为便于有计划地调整工商业    中南区开始工商业登记工作    全区争取月底前大部登记完毕,1950-06-10,1950-06
民主建国会号召全国会员    踊跃捐款救济失业工人,1950-06-10,1950-06
今年战胜洪水已有基本保证    全国治河春修工程大部完成,1950-06-10,1950-06
春修工程中存在缺点    缺乏系统调查研究和计划性    急应在继续春修和防汛工作中纠正,1950-06-10,1950-06
地方干部官僚主义  保管干部不负责任    山西各地存粮损耗严重    经过两月普查情况已有改进,1950-06-10,1950-06
河南治颍工程大部完成    以工代赈三十万灾民度过春荒,1950-06-10,1950-06
中央农业水利视察团抵南昌,1950-06-10,1950-06
林南仓供销分社晒粮不及时    霉坏玉米四万余斤    分社主任已作检讨并自请处分,1950-06-10,1950-06
上海粮食保管的新式设备    上海粮食公司第一仓库参观记,1950-06-10,1950-06
兰州地区喜雨,1950-06-10,1950-06
塘大渔区渔产丰收,1950-06-10,1950-06
高里国营农场旱地播稻成功,1950-06-10,1950-06
唐山保险公司业务逐月开展,1950-06-10,1950-06
华北酒专卖工作四月有显著改进,1950-06-10,1950-06
宛平将发存粮,1950-06-10,1950-06
天津专区清理贷粮五万灾民获得救济,1950-06-10,1950-06
盂县等地遭雹灾  准备补种晚作物,1950-06-10,1950-06
适应建设需要加速培养专材    交大清华开办专修科,1950-06-10,1950-06
天津专区团员带头战胜灾荒,1950-06-10,1950-06
京郊小麦即将成熟    各村积极准备收割    郊委会正动员农民进行田间选种,1950-06-10,1950-06
登记介绍失业技术员工    市劳动局今日起办理,1950-06-10,1950-06
第四卫生所成立,1950-06-10,1950-06
一贯道头子特务分子残害人民的血腥事实,1950-06-10,1950-06
青年交谊厅今日开幕,1950-06-10,1950-06
第二文化馆举行妇女婚姻讲座会,1950-06-10,1950-06
东北新型的医学教育,1950-06-10,1950-06
农大师生下田选种,1950-06-10,1950-06
中南军区及四野普遍开展建团工作    在三百多个连队中试验建团，已吸收团员三万七千余人,1950-06-10,1950-06
解决群众最迫切的问题    记七区各界人民代表会议,1950-06-10,1950-06
石家庄风行纸烟厂支部保证试行定额管理,1950-06-10,1950-06
促进国家统一纪念解放五周年    朝鲜祖国战线发出号召	建议召开民主党派协商会议	定期举行总选实现和平统一,1950-06-10,1950-06
美帝导演南朝鲜伪选结束    伪“国会”完全由民族叛徒把持,1950-06-10,1950-06
声援被迫害的反法西斯战士    纽约数千人举行大会    演说者一致谴责“非美活动委会”,1950-06-10,1950-06
联合国欧洲经济委员会开会    苏建议发展东西欧贸易    并斥马歇尔计划使西欧经济恶化,1950-06-10,1950-06
联合起来打垮叫嚣战争的力量    加青年致函世界民主青年    美劳动青年向我青年致敬,1950-06-10,1950-06
“反匪月”遭受彻底失败后    英帝在马来亚发动新攻势,1950-06-10,1950-06
苏联文化简讯,1950-06-10,1950-06
劳动报专文评论    美经济军国主义化    证明美国资本主义的继续衰落,1950-06-10,1950-06
美帝拟在比京    设“冷战”中心,1950-06-10,1950-06
美对瑞典强施压力    逼迫加入侵略集团,1950-06-10,1950-06
人民民主国家在苏联的援助下正胜利地为社会主义奠定基础    真理报论人民民主国家经济发展要素,1950-06-10,1950-06
“黄松岭的火灾”,1950-06-10,1950-06
武安县八区区委赵锡亚非法阻挠离婚拷打妇女,1950-06-10,1950-06
完县五区村支书任玉龙帮助地主抽夺农民土地    县政府已予扣押将依法惩处,1950-06-10,1950-06
察南军区司令员唐家礼打骂警察应作公开检讨,1950-06-10,1950-06
战士抢救放羊娃,1950-06-10,1950-06
坚持七年半的平顺西沟李顺达互助组  向毛主席报告致富经过    听毛主席的话组织起来走对了路  穷沟变成富沟·生产已超过战前,1950-06-11,1950-06
赖伊向联合国会员国建议  解决我国代表权问题    艾奇逊对赖伊建议发表虚伪声明,1950-06-11,1950-06
人民政协全国委员会二次会议即将开会	毛主席欢宴特别邀请人士等中央人民政府	及人民政协全委会各副主席委员作陪,1950-06-11,1950-06
物价由落转趋平稳  武汉市场情况好转,1950-06-11,1950-06
纺织工业部召开毛麻纺织会议  讨论毛麻工业生产问题	棉毛麻等业机物料会议亦揭幕,1950-06-11,1950-06
杭州市场转趋活跃  城乡物资交流日畅,1950-06-11,1950-06
解决手工业工人失业的有效办法  武汉组织生产合作社    并成立四个联营加工厂,1950-06-11,1950-06
中央贸易部发布  接收机关部队商业办法,1950-06-11,1950-06
中国土产公司  开始调剂国内土产,1950-06-11,1950-06
国营专业公司主动掌握市场  全国物价稳定交易活跃    日用必需品的成交量增加，真实购买力已在逐渐增长。,1950-06-11,1950-06
为物价完全稳定而努力,1950-06-11,1950-06
物价稳定人民币赶不上需要    河南部分地区又流通银元    省财委会决定组织人民币下乡,1950-06-11,1950-06
有计划地推动物资交流    平原省布置收购新麦    欢迎私商以合理价格进行采购,1950-06-11,1950-06
戚墅堰、青岛两电厂    挑起省煤省电竞赛,1950-06-11,1950-06
中南军区暨四野各部    积极进行水利建设    争取夏汛前完成治水任务,1950-06-11,1950-06
东北人民政府组织慰劳团    慰问四野回东北生产部队,1950-06-11,1950-06
人民币信用日趋巩固    山西农民用货币交易    货币借贷与储蓄日益普遍,1950-06-11,1950-06
为迅速扩大人民币流通范围    察绥两省银行加强联系    确定以大同集宁为联系重点,1950-06-11,1950-06
干部对推行人民币认识不足    繁峙白洋暗市仍严重,1950-06-11,1950-06
全国现金管理成效显著    转账增加现金收付节省    国家银行大量资金可用于扶植生产,1950-06-11,1950-06
接运东北粗粮任务    原阳延津迅速完成    新乡专署通报各县表扬,1950-06-11,1950-06
国营吉林化学工厂    展开迎接“七一”生产竞赛    制磷、电石两场提前完成五月任务,1950-06-11,1950-06
红五月生产竞赛中	许多工厂超过任务	旅大远东灯泡工厂	提前完成半年任务,1950-06-11,1950-06
京市现金流通量减少    国家银行集中使用资金力量增强    银行与各机关尚须认真执行现金管理决定,1950-06-11,1950-06
苏家屯砂轮厂    金钢砂产量提高八倍,1950-06-11,1950-06
“挖的快，抬的欢，为了人民吃和穿！”    人民解放军驻冀东某部挖河记,1950-06-11,1950-06
中央人民政府劳动部通知各地    试行工厂卫生暂行条例草案    保护工人健康，提高工作效能！,1950-06-11,1950-06
四野前战车第三师政治部主任    牟永春同志病逝北京    军委总政组织部定十二日公祭,1950-06-11,1950-06
纠正若干地区人民代表会议的形式主义偏向    东北民政会议决定改进办法,1950-06-11,1950-06
湖南整编工作基本完成    新编制减少了一万余人，节省了财政支出，并提高了工作效率。,1950-06-11,1950-06
法院清理积案工作大部完成    共结债务、房屋、婚姻及刑事案件三千余件,1950-06-11,1950-06
吸收工农子弟及工农干部入校学习    京市将增设三所中学    并扩充高工、高商等校班次,1950-06-11,1950-06
学校卫生委员会    积极推动学校卫生工作,1950-06-11,1950-06
适用婚姻法解决婚姻案件的实例    京市人民法院清理积案工作之一斑,1950-06-11,1950-06
大家出主意建设自己的第七区    记北京市第七区各界人民代表会议,1950-06-11,1950-06
京市工矿安全卫生委员会成立    调查研究各工矿安全卫生设备提供改进意见,1950-06-11,1950-06
官僚主义作风的教训,1950-06-11,1950-06
文教简讯,1950-06-11,1950-06
吉田政府正阴谋进一步迫害日共    全日民主人士深深愤慨    民族阵线工会号召组织总抗议罢工,1950-06-11,1950-06
为维护波茨坦宣言斗争到底	全日工联抗议迫害日共	并致函世界工联要求向联合国控诉	听涛克己等向日本反动政府提出抗议,1950-06-11,1950-06
美日反动派暴行层出不已    东京警察又逮捕工会领袖,1950-06-11,1950-06
劳动报论日本人民反法西斯斗争	指出：麦克阿瑟下令取缔日共中委的反动措施，	充分暴露了美帝对日本工人阶级组织的成长	及拥护和平运动的空前高涨所感到的恐惧。,1950-06-11,1950-06
消息报发表评论指出：    麦克阿瑟非法释放日战犯    反映美帝阴谋准备新战争,1950-06-11,1950-06
民革主席李济深发表谈话    斥麦克阿瑟迫害日共,1950-06-11,1950-06
英国各地人民    继续踊跃签名,1950-06-11,1950-06
美国宗教会议决议	要求终止对苏冷战,1950-06-11,1950-06
波德两国划定疆界    并签订经济与文化协定,1950-06-11,1950-06
越解放军上月出击获胜    三个地区内共歼敌千余名,1950-06-11,1950-06
美日反动派迫害日共    莫斯科各报表示愤慨,1950-06-11,1950-06
阳高县水利局工作不深入    盲目开渠造成很大浪费,1950-06-11,1950-06
朝鲜民主主义人民共和国学生给中国同学的信（摘要）,1950-06-11,1950-06
“海上风暴”锻炼了四十二位人民战士,1950-06-11,1950-06
代邮,1950-06-11,1950-06
攻击（木刻）,1950-06-11,1950-06
给高尔基的信,1950-06-11,1950-06
谈谈普及工作    为祝贺北京市文代大会而写,1950-06-11,1950-06
积极发展新文艺与大力改革旧文艺应密切结合起来,1950-06-11,1950-06
我参观了法西斯的杀人厂,1950-06-11,1950-06
莫斯科青年积极分子大会上  米哈依洛夫介绍新中国	指出中苏青年的会见是两国青年亲爱与友好的巨大示威,1950-06-12,1950-06
全国植棉计划超额完成  共已植棉五千二百二十八万亩    估计可产皮棉一千三百多万担,1950-06-12,1950-06
河北等省布置预防夏荒  号召注意长期生产自救,1950-06-12,1950-06
真理报载宋副主席论文  新中国经济情况的日趋稳定    是世界和平斗争的重要环节,1950-06-12,1950-06
内务部通知各地  总结生产救灾工作经验,1950-06-12,1950-06
中央团校第三期开学,1950-06-12,1950-06
本报原天津及东北各代销处来函反映  邮局挤顶代销处业务    要求纠正邮局“包办”发行偏向,1950-06-12,1950-06
邮电部朱学范部长发表谈话：  改进报纸发行工作反对关门主义倾向,1950-06-12,1950-06
山西平原等省部分地区遭受雹灾  政府领导群众积极补种抢救    及时解决群众种子困难并进行救济,1950-06-12,1950-06
预防新的灾荒,1950-06-12,1950-06
河北省衡水专区供销社  扶持灾区群众进行夏种,1950-06-12,1950-06
榆次等县雹灾袭击地区  秋苗补种改种完毕,1950-06-12,1950-06
北京邮政管理局企业管委会决定  大力扩展报纸发行    定六月份为报纸发行突击月  制订办法奖励工作积极员工,1950-06-12,1950-06
北京邮管局二十支局  发行人民日报的经验,1950-06-12,1950-06
上海私营华亚电线制造厂职工    制造高压电缆成功    向毛主席报告喜讯,1950-06-12,1950-06
天津中纺公司四厂工人刘云升改良油箱成功    机器用油减少了百分之九十四,1950-06-12,1950-06
中南区植棉超计划完成    全区棉田千余万亩可产皮棉二百万担    推广优种五十万亩  现正进行除虫工作,1950-06-12,1950-06
鸡泽棉苗普锄二遍    元氏北褚等村和滨县农场    用移植办法补齐棉田缺苗,1950-06-12,1950-06
迅速扑灭棉蚜！    河北五十九县部分棉田发生棉蚜    应注意及时除治以防发展成灾,1950-06-12,1950-06
河北良棉推广超过任务    播种优种棉八十五万亩    作到保种保收夏季工作以治虫为主,1950-06-12,1950-06
安平县治蚜重点村敬思村    配制治蚜药剂成功    经过试验证明杀虫效力很大,1950-06-12,1950-06
保定中小型工业联营    电料行联营后营业情况好转,1950-06-12,1950-06
改进业务创造推销方式    天津五月销煤超额完成,1950-06-12,1950-06
人民银行西萧墙办事处    存放业务平衡发展    大部贷款用于扶植私营企业,1950-06-12,1950-06
防水简讯,1950-06-12,1950-06
人民银行邯郸办事处    贷款扶植工商业    支持收购土产推动货币下乡,1950-06-12,1950-06
金融简讯,1950-06-12,1950-06
铁路简讯,1950-06-12,1950-06
国营阳泉煤矿反把头运动胜利结束    建立起新的三级制生产组织    三百多工人提升到领导地位,1950-06-12,1950-06
国营焦作煤矿    彻底摧毁把头制度    职工自动发起生产竞赛  并开始提出合理化建议,1950-06-12,1950-06
国营井陉煤矿检举把头分子,1950-06-12,1950-06
华北国营煤矿反把头运动经验,1950-06-12,1950-06
华北某师图书馆下连队,1950-06-12,1950-06
生产中开展文化活动提高生产效率增进民族团结,1950-06-12,1950-06
西南军区积极准备    开展全军大规模文教工作	文化程度很低及不识字的干部和战士	争取在三年半内达到高小或初中程度,1950-06-12,1950-06
零售公司调整经营范围    全部撤销各处部兼营的百货杂货业务    决定在每一行政区只设立一个营业处,1950-06-12,1950-06
物价平稳真实购买力上升  京市场交易日趋活跃    五月份开业户增加歇业减少,1950-06-12,1950-06
三区将召开人民代表会议    筹委工作开始进行,1950-06-12,1950-06
接受国营公司委托加工积极适应市场需要    私营工业产销情况好转    织染等十二行业五月份产销量均较上月增加,1950-06-12,1950-06
简讯,1950-06-12,1950-06
学校生产简讯,1950-06-12,1950-06
适用婚姻法解决婚姻案件的实例（续昨）    市人民法院清理积案工作之一斑,1950-06-12,1950-06
争取两年里全军战士达到高小毕业程度      东北军区订出具体学习办法    今年九月全军教育转入以文化为主  师团各级领导机关普遍设文化学校,1950-06-12,1950-06
东北军区各部队五个月来的文化学习,1950-06-12,1950-06
各地简讯,1950-06-12,1950-06
县委存在官僚主义作风  区村干部犯了强迫命令错误    河北成安县打井工作发生偏向    县委接受河北日报批评进行检查纠正,1950-06-12,1950-06
站在保卫和平斗争的最前列    西欧拒运军火运动扩展    美国军火船驶来驶去找不到码头工人,1950-06-12,1950-06
意展开和平签名运动    许多地方全部成年人参加签名    奥以两国各地普设和平委员会,1950-06-12,1950-06
苏向美英法等国提备忘录    解决南极洲管治权    不能没有苏联参加,1950-06-12,1950-06
旅越欧非十七国军人成立保卫和平者协会    号召法军中欧非人反对侵略战争,1950-06-12,1950-06
法人道报评美英在舒曼计划上的矛盾    舒曼有美国务院撑腰  英政府试图抗拒拖延,1950-06-12,1950-06
加强保卫和平的宣传工作    我国和平签名运动深入开展,1950-06-12,1950-06
本报收到和平签名已达五十四万余人,1950-06-12,1950-06
麦克阿瑟指使日反动政府    大肆搜捕日共及工会领袖    并禁止各报刊载日共领袖政治论文,1950-06-12,1950-06
舒曼提出“法德联营煤钢”计划    英与美法间矛盾尖锐化      美帝对英压力日益增加,1950-06-12,1950-06
写给敬爱的毛主席    武清县各界人民代表报告生产救灾工作,1950-06-12,1950-06
宁夏省民政厅副厅长白玉光    殴打群众损害党政威信    宁夏省府省委已予处分,1950-06-12,1950-06
南疆某部生产记    人说西北太荒凉  不知西北有宝藏    劳动能够翻天地  西北定会变天堂,1950-06-12,1950-06
区供销社业务员贪污    赵县县社决予处分,1950-06-12,1950-06
贯彻“谁种谁收”政策,1950-06-12,1950-06
为法国的民族独立与和平而斗争    一九五零年四月在法国共产党第十二次代表大会上的报告,1950-06-12,1950-06
资本主义制度下的科学在衰落,1950-06-12,1950-06
中共中央举行三中全会  全会一致同意毛主席报告,1950-06-13,1950-06
中共中央发表声明  斥责麦克阿瑟和吉田政府非法暴行    号召全国人民声援日共和日本人民,1950-06-13,1950-06
全国总工会等五大团体发表声明  支援日本人民的正义斗争,1950-06-13,1950-06
日政府企图进一步压制日共  吉田等连日来与麦克阿瑟密谋    日警继续搜捕工会及日共领袖,1950-06-13,1950-06
海口定海两市人民集会  欢庆海南岛及舟山解放,1950-06-13,1950-06
我与印尼建立外交关系  任命王任叔为驻印尼大使,1950-06-13,1950-06
为争取国家财政经济状况的基本好转而斗争    （六月六日在中国共产党第七届第三次中央全体会议上的报告）,1950-06-13,1950-06
全国铁路清仓工作顺利完成    发现大批目前急需而市场缺乏的物资    为今年材料供应计划提供了有力保证,1950-06-13,1950-06
黄河水利委员会仓库清理完毕    决定今后每半月检查仓库一次,1950-06-13,1950-06
华北查出大量账外物资    部分仓库有账无物或存积变质物品,1950-06-13,1950-06
人民银行天津分行上月贷款三百亿    扶助私营工商业,1950-06-13,1950-06
中共岚县县委及武乡一区区委    领导群众战胜冻灾    沁源城关等九村燃火防霜收效很大,1950-06-13,1950-06
中国银行大力扶植出口    四个月贷款七千五百亿    贯彻公私兼顾私营贷款比例较大,1950-06-13,1950-06
天津中国银行继续扶植出口    五月份贷款千余亿元,1950-06-13,1950-06
人民银行张市各行处    贷款扶植私营皮毛业,1950-06-13,1950-06
沪四家公私合营银行    贷款扶助私营工商业    五月底四行贷款余额达千余亿,1950-06-13,1950-06
唐山电业局、发电厂    提前完成半年生产任务    创全月平均煤耗零点五七七公斤新纪录,1950-06-13,1950-06
唐山发电厂怎样创造煤耗新纪录,1950-06-13,1950-06
工作研究    银行的结算制度    如何贯彻到工厂矿山中去？,1950-06-13,1950-06
“人定胜天”    ——记武乡二区战胜雹灾,1950-06-13,1950-06
简讯,1950-06-13,1950-06
集中资金，改进生产！    同顺等十四家大车及手车业    组织联营打开销路,1950-06-13,1950-06
联营商号第一家    介绍联营三信成玻璃庄,1950-06-13,1950-06
市文联开会    欢迎梅兰芳,1950-06-13,1950-06
切卡诺夫今讲演	纪念斯维尔德洛夫	明天举行奥斯特洛夫斯基逝世六十四周年纪念会,1950-06-13,1950-06
六七两区女代表    参加市妇联联欢,1950-06-13,1950-06
学校简讯,1950-06-13,1950-06
遵守交通秩序，防止车祸！,1950-06-13,1950-06
人民的监察的工作,1950-06-13,1950-06
黑龙江省合作总社    检查官僚主义贪污浪费    发现七县合作社损失十二亿余元  指示各社加强民主管理健全制度,1950-06-13,1950-06
文教简讯,1950-06-13,1950-06
虐杀已离婚的妻子    建屏梁方生被处死刑,1950-06-13,1950-06
石家庄专区专员公署决定    处分阻碍婚姻自由的干部    藁城县法院院长李策德记大过一次,1950-06-13,1950-06
共产党员和水银整流器,1950-06-13,1950-06
波兰驻我国大使布尔金向毛主席呈递国书,1950-06-13,1950-06
瑞典驻我国大使阿马斯顿向毛主席呈递国书,1950-06-13,1950-06
阿马斯顿传略,1950-06-13,1950-06
实现和平愿望排除战争威胁    奥国拥护和平大会开幕    考克号召爱好和平的人不要贻误时机,1950-06-13,1950-06
为征集五百万和平签名而奋斗    纽约和平宣传站开会    罗伯逊指出：“要强使战贩接受和平！”,1950-06-13,1950-06
捷青联举行代表大会    通过新盟章选出中央委会,1950-06-13,1950-06
英工人日报号召英国人民    反对英政府进行殖民战争,1950-06-13,1950-06
英共号召群众广泛动员    要求从马来亚撤回军队    英参谋总长史陵抵东南亚活动,1950-06-13,1950-06
真理报社论号召    扩大和平运动规模    二届和大以前要增加亿万人民签名,1950-06-13,1950-06
节省行政费用便利大规模使用机器    苏展开集体农场合并运动    新的高尔基农场农民收成可增加二倍,1950-06-13,1950-06
适应人民购买力的提高    保宣布改进贸易措施法令    自由市场面包价格减低四分之一,1950-06-13,1950-06
写给亲爱的毛主席    苏北泗阳县灾民报告生产自救情况,1950-06-13,1950-06
模范团员匡莲英,1950-06-13,1950-06
还要我们推销人民日报吗？,1950-06-13,1950-06
大同矿务局印刷厂崔士奇    贪污公款七百余万    已送法院依法惩办,1950-06-13,1950-06
荣华无理要求离婚    女方不同意竟遭痛殴,1950-06-13,1950-06
群众砍树区公所不制止    迁安四区林地损失严重,1950-06-13,1950-06
代邮,1950-06-13,1950-06
参观苏联纺织工厂幼儿院    ——访苏日记之一,1950-06-13,1950-06
中西医团结与中医的进修问题    五月三十日在北京市中医学会成立会讲,1950-06-13,1950-06
集团Ｘ光照相对于防治肺结核的贡献,1950-06-13,1950-06
北京市人民政府布告	府秘字  第五号,1950-06-13,1950-06
中央人民政府内务部通告,1950-06-13,1950-06
北京市人民政府劳动局通告	劳五字第五号,1950-06-13,1950-06
中国科学院通告,1950-06-13,1950-06
故宫博物院景山开放通告,1950-06-13,1950-06
首届全国高等教育会议闭幕  高等教育方针任务确定    通过高等学校暂行规程等五项草案,1950-06-14,1950-06
马叙伦部长致闭幕词,1950-06-14,1950-06
黄镇任驻匈大使  匈驻我国公使升任大使,1950-06-14,1950-06
民盟、民建和致公党发言人  斥麦克阿瑟迫害日共,1950-06-14,1950-06
美日反动派继续横施暴行  非法逮捕日共党员,1950-06-14,1950-06
国际和平奖金、斯大林和平奖金  中国作品征集评选委员会组成,1950-06-14,1950-06
华北十七个高等学校  组成联合招生委员会    招生地区、考试科目及日期确定,1950-06-14,1950-06
教育部马叙伦部长  在全国高等教育会议上的开幕词,1950-06-14,1950-06
深入检查官僚主义作风    济南站成立管委会,1950-06-14,1950-06
铲除铁路系统中的官僚主义作风    西安铁路分局官僚主义的恶果    莲花寺石场连续发生事件  浪费国家资财毁坏农民青苗,1950-06-14,1950-06
归绥办事处    开展反官僚主义斗争,1950-06-14,1950-06
天津铁路局    严格批评官僚主义    改选并重建管理委员会,1950-06-14,1950-06
西安铁路分局的官僚主义    ——莲花寺石场事件的根本原因,1950-06-14,1950-06
广东中山县忽视粮食保管    损失公粮达百万斤    县府和粮食局已作检讨,1950-06-14,1950-06
山西永虞县不重视公粮保管    粮食局应严格检讨,1950-06-14,1950-06
帮助农民度过青黄不接    安国县积极贷换粗粮,1950-06-14,1950-06
算细账了解夏荒严重    宿县营子村订生产计划,1950-06-14,1950-06
备荒简讯,1950-06-14,1950-06
简讯,1950-06-14,1950-06
开始好转的武汉工商业,1950-06-14,1950-06
举办各种有益青年的暑期活动    青年暑期生活委员会成立,1950-06-14,1950-06
平原民校学员增至三十万人    部分民校结合学习研究生产,1950-06-14,1950-06
“争取持久和平，争取人民民主！”    中文版第三十五期介绍,1950-06-14,1950-06
内蒙自治区锡林郭勒盟    参观团抵达首都          民族事务委员会设宴欢迎,1950-06-14,1950-06
宁夏举行教育会议    决定增设回民学校,1950-06-14,1950-06
雨季来临预防存粮霉坏    北京粮食公司积极盘点仓库,1950-06-14,1950-06
京西煤矿等单位    疏于雨前防范工作    国家资财遭受损失,1950-06-14,1950-06
新建化学制药厂    职工抢救雨险    仓房转危为安,1950-06-14,1950-06
新建玻璃厂厂长和工人试制天线绝缘子和玻璃油眼成功    工人阶级智慧无穷！,1950-06-14,1950-06
七十兵工厂车工刘式杰    改进旋“卡盘爪”的盘刀,1950-06-14,1950-06
解决劳动人民聚居区域积水问题    泡子河等处新建下水道,1950-06-14,1950-06
为扶植私立中小学发展    文教局公布经费补助办法    合乎条件之中小学即可申请,1950-06-14,1950-06
简讯,1950-06-14,1950-06
补正,1950-06-14,1950-06
学校卫生委员会    检查一九两区小学生健康,1950-06-14,1950-06
各级领导干部重视农民教育    涉县各村普遍建立民校,1950-06-14,1950-06
北京市人民政府中共各支部    学习文件检查工作    党群关系初步改善,1950-06-14,1950-06
苏南建业余学校百三十处    万余干部工人参加学习      去冬廿五万农民入冬学,1950-06-14,1950-06
文化教育简讯,1950-06-14,1950-06
在每一个城市乡村工厂街道家庭中征集签名！    国际民主妇联号召全世界妇女    积极以具体行动保卫世界和平,1950-06-14,1950-06
全国妇联通知各地妇联    发动妇女参加和平签名      广泛深入宣传教育并定期汇报签名情况,1950-06-14,1950-06
美共号召全国人民扩展争取和平运动    指出：和平定能战胜战争,1950-06-14,1950-06
传达和大决议    白芸启程赴穗,1950-06-14,1950-06
苏联第三届最高苏维埃首次会议揭幕    联盟院举行第一次会议,1950-06-14,1950-06
柬埔寨成立民族统一阵线    民族解放委员会同时组成,1950-06-14,1950-06
