阿尔巴尼亚军事法庭    枪决三名美国间谍,1950-06-14,1950-06
美国军人在日本,1950-06-14,1950-06
模范团员孙绪亭,1950-06-14,1950-06
南昌机务段工人徐坤耀半年内连续发明三种机器,1950-06-14,1950-06
大连第七完小同学给汉口小朋友的一封信,1950-06-14,1950-06
卫生所玩忽工人生命    唐山启新洋灰厂工人来信申诉,1950-06-14,1950-06
上海冷铸厂副厂长迟金龙    包庇贪污非法扣人,1950-06-14,1950-06
“五一节”    —访苏日记之二,1950-06-14,1950-06
编辑文件性著作要认真,1950-06-14,1950-06
推荐一批通俗读物,1950-06-14,1950-06
略谈“新华时事丛刊”,1950-06-14,1950-06
通俗科学杂志的新道路    ——介绍“科学技术通讯”,1950-06-14,1950-06
多读几遍加里宁的报告,1950-06-14,1950-06
关于“北望楼杂文”,1950-06-14,1950-06
中国人民政协全国委员会  第二次会议昨开幕    毛主席致开会辞指出土地改革为中心议题    昨日会议听取陈叔通报告会务、刘少奇报告土地改革问题,1950-06-15,1950-06
会议出席人名单,1950-06-15,1950-06
特邀列席人士名单,1950-06-15,1950-06
地方协商委员会  推派代表列席名单,1950-06-15,1950-06
中捷签订贸易协定  根据协定我国将输出各种原料    捷克将输出各种工业器材,1950-06-15,1950-06
内务部指示继续防荒,1950-06-15,1950-06
北京郊区土地改革后  大生产运动热烈展开    市府已贷小米三百余万斤,1950-06-15,1950-06
河南已经分配土地地区  农村出现生产运动高潮    农民紧张进行夏收，农具出售很快。,1950-06-15,1950-06
监察委员会六次会议  刘景范报告半年工作总结及今后任务    下半年将配合整训干部进行监督检查,1950-06-15,1950-06
“中国青年”短评  做好暑假工作,1950-06-15,1950-06
华北各厂矿加强民主管理    通过工代会和管委会解决生产问题和群众要求    依靠工人管好工厂,1950-06-15,1950-06
华北城乡交流趋旺盛    收购农副业产品扶助农民灾民	工业品大量下乡销路渐畅	城乡互助，发展生产！,1950-06-15,1950-06
主要农产品和土产开始上市	皖南城乡交流活跃	工商业情况亦随之逐步好转	城乡到助，发展生产！,1950-06-15,1950-06
湘鄂豫诸省收购土产输出    武汉土产市场活跃,1950-06-15,1950-06
新疆国营贸易公司    大力收购各民族土产    农、牧民家庭收入提高一半,1950-06-15,1950-06
沈阳冶炼厂贯彻工厂民主管理    生产呈现日新月异的新气象,1950-06-15,1950-06
如何贯彻管理民主化？    东北日报六月九日社论摘要,1950-06-15,1950-06
渝豫丰纱厂展开民主运动    严格批评领导干部官僚主义，加强了干部与群众的团结。,1950-06-15,1950-06
重点开办水利灌溉事业    芦台电化水利站告成    划分七个水利区可灌溉土地三万亩,1950-06-15,1950-06
电化了的芦台镇,1950-06-15,1950-06
中南区百货公司改进业务    配合收购组织货物下乡    上月全区销货百六十余亿,1950-06-15,1950-06
简讯,1950-06-15,1950-06
华东订定防治地方病计划拨经费九十余亿防治黑热病住血吸虫病等  福建普遍推行防疫注射及种痘,1950-06-15,1950-06
人民解放军第三及第四野战军    普遍开展夏季卫生防疫运动    积极改善伙食，注射疫苗，改善环境卫生。,1950-06-15,1950-06
新乡专区防治传染病    通过各县人代会等展开卫生宣传    组织小学教员妇女干部协助种痘,1950-06-15,1950-06
江西防治牛病    七千耕牛免疫,1950-06-15,1950-06
为加强工作计划性健全保管制度打下基础    京各专业公司盘点资财    查出部分单位仓库存有不在账的物品和会计账目不清的现象,1950-06-15,1950-06
辅华火药厂发生爆炸    附近居民损失严重正予紧急救治    市政机关已作检讨并查究原因,1950-06-15,1950-06
张友渔副市长应工商联合会邀请    报告调整工商业问题,1950-06-15,1950-06
人民法院审慎处理房屋纠纷    一年来结案二千余件,1950-06-15,1950-06
十六万牲畜注射防疫针    绥远牛瘟基本扑灭,1950-06-15,1950-06
防疫简讯,1950-06-15,1950-06
两点经验教训：    卫生宣传必须结合生产    农村医生亟待团结改造,1950-06-15,1950-06
在一个大家庭里    石景山发电厂支部团结了工人和职员,1950-06-15,1950-06
斯大林接见芬总理,1950-06-15,1950-06
苏三届最高苏维埃两院联席会议开幕    民族院举行第一次会议,1950-06-15,1950-06
日本工人纷纷举行罢工    抗议对日共的非法镇压,1950-06-15,1950-06
日本民主民族战线筹委会	致麦克阿瑟公开信	斥美宪及日警侵犯民主肆行逮捕	并主张立即释放被捕八名爱国者,1950-06-15,1950-06
中华全国文联发表声明    抗议麦克阿瑟非法暴行,1950-06-15,1950-06
真理报社论指出    苏联民主是坚强的，它具有浓厚的、无所不包的人民性。,1950-06-15,1950-06
美帝在日本的非法措施    并不能削弱人民的力量    美英反动报纸为美帝占领前途担忧,1950-06-15,1950-06
中德间开放无线电通信    两国邮电部部长互电致贺,1950-06-15,1950-06
朝鲜人民拥护和平统一号召    北部工厂学校集会宣誓将坚决斗争    美帝走狗李承晚卖国集团极为震惊,1950-06-15,1950-06
李承晚匪帮非法拘捕祖国战线代表    全朝人民表示愤慨与憎恨    大力展开营救被捕代表运动,1950-06-15,1950-06
南北朝鲜的鲜明对照    北部人民正纷纷迁入新居    南部五十余万人流离失所,1950-06-15,1950-06
印度政府迫害工农领袖    英进步人士严正抗议    普里特将赴印度为农民领袖辩护,1950-06-15,1950-06
模范教师王志亭,1950-06-15,1950-06
集宁一个移民小组    指责村长妨碍生产,1950-06-15,1950-06
安次县民工队的光荣    修竣京津护路堤涌现大批模范,1950-06-15,1950-06
代邮,1950-06-15,1950-06
简讯,1950-06-15,1950-06
苏联泽必诺七年级学校学生    给中国学生的信,1950-06-15,1950-06
参观列宁格勒皮鞋工厂    ——访苏日记之三,1950-06-15,1950-06
“福利国家”抑是战争国家？    ——杜鲁门统治下的美国,1950-06-15,1950-06
贝文外交的实质,1950-06-15,1950-06
波兰的经济成就和展望,1950-06-15,1950-06
人民政协全国委员会二次会议第二日  陈云薄一波报告财经工作    上午曾分组讨论土地改革问题,1950-06-16,1950-06
毛主席在三中全会的报告  苏京三报全文刊载,1950-06-16,1950-06
重工业部指示华北窑业公司  警惕官僚主义作风  记取教训再求改进,1950-06-16,1950-06
重工业部通令全国国营厂矿  吸取琉璃河水泥厂经验,1950-06-16,1950-06
平原麦收大部完成  全省平均七成年景,1950-06-16,1950-06
万山群岛我军继续前进  解放白沥大小万山等岛,1950-06-16,1950-06
上海市国营贸易公司  调整零售与批发价格,1950-06-16,1950-06
保证麦价稳定  促进城乡交流  贸易部发布购麦指示    购麦计划亦已制定七月份起陆续收购,1950-06-16,1950-06
改变官僚主义领导的重大成就    琉璃河水泥厂红五月生产创建厂以来最高纪录    重工业部及京市总工会勉励全体职工,1950-06-16,1950-06
京郊开始麦收  旱地每亩可打八斗  国营农场使用机器收割,1950-06-16,1950-06
保证麦价稳定  促进城乡交流  预防下乡货币突然冲进城市	影响物价  国营专业公司将联合私商  把大量工业品运到农村去,1950-06-16,1950-06
“武装的人民反对武装的反革命”	是不是中国革命独具的特点？,1950-06-16,1950-06
人民解放军是国防军也是生产军    西北军区暨一野部队	耕种农田百万亩	重视水利灌溉普遍精耕细作	天宝段工程已完成百万土石方,1950-06-16,1950-06
绥远毛绒药材输出增加    包头市场活跃皮毛店加多,1950-06-16,1950-06
华北某兵团经营渤海碱滩      垦植水田旱地近千顷,1950-06-16,1950-06
加强调查工作积极开展业务    各地土产公司交流土产,1950-06-16,1950-06
石家庄市农民服务所    热诚协助农民进城购销    五个月购销货物值二十六亿元,1950-06-16,1950-06
屯溪农民服务所业务发展  十个月住所农民近两万人,1950-06-16,1950-06
物价平稳出口商有利可图    青市土产出口逐月增加    全市百余出口商接近全部复业,1950-06-16,1950-06
津农民服务社办理代购代销    农民三个月中节省两千余万元,1950-06-16,1950-06
人们开始过着安定的日子	——物价稳定下的长沙,1950-06-16,1950-06
合作社简讯    安国供销社解决农民困难,1950-06-16,1950-06
合作社简讯    乐亭合作社    帮助群众生产度荒,1950-06-16,1950-06
六百里生产战线上,1950-06-16,1950-06
北京区各邮局收寄苏联包裹,1950-06-16,1950-06
工厂卫生暂行条例草案,1950-06-16,1950-06
加强翻译工作者的联系    “翻译通报”即将出版,1950-06-16,1950-06
上海英文报纸《上海新闻》出版,1950-06-16,1950-06
京郊二十区街、村党员干部    会议多兼职多影响生产    中共京郊二十区区委会已定出解决办法,1950-06-16,1950-06
青年团员带头做出成绩    榆树庄农民纷纷成立互助组,1950-06-16,1950-06
学校生产已有盈余    个别学校生产经营不善形成停顿,1950-06-16,1950-06
市人民政府举行紧急会议    积极办理爆炸事件善后    治疗救济殓尸等工作妥善进行中,1950-06-16,1950-06
市府市委等单位    慰问受灾市民,1950-06-16,1950-06
因爆炸受伤者受到妥善治疗,1950-06-16,1950-06
简讯,1950-06-16,1950-06
京郊国营农场	积极防治棉蚜	用烟叶石灰水杀虫很有效,1950-06-16,1950-06
翻身农民董金水,1950-06-16,1950-06
还要进一步努力	“鞍钢”党组织团结技术人员与职员的经验教训,1950-06-16,1950-06
最高苏维埃两院联席会上	苏联财长报告国家预算	保证发展国民经济增进劳动人民福利指拨必需款项	巩固国防保卫和平劳动,1950-06-16,1950-06
苏联报纸评国家预算    财长预算执行的报告，证明社会主义祖国力量强有力的高涨。,1950-06-16,1950-06
粉碎帝国主义罪恶阴谋    捷判处十三名叛国犯,1950-06-16,1950-06
苏联生物学者重要发现细胞能从非细胞体发生    对于医学及农学有巨大贡献,1950-06-16,1950-06
法和平签名运动扩展    伊弗里等地市民几乎全部参加    柏林抗议美政府迫害美共领袖,1950-06-16,1950-06
消息报观察家    评美帝“联防援欧计划”    杜鲁门图以军备竞赛缓和经济危机为华尔街的大亨寻求数十亿新利润,1950-06-16,1950-06
朝鲜南部爱国学生拥护祖国战线号召    大邱市女中举行反美罢课,1950-06-16,1950-06
反对美帝毁灭希腊人民的罪行    雅典成立地下和委会    向全国人民呼吁参加和平签名,1950-06-16,1950-06
西德美国士兵签名拥护和平,1950-06-16,1950-06
美帝侵越计划执行人	布鲁姆抵西贡,1950-06-16,1950-06
本报收到和平签名已达六十一万余人,1950-06-16,1950-06
越举行政府委员会    武元甲报告军事形势,1950-06-16,1950-06
中国民主促进会主席    马叙伦发表谈话    斥麦克阿瑟迫害日共,1950-06-16,1950-06
东京“读卖新闻”透露    日政府阴谋宣布日共为“非法”    全日学联决定期罢课抗议迫害日共,1950-06-16,1950-06
日共党员又有三人被捕,1950-06-16,1950-06
日学生拥护和平运动竟遭美日反动派制止	“你听，海洋在呼唤”影片预演被禁,1950-06-16,1950-06
石家庄军分区某部副连长王福芝    吊打妇女强迫离婚    该军分区党委会已予处分,1950-06-16,1950-06
周文焕妻失踪事件与邯郸镇政府无关	邯郸政府与邯郸中学来信声明,1950-06-16,1950-06
中国人民大学学生    写给东京大学学生的一封信,1950-06-16,1950-06
黄梅一区书贪污舞弊黄冈地委给予处分,1950-06-16,1950-06
尚德兴管理仓库有方    百万斤公粮未受损失    建屏县政府予以表扬,1950-06-16,1950-06
口袋给糖果装满了    ——访苏日记之四,1950-06-16,1950-06
工业中的公私兼顾和产销平衡问题,1950-06-16,1950-06
国营贸易对私营企业的扶植,1950-06-16,1950-06
北京市人民政府税务局通告    京税会字第二三八三号  一九五○年六月十六日,1950-06-16,1950-06
北京市人民政府税务局通告      京税地字第二二九○号  一九五○年六月十日,1950-06-16,1950-06
人民政协第一届全国委员会二次会议第三日  周恩来总理作政治报告    军委代总参谋长聂荣臻作军事报告,1950-06-17,1950-06
各地私营工商业力争好转  逐步改善经营维持生产    面向广大劳动人民  调整不合理的薪资    缩减机构减低成本  组织联营集中力量,1950-06-17,1950-06
德驻华外交使团抵京,1950-06-17,1950-06
丹麦驻华公使穆克抵京,1950-06-17,1950-06
昨为瑞典国庆日  周总理致电庆贺  瑞典驻华大使举行招待会,1950-06-17,1950-06
粤汉路汨罗站发生列车分离冲突事故  监察委员会处分失职人员,1950-06-17,1950-06
世界学生二次代表大会定八月举行  全国学联决选派代表参加,1950-06-17,1950-06
香港澳门工商界东北参观团抵沈,1950-06-17,1950-06
热烈拥护保卫世界和平宣言  首都百万余人参加签名    各人民团体将继续深入征求市民签名,1950-06-17,1950-06
中共中南军区党委会等  号召党员和干部学习毛主席报告,1950-06-17,1950-06
京私营企业力求改进  部分工业厉行节约提高质量    商业改进营业方针面向人民,1950-06-17,1950-06
拖运破机车北上修理  砸伤钢轨约四千条	铁道部已责成有关部门检查,1950-06-17,1950-06
私营工商业应当力求改造,1950-06-17,1950-06
平原积极预防夏荒    大部灾民度过春荒,1950-06-17,1950-06
山东省春荒已基本度过    苍山继续与夏荒作斗争,1950-06-17,1950-06
东北区粮食公司拨粮帮助灾区农民    解决耕种夏锄中的食粮困难,1950-06-17,1950-06
中央人民政府劳动部制定    市劳动争议仲裁委员会组织及工作规则,1950-06-17,1950-06
从南到北从平原到山地小麦渐次成熟    华北农村全面进入麦忙时节    除部分受灾地区外收成一般都比去年好,1950-06-17,1950-06
贯彻“保安第一”的生产方针    国营焦作煤矿改善保安工作    五个月来伤亡率比去年减低四分之三,1950-06-17,1950-06
陕西同官煤矿    纠正忽视保安工作,1950-06-17,1950-06
河北省三百余私营煤矿    安全设备非常恶劣    各地政府及矿务局应严加检查,1950-06-17,1950-06
华东各地普遍割麦    麦收结束地区开始夏种,1950-06-17,1950-06
河南小麦大部丰收    积极组织互助做到割麦夏种两不误,1950-06-17,1950-06
宁乡私营清溪永利两矿    忽视安全连续发生事故,1950-06-17,1950-06
工矿简讯,1950-06-17,1950-06
国营企业进行有效扶植    唐山私营企业逐渐恢复    开滦启新华新产销均有显著进展,1950-06-17,1950-06
保定调整公私关系    私营行业经过扶植开始好转,1950-06-17,1950-06
前上海市贸易总公司盲目定货遭受损失,1950-06-17,1950-06
中南各地农民度过春荒    积极生产预防夏荒,1950-06-17,1950-06
湖南农民广泛组织起来    全省已有农协会员五百七十余万    首届全省农民代表会议决定积极准备秋后实行土地改革,1950-06-17,1950-06
“又种庄稼又念书，家家出了写字人”    华北农村文化生活逐步发展    表现出土地改革后的农村新气象,1950-06-17,1950-06
铁路工会文工队扩大组织    沿京山京汉两路演唱完毕    转赴津浦等线各站段活动,1950-06-17,1950-06
保护劳动果实防止偷窃破坏    京郊农民组织起来看麦,1950-06-17,1950-06
市人民政府为改进工作教育干部    成立作风纪律检查委员会    将以零售公司、合作社和行政处为重点开始检查,1950-06-17,1950-06
预防传染疾病保护人民健康    全市开展夏季卫生运动,1950-06-17,1950-06
在本市及受灾区人民政府协助下    八百灾民返回原籍生产,1950-06-17,1950-06
简讯,1950-06-17,1950-06
辅华爆炸事件善后委员会    决定三项救济灾民办法,1950-06-17,1950-06
特种工艺联合会    紧急救济爆炸受难会员    一区理发业工人慰问受炸灾民,1950-06-17,1950-06
土地改革后的京郊农村    十四区农民努力增产一成,1950-06-17,1950-06
“新曲艺实验流动小组”,1950-06-17,1950-06
各地简讯,1950-06-17,1950-06
团结起来，搞好生产！    天津私营达生纱厂中共支部保证实现劳资两利政策,1950-06-17,1950-06
动员起来，加紧夏收！,1950-06-17,1950-06
日共中央领导机关主席    椎野悦郎发表声明    决进一步团结人民争取民族独立指出吉田卖国内阁已到穷途末路,1950-06-17,1950-06
东京无限期禁止示威及集会    日共向吉田提严正抗议    麦克阿瑟指使日政府执行禁令,1950-06-17,1950-06
全世界人民支援日本人民反对美日反动派备战阴谋    “世界知识”社评斥美帝迫害日共,1950-06-17,1950-06
中国人民救济总会发表声明    声援日本人民斗争    反对美帝迫害日共领袖,1950-06-17,1950-06
美工会代表团访联合国总部    表达劳动群众的和平意志,1950-06-17,1950-06
美帝军用飞机不断飞临北极,1950-06-17,1950-06
利用印巴之间的冲突    美加紧控制克什米尔,1950-06-17,1950-06
如此杜鲁门式的“民主”！    美两位进步作家入狱,1950-06-17,1950-06
蒋匪帮勾结菲当局    阴谋大肆迫害华侨,1950-06-17,1950-06
曼谷二万余华侨菜农将遭泰政府强迫迁移    六十年辛苦经营竟被掠夺,1950-06-17,1950-06
南非联邦众议院通过种族隔离法    各族人民激烈反对,1950-06-17,1950-06
南非政府迫害进步人民议会初读通过反动法案,1950-06-17,1950-06
抗议马兰政府迫害南非共产党,1950-06-17,1950-06
写给敬爱的毛主席    克山、平东两县报告生产救灾工作,1950-06-17,1950-06
淮阴虞沟区张肄成霸占革命军人的妻子	哈尔滨医大张肄胜来信申诉,1950-06-17,1950-06
乡干部不注意团结中农  宝丰领导机关应加检查,1950-06-17,1950-06
他们战胜了桑乾河    邮工傅三海等模范事迹,1950-06-17,1950-06
和苏联斯达哈诺夫工作者谈话    ——访苏日记之五,1950-06-17,1950-06
出品免检的工作者    ——访苏日记之六,1950-06-17,1950-06
劳动改造  重作新人,1950-06-17,1950-06
人民政协第一届全国委员会二次会议第四日    郭沫若沈钧儒报告文教和法院工作,1950-06-18,1950-06
全国粮食调运接近完成  供应大城市工矿区及灾区足够的食粮    三月来粮价始终平稳投机商一蹶不振,1950-06-18,1950-06
人民政协全国委员会学习座谈会暂行办法,1950-06-18,1950-06
以东北粗粮换购关内小麦	一亿九千多万斤粗粮  已运抵河北平原各地,1950-06-18,1950-06
同蒲铁路北段  大同至朔县段工程修复,1950-06-18,1950-06
人民政协全国委员会常务委员会工作报告    （陈叔通六月十四日在人民政协全国委员会二次会议上报告）,1950-06-18,1950-06
各地青年和少年儿童  热烈参加和平签名运动,1950-06-18,1950-06
表示对中国人民领袖的崇敬	吉尔吉斯一座高山命名为毛泽东山峰,1950-06-18,1950-06
南京喜雨,1950-06-18,1950-06
贸易部指示各地  禁止毛肠出口硫磺进口,1950-06-18,1950-06
全国新闻工作者协会  抗议荷政府压迫华侨新闻工作者,1950-06-18,1950-06
中央人民政府邮电部邮政总局	对各地邮局接办发行工作的重要通知,1950-06-18,1950-06
百万民工翻山越岭积极运送  湖南全省完成余粮调运    开支运费支持了二百多万农民战胜灾荒,1950-06-18,1950-06
瞿秋白和农民  ——纪念秋白殉难十五周年,1950-06-18,1950-06
东北国营厂矿大部超过计划    卅二种主要产品完成或超过任务    五月生产喜讯,1950-06-18,1950-06
唐山竞赛深入开展    职工决以生产胜利迎接“七一”,1950-06-18,1950-06
南京若干公营企业    生产计划大部完成,1950-06-18,1950-06
中南区公营工矿企业    大部超额完成任务,1950-06-18,1950-06
江西国营矿山    钨锡煤生产超过任务    萍乡煤矿全月产煤两万吨,1950-06-18,1950-06
广东省工业厅    决检查工厂生产管理,1950-06-18,1950-06
华北物资交流渐活跃    各专业公司大量收购土产供应日用品,1950-06-18,1950-06
华北煤矿工会筹委会    召开工会组织会议,1950-06-18,1950-06
保护工人阶级的基本利益    工会要作好群众生产工作    ——记全国工会生产工作会议,1950-06-18,1950-06
沈阳市公私经济恢复与发展的三个阶段,1950-06-18,1950-06
县供销社存在恩赐观点    文安盲目收购副产品,1950-06-18,1950-06
江西省国家银行和国营企业    扶植南昌私营工商业,1950-06-18,1950-06
湖南大量收购夏茶    新化茶山规模已恢复战前水平,1950-06-18,1950-06
贸易简讯,1950-06-18,1950-06
各地选种简讯,1950-06-18,1950-06
物价稳定，真实购买力增长    京工农业产品交流转畅	五月份食粮输出输入均有增加，	棉布外销较四月份增多百分之八十。,1950-06-18,1950-06
中国蛋品公司京分公司    上月收购鲜蛋两千余万个    六月二十五日停收，存有蛋品者可于停收前至收购处出售。,1950-06-18,1950-06
西安群众日报展开批评与自我批评    受批评者据实进行检讨纠正    部分机关和人员抗拒批评，该报公布名单催促认真答复。,1950-06-18,1950-06
南京青岛完成整编工作    各机关逐渐建立起科学的分工负责制度,1950-06-18,1950-06
大力调剂各地土产    土产公司业务日益发达,1950-06-18,1950-06
人民银行北京分行    厉行节约开支日减,1950-06-18,1950-06
五区人民代表会议    准备于本月底召开    筹委会成立正展开宣传,1950-06-18,1950-06
文教局再度通知各小学及幼稚园    彻底废除体罚制度,1950-06-18,1950-06
“五四医院”今开幕    学生诊病减价优待,1950-06-18,1950-06
克因电业社偷电    被查获后已坦白承认,1950-06-18,1950-06
救济爆炸受伤者    北京中苏友协捐款一百万元,1950-06-18,1950-06
纪念高尔基    维诺格拉多娃讲演,1950-06-18,1950-06
简讯,1950-06-18,1950-06
天津铁路丰台各段站    联合创办职工业余中学,1950-06-18,1950-06
天津市塘大区    继续改进职工业余学校,1950-06-18,1950-06
金州纺织厂的职工学习是怎样搞好的？,1950-06-18,1950-06
职工学习简讯,1950-06-18,1950-06
山西省各县普建文化馆,1950-06-18,1950-06
中央人民政府直属机关    将成立青年团工作委会,1950-06-18,1950-06
重庆市各工厂    开始建团工作,1950-06-18,1950-06
日共向爱国者发出号召    保卫祖国反对作新战争基地    美日反动派的镇压决阻止不住人民前进,1950-06-18,1950-06
世界工人阶级在反法西斯斗争中团结前进    法总工会声援日本工人    美民主远东政策委会斥美对日政策,1950-06-18,1950-06
东北各人民团体发表声明    抗议美日反动派迫害日共    北大学生会声援日本人民,1950-06-18,1950-06
吉田违反波茨坦宣言侵犯人权    日共向法院提出控诉,1950-06-18,1950-06
巴基斯坦共产党发表声明    接受情报局刊物论文结论    将加强工农联盟、组织统一战线进行反帝反封建斗争。,1950-06-18,1950-06
印度阿萨密省政府    加紧迫害进步势力    竟宣布印共为非法,1950-06-18,1950-06
美帝和英帝的矛盾在发展    英拒绝接受西欧“整体化”计划    法政府表示吃惊、美帝发出公然的恫吓,1950-06-18,1950-06
路透社驻柏林采访主任    皮特声明不再为战贩服务    在招待记者会上揭露美英备战阴谋,1950-06-18,1950-06
陕西华县青年团员    积极参加麦收工作,1950-06-18,1950-06
模范干部李计科,1950-06-18,1950-06
中国蚕丝业是有发展前途的    农业部工业原料司再答读者问,1950-06-18,1950-06
平山烟堡村干部    贪污公粮受处分,1950-06-18,1950-06
南口铁路医院部分医生    对工人疾病不负责任    望南口铁路医院进行检查,1950-06-18,1950-06
关于尺算法问题    于振善同志答读者,1950-06-18,1950-06
劳动是快乐的    ——访苏日记之七,1950-06-18,1950-06
高尔基—保卫和平的战士    ——高尔基逝世十四周年纪念,1950-06-18,1950-06
悼瞿秋白同志,1950-06-18,1950-06
苏联文学的奠基人——高尔基    在勇敢者和精神雄壮者的歌颂里，    你永远是：活的模范，向自由，向光明    的高傲的号召！——鹰之歌。,1950-06-18,1950-06
在沙马拉日报馆时期的高尔基,1950-06-18,1950-06
回忆瞿秋白同志    瞿秋白同志逝世十五周年纪念,1950-06-18,1950-06
政务院关于救济失业工人的指示,1950-06-19,1950-06
关于经济形势、调整工商业和调整税收诸问题    （在人民政协全国委员会第二次会议上的报告）,1950-06-19,1950-06
认真救济失业工人,1950-06-19,1950-06
救济失业工人暂行办法    中央人民政府政务院一九五零年六月十七日批准,1950-06-19,1950-06
各地人民政府和工会组织    用多种方式救济失业工人,1950-06-19,1950-06
