向中国的保尔·柯察金学习我要改造“个人第一”的思想意识,1951-10-16,1951-10
永嘉县某些领导干部竟以“地位”观念教育干部,1951-10-16,1951-10
剧本《重新作人》有敌我不分的错误,1951-10-16,1951-10
部分新出版的旧小说中仍有错误的思想内容,1951-10-16,1951-10
山西画报社检讨画错国旗的错误,1951-10-16,1951-10
兄弟会晤,1951-10-16,1951-10
共产党员刘尚文等压制群众批评中共山西省委纪律检查委员会通报全省党的组织以此教育全体党员,1951-10-16,1951-10
党的生活简评,1951-10-16,1951-10
怎样对反革命分子家属进行教育？,1951-10-16,1951-10
和苗族同胞建立了亲密无间的感情,1951-10-16,1951-10
保卫我们自由幸福的生活,1951-10-16,1951-10
保卫人民的幸福生活,1951-10-16,1951-10
教育反革命分子家属,1951-10-16,1951-10
鼓舞了我们胜利前进的信心,1951-10-16,1951-10
苏联真理报和文学报评论指出全世界进步人类拥护斯大林谈话表明他们决心保卫国际和平安全,1951-10-16,1951-10
日本共产党本部对策委员会发表声明斥吉田政府非法迫害日共领袖号召人民保卫独立和政治权利打倒吉田卖国政府,1951-10-16,1951-10
苏联代表在盟国对日委员会上提出讨论日本国会议员请愿书坚持取消吉田政府迫害日共领袖的非法决定,1951-10-16,1951-10
李奇微总部命令吉田政府交出仙台等地最好房舍仓库,1951-10-16,1951-10
西德各地人民举行大会欢迎人民议会建议,1951-10-16,1951-10
美最高法院竟拒绝受理美共领袖上诉美共声明谴责美统治集团法西斯罪行号召人民团结起来为废除史密斯法而斗争,1951-10-16,1951-10
法国举行省议会选举法共获得选票最多戴高乐党及社会党又一次惨败,1951-10-16,1951-10
挪威举行市选共产党选票增加充分表现挪威人民不满政府政策,1951-10-16,1951-10
缅甸关于对日和约的态度,1951-10-16,1951-10
人民志愿军战士谈祖国建设,1951-10-16,1951-10
国际简评,1951-10-16,1951-10
美方无法抵赖犯罪责任李奇微再次被迫承认美机扫射中立区但在承认之后竟又有美轰炸机从开城上空低飞而过人们不能不怀疑美方究竟是否还有恢复停战谈判的诚意,1951-10-17,1951-10
李奇微的来信,1951-10-17,1951-10
中国人民志愿军愈战愈强侵略军参谋人员慑于我军威力深为惶恐美方消息承认美军在朝鲜中线遭我严重打击和杀伤,1951-10-17,1951-10
双方联络官继续会谈复会事宜美方图窜改现行开城中立区协议继续阻挠双方代表团的迅速复会,1951-10-17,1951-10
朝鲜人民观礼代表团返抵平壤玄勋团长畅谈新中国的新生气象,1951-10-17,1951-10
柴川若等返抵朝鲜前线将分头向中朝人民部队作报告,1951-10-17,1951-10
各国人民观礼代表团在上海参观工厂农村,1951-10-17,1951-10
纪念鲁迅先生逝世十五周年北京鲁迅故居定十月十九日开放,1951-10-17,1951-10
我们伟大的祖国,1951-10-17,1951-10
在伟大祖国的康藏高原,1951-10-17,1951-10
荣誉的人——记人民志愿军崔建国排的战斗,1951-10-17,1951-10
河北省九月份超额完成购棉任务山东省吴桥张庄乡七百余户棉农向曲耀离应战售棉花纱布公司廉价供应棉絮棉价逐步下降,1951-10-17,1951-10
中央贸易部加紧调拨原棉保证纱厂全面开工,1951-10-17,1951-10
中南区经过民主改革的工矿企业生产管理工作已开始出现新面貌,1951-10-17,1951-10
民主改革后的武汉市第一纱厂,1951-10-17,1951-10
皖南芜湖易太圩机械排水站获得成功私人资本在农业建设方面有广大前途,1951-10-17,1951-10
经济生活简评鼓励私人资本下乡,1951-10-17,1951-10
看了物资展览会，我的思想提高了,1951-10-17,1951-10
巩固工农联盟，发展农业生产,1951-10-17,1951-10
我们回国学习的华侨学生决为建设伟大的祖国而奋斗,1951-10-17,1951-10
学习志愿军忠于人民事业的精神——《人民志愿军“普通一营”》读后感,1951-10-17,1951-10
我要学习吴运铎顽强的精神克服在工作中强调困难的缺点,1951-10-17,1951-10
学习张林同志的高贵品质,1951-10-17,1951-10
我认识了“活教育”的实质,1951-10-17,1951-10
无为县水利委员会副主任张悦对待批评采取不正确态度,1951-10-17,1951-10
对人民日报读者批评建议的反应三联书店关于《世界妇女名人剪影》一书的错误的检讨,1951-10-17,1951-10
斯大林关于语言学问题的著作对于社会科学发展的意义,1951-10-17,1951-10
我铁路劳动模范代表大会致电日本工人支援日本工人反对美制单独和约要求释放“松川事件”无辜被捕者,1951-10-17,1951-10
我全国民主妇女联合会写信给日本妇女支援“松川事件”无辜被告的正义斗争坚决反对美帝国主义武装日本及美制单独对日和约,1951-10-17,1951-10
日本“松川事件”无辜被告铃木信等呼吁中国人民继续支援日本人民斗争,1951-10-17,1951-10
驻日美国占领军总部正用收买和高压手段迫日本国会批准和约,1951-10-17,1951-10
国际简评支援“松川事件”无辜被告,1951-10-17,1951-10
缅甸关于对日和约的态度（续完）,1951-10-17,1951-10
伟大的中华人民共和国万岁 沈阳、上海、武汉、西安、迪化、西宁等地人民庆祝建国两周年,1951-10-17,1951-10
严肃法纪，惩处贪污分子！,1951-10-17,1951-10
新中国新人新事,1951-10-17,1951-10
各族人民团结起来，建设新中国！,1951-10-17,1951-10
批评与建议,1951-10-17,1951-10
寻人名单革命军人家属寻找革命军人,1951-10-17,1951-10
朝鲜西线我军打败敌军“秋季攻势”十天歼敌两万五千余人我军屡创以少胜多范例大量杀伤敌军,1951-10-18,1951-10
湖南省湘潭县乌石乡农民写信向志愿军彭德怀司令员祝贺胜利并报告故乡人民一年来的抗美援朝工作,1951-10-18,1951-10
双方联络官昨天继续会谈代表团复会事宜我方主张迅速进入具体复会时间的讨论要求对方放弃其无理提案接受我方合理提案,1951-10-18,1951-10
伦敦工人日报记者阿兰·魏宁顿揭露李奇微阴谋取消开城中立化协定美方记者透露李奇微总部蓄意继续进行侵朝战争,1951-10-18,1951-10
迎接志愿军出国作战一周年京津两市人民踊跃缴纳飞机大炮献款苏北农村合作社代收捐献粮款便利农民完成捐献计划,1951-10-18,1951-10
保罗等国观礼代表团赴杭州印度等国代表团离天津南下,1951-10-18,1951-10
苏联人民观礼代表团返京,1951-10-18,1951-10
我们伟大的祖国,1951-10-18,1951-10
党保证我们走向胜利,1951-10-18,1951-10
苏北南通县马桥村农民家家户户订售棉计划,1951-10-18,1951-10
成渝铁路接受苏联填土打夯的筑路法已成我国修筑得最快和最稳固的铁路,1951-10-18,1951-10
中央重工业部指示直属厂矿发动群众进行秋季保安大检查,1951-10-18,1951-10
坚决实行保安大检查经济生活简评,1951-10-18,1951-10
爱国主义劳动的新高涨——记东北工人阶级的增产节约运动,1951-10-18,1951-10
我认识了工人阶级的领导作用,1951-10-18,1951-10
工农互相保证发展生产,1951-10-18,1951-10
不让帝国主义再挑拨我们工农分家！,1951-10-18,1951-10
我们全军加入中苏友协为会员与苏联人民团结起来保卫和平,1951-10-18,1951-10
新闻工作者应吸取爱伦堡的新闻工作经验,1951-10-18,1951-10
长治县财粮科不该给教员拨发坏米,1951-10-18,1951-10
滁县部分小学教师应改变体罚儿童的现象,1951-10-18,1951-10
山东齐河八区人民政府关于错误处理贾象菊婚姻问题的检讨,1951-10-18,1951-10
新乡木材洋灰经营处对木材被水浸腐一事的检讨,1951-10-18,1951-10
工厂支部应当宣传郝建秀工作方法,1951-10-18,1951-10
党的生活简评反对无原则纠纷,1951-10-18,1951-10
充实我们的学识,1951-10-18,1951-10
文化零讯,1951-10-18,1951-10
斯大林关于语言学问题的著作对于社会科学发展的意义,1951-10-18,1951-10
日本工会组织反对单独“和约”号召日本工人展开强有力的抗议运动要求撤换并严惩出卖国家的吉田政府,1951-10-18,1951-10
德意志民主共和国人民议会向波恩议会提出质询重申举行全德会议准备全德选举的建议并抗议阿登纳将西德拖入北大西洋公约的阴谋,1951-10-18,1951-10
越人民军进攻义陆歼法侵略军四个连,1951-10-18,1951-10
巴基斯坦总理被刺死,1951-10-18,1951-10
人民解放军代表团参加捷陆军节我驻捷大使设宴招待捷副总理西罗基等应邀出席,1951-10-18,1951-10
伊朗议员发表谈话感谢苏联在安理会的支援,1951-10-18,1951-10
安理会讨论英伊石油案摩萨台斥英国侵犯伊朗主权,1951-10-18,1951-10
法省议会选举第二次投票结束法共为首的民主力量获更大胜利戴高乐党徒及右翼社会党头子又遭受一次惨败,1951-10-18,1951-10
侵朝美军伤亡惨重美国竟强迫日本人民输血,1951-10-18,1951-10
斯大林的谈话与世界和平,1951-10-18,1951-10
国际简评德国人民对阿登纳的又一警告,1951-10-18,1951-10
访“卡加洛沃”村农业合作社——“从黑海到波罗的海”之二,1951-10-18,1951-10
关于朝鲜局势与苏美关系苏联政府致美国政府的声明,1951-10-19,1951-10
朝鲜中线东部二十余公里狭窄地段上我军三天歼敌一万七千美联社记者供认在朝鲜西线美骑兵第七团伤亡惨重,1951-10-19,1951-10
双方联络官继续举行会谈我方再度驳斥美方的无理方案,1951-10-19,1951-10
周恩来总理兼外交部部长唁巴基斯坦总理逝世,1951-10-19,1951-10
中苏友好协会总会举行宴会招待苏联观礼代表团,1951-10-19,1951-10
匈批准中匈文化合作协定,1951-10-19,1951-10
入藏部队的医务人员积极为藏族人民治病,1951-10-19,1951-10
迎接人民志愿军出国作战一周年纪念日西康藏族自治区举行抗美援朝代表会议北京市工商界订出办法加强抗美援朝的实际行动,1951-10-19,1951-10
中央东北水灾慰问团向政务院报告工作东北政府和人民积极防汛抢救和安置灾民灾民战胜灾荒和恢复生产是完全有保证的,1951-10-19,1951-10
我们伟大的祖国,1951-10-19,1951-10
学习鲁迅，坚持思想斗争！,1951-10-19,1951-10
中南区和陕西省九月份超额完成收购新棉任务山西产棉区棉农响应曲耀离互助组爱国售棉挑战,1951-10-19,1951-10
进行充分政治动员和组织领导浙江农民集体售棉,1951-10-19,1951-10
热爱我们的祖国要把棉花卖给国家！,1951-10-19,1951-10
必须严办枪击工人的厂警经济生活简评,1951-10-19,1951-10
发展我们的重工业——华北区城乡物资交流展览会重工业馆介绍,1951-10-19,1951-10
主观主义是基本建设的最大敌人,1951-10-19,1951-10
感谢苏联专家布科夫帮助我们治理淮河,1951-10-19,1951-10
抗议日本反动派对“松川事件”无辜被告的非法判决,1951-10-19,1951-10
学习罗云章和张林忠心为党的事业奋斗的精神,1951-10-19,1951-10
只要全心全意为人民服务在任何岗位上都能发挥力量,1951-10-19,1951-10
粮食公司乌衣镇营业所碾米厂领导干部忽视工人利益警卫员竟开枪击伤工人,1951-10-19,1951-10
惠民专区某些花纱布公司不及时拨款给合作社影响了收购棉花工作,1951-10-19,1951-10
天津铁路管理局材料处改正长材短用浪费木材的作法对人民日报批评建议的反应,1951-10-19,1951-10
兄弟会晤,1951-10-19,1951-10
怀念思想战线上的伟大战士—鲁迅先生——发表在一部分报刊上的鲁迅先生逝世十五周年纪念文字摘要,1951-10-19,1951-10
中共河北省委指示各级党委加强购棉工作的政治教育,1951-10-19,1951-10
纪念鲁迅先生逝世十五周年鲁迅谈写作,1951-10-19,1951-10
不容情地对敌战斗,1951-10-19,1951-10
文化生活简评,1951-10-19,1951-10
“同意批准的举手！”,1951-10-19,1951-10
中近东人民反帝国主义运动日益高涨伊拉克人民要求废除英伊条约反对参加美英帝国主义所谓“联防”体系,1951-10-19,1951-10
埃及各地人民继续举行反帝游行示威反对美英帝国主义变埃及为近东侵略基地的阴谋埃及政府拒绝参加美英法土四国建议的“中东联合司令部”组织,1951-10-19,1951-10
美加紧拚凑东地中海集团受到中近东各国人民反对,1951-10-19,1951-10
巴基斯坦喀喇蚩学联支持伊朗埃及反帝斗争,1951-10-19,1951-10
越南南部人民军攻击敌交通干线获胜破坏法军火车一列毙敌两连,1951-10-19,1951-10
全国自然科学专门学会联合会全国科学技术普及协会发表宣言拥护斯大林关于原子武器的谈话主张禁止使用和停止生产原子武器,1951-10-19,1951-10
朝鲜后方各地丰收黄海道农产计划超额完成,1951-10-19,1951-10
澳反对重新武装日本委员会反对澳政府批准美制和约,1951-10-19,1951-10
驻在北海道的美日军队正加紧军事部署和训练,1951-10-19,1951-10
西德各地人民纷纷集会拥护人民议会建议要求举行全德会议,1951-10-19,1951-10
阿登纳在美帝国主义指使下竟再次拒绝人民议会建议波恩议会决就此进行辩论,1951-10-19,1951-10
科学工作者应为加强国防建设而努力——拥护斯大林关于原子武器问题的谈话,1951-10-19,1951-10
斯大林谈话鼓舞了苗族保卫和平的信心,1951-10-19,1951-10
美国侵略军伤亡率激增三天中我在中线平均每天歼敌五千六百是朝鲜战争进程中一个极有意义的事件,1951-10-20,1951-10
首都各界人士千余人举行大会纪念鲁迅逝世十五周年华北局等机关及上海等地亦集会纪念,1951-10-20,1951-10
联络官会议继续举行我方严词斥责对方所提无理要求要求对方慎重考虑接受我方提案,1951-10-20,1951-10
迎接志愿军出国作战一周年内蒙古自治区人民缴纳献款超过半数,1951-10-20,1951-10
中南地区和青岛市援朝铁路汽车人员出发,1951-10-20,1951-10
政务院举行一零七次会议,1951-10-20,1951-10
我们伟大的祖国,1951-10-20,1951-10
法国今晚报记者贝却敌报道美方提出荒谬建议竟要求美机有权飞越中立区,1951-10-20,1951-10
马良山上痛打英军二十九旅,1951-10-20,1951-10
从一座桥看美军“空中优势”,1951-10-20,1951-10
苏联的严正立场和美国的拖延战术,1951-10-20,1951-10
各地产棉区农民向曲耀离互助组应战保证把全部新棉卖给国家,1951-10-20,1951-10
充分供应全国人民的需要上海公私棉纺织厂加班生产,1951-10-20,1951-10
西南工人阶级对祖国的伟大贡献——记西南区工业展览会,1951-10-20,1951-10
克服各种困难，完成灾区秋耕工作,1951-10-20,1951-10
从物资交流展览大会看东北建设,1951-10-20,1951-10
应该有计划地发展手工业生产——华北区城乡物资交流展览会手工业馆介绍扩大城乡物资交流，发展工农业生产,1951-10-20,1951-10
只有在工人阶级帮助下农业生产才能不断提高,1951-10-20,1951-10
读者来信,1951-10-20,1951-10
兄弟会晤,1951-10-20,1951-10
我们要向鲁迅学习什么？纪念鲁迅先生逝世十五周年,1951-10-20,1951-10
关于鲁迅著作的编校注释和出版,1951-10-20,1951-10
文化零讯,1951-10-20,1951-10
语法、修辞讲话（第五讲）,1951-10-20,1951-10
日共中央发表关于旧金山会议的声明号召日本人民粉碎美制和约组织群众性抵抗行动推翻卖国的吉田政府,1951-10-20,1951-10
我国铁路工会邮电工会医务工会等声援日本“松川事件”无辜被告的斗争,1951-10-20,1951-10
朝“祖国保卫福券”销售工作超额完成,1951-10-20,1951-10
莫斯科文化科学界人士集会纪念鲁迅忌辰苏文学报介绍鲁迅生平及作品,1951-10-20,1951-10
英帝国主义者疯狂镇压埃及人民埃及人民愤慨异常坚决实行抵制,1951-10-20,1951-10
在海外四省议会选举中法共获得新胜利,1951-10-20,1951-10
英国许多工厂成立选举组织响应英国共产党号召为击败保守党而斗争,1951-10-20,1951-10
不顾銮披汶政府的可耻阻难泰国人民踊跃参加和平签名,1951-10-20,1951-10
教育工作者工会国际行政扩大会议致函各国教育工作者号召资本主义各国的教师们团结起来争取生活政治权利,1951-10-20,1951-10
东欧各国人民为斯大林的谈话所鼓舞保证争取提前完成生产计划维护和平,1951-10-20,1951-10
国际简评,1951-10-20,1951-10
在英雄桥畔,1951-10-20,1951-10
迎接人民志愿军出国作战一周年各地加强抗美援朝工作开展增产节约运动支援前线,1951-10-21,1951-10
越爬越高，越背越重,1951-10-21,1951-10
常州私营民丰纱厂工人写信给志愿军报告抗美援朝运动中增加生产的成绩祝贺志愿军出国作战一年的伟大胜利,1951-10-21,1951-10
朝鲜和苏联建立外交关系三周年斯大林、金日成互致贺电,1951-10-21,1951-10
双方联络官继续会谈取得关于中立区范围的协议将提交复会后首次会议讨论我方继续驳斥对方无理要求,1951-10-21,1951-10
美国人民要求停战谴责美政府在朝鲜谈判中缺乏诚意,1951-10-21,1951-10
苏联人民观礼团昨离京返莫斯科团长索洛维耶夫发表谈话,1951-10-21,1951-10
苏联人民纪念鲁迅,1951-10-21,1951-10
印度访华妇女代表汉纳·森夫人离京前致函我妇联邓颖超副主席,1951-10-21,1951-10
鲁迅故乡各界人民集会纪念鲁迅逝世十五周年,1951-10-21,1951-10
我们伟大的祖国,1951-10-21,1951-10
不倦地钻研马列主义理论是共产党人的责任和义务——“争取持久和平，争取人民民主！”总第一五○期社论,1951-10-21,1951-10
全国各大城市棉纺织厂重点推广郝建秀细纱工作法,1951-10-21,1951-10
我要更好地为城乡物资交流服务,1951-10-21,1951-10
经济生活简评,1951-10-21,1951-10
淮河流域的新面貌,1951-10-21,1951-10
天津铁路局核定资金工作的初步经验清理资材，核定资金，反对浪费！,1951-10-21,1951-10
读者来信,1951-10-21,1951-10
对人民日报批评建议的反应,1951-10-21,1951-10
文化生活简评,1951-10-21,1951-10
扩大增产节约运动，加强抗美援朝力量,1951-10-21,1951-10
全国工人阶级在抗美援朝运动中的伟大贡献,1951-10-21,1951-10
农村爱国运动的新高涨,1951-10-21,1951-10
全世界的人民都和你们在一起波兰和平委员会副主席、世界和平理事会理事耶齐·普特拉曼特给中国人民志愿军的一封信,1951-10-21,1951-10
工商界在抗美援朝爱国运动中前进,1951-10-21,1951-10
文化战线上的抗美援朝工作,1951-10-21,1951-10
全世界人民都热烈同情和支援我们,1951-10-21,1951-10
北京市抗美援朝分会订出纪念办法迎接志愿军出国作战周年河北省人民缴纳献款逾千亿元,1951-10-22,1951-10
解放军和志愿军战斗英雄代表团在首都曾向四十余万人民进行报告日内将分别返回战斗岗位及赴国内各地作报告,1951-10-22,1951-10
联络官会议达成协议双方约定今天在协议上签字同时确定代表团复会的日期,1951-10-22,1951-10
各国观礼代表团到南京,1951-10-22,1951-10
绥远省人民政府严惩渎职贪污罪犯省工商厅厅长支持所属出售黄金被处徒刑萨县副县长刘绍杰贪污罪行严重被处死刑,1951-10-22,1951-10
我们伟大的祖国,1951-10-22,1951-10
我们的心随着你们的心兴奋地激跳——作家老舍给志愿军指挥员战斗员的一封信,1951-10-22,1951-10
不许盗窃国家财产！,1951-10-22,1951-10
人民民主制度是治淮力量的源泉,1951-10-22,1951-10
全国煤矿基本建设会议决定工作方针合理使用国家投资减少浪费,1951-10-22,1951-10
纠正基本建设工作中的新偏向,1951-10-22,1951-10
工人农民紧密团结发展生产,1951-10-22,1951-10
学习工人阶级的爱国精神进一步开展爱国丰产运动,1951-10-22,1951-10
经济生活简评秋征工作必须按政策办事,1951-10-22,1951-10
开展爱国丰产运动，提高单位面积产量,1951-10-22,1951-10
拥护苏联政府声明,1951-10-22,1951-10
支援日本“松川事件”无辜被告的斗争,1951-10-22,1951-10
中华儿女崔建国排的事迹将永远记在祖国人民心里,1951-10-22,1951-10
黑龙江讷河县双泉村和五福村早婚和买卖婚姻现象严重当地领导机关应检查纠正,1951-10-22,1951-10
石家庄花纱布分公司委托厂商织布计算棉纱标准有错误，造成国家财产损失,1951-10-22,1951-10
对人民日报读者批评建议的反应青年团山东省惠民地方工作委员会关于干部兼职过多的检查答复,1951-10-22,1951-10
官僚主义者被贪污分子钻了空子沈阳纺织厂的教训值得各地注意,1951-10-22,1951-10
广东造纸厂主要党员干部不负责任民主改革工作进展极慢,1951-10-22,1951-10
警惕资产阶级反动思想作风的侵袭党的生活简评,1951-10-22,1951-10
山西日报组织读者讨论的经验,1951-10-22,1951-10
苍山县怎样利用典型案件进行婚姻法的宣传？坚决贯彻婚姻法，保障妇女权利！,1951-10-22,1951-10
璧山县利用典型案件大张旗鼓宣传婚姻法,1951-10-22,1951-10
利用典型案件宣传婚姻法政法工作简评,1951-10-22,1951-10
坚决清除戏曲中违反新婚姻法与侮辱妇女的恶劣思想文化生活简评,1951-10-22,1951-10
文化零讯,1951-10-22,1951-10
关心妇女生活，支援妇女斗争——《新中国妇女》第二十四期社论,1951-10-22,1951-10
日本工会组织积极参加全国性抗议运动反对批准单独和约和《安全条约》日共议员在国会痛斥奴役日本的美制和约,1951-10-22,1951-10
我新闻出版印刷工会等声援“松川事件”被告,1951-10-22,1951-10
美国飞机工业两万工人坚持罢工杜鲁门政府正阴谋布置镇压,1951-10-22,1951-10
苏报评埃及人民争取独立斗争：埃及人民觉悟提高美图利用英埃冲突加紧侵略,1951-10-22,1951-10
法国与美英狼狈为奸重新武装西德苏联再斥法政府违反法苏条约,1951-10-22,1951-10
英共副主席杜德主张英军撤出埃及迅速阻止英埃间发生全面战争,1951-10-22,1951-10
巴基斯坦总督易人,1951-10-22,1951-10
安理会决定延期辩论英对伊朗的“控诉案”苏联代表坚持安理会不能干涉伊朗内政埃及各地人民继续示威抗议英军暴行,1951-10-22,1951-10
以色列人民展开斗争反对参加美国中东侵略组织,1951-10-22,1951-10
国际简评,1951-10-22,1951-10
为中国人民辉煌的成就而欢呼,1951-10-22,1951-10
我看见了中国人民的力量,1951-10-22,1951-10
北京天津两市高等学校教师开展学习运动改造思想周总理向教师报告知识分子改造问题号召努力学习做文化战线的革命战士,1951-10-23,1951-10
迎接志愿军出国作战一周年浙江人民超额完成捐献计划华北人民已缴纳献款三千四百余亿元,1951-10-23,1951-10
在抗美援朝保家卫国运动中东北人民一年来贡献了巨大力量人民成群结队奔赴朝鲜前线创造光辉功绩大量捐输物资现款支援朝鲜人民解放战争,1951-10-23,1951-10
双方联络官在协议上签字我方建议代表团今天复会,1951-10-23,1951-10
中国作家赴苏访问团启程我电影工作者代表团离苏返国,1951-10-23,1951-10
华东和上海人民代表集会欢迎印度等国代表团,1951-10-23,1951-10
巴基斯坦观礼代表团团长离北京前曾函郭沫若致谢,1951-10-23,1951-10
越南人民两代表团离沈赴津,1951-10-23,1951-10
德文化代表团离上海,1951-10-23,1951-10
我国留美学生归国途中竟遭美国政府无理扣押,1951-10-23,1951-10
我们伟大的祖国,1951-10-23,1951-10
认真展开高等学校教师中的思想改造学习运动,1951-10-23,1951-10
寄语朝鲜前线志愿军英勇战士：祖国人民都在尽力支援你们！,1951-10-23,1951-10
华东首期新棉收购任务超额完成山东某些产棉区合作社分级议价不准确影响收棉工作,1951-10-23,1951-10
接受本报关于浪费木材的批评湖南林业局检讨单纯营利观点反对浪费木材，反对滥伐林木！,1951-10-23,1951-10
不再做“哑吧买卖”了经济生活简评,1951-10-23,1951-10
站在治淮战线最前列的人,1951-10-23,1951-10
人畜两旺的呼伦贝尔草原,1951-10-23,1951-10
湘鄂西老根据地人民代表王尚桂等参观首都各工厂后觉悟提高认识了工人阶级的领导作用,1951-10-23,1951-10
新民开原两县合作社干部洪水期间奋不顾身抢救物资,1951-10-23,1951-10
给要离婚的妇女以安全保障,1951-10-23,1951-10
我要努力宣传婚姻法,1951-10-23,1951-10
皖北检查粮库发现因保管不当造成很大损失,1951-10-23,1951-10
广灵县李环等违法盗卖林木当地领导机关应速检查处理,1951-10-23,1951-10
密切注意不法地主破坏活动陕州专区要加强农村治安工作,1951-10-23,1951-10
中共察哈尔省委发出指示确定全省以生产救灾为中心任务,1951-10-23,1951-10
忽视救灾工作造成严重损失中共滑县县委会进行检讨并确定贯彻生产救灾方针的步骤,1951-10-23,1951-10
党的生活简评认真做好生产救灾工作,1951-10-23,1951-10
北京大学教员的政治学习运动,1951-10-23,1951-10
写好报告文学，迅速反映飞跃进展中的祖国——读四篇朝鲜战场通讯后,1951-10-23,1951-10
坚决贯彻婚姻法，保障妇女权利！邰秀英孙田均自由结婚的故事,1951-10-23,1951-10
政法工作简评争取婚姻自由的斗争一定胜利,1951-10-23,1951-10
