祝贺中华人民共和国成立两周年斯大林大元帅致电毛主席苏联外交部长维辛斯基致电我政务院总理兼外交部长周恩来,1951-10-01,1951-10
我们伟大的祖国,1951-10-01,1951-10
毛主席昨举行宴会欢庆国庆节出席的有老根据地代表战斗英雄劳动模范等一千四百余人赴宴的有各国外交使节特邀外宾各国观礼代表等三百余人,1951-10-01,1951-10
中国人民保卫世界和平反对美国侵略委员会为反对美国重新武装日本并继续占领日本宣言,1951-10-01,1951-10
伟大的中国三大运动——为“人民中国”国庆纪念专刊作,1951-10-01,1951-10
庆祝第二届国庆节,1951-10-01,1951-10
国庆日致词,1951-10-01,1951-10
中华人民共和国的两年,1951-10-01,1951-10
伟大的抗美援朝运动,1951-10-01,1951-10
伟大的镇压反革命运动,1951-10-01,1951-10
两年中体验的一些意见——国庆二周年的献词,1951-10-01,1951-10
解放军、志愿军战斗英雄观礼代表团给毛主席写信祝贺建国两周年,1951-10-01,1951-10
各国政府电贺我国国庆,1951-10-01,1951-10
民用航空局全体工人职员向毛主席献“国庆号”飞机,1951-10-01,1951-10
应邀参加我国国庆节庆祝典礼朝保等国代表团抵京,1951-10-01,1951-10
朝鲜人民观礼代表团名单,1951-10-01,1951-10
保加利亚人民观礼代表团名单,1951-10-01,1951-10
罗马尼亚人民观礼代表团名单,1951-10-01,1951-10
捷克斯洛伐克人民观礼代表团名单,1951-10-01,1951-10
中央人民政府政务院命令自一九五一年十月一日起在新疆发行带维吾尔文的人民币并准在全国流通,1951-10-01,1951-10
新中国的第二年辉煌成就,1951-10-01,1951-10
中央人民政府委员会第十二次会议通过各项任免名单,1951-10-01,1951-10
欢庆中华人民共和国第二届国庆节首都昨日隆重举行庆祝典礼毛主席朱总司令和中央人民政府其他首长出席检阅全场群众为祖国人民力量划时代的发展而一再欢呼,1951-10-02,1951-10
青春的祖国，无穷的力量！,1951-10-02,1951-10
西藏地方政府电毛主席祝贺国庆班禅额尔德尼电毛主席致敬,1951-10-02,1951-10
我们伟大的祖国,1951-10-02,1951-10
中国人民解放军总部命令一九五一年十月一日于北京,1951-10-02,1951-10
我们的朋友遍于全世界！——各国政府和人民电贺我国国庆,1951-10-02,1951-10
中华人民共和国两年来的伟大成就,1951-10-02,1951-10
庆祝国庆二周年,1951-10-02,1951-10
团结在毛泽东的旗帜之下胜利前进——庆祝中华人民共和国建国两周年,1951-10-02,1951-10
全国各级各界人民代表会议的建设情况,1951-10-02,1951-10
中国人民革命与中国少数民族——为纪念建国二周年而作,1951-10-02,1951-10
新中国第二年的辉煌成就（一）抗美援朝斗争取得了伟大胜利,1951-10-02,1951-10
柏林、布拉格举行盛大集会热烈庆祝我国建国二周年我驻苏大使馆举行庆祝国庆纪念晚会,1951-10-02,1951-10
“争取持久和平，争取人民民主！”刊载董必武同志的论文,1951-10-02,1951-10
苏联真理报以大量篇幅刊载专文纪念我国庆节,1951-10-02,1951-10
金日成将军致电彭德怀将军贺我国庆,1951-10-02,1951-10
参加我国国庆节庆典波兰人民观礼代表团名单,1951-10-02,1951-10
国际记者协会电贺我国庆,1951-10-02,1951-10
瑞典大使及丹公使瑞士公使致函祝贺我国庆,1951-10-02,1951-10
英、挪、荷三国政府谈判代表致函祝贺我国庆,1951-10-02,1951-10
苏联各报著文热烈庆祝我国庆节盛赞我国革命胜利的伟大世界意义一致指出中苏友好是世界和平最有力的保障,1951-10-02,1951-10
中国人民的伟大节日,1951-10-02,1951-10
永远与中国友好——庆祝中华人民共和国建国二周年,1951-10-02,1951-10
华北第一次县长会议闭幕决定今冬明春大部县人民代表会议均须代行代表大会职权原则地通过关于加强抗美援朝、发展农业生产等十项决议,1951-10-03,1951-10
开城人民欢庆我国国庆节志愿军代表盛宴招待朝鲜人民军代表,1951-10-03,1951-10
天津已缴献款近八百亿元全国文艺界捐献超过原计划一倍多,1951-10-03,1951-10
我们伟大的祖国,1951-10-03,1951-10
中央人民政府政务院命令,1951-10-03,1951-10
中央人民政府政务院关于改革学制的决定（一九五一年八月十日政务院第九十七次政务会议通过）,1951-10-03,1951-10
中央人民政府教育部部长马叙伦关于政务院公布改革学制的决定的谈话,1951-10-03,1951-10
为什么必须改革学制？,1951-10-03,1951-10
欢呼伟大的祖国的成长，检阅国防和经济的力量！全国各大城市军民欢庆建国两周年,1951-10-03,1951-10
香港澳门同胞欢庆国庆五星国旗到处随风飘扬,1951-10-03,1951-10
西北和西南少数民族地区各族人民欢度国庆节,1951-10-03,1951-10
马恒昌小组写信给毛主席祝贺国庆提前完成生产任务并创造新纪录作为献礼决心不骄不躁继续努力进行祖国经济建设,1951-10-03,1951-10
棉花等级差价表（中央人民政府政务院财政经济委员会公布）,1951-10-03,1951-10
读者来信,1951-10-03,1951-10
对人民日报读者批评建议的反应北京煤业分公司某煤厂已注意改进安全设备,1951-10-03,1951-10
“我把整个生命交给了党”——记模范党员张林,1951-10-03,1951-10
党的生活简评评选模范中可以进行生动的爱国主义教育,1951-10-03,1951-10
做一个毛泽东时代的好学生,1951-10-03,1951-10
两年前后的我,1951-10-03,1951-10
语法、修辞讲话（第五讲）,1951-10-03,1951-10
新中国第二年的辉煌成就（二）大张旗鼓镇压反革命,1951-10-03,1951-10
苏联举办各种集会宣传我国两年来巨大成就,1951-10-03,1951-10
进一步发展与巩固中苏人民友谊苏联举办中国电影周在莫斯科揭幕匈牙利和罗马尼亚举行中国电影周庆祝我国庆,1951-10-03,1951-10
蒙古人民共和国外长拉姆苏伦发表声明抗议美制非法的单独对日和约蒙古人民决心保卫和平以粉碎美英扩大侵略远东阴谋,1951-10-03,1951-10
我们的朋友遍于全世界！——各国人民电贺我国国庆,1951-10-03,1951-10
记国外华侨对新中国的热爱,1951-10-03,1951-10
当代的不可抵抗的运动（《争取持久和平，争取人民民主！》中文版第一○八期社论）,1951-10-03,1951-10
庆祝中华人民共和国第二届国庆节,1951-10-03,1951-10
庆祝中华人民共和国成立两周年！中国人民伟大的领袖毛主席万岁！工人农民等上书毛主席庆祝国庆,1951-10-03,1951-10
中共农村支部国庆节上书毛主席,1951-10-03,1951-10
新中国新人新事,1951-10-03,1951-10
寻人名单革命军人家属寻找革命军人,1951-10-03,1951-10
朝中人民部队继续痛击敌军十天歼敌一万六千余人前线后方上空击落击伤敌机九十六架,1951-10-04,1951-10
志愿军在朝鲜前线欢度国庆节他们听着北京广播就像亲临天安门广场一样的愉快举行歌舞晚会尽情狂欢高呼“祖国万岁”“毛主席万岁”,1951-10-04,1951-10
我驻朝鲜大使倪志亮等荣获朝鲜国旗勋章及奖章,1951-10-04,1951-10
东北水灾区灾民写信给毛主席感谢人民政府对他们的关怀和慰问,1951-10-04,1951-10
苏联等十三国人民观礼代表团及巴基斯坦观礼代表访问我保卫和平反美侵略委员会各国观礼代表昨天分别到各处进行访问和参观游览,1951-10-04,1951-10
巴基斯坦人民观礼代表团团长米安·伊夫提卡鲁丁抵京,1951-10-04,1951-10
北京市第一批电车女司机正式行车首都妇女千三百余人前日在东单广场集会庆贺印度、匈、德等人民代表团外宾参加典礼致词,1951-10-04,1951-10
严格取缔投机活动、巩固物价的稳定中央贸易部通令加强市场管理,1951-10-04,1951-10
我们伟大的祖国,1951-10-04,1951-10
中国人民的伟大节日——“争取持久和平，争取人民民主！”社论,1951-10-04,1951-10
全国铁路劳动模范代表大会闭幕,1951-10-04,1951-10
全国农业工作会议闭幕,1951-10-04,1951-10
东北六十余厂矿向毛主席报捷增产节约值百六十余万吨粮食唐山开滦煤矿职工向毛主席报告国庆节前创造了两项产煤新纪录,1951-10-04,1951-10
人民工程师应有正确立场和观点,1951-10-04,1951-10
昌平县人民政府将公粮售予私商使国家财政收入遭受巨大损失,1951-10-04,1951-10
中国煤建公司绥远分公司不应违反劳动保护法令,1951-10-04,1951-10
淮北盐务局非法克扣工人工资,1951-10-04,1951-10
我在治淮工程中上了一大课,1951-10-04,1951-10
北京被服厂招收工人不应过苛限制年龄,1951-10-04,1951-10
唐山启新洋灰厂接受批评改进安全设备,1951-10-04,1951-10
今后决废除不收已婚妇女规定北京市公共卫生局中级卫生技术学校统一招生委员会已作检讨,1951-10-04,1951-10
中共中央中南局指示武汉市委认真处理宋瑛等压制批评事件长江日报为此发表社论，武汉市委作出检讨报告,1951-10-04,1951-10
中共中央中南局给武汉市委的指示,1951-10-04,1951-10
人民代表的提案为什么愈来愈少？——察哈尔省怀来县人民代表会议处理提案的情况,1951-10-04,1951-10
我看见了伟大可爱的老区人民,1951-10-04,1951-10
对轻视劳动人民的思想展开斗争,1951-10-04,1951-10
文化生活简评,1951-10-04,1951-10
新中国第二年的辉煌成就（三）全国共有三亿一千万以上农业人口地区完成了土地改革,1951-10-04,1951-10
我驻苏联大使张闻天举行盛大鸡尾酒会热烈庆祝我国成立二周年国庆节布尔加宁元帅等六百余贵宾应邀参加,1951-10-04,1951-10
我国驻德、印、巴基斯坦使节国庆日举行盛大庆祝招待会,1951-10-04,1951-10
伊巴露丽致函蔡畅答谢关于参加我国庆典礼的邀请,1951-10-04,1951-10
苏报显著刊载我国国庆消息,1951-10-04,1951-10
意大利共产党中央委员会总书记托里亚蒂贺电,1951-10-04,1951-10
保加利亚总工会主席普拉霍夫贺电,1951-10-04,1951-10
波兰工会中央理事会主席柯罗西维兹贺电,1951-10-04,1951-10
蒙古工会中央理事会主席诺罗夫萨布贺电,1951-10-04,1951-10
纺织工会国际主席诺斯贺电,1951-10-04,1951-10
芬兰纺织工人工会主席马蒂·森乃尔贺电,1951-10-04,1951-10
向在朝鲜前线获得伟大胜利的中国人民志愿军致敬！我炸毁了敌人三辆坦克,1951-10-04,1951-10
向在朝鲜前线获得伟大胜利的中国人民志愿军致敬！鸡雄山十七昼夜阻击战,1951-10-04,1951-10
向在朝鲜前线获得伟大胜利的中国人民志愿军致敬！捉“舌头”,1951-10-04,1951-10
加强国防建设，巩固祖国国防！——人民志愿军、人民解放军战斗英雄代表国庆节观礼后的感想,1951-10-04,1951-10
志愿军某部在夜月山一带一天歼敌八百余作战有功的英勇部队受到通令表扬,1951-10-05,1951-10
志愿军战斗英雄代表团向抗美援朝总会献旗,1951-10-05,1951-10
燕京大学校长陆志韦暨师生员工国庆日函毛主席致敬感谢领导他们完全解脱美帝国主义的压迫和牵制,1951-10-05,1951-10
全国总工会举行宴会欢迎来京工业劳动模范,1951-10-05,1951-10
中国人民解放军陆空海军全军加入中苏友协为团体会员,1951-10-05,1951-10
参加我国庆节庆典的各国代表团工会代表和部分团员昨日访问中华全国总工会李立三副主席介绍我国工人在革命中的贡献和现在状况,1951-10-05,1951-10
我志愿军在前线又俘获一名日本兵被俘日兵供出美军利用日寇进行侵朝战争的非法行为美国一面拖延停战谈判一面继续在日本大量制造军火,1951-10-05,1951-10
美、李匪军士气愈益低落逃兵日多并袭击后方仓库,1951-10-05,1951-10
我们伟大的祖国,1951-10-05,1951-10
金日成彭德怀两将军函复李奇微我方再次建议立即在开城恢复谈判美方横生枝节提出更换会址的无理要求，是为了造成继续拖延谈判的新的借口。,1951-10-05,1951-10
两年来中苏友好协会做了些什么,1951-10-05,1951-10
钢铁是这样炼成的——介绍中国的保尔·柯察金兵工功臣吴运铎,1951-10-05,1951-10
过去对外贸易的半殖民地性质根本改变了开国以来我国对外贸易连年出超,1951-10-05,1951-10
沈阳百余企业单位职工计划增产节约总值达二百余万吨粮食,1951-10-05,1951-10
华东各江河安度汛期淮河流域等地已胜利撤防,1951-10-05,1951-10
充分发动群众，彻底实行民主改革！数十万搬运工人进行反封建斗争百七十余城市废除搬运把头制度,1951-10-05,1951-10
工人在爱国生产竞赛中发挥高度积极性创造性天津有些工厂已能自制多种重要机器,1951-10-05,1951-10
发扬工人阶级的爱国精神经济生活简评,1951-10-05,1951-10
读者来信,1951-10-05,1951-10
对人民日报读者批评建议的反应中国影片经理公司对应注意电影广告思想内容意见的答复,1951-10-05,1951-10
党给了我坚持斗争的力量！,1951-10-05,1951-10
党的生活简评,1951-10-05,1951-10
清漳河边——访问太行山老根据地记实,1951-10-05,1951-10
文化生活简评,1951-10-05,1951-10
新中国第二年的辉煌成就（四）中国人民大团结万岁！,1951-10-05,1951-10
我国驻朝鲜和东欧人民民主国家使节庆祝国庆举行盛大招待会我驻瑞典、丹麦、芬兰、瑞士使馆国庆日招待贵宾,1951-10-05,1951-10
因受美反动派限制不能应邀前来我国法斯特致函郭沫若热烈祝贺我国庆节,1951-10-05,1951-10
掠夺伊朗石油的又一新花样英美图借联合国之名进一步侵犯伊朗主权,1951-10-05,1951-10
安理会非法将英对伊朗“控诉”案列入议程苏联代表痛斥英国政府干涉伊朗内政,1951-10-05,1951-10
德黑兰市民罢工罢市抗议英国干涉伊内政,1951-10-05,1951-10
国际简评,1951-10-05,1951-10
中央人民政府华侨事务委员会何香凝主任国庆日向国外侨胞广播词,1951-10-05,1951-10
向在朝鲜前线获得伟大胜利的中国人民志愿军致敬！坚守蛇头山三一三高地,1951-10-05,1951-10
向在朝鲜前线获得伟大胜利的中国人民志愿军致敬！在任何危险情况下我都不离开伤员们,1951-10-05,1951-10
向在朝鲜前线获得伟大胜利的中国人民志愿军致敬！消灭“英国皇家坦克营”,1951-10-05,1951-10
向在朝鲜前线获得伟大胜利的中国人民志愿军致敬！以身作则坚决完成运输任务,1951-10-05,1951-10
中苏友协二届年会和第一次全国代表会议昨日隆重举行开幕典礼,1951-10-06,1951-10
藏族僧俗人民及人民解放军欢欣鼓舞拉萨举行空前盛会庆祝国庆中央人民政府代表张经武欢宴西藏地方政府官员印度代表祝贺中印人民永远团结击破帝国主义的侵略阴谋,1951-10-06,1951-10
人民解放军进藏部队先遣部队全体指战员国庆节致电毛主席朱总司令致敬保证与西藏人民紧密团结、巩固祖国西南国防,1951-10-06,1951-10
提高人民购买力从经济上巩固工农联盟华北区城乡物资交流展览会开幕,1951-10-06,1951-10
政务院举行一零五次会议,1951-10-06,1951-10
美国在朝鲜停战谈判中屡次提出无理要求引起英国若干资产阶级舆论公开不满泰晤士报主张接受三八线为军事分界线停止侵朝战争,1951-10-06,1951-10
第一次全国民族教育会议闭幕确定目前少数民族教育应以爱国主义为中心内容，以培养少数民族干部为首要任务。,1951-10-06,1951-10
我们伟大的祖国,1951-10-06,1951-10
扩大城乡物资交流，发展工农业生产华北区城乡物资交流展览会介绍,1951-10-06,1951-10
在中苏友协第一次全国代表会议上郭沫若副会长的讲话,1951-10-06,1951-10
建设战线上的技术人员们——介绍来京参加国庆观礼的工业劳动模范孙云鸾等,1951-10-06,1951-10
两年来中国人民经济建设的成就,1951-10-06,1951-10
读者来信,1951-10-06,1951-10
对人民日报读者批评建议的反应,1951-10-06,1951-10
论新年画创作中几个主要的问题,1951-10-06,1951-10
语法、修辞讲话（第五讲）,1951-10-06,1951-10
新中国第二年的辉煌成就,1951-10-06,1951-10
朝鲜代表团访问我志愿军家属军属们热情款待并请转告前线亲属勇敢杀敌各国代表在首都继续进行访问和游览,1951-10-06,1951-10
朝鲜人民观礼代表团昨日离京启程返国,1951-10-06,1951-10
我全国总工会电贺自由德国国庆,1951-10-06,1951-10
应邀参加捷陆军节运动会我人民解放军代表团抵捷我“飞虎山”在罗马尼亚群众歌曲比赛大会上获奖,1951-10-06,1951-10
在中苏友好协会全国代表会议上索洛维耶夫代表苏联人民致贺,1951-10-06,1951-10
爱伦堡讲话,1951-10-06,1951-10
向在朝鲜前线获得伟大胜利的中国人民志愿军致敬！严重地打击了美国空中强盗,1951-10-06,1951-10
向在朝鲜前线获得伟大胜利的中国人民志愿军致敬！勇猛插入敌人的心脏,1951-10-06,1951-10
向在朝鲜前线获得伟大胜利的中国人民志愿军致敬！铁道兵团在朝鲜前线,1951-10-06,1951-10
关于原子武器问题斯大林同志答真理报记者问,1951-10-07,1951-10
美国原子讹诈的破产,1951-10-07,1951-10
世界工联总书记路易·赛扬电刘少奇同志祝贺我国第二届国庆,1951-10-07,1951-10
苏联对外文化协会理事会主席安德列·捷尼索夫电刘少奇会长贺中苏友协成立二周年,1951-10-07,1951-10
我青年团中央和全国民主青联电自由德国青年联盟热烈祝贺德意志民主共和国成立两周年,1951-10-07,1951-10
庆祝捷建军节捷大使馆举行招待会,1951-10-07,1951-10
青年团中央举行座谈会欢迎青年农业劳动模范,1951-10-07,1951-10
各国代表团的作家和艺术家昨与我国文艺界人士举行座谈,1951-10-07,1951-10
参加我国庆节庆典的各国妇女代表访问我全国民主妇联我全国妇联举行盛大欢迎会,1951-10-07,1951-10
我新闻出版印刷工会筹委会招待各国观礼团的新闻工作者,1951-10-07,1951-10
来京外宾继续在北京各处参观访问,1951-10-07,1951-10
我们伟大的祖国,1951-10-07,1951-10
世界和平的伟大福音——论斯大林关于原子武器的谈话,1951-10-07,1951-10
在中苏友好协会全国代表会议上雅科夫列夫的讲话,1951-10-07,1951-10
志愿军战斗英雄郭忠田的讲话,1951-10-07,1951-10
进一步开展对基本建设的讨论,1951-10-07,1951-10
“土产一动，百业俱兴”——华北区城乡物资交流展览大会山干鲜货馆介绍,1951-10-07,1951-10
读者来信,1951-10-07,1951-10
纠正自由主义态度解除各种思想顾虑东北区进一步贯彻反贪污斗争,1951-10-07,1951-10
党的生活简评滑县某些干部忽视救灾工作的错误应即纠正,1951-10-07,1951-10
坚决贯彻婚姻法，保障妇女权利！最高人民法院、司法部,1951-10-07,1951-10
最高人民法院中南分院判决谋杀梁安氏案虐杀妇女凶犯经公审枪决,1951-10-07,1951-10
肥西县孟张氏被逼自杀案判决凶犯孟庆和判处有期徒刑十五年,1951-10-07,1951-10
介绍柳青的新作《铜墙铁壁》,1951-10-07,1951-10
农民代表胡楠卿的讲话,1951-10-07,1951-10
少年儿童队员卢清华的讲话,1951-10-07,1951-10
朝中两国人民在伟大的斗争中的坚强团结是不可战胜的力量,1951-10-07,1951-10
越南人民坚持为保卫和平而团结斗争,1951-10-07,1951-10
向中国人民志愿军致敬,1951-10-07,1951-10
蒙古人民和中国人民永远站在一起,1951-10-07,1951-10
印度、中国和世界的和平,1951-10-07,1951-10
缅甸人民的愿望,1951-10-07,1951-10
缅甸人民为保卫世界和平而奋斗！,1951-10-07,1951-10
中华人民共和国是印尼在对于世界和平事业的贡献中的一面镜子,1951-10-07,1951-10
抗美援朝工作简评,1951-10-07,1951-10
为使美方不再重犯和抵赖违反中立区协议事件金日成彭德怀两将军建议扩大中立区建议中立区包括开城和汶山将会场移至板门店双方立即复会,1951-10-08,1951-10
德意志民主共和国第二届国庆节毛主席周总理分别致电祝贺斯大林大元帅电贺格罗提渥,1951-10-08,1951-10
庆祝德意志民主共和国成立两周年纪念柯尼希使团长昨在京举行招待会朱德宋庆龄副主席等二百余人应邀参加,1951-10-08,1951-10
波立特号召英国人民制止侵朝战争纽约工人日报抨击美国破坏谈判,1951-10-08,1951-10
周总理招待应邀参加我国庆典礼的外宾印度亲善访华团和巴基斯坦人民代表团拜访宋副主席,1951-10-08,1951-10
完成飞机大炮捐献计划加强国防各地人民纷纷按期和提前缴纳献款,1951-10-08,1951-10
中央人民政府人民革命军事委员会欢宴人民解放军和志愿军战斗英雄代表来京农业劳动模范将往天津参观物资交流展览会,1951-10-08,1951-10
上海各报拥护斯大林同志谈话痛斥美帝国主义原子讹诈政策,1951-10-08,1951-10
朝鲜铁路劳动模范十五人即将应邀来我国休养,1951-10-08,1951-10
文化部文物局会同有关单位举办祖国古代艺术展览,1951-10-08,1951-10
中央中南各民族访问团返京访问团所到地区受到各族人民热烈欢迎,1951-10-08,1951-10
我们伟大的祖国,1951-10-08,1951-10
人民政府大力领导发展生产并注意调整城乡关系东北区人民购买力空前提高今年购买力总值比去年提高百分之五十三,1951-10-08,1951-10
我深深体会到学习苏联先进经验的重要,1951-10-08,1951-10
布科夫同志表现了苏联人民伟大的国际主义精神,1951-10-08,1951-10
经济生活简评,1951-10-08,1951-10
我国棉花生产量是不可限量的华北区城乡物资交流展览会棉花馆介绍扩大城乡物资交流，发展工农业生产,1951-10-08,1951-10
读者来信,1951-10-08,1951-10
对人民日报读者批评建议的反应,1951-10-08,1951-10
在讨论《武训传》的基础上继续加强马列主义的学习,1951-10-08,1951-10
我对“活教育”的初步检讨,1951-10-08,1951-10
写在陈鹤琴先生的“初步检讨”之后,1951-10-08,1951-10
记中华全国文学艺术界联合会欢迎国际文学家、艺术家的盛会,1951-10-08,1951-10
文化生活简评,1951-10-08,1951-10
德意志民主共和国庆祝国庆民主德国全国阵线全国委员会发表宣言号召全德人民为恢复独立、统一而斗争,1951-10-08,1951-10
民主德国再度减低物价西德和柏林西区物价上涨,1951-10-08,1951-10
罗各地人民庆祝建军节,1951-10-08,1951-10
英共发表大选宣言号召在国会选举中击败保守党,1951-10-08,1951-10
曼谷华侨报纸号召全体侨胞在祖国光辉旗帜下团结起来,1951-10-08,1951-10
巨港华侨庆祝国庆大会贺电,1951-10-08,1951-10
平壤各界华侨举行盛大集会决进一步开展抗美援朝运动,1951-10-08,1951-10
英属毛律休斯岛鲁易士港华侨庆祝国庆筹委会贺电,1951-10-08,1951-10
留英中国学生总会贺电,1951-10-08,1951-10
坚守六一四高地,1951-10-08,1951-10
我守住了二三八高地,1951-10-08,1951-10
两年来的德意志民主共和国,1951-10-08,1951-10
予美军所谓“秋季攻势”以严重打击朝中人民部队续歼敌五千五天毁敌战车九辆击落击伤敌机二十三架我某部在夜月山天德山大量杀伤进犯美军,1951-10-09,1951-10
美军冒险进攻损失惨重美国反动舆论极感恐慌,1951-10-09,1951-10
斯大林的谈话严重地警告帝国主义苏联能够以原子武器回答原子武器德波捷匈罗保报纸赞扬斯大林对真理报记者谈话,1951-10-09,1951-10
法国《人道报》著文揭露美派遣日军官二百名指挥李承晚匪军作战,1951-10-09,1951-10
华东人民按期缴纳武器捐款全区达五千九百八十余亿元,1951-10-09,1951-10
中华全国民主妇女联合会举行茶会热烈欢迎各地来京观礼的妇女代表,1951-10-09,1951-10
匈人民观礼代表团团长向我全国妇联等献礼,1951-10-09,1951-10
我保卫世界和平反对美国侵略委员会邀各国人民观礼代表团举行座谈会彭真副主席向外宾详尽介绍了我国土地改革的成就人民银行行长南汉宸介绍我国经济恢复与发展情况,1951-10-09,1951-10
全国青联和青年团中央欢迎各国青年代表,1951-10-09,1951-10
人民革命老根据地礼品文物展览会开幕,1951-10-09,1951-10
苏联人民观礼代表团昨赴华东参观访问,1951-10-09,1951-10
越访华代表团及观礼代表团昨赴东北等地参观黄国越团长谈在北京的观感,1951-10-09,1951-10
英殖民当局继续迫害我侨胞马来亚华侨千余人返抵广州,1951-10-09,1951-10
捷代表团团长向我青年介绍伏契克斗争历史,1951-10-09,1951-10
我科学技术普及协会和科联招待苏匈科学工作者,1951-10-09,1951-10
参加我国庆节观礼的外宾连日在京参观访问,1951-10-09,1951-10
我们伟大的祖国,1951-10-09,1951-10
全国国营企业清理资产核定资金会议规定国营企业应迅速编制计划核定资金为明年实行计划管理和经济核算制作好准备工作,1951-10-09,1951-10
山西运城专区十四位小麦丰产模范的丰产经验,1951-10-09,1951-10
经济生活简评推广先进的丰产经验,1951-10-09,1951-10
关于劳动保险问题的解答,1951-10-09,1951-10
扩大城乡物资交流，发展工农业生产工人给予农民的礼物——华北区城乡物资交流展览会农业生产资料馆介绍,1951-10-09,1951-10
读者来信,1951-10-09,1951-10
