祝贺我解放军建军二十四周年斯大林大元帅致电毛主席华西列夫斯基、维辛斯基亦电祝贺,1951-08-01,1951-08
金日成将军电贺我建军节,1951-08-01,1951-08
武元甲将军电贺我建军节,1951-08-01,1951-08
我们伟大的祖国,1951-08-01,1951-08
政协全国委员会暨各民主党派“八一”电解放军和志愿军,1951-08-01,1951-08
中国人民志愿军是不可战胜的力量,1951-08-01,1951-08
朱总司令在中国人民解放军建军二十四周年庆祝大会上的讲话,1951-08-01,1951-08
人民解放军建军二十四周年首都隆重举行庆祝大会,1951-08-01,1951-08
中央人民政府访问团出发赴汉口访问南方各老革命根据地人民,1951-08-01,1951-08
波兰国防部长和参谋总长电朱总司令和徐总参谋长祝贺,1951-08-01,1951-08
朝鲜停战谈判会议续讨论确定军事分界线问题,1951-08-01,1951-08
朝中人民部队进行阻击作战十天歼灭进犯敌三千余名,1951-08-01,1951-08
庆祝二十四周年建军节,1951-08-01,1951-08
庆祝“八一”建军节,1951-08-01,1951-08
本报启事,1951-08-01,1951-08
各团体致电祝贺建军节,1951-08-01,1951-08
读者来信,1951-08-01,1951-08
对人民日报读者批评建议的反应济南机务段侵犯人权体罚工人事件已作最后处理,1951-08-01,1951-08
湖南平江年老工人和农民回忆秋收起义,1951-08-01,1951-08
回忆“八一”南昌起义,1951-08-01,1951-08
在井冈山上,1951-08-01,1951-08
南昌城头红旗飘扬,1951-08-01,1951-08
革命故乡井冈山区的新面貌,1951-08-01,1951-08
我怎样写《长征》,1951-08-01,1951-08
正确进行优抚工作的检查,1951-08-01,1951-08
首都各大工厂检查修订爱国公约的运动,1951-08-01,1951-08
我们怎样订好了家庭爱国公约？,1951-08-01,1951-08
志愿军归国代表在西南,1951-08-01,1951-08
张北人民的大喜事——访志愿军某部功臣姚盛的家庭,1951-08-01,1951-08
志愿军来信给祖国的工人兄弟们,1951-08-01,1951-08
向大家推荐《保卫和平》杂志,1951-08-01,1951-08
写给志愿军北京石景山发电厂刘德珍小组向志愿军报告六月份工作成绩,1951-08-01,1951-08
抗美援朝动态,1951-08-01,1951-08
庆祝中国人民解放军伟大的建军节！,1951-08-01,1951-08
庆祝中国人民解放军伟大的建军节向毛主席朱总司令致敬！,1951-08-01,1951-08
革命烈士及革命军人家属感到无尚的光荣和幸福！,1951-08-01,1951-08
寻人名单革命军人家属寻找革命军人,1951-08-01,1951-08
祝贺中国人民军队创建二十四周年朝祖国战线致电志愿军朝鲜保卫相电朱总司令致贺,1951-08-02,1951-08
庆祝中国人民解放军建军节朝鲜人民热烈慰问我志愿军武元甲号召越人民军学习我解放军经验,1951-08-02,1951-08
匈牙利国防部长电贺我解放军建军节,1951-08-02,1951-08
朝鲜停战谈判会议续讨论确立军事分界线问题,1951-08-02,1951-08
华东军区暨三野的战斗英雄和模范写信向毛主席和朱总司令致敬报告执行建设现代化国防军任务的成绩,1951-08-02,1951-08
十七个民族组成的某团指战员向毛主席朱总司令报告守卫边防的决心,1951-08-02,1951-08
北京市总工会等人民团体写信向解放军志愿军致敬,1951-08-02,1951-08
我们伟大的祖国,1951-08-02,1951-08
在首都庆祝建军节大会上越南人民访华代表团黄国越团长的颂词,1951-08-02,1951-08
在首都庆祝建军节大会上解放军第六汽车制配厂职工代表颂词,1951-08-02,1951-08
全国青联和学联电解放军,1951-08-02,1951-08
全国青联和学联电志愿军,1951-08-02,1951-08
全国文学艺术工作团体贺电,1951-08-02,1951-08
全国人民电贺党的三十周年,1951-08-02,1951-08
有光荣传统的后田村中共支部领导农民增产捐献使农民生产热情大大提高,1951-08-02,1951-08
急于求成草率动工，没有经济核算制度辽东省去年基本建设浪费很大今年该省工业厅已接受教训慎重从事,1951-08-02,1951-08
河南省的售棉储棉工作,1951-08-02,1951-08
邢台专区各县售棉储棉工作很不平衡有些县份领导干部忽视购棉储棉的现象应即纠正,1951-08-02,1951-08
经济生活动态,1951-08-02,1951-08
读者来信,1951-08-02,1951-08
努力学习毛主席的军事思想,1951-08-02,1951-08
我要永远做一个光荣的战斗员,1951-08-02,1951-08
永远保持人民给我的光荣，握紧枪杆保卫伟大的祖国！——第一野战军兼西北军区战斗英雄张保英“八一”广播词,1951-08-02,1951-08
十七勇士强渡大渡河,1951-08-02,1951-08
我怎样成长为英雄,1951-08-02,1951-08
突破乌江天险,1951-08-02,1951-08
印尼共产党发表声明抨击美国单独对日和约草案印尼四十三万以上人民已参加和平公约宣言签名,1951-08-02,1951-08
美反动舆论公开承认美图利用日本侵略中国苏联,1951-08-02,1951-08
朝鲜《劳动新闻》斥美干涉军煽动战火越通讯社指出美方缺乏和平诚意,1951-08-02,1951-08
瑞士驻华公使昨举行国庆招待会,1951-08-02,1951-08
美国工人日报社论指出美反动派企图破坏停战谈判,1951-08-02,1951-08
支援前线、巩固胜利朝鲜后方广大工人展开爱国生产竞赛,1951-08-02,1951-08
国际电影赛会胜利结束并举行授奖仪式我国影片《钢铁战士》荣获和平奖特等奖授给苏联影片《金星骑士》,1951-08-02,1951-08
美国会通过新“国防生产”法较原订法律更利于战争投机商人,1951-08-02,1951-08
全意海港工人举行和平大会决定举行地中海区国际和平大会,1951-08-02,1951-08
关于第三届世界青年与学生和平联欢节世界民主青联书记处发表声明指出联欢节将成为保卫和平反对战争的盛会,1951-08-02,1951-08
苏联畜牧业蓬勃发展许多地区提前完成三年计划,1951-08-02,1951-08
拉丁美洲人民继续签名拥护缔结和平公约宣言,1951-08-02,1951-08
保证条条铁路通向前方,1951-08-02,1951-08
疯狂掠夺,1951-08-02,1951-08
国际动态,1951-08-02,1951-08
朝停战谈判会议续讨论军事分界线问题我方驳斥美方无理要求指出美方主张违反公平合理的原则，因而绝不可能被接受。,1951-08-03,1951-08
美方无理拒绝以三八线为军事分界线，值得全世界人民注视和警惕。——新华社记者评述开城会议一周来毫无进展,1951-08-03,1951-08
美机继续疯狂炸平壤被人民军击落十二架美陆空军续残害朝和平人民,1951-08-03,1951-08
朝鲜停战谈判进行期间美策划继续占我台湾,1951-08-03,1951-08
美国利用日本战犯训练蒋匪军阴谋组织特务机构进行反苏反共活动指使蒋匪利用日船及旧海军人员妄图骚扰我沿海,1951-08-03,1951-08
全国各地军民热烈庆祝建军节广大人民保证完成捐献计划做好优抚工作,1951-08-03,1951-08
中央公安部公布华侨出入国境暂行办法,1951-08-03,1951-08
祝贺我解放军建军二十四周年朝人民军致电我志愿军进一步加强战斗友谊粉碎敌人任何阴谋,1951-08-03,1951-08
京津沪各报记者报道开城会议称三八线应作为军事分界线揭露美方对朝鲜停战谈判缺乏诚意,1951-08-03,1951-08
全国人民电贺党的三十周年,1951-08-03,1951-08
中央人民政府公安部布告公边警字第一七七号,1951-08-03,1951-08
我们伟大的祖国,1951-08-03,1951-08
中央轻工业部所属部分工厂资金没有核定造成许多浪费现正排除各种思想顾虑开展核定资金工作,1951-08-03,1951-08
石家庄市企业局所属工厂开展核定资金工作克服资金积压现象有的单位还应纠正本位思想,1951-08-03,1951-08
政务院财政经济委员会命令,1951-08-03,1951-08
国营企业资产清理及估价暂行办法,1951-08-03,1951-08
国营企业资金核定暂行办法,1951-08-03,1951-08
好好学习《武训历史调查记》,1951-08-03,1951-08
应当重视《武训历史调查记》,1951-08-03,1951-08
建议拍摄《宋景诗和武训》影片和绘制连环画,1951-08-03,1951-08
欢迎象《新人村》这样的记录片,1951-08-03,1951-08
张云溪给京剧界朋友们的一封信,1951-08-03,1951-08
苏北各地的夜党校工作,1951-08-03,1951-08
机关团体任意抽调学生西南各地学校教育陷于混乱,1951-08-03,1951-08
克服学校教育的混乱现象,1951-08-03,1951-08
发展中的华北区民校,1951-08-03,1951-08
关于资本主义总危机,1951-08-03,1951-08
朝鲜平安南道与平壤各界人民举行盛会庆祝我建军节向我志愿军致敬大会致电毛主席祝贺,1951-08-03,1951-08
参加世界青年和平联欢节我青年代表团抵柏林,1951-08-03,1951-08
日本和平运动增长人民热烈争取全面媾和,1951-08-03,1951-08
“中国人民的光荣和骄傲”红星报发表罗波达文章庆祝我建军节,1951-08-03,1951-08
马立克建议获得美国人民拥护有力地打击了美扩军备战计划马歇尔在参院作证时招认大伤脑筋,1951-08-03,1951-08
拼凑北大西洋集团侵略军遭遇严重困难美建议召开美英法会议加紧武装西德,1951-08-03,1951-08
美国正指使西德傀儡政府加紧编组所谓“边防部队”,1951-08-03,1951-08
国际动态,1951-08-03,1951-08
坚决反对美帝国主义分裂德国的政策——波茨坦协定六周年,1951-08-03,1951-08
朝鲜停战谈判第十八次会议南日将军继续驳斥美方案重申确立三八线为军事分界线的合理主张,1951-08-04,1951-08
在我人民政协全国委员会上黄国越报告越南人民英勇斗争中国革命的胜利予越南人民以莫大鼓舞,1951-08-04,1951-08
天津市天主教革新运动促进会发表告全国教友书揭露帝国主义利用宗教掩护反革命活动拥护政府取缔天主教内反动组织“圣母军”,1951-08-04,1951-08
天津近二千“圣母军团员”退出反动组织交出的证件充分暴露“圣母军”的反革命罪行,1951-08-04,1951-08
西康军区康定军分区藏民团成立,1951-08-04,1951-08
南方老根据地访问团由汉口分赴各地访问,1951-08-04,1951-08
中国少年儿童队西北区夏季旅行代表队和东北儿童旅行团抵京,1951-08-04,1951-08
政务院举行会议,1951-08-04,1951-08
我们伟大的祖国,1951-08-04,1951-08
加强抗美援朝继续开展增产捐献运动西南献机达一百九十架唐山专区已增产捐献百余亿元,1951-08-04,1951-08
上海工商联推动各行业订立具体办法争取早日完成献机初步目标深入爱国主义宣传制订详细缴款办法,1951-08-04,1951-08
政务院政治法律委员会关于筹设中央政法干部学校方案（一九五一年七月二十日政务院第九十四次政务会议批准）,1951-08-04,1951-08
开城的孩子们极度仇视美国侵略军,1951-08-04,1951-08
北京各界欢迎越南人民访华团,1951-08-04,1951-08
“圣母军”——人民的死敌,1951-08-04,1951-08
全国人民电贺党的三十周年,1951-08-04,1951-08
中央防汛总指挥部发布防汛指示,1951-08-04,1951-08
清理资材，核定资金，反对浪费！要从国家全面利益出发做好清理资材核定资金工作,1951-08-04,1951-08
河北七月中旬购棉储棉数字急剧下降中共河北省委指示各级党委采取五项措施纠正单打一的工作方法动员全党做好这一工作,1951-08-04,1951-08
怎样才能做好工程设计？,1951-08-04,1951-08
读者来信,1951-08-04,1951-08
读《武训历史调查记》,1951-08-04,1951-08
为烈属军属服务的好榜样——记成都市五金电器业的长期劳动服务队,1951-08-04,1951-08
幸福的晚年——访新乡市的五位老年军属,1951-08-04,1951-08
语法、修辞讲话（第三讲）,1951-08-04,1951-08
重视政府出版物的勘校工作—中央政法公报社论—,1951-08-04,1951-08
文化生活动态,1951-08-04,1951-08
他们在昼夜不停地工作着（治淮速写之一）,1951-08-04,1951-08
美国人民要求立即结束朝鲜战争纽约《工人日报》主张把朝鲜交给朝鲜人反对美军继续留在朝鲜保存紧张的局势,1951-08-04,1951-08
美国扩军计划的恶果通货膨胀剧烈人民购买力下降民用生产削减失业的人数激增,1951-08-04,1951-08
世界青年联欢节筹委会宣布联欢节节目,1951-08-04,1951-08
美国反动统治集团内部因侵朝失败继续争吵塔夫脱猛烈抨击杜鲁门政府,1951-08-04,1951-08
印度人民庆祝我建军节新德里举行展览会介绍解放军,1951-08-04,1951-08
我驻苏大使馆举行酒会庆祝建军节宾主举杯为毛主席斯大林的健康干杯,1951-08-04,1951-08
苏联各报以显著地位刊登我庆祝建军节大会消息,1951-08-04,1951-08
捷波等国报刊庆祝我建军节歌颂中国人民解放军,1951-08-04,1951-08
阿根廷和平拥护者举行二届全国和平大会,1951-08-04,1951-08
国际动态,1951-08-04,1951-08
世界青年与学生和平联欢节前夕,1951-08-04,1951-08
美方缺乏和平诚意停战谈判期间继续胁迫仆从国家增兵侵朝,1951-08-05,1951-08
开城前线我志愿军庆祝建军节提高警惕性决为朝鲜和平奋斗许多连队演出文娱节目讽剌美侵略者“海空军优势”,1951-08-05,1951-08
平壤华侨响应祖国号召展开捐献飞机大炮运动,1951-08-05,1951-08
我们伟大的祖国,1951-08-05,1951-08
对停战谈判缺乏诚意暴露无遗美方竟提荒谬无理要求借口海空军“威力”要挟将分界线向北移中外记者揭露美方阴谋拥护我合理主张,1951-08-05,1951-08
全国人民电贺党的三十周年,1951-08-05,1951-08
充分发挥潜在能力是人民电业的经营方针,1951-08-05,1951-08
把分散的手工业者逐步组织起来！全国合作社第一次手工业生产工作会议决定今后手工业生产合作社发展方针,1951-08-05,1951-08
山东召开工业基本建设工作会议批判各种错误思想决心不再草率从事,1951-08-05,1951-08
急于求成，设计不确，欲速不达东北某厂石炭酸工程中途停工,1951-08-05,1951-08
“严重的问题是教育农民”——记上泉村棉农售棉经过,1951-08-05,1951-08
中央劳动部和卫生部指示各厂矿、企业改进夏秋季节职工卫生保健工作全国总工会通知各级工会发动职工大力协助,1951-08-05,1951-08
彻底消灭蚜害，争取棉花丰收！,1951-08-05,1951-08
单纯技术观点在工作上必然表现为雇佣观点——对陈有功同志的信的意见,1951-08-05,1951-08
厦门电灯公司按装柴油机事先设计不周密造成损失,1951-08-05,1951-08
对人民日报批评建议的反应中国人民银行总行及北京分行对于宣传有奖储蓄中的非政治化倾向的检讨,1951-08-05,1951-08
华东军政委员会关于认真贯彻婚姻法的指示,1951-08-05,1951-08
华东一年来执行婚姻法的情况,1951-08-05,1951-08
不问政治是极其危险的倾向——介绍斯大林著《论党工作的缺点和消灭托洛茨基两面分子及其他两面分子的办法》,1951-08-05,1951-08
坚决贯彻执行婚姻法上海解放日报社论,1951-08-05,1951-08
文化生活动态,1951-08-05,1951-08
治淮妇女队（治淮速写之二）,1951-08-05,1951-08
东欧各人民民主国家热烈庆祝我人民解放军建军节各报一致赞扬我人民解放军力量强大,1951-08-05,1951-08
罗马尼亚武装部队部部长电贺我八一建军节阿尔巴尼亚妇联主席来电致贺,1951-08-05,1951-08
庆祝中国人民解放军建军节我驻印度瑞士使馆举行招待会,1951-08-05,1951-08
全国民主妇联集会欢迎越南人民访华团,1951-08-05,1951-08
加渔业工会书记谈话斥美制对日和约草案指出美图侵夺加拿大渔业利益,1951-08-05,1951-08
在美日反动派血腥统治下日本学生境况悲惨北海道学生反对美国驻兵,1951-08-05,1951-08
越南人民军在边和省歼法军一连缴获甚多法伪军大批向越人民军投诚,1951-08-05,1951-08
法国政府危机长期延续法反动阵营更加混乱大选七周后仍拼凑不成政府,1951-08-05,1951-08
苏联《新闻》杂志第二期内容介绍,1951-08-05,1951-08
参加世界青年与学生和平联欢节各国代表团陆续到达柏林,1951-08-05,1951-08
“醉翁之意不在酒”,1951-08-05,1951-08
国际动态,1951-08-05,1951-08
李蓝丁和她的手术队在朝鲜前线,1951-08-05,1951-08
开城我方权威人士指出美方制造僵局企图拖延和破坏谈判,1951-08-06,1951-08
美国企图保持紧张国际局势以实现其片面对日媾和阴谋这是美国竭力阻挠朝鲜停战谈判的丑恶目的之一,1951-08-06,1951-08
美方借口偶发事件拖延朝鲜停战谈判昨日会议未能按期举行,1951-08-06,1951-08
我国各报刊记者自开城报道美方坚持无理要求致使会议陷于僵局,1951-08-06,1951-08
新华社特派记者关于开城会议的述评,1951-08-06,1951-08
朝鲜各报谴责美方采取拖延态度使停战谈判会议再度陷入僵局,1951-08-06,1951-08
美国空中强盗接连滥炸朝鲜城乡居民朝鲜名诗人赵基天被美机炸死,1951-08-06,1951-08
我们伟大的祖国,1951-08-06,1951-08
全国人民电贺党的三十周年,1951-08-06,1951-08
全国国营煤矿上半年生产任务超额完成大同煤矿刘五宗赵有两小组创快速掘进全国最高纪录,1951-08-06,1951-08
关于购棉中的物资供应工作,1951-08-06,1951-08
经济生活动态,1951-08-06,1951-08
检查工程负责干部和技术人员中的主观主义思想,1951-08-06,1951-08
必须老老实实学习——对陈有功同志的信的意见,1951-08-06,1951-08
拥护政府严惩贪污犯！,1951-08-06,1951-08
中国粮食公司石家庄分公司全体职工进行反贪污学习,1951-08-06,1951-08
工人送水闸（治淮速写之三）,1951-08-06,1951-08
天津市自来水公司党组织在爱国生产竞赛中的思想领导工作,1951-08-06,1951-08
中共中央西南局大力纠正学校工作中的混乱现象,1951-08-06,1951-08
朝城县第七届各界人民代表会议的成就,1951-08-06,1951-08
中共中央华东局指示有关机关纠正学校教育中的混乱现象,1951-08-06,1951-08
不纯洁不健康的译文举例,1951-08-06,1951-08
金业勤为什么参军？,1951-08-06,1951-08
文化生活动态,1951-08-06,1951-08
英广大群众强烈不满工党政府扩军备战英职工大会年会所有提案均要求制止物价上涨并主张工党政府应谋取大国协议实行全面裁军,1951-08-06,1951-08
英国物价扶摇直上工人要求增加工资,1951-08-06,1951-08
费尔顿夫人出版“朝鲜见闻录”揭露侵朝美军暴行号召英人民争取朝鲜停战实现,1951-08-06,1951-08
真理报驻伦敦记者揭露英国“民主”的实质,1951-08-06,1951-08
向正确方向迈进的一步苏联“新闻”杂志第二斯社论,1951-08-06,1951-08
越南“人民周刊”发表社论赞扬我军伟大胜利,1951-08-06,1951-08
参加世界青年与学生和平联欢节苏、罗代表团筹备许多节目和礼物美国指使破坏联欢节的间谍分子被逮捕,1951-08-06,1951-08
“无稽谰言的承办商”——萨斯拉夫斯基在真理报上的小品文,1951-08-06,1951-08
反对西德重新军国主义化柏林西区人民投票继续举行,1951-08-06,1951-08
柏林西区许多工厂竟变成美国兵工厂,1951-08-06,1951-08
三兄弟,1951-08-06,1951-08
国际动态,1951-08-06,1951-08
美军在谈判期间加紧攻击行动中朝部队坚决打击进犯敌十天歼敌五千余毁美机百架,1951-08-07,1951-08
金日成彭德怀两将军答复李奇微我已再度命令我方警卫部队不进入开城会址区望李奇微接到答复后即令其代表团来开城复会,1951-08-07,1951-08
全世界青年保卫和平的伟大示威三届世界青年和平联欢节开幕我国与苏联朝鲜的代表团受到全场欢呼,1951-08-07,1951-08
志愿军某部领导机关嘉奖有功连队,1951-08-07,1951-08
美方代表仍未来开城停战谈判会议昨又未能举行,1951-08-07,1951-08
朝鲜人民军最高司令部中国人民志愿军司令部权威方面揭露美方所提军事分界线真相希望世界人民对美国这种阴谋严重注意,1951-08-07,1951-08
美方借口偶发事件不来开会是有意阻挠会议的又一明证我方绝未因美方数次有意破坏中立区的行动，而停止开会。,1951-08-07,1951-08
美政府竭力阻挠朝鲜停战谈判企图使国会通过庞大备战费用,1951-08-07,1951-08
“美国和平十字军”号召国内人民反对美政府阻挠谈判,1951-08-07,1951-08
我们伟大的祖国,1951-08-07,1951-08
在第三届世界青年与学生和平联欢节开幕典礼上的演说,1951-08-07,1951-08
全国人民电贺党的三十周年,1951-08-07,1951-08
购棉储棉和其他中心工作结合的范例——苏北如东县新民乡购棉储棉工作和生产防汛结合,1951-08-07,1951-08
工农联盟的伟大力量——记修建润河集分水闸的工人和民工,1951-08-07,1951-08
治淮工程中涌现了一万多名劳动模范,1951-08-07,1951-08
领导机关不够认真负责·勘查设计粗枝大叶潮白河牛牧屯引河口门部分工程被冲毁华北水利工程局已进行检查并作检讨,1951-08-07,1951-08
经济生活动态,1951-08-07,1951-08
专靠包商是做不好工程建设的——记西北铁路干线工程局盲目依靠包商的恶果,1951-08-07,1951-08
读者来信,1951-08-07,1951-08
论反对日本帝国主义的策略（一九三五年十二月二十七日）,1951-08-07,1951-08
中国工农红军长征路线图,1951-08-07,1951-08
进一步推进爱国公约运动各地检查修订爱国公约,1951-08-08,1951-08
新华社特派记者揭露美方借故拖延谈判真相李奇微在军事分界线问题上理屈词穷，又一次小题大做，重演拖延时间故技。,1951-08-08,1951-08
美国政府缺乏和平解决朝鲜战争诚意杜鲁门等连续发表挑衅言论,1951-08-08,1951-08
美方代表昨又不来开城显系故意拖延会议开城人士极表愤慨,1951-08-08,1951-08
朝鲜停战谈判期间美机继续侵入我领空半个月内达三十九次,1951-08-08,1951-08
美统治集团害怕和平,1951-08-08,1951-08
我们伟大的祖国,1951-08-08,1951-08
全国人民电贺党的三十周年,1951-08-08,1951-08
加强党对爱国公约运动的领导,1951-08-08,1951-08
山西省许多厂矿仍未重视基本建设检查工作该省工业厅组织检查组到晋南各厂及富家滩煤矿检查,1951-08-08,1951-08
应当重视对基本建设的检查,1951-08-08,1951-08
购棉储棉中要注意发动妇女,1951-08-08,1951-08
经济生活动态,1951-08-08,1951-08
读者来信,1951-08-08,1951-08
对人民日报读者批评建议的反应,1951-08-08,1951-08
反人民、反历史的思想和反现实主义的艺术电影《武训传》批判,1951-08-08,1951-08
抓紧时间检查与修订爱国公约,1951-08-08,1951-08
工商界的爱国捐献运动正在深入开展,1951-08-08,1951-08
作传达报告应注意些什么？,1951-08-08,1951-08
揭露美帝国主义真相的几本书,1951-08-08,1951-08
吉林市的爱国公约运动为什么前紧后松？,1951-08-08,1951-08
志愿军来信给参加军事干部学校的同学们,1951-08-08,1951-08
写给志愿军山东牟平县金沟寨乡乡干部给志愿军英雄吕松山的一封信,1951-08-08,1951-08
抗美援朝动态,1951-08-08,1951-08
爱护革命军人做好优抚工作,1951-08-08,1951-08
读者来信专页,1951-08-08,1951-08
新中国的新事物,1951-08-08,1951-08
纠正乱拉干部的无政府状态！,1951-08-08,1951-08
对人民日报读者批评建议的反应,1951-08-08,1951-08
消除乱拉干部的混乱现象,1951-08-08,1951-08
寻人名单革命军人家属寻找革命军人,1951-08-08,1951-08
什维尔尼克答复杜鲁门来信苏联再度建议缔结五大国和平公约,1951-08-09,1951-08
新华社特派记者对开城会议述评三八线是公平合理的分界线美方提出在三八线以北深入我方阵地内建立军事分界线的狂妄要求，使会议陷于停顿状态。,1951-08-09,1951-08
在开城停战谈判期间开城西南礼成江两岸地区竟遭美李海空军狂轰滥炸,1951-08-09,1951-08
李伪军无耻放射毒气炮弹志愿军决予进犯敌沉重打击,1951-08-09,1951-08
在东北进行访问后朝人民访华团返国,1951-08-09,1951-08
全国人民电贺党的三十周年,1951-08-09,1951-08
光明日报记者揭露美方拖延谈判的阴谋,1951-08-09,1951-08
我们伟大的祖国,1951-08-09,1951-08
中国水利建设史上空前辉煌的成就根治淮河第一期工程胜利完成,1951-08-09,1951-08
根治淮河第一年,1951-08-09,1951-08
战胜自然灾害，争取秋季丰收！各地农民坚决进行抗灾斗争,1951-08-09,1951-08
为购棉储棉工作的更大成绩而斗争！邯郸专区坚决争取完成购棉储棉任务,1951-08-09,1951-08
经济生活动态,1951-08-09,1951-08
读者来信,1951-08-09,1951-08
对人民日报读者批评建议的反应山东省导沭整沂委员会现正检查纠正浪费现象,1951-08-09,1951-08
文化生活动态,1951-08-09,1951-08
宁死不屈的八勇士,1951-08-09,1951-08
关于错误宣传党史的检讨,1951-08-09,1951-08
《武训历史调查记》解决了思想问题——记一个座谈会上的发言,1951-08-09,1951-08
语法、修辞讲话（第三讲）,1951-08-09,1951-08
一个值得各地重视的讨论,1951-08-09,1951-08
美政府害怕朝鲜停战实现会松弛北大西洋集团备战既怕战争又怕和平这就是美方无理拖延谈判的原因,1951-08-09,1951-08
我志愿军指战员帮助朝鲜人民生产,1951-08-09,1951-08
我全国文学艺术界联合会电唁朝鲜著名诗人赵基天,1951-08-09,1951-08
印度著名人士发表谈话反对美国武装日本,1951-08-09,1951-08
世界学生夏季运动会在柏林隆重开幕,1951-08-09,1951-08
日本各工会发表声明主张全面媾和坚决反对美制对日和约草案日本农民协会决议保卫和平要求全面和约,1951-08-09,1951-08
