对人民日报读者批评建议的反应川北军区后勤部强购树木一事已作适当处理,1951-08-17,1951-08
一封家信,1951-08-17,1951-08
察哈尔省市机关检查党史学习,1951-08-17,1951-08
北京市人民政府关于民主选举区、村人民政府的指示,1951-08-17,1951-08
配合国家经济及国防建设各自然科学专门学会陆续召开会议,1951-08-17,1951-08
文化生活动态,1951-08-17,1951-08
怎样学习语法、修辞讲话？,1951-08-17,1951-08
平原省各县人民代表会议召开的情况和问题,1951-08-17,1951-08
反对美制单独对日和约草案澳举行反对武装日本抗议周悉尼劳动人民集会抗议政府支持美国单独对日媾和,1951-08-17,1951-08
美亟图奴役日本人民为其侵略政策服务阴谋编练日军接替侵朝美军并侵略亚洲美日反动派加紧扩充和训练日本警察后备队,1951-08-17,1951-08
美统治集团疯狂扩军备战美国物价节节上涨,1951-08-17,1951-08
亚洲各国青年代表举行盛大联欢会各国代表对毛主席深表敬仰与关怀,1951-08-17,1951-08
民主德国全国阵线发表白皮书揭露美英武装西德计划号召人民积极反对帝国主义的战争准备,1951-08-17,1951-08
冲破驻奥美占领军封锁各国青年代表到达柏林,1951-08-17,1951-08
柏林举行德国青年和平战士日二百万德国青年集会示威游行反对重新武装西德·要求在今年内缔结对德和约,1951-08-17,1951-08
国际动态,1951-08-17,1951-08
加强保卫世界和平的斗争——记世界和平理事会执行局赫尔辛基会议——,1951-08-17,1951-08
北京市军事管制委员会军法处判决美国特务间谍阴谋武装暴动案主犯李安东、山口隆一判处死刑昨已执行枪决,1951-08-18,1951-08
我们伟大的祖国,1951-08-18,1951-08
中国人民解放军北京市军事管制委员会军法处判决一九五一年度军判字第一一四六号,1951-08-18,1951-08
全国人民电贺党的三十周年,1951-08-18,1951-08
斩断帝国主义侵略中国的魔爪,1951-08-18,1951-08
苏军解放朝鲜六周年纪念日金日成首相电斯大林大元帅致敬斯大林大元帅致电金日成首相祝贺,1951-08-18,1951-08
朝鲜解放六周年纪念平壤各界隆重集会庆祝,1951-08-18,1951-08
平壤各界庆祝大会向毛泽东主席的致敬电,1951-08-18,1951-08
苏联决定参加旧金山对日和会将提出关于对日和约建议美国集团对此惊慌失措担忧单独媾和阴谋将遭打击,1951-08-18,1951-08
日共国会议员团声明指出苏联参加旧金山会议将争取缔结全面和约,1951-08-18,1951-08
庆祝印尼独立六周年印尼使馆举行招待会,1951-08-18,1951-08
朝鲜停战谈判会议小组委员会举行会议,1951-08-18,1951-08
美机狂炸平壤等城激起朝鲜人民无比愤怒,1951-08-18,1951-08
美国人民支持在三八线停战要美国代表诚心谈判主张立即停止朝鲜军事行动,1951-08-18,1951-08
政务院昨举行会议,1951-08-18,1951-08
缅甸人民反对单独对日媾和缅甸和大召开反对美制对日和约会议决定成立群众运动筹备委员会加强斗争,1951-08-18,1951-08
上海各报发表评论一致拥护周外长声明痛斥美英单独对日和约草案,1951-08-18,1951-08
越南人民军在承天省歼法军一千缴获甚多,1951-08-18,1951-08
天津铁路局第十批援朝职工启程赴朝鲜前线,1951-08-18,1951-08
琉球群岛大东岛以南发现强烈台风向西北方移动,1951-08-18,1951-08
北京市人民政府新闻处启事,1951-08-18,1951-08
读者来信,1951-08-18,1951-08
对人民日报读者批评建议的反应,1951-08-18,1951-08
一封家信,1951-08-18,1951-08
美国特务间谍阴谋暴动的罪证,1951-08-18,1951-08
语法、修辞讲话（第三讲）,1951-08-18,1951-08
北京市人民检察署对美国特务间谍阴谋武装暴动危害中华人民共和国案起诉书京检一字第二十三号,1951-08-18,1951-08
各民主党派一致表示拥护严惩美国特务间谍,1951-08-19,1951-08
对美国特务间谍的正义判决首都各界人民表示热烈拥护认为是中国人民打击帝国主义阴谋一大胜利,1951-08-19,1951-08
东北各界人民拥护严惩美国特务间谍一致表示要加紧抗美援朝工作粉碎美国侵略阴谋,1951-08-19,1951-08
各地人民坚决拥护周外长声明反对美英单独对日媾和对美国重新武装日本愤慨万分,1951-08-19,1951-08
台风向北前进江苏山东沿海应紧急预防,1951-08-19,1951-08
英《工人日报》评军事分界线问题号召人民坚持在三八线停火,1951-08-19,1951-08
美国杂志透露美国故意拖延朝鲜停战谈判以利对日媾和侵占朝鲜钨矿,1951-08-19,1951-08
不愿赴朝作战无谓牺牲驻日美军开小差事件增加,1951-08-19,1951-08
我们伟大的祖国,1951-08-19,1951-08
全国人民电贺党的三十周年,1951-08-19,1951-08
巴黎今晚报记者自开城报道小组委员会举行二次会议无迹象显示谈判有何进展,1951-08-19,1951-08
某些机关从单纯财政观点出发滥伐森林湖南若干林区遭受巨大损失这种破坏国家资源的行为决不能容许继续存在反对浪费木材，反对滥伐林木！,1951-08-19,1951-08
庞家堡矿场土木建筑接连发生了许多浪费反对浪费木材，反对滥伐林木！,1951-08-19,1951-08
主观主义必然造成恶果——石家庄糖厂建厂失败给我的教训,1951-08-19,1951-08
读者来信,1951-08-19,1951-08
全国妇联举行第一次宣传教育工作会议通过关于妇女宣传教育工作的决议,1951-08-19,1951-08
一封家信,1951-08-19,1951-08
关于美国政府间谍在北京阴谋暴动案的感想,1951-08-19,1951-08
彻底消灭美国特务间谍,1951-08-19,1951-08
帝国主义特务间谍的末日,1951-08-19,1951-08
提高警惕，坚决镇压美国特务间谍,1951-08-19,1951-08
肃清美帝国主义特务分子,1951-08-19,1951-08
文化生活动态,1951-08-19,1951-08
我怎样写《谁是最可爱的人》,1951-08-19,1951-08
越南和平委员会发表声明坚决反对美英对日和约草案英报承认日本人民反对美制和约草案,1951-08-19,1951-08
反对美制对日和约草案埃及不参加对日和会,1951-08-19,1951-08
美国霸占日本经济美国资本广泛渗入日本工业在对外贸易上残酷掠夺日本,1951-08-19,1951-08
莫斯科各报刊载周外长声明,1951-08-19,1951-08
决心消除战争威胁建立持久和平全世界四亿三千万以上人民签名要求五大国缔结和平公约,1951-08-19,1951-08
美在朝鲜间谍活动继续遭受严重打击,1951-08-19,1951-08
波兰军事法庭判决美英间谍,1951-08-19,1951-08
我国与各国青年代表团举行联欢会各国代表向中国青年的伟大导师毛泽东致敬,1951-08-19,1951-08
为争取苏美人民友谊而奋斗苏美青年在柏林联欢,1951-08-19,1951-08
各国出席联欢节青年代表举行殖民地青年日声援殖民地人民反帝斗争,1951-08-19,1951-08
借故拖延，加紧赶制,1951-08-19,1951-08
越南民族统一阵线与越南人民革命事业——纪念越南八月革命六周年,1951-08-19,1951-08
美李军又非法侵袭板门店中立区我方联络官提出严重抗议我对此事件保留提出严正要求的权利,1951-08-20,1951-08
新华社特派记者报道朝鲜停战谈判会议揭露美方狡诈横蛮毫无和平诚意,1951-08-20,1951-08
香港英政府要求我新华社香港分社办理登记手续我新闻总署发言人发表谈话指出香港英政府的要求违反国际通例,1951-08-20,1951-08
美《工人日报》促请美国人民要求美军撤离三八线罗德夫人号召加拿大人民促成停战,1951-08-20,1951-08
台风将袭江浙沿海,1951-08-20,1951-08
吴芝圃牛佩琮工作成绩显著政务院注销其警告处分,1951-08-20,1951-08
我们伟大的祖国,1951-08-20,1951-08
英《工人日报》记者自开城报道美方无耻欺骗全世界一切诡计已全被识破,1951-08-20,1951-08
全国人民电贺党的三十周年,1951-08-20,1951-08
把国家预算决算工作提高一步,1951-08-20,1951-08
从经济上把少数民族和全国联结起来！——物资交流工作的开展提高了少数民族的生产热情,1951-08-20,1951-08
木材联合检查组检查结果证实铁道部生计处生记制材厂非法购销木材反对浪费木材，反对滥伐林木！,1951-08-20,1951-08
对基本建设认识不足却又急于求成松江省今年许多工程步调紊乱质量低劣反对浪费木材，反对滥伐林木！,1951-08-20,1951-08
预算决算暂行条例,1951-08-20,1951-08
本报读者纷纷来信拥护周外长的声明反对美制对日和约,1951-08-20,1951-08
遵化县人民政府关于当地群众拆毁长城问题的检查答复对人民日报读者批评建议的反应,1951-08-20,1951-08
中共湖南永明县委工作人员周芝美检讨不重视保管党内文件的错误对人民日报读者批评建议的反应,1951-08-20,1951-08
和冰排搏斗的英雄——志愿军某部工兵班保护桥梁的故事,1951-08-20,1951-08
建立与巩固党的传授站工作,1951-08-20,1951-08
纠正忽视民主政权建设工作的偏向！,1951-08-20,1951-08
人人都来和美国特务间谍作斗争——访中央人民政府最高人民法院沈钧儒院长,1951-08-20,1951-08
文化生活动态,1951-08-20,1951-08
山西省榆社县二届一次人民代表会议为什么能够开好？,1951-08-20,1951-08
日本人民反对美制对日和约草案战争工业中罢工增多农民反对军事基地化日本参加联欢节青年代表谈日本争取全面和约运动,1951-08-20,1951-08
不顾美日反动派的武装镇压与干涉日本青年举行全国代表和平会议决议加强要求全面媾和反对重新武装运动,1951-08-20,1951-08
反对重新武装日本澳新南威尔士工会会员停工抗议美制对日和约,1951-08-20,1951-08
日共等联名发表告人民书抗议反动派迫害联合通讯社,1951-08-20,1951-08
世界青年联欢节授奖我国代表团获得“团结奖”,1951-08-20,1951-08
中德青年的深厚友谊我青年代表收到德国青年许多礼物,1951-08-20,1951-08
各国青年在柏林联欢美英加青年保证尽力制止其本国政府侵略朝鲜的政策,1951-08-20,1951-08
惧怕朝鲜停战会松弛扩军活动美国加紧在西欧备战正布置侵略会议放手武装西德,1951-08-20,1951-08
日本人民的意见,1951-08-20,1951-08
国际动态,1951-08-20,1951-08
夜袭,1951-08-20,1951-08
匈牙利宪法节,1951-08-20,1951-08
全国人民电贺党的三十周年（之一）,1951-08-20,1951-08
全国人民电贺党的三十周年（之二）,1951-08-20,1951-08
全国人民电贺党的三十周年（之三）,1951-08-20,1951-08
全国人民电贺党的三十周年（之四）,1951-08-20,1951-08
美方武装人员违反协议袭击中立区南日将军向乔埃严重抗议痛斥美方一贯破坏协议，坚决要求惩凶并保证不再发生同类事件。,1951-08-21,1951-08
我方代表亲赴板门店附近向姚庆祥烈士致哀连队战士悲愤控诉美李军罪行,1951-08-21,1951-08
民主促进会中央理事会通过宣言拥护周外长声明,1951-08-21,1951-08
庆祝匈牙利宪法颁布两周年匈大使昨举行招待会,1951-08-21,1951-08
山东半岛沿海应紧防台风,1951-08-21,1951-08
掌握棉花季节差价保护棉农利益中央贸易部规定新棉收购办法指示各地向棉农宣传新棉价格推动农民售储陈棉,1951-08-21,1951-08
我们伟大的祖国,1951-08-21,1951-08
东北人民政府工业部关于加强基本建设领导的决定,1951-08-21,1951-08
北京市人民政府发布紧急通告动员全市人民消灭蚊子预防脑炎,1951-08-21,1951-08
全国人民电贺党的三十周年,1951-08-21,1951-08
紧急预防脑炎,1951-08-21,1951-08
中共中央中南局发布指示放手发动工人群众开展民主改革运动,1951-08-21,1951-08
最后肃清工矿行业中的封建残余势力中南区民主改革运动逐步展开,1951-08-21,1951-08
中央贸易部规定百货公司零售业务纪念节日减价办法,1951-08-21,1951-08
黄河中游洪水猛涨防汛总指挥部发出紧急通知下游沿岸紧张动员守护堤防,1951-08-21,1951-08
反对浪费木材，反对滥伐林木！只顾目前局部利益江西木材公司大量滥伐林木有关领导机关应当立即进行检查纠正,1951-08-21,1951-08
黄河下游沿岸各地钻探大堤成绩很好消灭了许多处堤身的隐患,1951-08-21,1951-08
经济生活动态,1951-08-21,1951-08
读者来信,1951-08-21,1951-08
对人民日报读者批评建议的反应抚顺市政府职工消费合作社理监事会主任对于该社违法进行投机买卖的检讨,1951-08-21,1951-08
和冰排搏斗的英雄——志愿军某部工兵班保护桥梁的故事,1951-08-21,1951-08
耶稣会—罗马教廷的别动队,1951-08-21,1951-08
文化生活动态,1951-08-21,1951-08
评五、六、七三个月上海各报对工厂安全卫生设备问题的宣传,1951-08-21,1951-08
纠正《正确地宣传党的历史》一文的一个错误,1951-08-21,1951-08
做好区人民法院工作,1951-08-21,1951-08
各国青年代表宣誓为和平事业斗争到底三届世界青年联欢节胜利闭幕各国代表演说主张五大国缔结和平公约,1951-08-21,1951-08
青年联欢节的誓词,1951-08-21,1951-08
真理报评联欢节闭幕各国青年团结友好决心维护世界和平,1951-08-21,1951-08
庆祝“八月革命”和国庆六周年越南胡志明主席发表告人民书越联战线发布口号号召全力进行抗战,1951-08-21,1951-08
波外长照会美大使波兰将参加旧金山会议,1951-08-21,1951-08
伊朗人民反对向美英屈服伊英石油谈判僵持哈里曼的阴谋活动，暴露了美国对伊朗石油的野心,1951-08-21,1951-08
反对美菲反动派的奴役和压迫菲律宾人民英勇斗争人民解放军获得广大人民支持,1951-08-21,1951-08
美国公布所谓“美菲联防条约草案”图驱策菲律宾人民当侵略炮灰阴谋在“联防”伪装下消除菲人民对武装日本的不满,1951-08-21,1951-08
在第三届世界青年与学生和平联欢节闭幕大会上的演说,1951-08-21,1951-08
美李匪军攻击活动愈益疯狂中朝剖队续予敌严重打击五天歼敌近三千毁伤敌机三十六架,1951-08-22,1951-08
化悲愤为力量捍卫朝鲜和平开城人民隆重追悼姚庆祥烈士向全世界人民控诉美国破坏和平暴行,1951-08-22,1951-08
邓华将军讲话号召加强准备迎击敌人挑衅,1951-08-22,1951-08
越南劳动党中央委员胡松茂逝世中共中央电越南劳动党吊唁越南胡志明主席亲撰祭文沉痛悼念,1951-08-22,1951-08
李相朝将军讲话保证完成烈士遗志为烈士报仇,1951-08-22,1951-08
烈士姚庆祥小传,1951-08-22,1951-08
李相朝、解方两将军慰问负伤战士王仁元王仁元激愤控诉美李军侵入中立区的罪行,1951-08-22,1951-08
志愿军某部英模荣膺“军功章”电金日成首相致谢,1951-08-22,1951-08
台风进抵上海东北三百里处江苏山东半岛等地将有风雨,1951-08-22,1951-08
美英公布所谓“对日和约草案定本”悍然无视中苏及东南亚各国权益企图在旧金山会议上强使各国签字画押,1951-08-22,1951-08
曾遭日寇侵略的东南亚各国舆论反对美英所谓“对日和约草案定本”,1951-08-22,1951-08
我们伟大的祖国,1951-08-22,1951-08
中国人民抗美援朝总会关于执行增产捐献计划、按期缴纳捐款的通知,1951-08-22,1951-08
全国人民电贺党的三十周年,1951-08-22,1951-08
燃料工业部部分直属厂矿核定资金未形成群众性运动有些干部竟认为清理资材已经“差不多了”清理资材，核定资金，反对浪费！,1951-08-22,1951-08
湖南省林业局存在单纯营利观点使华北华东一些煤矿的坑木供应受到严重影响,1951-08-22,1951-08
“咱们鞋厂变样了！”——记太原人民鞋厂民主改革前后,1951-08-22,1951-08
读者来信,1951-08-22,1951-08
中国店员工会武汉市委员会对忽视推行爱国公约的检讨答复对人民日报读者批评建议的反应,1951-08-22,1951-08
急于求成和游击作风是造成许多错误的根源——山西省纺织公司对晋南纺织厂建厂工作的检查报告,1951-08-22,1951-08
和冰排搏斗的英雄——志愿军某部工兵班保护桥梁的故事,1951-08-22,1951-08
“严重的问题是教育农民”记河北省售棉储棉运动中对农民的政治教育工作,1951-08-22,1951-08
检查在售棉储棉中党对农民的政治教育工作,1951-08-22,1951-08
北京师范大学中国大辞典编纂处对“评‘学习辞典’”一文的答复与检讨,1951-08-22,1951-08
浙江定海县忽视民主政权工作借口工作忙延不召开人民代表会议,1951-08-22,1951-08
文化生活动态,1951-08-22,1951-08
语法、修辞讲话（第三讲）,1951-08-22,1951-08
提高抗美援朝宣传报告的思想性——在西南区工作中的几点体会,1951-08-22,1951-08
辽东省推行爱国公约的情况和问题,1951-08-22,1951-08
成都市的爱国公约运动,1951-08-22,1951-08
信箱,1951-08-22,1951-08
把慰问信写得更好一些,1951-08-22,1951-08
“保卫和平”第二期内容介绍,1951-08-22,1951-08
志愿军来信希望继续加强抗美援朝运动,1951-08-22,1951-08
写给志愿军不能让我们最亲爱的人缺乏精神食粮,1951-08-22,1951-08
抗美援朝动态,1951-08-22,1951-08
工农联明的胜利标志,1951-08-22,1951-08
塘沽私营永利化学公司所属工厂安全卫生设备简陋严重影响工人健康,1951-08-22,1951-08
北京私营玉成砖窑厂窑顶失修摔死两名工人建筑工会向该厂资方提出抗议,1951-08-22,1951-08
反对忽视工人生命安全和健康！（编者按）,1951-08-22,1951-08
天津仓库使用不合理造成严重损失该市财经委员会准备根据各单位实际需要予以调整,1951-08-22,1951-08
要注意领导农民开沟排水避免各村间因排水起冲突,1951-08-22,1951-08
晋县等地农村出现高利贷当地政府应即进行调查处理,1951-08-22,1951-08
丰收不忘共产党,1951-08-22,1951-08
人民政府领导我们苗族同胞提高文化,1951-08-22,1951-08
应该重视工人群众的创造热情和智慧本报很多读者来信支持工人杨秀芝的发明创造对人民日报读者批评建议的反应,1951-08-22,1951-08
站起来了的中国人民热爱共产党和毛主席,1951-08-22,1951-08
私营企新橡胶厂资方应端正对待“临时工”的态度,1951-08-22,1951-08
唐山永兴斋鞋店经理虐待学徒当地政府应即予以调查处理,1951-08-22,1951-08
北京朝阳门外蔡记鞋铺工徒控诉该店经理经常打骂学徒,1951-08-22,1951-08
开封市文兴家具铺经理不应阻止学徒加入工会,1951-08-22,1951-08
不能容许资方虐待工人学徒！（编者按）,1951-08-22,1951-08
寻人名单革命军人家属寻找革命军人,1951-08-22,1951-08
美方蓄意破坏朝鲜停战谈判敌机竟轰炸开城会址地区美方对其杀害我军事警察事件无耻抵赖如不速予满意答复我将采取进一步措施,1951-08-23,1951-08
在美英所谓“对日和约草案定本”中暴露美国阴谋侵犯我台湾南威等岛主权中国人民绝对不能容忍美国这种强盗行为,1951-08-23,1951-08
南威岛和西沙群岛介绍,1951-08-23,1951-08
传达毛主席的关怀、深入了解人民生活北方老根据地访问团启程赴延安该团各分团亦先后组成分赴各地访问,1951-08-23,1951-08
台风进抵上海东北四百余里处长江口以北沿海有风雨,1951-08-23,1951-08
北京市继续清理反革命案件四百余件处决反革命罪犯二百余名另一百八十一名罪犯分别判刑或释放,1951-08-23,1951-08
我们伟大的祖国,1951-08-23,1951-08
我们不让你的血白流,1951-08-23,1951-08
云南个旧锡矿新厂废除封建把头制度,1951-08-23,1951-08
武汉第一纱厂深入展开民主改革加强了工人阶级内部的团结为进一步搞好生产准备了必要条件,1951-08-23,1951-08
包工问题十分严重,1951-08-23,1951-08
私营企业工会怎样面向生产？——记天津私营恒源纺织厂的工会工作,1951-08-23,1951-08
拥护人民政府严惩美国特务间谍向北京公安机关人员致敬,1951-08-23,1951-08
国营黄讯区农场领导干部应广泛吸收工人意见切实检查并改进工作,1951-08-23,1951-08
中国共产党在抗日时期的任务,1951-08-23,1951-08
纽约人民举行和平大会要求立即停止朝鲜战争,1951-08-23,1951-08
美国进步党主席宾逊赞成召开五大国会议反对美政府阻碍朝鲜停战谈判,1951-08-23,1951-08
东欧人民民主国家报纸显著刊登我周外长声明,1951-08-23,1951-08
美反动派疯狂迫害美共竟又逮捕六位美共干部被捕者表示决心战斗到底,1951-08-23,1951-08
庆祝越南八月革命和国庆武元甲发布命令,1951-08-23,1951-08
缅学生举行代表大会大会决议反对美制对日和约,1951-08-23,1951-08
日本部分资产阶级报纸怀疑美制对日和约草案,1951-08-23,1951-08
我访苏、访德代表团将赴各地传达报告,1951-08-23,1951-08
全国总工会与全国妇联电贺罗马尼亚解放七周年,1951-08-23,1951-08
罗马尼亚人民的新生活,1951-08-23,1951-08
罗马尼亚解放七周年,1951-08-23,1951-08
美方轰炸开城中立区蓄意谋害我方代表团金日成彭德怀将军提出严重抗议我方自廿三日起宣告停会以待对方作负责处理,1951-08-24,1951-08
美机轰炸扫射开城会址区经过,1951-08-24,1951-08
美李军在朝鲜东部前线发动冒险进攻中朝部队坚强阻击大量歼敌,1951-08-24,1951-08
庆祝罗马尼亚解放七周年罗大使昨举行招待会毛主席周总理分别致电巴洪和格罗查祝贺,1951-08-24,1951-08
美国官方新闻机关和报纸无耻叫嚣为美方破坏谈判继续侵略战争制造空气,1951-08-24,1951-08
人民外交学会在京会员集会讨论对日和约问题一致拥护周外长声明，斥责美国单独媾和阴谋,1951-08-24,1951-08
台风警报已经解除,1951-08-24,1951-08
我们伟大的祖国,1951-08-24,1951-08
优抚工作检查中发现的几个问题,1951-08-24,1951-08
法国今晚报记者等揭露美国谈判是为准备战争,1951-08-24,1951-08
全国人民电贺党的三十周年,1951-08-24,1951-08
英工人日报记者自开城报道美方捏造消息欺骗世界人民抵赖破坏中立区协议的责任,1951-08-24,1951-08
青岛市召开棉纺细纱职工代表会议大力推广郝建秀工作方法如果全国细纱工都像她少出皮辊花全年可增产四万四千四百六十件纱,1951-08-24,1951-08
把郝建秀工作法推广到全国！,1951-08-24,1951-08
郝建秀工作法的好处——在青岛市棉纺细纱职工代表会议上的讲话,1951-08-24,1951-08
推广先进工作方法要和保守思想作斗争——节录郝建秀工作法推广组工作总结,1951-08-24,1951-08
只顾眼前，不顾后果；为了救灾，却是造灾。川南部分地区竟用滥伐山林办法救灾,1951-08-24,1951-08
经济生活动态,1951-08-24,1951-08
读者来信,1951-08-24,1951-08
迎接华北第一次县长会议山西各专区、市、县积极进行准备,1951-08-24,1951-08
和冰排搏斗的英雄——志愿军某部工兵班保护桥梁的故事,1951-08-24,1951-08
青岛市三届三次人民代表会议改进搜集与审查提案办法,1951-08-24,1951-08
普遍迅速地使县人民代表会议代行县人民代表大会职权是当前政权建设的重要任务,1951-08-24,1951-08
影片《钢铁战士》和它获奖的意义,1951-08-24,1951-08
川西很多部门超越组织滥发统计表格造成乡村政权工作严重忙乱现象,1951-08-24,1951-08
文化生活动态《夫妇进行曲》是一部歪曲描写新中国现实的坏影片,1951-08-24,1951-08
朝鲜访华团圆满完成任务返抵平壤元东根发表谈话感谢我国支援向中国人民的伟大领袖毛主席致敬,1951-08-24,1951-08
日本和平战士写信给中国人民愿与中国人民携手团结保卫和平彻底粉碎帝国主义重新武装日本阴谋,1951-08-24,1951-08
日本社会党主席反对美军继续驻日,1951-08-24,1951-08
日劳动人民生活困苦最高工资仅及战前水平一半，贫民被迫出卖儿女,1951-08-24,1951-08
感谢德国政府的热烈招待冯文彬向皮克总统献礼,1951-08-24,1951-08
罗马尼亚《火花报》评我破获美间谍案美帝国主义破坏社会主义阵营各国后方的阴谋遭到无情打击,1951-08-24,1951-08
苏联伟大共产主义建设工程全面进行伏尔加河——顿河运河许多水闸开始按装钢架参加工程的专家与工人提出许多合理化建议,1951-08-24,1951-08
“海空优势”也不过如此——记中国人民志愿军某部特等功臣仵凤龄的谈话,1951-08-24,1951-08
日本“松川事件”被告斋藤千给全中国人民的一封信向中国人民致敬，呼吁中国人民继续声援日本人民的斗争,1951-08-24,1951-08
实现增产捐献计划保卫伟大祖国各地按时缴款购买武器继续修订爱国公约开展爱国增产运动,1951-08-25,1951-08
美机轰炸开城中立区及双方联络官调查详情,1951-08-25,1951-08
美方轰炸会址地区破坏谈判开城军民极为愤怒朝鲜报纸揭露美国扩大侵略阴谋,1951-08-25,1951-08
美国《指南针日报》载文抨击美方破坏谈判没有信义,1951-08-25,1951-08
美国报纸供认美方阻挠谈判是企图先签订单独对日和约,1951-08-25,1951-08
争取各族共同发展和进步！全国民族卫生会议开幕西北民族学院在兰州开学,1951-08-25,1951-08
中央人民政府成立以来首次选派的留苏学生已经分批启程赴苏联,1951-08-25,1951-08
政务院举行会议,1951-08-25,1951-08
