美方有意制造板门店事件破坏停战谈判乔埃以流氓口吻抵赖美方罪责对我方抗议竟无耻反噬以欺骗世界人民,1951-08-25,1951-08
我们伟大的祖国,1951-08-25,1951-08
法国今晚报记者等报道调查美机炸开城暴行美方联络官竟耍无赖,1951-08-25,1951-08
全国人民电贺党的三十周年,1951-08-25,1951-08
西南预购棉花完成超过计划百分之五十,1951-08-25,1951-08
发扬工人阶级在生产上的创造性！集中群众智慧，普遍推广！张淑云工作法使天津恒大烟草厂工作效率普遍提高,1951-08-25,1951-08
全国总工会召开建筑业工会工作会议讨论加强建筑业工会工作提出实行民主管理取消封建把头等办法,1951-08-25,1951-08
加强建筑工会工作——工人日报社论,1951-08-25,1951-08
西北棉花生长良好陕南和关中单位面积产量预计可超过去年一倍,1951-08-25,1951-08
反对浪费木材，反对滥伐林木！吉林黑龙江等省采伐、销售“地方材”损害国家森林引起木材市场混乱,1951-08-25,1951-08
吉林某些矿局干部存在着严重的本位主义思想违反规定滥伐山林浪费木材,1951-08-25,1951-08
张淑云工作法是怎样创造出来的？,1951-08-25,1951-08
中国粮食公司浙江省公司新建仓库全部不适用使国家资财遭受巨大损失,1951-08-25,1951-08
牡丹江森林工业管理局绥阳分局对国家木材资源不负责任订了合同不监督放任滥伐,1951-08-25,1951-08
武训宣传者的谬论破产了,1951-08-25,1951-08
《武训历史调查记》揭露了武训“兴学”的真相,1951-08-25,1951-08
对人民日报读者批评建议的反应北京新民报总编室关于发表《清除旧文艺中的色情毒素》错误文字的检讨,1951-08-25,1951-08
视察察哈尔省政权建设工作以后,1951-08-25,1951-08
和冰排搏斗的英雄——志愿军某部工兵班保护桥梁的故事,1951-08-25,1951-08
建议制止投机出版活动,1951-08-25,1951-08
不能容忍的粗制滥造现象,1951-08-25,1951-08
抄袭之风不可长,1951-08-25,1951-08
语法、修辞讲话（第三讲）,1951-08-25,1951-08
罗马尼亚热烈庆祝解放七周年布加勒斯特举行盛大阅兵和游行斯大林致电罗部长会议主席祝贺,1951-08-25,1951-08
日本全面媾和爱国运动协议会发表声明反对日本在美英和约草案上签字愿与亚洲人民团结一致反对单独媾和,1951-08-25,1951-08
日本推进和平国民会议成立发起签名反对美日军事协定,1951-08-25,1951-08
奄美大岛居民绝食反对美制对日和约,1951-08-25,1951-08
美国指使吉田政府追拨巨款扩充和武装警察后备队美利用特务重光葵进行侵略,1951-08-25,1951-08
法国民主报纸著论欢迎苏联参加旧金山会议斥美国和约草案是战争条约,1951-08-25,1951-08
美进步党提出竞选共同纲领决团结美国民主力量争取和平及民主权利,1951-08-25,1951-08
我国出版的《人民中国》杂志受到苏联广大社会人士赞扬,1951-08-25,1951-08
布加勒斯特庆祝苏军解放罗马尼亚七周年纪念大会上苏代表团团长伏罗希洛夫的演说,1951-08-25,1951-08
祝贺中共三十周年,1951-08-25,1951-08
中国的少年儿童队员在“台尔曼少年先锋共和国”中,1951-08-25,1951-08
中国人民解放军北京市军事管制委员会军法处布告,1951-08-25,1951-08
我代表团发言人揭穿乔埃报告完全歪曲事实自相矛盾严斥美国方面无耻抵赖谋杀责任人们由此可以加深认识：美国卑鄙和野蛮的行为是蓄意破坏开城的停战谈判,1951-08-26,1951-08
对美机轰炸开城中立区的严重暴行李奇微竟矢口抵赖蛮横透顶美方破坏谈判的恶毒阴谋已昭然若揭,1951-08-26,1951-08
美方夸大海空军威力自打耳光美反动报纸和军事当局早已招供海空军不能独立解决战斗,1951-08-26,1951-08
我们伟大的祖国,1951-08-26,1951-08
英国工人日报记者报道美故意炸开城制造紧张局势迫使其附庸国在旧金山就范,1951-08-26,1951-08
全国人民电贺党的三十周年,1951-08-26,1951-08
中央人民政府政务院关于成立塘沽建港委员会的决定,1951-08-26,1951-08
中央内务部发出通报表扬察哈尔省优抚工作,1951-08-26,1951-08
美国的谋杀者给世界的教训,1951-08-26,1951-08
唐山发电厂基本消灭责任事故,1951-08-26,1951-08
采伐利用不合理·随便烧山垦荒西南不少县区大量破坏山林浪费木材,1951-08-26,1951-08
保护森林·节省木材川北阆中提倡烧煤,1951-08-26,1951-08
加强政治思想教育与提高技术工作相结合哈尔滨工程处克服工程中的浪费现象,1951-08-26,1951-08
赣西南人民造纸厂用竹浆代替木浆成功可节约大量木材并为数万农民的副业生产解决了销路问题,1951-08-26,1951-08
济南化工厂职工关怀棉农生产积极改进工作方法钻研技术突击完成杀虫药二十一万斤,1951-08-26,1951-08
由兴石建筑公司偷工减料谈起,1951-08-26,1951-08
本报读者纷纷来信谴责美方破坏朝鲜停战谈判,1951-08-26,1951-08
一○三厂对待基本建设不严肃把添制鼓风炉说成大修理设计施工中发生了许多问题,1951-08-26,1951-08
电影放映队应该多多下乡宣传,1951-08-26,1951-08
翻译影片的片名应该改进,1951-08-26,1951-08
报纸应注意广告的政治性,1951-08-26,1951-08
文化生活动态,1951-08-26,1951-08
和冰排搏斗的英雄——志愿军某部工兵班保护桥梁的故事,1951-08-26,1951-08
从《武训传》的批判检讨我在上海文化艺术界的工作,1951-08-26,1951-08
读“爱国诗人杜甫传”,1951-08-26,1951-08
人民尊敬革命烈士的母亲,1951-08-26,1951-08
世界民主青联理事会会议在柏林举行讨论世界青年争取和平新任务冯文彬报告中国人民保卫和平的斗争成就,1951-08-26,1951-08
纽约“青年和平委员会”要求停止朝鲜战争,1951-08-26,1951-08
开城停战谈判以来美机连炸平壤居民区,1951-08-26,1951-08
美《纽约时报》记者承认汉城人民仇视美国侵略军丹麦医生报道南朝鲜人民惨况,1951-08-26,1951-08
美国坚持蛮横无理要求竟图侵占朝鲜钨矿锰矿,1951-08-26,1951-08
泰“政治周报”发表论文要求撤退侵朝泰军,1951-08-26,1951-08
英职工反对备战政策职工大会年会许多工会提案反对武装德日要求增加工资,1951-08-26,1951-08
美国独占资本家惧怕朝鲜停战谈判力图以加紧备战挽救经济危机,1951-08-26,1951-08
庆祝解放七周年罗政府举行招待会,1951-08-26,1951-08
国际动态,1951-08-26,1951-08
朝鲜的文化是摧毁不了的,1951-08-26,1951-08
中朝部队坚强阻击美李侵略军歼敌九千毁伤敌机卅架,1951-08-27,1951-08
美帝国主义威胁我国安全又一证明！美机接连入侵我国江浙沿海美国政府蓄意要以战争终止停战谈判我国人民必须努力继续加强巩固国防,1951-08-27,1951-08
美李匪军再袭开城中立区被我击退种种事实证明李奇微部署中止朝鲜停战谈判,1951-08-27,1951-08
法国今晚报记者报道美机轰炸开城罪证确凿揭露美联络官无耻歪曲事实,1951-08-27,1951-08
我人民志愿军某部举行庆功选模大会英雄们表示决心为和平战斗,1951-08-27,1951-08
美机轰炸开城系谋杀我方代表团我方代表团宣布详细调查结果,1951-08-27,1951-08
我国三大青年团体拥护周外长声明反对美国单独对日媾和,1951-08-27,1951-08
辽西省开原铁岭两县暴雨成灾党政机关紧急抢救大部灾民脱险人民空军出动空投物资营救灾民,1951-08-27,1951-08
上海各报痛斥美机挑衅罪行美国如不低头认罪必然受到严厉惩罚,1951-08-27,1951-08
印尼华侨回国观光在广州上海均受到热烈欢迎,1951-08-27,1951-08
我们伟大的祖国,1951-08-27,1951-08
继续增产捐献巩固国防西南人民增献飞机十三架石家庄市工商界集体缴纳十一亿余元,1951-08-27,1951-08
我们参加了抢救灾民的工作,1951-08-27,1951-08
全国人民电贺党的三十周年,1951-08-27,1951-08
充分发动工人群众，彻底实行民主改革！开封私营天同纱厂的事实证明私营企业也应进行民主改革该厂斗争了封建残余分子，劳资协商废除了不合理的旧制度，工人生产情绪提高。,1951-08-27,1951-08
山西富家滩煤矿检查基本建设,1951-08-27,1951-08
提高货币收支计划的准确性！——两个例子的鲜明对比,1951-08-27,1951-08
杭州开展民主改革运动后工人觉悟提高“吐苦水，伸冤气，斗倒恶霸；抬起头，挺起胸，搞好生产！”,1951-08-27,1951-08
对于广西良凤江水利工程崩溃事件的检讨,1951-08-27,1951-08
拥护周外长的声明反对美制对日和约,1951-08-27,1951-08
山西窑业总厂建筑轮窑发生错误领导干部强调困难原谅自己这是对国家人民不负责的态度,1951-08-27,1951-08
反对歪曲中朝人民友谊的作品,1951-08-27,1951-08
希望把《鸡毛信》一类好的儿童文学拍摄电影,1951-08-27,1951-08
从讨论武训问题我们学到些什么,1951-08-27,1951-08
“一把米运动”,1951-08-27,1951-08
文化生活动态,1951-08-27,1951-08
美英进步党派团体发表声明表达美英人民要求和平愿望费尔顿夫人痛斥美国飞机轰炸开城,1951-08-27,1951-08
中国人民革命胜利鼓舞了土耳其人民希克梅特畅谈对新中国的热爱,1951-08-27,1951-08
朝鲜后方各地人民继续捐献支援前线,1951-08-27,1951-08
土耳其决定不再派兵赴朝鲜,1951-08-27,1951-08
美、加进步报纸评称美制和约阴谋扩大亚洲侵略,1951-08-27,1951-08
泰反动政府开始检查华侨邮件严重侵犯我华侨合法权益,1951-08-27,1951-08
捷“红色权利报”发表评论斥美制对日和约草案,1951-08-27,1951-08
在重税盘剥及物价高涨压迫下日本人民自杀事件激增,1951-08-27,1951-08
美国强力破坏东西欧贸易英经济遭受严重打击,1951-08-27,1951-08
美统治集团疯狂侵略和备战美国人民生活贫困一千万个家庭挣扎在饥饿线上,1951-08-27,1951-08
加斯贝利政府执行卖国政策结果意大利机器工业已极度萎缩,1951-08-27,1951-08
苏采煤工业有新成就技术设备进一步改进，生产率不断提高，矿工生活日益改善,1951-08-27,1951-08
国际动态,1951-08-27,1951-08
苏联争取提前完成一九五一年生产计划的爱国热潮,1951-08-27,1951-08
美方含血喷人图逃脱谋杀我代表团罪责金日成彭德怀两将军痛斥李奇微再次指出美方必须认真处理这一挑衅事件谈判才能继续要李奇微派联络官来开城复查并发表双方往来文电全文,1951-08-28,1951-08
印度政府拒绝参加旧金山会议声明反对美国对日和约草案,1951-08-28,1951-08
就美方武装人员杀害我军事警察事件我方联络官向金日成彭德怀将军的报告,1951-08-28,1951-08
我方联络官在美机轰炸地点进行复查并听取当地居民叙述美机行凶情形,1951-08-28,1951-08
美机轰炸扫射我代表团住所证据确凿南日将军发表声明详述调查结果,1951-08-28,1951-08
我们伟大的祖国,1951-08-28,1951-08
李奇微二十五日复文,1951-08-28,1951-08
夏季爱国丰产竞赛计划胜利完成后李顺达互助组订出秋季生产计划向全国劳动模范和互助组挑战，建议进一步开展秋季爱国主义生产竞赛。,1951-08-28,1951-08
全国规模的群众性的爱国生产竞赛把今年的农业生产大大提高了一步,1951-08-28,1951-08
加强爱国主义教育贯彻依率计征政策全国夏季公粮征收工作接近完成,1951-08-28,1951-08
国家关怀农民利益粮食公司收购新谷中南华东谷价稳定,1951-08-28,1951-08
坚决废除建筑业中的封建把头制度——工人日报八月二十六日社论,1951-08-28,1951-08
徐州某建筑工程工地三千建筑工人反把头斗争胜利,1951-08-28,1951-08
读者来信,1951-08-28,1951-08
华北军区后勤运输部政治部关于某项工程中所发生纠纷的检查与答复对人民日报读者批评建议的反应,1951-08-28,1951-08
订爱国丰产计划向李顺达互助组应战,1951-08-28,1951-08
河北省各专区、市、县积极准备迎接华北县长会议,1951-08-28,1951-08
石家庄市人民代表选举工作存在严重的形式主义偏向,1951-08-28,1951-08
河北省河间、交河、青县等地干部对人民的民主要求估计不足,1951-08-28,1951-08
山西省晋城县人民代表会议代行人民代表大会职权的情况和经验,1951-08-28,1951-08
河北保定专署检查政权建设工作检查中发现干部有左倾关门主义思想忽视人民民主权利,1951-08-28,1951-08
《夫妇进行曲》是一部坏电影,1951-08-28,1951-08
文化生活动态,1951-08-28,1951-08
日本举行全国和平大会通过决议反对美制和约与日美军事协定主张缔结符合国际协定确保独立的和约,1951-08-28,1951-08
澳共第十六次全国代表大会开幕中共中央委员会致电祝贺,1951-08-28,1951-08
消息报评美日军事协定美日反动派的联盟违背日本民族利益,1951-08-28,1951-08
法人道报发表论文揭露“美日军事协定”,1951-08-28,1951-08
美国采取卑鄙手段包办对日和约曾与日寇合作的保大等傀儡竟被“邀请”到旧金山去捧场,1951-08-28,1951-08
越南通讯社发表评论斥美侵犯越人民利益,1951-08-28,1951-08
美国侵略者蓄意破坏停战谈判激起朝鲜人民极大的愤怒,1951-08-28,1951-08
英工人日报与法人道报著论斥美国破坏停战谈判,1951-08-28,1951-08
在美国“禁运”和日货倾销打击下香港经济危机严重工厂纷纷停闭失业工人数目激增,1951-08-28,1951-08
日本共产党第四次全国协议会“关于对分派主义者作斗争”的决议转载“争取持久和平，争取人民民主！”一九五一年第三十二期,1951-08-28,1951-08
日本五百余万人在和平公约宣言上签名四百六十余万人赞成全面媾和,1951-08-28,1951-08
日本和平大会决议和宣言,1951-08-28,1951-08
葛罗米柯抵纽约发表谈话苏联将提出对日和约建议以奠定远东持久和平基础,1951-08-29,1951-08
印度总理尼赫鲁发表演说说明印度政府不参加旧金山会议理由,1951-08-29,1951-08
印度驻英高级专员斥美制对日和约草案,1951-08-29,1951-08
缅甸政府决定不出席旧金山会议,1951-08-29,1951-08
武汉市工商界增献飞机十三架向全国工商界发起增产缴款竞赛保证按期缴款年前完成捐献缴款计划,1951-08-29,1951-08
武汉市工商界向毛主席报告超额完成捐献计划,1951-08-29,1951-08
印度不参加旧金山会议美英日统治者极为忧虑美答复印度的照会故意强词辩解,1951-08-29,1951-08
朝鲜最高人民会议议长许宪逝世我政协全国委员会致电吊唁,1951-08-29,1951-08
英法记者揭露美国扩大侵朝战争阴谋,1951-08-29,1951-08
范佛里特疯狂叫战暴露美国蓄意破坏停战谈判,1951-08-29,1951-08
中国民主促进会举行中央理事会全会通过发展新的分会组织等决议,1951-08-29,1951-08
我们伟大的祖国,1951-08-29,1951-08
全国人民电贺党的三十周年,1951-08-29,1951-08
京市大脑炎仍在发展各单位应切实注意预防工作,1951-08-29,1951-08
印度缅甸拒绝签订美英对日和约,1951-08-29,1951-08
改善少数民族的经济生活！,1951-08-29,1951-08
重庆十家木材商违法采购木材破坏森林川北人民法院达县分院依法判以徒刑或当庭训诫反对浪费木材，反对滥伐林木！,1951-08-29,1951-08
吉林省人民法院等机关擅自采伐销售木材使森林遭受严重破坏反对浪费木材，反对滥伐林木！,1951-08-29,1951-08
峰峰矿务局重点检查基本建设克服急于求成和不负责任的思想作风,1951-08-29,1951-08
北京市建设局取缔非法建筑商新华营造厂已被送法院处理,1951-08-29,1951-08
经济生活动态,1951-08-29,1951-08
读者来信,1951-08-29,1951-08
对人民日报读者批评建议的反应,1951-08-29,1951-08
中央人民政府教育部召开首次全国初等教育及师范教育会议,1951-08-29,1951-08
马叙伦部长的开幕词,1951-08-29,1951-08
北京等四大学师生八百人组成中南土地改革工作团,1951-08-29,1951-08
语法、修辞讲话（第三讲）,1951-08-29,1951-08
克服购棉储棉宣传的两种偏向,1951-08-29,1951-08
天津市委决定加强天津日报党的生活栏,1951-08-29,1951-08
群众日报对压制批评的斗争,1951-08-29,1951-08
重庆、成都等地举办高等学校政治课教学讨论会,1951-08-29,1951-08
黑龙江省某些农村剧团演出的戏剧内容有错误,1951-08-29,1951-08
巩固捐献运动的成绩，克服运动中的强迫命令偏向,1951-08-29,1951-08
关于美国单独对日媾和问题答问,1951-08-29,1951-08
皖北太和县增产捐献运动中的宣传工作,1951-08-29,1951-08
基督教天主教爱国运动继续发展,1951-08-29,1951-08
新华书店的募集书刊运动获得很大成绩,1951-08-29,1951-08
关于购赠书籍期刊给志愿军的问题,1951-08-29,1951-08
各地报纸关于揭露帝国主义利用中国教会进行特务破坏活动的报道,1951-08-29,1951-08
生动的抗美教育——苏联名剧《冷战》在首都上演,1951-08-29,1951-08
世界青年与学生和平联欢节万岁！,1951-08-29,1951-08
读者来信专页湖南新化红茶厂及湖南茶叶公司某些负责干部竟违法包庇地主当地领导机关应即进行严正处理,1951-08-29,1951-08
彻底摧毁野蛮的封建婚姻制度！,1951-08-29,1951-08
坚决肃清封建婚姻制度,1951-08-29,1951-08
应该尊敬与爱护国旗国徽国歌,1951-08-29,1951-08
不能容许滥制领袖像！,1951-08-29,1951-08
山东惠民专区村级干部兼职过多影响生产有关领导机关应即设法纠正,1951-08-29,1951-08
注意宣传材料的时间性,1951-08-29,1951-08
来信摘要,1951-08-29,1951-08
寻人名单革命军人家属寻找革命军人,1951-08-29,1951-08
背弃国际信义破坏开城中立区协议美机一贯侵犯中立区上空美空军轰炸谋杀事件是破坏双方协议登峰造极的发展,1951-08-30,1951-08
开城中外记者发表联合声明揭露美国无耻撒谎抵赖轰炸开城他们目击美机行凶罪证，对美方谎言极表愤慨,1951-08-30,1951-08
金日成彭德怀将军接获李奇微复电美方竟拒绝复查轰炸开城事件复电全篇说谎矛盾百出无以自圆其说,1951-08-30,1951-08
美国破坏停战谈判的严重事件激起我志愿军全军愤慨战士们表示誓为朝鲜和平奋斗到底,1951-08-30,1951-08
平原省人民政府和各专署、县政府积极准备参加华北县长会议正认真学习和总结建政工作,1951-08-30,1951-08
根据人民要求和市政建设需要上海军管会收回跑马厅场地,1951-08-30,1951-08
我们伟大的祖国,1951-08-30,1951-08
纠正县人民代表会议工作中的几个思想偏向,1951-08-30,1951-08
经过反封建残余的斗争和民主团结运动武汉裕华纱厂职工团结生产提高打破资方顾虑吸引他们积极参加民主改革,1951-08-30,1951-08
划清界限·讲明政策·着重思想发动江岸列车段民主改革胜利前进已完成反封建斗争，正为民主团结打思想基础。,1951-08-30,1951-08
周密准备做好新棉收购工作！,1951-08-30,1951-08
反对浪费木材，反对滥伐林木！中南应彻底制止滥伐和抢购木材,1951-08-30,1951-08
读者来信坚决肃清歧视妇女的封建思想！本报很多读者来信批判林红的意见,1951-08-30,1951-08
对人民日报读者批评建议的反应新乡县合作社联合社对忽视保存优良棉种的检讨,1951-08-30,1951-08
读毛泽东同志在一九二六年至一九二九年的四篇著作,1951-08-30,1951-08
必须相信群众，有事和群众商量,1951-08-30,1951-08
评《电影艺术概论》,1951-08-30,1951-08
苏联拥护和平委员会通过决议定期展开和平公约宣言签名运动第三届全苏拥护和平大会定十一月举行,1951-08-30,1951-08
缅甸人民示威反对美制和约草案缅工农党召开群众大会斥美国危害和平印度驻日代表团团长解释印度反对美制和约草案理由,1951-08-30,1951-08
印度各报抨击美国对日和约草案指出美制和约旨在复活日本军国主义进行侵略印度人民将与全世界人民一道击败美国的阴谋,1951-08-30,1951-08
英工商界焦虑美制和约签字后英国工业将遭受日本威胁,1951-08-30,1951-08
美国人民要求立即停止侵朝战争纽约《工人日报》号召人民阻止政府破坏谈判,1951-08-30,1951-08
反对美国对日和约草案迎接“八一五”六周年,1951-08-30,1951-08
美机又侵入开城中立区上空投掷照明弹南日将军向乔埃提出严重抗议要求美方严惩肇事人员，彻底保证不再发生破坏中立区协议的任何事件。,1951-08-31,1951-08
答谢对朝鲜解放六周年的祝贺金枓奉复电毛主席金日成复电周总理,1951-08-31,1951-08
加紧捐献武器支援前线巩固国防各地缴纳现款已逾四千亿元认捐飞机接近二千四百架最近九天缴款一千一百余亿,1951-08-31,1951-08
我方联络官张春山上校发表声明指斥李奇微诬我拒绝复查谰言发表关于再行调查的谈话记录向美方联络官对质,1951-08-31,1951-08
京市各区天主教徒纷纷集会签名要求驱逐间谍黎培里出中国揭发黎培里破坏天主教徒爱国革新运动卑鄙罪行,1951-08-31,1951-08
朝鲜人民军最高司令部中国人民志愿军司令部发言人发表谈话驳斥美方无耻蒙蔽谋杀事件真相美方歪曲事实拒绝复查只能证明其作贼心虚,1951-08-31,1951-08
我们伟大的祖国,1951-08-31,1951-08
中国人民抗美援朝总会关于九月三日抗日战争胜利日纪念办法的通知,1951-08-31,1951-08
电通社记者报道美机入侵开城投掷照明弹显示美方仍无理抗拒调查,1951-08-31,1951-08
华北部分地区遭受严重水旱虫灾各地农民奋力抗灾争取提高年成辽西洪水已退人民政府妥善安置灾民,1951-08-31,1951-08
轻工业部召开首届全国轻工业会议研究提高设备利用率降低原材料消耗定额号召彻底检查基本建设工作，总结经验教训,1951-08-31,1951-08
三万余人奋力抢修中长铁路长沈段客货运恢复,1951-08-31,1951-08
根本改造自然条件，杜绝风沙灾害！东北今年开始营造防护林带,1951-08-31,1951-08
防治棉蚜歌,1951-08-31,1951-08
“武训历史调查记”批判了我的“超阶级”思想,1951-08-31,1951-08
太原私营晋成营造厂转包工程进行中间剥削造成工人及工程的严重损失,1951-08-31,1951-08
泸溪县武溪镇税务局不应擅自降低税率,1951-08-31,1951-08
太原建筑公司及山西省建筑公司对晋南面粉厂修建工程中一再返工浪费的检讨,1951-08-31,1951-08
认真学习人民民主政权建设重要文件,1951-08-31,1951-08
关于安国县选举工作的检讨和经验,1951-08-31,1951-08
反对选举工作中的形式主义,1951-08-31,1951-08
文化生活动态,1951-08-31,1951-08
谈《牛郎织女》,1951-08-31,1951-08
开城人民痛恨美国破坏谈判坚决表示要为争取祖国自由而奋斗,1951-08-31,1951-08
大公报记者等自开城报道斥美方抵赖轰炸暴行事实证明是美国周密布置了谋杀,1951-08-31,1951-08
英国人民要求实现朝鲜停战英和平委员会电艾德礼不许美国继续破坏谈判,1951-08-31,1951-08
真理报评论指出美日军事协定的险恶目的在便利美国完全操纵日本,1951-08-31,1951-08
越《人民周刊》、巴基斯坦《今天报》抨击美制和约草案,1951-08-31,1951-08
日共临时中央指导部声援美共抗议美国当局迫害美共领袖,1951-08-31,1951-08
美国铜矿工人罢工百分之九十炼铜工业陷于停顿,1951-08-31,1951-08
侵朝美兵投降者日多他们痛恨干涉朝鲜希望停战回家,1951-08-31,1951-08
无法掩盖的侵略阴谋,1951-08-31,1951-08
英工人日报记者指出美国在玩弄旷古未有的骗局驱使帮凶各国继续为它卖命,1951-08-31,1951-08
亚澳各国人民坚决反对美国非法单独对日媾和,1951-08-31,1951-08
