文化零讯,1951-10-23,1951-10
朝鲜人民支持苏联政府致美政府的声明热烈欢迎苏联坚定的和平政策并指出美国任何谎言无法掩盖它阻挠停战谈判的罪行,1951-10-23,1951-10
迎接十月革命节罗、匈、蒙等国人民热烈展开生产竞赛,1951-10-23,1951-10
纽约码头工人大罢工严重地瘫痪了到朝鲜等地去的军事运输,1951-10-23,1951-10
中东各国人民支持埃及人民的正义斗争德黑兰等地人民示威表示愿共同反对帝国主义苏彝士运河区英军继续进攻并射击和平居民,1951-10-23,1951-10
雷曼在波恩议会上发言主张召开全德会议波恩议会再度拒绝人民议会建议,1951-10-23,1951-10
日共参议员兼岩传一在参议院会议上提出质询严斥单独和约使日本降为美国殖民地并谴责吉田反动政府出卖民族利益参加侵朝战争,1951-10-23,1951-10
原子弹贩子的失败——真理报评述外国报纸对斯大林答真理报记者问的评论,1951-10-23,1951-10
国际简评,1951-10-23,1951-10
中国人民政治协商会议第一届全国委员会第三次会议开幕,1951-10-24,1951-10
朝中人民军队并肩作战一年歼敌三十八万七千余名,1951-10-24,1951-10
迎接中国人民志愿军出国作战周年纪念全国缴纳献款已达二万三千多亿,1951-10-24,1951-10
我们伟大的祖国,1951-10-24,1951-10
中国人民政治协商会议第一届全国委员会第三次会议的开会词（一九五一年十月二十三日）,1951-10-24,1951-10
西藏地方政府致人民政协第一届全国委员会第三次会议贺电,1951-10-24,1951-10
中国人民政治协商会议第一届全国委员会第三次会议出席列席名单,1951-10-24,1951-10
经济生活简评反对基本建设中的消极拖延态度,1951-10-24,1951-10
经济零讯,1951-10-24,1951-10
祖国人民的热爱鼓舞着我们的战斗意志,1951-10-24,1951-10
坚决支持伊朗和埃及人民的反帝斗争！,1951-10-24,1951-10
抗议英帝国主义镇压埃及人民的罪行,1951-10-24,1951-10
向黄秀英的英雄行为学习,1951-10-24,1951-10
学习张林同志的事业精神,1951-10-24,1951-10
应该学习石联星饰演赵一曼角色的精神,1951-10-24,1951-10
中国粮食公司苏州支公司建仓工程一再发生错误,1951-10-24,1951-10
吉林化工一厂忽视保安工作造成皮带绞死工友王玉文事故,1951-10-24,1951-10
郑州铁路管理局基本建设工程的初步检查,1951-10-24,1951-10
全国人民一年来不断寄信捐款赠送物品热烈慰问慰劳中朝人民部队,1951-10-24,1951-10
一年来的爱国公约运动,1951-10-24,1951-10
一年来各少数民族地区的抗美援朝运动,1951-10-24,1951-10
愈战愈强的中国人民志愿军——为纪念志愿军入朝作战一周年而作,1951-10-24,1951-10
文化生活简评武汉市文艺界对具有错误思想的作品展开批评,1951-10-24,1951-10
语法、修辞讲话（第五讲）,1951-10-24,1951-10
迎接中国人民志愿军入朝作战一周年朝鲜军民热烈慰问志愿军部队工人农民发起增产竞赛积极支援前线,1951-10-24,1951-10
成千纽约人民集会要求停止侵朝战争,1951-10-24,1951-10
《民主朝鲜》报号召朝鲜人民积极支援我国志愿军,1951-10-24,1951-10
朝中代表团更换谈判代表,1951-10-24,1951-10
出席二届世界和平理事会会议我国代表团首批人员启程,1951-10-24,1951-10
李颉伯致函陆空运输工人工会国际总书记莫拉鲁呼吁支援日本“松川事件”的无辜被捕者,1951-10-24,1951-10
美拼凑以日军为主的“盟军后备部队”妄图镇压强大的东南亚民族解放运动美国并策划通过日本财阀向东南亚进行经济侵略,1951-10-24,1951-10
不朽的友谊,1951-10-24,1951-10
国际简评日本人民反对批准单独和约,1951-10-24,1951-10
一年来中朝人民战斗友谊的增进——为纪念中国人民志愿军入朝作战一周年而作,1951-10-24,1951-10
伟大的中国人民志愿军万岁,1951-10-24,1951-10
发挥创造能力，建设伟大祖国！,1951-10-24,1951-10
新中国新人新事,1951-10-24,1951-10
坚决贯彻执行婚姻法，保障妇女权利！,1951-10-24,1951-10
努力生产学习，为祖国贡献最大力量,1951-10-24,1951-10
来信摘要,1951-10-24,1951-10
寻人名单革命军人家属寻找革命军人,1951-10-24,1951-10
人民政协第一届全国委员会第三次会议昨继续举行通过关于抗美援朝工作的决议,1951-10-25,1951-10
抗美援朝总会常务委员会决定送给志愿军捐款二万二千余亿相当于一千五百架战斗机,1951-10-25,1951-10
我们伟大的祖国,1951-10-25,1951-10
人民政协第一届全国委员会第三次会议致中国人民志愿军贺电,1951-10-25,1951-10
人民政协第一届全国委员会第三次会议致金日成将军的贺电,1951-10-25,1951-10
中国共产党中央委员会致中国人民志愿军的贺电,1951-10-25,1951-10
中国共产党中央委员会致金日成将军的贺电,1951-10-25,1951-10
各民主党派及无党派民主人士致中国人民志愿军的贺电,1951-10-25,1951-10
中国人民抗美援朝总会致中国人民志愿军的贺电,1951-10-25,1951-10
中国人民抗美援朝总会致金日成将军的贺电,1951-10-25,1951-10
人民政协第一届全国委员会第三次会议关于抗美援朝工作的决议（一九五一年十月二十四日通过）,1951-10-25,1951-10
关于抗美援朝保家卫国运动的报告——一九五一年十月二十四日在中国人民政治协商会议第一届全国委员会第三次会议上的报告,1951-10-25,1951-10
中国人民志愿军发言人发表谈话朝中人民军队奋战一年已奠定最后胜利的巩固基础如果美国破坏谈判必将继续遭受打击直到最后失败,1951-10-25,1951-10
彭德怀将军荣获朝鲜一级国旗勋章立下特殊功勋的志愿军指战员分别获得勋章和奖章,1951-10-25,1951-10
纪念中国人民志愿军赴朝作战一周年朝鲜驻华大使李周渊昨晚举行招待会,1951-10-25,1951-10
毛主席前天的开会词莫斯科各报显著刊登,1951-10-25,1951-10
一年来各民主党派的抗美援朝工作,1951-10-25,1951-10
拥军优属已经成为全国人民自觉的行动,1951-10-25,1951-10
北京市优抚工作成绩很大,1951-10-25,1951-10
继续加强抗美援朝工作是全国人民目前的中心任务——纪念中国人民志愿军出国作战一周年,1951-10-25,1951-10
中国红十字会总会会长李德全等写信慰问中国人民志愿军,1951-10-25,1951-10
迪化市各族少年儿童队队员联名写信向彭德怀将军致敬,1951-10-25,1951-10
中华医学总会电志愿军医务工作者致敬,1951-10-25,1951-10
志愿军战斗英雄田文富故乡人民写信给田文富勉励功上加功,1951-10-25,1951-10
在朝鲜前线回忆出国作战一周年,1951-10-25,1951-10
最后胜利一定属于我们,1951-10-25,1951-10
你们每个人都是我心里的英雄——先进纺织工作生产者郝建秀给志愿军的一封信,1951-10-25,1951-10
出国作战第一功,1951-10-25,1951-10
文化生活简评大家都来积极参加马克思、恩格斯、列宁、斯大林著作中文译本的审查,1951-10-25,1951-10
文化零讯,1951-10-25,1951-10
南日将军函复乔埃批准双方联络官协议及谅解建议双方代表团于二十五日复会,1951-10-25,1951-10
“双方联络官间关于双方代表团复会事宜的协议”全文,1951-10-25,1951-10
双方联络官的共同谅解,1951-10-25,1951-10
乔埃给南日将军的来信,1951-10-25,1951-10
巴基斯坦人民观礼代表团离京前函谢周总理民主德国文化代表团离杭赴南京,1951-10-25,1951-10
爱国主义与国际主义是中国人民志愿军力量的源泉,1951-10-25,1951-10
中国人民的抗美援朝运动鼓舞了朝鲜人民的胜利信心,1951-10-25,1951-10
首都各界昨日举行大会纪念抗美援朝一周年,1951-10-26,1951-10
班禅额尔德尼电人民志愿军致敬,1951-10-26,1951-10
人民政协第一届全国委员会第三次会议昨听取财经及文教工作的报告通过制发抗美援朝纪念章给志愿军全体人员的提案,1951-10-26,1951-10
中国人民抗美援朝总会慰劳志愿军解放军伤病员,1951-10-26,1951-10
双方代表团昨天复会商定由小组委员会继续讨论确定军事分界线以建立非军事地区的问题,1951-10-26,1951-10
武汉市工商界完成献机四十三架计划浙江省人民完成捐献计划后又继续捐献飞机十架全国文艺界捐献“鲁迅号”飞机三架的计划超额完成,1951-10-26,1951-10
新华社特派记者评朝鲜停战谈判的恢复,1951-10-26,1951-10
我们伟大的祖国,1951-10-26,1951-10
抗美援朝总会副主席陈叔通致开会词,1951-10-26,1951-10
增产节约和捐献武器是继续加强抗美援朝工作的中心环节——郭沫若副主席在庆祝抗美援朝一周年纪念大会上的讲话,1951-10-26,1951-10
我们人民志愿军是不可战胜的力量——志愿军战斗英雄代表杜平在庆祝抗美援朝一周年纪念大会上的讲话,1951-10-26,1951-10
胜利一定属于朝中两国人民！——李周渊大使在庆祝抗美援朝一周年纪念大会上的讲话,1951-10-26,1951-10
解决职工思想顾虑，改善企业行政管理东北增产节约运动稳步前进,1951-10-26,1951-10
依靠工人阶级管理工厂,1951-10-26,1951-10
学习工人兄弟的科学分工和整体精神,1951-10-26,1951-10
经济生活简评和不重视国家财产的现象作不调和的斗争,1951-10-26,1951-10
认真钻研就能掌握机器规律——介绍郝建秀的科学细纱工作法——,1951-10-26,1951-10
读者来信,1951-10-26,1951-10
新年画在全国已有很大的推广如何领导旧艺人改进旧年画问题亟待解决,1951-10-26,1951-10
浙江省在棉麻收购工作中的政治教育问题,1951-10-26,1951-10
党的生活简评,1951-10-26,1951-10
我一定要切实地改正错误,1951-10-26,1951-10
中央人民政府文化部、出版总署关于加强年画工作的指示,1951-10-26,1951-10
文化生活简评,1951-10-26,1951-10
文化零讯,1951-10-26,1951-10
苏联共产党（布）中央委员会发布庆祝伟大的十月社会主义革命三十四周年口号,1951-10-26,1951-10
侵朝战争使美国大资本家获得暴利人民生活水平降低美国广大人民日益不满杜鲁门战争政策工人罢工浪潮高涨，群众极力逃避兵役,1951-10-26,1951-10
应捷克斯洛伐克总统邀请皮克赴布拉格访问,1951-10-26,1951-10
伤亡惨重，生还无望侵朝美军士气低沉,1951-10-26,1951-10
侵朝美军遭到异乎寻常的愈来愈大的伤亡美反动报刊对侵朝战争前途日益恐慌,1951-10-26,1951-10
反对美国利用单独对日“和约”侵略台湾的阴谋,1951-10-26,1951-10
国际简评美国将军的呓语,1951-10-26,1951-10
拥护和平解放西藏办法的协议达赖喇嘛致电毛主席,1951-10-27,1951-10
祝贺中朝人民军队并肩反抗美国侵略一年的胜利开城朝鲜人民军代表团欢宴志愿军代表团志愿军某部在前线集会纪念出国作战一周年,1951-10-27,1951-10
全国普遍庆祝抗美援朝斗争一周年各地人民表示要继续加强实际行动支援前线,1951-10-27,1951-10
出席世界和平理事会会议郭沫若等昨日离京茅盾等一行抵达莫斯科,1951-10-27,1951-10
政务院举行第一零八次会议,1951-10-27,1951-10
侵朝美空军损失惨重补充困难我军一年来击落击伤和俘获敌机二千三百多架,1951-10-27,1951-10
我志愿军打落美机一架缴获重要军用地图,1951-10-27,1951-10
人民政协全国委员会参加三大运动筹备委员会组织三十一个土地改革工作团赴各地工作,1951-10-27,1951-10
我们伟大的祖国,1951-10-27,1951-10
毛主席复电,1951-10-27,1951-10
中苏友好协会总会关于庆祝十月革命三十四周年纪念办法的通知,1951-10-27,1951-10
学习任弼时同志的精神作好当前的中心工作——中国青年报社论,1951-10-27,1951-10
纪念任弼时同志,1951-10-27,1951-10
一年来东北工人农民的爱国主义劳动竞赛运动,1951-10-27,1951-10
上海日用品工业大量增产供应秋后农民需要,1951-10-27,1951-10
中央贸易部和中国店员工会全国委员会关于在国营企业中开展以减低商品流转费用为中心的爱国主义劳动竞赛运动指示,1951-10-27,1951-10
从西南土地改革谈到民族工商业,1951-10-27,1951-10
读者来信,1951-10-27,1951-10
和龙县人民政府企业科等单位对砍伐和销售木材的错误的检讨对人民日报读者批评建议的反应,1951-10-27,1951-10
全国妇女一年来在抗美援朝运动中的贡献,1951-10-27,1951-10
全国青年团员和青年一年来在抗美援朝运动中的贡献,1951-10-27,1951-10
中共富平县委是怎样推进爱国公约运动的？,1951-10-27,1951-10
党的生活简评党委了解情况的一个重要方法,1951-10-27,1951-10
语法、修辞讲话（第五讲）,1951-10-27,1951-10
祝教师学习成功,1951-10-27,1951-10
我对政治学习看法的改变,1951-10-27,1951-10
文化零讯,1951-10-27,1951-10
平壤庆祝志愿军入朝作战一周年各界代表千余人隆重举行庆祝大会,1951-10-27,1951-10
埃及人民反帝斗争继续发展英国军事恫吓激起埃及人民更大的愤怒各地连日举行示威展开抵制英国货运动,1951-10-27,1951-10
中东各国人民支持埃及人民的斗争反对美国组织中东侵略集团,1951-10-27,1951-10
伊朗当局封闭进步报纸,1951-10-27,1951-10
西德大港口汉堡和不来梅万余码头工人罢工反动当局与右翼工会头子破坏失败,1951-10-27,1951-10
民主德国全国阵线援朝委员会纪念志愿军入朝作战一周年向中朝人民部队致兄弟敬礼,1951-10-27,1951-10
埃及人民反帝斗争介绍,1951-10-27,1951-10
纽约码头工人罢工迅速扩大大西洋岸上许多港口码头工人举行了同情罢工纽约几乎已成死港，美国统治集团十分恐慌,1951-10-27,1951-10
蒙古和英国人民观礼代表离京返国,1951-10-27,1951-10
平壤市各界庆祝大会给毛主席的致敬电,1951-10-27,1951-10
国际简评,1951-10-27,1951-10
湖北苏北川西等地提前完成原订捐献计划,1951-10-28,1951-10
柴川若等写信给祖国人民回到朝鲜前线后已向金日成彭德怀将军作了汇报各部队听了他们的报告后战志更为昂扬,1951-10-28,1951-10
朝鲜内阁副首相兼外务相朴宪永设宴庆祝我志愿军入朝作战一周年,1951-10-28,1951-10
任弼时同志逝世周年中共中央等单位代表昨天到西效墓地扫墓,1951-10-28,1951-10
入朝作战周年纪念前夕志愿军某部举行大会为五千多名功臣庆功,1951-10-28,1951-10
川北遂宁县和上海诚孚铁工厂举行“爱国公约展览会”展开群众性的评比推进爱国公约运动,1951-10-28,1951-10
印度亲善访华团返国前发表声明将向印度人民介绍新中国各方面的进步,1951-10-28,1951-10
华东武装部队学习志愿军的精神,1951-10-28,1951-10
吕松山家乡人民集会祝贺志愿军出国作战胜利,1951-10-28,1951-10
茅盾等一行飞赴维也纳出席世界和平理事会二届会议,1951-10-28,1951-10
我们伟大的祖国,1951-10-28,1951-10
巩固边疆的巨大力量——云南爱国公约运动发展概况介绍,1951-10-28,1951-10
中央人民政府纺织工业部中国纺织工会全国委员会联合指示全国棉纺织厂自下月起突击增产两月供应广大人民所需要的纱布并增强抗美援朝力量,1951-10-28,1951-10
改进安全卫生设备推行技术保安东北国营工矿死亡事故大减,1951-10-28,1951-10
河北地方工业清理资产告一段落呆滞资金投入再生产,1951-10-28,1951-10
徐州车辆段清理资产工作有成绩清出大批积压资金及账外材料,1951-10-28,1951-10
青海省各厂矿初步核定资金发现一个厂占用八个厂的资金,1951-10-28,1951-10
土地改革为新中国的工业化开辟了道路,1951-10-28,1951-10
郭金玉重新回到互助组,1951-10-28,1951-10
吉林、梅河口铁路分局工人纷纷提出增产节约计划,1951-10-28,1951-10
响应曲耀离互助组售棉挑战,1951-10-28,1951-10
东北贸易部商业干部学校校舍工程一再返工浪费很大,1951-10-28,1951-10
我们参加土地改革工作前，对思想作了检查,1951-10-28,1951-10
我投书检举了特务安体俭人民政府已认真负责处理,1951-10-28,1951-10
逼死杨维美的有关人员必须受到国家法律制裁,1951-10-28,1951-10
金华法院应重新处理滕桂芬案,1951-10-28,1951-10
好好学习婚姻法，不让坏分子钻空子——读金华县滕桂芬被迫自杀一文后,1951-10-28,1951-10
要从“李雷事件”中获得教训！——读者来信综述,1951-10-28,1951-10
婚姻法执行情况中央检查组出发湖南省人民政府派出两个检查组赴各地作重点检查,1951-10-28,1951-10
各地建立机关宣传员的经验,1951-10-28,1951-10
党的生活简评,1951-10-28,1951-10
为出版工作的高度思想性而斗争——苏联真理报一九五一年八月十八日社论,1951-10-28,1951-10
反对歪曲与假冒马克思主义——评许凌青的“新逻辑学”,1951-10-28,1951-10
华东各地大力展开婚姻法的宣传工作许多地区利用具体事例和典型案件进行宣传收效很大,1951-10-28,1951-10
政法工作简评,1951-10-28,1951-10
文化生活简评,1951-10-28,1951-10
文化零讯,1951-10-28,1951-10
加强对积极分子的领导和教育,1951-10-28,1951-10
沈阳冶炼厂怎样提前完成了全年增产节约计划,1951-10-28,1951-10
节约每一秒钟,1951-10-28,1951-10
在抗美援朝中感到的,1951-10-28,1951-10
西安市举办推行爱国公约的积极分子训练班,1951-10-28,1951-10
北京市第二区第九派出所的“抗美援朝日”,1951-10-28,1951-10
川北南充市推广陈玉山家庭的爱国公约,1951-10-28,1951-10
儿子爱国杀敌，我爱国生产——志愿军战士马玉祥父亲马青林的谈话,1951-10-28,1951-10
在保卫世界和平战线上,1951-10-28,1951-10
人民志愿军战斗英雄观礼代表团部分战斗英雄代表离京返朝鲜前线首都各界人民代表五百余人赴车站欢送,1951-10-29,1951-10
政协全国委员会第三次会议昨天开始大会讨论,1951-10-29,1951-10
双方联络官联合办事处成立,1951-10-29,1951-10
我们伟大的祖国,1951-10-29,1951-10
人民政协全国委员会第三次会议二十四日会上各界代表发言全文,1951-10-29,1951-10
粤汉铁路武昌分局积压资金的情况清理资产，核定资金，反对浪费！,1951-10-29,1951-10
河北省籽棉加工迟缓不能及时供应工业需要,1951-10-29,1951-10
我认识了劳动人民的智慧,1951-10-29,1951-10
“农民离开了工人，可真不行呢！”,1951-10-29,1951-10
郭全德进天津——记农民郭全德参观华北区城乡物资交流展览会后的思想变化,1951-10-29,1951-10
经济生活简评,1951-10-29,1951-10
经济简讯,1951-10-29,1951-10
在热火大锤下锻炼,1951-10-29,1951-10
读者来信,1951-10-29,1951-10
对人民日报读者批评建议的反应,1951-10-29,1951-10
党支部领导宣传工作的一个成功的例子太要乡党组织用先进事例和群众所喜爱的形式进行宣传,1951-10-29,1951-10
中共湖南省各级党委领导关于“李四喜思想”的讨论,1951-10-29,1951-10
提高关于国家建设事业宣传的质量,1951-10-29,1951-10
天津市人民政府公安局查获帝国主义分子文贵宾又一罪证文贵宾曾禁令天主教徒参加进步团体,1951-10-29,1951-10
老英雄李升的经历,1951-10-29,1951-10
帝国主义利用天主教破坏我国内政的又一铁证,1951-10-29,1951-10
波立特号召英国工人阶级团结起来坚决击败保守党的战争计划主张立即举行英苏谈判和停止侵朝战争,1951-10-29,1951-10
英国议会选举揭晓保守党获得议会微少多数邱吉尔组阁承认前途险恶,1951-10-29,1951-10
捷副总理祝贺我国人民抗美援朝一周年纽约《工人日报》号召人民迫使美政府撤退侵朝美军,1951-10-29,1951-10
希腊人民和世界民主力量正努力营救希腊民主议员,1951-10-29,1951-10
苏联发表第三季生产公报工业总产量较去年同季增百分之十五,1951-10-29,1951-10
中苏两个伟大民族间的友谊是不可摧毁的永恒的友谊,1951-10-29,1951-10
让我们都成为新亚洲的骄傲的建设者,1951-10-29,1951-10
国际简评声援被非法监禁的希腊议员,1951-10-29,1951-10
出国作战一周年纪念日志愿军司令机关举行庆祝大会朝鲜民主主义人民共和国代表团出席致贺,1951-10-30,1951-10
拥护达赖喇嘛致毛主席电班禅额尔德尼致电达赖喇嘛班禅行辕堪布会议厅亦通电拥护,1951-10-30,1951-10
朝鲜人民军各部庆祝志愿军参战一周年并派遣代表赴志愿军驻地祝贺,1951-10-30,1951-10
政协全国委员会第三次会议昨日上午分组讨论下午继续举行大会,1951-10-30,1951-10
上海工商界超额完成捐献,1951-10-30,1951-10
赴维也纳出席世界和平理事会会议郭沫若等一行飞抵莫斯科,1951-10-30,1951-10
我们伟大的祖国,1951-10-30,1951-10
人民政协全国委员会第三次会议二十八日会上的专题报告和发言,1951-10-30,1951-10
西北石油管理局运销公司兰州总站四个月为国家节约七十五亿元,1951-10-30,1951-10
我国机器工业突飞猛进已可自制全套纺织机械,1951-10-30,1951-10
中国纺织工会全国委员会号召全国棉纺织工人展开爱国主义竞赛完成增产纱布任务,1951-10-30,1951-10
山东临沂运输公司驾驶员游玉书创造节省汽油新纪录,1951-10-30,1951-10
上海国营纺织厂工人积极改进机器减少原物料浪费,1951-10-30,1951-10
张家口矿山机械制造厂职工积极节约增产发挥工业潜力,1951-10-30,1951-10
纺织工业中又有两项新创造,1951-10-30,1951-10
经济生活简评不能把企业盈余变成呆料,1951-10-30,1951-10
经济简讯,1951-10-30,1951-10
两年来东北煤矿工人生活的巨大变化,1951-10-30,1951-10
读者来信,1951-10-30,1951-10
对人民日报读者批评建议的反应武汉市人民政府民政局对轻率补助军属路费浪费国家财力的检讨,1951-10-30,1951-10
美日反动派操纵日本众院通过两项卖国条约,1951-10-30,1951-10
侵朝战争消耗巨大和扩军备战结果美国财政赤字激增经济情况益恶化美国人民不满美政府增税和滥发通货的灾难政策,1951-10-30,1951-10
埃及外交大臣举行记者招待会斥美国“调解”英埃纠纷阴谋再度强调英军必须撤离埃及,1951-10-30,1951-10
北越人民军两周内歼敌二千五马来亚人民武装继续痛击英军,1951-10-30,1951-10
我国人民团体向日本人民坚决表示声援“松川事件”无辜被告的斗争反对奴役日本人民的美制单独和约,1951-10-30,1951-10
人民政协全国委员会昨日继续举行大会,1951-10-31,1951-10
和平解放西藏、巩固祖国国防解放军进藏部队进抵拉萨西藏地方政府官员和拉萨人民盛会欢迎,1951-10-31,1951-10
张经武将军代表毛主席向达赖喇嘛赠礼,1951-10-31,1951-10
应印、缅两国政府邀请我国文化代表团抵印印度各地人民热烈筹备欢迎,1951-10-31,1951-10
匈波两国人民观礼代表团昨日离北京返国,1951-10-31,1951-10
我们伟大的祖国,1951-10-31,1951-10
人民政协全国委员会第三次会议二十九日会上的专题报告和发言（编者按）,1951-10-31,1951-10
华东军政委员会委员陈毅发言掌握思想领导运用自我批评武器做好工作,1951-10-31,1951-10
伊朗和埃及人民的正义斗争,1951-10-31,1951-10
人民志愿军代表杜平发言坚决秉承祖国人民意志一定要战胜敌人,1951-10-31,1951-10
中央人民政府农业部部长李书城发言为开展更大规模的爱国增产运动而奋斗,1951-10-31,1951-10
妇女工作者代表章蕴发言团结教育广大妇女成为建设祖国的力量,1951-10-31,1951-10
农业劳动模范李顺达发言农民要实现增产节约抗美援朝三大任务,1951-10-31,1951-10
工业劳动模范郭树德发言发扬爱国主义精神努力生产厉行节约,1951-10-31,1951-10
新疆省人民政府主席鲍尔汉（维吾尔族）发言新疆各族人民得到了无限光明的前途,1951-10-31,1951-10
保护祖国的森林,1951-10-31,1951-10
老根据地代表崔玉振发言坚决执行毛主席的号召争取更大光荣,1951-10-31,1951-10
钢铁工程师王之玺发言把科学技术与群众结合为国家积累财富,1951-10-31,1951-10
人民政协全国委员会委员朱德海（朝鲜族）发言东北朝鲜族人民热烈展开爱国增产竞赛,1951-10-31,1951-10
西南军政委员会副主席熊克武发言两年来西南各项工作都有了显著成就,1951-10-31,1951-10
中央人民政府卫生部部长李德全发言为进一步提高人民健康水平而奋斗,1951-10-31,1951-10
世界和平理事会发表公报全世界已有五亿六千余万人民签名要求五大国缔结和平公约,1951-10-31,1951-10
世界和平理事会秘书顾里亚耶夫论世界和平运动成就,1951-10-31,1951-10
美日《安全条约》附有秘密的“行政协定”该秘密条款把日本完全变成了美国的殖民地,1951-10-31,1951-10
论英国议会选举的结果苏联真理报十月二十八日社论,1951-10-31,1951-10
郭沫若等离莫斯科赴维也纳,1951-10-31,1951-10
美日反动派设置特务机关对进步党派团体进行破坏妄图打击日本人民爱国运动,1951-10-31,1951-10
美国侵朝空军遭受日益严重的打击所谓“空中优势”正摇摇欲坠美国资产阶级反动通讯社被迫供认,1951-10-31,1951-10
