中共中央东北局关于加强增产节约运动领导的通报,1951-10-09,1951-10
衷心的感谢——饰演影片《赵一曼》的一些微小的心得,1951-10-09,1951-10
浙江金华县浦口村干部干涉群众婚姻自由坏分子俞章全乘机逼死妇女金华人民法院对有关案犯判处太轻应重新处理,1951-10-09,1951-10
加强区乡干部对婚姻法的学习,1951-10-09,1951-10
纠正音乐演唱中的不良现象,1951-10-09,1951-10
纺织服装工人工会国际贺电,1951-10-09,1951-10
印度人民团体和社会名流贺电,1951-10-09,1951-10
印度社会主义共和党祝贺我国国庆的决议,1951-10-09,1951-10
全印前进集团副主席雅齐和书记桑迪利亚贺电,1951-10-09,1951-10
越国民议会常设委员会贺电,1951-10-09,1951-10
越中友好协会贺电,1951-10-09,1951-10
巴中友好协会贺电,1951-10-09,1951-10
德保捷匈日等国人民贺信,1951-10-09,1951-10
日本人民抗议吉田反动政府非法审讯日共领袖吉田被迫释放砂间一良等六人,1951-10-09,1951-10
德意志民主共和国国庆典礼上格罗提渥报告两年来国家巨大成就并痛斥阿登纳政府拒绝人民议会的合理建议,1951-10-09,1951-10
新西兰、巴西共产党分别发表声明斥责各该国反动政府签署单独对日和约日本劳农党继续反对批准美制和约和美日军事协定,1951-10-09,1951-10
侵朝战争促使日本物价猛涨日本人民生活益贫穷,1951-10-09,1951-10
摩萨台决出席安理会讨论伊朗石油问题,1951-10-09,1951-10
打击美国空中强盗！,1951-10-09,1951-10
英雄的钢铁连,1951-10-09,1951-10
胜利地完成了战斗任务,1951-10-09,1951-10
联合国宣言与目前联合国之关系,1951-10-09,1951-10
中国人民革命军事委员会总政治部主持昨在京举行盛大联欢会,1951-10-10,1951-10
中共中央华北局、华北军区和华北事务部盛会招待各地来京参加国庆节的代表中央内务部欢宴北方、南方老根据地人民代表,1951-10-10,1951-10
志愿军“三八线尖刀英雄连”写信向毛主席致敬决粉碎美帝国主义侵略野心争取更大胜利回答祖国人民,1951-10-10,1951-10
中德文化合作协定昨在京签字,1951-10-10,1951-10
全国国营企业清理资产核定资金会议确定国营企业当前中心工作争取明年全部实行计划管理和经济核算制度,1951-10-10,1951-10
政务院财政经济委员会派出基本建设检查组,1951-10-10,1951-10
全国合作社业务计划会议拟定明年发展业务计划轮廓全国合作事业今年上半年有巨大发展社员已达五千多万股金共达五千余亿,1951-10-10,1951-10
爱伦堡、聂鲁达昨日离京飞莫斯科,1951-10-10,1951-10
华北人民缴纳献款达二千五百余亿元沈阳工商界贯彻增产方针具体进行缴款组织工作已如期完成缴纳第二期十架战斗机的献款计划,1951-10-10,1951-10
纽约《工人日报》报道美国防部无理阻挠停战谈判连美国反动报纸也表示不满,1951-10-10,1951-10
我们伟大的祖国,1951-10-10,1951-10
上海爱国公约运动还须注意深入发展,1951-10-10,1951-10
为实现东北国营企业增产节约千万吨粮食计划东北地方工业计划增产百五十万吨东北铁路系统争取年底以前创造超额利润百五十万吨,1951-10-10,1951-10
曲耀离互助组决将新棉全部售储给国家向全国棉农发起售棉储棉竞赛,1951-10-10,1951-10
刘景贵是怎样增产节约的？,1951-10-10,1951-10
我国畜牧业前途无量——华北区城乡物资交流展览会畜产馆介绍,1951-10-10,1951-10
收购新棉工作中存在的问题,1951-10-10,1951-10
不要满足于收购新棉的初步成绩经济生活简评,1951-10-10,1951-10
读者来信,1951-10-10,1951-10
对《芸姑娘》连环画批评的答复对人民日报读者批评建议的反应,1951-10-10,1951-10
我是共产党员，一定要作模范！,1951-10-10,1951-10
随时随地注意保守党和国家的机密,1951-10-10,1951-10
我们对“课堂讨论”的认识,1951-10-10,1951-10
庄严美丽的诗篇——介绍《聂鲁达诗文集》,1951-10-10,1951-10
语法、修辞讲话（第五讲）,1951-10-10,1951-10
医务工作者必须重视工人的生命和健康,1951-10-10,1951-10
苏联艺术家举行庆祝晚会,1951-10-10,1951-10
罗马尼亚布拉索瓦州人民委员会来电祝贺,1951-10-10,1951-10
匈牙利举行“中国电影周”,1951-10-10,1951-10
印度加雅人民举行庆祝大会,1951-10-10,1951-10
英中友好协会举行庆祝会,1951-10-10,1951-10
加劳工进步党领袖著文纪念,1951-10-10,1951-10
芬中友好协会举行“新中国展览会”,1951-10-10,1951-10
我人民解放军代表团在捷受到热烈欢迎,1951-10-10,1951-10
蔡畅电贺戈登夫人七十寿辰,1951-10-10,1951-10
法国侵越损失惨重塔西尼赴美英乞求援助美国决心进一步干涉越南战争,1951-10-10,1951-10
美国会通过庞大军事预算杜鲁门承认通货膨胀灾难严重图再度增税弥补巨大财政赤字,1951-10-10,1951-10
主子和奴才,1951-10-10,1951-10
国际朋友和京郊农民的欢聚,1951-10-10,1951-10
使敌人不能前进一步,1951-10-10,1951-10
打垮敌人的“空中优势”,1951-10-10,1951-10
扩大城乡物资交流，发展工农业生产——华北区城乡物资交流展览会开幕,1951-10-10,1951-10
把最好的工作成果献给伟大的祖国读者来信专页,1951-10-10,1951-10
新中国新人新事,1951-10-10,1951-10
中央人民政府委员会第十二次会议通过各项任免名单（续完）,1951-10-10,1951-10
金日成彭德怀两将军函复李奇微提出应立即在板门店恢复停战谈判在复会后立即规定关于扩大中立区及保障会址安全的原则指出铁的事实俱在美方不能推脱对拖延停战谈判应负的责任,1951-10-11,1951-10
朝鲜前线我迎头予敌以沉重打击我军一周歼敌万三千余我强大后备部队尚未显身手，战士们无不摩拳擦掌，准备赢取新的伟大胜利！,1951-10-11,1951-10
双方联络官昨协商复会事宜我提出有关会场和日期等问题取得对方基本同意对方竟又坚持讨论中立区具体范围问题横加阻挠,1951-10-11,1951-10
英国工人日报记者阿兰·魏宁顿和法国今晚报记者贝却敌评论全世界必须提防李奇微继续玩弄诡计他是在舆论的压力下才勉强部分同意了关于恢复谈判的建议,1951-10-11,1951-10
解放军进军拉萨途中受藏族人民热烈欢迎,1951-10-11,1951-10
中苏友协全国代表会议代表拥护斯大林同志谈话决更努力加强中苏人民的团结,1951-10-11,1951-10
斯大林谈话极受欧美舆论重视反动报纸沮丧、进步报纸欢迎,1951-10-11,1951-10
朝鲜人民纷纷讨论斯大林谈话增强了和平能战胜战争的信心,1951-10-11,1951-10
我国六大人民团体昨天设宴为印度缅甸印尼巴基斯坦观礼代表团饯别同时欢迎昨天抵京的英国人民观礼代表,1951-10-11,1951-10
印缅等国观礼代表赴东北,1951-10-11,1951-10
印度和巴基斯坦报纸发表评论拥护苏联禁止原子武器的主张,1951-10-11,1951-10
保罗匈等国观礼代表赴华东,1951-10-11,1951-10
苏联人民观礼代表团抵上海,1951-10-11,1951-10
印尼和缅甸华侨归国观光团昨日离北京赴东北参观,1951-10-11,1951-10
我们伟大的祖国,1951-10-11,1951-10
以创造性的劳动响应祖国的号召,1951-10-11,1951-10
坚决实行民主改革，办好人民铁路！——郑州铁路管理局实行民主改革的初步经验,1951-10-11,1951-10
北京市财政经济委员会公布工资“分”计算办法,1951-10-11,1951-10
经济生活简评,1951-10-11,1951-10
农业生产前进的道路——华北区城乡物资交流展览会农业生产改进馆介绍,1951-10-11,1951-10
对虐杀妇女案件应负责的干部应当受到惩处并作公开检讨,1951-10-11,1951-10
给古丝妲·伏契科娃的信,1951-10-11,1951-10
舒兰县土产公司违法收买耕牛应即检查纠正,1951-10-11,1951-10
下安村民兵查住偷盗棉纱犯榆次花纱布分公司来信表扬,1951-10-11,1951-10
我们组织“白毛女”影片座谈会的收获,1951-10-11,1951-10
中共湖北省委指示各级党委纠正压制群众批评的现象,1951-10-11,1951-10
中共天津市八区区委认真处理群众来信,1951-10-11,1951-10
党的生活简评,1951-10-11,1951-10
北京市是怎样发动妇女参政的？,1951-10-11,1951-10
部分司法工作干部漠视妇女利益处理婚姻案件极不负责高级司法机关应追究责任予以处理,1951-10-11,1951-10
华县人民法院拖延离婚案件造成刘胡娃被迫自杀事件失职人员须受适当处分,1951-10-11,1951-10
宜兴人民法院认真处理婚姻案件批评区乡失职干部失职干部应作出检讨报告在群众中公布,1951-10-11,1951-10
九三学社中央候补理事汤璪真逝世,1951-10-11,1951-10
政法工作简评,1951-10-11,1951-10
严肃地对待毛主席和斯大林大元帅的函电,1951-10-11,1951-10
美国纽约市三个地方同时举行和平集会斥责美国战争政策要求停止侵朝美十位名流致函联合国对朝鲜谈判僵局表示焦虑,1951-10-11,1951-10
日本众院共产党议员风早八十二痛斥吉田签订美制和约出卖民族独立代表日本人民坚决反对这个战争和奴役的条约,1951-10-11,1951-10
美国用这样的方法“解放”日本,1951-10-11,1951-10
国际简评,1951-10-11,1951-10
全亚洲、全世界妇女团结的象征——记中华全国民主妇女联合会欢迎应邀参加我国国庆节各国代表团妇女代表茶会,1951-10-11,1951-10
以少胜多，大量歼灭敌人！,1951-10-11,1951-10
安全行车一万六千三百公里,1951-10-11,1951-10
为了我们最可爱的人,1951-10-11,1951-10
马克思列宁主义事业中的重要事件毛泽东选集第一卷出版选集中的各篇文章都经过毛泽东同志校阅全国各地新华书店自今天起开始发行,1951-10-12,1951-10
双方联络官昨继续协商复会事宜我方提出复会时间仍为美方无理拒绝,1951-10-12,1951-10
英记者阿兰·魏宁顿揭露美方阻挠恢复谈判他们想拖延时间掩饰“攻势”但在这期间却遭到了惨重损失,1951-10-12,1951-10
西南各族人民缴纳献款将近认捐半数东北人民缴纳献款总额已达一千亿元以上杭州市人民缴款已占认捐总数的百分之九十五,1951-10-12,1951-10
苏联对外文化协会驻华代表欢宴中苏友好协会全国代表会议代表,1951-10-12,1951-10
北方老根据地人民观礼代表团赴天津水利代表同日离京赴津,1951-10-12,1951-10
华东暨上海各界人民集会欢迎苏联观礼代表团,1951-10-12,1951-10
波兰人民观礼代表团团长等访问我青年战斗英雄劳动模范,1951-10-12,1951-10
我们伟大的祖国,1951-10-12,1951-10
向拉萨进军途中,1951-10-12,1951-10
各地展开收购新棉工作,1951-10-12,1951-10
华北区城乡物资交流展览会区际馆介绍扩大城乡物资交流，发展工农业生产,1951-10-12,1951-10
推广标准操作法必须首先解除群众思想顾虑经济生活简评,1951-10-12,1951-10
我所看到的人民的东北,1951-10-12,1951-10
读者来信,1951-10-12,1951-10
天津市人民政府劳动局处理天津市私营隆顺营造厂违法乱拉在职技术人员事件 对人民日报读者批评建议的反应,1951-10-12,1951-10
伟大的理想鼓舞着人们前进——记东北某厂熔炼部增产节约运动中的共产党员,1951-10-12,1951-10
纠正某些农村党员的“吃大锅饭”思想,1951-10-12,1951-10
德国艺术家对中国音乐舞蹈和歌剧《白毛女》的评价,1951-10-12,1951-10
庆祝中华人民共和国成立两周年,1951-10-12,1951-10
文化生活简评技术学校应加强政治理论学习,1951-10-12,1951-10
在中国记者座谈会上的谈话,1951-10-12,1951-10
我国驻缅甸、印尼两大使馆国庆日均举行盛会招待贵宾,1951-10-12,1951-10
印度亲善访华团和印尼等国人民代表团抵沈阳森德拉尔离京前函谢周总理和郭沫若,1951-10-12,1951-10
我驻巴基斯坦大使馆国庆日招待华侨澳洲悉尼华侨热烈庆祝国庆,1951-10-12,1951-10
印度很多城市举行盛大集会庆祝我国建国两周年《自由报》著论热望中印友好,1951-10-12,1951-10
东欧各国人民热烈拥护斯大林谈话盛赞苏联坚定不移地推行和平政策,1951-10-12,1951-10
皮克号召西德爱国者支持人民议会的建议争取恢复德国统一加速缔结和约,1951-10-12,1951-10
苏联在安理会上仗义执言伊朗舆论界一致表示感谢,1951-10-12,1951-10
我电影工作者代表团在苏联各地访问,1951-10-12,1951-10
“中国艺术展览会”在波兰首都华沙揭幕,1951-10-12,1951-10
马来亚民族解放军击毙英驻马来亚高级专员,1951-10-12,1951-10
南越人民军及民兵在同塔梅等省歼敌千余,1951-10-12,1951-10
东欧人民民主国家留学我国的学生写信向毛主席祝贺我国庆节,1951-10-12,1951-10
国际简评,1951-10-12,1951-10
莫斯科的中国电影周,1951-10-12,1951-10
中国共产党各地党的组织积极准备学习毛泽东选集,1951-10-13,1951-10
毛泽东选集昨在各大城市同时发行,1951-10-13,1951-10
中德两国通邮通电协定昨日在京签字,1951-10-13,1951-10
美机昨公然两次扫射开城中立区双方联络官会议上美方仍无理阻挠复会,1951-10-13,1951-10
新华社特派记者报道美方无理取闹故意拖延谈判目的之一是反对在中立区问题上实行平等负责原则,1951-10-13,1951-10
第一次全国初等教育及师范教育会议确定了用革命办法发展人民教育的方针,1951-10-13,1951-10
政务院举行第一零六次会议,1951-10-13,1951-10
我们伟大的祖国,1951-10-13,1951-10
稳定和发展小学教育，培养百万人民教师,1951-10-13,1951-10
北京市劳动局进行系统检查推动各厂矿改进安全卫生工作城子煤矿创造井下八个月无重伤无死亡事故的纪录,1951-10-13,1951-10
当出了废品的时候,1951-10-13,1951-10
推广北京市劳动局检查安全卫生工作的好经验经济生活简评,1951-10-13,1951-10
我参加治淮的几点体验一定要把淮河修好！,1951-10-13,1951-10
扩大城乡物资交流，发展工农业生产依靠群众，战胜灾害——华北区城乡物资交流展览会战胜灾害馆介绍,1951-10-13,1951-10
我要好好学习《毛泽东选集》,1951-10-13,1951-10
斯大林谈话使我们认识到加强国防建设的重要性,1951-10-13,1951-10
政务院关于改革学制的决定鼓舞了劳动人民的学习积极性,1951-10-13,1951-10
为实现新学制而努力,1951-10-13,1951-10
各地领导机关应组织干部学习“语法、修辞讲话”和“标点符号用法”,1951-10-13,1951-10
山西省建筑公司及窑业总厂对轮窑等工程错误的检讨对人民日报读者批评建议的反应,1951-10-13,1951-10
认真贯彻执行婚姻法,1951-10-13,1951-10
介绍《米丘林选集》,1951-10-13,1951-10
美满婚姻,1951-10-13,1951-10
语法、修辞讲话（第五讲）,1951-10-13,1951-10
政法工作简评,1951-10-13,1951-10
文化零讯,1951-10-13,1951-10
不准国会批准单独和约与美日军事协定日本和委会号召人民团结斗争要求五大国缔结和平公约制止战争,1951-10-13,1951-10
日本国会临时会议揭幕吉田图使国会批准美制和约,1951-10-13,1951-10
宋庆龄电贺戈登夫人寿诞巴黎举行戈登夫人寿辰庆祝会,1951-10-13,1951-10
被非法监禁的希腊民主议员格列索斯向斯大林和毛主席发出呼吁,1951-10-13,1951-10
越南通讯社和蒙古《真理报》的评论指出斯大林谈话加强了和平人民的信心,1951-10-13,1951-10
在中朝部队严重打击下美侵略军士气愈低,1951-10-13,1951-10
在伊朗人民的压力下英石油技术人员撤离伊朗美英争夺伊朗石油控制权加剧,1951-10-13,1951-10
法西斯后代的妄想,1951-10-13,1951-10
苏联对侵略者提出警告——论斯大林关于原子武器问题的谈话,1951-10-13,1951-10
国际简评抗议泰政府摧残华侨教育,1951-10-13,1951-10
美机十二日扫射开城中立区事件又一次证明美国将军们是一群疯狂的野兽美国行凶者应立即对扫射事件作出迅速负责的处理,1951-10-14,1951-10
尼泊尔共产党电毛主席贺我国庆,1951-10-14,1951-10
阴谋利用日本进行侵朝战争美策动“日韩军事同盟”,1951-10-14,1951-10
印度等国观礼代表团在沈阳进行访问活动,1951-10-14,1951-10
中国人民赴朝慰问团两个分团在西北西南广大地区作了传达报告,1951-10-14,1951-10
解放军志愿军战斗英雄座谈会结束战斗英雄劳动模范和老根据地人民代表报告了各种英勇事迹每个人都受到一次国际主义、爱国主义和新英雄主义的教育,1951-10-14,1951-10
西北区各族人民缴纳献款九百余亿佛教首领和民主人士踊跃捐献,1951-10-14,1951-10
少数民族语言文字研究指导委员会成立,1951-10-14,1951-10
我们伟大的祖国,1951-10-14,1951-10
中国人民抗美援朝总会关于纪念志愿军出国作战一周年并加强抗美援朝工作的通知,1951-10-14,1951-10
首都各界人民热爱毛主席著作决心好好学习《毛泽东选集》,1951-10-14,1951-10
朝鲜人民热爱中国人民志愿军英雄,1951-10-14,1951-10
护士与伤员,1951-10-14,1951-10
转变领导思想是作好基本建设的关键没有正确的工程设计就不可能施工！,1951-10-14,1951-10
创造性的劳动——记东北橡胶四厂增产节约运动的一角,1951-10-14,1951-10
私营棉纺织工业家荣毅仁等致函曲耀离感谢他提高棉花产量,1951-10-14,1951-10
为农民弟兄多制造更便宜更好用的新式农具扩大城乡物资交流，发展工农业生产,1951-10-14,1951-10
在收购新棉工作中加强经济保卫工作经济生活简评,1951-10-14,1951-10
读者来信学习《毛泽东选集》能使我们在各方面提高一步,1951-10-14,1951-10
斯大林同志的谈话增强了我们保卫和平的信心,1951-10-14,1951-10
我们要深入向市民宣传斯大林谈话的伟大意义,1951-10-14,1951-10
农民要求出版界编通俗字典,1951-10-14,1951-10
北京市文教局对工农教育工作不够重视,1951-10-14,1951-10
北京市文教局的检讨,1951-10-14,1951-10
向压制批评的官僚主义作风作坚决斗争,1951-10-14,1951-10
无锡市夜党校进行了共产主义教育,1951-10-14,1951-10
崇高的荣誉——访问北方老根据地人民代表,1951-10-14,1951-10
为消灭报纸上的错字而斗争,1951-10-14,1951-10
老根据地人民的革命意志,1951-10-14,1951-10
访问冀西老根据地,1951-10-14,1951-10
对戏曲改革中的反历史主义倾向应展开批评,1951-10-14,1951-10
应该克服庸俗的插科打诨,1951-10-14,1951-10
以加强抗美援朝工作来纪念志愿军出国作战一周年,1951-10-14,1951-10
苏联人民为各国人民间的和平与友好而斗争,1951-10-14,1951-10
我们要在东方和西方为争取和平而斗争,1951-10-14,1951-10
全世界人民怀着兴奋愉快的深情注视你们捷克和平委员会及捷克妇女联合会代表古丝妲·伏契科娃给中国人民志愿军的一封信,1951-10-14,1951-10
你们是我们最亲爱的同志和兄弟保加利亚和平委员会副主席卡拉斯拉渥夫给中国人民志愿军的一封信,1951-10-14,1951-10
给中国人民志愿军的一个战士,1951-10-14,1951-10
我们和你们的思想感情是连在一起的德国文化民主复兴联盟代表赛兹教授给中国人民志愿军的一封信,1951-10-14,1951-10
你们的斗争帮助了我们罗马尼亚的人民罗马尼亚保卫和平常设委员会副主席列巴达土给中国人民志愿军的一封信,1951-10-14,1951-10
进一步发展和巩固中苏人民伟大友谊中苏友协代表会议闭幕决议对广大人民进行国际主义思想教育和学习苏联先进经验的教育,1951-10-15,1951-10
南日将军关于美机扫射开城中立区事件向金日成彭德怀两将军的报告,1951-10-15,1951-10
朝鲜前线我炮兵部队配合步兵痛歼进犯敌,1951-10-15,1951-10
联络官会议昨日继续举行,1951-10-15,1951-10
美方显然继续阻挠恢复谈判全部复查过程证明是美机扫射中立区我方联络官再次奉命向美方提出抗议,1951-10-15,1951-10
各地人民决心努力学习毛泽东思想新疆各民族干部欢迎毛泽东选集用少数民族文字出版,1951-10-15,1951-10
我们伟大的祖国,1951-10-15,1951-10
中苏友协全国代表会议致斯大林大元帅电,1951-10-15,1951-10
中苏友协全国代表会议致毛主席电,1951-10-15,1951-10
具体深入地开展中苏友好工作——祝中苏友好协会第一次全国代表会议,1951-10-15,1951-10
盲目进行基本建设必然造成浪费,1951-10-15,1951-10
中国人民完全可以用自己的力量建设好自己的国家——老工程师萨福均谈成渝铁路的修筑,1951-10-15,1951-10
经济生活简评警惕反革命分子破坏秋征,1951-10-15,1951-10
新河卡和老河卡,1951-10-15,1951-10
华北工商业在迅速发展——华北区城乡物资交流展览会工商改进馆介绍,1951-10-15,1951-10
我要学习《毛泽东选集》做一个毛泽东的好学生,1951-10-15,1951-10
斯大林同志的谈话，长了人民的志气，灭了帝国主义的“威风”,1951-10-15,1951-10
中国的“保尔·柯察金”吴运铎是青年们工作学习的好榜样,1951-10-15,1951-10
北京电车女司机正式行车表现了我国妇女的无穷力量,1951-10-15,1951-10
“褫夺公权”的说法不妥当应改用“剥夺政治权利”,1951-10-15,1951-10
永茂建筑工程公司承建某厂宿舍施工粗糙造成返工浪费,1951-10-15,1951-10
对人民日报读者批评建议的反应,1951-10-15,1951-10
全国妇联召开妇女儿童福利工作会议决定推广妇婴卫生和育儿常识为今后首要工作任务,1951-10-15,1951-10
兄弟会晤,1951-10-15,1951-10
河南省各地注意加强对农民的政治教育工作,1951-10-15,1951-10
党员不能有个人的自私目的党的生活简评,1951-10-15,1951-10
最高人民法院、司法部关于检查司法干部思想作风及对干涉婚姻自由杀害妇女的犯罪行为展开群众性司法斗争的指示坚决贯彻婚姻法，保障妇女权利！,1951-10-15,1951-10
山东省人民法院滕县分院纠正丰县法院对婚姻案件的错误判决朱树人等滥用职权维护封建婚姻制度应作深刻检讨,1951-10-15,1951-10
竹溪县司法科轻判违犯婚姻法的案犯郧阳人民法院分院提出改判意见,1951-10-15,1951-10
我们永远在一起——致伏契科娃的信,1951-10-15,1951-10
“毛主席万岁！”——记“人民革命老根据地礼品文物展览会”,1951-10-15,1951-10
埃及决定废除英埃条约和共管苏丹协定开罗十万市民举行反英示威游行游行者高呼：“埃及站起来！”“英国人滚出埃及去！”,1951-10-15,1951-10
斯大林关于原子武器的谈话是维护和平的最有力的贡献中东各地报纸评论斯大林的谈话,1951-10-15,1951-10
苏联中国电影节结束观众达数百万一致赞扬我国电影事业的成就,1951-10-15,1951-10
在日本国会众院会议上吉田无耻要求批准单独和约日警继续大规模搜查民主报刊,1951-10-15,1951-10
侵朝各国帮凶军士气越来越低沉,1951-10-15,1951-10
美国人民不满侵朝战争普遍对输血运动非常冷淡,1951-10-15,1951-10
美英法图修改对意和约利用意大利进行侵略苏联照会美英法三国提出严正主张修改对意和约必须有助加强和平和保证意国平等独立,1951-10-15,1951-10
一位阵亡美国士兵的母亲反对侵朝战争呼吁争取和平,1951-10-15,1951-10
如此“安全”！,1951-10-15,1951-10
埃及决定废除英埃条约国际简评,1951-10-15,1951-10
范佛里特“秋季攻势”第一回合的败绩,1951-10-15,1951-10
一座新房子的故事,1951-10-15,1951-10
在京津参观后深感伟大祖国的可爱李顺达等订爱国增产公约联名写信给毛主席保证争取更大丰收,1951-10-16,1951-10
迎接志愿军出国作战一周年纪念日中南人民缴纳献款已达四千余亿元,1951-10-16,1951-10
南方老根据地人民代表赴天津参观北方老根据地人民代表和农业、水利劳动模范离津,1951-10-16,1951-10
双方联络官十五日继续会谈美方仍拖延谈判会议的恢复,1951-10-16,1951-10
华东和上海各界人民集会欢迎各国观礼代表团,1951-10-16,1951-10
苏联人民观礼代表团赴杭州,1951-10-16,1951-10
印度等国代表团离沈赴津,1951-10-16,1951-10
我驻印尼三领事馆开馆国庆日曾举行招待晚会,1951-10-16,1951-10
东北人民政府召开会议检查婚姻法的执行情况,1951-10-16,1951-10
沈阳市判决帝国主义传教士阴谋破坏案上海南京等市军管会宣布取缔“圣母军”,1951-10-16,1951-10
我们伟大的祖国,1951-10-16,1951-10
爱伦堡、聂鲁达离北京之前向中国人民告别的演说,1951-10-16,1951-10
中央人民政府劳动部发布关于搬运危险性物品的几项办法,1951-10-16,1951-10
山西运城专区参观华北区城乡物资交流展览会农民代表向毛主席报告参观后的思想变化认识了工人阶级的伟大领导作用，愿努力生产巩固工农联盟,1951-10-16,1951-10
检讨我对基本建设的错误思想,1951-10-16,1951-10
把棉花全部卖给国家,1951-10-16,1951-10
保护劳动的又一重要措施,1951-10-16,1951-10
提高单位面积产量，生产更多的粮食——华北区城乡物资交流展览会粮食馆介绍,1951-10-16,1951-10
我们全军加入中苏友协为会员表示中苏人民友谊更加坚强了,1951-10-16,1951-10
中苏两大国的友好团结是世界和平最有力的保证,1951-10-16,1951-10
参观了铁路展览会后我更加热爱祖国了,1951-10-16,1951-10
