以三八线作为双方军事分界线是公平合理的主张,1951-08-09,1951-08
美方违反协议袭击我代表团车辆南日将军提出严正抗议希望美方保证今后不再发生同类事件,1951-08-10,1951-08
美方破坏协议向板门店中立区射击,1951-08-10,1951-08
金日成彭德怀两将军答复李奇微我方郑重保证执行协议，除非美方有意制造事件以借口终止谈判,1951-08-10,1951-08
上海报纸许多读者痛斥美方荒谬主张,1951-08-10,1951-08
美方所提军事分界线的荒谬要求激起中朝战士无比愤怒表示中朝人民热爱和平，但并不怕继续反抗侵略战争,1951-08-10,1951-08
塔斯社报道：美国拖延谈判是为准备进攻,1951-08-10,1951-08
在停战谈判会议期间美国再次露出扩大侵略马脚朝鲜中央通讯社斥美方无谈判诚意,1951-08-10,1951-08
纽约《工人日报》发表社论斥美政府提出侵略性要求,1951-08-10,1951-08
法共《人道报》指出：美国制造困难图使谈判失败,1951-08-10,1951-08
我们伟大的祖国,1951-08-10,1951-08
全国人民电贺党的三十周年,1951-08-10,1951-08
（一）美国政府和平诚意的又一次考验,1951-08-10,1951-08
（二）选举必须反对关门主义和形式主义,1951-08-10,1951-08
中南工业部开始检查基本建设一九五零年的基本建设浪费很大,1951-08-10,1951-08
浙江省提前超额完成购棉储棉任务山东德州地委各县委对完成任务有充分信心抽调一切可以抽调的人力投入购棉储棉运动,1951-08-10,1951-08
陕西省兴平县农民开展爱国保棉竞赛,1951-08-10,1951-08
发挥农村合作社在购、储棉工作中应有的积极作用,1951-08-10,1951-08
我们在基本建设中遇到的几个问题,1951-08-10,1951-08
教育工作者应好好学习《武训历史调查记》,1951-08-10,1951-08
学习“武训历史调查团”的立场、观点和方法,1951-08-10,1951-08
我们关于《武训传》问题的检讨,1951-08-10,1951-08
我不该盲目支持武训继承人武金栋的“兴学”,1951-08-10,1951-08
“武训历史调查团”完成了一项艰巨的任务,1951-08-10,1951-08
宁死不屈的八勇士,1951-08-10,1951-08
文化生活动态,1951-08-10,1951-08
西北区党的宣传网,1951-08-10,1951-08
中央人民政府政务院关于改善各级学校学生健康状况的决定,1951-08-10,1951-08
中华全国学生第十五届代表大会决议,1951-08-10,1951-08
正确执行政务院改善学生健康状况的决定,1951-08-10,1951-08
北京市郊区八十五个村的村选工作,1951-08-10,1951-08
法英意三国人民纷纷发表声明或集会拥护苏联关于缔结和平公约建议要求各该国政府迅速行动促其实现,1951-08-10,1951-08
反对杜鲁门政府法西斯迫害美共号召人民保卫民主权利美反动当局竟又逮捕美共干部五人,1951-08-10,1951-08
参加联欢节我青年文工团在柏林公演受到欢迎,1951-08-10,1951-08
我全国总工会等人民团体电贺青年联欢节开幕抗议驻奥美军无理阻拦青年代表,1951-08-10,1951-08
苏联发表第二季生产公报工业总产量较去年同期增百分之十六,1951-08-10,1951-08
美日反动派加紧复活日本军国主义鸠山一郎等一万余名法西斯分子又被解除整肃处分,1951-08-10,1951-08
驻奥美军无理留难各国青年代表奥共英共提出抗议,1951-08-10,1951-08
联欢节歌曲比赛揭晓我国歌曲“全世界人民心一条”荣获二等奖,1951-08-10,1951-08
美英战俘和平委员会呼吁立即结束侵朝战争,1951-08-10,1951-08
越南中部广南省地方人民军上半年歼法军千余人,1951-08-10,1951-08
爱好和平的人民的职责苏联真理报社论,1951-08-10,1951-08
国际动态,1951-08-10,1951-08
朝鲜停战谈判会议昨日复会我重申以三八线为分界线严斥美方图中止讨论我方案的无理要求对美方连续违反协议再度提出书面抗议,1951-08-11,1951-08
中央人民政府北方老根据地访问团山东皖北苏北分团赴山东访问南方老根据地访问团分别前往各地,1951-08-11,1951-08
政务院举行会议通过关于改革学制的决定,1951-08-11,1951-08
华东各地优待烈军属成为经常工作订出各种优抚办法并把优抚工作列入爱国公约,1951-08-11,1951-08
华北各中小城市人民政府组织烈军属参加生产“八一”前后深入检查和推动优抚工作,1951-08-11,1951-08
我们伟大的祖国,1951-08-11,1951-08
中外记者评板门店事件,1951-08-11,1951-08
全国人民电贺党的三十周年,1951-08-11,1951-08
评朝鲜停战谈判,1951-08-11,1951-08
湖南杨梅山煤矿打垮封建残余势力民主改革工作胜利开展,1951-08-11,1951-08
京西矿务局检查基本建设因计划设计不周、盲目施工造成了不少浪费认识到以小生产观点对待工业建设必然失败,1951-08-11,1951-08
城市房地产税暂行条例,1951-08-11,1951-08
经济生活动态,1951-08-11,1951-08
读者来信,1951-08-11,1951-08
香河王店子村干部作风不纯问题中共香河县委员会已作处理对人民日报读者批评建议的反应,1951-08-11,1951-08
新疆土地占有及封建剥削的若干情况,1951-08-11,1951-08
宁死不屈的八勇士,1951-08-11,1951-08
全世界人民心一条（歌词）,1951-08-11,1951-08
东北局举办新闻研究班的经验,1951-08-11,1951-08
语法、修辞讲话（第三讲）,1951-08-11,1951-08
幸福的年青一代——记中国少年儿童队西北区夏季旅行代表队和东北儿童旅行团,1951-08-11,1951-08
全日本产业别工会会议拥护世界工联决议反对重新武装日本要求全面缔和号召日本工人团结一致加强和平斗争,1951-08-11,1951-08
美国为扶植日战争工业竟要各国放弃赔偿要求许多日本工厂为侵朝美军制造武器,1951-08-11,1951-08
美著名战争贩子杜威到远东进行阴谋活动,1951-08-11,1951-08
“美国和平十字军”致书联合国要求开城谈判期间停止军事行动,1951-08-11,1951-08
美国工人日报和比利时红旗报揭露美方拖延停战谈判诡计,1951-08-11,1951-08
美政府所谓轮换制变成骗局侵朝美军更加厌战,1951-08-11,1951-08
真理报严正驳斥英外相莫里逊谰言莫里逊反苏的诽谤遭到可耻失败各国进步舆论一致拥护真理报明确有力的论据,1951-08-11,1951-08
德国青年与中朝青年代表在柏林举行联欢会,1951-08-11,1951-08
美国经济的军事化,1951-08-11,1951-08
美方故意掩饰其荒谬方案南日将军予以严正指责朝鲜停战谈判会议关于军事分界线的讨论昨仍无任何进展,1951-08-12,1951-08
美方对分界线问题矛盾百出混乱不堪乔埃至今不敢公开发表美方方案究竟是什么,1951-08-12,1951-08
荣获斯大林奖金的文艺工作者上书毛主席致敬,1951-08-12,1951-08
关于美机扫射我代表团供应车辆事南日将军二次向乔埃抗议书全文严斥美方违背协议反发表诬蔑性言论,1951-08-12,1951-08
美进步党责美政府阻挠谈判,1951-08-12,1951-08
印尼政府违反国际愤例我赴使馆人员被迫返国我政府和人民对此极表示遗憾,1951-08-12,1951-08
中央北方老根据地访问团华北分团由京出发访问将分访晋冀鲁豫、晋察冀和晋绥等老区,1951-08-12,1951-08
中南西北部分地区优抚工作获成绩尊敬烈军属成为社会风气各地组织代耕介绍职业烈军属生活困难初步解决,1951-08-12,1951-08
我们伟大的祖国,1951-08-12,1951-08
乔埃对南日将军第一次抗议的无理答复,1951-08-12,1951-08
全国人民电贺党的三十周年,1951-08-12,1951-08
京市协商委员会和政府委员会昨举行联席会议授权城、郊各区各界人民代表会议选举区人民政府,1951-08-12,1951-08
各地土产参观团推动了物资交流,1951-08-12,1951-08
全国实行劳动保险的企业已达两千四百四十余单位,1951-08-12,1951-08
全国各地土产销出百分之八十以上农民购买力大大提高，城乡经济空前繁荣。,1951-08-12,1951-08
准备秋季物资交流天津召开棉织品等十个专业会议中南积极组织收购和物资调运,1951-08-12,1951-08
西北建筑公司副总工程师张连步认真钻探地基避免了工程上严重的危险,1951-08-12,1951-08
工程技术人员的榜样,1951-08-12,1951-08
反对基本建设中的三种错误思想,1951-08-12,1951-08
从北京市中小工厂看必须加强党对爱国公约运动的领导,1951-08-12,1951-08
经济生活动态,1951-08-12,1951-08
本报很多读者来信坚决拥护以三八线为双方军事分界线,1951-08-12,1951-08
福建德化县不少乡村干部封建思想作怪不执行婚姻法,1951-08-12,1951-08
太原修造厂接受批评检讨工程失败原因,1951-08-12,1951-08
永绥县花垣镇强迫组织的理发合作社已解散了,1951-08-12,1951-08
中国人民银行总行关于来信中引用材料不确实的答复,1951-08-12,1951-08
宁死不屈的八勇士,1951-08-12,1951-08
给杰米扬·别德内依〔一〕同志的信,1951-08-12,1951-08
在祖国的西南,1951-08-12,1951-08
评一本夸大宣传帝国主义空军威力的画册,1951-08-12,1951-08
格利佛游记的《译后散记》,1951-08-12,1951-08
文化生活动态,1951-08-12,1951-08
各国参加联欢节青年代表关切开城谈判一致痛斥美国拖延谈判的阴谋,1951-08-12,1951-08
参加青年联欢节各国代表团举行各种艺术表演我青年文工团演出获巨大成功,1951-08-12,1951-08
越人民访华代表团抵天津,1951-08-12,1951-08
各国民主青年进步组织抗议驻奥美军留难青年代表,1951-08-12,1951-08
各国人民拥护什维尔尼克的建议赞成缔结和平公约巩固国际和平谴责杜鲁门政府扩军备战违背全世界人民愿望,1951-08-12,1951-08
驻奥美军殴伤英国青年代表,1951-08-12,1951-08
越南人民军两次炮轰西贡码头保大伪军纷纷向人民军投诚,1951-08-12,1951-08
反对冻结工资、要求提高生活水平美国工人积极展开罢工斗争反动报刊招认以后将有大规模罢工,1951-08-12,1951-08
在哈里曼的干涉与压力下伊政府与英恢复谈判伊朗舆论不满与美英妥协,1951-08-12,1951-08
波兰审讯在波军中进行破坏的美英间谍严厉打击了英美帝国主义间谍机关的罪恶计划,1951-08-12,1951-08
印度报纸评论指出全世界关心和平的人民都拥护什维尔尼克建议,1951-08-12,1951-08
惧怕苏联建议会影响扩军备战美英法统治集团惊慌万状妄图曲解什维尔尼克建议,1951-08-12,1951-08
热爱祖国认真执行增产捐献计划各地人民踊跃缴纳捐款全国店员职工已缴捐款八十二亿余元山东和湖南人民献机增至二百四十架,1951-08-13,1951-08
南日将军继续严斥美方荒谬方案美方须负会议仍无进展的责任指出对方一日不认真考虑我方公平合理方案，会议就一日不能获得进展。,1951-08-13,1951-08
赴朝慰问团西南分团传达报告鼓舞人民加强抗美援朝工作,1951-08-13,1951-08
朝鲜记者评美方袭击我方车辆美方悍然违反所担当的义务再度暴露其无建立和平诚意,1951-08-13,1951-08
美国报纸透露美妄图霸占三八线以北钨矿,1951-08-13,1951-08
伦敦工人日报称：英国人民要求达成停战协议,1951-08-13,1951-08
摩洛哥共产党电贺中共三十周年,1951-08-13,1951-08
迎接华北首次县长会议华北各省加紧总结民主建政工作,1951-08-13,1951-08
上海和中南区等地许多城市与县份依靠群众积极清理反革命案件,1951-08-13,1951-08
新中国国家机关决不容贪污者存身！陈贤凡滥用职权贪污舞弊被判处死刑,1951-08-13,1951-08
我们伟大的祖国,1951-08-13,1951-08
全国人民电贺党的三十周年,1951-08-13,1951-08
许多单位存在局部观点轻视材料工作全国铁路材料浪费现象严重材料部门和生产部门应密切结合加强整体观念清理资材，核定资金，反对浪费！,1951-08-13,1951-08
从整体出发，做好材料工作！,1951-08-13,1951-08
上海戚墅堰铁路工厂大批材料积压浪费亟须清理资产核定资金,1951-08-13,1951-08
经济生活动态,1951-08-13,1951-08
读者来信,1951-08-13,1951-08
对人民日报读者批评建议的反应,1951-08-13,1951-08
新疆省规模巨大的水利灌溉工程,1951-08-13,1951-08
宁死不屈的八勇士,1951-08-13,1951-08
中长路阿城站党组织在经济核算中的思想教育工作,1951-08-13,1951-08
平原省文教厅没有认真检讨歌颂“武训精神”的错误思想,1951-08-13,1951-08
关于《永乐大典》,1951-08-13,1951-08
历史的镜子——《武训历史调查记》读后感,1951-08-13,1951-08
“防御”为名，侵略是实,1951-08-13,1951-08
拥护缔结和平公约反对美国准备战争柏林各国青年代表举行和平集会号召各国青年进一步加强国际团结,1951-08-13,1951-08
参加联欢节各国女青年代表五万余人举行声援女青年和平战士示威大会国际妇联以和平鸽奖章授给李顺任、第安等,1951-08-13,1951-08
介绍中国青年的斗争和生活我国照片展览会在柏林揭幕,1951-08-13,1951-08
对苏联建议缔结和平公约只字不提杜鲁门力图掩饰窘态故意歪曲什维尔尼克建议,1951-08-13,1951-08
马来亚英殖民当局疯狂无理拘捕华侨,1951-08-13,1951-08
日本工人要求全面缔和运动高涨“总评”发表宣言愿意参加和平运动反对重新武装全面媾和协议会与“产别”发表声明表示欢迎,1951-08-13,1951-08
杰斐逊与华盛顿的悲哀,1951-08-13,1951-08
莫里逊又挨了一耳光,1951-08-13,1951-08
战胜了敌人的空中威胁,1951-08-13,1951-08
北京等地许多私营工厂劳资协商订增产捐献计划根据计划纷纷修订爱国公约推进生产,1951-08-14,1951-08
平江举行老根据地人民及烈军工属代表会议中央访问团传达毛主席的关怀和指示会议致电毛主席保证执行指示争取更大的光荣,1951-08-14,1951-08
中央人民政府政务院通告抗日战争胜利日改定为九月三日,1951-08-14,1951-08
上海市志愿医疗手术顾问团出发赴朝鲜前线服务各地铁路工人援朝运输队先后启程,1951-08-14,1951-08
抗议美机投掷毒气炸弹朝外相朴宪永电联大与安理会主席要求将美国的战争罪犯交付裁判,1951-08-14,1951-08
在南日将军数日来不断质问下美方对分界线狂妄企图彻底暴露如果美方继续坚持其荒谬狂妄的方案会议停顿的责任必须完全由美方负担,1951-08-14,1951-08
巴基斯坦今日国庆毛主席周总理分电祝贺,1951-08-14,1951-08
青海伊斯兰教和喇嘛教人士曾分别组织抗美援朝宣传队深入回藏人民聚居地区宣传,1951-08-14,1951-08
采取“原案归宗”办法得到广大人民协助重庆市清理反革命积案工作接近完成,1951-08-14,1951-08
我们伟大的祖国,1951-08-14,1951-08
全国人民电贺党的三十周年,1951-08-14,1951-08
县人民代表会议没有开好的必须检讨,1951-08-14,1951-08
在停工学习期间提高了政治觉悟各纺织厂工人生产热情高涨努力节约原棉使白花率次布率大大降低,1951-08-14,1951-08
实行精耕细作·加强技术管理石家庄市郊区劳动模范张君琦试验棉田每亩可产籽棉八百斤,1951-08-14,1951-08
中央人民政府公安部布告,1951-08-14,1951-08
无线电器材管理暂行条例,1951-08-14,1951-08
受管制无线电器材范围表,1951-08-14,1951-08
打破思想障碍做好核定资金工作——记天津钢厂清理资产核定资金的前后,1951-08-14,1951-08
读者来信,1951-08-14,1951-08
对人民日报读者批评建议的反应热河省抗美援朝分会对印错“目前世界形势略图”的检讨,1951-08-14,1951-08
宁死不屈的八勇士,1951-08-14,1951-08
中共原阳县委进一步批判不问政治倾向,1951-08-14,1951-08
纠正忽视民主政权建设工作的偏向！河北省获鹿县将代表会与干部会混淆起来,1951-08-14,1951-08
纠正忽视民主政权建设工作的偏向！山西省忻县领导干部对人民代表会议看法不正确,1951-08-14,1951-08
纠正忽视民主政权建设工作的偏向！察哈尔省应县忽视人民代表的民主权利,1951-08-14,1951-08
河北省邢台县在两年内只改选了一次代表纠正忽视民主政权建设工作的偏向！,1951-08-14,1951-08
河北省新乐县干部竟认为人民代表会议“作用不大”纠正忽视民主政权建设工作的偏向！,1951-08-14,1951-08
美帝国主义传教士在西康巴塘的侵略活动,1951-08-14,1951-08
西康藏族自治区成立之后,1951-08-14,1951-08
朝鲜劳动党中央委员会发布纪念“八、一五”口号号召人民提高警惕性坚决战斗,1951-08-14,1951-08
要求缔结全面对日和约日本已有三百一十余万人签名美日反动派加紧策划日美军事协定修建军事基地,1951-08-14,1951-08
缅甸和平大会通过决议反对美国武装日本全缅学联反对美制对日和约,1951-08-14,1951-08
奥地利人民展开募捐运动慰问被留难的外国青年代表,1951-08-14,1951-08
一百零一个国家青年代表抵达柏林参加青年联欢节帝国主义者阻挠与破坏阴谋失败,1951-08-14,1951-08
庆祝世界青年联欢节缅甸青年举行盛会示威游行反对武装日本,1951-08-14,1951-08
美国企图借“粮食援助”掠夺印度矿产,1951-08-14,1951-08
法共政治局就普利文组阁通过决议谴责议会反动多数执行服从美国要求的政策号召工人加强团结迫使法政府满足人民要求,1951-08-14,1951-08
法政府疯狂备战引起物价高涨法国工人普遍要求提高工资反动统治集团一致感到非常恐惧,1951-08-14,1951-08
法政府危机延续三十余天后普利文勉强拼凑成新政府法统治集团内部矛盾更趋公开,1951-08-14,1951-08
在来比锡和布拉格国际博览会上,1951-08-14,1951-08
朝鲜解放六周年纪念毛主席周总理致电祝贺我国各民主党派及全国妇联等亦电致贺,1951-08-15,1951-08
美李匪军在停战谈判期间仍不断进犯中朝人民部队续歼敌二千余,1951-08-15,1951-08
张经武抵西藏会晤达赖喇嘛西藏地方政府人员电毛主席表示感谢达赖喇嘛率西藏地方政府启程返拉萨,1951-08-15,1951-08
巴基斯坦驻我国代办举行国庆日招待会,1951-08-15,1951-08
南日将军再斥美方狂妄要求中外记者继续揭露美方对谈判无诚意,1951-08-15,1951-08
新华社记者报道美方玩弄把戏图达到侵略目的,1951-08-15,1951-08
英国工人日报记者报道美方应负开城会议僵局全责,1951-08-15,1951-08
我们伟大的祖国,1951-08-15,1951-08
庆祝朝鲜解放六周年,1951-08-15,1951-08
法国今晚报记者揭露乔埃继续玩弄两面手法,1951-08-15,1951-08
全国人民电贺党的三十周年,1951-08-15,1951-08
政务院财政经济委员会关于改进与加强基本建设计划工作的指示,1951-08-15,1951-08
正确编制企业计划才能合理核定资金,1951-08-15,1951-08
城市旅栈业暂行管理规则,1951-08-15,1951-08
公共娱乐场所暂行管理规则,1951-08-15,1951-08
印铸刻字业暂行管理规则,1951-08-15,1951-08
读者来信,1951-08-15,1951-08
对人民日报读者批评建议的反应,1951-08-15,1951-08
一封家信,1951-08-15,1951-08
东北宣传员、报告员组织又有新发展,1951-08-15,1951-08
应当重视读报组工作,1951-08-15,1951-08
一九五○年人民监察工作总结及一九五一年工作任务的报告（一九五一年六月八日政务院第八十八次政务会议批准）,1951-08-15,1951-08
语法、修辞讲话（第三讲）,1951-08-15,1951-08
（一）请多多把精神食粮送给志愿军,1951-08-15,1951-08
（二）应当建立检查爱国公约的经常制度,1951-08-15,1951-08
克服爱国公约运动中的形式主义,1951-08-15,1951-08
东北农村的爱国丰产捐献运动,1951-08-15,1951-08
全国各地签名拥护缔结和平公约投票反对美国武装日本人数统计表,1951-08-15,1951-08
志愿军来信志愿军军邮发行股的来信,1951-08-15,1951-08
写给志愿军,1951-08-15,1951-08
抗美援朝动态,1951-08-15,1951-08
英勇战斗的朝鲜人民万岁！,1951-08-15,1951-08
志愿军归国代表“八一”节写信问候毛主席朱总司令健康,1951-08-15,1951-08
朱总司令故乡的烈属和军属向毛主席朱总司令报告生活情况,1951-08-15,1951-08
北京电信局爱国公约和竞赛结合后生产上表现了突出成绩,1951-08-15,1951-08
北京市公共汽车公司修订爱国公约掀起劳动竞赛竞赛条件和爱国公约相结合,1951-08-15,1951-08
皖北来安县青龙、独山两乡抗美援朝运动还没展开,1951-08-15,1951-08
邮局不应代售宣扬封建迷信的画片,1951-08-15,1951-08
建议推广幻灯宣传,1951-08-15,1951-08
不要乱用仅仅一个小圈子里面的人才能懂得的名词,1951-08-15,1951-08
颍上徐楼乡长吴金烂调动工作时组织群众“欢送”造成恶劣影响,1951-08-15,1951-08
西北行政区和辽东省都有西安市写信时应分别清楚以免发生错误,1951-08-15,1951-08
怎样对待反革命分子的家属？,1951-08-15,1951-08
中央技术管理局对工人杨秀芝的发明创造应采取积极支持的态度,1951-08-15,1951-08
寻人名单革命军人家属寻找革命军人,1951-08-15,1951-08
美国海空军狂轰滥炸只能对朝鲜和平居民施行残暴南日将军痛斥美方厚颜无耻要求为使会议免于停顿再度建议美方重新考虑我方方案,1951-08-16,1951-08
庆祝朝鲜解放六周年朝鲜驻华大使昨举行招待会周总理等及各国使节应邀出席,1951-08-16,1951-08
民革暨台湾自治同盟驻京办事处电贺朝鲜解放六周年青年团和全国青联亦电祝贺,1951-08-16,1951-08
越南人民访华代表团抵沈阳,1951-08-16,1951-08
我们伟大的祖国,1951-08-16,1951-08
中华人民共和国中央人民政府外交部部长周恩来关于美英对日和约草案及旧金山会议的声明,1951-08-16,1951-08
全国人民电贺党的三十周年,1951-08-16,1951-08
反对美英单独对日媾和,1951-08-16,1951-08
工人阶级的伟大力量！,1951-08-16,1951-08
广州有机肥料厂建厂工作发生许多错误建设程序混乱返工修改千余次领导干部急于求成·设计人员脱离实际,1951-08-16,1951-08
设计经常改变，施工中准备计划不够来镇工程队建筑工程陷入混乱状态,1951-08-16,1951-08
贯彻依率计征·结合政治教育华北夏征顺利完成,1951-08-16,1951-08
在粉碎帝国主义“经济封锁”的斗争中起了重大作用上海土产展览交流大会闭幕西北财经委员会召开会议总结半年来土产交流工作,1951-08-16,1951-08
本报很多读者继续来信坚决拥护以三八线为双方军事分界线,1951-08-16,1951-08
华南物资交流指导委员会不应任意把国家法令删节,1951-08-16,1951-08
大公报编辑部“关于“中国的世界第一”问题的答复,1951-08-16,1951-08
长沙市总工会关于翻印毛主席著作事的处理结果,1951-08-16,1951-08
党的生活,1951-08-16,1951-08
纠正忽视民主政权建设工作的偏向！,1951-08-16,1951-08
文化生活动态,1951-08-16,1951-08
评投机出版商的投机出版物,1951-08-16,1951-08
毛主席是各族人民的伟大领袖,1951-08-16,1951-08
一封家信,1951-08-16,1951-08
美英对日和约草案,1951-08-16,1951-08
我国参加联欢节青年代表团与欧美澳廿二国青年代表联欢各国代表演说保证与中国青年永久友好,1951-08-16,1951-08
四百余万德国青年写信给斯大林保证捍卫和平到底,1951-08-16,1951-08
美加紧利用日本侵朝日本反动派参加美备战活动日亟大部分工厂为美军制造侵略武器,1951-08-16,1951-08
在美国占领当局命令下吉田政府扩充警察后备队,1951-08-16,1951-08
美李匪军频繁攻击我方阵地中朝人民部队进行坚强阻击战五天歼敌三千余毁伤敌机二十二架,1951-08-17,1951-08
朝鲜停战谈判会议决定大会体会双方组成小组委员会交换意见,1951-08-17,1951-08
印度尼西亚今日国庆纪念毛主席电贺苏加诺周外长电印尼外长祝贺,1951-08-17,1951-08
北京永茂公司违法经营木材贸易木材联合检查组已对该公司进行检查,1951-08-17,1951-08
开城军民及我谈判代表团集会庆祝朝鲜解放六周年决心为争取实现朝鲜的和平民主独立统一而奋斗,1951-08-17,1951-08
法国巴黎今晚报记者报道美国记者要求美方停止欺骗,1951-08-17,1951-08
奉政务院指示成立木材联合检查组暂以北京为中心进行检查,1951-08-17,1951-08
民族贸易会议开幕,1951-08-17,1951-08
华北首次县长会议筹委会视察组视察各地民主建政工作后返京,1951-08-17,1951-08
中央人民政府政务院关于节约木材的指示,1951-08-17,1951-08
我们伟大的祖国,1951-08-17,1951-08
坚决制止浪费国家木材资源的行为,1951-08-17,1951-08
全国人民电贺党的三十周年,1951-08-17,1951-08
东北森林工业管理工作混乱木材不合规格好坏不分造成许多浪费用材部门只知要红松而不主动利用杂木的现象也应纠正反对浪费木材，反对滥伐林木！,1951-08-17,1951-08
西南各地滥伐木材损失很大林业机关和各有关部门应及时制止反对浪费木材，反对滥伐林木！,1951-08-17,1951-08
西南工业部钢铁管理局等有关部门检查一零一钢铁厂基本建设,1951-08-17,1951-08
各棉区合作社预购棉花工作初步完成四个月共预购皮棉四百二十余万担还须做好各项准备工作保证合同的完满实现,1951-08-17,1951-08
山东周密部署收购新棉花的准备工作要充分发挥有利条件克服各种困难,1951-08-17,1951-08
经济生活动态,1951-08-17,1951-08
读者来信,1951-08-17,1951-08
