一九五二年十一月二十九日内容提要,1952-11-29,1952-11
推广召开全国厂矿长会议的经验,1952-11-29,1952-11
拥护周外长的声明,1952-11-29,1952-11
各地粮食部门和合作社大力收购秋粮,1952-11-29,1952-11
大力加强基本建设工作的领导,1952-11-29,1952-11
山东基本建设中存在的问题,1952-11-29,1952-11
从一个电机安装工程看苏联技术经验的优越性,1952-11-29,1952-11
你应该站在实际这一边	——天兰铁路工地见闻之三,1952-11-29,1952-11
华北区提拔工人干部的经验,1952-11-29,1952-11
“苦恼村”变成了“欢乐村”	——记南京市五老村的卫生工作,1952-11-29,1952-11
介绍《联共（布）党关于经济建设问题的决议》	（国民经济恢复时期）（上册）,1952-11-29,1952-11
杭宁线上的卫生模范列车,1952-11-29,1952-11
文化生活简评    加强报纸摄影画刊专题报道的思想性和艺术性,1952-11-29,1952-11
文化简讯    中国青年艺术剧院附属中国少年儿童剧团在北京首次公演,1952-11-29,1952-11
迎接世界人民和平大会	法德分别举行全国性和平大会	全苏拥护和平大会定下月初开幕,1952-11-29,1952-11
郭沫若电贺德国保卫和平大会开幕,1952-11-29,1952-11
德国统一社会党、保加利亚共产党、阿尔巴尼亚劳动党	决定领导党员和群众学习斯大林伟大著作	荷兰共产党举行第十六次代表大会,1952-11-29,1952-11
联大政委会非法通过优先讨论印度提案    维辛斯基主张按照苏联建议修改印度提案,1952-11-29,1952-11
美反动报纸不敢发表苏联提案,1952-11-29,1952-11
美方承认美机又侵入会场区,1952-11-29,1952-11
英国猛烈抵抗美国独霸资本主义世界市场,1952-11-29,1952-11
亚洲人团结起来，粉碎美帝国主义用亚洲人打亚洲人的侵略阴谋,1952-11-29,1952-11
支持苏联关于朝鲜问题的建议    朝外务相朴宪永发表声明    朝鲜人民一致要求联合国通过苏联的提案,1952-11-30,1952-11
苏联文化艺术工作者在上海访问和演出    苏军红旗歌舞团连日在南京广泛参加“中苏友好月”活动,1952-11-30,1952-11
瑞典新任驻华大使    昨拜会周恩来外长,1952-11-30,1952-11
在联合国大会政治委员会十一月二十六日会议上    维辛斯基关于朝鲜问题的发言,1952-11-30,1952-11
朝中部队续在上甘岭击退敌人陆空军进攻    前线对空射击部队五天击落击伤敌机七十架,1952-11-30,1952-11
锡兰贸易代表团抵京,1952-11-30,1952-11
一九五二年十一月三十日内容提要,1952-11-30,1952-11
祝捷克斯洛伐克反对叛国阴谋的大胜利,1952-11-30,1952-11
捷审讯斯兰斯基等叛国案结束    证实谋叛分子以破坏和间谍活动为美帝国主义者服务    国家法庭分别判处斯兰斯基等叛国犯死刑和无期徒刑,1952-11-30,1952-11
张家口市人民建筑公司学习苏联先进经验    推行分段平行流水作业法提高工作效率,1952-11-30,1952-11
实行立体交错平行流水作业法    东北工业部第十工地六天盖好一层楼,1952-11-30,1952-11
当他想着产品质量的时候,1952-11-30,1952-11
巩固和提高华东区国营贸易部门爱国主义劳动竞赛的几个问题,1952-11-30,1952-11
学习苏联农业建设的经验    ——为庆祝“中苏友好月”而作,1952-11-30,1952-11
读者来信,1952-11-30,1952-11
《曙光照耀着莫斯科》的演出发挥了巨大教育作用,1952-11-30,1952-11
看《曙光照耀着莫斯科》,1952-11-30,1952-11
再论朝鲜前线的新胜利,1952-11-30,1952-11
爆破手和绣花荷包,1952-11-30,1952-11
张峰应战（山东快书）,1952-11-30,1952-11
制止“冷战”，制止战争宣传！    ——为迎接世界人民和平大会而作,1952-11-30,1952-11
朝鲜战场上的新胜利,1952-11-30,1952-11
