各人民民主国家庆祝十月革命节    波苏友好月和德苏友好月分别揭幕,1952-11-10,1952-11
庆祝十月社会主义革命三十五周年    苏联外交部副部长马立克招待各外交使团,1952-11-10,1952-11
莫斯科人民在十月革命节之夜的欢乐景象,1952-11-10,1952-11
苏联驻我国各地领事馆举行盛大庆祝酒会,1952-11-10,1952-11
苏联斥责美国在朝鲜周围建立“海防区”    美国侵犯公海中商船航行自由扩大封锁形成新的侵略行为,1952-11-10,1952-11
朝鲜前线金化地区敌军损失惨重狼狈已极,1952-11-10,1952-11
美方又打伤我方被俘人员    南日将军提出抗议,1952-11-10,1952-11
美国大选揭晓,1952-11-10,1952-11
庆祝十月革命三十五周年,1952-11-10,1952-11
中苏友好万岁,1952-11-10,1952-11
进一步巩固和发展中苏两国人民的友谊	感谢北京苏联红十字医院忘我地为病人服务,1952-11-10,1952-11
进一步巩固和发展中苏两国人民的友谊    参加医院建筑的工人们受到亲切的关怀,1952-11-10,1952-11
珍惜解放军的荣誉,1952-11-10,1952-11
来信摘要,1952-11-10,1952-11
国有土地租给农民耕种是否可收地租？,1952-11-10,1952-11
太原钢铁厂工人同志来信迫切要求改善安全卫生工作,1952-11-10,1952-11
本报记者调查报告,1952-11-10,1952-11
寻找革命军人名单,1952-11-10,1952-11
人民革命军事委员会总政治部举行酒会欢迎苏联友人    聂代总参谋长、志愿军陈副司令员等出席,1952-11-11,1952-11
苏著名艺术家继续举行表演会    我解放军高级军官和志愿军伤病员等观看表演,1952-11-11,1952-11
四川万县各界人民集会追悼苏联空军烈士,1952-11-11,1952-11
人民革命军事委员会总政治部举行报告会    亚历山大罗夫报告苏军红旗歌舞团的经历    苏联文化工作者代表团团员在首都作专题报告,1952-11-11,1952-11
伟大人民的牢不可破的友谊    ——苏联《真理报》社论摘要,1952-11-11,1952-11
首都电影工作者集会欢迎苏联电影工作者,1952-11-11,1952-11
一九五二年十一月十一日内容提要,1952-11-11,1952-11
艾森豪威尔对于美国选民的欺骗,1952-11-11,1952-11
北京市基本建设工程中开展“抢工”运动,1952-11-11,1952-11
苏联专家对于我国经济建设的巨大帮助,1952-11-11,1952-11
苏联马拉机械农具给农民带来了幸福	——马庆福农业生产合作社使用苏联马拉机械农具生产面貌日新月异,1952-11-11,1952-11
为开发祖国富源而斗争的一个女地震组,1952-11-11,1952-11
有计划的经营和管理企业的基本方法—经济核算制    ——中国长春铁路先进经验介绍之四,1952-11-11,1952-11
华东区各地各级贸易部门加强职工劳动保险及福利事业,1952-11-11,1952-11
读者来信,1952-11-11,1952-11
对人民日报读者批评建议的反应    唐山邮电局开始消灭加班加点现象,1952-11-11,1952-11
新民主主义青年团中央委员会	设宴招待西藏致敬团及昌都地区藏族人民	国庆节观礼代表团青年代表,1952-11-11,1952-11
中国人民保卫儿童全国委员会    招待来北京演出的中国福利会儿童剧团,1952-11-11,1952-11
苏斯洛夫在联共第十九次代表大会上的发言,1952-11-11,1952-11
消灭轻视思想工作的现象	——苏联《真理报》十月二十七日社论,1952-11-11,1952-11
我们必须学习苏联先进的科学经验,1952-11-11,1952-11
亚洲及太平洋区域和平联络委员会    号召筹备参加世界人民和平大会    全日本拥护和平大会在东京举行,1952-11-11,1952-11
各国人民积极筹备世界人民和平大会,1952-11-11,1952-11
我国工会代表团陈少敏副团长    谈参加苏联庆祝十月革命节典礼的观感,1952-11-11,1952-11
美国的所谓“自愿遣返”失去欺骗作用后    又借口“不强迫遣返”继续阻挠停战谈判,1952-11-11,1952-11
美方在蜂岩岛打伤我方被俘人员二十一名    再次证明美方继续在用刺刀强迫扣留战俘,1952-11-11,1952-11
中苏友谊发展史	——一九五二年十一月七日在北京各	大学教师学生和机关干部大会上的报告,1952-11-11,1952-11
维辛斯基在联大政委会上    就朝鲜问题发表演说    说明苏联代表团解决朝鲜问题的提案,1952-11-12,1952-11
苏联艺术工作团昨晚继续表演    朱德宋庆龄李济深高岗副主席和周恩来总理等到场观看,1952-11-12,1952-11
苏军红旗歌舞团表演音乐舞蹈,1952-11-12,1952-11
上海、天津、沈阳、拉萨等市    热烈展开“中苏友好月”活动,1952-11-12,1952-11
北京市人民政府和中苏友协	联合欢宴苏联专家,1952-11-12,1952-11
苏联艺术工作团等访工厂农村学校和机关	被访问的单位都召开了盛大的欢迎会,1952-11-12,1952-11
民革总部今日举行孙中山诞辰纪念会,1952-11-12,1952-11
苏联电影艺术工作者分别参加联欢会十日在北京三家影院和观众见面、昨日游北海公园,1952-11-12,1952-11
中华全国音乐工作者协会设宴招待查哈罗夫,1952-11-12,1952-11
首都各界十二万多人参加“中苏友好月”游园大会,1952-11-12,1952-11
一九五二年十一月十二日内容提要,1952-11-12,1952-11
苏联的先进技术理论在黄河铁桥加固工程中的胜利,1952-11-12,1952-11
监督生产财务工作的稽核工作	——中国长春铁路先进经验介绍之五,1952-11-12,1952-11
经济生活简评,1952-11-12,1952-11
读者来信,1952-11-12,1952-11
“亚洲及太平洋区域和平会议代表拉	丁美洲艺术家作品展览会”在京预展,1952-11-12,1952-11
日益巩固的伟大友谊万岁,1952-11-12,1952-11
真诚的心结成了同盟,1952-11-12,1952-11
青春就是幸福，青春就是力量    ——介绍彩色纪录片《我们坚持和平》,1952-11-12,1952-11
努力向苏联学习，迎接祖国建设高潮,1952-11-12,1952-11
记苏联著名艺术家和苏军红旗歌舞团在北京的演出,1952-11-12,1952-11
第二届赴朝慰问团总团代表    分别慰问人民志愿军各部队    祖国人民的慰问品成为鼓舞志愿军前进的巨大力量,1952-11-12,1952-11
志愿军领导机关集会庆祝十月革命节,1952-11-12,1952-11
朝鲜外务相朴宪永再次致电联合国大会    要求制止美国干涉者的暴行并严惩战犯,1952-11-12,1952-11
朝中人民海防部队连续沉重打击敌军,1952-11-12,1952-11
在莫斯科中国艺术展览会上    苏联人民踊跃参观我国作品,1952-11-12,1952-11
捷军队文工团、罗部队歌舞团    结束在我国访问演出    分别由沈阳和哈尔滨启程返国,1952-11-12,1952-11
越南人民军发展游击战    不断歼灭法军有生力量,1952-11-12,1952-11
斥美国所谓“不强迫遣返”,1952-11-12,1952-11
苏联艺术工作团和苏军红旗歌舞团    昨晚在怀仁堂继续演出,1952-11-13,1952-11
全国工人热烈学习苏联先进经验,1952-11-13,1952-11
农业部林业部水利部等单位举行座谈会    别洛沙普柯解答有关苏联农业集体化问题,1952-11-13,1952-11
西北牧区各民族参观团抵京,1952-11-13,1952-11
美国在联大叫嚷所谓“不强迫遣返战俘”    目的在于诱骗其他国家同意其扣留战俘的荒谬主张,1952-11-13,1952-11
在金化以北上甘岭附近地区                我军二十四天歼敌一万八千多名                      前线高射炮部队六天击落击伤敌机四十五架,1952-11-13,1952-11
中央文化部举行宴会                      欢宴戏曲观摩会演的演员等,1952-11-13,1952-11
一九五二年十一月十三日内容提要,1952-11-13,1952-11
揭穿美国所谓“不强迫遣返”的诡计,1952-11-13,1952-11
中苏友好与世界和平                  	——一九五二年十一月九日在北京中国各民主党派、	各人民团体的干部大会上的报告,1952-11-13,1952-11
全国各地三年来劳动就业和失业救济工作获显著成绩,1952-11-13,1952-11
广泛持久的爱国主义劳动竞赛	——中国长春铁路先进经验介绍之六,1952-11-13,1952-11
太行一村,1952-11-13,1952-11
昆嵛县人民政府不重视处理人民来信工作,1952-11-13,1952-11
应该用细致负责的态度对待革命工作,1952-11-13,1952-11
唐山市人民政府建设局等部门应彻底检查官僚主义,1952-11-13,1952-11
山西省高平县第五区人民政府                          应深入检查婚姻问题方面的旧法观点,1952-11-13,1952-11
慈云寺村干部王永明等违反婚姻法,1952-11-13,1952-11
关于改进收发工作的经验,1952-11-13,1952-11
中共闽侯县委员会有些干部不重视学习,1952-11-13,1952-11
苏军红旗歌舞团的经历                               	——一九五二年十一月十日在北京中国人民解放军部队	文艺工作者大会上的报告,1952-11-13,1952-11
访苏联艺术工作团领导人楚拉基,1952-11-13,1952-11
评越剧《西厢记》的改编工作,1952-11-13,1952-11
民主德国人民议会主席狄克曼致函波恩议会主席             再次建议定期交换关于全德问题的意见                     国际争取和平解决德国问题会议在柏林开幕,1952-11-13,1952-11
比苏友好月、奥苏友好月                          分别在比奥两国热烈举行,1952-11-13,1952-11
联大政治委员会继续讨论朝鲜问题                  捷代表等斥美国阻挠和平解决朝鲜问题    美英集团代表为美国屠杀战俘罪行辩护,1952-11-13,1952-11
各国和平代表返国前发表对新中国的观感,1952-11-13,1952-11
苏维埃艺术的光辉,1952-11-13,1952-11
在中南区及武汉各界庆祝十月革命三十五周年大会上    苏联水利专家布可夫的讲话,1952-11-13,1952-11
永远为中国人民怀念的苏联医学教育专家比阔夫,1952-11-13,1952-11
坚决执行党关于正确选拔干部的指示    ——苏联“真理报”九月三十日社论,1952-11-13,1952-11
给我们的中国朋友,1952-11-13,1952-11
苏联专家保保夫同志给我们的帮助,1952-11-13,1952-11
向苏联水利专家布可夫同志致敬,1952-11-13,1952-11
新中国第一批女航空员决心为发展祖国航空事业而努力,1952-11-13,1952-11
谢万福小组全体工人报告掌握机器提高工作效率的情况,1952-11-13,1952-11
热爱革命军人家属的喇嘛医生们,1952-11-13,1952-11
唐山市人民政府重视群众意见	市内交通安全问题已基本解决,1952-11-13,1952-11
发动群众检查报纸批评效果将鼓舞人民更关心国家事业,1952-11-13,1952-11
绥远省副主席杨植霖、奎璧对错估灾情问题的检讨,1952-11-13,1952-11
峰峰矿务局石灰窑连续发生五次熏人事故,1952-11-13,1952-11
峰峰矿务局基本建设处来信    石灰窑事故已进行检查处理,1952-11-13,1952-11
寻找革命军人名单,1952-11-13,1952-11
中苏友协总会举行京剧表演会	招待苏联文化工作者代表团、艺术工作团、	红旗歌舞团和电影艺术工作者代表团,1952-11-14,1952-11
中央人民政府文化部电影局    邀请苏联电影工作者座谈    苏联友人全面介绍电影工作的先进经验,1952-11-14,1952-11
国际科协执委会主席约里奥—居里    号召各国科学工作者反对细菌战,1952-11-14,1952-11
民革举行孙中山先生诞辰纪念会    南京各界代表谒中山陵  上海各界代表瞻仰孙先生故居,1952-11-14,1952-11
苏联艺术工作团为北京工人演出    梅兰芳代表我艺术界向苏艺术工作团献旗,1952-11-14,1952-11
费道罗夫等游故宫,1952-11-14,1952-11
中华全国戏剧工作者协会    邀请奥布拉兹卓夫演木偶戏,1952-11-14,1952-11
亚历山大罗夫和红旗歌舞团团员游北海    查哈罗夫等六人昨天访问中央戏剧学院,1952-11-14,1952-11
中国佛教界著名人士在京举行会议发起组织中国佛教协会,1952-11-14,1952-11
一九五二年十一月十四日内容提要,1952-11-14,1952-11
中国佛教协会发起书,1952-11-14,1952-11
苏联代表团团长维辛斯基十一月十日	在联大政委会上关于朝鲜问题的演说,1952-11-14,1952-11
欢迎苏联电影艺术工作者代表团,1952-11-14,1952-11
衷心祝贺中国人民的新成就,1952-11-14,1952-11
看苏联动画片    ——《渔夫和金鱼的故事》《黄鹤的故事》《圣诞节的前夜》等,1952-11-14,1952-11
访苏联电影艺术工作者代表团团长费道罗夫,1952-11-14,1952-11
文化简讯,1952-11-14,1952-11
格鲁森科连日参加中国科学院座谈会    介绍苏联科学院工作情况并对生物学问题发表意见,1952-11-14,1952-11
我青联和学联致电世界青联和国际学联	祝贺“世界青年日”与“国际学生周”	郭沫若吴玉章分别致电国际学联祝贺,1952-11-14,1952-11
“中苏友好月”第一周    各地热烈展开各种活动    工人农民纷纷写信感谢苏联专家热情帮助,1952-11-15,1952-11
各大城市积极准备迎接苏联友人,1952-11-15,1952-11
苏联影片展览增加特别节目,1952-11-15,1952-11
中苏友协总会举办杂技表演晚会	招待苏联文化工作者代表团、艺术工作团、	红旗歌舞团和电影艺术工作者代表团,1952-11-15,1952-11
政务院华北行政委员会    邀请吉洪诺夫作报告    吉洪诺夫和楚拉基等参观故宫博物院,1952-11-15,1952-11
政务院举行第一五八次会议,1952-11-15,1952-11
一九五二年十一月十五日内容提要,1952-11-15,1952-11
向苏联艺术家学习,1952-11-15,1952-11
李顺达谈“十月胜利”集体农庄    ——从一个集体农庄看苏联农业集体化的经历,1952-11-15,1952-11
太行一村（续完）,1952-11-15,1952-11
苏联艺术家的表演给了我们宝贵的启发,1952-11-15,1952-11
衷心的感谢,1952-11-15,1952-11
我看到了具有高度感染力的舞蹈艺术,1952-11-15,1952-11
给乌兰诺娃    ——看巴蕾舞《小夜曲》后作,1952-11-15,1952-11
奥布拉兹卓夫的木偶艺术,1952-11-15,1952-11
现实主义的音乐的辉煌胜利,1952-11-15,1952-11
学习苏联优秀的艺术,1952-11-15,1952-11
向杰出的苏联电影剧作家学习,1952-11-15,1952-11
向苏联伟大的艺术家们学习,1952-11-15,1952-11
伟大的成就,1952-11-15,1952-11
学习苏联接受民族艺术遗产的宝贵经验,1952-11-15,1952-11
我第二届赴朝慰问团离朝鲜回国    人民志愿军领导机关曾举行盛大欢送会,1952-11-15,1952-11
皮克总统就德法关系发表声明	决不容许德国方面对法国人民发动战争,1952-11-15,1952-11
国际争取和平解决德国问题会议闭幕    通过民主德国和西德代表团的联合宣言,1952-11-15,1952-11
美国策划的《欧洲防务集团》协定    附有密约准西德军进驻法国,1952-11-15,1952-11
关于落后国家经济发展问题	——苏联代表葛罗米柯在十一月六日联合国	第二（经济与财政）委员会会议上的演说,1952-11-15,1952-11
意共中央全会讨论保卫共和国宪法问题    意大利举行拥护民族独立和国家主权大会,1952-11-15,1952-11
侵朝帮凶军队损失惨重,1952-11-15,1952-11
济州岛我方被俘人员争取重返祖国的斗争    彻底揭穿了美方所谓“不强迫遣返”的骗局,1952-11-15,1952-11
美机又破坏协议侵入会场区,1952-11-15,1952-11
联大特别政委会结束讨论南非印度籍人民地位问题    苏波等国代表斥责南非联邦种族歧视政策,1952-11-15,1952-11
美机继续滥炸平壤郊区村庄,1952-11-15,1952-11
侵朝美军士兵纷纷要求回家    美国助理国防部长不敢正面答复,1952-11-15,1952-11
赴朝慰问团曾到开城慰问朝中代表团,1952-11-15,1952-11
朝中部队在十月份反击战中获重大胜利	全月歼敌六万三千多名    击落击伤敌军飞机八百二十四架,1952-11-16,1952-11
全国戏曲观摩演出大会昨闭幕    周总理出席闭幕典礼并讲话,1952-11-16,1952-11
全国戏剧工作者协会举行宴会    庆祝优秀戏曲工作者获奖,1952-11-16,1952-11
苏联文化工作者代表团等离北京    分别赴全国各地参加“中苏友好月”活动,1952-11-16,1952-11
一九五二年十一月十六日内容提要,1952-11-16,1952-11
出席第一届全国戏曲观摩演出大会全体代表    向毛泽东主席致敬电,1952-11-16,1952-11
正确地对待祖国的戏曲遗产,1952-11-16,1952-11
第一届全国戏曲观摩演出大会获奖者名单,1952-11-16,1952-11
中央林业部召开全国林业行政会议    计划全国在明年造林一百四十九万七千余公顷,1952-11-16,1952-11
阜新矿务局基本建设公司推广苏联先进经验	实行同类型房屋按指示图表流水作业法	九十六天的工程在五十一天内就完成了,1952-11-16,1952-11
经济学习与技术教育	——中国长春铁路先进经验介绍之七,1952-11-16,1952-11
苏联专家的帮助对中国煤矿工业的恢复和发展起了巨大作用,1952-11-16,1952-11
感谢苏联专家给我们的帮助,1952-11-16,1952-11
经济简讯,1952-11-16,1952-11
回忆苏联专家给我们小组的帮助,1952-11-16,1952-11
向苏联专家古连诺依学习,1952-11-16,1952-11
在苏联专家的帮助下我从一个普通工人成了技师,1952-11-16,1952-11
李保生等创保管粮食新方法,1952-11-16,1952-11
加强对区、乡干部学习的领导,1952-11-16,1952-11
濮阳、聊城专区合作社    应该重视煤炭下乡工作,1952-11-16,1952-11
苏联木偶戏艺术家和杂技家对中国艺术的意见,1952-11-16,1952-11
记苏军亚历山大罗夫红旗歌舞团的表演,1952-11-16,1952-11
学习苏联音乐的现实主义,1952-11-16,1952-11
我对于珈丽娜·乌兰诺娃舞蹈艺术的欣赏,1952-11-16,1952-11
纳赛罗娃的演唱给我们的一点启示,1952-11-16,1952-11
谈我国戏曲表演艺术里的现实主义,1952-11-16,1952-11
朝鲜前线的新胜利和新情况,1952-11-16,1952-11
最近几个月来的朝鲜战况,1952-11-16,1952-11
深入人心的苏联伟大友谊,1952-11-16,1952-11
我们爱书,1952-11-16,1952-11
“不准它们自由行动”	——记日益强大的志愿军炮兵,1952-11-16,1952-11
中央人民政府委员会开第十九次会议    通过改变大行政区人民政府（军政委员会）机构与任务等决定    批准中华人民共和国、蒙古人民共和国经济及文化合作的协定,1952-11-17,1952-11
全国各中小城市、农村和少数民族地区    “中苏友好月”的活动广泛展开,1952-11-17,1952-11
联共中央书记处通告    戈沃罗夫当选中央候补委员,1952-11-17,1952-11
西藏致敬团和各地各民族代表团陆续离京	在京期间曾受到中央人民政府及各界的热烈欢迎和招待,1952-11-17,1952-11
一九五二年十一月十七日内容提要,1952-11-17,1952-11
中央人民政府关于改变大行政区人民政府（军政委员会）	机构与任务的决定	（一九五二年十一月十五日中央人民政府委员会第十九次会议通过）,1952-11-17,1952-11
关于调整省、区建制的决议    （一九五二年十一月十五日中央人民政府委员会第十九次会议通过）,1952-11-17,1952-11
关于增设中央人民政府机构的决议	（一九五二年十一月十五日中央人民政府委员会第十九次会议通过）,1952-11-17,1952-11
吉洪诺夫和楚拉基等抵武汉受到热烈欢迎	昨向苏联空军志愿队烈士墓献花并在武汉市区进行参观,1952-11-17,1952-11
亚历山大罗夫及红旗歌舞团团员抵天津    天津市邀请苏联嘉宾参加“中苏友好月”游园联欢大会,1952-11-17,1952-11
费道罗夫及电影艺术工作者代表团抵沈阳,1952-11-17,1952-11
西藏致敬团等抵内蒙古海拉尔市,1952-11-17,1952-11
加强国家工作的集中性    迎接大规模经济建设,1952-11-17,1952-11
中央人民政府委员会第十九次会议通过的免职事项,1952-11-17,1952-11
中央人民政府委员会第十九次会议通过任命的各项名单,1952-11-17,1952-11
政务院提请中央人民政府委员会第十九次会议批准任命的各项名单,1952-11-17,1952-11
我们彼此发现了诗,1952-11-17,1952-11
红旗歌舞团的“回声”,1952-11-17,1952-11
访苏军红旗歌舞团团长亚历山大罗夫,1952-11-17,1952-11
向共产主义迈进的人们    ——苏联彩色影片《金星英雄》观后,1952-11-17,1952-11
文化简讯    北京市科学技术普及协会举办“干部科学讲座”,1952-11-17,1952-11
德共发表争取恢复全德统一纲领	号召全体爱国人民团结在民主德国全国阵线之内，	为实现西德民族解放斗争目标而奋斗,1952-11-17,1952-11
德国统一社会党号召人民支持德共纲领,1952-11-17,1952-11
美方又害死我方被俘人员美机并连续侵越会场区上空    我方南日将军张春山上校分别提出抗议,1952-11-17,1952-11
苏联各地人民庆祝“中苏友好月”,1952-11-17,1952-11
联合国大会全体会议结束一般辩论    维辛斯基的演说决定了大会整个讨论方向    很多国家不支持美国在朝鲜问题上的提案,1952-11-17,1952-11
联大托管委员会结束关于非自治地区情况报告问题的讨论    建议殖民国家取消种族和宗教等歧视法律    美英法等少数殖民国家在委员会会议上遭到严重失败,1952-11-17,1952-11
日本数十万煤矿和电气工人坚持罢工斗争    日共中央抗议日政府压制罢工的企图,1952-11-17,1952-11
艾森豪威尔及其部下阴谋扩大侵朝战争,1952-11-17,1952-11
美报承认艾森豪威尔上台后    将遇到重重严重困难,1952-11-17,1952-11
美国在日本加强间谍活动,1952-11-17,1952-11
白马山上的激战,1952-11-17,1952-11
政务院财政经济委员会举行会议    讨论加强基本建设工作    陈云主任指示迅速调集干部充实工作机构,1952-11-18,1952-11
全国各地苏联影片展览第一周盛况空前    北京天津沈阳上海等八大城市观众达三百八十万人,1952-11-18,1952-11
苏联文化艺术工作者在我国各地展开活动,1952-11-18,1952-11
查哈罗夫和哈侬等分别到达兰州和西安,1952-11-18,1952-11
迪化市举行盛大联欢晚会    庆祝十月革命节和“中苏友好月”,1952-11-18,1952-11
我国人民第二届赴朝慰问团回到沈阳,1952-11-18,1952-11
开城观察家列举美方阻挠遣俘的罪行    指出美国在联大的提案旨在破坏停战谈判,1952-11-18,1952-11
一九五二年十一月十八日内容提要,1952-11-18,1952-11
把基本建设放在首要地位,1952-11-18,1952-11
巴黎今晚报记者贝却敌    揭露美方诬我击毙中立区美兵的荒谬事件,1952-11-18,1952-11
苏联共产党第十九次代表大会关于一九五一	——一九五五年苏联发展第五个五年计划的指示	国家计划委员会主席马·萨·萨布罗夫同志的报告,1952-11-18,1952-11
日本出席和平会议代表团发表声明	抗议吉田政府下令逮捕和平代表的暴行,1952-11-18,1952-11
民主德国全国阵线全国委员会举行会议	讨论争取恢复德国全国统一问题,1952-11-18,1952-11
西欧各国人民反美情绪愈来愈强烈,1952-11-18,1952-11
美国关于朝鲜问题提案的阴谋已被揭穿    以色列等国代表在联大政委会上妄图加以粉饰,1952-11-18,1952-11
艾登在联大发表一般政策演说    附和美国强迫扣留战俘的主张,1952-11-18,1952-11
联合国大会特别政治委员会	通过印度等国谴责南非联邦种族歧视提案,1952-11-18,1952-11
《真理报》发表社论    评美国大选结果,1952-11-18,1952-11
美国和平组织    呼吁制止侵朝战争,1952-11-18,1952-11
在我军强大炮火打击下    美军士气越来越低,1952-11-18,1952-11
苏联和人民民主国家的生活    苏联的房屋建筑,1952-11-18,1952-11
中央人民政府工业与交通各部门    集中干部加强基本建设,1952-11-19,1952-11
华北财政经济工作会议结束    决定加强对基本建设工作的领导    在贸易工作方面着重解决了活跃初级市场等问题,1952-11-19,1952-11
西北牧区各民族参观团和中南区各民族参观团	向毛泽东主席献旗致敬	邓副总理代表毛主席受旗并设宴招待,1952-11-19,1952-11
伊犁等三区民族革命八周年	新疆及迪化各族代表集会纪念,1952-11-19,1952-11
全国各地干部学习斯大林著作	和联共第十九次代表大会文件,1952-11-19,1952-11
苏联书刊受到我国广大人民热烈欢迎	三年来全国出版的苏联书籍中译本共约三千一百多种,1952-11-19,1952-11
苏联文化艺术工作者在各城市访问和演出,1952-11-19,1952-11
东北人民政府主席    高岗接见苏联电影艺术工作者代表团,1952-11-19,1952-11
朝中部队在上甘岭等地大量歼敌    前线对空射击部队七天毁伤敌机三十四架,1952-11-19,1952-11
克拉克等战争贩子叫嚣继续扩大侵朝战争,1952-11-19,1952-11
罗马尼亚驻我国大使    鲁登科奉调返国,1952-11-19,1952-11
一九五二年十一月十九日内容提要,1952-11-19,1952-11
苏联共产党第十九次代表大会关于一九五一	—一九五五年苏联发展第五个五年计划的指示	苏联共产党第十九次代表大会关于国家计划委员会主席	马·萨·萨布罗夫同志的报告的决议（全体一致通过）,1952-11-19,1952-11
共产党员陈健是怎样学会管理近代化工厂的,1952-11-19,1952-11
武汉市第一纱厂党组织培养和提拔工人干部的经验,1952-11-19,1952-11
介绍苏联彩色影片《苏联大马戏团》	编导：里昂尼特·伐尔拉莫夫	莫斯科纪录片中央研究所一九五一年出品,1952-11-19,1952-11
苏联工业生产过程自动化扩大	按照新五年计划规定，自动化将普遍在一切工业部门中实行,1952-11-19,1952-11
