波捷罗匈保阿第三季经济计划执行结果    工农业获重大发展人民生活水平显著提高,1952-11-19,1952-11
《真理报》评我国及波捷德举行对苏友好月    指出这是民主阵营各国间新型的国际关系,1952-11-19,1952-11
英法两国许多人士不满美国的禁运政策    要求发展东西方贸易摆脱美国的限制    英国追随美国扩军与禁运的结果经济危机继续加深,1952-11-19,1952-11
越南人民军续歼大量法军	并阻击向富寿省窜犯的侵略者,1952-11-19,1952-11
北欧各国工人举行和平会议    选出代表出席世界人民和平大会,1952-11-19,1952-11
赖伊宣布辞去“联合国秘书长”职    反映美独裁政策失败,1952-11-19,1952-11
强大的苏联炮兵,1952-11-19,1952-11
西德人民要求独立解放的愿望	国际简评,1952-11-19,1952-11
华东军政委员会发布指示    加强基本建设的组织领导    华东区召开基本建设会议确定明年度任务,1952-11-20,1952-11
中南工业部召开全区工业会议    决定迅速加强领导充实基本建设工作机构,1952-11-20,1952-11
志愿军首长嘉勉上甘岭作战部队    赴朝慰问团第三分团亦致电祝贺伟大胜利,1952-11-20,1952-11
中华全国体育总会发表声明    抗议英政府阻挠我乒乓球代表队赴新加坡,1952-11-20,1952-11
美机续犯我东北领空,1952-11-20,1952-11
我被俘人员控诉美方虐杀战俘的血腥罪行,1952-11-20,1952-11
克拉克扩大侵朝战争的计划进一步被暴露,1952-11-20,1952-11
中国人民解放军各部队热烈展开向苏联学习的活动,1952-11-20,1952-11
赴朝慰问团在天津和苏军红旗歌舞团联欢    苏联文化艺术工作者继续在各地参加“中苏友好月”活动,1952-11-20,1952-11
天津市昨天举行中苏友好广播大会,1952-11-20,1952-11
一九五二年十一月二十日内容提要,1952-11-20,1952-11
第三年度治淮工程准备工作大体完成	大批技术工人和民工抵达工地部分工程已开始施工,1952-11-20,1952-11
治淮工程向着更大的胜利前进	——第三年度治淮工程介绍,1952-11-20,1952-11
帮助我国水利建设的苏联专家布可夫,1952-11-20,1952-11
经济简讯,1952-11-20,1952-11
十二名农业工作者建议昌黎铁路农场应改属农业部门领导,1952-11-20,1952-11
水利部工程总局应重视职工的发明创造,1952-11-20,1952-11
采用水稻密植栽培法果然获得了丰收,1952-11-20,1952-11
湖南绥宁二区人民政府应该加强护林防火工作,1952-11-20,1952-11
谢朝运农业互助组带头扭转不重视冬季治螟的思想,1952-11-20,1952-11
“万粒籼”稻种产量高,1952-11-20,1952-11
希望漫画家多创作反映新事物的漫画,1952-11-20,1952-11
我的职业有了保证,1952-11-20,1952-11
炼钢战线上的优秀共产党员赵旭,1952-11-20,1952-11
抗美援朝总会欢宴香玉剧社,1952-11-20,1952-11
苏联报刊工作的光荣任务	——在联共第十九次代表大会上的发言,1952-11-20,1952-11
苏联的农业科学是属于广大人民群众的      ——访苏联农业科学家别洛沙普柯,1952-11-20,1952-11
爱伦堡论世界人民和平大会筹备情况,1952-11-20,1952-11
匈任命五位部长会议副主席,1952-11-20,1952-11
美英帝国主义争夺市场斗争尖锐,1952-11-20,1952-11
美国垄断资本家战争利润激增,1952-11-20,1952-11
美国“工人日报”和工会组织    质问艾森豪威尔违背诺言,1952-11-20,1952-11
日电气和煤矿工人继续罢工,1952-11-20,1952-11
德国共产党争取恢复德国全国统一的纲领（摘要）,1952-11-20,1952-11
日本吉田反动政府是和平的敌人,1952-11-20,1952-11
努力学习苏联先进经验建设伟大的祖国	全国植棉丰产模范曲耀离	决心学习苏联先进生产经验,1952-11-20,1952-11
努力学习苏联先进经验建设伟大的祖国    苏联农业科学技术对我们的帮助,1952-11-20,1952-11
努力学习苏联先进经验建设伟大的祖国    北京农业大学全体师生努力学习苏联先进生物科学,1952-11-20,1952-11
川南革命残废军人学校全体同志    决心克服一切困难为人民做更多工作,1952-11-20,1952-11
青海河南蒙旗区全区头目人    团结在毛主席旗帜下为建设祖国而努力,1952-11-20,1952-11
“合作社的财产也有我一份”,1952-11-20,1952-11
“这是咱农业生产合作社的公共财产啊！”,1952-11-20,1952-11
两个孩子在长途列车上,1952-11-20,1952-11
找到了配眼镜的处方,1952-11-20,1952-11
正确地对待批评和自我批评	广西军区后勤部柳州办事处及汽车训练队	负责干部压制民主事件已经得到合理处理,1952-11-20,1952-11
对人民日报读者批评建议的反应    中央农业部对解决新式农具的修配问题已作出具体决定,1952-11-20,1952-11
对人民日报读者批评建议的反应    华北农业机械总厂对解决新农具修配问题的意见,1952-11-20,1952-11
坚决反对忽视工人安全的片面生产观点    北京市粮食公司不执行“搬运安全操作规程”    建议市人民政府和市工会召集双方协商解决,1952-11-20,1952-11
寻找革命军人名单,1952-11-20,1952-11
答谢对十月社会主义革命卅五周年的祝贺    斯大林致电毛泽东主席    并电我政协全国委员会致谢,1952-11-21,1952-11
各地加速培养建设人材    北京地质学院和中南矿冶学院等三校开学    西南工业部开办十七个短期技术专业学校,1952-11-21,1952-11
越南、寮国和高棉出席和平会议代表    向毛泽东主席献旗献礼致敬    朱德副主席代表毛主席受旗受礼,1952-11-21,1952-11
吉洪诺夫等访问毛主席故乡    苏联文化艺术工作者与西安各界联欢、电影工作者抵长春,1952-11-21,1952-11
太原钢铁厂炼钢部	建立中苏友好活动日,1952-11-21,1952-11
西藏致敬团等赴哈尔滨,1952-11-21,1952-11
中央人民广播电台    举办苏联艺术家音乐欣赏会和广播,1952-11-21,1952-11
马特洛索夫式的中国人民志愿军战斗英雄	黄继光舍身炸敌堡扫清进军道路,1952-11-21,1952-11
青年团中央委员会和全国学生联合会    关于纪念“一二·九”运动十七周年的通知,1952-11-21,1952-11
一九五二年十一月二十一日内容提要,1952-11-21,1952-11
范佛里特在金化地区攻势的惨败,1952-11-21,1952-11
燃料工业部开全国煤矿计划基本建设会议	号召把基本建设放在首要地位并加紧进行准备工作,1952-11-21,1952-11
推广先进经验的初步体会	——中国长春铁路先进经验介绍之八,1952-11-21,1952-11
先进的引导	——治淮工程中学习苏联先进经验的体会,1952-11-21,1952-11
加紧培养后备力量，做好煤矿钻探工作,1952-11-21,1952-11
经济简讯,1952-11-21,1952-11
读者来信,1952-11-21,1952-11
对人民日报读者批评建议的反应,1952-11-21,1952-11
社会主义的基本经济法则,1952-11-21,1952-11
学习苏联的节约经验,1952-11-21,1952-11
文化简讯,1952-11-21,1952-11
第二届赴朝慰问团在朝鲜前线时    深入朝鲜人民军各部队进行慰问,1952-11-21,1952-11
南日将军抗议美方又杀害我方被俘人员    美方承认美机连续侵越板门店会场区事件,1952-11-21,1952-11
越南人民军在北越前线继续获得新胜利	击退窜犯富寿法军并在发艳等地大量歼灭敌军,1952-11-21,1952-11
越南人民军总司令武元甲    致电前线部队祝贺胜利,1952-11-21,1952-11
美空军、陆军战俘    供述侵朝美军暴行,1952-11-21,1952-11
纽约《工人日报》发表社论    揭穿美国共和党头子扩大侵朝战争阴谋,1952-11-21,1952-11
杜鲁门艾森豪威尔会谈无结果,1952-11-21,1952-11
美方忠顺走卒“红十字国际委员会”的“视察”报告书    再次暴露美方扣留和屠杀战俘的无耻罪行,1952-11-21,1952-11
英法人民日益敌视美国占领者    美报承认“冷战”政策使美国与其附庸国矛盾日深,1952-11-21,1952-11
美国竭力驱逐马来亚英国势力	美垄断资本大量掠夺加拿大富源,1952-11-21,1952-11
西南西北等地进行各种部署    加强领导基本建设工作,1952-11-22,1952-11
苏联各地热烈庆祝“中苏友好月”,1952-11-22,1952-11
朝中人民部队完成过冬准备工作,1952-11-22,1952-11
天津市各界人民集会欢迎赴朝慰问团,1952-11-22,1952-11
上海、天津和武汉三市军事管制委员会    征用英国六个企业的全部财产,1952-11-22,1952-11
志愿军战士在上甘岭前线    英勇进行坑道战,1952-11-22,1952-11
西藏致敬团团长柳霞·土登塔巴    对西藏地方政府僧俗官员和全体藏族僧俗同胞的广播词,1952-11-22,1952-11
一九五二年十一月二十二日内容提要,1952-11-22,1952-11
华北区第二届物资交流大会胜利闭幕    大会推销了大量工农业产品，交易额达五万六千多亿元,1952-11-22,1952-11
华北二届物资交流大会加强联系初级市场,1952-11-22,1952-11
大同煤矿试用康拜因机采煤,1952-11-22,1952-11
经纬纺织机械制造厂工程师  荣科改进铸铁有成绩,1952-11-22,1952-11
大力加强领导抽调干部充实机构	铁道部基本建设力量显著增强,1952-11-22,1952-11
经济生活简评,1952-11-22,1952-11
提高劳动生产率的一个先决条件——合理的劳动组织与劳动报酬    ——中国长春铁路先进经验介绍之九,1952-11-22,1952-11
读者来信,1952-11-22,1952-11
中共河北省委严正处理“郭金升事件”,1952-11-22,1952-11
党的生活简评    经常地和官僚主义作斗争,1952-11-22,1952-11
现代资本主义的基本经济法则,1952-11-22,1952-11
波捷匈罗等国共产党工人党和劳动人民热烈学习斯大林的伟大理论著作,1952-11-22,1952-11
苏斯洛夫五十寿辰荣获列宁勋章,1952-11-22,1952-11
联合国大会政治委员会继续讨论朝鲜问题    白俄罗斯波兰代表斥责美国扣留战俘罪行    美报承认印度新提案加深了美英集团内部分歧,1952-11-22,1952-11
郭沫若电贺匈牙利全国和平大会开幕,1952-11-22,1952-11
美空军参谋长范顿伯叫嚣扩大侵朝战争,1952-11-22,1952-11
侵朝美军兵员弹药损耗严重,1952-11-22,1952-11
美机滥炸朝鲜和平居民区,1952-11-22,1952-11
美方交给我方的一批“战俘死亡名单”    再次证明美方匿报战俘妄图永远扣留,1952-11-22,1952-11
日本“保安厅”拟订扩军计划    吉田阴谋修改宪法中和平条款,1952-11-22,1952-11
美国在中东和近东排挤着英国,1952-11-22,1952-11
东北各基本建设部门	进行基本建设准备工作,1952-11-23,1952-11
朝鲜人民热烈支援上甘岭志愿军	美国通讯社继续透露美李军在金化前线遭到惨重伤亡,1952-11-23,1952-11
答谢对十月社会主义革命三十五周年的祝贺	维辛斯基外长致电周恩来总理,1952-11-23,1952-11
朝鲜最高人民会议常委会    新任命两位副首相,1952-11-23,1952-11
亚洲及太平洋区域和平会议展览会举行预展,1952-11-23,1952-11
沈钧儒致电西德联邦宪法法院院长    严斥波恩政府阴谋摧毁西德民主力量的罪行,1952-11-23,1952-11
苏联文化艺术工作者续在各地演出和访问,1952-11-23,1952-11
美方诬指我方打死美方人员    我函告美方对此不能负责,1952-11-23,1952-11
艾森豪威尔“结束朝鲜战争”的骗局已拆穿    他公然表示支持杜鲁门扣留战俘拖延战争的荒谬主张,1952-11-23,1952-11
美国利用日本人侵朝的罪行进一步暴露    美国杂志并承认美军正利用纳粹匪徒参加侵朝战争,1952-11-23,1952-11
中南民族参观团离京返汉口,1952-11-23,1952-11
政务院举行第一五九次会议,1952-11-23,1952-11
一九五二年十一月二十三日内容提要,1952-11-23,1952-11
海关总署召开全国海关关务会议	决加强业务发挥海关在对外贸易中的监督管理作用,1952-11-23,1952-11
中苏民航股份公司两年多以来成就巨大    对中苏经济、文化交流起了重要作用,1952-11-23,1952-11
端正思想，加强机构，做好明年的基本建设工作,1952-11-23,1952-11
中国百货公司华东区公司创造新作业法    全面改进采购、调拨及运输的制度,1952-11-23,1952-11
中国花纱布公司河南省公司陕州办事处职工    创三十吨车皮装二十二吨棉花的新纪录    中国畜产公司平原省公司职工再次提高绒毛装载量,1952-11-23,1952-11
读者来信,1952-11-23,1952-11
支部教育工作的一个重要创造,1952-11-23,1952-11
河北省实行支部教员授课卡片制度的情况和经验,1952-11-23,1952-11
河北省大兴县支部教员授课卡片制度建立的情况和经验,1952-11-23,1952-11
河北省尚义县实行支部教员授课卡片制度的情况,1952-11-23,1952-11
启事,1952-11-23,1952-11
文化简讯            《剧本》月刊十、十一月合刊内容介绍,1952-11-23,1952-11
迎接世界人民和平大会,1952-11-23,1952-11
走向世界人民和平大会,1952-11-23,1952-11
英雄，诗人，说唱家        ——记志愿军某部一个班的阵地说唱,1952-11-23,1952-11
关于世界人民和平大会问答,1952-11-23,1952-11
乌江的昨天和今天,1952-11-23,1952-11
抗美援朝总会及天津市分会举行大会    欢迎赴朝慰问团胜利归来,1952-11-24,1952-11
志愿军国庆节观礼代表团返回朝鲜前线后    向志愿军各部队广泛传达祖国建设的成就,1952-11-24,1952-11
上甘岭前线志愿军机枪射手    陈治国英勇舍身掩护战友打败敌人,1952-11-24,1952-11
苏联文化艺术工作者分别抵杭州成都等地,1952-11-24,1952-11
致公党举行代表大会    选举了新的中央委员会,1952-11-24,1952-11
全国青联举行常委会    定明春开全国青年第二次代表大会,1952-11-24,1952-11
新疆各民族体育参观团抵京,1952-11-24,1952-11
西北各族国庆观礼团返西安,1952-11-24,1952-11
一九五二年十一月二十四日内容提要,1952-11-24,1952-11
我们在审判,1952-11-24,1952-11
关于农业生产合作社若干问题的商榷,1952-11-24,1952-11
苏联“一列式拖带法”替长江航运开辟了新道路,1952-11-24,1952-11
经济生活简评    积极领导农民进行试办农业生产合作社的准备工作,1952-11-24,1952-11
“问题篓子”里的问题是怎样解决的    ——记郭玉恩农业生产合作社的成长,1952-11-24,1952-11
苏联共产党党章,1952-11-24,1952-11
联大法律、政治两委员会举行会议    维辛斯基就“侵略”定义发表演说    艾登再度无耻附和美国强迫扣留战俘原则,1952-11-24,1952-11
波兰人民共和国议会举行第一次会议    贝鲁特当选为部长会议主席,1952-11-24,1952-11
捷克斯洛伐克通讯社广播	关于以鲁道夫·斯兰斯基为首的反国家阴谋中心案的起诉书（摘要）,1952-11-24,1952-11
日本和平代表南博回到日本    吉田政府竟加以种种无理迫害,1952-11-24,1952-11
捷国家法庭开始审讯斯兰斯基叛国案	主犯斯兰斯基对进行谍报活动和叛国等罪行均供认不讳,1952-11-24,1952-11
苏联陆军部长发布庆祝炮兵节命令,1952-11-24,1952-11
艾森豪威尔任命新政府人员    全部是恶名昭著的反动分子,1952-11-24,1952-11
艾森豪威尔：“请进来吧！已经打扫干净了。”,1952-11-24,1952-11
我国大规模经济建设的先声    鞍山展开大规模基本建设,1952-11-25,1952-11
全国农村进行“中苏友好月”活动    苏联文化艺术工作者续在各地访问和表演,1952-11-25,1952-11
参加第五届国际植物保护会议    我国代表团离北京赴柏林,1952-11-25,1952-11
朝中部队在上甘岭继续歼敌千余    西线我军某部一夜歼灭英帮凶军三百余名    前线炮火一周歼敌八百击落击伤敌机四十九架,1952-11-25,1952-11
艾森豪威尔所谓“朝鲜之行”目的在策划战争,1952-11-25,1952-11
一九五二年十一月二十五日内容提要,1952-11-25,1952-11
一面学习，一面建设    ——鞍山基本建设工程技术力量的形成,1952-11-25,1952-11
不朽的朝鲜母亲,1952-11-25,1952-11
一座在苏联专家直接指导下修复的工厂,1952-11-25,1952-11
斯大林派来的人怎样在中国的河流上工作着,1952-11-25,1952-11
中长铁路职工的文化和物质生活    ——中国长春铁路先进经验介绍之十,1952-11-25,1952-11
经济简讯,1952-11-25,1952-11
读者来信,1952-11-25,1952-11
山东省安邱县人民政府决定加强民主建政工作    对人民日报读者批评建议的反应,1952-11-25,1952-11
苏南区积极慎重地进行建党工作,1952-11-25,1952-11
介绍苏联彩色影片《明朗的夏天》,1952-11-25,1952-11
雄鹰（歌曲）,1952-11-25,1952-11
文化简讯,1952-11-25,1952-11
迎接世界人民和平大会    各国人民积极进行各项筹备工作,1952-11-25,1952-11
日本拥护和平委员会常任委员会全体会议    决定召开人民大会反对派遣日军侵略朝鲜,1952-11-25,1952-11
越南人民军在黑水江流域歼敌二千多人    拔除山萝省木州高原全部法军据点并解放伦州等地,1952-11-25,1952-11
美国《指南针日报》评论员史东揭露美方捏造遣俘数字蓄意阻挠谈判,1952-11-25,1952-11
法国共产党发表声明揭露侵越战争的罪恶性质    丹麦船员拒绝运送军火到越南,1952-11-25,1952-11
德国统一社会党总书记、民主德国副总理乌布利希    就德国统一问题发表演说答复西德人民    阿登纳要波恩众议院月底批准两项卖国条约的企图失败,1952-11-25,1952-11
澳共主席狄克逊号召党员研究斯大林新著,1952-11-25,1952-11
联大特别政委会结束关于南非联邦种族冲突问题的辩论    十八国提案及苏联修正案以多数票通过,1952-11-25,1952-11
美国反动统治集团迫害美国出席和平会议代表    泰政府污蔑和平会议并逮捕爱国者,1952-11-25,1952-11
制止南非反动政府的种族歧视政策,1952-11-25,1952-11
国际简讯,1952-11-25,1952-11
对苏联关于朝鲜问题的提案    苏联代表团提出补充条款,1952-11-26,1952-11
全国少数民族人民欢庆中苏友好    各地铁路员工开展学习苏联先进经验运动,1952-11-26,1952-11
苏联艺术工作团连日在杭州游览和表演    红旗歌舞团抵南京、电影工作者离天津,1952-11-26,1952-11
我志愿军最近在朝鲜前线严惩英帮凶军    美国反动报刊继续供认侵朝美军士兵厌战怕死的情形,1952-11-26,1952-11
朝鲜农民朴在根舍身保护我志愿军伤员,1952-11-26,1952-11
浙江省中苏友好协会召开全省首届会员代表大会,1952-11-26,1952-11
越南人民军解放西北部重要据点山萝城,1952-11-26,1952-11
第二届全国卫生会议定在十二月上旬召开,1952-11-26,1952-11
广西省筹备成立僮族自治区,1952-11-26,1952-11
今年下半年返国的马来亚难侨    受到政府侨务机关妥善安置    另一批马来亚华侨返抵广州,1952-11-26,1952-11
中央气象台发布台风消息,1952-11-26,1952-11
一九五二年十一月二十六日内容提要,1952-11-26,1952-11
必须重视高级干部的理论学习,1952-11-26,1952-11
全国各地冬麦播种工作基本完成,1952-11-26,1952-11
中央人民政府水利部发出关于加强冬季农田水利工作指示,1952-11-26,1952-11
东北地区许多基本建设单位    固定建筑工人和训练建筑工人、干部,1952-11-26,1952-11
组织生产的重要手段——集体合同    ——沈阳三二一工厂集体合同介绍,1952-11-26,1952-11
华东煤矿工会和焦作矿务局召开会议    推广基本建设中的先进经验,1952-11-26,1952-11
把基本建设工作中的主要先进经验总结起来,1952-11-26,1952-11
经济生活简评    做好冬季浇田工作,1952-11-26,1952-11
读者来信,1952-11-26,1952-11
高岗同志怎样领导《矛盾论》的学习,1952-11-26,1952-11
东北人民政府工业部高级干部的理论学习,1952-11-26,1952-11
苏联科学家为人类幸福的未来而奋斗    ——访问苏联生物学家格鲁森科教授,1952-11-26,1952-11
应劝阻农民盲目向城市流动,1952-11-26,1952-11
维辛斯基十一月二十一日在联大法律委员会上关于侵略定义问题的演说,1952-11-26,1952-11
蒙古人民共和国国庆日,1952-11-26,1952-11
国际简讯,1952-11-26,1952-11
中国人民第二届赴朝慰部团胜利归来,1952-11-26,1952-11
“中苏友好月”活动广泛展开    各地已有二千多万人看了苏联影片展览,1952-11-27,1952-11
康藏公路康定至昌都段提前通车    毛主席朱总司令题词嘉勉筑路军工和民工	西南军政委员会主席刘伯承军区司令员贺龙等致电祝贺,1952-11-27,1952-11
苏联文化艺术工作者在各地访问参观表演,1952-11-27,1952-11
瑞典大使赛德勃隆奉调返国新任驻华大使魏斯特朗抵京,1952-11-27,1952-11
东北人民艺术剧院来京参加“中苏友好月”活动昨起公演苏联名剧《曙光照耀着莫斯科》,1952-11-27,1952-11
新华社记者评述朝鲜战场新胜利,1952-11-27,1952-11
朝中部队继续胜利夺取上甘岭附近阵地,1952-11-27,1952-11
美国侵略者扩充李伪军的计划困难重重,1952-11-27,1952-11
一九五二年十一月二十七日内容提要,1952-11-27,1952-11
为了和平到维也纳去,1952-11-27,1952-11
东北各基本建设单位建立责任制改善各工地施工管理工作,1952-11-27,1952-11
库韩村农民看到了远景,1952-11-27,1952-11
永远站在新事物的前面——天兰铁路工地见闻之一,1952-11-27,1952-11
以正确态度调整专门技术人材,1952-11-27,1952-11
读者来信,1952-11-27,1952-11
对人民日报读者批评建议的反应	北京市人民法院对“双合成”案的检查,1952-11-27,1952-11
华北行政委员会发出关于冬学运动的指示,1952-11-27,1952-11
中共中央华北局发出指示号召保证执行“冬学运动的指示”,1952-11-27,1952-11
中央人民政府教育部关于一九五二年冬学运动的通知,1952-11-27,1952-11
苏联历史学界热心研究中国近代史    ——访苏联历史学家叶菲莫夫教授,1952-11-27,1952-11
从朝鲜前线寄莫斯科	——为庆祝“中苏友好月”而作,1952-11-27,1952-11
浙江省人民政府、中共浙江省委纪律检查委员会    严正处理干部侵犯人权的三个重大案件,1952-11-27,1952-11
肃清干部侵犯人权的恶劣现象,1952-11-27,1952-11
迎接世界人民和平大会    各国和平组织加紧进行筹备工作,1952-11-27,1952-11
出席亚洲及太平洋区域和平会议各国代表返国后    广泛宣传和平会议成就盛赞我国飞跃进步,1952-11-27,1952-11
加拿大等六国出席和平会议代表    抗议吉田政府迫害日本和平代表的暴行,1952-11-27,1952-11
捷克斯洛伐克和乌克兰代表在联大政委会上发言    主张以苏联提案作为解决朝鲜问题的基础,1952-11-27,1952-11
波议会首次会议闭幕,1952-11-27,1952-11
国际简讯,1952-11-27,1952-11
现代和过去,1952-11-27,1952-11
上甘岭志愿军三十三天击落击伤敌机二百多架,1952-11-28,1952-11
联大政委会结束关于朝鲜问题一般辩论    维辛斯基揭露美国继续侵朝阴谋	指出美英集团企图在印度提案掩饰下设法通过美国的要求,1952-11-28,1952-11
在苏联友人无私的援助下中国长春铁路金城线提前修复正式通车,1952-11-28,1952-11
吉洪诺夫和哈侬等抵达上海受到热烈欢迎    苏联艺术家分别在上海和南京等地演出,1952-11-28,1952-11
在联合国大会政治委员会十一月二十四日会议上    维辛斯基关于朝鲜问题的演说,1952-11-28,1952-11
一九五二年十一月二十八日内容提要,1952-11-28,1952-11
为鞍山就是为全国    ——记全国支援鞍山钢铁公司的建设,1952-11-28,1952-11
中国百货公司盲目订货积压大批进口商品	造成这种现象的供给制思想和官僚主义作风，	必须坚决肃清，以便为实行经济核算制打下基础,1952-11-28,1952-11
沈阳国营贸易系统改革商品流转组织工作    建立专业批发机构，实行对专门商品的批发业务,1952-11-28,1952-11
让技术更好地为祖国服务    ——天兰铁路工地见闻之二,1952-11-28,1952-11
东北国营贸易系统建立批发站以来的成就,1952-11-28,1952-11
杨显亭农业生产合作社社员一致表示要向苏联学习,1952-11-28,1952-11
听了李顺达的访苏报告  平顺农民明确了生产方向,1952-11-28,1952-11
读了访苏观感的文章我们互助组有了很大进步,1952-11-28,1952-11
介绍防治“猪丹毒”的办法,1952-11-28,1952-11
西康藏族人民感谢毛主席,1952-11-28,1952-11
对人民日报读者批评建议的反应    玉田县人民法院前院长检查官僚主义,1952-11-28,1952-11
中共湖南新化县委没有按照中央的建党方针进行建党工作,1952-11-28,1952-11
党的生活简评    坚持积极的慎重的建党方针,1952-11-28,1952-11
北京重工业学校是怎样学习苏联经验进行课程改革工作的,1952-11-28,1952-11
中苏人民并肩前进（歌曲）,1952-11-28,1952-11
怀波列伏依,1952-11-28,1952-11
周恩来外长发表声明    赞同苏联关于朝鲜问题的建议,1952-11-29,1952-11
东北中南总结“中苏友好月”半月活动经验,1952-11-29,1952-11
中苏科学界进行科学交流工作,1952-11-29,1952-11
朝鲜停战谈判取得关于军事分界线的协议已经一年    美方坚持进行战争使谈判濒于破裂边缘,1952-11-29,1952-11
中日执行贸易协议的第一个合同在京签订,1952-11-29,1952-11
贯彻把基本建设放在首要地位的方针    重工业部召开全国厂矿长会议    正向各厂矿抽调力量充实基本建设机构,1952-11-29,1952-11
政务院举行第一六零次会议,1952-11-29,1952-11
