江西开辟民航线,1959-11-23,1959-11
大明山下修运河,1959-11-23,1959-11
廖启发积累“三查四慢”经验,1959-11-23,1959-11
邵鹏月月超额完成任务,1959-11-23,1959-11
高虎臣改进化油部件,1959-11-23,1959-11
农村旺季市场来临的时候,1959-11-23,1959-11
工人农民心连心,1959-11-23,1959-11
纺织工人庆丰收,1959-11-23,1959-11
一个流量浇地十万亩,1959-11-23,1959-11
建成引蓄用三结合水利网,1959-11-23,1959-11
合理灌溉水尽其用,1959-11-23,1959-11
河北半数穷队改变面貌,1959-11-23,1959-11
歌唱东梁山,1959-11-23,1959-11
鄱阳湖畔的变化,1959-11-23,1959-11
江西全面开垦湖田洲地,1959-11-23,1959-11
巨大的变化,1959-11-23,1959-11
新型农民的摇篮,1959-11-23,1959-11
增田公社红专学校一举数得,1959-11-23,1959-11
边作边学边学边作,1959-11-23,1959-11
中央领导人接见五省区参观团,1959-11-23,1959-11
班禅等在辽宁参观后去内蒙古,1959-11-23,1959-11
欢迎苏共青团代表团,1959-11-23,1959-11
纪念释迦牟尼降世节日,1959-11-23,1959-11
捷政府贸易代表团团长到京,1959-11-23,1959-11
各国驻华外交官员到河北、河南参观旅行,1959-11-23,1959-11
阿根廷奥斯瓦尔多·普格利赛乐队在京首次公演受到欢迎,1959-11-23,1959-11
捷交响乐团在上海演出,1959-11-23,1959-11
中匈击剑队举行精彩表演赛,1959-11-23,1959-11
苏青年男、女篮球队双双获胜,1959-11-23,1959-11
苏托木斯克人足球队2∶3败给广东队,1959-11-23,1959-11
罗大批企业提前完成全年生产计划,1959-11-23,1959-11
苏联将继续尽力维护和平,1959-11-23,1959-11
伏罗希洛夫欢宴杜尔总统,1959-11-23,1959-11
苏科技文化展览会在墨西哥开幕,1959-11-23,1959-11
苏联文化代表团应邀到智利访问,1959-11-23,1959-11
索非亚举行保中友谊晚会,1959-11-23,1959-11
保共领导人日夫科夫等参观了展览会,1959-11-23,1959-11
我代表团去圣地亚哥,1959-11-23,1959-11
通过兄弟国家劳动分工研究计划,1959-11-23,1959-11
德国统一社会党下月举行中央全会,1959-11-23,1959-11
煽动印度对我国“采取行动”,1959-11-23,1959-11
竭力企图阻挠中印谈判,1959-11-23,1959-11
越南的社会主义三大改造,1959-11-23,1959-11
生产战线上的尖兵,1959-11-23,1959-11
美国一面侈谈和平一面加剧“冷战”,1959-11-23,1959-11
苏联指斥美国进行冷战,1959-11-23,1959-11
美国在西欧扩大导弹基地,1959-11-23,1959-11
决定维持庞大军费,1959-11-23,1959-11
联大通过苏美裁军联合提案,1959-11-23,1959-11
美国文武官员大肆鼓吹扩军备战,1959-11-23,1959-11
南非当局迫害马费肯夫人的阴谋失败,1959-11-23,1959-11
美国在冲绳举行大规模导弹演习,1959-11-23,1959-11
国际工人阶级支持古巴,1959-11-23,1959-11
阿尔及利亚民族解放军接连出击,1959-11-23,1959-11
东京万人示威游行,1959-11-23,1959-11
日本为蒋帮制造军火,1959-11-23,1959-11
非洲工人阶级团结事业的重要发展,1959-11-23,1959-11
反右倾，鼓干劲，落后变先进,1959-11-23,1959-11
学术文化动态,1959-11-23,1959-11
挤颂,1959-11-23,1959-11
两间屋,1959-11-23,1959-11
搬新房,1959-11-23,1959-11
鳄鱼的眼泪,1959-11-23,1959-11
党比母亲还要亲,1959-11-23,1959-11
欢迎优秀的科学教育片,1959-11-23,1959-11
为人类的幸福,1959-11-23,1959-11
琼花和梖树,1959-11-23,1959-11
新线路（国画）,1959-11-23,1959-11
全国冬小麦播种计划超额完成,1959-11-24,1959-11
为明年春播及早深翻土地,1959-11-24,1959-11
四川重灾区保产轻灾区增产,1959-11-24,1959-11
维修设备制造备品,1959-11-24,1959-11
贵州农村新添百座小电站,1959-11-24,1959-11
京承铁路全线修通,1959-11-24,1959-11
今日天气预报（北京地区）,1959-11-24,1959-11
兰州化工厂合成氨产量翻番,1959-11-24,1959-11
上海行行业业形成协作网,1959-11-24,1959-11
协作就是力量,1959-11-24,1959-11
技术革新大小并举全面开花,1959-11-24,1959-11
上下齐动手大小一齐抓,1959-11-24,1959-11
广东职工大力支援水利建设,1959-11-24,1959-11
各显神通,1959-11-24,1959-11
大企业也要大搞群众运动,1959-11-24,1959-11
多喂青粗饲料猪肥猪壮,1959-11-24,1959-11
多养猪养好猪,1959-11-24,1959-11
不让病虫害潜伏越冬,1959-11-24,1959-11
敢于面对困难的人,1959-11-24,1959-11
山东三类麦苗大大减少,1959-11-24,1959-11
全椒县普施小麦盘根肥,1959-11-24,1959-11
水苋菜——好肥料好饲料,1959-11-24,1959-11
发酵饲料和青贮饲料,1959-11-24,1959-11
三县一条心携手齐跃进,1959-11-24,1959-11
协作产生力量,1959-11-24,1959-11
庆祝中国阿尔巴尼亚建交十周年,1959-11-24,1959-11
印度尼西亚赠给我国一批珍贵动物,1959-11-24,1959-11
西北大学加强思想教育,1959-11-24,1959-11
全国地层会议闭幕,1959-11-24,1959-11
大风和降温警报,1959-11-24,1959-11
杭州民办小学巩固提高,1959-11-24,1959-11
共产主义的苗圃,1959-11-24,1959-11
全国青年足球冠军赛结束,1959-11-24,1959-11
在武汉作精彩表演,1959-11-24,1959-11
哈尔滨冰上运动开始了,1959-11-24,1959-11
兄弟国家互通有无促进经济共同高涨,1959-11-24,1959-11
加强对劳动人民的思想政治教育,1959-11-24,1959-11
太阳已从东方升起,1959-11-24,1959-11
号召加强北方实现越南统一,1959-11-24,1959-11
苏美签订科学、技术、教育和文化合作协定,1959-11-24,1959-11
伊拉克专家去苏联学习,1959-11-24,1959-11
苏联经济正在迅速赶上美国,1959-11-24,1959-11
坚持敌视中国政策露骨地制造“两个中国”,1959-11-24,1959-11
号召民族解放军官兵坚持战斗,1959-11-24,1959-11
戴高乐拒绝同阿临时政府谈判,1959-11-24,1959-11
西德和平战士在法庭上宣扬和平真理,1959-11-24,1959-11
拉丁美洲召开妇女代表大会,1959-11-24,1959-11
英国和西德会谈默默结束,1959-11-24,1959-11
西欧两经济营垒矛盾加剧,1959-11-24,1959-11
以武会友,1959-11-24,1959-11
国际简讯,1959-11-24,1959-11
美国在资本主义市场上的地位日益削弱,1959-11-24,1959-11
谈逐级召开物资交流会,1959-11-24,1959-11
读书与工作,1959-11-24,1959-11
学术文化动态,1959-11-24,1959-11
斩江拦河夺丰收,1959-11-24,1959-11
年成不好收成好,1959-11-24,1959-11
不怕龙王不怕天,1959-11-24,1959-11
汉代陶楼阁,1959-11-24,1959-11
它鼓舞着我们前进,1959-11-24,1959-11
麦苗肥（第四届全国版画展览会作品）,1959-11-24,1959-11
发展猪肥化肥绿肥基地,1959-11-25,1959-11
胜利必属刚果人民,1959-11-25,1959-11
支持刚果人民争取民族独立,1959-11-25,1959-11
祝瑞香施展养猪本领,1959-11-25,1959-11
陕西百日抗旱扭转严重灾害局面,1959-11-25,1959-11
今日天气预报（北京地区）,1959-11-25,1959-11
本钢生产继续全面上升,1959-11-25,1959-11
东社工业区组织运输联动作业网,1959-11-25,1959-11
力夺全胜,1959-11-25,1959-11
河南建成输电网,1959-11-25,1959-11
西固新添发电机组,1959-11-25,1959-11
四川化工厂开始生产,1959-11-25,1959-11
广西兴建大水泥厂,1959-11-25,1959-11
上海轻工业增产不增人,1959-11-25,1959-11
山东好汉斩黄河,1959-11-25,1959-11
推广水力挖土,1959-11-25,1959-11
采用漏斗装车,1959-11-25,1959-11
高站台装卸快,1959-11-25,1959-11
摇臂吊效率高,1959-11-25,1959-11
引水冲沙淤地种水稻,1959-11-25,1959-11
晚稻新品种——“万粒斤”,1959-11-25,1959-11
“千粒穗”和“万粒斤”,1959-11-25,1959-11
贺榆林专区全面治理沙漠,1959-11-25,1959-11
沙漠中的革命,1959-11-25,1959-11
简明新闻,1959-11-25,1959-11
晋北羊只增长27％,1959-11-25,1959-11
荣誉归于他,1959-11-25,1959-11
饲养家兔增加收入,1959-11-25,1959-11
盱眙耕牛十个月净增一成多,1959-11-25,1959-11
广西农业中学做到大家满意,1959-11-25,1959-11
山东农业中学蓬勃发展,1959-11-25,1959-11
满腔热情为职工服务,1959-11-25,1959-11
天津新建高等院校健步前进,1959-11-25,1959-11
防治猪气喘病,1959-11-25,1959-11
教育战线上的新军,1959-11-25,1959-11
首都文化界举行纪念会,1959-11-25,1959-11
印度尼西亚情报部代表团到京,1959-11-25,1959-11
德意志民主共和国两位作家到京,1959-11-25,1959-11
周总理接见乐队领导人,1959-11-25,1959-11
我妇女访苏代表团回京,1959-11-25,1959-11
大风和降温警报,1959-11-25,1959-11
刚果人民要求立即独立,1959-11-25,1959-11
对印度尼西亚的排华运动表示忧虑,1959-11-25,1959-11
印度尼西亚同中国发生的问题  可按照两国外长联合公报解决,1959-11-25,1959-11
土耳其政府备战忙,1959-11-25,1959-11
土耳其经济混乱政治腐败,1959-11-25,1959-11
三分之一学龄儿童不能上学,1959-11-25,1959-11
美国军人胡作非为,1959-11-25,1959-11
在土耳其,1959-11-25,1959-11
以印度尼西亚——中国友好的精神和行动来解决华侨问题,1959-11-25,1959-11
李伪军一飞行员起义,1959-11-25,1959-11
彻底粉碎修改“安全条约”的阴谋,1959-11-25,1959-11
匈牙利人民信心百倍迎接党代会,1959-11-25,1959-11
美吴集团越反动越接近灭亡,1959-11-25,1959-11
赫鲁晓夫接见杜尔,1959-11-25,1959-11
匈苏代表谴责美国煽动冷战,1959-11-25,1959-11
一枝新开的友谊花,1959-11-25,1959-11
我国妇女代表团到达智利圣地亚哥,1959-11-25,1959-11
蒙古一批新工厂投入生产,1959-11-25,1959-11
苏蒙签订明年换货议定书,1959-11-25,1959-11
中英乒乓球队再次对垒,1959-11-25,1959-11
广阔浩瀚的友谊,1959-11-25,1959-11
革命历史的光辉,1959-11-25,1959-11
为了革命的后代,1959-11-25,1959-11
不一般,1959-11-25,1959-11
滚滚洪流不可挡,1959-11-25,1959-11
红心虎胆的宋技师,1959-11-25,1959-11
满园春色和一片黄叶,1959-11-25,1959-11
时刻警惕着阶级敌人,1959-11-25,1959-11
第一次过民主生活,1959-11-25,1959-11
打场（青海）,1959-11-25,1959-11
阿发挪的歌,1959-11-25,1959-11
算题一则,1959-11-25,1959-11
中国人民支持刚果和非洲人民,1959-11-26,1959-11
帝国主义者滚出刚果！滚出非洲！,1959-11-26,1959-11
感谢对十月革命节的祝贺,1959-11-26,1959-11
全面抓紧最后三十几天,1959-11-26,1959-11
上海电机工业大抓产量和品种,1959-11-26,1959-11
西藏农牧民喜获铁质工具,1959-11-26,1959-11
今日天气预报（北京地区）,1959-11-26,1959-11
鹿寨一年巨变长成炼铁新城,1959-11-26,1959-11
大抓矿山工作为明年钢铁工业继续跃进作好准备,1959-11-26,1959-11
插花庙—中型铁矿一面红旗,1959-11-26,1959-11
鹿寨光芒永射,1959-11-26,1959-11
巨犁出世,1959-11-26,1959-11
深夜锣鼓声,1959-11-26,1959-11
把不用的滚珠轴承支援农村,1959-11-26,1959-11
别忘了“好”和“省”,1959-11-26,1959-11
“工商还分什么家！”,1959-11-26,1959-11
这样开始的一场竞赛,1959-11-26,1959-11
春到人间花自开,1959-11-26,1959-11
关键,1959-11-26,1959-11
适应工程需要不断改革工具,1959-11-26,1959-11
云南检查小春田间管理质量  淮北趁雨补种保证小麦全苗,1959-11-26,1959-11
小麦提早冬灌好处多  清惠渠改进方法加速灌溉,1959-11-26,1959-11
工棚不透风顿顿吃热饭,1959-11-26,1959-11
便利存款取款,1959-11-26,1959-11
保健人员活跃在工地上,1959-11-26,1959-11
关心民工如亲人,1959-11-26,1959-11
为水库建设者上演新戏放映电影,1959-11-26,1959-11
给刚果独立自由，帝国主义滚出非洲去！,1959-11-26,1959-11
重庆机关干部作风一新,1959-11-26,1959-11
政治挂帅带来生产大丰收,1959-11-26,1959-11
接见全国小型煤矿工作会议农业机械科学技术会议全体代表,1959-11-26,1959-11
首都文学界追悼章靳以,1959-11-26,1959-11
北京大学举行联欢晚会,1959-11-26,1959-11
中蒙分别举行电影招待会,1959-11-26,1959-11
丁西林设宴欢迎印度尼西亚情报部代表团,1959-11-26,1959-11
支持刚果人民的斗争,1959-11-26,1959-11
刚果人民一定能斩断殖民枷锁,1959-11-26,1959-11
支持南非人民的正义斗争,1959-11-26,1959-11
古巴工人代表大会闭幕,1959-11-26,1959-11
南美风光,1959-11-26,1959-11
美洲区域工人组织,1959-11-26,1959-11
国际简讯,1959-11-26,1959-11
日本用战争赔偿实行扩张,1959-11-26,1959-11
日本对南越赔偿完全无效,1959-11-26,1959-11
美国竭力煽起反华运动掩饰侵略政策  妄图分裂亚非团结破坏亚非民族独立,1959-11-26,1959-11
蒙古社会主义建设事业蒸蒸日上,1959-11-26,1959-11
谴责美国干涉南越和老挝,1959-11-26,1959-11
赫鲁晓夫欢宴几内亚总统,1959-11-26,1959-11
意大利总统明年一月访苏,1959-11-26,1959-11
波兰和尼泊尔建交,1959-11-26,1959-11
地拉那举行电影展览开幕式,1959-11-26,1959-11
美国“冷战”制造者凶相毕露,1959-11-26,1959-11
美国军队必须撤出南朝鲜,1959-11-26,1959-11
墨西哥人踊跃参观苏联展览会,1959-11-26,1959-11
我国妇女代表团在智利访问,1959-11-26,1959-11
中苏文化交流活动,1959-11-26,1959-11
蒙古人民共和国成立三十五周年,1959-11-26,1959-11
谈谈现代汉语规范化工作,1959-11-26,1959-11
永远保持饱满的革命精神,1959-11-26,1959-11
古都青春,1959-11-26,1959-11
咬破个人主义的茧子,1959-11-26,1959-11
伟大的理想,1959-11-26,1959-11
人民的生活创造音乐的传统,1959-11-26,1959-11
大伙房水库短歌,1959-11-26,1959-11
中国风格,1959-11-26,1959-11
出海,1959-11-26,1959-11
上海电机厂全面完成年计划,1959-11-27,1959-11
中共代表团前往布达佩斯,1959-11-27,1959-11
庆祝蒙古人民共和国成立三十五周年,1959-11-27,1959-11
集中力量突击修建重点工程,1959-11-27,1959-11
支持反对日美“安全条约”的斗争,1959-11-27,1959-11
日本正在被拖上军国主义复活的道路,1959-11-27,1959-11
今日天气预报（北京地区）,1959-11-27,1959-11
迅速运送农副产品,1959-11-27,1959-11
技术革新结合连环竞赛  共同促进产品迅速成套,1959-11-27,1959-11
学习先进经验,1959-11-27,1959-11
积极的平衡,1959-11-27,1959-11
千车万船赶运城乡物资,1959-11-27,1959-11
铁木篾“三匠”上阵支援农业,1959-11-27,1959-11
简讯,1959-11-27,1959-11
夺钢先锋,1959-11-27,1959-11
增产手工业品迎接旺季,1959-11-27,1959-11
开展“百母保百仔”竞赛,1959-11-27,1959-11
草原传喜讯,1959-11-27,1959-11
粮食加工不用驴  利用水力带机器,1959-11-27,1959-11
良种猪繁殖多成长快,1959-11-27,1959-11
黑龙江农民喜养良种猪,1959-11-27,1959-11
多养良种猪,1959-11-27,1959-11
“两头乌”猪种介绍,1959-11-27,1959-11
“癞马沟”成为“铁牛社”,1959-11-27,1959-11
机械秋收（兴农公社速写）,1959-11-27,1959-11
适应农业继续跃进的新形势,1959-11-27,1959-11
解放军军官好学不倦,1959-11-27,1959-11
学习跟着生产走,1959-11-27,1959-11
更上一层楼,1959-11-27,1959-11
拉萨改选居民委员会,1959-11-27,1959-11
北京国棉一厂举行庆祝会,1959-11-27,1959-11
支持争取收回运河区主权的斗争,1959-11-27,1959-11
德国男子排球队到京,1959-11-27,1959-11
苏联青年男女篮球队双胜江苏队,1959-11-27,1959-11
东风时雨润鲜花,1959-11-27,1959-11
和平和社会主义事业前景无限光明,1959-11-27,1959-11
支持周恩来总理的和平建议,1959-11-27,1959-11
主张进行谈判缔结对德和约,1959-11-27,1959-11
朝鲜劳动党中央决定下月举行全会,1959-11-27,1959-11
杜尔表示支持万隆原则,1959-11-27,1959-11
不容破坏印度尼西亚中国友谊,1959-11-27,1959-11
在维也纳举行会议,1959-11-27,1959-11
我国红十字会捐款救济印度水灾灾民,1959-11-27,1959-11
我乒乓球乙队  再胜英格兰队,1959-11-27,1959-11
阿尔巴尼亚教育事业蓬勃发展,1959-11-27,1959-11
阿尔巴尼亚农业和畜牧业的发展,1959-11-27,1959-11
日本人民开展第八次全国行动,1959-11-27,1959-11
揭露新日美条约的侵略本质,1959-11-27,1959-11
反对“安全条约”斗争深入基层,1959-11-27,1959-11
声讨帝国主义在非洲的罪行,1959-11-27,1959-11
阿尔及利亚解放军将坚持斗争,1959-11-27,1959-11
美国大使和狗,1959-11-27,1959-11
黎巴嫩舆论群起抨击,1959-11-27,1959-11
美国月球卫星海底找月亮,1959-11-27,1959-11
美国卫星容器又失踪,1959-11-27,1959-11
格列索斯面临新迫害,1959-11-27,1959-11
奉行中立政策不参加军事集团,1959-11-27,1959-11
竭力制造亚洲的战争气氛,1959-11-27,1959-11
一致指责岸政府敌视中国政策,1959-11-27,1959-11
南口公社一年间,1959-11-27,1959-11
民族语文工作的巨大成就,1959-11-27,1959-11
学术文化动态,1959-11-27,1959-11
顽强地推广先进事物,1959-11-27,1959-11
师徒,1959-11-27,1959-11
前进的链条,1959-11-27,1959-11
春色满园关不住,1959-11-27,1959-11
编后小语,1959-11-27,1959-11
一定能赶上先进,1959-11-27,1959-11
争上游，长志气,1959-11-27,1959-11
队长回来了,1959-11-27,1959-11
迎英雄,1959-11-27,1959-11
引洮工程全部工序土机械化,1959-11-28,1959-11
河南受旱作物小部减产大部增产,1959-11-28,1959-11
中蒙人民的深厚友谊日益增强,1959-11-28,1959-11
中华人民共和国主席令,1959-11-28,1959-11
老虎车,1959-11-28,1959-11
木轨火车,1959-11-28,1959-11
加快小型水利工程建设  武东公社环环改革工具,1959-11-28,1959-11
把高工效的红旗插遍水利工地,1959-11-28,1959-11
今日天气预报（北京地区）,1959-11-28,1959-11
合理摆布缩短运程一次运完,1959-11-28,1959-11
一次运到好处很多,1959-11-28,1959-11
机器高速运转  生产全面跃进,1959-11-28,1959-11
青春长在,1959-11-28,1959-11
吉林市节约工业用煤十万吨,1959-11-28,1959-11
机器“大夫”,1959-11-28,1959-11
四种新型机车,1959-11-28,1959-11
我们怎样加快了基本建设速度,1959-11-28,1959-11
石家庄地区多种经营阔步向前,1959-11-28,1959-11
发动农民设计水利工程,1959-11-28,1959-11
到群众中去找“鲁班”！,1959-11-28,1959-11
抓住多种经营的大好时机,1959-11-28,1959-11
结合治水治土积肥造肥,1959-11-28,1959-11
丰收来之不易！,1959-11-28,1959-11
“十里光”和“五里净”,1959-11-28,1959-11
全国人民代表大会代表团访问蒙古人民共和国的报告,1959-11-28,1959-11
大力防治冬春传染病,1959-11-28,1959-11
各地普遍展开冬季卫生运动,1959-11-28,1959-11
李富春副总理接见蒙古经济考察团,1959-11-28,1959-11
郭沫若接见巴西客人,1959-11-28,1959-11
苏联各民族实用艺术和民间工艺品展览会闭幕,1959-11-28,1959-11
中国体操队去缅甸访问,1959-11-28,1959-11
尼共前总书记曼摩汉·阿迪卡利回国,1959-11-28,1959-11
首都举行阿影片“风暴”首映招待会,1959-11-28,1959-11
松村谦三访问武汉后去上海,1959-11-28,1959-11
宁夏回族自治区人民代表大会和人民委员会组织条例,1959-11-28,1959-11
阿尔巴尼亚人民劳动竞赛成绩卓著,1959-11-28,1959-11
匈牙利加速农业社会主义改造,1959-11-28,1959-11
非洲人民应当享受民族独立权利,1959-11-28,1959-11
和平烟幕后的“冷战”活动,1959-11-28,1959-11
中共代表团抵布达佩斯,1959-11-28,1959-11
斥责美国企图永远分裂朝鲜,1959-11-28,1959-11
我新闻工作者代表团抵平壤,1959-11-28,1959-11
我们的友谊,1959-11-28,1959-11
阿尔巴尼亚光辉的十五年,1959-11-28,1959-11
日本全国一致行动四百万人大示威,1959-11-28,1959-11
当前任务是阻止修改“安全条约”,1959-11-28,1959-11
我国妇联电日本妇女团体支持日本妇女反对修改“安全条约”,1959-11-28,1959-11
美国在台湾地区加紧挑衅,1959-11-28,1959-11
和平力量不可战胜,1959-11-28,1959-11
美国在欧亚非地区扩建导弹基地网,1959-11-28,1959-11
美国训练土意希军人使用导弹,1959-11-28,1959-11
缓兵之计,1959-11-28,1959-11
洛克菲勒是导弹大老板,1959-11-28,1959-11
死亡商人与导弹,1959-11-28,1959-11
找什么？,1959-11-28,1959-11
美国的导弹基地图,1959-11-28,1959-11
并非什么失调而是更加适应,1959-11-28,1959-11
反对安居中游的思想,1959-11-28,1959-11
原子能在农业中的利用,1959-11-28,1959-11
柳树春秋,1959-11-28,1959-11
革命和友谊的颂歌,1959-11-28,1959-11
晋中随笔,1959-11-28,1959-11
食物·热量·水,1959-11-28,1959-11
旅夜闻琴,1959-11-28,1959-11
儿童生活小景,1959-11-28,1959-11
湖南浙江改革工具节省农业劳力,1959-11-29,1959-11
电贺阿尔巴尼亚解放十五周年,1959-11-29,1959-11
欢庆阿尔巴尼亚的光辉节日,1959-11-29,1959-11
朱德委员长接见基罗加,1959-11-29,1959-11
刘主席电贺南斯拉夫国庆,1959-11-29,1959-11
英雄的人民，辉煌的成就！,1959-11-29,1959-11
今日天气预报（北京地区）,1959-11-29,1959-11
中国人民为阿尔巴尼亚的伟大成就感到自豪,1959-11-29,1959-11
阿尔巴尼亚人民在党的光辉旗帜下大踏步前进,1959-11-29,1959-11
社会主义在阿尔巴尼亚的胜利,1959-11-29,1959-11
电贺阿尔巴尼亚国庆,1959-11-29,1959-11
文化之花欣欣向荣,1959-11-29,1959-11
祝阿尔巴尼亚解放十五周年,1959-11-29,1959-11
人民首都地拉那,1959-11-29,1959-11
地拉那举行盛大歌舞晚会,1959-11-29,1959-11
克鲁雅城斯坎德培铜像揭幕,1959-11-29,1959-11
河南省中阿友好公社集会庆祝,1959-11-29,1959-11
国际简讯,1959-11-29,1959-11
日本一家工厂大爆炸,1959-11-29,1959-11
岸政府血腥镇压请愿群众激起公愤,1959-11-29,1959-11
日本人民显示了无比团结和力量,1959-11-29,1959-11
支持刚果和非洲人民正义斗争,1959-11-29,1959-11
赫脱又弹“冷战”滥调,1959-11-29,1959-11
艾奇逊企图复活“战争边缘政策”,1959-11-29,1959-11
美太平洋舰队司令到台湾活动,1959-11-29,1959-11
上海队胜德国家男子队,1959-11-29,1959-11
中苏友协代表团由苏联回国,1959-11-29,1959-11
我体操队到达仰光,1959-11-29,1959-11
蒙古经济考察团离京回国,1959-11-29,1959-11
发展现代工业改变内蒙面貌,1959-11-29,1959-11
钢铁木材食品工业迅速发展,1959-11-29,1959-11
大兴安岭森林工业走上新阶段,1959-11-29,1959-11
成长中的少数民族工人,1959-11-29,1959-11
草原之花,1959-11-29,1959-11
地富人勤出产多,1959-11-29,1959-11
白纸画新图处处飘油香,1959-11-29,1959-11
小炼油厂大有前途,1959-11-29,1959-11
农安县的人造石油,1959-11-29,1959-11
向革新的道路飞奔,1959-11-29,1959-11
广阔的天地,1959-11-29,1959-11
名词解释,1959-11-29,1959-11
冬季松脂生产在各产区展开,1959-11-29,1959-11
江门专区松脂产量不断上升,1959-11-29,1959-11
做好冬季采脂工作,1959-11-29,1959-11
南雄县始兴人民公社,1959-11-29,1959-11
增产松香的新途径,1959-11-29,1959-11
我国的松脂资源,1959-11-29,1959-11
什么是化学采脂法,1959-11-29,1959-11
一、二、三、四、五运动,1959-11-29,1959-11
10×480＝7700,1959-11-29,1959-11
地拉那短曲,1959-11-29,1959-11
我热爱北京,1959-11-29,1959-11
东柳重青,1959-11-29,1959-11
柳子戏,1959-11-29,1959-11
读者、作者、编者,1959-11-29,1959-11
公社新建化肥厂,1959-11-29,1959-11
快快长大！,1959-11-29,1959-11
“小秋收”大丰收  边采购边加工,1959-11-30,1959-11
赶快加工利用野生植物,1959-11-30,1959-11
忠县野生植物变百宝,1959-11-30,1959-11
庆祝南斯拉夫国庆,1959-11-30,1959-11
抗议美国驻孟买总领事馆绑架我职员,1959-11-30,1959-11
筑路开河赶造车船  扩大短途运输能力,1959-11-30,1959-11
今日天气预报（北京地区）,1959-11-30,1959-11
武钢完成今年建设任务,1959-11-30,1959-11
一片年景,1959-11-30,1959-11
公粮余粮征购提前完成  口粮种籽饲料合理留足,1959-11-30,1959-11
北京开始大规模冬季施工,1959-11-30,1959-11
独山子炼油厂继续扩建,1959-11-30,1959-11
包头兴建大型棉纺织厂,1959-11-30,1959-11
武钢主轧机基础浇得快,1959-11-30,1959-11
凉风垭职工又创新纪录,1959-11-30,1959-11
保证冬季施工多快好省,1959-11-30,1959-11
我们时代的风格,1959-11-30,1959-11
朱村队全力支援兄弟队养猪,1959-11-30,1959-11
赛和帮,1959-11-30,1959-11
蒋庄队六年耕牛增五倍,1959-11-30,1959-11
饲养讲科学,1959-11-30,1959-11
饲养讲科学,1959-11-30,1959-11
简明新闻,1959-11-30,1959-11
宁夏加紧草原基地建设,1959-11-30,1959-11
青海推行春小麦冬播,1959-11-30,1959-11
大片碱地长出麦苗,1959-11-30,1959-11
威宁县是怎样改良土壤的,1959-11-30,1959-11
在庆祝阿尔巴尼亚解放十五周年招待会上,1959-11-30,1959-11
中阿友协对外文委电贺阿国庆,1959-11-30,1959-11
一年多完成项目超过八年总和,1959-11-30,1959-11
班禅等离包头回北京,1959-11-30,1959-11
红在心里  专在地里,1959-11-30,1959-11
让协作之风吹遍每个角落,1959-11-30,1959-11
威力,1959-11-30,1959-11
摩洛哥前首相在我国访问结束,1959-11-30,1959-11
捷克斯洛伐克交响乐团离开我国,1959-11-30,1959-11
捷机器制造生产革新者代表团回国,1959-11-30,1959-11
喀麦隆、苏丹妇女代表团回国,1959-11-30,1959-11
智利外科医生阿库纳回国,1959-11-30,1959-11
朝鲜美术家同盟常委郑钟汝到京,1959-11-30,1959-11
蔡艺墅越过四米五十,1959-11-30,1959-11
北京队3比○胜德排球队,1959-11-30,1959-11
地拉那举行盛大阅兵游行,1959-11-30,1959-11
保证加速完成社会主义奠基工作,1959-11-30,1959-11
赫鲁晓夫率代表团抵匈,1959-11-30,1959-11
强烈抗议希腊当局迫害格列索斯,1959-11-30,1959-11
迎接匈牙利社会主义工人党第七次代表大会,1959-11-30,1959-11
