今日天气预报（北京地区）,1959-11-01,1959-11
经费自己筹炸药自己熬技术自己学,1959-11-01,1959-11
制止老挝政府非法审判苏发努冯,1959-11-01,1959-11
野生“百宝”乖乖为人民效劳,1959-11-01,1959-11
第一拖拉机制造厂工程质量优良 国家验收委员会批准今日投入生产,1959-11-01,1959-11
做群众运动带头人,1959-11-01,1959-11
擂起大兴水利的战鼓,1959-11-01,1959-11
做群众运动带头人,1959-11-01,1959-11
关于工业战线的群众运动,1959-11-01,1959-11
右倾机会主义就是企图为资本主义复辟开辟道路,1959-11-01,1959-11
鼓足更大干劲，跃进，再跃进,1959-11-01,1959-11
陈叔通向群英大会致贺词,1959-11-01,1959-11
两年全部机械化五年公社变花园,1959-11-01,1959-11
永远做党的忠实女儿,1959-11-01,1959-11
“一切为了祖国更大的跃进”,1959-11-01,1959-11
十月革命是世界人民胜利的旗帜,1959-11-01,1959-11
全国将展开盛大活动庆祝伟大十月革命节,1959-11-01,1959-11
看，钢铁轻骑队纵马飞奔,1959-11-01,1959-11
浙江晚稻出现大批千斤田,1959-11-01,1959-11
喜庆晚稻特大丰收,1959-11-01,1959-11
平均亩产二千一百六十四斤,1959-11-01,1959-11
千方百计促进家禽生产,1959-11-01,1959-11
擂起大兴水利的战鼓,1959-11-01,1959-11
希望就导向全面裁军措施达成协议,1959-11-01,1959-11
呼吁各国议会争取实现全面彻底裁军,1959-11-01,1959-11
反对联合国破坏日内瓦协议,1959-11-01,1959-11
阿尔及利亚独立火焰愈燃愈旺,1959-11-01,1959-11
阿尔及利亚人民一定获胜,1959-11-01,1959-11
老挝人民不许迫害苏发努冯,1959-11-01,1959-11
遵循中日两党声明加强斗争,1959-11-01,1959-11
卡塞姆总理复电周总理,1959-11-01,1959-11
日本利用赔偿协定搞阴谋,1959-11-01,1959-11
月球地理新的一章已写成,1959-11-01,1959-11
苏联行星际站和摄得的月球背面照片,1959-11-01,1959-11
北大荒变成了北大仓,1959-11-01,1959-11
向北京的乡亲们报丰收,1959-11-01,1959-11
密山大豆丰收单产提高二倍,1959-11-01,1959-11
公社化机械化发挥无穷威力,1959-11-01,1959-11
副食品的基地群,1959-11-01,1959-11
十年来的金融事业,1959-11-01,1959-11
矮房变大厦  人间建天堂,1959-11-01,1959-11
什么人说什么话,1959-11-01,1959-11
建设祖国,1959-11-01,1959-11
詹水晶十一年不出废品,1959-11-01,1959-11
“老马”长驰百万里,1959-11-01,1959-11
高速度地建设,1959-11-01,1959-11
把对祖国的热爱织进绸缎里,1959-11-01,1959-11
反右倾的胜利大搞群众运动的胜利,1959-11-01,1959-11
无畏的战士,1959-11-01,1959-11
荒山变金山,1959-11-01,1959-11
文化低挡不住心头热,1959-11-01,1959-11
能创造也能写书,1959-11-01,1959-11
“土”专家张福来,1959-11-01,1959-11
十年满堂红,1959-11-01,1959-11
万能突击队——杨万林工作队,1959-11-01,1959-11
地下铁海十年领先,1959-11-01,1959-11
工人也能设计,1959-11-01,1959-11
风雪难阻跃进车,1959-11-01,1959-11
倪志福和他的钻头,1959-11-01,1959-11
今日天气预报（北京地区）,1959-11-02,1959-11
建立步步高升的生产新常规,1959-11-02,1959-11
拖拉机厂举行落成典礼,1959-11-02,1959-11
结合秋收冬种大搞工具改革,1959-11-02,1959-11
山东千万亩棉花增产二成,1959-11-02,1959-11
为实现农业技术改造的伟大任务而奋斗,1959-11-02,1959-11
拖拉机厂举行落成典礼,1959-11-02,1959-11
多快好省四面开花,1959-11-02,1959-11
服务生产促进生产,1959-11-02,1959-11
少数民族地区经济建设大发展,1959-11-02,1959-11
大风霜冻紧急警报,1959-11-02,1959-11
六千多英雄代表观看文艺演出,1959-11-02,1959-11
山东二十万大军腰斩黄河,1959-11-02,1959-11
为实现农业技术改造的伟大任务而奋斗,1959-11-02,1959-11
让更多的铁牛开往田野,1959-11-02,1959-11
通力合作加快农业技术改造,1959-11-02,1959-11
拖拉机厂得到苏联无私的帮助,1959-11-02,1959-11
“东方红”的威力,1959-11-02,1959-11
祝“东方红”的诞生,1959-11-02,1959-11
在少年放牛的地方,1959-11-02,1959-11
东方红牌拖拉机介绍,1959-11-02,1959-11
为大跃进大创造而欢呼,1959-11-02,1959-11
揭穿“包产到户”的真面目,1959-11-02,1959-11
一亩地一头猪肥足粮丰,1959-11-02,1959-11
猪多肥多粮多,1959-11-02,1959-11
大建田间肥料站节省劳力,1959-11-02,1959-11
大量养猪粮食加番,1959-11-02,1959-11
大炮打不垮台风吹不散,1959-11-02,1959-11
树立先进旗手创造生产奇迹,1959-11-02,1959-11
首都举行文艺晚会,1959-11-02,1959-11
水力无梭织布机,1959-11-02,1959-11
中波签订科技合作议定书,1959-11-02,1959-11
澳大利亚等六国兄弟党代表团回国,1959-11-02,1959-11
巴西共产党代表团在东北参观后返京,1959-11-02,1959-11
降低四十二种物品价格,1959-11-02,1959-11
张奚若欢宴玻利维亚客人,1959-11-02,1959-11
波兰上演我国话剧“雷雨”,1959-11-02,1959-11
中波举行体操友谊赛,1959-11-02,1959-11
苏联经济很快就要超过美国,1959-11-02,1959-11
斯洛伐克的巨变,1959-11-02,1959-11
反对岸信介政府利用战争赔偿协定危害和平,1959-11-02,1959-11
苏越等国舆论声讨美萨集团罪行,1959-11-02,1959-11
刚果又爆发人民大示威,1959-11-02,1959-11
南斯拉夫代表团到印度,1959-11-02,1959-11
国际简讯,1959-11-02,1959-11
保持警惕继续斗争,1959-11-02,1959-11
越南国会和外交部分别声明,1959-11-02,1959-11
反对国会批准给南越战争赔偿,1959-11-02,1959-11
西欧的经济矛盾在发展,1959-11-02,1959-11
不进则退,1959-11-02,1959-11
学术文化动态,1959-11-02,1959-11
海洋地质学及其主要问题,1959-11-02,1959-11
六亿神州尽舜尧,1959-11-02,1959-11
来自远方,1959-11-02,1959-11
群英会颂,1959-11-02,1959-11
强夺天险,1959-11-02,1959-11
迷人的泥娃娃,1959-11-02,1959-11
拌和楼,1959-11-02,1959-11
美国展览,1959-11-02,1959-11
今日天气预报（北京地区）,1959-11-03,1959-11
棉花  油料  蚕茧  茶叶  稻麦齐报高产,1959-11-03,1959-11
城乡购销两旺,1959-11-03,1959-11
刘主席周总理陈外长电贺也门王国国庆,1959-11-03,1959-11
中匈互换友好条约批准书,1959-11-03,1959-11
首都举行中苏友谊联欢晚会,1959-11-03,1959-11
各路英雄献宝取经,1959-11-03,1959-11
中小企业一派大好形势,1959-11-03,1959-11
伟大的愿望和伟大的力量,1959-11-03,1959-11
加强雨后播种补种和田间管理,1959-11-03,1959-11
班禅额尔德尼等在黑龙江访问后去长春,1959-11-03,1959-11
李凤恩向老战友取经老孟泰给新基地送宝,1959-11-03,1959-11
英雄的歌儿唱不完,1959-11-03,1959-11
力争上游——时代的特征,1959-11-03,1959-11
生铁成本降低三分之二,1959-11-03,1959-11
小高炉的红火,1959-11-03,1959-11
陕西合理调整机械工业布局,1959-11-03,1959-11
大运河淮阴船闸动工,1959-11-03,1959-11
赶修京承铁路,1959-11-03,1959-11
湖南有了地方民航线,1959-11-03,1959-11
群众运动指向技术革新,1959-11-03,1959-11
代用原料到处有  增产节约门路多,1959-11-03,1959-11
少数民族地区经济面貌发生巨变,1959-11-03,1959-11
为了实现亲人的愿望,1959-11-03,1959-11
让电影艺术之花更加灿烂,1959-11-03,1959-11
冬季卫生运动深入展开,1959-11-03,1959-11
北京抓紧经常性卫生工作,1959-11-03,1959-11
突击运动和经常工作结合,1959-11-03,1959-11
一个好党员,1959-11-03,1959-11
光福公社常年坚持业余学习,1959-11-03,1959-11
关于国际形势和苏联外交政策,1959-11-03,1959-11
关于国际形势和苏联外交政策,1959-11-03,1959-11
制止老挝当局迫害苏发努冯,1959-11-03,1959-11
苏联裁军建议反映时代要求,1959-11-03,1959-11
印度尼西亚共产党代表团回国,1959-11-03,1959-11
挪威共产党代表团团长返京,1959-11-03,1959-11
哥伦比亚等国贵宾离京回国,1959-11-03,1959-11
捷国家女子排球队到京,1959-11-03,1959-11
中波体操友谊赛结束,1959-11-03,1959-11
中华医学会宴请印度客人,1959-11-03,1959-11
中罗举行划船友谊赛,1959-11-03,1959-11
朝鲜职业总同盟代表大会开幕,1959-11-03,1959-11
才能、群众创作、泼冷水,1959-11-03,1959-11
谈“注释”,1959-11-03,1959-11
谈电影“风暴”的改编,1959-11-03,1959-11
新的探索新的道路,1959-11-03,1959-11
革命的硬骨头,1959-11-03,1959-11
望月兴叹的人,1959-11-03,1959-11
重逢,1959-11-03,1959-11
谈作品中的“事故”,1959-11-03,1959-11
石榴树,1959-11-03,1959-11
苏南风光,1959-11-03,1959-11
出席全国工业、交通运输、基本建设、财贸方面社会主义建设先进集体和先进生产者代表大会代表名单,1959-11-03,1959-11
出席全国工业、交通运输、基本建设、财贸方面社会主义建设先进集体和先进生产者代表大会代表名单,1959-11-03,1959-11
出席全国工业、交通运输、基本建设、财贸方面社会主义建设先进集体和先进生产者代表大会代表名单,1959-11-03,1959-11
出席全国工业、交通运输、基本建设、财贸方面社会主义建设先进集体和先进生产者代表大会代表名单,1959-11-03,1959-11
今日天气预报（北京地区）,1959-11-04,1959-11
以新思想战胜旧思想用新技术代替旧技术,1959-11-04,1959-11
把增产节约运动和技术革新结合起来,1959-11-04,1959-11
大兴山水草木家畜野禽之利,1959-11-04,1959-11
公社庄稼好,1959-11-04,1959-11
摘棉花,1959-11-04,1959-11
棉粮高产榜,1959-11-04,1959-11
把增产节约运动和技术革新结合起来,1959-11-04,1959-11
细致谈经验认真学别人,1959-11-04,1959-11
先进集体保持先进荣誉,1959-11-04,1959-11
全国铁路职工献厚礼,1959-11-04,1959-11
西藏政协筹委会正式成立,1959-11-04,1959-11
光荣啊，建设战线上的解放军英雄！,1959-11-04,1959-11
高速优质完成四季度工程,1959-11-04,1959-11
趁黄金季节大抓施工进度,1959-11-04,1959-11
上海节约煤炭七十万吨,1959-11-04,1959-11
发展玻璃纤维工业,1959-11-04,1959-11
河南青海完成秋粮征购任务,1959-11-04,1959-11
山东工矿地区增电源,1959-11-04,1959-11
安徽自造无缝钢管,1959-11-04,1959-11
广西有了橡胶厂,1959-11-04,1959-11
又一大桥跨黄河,1959-11-04,1959-11
朝阳市征购工作一气呵成,1959-11-04,1959-11
访高级玻璃纤维厂,1959-11-04,1959-11
棉花收购站的一天,1959-11-04,1959-11
多多采山货快快来加工,1959-11-04,1959-11
破“定局论”抓牲畜配种,1959-11-04,1959-11
孵家禽不受季节限制,1959-11-04,1959-11
江西恒丰农场孵出大批秋鸭,1959-11-04,1959-11
利用牛舍猪圈养鸡省人力省饲料,1959-11-04,1959-11
做好准备保护牲畜过冬,1959-11-04,1959-11
湘东公社千亩晚稻超千斤,1959-11-04,1959-11
翻晒晚稻,1959-11-04,1959-11
农牧业双双跃进,1959-11-04,1959-11
苏联因地制宜推进农业专业化,1959-11-04,1959-11
各共和国农业专业化方向,1959-11-04,1959-11
祝朝鲜人民快马加鞭取得更大成就,1959-11-04,1959-11
朝鲜职业总同盟代表大会继续举行,1959-11-04,1959-11
应该拆除南北朝鲜间的墙壁,1959-11-04,1959-11
发展生产合理分配勤俭办社搞好副业,1959-11-04,1959-11
阿农业合作化获新成就,1959-11-04,1959-11
捷农业社数目不断增加,1959-11-04,1959-11
首都举行苏联工艺品展览会,1959-11-04,1959-11
苏联“托木斯克人”足球队抵天津,1959-11-04,1959-11
瑞典“尤哥登”足球队到京,1959-11-04,1959-11
半月国际述评,1959-11-04,1959-11
非洲民族解放斗争生气勃勃,1959-11-04,1959-11
比利时的殖民统治在动摇中,1959-11-04,1959-11
立即释放苏发努冯！,1959-11-04,1959-11
老挝当局被迫再度延期审判苏发努冯,1959-11-04,1959-11
苏联裁军建议深入人心,1959-11-04,1959-11
美国交给蒋介石空军一批摄影侦察机,1959-11-04,1959-11
和平力量大大加强冷战势力大大失势,1959-11-04,1959-11
成立工人阶级统一政党,1959-11-04,1959-11
坚持斗争争取独立,1959-11-04,1959-11
论教育事业的统一性与多样性,1959-11-04,1959-11
拍得月背照片的科学意义,1959-11-04,1959-11
哲学史上的唯我主义,1959-11-04,1959-11
学术文化动态,1959-11-04,1959-11
铁牛白马话洛阳,1959-11-04,1959-11
祝贺第一拖拉机厂诞生,1959-11-04,1959-11
第一台拖拉机出世了,1959-11-04,1959-11
“东方红”出车间,1959-11-04,1959-11
山鹰·牛·松竹,1959-11-04,1959-11
有形象、有意境、有气魄,1959-11-04,1959-11
翻晒小麦,1959-11-04,1959-11
雨,1959-11-04,1959-11
革命干劲的胜利,1959-11-04,1959-11
战胜川江激流,1959-11-04,1959-11
开路先锋——英雄杨连第连,1959-11-04,1959-11
刘新国巧用大拖车,1959-11-04,1959-11
小高炉红光满天,1959-11-04,1959-11
记账不用笔  点钱不用手,1959-11-04,1959-11
长江水边红旗飘,1959-11-04,1959-11
光荣的劳动崇高的荣誉,1959-11-04,1959-11
叫时间听命令,1959-11-04,1959-11
运输战线上的一员闯将,1959-11-04,1959-11
小铝厂大放光明,1959-11-04,1959-11
生猪饲养保管能手王金才,1959-11-04,1959-11
勇往直前跃进再跃进,1959-11-04,1959-11
岩石让路困难低头,1959-11-04,1959-11
一片赤心为旅客,1959-11-04,1959-11
一代新人,1959-11-04,1959-11
年年有创造月月有革新,1959-11-04,1959-11
今日天气预报（北京地区）,1959-11-05,1959-11
以养猪为主大建肥料基地,1959-11-05,1959-11
临汝养猪百日翻一番,1959-11-05,1959-11
国务院欢宴苏联专家负责人,1959-11-05,1959-11
卅五个小型合成氨厂将先在各省建立起来,1959-11-05,1959-11
化工部推广大连小型合成氨厂好经验,1959-11-05,1959-11
摘自中共中央、国务院大搞水肥的指示,1959-11-05,1959-11
为明年农业准备更多更好的肥料,1959-11-05,1959-11
互相学习共同提高,1959-11-05,1959-11
捷报飞向群英会,1959-11-05,1959-11
宁愿麻烦千遍不让顾客不便,1959-11-05,1959-11
摘自中共中央在全国工业、交通、基建、财贸战线群英大会上的祝词,1959-11-05,1959-11
满天星斗,1959-11-05,1959-11
四川一月之间运量猛增一倍,1959-11-05,1959-11
把铁路专用线改作共用线,1959-11-05,1959-11
挖专用线的潜力,1959-11-05,1959-11
七年实现革新项目近七百件,1959-11-05,1959-11
海州露天煤矿  红旗电铲小组五年来月月超产,1959-11-05,1959-11
进行学习总结加强徒工教育,1959-11-05,1959-11
我国制成四吨重的大型轴承,1959-11-05,1959-11
“东方红”到了黑龙江,1959-11-05,1959-11
钢铁的种子,1959-11-05,1959-11
公社引导农民走向共同富裕,1959-11-05,1959-11
万子湖公社渔业丰收粮油自给,1959-11-05,1959-11
桃园堡——穷队赶富队的标兵,1959-11-05,1959-11
迎头赶上,1959-11-05,1959-11
数字与事实,1959-11-05,1959-11
一棵茁壮的新芽,1959-11-05,1959-11
苏联各地党组织大力领导技术革新,1959-11-05,1959-11
中苏友谊之花,1959-11-05,1959-11
越南人民立志走在时间前面,1959-11-05,1959-11
泽登巴尔接见栗再温,1959-11-05,1959-11
巴共代表团和挪共代表团长回国,1959-11-05,1959-11
陈毅副总理接见英国约翰逊教长,1959-11-05,1959-11
苏联芭蕾舞团载誉返京,1959-11-05,1959-11
欢送伊拉克人民代表团,1959-11-05,1959-11
中苏友协代表团赴莫斯科,1959-11-05,1959-11
匈科技合作代表团到京,1959-11-05,1959-11
印度尼西亚副议长卡塔威纳塔到京,1959-11-05,1959-11
匈击剑队同北京队友谊赛,1959-11-05,1959-11
瑞典“尤哥登”足球队同天津队踢平,1959-11-05,1959-11
把大自然的奥秘揭开！,1959-11-05,1959-11
拉丁美洲反美斗争在发展中,1959-11-05,1959-11
巴西接管三家美国肉类冷藏公司,1959-11-05,1959-11
巴拿马爆发反美示威,1959-11-05,1959-11
古巴继续接管美国公司土地,1959-11-05,1959-11
释放苏发努冯维护日内瓦协议,1959-11-05,1959-11
反对英国企图解散柬埔寨国际委员会,1959-11-05,1959-11
萨纳尼空透露将加紧捏造“罪证”迫害苏发努冯,1959-11-05,1959-11
刚果人民继续袭击殖民军,1959-11-05,1959-11
刚果民族运动党,1959-11-05,1959-11
最近的阿根廷政治局势,1959-11-05,1959-11
石桥准备掀起促进日中友好运动 片山哲强调应恢复对华正常关系,1959-11-05,1959-11
国际简讯,1959-11-05,1959-11
冲绳人民抗议美国试验导弹,1959-11-05,1959-11
洛奇的如意算盘,1959-11-05,1959-11
驳所谓“小资产阶级狂热性”的谬论王执生,1959-11-05,1959-11
坚持党对企业的绝对领导,1959-11-05,1959-11
部分公社所有制的巨大意义,1959-11-05,1959-11
爱人和爱物,1959-11-05,1959-11
路遇（外二篇）,1959-11-05,1959-11
再访张百发,1959-11-05,1959-11
学习点表演,1959-11-05,1959-11
可贵的舍己为人精神,1959-11-05,1959-11
瓜果满园,1959-11-05,1959-11
船桅如林,1959-11-05,1959-11
今日天气预报（北京地区）,1959-11-06,1959-11
周总理欢宴众英雄,1959-11-06,1959-11
一亩一头猪  粮畜双丰收,1959-11-06,1959-11
西湖公社每亩有猪一头多,1959-11-06,1959-11
以猪养田  以田养猪,1959-11-06,1959-11
向董必武副主席递交国书,1959-11-06,1959-11
人民公社力挫秋旱,1959-11-06,1959-11
周总理欢宴众英雄,1959-11-06,1959-11
向董必武副主席递交国书,1959-11-06,1959-11
歌颂人类光辉伟大的节日,1959-11-06,1959-11
郭沫若欢宴苏联科学家,1959-11-06,1959-11
保证职工生活好生产好,1959-11-06,1959-11
苏联电影周隆重开幕,1959-11-06,1959-11
中共中央领导人接见河北和新疆两个参观团,1959-11-06,1959-11
秋季中国出口商品交易会交易活跃,1959-11-06,1959-11
首都中苏儿童举行联欢会,1959-11-06,1959-11
苏联国家大剧院芭蕾舞团为群英会代表演出天鹅湖,1959-11-06,1959-11
赞美你，少数民族第一代工人,1959-11-06,1959-11
青菜满园肥猪满圈,1959-11-06,1959-11
安徽提出明年农业增产措施,1959-11-06,1959-11
商品生产基地作用显著,1959-11-06,1959-11
市郊晨曦,1959-11-06,1959-11
简明新闻,1959-11-06,1959-11
种得多种得快种得好,1959-11-06,1959-11
积极举办业余教育,1959-11-06,1959-11
摘自陆定一同志在全国工业、交通、基建、财贸战线群英大会上的讲话,1959-11-06,1959-11
今冬明春掀起学习文化高潮,1959-11-06,1959-11
群众学习积极性普遍提高,1959-11-06,1959-11
宁津创办“三合一”业余学校,1959-11-06,1959-11
努力学习文化知识不断鼓起生产干劲,1959-11-06,1959-11
扫文盲,1959-11-06,1959-11
业余学校建起来,1959-11-06,1959-11
瞎汉变成文化人,1959-11-06,1959-11
民校里头闹呵呵,1959-11-06,1959-11
河南医学院研究果实累累,1959-11-06,1959-11
苏联举国欢腾迎佳节,1959-11-06,1959-11
莫斯科披上节日盛装,1959-11-06,1959-11
兄弟国家人民热烈迎接十月革命节,1959-11-06,1959-11
贝鲁特举行苏联电影周,1959-11-06,1959-11
赞扬苏联贷款帮助经济建设,1959-11-06,1959-11
祝贺苏联人民建设的辉煌成就,1959-11-06,1959-11
情长谊深,1959-11-06,1959-11
社会主义大家庭互助合作共同繁荣,1959-11-06,1959-11
伟大的友谊无私的援助,1959-11-06,1959-11
六年赶过资本主义世界,1959-11-06,1959-11
必须停止美国侵略朝鲜政策,1959-11-06,1959-11
要求释放老挝爱国领袖,1959-11-06,1959-11
巴拿马继续爆发反美示威,1959-11-06,1959-11
美国工人给钢铁大王的打击,1959-11-06,1959-11
卡塞姆发表谈话强调粉碎帝国主义的阴谋,1959-11-06,1959-11
举行挑衅性演习,1959-11-06,1959-11
陆定一副总理接见智利新闻代表团,1959-11-06,1959-11
张奚若宴请卡塔威纳塔,1959-11-06,1959-11
松村谦三返京,1959-11-06,1959-11
我妇女访苏代表团去莫斯科,1959-11-06,1959-11
我教育工会代表团应邀访问苏联,1959-11-06,1959-11
北京队胜瑞典“尤哥登”队,1959-11-06,1959-11
南非巾帼英雄再次举行示威,1959-11-06,1959-11
南非妇女在监狱中坚持斗争,1959-11-06,1959-11
驳“阶级斗争终结论”,1959-11-06,1959-11
真正的人——读报随笔,1959-11-06,1959-11
讨论少数民族历史问题,1959-11-06,1959-11
谒英雄城,1959-11-06,1959-11
早晨,1959-11-06,1959-11
工农合唱东方红（牌子曲）,1959-11-06,1959-11
歌颂新人新时代,1959-11-06,1959-11
脊梁,1959-11-06,1959-11
出席全国工业、交通运输、基本建设、财贸方面社会主义建设先进集体和先进生产者代表大会代表名单,1959-11-06,1959-11
出席全国工业、交通运输、基本建设、财贸方面社会主义建设先进集体和先进生产者代表大会代表名单,1959-11-06,1959-11
出席全国工业、交通运输、基本建设、财贸方面社会主义建设先进集体和先进生产者代表大会代表名单,1959-11-06,1959-11
出席全国工业、交通运输、基本建设、财贸方面社会主义建设先进集体和先进生产者代表大会代表名单,1959-11-06,1959-11
今日天气预报（北京地区）,1959-11-07,1959-11
沿着十月革命的道路从胜利走向更大胜利,1959-11-07,1959-11
向共产主义建设的旗手祝贺,1959-11-07,1959-11
宋庆龄会长向苏联人民致贺,1959-11-07,1959-11
电贺丹共成立四十周年,1959-11-07,1959-11
高举十月革命的红旗胜利前进,1959-11-07,1959-11
十月革命的光辉照耀着我们前进,1959-11-07,1959-11
中苏人民是最亲密的兄弟和战友,1959-11-07,1959-11
苏中两国人民永远团结一致,1959-11-07,1959-11
把农产品收购运动推向新阶段,1959-11-07,1959-11
完成和超额完成农产品收购任务,1959-11-07,1959-11
各路英雄充分交流先进经验,1959-11-07,1959-11
捷生产革新者代表团在京表演技术,1959-11-07,1959-11
山西收购形势空前良好,1959-11-07,1959-11
慢手赶快手  快手赶能手,1959-11-07,1959-11
农村生产路路告捷,1959-11-07,1959-11
一年兴修三个大水库,1959-11-07,1959-11
开展一亩田一头猪竞赛,1959-11-07,1959-11
冬季生产“水”字当先,1959-11-07,1959-11
为一亩田一头猪而战,1959-11-07,1959-11
大风和降温警报,1959-11-07,1959-11
莫斯科举行十月革命节庆祝大会,1959-11-07,1959-11
团结一致为共同事业贡献最大力量,1959-11-07,1959-11
首都各界举行联欢晚会,1959-11-07,1959-11
苏大使会见我党和国家领导人,1959-11-07,1959-11
举国欢庆进步人类的共同节日,1959-11-07,1959-11
朱委员长参观苏联工艺品展览会,1959-11-07,1959-11
周总理接见印苏文协主席巴利加夫妇,1959-11-07,1959-11
中苏友协代表团到达莫斯科,1959-11-07,1959-11
学习列宁的理论遗产,1959-11-07,1959-11
七年计划的雄伟步伐,1959-11-07,1959-11
研究宇宙空间的两年,1959-11-07,1959-11
我们建设着共产主义！,1959-11-07,1959-11
为了共产主义的伟大胜利,1959-11-07,1959-11
苏联人民—共产主义的建设者,1959-11-07,1959-11
苏联对我国机械工业建设的巨大援助,1959-11-07,1959-11
友谊的火花——记苏联专家在武钢炼钢厂,1959-11-07,1959-11
这里是革命的大本营,1959-11-07,1959-11
十月经验,1959-11-07,1959-11
友谊种子鲜花开,1959-11-07,1959-11
向往莫斯科,1959-11-07,1959-11
归来了！义和团的金拳,1959-11-07,1959-11
十月革命的光和热,1959-11-07,1959-11
没有见过面的好朋友,1959-11-07,1959-11
信,1959-11-07,1959-11
农民起义,1959-11-07,1959-11
出席全国工业、交通运输、基本建设、财贸方面社会主义建设先进集体和先进生产者代表大会代表名单,1959-11-07,1959-11
出席全国工业、交通运输、基本建设、财贸方面社会主义建设先进集体和先进生产者代表大会代表名单,1959-11-07,1959-11
英雄岛上的英雄邮电局,1959-11-07,1959-11
工人参加小组管理好得很,1959-11-07,1959-11
大无畏的摄影师,1959-11-07,1959-11
歪风刮不倒永远争上游,1959-11-07,1959-11
萧培俊和“劳模车”,1959-11-07,1959-11
把每滴油脂都榨出来,1959-11-07,1959-11
扎喜洋季西藏人民的好女儿,1959-11-07,1959-11
从鞍山到包头——记老架工陈启荣,1959-11-07,1959-11
群英会内外,1959-11-07,1959-11
今日天气预报（北京地区）,1959-11-08,1959-11
中苏伟大团结牢不可破,1959-11-08,1959-11
高举和平和共产主义的旗帜前进,1959-11-08,1959-11
从苏联今日看自己明天,1959-11-08,1959-11
刘主席接受访匈邀请,1959-11-08,1959-11
契尔沃年科大使的讲话,1959-11-08,1959-11
董必武副主席的讲话,1959-11-08,1959-11
用更多的机械装备工业和农业,1959-11-08,1959-11
冶金英雄冶炼出先进经验三百多条,1959-11-08,1959-11
煤炭工业标兵纷纷“献宝”,1959-11-08,1959-11
把总路线红旗插上每一辆汽车每一艘轮船每一架飞机每一条线路,1959-11-08,1959-11
政协常委会举行扩大会议,1959-11-08,1959-11
全国人民代表大会代表章靳以病逝,1959-11-08,1959-11
十三省群众基本战胜秋旱,1959-11-08,1959-11
工业生产头五天初报喜讯,1959-11-08,1959-11
太行山上航机轮,1959-11-08,1959-11
湖南开展冬种丰产竞赛,1959-11-08,1959-11
水利肥料第一条,1959-11-08,1959-11
治水龙王是社员,1959-11-08,1959-11
兴建岳城水库驯服漳河,1959-11-08,1959-11
地里拣场里拾保证丰产增收,1959-11-08,1959-11
寒潮警报,1959-11-08,1959-11
全体进步人类欢庆十月革命节,1959-11-08,1959-11
保持高度警惕捍卫和平劳动,1959-11-08,1959-11
关于伟大的十月社会主义革命四十二周年,1959-11-08,1959-11
联合国的干涉只会加剧老挝局势,1959-11-08,1959-11
美国谎话的破产,1959-11-08,1959-11
老挝人民继续展开爱国斗争,1959-11-08,1959-11
日本人民坚决反对“安全条约”,1959-11-08,1959-11
岸信介偷运一批美国导弹入境日本人民抗议政府引“蛇”入室,1959-11-08,1959-11
