巴拿马运河上飘扬巴拿马国旗,1959-11-08,1959-11
巴拿马运河区,1959-11-08,1959-11
艾森豪威尔宣布将访问印度等九国,1959-11-08,1959-11
林枫接见加尔多,1959-11-08,1959-11
日本国营铁路工会代表团到北京,1959-11-08,1959-11
苏联舞蹈家参观北京舞蹈学校,1959-11-08,1959-11
两位德国歌唱家回国,1959-11-08,1959-11
中捷女子排球队举行友谊赛,1959-11-08,1959-11
朝鲜政府决定在沪设立总领事馆,1959-11-08,1959-11
伊拉克人民代表团离京回国,1959-11-08,1959-11
印度尼西亚艺术团离穗回国,1959-11-08,1959-11
跨越世纪的飞跃,1959-11-08,1959-11
彝族人民踏上了社会主义大道,1959-11-08,1959-11
凉山人民阔步奔向幸福前程,1959-11-08,1959-11
新兴的城镇,1959-11-08,1959-11
北方大中城市普遍贮存秋菜,1959-11-08,1959-11
怎样贮藏白菜,1959-11-08,1959-11
改良萝卜沟窖好处多,1959-11-08,1959-11
土窖渍酸菜,1959-11-08,1959-11
无梁简易窖,1959-11-08,1959-11
用空房、地下室贮藏白菜,1959-11-08,1959-11
腌咸白菜和晾干白菜,1959-11-08,1959-11
欢乐地回忆兴奋地前瞻,1959-11-08,1959-11
送上学,1959-11-08,1959-11
民族颂,1959-11-08,1959-11
一支生力军,1959-11-08,1959-11
茶山曲,1959-11-08,1959-11
火浣布之谜,1959-11-08,1959-11
引洮河水上山,1959-11-08,1959-11
今日天气预报（北京地区）,1959-11-09,1959-11
全国群英大会胜利闭幕,1959-11-09,1959-11
向党中央、毛主席的致敬电,1959-11-09,1959-11
让先进种子在全国开花结果,1959-11-09,1959-11
摘编自群英会致全国职工书,1959-11-09,1959-11
周总理电贺柬埔寨独立节,1959-11-09,1959-11
一定完成党交给我们的任务  曾山在群英大会上致闭幕词,1959-11-09,1959-11
向新的伟大目标前进,1959-11-09,1959-11
摘自中共中央在全国工业、交通运输、基建、财贸战线群英大会上的祝词,1959-11-09,1959-11
要把支援农业当作最重要职责,1959-11-09,1959-11
争取今后年年都跃进,1959-11-09,1959-11
听党的话，跟毛主席走,1959-11-09,1959-11
全面跃进为国家运送更多物资,1959-11-09,1959-11
提高产量质量增加花色品种,1959-11-09,1959-11
勇往直前,1959-11-09,1959-11
提高技术多产原油支援工农业,1959-11-09,1959-11
用两条腿走路增产化肥农药,1959-11-09,1959-11
地质英雄提出新任务,1959-11-09,1959-11
水利电力先锋人人“献宝”,1959-11-09,1959-11
发扬协作传统实现快速施工,1959-11-09,1959-11
宝坻县60％穷队赶上富队,1959-11-09,1959-11
河南抗旱种麦超额完成计划,1959-11-09,1959-11
江西农民向低产田要高产,1959-11-09,1959-11
猪的经济价值,1959-11-09,1959-11
贵州积极发展集体养猪事业,1959-11-09,1959-11
集体养猪事业在飞跃,1959-11-09,1959-11
抓紧时机掀起冬季养猪高潮,1959-11-09,1959-11
苏联政府举行盛大招待会,1959-11-09,1959-11
从波罗的海滨到太平洋岸二亿苏联人民狂欢庆佳节,1959-11-09,1959-11
十月革命照耀人类解放道路,1959-11-09,1959-11
德头三季工业生产计划超额完成,1959-11-09,1959-11
首都举行友谊联欢会,1959-11-09,1959-11
苏联芭蕾舞团演出古典芭蕾舞剧“吉赛尔”,1959-11-09,1959-11
乌兰巴托举行移交仪式和庆祝集会,1959-11-09,1959-11
波兰作家代表团到京,1959-11-09,1959-11
越南国家银行行长黎日亮去上海等地访问,1959-11-09,1959-11
苏联考察队向南极腹地挺进,1959-11-09,1959-11
新建北极科学站开始工作,1959-11-09,1959-11
“八一”女子排球队以三比二胜捷女子队,1959-11-09,1959-11
我男女乒乓球队赴匈,1959-11-09,1959-11
阔步前进中的煤都库兹巴斯,1959-11-09,1959-11
美国成了众矢之的,1959-11-09,1959-11
野坂号召反对“安全条约”,1959-11-09,1959-11
苏联向各国发出照会,1959-11-09,1959-11
摩首相重申必须撤出外国军队和基地,1959-11-09,1959-11
号召亚非人民纪念“刚果日”,1959-11-09,1959-11
国际简讯,1959-11-09,1959-11
强迫钢铁工人复工,1959-11-09,1959-11
美国经济地位震荡日甚黄金源源外流美元步步下跌,1959-11-09,1959-11
朽木不可雕,1959-11-09,1959-11
山雨欲来的葡萄牙,1959-11-09,1959-11
语录,1959-11-09,1959-11
先进生产者是执行党的总路线的先锋,1959-11-09,1959-11
伟大的时代崇高的风格,1959-11-09,1959-11
人民的英雄——普通劳动者,1959-11-09,1959-11
万紫千红才是春,1959-11-09,1959-11
战斗在列宁的身边,1959-11-09,1959-11
惠女水库的故事,1959-11-09,1959-11
公鸡炮弹,1959-11-09,1959-11
剪窗花,1959-11-09,1959-11
路矿一家,1959-11-09,1959-11
儿童的乐园,1959-11-09,1959-11
工人、工程师、革新家,1959-11-09,1959-11
空中突击手徐柏岭,1959-11-09,1959-11
年轻的钢铁钻井队,1959-11-09,1959-11
两家一本账,1959-11-09,1959-11
活跃在深山密林里,1959-11-09,1959-11
建场三年荒原变乐园,1959-11-09,1959-11
民族花布的诞生,1959-11-09,1959-11
不断前进的中山糖厂,1959-11-09,1959-11
群策群力学习技术提高技术,1959-11-09,1959-11
从家务劳动到社会劳动,1959-11-09,1959-11
科学实践丰富了教学,1959-11-09,1959-11
王进玉——宁夏煤矿建井的红旗,1959-11-09,1959-11
困难当中出英雄,1959-11-09,1959-11
敬老人扶病残,1959-11-09,1959-11
南水北调的先遣队,1959-11-09,1959-11
干劲压海浪鱼鲜庆丰收,1959-11-09,1959-11
老天不帮忙  海盐也丰收,1959-11-09,1959-11
天气预报越来越准,1959-11-09,1959-11
今日天气预报（北京地区）,1959-11-10,1959-11
建议中印武装各退二十公里  两国总理最近期间举行会谈,1959-11-10,1959-11
同英雄们联欢道别,1959-11-10,1959-11
超额完成粮棉征购  妥善安排群众生活,1959-11-10,1959-11
上海工业生产十月超九月,1959-11-10,1959-11
朱委员长接见卡塔威纳塔副议长,1959-11-10,1959-11
周总理会见乌拉圭议会代表团,1959-11-10,1959-11
九百多名财贸英雄经验大交流,1959-11-10,1959-11
哪里需要就到哪里服务,1959-11-10,1959-11
增产更多的农林牧渔产品,1959-11-10,1959-11
女英雄向全国女职工发出倡议,1959-11-10,1959-11
各地短途运输形成高潮,1959-11-10,1959-11
土制硫酸大有可为,1959-11-10,1959-11
兰州炼油厂投入生产,1959-11-10,1959-11
站在克服困难的最前列,1959-11-10,1959-11
为冶金工业全面跃进而奋斗,1959-11-10,1959-11
竞赛成网红旗成林,1959-11-10,1959-11
冶金英雄决心跃登更高峰,1959-11-10,1959-11
数字与事实,1959-11-10,1959-11
简易焦炉红旗谱,1959-11-10,1959-11
小高炉标兵再创新纪录,1959-11-10,1959-11
青海小铜炉一跃再跃,1959-11-10,1959-11
僮族人民的夜明珠,1959-11-10,1959-11
一年成长的土专家,1959-11-10,1959-11
红旗插在阿尔泰高原,1959-11-10,1959-11
跟大转炉并驾齐驱,1959-11-10,1959-11
小轧钢机发挥威力,1959-11-10,1959-11
跨进一九六零年,1959-11-10,1959-11
生产高级耐火材料,1959-11-10,1959-11
小铜矿的一面红旗,1959-11-10,1959-11
小铝厂再次告捷,1959-11-10,1959-11
配合农村生产大力发展农村业余教育,1959-11-10,1959-11
为农业技术改造准备人材,1959-11-10,1959-11
一鼓作气乘胜前进扩大成果,1959-11-10,1959-11
大批白衣战士下乡下厂,1959-11-10,1959-11
民航局一千多人集会纪念  赞扬起义员工的爱国举动,1959-11-10,1959-11
土造自来水厂观水记,1959-11-10,1959-11
农民喝到自来水,1959-11-10,1959-11
关心群众生活,1959-11-10,1959-11
阿尔巴尼亚大力兴修水利,1959-11-10,1959-11
捷谷物单位面积产量显著提高越南今年晚稻生长情况良好,1959-11-10,1959-11
苏联科学为共产主义建设服务,1959-11-10,1959-11
罗许多企业提前完成全年生产计划,1959-11-10,1959-11
我艺术展览会在华沙开幕,1959-11-10,1959-11
主张通过谈判改善匈美关系,1959-11-10,1959-11
德十年成就展览会在京闭幕,1959-11-10,1959-11
锡中友协副主席古纳瓦达纳夫人到京,1959-11-10,1959-11
保加利亚七位艺术家到京,1959-11-10,1959-11
教会当局应对下属犯罪行为负责,1959-11-10,1959-11
为了彻底灭蚊,1959-11-10,1959-11
征服洼地的战斗,1959-11-10,1959-11
“调查报告”反打了美萨集团耳光,1959-11-10,1959-11
美国“自由”真相的再一次暴露,1959-11-10,1959-11
进一步策划干涉行动,1959-11-10,1959-11
号召人民抵制美国的法西斯调查,1959-11-10,1959-11
波多黎各现况,1959-11-10,1959-11
波多黎各,1959-11-10,1959-11
要求调查美国好战分子的阴谋,1959-11-10,1959-11
国际简讯,1959-11-10,1959-11
义正词严为“黎明日报”辩护,1959-11-10,1959-11
巴拿马人民继续示威,1959-11-10,1959-11
失业与饥饿的自由,1959-11-10,1959-11
和人民生活息息相关的展览,1959-11-10,1959-11
历史的真实和艺术的真实,1959-11-10,1959-11
雷电没有停息,1959-11-10,1959-11
珊瑚沙,1959-11-10,1959-11
听英雄们发言,1959-11-10,1959-11
锦上添花,1959-11-10,1959-11
悼念靳以同志,1959-11-10,1959-11
写于悲痛中,1959-11-10,1959-11
公社假日,1959-11-10,1959-11
今日天气预报（北京地区）,1959-11-11,1959-11
“两条腿走路”高速发展养猪,1959-11-11,1959-11
一亩地一头多猪  两亩地一头多牛,1959-11-11,1959-11
城市农村齐动手  无锡生猪繁殖多,1959-11-11,1959-11
养猪大发展,1959-11-11,1959-11
刘主席电贺瑞典国王寿辰,1959-11-11,1959-11
周恩来总理接见松村谦三,1959-11-11,1959-11
英雄临别表雄心,1959-11-11,1959-11
养猪好处多得很,1959-11-11,1959-11
英雄临别表雄心,1959-11-11,1959-11
养猪好处多得很,1959-11-11,1959-11
迈开英雄步伐跨过一九五九年,1959-11-11,1959-11
保证轻工产品价廉物美丰富多彩,1959-11-11,1959-11
加快工程进度不断刷新纪录,1959-11-11,1959-11
湘黔铁路湘娄段铺轨完工,1959-11-11,1959-11
台风消息,1959-11-11,1959-11
一批机械工厂完成全年基建计划,1959-11-11,1959-11
加强设备维修保证安全生产,1959-11-11,1959-11
注意维修保养,1959-11-11,1959-11
人民大会堂建设的胜利,1959-11-11,1959-11
羞得高山云里钻,1959-11-11,1959-11
洋土结合的好设计,1959-11-11,1959-11
代替钢铁的新材料,1959-11-11,1959-11
常年生产砖瓦,1959-11-11,1959-11
两个活鲁班,1959-11-11,1959-11
大型高炉建设速度,1959-11-11,1959-11
冶金工业设计能力,1959-11-11,1959-11
白手起家造水泥,1959-11-11,1959-11
把群众革命热情组织起来,1959-11-11,1959-11
枣阳县冬季生产热气腾腾,1959-11-11,1959-11
新疆大规模开荒造田,1959-11-11,1959-11
垦荒（民歌）,1959-11-11,1959-11
好办法,1959-11-11,1959-11
枣阳县怎样掀起全面生产高潮？,1959-11-11,1959-11
革新生产过程,1959-11-11,1959-11
苏联开展全民增产节约运动,1959-11-11,1959-11
苏联煤铁开采量压倒美国,1959-11-11,1959-11
鼓起更大干劲  实现更高指标匈工人以生产成就向党代会献礼,1959-11-11,1959-11
中匈签订明年科学合作计划,1959-11-11,1959-11
苏联芭蕾舞团在京举行告别演出,1959-11-11,1959-11
保加利亚十五种农作物空前丰收,1959-11-11,1959-11
苏联茶叶丰收,1959-11-11,1959-11
阿尔巴尼亚广大棉农紧张战斗竞赛摘棉,1959-11-11,1959-11
波兰采取措施实现农业发展计划,1959-11-11,1959-11
摩洛哥前首相贝拉弗里杰到京,1959-11-11,1959-11
印苏文协主席巴利加夫妇回国,1959-11-11,1959-11
缅甸文化友好代表团离昆明回国,1959-11-11,1959-11
乌拉圭议会代表团离京赴苏,1959-11-11,1959-11
蒂萨河畔红旗飘,1959-11-11,1959-11
美萨集团的诬蔑全部破产,1959-11-11,1959-11
为反对修改“安全条约”斗争到底,1959-11-11,1959-11
美萨集团造假证据诬蔑越南,1959-11-11,1959-11
要求迫使萨纳尼空停止非法活动,1959-11-11,1959-11
哈马舍尔德去老挝只会使局势更复杂,1959-11-11,1959-11
帝国主义必须滚出非洲,1959-11-11,1959-11
准备年底签订日美新条约,1959-11-11,1959-11
美国卫星第三次失灵,1959-11-11,1959-11
承认“黎明日报”和格列索斯无罪,1959-11-11,1959-11
芝加哥式的强盗逻辑,1959-11-11,1959-11
强盗控告,1959-11-11,1959-11
巴拿马人民反对美国霸占运河区,1959-11-11,1959-11
非洲今昔,1959-11-11,1959-11
既要党的领导又要群众的自觉,1959-11-11,1959-11
驳“大伤元气”论,1959-11-11,1959-11
科学研究硕果累累,1959-11-11,1959-11
衷心地感谢中国朋友们,1959-11-11,1959-11
看“吉赛尔”,1959-11-11,1959-11
街坊,1959-11-11,1959-11
利害篇,1959-11-11,1959-11
翱翔在暴风雨中的海燕,1959-11-11,1959-11
无限好前程,1959-11-11,1959-11
今日天气预报（北京地区）,1959-11-12,1959-11
不断革命精神管好冬麦油菜  安徽  四川  甘肃  力争近亿亩作物十成苗十成收,1959-11-12,1959-11
希望中日友好互不侵犯逐步恢复两国正常关系,1959-11-12,1959-11
加快冬季牲畜繁殖,1959-11-12,1959-11
小焦炉开放大红花,1959-11-12,1959-11
抓紧运输是当前的迫切任务,1959-11-12,1959-11
长途接短途运输不断线,1959-11-12,1959-11
希望中日友好互不侵犯逐步恢复两国正常关系,1959-11-12,1959-11
抓紧运输是当前的迫切任务,1959-11-12,1959-11
百万青工浩浩荡荡跨进1960年,1959-11-12,1959-11
携手齐争高速度,1959-11-12,1959-11
甘肃完成粮食征购计划,1959-11-12,1959-11
民革中央集会纪念孙中山先生诞辰,1959-11-12,1959-11
政协常委会举行扩大会议,1959-11-12,1959-11
林彪贺龙聂荣臻接见群英会的部队代表,1959-11-12,1959-11
群英会代表陆续离京,1959-11-12,1959-11
各地热烈响应群英大会号召  把增产节约运动推向新高峰,1959-11-12,1959-11
没有进口木浆也能生产高级纸张,1959-11-12,1959-11
自制红矾,1959-11-12,1959-11
用煤气烧瓷,1959-11-12,1959-11
深入公社辟乳源,1959-11-12,1959-11
油料、饲料、肥料三结合,1959-11-12,1959-11
当前轻工业的形势和任务,1959-11-12,1959-11
坚强的战斗集体  温暖的家庭,1959-11-12,1959-11
饶埠人民公社工业大放光彩,1959-11-12,1959-11
用机器编竹器,1959-11-12,1959-11
闪烁着共产主义的光辉,1959-11-12,1959-11
巧织女,1959-11-12,1959-11
你知道么？,1959-11-12,1959-11
新产品,1959-11-12,1959-11
阳高“红勤巧”运动有新发展,1959-11-12,1959-11
利用水力代替繁重劳动,1959-11-12,1959-11
磨面又能作针线,1959-11-12,1959-11
一水多用,1959-11-12,1959-11
广西农民省粮三千万斤,1959-11-12,1959-11
上饶专区晚稻增产一倍多,1959-11-12,1959-11
泗阳农场勤俭经营办得出色,1959-11-12,1959-11
用粮有计划,1959-11-12,1959-11
猪多、肥多、粮多,1959-11-12,1959-11
国营友谊农场——机械化农场的典型和学校,1959-11-12,1959-11
越南社会主义改造工作全面铺开,1959-11-12,1959-11
讨论进一步发展农牧业等问题,1959-11-12,1959-11
赫鲁晓夫明年三月访法,1959-11-12,1959-11
丹共庆祝建党四十周年,1959-11-12,1959-11
支持朝鲜人民和平统一祖国,1959-11-12,1959-11
科学研究应密切联系经济发展,1959-11-12,1959-11
捷科学研究工作取得杰出成就  化学方面有近百项居世界前列,1959-11-12,1959-11
波兰国务委员会任命两位部长会议副主席和两位部长,1959-11-12,1959-11
中朝友谊万古长青,1959-11-12,1959-11
欢送苏联国家大剧院芭蕾舞团,1959-11-12,1959-11
突尼斯财政和商业部长接见我参加国际博览会代表团团长,1959-11-12,1959-11
保加利亚五位歌唱家在京举行首次演出,1959-11-12,1959-11
从小工到工程师,1959-11-12,1959-11
苏联“托木斯克人”足球队胜“八一”队,1959-11-12,1959-11
反对修改“安全条约”禁止核武装,1959-11-12,1959-11
一定要收回巴拿马运河,1959-11-12,1959-11
支持日本人民的正义斗争,1959-11-12,1959-11
非洲反帝斗争向前迈进,1959-11-12,1959-11
非洲工会会议筹组全非工联,1959-11-12,1959-11
刚果局势密锣紧鼓,1959-11-12,1959-11
西班牙占领军仍未撤走,1959-11-12,1959-11
乌干达人民示威,1959-11-12,1959-11
南非又爆发示威,1959-11-12,1959-11
美帝国主义在非洲的扩张,1959-11-12,1959-11
歌颂革命的乐观主义,1959-11-12,1959-11
百炼成钢,1959-11-12,1959-11
墨子和孟子看到了商品的均等关系吗？,1959-11-12,1959-11
共产主义的精神,1959-11-12,1959-11
苏联版画的新成就,1959-11-12,1959-11
老树新枝现异彩,1959-11-12,1959-11
种麦有感,1959-11-12,1959-11
百骑大栗树,1959-11-12,1959-11
今日天气预报（北京地区）,1959-11-13,1959-11
粮食征购日增月长,1959-11-13,1959-11
采煤掘进洗煤全面丰收,1959-11-13,1959-11
我外交部通知印度大使准备交还被俘印军人员,1959-11-13,1959-11
北方秋季造林三千万亩,1959-11-13,1959-11
朱委员长接见松村谦三先生,1959-11-13,1959-11
周总理接见喀麦隆人民联盟主席穆米埃,1959-11-13,1959-11
日本愿和中国携手保卫和平,1959-11-13,1959-11
感谢对苏党政代表团的欢迎,1959-11-13,1959-11
开展冬季造林运动,1959-11-13,1959-11
开展冬季造林运动,1959-11-13,1959-11
江西水利战线的一面旗帜,1959-11-13,1959-11
醴陵县晚稻赛过了早稻,1959-11-13,1959-11
细收细打颗粒还家,1959-11-13,1959-11
陕西在高原沙漠区兴修水利,1959-11-13,1959-11
引延河水上山,1959-11-13,1959-11
一旗高举万旗飘,1959-11-13,1959-11
醴陵新民歌,1959-11-13,1959-11
晚稻是怎样高产的,1959-11-13,1959-11
今后的任务,1959-11-13,1959-11
我们的保证,1959-11-13,1959-11
组织短途运输网,1959-11-13,1959-11
数字在歌唱,1959-11-13,1959-11
在技术革新的道路上,1959-11-13,1959-11
在东四邮电局,1959-11-13,1959-11
红旗口,1959-11-13,1959-11
进一步完成西藏民主改革,1959-11-13,1959-11
鼓起干劲千方百计提高教学质量,1959-11-13,1959-11
龙胜大瑶两县走上富裕道路,1959-11-13,1959-11
北京上海纪念孙中山诞辰九十三周年,1959-11-13,1959-11
北京积极开展职工业余文化活动,1959-11-13,1959-11
血肉的友谊,1959-11-13,1959-11
掀起养猪高潮,1959-11-13,1959-11
中日两国应和平共处互相友好,1959-11-13,1959-11
基本建设速度快生产战线添新军,1959-11-13,1959-11
苏联新闻工作者代表大会开幕,1959-11-13,1959-11
欢迎摩洛哥前首相贝拉弗里杰,1959-11-13,1959-11
招待在京苏联友人,1959-11-13,1959-11
保加利亚歌唱家继续在京公演,1959-11-13,1959-11
批判现代资产阶级经济理论,1959-11-13,1959-11
云峰水电站大规模施工 中朝职工展开友谊竞赛,1959-11-13,1959-11
云峰水电站,1959-11-13,1959-11
花园都市的远景,1959-11-13,1959-11
日本愿和中国携手保卫和平,1959-11-13,1959-11
斥美国利用联合国干涉老挝,1959-11-13,1959-11
反对美国把日本拉进原子战略体系,1959-11-13,1959-11
古巴人民捐献飞机保卫祖国,1959-11-13,1959-11
抗议美国对希腊提供原子武器,1959-11-13,1959-11
尼克松竭力进行“冷战”宣传,1959-11-13,1959-11
食言自肥,1959-11-13,1959-11
美“援”是一个真正骗局,1959-11-13,1959-11
美国垄断资本加紧对外扩张,1959-11-13,1959-11
在“慈善”的幌子下,1959-11-13,1959-11
请君入桶,1959-11-13,1959-11
语录,1959-11-13,1959-11
用无产阶级观点看教育质量问题,1959-11-13,1959-11
用正气顶住歪风,1959-11-13,1959-11
意大利著名文化界人士呼吁为保卫民主文化而斗争,1959-11-13,1959-11
墨西哥正在出版马克思主义经典著作,1959-11-13,1959-11
苏联帮助法国建成一座全景电影院,1959-11-13,1959-11
万紫千红,1959-11-13,1959-11
今日天气预报（北京地区）,1959-11-14,1959-11
华漕公社创造养猪八条好经验,1959-11-14,1959-11
给冬季发展养猪备好饲料,1959-11-14,1959-11
水利建设高工效  土制机械显威风,1959-11-14,1959-11
抓紧质量重视安全,1959-11-14,1959-11
看，跃进的步伐何等豪迈！,1959-11-14,1959-11
木材到材和上调计划提前完成,1959-11-14,1959-11
一鼓作气全面完成收购任务,1959-11-14,1959-11
土洋结合增产电力和化工产品,1959-11-14,1959-11
公社能够办好化工厂,1959-11-14,1959-11
上海辽宁增加新电源,1959-11-14,1959-11
王道邦中将在京病逝,1959-11-14,1959-11
英雄们回到工作岗位,1959-11-14,1959-11
山东完成钢和电解铜年计划湖南福建完成全年产铁任务,1959-11-14,1959-11
煤矿生产组织上的革命——四、八交叉作业,1959-11-14,1959-11
和时间比赛,1959-11-14,1959-11
烧红天上云,1959-11-14,1959-11
沿着“从土到洋”的大道前进,1959-11-14,1959-11
百折不回向新技术进军,1959-11-14,1959-11
先进经验——继续跃进的武器,1959-11-14,1959-11
水力采煤,1959-11-14,1959-11
深孔爆破,1959-11-14,1959-11
井下三旗手,1959-11-14,1959-11
山东社办工业为农业服务,1959-11-14,1959-11
公社硫酸厂,1959-11-14,1959-11
辽宁水稻产区普遍增产,1959-11-14,1959-11
四川又出现四个水稻千斤县,1959-11-14,1959-11
南方各省秋茶丰收,1959-11-14,1959-11
孟县生地产量打破历史最高纪录,1959-11-14,1959-11
河北多种经营十月超九月,1959-11-14,1959-11
把黄河故道建成大果园,1959-11-14,1959-11
黄河故道我国果树生产的新基地,1959-11-14,1959-11
树上桔红如火田间稻谷铺金,1959-11-14,1959-11
阿尔巴尼亚劳动竞赛热火朝天,1959-11-14,1959-11
柏林市郊的一个乡村学院,1959-11-14,1959-11
罗马尼亚工农大学数目倍增,1959-11-14,1959-11
就捷克斯洛伐克进一步迅速和全面发展问题,1959-11-14,1959-11
保首座电视中心建成,1959-11-14,1959-11
美蒋矛盾的新发展,1959-11-14,1959-11
中苏友好团体签订合作协定,1959-11-14,1959-11
介绍中国十年来各方面的成就  波兰科学院举行中国问题科学会议,1959-11-14,1959-11
苏联芭蕾舞团离京回国,1959-11-14,1959-11
苏联青年男女篮球队到京,1959-11-14,1959-11
我对外文委和中保友协宴请保加利亚歌唱家,1959-11-14,1959-11
松村谦三离京赴昆明访问,1959-11-14,1959-11
保加利亚两位客人到京,1959-11-14,1959-11
张致祥去保加利亚访问,1959-11-14,1959-11
芬兰政府贸易代表团团长到京,1959-11-14,1959-11
中德音乐家合演名曲,1959-11-14,1959-11
欢送德累斯顿交响乐团,1959-11-14,1959-11
日本各界呼吁紧急阻止修改安全条约,1959-11-14,1959-11
抗议西德在西柏林设立电台,1959-11-14,1959-11
要求立即停止卖国谈判,1959-11-14,1959-11
哈马舍尔德到万象活动,1959-11-14,1959-11
西文的外交动态,1959-11-14,1959-11
西德竭力扩张经济势力,1959-11-14,1959-11
西德的冬天,1959-11-14,1959-11
依靠军事订货和经济扩张刺激生产 西德上半年经济依然不稳定,1959-11-14,1959-11
美国扶植下的西德军火工业,1959-11-14,1959-11
财贸工作的政治观点、生产观点和群众观点问题,1959-11-14,1959-11
预卜可以先知,1959-11-14,1959-11
革命秩序是最正常的秩序,1959-11-14,1959-11
伟大阶级的心声,1959-11-14,1959-11
绿洲红星,1959-11-14,1959-11
阔步前进的版画艺术,1959-11-14,1959-11
出海,1959-11-14,1959-11
铁树开花心想飞,1959-11-14,1959-11
设立“地方报纸动态”栏,1959-11-14,1959-11
表扬先进要全面,1959-11-14,1959-11
关于“包和保”一文的错误,1959-11-14,1959-11
对下乡作家的希望,1959-11-14,1959-11
这句话不是马克思说的,1959-11-14,1959-11
今日天气预报（北京地区）,1959-11-15,1959-11
开展多快好省的高工效施工运动,1959-11-15,1959-11
广丰“十养”十兴旺,1959-11-15,1959-11
加强领导突击采集大力收购积极加工,1959-11-15,1959-11
我方将扣押俘获的印军人员全部交给印度接收人员领回,1959-11-15,1959-11
河南一月完成两亿土石方,1959-11-15,1959-11
周总理接见卡塔威纳塔副议长,1959-11-15,1959-11
内蒙古农村副业生产丰收,1959-11-15,1959-11
泸州化工厂重视安全生产大增,1959-11-15,1959-11
消灭越冬病虫害  保卫明年大丰收,1959-11-15,1959-11
冬治一条虫秋收万粒谷,1959-11-15,1959-11
迅速消灭小麦条锈病,1959-11-15,1959-11
把群英会先进经验迅速传遍全国,1959-11-15,1959-11
福建广西抗旱抢种,1959-11-15,1959-11
预防疾病保证生产继续跃进,1959-11-15,1959-11
重视小革新取得大效果,1959-11-15,1959-11
陇海路改线工程加紧施工,1959-11-15,1959-11
弱台风警报,1959-11-15,1959-11
郭启慧——采购员的榜样,1959-11-15,1959-11
掀起商业工作新的跃进高潮,1959-11-15,1959-11
商品生产扩大公社收入增加,1959-11-15,1959-11
技术革新花一束,1959-11-15,1959-11
心底的话,1959-11-15,1959-11
工商一条心生产采购双跃进,1959-11-15,1959-11
数字在说明着……,1959-11-15,1959-11
郭云声——培养财源的能手,1959-11-15,1959-11
徐培州管粮十年,1959-11-15,1959-11
李美琼——帮助群众勤俭持家,1959-11-15,1959-11
善调百味,1959-11-15,1959-11
多发电  多供电  支援工农业跃进,1959-11-15,1959-11
抚顺发电厂全面跃进,1959-11-15,1959-11
为水利电力事业的继续跃进而奋斗,1959-11-15,1959-11
带电检修创奇迹,1959-11-15,1959-11
老英雄巧破难关,1959-11-15,1959-11
空中能人刘金阶,1959-11-15,1959-11
安全生产十年,1959-11-15,1959-11
突飞猛进的我国电力工业,1959-11-15,1959-11
水利战线标兵多,1959-11-15,1959-11
各国舆论谴责美国利用联合国干涉老挝,1959-11-15,1959-11
“后院”的呼声,1959-11-15,1959-11
哈马舍尔德企图在老挝设常驻代表,1959-11-15,1959-11
古巴不会在威胁和攻击面前后退,1959-11-15,1959-11
巴西总统批评美国政策,1959-11-15,1959-11
美国在南越加紧备战活动,1959-11-15,1959-11
西欧国家首脑外交活动频繁,1959-11-15,1959-11
陶里亚蒂当选意众院外委会副主席,1959-11-15,1959-11
