老挝人民武装自卫斗争日益强大,1959-08-23,1959-08
呼吁全力支持阿尔及利亚斗争,1959-08-23,1959-08
日本的母亲们举行大会,1959-08-23,1959-08
要求制止美国干涉老挝局势,1959-08-23,1959-08
黎巴嫩成立委员会,1959-08-23,1959-08
马格里布,1959-08-23,1959-08
广岛在呼吁,1959-08-23,1959-08
国际简讯,1959-08-23,1959-08
为中央接管喀拉拉邦撑腰,1959-08-23,1959-08
伦敦的“地下世界”,1959-08-23,1959-08
“巴格达条约”易名有感,1959-08-23,1959-08
美国教师爷,1959-08-23,1959-08
发展新疆各民族的社会主义文艺,1959-08-23,1959-08
跨入新时期的新疆文艺,1959-08-23,1959-08
“十二部木卡姆”复活,1959-08-23,1959-08
百花争妍万紫千红,1959-08-23,1959-08
绿洲库尔勒,1959-08-23,1959-08
孔雀河畔建新城,1959-08-23,1959-08
库尔勒绿洲小统计,1959-08-23,1959-08
阿坎山找水小唱,1959-08-23,1959-08
塔里木南沿一县,1959-08-23,1959-08
垦复竹林抚育竹林扩大竹林,1959-08-23,1959-08
竹子和竹林,1959-08-23,1959-08
发展楠竹生产支援建设,1959-08-23,1959-08
竹子是个宝，全身无废料,1959-08-23,1959-08
何仙观公社竹林好本报记者,1959-08-23,1959-08
生长最快的树种,1959-08-23,1959-08
“定”,1959-08-23,1959-08
难忘的友情,1959-08-23,1959-08
边疆花城,1959-08-23,1959-08
我国近年来出版的罗马尼亚文学作品,1959-08-23,1959-08
母爱,1959-08-23,1959-08
渔村傍晚,1959-08-23,1959-08
今日天气预报（北京地区）,1959-08-24,1959-08
四川农村形势无限好生产日日新,1959-08-24,1959-08
天桥商场红旗更鲜艳,1959-08-24,1959-08
弱台风在厦门附近登陆,1959-08-24,1959-08
庆祝罗马尼亚解放十五周年,1959-08-24,1959-08
多收  快收  收好  收足,1959-08-24,1959-08
积极准备，作好棉、麻、烟的收购工作,1959-08-24,1959-08
铁路催马加鞭保证生产跃进,1959-08-24,1959-08
颂促进派,1959-08-24,1959-08
干劲足热气高中旬更比上旬好,1959-08-24,1959-08
洪峰俯首过三门,1959-08-24,1959-08
哪里有旱情哪里就有工匠,1959-08-24,1959-08
把红旗举得更高,1959-08-24,1959-08
天桥商场高举红旗不断前进,1959-08-24,1959-08
白沙公社群情奋发大战八九月,1959-08-24,1959-08
应举生产队阔步前进,1959-08-24,1959-08
善观形势善抓时机,1959-08-24,1959-08
积极准备迎接秋季渔汛,1959-08-24,1959-08
内蒙古农民力争秋季丰产,1959-08-24,1959-08
鹰,1959-08-24,1959-08
布加勒斯特举行盛大阅兵和游行,1959-08-24,1959-08
罗大国民议会授勋,1959-08-24,1959-08
罗马尼亚已成为先进工农业国家,1959-08-24,1959-08
中罗友谊永远欣欣向荣,1959-08-24,1959-08
匈牙利社会主义建设加速前进,1959-08-24,1959-08
朝鲜开城人参丰收在望,1959-08-24,1959-08
苏联将出版卫国战争史,1959-08-24,1959-08
苏联飞行员技术举世无匹,1959-08-24,1959-08
习仲勋副总理接见日本法律界代表团,1959-08-24,1959-08
欢迎尼泊尔佛教代表团,1959-08-24,1959-08
郭沫若接见英皇家学会会长,1959-08-24,1959-08
越南统计考察团回国,1959-08-24,1959-08
飞跃前进中的越南,1959-08-24,1959-08
谴责美国用原子武器武装西德,1959-08-24,1959-08
冷战骑士之像,1959-08-24,1959-08
海地人民的希望,1959-08-24,1959-08
海地,1959-08-24,1959-08
阿公众谴责当局倒行逆施,1959-08-24,1959-08
一致表示要为南越同胞报仇,1959-08-24,1959-08
抗议美吴集团用铡头办法残杀爱国者,1959-08-24,1959-08
美国历年军事费用,1959-08-24,1959-08
美蒋飞机公然出动干涉,1959-08-24,1959-08
是应该取消美国军事基地的时候了,1959-08-24,1959-08
要求释放黎民族战士赫卢,1959-08-24,1959-08
阿尔及利亚解放军加强战斗,1959-08-24,1959-08
国际简讯,1959-08-24,1959-08
抓先进因素鼓后进队干劲,1959-08-24,1959-08
从“一点红”到“点点红”,1959-08-24,1959-08
江西大力开展科学研究活动,1959-08-24,1959-08
旗开得胜,1959-08-24,1959-08
我文化部授予奖章奖状,1959-08-24,1959-08
语言、逻辑、结构和思想教育,1959-08-24,1959-08
从一米四十到两米零二,1959-08-24,1959-08
全运会赛马比赛即将开始,1959-08-24,1959-08
都柳江边的女骑手,1959-08-24,1959-08
关于人民公社家庭小副业的调查,1959-08-24,1959-08
不能抛开政治挂帅,1959-08-24,1959-08
学术文化动态,1959-08-24,1959-08
中国人再不受气了,1959-08-24,1959-08
工人中的曲艺种子,1959-08-24,1959-08
困难像弹簧……,1959-08-24,1959-08
“在松林的后面”,1959-08-24,1959-08
无题有感,1959-08-24,1959-08
到处是课堂,1959-08-24,1959-08
今日天气预报（北京地区）,1959-08-25,1959-08
全国各族人民为实现今年的继续跃进而奋斗！,1959-08-25,1959-08
界牌公社农林牧副渔全面兴旺,1959-08-25,1959-08
转炉炼钢全面跃进红旗飘扬上海,1959-08-25,1959-08
福建沿海受到强台风袭击  受灾地区正全力抗灾救灾,1959-08-25,1959-08
我提出第63次严重警告,1959-08-25,1959-08
轧钢对口赛摆开战场,1959-08-25,1959-08
多造新车增加运力,1959-08-25,1959-08
吃好睡好干劲更高,1959-08-25,1959-08
加速生产货车,1959-08-25,1959-08
食谱下车间,1959-08-25,1959-08
助干劲,1959-08-25,1959-08
飞翔吧  上海机床厂,1959-08-25,1959-08
上下游互助互让战胜旱灾,1959-08-25,1959-08
形势无限好  领导更加强,1959-08-25,1959-08
根扎得正,1959-08-25,1959-08
定叫晚稻超早稻,1959-08-25,1959-08
浙江江苏大战晚稻病虫害,1959-08-25,1959-08
黑龙江副食品生产成绩大,1959-08-25,1959-08
简明新闻,1959-08-25,1959-08
阳光和阴影,1959-08-25,1959-08
两种社会  两样结果,1959-08-25,1959-08
学习加干诺娃榜样帮助落后共同前进,1959-08-25,1959-08
兄弟般互助加速保加利亚经济发展,1959-08-25,1959-08
越南北方劳动人民生活改善,1959-08-25,1959-08
布加勒斯特举行盛大宴会,1959-08-25,1959-08
罗科学家设计建造电子回旋加速器运转,1959-08-25,1959-08
阿发展淡水养鱼业,1959-08-25,1959-08
朝鲜地方工业生产能力日增,1959-08-25,1959-08
委内瑞拉五位人士到京,1959-08-25,1959-08
中国方面射击比赛在京开幕,1959-08-25,1959-08
非洲两位青年运动负责人应邀到我国访问,1959-08-25,1959-08
几内亚妇女代表团到京,1959-08-25,1959-08
苏联田径队再胜西德队,1959-08-25,1959-08
协助旅泰越侨返回越南,1959-08-25,1959-08
和越南大学师生相处的日子,1959-08-25,1959-08
美国罢工浪潮汹涌澎湃,1959-08-25,1959-08
巨掌,1959-08-25,1959-08
美国农民日趋贫困,1959-08-25,1959-08
支持美国钢铁工人罢工,1959-08-25,1959-08
号召全力支持古巴革命,1959-08-25,1959-08
日本母亲们反对修改“安全条约”,1959-08-25,1959-08
南非各地非洲人奋起反抗,1959-08-25,1959-08
拥护苏加诺的国庆演说,1959-08-25,1959-08
纳苏蒂安掌管国家安全的一切事务,1959-08-25,1959-08
国际简讯,1959-08-25,1959-08
法国和意大利工人运动的新高涨,1959-08-25,1959-08
一个美国失业者的遭遇,1959-08-25,1959-08
个个党员都做思想工作,1959-08-25,1959-08
人定胜天,1959-08-25,1959-08
落后赶先进  先进更先进,1959-08-25,1959-08
领导干部猛攻科学关,1959-08-25,1959-08
建云工厂卫生工作经常化,1959-08-25,1959-08
在夜大学四年,1959-08-25,1959-08
学习政策干劲倍增,1959-08-25,1959-08
盛夏的工人食堂,1959-08-25,1959-08
全运会赛艇竞赛开幕,1959-08-25,1959-08
赛艇,1959-08-25,1959-08
又创三项全国最高成绩,1959-08-25,1959-08
谈全军文艺会演中的歌剧,1959-08-25,1959-08
读徐悲鸿的一封信,1959-08-25,1959-08
徐悲鸿给刘勃舒的信,1959-08-25,1959-08
笔墨当随时代,1959-08-25,1959-08
“不能”和“不为”,1959-08-25,1959-08
一次愉快的艺术享受,1959-08-25,1959-08
浓艳和清淡,1959-08-25,1959-08
高血压,1959-08-25,1959-08
修筑长堤,1959-08-25,1959-08
今日天气预报（北京地区）,1959-08-26,1959-08
千万水利工程迸发出抗灾威力,1959-08-26,1959-08
提前一个季度完成全年降低成本任务,1959-08-26,1959-08
鞍钢四十多个厂矿领导干部  深入现场扎扎实实指挥生产,1959-08-26,1959-08
安徽早稻庆丰收,1959-08-26,1959-08
胡志明主席离北京回国,1959-08-26,1959-08
印渚公社力变山畈为良田  早稻总产量陡增七成以上,1959-08-26,1959-08
我提出第64次严重警告,1959-08-26,1959-08
克拉玛依展开夺油大战,1959-08-26,1959-08
武汉兴建电解铝厂,1959-08-26,1959-08
大同矿增产节约运动深入一步,1959-08-26,1959-08
今日克拉玛依,1959-08-26,1959-08
到炉边去到井下去,1959-08-26,1959-08
干劲鼓足了生产就能跃进,1959-08-26,1959-08
油海新歌,1959-08-26,1959-08
四川万名漆工上山割漆,1959-08-26,1959-08
生漆,1959-08-26,1959-08
毛坝出名漆,1959-08-26,1959-08
迎接秋收准备秋种,1959-08-26,1959-08
泗阳、东台开始收摘棉花,1959-08-26,1959-08
争取多结霜前花,1959-08-26,1959-08
再加措施保晚稻块块增产,1959-08-26,1959-08
痛歼棉花虫害,1959-08-26,1959-08
柞蚕业，跃进再跃进！,1959-08-26,1959-08
引长江水入太湖补足水源,1959-08-26,1959-08
一社有困难全县来支援,1959-08-26,1959-08
战胜鸟兽虫害力争柞蚕丰收,1959-08-26,1959-08
柞蚕,1959-08-26,1959-08
捷展开群众运动节约投资加快建设速度,1959-08-26,1959-08
强硬抗议西德在边境寻衅,1959-08-26,1959-08
中朝签订黄海渔业协定,1959-08-26,1959-08
今秋来比锡博览会意义大,1959-08-26,1959-08
设宴欢迎委内瑞拉友人,1959-08-26,1959-08
当代最大的百科全书,1959-08-26,1959-08
中国方面比赛全部结束,1959-08-26,1959-08
古巴等国八位青年代表到京,1959-08-26,1959-08
苏联帮助亚非国家发展经济,1959-08-26,1959-08
“少年宫”图书馆,1959-08-26,1959-08
深山中的开路先锋,1959-08-26,1959-08
痛斥美萨集团含血喷人,1959-08-26,1959-08
向美国钢铁工人致敬！,1959-08-26,1959-08
扩大对老挝局势的干涉,1959-08-26,1959-08
风向不利,1959-08-26,1959-08
我全总致电表示热烈祝贺,1959-08-26,1959-08
必须恢复赫卢的自由,1959-08-26,1959-08
援救黎共领袖赫卢,1959-08-26,1959-08
赫卢同志,1959-08-26,1959-08
抗议警察当局杀害罢工工人,1959-08-26,1959-08
呼吁全体劳工团结抵制反劳工法,1959-08-26,1959-08
阴谋迫害西共领导人蒙特罗,1959-08-26,1959-08
罗加号召加速土改回击敌人,1959-08-26,1959-08
国际简讯,1959-08-26,1959-08
死亡鼓吹者,1959-08-26,1959-08
对比今昔宣传公社优越性,1959-08-26,1959-08
陕西防治大骨节病有良方,1959-08-26,1959-08
福建省科学技术委员会成立,1959-08-26,1959-08
干劲和困难的消长,1959-08-26,1959-08
赛艇竞赛创成批优异成绩,1959-08-26,1959-08
一场争辩打破定命论,1959-08-26,1959-08
全运会球类比赛将有激烈争夺战,1959-08-26,1959-08
党委书记张振武,1959-08-26,1959-08
夸老张,1959-08-26,1959-08
足球决赛：九月一日开幕,1959-08-26,1959-08
关于人民公社若干问题的决议,1959-08-26,1959-08
闲时多学忙时少学,1959-08-26,1959-08
结合生产办好农民业余教育,1959-08-26,1959-08
学文化分秒必争,1959-08-26,1959-08
一百分,1959-08-26,1959-08
豆子的秘密,1959-08-26,1959-08
积极领导巧妙安排,1959-08-26,1959-08
蒸蒸日上,1959-08-26,1959-08
公社儿歌,1959-08-26,1959-08
山南山北,1959-08-26,1959-08
赶会记,1959-08-26,1959-08
红,1959-08-26,1959-08
听黄顺经独奏会,1959-08-26,1959-08
山区运输,1959-08-26,1959-08
今日天气预报（北京地区）,1959-08-27,1959-08
今年完成第二个五年计划主要指标,1959-08-27,1959-08
关于开展增产节约运动的决议,1959-08-27,1959-08
关于开展增产节约运动的决议,1959-08-27,1959-08
反右倾，鼓干劲，为在今年完成第二个五年计划的主要指标而斗争,1959-08-27,1959-08
调整今年经济计划的主要指标  号召进一步开展增产节约运动,1959-08-27,1959-08
国家统计局关于修订1958年农业统计数字的公报,1959-08-27,1959-08
摘自“中国共产党八届八中全会关于开展增产节约运动的决议”,1959-08-27,1959-08
鞍钢职工干劲越鼓越足,1959-08-27,1959-08
无锡二百多工厂大闹对口赛,1959-08-27,1959-08
立跃进思想抓跃进措施,1959-08-27,1959-08
群众运动万岁！,1959-08-27,1959-08
风驰电掣一年间,1959-08-27,1959-08
摘自“中国共产党八届八中全会关于开展增产节约运动的决议”,1959-08-27,1959-08
欢欢喜喜庆春麦丰收  乘胜前进争秋季超产,1959-08-27,1959-08
人民公社常葆美妙青春,1959-08-27,1959-08
可喜的消息,1959-08-27,1959-08
稻香千里喜丰收,1959-08-27,1959-08
苏联全面加速共产主义建设,1959-08-27,1959-08
波兰工矿企业讨论新五年计划,1959-08-27,1959-08
朝鲜增设技术学校,1959-08-27,1959-08
社会主义国家工业高速发展,1959-08-27,1959-08
匈劳动人民决心超额增产,1959-08-27,1959-08
提出大量增产节约建议,1959-08-27,1959-08
越南北方人民生产热潮日日高,1959-08-27,1959-08
胡志明主席回到河内,1959-08-27,1959-08
我人大代表团赴蒙访问,1959-08-27,1959-08
欢送日本法律界代表,1959-08-27,1959-08
帮助较差单位完成锻炼指标,1959-08-27,1959-08
英国多数职业足球运动员生活很苦,1959-08-27,1959-08
艾森豪威尔赴西欧弥补裂痕,1959-08-27,1959-08
美国黄金继续外流储备亏空,1959-08-27,1959-08
英国重要工业部门景况暗淡,1959-08-27,1959-08
美国生活费用空前高涨,1959-08-27,1959-08
法国明年财政赤字仍将达六千亿法郎,1959-08-27,1959-08
苏联主张禁止细菌和化学武器,1959-08-27,1959-08
丹共中央举行全会,1959-08-27,1959-08
必须立即释放赫卢,1959-08-27,1959-08
制止美萨集团破坏日内瓦协议,1959-08-27,1959-08
美国策划扩充老挝王国军队,1959-08-27,1959-08
粉碎“安全条约”成为中心问题,1959-08-27,1959-08
各国公众要求释放赫卢！,1959-08-27,1959-08
国际简讯,1959-08-27,1959-08
伊拉克处决六名摩苏尔叛乱分子,1959-08-27,1959-08
就经济问题作出三项决定,1959-08-27,1959-08
美国给阿联一笔贷款,1959-08-27,1959-08
向人民解释部分钞票贬值的决定,1959-08-27,1959-08
用打击敌人的劲头征服自然灾害,1959-08-27,1959-08
大力提倡  重点推行  逐步普及,1959-08-27,1959-08
莒口大队托儿组织又多又好,1959-08-27,1959-08
好得很,1959-08-27,1959-08
华侨教师争夸人民公社好,1959-08-27,1959-08
在第二次全国普通话教学成绩观摩会上的讲话,1959-08-27,1959-08
炉前“表演”记,1959-08-27,1959-08
“思想对头炉子顺”,1959-08-27,1959-08
矿山生活,1959-08-27,1959-08
鼓劲篇,1959-08-27,1959-08
工农弟兄笑开颜,1959-08-27,1959-08
特种工艺师（外一首）,1959-08-27,1959-08
女焊工,1959-08-27,1959-08
钻研,1959-08-27,1959-08
今日天气预报（北京地区）,1959-08-28,1959-08
坚持总路线、大跃进、人民公社的光荣旗帜 鼓干劲、反右倾、完成和超额完成今年经济计划,1959-08-28,1959-08
八大城市人民争擂战鼓猛勇上阵,1959-08-28,1959-08
全国工人打先锋,1959-08-28,1959-08
摘自“中国共产党八届八中全会关于开展增产节约运动的决议”,1959-08-28,1959-08
摘自“中国共产党八届八中全会关于开展增产节约运动的决议”,1959-08-28,1959-08
八大城市人民争擂战鼓猛勇上阵,1959-08-28,1959-08
陈正人任农业机械部长,1959-08-28,1959-08
沿着八中全会所指出的道路奋勇前进,1959-08-28,1959-08
有眼不识泰山,1959-08-28,1959-08
小高炉立下汗马功劳,1959-08-28,1959-08
谁说“得不偿失”？,1959-08-28,1959-08
沸腾的矿山,1959-08-28,1959-08
党发出了动员会，同志们，前进！,1959-08-28,1959-08
坡胡公社镇服旱魔万亩玉米大丰收,1959-08-28,1959-08
人民公社带来巨大变化  延安专区低产变成粮仓,1959-08-28,1959-08
加强后期管理争取多结秋桃,1959-08-28,1959-08
摘自“中国共产党八届八中全会关于开展增产节约运动的决议”,1959-08-28,1959-08
山东大部地区解除旱象,1959-08-28,1959-08
宜章群众五次猛攻病虫害,1959-08-28,1959-08
“虎口”夺粮记,1959-08-28,1959-08
飞机杀虫（木刻）,1959-08-28,1959-08
社会主义国家经济合作日益加强,1959-08-28,1959-08
苏波德捷匈五国合建大油管,1959-08-28,1959-08
越南上半年经济建设进展显著,1959-08-28,1959-08
苏联报纸全文刊载,1959-08-28,1959-08
苏联医学新成就,1959-08-28,1959-08
我国政府代表团启程,1959-08-28,1959-08
电贺日中友协全国大会,1959-08-28,1959-08
鲜明的对比,1959-08-28,1959-08
山谷里的明珠,1959-08-28,1959-08
民族独立运动和人民民主运动日益发展,1959-08-28,1959-08
彻底消灭殖民主义,1959-08-28,1959-08
赫鲁晓夫劝阿登纳放弃复仇梦想,1959-08-28,1959-08
西班牙共产党的政策光明磊落  坚决争取国家独立和人民自由,1959-08-28,1959-08
抗议迫害赫卢,1959-08-28,1959-08
阿富汗严守中立政策,1959-08-28,1959-08
美钢铁和汽车工业开工不足,1959-08-28,1959-08
英国削减纺织业生产,1959-08-28,1959-08
美国公然向老挝当局提供军火和金钱,1959-08-28,1959-08
苏加诺发表广播谈话,1959-08-28,1959-08
日本工业设备过剩情况严重,1959-08-28,1959-08
法国纺织业危机重重,1959-08-28,1959-08
印度粮食价格猛涨,1959-08-28,1959-08
艾森豪威尔出巡西欧,1959-08-28,1959-08
用总路线精神武装青年,1959-08-28,1959-08
昂首阔步投入增产节约洪流,1959-08-28,1959-08
充分发挥共青团基层组织的核心作用,1959-08-28,1959-08
全运会赛艇决赛结束,1959-08-28,1959-08
你帮我我帮你协作抗旱,1959-08-28,1959-08
共产主义之水,1959-08-28,1959-08
风雨线上的共产党员,1959-08-28,1959-08
喜讯，又一个喜讯！,1959-08-28,1959-08
在大跃进的旗帜下〔东北三省美术展览会作品〕,1959-08-28,1959-08
热,1959-08-28,1959-08
两面红旗炉顶飘,1959-08-28,1959-08
在巨浪面前,1959-08-28,1959-08
矿工的誓言四川中梁山北矿,1959-08-28,1959-08
六亿人民的志气,1959-08-28,1959-08
无题有感,1959-08-28,1959-08
一日跨千里,1959-08-28,1959-08
今日天气预报（北京地区）,1959-08-29,1959-08
关于调整一九五九年国民经济计划主要指标和进一步开展增产节约运动的报告,1959-08-29,1959-08
人民公社万岁,1959-08-29,1959-08
关于调整一九五九年国民经济计划主要指标和进一步开展增产节约运动的报告,1959-08-29,1959-08
人民公社万岁,1959-08-29,1959-08
人民公社健全发展稳如泰山,1959-08-29,1959-08
京郊百万社员欢呼公社一周年,1959-08-29,1959-08
蒙古政府代表团抵京,1959-08-29,1959-08
一年和五年,1959-08-29,1959-08
坚决拥护中共八届八中全会决议,1959-08-29,1959-08
誓做跃进突击手,1959-08-29,1959-08
齐心加快步伐奔向锦绣前程,1959-08-29,1959-08
晦气的乌鸦,1959-08-29,1959-08
应举公社百业兴旺,1959-08-29,1959-08
摘自“中共中央关于在农村建立人民公社问题的决议”,1959-08-29,1959-08
辽宁社办工业根深叶茂,1959-08-29,1959-08
崖底新庄办了一个好食堂,1959-08-29,1959-08
高级社办不到的事今天办到了,1959-08-29,1959-08
牧归（刻纸）,1959-08-29,1959-08
八月奏凯歌九月夺大胜,1959-08-29,1959-08
用战斗精神发展水力采煤,1959-08-29,1959-08
摘自“中国共产党八届八中全会关于开展增产节约运动的决议”,1959-08-29,1959-08
水力采煤的职工们积极行动起来,1959-08-29,1959-08
钢铁战士响应号召阔步前进,1959-08-29,1959-08
一天的开始,1959-08-29,1959-08
苏联集体农庄规模扩大威力倍增,1959-08-29,1959-08
阿尔巴尼亚农业机器激增,1959-08-29,1959-08
合作化是幸福源泉,1959-08-29,1959-08
农业合作化的果实,1959-08-29,1959-08
德农业合作化运动继续开展,1959-08-29,1959-08
中蒙两国人民兄弟友谊进一步加强,1959-08-29,1959-08
中国人民在胜利基础上继续跃进,1959-08-29,1959-08
赫鲁晓夫访美后不再访加拿大,1959-08-29,1959-08
刊登中共八中全会文件,1959-08-29,1959-08
帝国主义者又大哓毒舌,1959-08-29,1959-08
国外反动派大肆造谣污蔑,1959-08-29,1959-08
马不停蹄,1959-08-29,1959-08
曾经沧海,1959-08-29,1959-08
水流归大海,1959-08-29,1959-08
谁像太阳谁似蜜？,1959-08-29,1959-08
八月的公社,1959-08-29,1959-08
公社饲养场,1959-08-29,1959-08
今日天气预报（北京地区）,1959-08-30,1959-08
马克思主义者应当如何对待革命的群众运,1959-08-30,1959-08
建明人民公社树立了光辉榜样,1959-08-30,1959-08
蒙古政府代表团离京赴越南,1959-08-30,1959-08
强台风紧急警报,1959-08-30,1959-08
马克思主义者应当如何对待革命的群众运,1959-08-30,1959-08
决心沿着总路线向前跃进,1959-08-30,1959-08
解放军官兵响应党的伟大号召,1959-08-30,1959-08
党的决议鼓起群众浑身干劲,1959-08-30,1959-08
妇女要站在增产节约前列,1959-08-30,1959-08
动员青年进一步发挥突击作用,1959-08-30,1959-08
钢都八月钢材大丰收,1959-08-30,1959-08
苏长福再创行车新纪录  五十万公里安全无大修,1959-08-30,1959-08
公路运输线上的标兵,1959-08-30,1959-08
在八中全会公报的鼓舞下,1959-08-30,1959-08
高举总路线的光荣旗帜奋勇前进,1959-08-30,1959-08
运用大跃进经验继续跃进,1959-08-30,1959-08
桃林公社深入贯彻群众路线,1959-08-30,1959-08
树立榜样现场观摩,1959-08-30,1959-08
坚持勤俭办社的方针,1959-08-30,1959-08
万能的钥匙——试验田,1959-08-30,1959-08
中国人民的伟大胜利,1959-08-30,1959-08
预祝中国人民提前完成第二个五年计划,1959-08-30,1959-08
朝、蒙、罗、保报纸刊登中共八中全会文件,1959-08-30,1959-08
立即制止美国干涉老挝的行动,1959-08-30,1959-08
美国火上加油扩大老挝内战,1959-08-30,1959-08
愿同美英签订停止核试验协定,1959-08-30,1959-08
扎霞迪科欢宴我政府代表团,1959-08-30,1959-08
我人大代表团会见蒙古大人民呼拉尔常委会委员,1959-08-30,1959-08
波兰驻华大使奉调回国,1959-08-30,1959-08
柬国王拒绝西哈努克首相辞职,1959-08-30,1959-08
提出当前党的重大任务,1959-08-30,1959-08
不许迫害蒙特罗,1959-08-30,1959-08
“右倾顽症”和治疗的“药方”,1959-08-30,1959-08
“否定一切”的否定,1959-08-30,1959-08
全运会筹备工作就绪,1959-08-30,1959-08
全运会马球赛在呼和浩特举行,1959-08-30,1959-08
马球运动,1959-08-30,1959-08
上海男女队得分第一,1959-08-30,1959-08
勇敢者的运动,1959-08-30,1959-08
伟大的创造世界历史的行动,1959-08-30,1959-08
颂歌,1959-08-30,1959-08
宁夏川上的珍珠,1959-08-30,1959-08
是控诉，也是战斗！,1959-08-30,1959-08
做农民的知心朋友,1959-08-30,1959-08
河水让路,1959-08-30,1959-08
今日天气预报（北京地区）,1959-08-31,1959-08
钢都向全国钢铁战线下战表,1959-08-31,1959-08
京津两百多工厂提前跨过八月,1959-08-31,1959-08
开展超产竞赛  确保粮棉丰收,1959-08-31,1959-08
红光公社红光四射,1959-08-31,1959-08
包钢第一座热风炉开始烘炉,1959-08-31,1959-08
新建唐山铝厂投入生产,1959-08-31,1959-08
上海工人鼓足干劲往前赶,1959-08-31,1959-08
开滦六万矿工誓师夺煤,1959-08-31,1959-08
海河两岸逐浪高,1959-08-31,1959-08
千万厂矿平地起  大好河山添新姿,1959-08-31,1959-08
宁夏完成全年羊只增殖计划,1959-08-31,1959-08
横道河公社五业并茂,1959-08-31,1959-08
龙潭公社大搞渔业生产,1959-08-31,1959-08
苗岭深山的红旗林场,1959-08-31,1959-08
决心每公顷地多收五百斤粮,1959-08-31,1959-08
大战四十天捕鱼十一万担,1959-08-31,1959-08
争取晚田作物超产四成,1959-08-31,1959-08
用辉煌的成就迎接国庆,1959-08-31,1959-08
加强田间管理实现晚稻亩产七百斤,1959-08-31,1959-08
多种经济欣欣向荣,1959-08-31,1959-08
工人誓师比武农民斗志昂扬,1959-08-31,1959-08
高举总路线的红旗前进,1959-08-31,1959-08
文艺工作者争做跃进号手,1959-08-31,1959-08
广大群众奋勇抢险,1959-08-31,1959-08
坚决实现科学工作大跃进,1959-08-31,1959-08
国家体委召开誓师大会,1959-08-31,1959-08
喜讯传到包钢工地,1959-08-31,1959-08
改组工业管理迅速发展生产,1959-08-31,1959-08
中国人民在大跃进基础上再跃进,1959-08-31,1959-08
祝贺中国社会主义建设的伟大胜利,1959-08-31,1959-08
我人大代表团参观“蒙中友谊合作社”,1959-08-31,1959-08
中国人民在建设社会主义的道路上继续跃进,1959-08-31,1959-08
蒙古党政代表团到达河内,1959-08-31,1959-08
郭沫若设宴招待奥地利和平代表团,1959-08-31,1959-08
穆祥雄又破世界百米纪录,1959-08-31,1959-08
全运会前看游泳,1959-08-31,1959-08
赛马和障碍赛马,1959-08-31,1959-08
崇秀云,1959-08-31,1959-08
制止美国扩大  老挝内战的罪行,1959-08-31,1959-08
谴责美国扩大老挝内战,1959-08-31,1959-08
号召用罢工来阻止修改“安全条约”,1959-08-31,1959-08
日中友协第九次全国大会开幕,1959-08-31,1959-08
苏发努冯夫人提出抗议,1959-08-31,1959-08
日本同匈牙利恢复两国外交关系,1959-08-31,1959-08
要求停止迫害和平战士,1959-08-31,1959-08
要求释放赫卢的斗争在扩大,1959-08-31,1959-08
多米尼加反独裁武装广泛出击,1959-08-31,1959-08
艾森豪威尔仆仆于西欧之途,1959-08-31,1959-08
美国农业危机日益严重,1959-08-31,1959-08
意大利佃农日益贫困,1959-08-31,1959-08
法农业工人处境恶劣,1959-08-31,1959-08
国际简讯,1959-08-31,1959-08
两种社会制度两种鲜明对照的经济现象,1959-08-31,1959-08
