布尔吉巴表示突尼斯明年和苏联建交,1959-11-15,1959-11
西德政府仍想阻挠局势缓和,1959-11-15,1959-11
八十天后不能取得协议就再罢工,1959-11-15,1959-11
艾森豪威尔问钢铁垄断资本：干得好吗？,1959-11-15,1959-11
钢铁罢工沉重打击了资本家,1959-11-15,1959-11
目前英国经济情况,1959-11-15,1959-11
加快生产速度争取提前完成年度计划！,1959-11-15,1959-11
踊跃储蓄  利国利己,1959-11-15,1959-11
为争取共产主义胜利而斗争,1959-11-15,1959-11
抗议西德飞机侵犯领空,1959-11-15,1959-11
纳利夫金率苏联代表团抵京,1959-11-15,1959-11
德累斯顿交响乐团回国,1959-11-15,1959-11
赫鲁晓夫接见日夫科夫,1959-11-15,1959-11
赫鲁晓夫接见美驻苏大使,1959-11-15,1959-11
中苏青年篮球队友谊赛,1959-11-15,1959-11
苏联芭蕾舞蹈团部分演员在蒙古演出,1959-11-15,1959-11
巴基斯坦医师阿齐兹·汗等到京,1959-11-15,1959-11
参加澳新国际合作会议我代表团到墨尔本,1959-11-15,1959-11
荷兰新任代办到京,1959-11-15,1959-11
“傲霜花艳岭南枝”,1959-11-15,1959-11
一次深刻的共产主义教育,1959-11-15,1959-11
歌颂革命英雄的诗章,1959-11-15,1959-11
青年们热爱“老战”,1959-11-15,1959-11
再努一把力，再使劲跳一跳！,1959-11-15,1959-11
夜渡,1959-11-15,1959-11
美与丑,1959-11-15,1959-11
“宽打脚，不怕堕”,1959-11-15,1959-11
丰富多采的话剧舞台,1959-11-15,1959-11
重庆笺谱,1959-11-15,1959-11
全年工业总产值九成到手,1959-11-16,1959-11
重庆人人动手菜肉自给,1959-11-16,1959-11
城市副食品生产的榜样,1959-11-16,1959-11
撒遍安全网生产旬旬红 宁夏煤矿开展鸣放辩论,1959-11-16,1959-11
今日天气预报（北京地区）,1959-11-16,1959-11
无产阶级世界观和资产阶级世界观的斗争,1959-11-16,1959-11
党的群众路线在发展副食品生产上的胜利,1959-11-16,1959-11
瓜菜连片猪鸡兴旺,1959-11-16,1959-11
现场促进会巧破生产关键,1959-11-16,1959-11
抓中小企业  抓土法生产  加速增产急需的工业产品,1959-11-16,1959-11
促进有方,1959-11-16,1959-11
河南全省实现商品直线运输,1959-11-16,1959-11
河南开展商品直线运输的经验,1959-11-16,1959-11
液力传动内燃机车在青岛诞生,1959-11-16,1959-11
江油水泥厂投入生产,1959-11-16,1959-11
朝霞红遍武汉天,1959-11-16,1959-11
大家畜小家禽齐兴旺,1959-11-16,1959-11
贵州四川公社化后家禽发展快,1959-11-16,1959-11
大兴水利必须政治挂帅,1959-11-16,1959-11
及时为明年选留良种,1959-11-16,1959-11
一粒良种万粒谷,1959-11-16,1959-11
既是“造肥厂”又是“聚宝盆”,1959-11-16,1959-11
掀起劳动竞赛热潮争取今年生产大捷,1959-11-16,1959-11
苏联将发表月球背面详图,1959-11-16,1959-11
人类可能在本世纪到达月球,1959-11-16,1959-11
聂荣臻、郭沫若和李四光接见参加我地层会议的苏联代表团,1959-11-16,1959-11
捷交响乐团来我国访问演出,1959-11-16,1959-11
喀麦隆人民联盟主席穆米埃离京去莫斯科,1959-11-16,1959-11
兄弟国家经济合作进一步加强,1959-11-16,1959-11
中苏篮球足球精采友谊赛,1959-11-16,1959-11
北京足球队3比○胜“托木斯克人”队,1959-11-16,1959-11
全国冬季田径运动会揭幕,1959-11-16,1959-11
印度—巴基斯坦关于解决两国东部边界问题的联合公报和“基本条规”,1959-11-16,1959-11
妖魔鬼怪吓不倒古巴,1959-11-16,1959-11
美国政府成立专门机构,1959-11-16,1959-11
阿联同美国订协定输入美国农产品,1959-11-16,1959-11
“中央条约组织”加紧策划反伊阴谋,1959-11-16,1959-11
美国“后院”反美浪潮汹涌,1959-11-16,1959-11
美国在南朝鲜加强火箭基地,1959-11-16,1959-11
美国统治集团的要人接连发出冷战叫嚣,1959-11-16,1959-11
怯尼亚两万铁路工人罢工,1959-11-16,1959-11
阿根廷工人运动的发展,1959-11-16,1959-11
论社会主义成长为共产主义的规律性,1959-11-16,1959-11
要看对谁有利？,1959-11-16,1959-11
神经衰弱的新疗法,1959-11-16,1959-11
抗寒葡萄的新品种,1959-11-16,1959-11
家鱼繁殖的新途径,1959-11-16,1959-11
上海颂,1959-11-16,1959-11
上海城隍庙,1959-11-16,1959-11
曹家渡畔 （国画）,1959-11-16,1959-11
什么“感情”？谁的感情？,1959-11-16,1959-11
学派的剪影,1959-11-16,1959-11
给祖国的歌,1959-11-16,1959-11
水利施工的革命创举,1959-11-17,1959-11
每天扩大灌区十一万亩,1959-11-17,1959-11
张友道突击队巧使新工具,1959-11-17,1959-11
土火车,1959-11-17,1959-11
周总理接见贝拉弗里杰,1959-11-17,1959-11
天津向机械化半机械化疾进,1959-11-17,1959-11
中部喜雨喜雪 两广福建抗旱,1959-11-17,1959-11
今日天气预报（北京地区）,1959-11-17,1959-11
今年工业轴承生产计划提前完成,1959-11-17,1959-11
土洋结合闹革新小煤井显大威风,1959-11-17,1959-11
让更多的车辆参加冬季运输,1959-11-17,1959-11
赶标兵帮落后迅速扩大先进面,1959-11-17,1959-11
“争”和“帮”,1959-11-17,1959-11
千方百计挖掘车辆潜力,1959-11-17,1959-11
第一批高级照相机,1959-11-17,1959-11
新颖的塑料制品,1959-11-17,1959-11
复音调电子琴能演奏十二种音色,1959-11-17,1959-11
巨型钟奏乐报时刻,1959-11-17,1959-11
高级纸薄如蝉翼美似锦,1959-11-17,1959-11
依靠群众搞好现场管理,1959-11-17,1959-11
把技术革新和技术革命推向新高潮,1959-11-17,1959-11
大搞群众运动掌握尖端技术,1959-11-17,1959-11
大摆“蚂蚁阵”攻克“堡垒群”,1959-11-17,1959-11
自动生产线,1959-11-17,1959-11
泥型铸造的新光彩,1959-11-17,1959-11
支持农业技术改造,1959-11-17,1959-11
多种菜多贮柴过好冬天,1959-11-17,1959-11
从高产中寻找更高产经验,1959-11-17,1959-11
超额五倍完成收购计划,1959-11-17,1959-11
取之不尽的野生资源,1959-11-17,1959-11
抓住群众生活中的两件大事,1959-11-17,1959-11
黑龙江在封冻前完成翻地计划,1959-11-17,1959-11
一年产三窝小猪,1959-11-17,1959-11
山东水产产量节节上升,1959-11-17,1959-11
开封专区改革磨面工具,1959-11-17,1959-11
浙江推广“万灵灶”,1959-11-17,1959-11
加强思想教育推进农业社会主义改造,1959-11-17,1959-11
朝鲜劳动党中央常委会决定,1959-11-17,1959-11
罗马尼亚灌溉面积增加近一倍,1959-11-17,1959-11
外国军队必须撤出南朝鲜,1959-11-17,1959-11
联合国无权讨论朝鲜问题,1959-11-17,1959-11
苏联经济巨大步伐震撼美国,1959-11-17,1959-11
我妇女代表团去智利,1959-11-17,1959-11
兄弟国家铁路工务工程会议在京开幕,1959-11-17,1959-11
蒙古教育工作者代表团到京,1959-11-17,1959-11
布达佩斯国际乒乓球赛结束,1959-11-17,1959-11
刘正八十米低栏成绩达到世界水平,1959-11-17,1959-11
苏联冰球队大胜美国冠军队,1959-11-17,1959-11
竞赛,1959-11-17,1959-11
朝鲜人民坚决要求早日实现祖国和平统一,1959-11-17,1959-11
哈瓦那举行学生民兵队检阅,1959-11-17,1959-11
揭露美萨集团违反日内瓦协议,1959-11-17,1959-11
威胁要减少进口古巴糖,1959-11-17,1959-11
印度尼西亚核心内阁坚持领海为十二浬,1959-11-17,1959-11
谴责南非当局种族歧视政策,1959-11-17,1959-11
在南非的殖民剥削,1959-11-17,1959-11
西德和平战士在法庭上反击和平敌人,1959-11-17,1959-11
西德人民同阿登纳政策的矛盾无法调和,1959-11-17,1959-11
柬埔寨国际委员会提出第七次临时报告,1959-11-17,1959-11
半月国际述评,1959-11-17,1959-11
为农业技术改造出谋献计,1959-11-17,1959-11
积极安排农民业余学习,1959-11-17,1959-11
扫盲教师,1959-11-17,1959-11
王道邦中将追悼会在京举行,1959-11-17,1959-11
北京中医院治疗肛门疾患有成效,1959-11-17,1959-11
民办学校的一面红旗,1959-11-17,1959-11
不要绕开麻烦问题走,1959-11-17,1959-11
标兵颂,1959-11-17,1959-11
坚定的脚步,1959-11-17,1959-11
向日葵和英雄,1959-11-17,1959-11
张彩花,1959-11-17,1959-11
苏联民间工艺的繁荣,1959-11-17,1959-11
南山变成火焰山,1959-11-17,1959-11
秦岭烟云,1959-11-17,1959-11
和平鸽二三事,1959-11-17,1959-11
幼儿园里朋友多,1959-11-17,1959-11
七省协作治理黄土高原,1959-11-18,1959-11
支持我国和平解决中印边界问题的倡议,1959-11-18,1959-11
要求印度政府立即同中国会谈,1959-11-18,1959-11
在交界地区建立非军事地带是好主意,1959-11-18,1959-11
电贺摩洛哥国王登基32周年,1959-11-18,1959-11
周总理设宴欢迎摩洛哥客人,1959-11-18,1959-11
朱德委员长接见贝拉弗里杰,1959-11-18,1959-11
今日天气预报（北京地区）,1959-11-18,1959-11
加强城市街道民办工业和服务性事业的领导,1959-11-18,1959-11
“专题试验田”连破技术关,1959-11-18,1959-11
众英雄争当传播经验突击手,1959-11-18,1959-11
上钢化铁炉不烘炉熔铁成功,1959-11-18,1959-11
让先进的花朵开遍全国,1959-11-18,1959-11
整顿和提高街道工业和服务业,1959-11-18,1959-11
天津街道工业产量高质量好,1959-11-18,1959-11
台风警报,1959-11-18,1959-11
全国地层会议在京开幕,1959-11-18,1959-11
地层学,1959-11-18,1959-11
加强企业管理是小厂继续跃进的重要途径,1959-11-18,1959-11
新品种比去年增加二点七倍,1959-11-18,1959-11
钻井红旗,1959-11-18,1959-11
加快石油工业的发展速度,1959-11-18,1959-11
浓烟启示气变油,1959-11-18,1959-11
暖衣解冻油畅流,1959-11-18,1959-11
钻透祁连万丈峰,1959-11-18,1959-11
油田主人,1959-11-18,1959-11
石油和石油产品,1959-11-18,1959-11
试验田带动晚稻全面丰产,1959-11-18,1959-11
先进养猪单位成批涌现,1959-11-18,1959-11
试验田的新发展,1959-11-18,1959-11
渔溪公社自繁自养猪源充足,1959-11-18,1959-11
培育种猪的标兵李百川,1959-11-18,1959-11
自繁自养,1959-11-18,1959-11
宁夏治理清水河收大效益,1959-11-18,1959-11
金稻伴新村,1959-11-18,1959-11
希望中印总理会谈解决边界问题,1959-11-18,1959-11
海防工业建设飞跃前进,1959-11-18,1959-11
周总理接见阿尔及利亚工会领袖,1959-11-18,1959-11
匈牙利电讯学家巴尔塔到京,1959-11-18,1959-11
苏联红十字会代表团抵京,1959-11-18,1959-11
波兰部长会议小型工业委员会代表团抵京,1959-11-18,1959-11
荷兰新任代办柯大为向罗贵波递交委任书,1959-11-18,1959-11
捷交响乐团离广州来京,1959-11-18,1959-11
指责美英阴谋挑起“匈牙利问题”,1959-11-18,1959-11
谴责美国操纵联大讨论朝鲜问题,1959-11-18,1959-11
冷战旗手,1959-11-18,1959-11
摩中两国在反帝斗争中团结在一起,1959-11-18,1959-11
中苏篮球队在京举行末场友谊赛,1959-11-18,1959-11
我们爱厂如爱家,1959-11-18,1959-11
反对美国利用联合国干涉老挝,1959-11-18,1959-11
日本人民月底发动第八次统一行动,1959-11-18,1959-11
日本上半年对美贸易开始出超,1959-11-18,1959-11
揭露美国石油大王加剧冷战,1959-11-18,1959-11
波多黎各首都响彻反美呼声,1959-11-18,1959-11
阿共声明将满怀信心坚持斗争,1959-11-18,1959-11
拉丁美洲工人奋勇斗争,1959-11-18,1959-11
日美垄断资本的经济关系,1959-11-18,1959-11
在高速度发展中求平衡,1959-11-18,1959-11
闲话月球,1959-11-18,1959-11
热情温情冷水,1959-11-18,1959-11
“利他主义”,1959-11-18,1959-11
在李顺达的公社里,1959-11-18,1959-11
山庄,1959-11-18,1959-11
环球旅行,1959-11-18,1959-11
决不能让反动派窃取革命领导权,1959-11-18,1959-11
话剧七首,1959-11-18,1959-11
黄土高原的春天,1959-11-18,1959-11
中卫县大牲畜纯增率达14％,1959-11-19,1959-11
湖南母牛基本满怀,1959-11-19,1959-11
黑龙江畜禽兴旺,1959-11-19,1959-11
环县平均每人养羊五只,1959-11-19,1959-11
加快发展大牲畜,1959-11-19,1959-11
四省冬播面积超过计划,1959-11-19,1959-11
睢县农副产品样样收购得好,1959-11-19,1959-11
华新水泥厂做到产量高质量好,1959-11-19,1959-11
今日天气预报（北京地区）,1959-11-19,1959-11
生产运输大协作优先运送煤铁钢,1959-11-19,1959-11
土洋并举武装县社机械工业,1959-11-19,1959-11
哈尔滨工业部门帮助县社发展工业,1959-11-19,1959-11
向协作要效率  多产多运,1959-11-19,1959-11
此路直通,1959-11-19,1959-11
湘黔路湘娄段通车,1959-11-19,1959-11
大桥架上太行山,1959-11-19,1959-11
湘潭修建公路桥,1959-11-19,1959-11
安徽办起三千多野生植物加工厂,1959-11-19,1959-11
初制加工很重要,1959-11-19,1959-11
大浦供销部为农业生产服务的几点体会,1959-11-19,1959-11
陕西贵州早追肥早浇水,1959-11-19,1959-11
苗期追肥是当务之急,1959-11-19,1959-11
防止早种小麦年前拔节,1959-11-19,1959-11
延安专区农林牧副渔都增产,1959-11-19,1959-11
学习延安人民艰苦奋斗的精神,1959-11-19,1959-11
青海柴达木盆地粮食增产八成,1959-11-19,1959-11
柴达木农业珍闻,1959-11-19,1959-11
青海试种水稻获高产,1959-11-19,1959-11
用不断革命精神教育群众,1959-11-19,1959-11
建系十个月取得大成就,1959-11-19,1959-11
从工厂取经,1959-11-19,1959-11
一年走完多年路程,1959-11-19,1959-11
前进吧！新的科系,1959-11-19,1959-11
拉萨市新建许多房屋,1959-11-19,1959-11
广东农业中学巩固提高,1959-11-19,1959-11
宋副主席接见卡塔威纳塔,1959-11-19,1959-11
朱委员长接见喀麦隆妇女代表,1959-11-19,1959-11
培养农村小学教师的好办法,1959-11-19,1959-11
托木斯克人足球队同武汉队踢成平局,1959-11-19,1959-11
冬天里的春天,1959-11-19,1959-11
亲如一家人,1959-11-19,1959-11
坚持冷战政策的人必遭更大失败,1959-11-19,1959-11
希望维护中印友谊和平解决边界问题,1959-11-19,1959-11
揭露美国反动报纸的歪曲宣传,1959-11-19,1959-11
印度右派制造示威阻挠谈判,1959-11-19,1959-11
美国煽动印度拒绝我国建议,1959-11-19,1959-11
贝拉弗里杰去上海访问,1959-11-19,1959-11
中匈签订科技合作议定书,1959-11-19,1959-11
阿尔巴尼亚首都集会庆祝,1959-11-19,1959-11
山区的新生,1959-11-19,1959-11
奇异的“地下工厂”,1959-11-19,1959-11
不许美国盗用联合国旗帜干涉老挝,1959-11-19,1959-11
拉丁美洲独裁政权风雨飘摇,1959-11-19,1959-11
制止美国在冲绳试验导弹,1959-11-19,1959-11
美总统将访西、突两国,1959-11-19,1959-11
鼓吹实力政策拉拢中立国家,1959-11-19,1959-11
阿登纳凄风苦雨到伦敦,1959-11-19,1959-11
国际简讯,1959-11-19,1959-11
明争暗斗,1959-11-19,1959-11
“力争上游”颂,1959-11-19,1959-11
建设最理想的社会需要最崇高的道德,1959-11-19,1959-11
关于共产主义道德,1959-11-19,1959-11
枚乘“七发”与右倾顽症,1959-11-19,1959-11
鹿的地方——新的钢都,1959-11-19,1959-11
包钢铁水奔流,1959-11-19,1959-11
赶车姑娘（外一首）,1959-11-19,1959-11
东风吹透的时候,1959-11-19,1959-11
钢筋混凝土是谁发明的？,1959-11-19,1959-11
农村工具改革百花盛开,1959-11-20,1959-11
广东抢救受旱作物七百万亩,1959-11-20,1959-11
牛马羊增殖六成,1959-11-20,1959-11
广西新制大批改良工具,1959-11-20,1959-11
第一拖拉机厂产量高升,1959-11-20,1959-11
湖南邵阳十五个炼铁厂,1959-11-20,1959-11
成本低——达到大高炉先进水平,1959-11-20,1959-11
今日天气预报（北京地区）,1959-11-20,1959-11
人人搞革新样样有革新,1959-11-20,1959-11
革新工具搭配成套装卸效率全面提高,1959-11-20,1959-11
先进技术也要不断革新,1959-11-20,1959-11
“积木式”机床更灵巧了,1959-11-20,1959-11
技术革新前途无量,1959-11-20,1959-11
福州第二化工厂,1959-11-20,1959-11
云南最大的化肥厂,1959-11-20,1959-11
杭州兽用药厂,1959-11-20,1959-11
“金字招牌”,1959-11-20,1959-11
西藏人民喜笑颜开进商店,1959-11-20,1959-11
向自然开战,1959-11-20,1959-11
郧县高速度改变山区面貌,1959-11-20,1959-11
自办化肥厂满足生产需要,1959-11-20,1959-11
简明新闻,1959-11-20,1959-11
百万亩晚稻增产六成,1959-11-20,1959-11
报丰收,1959-11-20,1959-11
治山治水旱涝无忧,1959-11-20,1959-11
王亚庄党支部脚跟着实,1959-11-20,1959-11
北京街道生产组织越办越好,1959-11-20,1959-11
厦门家务服务站服务周到,1959-11-20,1959-11
全国田径运动会成绩优异,1959-11-20,1959-11
捷交响乐团在京演出受到热烈欢迎,1959-11-20,1959-11
苏联列宁共青团代表团到京,1959-11-20,1959-11
苏联驻华大使举行电影晚会,1959-11-20,1959-11
阿根廷澳斯瓦尔多·普格利赛乐队到京,1959-11-20,1959-11
匈科学技术合作代表团离京,1959-11-20,1959-11
张友渔任中缅友协理事会会长,1959-11-20,1959-11
苏青年男女篮球队双胜河北队,1959-11-20,1959-11
从生产中来  到生产中去,1959-11-20,1959-11
科学研究多快好省一例,1959-11-20,1959-11
苏维埃报刊应当是最强有力的和最富有战斗性的,1959-11-20,1959-11
七年计划的步伐,1959-11-20,1959-11
捷掀起改良土壤兴修水利的群众运动,1959-11-20,1959-11
诺沃提尼率党政代表团抵柏林,1959-11-20,1959-11
米高扬抵墨西哥受到热烈欢迎,1959-11-20,1959-11
加强工人斗争组织反对修改“安全条约”,1959-11-20,1959-11
尼赫鲁就中印边界问题发表讲话,1959-11-20,1959-11
要求法国停止核试验,1959-11-20,1959-11
应遵循正义原则释放赫卢,1959-11-20,1959-11
我驻缅甸大使设宴招待缅甸文化代表团,1959-11-20,1959-11
老挝第三次延期审讯苏发努冯,1959-11-20,1959-11
必须消除西柏林紧张策源地,1959-11-20,1959-11
我川剧团在波捷德保等国访问,1959-11-20,1959-11
继续发出有害中印关系的言论,1959-11-20,1959-11
综合考察是建设计划的计划,1959-11-20,1959-11
生活方式是可以改变的,1959-11-20,1959-11
批判“论否定”一文的右倾观点,1959-11-20,1959-11
在茫茫的林海里,1959-11-20,1959-11
晚归,1959-11-20,1959-11
巴拿马之歌,1959-11-20,1959-11
考验的时候,1959-11-20,1959-11
举起彩笔保卫幸福生活,1959-11-20,1959-11
愿日用品“锦上添花”,1959-11-20,1959-11
好讲解员,1959-11-20,1959-11
有感于影片的名称,1959-11-20,1959-11
内河港口码头安上土机械  短途运输队伍装备车和船,1959-11-21,1959-11
发展轻便铁路土铁路,1959-11-21,1959-11
山东小企业立大功劳,1959-11-21,1959-11
小高炉利用系数一再提高,1959-11-21,1959-11
江苏广东林牧副渔兴旺,1959-11-21,1959-11
浙江养兔十个月增加两倍,1959-11-21,1959-11
今日天气预报（北京地区）,1959-11-21,1959-11
维修保养到家  车辆经常完好,1959-11-21,1959-11
预则立,1959-11-21,1959-11
再接再厉增产更多的钢铁,1959-11-21,1959-11
上海轻工业品质量越来越好,1959-11-21,1959-11
群众干劲越高安全工作越细,1959-11-21,1959-11
广东深圳兴建水库,1959-11-21,1959-11
郑州黄河大桥架梁,1959-11-21,1959-11
淄博采用煤气烧窑,1959-11-21,1959-11
使用煤气炉注意事项,1959-11-21,1959-11
陶瓷工业的一项创举,1959-11-21,1959-11
十万工人打响腰斩汉江头一炮,1959-11-21,1959-11
又一列车电站发电,1959-11-21,1959-11
苇席造船真轻便,1959-11-21,1959-11
水文气象调查船,1959-11-21,1959-11
柯柯盐湖在变化着,1959-11-21,1959-11
取尽甘薯全身宝,1959-11-21,1959-11
物尽其用,1959-11-21,1959-11
十个出色的养猪姑娘,1959-11-21,1959-11
养猪,1959-11-21,1959-11
多快好省发展养猪事业,1959-11-21,1959-11
“穷办法”潜力无穷,1959-11-21,1959-11
贵州高原报丰收,1959-11-21,1959-11
苗岭深山夺高产,1959-11-21,1959-11
百岁老人话丰年,1959-11-21,1959-11
黄黄谷穗金浪翻（山歌）,1959-11-21,1959-11
高速度发展养猪事业,1959-11-21,1959-11
思想工作深透干部作风深入,1959-11-21,1959-11
拉萨迂噶岗面貌完全改观,1959-11-21,1959-11
纪念席勒诞辰二百周年,1959-11-21,1959-11
对外文委等单位设宴欢迎捷交响乐团,1959-11-21,1959-11
苏青年篮球队同四川队比赛男胜女败,1959-11-21,1959-11
举行音乐会并为农民演出  朱委员长接见乐团负责人,1959-11-21,1959-11
益阳县干部坚持种试验田,1959-11-21,1959-11
西藏电影事业迅速发展  翻身农奴成主要观众,1959-11-21,1959-11
青海藏语话剧队下牧区  牧民远道赶去看演出,1959-11-21,1959-11
有声势，有计划，有深度,1959-11-21,1959-11
支部工作好生产喜丰收,1959-11-21,1959-11
越南北方广大地区晚稻大丰收,1959-11-21,1959-11
决定提前完成三年计划,1959-11-21,1959-11
米高扬同墨西哥总统会谈,1959-11-21,1959-11
几内亚总统到莫斯科访问,1959-11-21,1959-11
我国歌唱家郑兴丽为澳大利亚工人演唱,1959-11-21,1959-11
七比一胜英格兰队,1959-11-21,1959-11
希望中印通过谈判解决边界问题,1959-11-21,1959-11
百般阻挠中印谈判边界问题,1959-11-21,1959-11
肆意诋毁周总理建议并叫嚷拒绝谈判,1959-11-21,1959-11
煽动印度对我国采取强硬态度,1959-11-21,1959-11
英国公然袒护美萨集s团迫害苏发努冯,1959-11-21,1959-11
美国某些人士力图保持远东紧张状态,1959-11-21,1959-11
洛克菲勒又大放冷战厥词,1959-11-21,1959-11
抗议哈马舍尔德到老挝活动,1959-11-21,1959-11
怯尼亚非洲铁路工人坚持罢工,1959-11-21,1959-11
把反对“安全条约”的传单撒遍全国,1959-11-21,1959-11
准备拿起武器保卫革命,1959-11-21,1959-11
日本煤矿工人举行大罢工,1959-11-21,1959-11
麦克米伦明年初去非洲活动,1959-11-21,1959-11
日本百万灾民的悲惨境遇,1959-11-21,1959-11
论农村集市贸易,1959-11-21,1959-11
历史科学进展的丰碑,1959-11-21,1959-11
大字报小诗,1959-11-21,1959-11
“蚂蚁爬石像”,1959-11-21,1959-11
新办起的食堂可好啦！,1959-11-21,1959-11
人民的斗争·人民的形象,1959-11-21,1959-11
赞公共食堂,1959-11-21,1959-11
红花,1959-11-21,1959-11
“小洋群”的强大生命力,1959-11-22,1959-11
一炉带头 群炉追赶,1959-11-22,1959-11
坚持高产优质低成本先进水平,1959-11-22,1959-11
安阳一座小高炉  连创日产新纪录,1959-11-22,1959-11
重庆长江大桥建成,1959-11-22,1959-11
土洋并举迅速建起炼焦工业  上海焦炭月产量达十万多吨,1959-11-22,1959-11
萍乡县小煤窑加快技术改造  九个半月已产原煤六十万吨,1959-11-22,1959-11
今日天气预报（北京地区）,1959-11-22,1959-11
各路英雄“传经送宝”,1959-11-22,1959-11
建立大批野生植物加工厂,1959-11-22,1959-11
广州轻工业产量质量品种全面跃进,1959-11-22,1959-11
七府坟车站同太钢加强协作,1959-11-22,1959-11
拉萨手工业蒸蒸日上,1959-11-22,1959-11
确保块块麦田苗全苗壮,1959-11-22,1959-11
高粱秸里出宝贝,1959-11-22,1959-11
献宝,1959-11-22,1959-11
多穗高粱,1959-11-22,1959-11
农林牧副渔五业互相促进,1959-11-22,1959-11
苏联大力兴建热电站和化工厂  百多个大型电站正动工建设,1959-11-22,1959-11
匈社会主义工人党举行中央全会,1959-11-22,1959-11
阿尔巴尼亚农业阔步前进,1959-11-22,1959-11
希望印度接受建议举行会谈,1959-11-22,1959-11
寻衅闹事反华反共,1959-11-22,1959-11
阿尔巴尼亚建设成就辉煌,1959-11-22,1959-11
苏联希望同美洲国家友好,1959-11-22,1959-11
尼赫鲁提出第二个“白皮书”,1959-11-22,1959-11
苏联将出版各种百科全书,1959-11-22,1959-11
巴西工业联合会副主席加·埃·菲洛到京,1959-11-22,1959-11
尼中友协代表团回国,1959-11-22,1959-11
听取访问越朝蒙德四国报告,1959-11-22,1959-11
我川剧团首次在索非亚演出,1959-11-22,1959-11
钢城的竞赛,1959-11-22,1959-11
日本和平大会在东京隆重开幕,1959-11-22,1959-11
要求停止核武器试验,1959-11-22,1959-11
藤山公然叫嚣以中苏为敌,1959-11-22,1959-11
阿尔及利亚准备同法国谈判,1959-11-22,1959-11
无知兼无礼,1959-11-22,1959-11
十月份工业生产续降,1959-11-22,1959-11
私人负债激增,1959-11-22,1959-11
美国黄金储备下降,1959-11-22,1959-11
农民收入锐减,1959-11-22,1959-11
利用“美援”推销美货,1959-11-22,1959-11
掀起冬季养猪积肥高潮,1959-11-22,1959-11
贵州毕节专区大修水利积肥造肥,1959-11-22,1959-11
贵州的高寒山区,1959-11-22,1959-11
新的煤炭基地正在兴建,1959-11-22,1959-11
翻天覆地的变化,1959-11-22,1959-11
新生的仡佬族,1959-11-22,1959-11
建设山区的一面红旗,1959-11-22,1959-11
依靠公社力量消灭森林火灾,1959-11-22,1959-11
苦战一冬春铲除山火根,1959-11-22,1959-11
林火的种类,1959-11-22,1959-11
加强冬春护林防火,1959-11-22,1959-11
守卫着林海的哨兵——余德明,1959-11-22,1959-11
护林防火方法多,1959-11-22,1959-11
不让一个伙伴掉队,1959-11-22,1959-11
妈妈,1959-11-22,1959-11
西江月,1959-11-22,1959-11
印花布上的一朵鲜花,1959-11-22,1959-11
锅灶的始祖,1959-11-22,1959-11
人民公社好,1959-11-22,1959-11
“两条腿走路”增产农具化肥,1959-11-23,1959-11
上海制成五万瓩汽轮电机,1959-11-23,1959-11
商业——农业跃进的出色后勤,1959-11-23,1959-11
提高农副产品加工效率,1959-11-23,1959-11
湖北转入生产自救节约度荒,1959-11-23,1959-11
今日天气预报（北京地区）,1959-11-23,1959-11
革新技术  加强管理  有劳有逸,1959-11-23,1959-11
充分利用成材边材,1959-11-23,1959-11
昆明机床厂控制加工余量节约金属材料,1959-11-23,1959-11
进一步做好通风防尘工作,1959-11-23,1959-11
株洲玻璃厂生产,1959-11-23,1959-11
龙凤新添露天坑,1959-11-23,1959-11
大通河大桥建成,1959-11-23,1959-11
