仙女山飘扬山区抗旱红旗,1959-08-08,1959-08
天地之间,1959-08-08,1959-08
不靠天不等雨持久抗旱夺丰收,1959-08-08,1959-08
跟党走,1959-08-08,1959-08
小扁担,1959-08-08,1959-08
干劲不同  庄稼两样,1959-08-08,1959-08
糖料作物增产的紧要关头,1959-08-08,1959-08
广东大部分甘蔗生机转旺,1959-08-08,1959-08
黑龙江加强甜菜田间管理,1959-08-08,1959-08
大青山下的甜菜丰产田,1959-08-08,1959-08
甘蔗和甜菜,1959-08-08,1959-08
改善苏美关系有助于巩固和平,1959-08-08,1959-08
苏联人民欢迎苏美首脑相互访问,1959-08-08,1959-08
苏联农业劳动者高速收割踊跃交售,1959-08-08,1959-08
苏联劳动人民互相帮助共求先进,1959-08-08,1959-08
朝鲜职工增产竞赛进入高潮,1959-08-08,1959-08
旅日朝侨要求回国的斗争获胜,1959-08-08,1959-08
各国欢迎苏美首脑相互访问,1959-08-08,1959-08
胡志明主席到西安,1959-08-08,1959-08
伊拉克医学代表团到京,1959-08-08,1959-08
匈游泳和跳水队到京,1959-08-08,1959-08
中保签订广播电视合作协定,1959-08-08,1959-08
阿尔及利亚妇女代表团和突尼斯妇女代表到京,1959-08-08,1959-08
难忘的友谊,1959-08-08,1959-08
世界上没有过的速度,1959-08-08,1959-08
参加到反对战争的伟大战斗中去,1959-08-08,1959-08
横越半个日本的和平大进军,1959-08-08,1959-08
反对“安全条约”是当前斗争焦点,1959-08-08,1959-08
把十二日定为反对特鲁希略斗争日,1959-08-08,1959-08
评日内瓦外长会议,1959-08-08,1959-08
讨论德国问题必须有两个德国参加,1959-08-08,1959-08
反独裁武装转战首都南北,1959-08-08,1959-08
国际简讯,1959-08-08,1959-08
岸信介通过修改“安全条约”复活军国主义,1959-08-08,1959-08
首都将开展四次卫生突击战,1959-08-08,1959-08
五莲县委领导作风踏实,1959-08-08,1959-08
坚持好作风，作基层干部的好榜样,1959-08-08,1959-08
数千藏胞走进学校,1959-08-08,1959-08
迎头痛歼,1959-08-08,1959-08
女共产党员汪水秀,1959-08-08,1959-08
陌路相逢是亲人,1959-08-08,1959-08
给孩子多画些好的小人书,1959-08-08,1959-08
让课本发挥更大的作用,1959-08-08,1959-08
莫大的鼓舞,1959-08-08,1959-08
天津中医系统学习医学理论,1959-08-08,1959-08
“鹏程万里”,1959-08-08,1959-08
福建广泛征集医案医话,1959-08-08,1959-08
什么是医案医话？,1959-08-08,1959-08
正确理解理论和实践的关系,1959-08-08,1959-08
应当重视轻工业的发展,1959-08-08,1959-08
论安全与生产,1959-08-08,1959-08
一花独香不是春,1959-08-08,1959-08
谷场夜话,1959-08-08,1959-08
稻香熏得人心甜,1959-08-08,1959-08
妙峰山风光,1959-08-08,1959-08
大战举手塘,1959-08-08,1959-08
钓鱼有感,1959-08-08,1959-08
丰收（木刻）,1959-08-08,1959-08
金县海带养殖场（国画）,1959-08-08,1959-08
今日天气预报（北京地区）,1959-08-09,1959-08
鞍钢七月份钢和钢材产量创造最高纪录,1959-08-09,1959-08
超产钢材十万吨迎接国庆十周年,1959-08-09,1959-08
京郊农民奋勇抗洪排涝,1959-08-09,1959-08
南方林区大抓木材水运,1959-08-09,1959-08
迅速把木材调运出来,1959-08-09,1959-08
大战八九月多产煤铁迎国庆,1959-08-09,1959-08
上海一百种轻工业品质量提高,1959-08-09,1959-08
抗旱防洪急如火物资技术齐驰援,1959-08-09,1959-08
支前保丰收,1959-08-09,1959-08
北京最近为什么连降大雨？,1959-08-09,1959-08
红火炉前的凉爽车间,1959-08-09,1959-08
首都百万大军今晨聚歼蚊蝇,1959-08-09,1959-08
为了千万旅客的健康,1959-08-09,1959-08
苏联真诚希望同各国建立友好关系,1959-08-09,1959-08
号召和平力量采取行动结束冷战,1959-08-09,1959-08
越南北方大力兴建现代化工厂,1959-08-09,1959-08
哈萨克七个月完成全年畜产品交售计划,1959-08-09,1959-08
朝鲜全民奋战大建发电站,1959-08-09,1959-08
捷减低农业机器价格,1959-08-09,1959-08
保今年蔬菜作物可望丰收,1959-08-09,1959-08
李一卿启程去加尔各答,1959-08-09,1959-08
阿万余干部参加体力劳动,1959-08-09,1959-08
十月为“恢复日中邦交月”,1959-08-09,1959-08
莫斯科青年热情会佳宾,1959-08-09,1959-08
古巴、墨西哥妇女代表团离京,1959-08-09,1959-08
胡志明主席在西安参观,1959-08-09,1959-08
中波友协代表团访问波兰党中央,1959-08-09,1959-08
苏联科学技术新事,1959-08-09,1959-08
吉尔吉斯的今天和明天,1959-08-09,1959-08
制止卖国阴谋反对美国干涉,1959-08-09,1959-08
桑怒和丰沙里人民奋起战斗,1959-08-09,1959-08
从广岛发出的和平号召,1959-08-09,1959-08
呼吁日本和西德人民反对核武装,1959-08-09,1959-08
禁止氢弹大会成功,1959-08-09,1959-08
谴责美国阴谋在老挝挑起新战争,1959-08-09,1959-08
美总统将赴西欧访问,1959-08-09,1959-08
伊朗人民党向联合国控诉,1959-08-09,1959-08
尼赫鲁谈喀拉拉邦问题,1959-08-09,1959-08
抗议阿联当局非法逮捕赫卢,1959-08-09,1959-08
福斯特号召支持钢铁工人斗争,1959-08-09,1959-08
莫大的讽刺,1959-08-09,1959-08
加速开发海南岛的热带资源,1959-08-09,1959-08
环岛漫行,1959-08-09,1959-08
椰子一身无废物,1959-08-09,1959-08
三大饮料之一咖啡,1959-08-09,1959-08
常绿乔木——槟榔,1959-08-09,1959-08
芬香扑鼻的香茅,1959-08-09,1959-08
草本植物——剑麻,1959-08-09,1959-08
南海上的明珠,1959-08-09,1959-08
商业系统遍开技术革新之花,1959-08-09,1959-08
肩膀解放了,1959-08-09,1959-08
“四化”仓库,1959-08-09,1959-08
掀起商业技术革新的新高潮,1959-08-09,1959-08
革新的花朵,1959-08-09,1959-08
捆螃蟹夹,1959-08-09,1959-08
多用洗涤机,1959-08-09,1959-08
析木公社青贮工作好,1959-08-09,1959-08
密山垦区突击青贮饲料,1959-08-09,1959-08
怎样调制青贮饲料,1959-08-09,1959-08
为猪准备丰富的粮草,1959-08-09,1959-08
青贮饲料和青贮窖,1959-08-09,1959-08
青贮玉米秸喂牛增重快,1959-08-09,1959-08
青贮饲料的营养成份,1959-08-09,1959-08
大搞青贮饲料,1959-08-09,1959-08
万棹齐发，鼓浪前进,1959-08-09,1959-08
寻人启事,1959-08-09,1959-08
革命意志的胜利,1959-08-09,1959-08
假日,1959-08-09,1959-08
定苗,1959-08-09,1959-08
“大家都是胜利者”,1959-08-09,1959-08
千里马在奔驰……,1959-08-09,1959-08
西洋景,1959-08-09,1959-08
配电工（油画）,1959-08-09,1959-08
今日天气预报（北京地区）,1959-08-10,1959-08
干劲要一鼓再鼓上游要一争再争,1959-08-10,1959-08
松江政治挂帅推动丰产运动,1959-08-10,1959-08
钢都英雄奋起摆擂比武,1959-08-10,1959-08
首都百万群众两路夹击蚊蝇,1959-08-10,1959-08
包钢突击建设一号高炉,1959-08-10,1959-08
力争上游困难低头,1959-08-10,1959-08
六个月建成六百多项工程,1959-08-10,1959-08
上钢产量质量双跃进,1959-08-10,1959-08
太钢青年高炉日日超产 北票矿多产原煤两千吨,1959-08-10,1959-08
积极发展栲胶生产,1959-08-10,1959-08
干劲的分量,1959-08-10,1959-08
各地力争栲胶产量增长三倍,1959-08-10,1959-08
我国的栲胶原料,1959-08-10,1959-08
栲胶的用途,1959-08-10,1959-08
深夜奋战（木刻）,1959-08-10,1959-08
四川全党全民动员与天争粮,1959-08-10,1959-08
襄阳专区灌溉网在抗旱中大显身手,1959-08-10,1959-08
河南省通令嘉奖抗旱先进县市,1959-08-10,1959-08
种瓜得瓜,1959-08-10,1959-08
长江之水,1959-08-10,1959-08
在抗旱最前线,1959-08-10,1959-08
开山劈岭引水上山,1959-08-10,1959-08
抗旱小景,1959-08-10,1959-08
深山古洞找水源,1959-08-10,1959-08
匈牙利劳动人民竞赛热潮日益高涨,1959-08-10,1959-08
再次建议签订互不侵犯条约,1959-08-10,1959-08
波兰试用四班制提高煤产量,1959-08-10,1959-08
保加利亚职工踊跃提合理化建议,1959-08-10,1959-08
认为苏美关系改善有利于和平,1959-08-10,1959-08
蒙古改变地方行政机构,1959-08-10,1959-08
全苏第二届运动会隆重开幕,1959-08-10,1959-08
朝苏“友谊桥”建成,1959-08-10,1959-08
中匈游泳队友谊表演赛,1959-08-10,1959-08
规模巨大健将云集,1959-08-10,1959-08
纽约股票价格暴跌,1959-08-10,1959-08
授给吴英恺教授荣誉会员证书,1959-08-10,1959-08
越南劳动部考察团回国,1959-08-10,1959-08
广东粤剧院到达平壤,1959-08-10,1959-08
吉卜赛人的新生,1959-08-10,1959-08
美国嗾使老挝当局扩大内战造成严重局势 越南民主共和国对此局势决不能袖手旁观,1959-08-10,1959-08
印度总理尼赫鲁谈老挝局势,1959-08-10,1959-08
斗争中的墨西哥妇女,1959-08-10,1959-08
支持非洲争取独立的斗争,1959-08-10,1959-08
反对干涉古巴内政,1959-08-10,1959-08
古巴逮捕一批阴谋分子,1959-08-10,1959-08
希腊爱国者亲属发出呼吁,1959-08-10,1959-08
国际简讯,1959-08-10,1959-08
日本人民发动大游行,1959-08-10,1959-08
“松川事件”斗争的十年,1959-08-10,1959-08
和群众拧在一起抗天灾争丰收,1959-08-10,1959-08
围绕生产开展科普活动,1959-08-10,1959-08
重视普及,1959-08-10,1959-08
领导抗旱斗争的榜样,1959-08-10,1959-08
结合实际情况学习政策理论,1959-08-10,1959-08
台湾发生严重水灾,1959-08-10,1959-08
山岗诊断起死回生,1959-08-10,1959-08
深夜上山取蛇药,1959-08-10,1959-08
两条生命,1959-08-10,1959-08
郑州国棉三厂掀起学习高潮,1959-08-10,1959-08
不让夏天悄悄地溜走,1959-08-10,1959-08
全面展开共产主义建设时期生产力和生产关系的发展,1959-08-10,1959-08
丰收日记,1959-08-10,1959-08
路越走越宽广,1959-08-10,1959-08
胶东之花,1959-08-10,1959-08
施耐庵的两首诗,1959-08-10,1959-08
抗旱短歌,1959-08-10,1959-08
庆丰收,1959-08-10,1959-08
今日天气预报（北京地区）,1959-08-11,1959-08
迅速把生产高潮推向每个角落,1959-08-11,1959-08
共青团中央号召全国青年在生产新高潮中大显身手,1959-08-11,1959-08
鞍钢出色完成上旬钢材计划,1959-08-11,1959-08
重钢太钢日产水平迅速上升,1959-08-11,1959-08
加快生产机车货车,1959-08-11,1959-08
赶前不赶后时时争上游,1959-08-11,1959-08
一切工作往前赶,1959-08-11,1959-08
主动克服困难增产钢圈轴承,1959-08-11,1959-08
重点工程兼程跃进,1959-08-11,1959-08
解放铁路专用线,1959-08-11,1959-08
崇高的职业,1959-08-11,1959-08
再接再厉,1959-08-11,1959-08
中和大队总产单产齐跃进,1959-08-11,1959-08
“东坡田”今昔,1959-08-11,1959-08
路在人走事在人为,1959-08-11,1959-08
在天灾面前应该怎么办？,1959-08-11,1959-08
增城力争晚造丰收夺回早造受灾损失,1959-08-11,1959-08
抓紧季节多种大白菜要做好家禽秋孵工作 青贮饲料要及早准备,1959-08-11,1959-08
山西掀起超包产运动,1959-08-11,1959-08
开辟“山上运河”的英雄们,1959-08-11,1959-08
朝鲜人民热烈展开增产竞赛迎接国庆,1959-08-11,1959-08
越南人民战胜特大洪水,1959-08-11,1959-08
苏联用立体构件快速建楼房,1959-08-11,1959-08
中匈游泳友谊赛结束,1959-08-11,1959-08
日本法律界代表团到京,1959-08-11,1959-08
罗降低工业品食品价格,1959-08-11,1959-08
陈毅副总理接见比利时工会领导人,1959-08-11,1959-08
必须加强和平力量警惕冷战势力,1959-08-11,1959-08
竞献优秀节目迎接国庆,1959-08-11,1959-08
索非亚人民决定献出五十万个劳动日,1959-08-11,1959-08
从半年看前景,1959-08-11,1959-08
日本各界决心争取无罪释放全体被告,1959-08-11,1959-08
非洲国家的团结合作,1959-08-11,1959-08
号召加强团结实现内阁政治纲领,1959-08-11,1959-08
号召人民击退对民主的进攻,1959-08-11,1959-08
琅勃拉邦省人民迎头回击,1959-08-11,1959-08
三国武官到内战地区活动,1959-08-11,1959-08
伊拉克“革命报”攻击各国共产党,1959-08-11,1959-08
伊拉克“革命报”攻击各国共产党,1959-08-11,1959-08
阿曼地雷四伏英军不断被炸,1959-08-11,1959-08
撒哈拉沙漠一景,1959-08-11,1959-08
多哥筹备明年四月独立,1959-08-11,1959-08
卢蒙巴要求刚果立即独立,1959-08-11,1959-08
河南五万白衣战士上山下乡,1959-08-11,1959-08
赞白衣战士,1959-08-11,1959-08
两套人马结合科学之花常开,1959-08-11,1959-08
重视中间性试验,1959-08-11,1959-08
我怎样引导学生阅读语文课文,1959-08-11,1959-08
同仁菜场卫生红旗飘,1959-08-11,1959-08
暑假学生生活小景,1959-08-11,1959-08
在全军文艺会演中看到的和想到的,1959-08-11,1959-08
赏“风雪之夜”,1959-08-11,1959-08
丰收日记,1959-08-11,1959-08
造房人的风格,1959-08-11,1959-08
政治挂帅和钻研业务,1959-08-11,1959-08
需要扶持,1959-08-11,1959-08
西山（外一首）,1959-08-11,1959-08
征服黄河（木刻）,1959-08-11,1959-08
今日天气预报（北京地区）,1959-08-12,1959-08
一批钢煤健将胜利跨过八月上旬,1959-08-12,1959-08
信任群众威力实现新的跃进,1959-08-12,1959-08
青浦县猪鱼鸡鸭一片兴旺景象,1959-08-12,1959-08
解决城市副食品供应问题的正确方针,1959-08-12,1959-08
条件好不松懈条件差不畏难,1959-08-12,1959-08
保证采掘工人武器精良,1959-08-12,1959-08
抓紧时机收购土特产品,1959-08-12,1959-08
条件好也要鼓干劲,1959-08-12,1959-08
东北电力网新增生力军,1959-08-12,1959-08
山东又建成百立米高炉,1959-08-12,1959-08
白云深处建电站,1959-08-12,1959-08
只要意志坚低产变高产 一旦干劲不够丰收变成歉收,1959-08-12,1959-08
山东全民投入抗旱保收斗争,1959-08-12,1959-08
吉林展开超包产竞赛,1959-08-12,1959-08
路,1959-08-12,1959-08
今年为什么发生旱涝现象？ 今后一个时期的趋势如何？,1959-08-12,1959-08
园艺事业欣欣向荣,1959-08-12,1959-08
伊犁苹果上市,1959-08-12,1959-08
库尔勒梨香甜多汁,1959-08-12,1959-08
吐鲁番葡萄结实累累,1959-08-12,1959-08
花子岗抗旱记,1959-08-12,1959-08
讨水,1959-08-12,1959-08
苏联愿承担义务不先恢复核试验,1959-08-12,1959-08
苏联展览会在纽约闭幕,1959-08-12,1959-08
蒙古耕地面积激增农作物丰收在望,1959-08-12,1959-08
世界民主青联举行会员组织大会,1959-08-12,1959-08
将多余自留牲畜再入社,1959-08-12,1959-08
一致谴责岸信介政府敌视中国,1959-08-12,1959-08
彼纳硕士到京,1959-08-12,1959-08
中波友协代表团团长王维舟访波后返京,1959-08-12,1959-08
印度尼西亚艺术团到京,1959-08-12,1959-08
纽约股票行市继续狂跌,1959-08-12,1959-08
办学院迎国庆,1959-08-12,1959-08
利用杂剧克服缺点,1959-08-12,1959-08
飞奔吧，千里马！,1959-08-12,1959-08
美国干涉老挝局势威胁越南安全  应当采取紧急措施制止老挝内战,1959-08-12,1959-08
制止美国和老挝当局扩大内战,1959-08-12,1959-08
拉丁美洲舆论斥美国干涉阴谋,1959-08-12,1959-08
南方好冷！,1959-08-12,1959-08
华尔街喉舌为美国领导地位担心,1959-08-12,1959-08
尼赫鲁再谈老挝局势,1959-08-12,1959-08
国际简讯,1959-08-12,1959-08
古巴破获大规模叛乱阴谋案,1959-08-12,1959-08
并无矛盾,1959-08-12,1959-08
“泛美经济开发银行”的掠夺本质,1959-08-12,1959-08
党委主动厂长尽责职工添劲,1959-08-12,1959-08
北京首次卫生突击战告捷,1959-08-12,1959-08
一场辩论扫除了松劲情绪,1959-08-12,1959-08
找源泉,1959-08-12,1959-08
中国医科大学在首都成立,1959-08-12,1959-08
二百多名藏族学生回西藏,1959-08-12,1959-08
港九受灾同胞领到祖国救济米,1959-08-12,1959-08
除害务尽,1959-08-12,1959-08
继续加强工业企业中党的领导作用,1959-08-12,1959-08
洪水中的共产党员江秀梅,1959-08-12,1959-08
正确认识政治经济学中的几个关系问题,1959-08-12,1959-08
来、去、入、出,1959-08-12,1959-08
太阳能的利用,1959-08-12,1959-08
工业区·风景区——武汉,1959-08-12,1959-08
心田自有甘露,1959-08-12,1959-08
矿工的心（外二首）,1959-08-12,1959-08
三言两语,1959-08-12,1959-08
和平（套色木刻）,1959-08-12,1959-08
今日天气预报（北京地区）,1959-08-13,1959-08
精心管理棉田确保棉花增产,1959-08-13,1959-08
坚决反对美国和老挝当局威胁和平,1959-08-13,1959-08
抓好具体措施推进生产高潮,1959-08-13,1959-08
棉田除虫战术好收效大,1959-08-13,1959-08
确保伏桃，多结秋桃，争取棉花大丰收,1959-08-13,1959-08
八月头十天又一批厂矿报捷,1959-08-13,1959-08
上海树立三百标兵,1959-08-13,1959-08
大力增产日用品进一步活跃市场,1959-08-13,1959-08
新疆石油加速东运,1959-08-13,1959-08
工商之间,1959-08-13,1959-08
抓紧关键季节多产石油,1959-08-13,1959-08
宁夏有了七座人造石油厂,1959-08-13,1959-08
车站码头快装快卸,1959-08-13,1959-08
川中油区之夜（钢笔画）,1959-08-13,1959-08
江西人民奋起抗灾,1959-08-13,1959-08
农业战线秋季形势一片光明,1959-08-13,1959-08
生产好不好关键在领导,1959-08-13,1959-08
一个积极抗旱庄稼长得好 一个靠天等雨稻薯枯死多,1959-08-13,1959-08
千百万人上山大采松脂,1959-08-13,1959-08
抓紧时机多采松脂,1959-08-13,1959-08
北京郊区抗涝抢种秋菜,1959-08-13,1959-08
一瓜一菜，当思来处不易,1959-08-13,1959-08
干旱难不倒英雄汉,1959-08-13,1959-08
苏联愿立即签订停止核试验协定,1959-08-13,1959-08
社会主义阵营以雄壮步伐迈向伟大目标,1959-08-13,1959-08
匈牙利今年收成非常好,1959-08-13,1959-08
墨西哥电影代表团抵京,1959-08-13,1959-08
和平风乍起华尔街发急,1959-08-13,1959-08
包尔汉设宴欢迎印度尼西亚艺术团,1959-08-13,1959-08
欢唱“千里马”时代,1959-08-13,1959-08
朝鲜社会主义建设成就辉煌,1959-08-13,1959-08
中朝友协举行电影晚会庆祝朝鲜国庆,1959-08-13,1959-08
“只要大家同心合力……”,1959-08-13,1959-08
评老挝的严重局势,1959-08-13,1959-08
美洲外长会议将展开一场斗争,1959-08-13,1959-08
号召拉丁美洲人民粉碎美国干涉,1959-08-13,1959-08
吁请采取措施缓和老挝局势,1959-08-13,1959-08
美国钢铁工人斗志日益昂扬,1959-08-13,1959-08
阿根廷五十万工人总罢工,1959-08-13,1959-08
古巴工人欢呼粉碎叛乱阴谋,1959-08-13,1959-08
美国力图抵赖挑起老挝内战罪责,1959-08-13,1959-08
古巴土改见闻,1959-08-13,1959-08
依靠党员开展人定胜天教育,1959-08-13,1959-08
既治标又治本除四害灭五病,1959-08-13,1959-08
检查“三反双减”政策执行情况,1959-08-13,1959-08
广东土壤科学工作者举行学术讨论会,1959-08-13,1959-08
土洋专家共商抗旱大计,1959-08-13,1959-08
打铁要靠自身硬,1959-08-13,1959-08
花、果和根,1959-08-13,1959-08
巧法观天象,1959-08-13,1959-08
我航空模型选手创两项世界纪录,1959-08-13,1959-08
航空模型常识,1959-08-13,1959-08
生产上的好哨兵,1959-08-13,1959-08
用最少的劳动消耗，取得最多的使用价值,1959-08-13,1959-08
谈合理,1959-08-13,1959-08
黄泛区景色如画,1959-08-13,1959-08
泛区老汉唱古今,1959-08-13,1959-08
花园口变花园,1959-08-13,1959-08
邓城除害记,1959-08-13,1959-08
黄泛区民歌,1959-08-13,1959-08
嫁接,1959-08-13,1959-08
捉虫去,1959-08-13,1959-08
今日天气预报（北京地区）,1959-08-14,1959-08
关于展开抗灾斗争的紧急指示,1959-08-14,1959-08
胡志明主席到达北京,1959-08-14,1959-08
争颂人民公社好得很,1959-08-14,1959-08
把抗旱斗争进行到底,1959-08-14,1959-08
抗旱物资火速调往河南,1959-08-14,1959-08
吴县大讲形势大鼓干劲,1959-08-14,1959-08
河北秣马厉兵迎接收购旺季,1959-08-14,1959-08
商业工作者的干劲,1959-08-14,1959-08
人人都在忙生产 商业也为人人忙（招贴画）,1959-08-14,1959-08
三送雨具,1959-08-14,1959-08
海上商店,1959-08-14,1959-08
热闹的夜市,1959-08-14,1959-08
促进生产货源足,1959-08-14,1959-08
上海南京路三百家商店夺红旗,1959-08-14,1959-08
力争生产新高潮中电力充足,1959-08-14,1959-08
互助协作多炼优质钢,1959-08-14,1959-08
北京发起收尾工程突击战,1959-08-14,1959-08
高空抢修（套色木刻）,1959-08-14,1959-08
北方水稻要同南方水稻比翼高飞,1959-08-14,1959-08
争取北方水稻大丰收,1959-08-14,1959-08
扬州市生猪迅速发展,1959-08-14,1959-08
湖南广西抢种晚秋,1959-08-14,1959-08
内蒙古云南突击沤制绿肥,1959-08-14,1959-08
丁集公社大搞积肥基本建设,1959-08-14,1959-08
水产部通知水产战线是继续跃进的形势,1959-08-14,1959-08
青海水产事业迅速发展,1959-08-14,1959-08
炊事员张书贤,1959-08-14,1959-08
文化大军到前线去,1959-08-14,1959-08
深夜的锯刨声,1959-08-14,1959-08
放下药箱就车水  跳下车架就治病,1959-08-14,1959-08
人人都把货郎夸,1959-08-14,1959-08
东欧社会主义国家农业生产大步前进,1959-08-14,1959-08
各国代表强调团结一致保卫和平,1959-08-14,1959-08
巴尔干应当成为和平地区,1959-08-14,1959-08
签订遣送旅日朝侨回国协议,1959-08-14,1959-08
朝鲜驻华大使举行电影招待会,1959-08-14,1959-08
奥和平代表团到京,1959-08-14,1959-08
在京举行首次演出,1959-08-14,1959-08
美总统谈赫鲁晓夫访美,1959-08-14,1959-08
朝鲜的东北角,1959-08-14,1959-08
朝鲜大力增殖猪牛鸡鸭,1959-08-14,1959-08
地下养鸡场,1959-08-14,1959-08
保加利亚养鸡业大发展,1959-08-14,1959-08
智利首都人民举行反美大示威示威,1959-08-14,1959-08
11月1日为阿尔及利亚日,1959-08-14,1959-08
阿尔及利亚解放军大捷,1959-08-14,1959-08
美洲外长会议纯粹是陷阱,1959-08-14,1959-08
拉丁美洲公众一致声援古巴,1959-08-14,1959-08
谴责印度政府对民主的侵犯,1959-08-14,1959-08
古巴人民展开庆祝活动,1959-08-14,1959-08
美国在资本主义世界中江河日下,1959-08-14,1959-08
岸信介周游列国白费脚力,1959-08-14,1959-08
黑漆灯笼,1959-08-14,1959-08
日本的“超级推销员”,1959-08-14,1959-08
美国黄金外流和美元信用危机,1959-08-14,1959-08
抓政策抓思想解决重大问题,1959-08-14,1959-08
大鼓青年干劲发挥老农特长,1959-08-14,1959-08
怎样培养小学一年级儿童的说话和写话能力,1959-08-14,1959-08
学长处增干劲,1959-08-14,1959-08
歌颂建设山区的冲天干劲,1959-08-14,1959-08
鼓舞干劲活跃生活,1959-08-14,1959-08
勤学苦练为国争光,1959-08-14,1959-08
加紧练习大显身手,1959-08-14,1959-08
关于小麦合理密植问题的探讨,1959-08-14,1959-08
谈谈读书方法,1959-08-14,1959-08
“管天小组”赞,1959-08-14,1959-08
溪边的造船厂,1959-08-14,1959-08
海上暴风雨,1959-08-14,1959-08
贺墨西哥电影周,1959-08-14,1959-08
奇怪的雨,1959-08-14,1959-08
无花果,1959-08-14,1959-08
舵手（木刻）,1959-08-14,1959-08
海鱼（油画）,1959-08-14,1959-08
今日天气预报（北京地区）,1959-08-15,1959-08
浙江广西喜摘早稻丰收硕果,1959-08-15,1959-08
公社力能回天抗旱巧夺奇功,1959-08-15,1959-08
南北五省围剿秋蝗,1959-08-15,1959-08
电贺朝鲜解放十四周年,1959-08-15,1959-08
全力组织八九两月生产高潮,1959-08-15,1959-08
奋战一个月质量插红旗,1959-08-15,1959-08
林业系统响起跃进号角,1959-08-15,1959-08
踊跃储蓄支援大跃进,1959-08-15,1959-08
北京建焦化厂,1959-08-15,1959-08
内蒙古天然碱丰收,1959-08-15,1959-08
庐江矾矿大跃进,1959-08-15,1959-08
进一步提高小高炉生铁质量,1959-08-15,1959-08
加强统一领导 高速度地建设工业基地,1959-08-15,1959-08
武汉向工业基地迈进,1959-08-15,1959-08
“九省通衢”真正成为交通枢纽,1959-08-15,1959-08
烽火队玉米田间管理好上加好,1959-08-15,1959-08
本报8月7日社论,1959-08-15,1959-08
展翅,1959-08-15,1959-08
患难相扶亲密协作,1959-08-15,1959-08
为秋粮增产共谋大计,1959-08-15,1959-08
峪直河灌区用现有的水浇最多的地,1959-08-15,1959-08
沔阳县通海口公社积极增加提水工具,1959-08-15,1959-08
交流今年麦棉栽培经验 及早准备小麦秋播工作,1959-08-15,1959-08
友谊农场在麦收时节,1959-08-15,1959-08
朝鲜人民跨上千里马奔驰,1959-08-15,1959-08
平壤盛大集会庆祝朝鲜解放十四周年,1959-08-15,1959-08
中国人民永远同朝鲜人民站在一起,1959-08-15,1959-08
号召全民团结实现祖国和平统一,1959-08-15,1959-08
建议南北双方恢复贸易,1959-08-15,1959-08
德意志民主共和国全运会开幕,1959-08-15,1959-08
欢迎阿尔及利亚等国妇女代表,1959-08-15,1959-08
罗五位音乐家到京,1959-08-15,1959-08
“墨西哥电影周”在京开幕,1959-08-15,1959-08
缅甸艺术考察团到京,1959-08-15,1959-08
朝鲜在飞跃前进,1959-08-15,1959-08
塞内加尔青年代表到京,1959-08-15,1959-08
美洲外长会议上摆开了阵势,1959-08-15,1959-08
南美情调,1959-08-15,1959-08
委内瑞拉坚决反对成立警察部队,1959-08-15,1959-08
巴西——在斗争中的国家,1959-08-15,1959-08
巴西人民保卫石油资源的斗争,1959-08-15,1959-08
不许美国干涉古巴,1959-08-15,1959-08
要求宣布加纳为共和国,1959-08-15,1959-08
谴责赫脱操纵美洲外长会议,1959-08-15,1959-08
喀拉拉邦马上变样,1959-08-15,1959-08
通货膨胀失业激增赋税奇重,1959-08-15,1959-08
国际简讯,1959-08-15,1959-08
日本反动派利用“八一五”宣传军国主义,1959-08-15,1959-08
泰国加紧训练老挝警察,1959-08-15,1959-08
“祝您幸运”,1959-08-15,1959-08
乘胜前进把增产节约推向更高潮,1959-08-15,1959-08
深入困难地区改变落后面貌,1959-08-15,1959-08
中西医促膝相谈交流经验,1959-08-15,1959-08
良好的开端,1959-08-15,1959-08
敢于到困难的地方去,1959-08-15,1959-08
