今日天气预报（北京地区）,1959-08-01,1959-08
小高炉生铁和转炉钢质量上升,1959-08-01,1959-08
把小高炉生铁和转炉钢的质量再提高一步,1959-08-01,1959-08
京包铁路修复通车,1959-08-01,1959-08
七月采煤计划超额完成,1959-08-01,1959-08
重钢试轧成功轻轨支援煤矿生产,1959-08-01,1959-08
刘少奇主席电贺瑞士国庆,1959-08-01,1959-08
苏联国防部长电贺我建军节,1959-08-01,1959-08
首都举行晚会庆祝建军节,1959-08-01,1959-08
我提出第61次严重警告,1959-08-01,1959-08
纪念“八一”建军节，向人民解放军致敬！,1959-08-01,1959-08
提高港口吞吐能力,1959-08-01,1959-08
全面提高转炉炼钢质量,1959-08-01,1959-08
支援农民战胜干旱保证丰收,1959-08-01,1959-08
让港口车船快速周转,1959-08-01,1959-08
京郊西瓜大量上市,1959-08-01,1959-08
丰都榨菜源源外调,1959-08-01,1959-08
侨乡名茶运销海外,1959-08-01,1959-08
建设中的龙河口水库,1959-08-01,1959-08
转炉炼钢为什么要用热风碱性化铁炉脱硫,1959-08-01,1959-08
“方便街”,1959-08-01,1959-08
去年功夫深  今年收成好,1959-08-01,1959-08
改造自然低产赶高产,1959-08-01,1959-08
新工具在“双抢”中发挥威力,1959-08-01,1959-08
关键在于扎实细致,1959-08-01,1959-08
全国春茧丰收,1959-08-01,1959-08
桑蚕,1959-08-01,1959-08
夏秋蚕茧增产大有可为,1959-08-01,1959-08
养蚕之乡,1959-08-01,1959-08
夏茧图,1959-08-01,1959-08
稻谷丰收  处处入画,1959-08-01,1959-08
广大烈军属得到妥善安排,1959-08-01,1959-08
光荣传统教育开花结果,1959-08-01,1959-08
艰苦朴素作风不减当年,1959-08-01,1959-08
真金要火炼,1959-08-01,1959-08
党，灾民信心和力量的泉源,1959-08-01,1959-08
祖国领空保卫者,1959-08-01,1959-08
正告西方不要把外长会议当儿戏,1959-08-01,1959-08
匈牙利社会主义建设进展迅速,1959-08-01,1959-08
苏城市工矿区建立副食品基地,1959-08-01,1959-08
加干诺娃接受崇高奖赏,1959-08-01,1959-08
我全国学联致电祝贺,1959-08-01,1959-08
我国歌舞团结束在伊拉克演出,1959-08-01,1959-08
中伊友协欢宴伊拉克军队足球队,1959-08-01,1959-08
各国青年代表集会谴责殖民主义,1959-08-01,1959-08
各国青年喜遇同行,1959-08-01,1959-08
竟派大批特务赴维也纳捣乱,1959-08-01,1959-08
在和平的国度里,1959-08-01,1959-08
具有共产主义风格的人,1959-08-01,1959-08
谴责美国唆使老挝当局叛国殃民,1959-08-01,1959-08
指责国大党在喀拉拉邦的政策,1959-08-01,1959-08
阿根廷150万工人罢工,1959-08-01,1959-08
泰国外长到处奔跑招伙,1959-08-01,1959-08
临时最高谘询委员会等机构名单,1959-08-01,1959-08
卡塞姆谈伊拉克国内问题,1959-08-01,1959-08
纽约黑人痛苦不堪忍受,1959-08-01,1959-08
医药费用奇昂老百姓病不起,1959-08-01,1959-08
纽约贫民窟激增,1959-08-01,1959-08
三千万人得不到医疗,1959-08-01,1959-08
纽约哈莱姆区老鼠横行,1959-08-01,1959-08
失业者一家的悲惨遭遇,1959-08-01,1959-08
美国广告,1959-08-01,1959-08
半月国际述评,1959-08-01,1959-08
贫富悬殊的“美国生活方式”,1959-08-01,1959-08
从今年小麦丰收想到的,1959-08-01,1959-08
风能的利用,1959-08-01,1959-08
“八一城”赞,1959-08-01,1959-08
关于“名城赋”,1959-08-01,1959-08
哥哥复员我当兵（歌词）,1959-08-01,1959-08
橡皮船上,1959-08-01,1959-08
筑路战士的歌,1959-08-01,1959-08
永远记住你们的功勋（雕塑）,1959-08-01,1959-08
向开山辟路的军工民工致敬,1959-08-01,1959-08
今日天气预报（北京地区）,1959-08-02,1959-08
鞍钢全力夺取八月生产满堂红,1959-08-02,1959-08
四百对新矿井加快建设,1959-08-02,1959-08
淮南矿七月计划完成得好,1959-08-02,1959-08
战胜炎夏七月高产优质,1959-08-02,1959-08
八月第一天起就抓紧煤炭高产,1959-08-02,1959-08
各地人民庆祝“八一”建军节,1959-08-02,1959-08
解放军领导机关招待各国驻华武官,1959-08-02,1959-08
江阴中稻三类苗大变样,1959-08-02,1959-08
要做到块块丰收,1959-08-02,1959-08
上海纸张产量稳步上升,1959-08-02,1959-08
拉萨泽当间将通航汽船,1959-08-02,1959-08
长得好收得细粒粒归仓 新疆宁夏吉林紧张收割春小麦,1959-08-02,1959-08
“因为我们是人民海军！”,1959-08-02,1959-08
河南水利工程发挥巨大作用,1959-08-02,1959-08
我国女子跳伞破世界纪录,1959-08-02,1959-08
全国自行车赛开幕,1959-08-02,1959-08
水墨淋漓  维妙维肖,1959-08-02,1959-08
德波半年来工业产值有很大增长,1959-08-02,1959-08
各兄弟国家祝贺我建军节,1959-08-02,1959-08
斥美国对外长会议的顽固态度,1959-08-02,1959-08
我对外文协欢宴玻利维亚歌舞团,1959-08-02,1959-08
陈毅副总理先后接见墨西哥和古巴妇女代表团,1959-08-02,1959-08
联欢节和平友谊巨流波澜壮阔,1959-08-02,1959-08
真实地描写我们的新世界和新人物,1959-08-02,1959-08
更好地反映“千里马”时代,1959-08-02,1959-08
工厂农村处处有题材,1959-08-02,1959-08
捷作家制订下厂下乡计划,1959-08-02,1959-08
现实生活丰富了创作源泉,1959-08-02,1959-08
布拉次克的早晨,1959-08-02,1959-08
禁止原子弹氢弹世界大会开幕,1959-08-02,1959-08
老挝当局悍然逮捕苏发努冯,1959-08-02,1959-08
印度总统接管喀拉拉邦政府,1959-08-02,1959-08
缅甸反动势力日益抬头,1959-08-02,1959-08
诽谤改变不了事实,1959-08-02,1959-08
古巴有权不参加美洲外长会议,1959-08-02,1959-08
国际简讯,1959-08-02,1959-08
日本对东南亚经济扩张的新阴谋,1959-08-02,1959-08
党的民族政策的光辉胜利,1959-08-02,1959-08
长白山下一村庄,1959-08-02,1959-08
东北边疆的乐园——延边,1959-08-02,1959-08
延边民歌,1959-08-02,1959-08
九水河畔传佳话,1959-08-02,1959-08
大合唱“长白之歌”,1959-08-02,1959-08
充分挖掘秋茶潜力增产茶叶,1959-08-02,1959-08
绍兴积极革新采茶制茶技术,1959-08-02,1959-08
争取秋茶更大丰收,1959-08-02,1959-08
在茶乡梅家坞,1959-08-02,1959-08
安徽抓紧采制夏茶,1959-08-02,1959-08
双手采茶效率高,1959-08-02,1959-08
保证秋茶丰产丰收的关键,1959-08-02,1959-08
增产各种油漆一千二百多吨,1959-08-02,1959-08
几种新型的油漆,1959-08-02,1959-08
生产更多更好的油漆和颜料,1959-08-02,1959-08
铁红颜料过了质量关,1959-08-02,1959-08
油漆是怎样制造的？,1959-08-02,1959-08
油漆和颜料,1959-08-02,1959-08
赛过妈妈,1959-08-02,1959-08
来自拉丁美洲的艺术和友谊,1959-08-02,1959-08
食品的冷藏,1959-08-02,1959-08
文明行为,1959-08-02,1959-08
庭院之间,1959-08-02,1959-08
名山不在高,1959-08-02,1959-08
今日天气预报（北京地区）,1959-08-03,1959-08
八月份再争煤炭超产,1959-08-03,1959-08
胡志明主席访问新疆,1959-08-03,1959-08
又勤又巧管好经济作物,1959-08-03,1959-08
全力战胜八月高温 增产更多好钢好材,1959-08-03,1959-08
力争更多新厂投入生产,1959-08-03,1959-08
清理半成品消除积压,1959-08-03,1959-08
生产生活一齐抓精力充沛多挖煤,1959-08-03,1959-08
治标治本双管齐下,1959-08-03,1959-08
沈阳提前运出两万车货物,1959-08-03,1959-08
承德建立六个石油厂,1959-08-03,1959-08
河南兴建新闻纸厂,1959-08-03,1959-08
抓紧季节腌晒蔬菜,1959-08-03,1959-08
筏子手,1959-08-03,1959-08
一年增殖牛马羊七百多万头,1959-08-03,1959-08
内蒙古牧民力争牲畜更大丰收,1959-08-03,1959-08
向内蒙古各族牧民学习,1959-08-03,1959-08
提前半月完成薅秧计划,1959-08-03,1959-08
丰年话草原,1959-08-03,1959-08
帮助落后队实现秋季增产,1959-08-03,1959-08
用飞机帮助公社除治棉虫,1959-08-03,1959-08
简明新闻,1959-08-03,1959-08
牧区新事,1959-08-03,1959-08
蒙古将加速建立社会主义物质基础,1959-08-03,1959-08
莫斯科市两年来工业发展加快一倍,1959-08-03,1959-08
波兰青年生产队开展竞赛,1959-08-03,1959-08
举行招待会庆祝建军节,1959-08-03,1959-08
五大洲青年举行和平友谊大游行,1959-08-03,1959-08
要和平友谊，不要仇恨！,1959-08-03,1959-08
“八一”队同客队踢成平局,1959-08-03,1959-08
加拿大文化代表团到京,1959-08-03,1959-08
承认苏联建设成就巨大,1959-08-03,1959-08
苏海运工会代表团到京,1959-08-03,1959-08
今日的开城和板门店,1959-08-03,1959-08
拉丁美洲人民支持古巴反对美国干涉,1959-08-03,1959-08
拉丁美洲反独裁烽火蔓延,1959-08-03,1959-08
号召人民粉碎美国的干涉阴谋,1959-08-03,1959-08
印公众抗议中央接管喀拉拉邦,1959-08-03,1959-08
美国对共产党进行新迫害,1959-08-03,1959-08
不许广岛惨剧重演！,1959-08-03,1959-08
塞浦路斯人民决心争取真正独立,1959-08-03,1959-08
必须消除欧洲和平两大威胁,1959-08-03,1959-08
国际简讯,1959-08-03,1959-08
海地的苦难和斗争,1959-08-03,1959-08
三军官兵抢险救灾英勇顽强,1959-08-03,1959-08
城乡配合进剿病害,1959-08-03,1959-08
四省三市开展除害灭病竞赛,1959-08-03,1959-08
化害为利,1959-08-03,1959-08
慕士塔格登山队人员到京,1959-08-03,1959-08
大规模土壤调查胜利完成,1959-08-03,1959-08
北京百万儿童欢度暑假,1959-08-03,1959-08
赛车场自行车比赛开始,1959-08-03,1959-08
复员军人慢性病疗养院将建成,1959-08-03,1959-08
科学技术集锦,1959-08-03,1959-08
暑假生活一日,1959-08-03,1959-08
列宁党的英勇道路,1959-08-03,1959-08
关于国民经济有计划按比例发展问题,1959-08-03,1959-08
工人阶级的“心事”,1959-08-03,1959-08
女飞行员空投记,1959-08-03,1959-08
插翅高飞,1959-08-03,1959-08
听完向秀丽的故事,1959-08-03,1959-08
关于摘章引句,1959-08-03,1959-08
不光是字和词的问题,1959-08-03,1959-08
读者作者编者,1959-08-03,1959-08
喂鸡（国画）,1959-08-03,1959-08
湖上新潮,1959-08-03,1959-08
今日天气预报（北京地区）,1959-08-04,1959-08
千百万人展开伟大的抗旱斗争,1959-08-04,1959-08
冶金部推广先进洗煤经验,1959-08-04,1959-08
赶前不赶后紧紧抓开头,1959-08-04,1959-08
把采好的煤尽快运出去,1959-08-04,1959-08
抓紧洗煤这一关,1959-08-04,1959-08
确保机械工业完成跃进计划,1959-08-04,1959-08
上海搪瓷业大闹厂际竞赛,1959-08-04,1959-08
协助农村增产副食品,1959-08-04,1959-08
皆大欢喜,1959-08-04,1959-08
办试验田破技术关,1959-08-04,1959-08
哈尔滨开展工程质量大检查,1959-08-04,1959-08
锅炉工人巧节煤,1959-08-04,1959-08
来自大同市的倡议,1959-08-04,1959-08
锅周烟道灶,1959-08-04,1959-08
一个省煤的食堂,1959-08-04,1959-08
我家是这样节约用煤的,1959-08-04,1959-08
老红军商店,1959-08-04,1959-08
冬小麦种植区域北移,1959-08-04,1959-08
陕西突击麦地伏耕 甘肃选种又早又快,1959-08-04,1959-08
晋南冬麦播种准备形成热潮,1959-08-04,1959-08
冬播计划落实群众干劲倍增,1959-08-04,1959-08
猪多肥多肥多粮多,1959-08-04,1959-08
茶陵县力争全年全面丰收,1959-08-04,1959-08
伏耕有什么好处,1959-08-04,1959-08
行不止步,1959-08-04,1959-08
乘胜前进,1959-08-04,1959-08
襄阳“三北”岗地小麦增产五成,1959-08-04,1959-08
旱地小麦连年丰收,1959-08-04,1959-08
集中资金加速建设重点工业企业,1959-08-04,1959-08
开展增产竞赛争取更大丰收,1959-08-04,1959-08
赫鲁晓夫下月访美,1959-08-04,1959-08
苏美应该发展和平经济竞赛,1959-08-04,1959-08
接见塞浦路斯文化代表团,1959-08-04,1959-08
各国青年代表强调不容法西斯复活,1959-08-04,1959-08
文艺演出比赛我国节目获奖,1959-08-04,1959-08
保罗·罗伯逊谈笑风生,1959-08-04,1959-08
中奥青年亲密会见,1959-08-04,1959-08
篮球比赛我男子队获亚军,1959-08-04,1959-08
印度尼西亚共产党将举行第六次代表大会,1959-08-04,1959-08
匈牙利国家篮球队在我国结束比赛后赴朝,1959-08-04,1959-08
苏中友协举行纪念活动,1959-08-04,1959-08
我国川剧团赴波捷德等国访问,1959-08-04,1959-08
我一专家获柬勋章,1959-08-04,1959-08
为美侵略政策百般辩解,1959-08-04,1959-08
尼克松到波兰访问,1959-08-04,1959-08
在自动工作线上轧制房屋,1959-08-04,1959-08
波多黎各人民举行示威要求独立,1959-08-04,1959-08
岸政府急于实现日本核武装,1959-08-04,1959-08
日美举行联合军事演习,1959-08-04,1959-08
决心合力击败美国干涉阴谋,1959-08-04,1959-08
要求撤消美国空军基地,1959-08-04,1959-08
古巴新闻界严加谴责,1959-08-04,1959-08
东南亚集团阴谋干涉老挝,1959-08-04,1959-08
国际简讯,1959-08-04,1959-08
伊德尔遭法殖民者折磨致死,1959-08-04,1959-08
悲观和乐观,1959-08-04,1959-08
抨击美国给巴基斯坦军援,1959-08-04,1959-08
引狼入室的危险政策,1959-08-04,1959-08
交河县委加强对落后社队的领导,1959-08-04,1959-08
科学研究为生产服务,1959-08-04,1959-08
重兵指向重点,1959-08-04,1959-08
树雄图  立大志,1959-08-04,1959-08
解放军干部学习文化劲头大,1959-08-04,1959-08
促使卫生工作经常化,1959-08-04,1959-08
国家体委和全国总工会联合举行晚会,1959-08-04,1959-08
党引向胜利,1959-08-04,1959-08
送“关汉卿”访朝,1959-08-04,1959-08
谈相声如何创造形象,1959-08-04,1959-08
得之于集体  还之于集体,1959-08-04,1959-08
三言两语,1959-08-04,1959-08
矿山消息,1959-08-04,1959-08
龙王在井下,1959-08-04,1959-08
人人喜爱“红莲花”,1959-08-04,1959-08
有趣的光,1959-08-04,1959-08
舟山谣,1959-08-04,1959-08
坑口捷报（套色木刻）,1959-08-04,1959-08
今日天气预报（北京地区）,1959-08-05,1959-08
140个重点煤矿产量不断上升,1959-08-05,1959-08
首都集会声援日本人民正义斗争,1959-08-05,1959-08
太钢八月头三天全面报捷,1959-08-05,1959-08
苏美首脑相互访问将促进和平,1959-08-05,1959-08
当前国际政治生活中的重大事件,1959-08-05,1959-08
台风中心将在浙江登陆,1959-08-05,1959-08
日本人民反对美日军事同盟和核武装的新高潮,1959-08-05,1959-08
各地小五金上市量日增,1959-08-05,1959-08
百余种小商品成本下降,1959-08-05,1959-08
七月份生产计划全面完成,1959-08-05,1959-08
水厂多供水用户勤节约,1959-08-05,1959-08
进一步抓紧日用小五金的生产,1959-08-05,1959-08
黔阳专区趁好水放运木材,1959-08-05,1959-08
吉林兴办林产化学工业,1959-08-05,1959-08
伐木场里（木刻）,1959-08-05,1959-08
金笔小常识,1959-08-05,1959-08
提高质量增产金笔,1959-08-05,1959-08
考场上的英雄,1959-08-05,1959-08
山东河北开展秋田超产运动,1959-08-05,1959-08
人民公社好早稻产量高,1959-08-05,1959-08
汕头专区改造落后田四十万亩,1959-08-05,1959-08
黑龙江农民抢收春小麦,1959-08-05,1959-08
四川加强中稻后期管理,1959-08-05,1959-08
麻田的后期管理和麻的沤制技术,1959-08-05,1959-08
多施追肥保证麻类丰收,1959-08-05,1959-08
安徽麻类生产大发展,1959-08-05,1959-08
麻的分布及其用途,1959-08-05,1959-08
收割苎麻,1959-08-05,1959-08
一定要完全禁止核武器和核战争,1959-08-05,1959-08
亚洲及太平洋和委会电贺广岛大会成功,1959-08-05,1959-08
外长会议已获得了一些进展 西方阻碍着许多问题的解决,1959-08-05,1959-08
印度各地人民举行示威,1959-08-05,1959-08
在纽约的波多黎各人示威,1959-08-05,1959-08
老挝当局调集兵力扩大内战,1959-08-05,1959-08
纳赛尔反击“纽约时报”的攻讦,1959-08-05,1959-08
伊拉克工会总联合会书记被逮捕,1959-08-05,1959-08
要对老挝局势进行干涉,1959-08-05,1959-08
企图加紧镇压马来亚民族解放军,1959-08-05,1959-08
日本人民不许广岛惨剧重演,1959-08-05,1959-08
和平友谊思想显示无比强大威力,1959-08-05,1959-08
各国青年举行庆祝晚会,1959-08-05,1959-08
各国欢迎苏美领导人互相访问,1959-08-05,1959-08
十三万旅日朝侨示威要求回国,1959-08-05,1959-08
举行国宴招待王雨田大使,1959-08-05,1959-08
不许阻挠旅日朝侨回国,1959-08-05,1959-08
莫斯科国际电影节开幕,1959-08-05,1959-08
美国各界重视苏美首脑互相访问,1959-08-05,1959-08
举行招待会庆祝建军节,1959-08-05,1959-08
我穆斯林朝觐代表团离摩洛哥去突尼斯,1959-08-05,1959-08
开发杭沙格的青年们,1959-08-05,1959-08
灾害临头舍己为人,1959-08-05,1959-08
把洪水抢走的夺回来,1959-08-05,1959-08
鸿兴饭馆干净利落顾客满意v,1959-08-05,1959-08
到山林草原寻找药用植物,1959-08-05,1959-08
向鸿兴饭馆学习,1959-08-05,1959-08
赛车场自行车锦标赛结束,1959-08-05,1959-08
八省区举行音乐舞蹈汇报演出,1959-08-05,1959-08
拉加里村的新生,1959-08-05,1959-08
谈谈古典文献整理与出版的问题,1959-08-05,1959-08
中华书局陆续整理出版古典文献,1959-08-05,1959-08
三门峡上高歌,1959-08-05,1959-08
小兴安岭战斗的夏天,1959-08-05,1959-08
“活”种庄稼,1959-08-05,1959-08
提倡学而后述,1959-08-05,1959-08
欢迎你，四川省歌舞演出团,1959-08-05,1959-08
蚕儿小传,1959-08-05,1959-08
遍地歌声,1959-08-05,1959-08
今日天气预报（北京地区）,1959-08-06,1959-08
克服右倾情绪厉行增产节约,1959-08-06,1959-08
赫鲁晓夫就苏美首脑相互访问发表声明,1959-08-06,1959-08
北京工业月月超产一跃再跃,1959-08-06,1959-08
八月开门日日红,1959-08-06,1959-08
我东海黄海一带将有大风,1959-08-06,1959-08
重庆二十六万职工大闹对手赛,1959-08-06,1959-08
立志赶先进,1959-08-06,1959-08
前进中的故事,1959-08-06,1959-08
给半成品安排出路,1959-08-06,1959-08
增产更多日用玻璃玻璃,1959-08-06,1959-08
砖造多用炉,1959-08-06,1959-08
锅炉过热器,1959-08-06,1959-08
跃进式火墙,1959-08-06,1959-08
抽屉式蒸笼,1959-08-06,1959-08
访“包锅灶”创造者,1959-08-06,1959-08
苏州专区再争秋季满堂红,1959-08-06,1959-08
增产多少决定于干劲大小,1959-08-06,1959-08
天山南北水稻香,1959-08-06,1959-08
回天之力,1959-08-06,1959-08
红光普照,1959-08-06,1959-08
黄绿之间,1959-08-06,1959-08
人定胜天,1959-08-06,1959-08
各业支援抗旱抗旱推动各业,1959-08-06,1959-08
炳辉县组织抗旱大协作,1959-08-06,1959-08
劳力协作  水源调剂,1959-08-06,1959-08
苏美首脑相互访问有助和平,1959-08-06,1959-08
社会主义国家欢迎苏美首脑相互访问,1959-08-06,1959-08
各国官方欢迎赫鲁晓夫和艾森豪威尔相互访问,1959-08-06,1959-08
美政界和舆论表示欢迎,1959-08-06,1959-08
胡志明主席到达兰州,1959-08-06,1959-08
青年联欢节发表宣言胜利闭幕,1959-08-06,1959-08
和平与友谊不可阻挡,1959-08-06,1959-08
朝鲜展览会在京开幕,1959-08-06,1959-08
继续以革命精神掀起建设高潮,1959-08-06,1959-08
争取提前完成今年生产计划,1959-08-06,1959-08
要把今年增产指标提高到三倍多,1959-08-06,1959-08
禁止氢弹世界大会正式会议开幕,1959-08-06,1959-08
禁止原子弹氢弹世界大会,1959-08-06,1959-08
日本人民和平大军到达广岛,1959-08-06,1959-08
美国制造老挝紧张局势贼喊捉贼,1959-08-06,1959-08
加尔各答二十多万人开大会,1959-08-06,1959-08
印度成立极右政党,1959-08-06,1959-08
伊共中央举行扩大会议,1959-08-06,1959-08
美国和老挝政府含血喷人,1959-08-06,1959-08
英国的“大国地位”和“均势”政策,1959-08-06,1959-08
云锦队党员和群众心齐劲足,1959-08-06,1959-08
好带路人,1959-08-06,1959-08
河北展开技术考察一举两得,1959-08-06,1959-08
学术活动联系实际一例,1959-08-06,1959-08
沈阳纺织厂业余学校逐步巩固,1959-08-06,1959-08
山南翻身农民力争丰收,1959-08-06,1959-08
解放军在东江抗洪救灾中,1959-08-06,1959-08
玉器牙雕巧夺天工,1959-08-06,1959-08
铁的艺术,1959-08-06,1959-08
唐三彩重放异彩,1959-08-06,1959-08
论社会主义企业经济核算,1959-08-06,1959-08
介绍“马克思主义哲学原理”,1959-08-06,1959-08
哪个靠你天吃饭,1959-08-06,1959-08
一把镢头握在手,1959-08-06,1959-08
伸手遮住烈太阳,1959-08-06,1959-08
修水车,1959-08-06,1959-08
地上一队水担,1959-08-06,1959-08
人人都动手,1959-08-06,1959-08
不再靠老天,1959-08-06,1959-08
给抗旱英雄们,1959-08-06,1959-08
渠里的水落了,1959-08-06,1959-08
书记书记不能走,1959-08-06,1959-08
向干旱要粮食,1959-08-06,1959-08
在南极的新交,1959-08-06,1959-08
扑灭“天火”,1959-08-06,1959-08
今日天气预报（北京地区）,1959-08-07,1959-08
战胜灾害  力争丰收,1959-08-07,1959-08
河南全民出征大战旱魔,1959-08-07,1959-08
抗旱到底（原载河南日报）,1959-08-07,1959-08
我东海黄海仍将有大风,1959-08-07,1959-08
湖北人民抗旱夺粮初战大捷,1959-08-07,1959-08
宣战,1959-08-07,1959-08
书记担水上南山,1959-08-07,1959-08
踩起水车像腾云,1959-08-07,1959-08
抓技术革新促高产优质,1959-08-07,1959-08
劲上加巧无往不胜,1959-08-07,1959-08
用煤气代替乙炔切割金属,1959-08-07,1959-08
奇妙的试写机,1959-08-07,1959-08
用蒸汽吹制玻璃,1959-08-07,1959-08
甲壳质的妙用,1959-08-07,1959-08
美术透明唱片,1959-08-07,1959-08
大型烟叶复烤机,1959-08-07,1959-08
自动封口机,1959-08-07,1959-08
木材漂白,1959-08-07,1959-08
自制牙膏原料,1959-08-07,1959-08
焊接玻璃,1959-08-07,1959-08
边远地区传捷报,1959-08-07,1959-08
日用陶瓷和工业陶瓷并举,1959-08-07,1959-08
暴雨中的战斗,1959-08-07,1959-08
横巷公社庄稼样样好块块好,1959-08-07,1959-08
猪场讲卫生  猪肥子孙多,1959-08-07,1959-08
浙江水果丰收在望,1959-08-07,1959-08
承德专区多种桑果多养家畜,1959-08-07,1959-08
南靖山城公社干部田头安营扎寨 泗阳县层层建立棉花高产指挥片,1959-08-07,1959-08
到高潮中去推动高潮,1959-08-07,1959-08
农业部召开烤烟生产汇报会,1959-08-07,1959-08
简明新闻,1959-08-07,1959-08
保证水果大丰收,1959-08-07,1959-08
农林牧副渔全面大丰收,1959-08-07,1959-08
访问美国是为了加强和平,1959-08-07,1959-08
殷切期望结束冷战巩固和平,1959-08-07,1959-08
西德统治集团掩饰不住忧虑 害怕局势缓和使它陷于孤立,1959-08-07,1959-08
捷上半年工业总产值计划超额完成,1959-08-07,1959-08
胡志明主席离兰州去西安访问,1959-08-07,1959-08
波兰决致力于和平和国际合作,1959-08-07,1959-08
尼克松返抵华盛顿,1959-08-07,1959-08
双方直接会谈非常有意义,1959-08-07,1959-08
我青年代表团启程返国,1959-08-07,1959-08
比五金工会代表团到京,1959-08-07,1959-08
在我国访问后回国,1959-08-07,1959-08
广东粤剧院去朝鲜访问,1959-08-07,1959-08
首脑会议必须研究悬而未决问题,1959-08-07,1959-08
要求和平协商的洪流挡不住,1959-08-07,1959-08
四国外长发表声明,1959-08-07,1959-08
日本各地一百多万人集会游行,1959-08-07,1959-08
老挝当前局势越来越危险 希望国际委员会负起责任,1959-08-07,1959-08
必须拯救人类免于核战争威胁,1959-08-07,1959-08
广岛人民沉痛纪念十四年前惨祸,1959-08-07,1959-08
仍然禁止群众集会,1959-08-07,1959-08
国际简讯,1959-08-07,1959-08
为老挝当局发动内战打气,1959-08-07,1959-08
日青年反对岸政府敌视中国,1959-08-07,1959-08
从试验田里找经验指导植棉,1959-08-07,1959-08
坚持种试验田,1959-08-07,1959-08
提高业余学校教学质量,1959-08-07,1959-08
生产领先医药跟上,1959-08-07,1959-08
让科技新成就尽速用于生产,1959-08-07,1959-08
临危不惧抢救国家财产,1959-08-07,1959-08
学习房泽林的无畏精神,1959-08-07,1959-08
4、5、6月份全国行政区划变动情况,1959-08-07,1959-08
周末广州街头,1959-08-07,1959-08
论综合平衡,1959-08-07,1959-08
棉花蕾铃脱落同气象条件的关系,1959-08-07,1959-08
历史研究所第一、二所收集并编纂敦煌资料,1959-08-07,1959-08
中央民族学院研究部编纂民族史资料,1959-08-07,1959-08
土木建筑研究所编写东北木材志,1959-08-07,1959-08
王国维的学术论著已陆续选印出版,1959-08-07,1959-08
筹建全省总工会纪念馆,1959-08-07,1959-08
四川巴中成立革命博物馆,1959-08-07,1959-08
珍贵的“八一”文献,1959-08-07,1959-08
乌恰县山中发现大批波斯银币和金条,1959-08-07,1959-08
要保护出土文物,1959-08-07,1959-08
青海发掘大批古文物,1959-08-07,1959-08
“赵州桥”修复,1959-08-07,1959-08
满山遍野闪金光,1959-08-07,1959-08
大伙儿比我还要早,1959-08-07,1959-08
煤都是宝城,1959-08-07,1959-08
“找”中出门路,1959-08-07,1959-08
白云鄂博抒情,1959-08-07,1959-08
轻歌曼舞动心弦,1959-08-07,1959-08
夺煤大战（套色木刻）,1959-08-07,1959-08
牧笛（套色木刻）,1959-08-07,1959-08
今日天气预报（北京地区）,1959-08-08,1959-08
推动增产节约的新热潮一浪高一浪,1959-08-08,1959-08
皖湘人民协力奋战引水灭灾,1959-08-08,1959-08
全国小麦收购任务已完成77％,1959-08-08,1959-08
抓紧割青沤肥的好时机,1959-08-08,1959-08
北京头六天钢的日产量  比七月增长6.8％,1959-08-08,1959-08
全年计划提前完成,1959-08-08,1959-08
民用煤也要努力节约,1959-08-08,1959-08
建筑企业要着重抓“好”抓“省”,1959-08-08,1959-08
节约民用煤人人有责,1959-08-08,1959-08
以身挡雨救砖坯,1959-08-08,1959-08
收入多也应该节约,1959-08-08,1959-08
为什么买了货不取,1959-08-08,1959-08
节约最光荣,1959-08-08,1959-08
我们革新了标题字架,1959-08-08,1959-08
机械灌溉大有潜力,1959-08-08,1959-08
