天津开展灭蝇灭蚊大战,1959-08-15,1959-08
雨大干劲猛,1959-08-15,1959-08
我国少数民族地区的社会改革,1959-08-15,1959-08
爷爷的胡子,1959-08-15,1959-08
“戴盆何以望天？”,1959-08-15,1959-08
愿无穷花开满江山,1959-08-15,1959-08
骨肉之情,1959-08-15,1959-08
高潮短曲,1959-08-15,1959-08
怎样欣赏诗,1959-08-15,1959-08
和平的土地,1959-08-15,1959-08
今日天气预报（北京地区）,1959-08-16,1959-08
手工业生产迅速恢复发展,1959-08-16,1959-08
中国热烈欢迎苏美首脑相互访问,1959-08-16,1959-08
鞍钢13天超产钢材15000吨,1959-08-16,1959-08
树立先进榜样  鼓舞职工干劲,1959-08-16,1959-08
节约流动资金,1959-08-16,1959-08
人民公社力能胜天,1959-08-16,1959-08
公社修下河网水旱灾害低头,1959-08-16,1959-08
号召掀起增产节约新高潮,1959-08-16,1959-08
河南结合抗旱防治秋蝗,1959-08-16,1959-08
哈尔滨运菜支援北京,1959-08-16,1959-08
工人文工团观摩演出开始,1959-08-16,1959-08
北京商业职工英勇护仓,1959-08-16,1959-08
护库大战,1959-08-16,1959-08
保证仓库安全度过雨季,1959-08-16,1959-08
玉溪增产上等烤烟,1959-08-16,1959-08
河南每天收购百万斤烤烟,1959-08-16,1959-08
吉林鹿茸仔鹿双丰收,1959-08-16,1959-08
今年口蘑长得好,1959-08-16,1959-08
平壤举行阅兵和群众游行,1959-08-16,1959-08
捷农业劳动者与天争粮保证丰收,1959-08-16,1959-08
德意志民主共和国工业生产又传捷报,1959-08-16,1959-08
旅泰越侨定期返国,1959-08-16,1959-08
墨西哥电影代表团在首都同观众见面,1959-08-16,1959-08
锡教师工会代表团到京,1959-08-16,1959-08
伊拉克教师代表团到京,1959-08-16,1959-08
朝鲜举行学生体育大会,1959-08-16,1959-08
陈毅副总理接见阿尔及利亚妇女代表团和突尼斯与新加坡妇女代表,1959-08-16,1959-08
美国普通人民一致赞许,1959-08-16,1959-08
发现新大陆并非偶然,1959-08-16,1959-08
乌拉尔归欧洲高加索属亚洲,1959-08-16,1959-08
在“乌克兰”集体农庄里,1959-08-16,1959-08
老挝人民决为保卫祖国利益战斗到底,1959-08-16,1959-08
美国战车上的枪手,1959-08-16,1959-08
号召民主力量加强团结维护宪法,1959-08-16,1959-08
印度庆祝独立日,1959-08-16,1959-08
不容许破坏国内民主力量,1959-08-16,1959-08
日本将展开广泛活动,1959-08-16,1959-08
国际简迅,1959-08-16,1959-08
谴责美国干涉加勒比海各国内政,1959-08-16,1959-08
反对美国侵犯主权的建议,1959-08-16,1959-08
古巴俘获一架入侵飞机,1959-08-16,1959-08
“美洲国家组织”与美洲外长会议,1959-08-16,1959-08
喝令沙河灌秋田,1959-08-16,1959-08
和老天争夺蔬菜,1959-08-16,1959-08
抗旱前线的蔡书记,1959-08-16,1959-08
锅驼机手杨宝德,1959-08-16,1959-08
无雨也要保丰收,1959-08-16,1959-08
昔日蝗虫窝今日丰产区,1959-08-16,1959-08
积极建设以煤炭生产为中心的自治区工业,1959-08-16,1959-08
喜看荒漠建新城,1959-08-16,1959-08
宁夏诗歌,1959-08-16,1959-08
满腔热情关心人,1959-08-16,1959-08
为了群众的安全,1959-08-16,1959-08
前方后方一条心,1959-08-16,1959-08
宁夏煤炭工业迅速发展,1959-08-16,1959-08
全国各地支援宁夏建设,1959-08-16,1959-08
塞上江南添新景,1959-08-16,1959-08
吉林化工区肥料厂外景,1959-08-16,1959-08
努力增产化肥,1959-08-16,1959-08
为了多产粮食,1959-08-16,1959-08
苦干巧干产量猛增,1959-08-16,1959-08
化学肥料的种类,1959-08-16,1959-08
用什么原料可以生产化肥？,1959-08-16,1959-08
要雷电为人类造福,1959-08-16,1959-08
炮轰冰雹,1959-08-16,1959-08
雀巢孵益鸟,1959-08-16,1959-08
兴家立业新解,1959-08-16,1959-08
织衣鱼,1959-08-16,1959-08
抗旱战歌,1959-08-16,1959-08
大战旱魔（摄影）,1959-08-16,1959-08
看舞剧“石义砍柴”,1959-08-16,1959-08
火柴盒贴纸的美术设计,1959-08-16,1959-08
今日天气预报（北京地区）,1959-08-17,1959-08
骨干工程103个车间基本建成,1959-08-17,1959-08
大批物资驰援抗灾前线,1959-08-17,1959-08
电贺印度尼西亚独立14周年,1959-08-17,1959-08
用最少的人做最多的事,1959-08-17,1959-08
拉萨军民奋勇击退洪水,1959-08-17,1959-08
整顿劳动组织，提高劳动生产率,1959-08-17,1959-08
八九月机械工业要打个大胜仗,1959-08-17,1959-08
赶制轧钢机人字齿轮（木刻）,1959-08-17,1959-08
早走一步运煤过冬,1959-08-17,1959-08
培养新人传宗接代,1959-08-17,1959-08
传宗接代后继有人,1959-08-17,1959-08
军事博物馆在首都建成,1959-08-17,1959-08
雄伟的中国人民革命军事博物馆,1959-08-17,1959-08
本报8月7日社论,1959-08-17,1959-08
海门流动现场会议大鼓干劲,1959-08-17,1959-08
形式,1959-08-17,1959-08
略阳措施加码争取秋粮增产,1959-08-17,1959-08
原来就是他,1959-08-17,1959-08
到群众中交知心朋友,1959-08-17,1959-08
遂川增产竞赛热潮步步高,1959-08-17,1959-08
深入抗旱最前线,1959-08-17,1959-08
向秋蝗展开强大歼灭战,1959-08-17,1959-08
各国青年表示维护和平的共同决心,1959-08-17,1959-08
罗马尼亚化学工业飞速发展,1959-08-17,1959-08
先进工人掀起帮助落后运动,1959-08-17,1959-08
苏联大力养育鸭鹅等家禽,1959-08-17,1959-08
莫斯科电影日热闹非常,1959-08-17,1959-08
密切联系人民推动生产前进,1959-08-17,1959-08
讨论党代会筹备工作问题,1959-08-17,1959-08
苏联帮伊拉克建造船厂,1959-08-17,1959-08
柬皇家社会主义青联代表团到北京,1959-08-17,1959-08
我国青年代表团返抵北京,1959-08-17,1959-08
柬埔寨国家篮球队回国,1959-08-17,1959-08
“在边海河两岸”,1959-08-17,1959-08
在苏维埃各族人民友好的大家庭中,1959-08-17,1959-08
制止美国干涉老挝保障东南亚和平,1959-08-17,1959-08
美洲外长会议上干涉与反干涉斗争激烈,1959-08-17,1959-08
前独裁者在美国逍遥法外,1959-08-17,1959-08
阿本斯号召制止美国重演危地马拉事件,1959-08-17,1959-08
国际简讯,1959-08-17,1959-08
美国钢铁工人的罢工,1959-08-17,1959-08
泰国当局蠢蠢欲动,1959-08-17,1959-08
印度尼西亚共产党“六大”将如期举行,1959-08-17,1959-08
开除四十四名军官的军籍,1959-08-17,1959-08
半月国际述评,1959-08-17,1959-08
新疆各级领导干部坚持参加劳动,1959-08-17,1959-08
一场大辩论鼓起抗旱斗志,1959-08-17,1959-08
旱灾退让了,1959-08-17,1959-08
全运会筹备工作进入紧张阶段,1959-08-17,1959-08
五省跳伞友谊赛结束,1959-08-17,1959-08
全运会比赛和表演项目场地确定,1959-08-17,1959-08
教师暑期生活一日,1959-08-17,1959-08
加强工业对农业的支援,1959-08-17,1959-08
降妖二十字经,1959-08-17,1959-08
修建化铁炉,1959-08-17,1959-08
女英雄“百岁挂帅”,1959-08-17,1959-08
千军万马战旱魔,1959-08-17,1959-08
今日天气预报（北京地区）,1959-08-18,1959-08
充分发挥人民公社的优越性战胜旱、涝、虫等灾害,1959-08-18,1959-08
靠大集体之力  兴大协作之风,1959-08-18,1959-08
丰城县社社合力战胜干旱,1959-08-18,1959-08
中国印度尼西亚人民紧密携手  努力保障印度支那和远东和平,1959-08-18,1959-08
高潮日日涨生产节节升,1959-08-18,1959-08
大冶钢厂日产水平远胜上月唐山钢厂产量质量全面告捷,1959-08-18,1959-08
全年增产节约计划提前完成,1959-08-18,1959-08
充分利用野生植物原料为轻工业大开增产门路,1959-08-18,1959-08
要有发展的观点,1959-08-18,1959-08
丰富的野生植物资源,1959-08-18,1959-08
三笔账驳倒保守思想,1959-08-18,1959-08
防洪保安全雨大也增产,1959-08-18,1959-08
柯柯盐湖札记,1959-08-18,1959-08
江苏人民信心百倍抗击干旱,1959-08-18,1959-08
中共中央、国务院关于展开抗灾斗争的紧急指示,1959-08-18,1959-08
“按图索骥”新解,1959-08-18,1959-08
马家湖大队设置生产指挥图,1959-08-18,1959-08
农业部通知,1959-08-18,1959-08
损失一斤捞回两斤,1959-08-18,1959-08
邓家塘公社掀起晚秋丰产热潮,1959-08-18,1959-08
跃进生产队奋起抗旱,1959-08-18,1959-08
正气驱“旱鬼”,1959-08-18,1959-08
过日子要作长远打算,1959-08-18,1959-08
匈牙利人民乘胜前进掀起生产新高潮,1959-08-18,1959-08
今年铁路运输成绩空前好,1959-08-18,1959-08
第二届全苏运动会胜利闭幕,1959-08-18,1959-08
金日成观看粤剧“关汉卿”,1959-08-18,1959-08
北京纪念台尔曼被害十五周年,1959-08-18,1959-08
波兰的心,1959-08-18,1959-08
有人民的地方就有共产党 阿登纳阻挡不了历史车轮,1959-08-18,1959-08
罗艺术家在京演出,1959-08-18,1959-08
中美会谈延期举行,1959-08-18,1959-08
多项比赛成绩超过西德,1959-08-18,1959-08
战斗在新垦区的人们,1959-08-18,1959-08
加强民族民主运动在斗争中联合起来,1959-08-18,1959-08
苏加诺总统强调反帝平叛乱,1959-08-18,1959-08
反对干涉加勒比各国的内政,1959-08-18,1959-08
古巴武装部队总司令去圣地亚哥,1959-08-18,1959-08
老挝人民奋起反击政府军扫荡,1959-08-18,1959-08
古巴共产党人是最坚定的反帝战士,1959-08-18,1959-08
印度尼西亚共产党总书记宣布,1959-08-18,1959-08
美军违法进入南越,1959-08-18,1959-08
号召实现政府纲领加强民族团结,1959-08-18,1959-08
开展群众文化教育活动,1959-08-18,1959-08
国际简讯,1959-08-18,1959-08
坚决和全体爱国人民一起高举和平、中立、统一、繁荣的旗帜！,1959-08-18,1959-08
不稳定的日本经济,1959-08-18,1959-08
群众文化一朵花,1959-08-18,1959-08
奔驰南北寻找灭蝗治虫途径,1959-08-18,1959-08
柏林大队人增寿田增产,1959-08-18,1959-08
抗旱战线上的共产党员,1959-08-18,1959-08
妥善安排基层单位卫生工作,1959-08-18,1959-08
同窗苦读书异地建家园,1959-08-18,1959-08
全国人民代表大会代表张元济逝世,1959-08-18,1959-08
拿起文化武器反右倾鼓干劲,1959-08-18,1959-08
谈“红旗谱”中朱老忠的形象创造,1959-08-18,1959-08
杰出的短篇“潘虎”,1959-08-18,1959-08
月照东墙,1959-08-18,1959-08
以天下为己任,1959-08-18,1959-08
别具风格的印度尼西亚歌舞,1959-08-18,1959-08
山上运河,1959-08-18,1959-08
今日天气预报（北京地区）,1959-08-19,1959-08
湖北各地公社大协作灭干旱 一举扩大灌溉面积五百万亩,1959-08-19,1959-08
人民公社闪光芒 新疆油粮齐丰收,1959-08-19,1959-08
莲江口公社大显风采,1959-08-19,1959-08
四川湖南开镰收中稻,1959-08-19,1959-08
在大跃进旗帜下夺取新的伟大胜利,1959-08-19,1959-08
上万标兵带头竞赛如火如荼,1959-08-19,1959-08
商业部门大调物资迎三秋,1959-08-19,1959-08
闽浙赣加紧砍运毛竹,1959-08-19,1959-08
拿猫当虎斗,1959-08-19,1959-08
劲上加劲一跃再跃,1959-08-19,1959-08
急起直追力争上游,1959-08-19,1959-08
发展小型造纸工业,1959-08-19,1959-08
四川建成一百多台小型造纸机  河南小纸厂遍及七十四个县市,1959-08-19,1959-08
毛竹,1959-08-19,1959-08
竹排畅流进贤河,1959-08-19,1959-08
本报8月18日社论,1959-08-19,1959-08
嵖岈山人民公社越战越强,1959-08-19,1959-08
宜春专区八百个落后生产队赶上先进,1959-08-19,1959-08
玉米高粱生长茂密茁壮,1959-08-19,1959-08
丢了张老三,1959-08-19,1959-08
力争杂粮大丰收,1959-08-19,1959-08
广西积极蓄水保水防害,1959-08-19,1959-08
人民公社放光彩,1959-08-19,1959-08
丢掉幻想重返祖国,1959-08-19,1959-08
罗马尼亚机器制造工业发展迅速,1959-08-19,1959-08
千方百计节约大量钢铁,1959-08-19,1959-08
陈毅副总理接见智利作家,1959-08-19,1959-08
蒙古各地制定文化进军措施,1959-08-19,1959-08
罗马尼亚音乐家再次公演,1959-08-19,1959-08
泽登巴尔将率代表团访越,1959-08-19,1959-08
莫斯科国际电影节闭幕,1959-08-19,1959-08
美国“冷战”鼓吹者害怕解冻,1959-08-19,1959-08
我川剧团在波演出,1959-08-19,1959-08
卡纳·波加尔到京,1959-08-19,1959-08
索克少将离昆明返国,1959-08-19,1959-08
不识抬举,1959-08-19,1959-08
深厚的友情,1959-08-19,1959-08
老挝局势威胁东南亚和平 国际委员会应当恢复活动,1959-08-19,1959-08
要求采取措施制止老挝内战,1959-08-19,1959-08
支持古巴人民反对美国压迫,1959-08-19,1959-08
扬言美国要出兵干涉老挝,1959-08-19,1959-08
抗议南越当局发动惨无人道的“扫荡”,1959-08-19,1959-08
控告多米尼加独裁者侵犯古巴,1959-08-19,1959-08
印度西孟加拉邦大肆逮捕,1959-08-19,1959-08
扣留一架古巴飞机,1959-08-19,1959-08
美众议院又通过一项敌视我国议案,1959-08-19,1959-08
阿联力图改善同一些阿拉伯国家关系,1959-08-19,1959-08
美国钢铁罢工影响巨大,1959-08-19,1959-08
美国钢铁老板赚钱创空前纪录,1959-08-19,1959-08
国际简讯,1959-08-19,1959-08
美国的加勒比海纵队,1959-08-19,1959-08
中共天水市五十里铺生产队支部工作经验,1959-08-19,1959-08
加强农村党支部的战斗力,1959-08-19,1959-08
及时推广先进经验,1959-08-19,1959-08
党委加强领导教学质量提高,1959-08-19,1959-08
论敢想敢说敢做,1959-08-19,1959-08
谈认真思考,1959-08-19,1959-08
一只眼睛……,1959-08-19,1959-08
果园老萧,1959-08-19,1959-08
牙雕艺人献杰作 “乘风破浪”话龙舟,1959-08-19,1959-08
从“不许客题诗”说起,1959-08-19,1959-08
新闻纪录电影之窗,1959-08-19,1959-08
铺轨,1959-08-19,1959-08
今日天气预报（北京地区）,1959-08-20,1959-08
促进公社发展多种经营 积极建立国营生产基地,1959-08-20,1959-08
江西早稻喜丰收,1959-08-20,1959-08
做好旺季市场购销工作,1959-08-20,1959-08
胡志明主席在京参观游览,1959-08-20,1959-08
农商协作发展多种经营,1959-08-20,1959-08
妇女们，热烈投入增产节约运动！,1959-08-20,1959-08
吴良湖高举集体主义大旗,1959-08-20,1959-08
好“火车头”,1959-08-20,1959-08
速度快慢要看干劲大小,1959-08-20,1959-08
帆船竞发忙运盐,1959-08-20,1959-08
民主十二号轮省煤有方,1959-08-20,1959-08
千吨轮将直驶钢厂,1959-08-20,1959-08
货郎船,1959-08-20,1959-08
起帆滚珠轴承化,1959-08-20,1959-08
曲线的由来,1959-08-20,1959-08
夜班夺煤记,1959-08-20,1959-08
松涛水库开始拦蓄洪水,1959-08-20,1959-08
贵州二十五对煤井施工 内蒙古建设三座大煤井,1959-08-20,1959-08
永登水泥厂完工,1959-08-20,1959-08
郑州砂轮厂部分投入生产,1959-08-20,1959-08
人民公社力量大旱年长出好庄稼,1959-08-20,1959-08
发挥公社威力革新生产过程,1959-08-20,1959-08
深夜车水浇旱田（河南长葛速写）,1959-08-20,1959-08
合理，更合理！,1959-08-20,1959-08
西藏农民欢欢喜喜迎接丰收,1959-08-20,1959-08
简明新闻,1959-08-20,1959-08
夺回损失的粮食,1959-08-20,1959-08
吉林加强大豆田间管理,1959-08-20,1959-08
给向日葵授粉,1959-08-20,1959-08
福建春花生登场,1959-08-20,1959-08
内蒙古杏核丰收,1959-08-20,1959-08
贵州积极抚育油桐和油茶,1959-08-20,1959-08
结合生产组织一次卫生大检查,1959-08-20,1959-08
把卫生运动更普遍深入地开展起来,1959-08-20,1959-08
沪汉沈宁发动卫生突击战,1959-08-20,1959-08
茶卡公社党委领导深入具体,1959-08-20,1959-08
抓政治思想抓科学技术,1959-08-20,1959-08
北京清洁工人比干劲,1959-08-20,1959-08
全国人民代表大会代表冷遹逝世,1959-08-20,1959-08
苏越两国人民掀起劳动竞赛热潮,1959-08-20,1959-08
苏美首脑互访有助于缓和国际局势,1959-08-20,1959-08
苏联推广分期付款售商品,1959-08-20,1959-08
苏联帮助印度尼西亚建设,1959-08-20,1959-08
我国将从摩洛哥输入磷酸盐,1959-08-20,1959-08
捷政府向美国提出抗议,1959-08-20,1959-08
捷政府向美国提出抗议,1959-08-20,1959-08
节约旗手米利塔鲁,1959-08-20,1959-08
匈牙利思想战线上的斗争,1959-08-20,1959-08
呼吁迫使美国和老挝政府停止内战,1959-08-20,1959-08
呼吁迫使美国和老挝政府停止内战,1959-08-20,1959-08
美国找借口干涉古巴阴谋受挫,1959-08-20,1959-08
呼吁加强民族队伍的团结,1959-08-20,1959-08
拉丁美洲人民拧成一股劲就不可摧毁,1959-08-20,1959-08
国际简讯,1959-08-20,1959-08
美国钢铁工人坚持罢工,1959-08-20,1959-08
扩充军备美国总统拨巨款 分赃不匀海陆空军大争吵,1959-08-20,1959-08
美国钢铁工人的罢工斗争,1959-08-20,1959-08
关于小麦丰产的若干问题,1959-08-20,1959-08
谈才能与学习,1959-08-20,1959-08
“加以”是没有生命的字眼吗？,1959-08-20,1959-08
在英雄们面前,1959-08-20,1959-08
杭州风物,1959-08-20,1959-08
随感录,1959-08-20,1959-08
关于“乃”字的用法,1959-08-20,1959-08
穿过皖南翠绿的山群……,1959-08-20,1959-08
天旱地不干,1959-08-20,1959-08
新书,1959-08-20,1959-08
今日天气预报（北京地区）,1959-08-21,1959-08
福建早稻增产公社立下大功,1959-08-21,1959-08
全国钢铁生产步步高升,1959-08-21,1959-08
河南水利工程大收抗旱效益  淮北纵横河网源源送水灌田,1959-08-21,1959-08
一定能够战胜虫灾,1959-08-21,1959-08
利用大厂边材增加小厂原料,1959-08-21,1959-08
充分有效地利用边角余料,1959-08-21,1959-08
江苏等地抓紧提前运输,1959-08-21,1959-08
一台机床两面红旗,1959-08-21,1959-08
六年不出废品的人,1959-08-21,1959-08
各地准备收购秋茶,1959-08-21,1959-08
河北七个月生产火硝二百多万斤,1959-08-21,1959-08
火硝,1959-08-21,1959-08
超产十万吨煤,1959-08-21,1959-08
从质量事故中吸取教训,1959-08-21,1959-08
不辞辛劳为别人,1959-08-21,1959-08
旧乐器的新生,1959-08-21,1959-08
技术革命和技术革新的区别？,1959-08-21,1959-08
节省一半钱,1959-08-21,1959-08
多为旅客想,1959-08-21,1959-08
因地制宜制订种麦计划  增产措施落实到队到田,1959-08-21,1959-08
陕西青年农民力争秋粮丰产,1959-08-21,1959-08
多种再多种为己又为人,1959-08-21,1959-08
建立基地增产蔬菜种子,1959-08-21,1959-08
简明新闻,1959-08-21,1959-08
“地瓜公社”,1959-08-21,1959-08
关于甘薯翻藤问题的讨论,1959-08-21,1959-08
我们的怀疑,1959-08-21,1959-08
再谈甘薯翻藤的坏处,1959-08-21,1959-08
抢收中稻（速写）,1959-08-21,1959-08
苏联兴办多种技术学校培养新工人,1959-08-21,1959-08
加强团结争取越南和平统一,1959-08-21,1959-08
王维舟报告访波之行,1959-08-21,1959-08
北京三个工厂职工隆重集会,1959-08-21,1959-08
蒙古人民军英雄纪念碑在乔巴山市举行揭幕式,1959-08-21,1959-08
捷大力促进生产机械化自动化,1959-08-21,1959-08
智利作家杨加斯回国,1959-08-21,1959-08
越池——建设中的越南新工业基地,1959-08-21,1959-08
哥伦比亚——中国友协成立,1959-08-21,1959-08
陈毅副总理接见尼泊尔佛教代表团,1959-08-21,1959-08
罗马尼亚石油和石油设备工业的成就,1959-08-21,1959-08
必须遵循日内瓦协议的道路,1959-08-21,1959-08
拉丁美洲声援古巴革命运动日益扩大,1959-08-21,1959-08
美萨集团加紧迫害爱国战线党领导人,1959-08-21,1959-08
朝中方面列举事实痛予揭露,1959-08-21,1959-08
反对“安全条约”争取和平中立,1959-08-21,1959-08
马来亚首次大选揭晓,1959-08-21,1959-08
马来亚的首次大选,1959-08-21,1959-08
希腊当局加紧迫害民主战士,1959-08-21,1959-08
判决摩苏尔叛乱分子,1959-08-21,1959-08
阿联当局进行反共审判,1959-08-21,1959-08
国际简讯,1959-08-21,1959-08
打着“不干涉”幌子的美国干涉者,1959-08-21,1959-08
中国共产党中央委员会向第八次全国代表大会的政治报告,1959-08-21,1959-08
走在前头给群众鼓劲,1959-08-21,1959-08
模范党员申长林,1959-08-21,1959-08
共产党员的本色,1959-08-21,1959-08
党委书记苦钻科学知识,1959-08-21,1959-08
你真像我的亲女儿,1959-08-21,1959-08
降伏旱魔的人,1959-08-21,1959-08
打破人间地狱建设幸福乐园,1959-08-21,1959-08
气势磅礴的沈阳,1959-08-21,1959-08
新城市,1959-08-21,1959-08
欣闻名产上市,1959-08-21,1959-08
一根牛鞭子,1959-08-21,1959-08
三言两语,1959-08-21,1959-08
小青劈桥又搭桥,1959-08-21,1959-08
唱词和字幕,1959-08-21,1959-08
今日天气预报（北京地区）,1959-08-22,1959-08
全国部分受旱地区喜雨,1959-08-22,1959-08
东北三省大秋作物生长良好,1959-08-22,1959-08
刘少奇主席会见胡志明主席,1959-08-22,1959-08
阿富汗副首相将访问我国,1959-08-22,1959-08
快装快卸,1959-08-22,1959-08
每辆货车载重超过四十吨,1959-08-22,1959-08
铁路工厂协作卸车又多又快,1959-08-22,1959-08
云南甘肃保证雨季运输畅通,1959-08-22,1959-08
各地小商品上市量大增,1959-08-22,1959-08
第二次第三类商品交流大会开幕,1959-08-22,1959-08
南京兴建大型热电站,1959-08-22,1959-08
拉萨河上“不落的太阳”,1959-08-22,1959-08
唐山新变电站开始运行,1959-08-22,1959-08
万能汽焊切割机,1959-08-22,1959-08
汽水粉,1959-08-22,1959-08
机器糊信封,1959-08-22,1959-08
矾都多产好明矾,1959-08-22,1959-08
综合利用明矾石,1959-08-22,1959-08
明矾的用途,1959-08-22,1959-08
矾都纪行,1959-08-22,1959-08
做好大牲畜秋季配种工作,1959-08-22,1959-08
募阳公社红旗越举越高,1959-08-22,1959-08
红旗何以越举越高,1959-08-22,1959-08
牲畜多肥料足粮食逐年增加,1959-08-22,1959-08
大牲畜秋配工作进展迅速,1959-08-22,1959-08
人多势众力量强,1959-08-22,1959-08
加强大白菜的苗期管理,1959-08-22,1959-08
胶县人民抗旱抢种大白菜,1959-08-22,1959-08
罗马尼亚工矿企业纷纷实现增产保证,1959-08-22,1959-08
静静顿河畔将耸立“原子巨人” 世界最大的快中子反应堆已投入生产,1959-08-22,1959-08
首都举行电影招待会,1959-08-22,1959-08
越南防洪抗涝斗争获巨大胜利,1959-08-22,1959-08
苏联人民志愿纠察队发挥作用,1959-08-22,1959-08
陆定一副总理接见捷新闻工作者代表团,1959-08-22,1959-08
朝鲜北部对外贸易发展迅速,1959-08-22,1959-08
保加利亚科技合作代表团到京,1959-08-22,1959-08
英皇家学会会长到京,1959-08-22,1959-08
友谊颂,1959-08-22,1959-08
访问“毛泽东”工厂,1959-08-22,1959-08
南越人民奋起声讨美吴集团暴行,1959-08-22,1959-08
联合国无权讨论老挝问题,1959-08-22,1959-08
乌拉圭首都人民大示威,1959-08-22,1959-08
乌拉圭经济情况恶化,1959-08-22,1959-08
号召全力支援钢铁工人大罢工,1959-08-22,1959-08
英国要关掉三分之一煤矿,1959-08-22,1959-08
各国公众要求释放赫卢,1959-08-22,1959-08
法国使馆参赞行为恶劣 阿富汗政府予以驱逐,1959-08-22,1959-08
波恩—巴黎轴心的工业支柱,1959-08-22,1959-08
奇特的婚姻,1959-08-22,1959-08
英法报纸吵得不可开交,1959-08-22,1959-08
阿登纳的报刊帮腔,1959-08-22,1959-08
美国资本加紧渗入印度,1959-08-22,1959-08
生产自动化失业人数增,1959-08-22,1959-08
粮食过剩成灾穷人挨饥受饿,1959-08-22,1959-08
老百姓债台高筑  资本家利润巨大,1959-08-22,1959-08
严格检验药品  提高疗效,1959-08-22,1959-08
保证供应合格的药品,1959-08-22,1959-08
掀起一个声势浩大的增产节约运动,1959-08-22,1959-08
摆有利条件鼓群众斗志,1959-08-22,1959-08
树必胜信心,1959-08-22,1959-08
北京第二个卫生战役开始,1959-08-22,1959-08
冯富和道尔代,1959-08-22,1959-08
我怎样在语文教学中进行思想教育,1959-08-22,1959-08
有病治病无病抗旱,1959-08-22,1959-08
既要看到物质条件更要重视人的作用,1959-08-22,1959-08
学术文化动态,1959-08-22,1959-08
射电天文学——打开宇宙秘密的新钥匙,1959-08-22,1959-08
初秋之果,1959-08-22,1959-08
向上看，也要向下看,1959-08-22,1959-08
抗日民族英雄“杨靖宇”,1959-08-22,1959-08
拉萨卖花女,1959-08-22,1959-08
桨和舵,1959-08-22,1959-08
熔点穆渔,1959-08-22,1959-08
送瘟神,1959-08-22,1959-08
广州越秀山,1959-08-22,1959-08
今日天气预报（北京地区）,1959-08-23,1959-08
抗旱抢救的大部庄稼欣欣向荣,1959-08-23,1959-08
电贺罗马尼亚解放十五周年,1959-08-23,1959-08
庆祝罗马尼亚人民的光荣节日,1959-08-23,1959-08
我提出第62次严重警告,1959-08-23,1959-08
鞍钢五大平炉决超产七万吨好钢,1959-08-23,1959-08
庆祝罗马尼亚伟大的解放节日,1959-08-23,1959-08
武钢生铁焦炭矿石生产节节上升 包钢一号高炉砌砖工程提前完成,1959-08-23,1959-08
想不到变化这样快,1959-08-23,1959-08
广西超包产运动轰轰烈烈展开,1959-08-23,1959-08
抓住有利形势,1959-08-23,1959-08
谢有球是干劲冲天的好社员,1959-08-23,1959-08
贵州人造石油产量猛增五倍,1959-08-23,1959-08
下班以后,1959-08-23,1959-08
武汉化工职工增产节约好,1959-08-23,1959-08
乌江大桥开始架梁,1959-08-23,1959-08
台风警报,1959-08-23,1959-08
重庆夏季卫生运动深入各行各业,1959-08-23,1959-08
罗马尼亚大国民议会隆重举行集会,1959-08-23,1959-08
热烈祝贺罗马尼亚人民取得更大成就,1959-08-23,1959-08
罗马尼亚沿着繁荣幸福的社会主义道路迈进,1959-08-23,1959-08
招待罗马尼亚音乐家,1959-08-23,1959-08
招待瑞典戏剧界和新闻界,1959-08-23,1959-08
盛开的玫瑰,1959-08-23,1959-08
卢森堡钢琴家黄顺经在京举行首次演出,1959-08-23,1959-08
罗马尼亚从法西斯枷锁下解放十五周年,1959-08-23,1959-08
怀念罗马尼亚专家,1959-08-23,1959-08
欢呼罗马尼亚伟大的建设成就,1959-08-23,1959-08
友谊的种子结了果,1959-08-23,1959-08
美丽的布加勒斯特,1959-08-23,1959-08
