没有反复的实践  就没有正确的设计,1965-03-24,1965-03
下楼出院好得很,1965-03-24,1965-03
为革命而画  为工农兵服务,1965-03-24,1965-03
不断革命  不断改造,1965-03-24,1965-03
嘉陵怒潮资产阶级罪恶录〔中国画组画〕,1965-03-24,1965-03
北京地区天气预报,1965-03-25,1965-03
越南南方民族解放阵线中央就美帝在南越扩大战争发表声明不惜一切牺牲抗战到底赶走美国侵略者准备接受五大洲朋友们提供的一切援助,1965-03-25,1965-03
齐奥塞斯库、斯托伊卡、毛雷尔同志担任新职务毛泽东刘少奇朱德周恩来同志致电热烈祝贺林彪陈毅同志电贺罗武装部队部部长和外交部长就任,1965-03-25,1965-03
我党政代表团吊唁乔治乌—德治同志逝世在乔治乌—德治同志灵前献花圈并守灵周恩来同志向罗党中央表示哀悼，向治丧委员会递交悼词,1965-03-25,1965-03
周恩来同志率代表团到布加勒斯特齐奥塞斯库、毛雷尔等党政领导人到机场迎接,1965-03-25,1965-03
全世界人民动员起来，援助南越人民，打败美国侵略者,1965-03-25,1965-03
声讨约翰逊政府的滔天罪行,1965-03-25,1965-03
越《人民报》发表社论向全世界舆论呼吁制止美帝使用毒气屠杀南越人民号召越南军民狠狠打击美国强盗为南方同胞报仇,1965-03-25,1965-03
范文同总理在招待社会主义国家铁路代表团宴会上强调越南人民更加坚定地站在反美斗争前线吕正操部长表示中国人民将采取一切可能措施支持越南兄弟,1965-03-25,1965-03
越南北方军民两天击落敌机五架击伤多架人民军联络代表团抗议美国飞机和别动艇再次轰炸袭击越南领土,1965-03-25,1965-03
亚非舆论怒斥约翰逊政府使用毒气美国刽子手应受国际审判苏丹新闻和劳工部长谴责美国在南越进行毒气战,1965-03-25,1965-03
约翰逊无法无天比希特勒更加凶恶白宫发言人叫嚷美国要在南越继续放手使用毒气麦克纳马拉供认美国三年前就在南越部署化学战,1965-03-25,1965-03
英政府充当美国辩护士想捞到什么？威尔逊竟公然说美国使用毒气不违反日内瓦议定书斯图尔特同美策划“和平解决”妄图使南越人民屈服,1965-03-25,1965-03
美国一直准备在南越使用毒气,1965-03-25,1965-03
坚决反对美帝国主义和西德军国主义纵容纳粹战犯的罪恶勾当我政府声明一切纳粹战犯必须彻底追究,1965-03-25,1965-03
周恩来同志在罗拜会朝代表团,1965-03-25,1965-03
感谢对印度支那人民会议成功的祝贺西哈努克亲王致电周总理,1965-03-25,1965-03
感谢对乌干达政府反击美帝侵略的支持奥博特总理复信周总理,1965-03-25,1965-03
周总理赴罗途中致电奈温主席,1965-03-25,1965-03
周总理赴罗途中致电印度总理,1965-03-25,1965-03
周总理赴罗途中致电伊朗首相,1965-03-25,1965-03
周总理赴罗途中致电土耳其总理,1965-03-25,1965-03
巴基斯坦民间舞蹈团首次演出彭真副委员长观看演出并接见舞蹈团主要成员,1965-03-25,1965-03
阿富汗国王宴请陈毅副总理陈副总理同阿首相副首相继续会谈,1965-03-25,1965-03
我国各地下半旗哀悼乔治乌—德治同志逝世,1965-03-25,1965-03
中共中央候补委员、江西省省长  邵式平同志逝世,1965-03-25,1965-03
美国和南越伪军侵袭柬境罪证如山柬政府邀请国际委员会和外国记者现场观看柬报强调人民绝不会在美帝国主义战争讹诈面前低头,1965-03-25,1965-03
雅加达集会迎接万隆会议十周年大会通过声明强调应把斗争的矛头指向美帝苏班德里约等讲话中一致主张加强反帝斗争,1965-03-25,1965-03
寮方电台谴责美帝及其走狗编造所谓“同兴事件”强烈抗议加、印代表进行非法调查老挝人民武装又击落美国及其走狗飞机一架,1965-03-25,1965-03
一定要把纳粹战犯追究到底,1965-03-25,1965-03
被老挝人民武装打得蒙头转向  美伪军队互相开火死伤数百,1965-03-25,1965-03
阿尤布·汗总统宣誓就职,1965-03-25,1965-03
澳共（马列主义者）代表团团员维达·李特尔夫人慰问我遭到苏联当局迫害的留学生,1965-03-25,1965-03
叙利亚代表团离开武汉到南京,1965-03-25,1965-03
郭沫若副委员长接见日本客人,1965-03-25,1965-03
不能容许西德政府包庇纳粹战争罪犯,1965-03-25,1965-03
智利前副总统夫妇到京,1965-03-25,1965-03
每事问,1965-03-25,1965-03
革命干劲由何而来？——读《关于如何打乒乓球》一文想到的,1965-03-25,1965-03
学习毛主席著作是必不可少的思想建设,1965-03-25,1965-03
在实践中学习,1965-03-25,1965-03
北京地区天气预报,1965-03-26,1965-03
特种战争，要打！特种战争扩大，也打！局部战争，也打！再打五年，也打！再打二十年，也打！打到完全胜利才停止！南越军民坚决同美帝国主义打到底,1965-03-26,1965-03
越南北方军民热烈欢迎越南南方民族解放阵线声明从南方聚集到北方来的同志响应号召随时准备重返南方拿起武器消灭敌人,1965-03-26,1965-03
周总理函纳赛尔总统并请转达阿拉伯各国领导人中国政府和人民坚决支持阿拉伯人民反对美帝西德和犹太复国主义的斗争,1965-03-26,1965-03
毛主席接见叙利亚访华友好代表团,1965-03-26,1965-03
罗马尼亚人民最后送别敬爱的领袖乔治乌—德治同志国葬仪式隆重举行我代表团和其他国家代表团、各国使节参加追悼会和安葬仪式罗马尼亚工人党中央发表讣告悼念乔治乌—德治同志,1965-03-26,1965-03
陈毅副总理电谢阿政府领导人,1965-03-26,1965-03
周恩来同志拜会黄文欢同志,1965-03-26,1965-03
周恩来同志拜会马尔科同志,1965-03-26,1965-03
为陈毅副总理访问阿富汗  我驻阿大使举行盛大招待会加齐元帅、优素福首相和查希尔副首相出席,1965-03-26,1965-03
朴金喆同志回拜周恩来同志,1965-03-26,1965-03
中阿友好合作关系的重大发展,1965-03-26,1965-03
中国阿富汗边界议定书在喀布尔签字中国阿富汗两国经济和技术合作协定、文化合作协定同时签订陈毅副总理查希尔副首相共祝中阿两国友好关系不断巩固发展,1965-03-26,1965-03
陈毅副总理离开阿富汗到达巴基斯坦离喀布尔时查希尔副首相和加齐首席代表等到机场欢送到拉瓦尔品第时受到布托外长和数以万计的居民热烈欢迎陈毅副总理拜会阿尤布·汗总统,1965-03-26,1965-03
彭真市长和夫人张洁清  请非洲各国使节和夫人看《赤道战鼓》,1965-03-26,1965-03
我和大等团体强烈抗议美帝在南越使用毒气约翰逊政府是最凶恶的头号战犯世界人民动员起来粉碎美帝挑衅,1965-03-26,1965-03
越南各群众团体愤怒控诉美帝屠杀南越人民的新暴行决不能饶恕约翰逊政府使用毒气的野蛮行径,1965-03-26,1965-03
各国舆论愤怒声讨美帝在南越使用毒气的疯狂挣扎约翰逊政府更陷孤立将加速最终失败,1965-03-26,1965-03
西方舆论哗然英国意大利公众愤怒示威抗议美国使用毒气西欧和加拿大报纸说约翰逊愚蠢再次失算了,1965-03-26,1965-03
华盛顿慌乱美报哀叹约翰逊使用毒气是损害美国的大错误参议员莫尔斯打约翰逊耳光说美国破坏国际法,1965-03-26,1965-03
“手被斩断心就痛”,1965-03-26,1965-03
强大其貌  怯弱其实,1965-03-26,1965-03
宫本显治总书记号召在参院选举中击败反党修正主义分子破坏阴谋莫斯科三月会议证明修正主义组织路线的破产事实证明修正主义者为肯尼迪约翰逊涂脂抹粉的理论和政策完全错误,1965-03-26,1965-03
修正主义三月一日分裂会议——反对马克思列宁主义和国际共产主义的一个大阴谋阿尔巴尼亚《人民之声报》的文章,1965-03-26,1965-03
罗马尼亚大国民议会举行会议基伏·斯托伊卡当选国务委员会主席,1965-03-26,1965-03
罗党和政府宴请各国代表团,1965-03-26,1965-03
中蒙换货议定书在乌兰巴托签字,1965-03-26,1965-03
我国和也门签订议定书  援助也门建立萨那纺织厂,1965-03-26,1965-03
中国电影周在雅加达隆重开幕,1965-03-26,1965-03
叙利亚代表团离南京到上海,1965-03-26,1965-03
巴勒斯坦解放组织代表团抵杭,1965-03-26,1965-03
我科技代表团和科学文化代表团回京,1965-03-26,1965-03
我政府贸易代表团团长抵布达佩斯,1965-03-26,1965-03
宫本显治同志的夫人离广州回国,1965-03-26,1965-03
阿尔巴尼亚大使馆临时代办  为阿文化代表团访华举行酒会,1965-03-26,1965-03
李先念副总理接见日本客人,1965-03-26,1965-03
我人民外交学会会长宴请智利前副总统,1965-03-26,1965-03
北京地区天气预报,1965-03-27,1965-03
打得好  打得狠  打得准越南军民昨天打落美机十三架人民军总司令部嘉奖和表扬有功军民取得辉煌的胜利何文楼大校强烈抗议美机一再袭击越南北方的严重战争行动,1965-03-27,1965-03
朝鲜政府声明积极响应南越民族解放阵线声明决定提供包括武器在内的一切援助全国开展援越运动，随时应南越人民要求派出志愿人员,1965-03-27,1965-03
日共发表特别声明全力支持越南人民抗美斗争号召日本一切民主力量统一行动反击美国强盗在越南的残暴侵略,1965-03-27,1965-03
我党政代表团拜会罗党政领导人,1965-03-27,1965-03
应阿尔巴尼亚党和政府邀请周恩来同志将率党政代表团访阿地拉那披上节日盛装，工人农民准备热烈欢迎我代表团,1965-03-27,1965-03
欢呼越南军民打得好,1965-03-27,1965-03
毛主席接见巴勒斯坦解放组织代表团,1965-03-27,1965-03
布托外长设宴招待陈毅副总理宾主祝贺标界工作顺利完成和中巴友谊日益发展,1965-03-27,1965-03
我党政代表团在罗马尼亚参观访问周恩来同志谢富治同志接见我驻罗使馆人员和留学生,1965-03-27,1965-03
各党派负责人举行双周座谈会  对当前国内外形势进行了热烈的讨论,1965-03-27,1965-03
黄文欢同志回拜周恩来同志,1965-03-27,1965-03
凯塔总统接见我人大代表团,1965-03-27,1965-03
巴勒斯坦代表团到上海访问,1965-03-27,1965-03
中国巴基斯坦边界议定书签字两国文化合作协定同时签订陈毅副总理布托外长分别代表两国政府签字,1965-03-27,1965-03
南昌各界公祭邵式平同志杨尚奎同志主祭  方志纯同志致悼词,1965-03-27,1965-03
罗瑞卿副总理兼总参谋长  接见击落美制蒋匪侦察机有功人员,1965-03-27,1965-03
活跃在各地报纸上的活思想,1965-03-27,1965-03
发扬革命精神  贯彻造林政策  层层加强领导四川县县植树年年造林全省超额完成春季造林计划，认真加强管理，力争提高成活率,1965-03-27,1965-03
自己动手，育苗造林,1965-03-27,1965-03
从专区到生产队逐级培育树苗雁北专区为大规模植树造林创造了有利条件,1965-03-27,1965-03
一个平原上的村庄能栽多少树  请看十八里屯大队的榜样,1965-03-27,1965-03
发扬联系实际联系群众的革命化设计作风北京上海一万多设计人员深入现场,1965-03-27,1965-03
平地植树大有可为,1965-03-27,1965-03
陕西普降雨雪,1965-03-27,1965-03
朝鲜民主主义人民共和国政府声明庄严宣布无条件地衷心地支持越南南方民族解放阵线的声明,1965-03-27,1965-03
约翰逊发表了满纸谎言和凶恶的声明诡称“美国并不谋求扩大战争”，还要争取“体面的和平”叫嚷美国还要继续进行侵略南越和扩大战争的“军事行动”,1965-03-27,1965-03
朝鲜人民军官兵集会严正警告美帝不要打错算盘保持战备状态支援越南兄弟消灭美国侵略者东京万人集会，宫本显治同志号召援助越南人民，痛击美日反动派,1965-03-27,1965-03
越《人民报》号召青年开展“三准备”运动响应南方同胞战斗号召  奋起保家卫国战胜美帝,1965-03-27,1965-03
越南政府发表声明向全世界控诉美帝使用毒气的滔天罪行越南人民同仇敌忾决心消灭美国侵略者美帝越是凶相毕露就越暴露出它的虚弱,1965-03-27,1965-03
我全国妇联等团体强烈谴责美帝使用毒气罪行约翰逊逃不了全世界人民正义审判,1965-03-27,1965-03
腊斯克妄图粉饰美国新战争罪行  悍然叫嚷要在南越继续使用毒气,1965-03-27,1965-03
亚太和联强烈谴责美国使用毒气  支持越南人民赶走美帝国主义,1965-03-27,1965-03
各国公众舆论愤怒声讨美帝使用毒气罪行世界人民对美帝暴行不能袖手旁观南越人民定能把美国侵略者赶出去,1965-03-27,1965-03
美报哀叹华盛顿处在世界舆论谴责的风暴中美国三千教授学生彻夜示威抗议美国使用毒气巴黎报纸驳斥美国的狡辩并表示很难追随美国的政策,1965-03-27,1965-03
参与美国侵越战争的外来雇佣军,1965-03-27,1965-03
艾地主席指出仅仅一般地反帝已经远远不够亚非团结应以反美斗争精神为基础现代修正主义者说亚非团结意味分裂反帝力量，这是错误的,1965-03-27,1965-03
艾地主席说纳沙贡政党应互相帮助共同前进现代修正主义是帝国主义孪生兄弟,1965-03-27,1965-03
我驻缅大使馆发表声明  斥美联社造谣挑拨中缅关系,1965-03-27,1965-03
巴基斯坦人民热烈庆祝巴基斯坦日临时首都拉瓦尔品第举行盛大的军事检阅,1965-03-27,1965-03
阿富汗全国热烈庆祝农民节  喀布尔一万农牧民集会欢庆,1965-03-27,1965-03
纳赛尔总统宣誓就职,1965-03-27,1965-03
阿尤布·汗总统任命四位部长,1965-03-27,1965-03
我人大代表团在马里两个城市访问,1965-03-27,1965-03
华莱士州长和约翰逊总统,1965-03-27,1965-03
我亚非团结委员会主席  宴请泰国独立运动联络代表,1965-03-27,1965-03
我民航总局副局长宴请印度尼西亚客人,1965-03-27,1965-03
我国际贸易促进委员会副主席宴请奥客人,1965-03-27,1965-03
我作家代表团到日本访问,1965-03-27,1965-03
美国黑人争取民权的长途进军胜利结束三万多人在亚拉巴马州政府大厦外集会示威全国各地连日来不断爆发示威支持塞尔马市黑人斗争,1965-03-27,1965-03
北京地区天气预报,1965-03-28,1965-03
打倒美国强盗和越奸卖国贼！越南军民决战决胜精神万岁！越南祖国战线声明坚决反美抗战到底全力支持越南南方民族解放阵线三月二十二日的声明完全赞同聚集北方的南方儿女必要时回南方消灭敌人,1965-03-28,1965-03
我党政代表团同阿领导人会谈,1965-03-28,1965-03
我国党政代表团  向地拉那烈士墓献花圈,1965-03-28,1965-03
南越军民三月上半月歼敌两千五毙伤美军五十三名，毁伤敌机十四架炮艇八艘,1965-03-28,1965-03
在警卫森严的美国重要军事基地——岘港南越人民武装炸坏一艘登陆舰,1965-03-28,1965-03
周恩来同志率党政代表团到地拉那霍查、谢胡、列希等党政领导人到机场热烈欢迎我党政代表团拜会阿尔巴尼亚党政领导人离罗时齐奥塞斯库、斯托伊卡、毛雷尔等同志到机场送行,1965-03-28,1965-03
办好三结合的样板田，促进农业科学实验运动,1965-03-28,1965-03
国务院召开全国农业科学实验工作会议大力发展样板田  促进农业生产新高潮,1965-03-28,1965-03
理论与实践结合  科学为生产服务农业科学技术工作者上山下乡大种样板田,1965-03-28,1965-03
社会主义时代工农兵英雄人物形象在舞台上大放光彩华北话剧歌剧观摩演出结束周总理等领导人分别观看了各轮演出的一些剧目,1965-03-28,1965-03
国务院举行一百五十四次全体会议通过中国坦桑尼亚友好条约，核准中国坦桑尼亚贸易协定通过设立国家建设委员会，建筑工程部分为建筑工程建筑材料两部,1965-03-28,1965-03
我国南方地区陆续降雨,1965-03-28,1965-03
阿《人民之声报》支持越南南方民族解放阵线中央声明阿尔巴尼亚人民决心同越南兄弟站在一起敦上校和老挝和平中立党代主席表示将同南越战友并肩斗争柬埔寨执政党和印度尼西亚群众团体保证大力声援南越人民,1965-03-28,1965-03
胡志明主席表彰抗击美国空袭的有功人员越报电台欢呼河静横山和白龙尾军民漂亮的歼灭战永灵地区和广平省军民两天击落美机六架击伤多架,1965-03-28,1965-03
美国记者为“特种战争”哀泣漫长岁月无底洞美国直接参战只等闲奈何奈何泰勒太天真放了空炮找不到挽救妙方可悲可悲,1965-03-28,1965-03
阮明芳代理团长举行记者招待会重申消灭美国侵略者的坚定立场越南南方人民拥有正当的自卫权利可以接受包括武器和志愿军的援助,1965-03-28,1965-03
越南南方民族解放阵线对外联络委员会强烈谴责美国使用毒气南越人民不打败美帝就决不放下武器美国侵略者休想用毒气吓倒南越人民,1965-03-28,1965-03
越《人民报》总编辑黄松说约翰逊扩大战争决无出路越南人民只有前进决不后退  坚决同美国侵略者打到胜利,1965-03-28,1965-03
我红十字会等团体抗议美帝在南越使用毒气美帝国主义挽救不了侵越败局,1965-03-28,1965-03
抗议约翰逊侵越政策  美国一妇女在街上自焚,1965-03-28,1965-03
约翰逊多行不义必自毙英法和西德公众舆论谴责美国在南越进行毒气战,1965-03-28,1965-03
希尔主席就澳共（马列主义者）建党一周年发表声明在马列主义的伟大旗帜下团结起来击败没有赫鲁晓夫的赫鲁晓夫主义,1965-03-28,1965-03
中巴友好合作的新发展,1965-03-28,1965-03
陈毅副总理抵卡拉奇受到热烈欢迎巴交通部长举行宴会，陈毅副总理和布托外长讲话共赞中巴友谊,1965-03-28,1965-03
中共中央电贺挪共全国代表大会,1965-03-28,1965-03
挪共第十一次全国代表大会开幕,1965-03-28,1965-03
周恩来团长电谢罗党政领导人,1965-03-28,1965-03
老挝爱国军民取得辉煌战果  三年来共击落美机五十八架辛加坡将军说老挝人民将彻底地赶走美帝,1965-03-28,1965-03
巴勒斯坦解放组织代表团离开我国上海各界集会热烈欢迎巴勒斯坦代表团,1965-03-28,1965-03
廖承志接见并宴请日本美术活动家,1965-03-28,1965-03
我国际贸易促进会主席宴请智利贵宾,1965-03-28,1965-03
芬兰大使向我外交部转达芬政府对周总理电报的答复,1965-03-28,1965-03
庆祝缅甸国防军建军二十周年  缅甸驻华武官举行招待会罗瑞卿副总理应邀出席,1965-03-28,1965-03
奋发图强，攀登科学技术高峰——话剧《飞雪迎春》观后感,1965-03-28,1965-03
精心塑造刘胡兰的英雄形象——话剧《刘胡兰》写作经过,1965-03-28,1965-03
要紧紧地握住这根鞭子——话剧《青松岭》观后感,1965-03-28,1965-03
向业余演员学习,1965-03-28,1965-03
北京地区天气预报,1965-03-29,1965-03
陈毅外长复电春水外长完全支持越南政府立场和南越民族解放阵线声明支援越南人民抗美斗争是中国人民神圣的国际义务,1965-03-29,1965-03
为支援越南人民反抗美国侵略而斗争,1965-03-29,1965-03
河静大捷纪实——越南军民痛击美国空中强盗的光辉一页,1965-03-29,1965-03
我党政代表团同阿党政领导人继续会谈周恩来同志谢富治同志接见我在阿人员和留学生,1965-03-29,1965-03
越南党政代表团回国途中到京  彭真等同志到机场欢迎黄文欢同志,1965-03-29,1965-03
刘少奇主席等领导人观看话剧《女飞行员》,1965-03-29,1965-03
中央工业交通各部设计革命获得巨大成果修改八百个设计项目节约几亿元投资大批设计人员深入现场，吸收群众意见，使基建工程设计达到技术上先进，经济上合理，更加符合多快好省的要求,1965-03-29,1965-03
沈阳拖拉机制造厂敢革陈旧工艺的命把工人的好经验纳入工艺规程八百多项好经验充实了工艺规程，进一步调动了工人的积极性和创造性，有力地促进了生产的发展,1965-03-29,1965-03
发扬共产主义风格  促进比学赶帮竞赛东北制药总厂二车间职工不怕别人超过自己，把自己试验成功的新工艺毫无保留地介绍给兄弟厂，同它们携手前进，为国家生产了更多的药品,1965-03-29,1965-03
各族牧民战胜冬季严寒和干旱  内蒙古接活仔畜二百多万头,1965-03-29,1965-03
表彰藏族战士忠于人民、不畏艰险的革命精神国防部追授普布扎西为“爱民模范”西藏军区在拉萨隆重举行命名大会,1965-03-29,1965-03
为革命，不是为锦标,1965-03-29,1965-03
学习在校  劳动在队  食宿在家扶余县积极推广队办农业中学,1965-03-29,1965-03
简讯,1965-03-29,1965-03
朝鲜祖国统一民主主义战线支持越南南方民族解放阵线声明朝鲜人民誓作兄弟的越南人民的后盾充分作好准备直接支援南越人民战斗,1965-03-29,1965-03
充分显示热爱祖国和决心战胜美国侵略者的英雄气概越南一百五十万青年参加“三准备”运动越妇联号召广大妇女积极参加“三承担”运动投入反美救国行列,1965-03-29,1965-03
东京万人集会示威抗议美国侵略越南刚果（布）《革命之声》说南越人民必将打败美帝及其仆从,1965-03-29,1965-03
抗议美国侵略南越和使用毒气美国和西欧许多城市举行示威游行罗素说美国当局要灭绝南越居民的罪行使人类感到震惊,1965-03-29,1965-03
佐藤政府充当美帝侵略帮凶事实俱在八百名日本人在南越为美国侵略战争效劳,1965-03-29,1965-03
美帝国主义是怎样撕毁日内瓦协议的,1965-03-29,1965-03
西哈努克亲王说美军必须撤出南越不同意罗素提出的召开讨论印度支那问题的日内瓦会议主张,1965-03-29,1965-03
卡拉奇市政委员会宴请陈毅副总理宾主同赞两国友好合作关系的新发展巴基斯坦报纸热烈欢迎中巴边界议定书签字,1965-03-29,1965-03
反对“韩日会谈”，声讨美日反动派和朴集团罪恶活动平壤十五万人举行集会和示威游行南朝鲜群众示威同伪军警发生冲突,1965-03-29,1965-03
印度尼西亚贫民主义阵线举行反帝示威数万人高呼“美国佬，滚回去！”和“粉碎美帝国主义！”口号雅加达和泗水工人分别接管两家美国公司,1965-03-29,1965-03
赫鲁晓夫苏美合作主宰世界主张承继有人苏代表大肆鼓吹建立联合国宪兵部队表示愿意为此出钱以分享对这支反革命武装的控制和指挥别有用心地把印度支那局势和“维持和平行动”扯在一起,1965-03-29,1965-03
美机美舰侵入我领空领海  我提出第三百七十次严重警告,1965-03-29,1965-03
我共青团代表团到达罗马尼亚,1965-03-29,1965-03
中匈今年换货和支付协定签字,1965-03-29,1965-03
叙利亚代表团离上海到杭州,1965-03-29,1965-03
中芬签订一九六五年贸易协定,1965-03-29,1965-03
苏驻美大使求见腊斯克会谈东南亚局势美国国务院发言人对会谈结果表示赞赏,1965-03-29,1965-03
谢富治拜会阿尔巴尼亚内务部长并和赵毅敏参观阿解放斗争博物馆,1965-03-29,1965-03
《南柳党支部工作的好经验》序,1965-03-29,1965-03
南柳党支部怎样活学活用毛主席著作,1965-03-29,1965-03
我取得了水上吹号的“自由”,1965-03-29,1965-03
好事和坏事,1965-03-29,1965-03
认识内外因的辩证关系促进思想革命化,1965-03-29,1965-03
我们的南方永远是英雄的南方,1965-03-29,1965-03
看巴基斯坦民间舞蹈家演出,1965-03-29,1965-03
找错了对象,1965-03-29,1965-03
北京地区天气预报,1965-03-30,1965-03
老挝爱国战线党热烈支持南越民族解放阵线声明老挝人民愿同南越人民并肩战斗反对美帝国主义的一切侵略行动,1965-03-30,1965-03
艾地主席同姚仲明大使会谈印度支那局势时说印度尼西亚人民强烈谴责美帝侵越向越南人民提供支持不会落于人后,1965-03-30,1965-03
越南白龙尾岛军民昨日又获辉煌战果击落美机两架  击退美舰侵袭何文楼大校强烈抗议美帝新的战争行动,1965-03-30,1965-03
邓小平、彭真同志会见由黄文欢同志率领的越南代表团,1965-03-30,1965-03
我党政代表团同阿领导人继续会谈,1965-03-30,1965-03
响应南越民族解放阵线和越南祖国战线声明越南南方人员在河内集会誓师待发越南政府副总理、前南方抗战领导人员范雄、阮维桢等出席集会,1965-03-30,1965-03
阿尔巴尼亚党和政府盛宴欢迎我代表团霍查、谢胡、列希等党政领导人出席谢胡和周恩来同志讲话赞颂中阿两党两国和两国人民的战斗友谊谢胡同志表示阿尔巴尼亚完全支持越南人民反美侵略的正义斗争,1965-03-30,1965-03
商业工作要进一步支援农业,1965-03-30,1965-03
设计方案变一变  节省资金百万元,1965-03-30,1965-03
新疆食糖全部生产自给过去食糖全部依靠外地输入，现在仅石河子糖厂一年生产的食糖，就可供全区每人平均五市斤,1965-03-30,1965-03
李富春薄一波副总理  观看一万二千吨水压机操作表演,1965-03-30,1965-03
湖北全线修整长江汉江荆江堤防内蒙古阿拉善左旗草原建成一项管道引水工程,1965-03-30,1965-03
广东省广州市各界人士  纪念黄花岗七十二烈士殉难五十四周年,1965-03-30,1965-03
