纪念孙中山先生逝世四十周年	北京上海南京广州举行纪念仪式,1965-03-13,1965-03
活跃在各地报纸上的活思想,1965-03-13,1965-03
加强领导  依靠群众  自力更生  艰苦奋斗南北棉区涌现大批棉花高产单位,1965-03-13,1965-03
掌握干旱规律  及早防御干旱,1965-03-13,1965-03
努力攻克医学科学中的顽固堡垒我国肿瘤防治工作取得新成就全国肿瘤学术会议在上海举行，收到论文九百多篇,1965-03-13,1965-03
同干旱“打游击”（编后）,1965-03-13,1965-03
华北区话剧歌剧观摩演出第二三轮结束,1965-03-13,1965-03
模范的服务质量从哪里来——记天桥百货商场的思想工作,1965-03-13,1965-03
艾地主席说不反对美帝就不配称为革命者支持亚非拉留学生反美示威  同情在莫斯科被打伤的学生,1965-03-13,1965-03
约翰逊在扩大战争道路上越走越远拼命增加赌注准备进行新军事冒险西方通讯社透露美国要进一步轰炸越南和增兵南越,1965-03-13,1965-03
原来如此约翰逊总统责怪下来“保护不够”苏联政府如奉圣旨镇压反美示威,1965-03-13,1965-03
西方记者怎么看莫斯科流血事件  十月革命后第一次大怪事,1965-03-13,1965-03
华盛顿受困  新德里着急印度政府和铁托集团一搭一档奔走呼号推销“谈判”诡计妄想解救美国侵越困境,1965-03-13,1965-03
南越中部人民武装半月歼敌七千多人其中有四百八十四名美国侵略者,1965-03-13,1965-03
“空中优势”岂能挽救地面劣势西贡美军发言人承认美机轰炸毫无结果,1965-03-13,1965-03
进一步促进两国文化事业的共同高涨中阿签订文化合作协定执行计划我对外文委主任设宴祝贺两国文化合作新发展,1965-03-13,1965-03
尼雷尔总统接见我大使,1965-03-13,1965-03
苏班德里约副总理接见姚仲明大使,1965-03-13,1965-03
我交通部部长设宴欢迎阿尔巴尼亚交通代表团,1965-03-13,1965-03
我新华通讯社副社长设宴欢迎缅甸通讯社代表团,1965-03-13,1965-03
我政府捐赠索马里一批救济物资,1965-03-13,1965-03
我妇女代表离开布拉柴维尔,1965-03-13,1965-03
纪念叙利亚三月八日革命节  叙驻华使馆临时代办举行招待会,1965-03-13,1965-03
以实际行动反击西德同以色列勾结的决定阿拉伯国家陆续召回大使准备绝交舆论指出美帝是阿拉伯人民痛苦根源和主要敌人,1965-03-13,1965-03
老挝爱国战线党中央发表白皮书揭露美帝在老挝的干涉和侵略活动苏发努冯亲王要日内瓦会议两主席迫使美国遵守日内瓦协议,1965-03-13,1965-03
粗暴干涉阿拉伯国家对西德的严正警告美国公然支持西德同以色列勾结西德继续以断绝“援助”对阿拉伯国家施加压力,1965-03-13,1965-03
罗伯特·威廉呼吁各国人民支持美国黑人斗争强烈谴责约翰逊政府对黑人采取恐怖行动加拿大群众在美总领事馆前示威抗议美国政府镇压黑人,1965-03-13,1965-03
美国塞尔马市黑人的斗争,1965-03-13,1965-03
朝鲜《祖国统一报》编辑部文章谴责美帝拼凑东北亚联盟阴谋号召南朝鲜人民展开强大斗争粉碎“韩日会谈”我十团体致电表示将同朝鲜人民并肩反对美帝制造“韩日会谈”阴谋,1965-03-13,1965-03
不顾当局的禁令和镇压  蔑视约翰逊的伪善呼吁美国黑人争取选举权运动蓬勃发展全国许多地方爆发示威  抗议镇压塞尔马市黑人斗争,1965-03-13,1965-03
在“小而专”、“中而专”的基础上组织机械工业生产,1965-03-13,1965-03
组织起来进行专业化生产的优越性,1965-03-13,1965-03
专业化生产为技术革新开辟了道路,1965-03-13,1965-03
人与人的关系的新变化,1965-03-13,1965-03
分厂就是好,1965-03-13,1965-03
织布机旁三姐妹,1965-03-13,1965-03
谁是那个好娃娃？,1965-03-13,1965-03
应该区别对待古典文学作品,1965-03-13,1965-03
“这点儿东西”缺不得——话剧《俩师徒》观后感,1965-03-13,1965-03
毛泽东时代的妇女（曲谱）,1965-03-13,1965-03
北京地区天气预报,1965-03-14,1965-03
改造山  山低头  改造河河变样  改造地地增产临沂地区人民发扬革命精神顽强不懈征服自然,1965-03-14,1965-03
做社会主义时代的新愚公——评临沂地区改造自然的成功经验,1965-03-14,1965-03
美国强盗在越南南方所有战场上都陷入狼狈挨打境地南越军民上月歼敌一万八,1965-03-14,1965-03
周恩来总理电贺印度支那人民会议胜利闭幕,1965-03-14,1965-03
反美示威中被殴打重伤的我留学生继续遭到苏联当局骇人听闻的迫害我留学生黄照庚在医院惨遭毒打，唐必铭遭苏便衣人员持枪恫吓我驻苏联大使馆人员向苏联当局提出抗议,1965-03-14,1965-03
新共总书记威尔科克斯同志到京邓小平彭真康生等同志到机场热烈欢迎,1965-03-14,1965-03
周总理接见阿尔巴尼亚客人,1965-03-14,1965-03
大米小传,1965-03-14,1965-03
毛主席说：“愚公移山，改造中国，厉家寨是一个好例。”且听：新愚公畅谈移山——厉家寨贫农社员座谈纪要,1965-03-14,1965-03
澳大利亚《先锋报》谴责苏联当局袭击示威者和向美国政府道歉谁继续执行赫鲁晓夫修正主义方针谁就一定遭到赫鲁晓夫同样的命运,1965-03-14,1965-03
亚非拉公众舆论抗议约翰逊政府在印度支那的军事冒险美帝胆敢扩大战争将是它在亚洲的末日罗《火花报》说美国政府必须停止侵略并从南越撤出美国武装力量,1965-03-14,1965-03
罗马尼亚举行大国民议会选举,1965-03-14,1965-03
苏发努冯亲王向富马建议举行三方会谈要解决老挝问题必须制止美国侵略,1965-03-14,1965-03
欢迎阿尔巴尼亚两代表团访华  中阿友协举行招待会周恩来总理出席  宾主共祝中阿战斗友谊,1965-03-14,1965-03
印度尼西亚农民阵线代表团到京,1965-03-14,1965-03
印度尼西亚农园工会代表团抵京,1965-03-14,1965-03
越南《人民报》痛斥约翰逊在戴维营策划扩大战争美国有飞机越南有打下飞机的武器美侵略者敢到哪里就在哪里消灭它越第四军区准备击落更多美机  广平永灵军民又擒飞贼一名,1965-03-14,1965-03
在莫斯科学习的亚洲非洲拉丁美洲学生继续相互探望慰问被苏军警打伤的学生,1965-03-14,1965-03
阿拉伯国家舆论揭露美国是西德勾结以色列的幕后操纵者抨击美帝企图在阿拉伯推行新殖民主义的黎波里群众示威抗议美国和西德敌视阿拉伯国家的政策艾哈德不顾阿拉伯国家的强烈抗议悍然派遣特使到达以色列密谋建交,1965-03-14,1965-03
以色列一再对叙利亚挑衅,1965-03-14,1965-03
加纳学生在美使馆前举行反美示威巴马科报纸支持马里工人反对美帝国主义的立场津巴布韦非洲民族联盟领导人斥责美帝侵略活动,1965-03-14,1965-03
美国各地示威抗议军警野蛮镇压黑人加拿大公众继续在美总领事馆前示威抗议美政府血腥暴行阿报谴责华盛顿口喊“民主”、“自由”而干的是残暴镇压,1965-03-14,1965-03
抗议日自卫队到冲绳受美游击战训练冲绳民主力量举行游行示威,1965-03-14,1965-03
支持阿拉伯人民的正义立场,1965-03-14,1965-03
日共《赤旗报》揭露佐藤政府加紧复活军国主义号召展开反对“三矢计划”的斗争,1965-03-14,1965-03
在南越的美国侵略军,1965-03-14,1965-03
岘港——美国在南越的重要基地,1965-03-14,1965-03
美国在南越侵略军人数逐年增加,1965-03-14,1965-03
“斯特利—泰勒计划”,1965-03-14,1965-03
“战略村计划”,1965-03-14,1965-03
在设计工作中认真学习马克思主义的认识论,1965-03-14,1965-03
前人的经验并非神圣不可侵犯,1965-03-14,1965-03
标准图纸也是不断发展的,1965-03-14,1965-03
“本本”跟个人主义是“亲兄弟”,1965-03-14,1965-03
不能轻视工人创造的“土”办法,1965-03-14,1965-03
实行节约必须实事求是,1965-03-14,1965-03
蓑衣坝给我们的启示,1965-03-14,1965-03
到劳动人民中去求“真知”（编后）,1965-03-14,1965-03
编后,1965-03-14,1965-03
开路,1965-03-14,1965-03
阔步前进,1965-03-14,1965-03
阿妈在学习,1965-03-14,1965-03
旧社会苦井万丈深——资产阶级罪恶录,1965-03-14,1965-03
北京地区天气预报,1965-03-15,1965-03
何文楼大校急电越南国际委员会强烈抗议美伪对越南北方采取新的战争行动越南人民军昨击落敌机一架,1965-03-15,1965-03
最大的愤慨，强烈的抗议,1965-03-15,1965-03
毛主席会见威尔科克斯、威廉斯、希尔等同志同新西兰澳大利亚同志进行了亲切的谈话，并设宴招待,1965-03-15,1965-03
最强烈抗议苏联政府迫害反美游行的学生！向返回祖国的留学生表示亲切慰问和敬意！我政府接回四名重伤留苏学生进行治疗,1965-03-15,1965-03
“云南小粮仓”的喜讯——从宜良坝子看云南农业生产大好形势,1965-03-15,1965-03
浙江在春季造林中认真贯彻各项政策坚持落实林权  促进林业发展湖南普遍建立造林样板山，以活样板推动造林工作,1965-03-15,1965-03
物资部门要当好工业生产的“后勤部”武昌组成综合服务队，直接下厂服务，综合供应物资，及时帮助工厂解决了近百个难题，并对工厂合理使用物资起了促进作用，很受工厂欢迎,1965-03-15,1965-03
南宁各族各界一千多人集会庆祝广西僮族自治区成立七周年,1965-03-15,1965-03
全国美展西南地区作品开始展出不少反映现实生活的好作品受到首都美术界重视,1965-03-15,1965-03
五名运动员刷新两项速滑全国纪录其中两名选手超过今年世界速滑比赛两项第一名的成绩,1965-03-15,1965-03
北京农业劳动大学开学,1965-03-15,1965-03
天津建立半工半读师范学院,1965-03-15,1965-03
燕子衔泥垒大窝,1965-03-15,1965-03
编者按,1965-03-15,1965-03
给水带上了笼头,1965-03-15,1965-03
吃地瓜的肚子吃上了大米,1965-03-15,1965-03
从受难沟到幸福沟,1965-03-15,1965-03
越《人民报》号召武装力量发扬英雄传统不断提高战斗力坚决粉碎美帝挑衅保卫北方支援南方南越解放军再次炮轰德和伪军师部西贡学生走上街头示威抗议美海军陆战队进入南越,1965-03-15,1965-03
约翰逊赞赏铁托策划“和谈”并要铁托使其他国家“谅解”美国侵略越南,1965-03-15,1965-03
配合美国扩大战争进行讹诈美泰举行“反叛乱训练演习”,1965-03-15,1965-03
日共《赤旗报》号召加强支援越南人民斗争美国鼓吹“谈判”是为猖狂侵略打掩护意大利挪威群众在美使馆前举行示威抗议美国侵略越南,1965-03-15,1965-03
英报说美国脚踩流沙  西德报纸反对参加肮脏战争世界人民唾弃美国到处都打美国使馆美国放肆行径使任何谈判成为不可能法刊指责美国在南越步步扩大战争,1965-03-15,1965-03
加纳报纸怒斥美国镇压黑人的纳粹式暴行加拿大多伦多群众在美领事馆前示威三天三夜,1965-03-15,1965-03
约翰逊难矣哉！既要扩大侵越战争但又担心前途莫测居然妄想越南人民放弃斗争乞求谈判,1965-03-15,1965-03
阿拉伯世界坚决反击美帝反阿拉伯阴谋苏丹两万人举行盛大集会和示威游行谴责西德同以色列建交的决定纳赛尔总统重申反击决心  本·贝拉总统赞扬纳赛尔态度叙利亚新闻部长和阿拉伯国家舆论谴责美国同西德扶植以色列阴谋,1965-03-15,1965-03
我亚非团结委员会和伊斯兰教协会支持阿拉伯人民反对美帝唆使西德武装以色列,1965-03-15,1965-03
苏发努冯亲王要求右派和富马不再为美国政策效劳再次建议三方会谈恢复民族团结政府冯沙万说富马停火建议是为掩护美国扩大侵略战火,1965-03-15,1965-03
苏加诺总统重申决心粉碎“马来西亚”美国政策不得人心  反美是普遍情绪印度尼西亚公众愤怒谴责美国对“马来西亚”提供军事“援助”,1965-03-15,1965-03
冯维希指出印度支那人民会议打击了美帝侵略活动号召加强团结更坚决有力进行斗争,1965-03-15,1965-03
在美国指使下同蒋帮加紧勾结佐藤政府决定给蒋帮巨额贷款,1965-03-15,1965-03
应陈毅副总理兼外长邀请来我国进行友好访问叙利亚访华友好代表团到广州广东省省长陈郁设宴招待全体叙利亚贵宾,1965-03-15,1965-03
参加来比锡博览会八百周年庆祝活动后我政府代表团回到北京,1965-03-15,1965-03
我驻赞比亚大使到达卢萨卡,1965-03-15,1965-03
阿根廷精神病学家到京,1965-03-15,1965-03
反对“日韩会谈”  要求废除“日韩基本条约”一万三千旅日朝侨举行大会要求美帝立即撤出南朝鲜东京各界二千人集会号召加强团结进一步展开斗争,1965-03-15,1965-03
陈毅副总理接见缅甸通讯社代表团,1965-03-15,1965-03
在样板田上发展农业科学,1965-03-15,1965-03
小麦锈病的药剂防治,1965-03-15,1965-03
应用“灭蚕蝇”防治柞蚕寄生蝇的经验,1965-03-15,1965-03
从谷粒谈起,1965-03-15,1965-03
播革命的种子,1965-03-15,1965-03
钢八连赞（歌词）,1965-03-15,1965-03
在文艺阵地上,1965-03-15,1965-03
抗洪斗争的凯歌——看话剧《战洪图》的感想,1965-03-15,1965-03
刘胡兰永远活在我们心中,1965-03-15,1965-03
北京地区天气预报,1965-03-16,1965-03
河北创造依靠群众治水的卓越范例宣惠河疏浚工程作到多快好省,1965-03-16,1965-03
在十四十五两日反击美伪空袭战斗中获大胜利越人民军击落敌机六架击伤多架,1965-03-16,1965-03
应阿富汗、巴基斯坦、尼泊尔政府邀请陈毅副总理将访问亚洲三国,1965-03-16,1965-03
郭沫若副委员长和有关方面负责人亲切慰问遭受苏联当局迫害的四名重伤学生陈子平大使到医院亲切慰问我四名重伤留苏学生,1965-03-16,1965-03
首都各大医院著名医师会诊四名重伤留苏学生,1965-03-16,1965-03
叙利亚访华友好代表团到达北京陈毅副总理宴请贵宾并举行会谈陈毅副总理在宴会上表示中国坚决支持阿拉伯人民反帝斗争哈桑·穆拉维德部长谴责美帝同以色列勾结侵犯阿拉伯人民,1965-03-16,1965-03
实行三结合设计  促进设计革命化,1965-03-16,1965-03
既帮耕读小学教师教书  又向耕读小学教师学习花观村全日制小学教师实行这个办法后，提高了耕读小学的教学质量，推动了全日制小学的教学改革,1965-03-16,1965-03
帮得好，学得更好,1965-03-16,1965-03
帮助了别人  提高了自己,1965-03-16,1965-03
我国新建一座现代化大型化肥厂河北化肥厂第一期工程建成投入生产,1965-03-16,1965-03
简讯,1965-03-16,1965-03
中兴公社太平大队抗旱播种保苗增产的先进经验——吕和耕作法看天时，定作物比例  看雨情，定播种顺序  看墒情，定播种方法,1965-03-16,1965-03
灵活机动的战略战术,1965-03-16,1965-03
黑龙江干旱地区推广“吕和耕作法”,1965-03-16,1965-03
早稻不烂秧  在人不在天湖南邵阳地区一百零五个单位早稻育秧经验的调查,1965-03-16,1965-03
澳共（马列主义者）中央分别致电苏美大使苏联镇压反美示威是为美帝帮忙美国扩大战争挽救不了可耻失败,1965-03-16,1965-03
日共《赤旗报》揭露约翰逊扩大侵越战争阴谋谴责美国制造“第二个朝鲜战争”毛里塔尼亚总统表示保证支持越南民主共和国,1965-03-16,1965-03
美国报刊惊呼反美浪潮席卷全球华盛顿扩大侵略战争失尽人心约翰逊内外交困成了孤家寡人,1965-03-16,1965-03
阿拉伯国家外长会议决定立即召回驻波恩大使支持阿联立场准备同西德绝交苏丹人民示威谴责美国西德勾结以色列与阿拉伯人民为敌,1965-03-16,1965-03
以色列悍然决定同西德建交,1965-03-16,1965-03
寮方电台揭露美帝及其走狗加紧准备进攻解放区号召粉碎美帝扩大战争阴谋赫芒人民武装力量痛歼窜犯土匪  解放区相继集会怒讨美机轰炸罪行,1965-03-16,1965-03
西哈努克亲王驳斥西方反华谰言只有美国帝国主义而根本不存在“中国帝国主义”,1965-03-16,1965-03
锡总理谴责美英干涉锡竞选揭露反对党制造恶毒的反华谰言欺骗人民,1965-03-16,1965-03
中非友协副会长宴请索马里议员,1965-03-16,1965-03
结束在越南的友好访问我纺织工业代表团离河内回国,1965-03-16,1965-03
谴责约翰逊政府迫害黑人纵容种族主义暴行美全国各地连日爆发大规模抗议示威加拿大和英国学生三千人在美驻加大使馆前示威抗议美国当局镇压黑人,1965-03-16,1965-03
陈永康在常熟  ［报告文学］,1965-03-16,1965-03
北京地区天气预报,1965-03-17,1965-03
我外交部照会苏使馆  断然拒绝苏联歪曲事实颠倒是非的照会坚决抗议苏政府镇压反美游行迫害中国留学生,1965-03-17,1965-03
越南《人民报》发表社论号召军民提高决战决胜精神谴责美机侵入越南北方的内地越人民军联络代表团强烈抗议美伪飞机、军舰的新侵犯,1965-03-17,1965-03
随时准备战斗！随时准备参军！随时准备到任何地方去战胜任何敌人！越南百万青年决心消灭美国侵略者,1965-03-17,1965-03
我国人大代表团到达几内亚几内亚国民议会议长等到机场欢迎,1965-03-17,1965-03
周恩来总理接见法国记者,1965-03-17,1965-03
坚决粉碎美国强盗的战争讹诈！,1965-03-17,1965-03
苏联当局迫害我留学生罪证如山不容抵赖首都各大医院著名医师公布黄照庚等四人的病历摘要,1965-03-17,1965-03
陈毅副总理回访叙外长并继续会谈陆定一副总理接见叙利亚代表团团员文化部和对外文委举行文艺晚会欢迎哈桑·穆拉维德外长等贵宾,1965-03-17,1965-03
陆定一副总理陈叔通副委员长李四光副主席慰问遭受苏联当局迫害的留学生在京的越朝阿日等国留学生和贵宁·奔舍那夫人也前往慰问,1965-03-17,1965-03
北方五省市防旱抗旱座谈会提出建议积极防旱抗旱  保证适时春播,1965-03-17,1965-03
一等品质量能不能再提高？吉林省无线电厂职工发扬不断革命精神，克服故步自封思想，把原来认为不能再提高的半导体收音机一等品的质量一再提高,1965-03-17,1965-03
日新又日新,1965-03-17,1965-03
黄河下游堤防春修工程开工,1965-03-17,1965-03
越南祖国战线中央就全国反美日十五周年发表号召书三千万越南人民坚决击败美国侵略者越人民军全体指战员决心为消灭美帝及其走狗战斗到底,1965-03-17,1965-03
可笑的悲剧登陆岘港美军没有打仗先倒一批,1965-03-17,1965-03
约翰逊亲自加紧策划扩大侵越战争美陆军参谋长承认轰炸越南未曾“改变潮流”但又叫嚷要下更大赌注,1965-03-17,1965-03
比利时共产主义学联支持越南人民斗争向莫斯科反美示威学生致敬谴责苏联当局镇压示威学生比共中委霍瓦尔特说对美国让步就是鼓励侵略,1965-03-17,1965-03
苏联外交部歪曲事实颠倒是非的照会,1965-03-17,1965-03
在亚非拉到处燃烧的反美的正义怒火在莫斯科竟成了惨遭镇压的“挑衅行动”,1965-03-17,1965-03
对塞尔马市黑人的血腥镇压激起席卷全国的抗议浪潮美国公众在白宫前示威已持续八天,1965-03-17,1965-03
约翰逊“民权法”的最好注解,1965-03-17,1965-03
各国人民决不能坐视美帝疯狂冒险朝报说朝鲜城乡正展开全民运动支持越南人民反美正义斗争日公众领袖说目前最重要的不是谈判而是狠狠打击侵略者英国各地公众继续举行抗议示威要求美帝国主义从南越滚出去,1965-03-17,1965-03
纳赛尔再度当选总统,1965-03-17,1965-03
加强团结对付帝国主义阴谋非洲四国首脑举行会谈,1965-03-17,1965-03
柬外交大臣照会日内瓦会议两主席要求紧急召开柬埔寨问题国际会议,1965-03-17,1965-03
亚非伊斯兰会议闭幕宣言谴责帝国主义和新老殖民主义,1965-03-17,1965-03
应我人民外交学会邀请进行友好访问巴勒斯坦解放组织代表团到广州,1965-03-17,1965-03
波兰两位客人到京,1965-03-17,1965-03
日禁止原氢协访华友好代表团到京,1965-03-17,1965-03
印度尼西亚一位客人赴朝途中路过北京,1965-03-17,1965-03
我代表团参加亚非经济讨论会后回京,1965-03-17,1965-03
我南京杂技团演出在中非共和国受到热烈欢迎达科总统和议长等都观看了演出,1965-03-17,1965-03
支持美国黑人正义斗争,1965-03-17,1965-03
认识要经过反复——学习毛主席关于认识论的一个重要思想,1965-03-17,1965-03
全局观点,1965-03-17,1965-03
为人民服务是最大的幸福,1965-03-17,1965-03
反复实践，不断革新,1965-03-17,1965-03
“亲口吃一吃”,1965-03-17,1965-03
忘了戴安全帽,1965-03-17,1965-03
这种“大方”要不得,1965-03-17,1965-03
颂“好人好事簿”,1965-03-17,1965-03
昆仑汽车兵（二首）,1965-03-17,1965-03
《一颗红心》的诞生,1965-03-17,1965-03
五好战士唱英雄,1965-03-17,1965-03
北京地区天气预报,1965-03-18,1965-03
我国第一套尿素设备在上海试车成功,1965-03-18,1965-03
立壁大队一队发扬大寨精神开展群众性科学实验打破谷子是低产作物的旧观念,1965-03-18,1965-03
谷子高产说明了什么,1965-03-18,1965-03
首都各界群众代表慰问受伤留苏学生在京的亚非留学生和朝鲜大使馆参赞等也前往慰问,1965-03-18,1965-03
刘少奇同志会见希尔等同志,1965-03-18,1965-03
巴勒斯坦解放组织代表团到京我外交学会会长举行宴会欢迎,1965-03-18,1965-03
周恩来总理接见并设宴招待叙利亚贵宾,1965-03-18,1965-03
在设计教学中必须兴无灭资,1965-03-18,1965-03
建筑专业的设计教学存在什么问题？,1965-03-18,1965-03
设计教学要从“实战”要求出发,1965-03-18,1965-03
路子走对了（编后）,1965-03-18,1965-03
实现机关革命化的好榜样黎城县人民武装部获“四好武装部标兵”称号华北局和北京部队领导机关在太原举行授旗仪式,1965-03-18,1965-03
立壁一队种谷记,1965-03-18,1965-03
广东两名女运动员打破两项游泳全国纪录,1965-03-18,1965-03
充分相信工人  增产就有办法国营济南第一棉纺织厂认真学习解放军的民主作风，听取工人意见，采纳工人建议，许多困难问题迎刃而解，全厂迅速出现生产高潮,1965-03-18,1965-03
阮友寿主席号召南越人民扩大斗争连续进攻不抱幻想，坚决打击美国侵略者勇敢前进，胜利必属全越南人民解放军炮击广治伪军司令部  加来省歼美伪军百余名,1965-03-18,1965-03
马里《发展》周刊支持各国人民正义行动全世界人民反美示威理所当然谁要昧着良心就是助长不公正,1965-03-18,1965-03
日共中央代表抗议美国增兵南越和对越南挑衅只有美军撤出越南才能恢复印度支那和平罗马三千群众前往美国使馆示威惨遭当局镇压,1965-03-18,1965-03
南朝鲜两千炮灰运到南越,1965-03-18,1965-03
美帝扩大印度支那战争的又一步骤,1965-03-18,1965-03
中国印度尼西亚签订科学技术合作协定我科技代表团访问印度尼西亚后离雅加达,1965-03-18,1965-03
林彪元帅电贺蒙古建军节,1965-03-18,1965-03
越南百万青年热烈参加“三准备”运动保卫祖国祖国战线中央电贺永灵义安部队击落六架美机的新胜利,1965-03-18,1965-03
我和大和亚非团结委会招待日本朋友宾主谴责美帝侵越并预祝第十一届禁止核弹大会成功郭沫若副委员长和廖承志主席接见日本客人,1965-03-18,1965-03
西哈努克亲王说中国的独立和力量是亚洲人民的骄傲美国害怕中国因它是对美帝的大障碍柬埔寨报纸指出中国忠于自己诺言在帝国主义面前从不退却《缅甸人报》说中国政府和人民一贯坚定支持非洲人民反帝斗争,1965-03-18,1965-03
雅加达文化电影界知名人士和工人群众示威接管美国电影协会办事处艾地主席号召对美帝在科学领域的阴险活动发动攻势,1965-03-18,1965-03
反对美帝在幕后操纵西德和以色列与阿拉伯为敌伊拉克黎巴嫩群众举行抗议示威叙利亚副总理指责美国掠夺阿拉伯资源支持犹太复国主义苏丹公众谴责美帝把以色列当作利剑插入阿拉伯国家心脏,1965-03-18,1965-03
几内亚马里和阿尔及利亚三国总统一致表示坚决挫败帝国主义分裂非洲阴谋,1965-03-18,1965-03
西德报纸哀叹美国的支持不中用西德在中东遭最严重失败,1965-03-18,1965-03
抗议美国石油公司无理解雇工人巴林群岛石油工人连日示威罢工英国当局助纣为虐出动军警残酷镇压示威工人在黎巴嫩的巴林学生谴责美国公司执行一项帝国主义计划,1965-03-18,1965-03
美亚拉巴马州人民坚持反种族压迫斗争蒙哥马利和塞尔马群众示威又遭到当局野蛮镇压加拿大公众抗议美国镇压黑人的运动扩及全国各个地区,1965-03-18,1965-03
约翰逊承认种族歧视是美国“普遍现象”妄想用一纸新的具文麻痹黑人斗争意志,1965-03-18,1965-03
沙家浜〔根据沪剧《芦荡火种》改编〕,1965-03-18,1965-03
试评京剧《沙家浜》的改编,1965-03-18,1965-03
北京地区天气预报,1965-03-19,1965-03
