就美帝国主义新的极其严重的侵略行为越南国防部发表声明严正警告美帝国主义必须立即停止一切挑衅和战争行为号召越南军民提高警惕坚决粉碎敌人的一切卑鄙阴谋,1965-02-08,1965-02
越南南方解放军奇袭波来古大捷毙伤一百多名美国侵略者，击毁二十架美机,1965-02-08,1965-02
由尼雷尔总统访华先遣组负责人巴布部长率领坦桑尼亚政府贸易代表团到京李先念副总理接见  林海云代理外贸部长设宴欢迎,1965-02-08,1965-02
林彪元帅致电金昌凤大将热烈祝贺朝鲜人民军建军节,1965-02-08,1965-02
活跃在各地报纸上的活思想,1965-02-08,1965-02
歌唱各军种兵种的革命英雄事迹空军、铁道兵、内蒙古部队和人民公安部队的业余文艺战士连日演出，赢得首都广大观众的赞赏,1965-02-08,1965-02
简讯,1965-02-08,1965-02
湖北文艺工作者演出大型音乐舞蹈史诗《东方红》,1965-02-08,1965-02
继承“二七”革命传统积极投入生产高潮郑州、武汉和福州等地隆重集会纪念“二七”四十二周年,1965-02-08,1965-02
上海游泳选手打破男子四百米自由泳全国纪录,1965-02-08,1965-02
分析活的典型  提高思想认识向人民解放军学习，抓好活的思想,1965-02-08,1965-02
依靠群众做思想工作向人民解放军学习，抓好活的思想,1965-02-08,1965-02
镰刀快先要思想“快”向人民解放军学习，抓好活的思想,1965-02-08,1965-02
指导思想要正确向人民解放军学习，抓好活的思想,1965-02-08,1965-02
实行社员农忙务农农闲务林的办法黑龙江抚育改造次生林多快好省安徽开展植树造林活动建设稳产高产农田,1965-02-08,1965-02
西哈努克亲王说柬埔寨要自由尊严不要美元呼吁印度支那人民团结起来消灭帝国主义越南南方民族解放阵线热烈赞同召开印度支那人民会议的倡议,1965-02-08,1965-02
柬埔寨决定禁止西方国家记者入境,1965-02-08,1965-02
加强非洲人民在反帝斗争中的团结非洲人组织委员会代表大会开幕,1965-02-08,1965-02
“美援”，见鬼去吧！巴基斯坦报纸抨击美国利用“援助”控制受援国,1965-02-08,1965-02
马桑巴—代巴总统说刚果（布）人民宁死不屈警告美国不要在刚果（布）从事新冒险,1965-02-08,1965-02
国际简讯,1965-02-08,1965-02
世界女子速滑锦标赛结束我国两名选手分别获第十一名、第十二名,1965-02-08,1965-02
朝鲜、阿尔巴尼亚、缅甸报纸分别发表文章支持日本人民反对美国核潜艇进驻斗争,1965-02-08,1965-02
锡兰名城康堤见闻,1965-02-08,1965-02
美帝国主义妄图挽救侵略南越的败局约翰逊政府又一次发动严重的战争挑衅悍然对越南民主共和国进行“报复攻击”,1965-02-08,1965-02
各国人民要求彻底改组联合国马里总统指出联合国组织的精神和活动有严重缺点刚果（布）执政党机关刊说联合国已沦为国际帝国主义的工具巴基斯坦报纸说联合国必须彻底整顿以满足新兴国家的要求,1965-02-08,1965-02
美国黑人领袖马尔科姆·爱克斯发表谈话指出联合国不能代表世界人民，必须改组中国核爆炸是对世界被压迫人民的伟大贡献,1965-02-08,1965-02
阿新建成一座大型文化宫全国城乡文化宫总数增至一千六百座,1965-02-08,1965-02
苏制成一台高速电气机车,1965-02-08,1965-02
古巴建立甘蔗试验田,1965-02-08,1965-02
苏加诺总统主持最高作战司令部会议苏班德里约第一副总理报告访华之行结果各政党团体欢呼击毙南苏拉威西叛乱头目,1965-02-08,1965-02
国际律师团成员托姆再次揭露巴西当局暴行呼吁各国人士动员起来营救中国人员,1965-02-08,1965-02
《马来亚箴言》月刊说帝国主义挽救不了“马来西亚”美英在远东炫耀武力吓不倒任何人各国人民能给帝国主义致命打击,1965-02-08,1965-02
马来亚人民社会主义阵线号召人民反对帝国主义占领“马来西亚”的独立已经成为笑话“马来西亚”当局竟然大肆逮捕爱国人士,1965-02-08,1965-02
刚果（布）刊物谴责美国在非洲进行破坏活动布隆迪同中国断交是美帝国主义阴谋,1965-02-08,1965-02
寮方电台谴责美国非法运进老挝一批战斗机,1965-02-08,1965-02
塔斯社就老挝局势发表声明,1965-02-08,1965-02
罗马尼亚经济建设取得新成就去年工业生产增长百分之十四多，粮食超过前年,1965-02-08,1965-02
坦桑尼亚报纸欢呼尼雷尔总统将访华坦中两国友好关系与日俱增,1965-02-08,1965-02
豫北盐渍土棉麦保苗经验,1965-02-08,1965-02
山区建设必须注意泥石流的危害,1965-02-08,1965-02
饲草生产是发展畜牧业的首要关键,1965-02-08,1965-02
以虫治虫,1965-02-08,1965-02
气象雷达对农业的帮助,1965-02-08,1965-02
确实表达了我们的心愿,1965-02-08,1965-02
鼓足干劲迎高潮,1965-02-08,1965-02
十个苹果,1965-02-08,1965-02
在文艺阵地上,1965-02-08,1965-02
北京地区天气预报,1965-02-09,1965-02
我国政府重申侵犯越南就是侵犯中国中国人民做了准备支援越南反美侵略首都五十万人示威强烈谴责美帝扩大侵越战争,1965-02-09,1965-02
越南人民军两天击落美机十架越南人民军总部表扬有功部队取得光辉胜利,1965-02-09,1965-02
就美机轰炸扫射越南北方的极严重侵略行动发表声明越政府强烈谴责美帝新的战争挑衅河内七万人集会愤怒声讨美帝侵略罪行,1965-02-09,1965-02
国务院副总理兼解放军总参谋长罗瑞卿大将强烈谴责美帝侵略越南北方  中国人民将尽最大努力支持越南人民反美斗争,1965-02-09,1965-02
越南南方民族解放阵线中央主席团发表声明越南南方人民和越南北方人民是一家美帝侵略北方是对全体越南人民挑衅,1965-02-09,1965-02
必须惩罚美国侵略者！,1965-02-09,1965-02
越驻中国使馆临时代办黄北举行记者招待会强烈谴责美帝对越南的战争挑衅,1965-02-09,1965-02
我亚非团结委员会和中越友协分别致电越南有关团体决心同越南人民并肩抗击美帝,1965-02-09,1965-02
热烈庆祝朝鲜人民军建军十七周年朝鲜驻华武官举行招待会贺龙元帅罗瑞卿大将出席招待会宾主热烈赞扬中朝两国人民和军队用鲜血凝成的战斗友谊,1965-02-09,1965-02
六亿五千万中国人民做好一切准备誓为越南人民后盾首都五十万人示威游行抗议美帝侵犯越南热烈庆贺越南军民抗击美帝国主义侵略的伟大胜利,1965-02-09,1965-02
我驻布隆迪大使柳雨峰和使馆人员回到北京陈副总理接见柳雨峰大使和全体人员,1965-02-09,1965-02
各国舆论怒斥美国新的战争冒险日本公众和锡兰阿尔及利亚报纸谴责美帝对越南的挑衅比共政治局指出各国人民将全力制止美帝扩大亚洲战火,1965-02-09,1965-02
美国加拿大公众示威反对轰炸越南英法对美国新冒险感到不安,1965-02-09,1965-02
河内七万人盛大集会示威对美帝发出严厉警告全党全民全军拥护政府声明决心保卫祖国战胜美国侵略者洞海市人民集会热烈欢呼人民军痛打美国飞贼的辉煌胜利,1965-02-09,1965-02
越南军民坚决反击美国战争行动外交部新闻司长驳斥美国掩盖侵略的无耻污蔑《人民报》说美帝新冒险挽救不了侵略南越败局,1965-02-09,1965-02
约翰逊威胁要进一步扩大战争挑衅宣布向南越增派导弹部队并从南越撤出美国人员“家属”白宫透露美国侵袭越南罪行是经过周密策划的,1965-02-09,1965-02
受帝国主义控制的联合国必将垮台印度尼西亚公众继续支持周总理彻底改组联合国的主张柬国家电台说周总理主张得到广泛赞同伊报抨击某些大国控制联合国,1965-02-09,1965-02
乌布利希等德领导人就华沙条约国会议发表讲话和文章美国扶植西德严重威胁欧洲和平,1965-02-09,1965-02
纪念朝鲜人民军建军十七周年平壤各界人民举行隆重集会许凤学大将号召加强斗争把美国侵略军赶出南朝鲜,1965-02-09,1965-02
西巴色将军强烈抗议美帝非法派遣飞机进入老挝老挝人民坚决挫败美帝扩大战争阴谋要求国际委员会迫使美帝立即撤走全部飞机,1965-02-09,1965-02
越《人民报》就万象兵变评美帝使用走狗政策西贡政变传染病蔓延到了万象诺萨万和西何已被美国一脚踢开狼狈逃到泰国,1965-02-09,1965-02
坦桑尼亚首任驻华大使拜会陈毅副总理,1965-02-09,1965-02
苏普拉普托律师离开我国,1965-02-09,1965-02
中国和刚果（布）签订两个议定书,1965-02-09,1965-02
我政府贸易代表团访缅后回京耿飚大使曾为代表团访缅举行招待会,1965-02-09,1965-02
侵略者惊魂未定  解放军又显神通南越人民武装炮轰朔庄美军机场波来古奇袭发生后邦迪奉命仓皇赶回华盛顿,1965-02-09,1965-02
抓活思想的锐利武器——开展战士业余小话剧活动的体会,1965-02-09,1965-02
尽量利用这个武器,1965-02-09,1965-02
关于青年题材影片的调查报告,1965-02-09,1965-02
北方南方齐传捷报,1965-02-09,1965-02
给美国侵略者以应有的惩罚,1965-02-09,1965-02
雁儿落带过得胜令——越南庆捷,1965-02-09,1965-02
警告,1965-02-09,1965-02
“出路”何处寻？,1965-02-09,1965-02
北京地区天气预报,1965-02-10,1965-02
北京、上海、广州、南宁二百五十万人大示威同仇敌忾声讨美国强盗  万众一心支援越南弟兄全国政协各人民团体各民主党派声援越南人民反美侵略斗争在我国的越南和其他国家的朋友参加当地群众反对美帝侵略的游行,1965-02-10,1965-02
首都人民今天大集会支援越南人民反美斗争,1965-02-10,1965-02
古巴社会主义革命统一党代表团离京邓小平彭真康生刘宁一赵毅敏等同志到机场欢送,1965-02-10,1965-02
春水外长写信给日内瓦会议两主席、参加国和有关国家谴责美国蓄意对越南采取战争行动要求各国政府及时制止美国侵略者,1965-02-10,1965-02
摩洛哥共产党代表团到京康生刘宁一等同志到机场迎接,1965-02-10,1965-02
在七八两日自卫战斗中取得光辉胜利越南军民共击落美机十二架,1965-02-10,1965-02
越南南方解放军奇袭波来古战果辉煌毙伤美国侵略者二百三十四人击毁击伤美国飞机共三十一架,1965-02-10,1965-02
约翰逊政府的强盗语言,1965-02-10,1965-02
中国人民坚决支持越南人民反美斗争,1965-02-10,1965-02
周恩来总理陈毅副总理  接见坦桑尼亚贸易代表团,1965-02-10,1965-02
周恩来总理接见阿根廷朋友,1965-02-10,1965-02
坦桑尼亚首任大使拜会周总理,1965-02-10,1965-02
坦桑尼亚总统访华先遣组人员到京,1965-02-10,1965-02
坚决拥护我国政府声明决用实际行动支援越南人民上海八十万人冒雨示威游行声讨美帝热烈祝贺越南军民抗击美国强盗取得辉煌战果,1965-02-10,1965-02
全国政协、各民主党派、各人民团体负责人等向越使馆递交声援信全力支持兄弟越南人民反美斗争,1965-02-10,1965-02
誓为越南人民反美斗争后盾广州五十万人举行声势浩大示威游行,1965-02-10,1965-02
同越南山水相连的南宁市人民大示威随时准备同越南人民并肩战斗,1965-02-10,1965-02
在京外国朋友和首都百万示威群众并肩前进高呼“要越南，不要美国佬！”,1965-02-10,1965-02
朝鲜政府发表声明谴责美帝对越南的战争挑衅坚决同越南兄弟一起反对共同敌人热烈欢呼越南军民再次英勇反击美国侵略所获光辉胜利,1965-02-10,1965-02
苏联政府发表声明谴责美国武装力量对越南民主共和国的袭击支持越南政府抗议美国采取战争行动的声明,1965-02-10,1965-02
越南各地集会示威声讨美国侵略者何文楼大校函国际委员会抗议美国海盗袭击,1965-02-10,1965-02
亚洲舆论说美国对越南挑衅就是对新兴国家挑衅各国人民饶不了美帝好战行动美国瑞典和丹麦公众示威抗议美国对越南的侵略,1965-02-10,1965-02
美舰美机侵入我国领海领空我提出第三百六十次严重警告,1965-02-10,1965-02
日共中央强烈抗议美国侵犯越南并抗议佐藤政府同美国侵越政策合作,1965-02-10,1965-02
三千万人民的钢铁意志——记河内七万人集会声讨美国侵略者,1965-02-10,1965-02
越南南方解放武装力量指挥部号召解放军和游击队员狠狠打击美帝侵略者保卫北方解放南方解放军在波来古大捷后继续英勇出击猛烈袭击美伪军,1965-02-10,1965-02
西贡美当局招认美侵略军遭沉重打击伪空军司令座机入侵北方时中弹四次仅以身免,1965-02-10,1965-02
朝鲜民族保卫相下令全军保持动员状态时刻作好准备警惕美帝战争挑衅揭露美帝正在南朝鲜增强军事力量疯狂准备新的侵略战争,1965-02-10,1965-02
十多年来坚持斗争  英雄事迹可歌可泣南朝鲜游击队壮大了自己力量,1965-02-10,1965-02
美帝国主义张牙舞爪色厉内荏约翰逊再次召开最高决策会议讨论南越局势并发出战争威胁邦迪在记者追问下支吾其词无法掩饰对西贡危机的悲观情绪,1965-02-10,1965-02
美侵略南越战争前景可悲一些议员和报纸表示不安,1965-02-10,1965-02
无可奈何的招供,1965-02-10,1965-02
南越人民武装的四次大捷,1965-02-10,1965-02
北京地区天气预报,1965-02-11,1965-02
应刘少奇主席周恩来总理邀请阿尤布·汗总统下月访问我国,1965-02-11,1965-02
苏联代表团回国途中到京周总理陈毅副总理到机场欢迎并设宴招待,1965-02-11,1965-02
全中国人民一定要在一切战线上加紧努力加强准备首都一百五十万人集会示威支援越南兄弟反美斗争毛泽东刘少奇周恩来邓小平等党和国家领导人参加了大会,1965-02-11,1965-02
中国人民一定要加紧努力加强准备坚决支援越南打退美帝的战争挑衅,1965-02-11,1965-02
中国人民完全拥护我政府声明  随时准备同越南人民并肩战斗中共中央委员、中华全国总工会主席刘宁一的讲话,1965-02-11,1965-02
越南人民紧握手中的斧头和枪杆决心给予美国侵略者应有的反击越南驻华大使馆临时代办黄北的讲话,1965-02-11,1965-02
越南南方军民坚决战斗到底  彻底击败美帝实现祖国统一越南南方民族解放阵线常驻中国代表团代理团长阮明芳的讲话,1965-02-11,1965-02
作好一切准备坚决支援越南兄弟上海一百五十万人继续示威游行声讨美帝侵略罪行,1965-02-11,1965-02
谴责美国新战争挑衅  欢呼反侵略伟大胜利越南北方各地数十万人集会示威越外交部发言人谴责美国调集舰只准备进行新挑衅,1965-02-11,1965-02
天津七十万示威群众发出正义呼声：尽一切努力支援越南人民斗争,1965-02-11,1965-02
支持越南人民狠揍美国强盗广州又有七十万人走上街头举行声援越南示威游行,1965-02-11,1965-02
武汉六十万人举行声势浩大的游行示威永远同越南兄弟站在一起,1965-02-11,1965-02
对越南的侵犯就是对中国的侵犯昆明各族人民游行示威显示支援越南人民的决心,1965-02-11,1965-02
“美国贼，从越南滚出去！”南宁人民继续游行示威支持越南,1965-02-11,1965-02
简讯,1965-02-11,1965-02
美国在印度支那扩大军事侵略图,1965-02-11,1965-02
阿尔巴尼亚政府发表声明支持越南人民斗争越南人民必将彻底战胜美国侵略者,1965-02-11,1965-02
罗亚外长谴责美国制造无耻借口侵略越南古巴人民向越南人民表示战斗性声援,1965-02-11,1965-02
蒙保政府就美国对越南的挑衅发表声明声援越南人民维护独立与安全的斗争,1965-02-11,1965-02
德外交部副部长谴责美国对越南的危险挑衅美国轰炸越南是希特勒式的罪行,1965-02-11,1965-02
艾地主席说美帝对越南的进攻就是对全世界人民的进攻印度尼西亚人民决不能容忍美帝侵略越南日共《赤旗报》号召一切民主力量展开反对美国侵略越南的统一行动,1965-02-11,1965-02
亚非拉留苏学生抗议美帝侵犯越南在美国驻苏使馆前举行示威,1965-02-11,1965-02
苏联代表团结束对越南的访问,1965-02-11,1965-02
约翰逊政府究竟“谋求”什么？从事实看美国扩大侵略印度支那的罪行,1965-02-11,1965-02
亚非拉公众舆论继续纷纷抗议美国轰炸越南北方美国对越南的侵略就是对世界人民的挑衅各国人民不能坐视美帝扩大印度支那战争,1965-02-11,1965-02
抗议约翰逊政府空袭越南民主共和国美国旧金山市民举行游行示威,1965-02-11,1965-02
南越人民武装打得猛侵越美军副司令险些丧命，儿子肚子被击穿,1965-02-11,1965-02
英报指出美国轰炸越南是蓄谋行动英外交大臣公然为美国侵略越南罪行辩护,1965-02-11,1965-02
美国官员议员和御用记者演出大合唱对越南进行狂妄的战争威胁邦迪叫嚷美国人员家属撤出南越是扩大战争步骤,1965-02-11,1965-02
《桑给巴尔之声》欢呼尼雷尔总统访华中坦友好关系将进一步加强,1965-02-11,1965-02
国际律师团首席律师长野回国离京时宣布律师团将扩大和加强,1965-02-11,1965-02
孟英大使宴请中非共和国总统达科总统指出两国互相了解前景美好,1965-02-11,1965-02
南非泛非主义者大会代理主席等到京,1965-02-11,1965-02
中国坦桑尼亚两国政府在京签订贸易协定和交换商品议定书,1965-02-11,1965-02
北京地区天气预报,1965-02-12,1965-02
越南政府就美机再次袭击的极严重战争行动发表声明越南人民时刻准备战斗击败美国侵略者人民军昨击落入侵美机七架活捉美飞行员一名,1965-02-12,1965-02
南越人民武装力量在归仁严惩美国侵略者彻底炸毁美军巢穴  数十美军葬身瓦砾,1965-02-12,1965-02
越南南方解放军连战连捷平定一役全歼伪军两连消灭伪军一营重创伪军一连怀仁一战打死打伤敌人八十名并迫使一连伪军投降奇袭德丰痛击美国强盗奋战福绥丛林火烧美伪伞兵,1965-02-12,1965-02
苏里亚·巴哈杜尔·塔帕就任尼大臣会议主席周恩来总理致电热烈祝贺,1965-02-12,1965-02
苏联代表团离京赴朝周总理、陈毅副总理等到机场欢送柯西金行前举行宴会，周总理、陈副总理出席,1965-02-12,1965-02
誓为越南人民反对美国侵略的坚强后盾解放军严正警告美国强盗陆海空三军在战斗岗位集会，欢呼越南战友打得好,1965-02-12,1965-02
毛主席刘主席接见苏联代表团,1965-02-12,1965-02
坦桑尼亚首任驻华大使向刘少奇主席递交国书,1965-02-12,1965-02
向英勇的越南南方人民致敬！,1965-02-12,1965-02
同越南人民饮一江水烧一山柴的广西边境人民绝不容许美帝在家门口点燃战火,1965-02-12,1965-02
我们坚决同越南人民并肩战斗南京五十万人示威游行声讨美帝侵略罪行,1965-02-12,1965-02
全力支援越南兄弟狠揍美国豺狼重庆五十多万人示威游行，反美怒潮震荡山城,1965-02-12,1965-02
南越人民武装斗争胜利图,1965-02-12,1965-02
中国青年全力支持越南兄弟反对美帝共青团中央、全国青联的电报,1965-02-12,1965-02
严厉谴责美帝罪行  坚决支持越南人民中华全国新闻工作者协会的电报,1965-02-12,1965-02
美帝在哪里发动战争就要在哪里灭亡中国民主促进会副主席王绍鏊的谈话,1965-02-12,1965-02
坚决粉碎美帝国主义的战争冒险计划中国农工民主党中央主席团主席季方的谈话,1965-02-12,1965-02
美帝欠下的血债必须用血来偿还中国致公党主席陈其尤的谈话,1965-02-12,1965-02
坚决支持越南人民的正义斗争九三学社主席许德珩的谈话,1965-02-12,1965-02
美帝的垂死挣扎绝不能挽救失败命运台湾民主自治同盟总部负责人的谈话,1965-02-12,1965-02
时刻准备以一切力量支援越南人民全国工商联主任委员陈叔通的谈话,1965-02-12,1965-02
我国归侨和侨眷站在越南人民一边中华全国归国华侨联合会代主席庄希泉的谈话,1965-02-12,1965-02
中国有权支持越南不受侵犯无党派民主人士张奚若的声明,1965-02-12,1965-02
越南国防部代表谴责美国发动更大规模的袭击美帝强盗进攻只能激发越南人民仇恨越南人民决心英勇战斗粉碎美国侵略,1965-02-12,1965-02
河内各界代表到中国大使馆感谢中国人民的支持中越人民必将共祝反美胜利我大使说：中国人民对越南人民的支援是应尽国际义务,1965-02-12,1965-02
平定省和归仁,1965-02-12,1965-02
“隼式”导弹,1965-02-12,1965-02
谴责美国侵略越南  支持越南人民斗争西哈努克亲王保证在共同反美斗争中给越南兄弟般声援阿尔及利亚政府主张外国军队撤出南越执行日内瓦协议老挝爱国战线党武装部队最高指挥部祝贺越南军民胜利,1965-02-12,1965-02
越南苏联发表联合声明,1965-02-12,1965-02
示威的海洋，在全世界汹涌澎湃美帝国主义，炸弹救不了你的命平壤地拉那柏林东京罗马华盛顿和拉美各地人民集会示威声援越南,1965-02-12,1965-02
在广州的泰国著名公众领袖比里·帕侬荣支持越南人民反对美国侵略斗争,1965-02-12,1965-02
旧债未了又添新血债  颠倒黑白掩不住暴行美国悍然再次对越南发动空中袭击约翰逊还在加紧调兵遣将准备进一步扩大战争,1965-02-12,1965-02
五角大楼承认南越美军基地易受人民武装攻击处处设防  防不胜防陷入重围  奇袭难逃,1965-02-12,1965-02
坚决支持越南人民的反侵略战斗誓把美帝国主义从东南亚赶出去亚非拉人民怒涛翻腾共讨美帝轰炸越南的滔天罪行,1965-02-12,1965-02
佐藤政府必须取消“吉田信件”,1965-02-12,1965-02
正义的呼声,1965-02-12,1965-02
英著名哲学家罗素抗议美国对越南的袭击要求联合国谴责美国是侵略者指责英工党政府出于懦夫愿望一味支持美国,1965-02-12,1965-02
法国政府发表声明要求排斥外国对印度支那的干涉主张召开国际会议达成有关协议华盛顿立即表示反对并重申美国顽固态度,1965-02-12,1965-02
德部长会议副主席洛伊施纳逝世,1965-02-12,1965-02
佐藤政府竟同蒋帮穿起连裆裤利用“吉田信件”破坏日中贸易日本经济界和报界对佐藤屈从美蒋压力表示强烈不满,1965-02-12,1965-02
筹委会第四次会议同意阿尔及利亚要求第二次亚非会议推迟到六月底举行,1965-02-12,1965-02
科威特访华友好代表团抵京,1965-02-12,1965-02
苏加诺总统接见姚仲明大使强调加强两国战友之谊伟大意义,1965-02-12,1965-02
春夜寄越南,1965-02-12,1965-02
一团团怒火烧在心间,1965-02-12,1965-02
遥望南天怒火生,1965-02-12,1965-02
严阵以待,1965-02-12,1965-02
打得好,1965-02-12,1965-02
天安门前涌怒潮,1965-02-12,1965-02
庄严的声明，愤怒的吼声（曲谱）,1965-02-12,1965-02
支持越南，声讨美帝（曲谱）,1965-02-12,1965-02
北京地区天气预报,1965-02-13,1965-02
声讨美国强盗滔天罪行  欢呼越南军民伟大胜利全国一千多万人示威支援越南,1965-02-13,1965-02
义愤填胸随时准备粉碎美国强盗的侵犯越南三百万人示威声讨美帝欢欣鼓舞热烈庆祝十一日痛歼美机的光辉胜利,1965-02-13,1965-02
写信感谢我国人民支持越南人民反对美国侵略的斗争胡志明主席盛赞越中人民战斗友谊,1965-02-13,1965-02
邓小平康生刘宁一等同志同摩洛哥共产党代表团进行会谈,1965-02-13,1965-02
应邀参加庆祝中苏友好同盟互助条约签订十五周年的活动中苏友协代表团离京赴苏,1965-02-13,1965-02
黄北临时代办举行记者招待会谴责美国侵略越南人民决心给美帝更有力的反击呼吁各国制止美帝对越南的一切侵略行动,1965-02-13,1965-02
应邀参加庆祝中苏友好同盟互助条约签订十五周年的活动苏中友协代表团到达北京,1965-02-13,1965-02
越南人民武装前天共击落美机九架越南人民军总司令部嘉奖有功部队,1965-02-13,1965-02
周恩来总理  陈毅副总理接见科威特访华友好代表团团长,1965-02-13,1965-02
美国飞机再次轰炸越南北方激起我国人民极大愤怒沈阳百万群众示威游行声讨美帝誓以实际行动全力支援越南兄弟打击美国侵略者,1965-02-13,1965-02
全力支持越南人民反对美国武装侵略  中国作家协会的电报,1965-02-13,1965-02
美帝扩大侵越战争只会失败得更惨中国国际贸易促进委员会的电报,1965-02-13,1965-02
尽一切可能支持越南人民正义斗争  中国佛教协会的电报,1965-02-13,1965-02
美帝侵略越南进一步暴露了强盗面目  中国天主教爱国会的电报,1965-02-13,1965-02
刘主席任命秦力真为驻赞比亚大使,1965-02-13,1965-02
我对外经济联络委员会主任设宴  热烈欢迎科威特访华友好代表团,1965-02-13,1965-02
越南兄弟，上海工人支持你们！,1965-02-13,1965-02
同越南人民并肩痛击美国强盗西安五十万人举行声势浩大的示威声讨美帝侵越罪行参加游行的越南留学生高呼：越中两国人民的战斗友谊万岁,1965-02-13,1965-02
越中友协庆祝成立十五周年孙光阀副会长和朱其文大使赞扬两国战斗友谊日益发展,1965-02-13,1965-02
美国纸老虎的自白,1965-02-13,1965-02
