北京地区天气预报,1965-02-01,1965-02
高举毛泽东思想红旗  保持常备不懈  密切协同作战东南沿海军民又连续歼灭七股美蒋武装特务,1965-02-01,1965-02
来者不拒，全部歼灭！,1965-02-01,1965-02
我国外交部发表声明严重抗议布隆迪政府无理中断中布外交关系,1965-02-01,1965-02
康生同志接见文琴佐·卡洛,1965-02-01,1965-02
《毛泽东著作选读》乙种本蒙古维吾尔哈萨克文版出版,1965-02-01,1965-02
我六单位招待国际律师团杨秀峰院长等一再举杯向主持正义的各国律师致谢,1965-02-01,1965-02
国际律师团发表声明谴责巴西当局的非法判决对中国人员的审判是一次政治迫害致电各国法律家和法律家团体呼吁主持正义给予有力声援举行记者招待会发表声明要求巴西当局立即释放中国人员,1965-02-01,1965-02
黄海歼敌,1965-02-01,1965-02
假期欢乐愉快度佳节  节后鼓足干劲闹生产北京上海广州居民练歌排戏准备参加春节联欢,1965-02-01,1965-02
布袋澳里捉匪记,1965-02-01,1965-02
广东、福建、浙江、江苏沿海地区军民连续歼灭七股美蒋武装特务,1965-02-01,1965-02
欲盖弥彰——评史蒂文森的演说,1965-02-01,1965-02
印度尼西亚合作国会议长和日本公众支持周总理的主张联合国不能反映亚非国家利益必须彻底改组卡塔威纳塔议长说中国印度尼西亚联合声明是对帝国主义的决定性打击,1965-02-01,1965-02
平托律师在辩护词中引用大量证据和论据指出我人员为促进中巴人民友谊合法进入巴西在巴西进行的业务活动都是公开和正当的,1965-02-01,1965-02
朝鲜外务省发表声明谴责美帝在印度支那的新冒险美帝胆敢扩大战争必遭惨败完全支持苏发努冯亲王提出和平解决老挝问题的主张,1965-02-01,1965-02
抗议美帝及其走狗血腥镇压南越佛教徒的罪行首都宗教界集会支持南越佛教徒反美爱国斗争我佛教协会呼吁制止美帝及其走狗对南越佛教徒的残暴迫害,1965-02-01,1965-02
科兹洛夫逝世,1965-02-01,1965-02
阿根廷著名律师托姆谈巴西当局诬陷我人员的背景和情况巴西当局“审判”我人员是为了讨好美帝营救我人员的斗争是为正义进行的斗争,1965-02-01,1965-02
我被迫害人员家属代表抵里约热内卢,1965-02-01,1965-02
首都集会欢迎全印度尼西亚中央职工会副主席刘宁一欢宴印度尼西亚客人,1965-02-01,1965-02
美军舰侵入我福建省领海我提出第三百五十八次严重警告,1965-02-01,1965-02
某公三哭〔散曲〕,1965-02-01,1965-02
只要有决心  好上还能好,1965-02-01,1965-02
在头里,1965-02-01,1965-02
散曲·曲牌·带过曲,1965-02-01,1965-02
北京地区天气预报,1965-02-02,1965-02
音西大队发动社员讨论今年生产计划贫下中农算细账挖潜力提出增产办法,1965-02-02,1965-02
薛镇大队一队接受去年经验教训把社员的干劲纳入生产计划,1965-02-02,1965-02
海南岛开始播种插秧,1965-02-02,1965-02
云南玉溪坝子油菜开花,1965-02-02,1965-02
李顺达、申纪兰、罗世发用一分为二的方法总结成绩发扬大寨精神迎接农业生产新高潮他们表示要树雄心立壮志带头劳动加强领导搞好今年大生产,1965-02-02,1965-02
全国城镇储蓄存款大幅度增长超过一九六三年增长数的一倍以上,1965-02-02,1965-02
国际律师团伸张正义致电巴西总统和上诉法院抗议对中国人员的非法判决致电平托律师对他为中国人员的斗争表示支持和敬意致电中国人员对他们在军事法庭的英勇斗争表示敬意,1965-02-02,1965-02
有所创造  有所前进,1965-02-02,1965-02
活跃在各地报纸上的活思想,1965-02-02,1965-02
新春传捷报  元月开门红,1965-02-02,1965-02
向人民子弟兵表示亲切的慰问和崇高的敬意各地人民热情慰问人民解放军,1965-02-02,1965-02
一九六五年年画展览在京开幕展品都是歌颂工农兵和社会主义革命与建设的作品,1965-02-02,1965-02
六名游泳运动员打破五项全国纪录,1965-02-02,1965-02
必须结束帝国主义对联合国的操纵阿里·沙斯特罗阿米佐约说另建一个革命的联合国无疑是个革命的主张  全印度尼西亚中央职工会主席指出联合国已成为美帝国主义的橡皮图章巴基斯坦公众和日本和委会主席平野义太郎谴责联合国为帝国主义效劳,1965-02-02,1965-02
美比帝国主义的阴谋必将破产,1965-02-02,1965-02
东京举行万人参加的紧急大会反对美国核潜艇再次进驻日本日本共产党号召全体民主力量团结起来加强斗争,1965-02-02,1965-02
苏班德里约博士率领的代表团回到雅加达,1965-02-02,1965-02
越南驻华大使馆临时代办举行记者招待会呼吁制止美帝国主义扩大南越战争,1965-02-02,1965-02
美舰美机侵入我领海领空我提出第三百五十九次严重警告,1965-02-02,1965-02
万象发生兵变,1965-02-02,1965-02
平托律师辩护词揭露美蒋集团直接策动和参与对我人员迫害美蒋伪造信件歪曲译文手法卑鄙之极我人员行为正当非造谣诽谤所能抹黑,1965-02-02,1965-02
河内庆祝越南劳动党成立三十五周年,1965-02-02,1965-02
陈毅副总理接见印度尼西亚客人,1965-02-02,1965-02
熟悉工农兵  表现工农兵全国美展华东地区作品山东年画专刊,1965-02-02,1965-02
北京地区天气预报,1965-02-03,1965-02
中共中央致电越南劳动党中央祝贺越南劳动党诞生三十五周年,1965-02-03,1965-02
满怀信心迎接工农业生产新高潮各地人民欢欢乐乐过春节,1965-02-03,1965-02
朱德董必武等同志参观广州体育观赏会宫本显治、优素福·阿吉托罗普应邀出席,1965-02-03,1965-02
各地军民春节联欢互叙亲如一家的革命情谊,1965-02-03,1965-02
古巴社会主义革命统一党代表团格瓦拉等同志到广州,1965-02-03,1965-02
宣传大好形势  积极支援生产解放军热烈开展拥政爱民活动,1965-02-03,1965-02
新会县领导干部深入生产第一线动口又动手运用样板经验  备耕工作扎实,1965-02-03,1965-02
黄源大队贫下中农在备耕中发扬自力更生精神要用两手挖掉穷根扎下社会主义富根,1965-02-03,1965-02
大挖潜力  增加生产  支援农业上海许多工厂生产的农用物资外运天津百多家工厂赶制农业生产资料,1965-02-03,1965-02
在掏粪工人家里迎春,1965-02-03,1965-02
“问题在人不在猪”,1965-02-03,1965-02
“这种事情做不得”,1965-02-03,1965-02
虎口夺牛,1965-02-03,1965-02
寒夜护猪,1965-02-03,1965-02
救活这头驴,1965-02-03,1965-02
不只是救了一口猪（编后）,1965-02-03,1965-02
庆祝印度尼西亚《人民日报》创刊十四周年梭罗七十五万人举行盛大集会,1965-02-03,1965-02
抗议美国核潜艇再次进驻日本佐世保一万五千人集会示威佐藤政府竟出动大批警察保护美国核潜艇进港,1965-02-03,1965-02
美伪军舰三艘侵入越南北方领海挑衅越南人民军击沉美伪军舰一艘,1965-02-03,1965-02
越南人民军代表团电国际委员会抗议美伪军舰炮轰昏果岛,1965-02-03,1965-02
勃列日涅夫等访问匈牙利,1965-02-03,1965-02
威尔逊借口对付所谓中国“威胁”叫嚷用核力量“保护”亚洲国家,1965-02-03,1965-02
平托律师在辩护词的最后一部分严正指出诬控我人员的罪证荒诞离奇不可置信硬加在中国被告身上的罪名可以休矣,1965-02-03,1965-02
在河内庆祝越南劳动党建党三十五周年大会上黎德寿同志的讲话,1965-02-03,1965-02
北京地区天气预报,1965-02-04,1965-02
沈阳许多老工人主意好体会深调动职工积极性  增加生产不增人,1965-02-04,1965-02
向技术革新要潜力  用巧劲迎高潮武汉一些工厂今年已出现一批革新成果,1965-02-04,1965-02
兰州合成氨厂干部下车间蹲点劳动到第一线去促进新高潮,1965-02-04,1965-02
思想先行（编后）,1965-02-04,1965-02
南京化学工业公司职工的共同心愿：全力支援农业生产一月份氮肥和磷肥超额一万多吨完成计划,1965-02-04,1965-02
刘主席  周总理电贺锡兰独立十七周年,1965-02-04,1965-02
畅谈当前新形势  携手夺取新胜利各地工人农民春节联欢,1965-02-04,1965-02
各地穆斯林欢度开斋节,1965-02-04,1965-02
解放军满怀革命豪情度春节边防战士加倍警惕坚守岗位保卫祖国,1965-02-04,1965-02
应中共中央邀请古巴社会主义革命统一党代表团到京邓小平彭真康生刘宁一同志到机场欢迎,1965-02-04,1965-02
水利工程质量是否合格？  请贫农下中农打“收条”,1965-02-04,1965-02
抓验收（编后）,1965-02-04,1965-02
贫农下中农目光远大  徽州专区大力建设茶园,1965-02-04,1965-02
南充专区利用隙地大量栽桑,1965-02-04,1965-02
看得更宽更远些,1965-02-04,1965-02
三次登门求教,1965-02-04,1965-02
让新型光源大显威力,1965-02-04,1965-02
能穿透浓雾的灯——钠灯,1965-02-04,1965-02
脉冲氙灯,1965-02-04,1965-02
高压水银荧光灯,1965-02-04,1965-02
永远不会变黑的灯泡——碘钨灯,1965-02-04,1965-02
小型和配套工程为主  社队自办为主各地冬季水利建设成绩显著,1965-02-04,1965-02
“人造小太阳”高压长弧氙灯,1965-02-04,1965-02
野坂主席号召争取反帝斗争新胜利美帝日益孤立节节失败变得更狂暴各国人民能够捆住美帝国主义手脚,1965-02-04,1965-02
越人民军联络代表团长致电国际委员会主席抗议美国及其仆从军舰侵犯越南领海,1965-02-04,1965-02
越南通讯社受权发表声明驳斥美国及其仆从对越南的诬蔑,1965-02-04,1965-02
老挝爱国武装防空部队又击落美国和老挝右派飞机四架,1965-02-04,1965-02
老挝右派军队在万象火并美国大使馆进行干预分别同双方接触,1965-02-04,1965-02
苏加诺总统说印度尼西亚自力更生决心更坚定印度尼西亚举国热烈欢迎加强同中国战友关系《马来亚箴言》月刊说：“印度尼西亚，干得好”,1965-02-04,1965-02
我亚非团结委员会就“安哥拉日”发表声明中国人民坚决支持安哥拉和非洲人民的斗争,1965-02-04,1965-02
安哥拉爱国武装取得新的胜利击落葡殖民军飞机一架并击毙一批敌人,1965-02-04,1965-02
坦桑尼亚首任驻华大使启程来京,1965-02-04,1965-02
国际律师团成员、巴基斯坦律师易卜拉欣离开北京回国,1965-02-04,1965-02
简讯,1965-02-04,1965-02
美国核潜艇再次开进佐世保激起日本人民更大愤怒佐世保万余人示威高呼美核潜艇滚出去横须贺集会支持佐世保并呼吁全国人民团结起来斗争到底,1965-02-04,1965-02
陈毅副总理接见日本客人,1965-02-04,1965-02
在劳动化的道路上改造自己,1965-02-04,1965-02
祖国—春天的故乡,1965-02-04,1965-02
同献红心一片,1965-02-04,1965-02
送对联,1965-02-04,1965-02
《矿山兄弟》充满革命精神,1965-02-04,1965-02
北京地区天气预报,1965-02-05,1965-02
中央农业部门要求各地打响今年农业增产第一炮抓紧时机加强越冬作物田间管理,1965-02-05,1965-02
编者按,1965-02-05,1965-02
针对田间新情况  采取新法管麦田,1965-02-05,1965-02
这笔账算得好,1965-02-05,1965-02
尿肥浇麦长得旺,1965-02-05,1965-02
刘少奇周恩来邓小平同志会见并宴请古巴社会主义革命统一党代表团,1965-02-05,1965-02
全国各地春节期间广泛开展拥军优属活动向光荣之家进行热情的慰问,1965-02-05,1965-02
主要矛盾是“理论水平低”吗？,1965-02-05,1965-02
到现场设计是“水平低”的表现么？,1965-02-05,1965-02
死读书得不到活知识,1965-02-05,1965-02
只信“本本”是顽固的习惯势力,1965-02-05,1965-02
怎样看待书本知识？（编后）,1965-02-05,1965-02
首都商业领导机关和天津财贸系统干部参加春节售货义务劳动有的站柜台，有的摆货摊，有的走街串巷为群众服务,1965-02-05,1965-02
北京、乌鲁木齐、重庆等城市  举行春节环城赛跑,1965-02-05,1965-02
春节游泳比赛破十三项全国纪录,1965-02-05,1965-02
新居的新对联  住新房感谢共产党  想北京祝福毛主席,1965-02-05,1965-02
让阶级友爱成为一代新风,1965-02-05,1965-02
泰国爱国阵线诞生并发表告全国同胞书结成统一的坚强组织赶走美帝国主义实现泰国的独立民主和平中立与繁荣,1965-02-05,1965-02
越南《人民报》欢呼泰国爱国阵线诞生泰国人民找到了解放的道路,1965-02-05,1965-02
越南国防会议提出今后国防工作的任务和方向进一步加强国防随时粉碎美帝侵略挑衅美帝国主义及其仆从在南越陷入严重危机最后必将失败,1965-02-05,1965-02
锡兰工业展览会显示工业建设成就班达拉奈克夫人强调自力更生发展工业,1965-02-05,1965-02
中锡友协举行酒会庆祝锡兰独立节,1965-02-05,1965-02
美比帝国主义破坏不了中布人民的友谊布隆迪人民热情送别我使馆人员几位政府大臣和各界代表纷纷赶到机场送行,1965-02-05,1965-02
阿尔巴尼亚去年计划完成情况良好工业总产值增长百分之七点四，粮食增产百分之十九,1965-02-05,1965-02
罗马尼亚增加药品生产,1965-02-05,1965-02
古巴强调教育和生产劳动相结合教育部长说学生每年应有一个月时间参加劳动,1965-02-05,1965-02
苏一冶金厂建吹氧转炉车间,1965-02-05,1965-02
德去年生产约二百万台电机,1965-02-05,1965-02
波农业研究所培育新的品种,1965-02-05,1965-02
苏加诺总统重申决不改变退出联合国立场打破了对联合国的迷信提高了印度尼西亚威信警告美国不得干涉南越和亚非拉的事务,1965-02-05,1965-02
刚果（布）坚决反击冲伯集团挑衅利苏巴总理警告冲伯必须对严重后果负责,1965-02-05,1965-02
古巴人民武装反击海盗船只的袭击电视台转播审讯美国派遣的反革命分子实况,1965-02-05,1965-02
阿联下令封闭刚果（利）使馆,1965-02-05,1965-02
约翰逊谈美苏领导人互访,1965-02-05,1965-02
柬埔寨去年对外贸易取得盈余放弃“美援”后经济有了发展,1965-02-05,1965-02
巴基斯坦试种大豆成功卡拉奇渔业产量达近年最高纪录,1965-02-05,1965-02
尼泊尔国王强调自力更生建设国家,1965-02-05,1965-02
也门第一个铝制厨房用具厂开工,1965-02-05,1965-02
缅甸准备修建更多灌溉堤坝,1965-02-05,1965-02
国际简讯,1965-02-05,1965-02
日本人民反对美核潜艇斗争浪潮扩大佐世保东京长崎等地集会示威谴责佐藤政府屈从美国各团体领导人愤怒抗议美国想把日本变为远东核基地,1965-02-05,1965-02
反对在选民登记方面实行种族歧视美国亚拉巴马州黑人连续第三天示威当局出动警察大肆逮捕，被捕黑人总数达两千人,1965-02-05,1965-02
在毛泽东思想指导下，改革我们的教学,1965-02-05,1965-02
为贫农下中农子女办学,1965-02-05,1965-02
中国北部农田防护林问题的讨论,1965-02-05,1965-02
对“榆林三迁”说的考证,1965-02-05,1965-02
咱贫农下中农就得为集体多操心,1965-02-05,1965-02
不怕“老爷”机床，只怕“老爷”思想,1965-02-05,1965-02
老贫农的故事让堂屋,1965-02-05,1965-02
贫农下中农之歌〔歌词〕,1965-02-05,1965-02
把青春献给农村——看朝鲜故事片《新的一代》,1965-02-05,1965-02
北京地区天气预报,1965-02-06,1965-02
华东地区开座谈会提出争取农业全面丰收重要一着选好杂粮种子  种好杂粮作物建议各地发动群众查种选种推广良种为春播和夏播做好准备,1965-02-06,1965-02
江南广大地区喜雨,1965-02-06,1965-02
“主粮”和“杂粮”,1965-02-06,1965-02
陈毅副总理强烈谴责美、比帝国主义破坏中布友好关系帝国主义破坏亚非团结的阴谋注定失败,1965-02-06,1965-02
锡兰大使举行独立十七周年招待会周恩来总理陈毅副总理等应邀出席,1965-02-06,1965-02
柯西金主席率苏代表团访越途中到京周恩来总理陈毅副总理等到机场欢迎周总理陈副总理宴请苏代表团，宴会后双方进行了谈话,1965-02-06,1965-02
解放军官兵高举毛泽东思想红旗乘胜前进四好运动更扎实  先进人物更出色,1965-02-06,1965-02
教室里难解决的思想问题  在实践中找到了正确答案,1965-02-06,1965-02
用活事教育学生遵守劳动纪律,1965-02-06,1965-02
活思想活教育（编后）,1965-02-06,1965-02
是教师又是公社社员  既教书也参加集体劳动江苏耕读小学育成一支新型教师队伍,1965-02-06,1965-02
依靠集体力量  学习大寨精神河北京广铁路两侧精修大片园田,1965-02-06,1965-02
要象“乌兰牧骑”那样为工农兵服务内蒙古各民族文艺工作者学习“乌兰牧骑”革命精神和革命作风,1965-02-06,1965-02
全国美术展览会华东地区作品在首都展出,1965-02-06,1965-02
全国人民代表大会代表刘同圻逝世,1965-02-06,1965-02
办了耕读小学  又办耕（工）读中学宁夏许多贫下中农子女得到入学机会全区中学分布更加合理，各族群众热烈支持,1965-02-06,1965-02
简讯,1965-02-06,1965-02
印度尼西亚公众舆论热烈支持中国印度尼西亚联合声明加强新兴力量团结  打击美英帝国主义,1965-02-06,1965-02
日本柬埔寨和巴基斯坦公众舆论支持周总理的主张联合国已到进行彻底改造的时候了尼泊尔报纸指出联合国被少数大国操纵追求私利必须进行改组,1965-02-06,1965-02
艾地主席谴责美国企图把南越战争国际化越南政党团体抗议美国指使南朝鲜傀儡参加南越战争,1965-02-06,1965-02
阿尔巴尼亚石油工业发展快目前平均每五十二天的开采量就相当于一九三八年全年产量,1965-02-06,1965-02
越南积极发展农村交通运输事业,1965-02-06,1965-02
简讯,1965-02-06,1965-02
南越人民武装北村一战又获大捷美伪集团大规模“扫荡”彻底失败,1965-02-06,1965-02
老挝爱国战线党武装部队击退敌人进犯寮国战斗部队电台欢呼击落敌机四架的辉煌战绩,1965-02-06,1965-02
比利时共产党政治局发表一项决议谴责美比在布隆迪策动反华新阴谋,1965-02-06,1965-02
结束在印度尼西亚的访问我友好代表团回到北京,1965-02-06,1965-02
我妇女代表团回京,1965-02-06,1965-02
老挝右派集团内部激烈火并四天库帕拉西部队控制万象  诺萨万和西何下落不明,1965-02-06,1965-02
把争取早日实现祖国和平统一的愿望化为实际行动朝鲜掀起“拯救南朝鲜同胞的增产运动”,1965-02-06,1965-02
约翰逊承认美国在南越天天有困难表示将要发表有关苏美领导人互访的细节邦迪衔命去西贡谋求挽救侵略败局的出路,1965-02-06,1965-02
日本人民反美斗争如火如荼气势磅礴美国核潜艇第二次被迫滚出佐世保港,1965-02-06,1965-02
庆祝独立十七周年锡兰十万人举行游行,1965-02-06,1965-02
武装革命是南非人民解放的唯一道路泛非主义者大会领导人说不能依靠联合国,1965-02-06,1965-02
古巴卡西尔达等城人民集会抗议受美帝指挥的海盗船只进行新侵略,1965-02-06,1965-02
戴高乐指责联合国历年来滥用权力擅自出兵朝鲜和刚果联合国为大国操纵干涉各国内政陷入危机主张结束美元的垄断地位改变国际货币制度,1965-02-06,1965-02
华盛顿急忙表示反对戴高乐主张美国记者说约翰逊拉拢法国的努力碰了硬钉子,1965-02-06,1965-02
英国议员华贝说美国是亚洲危险的侵略者抨击美国想利用武力和联合国统治世界,1965-02-06,1965-02
美黄金储备最近一周再减一亿美元,1965-02-06,1965-02
坚持反对在选民登记方面实行种族歧视美国亚拉巴马州黑人继续示威,1965-02-06,1965-02
日本人民怒逐美国核潜艇,1965-02-06,1965-02
全心全意地为中国和世界的绝大多数人服务（编者按）,1965-02-06,1965-02
做工作不是为了什么“出人头地”,1965-02-06,1965-02
要踏实工作首先应当思想红,1965-02-06,1965-02
冯定宣扬“出人头地”是向青年灌输毒素,1965-02-06,1965-02
把青春贡献给社会主义新农村,1965-02-06,1965-02
我们的理想是干革命,1965-02-06,1965-02
我想的是党和人民的利益,1965-02-06,1965-02
冯定指的道路是走不得的,1965-02-06,1965-02
为党、为人民、为革命而踏实工作,1965-02-06,1965-02
不怕舞台不高大，单怕思想不高大,1965-02-06,1965-02
抓住关键,1965-02-06,1965-02
歌颂社会主义新农村的短笛,1965-02-06,1965-02
一出反映科学实验题材的新戏,1965-02-06,1965-02
怎样看待中央乐团的水平,1965-02-06,1965-02
北京地区天气预报,1965-02-07,1965-02
两种设计思想  一场尖锐斗争,1965-02-07,1965-02
点面之间大有学问,1965-02-07,1965-02
请贫农下中农参加设计农村电站,1965-02-07,1965-02
药效好  毒性小  成本低我国试制成功一批新农药一些老产品由于生产技术改进质量显著提高成本大大下降过去一直依靠进口的农药乳化剂，去年已经试制成功五种,1965-02-07,1965-02
坦桑尼亚首任驻中国大使到京,1965-02-07,1965-02
苏联代表团离京赴越周总理陈毅副总理等到机场欢送,1965-02-07,1965-02
从停滞不前到有所前进——访全国植棉模范张秋香,1965-02-07,1965-02
我们的集体副业搞得好,1965-02-07,1965-02
向贫农下中农求谋问计,1965-02-07,1965-02
依靠群众就有办法,1965-02-07,1965-02
最勤劳的人最聪明（编后）,1965-02-07,1965-02
找生产差距  抓薄弱环节  添增产措施汉寿县以点带面检查备耕,1965-02-07,1965-02
纪念“二七”大罢工四十二周年北京铁道部门和一些工厂举行报告会座谈会,1965-02-07,1965-02
俯首甘为孺子牛（编后）,1965-02-07,1965-02
保持和发扬人民警察的本色“公安战线上的好八连”——海城车站公安派出所的民警，在爱民月里，积极为人民办好事，群众称他们为知心人,1965-02-07,1965-02
烈属张奶奶“子孙”满堂,1965-02-07,1965-02
“真是我们贫农的好后代！”,1965-02-07,1965-02
一块路牌的由来,1965-02-07,1965-02
他们胸中装着集体（编后）,1965-02-07,1965-02
苏班德里约第一副总理赞扬印度尼西亚中国联合声明联合声明是打击帝国主义的大锤子印度尼西亚公众继续欢呼两国人民的战斗友谊日益增长,1965-02-07,1965-02
越南南方《人民报》发表社论号召更狠地打击敌人争取更大胜利南越中部地区去年一千六百万人参加声势浩大的反美伪斗争,1965-02-07,1965-02
印度尼西亚和加纳新闻工作者发表访华观感中国建设成就是贯彻毛泽东思想的结果马里总统府国家监察官欢呼中国原子弹是和平的炸弹黎巴嫩副议长赞扬中国工业突飞猛进文化也欣欣向荣,1965-02-07,1965-02
庆祝朝鲜人民军建军十七周年我解放军总政治部举行报告会朝鲜驻华武官举行电影招待会,1965-02-07,1965-02
参加桑给巴尔革命一周年庆祝活动我政府代表等应邀前往坦桑尼亚,1965-02-07,1965-02
全印度尼西亚中央职工会第一副主席回国,1965-02-07,1965-02
阿尔及利亚议长和印度尼西亚和委会谴责帝国主义指使南朝鲜参加南越战争南朝鲜雇佣军已编成将运往南越充当美帝侵略炮灰,1965-02-07,1965-02
布隆迪留法学生致国王公开信要求政府立即恢复中布外交关系,1965-02-07,1965-02
独立的王冠在于自力更生,1965-02-07,1965-02
国际律师团成员阿根廷著名律师托姆会见我被捕人员家属和有关单位负责人我人员进入巴西活动合法性有目共睹他们决心为正义和祖国荣誉斗争到底各国公众继续抗议巴西当局非法判决并要求立即释放我人员,1965-02-07,1965-02
反对美帝国主义和独裁政权厄瓜多尔数千群众示威游行示威者同警察展开了英勇搏斗,1965-02-07,1965-02
我全总致电南非工会组织坚决支持南非人民正义斗争,1965-02-07,1965-02
法国总理到巴基斯坦访问,1965-02-07,1965-02
刚果（布）一千青年和各界知名人士集会决心同美帝国主义作斗争,1965-02-07,1965-02
约翰逊的空洞诺言掩盖不了事实数千美国黑人因争选举权被捕,1965-02-07,1965-02
法驻美大使拒绝美国对法国外交政策的指责法国不能任人摆布充当被保护者美国官方和报纸继续大肆攻击戴高乐主张,1965-02-07,1965-02
纪念安哥拉人民武装起义四周年我青联和学联声援安哥拉青年和学生反帝斗争阿尔及尔和布拉柴维尔分别举行庆祝集会,1965-02-07,1965-02
杀人犯的自供状,1965-02-07,1965-02
“以情感人”和“以理服人”——驳周谷城的唯情论,1965-02-07,1965-02
要向雷锋同志学习一辈子,1965-02-07,1965-02
干革命不能半条心,1965-02-07,1965-02
到平凡的工作中去锻炼自己,1965-02-07,1965-02
革命需要千百万无名英雄,1965-02-07,1965-02
节约究竟为了什么,1965-02-07,1965-02
对待个人主义一定要象秋风扫落叶,1965-02-07,1965-02
北京地区天气预报,1965-02-08,1965-02
根据当地特点紧紧抓住农业增产重要措施嘉禾县大力改造低产旱土各级领导干部深入不同地区蹲点劳动，作出样板，以点带面,1965-02-08,1965-02
依靠贫农下中农克服自满情绪阳湖大队继续努力改造低产田,1965-02-08,1965-02
改造低产田和种好高产田,1965-02-08,1965-02
英勇反击美国空中强盗越南军民击落敌机四架,1965-02-08,1965-02
