文艺战线上的一场大是大非之争——各地作协分会和文艺单位召开座谈会批判“写中间人物”论,1965-02-18,1965-02
北京地区天气预报,1965-02-19,1965-02
陈毅副总理再次重申中国人民已作好一切准备中国誓作越南人民反美侵略的坚强后盾当前迫切问题是迫使美国侵略军全部撤出印度支那,1965-02-19,1965-02
写信表扬广平永灵义安军民抗击美帝的辉煌战功胡志明主席号召全国一致英勇斗争,1965-02-19,1965-02
六十多国的政府或公众声讨美帝侵越新罪行全世界反美怒潮汹涌澎湃严重警告美国纸老虎：如进一步扩大侵略必遭彻底失败,1965-02-19,1965-02
约翰逊政府进退两难,1965-02-19,1965-02
刘主席、周总理回访尼雷尔总统并进行会谈坦桑尼亚贵宾由刘主席等陪同观看芭蕾舞剧《红色娘子军》,1965-02-19,1965-02
尼泊尔驻华大使举行国庆招待会周恩来总理陈毅李先念副总理等应邀出席凯谢尔·巴哈杜尔大使和陈毅副总理讲话，共祝两国友好关系不断发展,1965-02-19,1965-02
全国妇联向各级妇联发出关于纪念“三八”节的通知号召妇女大树革命雄心苦练过硬本领在革命和建设新高潮中作出更大贡献,1965-02-19,1965-02
尼泊尔王国国庆十五周年  尼泊尔驻拉萨总领事举行招待会,1965-02-19,1965-02
在美帝国主义指使下  蒋匪帮竟要派兵到南越送死,1965-02-19,1965-02
尼雷尔总统参观北京第三棉纺织厂  陈毅副总理陪同参观,1965-02-19,1965-02
全国妇联茶会欢迎尼雷尔总统夫人邓颖超副主席和尼雷尔总统夫人共颂两国妇女友谊,1965-02-19,1965-02
到春耕生产第一线加强具体深入的领导湖北各级领导干部通过蹲点劳动解决实际问题指导面上工作辽宁备耕检查团认真总结增产经验推动群众性比学赶帮活动,1965-02-19,1965-02
立志走知识分子劳动化革命化的道路去年有三十多万城市青年下乡落户,1965-02-19,1965-02
赶在季节前头  推动春耕生产首都组织技术服务队深入农村修理农械安徽排灌机械多的地区集中技术工人到公社巡回检修,1965-02-19,1965-02
发展化肥工业  支援农业生产南京新建碳酸氢铵工程第一期工程投入生产湖北新建荆襄磷矿第一期工程提前一年完工,1965-02-19,1965-02
南京磷肥厂小批生产一种新的高效化肥,1965-02-19,1965-02
北京农药厂成批生产稻田除莠剂“敌稗”,1965-02-19,1965-02
李村大队试验成功新打井法用这种方法打井，可以使每眼井的成本降低近二分之一，出水量增加近一倍，井的使用年限也可以延长,1965-02-19,1965-02
甘肃设计成功新型水轮车这种机器适于在水头低、扬程高的地区使用，一台可以灌溉一百二十多亩田地,1965-02-19,1965-02
深入实际同工农结合是现场设计的实质,1965-02-19,1965-02
现场是广阔的天地,1965-02-19,1965-02
不能看成“办公桌搬家”现场设计是思想作风的革命，不能单纯看成工作方法的改变。否则发挥不了现场设计的作用,1965-02-19,1965-02
再谈怎样理解现场设计,1965-02-19,1965-02
现场设计的真正目的,1965-02-19,1965-02
不要理解得太狭窄,1965-02-19,1965-02
不能本末倒置,1965-02-19,1965-02
印度支那人民会议筹备会议闭幕加强团结和相互支持制止美帝侵略人民会议定二十五日在金边举行，邀请四十个政治组织与运动参加,1965-02-19,1965-02
越南荣市隆重举行庆功大会人民军总司令部号召准备更有力回击美国新战争挑衅南越中区解放军祝贺北方辉煌胜利决心扩大南方战绩,1965-02-19,1965-02
越南《人民报》说约翰逊政府侵犯越南是自讨苦吃美国扩大侵略只能更加陷入绝境越南军民再次击退美伪别动艇  何文楼大校强烈抗议美国新挑衅,1965-02-19,1965-02
对美帝扩大战争挑衅必须狠狠地还击！南越解放军四天歼敌三千毙伤美军四百余,1965-02-19,1965-02
各国公众舆论继续声讨美帝侵略越南的罪行美国侵略越南就是侵略全世界被压迫人民,1965-02-19,1965-02
康托尔亲王在招待苏班德里约宴会上说亚洲人民必须加强团结击败美帝进攻苏班德里约离金边时强调亚洲问题不容外来干涉,1965-02-19,1965-02
约翰逊又叫嚷扩大战争进行讹诈泰勒承认轰炸不中用但仍威胁要继续冒险,1965-02-19,1965-02
介绍德国家人民军的任务和成就德驻华武官举行记者座谈会,1965-02-19,1965-02
非洲人民敌忾同仇反对美国侵略乌干达东非四国驻联合国代表联合宣告不会对乌干达遭受侵略袖手旁观赞、肯和坦桑三国内长会议表示支持乌干达反击侵略的任何措施非洲民族主义政党严厉谴责美国飞机轰炸乌干达并支持乌干达人民反美斗争,1965-02-19,1965-02
乌干达,1965-02-19,1965-02
日本军国主义势力野心不死,1965-02-19,1965-02
冈比亚宣告独立,1965-02-19,1965-02
锡兰国防和外交部驳斥某些报纸的反华诽谤所有反华消息查明全属虚构,1965-02-19,1965-02
阿尔及利亚全力声援阿联本·贝拉总统指责西德威胁阿联,1965-02-19,1965-02
美国公然支持西德对阿联施加压力艾哈德再次压阿联取消乌布利希访问,1965-02-19,1965-02
印度两万多名教师绝食要求改善工作条件,1965-02-19,1965-02
法国总理访印结束,1965-02-19,1965-02
日群众团体和知名人士反对“三矢计划”《读卖新闻》说佐藤政府的“自主外交”是骗人鬼话,1965-02-19,1965-02
日外务大臣偷偷溜进汉城密谋促成“日韩会谈”汉城群众示威要椎名滚回去,1965-02-19,1965-02
美帝策动秘鲁当局掀起新的镇压浪潮秘共第一书记和地方组织许多领导人遭无理逮捕,1965-02-19,1965-02
什么是“三矢计划”？,1965-02-19,1965-02
乌干达击退冲伯军队的入侵,1965-02-19,1965-02
做一颗永不生锈的螺丝钉,1965-02-19,1965-02
为人民服务是幸福的,1965-02-19,1965-02
两个景颇族战士,1965-02-19,1965-02
牧民的心,1965-02-19,1965-02
北京地区天气预报,1965-02-20,1965-02
“全国一致  英勇斗争”越南八百万人民反美示威,1965-02-20,1965-02
首都人民今日盛会欢迎尼雷尔总统,1965-02-20,1965-02
作好春耕春播准备  管好春收夏收作物集中力量抓紧时机打好农业生产第一仗,1965-02-20,1965-02
向大自然作斗争要力争主动,1965-02-20,1965-02
毛泽东主席接见尼雷尔总统刘主席周总理同尼雷尔总统继续会谈,1965-02-20,1965-02
坦桑尼亚大使为尼雷尔总统访华举行招待会周总理和夫人设宴招待尼雷尔总统和夫人周总理和尼雷尔总统共祝中国坦桑尼亚两国人民的友好关系不断发展,1965-02-20,1965-02
贫农下中农来信畅谈迎接农业生产新高潮春耕生产一步主动步步主动,1965-02-20,1965-02
生产计划订得早  备耕工作做得好  把冬季生产高潮引到春季,1965-02-20,1965-02
备耕工作要赶到季节前头龙湾大队社员提高觉悟，生产劲头越来越足,1965-02-20,1965-02
开展比学赶帮备耕又快又好  黄旗庄大队积极挖台田送肥料,1965-02-20,1965-02
进行农田基本建设  改变黄土高原面貌黄河中游地区水土保持获新成绩,1965-02-20,1965-02
抓思想工作  争农业丰收渭南县全面总结经验，干部社员觉悟提高，今年生产准备工作比以往任何一年都好,1965-02-20,1965-02
挖掘企业潜力迎接生产高潮天津工厂企业充分运用闲置设备在生产中发挥作用重庆纺织业调整劳动组织精简层次加强生产第一线,1965-02-20,1965-02
青岛国棉六厂革新两项设备半自动落纱机和半自动插管机代替了手工拔纱管和插管的笨重劳动,1965-02-20,1965-02
拉萨皮革厂大量生产皮毛制品,1965-02-20,1965-02
南越人民欢呼北方同胞痛打美国强盗各人民团体表示决同北方同胞并肩粉碎美国挑衅南越解放军在岘港等地区出击歼灭了大量伪军缴获甚多,1965-02-20,1965-02
工人一手拿锤一手拿枪  农民一手扶犁一手拿枪越南人民加紧促进生产回击美帝挑衅越南祖国战线指出美帝想以战争挑衅吓退越南人民是打错了算盘,1965-02-20,1965-02
反映人民反击美帝空袭的英勇斗争洞海市展出反美斗争速写画,1965-02-20,1965-02
抗议约翰逊政府扩大南越战争美国一些大中学生举行绝食斗争,1965-02-20,1965-02
美帝侵略越南激起世界反美风暴美联社惊呼美国陷于世界人民示威包围之中,1965-02-20,1965-02
乌布利希主席谴责西德干预阿联内政纳赛尔总统谴责西德武装以色列,1965-02-20,1965-02
美帝国主义色厉内荏妄想唬人麦克纳马拉承认侵越丧失信心但又叫嚷蛮干到底,1965-02-20,1965-02
西贡又政变  阮庆再下台政变头目效忠美国主子将再挂“文官”招牌,1965-02-20,1965-02
支持越南人民斗争  抗议美帝侵略越南在保匈德波的亚非拉留学生分别集会示威索非亚人民和华沙大学学生也分别集会示威,1965-02-20,1965-02
苏联部长会议主席柯西金电贺印度支那人民会议筹备会议,1965-02-20,1965-02
中苏友协代表团在苏各地访问鲁德涅夫副主席接见我代表团,1965-02-20,1965-02
科威特访华代表团回国,1965-02-20,1965-02
丹麦商业大臣离京去外地访问,1965-02-20,1965-02
中巴签订贷款协定,1965-02-20,1965-02
参加亚非经济讨论会我代表团到阿尔及尔,1965-02-20,1965-02
中德签订今年交换货物和付款协定李先念副总理接见德政府贸易代表团,1965-02-20,1965-02
以实际爱国行动打击美国敌视印度尼西亚和侵略越南罪行印度尼西亚工人接管八个美国橡胶园苏加诺总统说被雅加达青年接管的美国新闻处大楼将由政府管制,1965-02-20,1965-02
阿尔及利亚外长要求根据新的现实改组联合国联合国的老概念已不适应当前形势美国黑人领袖威廉说目前联合国代表美国操纵的帝国主义力量,1965-02-20,1965-02
请看联合国在某些大国操纵下成了什么东西！阿代表要求联大结束瘫痪状态的动议遭到美苏等国否决毛里塔尼亚代表感谢阿尔巴尼亚打破了大会的昏睡状态沙特阿拉伯和坦桑尼亚代表指责联大欺侮小国成为笑柄,1965-02-20,1965-02
反对美帝国主义操纵下的“韩日会谈”汉城两万多人示威声讨朴正熙卖国集团日本各地人民集会反对椎名到南朝鲜活动《赤旗报》揭露美国加紧策动“日韩会谈”以便纠集侵略集团,1965-02-20,1965-02
国际律师团成员法国律师塞内夏尔夫人揭露巴西非法判决“罪名”站不住脚  判刑毫无道理日本四十五个群众团体集会要求巴西释放中国人员,1965-02-20,1965-02
在战友的国家里访问,1965-02-20,1965-02
专业化和协作是多快好省地发展工业生产力的重要途径,1965-02-20,1965-02
在商业工作中能否说人的因素第一？,1965-02-20,1965-02
《经济研究》、《新建设》、《学术月刊》、《中国经济问题》发表文章继续批评杨坚白等同志的“生产价格论”,1965-02-20,1965-02
有关歌剧《江姐》音乐的评论,1965-02-20,1965-02
伟大的共产主义战士的光辉形象——谈电影《雷锋》的艺术处理,1965-02-20,1965-02
北京地区天气预报,1965-02-21,1965-02
中国坦桑尼亚友好条约,1965-02-21,1965-02
人大常委会第三次会议决定刘主席为签订中坦桑友好条约全权代表,1965-02-21,1965-02
首都盛会欢迎尼雷尔总统和夫人庆祝中国坦桑尼亚签订友好条约刘主席和夫人、周总理、彭市长和夫人、陈副总理、郭副委员长等出席大会,1965-02-21,1965-02
标志着两国友好合作关系进入新的发展阶段中国坦桑尼亚友好条约在京隆重签订刘少奇主席和尼雷尔总统分别代表两国签字,1965-02-21,1965-02
尼雷尔总统和夫人盛宴答谢我国领导人刘主席和夫人、周总理和夫人、彭真和夫人、陈毅、郭沫若、杨明轩、刘宁一等出席,1965-02-21,1965-02
非洲使节为尼雷尔总统访华举行宴会尼雷尔总统和夫人、周总理和夫人、陈毅副总理和亚洲拉丁美洲使节出席,1965-02-21,1965-02
在首都各界欢迎尼雷尔总统和庆祝中国坦桑尼亚友好条约签订大会上彭真市长和尼雷尔总统的讲话,1965-02-21,1965-02
在尼雷尔总统举行的答谢宴会上尼雷尔总统和周恩来总理的讲话,1965-02-21,1965-02
我国主要农业区连下两场雨雪长江中下游部分地区旱象基本解除，华北部分地区旱象有所缓和,1965-02-21,1965-02
刘主席任命徐运北为第二轻工业部部长,1965-02-21,1965-02
痛击美国飞贼,1965-02-21,1965-02
坦桑尼亚贵宾参观北京体育学院,1965-02-21,1965-02
朝日人民联合起来粉碎“韩日基本条约”平壤集会宣布朝鲜人民绝不承认“韩日会谈”的任何协议日共、社会党和三十四个团体联合抗议非法条约的签署,1965-02-21,1965-02
澳共（马列主义者）主席希尔发表声明苏联共产党领导人打算在一九六五年三月一日召开共产党和工人党国际会议的所谓起草委员会会议，这纯粹是赫鲁晓夫所提出的计划的继续,1965-02-21,1965-02
美国加紧拼凑东北亚侵略集团的严重步骤日本南朝鲜悍然签署“日韩基本条约”,1965-02-21,1965-02
阿尔巴尼亚劳动党中央举行全会会议通过政治局报告并确定了相应的任务,1965-02-21,1965-02
世界公众舆论继续支持越南人民反美斗争美帝在越南的冒险无异自掘坟墓以威廉为首的美国革命行动运动指出越南人民的胜利不可遏止,1965-02-21,1965-02
坚决反击美国加紧轰炸老挝解放区暴行老挝桑怒军民击落美机四架并击伤多架桑怒省人民武装剿匪获重大胜利收复邦通等地,1965-02-21,1965-02
阮庆反扑  政变流产,1965-02-21,1965-02
美舰侵入我福建省领海我提出第三百六十三次严重警告,1965-02-21,1965-02
就我政府关于全面禁止和彻底销毁核武器建议荷兰代首相复信周恩来总理,1965-02-21,1965-02
发扬万隆精神  加强亚非人民团结第一次亚非会议主席阿里号召盛大庆祝会议十周年苏加诺总统下令成立执行指挥部负责筹备庆祝活动,1965-02-21,1965-02
研究反对帝国主义和新殖民主义的实际措施亚非经济讨论会将于二十二日召开,1965-02-21,1965-02
刚果（利）东线爱国武装领导人之一苏米亚洛盛赞毛主席声明毛主席声明鼓舞刚果人民反帝斗争美国等帝国主义屠杀刚果人民中刚两国人民是反帝斗争中的兄弟刚果爱国武装攻占一交通中心  英报惊呼伪军失去主动,1965-02-21,1965-02
保卫乌干达主权  制止美国侵略乌干达大力开展征兵工作，两千多退伍军人响应号召报到非亚公众和舆论纷纷谴责美帝挑衅，热烈支持乌干达反侵略的斗争,1965-02-21,1965-02
印度尼西亚青年反美爱国运动日益扩大棉兰青年接管美国新闻处大楼群众扯下美国国旗升起了印度尼西亚国旗,1965-02-21,1965-02
中国亚非团结委员会等团体分别发出电报支持乌干达人民反美爱国正义斗争,1965-02-21,1965-02
莫三鼻给民族民主联盟领导人说决心把武装斗争进行到底自由战士一月下半月打死葡殖民军三十多,1965-02-21,1965-02
庆祝尼泊尔王国民主日加德满都举行盛大游行,1965-02-21,1965-02
葡属几内亚人民军获新胜利解放区粮食丰收生活愈来愈好,1965-02-21,1965-02
汉弗莱叫嚷加强美国对联合国的控制鼓吹建立“联合国军”充当镇压民族解放运动工具主张借“防止核扩散”的幌子推进美国核讹诈战略,1965-02-21,1965-02
反对在学校里实行种族歧视纽约黑人青少年连日举行示威塞尔马市黑人再次示威抗议拖延黑人选民登记工作,1965-02-21,1965-02
在“民权法”的“保障”下,1965-02-21,1965-02
“中间人物”和典型问题——驳邵荃麟同志“写中间人物”的文学主张,1965-02-21,1965-02
北京地区天气预报,1965-02-22,1965-02
把农村工作的重心转到春耕生产方面来,1965-02-22,1965-02
广东番禺县社领导干部及时深入基层树立备耕样板推动备耕工作,1965-02-22,1965-02
周总理电贺亚非经济讨论会开幕祝贺会议对建设完全独立自主的、先进的、富强的新亚洲、新非洲这一崇高事业作出积极的贡献。,1965-02-22,1965-02
高举毛泽东思想红旗实现企业管理革命化,1965-02-22,1965-02
气象和水利部门预报今春很多地区可能出现干旱各地要及早准备防旱抗旱,1965-02-22,1965-02
由刘主席和夫人、陈毅副总理等陪同尼雷尔总统和夫人离京去外地访问周恩来总理和彭真郭沫若杨明轩刘宁一副委员长等到机场欢送南京市各界群众冒雪到机场欢迎  江苏省副省长设宴招待贵宾,1965-02-22,1965-02
我们欢迎干部坚持劳动,1965-02-22,1965-02
干部参加劳动真解决问题,1965-02-22,1965-02
“他们都象瓦工了”,1965-02-22,1965-02
有技术的干部更要参加劳动,1965-02-22,1965-02
坚持下去（编后）,1965-02-22,1965-02
北京一批小麦科学工作者到京郊进行麦田调查提出建议抓紧小麦返青管理是夏季增产重要关键,1965-02-22,1965-02
从最坏处着想，向最好处努力  内蒙古牧民顽强抗灾争牧业丰收延吉勇南大队发挥群众集体智慧变雪害为雪利备耕农活比往年好,1965-02-22,1965-02
周总理观看话剧《女飞行员》,1965-02-22,1965-02
做一个高尚的人,1965-02-22,1965-02
九年服役九年红  ——海军战士王行志的共产主义精神,1965-02-22,1965-02
南越人民武装一月份歼敌七千人解放军与游击队出击千余次，歼灭美国侵略者和伪军军官各二百名敌占区群众斗争蓬勃发展美伪统治陷于严重危机,1965-02-22,1965-02
朴正熙集团公然充当美帝国主义侵越的帮凶南朝鲜为美国提供的炮灰已运往南越,1965-02-22,1965-02
各国人民决不许约翰逊扩大战争挑衅拉美各国和美英公众继续示威集会抗议美国侵犯越南,1965-02-22,1965-02
老挝爱国战线党武装部队最高指挥部强烈抗议美机轰炸桑怒号召军民加倍打击敌人,1965-02-22,1965-02
老挝人民严惩美国侵略者,1965-02-22,1965-02
欢送苏中友协代表团等郭沫若和夫人举行宴会,1965-02-22,1965-02
中苏友协代表团等访苏后回到北京,1965-02-22,1965-02
南越飞机侵入柬领空撒放化学毒药柬埔寨人民痛斥南越当局的野蛮罪行,1965-02-22,1965-02
法国周刊讽刺美国在南越骑虎难下约翰逊扩大冒险是自走绝路输掉了战争还能耍什么花招,1965-02-22,1965-02
越《人民报》说西贡新政变是泰勒在幕后策动的美国准备随时换马  傀儡无法调和矛盾南越政局混乱证明伪军和伪政权瓦解不可避免,1965-02-22,1965-02
奴才不争气  主子干着急美报惊呼西贡新政变表明全面崩溃迫在眉睫美众议院军委会主席说南越换“政府”甚于美国佬换衬衣,1965-02-22,1965-02
非洲公众舆论继续声援乌干达人民反帝正义斗争侵略乌干达就是侵略全非洲苏丹总理说苏丹人民对这种侵略不会置之不理,1965-02-22,1965-02
朝鲜舆论强烈谴责美国一手导演的“韩日基本条约”美国力图拼凑反共军事政治集团在朝鲜和远东地区扩大战争温床,1965-02-22,1965-02
锡兰总理班达拉奈克夫人发表公报再次驳斥锡兰一些报刊的反华言论,1965-02-22,1965-02
美国马里翁市黑人示威遭军警武力镇压全市四千居民中约有九百名黑人示威者被当局逮捕,1965-02-22,1965-02
刚果（布）决定加强农村工作全体政府成员将到农村分区负责,1965-02-22,1965-02
肯尼亚实行鼓励农民增产水稻政策,1965-02-22,1965-02
努力使食糖自给自足坦噶尼喀新建两家糖厂,1965-02-22,1965-02
“日韩会谈”和美国的战争阴谋,1965-02-22,1965-02
坦噶尼喀非洲民族联盟创建地被宣布作为纪念地,1965-02-22,1965-02
苏班德里约访问亚洲一些国家后回国,1965-02-22,1965-02
刚果（布）全国革命运动中央委员会举行会议通过决议同意政府改革国家人民军的计划,1965-02-22,1965-02
法国外长同约翰逊、腊斯克等会谈结束法美两国政策仍然存在尖锐分歧巴黎报纸认为戴高乐同约翰逊在一切方面都是互相排斥的,1965-02-22,1965-02
北大西洋公约组织内部矛盾重重美国哀叹“团结”西欧盟国不易麦克纳马拉鼓吹建立“盟国核力量”来维持美国的核垄断地位,1965-02-22,1965-02
加纳大力发展国民经济今年投资比去年增加约四分之一,1965-02-22,1965-02
象徐寅生同志那样活学活用毛泽东思想,1965-02-22,1965-02
坚持一分为二  才能不断前进,1965-02-22,1965-02
自力更生  克服困难,1965-02-22,1965-02
解决一个矛盾就前进一步,1965-02-22,1965-02
迎春会,1965-02-22,1965-02
小刘为什么变了,1965-02-22,1965-02
老师傅一席话,1965-02-22,1965-02
立什么样的功？,1965-02-22,1965-02
说革命的相声,1965-02-22,1965-02
生产高潮和领导艺术,1965-02-23,1965-02
由刘少奇主席和夫人、陈毅副总理等陪同尼雷尔总统和夫人抵上海受到热烈欢迎上海副市长设宴招待贵宾  南京各界群众到机场欢送贵宾,1965-02-23,1965-02
北京地区天气预报,1965-02-23,1965-02
刘主席周总理陈外长电贺中国刚果（布）建交一周年中国坚决支持刚果（布）反对美帝颠覆的斗争我外交部举行盛大招待会，周恩来总理等出席章汉夫副部长和库班吉萨·约瑟夫临时代办讲话，共颂两国人民的战斗友谊,1965-02-23,1965-02
毛泽东主席同党和国家其他领导人接见一些会议的代表和战士演出队人员,1965-02-23,1965-02
群众革命热情高涨掀起生产高潮上海染料厂在革命化的道路上不断前进他们的经验是发扬民主，依靠群众，坚持干部参加劳动，实行点面结合的领导方法  一月份生产计划超额完成，消灭了二类品，增加了新品种,1965-02-23,1965-02
生产要有高潮，思想先有高潮,1965-02-23,1965-02
想挖生产潜力先挖思想潜力,1965-02-23,1965-02
干部会上的七天和群众中的七天——组织生产高潮从难到易的一些体会,1965-02-23,1965-02
现场毕业设计给我的教育高等学校的设计教学也要进行革命关于“用革命精神改进设计工作的讨论”  ２０,1965-02-23,1965-02
要练专业基本功，更要练思想功高等学校的设计教学也要进行革命关于“用革命精神改进设计工作的讨论”  ２０,1965-02-23,1965-02
建筑设计教学必须改革高等学校的设计教学也要进行革命关于“用革命精神改进设计工作的讨论”  ２０,1965-02-23,1965-02
要学习设计工农喜爱的新建筑高等学校的设计教学也要进行革命关于“用革命精神改进设计工作的讨论”  ２０,1965-02-23,1965-02
政治要挂帅（编后）,1965-02-23,1965-02
《解放军报》发表《怎样突出政治》的社论政治思想工作要成为全盘工作的基础社论指出：突出政治，就是在一切工作中以毛泽东思想挂帅；以毛泽东思想为武器，抓好部队的活思想，加强部队的政治教育,1965-02-23,1965-02
全国体育工作会议确定今年方针任务普及和提高相结合大力开展体育运动号召体育工作者和运动员高举毛泽东思想红旗，为实现体育工作革命化而奋斗,1965-02-23,1965-02
美国加剧远东紧张局势的又一个严重步骤,1965-02-23,1965-02
朝鲜北部掀起声讨美朴日勾结的怒潮严正宣告“韩日基本条约”完全非法无效日共与社会党领导人表示将开展统一斗争粉碎“日韩会谈”,1965-02-23,1965-02
中国商品在巴黎,1965-02-23,1965-02
中日友协致电日本各界争取日中友好大会谴责佐藤政府阻挠日中友好,1965-02-23,1965-02
老挝桑怒市各族各界一千多人集会  声讨美帝及其走狗轰炸解放区寮方电台报道十九日击落美机七架,1965-02-23,1965-02
美国军舰侵入我广东地区领海  我提出第三百六十四次严重警告,1965-02-23,1965-02
林彪元帅电贺苏联建军节,1965-02-23,1965-02
我政府贸易代表团去波兰,1965-02-23,1965-02
苏中友协代表团等离京回国,1965-02-23,1965-02
查禾多大使为我科技代表团饯行,1965-02-23,1965-02
在刘少奇主席和曹荻秋副市长等陪同下  尼雷尔总统在上海参观,1965-02-23,1965-02
随时准备战斗、随时准备参军、随时准备战胜任何敌人河内十二万青年参加“三个准备”运动这个运动在越南其他地区也获得了迅速发展,1965-02-23,1965-02
西贡局势乱极  三天两次政变美军方参与南越伪军“少壮派”同阮庆剧烈倾轧,1965-02-23,1965-02
加纳阿尔及利亚马里和阿联驻刚果（布）使馆重申完全和坚决支持刚果（布）反帝斗争凯塔总统强调对帝国主义策划的阴谋不能漠视,1965-02-23,1965-02
比共中央致函越南劳动党中央坚决支持越南人民抗击美国侵略指出美帝国主义被赶出南越的时刻已经不远了,1965-02-23,1965-02
苏米亚洛谴责美比野蛮侵略刚果（利）赞扬中国人民真诚援助刚果民族斗争,1965-02-23,1965-02
叙利亚判处两名美国间谍死刑把负责这些间谍活动的两名美国外交人员驱逐出境,1965-02-23,1965-02
我亚非团结委员会和国际贸易促进委员会  祝贺亚非经济讨论会成功,1965-02-23,1965-02
