希望画家多画幻灯片,1965-10-13,1965-10
满足放映员的要求,1965-10-13,1965-10
平沙莽莽变绿洲——艺术性纪录片《军垦战歌》观后,1965-10-13,1965-10
北京地区天气预报,1965-10-14,1965-10
云南各族各界十万多人冒雨欢迎柬埔寨贵宾西哈努克亲王和夫人从哈尔滨到昆明刘少奇主席在哈尔滨机场欢送，陈副总理陪同前往,1965-10-14,1965-10
积极执行购油留饼方针为农业生产服务招远粮食部门协助社队自榨油料四年来全县生猪饲养头数和粮油作物产量大增，粮食部门经营费用大量节省,1965-10-14,1965-10
贺副总理和中央代表团部分同志回京乌鲁木齐各族各界十多万人载歌载舞欢送彭真乌兰夫罗瑞卿刘澜涛杨尚昆同志等到机场欢迎,1965-10-14,1965-10
突出政治必须抓好活的思想,1965-10-14,1965-10
一切工作都是为了革命  从老岗位到新岗位——记志丹县七位退休同志办果园的革命事迹,1965-10-14,1965-10
高举毛泽东思想红旗占领戏剧舞台西南话剧地方戏观摩演出获新成就川剧艺术在反映革命的现代生活方面显示新的生命力,1965-10-14,1965-10
噶尔昆沙人民热烈欢迎毛主席派来的亲人中央代表团五分团到达西藏西部阿里地区,1965-10-14,1965-10
在新社会越活越年青——记贺龙副总理会见维族百岁老人买买提木沙,1965-10-14,1965-10
胡主席勉励清化军民进一步打击美侵略者表扬击落第一百架美机的胜利越南北方已共击落美机六百五十二架,1965-10-14,1965-10
美国“结束越南战争全国委员会”发出呼吁全美国人民起来反对侵越战争,1965-10-14,1965-10
高呼美帝国主义从越南南朝鲜日本和整个亚洲滚出去东京五万多人集会示威反对批准“日韩条约”宫本总书记提出当前任务号召推翻佐藤政府日比谷公园一万人集会纪念浅沼稻次郎逝世五周年,1965-10-14,1965-10
马桑巴—代巴总统说已把边境居民武装起来重申决心抗击冲伯集团新挑衅,1965-10-14,1965-10
英军对也门军事据点发动突袭  也门政府抗议英国侵略挑衅,1965-10-14,1965-10
津巴布韦民族主义政党领导人声明  将以武装斗争反对殖民统治,1965-10-14,1965-10
卡布拉尔强调要把武装斗争进行到底葡属几内亚人民武装已解放了一半土地,1965-10-14,1965-10
巴报谴责铁托为结党营私之徒  铁托支持印侵略破坏亚非团结,1965-10-14,1965-10
国际简讯,1965-10-14,1965-10
美国“越南日委员会”号召举行反对美国侵越“国际抗议日”现在是世界人民大呼美帝住手的时候了加拿大多伦多“国际越南日委员会”号召人民示威反对美国侵略越南,1965-10-14,1965-10
老挝爱国战线党中央副主席费当号召人民加强团结把美国侵略者全部赶出老挝老挝解放军指挥部号召指战员勇往直前打败美帝及其走狗,1965-10-14,1965-10
在平壤庆祝朝鲜劳动党成立二十周年的大会上  金日成委员长的报告,1965-10-14,1965-10
李先念副总理接见智利客人,1965-10-14,1965-10
锡兰政府贸易代表团回国,1965-10-14,1965-10
马里发展部长库亚特回国,1965-10-14,1965-10
印度尼西亚中爪哇省长等回国,1965-10-14,1965-10
越南一位客人到京,1965-10-14,1965-10
波兰国立“西里西亚”民间歌舞团到京,1965-10-14,1965-10
日本仓敷人造丝公司总经理等到京,1965-10-14,1965-10
我人民解放军总政治部举行宴会  招待阿尔巴尼亚人民军歌舞团,1965-10-14,1965-10
德舞蹈团在京首次演出  乌兰夫副总理观看并接见舞蹈团人员,1965-10-14,1965-10
到广阔的天地中去飞翔,1965-10-14,1965-10
经济理论工作者的新课题,1965-10-14,1965-10
经济理论要为五亿农民服务,1965-10-14,1965-10
本报理论宣传部邀请北京部分经济理论工作者座谈经济理论工作联系实际面向农村问题,1965-10-14,1965-10
为建设社会主义新农村贡献力量河北财经学院教师举行座谈会,1965-10-14,1965-10
战斗的颂歌  永恒的友谊,1965-10-14,1965-10
站柜台和干革命,1965-10-14,1965-10
“京剧教唱”办得好,1965-10-14,1965-10
健康  学业  主动,1965-10-14,1965-10
薄膜上的虹彩,1965-10-14,1965-10
北京来了演出队,1965-10-14,1965-10
北京地区天气预报,1965-10-15,1965-10
西哈努克亲王陈副总理在云南省长宴会上发表重要讲话中柬两国人民永远紧密团结一起  争取反美反殖共同斗争最后胜利云南省人委举行文艺晚会欢迎柬埔寨贵宾,1965-10-15,1965-10
周总理在招待柬中友协代表团宴会上说中国人把高棉人看成是最好的朋友,1965-10-15,1965-10
周总理接见刚果（布）客人,1965-10-15,1965-10
陈副总理说当前人类的最大希望是坚决反对美帝中国敢于为彻底打败美帝国主义冒危险,1965-10-15,1965-10
依靠人民公社集体力量战胜各种自然灾害四川水稻大部增产  陕西早秋收成较好福建山区人民喜割晚稻，贵州山区社员抢收秋粮,1965-10-15,1965-10
收“破烂”是革命工作搞工业，搞商业，都是为了进行社会主义革命，加速社会主义建设。我们虽然没有直接参加生产，可是工厂把我们看作生产中不可缺少的一员。,1965-10-15,1965-10
我乐意跟“破烂”打一辈子交道认清回收废旧物资工作跟工农业生产和人民生活有密切关系，就感觉干这一行不是没出息，而是可以大有作为。,1965-10-15,1965-10
两个岗位  一个目标废旧物资公司用规格对路的原料支援了我们，我们一定要用质量好的产品支援农村。,1965-10-15,1965-10
一新耳目（编后）,1965-10-15,1965-10
发扬革命精神创制新产品,1965-10-15,1965-10
活跃在各地报纸上的活思想,1965-10-15,1965-10
山东建成一座化肥厂,1965-10-15,1965-10
简讯,1965-10-15,1965-10
心为革命水长流,1965-10-15,1965-10
“老农会”的新风格,1965-10-15,1965-10
人民需要这样的“傻子”,1965-10-15,1965-10
烈火红心,1965-10-15,1965-10
十转山上绿化人,1965-10-15,1965-10
阮文追烈士,1965-10-15,1965-10
我经济建设展览会在布加勒斯特闭幕罗四十多万观众盛赞我建设巨大成就,1965-10-15,1965-10
欢迎波兰“西里西亚”民间歌舞团  我对外文委举行宴会,1965-10-15,1965-10
中捷网球队在京进行首次友谊赛,1965-10-15,1965-10
第六次日本民主青年同盟访华代表团到京,1965-10-15,1965-10
东京工人青年和学生集会  欢迎中华全国总工会代表团,1965-10-15,1965-10
孙德胜接见中越友协代表团,1965-10-15,1965-10
布迈丁接见曾涛大使,1965-10-15,1965-10
为中越友协代表团访越  我驻越临时代办举行宴会,1965-10-15,1965-10
为我文化代表团和杂技团访法  我驻法大使举行招待会,1965-10-15,1965-10
南越解放工联青联就阮文追牺牲一周年发出号召学习阮文追的光辉榜样消灭美国侵略者越南北方群众团体决定举行“竞赛月”加紧战斗生产纪念烈士,1965-10-15,1965-10
一个阮文追倒下去，千万个阮文追站起来！全越军民掀起学习阮文追为阮文追报仇的浪潮,1965-10-15,1965-10
英雄战士阮文然,1965-10-15,1965-10
刚果（布）代表在联大谴责美国侵略越南  要求美国侵略军撤出南越,1965-10-15,1965-10
美帝是亚非拉人民共同敌人坦报说南越人民反美斗争鼓舞非洲自由战士,1965-10-15,1965-10
高呼“让我们推翻佐藤内阁！”“美国从亚洲滚出去！”东京等地万人集会反对批准“日韩条约”日本禁止原子弹氢弹协议会号召人民起来展开斗争,1965-10-15,1965-10
中越驻老挝经济文化代表团  联合举行宴会欢庆老挝革命节,1965-10-15,1965-10
印军连日来不断进攻巴基斯坦据点巴沙尼号召巴人民团结粉碎印度侵略巴舆论谴责大国操纵联合国不解决克什米尔问题,1965-10-15,1965-10
苏美又达成使美国满意的协议将共同出版有关空间生物学等研究刊物,1965-10-15,1965-10
美国惧怕泰国爱国力量发展  策动泰反动派加强警察力量妄图镇压,1965-10-15,1965-10
日本人民决心粉碎“日韩条约”,1965-10-15,1965-10
朴正熙集团的丑剧,1965-10-15,1965-10
在“韩日基本条约”中为什么用“韩”字代表南朝鲜？,1965-10-15,1965-10
日垄断资本加紧渗入南朝鲜,1965-10-15,1965-10
“日韩条约”是美国一手撮合的,1965-10-15,1965-10
认识到反对美帝侵略越南也就是争取自己的切身权利美国人民反对侵越的斗争正推向新水平,1965-10-15,1965-10
为革命而画——记四川版画工作者的创作活动,1965-10-15,1965-10
草原歌声飞北京,1965-10-15,1965-10
北京地区天气预报,1965-10-16,1965-10
依靠五亿农民办水利,1965-10-16,1965-10
周总理接见并宴请北加里曼丹客人,1965-10-16,1965-10
陈毅副总理在昆明举行宴会  热烈欢送西哈努克亲王和夫人宾主共祝两国永恒的战斗友谊不断巩固发展,1965-10-16,1965-10
节约用煤三分靠炉灶七分靠思想,1965-10-16,1965-10
紧密依靠群众，深入发动群众，设计施工革命化宣惠河疏浚工程充分体现大寨精神,1965-10-16,1965-10
刘主席接见柬中友协代表团,1965-10-16,1965-10
水利工程设计革命化的一个范例——宣惠河工程设计是怎样诞生的,1965-10-16,1965-10
毛主席教导我这样做,1965-10-16,1965-10
立志做好查号工作,1965-10-16,1965-10
为人民、为革命当好普通一兵,1965-10-16,1965-10
全心全意为农村医疗卫生事业服务,1965-10-16,1965-10
广东安徽卫生教育部门积极为农村培养医务人员,1965-10-16,1965-10
河内集会纪念阮文追烈士英勇就义一周年发扬革命英雄主义精神战胜美国强盗,1965-10-16,1965-10
越南北方军民击落美机五架,1965-10-16,1965-10
《象他那样生活》鼓舞我国广大读者许多读者表示要学习阮文追的革命精神以实际行动打击帝国主义这本书在我国已发行近三百万册并被改编成戏曲舞蹈在各地上演,1965-10-16,1965-10
波兰民间歌舞团在京首次演出乌兰夫陆定一副总理观看演出并接见波艺术家,1965-10-16,1965-10
日共中央领导人接见我工会代表团,1965-10-16,1965-10
中越友协代表团回到北京,1965-10-16,1965-10
中非共和国妇女代表团到京,1965-10-16,1965-10
柬足球队在广州进行最后一场友谊赛,1965-10-16,1965-10
苏联国家网球队到京,1965-10-16,1965-10
苏丹《时代报》主编到京,1965-10-16,1965-10
中捷网球队在京继续进行友谊赛,1965-10-16,1965-10
南越军民今年七个月来歼灭美军近五千名阮文追故乡广南省军民为烈士报仇消灭美军一千六百多平定省解放军为阮文追复仇连日出击歼灭伪军三百多美军六十多,1965-10-16,1965-10
罗素痛斥美帝侵越暴行好比希特勒当众撕毁工党党证抗议英政府屈从美国政策,1965-10-16,1965-10
请看美国少爷兵在南越丛林中多么狼狈！,1965-10-16,1965-10
蹩脚的美国佬,1965-10-16,1965-10
老挝爱国力量举行全国政治协商会议苏发努冯亲王号召紧密团结共同抗美救国争取新的胜利,1965-10-16,1965-10
老挝爱国军民二十年来获得辉煌胜利解放领土五分之三  歼敌七万八千余  击落敌机一百六十五架,1965-10-16,1965-10
不准把日本变为侵略基地  东京万人集会示威反对“日韩条约”,1965-10-16,1965-10
朝鲜电工委员会发言人发表谈话  谴责日政府拒绝朝代表团入境欢迎国际大会维护自己权益的决议,1965-10-16,1965-10
巴基斯坦国民议会议长  要求给克什米尔人民自决权,1965-10-16,1965-10
柬埔寨代表在联大谴责泰国追随美国侵越泰国已变成美国基地和殖民地柬政府发表声明抗议泰国在柬境埋设地雷,1965-10-16,1965-10
尼雷尔总统强调接受外援不能有损独立  坦桑将继续奉行不结盟政策,1965-10-16,1965-10
非洲统一组织部长理事会第五次会议开幕,1965-10-16,1965-10
叙新总理强调尊重积极中立原则,1965-10-16,1965-10
非洲将升起又一面独立旗子  英国被迫宣布贝专纳在明年独立,1965-10-16,1965-10
美国人民积极准备反对侵越“全国抗议日”全国将有约一百个城市成千上万人参加各种形式的抗议活动美军火工人向麦克纳马拉示威要求美军撤出南越,1965-10-16,1965-10
贝专纳,1965-10-16,1965-10
“金色的国家”——科威特,1965-10-16,1965-10
一场漂亮的海上歼灭战〔报告文学〕,1965-10-16,1965-10
南海凯歌,1965-10-16,1965-10
“司令部”的革命化,1965-10-16,1965-10
为四川工艺美展叫好,1965-10-16,1965-10
贫下中农心里的好闺女,1965-10-16,1965-10
天是什么？,1965-10-16,1965-10
南海铜墙,1965-10-16,1965-10
荣昌泡菜罐、茶壶,1965-10-16,1965-10
伟大的毛泽东思想是力量的源泉,1965-10-16,1965-10
北京地区天气预报,1965-10-17,1965-10
满载中国人民对柬埔寨人民的战斗友情西哈努克亲王和夫人离开我国陈毅副总理和云南省昆明市十万多人热烈欢送贵宾,1965-10-17,1965-10
一手抓社会主义教育运动  一手抓经常性政治思想工作财贸工作必须进一步突出政治,1965-10-17,1965-10
周总理接见印度尼西亚客人,1965-10-17,1965-10
各党派无党派人士举行双周座谈会热烈讨论了当前国内外形势，董必武同志出席并发了言,1965-10-17,1965-10
今年秋季出口商品交易会在广州开幕展出商品近三万种，其中新品种、新花色商品达七千多种,1965-10-17,1965-10
西哈努克亲王在仰光发表声明苏联领导人突然取消对他的邀请，不知道这种蓄意侮辱的原因何在？柬埔寨对此将加以考虑。,1965-10-17,1965-10
简讯,1965-10-17,1965-10
西哈努克亲王热情评论陈毅副总理对中外记者的谈话中国对美帝的警告有利于维护世界和平只有中国的坚定立场才能阻止美帝国主义在世界上燃起战火的企图,1965-10-17,1965-10
我们几个宰猪工人创造了新机器,1965-10-17,1965-10
自觉革命力量无穷只有把自己的工作和建设社会主义的强大祖国联系起来，工作才有劲头，才能有所发明，有所创造,1965-10-17,1965-10
我对磨刀有了感情刀剪是工人手里的武器，刀剪和人民生活息息相关。磨好刀剪，就是为人民服务,1965-10-17,1965-10
哪里需要就到哪里去,1965-10-17,1965-10
干革命工作要精益求精,1965-10-17,1965-10
《毛泽东选集》第二卷盲文版出版,1965-10-17,1965-10
热情歌颂西北地区汉藏等族人民革命精神歌剧“向阳川”话剧“昆仑战风雪”在京演出西南区一批小型革命现代戏受到观众热烈赞扬,1965-10-17,1965-10
亚非团结组织和非洲民族主义政党谴责美国和谈阴谋要求美侵略军立即撤出南越,1965-10-17,1965-10
响应关于举行“国际抗议日”的号召伦敦波恩群众示威反对美侵越,1965-10-17,1965-10
风起云涌的美国人民抗议侵越运动,1965-10-17,1965-10
愤怒高呼“制止帝国主义战争！”“美国从越南滚出去！”美国人民反对侵越示威浪潮席卷全国伯克利市一万群众不顾警察镇压集会游行声讨约翰逊政府侵越政策,1965-10-17,1965-10
美国人民要求停止侵越战争,1965-10-17,1965-10
约翰逊玩火,1965-10-17,1965-10
康开《部队新闻》号召人民解放军粉碎美帝及其走狗进攻老挝人民坚决战斗直到斩断美帝魔爪,1965-10-17,1965-10
日共国会议员团谴责佐藤政府企图强行批准“日韩条约”日本人民将为推翻佐藤政府和解散国会而斗争佐藤和椎名竭力掩饰“日韩条约”的侵略性并再次为美帝侵越帮腔,1965-10-17,1965-10
尼雷尔总统任命驻中国新大使,1965-10-17,1965-10
我妇联副主席宴请中非共和国客人,1965-10-17,1965-10
来我国参加新运会会议和参观访问后各国体育界人士绝大部分已经回国,1965-10-17,1965-10
我新闻工作者代表团到达柬埔寨,1965-10-17,1965-10
我新闻工作者代表团访问北欧四国后回京,1965-10-17,1965-10
我新闻工作者代表团从智利回京,1965-10-17,1965-10
柬埔寨王国农业代表团到京,1965-10-17,1965-10
智利三位客人离京回国,1965-10-17,1965-10
我技术进口总公司和意义诺赛蒂公司签订订购大口径无缝钢管扩管厂设备合同,1965-10-17,1965-10
中国杂技艺术团在法国冈城演出,1965-10-17,1965-10
菲律宾火山爆发成灾  我红十字会电慰并捐款救济菲灾民,1965-10-17,1965-10
彭真副委员长接见日本工业展览会展览团长等,1965-10-17,1965-10
英雄的山萝城,1965-10-17,1965-10
中华全国新闻工作者协会和印度尼西亚新闻工作者协会在北京签署联合声明,1965-10-17,1965-10
报眼口号,1965-10-17,1965-10
不断改造思想才能做好工作,1965-10-17,1965-10
谈谈领导干部改造思想的必要性,1965-10-17,1965-10
学一辈子《为人民服务》为人民服务一辈子,1965-10-17,1965-10
为谁而忙？,1965-10-17,1965-10
彩塑的异彩——看天津彩塑展览,1965-10-17,1965-10
魏大爷给我们上了一课,1965-10-17,1965-10
曲艺队员上山乡,1965-10-17,1965-10
怕与不怕,1965-10-17,1965-10
常在河边走  也能不湿脚,1965-10-17,1965-10
取经,1965-10-17,1965-10
北京地区天气预报,1965-10-18,1965-10
刘主席和夫人、周恩来总理  会见刚果（布）和阿联贵宾,1965-10-18,1965-10
尼新任大使拜会朱委员长,1965-10-18,1965-10
解放军某部八连高举毛泽东思想红旗出色完成各项任务国防部授予“英雄八连”光荣称号北京部队领导机关隆重举行命名大会,1965-10-18,1965-10
“美国佬回来罢！”“让约翰逊自己去打这场仗！”美国人民继续大示威反对侵越战争美国当局张惶恐惧出动大批军警特务流氓进行阻挠破坏,1965-10-18,1965-10
觉醒了的美国人民在战斗，在前进！,1965-10-18,1965-10
马桑巴—代巴总统夫人和萨布里副总统夫人到京刘主席和夫人、周总理和夫人设宴热烈欢迎贵宾宾主共祝中国、刚果（布）、阿联三国人民和妇女的友谊不断加强,1965-10-18,1965-10
实现县委领导革命化  建设社会主义新农村（三）（编者按）,1965-10-18,1965-10
毛主席语录,1965-10-18,1965-10
带着问题学习毛主席著作,1965-10-18,1965-10
“敢”字当头，还是无所作为？推广大寨先进经验，首先要求县委领导革命化，并带动基层干部层层革命化，正确接受经验教训，彻底破除因循守旧思想,1965-10-18,1965-10
关键在于领导核心革命化县委常委首先要革命化——先有思想的革命化，才有行动的革命化——领导革命化要抓关键性的问题,1965-10-18,1965-10
我们改变了“大赖精神”县委如果缺乏革命思想，不用自力更生革命精神武装群众，在生产建设上就会产生大寨精神的对立面——“大赖精神”,1965-10-18,1965-10
谈“化”,1965-10-18,1965-10
上海制成精密微量天平这种天平的最小感量为百万分之一克，最大称量为两克。它的误差达到了国际上比较先进的水平,1965-10-18,1965-10
南京大量生产水银开关水银开关是强电流工程自动控制设备上的重要元件，过去大部分依赖进口，现在即可满足各地需要,1965-10-18,1965-10
一切工作都是为了革命  操刀卖肉就是干革命,1965-10-18,1965-10
一切工作都是为了革命  三轮车越踩越有劲,1965-10-18,1965-10
一切工作都是为了革命  革命要我干啥就干啥,1965-10-18,1965-10
我国第一个使用机械疏浚平原河道的试点工程卫河清淤首期工程全部竣工,1965-10-18,1965-10
天山南北各族人民热情迎亲人中央代表团各分团正在新疆各地进行慰问,1965-10-18,1965-10
倪志钦跳过二米二四  这是目前男子跳高的世界最好成绩,1965-10-18,1965-10
陈家全十秒一跑完百米  这是目前男子百米的世界最好成绩,1965-10-18,1965-10
镶牙记,1965-10-18,1965-10
依靠谁发展农村副业？,1965-10-18,1965-10
阿尔巴尼亚劳动党和新西兰共产党签署联合声明只有排除修正主义者才能实现国际共运的团结必须继续进行公开论战进一步揭露修正主义者无保留地支持越南人民反美斗争，谴责美国在修正主义者支持下玩弄和谈骗局,1965-10-18,1965-10
新共代表团结束在阿尔巴尼亚的友好访问,1965-10-18,1965-10
西哈努克亲王返国受到隆重欢迎在缅甸启程前说柬将建议延期召开亚非会议,1965-10-18,1965-10
筹备亚非会议的常设委员会举行第九次会议,1965-10-18,1965-10
苏米亚洛揭露伪新总理是杀害卢蒙巴凶手之一刚果（利）爱国者将继续斗争反对伪政权伪总统卡萨武布撵掉冲伯扶起金巴作新傀儡,1965-10-18,1965-10
罗马尼亚文化代表团到京,1965-10-18,1965-10
罗两医务工作者到京,1965-10-18,1965-10
柬埔寨贸易部代表团到京,1965-10-18,1965-10
苏丹法律工作者代表团到京,1965-10-18,1965-10
加拿大人和美国人在多伦多示威庄严宣布同美国侵越战争断绝一切关系,1965-10-18,1965-10
高呼美军撤出越南，反对英政府追随美国侵越英国公众在美使馆前彻夜示威爱尔兰和挪威公众也在美使馆前示威,1965-10-18,1965-10
澳大利亚公众集会示威抗议美国侵越  反对孟席斯政府派兵参战,1965-10-18,1965-10
阿联《共和国报》赞扬美国人民斗争  美国侵略集团在国内空前孤立,1965-10-18,1965-10
响应美国“越南日委员会”举行“国际抗议日”的号召英属圭亚那和阿根廷公众分别举行示威,1965-10-18,1965-10
意大利许多城市人民举行反美示威扛着南越民族解放阵线大旗高呼美国佬滚出越南,1965-10-18,1965-10
腊斯克的诡辩术,1965-10-18,1965-10
越《人民报》热烈赞扬美国人民发起“国际抗议日”美国人民给约翰逊沉重一击黎廷探撰文强调美帝是美越两国人民的共同敌人,1965-10-18,1965-10
从一个参议员收到的公民来信  看美国人民反对侵越战争,1965-10-18,1965-10
比利时人民支援越南人民反美斗争高举南越民族解放阵线旗帜举行示威,1965-10-18,1965-10
伪装,1965-10-18,1965-10
服输与不服输,1965-10-18,1965-10
“思想管理员”,1965-10-18,1965-10
飞在大风大浪里〔外一首〕,1965-10-18,1965-10
苦根上开出的革命花——谈影片《苦菜花》中的母亲的形象,1965-10-18,1965-10
备课,1965-10-18,1965-10
北京地区天气预报,1965-10-19,1965-10
印度尼西亚武装部队袭击搜查我商务参赞处是对我国的极严重挑衅中国政府向印度尼西亚政府提出强烈抗议要求印度尼西亚政府道歉，惩办肇事者和主使人，保证不再发生类似事件,1965-10-19,1965-10
印度尼西亚武装部队公然袭击我商务参赞处强迫进行非法搜查并威胁和侮辱我外交官员,1965-10-19,1965-10
柬王后电刘主席和夫人  感谢我政府对西哈努克亲王的盛情接待,1965-10-19,1965-10
坦桑尼亚政府发表声明  第二次亚非会议应当不定期地延期,1965-10-19,1965-10
文化部和中非友协举行文艺晚会欢迎马桑巴—代巴总统夫人和萨布里副总统夫人,1965-10-19,1965-10
西哈努克亲王在金边作访问中朝的报告柬埔寨同中国和朝鲜的友好和互相支持的关系更加牢固,1965-10-19,1965-10
积极为农民设计结实经济的住房改进我国农村建筑是一项重要任务，各地建筑设计者应该重视这项工作。为农村建筑服务就是为人民服务，不是没有“名堂”，而是大有“名堂”。,1965-10-19,1965-10
浙江工业设计院为农民设计房屋  金华慈溪农村建成一批新式住宅,1965-10-19,1965-10
建筑设计工作者又一广阔天地（编后）,1965-10-19,1965-10
农民群众迫切要求改造草屋,1965-10-19,1965-10
深山养马为革命只要我们当牧工的把放马看成是干革命，对畜群有了深厚的感情，就会不怕困难，一心发展马群,1965-10-19,1965-10
当革命的通讯员大有出息它同其他工作一样，只要做出成绩，都是为中国革命、世界革命贡献了力量,1965-10-19,1965-10
售票员做的是革命工作我们服务人员，把岗位工作干好了，提高了服务质量，就是为社会主义革命和建设作出了贡献,1965-10-19,1965-10
做一个完全的、彻底的人民勤务员革命就是改造主观世界和客观世界的斗争。要取得斗争胜利，就要活学活用毛主席著作，确立坚定的无产阶级世界观,1965-10-19,1965-10
干一辈子革命  学一辈子毛主席著作七十多万观众参观“廖初江、丰福生、黄祖示学习毛主席著作展览”受到教育,1965-10-19,1965-10
支持美国人民的正义行动  反对美国侵越战争新西兰公众在美领事馆前示威,1965-10-19,1965-10
英国各地纷纷举行抗议活动要美军撤出南越伦敦群众在美使馆前通宵示威,1965-10-19,1965-10
瑞典公众在美国使馆前示威  高呼美国从越南滚出去,1965-10-19,1965-10
加拿大公众继续示威抗议美国侵越英属圭亚那前总理贾根谴责美国充当世界警察的角色,1965-10-19,1965-10
几内亚工联第四次特别代表大会通过决议要求美国及其仆从军队撤出南越,1965-10-19,1965-10
西德《另一种报》谴责美国侵越  美国的“自由”就是杀人的自由,1965-10-19,1965-10
莫三鼻给革命委员会领导人强调非洲人民应完全支持越南反美爱国斗争,1965-10-19,1965-10
学习阮文追烈士的革命硬骨头精神北京石钢和新华印刷厂等职工集会纪念阮文追烈士就义一周年,1965-10-19,1965-10
