约翰逊手挥屠刀却又装成了佛下令再炸越南的当天重弹和平滥调华盛顿忙于洗刷罪责  军人政客叫嚷扩大战争,1965-02-13,1965-02
越南人民同仇敌忾声讨美国侵略者英雄的洞海市人民坚强不屈准备随时予敌更沉重打击越《人民报》说美国想以战争挑衅削弱南北方人民斗志是打错算盘,1965-02-13,1965-02
越南人民军第四军区司令员警告美帝不得玩火美国如继续进犯必遭越南军民更大打击越南人民军代表团抗议美国派遣军舰在南中国海进行挑衅,1965-02-13,1965-02
东南亚人民不容美帝国主义逞凶霸道艾地主席说美帝必须滚出东南亚  巴基斯坦学生举行反美示威柬埔寨和缅甸等国报纸说约翰逊的强盗逻辑就是希特勒的逻辑,1965-02-13,1965-02
非洲人民看穿了约翰逊的好战与伪善刚果（布）和喀麦隆、斯威士兰、南非公众组织声援越南人民肯尼亚人士说联合国不谴责美帝侵略证明它是受美国操纵的,1965-02-13,1965-02
康开集会声讨美帝侵犯越南兄弟老挝越南人民永远战斗在一起,1965-02-13,1965-02
捷克斯洛伐克政府发表声明谴责美国对越南民主共和国的侵略行动,1965-02-13,1965-02
布加勒斯特工人和大学生集会要求美国从南越撤出军队,1965-02-13,1965-02
美国黑人领袖罗伯特·威廉说一定要把美帝杀人犯送进坟墓,1965-02-13,1965-02
抗议美国袭击越南  要求美军撤出南越纽约旧金山等地公众示威,1965-02-13,1965-02
美国的“功劳”,1965-02-13,1965-02
高呼“约翰逊是杀人犯！”，“约翰逊是法西斯分子！”西欧公众纷纷示威反对美国侵略越南,1965-02-13,1965-02
强烈抗议美国袭击越南民主共和国澳大利亚人民举行反美示威,1965-02-13,1965-02
佐藤大卖力气替美国帮腔硬说美国轰炸越南不是扩大战争,1965-02-13,1965-02
英国下院五十名议员联名提出动议反对英政府追随美国侵略越南政策英外交大臣公然为美国轰炸越南罪行辩解,1965-02-13,1965-02
苏加诺总统在雅加达一万五千工人集会上重申决心反击任何进攻必要时将武装全体工农保卫民族独立印度尼西亚退出联合国后将更加强大威望更高革命将继续勇往直前,1965-02-13,1965-02
新共主席威廉斯要求改组被帝国主义控制的联合国联合国如果不改组就将彻底瓦解亚非国家公众舆论谴责联合国屈从美国尽干坏事充当殖民工具,1965-02-13,1965-02
艾地主席说印度尼西亚退出联合国是对所有国家和政治家的考验帝国主义不高兴  反帝者应当高兴英美如进攻印度尼西亚，东南亚革命将进入高潮，并蔓延到全亚洲,1965-02-13,1965-02
就我政府关于全面禁止和彻底销毁核武器建议挪威首相复信周恩来总理,1965-02-13,1965-02
庆祝革命胜利一周年桑给巴尔市长举行招待会我国政府代表团抵桑参加庆祝活动,1965-02-13,1965-02
富米·冯维希率领代表团到达金边表示衷心赞成西哈努克亲王召开人民会议建议,1965-02-13,1965-02
就我政府关于全面禁止和彻底销毁核武器建议丹麦首相复信周恩来总理,1965-02-13,1965-02
保持革命精神  昂首阔步前进,1965-02-13,1965-02
痛斥美国强盗,1965-02-13,1965-02
把敌人的嘴巴封起来——访问越南一个战斗的渔村,1965-02-13,1965-02
致战友,1965-02-13,1965-02
胜利的颂歌,1965-02-13,1965-02
北京地区天气预报,1965-02-14,1965-02
我国政府发表声明揭露美国一步步试图扩大印度支那战争号召全世界支援越南和印度支那人民正义斗争,1965-02-14,1965-02
中苏两国领导人相互致电祝贺中苏友好同盟互助条约签订十五周年,1965-02-14,1965-02
首都隆重集会庆祝中苏同盟十五周年陈毅郭沫若陈叔通李烛尘蔡廷锴以及在京的苏联朋友出席大会郭沫若副委员长契尔沃年科大使科热夫尼科夫团长先后讲了话,1965-02-14,1965-02
刘少奇主席接见科威特访华友好代表团团长,1965-02-14,1965-02
南越人民武装上月底潜入西贡敌人心脏爆炸美军顾问团总部炸死美军官五十五名，包括两名将官,1965-02-14,1965-02
在首都庆祝中苏友好同盟互助条约签订十五周年大会上人大副委员长、中苏友协副会长郭沫若的讲话,1965-02-14,1965-02
为维护中苏团结而斗争——庆祝中苏友好同盟互助条约签订十五周年,1965-02-14,1965-02
宋庆龄致电波波娃和安德烈耶夫祝贺中苏同盟条约签订十五周年,1965-02-14,1965-02
在首都各界庆祝中苏友好同盟互助条约签订十五周年大会上苏联驻华大使契尔沃年科的讲话,1965-02-14,1965-02
孙德胜主席黄国越会长致电周恩来主席杨秀峰会长感谢中国支持越南人民反美斗争有中国和全世界人民的支持，越南人民的斗争必将得到彻底胜利,1965-02-14,1965-02
誓作英雄越南人民的坚强后盾随时准备同越南兄弟并肩战斗鞍山太原杭州合肥等地人民集会愤怒声讨美国强盗沈阳制造援越产品的工人加紧生产支援越南人民,1965-02-14,1965-02
陈毅副总理郭沫若副委员长等接见苏中友协代表团,1965-02-14,1965-02
中国和阿尔及利亚签订议定书向阿尔及利亚民兵提供装备,1965-02-14,1965-02
应邀参加庆祝中苏友好同盟互助条约签订十五周年活动中苏友协代表团到达莫斯科,1965-02-14,1965-02
廖承志刘宁一宴请日本客人,1965-02-14,1965-02
廖承志接见南非朋友,1965-02-14,1965-02
丹麦商业大臣到京,1965-02-14,1965-02
介绍即将开幕的来比锡国际博览会柯尔特大使举行记者招待会,1965-02-14,1965-02
庆祝中苏同盟十五周年石景山中苏友好公社举行集会,1965-02-14,1965-02
参加亚非经济讨论会我代表团去阿尔及利亚,1965-02-14,1965-02
在首都各界庆祝中苏友好同盟互助条约签订十五周年大会上苏中友协代表团团长科热夫尼科夫的讲话,1965-02-14,1965-02
越南南方解放阵线中央电贺解放军奇袭波来古有功单位号召解放军给美国侵略者更沉重打击越南北方永灵区人民控诉美帝暴行决心更狠更准打击侵略者《人民报》指出美帝对北方的冒险已在军事和政治上遭到惨败,1965-02-14,1965-02
西哈努克亲王赞扬南越人民战斗精神南越人民定将赢得最后胜利,1965-02-14,1965-02
老挝爱国战线党中央谴责美帝进攻越南民主共和国热烈欢呼越南军民反击美帝的辉煌胜利,1965-02-14,1965-02
波兰政府发表声明谴责美国反对越南民主共和国的武装活动,1965-02-14,1965-02
罗马尼亚政府发表声明保证全力支持越南政府和人民反对美国侵略,1965-02-14,1965-02
匈牙利国民议会通过决议谴责美国侵略越南民主共和国,1965-02-14,1965-02
美国轰炸越南扩大战争是蓄谋罪行约翰逊散布种种烟幕掩盖不了真相,1965-02-14,1965-02
朝鲜和阿尔巴尼亚人民义愤填膺声讨美国侵越罪行美帝对越南的挑衅就是对社会主义阵营的挑衅古巴各人民团体表示支持越南人民的正义斗争,1965-02-14,1965-02
印度尼西亚合作国会议长支持越南人民斗争决不能对美帝侵略越南袖手旁观,1965-02-14,1965-02
反美示威浪潮席卷全世界日本印度尼西亚等国人民纷纷示威抗议美国侵略越南美国人民发出强烈呼声要求政府结束肮脏的侵略战争,1965-02-14,1965-02
法国记者怎样看美国和越南？越南人民敢于同泥足巨人较量是伟大的美国强权代公理终于处在世界被告地位,1965-02-14,1965-02
喜气洋洋庆祝桑给巴尔革命一周年坦桑尼亚首都举行盛大游行集会桑给巴尔举行阅兵和群众游行庆祝革命节日,1965-02-14,1965-02
挪威瑞士报纸不满美国轰炸越南指出美国边缘政策不能挽救它在南越的败局,1965-02-14,1965-02
美记者说约翰逊赌注一定输光哀叹空袭不可能使越南人民害怕屈服,1965-02-14,1965-02
美国军舰侵入我福建省地区领海我提出第三百六十一次严重警告,1965-02-14,1965-02
雷锋精神永放光芒——影片《雷锋》观后感,1965-02-14,1965-02
只有作革命人，才能演好革命戏,1965-02-14,1965-02
从《新疆舞》到《蓝天练武》,1965-02-14,1965-02
首先思想过硬,1965-02-14,1965-02
北京地区天气预报,1965-02-15,1965-02
征服穷山恶水  建设高产农田芙蓉大队自力更生群策群力改变自然面貌,1965-02-15,1965-02
要敢于斗争，也要善于斗争——论芙蓉大队改造穷山恶水顽强斗争的经验,1965-02-15,1965-02
越南外交部发言人发表声明谴责美帝加强对越南的战争行动,1965-02-15,1965-02
胡志明主席命令授予有功单位勋章越南军民击沉击毁敌艇三艘,1965-02-15,1965-02
联合国往哪里去？——评戴高乐二月四日的讲话,1965-02-15,1965-02
我赞成真刀真枪的毕业设计,1965-02-15,1965-02
学校要培养学生树立正确的设计思想,1965-02-15,1965-02
让我们到生产实践中到工农群众中去作毕业设计,1965-02-15,1965-02
用什么方法培养设计人材？（编后）,1965-02-15,1965-02
在北京上海的越南和其他国家留学生分别集会愤怒声讨美帝武装侵略越南表达中越两国青年和各国青年紧密团结战斗的决心,1965-02-15,1965-02
安徽举行京剧现代戏观摩演出大会这次演出的剧目都是去年全国京剧现代戏观摩演出大会以后创作和改编的，很受观众欢迎,1965-02-15,1965-02
发扬文艺为工农兵服务的革命精神内蒙古“乌兰牧骑”为牧民送歌献舞,1965-02-15,1965-02
北京上海广州沈阳武汉等地分别集会庆祝中苏同盟条约签订十五周年,1965-02-15,1965-02
辽宁吉林广西更改六个市县等地名,1965-02-15,1965-02
约翰逊政府罪行激起全球反美怒潮亚非欧美各国公众纷纷集会示威声讨美国侵略越南印度尼西亚日本黎巴嫩智利英国等国著名人士纷纷支持越南人民斗争,1965-02-15,1965-02
莫斯科举行集会庆祝中苏同盟十五周年别谢夫在会上作了报告潘自力、何伟分别在会上讲话,1965-02-15,1965-02
我国驻苏大使潘自力的讲话,1965-02-15,1965-02
苏共中央委员、交通部长别谢夫的报告,1965-02-15,1965-02
柯西金主席电谢周总理,1965-02-15,1965-02
苏联代表团离开平壤回国,1965-02-15,1965-02
祝贺中苏同盟十五周年葛罗米柯外长致电陈毅外长,1965-02-15,1965-02
波波娃和安德烈耶夫致电宋庆龄,1965-02-15,1965-02
中苏友好协会代表团团长何伟的讲话,1965-02-15,1965-02
河内举行大会总结劳动竞赛经验表扬先进单位胡志明主席号召加紧生产支援南方与会代表热烈欢呼痛击美国强盗的辉煌胜利,1965-02-15,1965-02
祝印度支那人民会议筹备会议开幕,1965-02-15,1965-02
在反对美帝国主义的共同斗争中加强团结印度支那人民会议筹备会议在金边开幕柬新闻社评论指出印度支那决不是美国可以实现霸权的场所,1965-02-15,1965-02
苏班德里约率代表团到达金边将同西哈努克亲王商谈亚洲局势,1965-02-15,1965-02
德意志民主共和国政府发表声明强烈谴责美国对越南的侵略行动,1965-02-15,1965-02
侵略南越美军最近伤亡惨重合众国际社承认上周被歼二百多名,1965-02-15,1965-02
利苏巴总理揭露帝国主义勾结冲伯进行颠覆阴谋号召刚果（布）人民动员起来保卫国家独立刚果（布）武装部队加强警戒工会和青年组织要求它们的成员武装起来,1965-02-15,1965-02
日本“防卫厅”竟制定以中朝为假想敌的秘密作战计划日共和社会党强烈谴责军国主义分子罪恶图谋,1965-02-15,1965-02
日社会党议员冈田春夫揭露所谓“三矢计划”的细节美日反动派的侵略野心暴露无遗,1965-02-15,1965-02
进一步打击美元在国际货币市场上的垄断地位法国宣布退出“金汇兑本位制”,1965-02-15,1965-02
金本位制和金汇兑本位制,1965-02-15,1965-02
摩洛哥驻华大使离任回国,1965-02-15,1965-02
我对外经济联络委员会主任方毅宴别科威特访华友好代表团,1965-02-15,1965-02
卡鲁姆接见我政府代表我驻桑领事为我代表访问举行招待会,1965-02-15,1965-02
美国国际收支赤字庞大美元危机加剧约翰逊打肿脸充胖子妄图安定人心美国报刊对约翰逊特别咨文中提出的解救危机的措施表示怀疑,1965-02-15,1965-02
李先念副总理接见丹商业大臣林海云代理部长设宴招待丹麦客人,1965-02-15,1965-02
越南——世界上光辉的名字,1965-02-15,1965-02
英雄的越南人民必胜,1965-02-15,1965-02
东风处处压西风,1965-02-15,1965-02
路（对口词）,1965-02-15,1965-02
北京地区天气预报,1965-02-16,1965-02
以革命的精神做好一九六五年的商业工作,1965-02-16,1965-02
越南南方民族解放阵线发布命令号召南方军民解放南方  保卫北方,1965-02-16,1965-02
苏联驻华大使馆举行招待会庆祝中苏同盟条约签订十五周年,1965-02-16,1965-02
越南人民军总政治部向全军发出指示响应胡志明主席号召开展发扬革命精神运动,1965-02-16,1965-02
南越解放军火线喊话威力巨大伪军一连响应放下武器的号召波来古大捷共毙伤美军三百五十七名，击毁美机四十二架,1965-02-16,1965-02
国务院举行一百五十三次全体会议通过设立第二轻工业部，提请全国人大常委会审议决定；核准中国古巴贸易协定、支付协定，中国肯尼亚贸易协定，中国阿联经济技术合作协定。,1965-02-16,1965-02
高举毛泽东思想红旗，做好社会主义商业工作,1965-02-16,1965-02
把小麦锈病消灭在老窝里,1965-02-16,1965-02
衡水地区发动群众总结去年生产经验及早防治麦锈病  力争夏季好收成,1965-02-16,1965-02
契尔沃年科大使的讲话,1965-02-16,1965-02
在苏联驻华大使馆庆祝中苏同盟十五周年招待会上陈毅副总理的讲话,1965-02-16,1965-02
越南《人民报》号召军民大力促进生产随时准备战斗更进一步准备击败美国战争挑衅者谴责英国政府公然充当美国破坏日内瓦协议的辩护士越人民军联络代表团函电国际委员会抗议美国继续挑衅和增兵南越,1965-02-16,1965-02
朝鲜苏联联合声明,1965-02-16,1965-02
泰国独立运动发表新年文告号召人民团结斗争驱逐美帝,1965-02-16,1965-02
新共声明谴责美国对越南的战争行动越南反击美国侵略是理所当然,1965-02-16,1965-02
在回莫斯科途中飞越我国上空时柯西金主席向周总理致意,1965-02-16,1965-02
英雄人民英雄城,1965-02-16,1965-02
苏发努冯亲王谴责美帝侵略越南严重威胁印度支那和平美国罪恶冒险只能加速彻底失败老挝佛协表示老挝佛教徒将和越南人民一起抗击美帝一切侵略,1965-02-16,1965-02
雅加达二十五万人示威声援越南反对美国侵略穆尼尔号召展开接管美国企业的运动支持越南粉碎美帝学生组织领导人宣布接管美新处并把它变为援越反美斗争指挥部,1965-02-16,1965-02
东京近三万人集会示威抗议美国侵略越南春日正一号召日本人民加强统一战线展开反美爱国斗争拉美和英国各地人民继续示威高呼美国佬从越南滚出去,1965-02-16,1965-02
丹麦电子测量仪器展览在京开幕我国际贸易促进委员会副主席设宴庆祝展览会开幕,1965-02-16,1965-02
科威特访华友好代表团去上海访问,1965-02-16,1965-02
我作家协会副主席宴请日本客人,1965-02-16,1965-02
前往巴西探望我国九名人员第二批家属代表抵达日内瓦,1965-02-16,1965-02
中国巴基斯坦建立直达无线电话电路,1965-02-16,1965-02
美国纸老虎的丑相,1965-02-16,1965-02
柬人民社会同盟总书记指出印度支那人民会议意义重大印度支那人民将协力斗争挫败美帝侵略政策指责美国有计划地不断破坏日内瓦协议和印度支那地区和平越《人民报》和寮国电台热烈欢迎召开人民会议推进反美斗争,1965-02-16,1965-02
坦桑尼亚政府决不向美帝威胁低头决定召回驻美大使回答美国驱逐坦外交官的无理行为,1965-02-16,1965-02
粉碎帝国主义对刚果（布）颠覆阴谋,1965-02-16,1965-02
西德“哈尔斯坦主义”可以休矣,1965-02-16,1965-02
乌干达政府抨击冲伯傀儡飞机轰炸乌领土抗议美国新殖民主义暴行奥博特总理强调乌独立和领土完整不容破坏,1965-02-16,1965-02
不许美帝国主义侵犯乌干达,1965-02-16,1965-02
《新德意志报》抨击“哈尔斯坦主义”者的狂妄讹诈西德不得干涉阿联邀请乌布利希访问,1965-02-16,1965-02
西德援引臭名昭著的“哈尔斯坦主义”公然干涉阿联发展同民主德国关系,1965-02-16,1965-02
“哈尔斯坦主义”,1965-02-16,1965-02
美国为什么反对恢复金本位,1965-02-16,1965-02
梦南方——访越记事,1965-02-16,1965-02
心和泪——献给中国人民解放军总政话剧团的革命艺术家,1965-02-16,1965-02
人民公社,1965-02-16,1965-02
北京地区天气预报,1965-02-17,1965-02
发扬生产民主，落实生产计划,1965-02-17,1965-02
尼雷尔总统传略,1965-02-17,1965-02
热烈欢迎尼雷尔总统,1965-02-17,1965-02
越南人民军总司令部发出紧急信件要求国际委员会撤出常驻越南固定小组,1965-02-17,1965-02
摩洛哥共产党代表团离京回国康生刘宁一等同志到机场欢送,1965-02-17,1965-02
周铺公社五大队发动群众共商生产大计民主制订积极可靠的增产计划,1965-02-17,1965-02
尼雷尔总统到上海受到热烈欢迎坦桑尼亚联合共和国贵宾今日到京,1965-02-17,1965-02
怎样看人的因素,1965-02-17,1965-02
“上”和“下”,1965-02-17,1965-02
转败为胜,1965-02-17,1965-02
各行各业都为农业生产高潮贡献更大力量全国大中型化肥企业普遍增产,1965-02-17,1965-02
让农村“五匠”充分发挥作用谷田公社把石匠、木匠、泥水匠、瓦匠、竹匠组成基本建设队，加速了农业生产和基本建设,1965-02-17,1965-02
组织“五匠”为农业高潮服务,1965-02-17,1965-02
轻巧灵活的碾米机,1965-02-17,1965-02
工效高的饲料粉碎机,1965-02-17,1965-02
手摇番薯刨丝机,1965-02-17,1965-02
离心式茶籽脱壳机,1965-02-17,1965-02
“五匠”基本建设队好得很,1965-02-17,1965-02
刘主席任命李云川为驻达荷美大使,1965-02-17,1965-02
越南国际委员会固定小组没有理由不撤走,1965-02-17,1965-02
坦桑尼亚议长等就尼雷尔总统访华发表谈话加强中坦两国的友谊和合作在反帝斗争中永远站在一起,1965-02-17,1965-02
南越解放军七八两日在平定取得辉煌战果歼灭敌军八百多人  缴获枪炮五百件被歼敌人中包括一名美国军官  西贡美军人员惊呼损失惨重,1965-02-17,1965-02
武元甲大将热烈祝贺南越解放军建立四周年南越解放军成长迅速战绩辉煌使敌丧胆全国同胞钢铁团结定能打败美国侵略者,1965-02-17,1965-02
庆祝中苏友好同盟互助条约十五周年我驻苏联大使举行友好晚会潘自力大使和基里连科在会上讲话,1965-02-17,1965-02
罗素说美国侵略越南是海盗式的疯狂挣扎全世界必须大声疾呼反对美国呼吁英国公众反对工党政府追随美国的可耻行为指责威尔逊无理拒绝中国召开各国首脑会议建议,1965-02-17,1965-02
伦敦千余人示威抗议美国侵略越南,1965-02-17,1965-02
最是伤心波来古  入地无门求上帝美国伤兵回述波来古挨揍狼狈相，惊呼南越人民武装炮火准确,1965-02-17,1965-02
美国军舰侵入我福建省领海我提出第三百六十二次严重警告,1965-02-17,1965-02
美《国民前卫》周刊驳斥约翰逊政府的弥天大谎美国空袭越南是明目张胆的侵略行为联合国应名正言顺地谴责美国侵略者,1965-02-17,1965-02
美国侵略者决没有好下场洞海人民打捞起美机残骸和飞行员尸体,1965-02-17,1965-02
苏加诺总统号召筹备庆祝万隆会议十周年艾地主席要求在节日里更加记住美英仇恨,1965-02-17,1965-02
阿联政府的严正立场,1965-02-17,1965-02
冯维希在印度支那人民会议筹备会议上指出人民会议目标是三国人民团结反美陈宝剑说会议将依据万隆会议原则实现团结,1965-02-17,1965-02
西哈努克亲王支持印度尼西亚对联合国立场必须结束联合国充当美帝工具的局面呼吁各国人民共同行动反击美国的战争挑衅,1965-02-17,1965-02
卡斯特罗总理兼土改委会主席,1965-02-17,1965-02
反对新殖民主义产物“马来西亚”的斗争日益高涨马来亚爆发反对美英帝国主义示威“马来西亚”当局出动军警镇压并大批逮捕示威者,1965-02-17,1965-02
阿拉伯国家反对美国西德给以色列武器阿联议会警告西德若不停止运送军火将断绝两国关系萨布里总理严斥西德以削减对阿联“援助”进行威胁,1965-02-17,1965-02
外交部举行文艺晚会招待各国驻华使节,1965-02-17,1965-02
我赠阿万吨巨轮“曙光号”抵阿尔及尔港,1965-02-17,1965-02
佐藤政府侵略野心愈来愈大竟决定在美帝撮合下拼凑“亚洲反共联盟”还叫嚷制定“三矢计划”为“理所当然”,1965-02-17,1965-02
陈毅副总理接见丹麦商业大臣丹商业大臣宴请我有关方面人士,1965-02-17,1965-02
强烈抗议美国—冲伯飞机轰炸乌干达和平村庄肯尼亚大学生在美国使馆前示威坦桑尼亚报纸强调美国必须对轰炸暴行负责,1965-02-17,1965-02
我们没有资格学哲学吗？,1965-02-17,1965-02
编后,1965-02-17,1965-02
怎样看待工农兵学理论——评杨献珍同志对这个问题的错误观点,1965-02-17,1965-02
杨献珍同志为什么反对“在学习中战斗，在战斗中学习”——求新造船厂职工驳斥杨献珍同志对工人学习毛主席著作的诬蔑的座谈纪录,1965-02-17,1965-02
南方来信（画刊１１２）,1965-02-17,1965-02
北京地区天气预报,1965-02-18,1965-02
刘主席重申中国人民坚定不移的立场坚决支持越南刚果人民反美正义斗争,1965-02-18,1965-02
刘主席和夫人、周总理和夫人会见尼雷尔总统和夫人,1965-02-18,1965-02
刘主席周总理陈外长电贺尼泊尔王国民主日,1965-02-18,1965-02
周总理陈外长电贺冈比亚独立我国决定承认冈比亚,1965-02-18,1965-02
华中华东华北喜降雨雪黄淮流域干旱有些缓和，有利越冬作物返青,1965-02-18,1965-02
尼雷尔总统和夫人到达北京刘主席和夫人盛宴欢迎贵宾,1965-02-18,1965-02
尼雷尔总统及随行人员名单,1965-02-18,1965-02
京剧工作者攀登京剧艺术高峰的又一革命行动《芦荡火种》修改重排改名《沙家浜》,1965-02-18,1965-02
香港观众盛赞革命京剧《红灯记》,1965-02-18,1965-02
表达中国人民誓作越南人民坚强后盾的意志新闻纪录片《坚决支持越南》在京上映,1965-02-18,1965-02
在欢迎尼雷尔总统的宴会上  刘少奇主席和尼雷尔总统的讲话,1965-02-18,1965-02
坦桑尼亚贵宾参观中国革命博物馆周恩来总理和刘主席夫人陪同参观,1965-02-18,1965-02
全国军民到处布下天罗地网  美帝如敢来犯只有死路一条越南人民万众一心时刻准备消灭美国侵略者广平和永灵军民表示永远保持高度警惕坚决迎击任何进犯敌人,1965-02-18,1965-02
科威特代表团同我国方面进行会谈双方强调会谈有利加强两国友谊,1965-02-18,1965-02
美帝国主义必须从印度支那滚出去！老挝康开丰沙里分别集会表示要和越南人民同生死共战斗南美各国和加拿大意大利公众示威游行抗议美国侵略越南,1965-02-18,1965-02
阿尔巴尼亚代表谴责美国使联合国正常活动瘫痪联合国如不摆脱大国操纵就会垮台把中国排除在外严重影响联合国执行任务的能力,1965-02-18,1965-02
美国公众对美扩大侵越战争极表不安约翰逊侵略越南不得人心,1965-02-18,1965-02
西贡又拼凑了一个傀儡班底美联社承认侵犯北方封不住南越政治火山口,1965-02-18,1965-02
美国把第二导弹连运进南越,1965-02-18,1965-02
庆祝尼泊尔王国民主日中尼友协举行酒会,1965-02-18,1965-02
中尼友好的里程碑尼记者盛赞加德满都—科达里公路,1965-02-18,1965-02
乌干达全国愤怒举行大规模反美示威示威群众高呼“美国狗滚出去”并撕毁使馆楼上的美国国旗奥博特总理号召人民保卫独立主权准备粉碎美国好战政策肯尼亚政府和全非工会联合会谴责美国飞机轰炸乌干达的侵略暴行,1965-02-18,1965-02
坦报指出美国外交人员进行颠覆活动不容抵赖坦桑尼亚决定召回驻美大使作得对加纳电台谴责美帝对坦施加压力并支持坦驱逐美外交官,1965-02-18,1965-02
朝鲜在坦桑尼亚设立大使馆,1965-02-18,1965-02
锡兰总理和报纸驳斥反华诽谤揭露反动派企图制造反华歇斯底里影响选举,1965-02-18,1965-02
奈温主席在印度进行七天访问,1965-02-18,1965-02
祝贺冈比亚独立,1965-02-18,1965-02
我亚非团结委员会和中非友协电冈比亚总理热烈祝贺冈比亚宣布独立,1965-02-18,1965-02
粉碎“日韩会谈”  斩断日本军国主义侵略魔爪日共与社会党等发表联合声明要求立即停止会谈朝鲜人民团体和报纸谴责美朴集团和日本军国主义者促成会谈阴谋,1965-02-18,1965-02
美国又进行地下核试验,1965-02-18,1965-02
冈比亚,1965-02-18,1965-02
维多利亚湖上的明珠,1965-02-18,1965-02
我的《有鬼无害论》是错误的,1965-02-18,1965-02
