中国手工艺展览会在金边开幕,1967-03-27,1967-03
越报欢呼炮轰南越美军基地的巨大胜利北方军民歼美炮声是对美帝严厉警告最近又在河西等省击落美国强盗飞机七架,1967-03-27,1967-03
亚非人民欢呼中国文化大革命是世界历史上最伟大事件文化大革命是毛主席对马列主义的巨大贡献,1967-03-27,1967-03
毛里塔尼亚人民赞扬中国文化大革命具有伟大世界意义文化大革命推动世界革命蓬勃发展,1967-03-27,1967-03
缅甸朋友热烈欢呼文化大革命大大鼓舞全世界无产阶级革命派大联合是毛主席革命路线的胜利中国红卫兵小将是反帝反修的坚强战士,1967-03-27,1967-03
阿尔巴尼亚在革命化大道上奋勇前进,1967-03-27,1967-03
毛主席语录,1967-03-28,1967-03
在解放军大力帮助下活学活用毛主席著作大同煤矿革命生产出现新局面迅速建立和健全了“三结合”的领导班子，煤产量不断提高,1967-03-28,1967-03
山东革命委员会组织宣传队分赴省内各地大力宣传毛泽东思想青岛市毛泽东思想宣传团深入基层,1967-03-28,1967-03
首都红卫兵小将热烈欢呼中学红代会成立听毛主席的话，复课闹革命,1967-03-28,1967-03
北京各县区第一线指挥部用毛泽东思想统帅一切充分运用无产阶级权威掀起了春耕生产新高潮,1967-03-28,1967-03
山东棉区社员贯彻抓革命促生产指示积极作好各种准备决心按照国家计划种足种好棉田山西曲沃县开展两种思想、两条道路的斗争，不折不扣落实种棉计划,1967-03-28,1967-03
红光大队贫下中农正确对待干部支持革命干部挺起腰杆领导春耕,1967-03-28,1967-03
浙江贫下中农牢记毛主席教导今年春播定要超往年普遍开始播种早稻，力争高质量、高标准,1967-03-28,1967-03
以只争朝夕的精神投入春汛捕捞广东沿海广大渔民提早出海广西北海市四百多艘渔船大闹春汛生产,1967-03-28,1967-03
广州部队炮兵某部指战员热情传授经验帮助农村干部突出无产阶级政治自觉用毛泽东思想指挥春耕生产,1967-03-28,1967-03
听毛主席的话，到群众中去,1967-03-28,1967-03
“公”字当头的人们——记东海前线某岛军民英勇抢救失火渔船的事迹,1967-03-28,1967-03
我是怎样回到毛主席的无产阶级革命路线来的,1967-03-28,1967-03
要使自己的思想适应变化了的新形势,1967-03-28,1967-03
霍查同志在克鲁亚区党的积极分子大会作重要讲话加强阶级斗争观念  促进思想革命化,1967-03-28,1967-03
亚非记协强烈谴责苏修非法召开亚非作家伪“三大”苏修奉行投降分裂路线成为美帝头号帮凶,1967-03-28,1967-03
索马里作家协会坚决支持在北京召开第三届亚非作家大会亚非革命作家团结起来粉碎苏修分裂破坏行动,1967-03-28,1967-03
罗马尼亚领导人在布加勒斯特集会上说发展工业是巩固独立主权的重要因素齐奥塞斯库、斯托伊卡、毛雷尔等出席集会,1967-03-28,1967-03
索政府谴责法国在索马里海岸炮制的“公民投票”索马里人民决心消灭一切殖民主义索马里海岸人民不顾殖民军警威胁抵制“公民投票”,1967-03-28,1967-03
我援助尼泊尔一仓库工程完工马亨德拉国王主持落成典礼,1967-03-28,1967-03
坦报驳斥英垄断资本对坦桑银行国有化的谰言恫吓改变不了坦桑尼亚的决心,1967-03-28,1967-03
庆祝缅甸武装部队建立二十二周年缅甸驻华武官举行招待会,1967-03-28,1967-03
国际简讯,1967-03-28,1967-03
南越解放电台欢呼北京军民炮轰美军的胜利南北军民并肩战斗打败美国侵略者越《人民军队报》号召北方军民更严厉惩罚美国强盗,1967-03-28,1967-03
不愿替美国侵略者送死南越伪军纷纷投诚,1967-03-28,1967-03
美国佬杀人犯从南越滚出去！近四千英国公众示威游行反对美国侵略越南,1967-03-28,1967-03
宁肯坐牢也不替美国统治集团卖命美国青年反对约翰逊政府侵略越南拒服兵役,1967-03-28,1967-03
斗争的火花,1967-03-28,1967-03
美国人民的觉醒,1967-03-28,1967-03
发挥人民战争的无比威力  粉碎美帝两次大规模“扫荡”西宁军民二月以来歼敌八千多,1967-03-28,1967-03
不当侵越炮灰！美国黑人学生轰走征兵局长,1967-03-28,1967-03
毛主席语录,1967-03-29,1967-03
黑龙江省革命委员会和省军区召开工交战线抓革命、促生产工作会议把工交企业办成毛泽东思想大学校,1967-03-29,1967-03
无产阶级文化大革命推动生产不断发展全国针棉织品生产和供应形势大好广大职工以革命统帅生产，深入调查，了解贫下中农需要，生产和供应进一步面向农村,1967-03-29,1967-03
山西省军区和驻山西部队大力支持工业生产工作用毛泽东思想武装革命职工抓革命促生产,1967-03-29,1967-03
报眼口号,1967-03-29,1967-03
青岛工交战线广大革命职工革命干部更加鼓足干劲力争上游雷厉风行贯彻党中央指示迅速创造出优异生产成绩,1967-03-29,1967-03
革命派掌权后团结广大群众正确对待干部上海第六机床厂提前完成第一季度计划全厂革命职工决心乘胜前进把革命和生产搞得好上加好,1967-03-29,1967-03
无产阶级革命派意气风发斗志昂扬贵州柴油机厂革命生产形势越来越好第一季度出产的柴油机相当于去年全年总产量的一半,1967-03-29,1967-03
甘肃大部分地区普降雨雪,1967-03-29,1967-03
向解放军学习  办革命化企业,1967-03-29,1967-03
到春耕第一线去为广大贫下中农服务,1967-03-29,1967-03
为农业丰收贡献一份力量老工人陈庆玉向生产队献肥的故事,1967-03-29,1967-03
积极支援春耕第一线定西县一批畜牧兽医人员下乡,1967-03-29,1967-03
报眼口号,1967-03-29,1967-03
坚决执行毛主席的干部政策  争取和团结大多数干部,1967-03-29,1967-03
消除顾虑坚决同革命群众站在一起,1967-03-29,1967-03
报眼毛泽东语录,1967-03-29,1967-03
刚果（利）爱国武装西线政委会指出当前任务广泛动员群众  加强武装斗争必须建立一个统一和真正革命的党,1967-03-29,1967-03
胜利的保证,1967-03-29,1967-03
严厉的惩罚  有力的打击南越育庙美军炮兵基地遭到炮轰目击记,1967-03-29,1967-03
用革命的反“围剿”打破反革命的“围剿”非洲爱国武装在战斗中迅速成长壮大,1967-03-29,1967-03
刚果（利）革命人民无限热爱和敬仰毛主席用毛泽东思想武装起来就能赢得胜利,1967-03-29,1967-03
《毛主席语录》在刚果（布）受到热烈欢迎,1967-03-29,1967-03
心向毛主席,1967-03-29,1967-03
马尔加什人民把希望寄托在毛主席身上毛主席的光辉著作《中国社会各阶级的分析》在马尔加什油印出版,1967-03-29,1967-03
到劳动人民中去锻炼成长——记在北京的外国专家子女自愿下厂劳动,1967-03-29,1967-03
毛主席语录,1967-03-30,1967-03
破除旧的不合理的管理机构和制度贵阳棉纺厂建立革命化管理体制,1967-03-30,1967-03
上海革命委员会和当地驻军联合召开工交系统抓革命促生产誓师大会坚决迅速贯彻毛主席伟大指示誓做抓革命促生产最出色模范,1967-03-30,1967-03
放手发动群众，粉碎反革命复辟阴谋,1967-03-30,1967-03
报眼毛主席语录,1967-03-30,1967-03
把部队政治工作经验带进工厂山西驻军某部到江阳化工厂宣传毛泽东思想支持工业不断帮助革命职工解决思想问题革命和生产热气腾腾,1967-03-30,1967-03
广西驻军某部毛泽东思想宣传队热情传授部队政治思想工作经验提高干部社员觉悟推动春耕生产,1967-03-30,1967-03
李顺达——革命的闯将，生产的模范,1967-03-30,1967-03
广大贫下中农和革命干部以毛泽东思想为统帅抓革命促生产贵州春耕生产形势越来越好,1967-03-30,1967-03
红旗公社革命干部奔赴春耕生产第一线狠抓备耕薄弱队的工作,1967-03-30,1967-03
周口店地区供销社等五个单位组成联合服务组下乡支援春耕,1967-03-30,1967-03
把文化大革命中焕发出来的革命干劲用到生产上山东开展大规模植树造林活动全省已造林七十六万亩，四旁植树一亿多株,1967-03-30,1967-03
群众的批评是对干部最大的爱护岳滩大队干部正确对待贫下中农意见积极领导春耕生产,1967-03-30,1967-03
华侨事务委员会负责人向新华社记者发表谈话强烈谴责印尼政府破坏我接侨工作,1967-03-30,1967-03
北泽政雄痛斥苏修分裂亚非团结反帝运动的罪行一切革命力量联合起来粉碎苏修叛卖行为不管苏修如何破坏，亚非人民将在反帝反修斗争中胜利前进,1967-03-30,1967-03
六个非洲民族主义政党和组织发表联合声明谴责苏美勾结破坏亚非人民反帝斗争,1967-03-30,1967-03
苏修集团的大悲剧,1967-03-30,1967-03
锡兰著名作家谴责苏修非法召开亚非作家伪“三大”亚非国家的命运只能由亚非人民决定加那利群岛争取自决和独立运动总书记处决定派代表参加在北京召开的亚非作家大会和亚非团结大会,1967-03-30,1967-03
坦桑尼亚朋友赞扬中国文化大革命文化大革命一定会取得完全胜利,1967-03-30,1967-03
希腊进步学联赞扬中国文化大革命的重大世界意义从根本上动摇帝国主义和反动派的统治,1967-03-30,1967-03
我政府贸易代表团离京赴芬兰,1967-03-30,1967-03
中罗友好代表团赴罗马尼亚访问,1967-03-30,1967-03
结束在刚果（布）的友好访问我妇女代表团离布拉柴维尔回国,1967-03-30,1967-03
南越解放军猛袭岘港美空军基地歼灭美军五百多  击毁美机十六架,1967-03-30,1967-03
在开罗的非洲自由战士就沙佩维尔事件七周年发表声明必须用革命的暴力对付反革命的暴力要反对帝国主义就必须坚决反对现代修正主义,1967-03-30,1967-03
简明新闻,1967-03-30,1967-03
不许联合国插手南也门,1967-03-30,1967-03
南也门人民反帝革命斗争深入发展民族解放武装力量迅速扩大  城市群众反帝运动空前高涨,1967-03-30,1967-03
老挝爱国军民反“扫荡”歼灭大批敌人中下寮地区半个月击落美国强盗飞机十五架,1967-03-30,1967-03
南也门,1967-03-30,1967-03
报眼口号,1967-03-31,1967-03
在干部问题上的资产阶级反动路线必须批判,1967-03-31,1967-03
“打击一大片，保护一小撮”是资产阶级反动路线的一个组成部分（一九六六年六、七两月清华大学工作组在干部问题上执行资产阶级反动路线的情况调查）,1967-03-31,1967-03
坚持按照毛主席的革命路线办事山西工交战线节节获胜全省工业总产值一月二月都超过去年同期，三月又有较大增长,1967-03-31,1967-03
河南又下喜雨,1967-03-31,1967-03
在毛主席“抓革命，促生产”伟大战略方针指引下山东农村春季生产形势大好,1967-03-31,1967-03
抓阶级斗争  促春耕生产解放军某部炮三连发动群众粉碎了敌人破坏春耕的阴谋,1967-03-31,1967-03
念念不忘阶级斗争,1967-03-31,1967-03
山东省革委会和省军区向全省民兵发出号召积极参加和支持革命“三结合”夺权斗争,1967-03-31,1967-03
联合起来更好地发挥战斗作用贵阳卫校毛泽东思想红代会撰文祝贺首都中等学校红代会成立,1967-03-31,1967-03
周承英英勇抢救红卫兵,1967-03-31,1967-03
打倒折中主义，坚持革命的“三结合”,1967-03-31,1967-03
革命的“三结合”是夺权斗争胜利的保证,1967-03-31,1967-03
群众批评好得很！,1967-03-31,1967-03
以大无畏的精神革“私”字的命,1967-03-31,1967-03
吴丹“新方案”是个大骗局,1967-03-31,1967-03
南越解放武装力量又打了一场漂亮速决战几分钟全歼敌军两连毁伤军车百余辆,1967-03-31,1967-03
越南外交部发言人就吴丹最近的活动发表评论说联合国绝对无权干涉越南问题发言人揭露美帝用“和平”烟幕掩盖扩大战争行动的新诡计,1967-03-31,1967-03
配合美帝侵越政策  诱迫越南人民投降吴丹玩新花招搞旧阴谋抛出一个所谓“三个步骤”方案马上得到约翰逊喝采,1967-03-31,1967-03
阿尔巴尼亚《人民之声报》指出美帝苏修大力豢养印尼反动派印尼右派政权积极拼凑军事联盟为美帝反华阴谋效劳,1967-03-31,1967-03
西南非洲民族联盟代表支持在北京举行亚非团结大会决心为革命的亚非团结运动而战斗宣布不同苏修操纵的亚非团结组织书记处发生关系,1967-03-31,1967-03
贝专纳人民党领导人谴责苏修非法召开亚非作家伪“三大”提高警惕分清敌友  坚决同苏修斗争到底苏美勾结破坏亚非人民反帝斗争，只能加速自己灭亡,1967-03-31,1967-03
锡兰作协揭露苏修召开亚非作家伪“三大”的阴谋苏修叛卖行为迎合帝国主义需要,1967-03-31,1967-03
南越解放军打得好,1967-03-31,1967-03
