柬埔寨外交大臣致函陈毅副总理感谢中国对柬埔寨的声援,1967-03-18,1967-03
湄公河三角洲成了侵越美军新坟场今年以来上千名美国侵略者被埋葬在那里,1967-03-18,1967-03
相应升级,1967-03-18,1967-03
捣乱，失败，再捣乱，再失败，直至灭亡美帝加紧准备进一步扩大侵越战争,1967-03-18,1967-03
怯懦者最残暴美国疯狂发展生物和化学武器,1967-03-18,1967-03
鼓励苏修集团叛卖投降美参院批准美苏领事条约,1967-03-18,1967-03
简明新闻,1967-03-18,1967-03
南越解放武装力量猛袭朱莱美军基地击毁美机三十多架消灭美军一百多名,1967-03-18,1967-03
无私才能“一身轻”,1967-03-18,1967-03
挺起腰杆扛红旗（鼓词）,1967-03-18,1967-03
东海春潮,1967-03-18,1967-03
山村新貌（外一首）,1967-03-18,1967-03
报眼口号,1967-03-19,1967-03
中共中央给全国厂矿企业革命职工、革命干部的信,1967-03-19,1967-03
向战斗中的英雄的越南人民致敬——纪念越南全国反美斗争日十七周年,1967-03-19,1967-03
无产阶级革命派既是革命的闯将又是生产的模范南宁水稻插秧机厂超额完成二月份生产计划这个厂二月份生产的插秧机比去年同期增长四点一倍，成本降低一半，有力地支援了春耕生产,1967-03-19,1967-03
在文化大革命中坚持抓革命促生产沈阳部队工程机械修配厂广大革命职工坚守生产岗位，遵守劳动纪律，多快好省地完成了生产计划,1967-03-19,1967-03
中国共产党和新西兰共产党的战斗友谊万岁！威尔科克斯同志离京访问广州后回国周恩来同志康生同志等到北京机场欢送,1967-03-19,1967-03
没有革命的“三结合”，就不能保证夺权斗争的胜利,1967-03-19,1967-03
越南人民决心把美国强盗赶出国土河内各界人民集会纪念越南全国反美斗争日,1967-03-19,1967-03
南越人民战争的又一曲凯歌西宁军民十七天歼侵略军三千多粉碎美帝在侵越战争中规模最大的一次“扫荡”,1967-03-19,1967-03
从檀香山会议到关岛会议,1967-03-19,1967-03
越南北方人民不怕艰苦牺牲坚决同美国侵略者战斗到底,1967-03-19,1967-03
霍查同志视察地拉那工厂企业强调干部必须向劳动群众学习,1967-03-19,1967-03
阿部长会议通过决定支持取消额外报酬的革命倡议,1967-03-19,1967-03
一手拿镐  一手拿枪,1967-03-19,1967-03
七个非洲民族主义组织发表联合声明谴责苏修同美帝勾结镇压亚非拉革命斗争缅甸亚非团结委员会支持今年在北京召开第五届亚非团结大会,1967-03-19,1967-03
津巴布韦非洲民族联盟代表为纪念“津巴布韦日”发表声明发动群众展开武装斗争彻底解放祖国亚非记协支持津巴布韦人民斗争自由战士在开罗集会纪念“津巴布韦日”,1967-03-19,1967-03
亚太和联谴责苏修危害亚非地区和平事业敦促成员国支持在北京召开亚非团结大会,1967-03-19,1967-03
也门人民举行“南也门周”支持南也门人民反英武装斗争,1967-03-19,1967-03
芬兰驻华大使奉调离任,1967-03-19,1967-03
谢胡同志就人民军革命化问题作重要指示加强思想革命化把革命进行到底,1967-03-19,1967-03
报眼口号,1967-03-20,1967-03
上海等城市厂矿企业革命职工、革命干部热烈响应毛主席、党中央号召坚决把无产阶级文化大革命进行到底誓做抓革命、促生产的最出色的模范,1967-03-20,1967-03
首都各界人民隆重举行支持越南人民抗美救国斗争大会中国人民坚决支持越南人民彻底打败美帝,1967-03-20,1967-03
响应毛主席、党中央的伟大号召，夺取革命和生产双丰收——黑龙江省厂矿企业革命职工座谈纪要,1967-03-20,1967-03
郭沫若副委员长在首都各界人民支持越南人民抗美救国斗争大会上讲话  毛主席领导的文化大革命使中国人民更加革命化为支援越南人民的抗美救国战争发挥更大的力量,1967-03-20,1967-03
首都各界人民支持越南人民抗美救国斗争大会通电,1967-03-20,1967-03
阮明芳代团长在首都各界人民支持越南人民抗美救国斗争大会上讲话  不管美帝怎样穷凶极恶扩大侵略战争南越军民打败美帝的决心坚定不移,1967-03-20,1967-03
黎终始临时代办在首都各界人民支持越南人民抗美救国斗争大会上讲话  中国人民始终是越南人民的亲密战友越南人民必将粉碎美帝战争升级计划,1967-03-20,1967-03
我是怎样“抓革命，促生产”的？,1967-03-20,1967-03
中国文化大革命开辟了世界历史的新纪元,1967-03-20,1967-03
亚非人民团结日本委员会代表发表声明脱离苏修操纵的亚非团结组织书记处支持在北京召开第五届亚非团结大会,1967-03-20,1967-03
抗议法国举行“公民投票”骗局支持索马里海岸人民争取独立斗争索马里人民举行声势浩大的示威游行群众手持《毛主席语录》，高呼“中国万岁”“打倒约翰逊”等口号,1967-03-20,1967-03
我国向尼泊尔提供两万吨大米,1967-03-20,1967-03
印尼作家强烈谴责苏修策划召开亚非作家伪“三大”的阴谋亚非作家以毛泽东思想为武器坚决同苏修叛卖行为进行斗争,1967-03-20,1967-03
越南南方军民决心抗战到底把美国侵略者全部赶出国土民族解放阵线中央集会纪念全国反美斗争日,1967-03-20,1967-03
越南《人民报》和南越解放通讯社谴责美国召开战争会议美帝疯狂扩大战争是自取灭亡,1967-03-20,1967-03
美国－南越伪军侵犯柬领土领空柬埔寨政府提出强烈抗议,1967-03-20,1967-03
声援越南人民国际会议常设局发出呼吁书呼吁各国人民加强支援越南人民斗争,1967-03-20,1967-03
加紧部署扩大侵越战争的新冒险计划约翰逊召开关岛会议妄图作垂死挣扎,1967-03-20,1967-03
南越战场捷报频传广治省军民奋战两周歼灭美军两千多,1967-03-20,1967-03
关岛,1967-03-20,1967-03
报眼口号,1967-03-21,1967-03
跟着毛主席革命到底,1967-03-21,1967-03
响应毛主席的伟大号召抓革命促生产动员一切力量搞好春耕北京市贫下中农代表会议胜利召开周总理代表毛主席和他的亲密战友林彪同志以及党中央、国务院、中央军委、中央文革小组到会祝贺并作了重要指示陈伯达康生谢富治江青等同志也到会祝贺陈伯达同志讲了话  大会通过了给毛主席的致敬信和大会决议,1967-03-21,1967-03
北京市贫下中农代表会议  给毛主席的致敬信,1967-03-21,1967-03
北京市贫下中农代表会议通过决议不折不扣地执行毛主席的伟大指示争取革命生产双胜利,1967-03-21,1967-03
文化大革命焕发出广大群众的冲天干劲贵州省掀起春季造林高潮,1967-03-21,1967-03
毛主席啊，您是世界人民心中的红太阳！,1967-03-21,1967-03
毛泽东思想给予革命人民巨大鼓舞和教育“老三篇”日文版合订本在东京出版毛主席光辉著作《反对本本主义》在印度喀拉拉邦出版,1967-03-21,1967-03
叙利亚出版阿文版《毛主席语录》,1967-03-21,1967-03
毛主席著作在挪威受到热烈欢迎,1967-03-21,1967-03
要革命就必须学习毛主席著作,1967-03-21,1967-03
世界革命的光辉,1967-03-21,1967-03
我是最幸福的人,1967-03-21,1967-03
这本书太重要了,1967-03-21,1967-03
南越民族解放阵线发表声明严厉谴责关岛会议美帝任何战争“升级”都挽救不了败局越南《人民军队报》说越南人民决心给侵略者最有力的回击,1967-03-21,1967-03
我外交部强烈抗议英国政府的严重挑衅英国必须停止把香港作为美国侵越基地,1967-03-21,1967-03
在北京的外国朋友举行游行  全力支持越南人民斗争,1967-03-21,1967-03
杀气腾腾的关岛会议开场约翰逊和阮文绍一唱一和叫嚣扩大战争,1967-03-21,1967-03
简明新闻,1967-03-21,1967-03
为关岛会议策划扩大侵越战争制造舆论准备美国军政头目发出疯狂战争叫嚣,1967-03-21,1967-03
南越各地军民广泛出击狠揍敌人广义、承天等省解放武装力量几天内歼敌近千,1967-03-21,1967-03
喜信到厂矿,1967-03-21,1967-03
两副重担一肩挑  （对口词）,1967-03-21,1967-03
党中央和咱心连心,1967-03-21,1967-03
抓革命促生产的模范（曲谱）,1967-03-21,1967-03
毛主席语录,1967-03-22,1967-03
坚决执行毛主席的干部政策黑龙江省依兰县红色造反者,1967-03-22,1967-03
坚决响应毛主席伟大号召，为党为人民作出新的贡献人民解放军大力支持工业生产工作军民同学毛主席著作，同心闹革命，协力促生产，革命生产迅速出现新面貌,1967-03-22,1967-03
积极支援厂矿企业抓革命促生产,1967-03-22,1967-03
医务工作者开赴春耕第一线好得很！,1967-03-22,1967-03
《在农村中坚决贯彻“抓革命，促生产”的伟大方针》一书出版,1967-03-22,1967-03
既是毛泽东思想宣传队又是卫生工作队北京等地大批医务人员奔赴春耕第一线,1967-03-22,1967-03
青岛市三级干部会议向全市无产阶级革命派发出号召高举毛泽东思想伟大红旗把文化大革命进行到底,1967-03-22,1967-03
美国强盗军舰、飞机连续侵入我领海领空我提出严重警告我国人民对美帝军事挑衅表示极大愤怒,1967-03-22,1967-03
我们是怎样区别对待领导干部的,1967-03-22,1967-03
报眼毛主席语录,1967-03-22,1967-03
帮助犯错误的干部站出来,1967-03-22,1967-03
弄清思想团结同志,1967-03-22,1967-03
用毛泽东思想武装头脑日本青少年活学活用《毛主席语录》的故事,1967-03-22,1967-03
在毛泽东思想大学校里成长——访问一位在中国工作的美国女专家,1967-03-22,1967-03
伟大的毛主席  光辉的红太阳,1967-03-22,1967-03
毛泽东思想是革命人民斗争的指南巴基斯坦人民无限热爱《毛主席语录》,1967-03-22,1967-03
从毛主席著作中汲取了革命力量,1967-03-22,1967-03
印度反动派的反华丑剧,1967-03-22,1967-03
阮友寿主席向西贡市人民发出号召团结起来打败美帝  推翻傀儡统治,1967-03-22,1967-03
印度当局利用中国西藏叛匪进行猖狂反华活动我外交部最强烈抗议印度政府新挑衅,1967-03-22,1967-03
越南北方军民击落美机两架,1967-03-22,1967-03
一仆二主  加紧勾结美帝犒赏，苏修捧场，竭力为印度新政府打气印度总统向美苏主子献媚，恶毒地攻击中国,1967-03-22,1967-03
勇敢战斗  不怕牺牲  不怕疲劳  连续作战西宁军民二十三天歼美军四千多,1967-03-22,1967-03
美帝妄图扩大战争挽救侵越败局关岛黑会策划新阴谋后收场,1967-03-22,1967-03
报眼口号,1967-03-23,1967-03
把革命放在首位,1967-03-23,1967-03
哈尔滨铁路局夺权后运输形势大好,1967-03-23,1967-03
遵照伟大领袖毛主席提出的革命的“三结合”的正确方针山西省革命委员会正式建立,1967-03-23,1967-03
坚决执行和捍卫革命的“三结合”方针,1967-03-23,1967-03
军民同心闹革命协力促生产,1967-03-23,1967-03
解放军驻哈尔滨某部广大指战员深入工厂交通运输企业用毛泽东思想武装无产阶级革命派夺好权掌好权狠抓革命猛促生产,1967-03-23,1967-03
报眼口号,1967-03-23,1967-03
在抓革命促生产中立新功哈尔滨市滨江区民兵活学活用毛主席著作讲用会部分同志的发言,1967-03-23,1967-03
对待干部要作阶级分析,1967-03-23,1967-03
丢开私心闹革命  挺起腰杆抓生产,1967-03-23,1967-03
亚非作家常设局发表声明揭露苏修分裂和破坏亚非作家运动的严重罪行  苏修策划贝鲁特伪“第三届亚非作家大会”是为美帝效劳从大量事实中再次得出结论：苏修是美帝的头号帮凶和亚非人民的头号叛徒；反帝必须反修今年在北京召开的第三届亚非作家大会筹备工作正在令人满意地进行，中国文化大革命的胜利是大会取得成功的保证,1967-03-23,1967-03
被苏修无理驱逐的我驻苏使馆两位同志回京首都无产阶级革命派代表等到机场热烈欢迎,1967-03-23,1967-03
三棵树车辆段坚决贯彻“抓革命，促生产”方针精简重叠机构  发扬协作精神三分之二非生产人员充实生产第一线，革命生产出现新面貌,1967-03-23,1967-03
高举毛泽东思想伟大红旗坚持正义斗争香港中国海员反迫害斗争赢得巨大胜利荷兰渣华公司被迫低头认错，接受中国海员合理要求,1967-03-23,1967-03
我驻苏临时代办严正驳斥苏修当局对我使馆的诽谤诬蔑苏修恶化两国关系疯狂反华决没有好下场,1967-03-23,1967-03
印尼亚非人民团结组织谴责苏修分裂亚非人民团结反帝运动宣布退出苏修操纵的亚非团结组织书记处决心使今年在北京举行的第五届亚非团结大会取得巨大成功,1967-03-23,1967-03
庆祝巴基斯坦国庆中巴友协举行招待会,1967-03-23,1967-03
中古签订今年贸易议定书,1967-03-23,1967-03
鳄鱼的眼泪,1967-03-23,1967-03
出卖苏联人民的利益  大肆反华反共反人民苏修加紧同日本反动派勾结,1967-03-23,1967-03
为美国扩大战争效劳  疯狂复活军国主义佐藤政府通过第三次扩军计划,1967-03-23,1967-03
印尼政府竟公然篡改我国国名我大使馆提出最强烈抗议,1967-03-23,1967-03
阿扎尼亚民族解放斗争一定胜利中国亚非团结会等表示坚决支持阿扎尼亚人民斗争阿扎尼亚泛非主义者大会重申争取解放的坚定决心,1967-03-23,1967-03
越南驻华临时代办在记者招待会上说美帝的战争“升级”行动必遭惩罚,1967-03-23,1967-03
来者不善  善者不来美军政头目连续到台湾活动,1967-03-23,1967-03
美帝在侵越战争中的困难是不可克服的,1967-03-23,1967-03
南越昆嵩嘉莱军民猛袭敌人建奇功一个月全歼和重创美国侵略军十六个连,1967-03-23,1967-03
报眼口号,1967-03-24,1967-03
北京市革命职工代表会议决议,1967-03-24,1967-03
无产阶级革命派在毛泽东思想伟大红旗下大会师北京市革命职工代表会议胜利召开,1967-03-24,1967-03
北京市革命职工代表会议  给毛主席的致敬信,1967-03-24,1967-03
太原三十多万军民集会游行欢庆山西省革命委员会成立紧紧跟着毛主席夺取革命新胜利大会通过给我们最最敬爱的伟大领袖毛主席的致敬电,1967-03-24,1967-03
贵阳棉纺厂革命职工大破资产阶级“权威”革命放在首位  生产迅猛发展色布质量达到建厂以来最高水平，产量上升，成本降低,1967-03-24,1967-03
巴基斯坦驻中国大使举行国庆招待会周恩来总理等应邀出席苏尔坦·穆罕默德·汗大使和陈毅副总理共祝中巴友谊不断发展,1967-03-24,1967-03
中国亚非团结委员会代表发表声明亚非团结组织常设书记处已成苏修工具中国亚非团结委员会不再同它发生关系,1967-03-24,1967-03
美国侵略者惊魂未定又挨炮轰西贡嘉定地区解放军猛袭敌巢歼美军三百多,1967-03-24,1967-03
越外交部谴责英国政府追随美帝侵略政策英国必须停止把香港作为美帝侵越基地,1967-03-24,1967-03
革命造反才有活路,1967-03-24,1967-03
国大党的反动统治造成严重恶果印度已变成饥饿之国,1967-03-24,1967-03
印度人民反饥饿斗争烈火越烧越旺愤怒的饥民袭击警察所和粮店，夺取武器和粮食,1967-03-24,1967-03
狠狠打击反动政府的民族压迫政策印度少数民族武装不断袭击反动军警,1967-03-24,1967-03
越南朋友热情赞颂毛泽东思想是无产阶级革命事业的指路明灯毛泽东主席是世界人民最伟大的革命旗手中国文化大革命是最伟大的最彻底的革命,1967-03-24,1967-03
痛击苏修对咱中国农民的诬蔑,1967-03-24,1967-03
塞内加尔朋友说中国文化大革命照亮各国人民斗争道路文化大革命激励世界人民扫除帝修反苏修攻击中国文化大革命是怕苏联人民起来造他们的反,1967-03-24,1967-03
日本朋友说中国文化大革命对世界革命发生巨大影响文化大革命是向共产主义过渡的必经之路,1967-03-24,1967-03
军民并肩上战场,1967-03-24,1967-03
认真,1967-03-24,1967-03
及时雨,1967-03-24,1967-03
报眼口号,1967-03-25,1967-03
报眼口号,1967-03-25,1967-03
首都广大革命职工热烈欢呼工代会胜利召开响应毛主席号召掀起抓革命促生产高潮实现革命的大联合，贯彻革命的“三结合”，坚决打退资本主义反革命复辟逆流鼓足干劲，力争上游，大力支援农业，为完成和超额完成国家计划尽最大努力,1967-03-25,1967-03
新汶矿务局革命职工在毛主席的革命路线指引下坚决斗争  彻底粉碎阶级敌人反扑坚守岗位  月月超额完成国家计划,1967-03-25,1967-03
抓革命是促生产的动力,1967-03-25,1967-03
永远和无产阶级革命派站在一起,1967-03-25,1967-03
革命的“三结合”必须走群众路线,1967-03-25,1967-03
国务院核准中毛经济、文化和贸易协定,1967-03-25,1967-03
粮棉布局一定要服从国家计划,1967-03-25,1967-03
浇好小麦返青水,1967-03-25,1967-03
用只争朝夕的精神搞好麦田管理,1967-03-25,1967-03
枣园大队贫下中农和干部响应毛主席的号召情绪高昂搞革命  热气腾腾闹春耕,1967-03-25,1967-03
上市大队正确处理国家、集体、个人三者关系落实春播计划掀起生产高潮广大贫下中农根据新制订的增产计划，加紧积肥送肥，整修田间渠道，认真检查种子、种苗，按作物计划种植面积一丘一丘落实到田,1967-03-25,1967-03
把农用物资及时送到春耕第一线小清河航运局革命派破冰开航，二月份和三月上半月运送的农业生产急需物资，比去年同期增加一倍以上,1967-03-25,1967-03
继承和发扬韶山人民光荣的斗争传统韶山大队民兵在备耕中发挥突击队作用黄窝大队民兵坚持活学活用毛主席著作，有力地促进了春耕生产,1967-03-25,1967-03
解放军大力支援工业  济南市一片热气腾腾工人战士并肩战斗革命生产双丰收,1967-03-25,1967-03
把伟大的毛泽东思想带给工人同志贵州军区派出一批干部帮助贵阳铁路分局抓革命、促生产，使贵州省铁路运输出现一派新气象。,1967-03-25,1967-03
做毛泽东思想的宣传员  当革命左派的小学生长春驻军宣传队深入第一汽车厂，有力地促进了革命和生产,1967-03-25,1967-03
人民战士支援春耕忙——解放军福建前线部队帮助群众生产的小故事,1967-03-25,1967-03
我作协强烈谴责苏修策划亚非作家伪“三大”的分裂罪行亚非革命作家团结起来挫败苏修破坏阴谋坚信在北京举行的第三次亚非作家大会必将更高地举起毛泽东思想伟大红旗苏修分裂行为彻底暴露了它投靠美帝出卖亚非人民团结反帝事业的叛徒嘴脸,1967-03-25,1967-03
遵循毛泽东思想的正确路线  加强亚非人民的战斗团结马尔加什进步人士坚决支持在北京召开亚非团结大会,1967-03-25,1967-03
传播伟大的毛泽东思想  增进中日人民团结友好中国通讯社在东京举行成立庆祝大会,1967-03-25,1967-03
法政府把我国在巴黎两处房产交还我使馆,1967-03-25,1967-03
加强思想革命化促进生产发展阿尔巴尼亚工人胜利完成头两月生产计划,1967-03-25,1967-03
发罗拉制碱厂生产出第一批纯碱广大职工决心以革命热情完成新的战斗任务,1967-03-25,1967-03
阿全国人口达一百九十三万余人,1967-03-25,1967-03
决心夺取一个丰收年阿农村掀起春耕生产高潮,1967-03-25,1967-03
南越解放通讯社发表评论说南越人民决心打垮美国侵略者坚决实现民族解放阵线五点声明的庄严誓言,1967-03-25,1967-03
西哈努克亲王谴责美帝企图把柬埔寨变为殖民地柬埔寨坚决粉碎美帝颠覆阴谋,1967-03-25,1967-03
我国际贸易促进会和远洋运输公司发表声明坚决支持越南兄弟的正义斗争,1967-03-25,1967-03
美国侵略军为非作歹香港居民怒斥战争瘟神,1967-03-25,1967-03
他侬集团死心塌地充当美帝侵越帮凶竟决定让美国Ｂ－５２轰炸机进驻泰国,1967-03-25,1967-03
为美帝殉葬的奴才,1967-03-25,1967-03
南越解放军在保邦又打了一场漂亮的歼灭战一小时战斗全歼美军一个战团西宁省军民二十三天共歼灭美军五千多,1967-03-25,1967-03
毛主席语录,1967-03-26,1967-03
四川渡口驻军从政治思想上支持左派创造了很好的经验帮助革命左派学习和运用毛泽东思想,1967-03-26,1967-03
首要的是从政治思想上支持左派,1967-03-26,1967-03
编者按,1967-03-26,1967-03
永远和群众联系在一起革命派夺权以后的根本问题是巩固政权，防止资产阶级的反革命复辟，这就要求领导班子不断革命，永不变色。,1967-03-26,1967-03
阶级斗争没有熄灭党内一小撮走资本主义道路的当权派在失去权力以后，绝不会甘心失败，他们必然要用各种方式进行垂死的反扑。,1967-03-26,1967-03
警惕糖衣炮弹的袭击,1967-03-26,1967-03
无私的战士心最红——无产阶级革命战士郭嘉宏的故事,1967-03-26,1967-03
是起点，不是终点资产阶级革命，只要把政权夺到手，就达到了最终目的。而无产阶级革命派取得夺权胜利以后，大量而艰苦地改造人、改造社会的工作，还在前面。,1967-03-26,1967-03
吴淞公社广大革命干部和贫下中农活学活用毛主席著作打破定局论发挥主观能动作用  狠抓夏熟作物管理,1967-03-26,1967-03
把农村当作学习毛主席著作好课堂把广大贫下中农当作自己的好老师沈阳部队某团六连指战员，认真学习《湖南农民运动考察报告》，决心向贫下中农学习，为春耕生产贡献更大力量,1967-03-26,1967-03
是技术服务队  又是毛泽东思想宣传队长春组织技术工人下乡重庆农业生产资料供应部门积极供应春耕物资,1967-03-26,1967-03
山西建立各级第一线指挥部加强对春耕生产的领导派出大批干部奔赴春耕第一线,1967-03-26,1967-03
西藏人民热烈拥护我外交部照会最强烈抗议印度当局利用西藏叛匪反华,1967-03-26,1967-03
甘当无产阶级革命派的小学生,1967-03-26,1967-03
报眼毛主席语录,1967-03-26,1967-03
打碎束缚我彻底革命的精神枷锁,1967-03-26,1967-03
用发展的眼光看待同志,1967-03-26,1967-03
老挝桑怒解放区军民无限热爱毛主席和毛泽东思想毛主席是最伟大的马列主义者革命人民掌握毛泽东思想就能消灭帝国主义和反动派,1967-03-26,1967-03
几内亚朋友热情赞颂毛泽东思想是红光普照的太阳,1967-03-26,1967-03
莫三鼻给非洲民族联盟主席发表声明谴责苏修分裂亚非人民团结运动的罪行巴苏陀兰大会党代表支持在北京召开第五届亚非团结大会,1967-03-26,1967-03
苏丹自由笔会和莫三鼻给非洲民族联盟主席分别发表声明支持今年在北京召开第三次亚非作家大会,1967-03-26,1967-03
毛主席派来的好医生——记全心全意为也门人民服务的中国医疗队,1967-03-26,1967-03
严惩美国强盗战争“升级”罪行越南北方军民猛轰南越美军炮兵基地消灭美军一千多名，击毁大炮十七门、军车五十七辆,1967-03-26,1967-03
南越解放军炮轰岘港美军机场战果辉煌歼灭美军一千多  毁美机九十四架边和解放军二十五分钟全歼伪军一营一号公路伏击战毁敌军八十五辆,1967-03-26,1967-03
纪念越南全国反美斗争日十七周年阮明芳代团长举行电影招待会,1967-03-26,1967-03
日美等国报刊透露苏美在越南问题上大做交易的内幕苏修叛徒嘴脸暴露无遗,1967-03-26,1967-03
苏修集团开门揖盗竭力鼓励美国垄断资本渗入苏联,1967-03-26,1967-03
越南南方民族解放阵线发表声明南越人民誓同北方同胞并肩打到底美国强盗疯狂袭击北方必将遭到南方军民严厉惩罚,1967-03-26,1967-03
苏修热心为印尼反动派输血公然表示愿意在印尼投资并扩大同印尼的贸易,1967-03-26,1967-03
两条走狗  一路货色印尼右派同“马来西亚”加紧军事勾结,1967-03-26,1967-03
肆意出卖民族利益印尼反动派为帝国主义资本敞开大门,1967-03-26,1967-03
毛主席语录,1967-03-27,1967-03
美帝扩大侵越战争的黑会,1967-03-27,1967-03
几十万革命小将在伟大统帅毛主席身边团结起来，联合起来首都中等学校红卫兵代表大会成立,1967-03-27,1967-03
首都中等学校红卫兵代表大会给毛主席的致敬信,1967-03-27,1967-03
首都中等学校红卫兵代表大会宣言,1967-03-27,1967-03
首都中等学校红卫兵代表大会告全国中等学校红卫兵书响应毛主席的伟大号召：“复课闹革命”实现革命大联合将文化大革命进行到底,1967-03-27,1967-03
各国公众舆论谴责关岛黑会策划扩大战争美帝任何阴谋诡计挽救不了败局,1967-03-27,1967-03
粉碎美帝颠覆柬埔寨的阴谋,1967-03-27,1967-03
不愿为美国侵越战争火中取栗法国宣布不参加东南亚集团理事会会议,1967-03-27,1967-03
抗议美帝侵略越南伦敦两千多人举行示威,1967-03-27,1967-03
和平烟幕掩盖不住战争阴谋关岛会议是美帝扩大侵略的前奏西方报刊透露约翰逊之流策划新的战争冒险的底细,1967-03-27,1967-03
刚果（布）总统接见我妇女代表团,1967-03-27,1967-03
我工会代表团到达刚果（布）,1967-03-27,1967-03
