毛主席语录,1967-03-01,1967-03
用毛泽东思想做为大联合的灵魂贵阳棉纺厂按行政部门搞联合组织纪律性大大加强，革命和生产出现新面貌,1967-03-01,1967-03
上海工业战线百万革命派战士、革命职工和干部举行誓师大会为无产阶级革命事业夺好权掌好权用好权坚决把活学活用毛主席著作的群众运动提高到新阶段，加速实现人的思想革命化，进一步开展“三结合”夺权斗争，掀起革命和生产新高潮,1967-03-01,1967-03
无产阶级革命派大联合的好形式,1967-03-01,1967-03
毛主席给革命小将指明前进方向东方红战斗队和《体育战报》的无产阶级革命派，决心更好地活学活用毛主席著作，开展两个夺权斗争，把无产阶级文化大革命进行到底,1967-03-01,1967-03
边战斗  边学习  灵魂深处闹革命新北大革命学生欢呼东方红战斗队革命的大字报,1967-03-01,1967-03
“从零开始”好得很,1967-03-01,1967-03
首先要有正确的态度,1967-03-01,1967-03
同革命干部一道挑起春耕生产重担黄冈县永红公社幸福大队贫下中农革命派和革命群众，揭穿阶级敌人的阴谋诡计，团结和帮助干部，共同搞好春耕生产。响应毛主席伟大号召  掀起春耕生产的高潮,1967-03-01,1967-03
遵义市郊革命派农民组织致书全省农民活学活用毛主席著作搞好春耕生产,1967-03-01,1967-03
哈尔滨汽轮机厂革命派夺权后发扬艰苦奋斗作风牢记毛主席教导  永远节约闹革命,1967-03-01,1967-03
福建民兵坚决响应毛主席号召抓革命促生产促战备一手拿枪一手拿锄大闹春耕,1967-03-01,1967-03
报眼口号,1967-03-01,1967-03
执行党的干部政策决不能打折扣,1967-03-01,1967-03
坚决站到毛主席革命路线一边,1967-03-01,1967-03
决心和革命派一起干革命,1967-03-01,1967-03
打倒无政府主义！,1967-03-01,1967-03
巴基斯坦朋友热烈欢呼中国革命派“三结合”夺权好得很苏修领导集团惶恐万状深怕人民起来造反,1967-03-01,1967-03
日本朋友欢呼我国革命派夺权的革命行动文化大革命为世界人民树立光辉榜样进行政治革命、经济革命和文化革命都离不开毛泽东思想,1967-03-01,1967-03
在古巴的爱国侨胞说：祖国永不变色  华侨才有靠山,1967-03-01,1967-03
中国文化大革命是世界革命的未来阿尔及利亚朋友说世界人民要走中国革命的道路,1967-03-01,1967-03
国际时事讲话,1967-03-01,1967-03
南越解放军猛轰岘港美军基地朔庄芹苴宁顺等省军民反“扫荡”歼敌一千多,1967-03-01,1967-03
越北方清化省军民击伤美军舰一艘美帝公然向越南北方一些河流投放水雷,1967-03-01,1967-03
解决越南问题的条件只能是美军滚出去阿《团结报》谴责美苏妄图扑灭越南人民抗美救国斗争烈火法国共产主义运动（马列）书记揭露柯西金访英的叛卖行径,1967-03-01,1967-03
日本《长周新闻》揭露美苏勾结的新阴谋美国的“和平”就是扩大侵略,1967-03-01,1967-03
美国军用飞机侵入我广东省领空我提出第四百二十六次严重警告,1967-03-01,1967-03
中保签订科技合作议定书,1967-03-01,1967-03
简明新闻,1967-03-01,1967-03
美国生产下降，投资萎缩，经济前景黯淡约翰逊承认美国经济面临着恶性通货膨胀和生产“过剩”的双重威胁,1967-03-01,1967-03
西欧各国经济面临严重生产“过剩”危机,1967-03-01,1967-03
毛主席语录,1967-03-02,1967-03
高举毛泽东思想伟大红旗实行“三结合”的无产阶级革命大军粉碎假夺权反夺权的阴谋山东省革命委员会在激烈搏斗中诞生第一号通告号召夺取革命生产双胜利,1967-03-02,1967-03
北满钢厂革命派始终坚持抓革命促生产他们处于少数地位的时候，坚持生产，争取了群众；他们掌权以后，继续团结群众，迅速建立了生产新秩序，生产大幅度增长。,1967-03-02,1967-03
山东省革命委员会给毛主席的致敬电,1967-03-02,1967-03
革命的“三结合”是夺权斗争胜利的保证,1967-03-02,1967-03
农村革命干部站到春耕生产第一线东方红公社组成抓革命促生产领导班子，挑起革命和生产的重担,1967-03-02,1967-03
广西驻军某部军人家属  踊跃投入支援春耕行列,1967-03-02,1967-03
中国无产阶级文化大革命万岁！阿尔巴尼亚劳动党中央机关理论刊物《党的道路》编辑部文章（摘要）,1967-03-02,1967-03
戈培尔的新门徒,1967-03-02,1967-03
苏修愈是造谣愈暴露叛徒嘴脸竟在“援越过境物资”问题上大肆诽谤中国妄图挑拨中越人民战斗友谊，为美帝效劳,1967-03-02,1967-03
越南通讯社受权声明说中国把援越过境物资妥善运到越南,1967-03-02,1967-03
苏修搞所谓“联合行动”就是要联合投降古纳瓦达纳夫人和杜阿玛痛斥苏修在越南问题上假支持真出卖,1967-03-02,1967-03
索马里工人谴责苏修领导集团法西斯暴行苏修终将埋葬在自掘的坟墓里,1967-03-02,1967-03
越南外交部谴责美帝及其南越走狗侵略柬埔寨完全支持柬埔寨政府的严正立场阿《团结报》强调柬人民必将挫败美帝及其走狗的侵略,1967-03-02,1967-03
丹麦工业展览会在北京开幕,1967-03-02,1967-03
庆祝德国家人民军建军十一周年德驻华武官举行酒会和电影招待会,1967-03-02,1967-03
国际简讯,1967-03-02,1967-03
莫三鼻给游击队袭击葡殖民军兵营安哥拉游击队在北部地区加强战斗不断取胜,1967-03-02,1967-03
南也门民族主义者攻打英国军营歼敌数十,1967-03-02,1967-03
南越西宁省解放军全歼美军两个炮兵连槟椥省军民一月份主动出击歼敌一千五百名,1967-03-02,1967-03
尼雷尔总统在坦桑尼亚执政党会议上说坦桑尼亚人民是自力更生的人民,1967-03-02,1967-03
阿《非洲革命》周刊揭露美国垄断资本渗入北非的阴谋美帝“援助”是为了建立殖民统治,1967-03-02,1967-03
《阿鲁沙宣言》和坦桑尼亚国有化措施,1967-03-02,1967-03
泰国人民武装去年歼敌五百多卖国贼他侬惊呼泰国面临象南越一样困难的局势,1967-03-02,1967-03
刚果（利）西线游击队扩大革命根据地肃清傀儡军队  争取群众支持  建立基层组织  实行自力更生,1967-03-02,1967-03
报眼毛主席语录,1967-03-02,1967-03
编者按,1967-03-02,1967-03
政治路线确定之后（曲谱）,1967-03-02,1967-03
没有多数才德兼备的领导干部是不能写成其历史任务的,1967-03-02,1967-03
必须善于识别干部,1967-03-02,1967-03
对于在工作中犯过错误的人们,1967-03-02,1967-03
使他变为一个好同志,1967-03-02,1967-03
群众的积极性相结合,1967-03-02,1967-03
毛主席语录,1967-03-03,1967-03
首都大专院校红卫兵代表大会宣言（一九六七年二月二十二日）,1967-03-03,1967-03
在伟大领袖毛主席身边、在伟大毛泽东思想旗帜下联合起来首都大专院校红卫兵代表大会成立,1967-03-03,1967-03
首都大专院校红卫兵代表大会  给毛主席的致敬信,1967-03-03,1967-03
在毛泽东思想伟大红旗下大联合把伟大的红卫兵运动推向新高潮首都大专院校红卫兵代表大会告全国红卫兵书,1967-03-03,1967-03
报眼口号,1967-03-03,1967-03
解放军指战员发扬战斗队、工作队、生产队的光荣传统以战斗姿态争分夺秒支援春耕,1967-03-03,1967-03
山西革命造反总指挥部贯彻抓革命促生产方针组织机修队伍支援春耕春灌,1967-03-03,1967-03
平度供销系统革命派认真学习党中央的信把春耕需用物资及时供应农村,1967-03-03,1967-03
陕西省人民医院支援春耕  白衣战士奔赴农业第一线,1967-03-03,1967-03
干部和群众共挑革命生产两副重担  森林大队备耕生产热火朝天,1967-03-03,1967-03
越南南方民族解放阵线中央委员会重申五点声明的严正立场号召军民勇往直前，打败美国侵略者约翰逊政府的“和平”论调不过是骗局，它的实际行动是扩大战争只要越南国土上还有美国侵略军，越南南方人民就决不放下武器,1967-03-03,1967-03
越外交部强烈谴责美帝新的战争“升级”罪行越南人民决不向美国武力屈服,1967-03-03,1967-03
越南首都各报热烈支持南越民族解放阵线声明北方人民坚决同南方同胞并肩战斗争取抗美救国神圣事业的彻底胜利,1967-03-03,1967-03
越《人民军队报》号召进一步发扬决战决胜的意志把仇恨变为行动，向敌人冲锋坚决粉碎美帝国主义的一切战争“升级”行动,1967-03-03,1967-03
红卫兵是中国最优秀的新的一代许多外国朋友深为革命小将的革命精神所感动,1967-03-03,1967-03
初升的太阳,1967-03-03,1967-03
最积极的战士,1967-03-03,1967-03
毛主席的好战士  反帝反修的突击队亚非朋友热情赞扬中国的红卫兵,1967-03-03,1967-03
你们干得好！,1967-03-03,1967-03
阿尔巴尼亚青年战友寄来热情洋溢的信愿同中国红卫兵互相鼓舞共同前进,1967-03-03,1967-03
毛主席语录,1967-03-04,1967-03
满怀对毛主席无限热爱的心情，热烈庆祝山东省革命委员会成立济南近三十万人集会游行广大工农兵和干部表示要坚决执行和捍卫“三结合”的正确方针革命群众同声赞扬解放军在支持革命派夺权斗争中的杰出贡献,1967-03-04,1967-03
我们是怎样争取和团结群众大多数的,1967-03-04,1967-03
依靠革命左派团结群众大多数争取“三结合”联合夺权彻底胜利王效禹同志在庆祝山东省革命委员会成立大会上的讲话,1967-03-04,1967-03
人民解放军坚决遵循毛主席的教导坚定地同无产阶级革命派并肩战斗杨得志同志在庆祝山东省革命委员会成立大会上的讲话,1967-03-04,1967-03
北京广大农兵和红卫兵热烈欢呼首都大专院校红卫兵大会师首都红代会成立必将推动无产阶级革命派大联合大批革命群众涌向党中央、国务院接待站报喜，纵情欢呼伟大毛泽东思想的新胜利革命小将们决心在夺党内一小撮走资本主义道路当权派的权的同时，狠斗“私”字，做永不掉队的红卫兵,1967-03-04,1967-03
农业工交财贸等部门无产阶级革命派和革命群众发出紧急呼吁各行各业紧密配合立即行动支援春耕,1967-03-04,1967-03
解放军坚决执行伟大统帅毛主席的战斗命令山东驻军在夺权斗争中立下不朽功勋,1967-03-04,1967-03
报眼口号,1967-03-04,1967-03
革命派大联合是一场灭资兴无的思想斗争,1967-03-04,1967-03
放下包袱  轻装上阵,1967-03-04,1967-03
灵魂深处闹革命——无产阶级革命派谈破私立公,1967-03-04,1967-03
严格区分两类矛盾是正确对待干部的重要前提空军某雷达团领导干部学习《关于正确处理人民内部矛盾的问题》的体会,1967-03-04,1967-03
锡共书记桑穆加塔桑号召全党学习和运用毛主席著作毛泽东思想是全世界革命运动的指南锡兰共产党出版《毛主席语录》僧加罗文版,1967-03-04,1967-03
法国《新人道报》发表“老三篇”毛主席三篇光辉著作在印度译成马拉雅兰文出版,1967-03-04,1967-03
缅甸许多工人积极学习《毛主席语录》毛泽东思想是反帝反修的强大武器,1967-03-04,1967-03
日本革命人民努力学习毛泽东思想学习会和学习小组纷纷成立，在革命群众集会上张贴毛主席语录、朗读毛主席语录、唱毛主席语录歌蔚然成风,1967-03-04,1967-03
摩洛哥驻华大使举行国庆招待会陈毅副总理和有关方面负责人应邀出席,1967-03-04,1967-03
挪威新任驻华大使到京,1967-03-04,1967-03
我春季出口商品交易会将在广州举行,1967-03-04,1967-03
我驻阿使馆人员在阿参加义务劳动,1967-03-04,1967-03
祝贺阿歌舞团访华演出成功我驻阿临时代办举行招待会,1967-03-04,1967-03
越南军民击落美机四架击伤美舰三艘,1967-03-04,1967-03
越祖国战线支持南越民族解放阵线和越外交部两项声明美国侵略者必将得到应有的惩罚,1967-03-04,1967-03
阮明芳举行中外记者招待会强调指出南越人民决心战斗到底  美帝和谈骗局必败,1967-03-04,1967-03
阿《人民之声报》和澳《先锋报》揭露：美帝加紧战争“升级”  苏修大干叛卖勾当柯西金伦敦之行是帮助美帝玩弄“以炸迫和”的战争讹诈,1967-03-04,1967-03
佐藤正在走东条的老路,1967-03-04,1967-03
佐藤公然叫嚷日本要进行核试验日本政府在美帝支持下加紧扩军备战发展军火工业,1967-03-04,1967-03
严惩疯狂进行战争“升级”的美国强盗南越西宁省解放军全歼美军三连,1967-03-04,1967-03
毛主席语录,1967-03-05,1967-03
翟里大队贫下中农和革命干部坚决保卫四清运动成果不许阶级敌人反攻倒算经过斗争考验的广大贫下中农和革命干部团结一致掀起春耕生产热潮,1967-03-05,1967-03
保卫四清运动的伟大成果,1967-03-05,1967-03
上海山东黑龙江山西贵州青岛广大无产阶级革命派热烈欢呼首都大专院校红代会的成立为全国红卫兵树立了光辉榜样,1967-03-05,1967-03
同革命群众和革命干部一起把昔阳县的大权全部夺到无产阶级革命派手中  陈永贵响应毛主席号召站在斗争前列为全省全国劳动模范树立了光辉榜样,1967-03-05,1967-03
一贯活学活用毛主席著作，多次不顾个人安危抢救战友国防部授予王裕昌“爱兵模范”称号,1967-03-05,1967-03
向用毛泽东思想武装起来的革命战士王裕昌热烈祝贺福建前线部队隆重举行命名大会广大指战员表示，要象王裕昌那样，永远忠于毛主席，在捍卫祖国和无产阶级文化大革命中创立新功王裕昌同志表示，要谦虚谨慎，戒骄戒躁，保持荣誉，发扬荣誉，做一个名副其实的毛主席的好战士,1967-03-05,1967-03
革命农民运动汹涌澎湃农业生产高潮滚滚向前新华社记者评述上海郊区农村抓革命促生产大好形势,1967-03-05,1967-03
水利电力部革命造反委员会号召水利战线上的革命职工和革命群众紧急动员起来抓好春灌抗旱保墒工作,1967-03-05,1967-03
奥地利马克思列宁主义党成立主张通过暴力推翻资本主义制度，建立无产阶级专政大会向毛主席林彪同志致热烈的革命敬礼,1967-03-05,1967-03
新西兰共产党政治委员会通过决议指出：中国文化大革命是绝对必要的是否承认在社会主义制度下有阶级斗争，是马列主义者和修正主义者的分界线,1967-03-05,1967-03
亚非朋友说中国文化大革命是对帝修的有力打击坚信马列主义红旗将在全世界飘扬,1967-03-05,1967-03
日本革命人士说中国文化大革命是国际共运史上的壮举支持还是反对中国文化大革命是区别真假马列主义者的准则,1967-03-05,1967-03
首都各界集会欢庆中老友协成立四周年中国人民坚决支持老挝人民打败美帝奔舍那夫人说我文化大革命给被压迫人民巨大鼓舞,1967-03-05,1967-03
索马里朋友欢呼我文化大革命和中索友谊我货船“兰州号”首次抵达摩加迪沙港受到热烈欢迎,1967-03-05,1967-03
陈叔亮大使招待柬中友协新常委会,1967-03-05,1967-03
我妇女代表团赴刚果（布）访问,1967-03-05,1967-03
阿报揭露美苏在裁军会议策划“防止核扩散”阴谋美苏正在加紧勾结共同反华,1967-03-05,1967-03
苏修叛卖行动的又一步骤柯西金同意就限制发展核导弹问题同美谈判,1967-03-05,1967-03
亚非舆论坚决反击苏修的分裂阴谋尽最大努力开好第五届亚非人民团结大会,1967-03-05,1967-03
老挝爱国军民又立新战功一月份在川圹省歼敌一百多，击落击伤敌机十三架,1967-03-05,1967-03
美国军舰和军用飞机侵入我领海领空我提出第四百二十七次严重警告,1967-03-05,1967-03
推翻吃人的阎王殿,1967-03-05,1967-03
美帝国主义“后院”处处是火山拉丁美洲人民反压迫反剥削斗争浪潮汹涌,1967-03-05,1967-03
美国吸血鬼在玻利维亚,1967-03-05,1967-03
玻利维亚共产党重申决不向亲美独裁政府屈服人民的回答是：加强团结，展开斗争！,1967-03-05,1967-03
春雨,1967-03-05,1967-03
解放军来到俺们庄,1967-03-05,1967-03
毛主席的信是春风,1967-03-05,1967-03
说“争”,1967-03-05,1967-03
春耕战鼓擂起来,1967-03-05,1967-03
立即为做好春耕生产而积极工作（曲谱）,1967-03-05,1967-03
我国外交部就越南局势的新发展发表声明毛泽东思想武装的七亿中国人民最坚决地支持越南兄弟抗美到底强烈谴责美帝对越南的新的军事讹诈和苏修领导集团的叛卖活动,1967-03-06,1967-03
青岛市革命委员会在文化大革命新形势下作出决定无产阶级革命派按单位按部门大联合,1967-03-06,1967-03
响应毛主席、党中央的号召，掀起春耕生产的高潮,1967-03-06,1967-03
青岛市革命委员会号召全市无产阶级革命派一切从全局利益出发听毛主席的话按单位按部门大联合,1967-03-06,1967-03
对敌狠  对己和,1967-03-06,1967-03
各地革命小将决心向首都大专院校红卫兵学习实行大联合  做出新贡献,1967-03-06,1967-03
国务院水土保持委员会革命群众组织向全国提出紧急倡议抓住有利时机，掀起春季水土保持运动新高潮,1967-03-06,1967-03
抓革命  促春耕——记首都郊区人民公社的备耕活动,1967-03-06,1967-03
鞍钢新产品——二十五米长钢轨标志我国钢轨生产技术进入世界先进行列,1967-03-06,1967-03
五位数字电压表出厂了,1967-03-06,1967-03
可喜的信号（编者按）,1967-03-06,1967-03
天津制成新型油石从此结束依赖进口的局面,1967-03-06,1967-03
报眼毛主席语录,1967-03-06,1967-03
要一丝不苟地执行毛主席的干部政策,1967-03-06,1967-03
革命干部只有打倒“私”字才能站出来,1967-03-06,1967-03
争取做一个无产阶级的当权派,1967-03-06,1967-03
无产阶级革命派谈“三结合”夺权,1967-03-06,1967-03
日本朋友安井热情赞颂说毛主席是世界革命的伟大舵手文化大革命把国际共产主义运动推向一个崭新阶段,1967-03-06,1967-03
坦桑尼亚人民无限热爱毛主席，热情学习毛泽东思想毛主席的话就是真理,1967-03-06,1967-03
荷兰一位学生写信给中国朋友热爱毛主席  想念北京城,1967-03-06,1967-03
霍查同志出席基层党组织会议并视察都拉斯区号召同旧思想开展斗争把革命进行到底,1967-03-06,1967-03
开展比学赶帮活动  热烈支援农业生产阿妇女在革命化运动中作出优异成绩,1967-03-06,1967-03
霍查同志的亲切教导  劳动党五大的鼓舞阿人民军在革命化大道上奋勇前进突出无产阶级政治，学习英雄人物，密切官兵关系，加强军民团结，实行自力更生,1967-03-06,1967-03
南越嘉定解放军猛袭美军基地经十二分钟战斗全歼美军两连,1967-03-06,1967-03
阿扎尼亚泛非主义者大会谴责苏修分裂亚非反帝斗争革命人民支持在北京召开亚非团结大会,1967-03-06,1967-03
美帝对拉丁美洲的侵略面目暴露无遗在泛美外长会议上鼓吹“经济一体化”，加紧推行“争取进步联盟”计划,1967-03-06,1967-03
简明新闻,1967-03-06,1967-03
毛主席语录,1967-03-07,1967-03
把活学活用毛主席著作群众运动推向新阶段用毛泽东思想指导夺权斗争太原市革命委员会号召革命派自觉夺头脑中“私”字的权,1967-03-07,1967-03
青岛国棉九厂革命组织认真实行“精兵简政”动员脱产人员返回生产岗位压缩非生产性开支，节约物资，保证生产第一线需要,1967-03-07,1967-03
中小学复课闹革命,1967-03-07,1967-03
无产阶级革命派最强大的靠山——记山东地区夺权斗争中人民子弟兵的新功勋,1967-03-07,1967-03
党中央的通知说出了革命师生的心里话北京上海小学陆续复课闹革命,1967-03-07,1967-03
响应毛主席伟大号召永远向雷锋同志学习,1967-03-07,1967-03
抓革命、促生产的好干部——记连江县南塘大队队长李英俤,1967-03-07,1967-03
打倒“私”字  放下包袱  搞好生产,1967-03-07,1967-03
象雷锋那样立场坚定爱憎分明全心全意支持无产阶级革命派沈阳部队某部隆重集会纪念毛主席题词“向雷锋同志学习”发表四周年,1967-03-07,1967-03
阿扎尼亚泛非主义者大会代表欢呼毛主席是当代最伟大的马列主义者赞扬中国无产阶级革命派“三结合”夺权胜利,1967-03-07,1967-03
美国进步劳工党《挑战》月报发表社论指出中国文化大革命使美帝苏修发抖,1967-03-07,1967-03
尼泊尔朋友说中国文化大革命是伟大创举文化大革命给世界人民指出光明大道现代修正主义者越是反对，世界人民越是支持,1967-03-07,1967-03
可怜的反华小丑,1967-03-07,1967-03
中国文化大革命鼓舞亚非拉人民拉美人民把中国革命群众的胜利看成自己的胜利,1967-03-07,1967-03
胡志明主席视察农村号召人民努力生产和战斗为抗美救国事业作出新贡献,1967-03-07,1967-03
印尼“临时人协”竟恶毒篡改我国国名制造“两个中国”我大使馆最严重抗议印尼政府的反华挑衅,1967-03-07,1967-03
印尼经济一团糟,1967-03-07,1967-03
苏美在越南问题上干些什么勾当？从西方报刊看苏修领导集团充当美帝帮凶的叛卖行为,1967-03-07,1967-03
对美帝国主义侵略者的回答就是狠狠地打南越西宁省军民上月全歼十四连美军人民武装再次炮轰美军朱莱基地和茶诺机场,1967-03-07,1967-03
他戴上了红袖章,1967-03-07,1967-03
欢迎革命领导干部站出来（对口词）,1967-03-07,1967-03
学会做“医生”,1967-03-07,1967-03
帮,1967-03-07,1967-03
毛主席语录,1967-03-08,1967-03
革命在一起  干活在一起  生活在一起用毛泽东思想破私立公按部门大联合,1967-03-08,1967-03
黑龙江省军区向全省民兵发出号召紧跟毛主席  争当革命派掌握民兵领导权，巩固无产阶级专政，狠抓革命，猛促生产,1967-03-08,1967-03
报眼毛主席语录,1967-03-08,1967-03
翟里大队革命妇女在阶级斗争风浪中迅速成长坚决捍卫以毛主席为代表的革命路线发扬革命硬骨头精神打退敌人的反扑,1967-03-08,1967-03
破私立公，做彻底的无产阶级革命派,1967-03-08,1967-03
正确地对待自己,1967-03-08,1967-03
无政府主义思潮必须批判,1967-03-08,1967-03
革命派内部应求大同存小异——对实现无产阶级革命派大联合的几点看法,1967-03-08,1967-03
在京外国女专家热烈赞颂中国无产阶级文化大革命毛泽东思想照亮世界人民解放的道路祝世界人民伟大领袖毛主席万寿无疆,1967-03-08,1967-03
毛主席的话句句说到我们心坎上——记一位日本青年女工活学活用《毛主席语录》的故事,1967-03-08,1967-03
非洲革命人民无限信仰毛泽东思想越读毛主席的书心里越亮堂要革命就必须遵循毛主席的教导进行斗争,1967-03-08,1967-03
澳共（马列主义者）主席希尔同志说：苏修领导集团是历史上最大的叛徒苏修勾结美帝推行“和谈”阴谋是要迫使越南人民投降,1967-03-08,1967-03
阿《团结报》严厉谴责苏修为美帝“和谈”骗局效劳美苏“神圣同盟”挽救不了失败的命运莫三鼻给自由战士谴责美苏勾结破坏越南人民革命,1967-03-08,1967-03
比利时公众示威声援越南人民斗争格里巴同志等比共领导人参加示威游行,1967-03-08,1967-03
我代表向世界青联主席提出强烈抗议世界青联已堕落成为苏修反华工具,1967-03-08,1967-03
南越解放军狠揍南朝鲜帮凶军袭击帮凶军据点歼敌六百多名,1967-03-08,1967-03
在战斗烈火中永生的英雄战士阮文历短短一年多的战斗中，他亲手消灭了一百多名敌人，为祖国的解放事业流尽了最后一滴鲜血。,1967-03-08,1967-03
歼美包围圈里访勇士,1967-03-08,1967-03
报眼毛主席语录,1967-03-09,1967-03
搞臭风头主义,1967-03-09,1967-03
青岛无产阶级革命派显示巨大智慧和力量全市响彻着革命和生产双胜利的凯歌,1967-03-09,1967-03
应中共中央邀请来我国进行友好访问威尔科克斯同志到北京周恩来康生等同志到机场欢迎,1967-03-09,1967-03
桃园公社贫下中农坚决照毛主席的指示办事团结社队干部把春耕搞得热火朝天,1967-03-09,1967-03
武装部干部深入生产第一线滨江区贫下中农和民兵掀起春耕热潮,1967-03-09,1967-03
海南岛驻军某部军人家属同黎族社员一起大闹春耕,1967-03-09,1967-03
支持无产阶级文化大革命  反击敌人破坏社会主义市场的阴谋上海大批日用工业品源源调往各地,1967-03-09,1967-03
报眼口号,1967-03-09,1967-03
坚决站在无产阶级革命派一边,1967-03-09,1967-03
为革命领导干部的“亮相”喝采,1967-03-09,1967-03
不折不扣地按照毛主席的干部政策办事黑龙江省委机关红色造反团红炮兵分团,1967-03-09,1967-03
报眼口号,1967-03-09,1967-03
抓革命促生产的凯歌,1967-03-09,1967-03
农村干部要欢迎贫下中农的批评德州市七里铺生产大队革命干部座谈应该怎样对待革命群众的批评,1967-03-09,1967-03
在春耕生产中立新功,1967-03-09,1967-03
我国十二团体就越南局势发表联合声明坚决支持越南人民打到底,1967-03-09,1967-03
