驻山东农机学院工人毛泽东思想宣传队决心把教育革命进行到底带领革命师生深入三大革命斗争第一线在广大工农群众教育帮助下搞好斗批改,1968-11-01,1968-11
是“占领”不是“点缀”,1968-11-01,1968-11
广东阳山县革委会成员深入厂矿、社队广泛听取工人和贫下中农的意见依靠工人和贫下中农实行精兵简政,1968-11-01,1968-11
毛主席语录,1968-11-01,1968-11
贫下中农自编新教材好得很,1968-11-01,1968-11
贫下中农管理学校  一代新人茁壮成长储茂农业中学培养出一批革命接班人,1968-11-01,1968-11
坚决把农村学校的领导权夺过来,1968-11-01,1968-11
贫下中农管理学校就是好！,1968-11-01,1968-11
请工农群众进来  派本站职工出去肇东县生产资料供应站开门进行斗批改,1968-11-01,1968-11
在领导斗批改中狠抓思想革命化,1968-11-01,1968-11
走红军医院之路——记井冈山上的上海医疗队,1968-11-01,1968-11
沿着社会主义方向办企业  坚定不移为农业生产服务贵州红星拖拉机厂试制成功一机多用柴油机,1968-11-01,1968-11
山东浙江江西棉区战胜自然灾害夺得棉花丰收广大社员满怀革命豪情踊跃交售新棉,1968-11-01,1968-11
跃进高潮滚滚来石家庄市广大革命工人开展技术革新、技术革命运动促进生产大发展,1968-11-01,1968-11
报眼口号,1968-11-01,1968-11
在路线问题上没有调和的余地,1968-11-01,1968-11
批臭“党内和平论”,1968-11-01,1968-11
坚决彻底清除废料,1968-11-01,1968-11
吸收新鲜血液才能朝气蓬勃,1968-11-01,1968-11
积极开展党内的思想斗争,1968-11-01,1968-11
北京城区天气预报,1968-11-01,1968-11
怒斥苏修叛徒的诬蔑,1968-11-01,1968-11
反对反动当局迫害  抗议垄断资本剥削资本主义国家工人罢工斗争此伏彼起,1968-11-01,1968-11
反对政府充当美帝侵略帮凶新西兰人民举行示威,1968-11-01,1968-11
叙利亚组成新政府,1968-11-01,1968-11
我国帮助修建的尼泊尔一公路开始进行勘测工作,1968-11-01,1968-11
打着“经济援助”的幌子干着同美帝一样的勾当苏修对印度实行社会帝国主义的经济掠夺苏修的罪恶行径必将激起印度人民的强烈反对而遭到可耻的失败,1968-11-01,1968-11
粉碎日美“安全条约”！打倒佐藤政府东京工人学生斗志昂扬举行反美示威游行,1968-11-01,1968-11
中国共产党第八届扩大的第十二次中央委员会全会公报,1968-11-02,1968-11
毛主席语录,1968-11-02,1968-11
农民毛泽东思想宣传队好——河北省涿鹿县革委会的调查报告,1968-11-02,1968-11
毛泽东思想在我家扎下了根,1968-11-02,1968-11
以最快速度让毛主席最新指示家喻户晓,1968-11-02,1968-11
“我们要的是共产主义风格！”,1968-11-02,1968-11
厂矿企业干部下放劳动的一个典型——河南洛阳玻璃厂调查报告,1968-11-02,1968-11
灵魂深处的变化——河北邢台綦村铁矿干部下放劳动的收获,1968-11-02,1968-11
沿着毛主席指引的光辉道路前进——记在西藏高原立足生根的女知识青年程振英,1968-11-02,1968-11
报眼口号,1968-11-02,1968-11
南京长江大桥工人狠批大叛徒刘少奇“爬行哲学”,1968-11-02,1968-11
印度《解放》月刊热情欢呼我国文化大革命的辉煌胜利中国人民在伟大的领袖毛主席领导下从一个划时代胜利走向又一划时代胜利,1968-11-02,1968-11
毛主席两篇光辉著作在锡兰翻译出版,1968-11-02,1968-11
胜利属于用毛泽东思想武装的中国人民坦桑尼亚朋友热烈祝贺我国文化大革命取得伟大胜利,1968-11-02,1968-11
阿政府经济代表团结束南京访问回到北京战友们在访问南京时高度评价我国无产阶级文化大革命,1968-11-02,1968-11
反对垄断资本的残酷剥削和压迫反对腐朽的资产阶级社会和教育制度意大利工人学生运动此伏彼起席卷全国英汽车制造工人罢工斗争高涨西班牙葡萄牙学生示威反对法西斯统治,1968-11-02,1968-11
我驻英代办处连续举行电影招待会《钢琴伴唱＜红灯记＞》等影片受到英国进步朋友热烈赞扬,1968-11-02,1968-11
庆祝阿尔及利亚革命十四周年阿尔及利亚驻华大使举行招待会谢富治副总理等应邀出席,1968-11-02,1968-11
赞比亚部长视察我援建坦赞铁路勘测设计小组工作营中国援助使赞比亚人民深深感动,1968-11-02,1968-11
北京城区天气预报,1968-11-02,1968-11
报眼口号,1968-11-03,1968-11
全国亿万革命群众热烈欢呼党的八届扩大的十二中全会公报发表热烈庆祝无产阶级文化大革命伟大胜利紧跟伟大领袖毛主席乘风破浪奋勇前进,1968-11-03,1968-11
解放军热烈欢呼党的八届扩大的十二中全会的成功,1968-11-03,1968-11
《中国共产党第八届扩大的第十二次中央委员会全会公报》出版单行本,1968-11-03,1968-11
紧跟毛主席从胜利走向胜利,1968-11-03,1968-11
热烈欢呼文化大革命的辉煌胜利,1968-11-03,1968-11
把大叛徒刘少奇永远开除出党大快人心！,1968-11-03,1968-11
为我们贫下中农除了一大害,1968-11-03,1968-11
全会公报表达了全国无产阶级革命派的心愿,1968-11-03,1968-11
欢腾的首都之夜,1968-11-03,1968-11
天安门前欢庆胜利,1968-11-03,1968-11
喜讯传到了花家地,1968-11-03,1968-11
公报说出了我们心里话,1968-11-03,1968-11
敬祝毛主席万寿无疆！,1968-11-03,1968-11
越南民主共和国政府十一月二日发表的声明全文,1968-11-03,1968-11
约翰逊十月三十一日发表的讲话全文,1968-11-03,1968-11
配合美帝国主义的侵略政策  扶植印度反动派进行反华苏修集团同印度反动派加紧反革命勾结苏印政府头目最近你来我往进行反革命串连，大搞阴谋勾当,1968-11-03,1968-11
报眼口号,1968-11-03,1968-11
戳穿大叛徒刘少奇“技术中心”论的反动本质,1968-11-03,1968-11
北京城区天气预报,1968-11-03,1968-11
毛主席语录,1968-11-04,1968-11
亿万军民认真学习热情宣传党的十二中全会公报决心紧跟伟大领袖毛主席奋勇前进,1968-11-04,1968-11
坚决响应党的八届扩大的十二中全会号召以实际行动迎接党的九次代表大会的召开,1968-11-04,1968-11
紧跟毛主席胜利是属于我们的,1968-11-04,1968-11
在全会公报的指引下阔步前进,1968-11-04,1968-11
誓把新疆建成反帝反修钢铁长城,1968-11-04,1968-11
公报照亮了我们前进的道路,1968-11-04,1968-11
永远紧跟毛主席海枯石烂不变心——韶山、井冈山、遵义、延安革命人民热烈欢呼党的八届十二中全会公报发表,1968-11-04,1968-11
跟着毛主席的红旗走就是胜利！——韶山、井冈山、遵义、延安革命人民热烈欢呼党的八届十二中全会公报发表,1968-11-04,1968-11
遵义儿女永远忠于毛主席——韶山、井冈山、遵义、延安革命人民热烈欢呼党的八届十二中全会公报发表,1968-11-04,1968-11
延安人民紧跟毛主席走社会主义道路——韶山、井岗山、遵义、延安革命人民热烈欢呼党的八届十二中全会公报发表,1968-11-04,1968-11
列车上的欢呼——韶山、井冈山、遵义、延安革命人民热烈欢呼党的八届十二中全会公报发表,1968-11-04,1968-11
中国人民革命和社会主义事业的伟大的历史性事件阿《人民之声报》发表社论热烈欢呼中国共产党第八届扩大的十二中全会的成功,1968-11-04,1968-11
一场清算刘少奇反革命罪行的战斗——记南京长江大桥工地上的军民欢呼党的十二中全会公报发表,1968-11-04,1968-11
《中国共产党第八届扩大的第十二次中央委员会全会公报》用五种少数民族文字翻译出版,1968-11-04,1968-11
“俄国佬滚回去！”“我们赶走了希特勒，我们也一定赶走勃列日涅夫！”捷人民大示威反对苏修军事占领,1968-11-04,1968-11
“泰国人民之声”电台指出泰国革命形势大好泰人民武装斗争浪潮猛烈冲击美泰反动统治,1968-11-04,1968-11
毛里塔尼亚《人民报》赞扬中国革命和建设取得伟大成就强大的新中国朝气蓬勃充满信心中国文化大革命的胜利是对各国革命人民的巨大支持,1968-11-04,1968-11
卡鲁姆副总统接见我回国的技术人员表示感谢中国人民给坦桑富有成果的支援,1968-11-04,1968-11
美国华盛顿黑人又奋起抗暴示威黑人同反动警察展开激烈搏斗,1968-11-04,1968-11
庆祝阿尔及利亚革命十四周年阿尔及尔举行群众游行和军事检阅,1968-11-04,1968-11
柬抗议美国—南越侵略罪行,1968-11-04,1968-11
佐藤反动政府复活军国主义决定用美制飞机武装航空“自卫队”,1968-11-04,1968-11
加紧控制印度尼西亚  妄图镇压亚洲人民革命运动美帝在印尼建立军事基地,1968-11-04,1968-11
竟冒天下之大不韪  步德日法西斯后尘美帝加紧制造灭绝人性的化学细菌武器,1968-11-04,1968-11
工人阶级永远是航空工业的主人——彻底批判叛徒刘少奇推行“专家治厂”的滔天罪行,1968-11-04,1968-11
“专家治所”就是资产阶级专政,1968-11-04,1968-11
斥“专家治厂”的修正主义谬论,1968-11-04,1968-11
工人阶级有无限创造力,1968-11-04,1968-11
北京城区天气预报,1968-11-04,1968-11
毛主席语录,1968-11-05,1968-11
毛主席最新指示,1968-11-05,1968-11
全国军民在党的十二中全会公报的鼓舞下意气风发斗志昂扬紧跟伟大领袖毛主席的伟大战略部署夺取无产阶级文化大革命的全面胜利,1968-11-05,1968-11
发扬“一月革命”精神  认真搞好斗批改,1968-11-05,1968-11
彻底清算头号大工贼刘少奇的滔天罪行,1968-11-05,1968-11
牢牢掌握印把子,1968-11-05,1968-11
用“不到长城非好汉”的精神夺取新胜利,1968-11-05,1968-11
响应全会号召，百倍提高革命警惕,1968-11-05,1968-11
毛泽东思想照亮前进的道路,1968-11-05,1968-11
我国人民政治生活中的伟大事件,1968-11-05,1968-11
紧跟毛主席搞好斗批改,1968-11-05,1968-11
大灭了阶级敌人的威风,1968-11-05,1968-11
沿着全会指引的方向胜利前进,1968-11-05,1968-11
毛泽东思想的伟大胜利——安源、武汉、桃园、天华的工人、贫下中农热烈拥护党的十二中全会把叛徒、内奸、工贼刘少奇永远开除出党,1968-11-05,1968-11
无限忠于伟大统帅毛主席随时准备歼灭敢于来犯之敌——反帝反修前哨战士热烈欢呼公报发表,1968-11-05,1968-11
胡志明主席十一月三日的号召书,1968-11-05,1968-11
越南南方民族解放阵线中央关于越南南方问题政治解决的声明,1968-11-05,1968-11
阿联击落入侵的以色列飞机一架,1968-11-05,1968-11
反对以色列的野蛮侵略  支持巴勒斯坦人民正义斗争阿拉伯各国人民掀起大规模反美示威各国示威群众强调武装斗争是解放巴勒斯坦的唯一途径,1968-11-05,1968-11
北加里曼丹《解放报》欢呼我国十九年来的伟大成就和文化大革命的伟大胜利北加里曼丹人民要走中国人民的道路,1968-11-05,1968-11
巴基斯坦外长侯赛因称赞巴中友谊同中国建立友好关系符合巴民族利益,1968-11-05,1968-11
前往赞比亚参加帮助修建坦—赞铁路我勘测设计小组途经坦桑尼亚受到欢迎,1968-11-05,1968-11
北京城区天气预报,1968-11-05,1968-11
毛主席派来了好医生——马里人民赞扬中国医疗队,1968-11-05,1968-11
怀着无限忠于毛主席的深厚无产阶级感情掀起学习宣传党的十二中全会公报的热潮,1968-11-06,1968-11
踊跃交售征购粮,1968-11-06,1968-11
冒雨送公报,1968-11-06,1968-11
收音机旁的批判会,1968-11-06,1968-11
毛主席语录,1968-11-06,1968-11
响应全会号召深入展开革命大批判,1968-11-06,1968-11
狠抓阶级斗争不转向,1968-11-06,1968-11
毛主席领导我们不断前进,1968-11-06,1968-11
公报说出俺贫下中农心里话,1968-11-06,1968-11
坚决肃清刘少奇反革命修正主义思想,1968-11-06,1968-11
敬爱的毛主席，我们永远心向您！——边疆各族人民热烈欢呼党的十二中全会公报发表,1968-11-06,1968-11
港澳爱国同胞怀着无比兴奋的心情举行集会热烈欢呼党的八届十二中全会公报发表决心夺取反英抗暴斗争的最后胜利,1968-11-06,1968-11
历史的辩证法,1968-11-06,1968-11
紧跟毛主席就是胜利  （对口剧）,1968-11-06,1968-11
巨浪滚滚  凯歌阵阵,1968-11-06,1968-11
手捧公报心潮涌,1968-11-06,1968-11
喜讯传到红旗庄（山东快书）,1968-11-06,1968-11
曲谱,1968-11-06,1968-11
阿机械工业发展显著,1968-11-06,1968-11
鼓足革命干劲  争取大好收成阿全国农村加紧秋收秋播工作玉米收获工作已完成百分之五十七,1968-11-06,1968-11
反对美帝侵略政策  反对法西斯统治资本主义各国人民不断展开反美、反独裁斗争,1968-11-06,1968-11
庆祝中马建交八周年和中马友好条约签订四周年我驻马里临时代办举行酒会,1968-11-06,1968-11
董必武副主席接受捷新任大使国书,1968-11-06,1968-11
美国财政经济情况恶化,1968-11-06,1968-11
美国学生占领学校大楼抗议总统选举丑剧华盛顿四百多士兵、退伍军人示威反对约翰逊政府侵略越南,1968-11-06,1968-11
人民意志坚  沼泽变良田阿尔巴尼亚大规模进行排干沼泽的水利工程,1968-11-06,1968-11
报眼口号,1968-11-06,1968-11
阿《青年之声报》揭露苏修把苏共青团变为复辟资本主义工具谴责苏修毒害青年破坏世界青年革命运动,1968-11-06,1968-11
背叛十月革命、背叛社会主义、在农业领域全面复辟资本主义的又一罪证  苏修叛徒集团公然推行土地自由经营,1968-11-06,1968-11
苏修叛徒集团是印尼革命人民不共戴天的死敌,1968-11-06,1968-11
北京城区天气预报,1968-11-06,1968-11
紧跟伟大领袖毛主席奋勇前进！沈阳工人阶级认真学习宣传党的十二中全会公报坚决执行全会提出的战斗任务掀起斗批改新高潮,1968-11-07,1968-11
在党的八届十二中全会公报的鼓舞下,1968-11-07,1968-11
毛主席语录,1968-11-07,1968-11
湖南省各级革命委员会成员深入基层深入群众带头学习、宣传和贯彻全会公报,1968-11-07,1968-11
坚决执行党的十二中全会提出的战斗任务北京新华印刷厂革命职工，在全会公报的鼓舞下，雷厉风行，制订措施，迅速行动，掀起斗批改新高潮，生产搞得更加出色,1968-11-07,1968-11
在全会公报的光辉照耀下前进,1968-11-07,1968-11
时刻不忘无产阶级专政,1968-11-07,1968-11
狠抓两条教育路线的斗争不转向——湖北谷城县红旗公社贫下中农管理学校的经验（调查报告）,1968-11-07,1968-11
贫下中农管理学校要管好四件大事,1968-11-07,1968-11
张家口七一化学纤维纺织厂建成投产,1968-11-07,1968-11
上海郊区各县提前完成棉花收购计划,1968-11-07,1968-11
延安无线电厂工人的怒火,1968-11-07,1968-11
“争气炉”旁摆战场  痛批叛徒刘少奇——记杨树浦发电厂革命职工的一次工地现场批判会,1968-11-07,1968-11
彻底肃清刘少奇反革命修正主义思想,1968-11-07,1968-11
把“阶级斗争熄灭论”彻底批臭,1968-11-07,1968-11
瑞典马列主义者共产主义联盟电贺中国共产党八届十二中全会的成功中国人民的胜利也是世界无产阶级的胜利欢呼中国共产党和中国人民把大叛徒刘少奇扫进了历史垃圾堆,1968-11-07,1968-11
阿尔巴尼亚劳动党党史将出版霍查同志接见工人和编辑人员,1968-11-07,1968-11
主动出击消灭敌人有生力量  积极开展宣传和组织群众的工作泰国人民武装在斗争中发展壮大,1968-11-07,1968-11
西南非武装斗争传捷报民族主义战士袭击敌人基地，打死殖民军二十人，炸毁军车五辆,1968-11-07,1968-11
巴勒斯坦游击队十月份取得新胜利向以色列侵略军发动了一百四十次袭击，歼灭敌人八百多名,1968-11-07,1968-11
南也门抗议英国飞机侵犯领空,1968-11-07,1968-11
美国人民的新觉醒十几个城市学生大示威反对总统“选举”骗局,1968-11-07,1968-11
报眼口号,1968-11-07,1968-11
在国内全面复辟资本主义  在国外疯狂推行社会帝国主义苏修叛徒倒行逆施促进苏联人民新觉醒,1968-11-07,1968-11
以欧美资本主义国家经济体制为样板  加紧剥削和奴役苏联人民苏修叛徒集团对经济实行资本主义大改组,1968-11-07,1968-11
北京城区天气预报,1968-11-07,1968-11
首都工人宣传队怀着无限忠于伟大领袖毛主席的深厚无产阶级感情认真学习和热情宣传党的十二中全会公报响应全会的号召坚决搞好上层建筑斗批改,1968-11-08,1968-11
天津工人阶级以高昂的革命热情坚决落实公报提出的战斗任务,1968-11-08,1968-11
万里东风传喜报  大庆处处红旗飘,1968-11-08,1968-11
毛主席语录,1968-11-08,1968-11
九户贫农坚持办学十八年（调查报告）,1968-11-08,1968-11
珠海县商业系统革命职工狠批刘少奇推行的修正主义商业管理路线建立起一个面向工农兵的商业服务站,1968-11-08,1968-11
为贫下中农子女大开校门,1968-11-08,1968-11
大办落实公报的学习班柳河“五·七”干校学员掀起学习公报、宣传公报、落实公报的运动，决心把“五·七”干校办得更好,1968-11-08,1968-11
沿着毛主席指引的革命航道奋勇前进北京卫戍区某部三连指战员决心全面落实十二中全会公报提出的各项战斗号令，紧握手中枪，永远做无限忠于毛主席的好战士,1968-11-08,1968-11
公报照亮了饲养员的心,1968-11-08,1968-11
用实际行动响应十二中全会公报提出的战斗号召贵阳发电厂提前完成发电机组大修任务,1968-11-08,1968-11
狠批“读书做官”论,1968-11-08,1968-11
肃清反革命修正主义教育路线的流毒,1968-11-08,1968-11
戳穿“三特殊”分配路线的反动本质,1968-11-08,1968-11
用实际行动粉碎“读书做官”论,1968-11-08,1968-11
永远做普通劳动者,1968-11-08,1968-11
澳共（马列）主席希尔同志热情赞扬中国共产党八届十二中全会的成功毛主席无产阶级革命路线的重大胜利向前发展的社会主义制度在生气勃勃地走向胜利,1968-11-08,1968-11
意共（马列）中央热烈祝贺中共八届十二中全会成功中国人民的胜利是对世界革命人民的强有力支持,1968-11-08,1968-11
顶天立地的英雄人民,1968-11-08,1968-11
庆祝十月革命节和阿劳动党成立二十七周年阿各地纷纷举行庆祝活动,1968-11-08,1968-11
坚持自力更生方针和蓬勃开展科技革命的硕果地拉那先进技术展览馆落成,1968-11-08,1968-11
报眼口号,1968-11-08,1968-11
把苏修的御用工会揪出示众,1968-11-08,1968-11
尼泊尔人民谴责苏修背叛十月革命苏联人民定会把叛徒扔进历史垃圾堆,1968-11-08,1968-11
苏修“奖金”填满特权阶层腰包,1968-11-08,1968-11
北京城区天气预报,1968-11-08,1968-11
高举毛泽东思想伟大红旗开展革命大批判武汉第四棉纺织厂工人和驻厂解放军用铁的事实愤怒声讨刘少奇的滔天罪行,1968-11-09,1968-11
坚决响应党的八届十二中全会的伟大战斗号召江西省掀起声势浩大的革命大批判热潮,1968-11-09,1968-11
毛主席语录,1968-11-09,1968-11
报眼口号,1968-11-09,1968-11
山东各级革委会大办毛泽东思想学习班坚决执行全会提出的各项伟大战斗任务,1968-11-09,1968-11
上海中国钟厂革命职工坚决响应党的十二中全会的伟大号召以只争朝夕的精神掀起斗批改新高潮,1968-11-09,1968-11
天津红桥区革委会组织以工人为主体的毛泽东思想宣传队深入基层单位宣传党的十二中全会公报,1968-11-09,1968-11
落实公报必须充分发动群众木城涧煤矿革命委员会在驻矿解放军毛泽东思想宣传队帮助下，放手发动群众，斗批改搞得轰轰烈烈,1968-11-09,1968-11
决不容许大工贼刘少奇颠倒历史,1968-11-09,1968-11
彻底肃清刘少奇的反革命修正主义思想,1968-11-09,1968-11
军民共讨叛徒刘少奇——记四五六二部队农场指战员和四渡河大队贫下中农的一次批判会,1968-11-09,1968-11
甲板上的战斗——记“海上猛虎艇”战斗航行中的革命大批判会,1968-11-09,1968-11
心中升起红太阳  完全彻底为人民——记甘肃临夏县活学活用毛主席著作积极分子、“赤脚医生”郑有禄,1968-11-09,1968-11
让知识青年在工农中“开花结果”,1968-11-09,1968-11
全世界各国真正的革命者高举着伟大十月的旗帜、列宁和斯大林的旗帜  阿《人民之声报》发表社论庆祝十月革命五十一周年和阿劳动党成立二十七周年,1968-11-09,1968-11
《阿尔巴尼亚劳动党党史》在阿出版,1968-11-09,1968-11
不畏捷修镇压  蔑视苏修威胁捷人民再次示威反对苏修军事占领,1968-11-09,1968-11
列宁的故乡必将重见光明,1968-11-09,1968-11
劳动党和霍查同志的教导激励工人农民冲天革命干劲阿工农业劳动竞赛取得良好成绩,1968-11-09,1968-11
北京城区天气预报,1968-11-09,1968-11
非洲朋友热烈欢呼中国人民的辉煌胜利中共八届十二中全会具有伟大历史意义,1968-11-09,1968-11
牙买加青年刊物欢呼我国文化大革命伟大胜利文化大革命把中国人民锻炼成铜墙铁壁,1968-11-09,1968-11
美国广大人民反对和抵制总统“选举”丑剧各地示威群众指出所有美国总统候选人都是一丘之貉,1968-11-09,1968-11
美帝上演总统“选举”丑剧尼克松将任下届美国总统,1968-11-09,1968-11
应我人民解放军总参谋长黄永胜邀请来我国进行友好访问巴基斯坦武装部队友好代表团抵京黄永胜总参谋长设宴热烈欢迎客人,1968-11-09,1968-11
上海一百二十万工人在十二中全会公报鼓舞下革命精神更加振奋广泛深入地开展学习落实公报的群众运动决心搞好斗批改夺取文化大革命全面胜利,1968-11-10,1968-11
广东数百万贫下中农组成毛泽东思想宣传队最迅速地把毛主席的声音传给广大革命群众,1968-11-10,1968-11
湖北城乡大办学习班贯彻十二中全会公报边学习边运用有力地推动斗批改深入发展,1968-11-10,1968-11
毛主席语录,1968-11-10,1968-11
工人阶级领导大批判显示巨大威力,1968-11-10,1968-11
我们是历史的见证人——九位老工人愤怒控诉叛徒、内奸、工贼刘少奇一九二七年在武汉叛变革命，出卖工人运动，投降敌人的滔天罪行,1968-11-10,1968-11
宁夏吴忠县波浪渠大队贫下中农发扬“不到长城非好汉”的彻底革命精神认真总结经验深入开展大批判,1968-11-10,1968-11
把刘少奇的叛徒哲学扫进历史垃圾堆,1968-11-10,1968-11
报眼口号,1968-11-10,1968-11
这样的农中就是好甘肃省临泽县蓼泉农业中学调查报告,1968-11-10,1968-11
用实际行动响应公报发出的战斗号召贵阳地区一批提前完成生产计划的厂矿乘胜前进掀起抓革命促生产新高潮湖南橡胶厂边学习公报边总结工作边落实任务有力推动斗批改和生产发展,1968-11-10,1968-11
在毛主席“必须把棉花抓紧”的伟大号召下河北棉花丰收广大贫下中农踊跃交售新棉福建海带紫菜人工养殖事业迅速发展,1968-11-10,1968-11
为工农兵服务一辈子 向工农兵学习一辈子,1968-11-10,1968-11
工农兵不需要的就破  工农兵需要的就立,1968-11-10,1968-11
日本“毛泽东思想研究会”欢呼中共八届十二中全会公报发表公报具有不可估量的历史意义号召日本革命人民以毛泽东思想作武器进一步批判宫本集团,1968-11-10,1968-11
非洲民族主义战士欢呼我国文化大革命取得决定性胜利十二中全会公报极大地鼓舞了非洲革命人民,1968-11-10,1968-11
英国进步人士等欢呼中共八届十二中全会取得成功开除刘少奇出党是世界革命人民的伟大胜利在天津港的外国海员听到公报热情欢呼“毛主席万岁！”,1968-11-10,1968-11
尼泊尔锡兰朋友赞扬我十二中全会公报是伟大的革命文献中国文化大革命鼓舞了世界人民反美斗争,1968-11-10,1968-11
柬驻华大使举行国庆招待会周总理谢副总理等应邀出席中柬友协举行招待会庆祝柬埔寨国庆,1968-11-10,1968-11
地拉那大学代表团离京回国,1968-11-10,1968-11
欢迎巴基斯坦武装部队友好代表团我国防部举行文艺晚会,1968-11-10,1968-11
印度向巴基斯坦进行侵略挑衅东巴政府向印方提出抗议,1968-11-10,1968-11
北京城区天气预报,1968-11-10,1968-11
秘共中央发表文章谴责苏修侵捷的野蛮罪行苏修叛徒集团的日子不会长久,1968-11-10,1968-11
阿《团结报》揭露苏修镇压马来亚人民斗争的罪恶行径苏修美帝都是人民的死敌,1968-11-10,1968-11
玻利维亚共产党发表声明强烈谴责苏修集团侵捷的罪行坚信修正主义统治下的人民只要高举马列主义旗帜定能扫除帝修反,1968-11-10,1968-11
苏修是骑在东欧人民头上的新沙皇,1968-11-10,1968-11
看苏修怎样通过“经互会”对东欧人民进行掠夺和剥削！,1968-11-10,1968-11
北京二七机车车辆厂革命职工在八三四一部队支左人员帮助下以高昂的革命精神落实全会提出的任务深入开展革命大批判认真清理阶级队伍,1968-11-11,1968-11
毛主席语录,1968-11-11,1968-11
