拉赫曼傀儡集团疯狂逮捕爱国者反动派的迫害只能促进人民革命马来亚各界人民谴责拉赫曼集团的法西斯暴行,1968-11-18,1968-11
北京城区天气预报,1968-11-18,1968-11
四好连队运动的光辉成果,1968-11-19,1968-11
毛主席语录,1968-11-19,1968-11
无限忠于伟大领袖毛主席  无限忠于人民“爱民模范连”命名大会在广州隆重举行,1968-11-19,1968-11
什么样的教师教出什么样的学生,1968-11-19,1968-11
建议代表了革命师生的要求,1968-11-19,1968-11
建立一支革命化的教师队伍,1968-11-19,1968-11
优越性已经显示出来了,1968-11-19,1968-11
这是教师走什么路的大问题,1968-11-19,1968-11
要做好公办小学教师的思想工作,1968-11-19,1968-11
关于教师调配问题的建议,1968-11-19,1968-11
这个问题可以讨论,1968-11-19,1968-11
忠于毛主席的战士最热爱人民——记人民解放军广州部队某部“爱民模范连”,1968-11-19,1968-11
在党的八届十二中全会公报的鼓舞下,1968-11-19,1968-11
毛泽东思想是工人阶级的命根子,1968-11-19,1968-11
贫下中农无限热爱伟大领袖毛主席福建光泽县城关公社贫下中农联系两年来文化大革命的战斗历程，热烈赞颂毛泽东思想的无比威力，更加爱读毛主席的书,1968-11-19,1968-11
在家庭学习班里,1968-11-19,1968-11
百万翻身农奴掌握毛泽东思想的新时代——毛泽东思想在西藏地区空前大普及，毛泽东思想的灿烂阳光普照万里高原,1968-11-19,1968-11
牙买加“争取民族解放青年力量”欢呼中共十二中全会的伟大意义中国文化大革命正朝着全面胜利的方向前进,1968-11-19,1968-11
尼泊尔朋友盛赞钢琴伴唱《红灯记》毛主席无产阶级革命文艺路线的胜利《红灯记》表现了革命人民的英雄气概,1968-11-19,1968-11
贝专纳人民党和巴苏陀兰大会党热情赞扬我文化大革命取得决定性胜利中国社会主义制度进一步巩固,1968-11-19,1968-11
巴武装部队友好代表团离广州回国客人们盛赞中国人民在政治、经济和军事等方面取得巨大成就,1968-11-19,1968-11
全心全意为非洲人民服务——记中国医疗队在毛里塔尼亚的动人事迹,1968-11-19,1968-11
北京城区天气预报,1968-11-19,1968-11
决不让美帝统治亚洲决不让日本军国主义东山再起日本人民斗志昂扬进行反美斗争神户市一千青年工人和学生集会反对美军当局把神户港变为军港,1968-11-19,1968-11
西欧拉丁美洲工人学生斗争蓬勃向前意大利学生反对腐朽资产阶级教育制度的斗争一浪高一浪,1968-11-19,1968-11
人民革命运动烈火是扑灭不了的阿《战士报》欢呼欧洲拉美工人学生运动新高涨,1968-11-19,1968-11
玻利维亚橡胶园里的饥饿和奴役,1968-11-19,1968-11
丧失土地  深受剥削  流落异乡意大利农民处境悲惨,1968-11-19,1968-11
秘鲁有八百万人处于奴隶状态,1968-11-19,1968-11
印奥里萨邦“可怕的贫困状况”,1968-11-19,1968-11
在垄断资本和封建制度压榨和摧残下阿根廷劳动人民健康情况恶化,1968-11-19,1968-11
工人阶级占领科学技术领域后显示无穷的智慧和创造才能北京工业战线技术革新技术革命蓬勃开展,1968-11-20,1968-11
毛泽东思想武装的工人能够创造奇迹从北京摩托车制造厂的生产飞跃看工业生产新形势（调查报告）,1968-11-20,1968-11
毛主席语录,1968-11-20,1968-11
沿着毛主席的革命路线办学十年——记山东五莲县李崮寨庄户小学老师刘太臻,1968-11-20,1968-11
埔上公社水尾片的林业工人和贫下中农联合起来管理小学群众办学的积极性空前高涨,1968-11-20,1968-11
贫下中农的好后代,1968-11-20,1968-11
老贫农讲的课真带劲儿,1968-11-20,1968-11
李荣桂又穿上了“防修衣”,1968-11-20,1968-11
甘肃冶金公司工人以彻底革命精神落实十二中全会提出的战斗任务密切结合实际深入展开革命大批判,1968-11-20,1968-11
报眼口号,1968-11-20,1968-11
狠批叛徒刘少奇“阶级斗争熄灭论”等反革命修正主义谬论江岸车辆厂清理阶级队伍工作向纵深发展,1968-11-20,1968-11
在伟大祖国的坚决支持和香港爱国同胞的不断斗争下新华社香港分社记者薛平胜利出狱,1968-11-20,1968-11
报眼口号,1968-11-20,1968-11
大工贼刘少奇是工人阶级的死敌彻底清算叛徒、内奸、工贼刘少奇的滔天罪行,1968-11-20,1968-11
澳共（马列）机关报《先锋报》发表文章号召革命者努力学习马列主义、毛泽东思想强调把毛泽东思想运用于澳大利亚斗争实践推进革命运动,1968-11-20,1968-11
锡兰共产党《红旗》周刊欢呼中共十二中全会公报标志着中国的无产阶级专政得到捍卫和巩固妄图在中国复辟资本主义的以刘少奇为首的修正主义反动势力彻底失败,1968-11-20,1968-11
日本朋友欢呼中国人民彻底摧毁以刘少奇为首的资产阶级司令部马列主义定要战胜修正主义,1968-11-20,1968-11
英雄的巴勒斯坦战士穆尼尔,1968-11-20,1968-11
“泰国人民之声”指出泰共领导的人民武装斗争的烽火越烧越旺泰国人民坚决走革命武装斗争的道路,1968-11-20,1968-11
炮轰敌人阵地  摧毁敌人营房几内亚（比绍）爱国武装继续袭击葡殖民军,1968-11-20,1968-11
叙国家元首表示支持巴勒斯坦突击队的武装斗争谴责以色列威胁阿拉伯国家,1968-11-20,1968-11
阿《团结报》揭露苏修在尼克松当选美国总统后加紧同美帝勾搭苏修是世界人民的敌人阿尔巴尼亚报纸指出尼克松同他的前任一样是美国垄断资本集团的忠实走狗,1968-11-20,1968-11
不准美帝蹂躏日本土地  要求美军归还演习场北富士山麓农民举行奋起大会新西兰海员采取行动反对侵越美军到新西兰“度假”,1968-11-20,1968-11
美帝又欠下日本人民一笔血债驻冲绳美Ｂ—５２飞机起飞时爆炸伤五名居民毁民房一百多间日本人民满怀对美帝新仇旧恨愤怒谴责美军暴行,1968-11-20,1968-11
侵略集团奄奄一息  西方“盟国”矛盾重重北大西洋集团进一步分崩离析,1968-11-20,1968-11
资本主义金融危机进一步发展新信号西欧美国抢购黄金风潮再起,1968-11-20,1968-11
北京城区天气预报,1968-11-20,1968-11
毛主席语录,1968-11-21,1968-11
毛泽东思想武装起来的人是无敌的——记英雄的大寨人战胜特大雹灾夺得丰收的斗争,1968-11-21,1968-11
在斗争中活学活用毛泽东思想大灾也能夺得大丰收,1968-11-21,1968-11
贫下中农登上农业科学技术研究工作舞台培育和推广杂交高粱取得新成就,1968-11-21,1968-11
黑龙江省一批厂矿提前完成全年生产计划,1968-11-21,1968-11
在大破修正主义教育路线中建立一支革命化的教师队伍,1968-11-21,1968-11
这样的学校才能教出好孩子,1968-11-21,1968-11
教师必须彻底改变旧思想,1968-11-21,1968-11
大队办学最合咱贫下中农心意,1968-11-21,1968-11
要由贫下中农给他们以再教育,1968-11-21,1968-11
挖掉反动“小宝塔”的基础,1968-11-21,1968-11
要权不要钱,1968-11-21,1968-11
“毛主席的好战士雷锋纪念馆”建成,1968-11-21,1968-11
大庆油田传捷报,1968-11-21,1968-11
毛主席派来的“金珠玛米”和藏胞心连心,1968-11-21,1968-11
毛泽东思想的伟大胜利  工人阶级领导一切的巨大成果我国万吨级远洋巨轮“高阳号”胜利下水,1968-11-21,1968-11
报眼口号,1968-11-21,1968-11
贫下中农一定要掌握文权,1968-11-21,1968-11
两种学校培养两种接班人,1968-11-21,1968-11
彻底批判刘少奇“分数挂帅”的反动实质,1968-11-21,1968-11
民办学校就是好,1968-11-21,1968-11
北京城区天气预报,1968-11-21,1968-11
几内亚朋友等欢呼中共十二中全会具有伟大历史意义毛泽东思想是被压迫人民的强大思想武器,1968-11-21,1968-11
南也门朋友热情欢呼中共八届十二中全会的光辉成就文化大革命的伟大胜利对世界革命有深远意义,1968-11-21,1968-11
“Ｂ—５２滚出去！”“美国佬滚出去！”“撤除美军基地！”冲绳八千多群众集会愤怒声讨美帝新暴行侵越美军到新西兰“度假”新西兰示威群众高呼：“美国佬滚出亚洲！”,1968-11-21,1968-11
蔑视当局不准示威的禁令  为争取民主权利而英勇斗争北爱尔兰人民连日进行示威示威群众不畏强暴用啤酒瓶痛击前来镇压的警察,1968-11-21,1968-11
我援阿尔及利亚修建的展览馆举行奠基仪式,1968-11-21,1968-11
坦桑农业合作部副部长离京,1968-11-21,1968-11
以实际行动响应劳动党关于增加农业生产的号召阿拖拉机站工人提前完成今年生产计划阿沃德耶水电站工人鼓足干劲日夜施工力争把巨大工程提前完工,1968-11-21,1968-11
在贯彻执行党的八届十二中全会公报提出的伟大战斗任务中辽宁城乡掀起活学活用毛泽东思想新高潮,1968-11-22,1968-11
陈伯达康生同志同希尔同志举行会谈希尔同志参观北京新华印刷厂受到热烈欢迎,1968-11-22,1968-11
热烈颂扬伟大领袖毛主席的英明领导,1968-11-22,1968-11
毛主席语录,1968-11-22,1968-11
以公报为武器，矛头对准叛徒刘少奇等最大一小撮走资派天津大学革命师生狠批“阶级斗争熄灭论”,1968-11-22,1968-11
丹东丝绸一厂革委会对照公报检查工作狠批修正主义政权建设路线坚决贯彻执行精兵简政原则,1968-11-22,1968-11
成都部队某部侦察连克服“批判到顶”思想把革命大批判步步引向深入,1968-11-22,1968-11
报眼口号,1968-11-22,1968-11
坚决贯彻执行伟大领袖毛主席“农业学大寨”的光辉指示昔阳县开展学大寨运动取得重大成绩和丰富经验,1968-11-22,1968-11
为无产阶级政治服务  为工农兵服务  为工农业生产服务广州百货商店树立崭新的经营思想和经营作风,1968-11-22,1968-11
认真接受贫下中农再教育  加速自己思想革命化江西一批下放人员在农村发挥积极作用,1968-11-22,1968-11
真工贼  假“领袖”,1968-11-22,1968-11
剥开“工运领袖”的画皮,1968-11-22,1968-11
刘少奇从来就是我们工人的死敌,1968-11-22,1968-11
刘少奇是帝国主义、国民党反动派的走狗,1968-11-22,1968-11
《毛泽东著作选读（甲种本）》意大利文版在意大利出版,1968-11-22,1968-11
古巴和拉美朋友热烈赞扬钢琴伴唱《红灯记》中国革命文艺在文化大革命中取得惊人成就钢琴伴唱《红灯记》演出成功是钢琴音乐中的革命,1968-11-22,1968-11
美帝在联合国推行反华政策极其不得人心阿尔巴尼亚等国要求恢复中国在联合国的合法权利的提案反映世界广大人民热切愿望,1968-11-22,1968-11
全心全意为世界人民服务——记建设加德满都——博克拉公路的中国工程技术人员,1968-11-22,1968-11
北京城区天气预报,1968-11-22,1968-11
老挝爱国战线党召开第三次（特别）全国代表大会苏发努冯亲王在会上作了关于老挝局势、老挝人民爱国斗争的伟大胜利和今后的紧急任务的政治报告,1968-11-22,1968-11
反对充当侵越炮灰  高喊打倒美帝口号  怒捣美国侵略机构拉美学生运动高涨矛头直指美帝害人虫各国青年学生展开反美示威同时对本国反动政府镇压政策进行坚决斗争,1968-11-22,1968-11
美国前国防部长麦克纳马拉偷偷摸摸钻进印度活动加尔各答群众大示威喝令刽子手滚蛋示威群众焚毁电车，同反动警察搏斗三小时,1968-11-22,1968-11
袭击敌人机场  摧毁敌军营房  粉碎敌人“扫荡”老挝爱国军民最近又获新战果,1968-11-22,1968-11
马来亚人民必将向反动派讨还血债马来亚（包括新加坡）一些政党团体强烈抗议傀儡集团迫害爱国志士,1968-11-22,1968-11
印尼法西斯政权大卖国,1968-11-22,1968-11
决心把反对腐朽教育制度的斗争进行到底日本东京大学学生坚持罢课二百五十多天学生代表怒斥宫本修正主义集团充当反动政府帮凶破坏学生斗争,1968-11-22,1968-11
英国大学师生示威要求民主权利,1968-11-22,1968-11
阿尔巴尼亚政府经济代表团访问中国的新闻公报,1968-11-23,1968-11
中阿经济贸易协定在京签字周恩来总理参加了签字仪式李先念副总理和查尔查尼团长在协定和议定书上签字,1968-11-23,1968-11
阿政府经济代表团离京回国首都二千多革命群众到机场热烈欢送,1968-11-23,1968-11
湖南财贸学院革委会在工人宣传队帮助下狠抓根本积极领导师生活学活用毛泽东思想,1968-11-23,1968-11
毛主席语录,1968-11-23,1968-11
贫下中农给我的待遇远远超过我所做的成绩,1968-11-23,1968-11
当民办教师和公办教师的不同感受,1968-11-23,1968-11
“敢”字当头，砸烂资产阶级“正规化”的框框,1968-11-23,1968-11
要永远按照贫下中农的心意办学,1968-11-23,1968-11
地位变了，感情也变了,1968-11-23,1968-11
选拔和留用教师应当结合,1968-11-23,1968-11
家在城市的农村教师到农村安家落户去,1968-11-23,1968-11
贫下中农真正负担不起教师的工分吗？,1968-11-23,1968-11
老贫农的新功勋——记天津小站地区西右营大队“革命老头批判说理队”,1968-11-23,1968-11
革委会如何以公报为纲推动斗批改？山东烟台地区各级革委会的经验是：第一把手带头，深入群众，发现典型，总结经验，热情支持新生事物，掀起斗批改新高潮,1968-11-23,1968-11
在公报鼓舞下掀起斗批改新高潮蚌埠铁路分局革命生产形势越来越好,1968-11-23,1968-11
在无产阶级文化大革命大好形势鼓舞下为祖国的社会主义建设事业贡献力量铁道兵部队战斗在南北各地加紧修建铁路,1968-11-23,1968-11
落实毛主席“备战、备荒、为人民”的伟大战略方针，促进生产发展  全国各地创造了解决马铃薯退化问题的先进经验,1968-11-23,1968-11
东台县贫下中农满怀无产阶级感情开展演唱活动大赞大颂伟大的毛泽东思想,1968-11-23,1968-11
五指山下的一个中医服务站,1968-11-23,1968-11
狠批刘少奇一伙反对文艺工作者与工农兵相结合的谬论,1968-11-23,1968-11
如此“下乡”法——斥刘少奇的一个谬论,1968-11-23,1968-11
坚决走与工农兵相结合的道路,1968-11-23,1968-11
反映三里塚农民反美斗争的影片鼓舞日本人民必须同美日反动派进行针锋相对的斗争,1968-11-23,1968-11
反对腐朽教育制度  抗议反动当局镇压  要求民主权利意大利进步学生运动汹涌澎湃向前发展,1968-11-23,1968-11
日本三里塚农民运动领导人谴责宫本集团的叛卖行径宫本集团破坏农民反美斗争犯下滔天罪行,1968-11-23,1968-11
加尔各答学生继续举行反美大示威战争贩子麦克纳马拉躲在邦长府里吓得不敢出门,1968-11-23,1968-11
阴谋制定新法案限制中国访日人员在日本的正常活动佐藤反动政府追随美帝苏修加紧反华激起了日本广大人民和日中友好贸易界的强烈愤慨,1968-11-23,1968-11
柬埔寨政府发表声明谴责美国对柬人民犯下新的侵略罪行,1968-11-23,1968-11
中国阿富汗友好协会举行酒会庆祝中国阿富汗边界条约签订五周年,1968-11-23,1968-11
西方抛售纸币抢购黄金风潮越刮越猛摇摇欲坠的资本主义世界货币体系再次濒临崩溃边缘,1968-11-23,1968-11
北京城区天气预报,1968-11-23,1968-11
阿尔巴尼亚驻华大使纳塔奈利举行招待会庆祝阿中两国建交十九周年谢富治副总理和有关方面负责人应邀出席了招待会,1968-11-24,1968-11
毛主席语录,1968-11-24,1968-11
齐齐哈尔车辆厂坚决落实毛主席“工人阶级必须领导一切”的伟大指示发挥工人阶级的创造智慧和领导才能组织工人检查组推动斗批改深入发展,1968-11-24,1968-11
在继续深入批判叛徒刘少奇的斗争中立新功,1968-11-24,1968-11
批透批臭大判徒刘少奇——山东桓台县田庄公社田庄大队“革命大批判讲用会”纪实,1968-11-24,1968-11
小成的“炮”声又响了,1968-11-24,1968-11
报眼口号,1968-11-24,1968-11
狠抓两条路线斗争  改革不合理的管理制度,1968-11-24,1968-11
报眼口号,1968-11-24,1968-11
完全必要  非常及时,1968-11-24,1968-11
防止资本主义复辟的万年大计,1968-11-24,1968-11
毛泽东思想照亮了小岛渔村,1968-11-24,1968-11
无产阶级文化大革命非搞不可,1968-11-24,1968-11
社会主义生产的伟大推动力,1968-11-24,1968-11
满载中国党、政府和人民的深情厚谊阿政府经济代表团回到地拉那在机场受到阿尔巴尼亚党政领导人极其热烈的欢迎,1968-11-24,1968-11
劳动党的国家工业化政策的伟大胜利阿尔巴尼亚工业迅猛发展今年头九个月的工业生产产值比一九六○年增加了百分之五十一,1968-11-24,1968-11
秘共中央热烈欢呼中国文化大革命取得伟大胜利中国已成为世界革命强大根据地,1968-11-24,1968-11
“法塔赫”发言人重申巴勒斯坦人民决不接受“政治解决”阴谋拿起枪杆子搞武装斗争是唯一出路巴勒斯坦人民决不向敌人屈膝投降，坚决战斗到最后胜利,1968-11-24,1968-11
马《阵线报》揭露苏修勾结傀儡集团出卖马来亚革命的罪行苏修叛徒集团是马来亚人民的死敌马来亚革命人民绝不宽怒苏修叛徒的背叛行径,1968-11-24,1968-11
爱国学生团结战斗把学生运动推向新高潮两万日本学生联合展开声势浩大示威学生斗争给美日反动派以有力打击，使宫本集团破坏阴谋彻底破产,1968-11-24,1968-11
罢课示威  占领校舍  武力抗暴美进步学生反对种族歧视斗争蓬勃发展拉美一些国家农民不断展开反对美国和本国大庄园主剥削的斗争,1968-11-24,1968-11
工人学生团结起来并肩战斗向垄断资本进攻意大利工人学生运动一浪高一浪,1968-11-24,1968-11
美国人民为什么挨饿？,1968-11-24,1968-11
千百万美国人民挣扎在死亡线上他们的每天饭食不超过一顿稀粥,1968-11-24,1968-11
垄断资本家追逐利润玩忽人命心如蛇蝎美一煤矿爆炸矿工惨遭不幸美国每天有八千多工人因事故死亡或残废,1968-11-24,1968-11
北京城区天气预报,1968-11-24,1968-11
在中国共产党第七届中央委员会第二次全体会议上的报告,1968-11-25,1968-11
毛主席语录,1968-11-25,1968-11
认真学习两条路线斗争的历史,1968-11-25,1968-11
广西活学活用毛泽东思想的伟大群众运动日益发展,1968-11-25,1968-11
毛主席革命路线的胜利凯歌,1968-11-25,1968-11
把宣传毛泽东思想作为最重要战斗任务崇礼县新华书店革命职工，既当毛主席著作的发行员，又当毛泽东思想的宣传员，成为活跃在山区的一支红色尖兵,1968-11-25,1968-11
红太阳照亮了西马村——西马村大队社员活学活用毛主席著作的故事,1968-11-25,1968-11
阿尔巴尼亚《人民之声报》发表社论热烈赞扬阿中友谊不断发展阿中友谊是真正的革命战斗友谊,1968-11-25,1968-11
我驻阿使馆举行招待会庆祝中阿建交十九周年李庭荃临时代办说阿人民是国际无产阶级和世界革命人民的坚强突击队纳赛外长热烈赞扬和高度评价中国无产阶级文化大革命取得的伟大胜利,1968-11-25,1968-11
在泰国共产党领导下运用人民战争战略战术泰国人民武装抓紧战机频繁出击不断获胜人民武装深入农村开展宣传和组织群众的活动大大提高农民群众觉悟,1968-11-25,1968-11
伊拉克报纸支持“法塔赫”关于坚持武装斗争声明人民战争是巴勒斯坦人民胜利的道路,1968-11-25,1968-11
在马来亚广大人民群众的坚决支持下马来亚爱国者绝食斗争取得胜利,1968-11-25,1968-11
反对腐朽的资产阶级教育制度  抗议反动当局的暴行意大利各地学生继续举行大示威一些城市的工人参加示威同学生并肩战斗,1968-11-25,1968-11
美帝又进行地下核试验,1968-11-25,1968-11
从“黄姓大厅”到“反修厅”,1968-11-25,1968-11
批修田,1968-11-25,1968-11
搞一辈子阶级斗争,1968-11-25,1968-11
砍倒刘少奇“组织社会生活”的黑旗,1968-11-25,1968-11
批臭“阶级斗争熄灭论”,1968-11-25,1968-11
北京城区天气预报,1968-11-25,1968-11
全国亿万军民认真学习伟大领袖毛主席的最新指示隆重庆祝重新发表毛主席的划时代光辉文献热烈欢呼毛主席无产阶级革命路线伟大胜利,1968-11-26,1968-11
毛主席语录,1968-11-26,1968-11
毛主席最新指示,1968-11-26,1968-11
为捍卫毛主席的革命路线而战斗,1968-11-26,1968-11
一辈子紧跟伟大领袖毛主席  一辈子捍卫毛主席革命路线,1968-11-26,1968-11
两条路线斗争要天天讲、月月讲、年年讲,1968-11-26,1968-11
越学对毛主席的革命路线越亲,1968-11-26,1968-11
英明的预见  伟大的纲领——沈阳部队几位战斗英雄重新学习毛主席《在中国共产党第七届中央委员会第二次全体会议上的报告》的体会,1968-11-26,1968-11
紧跟毛主席就是胜利,1968-11-26,1968-11
永远不要忘记政权,1968-11-26,1968-11
毛主席在党的七届二中全会上的报告是在无产阶级专政下继续革命的灯塔,1968-11-26,1968-11
毛泽东思想当了家,1968-11-26,1968-11
在劳动中重新学习  不断改造世界观,1968-11-26,1968-11
带好知识青年是贫下中农的光荣职责,1968-11-26,1968-11
紧跟毛主席的伟大战略部署主动向阶级敌人和各种自然灾害展开英勇斗争湖南今年粮食总产量是历史上最高一年,1968-11-26,1968-11
新华社香港分社和香港六家爱国报纸的负责人探视被港英当局非法拘禁的爱国新闻工作者,1968-11-26,1968-11
拉丁美洲朋友热烈祝贺中共八届十二中全会的成功欢呼全会公报具有伟大历史意义指出清除叛徒、内奸、工贼刘少奇表明中国文化大革命已取得决定性胜利,1968-11-26,1968-11
山鹰之国遍传建设捷报  英雄人民创造英雄业绩阿人民以优异成就迎接祖国光辉节日今年全国工业生产总值将比一九六七年增长百分之十七,1968-11-26,1968-11
日本《革命战士》揭露日修大搞议会道路的无耻嘴脸宫本集团是马列主义的叛徒日本人民定会把日修集团和美日反动派一起抛进历史垃圾箱,1968-11-26,1968-11
阿《团结报》谴责苏美勾结妄图主宰世界的罪恶行径美帝苏修是各国人民不共戴天的敌人帝国主义和修正主义结成镇压人民的反革命同盟只能表明它们的虚弱,1968-11-26,1968-11
日本工人学生同三里塚农民举行反美示威坚决把反对修建侵略机场的斗争进行到底,1968-11-26,1968-11
巴勒斯坦游击队又获重大战果十一月中旬进行战斗六十多次，歼敌四百多袭击了以色列军总部，击毁敌人军事学院等,1968-11-26,1968-11
北京城区天气预报,1968-11-26,1968-11
全国亿万军民学习毛主席的最新指示和在党的七届二中全会上的报告更深入地开展两条路线斗争史的学习运动紧跟伟大领袖毛主席完成斗批改伟大任务,1968-11-27,1968-11
《在中国共产党第七届中央委员会第二次全体会议上的报告》和《认真学习两条路线斗争的历史》出版单行本,1968-11-27,1968-11
毛主席语录,1968-11-27,1968-11
毛主席最新指示,1968-11-27,1968-11
毛主席革命路线在我们工人心中深深扎根,1968-11-27,1968-11
走毛主席的路就是胜利,1968-11-27,1968-11
毛主席的革命路线是我们的命根子,1968-11-27,1968-11
永远做捍卫毛主席革命路线的战斗队,1968-11-27,1968-11
认真学习伟大领袖毛主席在党的七届二中全会上的报告天津工人阶级提高两条路线斗争觉悟狠批刘少奇复辟资本主义的黑宣言书,1968-11-27,1968-11
革命战士誓把两条路线斗争进行到底,1968-11-27,1968-11
洪泾大队贫下中农带着对大叛徒刘少奇无比仇恨的心情联系本大队两条路线斗争的实际肃清刘少奇反革命修正主义思想,1968-11-27,1968-11
缅甸共产党中央委员会给中国共产党中央委员会的贺信热烈祝贺中共八届十二中全会的辉煌胜利,1968-11-27,1968-11
驻长春南关区口腔医院工人、解放军毛泽东思想宣传队带领医院革命群众认真依靠工农兵  开门进行斗批改,1968-11-27,1968-11
最大的战斗力是用毛泽东思想武装起来的人——记军医郑述言攻克颅脑手术关的先进事迹,1968-11-27,1968-11
就第一三五次中美大使级会谈会期问题我外交部新闻司发言人发表谈话,1968-11-27,1968-11
北京新华印刷厂广大革命职工举行集会热烈庆祝阿尔巴尼亚解放二十四周年,1968-11-27,1968-11
瑞典朋友在斯德哥尔摩举办讲座热情宣传中国文化大革命的伟大胜利,1968-11-27,1968-11
日本《长周新闻》指出日本成为美国在“远东的兵工厂”揭露美日反动派疯狂复活日本军国主义,1968-11-27,1968-11
美帝指挥印尼反动派修建侵略性军事工程由法西斯军人政权统治的印尼，已沦为美帝侵略亚洲的桥头堡,1968-11-27,1968-11
庆祝毛里塔尼亚独立八周年中非友协举行招待会,1968-11-27,1968-11
广大农业劳动者以辉煌成就欢庆祖国的伟大节日阿尔巴尼亚农村呈现朝气蓬勃的革命景象,1968-11-27,1968-11
