帝修反的走狗  社会主义的叛徒彻底清算刘少奇叛党叛国的滔天罪行——批判反动影片刘少奇《访问印度尼西亚》,1968-11-27,1968-11
人民空军不可侮,1968-11-27,1968-11
银幕内外,1968-11-27,1968-11
乌鸦的翅膀再黑  遮不住红太阳的光辉,1968-11-27,1968-11
北京城区天气预报,1968-11-27,1968-11
最热烈地祝贺阿尔巴尼亚解放二十四周年我们的伟大领袖毛主席和林副主席周总理致电阿人民伟大领袖霍查和列希谢胡同志,1968-11-28,1968-11
毛主席最新指示和在七届二中全会上的报告鼓舞了广大人民群众上海工人阶级认真学习两条路线斗争史,1968-11-28,1968-11
毛主席语录,1968-11-28,1968-11
彻底埋葬“阶级斗争熄灭论”,1968-11-28,1968-11
批臭复辟资本主义的“驯服工具论”,1968-11-28,1968-11
揭穿“党内和平论”的反动实质,1968-11-28,1968-11
自觉地捍卫毛主席的革命路线,1968-11-28,1968-11
力量的源泉  前进的灯塔  胜利的保证,1968-11-28,1968-11
两条路线斗争的历史永记心头,1968-11-28,1968-11
在毛主席革命路线指引下乘胜前进,1968-11-28,1968-11
泰国共产党中央委员会给中国共产党中央委员会贺信全力支持中共八届十二中全会公报,1968-11-28,1968-11
刚果（金）等非洲战士热烈欢呼毛主席支持刚果（金）人民的声明发表四周年毛主席的声明是反对美帝苏修的最强大思想武器,1968-11-28,1968-11
毛里塔尼亚驻华大使举行招待会热烈庆祝独立八周年宾主共祝两国人民友谊不断巩固发展李富春副总理等应邀出席  哈尔希大使和姬鹏飞副部长先后讲话,1968-11-28,1968-11
我对外友协和中阿友协庆祝阿解放二十四周年举行阿影片《广阔的地平线》首映招待会,1968-11-28,1968-11
中阿人民永远团结、战斗、胜利在一起中阿友好人民公社社员举行集会热烈庆祝阿尔巴尼亚人民光辉节日,1968-11-28,1968-11
中阿两国人民的革命友谊万古长青,1968-11-28,1968-11
社里的红花,1968-11-28,1968-11
坚持无产阶级专政和社会主义道路  遵循自力更生、独立自主方针阿尔巴尼亚社会主义建设成就辉煌,1968-11-28,1968-11
共产主义战士的颂歌——阿尔巴尼亚故事片《广阔的地平线》观后,1968-11-28,1968-11
我们的心是连在一起的,1968-11-28,1968-11
赞“别管我”,1968-11-28,1968-11
红日照边疆  草原新人多,1968-11-28,1968-11
北京城区天气预报,1968-11-28,1968-11
毛主席语录,1968-11-29,1968-11
伟大领袖毛主席会见希尔同志同希尔同志热烈握手，并进行了极为亲切的谈话周恩来、陈伯达、康生、姚文元同志参加会见,1968-11-29,1968-11
应阿党和政府邀请前往参加阿尔巴尼亚解放二十四周年庆祝活动中国党政军代表团满载深情厚谊抵地拉那,1968-11-29,1968-11
光荣的战斗的道路庆祝阿尔巴尼亚解放二十四周年,1968-11-29,1968-11
谢胡同志接见中国党政军代表团接见时，谢胡同志同黄永胜同志和代表团全体成员进行了极其亲切友好的谈话,1968-11-29,1968-11
我党政军代表团赴阿途中经罗,1968-11-29,1968-11
用伟大的毛泽东思想哺育革命后代驻韶山学校贫下中农毛泽东思想宣传队，组织革命师生认真学习毛主席的伟大革命实践，极大地提高了广大师生的阶级斗争和两条路线斗争觉悟,1968-11-29,1968-11
经过文化大革命的中国人民坚定不移地支持阿尔巴尼亚人民反帝反修斗争首都革命群众隆重集会热烈庆祝阿尔巴尼亚光辉节日,1968-11-29,1968-11
这项工作要结合革命大批判进行,1968-11-29,1968-11
毛主席啊，劳动人民今天开心了！,1968-11-29,1968-11
我们不要修正主义的“教学质量”——公办变民办会影响“教学质量”吗？,1968-11-29,1968-11
少数民族地区普及农村教育的极好措施,1968-11-29,1968-11
肃清刘少奇“读书做官论”的流毒,1968-11-29,1968-11
附设初中班的教师也应记工分,1968-11-29,1968-11
新西兰共产党政治委员会欢呼中共八届十二中全会伟大胜利中国坚定地沿着社会主义道路前进,1968-11-29,1968-11
刚果（布）朋友热烈欢呼毛主席支持刚果（金）人民的声明发表四周年毛主席的声明给革命人民以巨大的支持和鼓舞决心响应毛主席在声明中所发出的伟大号召更高地举起反帝反殖斗争红旗,1968-11-29,1968-11
印度喀拉拉邦革命人民拿起武器奋起造反连续袭击警察局和地主庄园使喀拉拉邦反动当局惊慌失措丹吉叛徒集团大肆污蔑和攻击人民群众的革命行动充分暴露其丑恶嘴脸,1968-11-29,1968-11
美一大学学生举行示威反对侵略战争旧金山学院黑人学生坚持罢课三周多,1968-11-29,1968-11
阿影片《广阔的地平线》在我各大城市陆续上映,1968-11-29,1968-11
南斯拉夫驻华大使馆临时代办举行国庆招待会,1968-11-29,1968-11
资本主义世界金融危机深重法郎英镑美元同时受到沉重打击，帝国主义各国乱作一团，更加分崩离析,1968-11-29,1968-11
阿教育和文化部举行积极分子会议讨论文化领域实行工人阶级监督问题部长会议主席谢胡同志出席会议，并讲了话,1968-11-29,1968-11
热烈祝贺阿尔巴尼亚人民的伟大节日,1968-11-29,1968-11
北京城区天气预报,1968-11-29,1968-11
山鹰展翅,1968-11-29,1968-11
阿驻华大使纳塔奈利举行盛大招待会热烈庆祝阿尔巴尼亚解放二十四周年,1968-11-30,1968-11
毛主席语录,1968-11-30,1968-11
认真学习党内两条路线斗争历史经验让毛主席革命路线家喻户晓深入人心广东省革委会在全省城乡狠抓两条路线斗争的教育推动各条战线斗批改,1968-11-30,1968-11
周总理在纳塔奈利大使举行的庆祝阿尔巴尼亚解放二十四周年招待会上讲话阿尔巴尼亚革命化运动已经显示巨大威力中阿两国人民将永远团结战斗胜利在一起,1968-11-30,1968-11
纳塔奈利大使在庆祝阿尔巴尼亚解放二十四周年招待会上讲话中国文化大革命沉重打击了苏美反革命联盟建立在马列主义基础上的阿中友谊牢不可破,1968-11-30,1968-11
阿《人民之声报》发表社论热烈欢迎我党政军代表团访问阿尔巴尼亚中阿人民革命团结千锤百炼万古长青,1968-11-30,1968-11
阿尔巴尼亚劳动党中央委员会等在地拉那举行隆重集会热烈庆祝阿尔巴尼亚人民的光辉节日阿尔巴尼亚人民伟大领袖霍查同志以及列希谢胡等同志出席了大会,1968-11-30,1968-11
锡共中央政治局发表声明热情赞扬毛泽东思想使十月社会主义革命的理想发扬光大,1968-11-30,1968-11
我党政军代表团参观阿民族解放斗争博物馆巴卢库、科列加、杜米和普里夫蒂等同志陪同黄永胜同志和代表团团员进行参观,1968-11-30,1968-11
认真落实十二中全会提出的各项战斗任务迎接工农业生产新跃进煤炭工业部召开全国煤矿掘进和坑木节约代用现场会议,1968-11-30,1968-11
一支宣传毛泽东思想的坚强队伍——广州市郊区石龙公社贫下中农毛泽东思想宣传队网的调查报告,1968-11-30,1968-11
最伟大的胜利,1968-11-30,1968-11
永葆工人阶级的本色——记北京无线电工业学校首都工人、解放军毛泽东思想宣传队指挥部负责人王畔东,1968-11-30,1968-11
刘少奇是复辟资本主义的罪魁祸首,1968-11-30,1968-11
从三户贫农办合作社看两条路线的斗争,1968-11-30,1968-11
把拿枪的和不拿枪的敌人统统打倒,1968-11-30,1968-11
社会主义道路我们走定了,1968-11-30,1968-11
北京城区天气预报,1968-11-30,1968-11
