秘鲁共产党中央委员会机关报《红旗报》发表文章盛赞我党“九大”是毛泽东思想的伟大胜利中国共产党和中国人民在无产阶级文化大革命中取得了非凡的胜利,1970-04-15,1970-04
美帝侵略和掠夺非洲的自供状,1970-04-15,1970-04
巴基斯坦总统叶海亚致电阿联总统纳赛尔谴责以色列飞机轰炸阿联小学的罪行利比亚外长指出美以的暴行只能加强阿拉伯人民击败侵略者的决心,1970-04-15,1970-04
为我国援坦桑人员李顺卿逝世坦桑政府和我驻坦桑大使馆举行追悼会,1970-04-15,1970-04
刚果《战斗报》痛斥美帝及其走狗劫走刚果人民的强盗行径美帝策划刚果反动政变暴露了凶恶本质,1970-04-15,1970-04
《阿尔及利亚现实》周刊揭露尼克松政府加紧对非洲进行渗透谴责美帝向非洲国家推销‘尼克松主义’,1970-04-15,1970-04
怀着对美以侵略者轰炸阿联小学的暴行的无比仇恨巴勒斯坦游击队猛袭以色列侵略军连日来不断向敌人发动进攻，歼灭一批敌军,1970-04-15,1970-04
越南祖国战线发表声明强烈谴责柬右派集团屠杀越侨越柬人民团结起来反对美帝及其走狗,1970-04-15,1970-04
越南击落美无人驾驶侦察机一架,1970-04-15,1970-04
柬人民加强斗争反对右派集团柴桢省一地区建立民族统一阵线临时委员会，数百青年参加爱国武装力量,1970-04-15,1970-04
越南南方共和外交部发表声明强烈抗议柬右派集团血腥屠杀越侨的罪行解放通讯社指出朗诺—施里玛达集团屠杀越侨的暴行完全是为美帝效劳,1970-04-15,1970-04
不结盟国家会议筹备会议在坦桑开幕坦桑总统尼雷尔致开幕词第二副总统卡瓦瓦当选筹备会议主席,1970-04-15,1970-04
坦桑总统为不结盟国家会议筹备会议举行招待会柬埔寨合法政府代表团团长宾努应邀出席,1970-04-15,1970-04
亚非法律工作者会议常设书记处谴责美帝策动柬政变完全支持柬人民反对美帝及其走狗的斗争,1970-04-15,1970-04
泰国反动当局妄图用武力为柬右派集团撑腰在人民力量打击下，泰国反动派同柬右派集团一样都将遭到覆灭下场,1970-04-15,1970-04
北京城区天气预报,1970-04-15,1970-04
报眼毛主席语录,1970-04-16,1970-04
人民解放军全军认真学习新党章全面落实毛主席的整党建党伟大纲领把党组织建设得更加朝气蓬勃,1970-04-16,1970-04
放手发动群众，自力更生，艰苦奋斗湖北多快好省发展煤炭生产,1970-04-16,1970-04
周恩来总理接见日本友好贸易七团体代表,1970-04-16,1970-04
应中共中央邀请来我国进行友好访问新共总书记威尔科克斯等同志到京康生、张春桥同志等前往机场欢迎,1970-04-16,1970-04
巴勒斯坦民族解放运动（法塔赫）第一负责人巴勒斯坦解放组织执行委员会主席阿拉法特给周总理的感谢信,1970-04-16,1970-04
朝鲜驻中国大使玄峻极举行招待会庆祝金日成首相五十八岁寿辰李先念副总理郭沫若副委员长等应邀出席,1970-04-16,1970-04
在伟大的七十年代第一个春天在国内外一派大好形势下一九七○年春季中国出口商品交易会在广州隆重开幕,1970-04-16,1970-04
坚持毛泽东思想挂帅，就无往而不胜,1970-04-16,1970-04
驳所谓“用经济办法管理经济”,1970-04-16,1970-04
政治永远统帅生产,1970-04-16,1970-04
毛主席语录,1970-04-16,1970-04
亚非朋友和英国人民热烈欢呼毛主席伟大声明发表两周年毛主席声明在全世界产生伟大深远影响极大鼓舞亚非拉革命人民反帝反殖斗志,1970-04-16,1970-04
在伟大领袖毛主席《支持美国黑人抗暴斗争的声明》鼓舞下美国黑人争自由求解放的斗争深入发展两年来，黑人斗争同广大人民斗争汇成巨大洪流，不断冲击美帝的反动统治,1970-04-16,1970-04
坚决支持美国黑人的抗暴斗争,1970-04-16,1970-04
柬埔寨人民和爱国武装力量痛击入侵的美军和南越伪军打死打伤美国侵略军七十名、伪军近百名,1970-04-16,1970-04
柬埔寨爱国武装力量严惩右派军队在干丹等五个省同右派军队战斗十三次歼敌一百多名爱国武装力量在反对右派政变集团的斗争中不断壮大,1970-04-16,1970-04
澳共（马列）《先锋报》揭露美帝扩大对亚洲的侵略支持越南老挝和柬埔寨人民反美斗争,1970-04-16,1970-04
阿尔巴尼亚《人民之声报》谴责美帝策动柬右派集团政变坚决支持柬埔寨人民反美爱国正义斗争柬埔寨人民和爱国力量得到全世界人民的支持必将取得胜利,1970-04-16,1970-04
日本毛泽东思想研究会的《人民新闻》谴责美帝策动柬埔寨政变美帝国主义必败！印度支那各国人民必胜！,1970-04-16,1970-04
亚非记协书记处发表关于柬埔寨局势的声明坚决支持柬国家元首西哈努克的五点声明柬埔寨人民在全世界人民的支持下团结战斗定能打败美帝及其走狗,1970-04-16,1970-04
日共（左派）《人民之星》谴责美帝策动柬埔寨政变印度支那各国人民反美斗争必将取得胜利指出日本人民反对美日反动派的斗争同印度支那人民反美斗争紧密相连,1970-04-16,1970-04
新西兰共产党机关报《人民之声报》发表文章指出毛泽东思想鼓舞毛利族人民进行斗争,1970-04-16,1970-04
声讨美帝走狗柬埔寨右派集团的暴行,1970-04-16,1970-04
苏发努冯亲王就老挝新年发表广播演说号召爱国军民加强团结夺取更大胜利巴特寮电台指出美帝及其走狗遭到惨重失败，但他们的本性决不会改变,1970-04-16,1970-04
日中友好协会（正统）总部召开全国代表大会同美日反动派斗争到底坚定发展日中友好运动,1970-04-16,1970-04
日中友好运动领导人黑田寿男发表谈话高举反美斗争旗帜  广泛开展日中友好运动强烈谴责美日反动派加紧扩军备战、加速复活日本军国主义的罪恶行径,1970-04-16,1970-04
巴基斯坦报纸继续发表社论赞扬巴中两国人民友谊不断发展,1970-04-16,1970-04
中国索马里两国人民辛勤劳动的结果索马里报纸赞扬我国援建的水稻和烟草试验站,1970-04-16,1970-04
苏丹新任驻华大使到京,1970-04-16,1970-04
北京城区天气预报,1970-04-16,1970-04
报眼毛主席语录,1970-04-17,1970-04
赤裸裸的暴露,1970-04-17,1970-04
上海工人阶级依靠战无不胜的毛泽东思想闯出新路高速度建成第一台中国式单晶炉,1970-04-17,1970-04
贯彻执行建设社会主义总路线的又一重大胜利陕西东方红电力抽水灌溉工程胜利建成,1970-04-17,1970-04
高举毛泽东思想伟大红旗，更广泛深入地开展‘农业学大寨’的群众运动昔阳干部群众满怀壮志重新安排河山,1970-04-17,1970-04
周恩来、康生、张春桥同志举行宴会热烈欢迎威尔科克斯和罗·泰勒同志,1970-04-17,1970-04
坚决照毛主席指示办事就是胜利大兴县革委会认真贯彻执行毛主席亲自制定的路线、方针、政策，革命生产形势大好,1970-04-17,1970-04
活学活用毛主席的光辉哲学思想正确解决增产节约中几个关系问题阳泉矿务局不断克服各种错误倾向，使增产节约运动更加蓬勃发展,1970-04-17,1970-04
一颗红心为革命全心全意为人民——记人民解放军某部卫生队长、共产党员张嘉福的先进事迹,1970-04-17,1970-04
怎样发挥共产党员的先进作用北京部队某部六连学习新党章的体会党员必须是无产阶级先进分子,1970-04-17,1970-04
向群众学习做群众的小学生,1970-04-17,1970-04
按照新党章的规定严格要求自己,1970-04-17,1970-04
既要带动群众又要帮助群众,1970-04-17,1970-04
“肩上不离粗扁担，心中不忘大方向”——记共产党员毛凤鸾坚持参加集体生产劳动的事迹,1970-04-17,1970-04
柬埔寨国家元首西哈努克亲王给同柬埔寨人民友好的各国政府与人民的信严厉谴责朗诺—施里玛达叛徒集团实行法西斯大屠杀的滔天罪行,1970-04-17,1970-04
热烈欢呼柬埔寨人民反美爱国斗争的胜利,1970-04-17,1970-04
响应国家元首西哈努克亲王的号召反对美帝及其走狗柬埔寨柴桢省人民和爱国武装力量歼灭和重创右派军队六个连,1970-04-17,1970-04
抗议尼克松政府扩大侵越战争疯狂扩军备战美国人民再次掀起全国规模大示威,1970-04-17,1970-04
坦桑尼亚总统尼雷尔接见柬埔寨合法政府代表团支持西哈努克亲王和柬埔寨人民的事业,1970-04-17,1970-04
阿尔巴尼亚《人民之声报》发表文章周总理访问朝鲜对进一步加强中朝两国人民间的友谊和密切合作作出重要贡献,1970-04-17,1970-04
我社会主义建设成就展览会在科尔察开幕阿尔巴尼亚人民怀着极大的热情参观了展览,1970-04-17,1970-04
日中友好运动领导人黑田寿男支持中朝两国政府联合公报联合公报沉重打击了美日反动派谴责日本反动派以美帝国主义为靠山积极扩军备战,1970-04-17,1970-04
日中友好运动领导人宫崎世民欢呼中朝两国政府联合公报联合公报巨大鼓舞了日本人民和世界人民谴责日本军国主义积极为美帝侵略亚洲的政策效劳,1970-04-17,1970-04
日本进步团体负责人欢迎中朝两国政府联合公报决心同美帝和日本军国主义进行斗争联合公报对各国革命人民和亚非拉民族解放运动是巨大的鼓舞和支持,1970-04-17,1970-04
日本三千群众举行反美集会示威,1970-04-17,1970-04
我新任驻马里大使孟钺离京赴任,1970-04-17,1970-04
北京城区天气预报,1970-04-17,1970-04
报眼毛主席语录,1970-04-18,1970-04
天津市红桥区各级党组织经常对党员进行教育坚持上党课学好新党章广大党员在三大革命运动中更好地发挥了先锋和模范作用,1970-04-18,1970-04
团结战斗，进一步巩固无产阶级专政米泉县各族人民在党的“九大”精神鼓舞下不断夺得新胜利,1970-04-18,1970-04
广州部队各级党组织用毛主席的建党思想武装广大党员对党员深入进行新党章的教育加速部队革命化和战斗化建设,1970-04-18,1970-04
紧跟毛主席，奋勇向前进！——记“毛泽东号”机车组二十四年保持和发扬艰苦奋斗革命传统的光辉事迹,1970-04-18,1970-04
毛泽东思想灿烂阳光普照西藏高原解放军驻藏部队指战员热情传播毛泽东思想,1970-04-18,1970-04
“九大”团结、胜利的旗帜高高飘扬在云南高黎贡山上碧江各族人民坚持活学活用毛泽东思想,1970-04-18,1970-04
加强党的领导坚持自力更生狠批洋奴哲学乐昌县依靠群众多快好省建设棉纺厂实现当年设计，当年施工，当年部分设备安装试产,1970-04-18,1970-04
简讯,1970-04-18,1970-04
自力更生的力量在人民群众之中,1970-04-18,1970-04
千方百计为群众解决困难,1970-04-18,1970-04
把邮包汇款送到贫下中农家里,1970-04-18,1970-04
急工农兵之所急,1970-04-18,1970-04
黄河洼地变成米粮仓——记封丘县沿河地区引黄淤灌、改碱种稻的事迹,1970-04-18,1970-04
浑江市三公里储蓄所工作人员努力做好金融工作,1970-04-18,1970-04
快马加鞭未下鞍——记水源公社革命群众和干部继续革命夺取新胜利的事迹,1970-04-18,1970-04
阮友寿主席和黄晋发主席致电西哈努克亲王感谢西哈努克亲王谴责朗诺—施里玛达集团屠杀旅柬越侨,1970-04-18,1970-04
越南南方解放通讯社谴责柬右派集团镇压爱国人民的罪行柬埔寨人民反对美帝及其走狗的斗争必胜,1970-04-18,1970-04
越南南方民主党发表声明支持柬埔寨国家元首西哈努克的五点声明,1970-04-18,1970-04
坦桑副总统、不结盟国家会议筹备会议主席举行招待会柬埔寨合法政府代表团团长宾努应邀出席,1970-04-18,1970-04
柬埔寨留法学生联合会致电不结盟国家会议筹备会议重申西哈努克亲王是柬埔寨合法国家元首,1970-04-18,1970-04
苏丹外交和内阁事务国务部长说苏丹支持柬国家元首西哈努克合法政权,1970-04-18,1970-04
支撑政变集团维持反动统治镇压人民的爱国斗争美帝加紧向柬埔寨右派集团提供军火,1970-04-18,1970-04
亚非作家常设局执行书记处发表声明坚决支持柬人民反对美帝及朗诺集团的斗争在全世界人民的支持下越老柬人民反美斗争定会取得最后胜利,1970-04-18,1970-04
越南人民愤怒声讨柬右派集团迫害越侨的暴行,1970-04-18,1970-04
新西兰共产党全国书记处发表声明谴责美帝强化侵略印度支那战争号召一切进步人士加强斗争为打败美帝及其帮凶作出贡献,1970-04-18,1970-04
反对垄断资产阶级反动统治的斗争浪潮汹涌澎湃意大利各地三百五十万工人举行大罢工第二主要工业区皮埃蒙特区工人举行总罢工使这个区完全陷于瘫痪,1970-04-18,1970-04
‘马来亚革命之声’发表评论揭露苏修在亚洲的罪恶阴谋强烈谴责苏修加紧对马来亚进行渗透苏修的无耻行径进一步暴露他们的狰狞面目，激起马来亚人民的无比愤怒,1970-04-18,1970-04
抗议西斯科到中东策划反对阿拉伯和巴勒斯坦人民的阴谋安曼一万阿拉伯群众举行反美大示威示威群众怒砸美国大使馆西斯科被迫取消‘访问’约旦,1970-04-18,1970-04
抗议美帝侵越支持越南人民正义斗争丹麦万名群众举行示威游行,1970-04-18,1970-04
苏修勾结日本反动派对苏联人民犯下新罪行苏修叛徒集团派诺维科夫到日本进行阴谋活动，大肆拍卖苏联主权，乞求日本垄断资本“开发”西伯利亚，鼓励日本军国主义向海外扩张,1970-04-18,1970-04
北京城区天气预报,1970-04-18,1970-04
报眼毛主席语录,1970-04-19,1970-04
柬埔寨国家元首西哈努克亲王写信给周总理最严厉地谴责朗诺集团屠杀华侨、越侨和高棉人的罪行，表示将彻底打败美帝国主义及其走狗,1970-04-19,1970-04
哈尔滨电机厂以班组为基础深入开展革命大批判坚持科学分析讲清道理批深批透一支以工人为主体的大批判骨干队伍不断发展壮大,1970-04-19,1970-04
深入开展革命大批判，夺取工业生产新胜利,1970-04-19,1970-04
用毛主席的哲学思想指导种田,1970-04-19,1970-04
黄山洞大队党支部坚决执行新党章规定经常对党员进行阶级斗争的教育充分发挥党支部的战斗堡垒作用,1970-04-19,1970-04
没有金刚钻，也能揽瓷器活,1970-04-19,1970-04
物尽其用，‘废’料不废,1970-04-19,1970-04
艰苦奋斗闹革命勤俭节约为人民——人民解放军北京部队某部炮团烧煤石的调查报告,1970-04-19,1970-04
“土药铺”——记庄河县东升大队勤俭办合作医疗的故事,1970-04-19,1970-04
广州部队制成几种新型药品成本低廉、疗效良好，深受广大工农兵欢迎,1970-04-19,1970-04
潜力挖不尽，增产无止境——批判“增产到顶，潜力挖尽”的保守思想,1970-04-19,1970-04
驳“大厂浪费有理论”,1970-04-19,1970-04
‘宽打’岂能‘窄用’,1970-04-19,1970-04
‘财大气粗’的思想要不得,1970-04-19,1970-04
从广治省到湄公河三角洲的各个战场上广泛猛袭敌人越南南方军民英勇战斗取得新战果三月底到四月初歼灭大批美伪军和仆从军，击毁敌人许多军车,1970-04-19,1970-04
老挝爱国力量旱季五个月内歼敌一万多名击落击毁美机九十多架缴获和击毁各种武器两千多件巴特寮电台指出美帝及其走狗在老挝的疯狂冒险行动遭到惨重失败,1970-04-19,1970-04
在人民爱国斗争怒潮的沉重打击下惊慌失措柬右派集团一再向美国主子乞讨“援助”,1970-04-19,1970-04
柬埔寨右派集团日子越来越不好过靠刺刀控制的金边食品奇缺物价飞涨民怨沸腾,1970-04-19,1970-04
胜利一定属于印度支那人民,1970-04-19,1970-04
朝鲜外务省发言人发表声明强烈谴责柬右派集团残暴屠杀越侨《劳动新闻》指出柬埔寨右派集团反人民的凶恶面目暴露无遗,1970-04-19,1970-04
阿《团结报》赞扬我党“九大”进一步推进社会主义革命和建设毛主席领导中国人民取得宏伟成就全世界人民感到无限高兴美帝和苏修惊恐万状,1970-04-19,1970-04
以高昂的革命热情和充沛的干劲投入社会主义竞赛地拉那等地工人胜利完成第一季度工业生产计划阿尔巴尼亚许多地区提前实现农村电气化,1970-04-19,1970-04
日本朋友西泽隆二和井上清等支持中朝两国政府联合公报揭露美帝侵略政策谴责日本军国主义复活,1970-04-19,1970-04
抗议美国反动统治集团迫害黑人美国康涅狄格州群众举行示威,1970-04-19,1970-04
充当美帝侵略亚洲的急先锋妄图重建日本殖民势力范围日本反动派疯狂向海外进行侵略扩张亚洲各国人民极为愤慨，正在保持高度警惕,1970-04-19,1970-04
北京城区天气预报,1970-04-19,1970-04
报眼毛主席语录,1970-04-20,1970-04
坚决响应毛主席的伟大号召高举党的“九大”团结、胜利旗帜新疆革命和生产蓬勃发展形势一片大好,1970-04-20,1970-04
充分发挥老工人作用推动增产节约运动天津工业系统组织老工人调查组，协助革委会调查和解决革命和生产中的问题,1970-04-20,1970-04
阿尔巴尼亚驻华大使罗博同志举行宴会招待我党和国家领导同志周恩来陈伯达康生张春桥黄永胜李先念吴法宪李德生等同志出席宴会是在十分亲切友好的气氛中进行的,1970-04-20,1970-04
活学活用“老三篇”越学眼界越开阔西安铁路局西安西站广大群众阶级觉悟不断提高，全站革命和生产蓬勃发展,1970-04-20,1970-04
中国中日备忘录贸易办事处代表和日本日中备忘录贸易办事处代表会谈公报在北京签字中国日本友好协会名誉会长郭沫若和有关方面负责人参加签字仪式,1970-04-20,1970-04
中国中日备忘录贸易办事处代表、日本日中备忘录贸易办事处代表会谈公报,1970-04-20,1970-04
在毛主席的‘备战、备荒、为人民’伟大战略方针指引下江苏多快好省地建设苏南煤田广大工人为迅速改变北煤南运状况作出新贡献,1970-04-20,1970-04
西藏高原第一代纺织工人心向北京城建设新西藏,1970-04-20,1970-04
简讯,1970-04-20,1970-04
发动群众，推广人民的医药卫生事业如东县环镇公社普及新针疗法的调查把群众性的医疗卫生工作办好——关于农村医疗卫生制度的讨论（三十）,1970-04-20,1970-04
落实‘备战、备荒、为人民’的伟大战略方针把大队变成打不烂的药库把群众性的医疗卫生工作办好——关于农村医疗卫生制度的讨论（三十）,1970-04-20,1970-04
群众办医好把群众性的医疗卫生工作办好——关于农村医疗卫生制度的讨论（三十）,1970-04-20,1970-04
戈壁滩上开展了土方草药运动把群众性的医疗卫生工作办好——关于农村医疗卫生制度的讨论（三十）,1970-04-20,1970-04
户户建立草药篮把群众性的医疗卫生工作办好——关于农村医疗卫生制度的讨论（三十）,1970-04-20,1970-04
学校办起了‘土药室’把群众性的医疗卫生工作办好——关于农村医疗卫生制度的讨论（三十）,1970-04-20,1970-04
罗田县革委会在完成‘九大’提出的各项战斗任务中紧密联系实际深入开展大批判,1970-04-20,1970-04
大白楼贫下中农回忆王国福,1970-04-20,1970-04
七星岭大队自力更生艰苦奋斗治山治水改土造田“穷山沟”连续七年夺得粮食高产亩产跨过“纲要”规定指标，由吃国家返销粮变为向国家提供商品粮,1970-04-20,1970-04
范文同总理致电柬国家元首西哈努克亲王感谢西哈努克亲王严厉谴责朗诺—施里玛达集团屠杀旅柬越侨,1970-04-20,1970-04
柬埔寨爱国武装力量痛击右派集团军队占领茶胶市以南三个重要城镇，政变集团军队一个营下落不明,1970-04-20,1970-04
越南外交部新闻司司长举行记者招待会驳斥柬埔寨反动集团的无耻谣言,1970-04-20,1970-04
不结盟国家会议筹备会议在坦桑闭幕筹备会议主席卡瓦瓦宣布第三次不结盟国家首脑会议今年内在卢萨卡举行,1970-04-20,1970-04
宾努亲王率柬埔寨合法政府代表团离坦桑时发表声明感谢坦桑政府支持西哈努克亲王和柬埔寨人民,1970-04-20,1970-04
越南民主共和国政府发表声明强烈谴责柬反动集团屠杀旅柬越侨的暴行号召旅柬侨胞紧密团结，加强同柬埔寨人民的友谊，反对美帝及其走狗的一切阴谋,1970-04-20,1970-04
柬政变集团继续血腥屠杀越南侨民西方通讯社报道仅在金边附近的湄公河上就集体屠杀了一千多人一位在大屠杀中逃出的越侨青年控诉柬右派集团令人发指的暴行,1970-04-20,1970-04
非洲海员热烈欢呼毛主席《支持美国黑人抗暴斗争的声明》发表两周年毛主席声明给全世界黑人以解放的信心和力量,1970-04-20,1970-04
印共（马列）领导人查鲁·马宗达指出印度革命形势大好号召工人阶级同农民团结起来开展武装斗争,1970-04-20,1970-04
罗马尼亚《火花报》就罗外贸部长访华发表文章热烈赞扬中罗两国人民友好关系进一步发展,1970-04-20,1970-04
“暴风之声”强烈谴责西斯科到中东进行阴谋活动反对“政治解决”方案把武装斗争进行到底黎巴嫩人民举行声势浩大示威游行抗议西斯科“访问”,1970-04-20,1970-04
日本友好贸易七团体代表团离京回国,1970-04-20,1970-04
亚非记协就亚非新闻工作者日发表号召书加强战斗团结反对美帝苏修和各国反动派,1970-04-20,1970-04
北京城区天气预报,1970-04-20,1970-04
报眼毛主席语录,1970-04-21,1970-04
在教育中使用在使用中加强教育上海沪东造船厂革委会认真落实毛主席对知识分子的政策，坚持用毛泽东思想对工程技术人员进行再教育，取得显著效果,1970-04-21,1970-04
朝鲜民主主义人民共和国驻华大使玄峻极同志为周总理访问朝鲜举行宴会周恩来总理、黄永胜总参谋长、李先念副总理应邀出席玄峻极大使和周总理在十分亲切友好的宴会上讲了话,1970-04-21,1970-04
伟大列宁诞生一百周年前夕我驻苏临时代办拜谒列宁墓并献花圈,1970-04-21,1970-04
周恩来总理接见日本松村谦三访华团,1970-04-21,1970-04
无产阶级教育革命大有奔头——驳“当教师没奔头”论,1970-04-21,1970-04
农村中革命大批判的生力军——记河南省济源县贫下中农革命大批判小组,1970-04-21,1970-04
白手起家艰苦创业——记沿着自力更生道路胜利前进的南通晶体管厂,1970-04-21,1970-04
综合利用大有可为北京维尼纶厂自力更生从废气、废热、废水中回收大量产品,1970-04-21,1970-04
要搞综合利用,1970-04-21,1970-04
‘昆明牌’载重汽车成批生产,1970-04-21,1970-04
用电子技术改造电机系统,1970-04-21,1970-04
从废机油中提炼机油,1970-04-21,1970-04
学习毛主席哲学思想继承发展耳针疗法,1970-04-21,1970-04
邢台地区人民医院认真执行毛主席的无产阶级卫生路线城市医院用草医草药防病治病深受欢迎,1970-04-21,1970-04
日本松村谦三举行告别宴会郭沫若和有关方面负责人应邀出席,1970-04-21,1970-04
柬埔寨右派集团逃脱不了正义的惩罚,1970-04-21,1970-04
河内各界人民举行集会声讨柬右派集团屠杀越侨的暴行越《人民报》指出朗诺——施里玛达集团玩火必自焚,1970-04-21,1970-04
越南北方军民击落美机一架,1970-04-21,1970-04
老挝爱国战线党中央发言人发表声明谴责柬反动集团屠杀越侨的残暴罪行老柬越人民紧密团结坚决打击美帝及其走狗的侵略阴谋和破坏活动,1970-04-21,1970-04
朝鲜《劳动新闻》严斥美帝扩大印度支那战争的罪恶阴谋揭露美帝企图利用联合国插手柬埔寨局势,1970-04-21,1970-04
越南驻华大使举行记者招待会向中外记者宣读越南政府十八日发表的声明指出柬反动集团屠杀越侨为美帝扩大侵略战争阴谋效劳必遭失败,1970-04-21,1970-04
抗议美帝强化侵略印度支那战争美国许多城市群众连续举行集会示威,1970-04-21,1970-04
解放被占领的阿拉伯湾人民阵线一位负责人发表访华观感毛主席的光辉思想是革命人民的宝贵财富决心在革命实践中学习马列主义、毛泽东思想，把武装斗争进行到底,1970-04-21,1970-04
几内亚（比绍）爱国武装狠狠打击敌人向葡萄牙殖民军发动猛烈进攻，歼灭一批敌人,1970-04-21,1970-04
苏丹驻华大使向董必武副主席递交国书,1970-04-21,1970-04
日本各界友好人士在东京举行会议热烈支持中国国际贸易促进委员会、日本国际贸易促进协会等七团体共同声明,1970-04-21,1970-04
坚决粉碎日美军事同盟反对日本军国主义核武装东京等地工人农民学生举行集会示威决心同亚洲各国人民紧密团结，共同反对美日反动派的侵略和战争政策,1970-04-21,1970-04
印度学生英勇斗争反对美帝和印度反动派加尔各答大学生怒捣美国中央情报局分支机构中央邦、拉贾斯坦邦学生反抗反动当局的镇压,1970-04-21,1970-04
反对美帝侵略越南支持越南人民斗争挪威人民举行示威集会,1970-04-21,1970-04
北京城区天气预报,1970-04-21,1970-04
