以农村包围城市进行人民游击战争佐法尔地区人民解放军解放苏达城在其他地区歼灭一批英国殖民军和雇佣军，击落敌机一架,1970-04-21,1970-04
报眼口号,1970-04-22,1970-04
列宁主义，还是社会帝国主义？——纪念伟大列宁诞生一百周年,1970-04-22,1970-04
在数以千计的人民密切配合下严惩右派军队柬磅湛省爱国武装力量一举歼敌二百多,1970-04-22,1970-04
阿尔巴尼亚报纸指出柬埔寨人民得到全世界人民的支持热烈赞扬柬爱国力量英勇打击右派军队,1970-04-22,1970-04
阿扎尼亚（南非）泛非主义者大会写信给柬国家元首西哈努克亲王坚决支持柬埔寨人民的反美爱国斗争,1970-04-22,1970-04
刚果《战斗报》谴责美帝策动柬埔寨政变支持柬人民反对美帝及其走狗的正义斗争印度支那各国人民在全世界人民的支援下必将打败美帝,1970-04-22,1970-04
日本松村谦三访华团离京回国,1970-04-22,1970-04
南也门卫生部长接见我医务人员,1970-04-22,1970-04
越南南方共和临时革命政府发表声明强烈谴责柬右派集团屠杀旅柬越侨的暴行,1970-04-22,1970-04
亚非人民团结日本委员会委员长坂本德松发表声明支持柬国家元首西哈努克的五点声明,1970-04-22,1970-04
北京城区天气预报,1970-04-22,1970-04
报眼毛主席语录,1970-04-23,1970-04
首都和全国各地人民纪念伟大列宁诞生一百周年决心在马克思主义、列宁主义、毛泽东思想指引下，同全世界人民团结起来，为打倒美帝、苏修和各国反动派而英勇战斗,1970-04-23,1970-04
周恩来、康生、张春桥同志同威尔科克斯同志、罗·泰勒同志举行会谈会谈在亲切友好的气氛中进行,1970-04-23,1970-04
宁远县各级革委会遵照伟大领袖毛主席的教导坚持密切联系群众发扬艰苦朴素作风,1970-04-23,1970-04
周总理接见毛里塔尼亚大使,1970-04-23,1970-04
要讲革命课先做革命人——北京三十一中座谈教师思想革命化同教学突出无产阶级政治的关系纪要城市的小学及中学应当如何办？,1970-04-23,1970-04
学什么？,1970-04-23,1970-04
赞工农讲师,1970-04-23,1970-04
勇于冲破冲框框,1970-04-23,1970-04
课堂教学和现场教学结合,1970-04-23,1970-04
吃透上下两头,1970-04-23,1970-04
革命者要敢于破“顶”而上干革命没有止境，发展生产没有尽头河北省安次县小评论选登,1970-04-23,1970-04
首先要看到人的积极因素干革命没有止境，发展生产没有尽头河北省安次县小评论选登,1970-04-23,1970-04
干社会主义不能‘慢慢来’干革命没有止境，发展生产没有尽头河北省安次县小评论选登,1970-04-23,1970-04
穷不夺志富不变色——记石屋大队坚持十年艰苦创业的事迹,1970-04-23,1970-04
抓两条路线斗争以革命大批判开路天津木材管理供应系统为革命节约木材,1970-04-23,1970-04
在欢庆党的‘九大’召开一周年的大喜日子里又一艘巨型油轮胜利下水,1970-04-23,1970-04
狠批洋奴哲学，坚持土法上马上海开关厂制成二十二万伏高压少油开关,1970-04-23,1970-04
自力更生的思想在群众中牢牢扎根南昌发电厂抓紧革命大批判推动增产节约活动深入开展,1970-04-23,1970-04
夜学班的小教师,1970-04-23,1970-04
义务理发员,1970-04-23,1970-04
柬埔寨国家元首西哈努克亲王发表第三号告全国同胞书号召人民拿起武器打倒美帝走狗朗诺—施里玛达集团,1970-04-23,1970-04
柬埔寨国家元首西哈努克亲王写信给亚非记协和亚非作家常设局执行书记处感谢对柬埔寨人民反对美帝国主义及其走狗斗争的支持,1970-04-23,1970-04
马来亚《阵线报》欢呼柬埔寨人民反对美帝和政变集团斗争的发展柬埔寨人民革命风暴到处掀起势不可挡老挝亚非团结委员会声明完全支持柬埔寨人民的正义斗争,1970-04-23,1970-04
印共（马列）领导的农民武装广泛开展游击战英勇反击反革命“围剿”继续扩展武装斗争地区严惩恶霸地主,1970-04-23,1970-04
泰国人民武装接连出击取得新胜利歼灭一批美泰反动军警大力开展破坏敌人交通运输线活动,1970-04-23,1970-04
老挝爱国战线党中央常务委员会发布命令号召人民开展发展生产抗击美帝的竞赛运动要求各地各单位和各机关发扬自力更生精神生产更多的粮食,1970-04-23,1970-04
苏修叛徒一代不如一代苏联经济每况愈下,1970-04-23,1970-04
北京城区天气预报,1970-04-23,1970-04
报眼毛主席语录,1970-04-24,1970-04
更自觉地按照毛主席的革命路线办事黑龙江省肇东县运用路线分析讲用会的方法，不断提高干部和群众的觉悟，推动了活学活用毛泽东思想群众运动和斗批改的蓬勃发展。,1970-04-24,1970-04
某守岛部队党委活学活用毛主席关于继续革命的伟大理论和建党学说用毛泽东思想建设党委领导班子带动了部队的革命化、战斗化建设，新人新事大量涌现,1970-04-24,1970-04
狠批洋奴哲学彻底解放思想大连化工厂制成翅片型中压废热锅炉，并总结出一套自己的技术理论,1970-04-24,1970-04
自力更生奏凯歌——记长沙矿山通用机器厂建造新式锻造反射炉的事迹,1970-04-24,1970-04
包钢在社会主义革命竞赛中,1970-04-24,1970-04
用毛主席哲学思想实行科学种田——江西萍乡市湘东镇砚田大队的调查,1970-04-24,1970-04
生产队的‘好后勤’——荣成县荫子公社生产资料门市部为生产服务的事迹,1970-04-24,1970-04
透过现象看本质,1970-04-24,1970-04
吃一堑，长一智,1970-04-24,1970-04
张掖机械林场实现粮油肉菜自给,1970-04-24,1970-04
牧民不吃国家商品粮红星牧场在搞好畜牧业生产的同时抓好农业生产,1970-04-24,1970-04
紧跟伟大领袖毛主席继续革命永向前,1970-04-24,1970-04
无私无畏的先锋战士——记广州部队工程兵某部共产党员、副连长李发玉,1970-04-24,1970-04
阿尔巴尼亚《人民之声报》发表社论欢呼中阿两党两国人民的革命战斗友谊日益发展指出中阿友谊是在反对美帝苏修和反动派的斗争中锤炼出来的,1970-04-24,1970-04
英国进步群众示威反对苏修社会帝国主义,1970-04-24,1970-04
印度《解放》月刊谴责苏修美帝指使印度反动派疯狂扩军备战苏修美帝企图变印度为侵略中国和亚洲的基地,1970-04-24,1970-04
与英帝相互勾结狼狈为奸侵略面目又一次大暴露美帝悍然出兵镇压特立尼达和多巴哥的人民斗争美帝的武装干涉必将促使当地人民进行更加广泛、更加激烈的斗争,1970-04-24,1970-04
反对美帝勾结反动当局残酷镇压学生厄瓜多尔各地学生举行示威游行,1970-04-24,1970-04
阿富汗政府为我援建的青金石雕刻工场举行开工仪式,1970-04-24,1970-04
为纪念吉隆滩胜利九周年古巴驻华大使馆临时代办举行酒会,1970-04-24,1970-04
我新任驻苏丹大使杨守正离京赴任,1970-04-24,1970-04
毛里塔尼亚驻华大使哈尔希离任回国,1970-04-24,1970-04
新共《人民之声报》揭露美帝阴谋扩大侵略印度支那战争号召亚洲人民加强反对美帝及其走狗的斗争谴责新西兰统治阶级为美帝提供炮灰，从事侵略活动,1970-04-24,1970-04
澳共（马列）《先锋报》指出美帝是世界人民的头号敌人亚洲人民结成统一战线反对美帝侵略美帝策动柬埔寨右派集团政变，是在亚洲扩大侵略的严重步骤,1970-04-24,1970-04
越南南方解放通讯社受权发表声明驳斥柬政变集团对越南南方共和的无耻诬蔑,1970-04-24,1970-04
朝鲜《劳动新闻》谴责美帝纠集南越傀儡集团侵略柬埔寨印度支那人民定能粉碎美帝的侵略阴谋,1970-04-24,1970-04
在人民爱国武装斗争的沉重打击下柬政变集团走投无路再三向美帝求援,1970-04-24,1970-04
越南南方共和临时革命政府主席黄晋发发表号召书号召爱国军民促进‘决战决胜美国侵略强盗’竞赛运动发扬革命精神，夺取更大胜利，迎接临时革命政府成立一周年,1970-04-24,1970-04
各国舆论谴责美帝策动柬政变阴谋扩大印度支那战争世界革命人民坚决站在柬埔寨人民一边,1970-04-24,1970-04
北京城区天气预报,1970-04-24,1970-04
报眼毛主席语录,1970-04-25,1970-04
在伟大的毛泽东思想哺育下西藏第一代工人迅速成长壮大,1970-04-25,1970-04
坦桑尼亚驻华大使举行招待会庆祝坦桑尼亚联合共和国成立六周年周恩来总理李先念副总理郭沫若副委员长等应邀出席万布拉大使和李先念副总理在洋溢着中坦人民友好气氛的招待会上讲了话,1970-04-25,1970-04
高唱革命战歌胜利前进在毛主席的无产阶级文艺路线的光辉照耀下，由革命文艺工作者重新填词或改词的十首革命历史歌曲，受到广大工农兵群众的热烈欢迎,1970-04-25,1970-04
穷棒子精神万岁！——上海绒毯三厂坚持勤俭办厂的调查,1970-04-25,1970-04
郑州汽车厂生产‘郑州—一三○型’汽车,1970-04-25,1970-04
伶俐糖厂自力更生生产小型制糖机,1970-04-25,1970-04
广州部队某部利用废旧材料建成棉毯厂,1970-04-25,1970-04
办一切事情都要执行勤俭原则北京五金交电公司积极做好零件配件供应和修配工作,1970-04-25,1970-04
自力更生艰苦奋斗重新安排‘老灾区’河山商丘地区四百多万革命群众在‘九大’精神鼓舞下，决心彻底改变多灾低产面貌,1970-04-25,1970-04
燕山深处办电忙——青龙县兴办小型水电站的调查,1970-04-25,1970-04
发扬自力更生、艰苦奋斗精神充分利用丰富的水力资源湖南多快好省地发展小型水电站,1970-04-25,1970-04
遵照毛主席关于‘备战、备荒、为人民’的教导淳安建成一百三十多座小型水电站,1970-04-25,1970-04
为共产主义奋斗终身——记人民解放军空军某部优秀共产党员李同林,1970-04-25,1970-04
静海县各级革命委员会遵照毛主席教导加强对下放干部的领导和帮助,1970-04-25,1970-04
“草棚大学”育新人——记广西东兰县“五·七”干校,1970-04-25,1970-04
柬埔寨民族统一阵线武装部队在金边散发呼吁书呼吁右派军队士兵等起来反对卖国集团民族统一阵线在各国人民的帮助下为打败美帝及其走狗作出贡献,1970-04-25,1970-04
越南南方民族解放阵线中央委员会发表声明强烈抗议柬右派集团屠杀越侨  坚信越侨将在反对美帝国主义及其走狗的斗争中同柬埔寨人民更加团结起来,1970-04-25,1970-04
越南南方民族解放阵线中央委员会、越南民族、民主及和平力量联盟中央委员会举行集会愤怒声讨美帝走狗柬右派集团屠杀越侨的罪行,1970-04-25,1970-04
戳穿苏修鼓吹召开“新日内瓦会议”的阴谋苏修叛徒集团妄图勾结美帝稳定柬政变集团摇摇欲坠的反动统治镇压人民反美爱国斗争,1970-04-25,1970-04
越南民主共和国外交部发言人发表声明谴责美机轰炸越南北方居民区的罪行指出美帝的新罪行揭穿了尼克松政府叫嚷的骗人的和平论调,1970-04-25,1970-04
老挝爱国军民连续袭击敌人在川圹省和沙湾拿吉省四月份以来歼灭一批敌军缴获大批武器巴特寮电台号召爱国军民继续歼灭敌人有生力量夺取更大胜利,1970-04-25,1970-04
朝鲜最高人民会议举行第四届第四次会议会议一致通过了一九六九年国家预算执行结果的决定和关于一九七○年国家预算的法令,1970-04-25,1970-04
亚非记协集会庆祝“亚非新闻工作者日”七周年亚非新闻工作者团结起来为打倒帝修反而斗争亚非记协总书记查禾多和中国新闻界代表石少华先后在会上讲话,1970-04-25,1970-04
我新任驻芬兰大使向芬兰总统呈递国书,1970-04-25,1970-04
美帝和社会帝国主义在中东处境困难妄图挣扎反扑美帝对阿拉伯国家进行讹诈逼降并在这些国家内部加紧策动颠覆和政变社会帝国主义玩弄假支持真出卖、假援助真控制手法，向阿拉伯国家渗透,1970-04-25,1970-04
北京城区天气预报,1970-04-25,1970-04
报眼毛主席语录,1970-04-26,1970-04
毛主席提出“我们也要搞人造卫星”的伟大号召实现了！我国第一颗人造地球卫星发射成功卫星重一百七十三公斤，用二○·○○九兆周的频率，播送《东方红》乐曲,1970-04-26,1970-04
我国人造地球卫星运行情况良好从空中发回《东方红》乐曲清晰嘹亮各种仪器工作正常，遥测仪器不断发回各种数据,1970-04-26,1970-04
我国第一颗人造地球卫星飞经祖国各地的时间（北京时间）,1970-04-26,1970-04
我国第一颗人造地球卫星飞经世界各地的时间（北京时间）,1970-04-26,1970-04
青海省牧区各级党组织和革委会领导各族牧民深入开展活学活用毛泽东思想群众运动全面落实“九大”提出的各项战斗任务,1970-04-26,1970-04
威尔科克斯和罗·泰勒同志回国康生同志和张春桥同志等前往机场欢送,1970-04-26,1970-04
大家动手，自力更生——学习《论军队生产自给，兼论整风和生产两大运动的重要性》,1970-04-26,1970-04
秘鲁共产党出版毛主席光辉著作《湖南农民运动考察报告》指出要根据秘鲁具体条件把这篇伟大著作应用于革命实践,1970-04-26,1970-04
北加里曼丹革命战士写诗热情歌颂伟大的毛泽东思想,1970-04-26,1970-04
愤怒抗议美帝勾结英帝进行武装干涉特立尼达和多巴哥人民举行声势浩大示威,1970-04-26,1970-04
纪念朝鲜抗日游击队成立三十八周年朝鲜驻华大使举行宴会玄峻极大使和邱会作副总参谋长共祝中朝人民用鲜血凝成的战斗友谊进一步发展,1970-04-26,1970-04
庆祝坦桑尼亚联合共和国成立六周年中非友协举行酒会,1970-04-26,1970-04
在斗争中活学活用毛泽东思想——日本齿轮座两位青年演员学习毛主席著作的事迹,1970-04-26,1970-04
死心塌地充当美帝苏修的忠实走狗决没有好下场印度反动政府对邻国顽固坚持扩张主义政策,1970-04-26,1970-04
柬埔寨爱国武装力量继续痛击右派集团军队,1970-04-26,1970-04
越南民主共和国外交部发言人发表声明强烈谴责美帝向柬右派集团提供武器美帝的干涉和侵略挽救不了它在南越的失败和朗诺—施里玛达集团的困境,1970-04-26,1970-04
强烈抗议柬右派集团勾结西贡傀儡屠杀越侨西贡数千青年和学生举行集会示威,1970-04-26,1970-04
美帝加紧武装柬埔寨政变集团美国官员供认美国已通过南越傀儡把武器运给柬政变集团美国宣扬“不打算卷入柬埔寨局势”，只不过是骗人的鬼话,1970-04-26,1970-04
阿《人民之声报》谴责柬右派集团屠杀迫害柬人民、越侨和华侨的罪行柬埔寨人民正义斗争必将战胜法西斯恐怖统治指出朗诺—施里玛达右派集团的野蛮暴行是在美帝鼓励下进行的,1970-04-26,1970-04
柬右派政变集团制造民族屠杀只能自食其果柬埔寨人民和爱国武装力量乘胜追击决心埋葬朗诺—施里玛达卖国集团屠杀越侨激起世界人民的强烈愤慨迫害华侨是对中国人民的严重挑衅,1970-04-26,1970-04
北京城区天气预报,1970-04-26,1970-04
报眼毛主席语录,1970-04-27,1970-04
毛主席语录,1970-04-27,1970-04
欢呼伟大领袖毛主席的伟大号召实现了欢呼我国第一颗人造地球卫星发射成功,1970-04-27,1970-04
毛主席林副主席周总理收到霍查谢胡同志的贺电,1970-04-27,1970-04
毛主席林副主席周总理收到孙德胜黎笋长征范文同同志的贺电,1970-04-27,1970-04
毛主席林副主席周总理收到金日成崔庸健同志的贺电,1970-04-27,1970-04
光荣归于伟大领袖毛主席首都军民热烈欢呼我国第一颗人造地球卫星发射成功,1970-04-27,1970-04
我国人造地球卫星继续正常运行北京等地群众今晚可以直接看到,1970-04-27,1970-04
我国第一颗人造地球卫星四月二十七日、二十八日飞经祖国各地的时间（北京时间）,1970-04-27,1970-04
我国第一颗人造地球卫星四月二十七日、二十八日飞经世界各地的时间（北京时间）,1970-04-27,1970-04
在地拉那隆重纪念伟大列宁诞生一百周年大会上霍查同志的开幕词,1970-04-27,1970-04
在地拉那隆重纪念伟大列宁诞生一百周年大会上阿利雅同志发表讲话,1970-04-27,1970-04
我国工人代表团抵地拉那阿工会中央理事会总书记雅科瓦等到机场欢迎代表团离北京时李先念纪登奎等同志前往欢送,1970-04-27,1970-04
我新任驻马里大使向马里国家元首递交国书,1970-04-27,1970-04
坦桑尼亚总统接见我驻坦桑大使,1970-04-27,1970-04
毛里塔尼亚总统接见我技术和医务人员,1970-04-27,1970-04
毛主席的伟大号召实现了！,1970-04-27,1970-04
永远沿着毛主席指引的航道胜利前进,1970-04-27,1970-04
毛主席革命路线的伟大胜利,1970-04-27,1970-04
红色卫星飞长空宇宙响彻《东方红》,1970-04-27,1970-04
充分发动群众依靠群众运用人民战争战略战术泰国北部爱国军民勇敢战斗取得新战果,1970-04-27,1970-04
马来亚民族解放军在反“围剿”战斗中捷报频传在霹雳州英勇袭击拉赫曼——拉扎克傀儡集团的巡逻队,1970-04-27,1970-04
越南《人民报》指出越南人民断然拒绝印尼法西斯政权提出的‘建议’谴责印尼法西斯政权为美帝侵略柬埔寨效劳印尼的‘建议’是为了掩盖美帝的罪行并帮助柬右派集团镇压人民爱国运动,1970-04-27,1970-04
柬埔寨磅湛省克列县数千人民集会庆祝柬民族统一阵线克列县委员会建立宣读国家元首西哈努克亲王的救国呼吁书，宣布废除当地反动政权,1970-04-27,1970-04
柬埔寨右派集团加紧迫害旅柬华侨悍然下令封闭所有在金边的华侨和越侨学校,1970-04-27,1970-04
印尼法西斯集团为柬右派集团撑腰打气公然跳出来鼓吹召开所谓“亚洲国家会议”来“讨论柬埔寨局势”，企图干涉和侵略柬埔寨,1970-04-27,1970-04
热烈欢迎越南第四区业余艺术团来我国访问演出中越友协和我对外友协举行招待会,1970-04-27,1970-04
北京城区天气预报,1970-04-27,1970-04
报眼毛主席语录,1970-04-28,1970-04
印度支那人民最高级会议联合声明,1970-04-28,1970-04
欢呼我国第一颗人造地球卫星发射成功全国军民决心紧跟毛主席夺取更大胜利,1970-04-28,1970-04
《列宁主义，还是社会帝国主义？》一书出版《赤裸裸的暴露》一文也编入本书,1970-04-28,1970-04
全球响彻《东方红》万岁万岁毛泽东——人民解放军陆海空军指战员纵情欢呼我国第一颗人造地球卫星发射成功,1970-04-28,1970-04
沿着毛泽东思想的轨道胜利前进——上海人民热烈欢呼我国第一颗人造地球卫星发射成功,1970-04-28,1970-04
我国第一颗人造地球卫星发射成功把贫下中农热爱毛主席的心传遍全球英雄韶山儿女决心紧跟毛主席从胜利走向新的胜利,1970-04-28,1970-04
毛泽东思想是威力无穷的精神原子弹革命摇篮井冈山到处响彻着欢呼声,1970-04-28,1970-04
最美好的颂歌是《东方红》延安人民欢庆我国人造地球卫星上天,1970-04-28,1970-04
我国银川兰州成都长沙广州等地区今晚能看到我国第一颗人造地球卫星,1970-04-28,1970-04
怎样观察人造地球卫星,1970-04-28,1970-04
毛泽东思想是胜利的源泉,1970-04-28,1970-04
紧跟毛主席就是胜利,1970-04-28,1970-04
自力更生威力大，人造卫星飞上天,1970-04-28,1970-04
新疆各族人民齐声歌颂红太阳,1970-04-28,1970-04
大长世界革命人民的志气,1970-04-28,1970-04
钢铁工人欢呼我国卫星上天,1970-04-28,1970-04
印度支那人民最高级会议隆重举行,1970-04-28,1970-04
阿工会中央理事会总书记雅科瓦接见我国工人代表团,1970-04-28,1970-04
中美大使级会谈第一三七次会议将在五月二十日举行,1970-04-28,1970-04
越南北方各地人民纷纷举行集会愤怒声讨柬右派集团屠杀越侨的罪行旅柬越侨同柬埔寨人民紧密团结起来开展反对美帝及其走狗的斗争,1970-04-28,1970-04
柬埔寨柴桢省占知县人民和越侨举行集会谴责朗诺—施里玛达集团屠杀越南侨民揭露右派集团把柬埔寨变成美国殖民地和军事基地的卖国面目,1970-04-28,1970-04
澳共（马列）主席希尔电贺我成功发射人造卫星中国新胜利是对美帝苏修的又一巨大打击,1970-04-28,1970-04
罗马尼亚部长会议主席毛雷尔电贺我成功发射人造卫星向中国政府和人民表示真诚的祝贺,1970-04-28,1970-04
巴基斯坦总统叶海亚电贺我成功发射人造卫星中国的卓越成就具有历史意义,1970-04-28,1970-04
越《人民报》和‘越南之声’热烈祝贺我成功发射人造卫星中国社会主义革命和建设不断前进指出这是对越南人民和印度支那人民反对美帝斗争的巨大支持,1970-04-28,1970-04
阿《人民之声报》等发表社论热烈祝贺我成功发射人造卫星无产阶级文化大革命的又一丰硕成果,1970-04-28,1970-04
几内亚总统杜尔电贺我成功发射人造卫星中国取得了极其伟大的成就,1970-04-28,1970-04
阿富汗首相埃特马迪电贺我成功发射人造卫星祝愿中国取得进一步的科学成就,1970-04-28,1970-04
毛里塔尼亚总统达达赫电贺我成功发射人造卫星中国人民取得了伟大的胜利,1970-04-28,1970-04
北京城区天气预报,1970-04-28,1970-04
报眼毛主席语录,1970-04-29,1970-04
中华人民共和国政府声明,1970-04-29,1970-04
革命形势一片大好工农业生产蓬勃发展黑龙江河北浙江城乡市场繁荣兴旺,1970-04-29,1970-04
高举毛泽东思想伟大红旗继续前进,1970-04-29,1970-04
自力更生方针的伟大胜利,1970-04-29,1970-04
胜利凯歌遍全球,1970-04-29,1970-04
最响亮的歌是《东方红》,1970-04-29,1970-04
站在雪山望北京放声歌颂红太阳,1970-04-29,1970-04
我国第一颗人造地球卫星发射成功是伟大领袖毛主席英明领导的结果港澳爱国同胞畅谈伟大社会主义祖国的伟大成就,1970-04-29,1970-04
我国第一颗人造地球卫星继续正常运行四月二十九日、三十日飞经祖国各地的时间,1970-04-29,1970-04
我国第一颗人造地球卫星继续正常运行四月二十九日、三十日飞经世界主要城市的时间,1970-04-29,1970-04
四月二十九日、四月三十日傍晚我国可以看到第一颗人造卫星的地区,1970-04-29,1970-04
什么叫人造地球卫星,1970-04-29,1970-04
在印度支那人民最高级会议开幕式上柬埔寨国家元首西哈努克亲王的讲话印度支那人民在中国和世界人民支持下定能战胜美帝及其走狗,1970-04-29,1970-04
金日成首相电贺印度支那人民最高级会议朝鲜政府和人民坚决支持印度支那三国人民的抗美救国战争,1970-04-29,1970-04
在印度支那人民最高级会议上范文同总理的讲话这次会议是印度支那三国人民团结战斗的伟大胜利,1970-04-29,1970-04
老挝爱国战线党中央委员会、越南民主共和国人民代表团分别举行记者招待会公布印度支那人民最高级会议联合声明,1970-04-29,1970-04
越南南方民族解放阵线主席阮友寿、共和临时革命政府主席黄晋发电贺我成功发射人造卫星毛主席领导中国人民取得的重大胜利,1970-04-29,1970-04
缅甸共产党电贺我发射人造卫星成功中国新成就大大鼓舞世界被压迫人民,1970-04-29,1970-04
瑞典马列主义者共产主义联盟电贺我成功发射人造卫星中国的成就是毛泽东思想的伟大胜利,1970-04-29,1970-04
比利时马列主义共产党电贺我成功发射人造卫星中国辉煌胜利是对美帝苏修的沉重打击,1970-04-29,1970-04
越南副总理兼国防部长武元甲电贺我发射人造卫星成功中国的胜利对越南人民是强有力的鼓舞,1970-04-29,1970-04
赞比亚总统卡翁达电贺我成功发射人造卫星中国人民取得的非凡成就,1970-04-29,1970-04
南斯拉夫联邦执行委员会主席里比契奇电贺我成功发射人造卫星中国人民的伟大成功具有重大意义,1970-04-29,1970-04
尼泊尔外交大臣电贺我发射人造卫星成功祝贺中国取得伟大的技术成就,1970-04-29,1970-04
亚非记协总书记查禾多写信祝贺我成功发射人造卫星中国人民打破了帝修对宇宙空间技术的垄断,1970-04-29,1970-04
澳共（马列）《先锋报》撰文纪念列宁诞生一百周年必须加强学习马克思主义、列宁主义、毛泽东思想,1970-04-29,1970-04
我国工人代表团在地拉那参观访问受到阿尔巴尼亚同志和战友亲切、热烈的欢迎,1970-04-29,1970-04
庆祝中尼和平友好条约签订十周年中尼友协举行酒会李先念副总理和郭沫若副委员长出席,1970-04-29,1970-04
北京城区天气预报,1970-04-29,1970-04
报眼毛主席语录,1970-04-30,1970-04
中共中央电贺马来亚共产党成立四十周年,1970-04-30,1970-04
印度支那三国人民战斗团结的重大胜利,1970-04-30,1970-04
为纪念毛主席的《在延安文艺座谈会上的讲话》发表二十八周年闪耀着毛泽东思想灿烂光辉的革命样板戏将再度公演同时公演无产阶级革命文艺的新品种——钢琴协奏曲《黄河》,1970-04-30,1970-04
