意大利共产党（马列）中央写信给中共中央    最热烈祝贺中国共产党成立五十周年,1971-07-09,1971-07
意大利共产党人组织（马列）全国（临时）领导机构    写信给毛主席、林副主席和中共中央    最热烈祝贺中国共产党成立五十周年,1971-07-09,1971-07
日本共产主义青年同盟中央致电中共中央    最热烈祝贺中国共产党成立五十周年,1971-07-09,1971-07
巴勒斯坦全国委员会第九次会议开幕    阿拉法特主席作报告强调将继续进行武装斗争直到胜利    萨达特总统讲话表示阿联支持巴勒斯坦事业,1971-07-09,1971-07
柬埔寨王国民族团结政府发言人发表声明    完全支持越南南方共和七点建议,1971-07-09,1971-07
日中友好协会（正统）总部、“恢复    日中邦交国民会议”在东京分别集会    纪念中国人民抗日战争三十四周年,1971-07-09,1971-07
越南、老挝、柬埔寨青年代表团到京    我青年代表团同车回到北京    我有关方面负责人欢宴越老柬战友,1971-07-09,1971-07
越粮食食品部访问考察代表团回国,1971-07-09,1971-07
日本公明党访华代表团回到东京,1971-07-09,1971-07
中国和也门民主人民共和国关于两    项工程的会谈纪要在亚丁签字,1971-07-09,1971-07
安哥拉人民解放运动青年代表团到京,1971-07-09,1971-07
一位秘鲁朋友到京,1971-07-09,1971-07
北京城区天气预报,1971-07-09,1971-07
林彪同志致电巴卢库同志    最热烈祝贺阿人民军建军二十八周年,1971-07-10,1971-07
响应伟大领袖毛主席的号召  认真总结经验    工业战线深入开展学大庆运动,1971-07-10,1971-07
把读书同调查研究总结经验结合起来  玉树藏族自治州    州委领导成员不断提高执行毛主席革命路线的自觉性,1971-07-10,1971-07
毛主席语录,1971-07-10,1971-07
阿尔巴尼亚驻华使馆武官哈卡尼举行招待会    热烈庆祝阿人民军建军二十八周年,1971-07-10,1971-07
为庆祝中朝友好合作互助条约签订十周年    首都隆重举行“中朝友好周”开幕式,1971-07-10,1971-07
朝气蓬勃的女支部书记,1971-07-10,1971-07
报眼口号,1971-07-10,1971-07
坚持民主集中制是我党的优良传统,1971-07-10,1971-07
我对实行民主集中制的一些体会,1971-07-10,1971-07
在霍查同志为首的阿劳动党的无产阶级建军路线指引下    阿人民军在革命化战斗化的道路上胜利前进    高举反帝反修的革命旗帜，成为无产阶级专政的坚强柱石,1971-07-10,1971-07
在阿尔巴尼亚人民军建军二十八周年节日前夕    阿国防部设宴招待我大使和武官    宾主讲话共颂两国人民和军队的革命友谊    和战斗团结进一步发展,1971-07-10,1971-07
海上英雄,1971-07-10,1971-07
英雄的军队  坚强的柱石,1971-07-10,1971-07
纪念朝中友好合作互助条约签订十周年    平壤隆重举行“朝中友好周”开幕仪式,1971-07-10,1971-07
前来参加中朝友好合作互助条约十周年庆祝活动    朝鲜两江道友好代表团到长春,1971-07-10,1971-07
我吉林省友好代表团去朝鲜    前往参加朝中友好合作互助条约十周年庆祝活动,1971-07-10,1971-07
结束在韶山、长沙、上海和南京的参观访问    几内亚军事代表团回到北京,1971-07-10,1971-07
芬中协会访华团离京回国,1971-07-10,1971-07
庆祝蒙古人民革命胜利五十周年    中蒙友协、对外友协举行电影酒会,1971-07-10,1971-07
中古男子篮球队进行友谊比赛,1971-07-10,1971-07
千里马在飞奔    ——访降仙炼钢厂,1971-07-10,1971-07
柬国家元首西哈努克亲王发表第二十三号告高棉同胞书    （第一部分）,1971-07-10,1971-07
北京城区天气预报,1971-07-10,1971-07
热烈祝贺中朝友好合作互助条约签订十周年    毛泽东同志林彪同志周恩来同志    致电金日成同志和崔庸健同志,1971-07-11,1971-07
热烈祝贺朝中友好合作互助条约签订十周年    金日成同志和崔庸健同志致电毛泽东同志、    林彪同志、周恩来同志,1971-07-11,1971-07
反对帝国主义侵略的坚强同盟,1971-07-11,1971-07
毛主席语录,1971-07-11,1971-07
参加中朝友好合作互助条约签订十周年庆祝活动    金仲麟和金万金同志率朝党政代表团到北京,1971-07-11,1971-07
参加朝中友好合作互助条约签订十周年庆祝活动    李先念和李德生同志率我党政代表团到平壤,1971-07-11,1971-07
我党政领导同志会见朝鲜党政代表团,1971-07-11,1971-07
热烈庆祝中朝友好合作互助条约签订十周年    热烈欢迎朝鲜民主主义人民共和国党政代表团    中共中央和国务院举行盛大宴会,1971-07-11,1971-07
在中共中央、国务院庆祝    中朝友好合作互助条约签订十周年和欢迎朝鲜党    政代表团宴会上黄永胜同志的讲话,1971-07-11,1971-07
在中共中央、国务院庆祝    中朝友好合作互助条约签订十周年    和欢迎朝鲜党政代表团宴会上金仲麟同志的讲话,1971-07-11,1971-07
隆重庆祝朝中友好合作互助条约签订十周年    朝鲜劳动党中央和朝鲜政府举行盛大宴会,1971-07-11,1971-07
李先念李德生同志拜访金一、朴成哲、    吴振宇、杨亨燮等同志    朝中两国战友进行了十分亲切友好的谈话,1971-07-11,1971-07
在朝鲜劳动党中央和朝鲜政府庆祝    朝中友好合作互助条约签订十周年宴会上金一同志的讲话,1971-07-11,1971-07
在朝鲜劳动党中央和朝鲜政府庆祝朝中友    好合作互助条约签订十周年宴会上李先念同志的讲话,1971-07-11,1971-07
前来参加中朝友好合作互助条约签订十周年庆祝活动    朝鲜平安北道友好代表团到沈阳    辽宁省革委会欢宴朝鲜战友    杨春甫副主任和朴勇观团长讲话,1971-07-11,1971-07
参加庆祝朝中友好合作互助条约签订十周年活动    辽宁省友好代表团去朝鲜,1971-07-11,1971-07
几内亚共和国总统杜尔致电毛主席    最诚挚祝贺中国共产党成立五十周年,1971-07-11,1971-07
阿尔及利亚民族解放阵线机构负责人致电中共中央    祝贺中国共产党成立五十周年,1971-07-11,1971-07
《纪念中国共产党五十周年》五种少数民族文字版本出版,1971-07-11,1971-07
中朝友好合作互助条约,1971-07-11,1971-07
坦噶尼喀非洲民族联盟青年团    祝贺中国共产党成立五十周年,1971-07-11,1971-07
中朝人民是不可战胜的,1971-07-11,1971-07
友谊的桥梁把我们紧密连在一起,1971-07-11,1971-07
战斗友谊开新花,1971-07-11,1971-07
在社会主义建设的大道上阔步前进,1971-07-11,1971-07
亚非乒乓球友好邀请赛发起国筹备会议圆满结束    邀请赛发起国通过筹备会议公报,1971-07-11,1971-07
阿尔巴尼亚足球队北京市足球队举行第二场友谊表演    受到首都八万观众的热烈欢迎,1971-07-11,1971-07
中国田径队去阿尔巴尼亚进行友好访问,1971-07-11,1971-07
应尼日利亚乒乓球协会邀请    中国乒乓球队到达尼日利亚进行友好访问,1971-07-11,1971-07
越南胡志明劳动青年团代表团越南南方    解放青年代表团离京回国,1971-07-11,1971-07
澳大利亚工党代表团离京去南方访问,1971-07-11,1971-07
中国社会主义建设成就展览会在布加勒斯特圆满闭幕,1971-07-11,1971-07
我赴罗马尼亚社会主义建设成就展览团团长回到北京,1971-07-11,1971-07
庆祝蒙古人民革命胜利五十周年    蒙驻华大使馆临时代办举行招待会,1971-07-11,1971-07
罗素和平基金会两位理事离京回国,1971-07-11,1971-07
柬国家元首西哈努克亲王发表第二十三号告高棉同胞书    （第一部分）,1971-07-11,1971-07
北京城区天气预报,1971-07-11,1971-07
中朝两党、两国人民的革命友谊和战斗团结万岁！    首都盛会庆祝中朝友好合作互助条约十周年    誓把反对美帝和日本军国主义斗争进行到底,1971-07-12,1971-07
充分显示朝中人民建立在马列主义和无产阶级国际主义基础上的    革命友谊和战斗团结平壤盛会庆祝朝中友好合作互助条约十周年    强烈谴责美日反动派的侵略政策和战争政策,1971-07-12,1971-07
毛主席语录,1971-07-12,1971-07
在首都人民庆祝中朝友好合作互助    条约签订十周年大会上姚文元同志的讲话,1971-07-12,1971-07
在首都人民庆祝中朝友好合作互助条约签订十周年大会上    金仲麟同志的讲话,1971-07-12,1971-07
在平壤举行的庆祝朝中友好合作互助条约签订十周年群众大会上    朴成哲同志的讲话,1971-07-12,1971-07
在平壤举行的庆祝朝中友好合作互助条约签订十周年群众大会上    李先念同志的讲话,1971-07-12,1971-07
周总理李作鹏副总参谋长郭沫若副委员长王新亭副总参谋长    会见参加亚非乒乓球友好邀请赛发起国筹备会议代表,1971-07-12,1971-07
朝鲜党政代表团参观北京石油化工总厂    金仲麟、金万金等贵宾在纪登奎和孙晓风同志陪同下来到工厂时，    受到数千名工人的热烈欢迎,1971-07-12,1971-07
沈阳长春丹东隆重集会庆祝中朝友好合作互助条约十周年    决心进一步巩固和加强中朝坚强同盟    为反对两国人民共同敌人而战斗到底,1971-07-12,1971-07
平壤举行大型团体操表演和大型音乐歌舞演出    热烈欢迎中国党政代表团    金一同志、吴振宇大将、杨亨燮同志等朝鲜领导人陪同观看,1971-07-12,1971-07
中朝友协、我对外友协与朝中友协互致贺电    热烈祝贺中朝友好合作互助条约十周年,1971-07-12,1971-07
我代表团向朝中苏烈士纪念塔献花圈    朝鲜人民军烈士、中国人民志愿军烈士、    在反法西斯战争中牺牲的苏联红军烈士永垂不朽,1971-07-12,1971-07
郭沫若副委员长会见后藤钾二等    同他们进行了友好的谈话,1971-07-12,1971-07
庆祝亚非乒乓球友好邀请赛发起国筹备会议圆满结束    我对外友协和体育总会举行招待会    郭沫若副委员长等出席  宾主在会上祝酒,1971-07-12,1971-07
阿联驻华大使设便宴招待    参加亚非乒乓球友好邀请赛发起国筹备会议的各国体育代表团,1971-07-12,1971-07
伟大的友谊  战斗的团结,1971-07-12,1971-07
北京城区天气预报,1971-07-12,1971-07
中朝两国党政领导同志在极其亲切友好气氛中会谈    就进一步加强中朝两党、两国和两国人民之间的战斗友谊和    革命团结以及共同关心的问题交换意见,1971-07-13,1971-07
柬埔寨国家元首西哈努克亲王  会见金仲麟团长金万金副团长等,1971-07-13,1971-07
中联部、外交部举行文艺晚会  热烈欢迎朝鲜党政代表团    金仲麟团长、金万金副团长等朝鲜战友和姚文元、    李作鹏、邱会作等同志一起观看了革命现代京剧《红灯记》,1971-07-13,1971-07
周恩来总理、黄永胜总参谋长会见几内亚军事代表团    同萨尼奥·马马迪团长等进行了亲切友好的谈话,1971-07-13,1971-07
周恩来纪登奎郭沫若同志会见日本工人访华团    宾主进行了友好的谈话,1971-07-13,1971-07
路线问题要经常讲反复讲    ——龙桥大队党支部对党员和群众进行党的基本路线教育的经验,1971-07-13,1971-07
毛主席语录,1971-07-13,1971-07
为提高路线斗争觉悟而认真看书学习,1971-07-13,1971-07
我们是怎样组织基层干部在干校读书的,1971-07-13,1971-07
把插队干部的学习领导好,1971-07-13,1971-07
下放劳动与认真读书,1971-07-13,1971-07
深入持久地开展革命大批判，推动教育革命不断前进,1971-07-13,1971-07
贫下中农批判“人性论”,1971-07-13,1971-07
世上没有无缘无故的爱,1971-07-13,1971-07
批臭“同族同姓一家亲”,1971-07-13,1971-07
戳穿“人格平等”的假面具,1971-07-13,1971-07
红星中朝友好人民公社隆重集会    庆祝中朝友好合作互助条约十周年    玄峻极大使等朝鲜驻中国大使馆的战友应邀出席,1971-07-13,1971-07
图们集会庆祝中朝友好合作互助条约十周年    决心在反对美日反动派的斗争中同朝鲜人民    团结战斗胜利在一起,1971-07-13,1971-07
我党政代表团由朴成哲、杨亨燮等同志陪同    参观平壤万景台金日成首相旧居    还参观访问了“红旗万景台革命学院”，观看学员射击表演,1971-07-13,1971-07
朝鲜《劳动新闻》发表社论庆祝朝中友好合作互助条约十周年    进一步加强朝中两党两国和两国人民战斗团结,1971-07-13,1971-07
英雄的朝鲜人民军在奋勇前进,1971-07-13,1971-07
地拉那举行盛大文艺晚会庆祝阿建军节    查尔查尼、巴卢库、托斯卡、穆夫蒂乌、    阿利雅等同志和数万军民参加    《人民之声报》发表社论号召军民加强战备增强防御能力,1971-07-13,1971-07
阿国防部长巴卢库就建军节发布命令    全国军民必须提高革命警惕，    把军事力量和战备提高到更高水平，    以便给敢于来犯的侵略者以应有的回击,1971-07-13,1971-07
朝鲜《劳动新闻》发表评论    谴责莱尔德窜到南朝鲜进行罪恶活动    美帝必须停止发动新战争的阴谋，    全部、无条件地从南朝鲜撤出去,1971-07-13,1971-07
几内亚杜尔总统接见我大使,1971-07-13,1971-07
苏丹尼迈里主席接见我大使,1971-07-13,1971-07
我驻伊拉克大使设宴    招待访华回国的伊拉克经济技术代表团,1971-07-13,1971-07
安哥拉人民解放运动青年代表团    离京去长沙、韶山、上海等地参观,1971-07-13,1971-07
后藤钾二会长等离京回国,1971-07-13,1971-07
朝鲜体育代表团离京回国,1971-07-13,1971-07
莱尔德窜到日本策划加强美日军事同盟    分别同佐藤、中曾根和增原进行密谈，为进一步利用    日本军国主义推行美帝对亚洲的侵略战争政策作了部署,1971-07-13,1971-07
北京城区天气预报,1971-07-13,1971-07
朝鲜人民的伟大领袖金日成同志接见    中国党政代表团进行极其亲切友好谈话,1971-07-14,1971-07
第九届巴勒斯坦全国委员会大会通过    法胡姆和阿拉法特致周总理的电报    对周总理的贺电以及中国政府和人民支持巴勒斯坦革命表示感谢,1971-07-14,1971-07
周恩来总理致电贝克尔总统    热烈祝贺伊拉克共和国国庆,1971-07-14,1971-07
参加上海人民庆祝中朝友好合作互助条约签订十周年活动    朝鲜党政代表团到达上海受到热烈欢迎,1971-07-14,1971-07
毛主席语录,1971-07-14,1971-07
一个重要的课题    ——关于大连钢厂提高劳动生产率、挖掘企业潜力的调查报告,1971-07-14,1971-07
抓革命促生产，不断提高劳动生产率,1971-07-14,1971-07
人的正确思想只能从社会实践中来,1971-07-14,1971-07
调查研究就是好,1971-07-14,1971-07
实践是获得真知的唯一源泉,1971-07-14,1971-07
勤劳出智慧  实践得真知,1971-07-14,1971-07
中共上海市委、上海市革委会举行文艺晚会    热烈欢迎朝鲜党政代表团    金仲麟金万金等朝鲜同志和张春桥等同志    一起观看革命现代舞剧《白毛女》,1971-07-14,1971-07
首钢工人集会庆祝中朝友好合作互助条约十周年    中朝人民用鲜血凝成的战斗友谊牢不可破    玄峻极大使等朝鲜驻华使馆的战友应邀出席,1971-07-14,1971-07
杭嘉湖平原春茧增产,1971-07-14,1971-07
五道水公社积极开办小药园,1971-07-14,1971-07
德庆县何首乌丰收,1971-07-14,1971-07
漳浦县发展龙舌兰生产,1971-07-14,1971-07
做毛主席的好社员,1971-07-14,1971-07
盛习友和我们相处的日子里,1971-07-14,1971-07
自觉执行毛主席的革命路线,1971-07-14,1971-07
菲律宾共产党中央写信给中共中央    最衷心祝贺中国共产党成立五十周年,1971-07-14,1971-07
比利时共产党（马列）中央写信给毛主席、林副主席和中共中央    热烈祝贺中国共产党成立五十周年,1971-07-14,1971-07
意大利东方出版社写信给中共中央    最热烈祝贺中国共产党成立五十周年,1971-07-14,1971-07
罗马尼亚《火花报》发表评论    最热烈祝贺中国共产党五十周年,1971-07-14,1971-07
英国工人、学生和旅英亚非拉工人、学生在伦敦集会    热烈庆祝中国共产党成立五十周年,1971-07-14,1971-07
奥地利马列主义党中央写信给中共中央    最衷心祝贺中国共产党成立五十周年,1971-07-14,1971-07
《毛泽东选集》第三卷意文版在意大利出版,1971-07-14,1971-07
热烈庆祝朝中友好合作互助条约签订十周年    朝鲜平安北道和两江道首府分别集会,1971-07-14,1971-07
赤道几内亚承认柬王国民族团结政府    马西亚斯总统接见沙林察外交大臣,1971-07-14,1971-07
阿拉伯联合共和国体育代表团回国,1971-07-14,1971-07
尼泊尔体育代表团离京去南方访问,1971-07-14,1971-07
毛里求斯体育代表团离京去南方访问,1971-07-14,1971-07
日本工人访华团离京去南方访问,1971-07-14,1971-07
瑞典中国友好联合会访华团到京,1971-07-14,1971-07
几内亚军事代表团团长举行告别宴会  马马迪团长讲话强调，    一切反帝国家有迫切责任互相支持对付帝国主义张才千副总长    讲话指出，代表团的访问将加强中几两国人民和军队友谊,1971-07-14,1971-07
中朝人民的革命传统友谊万古长青,1971-07-14,1971-07
北京城区天气预报,1971-07-14,1971-07
庆祝中朝友好合作互助条约签订十周年！    中朝两党、两国人民的战斗友谊万岁！    上海万人集会热烈欢迎朝党政代表团,1971-07-15,1971-07
由朴成哲、杨亨燮等同志陪同    中国党政代表团访问咸兴市受到十几万人隆重热烈欢迎,1971-07-15,1971-07
西哈努克亲王和宾努亲王分别会见阮维桢副总理    同阮维桢副总理进行了亲切友好的谈话,1971-07-15,1971-07
周恩来总理姬鹏飞代部长会见阮维桢副总理    同阮维桢副总理进行了亲切友好的谈话,1971-07-15,1971-07
阮维桢等同志回国途中到达北京    邱会作同志设宴招待越南同志,1971-07-15,1971-07
法国驻华大使举行国庆招待会    周总理、郭副委员长应邀出席    佩雷菲特率领的法议会代表团出席    马纳克大使和姬鹏飞代部长祝酒，    共祝中法友好关系不断巩固和加强,1971-07-15,1971-07
毛主席语录,1971-07-15,1971-07
在上海人民欢迎朝鲜党政代表团的大会上    张春桥同志的欢迎词,1971-07-15,1971-07
在上海人民欢迎朝鲜党政代表团的大会上    金仲麟同志的讲话,1971-07-15,1971-07
电业工人学大庆，“两论”指路写新篇    ——记江苏南通天生港发电厂自力更生制造发电设备的事迹,1971-07-15,1971-07
火焰山下绘新图    记新疆军区生产建设兵团某团化工一连发扬大庆精神艰苦创业的事迹,1971-07-15,1971-07
阿·佩雷菲特率法国议会代表团到京    郭沫若副委员长等会见法国议会代表团,1971-07-15,1971-07
朝人民军韩滢玉所属部队和朝中友谊合作农场分别集会    庆祝朝中友好合作互助条约十周年    韩滢玉何渠若在部队集会上讲话，    强调进一步发展两国人民的战斗团结,1971-07-15,1971-07
清华大学革命师生一千五百余人隆重集会    庆祝中朝友好合作互助条约十周年    玄峻极大使等朝鲜战友和石少华同志等有关方面负责人出席,1971-07-15,1971-07
郭沫若副委员长会见瑞典火炬社访华团,1971-07-15,1971-07
几内亚共和国军事代表团离京回国    张才千副总长等和解放军指战员以及民兵千余人去机场欢送    首都机场呈现中、几两国人民和军队的友好热烈气氛,1971-07-15,1971-07
阿尔及利亚新任驻华大使到京,1971-07-15,1971-07
马里国家元首特拉奥雷致电毛主席,1971-07-15,1971-07
亚非作家常设局执行书记处写信给中共中央,1971-07-15,1971-07
亚非新闻工作者协会书记处写信给中共中央,1971-07-15,1971-07
争取安哥拉彻底独立全国联盟中央    致电毛主席林副主席周总理,1971-07-15,1971-07
安哥拉人民解放运动主席内图致电中共中央,1971-07-15,1971-07
“马来亚革命之声”电台广播祝贺文章,1971-07-15,1971-07
加那利群岛争取自决和独立运动总书记致电中共中央,1971-07-15,1971-07
“泰国人民之声”电台广播祝贺文章,1971-07-15,1971-07
柬埔寨王国民族团结政府发言人发表声明    强烈谴责美帝及其西贡傀儡侵柬新罪行    人民武装力量痛击敌人六月下半月取得新战果,1971-07-15,1971-07
巴勒斯坦全国委员会谴责约旦反动当局阴谋消灭巴勒斯坦革命    巴勒斯坦革命力量决心粉碎敌人阴谋    游击队英勇反击约旦反动派大规模武装进攻,1971-07-15,1971-07
欢迎遭受美国非法逮捕和判刑的四名古巴渔民胜利归来    古巴首都哈瓦那数万群众举行集会,1971-07-15,1971-07
莱尔德窜到南朝鲜策划新的侵略阴谋    同朴正熙傀儡集团进行反革命活动，    加强日美朴军事勾结；窜到非军事区窥伺北方，    明目张胆地对朝鲜民主主义人民共和国进行挑衅,1971-07-15,1971-07
北京城区天气预报,1971-07-15,1971-07
衷心感谢朝鲜劳动党、政府和人民兄弟般的、    极其热情友好的欢迎和接待    中国党政代表团举行盛大告别宴会    金一、朴成哲、徐哲、杨亨燮同志等朝鲜战友应邀出席    李先念和金一同志讲话,1971-07-16,1971-07
庆祝朝中友好合作互助条约十周年！    朝中人民永远团结战斗胜利在一起！    咸兴群众集会热烈欢迎中国党政代表团,1971-07-16,1971-07
朝鲜党政代表团访问毛主席故乡韶山    中共湖南省委、省革委会举行宴会热烈欢迎金仲麟、    金万金等朝鲜同志  朝鲜战友由张春桥等同志陪同回到北京    吴法宪等同志到机场迎接,1971-07-16,1971-07
公告,1971-07-16,1971-07
毛主席语录,1971-07-16,1971-07
到大风大浪中锻炼身体锻炼意志,1971-07-16,1971-07
在中国党政代表团举行的告别宴会上    李先念同志的讲话,1971-07-16,1971-07
在中国党政代表团举行的告别宴会上    金一同志的讲话,1971-07-16,1971-07
阮维桢同志等离京回国    邱会作姬鹏飞等同志前往机场送行,1971-07-16,1971-07
在咸兴市群众大会上    玄武光同志的讲话,1971-07-16,1971-07
在咸兴市群众大会上    李德生同志的讲话,1971-07-16,1971-07
高举决战决胜的旗帜同老柬爱国军民配合作战    越南南方军民上半年歼敌十五万,1971-07-16,1971-07
美国五十万电话工人举行大罢工    这次全国规模的电话工人斗争，严重影响美国电话业务，    沉重打击美国垄断资本集团，    把目前美国工人罢工斗争推向新的高潮,1971-07-16,1971-07
充分发挥人民战争威力  英勇机智打击敌人    老挝爱国军民上半年歼敌近三万名    沉重打击了美帝及其走狗的侵略阴谋，进一步瓦解敌军,1971-07-16,1971-07
由朴成哲、玄武光、杨亨燮同志陪同    中国党政代表团参观朝鲜龙城机械厂    受到当地两万多群众夹道欢迎,1971-07-16,1971-07
充分利用设备能力  大力开展技术革新运动    朝鲜水泥生产取得很大成绩,1971-07-16,1971-07
热烈庆祝中朝友好合作互助条约签订十周年    解放军驻京部队某部隆重集会    玄峻极大使等朝鲜战友应邀出席,1971-07-16,1971-07
为建设社会主义新农村而斗争,1971-07-16,1971-07
第九届巴勒斯坦全国委员会大会胜利闭幕    选出巴勒斯坦解放组织执行委员会，阿拉法特任主席    发表重要声明重申巴勒斯坦人民坚持武装斗争直到胜利,1971-07-16,1971-07
庆祝把美国垄断资本霸占的铜矿收归国有    智利人民在兰卡瓜市举行盛大集会    阿连德总统在会上发表演说，揭露    美国垄断资本对智利铜的野蛮掠夺,1971-07-16,1971-07
郭沫若副委员长欢宴法国议会代表团    郭沫若讲话，中国人民反对超级大国主    宰世界并主张各国事务应由各国人民自己解决    阿·佩雷菲特讲话强调，法国坚持民族独立原则,1971-07-16,1971-07
智利议会在广大人民强烈要求下通过宪法修改草案    授权政府把美资霸占的铜矿收归国有,1971-07-16,1971-07
中国田径队抵达地拉那,1971-07-16,1971-07
我边境贸易代表团    访问巴基斯坦吉尔吉特特区,1971-07-16,1971-07
老挝爱国青年代表团离京回国,1971-07-16,1971-07
中国赴朝旅行参观团离京,1971-07-16,1971-07
苏丹社会主义联盟全国代表大会筹备委员会代表团到达北京,1971-07-16,1971-07
西南非人民组织青年代表团离京,1971-07-16,1971-07
瑞典火炬社访华团离京回国,1971-07-16,1971-07
北京城区天气预报,1971-07-16,1971-07
全国军民庆祝伟大领袖毛主席又一次畅游长江五周年    响应毛主席伟大号召到大风大浪中锻炼身体锻炼意志    沿着毛主席革命路线在三大革命运动实践中破浪前进,1971-07-17,1971-07
玄峻极大使为庆祝朝中友好合作互助条约    十周年和朝党政代表团访华举行宴会    加强朝中兄弟同盟粉碎美日反动派侵略阴谋,1971-07-17,1971-07
