平壤举行大型团体操表演    热烈欢迎西哈努克亲王和夫人    金日成同志和夫人等陪同观看了表演,1971-07-25,1971-07
布特弗利卡部长举行宴会    周总理李先念副总理姬鹏飞代部长和宾努首相等应邀出席,1971-07-25,1971-07
周恩来、张春桥同志会见韩丁、雷洲安等美国朋友    同他们进行了亲切友好的谈话,1971-07-25,1971-07
毛主席语录,1971-07-25,1971-07
在欢迎西哈努克亲王的盛大宴会上    金日成首相的讲话,1971-07-25,1971-07
在金日成首相举行的盛大欢迎宴会上    西哈努克亲王的讲话,1971-07-25,1971-07
在布特弗利卡部长举行的宴会上    布特弗利卡部长的讲话,1971-07-25,1971-07
在布特弗利卡部长举行的宴会上    李先念副总理的讲话,1971-07-25,1971-07
认真落实毛主席关于“要把黄河的事情办好”的伟大指示    河南山东沿黄河地区加强防汛准备工作,1971-07-25,1971-07
兄弟同盟  革命情深    ——记朝鲜党政代表团在中国,1971-07-25,1971-07
应我国政府邀请前来进行友好访问    塞拉勒窝内政府代表团到达上海,1971-07-25,1971-07
宾努首相会见布特弗利卡部长    会见在亲切友好的气氛中进行,1971-07-25,1971-07
李先念副总理、曹鲁副部长会见罗马尼亚食品生产考察团,1971-07-25,1971-07
伟大的友谊  坚强的决心,1971-07-25,1971-07
日本社会党委员长成田致函郭沫若副委员长    强调只有一个中国，必须废除日蒋条约,1971-07-25,1971-07
日本社会党和公明党议员在国会质询佐藤    揭露和批判佐藤政府顽固坚持敌视中国的政策,1971-07-25,1971-07
简讯,1971-07-25,1971-07
《老挝爱国报》就关于老挝问题的日内瓦协议签订九周年发表社论    坚决斗争，战胜美帝侵略者及其走狗    强烈谴责美帝竭力扩大和强化侵略老挝的战争,1971-07-25,1971-07
柬国家元首西哈努克亲王会见伊拉克驻朝鲜大使,1971-07-25,1971-07
罗马尼亚《火花报》就印度支那问题的    日内瓦协议十七周年发表文章    坚决支持越南和印度支那人民的正义斗争    强调越南南方共和的七点建议具有重大意义,1971-07-25,1971-07
朝鲜人民英勇的反美斗争,1971-07-25,1971-07
朴正熙傀儡集团的法西斯统治,1971-07-25,1971-07
美日朴反革命军事同盟,1971-07-25,1971-07
双重走狗朴正熙,1971-07-25,1971-07
北京城区天气预报,1971-07-25,1971-07
抓好这件带根本性的大事    ——张家口市宣化砖瓦厂干部是怎样坚持参加集体生产劳动的,1971-07-26,1971-07
金日成首相同西哈努克亲王举行会谈    双方就共同关心的问题交换了意见，并取得了完全一致的看法。    会谈是在战斗团结和热烈的兄弟般的友好气氛中进行的,1971-07-26,1971-07
金日成首相和夫人陪同西哈努克亲王和夫人    观看朝鲜革命民族歌剧《血海》,1971-07-26,1971-07
周恩来总理致电卡斯特罗总理热烈祝贺古巴全国起义日十八周年,1971-07-26,1971-07
卡马拉—泰勒部长率政府代表团到京    李先念副总理设宴欢迎塞拉勒窝内贵宾,1971-07-26,1971-07
李先念副总理等同卡马拉—泰勒部长等举行会谈,1971-07-26,1971-07
毛主席语录,1971-07-26,1971-07
天津市就地取材土法上马发展小水泥工业,1971-07-26,1971-07
太原市基本实行“四合一”环形供电,1971-07-26,1971-07
学大庆，领导班子必须革命化,1971-07-26,1971-07
在欢迎塞拉勒窝内共和国政府代表团宴会上    李先念副总理的讲话,1971-07-26,1971-07
在李先念副总理举行的欢迎宴会上    卡马拉—泰勒团长的讲话,1971-07-26,1971-07
中非友协和对外友协举办音乐晚会    欢迎阿尔及利亚政府代表团和塞拉勒窝内政府代表团    李先念副总理姬鹏飞代部长方毅部长等陪同    两国贵宾欣赏了演出,1971-07-26,1971-07
祖国的雄鹰,1971-07-26,1971-07
军民团结之花开遍祖国边疆,1971-07-26,1971-07
老挝爱国战线党中央就关于老挝    问题的日内瓦协议签订九周年发表声明    老挝人民不怕一切牺牲决心打败美国侵略者,1971-07-26,1971-07
金日成首相赠送柬埔寨的医药品转交仪式在平壤举行,1971-07-26,1971-07
粉碎敌军“扫荡”  狠狠打击“蚕食”进攻的敌人    老挝爱国军民英勇战斗不断取得新战果,1971-07-26,1971-07
朝鲜外务省发言人谴责美帝及其走狗对老挝的    新侵略罪行朝鲜人民坚决支援老挝人民    抗美救国战争美帝侵略者必须立即停止    对老挝人民的一切侵略行径，撤出老挝,1971-07-26,1971-07
美帝加紧在老挝和柬埔寨的侵略活动    不断指使泰国部队和西贡伪军进行侵略，    甚至出动美国空军直接配合和参与罪恶活动,1971-07-26,1971-07
不断挫败美帝颠覆干涉和经济封锁    坚决维护民族独立和国家主权    古巴人民在反对美帝侵略斗争中奋勇前进,1971-07-26,1971-07
美国数十万工人掀起罢工斗争新高潮    罢工斗争互相呼应，猛烈地冲击着垄断资本集团的反动统治    铁路工人罢工规模不断扩大，参加罢工人数已达十二万五千,1971-07-26,1971-07
阿联总统萨达特发表讲话    谴责约旦当局镇压巴勒斯坦游击队,1971-07-26,1971-07
为我国男子篮球队送行    古巴全国体育运动文娱委员会举行招待会,1971-07-26,1971-07
我人民外交学会会长张奚若举行宴会    欢迎加拿大进步保守党领袖斯坦菲尔德,1971-07-26,1971-07
加拿大政府总理特鲁多接见我粮油食品进出口公司代表团,1971-07-26,1971-07
北京城区天气预报,1971-07-26,1971-07
古巴“七·二六”全国起义日,1971-07-26,1971-07
坚决同巴勒斯坦人民站在一起,1971-07-26,1971-07
迎接伟大的人民解放军建军四十四周年    全国各地广泛开展拥军爱民活动,1971-07-27,1971-07
在金日成首相和夫人陪同下    西哈努克亲王和夫人访问元山受到欢迎,1971-07-27,1971-07
毛主席语录,1971-07-27,1971-07
英雄的朝鲜人民是不可战胜的    ——纪念朝鲜祖国解放战争胜利十八周年,1971-07-27,1971-07
永远拿起批评和自我批评的武器,1971-07-27,1971-07
姬鹏飞代部长、李强副部长同卡马拉—泰勒部长等继续举行会谈,1971-07-27,1971-07
塞拉勒窝内政府代表团参观北京市木材厂,1971-07-27,1971-07
西哈努克亲王夫人在平壤参观访问    同朝鲜民主妇女同盟负责人和平壤妇女干部举行座谈会,1971-07-27,1971-07
截瘫病人终于站起来了    ——学习和运用毛主席哲学思想指导治疗截瘫病的一些体会,1971-07-27,1971-07
批判锦标主义的反动性,1971-07-27,1971-07
坚持“友谊第一”  反对锦标主义,1971-07-27,1971-07
锦标主义必须批判,1971-07-27,1971-07
在平定、茶荣、美萩等省连续出击越南南方军民英勇战斗取得新战果,1971-07-27,1971-07
前柬埔寨王国驻伦敦大使馆二等秘书宾纳先生到京宣布参加柬民族统一阵线,1971-07-27,1971-07
苏丹武装部队粉碎一次军事政变以尼迈里主席为首的苏丹政府重新控制了局势,1971-07-27,1971-07
莱尔德对中国和亚洲人民进行疯狂挑衅,1971-07-27,1971-07
革命自有后来人,1971-07-27,1971-07
要求充分就业、改善生活条件和工作条件    意大利两百万工人罢工和示威,1971-07-27,1971-07
反对反动当局镇压  争取民主权利    北爱尔兰人民不断展开斗争,1971-07-27,1971-07
澳大利亚二十五万五金工人罢工,1971-07-27,1971-07
阿根廷工人、学生举行集会示威,1971-07-27,1971-07
西德农民集会示威要求改善生活,1971-07-27,1971-07
坚决反对种族歧视和种族压迫    美国少数民族人民展开抗暴斗争,1971-07-27,1971-07
郭沫若副委员长、张奚若会长会见加进步保守党领袖斯坦菲尔德,1971-07-27,1971-07
中非友协举行宴会欢迎安哥拉人民解放运动代表团,1971-07-27,1971-07
罗马尼亚食品生产考察团离京回国,1971-07-27,1971-07
我外交部代部长姬鹏飞设宴欢迎    赞比亚总统特别助理马克·乔纳,1971-07-27,1971-07
法国议会代表团访问上海    上海市革委会副主任徐景贤设宴欢迎代表团,1971-07-27,1971-07
锡兰国营纺织公司宴请我纺织技术工作组,1971-07-27,1971-07
报眼口号,1971-07-27,1971-07
北京城区天气预报,1971-07-27,1971-07
中共兰州市委坚决落实毛主席    关于“要认真读书”的教导    加强对县以上干部学习的领导,1971-07-28,1971-07
朝鲜劳动党江原道委员会和江原道人民委员会举行宴会    欢迎西哈努克亲王和夫人    金日成首相和夫人出席  金义淳同志和西哈努克亲王讲话,1971-07-28,1971-07
阿尔及利亚政府代表团离京去延安等地访问    李先念副总理等和数千革命群众到机场热烈    欢送布特弗利卡部长等贵宾,1971-07-28,1971-07
金在淑临时代办举行宴会庆祝朝鲜    祖国解放战争胜利十八周年,1971-07-28,1971-07
毛主席语录,1971-07-28,1971-07
在继续革命的征途上    ——记人民解放军部分领导干部朝气蓬勃干革命的先进事迹,1971-07-28,1971-07
吕大娘热爱子弟兵,1971-07-28,1971-07
顶风迎浪送亲人,1971-07-28,1971-07
军民友谊田,1971-07-28,1971-07
加强领导  狠抓路线教育    赣州地区大力发展日用工业生产,1971-07-28,1971-07
中华人民共和国政府和阿尔及利亚民主人民共和国政府    经济技术合作协定签字,1971-07-28,1971-07
战斗在西藏高原上的无产阶级先锋战士,1971-07-28,1971-07
报眼口号,1971-07-28,1971-07
关心革命队伍的每一个人    ——记甘肃安口煤矿老工人、矿党委副书记邬大伍的事迹,1971-07-28,1971-07
苏发努冯亲王就“声援越南人民月”致电    孙德胜主席阮友寿主席黄晋发主席    老挝人民决心同越柬人民一道打败美帝重申支持越南南方共和    七点建议，要美军无条件地全部撤出越南南方,1971-07-28,1971-07
吉春大臣等访问开城市受到热烈欢迎    朝鲜停战委员会朝中方面首席委员韩滢玉少将宴请柬埔寨贵宾,1971-07-28,1971-07
越南南方共和外交部发表声明    谴责美帝及其走狗侵犯查尔平原—川圹地区,1971-07-28,1971-07
柬王国民族团结政府外交大臣沙林察到达北京,1971-07-28,1971-07
阿尔巴尼亚足球队在沈阳友好访问后回京    陈锡联同志等观看阿足球队同辽宁省足球队的精采友谊表演,1971-07-28,1971-07
为欢送阿尔巴尼亚足球队    我国家体委举行游园联欢会,1971-07-28,1971-07
阿联政府贸易代表团到达北京    白相国部长等到机场欢迎,1971-07-28,1971-07
郭沫若副委员长会见奥地利朋友,1971-07-28,1971-07
我外交部代部长姬鹏飞会见    加进步保守党领袖斯坦菲尔德斯坦菲尔德离京去我国南方访问,1971-07-28,1971-07
英中了解协会学生青年访华团到京,1971-07-28,1971-07
胜利结束声援朝鲜人民反美斗争月    越南祖国战线中央等在河内隆重集会    陈琳秘书长讲话谴责美帝加紧拉拢    日本军国主义策划反对朝鲜的新战争,1971-07-28,1971-07
尼雷尔总统发表新闻公报    驳斥阿明关于坦桑军队“入侵”乌干达的谎言    指出没有任何中国人越过坦桑—乌干达边界,1971-07-28,1971-07
就乌干达总统阿明攻击中国一事    我驻乌干达大使馆临时代办提出抗议,1971-07-28,1971-07
坦桑总统办公室国务部长指出    坦桑政府继续支持各国人民斗争,1971-07-28,1971-07
远方战友的札记    ——记阿尔巴尼亚“拉比诺特”足球队在北京,1971-07-28,1971-07
北京城区天气预报,1971-07-28,1971-07
朝鲜人民的伟大胜利,1971-07-28,1971-07
中共台安县委发扬理论联系实际的革命学风    把读书同调查研究和总结经验结合起来,1971-07-29,1971-07
认真落实党的知识分子政策    上海国棉十二厂党委帮助工程技术人员改造旧思想、旧作风，    提高路线斗争觉悟，在社会主义革命和社会主义建设中发挥作用,1971-07-29,1971-07
毛主席语录,1971-07-29,1971-07
自由飞翔在万里海空    ——记海军航空兵某部一等功荣立者、飞行中队长魏智英,1971-07-29,1971-07
时刻把群众放在心上,1971-07-29,1971-07
疾风怒涛  心红眼亮    ——记福建前线人民解放军某部观察所,1971-07-29,1971-07
人民的勤务员  群众的小学生    ——记宁夏吴忠县立新公社党委书记、革委会主任杨永山,1971-07-29,1971-07
李先念副总理白相国部长    会见并宴请阿联政府贸易代表团,1971-07-29,1971-07
塞拉勒窝内政府代表团访问北京部队某部    受到广大指战员的热烈欢迎,1971-07-29,1971-07
狠抓两条路线斗争  做好冶金地质工作,1971-07-29,1971-07
为革命认真找矿,1971-07-29,1971-07
粉碎美帝及其走狗的多次“扫荡”    取得具有战略意义的伟大胜利    柬爱国军民旱季战斗歼敌七万五千    越南《人民报》等热烈欢呼柬埔寨军民所取得的辉煌战果,1971-07-29,1971-07
声援越南人民抗美救国斗争    老挝爱国战线党中央在桑怒隆重集会,1971-07-29,1971-07
英勇反击来犯之敌    老挝川圹省爱国军民歼敌六百余        川圹省委主席涅乌强烈谴责美帝及其走狗进攻川圹解放区,1971-07-29,1971-07
四处出击  不断获胜    泰国爱国军民在南、北和东北部袭击敌人,1971-07-29,1971-07
沙捞越人民武装力量不断取得新胜利,1971-07-29,1971-07
在各族人民支持下坚决反击敌人“围剿”    马来亚民族解放军战斗在霹雳州,1971-07-29,1971-07
广泛开展人民游击战争    越南南方各地军民取得新战果,1971-07-29,1971-07
朝《劳动新闻》发表社论纪念朝鲜祖国解放战争胜利十八周年    朝中人民团结战斗反对美帝和日本军国主义,1971-07-29,1971-07
面对美帝和约旦反动派的残酷镇压    巴勒斯坦游击队浴血奋战抗击敌军                《法塔赫报》指出，只要坚持人民战争，就能克服暂时困难,1971-07-29,1971-07
阿尔巴尼亚“拉比诺特”足球队离京回国,1971-07-29,1971-07
黄华大使向加拿大副总督递交国书,1971-07-29,1971-07
法国议会代表团访问杭州,1971-07-29,1971-07
柬埔寨外交大臣沙林察    会见塞拉勒窝内外交部长普拉特,1971-07-29,1971-07
热烈庆祝全国起义日十八周年    古巴首都数十万群众举行盛大集会,1971-07-29,1971-07
简讯,1971-07-29,1971-07
北京城区天气预报,1971-07-29,1971-07
湖南汨罗公社党委成员坚持深入三大革命斗争第一线    真心诚意地向群众学习  自觉改造世界观,1971-07-30,1971-07
周恩来总理方毅部长李强副部长    会见塞拉勒窝内共和国政府代表团    宾主进行了亲切友好的谈话,1971-07-30,1971-07
周恩来总理会见并宴请    荷兰电影导演、法国电影工作者和作家    同荷兰、法国朋友进行了友好的谈话,1971-07-30,1971-07
中共福建省南靖县委领导成员遵照毛主席教导坚持群众路线    从群众中吸取政治营养  提高领导水平,1971-07-30,1971-07
毛主席语录,1971-07-30,1971-07
朝阳起宏图    ——记朝阳地委书记、朝阳军分区政委王吉道同志和群众一起改变地区面貌的斗争,1971-07-30,1971-07
用毛泽东思想改造大学文科,1971-07-30,1971-07
坚持以毛主席的著作为基本教材,1971-07-30,1971-07
学习马列主义要联系实际,1971-07-30,1971-07
练笔先炼思想,1971-07-30,1971-07
浙江省二十七个县、市发现天然气,1971-07-30,1971-07
李先念、谢华同志会见越南东医考察团    同越南同志进行了十分亲切友好的谈话,1971-07-30,1971-07
工业简讯,1971-07-30,1971-07
接受新事物  研究新问题,1971-07-30,1971-07
柬埔寨王国民族团结政府发言人发表声明    严厉谴责美帝及其走狗新的战争罪行,1971-07-30,1971-07
美国一些报刊和议员发表评论和讲话    美国应该接受七点建议尽快结束侵越战争    要求尼克松明确宣布美军全部撤出越南南方的期限,1971-07-30,1971-07
就美国抛售囤积的橡胶    泰、马、印尼将联合向美提出抗议,1971-07-30,1971-07
冲破重重阻挠  继续反对垄断资本剥削    美国铁路和码头工人坚持罢工    工人的斗争沉重打击了垄断资本，五分之一的铁路线瘫痪,1971-07-30,1971-07
为了挽救在亚洲的败局和摆脱内外交困的处境    美帝阴谋进一步起用日本军国主义侵略亚洲,1971-07-30,1971-07
阿尔巴尼亚斯大林城军民隆重集会    赛沃同志和丁山同志讲话共颂阿中人民和军队的战斗友谊,1971-07-30,1971-07
罗马尼亚武装部队部举行集会    约内尔上将和林千武官讲话共颂    罗中人民和军队的战斗友谊,1971-07-30,1971-07
朝鲜民族保卫省举行隆重集会    金铁万上将和王育智武官讲话共颂朝    中人民和军队的战斗友谊    朝人民军空军朴南亨所属部队集会庆祝我建军节,1971-07-30,1971-07
热烈欢迎阿拉伯也门共和国外交部次长访华    我外交部副部长李耀文举行宴会    宾主讲话共颂两国人民友好合作关系不断发展,1971-07-30,1971-07
阿尔及利亚政府代表团访问延安西安,1971-07-30,1971-07
北京城区天气预报,1971-07-30,1971-07
遵照伟大领袖毛主席关于“认真看书学习，    弄通马克思主义”的指示    解放军广大干部紧密联系实际认真读书    带领部队朝气蓬勃地沿着毛主席的革命路线胜利前进,1971-07-31,1971-07
关于中华人民共和国和塞拉勒窝内    共和国建立外交关系的公报,1971-07-31,1971-07
中塞两国建立外交关系公报在京签字    两国经济技术合作协定、贸易支付协定同时签字    周总理、李副总理、卡马拉—泰勒部长等出席签字仪式,1971-07-31,1971-07
第七、八期《人民画报》合刊和《解放军画报》合刊即将出版    突出地歌颂伟大领袖毛主席的英明领导    突出地歌颂毛主席革命路线的伟大胜利,1971-07-31,1971-07
塞拉勒窝内共和国政府代表团    访问中华人民共和国公报,1971-07-31,1971-07
塞拉勒窝内政府代表团离开北京前往朝鲜访问    李先念姬鹏飞方毅李强等同志和革命群众到机场    欢送卡马拉—泰勒部长等贵宾,1971-07-31,1971-07
毛主席语录,1971-07-31,1971-07
永远是一个战斗队    ——记在保卫祖国战斗岗位上的人民解放军指战员,1971-07-31,1971-07
西双版纳的拥军爱民新歌,1971-07-31,1971-07
朝中方面首席委员在朝鲜军停会会议上    严厉谴责美帝侵略和战争政策向敌方提出七点强烈要求,1971-07-31,1971-07
在视察康斯坦察同当地党的干部会见大会上    齐奥塞斯库同志发表讲话,1971-07-31,1971-07
阿国防部举行隆重集会热烈庆祝我建军节    梅罗同志和丁山同志讲话共颂阿中两国人民和军队之间的战斗友谊,1971-07-31,1971-07
宾努首相和柬王国民族团结政府其他成员    参观我《光辉的〈五·七指示〉万岁》展览,1971-07-31,1971-07
马列主义党和兄弟组织的同志、各国驻华使节和武官等    参观我《光辉的〈五·七指示〉万岁》展览,1971-07-31,1971-07
法国议会代表团访问南京,1971-07-31,1971-07
大西洋,1971-07-31,1971-07
西非国家    塞拉勒窝内,1971-07-31,1971-07
美日对南朝鲜的经济控制和掠夺,1971-07-31,1971-07
次大陆,1971-07-31,1971-07
北京城区天气预报,1971-07-31,1971-07
