朝鲜党政代表团离开北京回到平壤    黄永胜姚文元吴法宪李作鹏纪登奎郭沫若等同志    到机场热烈欢送金仲麟金万金等朝鲜战友，    李先念李德生等同志在机场送行,1971-07-17,1971-07
中国党政代表团离开平壤回到北京    金一、朴成哲、吴振宇、徐哲、杨亨燮等同志到平壤机场热烈欢送    黄永胜、姚文元、吴法宪、李作鹏、    纪登奎、郭沫若等同志到机场迎接,1971-07-17,1971-07
毛主席语录,1971-07-17,1971-07
在玄峻极大使举行的宴会上    金仲麟同志的讲话,1971-07-17,1971-07
在玄峻极大使举行的宴会上    黄永胜同志的讲话,1971-07-17,1971-07
阿雷姆大使举行招待会    庆祝伊拉克共和国国庆    李先念副总理郭沫若副委员长等应邀出席,1971-07-17,1971-07
中朝人民友谊谱新歌,1971-07-17,1971-07
曹村公社党委和革委会遵循毛主席的教导    认真抓好干部参加集体生产劳动,1971-07-17,1971-07
坚持实践第一  认真搞好调查研究    中共平和县委和县革委会领导成员深入实际调查研究，    取得领导革命和生产的主动权,1971-07-17,1971-07
老挝爱国战线党中央主席苏发努冯亲王致函富马亲王    谴责美帝及其走狗扩大侵略战争罪行,1971-07-17,1971-07
我国领土南沙群岛不容侵犯    菲律宾当局公然派兵占领我南沙群岛的中业岛等岛屿    西贡傀儡集团也妄图混水摸鱼，侵占我国领土,1971-07-17,1971-07
庆祝朝中友好合作互助条约签订十周年    朝鲜各地纷纷集会和开展各种友好活动,1971-07-17,1971-07
朝鲜两江道友好代表团离长春回国    代表团在参观访问时受到广大革命群众的热烈欢迎,1971-07-17,1971-07
为亚非记协第六期亚非记者训练班结业    亚非记协总书记查禾多举行招待会    查禾多和石少华讲话，    祝刚果同行们为亚非人民团结反帝事业作出贡献,1971-07-17,1971-07
郭沫若副委员长会见秘鲁客人    同他进行了友好的谈话,1971-07-17,1971-07
尼日利亚第二届全国乒乓球    公开锦标赛在拉各斯举行开幕式,1971-07-17,1971-07
我乒乓球队拜访尼日利亚国家体育委员会主席,1971-07-17,1971-07
中国银行代表团访问越南,1971-07-17,1971-07
阿拉法特主席发表给全体巴勒斯坦突击队的公开信    盛赞突击队英勇抗击约旦反动派进攻    巴勒斯坦解放组织执委会谴责约旦当局血腥镇压突击队,1971-07-17,1971-07
第九届巴勒斯坦全国委员会全体会议通过建议    反对“政治解决”办法  重申坚持武装斗争    谴责约旦政权执行否认巴勒斯坦革命的反动政策,1971-07-17,1971-07
科威特和叙利亚发表联合声明    支持巴勒斯坦抵抗运动,1971-07-17,1971-07
太平洋,1971-07-17,1971-07
美国的领土扩张,1971-07-17,1971-07
关税和关税同盟,1971-07-17,1971-07
长岛,1971-07-17,1971-07
北京城区天气预报,1971-07-17,1971-07
解放军驻上海空军部队党委加强对支左领导干部进行    民主集中制教育    认真实行毛主席亲自倡导的民主集中制的组织原则,1971-07-18,1971-07
实行民主集中制  加强党委的集体领导    平顺县委进一步增强革命团结，带领全县人民不断胜利前进,1971-07-18,1971-07
充分发挥党委“一班人”的积极性    淮南谢三矿党委坚持贯彻执行党的民主集中制,1971-07-18,1971-07
毛主席语录,1971-07-18,1971-07
徐淮平原大寨花    ——记新沂县后行大队沿着毛主席的革命路线改天换地的事迹,1971-07-18,1971-07
切实加强领导  认真执行政策    四川浙江超额完成夏粮征购和油料收购任务    山东聊城地区正确处理国家、集体、个人三者关系，踊跃交售余粮,1971-07-18,1971-07
海安县实现一人一猪,1971-07-18,1971-07
北义城公社养猪成绩大,1971-07-18,1971-07
清丰县基层供销社办生猪繁殖场,1971-07-18,1971-07
捍卫毛主席革命路线的战斗堡垒    ——记甘肃省礼县崖城公社何家庄大队党支部,1971-07-18,1971-07
柬埔寨国家元首西哈努克亲王接见法国议会代表团团长佩雷菲特等,1971-07-18,1971-07
革命现代舞剧彩色影片《红色娘子军》在    港澳上映受到广大爱国同胞热烈欢迎,1971-07-18,1971-07
在革命斗争中凝成的战斗友谊万岁    ——朝鲜彩色纪录影片《兄弟的中国人民的使者》    《中国人民友好代表团访问朝鲜》观后,1971-07-18,1971-07
战友颂    ——朝鲜故事影片《战友》观后,1971-07-18,1971-07
在看得见和看不见的战线上    ——《看不见的战线》《南江村的妇女》观后,1971-07-18,1971-07
光辉的形象  战斗的颂歌    ——朝鲜故事影片《南江村的妇女》观后,1971-07-18,1971-07
朝鲜劳动党员的光辉典型,1971-07-18,1971-07
阿尔巴尼亚、阿尔及利亚等十八国提出提案    要求恢复中国在联合国的一切权利    立即把蒋介石集团从联合国及其一切所属组织中驱逐出去,1971-07-18,1971-07
粉碎垄断资本集团的破坏和迫害    美国五十万电话工人坚持罢工斗争    三万名铁路工人罢工严重影响美国南部和西部铁路运输,1971-07-18,1971-07
老挝爱国中立力量联盟、亚非拉人民团结组织执行    书记处分别声明热烈支持越南南方共和七点建议    南斯拉夫外交部发言人指出七点建议具有重要意义并表示欢迎,1971-07-18,1971-07
老挝爱国战线党中央发表声明    谴责美帝及其走狗大举侵犯查尔平原—川圹地区,1971-07-18,1971-07
智利宪法修正案正式生效    把美国垄断资本集团霸占的大铜矿收归国有,1971-07-18,1971-07
美国国债猛增到近四千亿美元    一九七一财政年度是二次大战后国债增加最多的一年,1971-07-18,1971-07
美国生活费用急剧上涨    五月份是十五个月以来生活费用增长幅度最大的一个月,1971-07-18,1971-07
美国五百五十万人失业    六月份失业人数达到了一九六一年七月以来的最高峰,1971-07-18,1971-07
阿中两国田径队举行盛大友谊表演    查尔查尼、巴卢库、穆夫蒂乌、阿利雅、科列加等同志出席观看    多达和宋冠杰先后讲话共颂两国人民和两国运动员的革命友谊,1971-07-18,1971-07
朝鲜千里马黄海钢铁厂等单位隆重集会    庆祝朝中友好合作互助条约十周年    朝鲜战友和我使馆人员讲话共颂两国人民和军队的战斗友谊,1971-07-18,1971-07
阿尔及利亚新任驻华大使向董必武副主席递交国书,1971-07-18,1971-07
为法国议会代表团访问中国    法国驻华大使马纳克举行招待会    郭沫若副委员长和姬鹏飞代外长等应邀出席,1971-07-18,1971-07
阿尔巴尼亚足球队访问上海后去长沙    在上海期间受到革命群众热烈欢迎,1971-07-18,1971-07
朝鲜运输代表团到京,1971-07-18,1971-07
朝鲜平安北道友好代表团离沈阳回国    代表团在参观访问时受到各地革委会负责人和革命群众热烈欢迎,1971-07-18,1971-07
越南地方经济考察团访问大寨    受到陈永贵等负责同志和广大社员热烈欢迎,1971-07-18,1971-07
在朝鲜参加朝中友好合作互助条约十周年庆祝活动后    辽宁省吉林省友好代表团分别回到沈阳长春,1971-07-18,1971-07
北京城区天气预报,1971-07-18,1971-07
毛主席无产阶级卫生路线和科研路线的伟大胜利    我国医务工作者和科学工作者创造成功针刺麻醉,1971-07-19,1971-07
周恩来总理郭沫若副委员长会见法国议会代表团,1971-07-19,1971-07
中西医结合的光辉范例    ——欢呼我国创造成功针刺麻醉,1971-07-19,1971-07
毛主席语录,1971-07-19,1971-07
批判孔丘的教育思想,1971-07-19,1971-07
解放军某部驻吴忠县支左人员深入三大革命斗争实际    运用阶级分析的方法进行调查研究,1971-07-19,1971-07
李先念副总理韩宗正副部长    会见越南海防市工业参观团,1971-07-19,1971-07
姚文元、纪登奎同志会见刚果记者学习团,1971-07-19,1971-07
群众办矿简讯,1971-07-19,1971-07
正确处理群众办矿的三个关系,1971-07-19,1971-07
不可忽视小富矿,1971-07-19,1971-07
希望加强对群众采矿的领导,1971-07-19,1971-07
进一步深入开展社会主义革命和建设    阿公布发展经济和文化新五年计划指示草案    《人民之声报》说指示草案标志着阿朝着社会主义前进的宏伟步骤,1971-07-19,1971-07
讨论对青年工人进行阶级教育问题    阿工会和劳动青年联盟举行会议,1971-07-19,1971-07
在劳动党领导下积极开展社会主义竞赛    阿工农业战线取得新成就,1971-07-19,1971-07
欢呼取得的伟大胜利  决心彻底战胜美帝及其走狗    柬埔寨爱国军民在解放区集会,1971-07-19,1971-07
给垄断资本集团以有力的打击    美国数万名工人坚持罢工斗争,1971-07-19,1971-07
越南民主共和国外交部发言人    谴责美帝袭击越南北方领土,1971-07-19,1971-07
沙林察率柬政府代表团访罗    齐奥塞斯库主席接见并宴请代表团,1971-07-19,1971-07
保加利亚第六届国民议会举行首次会议    选出国民议会主席、国务委员会主席和部长会议主席,1971-07-19,1971-07
谴责约旦反动派镇压游击队  决心继续进行武装斗争    叙利亚数万巴勒斯坦群众举行盛大示威    游行示威群众愤怒高呼：“我们的敌人是美帝、    犹太复国主义和他们的走狗”,1971-07-19,1971-07
一些阿拉伯国家的政党、群众团体、公众舆论    痛斥约旦反动派镇压巴勒斯坦游击队,1971-07-19,1971-07
阿尔及利亚全国革命委员会和政府发表声明    谴责约旦反动派武装进攻巴勒斯坦抵抗运动    紧急呼吁阿拉伯国家具体支援巴勒斯坦革命,1971-07-19,1971-07
伊拉克外交部长召见约旦驻伊大使    要求立即停止对突击队的军事行动,1971-07-19,1971-07
朝鲜人民军军官和战斗英雄畅谈朝中两国军队的战斗友谊    朝中两国军队战斗团结坚如磐石    美日反动派胆敢发动新侵略战争，必将遭到彻底失败,1971-07-19,1971-07
冰岛新政府发表政策声明宣布    将关闭北大西洋集团的庞大军事基地    要求美国分阶段撤走它在基地上的驻军,1971-07-19,1971-07
坦桑尼亚击落入侵葡机一架    第二副总统卡瓦瓦就此警告葡萄牙殖民主义者,1971-07-19,1971-07
越南地方经济考察团访问遵化县,1971-07-19,1971-07
我旅游局代表团离河内回国,1971-07-19,1971-07
我旅行参观团到达平壤,1971-07-19,1971-07
越南海防市工业参观团访问天津,1971-07-19,1971-07
丹麦青年访华团离京去外地访问,1971-07-19,1971-07
北京城区天气预报,1971-07-19,1971-07
株洲市长江冶炼厂党委认真学习马列主义、毛泽东思想    狠批唯生产力论  坚持革命统帅生产,1971-07-20,1971-07
山西加强对轻工业生产的领导    自力更生办起大批小工厂，生产各种轻工业产品，    满足城乡人民需要,1971-07-20,1971-07
周恩来、张春桥、姚文元同志会见    “关心亚洲问题学者委员会”美国会员友好访华团    同他们进行了亲切友好的谈话,1971-07-20,1971-07
毛主席语录,1971-07-20,1971-07
越南人民的民族愿望一定能实现,1971-07-20,1971-07
揭穿佐藤政府搜罗炮灰的骗局    ——评日本反动影片《啊，海军》,1971-07-20,1971-07
北京市财金局深入批判反革命修正主义路线和大手大脚的作风    坚决执行毛主席的革命路线    切实加强基建财务管理工作,1971-07-20,1971-07
基本建设必须坚持少花钱多办事,1971-07-20,1971-07
路线觉悟高“废料”变成宝,1971-07-20,1971-07
要建立和健全必要的质量检验制度,1971-07-20,1971-07
广州医疗器械合作工厂    生产出一批适合农村需要的医疗器械,1971-07-20,1971-07
大寨贫下中农是怎样管理学校的,1971-07-20,1971-07
针刺麻醉好,1971-07-20,1971-07
秘鲁共产党中央写信给中共中央    最热烈祝贺中国共产党成立五十周年,1971-07-20,1971-07
印度支那人民抗美救国战争形势大好,1971-07-20,1971-07
越南南方共和临时革命政府外交部发言人发表声明    严厉谴责美帝及其西贡傀儡侵柬新罪行    越南南方解放通讯社强烈谴责美帝及其走狗    进犯查尔平原—川圹解放区,1971-07-20,1971-07
战斗的青春    ——记越南南方解放军年轻指挥员黎马良的英雄事迹,1971-07-20,1971-07
朝鲜外务省发言人发表声明    谴责莱尔德窜到日本和南朝鲜策划侵略阴谋    美帝必须立即无条件地撤出南朝鲜,1971-07-20,1971-07
约旦反动军队在阿杰隆地区连续疯狂进攻游击队    巴勒斯坦游击队奋战六天英勇抗敌,1971-07-20,1971-07
辽宁省吉林省两友好代表团在朝期间    参观访问受到当地朝鲜人民热烈欢迎,1971-07-20,1971-07
智利政府接管美资铜公司的一些主要铜矿    古巴智利两国航空线开始正式通航,1971-07-20,1971-07
阿尔巴尼亚足球队访问韶山和长沙    湖南省革委会举行宴会欢迎阿尔巴尼亚战友,1971-07-20,1971-07
越南海防工业参观团离京去南方访问,1971-07-20,1971-07
法国议会代表团    离京去外地参观访问,1971-07-20,1971-07
中尼签订中国帮助尼泊尔修建    加德满都—博克拉公路路面等换文,1971-07-20,1971-07
中国乒乓球队领队和队员    分别拜访奥巴殿下和拉各斯军事长官,1971-07-20,1971-07
我首任驻加拿大特命全权大使黄华离京赴任,1971-07-20,1971-07
北京城区天气预报,1971-07-20,1971-07
周恩来总理致电阿连德总统    向智利地震灾区人民表示同情和慰问,1971-07-21,1971-07
毛主席语录,1971-07-21,1971-07
加强党的政策教育,1971-07-21,1971-07
按照毛主席的指示多快好省地培养工人技术队伍    ——辽宁省厂办工人大学的调查,1971-07-21,1971-07
高举毛泽东思想伟大红旗  深入开展革命大批判    共产党员应是无产阶级专政下继续革命的先锋战士    ——批判叛徒、内奸、工贼刘少奇一伙炮制的修正主义《课本》,1971-07-21,1971-07
在无产阶级政治统帅下努力学习技术    广东仪表厂从工人中培养出一支又红又专的技术队伍,1971-07-21,1971-07
对赞同的意见也要分析,1971-07-21,1971-07
听批评意见要坐得住,1971-07-21,1971-07
一个人的意见也要认真听,1971-07-21,1971-07
柬埔寨王国民族团结政府发言人发表声明    强烈谴责美帝破坏日内瓦协议罪行,1971-07-21,1971-07
在关于印度支那问题日内瓦协议签订十七周年之际    越南国会统一委员会代表团拜会越南南方共和特别代表团,1971-07-21,1971-07
关于印度支那问题的日内瓦协议,1971-07-21,1971-07
应我国政府邀请前来进行支好访问    阿尔及利亚政府代表团到达上海    上海市革委会负责人和革命群众前往机场热烈欢迎贵宾,1971-07-21,1971-07
林平大使向阿连德总统递交周恩来总理的慰问电,1971-07-21,1971-07
中国红十字会致电智利内政部长和救灾专门委员会慰问受灾人民,1971-07-21,1971-07
决心用自己的双手重建家园战胜地震灾害    智利人民不怕困难广泛开展抗灾斗争,1971-07-21,1971-07
中国旅游局访越代表团回京,1971-07-21,1971-07
朝鲜运输代表团访问天津,1971-07-21,1971-07
越南《人民报》就关于印度支那问题的    日内瓦协议签订十七周年发表社论    《团结、信心、决战、决胜》,1971-07-21,1971-07
朝鲜《劳动新闻》发表社论谴责美帝    破坏关于印度支那问题的日内瓦协议    坚决支持越南人民抗美救国正义斗争,1971-07-21,1971-07
阿《人民之声报》就关于印度支那问题的    日内瓦协议签订十七周年发表社论    坚决支持越南人民和印度支那人民反美斗争,1971-07-21,1971-07
意中协会访华团离京去南方访问,1971-07-21,1971-07
几军事代表团访华后回到科纳克里,1971-07-21,1971-07
安哥拉人民解放运动青年代表团离开我国,1971-07-21,1971-07
尼日利亚第二届全国乒乓球锦标赛闭幕    尼中两国乒乓球运动员举行国际友谊比赛,1971-07-21,1971-07
北京城区天气预报,1971-07-21,1971-07
柬国家元首西哈努克亲王发表第二十三号告高棉同胞书    （第二部分，即最后一部分）,1971-07-21,1971-07
上钢五厂党委密切结合三大革命斗争实际    加强对党员和工人群众进行党的基本路线教育,1971-07-22,1971-07
布特弗利卡部长率政府代表团到京    李先念副总理宴请阿尔及利亚贵宾,1971-07-22,1971-07
李先念副总理、姬鹏飞代部长    同布特弗利卡部长举行会谈    会谈在亲切友好的气氛中进行,1971-07-22,1971-07
毛主席语录,1971-07-22,1971-07
加强赤脚医生的思想政治工作    五河县界沟大队巩固合作医疗的经验,1971-07-22,1971-07
为办好合作医疗献出秘方,1971-07-22,1971-07
让秘方更好地为人民服务,1971-07-22,1971-07
把秘方变成群众的共同财富,1971-07-22,1971-07
自力更生  办好合作医疗,1971-07-22,1971-07
献方为人民,1971-07-22,1971-07
在欢迎阿尔及利亚政府代表团宴会上    李先念副总理的讲话,1971-07-22,1971-07
在李先念副总理举行的欢迎宴会上    布特弗利卡部长的讲话,1971-07-22,1971-07
深入开展思想和政治路线教育  发扬大寨革命精神    广东福建湖南云南早稻获得好收成,1971-07-22,1971-07
中共新源县委把读书同改进领导方法和作风结合起来    调查研究在“深入”上狠下功夫,1971-07-22,1971-07
绍兴县农机修理制造厂热心为农业服务,1971-07-22,1971-07
洪水农具厂支农服务队受山区农民欢迎,1971-07-22,1971-07
老挝爱国战线党中央发布命令    号召爱国军民声援越南人民抗美斗争    组成领导小组领导“声援越南人民抗击美帝国主义月”的活动,1971-07-22,1971-07
朝鲜外务省发言人发表声明    强烈谴责美帝和西贡傀儡侵柬新罪行    朝鲜政府和人民全力支持柬埔寨人民反对美帝侵略的正义斗争,1971-07-22,1971-07
抗议美帝侵略印度支那  支持越南南方共和七点和平倡议    法国近万名工人、学生举行大示威    阿尔及利亚工人总联合会全国书记处支持越南南方共和新建议,1971-07-22,1971-07
抗议政府当局继续实行镇压人民斗争的“紧急安全措施”    乌拉圭五十万职工举行总罢工    总罢工使各地工厂停工、交通中断、商店关门、报纸停刊,1971-07-22,1971-07
澳大利亚昆士兰二十万工人罢工    反对南非白人种族主义政权的种族压迫政策,1971-07-22,1971-07
就印度飞机多次侵犯巴基斯坦领空    巴基斯坦政府向印度提出强烈抗议,1971-07-22,1971-07
尼克松政府加紧强化侵略印度支那战争    美帝及其西贡走狗又派遣一万名西贡伪军侵柬，    对柬埔寨人民犯下新的侵略罪行,1971-07-22,1971-07
莱尔德在日本和南朝鲜进行阴谋活动    加强美帝在亚洲的军事部署，加紧美日朴的军事勾结，    让日本反动派充当美帝侵略的打手和急先锋，    进一步推行“尼克松主义”,1971-07-22,1971-07
一些亚、非、拉、欧国家和地区的群众团体    热烈祝贺中国共产党成立五十周年,1971-07-22,1971-07
法国议会代表团访问延安和西安,1971-07-22,1971-07
美国黑人工人大会代表团到京,1971-07-22,1971-07
也门民主人民共和国内政部长离京回国,1971-07-22,1971-07
英中了解协会代表团到京,1971-07-22,1971-07
抗议约旦反动派镇压巴勒斯坦游击队    黎巴嫩二万五千多群众游行示威    阿联、科威特政府和一些非洲民族解放运动组织    坚决支持巴勒斯坦人民斗争,1971-07-22,1971-07
荒山变成花果山,1971-07-22,1971-07
北京城区天气预报,1971-07-22,1971-07
应金日成首相邀请前往朝鲜进行国事访问    西哈努克亲王和夫人到达平壤,1971-07-23,1971-07
周恩来总理致电萨达特总统    热烈祝贺阿拉伯联合共和国国庆,1971-07-23,1971-07
周恩来总理电贺埃塞俄比亚皇帝    塞拉西一世寿辰和埃塞俄比亚国庆,1971-07-23,1971-07
周恩来总理会见古巴新任驻华大使巴雷依罗,1971-07-23,1971-07
遵照伟大领袖毛主席的指示从工人中培养技术人员    上海机床厂“七·二一”工人大学首期学员毕业,1971-07-23,1971-07
毛主席语录,1971-07-23,1971-07
是继续革命，还是复辟资本主义？    ——批判刘少奇一类政治骗子的所谓    “先进的社会主义制度同落后的社会    生产力之间的矛盾”的反动谬论,1971-07-23,1971-07
北京重型电机厂、锅炉厂、第二通用机械厂团结协作    多快好省地建成生产电站设备的基地,1971-07-23,1971-07
宝塔山下延水旁  军民团结谱新章,1971-07-23,1971-07
姬鹏飞代部长同布特弗利卡部长会谈,1971-07-23,1971-07
阿尔及利亚政府代表团    参观北京石油化工总厂,1971-07-23,1971-07
一切实际工作者必须向下作调查,1971-07-23,1971-07
调查研究要周密,1971-07-23,1971-07
到实践中去才能认识世界,1971-07-23,1971-07
反复实践  摸索大自然规律,1971-07-23,1971-07
黎笋同志看望出席军事工作会议的代表并作亲切讲话    越南人民决心彻底战胜美帝及其走狗    号召军民同印度支那各国人民紧密团结，    坚持和大力促进抗战夺取最大胜利,1971-07-23,1971-07
越南外交部就关于越南问题的日内瓦协议十七周年发表声明    越南人民誓把抗美救国事业推向彻底胜利,1971-07-23,1971-07
愤怒谴责美帝坚持进行侵略战争  坚决支持越南人民抗美救国斗争    朝鲜各地工厂学校举行群众集会,1971-07-23,1971-07
美国军用飞机侵入我国领空    我提出第四百九十四次严重警告,1971-07-23,1971-07
古巴《格拉玛报》发表社论    支持越南南方共和七点建议,1971-07-23,1971-07
抗议美帝以技术援助为名进行文化侵略    洪都拉斯学生举行反美示威,1971-07-23,1971-07
北京城区天气预报,1971-07-23,1971-07
坚决支持巴勒斯坦人民反击约旦反动派的进攻,1971-07-23,1971-07
庆祝朝鲜祖国解放战争胜利十八周年    朝鲜驻华使馆武官举行电影招待会    陈继德副总参谋长等应邀出席,1971-07-23,1971-07
阿尔巴尼亚足球队访津受到热烈欢迎,1971-07-23,1971-07
越南地方经济考察团离京去南方访问,1971-07-23,1971-07
庆祝波兰国家复兴节    波兰驻华大使举行招待会    郭沫若副委员长等应邀出席,1971-07-23,1971-07
加拿大不列颠哥伦比亚大学文化访华团离京去外地访问,1971-07-23,1971-07
在伊拉克的巴勒斯坦游击队组织和伊拉克群众    团体举行大示威抗议约旦反动派屠杀巴勒斯坦游击队    巴勒斯坦和阿拉伯一些国家的    群众和群众组织谴责约旦反动当局暴行,1971-07-23,1971-07
美帝是镇压巴勒斯坦游击队的罪魁祸首    最近约旦反动派在美帝指使下悍然对游击队发动新的武装进攻，    对巴勒斯坦人民又犯下新的罪行,1971-07-23,1971-07
明目张胆的挑衅,1971-07-24,1971-07
金日成首相盛宴欢迎西哈努克亲王,1971-07-24,1971-07
周恩来总理、姬鹏飞代部长会见布    特弗利卡部长和阿政府代表团,1971-07-24,1971-07
认真落实毛主席关于“古为今用”的伟大方针    我国在文化大革命中发掘出大批珍贵历史文物,1971-07-24,1971-07
毛主席语录,1971-07-24,1971-07
战高温  夺高产,1971-07-24,1971-07
张春桥同志会见并宴请    美国黑人工人大会代表团,1971-07-24,1971-07
在实践中不断开辟认识真理的道路,1971-07-24,1971-07
干革命不能单凭热情,1971-07-24,1971-07
越南南方共和外交部就关于越南问题的    日内瓦协议签订十七周年发表声明    越南南方人民决心抗击美帝直到彻底胜利    美国必须停止侵略战争，必须全部和无条件地把美军撤出越南南方,1971-07-24,1971-07
朝鲜《劳动新闻》发表文章谴责美帝的侵略罪行    美帝是侵略和战争的主要势力和元凶,1971-07-24,1971-07
亚非拉许多国家政府和人民热烈支持越南南方共和七点建议    七点建议是解决越南问题的正确途径,1971-07-24,1971-07
朝鲜《劳动新闻》发表社论热烈欢迎西哈努克亲王    访问朝鲜坚决支持柬埔寨人民抗美救国战争    任何帝国主义势力既不能征服亚洲人民，    也不能破坏他们的团结力量,1971-07-24,1971-07
阿尔及利亚人民在反帝反殖道路上前进    在巩固民族独立，发展民族经济，反对大国强权政治，    反对帝国主义和新老殖民主义侵略的斗争中，不断取得新胜利,1971-07-24,1971-07
坦桑尼亚国际贸易博览会圆满闭幕    有十一个国家参加，接待了十六万多观众    尼雷尔总统卡瓦瓦第二副总统参观博览会和中国馆,1971-07-24,1971-07
“关心亚洲问题学者委员会”    美国会员友好访华团离京回国,1971-07-24,1971-07
法国议会代表团访问武汉,1971-07-24,1971-07
约旦一客人到京,1971-07-24,1971-07
我驻尼日利亚使馆临时代办    为中国乒乓球队举行招待会,1971-07-24,1971-07
北京城区天气预报,1971-07-24,1971-07
学大庆精神  创英雄业绩    ——福建三明钢铁厂以大庆为榜样多快好省    恢复发展生产的调查报告,1971-07-25,1971-07
