一面制造借口拖延签署协定一面加速步伐武装阮文绍集团美国政府把大量武器赶运到西贡,1972-11-12,1972-11
牙买加总理接见我国际贸促会代表团,1972-11-12,1972-11
招待访华回国的阿体委代表团等我驻阿尔巴尼亚大使举行宴会,1972-11-12,1972-11
我政府代表团在尼日利亚参观访问	方毅团长在拉各斯举行答谢宴会,1972-11-12,1972-11
加拿大卫生福利部副部长会见我医学代表团姚广大使为代表团访加举行招待会,1972-11-12,1972-11
阿《人民之声报》发表社论欢庆劳动党成立三十一周年阿人民在劳动党领导下取得光辉胜利,1972-11-12,1972-11
阿拉法特主席发表告巴勒斯坦人民和游击队书号召提高警惕坚持斗争对付敌人阴谋叙利亚防空部队击退入侵的以色列飞机,1972-11-12,1972-11
乔冠华团长宴请出席联大的日本代表团,1972-11-12,1972-11
乔冠华团长宴请出席联大法国英国代表,1972-11-12,1972-11
厄瓜多尔等拉美五国成立常设委员会	协调政策发展动力和石油工业,1972-11-12,1972-11
西欧“共同市场”各国外长在布鲁塞尔举行会议达成同地中海国家建立“自由贸易区”的原则协议挪威政府同西欧“共同市场”就缔结自由贸易协定开始谈判,1972-11-12,1972-11
不丹外交大臣对记者发表谈话不丹将奉行不结盟、和平共处外交政策,1972-11-12,1972-11
海湾三国访问记,1972-11-12,1972-11
北京城区天气预报,1972-11-12,1972-11
勃利县委领导成员经常想想工作中的弱点、缺点和错误有了成绩不自满继续革命不停步,1972-11-13,1972-11
沈阳矿山机器厂老干部在领导生产中发挥积极作用,1972-11-13,1972-11
巴卢库同志率军事友好代表团离京到沈阳叶剑英等同志前往机场送行李德生等同志陪同前往陈锡联同志设宴欢迎，宾主共颂中阿两国人民和军队的革命友谊,1972-11-13,1972-11
常德县委从思想政治路线教育入手帮助新干部在斗争中增长才干,1972-11-13,1972-11
北京、南京、上海、广东各界人士纪念孙中山先生诞生一百零六周年,1972-11-13,1972-11
报眼毛主席语录,1972-11-13,1972-11
发展县办工业必须兼顾农业——河北邯郸县解决工业与农业争劳力问题的调查,1972-11-13,1972-11
工农友谊路,1972-11-13,1972-11
阳原县加强三级农机修造网,1972-11-13,1972-11
济源县农机厂克服重造轻修思想,1972-11-13,1972-11
丰顺县农机厂建立农机维修档案,1972-11-13,1972-11
想贫下中农所未想,1972-11-13,1972-11
“想”得好（编后）,1972-11-13,1972-11
增产“小手扶”配套农具,1972-11-13,1972-11
促进我国对外贸易的发展增进同各国人民间的友谊今年秋季出口商品交易会盛况空前,1972-11-13,1972-11
姚文元同志会见日本山口县文学代表团同冨成博团长等进行了亲切友好的谈话,1972-11-13,1972-11
“天涯海角”创新业——记知识青年在海南岛小熟岭垦荒建设橡胶园的事迹,1972-11-13,1972-11
为阿尔及利亚民族解放阵线青年代表团访华阿裴德临时代办举行宴会,1972-11-13,1972-11
耿飚部长会见并宴请阿尔及利亚民族解放阵线青年代表团宴会上宾主共颂两国人民和青年的战斗团结,1972-11-13,1972-11
阿尔及利亚政府代表团离广州回国阿贵宾在广州进行了参观访问,1972-11-13,1972-11
委内瑞拉贸易代表团到京,1972-11-13,1972-11
北欧四国新闻代表团离京,1972-11-13,1972-11
朱穆之宴请共同社社长福岛慎太郎,1972-11-13,1972-11
奥地利新闻工作者代表团离开广州回国,1972-11-13,1972-11
瑞典中国友好联合会代表团离京回国,1972-11-13,1972-11
前往缅甸、巴基斯坦、科威特访问  中国排球队离京,1972-11-13,1972-11
天津足球队前往非洲三国访问,1972-11-13,1972-11
采取多种形式提高教师业务水平,1972-11-13,1972-11
新老教师团结互助，共同提高,1972-11-13,1972-11
认真抓好教师的业务学习,1972-11-13,1972-11
充分信任，合理使用，热情帮助,1972-11-13,1972-11
范文同总理视察河西省	在视察大同乡农业合作社时，勉励社员和干部继续奋斗，	使产量达到更高的指标,1972-11-13,1972-11
越南《人民报》和“越南之声”电台分别发表评论谴责美国—阮文绍集团加紧迫害爱国者,1972-11-13,1972-11
越南《人民报》发表社论谴责美国继续利用阮文绍集团推行“越南化”政策指出只要美国继续进行侵略战争，越南人民就要继续战斗,1972-11-13,1972-11
越南外交部发言人连日发表声明严厉谴责美帝轰炸越南北方居民稠密区,1972-11-13,1972-11
越南清化、广平两省军民击落美机四架,1972-11-13,1972-11
澳共（马列）《先锋报》和巴基斯坦报纸发表评论美国应当在恢复越南和平的协定上签字联邦德国和西柏林一些组织和个人要求美国政府立即签署协定,1972-11-13,1972-11
阻止美军向南越运送坦克日本东京和神奈川县人民示威,1972-11-13,1972-11
在越南南方人民武装力量沉重打击下西贡伪军纷纷开小差或起义投诚,1972-11-13,1972-11
我代表在联合国教科文组织第三委员会会议上发言谴责朗诺傀儡集团破坏吴哥古迹支持柬王国政府反对任何国际组织以“保护吴哥”为名	干涉柬内政的严正立场,1972-11-13,1972-11
西哈努克亲王和夫人回到平壤金日成首相和夫人前往车站迎接,1972-11-13,1972-11
联大二委会在发展中国家代表努力下通过决议建议把环境秘书处设在内罗毕,1972-11-13,1972-11
阿尔巴尼亚《人民之声报》发表社论支持柬埔寨王国民族团结政府声明古巴首都工人集会庆祝柬王国国庆十九周年,1972-11-13,1972-11
美国向朗诺集团赶运军事装备,1972-11-13,1972-11
我政府代表团离尼日利亚回国,1972-11-13,1972-11
访问也门、埃及、黎巴嫩、民主也门后我青年乒乓球代表团回到北京,1972-11-13,1972-11
我青年代表团离地拉那回国,1972-11-13,1972-11
我桥梁工作组离仰光回国,1972-11-13,1972-11
叙总统阿萨德号召坚持反以战斗科威特外交大臣萨巴赫发表谈话谴责以色列空袭叙利亚越南民主共和国和越南南方共和外交部支持叙人民斗争,1972-11-13,1972-11
苏修继续让犹太人移居以色列阿尔及利亚《圣战者日报》谴责苏修的做法,1972-11-13,1972-11
北京城区天气预报,1972-11-13,1972-11
甘肃化工企业在“备战、备荒、为人民”的伟大战略方针指引下广辟原料来源节约工业用粮和植物油沈阳一批工厂基本上做到生产不用粮	辽宁一批企业用矿物油代替动植物油,1972-11-14,1972-11
以丰补歉积谷备荒,1972-11-14,1972-11
西安市花园粮店职工走出柜台帮助群众搞好节粮储粮,1972-11-14,1972-11
天津市农机部门职工加强调查研究，从实际需要出发为农村生产更多更好的农业机械,1972-11-14,1972-11
上海计算技术研究所和有关单位密切协作制成一台新的集成电路通用数字电子计算机每秒钟能运算十一万次，经过半年来一千六百多个小时的运转，	表明性能良好,1972-11-14,1972-11
报眼毛主席语录,1972-11-14,1972-11
共产党员要做革命的园丁东新大队党支部加强对共青团工作的领导,1972-11-14,1972-11
引导他们走又红又专的道路,1972-11-14,1972-11
报眼口号,1972-11-14,1972-11
积极开展适合青年特点的文体活动,1972-11-14,1972-11
认真管好青年的业余生活,1972-11-14,1972-11
中国人民解放军沈阳部队举行大会热烈欢迎巴卢库同志率领的阿军事友好代表团,1972-11-14,1972-11
外贸部副部长周化民举行宴会热烈欢迎委内瑞拉贸易代表团,1972-11-14,1972-11
几内亚共和国新任驻中国大使卡马拉向朱德委员长递交国书,1972-11-14,1972-11
廖承志宴请日中友协（正统）各界友好访华团,1972-11-14,1972-11
毛里塔尼亚政府代表团参观红旗渠,1972-11-14,1972-11
表扬和批评引起的争论,1972-11-14,1972-11
提高路线觉悟抓好产品质量,1972-11-14,1972-11
在为生产服务中发展科研工作,1972-11-14,1972-11
越南《人民报》发表社论欢呼越南南方军民取得的新胜利指出美国侵略者尽管加紧推行战争“越南化”，向伪军提供更多的武器和战争工具，也挽救不了西贡伪军的崩溃,1972-11-14,1972-11
越南南方共和外交部发言人发表声明强烈谴责美帝轰炸越南南方许多居民稠密区,1972-11-14,1972-11
越南北方军民击落美机五架击伤美舰两艘,1972-11-14,1972-11
泰国各地人民武装坚持游击战争三个月来不断袭击敌人据点，取得新的胜利,1972-11-14,1972-11
越南外交部发言人发表声明严厉谴责美帝袭击越南北方居民稠密区,1972-11-14,1972-11
匈牙利总理福克会见我外贸部长白相国,1972-11-14,1972-11
金一第一副首相接见北京市友好代表团,1972-11-14,1972-11
我青年乒乓球代表团访问日本秋田县,1972-11-14,1972-11
欢送中国医学代表团加拿大卫生福利部等有关方面举行宴会,1972-11-14,1972-11
我科学家代表团访问渥太华,1972-11-14,1972-11
我驻坦桑大使向坦桑尼亚外长赠送电视影片,1972-11-14,1972-11
我驻阿大使和使馆人员到农业社劳动,1972-11-14,1972-11
我清华大学代表团离瑞士赴德意志联邦共和国我驻瑞士大使为代表团访问举行招待会,1972-11-14,1972-11
阿尔巴尼亚畜牧业取得新成就	朝鲜发展家禽业养蚕业果木业,1972-11-14,1972-11
积极响应齐奥塞斯库主席的号召罗农业劳动者紧张进行秋收秋播,1972-11-14,1972-11
乔冠华团长设午宴招待非洲国家代表,1972-11-14,1972-11
波美贸易问题联合委员会举行第二次会议双方签订进一步相互发展经济关系议定书,1972-11-14,1972-11
伏击敌军车队攻打敌人营房莫三鼻给爱国武装频繁袭击葡殖民军,1972-11-14,1972-11
几内亚和佛得角非洲独立党总书记举行记者招待会几内亚（比绍）人民武装斗争取得新胜利,1972-11-14,1972-11
津巴布韦非洲人民联盟的刊物发表社论号召人民为争取民族独立而斗争到底,1972-11-14,1972-11
纳米比亚人民为争取民族解放而斗争,1972-11-14,1972-11
北京城区天气预报,1972-11-14,1972-11
应我国政府邀请前来访问	尼泊尔首相比斯塔和夫人今天到京	尼泊尔贵宾到达昆明时，	受到云南省领导同志和各族群众两千人的热烈欢迎,1972-11-15,1972-11
黎德寿同志在前往巴黎途中到达北京周恩来、李先念同志会见黎德寿同志双方进行了十分亲切友好的谈话会见以后，李先念同志设宴招待越南同志,1972-11-15,1972-11
乔冠华团长在联大发言坚决反对苏联    《关于在国际关系中不使用武力和永远禁止使用核武器》提案    苏联建议是一个彻头彻尾的骗局,1972-11-15,1972-11
周恩来顾明何英陈慕华会见西迪亚部长等贵宾	同毛里塔尼亚政府代表团全体成员进行了亲切友好的谈话,1972-11-15,1972-11
报眼毛主席语录,1972-11-15,1972-11
热烈欢迎尼泊尔贵宾,1972-11-15,1972-11
扎扎实实地大打矿山之仗甘肃集中优势兵力打歼灭战加快矿山建设步伐湖南坚持两条腿走路方针发展小有色金属工业,1972-11-15,1972-11
夺高产的重要一环——四川省新都县种子工作调查,1972-11-15,1972-11
殭蛹代替殭蚕,1972-11-15,1972-11
人工饲养海马,1972-11-15,1972-11
安息香割脂成功,1972-11-15,1972-11
坚持储粮备战备荒,1972-11-15,1972-11
结束在沈阳的参观访问巴卢库同志率阿军事友好代表团到达旅大旅大驻军负责人设宴欢迎阿尔巴尼亚战友,1972-11-15,1972-11
郭沫若副委员长会见朝鲜科学院代表团,1972-11-15,1972-11
毛里塔尼亚西迪亚部长举行告别宴会,1972-11-15,1972-11
中尼友协、对外友协举行宴会欢迎尼泊尔—中国友好协会代表团,1972-11-15,1972-11
我驻希腊大使馆临时代办申志伟前往雅典赴任,1972-11-15,1972-11
日本山口县文学代表团离京前往各地参观访问,1972-11-15,1972-11
中朝两国科学院签订一九七三至一九七四年科学合作计划郭沫若出席签字仪式吴有训设宴招待朝鲜同志,1972-11-15,1972-11
结束对朝鲜民主主义人民共和国的友好访问北京市友好代表团回到北京,1972-11-15,1972-11
阿尔及利亚民族解放阵线青年代表团离京,1972-11-15,1972-11
波兰外贸部副部长离京,1972-11-15,1972-11
瑞士医学界人士离京,1972-11-15,1972-11
前往科威特、几内亚、塞内加尔访问  中国足球队离开北京,1972-11-15,1972-11
各国朋友喜爱中国工艺品	——一九七二年秋季中国出口商品交易会侧记,1972-11-15,1972-11
贵在自知“真症候”,1972-11-15,1972-11
数风流人物还看今朝——批判周扬一伙的“写中间人物”谬论,1972-11-15,1972-11
“灵感”论是资产阶级货色,1972-11-15,1972-11
老挝爱国战线中央就老挝局势发表声明    谴责美帝及其走狗新的战争冒险和阻挠和平解决老挝问题,1972-11-15,1972-11
富米·冯维希返桑怒时途经河内,1972-11-15,1972-11
越南民主共和国外交部新闻司公布  黎德寿特别顾问启程前往巴黎,1972-11-15,1972-11
“越南之声”评美国把大批武器运进柬埔寨和越南南方美国阴谋延长侵略战争的又一证据,1972-11-15,1972-11
柬王国民族团结政府外交部发表公报加蓬决定承认柬王国民族团结政府,1972-11-15,1972-11
发扬坚强不屈的反侵略传统    越南北方军民加强战备随时准备打击敌人    南北方一些组织和各界人士拥护政府声明，要求美国政府签订协定,1972-11-15,1972-11
越南外交部发言人发表声明    谴责美帝袭击越南北方居民稠密区,1972-11-15,1972-11
在西南、西北地区和金边军事特区连续进攻朗诺伪军	柬埔寨人民武装力量歼灭敌人许多有生力量	越南《人民报》等热烈欢呼柬埔寨军民雨季战斗取得辉煌胜利,1972-11-15,1972-11
西哈努克亲王接见圭亚那政府经济贸易代表团,1972-11-15,1972-11
金日成首相接见圭亚那政府经济贸易代表团,1972-11-15,1972-11
寻歼残敌攻打据点截击敌军老挝川圹等省爱国军民取得新战果,1972-11-15,1972-11
尼泊尔发展民族经济和文化成就显著,1972-11-15,1972-11
“泉水之岛”——牙买加,1972-11-15,1972-11
联合国三个组织简介,1972-11-15,1972-11
国际可可会议,1972-11-15,1972-11
可可,1972-11-15,1972-11
可可的老家和生产国,1972-11-15,1972-11
北京城区天气预报,1972-11-15,1972-11
比斯塔首相和夫人到京受到数万人夹道欢迎周恩来总理举行宴会热烈欢迎尼泊尔贵宾周恩来，李先念和林佳楣，阿沛·阿旺晋美，姬鹏飞和许寒冰，    吴德等到机场热烈欢迎邓颖超同志在宾馆迎接周恩来总理和比斯塔首相在宴会上发表了热情友好的讲话,1972-11-16,1972-11
姬鹏飞外交部长声明中国政府尊重和支持拉丁美洲国家	关于建立拉丁美洲无核区的正义主张,1972-11-16,1972-11
黎清毅同志率越政府经济代表团到京首都群众数千人，李先念、韩念龙、李强、韩宗正、王树声，	秀木前往机场热烈欢迎,1972-11-16,1972-11
黎德寿同志离京前往巴黎李先念、韩念龙、申健等前往机场送行,1972-11-16,1972-11
报眼毛主席语录,1972-11-16,1972-11
在欢迎尼泊尔首相比斯塔的宴会上  周恩来总理的讲话,1972-11-16,1972-11
在周恩来总理举行的欢迎宴会上  比斯塔首相的讲话,1972-11-16,1972-11
周恩来总理会见黎巴嫩、荷兰、土耳其、卢旺达首任驻中国大使会见时在座的有外交部部长姬鹏飞等,1972-11-16,1972-11
积极发展生产备战备荒为人民金山县队队有储备粮,1972-11-16,1972-11
丰年多储歉年少储逐年增多龙口大队坚持年年储粮,1972-11-16,1972-11
丰收不忘国家增产不忘储备革新大队集体储粮六十多万斤,1972-11-16,1972-11
发扬勤俭节约精神反对铺张浪费华二大队集体储备粮逐年增多,1972-11-16,1972-11
科学实验结硕果,1972-11-16,1972-11
一九七二年秋季中国出口商品交易会闭幕	这届交易会的盛况，	反映了我国人民同世界各国人民之间的友好往来更加广泛；	我国同世界各国、各地区的贸易关系，	在平等互利、互通有无的基础上正在不断发展,1972-11-16,1972-11
巴卢库同志率领的军事友好代表团参观访问旅顺港受到热烈欢迎,1972-11-16,1972-11
郭沫若、廖承志、张香山会见日中友协（正统）各界友好访华团,1972-11-16,1972-11
格鲁特哈特大使和夫人举行招待会庆祝比利时王朝日李先念副总理姬鹏飞外长等应邀出席,1972-11-16,1972-11
毛里塔尼亚政府代表团离京赴我国南方访问,1972-11-16,1972-11
墨西哥医务社会代表团到京,1972-11-16,1972-11
余湛会见委内瑞拉贸易代表团,1972-11-16,1972-11
余湛会见联邦德国外交部总务司长勒丁,1972-11-16,1972-11
中国青年代表团访阿后回到北京,1972-11-16,1972-11
埃塞俄比亚新闻工作者代表团到京,1972-11-16,1972-11
莲子传友情,1972-11-16,1972-11
中国乒协向柬埔寨乒协赠送亚非乒乓球友好邀请赛影片,1972-11-16,1972-11
中国赴尼日利亚经济贸易展览团团长回京,1972-11-16,1972-11
越南南方爱国军民连续进攻痛歼敌军在土龙木、嘉定等省歼灭敌人大批有生力量，解放大片地区,1972-11-16,1972-11
柬埔寨王国民族团结政府外交部发言人发表声明谴责美帝把战争物资运给朗诺卖国集团,1972-11-16,1972-11
“越南之声”电台发表评论痛斥美帝走狗阮文绍的罪行,1972-11-16,1972-11
应英国政府邀请进行正式访问乔冠华副部长离纽约到达伦敦,1972-11-16,1972-11
越南外交部发言人发表声明严厉谴责美帝袭击越南北方居民稠密区,1972-11-16,1972-11
富米·冯维希回到桑怒,1972-11-16,1972-11
苏丹总统尼迈里接见我国大使,1972-11-16,1972-11
马耳他总理明托夫接见我国大使和综合考察组组长,1972-11-16,1972-11
我青年乒乓球代表团访问日本山形县,1972-11-16,1972-11
我驻伊朗大使宴请胡韦达首相,1972-11-16,1972-11
中国银行代表团结束在法国的友好访问,1972-11-16,1972-11
我科学家代表团访问多伦多,1972-11-16,1972-11
联大全体会议通过决议呼吁各国支持非洲葡属殖民地人民斗争谴责葡萄牙、南非和南罗得西亚非法政权勾结企图永远维持殖民统治,1972-11-16,1972-11
日本政府宣布解散众议院并举行大选参议院通过关于日中联合声明的决议,1972-11-16,1972-11
朝鲜《劳动新闻》发表文章谴责美帝阴谋永久分裂朝鲜,1972-11-16,1972-11
抗议美国颁布“渔业法”决心捍卫二百海里领海权秘鲁人民纷纷举行集会示威,1972-11-16,1972-11
意大利和罗马尼亚外长举行会谈发表公报强调：拟议中的欧安会必须使一切国家免遭侵略、	干涉或把别国意志强加于人,1972-11-16,1972-11
厄瓜多尔拘捕闯入领海的七艘美国渔船,1972-11-16,1972-11
反对种族歧视政策要求改善生活条件美国印第安人举行抗议活动,1972-11-16,1972-11
巴基斯坦和德意志民主共和国建交,1972-11-16,1972-11
拉丁美洲无核区,1972-11-16,1972-11
卢森堡大公国,1972-11-16,1972-11
吕宋岛,1972-11-16,1972-11
北京城区天气预报,1972-11-16,1972-11
保持和发扬艰苦奋斗的优良作风淄博矿务局党委领导成员经常深入基层，调查研究，参加劳动，	带领群众勤俭办企业，连年提前完成煤炭生产计划,1972-11-17,1972-11
中华人民共和国和卢森堡大公国建立外交关系的联合公报,1972-11-17,1972-11
周恩来总理同比斯塔首相举行会谈会谈在亲切友好的气氛中进行,1972-11-17,1972-11
尼驻华大使为比斯塔首相访华举行宴会周恩来、郭沫若、阿沛·阿旺晋美、周建人、姬鹏飞等应邀出席,1972-11-17,1972-11
李先念同志举行宴会热烈欢迎黎清毅同志率领的越政府经济代表团李先念副总理和黎清毅副总理先后在宴会上讲话,1972-11-17,1972-11
李先念、李强、韩宗正、彭绍辉  同黎清毅、李班、吴船、陈参会谈,1972-11-17,1972-11
报眼毛主席语录,1972-11-17,1972-11
怎样调动各方面的积极性？——张家口市重工业局党委在批修整风中继续落实党的政策,1972-11-17,1972-11
不能仅仅满足于安排工作,1972-11-17,1972-11
对错误做法不能姑息迁就,1972-11-17,1972-11
领导要带头联系实际,1972-11-17,1972-11
引导党员分清路线是非,1972-11-17,1972-11
她能不能出席积极分子代表大会？,1972-11-17,1972-11
坚持原则旗帜鲜明,1972-11-17,1972-11
党课教育要以批修整风为纲,1972-11-17,1972-11
在欢迎越南政府经济代表团宴会上  李先念副总理的讲话,1972-11-17,1972-11
在李先念副总理举行的欢迎宴会上  黎清毅副总理的讲话,1972-11-17,1972-11
李先念、周化民会见委内瑞拉贸易代表团,1972-11-17,1972-11
圭亚那政府经济贸易代表团回国,1972-11-17,1972-11
中国展览团长李永亭回京,1972-11-17,1972-11
为朝鲜科学院代表团访问中国  玄峻极大使举行宴会,1972-11-17,1972-11
“现代诗中应有铁”——读胡志明主席《“狱中日记”诗抄》,1972-11-17,1972-11
提倡小戏,1972-11-17,1972-11
来自群众斗争生活的舞蹈,1972-11-17,1972-11
锣鼓声声庆丰收,1972-11-17,1972-11
拉丁美洲国家的意志应当得到尊重,1972-11-17,1972-11
越南民主共和国外交部发表声明谴责美国大规模向阮文绍伪政权增运武器、强化侵越战争,1972-11-17,1972-11
发扬决不妥协决不后退战斗精神挫败伪军十七次反扑柬人民武装十月份在五号公路取得辉煌战果乔森潘总司令写信表彰西南地区军民雨季战斗的重大胜利,1972-11-17,1972-11
苏联制造借口拒绝对拉美无核区承担义务罗申在联大第一委员会会议上的发言，进一步戳穿了苏修    “关于在国际关系中不使用武力和永远禁止使用核武器”的鬼把戏,1972-11-17,1972-11
老挝爱国中立力量联盟发表声明抗议美帝及其走狗阻挠和平解决老挝问题和进攻解放区,1972-11-17,1972-11
越南南方敌占区人民不顾敌人恫吓和镇压反对阮文绍集团强迫悬挂和绘画伪旗,1972-11-17,1972-11
越南外交部发言人发表声明严厉谴责美帝继续袭击越南北方居民稠密区,1972-11-17,1972-11
澳共《先锋报》发表文章谴责美国拖延签订越南和平协定,1972-11-17,1972-11
联大全体会议通过九项决议谴责南非种族隔离政策要求消除种族歧视重申南非人民享有自决和自由的不容剥夺的权利,1972-11-17,1972-11
金日成首相和夫人同西哈努克亲王和夫人观看平壤艺术家的歌舞表演西哈努克亲王和夫人参观朝鲜革命博物馆,1972-11-17,1972-11
加强团结收复失地共同抗击以色列侵略阿拉伯国家外长国防部长会议开幕,1972-11-17,1972-11
《新兴的尼泊尔报》就尼首相访华发表社论指出尼中两国关系发展的另一里程碑比斯塔首相的访问定将加强两国间的融洽关系和促进了解,1972-11-17,1972-11
“关税及贸易总协定”第二十八届会议闭幕美国代表提出把全面废除发达国家间的工业品关税    作为下轮国际贸易谈判的目标，“共同市场”成员国和英国表示反对,1972-11-17,1972-11
我政府贸易代表团应邀抵南斯拉夫访问南联邦执行委员会主席接见我代表团,1972-11-17,1972-11
我医学代表团离开加拿大到法国访问,1972-11-17,1972-11
美国际收支情况继续恶化三季度逆差四十七亿美元,1972-11-17,1972-11
中国银行代表团访问法国后抵阿尔及利亚阿尔及利亚财政部长接见并宴请我代表团,1972-11-17,1972-11
我国际贸促会代表团在牙买加举行告别宴会,1972-11-17,1972-11
北京城区天气预报,1972-11-17,1972-11
毛泽东主席会见尼泊尔首相基·尼·比斯塔毛主席对来自友好邻邦的尼泊尔首相，表示热烈欢迎，	并且请比斯塔首相阁下向比兰德拉国王陛下转达他的问候。	会见在亲切友好气氛中进行。周恩来总理等参加会见。,1972-11-18,1972-11
周恩来、李先念同志会见黎清毅同志和由他率领的越南政府经济代表团同黎清毅等越南同志进行了十分亲切友好的谈话,1972-11-18,1972-11
报眼毛主席语录,1972-11-18,1972-11
欢迎我国和卢森堡建交,1972-11-18,1972-11
一手抓增产一手抓节约——广西八一矿的调查,1972-11-18,1972-11
利用余热发电,1972-11-18,1972-11
一点毛刺不放,1972-11-18,1972-11
他在永不停息地前进——记著名劳动模范、工人工程师苏广铭,1972-11-18,1972-11
鼓励老模范继续立新功,1972-11-18,1972-11
比斯塔首相和夫人访问中央民族学院尼泊尔贵宾应邀观看革命现代京剧《红灯记》,1972-11-18,1972-11
周总理会见马耳他首任驻华大使,1972-11-18,1972-11
恰科和佩尔拉库同志等到鞍山访问鞍山驻军和鞍山市革委会负责人等到机场热烈欢迎,1972-11-18,1972-11
由陈锡联、刘德才同志陪同巴卢库同志等在旅大继续参观访问,1972-11-18,1972-11
今冬明春根治海河工程开工,1972-11-18,1972-11
毛里塔尼亚政府代表团结束在南京的访问前往杭州,1972-11-18,1972-11
拉齐拉卡外长率马尔加什代表团结束对朝鲜的访问途经上海回国,1972-11-18,1972-11
廖承志会长会见日本共同社代表团,1972-11-18,1972-11
