张春桥同志举行宴会热烈欢迎巴卢库同志率领的军事友好代表团,1972-11-24,1972-11
罗博大使举行招待会  热烈庆祝阿中建交二十三周年姚文元姬鹏飞马文波余湛方毅李强王树声同志等应邀出席,1972-11-24,1972-11
老挝新任驻中国大使向朱德委员长递交国书,1972-11-24,1972-11
忆传统讲路线不断加强军事训练北京部队某师深入开展批修整风运动，	提高执行毛主席建军路线的自觉性。	广大战士以饱满的政治热情，苦练杀敌本领，进一步提高战斗力,1972-11-24,1972-11
卫生部负责人举行宴会热烈欢迎埃及卫生代表团在热烈友好气氛的宴会上陈仁洪同志和马赫福兹部长讲了话,1972-11-24,1972-11
廖承志会见西日本部落解放活动家友好访华团,1972-11-24,1972-11
我卫生工作考察团赴越参观访问,1972-11-24,1972-11
我科学技术工作者代表团赴巴参加卡拉奇核电站开幕典礼,1972-11-24,1972-11
国际电信联盟秘书长米里离京,1972-11-24,1972-11
联系实际问题进行路线教育——记吉林省扶余县几个公社、大队的事例,1972-11-24,1972-11
发扬南泥湾精神战胜严重干旱玛纳斯河流域各军垦农场棉花丰收,1972-11-24,1972-11
湘西土家族苗族自治州“小秋收”取得成绩,1972-11-24,1972-11
咸宁县增设商业网点及时收购土特产品,1972-11-24,1972-11
落实政策要抓典型——中共安徽当涂县委认真落实政策的事迹,1972-11-24,1972-11
柬人民武装上月猛烈进攻战绩辉煌	老挝爱国军民英勇战斗又获新战果,1972-11-24,1972-11
黎笋同志视察海防市港口、工厂、部队各单位的代表表示要大力促进生产和随时准备战斗越南北方广大青年响应祖国号召踊跃参军,1972-11-24,1972-11
越《人民报》就南圻起义三十二周年发表社论只要美国继续侵越战争越南人民就战斗到底,1972-11-24,1972-11
谢胡主席接见我冶金工业部代表团查尔查尼、科列加和凯莱齐同志等在座,1972-11-24,1972-11
我驻阿尔巴尼亚大使举行招待会热烈庆祝中阿建交二十三周年凯莱齐同志、纳赛外长等阿领导人出席,1972-11-24,1972-11
尼泊尔大臣宴请我政府代表团,1972-11-24,1972-11
中国银行代表团结束对阿尔及利亚的访问,1972-11-24,1972-11
我体育代表团到达地拉那,1972-11-24,1972-11
我乒乓球队访问南斯拉夫,1972-11-24,1972-11
我国代表黄华在安理会会议上发言重申中国坚决支持非洲人民的正义斗争揭露有些人鼓吹不加区分的禁止使用一切武力、反对区分正义战争	和非正义战争、为帝国主义和新老殖民主义的反动谬论张目,1972-11-24,1972-11
许多亚非国家代表在安理会讨论结束葡殖民统治问题时发言坚决支持葡属殖民地人民的民族解放斗争会议通过决议，重新确认安哥拉、几内亚（比绍）、佛得角和	莫三鼻给人民享有自决和独立的不容剥夺的权利,1972-11-24,1972-11
欧安会筹备性会谈在赫尔辛基开始,1972-11-24,1972-11
赤道几内亚和加蓬两国政府达成和平解决两国领土争端的协议,1972-11-24,1972-11
我国科学家代表团访问华盛顿  尼克松总统电祝我代表团访问成功美国总统科学顾问戴维博士设宴欢迎我代表团,1972-11-24,1972-11
抗议美国颁布“渔业法”决心保卫二百海里领海权秘鲁二万五千群众举行游行和集会,1972-11-24,1972-11
安第斯条约组织和阿根廷委员会成立,1972-11-24,1972-11
厄瓜多尔海军又拘捕六艘美国渔船,1972-11-24,1972-11
北京城区天气预报,1972-11-24,1972-11
北京市义利食品厂党委遵循毛主席提出的三项基本原则认真看书学习加强党委思想建设自觉接受群众监督，反骄破满，克服不正之风，促进思想革命化,1972-11-25,1972-11
抚顺石油三厂提前完成年计划,1972-11-25,1972-11
切实加强党对经济工作的领导青海大通煤矿原煤产量提高成本降低,1972-11-25,1972-11
黎巴嫩外长哈马德和夫人到达北京姬鹏飞和许寒冰，何英和王浩，陈洁，陈慕华等到机场欢迎,1972-11-25,1972-11
宾努首相和夫人等访问韶山柬埔寨贵宾受到群众热烈欢迎华国锋代主任等陪同访问,1972-11-25,1972-11
报眼毛主席语录,1972-11-25,1972-11
祝贺我国和牙买加建交,1972-11-25,1972-11
坚持群众路线狠抓农业增产措施四川双流县整修古灌渠、改造冬水田、推广双季稻，	全县农业生产迅速发展,1972-11-25,1972-11
“冷浆田”变成了高产田,1972-11-25,1972-11
节省投资讲究实效,1972-11-25,1972-11
一万五千多亩白浆土是怎样改良的？——黑龙江生产建设部队某连用有机肥改良土壤的好经验,1972-11-25,1972-11
巴卢库同志和阿军事友好代表团成员	在上海观看革命现代舞剧《白毛女》	张春桥同志等陪同观看演出,1972-11-25,1972-11
李德生同志会见阿国家旅行社代表团同他们进行了十分亲切友好的谈话,1972-11-25,1972-11
廖承志会见并宴请香港厂商旅行团,1972-11-25,1972-11
自力更生因地制宜发动群众新建改建水井浠水县大力改善饮水卫生条件,1972-11-25,1972-11
金县北关大队坚持开展爱国卫生运动提高社员健康水平促进生产发展,1972-11-25,1972-11
南京五老村坚持除“四害”讲卫生发病率逐年下降，有效地保障居民群众的身体健康,1972-11-25,1972-11
中国羽毛球协会举行宴会欢迎马来西亚羽毛球总会代表团,1972-11-25,1972-11
日朝体育交流促进联盟代表团南京回国,1972-11-25,1972-11
一定要消灭血吸虫病——记江苏省和上海市五县毗邻地区人民联合防治血吸虫病的事迹,1972-11-25,1972-11
用辩证法攻克煤炭生产难关——锦州市八道壕煤矿工人学哲学的事例,1972-11-25,1972-11
计划要合于客观实际,1972-11-25,1972-11
领导要向群众学习,1972-11-25,1972-11
认识不会“到顶”真理没有“终极”,1972-11-25,1972-11
越南南方美萩等四省军民不断出击重挫伪军越南北方军民已击落美国Ｂ—５２型飞机二十七架,1972-11-25,1972-11
越南外交部发言人发表声明  严厉谴责美帝加强袭击北方居民稠密区,1972-11-25,1972-11
柬王国民族团结政府外交部发言人发表声明谴责美帝强化侵老战争加剧老挝紧张局势巴特寮电台谴责美帝及其走狗侵犯解放区阻挠谈判,1972-11-25,1972-11
中国沈阳杂技团在渥太华首次演出米切纳总督、特鲁多总理和高级官员出席观看,1972-11-25,1972-11
伊朗王储礼萨殿下北京杂技团演出,1972-11-25,1972-11
结束对南斯拉夫的访问后  我政府贸易代表团抵罗马尼亚,1972-11-25,1972-11
郑准泽副首相接见我银行代表团,1972-11-25,1972-11
金万金副首相接见我气象代表团,1972-11-25,1972-11
我大使为秘鲁陆军参谋长访华归国举行招待会,1972-11-25,1972-11
我石油考察团访问加拿大、法国后回到北京,1972-11-25,1972-11
中国热电厂考察组到达仰光,1972-11-25,1972-11
罗马尼亚共产党中央委员会举行全体会议齐奥塞斯库同志就国内和国际问题作了报告,1972-11-25,1972-11
第三世界许多代表在联大第六委员会辩论所谓国际恐怖主义问题时指出帝国主义殖民主义犹太复国主义才是恐怖主义我代表发言表示决不允许帝殖等利用所谓国际恐怖主义问题诬蔑和	镇压民族解放运动,1972-11-25,1972-11
朝鲜外务省发言人发表声明谴责美帝阻挠朝鲜实现自主和平统一朝鲜南北红十字会会谈决定在板门店设立联合办事处,1972-11-25,1972-11
金泰禧团长说双方加深了了解并就一些问题达成协议	参加朝鲜南北红十字会会谈的北方代表团回到平壤,1972-11-25,1972-11
几内亚科纳克里四万多群众集会庆祝战胜帝国主义入侵两周年杜尔总统为“一九七○年十一月二十二日纪念碑”奠基,1972-11-25,1972-11
巴基斯坦政府正式宣布决定退出“联合国韩国统一复兴委员会”,1972-11-25,1972-11
非洲统一组织发表新闻公报祝贺几内亚人民在捍卫独立斗争中取得的胜利,1972-11-25,1972-11
墨西哥纪念一九一○年革命六十二周年埃切维里亚总统主持纪念仪式,1972-11-25,1972-11
苏联假裁军真扩军的原形又一次暴露塔斯社宣布苏联再次向太平洋发射火箭,1972-11-25,1972-11
北京地区天气预报,1972-11-25,1972-11
发扬自力更生、艰苦奋斗的革命精神	我国小水泥工业有很大发展	全国百分之七十的县有小水泥厂，	生产的水泥占全国水泥总产量的百分之四十八。	到十一月上旬，小水泥工业已经完成今年全年的生产计划,1972-11-26,1972-11
比斯塔首相和夫人离广州回国	李先念和林佳楣，丁盛等以及广州市群众两千多人前往车站热烈欢送	在结束访问时，比斯塔首相给周恩来总理发来感谢信,1972-11-26,1972-11
姬鹏飞外长举行宴会热烈欢迎黎巴嫩外长哈马德和夫人何英、陈洁、陈慕华，以及许寒冰、王浩出席作陪姬鹏飞外长和哈马德外长在宴会上讲话,1972-11-26,1972-11
宾努首相和夫人等离长沙去武汉访问湖南省革委会代主任华国锋等和长沙市群众到车站热烈欢送,1972-11-26,1972-11
周恩来、陈仁洪会见埃及卫生代表团,1972-11-26,1972-11
关于中华人民共和国和扎伊尔共和国国家关系正常化的联合公报,1972-11-26,1972-11
报眼毛主席语录,1972-11-26,1972-11
望都县找到一条农田水利建设好经验	把水利设施的合理布局、配套和平整土地结合起来,1972-11-26,1972-11
中国舞剧团、北京京剧团、中央乐团分赴各地巡回演出革命样板戏,1972-11-26,1972-11
夏县积极打井利用地下水浇地,1972-11-26,1972-11
姬鹏飞外长、何英副外长同哈马德外长举行会谈,1972-11-26,1972-11
庄河县狠抓水利配套工程    扩大了有效灌溉面积	在抗旱保收中发挥了作用,1972-11-26,1972-11
人大代表沙梦弼逝世,1972-11-26,1972-11
结束对重庆的友好访问  黎清毅同志率越南政府经济代表团回京,1972-11-26,1972-11
巴卢库同志等在上海观看中阿足球友谊赛	张春桥、张才千同志等陪同观看,1972-11-26,1972-11
耿飚倪志福会见并宴请罗马尼亚总工会代表团,1972-11-26,1972-11
乌干达总统特使到京,1972-11-26,1972-11
姬鹏飞外长会见联合国亚洲及远东经济委员会执行秘书,1972-11-26,1972-11
杨骥宴请法国知名人士访华团,1972-11-26,1972-11
郭沫若、周培源会见布鲁诺·皮特曼,1972-11-26,1972-11
日本政府事务当局访华团部分团员到京,1972-11-26,1972-11
法国科技展览会在京开幕,1972-11-26,1972-11
中国水利代表团应邀前往斯里兰卡访问,1972-11-26,1972-11
越南工艺美术参观团离京去我国南方访问,1972-11-26,1972-11
阿尔巴尼亚国家旅行社代表团回国,1972-11-26,1972-11
法国两位教授到京,1972-11-26,1972-11
我国际贸促代表团回京,1972-11-26,1972-11
中国羽毛球协会举行仪式  欢迎马来西亚羽毛球总会代表团,1972-11-26,1972-11
他从来没讲过自己的功劳	——记全心全意为人民服务的共产党员王志,1972-11-26,1972-11
不是要做官，而是要革命	——战斗英雄、共产党员张万一重返部队以后,1972-11-26,1972-11
能上能下，能“官”能民,1972-11-26,1972-11
掌握思想斗争和革命团结的辩证法,1972-11-26,1972-11
实事求是以理服人,1972-11-26,1972-11
一看二帮主动团结,1972-11-26,1972-11
黎笋同志视察海兴省	指出只要美帝没有放弃侵越野心就必须大力促进抗美救国战争,1972-11-26,1972-11
越南《人民报》发表评论	谴责美国企图用所谓北越撤军问题拖延签署协定,1972-11-26,1972-11
柬埔寨王国外交部发言人发表声明  强烈谴责美帝强化侵越战争,1972-11-26,1972-11
沙林察大臣离几内亚到布隆迪访问	杜尔总统接见时重申支持柬人民正义斗争,1972-11-26,1972-11
越南北方军民击落美机三架,1972-11-26,1972-11
科伦坡举行“兰卡·卡里亚尼”号货轮初航仪式	斯里兰卡总理班达拉奈克夫人出席并讲话,1972-11-26,1972-11
我北京杂技团在德黑兰举行末场演出	巴列维亲王殿下和夫人观看了演出,1972-11-26,1972-11
我青年乒乓球代表团离东京回国,1972-11-26,1972-11
缅甸体育运动局局长举行酒会招待我排球队,1972-11-26,1972-11
我乒乓球队结束对东非五国的访问后回国,1972-11-26,1972-11
罗马尼亚大国民议会举行第六届第九次会议齐奥塞斯库、波德纳拉希、曼内斯库等党政领导人出席,1972-11-26,1972-11
联大第一委员会决定建立机构研究各国对召开世界裁军会议问题意见强调只有在确保各国安全条件下裁军才能进展我代表团考虑到这决定反映许多爱好和平的中小国家的努力，	投了赞成票,1972-11-26,1972-11
联合国教科文组织会议闭幕,1972-11-26,1972-11
联大审委会讨论各代表团全权证书问题	塞内加尔、坦桑尼亚、中国代表反对朗诺集团和南非种族主义代表	在联合国占有席位,1972-11-26,1972-11
以色列军队入侵黎巴嫩南部被击退,1972-11-26,1972-11
柬王国民族团结政府是柬埔寨唯一合法政府,1972-11-26,1972-11
我历史剧《屈原》在日本新ｘì僜市上演,1972-11-26,1972-11
我清华大学代表团离卡拉奇回国,1972-11-26,1972-11
法国卫生部长接见我医学代表团,1972-11-26,1972-11
北京城区天气预报,1972-11-26,1972-11
发挥团支部作用做好青年教育工作	梁王三大队团支部教育团员和青年在三大革命运动中发挥积极作用,1972-11-27,1972-11
三湾大队党总支深入进行艰苦奋斗的革命传统教育	知识青年在农村广阔天地健康成长,1972-11-27,1972-11
中越签订一九七三年无偿给予越南经济、军事物资援助协定和供应越南军事装备物资议定书李先念副总理和黎清毅副总理签字周总理出席签字仪式,1972-11-27,1972-11
宾努首相和夫人到达武汉访问英·萨利特使同车到达潘振武副主任等到车站热烈欢迎,1972-11-27,1972-11
公路建设战线广大职工认真执行社会主义建设总路线全国公路黑色路面铺筑计划提前超额完成对支援工农业生产、加强国防建设、方便人民生活，发挥了重要作用,1972-11-27,1972-11
报眼毛主席语录,1972-11-27,1972-11
瓮安食品公司结合业务实际进行路线教育改善经营管理增加国家积累,1972-11-27,1972-11
新乡市百货公司坚决贯彻执行“发展经济，保障供给”的方针	努力增加商品品种不断提高服务质量,1972-11-27,1972-11
惠来县葵潭商店充分调动职工积极性健全经济核算制提高管理水平,1972-11-27,1972-11
提高为顾问服务的本领,1972-11-27,1972-11
小陆学卖肉,1972-11-27,1972-11
古老市场特色多,1972-11-27,1972-11
布斯塔尼大使和夫人举行招待会  庆祝黎巴嫩共和国国庆哈马德外长和夫人出席李先念副总理姬鹏飞外长等应邀出席布斯塔尼大使和姬鹏飞外长讲话，共祝黎中两国人民的友谊不断发展,1972-11-27,1972-11
姬鹏飞外长、何英副外长同哈马德外长进行会谈,1972-11-27,1972-11
巴卢库同志率阿军事友好代表团到达南京许世友同志设宴热烈欢迎阿尔巴尼亚战友巴卢库等同志由许世友、张才千等同志陪同参观了南京长江大桥,1972-11-27,1972-11
姬鹏飞外长何英副外长会见并设宴招待乌干达总统特使,1972-11-27,1972-11
埃及卫生部长、埃及卫生代表团团长马赫福兹教授举行告别宴会,1972-11-27,1972-11
为法国科学技术展览会开幕  我对外友协和科学技术协会举行宴会,1972-11-27,1972-11
叶志强副部长举行宴会  欢迎加拿大矿业金属代表团,1972-11-27,1972-11
军民心连心鱼水情谊深,1972-11-27,1972-11
我国银行、气象代表团和网球队访朝后回到北京,1972-11-27,1972-11
阶级的情谊重如泰山	——赞严伟才的国际主义精神,1972-11-27,1972-11
英勇无畏气冲霄汉,1972-11-27,1972-11
基层指挥员的光辉榜样,1972-11-27,1972-11
越南南方人民武装连续出击取得新战果在广治、巴地、边和等省歼灭许多敌人,1972-11-27,1972-11
越南人民军总司令部表彰第四军区军民的出色战功,1972-11-27,1972-11
越南外交部发言人发表声明谴责美帝继续袭击北方居民稠密区,1972-11-27,1972-11
西哈努克亲王和夫人访问朱乙里地区西哈努克亲王设宴招待咸镜北道的负责干部,1972-11-27,1972-11
越南外交部越南南方共和外交部发言人分别发表声明谴责美帝向南朝鲜运送武器,1972-11-27,1972-11
比兰德拉国王主持逊科西水电站竣工仪式拉宾德拉·纳特·夏尔马大臣和张彬团长先后讲话比兰德拉国王和艾什瓦尔雅王后接见张彬团长,1972-11-27,1972-11
中尼友好合作的结晶,1972-11-27,1972-11
阿尔巴尼亚语正字法会议闭幕	霍查同志和其他党政领导人出席闭幕式,1972-11-27,1972-11
霍查同志接见我冶金工业部代表团阿尔巴尼亚工矿部长设宴招待代表团,1972-11-27,1972-11
黄华宴请一些阿拉伯国家的代表,1972-11-27,1972-11
新西兰议会选举揭晓工党将组新内阁,1972-11-27,1972-11
古巴成立部长会议执行委员会,1972-11-27,1972-11
庆祝几内亚人民战胜葡萄牙入侵两周年塞拉勒窝内和马里首都分别举行游行集会和庆祝仪式埃塞俄比亚和扎伊尔报纸和电台发表社论强调非洲人民加强团结,1972-11-27,1972-11
伊朗首相助理卡沙尼举行招待会招待中国北京杂技团,1972-11-27,1972-11
我医学代表团访问法国里昂市,1972-11-27,1972-11
越南卫生部副部长欢宴我卫生工作考察团,1972-11-27,1972-11
墨西哥工商部长水利资源部长宴请我大使,1972-11-27,1972-11
中国银行代表团到达坦桑尼亚,1972-11-27,1972-11
我赴古巴友好参观团离古回国,1972-11-27,1972-11
北京城区天气预报,1972-11-27,1972-11
最热烈地祝贺阿尔巴尼亚独立六十周年和解放二十八周年毛泽东同志董必武同志朱德同志周恩来同志致电霍查同志列希同志谢胡同志,1972-11-28,1972-11
董必武代主席周恩来总理致电米歇尔·米孔贝罗总统和	阿尔班·尼亚莫亚总理	热烈祝贺布隆迪共和国成立六周年,1972-11-28,1972-11
董代主席致电蒙博托·塞塞·塞科总统热烈祝贺扎伊尔共和国第二共和国成立日,1972-11-28,1972-11
周恩来总理致电达达赫总统热烈祝贺毛里塔尼亚伊斯兰共和国国庆,1972-11-28,1972-11
报眼毛主席语录,1972-11-28,1972-11
英雄的阿尔巴尼亚是不可战胜的,1972-11-28,1972-11
就地取材材尽其用——辽宁金县是如何解决制造农具原料不足问题的？,1972-11-28,1972-11
广西七二五矿采矿不占农田,1972-11-28,1972-11
本溪歪头山铁矿建筑尾矿坝做到晚占田,1972-11-28,1972-11
广东派潭矿坚持边采矿边复田,1972-11-28,1972-11
按照农业需要发展手工业生产——湖北鄂城县华容区的调查,1972-11-28,1972-11
“就地取材”是好办法（编后）,1972-11-28,1972-11
湖北省革委会举行文艺晚会欢迎宾努首相和夫人等柬埔寨贵宾,1972-11-28,1972-11
黎清毅副总理率越政府经济代表团离京李先念韩念龙李强韩宗正王树声和首都群众数千人到机场热烈欢送柬埔寨王国民族团结政府大臣秀木也到机场欢送,1972-11-28,1972-11
周恩来乔冠华吴冷西朱穆之王冶秋会见美国专栏作家艾尔索普夫妇,1972-11-28,1972-11
哈马德外长等黎巴嫩贵宾观看革命现代京剧《平原作战》,1972-11-28,1972-11
巴卢库同志等在南京出席文艺晚会	许世友同志等陪同阿尔巴尼亚战友观看杂技表演,1972-11-28,1972-11
邓颖超吕玉兰康克清区棠亮同志会见美国妇女代表团,1972-11-28,1972-11
武夷新茶乡,1972-11-28,1972-11
南斯拉夫驻华大使举行国庆招待会,1972-11-28,1972-11
埃及卫生代表团前往上海访问,1972-11-28,1972-11
奥地利“中国研究会”主席布鲁诺·皮特曼离京,1972-11-28,1972-11
安致远宴请联合国人口活动基金总干事萨拉斯,1972-11-28,1972-11
南京部队炮兵某师党委  发扬理论联系实际的革命学风,1972-11-28,1972-11
正确处理革命与生产的关系,1972-11-28,1972-11
关于调查研究的点滴体会,1972-11-28,1972-11
用唯物辩证法指导老企业的改造,1972-11-28,1972-11
越《人民报》谴责美国出尔反尔态度顽固如美方想抛弃已商定的协定，越南人民将战斗到彻底胜利,1972-11-28,1972-11
老挝沙拉湾等省爱国军民粉碎敌人蚕食进攻柬埔寨人民武装在磅士卑等省猛攻金边伪军,1972-11-28,1972-11
越南外交部发言发表声明严厉谴责美帝袭击北方居民稠密区,1972-11-28,1972-11
瑞典首相接见我乒乓球队,1972-11-28,1972-11
第十五届斯堪的纳维亚国际乒乓球锦标赛闭幕南斯拉夫男队中国女队分别获得男女团体赛冠军,1972-11-28,1972-11
我医学代表团继续在巴黎访问,1972-11-28,1972-11
我科学技术工作者代表团到达巴基斯坦,1972-11-28,1972-11
朴成哲第二副首相接见我第三批赴朝友好参观团,1972-11-28,1972-11
我科学家代表团在纽约州斯托尼布鲁克访问,1972-11-28,1972-11
阿尔巴尼亚独立六十周年和解放二十八周年前夕阿人民以工农业生产新成就迎接光辉节日工矿企业职工深入开展社会主义竞赛，	农业劳动者加速进行秋收秋耕秋种,1972-11-28,1972-11
毛里塔尼亚培养本国干部获得显著成就新培养出来的本国干部和技术人员正为建设祖国发挥重大作用,1972-11-28,1972-11
布隆迪人民在反帝反殖斗争中不断前进,1972-11-28,1972-11
德意志民主共和国在联合国总部设立常驻观察员代表团,1972-11-28,1972-11
扎伊尔共和国,1972-11-28,1972-11
赤道和赤道线上的国家,1972-11-28,1972-11
莫三鼻给海峡,1972-11-28,1972-11
北京城区天气预报,1972-11-28,1972-11
认真落实政策加强企业管理峰峰矿务局调动广大职工积极性，促进了煤炭生产,1972-11-29,1972-11
严格执行“采掘并举，掘进先行”方针李封煤矿提前完成原煤生产和掘进进尺计划,1972-11-29,1972-11
领导干部坚持调查研究同群众一起解决问题平安煤矿连续五十五个月超额完成国家计划,1972-11-29,1972-11
关于中华人民共和国和乍得共和国建立外交关系的联合公报,1972-11-29,1972-11
董必武代主席、周恩来总理致电热烈祝贺南斯拉夫国庆,1972-11-29,1972-11
周恩来、姬鹏飞、何英会见哈马德外长和夫人等贵宾周总理同哈马德外长进行了友好的谈话,1972-11-29,1972-11
周恩来、何英会见乌干达总统特使翁多加同翁多加特使等进行了友好的谈话,1972-11-29,1972-11
报眼毛主席语录,1972-11-29,1972-11
张掖县委集中主要精力领导群众大办农业	全县粮食产量连续三年达到《纲要》指标，林、牧、副各业	和“五小”工业也得到较大发展,1972-11-29,1972-11
发扬艰苦奋斗作风做好调查研究工作	中共平山县委领导成员深入基层，认真总结经验，推动全县生产发展,1972-11-29,1972-11
坚持储粮备战备荒,1972-11-29,1972-11
积极生产农机配件促进农业机械化,1972-11-29,1972-11
发挥农村铁、木匠的作用,1972-11-29,1972-11
山区需要小型柴油机,1972-11-29,1972-11
重视农药机械的保养,1972-11-29,1972-11
北京市革委会、中阿友协、对外友协举行招待会热烈庆祝阿独立六十周年和解放二十八周年罗博大使和夫人等阿尔巴尼亚同志应邀出席	姚文元李先念郭沫若吴德等同志出席	郭沫若同志和罗博大使在洋溢着十分热烈友好气氛的招待会上祝酒,1972-11-29,1972-11
江苏省革委会和南京部队举行大会热烈庆祝阿尔巴尼亚人民的光辉节日巴卢库等同志应邀出席	在充满战斗团结气氛的大会上许世友和巴卢库先后讲话,1972-11-29,1972-11
两部阿尔巴尼亚影片和一部中国纪录片将在各地陆续上映,1972-11-29,1972-11
马来西亚羽毛球总会代表团举行答谢宴会,1972-11-29,1972-11
郭沫若吴有训武衡会见法国教授,1972-11-29,1972-11
日本政府事务当局访华团到京,1972-11-29,1972-11
贯彻执行民主集中制发挥集体领导作用福州部队某团党委正、副书记保持优良的民主作风，正确处理个人和党委其他成员的关系，加强了党委团结,1972-11-29,1972-11
王殊临时代办去西德赴任,1972-11-29,1972-11
郭又昌临时代办去多哥赴任,1972-11-29,1972-11
吴纽和夫人离开上海,1972-11-29,1972-11
中国女排访缅后回到北京,1972-11-29,1972-11
坚持科学种田的知识青年,1972-11-29,1972-11
福山铜矿党委热情帮助青工学技术,1972-11-29,1972-11
青年工人在成长,1972-11-29,1972-11
虚心学习精益求精,1972-11-29,1972-11
越南南方解放通讯社发表评论员文章指出美国政府的拙劣导演骗不了人揭露美国唆使阮文绍反对越美之间已经商定的问题，	以拖延签订和平协定,1972-11-29,1972-11
孙德胜主席嘉奖海防军民辉煌战功号召大力促进抗美救国战争直到彻底胜利,1972-11-29,1972-11
西哈努克亲王和夫人回到平壤  金日成首相和夫人前往车站迎接,1972-11-29,1972-11
越《人民报》热烈欢迎中越两国政府签订的协定越中人民战斗友谊和团结的新表现,1972-11-29,1972-11
