维护本国石油权益限制外国石油公司利润厄瓜多尔第七次提高石油参考价格委内瑞拉提高外国石油公司应缴的油田使用费,1973-11-19,1973-11
印度一些国会议员和教师举行示威反对苏联当局向印度作家发“奖金”,1973-11-19,1973-11
北京城区天气预报,1973-11-19,1973-11
毛泽东主席会见阮友寿主席和阮氏萍外长会见在充满中越人民兄弟情谊的气氛中进行。,1973-11-20,1973-11
首都人民隆重集会  热烈欢迎越南南方亲密战友阮友寿主席和代表团团员阮氏萍、黎光政、阮文广、胡春山等应邀出席大会朱德、叶剑英、吴德、姬鹏飞、方毅等出席，沙林察大臣、吴船大使也应邀出席北京市革委会主任吴德致欢迎词阮友寿主席发表热情洋溢的讲话,1973-11-20,1973-11
报眼毛主席语录,1973-11-20,1973-11
在首都人民欢迎越南南方共和临时革命政府代表团大会上吴德主任的欢迎词,1973-11-20,1973-11
在首都人民欢迎越南南方共和临时革命政府代表团大会上阮友寿主席的讲话,1973-11-20,1973-11
周恩来总理同阮友寿主席在十分亲切友好的气氛中继续会谈,1973-11-20,1973-11
阮友寿主席等越南南方亲密战友访问中越友好人民公社受到热烈欢迎李德生副主席陪同越南南方贵宾参观访问,1973-11-20,1973-11
象“铁人”那样生活战斗——记大庆油田工人新干部吕宗思,1973-11-20,1973-11
王猛主任举行宴会欢迎汉斯—迪特里希·根舍部长,1973-11-20,1973-11
荷兰经济事务大臣吕贝尔斯一行到京李强部长等前往机场迎接,1973-11-20,1973-11
王耀庭会见并宴请瑞士贸易代表团,1973-11-20,1973-11
日本羽毛球代表团举行答谢宴会,1973-11-20,1973-11
结束对我国的参观访问罗马尼亚旅行团离开北京前往朝鲜,1973-11-20,1973-11
学习马列的课堂路线教育的阵地——记北京郊区崔窑大队的政治夜校,1973-11-20,1973-11
洪泽好风光,1973-11-20,1973-11
雪夜送亲人,1973-11-20,1973-11
一杯水,1973-11-20,1973-11
社会主义新道德的光辉——苏州市拾物招领处见闻,1973-11-20,1973-11
在越南南方共和临时革命政府领导下继续进行不懈斗争越南南方人民捍卫和巩固胜利成果西贡政权破坏巴黎协定和抢占人民胜利果实的图谋遭到沉重打击,1973-11-20,1973-11
柬人民武装不断进攻拔除敌人一些据点在湄公河上袭击敌军战船队击沉击伤十三艘,1973-11-20,1973-11
结束对我国的国事访问后史蒂文斯总统回到弗里敦,1973-11-20,1973-11
伊朗古拉姆·礼萨亲王和夫人会见我大使和排球代表团全体成员,1973-11-20,1973-11
出席国际红十字大会的我国政府代表团团长等宴请越南和朝鲜政府代表团团长,1973-11-20,1973-11
我红十字会代表团离德黑兰前往阿尔及利亚访问,1973-11-20,1973-11
越南南方共和和越南外交部发言人发表声明谴责西贡政权飞机轰炸西宁省一些地区,1973-11-20,1973-11
越南外交部发言人发表声明谴责美机侵犯越南领空,1973-11-20,1973-11
西贡士兵纷纷弃暗投明,1973-11-20,1973-11
广大职工积极开展技术革新运动获得显著成绩朝鲜一批工矿企业提前完成今年生产计划,1973-11-20,1973-11
反对朴正熙集团法西斯统治争取民主权利南朝鲜青年学生继续示威集会罢课,1973-11-20,1973-11
《新苏丹》周刊和委内瑞拉《现代》杂志发表文章揭露苏美在中东、地中海和印度洋加紧争夺霸权圭亚那总理伯纳姆指责美苏把中东当作武器试验场,1973-11-20,1973-11
巴基斯坦总理布托发表讲话重申对遣返巴基斯坦战俘的立场强调不允许审判巴基斯坦战俘,1973-11-20,1973-11
拉美国家举行外长会议并通过声明加强团结合作保卫国家主权和经济利益,1973-11-20,1973-11
非洲发展中国家崭新经济面貌的缩影——第十届阿尔及尔国际博览会散记,1973-11-20,1973-11
北京城区天气预报,1973-11-20,1973-11
越南南方共和临时革命政府代表团举行告别宴会周恩来、李德生、张春桥、李先念、吴德、邓小平、阿沛·阿旺晋美、姬鹏飞、耿飚、方毅、李强、肖劲光等应邀出席宴会吴船大使和沙林察大臣、秀蒲拉西大臣也应邀出席阮友寿主席和周总理讲话。大家共祝中越人民的伟大友谊和战斗团结不断发展巩固,1973-11-21,1973-11
关于一九七四年中国给予越南南方共和无偿经济援助的协定在北京签字阮友寿主席、李先念副总理出席签字仪式李强部长、阮氏萍外长签字,1973-11-21,1973-11
应中华人民共和国政府的邀请英国首相希思将于明年一月来我国访问,1973-11-21,1973-11
应我国政府邀请前来进行友好访问扎伊尔共和国政府代表团到京姬鹏飞外长等到机场欢迎恩古扎·卡尔·伊邦德等贵宾,1973-11-21,1973-11
周恩来总理同阮友寿主席继续会谈,1973-11-21,1973-11
阮友寿主席等越南南方战友参观北京制药厂受到工人群众热烈欢迎邓小平副总理等陪同参观,1973-11-21,1973-11
报眼毛主席语录,1973-11-21,1973-11
在越南南方共和临时革命政府代表团的告别宴会上阮友寿主席的讲话,1973-11-21,1973-11
在越南南方共和临时革命政府代表团的告别宴会上周恩来总理的祝酒词,1973-11-21,1973-11
廖承志会长会见并宴请日本地方自治体访华友好代表团,1973-11-21,1973-11
继续对我国进行访问扬·珀仓副主席访问朝鲜后回到北京,1973-11-21,1973-11
为汉斯—迪特里希·根舍部长和夫人访问中国西德驻华大使保尔斯举行宴会王猛主任、乔冠华副部长等应邀出席,1973-11-21,1973-11
黄树则副部长会见并宴请越南医学考察组,1973-11-21,1973-11
荷兰工业技术展览会在北京开幕李强部长为展览会剪彩吕贝尔斯大臣和王耀庭主任讲话,1973-11-21,1973-11
何英副部长会见索马里银行代表团,1973-11-21,1973-11
参加在日本举行的一个科学会议后北京医学院负责人米勒等回到北京,1973-11-21,1973-11
中国政府海运代表团前往法国访问,1973-11-21,1973-11
党的基本路线是劳动人民的生命线——广东琼海县泮水公社东山大队进行基本路线教育纪实,1973-11-21,1973-11
艰苦奋斗改造山区——记湖北保康县大干大变的事迹,1973-11-21,1973-11
光荣传统永不忘勤俭节约广积粮,1973-11-21,1973-11
提倡顾全大局,1973-11-21,1973-11
从“灵感论”看林彪的反动面目,1973-11-21,1973-11
比较是医治受骗的好方子,1973-11-21,1973-11
打碎这块“敲门砖”,1973-11-21,1973-11
如此“成仁”,1973-11-21,1973-11
金日成主席接见罗马尼亚政府代表团和扎伊尔共和国全国执委会代表团同罗马尼亚和扎伊尔客人进行亲切友好谈话,1973-11-21,1973-11
孙德胜主席致电阮友寿主席黄晋发主席最亲切慰问南方中部中区受灾同胞范文同总理请阮文进团长把慰问物资转交给南方同胞,1973-11-21,1973-11
桥梁工人、干部和青年突击队忘我劳动战胜困难越南南方广治省提前完成东河桥重建工程,1973-11-21,1973-11
西贡政权违反巴黎协定多次发动军事行动越南南方军民迎头痛击给予应有惩罚,1973-11-21,1973-11
金边又一名空军军官驾机轰炸伪总统府,1973-11-21,1973-11
保卫解放区重建新家园,1973-11-21,1973-11
坚持无产阶级国际主义,1973-11-21,1973-11
非洲统一组织举行部长理事会特别会议塞拉西皇帝讲话强调以色列必须从被占领的阿拉伯领土上撤军阿萨德总统致电感谢非洲国家支持阿拉伯国家反对以色列侵略,1973-11-21,1973-11
阿拉伯石油输出国组织会议决定继续用石油武器打击支持以色列的国家科威特报纸强调阿拉伯人民加强团结不要相信苏美“和平保证”,1973-11-21,1973-11
旅日朝鲜人总联合会中央常任委员会发表声明支持关于召开大民族会议的合理主张旅美爱国朝侨在纽约示威反对制造“两个朝鲜”,1973-11-21,1973-11
北欧四国政治和文化组织代表集会声援朝鲜人民争取祖国统一斗争,1973-11-21,1973-11
美国能源危机进一步加剧国会和政府不得不采取一些非常措施,1973-11-21,1973-11
第二十二届国际红十字大会闭幕伊朗首相胡韦达出席闭幕会议并发表讲话,1973-11-21,1973-11
日本举行第四十届全国大学生乒乓球锦标赛,1973-11-21,1973-11
墨西哥培育小麦良种取得成绩这种小麦具有抗倒伏、抗锈病、适应性强、产量高等优点,1973-11-21,1973-11
北京城区天气预报,1973-11-21,1973-11
阮友寿主席率代表团离京到天津周恩来、李德生、张春桥、李先念、吴德、阿沛·阿旺晋美、姬鹏飞、方毅、李强、肖劲光和数千群众到北京车站热烈欢送邓小平、韩念龙陪同越南南方战友到天津访问天津市成千上万群众热烈欢迎越南南方战友天津市革委会主任解学恭宴请贵宾,1973-11-22,1973-11
认真贯彻执行“以粮为纲，全面发展”的方针湖北四川陕西安徽新疆棉花丰收棉区广大社员满怀喜悦心情踊跃向国家出售新棉,1973-11-22,1973-11
周恩来总理致电杜尔总统  热烈祝贺几内亚人民反侵略胜利三周年,1973-11-22,1973-11
姬鹏飞外长举行宴会  热烈欢迎扎伊尔共和国政府代表团在充满友好气氛的宴会上，姬鹏飞外长和恩古扎国务委员讲话,1973-11-22,1973-11
报眼毛主席语录,1973-11-22,1973-11
退伍不褪色,1973-11-22,1973-11
右倾机会主义和孔子思想,1973-11-22,1973-11
在斗争第一线成长——记山东诸城县小凤凰大队回乡知识青年王敢冲的事迹,1973-11-22,1973-11
让艰苦奋斗的革命精神代代相传老红军战士甘祖昌给知识青年的信,1973-11-22,1973-11
给后代留下什么,1973-11-22,1973-11
学习老干部接好革命班,1973-11-22,1973-11
应该重视回乡青年的思想教育,1973-11-22,1973-11
阮友寿主席参观天津广播器材厂邓小平、解学恭、韩念龙陪同越南南方战友参观,1973-11-22,1973-11
《全国连环画、中国画展览》和《户县农民画展》《一九七三年全国摄影艺术展览》在北京闭幕三个展览显示了我国美术创作和摄影艺术创作的新收获，受到广大观众热烈赞扬,1973-11-22,1973-11
李先念副总理、陈希愈行长会见索马里银行代表团,1973-11-22,1973-11
中阿两国科学院科学合作协定和一九七四年执行计划在京签字郭沫若院长和阿列克谢·塔契·布达院长签字,1973-11-22,1973-11
姬鹏飞外长同恩古扎国务委员会谈会谈在友好的气氛中进行,1973-11-22,1973-11
廖承志会长会见并宴请日本朋友,1973-11-22,1973-11
李强部长宴请吕贝尔斯大臣,1973-11-22,1973-11
朝鲜第二批友好访华参观团离京回国,1973-11-22,1973-11
谢华会见并宴请日本第二批医师针灸师友好访华团,1973-11-22,1973-11
应邀前往瑞典冰岛芬兰进行友好访问中国乒乓球队离开北京,1973-11-22,1973-11
金日成主席致电布迈丁主席感谢对朝鲜人民争取实现国家统一事业的支持,1973-11-22,1973-11
南朝鲜统一革命党中央发表声明热烈支持召开大民族会议的建议,1973-11-22,1973-11
越南南方民族解放阵线中央和共和临时革命政府号召中部中区军民团结互助战胜灾害恢复生产,1973-11-22,1973-11
罗马尼亚等国代表在联大政委会上支持朝鲜的严正立场朝鲜和平统一问题应由朝鲜人民自己解决,1973-11-22,1973-11
越南同卢森堡和上沃尔特建交,1973-11-22,1973-11
工业战线上的先进事迹,1973-11-22,1973-11
我政府代表团到达科纳克里,1973-11-22,1973-11
广州杂技团结束在惠灵顿的访问演出,1973-11-22,1973-11
我医学代表团拜会缅甸卫生和教育部长,1973-11-22,1973-11
我医学代表团结束在丹麦的访问,1973-11-22,1973-11
我大使为我体育代表团访问南斯拉夫举行招待会,1973-11-22,1973-11
莫三鼻给和安哥拉爱国武装不断打击敌人坦桑政府代表团访问莫三鼻给解放区支持莫三鼻给人民斗争,1973-11-22,1973-11
妄图实现老沙皇没有实现的建立世界帝国的迷梦苏修社会帝国主义加紧对南亚和印度洋扩张,1973-11-22,1973-11
日本《东风月刊》揭露苏联社会帝国主义的危险性谴责苏修向南亚和中东等地侵略扩张,1973-11-22,1973-11
法国一些知名人士发表讲话和文章强调进一步加强西欧的政治联合指出不能对苏联日益增长的军事力量置若罔闻,1973-11-22,1973-11
为即将举行的九国首脑会议进行准备西欧“共同市场”九国外长会议在哥本哈根举行,1973-11-22,1973-11
巴基斯坦伊朗签订经济议定书,1973-11-22,1973-11
印度财政赤字剧增这同大量增加军事开支有直接关系,1973-11-22,1973-11
北京城区天气预报,1973-11-22,1973-11
我国重要粮食高产地区之一  苏州地区农业全面丰收,1973-11-23,1973-11
阮友寿主席率代表团到达广州访问邓小平、韩念龙陪同到达广州广州市数千群众热烈欢迎越南南方战友广东省革委会设宴热烈欢迎越南南方贵宾丁盛主任和阮友寿主席讲话,1973-11-23,1973-11
阮友寿主席拜会哥沙曼王后并同西哈努克亲王和宾努首相进行友好的会见,1973-11-23,1973-11
周恩来总理、姬鹏飞外长会见恩古扎国务委员和他率领的代表团,1973-11-23,1973-11
周恩来总理、王猛主任会见  汉斯—迪特里希·根舍部长,1973-11-23,1973-11
报眼毛主席语录,1973-11-23,1973-11
抓紧抓好基本路线教育——武钢烧结厂一烧车间甲班工段和检修工段忆苦对比的调查,1973-11-23,1973-11
一批厂矿完成全年计划,1973-11-23,1973-11
抚顺煤矿运输部提前做好冬季运输准备,1973-11-23,1973-11
焦作市水泥厂安排好冬季生产和职工生活,1973-11-23,1973-11
实践出真知——安徽铜陵市铜官山化肥厂工人革新技术的故事二则,1973-11-23,1973-11
林海架彩虹——访大兴安岭新林林场女子架桥队,1973-11-23,1973-11
女石匠——记民兵营长李月梅的先进事迹,1973-11-23,1973-11
生产斗争中的女闯将,1973-11-23,1973-11
迎着阶级斗争风浪前进——记新疆疏勒县县委副书记阿衣木汗,1973-11-23,1973-11
兄弟情谊深似海,1973-11-23,1973-11
李先念副总理、李强部长会见吕贝尔斯大臣和威斯曼主席,1973-11-23,1973-11
为荷兰工业技术展览会在京开幕威斯曼主席举行招待会,1973-11-23,1973-11
喀麦隆医学代表团离京回国,1973-11-23,1973-11
姬外长同恩古扎国务委员继续会谈扎伊尔共和国政府代表团在北京参观,1973-11-23,1973-11
廖承志会见全日本港湾工会友好访华团,1973-11-23,1973-11
汉斯—迪特里希·根舍部长举行招待会,1973-11-23,1973-11
对外友协和中朝友协举行电影招待会庆祝中朝经济及文化合作协定二十周年,1973-11-23,1973-11
日本日中备忘录贸易访华代表团到京廖承志、刘希文等到机场迎接,1973-11-23,1973-11
索马里银行代表团去南方访问,1973-11-23,1973-11
朝鲜民主主义人民共和国代表团发表声明联大政委会在有朝鲜民主主义人民共和国代表参加下讨论朝鲜问题和通过的决定，是全体朝鲜人民和全世界爱好和平国家共同努力的成果。朝鲜政府和人民将为从南朝鲜撤出一切打着“联合国军”旗号的外国军队和为在没有任何外来势力干涉的情况下实现国家的自主和平统一而斗争到底,1973-11-23,1973-11
联大政委会结束关于朝鲜问题的辩论并通过一项声明决定立即解散“联合国韩国统一复兴委员会”希望朝鲜南北两方本着一九七二年七月四日联合声明中三项原则的精神继续对话同时宣布关于朝鲜问题的两项决议草案将不在本届联大提付表决,1973-11-23,1973-11
朝鲜对外文委和朝中友协举行电影酒会庆祝朝中经济及文化合作协定二十周年,1973-11-23,1973-11
朝鲜代表团团长李钟木在联大政委会结束朝鲜问题的辩论后发言任何力量扭转不了朝鲜民族重新统一的强大潮流,1973-11-23,1973-11
所谓“联合国韩国统一复兴委员会”,1973-11-23,1973-11
中朝经济和文化合作的巨大成就,1973-11-23,1973-11
就联大即将讨论恢复柬王国政府在联合国合法权利问题柬埔寨国家元首西哈努克亲王发表声明对在本届联大期间支持柬埔寨王国的各国政府表示感谢并希望它们继续给予支持,1973-11-23,1973-11
沙林察外交大臣举行记者招待会在会上宣读了西哈努克亲王的声明,1973-11-23,1973-11
石油输出国组织接纳厄瓜多尔为成员国,1973-11-23,1973-11
索马里政府向遭受旱灾的西非六国赠款,1973-11-23,1973-11
我代表庄焰在联合国大会全体会议上发言揭露苏联关于安理会常任理事国削减军费提案是个骗局指出这个提案的用心是企图掩盖苏联进行大规模军备竞赛和反对真正裁军的顽固立场，而把所谓拒绝裁军的责任转嫁到别国身上,1973-11-23,1973-11
拉美国营石油互助协会举行会议协调彼此的政策维护民族利益,1973-11-23,1973-11
陈旧的货色,1973-11-23,1973-11
北京城区天气预报,1973-11-23,1973-11
联合公报,1973-11-24,1973-11
满载中国人民对越南南方人民深厚的兄弟情谊阮友寿主席率代表团离开广州邓小平、韩念龙、丁盛等和数千群众到机场热烈欢送越南南方战友,1973-11-24,1973-11
周恩来总理、李强部长  会见罗马尼亚政府贸易代表团,1973-11-24,1973-11
周恩来总理、方毅部长  会见塞内加尔政府代表团,1973-11-24,1973-11
邓小平韩念龙看望哥沙曼王后转达了毛主席、董必武代主席、周恩来总理、江青同志、邓颖超同志对哥沙曼王后的问候,1973-11-24,1973-11
朝鲜驻中国大使玄峻极举行宴会庆祝朝中经济及文化合作协定二十周年李德生、吴德、倪志福等同志应邀出席玄峻极大使和吴德同志讲话,1973-11-24,1973-11
报眼毛主席语录,1973-11-24,1973-11
在十大精神鼓舞下，深入开展农业学大寨运动东北三省掀起农田水利基本建设热潮,1973-11-24,1973-11
“一定要为革命多作贡献！”——肇东县农村广大社员售粮见闻,1973-11-24,1973-11
朝鲜人民统一祖国的斗争一定胜利（社论）,1973-11-24,1973-11
阮友寿主席给周总理的感谢电,1973-11-24,1973-11
中国和罗马尼亚政府一九七四年交换货物和付款议定书在京签字李先念出席签字仪式李强、扬·珀仓分别签字,1973-11-24,1973-11
什图拉大使举行宴会热烈庆祝阿中建交二十四周年姬鹏飞耿飚余湛柴树藩李达等应邀出席,1973-11-24,1973-11
应邀前往老挝解放区进行友好访问中国友好代表团离开北京耿飚符浩等到机场送行,1973-11-24,1973-11
扎伊尔政府代表团到天津访问,1973-11-24,1973-11
汉斯—迪特里希·根舍和夫人离京回国,1973-11-24,1973-11
中国摄影代表团访问越南后回到北京,1973-11-24,1973-11
中塞经济技术合作协定和贸易协定签字塞克部长举行答谢宴会，方毅部长等应邀出席,1973-11-24,1973-11
日本邮电访华代表团到京,1973-11-24,1973-11
我赴荷兰展览团团长孙锁昌离京,1973-11-24,1973-11
结束对伊朗的友好访问中国排球代表团回到北京,1973-11-24,1973-11
为罗马尼亚政府贸易代表团访华格夫里列斯库大使举行宴会李先念李强李水清陈绍昆等应邀出席,1973-11-24,1973-11
阿尔巴尼亚科学院代表团离京回国,1973-11-24,1973-11
中国中日备忘录贸易办事处负责人刘希文设宴欢迎日本日中备忘录贸易访华代表团廖承志会长出席宴会,1973-11-24,1973-11
结束对非洲五国的友好访问中国四川省乒乓球队回到北京,1973-11-24,1973-11
东海前哨的战斗堡垒——记浙江省普陀县白沙渔业大队民兵连,1973-11-24,1973-11
时刻警惕,1973-11-24,1973-11
劳武结合常备不懈,1973-11-24,1973-11
五·七干校是社会主义时期的新型干部学校,1973-11-24,1973-11
就第二十八届联大讨论朝鲜问题朝鲜民主主义人民共和国外交部发表声明指出联大讨论过程说明朝鲜统一事业的支持者和同情者队伍日益壮大,1973-11-24,1973-11
摧毁敌军营地截击增援敌军柬人民武装在四号公路战场连战皆捷,1973-11-24,1973-11
朝鲜《劳动新闻》就联大讨论朝鲜问题的结果发表社论朝鲜自主和平统一祖国方针的胜利,1973-11-24,1973-11
老挝执行协定中央联合委员会举行首次会议,1973-11-24,1973-11
我驻朝鲜大使举行宴会庆祝中朝经济及文化合作协定二十周年李根模、杨亨燮、崔载羽、许锬等同志应邀出席,1973-11-24,1973-11
法国总理夫人招待访法中国友好参观团,1973-11-24,1973-11
我驻阿尔巴尼亚大使举行招待会庆祝中阿建交二十四周年纳赛外长等应邀出席,1973-11-24,1973-11
我国际贸促会贸易代表团抵菲律宾访问,1973-11-24,1973-11
我为阿富汗无偿建造一座医院的会谈纪要签字仪式在喀布尔举行,1973-11-24,1973-11
我摄影代表团结束对越南访问,1973-11-24,1973-11
非洲统一组织部长理事会特别会议闭幕通过有关中东等问题的决议和关于国际形势的声明要求以色列立即无条件撤出被占的阿拉伯领土和实现巴勒斯坦民族权利会议主席致电埃及、叙利亚和巴勒斯坦解放组织领导人表示继续支持阿拉伯人民斗争,1973-11-24,1973-11
沙特阿拉伯国王、黎巴嫩总统等发表谈话和文告加强阿拉伯团结支持巴勒斯坦人民收复家园,1973-11-24,1973-11
联大政委会通过关于燃烧武器问题的提案我投赞成票，苏联、美国、以色列和南非等弃权。我代表发言指出，我们赞成禁止使用燃烧武器，是从反对侵略战争、维护被压迫民族自卫权利的立场出发的,1973-11-24,1973-11
几内亚人民热烈庆祝反侵略战争胜利三周年杜尔总统出席庆祝大会并发表讲话阿明总统、佩雷拉总书记和我政府代表团应邀出席,1973-11-24,1973-11
法国外长若贝尔在西欧联盟议会上讲话美苏“缓和”只是历史的一瞬，争夺仍然存在,1973-11-24,1973-11
日本内阁会议决定对中东的新政策主张以色列军队撤出在一九六七年战争中占领的全部领土，承认和尊重巴勒斯坦人民的合法权利,1973-11-24,1973-11
苏里南民族党派联盟在大选中获胜,1973-11-24,1973-11
北京城区天气预报,1973-11-24,1973-11
安仁县各级党组织层层举办学习班联系阶级斗争实际深入进行路线教育,1973-11-25,1973-11
党的基本路线要经常讲反复讲天津化工局认真总结和推广路线教育的经验,1973-11-25,1973-11
积极帮助工农干部提高路线觉悟中共四子王旗委举办学习班，分期分批组织基层干部深入学习十大文件,1973-11-25,1973-11
贯彻执行“以粮为纲，全面发展”的方针江苏河北河南山东棉花丰收,1973-11-25,1973-11
报眼毛主席语录,1973-11-25,1973-11
靠路线指方向靠群众办水利——辽宁庄河县发动群众大修水利的经验,1973-11-25,1973-11
“一滴水”的精神——记山西阳城县推广白桑大队抗旱经验的斗争,1973-11-25,1973-11
桂花之乡,1973-11-25,1973-11
雀儿山麓苹果香,1973-11-25,1973-11
那坡县兽皮增产,1973-11-25,1973-11
让青春永放光辉——记河北省承德钢铁厂女医生孙志成,1973-11-25,1973-11
怒江两岸美如画——记云南保山县各族人民共同开发怒江坝的事迹,1973-11-25,1973-11
大森林的主人访黑龙江省穆棱林区,1973-11-25,1973-11
“世界屋脊”上的雷达兵,1973-11-25,1973-11
罗马尼亚政府贸易代表团离京回国李先念副总理、李强部长等前往机场送行,1973-11-25,1973-11
邓小平副总理、张香山副会长会见日本青年团协议会访华团,1973-11-25,1973-11
庆祝扎伊尔第二共和国八周年扎伊尔驻中国大使举行招待会邓小平副总理、姬鹏飞外长等应邀出席,1973-11-25,1973-11
郭沫若副委员长会见日本地方自治体访华友好代表团,1973-11-25,1973-11
钟夫翔部长会见日本邮电访华代表团申光副部长设宴招待日本客人,1973-11-25,1973-11
塞内加尔政府代表团离京回国方毅部长等到机场欢送,1973-11-25,1973-11
荷兰经济事务大臣吕贝尔斯离京回国李强部长等前往机场送行,1973-11-25,1973-11
黄树则副部长会见并宴请世界卫生组织考察组,1973-11-25,1973-11
伊拉克新任驻华大使到京,1973-11-25,1973-11
结束在法国的参观访问中国友好参观团回到北京,1973-11-25,1973-11
马仁辉局长宴请国际民航组织理事会主席,1973-11-25,1973-11
前往阿尔巴尼亚参加科技合作会议我科技合作代表团离京,1973-11-25,1973-11
阮友寿主席率越南南方共和代表团到达河内范文同总理和阮维桢副总理等前往机场迎接越《人民报》社论指出代表团访华成功是中越人民亲密团结的新体现,1973-11-25,1973-11
越南南方共和临时革命政府军事代表团就南方局势提出急待解决的三个问题,1973-11-25,1973-11
联合国大会政委会通过一项决议敦促所有国家接受宣布印度洋为和平区我代表发言指出必须制止超级大国在印度洋地区的军事扩张和争霸活动表决时，我代表团投赞成票，苏联、美国、南非、葡萄牙、以色列等投弃权票,1973-11-25,1973-11
新沙皇在印度洋的扩张,1973-11-25,1973-11
