秦力生会见并宴请英科学家代表团,1973-11-13,1973-11
出席联合国人口委员会第十七次会议后我国观察员回到北京,1973-11-13,1973-11
中国医学代表团去缅甸访问,1973-11-13,1973-11
绿春县适应山区特点采取多种形式办学大力发展哈尼族聚居区的教育事业,1973-11-13,1973-11
鄂伦春新人,1973-11-13,1973-11
苏发努冯亲王致电西哈努克亲王和宾努亲王最热烈祝贺柬埔寨王国国庆二十周年,1973-11-13,1973-11
声援南朝鲜学生反对朴正熙集团的斗争平壤两万多青年学生举行集会,1973-11-13,1973-11
柬埔寨人民武装解放又一重镇斯朗镇摧毁伪军四个据点，歼敌一千名,1973-11-13,1973-11
朝鲜《劳动新闻》发表文章指出实行单一国号联邦制是统一朝鲜最合理方案阿《人民之声报》支持朝鲜人民自主和平统一祖国的斗争,1973-11-13,1973-11
广州杂技团在新西兰首次演出新西兰—中国协会惠灵顿分会举行招待会欢迎杂技团,1973-11-13,1973-11
我男女篮球队在朝鲜举行首场友谊赛,1973-11-13,1973-11
我解放军男子篮球队在巴举行首场友谊赛,1973-11-13,1973-11
新华通讯社副社长穆青到达南斯拉夫,1973-11-13,1973-11
在朴正熙集团的反动统治下南朝鲜失业失学情况严重,1973-11-13,1973-11
进一步贯彻教育与生产劳动相结合的方针阿尔巴尼亚教育事业取得新成就,1973-11-13,1973-11
罗中友好农业社战胜自然灾害获得好收成,1973-11-13,1973-11
拉美国家加强经济合作发展民族经济墨西哥和萨尔瓦多将建立常设联合委员会以加强经济关系安第斯条约组织和中美洲共同市场代表讨论相互合作问题,1973-11-13,1973-11
抗议垄断资本集团剥削反对通货膨胀和物价上涨日本十万工人在东京集会和示威游行冲绳农民代表在东京集会要求提高甘蔗收购价格,1973-11-13,1973-11
加拿大主张扩大沿海自然资源管辖权,1973-11-13,1973-11
阿尔巴尼亚和布隆迪建交,1973-11-13,1973-11
参加联合国大会关于朝鲜问题的讨论朝鲜民主主义人民共和国代表团抵纽约,1973-11-13,1973-11
巴基斯坦外交部发言人发表谈话要求印度政府加快遣返巴基斯坦战俘,1973-11-13,1973-11
壁画之都,1973-11-13,1973-11
北京城区天气预报,1973-11-13,1973-11
认真学习新党章坚决执行新党章上海工交战线广大党员和群众决心按照新党章要求，加强党的建设，增强党的观念，为完成十大提出的各项任务而奋斗,1973-11-14,1973-11
西藏实现一项农业生产重要变革打破了“高原不能种植冬小麦”的迷信，夺得今年冬小麦大面积丰产广大翻身农民响应自治区党委号召，扩大播种面积，力争明年更大丰收,1973-11-14,1973-11
基辛格国务卿举行宴会周恩来总理、叶剑英副主席、姬鹏飞外长、乔冠华副外长应邀出席基辛格和姬鹏飞在宴会上祝酒,1973-11-14,1973-11
周恩来、姬鹏飞、乔冠华同基辛格再次举行会谈,1973-11-14,1973-11
耿飚同志举行宴会  热烈欢迎法国《红色人道报》马克思列宁主义共产党人代表团,1973-11-14,1973-11
报眼毛主席语录,1973-11-14,1973-11
秦王朝建立过程中复辟与反复辟的斗争——兼论儒法论争的社会基础,1973-11-14,1973-11
发扬艰苦奋斗光荣传统保持人民军队政治本色北京部队某部红军团指战员以马克思主义、列宁主义、毛泽东思想为武器，深入批判林彪一伙破坏我军光荣传统的罪行，提高了路线斗争觉悟，激发了继续革命的旺盛意志,1973-11-14,1973-11
切实加强党同群众的联系黎城县各级党组织聘请一批老贫老、老劳模、复员退伍军人和退休老干部当“参谋”。他们协助党组织正确执行党的路线和政策，培养革命事业接班人，发挥了积极作用,1973-11-14,1973-11
贵州册亨布依族自治县各级党组织和教育部门依靠群众发展农村教育事业,1973-11-14,1973-11
我国族日华侨代表团离广州去日本,1973-11-14,1973-11
美籍中国物理学家吴健雄、袁家骝博士离广州返美国,1973-11-14,1973-11
立大志抓大事——湖南安乡县以路线为纲建设社会主义大农业的事迹,1973-11-14,1973-11
群众批评大有益,1973-11-14,1973-11
喜看巫峡新山乡——记湖北巴东县泉口公社艰苦建设山区的斗争,1973-11-14,1973-11
布迈丁主席在联大将讨论朝鲜问题时致电不结盟国家首脑呼吁为正确解决朝鲜问题作出努力,1973-11-14,1973-11
范文同总理接见英·萨利特使,1973-11-14,1973-11
朝鲜《劳动新闻》揭露所谓“关于韩国问题的备忘录”实质谴责朴正熙集团的分裂阴谋和卖国罪行,1973-11-14,1973-11
反对法西斯统治争取民主权利汉城梨花女子大学学生展开斗争,1973-11-14,1973-11
黄华会见朝鲜代表团团长李钟木,1973-11-14,1973-11
尼泊尔《新时代》周刊发表社论支持朝鲜统一并作为一个国家进入联合国,1973-11-14,1973-11
康良煜副主席接见我体育代表团,1973-11-14,1973-11
我广播代表团到越南进行友好访问,1973-11-14,1973-11
我红十字会代表团长拜会莎姆斯·巴列维公主祝贺伊朗红狮与太阳协会成立五十周年,1973-11-14,1973-11
中国和瑞士签订民用航空运输协定,1973-11-14,1973-11
印度柯棣华大夫纪念委员会英国分会成立,1973-11-14,1973-11
结束对阿尔巴尼亚的友好访问我旅游局友好参观团前往罗马尼亚,1973-11-14,1973-11
我乒乓球代表团到阿根廷进行友好访问,1973-11-14,1973-11
我排球代表团到伊朗进行友好访问,1973-11-14,1973-11
我医学代表团到达仰光,1973-11-14,1973-11
柬人民武装在金边南部顽强战斗重创敌人歼灭大批伪军，控制三十八号公路一段及特诺河,1973-11-14,1973-11
亚非拉国家积极发展民族经济斯里兰卡试种棉花获初步成果几内亚努力发展电力工业有成就牙买加争取食物自给特立尼达和多巴哥发展生产减少粮食进口,1973-11-14,1973-11
尼迈里总统发表讲话重申支持阿拉伯人民斗争强调巴勒斯坦人民的民族权利不可退让突尼斯舆论指出只要阿拉伯和巴勒斯坦人民未收回被霸占的领土和合法权利，近东就不可能有和平,1973-11-14,1973-11
联合国粮农组织举行第十七届大会我代表首次参加受到欢迎阿尔巴尼亚等国被接纳为会员国,1973-11-14,1973-11
斯里兰卡《人民力量报》发表评论谴责超级大国在印度洋争霸,1973-11-14,1973-11
“缓和”并非现实西欧应加强防御西德国防部长强调欧洲本身应该对自己的防务有足够关心瑞士军队总参谋长指出要保持国家独立需拥有有效的防御,1973-11-14,1973-11
新兴的舒威巴工业区,1973-11-14,1973-11
北京城区天气预报,1973-11-14,1973-11
认真办好不脱产干部学习班——湖南黔阳县轮训农村生产大队党支部书记的调查,1973-11-15,1973-11
公报,1973-11-15,1973-11
史蒂文斯总统在广州参观徐向前、何英、焦林义、罗范群等陪同贵宾参观,1973-11-15,1973-11
基辛格国务卿一行离京去日本姬鹏飞乔冠华朱穆之马仁辉等到机场送行,1973-11-15,1973-11
珀仓副主席率罗贸易代表团到京李先念副总理、李强部长等前往机场欢迎,1973-11-15,1973-11
甜菜丰收,1973-11-15,1973-11
报眼毛主席语录,1973-11-15,1973-11
天津海河新貌,1973-11-15,1973-11
坚持常年大办水利加快农业发展步伐十年来，北京市广大人民对海河北系各河的中上游地区，坚持进行综合治理，兴建大批农田水利工程，有效地提高了农田抗灾能力,1973-11-15,1973-11
站在海河头，想到海河尾邢台县人民综合治理山区取得成绩,1973-11-15,1973-11
鲁北人民多年的愿望实现了——记鲁北人民根治水患的斗争,1973-11-15,1973-11
致力于创新,1973-11-15,1973-11
连环画大有可为,1973-11-15,1973-11
我国积极研究和应用激光技术到目前为止，科学研究和工业生产部门已研制成功数十种常用的激光材料和各种配套元件。不少单位在应用激光技术以后，提高了工作效率，促进了技术革新的发展。,1973-11-15,1973-11
陈平临时代办举行记者招待会散发越南南方共和临时革命政府十一月九日发表的关于西贡政权极其严重的战争行动的声明,1973-11-15,1973-11
郭沫若副委员长会见并宴请日本书法代表团,1973-11-15,1973-11
为我冶金工作组结束对阿尔巴尼亚的访问什图拉大使举行宴会,1973-11-15,1973-11
埃及医药考察团到京,1973-11-15,1973-11
参加世界气象组织大气科学委员会会议我国代表团离京前往法国凡尔赛,1973-11-15,1973-11
王冶秋、夏鼐会见并宴请美国考古代表团,1973-11-15,1973-11
在斗争中成长——记芜湖锅炉厂党委副书记、新干部张克俭的事迹,1973-11-15,1973-11
越南南方共和临时革命政府发表声明美国和西贡政权必须立即停止战争行动严格履行巴黎协定,1973-11-15,1973-11
越南民主共和国政府发表声明指出美国和西贡政权强化战争行动严重违反巴黎协定,1973-11-15,1973-11
英·萨利特使离河内回柬埔寨,1973-11-15,1973-11
结束对朝鲜的友好访问我体育代表团离开平壤回国,1973-11-15,1973-11
我科学院代表团到达河内,1973-11-15,1973-11
北京医学院负责人米勒等离日回国,1973-11-15,1973-11
我旅游局友好参观团抵布加勒斯特,1973-11-15,1973-11
总结工作经验确定新的任务柬埔寨东北部民主妇女协会举行会议,1973-11-15,1973-11
为日中友好积极学汉语,1973-11-15,1973-11
“缓和”烟幕掩盖不住苏修在欧洲的军事野心,1973-11-15,1973-11
博茨瓦纳宣布同以色列断交,1973-11-15,1973-11
联大政治和安全委员会以压倒多数通过决议要苏联签署拉美禁止核武器条约第二号附加议定书我代表发言坚决支持拉美国家反对超级大国的核霸权主义的斗争苏代表为拒绝签署议定书进行诡辩，再次暴露苏联假裁军和争夺核霸权的真面目,1973-11-15,1973-11
第八届政府间海事协商组织大会开幕我代表团团长发言，主张任何一个国家的海上事务，要由本国人民来管，世界的海上事务，要由世界各国来管,1973-11-15,1973-11
英国首相希思和西德总理勃兰特分别发表讲话强调进一步加速西欧共同体的政治联合,1973-11-15,1973-11
北京城区天气预报,1973-11-15,1973-11
祖国西南的重要商品粮基地  都江堰灌区全面丰收,1973-11-16,1973-11
满载中国人民的深情厚谊  史蒂文斯总统离开广州回国徐向前、何英、丁盛等和广州数千名群众前往机场热烈欢送,1973-11-16,1973-11
史蒂文斯总统给毛主席的感谢电,1973-11-16,1973-11
史蒂文斯总统给周总理的感谢电,1973-11-16,1973-11
应我国政府的邀请  阮友寿主席率越南南方共和代表团将于最近来我国进行正式友好访问,1973-11-16,1973-11
李先念副总理举行宴会  热烈欢迎罗马尼亚政府贸易代表团李先念副总理珀仓副主席讲话，共颂两党、两国和两国人民的兄弟友谊,1973-11-16,1973-11
报眼毛主席语录,1973-11-16,1973-11
春风化雨山河增色——访河南省林县,1973-11-16,1973-11
丰收季节访“火洲”,1973-11-16,1973-11
踊跃交售粮食力争多作贡献荆门商水玉溪三县超额完成国家粮食征购任务,1973-11-16,1973-11
一次生动活泼的报告会——天津大学工农兵学生学习生活侧记,1973-11-16,1973-11
马口镇文化馆为儿童办图书室,1973-11-16,1973-11
在少年儿童中开展讲革命故事活动,1973-11-16,1973-11
努力办好职工业余教育,1973-11-16,1973-11
燃化企业职工业余教育动态,1973-11-16,1973-11
一九七三年秋季中国出口商品交易会胜利闭幕在国内外一片大好形势下举办的这届交易会，来宾踊跃，气氛热烈，达成的贸易额比以往各届有显著增加交易会举行闭幕招待会，外国朋友、海外华侨、港澳同胞和交易会工作人员四千多人参加,1973-11-16,1973-11
茂名市革委会、西吉县委和县革委会改进领导作风加强信访工作进一步密切联系群众,1973-11-16,1973-11
李强部长同珀仓团长达尔包斯副团长会谈会谈在亲切友好的气氛中进行,1973-11-16,1973-11
世界卫生组织总干事马勒等离京去上海参观访问,1973-11-16,1973-11
圆满结束对瑞士的友好访问我政府民航代表团副团长等回京,1973-11-16,1973-11
结束对朝鲜的友好访问中国体育代表团回到北京,1973-11-16,1973-11
我电子学会电子技术考察团离京赴日,1973-11-16,1973-11
美国友人洛伊斯·斯诺夫人等离开北京去我国南方访问廖承志等到机场送行,1973-11-16,1973-11
芬兰造纸业协会包装技术代表团离京,1973-11-16,1973-11
多米尼加朋友阿里斯蒂和夫人离京,1973-11-16,1973-11
阶级情深——解放军干部爱兵故事,1973-11-16,1973-11
越南北方展开冬季作物生产运动在搞好粮食生产同时，积极发展经济作物,1973-11-16,1973-11
范文同总理接见我三个代表团同代表团进行亲切友好的谈话,1973-11-16,1973-11
布伦德尔总督观看广州杂技团演出新西兰代总理宴请并会见杂技团,1973-11-16,1973-11
阿尔巴尼亚一些区召开党的积极分子会议谢胡同志出席地拉那区会议并作指示全国先进工作者会议在地拉那举行卡博同志等出席,1973-11-16,1973-11
大好的形势盛大的聚会——记一九七三年秋季中国出口商品交易会,1973-11-16,1973-11
许多亚非国家代表在联大特别政治委员会会议上发言谴责以色列犹太复国主义推行侵略扩张政策巴勒斯坦解放组织代表坚决反对安理会不明确规定巴勒斯坦人民权利的两个决议我代表指出不恢复巴勒斯坦人民的民族权利就不能真正解决中东问题,1973-11-16,1973-11
阿拉伯联盟邀请阿拉伯各国国家元首出席阿拉伯最高级会议讨论当前局势,1973-11-16,1973-11
阿拉伯人民的命运不应由超级大国决定法国《红色人道报》、英共（马列）《工人报》和“马来亚革命之声”谴责美苏干涉中东事务，阴谋剥夺巴勒斯坦人民的民族权利,1973-11-16,1973-11
一些阿拉伯国家对埃以协议作不同反应有的指出要“致力于使和平不致于损害任何一个阿拉伯国家，特别是巴勒斯坦人民”,1973-11-16,1973-11
埃及以色列两方代表签署一项六点协议协议墨迹未干，以总理就叫嚷“以色列绝不准备从它目前军事阵地撤退到被称为十月二十二日线的那条想象和虚构的线上去”,1973-11-16,1973-11
军费剧增债台高筑通货膨胀生产下降以色列发动侵略战争使经济严重恶化,1973-11-16,1973-11
地中海最大的公害,1973-11-16,1973-11
北京城区天气预报,1973-11-16,1973-11
毛主席的伟大号召变成亿万人民的伟大行动根治海河十年山河面貌大变依靠人民公社集体经济力量，实行井灌与渠灌结合，海河流域粮食总产量增长一倍,1973-11-17,1973-11
用社会主义思想占领农村文化阵地山根大队自力更生办图书室，组织社员认真读书,1973-11-17,1973-11
汉阳轧钢厂党委组织青年工人  积极阅读和评论革命图书,1973-11-17,1973-11
工会组织要协助党委抓好大事湘潭市各级工会组织，在党的一元化领导下，组织工人群众看书学习，深入开展批林整风,1973-11-17,1973-11
报眼毛主席语录,1973-11-17,1973-11
当代愚公战海河,1973-11-17,1973-11
海河和海河流域,1973-11-17,1973-11
新的斗争生活的赞歌——评文艺丛刊《朝霸》、《金钟长鸣》,1973-11-17,1973-11
“按照文化大革命的精神来办事”,1973-11-17,1973-11
少年儿童喜闻乐见的好影片——彩色动画片《小号手》和彩色剪纸片《东海小哨兵》观后,1973-11-17,1973-11
造就大批少数民族武装干部和民兵干部甘肃额济纳旗党委选拔大蒙古族先进分子，但任武装干部和民兵干部；采取办学习班和领导干部传、帮、带等方式，提高他们的政治、思想水平和领导能力,1973-11-17,1973-11
李先念、杨杰、陶琦会见阿尔巴尼亚交通代表团,1973-11-17,1973-11
扬·珀仓副主席离京去朝鲜访问李强部长等到机场送行,1973-11-17,1973-11
答谢我外交部在秋季组织参观旅行驻京外交使节举行宴会姬鹏飞乔冠华韩念龙马文波符浩等应邀出席,1973-11-17,1973-11
张香山举行宴会欢迎全日本港湾工会友好访华团,1973-11-17,1973-11
参加日本临床外科医学会第三十五届大会后中华医学会医学代表团回到北京,1973-11-17,1973-11
秦力生会见并宴请罗科学工作者,1973-11-17,1973-11
塞内加尔政府代表团到达北京方毅、李克等前往机场欢迎,1973-11-17,1973-11
中国羽毛球协会举行招待会欢迎日本羽毛球代表团,1973-11-17,1973-11
出席联合国教科文组织会议后我国代表李光泽回到北京,1973-11-17,1973-11
永葆革命青春——记女共产党员宋欣茹,1973-11-17,1973-11
朝鲜民主主义人民共和国代表团团长李钟木在联大政委会发言阐述关于朝鲜自主和平统一问题的原则立场,1973-11-17,1973-11
联大政委会开始辩论朝鲜问题朝鲜民主主义人民共和国代表团首次参加受到许多国家代表热烈欢迎,1973-11-17,1973-11
黄华代表在联大政委会讨论朝鲜问题时发言坚决支持朝鲜民主主义人民共和国的正义立场指出阿尔及利亚中国等国联合提出的《为促进朝鲜的自主和平统一创造有利条件》决议草案，符合朝鲜人民真正利益和联合国宪章精神，应得到联大认真考虑,1973-11-17,1973-11
亚运会联合会理事会以压倒多数批准执委会决议确认我国为会员并驱逐蒋帮,1973-11-17,1973-11
北京城区天气预报,1973-11-17,1973-11
深入开展批林整风贯彻执行基本路线  上海钢铁工业大幅度增产,1973-11-18,1973-11
广大工人、干部和技术人员抓大事促大干北京钢厂提前完成钢材生产年计划,1973-11-18,1973-11
放手发动群众集中群众智慧天津第一炼钢厂创一项平炉炼钢新纪录,1973-11-18,1973-11
全心全意依靠工人阶级办企业  武钢轧板厂钢板产量质量普遍提高,1973-11-18,1973-11
报眼毛主席语录,1973-11-18,1973-11
热烈欢迎来自越南南方的亲密战友（社论）,1973-11-18,1973-11
治江治河的正确道路——关于根治海河发展农业生产的调查,1973-11-18,1973-11
做知识青年上山下乡的促进派,1973-11-18,1973-11
踏着英雄的足迹前进——记“欧阳海班”的先进事迹,1973-11-18,1973-11
爱民气象台,1973-11-18,1973-11
夜海深情,1973-11-18,1973-11
苹果熟了的时候,1973-11-18,1973-11
中华全国体育总会声明声明指出：中华全国体育总会作为亚洲运动会联合会的成员将派出体育代表团参加一九七四年九月在德黑兰举行的第七届亚运会；中华全国体育总会一向深切关怀台湾省的运动员；我们欢迎台湾省运动员前来参加全国选拔赛，以使他们能够同全国其他省市的运动员一道参加第七届亚运会,1973-11-18,1973-11
邓小平、韩念龙会见朝鲜友好访华参观团,1973-11-18,1973-11
邓颖超、廖承志、罗青长会见并宴请李宗仁先生元配夫人李秀文,1973-11-18,1973-11
方毅部长宴请塞内加尔政府代表团方毅部长李克副部长同奥斯曼·塞克部长举行会谈,1973-11-18,1973-11
应几内亚共和国政府邀请我政府代表团离京前往科纳克里,1973-11-18,1973-11
廖承志、林林会见并宴请清水正夫和松山树子,1973-11-18,1973-11
张香山会见日本朋友,1973-11-18,1973-11
索马里银行代表团到京,1973-11-18,1973-11
结束了在日本的友好访问中国人民保险公司代表团回到北京,1973-11-18,1973-11
结束对挪威、芬兰、丹麦的友好访问中国冰球队回到北京,1973-11-18,1973-11
庆祝法国航空公司由巴黎通航北京中国友好参观团离京赴法国,1973-11-18,1973-11
中国在国际体育组织中的合法权利应当恢复（本报评论）,1973-11-18,1973-11
朝鲜劳动党等写信给南朝鲜一些政党建议召开大民族会议实现祖国自主和平统一,1973-11-18,1973-11
朝鲜民主主义人民共和国国际威望日益提高,1973-11-18,1973-11
阿尔巴尼亚等国代表在联大政委会支持李钟木团长阐述的原则立场必须让朝鲜人民自己解决朝鲜和平统一问题,1973-11-18,1973-11
前进中的越南南方解放区,1973-11-18,1973-11
中国人民和越南南方人民的战斗友谊不断发展,1973-11-18,1973-11
越南南方的少数民族,1973-11-18,1973-11
越南南方城镇东河和禄宁,1973-11-18,1973-11
我代表庄焰在联大政委会上就禁止核试验问题发言揭露超级大国所谓核裁军和禁止核试验的骗局指出苏联竭力鼓吹禁止核试验的目的是企图让各国人民跪倒在它的核威胁之下,1973-11-18,1973-11
许多国家代表在联大政委会上发言谴责苏美推行核垄断政策加紧核军备竞赛中国、阿尔巴尼亚、法国、加蓬等国投票反对关于停止核试验的两个决议草案,1973-11-18,1973-11
巴勒斯坦突击队袭击以色列侵略者黎巴嫩、叙利亚击退入侵的以色列军,1973-11-18,1973-11
美国国务卿基辛格结束对日本的访问,1973-11-18,1973-11
法国外长若贝尔就外交政策问题发表讲话批评美苏在中东问题上搞排他性活动指出中欧裁军谈判只能损害欧洲前途，强调要加强西欧的团结并绝不放弃防务努力,1973-11-18,1973-11
日本决定在全国范围内节省石油消费,1973-11-18,1973-11
挪威政府宣布克朗增值,1973-11-18,1973-11
能源危机日益严重煤电供应情况紧张英国政府宣布全国处于紧急状态,1973-11-18,1973-11
北京城区天气预报,1973-11-18,1973-11
阮友寿主席率越南南方共和临时革命政府代表团到京周恩来总理举行盛大宴会热烈欢迎越南南方亲密战友,1973-11-19,1973-11
董代主席电贺埃米尔·易卜拉欣·纳西尔再次荣任马尔代夫共和国总统,1973-11-19,1973-11
周恩来总理同阮友寿主席在十分亲切友好的气氛中会谈,1973-11-19,1973-11
报眼毛主席语录,1973-11-19,1973-11
在欢迎越南南方共和临时革命政府代表团宴会上周恩来总理的讲话,1973-11-19,1973-11
在周恩来总理举行的欢迎宴会上阮友寿主席的讲话,1973-11-19,1973-11
阿尔巴尼亚交通代表团离京回国杨杰、陶琦等前往机场送行,1973-11-19,1973-11
廖承志、张香山会见并宴请日本青年团协议会访华团,1973-11-19,1973-11
中日两国羽毛球队在京进行友谊赛廖承志会长等观看了比赛,1973-11-19,1973-11
出席世界知识产权组织全体会议第二届会议我国际贸易促进委员会观察小组离京赴日内瓦,1973-11-19,1973-11
邮电部发行文化大革命期间《出土文物》邮票一套,1973-11-19,1973-11
徐运北会见并宴请美国幼儿发展和教育代表团,1973-11-19,1973-11
澳大利亚格里菲斯大学代表团离京,1973-11-19,1973-11
我港口业务友好代表团访日后回到北京,1973-11-19,1973-11
日本书法代表团举行答谢宴会廖承志会长等应邀出席,1973-11-19,1973-11
笔底千花两国春,1973-11-19,1973-11
根深叶茂——记洛阳东方红拖拉机厂炼钢分厂党委副书记、新干部徐文俊,1973-11-19,1973-11
“工人主任”——记太原市第一汽车运输公司革委会副主任、新干部孟甲喜,1973-11-19,1973-11
互相帮助取长补短——记大连纺织厂前纺车间乙班的新老干部,1973-11-19,1973-11
发扬密切联系群众的优良传统,1973-11-19,1973-11
在越南南方共和临时革命政府的领导下越南南方解放区人民大力恢复发展生产和文教事业,1973-11-19,1973-11
许多国家和地区代表欢迎亚运会联合会确认我国合法权利中国参加亚运会将增进亚洲人民的友好合作强调亚洲国家团结起来互相支援促进体育运动的发展,1973-11-19,1973-11
朝鲜《劳动新闻》谴责美朴集团分裂朝鲜的阴谋坚决反对“两个朝鲜”同时加入联合国朝鲜南北协调委员会平壤方面副主席就协调委员会改组问题致函汉城方面副主席,1973-11-19,1973-11
朝鲜军事停战委员会举行秘书长会议朝中方面抗议敌方犯下的种种罪行,1973-11-19,1973-11
我国驻墨西哥大使向墨西哥总统转交周总理赠送的影片,1973-11-19,1973-11
巴基斯坦陆军参谋长接见我解放军篮球队,1973-11-19,1973-11
我排球队同伊朗国家排球队举行首次比赛,1973-11-19,1973-11
重建越门——东河港,1973-11-19,1973-11
我代表和第三世界其他国家代表在联大第四委员会会议上发言谴责某些西方大国对殖民地进行经济侵略,1973-11-19,1973-11
断然采取联合行动显示团结战斗的力量阿拉伯国家用石油“武器”打击以色列及其支持者,1973-11-19,1973-11
联大通过召开第三次海洋法会议的决定苏联代表弃权，再次采取反对发展中国家维护主权和海洋资源的顽固立场,1973-11-19,1973-11
加拿大议员指责苏联破坏国际渔业协议,1973-11-19,1973-11
蓬皮杜总统同希思首相举行会谈法英两国首脑表示要从各方面加强和发展西欧共同体，并反对超级大国对世界的“共同统治”,1973-11-19,1973-11
挪威《晚邮报》发表文章揭露苏联渔船横行海洋损害发展中国家利益,1973-11-19,1973-11
