中朝日瑞南五国乒乓球友谊赛在京举行我体总负责人庄则栋和朝鲜、日本、瑞典、南斯拉夫、中国    五国乒乓球代表团团长等出席开幕式,1974-05-15,1974-05
邮电部发行《万国邮政联盟成立一百周年纪念邮票》,1974-05-15,1974-05
金日成主席举行盛大宴会欢迎桑戈尔总统金日成主席桑戈尔总统强调第三世界坚决捍卫国家主权发展民族经济,1974-05-15,1974-05
柬埔寨代表团和埃及代表团举行会谈乔森潘和英·萨利等拜访埃及第一副总理赫加齐,1974-05-15,1974-05
结束对我国的友好访问阮氏定率越南南方妇女代表团抵河内,1974-05-15,1974-05
朝鲜《劳动新闻》发表评论员文章第三世界作为强大政治力量登上历史舞台巴基斯坦报纸指出联大特别会议反映了第三世界的团结和觉醒,1974-05-15,1974-05
老挝一些组织谴责极右派破坏阴谋支持临时民族联合政府决定,1974-05-15,1974-05
朝鲜政府代表团离开罗马尼亚,1974-05-15,1974-05
我出土文物展览在斯德哥尔摩开幕瑞典国王卡尔十六世出席开幕式并讲话,1974-05-15,1974-05
天津市友好访问团结束对日本的友好访问,1974-05-15,1974-05
我田径队离墨西哥回国,1974-05-15,1974-05
西贡政权统治区经济危机日益加深挣扎在饥饿线上的广大劳动人民纷纷进行反抗,1974-05-15,1974-05
金边物价不断上涨激起人民强烈反抗,1974-05-15,1974-05
非洲统一组织解放委员会第二十三次会议开幕阿希乔总统致开幕词呼吁更加有力地支持非洲解放运动莫三鼻给解放阵线代表重申继续团结战斗争取彻底独立,1974-05-15,1974-05
墨西哥阿根廷舆论揭露跨国公司掠夺发展中国家拉美国家加强团结反对跨国公司石油输出国组织总书记谴责跨国石油公司攫取高额利润,1974-05-15,1974-05
印度舆论揭穿苏联吹嘘“无私援助”的谎言谴责苏联延误“援”建工程反而倒打一耙日本外务省抗议苏联当局在公海上勒索日本渔民,1974-05-15,1974-05
尼泊尔首相里贾尔发表谈话谴责反民族分子的罪恶活动,1974-05-15,1974-05
美国跨国公司对发展中国家的掠夺和剥削,1974-05-15,1974-05
北京城区天气预报,1974-05-15,1974-05
毛主席革命路线的伟大胜利文化大革命的响亮颂歌我国自力更生新建起大港油田在激烈的阶级斗争和两条路线斗争中，我国石油工人发扬大庆精神新建的大港油田，将为我国提供大量的石油和天然气，对改变我国燃料构成，促进全国工农业生产发展，有重要意义,1974-05-16,1974-05
解放军北京卫戍区某部六连指战员斗志高昂抓住林彪“克己复礼”反复批深入批干部和战士的阶级斗争、路线斗争和继续革命的觉悟大大提高，决心乘胜前进，把批林批孔斗争进行到底,1974-05-16,1974-05
福建建成两处新的煤矿矿井,1974-05-16,1974-05
秘鲁中部最近发生严重水灾周总理致电贝拉斯科总统表示慰问我红十字会致电秘鲁红十字会，慰问受灾地区人民,1974-05-16,1974-05
毛主席语录,1974-05-16,1974-05
新生事物是不可战胜的——从“郑韩故城”的历史和现实批判林彪否定新生事物的罪行,1974-05-16,1974-05
坚持乡村继续革命——批判林彪、孔老二诬蔑劳动人民的谬论,1974-05-16,1974-05
群众是人间奇迹的创造者——批判“上智下愚”的唯心史观,1974-05-16,1974-05
无产阶级文化大革命伟大成果不容抹煞,1974-05-16,1974-05
坚持学大庆碱滩飘油香——记发展中的大港油田,1974-05-16,1974-05
一九七四年春季中国出口商品交易会胜利闭幕一个月来，一百多个国家和地区的外国朋友、海外华侨和港澳同胞两万五千多人前来洽谈贸易和参观访问。来自第三世界国家和地区的贸易界朋友比上一届增多，同他们达成的贸易额比历届都有增加。十五日，交易会举行盛大闭幕招待会,1974-05-16,1974-05
李先念、邓颖超、林佳楣会见阿尔瓦罗·埃切维里亚和夫人,1974-05-16,1974-05
邓小平副总理会见拉特纳亚克部长,1974-05-16,1974-05
就国际田联无理处分巴基斯坦田径运动员我国田径协会负责人发表声明中国人民对国际田联少数领导人的蛮横行径表示极大愤慨,1974-05-16,1974-05
邓小平副总理会见朝日瑞南乒乓球代表团团长,1974-05-16,1974-05
周建人副委员长会见日本京都市友好代表团,1974-05-16,1974-05
姬鹏飞外长会见乍得首任驻华大使,1974-05-16,1974-05
外事往来,1974-05-16,1974-05
中苏今年交换货物和付款协定在京签字,1974-05-16,1974-05
廖承志、庄则栋、罗青长、林丽韫、马文波、李金德设宴欢迎旅日、旅美台湾省同胞运动员,1974-05-16,1974-05
我国参加第七届亚运会足球选拔赛结束,1974-05-16,1974-05
金日成主席致电阿拉法特主席朝鲜人民全力支持巴勒斯坦人民正义斗争朝鲜举行“支持巴勒斯坦人民斗争周”,1974-05-16,1974-05
金日成主席和桑戈尔总统举行会谈金日成主席和夫人回拜桑戈尔总统和夫人,1974-05-16,1974-05
国际大坝委员会接受中国为正式成员,1974-05-16,1974-05
布托总理访问我国后回到拉瓦尔品第在机场发表讲话说他这次访问极为成功巴基斯坦报纸热烈赞扬布托总理访问增进了巴中友谊,1974-05-16,1974-05
日本众参两院分别举行全体会议一致通过日中航空运输协定,1974-05-16,1974-05
出席越南南方两方协商会议的越南南方共和代表团宣布无限期停止参加两方协商会议,1974-05-16,1974-05
英雄的姐妹深厚的情谊——记越南南方妇女解放联合会代表团访问我国,1974-05-16,1974-05
埃及副总理宴请柬埔寨代表团萨达特总统接见乔森潘和英·萨利等柬埔寨贵宾,1974-05-16,1974-05
非洲统一组织解放委员会第二十三次会议发表声明支持莫三鼻给安哥拉等地区人民完全独立非洲独立国家将用一切手段支援民族解放运动,1974-05-16,1974-05
阿根廷革命共产党和共产主义先锋党机关报分别载文揭露苏美两霸在欧洲和中东加紧争夺指出所谓“世界性的缓和”是反对各国人民的一出丑剧,1974-05-16,1974-05
谢尔当选西德总统,1974-05-16,1974-05
民主也门和阿拉伯也门发表联合公报强调双方加强经济合作和保证边界地区稳定,1974-05-16,1974-05
南斯拉夫颁布新的国防法,1974-05-16,1974-05
国际收支严重恶化通货膨胀急剧发展意大利采取措施限制进口,1974-05-16,1974-05
骗子的格言,1974-05-16,1974-05
北京城区天气预报,1974-05-16,1974-05
广阔天地大有作为公社党委发动干部、群众以党的基本路线为指导深入批林批孔,1974-05-17,1974-05
桑戈尔总统和夫人访问上海受到热烈欢迎上海市革委会宴请塞内加尔贵宾马天水副主任和桑戈尔总统先后祝酒,1974-05-17,1974-05
祝贺中日航空运输协定的签订,1974-05-17,1974-05
毛主席语录,1974-05-17,1974-05
热烈欢迎马卡里奥斯总统,1974-05-17,1974-05
卑贱者最聪明高贵者最愚蠢——批判林彪、孔老二鼓吹的“上智下愚”的唯心史观,1974-05-17,1974-05
铁臂银锄创历史——批判林彪、孔老二“上智下愚”的谬论,1974-05-17,1974-05
反革命两面派的自供,1974-05-17,1974-05
破灭了的“皇帝梦”,1974-05-17,1974-05
青龙河畔气象新——河北卢龙县富申庄大队批林批孔以来的变化,1974-05-17,1974-05
云雾山中新画图,1974-05-17,1974-05
兰考的春天,1974-05-17,1974-05
广大职工深入开展批林批孔运动，进一步增强革命团结大同矿务局革命生产形势越来越好,1974-05-17,1974-05
中朝日瑞南五国乒乓球友谊赛团体赛结束各国运动员在比赛中表现出的“友谊重于比赛”的风格，以及他们的顽强斗志和精采球艺，赢得观众热烈称赞,1974-05-17,1974-05
廖承志会见日本爱知县自治体议员友好访华团,1974-05-17,1974-05
韩念龙、杨骥会见并宴请肯德拉将军和夫人,1974-05-17,1974-05
我国参加第七届亚运会射击选拔赛结束,1974-05-17,1974-05
中朝日瑞南乒乓球友谊赛男女团体赛成绩公报,1974-05-17,1974-05
外事往来,1974-05-17,1974-05
桑戈尔总统举行盛大宴会招待金日成主席桑戈尔总统和金日成主席讲话强调第三世界的团结桑戈尔总统结束对朝鲜的访问金日成主席等到机场送行,1974-05-17,1974-05
乔森潘、英·萨利率柬代表团到达大马士革叙利亚副总理哈达姆等到机场欢迎柬埔寨贵宾,1974-05-17,1974-05
柬埔寨和埃及发表联合公报柬代表团离开罗时埃及副总理伊斯梅尔等欢送,1974-05-17,1974-05
多哥总统埃亚德马接见我大使,1974-05-17,1974-05
我驻叙利亚大使离任回国,1974-05-17,1974-05
塞浦路斯共和国,1974-05-17,1974-05
地中海和地中海国家,1974-05-17,1974-05
塞浦路斯的农业和矿业,1974-05-17,1974-05
地中海型气候,1974-05-17,1974-05
在联合国工业发展理事会会议上第三世界国家代表谴责超级大国侵略掠夺政策会议通过发展中国家提出的“执行联大特别会议各项决定”等决议,1974-05-17,1974-05
纪念肯特州立大学四名学生遇害四周年美国群众九千人举行集会会上宣读柬国家元首西哈努克亲王的电报,1974-05-17,1974-05
支持全国铁路工人的斗争印度工人不怕镇压举行全国大罢工这是独立后首次全国大罢工，工商交通和政府机构活动大受影响,1974-05-17,1974-05
加强纽带增进友谊——记日本人民欢迎日中航空运输协定签字,1974-05-17,1974-05
北京城区天气预报,1974-05-17,1974-05
应我国政府邀请前来进行正式访问马卡里奥斯总统到京受到热烈欢迎邓小平、陈锡联、纪登奎、吴德、徐向前、阿沛·阿旺晋美和姬鹏飞等，以及首都群众数千人前往机场热烈欢迎周恩来总理在宾馆迎接马卡里奥斯总统和其他塞浦路斯贵宾,1974-05-18,1974-05
金日成主席和金一总理致电毛主席、董代主席和周总理,1974-05-18,1974-05
霍查同志谢胡同志致电毛主席、周总理,1974-05-18,1974-05
范文同总理致电周总理,1974-05-18,1974-05
黄晋发主席致电周总理,1974-05-18,1974-05
达达赫总统致电周总理,1974-05-18,1974-05
曼内斯库总理致电周总理,1974-05-18,1974-05
毛主席语录,1974-05-18,1974-05
桑戈尔总统在上海参观受到热烈欢迎上海市革命委员会副主任马天水、徐景贤、冯国柱陪同塞内加尔贵宾参观,1974-05-18,1974-05
圆满结束欧非亚八国之行继续对我国进行正式友好访问乔森潘、英·萨利率代表团到乌鲁木齐赛福鼎主任、曹思明副主任和数千名各族群众到机场热烈欢迎柬埔寨贵宾,1974-05-18,1974-05
李先念副总理会见阿尔巴尼亚交通部代表团,1974-05-18,1974-05
李先念会见坦桑尼亚银行代表团,1974-05-18,1974-05
纪登奎会见扎伊尔人民革命运动青年组织代表团,1974-05-18,1974-05
阿赫马尔议长率领代表团离京,1974-05-18,1974-05
拉特纳亚克部长离京,1974-05-18,1974-05
乔冠华副部长会见美国州长团,1974-05-18,1974-05
统战部邀请参加亚运会选拔赛的旅日、旅美台湾省同胞和在京台湾省籍人士举行座谈会,1974-05-18,1974-05
读《盐铁论》——西汉中期儒法两家的一场大论战,1974-05-18,1974-05
战斗在批林批孔前线的女战士——北京部队某部“红色话务班”批林批孔的事迹,1974-05-18,1974-05
孔孟之道就是反革命之道——看地主分子怎样同林彪一唱一和尊孔“克己复礼”,1974-05-18,1974-05
是谁创造了人类世界——兰州部队某部七连联系建设南泥湾的实践批判“上智下愚”的谬论,1974-05-18,1974-05
叙利亚政府欢迎柬埔寨代表团阿萨德总统和阿尤比总理分别接见柬埔寨代表团哈达姆副总理宴请乔森潘和英·萨利等柬埔寨贵宾,1974-05-18,1974-05
朝鲜和塞内加尔发表联合公报指出第三世界国家人民作为当代伟大的革命力量，    已成为推动人类历史前进的巨大动力,1974-05-18,1974-05
日本报纸发表社论谴责一小撮极右分子的反华行径日中航空协定的签订将进一步巩固两国关系,1974-05-18,1974-05
鲁巴伊主席观看我国电影,1974-05-18,1974-05
布加勒斯特国际消费品博览会开幕我驻罗大使和中国馆馆长举行馆日招待会,1974-05-18,1974-05
我羽毛球代表团到达曼谷,1974-05-18,1974-05
乍得公共工程部长为我考察组举行招待会,1974-05-18,1974-05
地中海的美丽岛国——塞浦路斯,1974-05-18,1974-05
在第一届老挝民族政治联合委员会第三次全体会议上苏发努冯主席作重要政治报告号召全国人民提高警惕，加强团结，严格彻底履行万象协定和议定书及双方一致同意的各项规定，积极支持民族政治联合委员会和临时民族联合政府,1974-05-18,1974-05
黎巴嫩总理索勒赫和埃及外长法赫米谴责以色列悍然轰炸黎巴嫩,1974-05-18,1974-05
苏联加紧海洋扩张遭到强烈反对英报指出苏联向印度洋扩张同第三世界关系处于窘迫境地苏联潜艇潜入瑞典领海被逐澳大利亚要苏联捕鲸队离开,1974-05-18,1974-05
西德联邦议院选举施密特为总理,1974-05-18,1974-05
法《世界报》发表一议员的文章强调在苏联威胁面前法国应掌握防务能力,1974-05-18,1974-05
葡萄牙殖民军再次大规模屠杀莫三鼻给人民,1974-05-18,1974-05
北京城区天气预报,1974-05-18,1974-05
毛泽东主席会见马卡里奥斯总统等贵宾毛主席对来自地中海地区的塞浦路斯贵宾，表示热烈欢迎，同马卡里奥斯总统进行了亲切友好的谈话。马卡里奥斯总统表示希望他这次的访问将进一步加强塞中两国之间已有的友好关系。周恩来总理、王洪文副主席、邓小平副总理等参加了会见和谈话,1974-05-19,1974-05
周恩来总理、邓小平副总理同马卡里奥斯总统举行会谈会谈在亲切友好的气氛中进行,1974-05-19,1974-05
热烈欢迎马卡里奥斯总统等塞浦路斯贵宾江青邓小平陈锡联纪登奎吴德徐向前阿沛·阿旺晋美会见贵宾邓小平副总理主持以周恩来总理名义举行的盛大宴会会见时宾主进行了亲切友好的谈话邓小平副总理和马卡里奥斯总统在宴会上先后讲话,1974-05-19,1974-05
毛主席语录,1974-05-19,1974-05
塞内加尔共和国总统列奥波尔德·塞达·桑戈    尔访问中华人民共和国公报,1974-05-19,1974-05
圆满结束对我国的正式访问桑戈尔总统和夫人等贵宾离上海马天水、徐景贤、王秀珍、冯国柱等和两千多名群众到机场热烈欢送,1974-05-19,1974-05
乔森潘、英·萨利参观吐鲁番县农村,1974-05-19,1974-05
乍得驻华大使向朱委员长递交国书,1974-05-19,1974-05
深切慰问我云南四川地震灾区人民比耶迪奇主席致电周总理,1974-05-19,1974-05
惠特拉姆总理致电周总理,1974-05-19,1974-05
比利时外交大臣致电姬外长,1974-05-19,1974-05
英外交大臣致电姬外长,1974-05-19,1974-05
卢汉先生的追悼会在北京举行董必武、朱德、周恩来、王洪文、康生、叶剑英、李先念、    邓小平、刘伯承、郭沫若送了花圈徐向前主持追悼会    许德珩致悼词,1974-05-19,1974-05
在欢迎马卡里奥斯总统宴会上邓小平副总理的讲话,1974-05-19,1974-05
在欢迎马卡里奥斯总统宴会上马卡里奥斯总统的讲话,1974-05-19,1974-05
马卡里奥斯总统等塞浦路斯贵宾参观北京重型电机厂受到热烈欢迎,1974-05-19,1974-05
阿赫马尔议长率代表团离广州回国,1974-05-19,1974-05
在毛主席、党中央的亲切关怀和全国人民的大力支援下云南四川地震灾区人民决心自力更生重建家园,1974-05-19,1974-05
在毛主席革命路线指引下在文化大革命推动下广东枫树坝水电站胜利建成这项工程具有发电并提高东江的防洪和通航能力等综合效益,1974-05-19,1974-05
李先念副总理会见美国州长团,1974-05-19,1974-05
聂荣臻副主席会见白求恩大夫的亲属科内尔夫人等,1974-05-19,1974-05
张香山会见并宴请罗马尼亚共青团代表团,1974-05-19,1974-05
中朝日瑞南五国乒乓球友谊赛胜利闭幕日本的河野满和朝鲜的朴英顺分别获得男、女单打冠军,1974-05-19,1974-05
外事往来,1974-05-19,1974-05
我国参加第七届亚运会击剑选拔赛结束,1974-05-19,1974-05
中巴网球队在北京进行友谊赛,1974-05-19,1974-05
中朝日瑞南五国乒乓球友谊赛男、女单打半决赛、决赛成绩公报,1974-05-19,1974-05
强烈谴责以色列的新罪行,1974-05-19,1974-05
柬埔寨人民武装奋战四号公路获重大战果柬通社指出人民武装获得的新胜利使金边卖国贼处境非常危急,1974-05-19,1974-05
黎巴嫩总统弗朗吉亚在内阁特别会议上讲话强烈谴责以色列轰炸黎巴嫩的野蛮罪行萨达特总统和布托总理致电黎巴嫩领导人表示声援,1974-05-19,1974-05
世界卫生大会全体会议分别通过决议世界卫生组织接纳几内亚（比绍）和纳米比亚加纳国家元首阿昌庞重申支持非洲解放运动,1974-05-19,1974-05
越南南方共和及越南外交部分别发表声明谴责美国和西贡政权破坏巴黎协定,1974-05-19,1974-05
葡萄牙组成新政府表示将继续在非洲进行殖民战争,1974-05-19,1974-05
南斯拉夫颁布新宪法铁托再次当选总统议会选出联邦执委会，比耶迪奇再次担任主席,1974-05-19,1974-05
是谁在“浑水摸鱼”？,1974-05-19,1974-05
巴基斯坦报纸继续赞扬布托总理访华巴中两国进一步加强团结反帝反霸,1974-05-19,1974-05
日中友协（正统）举行酒会热烈庆祝日中航空运输协定的签订,1974-05-19,1974-05
金日成主席接见罗马尼亚共青团代表团,1974-05-19,1974-05
抗议增税法案反对物价上涨丹麦二十万工人举行大罢工,1974-05-19,1974-05
“纪念班达拉奈克国际会议大厦”揭幕一周年斯里兰卡外交部举行庆祝茶会,1974-05-19,1974-05
中日两国的古代交通,1974-05-19,1974-05
大陆、次大陆、南亚,1974-05-19,1974-05
克什米尔问题的由来,1974-05-19,1974-05
北京地区天气预报,1974-05-19,1974-05
实行启发式搞好批林批孔解放军北京卫戍区某部六连的调查报告,1974-05-20,1974-05
在批林批孔运动的推动下全国棉花播种任务胜利完成棉区广大群众正在开展苗期管理，力争今年棉花获得新丰收,1974-05-20,1974-05
董必武代主席电贺瓦尔特·谢尔当选为德意志联邦共和国总统,1974-05-20,1974-05
邓小平副总理同马卡里奥斯总统会谈,1974-05-20,1974-05
马卡里奥斯总统等塞浦路斯贵宾观看革命现代舞剧《红色娘子军》邓小平、吴德等陪同塞浦路斯贵宾观看演出,1974-05-20,1974-05
毛主席语录,1974-05-20,1974-05
深批“克己复礼”，坚持社会主义道路,1974-05-20,1974-05
抓好阶级斗争反对复辟倒退——批判林彪“仁爱之心”的反动谬论,1974-05-20,1974-05
对敌人“仁慈”就是背叛人民,1974-05-20,1974-05
东风满帆鱼满舱——记吕泗渔港在无产阶级文化大革命中的巨大变化,1974-05-20,1974-05
杭嘉湖新貌,1974-05-20,1974-05
养蜂促进农业增产——新都县发展养蜂业的调查,1974-05-20,1974-05
农业学大寨,1974-05-20,1974-05
勇当驾辕牛敢拉上坡车,1974-05-20,1974-05
乔森潘、英·萨利在乌鲁木齐举行宴会赛福鼎、曹思明等应邀出席宴会充满热烈友好的气氛,1974-05-20,1974-05
广大职工自觉地贯彻执行“以农业为基础、工业为主导”的方针辽宁农机工业战线大力支援农业,1974-05-20,1974-05
深切慰问我云南四川地震灾区人民贝拉斯科总统致电董代主席,1974-05-20,1974-05
西丽玛沃·班达拉奈克总理致电周恩来总理,1974-05-20,1974-05
越南通讯社代表团离京去东北访问,1974-05-20,1974-05
阿尔瓦罗·埃切维里亚夫妇离京,1974-05-20,1974-05
瑞南日乒乓球代表团陆续离开我国朝鲜代表团继续留在我国访问然后回国,1974-05-20,1974-05
在批林批孔运动推动下青海重工业系统生产不断增长一至四月份工业总产值比去年同期增长百分之九点二，    创造历史同期最高水平,1974-05-20,1974-05
外事往来,1974-05-20,1974-05
昆明机床厂等单位职工试制成功高精度光电圆刻线机,1974-05-20,1974-05
广大干部和工人一起批林批孔参加劳动姜家湾煤矿提前完成上半年原煤生产计划,1974-05-20,1974-05
充分显示柬埔寨人民英雄气概有力鼓舞第三世界反帝反霸斗争柬埔寨人民抗美救国战争取得辉煌战果,1974-05-20,1974-05
老挝执行协定中央联合委员会签署“关于监督停火的若干规定”,1974-05-20,1974-05
国际击剑联合会举行第五十五届代表大会通过我国击剑协会入会的决定,1974-05-20,1974-05
英国国际战略研究所研究报告指出超级大国之间的紧张关系不断加剧,1974-05-20,1974-05
加紧核扩军步伐同美国争夺核优势苏联进行今年第二次地下核爆炸,1974-05-20,1974-05
印度进行一次地下核爆炸试验,1974-05-20,1974-05
伟大的思想武器,1974-05-20,1974-05
奇袭布雷安比,1974-05-20,1974-05
非洲统一组织解放委员会第二十三次会议闭幕支援武装斗争加速非洲大陆的彻底解放安哥拉民族解放阵线揭露葡萄牙军政府的新殖民主义阴谋,1974-05-20,1974-05
突尼斯、科威特、埃及、苏丹领导人分别打电报或发表谈话谴责以色列新罪行支持黎巴嫩和巴勒斯坦人民斗争,1974-05-20,1974-05
北京地区天气预报,1974-05-20,1974-05
马卡里奥斯总统举行盛大宴会邓小平、陈锡联、纪登奎、吴德、徐向前、阿沛·阿旺晋美等应邀出席马卡里奥斯总统和邓小平副总理先后发表热情讲话,1974-05-21,1974-05
马卡里奥斯总统在京参观吴德、徐向前分别陪同塞浦路斯贵宾参观游览,1974-05-21,1974-05
应周恩来总理的邀请马来西亚总理拉扎克将访问我国访问期间将正式签署两国政府建交协议,1974-05-21,1974-05
乔森潘团长英·萨利副团长率柬埔寨代表团到达北京我国领导人叶剑英、吴德，宾努首相和夫人等前往机场迎接代表团离开乌鲁木奇时，赛福鼎等和各族群众到机场欢送,1974-05-21,1974-05
深切慰问我云南、四川地震灾区人民西哈努克亲王和宾努首相致电董必武代主席和周恩来总理,1974-05-21,1974-05
沿着《在延安文艺座谈会上的讲话》指引的方向前进——革命文艺工作者谈学习革命样板戏的体会,1974-05-21,1974-05
毛主席语录,1974-05-21,1974-05
在马卡里奥斯总统举行的宴会上马卡里奥斯总统的讲话,1974-05-21,1974-05
在马卡里奥斯总统举行的宴会上邓小平副总理的讲话,1974-05-21,1974-05
批林批孔运动促进了农业生产的发展广西加强田间管理力争夏季农业增产,1974-05-21,1974-05
广东小麦油菜籽喜获丰收同去年比，小麦增产六成，油菜籽增产近两倍,1974-05-21,1974-05
邓小平副总理会见刚果新闻工作者代表团,1974-05-21,1974-05
朗盖—措布涅·克莱芒大使举行招待会庆祝喀麦隆联合共和国国庆,1974-05-21,1974-05
各国驻华大使馆武官和夫人应邀到昆明参观访问后回京,1974-05-21,1974-05
中国和新加坡射击队在京进行友谊赛,1974-05-21,1974-05
区棠亮宴请挪威“红色青年”代表团,1974-05-21,1974-05
外事往来,1974-05-21,1974-05
坚持和贫下中农结合在一块——批判林彪鄙薄劳动、仇视工农的罪行,1974-05-21,1974-05
牢记党的基本路线深批“克己复礼”,1974-05-21,1974-05
决不许开历史倒车,1974-05-21,1974-05
破除“天命”坚持革命,1974-05-21,1974-05
粤剧的新生——记广东省粤剧团学习移植革命样板戏《沙家浜》,1974-05-21,1974-05
户县民兵业余美术作者创作大批作品,1974-05-21,1974-05
西双版纳大批业余歌手歌颂党歌颂社会主义,1974-05-21,1974-05
西贡当局应当彻底履行巴黎协定,1974-05-21,1974-05
总结自力更生生产零配件方面的成绩并提出新任务阿尔巴尼亚举行先进工作者全国会见会凯莱齐同志作报告托斯卡同志宣读党中央给先进工作者的贺信,1974-05-21,1974-05
吉斯卡尔·德斯坦当选法国总统,1974-05-21,1974-05
我邮政代表团到达日内瓦,1974-05-21,1974-05
布托总理发表声明巴基斯坦决不屈服于印度的核讹诈,1974-05-21,1974-05
反对朗诺卖国集团反动统治要求民主自由和改善生活金边学生教师斗争浪潮此伏彼起,1974-05-21,1974-05
喀麦隆总统阿希乔接见我大使,1974-05-21,1974-05
比耶迪奇主席参观中国出土文物展览,1974-05-21,1974-05
我羽毛球代表团在曼谷进行访泰首次比赛,1974-05-21,1974-05
我体操队结束对摩洛哥的友好访问,1974-05-21,1974-05
今日尼科西亚,1974-05-21,1974-05
我国和一些国家代表在经社理事会会议上发言加强反帝反殖斗争支持非洲民族解放运动,1974-05-21,1974-05
阿拉伯也门、科威特、阿拉伯联合酋长国、乌干达领导人重申支持阿拉伯和巴勒斯坦人民的正义斗争,1974-05-21,1974-05
黎巴嫩炮兵和巴勒斯坦民兵反击以色列侵略者,1974-05-21,1974-05
北京地区天气预报,1974-05-21,1974-05
