在毛主席的革命文艺路线指引下京沪津工农兵业余文艺活动蓬勃开展广大业余文艺战士在革命样板戏的推动下，紧密配合批林批孔斗争，积极创作和演出文艺节目，狠批林彪“克己复礼”的罪行，    热情歌颂文化大革命的伟大胜利，充分发挥革命文艺的战斗作用,1974-05-22,1974-05
马卡里奥斯总统离京到上海访问徐向前等陪同前往邓小平、陈锡联、纪登奎、吴德、阿沛·阿旺晋美等和首都群众到机场热烈欢送上海市革委会设宴欢迎塞浦路斯贵宾,1974-05-22,1974-05
毛主席革命文艺路线的新胜利批林批孔运动的丰硕成果革命现代京剧《平原作战》《杜鹃山》彩色影片将于本月二十三日起在全国城乡陆续上映,1974-05-22,1974-05
毛主席语录,1974-05-22,1974-05
为巩固无产阶级专政而战的鞍钢工人,1974-05-22,1974-05
安平公社在批林批孔运动中进一步建立和健全理论学习小组,1974-05-22,1974-05
岳滩大队党支部组织贫下中农和知识青年结合批林批孔认真看书学习,1974-05-22,1974-05
采取多种措施培训学习辅导员苏卢大队批林批孔水平不断提高,1974-05-22,1974-05
《三上桃峰》是妄图复活文艺黑线的大毒草,1974-05-22,1974-05
肃清“无冲突论”的流毒,1974-05-22,1974-05
大寨红旗光芒万丈,1974-05-22,1974-05
抓生产是假搞复辟是真,1974-05-22,1974-05
革命逐步深入生产持续上升石景山发电厂超额完成一至四月国家计划发电量比去年同期增长百分之十六，节约厂用电三百多万度，    节省用煤九千多吨,1974-05-22,1974-05
依靠群众因地制宜琼中县积极发展小水电建设,1974-05-22,1974-05
深切慰问我云南四川地震灾区人民埃里亚尼主席致电董代主席,1974-05-22,1974-05
秘鲁外交部长致电姬鹏飞外长,1974-05-22,1974-05
日本外务大臣致电姬鹏飞外长,1974-05-22,1974-05
为革命多产盐产好盐我国北方海盐产区掀起春晒生产高潮,1974-05-22,1974-05
我国参加第七届亚运会游泳选拔赛结束,1974-05-22,1974-05
李先念会见肯德拉将军和夫人,1974-05-22,1974-05
李强举行宴会欢迎法国官方代表团,1974-05-22,1974-05
摩洛哥王国拉米雅公主到京,1974-05-22,1974-05
外事往来,1974-05-22,1974-05
在金边周围、一号和四号公路等地前线柬人民武装发动强大攻势取得新战果,1974-05-22,1974-05
金丰燮少将在朝鲜军事停战委员会会议上强烈抗议美帝和朴正熙集团进行战争挑衅,1974-05-22,1974-05
朝鲜和尼泊尔建立大使级外交关系,1974-05-22,1974-05
许锬特使结束对乌干达的访问发表联合公报重申支持世界各地人民的解放运动,1974-05-22,1974-05
西哈努克亲王会见刚果新闻工作者代表团,1974-05-22,1974-05
越南人民大力发展山区和内地水利事业“越南之声”电台新发射台落成宁平发电厂一号机组开始运行,1974-05-22,1974-05
日中友好协会（正统）举办中国展览会,1974-05-22,1974-05
国际羽毛球表演赛在曼谷开幕,1974-05-22,1974-05
我体操队结束对突尼斯的友好访问,1974-05-22,1974-05
古—中友协庆祝协会成立十四周年,1974-05-22,1974-05
奥地利一学校举办“中国日”活动,1974-05-22,1974-05
莫三鼻给解放阵线和安哥拉人民解放运动分别发表谈话和声明加强反对葡萄牙殖民主义斗争直到取得独立杜尔总统强调葡萄牙殖民地人民要加强团结靠斗争赢得无条件的独立,1974-05-22,1974-05
安哥拉游击队不断打击葡萄牙殖民军,1974-05-22,1974-05
巴勒斯坦解放组织、阿拉伯联盟和一些国家报纸谴责以色列对阿拉伯和巴勒斯坦人民的新侵犯叙利亚军队继续打击以色列侵略军，获得新的战果,1974-05-22,1974-05
芬兰马列主义小组机关刊《十月》发表文章揭露苏修掠夺东欧国家和发展中国家,1974-05-22,1974-05
喀麦隆首都庆祝国庆阿希乔总统出席庆祝仪式并检阅部队,1974-05-22,1974-05
北京地区天气预报,1974-05-22,1974-05
在毛主席的无产阶级文艺路线指引下我国革命样板戏进一步普及和发展革命样板戏充分发挥了“团结人民、教育人民、    打击敌人、消灭敌人”的作用，受到热烈欢迎    随着批林批孔运动的深入开展，我国社会主义文    艺园地必将出现百花盛开的空前繁荣景象,1974-05-23,1974-05
《在延安文艺座谈会上的讲话》指引革命样板戏创作    和演出单位深入基层坚持为工农兵演出向工农兵学习文艺工作者和工农兵一起参加批林批孔斗争，受到生    动的路线教育,1974-05-23,1974-05
董必武代主席朱德委员长周恩来总理致电铁托、格里戈罗夫、比耶迪奇衷心祝贺他们分别就任南斯拉夫社会主义联邦共和国总统、联邦议会主席和联邦执行委员会主席,1974-05-23,1974-05
董必武代主席和周恩来总理电贺德斯坦当选为法国总统,1974-05-23,1974-05
毛主席语录,1974-05-23,1974-05
空军某部业余美术人员虚心学习户县农民画家的创作经验在批林批孔中发挥革命文艺的战斗作用,1974-05-23,1974-05
把革命样板戏送到戈壁哨卡,1974-05-23,1974-05
认真学习《在延安文艺座谈会上的讲话》福州部队某团积极开展业余文艺活动,1974-05-23,1974-05
坚持正确方向坚持斗争哲学——学习《在延安文艺座谈会上的讲话》,1974-05-23,1974-05
在斗争的风雨中成长——云南省双柏县è＠①嘉公社平掌大队合作医疗站的调查,1974-05-23,1974-05
巩固和发展合作医疗,1974-05-23,1974-05
合作医疗救了俺一家,1974-05-23,1974-05
我过上了健康幸福的晚年,1974-05-23,1974-05
半农半医的“土医生”就是好,1974-05-23,1974-05
马卡里奥斯总统离上海到杭州徐向前副委员长等陪同访问。离上海时，马天水副主任等到机场欢送。浙江省革委会主任谭启龙设宴欢迎塞浦路斯贵宾,1974-05-23,1974-05
乔森潘率代表团访问中柬友好公社,1974-05-23,1974-05
邓小平副总理会见吉茨吉斯和夫人,1974-05-23,1974-05
就我云南四川地震表示深切慰问阿里·纳赛尔总理致电周总理,1974-05-23,1974-05
外事往来,1974-05-23,1974-05
保加利亚驻华大使举行电影招待会,1974-05-23,1974-05
法国工业科学技术展览会在京开幕我国际贸易促进委员会为展览会开幕举行招待会,1974-05-23,1974-05
姬鹏飞外长设宴欢迎拉米雅公主姬鹏飞外长和拉米雅公主在充满友好气氛的宴会上讲话,1974-05-23,1974-05
柬埔寨人民武装在波萝勉等地不断发动攻势人民武装力量女战士战斗在各条战线为抗美救国斗争作出卓越贡献,1974-05-23,1974-05
澳大利亚《先锋报》发表社论欢呼柬埔寨人民斗争的胜利,1974-05-23,1974-05
维护巴黎协定保卫解放区越南南方各地军民痛击侵犯解放区的西贡军队,1974-05-23,1974-05
朝鲜《劳动新闻》发表评论谴责南朝鲜渔轮侵犯我领海的海盗行径,1974-05-23,1974-05
反对物价上涨要求增加工资和改善工作条件意大利和葡萄牙工人举行罢工英国学生要求增加助学金西班牙学生抗议政府加强对学校控制,1974-05-23,1974-05
浙江手工艺品展览在塞内加尔首都开幕,1974-05-23,1974-05
在菲律宾访问的十天,1974-05-23,1974-05
第三世界国家加强团结共同斗争阿根廷总统庇隆强调第三世界国家团结一致共同对付大国的摆布和控制牙买加总理曼利表示要同第三世界其他国家一起建立新的国际经济关系,1974-05-23,1974-05
突尼斯和几内亚总统发表谈话重申支持阿拉伯人民的正义斗争阿拉伯也门外交部负责人谴责以色列对黎巴嫩的侵略,1974-05-23,1974-05
加强联合保护共同利益汞生产国决定成立国际组织,1974-05-23,1974-05
首届布加勒斯特国际消费品博览会闭幕,1974-05-23,1974-05
拉美四个香蕉出口国发表声明谴责跨国公司的无理行径,1974-05-23,1974-05
阿拉伯联盟联合防御理事会会议闭幕决定建立一个发展军事工业的阿拉伯组织,1974-05-23,1974-05
智利军政府“战时法庭”审判支持前政府的人,1974-05-23,1974-05
北京地区天气预报,1974-05-23,1974-05
革命文艺是团结人民、教育人民、打击敌人、消灭敌人的有力武器北京市工农兵热情赞颂革命样板戏北京市部分工农兵进行座谈，用革命样板戏在社会主义革命和建设中发挥巨大战斗作用的生动事实，热情歌颂毛主席无产阶级文艺路线的伟大胜利,1974-05-24,1974-05
周恩来总理会见絮德罗同他进行了友好的谈话,1974-05-24,1974-05
认真学习《在延安文艺座谈会上的讲话》深入批判反动没落阶级意识形态孔孟之道广州部队工程兵某团技术人员坚持走与工农兵相结合的道路,1974-05-24,1974-05
乔森潘团长、英·萨利副团长应江青同志邀请观看革命现代舞剧《草原儿女》和《沂蒙颂》柬埔寨国家元首西哈努克亲王和夫人、宾努亲王和夫人也应邀观看我国党和国家领导人王洪文、江青、姚文元、吴德陪同柬埔寨贵宾观看演出,1974-05-24,1974-05
毛主席语录,1974-05-24,1974-05
坚持革命反对复辟,1974-05-24,1974-05
决不能让历史的车轮倒转,1974-05-24,1974-05
耕也，乐在其中——批判林彪、孔老二鄙视劳动仇视劳动人民的反动思想,1974-05-24,1974-05
坚持在劳动中同工农打成一片,1974-05-24,1974-05
马卡里奥斯总统从杭州到达广州访问徐向前副委员长等陪同访问。    贵宾离开杭州时，谭启龙主任等前往机场欢送广东省革委会举行宴会欢迎塞浦路斯贵宾赵紫阳主任马卡里奥斯总统祝酒,1974-05-24,1974-05
李先念副总理、姬鹏飞外长会见拉米雅公主,1974-05-24,1974-05
保尔斯大使举行招待会庆祝德意志联邦共和国二十五周年,1974-05-24,1974-05
廖承志会长会见并宴请日本全国都道府县议会议长会友好访华团,1974-05-24,1974-05
为法国工业科学技术展览会在京举行絮德罗主席马纳克大使举行招待会,1974-05-24,1974-05
为拉米雅公主访问中国摩洛哥驻华大使祖海里举行招待会,1974-05-24,1974-05
中国新加坡射击队在京友谊赛结束,1974-05-24,1974-05
外事往来,1974-05-24,1974-05
福建春收粮食作物比去年增产二成,1974-05-24,1974-05
湖北超额完成漆树种植任务,1974-05-24,1974-05
南通水产系统夺得春汛海洋渔业丰收,1974-05-24,1974-05
大力开展技术革新运动充分发挥现有设备潜力朝鲜钢铁企业继续取得新成绩一年来地质工作者发现十几个蕴藏量丰富的矿山和三百多条矿脉,1974-05-24,1974-05
意大利一百七十万农业工人大罢工日本农民渔民代表分别在东京集会要求改善生活,1974-05-24,1974-05
越南南方共和与越南外交部发言人谴责美国阴谋为西贡政权建弹药厂,1974-05-24,1974-05
朝鲜南北红十字会代表进行第六次接触,1974-05-24,1974-05
越南北方广泛开展群众性体育活动,1974-05-24,1974-05
物价接连上涨通货急剧膨胀南朝鲜经济日益恶化,1974-05-24,1974-05
炉火正红风华正茂——访朝鲜黄海钢铁联合企业,1974-05-24,1974-05
第三世界国家捍卫独立主权发展民族经济委内瑞拉着手实现石油国有化墨西哥外长表示坚持二百海里承袭海主张多哥政府为捍卫本国矿业资源决定接管多哥贝宁矿业公司中的外资股份,1974-05-24,1974-05
几内亚、科威特、也门和沙特阿拉伯领导人重申坚决支持黎巴嫩和巴勒斯坦人民正义斗争,1974-05-24,1974-05
斯里兰卡人民热烈庆祝共和国日总统高伯拉瓦和总理班达拉奈克夫人发表文告，号召加强团结，维护独立，发展民族经济,1974-05-24,1974-05
非洲和阿拉伯女议员举行大会会议赞扬非洲和阿拉伯妇女在解放斗争中的作用,1974-05-24,1974-05
西德总理施密特发表施政纲领,1974-05-24,1974-05
澳大利亚《先锋报》发表社论揭露苏联社会帝国主义加紧对澳渗透,1974-05-24,1974-05
中央条约组织部长理事会举行会议,1974-05-24,1974-05
在争吵的背后,1974-05-24,1974-05
北京地区天气预报,1974-05-24,1974-05
应我国政府的邀请前来进行访问英国保守党领袖爱德华·希思到京邓小平副总理、吴德主任等和首都群众数千人前往机场热烈欢迎,1974-05-25,1974-05
周恩来、王洪文、张春桥、江青、姚文元、邓小平、郭沫若    会见李政道博士和夫人同他们进行了十分亲切的谈话,1974-05-25,1974-05
圆满结束对我国的正式访问马卡里奥斯总统离广州回国徐向前、赵紫阳等和广州市群众两千人前往车站热烈欢送,1974-05-25,1974-05
为柬埔寨代表团访问亚、欧、非友好国家宾努首相宴请有关国家使节乔森潘团长、英·萨利副团长、宾努首相的夫人等作陪,1974-05-25,1974-05
李先念副总理同乔森潘团长、英·萨利副团长举行会谈,1974-05-25,1974-05
叶剑英、纪登奎同志会见并宴请罗马尼亚共青团代表团宾主进行了亲切友好的谈话,1974-05-25,1974-05
毛主席语录,1974-05-25,1974-05
鼓吹“先哲”就是搞孔孟之道,1974-05-25,1974-05
靠实践，不靠“天才”,1974-05-25,1974-05
在斗争中提高觉悟增长才干,1974-05-25,1974-05
复辟倒退注定要失败,1974-05-25,1974-05
各族群众发扬自力更生、艰苦奋斗的革命精神新疆广大农村牧区积极兴建小水电站,1974-05-25,1974-05
对我云南四川地震表示深切慰问海涅曼总统致电董必武代主席,1974-05-25,1974-05
希腊外长致电姬鹏飞外长,1974-05-25,1974-05
意大利外长致电姬鹏飞外长,1974-05-25,1974-05
邓小平会见日本全国都道府县议会议长会友好访华团,1974-05-25,1974-05
邓小平会见法国官方代表团和法国雇主全国委员会代表团,1974-05-25,1974-05
我旅日旅美台湾省同胞运动员同祖国各地运动员在京联欢,1974-05-25,1974-05
拉米雅公主离开北京前往广州,1974-05-25,1974-05
外事往来,1974-05-25,1974-05
我新任驻老挝大使国鹰离京赴任,1974-05-25,1974-05
白求恩的亲属来到中国,1974-05-25,1974-05
非洲统一组织代理行政秘书长发表声明庆祝非洲统一组织成立十一周年多哥、达荷美和尼日利亚领导人重申坚决支持非洲解放运动,1974-05-25,1974-05
反对葡萄牙新政权搞所谓“联邦”的主张圣多美岛及普林西比岛人民要求完全独立,1974-05-25,1974-05
第二十七届世界卫生大会闭幕并通过决议援助非洲南部民族解放运动许多代表谴责帝国主义殖民主义种族主义犹太复国主义,1974-05-25,1974-05
非洲人民争取国家独立和民族解放运动的巨大成果,1974-05-25,1974-05
英国澳大利亚劳动人民纷起斗争要求增加工资芬兰各地五千名养老金领取者举行集会示威要求改善生活,1974-05-25,1974-05
巴巴多斯群众示威反对外国垄断资本剥削,1974-05-25,1974-05
增进友谊加深了解交流经验国际羽毛球表演赛在曼谷闭幕,1974-05-25,1974-05
我旅游局代表团结束对伊朗的访问,1974-05-25,1974-05
第三世界国家积极发展农业墨西哥增加粮食生产争取达到自给    厄瓜多尔兴修水利增加贷款扩大多种经营索马里五年发展计划把发展农业放在重要地位    尼泊尔试种棉花获得较好收成,1974-05-25,1974-05
阿尔巴尼亚《人民之声报》发表文章指出发展中国家奋起反霸捍卫主权发展民族经济,1974-05-25,1974-05
新西兰《人民之声》周报指出新西兰受外国垄断资本入侵之害,1974-05-25,1974-05
亚非拉国家捍卫独立主权保护民族资源尼日利亚在五家外国石油公司中取得过半股份    中非把五家外国石油公司国有化牙买加政府宣布对外资铝土公司征收新税  菲律宾公布法令限制外资攫取菲资金,1974-05-25,1974-05
口蜜腹剑的假朋友——苏修破坏阿拉伯国家石油斗争的两面手法,1974-05-25,1974-05
北京地区天气预报,1974-05-25,1974-05
毛泽东主席会见英国前首相希思等贵宾毛主席同英国贵宾一一握了手，并且同希思先生和艾惕思大使    在无拘束的气氛中进行了广泛的交谈周恩来总理、王洪文副主席、邓小平副总理等参加了会见和谈话,1974-05-26,1974-05
邓小平副总理举行宴会热烈欢迎英国前首相希思艾惕思大使应邀出席吴德主任、姬外长等作陪    邓小平副总理和希思先生讲话,1974-05-26,1974-05
英国前首相希思在京参观,1974-05-26,1974-05
邓小平副总理同英国前首相希思会谈,1974-05-26,1974-05
毛主席语录,1974-05-26,1974-05
学习《在延安文艺座谈会上的讲话》批判林彪效法孔老二“克己复礼”的罪行北京市部分文艺工作者座谈，决心把文艺革命推向前进,1974-05-26,1974-05
非洲国家驻中国使节举行招待会庆祝“非洲解放日”十一周年西哈努克亲王、沙林察大臣、李先念副总理、姬鹏飞部长等应邀出席,1974-05-26,1974-05
对我云南四川地震表示诚挚慰问埃切维里亚总统致电董代主席,1974-05-26,1974-05
埃切维里亚总统致电周总理,1974-05-26,1974-05
陈明仁先生追悼会在北京举行朱德、周恩来、叶剑英、聂荣臻、许德珩送了花圈聂荣臻主持追悼会肖劲光致悼词,1974-05-26,1974-05
我国参加第七届亚运会水球选拔赛结束,1974-05-26,1974-05
在欢迎希思先生的宴会上邓小平副总理的讲话,1974-05-26,1974-05
在邓小平副总理举行的欢迎宴会上希思先生的讲话,1974-05-26,1974-05
罗斯临时代办举行招待会庆祝阿根廷共和国国庆,1974-05-26,1974-05
姬鹏飞外长会见马尔加什共和国新任驻华大使,1974-05-26,1974-05
罗马尼亚共青团代表团离京回国,1974-05-26,1974-05
外事往来,1974-05-26,1974-05
国家体委举行招待会欢迎阿尔巴尼亚田径和排球运动员,1974-05-26,1974-05
光辉的道路丰硕的成果——北京部队空军五·七干校出校学员的情况调查,1974-05-26,1974-05
五·七干校对我的教育实在深,1974-05-26,1974-05
老胡恢复了老长工的本色,1974-05-26,1974-05
柬通社欢呼乔森潘、英·萨利率代表团访问十一国圆满成功柬埔寨人民革命运动在国际上享有崇高威望,1974-05-26,1974-05
纪念第一次反法西斯民族解放代表大会召开三十周年阿尔巴尼亚举行隆重庆祝活动列希、谢胡等领导人参加，列希在群众大会上发表讲话,1974-05-26,1974-05
柬埔寨人民武装继续在金边周围等地打击伪军敌占区人民英勇斗争反对朗诺集团强行征兵的法西斯行径,1974-05-26,1974-05
越南南方共和外交部发言人发表公报揭露西贡政权连续制造大量违反停火事件,1974-05-26,1974-05
不满朗诺集团的法西斯统治柬埔寨敌占区大批居民和伪军投奔解放区,1974-05-26,1974-05
不满西贡政权破坏巴黎协定的行径西贡军队士兵纷纷开小差和举行起义,1974-05-26,1974-05
南朝鲜劳动人民受尽剥削生活日益贫困,1974-05-26,1974-05
卡翁达总统和阿明总统为庆祝“非洲解放日”分别发表文告团结起来争取非洲的完全解放朝鲜《劳动新闻》指出非洲人民斗争大大促进三大洲反帝革命事业,1974-05-26,1974-05
安哥拉和津巴布韦人民武装不断取得新战果坦桑尼亚外长重申支持非洲南部和几内亚（比绍）人民的斗争,1974-05-26,1974-05
一纸空文一场骗局,1974-05-26,1974-05
一些中小国家代表在裁军会议上揭露和抨击苏美空谈“裁军”加紧扩军,1974-05-26,1974-05
伊朗和摩洛哥发表联合公报希望地中海和印度洋摆脱大国竞争,1974-05-26,1974-05
“欧安会”第二阶段会议仍无进展,1974-05-26,1974-05
孟加拉国一周刊刊载报道谴责印度不愿解决法拉卡水坝问题,1974-05-26,1974-05
北京地区天气预报,1974-05-26,1974-05
中柬两国政府关于一九七四年中国无偿供应柬埔寨军事装备物资协定在京签字西哈努克亲王和夫人、宾努亲王和夫人、乔森潘团长、英·萨利副团长，我国党政领导人周恩来、叶剑英、李先念、陈锡联、苏振华参加签字仪式,1974-05-27,1974-05
英国前首相希思等贵宾应邀出席音乐会我国领导人江青、邓小平、吴德陪同英国贵宾出席,1974-05-27,1974-05
邓副总理同英国前首相希思继续会谈,1974-05-27,1974-05
在柬埔寨国家元首西哈努克亲王主持下乔森潘团长英·萨利副团长举行盛大告别宴会叶剑英李先念陈锡联苏振华等应邀出席西哈努克亲    王夫人、宾努亲王和夫人出席作陪乔森潘副首相和李先念副总理讲话宴会始终洋溢    着中柬两国人民团结战斗的热烈气氛,1974-05-27,1974-05
认真看书学习深入批林批孔南宁火车站装卸一大班青年读书小组的工人路线斗争觉悟不断提高,1974-05-27,1974-05
毛主席语录,1974-05-27,1974-05
在告别宴会上乔森潘副首相的讲话,1974-05-27,1974-05
在乔森潘副首相举行的告别宴会上李先念副总理的讲话,1974-05-27,1974-05
李先念副总理会见朝鲜友好访华参观团,1974-05-27,1974-05
日本全国都道府县议会议长会友好访华团举行告别宴会,1974-05-27,1974-05
我参加第七届亚运会乒乓球和举重选拔赛结束,1974-05-27,1974-05
郭沫若副委员长会见日本朋友西园寺公一和夫人,1974-05-27,1974-05
否定文化大革命就是倒退复辟,1974-05-27,1974-05
无产阶级文化大革命的光辉照耀彝家寨,1974-05-27,1974-05
实践出真知,1974-05-27,1974-05
批判林彪鼓吹“生而知之”谬论,1974-05-27,1974-05
实践使我学会了雕塑创作——斥林彪鼓吹孔老二“生而知之”的谬论,1974-05-27,1974-05
巨大的动力喜人的步伐    ——批林批孔斗争推动石家庄地区农业学大寨运动记实,1974-05-27,1974-05
新的起点新的作风——记四川省什邡县马井公社七大队干部在文化大革命中的变化,1974-05-27,1974-05
路线对了头水随人意流——记临澧县在文化大革命中修建大型水轮泵站的事迹,1974-05-27,1974-05
广大农业劳动者决心夺取今年粮食生产更大丰收朝鲜农村全面进入插秧大忙季节,1974-05-27,1974-05
罗马尼亚社会主义团结阵线举行代表大会齐奥塞斯库、波德纳拉希等党政领导人出席,1974-05-27,1974-05
圭亚那和朝鲜建立外交关系,1974-05-27,1974-05
共筑友谊之路,1974-05-27,1974-05
日中友协（正统）举行全国代表大会黑田寿男会长发表讲话宫崎世民理事长做工作报告,1974-05-27,1974-05
也门卫生部长沃杜德为我医疗队举行招待会,1974-05-27,1974-05
加强非洲团结支持非洲解放斗争塞拉西一世皇帝发表文告庆祝非洲统一组织成立十一周年埃及和坦桑举行庆祝集会阿、罗报纸赞扬非洲人民斗争,1974-05-27,1974-05
第三世界加强团结反帝反霸维护独立主权墨西哥总统埃切维里亚强烈谴责超级大国争霸世界圭亚那部长纳西门托指责帝国主义掠夺第三世界的资源,1974-05-27,1974-05
数千青年在里斯本示威反对葡殖民主义扎伊尔报纸揭露西方石油公司同葡萄牙殖民主义者勾结掠夺安哥拉石油，镇压非洲民族解放运动,1974-05-27,1974-05
苏丹举行阅兵和游行庆祝革命五周年尼迈里总统检阅游行队伍并在议会强调支持非洲解放运动,1974-05-27,1974-05
日本众院强行通过反动的“靖国神社法案”,1974-05-27,1974-05
伊朗报纸揭露苏修对发展中国家进行剥削要求调整伊朗售给苏联的天然气价格,1974-05-27,1974-05
日本政府要求苏联停止海上打靶训练指出苏联无视日苏渔业委员会达成的协议,1974-05-27,1974-05
“一体化”的要害,1974-05-27,1974-05
北京地区天气预报,1974-05-27,1974-05
联合公报,1974-05-28,1974-05
英国前首相希思举行答谢宴会邓小平副总理、吴德主任、姬鹏飞外长等应邀出席希思先生和邓小平副总理先后在宴会上讲话,1974-05-28,1974-05
乔森潘、英·萨利率代表团离京回国叶剑英、李先念、陈锡联、吴德、苏振华和数千群众前往机场热烈欢送西哈努克亲王，宾努首相和夫人等也前往机场欢送,1974-05-28,1974-05
周总理会见英国前首相希思宾主在友好的气氛中进行了谈话邓副总理参加会见，在此前同希思先生继续会谈,1974-05-28,1974-05
毛主席语录,1974-05-28,1974-05
中国和马来西亚友好关系的新发展,1974-05-28,1974-05
英国前首相希思参观北京大学受到师生们的热烈欢迎,1974-05-28,1974-05
马尔加什共和国新任驻华大使拉若纳里韦洛向朱德委员长递交国书,1974-05-28,1974-05
对我云南四川地震表示深切慰问加拿大外长致电姬鹏飞外长,1974-05-28,1974-05
中国阿根廷男子篮球队在京进行友谊赛华国锋同志等出席观看比赛,1974-05-28,1974-05
首都新闻界举行招待会欢迎马来西亚新闻工作者,1974-05-28,1974-05
我解放军友好参观团离京去朝鲜访问,1974-05-28,1974-05
拉米雅公主离开广州回国,1974-05-28,1974-05
全国中国式摔跤比赛在呼和浩特举行,1974-05-28,1974-05
我参加第七届亚运会篮球选拔赛结束,1974-05-28,1974-05
外事往来,1974-05-28,1974-05
站在斗争前列加强党的领导天津动力机厂党委不断加深对批林批孔斗争伟大意义的理解，    放手发动群众，批林批孔斗争步步深入发展,1974-05-28,1974-05
