西哈努克亲王和夫人会见桑戈尔总统和夫人,1974-05-09,1974-05
桑戈尔总统参观北京大学和故宫吴德何英陪同贵宾参观北大受到学校负责人和学员热烈欢迎徐向前陪同贵宾参观故宫和文化大革命期间出土的历史文物,1974-05-09,1974-05
毛主席语录,1974-05-09,1974-05
难以用分数来评定——记工农兵大学生赵兵和他的一份答卷,1974-05-09,1974-05
宁夏中宁县鸣沙中学贯彻执行毛主席的《五·七指示》批林批孔更加坚定了开门办学,1974-05-09,1974-05
在本学期化学学习中对对立统一规律的体会,1974-05-09,1974-05
文化大革命的伟大成果不容否定西藏列麦公社社员回顾公社成立后的变化，狠批林彪“克己复礼”,1974-05-09,1974-05
我们热爱文化大革命中出现的新事物,1974-05-09,1974-05
畲族人民热情歌颂文化大革命,1974-05-09,1974-05
“仁者爱人”是骗人的鬼话,1974-05-09,1974-05
“富民”的标本,1974-05-09,1974-05
在继续革命的大道上阔步前进——记浙江余杭县五常公社干部坚持参加集体生产劳动的事迹,1974-05-09,1974-05
上海市妇女联合会举行报告会越南南方女英雄女勇士报告抗美救国斗争英雄事迹阮氏定团长等越南南方女战友在会上受到热烈欢迎,1974-05-09,1974-05
北京部队某部榴炮一连指战员在批林批孔中畅谈切身体会《五·七指示》促进连队建设,1974-05-09,1974-05
结束在南京的友好访问阿赫马尔议长率代表团返回北京,1974-05-09,1974-05
吴船大使举行电影招待会纪念奠边府大捷二十周年,1974-05-09,1974-05
今年全国篮球联赛第一阶段比赛结束,1974-05-09,1974-05
毛里塔尼亚首都群众集会欢迎柬埔寨代表团达达赫总统接见并宴请柬埔寨代表团穆克纳斯外长设宴欢迎乔森潘、英·萨利等柬埔寨贵宾,1974-05-09,1974-05
柬埔寨人民武装继续发动进攻获新胜利四月下半月在各个战场共歼灭朗诺伪军八千多,1974-05-09,1974-05
菲律宾总统马科斯表示希望菲中两国不久以后建交,1974-05-09,1974-05
瑞典国王卡尔十六世接见我大使,1974-05-09,1974-05
我乒乓球代表团离开东京回国,1974-05-09,1974-05
中波签订海运公司管委会会议议定书,1974-05-09,1974-05
中塞人民友情深,1974-05-09,1974-05
几内亚（比绍）爱国武装连续发动进攻获新战果莫三鼻给自由战士击落侵犯解放区的敌机两架,1974-05-09,1974-05
沙特阿拉伯国防和航空大臣阿卜杜勒·阿齐兹表示反对苏美争夺中东不许外国干涉海湾事务突尼斯法院缺席判处苏联间谍无期徒刑,1974-05-09,1974-05
巴勒斯坦突击队继续打击敌人  散发传单号召敌占区人民奋起反击以色列侵略者,1974-05-09,1974-05
以色列多次侵袭黎巴嫩,1974-05-09,1974-05
强烈抗议全国劳资关系法院压制工人斗争英国一百多万机械工人举行全国性罢工多米尼加工人和教师罢工罢教支持政治犯正义斗争,1974-05-09,1974-05
苏修争夺海上霸权的自供状,1974-05-09,1974-05
北京城区天气预报,1974-05-09,1974-05
桑戈尔总统和夫人举行盛大宴会塞内加尔贵宾离京前往大寨访问西哈努克亲王和夫人、宾努亲王和夫人，李先念陈锡联华国锋吴德    徐向前等应邀出席宴会桑戈尔总统和李先念副总理在宴会上讲话李先念等陪同前往，陈锡联华国锋吴德徐向前    和数千群众到车站欢送,1974-05-10,1974-05
周恩来总理、李先念副总理同桑戈尔总统继续举行会谈,1974-05-10,1974-05
北京二七机车车辆厂的工人、干部深入批林批孔热情歌颂文化大革命的伟大胜利坚持无产阶级专政下的继续革命,1974-05-10,1974-05
沈阳部队炮兵某团三连青年战士李发锁关心国家大事满怀革命热情努力学习积极批林批孔,1974-05-10,1974-05
毛主席语录,1974-05-10,1974-05
在桑戈尔总统举行的宴会上桑戈尔总统的讲话,1974-05-10,1974-05
在桑戈尔总统举行的宴会上李先念副总理的讲话,1974-05-10,1974-05
阮氏定副司令率领代表团到达韶山参观毛主席旧居受到群众热烈欢迎,1974-05-10,1974-05
阿赫马尔议长率代表团离京去朝鲜访问阿沛·阿旺晋美副委员长等到车站欢送也门贵宾,1974-05-10,1974-05
玄峻极大使对新华社记者发表谈话谴责朴正熙集团镇压南朝鲜青年的法西斯暴行,1974-05-10,1974-05
廖承志张香山会见并宴请日本朋友,1974-05-10,1974-05
廖承志会见日本出版编辑友好访华团,1974-05-10,1974-05
库尔卡大使举行酒会庆祝捷国庆,1974-05-10,1974-05
鲁迅的一张“白卷”——二十年代围绕“青年必读书”的一场斗争,1974-05-10,1974-05
从“子不语”谈起,1974-05-10,1974-05
社会主义文艺的根本任务不容篡改——批判林彪“写人”的反革命文艺口号,1974-05-10,1974-05
在斗争中成长——记鹤壁矿务局几位工人新干部,1974-05-10,1974-05
把青年干部放到斗争第一线去锻炼,1974-05-10,1974-05
全心全意为人民——记福建省沙县中堡大队赤脚医生巫先木,1974-05-10,1974-05
柬埔寨和毛里塔尼亚发表联合声明柬埔寨代表团结束对毛里塔尼亚的正式访问后前往雅温得,1974-05-10,1974-05
我代表在第二十七届世界卫生大会上发言指出    第三世界发展卫生事业必须坚持反帝反殖反霸世界卫生组织应该努力满足第三世界各国人民的愿望和要求,1974-05-10,1974-05
朝鲜社会主义劳动青年同盟和学生委员会等发表声明谴责朴正熙集团镇压南朝鲜青年学生的罪行,1974-05-10,1974-05
金英柱特使结束对伊拉克的访问朝鲜友好代表团访问尼泊尔后回国,1974-05-10,1974-05
加纳承认柬埔寨王国民族团结政府,1974-05-10,1974-05
瑞典——中国友好联合会举行第三次代表大会,1974-05-10,1974-05
我体操队访问阿尔及利亚后前往摩洛哥,1974-05-10,1974-05
第五十二届米兰国际博览会闭幕中国馆受到热烈欢迎，接待了五十多万观众,1974-05-10,1974-05
第五届布尔诺国际消费品博览会在捷举行,1974-05-10,1974-05
莫三鼻给解放阵线和争取安哥拉彻底独立全国联盟号召加强武装斗争实现完全独立扎伊尔总统和马里国家元首重申坚决支持非洲解放运动,1974-05-10,1974-05
印度全国数十万铁路工人举行大罢工中央政府雇员举行声援罢工西孟加拉邦职工罢工罢市,1974-05-10,1974-05
印度舆论揭穿苏联吹嘘苏印经济关系“平等”“互利”的谎言谴责苏联损人利己掠夺印度,1974-05-10,1974-05
讨论协调行动维护共同利益拉美十个咖啡生产国举行会议巴拿马工商部长强调香蕉生产国团结一致反对跨国公司,1974-05-10,1974-05
美国经济进一步严重恶化首季国民生产总值急剧下降，市场物价出现新涨风,1974-05-10,1974-05
北京城区天气预报,1974-05-10,1974-05
在斗争中培养工人理论队伍——上钢五厂二车间铸钢工段的调查,1974-05-11,1974-05
朝气蓬勃地战斗在批林批孔运动前列北京部队某团副政委、青年干部邢希礼，认真看书学习，带领全团指战员深入批判林彪和孔老二的反动谬论,1974-05-11,1974-05
我国科学工作者决心为建设祖国边疆作出贡献对青藏高原进行综合考察获得可喜成果,1974-05-11,1974-05
毛主席语录,1974-05-11,1974-05
热烈欢迎巴基斯坦的友好使者,1974-05-11,1974-05
桑戈尔总统和夫人等贵宾访问大寨后到沈阳李先念副总理陪同访问。访问大寨时，受到陈永贵、郭凤莲等和大寨大队社员的热烈欢迎。到达沈阳时，李伯秋等和沈阳市群众两千多人到机场热烈欢迎塞内加尔贵宾,1974-05-11,1974-05
邓小平会见越南通讯社代表团,1974-05-11,1974-05
西安市各界群众举行集会热烈欢迎日本京都市友好代表团孙长兴主任和船桥求己市长宣布西安市和京都市正式结成友好城市,1974-05-11,1974-05
姬鹏飞外长会见智利新任驻华大使,1974-05-11,1974-05
中澳女子篮球队在京进行友谊比赛,1974-05-11,1974-05
乍得首任驻华大使到达北京,1974-05-11,1974-05
外事往来,1974-05-11,1974-05
我国参加第七届亚运会排球选拔赛结束通过这次选拔比赛，将选出我国参加第七届亚洲运动会的排球代表队,1974-05-11,1974-05
庄稼汉时刻想着国家大事——批判林彪诬蔑劳动人民的反动谬论,1974-05-11,1974-05
批判“焉用稼”立志滚泥巴,1974-05-11,1974-05
人的认识一点也不能离开实践,1974-05-11,1974-05
所谓“革命的董仲舒”及其他,1974-05-11,1974-05
旭日东升——记北京市海淀区东升人民公社文化大革命以来的巨大变化,1974-05-11,1974-05
破“天命”除“天虫”,1974-05-11,1974-05
农业学大寨,1974-05-11,1974-05
这次文化大革命实在好！,1974-05-11,1974-05
乔森潘、英·萨利率柬代表团到达雅温得喀麦隆外长埃丰等高级官员到机场欢迎柬埔寨代表团途经阿克拉时加纳外长巴阿到机场迎送,1974-05-11,1974-05
柬埔寨人民武装在各地继续痛歼朗诺伪军,1974-05-11,1974-05
老挝临时民族联合政府作出决定不同意万象极右派召开“国民议会”会议巴特寮电台揭露万象极右派破坏两个中央机构的阴谋,1974-05-11,1974-05
越南南方军民严惩蚕食解放区的西贡军队,1974-05-11,1974-05
黄英俊谴责西贡政权破坏巴黎协定,1974-05-11,1974-05
巴基斯坦积极加强同第三世界的团结中巴人民在反对霸权主义和扩张主义斗争中结成深厚友谊,1974-05-11,1974-05
我工人代表团结束对朝鲜的友好访问朴成哲副总理接见代表团我大使举行宴会,1974-05-11,1974-05
杜尔总统接见我驻几内亚大使,1974-05-11,1974-05
我国家男子篮球代表团结束对菲律宾的访问梅尔乔部长设宴欢送，表示希望菲中关系进一步发展,1974-05-11,1974-05
英中了解协会举行第九次年会,1974-05-11,1974-05
列宁主义的外衣，老沙皇的黑货——剖析苏修所谓“民族接近”政策,1974-05-11,1974-05
美国人民示威反对种族歧视政策纽约旧金山等地黑人愤怒抗议当局的歧视和迫害,1974-05-11,1974-05
几内亚分别和科威特、巴林发表联合公报支持巴勒斯坦人民恢复民族权利的斗争也门总理表示全力声援巴勒斯坦人民,1974-05-11,1974-05
非洲人民加强反对种族歧视斗争非洲工会反对种族隔离协调委员会呼吁各国支持反种族隔离斗争非洲体育最高理事会执行委员会重申反对各种形式的种族歧视,1974-05-11,1974-05
北京地区天气预报,1974-05-11,1974-05
毛泽东主席会见布托总理和夫人等贵宾当巴基斯坦贵宾来到会见厅时，毛主席同他们一一握手，对他们前来我国访问表示欢迎。随后，毛主席同布托总理在亲切友好的气氛中进行了谈话周恩来总理、王洪文副主席、邓小平副总理等参加了会见和谈话,1974-05-12,1974-05
应周恩来总理邀请前来我国进行正式访问布托总理和夫人到京受到隆重热烈欢迎叶剑英、邓小平、纪登奎、吴德、阿沛·阿旺晋美等和数千名群众前往机场热烈欢迎周恩来总理在宾馆亲切迎接布托总理和夫人以及其他巴基斯坦贵宾,1974-05-12,1974-05
毛主席语录,1974-05-12,1974-05
西哈努克亲王和夫人会见阮氏定率领的越南南方妇女代表团越南南方妇女代表团访问桂林后回到北京,1974-05-12,1974-05
辽宁省革命委员会举行宴会热烈欢迎桑戈尔总统和夫人等贵宾李先念副总理等出席李伯秋副主任、桑戈尔总统先后在宴会上祝酒,1974-05-12,1974-05
随同布托总理和夫人访华的主要人员名单,1974-05-12,1974-05
帕拉冯维坎大使举行招待会庆祝老挝王国国庆,1974-05-12,1974-05
我工人代表团访问朝鲜后回到北京,1974-05-12,1974-05
我国乒乓球代表团离香港回到北京,1974-05-12,1974-05
千里海防绘新图,1974-05-12,1974-05
卑贱者最聪明高贵者最愚蠢,1974-05-12,1974-05
林彪鼓吹的“中庸之道”就是卖国之道,1974-05-12,1974-05
革命青年要与孔孟之道彻底决裂,1974-05-12,1974-05
永做草原上的新牧民——批判林彪恶毒攻击知识青年上山下乡的罪行,1974-05-12,1974-05
朝气蓬勃地战斗在批林批孔前列的青年战士们,1974-05-12,1974-05
在批林批孔中发挥革命故事的战斗作用上海市郊区广大故事员积极开展活动，热情歌颂社会主义新生事物，批判林彪、孔老二鼓吹的“克己复礼”等反动谬论,1974-05-12,1974-05
在毛主席无产阶级革命文艺路线指引下旅大市工人业余美术创作活动蓬勃开展,1974-05-12,1974-05
武汉市第一中学党总支发挥学生的革命积极性批林批孔巩固和发展教育革命成果,1974-05-12,1974-05
喀麦隆国务部长举行宴会欢迎柬埔寨代表团阿希乔总统接见乔森潘、英·萨利等柬埔寨贵宾,1974-05-12,1974-05
齐奥塞斯库总统接见朝鲜政府代表团重申全力支持朝鲜实现祖国自主和平统一的主张,1974-05-12,1974-05
阿尔巴尼亚人民开展烈士日纪念活动阿利雅、斯巴秀等领导人在地拉那向烈士陵墓献花圈,1974-05-12,1974-05
万象各界人士庆祝老挝国庆日瓦达纳国王主持庆祝活动，富马亲王发表讲话,1974-05-12,1974-05
朝鲜《劳动新闻》发表文章揭露朴正熙集团镇压南朝鲜人民的罪行,1974-05-12,1974-05
朴正熙集团出动飞机入侵分界线朝鲜北方上空,1974-05-12,1974-05
阿萨德总统接见我驻叙利亚大使,1974-05-12,1974-05
马西亚斯总统接见我驻赤道几内亚大使奥约诺·阿洛戈国务秘书为我大使离任举行招待会,1974-05-12,1974-05
史蒂文斯总统接见我考察组,1974-05-12,1974-05
反对朴正熙集团破坏农业南朝鲜各地农民奋起展开斗争,1974-05-12,1974-05
巴基斯坦恢复和发展农业生产的成就,1974-05-12,1974-05
安哥拉人民解放运动主席拒绝葡萄牙关于成立“联邦”的建议决心继续为争取彻底独立而斗争赞比亚总统卡翁达号召军队加强戒备以对付敌人突然袭击,1974-05-12,1974-05
刚果、坦桑尼亚、扎伊尔、赞比亚外长举行会议并发表联合公报支持非洲各解放运动加紧进行武装斗争,1974-05-12,1974-05
朝鲜《劳动新闻》就联大特别会议闭幕发表编辑部文章第三世界人民日益觉醒显示强大威力阿尔巴尼亚《团结报》强调反对两个超级大国的斗争是艰巨而长期的,1974-05-12,1974-05
南斯拉夫《信使报》发表评论揭露苏美两个超级大国制造“缓和”骗局,1974-05-12,1974-05
对抗苏联日益增长的军事挑战北大西洋集团在地中海举行大规模军事演习,1974-05-12,1974-05
迪戈加西亚岛,1974-05-12,1974-05
苏修向印度洋的扩张和侵略,1974-05-12,1974-05
北京城区天气预报,1974-05-12,1974-05
热烈欢迎布托总理和夫人等贵宾叶剑英江青邓小平纪登奎吴德阿沛·阿旺晋美会见贵宾邓小平副总理主持以周恩来总理名义举行的盛大宴会会见时宾主进行了亲切友好的谈话邓小平副总理和布托总理    在宴会上先后讲话,1974-05-13,1974-05
云南昭通地区和与其邻接的四川凉山彝族自治州境内发生强烈地震毛主席和党中央、国务院十分关怀灾区人民迅速组织有关部门进行救灾工作，同时派出慰问团前往灾区慰问。    地震地区各族人民满怀信心战胜地震灾害，决心自力更生，奋发图    强，发展生产，重建家园,1974-05-13,1974-05
周恩来总理、邓小平副总理同布托总理在亲切友好气氛中举行会谈,1974-05-13,1974-05
布托总理的夫人参观北京料器制品厂,1974-05-13,1974-05
邓颖超同志会见阮氏定为团长的越南南方妇女解放联合会代表团宾主进行了十分亲切友好的谈话,1974-05-13,1974-05
毛主席语录,1974-05-13,1974-05
在欢迎布托总理宴会上邓小平副总理的讲话,1974-05-13,1974-05
在欢迎布托总理宴会上  布托总理的讲话,1974-05-13,1974-05
劳动经常化思想革命化——记中共吴堡县委领导成员坚持参加集体生产劳动的事迹,1974-05-13,1974-05
上海六万知识青年在塔里木盆地茁壮成长他们努力学习马列著作和毛主席著作，积极参加三大革命运动，路线斗争觉悟不断提高，为建设祖国边疆贡献自己的力量,1974-05-13,1974-05
桑戈尔总统和夫人在沈阳参观受到热烈欢迎李先念副总理和李伯秋副主任等陪同贵宾参观,1974-05-13,1974-05
首都新闻界举行招待会欢迎随同布托总理访华的新闻工作者,1974-05-13,1974-05
应邀前来我国进行友好访问斯里兰卡体育部部长拉特纳亚克到京,1974-05-13,1974-05
我国家男子篮球代表团离香港回京,1974-05-13,1974-05
中华全国体育总会举行招待会欢迎朝鲜日本瑞典南斯拉夫乒乓球代表团,1974-05-13,1974-05
保护渔民健康促进渔业生产北海市培训一批海上赤脚医生,1974-05-13,1974-05
我有关方面强烈抗议南朝鲜渔轮的海盗行径严重警告南朝鲜当局必须立即停止类似事件的发生,1974-05-13,1974-05
外事往来,1974-05-13,1974-05
河北省交河县刘辛大队的干部和社员总结路线斗争经验深入批判“克己复礼”,1974-05-13,1974-05
仡佬族贫下中农热情歌颂文化大革命,1974-05-13,1974-05
坚决反击林彪诬蔑文化大革命的谰言,1974-05-13,1974-05
“愚公”不愚“智叟”不智,1974-05-13,1974-05
柬埔寨和喀麦隆发表联合公报柬代表团结束对喀麦隆的友好访问离雅温得前往埃及,1974-05-13,1974-05
越南南方芹苴和茶荣等省解放区人民努力克服困难发展经济巩固解放区,1974-05-13,1974-05
粮食生产不断增加文教事业进一步发展柬埔寨解放区一片欣欣向荣景象,1974-05-13,1974-05
贝克尔总统接见我驻伊拉克大使,1974-05-13,1974-05
菲律宾外长接见我国家男子篮球代表团负责人,1974-05-13,1974-05
巴中友协举办的中国美术展览在卡拉奇开幕,1974-05-13,1974-05
吉林毓文中学代表团离平壤回国,1974-05-13,1974-05
越南南方共和临时革命政府军事代表团发表声明宣布被迫停止参加两方中央联合军委会会议,1974-05-13,1974-05
英勇保卫解放区的女战士,1974-05-13,1974-05
拉美国家加强合作保卫独立主权发展民族经济加勒比共同体采取联合措施反对帝国主义控制和剥削三个香蕉出口国领导人举行会议抵抗跨国公司的压力,1974-05-13,1974-05
阿尔巴尼亚《团结报》发表文章揭露苏修鼓吹“局势和缓”的虚假性圭亚那部长谴责美苏在“和缓”烟幕下加紧扩张军备,1974-05-13,1974-05
毛里塔尼亚、也门、伊拉克和乌干达领导人重申支持阿拉伯和巴勒斯坦人民的正义斗争叙利亚总统和国防部长视察前线,1974-05-13,1974-05
苏里南（荷属圭亚那）内政部长宣布决心争取在一九七五年底实现独立,1974-05-13,1974-05
加拿大众议院通过对政府不信任动议,1974-05-13,1974-05
冰岛总理宣布解散议会重新举行大选,1974-05-13,1974-05
北京城区天气预报,1974-05-13,1974-05
布托总理和夫人举行盛大宴会西哈努克亲王和夫人、宾努亲王和夫人，我国领导人叶剑英、邓小平、纪登奎、吴德、阿沛·阿旺晋美应邀出席布托总理和邓小平副总理先后在宴会上讲话，热烈赞扬中巴两国人民的友谊    和两国之间友好合作关系的新发展,1974-05-14,1974-05
邓小平副总理同布托总理会谈会谈在亲切友好的气氛中进行,1974-05-14,1974-05
西哈努克亲王和夫人会见布托总理和夫人,1974-05-14,1974-05
大连钢厂职工以本厂文化大革命中巨大变化的事实深批林彪“克己复礼”的反动纲领,1974-05-14,1974-05
在毛主席的革命路线指引下我国城市煤气事业有很大发展设有煤气的城市由一九六五年的十六个增加到三十一个，供气量增加一倍半,1974-05-14,1974-05
甘肃窑街矿务局自行设计自己施工新建一对现代化大型矿井,1974-05-14,1974-05
毛主席语录,1974-05-14,1974-05
在布托总理举行的宴会上布托总理的讲话,1974-05-14,1974-05
在布托总理举行的宴会上邓小平副总理的讲话,1974-05-14,1974-05
桑戈尔总统和夫人离开沈阳去朝鲜访问李先念副总理李伯秋副主任等和两千多名群众到机场热烈欢送贵宾,1974-05-14,1974-05
邓小平副总理、廖承志会长会见日本地方自治首长访华团,1974-05-14,1974-05
布托总理的夫人参观北京大学受到热烈欢迎,1974-05-14,1974-05
外事往来,1974-05-14,1974-05
日本地方自治首长访华团举行告别宴会廖承志、王磊等应邀出席宴会,1974-05-14,1974-05
国家体委举行宴会欢迎拉特纳亚克部长,1974-05-14,1974-05
批林批孔的闯将——喜见天津一代青年工人成长,1974-05-14,1974-05
山鹰展翅——记裕固族战士贺西江、贺西征兄弟俩批林批孔的事迹,1974-05-14,1974-05
批林批孔斗争中的英雄三岛子弟兵,1974-05-14,1974-05
进一步发挥革命样板戏的战斗作用——热烈欢呼革命样板戏影片汇映,1974-05-14,1974-05
捍卫革命样板戏的创作原则,1974-05-14,1974-05
革命的文艺斗争的武器,1974-05-14,1974-05
火红的战旗斗争的凯歌,1974-05-14,1974-05
乔森潘、英·萨利率柬埔寨代表团抵开罗埃及副总理伊斯梅尔等高级官员前往机场欢迎柬埔寨代表团途经恩贾梅纳时乍得外长到机场迎送,1974-05-14,1974-05
桑戈尔总统到朝鲜进行访问金日成主席等领导人到机场欢迎,1974-05-14,1974-05
维护巴黎协定保卫解放区越南南方各地军民继续痛击来犯的西贡伪军,1974-05-14,1974-05
柬人民武装在各条战线歼灭敌人一批有生力量金边西北前线的支前队积极配合人民武装打击朗诺伪军,1974-05-14,1974-05
巴基斯坦体委负责人和舆论谴责国际业余田径联合会的荒谬决定,1974-05-14,1974-05
菲律宾外长罗慕洛谈对外关系表示希望同中国很快建立外交关系,1974-05-14,1974-05
访巴基斯坦新兴的“棉纺城”,1974-05-14,1974-05
几内亚、阿尔及利亚、加蓬领导人重申支持非洲民族解放运动反对新殖民主义莫三鼻给自由战士击落葡萄牙殖民军飞机三架,1974-05-14,1974-05
第三世界国家团结起来维护本国权益伊朗国王指出石油输出国组织的成员国有权提高石油价格哥斯达黎加总统强调拉美国家加强合作保卫基本产品价格,1974-05-14,1974-05
科威特工商会会长发表讲话强调石油价格应当由产油国决定,1974-05-14,1974-05
科威特《舆论报》发表社论揭露苏美两个超级大国在中东加紧争夺泰国报纸谴责苏美进行间谍活动威胁泰国安全,1974-05-14,1974-05
巴勒斯坦革命者袭击以色列占领军日内瓦举办“巴勒斯坦人民反占领斗争二十六年”展览会,1974-05-14,1974-05
为保卫民族财富和工人切身利益拉丁美洲香蕉工人工会举行会议,1974-05-14,1974-05
叙利亚继续打击以色列侵略军,1974-05-14,1974-05
墨西哥人民举行集会游行纪念普埃布拉战役胜利一百一十二周年,1974-05-14,1974-05
秘鲁政府采取措施援救山崩受灾居民,1974-05-14,1974-05
北京城区天气预报,1974-05-14,1974-05
联合公报,1974-05-15,1974-05
结束对我国的正式访问布托总理和夫人离开北京回国我国领导人叶剑英、邓小平、纪登奎、吴德、阿沛·阿旺晋美和首都群众数千人前往机场热烈欢送巴基斯坦贵宾,1974-05-15,1974-05
邓小平副总理和布托总理继续会谈,1974-05-15,1974-05
阮氏定副司令为团长的越南南方妇女代表团离京回国刘湘屏、林丽韫、诸惠芬、李达等和首都各界妇女代表前往机场热烈欢送,1974-05-15,1974-05
长征主席率越南国会代表团出国访问途中路经北京徐向前副委员长等前往机场迎送,1974-05-15,1974-05
深入批林批孔促进工业生产伊犁哈萨克自治州直属厂矿首季工业生产取得新成果,1974-05-15,1974-05
毛主席语录,1974-05-15,1974-05
兰州综合电机厂党委领导成员认真看书学习，掌握批判武器领导站在前列带领群众把批林批孔运动引向深入,1974-05-15,1974-05
林彪反革命策略的破产——批判一份黑笔记,1974-05-15,1974-05
后来居上——记共产党员、青年女工张凤霞勇于和旧传统观念决裂的先进事迹,1974-05-15,1974-05
来自群众扎根群众——记焦作市水泥厂三位新干部,1974-05-15,1974-05
靠谁配管柱,1974-05-15,1974-05
试制弯管机,1974-05-15,1974-05
抢装空压机,1974-05-15,1974-05
批林批孔运动推动培养新干部的工作丰润县各级领导干部深批林彪鼓吹的孔孟之道，    冲破“论资排辈”等旧思想、旧观念的束缚，坚    持从工人、贫下中农中选拔和培养新干部,1974-05-15,1974-05
智利新任驻中国大使向朱德委员长递交国书,1974-05-15,1974-05
纪登奎会见罗马尼亚友好参观团,1974-05-15,1974-05
徐向前、阿沛·阿旺晋美会见巴基斯坦贵宾,1974-05-15,1974-05
成都部队某医院大力支持社会主义新生事物热情帮助农村社队办好合作医疗,1974-05-15,1974-05
第一批《农村版图书》开始出版,1974-05-15,1974-05
《文艺节目》第五辑、第六辑出版,1974-05-15,1974-05
廖承志会长会见并宴请日本京都市友好代表团,1974-05-15,1974-05
