中国京剧院四团在香港演出结束,1979-11-25,1979-11
简讯,1979-11-25,1979-11
巴勒斯坦全国委员会代表团离京,1979-11-25,1979-11
范若一同志追悼会在京举行,1979-11-25,1979-11
罗共十二大胜利闭幕,1979-11-25,1979-11
李光耀总理要求实行经济制裁迫使越南撤军,1979-11-25,1979-11
谁在灭绝柬埔寨民族,1979-11-25,1979-11
谴责越南拒绝联大决议支持李光耀建议,1979-11-25,1979-11
泰边防部队击退一股入侵的外国军队,1979-11-25,1979-11
印尼领导人表示准备同中国关系正常化,1979-11-25,1979-11
访问在泰国的难民收容中心,1979-11-25,1979-11
卢萨卡数千群众示威抗议罗得西亚的袭击,1979-11-25,1979-11
卡特声明伤害美国人质后果将极其严重,1979-11-25,1979-11
伊朗宣布不偿还伊朗银行所欠外债,1979-11-25,1979-11
加尔各答和达卡发生穆斯林示威,1979-11-25,1979-11
“别具一格”的玻利维亚政变结局,1979-11-25,1979-11
玻利维亚前陆军司令拒绝交权,1979-11-25,1979-11
利比亚总人民委员会秘书接见我大使,1979-11-25,1979-11
我驻加蓬大使离任回国,1979-11-25,1979-11
友好往来,1979-11-25,1979-11
北京地区天气预报,1979-11-25,1979-11
中国瓷器,1979-11-25,1979-11
瓷器的装饰,1979-11-25,1979-11
不寻常的十月,1979-11-25,1979-11
欢腾的多瑙河三角洲,1979-11-25,1979-11
伟大的平凡,1979-11-25,1979-11
“金花”与星洲,1979-11-25,1979-11
地外生命的探索,1979-11-25,1979-11
立足国内自力更生增产节约粮食,1979-11-26,1979-11
加强领导做好粮食工作,1979-11-26,1979-11
选拔工程技术人员到领导岗位,1979-11-26,1979-11
沈阳对调价偏高商品重新定价,1979-11-26,1979-11
为什么越南统一后中越关系恶化了？,1979-11-26,1979-11
大庆油田降低能源消耗,1979-11-26,1979-11
米糠玉米胚芽榨油潜力很大,1979-11-26,1979-11
肖金柏利用尾气发电受到奖励,1979-11-26,1979-11
侨眷夫妇严纪彤、王柏玲培养良种猪成绩显著被提升担任领导职务,1979-11-26,1979-11
简讯,1979-11-26,1979-11
农民欢迎农机产销见面、服务上门,1979-11-26,1979-11
这条路走对了（编后）,1979-11-26,1979-11
政策必须兑现多劳应该多得,1979-11-26,1979-11
堌阳公社对蹲点干部试行考核奖罚制度,1979-11-26,1979-11
农副产品提价给轻纺工业带来充足原料,1979-11-26,1979-11
揪出贪污犯企业获新生,1979-11-26,1979-11
淮北杨庄煤矿生产每吨煤上缴利润十一元多,1979-11-26,1979-11
上海‘二百型’英雄金笔可与美国派克金笔相媲美,1979-11-26,1979-11
不准以开会为借口请客送礼挥霍浪费,1979-11-26,1979-11
这种“框框”该不该突破？,1979-11-26,1979-11
倾听人民的声音,1979-11-26,1979-11
要把极左路线批透,1979-11-26,1979-11
大胆表现革命的人性美,1979-11-26,1979-11
大力表彰维护社会治安有功人员,1979-11-26,1979-11
战士徐相国勇擒凶犯光荣牺牲,1979-11-26,1979-11
勇斗肇事歹徒,1979-11-26,1979-11
挺身擒拿罪犯,1979-11-26,1979-11
林业科研工作重新走上正轨,1979-11-26,1979-11
改善学生生活和学习条件,1979-11-26,1979-11
足球运动重点地区已确定,1979-11-26,1979-11
中国体育服务公司在北京成立,1979-11-26,1979-11
“宁夏人民要比上海更需要我”,1979-11-26,1979-11
克拉斯副首相和夫人在西安参观,1979-11-26,1979-11
豪夫部长和夫人访问上海,1979-11-26,1979-11
王震会见英国朋友,1979-11-26,1979-11
柬埔寨群众集会欢呼联大决议,1979-11-26,1979-11
泰国致函联合国抗议外国军队侵犯边境,1979-11-26,1979-11
十三名越南人乘飞机逃到新加坡要求去美国避难,1979-11-26,1979-11
从经济伙伴转向政治伙伴,1979-11-26,1979-11
油田新生,1979-11-26,1979-11
吴奈温总统接见黄华外长,1979-11-26,1979-11
卡翁达总统接见我大使,1979-11-26,1979-11
我获斯堪的纳维亚乒乓球锦标赛男女团体冠军,1979-11-26,1979-11
友好往来,1979-11-26,1979-11
喀麦隆的经济首都杜阿拉,1979-11-26,1979-11
土耳其的心脏——安卡拉,1979-11-26,1979-11
麦加,1979-11-26,1979-11
西欧不能对它面临的威胁置之不理,1979-11-26,1979-11
葛罗米柯对西德的压力未能奏效根舍说波恩不接受莫斯科的立场,1979-11-26,1979-11
奥联邦军进行军事演习规模空前,1979-11-26,1979-11
美国参议院内的一场激烈较量,1979-11-26,1979-11
一些国家领导人呼吁伊朗释放美国人质,1979-11-26,1979-11
巴基斯坦支持伊朗召开安理会的要求,1979-11-26,1979-11
警惕企图得利的“渔翁”,1979-11-26,1979-11
哈克总统悼念美国使馆被袭击事件中死难者,1979-11-26,1979-11
占领麦加清真寺的武装分子已被肃清,1979-11-26,1979-11
世界卫生组织号召戒烟,1979-11-26,1979-11
北京地区天气预报,1979-11-26,1979-11
要进一步加强社会主义法制,1979-11-27,1979-11
基建投资改为贷款符合经济规律,1979-11-27,1979-11
建设银行改为国务院直属单位,1979-11-27,1979-11
我在国际奥委会合法权利得到恢复,1979-11-27,1979-11
江西由点到面开展法制教育,1979-11-27,1979-11
江苏省第一条一级公路通车,1979-11-27,1979-11
上海市化工轻工供应公司开设方便科研工作服务部,1979-11-27,1979-11
越中战斗友谊的事实不容歪曲,1979-11-27,1979-11
出路,1979-11-27,1979-11
江西省经委到第一线进行生产调度,1979-11-27,1979-11
天津市早点铺生意分外兴隆,1979-11-27,1979-11
南京市民中传播的一件‘新闻’,1979-11-27,1979-11
轻工部举办重点企业厂长轮训班,1979-11-27,1979-11
上海将批量生产电视机集成电路,1979-11-27,1979-11
宋地辉研制成熨烫被服新装置,1979-11-27,1979-11
ＥＣＬ电路系列开始投入批量生产,1979-11-27,1979-11
正确反映党的斗争历史,1979-11-27,1979-11
礼貌与尊严,1979-11-27,1979-11
事实是根据，法律是准绳,1979-11-27,1979-11
抚顺逮捕三名煽动闹事的犯罪分子,1979-11-27,1979-11
南宁奖励维护治安有功单位和个人,1979-11-27,1979-11
太原五一东路十二年青少年无犯罪现象,1979-11-27,1979-11
幼儿教育研究会在南京成立,1979-11-27,1979-11
邓副总理会见来自美洲的朋友,1979-11-27,1979-11
邓颖超会见朝中友协代表团,1979-11-27,1979-11
克拉斯副首相和夫人离广州回国,1979-11-27,1979-11
豪夫部长和夫人一行离京回国,1979-11-27,1979-11
姚依林会见斯里兰卡政府贸易代表团,1979-11-27,1979-11
方毅会见美国巴梭罗教授和夫人,1979-11-27,1979-11
中斯两国换货议定书在北京签字,1979-11-27,1979-11
对伊朗美国间事件表示关切,1979-11-27,1979-11
全国科普美术作品展览在京举行,1979-11-27,1979-11
我国地层工作进入新的发展阶段,1979-11-27,1979-11
第二届全国流体力学学术会议在无锡举行,1979-11-27,1979-11
中国统计学会成立,1979-11-27,1979-11
彩色科教片《吸烟危害健康》上映,1979-11-27,1979-11
越中战斗友谊的事实不容歪曲,1979-11-27,1979-11
苏联在西欧的外交活动连遭挫折,1979-11-27,1979-11
葡萄牙决心实现同欧洲共同体一体化,1979-11-27,1979-11
克里姆林宫输了一个回合,1979-11-27,1979-11
我国同国际奥委会的关系,1979-11-27,1979-11
大平首相说日中关系进展有助亚洲和世界和平,1979-11-27,1979-11
中比经济合作的新发展,1979-11-27,1979-11
伊朗代外长谈释放美国人质问题,1979-11-27,1979-11
西哈努克亲王到达巴黎,1979-11-27,1979-11
埃及又收回西奈的一块土地,1979-11-27,1979-11
北京地区天气预报,1979-11-27,1979-11
脱离社会需要的生产非调整不可,1979-11-28,1979-11
华国锋总理致电卡翁达总统,1979-11-28,1979-11
采取措施整顿大中城市社会秩序,1979-11-28,1979-11
县经委用经济办法管理工交企业,1979-11-28,1979-11
新形势新任务,1979-11-28,1979-11
关于知识分子问题的笔记,1979-11-28,1979-11
调整农机工业适应四化需要,1979-11-28,1979-11
民主选举车间干部带来新气象,1979-11-28,1979-11
满足市场需要增加企业利润,1979-11-28,1979-11
千年银杏树果实累累,1979-11-28,1979-11
‘油茶王’产茶油三十三斤半,1979-11-28,1979-11
大兴安岭发现木灵芝,1979-11-28,1979-11
面积和产量不会绝对成正比例,1979-11-28,1979-11
压服行不通说服受欢迎,1979-11-28,1979-11
是不接受国家计划指导吗？,1979-11-28,1979-11
究竟什么是‘懦夫懒汉世界观’？,1979-11-28,1979-11
畜牧为主势在必行,1979-11-28,1979-11
把科技工作摆在实现四化的关键位置上,1979-11-28,1979-11
我将派代表团参加明年奥运会比赛项目,1979-11-28,1979-11
越南武装人员又多次入侵我领土制造流血事件,1979-11-28,1979-11
法国新任驻华大使克洛德·沙耶向邓颖超副委员长递交国书,1979-11-28,1979-11
期待中华体育健儿并肩出现在奥运会上,1979-11-28,1979-11
王震会见美国造船业代表团,1979-11-28,1979-11
瑞士伯尔尼弦乐四重奏团离京回国,1979-11-28,1979-11
简讯,1979-11-28,1979-11
葛罗米柯在波恩“差一点跳了起来”,1979-11-28,1979-11
泰官方揭露苏越勾结侵柬并不断进攻泰国,1979-11-28,1979-11
斥黎某反华,1979-11-28,1979-11
英国外相主张北约战区核力量现代化,1979-11-28,1979-11
十亿人的中国回到奥林匹克运动奥林匹克精神将重新普及全世界,1979-11-28,1979-11
津巴布韦爱国阵线重申要修改英国停火方案,1979-11-28,1979-11
安理会一致同意讨论伊美关系问题,1979-11-28,1979-11
巴列维将离开美国,1979-11-28,1979-11
‘中国人喜欢瓦尔特，而我喜欢中国’,1979-11-28,1979-11
和谈之外的枪炮声,1979-11-28,1979-11
从古希腊奥运会到现代奥运会,1979-11-28,1979-11
丰富多采的奥运会竞赛项目,1979-11-28,1979-11
奥林匹克精神,1979-11-28,1979-11
国际奥委会机构,1979-11-28,1979-11
会徽·会旗·会歌,1979-11-28,1979-11
北京地区天气预报,1979-11-28,1979-11
清水安三会见记日本纪行,1979-11-28,1979-11
同志，何久自苦？,1979-11-28,1979-11
延边的早晨,1979-11-28,1979-11
抓紧培养和选拔优秀中青年干部,1979-11-29,1979-11
重视技术政策研究建立科研正常秩序,1979-11-29,1979-11
大平首相应邀下月五日访华,1979-11-29,1979-11
苏丹哈利勒上将即将率代表团访华,1979-11-29,1979-11
英德地区找到大型硫铁矿,1979-11-29,1979-11
凤凰牌自行车质量名列首位,1979-11-29,1979-11
老干部传帮带当“参谋”帮助年轻领导干部增长才干,1979-11-29,1979-11
平罗县委重视培养中青年少数民族干部,1979-11-29,1979-11
武汉部分企业降低成本产品不提价,1979-11-29,1979-11
广州一些商品提价不合理重新调整,1979-11-29,1979-11
左权县重点建设见效快的工程,1979-11-29,1979-11
广西按基建程序建设水利工程,1979-11-29,1979-11
江山县不搞‘一平二调’,1979-11-29,1979-11
花钱必须讲求实效,1979-11-29,1979-11
昌邑平原以多种经营为重点,1979-11-29,1979-11
增强了团结促进了生产,1979-11-29,1979-11
天津大学南开大学教授陆续搬入新居包头师专把新建宿舍全部分给教师,1979-11-29,1979-11
教育干部纠正不正之风常州市清理“试用产品”,1979-11-29,1979-11
北京约鱼台国宾馆开始接待自费来华访问的高级代表团,1979-11-29,1979-11
将新建领导干部住宅改作托儿所,1979-11-29,1979-11
赶快拯救走投无路的湖笔生产,1979-11-29,1979-11
党委要重视青少年的教育工作,1979-11-29,1979-11
重庆市重视青少年道德教育效果良好,1979-11-29,1979-11
澄迈县表彰一批好家长,1979-11-29,1979-11
平顶山市举办道德教育漫画展览,1979-11-29,1979-11
打击刑事犯罪维护社会治安（编者按）,1979-11-29,1979-11
依法惩办结伙抢劫犯,1979-11-29,1979-11
三个女青年勇擒盗窃犯,1979-11-29,1979-11
解帮拆伙促进转化,1979-11-29,1979-11
‘育女’如‘生儿’,1979-11-29,1979-11
冲破“男娶女嫁”旧观念,1979-11-29,1979-11
高尚品格传子女,1979-11-29,1979-11
南京市郊红花公社表彰只生一胎的社员,1979-11-29,1979-11
姐妹接班照顾烈属,1979-11-29,1979-11
祝贺我国奥委会合法权利得到恢复,1979-11-29,1979-11
切实关心支边干部加速建设西双版纳,1979-11-29,1979-11
黄麻起义和鄂豫皖苏区革命烈士纪念碑落成,1979-11-29,1979-11
徐向前同志会见南斯拉夫人民解放战争战士协会代表团,1979-11-29,1979-11
南斯拉夫电影周开幕,1979-11-29,1979-11
世界著名小提琴演奏家梅纽因到京,1979-11-29,1979-11
第十五届国际针灸班结束,1979-11-29,1979-11
一种医治鼻窦炎的新中药制成,1979-11-29,1979-11
宫学斌指压麻醉拔牙法受欢迎,1979-11-29,1979-11
张国英献出珍藏的古医书受奖,1979-11-29,1979-11
刘泽荣同志追悼会在北京举行,1979-11-29,1979-11
罗共中央政治执委会举行会议选出以齐奥塞斯库同志为首的常设局,1979-11-29,1979-11
必须加强武装力量维护国家主权,1979-11-29,1979-11
我党代表团在罗继续参观访问,1979-11-29,1979-11
黄华外长离开仰光回国,1979-11-29,1979-11
江苏同维多利亚州正式结成友好省（州）,1979-11-29,1979-11
上海和鹿特丹结成友好城市,1979-11-29,1979-11
我政府贸易代表团访问埃及,1979-11-29,1979-11
日本应发挥与国际地位相适应的作用,1979-11-29,1979-11
日本人民对中国有亲密感,1979-11-29,1979-11
朴实·健康·朝气蓬勃,1979-11-29,1979-11
访柬埔寨难民收容中心,1979-11-29,1979-11
日本新外相大来佐武郎,1979-11-29,1979-11
非洲——从“贫油大陆”到重要产油区,1979-11-29,1979-11
新兴的铀矿之国尼日尔,1979-11-29,1979-11
西德朝野支持北约加强中程武器,1979-11-29,1979-11
苏美核条约会使西欧安全面临真正挑战,1979-11-29,1979-11
瓦尔德海姆呼吁美伊采取克制避免形势激化,1979-11-29,1979-11
英联邦国家使节要求伊朗释放人质,1979-11-29,1979-11
美洲国家组织对美伊关系表示关注,1979-11-29,1979-11
霍梅尼反对安理会讨论伊美关系,1979-11-29,1979-11
苏联向伊朗扩张引人注目,1979-11-29,1979-11
我代表在联大重申支持巴勒斯坦人民的斗争,1979-11-29,1979-11
一架巴航客机在沙特阿拉伯上空坠毁,1979-11-29,1979-11
巴基斯坦出土大批珍贵文物,1979-11-29,1979-11
吉洪诺夫被提升为政治局委员,1979-11-29,1979-11
土耳其政府的更迭,1979-11-29,1979-11
德米雷尔,1979-11-29,1979-11
吉洪诺夫和戈尔巴乔夫,1979-11-29,1979-11
国际简讯,1979-11-29,1979-11
北京地区天气预报,1979-11-29,1979-11
通过建国以来法律法令效力的决议,1979-11-30,1979-11
加强社会主义法制的必要措施,1979-11-30,1979-11
五届人大常委会令第三号,1979-11-30,1979-11
建国以来制定的法律、法令除同目前的宪法、法律和法令相抵触外，继续有效,1979-11-30,1979-11
坚决支持巴勒斯坦恢复民族权利的斗争,1979-11-30,1979-11
彭真副委员长兼任人大常委会代秘书长,1979-11-30,1979-11
国务院公布劳动教养补充规定,1979-11-30,1979-11
重复建设应当制止,1979-11-30,1979-11
没有必要家家都搞电子计算机,1979-11-30,1979-11
建厂要考虑经济效果,1979-11-30,1979-11
人大常委会任命名单,1979-11-30,1979-11
平调集体企业资金要不得,1979-11-30,1979-11
两种所有制不能混同,1979-11-30,1979-11
许宁研究成功近人爆破技术,1979-11-30,1979-11
迅速提高我国农作物良种化水平,1979-11-30,1979-11
怎样加快治理黄河的步伐？,1979-11-30,1979-11
平原可以发展大牲畜,1979-11-30,1979-11
调动社员养畜的积极性,1979-11-30,1979-11
城镇附近养羊好,1979-11-30,1979-11
南阳黄牛在恢复发展,1979-11-30,1979-11
上海市七所医院加强经济管理,1979-11-30,1979-11
采用新技术与就业问题不矛盾,1979-11-30,1979-11
崞村中学为教师办了十件好事,1979-11-30,1979-11
深受欢迎的教师招待所,1979-11-30,1979-11
优先供应学校和教师用煤,1979-11-30,1979-11
谁的思想混乱？,1979-11-30,1979-11
要创造条件让老专家写书,1979-11-30,1979-11
如何从根本上扭转我国农业的恶性循环,1979-11-30,1979-11
北京市依法逮捕行凶拒捕罪犯,1979-11-30,1979-11
这里青少年的思想品德高尚,1979-11-30,1979-11
耐心教育违法犯罪的青少年,1979-11-30,1979-11
广开门路安排闲散待业青年,1979-11-30,1979-11
不要看不起自己,1979-11-30,1979-11
《外国人士看中国》办得好,1979-11-30,1979-11
中国的卡玛太少了,1979-11-30,1979-11
《卡玛罢宴》的联想,1979-11-30,1979-11
小问题和大问题,1979-11-30,1979-11
有感,1979-11-30,1979-11
《卡玛罢宴》真棒！,1979-11-30,1979-11
王震会见南斯拉夫电影代表团,1979-11-30,1979-11
方毅会见马塞尔·罗切夫妇,1979-11-30,1979-11
方毅会见美国肖洛教授和夫人,1979-11-30,1979-11
谷牧会见美国朋友,1979-11-30,1979-11
方毅会见澳科学与工业研究组织代表团,1979-11-30,1979-11
方毅会见美国美中学术交流委员会代表团,1979-11-30,1979-11
梅尔西尼大使和夫人举行招待会,1979-11-30,1979-11
中国新闻代表团访问日本后回到北京,1979-11-30,1979-11
天津市医院工作有改进,1979-11-30,1979-11
我国生物医学工程学科组在重庆成立,1979-11-30,1979-11
山东选拔一批中医药人员加强中医队伍,1979-11-30,1979-11
妇科尿瘘病有了新的治疗技术,1979-11-30,1979-11
新医正骨疗法使颈性失明病人见光明,1979-11-30,1979-11
兰州部队第十医院为患者寄药,1979-11-30,1979-11
中国人民始终不渝支持巴勒斯坦人民的斗争,1979-11-30,1979-11
铁托总统举行盛大招待会,1979-11-30,1979-11
大平首相和大来外相会见我广播电视代表团,1979-11-30,1979-11
哈克总统赞扬巴中友谊,1979-11-30,1979-11
苏丹第一副总统启程来华,1979-11-30,1979-11
泰外长说日中加强关系有利亚洲和平,1979-11-30,1979-11
印尼利用外资发展石油工业,1979-11-30,1979-11
塞内加尔改善企业管理推动生产发展,1979-11-30,1979-11
委内瑞拉开设产销直接挂钩大众市场,1979-11-30,1979-11
多哥自力发展经济不躺在外援上,1979-11-30,1979-11
阿拉法特重申在中东建立公正持久和平,1979-11-30,1979-11
国际声援巴勒斯坦人民日,1979-11-30,1979-11
阿拉法特,1979-11-30,1979-11
洛桑维迪堡传来的喜讯,1979-11-30,1979-11
在漏船上凿窟窿,1979-11-30,1979-11
苏联今年粮食锐减经济情况不妙,1979-11-30,1979-11
卡特表示美国希望和平解决美伊危机,1979-11-30,1979-11
法国再次呼吁伊朗释放美国人质,1979-11-30,1979-11
伊拉克要求伊朗尊重国际准则,1979-11-30,1979-11
加纳呼吁伊美克制和平解决人质问题,1979-11-30,1979-11
葡萄牙的中期选举,1979-11-30,1979-11
美国向海湾产油国谋求石油稳定进口,1979-11-30,1979-11
新西兰一架飞机失事,1979-11-30,1979-11
委内瑞拉著名反政府游击队领导人“下山”,1979-11-30,1979-11
肯尼亚组成新内阁,1979-11-30,1979-11
日本的青少年问题,1979-11-30,1979-11
东京都私立高中学费将上涨,1979-11-30,1979-11
北京地区天气预报,1979-11-30,1979-11
