中英关切世界和平与稳定两国确信友好合作前途广阔,1979-11-01,1979-11
上海市轻工系统增产节约十条经验好,1979-11-01,1979-11
徐州矿务局降低坑木消耗,1979-11-01,1979-11
上海制成微型电子计算机,1979-11-01,1979-11
青藏铁路哈尔盖至德令哈段开办临时客运,1979-11-01,1979-11
本月起百分之四十职工升级增加工资,1979-11-01,1979-11
党中央、国务院决定今日起提高主要副食品销价并给职工补贴,1979-11-01,1979-11
人民经济生活中的一件大事,1979-11-01,1979-11
北京西城区房管局组织力量检修民房,1979-11-01,1979-11
研究李大钊学习李大钊,1979-11-01,1979-11
象李大钊同志那样工作和战斗,1979-11-01,1979-11
华总理向马克思墓敬献花圈,1979-11-01,1979-11
邓副总理会见法国前总理富尔,1979-11-01,1979-11
华总理参观英国北海油田展览,1979-11-01,1979-11
哈林议长率泰国国会代表团访问上海,1979-11-01,1979-11
西哈努克亲王举行生日庆祝宴会,1979-11-01,1979-11
邓颖超会见日创价学会妇女部访华团,1979-11-01,1979-11
康世恩会见法国地质学家代表团,1979-11-01,1979-11
土耳其驻华大使举行国庆招待会,1979-11-01,1979-11
谷牧会见日本朋友,1979-11-01,1979-11
王任重会见日本水稻专家,1979-11-01,1979-11
乌干达新任驻华大使向乌兰夫副委员长递交国书,1979-11-01,1979-11
沈雁冰会见瑞典文化人士代表团,1979-11-01,1979-11
教育部、广播局举办英语专题讲座,1979-11-01,1979-11
曾涛宴请朝中央通讯社代表团,1979-11-01,1979-11
林乎加率北京市友好代表团去东京访问,1979-11-01,1979-11
英国老维克剧团来我国访问演出,1979-11-01,1979-11
张维翰同志追悼会在京举行,1979-11-01,1979-11
简讯,1979-11-01,1979-11
施特劳斯强调警惕莫斯科战略,1979-11-01,1979-11
英报主张积极促进英中关系,1979-11-01,1979-11
芬报说第三世界已成世界性力量,1979-11-01,1979-11
‘保证’和现实,1979-11-01,1979-11
民柬政府呼吁各国迫使越南从柬撤军,1979-11-01,1979-11
泰国王后访柬难民营,1979-11-01,1979-11
江萨命令泰国军队作好充分准备,1979-11-01,1979-11
马克思墓,1979-11-01,1979-11
英国的航空工业,1979-11-01,1979-11
萨尔基斯总统接见何英,1979-11-01,1979-11
阿拉法特主席会见何英,1979-11-01,1979-11
德比市与铁路技术中心,1979-11-01,1979-11
谨访假冒,1979-11-01,1979-11
伦斯说苏联军费增长十倍于北约,1979-11-01,1979-11
苏联逆火式轰炸机指向美国海军,1979-11-01,1979-11
法国总统首次访问西柏林,1979-11-01,1979-11
中非两千示威学生同政府部队发生冲突,1979-11-01,1979-11
伊朗政府决定对库尔德问题实行政治解决,1979-11-01,1979-11
苏在阿—伊边境修建军事基地,1979-11-01,1979-11
美国内出现关于中东政策的新辩论,1979-11-01,1979-11
国际简讯,1979-11-01,1979-11
日本大选后的风波,1979-11-01,1979-11
卡斯巴巡礼,1979-11-01,1979-11
美科学家首次测出星际空间反物质流将对宇宙起源的研究产生重要影响,1979-11-01,1979-11
北京地区天气预报,1979-11-01,1979-11
注意培养发现人才繁荣祖国科学事业,1979-11-02,1979-11
回顾社会主义文艺的战斗历程阐明新时期文学艺术光荣任务,1979-11-02,1979-11
科学院举行茶话会隆重纪念建院三十周年,1979-11-02,1979-11
各行各业立即行动起来降低消耗节约能源,1979-11-02,1979-11
尽快解决山西煤炭积压问题,1979-11-02,1979-11
把节约能源这件大事抓紧,1979-11-02,1979-11
社员养羊何罪之有？,1979-11-02,1979-11
广东重点检查消费品的销售价格,1979-11-02,1979-11
南京市委通知严禁随意提高物价,1979-11-02,1979-11
也谈‘要亩数还是要产量’,1979-11-02,1979-11
县里也要有一点“自主权”,1979-11-02,1979-11
要‘实壮’不要‘虚胖’,1979-11-02,1979-11
还要再拉上一把,1979-11-02,1979-11
努力教育好青少年一代,1979-11-02,1979-11
无锡市开展树立新风尚活动,1979-11-02,1979-11
社会风尚逐步改观治安情况日渐好转,1979-11-02,1979-11
上海蓬莱街道组织社会调查,1979-11-02,1979-11
尽力为晚婚青工解决‘新房’,1979-11-02,1979-11
松门建立台湾渔民接待站,1979-11-02,1979-11
金韦一家亲,1979-11-02,1979-11
李光宇王桂英的婚事是怎样办的,1979-11-02,1979-11
华总理参观航空发动机制造厂和铁路技术中心,1979-11-02,1979-11
余秋里副总理在英国主要工业区参观,1979-11-02,1979-11
哈林议长率泰王国国会代表团到杭州访问,1979-11-02,1979-11
姬鹏飞会见法国革命共产党（马列主义）干部团,1979-11-02,1979-11
胡乔木离京去罗马尼亚和南斯拉夫访问,1979-11-02,1979-11
黄文欢同志参观首都国际机场,1979-11-02,1979-11
阿尔及利亚驻华大使和夫人举行国庆招待会,1979-11-02,1979-11
我国对外开放的八座山峰简介,1979-11-02,1979-11
我国从明年起将对外开放八座山峰,1979-11-02,1979-11
中国京剧院四团在香港演出受到热烈欢迎,1979-11-02,1979-11
杨允植同志追悼会在北京举行,1979-11-02,1979-11
齐奥塞斯库建议加强团结阵线进一步发扬民主,1979-11-02,1979-11
美国参议员证实越南对柬埔寨使用毒气,1979-11-02,1979-11
罗马尼亚农业取得好收成,1979-11-02,1979-11
南朝鲜的动乱,1979-11-02,1979-11
崔圭夏其人,1979-11-02,1979-11
如此‘姐妹省’,1979-11-02,1979-11
德热拉斯受法律制裁,1979-11-02,1979-11
曼彻斯特,1979-11-02,1979-11
古希腊悲剧熠熠放光彩,1979-11-02,1979-11
难忘的会见,1979-11-02,1979-11
欧洲共同体同非、加、太地区国家签署新洛美协定,1979-11-02,1979-11
达扬辞职说明了什么？,1979-11-02,1979-11
达扬其人,1979-11-02,1979-11
第二个《洛美协定》,1979-11-02,1979-11
古巴千方百计想当安理会非常任理事国,1979-11-02,1979-11
玻利维亚发生军事政变,1979-11-02,1979-11
意大利赞成在西欧部署美制新导弹,1979-11-02,1979-11
东、西德签订汽车过境协定,1979-11-02,1979-11
罗得西亚制宪会议讨论过渡期问题,1979-11-02,1979-11
国际简讯,1979-11-02,1979-11
西德总统将徒步旅行两年,1979-11-02,1979-11
苏联青年戴十字架成风,1979-11-02,1979-11
赫鲁晓夫成了“美国总统”,1979-11-02,1979-11
北京地区天气预报,1979-11-02,1979-11
安排国民经济把人民生活需要置于首位,1979-11-03,1979-11
必须遏制霸权主义的扩张和侵略,1979-11-03,1979-11
中英签订加强合作的两项协定,1979-11-03,1979-11
农民从农产品提价中得到实惠,1979-11-03,1979-11
舟山地区渔民勤出海夺高产,1979-11-03,1979-11
本月起增加高校中专学生助学金,1979-11-03,1979-11
蔬菜销价稳定在去年同期水平上,1979-11-03,1979-11
青年要选择为人民作贡献的正确途径,1979-11-03,1979-11
抓好职工的技术培训工作,1979-11-03,1979-11
国务院通知严禁年终突击花钱,1979-11-03,1979-11
四平市实行减亏受惠超盈给奖办法,1979-11-03,1979-11
今冬明春检查中央两个农业文件的落实情况,1979-11-03,1979-11
秋季广交会生意兴隆,1979-11-03,1979-11
天津市开设十个农副产品市场,1979-11-03,1979-11
梧州地区农村社队和社员增产黄金,1979-11-03,1979-11
解放军某部学员潘存云交献金刚石,1979-11-03,1979-11
晋级考试怎么考，考什么？,1979-11-03,1979-11
不要再蹈覆辙,1979-11-03,1979-11
提倡养猫,1979-11-03,1979-11
向列车乘务员进一言,1979-11-03,1979-11
上面堵了口，下面才断流,1979-11-03,1979-11
这样的支农“贵客”农民请不起,1979-11-03,1979-11
‘近六千元收入’的报道造成不良后果,1979-11-03,1979-11
发表李生杰同志的来信应该核实,1979-11-03,1979-11
托马斯议长为华总理举行招待会伦敦市为华总理举行宴会和欢迎仪式,1979-11-03,1979-11
为繁荣新时期的文艺事业奋发前进,1979-11-03,1979-11
邓颖超会见美国肿瘤流行病学家李沛博士,1979-11-03,1979-11
依法惩处打砸抢刑事犯罪分子,1979-11-03,1979-11
欢度“古尔邦节”,1979-11-03,1979-11
顾绍雄同志追悼会在京举行,1979-11-03,1979-11
中国足协接受国际足联关于中国代表权决议,1979-11-03,1979-11
英国老维克剧团在上海举行首场演出,1979-11-03,1979-11
法国军医代表团访华结束,1979-11-03,1979-11
外事往来,1979-11-03,1979-11
柏林交响乐团和中央乐团在京联合演出,1979-11-03,1979-11
湖北省同美国俄亥俄州建立友好省州关系,1979-11-03,1979-11
意大利各界人士热情期待华总理访问,1979-11-03,1979-11
他乡遇故知,1979-11-03,1979-11
要求国会迅速批准美中贸易协定,1979-11-03,1979-11
日本各界纪念河上肇诞辰一百周年,1979-11-03,1979-11
美‘柏伽索斯—二号’卫星将坠落,1979-11-03,1979-11
我大使向特立尼达和多巴哥代总统递交国书,1979-11-03,1979-11
越南调集苏联武器准备大举攻柬,1979-11-03,1979-11
中苏谈判举行第三次全体会议,1979-11-03,1979-11
伊朗一宗教领导人被暗杀,1979-11-03,1979-11
国际简讯,1979-11-03,1979-11
意大利共和国,1979-11-03,1979-11
意大利的工业和农业,1979-11-03,1979-11
拉尔德雷洛地热电站,1979-11-03,1979-11
北京地区天气预报,1979-11-03,1979-11
“有朋自远方来”,1979-11-03,1979-11
进步与退步,1979-11-03,1979-11
握手,1979-11-03,1979-11
她也看见了明日的朝霞,1979-11-03,1979-11
圩日二首,1979-11-03,1979-11
能者上来,1979-11-03,1979-11
别具一格的《榕树》丛刊,1979-11-03,1979-11
华总理离伦敦到达意大利访问,1979-11-04,1979-11
做献身四化立志改革的实干家,1979-11-04,1979-11
北京清河毛纺织厂一年发生大变化,1979-11-04,1979-11
华总理在伦敦举行答谢宴会,1979-11-04,1979-11
甘肃重新确定发展农业的规划措施,1979-11-04,1979-11
第四次文代会举行大会发言,1979-11-04,1979-11
搞好产销结合实行以销促产,1979-11-04,1979-11
煤矿安全生产刻不容缓,1979-11-04,1979-11
长计划短安排坚持改造自然,1979-11-04,1979-11
浦下大队妥善解决务农务工矛盾,1979-11-04,1979-11
上海市机电一局开展多种形式的技术服务,1979-11-04,1979-11
放下架子当配角广开门路做生意,1979-11-04,1979-11
为企业增产打开新路,1979-11-04,1979-11
让金华火腿来个大发展,1979-11-04,1979-11
华总理参观牛津大学和舍伍德农庄,1979-11-04,1979-11
华总理在英国的访问富有意义、很有收获,1979-11-04,1979-11
华总理访问意大利日程,1979-11-04,1979-11
姬鹏飞出席墨西哥三重奏团音乐会,1979-11-04,1979-11
为国家分忧解愁,1979-11-04,1979-11
我代表团在联大提出反霸权主义决议草案,1979-11-04,1979-11
法报揭露苏古在非洲的扩张势头咄咄逼人奥报说苏联利用越南作基地推行远东战略,1979-11-04,1979-11
中英关系发展的新篇章,1979-11-04,1979-11
民主柬埔寨代表在联大揭露越南霸权野心,1979-11-04,1979-11
十月份有二十万柬埔寨难民逃入泰国,1979-11-04,1979-11
日本各界集会支持柬埔寨人民反侵略斗争,1979-11-04,1979-11
国际简讯,1979-11-04,1979-11
不承认巴勒斯坦解放组织就不可能解决问题,1979-11-04,1979-11
越来越多美国人主张承认巴勒斯坦民族权利,1979-11-04,1979-11
欧洲古老的城市——罗马,1979-11-04,1979-11
威尼斯广场和无名英雄墓,1979-11-04,1979-11
北京地区天气预报,1979-11-04,1979-11
摄影艺术的春消息,1979-11-04,1979-11
遗香犹自透尘怀,1979-11-04,1979-11
沟通中西文化的先驱者,1979-11-04,1979-11
米兰，璀璨的文化古城,1979-11-04,1979-11
漫话‘菲亚特’,1979-11-04,1979-11
南瓜的妙用,1979-11-04,1979-11
有生命的雷达,1979-11-04,1979-11
《大卫》（局部）,1979-11-04,1979-11
天然温度表,1979-11-04,1979-11
科西加总理欢宴华总理,1979-11-05,1979-11
排除‘左’右干扰确保工作重点转移  批判无政府主义极端个人主义维护安定团结,1979-11-05,1979-11
经中央军委批准解放军将对平时立功和授予荣誉称号人员颁发奖章,1979-11-05,1979-11
脚踏实地前进,1979-11-05,1979-11
为满足市场需要“动脑筋”,1979-11-05,1979-11
解决‘卡脖’问题发展轻纺工业,1979-11-05,1979-11
“小饭桌”解决了大难题,1979-11-05,1979-11
石咀山一矿职工夫妻纷纷团聚,1979-11-05,1979-11
宿州市办起几个女浴池,1979-11-05,1979-11
探亲归来,1979-11-05,1979-11
给养奶牛户落实政策北安镇老人婴儿又喝到鲜奶,1979-11-05,1979-11
黑龙江涤纶厂建成试生产,1979-11-05,1979-11
李伦稳运用光面爆破技术在室内爆破成功,1979-11-05,1979-11
西子湖畔出现一种新业务：一次成像摄影,1979-11-05,1979-11
给一位青年作者的信,1979-11-05,1979-11
塑造站在时代前列的新人形象,1979-11-05,1979-11
工笔重彩画的回顾与瞻望,1979-11-05,1979-11
华总理在罗马向无名英雄墓献花圈,1979-11-05,1979-11
掌握无产阶级世界观，运用文艺武器为四化服务,1979-11-05,1979-11
泰王国国会代表团访问广州后回国,1979-11-05,1979-11
姬鹏飞会见朝中社代表团,1979-11-05,1979-11
谷牧会见日本兴业银行代表团,1979-11-05,1979-11
文艺界各协会、研究会、学会分别举行会员代表大会,1979-11-05,1979-11
谷牧会见法国经济学教授,1979-11-05,1979-11
康世恩会见美国煤炭协会代表团,1979-11-05,1979-11
康世恩会见美国北卡罗来纳州烟草代表团,1979-11-05,1979-11
康克清会见泰国警察夫人协会代表团,1979-11-05,1979-11
柏林交响乐团结束对我国访问后离京,1979-11-05,1979-11
上海—香港间集装箱运输定期班轮正式通航,1979-11-05,1979-11
保障党员申诉权利健全党内民主生活,1979-11-05,1979-11
莫斯科为什么这样神经衰弱？,1979-11-05,1979-11
西欧从全球战略出发加强对华关系,1979-11-05,1979-11
战略岛屿国际会议指出苏联威胁日益严重,1979-11-05,1979-11
苏联一支舰队将到越南海防活动,1979-11-05,1979-11
何英结束对埃及的访问,1979-11-05,1979-11
河内敲诈救济柬埔寨的物资,1979-11-05,1979-11
美‘柏伽索斯——二号’在大西洋坠毁,1979-11-05,1979-11
吴数德获世界举重赛一项冠军,1979-11-05,1979-11
伊朗学生占领美国大使馆,1979-11-05,1979-11
我代表团出席国际海洋卫星组织首次大会,1979-11-05,1979-11
友好往来,1979-11-05,1979-11
国际简讯,1979-11-05,1979-11
动荡的日本政局,1979-11-05,1979-11
百岛之城威尼斯,1979-11-05,1979-11
圣马可广场,1979-11-05,1979-11
林木茂密的锦绣江山,1979-11-05,1979-11
给农业插上翅膀,1979-11-05,1979-11
另开油路,1979-11-05,1979-11
日本农民的家庭副业——养鸡,1979-11-05,1979-11
北京地区天气通报,1979-11-05,1979-11
钢铁生产为农业轻工业服务,1979-11-06,1979-11
意大利总统宴请华总理,1979-11-06,1979-11
为什么农民没有得到应得的实惠？,1979-11-06,1979-11
选拔有真才实学的干部担任厂领导,1979-11-06,1979-11
增强政策观念维护政策稳定,1979-11-06,1979-11
辽河化肥厂正式投产,1979-11-06,1979-11
商品粮基地也不能单打一抓粮,1979-11-06,1979-11
续‘待兴的事业’,1979-11-06,1979-11
还要继续落实生产队自主权,1979-11-06,1979-11
修路尽量少占农田,1979-11-06,1979-11
张榜承认错订物价如数退回多收货款,1979-11-06,1979-11
拉萨八角街居民第一次用自来水,1979-11-06,1979-11
北京建成一条易燃蜂窝煤生产线,1979-11-06,1979-11
简讯,1979-11-06,1979-11
锦县供销部门在农村办夜市把买卖做到社员家门口,1979-11-06,1979-11
“离于众庶，则无英雄”,1979-11-06,1979-11
量刑中的从轻、减轻、免除处罚,1979-11-06,1979-11
“刑不上大夫”解,1979-11-06,1979-11
《民主与法制》第三期出版,1979-11-06,1979-11
要正确使用免予起诉,1979-11-06,1979-11
华总理到达威尼斯参观访问意不管部长萨蒂在威尼斯宴请华总理,1979-11-06,1979-11
圣马力诺国家元首接见黄华外长,1979-11-06,1979-11
菲亚特公司为余秋里副总理举行宴会,1979-11-06,1979-11
聂荣臻会见加拿大驻京记者,1979-11-06,1979-11
谷牧会见西德广播协会访华团,1979-11-06,1979-11
姬鹏飞会见并宴请朝鲜劳动党平安北道代表团,1979-11-06,1979-11
不要以为这是小事,1979-11-06,1979-11
文化部欢宴英国老维克剧团,1979-11-06,1979-11
简讯,1979-11-06,1979-11
草粮轮作大有可为,1979-11-06,1979-11
‘对马可·波罗的回访’,1979-11-06,1979-11
制止越南在老、柬的化学战争,1979-11-06,1979-11
心里有数,1979-11-06,1979-11
救谁？,1979-11-06,1979-11
越老军队用苏联毒气残杀人民,1979-11-06,1979-11
沙德利总统接见我特使,1979-11-06,1979-11
也门总理接见何英,1979-11-06,1979-11
东京都热烈欢迎北京市友好代表团,1979-11-06,1979-11
泰国如遭进攻，印尼将不得不在国外作战,1979-11-06,1979-11
武元甲疯狂攻击东盟和中国,1979-11-06,1979-11
不丹国王表示反对越南侵柬,1979-11-06,1979-11
陈伟强破五十六公斤级挺举世界纪录,1979-11-06,1979-11
圣马力诺共和国,1979-11-06,1979-11
都灵市,1979-11-06,1979-11
美国科学家又发现一个木卫星,1979-11-06,1979-11
加拿大从油沙中提炼石油,1979-11-06,1979-11
菲律宾采用治疗血吸虫病新药,1979-11-06,1979-11
日本试验成功搅拌混凝土新方法,1979-11-06,1979-11
球痞,1979-11-06,1979-11
澳建成世界第一个太阳能微波电话系统,1979-11-06,1979-11
在国际关系中铲除强权政治和干涉政策,1979-11-06,1979-11
西德外长强调采取必要行动对付苏联威胁,1979-11-06,1979-11
美政界人士要求政府增加军费,1979-11-06,1979-11
玻利维亚政变后政局动荡,1979-11-06,1979-11
美国七万多农机制造工人罢工,1979-11-06,1979-11
布热津斯基访问阿尔及利亚,1979-11-06,1979-11
伊朗外交部就伊美关系发表声明,1979-11-06,1979-11
频繁的政变,1979-11-06,1979-11
国际简讯,1979-11-06,1979-11
莫斯科的酒宴,1979-11-06,1979-11
北京地区天气预报,1979-11-06,1979-11
华总理结束四国之行离罗马回国,1979-11-07,1979-11
国务院要求各地大张旗鼓检查市场物价,1979-11-07,1979-11
访问西欧四国取得圆满成功,1979-11-07,1979-11
采取措施保护消费者的利益,1979-11-07,1979-11
不能因经营管理不当增加人民负担,1979-11-07,1979-11
物价检查不要走过场,1979-11-07,1979-11
做安定团结的促进派,1979-11-07,1979-11
改造老设备投资少见效快,1979-11-07,1979-11
天津的‘金杯牌’手缝五号足球被国际足联批准为国际比赛用球,1979-11-07,1979-11
革新技术改革体制发挥设备潜力,1979-11-07,1979-11
要重视和发挥民间运输的作用,1979-11-07,1979-11
许昌市粮食部门开展直线运输,1979-11-07,1979-11
一根金线的启示从传统手工艺品,1979-11-07,1979-11
万鸭齐鸣渔家欢,1979-11-07,1979-11
广西繁育出奶肉兼用杂交水牛,1979-11-07,1979-11
内蒙古养双峰骆驼三十八万多峰,1979-11-07,1979-11
为什么对社队企业那样歧视？,1979-11-07,1979-11
以科学态度对待农业基本建设,1979-11-07,1979-11
要向工农子女看齐,1979-11-07,1979-11
一个预备党员的建议,1979-11-07,1979-11
不要官帽要草帽,1979-11-07,1979-11
坚持原则维护党规党法,1979-11-07,1979-11
党员都应维护党规党法,1979-11-07,1979-11
华总理同科西加总理继续举行会谈,1979-11-07,1979-11
华总理会见圣马力诺外长雷菲,1979-11-07,1979-11
罗乔治·埃乃斯库国家乐团举行首场演出,1979-11-07,1979-11
华总理会见意政府部长和经济界人士,1979-11-07,1979-11
华总理在罗马接见华侨代表,1979-11-07,1979-11
华总理会见联合国粮农组织总干事,1979-11-07,1979-11
邓副总理会见日本朋友千宗室一行,1979-11-07,1979-11
王震会见小林宏治会长等日本朋友,1979-11-07,1979-11
南京市和美国圣路易斯市结为友好城市,1979-11-07,1979-11
第二届亚洲手球锦标赛在南京开幕,1979-11-07,1979-11
北京市高级人民法院终审裁定驳回魏京生的上诉维持原判,1979-11-07,1979-11
倪志福会见日全国金属工会访华团,1979-11-07,1979-11
庆祝伟大十月社会主义革命六十二周年,1979-11-07,1979-11
简讯,1979-11-07,1979-11
大平正芳当选为日本新首相,1979-11-07,1979-11
大平首相将按预定计划在下月访华,1979-11-07,1979-11
风波重重的日本首相选举,1979-11-07,1979-11
大平正芳,1979-11-07,1979-11
民主柬埔寨要求在联合国部队监督下迫使越南撤军,1979-11-07,1979-11
伊朗学生占领美英使领馆霍梅尼表示支持,1979-11-07,1979-11
要挟西方不要在西欧生产和部署中程核武器,1979-11-07,1979-11
越南武装人员打死打伤我边防军民四人,1979-11-07,1979-11
联合国举行认捐会紧急救济柬人民,1979-11-07,1979-11
伊朗巴扎尔甘内阁辞职,1979-11-07,1979-11
交响乐·友谊·美的享受,1979-11-07,1979-11
北京地区天气预报,1979-11-07,1979-11
肥沃地里的野草〔小说〕,1979-11-07,1979-11
伟大的国际主义战士白求恩,1979-11-07,1979-11
《丝路花雨》别开生面,1979-11-07,1979-11
华总理回到乌鲁木齐,1979-11-08,1979-11
曾北危写出一批著作和论文,1979-11-08,1979-11
刘利萍刻苦钻研成为装配能手,1979-11-08,1979-11
归侨徐来自得到尊重和表扬,1979-11-08,1979-11
加快发展农区畜牧业和草食牲畜,1979-11-08,1979-11
开化县造林面积大管林经验好,1979-11-08,1979-11
从技术经济方面探讨建设的经验教训,1979-11-08,1979-11
‘可以，可以，也可以’,1979-11-08,1979-11
定额记分也不错,1979-11-08,1979-11
注意发挥集体所有制的优越性,1979-11-08,1979-11
从实际出发搞责任制,1979-11-08,1979-11
盛开的四川工艺之花,1979-11-08,1979-11
上海第一冷冻机厂部分产品自销,1979-11-08,1979-11
拉萨兴办集体企业,1979-11-08,1979-11
陶瓷艺术园中一枝新秀,1979-11-08,1979-11
出口美国的中国庭园已启运,1979-11-08,1979-11
中国金鱼在国际市场受欢迎,1979-11-08,1979-11
豫东沙区花生成倍增加,1979-11-08,1979-11
从吕梁山区建设谈农业指导思想,1979-11-08,1979-11
党委重视措施有力扫盲不难,1979-11-08,1979-11
研究所办试验工厂好,1979-11-08,1979-11
应该重视基层中医工作,1979-11-08,1979-11
农村医院应实行轮流值班制,1979-11-08,1979-11
谈谈青少年吸烟的害处,1979-11-08,1979-11
解放军全面开展年终检查考核工作,1979-11-08,1979-11
要为选拔少数民族干部开门,1979-11-08,1979-11
科学出版社出版学术刊物五十多种,1979-11-08,1979-11
中国翻译出版服务公司在北京成立,1979-11-08,1979-11
《各国手册丛书》第一辑《日本》出版,1979-11-08,1979-11
《关山月画集》在广州出版,1979-11-08,1979-11
英国老维克剧团在京演出《哈姆莱特》,1979-11-08,1979-11
邓颖超会见日本大分市友好访华团,1979-11-08,1979-11
韦国清会见西德退役少将比德尔曼夫妇,1979-11-08,1979-11
方毅会见美国著名发育生物学家埃伯特教授,1979-11-08,1979-11
方毅会见七个国家的科学家,1979-11-08,1979-11
康世恩会见美国朋友,1979-11-08,1979-11
庆祝伟大十月社会主义革命六十二周年,1979-11-08,1979-11
孙敬文部长宴请英国化学工业代表团,1979-11-08,1979-11
人民的最终裁决,1979-11-08,1979-11
国际舆论高度评价华总理西欧之行,1979-11-08,1979-11
霜叶红于二月花,1979-11-08,1979-11
江萨总理说泰中友谊日益加强,1979-11-08,1979-11
黄华外长到南斯拉夫访问,1979-11-08,1979-11
雷迪总统接见我驻印度大使,1979-11-08,1979-11
孔切主席视察我援建的太拉水库工程,1979-11-08,1979-11
萨利赫总统接见何英副外长,1979-11-08,1979-11
美国青年卡玛罢宴,1979-11-08,1979-11
友好往来,1979-11-08,1979-11
日本出版发行我国地图集,1979-11-08,1979-11
火星并非一片干旱荒漠,1979-11-08,1979-11
二十五国向联大提出关于柬埔寨局势决议草案,1979-11-08,1979-11
联合国同意向泰柬边界派出调查组,1979-11-08,1979-11
苏联在古巴海军基地建新码头,1979-11-08,1979-11
在联合国救济柬人民会议上展开激烈斗争,1979-11-08,1979-11
民柬电台谴责越伪阻挠国际救济,1979-11-08,1979-11
玻政变首脑同议长会晤无结果,1979-11-08,1979-11
萨新政府和反政府组织达成协议,1979-11-08,1979-11
美国三里岛核电厂何以发生事故,1979-11-08,1979-11
苏联要求增捕鲸鱼遭拒绝,1979-11-08,1979-11
苏联同阿富汗新政权之间出现分歧,1979-11-08,1979-11
核战争不能毁灭世界,1979-11-08,1979-11
国际简讯,1979-11-08,1979-11
北京地区天气预报,1979-11-08,1979-11
维护群众切身利益组织职工参加四化建设,1979-11-09,1979-11
改进经营管理降低食品成本,1979-11-09,1979-11
杭州大众食品销价不提或少提,1979-11-09,1979-11
精打细算执行价格政策,1979-11-09,1979-11
编后,1979-11-09,1979-11
深入群众之中做好群众工作,1979-11-09,1979-11
“要拿我当一挺机关枪使用”,1979-11-09,1979-11
屏南县两年改变了低产面貌,1979-11-09,1979-11
北京环境污染使各国专家吃惊,1979-11-09,1979-11
解决噪声危害保障人民健康,1979-11-09,1979-11
下决心控制噪声,1979-11-09,1979-11
云南把部分宜林荒山划给社员造林,1979-11-09,1979-11
一张营业证解决了十三口人生活,1979-11-09,1979-11
吕志良三下三上的故事,1979-11-09,1979-11
湖南千余名干部下乡下厂做经济调查,1979-11-09,1979-11
委托代办事业大有可为,1979-11-09,1979-11
集中和分散,1979-11-09,1979-11
要研究社会主义基本经济规律,1979-11-09,1979-11
“不负刑事责任”与“免予刑事处分”,1979-11-09,1979-11
