福建举行鲁迅诞生一百周年纪念会,1981-09-21,1981-09
凤县灾区来信  党领导我们抗灾自救,1981-09-21,1981-09
上海祭扫辛亥革命先烈邹容墓,1981-09-21,1981-09
刘焕统提升为空军某军副参谋长,1981-09-21,1981-09
谷牧会见日本经济专家向坂正男一行,1981-09-21,1981-09
刘维明欢宴日本青年访华团,1981-09-21,1981-09
林林会见法国朋友,1981-09-21,1981-09
印度环境保护代表团离京赴外地参观访问,1981-09-21,1981-09
延安整风为全国革命胜利奠定了思想基础,1981-09-21,1981-09
党的领导与人民民主,1981-09-21,1981-09
水资源的合理利用问题,1981-09-21,1981-09
《国力论》评介,1981-09-21,1981-09
全国首次日本哲学讨论会召开,1981-09-21,1981-09
全国党校第二届哲学年会召开,1981-09-21,1981-09
发展中国家去年经济增长较快达４．６％,1981-09-21,1981-09
苏联再次粗暴干涉波兰内政,1981-09-21,1981-09
和平与正义力量的共同胜利,1981-09-21,1981-09
美国二十多万劳动者举行“团结日”大示威,1981-09-21,1981-09
西方舆论指责苏联对波威胁升级,1981-09-21,1981-09
阿游击队连续在各地打击苏军和政府军,1981-09-21,1981-09
英工党领袖从莫斯科带回什么信息？,1981-09-21,1981-09
我贸易代表团访问新西兰,1981-09-21,1981-09
我男排在中日友谊赛中两战两捷,1981-09-21,1981-09
马达加斯加举办中国剪纸艺术展览会,1981-09-21,1981-09
马尼拉七千学生举行示威,1981-09-21,1981-09
坚定阵线首脑会议要加强同苏关系,1981-09-21,1981-09
零点行动,1981-09-21,1981-09
汉方药在日本受欢迎,1981-09-21,1981-09
英·甘地说印度将继续进行核试验,1981-09-21,1981-09
沙维斯将临时担任巴西总统,1981-09-21,1981-09
阿拉伯卫生部长理事会开会,1981-09-21,1981-09
英国自由党召开年会,1981-09-21,1981-09
北约在南欧地区举行演习,1981-09-21,1981-09
日本职工去年实际收入下降,1981-09-21,1981-09
肯尼亚货币贬值百分之十五,1981-09-21,1981-09
南也门阿比安三角洲遭水灾,1981-09-21,1981-09
伊朗一次就处决八十四名持不同政见者,1981-09-21,1981-09
孙中山先生四访纽约,1981-09-21,1981-09
阿尔及尔国际博览会巡礼,1981-09-21,1981-09
非洲的石油,1981-09-21,1981-09
美国钢都匹茨堡,1981-09-21,1981-09
万福寺,1981-09-21,1981-09
影片《马可·波罗》在拍摄中,1981-09-21,1981-09
对鲁迅的最好的纪念（祝新版《鲁迅全集》的出版）,1981-09-21,1981-09
祝贺和感谢（祝新版《鲁迅全集》的出版）,1981-09-21,1981-09
学学孩子（祝新版《鲁迅全集》的出版）,1981-09-21,1981-09
小谈《鲁迅全集》的注释（祝新版《鲁迅全集》的出版）,1981-09-21,1981-09
路灯,1981-09-21,1981-09
作群众的“知音”,1981-09-21,1981-09
花手帕,1981-09-21,1981-09
黄山石笋峰,1981-09-21,1981-09
论鲁迅,1981-09-22,1981-09
我南海和南黄海石油蕴藏量相当丰富,1981-09-22,1981-09
健全县市州党代表大会制度,1981-09-22,1981-09
天津五万多人突击搞环境卫生,1981-09-22,1981-09
上海冶金局实行全行业增利定比留成,1981-09-22,1981-09
乌鲁木齐到内地铁路交通恢复,1981-09-22,1981-09
四川气象部门２８个单位获奖,1981-09-22,1981-09
苏联要求南非归还俘获的专家,1981-09-22,1981-09
吉林化工公司化肥厂超额完成年利润计划,1981-09-22,1981-09
力争灾年实现增产四川轻工系统搞竞赛,1981-09-22,1981-09
平邑县资助优抚对象盖房四千五百多间,1981-09-22,1981-09
广西可开发水力资源有一千六百多万千瓦,1981-09-22,1981-09
河南发现碳铬矿,1981-09-22,1981-09
宝钢一期工程继续进,1981-09-22,1981-09
不能发给下边一个责任制,1981-09-22,1981-09
我该怎样回答社员呢？,1981-09-22,1981-09
可别再搞“一刀切”了！,1981-09-22,1981-09
不要搞新的“一刀切”,1981-09-22,1981-09
从四川洪水灾害中吸取有益的教训,1981-09-22,1981-09
动员千家万户搞好“小秋收”,1981-09-22,1981-09
三十埠公社农业技术问事处办得好,1981-09-22,1981-09
长安县用多种办法推广科学技术,1981-09-22,1981-09
启东县发放售棉卡和售棉证,1981-09-22,1981-09
广西饲养母猪增多,1981-09-22,1981-09
内蒙古绵羊毛增收,1981-09-22,1981-09
驱害兽保庄稼的“神狗”,1981-09-22,1981-09
哈密瓜之乡举行赛瓜会,1981-09-22,1981-09
农民坐飞机俯瞰沈阳城,1981-09-22,1981-09
科普之窗,1981-09-22,1981-09
对优秀知识分子要敢于委以重任,1981-09-22,1981-09
参加国家决策和科学管理,1981-09-22,1981-09
选拔优秀教师担任领导职务,1981-09-22,1981-09
首批九十二名毕业生对口录用,1981-09-22,1981-09
为科研成果转让牵线搭桥,1981-09-22,1981-09
地质部第九实验室研究出选冶联合工艺,1981-09-22,1981-09
北师大要求学生做到“仪表美”,1981-09-22,1981-09
到重点饲养奶牛地区传授技术,1981-09-22,1981-09
核垃圾何处葬身,1981-09-22,1981-09
引导文艺工作者自己教育自己,1981-09-22,1981-09
好经为什么念歪了？,1981-09-22,1981-09
民进举行纪念鲁迅百年诞辰报告会,1981-09-22,1981-09
萨巴—莱柯举行答谢宴会,1981-09-22,1981-09
北京杂技团出访阿拉伯也门共和国等三国,1981-09-22,1981-09
万里会见泰国客人,1981-09-22,1981-09
中国社会科学院研究生院首届研究生毕业,1981-09-22,1981-09
《鲁迅研究年刊》１９８１年号将出版,1981-09-22,1981-09
姬鹏飞会见泰国文化代表团,1981-09-22,1981-09
迪亚议长同焦若愚进行友好会见,1981-09-22,1981-09
薛勤未批评陈蕃,1981-09-22,1981-09
薄一波会见美国客人,1981-09-22,1981-09
廖承志会见日本前外相小坂善太郎,1981-09-22,1981-09
美国医学会杂志中文版将在中国出版,1981-09-22,1981-09
中国队对新西兰队足球２４日比赛,1981-09-22,1981-09
西部洪涝、东部干旱原因何在？,1981-09-22,1981-09
“党是俺的亲娘”,1981-09-22,1981-09
邹容、“苏报案”及《革命军》,1981-09-22,1981-09
访辛亥老人、著名书法家孙墨佛（纪念辛亥革命７０周年）,1981-09-22,1981-09
辛亥革命前革命派和改良派的论战（纪念辛亥革命７０周年）,1981-09-22,1981-09
西方通讯社评中国发射卫星的重大成就,1981-09-22,1981-09
肮脏的间谍活动,1981-09-22,1981-09
阿游击队攻进坎大哈同政府军激烈巷战,1981-09-22,1981-09
巴基斯坦取消巴航的喀布尔航班,1981-09-22,1981-09
伯利兹欢庆独立,1981-09-22,1981-09
波兰问题只能通过各方协议自主和平解决,1981-09-22,1981-09
越南《人民报》骂街,1981-09-22,1981-09
菲报提醒人们警惕苏联特务活动,1981-09-22,1981-09
民柬部队在贡布等地破坏越军交通线,1981-09-22,1981-09
波兰部长会议举行紧急会议研究国内问题,1981-09-22,1981-09
古巴和柬伪签署合作协定,1981-09-22,1981-09
上沃尔特元首访问贝宁,1981-09-22,1981-09
科威特埃米尔访南,1981-09-22,1981-09
摩美将合开摩近海石油,1981-09-22,1981-09
扎卢加强边境安全,1981-09-22,1981-09
黑格强调要从实力地位出发同苏谈判,1981-09-22,1981-09
萨尔瓦多执委会主席希望多党对话,1981-09-22,1981-09
加美发生一场控制和反控制的争吵,1981-09-22,1981-09
打了一年的两伊战争,1981-09-22,1981-09
卢旺达经济持续发展,1981-09-22,1981-09
访瑞士老年人病院,1981-09-22,1981-09
捷克斯洛伐克的啤酒花种植业,1981-09-22,1981-09
加拿大建成奇趣乐园,1981-09-22,1981-09
大批鲸集体自杀,1981-09-22,1981-09
西德的老年大学生,1981-09-22,1981-09
飞机乘客的电话设施,1981-09-22,1981-09
新型电子体温表,1981-09-22,1981-09
安全雨伞,1981-09-22,1981-09
防鲨鱼电缆,1981-09-22,1981-09
一座新的文化宫殿,1981-09-22,1981-09
历史的丰碑,1981-09-22,1981-09
五四时期鲁迅批改的几首诗,1981-09-22,1981-09
栏杆,1981-09-22,1981-09
陈毅在大江南北,1981-09-22,1981-09
《农民文学》创刊,1981-09-22,1981-09
惯于长夜过春时〔木刻〕,1981-09-22,1981-09
实行经济责任制  注意解决新问题（社论）,1981-09-23,1981-09
鲁迅诞生一百周年纪念委员会举行全会,1981-09-23,1981-09
全国青年绿化祖国突击手（队）表彰大会在京举行,1981-09-23,1981-09
加快扭转我国林业落后状况是战略任务,1981-09-23,1981-09
邓小平会见迪亚议长率领的代表团,1981-09-23,1981-09
新疆用少数民族文字出版鲁迅作品,1981-09-23,1981-09
天津市４４名归国华侨入党,1981-09-23,1981-09
广州第一个个体户和集体户团支部成立,1981-09-23,1981-09
西藏建设地热试验电站,1981-09-23,1981-09
从部长到区队长都要跟班参加体力劳动,1981-09-23,1981-09
深入检查  一抓到底,1981-09-23,1981-09
四化建设中的模范共产党员,1981-09-23,1981-09
这里缺乏社会主义协作,1981-09-23,1981-09
地质勘探要统一管理,1981-09-23,1981-09
有效地提高了基建投资效果,1981-09-23,1981-09
给十个工业局正副局长发奖,1981-09-23,1981-09
听天都峰上叫卖声,1981-09-23,1981-09
全国新号型服装在京展销,1981-09-23,1981-09
年富力强懂业务的干部到第一线  年老业务差的同志退居二线当参谋,1981-09-23,1981-09
辽阳精密仪表厂生产的洗衣机定时器寿命延长,1981-09-23,1981-09
“我们选举的厂长选对了！”,1981-09-23,1981-09
全国第三届黑白电视机质量评比揭晓（工商短波）,1981-09-23,1981-09
郑州北站新建上行出发场交付使用（工商短波）,1981-09-23,1981-09
齐鲁石化总公司一项节能技术改造成功（工商短波）,1981-09-23,1981-09
大型链板式自动茶叶烘干机测定合格（工商短波）,1981-09-23,1981-09
北京向阳二所将改名宣武门饭店（工商短波）,1981-09-23,1981-09
山西矿院干部张涛被劳教两年,1981-09-23,1981-09
“为正党风  我不怕得罪人”（在纪检战线上）,1981-09-23,1981-09
煤炭部党组纪检组拟定几项规定,1981-09-23,1981-09
经理孙晋和查清一起骗取奖金事件,1981-09-23,1981-09
银鹰飞架“爱民桥”,1981-09-23,1981-09
一个被从宽释放人的一封信,1981-09-23,1981-09
某团参谋长党玉秀带头抢救落水者,1981-09-23,1981-09
《对这种“捞一把”的人该怎么办？》,1981-09-23,1981-09
来函照登,1981-09-23,1981-09
动员群众  搞好卫生  迎接国庆,1981-09-23,1981-09
青海玛多县分配水平全国最高,1981-09-23,1981-09
１９８０年全国好新闻评选揭晓,1981-09-23,1981-09
纪念鲁迅诞生一百周年,1981-09-23,1981-09
港澳各界正积极筹备纪念辛亥革命七十周年,1981-09-23,1981-09
中国足球队和新西兰足球队名单,1981-09-23,1981-09
《孙中山伦敦蒙难记》即将公演,1981-09-23,1981-09
迪亚议长一行离京赴外地访问,1981-09-23,1981-09
利比里亚新任驻华大使向谭震林递交国书,1981-09-23,1981-09
班禅额尔德尼·却吉坚赞会见多哥客人,1981-09-23,1981-09
谷牧会见西德专利代表团,1981-09-23,1981-09
黄华会见新加坡首任驻华商务代表陈松川,1981-09-23,1981-09
中国西德铁路合作协议在京签字,1981-09-23,1981-09
黄华会见即将离任的阿曼驻华大使,1981-09-23,1981-09
黄华会见即将离任的智利驻华大使,1981-09-23,1981-09
黄华会见日本青年访华团,1981-09-23,1981-09
泰国教育部长举行答谢宴会,1981-09-23,1981-09
把鲁迅先生的战迹献给日本人民（评价鲁迅的四篇重要佚文）,1981-09-23,1981-09
鲁迅的伟大（评价鲁迅的四篇重要佚文）,1981-09-23,1981-09
新发现的评价鲁迅的四篇重要佚文（评价鲁迅的四篇重要佚文）,1981-09-23,1981-09
精神的食粮（评价鲁迅的四篇重要佚文）,1981-09-23,1981-09
鲁迅先生的精神（评价鲁迅的四篇重要佚文）,1981-09-23,1981-09
关于新版《鲁迅全集》的注释工作,1981-09-23,1981-09
写在新编《鲁迅全集》出版的时候,1981-09-23,1981-09
伯利兹正式宣告独立,1981-09-23,1981-09
一些代表对当前国际紧张局势表示严重关切,1981-09-23,1981-09
日意报纸谈中国一次发射三颗卫星的意义,1981-09-23,1981-09
谴责外国干涉第三世界国家的事务,1981-09-23,1981-09
柬三方有可能在许多问题上求得共同立场,1981-09-23,1981-09
埃以美即将恢复巴勒斯坦自治谈判,1981-09-23,1981-09
黑格在联大表示将对国际经济发展采取合作态度,1981-09-23,1981-09
章文晋在纽约会见联合国秘书长等,1981-09-23,1981-09
朝鲜机械化养鸡养猪发展迅速,1981-09-23,1981-09
卡拉汉说单方面核裁军不能增强英国的安全,1981-09-23,1981-09
比利时伊斯更斯内阁辞职,1981-09-23,1981-09
中澳签署经济合作议定书,1981-09-23,1981-09
西德总理谴责反美暴力行动,1981-09-23,1981-09
成都杂技团在坦桑尼亚首场演出,1981-09-23,1981-09
日本著名戏剧家河原崎长十郎逝世,1981-09-23,1981-09
美国因苏使用化学武器将审查有关公约,1981-09-23,1981-09
日本记者眼中的胡志明市,1981-09-23,1981-09
希腊外长说希不能退出北约,1981-09-23,1981-09
澳美新将举行联合军事演习,1981-09-23,1981-09
西班牙又发生食物中毒事件,1981-09-23,1981-09
葡萄牙农业今年大幅度减产,1981-09-23,1981-09
本届联大的主要议题,1981-09-23,1981-09
访箴津合作农场,1981-09-23,1981-09
达卡——孟加拉国的骄傲,1981-09-23,1981-09
美国各方在恢复金本位制上开展争论,1981-09-23,1981-09
中国新西兰足球队实力浅析,1981-09-23,1981-09
广州“四·一五”我所见到的鲁迅,1981-09-23,1981-09
祝贺新版《鲁迅全集》出版,1981-09-23,1981-09
要对得起鲁迅对拼音文字的支持,1981-09-23,1981-09
鲁迅先生对于科普事业的贡献,1981-09-23,1981-09
鲁迅〔雕塑〕,1981-09-23,1981-09
振作精神  争挑重担  多产煤炭,1981-09-24,1981-09
我国早稻征购任务超额完成,1981-09-24,1981-09
北京市领导干部检查吃喝歪风,1981-09-24,1981-09
宝钢一期工程在调整中继续建设,1981-09-24,1981-09
欢迎来京参加鲁迅纪念活动的外宾,1981-09-24,1981-09
中南二轻产品看样订货会成交多,1981-09-24,1981-09
广州出现一批商品维修服务中心,1981-09-24,1981-09
准北改变离开红薯不能活状况,1981-09-24,1981-09
庆祝张孝骞教授从事医学工作六十年,1981-09-24,1981-09
多哥总统纳辛贝·埃亚德马,1981-09-24,1981-09
邓小平会见小坂善太郎,1981-09-24,1981-09
“科普一条街”好！（今日谈）,1981-09-24,1981-09
新闻照片不应该摆布（今日谈）,1981-09-24,1981-09
保护现有森林  加快发展林业,1981-09-24,1981-09
企业利润增加  经济效果显著,1981-09-24,1981-09
北京郊区东坝公社支持穷队搞多种经营,1981-09-24,1981-09
“华西秋雨”与黄河水患,1981-09-24,1981-09
扶助穷队致富的好办法,1981-09-24,1981-09
遥寄千元表深情,1981-09-24,1981-09
西双版纳首次发现风流草,1981-09-24,1981-09
金沙江发现白鲟产卵场,1981-09-24,1981-09
云南发现稀有树种三棱栎,1981-09-24,1981-09
县委书记走访貂场,1981-09-24,1981-09
文娱生活活跃  生产干劲更大,1981-09-24,1981-09
不出门也知天下事,1981-09-24,1981-09
我们要看报,1981-09-24,1981-09
坚持医学临床实践６０年,1981-09-24,1981-09
蓝口公社加强计划生育政治思想工作的调查,1981-09-24,1981-09
蒲圻“小茶园”促进了农村教育的普及,1981-09-24,1981-09
坚决服从组织分配，到祖国最需要的地方去,1981-09-24,1981-09
夸夸戴红五星的校外“园丁”,1981-09-24,1981-09
快把课本发下来,1981-09-24,1981-09
应该重视教科书的印刷工作,1981-09-24,1981-09
现实生活中的长寿之路,1981-09-24,1981-09
开展批评  纠正缺点  拍摄更多好影片,1981-09-24,1981-09
北方曲艺优秀节目观摩演出在津开幕,1981-09-24,1981-09
心胸外科学术讨论会在京举行,1981-09-24,1981-09
瑞典国王和王后离上海回国,1981-09-24,1981-09
彭冲会见并宴请意共领导机构成员,1981-09-24,1981-09
方毅会见西德交通部长豪夫,1981-09-24,1981-09
谷牧会见西班牙客人,1981-09-24,1981-09
鲍亚季耶夫上校举行招待会,1981-09-24,1981-09
参加国际货币基金组织和世界银行理事会年会,1981-09-24,1981-09
中国空间技术的新成就,1981-09-24,1981-09
伦敦三重奏小组在京演出,1981-09-24,1981-09
中意经济合作第一次混合委员会会议开幕,1981-09-24,1981-09
“架桥铺路”密切党群关系,1981-09-24,1981-09
一条得民心的规定,1981-09-24,1981-09
请示报告七天不复有权自决,1981-09-24,1981-09
县以下工业调整的两点想法,1981-09-24,1981-09
翻印文件何其多,1981-09-24,1981-09
水泥遭雨淋  至今无人理,1981-09-24,1981-09
“隔山买牛”的订书制度应改进,1981-09-24,1981-09
伟大的先驱者——孙中山（纪念辛亥革命７０周年）,1981-09-24,1981-09
孙中山先生二三事,1981-09-24,1981-09
黄兴,1981-09-24,1981-09
萍浏醴起义,1981-09-24,1981-09
阿游击队在加兹尼省等地打击敌军,1981-09-24,1981-09
支持建立国际经济新秩序  要求苏越从阿柬撤军,1981-09-24,1981-09
柬三方特委会第三次开会,1981-09-24,1981-09
泰国武装部队最高领导层改组,1981-09-24,1981-09
几内亚比绍拒绝向苏联提供海军基地,1981-09-24,1981-09
安哥拉收复被南非侵占的三个城镇,1981-09-24,1981-09
波党政领导人谈国内局势,1981-09-24,1981-09
伯利兹国务部长会见我政府代表,1981-09-24,1981-09
金永南同志会见《人民日报》代表团,1981-09-24,1981-09
无核区的神话,1981-09-24,1981-09
波兰总理接见苏部长会议副主席,1981-09-24,1981-09
波兰总理接见华约参谋长,1981-09-24,1981-09
关于苏美外长会晤,1981-09-24,1981-09
里根致信勃列日涅夫,1981-09-24,1981-09
禁止或限制使用滥杀滥伤武器公约,1981-09-24,1981-09
北也门奉行积极中立外交政策,1981-09-24,1981-09
鲁迅著作在法国,1981-09-24,1981-09
美丽的湖滨城市——布琼布拉,1981-09-24,1981-09
世界举重锦标赛在法国闭幕,1981-09-24,1981-09
世界自由式摔跤锦标赛结束,1981-09-24,1981-09
日本获世界男子手球赛决赛权,1981-09-24,1981-09
从生物获得能源,1981-09-24,1981-09
日本出版有关中国三部书,1981-09-24,1981-09
《苏联军事力量的战略、战术和武器情况百科全书》,1981-09-24,1981-09
《踏上龙的国土》,1981-09-24,1981-09
《世界海洋地图》,1981-09-24,1981-09
台莱曼的三部作品首次发表,1981-09-24,1981-09
鲁迅回忆片断,1981-09-24,1981-09
鲁迅在中国大学的讲演,1981-09-24,1981-09
民族魂  （外一首）,1981-09-24,1981-09
打开儿童世界之窗,1981-09-24,1981-09
鲁迅与瞿秋白〔油画〕,1981-09-24,1981-09
鲁迅精神永在,1981-09-25,1981-09
在延安文艺座谈会上的讲话,1981-09-25,1981-09
近海发现六个大型含油气盆地,1981-09-25,1981-09
浙江出版一批鲁迅研究的书籍,1981-09-25,1981-09
鲁迅故居摄影展览在沪开幕,1981-09-25,1981-09
天津建立鲁迅文艺奖励基金,1981-09-25,1981-09
上海党政领导和文艺界人士在鲁迅墓地举行扫墓仪式,1981-09-25,1981-09
保护联户和独户办农机的积极性,1981-09-25,1981-09
中、新两队○比○踢平,1981-09-25,1981-09
阿游击队已控制坎大哈几乎所有地区,1981-09-25,1981-09
加强思想政治工作端正施工作风,1981-09-25,1981-09
企业应有开除权,1981-09-25,1981-09
将一贯违反纪律长期旷工人员除名,1981-09-25,1981-09
鞍山清洁工人四喜盈门,1981-09-25,1981-09
家用太阳能热水器已进入多层建筑,1981-09-25,1981-09
全国铁路将实行新的“铁路货物运输规程”,1981-09-25,1981-09
向挖革改要经济效益,1981-09-25,1981-09
全社会都要尊重清洁工人,1981-09-25,1981-09
上海等市恢复市内电话计次收费,1981-09-25,1981-09
不可小看点点滴滴,1981-09-25,1981-09
服装生产和经营的一项改革,1981-09-25,1981-09
学习孙中山的精神，为振兴中华而奋斗,1981-09-25,1981-09
党刊要积极开展正确的批评,1981-09-25,1981-09
学习张子意同志勇于自我批评的精神,1981-09-25,1981-09
全国各地党员教育刊物成倍增加，越办越好,1981-09-25,1981-09
在青年中开展学历史、爱祖国活动,1981-09-25,1981-09
来函照登,1981-09-25,1981-09
满腔热情地扶助贫困户,1981-09-25,1981-09
这也是一股不正之风,1981-09-25,1981-09
中青年鲁迅研究工作者崛起,1981-09-25,1981-09
万里会见新西兰文化代表团,1981-09-25,1981-09
《中国经济年鉴》１９８１年刊最近出版,1981-09-25,1981-09
联合国沙漠防治讲习班在兰州结束,1981-09-25,1981-09
美国新任驻华大使向邓颖超递交国书,1981-09-25,1981-09
薄一波会见欧洲议会议员团,1981-09-25,1981-09
中日合拍彩色纪录片《北京故宫博物院》,1981-09-25,1981-09
对外友协举行电影招待会    庆祝中国和阿拉伯也门共和国建交二十五周年,1981-09-25,1981-09
方毅会见欧洲原子核研究中心总主任,1981-09-25,1981-09
全国田径锦标赛取得可喜成绩,1981-09-25,1981-09
杨静仁会见尼泊尔客人,1981-09-25,1981-09
黄华会见联合国难民事务前高级专员,1981-09-25,1981-09
各有特点  平分秋色,1981-09-25,1981-09
日本国际裁判赞扬北京观众风格高,1981-09-25,1981-09
辛亥革命的一个重要历史教训,1981-09-25,1981-09
义和团运动,1981-09-25,1981-09
国营企业收入分配体制改革的讨论,1981-09-25,1981-09
《律师手册》即将出版,1981-09-25,1981-09
《孙中山传》修订本即将出版,1981-09-25,1981-09
苏联霸权主义侵略扩张仍是世界和平主要威胁,1981-09-25,1981-09
波政府将同团结工会就一些问题继续谈判,1981-09-25,1981-09
对当前柬阿等世界最紧迫问题表示关切,1981-09-25,1981-09
苏越在东南亚的“新策略”,1981-09-25,1981-09
伊朗将选举新总统已批准５名候选人,1981-09-25,1981-09
希望作家们为反对侵略维护和平而努力,1981-09-25,1981-09
多哥总统埃亚德马启程来华,1981-09-25,1981-09
法国民议会通过废除死刑法案,1981-09-25,1981-09
日本开展“征服癌症月”活动,1981-09-25,1981-09
海湾六国讨论军事合作,1981-09-25,1981-09
美国在洪军事顾问遭袭击,1981-09-25,1981-09
日美在西太平洋举行演习,1981-09-25,1981-09
法国举行大规模军事演习,1981-09-25,1981-09
克格勃在泰国,1981-09-25,1981-09
新加坡重视癌症的防治,1981-09-25,1981-09
访鲁迅先生在日本住地,1981-09-25,1981-09
迅速发展的多哥,1981-09-25,1981-09
意大利热情介绍鲁迅著作,1981-09-25,1981-09
鲁迅著作在南斯拉夫,1981-09-25,1981-09
世界马拉松运动蓬勃发展,1981-09-25,1981-09
毕生学习鲁迅,1981-09-25,1981-09
在虹口公园,1981-09-25,1981-09
编导传记纪录片《鲁迅传》的体会,1981-09-25,1981-09
民族魂（木刻）,1981-09-25,1981-09
无题有感,1981-09-25,1981-09
厚重和坚韧,1981-09-25,1981-09
许广平的一生,1981-09-25,1981-09
咸亨酒店和其他,1981-09-25,1981-09
首都隆重集会纪念鲁迅诞生一百周年,1981-09-26,1981-09
在鲁迅诞生一百周年纪念大会上的讲话,1981-09-26,1981-09
多哥总统埃亚德马到达北京  赵紫阳主持欢迎仪式和宴会,1981-09-26,1981-09
独立的非洲是国际舞台上一支强大力量,1981-09-26,1981-09
埃亚德马在赵紫阳举行的欢迎宴会上,1981-09-26,1981-09
航空流体系统国际标准化会议在京召开,1981-09-26,1981-09
赵紫阳会见意大利外贸部长卡波里阿,1981-09-26,1981-09
全国第四次“质量月”授奖大会在京举行,1981-09-26,1981-09
李先念会见澳大利亚卫生部长麦凯勒,1981-09-26,1981-09
卢嘉锡宴请西德马克斯·普朗克学会代表团,1981-09-26,1981-09
伍修权欢宴英国皇家国防研究院代表团,1981-09-26,1981-09
鲁迅研究有了新的广度和深度,1981-09-26,1981-09
中国鲁迅研究学会选举新的理事会,1981-09-26,1981-09
杭州举行鲁迅先生塑像奠基典礼,1981-09-26,1981-09
香港准备在孙中山在港求学和从事革命活动的三处遗址设立纪念牌匾,1981-09-26,1981-09
隆重纪念鲁迅诞生一百周年,1981-09-26,1981-09
兴旺的牲口市场,1981-09-26,1981-09
要全面地总结经验教训,1981-09-26,1981-09
大力加强社队财务管理取得成效,1981-09-26,1981-09
尖子赞,1981-09-26,1981-09
用单分子膜预防苹果炭疽病成功,1981-09-26,1981-09
责任制和财务管理一起抓,1981-09-26,1981-09
麦秀双穗喜盈村,1981-09-26,1981-09
建立农业灾情档案,1981-09-26,1981-09
农民同食品站联办猪场,1981-09-26,1981-09
金华火腿产量大增,1981-09-26,1981-09
陈沛自荐当队长之后,1981-09-26,1981-09
场院上〔木刻〕,1981-09-26,1981-09
一位女县长的４８小时〔报告文学〕,1981-09-26,1981-09
鲁西翻身诗〔二首〕,1981-09-26,1981-09
布谷声声〔短篇小说〕,1981-09-26,1981-09
肯尼亚总统要求联大强制实行纳米比亚决议,1981-09-26,1981-09
安理会建议联大接纳伯利兹为会员国,1981-09-26,1981-09
阿富汗游击队在潘杰希尔山谷重创敌军,1981-09-26,1981-09
重新组成日本工人党,1981-09-26,1981-09
雅鲁泽尔斯基在议会作国内局势报告,1981-09-26,1981-09
只有保持东西方均势才能维护和平,1981-09-26,1981-09
日苏外长会谈在北方领土问题上争论激烈,1981-09-26,1981-09
各国议会联盟大会闭幕,1981-09-26,1981-09
日本国会临时会议开幕,1981-09-26,1981-09
法国内阁通过国有化法案,1981-09-26,1981-09
根本对立的方案,1981-09-26,1981-09
美苏宣布将在１１月开始武器控制问题谈判,1981-09-26,1981-09
墨中友协纪念鲁迅诞生一百周年,1981-09-26,1981-09
