洪水的考验,1981-09-11,1981-09
副军长的妈妈,1981-09-11,1981-09
贺新房,1981-09-11,1981-09
从台湾回归有感,1981-09-11,1981-09
梦里江山  寂然无声,1981-09-11,1981-09
台湾电视播放大陆风光片,1981-09-11,1981-09
广州销售了不少台湾商品,1981-09-11,1981-09
外销业日益衰退,1981-09-11,1981-09
新竹外海发现油气,1981-09-11,1981-09
北部发现放射性异常带十一处,1981-09-11,1981-09
牢牢掌握主题和中心学习六中全会文件体会,1981-09-11,1981-09
姬鹏飞欢宴喀麦隆民族联盟代表团,1981-09-11,1981-09
朝鲜电影周在京开幕,1981-09-11,1981-09
埃及民间艺术团在京举行访华首演,1981-09-11,1981-09
民航总局向“两航”起义人员颁发证明书,1981-09-11,1981-09
谷牧会见日本客人,1981-09-11,1981-09
耿飚会见尼日利亚客人,1981-09-11,1981-09
姬鹏飞会见意大利南方金融投资公司代表团,1981-09-11,1981-09
黄华会见日本外务省顾问,1981-09-11,1981-09
谭震林会见泰国前副总理颂朴,1981-09-11,1981-09
王炳南会见希腊知名人士访华团,1981-09-11,1981-09
中国政府贸易代表团离京赴新西兰、澳大利亚访问,1981-09-11,1981-09
武汉京剧团离京赴欧洲四国访问演出,1981-09-11,1981-09
马克思主义者对待历史经验的态度,1981-09-11,1981-09
维护民族尊严的太平天国外交,1981-09-11,1981-09
发展轻工业靠挖潜,1981-09-11,1981-09
《忆南征》出版,1981-09-11,1981-09
《筹安会“六君子”传》出版,1981-09-11,1981-09
《二程集》即将出版,1981-09-11,1981-09
铃木表示要为归还北方领土全力以赴,1981-09-11,1981-09
为促进民族统一大会的召开而斗争,1981-09-11,1981-09
不要忘记史密斯的教训,1981-09-11,1981-09
西班牙各政党强烈谴责苏联干涉内政,1981-09-11,1981-09
阿富汗游击队袭击侵阿苏军据点,1981-09-11,1981-09
联合国非洲集团要求立即实施纳米比亚决议,1981-09-11,1981-09
成立监督机构制止以色列武器进入黎巴嫩,1981-09-11,1981-09
美副国务卿访巴基斯坦,1981-09-11,1981-09
尼加拉瓜宣布全国紧急状态,1981-09-11,1981-09
勃列日涅夫会见柬伪头目宾索万,1981-09-11,1981-09
苏联为什么举行这样大规模军事演习？,1981-09-11,1981-09
伊朗新政府加强治安保卫工作,1981-09-11,1981-09
西欧经济仍在衰退中,1981-09-11,1981-09
南亚七国农业研究小组举行会议,1981-09-11,1981-09
印度发展小城市,1981-09-11,1981-09
欧洲共同体工业生产继续下降,1981-09-11,1981-09
北约在地中海举行海军演习,1981-09-11,1981-09
忆往昔  峥嵘岁月稠,1981-09-11,1981-09
培养人才的摇篮,1981-09-11,1981-09
巴基斯坦奠基人——真纳,1981-09-11,1981-09
西欧青年人失业为何严重,1981-09-11,1981-09
塞内加尔的猴子面包树,1981-09-11,1981-09
法国学校的新课程,1981-09-11,1981-09
世界上最小的摩托车,1981-09-11,1981-09
十四年不眠的人,1981-09-11,1981-09
鹦鹉为盲人引路,1981-09-11,1981-09
蝎子山丘,1981-09-11,1981-09
四只眼睛的鱼,1981-09-11,1981-09
昆虫动物园,1981-09-11,1981-09
泰山挑夫,1981-09-11,1981-09
水与油及其它,1981-09-11,1981-09
泰山新议,1981-09-11,1981-09
赫尔岑谈读书,1981-09-11,1981-09
热情扶持业余剧团,1981-09-11,1981-09
早,1981-09-11,1981-09
重回上海忆童年（连载）,1981-09-11,1981-09
雨歇〔中国画〕,1981-09-11,1981-09
信贷员曹桢发扬主人翁精神  算大帐查清“高亏高品”有盈余,1981-09-12,1981-09
浙江超额完成早稻征购任务,1981-09-12,1981-09
惠阳地区人口增长率下降,1981-09-12,1981-09
湖北地县工业总产值大增,1981-09-12,1981-09
关于全国县级直接选举工作的总结报告,1981-09-12,1981-09
重庆受灾工厂商店全部恢复生产和营业,1981-09-12,1981-09
面临停产的天津铝合金厂越办越活,1981-09-12,1981-09
狠抓最后三个多月,1981-09-12,1981-09
黄河上游发生较大洪水,1981-09-12,1981-09
新版《鲁迅全集》将在全国发行,1981-09-12,1981-09
宁夏农垦系统发展多种经营效果显著,1981-09-12,1981-09
发生在生米公社的两件新事,1981-09-12,1981-09
农场关心社队  社队体贴农场,1981-09-12,1981-09
高唐庆中秋,1981-09-12,1981-09
沙洲县的每个公社都建立业余文艺宣传队,1981-09-12,1981-09
过去跳“农门”  今天回“农门”,1981-09-12,1981-09
培养藏族科技人员,1981-09-12,1981-09
是三个人，还是一个人？,1981-09-12,1981-09
枣树二次结果是正常的,1981-09-12,1981-09
骑车千里看丰收,1981-09-12,1981-09
真知灼见  为国分忧,1981-09-12,1981-09
胳膊肘朝哪拐？,1981-09-12,1981-09
严禁借用银行帐户的非法行为,1981-09-12,1981-09
沈阳水泵厂生产高效节能新设备,1981-09-12,1981-09
解决建港工程中的难题,1981-09-12,1981-09
提高了运输效率,1981-09-12,1981-09
玉堂酱园名不虚传,1981-09-12,1981-09
海峡隔不断骨肉之情,1981-09-12,1981-09
云南仪表厂消灭职业病,1981-09-12,1981-09
１２０全景照相机制成,1981-09-12,1981-09
广西八一锰矿年年植树,1981-09-12,1981-09
基建工程兵部队节油,1981-09-12,1981-09
民革举行中秋茶话会,1981-09-12,1981-09
福建沿海军民向金门马祖漂送月饼,1981-09-12,1981-09
阿里副总理兼外长离京赴朝访问,1981-09-12,1981-09
方毅会见日本铁钢协会代表团,1981-09-12,1981-09
姬鹏飞会见委内瑞拉基社党领导人阿吉拉尔,1981-09-12,1981-09
方毅会见美国芝加哥大学代表团,1981-09-12,1981-09
陈宇会见多哥工联代表团,1981-09-12,1981-09
美气的日子〔短篇小说〕,1981-09-12,1981-09
柏树的怀念,1981-09-12,1981-09
喀布尔群众奋起示威抗议强征退役军人入伍,1981-09-12,1981-09
苏越为谋求霸权勾结得更加紧密,1981-09-12,1981-09
侵柬越军侵入泰国东部领海,1981-09-12,1981-09
日本要求归还北方领土运动在前进,1981-09-12,1981-09
纳沙布角,1981-09-12,1981-09
日报驳斥苏联对铃木首相的攻击,1981-09-12,1981-09
代表们呼吁国际社会增加对最不发达国家援助,1981-09-12,1981-09
撒切尔夫人支持美国生产中子弹,1981-09-12,1981-09
国际科学史会议在布加勒斯特举行,1981-09-12,1981-09
东德洪堡大学纪念鲁迅诞辰,1981-09-12,1981-09
奥地利电视台播放电视纪录片《新中国》,1981-09-12,1981-09
赞同黎巴嫩停火委员会决定,1981-09-12,1981-09
苏战略和常规武器生产超过美国,1981-09-12,1981-09
毕加索名画《格尔尼卡》归还西班牙,1981-09-12,1981-09
奥地利总统访问瑞士,1981-09-12,1981-09
孟外长访印讨论双边问题,1981-09-12,1981-09
美国副国务卿结束访巴,1981-09-12,1981-09
土国家元首希望改善土希关系,1981-09-12,1981-09
西撒人阵释放毛里塔尼亚战俘,1981-09-12,1981-09
美向罗提供一亿多美元贷款,1981-09-12,1981-09
欧洲共同体钢铁将提价,1981-09-12,1981-09
意大利军队在地中海演习,1981-09-12,1981-09
日本著名物理学家汤川秀树逝世,1981-09-12,1981-09
往事,1981-09-12,1981-09
斯德哥尔摩拾零,1981-09-12,1981-09
从电影明星到摄影艺术家,1981-09-12,1981-09
达尔文的植物笔记,1981-09-12,1981-09
手不灵脚灵,1981-09-12,1981-09
重回上海忆童年（连载）,1981-09-12,1981-09
诗二首,1981-09-12,1981-09
访舞蹈家崔美善,1981-09-12,1981-09
辛勤耕耘  热情扶植,1981-09-12,1981-09
《黎明》散文诗丛书,1981-09-12,1981-09
《文学手册》,1981-09-12,1981-09
《鲁迅在世界文学上的地位》,1981-09-12,1981-09
职工承包经营不唯盈利为方便群众,1981-09-13,1981-09
合肥百货大楼领导干部勇于自我批评改变软散状态,1981-09-13,1981-09
集中全力加强黄河上游防汛工作确保工农生产和人民生命财产安全,1981-09-13,1981-09
拯救西南绿色长城  保护长江鱼米之乡,1981-09-13,1981-09
加强政治责任感  实行经营责任制,1981-09-13,1981-09
中央国家机关领导同志参加周末打扫卫生劳动,1981-09-13,1981-09
李先念会见喀麦隆民族联盟代表团,1981-09-13,1981-09
愿“少见的事”多起来（今日谈）,1981-09-13,1981-09
自己种出的果子香甜（今日谈）,1981-09-13,1981-09
宁夏十万军民日夜防洪抢险,1981-09-13,1981-09
“副业通”,1981-09-13,1981-09
土地科学工作者建议：切实抓好土地的利用和管理,1981-09-13,1981-09
长岛捕获海蜇１，０００万斤,1981-09-13,1981-09
拉萨收获苹果４００多万斤,1981-09-13,1981-09
台湾一梅花鹿产一小白鹿,1981-09-13,1981-09
老崔头笑得多甜！,1981-09-13,1981-09
遂宁县组织群众淘金自救,1981-09-13,1981-09
抚今追昔感到幸福  五保老人捐款救灾,1981-09-13,1981-09
泰和鸡名扬海外,1981-09-13,1981-09
五千绣花针  挣来百万富,1981-09-13,1981-09
黄草变财富,1981-09-13,1981-09
编织能手大展所长,1981-09-13,1981-09
赤峰城市卫生面貌迅速改观,1981-09-13,1981-09
“我们也有苦恼”,1981-09-13,1981-09
不能把儿童的安危置之度外,1981-09-13,1981-09
赤峰市卫生面貌改观的启示,1981-09-13,1981-09
必须真正向人民负责,1981-09-13,1981-09
也谈我们的苦恼,1981-09-13,1981-09
接受批评  改进工作,1981-09-13,1981-09
小儿佝偻病的防治,1981-09-13,1981-09
怎样看待孩子撒谎,1981-09-13,1981-09
“挂钥匙小朋友阅览室”,1981-09-13,1981-09
新的一代健康成长,1981-09-13,1981-09
从衡水铁厂下马事件中吸取教训,1981-09-13,1981-09
孙中山先生遗体安葬后从未移动过,1981-09-13,1981-09
姬鹏飞同喀麦隆民族联盟代表团会谈双方同意建立中喀两党友好合作关系,1981-09-13,1981-09
习仲勋会见委内瑞拉基社党领导人阿吉拉尔,1981-09-13,1981-09
范塔耶·比夫图大使举行招待会庆祝埃塞俄比亚人民革命日,1981-09-13,1981-09
方毅会见加拿大赫兹堡教授,1981-09-13,1981-09
张学良将军胞妹思念亲人,1981-09-13,1981-09
方毅会见西德液压气动专家巴克教授,1981-09-13,1981-09
“希望杯”里有希望,1981-09-13,1981-09
第十二届世界杯足球赛预选赛形势分析,1981-09-13,1981-09
富有浓郁民族风格的套马（少数民族体育花絮）,1981-09-13,1981-09
别具一格的头顶瓦瓮竞走赛（少数民族体育花絮）,1981-09-13,1981-09
饶有风趣的跳马、跳骆驼,1981-09-13,1981-09
绿茵场的由来,1981-09-13,1981-09
勇于同歪风邪气作斗争,1981-09-13,1981-09
温州地区不少社队企业大肆骗钱,1981-09-13,1981-09
浙江省委已组成检查组赴温州,1981-09-13,1981-09
科学种田“明白纸”（适应农村新形势  解决农村新问题）,1981-09-13,1981-09
集日“农业技术问答处”（适应农村新形势  解决农村新问题）,1981-09-13,1981-09
水乡迫切要求恢复和发展水车（适应农村新形势  解决农村新问题）,1981-09-13,1981-09
发展多用小拖拉机大有前途（适应农村新形势  解决农村新问题）,1981-09-13,1981-09
教给农民正确使用化肥农药（适应农村新形势  解决农村新问题）,1981-09-13,1981-09
我们的调查,1981-09-13,1981-09
不应强迫储蓄,1981-09-13,1981-09
来之何难，弃之何易,1981-09-13,1981-09
北京站公用电话亭的服务品德,1981-09-13,1981-09
铁路客运部门要多为乘客着想,1981-09-13,1981-09
商店营业时间应与职工上班时间错开,1981-09-13,1981-09
昔日两公司闹矛盾旅客受难今朝团结紧互支持群众开颜,1981-09-13,1981-09
非洲前线国家紧急首脑会议发表公报,1981-09-13,1981-09
伊朗连日发生反政府示威,1981-09-13,1981-09
赞比亚军队还击南非军队袭击,1981-09-13,1981-09
联大纳米比亚问题紧急会议结束一般性辩论,1981-09-13,1981-09
伊朗又一名宗教领导人被暗杀,1981-09-13,1981-09
民柬电台发表社论指出柬各方应遵守联合声明不把分歧公之于众,1981-09-13,1981-09
英萨利到达纽约准备出席第三十六届联大,1981-09-13,1981-09
波兰团结工会首届代表大会第一阶段会议结束,1981-09-13,1981-09
新加坡外长相信民柬能再次在联大保持席位,1981-09-13,1981-09
阿富汗游击队袭击喀布尔近郊政府军据点,1981-09-13,1981-09
莫斯科的谩骂说明了什么？,1981-09-13,1981-09
荷兰组成新联合政府,1981-09-13,1981-09
危险的“战略合作”,1981-09-13,1981-09
国际社会科学讨论会在墨举行,1981-09-13,1981-09
北约举行为期十天的海军演习,1981-09-13,1981-09
英职工大会一九八一年年会结束,1981-09-13,1981-09
美国政府面临多事之秋,1981-09-13,1981-09
中秋佳节喜重逢,1981-09-13,1981-09
国际航空运输业一瞥,1981-09-13,1981-09
日本的私人储蓄活动,1981-09-13,1981-09
比利时获世界杯足球赛决赛权,1981-09-13,1981-09
英格兰足球队负于挪威队,1981-09-13,1981-09
南斯拉夫足球队胜丹麦队,1981-09-13,1981-09
苏格兰足球队二比○战胜瑞典队,1981-09-13,1981-09
保尔·柯察金话剧,1981-09-13,1981-09
保尔精神激励我们前进,1981-09-13,1981-09
军民同心协力  奋勇抗洪抢险,1981-09-14,1981-09
农垦系统上交商品粮增多连年盈利,1981-09-14,1981-09
再接再厉全力以赴战胜黄河上游洪水,1981-09-14,1981-09
云南地质局积极勘探水肥资源,1981-09-14,1981-09
瑞典国王卡尔十六世·古斯塔夫,1981-09-14,1981-09
加强地质工作查明更多矿藏,1981-09-14,1981-09
北京国际马拉松比赛２７日举行,1981-09-14,1981-09
煤炭运输损耗惊人,1981-09-14,1981-09
国内旅游业要认真做好疏导工作,1981-09-14,1981-09
要实行货运责任制,1981-09-14,1981-09
运输部门违章运货亟待改进,1981-09-14,1981-09
天津市公共汽车公司解决实行责任制中的新问题,1981-09-14,1981-09
“自由恋爱”比“包办婚姻”好,1981-09-14,1981-09
坚持原则的女厂长王春蓉,1981-09-14,1981-09
扶持特色商店,1981-09-14,1981-09
昆明部队注意利用自然能源（工商短波）,1981-09-14,1981-09
柳钢改造轧钢加热炉节约了能源（工商短波）,1981-09-14,1981-09
陕西省积极安排棉布生产（工商短波）,1981-09-14,1981-09
唐山新区找到丰富水源（工商短波）,1981-09-14,1981-09
竞争与风格,1981-09-14,1981-09
六十六万元巨款是怎样被骗走的？,1981-09-14,1981-09
黑龙江省各地党委书记亲自抓党风,1981-09-14,1981-09
衡水铁厂下马事件处理得好,1981-09-14,1981-09
信念·视野·历史的眼光,1981-09-14,1981-09
报纸批评属实  问题已在查处,1981-09-14,1981-09
编者案,1981-09-14,1981-09
侗族妇女,1981-09-14,1981-09
侗乡风尚好,1981-09-14,1981-09
多才多艺是侗家,1981-09-14,1981-09
风雨桥,1981-09-14,1981-09
沈阳部队纪委表扬二十名师以上干部,1981-09-14,1981-09
不正之风是可以纠正的,1981-09-14,1981-09
党鼓舞我们增强信心反对不正之风,1981-09-14,1981-09
建立良好秩序提高医疗服务质量,1981-09-14,1981-09
庆祝《健康报》创刊五十周年,1981-09-14,1981-09
中山陵装修竣工后接受群众瞻仰参观,1981-09-14,1981-09
热切希望台湾早日回归祖国,1981-09-14,1981-09
中国笔会中心举行会员大会,1981-09-14,1981-09
“港澳各界纪念辛亥革命七十周年筹备委员会”正式成立,1981-09-14,1981-09
杨得志会见西班牙军事代表团,1981-09-14,1981-09
京沪津榕杭台胞欢度中秋佳节,1981-09-14,1981-09
第六期国际基层卫生讲习班在嘉定县开学,1981-09-14,1981-09
康克清会见圣多美和普林西比友好人士代表团,1981-09-14,1981-09
雍文涛会见联合国粮农组织助理总干事一行,1981-09-14,1981-09
程子华会见北欧盲人组织合作委员会访华团,1981-09-14,1981-09
姬鹏飞会见希腊知名人士访华团,1981-09-14,1981-09
王炳南会见并宴请秘鲁客人,1981-09-14,1981-09
陈文成是被谋杀而死,1981-09-14,1981-09
执行法律要考虑形势,1981-09-14,1981-09
真理是否包含错误问题讨论概述,1981-09-14,1981-09
发展农工商综合经营的战略意义,1981-09-14,1981-09
为什么要继续搞活市场？,1981-09-14,1981-09
何时开庭要遵守法律,1981-09-14,1981-09
要求其他各方都遵守联合声明,1981-09-14,1981-09
阿富汗游击队加强进攻苏军和政府军,1981-09-14,1981-09
偷梁换柱的阴谋,1981-09-14,1981-09
东盟同越南谈判不会有好处,1981-09-14,1981-09
加尔各答举行总罢工,1981-09-14,1981-09
英法首脑举行会谈,1981-09-14,1981-09
寨内加尔将同冈比亚合并,1981-09-14,1981-09
西德议员谴责苏大规模军事演习,1981-09-14,1981-09
苏联军事演习结束前在波兰近海举行登陆演习,1981-09-14,1981-09
黑格访问南斯拉夫,1981-09-14,1981-09
埃及公民投票赞成萨达特解决教派冲突措施,1981-09-14,1981-09
苏联将连续三年粮食歉收,1981-09-14,1981-09
我青年队获六项冠军,1981-09-14,1981-09
世界杯羽毛球单打锦标赛下月在吉隆坡举行,1981-09-14,1981-09
南共中央执行书记马约尔会见邓力群,1981-09-14,1981-09
水果的大敌——地中海果蝇,1981-09-14,1981-09
日民社党委员长视察北方领土,1981-09-14,1981-09
牙买加总理访问委内瑞拉,1981-09-14,1981-09
巴基斯坦发生地震,1981-09-14,1981-09
巴探明一千八百万吨铁矿,1981-09-14,1981-09
管窥瑞典,1981-09-14,1981-09
谎言遮掩不了事实,1981-09-14,1981-09
美西军事基地谈判为何陷入僵局,1981-09-14,1981-09
匈牙利重视粮食生产,1981-09-14,1981-09
瑞黄重视钢铁厂废渣的利用,1981-09-14,1981-09
用袋装混凝土盖房,1981-09-14,1981-09
新型淘金器,1981-09-14,1981-09
房间可以移动的办公楼,1981-09-14,1981-09
袖珍声波驱蚊器,1981-09-14,1981-09
鼓舞翩跹〔中国画〕,1981-09-14,1981-09
舞蹈大家——崔美善,1981-09-14,1981-09
观《长鼓舞》,1981-09-14,1981-09
孙中山伦敦蒙难……,1981-09-14,1981-09
夜市见闻杂感,1981-09-14,1981-09
夜市的灯,1981-09-14,1981-09
氧与人体健康,1981-09-14,1981-09
“慈母心” “婆婆嘴”,1981-09-14,1981-09
各级领导干部到基层现场解决问题,1981-09-15,1981-09
瑞典国王和王后到达北京  习仲勋主持欢迎仪式和宴会,1981-09-15,1981-09
叶剑英会见瑞典国王和王后,1981-09-15,1981-09
各级领导都要身体力行,1981-09-15,1981-09
一批农学家提出三个值得重视的问题,1981-09-15,1981-09
龙羊峡军民奋力加固围堰锁住“龙头”,1981-09-15,1981-09
大型文献纪录片《辛亥风云》摄制完成,1981-09-15,1981-09
二百多出国留学人员学成回国,1981-09-15,1981-09
北京师范大学聘请他为客座教授,1981-09-15,1981-09
出口远洋货轮“长城”号下水,1981-09-15,1981-09
“打预防针”的办法好,1981-09-15,1981-09
态度好还要业务精,1981-09-15,1981-09
又统又包  加强领导,1981-09-15,1981-09
把银幕挂到乡村场院,1981-09-15,1981-09
关心农民的文化生活,1981-09-15,1981-09
贺兰山下引种水杉,1981-09-15,1981-09
温州郊区生产无籽番茄,1981-09-15,1981-09
郭七爷的骂声消失了,1981-09-15,1981-09
农民需要《农村住宅设计图案》,1981-09-15,1981-09
桂阳发现柔毛油杉,1981-09-15,1981-09
处理麦种，及早预防病虫为害,1981-09-15,1981-09
要注意培训生产队长,1981-09-15,1981-09
到实践中总结经验（研究新情况  解决新问题）,1981-09-15,1981-09
对责任田不应设“卡”（研究新情况  解决新问题）,1981-09-15,1981-09
新学年里要抓好思想政治教育,1981-09-15,1981-09
看“活水”怎样流动,1981-09-15,1981-09
为了造就高质量的人才,1981-09-15,1981-09
地方科委要沟通技术援用渠道,1981-09-15,1981-09
这里，最好的房子是学校,1981-09-15,1981-09
上海化工系统举办科研成果交易会,1981-09-15,1981-09
地下水位对农作物的影响,1981-09-15,1981-09
豆科牧草,1981-09-15,1981-09
莫使学生处危室,1981-09-15,1981-09
瑞典国王和王后到达北京  习仲勋主持欢迎仪式和宴会,1981-09-15,1981-09
今年农副产品增长较大  供销合作社要大力购销,1981-09-15,1981-09
鲁迅诞生一百周年各项纪念活动陆续展开,1981-09-15,1981-09
社会各界已为中国儿童和少年基金会捐款一百万元,1981-09-15,1981-09
表彰国际音乐比赛中获奖者及其教师,1981-09-15,1981-09
广东举行纪念鲁迅学术讨论会,1981-09-15,1981-09
鲁迅墓和故居整饰一新,1981-09-15,1981-09
吉布提国民议会代表团抵京,1981-09-15,1981-09
倪志福会见津巴布韦工会大会代表团,1981-09-15,1981-09
曾涛离京去西欧三国访问,1981-09-15,1981-09
西蒙·皮埃尔举行答谢宴会,1981-09-15,1981-09
勉励失足青年树立革命人生观,1981-09-15,1981-09
华侨茶业发展研究基金会成立,1981-09-15,1981-09
被越南武装人员越境抓走的２３名中国边境居民回到祖国,1981-09-15,1981-09
何维忠同志追悼会在京举行,1981-09-15,1981-09
学习朱德同志发展手工业的思想,1981-09-15,1981-09
戊戌变法,1981-09-15,1981-09
按专业化原则改组工业企业,1981-09-15,1981-09
监所检察（人民检察工作（六））,1981-09-15,1981-09
中国经济调整打开了经济发展新进程,1981-09-15,1981-09
德黑兰连续发生反政府示威游行,1981-09-15,1981-09
英萨利致函各国外长,1981-09-15,1981-09
柬三方特委会举行第一次会议,1981-09-15,1981-09
发展科研促进农业生产,1981-09-15,1981-09
打进总理府的人民圣战者成员应对此负责,1981-09-15,1981-09
老挝游击队打死打伤越军七十二人,1981-09-15,1981-09
泰国陆海空军举行防空演习,1981-09-15,1981-09
泛美农业和食品生产会议,1981-09-15,1981-09
拉美和加勒比举行声援朝鲜和平统一大会,1981-09-15,1981-09
尼日利亚采取措施发展农业,1981-09-15,1981-09
菲律宾精糖产量不断提高,1981-09-15,1981-09
黑格同法赫德讨论中东问题,1981-09-15,1981-09
埃及副总理兼外长阿里谈亚洲之行,1981-09-15,1981-09
里根政府决定削减军费以平衡预算,1981-09-15,1981-09
意大利和西德总理在联合记者招待会上重申,1981-09-15,1981-09
塞冈邦联计划获进展,1981-09-15,1981-09
北约开始“秋季熔炉”演习,1981-09-15,1981-09
朝鲜成立促进朝日友好亲善协会,1981-09-15,1981-09
墨纪念六少年牺牲百余周年,1981-09-15,1981-09
坎帕拉郊区接连发生爆炸抢劫案,1981-09-15,1981-09
在巴阿富汗难民达二百三十万人,1981-09-15,1981-09
美去年发生一千多万起犯罪案,1981-09-15,1981-09
墨西哥数万名大学职工举行罢工,1981-09-15,1981-09
哥伦比亚教师举行全国抗议活动,1981-09-15,1981-09
印孟同意采取建设性态度解决双边问题,1981-09-15,1981-09
——我们追求和平目标是始终不渝的！,1981-09-15,1981-09
从北方领土看日苏关系,1981-09-15,1981-09
喀拉什山谷行,1981-09-15,1981-09
“扔石头”比赛,1981-09-15,1981-09
访问挪威船级社,1981-09-15,1981-09
刚果的流动邮局,1981-09-15,1981-09
羽毛球——印度尼西亚的国球,1981-09-15,1981-09
捷克斯洛伐克足球队胜威尔士队,1981-09-15,1981-09
世界柔道锦标赛在荷兰结束,1981-09-15,1981-09
“反哺”,1981-09-15,1981-09
母爱与爱母,1981-09-15,1981-09
我给鲁迅先生画遗像,1981-09-15,1981-09
月下情,1981-09-15,1981-09
《可爱的中国》的新版本,1981-09-15,1981-09
故乡佳节,1981-09-15,1981-09
八月份全国工交生产上升利润增加,1981-09-16,1981-09
龙羊峡军民展开确保围堰安全的决战  刘家峡主副坝加高加固工程提前完成,1981-09-16,1981-09
把小商品生产提到重要地位,1981-09-16,1981-09
开展批评扶正祛邪,1981-09-16,1981-09
中吉友好合作关系正在不断发展,1981-09-16,1981-09
济南认真处理石化厂违反财经纪律行为,1981-09-16,1981-09
苏州市采取措施扶持小商品生产,1981-09-16,1981-09
北京地铁一期工程正式交付使用,1981-09-16,1981-09
我淡水珍珠出口跃居世界第一位,1981-09-16,1981-09
新疆今年将再增产二百万米纯棉白布,1981-09-16,1981-09
浙江省最近成立电力联营企业,1981-09-16,1981-09
关于纳米比亚问题的联大紧急特别会议通过决议要求立即执行纳米比亚独立的决议,1981-09-16,1981-09
待业青年温宝珠自办托婴室,1981-09-16,1981-09
“打开财源的金钥匙”（工作研究和经验交流）,1981-09-16,1981-09
财贸工作要适应农村新形势（编者按）,1981-09-16,1981-09
希望多生产大缸以利储粮（财贸工作要适应农村新形势）,1981-09-16,1981-09
农村急待增设储蓄网点（财贸工作要适应农村新形势）,1981-09-16,1981-09
建议农村供销社设图书专柜（财贸工作要适应农村新形势）,1981-09-16,1981-09
农村需要鞋帽成衣（财贸工作要适应农村新形势）,1981-09-16,1981-09
惠民地区大牲畜市场活跃（财贸工作要适应农村新形势）,1981-09-16,1981-09
建湖县加工锅盖供应农村（财贸工作要适应农村新形势）,1981-09-16,1981-09
十一个省市信托贸易公司  积极为工商业疏通渠道,1981-09-16,1981-09
平顶山市新建副食品生产基地,1981-09-16,1981-09
一机系统二百多项科技成果获奖（工商短波）,1981-09-16,1981-09
河南二十万人从事个体工商业（工商短波）,1981-09-16,1981-09
珠算技术比赛在济南举行（工商短波）,1981-09-16,1981-09
广东成立一批劳动服务公司,1981-09-16,1981-09
发人深思,1981-09-16,1981-09
民主选举是一个动力,1981-09-16,1981-09
打击走私活动  维护党纪国法,1981-09-16,1981-09
一个坚强的战斗堡垒,1981-09-16,1981-09
北京市公安局表彰和奖励一批治安积极分子,1981-09-16,1981-09
大家都来关心孤儿寡女,1981-09-16,1981-09
冷淡和热情之间,1981-09-16,1981-09
癔瘫病人站起来了,1981-09-16,1981-09
公仆,1981-09-16,1981-09
重复建设为何制止不了？,1981-09-16,1981-09
