《陶行知全集》第一卷出版,1984-03-12,1984-03
宁夏发掘一座大型北周古墓,1984-03-12,1984-03
新疆拜城发现一座千佛洞,1984-03-12,1984-03
北京已有１８９个市重点文物保护单位,1984-03-12,1984-03
辽宁发掘出古人类洞穴遗址,1984-03-12,1984-03
陕西发现一批罕见中唐古墓,1984-03-12,1984-03
伊川县发现战国晚期酒器,1984-03-12,1984-03
改进经营管理二汽邀请各地用户司机提意见重视信息,1984-03-12,1984-03
克服平均主义天津优先安排青年劳模迁新居鼓励先进,1984-03-12,1984-03
足球甲级队联赛已打完第六轮,1984-03-12,1984-03
内蒙古马拉松女将马丽琴创全国最新成绩,1984-03-12,1984-03
热爱排球事业的李德成老师,1984-03-12,1984-03
安徽省委继续清除“左”的思想影响,1984-03-12,1984-03
宁夏区党委整顿会风,1984-03-12,1984-03
昆明部队党委教育党员不搞文过饰非,1984-03-12,1984-03
国务院关于农村个体工商业的若干规定,1984-03-12,1984-03
简讯,1984-03-12,1984-03
内蒙古自治区基本完成旗（县）机构改革,1984-03-12,1984-03
中国特使离京赴莫斯科参加中苏第四轮磋商,1984-03-12,1984-03
中国新闻代表团赴日本访问,1984-03-12,1984-03
中国南海浬丁英贝士钻井有限公司在京成立,1984-03-12,1984-03
开展文明服务百日竞赛,1984-03-12,1984-03
张路生勤劳致富不忘照顾孤寡老人,1984-03-12,1984-03
国土规划的任务和性质,1984-03-12,1984-03
信息论的产生与发展,1984-03-12,1984-03
学会使用法律武器，严厉打击刑事犯罪活动,1984-03-12,1984-03
《中国计划管理问题》出版,1984-03-12,1984-03
出版消息,1984-03-12,1984-03
侵柬反华没有前途（本报评论）,1984-03-12,1984-03
勇于反抗侵略勤于建设国家,1984-03-12,1984-03
朝鲜为金一举行国葬金日成前往吊唁,1984-03-12,1984-03
阿拉伯国家外长将召开特别会议,1984-03-12,1984-03
哈特连续四次在民主党预选中获胜,1984-03-12,1984-03
完全支持朝鲜关于三方会谈建议,1984-03-12,1984-03
阿利耶夫在大马士革强调支持叙利亚,1984-03-12,1984-03
捷克斯洛伐克把今年定为“捷克音乐年”,1984-03-12,1984-03
印苏两国将更大规模加强防务合作,1984-03-12,1984-03
北约将在挪威北部举行军事演习,1984-03-12,1984-03
印尼前副总统呼吁同中国关系正常化,1984-03-12,1984-03
我政府特使抵莫斯科参加中苏磋商,1984-03-12,1984-03
中意签订空间科技合作议定书,1984-03-12,1984-03
我红十字会向塞内加尔赠款,1984-03-12,1984-03
国际简讯,1984-03-12,1984-03
稳健而可喜的进步,1984-03-12,1984-03
努力发展格调健康的轻音乐,1984-03-12,1984-03
别开生面的《金鸡引凤》,1984-03-12,1984-03
永不熄灭的火焰,1984-03-12,1984-03
出版动态,1984-03-12,1984-03
知耻近乎勇,1984-03-12,1984-03
扬州之歌,1984-03-12,1984-03
锋芒赞,1984-03-12,1984-03
鲁迅与《南方草木状》,1984-03-12,1984-03
文件的效益,1984-03-12,1984-03
大姐、您好！,1984-03-12,1984-03
北京地区天气预报,1984-03-13,1984-03
六届人大二次会议五月十五日召开,1984-03-13,1984-03
全国人大常委会关于召开六届人大二次会议的决定,1984-03-13,1984-03
党和国家领导人到十三陵植树,1984-03-13,1984-03
六届人大常委会代表资格审查委员会名单,1984-03-13,1984-03
对外开放政策应包括两方面含义一是对外国一是对外省外区外地,1984-03-13,1984-03
暑假召开首次少先队员辅导员代表会议,1984-03-13,1984-03
申请在北京举办第１１届亚运会,1984-03-13,1984-03
全国十家企业获企业管理优秀奖,1984-03-13,1984-03
履行一个公民的义务,1984-03-13,1984-03
不寻常的“挑毛病”活动,1984-03-13,1984-03
深圳引进一批知识技术密集型项目,1984-03-13,1984-03
牡丹江市技术改造效果好,1984-03-13,1984-03
岂能把港口码头作仓库,1984-03-13,1984-03
能这样治理脏乱差吗？,1984-03-13,1984-03
向先富的农民学走勤劳致富的路,1984-03-13,1984-03
整治国土必先种树种草,1984-03-13,1984-03
怎样在干旱地区种好树？,1984-03-13,1984-03
猕猴桃汁——大有发展前途的保健饮料,1984-03-13,1984-03
让杨树在南方茁壮成长,1984-03-13,1984-03
重视营造薪炭林,1984-03-13,1984-03
我干扰素基因工程研究成绩显著,1984-03-13,1984-03
干扰素,1984-03-13,1984-03
白洋淀国土经济研究会成立,1984-03-13,1984-03
坚决取缔制售假药的非法活动,1984-03-13,1984-03
兽医赵立明被评为齐齐哈尔市特等劳模,1984-03-13,1984-03
北航聘请著名计算机科学家叶祖尧为名誉教授,1984-03-13,1984-03
开放政策展宏图珠海吸引跨国公司兴办新型工业敢于“拿来”,1984-03-13,1984-03
尖端科学进牧区内蒙应用遥感技术调查草场资源决心“起飞”,1984-03-13,1984-03
徐永久、阎江、关平破一项亚洲纪录,1984-03-13,1984-03
蔡舒杨文琴获澳大利亚国际田径赛两项冠军,1984-03-13,1984-03
要重视竞走后备力量的培养,1984-03-13,1984-03
香港宝路华队获彪马杯足球赛冠军,1984-03-13,1984-03
上海队获亚洲城际国际象棋赛冠军,1984-03-13,1984-03
琵琶湖马拉松赛中我选手失利,1984-03-13,1984-03
请求献血的电视启事播出以后,1984-03-13,1984-03
纪念孙中山先生逝世５９周年,1984-03-13,1984-03
联合举办１９８４年植树节文艺晚会,1984-03-13,1984-03
索要住房的“财神爷”为何得不到处理？,1984-03-13,1984-03
日本《渡边寒鸥论书百绝诗书展览》在京开幕,1984-03-13,1984-03
加强对政工干部的培养训练,1984-03-13,1984-03
谋求公职难乎其难,1984-03-13,1984-03
金牌到手盘缠无着,1984-03-13,1984-03
执法犯法百姓遭殃,1984-03-13,1984-03
不能靠“免战牌”拒绝统一,1984-03-13,1984-03
贵重仪器使用中心发挥功效,1984-03-13,1984-03
台湾故宫博物院拟建仿唐宋庭园,1984-03-13,1984-03
台湾拟定一项五年造林计划,1984-03-13,1984-03
《台湾作家小说选集》出版,1984-03-13,1984-03
台胞詹丽香工作出色连年评为先进工作者,1984-03-13,1984-03
改进工作作风为民排忧解难,1984-03-13,1984-03
“严肃处理”,1984-03-13,1984-03
找准问题边整边改,1984-03-13,1984-03
老将军推荐一篇好文章,1984-03-13,1984-03
提倡谈心,1984-03-13,1984-03
首先把自己的作风整好,1984-03-13,1984-03
长岭炼油厂剖析“老好人”,1984-03-13,1984-03
九江召开学习辅导员会议,1984-03-13,1984-03
重庆百货商店“外促内帮”边整边改,1984-03-13,1984-03
山东省军区全部交出超标准住房,1984-03-13,1984-03
丰县５０名党员倡议闺女出嫁不收彩礼,1984-03-13,1984-03
为何省掉“副”字称正职？,1984-03-13,1984-03
“王永春案件”的背后,1984-03-13,1984-03
埃夫伦总统讲话热烈欢迎李主席访土耳其,1984-03-13,1984-03
李主席到亚喀巴湾参观游览,1984-03-13,1984-03
林佳楣参观侯赛因王家医学城,1984-03-13,1984-03
亚喀巴,1984-03-13,1984-03
东盟继续支持柬埔寨人民的正义斗争,1984-03-13,1984-03
海湾合作委员会外交大臣会议闭幕,1984-03-13,1984-03
杰马耶勒和各派领导人抵瑞士参加和解会议,1984-03-13,1984-03
要为进一步发展日中关系做出贡献,1984-03-13,1984-03
昂纳克参观莱比锡国际博览会中国馆,1984-03-13,1984-03
莱比锡国际书籍博览会开幕,1984-03-13,1984-03
阿拉法特表示巴解希望同叙利亚改善关系,1984-03-13,1984-03
阿萨德任命三名副总统并组成新内阁,1984-03-13,1984-03
比利时电视台播放介绍中国情况的纪录片,1984-03-13,1984-03
斯里兰卡马尔瓦纳加马试验农场竣工,1984-03-13,1984-03
国际简讯,1984-03-13,1984-03
反对转嫁经济危机谴责跨国公司掠夺,1984-03-13,1984-03
罗马尼亚扶助农民扩大畜牧业生产,1984-03-13,1984-03
哥尼领导人会谈两国关系正常化问题,1984-03-13,1984-03
乌拉圭示威群众与警察冲突,1984-03-13,1984-03
共同体首脑会议前的紧锣密鼓,1984-03-13,1984-03
一些国家相继发生爆炸事件,1984-03-13,1984-03
昂纳克将访问联邦德国,1984-03-13,1984-03
法西两国首脑磋商解决捕鱼纠纷,1984-03-13,1984-03
葛罗米柯同美国大使讨论两国关系,1984-03-13,1984-03
美国二月份失业率下降,1984-03-13,1984-03
纽约股票价格继续看跌,1984-03-13,1984-03
科尔的美国之行,1984-03-13,1984-03
打电报告状的启示,1984-03-13,1984-03
凤还巢,1984-03-13,1984-03
让交响乐走进更多人的生活,1984-03-13,1984-03
大姐，您好！,1984-03-13,1984-03
北京地区天气预报,1984-03-14,1984-03
李主席开始对土耳其进行国事访问,1984-03-14,1984-03
武汉空军专机飞播造林,1984-03-14,1984-03
认真学习中指委七号通知部署对照检查,1984-03-14,1984-03
建立我国专利制度的良好开端（社论）,1984-03-14,1984-03
中宣部等单位举办形势报告会,1984-03-14,1984-03
烟台市农村商品经济迅速发展,1984-03-14,1984-03
探索企业管理现代化经验２０个企业确定为重点试点,1984-03-14,1984-03
头天听宣讲次日买汽车,1984-03-14,1984-03
沉绿湖的联想,1984-03-14,1984-03
中华人民共和国专利法,1984-03-14,1984-03
沈阳市郊三万人从事贩运活动,1984-03-14,1984-03
制止宰杀母猪确保生猪发展,1984-03-14,1984-03
对王瑞荣等如何处理了？,1984-03-14,1984-03
讲服务讲效率,1984-03-14,1984-03
庆祝张仲实翻译研究马列著作五十周年,1984-03-14,1984-03
江汉湖群消失一半保护湖泊刻不容缓,1984-03-14,1984-03
在危险关头与荣誉面前,1984-03-14,1984-03
中国科协和教育部将举办一系列活动,1984-03-14,1984-03
只有破除迷信社会才有进步,1984-03-14,1984-03
简讯,1984-03-14,1984-03
中国记协新闻学院即将招生,1984-03-14,1984-03
水泥厂两年关闭走投无路两农民承包经营起死回生,1984-03-14,1984-03
大农场一经改革致富有门众职工家庭联产扭亏为盈,1984-03-14,1984-03
内蒙古选手获全国古典式摔跤比赛七项冠军,1984-03-14,1984-03
朱庆元击败名将栾菊杰夺冠军,1984-03-14,1984-03
澳大利亚击剑队结束访华比赛,1984-03-14,1984-03
波兰乒乓球邀请赛结束,1984-03-14,1984-03
京港慈善长跑筹款一百八十多万港元,1984-03-14,1984-03
湖南省委决定查处一起严重违纪事件,1984-03-14,1984-03
山西省卫生厅解决五十多个问题,1984-03-14,1984-03
向中顾委委员贾庭三同志遗体告别,1984-03-14,1984-03
广州南京上海武汉等地举行纪念活动,1984-03-14,1984-03
积极开展工作,1984-03-14,1984-03
我国工业发达的大中城市有劳动能力的盲人基本得到安置,1984-03-14,1984-03
党和人民需要更多有胆有识的干部,1984-03-14,1984-03
某团为山区培养千余名农民科技骨干,1984-03-14,1984-03
图们市百货大楼倒塌事故责任者受到处理,1984-03-14,1984-03
吉林省政府授予陈鸽“革命烈士”称号,1984-03-14,1984-03
中组部劳动人事部北京市委联合举行周超事迹报告会,1984-03-14,1984-03
北京成立８，１００多个综合包户服务组,1984-03-14,1984-03
江都县七千多妇女参加文化技术学习,1984-03-14,1984-03
张治安以权谋私受留党察看一年处分,1984-03-14,1984-03
“娘家人”,1984-03-14,1984-03
关于税制改革的几个问题,1984-03-14,1984-03
中国社会主义青年团的创建及其活动,1984-03-14,1984-03
破坏选举罪,1984-03-14,1984-03
李先念主席离开安曼前往土耳其,1984-03-14,1984-03
约旦王储设家宴欢迎李先念主席,1984-03-14,1984-03
李主席说巴、约之行达到预期目的,1984-03-14,1984-03
李主席致电感谢侯赛因国王,1984-03-14,1984-03
李先念主席向叙利亚总统发致敬电,1984-03-14,1984-03
宫达非副外长举行记者招待会,1984-03-14,1984-03
李主席接见驻约旦使馆人员等,1984-03-14,1984-03
中约关系的新篇章,1984-03-14,1984-03
黎巴嫩全国和解会议在洛桑开幕,1984-03-14,1984-03
新的起步,1984-03-14,1984-03
阿利耶夫同叙领导人会谈中东局势,1984-03-14,1984-03
日中青年在行川岛国立公园联欢,1984-03-14,1984-03
阐述南当前的内外政策,1984-03-14,1984-03
西南非洲人民组织愿同南非直接谈判,1984-03-14,1984-03
南部非洲局势的新动向,1984-03-14,1984-03
美国反驳塔斯社对两国接触的评论,1984-03-14,1984-03
赞比亚总理呼吁联合国推动纳米比亚独立进程,1984-03-14,1984-03
各国计算机人才不足加紧普及计算机教育,1984-03-14,1984-03
坦桑支持莫桑比克和南非对话,1984-03-14,1984-03
坦桑执政党提出桑给巴尔总统候选人,1984-03-14,1984-03
美国开办“电子大学”,1984-03-14,1984-03
首航内罗毕,1984-03-14,1984-03
北京地区天气预报,1984-03-15,1984-03
整党中必须注意落实政策（社论）,1984-03-15,1984-03
埃夫伦总统举行盛大国宴欢迎李主席,1984-03-15,1984-03
李先念同埃夫伦会谈,1984-03-15,1984-03
胡耀邦会见美籍学者薛君度,1984-03-15,1984-03
安徽省委在整党中采取措施严肃查处,1984-03-15,1984-03
工商银行发放十亿贴息贷款发展名牌产品,1984-03-15,1984-03
简讯,1984-03-15,1984-03
把重庆建成开发大西南经济中心,1984-03-15,1984-03
共产党员李相元应得到支持,1984-03-15,1984-03
我国机械工业实行专业化协作改组,1984-03-15,1984-03
我国初步建成专利服务网,1984-03-15,1984-03
关于《中华人民共和国专利法（草案）》说明,1984-03-15,1984-03
张友渔代表人大法律委员会向六届全国人大常委会第四,1984-03-15,1984-03
次会议报告《中华人民共和国专利法（草案）》的审议结果,1984-03-15,1984-03
临安县农村建立群众性学校管理组织,1984-03-15,1984-03
只求出力不图出名情操高尚,1984-03-15,1984-03
一份受欢迎的英语教学小报,1984-03-15,1984-03
《白衣下的污垢》一文震动西安,1984-03-15,1984-03
救治毒蛇咬伤有新特效药,1984-03-15,1984-03
江苏推广生物能育秧新技术,1984-03-15,1984-03
中英科学合作协议在京签字,1984-03-15,1984-03
画家刘继卣追悼会在京举行,1984-03-15,1984-03
简讯,1984-03-15,1984-03
新书记顶歪风出绝招有送礼者公布姓名潘其兰上任致信下属,1984-03-15,1984-03
三女子搞对象明大义不恋城市独爱矿工张亚平姐妹远嫁铜山,1984-03-15,1984-03
运动员喜爱的好医生——何天祺,1984-03-15,1984-03
国际帆船联盟接纳中国帆船协会为成员,1984-03-15,1984-03
简讯,1984-03-15,1984-03
土中两国人民有着根深蒂固的友好关系,1984-03-15,1984-03
中土之间的友好合作关系必将得到新的发展,1984-03-15,1984-03
斯里兰卡新任大使向乌兰夫递交国书,1984-03-15,1984-03
中美联合经济委员会第四次会议即将在北京举行,1984-03-15,1984-03
中国残疾人福利基金会于今日成立,1984-03-15,1984-03
驻宁部队和民兵为中山陵植树１８万棵,1984-03-15,1984-03
赣州地区老红军安度晚年,1984-03-15,1984-03
黄华会见奥地利多瑙欧洲研究所经济代表团,1984-03-15,1984-03
姚依林会见菲律宾能源部长,1984-03-15,1984-03
王炳南会见美国客人,1984-03-15,1984-03
陈辛仁会见菲律宾儿童文学协会代表团,1984-03-15,1984-03
李鹏会见世界气象组织秘书长,1984-03-15,1984-03
陈慕华和菲律宾能源部长会谈,1984-03-15,1984-03
李鹏会见伊朗矿业金属部代表团,1984-03-15,1984-03
徐信宴请哥伦比亚客人,1984-03-15,1984-03
图们市百货大楼倒塌的缘由,1984-03-15,1984-03
转变中的关中农村,1984-03-15,1984-03
发达地区如何加速农业现代化？,1984-03-15,1984-03
农民更盼望产前信息指导,1984-03-15,1984-03
土地转包带来两家富,1984-03-15,1984-03
谈“管”,1984-03-15,1984-03
积淤造田的功臣——芦苇,1984-03-15,1984-03
立足本地资源发展传统产品,1984-03-15,1984-03
为离土不离乡农民开绿灯,1984-03-15,1984-03
李主席拜会土耳其总统埃夫伦,1984-03-15,1984-03
李主席向凯末尔陵墓献花圈,1984-03-15,1984-03
土耳其总理厄扎尔设午宴招待李主席,1984-03-15,1984-03
“土耳其共和国将永远屹立”,1984-03-15,1984-03
黎全国和解会议达成六点全面停火协议,1984-03-15,1984-03
泰副总理指出越南是东盟国家的威胁,1984-03-15,1984-03
苏联部长会议有几名第一副主席？,1984-03-15,1984-03
索马里总统视察我援建的建设工地,1984-03-15,1984-03
赞比亚总理赞扬中赞关系,1984-03-15,1984-03
中国和民主德国签订今年换货和付款协定,1984-03-15,1984-03
里根谈美国在中东的三大目标,1984-03-15,1984-03
国际简讯,1984-03-15,1984-03
蒙代尔和哈特争雄最后胜负尚难预料,1984-03-15,1984-03
追究拿人民的生命财产当儿戏者的责任！,1984-03-15,1984-03
四年如一日的义务清洁工,1984-03-15,1984-03
要加强对猎枪的管理,1984-03-15,1984-03
猪皮残脂化油充“食油”违法害人无人究,1984-03-15,1984-03
牲畜市场设在林区树木遭殃,1984-03-15,1984-03
脸上长癣有办法治吗？,1984-03-15,1984-03
皮革厂的刮皮油是工业用油应杜绝小贩谋利当食油出售,1984-03-15,1984-03
我敬爱的老舍同志,1984-03-15,1984-03
工后〔版画〕,1984-03-15,1984-03
“树碑立传”有何妨？,1984-03-15,1984-03
大姐，您好！,1984-03-15,1984-03
北京地区天气预报,1984-03-16,1984-03
江苏工农业总产值七年已翻番省委部署力争七年实现再翻番,1984-03-16,1984-03
把文化较低不懂政策的领导立即调出,1984-03-16,1984-03
中国残疾人福利基金会在京成立,1984-03-16,1984-03
边整边改纠正商业服务业中歪风,1984-03-16,1984-03
深切怀念人民艺术家老舍,1984-03-16,1984-03
沈阳市中小企业招标求贤众大学生揭榜献计,1984-03-16,1984-03
广州民航改进服务,1984-03-16,1984-03
简讯,1984-03-16,1984-03
敢于改造“小气候”,1984-03-16,1984-03
进一步发展商品生产和商品流通,1984-03-16,1984-03
发展核电弥补沿海地区能源不足,1984-03-16,1984-03
核电——既经济又安全的能源,1984-03-16,1984-03
山东农村初步形成职业技术教育网,1984-03-16,1984-03
强调多渠道培养软件人才,1984-03-16,1984-03
国防科工委把智力开发作为战略重点,1984-03-16,1984-03
山西省积极解决科技人员后顾之忧,1984-03-16,1984-03
《围墙》等二十篇作品获１９８３年全国优秀短篇小说奖,1984-03-16,1984-03
请做一个有道德的集邮者,1984-03-16,1984-03
治好“左视眼”盘县主动纠正打击专业户经商的错误有希望,1984-03-16,1984-03
搬掉“绊脚石”山阴严肃处理对抗党中央决策的干部不含糊,1984-03-16,1984-03
中国队首战告捷,1984-03-16,1984-03
两朵雪莲花,1984-03-16,1984-03
广西队将与辽宁队争夺冠军,1984-03-16,1984-03
我国女子标枪掷出好成绩,1984-03-16,1984-03
认真做好残疾人工作（社论）,1984-03-16,1984-03
中国残疾人福利基金会成员名单,1984-03-16,1984-03
要抓紧查处机关内部的经济犯罪案件,1984-03-16,1984-03
纠正律师依法履行职责遭逮捕冤案,1984-03-16,1984-03
无理逮捕律师事件的教训（国内短评）,1984-03-16,1984-03
中国残疾人福利基金会章程,1984-03-16,1984-03
欢迎尼泊尔全国评议会代表团,1984-03-16,1984-03
大安县两名中学生勇斗犯罪分子,1984-03-16,1984-03
中苏国境河流航行联合委员会第二十六次例会在黑河市举行,1984-03-16,1984-03
回忆和陈云同志在一起战斗的岁月,1984-03-16,1984-03
苏区职工运动的正确指导思想,1984-03-16,1984-03
书讯,1984-03-16,1984-03
李主席祝愿中土友谊万古长青,1984-03-16,1984-03
李主席观看土耳其民间舞蹈,1984-03-16,1984-03
发展中土关系维护世界和平,1984-03-16,1984-03
李主席参观阿纳多卢文明博物馆,1984-03-16,1984-03
宫达非等代表李主席向安卡拉大学赠图书,1984-03-16,1984-03
李主席接见我在土人员和留学生,1984-03-16,1984-03
旅澳柬埔寨人和越南人示威愤怒抗议阮基石到澳大利亚访问,1984-03-16,1984-03
呼吁世界各国不要卷入两伊战争,1984-03-16,1984-03
黎全国和解会议讨论政治和行政改革问题,1984-03-16,1984-03
我展品在莱比锡博览会荣获四枚金质奖章,1984-03-16,1984-03
我英文《中国集邮》杂志在拉巴斯获奖,1984-03-16,1984-03
埃及获准重新参加伊斯兰会议,1984-03-16,1984-03
菲律宾总统签署新选举法,1984-03-16,1984-03
南共联盟不赞成召开世界共产党会议,1984-03-16,1984-03
欧洲共同体在一些问题上取得进展,1984-03-16,1984-03
尼加拉瓜要求美国从中美洲撤军,1984-03-16,1984-03
在新技术革命中的日本,1984-03-16,1984-03
美国加强在中美洲地区的军事活动,1984-03-16,1984-03
军援与民主,1984-03-16,1984-03
日苏协商无结果葛罗米柯拒绝访日,1984-03-16,1984-03
浓笔重彩绘风情,1984-03-16,1984-03
愿我们有一个新的妇女观,1984-03-16,1984-03
春江〔中国画〕,1984-03-16,1984-03
老舍先生在重庆,1984-03-16,1984-03
大姐，您好！,1984-03-16,1984-03
怀念老舍,1984-03-16,1984-03
黄昏，在田野上（外一章）,1984-03-16,1984-03
北京地区天气预报,1984-03-17,1984-03
落实一号文件抓好春季生产（本报评论）,1984-03-17,1984-03
亿万农民欢欣鼓舞投入春季生产,1984-03-17,1984-03
李主席在安卡拉举行答谢宴会,1984-03-17,1984-03
四川粮食总产突破八百亿斤,1984-03-17,1984-03
顺德县社队企业贡献大产品年出口总值超亿元,1984-03-17,1984-03
运—12首次飞行表演,1984-03-17,1984-03
中曾根首相三月二十三日起访华,1984-03-17,1984-03
外国首脑来访恢复礼炮欢迎,1984-03-17,1984-03
贵州抓紧落实政策加快改革步伐,1984-03-17,1984-03
你们单位有无安振东？有无陈秀云？,1984-03-17,1984-03
永安林区大量木材面临变质铁道部门应该立即组织抢运,1984-03-17,1984-03
荒唐的悲剧,1984-03-17,1984-03
农业要跟踪世界最新技术（本报评论）,1984-03-17,1984-03
我国农业生物技术取得进展,1984-03-17,1984-03
“豆腐李”进贵阳,1984-03-17,1984-03
生物技术和农业,1984-03-17,1984-03
迅速查处贩卖无碘私盐问题,1984-03-17,1984-03
国务院颁布《国营企业成本管理条例》,1984-03-17,1984-03
全国三类物资交流会盛况喜人,1984-03-17,1984-03
让“巧妙机器”灵活地运转起来,1984-03-17,1984-03
如此“经济效益”,1984-03-17,1984-03
应该有点义务感,1984-03-17,1984-03
顾客要的是实情实话,1984-03-17,1984-03
奖在年终更好些,1984-03-17,1984-03
改革才能开创新局面（本报评论）,1984-03-17,1984-03
加强责任制扩大自主权,1984-03-17,1984-03
陕西普教工作有了“硬杠杠”,1984-03-17,1984-03
上海派出调查组检查知识分子政策落实情况,1984-03-17,1984-03
军地联合办学培育四化人才,1984-03-17,1984-03
北师大修建三一八烈士纪念碑,1984-03-17,1984-03
《全国短新闻选》即将出版,1984-03-17,1984-03
武汉开展“娃娃学计算机日”活动,1984-03-17,1984-03
主人做主农民梁新民献上四万元筑路费“新阔佬”慷慨解囊,1984-03-17,1984-03
鼠年捕鼠衡水面粉厂挖出十二个盗窃犯“粮耗子”束手就擒,1984-03-17,1984-03
全英羽毛球锦标赛中国队前景如何？,1984-03-17,1984-03
我雪橇协会被接纳为国际雪橇联合会会员,1984-03-17,1984-03
国家男篮中锋韩朋山因突发病去世,1984-03-17,1984-03
全英羽毛球锦标赛的由来,1984-03-17,1984-03
中国兵乓球队赢得访波比赛胜利,1984-03-17,1984-03
四川省轻工厅开会大吃大喝,1984-03-17,1984-03
要引以为戒（国内短评）,1984-03-17,1984-03
铁道部党组把对照检查着眼点放在开创新局面上,1984-03-17,1984-03
解决领导干部多占住房问题,1984-03-17,1984-03
武威地委在各项工作中贯彻整改精神,1984-03-17,1984-03
北京继续推行“门前三包”责任制,1984-03-17,1984-03
品德高尚——青年农民义务赡养两孤老,1984-03-17,1984-03
十分敬佩——日本友人隔海致函赞新风,1984-03-17,1984-03
叶飞与尼泊尔全国评议会代表团会谈,1984-03-17,1984-03
王震宴请日中友好议员联盟访华团,1984-03-17,1984-03
中英关于香港问题第二阶段第十轮会谈开始举行,1984-03-17,1984-03
吴学谦会见马达加斯加和斯里兰卡新大使,1984-03-17,1984-03
康克清会见美国朋友,1984-03-17,1984-03
胡锦涛会见叙利亚少年复兴先锋组织代表团,1984-03-17,1984-03
于厚德同志逝世,1984-03-17,1984-03
福建一批台属和原国民党国军政人员当选县级领导和政协负责人,1984-03-17,1984-03
为了维护空中安全和祖国荣誉,1984-03-17,1984-03
要以整党精神刹住不正之风,1984-03-17,1984-03
四川潼南塘坝区竟为区委书记女儿当干部搞突击入党,1984-03-17,1984-03
是着力解决问题的时候了！,1984-03-17,1984-03
重庆市委组织部的答复,1984-03-17,1984-03
边整边改端正党风,1984-03-17,1984-03
悼念死者也可以栽棵树,1984-03-17,1984-03
应使美景长存,1984-03-17,1984-03
不要在放蜂季节开会,1984-03-17,1984-03
邮寄稿件是否需要贴邮票？,1984-03-17,1984-03
久病盼康复良药寄深情,1984-03-17,1984-03
应向这样的好党员学习,1984-03-17,1984-03
割股献皮好医德,1984-03-17,1984-03
李主席访尼将为两国关系增添重要篇章,1984-03-17,1984-03
日中友好应成为世界各国和平共处的典范,1984-03-17,1984-03
朝鲜人民期待胡耀邦访朝,1984-03-17,1984-03
伊斯坦布尔十万人欢迎李主席,1984-03-17,1984-03
李主席会见外国驻土耳其外交使节,1984-03-17,1984-03
中土两国副总理举行第二轮会谈,1984-03-17,1984-03
土耳其积极发展畜牧业,1984-03-17,1984-03
