听取党内外意见搞好整党,1984-03-06,1984-03
学习没有走过场才能转入对照检查,1984-03-06,1984-03
党员的起码要求,1984-03-06,1984-03
悼英雄卜凤刚,1984-03-06,1984-03
“关系网”下的肮脏交易,1984-03-06,1984-03
改变知识分子入党难局面,1984-03-06,1984-03
在各地党刊上,1984-03-06,1984-03
减少干部流向大城市,1984-03-06,1984-03
黎巴嫩冲突各方达成停火协议,1984-03-06,1984-03
新型医用扫描机问世,1984-03-06,1984-03
民柬国民军第二次突袭暹粒市,1984-03-06,1984-03
柬埔寨民族解放运动建立新作战基地,1984-03-06,1984-03
真挚的友谊崇高的荣誉,1984-03-06,1984-03
伊斯兰会议组织警告美国不要把使馆迁到耶路撒冷,1984-03-06,1984-03
重申为纳米比亚独立而斗争,1984-03-06,1984-03
埃同意巴解组织研究中心设在开罗,1984-03-06,1984-03
塞内冈比亚邦联努力实现经济一体化,1984-03-06,1984-03
以色列飞机轰炸黎巴嫩中部在黎南部的以占领军遭袭击,1984-03-06,1984-03
伊朗议长说封闭海峡是伊朗的最后武器,1984-03-06,1984-03
巴基斯坦举办全国牲畜展览会,1984-03-06,1984-03
巴基斯坦和巴西要求外国军队立即撤出阿富汗,1984-03-06,1984-03
严惩杀害华侨女青年的凶手,1984-03-06,1984-03
尼日利亚一些宗教狂热分子掀起骚乱,1984-03-06,1984-03
中尼公路西藏境内一段已修复通车,1984-03-06,1984-03
我向中非派遣医疗队议定书在班吉签字,1984-03-06,1984-03
国际简讯,1984-03-06,1984-03
挪威首相说北欧国家应加强防务,1984-03-06,1984-03
三方会谈建议是为了开创统一新局面,1984-03-06,1984-03
光荣的小学教师,1984-03-06,1984-03
科尔呼吁美苏举行最高级会谈,1984-03-06,1984-03
乌干达成立国家科学院泰国将成立技术咨询处,1984-03-06,1984-03
法国五十五万人示威,1984-03-06,1984-03
英国政府与职工大会之争,1984-03-06,1984-03
酸雨杀人！,1984-03-06,1984-03
“真实性”小议,1984-03-06,1984-03
忆澜波,1984-03-06,1984-03
不愿同秋风絮语黄昏（外一首）,1984-03-06,1984-03
大姐，您好！,1984-03-06,1984-03
爱的期待,1984-03-06,1984-03
北京地区天气预报,1984-03-07,1984-03
六届人大常委会四次会议举行全体会,1984-03-07,1984-03
哈克总统举行盛大国宴招待李主席,1984-03-07,1984-03
哈克总统授予李主席‘巴基斯坦勋章’,1984-03-07,1984-03
中华人民共和国全国人民代表大会代表参加各国议会联盟代表团章程,1984-03-07,1984-03
“拿来主义”加快了经济发展,1984-03-07,1984-03
打破割据放手“拿来”（本报评论）,1984-03-07,1984-03
北京在十三陵开辟“国际友谊林”,1984-03-07,1984-03
一九八三年最佳邮票评选揭晓,1984-03-07,1984-03
劣棉充储备棉国家损失严重,1984-03-07,1984-03
认真学习贯彻党中央国务院指示黑龙江省林区放宽政策发展林业,1984-03-07,1984-03
昌图县动员全县人民造林护田,1984-03-07,1984-03
从五方面严格要求确保基建投资效果,1984-03-07,1984-03
林茂粮丰（国内短评）,1984-03-07,1984-03
平原多树木粮林齐丰收,1984-03-07,1984-03
严格管理爆炸物品（本报评论）,1984-03-07,1984-03
海南岛开发建设又有新发展,1984-03-07,1984-03
１．５万多名林业科技工作者将获“劲松奖”,1984-03-07,1984-03
湖南十万青年营造新林带,1984-03-07,1984-03
中华人民共和国民用爆炸物品管理条例,1984-03-07,1984-03
大胆起用有创见的实干家,1984-03-07,1984-03
首都女科技工作者纪念三八节,1984-03-07,1984-03
“新官”下基层“取经”阜阳组织县市领导考察农村搞商品生产,1984-03-07,1984-03
“泥腿”与学者“结亲”左权聘请农大教授担任顾问靠科学造林,1984-03-07,1984-03
各个赛区有好戏精彩激烈险象生,1984-03-07,1984-03
中日选手明年合登纳木那尼峰,1984-03-07,1984-03
国家体委把毽球列为比赛项目,1984-03-07,1984-03
巴中两国之间的友谊源远流长,1984-03-07,1984-03
中巴友谊有着牢固基础和强大生命力,1984-03-07,1984-03
张劲夫报告我国当前经济情况,1984-03-07,1984-03
举行庆祝“三八”妇女节茶话会,1984-03-07,1984-03
在京女台胞、台属、女归侨和侨眷座谈纪念“三八”节,1984-03-07,1984-03
姚依林会见世界银行副行长卡劳斯曼诺古,1984-03-07,1984-03
吴学谦会见布隆迪贵宾,1984-03-07,1984-03
杜润生就我国农村经济政策答中外记者问,1984-03-07,1984-03
刘华清会见巴基斯坦客人,1984-03-07,1984-03
一代革命女杰——危拱之,1984-03-07,1984-03
各国议会联盟,1984-03-07,1984-03
７００万斤被糟踏的储备棉的“申诉”,1984-03-07,1984-03
他们以劣棉充好棉坑害国家,1984-03-07,1984-03
在西藏推行太阳灶势在必行,1984-03-07,1984-03
积极采取措施，使甲级站名实相符,1984-03-07,1984-03
处理集体房屋不能把房基地一起卖掉,1984-03-07,1984-03
这笔帐往哪儿下？,1984-03-07,1984-03
李先念同齐亚·哈克结束会谈,1984-03-07,1984-03
友谊之树常青,1984-03-07,1984-03
中巴友好合作关系将不断发展,1984-03-07,1984-03
黎政府宣布废除黎以撤军协议,1984-03-07,1984-03
强调要继续战斗直到越南从柬撤走,1984-03-07,1984-03
民柬部队连续攻克十一个越军据点,1984-03-07,1984-03
黎实现停火居民纷纷返回家园,1984-03-07,1984-03
谢松结束访黎决定不久撤回法军,1984-03-07,1984-03
阿盟秘书长表示要继续努力结束两伊战争,1984-03-07,1984-03
阿利耶夫将于本月上半月访叙,1984-03-07,1984-03
日本发生七点九级强烈地震,1984-03-07,1984-03
国际简讯,1984-03-07,1984-03
非统组织部长理事会会议闭幕,1984-03-07,1984-03
水银般的女乡长,1984-03-07,1984-03
荣获“最崇高功勋”金牌的女医生,1984-03-07,1984-03
科尔和里根举行会谈,1984-03-07,1984-03
托恩说希望恢复阿拉伯—西欧对话,1984-03-07,1984-03
哈特在缅因州预选中再度获胜,1984-03-07,1984-03
比利时妇女游行要求工作权利,1984-03-07,1984-03
昏睡病疫苗试验研究成功,1984-03-07,1984-03
世界原子能发电站已达三百零二座,1984-03-07,1984-03
在“女性优先”的西方世界,1984-03-07,1984-03
山南山北长相忆,1984-03-07,1984-03
在慕尼黑霍夫勃劳豪斯啤酒店,1984-03-07,1984-03
常胜的人,1984-03-07,1984-03
北京地区天气预报,1984-03-08,1984-03
首都各界妇女集会纪念“三八”节,1984-03-08,1984-03
李主席在伊斯兰堡举行答谢宴会,1984-03-08,1984-03
继续大力抓好计划生育工作,1984-03-08,1984-03
卫生部表彰去年全国卫生先进工作者,1984-03-08,1984-03
近三百名白衣女战士获部颁荣誉证书,1984-03-08,1984-03
我国遗传工程研究中的一项突破性成果,1984-03-08,1984-03
摘掉这类“免战牌”,1984-03-08,1984-03
为祖国兴旺更好地发挥半边天作用,1984-03-08,1984-03
一个带有普遍性的大问题,1984-03-08,1984-03
勤劳致富的带头人——毛文华,1984-03-08,1984-03
福建一枝花,1984-03-08,1984-03
陈埭的启示,1984-03-08,1984-03
翘首盼回音,1984-03-08,1984-03
女营业员许玉慧,1984-03-08,1984-03
湖北省进行林业商品基地建设,1984-03-08,1984-03
兰州部队某团创建“百花园”,1984-03-08,1984-03
围场县抓“三定”促造林,1984-03-08,1984-03
张家口地区积极准备林木种子,1984-03-08,1984-03
此柜不该撤,1984-03-08,1984-03
鸡蛋汤与素什锦,1984-03-08,1984-03
因为我是外地客,1984-03-08,1984-03
一斤韭菜二两泥,1984-03-08,1984-03
“四大王”相会在北京,1984-03-08,1984-03
科普工作一定要与生产实践相结合,1984-03-08,1984-03
女兽医胡德昌,1984-03-08,1984-03
发扬老传统迎接新挑战,1984-03-08,1984-03
玉溪县六成以上儿童接受学前教育,1984-03-08,1984-03
简讯,1984-03-08,1984-03
治山管山养山尤溪建立山林承包制为后代造福,1984-03-08,1984-03
选才育才用才正定选送农民进大学向未来投资,1984-03-08,1984-03
凯歌杯女子足球邀请赛在沪揭幕,1984-03-08,1984-03
我国决定参加国际伤残人运动会,1984-03-08,1984-03
中澳击剑选手在京比赛两场,1984-03-08,1984-03
世界女子足球发展简介,1984-03-08,1984-03
围绕党的总任务做好妇女工作（社论）,1984-03-08,1984-03
中国妇女革命的先驱,1984-03-08,1984-03
党和国家领导人及各界人士向韩练成遗体告别,1984-03-08,1984-03
外交部举行新闻发布会,1984-03-08,1984-03
黄华会见英国客人,1984-03-08,1984-03
宋平会见荷兰经济合作代表团,1984-03-08,1984-03
简讯,1984-03-08,1984-03
《明镜》周刊记者因违反我国法律被要求离境,1984-03-08,1984-03
朝鲜驻华大使举行记者招待会,1984-03-08,1984-03
李梦华会见联邦德国体联主席,1984-03-08,1984-03
朝鲜红十字会代表团离京回国,1984-03-08,1984-03
中国比利时贷款协定在京签字,1984-03-08,1984-03
罗干会见比利时总工会代表团,1984-03-08,1984-03
江苏集体建筑企业为什么有竞争力,1984-03-08,1984-03
从山寨到城市,1984-03-08,1984-03
苦乐辨,1984-03-08,1984-03
长兴乡尝到发展建材业甜头,1984-03-08,1984-03
包干到户拨响思乡曲,1984-03-08,1984-03
“庄稼的粮食”,1984-03-08,1984-03
王屋山区乡乡通电,1984-03-08,1984-03
拉合尔市民热烈欢迎李先念主席,1984-03-08,1984-03
李主席离伊斯兰堡到拉合尔访问,1984-03-08,1984-03
“花园之城”盛情激荡,1984-03-08,1984-03
田纪云副总理和巴基斯坦财长会谈,1984-03-08,1984-03
李主席接见我在巴专家和使馆人员,1984-03-08,1984-03
田纪云副总理代表我红十字会向阿富汗难民赠药品,1984-03-08,1984-03
中曾根首相会见我大使谈访华目的,1984-03-08,1984-03
让更多的巴基斯坦人了解中国,1984-03-08,1984-03
走向社会的埃及妇女,1984-03-08,1984-03
印度总理接见我工会代表团,1984-03-08,1984-03
我红十字会向佛得角赠款,1984-03-08,1984-03
切实保护妇女儿童合法权益虐待妻子的刘福贵受到惩处,1984-03-08,1984-03
一条烟钱见精神,1984-03-08,1984-03
晏东升为何不愿当劳模？,1984-03-08,1984-03
好一个“不受限制”,1984-03-08,1984-03
决不让损坏文物的事再次发生,1984-03-08,1984-03
清洁工人觅知音盼望有人搭鹊桥,1984-03-08,1984-03
采取措施，保护国家矿产资源,1984-03-08,1984-03
要保护穿山甲,1984-03-08,1984-03
净乐文物何处去垒田垫墙修粪坑,1984-03-08,1984-03
漫话“妇道”,1984-03-08,1984-03
午休〔中国画〕,1984-03-08,1984-03
红叶,1984-03-08,1984-03
大姐，您好！,1984-03-08,1984-03
我现在是妈妈了（二首）,1984-03-08,1984-03
晒黄花的少女,1984-03-08,1984-03
“多情”的岁月,1984-03-08,1984-03
北京地区天气预报,1984-03-09,1984-03
李先念主席抵达安曼受到热烈欢迎,1984-03-09,1984-03
带头开展谈心活动努力造成民主气氛,1984-03-09,1984-03
听取关于赵紫阳访问美加两国情况报告,1984-03-09,1984-03
中外妇女在京欢聚庆佳节,1984-03-09,1984-03
真实反映变革中的农村现实,1984-03-09,1984-03
且慢戴帽,1984-03-09,1984-03
临西县请王继英出台管理国营牧场,1984-03-09,1984-03
风险共担利润均沾,1984-03-09,1984-03
江西集中资金发展电子工业,1984-03-09,1984-03
用经济方法解决工商矛盾（国内短评）,1984-03-09,1984-03
“未必人间无好汉”,1984-03-09,1984-03
一业兴百业旺,1984-03-09,1984-03
国务院关于合作商业组织和个人贩运农副产品若干问题的规定,1984-03-09,1984-03
简讯,1984-03-09,1984-03
今年农村科普工作的五项任务,1984-03-09,1984-03
为了孩子们的健康,1984-03-09,1984-03
卫一项便民利民的重要改革,1984-03-09,1984-03
荣获一九八三年全国卫生先进工作者称号的女医务人员名单,1984-03-09,1984-03
我国已初步形成妇幼卫生保健网,1984-03-09,1984-03
陆海空三军文艺战士为中国少儿基金会募捐义演,1984-03-09,1984-03
京剧演员刘美君为福建儿童捐款,1984-03-09,1984-03
各民主党派、工商联书画联展开幕,1984-03-09,1984-03
昔日刀耕火种今朝由穷变富黎寨苗村盛赞责任制好！,1984-03-09,1984-03
去年濒临停产  现在扭亏为盈新官上任拿出新招术高！,1984-03-09,1984-03
杨荫浏先生追悼会在京举行,1984-03-09,1984-03
全国足球甲级队联赛８日攻势减弱,1984-03-09,1984-03
第一届全国青少年运动会将于明年十月在河南举行,1984-03-09,1984-03
天津市四十万妇女参加“三八健康杯”体育活动通讯赛,1984-03-09,1984-03
我选手夺澳大利亚墨尔本国际田径赛男女跳高金牌,1984-03-09,1984-03
我国选手获匈牙利国际举重赛一项冠军,1984-03-09,1984-03
《世界体操》公布去年世界优秀男女体操选手名单,1984-03-09,1984-03
灵宝县委未整先改,1984-03-09,1984-03
广东建委改变领导作风,1984-03-09,1984-03
维护妇女儿童合法权益  法制宣传月活动取得成效,1984-03-09,1984-03
天津劳动局刹招工中的歪风,1984-03-09,1984-03
勤奋俭朴的妇女干部,1984-03-09,1984-03
两名林学院毕业生当上正副县长,1984-03-09,1984-03
台湾海峡每月通过船只达千艘以上,1984-03-09,1984-03
胡启立会见日本客人,1984-03-09,1984-03
朱学范会见比利时总工会代表团,1984-03-09,1984-03
张劲夫会见联邦德国客人,1984-03-09,1984-03
中朝鸭绿江图们江航运合作委员会第二十三次会议协议书在沈阳签订,1984-03-09,1984-03
中国伊朗政府经济贸易代表团会谈纪要签字,1984-03-09,1984-03
中等城市经济发展战略的若干问题,1984-03-09,1984-03
收回汉口、九江英租界,1984-03-09,1984-03
《广州经济年鉴》出版,1984-03-09,1984-03
李先念主席离开拉合尔前往约旦,1984-03-09,1984-03
李主席致电感谢巴基斯坦总统,1984-03-09,1984-03
旁遮普省省督宴请李先念主席,1984-03-09,1984-03
齐亚·哈克总统陪同林佳楣田纪云参观,1984-03-09,1984-03
李主席访问巴基斯坦完全达到预期目的,1984-03-09,1984-03
李主席向海湾四国元首发致敬电,1984-03-09,1984-03
历久而弥坚,1984-03-09,1984-03
普拉宁茨主席接见凌云和杨德中,1984-03-09,1984-03
中保签订今年交换货物和付款协定,1984-03-09,1984-03
中国联邦德国签署民用空间科技合作议定书,1984-03-09,1984-03
中国出口商品展览会在曼谷开幕,1984-03-09,1984-03
民主德国部长会议副主席接见我计委考察组,1984-03-09,1984-03
中哥交换文化科技合作协定批准书,1984-03-09,1984-03
稳步发展的约旦,1984-03-09,1984-03
阿拉伯妇女今昔,1984-03-09,1984-03
再次呼吁举行“三方会谈”,1984-03-09,1984-03
瑞士警察制服劫机者,1984-03-09,1984-03
华约提出冻结和削减军费新建议北约各成员国态度冷淡反应谨慎,1984-03-09,1984-03
法国与欧洲共同体成员国频繁磋商,1984-03-09,1984-03
阿拉伯舆论普遍欢迎废除黎以协议,1984-03-09,1984-03
欧洲经济共同体对今年经济前景表示乐观,1984-03-09,1984-03
“阿丽阿娜”火箭把通讯卫星送入轨道,1984-03-09,1984-03
叙利亚内阁辞职,1984-03-09,1984-03
国际民航组织谴责苏击落南朝鲜客机,1984-03-09,1984-03
美开展普及癌症预防知识运动,1984-03-09,1984-03
西班牙加入共同体问题取得进展,1984-03-09,1984-03
“荐”说,1984-03-09,1984-03
栖息〔版画〕,1984-03-09,1984-03
“糖县”斗门散记,1984-03-09,1984-03
大姐，您好！,1984-03-09,1984-03
为什么要听交响乐,1984-03-09,1984-03
种子,1984-03-09,1984-03
北京地区天气预报,1984-03-10,1984-03
领导认真步子扎实抓紧整改继续深入,1984-03-10,1984-03
侯赛因国王举行盛大国宴欢迎李主席,1984-03-10,1984-03
山东省交流县级主要领导干部,1984-03-10,1984-03
李先念同侯赛因举行会谈,1984-03-10,1984-03
搞好县级主要领导干部的交流（本报评论）,1984-03-10,1984-03
年内调整好普通中学领导班子,1984-03-10,1984-03
以绿化美化新成绩迎接国庆３５周年,1984-03-10,1984-03
“猫鼠同乐”,1984-03-10,1984-03
立志改革开拓前进,1984-03-10,1984-03
杨波要求全国轻工企业认真学习,1984-03-10,1984-03
公开纠正打击专业户张勇等的错误,1984-03-10,1984-03
“撞到南墙”该回头（国内短评）,1984-03-10,1984-03
珍惜自己的光荣历史，为党为人民作出新的贡献,1984-03-10,1984-03
唱当今农村生活演农村新人新事,1984-03-10,1984-03
图书货郎,1984-03-10,1984-03
中央领导同志赞扬现代豫剧《金鸡引凤》,1984-03-10,1984-03
搬柜台下乡丰城开设集镇良种市场农民备耕无须愁,1984-03-10,1984-03
请商贩进城广州打破水产独家经营市民吃鱼不再难,1984-03-10,1984-03
对学生进行劳动教育,1984-03-10,1984-03
评弹“丽调”创始人徐丽仙逝世,1984-03-10,1984-03
赛场岂容撒野,1984-03-10,1984-03
参加全英羽毛球公开赛的中国羽毛球队组成,1984-03-10,1984-03
世界室内撑竿跳跳得最高的人——蒂·维涅隆,1984-03-10,1984-03
世界上跑得最快的女子——阿什福德,1984-03-10,1984-03
约旦仍然和阿拉伯民族一起为巩固独立而斗争,1984-03-10,1984-03
漫云女子不英雄为《人物》妇女专号作,1984-03-10,1984-03
中国坚决支持阿拉伯各国和巴勒斯坦人民正义斗争,1984-03-10,1984-03
一人洒热血众人脱险境,1984-03-10,1984-03
马达加斯加大使向乌兰夫副主席递交国书,1984-03-10,1984-03
薄一波会见法中委员会主席德·维勒朋,1984-03-10,1984-03
严济慈会见日本东京大学代表团,1984-03-10,1984-03
李鹏会见澳大利亚客人,1984-03-10,1984-03
处决犯罪分子赵国煊前后,1984-03-10,1984-03
关于利用外资的几个认识问题,1984-03-10,1984-03
推荐《逻辑与语言学习》杂志,1984-03-10,1984-03
对消费要进行正确的引导,1984-03-10,1984-03
坚决同刑讯逼供罪作斗争,1984-03-10,1984-03
《政治常识手册》再版,1984-03-10,1984-03
简讯,1984-03-10,1984-03
李主席参观约旦烈士纪念堂,1984-03-10,1984-03
日长思故友路远人更亲,1984-03-10,1984-03
约旦重视职业培训,1984-03-10,1984-03
一个新的转析（国际短评）,1984-03-10,1984-03
民柬国民军攻打马德望省蒙县县城,1984-03-10,1984-03
中日签订建立食品流通开发委员会协议书,1984-03-10,1984-03
马科斯总统和西哈努力克亲王会谈柬埔寨形势,1984-03-10,1984-03
法塔赫召开中央委员会会议,1984-03-10,1984-03
新西兰代总理宴请我妇女代表团,1984-03-10,1984-03
黎巴嫩第二次全国和解会议即将在瑞士举行,1984-03-10,1984-03
日本前外相宫泽遭暴徒袭击受伤,1984-03-10,1984-03
国际简讯,1984-03-10,1984-03
各国共产党应独立选择实现社会主义道路,1984-03-10,1984-03
日内瓦裁军谈判会议讨论禁止化学武器,1984-03-10,1984-03
苏美在亚太地区的军事对峙,1984-03-10,1984-03
非洲国家工会呼吁重视妇女作用,1984-03-10,1984-03
西欧妇女示威要求和平与保障妇女权利,1984-03-10,1984-03
他们的愿望实现了,1984-03-10,1984-03
摇钱树,1984-03-10,1984-03
文化与绿化,1984-03-10,1984-03
古迹新颜,1984-03-10,1984-03
浮山剪纸,1984-03-10,1984-03
山乡秀色,1984-03-10,1984-03
上高县农村文化工作好,1984-03-10,1984-03
防止集邮“公害”,1984-03-10,1984-03
文艺新书,1984-03-10,1984-03
北京地区天气预报,1984-03-11,1984-03
中纪委工作会议要求全党抓紧工作通过整党使党风在今年有明显好转,1984-03-11,1984-03
奥贝达特首相举行晚宴招待李主席,1984-03-11,1984-03
中央六单位举办讲座受欢迎,1984-03-11,1984-03
胡耀邦李先念致电金日成深切哀悼金一副主席逝世,1984-03-11,1984-03
朝鲜国家副主席金一逝世,1984-03-11,1984-03
胜利油田打出一口高产油井,1984-03-11,1984-03
赵紫阳称赞重庆经济体制改革效益好,1984-03-11,1984-03
中国评剧院二团试行体制改革充满生机,1984-03-11,1984-03
总结经验，推动文艺改革健康发展,1984-03-11,1984-03
“取经人”猛增步鑫生应接不暇不学习先进游“仙境”太不应该,1984-03-11,1984-03
难以招架的“学习”,1984-03-11,1984-03
天光集成电路厂起飞记,1984-03-11,1984-03
知识就是财富,1984-03-11,1984-03
国务院关于农民个人或联户购置机动车船和拖拉机经营运输业的若干规定,1984-03-11,1984-03
这样的作风值得赞扬,1984-03-11,1984-03
两亿斤粉丝求买主,1984-03-11,1984-03
编者按,1984-03-11,1984-03
太仓县疏通农村商品流通渠道,1984-03-11,1984-03
各地交通部门要认真贯彻国务院《规定》,1984-03-11,1984-03
五百农民走出“娘子关”,1984-03-11,1984-03
改善经营管理杜绝木材霉烂,1984-03-11,1984-03
预防为主城乡兼顾,1984-03-11,1984-03
新秀,1984-03-11,1984-03
沙市职业学校学生超过普通高中学生,1984-03-11,1984-03
北京市中青年演员调演评奖揭晓,1984-03-11,1984-03
湘鄂川黔五地（州）美术摄影作品在京展出,1984-03-11,1984-03
云南发现象形文字东巴舞谱,1984-03-11,1984-03
台湾数百件艺术精品沉海底,1984-03-11,1984-03
政策开脑筋大队长取出床下巨额存款壮大胆搞生产,1984-03-11,1984-03
科学插翅膀致富户具备较好智力结构有文化富得快,1984-03-11,1984-03
从百辆农民摩托车赛想到的,1984-03-11,1984-03
沙县建立农村体育活动基金会,1984-03-11,1984-03
青年农民周玉玲办家庭俱乐部,1984-03-11,1984-03
中国队获金牌数名列第二,1984-03-11,1984-03
中国青年足球队出征参加亚青锦标赛,1984-03-11,1984-03
全国春季马拉松竞走比赛揭幕,1984-03-11,1984-03
辽宁二队获“火车牌”杯足球邀请赛冠军,1984-03-11,1984-03
北京市表彰一批群体先进集体和个人,1984-03-11,1984-03
为普及自行车运动献计献策,1984-03-11,1984-03
推荐点名批评县委的干部为纪委副书记,1984-03-11,1984-03
积极开展‘警民共建精神文明’活动,1984-03-11,1984-03
总政举行周超同志先进事迹报告会,1984-03-11,1984-03
台湾宣布开放对大陆千余种转口货品进口,1984-03-11,1984-03
海军水面舰艇学校学员奋力灭火,1984-03-11,1984-03
天津环卫局副局长王辅成掏粪十一年,1984-03-11,1984-03
邢台市领导带头拆违章自建房院,1984-03-11,1984-03
中国坚决反对美国政府违反协议,1984-03-11,1984-03
某团党委实行抓基层包干责任制,1984-03-11,1984-03
一小时十四分的战斗,1984-03-11,1984-03
吴学谦会见联合国协调代表和一些驻华使节,1984-03-11,1984-03
中国残疾人福利基金会举行理事会议,1984-03-11,1984-03
赡养老人是儿女应尽的义务,1984-03-11,1984-03
郭有水林富荣被判刑,1984-03-11,1984-03
北京西城区房管局副局长郭宗鼎被逮捕,1984-03-11,1984-03
把建材工业办成有活力的产业,1984-03-11,1984-03
改造老材料发展新材料,1984-03-11,1984-03
水泥工业要有个新发展,1984-03-11,1984-03
平板玻璃前景灿烂,1984-03-11,1984-03
别具一格的现代建筑陶瓷,1984-03-11,1984-03
水泥今昔谈,1984-03-11,1984-03
工业废渣利用大有可为,1984-03-11,1984-03
新型建筑材料,1984-03-11,1984-03
玻璃纤维,1984-03-11,1984-03
玻璃钢,1984-03-11,1984-03
中空玻璃,1984-03-11,1984-03
李主席观看约旦大型军乐队表演,1984-03-11,1984-03
约旦首相同田纪云副总理会谈,1984-03-11,1984-03
约旦政府决定今年为“安曼绿化年”,1984-03-11,1984-03
法国数百万公务员总罢工要求保障购买力,1984-03-11,1984-03
民柬国民军突袭暹粒市获重大战果,1984-03-11,1984-03
泰副总理说侵柬越军对泰国构成威胁,1984-03-11,1984-03
越南企图在东盟国家间制造分裂,1984-03-11,1984-03
美国在加拿大进行第一次巡航导弹试验,1984-03-11,1984-03
西南非洲人民组织创建人托伊沃同努乔马会谈,1984-03-11,1984-03
苏部长会议第一副主席访问叙利亚,1984-03-11,1984-03
蒙博托视察我援建的制糖联合企业工地,1984-03-11,1984-03
倪志福在印度举行答谢招待会,1984-03-11,1984-03
“今日中国”摄影展览在安卡拉开幕,1984-03-11,1984-03
英国进行首次在基地外部署巡航导弹演习,1984-03-11,1984-03
国际简讯,1984-03-11,1984-03
巴西围绕总统选举的一场争论,1984-03-11,1984-03
为了过去的未来,1984-03-11,1984-03
中国音乐在瑞典,1984-03-11,1984-03
中年起步的女作家,1984-03-11,1984-03
一些国家的“植树节”,1984-03-11,1984-03
引人入胜的“骆驼角斗”,1984-03-11,1984-03
在绿色之国的原野上,1984-03-11,1984-03
塞罕坝  美丽的坝,1984-03-11,1984-03
北京地区天气预报,1984-03-12,1984-03
领导干部带头深刻剖析自己是第一条,1984-03-12,1984-03
榆林地区林草建设出现十大喜人变化,1984-03-12,1984-03
李先念在安曼会见阿拉法特,1984-03-12,1984-03
一年更胜一年绿（社论）,1984-03-12,1984-03
发挥互助精神实行群防群治,1984-03-12,1984-03
赵紫阳在遵义红军山种罗汉松,1984-03-12,1984-03
右玉县成为“三北”地区绿化县,1984-03-12,1984-03
“接力棒”传到自己手里时,1984-03-12,1984-03
刘家庄大队兴办沼气保护植被,1984-03-12,1984-03
山东放宽荒山承包政策,1984-03-12,1984-03
西吉两年植树种草６４万多亩,1984-03-12,1984-03
内江地区建成柑桔新产区,1984-03-12,1984-03
闽台青年共造友谊林,1984-03-12,1984-03
植树节史话,1984-03-12,1984-03
从灾难中醒悟,1984-03-12,1984-03
“大锅饭”是怎样端走的？,1984-03-12,1984-03
王素华荣获“振兴中华刻苦读书标兵”称号,1984-03-12,1984-03
我国报刊发行出现新趋势,1984-03-12,1984-03
北京“交响音乐欣赏会”举行百期庆祝活动,1984-03-12,1984-03
