北京地区天气预报,1984-03-01,1984-03
关于深入扎实地开展绿化祖国运动的指示,1984-03-01,1984-03
六届人大常委会第四次会议开始举行,1984-03-01,1984-03
石家庄市支持农村发展商品生产,1984-03-01,1984-03
科尔总理将于今年十月访华,1984-03-01,1984-03
宜阳县委保护个体户合法权益,1984-03-01,1984-03
山西有十九个专业户交售商品粮逾十万斤,1984-03-01,1984-03
简讯,1984-03-01,1984-03
开创绿化事业新局面的动员令（社论）,1984-03-01,1984-03
高青县实行投标承包加速绿化,1984-03-01,1984-03
全国公路两旁植树二亿多株,1984-03-01,1984-03
高安县组织劳力进山造林,1984-03-01,1984-03
绿色长城锁“沙龙”,1984-03-01,1984-03
尽快使科学技术转化为生产力,1984-03-01,1984-03
十指断离  九指再植,1984-03-01,1984-03
用科学战胜迷信,1984-03-01,1984-03
湖北拨款二千万元维修县医院危房,1984-03-01,1984-03
空军通报表彰一批科技工作者,1984-03-01,1984-03
一两滴血能检查肝癌的新法,1984-03-01,1984-03
北京市卫生防病工作有进展,1984-03-01,1984-03
赤峰氟病区人民吃上低氟水,1984-03-01,1984-03
今年全国艺术院校招生四月开始,1984-03-01,1984-03
川剧艺术表演家阳友鹤病逝,1984-03-01,1984-03
喜讯黄河口北岸探区打出高产油气井胜利油田前景美好,1984-03-01,1984-03
放心贵州省政法机关保护两户权与利勤劳致富有人撑腰,1984-03-01,1984-03
我跳伞队获墨西哥国际杯赛一项冠军,1984-03-01,1984-03
室内与室外田径区别何在？,1984-03-01,1984-03
全国足球甲级队联赛成绩公报,1984-03-01,1984-03
中澳击剑选手羊城比赛各显其能,1984-03-01,1984-03
象棋特级大师胡荣华捧走昆化杯,1984-03-01,1984-03
电子工业部破除“会八股”树立新会风,1984-03-01,1984-03
四川省委统战部抓紧落实政策,1984-03-01,1984-03
吉林省直机关领导干部带头归还拖欠的公款,1984-03-01,1984-03
“念念有词”与“不甚了了”,1984-03-01,1984-03
全社会齐心协力维护妇女儿童合法权益,1984-03-01,1984-03
学习华山抢险英雄的献身精神,1984-03-01,1984-03
赵紫阳分别会见四国驻华大使,1984-03-01,1984-03
中苏第四轮磋商将自三月十二日起在莫斯科举行,1984-03-01,1984-03
叶飞会见日本客人,1984-03-01,1984-03
为了党的事业,1984-03-01,1984-03
上海广州等地广大青少年积极参加便民利民和植树种草活动,1984-03-01,1984-03
长沙市一学雷锋服务队被授予“青年精神文明建设红旗”称号,1984-03-01,1984-03
坚决反对弄虚作假,1984-03-01,1984-03
余干县破获一起集体贪污案,1984-03-01,1984-03
栽下“富”根留后人,1984-03-01,1984-03
建议适当发展些杂树杂果,1984-03-01,1984-03
小毛驴、拖拉机及其它,1984-03-01,1984-03
春风催我绿荒山,1984-03-01,1984-03
允许买卖活树好,1984-03-01,1984-03
树种知识,1984-03-01,1984-03
我国首次采到油茶花蜜,1984-03-01,1984-03
防风固沙的火炬树,1984-03-01,1984-03
很不美的行为！,1984-03-01,1984-03
黎总统到大马士革同叙总统会谈,1984-03-01,1984-03
安理会再次推迟表决关于黎问题的法国建议,1984-03-01,1984-03
南共联盟中央全会讨论稳定经济问题,1984-03-01,1984-03
阿拉法特说约巴会谈将为双方合作奠定基础,1984-03-01,1984-03
阿游击队上月频繁出击歼敌一批有生力量,1984-03-01,1984-03
耶路撒冷市中心发生爆炸,1984-03-01,1984-03
英数十万人抗议政府禁止工会在通讯总部活动,1984-03-01,1984-03
日社会党党代会提出建设“新社会党”,1984-03-01,1984-03
喀麦隆判处前总统阿希乔死刑,1984-03-01,1984-03
特殊公民,1984-03-01,1984-03
横滨司法当局无理判决六名旅日侨胞有罪,1984-03-01,1984-03
指责苏未按正当程序拦截南朝鲜客机,1984-03-01,1984-03
血泪的控诉,1984-03-01,1984-03
温哥华的“中山公园”,1984-03-01,1984-03
横行霸道的党委书记——曹月德,1984-03-01,1984-03
怎能把工厂当领地,1984-03-01,1984-03
一个也没“照顾”,1984-03-01,1984-03
支农要想到一个“早”字,1984-03-01,1984-03
请为农村购买了电视机的人想点办法,1984-03-01,1984-03
一面镜子,1984-03-01,1984-03
经过维修，象个学校的样子了！,1984-03-01,1984-03
绵绵泾河水,1984-03-01,1984-03
换一个“三三制”,1984-03-01,1984-03
闽南的风,1984-03-01,1984-03
雪落在中国的土地上,1984-03-01,1984-03
走黎寨,1984-03-01,1984-03
话剧借鉴外国戏剧漫谈,1984-03-01,1984-03
北京地区天气预报,1984-03-02,1984-03
国营林场职工承包荒山造林是加快绿化祖国的极好办法,1984-03-02,1984-03
增进了解相互学习加深友谊发展合作,1984-03-02,1984-03
国家把电子工业放到战略重点地位,1984-03-02,1984-03
刘国生是怎样承包荒山造林的？,1984-03-02,1984-03
中布两国互相帮助合作前景广阔,1984-03-02,1984-03
赵紫阳会见吉布尼,1984-03-02,1984-03
浙江上百万能工巧匠出省劳动,1984-03-02,1984-03
眉山组织十万民工整治公路,1984-03-02,1984-03
积极地协调地发展电子工业（本报评论）,1984-03-02,1984-03
广东省农副产品价格稳中有降,1984-03-02,1984-03
农家用上计算器,1984-03-02,1984-03
养猫灭鼠,1984-03-02,1984-03
“拐子香油”进城镇落户记,1984-03-02,1984-03
首都财贸部门决心治差,1984-03-02,1984-03
赞为勤劳致富农民壮胆,1984-03-02,1984-03
京郊已有四个单位订购六架,1984-03-02,1984-03
投入一元产出九元多,1984-03-02,1984-03
养羊的目的“不是开动物园！”,1984-03-02,1984-03
要“变着法儿”卖,1984-03-02,1984-03
空房变“银行”,1984-03-02,1984-03
汨罗江边的金桔,1984-03-02,1984-03
认真查处医药商品流通中的歪风,1984-03-02,1984-03
进忠言当诤友,1984-03-02,1984-03
积极推进改革迎接新的挑战,1984-03-02,1984-03
镇原县文教局长张呈祥被清除出党,1984-03-02,1984-03
空军领导机关举行周超事迹报告会,1984-03-02,1984-03
诤友难得,1984-03-02,1984-03
兰州大学决定成立西北开发综合研究所,1984-03-02,1984-03
动员社会力量改善中小学办学条件,1984-03-02,1984-03
莫把庐山变“楼山”,1984-03-02,1984-03
独资开设车站三岔口寿宁县农民李典伟方便过客受表扬,1984-03-02,1984-03
四天处理问题一大堆浙江计经委负责人现场办公效率高,1984-03-02,1984-03
全国篮球冬训检查比赛结束,1984-03-02,1984-03
中国女篮访罗比赛三战全胜,1984-03-02,1984-03
全英羽毛球锦标赛公布种子选手名单,1984-03-02,1984-03
简讯,1984-03-02,1984-03
福州部队党委提倡知错早改,1984-03-02,1984-03
济南部队党委强调领导带头整改,1984-03-02,1984-03
文明礼貌月第一天的上海南京路,1984-03-02,1984-03
浙江省外办党组成员争取做到“三带头”,1984-03-02,1984-03
香港舆论指出这是重弹“三脚凳”老调,1984-03-02,1984-03
张劲夫会见联邦德国下萨克森州经济代表团,1984-03-02,1984-03
北京空军植树造林一年比一年好,1984-03-02,1984-03
教授上码头为旅客治病,1984-03-02,1984-03
米勒上校举行建军节电影酒会,1984-03-02,1984-03
在一起起婚姻案面前,1984-03-02,1984-03
人民法院的一项重要职责,1984-03-02,1984-03
降低物化劳动消耗,1984-03-02,1984-03
平型关战役,1984-03-02,1984-03
《统计学理论研究》评介,1984-03-02,1984-03
《中国国民党“一大”六十周年纪念论文集》出版,1984-03-02,1984-03
《毛泽东早期哲学思想探原》出版,1984-03-02,1984-03
《逻辑与智慧》出版,1984-03-02,1984-03
安理会多数赞成法国建议但苏联否决,1984-03-02,1984-03
平壤举行报告会纪念人民起义六十五周年,1984-03-02,1984-03
约巴达成共同行动的基本协议,1984-03-02,1984-03
贝鲁特西区发生一起严重爆炸事件,1984-03-02,1984-03
阿拉法特说他的安曼之行非常重要,1984-03-02,1984-03
批评印尼人士最近关于柬埔寨问题的言论,1984-03-02,1984-03
美舆论说美国要同黎政府拉开距离,1984-03-02,1984-03
美国保证继续向泰国提供军援,1984-03-02,1984-03
两伊仍在南部战线激战,1984-03-02,1984-03
阿尔及利亚开全国发展会议,1984-03-02,1984-03
欢迎第五批日本孤儿回国寻亲团,1984-03-02,1984-03
毛里塔尼亚承认阿拉伯撒哈拉民主共和国,1984-03-02,1984-03
摩洛哥重申对西撒哈拉问题立场,1984-03-02,1984-03
西欧金价因两伊战争升级而急剧上涨,1984-03-02,1984-03
黑非洲再次面临干旱和粮荒,1984-03-02,1984-03
世界面临沙漠化威胁,1984-03-02,1984-03
科尔与英、法、意等国领导人会谈,1984-03-02,1984-03
欧洲共同体开展信息技术研究追赶美日,1984-03-02,1984-03
西欧迎接新技术革命的挑战,1984-03-02,1984-03
意大利领导人支持欧洲一体化进程,1984-03-02,1984-03
特鲁多辞去加拿大自由党领袖职务,1984-03-02,1984-03
戈尔巴乔夫强调提高国民经济效益,1984-03-02,1984-03
苏联宣布二百海里经济区,1984-03-02,1984-03
联邦德国的核电工业,1984-03-02,1984-03
大地和海洋,1984-03-02,1984-03
和老金絮话,1984-03-02,1984-03
书店好事,1984-03-02,1984-03
不要忽视书法普及教育,1984-03-02,1984-03
雪封林海,1984-03-02,1984-03
迟了的赞扬,1984-03-02,1984-03
“看人下菜碟”,1984-03-02,1984-03
北京地区天气预报,1984-03-03,1984-03
以整党精神贯彻知识分子政策,1984-03-03,1984-03
十三陵林场１４名工人承包荒山造林,1984-03-03,1984-03
整党领导工作责任落实到人,1984-03-03,1984-03
给农村商品生产插上有力的翅膀（社论）,1984-03-03,1984-03
简讯,1984-03-03,1984-03
孝感各县建立“两户一体”服务公司,1984-03-03,1984-03
万里会见日本新闻代表团,1984-03-03,1984-03
不平坦的路，光明的路,1984-03-03,1984-03
众英雄抢救落水儿童受表彰王德恒光荣献身芳名留人间,1984-03-03,1984-03
王英公社发展“十小”生产改变面貌,1984-03-03,1984-03
经手尿素五十万不开后门卖一斤,1984-03-03,1984-03
此处后门何日堵？,1984-03-03,1984-03
“十小”生产大有潜力（国内短评）,1984-03-03,1984-03
巴中县渔溪区“十小”生产欣欣向荣,1984-03-03,1984-03
改灶节柴是农村节能重点,1984-03-03,1984-03
电脑进入我国邮电通信和管理领域,1984-03-03,1984-03
武钢应用计算机管理生产推动企业技术改造,1984-03-03,1984-03
有管有活疏通渠道,1984-03-03,1984-03
香港财政司预测今年香港经济继续增长,1984-03-03,1984-03
改革见成效科研出新貌,1984-03-03,1984-03
瀚海驯水二十春,1984-03-03,1984-03
体育深入家庭家庭需要体育,1984-03-03,1984-03
农科院根据农村商品生产需要开展科研,1984-03-03,1984-03
我国农村科普事业迅猛发展,1984-03-03,1984-03
微波、卫星等先进通信手段日渐发挥效能,1984-03-03,1984-03
上海还有一百多名大学毕业生拒不服从分配,1984-03-03,1984-03
加强对子女教育培养四化有用之才,1984-03-03,1984-03
账应该怎样算,1984-03-03,1984-03
干部交流山东县级领导服从调动三天到任,1984-03-03,1984-03
菜农挑战江西冬瓜大王设奖打擂百元悬赏,1984-03-03,1984-03
深切怀念王泰吉同志,1984-03-03,1984-03
各族人民要学习卜凤刚,1984-03-03,1984-03
万里等领导同志参观北京多国医疗器械展览,1984-03-03,1984-03
吴学谦访问缅甸马来西亚后回到北京,1984-03-03,1984-03
精神文明哨兵  祖国“南大门”,1984-03-03,1984-03
王震会见日本客人,1984-03-03,1984-03
谷牧会见苏联工商会主席,1984-03-03,1984-03
中国工会代表团离京赴亚非六国访问,1984-03-03,1984-03
李鹏会见加拿大众议员汉密尔顿,1984-03-03,1984-03
布隆迪贵宾离京赴平壤,1984-03-03,1984-03
朝鲜驻华大使向我工程技术人员授勋,1984-03-03,1984-03
最高人民法院代表团赴印度参加国际会议,1984-03-03,1984-03
向组织如实反映情况竟受到压制,1984-03-03,1984-03
多情子弟,1984-03-03,1984-03
怎能以感情亲疏论是非,1984-03-03,1984-03
孤寡老人感谢党,1984-03-03,1984-03
新的一年新的路风,1984-03-03,1984-03
为了远方的病人,1984-03-03,1984-03
拖斗卡车见难不救无道德解放牌车解危为安风格高,1984-03-03,1984-03
不能让这里的悲剧重演！,1984-03-03,1984-03
一定严格执行商品供应政策,1984-03-03,1984-03
对乱收旅客住宿介绍费的现象已进行整顿,1984-03-03,1984-03
为边远地区读者邮购图书想点办法,1984-03-03,1984-03
长城到底有多长？,1984-03-03,1984-03
河内为什么掀起新的反华浪潮？,1984-03-03,1984-03
约巴公报强调要继续对话,1984-03-03,1984-03
杰马耶勒总统结束访叙回国,1984-03-03,1984-03
民柬国民军突袭越军重要据点韦连镇,1984-03-03,1984-03
炳总理说越南侵柬威胁东南亚安全,1984-03-03,1984-03
苏在阿富汗瓦罕地区建机场,1984-03-03,1984-03
国际简讯,1984-03-03,1984-03
苏联在金兰湾和岘港增强海空军力量,1984-03-03,1984-03
新加坡加快住宅建设,1984-03-03,1984-03
赞扬中国在控制人口增长方面的成就,1984-03-03,1984-03
中日和平利用原子能合作协定第二轮会谈结束,1984-03-03,1984-03
我古代传统技术展览会在西雅图开幕,1984-03-03,1984-03
我中联部向刚果党校赠送毛选等著作,1984-03-03,1984-03
动画片《鹬蚌相争》在国际电影节获奖,1984-03-03,1984-03
我红十字会向赤道几内亚赠一百吨大米,1984-03-03,1984-03
伦敦成立中国电影欣赏社,1984-03-03,1984-03
苦果,1984-03-03,1984-03
阿根廷呼吁不结盟运动制止军备竞赛,1984-03-03,1984-03
巴西乌拉圭总统强调切实有效地裁军,1984-03-03,1984-03
非统部长理事会支持莫安两国与南非接触,1984-03-03,1984-03
利用信息和计算技术发展经济,1984-03-03,1984-03
南非非洲人国民大会重申为自决权利继续斗争,1984-03-03,1984-03
尼加拉瓜抗议美支持反政府分子袭击港口,1984-03-03,1984-03
哈特在新罕布什尔州预选中获胜,1984-03-03,1984-03
联邦德国的核电工业,1984-03-03,1984-03
苏联用手术治疗近视眼成功,1984-03-03,1984-03
科普创作和精神文明,1984-03-03,1984-03
送歌到基层,1984-03-03,1984-03
郭沫若手书甲骨文,1984-03-03,1984-03
风云气派,1984-03-03,1984-03
侯宝林的“一、二、三、四”,1984-03-03,1984-03
打开世界知识的窗口,1984-03-03,1984-03
山村农民自建文化宫,1984-03-03,1984-03
文艺新书,1984-03-03,1984-03
北京地区天气预报,1984-03-04,1984-03
众英雄可敬新民风可喜,1984-03-04,1984-03
我国财经干部必须更新知识,1984-03-04,1984-03
走在前列当好绿化祖国尖兵,1984-03-04,1984-03
国务院发布统一实行法定计量单位命令,1984-03-04,1984-03
采金不被金迷心,1984-03-04,1984-03
我国第一个天然狩猎场对外开放,1984-03-04,1984-03
偃师发掘出商代早期都城遗址,1984-03-04,1984-03
张副段长动用“专车”为子接新娘运煤列车停站让路春运被干扰,1984-03-04,1984-03
三江平原“农垦项目”建设取得良好开端,1984-03-04,1984-03
“保护伞”可以打破,1984-03-04,1984-03
统一实行法定计量单位是件大事（本报评论）,1984-03-04,1984-03
就我国统一实行法定计量单位,1984-03-04,1984-03
国家计量局负责人答新华社记者问,1984-03-04,1984-03
法定计量单位名词解释,1984-03-04,1984-03
中华人民共和国法定计量单位表,1984-03-04,1984-03
这也是生产力的解放,1984-03-04,1984-03
计划生育工作任务仍十分艰巨,1984-03-04,1984-03
艺高胆大,1984-03-04,1984-03
万里、方毅接见中华医学会代表,1984-03-04,1984-03
调整科研课题推广移植科研成果,1984-03-04,1984-03
王震会见石本正一先生,1984-03-04,1984-03
简讯,1984-03-04,1984-03
慧眼识骏马无畏护良才女伯乐陈秀云当哈尔滨二轻局领导,1984-03-04,1984-03
存心促流通  放手辟新路原平县众农民办合作汽车运输公司,1984-03-04,1984-03
朋友，不妨试试看,1984-03-04,1984-03
体育给我们一家带来健康和欢乐,1984-03-04,1984-03
我国首次举行大型室内田径赛,1984-03-04,1984-03
国家女子足球集训队１∶０胜广东队,1984-03-04,1984-03
他比父母还亲,1984-03-04,1984-03
体育动态,1984-03-04,1984-03
《冠军的童年》深受少年儿童喜爱,1984-03-04,1984-03
交通部边整边改讲求实效,1984-03-04,1984-03
以雷锋精神搞好对照检查,1984-03-04,1984-03
向各地以及居住在国外的藏胞祝贺藏历新年,1984-03-04,1984-03
三小时解决了四年没解决的“老大难”问题,1984-03-04,1984-03
沉绿湖上的春雷,1984-03-04,1984-03
谷牧会见美国经济法律专家代表团,1984-03-04,1984-03
国务院任免一批国家工作人员,1984-03-04,1984-03
姬鹏飞会见巴基斯坦文官学院代表团,1984-03-04,1984-03
中蒙一九八四年换货议定书在京签字,1984-03-04,1984-03
达县地区罐头厂李作乾被依法逮捕,1984-03-04,1984-03
进一步认识城市建设和管理好城市,1984-03-04,1984-03
谈谈城市规划,1984-03-04,1984-03
重点建设与城市要协调发展,1984-03-04,1984-03
什么叫“城市化”？,1984-03-04,1984-03
邮电通信和城市现代化,1984-03-04,1984-03
我国城市情况点滴,1984-03-04,1984-03
中国城市科学研究会,1984-03-04,1984-03
民柬抵抗力量几乎全部收复马亨山南部地区,1984-03-04,1984-03
加强政治外交行动加速纳米比亚独立,1984-03-04,1984-03
叙利亚要求黎反对派同它协调立场,1984-03-04,1984-03
莫桑比克和南非达成互不侵犯条约协议,1984-03-04,1984-03
柬埔寨问题不容许通过“区域会谈”解决,1984-03-04,1984-03
孟加拉国将举行总统和议会选举,1984-03-04,1984-03
契尔年科谈苏联内外政策,1984-03-04,1984-03
强烈谴责外国军队对主权国家的入侵和占领,1984-03-04,1984-03
印度即将开始修筑印孟边界铁丝网,1984-03-04,1984-03
亚洲和大洋洲软件协会将于６月成立,1984-03-04,1984-03
第３２届北欧理事会年会闭幕,1984-03-04,1984-03
美拒绝给苏奥委会官员办理入境签证,1984-03-04,1984-03
联邦德国的核电工业,1984-03-04,1984-03
国际简讯,1984-03-04,1984-03
新技术产业在美国崛起,1984-03-04,1984-03
枕带山湖雄且杰,1984-03-04,1984-03
在印度寻访父亲的友人,1984-03-04,1984-03
好莱坞的“梦”,1984-03-04,1984-03
斯德哥尔摩拾零,1984-03-04,1984-03
议会的“小听差”,1984-03-04,1984-03
快速发展中的蛇口,1984-03-04,1984-03
北京地区天气预报,1984-03-05,1984-03
关于对照检查阶段必须注意的若干事项的通知,1984-03-05,1984-03
按照经济合理原则就地加工农副产品,1984-03-05,1984-03
增进了解发展友谊（社论）,1984-03-05,1984-03
遵义会议的若干情节已经弄清,1984-03-05,1984-03
李小平获男子个人全能冠军,1984-03-05,1984-03
“天天开门，时时供应”,1984-03-05,1984-03
首都高等院校开展“文明大学生日”活动,1984-03-05,1984-03
把绿化祖国的锣鼓敲得更响些,1984-03-05,1984-03
屋顶花园景色美,1984-03-05,1984-03
继续放宽政策发展立体林业,1984-03-05,1984-03
浙江省城乡加快绿化步伐,1984-03-05,1984-03
江西省农户争包荒山造林,1984-03-05,1984-03
解放军指战员积极参加植树活动,1984-03-05,1984-03
绥宁县鼓励农民向荒山投资,1984-03-05,1984-03
信息社会与光纤通信,1984-03-05,1984-03
鹈鹕,1984-03-05,1984-03
迅速发展的国外光纤通信技术,1984-03-05,1984-03
小资料,1984-03-05,1984-03
光纤通信在我国,1984-03-05,1984-03
从光电话到光纤通信,1984-03-05,1984-03
光在通信上的妙用,1984-03-05,1984-03
源流不乱古籍生辉,1984-03-05,1984-03
敢碰硬黔西县委刹不正之风“三板斧”开路,1984-03-05,1984-03
靠科学孤岛新镇选最优方案“两家人”联合,1984-03-05,1984-03
中国队以４：１战胜朝鲜队,1984-03-05,1984-03
六支部队女篮在沈阳角逐,1984-03-05,1984-03
薄一波会见游泳、跳水健儿,1984-03-05,1984-03
张成仁在平凡岗位上奋斗终生,1984-03-05,1984-03
驻京部队积极参加首都文明建设,1984-03-05,1984-03
吉林设市长电话室为民解忧,1984-03-05,1984-03
南京四万民兵上街为民服务,1984-03-05,1984-03
团中央决定表彰２０６个青少年学雷锋先进组织,1984-03-05,1984-03
西安纪念王泰吉烈士就义５０周年,1984-03-05,1984-03
保定市委坚持“无会议日”制度,1984-03-05,1984-03
边境护耕,1984-03-05,1984-03
科尔沁草原深处的爱民曲,1984-03-05,1984-03
马辛春宴请巴基斯坦海军参谋学院代表团,1984-03-05,1984-03
康克清会见联合国儿童基金会欧洲国家全国委员会代表团,1984-03-05,1984-03
摩洛哥大使为哈桑二世即位２３周年举行招待会,1984-03-05,1984-03
中国古巴签订海运合作协议书,1984-03-05,1984-03
日方向我转让微型汽车生产技术合同签字,1984-03-05,1984-03
日本消费合作社联合会代表团举行答谢宴会,1984-03-05,1984-03
十几万家公司有名无实各有目的,1984-03-05,1984-03
黄季陆通过海外学者收集史料,1984-03-05,1984-03
台湾规划七个环境保护区,1984-03-05,1984-03
台湾渔业步履维艰,1984-03-05,1984-03
山地文化园区筹建缓慢,1984-03-05,1984-03
药贩卖假药医生用禁品,1984-03-05,1984-03
台湾新建林森纪念堂,1984-03-05,1984-03
客家歌手唱新词,1984-03-05,1984-03
台大育成大陆猕猴桃,1984-03-05,1984-03
台湾一艘货轮爆炸,1984-03-05,1984-03
来信,1984-03-05,1984-03
炎州旅怀,1984-03-05,1984-03
实事求是，做好财经工作,1984-03-05,1984-03
“灌输”浅议,1984-03-05,1984-03
什么是诬告陷害罪,1984-03-05,1984-03
巴中传统友谊必将进一步发展和加强,1984-03-05,1984-03
巴基斯坦重视发展农业取得成就,1984-03-05,1984-03
巴西举行盛大狂欢节十万游客参加,1984-03-05,1984-03
国际原子能机构赞扬巴和平利用核能,1984-03-05,1984-03
杰马耶勒同反对派领导人和夏蒙会谈,1984-03-05,1984-03
舒尔茨承认美在黎受挫,1984-03-05,1984-03
谢松访黎巴嫩讨论撤回法军问题,1984-03-05,1984-03
匈牙利重视个体商贩作用并加强管理,1984-03-05,1984-03
美国欢迎契尔年科要同美对话的提法,1984-03-05,1984-03
朝抗议美机侵犯朝鲜北方领空,1984-03-05,1984-03
南苏签订经济和科技合作议定书,1984-03-05,1984-03
世界规模最大的旅游博览会在西柏林开幕,1984-03-05,1984-03
踏步不前的斯德哥尔摩会议,1984-03-05,1984-03
我科教片《蓝色的血液》在贝尔格莱德获奖,1984-03-05,1984-03
国际简讯,1984-03-05,1984-03
关于传记文学,1984-03-05,1984-03
生活是文学艺术之源,1984-03-05,1984-03
看电视《戏曲集锦》,1984-03-05,1984-03
长篇小说《台湾人三部曲》出版,1984-03-05,1984-03
时刻牢记社会主义的文艺方向,1984-03-05,1984-03
大姐，您好！,1984-03-05,1984-03
董老的一首佚诗,1984-03-05,1984-03
北京地区天气预报,1984-03-06,1984-03
李主席抵伊斯兰堡受到隆重热烈欢迎,1984-03-06,1984-03
人大常委委员审议专利法草案,1984-03-06,1984-03
共产党人的胸怀,1984-03-06,1984-03
陈秀云被任命为哈尔滨二轻局党委副书记,1984-03-06,1984-03
李先念同齐亚·哈克举行第一轮会谈,1984-03-06,1984-03
我们需要千千万万个陈秀云（本报评论）,1984-03-06,1984-03
开展国产机电产品质量评论,1984-03-06,1984-03
为发展农村大好形势提出三项倡议,1984-03-06,1984-03
制止在骊山风景名胜区乱占地乱建设,1984-03-06,1984-03
甘肃国营工业层层签订经济责任书,1984-03-06,1984-03
主管部门也要建立责任制（国内短评）,1984-03-06,1984-03
承包兑现厂长受奖,1984-03-06,1984-03
改革出成果联营出效益,1984-03-06,1984-03
宁波绣服厂上海丝绸进出口公司联营效果显著,1984-03-06,1984-03
“军中无戏言”,1984-03-06,1984-03
积极开发农村青年智力资源,1984-03-06,1984-03
书柜前的文明青年,1984-03-06,1984-03
毛守白教授获“里昂·伯尔纳基金奖”,1984-03-06,1984-03
中国科学院科学基金申请和管理办法有新规定,1984-03-06,1984-03
请关心我们的入党问题,1984-03-06,1984-03
推广农业新技术回乡知青显身手,1984-03-06,1984-03
就地取“才”,1984-03-06,1984-03
新疆发现冷水型筳类化石,1984-03-06,1984-03
全社会都要重视少儿思想品德教育,1984-03-06,1984-03
山西省加快落实知识分子政策的步伐,1984-03-06,1984-03
解决家在农村的科技人员夫妇分居问题,1984-03-06,1984-03
新农药多灭灵大显神通,1984-03-06,1984-03
县委书记充“经纪人”江西万年请专业户进城谈生意成交快,1984-03-06,1984-03
高校毕业当“火头军”山西财院由大学生留校管食堂面貌改,1984-03-06,1984-03
我国速滑的主要差距在哪里？,1984-03-06,1984-03
我选手又获巴黎体操大奖赛四个单项冠军,1984-03-06,1984-03
奋飞在银色的跑道上,1984-03-06,1984-03
保定地区开创军民共建精神文明新局面,1984-03-06,1984-03
各级机关应逐步做到定编定人,1984-03-06,1984-03
不该发生的奇闻,1984-03-06,1984-03
邓颖超和国务院机关女工作人员共庆“三八”节,1984-03-06,1984-03
铁道部第三工程局党委改变对张敬荣陶来根的处分,1984-03-06,1984-03
王震说中曾根访华定会受到热烈欢迎,1984-03-06,1984-03
姚依林会见南斯拉夫经济代表团,1984-03-06,1984-03
李鹏会见日本客人,1984-03-06,1984-03
李鹏会见英国太古有限公司代表团,1984-03-06,1984-03
女归侨司徒桂美担任贵阳市副市长,1984-03-06,1984-03
刘文彦拦惊马光荣献身,1984-03-06,1984-03
整党的方法与态度,1984-03-06,1984-03
