三月素描,1984-03-22,1984-03
剪毛,1984-03-22,1984-03
采桑女,1984-03-22,1984-03
太阳岛,1984-03-22,1984-03
北京地区天气预报,1984-03-23,1984-03
山西省同苏浙沪发展经济协作,1984-03-23,1984-03
立经济责任状一年税制翻番,1984-03-23,1984-03
李主席四国之行取得圆满成功,1984-03-23,1984-03
日本国内阁总理大臣中曾根康弘,1984-03-23,1984-03
石岛港迅速恢复客运,1984-03-23,1984-03
耿飚将率人大代表团赴瑞士,1984-03-23,1984-03
热烈欢迎中曾根总理大臣（社论）,1984-03-23,1984-03
新农村的“信息”,1984-03-23,1984-03
赵紫阳会见赵浩生,1984-03-23,1984-03
１３．５万安培铝电解工业试验通过鉴定,1984-03-23,1984-03
漳泽电厂动工兴建,1984-03-23,1984-03
长江河蟹在深圳人工孵化育苗成功,1984-03-23,1984-03
昆明大学成立,1984-03-23,1984-03
三位农民跨县承包新绛水泥厂,1984-03-23,1984-03
认识三江平原开发三江平原,1984-03-23,1984-03
三江平原简介,1984-03-23,1984-03
是农民的本领大吗？,1984-03-23,1984-03
急功近利非好事,1984-03-23,1984-03
成都铁路分局积极运输春耕物资,1984-03-23,1984-03
长春处理生产低劣酱油香肠者,1984-03-23,1984-03
建立灵活的农村信息网,1984-03-23,1984-03
石头“经理”赵玉花,1984-03-23,1984-03
海南春来早,1984-03-23,1984-03
应该改革的“制度”,1984-03-23,1984-03
“十年一贯制”的牛骨汤,1984-03-23,1984-03
“停业盘点”应当改,1984-03-23,1984-03
临走，他只想穿一件白大褂……,1984-03-23,1984-03
让人民群众打分,1984-03-23,1984-03
天津摸索出一条技术进步新路子,1984-03-23,1984-03
我研究乙型肝炎病毒基因工程获重大进展,1984-03-23,1984-03
简讯,1984-03-23,1984-03
金不换八百“回头浪子”登台受奖抚顺市失足青年喜逢甘霖,1984-03-23,1984-03
一团糟几多“武林高手”挥拳打人平顶山第一医院乱得出奇,1984-03-23,1984-03
中泰青年足球队今日决战,1984-03-23,1984-03
中国选手只有栾劲未能过关,1984-03-23,1984-03
全国网球甲组各队在昆明交战,1984-03-23,1984-03
足坛新人——张焱,1984-03-23,1984-03
国家男篮抽调两名高中锋集训,1984-03-23,1984-03
中国冰球队平日本队负于民主德国队,1984-03-23,1984-03
两个月查处３０多个问题,1984-03-23,1984-03
敢犯“众怒”,1984-03-23,1984-03
保定市实行“无会议日”制度,1984-03-23,1984-03
捷克斯洛伐克大使向乌兰夫递交国书,1984-03-23,1984-03
韦国清会见赞比亚青年代表团,1984-03-23,1984-03
陈慕华同巴西财政部长会谈,1984-03-23,1984-03
李鹏会见荷兰经济代表团,1984-03-23,1984-03
张爱萍会见法国宇宙航空工业集团主席,1984-03-23,1984-03
谷牧会见联邦德国政府民航代表团,1984-03-23,1984-03
胡锦涛会见赞比亚青年代表团,1984-03-23,1984-03
陈慕华宴请巴西政府经济代表团,1984-03-23,1984-03
蒋经国李登辉“当选”台湾“总统”和“副总统”,1984-03-23,1984-03
中国银行行名协议在京签字,1984-03-23,1984-03
揭穿“乐山地下金库”的骗局,1984-03-23,1984-03
尽快起用一代新人,1984-03-23,1984-03
略论工业合作的性质、特点和发展问题,1984-03-23,1984-03
《一九○○年以来的美国史》出版,1984-03-23,1984-03
李主席在加德满都观看文艺演出,1984-03-23,1984-03
安倍说日中关系处在历史上最好时期,1984-03-23,1984-03
李主席会见驻尼泊尔使馆人员,1984-03-23,1984-03
友情飞越高难计,1984-03-23,1984-03
白宫宣布美国总统里根四月底访华,1984-03-23,1984-03
什特劳加尔总理说将努力使捷中关系正常化,1984-03-23,1984-03
通迪凯尔广场巡礼,1984-03-23,1984-03
旅日华侨举行代表会议,1984-03-23,1984-03
拉多维奇和舒科维奇接见江西友好代表团,1984-03-23,1984-03
日中文化交流协会常任理事白石凡病逝,1984-03-23,1984-03
中日科技合作的发展,1984-03-23,1984-03
国际简讯,1984-03-23,1984-03
美国航空母舰与苏联核潜艇相撞,1984-03-23,1984-03
苏联油轮在尼加拉瓜水域触雷受伤,1984-03-23,1984-03
来自萨尔瓦多的报道,1984-03-23,1984-03
纪念消除种族歧视国际日会议在日内瓦举行,1984-03-23,1984-03
苏航空母舰将同古巴海军举行军事演习,1984-03-23,1984-03
以色列沙米尔政府被迫同意提前大选,1984-03-23,1984-03
非洲议会联盟第七次会议闭幕,1984-03-23,1984-03
华约国家军事演习结束,1984-03-23,1984-03
尼迈里表示愿意同埃塞俄比亚和解,1984-03-23,1984-03
几内亚总统杜尔访问阿尔及利亚,1984-03-23,1984-03
尼泊尔改变能源结构,1984-03-23,1984-03
沙特阿拉伯重视利用太阳能,1984-03-23,1984-03
非洲九国治理海洋污染,1984-03-23,1984-03
津巴布韦建立第一个国立幼儿园,1984-03-23,1984-03
卡塔尔为“油源枯竭”作准备,1984-03-23,1984-03
印度新建一座天文馆,1984-03-23,1984-03
俳句十首,1984-03-23,1984-03
一个潜藏着的主旨,1984-03-23,1984-03
修瑞娟为什么怕表扬？,1984-03-23,1984-03
漫谈国际音乐比赛,1984-03-23,1984-03
林间组曲,1984-03-23,1984-03
《历史文学》出版,1984-03-23,1984-03
来函照登,1984-03-23,1984-03
北京地区天气预报,1984-03-24,1984-03
赵紫阳总理主持隆重仪式和宴会,1984-03-24,1984-03
热烈欢迎中曾根首相等日本贵宾,1984-03-24,1984-03
李先念主席回到昆明,1984-03-24,1984-03
六届政协二次会议五月十二日召开,1984-03-24,1984-03
赵紫阳总理和中曾根首相举行会谈,1984-03-24,1984-03
授予张达伍“献身海军事业的模范干部”称号,1984-03-24,1984-03
两个超级大国应大幅度裁减核武器,1984-03-24,1984-03
设立“中日友好二十一世纪委员会”,1984-03-24,1984-03
成功的访问（社论）,1984-03-24,1984-03
上海手表工业向何处去？,1984-03-24,1984-03
电子计算机进入我国纺织工业,1984-03-24,1984-03
世界气象日大会在北京举行,1984-03-24,1984-03
香甜四溢的边寨,1984-03-24,1984-03
层层签订“责任状”是一个创造,1984-03-24,1984-03
农业气象,1984-03-24,1984-03
去年立下“责任状”今年得奖受表扬,1984-03-24,1984-03
郏县在“两户一体”农民中发展党员,1984-03-24,1984-03
农业生产也要提高效益,1984-03-24,1984-03
坑害农民国法难容,1984-03-24,1984-03
不许用种子害人（国内短评）,1984-03-24,1984-03
检查落实知识分子政策讲求实效,1984-03-24,1984-03
他的事业在草原,1984-03-24,1984-03
扬子鳄和密河鳄有亲缘关系,1984-03-24,1984-03
就经济管理刊授联合大学招生问题答读者,1984-03-24,1984-03
请出“老大”办事不难,1984-03-24,1984-03
日本将向我国提供新的政府贷款,1984-03-24,1984-03
精益求精得银质奖章不止步横峰某厂动员对优质产品挑刺,1984-03-24,1984-03
山外有山当水稻状元盼高手辽宁农民悬赏向全省同行桃战,1984-03-24,1984-03
中国青年足球队击败泰国队荣获冠军,1984-03-24,1984-03
我选手两男四女进入前八名,1984-03-24,1984-03
汤姆斯怀和尤伯杯羽毛球赛分组情况,1984-03-24,1984-03
全国足球甲级队联赛第一阶段比赛结束,1984-03-24,1984-03
赵紫阳总理的讲话,1984-03-24,1984-03
中曾根总理大臣的答谢词,1984-03-24,1984-03
邓颖超会见中曾根首相和夫人,1984-03-24,1984-03
中日友好２１世纪委员会中方人员名单,1984-03-24,1984-03
设立中日友好二十一世纪委员会是中日关系史上的一件大事,1984-03-24,1984-03
康克清会见中曾根首相夫人,1984-03-24,1984-03
包头市委严肃对待群众批评认真查处干部多占住房问题,1984-03-24,1984-03
寻“猪屁股”,1984-03-24,1984-03
编者按,1984-03-24,1984-03
决不能让他们逃脱罪责,1984-03-24,1984-03
社会主义岂容“‘家鬼’害家人”！,1984-03-24,1984-03
必须给予法律制裁,1984-03-24,1984-03
把为外宾和侨胞制装工作搞起来,1984-03-24,1984-03
贝壳综合利用大有可为,1984-03-24,1984-03
是慰问伤病员，还是“犒劳”慰问者,1984-03-24,1984-03
一个专业户的苦恼,1984-03-24,1984-03
手头缺粮票农民出门难,1984-03-24,1984-03
窗飞雪婴儿冻得哭门不开老农干着急,1984-03-24,1984-03
鸣放礼炮是怎么回事？,1984-03-24,1984-03
千万个雷锋在成长,1984-03-24,1984-03
又是他们兄妹三人,1984-03-24,1984-03
李主席离加德满都回国致电感谢尼泊尔国王,1984-03-24,1984-03
日本建成亚洲最长的吊桥,1984-03-24,1984-03
中曾根首相启程来华访问,1984-03-24,1984-03
就三千名日本青年今秋访华举行座谈会,1984-03-24,1984-03
中尼发表新闻公报,1984-03-24,1984-03
拙劣的表演,1984-03-24,1984-03
春风金阳迎宾来,1984-03-24,1984-03
民柬电台说阮基石的“新方针”是骗人花招,1984-03-24,1984-03
西哈努克高度评价柬爱国力量的胜利,1984-03-24,1984-03
葛罗米柯会见钱其琛,1984-03-24,1984-03
阿盟秘书长接见我大使,1984-03-24,1984-03
我红十字会向博茨瓦纳受灾人民赠款,1984-03-24,1984-03
制止美国和苏联在欧洲部署导弹,1984-03-24,1984-03
博茨瓦纳和南非就安全问题举行会谈,1984-03-24,1984-03
联合国反对种族隔离特委会举行会议,1984-03-24,1984-03
努乔马强调继续为纳米比亚独立而斗争,1984-03-24,1984-03
日本报纸对美苏舰艇相撞事件表示严重不安,1984-03-24,1984-03
贝鲁特西区又发生武装冲突,1984-03-24,1984-03
苏联决定在服务行业中扩大经营自主权,1984-03-24,1984-03
冤家路窄,1984-03-24,1984-03
以色列解散议会提前大选,1984-03-24,1984-03
苏垦荒区提供全国半数商品粮,1984-03-24,1984-03
从您的书里吸取思想营养,1984-03-24,1984-03
银幕剪影,1984-03-24,1984-03
嘹亮的改革之声,1984-03-24,1984-03
崂山上的笑声,1984-03-24,1984-03
甘当配角,1984-03-24,1984-03
《簪花仕女图》邮票,1984-03-24,1984-03
海岛歌声飞,1984-03-24,1984-03
三省一市舞台美术理论座谈会,1984-03-24,1984-03
《春节联欢晚会》唱片,1984-03-24,1984-03
河北举办杂文创作奖,1984-03-24,1984-03
北京地区天气预报,1984-03-25,1984-03
搞好对照检查的关键（社论）,1984-03-25,1984-03
祝中日友好如长江大河奔流不息,1984-03-25,1984-03
彭真委员长会见中曾根首相,1984-03-25,1984-03
西哈努克到达北京,1984-03-25,1984-03
胡耀邦设家宴款待中曾根一家,1984-03-25,1984-03
朝向二十一世纪实现日中世代友好,1984-03-25,1984-03
政策落实了有知识的先富,1984-03-25,1984-03
加强扶助农村贫困户工作,1984-03-25,1984-03
谁有知识谁先富,1984-03-25,1984-03
常州市机械系统增加了活力,1984-03-25,1984-03
大厂定点帮助区街小厂提高素质,1984-03-25,1984-03
老虎台矿推行现代化企业管理,1984-03-25,1984-03
中日经济合作前景广阔,1984-03-25,1984-03
我国出口许可证管理工作取得成效,1984-03-25,1984-03
电耗低居世界领先地位,1984-03-25,1984-03
天津引进微型汽车制造技术,1984-03-25,1984-03
简讯,1984-03-25,1984-03
上海郊区农民沈真延将特大银元宝献国家,1984-03-25,1984-03
六届政协常委会第四次会议结束,1984-03-25,1984-03
“树医生”赵春芝,1984-03-25,1984-03
廖汉生率人大代表团离京,1984-03-25,1984-03
１９８１年全国婴儿死亡率为３４．６８‰,1984-03-25,1984-03
全国人口平均预期寿命为６７．８８岁,1984-03-25,1984-03
北影将协助意大利摄制电视系列片《末代皇帝》,1984-03-25,1984-03
磨刀不误砍柴潍坊开关厂安排工人进业余学校提高生产率,1984-03-25,1984-03
家丑岂怕外扬抚顺商业局抓住典型办揭丑影展治理脏乱差,1984-03-25,1984-03
朝向二十一世纪,1984-03-25,1984-03
中曾根首相参观中日友好医院,1984-03-25,1984-03
吴学谦同安倍晋太朗会谈,1984-03-25,1984-03
赵紫阳会见即将离任的古巴大使,1984-03-25,1984-03
中曾根首相向人民英雄纪念碑献花圈,1984-03-25,1984-03
中曾根首相和夫人看望廖承志夫人,1984-03-25,1984-03
中曾根夫人参观北海幼儿园,1984-03-25,1984-03
加快饲料行业的建设,1984-03-25,1984-03
改善大城市副食品供应的重要途径,1984-03-25,1984-03
养殖专业户重点户的希望,1984-03-25,1984-03
采用微电脑计算饲料配方获成效,1984-03-25,1984-03
国外配合饲料工业一瞥,1984-03-25,1984-03
商业部门饲料工业生产能力迅速扩大,1984-03-25,1984-03
东乡县饲料厂灵活调节饲料产销,1984-03-25,1984-03
符离集烧鸡和饲料生产,1984-03-25,1984-03
饲料新释,1984-03-25,1984-03
上海市开展饲料规划调查,1984-03-25,1984-03
民柬爱国武装突袭柏威夏省恰普县城,1984-03-25,1984-03
金边伪军三百多人开小差,1984-03-25,1984-03
千秋万岁播东风,1984-03-25,1984-03
西哈努克亲王启程来华,1984-03-25,1984-03
贝鲁特西区白天激烈冲突晚上达成停火协议,1984-03-25,1984-03
墨西哥总统重申反对干涉中美洲,1984-03-25,1984-03
法国将从贝鲁特撤军,1984-03-25,1984-03
智利全国处于紧急状态,1984-03-25,1984-03
加拿大举行酸雨问题国际会议,1984-03-25,1984-03
尼加拉瓜执委会协调员中断在墨西哥的访问,1984-03-25,1984-03
美军直升飞机在南朝鲜坠毁,1984-03-25,1984-03
中罗两国共青团中央第一书记举行会谈,1984-03-25,1984-03
巴基斯坦积极开发新能源,1984-03-25,1984-03
国际简讯,1984-03-25,1984-03
在科技新潮流面前,1984-03-25,1984-03
“我们的音乐家”,1984-03-25,1984-03
风雪横滨夜,1984-03-25,1984-03
小野妹子,1984-03-25,1984-03
新的畅销书,1984-03-25,1984-03
多瑙河湾一小镇,1984-03-25,1984-03
访觉莫洞戒毒院,1984-03-25,1984-03
鲜花吊英雄,1984-03-25,1984-03
华北油田巡礼,1984-03-25,1984-03
北京地区天气预报,1984-03-26,1984-03
“嘉陵”联合体出速度出质量出效益,1984-03-26,1984-03
发展中日关系要看得远一些广一些,1984-03-26,1984-03
走军民结合的道路（本报评论）,1984-03-26,1984-03
中日青少年永远友好,1984-03-26,1984-03
中国巴西经济贸易关系发展前景广阔,1984-03-26,1984-03
迎接和庆祝建国三十五周年,1984-03-26,1984-03
用人“三招”,1984-03-26,1984-03
大明山还在乱砍滥伐,1984-03-26,1984-03
真是“墙脚”吗？,1984-03-26,1984-03
丹东减发六家亏损企业职工工资,1984-03-26,1984-03
辽宁探明一个新煤田,1984-03-26,1984-03
用飞机抢来的买卖,1984-03-26,1984-03
国家旅游局决定追认鱼新平为“全国模范翻译导游”在旅游系统开展学习鱼新平活动,1984-03-26,1984-03
农村集体经济的重要支柱,1984-03-26,1984-03
唐山市委、市政府接受报纸批评迅速改进工作,1984-03-26,1984-03
霍县矿务局整顿企业提高效率,1984-03-26,1984-03
民航北京管理局改进服务工作,1984-03-26,1984-03
让重点真正重起来,1984-03-26,1984-03
浙江三个专业文艺团体试行经营承包责任制效果好,1984-03-26,1984-03
上海市郊十个县实现普及教育,1984-03-26,1984-03
一条无人值守中继光纤通信线路在京并网使用,1984-03-26,1984-03
拯救大熊猫活动牵动亿万颗心,1984-03-26,1984-03
加压离子交换分离重稀土元素新工艺在兰州大学原子核研究所研究成功,1984-03-26,1984-03
方毅会见日本棋圣藤泽秀行,1984-03-26,1984-03
方便顾客天津河东区８６家商店延长营业时间应受称赞,1984-03-26,1984-03
暴殄天物沈东果品站１３万柑桔腐烂变质被埋理当处罚,1984-03-26,1984-03
“其身正，不令而行”,1984-03-26,1984-03
北京国际女篮邀请赛开幕,1984-03-26,1984-03
李梅素打破女子铅球亚洲纪录,1984-03-26,1984-03
快速勇猛的踢法值得提倡,1984-03-26,1984-03
简讯,1984-03-26,1984-03
依靠快攻打开局面,1984-03-26,1984-03
全英羽毛球公开赛半决赛成绩公报,1984-03-26,1984-03
最后消息,1984-03-26,1984-03
陕西省领导同志到基层了解情况,1984-03-26,1984-03
华北油田勘探一公司党委严处违法乱纪党员,1984-03-26,1984-03
吉林省委领导克服官僚主义作风,1984-03-26,1984-03
城乡建设部和建筑工会接受批评,1984-03-26,1984-03
胡耀邦赵紫阳分别同中曾根和安倍话别,1984-03-26,1984-03
对中国访问极为充实并取得丰硕成果,1984-03-26,1984-03
中曾根首相和夫人在京参观农贸市场,1984-03-26,1984-03
中日友好２１世纪委员会日方委员简介,1984-03-26,1984-03
湖北省政府宴请中曾根首相,1984-03-26,1984-03
陈慕华和巴西财政部长在京签署会谈纪要,1984-03-26,1984-03
荣毅仁会见日本客人,1984-03-26,1984-03
荣毅仁会见科威特国际投资公司董事长,1984-03-26,1984-03
尼泊尔全国评议会代表团回国,1984-03-26,1984-03
黑龙江省同苏联边境贸易谈判结束,1984-03-26,1984-03
论历史上遗留下来的民族间事实上的不平等,1984-03-26,1984-03
全国生态经济科学讨论会,1984-03-26,1984-03
司马徽的难言之隐,1984-03-26,1984-03
巴颂揭露越南将向民柬发动攻势,1984-03-26,1984-03
泰报揭露：阮基石患的是“外交病”,1984-03-26,1984-03
在北京访问的最后一天,1984-03-26,1984-03
法国开始从贝鲁特撤出部队,1984-03-26,1984-03
密特朗访美呼吁恢复东西方会谈,1984-03-26,1984-03
美国又将在洪都拉斯举行三个月演习,1984-03-26,1984-03
日本经济今年度预计增长４．１％,1984-03-26,1984-03
意大利数十万群众示威游行,1984-03-26,1984-03
坦桑尼亚总统等接见我工会代表团,1984-03-26,1984-03
我驻秘鲁大使徐晃病逝,1984-03-26,1984-03
王光英一行结束对泰国的访问,1984-03-26,1984-03
突尼斯国民议会议长接见我大使,1984-03-26,1984-03
扎伊尔立法委员会第一副主席接见我大使,1984-03-26,1984-03
中罗签订一九八四年图书贸易合同,1984-03-26,1984-03
新华社代表团访问葡萄牙,1984-03-26,1984-03
友谊的彩桥,1984-03-26,1984-03
国际简讯,1984-03-26,1984-03
文学应当和生活同步前进,1984-03-26,1984-03
歌颂工人阶级的革命精神,1984-03-26,1984-03
《邵式平日记》出版,1984-03-26,1984-03
陆文夫作品讨论会在苏州召开,1984-03-26,1984-03
变革的现实生活呼唤着文学,1984-03-26,1984-03
“老好人”好什么？,1984-03-26,1984-03
到天山去,1984-03-26,1984-03
东京街头所见,1984-03-26,1984-03
花城三月,1984-03-26,1984-03
道教“丛林”白云观,1984-03-26,1984-03
《出版史料》的特色,1984-03-26,1984-03
北京地区天气预报,1984-03-27,1984-03
研究以较少投资建较多电站,1984-03-27,1984-03
各地要把治穷和治病结合起来抓,1984-03-27,1984-03
努力开创地方病防治工作新局面（本报评论）,1984-03-27,1984-03
人大委员长会议举行扩大会议,1984-03-27,1984-03
赵紫阳设宴为西哈努克洗尘,1984-03-27,1984-03
授予钱绍钧“国防科技工作模范”称号,1984-03-27,1984-03
胜利油田打出一口新井日产原油一千一百吨,1984-03-27,1984-03
知识竞赛不宜滥,1984-03-27,1984-03
保定地区农村工业蓬勃发展,1984-03-27,1984-03
把产品和应用技术同时送上门,1984-03-27,1984-03
长沙市电子研究所研制计算机成绩显著,1984-03-27,1984-03
把信息变成财富,1984-03-27,1984-03
辽宁省推广沈阳集体企业改革经验,1984-03-27,1984-03
工农共建运输专业县,1984-03-27,1984-03
上海衬衫业决心学习步鑫生,1984-03-27,1984-03
北京服装工业公司决心加快改革步伐,1984-03-27,1984-03
送上门的“信息”,1984-03-27,1984-03
希望多有几家“大三元”,1984-03-27,1984-03
“关门前，看一眼”,1984-03-27,1984-03
应用研究单位自负盈亏好,1984-03-27,1984-03
中国一九八二年人口普查国际讨论会在北京开幕,1984-03-27,1984-03
今年高校将毕业２７万本科专科学生１．１万多名研究生,1984-03-27,1984-03
加强高校毕业生思想政治教育工作,1984-03-27,1984-03
《茅盾全集》第一、二、三卷出版,1984-03-27,1984-03
我国地方病防治工作进展快,1984-03-27,1984-03
《光明日报》举办“光明”征文活动,1984-03-27,1984-03
美国普兰蒂斯·霍尔出版社图书展览在北京举行,1984-03-27,1984-03
壮族画家罗鼎华三代画展受欢迎,1984-03-27,1984-03
闻过则喜通化一干部批评省委省委书记望更多同志讲真话,1984-03-27,1984-03
毛遂自荐阜城某农民主持企业企业改革竟起死回生出奇迹,1984-03-27,1984-03
中国女将蝉联两项冠军,1984-03-27,1984-03
关键时刻失误两支主队失利,1984-03-27,1984-03
“赛耶·塔特杯”国际冰球赛中国队负于罗马尼亚队瑞士队,1984-03-27,1984-03
世界越野锦标赛我国选手有进步,1984-03-27,1984-03
纪念吴承仕同志诞生一百周年,1984-03-27,1984-03
祝贺中曾根访华圆满成功,1984-03-27,1984-03
中曾根首相离沪回国,1984-03-27,1984-03
中英关于香港问题第二阶段第十一轮会谈开始举行,1984-03-27,1984-03
康克清会见墨西哥女参众议员团,1984-03-27,1984-03
张爱萍会见美国朋友,1984-03-27,1984-03
伍修权会见美国前总统国家安全事务助理,1984-03-27,1984-03
邹瑜会见比利时司法代表团,1984-03-27,1984-03
全国青联举行宴会欢迎东京青年会议所日中友好青少年之翼代表团,1984-03-27,1984-03
巴蒂举行招待会庆祝巴基斯坦日,1984-03-27,1984-03
穆希德大使举行孟加拉国国庆招待会,1984-03-27,1984-03
希腊大使举行国庆招待会,1984-03-27,1984-03
文明值勤严格执法,1984-03-27,1984-03
杀害纪检干部车昭富一案中的一些牵连人受党纪国法追究,1984-03-27,1984-03
李建民获“基层干部的模范”荣誉称号,1984-03-27,1984-03
王育斌同志逝世,1984-03-27,1984-03
近水也不能救火,1984-03-27,1984-03
改革中的苦恼和欢乐,1984-03-27,1984-03
地方报纸不应突出宣传当地负责人,1984-03-27,1984-03
王熙凤的“自我批评”,1984-03-27,1984-03
被丢下的一封加急电报,1984-03-27,1984-03
他努力改善着周围的“气候”,1984-03-27,1984-03
勇斗罪犯纪检干部英名四方传诵,1984-03-27,1984-03
欺压百姓区委书记被判十年徒刑,1984-03-27,1984-03
急件急办,1984-03-27,1984-03
“武斗总指挥”窃权之后,1984-03-27,1984-03
中曾根首相回到东京,1984-03-27,1984-03
增进了解  相互学习  加深友谊  发展合作,1984-03-27,1984-03
日本报纸高度评价中曾根访华,1984-03-27,1984-03
怀着诚意来满载友情归,1984-03-27,1984-03
“争取和平与裁军集会”在巴黎举行,1984-03-27,1984-03
约旦要求召开世界和平大会推动中东问题解决,1984-03-27,1984-03
穆巴拉克表示埃及全力支持苏丹,1984-03-27,1984-03
萨尔瓦多在紧张气氛中举行大选,1984-03-27,1984-03
两个德国的关系有所改善,1984-03-27,1984-03
意共总书记贝林格呼吁美苏冻结部署中程导弹,1984-03-27,1984-03
蒙代尔在预选中得到的支持多于哈特,1984-03-27,1984-03
中苏第四轮磋商新闻公报,1984-03-27,1984-03
叙利亚著名诗人和作家奥贝德逝世,1984-03-27,1984-03
从儿童抓起普及应用电子技术,1984-03-27,1984-03
莱索托不同南非签订互不侵犯条约,1984-03-27,1984-03
匈牙利副总理接见我经济代表团,1984-03-27,1984-03
合肥市和弗里敦市结为友好城市,1984-03-27,1984-03
国际简讯,1984-03-27,1984-03
再见吧，北京,1984-03-27,1984-03
我和《世界知识》,1984-03-27,1984-03
伊敏河畔〔油画〕,1984-03-27,1984-03
黎明的脚步,1984-03-27,1984-03
游少林寺  （二首）,1984-03-27,1984-03
永遇乐,1984-03-27,1984-03
鸡诫,1984-03-27,1984-03
读《回忆亚东图书馆》,1984-03-27,1984-03
北京地区天气预报,1984-03-28,1984-03
李先念从昆明回到北京,1984-03-28,1984-03
胡耀邦宣布五月初出访朝鲜重申支持朝鲜和平统一方针,1984-03-28,1984-03
抽调科技骨干支援重点建设项目,1984-03-28,1984-03
以多种方式开展人大外事活动,1984-03-28,1984-03
沉痛哀悼杜尔总统逝世,1984-03-28,1984-03
天津加快技术改造步伐,1984-03-28,1984-03
为什么不敢留下笔迹？,1984-03-28,1984-03
简讯,1984-03-28,1984-03
浩浩长江，何日万舸争航？,1984-03-28,1984-03
正在兴建中的中央彩电中心,1984-03-28,1984-03
闯荡在国际市场,1984-03-28,1984-03
临汾铁路分局实现连续三个安全年,1984-03-28,1984-03
郑州东站改革铁路货运工作,1984-03-28,1984-03
“万里铁路万里林”工程全面展开,1984-03-28,1984-03
中日合作开发三江平原龙头桥典型区农业规划在京签字,1984-03-28,1984-03
“一刀切”与“切两刀”,1984-03-28,1984-03
落实知识分子政策要扎扎实实办实事,1984-03-28,1984-03
抽调科技骨干支援重点建设,1984-03-28,1984-03
我国应用丙硫咪唑治疗人囊虫病成功,1984-03-28,1984-03
羽坛进入欧亚对峙时代,1984-03-28,1984-03
全国网球联赛（甲组）结束,1984-03-28,1984-03
陈肖霞获全国跳水冠军赛女子跳板跳水冠军,1984-03-28,1984-03
中国队在“赛耶·塔特杯”国际冰球赛上胜匈牙利队,1984-03-28,1984-03
车轮滚滚试看集体企业显威周口运输公司千里运晋煤,1984-03-28,1984-03
乾坤朗朗岂容诬告伎俩得逞漳浦原副县长一朝受严惩,1984-03-28,1984-03
生物工程将使医学发生变革,1984-03-28,1984-03
战胜癌症——二○○六年,1984-03-28,1984-03
生物工程药品预测,1984-03-28,1984-03
有机涂层钢板,1984-03-28,1984-03
页岩陶粒,1984-03-28,1984-03
让水电事业起飞,1984-03-28,1984-03
海军开始出现边整边改新局面,1984-03-28,1984-03
勤奋努力严于律己,1984-03-28,1984-03
感谢中国政府和各界人士的款待,1984-03-28,1984-03
黄华会见墨西哥女参众议员团,1984-03-28,1984-03
李鹏会见美国客人,1984-03-28,1984-03
中英关于香港问题第二阶段第十一轮会谈结束,1984-03-28,1984-03
