如何把部门工作做得更好些,1985-02-01,1985-02
三个“三角”将辟为沿海经济开放区,1985-02-01,1985-02
辽宁十一个市建立人才信息网,1985-02-01,1985-02
青岛市联合办公审批建设项目,1985-02-01,1985-02
十二芯市内通信光缆研制成功,1985-02-01,1985-02
重庆制成大功率沼气发电机组,1985-02-01,1985-02
福建蔗糖产量创历史最高纪录,1985-02-01,1985-02
江苏农村涌现一批“千万元村”,1985-02-01,1985-02
商丘地区农桐间作农田林网化,1985-02-01,1985-02
六届人大三次会议召开前人大代表将视察各地工作,1985-02-01,1985-02
评“不发纪念品不开会”,1985-02-01,1985-02
二月上旬我国大部地区气温比常年高,1985-02-01,1985-02
误会引出的故事,1985-02-01,1985-02
农村集市新貌,1985-02-01,1985-02
沿海兴  内地旺（本报评论）,1985-02-01,1985-02
加快发展化学工业四条方针,1985-02-01,1985-02
禁止发行各种变相货币,1985-02-01,1985-02
《关于加强疏港工作的几项规定》２月１日起试行,1985-02-01,1985-02
山东省饲料工业迅速发展,1985-02-01,1985-02
长江航运事业欣欣向荣,1985-02-01,1985-02
北京商业服务业十八万青年职工参加商业道德教育轮训,1985-02-01,1985-02
中信电通有限公司成立,1985-02-01,1985-02
钢管渗铝新工艺通过鉴定,1985-02-01,1985-02
破“常规思维”,1985-02-01,1985-02
丰富首都节日市场促进城乡商品交流,1985-02-01,1985-02
西宁机械配件工业公司受到通报批评,1985-02-01,1985-02
粮食等农副产品显著增值,1985-02-01,1985-02
为首都春节市场供应增色添彩,1985-02-01,1985-02
延边到关内有了直达列车,1985-02-01,1985-02
林牧工副渔业比重上升,1985-02-01,1985-02
天津市交通拥挤状况亟待改变,1985-02-01,1985-02
菜谱要名副其实,1985-02-01,1985-02
十七个姑娘自费办学,1985-02-01,1985-02
没有人情的作品是不会感动人的,1985-02-01,1985-02
锦州市为教师颁发优待征,1985-02-01,1985-02
查查“专款专用”,1985-02-01,1985-02
中国科学家作首次环乔治岛空中考察,1985-02-01,1985-02
放开搞活  谨防混水摸鱼  云南公安部门打击签假合同诈骗犯工农联盟  深入各个领域  华北油田委托农民承包看护采油井（今日首都和各省市区报纸要目）,1985-02-01,1985-02
军民团结  奋战南极,1985-02-01,1985-02
《中华在改革中腾飞》新闻摄影大奖赛,1985-02-01,1985-02
国防科技大学研究生院在长沙成立,1985-02-01,1985-02
上海新闻界举行缅怀恽逸群座谈会,1985-02-01,1985-02
北京人文函授大学增设群众文化管理等系科,1985-02-01,1985-02
新疆成立一所经济管理干部学校,1985-02-01,1985-02
北京信息工程学院成立,1985-02-01,1985-02
匈牙利派出高水平足球队访华,1985-02-01,1985-02
中国女篮胜加拿大队,1985-02-01,1985-02
中国选手获两枚金牌,1985-02-01,1985-02
北京举行中小学生振兴中华杯排球赛,1985-02-01,1985-02
全国各地开发退伍军人两用人才,1985-02-01,1985-02
南海顺德两县推行治安承包责任制,1985-02-01,1985-02
北京轻工产品展销馆门卫见危不救,1985-02-01,1985-02
亲人解放军救了我一家,1985-02-01,1985-02
某师广开学路培养两用人才,1985-02-01,1985-02
戈壁卫士,1985-02-01,1985-02
姚依林会见美国年轻企业总裁访华团,1985-02-01,1985-02
荣毅仁离京赴日本访问,1985-02-01,1985-02
国际劳工组织北京局举行开业典礼,1985-02-01,1985-02
为自由鸣炮,1985-02-01,1985-02
理论创新与当代中国,1985-02-01,1985-02
孙中山学术讨论会综述,1985-02-01,1985-02
《唐太宗传》评介,1985-02-01,1985-02
《远生遗著》增订出版,1985-02-01,1985-02
中国共产党帮助国民党改组与第一次国共合作,1985-02-01,1985-02
揭露河内妄图分裂联合政府,1985-02-01,1985-02
非统首脑会议将专门讨论经济问题,1985-02-01,1985-02
呼吁国际组织密切注视越南罪行,1985-02-01,1985-02
乍得在安理会指责利比亚企图谋杀乍总统,1985-02-01,1985-02
美国向泰国提供援款救济灾民,1985-02-01,1985-02
侯赛因抨击美国中东政策,1985-02-01,1985-02
伊拉克军队又向伊朗发起地面攻势伊朗说将对伊拉克的袭击进行报复,1985-02-01,1985-02
美华协会敦促调查江南案,1985-02-01,1985-02
日美贸易谈判未达成实质性协议,1985-02-01,1985-02
黎南部以色列占领军伤亡增加,1985-02-01,1985-02
欧洲葡萄酒“过剩”,1985-02-01,1985-02
陈慕华抵西班牙进行友好访问,1985-02-01,1985-02
马达加斯加总统总理接见我大使,1985-02-01,1985-02
我援建的沙灰砖厂移交给埃及,1985-02-01,1985-02
中波签订换货协定,1985-02-01,1985-02
简讯,1985-02-01,1985-02
中蒙签订换货议定书,1985-02-01,1985-02
国际简讯,1985-02-01,1985-02
喀尔巴阡山下一林场,1985-02-01,1985-02
呼吁各国支援非洲受灾国家,1985-02-01,1985-02
总统呼吁恢复南北对话,1985-02-01,1985-02
同干旱作斗争的非洲人民,1985-02-01,1985-02
二十五年来第二次削价,1985-02-01,1985-02
美外贸逆差达一千二百多亿美元,1985-02-01,1985-02
美航天飞机将重新起飞,1985-02-01,1985-02
苏联从科拉半岛地区撤出ＳＳ—５核导弹,1985-02-01,1985-02
芬兰找到坠毁的苏巡航导弹部件,1985-02-01,1985-02
白宫的“不速之客”,1985-02-01,1985-02
格陵兰退出欧洲共同体,1985-02-01,1985-02
一个市委书记的独白〔报告文学〕,1985-02-01,1985-02
党委着力抓四件事威信提高厂长统一指挥改革进展顺利,1985-02-02,1985-02
四川发动全省人民荐贤,1985-02-02,1985-02
沈阳招考部分局级干部,1985-02-02,1985-02
党委书记的新课题（本报评论）,1985-02-02,1985-02
推广应用优选法统筹法经济效益突出,1985-02-02,1985-02
劝说父亲退二线,1985-02-02,1985-02
七千农民纷纷自费赴会,1985-02-02,1985-02
山东乡镇企业“四轮”齐转去年总收入一百四十亿元,1985-02-02,1985-02
同话农村开拓计  共商明日新课题,1985-02-02,1985-02
胡耀邦将出访澳大利亚和新西兰,1985-02-02,1985-02
青年诚心求教 前辈热心指导,1985-02-02,1985-02
一番实话,1985-02-02,1985-02
“外乡人”进京有感,1985-02-02,1985-02
泰国军队赶走全部入侵越军,1985-02-02,1985-02
公司改革不能一刀切,1985-02-02,1985-02
将欲取之  必先与之,1985-02-02,1985-02
谈“甩开婆婆”,1985-02-02,1985-02
江西集资兴建十五条农村公路,1985-02-02,1985-02
必须抓好生产分配运输“一本账”,1985-02-02,1985-02
“简政放权”三忌,1985-02-02,1985-02
沈海马养的金钱龟  人称“活气象”,1985-02-02,1985-02
农村工农业总产值六年翻番,1985-02-02,1985-02
江申一○八轮实行单船承包效果明显,1985-02-02,1985-02
安阳东郊供销社及早备年货,1985-02-02,1985-02
北京年货车队下河北,1985-02-02,1985-02
喀喇沁旗扶持少数民族农牧民开发矿业,1985-02-02,1985-02
湖南研制出新的营养强化剂,1985-02-02,1985-02
内蒙古着手恢复黄河航运,1985-02-02,1985-02
“三着”制胜,1985-02-02,1985-02
郑州铁路分局对春节运输提出具体要求,1985-02-02,1985-02
中国厨房设备技术开发中心在京成立,1985-02-02,1985-02
天津机务段积极准备春节运输,1985-02-02,1985-02
左权县积极引进资金,1985-02-02,1985-02
在心灵深处耕耘,1985-02-02,1985-02
看似奇崛实平易,1985-02-02,1985-02
“智囊团”在经济科技领域发挥作用,1985-02-02,1985-02
陕西农民企业家与科技单位洽谈引进技术聘请人才,1985-02-02,1985-02
民办缝纫学校陋室办学感动日本友人,1985-02-02,1985-02
大熊猫繁殖力低之谜揭开了,1985-02-02,1985-02
北京一能人制成“九龙公平杯”,1985-02-02,1985-02
向中国儿童和少年基金会捐款近万元,1985-02-02,1985-02
卫星激光测距系统通过鉴定,1985-02-02,1985-02
医圣张仲景与医圣祠在京展览,1985-02-02,1985-02
《戏剧报》、《戏剧论丛》向首都观众推荐昆剧《三夫人》,1985-02-02,1985-02
中国女篮战胜澳大利亚队,1985-02-02,1985-02
第四届尼赫鲁金杯足球赛分组预赛结束,1985-02-02,1985-02
中国队王金泽被选为优秀投球手,1985-02-02,1985-02
幼年流浪今致富  立下宏愿助孤儿  射洪某农民办儿童福利院苦心钻研终成才  面向八方传技艺  光山一村姑开天麻函授校（今日首都和各省市区报纸要目）,1985-02-02,1985-02
认真解决知识分子入党难问题,1985-02-02,1985-02
怪事一桩！,1985-02-02,1985-02
带领群众走上富裕道路,1985-02-02,1985-02
北京陆军预备役第二师成立,1985-02-02,1985-02
武警四川总队积极帮助农民致富,1985-02-02,1985-02
我国统计史上最准确最丰富的人口资料将出版,1985-02-02,1985-02
清除有碍于四化建设的错误思想和行动,1985-02-02,1985-02
某军党委和机关认真安排第二期整党学习,1985-02-02,1985-02
北京市将在今年春节广泛开展尊老敬贤活动,1985-02-02,1985-02
天津市评选最佳交通民警活动揭晓,1985-02-02,1985-02
厄运难移赤子心,1985-02-02,1985-02
长汀县认真落实台胞台属政策,1985-02-02,1985-02
中国国际友好联络会举行欢庆春节酒会,1985-02-02,1985-02
王丙乾会见日本和联邦德国金融界客人,1985-02-02,1985-02
请给我一次机会,1985-02-02,1985-02
假文凭一律作废  责任者停职检查,1985-02-02,1985-02
农民紧迫需要小型适用的农业机械,1985-02-02,1985-02
道路坎坷  行人叫苦,1985-02-02,1985-02
信誉更比药价高,1985-02-02,1985-02
洛阳市制锁厂应迅速治理“三害”,1985-02-02,1985-02
是正当罚款而不是无理罚款,1985-02-02,1985-02
“富华”牌收录机是谁家的产品？,1985-02-02,1985-02
一些地方克斤扣两现象严重计量管理工作亟待加强,1985-02-02,1985-02
我县江南乡报刊投递已正常,1985-02-02,1985-02
定西县连续发生殴打教师事件,1985-02-02,1985-02
泰国揭露越南建议,1985-02-02,1985-02
阿富汗战事加剧,1985-02-02,1985-02
民柬领导人将在曼谷会晤,1985-02-02,1985-02
朝鲜为迎接解放和建党四十周年发布口号,1985-02-02,1985-02
西班牙首相冈萨雷斯接见陈慕华,1985-02-02,1985-02
我大使为荣毅仁董事长访日举行招待会,1985-02-02,1985-02
以色列在约旦河西岸残酷迫害巴勒斯坦人民,1985-02-02,1985-02
日本企业的更名热,1985-02-02,1985-02
日本第三产业将迅速发展,1985-02-02,1985-02
去年日本工业增长１１．２％,1985-02-02,1985-02
美决定暂停向中东国家出售武器,1985-02-02,1985-02
第一次世界大战遗留炸弹爆炸炸死炸伤南斯拉夫的三名儿童,1985-02-02,1985-02
国际简讯,1985-02-02,1985-02
酸雨污染加拿大湖泊,1985-02-02,1985-02
方便顾客的市场,1985-02-02,1985-02
敦促超级大国认真谈判核裁军,1985-02-02,1985-02
里根说如不能同苏达成好协议就退出谈判,1985-02-02,1985-02
欧洲裁军会议举行第五阶段会议,1985-02-02,1985-02
中欧裁军谈判举行第三十五轮会谈,1985-02-02,1985-02
孔塔多拉集团力促中美洲和平谈判,1985-02-02,1985-02
欧洲航天局会议达成协议决定着手研究哥伦布空间站和阿丽阿娜—五型火箭,1985-02-02,1985-02
奥斯威辛集中营幸存者要求惩办逃亡纳粹凶手,1985-02-02,1985-02
苏联飞行员发现一种奇异现象,1985-02-02,1985-02
看《快乐的汉斯》演出有感,1985-02-02,1985-02
设奖与挑战,1985-02-02,1985-02
老作家回“娘家”,1985-02-02,1985-02
推荐“儿童智力游戏盒”,1985-02-02,1985-02
铁笔金石寓乡情,1985-02-02,1985-02
简讯,1985-02-02,1985-02
中国作协调整《文艺报》《人民文学》正副主编,1985-02-02,1985-02
阿甲研究小组在京成立,1985-02-02,1985-02
歙砚巨观,1985-02-02,1985-02
福州军区制止非法经商活动,1985-02-03,1985-02
百名优秀青年厂长（经理）在京受奖,1985-02-03,1985-02
十名优秀青年企业家,1985-02-03,1985-02
乡镇煤矿富有活力贡献很大前途无量,1985-02-03,1985-02
朱大娘赶“财神”,1985-02-03,1985-02
造就一大批青年企业家（本报评论）,1985-02-03,1985-02
倪志福率中共代表团离京赴法,1985-02-03,1985-02
赵紫阳会见陈香梅,1985-02-03,1985-02
服务态度不好要追究领导责任,1985-02-03,1985-02
第三产业成为拉萨最大产业,1985-02-03,1985-02
石家庄地区兴办第三产业学校,1985-02-03,1985-02
四川打破条块分割框框  改革机械行业领导机构,1985-02-03,1985-02
长春食品贸易中心多渠道进货,1985-02-03,1985-02
博兴澫头村建劳动人民纪念堂,1985-02-03,1985-02
北京王府井首家农民商店开张,1985-02-03,1985-02
谈口号,1985-02-03,1985-02
饮食店租赁给我们以后,1985-02-03,1985-02
自主经营好,1985-02-03,1985-02
腾格里万亩沙海变绿洲,1985-02-03,1985-02
冲破条块束缚  跨区跨业搞协作,1985-02-03,1985-02
促进各国贸易的桥梁,1985-02-03,1985-02
京郊二百多个村庄实现沼气化,1985-02-03,1985-02
一业为主  综合经营  搞活渠道,1985-02-03,1985-02
长春市园林建设展露新姿,1985-02-03,1985-02
引钱塘江水入西湖工程开工,1985-02-03,1985-02
北京清华池增设桑那浴,1985-02-03,1985-02
高粱啤酒问世,1985-02-03,1985-02
女工宗敏华承包一个厂半年扭亏为盈,1985-02-03,1985-02
车冷人凉,1985-02-03,1985-02
编者按,1985-02-03,1985-02
午餐饭店生意兴旺,1985-02-03,1985-02
农民夜校学英语,1985-02-03,1985-02
小马车上的羊肉馆,1985-02-03,1985-02
迷信纸变信息条,1985-02-03,1985-02
简讯,1985-02-03,1985-02
城乡联办瓜子加工厂,1985-02-03,1985-02
武汉市信息产业访问记,1985-02-03,1985-02
宁夏重奖贡献突出的知识分子,1985-02-03,1985-02
大学与工厂建立技术联盟,1985-02-03,1985-02
“深挖一下”,1985-02-03,1985-02
“放心医生”程蕴琳受重奖,1985-02-03,1985-02
春节期间广泛开展尊师活动,1985-02-03,1985-02
办公司  一味招摇撞骗  武汉某公司骗取巨款  被吊销执照    掌电权  四处敲诈勒索  中江一电霸受贿万元  已判处徒刑（今日首都和各省市区报纸要目）,1985-02-03,1985-02
习仲勋等接见中华全国中医学会会议代表,1985-02-03,1985-02
首届“乌金奖”发奖大会在京举行,1985-02-03,1985-02
贺近恪被选为世界林业科学院院士,1985-02-03,1985-02
邓铁涛等发起筹建振兴中医基金会,1985-02-03,1985-02
上海建立了人体肝癌单克隆抗体杂交瘤株,1985-02-03,1985-02
祁连鹿鸣,1985-02-03,1985-02
希望中匈足球界加强交流,1985-02-03,1985-02
胡利萍获女子跳板跳水银牌,1985-02-03,1985-02
山东省乒乓球队在比利时比赛获得全胜,1985-02-03,1985-02
门球知识简介,1985-02-03,1985-02
农牧渔业部愿协助部队培养两用人才,1985-02-03,1985-02
坚决纠正党政干部以权经商歪风,1985-02-03,1985-02
怀念张西曼教授,1985-02-03,1985-02
天津市重视公安基层设施建设,1985-02-03,1985-02
一个值得重视的问题（国内短评）,1985-02-03,1985-02
权与钱,1985-02-03,1985-02
佛山的经验——推行治安承包责任制,1985-02-03,1985-02
去年首都社会治安是１９６６年以来最好的一年,1985-02-03,1985-02
中国工农红军第八军革命纪念馆在广西龙州县落成,1985-02-03,1985-02
一座“二七”大罢工组雕在郑州落成,1985-02-03,1985-02
民兵马黔致富不忘帮贫,1985-02-03,1985-02
乌鲁木齐县五位专业户农牧民当上了党代表,1985-02-03,1985-02
云南省经贸厅党组进行否定“文革”教育,1985-02-03,1985-02
刘顺茂三接五保户,1985-02-03,1985-02
联邦德国教会代表团抵达广州,1985-02-03,1985-02
《中华大藏经（汉文部分）》开始出版,1985-02-03,1985-02
倪征ｙù＠①离京赴海牙就任国际法院法官,1985-02-03,1985-02
县委书记罗鉴宇深入基层调查研究,1985-02-03,1985-02
着力培养创造型人才,1985-02-03,1985-02
他们提出好学生的新标准,1985-02-03,1985-02
农校要为农村培养顶用的毕业生,1985-02-03,1985-02
改革不合理的中学课程结构,1985-02-03,1985-02
让学生多掌握实验技能,1985-02-03,1985-02
民柬部队同越军展开激战,1985-02-03,1985-02
不许迫害艾德琳（国际短评）,1985-02-03,1985-02
支持巴勒斯坦人民斗争何罪之有,1985-02-03,1985-02
帽子难摘,1985-02-03,1985-02
西提：只要越南对柬采取军事行动柬埔寨问题就不能得到解决,1985-02-03,1985-02
联合国纳米比亚理事会谴责南非军事演习,1985-02-03,1985-02
西班牙国王胡安·卡洛斯接见陈慕华,1985-02-03,1985-02
希望今年能结束黎巴嫩被占领和战乱之苦,1985-02-03,1985-02
由于接待前纳粹战犯奥地利国防部长受严厉批评,1985-02-03,1985-02
两伊部队仍在中部战线激战,1985-02-03,1985-02
特里波利市又发生爆炸事件,1985-02-03,1985-02
法国驻印度大使涉嫌间谍案,1985-02-03,1985-02
美国和安哥拉谈判取得进展,1985-02-03,1985-02
我国援建的多哥人民联盟之家大夏获国际墨丘利和平金质奖章,1985-02-03,1985-02
芬兰打捞起苏联坠落导弹的残骸,1985-02-03,1985-02
国际经济动态,1985-02-03,1985-02
访日散记,1985-02-03,1985-02
奇妙的水族世界,1985-02-03,1985-02
美国第一位华人宇航员,1985-02-03,1985-02
日本政界一部内幕故事,1985-02-03,1985-02
马萨亚火山口探奇,1985-02-03,1985-02
法国人的幽默,1985-02-03,1985-02
埃及国家图书馆,1985-02-03,1985-02
“绿色的金子”——啤酒花,1985-02-03,1985-02
今日二七机车工厂,1985-02-03,1985-02
经商有道（本报评论）,1985-02-04,1985-02
形势好时要正视弱点防止失误,1985-02-04,1985-02
个体户商品春节不提价,1985-02-04,1985-02
去年１２３个重点项目建设进度加快,1985-02-04,1985-02
李金铠研制成功多文种电脑引导输入系统,1985-02-04,1985-02
认真执行物价政策  紧俏商品无一提价,1985-02-04,1985-02
柬埔寨第七个旱季形势好  越南的军事攻势日趋衰弱,1985-02-04,1985-02
杭州工业总产值超百亿元,1985-02-04,1985-02
福州和宁德开展对口支援,1985-02-04,1985-02
秦巴山区百万农民修公路,1985-02-04,1985-02
周荣华的“文凭”,1985-02-04,1985-02
玉田县查获一起空买空卖彩电诈骗大案,1985-02-04,1985-02
触目惊心  发人深醒（国内短评）,1985-02-04,1985-02
“ 牛村”,1985-02-04,1985-02
乡镇企业中的小“托拉斯”,1985-02-04,1985-02
苏锦国的治厂“公式”,1985-02-04,1985-02
小“托拉斯”赞,1985-02-04,1985-02
邯郸地区商品经济得到发展,1985-02-04,1985-02
改革劳动人事管理制度  搞活地质队,1985-02-04,1985-02
广州白云农工商联合公司按贸、工、农程序办企业,1985-02-04,1985-02
明日何其多,1985-02-04,1985-02
进一步发挥设备制造行业的潜力,1985-02-04,1985-02
赶快制订《公司法》,1985-02-04,1985-02
我国第一条通往东南亚的定期集装箱班轮航线开航,1985-02-04,1985-02
湖北省去年新建沼气池近九万口,1985-02-04,1985-02
曲阳县开发利用大理石资源年总产值一千四百多万元,1985-02-04,1985-02
近千只天鹅在山东马山港栖息过冬,1985-02-04,1985-02
徐应荣搞客运实行优惠价,1985-02-04,1985-02
王梅坤承包水库致富受嘉奖,1985-02-04,1985-02
进一步放宽政策  促进开发性生产,1985-02-04,1985-02
深圳口岸效率高,1985-02-04,1985-02
北海市六条新公路动工,1985-02-04,1985-02
大连港吞吐量去年突破四千万吨大关,1985-02-04,1985-02
经济技术开发区简介,1985-02-04,1985-02
连云港划地专供内联之用,1985-02-04,1985-02
天津开发区三条公路路基填方完工,1985-02-04,1985-02
秦皇岛经济技术开发区建设取得进展,1985-02-04,1985-02
沉缸美酒更醇香,1985-02-04,1985-02
河南作出高教改革新规定,1985-02-04,1985-02
贵州在人才进出上首次“扭亏为盈”,1985-02-04,1985-02
在千百万人之中,1985-02-04,1985-02
联合国人口活动基金会将再给我五千万美元援助,1985-02-04,1985-02
中药７９—２片剂治疗硬皮病疗效显著,1985-02-04,1985-02
黄昆访美讲学受到高度评价,1985-02-04,1985-02
全国大学生篮球赛即将在南京揭幕,1985-02-04,1985-02
南斯拉夫队将同苏联队争夺尼赫鲁金杯足球赛冠军,1985-02-04,1985-02
黄萍获女子跳台跳水亚军,1985-02-04,1985-02
郑健获巴黎短池游泳赛第三名,1985-02-04,1985-02
简讯,1985-02-04,1985-02
如此考察  福州市外行买设备胆子壮  花冤枉钱不心疼这般招待  沈阳玻璃厂宴宾客气派大  吃公家款多慷慨（今日首都和各省市区报纸要目）,1985-02-04,1985-02
对大陆经济要正确研究,1985-02-04,1985-02
劝诫部属不参加无谓应酬,1985-02-04,1985-02
投资中美洲落空,1985-02-04,1985-02
国民党三中全会可能延期（今日台湾）,1985-02-04,1985-02
孙立人再次申请离台遭拒绝（今日台湾）,1985-02-04,1985-02
忆姑苏（今日台湾）,1985-02-04,1985-02
公立学校教职员工资新规定（今日台湾）,1985-02-04,1985-02
梦绕故乡旦暮求,1985-02-04,1985-02
老帅的欣慰,1985-02-04,1985-02
太原钢铁公司安排职工残疾子女就业有方,1985-02-04,1985-02
人武部政委符岐圣被群众称为“财神爷”,1985-02-04,1985-02
海军开放军事禁区内一批风景名胜地,1985-02-04,1985-02
“活地图”,1985-02-04,1985-02
北京丰台区扎扎实实开展拥军优属活动,1985-02-04,1985-02
认真做好劳教工作（国内短评）,1985-02-04,1985-02
希望之路就在脚下,1985-02-04,1985-02
劳教与劳改有何不同？,1985-02-04,1985-02
“浪子”赔情还赃物,1985-02-04,1985-02
结婚不忘“圆镜”人,1985-02-04,1985-02
“户口”回到西安市,1985-02-04,1985-02
冯细劳动致富,1985-02-04,1985-02
劳教所里的展览会,1985-02-04,1985-02
当前有关组织工业公司的几个问题,1985-02-04,1985-02
“人民群众是历史的创造者”质疑,1985-02-04,1985-02
怕就怕鸦雀无声,1985-02-04,1985-02
《羊城晚报》“消费问题讨论”简介,1985-02-04,1985-02
窝赃、销赃罪,1985-02-04,1985-02
民柬内阁会议分析国内形势,1985-02-04,1985-02
将继续为解决柬问题作努力,1985-02-04,1985-02
美苏再次相互指责,1985-02-04,1985-02
石油输出国组织削减油价反应强烈,1985-02-04,1985-02
金大中离美返南朝鲜,1985-02-04,1985-02
强调华约将继续履行历史使命,1985-02-04,1985-02
动荡不安的玻利维亚局势,1985-02-04,1985-02
印毒气遇难者尸体解剖发现内脏受伤害,1985-02-04,1985-02
芬查明坠入的苏导弹不是巡航导弹,1985-02-04,1985-02
两伊仍在激战,1985-02-04,1985-02
国际简讯,1985-02-04,1985-02
芬兰和美国南部地区气温创历史低点,1985-02-04,1985-02
埃及因天气严寒关闭重要港口,1985-02-04,1985-02
虫害侵袭东非和南部非洲地区,1985-02-04,1985-02
访日散记,1985-02-04,1985-02
我们赶上了文艺创作的最好气候,1985-02-04,1985-02
春风扑面  热气腾腾,1985-02-04,1985-02
燧石，在敲击中发射出光彩,1985-02-04,1985-02
《河魂》〔长篇小说〕,1985-02-04,1985-02
《猎神，走出山谷》〔中篇小说〕,1985-02-04,1985-02
《旋风》 〔报告文学〕,1985-02-04,1985-02
《记者》〔中篇小说〕,1985-02-04,1985-02
《文艺报》开展话剧问题讨论,1985-02-04,1985-02
《旧人与新人》将问世,1985-02-04,1985-02
《中国古典文学鉴赏》创刊,1985-02-04,1985-02
挑战与思考,1985-02-04,1985-02
用人之“勇”,1985-02-04,1985-02
故乡啊，故乡,1985-02-04,1985-02
大西北,1985-02-04,1985-02
有时（外一首）,1985-02-04,1985-02
《斯坦尼斯拉夫斯基传》,1985-02-04,1985-02
“后门”在移动,1985-02-04,1985-02
“代培”与换亲,1985-02-04,1985-02
冰雪松花江（ 中国画）,1985-02-04,1985-02
科研要开花，更要结果,1985-02-05,1985-02
各地为保持节日市场稳定部署春节期间物价大检查,1985-02-05,1985-02
收起对策，执行政策（本报评论）,1985-02-05,1985-02
探索高等学校招生改革新路子上海市今年高考试行单独命题,1985-02-05,1985-02
各级领导要接触新秀（本报评论）,1985-02-05,1985-02
女中学生李一智朱萍分获国际绘画金质奖银质奖,1985-02-05,1985-02
他为什么追“总结”,1985-02-05,1985-02
陈丕显会见省市区民政厅局长时指出民政部门要做好基层政权建设工作,1985-02-05,1985-02
帮助兴建汕头大学李嘉诚捐赠港币两亿多元,1985-02-05,1985-02
西藏农村出现科学种田热,1985-02-05,1985-02
拉美十一国将举行部长级会议 谋求合理解决债务问题,1985-02-05,1985-02
把立足点移到服务上,1985-02-05,1985-02
王安电脑公司亚洲区业务总部已迁至香港,1985-02-05,1985-02
世界易货贸易急剧增加,1985-02-05,1985-02
不应随意扩大范围,1985-02-05,1985-02
新厂长须有新招数,1985-02-05,1985-02
减少中间环节  产销直接挂钩  成都市放开猪肉市场效果好,1985-02-05,1985-02
饲养种畜种禽不能“一窝蜂”,1985-02-05,1985-02
利用草原优势  调整农业结构延安地区户均超过一头大家畜,1985-02-05,1985-02
把企业应有的权力不折不扣地给企业徐州矿务局出现新的生机,1985-02-05,1985-02
新苏木养牛发家,1985-02-05,1985-02
武汉市以中心城市为依托发展横向经济联系工业产值利润税收同步增长,1985-02-05,1985-02
河南乡镇企业产值超过八十亿,1985-02-05,1985-02
西安技术市场开业,1985-02-05,1985-02
腊月砀山有鲜梨,1985-02-05,1985-02
放权就能搞活,1985-02-05,1985-02
我国建成第一条集团电话生产线,1985-02-05,1985-02
青年经理陈质枫,1985-02-05,1985-02
宁夏集会奖励专业户,1985-02-05,1985-02
建设银行北京市分行重视审查建设项目,1985-02-05,1985-02
