制止以色列的侵略和扩张是维护中东和平的关键,1985-03-10,1985-03
安徽五千多名犯罪人员投案自首,1985-03-10,1985-03
孙中山先生铜像奠基典礼在京举行,1985-03-10,1985-03
拳拳报国心,1985-03-10,1985-03
许家屯设宴招待香港政府司级官员,1985-03-10,1985-03
黄华会见马里政府文化代表团,1985-03-10,1985-03
廖汉生会见巴基斯坦文官学院代表团,1985-03-10,1985-03
国家海洋局局长罗钰如率代表团出席联合国教科文组织政府间海洋学委员会大会,1985-03-10,1985-03
宿县造林十三年建成“绿色银行”,1985-03-11,1985-03
提倡股份式合作（本报评论）,1985-03-11,1985-03
临汝农村兴办股份合作企业,1985-03-11,1985-03
北京大幅度缩小指令性计划范围,1985-03-11,1985-03
一张罚款通报,1985-03-11,1985-03
驻地周围荒漠变绿洲,1985-03-11,1985-03
甘肃初步纠正滥发奖金问题,1985-03-11,1985-03
山西查处一起倒卖汽车案,1985-03-11,1985-03
以实际行动支持达敦军民抗越斗争,1985-03-11,1985-03
三月中旬大部分地区气温将偏低,1985-03-11,1985-03
沈阳市劳模会只开了六十五分钟,1985-03-11,1985-03
此类“指标”下不得,1985-03-11,1985-03
“奖而分之不如不奖”,1985-03-11,1985-03
我国五大考古新发现,1985-03-11,1985-03
上海市内电话使用新型报警设备,1985-03-11,1985-03
中缅胞波情 轻舟赶集来,1985-03-11,1985-03
打破封闭状态  引进消化新技术  上海造船业加快产品升级换代,1985-03-11,1985-03
一业为主  多种经营,1985-03-11,1985-03
大型总公司应把权放给基层企业,1985-03-11,1985-03
头脑要冷静,1985-03-11,1985-03
河北省抓紧落实今年棉花定购合同,1985-03-11,1985-03
冠县大曲村减少植棉兴办企业,1985-03-11,1985-03
常州市刹住滥发购货券歪风,1985-03-11,1985-03
部分省市交通管理部门座谈缓解城市交通拥挤办法,1985-03-11,1985-03
“找零钱”也当讲究,1985-03-11,1985-03
北京提出新措施,1985-03-11,1985-03
铜陵市采取财政贴息贷款支持养猪,1985-03-11,1985-03
甘肃厂坝矿建设初具规模,1985-03-11,1985-03
驻川部队支援风景游览地植树造林,1985-03-11,1985-03
济宁市保险公司为民解难,1985-03-11,1985-03
上海药物牙膏在京展销受欢迎,1985-03-11,1985-03
可供生食的无公害营养蔬菜在上海试种成功,1985-03-11,1985-03
兰州制成生产航空风挡玻璃的工艺设备,1985-03-11,1985-03
就地转化粮食 发展畜禽渔业,1985-03-11,1985-03
厂长首先对谁负责？,1985-03-11,1985-03
应重视耕地减少问题,1985-03-11,1985-03
四川省计划生育工作成绩显著,1985-03-11,1985-03
佳肴热饭迎师生,1985-03-11,1985-03
把舞台放在孩子们中间,1985-03-11,1985-03
中国南极考察船队离开智利回国,1985-03-11,1985-03
中山大学在京校友举行“孙中山学说恳谈会”,1985-03-11,1985-03
北京市儿童钢琴比赛闭幕,1985-03-11,1985-03
我国首次把从黄瓜子叶分离出的原生质体培养成植株,1985-03-11,1985-03
杨尚昆接见即将出征的中国乒乓球代表团,1985-03-11,1985-03
中日围棋擂台赛我选手再传捷报,1985-03-11,1985-03
简讯,1985-03-11,1985-03
迎春杯足球赛在重庆落下帷幕,1985-03-11,1985-03
中国女垒战胜新西兰队,1985-03-11,1985-03
万宝足球队夺得“华南杯”,1985-03-11,1985-03
中国选手获国际体操配对赛冠亚军,1985-03-11,1985-03
莫道黔西行路难  条条公路出山乡  毕节区筑路热自民间兴起    喜看冀北风沙减片片绿林起原野  张家口防护林在农田见效（今日首都和各省市区报纸要目）,1985-03-11,1985-03
台岛官营企业弊病多端,1985-03-11,1985-03
两岸影片应在海外公平竞争,1985-03-11,1985-03
台湾的黑社会和“扫黑”,1985-03-11,1985-03
台湾的大专院校（三）,1985-03-11,1985-03
台北新建“宋元庭院”至善园,1985-03-11,1985-03
台湾电影“金马奖”揭晓,1985-03-11,1985-03
皮包公司十万家,1985-03-11,1985-03
新追求  新招数  新作风,1985-03-11,1985-03
做有理想有道德有文化有纪律的一代新人,1985-03-11,1985-03
要坚决刹住新的不正之风,1985-03-11,1985-03
彻底否定“文革”  消除派性,1985-03-11,1985-03
乔石会见达利一行,1985-03-11,1985-03
中也两国外长举行会谈,1985-03-11,1985-03
吴学谦电贺联合国教科文组织政府间海洋学委员会成立２５周年,1985-03-11,1985-03
为了人民的安居乐业（为争取社会治安根本好转而努力）,1985-03-11,1985-03
走上新岸以后,1985-03-11,1985-03
喜看湖北社会治安形势,1985-03-11,1985-03
政法简讯,1985-03-11,1985-03
编者按,1985-03-11,1985-03
贤内助,1985-03-11,1985-03
思想政治工作也要改革,1985-03-11,1985-03
亦官亦商  国之大蠹,1985-03-11,1985-03
关于史论关系的讨论简介,1985-03-11,1985-03
重婚罪（《中华人民共和国刑法》普及宣传讲话（９８））,1985-03-11,1985-03
《理论经济学若干问题》出版,1985-03-11,1985-03
简讯,1985-03-11,1985-03
泰国积极筹备迎接李主席访问,1985-03-11,1985-03
民柬部队猛袭菩萨市,1985-03-11,1985-03
许多代表在安理会谴责南非迫害黑人,1985-03-11,1985-03
中东和谈的新动向,1985-03-11,1985-03
穆巴拉克抵美会谈中东问题,1985-03-11,1985-03
今年两国贸易额将超过一亿美元,1985-03-11,1985-03
金大中金泳三说解除禁令毫无意义,1985-03-11,1985-03
吉布提总统接见我政府代表团,1985-03-11,1985-03
我驻利比亚大使递交国书,1985-03-11,1985-03
我大使向巴布亚新几内亚总督递交国书,1985-03-11,1985-03
匈副总理接见我经济体制考察团团长,1985-03-11,1985-03
苏丹第一副议长接见我工会代表团,1985-03-11,1985-03
中坦签订文化合作协定执行计划,1985-03-11,1985-03
印度聘请一美国法律事务所为毒气渗漏惨案受害者起诉,1985-03-11,1985-03
两年前被绑架的旅游者下落已查明,1985-03-11,1985-03
玻利维亚再次爆发全国总罢工  玻军方宣布军队处于戒备状态,1985-03-11,1985-03
国际简讯,1985-03-11,1985-03
阿根廷最大政党正义党分裂,1985-03-11,1985-03
通俗文学需要提高,1985-03-11,1985-03
昨天、今天与明天,1985-03-11,1985-03
应有写改革的传世之作,1985-03-11,1985-03
嘲谑嬉笑寓深思,1985-03-11,1985-03
文学笔记,1985-03-11,1985-03
鼠去牛来闻虎啸,1985-03-11,1985-03
巴布里加的黄昏,1985-03-11,1985-03
山村偶拾（二首）,1985-03-11,1985-03
这双鞋里是热乎乎的,1985-03-11,1985-03
不是笔会  胜似笔会,1985-03-11,1985-03
山里红（雕塑）,1985-03-11,1985-03
李主席抵达曼谷五十万人夹道欢迎,1985-03-12,1985-03
理想纪律是改革的保证（本报评论）,1985-03-12,1985-03
李先念彭真电唁契尔年科逝世,1985-03-12,1985-03
苏联领导人契尔年科病逝,1985-03-12,1985-03
普密蓬·阿杜德国王盛宴李主席,1985-03-12,1985-03
胡耀邦会见玄峻极,1985-03-12,1985-03
中国青年要与各国青年加强合作  为和平和人类进步事业作新贡献,1985-03-12,1985-03
现在是我国经济发展最好时期,1985-03-12,1985-03
解放军拉开造林战幕,1985-03-12,1985-03
我边防部队继续还击来犯越军,1985-03-12,1985-03
许多城市开始铺翠叠彩（植树种草  绿化祖国  持之以恒  讲究实效）,1985-03-12,1985-03
在“绿”字上多做文章（植树种草  绿化祖国  持之以恒  讲究实效（国内短评））,1985-03-12,1985-03
绿化是建设事业  要扎实搞好（植树种草  绿化祖国  持之以恒  讲究实效）,1985-03-12,1985-03
陇西县种树育苗量多质好（植树种草  绿化祖国  持之以恒  讲究实效）,1985-03-12,1985-03
要多听行家的意见（植树种草  绿化祖国  持之以恒  讲究实效）,1985-03-12,1985-03
植树谚语趣话（植树种草  绿化祖国  持之以恒  讲究实效）,1985-03-12,1985-03
叙永县去冬今春成片造林八万亩（植树种草  绿化祖国  持之以恒  讲究实效）,1985-03-12,1985-03
岳阳县乡村林场为农户提供苗木（植树种草  绿化祖国  持之以恒  讲究实效）,1985-03-12,1985-03
宁冈发现厚叶红山茶（植树种草  绿化祖国  持之以恒  讲究实效）,1985-03-12,1985-03
在章古台播种春色的科研所（植树种草  绿化祖国  持之以恒  讲究实效）,1985-03-12,1985-03
陈景田三年植树五万株（植树种草  绿化祖国  持之以恒  讲究实效）,1985-03-12,1985-03
梅岭巾帼建林场,1985-03-12,1985-03
战士无处不英雄（植树种草  绿化祖国  持之以恒  讲究实效）,1985-03-12,1985-03
今年高校毕业生分配办法有较大改革,1985-03-12,1985-03
科研面向经济出人才出成果出效益,1985-03-12,1985-03
突破“包”与“统”的局面（本报评论）,1985-03-12,1985-03
各行各业青年为教师衣食住行服务,1985-03-12,1985-03
国务院决定规划和开发兴城旅游区,1985-03-12,1985-03
无解说词的旅游影片《西藏——西藏》制成,1985-03-12,1985-03
我国引种高蛋白饲料螺旋藻成功,1985-03-12,1985-03
日本夏普综合技术展览会在京开幕,1985-03-12,1985-03
华东石油学院积极开展电化教学,1985-03-12,1985-03
新疆去年有五千多名知识分子入党,1985-03-12,1985-03
莫效齐人攫金  科委副主任抢夺他人成果  于耀升受处分当知悔    且喜华佗再世  人民好医生接活离体断指  周礼荣享盛名不停步（今日首都和各省市区报纸要目）,1985-03-12,1985-03
上海、太原队获第六届亚洲城市国际象棋赛冠亚军,1985-03-12,1985-03
我棋手江铸久败于日本棋手小林光一,1985-03-12,1985-03
丹麦羽毛球公开赛我获两项冠军,1985-03-12,1985-03
简讯,1985-03-12,1985-03
全国手球联赛圆满结束,1985-03-12,1985-03
中国田坛一颗希望之星,1985-03-12,1985-03
促使泰中两国在各个领域的繁荣,1985-03-12,1985-03
中泰两国人民友谊进入新的发展时期,1985-03-12,1985-03
李鹏副总理看望安徽省沿淮行蓄洪区受灾人民,1985-03-12,1985-03
发扬“俯首甘为孺子牛”精神  再立新功,1985-03-12,1985-03
中国政府对契尔年科主席逝世表示深切哀悼,1985-03-12,1985-03
赵紫阳会见扎伊尔驻华大使,1985-03-12,1985-03
李一氓宴请日本护宪国民联合友好访华团,1985-03-12,1985-03
田纪云会见朝鲜商业代表团,1985-03-12,1985-03
宋平会见日本客人,1985-03-12,1985-03
巴布亚新几内亚林业部长到京,1985-03-12,1985-03
民革中央瞻仰孙中山先生衣冠塚,1985-03-12,1985-03
全社会要关心残疾人就业和教育问题,1985-03-12,1985-03
第一期全国企事业法律顾问培训班开学,1985-03-12,1985-03
编者按,1985-03-12,1985-03
闪光的铺路石,1985-03-12,1985-03
她使小郑重见光明,1985-03-12,1985-03
不是亲闺女胜似亲闺女,1985-03-12,1985-03
宣传基本国策的热心人,1985-03-12,1985-03
解决党内矛盾的正确途径,1985-03-12,1985-03
安阳市物价局纠正新的不正之风,1985-03-12,1985-03
党政干部经商谋私  触目惊心  泗阳县委采取措施  严肃处理,1985-03-12,1985-03
此种“表示”之风应休矣,1985-03-12,1985-03
如此“行家里手”,1985-03-12,1985-03
新“官”之“新”,1985-03-12,1985-03
莫做当今“地下党员”,1985-03-12,1985-03
倾听群众呼声  帮助排忧解难,1985-03-12,1985-03
称兄道妹的肮脏交易,1985-03-12,1985-03
坚持党的原则  做好纪检工作,1985-03-12,1985-03
泰国国王会见李先念主席,1985-03-12,1985-03
李主席离仰光前往泰国访问,1985-03-12,1985-03
民柬部队兵分三路袭击磅清扬市,1985-03-12,1985-03
我代表坚决主张早日实现纳米比亚独立,1985-03-12,1985-03
中泰友谊谱新篇,1985-03-12,1985-03
叙副总统再次访问黎巴嫩,1985-03-12,1985-03
伊斯兰会议组织呼吁两伊停止轰炸民用设施,1985-03-12,1985-03
日本青函海底隧道的通车坑道凿通,1985-03-12,1985-03
泰国的“以气代油”,1985-03-12,1985-03
南医生采用新法接活两个月前断的手掌,1985-03-12,1985-03
国际简讯,1985-03-12,1985-03
苏联领导机构发表告党和人民书,1985-03-12,1985-03
中曾根和安倍等就契尔年科逝世发表谈话,1985-03-12,1985-03
全党必须实现思想和行动上的统一,1985-03-12,1985-03
苏美武器控制谈判如期举行,1985-03-12,1985-03
新任苏共中央总书记戈尔巴乔夫,1985-03-12,1985-03
北欧理事会会议结束,1985-03-12,1985-03
昂纳克希望苏美谈判取得积极成果,1985-03-12,1985-03
希腊总统卡拉曼利斯辞职,1985-03-12,1985-03
天文学家发现最遥远的星系,1985-03-12,1985-03
不用眼镜的立体电视,1985-03-12,1985-03
苏研制成新型降雪机,1985-03-12,1985-03
无水“灌溉”,1985-03-12,1985-03
美国一些新纳粹组织复活,1985-03-12,1985-03
新颖的电动三轮车,1985-03-12,1985-03
说说冷静,1985-03-12,1985-03
北方的原野（三章）,1985-03-12,1985-03
给母亲,1985-03-12,1985-03
呵，骆驼！,1985-03-12,1985-03
悼念韩非,1985-03-12,1985-03
鲁迅、森鸥外及其它,1985-03-12,1985-03
第几代孙顶什么用？,1985-03-12,1985-03
履行公民植树的义务  党和国家领导人到天坛公园植树,1985-03-13,1985-03
炳总理举行盛大招待会欢迎李主席  李主席同炳总理在友好气氛中会谈,1985-03-13,1985-03
吊唁契尔年科主席逝世,1985-03-13,1985-03
赵总理电唁巴巴多斯总理亚当斯逝世,1985-03-13,1985-03
我们愿同所有国家发展友好合作关系,1985-03-13,1985-03
李鹏率我政府代表团赴莫斯科参加葬礼,1985-03-13,1985-03
在第二期整党工作会议上的讲话（摘要）,1985-03-13,1985-03
简讯,1985-03-13,1985-03
加强信贷管理  提高经济效益,1985-03-13,1985-03
让“巧妙的机器”运转得更好（本报评论）,1985-03-13,1985-03
“五费”统收  群众受益,1985-03-13,1985-03
中央国家机关义务植树成绩显著,1985-03-13,1985-03
广州消费者委员会积极开展工作,1985-03-13,1985-03
广西扩大发展林业资金,1985-03-13,1985-03
武汉市狠刹乱涨物价歪风,1985-03-13,1985-03
承包勿忘便民,1985-03-13,1985-03
万家农商创济南,1985-03-13,1985-03
物资部门要努力办好贸易中心,1985-03-13,1985-03
在改革中加强管理,1985-03-13,1985-03
编者按,1985-03-13,1985-03
易地办店  生意兴隆,1985-03-13,1985-03
收废铁得大利,1985-03-13,1985-03
利用废料制作工艺品,1985-03-13,1985-03
常屯村烧盆工艺精,1985-03-13,1985-03
陈春忠小枣育苗有新法,1985-03-13,1985-03
女评酒员,1985-03-13,1985-03
徐锦堂面向生产搞科研功绩卓著,1985-03-13,1985-03
我国首次发现显性雄性核不育谷子,1985-03-13,1985-03
科研项目和科研收入实现翻番,1985-03-13,1985-03
实实在在地冒尖,1985-03-13,1985-03
凭真本事生财  靠新技术致富,1985-03-13,1985-03
李德生要求各级领导抓好地方病防治工作,1985-03-13,1985-03
着眼于技术市场需要搞科研,1985-03-13,1985-03
为乡里造福  清水流进农家  湾潭乡办起农民自来水公司    树文明新风  群众上门敬老  荔湾区开展照顾烈军属活动（今日首都和各省市区报纸要目）,1985-03-13,1985-03
江阴发现古钱币之王——咸丰重宝,1985-03-13,1985-03
中国女垒又胜澳、加三场,1985-03-13,1985-03
准备迎接瑞典队的挑战,1985-03-13,1985-03
戴维斯杯网球赛东区我队进入第三轮,1985-03-13,1985-03
越南对柬埔寨的侵略和占领直接威胁泰国的安全,1985-03-13,1985-03
坚决支持泰国英勇抗击越军的挑衅和侵犯,1985-03-13,1985-03
纪念孙中山先生逝世六十周年,1985-03-13,1985-03
全国台联会长副会长秘书长理事名单,1985-03-13,1985-03
许家屯为香港行政立法  两局议员举行春茗宴会,1985-03-13,1985-03
简讯,1985-03-13,1985-03
中国对戈尔巴乔夫当选为苏共中央总书记表示祝贺,1985-03-13,1985-03
王震陈慕华分别会见日本松下电器产业公司访华团,1985-03-13,1985-03
王震会见日本客人,1985-03-13,1985-03
钱李仁同西南非洲人民组织代表团举行会谈,1985-03-13,1985-03
经济活跃  邮件激增  运力不足,1985-03-13,1985-03
肇源县农民承包乡邮路,1985-03-13,1985-03
海堰乡集资办邮电所,1985-03-13,1985-03
唐山市一年实现乡乡有邮电机构,1985-03-13,1985-03
邮电部门发行报刊三千五百种,1985-03-13,1985-03
去年全国人均寄信三点九件,1985-03-13,1985-03
我国开办邮政特快专递业务,1985-03-13,1985-03
国外电子邮政业务介绍,1985-03-13,1985-03
农贸市场设置信报箱好,1985-03-13,1985-03
《花卉报》即将创刊,1985-03-13,1985-03
东风市场为一些名优产品增辟专柜,1985-03-13,1985-03
北京电冰箱总厂重视售后服务,1985-03-13,1985-03
新型自动春卷皮机,1985-03-13,1985-03
食品碾磨机,1985-03-13,1985-03
走向世界  为国争光,1985-03-13,1985-03
中泰签订两项经济合作协定  李先念主席和炳总理出席签字仪式,1985-03-13,1985-03
林佳楣以李主席名义向泰红十字会捐款,1985-03-13,1985-03
李主席访问北榄鳄鱼湖,1985-03-13,1985-03
越南当局的新花招（国际短评）,1985-03-13,1985-03
民柬国民军袭击越军三三九师师部,1985-03-13,1985-03
苏两院主席再次会见我人大代表团,1985-03-13,1985-03
巴巴多斯总理亚当斯逝世,1985-03-13,1985-03
南部非洲前线国家谴责南非,1985-03-13,1985-03
我新任驻圣多美和普林西比大使递交国书,1985-03-13,1985-03
联邦德国总统接见我离任大使,1985-03-13,1985-03
扎伊尔总理接见我离任大使,1985-03-13,1985-03
民主也门总理接见我政府代表团  阿拉伯也门总理接见芮杏文部长,1985-03-13,1985-03
孟中签订文化协定执行计划,1985-03-13,1985-03
谴责以色列在黎巴嫩南部犯下的罪行,1985-03-13,1985-03
联合国特委会主席呼吁消除种族隔离,1985-03-13,1985-03
伊朗接受停止袭击民用目标的建议,1985-03-13,1985-03
以占领军在黎南部进行大扫荡,1985-03-13,1985-03
国际简讯,1985-03-13,1985-03
世界最长的青函隧道,1985-03-13,1985-03
在第三世界,1985-03-13,1985-03
从“宇宙救援”说起,1985-03-13,1985-03
联合国关于非洲紧急形势会议开幕,1985-03-13,1985-03
“马克罗”超级商场散记,1985-03-13,1985-03
戈尔巴乔夫谈苏联当前内外政策,1985-03-13,1985-03
美苏开始举行武器控制谈判,1985-03-13,1985-03
法国省议会选举进行首轮投票,1985-03-13,1985-03
瑞典舆论对谈判表示欢迎但不抱很大期望,1985-03-13,1985-03
日美举行贸易谈判,1985-03-13,1985-03
汉普顿故宫将出租,1985-03-13,1985-03
也是一条大“尾巴”,1985-03-13,1985-03
天山月,1985-03-13,1985-03
小镇（外一章）,1985-03-13,1985-03
长城,1985-03-13,1985-03
竞选搞公开答辩好,1985-03-13,1985-03
边疆卷语——云南扣林山,1985-03-13,1985-03
三年上交国家十六亿多元,1985-03-14,1985-03
在第二次全国台湾同胞代表会议上的讲话（一九八五年三月六日）,1985-03-14,1985-03
注意克服放松粮食生产苗头,1985-03-14,1985-03
吉林黑龙江增供轻纺部门木材,1985-03-14,1985-03
李主席在曼谷举行答谢宴会,1985-03-14,1985-03
莫斯科隆重举行契尔年科葬礼,1985-03-14,1985-03
严明纪律执行政策纠正不正之风,1985-03-14,1985-03
纠正新的不正之风是二期整党突出任务,1985-03-14,1985-03
守纪律的最高标准是维护和执行政策（本报评论）,1985-03-14,1985-03
绿色小镇允景洪,1985-03-14,1985-03
摸着石头过河——信阳县从实际出发制订规划发展生产,1985-03-14,1985-03
国务院在合肥召开治淮会议,1985-03-14,1985-03
在改革中探索新的管理制度管理方式,1985-03-14,1985-03
稳扎稳打（国内短评）,1985-03-14,1985-03
树立正确的经济效益观,1985-03-14,1985-03
严肃财经纪律  纠正新的不正之风,1985-03-14,1985-03
民航的根本出路是改革,1985-03-14,1985-03
重庆建设机床厂高价出售“雅马哈”有关部门丧失原则徇情开脱不按章处理,1985-03-14,1985-03
中国国际有色金属租赁有限公司开业,1985-03-14,1985-03
全国乡镇企业产品展销订货会将在北京举行,1985-03-14,1985-03
《“疯狂”的君子兰交易》一文部分情节失实,1985-03-14,1985-03
便民要落实在行动上,1985-03-14,1985-03
“女能人”,1985-03-14,1985-03
学校的事让学校自己去办,1985-03-14,1985-03
不要“杀鸡取卵”,1985-03-14,1985-03
克服棉花远缘杂交种不育  我国专家取得突破性进展,1985-03-14,1985-03
一个大型计算机网络在京建成,1985-03-14,1985-03
上海今年将增设四所高等学校,1985-03-14,1985-03
新疆阿尔金山自然保护区被列为国家级自然保护区,1985-03-14,1985-03
束鹿县民办“农民医疗救护站”,1985-03-14,1985-03
中国统计干部电视函授学院成立,1985-03-14,1985-03
藏书乃财富  闲置实可惜  武汉医学院图书馆向社会开放    铁路是动脉  奔流应不息  粤桂湘三省军用线让地方使用（今日首都和各省市区报纸要目）,1985-03-14,1985-03
农民刘驰举办省象棋邀请赛,1985-03-14,1985-03
国家女排冬训后首次亮相,1985-03-14,1985-03
中国大学生队获参加世界大学生运动会足球赛资格,1985-03-14,1985-03
栾菊杰获全国女子花剑个人赛冠军,1985-03-14,1985-03
不为人所知的名将——吴文嘉,1985-03-14,1985-03
美国一大学接力队创室内女子四乘八百米接力世界最好成绩,1985-03-14,1985-03
世界大学生运动会报名参赛国家和地区数目空前,1985-03-14,1985-03
德宏军民共建文明  各族农民勤劳致富,1985-03-14,1985-03
改革之风吹进了巩乃斯草原,1985-03-14,1985-03
怒江傈僳族自治州第一个万元村,1985-03-14,1985-03
牧民办饭庄  青城奶茶香,1985-03-14,1985-03
昔日流浪求食  如今办企业致富,1985-03-14,1985-03
第二次全国台胞代表会闭幕,1985-03-14,1985-03
划清是非界限  坚持改革方向,1985-03-14,1985-03
教育党员作抵制新的不正之风的模范,1985-03-14,1985-03
做好军队离退休干部和退伍军人安置工作（本报评论）,1985-03-14,1985-03
三万多名军队离休干部将移交地方安置,1985-03-14,1985-03
广州南京上海武汉等地分别举行纪念活动,1985-03-14,1985-03
尽快使大中企业都有经过专门培训的法律顾问,1985-03-14,1985-03
孙中山先生塑像在厦门落成,1985-03-14,1985-03
中国将向非洲提供五万吨救灾粮,1985-03-14,1985-03
几内亚外长将访华,1985-03-14,1985-03
朱学范会见日本客人,1985-03-14,1985-03
武警首届武术表演散手赛在南宁举行,1985-03-14,1985-03
姚依林会见瓦卡及其一行,1985-03-14,1985-03
全社会都要关心老干部工作,1985-03-14,1985-03
姚依林会见英国太古有限公司主席,1985-03-14,1985-03
孟加拉国驻华大使因病在京逝世,1985-03-14,1985-03
孟加拉国计划部长、联合国教科文组织执行局委员马吉德·汗一行抵京,1985-03-14,1985-03
英国不管部大臣扬格勋爵离港返英,1985-03-14,1985-03
外交部文化部举行文艺晚会招待各国驻华使节,1985-03-14,1985-03
简讯,1985-03-14,1985-03
水面耕地同样宝贵,1985-03-14,1985-03
让人们吃到更多的水产品,1985-03-14,1985-03
你了解泥鳅吗？,1985-03-14,1985-03
小虾加工成大虾,1985-03-14,1985-03
“活化石”——扬子鳄,1985-03-14,1985-03
浓缩鱼蛋白,1985-03-14,1985-03
鱼肝油制成的止血药,1985-03-14,1985-03
船舶减摇鳍——平稳行船的装置,1985-03-14,1985-03
铣刀加工有新法,1985-03-14,1985-03
国产自动船用开关制成,1985-03-14,1985-03
泰国华人团体盛宴欢迎李主席访问,1985-03-14,1985-03
泰中友协欢宴李先念主席和夫人,1985-03-14,1985-03
希望华侨华人为中泰友谊作新贡献,1985-03-14,1985-03
莫斯科隆重举行契尔年科葬礼,1985-03-14,1985-03
强烈谴责越在中越和泰柬边境军事挑衅,1985-03-14,1985-03
里根表示愿意会见戈尔巴乔夫,1985-03-14,1985-03
发展中泰关系维护世界和平,1985-03-14,1985-03
穆巴拉克同里根举行会谈,1985-03-14,1985-03
美苏武器控制谈判继续举行,1985-03-14,1985-03
党员王继堂和六家困难户,1985-03-14,1985-03
赶快整顿这些废品收购站,1985-03-14,1985-03
形同赌博的骗钱勾当,1985-03-14,1985-03
是招聘信息员，还是……,1985-03-14,1985-03
学校不能这样办？,1985-03-14,1985-03
糟践古文物易  维护古文物难,1985-03-14,1985-03
短命的“速热器”,1985-03-14,1985-03
清水粮站短斤少两事已处理,1985-03-14,1985-03
一点说明,1985-03-14,1985-03
记帐方法是否应统一之我见,1985-03-14,1985-03
也说新处长的“妙语”,1985-03-14,1985-03
关于中庸,1985-03-14,1985-03
巾帼凌空豪情在,1985-03-14,1985-03
神农架速写（外一首）,1985-03-14,1985-03
汩汩的渠水,1985-03-14,1985-03
夜大学开课（摄影）,1985-03-14,1985-03
努力改变党员队伍文化偏低的现状重点发展优秀中青年知识分子入党,1985-03-15,1985-03
企业的技术改造要有重点有规划（本报评论）,1985-03-15,1985-03
以现有企业技术改造和改建扩建为主,1985-03-15,1985-03
戈尔巴乔夫总书记会见李鹏副总理,1985-03-15,1985-03
李主席离开曼谷前往清迈访问,1985-03-15,1985-03
彭真等会见全国公安战线功臣模范和立功集体表彰命名大会全体代表,1985-03-15,1985-03
专利法实施细则四月一日施行,1985-03-15,1985-03
降低承包基数  欺骗国家  截留巨额利润  中饱私囊,1985-03-15,1985-03
把上海建成发展出口增加创汇的基地,1985-03-15,1985-03
扩种优质早稻和经济作物,1985-03-15,1985-03
莫让老同志勉为其难,1985-03-15,1985-03
今年将开通三条电气化铁路,1985-03-15,1985-03
