各地各部门必须坚决制止新的不正之风对有令不行有禁不止的歪风要立即查处,1985-03-01,1985-03
在全国农村工作会议上的讲话（摘要）,1985-03-01,1985-03
全国法院先进集体先进个人受表彰,1985-03-01,1985-03
海军政治部查处非法经商活动,1985-03-01,1985-03
北京市保定地区加强横向经济联系,1985-03-01,1985-03
有色金属工业提前完成六五计划,1985-03-01,1985-03
西江开始大规模整治,1985-03-01,1985-03
巩县与农民联办粮行,1985-03-01,1985-03
沙头角口岸正式开放,1985-03-01,1985-03
三月上旬天气展望,1985-03-01,1985-03
退奖,1985-03-01,1985-03
威海市全部停办机关办的企业,1985-03-01,1985-03
不要在钱孔里翻筋斗,1985-03-01,1985-03
原平县城乡经济展翅起飞,1985-03-01,1985-03
加强管理  促进开放  保障开放,1985-03-01,1985-03
宁丢饭碗  不保落后,1985-03-01,1985-03
应该破此“壁垒”,1985-03-01,1985-03
太湖半年封湖休渔效果好,1985-03-01,1985-03
经济短波,1985-03-01,1985-03
副省长收到群众来信之后,1985-03-01,1985-03
我南极考察队告别南极洲开始返航,1985-03-01,1985-03
逐级往下“落”,1985-03-01,1985-03
河北赵县尊师重教的做法是：从多方面为教师办实事,1985-03-01,1985-03
纪念阿英诞生八十五周年学术讨论会在京举行,1985-03-01,1985-03
随书配片将提高图书利用率,1985-03-01,1985-03
我出版《美国科学技术的政策、组织和管理》,1985-03-01,1985-03
首都纪念芬兰史诗《卡勒瓦拉》出版一百五十周年,1985-03-01,1985-03
中国队和香港队将在上海比赛,1985-03-01,1985-03
全国冰球邀请赛在哈举行,1985-03-01,1985-03
泳坛名将萨尔尼科夫因伤不参加上半年比赛,1985-03-01,1985-03
女排冬训见闻,1985-03-01,1985-03
见利而至发昏  副市长同犯罪分子勾结  违法被捕  罪有应得    买卖须讲信义  百货店对广大顾客负责  自我监督  公平交易（今日首都和各省市区报纸要目）,1985-03-01,1985-03
“大内档案”今昔,1985-03-01,1985-03
天台县委对农村党员党支部进行教育和整顿,1985-03-01,1985-03
山西省气象局经过整党面貌一新,1985-03-01,1985-03
这不是赔礼道歉的问题,1985-03-01,1985-03
希腊总理推迟访华,1985-03-01,1985-03
中国政府代表团离京参加联合国地区教育会议,1985-03-01,1985-03
英国经济贸易代表团到京,1985-03-01,1985-03
中缅边界联合检查即将开始,1985-03-01,1985-03
辛佩文苏茂李强三名台湾国民党特务被判刑,1985-03-01,1985-03
胡嘉宾遗体告别仪式在京举行,1985-03-01,1985-03
简讯,1985-03-01,1985-03
排难解忧  赤诚尽职,1985-03-01,1985-03
新兴的家庭托儿事业,1985-03-01,1985-03
北京市妇联举行联欢会,1985-03-01,1985-03
创造美的人,1985-03-01,1985-03
简讯,1985-03-01,1985-03
祝您幸福,1985-03-01,1985-03
在必然王国基础上的自由王国,1985-03-01,1985-03
民主出智力,1985-03-01,1985-03
来函摘登,1985-03-01,1985-03
莱芜战役,1985-03-01,1985-03
暴力干涉婚姻自由罪（《中华人民共和国刑法》普及宣传讲话（９６））,1985-03-01,1985-03
民柬部队深入腹地痛歼越军,1985-03-01,1985-03
越南拒绝同西哈努克会谈,1985-03-01,1985-03
泰国飞机在边境上空遭越军射击  又有一批侵柬越军士兵逃奔泰国,1985-03-01,1985-03
谴责越军进攻泰柬边境平民,1985-03-01,1985-03
《越南变成最落后国家》,1985-03-01,1985-03
黎以军队在黎南部发生冲突,1985-03-01,1985-03
朝鲜将积极开展外交工作,1985-03-01,1985-03
苏军向阿富汗游击队发动新进攻,1985-03-01,1985-03
美人士指责苏在阿制造饥荒,1985-03-01,1985-03
无法无天的“声明”,1985-03-01,1985-03
以表示愿和不包括巴解的约巴联合代表团谈判,1985-03-01,1985-03
伊朗总理接见张劲夫,1985-03-01,1985-03
土耳其总理接见我大使,1985-03-01,1985-03
我大使向佛得角总统递交国书,1985-03-01,1985-03
加蓬总理接见我大使,1985-03-01,1985-03
贝尔格莱德大学开设中文专业,1985-03-01,1985-03
简讯,1985-03-01,1985-03
旅英华侨和英籍华人欢度春节,1985-03-01,1985-03
国际简讯,1985-03-01,1985-03
英国对华贸易的新势头,1985-03-01,1985-03
依靠孔塔多拉集团努力解决中美洲问题,1985-03-01,1985-03
尼加拉瓜宣布辞退古巴军事顾问,1985-03-01,1985-03
一朵初绽的改革之花,1985-03-01,1985-03
美欢迎尼加拉瓜邀请美议员参观军事基地,1985-03-01,1985-03
英国阿根廷关系有松动,1985-03-01,1985-03
舒尔茨温伯格敦促国会批准生产和部署ＭＸ导弹,1985-03-01,1985-03
英国马可尼公司终止与苏联的一项商业谈判,1985-03-01,1985-03
西欧联合干预迫使美元汇价回跌,1985-03-01,1985-03
美国发明加工米粉的新技术,1985-03-01,1985-03
英研制高效益废水处理系统,1985-03-01,1985-03
苏联研究出盐碱地治理方法,1985-03-01,1985-03
“发福”不是福,1985-03-01,1985-03
西方的获得性免疫缺损综合症,1985-03-01,1985-03
西欧发生两起严重车祸,1985-03-01,1985-03
亚热带的风,1985-03-01,1985-03
二妹子（雕塑）,1985-03-01,1985-03
祖国啊，我们的母亲！,1985-03-01,1985-03
成长为一代良才  肩负振兴中华重任,1985-03-02,1985-03
发展睦邻关系  推进友好合作,1985-03-02,1985-03
坚决纠正滥发服装等歪风,1985-03-02,1985-03
“彩票”不可取（本报评论）,1985-03-02,1985-03
包钢跨入年利润超亿元大户行列,1985-03-02,1985-03
西吉县不毛之地披上绿装,1985-03-02,1985-03
广东五华县农民自建电影场,1985-03-02,1985-03
“高干专业户”,1985-03-02,1985-03
经贸部决定对出口香港等四类纺织品全面实行出口许可证管理,1985-03-02,1985-03
一年绿化荒山十万亩,1985-03-02,1985-03
最高人民法院对专利审判作出规定,1985-03-02,1985-03
我测定米定义长度有新标准,1985-03-02,1985-03
借书岂能与赞助挂钩,1985-03-02,1985-03
为农村治穷致富办六件事,1985-03-02,1985-03
“女状元”尹静平,1985-03-02,1985-03
衡水地区实行农技综合服务,1985-03-02,1985-03
象经营承包田那样经营山,1985-03-02,1985-03
金寨县组织能人承包荒山造林,1985-03-02,1985-03
综合服务好（国内短评）,1985-03-02,1985-03
农民进城经营房产业,1985-03-02,1985-03
中城村办林木保险公司,1985-03-02,1985-03
龙眼树产出紫胶,1985-03-02,1985-03
农民急需水稻育苗催芽机,1985-03-02,1985-03
有色金属工业工作会议提出四条方针,1985-03-02,1985-03
刹住干部经商的不正之风,1985-03-02,1985-03
襄垣县城乡经济比翼齐飞,1985-03-02,1985-03
上海举办大型外贸洽谈会,1985-03-02,1985-03
全州发现珍贵稀有树种三尖杉,1985-03-02,1985-03
中日合营快餐食品公司,1985-03-02,1985-03
经济短波,1985-03-02,1985-03
在奖金面前,1985-03-02,1985-03
罐头好吃口好开,1985-03-02,1985-03
离开大医院  创业到基层,1985-03-02,1985-03
江苏完成海岸带及滩涂资源综合调查,1985-03-02,1985-03
钻空子与填空白,1985-03-02,1985-03
中国南极考察编队顺利离开南极范围,1985-03-02,1985-03
宜君农民画展有特色,1985-03-02,1985-03
电子仿生耳使一聋女重回“有声世界”,1985-03-02,1985-03
新疆气象话语广播电台为牲畜转场提供天气预报,1985-03-02,1985-03
国际米定义的三次变更,1985-03-02,1985-03
胎儿肾移植成人体内一年长大一倍多,1985-03-02,1985-03
礼品送上门  香菌木耳一一拒收  远安县水电公司抵制不正风    领导不护短  倒卖坑骗件件查处  大连十一塑料厂加强纪律性（今日首都和各省市区报纸要目）,1985-03-02,1985-03
世界女子国际象棋分区赛将在成都举行,1985-03-02,1985-03
国际奥委会将允许职业运动员参加奥运会三项比赛,1985-03-02,1985-03
三月份主要体育竞赛活动,1985-03-02,1985-03
中国队以四比零再胜文莱队,1985-03-02,1985-03
世界杯南美区预赛将开始,1985-03-02,1985-03
引人注目的世界大学生运动会,1985-03-02,1985-03
坚持实事求是和以自我教育为主的原则,1985-03-02,1985-03
保证国家和军队改革顺利进行,1985-03-02,1985-03
纪念邓演达先生诞辰九十周年,1985-03-02,1985-03
南京军区一些部队支援小城镇建设,1985-03-02,1985-03
温州查处一起派性保护坏人重大案件,1985-03-02,1985-03
在纪念邓演达先生诞辰９０周年座谈会上的讲话,1985-03-02,1985-03
招待香港新闻界朋友,1985-03-02,1985-03
五岛升率日本商工会议所访华团抵京,1985-03-02,1985-03
王丙乾会见南斯拉夫财政金融代表团,1985-03-02,1985-03
王丙乾会见非洲开发银行代表团,1985-03-02,1985-03
陈慕华同英国不管大臣举行会谈,1985-03-02,1985-03
飞吧，雏鹰,1985-03-02,1985-03
提高产品质量  维护消费者利益,1985-03-02,1985-03
“大凤蝶”“翠鸟”香烟混装,1985-03-02,1985-03
“淮海”保温瓶自然爆炸,1985-03-02,1985-03
一百七十元，买个“大杂烩”,1985-03-02,1985-03
六个多月还不见派人来修理,1985-03-02,1985-03
对产品怎能如此不负责任,1985-03-02,1985-03
走南闯北查“冒牌”,1985-03-02,1985-03
维护《统计法》的蔡连贵已复职,1985-03-02,1985-03
两个县修不起四公里路吗？,1985-03-02,1985-03
摊点断交通  行人莫奈何,1985-03-02,1985-03
蔷薇怨,1985-03-02,1985-03
学习王发英 勇于斗歪风,1985-03-02,1985-03
迫使以色列结束对黎的侵略,1985-03-02,1985-03
有关方面对建议反应各不相同,1985-03-02,1985-03
南极情深,1985-03-02,1985-03
美国欢迎埃以就中东问题进行对话,1985-03-02,1985-03
苏越蓄意加剧东南亚紧张局势,1985-03-02,1985-03
扎伊尔和南非工会谴责南非种族隔离政策,1985-03-02,1985-03
印度和世界文学国际讨论会闭幕,1985-03-02,1985-03
苏军费开支增长速度减缓,1985-03-02,1985-03
田中角荣患脑溢血住院,1985-03-02,1985-03
法国开始纪念“维克多·雨果年”,1985-03-02,1985-03
我大使向摩洛哥国王递交国书,1985-03-02,1985-03
斯里兰卡总理观看江西杂技团演出,1985-03-02,1985-03
日本外务省举行酒会欢迎我日语教师研修团,1985-03-02,1985-03
我国同新加坡开设航线,1985-03-02,1985-03
一桩成功的事业,1985-03-02,1985-03
国际简讯,1985-03-02,1985-03
非洲粮食战略会议在阿比让举行  呼吁尽一切努力实现粮食自给,1985-03-02,1985-03
法国和西德首脑表示要推进欧洲建设,1985-03-02,1985-03
不智之举,1985-03-02,1985-03
美拒绝尼加拉瓜总统的和平建议,1985-03-02,1985-03
苏在苏黎世的商业银行因亏损关闭,1985-03-02,1985-03
葛罗米柯访问西班牙,1985-03-02,1985-03
玻利维亚政府与工会关系紧张,1985-03-02,1985-03
美经济界人士说亚太地区已成为美国贸易伙伴,1985-03-02,1985-03
美元汇价暴涨使瑞典经济蒙受打击,1985-03-02,1985-03
跑过来了，基思,1985-03-02,1985-03
朴实纯真  落落大方,1985-03-02,1985-03
乌鲁木齐（双韵）,1985-03-02,1985-03
音乐园地中的嫩芽,1985-03-02,1985-03
“白色噩梦”中的“暖流”,1985-03-02,1985-03
多用电声扬琴研制成功,1985-03-02,1985-03
简讯,1985-03-02,1985-03
简讯,1985-03-02,1985-03
简讯,1985-03-02,1985-03
简讯,1985-03-02,1985-03
简讯,1985-03-02,1985-03
简讯,1985-03-02,1985-03
简讯,1985-03-02,1985-03
简讯,1985-03-02,1985-03
吉祥如意,1985-03-02,1985-03
上海技术市场带来巨大经济效益,1985-03-03,1985-03
经验：坚持造林和护林并重,1985-03-03,1985-03
研究科技体制改革的重大问题,1985-03-03,1985-03
全国检察系统召开表彰大会,1985-03-03,1985-03
“报忧”和“不报忧”,1985-03-03,1985-03
武汉少数银行办事处竟向客户索要“劳务费”,1985-03-03,1985-03
去年吸收外资和引进技术增多,1985-03-03,1985-03
积极指导农民安排种植计划,1985-03-03,1985-03
给贡献突出的姜泗长记二等功,1985-03-03,1985-03
湟中县养殖专业户过万,1985-03-03,1985-03
儿媳相婆婆,1985-03-03,1985-03
北京市工业企业前景广阔,1985-03-03,1985-03
克东县农民多种形式承包造林效果好,1985-03-03,1985-03
政策兑现  取信于民（国内短评）,1985-03-03,1985-03
淇县实现农田林网化,1985-03-03,1985-03
沈阳市塑料六厂四年改变面貌,1985-03-03,1985-03
卖货和尊重人,1985-03-03,1985-03
南召县解决林牧矛盾促进羊只发展,1985-03-03,1985-03
靠技术进步  增强企业实力,1985-03-03,1985-03
制止滥杀羊,1985-03-03,1985-03
十七天解决扯皮十五年的问题,1985-03-03,1985-03
世界屋脊创奇迹,1985-03-03,1985-03
第二批企业经理厂长国家统考成绩揭晓,1985-03-03,1985-03
黑龙江航运部门停航不停工,1985-03-03,1985-03
上海节能创历史新纪录,1985-03-03,1985-03
农民创办贸易信息公司,1985-03-03,1985-03
安庆石化总厂设外轮加油站,1985-03-03,1985-03
太原使用电话计次计时设备,1985-03-03,1985-03
扎实改革  成效自见,1985-03-03,1985-03
再见了，南极！,1985-03-03,1985-03
纪念马连良诞辰八十五周年座谈会在京举行,1985-03-03,1985-03
希望广大教师在改革中创造、探索,1985-03-03,1985-03
全国妇联邀请女文艺工作者座谈,1985-03-03,1985-03
净化环境的秃鹫,1985-03-03,1985-03
食堂办不好  农民来承包  云南大学改革后勤工作走出一步好棋    绿化有雄心  平原可造林  珠江下游营造农田林网惠及万代子孙（今日首都和各省市区报纸要目）,1985-03-03,1985-03
关键在于打好基础  如何实现我国足球的腾飞？（１８）,1985-03-03,1985-03
赶快解决场地荒  如何实现我国足球的腾飞？（１８）,1985-03-03,1985-03
把足球踢到农村来  如何实现我国足球的腾飞？（１８）,1985-03-03,1985-03
编后,1985-03-03,1985-03
普及,1985-03-03,1985-03
能干的女县长,1985-03-03,1985-03
部分全国人大代表视察北京市工作,1985-03-03,1985-03
武警部队积极支援地方经济建设,1985-03-03,1985-03
福州军区某部为改建福马公路承担任务,1985-03-03,1985-03
川东川西群众帮助部队维护通信线路,1985-03-03,1985-03
应得到的启示,1985-03-03,1985-03
格尔木市领导干部认真改进作风,1985-03-03,1985-03
王尚先郑国清主动退还“挂钩奖”,1985-03-03,1985-03
湖南省委着手处理长沙市工商局负责人诬陷记者问题,1985-03-03,1985-03
纪念“三八”国际劳动妇女节,1985-03-03,1985-03
我国新增两个不需办旅行证的开放地区,1985-03-03,1985-03
许家屯举行酒会招待香港各界知名人士,1985-03-03,1985-03
请客送礼挥霍公款四千余元,1985-03-03,1985-03
借职权之便敲诈勒索集体企业和个体户,1985-03-03,1985-03
陈慕华宋平分别会见日本商工会议所访华团,1985-03-03,1985-03
简讯,1985-03-03,1985-03
有热就能发光,1985-03-03,1985-03
建立起教育与经济的新联系,1985-03-03,1985-03
首都大学生勤工助学活动的新发展,1985-03-03,1985-03
校外教育也要改革,1985-03-03,1985-03
文科改革与图书馆,1985-03-03,1985-03
高校考查办法有弊病,1985-03-03,1985-03
舒尔茨与尼加拉瓜总统奥尔特加会晤,1985-03-03,1985-03
号召国民军内外线配合作战歼灭越军有生力量,1985-03-03,1985-03
一块遮羞布,1985-03-03,1985-03
最深切的感受,1985-03-03,1985-03
乌拉圭民选总统桑吉内蒂宣誓就职,1985-03-03,1985-03
国际要闻简报,1985-03-03,1985-03
乌拉圭和委内瑞拉恢复外交关系,1985-03-03,1985-03
法国政府支持尼加拉瓜总统和平建议,1985-03-03,1985-03
我国为国际和平年认捐一万美元,1985-03-03,1985-03
我新任驻苏大使向苏领导人递交国书,1985-03-03,1985-03
我政府代表团结束对阿联酋正式访问,1985-03-03,1985-03
葛罗米柯南欧之行,1985-03-03,1985-03
缅甸珠宝世界第一,1985-03-03,1985-03
国际经济动态,1985-03-03,1985-03
泰华兄弟亲,1985-03-03,1985-03
巴黎观鸽随想,1985-03-03,1985-03
马累小景,1985-03-03,1985-03
明天的大学,1985-03-03,1985-03
烟草今昔轶话,1985-03-03,1985-03
预报国际流行色的人们,1985-03-03,1985-03
海峡群岛的变迁,1985-03-03,1985-03
南充丝绸,1985-03-03,1985-03
层层放权  提拔能人  重奖重罚,1985-03-04,1985-03
不义之财切莫取（本报评论）,1985-03-04,1985-03
工商银行石家庄支行  中华大街办事处严重违反财经纪律,1985-03-04,1985-03
竟违背政策  突击提工资,1985-03-04,1985-03
退款记,1985-03-04,1985-03
增进友谊  加强合作（社论）,1985-03-04,1985-03
协调一致行动保护拉美共同利益,1985-03-04,1985-03
“童装大比美”好吗？,1985-03-04,1985-03
越是开放地区越要做好管理工作,1985-03-04,1985-03
宝钢第一座焦炉点火烘炉,1985-03-04,1985-03
我国有了第一个女试飞员,1985-03-04,1985-03
四川罗城古镇重视古代风貌,1985-03-04,1985-03
大厂应放权给车间,1985-03-04,1985-03
河北怀来物价局协调服务有方,1985-03-04,1985-03
北京市广泛开展物价检查,1985-03-04,1985-03
沈阳市第一粮库等单位受到制裁,1985-03-04,1985-03
有色金属工业要面向国际市场,1985-03-04,1985-03
放开，不是撒手不管（国内短评）,1985-03-04,1985-03
煤炭部要求各煤矿十分注意安全生产,1985-03-04,1985-03
承德市农村“两户一体”迅速发展,1985-03-04,1985-03
南京名厨师胡长龄获荣誉证书,1985-03-04,1985-03
汕头市试行住宅商品化,1985-03-04,1985-03
青海畜牧业“西繁东育”效果好,1985-03-04,1985-03
上海石洞口电厂开工,1985-03-04,1985-03
天津自行车二厂职工增强主人翁责任感,1985-03-04,1985-03
河南养牛业发展快,1985-03-04,1985-03
营口采取优惠政策兴办第三产业,1985-03-04,1985-03
洛阳牡丹首次进入澳门花市,1985-03-04,1985-03
沈阳物资贸易中心开业,1985-03-04,1985-03
北京推广无油透明切削液,1985-03-04,1985-03
把资金转向内地,1985-03-04,1985-03
喜看八方争人才,1985-03-04,1985-03
喜中隐忧,1985-03-04,1985-03
“三八”节前后有六部新影片上映,1985-03-04,1985-03
首都一批名老中医将“坐堂行医”,1985-03-04,1985-03
谁言玉门关春风不度  甘肃一年引进专业人才千余名  可喜    试看浦江畔群星灿烂  上海全市表彰服务人员五百多  当贺（今日首都和各省市区报纸要目）,1985-03-04,1985-03
杨岳山进入全能决赛  李宁因伤退出比赛,1985-03-04,1985-03
大熊猫被定为世界少年足球锦标赛吉祥物,1985-03-04,1985-03
中国女队获罗马尼亚乒乓球公开赛决赛权,1985-03-04,1985-03
中国四名选手进入联邦德国羽毛球公开锦标赛半决赛,1985-03-04,1985-03
紧张激烈的美式足球,1985-03-04,1985-03
建议台湾与大陆共同开发南极,1985-03-04,1985-03
农家经济收入显著增加,1985-03-04,1985-03
台湾的大专院校（二）,1985-03-04,1985-03
小学生交通事故频繁,1985-03-04,1985-03
海员人数锐减,1985-03-04,1985-03
怀故乡六角亭与三星桥,1985-03-04,1985-03
台湾简讯,1985-03-04,1985-03
高尔夫球女将——涂阿玉,1985-03-04,1985-03
不忘昨天  珍惜今天,1985-03-04,1985-03
南京军区空军党委在整党中转变机关作风,1985-03-04,1985-03
军队要模范执行党和政府政策法令,1985-03-04,1985-03
中国人大代表团离京赴苏联访问,1985-03-04,1985-03
姚依林会见日本商工会议所访华团,1985-03-04,1985-03
耿耿赤诚骨肉情,1985-03-04,1985-03
黄景秋获“青年智力拥军模范”称号,1985-03-04,1985-03
荣毅仁会见英国经济贸易代表团,1985-03-04,1985-03
简讯,1985-03-04,1985-03
特事特办  新事新办,1985-03-04,1985-03
领导与律师,1985-03-04,1985-03
小统计,1985-03-04,1985-03
律师的呼声,1985-03-04,1985-03
住宅商品化与我国城市住房制度的改革,1985-03-04,1985-03
农村商品经济发展与传统观念的变革,1985-03-04,1985-03
市场  技术  资源,1985-03-04,1985-03
缅甸准备热烈欢迎李主席,1985-03-04,1985-03
柬埔寨目前形势对抵抗力量有利,1985-03-04,1985-03
阿拉法特表示承担对约巴协议的义务,1985-03-04,1985-03
英国王太子查尔斯献血,1985-03-04,1985-03
科威特组成以萨阿德为首的新内阁,1985-03-04,1985-03
缅甸水稻又获丰收,1985-03-04,1985-03
齐亚·哈克宣布修改巴基斯坦宪法,1985-03-04,1985-03
业余干家务  劳动以健身,1985-03-04,1985-03
民间艺术的盛大节日,1985-03-04,1985-03
我人大代表团抵苏联进行友好访问,1985-03-04,1985-03
伊朗总统接见国务委员张劲夫,1985-03-04,1985-03
挪威国王和首相出席我兵马俑展览开幕式,1985-03-04,1985-03
国际简讯,1985-03-04,1985-03
让心灵先自由,1985-03-04,1985-03
怀念阿英同志,1985-03-04,1985-03
识才·爱才·扶才,1985-03-04,1985-03
“通感”和“通知”（文艺评论）,1985-03-04,1985-03
“活着的荷马”（文艺评论）,1985-03-04,1985-03
“石敢当”的联想,1985-03-04,1985-03
流云,1985-03-04,1985-03
花,1985-03-04,1985-03
《不惑集》序言,1985-03-04,1985-03
历史的回声,1985-03-04,1985-03
秋游,1985-03-04,1985-03
李先念主席抵仰光受到热烈欢迎,1985-03-05,1985-03
第三世界发展是和平力量重要因素,1985-03-05,1985-03
赵紫阳会见英国经济贸易代表团  共同努力扩大中英经济技术合作,1985-03-05,1985-03
国务院通知：制止滥发各种奖券,1985-03-05,1985-03
剪彩三问,1985-03-05,1985-03
历时一年的英国煤矿工人罢工结束,1985-03-05,1985-03
当代“杜康”,1985-03-05,1985-03
青岛啤酒厂年产能力翻番,1985-03-05,1985-03
家畜家禽防疫条例,1985-03-05,1985-03
兴办家庭林场  加速发展林业,1985-03-05,1985-03
农行天水地区中心支行刹不正之风,1985-03-05,1985-03
“家庭林场好”（国内短评）,1985-03-05,1985-03
甘当配角,1985-03-05,1985-03
肥东县八斗区乡乡建立农民邮电服务公司,1985-03-05,1985-03
哈尔滨铁路局层层承包见效果,1985-03-05,1985-03
和田地区造林取得好成绩,1985-03-05,1985-03
山东五百多万亩陡坡地退耕还林,1985-03-05,1985-03
四川许多乡镇企业积极引进人才,1985-03-05,1985-03
薄利多销生意好,1985-03-05,1985-03
热情招待五洲客,1985-03-05,1985-03
哈尔滨技术市场巡礼,1985-03-05,1985-03
技术商品在全行业走俏,1985-03-05,1985-03
山西注意办实事落实政策不空谈,1985-03-05,1985-03
人发中硒含量过低易得癌症,1985-03-05,1985-03
不要“画饼”,1985-03-05,1985-03
我国与欧洲共同体合办的经营管理硕士研究生班开学,1985-03-05,1985-03
一百六十多名书法家向中国残疾人福利基金会捐赠作品,1985-03-05,1985-03
全国技术发展战略思想学术会议在京举行,1985-03-05,1985-03
中国文化讲习班在京开学,1985-03-05,1985-03
中日合作研究开发动物细胞培养技术,1985-03-05,1985-03
记协职工新闻学院将招八十名新生,1985-03-05,1985-03
刘思慕同志逝世,1985-03-05,1985-03
语言学家彭铎逝世,1985-03-05,1985-03
监狱也办学校  天津一犯人文化学校铺设新路  改造人  造就人    局规公诸于众  杭州标准计量局人员手持名片  不徇私  不谋私（今日首都和各省市区报纸要目）,1985-03-05,1985-03
中国选手在联邦德国羽毛球公开赛获三项冠军,1985-03-05,1985-03
一九八五年美国杯体操锦标赛结束,1985-03-05,1985-03
西藏举行妇女藏文书法竞赛,1985-03-05,1985-03
打破坚冰辟通道,1985-03-05,1985-03
全国法院“双先”表彰大会闭幕  彭真陈丕显写信向大会表示祝贺,1985-03-05,1985-03
严肃查处变相滥发奖金实物的典型事件,1985-03-05,1985-03
发扬雷锋“傻子”精神  全心全意为人民服务,1985-03-05,1985-03
到基层调查研究  为群众排忧解难,1985-03-05,1985-03
中国国际信托投资公司和日本商工会议所合作协议书签字日本商工会议所访华团离京去外地参观,1985-03-05,1985-03
李鹏分别会见英国经济贸易代表团和日本客人,1985-03-05,1985-03
业余值勤五春秋,1985-03-05,1985-03
台湾“立法委员”蔡辰洲被拘捕,1985-03-05,1985-03
中英签署技术合作文件,1985-03-05,1985-03
秦皇岛劳教所取得新成绩,1985-03-05,1985-03
人才·品种·管理·销售,1985-03-05,1985-03
党内外群众精神振奋  改革和工作生机勃勃,1985-03-05,1985-03
看清官僚主义危害,1985-03-05,1985-03
何必“事必躬亲”,1985-03-05,1985-03
选人失当亦有责,1985-03-05,1985-03
党员教育一忌,1985-03-05,1985-03
搬“山”填“海”下基层,1985-03-05,1985-03
希望有“党外之声”,1985-03-05,1985-03
勇当这样的“拆庙”人,1985-03-05,1985-03
地委书记赠春联,1985-03-05,1985-03
落实政策要注重效率（国内短评）,1985-03-05,1985-03
从苦泪咽肚到热泪盈眶,1985-03-05,1985-03
共写友谊新篇章,1985-03-05,1985-03
缅甸的大型综合饲养场,1985-03-05,1985-03
几内亚比绍尼日利亚强调加强南南合作,1985-03-05,1985-03
将互相合作为实现民主化而斗争,1985-03-05,1985-03
亚太国家教育部长和经济负责人会议开幕,1985-03-05,1985-03
澳新美理事会年会延期,1985-03-05,1985-03
菲律宾外交部长被解除职务,1985-03-05,1985-03
吉布提总统出席我援建的人民宫竣工仪式,1985-03-05,1985-03
印度副总统接见我基督教代表团,1985-03-05,1985-03
利比亚叙利亚民主也门协调立场,1985-03-05,1985-03
苏丹总统宣布对南方反政府武装单方面停火,1985-03-05,1985-03
通向民主进程的重要一步,1985-03-05,1985-03
国际简讯,1985-03-05,1985-03
欧洲国家应参加日内瓦军备控制谈判,1985-03-05,1985-03
里根“把球踢给了日本”,1985-03-05,1985-03
美国取消日本向美国出口汽车的自愿限制,1985-03-05,1985-03
