雁北地区集资修建中小学,1985-03-15,1985-03
行长的“检查”,1985-03-15,1985-03
沈阳市改革副食品生产流通体制,1985-03-15,1985-03
“闵行三大家”技术改造刻不容缓,1985-03-15,1985-03
陕县电器厂靠培养人才发展企业,1985-03-15,1985-03
放开搞活  改善供应（本报评论）,1985-03-15,1985-03
产品开发靠人才,1985-03-15,1985-03
把关又服务是商检工作改革方向,1985-03-15,1985-03
台历可作好文章,1985-03-15,1985-03
黑龙江省一年造林二百余万亩,1985-03-15,1985-03
注意医药质量  加强中药工作,1985-03-15,1985-03
中国农村能源协会在京成立,1985-03-15,1985-03
长虹彩电通过鉴定大批量生产,1985-03-15,1985-03
中太发展有限公司协议签字,1985-03-15,1985-03
五单位主办复印机技术咨询展销会,1985-03-15,1985-03
简讯,1985-03-15,1985-03
选城乡办盐水蘑菇加工厂,1985-03-15,1985-03
亿元乡“彩照热”,1985-03-15,1985-03
咨询服务上门,1985-03-15,1985-03
农民代办电信营业处,1985-03-15,1985-03
希望微量元素投放农村市场,1985-03-15,1985-03
春风吹绿莱西县,1985-03-15,1985-03
乡镇企业成为广阔的技术市场,1985-03-15,1985-03
军工系统向民用部门转让技术,1985-03-15,1985-03
一项真正的开发事业,1985-03-15,1985-03
基础研究基金制优于拨款制,1985-03-15,1985-03
湖南农村普遍办农民文化技术学校,1985-03-15,1985-03
新疆表彰保护珍稀动物有功人员,1985-03-15,1985-03
创造出治疗骶骨肿瘤新方法,1985-03-15,1985-03
中国南极考察船队在归途中安全通过西风带,1985-03-15,1985-03
《中国野生动物》大型影视系列纪录片即将开拍,1985-03-15,1985-03
《焦菊隐文集》将陆续出版,1985-03-15,1985-03
法国向艾青、吴作人等授勋,1985-03-15,1985-03
群众与企业打官司  法院开庭审理  安岳县种子公司违约赔款    农民同专家签合同  创办科研基地  郇封乡青年农民远见卓识（今日首都和各省市区报纸要目）,1985-03-15,1985-03
中国女子垒球队战胜美国队,1985-03-15,1985-03
优秀速滑运动员——王秀丽,1985-03-15,1985-03
涌现出一批很有希望的新秀,1985-03-15,1985-03
全国公安足球选拔赛在广州举行,1985-03-15,1985-03
一九八五年全国高山滑雪比赛结束,1985-03-15,1985-03
沧源佤族自治县培养佤族服装制作人才,1985-03-15,1985-03
提高党员全心全意为人民服务的觉悟,1985-03-15,1985-03
永州市委开展党性党纪教育,1985-03-15,1985-03
石家庄地委纠正新的不正之风,1985-03-15,1985-03
祝贺残疾人附捐特种邮票发行,1985-03-15,1985-03
为何突击提干,1985-03-15,1985-03
北京军区某团一批退伍战士发挥作用,1985-03-15,1985-03
军队干部柯良坚韧不拔自学成才,1985-03-15,1985-03
京津沪三市团委商定在工业和高校系统青年中开展联谊竞赛活动,1985-03-15,1985-03
平谷县积极推行火葬取得成效,1985-03-15,1985-03
广东省一批致富退伍军人不忘扶贫,1985-03-15,1985-03
福州纺织印染厂党委引导后进青工走正路,1985-03-15,1985-03
南京市郊两万多民兵和退伍军人为烈军属义务助耕,1985-03-15,1985-03
蒙汉牧民联合举办民族团结家庭那达慕大会,1985-03-15,1985-03
杨海波当选安徽省政协主席,1985-03-15,1985-03
台湾著名老作家杨逵病逝,1985-03-15,1985-03
许龙超当律师受到群众称赞,1985-03-15,1985-03
宋平会见孟加拉国客人,1985-03-15,1985-03
康世恩会见美国客人,1985-03-15,1985-03
民主也门外长达利在广东参观访问,1985-03-15,1985-03
邮电部发行的《中国残疾人》附捐特种邮票,1985-03-15,1985-03
巴布亚新几内亚林业部长举行告别宴会,1985-03-15,1985-03
扩大企业的投资决策权,1985-03-15,1985-03
必须改变当前哲学研究的落后状况,1985-03-15,1985-03
认真研究关于政府职能的理论,1985-03-15,1985-03
读《北洋军阀史稿》,1985-03-15,1985-03
《中国教育年鉴》评介,1985-03-15,1985-03
苏最高苏维埃第一副主席接见我人大代表团,1985-03-15,1985-03
李主席抵清迈府访问受到热烈欢迎,1985-03-15,1985-03
徐信与泰国军方领导人会谈,1985-03-15,1985-03
苏联党政领导人会见外国代表团,1985-03-15,1985-03
李鹏看望我驻苏机构人员和留学生,1985-03-15,1985-03
西哈努克说柬内地的战斗是决定性的,1985-03-15,1985-03
联合国秘书长对泰柬边境局势表示关切,1985-03-15,1985-03
美国在安理会否决谴责以色列的决议,1985-03-15,1985-03
夏卡朋出任西哈努克民族主义军副总参谋长,1985-03-15,1985-03
美国研究向泰出售Ｆ—１６战斗机,1985-03-15,1985-03
阿萨德宣誓就任叙利亚总统,1985-03-15,1985-03
土耳其驻加拿大使馆遭暴徒袭击,1985-03-15,1985-03
越在澳外长访越时继续玩弄政治花招,1985-03-15,1985-03
两伊互袭对方首都使战争升级,1985-03-15,1985-03
塞拉利昂总统接见我离任大使,1985-03-15,1985-03
国际简讯,1985-03-15,1985-03
法国四百五十名青年将乘火车访华,1985-03-15,1985-03
联合国关于非洲紧急形势会议闭幕,1985-03-15,1985-03
一些非洲国家旱情有所发展,1985-03-15,1985-03
拉美“民主化进程”的新进展,1985-03-15,1985-03
要求美苏政府把诺言变为行动,1985-03-15,1985-03
要求两个超级大国停止军备竞赛  欧洲一些国家群众在日内瓦示威,1985-03-15,1985-03
谴责美“星球大战”计划,1985-03-15,1985-03
昂纳克强调当前最重要任务是维护和平,1985-03-15,1985-03
哥伦比亚多米尼加总统主张谈判解决中美洲问题,1985-03-15,1985-03
“相似”但不相同,1985-03-15,1985-03
支持孔塔多拉集团的和平努力,1985-03-15,1985-03
咖啡杯里有“危险”,1985-03-15,1985-03
到南极去,1985-03-15,1985-03
云飞故乡,1985-03-15,1985-03
拉网〔漆画〕,1985-03-15,1985-03
六届人大常委会举行第十次会议,1985-03-16,1985-03
决定二十五日召开政协六届三次会议,1985-03-16,1985-03
李先念主席出访圆满成功回到贵阳,1985-03-16,1985-03
今年全国各类高等学校计划招生１１６万多人,1985-03-16,1985-03
发展睦邻友好关系的新篇章（社论）,1985-03-16,1985-03
全国中专、农中、职中今年将招收１７５万多人,1985-03-16,1985-03
李鹏率我国政府代表团回京,1985-03-16,1985-03
孝感第一家农民自来水公司开业,1985-03-16,1985-03
第一代黎族作家龙敏的小说出版,1985-03-16,1985-03
毕节地区群众兴修公路,1985-03-16,1985-03
已改正“赞助”做法,1985-03-16,1985-03
划清一条界限,1985-03-16,1985-03
令行禁止有错必纠,1985-03-16,1985-03
战士上课当老师,1985-03-16,1985-03
逐级放权定责  企业充满活力,1985-03-16,1985-03
逐级放权与层层负责,1985-03-16,1985-03
“三北”防护林首期工程即将完成,1985-03-16,1985-03
江西超额完成造林计划,1985-03-16,1985-03
哈尔滨鲜蛋产销两旺价格稳定,1985-03-16,1985-03
国务院发布《中华人民共和国海洋倾废管理条例》,1985-03-16,1985-03
管理混乱连年亏损  弄虚作假滥发奖金,1985-03-16,1985-03
人不干净货也滞,1985-03-16,1985-03
聚财必须善于生财,1985-03-16,1985-03
乡下人的“贴心店”,1985-03-16,1985-03
南京市商业网点迅速增加,1985-03-16,1985-03
上无二厂帮厦门办企业,1985-03-16,1985-03
经济短波,1985-03-16,1985-03
巴东夏橙丰收在望,1985-03-16,1985-03
黄土高原水土保持工作亟待协调,1985-03-16,1985-03
干预也是一种改革,1985-03-16,1985-03
段甲岭上落凤凰,1985-03-16,1985-03
珍惜创作自由  保证创作自由,1985-03-16,1985-03
我国首次饲养繁殖出一对雪豹,1985-03-16,1985-03
向乡镇企业和专业户供应技术,1985-03-16,1985-03
二百一十七件歌颂祖国海疆的作品获“银帆”奖,1985-03-16,1985-03
首届金盾美术书法摄影作品展览在京开幕,1985-03-16,1985-03
北京印染厂改革经验汇编成《企业腾飞之路》一书出版,1985-03-16,1985-03
石钰镐的新发明,1985-03-16,1985-03
我将在日本筑波国际科学博览会展出火箭卫星,1985-03-16,1985-03
乱涨价  搞虚假  缺斤两  均在抵制之列  吴桥商业系统不含糊    等人上  招手停  请客坐  都是改革成果  武汉公共汽车新面貌（今日首都和各省市区报纸要目）,1985-03-16,1985-03
世界女子国际象棋分区赛在成都揭幕,1985-03-16,1985-03
世界冰球Ｃ组比赛在法国举行,1985-03-16,1985-03
瑞典发行蔡振华纪念邮票,1985-03-16,1985-03
李来群获王冠荣中国象棋大师赛冠军,1985-03-16,1985-03
瑞典羽毛球公开赛爆冷门,1985-03-16,1985-03
全国花样滑冰比赛结束,1985-03-16,1985-03
建设有中国特色的残疾人福利事业,1985-03-16,1985-03
对第二期整党单位实行分类指导,1985-03-16,1985-03
为多出人才快出人才作贡献,1985-03-16,1985-03
住在新疆的全国人大代表就地视察工作,1985-03-16,1985-03
中国人大代表团回到北京,1985-03-16,1985-03
习仲勋宴请纳米比亚西南非洲人民组织代表团,1985-03-16,1985-03
王震康克清分别会见日中妇女友好交流访华团,1985-03-16,1985-03
中国政府同联合国儿童基金会一九八五—一九八九年年合作方案行动计划在京签字,1985-03-16,1985-03
姚依林会见孟加拉国计划部长,1985-03-16,1985-03
合肥市政府一杯清茶谢功臣,1985-03-16,1985-03
陈慕华会见美国毕萃斯集团董事长,1985-03-16,1985-03
民主也门外长达利离京回国,1985-03-16,1985-03
外交部驻香港签证办事处主任陈世培到任,1985-03-16,1985-03
在祖国的夜空中,1985-03-16,1985-03
热血男儿一席谈,1985-03-16,1985-03
三河县一些棉花收购站敲诈卖棉人（勇于向不正之风作斗争）,1985-03-16,1985-03
他们在勒索棉农（勇于向不正之风作斗争）,1985-03-16,1985-03
不义之财一分也不能要,1985-03-16,1985-03
在收购粮食中开后门收贿赂  青堆子粮库李德文等受处分（勇于向不正之风作斗争）,1985-03-16,1985-03
电影发行体制要改变,1985-03-16,1985-03
多拍些科技教学电视片,1985-03-16,1985-03
盒式录音磁带应当这样保管,1985-03-16,1985-03
接受读者批评  抓紧治理污染,1985-03-16,1985-03
向邮电部门道歉,1985-03-16,1985-03
当心火车！,1985-03-16,1985-03
李主席结束对泰国访问回国,1985-03-16,1985-03
及时的忠告,1985-03-16,1985-03
泰国十六个县实行戒严,1985-03-16,1985-03
我政府代表团离莫斯科回国,1985-03-16,1985-03
中曾根和戈尔巴乔夫会谈表示要改善关系,1985-03-16,1985-03
我人大代表团结束访苏,1985-03-16,1985-03
谷牧向巴西总统递交特使证书,1985-03-16,1985-03
黎巴嫩长枪党发生分裂,1985-03-16,1985-03
亚太教育及经济规划部长会议在泰举行呼吁加强合作发展本地区教育,1985-03-16,1985-03
英女王和首相接见我离任大使,1985-03-16,1985-03
巴黎市长授予我三名医生银质勋章,1985-03-16,1985-03
两伊在南部战场展开激战,1985-03-16,1985-03
泰国发展植树护林村,1985-03-16,1985-03
美驻黎使馆部分人员撤离贝鲁特,1985-03-16,1985-03
通过对话和协商改善北南关系,1985-03-16,1985-03
让全社会都关怀老人,1985-03-16,1985-03
美苏武器控制谈判举行二次会议,1985-03-16,1985-03
比利时政府决定按计划部署美国巡航导弹,1985-03-16,1985-03
主要国家地铁犯罪率情况,1985-03-16,1985-03
筑波国际科技博览会展望,1985-03-16,1985-03
“创作自由”随想,1985-03-16,1985-03
民族精神的颂歌《秦俑魂》,1985-03-16,1985-03
增刊之忧,1985-03-16,1985-03
要把人物演活,1985-03-16,1985-03
中国秦兵马俑在挪威,1985-03-16,1985-03
话剧《乞丐与王子》上演,1985-03-16,1985-03
《绿叶奖》征歌揭晓,1985-03-16,1985-03
牛,1985-03-16,1985-03
看高甲戏《凤冠梦》,1985-03-16,1985-03
辋川胜景（文化生活）,1985-03-16,1985-03
加强物价管理和监督检查坚决刹住乱涨价不正之风,1985-03-17,1985-03
制定涉外经济合同法有利我国经济建设,1985-03-17,1985-03
走一步看一步——记武汉市蔬菜市场放开前后,1985-03-17,1985-03
坚决支持纳米比亚人民正义斗争,1985-03-17,1985-03
怪事一桩,1985-03-17,1985-03
阎红、关平、徐永久竞走创世界最好成绩,1985-03-17,1985-03
中美应多层次多渠道发展友好关系,1985-03-17,1985-03
勿做穿凿文章,1985-03-17,1985-03
衡阳商业系统改革管理机构,1985-03-17,1985-03
简政放权  以少胜多,1985-03-17,1985-03
联合捏合  两种结果,1985-03-17,1985-03
联合不是捏合,1985-03-17,1985-03
从４月１日起实行新列车运行图,1985-03-17,1985-03
建材工业需要大发展,1985-03-17,1985-03
济宁市郊区算帐表明：决不能放松粮食生产,1985-03-17,1985-03
银川市物价局查处一起倒卖钢材案件,1985-03-17,1985-03
大通空运（中国）有限公司开业,1985-03-17,1985-03
丹东ＴＪＳ调谐器七次降价,1985-03-17,1985-03
新型小螺距测量仪研制成功,1985-03-17,1985-03
广西探明一个大型氧化锰矿床,1985-03-17,1985-03
产品质量监督试行办法,1985-03-17,1985-03
下功夫办好农村职业技术教育,1985-03-17,1985-03
文凭的贬值,1985-03-17,1985-03
高校承担国家经济建设科研任务硕果累累,1985-03-17,1985-03
一项荣获国家一等发明奖的成果转让成交,1985-03-17,1985-03
全国优秀中短篇小说和报告文学评选揭晓,1985-03-17,1985-03
华罗庚当选为联邦德国巴伐利亚科学院通讯院士,1985-03-17,1985-03
天津发现“肝炎灵”对乙型肝炎病毒有抑制作用,1985-03-17,1985-03
香港和内地摄影界交流技艺,1985-03-17,1985-03
奇异的青海湖,1985-03-17,1985-03
面向国际市场  到处建“聚宝盆”  佛山农村建立商品生产基地  制止涨价之风  此地有“定风珠”  黄石国营商业稳定市场物价（今日首都和各省市区报纸要目）,1985-03-17,1985-03
中国冰球队战平法国队,1985-03-17,1985-03
中国队战胜阿联酋队,1985-03-17,1985-03
瑞典羽毛球公开赛复赛结束,1985-03-17,1985-03
中国队在南太平洋女子垒球赛中进入前三名,1985-03-17,1985-03
朱建华在广州跳过二米三四,1985-03-17,1985-03
芬兰和美国运动员连超跳台跳雪世界最好成绩,1985-03-17,1985-03
荷兰的冰上马拉松节,1985-03-17,1985-03
提高女职工政治文化科学素质  维护合法权益,1985-03-17,1985-03
全国人大代表团访问卢旺达布隆迪扎伊尔情况,1985-03-17,1985-03
全国人大法律委员会对涉外经济合同法草案审议结果的报告,1985-03-17,1985-03
全国人大法律委员会对继承法草案审议结果的报告,1985-03-17,1985-03
安置伤病残退伍军人,1985-03-17,1985-03
在拉萨的全国人大代表和全国政协委员联合在西藏就地视察工作,1985-03-17,1985-03
档案工作要更好地为两个文明建设服务,1985-03-17,1985-03
法网与关系网,1985-03-17,1985-03
郝建秀会见法国共产主义青年运动代表团,1985-03-17,1985-03
吴学谦宴请纳米比亚西南非洲人民组织代表团,1985-03-17,1985-03
认真贯彻执行中英联合声明  维护香港稳定繁荣,1985-03-17,1985-03
陈慕华会见欧洲机床工业合作委员会代表团,1985-03-17,1985-03
庆祝中拉友协成立二十五周年,1985-03-17,1985-03
中国政府代表团离京出席教科文组织国际成人教育会议,1985-03-17,1985-03
简讯,1985-03-17,1985-03
推行治安合同  保护“两户一体”,1985-03-17,1985-03
台湾民主自治同盟对台湾著名作家杨逵先生的逝世表示哀悼,1985-03-17,1985-03
职业教育要以质量求发展,1985-03-17,1985-03
不要片面理解早期教育,1985-03-17,1985-03
对高等教育改革的几点浅见,1985-03-17,1985-03
民主德国的职业教育,1985-03-17,1985-03
扩建图书馆是高校挖潜的捷径,1985-03-17,1985-03
扩建图书馆是高校挖潜的捷径,1985-03-17,1985-03
泰国若再遭越军侵犯  泰军将越界打击敌人,1985-03-17,1985-03
安理会呼吁两伊双方停止敌对行动,1985-03-17,1985-03
里根说苏领导人确实准备同美谈判,1985-03-17,1985-03
巴西举行新总统就职仪式,1985-03-17,1985-03
日本国际科技博览会开幕,1985-03-17,1985-03
黎巴嫩议长呼吁加强全国团结,1985-03-17,1985-03
苏联集会纪念孙中山逝世六十周年,1985-03-17,1985-03
孟斯两国总统接见我国际交流协会代表团,1985-03-17,1985-03
中利混合委员会举行第二次会议,1985-03-17,1985-03
中国银行伦敦分行建立格拉斯哥支行,1985-03-17,1985-03
印度高级代表团将访巴基斯坦,1985-03-17,1985-03
玻利维亚大选推迟举行,1985-03-17,1985-03
阿根廷参院批准阿智和平友好条约,1985-03-17,1985-03
日美贸易谈判结束,1985-03-17,1985-03
美劳工部长因诈骗案被迫辞职,1985-03-17,1985-03
“可口可乐”与伍德拉夫,1985-03-17,1985-03
西南非洲人民组织,1985-03-17,1985-03
核力量对比,1985-03-17,1985-03
国际简讯,1985-03-17,1985-03
艺术相通心相连,1985-03-17,1985-03
一位可敬的普通苏联公民,1985-03-17,1985-03
武术之家,1985-03-17,1985-03
漫游自由城,1985-03-17,1985-03
上马下马话“幽谷”,1985-03-17,1985-03
美国的自疗热,1985-03-17,1985-03
瓷都景德镇,1985-03-17,1985-03
国务院通知坚决制止就地转手倒卖活动,1985-03-18,1985-03
谨防被欺（本报评论）,1985-03-18,1985-03
桃江县核减虚报数字,1985-03-18,1985-03
田纪云强调增加优质粮食种植面积和产量,1985-03-18,1985-03
严禁非法倒卖外汇和外币流通,1985-03-18,1985-03
工业生产经济效益明显改善,1985-03-18,1985-03
“令必行，禁必止”,1985-03-18,1985-03
甘肃八百万亩坡地将退耕还林还草,1985-03-18,1985-03
苏州探明一座高岭土矿,1985-03-18,1985-03
麻城集资两千万元办学,1985-03-18,1985-03
厦门开办日美直拨电话,1985-03-18,1985-03
广东兴建邮电重点工程,1985-03-18,1985-03
深圳百货公司经理夸党委,1985-03-18,1985-03
今日雁北赶江南,1985-03-18,1985-03
管好用好每寸土地,1985-03-18,1985-03
厂长应做开明之士,1985-03-18,1985-03
珍惜土地  千秋大计（本报评论）,1985-03-18,1985-03
交通部青年“为重点建设献青春”活动取得成绩,1985-03-18,1985-03
福建利用“三田”发展养鱼业,1985-03-18,1985-03
变隶属关系为经济伙伴,1985-03-18,1985-03
４４７厂积极生产民用产品,1985-03-18,1985-03
新疆５０％的宜林公路披上绿装,1985-03-18,1985-03
阿米娜汗的喜事,1985-03-18,1985-03
世界屋脊绘新图,1985-03-18,1985-03
勇挑援藏工程重担（世界屋脊绘新图）,1985-03-18,1985-03
惠安石工显身手（世界屋脊绘新图）,1985-03-18,1985-03
象建设天津那样来建设西藏（世界屋脊绘新图）,1985-03-18,1985-03
设计施工  争分夺秒（世界屋脊绘新图）,1985-03-18,1985-03
以支前精神支援西藏建设（世界屋脊绘新图）,1985-03-18,1985-03
山东去年山楂、板栗、核桃产量创新纪录,1985-03-18,1985-03
乐陵县去年栽植枣树一百五十万株,1985-03-18,1985-03
我国正加快新型船舶的开发,1985-03-18,1985-03
搞清问题  制订规划  限期解决,1985-03-18,1985-03
北京为第三产业培养大批劳动后备军,1985-03-18,1985-03
中国科技大学少年班将在全国范围内招生,1985-03-18,1985-03
中国选手已稳获三项冠军,1985-03-18,1985-03
榕城杯女排邀请赛结束,1985-03-18,1985-03
全国短跑道速滑赛创两项全国最好成绩,1985-03-18,1985-03
中国队在第三十八届世乒赛团体赛日程,1985-03-18,1985-03
飞毛腿在全国春季马拉松赛中比高低,1985-03-18,1985-03
沙特队在亚洲青年足球锦标赛中胜泰国队,1985-03-18,1985-03
紧俏物资首推汽车  武汉销售部手中有车不谋私  七千辆车作证    城乡群众都要瘦肉  潼南六个乡面向市场建基地  三万头猪开头（今日首都和各省市区报纸要目）,1985-03-18,1985-03
今年台湾经济难以乐观,1985-03-18,1985-03
台湾“经济部长”易人,1985-03-18,1985-03
台湾高山族争取生存权利,1985-03-18,1985-03
台湾的大专院校（四）,1985-03-18,1985-03
行政机构人员急剧膨胀,1985-03-18,1985-03
除夕思乡有感,1985-03-18,1985-03
徐露再演《霸王别姬》,1985-03-18,1985-03
一位游客眼中的台湾,1985-03-18,1985-03
认真制止和纠正新的不正之风,1985-03-18,1985-03
人民利益的忠诚保卫者,1985-03-18,1985-03
中国政治学会第二届代表大会暨学术讨论会在济南举行,1985-03-18,1985-03
岂能自立标准,1985-03-18,1985-03
中国政府运输代表团离京赴莫斯科,1985-03-18,1985-03
赵朴初会见日中旅行社社长武藤贞雄一行,1985-03-18,1985-03
中国青年代表团访日后回到北京,1985-03-18,1985-03
钱其琛离京赴曼谷出席联合国亚太经社会第四十一届大会,1985-03-18,1985-03
解放思想  勇于创新  立志改革,1985-03-18,1985-03
金城银行贷款谈判记（解放思想  勇于创新  立志改革）,1985-03-18,1985-03
商店成立法律室（解放思想  勇于创新  立志改革）,1985-03-18,1985-03
入境放宽  管理加强（解放思想  勇于创新  立志改革）,1985-03-18,1985-03
东湖宾馆的新伙伴（解放思想  勇于创新  立志改革）,1985-03-18,1985-03
要重视普及法律知识（解放思想  勇于创新  立志改革）,1985-03-18,1985-03
港澳同胞可到珠海买房（解放思想  勇于创新  立志改革）,1985-03-18,1985-03
解放思想办刊物（解放思想  勇于创新  立志改革）,1985-03-18,1985-03
体制改革的经济环境和宏观调节问题,1985-03-18,1985-03
思想也不能搞封锁,1985-03-18,1985-03
企业为什么要有扩大再生产的权力？,1985-03-18,1985-03
破坏现役军人婚姻罪（《中华人民共和国刑法》普及宣传讲话（９９））,1985-03-18,1985-03
简讯,1985-03-18,1985-03
消除朝鲜战争危险会议在巴黎举行,1985-03-18,1985-03
南苏两国两党关系将向前发展,1985-03-18,1985-03
以色列群众示威要求当局从黎撤军,1985-03-18,1985-03
叙军向贝鲁特北部调动,1985-03-18,1985-03
民柬部队击毙桔井省省长,1985-03-18,1985-03
两伊继续在底格里斯河以东激战,1985-03-18,1985-03
伊拉克宣布伊朗领空为军事禁区,1985-03-18,1985-03
穆巴拉克总统结束欧美之行,1985-03-18,1985-03
科威特埃米尔接见张劲夫,1985-03-18,1985-03
多哥部分地区下了一场好雨,1985-03-18,1985-03
北京上海等十五个亚洲城市将进入世界上最大城市之列,1985-03-18,1985-03
英国首相亲自负责严加处理,1985-03-18,1985-03
播种友谊的种子,1985-03-18,1985-03
西方十国集团讨论改革世界货币体系问题,1985-03-18,1985-03
发展中国家借债负担在增加,1985-03-18,1985-03
美元升值使非洲国家负债越来越重,1985-03-18,1985-03
文艺理论批评甘苦谈,1985-03-18,1985-03
反映生活奔涌的潮头,1985-03-18,1985-03
《他到底得罪了谁》〔报告文学〕,1985-03-18,1985-03
京剧武戏亟待振兴,1985-03-18,1985-03
文学笔记,1985-03-18,1985-03
出版动态,1985-03-18,1985-03
风从何处来？,1985-03-18,1985-03
第一封：青年男女的社交（美国来的信）,1985-03-18,1985-03
怀潘训烈士,1985-03-18,1985-03
长短互补（大地漫笔）,1985-03-18,1985-03
鹭,1985-03-18,1985-03
没有赶上头班车的姑娘（外一首）,1985-03-18,1985-03
靠人才  靠改革  靠纪律,1985-03-19,1985-03
修改的继承法具有中国特色,1985-03-19,1985-03
争比什么？（本报评论）,1985-03-19,1985-03
不可片面追求高产值滥发奖金,1985-03-19,1985-03
大胆起用有缺点错误的能人,1985-03-19,1985-03
卖鸡换绳,1985-03-19,1985-03
１１７项获奖  １７项为国家发明奖,1985-03-19,1985-03
李先念在遵义植树,1985-03-19,1985-03
每年四月的第一个星期天  北京全市人民“义务植树日”,1985-03-19,1985-03
干部帮助农民进一步发展商品生产,1985-03-19,1985-03
河南经济林达六百万亩,1985-03-19,1985-03
也谈“富矿”,1985-03-19,1985-03
失望之余的议论,1985-03-19,1985-03
上海呢绒供应趋缓,1985-03-19,1985-03
上海呢绒供应趋缓,1985-03-19,1985-03
决不可放松粮食生产（本报评论）,1985-03-19,1985-03
阳高县鼓励农民种田致富,1985-03-19,1985-03
荆门市粮食专业户纷纷买农机,1985-03-19,1985-03
农牧渔业部推广花生地  膜覆盖技术获显著效益,1985-03-19,1985-03
汉县大力发展食品加工业,1985-03-19,1985-03
不能把第三产业办成福利事业,1985-03-19,1985-03
“过而能改，善莫大焉”,1985-03-19,1985-03
国务院批准《关于申请商标注册要求优先权的暂行规定》,1985-03-19,1985-03
农民运输为何列入另册？,1985-03-19,1985-03
《保护工业产权巴黎公约》,1985-03-19,1985-03
经济短波,1985-03-19,1985-03
返港以后,1985-03-19,1985-03
致富路上新风歌,1985-03-19,1985-03
经营技术商品  衔接科研生产,1985-03-19,1985-03
军民经济技术合作是一项战略任务,1985-03-19,1985-03
欢迎这样的实干家,1985-03-19,1985-03
说办就办  不拖不推,1985-03-19,1985-03
广东拨专款帮助少数民族地区办乡村医疗站,1985-03-19,1985-03
北京一些著名老中医入党,1985-03-19,1985-03
白鳍豚养护场将在铜陵兴建,1985-03-19,1985-03
制成白炽灯光电参数自动测试仪,1985-03-19,1985-03
《中共中央关于整党的决定学习问答》开始发行,1985-03-19,1985-03
速算研究所举办快速计算法培训班,1985-03-19,1985-03
“紫金杯”微机程序设计赛将于本月举行,1985-03-19,1985-03
白居易墓地——白园将开放,1985-03-19,1985-03
中国队获南太平洋女垒赛亚军,1985-03-19,1985-03
最后消息,1985-03-19,1985-03
三名竞走选手又超一项亚洲最好成绩,1985-03-19,1985-03
