雁北地区乡镇企业发展迅速,1985-02-05,1985-02
河北省乡镇企业收入占农业总收入一半,1985-02-05,1985-02
呼和浩特与北京之间开通客运汽车,1985-02-05,1985-02
湖南省畜牧业区划通过鉴定,1985-02-05,1985-02
天安门前将建地下人行道,1985-02-05,1985-02
耒阳县落实知识分子政策采取新措施 “实权人物”下去当场解决问题,1985-02-05,1985-02
变“空对空”为“实打实”,1985-02-05,1985-02
北京六十三个单位开展测试设备协作共用一年等于增加精密仪器一百二十台,1985-02-05,1985-02
长征医院骨科治疗颈椎病达世界先进水平,1985-02-05,1985-02
及早安排计算机普及教育,1985-02-05,1985-02
团中央、全国学联向全国大中专学生发出公开信，要求寒假参加勤工助学  努力培养自立能力,1985-02-05,1985-02
发扬民主正党风  肥乡县消除派性  民心思定  县委顺利选出不讲科学瞎指挥  白沙矿发生事故  人命关天  领导难辞其咎（今日首都和各省市区报纸要目）,1985-02-05,1985-02
江定邦自办技术商品交易会,1985-02-05,1985-02
电影演员韩非去世,1985-02-05,1985-02
中国现代文学馆成立,1985-02-05,1985-02
《蔡元培全集》即将问世,1985-02-05,1985-02
蒙古人民画家楚勒特木作品展览开幕,1985-02-05,1985-02
留学归国的音乐舞蹈工作者在京首次汇报演出,1985-02-05,1985-02
万里接见张小冬等优秀运动员,1985-02-05,1985-02
中国选手在澳运会上又夺四枚奖牌,1985-02-05,1985-02
葡萄牙选手包揽欧洲俱乐部杯越野赛跑全部奖牌,1985-02-05,1985-02
巴黎迪亚纳国际游泳赛结束我选手郑健李金兰成绩较好,1985-02-05,1985-02
美国花样滑冰锦标赛美籍华人陈婷婷夺金牌,1985-02-05,1985-02
世界高山滑雪锦标赛瑞士选手垄断男女速降滑雪赛冠军,1985-02-05,1985-02
为适应城市经济体制改革需要鸡西市调整中层领导班子全市经济发展速度大大加快，工业生产逐月上升,1985-02-05,1985-02
可怜天下父母心（本报评论）,1985-02-05,1985-02
武汉市硚口区人民法院运用法律手段调解纠纷  维护老人合法权益,1985-02-05,1985-02
山西省各级党组织的领导带头和知识分子交朋友,1985-02-05,1985-02
民政部春节慰问团深入老山者阴山前线 慰问云南边防部队指战员转达党中央、国务院和全国各族人民的亲切问候,1985-02-05,1985-02
广东省春节慰问团慰问西沙军民,1985-02-05,1985-02
厦门市长感谢部队为特区输送了一批有知识勇于进取的干部,1985-02-05,1985-02
伊犁哈萨克自治州组织机关干部深入基层调查研究  指导经济体制改革,1985-02-05,1985-02
安庆市迎江区积极开展创“六好”居委会活动,1985-02-05,1985-02
北京轻工产品展销馆门卫见危不救侵害记者合法权益事件已得到处理,1985-02-05,1985-02
许涤新离京赴日本出席亚洲议员人口和发展问题会议,1985-02-05,1985-02
澳门总督到京,1985-02-05,1985-02
保定在变,1985-02-05,1985-02
不准利用人事权谋私（国内短评）,1985-02-05,1985-02
山西省测绘局招收调配职工歪风严重局党组结合整党正在进行处理,1985-02-05,1985-02
党政各尽责  共唱“一台戏”,1985-02-05,1985-02
“杨老板”拒贿,1985-02-05,1985-02
喜德县委查处新的不正之风胡元成利用职权经商牟利坑害农民被开除党籍,1985-02-05,1985-02
指名道姓为知识分子建的房子，却分到工厂党总支正副书记手中，然而,1985-02-05,1985-02
欲招凤凰来  先栽梧桐树,1985-02-05,1985-02
莫以成败论英雄,1985-02-05,1985-02
容才之德美,1985-02-05,1985-02
“经验”不能苛求,1985-02-05,1985-02
联合国部队驻柬使命只是监督越撤军,1985-02-05,1985-02
民柬部队深入内地猛烈袭击越军国民军总司令部号召粉碎越军西线攻势,1985-02-05,1985-02
海湾国家为结束两伊战争作出新努力 科威特副首相访叙  沙特外交大臣访伊拉克,1985-02-05,1985-02
德奎利亚尔同苏哈托会谈一致认为越南和东盟在柬问题上观点仍相距遥远,1985-02-05,1985-02
侵柬越军在泰边境地区挑衅,1985-02-05,1985-02
沙特国王会见阿拉法特主席,1985-02-05,1985-02
卡斯特罗希望改善古美关系,1985-02-05,1985-02
比首相表示要部署巡航导弹,1985-02-05,1985-02
两伊在中部战线等地继续发生战斗,1985-02-05,1985-02
黎内阁讨论经济和治安问题 政府采取紧急措施对付黎镑比价下跌,1985-02-05,1985-02
陈慕华一行离西班牙抵达西德,1985-02-05,1985-02
广东与瓜达卡纳尔省建立友好省关系,1985-02-05,1985-02
叙拒绝参加讨论埃及重返阿盟会议,1985-02-05,1985-02
高速有轨电车在苏联兴起,1985-02-05,1985-02
访日散记,1985-02-05,1985-02
美国钢铁公司生产有所好转（国际经济动态）,1985-02-05,1985-02
西德今年经济增长将更高（国际经济动态）,1985-02-05,1985-02
去年日负债总额创历史纪录,1985-02-05,1985-02
依靠自己努力使非洲真正独立   非统解委会讨论纳米比亚独立和南非解放运动问题,1985-02-05,1985-02
意南呼吁各国采取行动改善国际关系两国边界问题的顺利解决使双边关系不断发展,1985-02-05,1985-02
西英外长谈直布罗陀问题,1985-02-05,1985-02
里根向国会提出新年度政府预算 削减赤字  大砍民用开支  大幅度增加军事开支,1985-02-05,1985-02
图图宣誓就任南非第一位黑人主教,1985-02-05,1985-02
十二国城市代表呼吁消除核危险,1985-02-05,1985-02
因发现艾贝加是纳粹战犯  联邦德国废止“艾贝加奖”,1985-02-05,1985-02
阿根廷小麦获历史上最好收成,1985-02-05,1985-02
墨西哥与玻、秘、厄签订捕鱼协定,1985-02-05,1985-02
智利海产创历史记录,1985-02-05,1985-02
澳大利亚蔗糖业一瞥,1985-02-05,1985-02
瑞典制成激光发生器显示锯剖方位,1985-02-05,1985-02
电视显示防犯摄像机,1985-02-05,1985-02
造纸有新法,1985-02-05,1985-02
纸膜胶贴育苗法,1985-02-05,1985-02
防治白蚁的新型药剂,1985-02-05,1985-02
筛选选人者,1985-02-05,1985-02
秋叶,1985-02-05,1985-02
草与界碑（外一首）,1985-02-05,1985-02
斗室,1985-02-05,1985-02
晋升荣誉与降低职务,1985-02-05,1985-02
《明天》儿童文学丛刊创刊,1985-02-05,1985-02
《夜谈》杂文集出版,1985-02-05,1985-02
狠抓大案要案打击严重经济犯罪,1985-02-06,1985-02
街头医疗队,1985-02-06,1985-02
帮助农民转忧为喜（本报评论）,1985-02-06,1985-02
威县调整产业结构订出增收规划,1985-02-06,1985-02
中西医结合治疗恶性肿瘤有明显优势,1985-02-06,1985-02
大力促进消费品生产保证市场供应,1985-02-06,1985-02
太原市查获一起非法倒卖钢锭案,1985-02-06,1985-02
英即将派出大型经济贸易代表团访华,1985-02-06,1985-02
求全责备二种,1985-02-06,1985-02
西班牙开放直布罗陀边境,1985-02-06,1985-02
党和国家领导人会见优秀青年厂长、经理,1985-02-06,1985-02
万里提出要进一步采取“开明”政策，把企业搞活，把城市建设搞好，努力建成开放型的“大武汉”,1985-02-06,1985-02
不穿军装的护线兵,1985-02-06,1985-02
“散摊子”大摆宴席三个公司竞相效尤,1985-02-06,1985-02
看准了就大胆干（开拓者的足迹与心声）,1985-02-06,1985-02
为了大家早日富（开拓者的足迹与心声）,1985-02-06,1985-02
要不折不扣地按党中央的精神办事（开拓者的足迹与心声）,1985-02-06,1985-02
干事业不能怕冒风险（开拓者的足迹与心声）,1985-02-06,1985-02
围绕玉米皮做文章（开拓者的足迹与心声）,1985-02-06,1985-02
开拓者的足迹与心声（编者按）,1985-02-06,1985-02
抓应用促发展  抓竞争促提高,1985-02-06,1985-02
企业性公司也可成为法人,1985-02-06,1985-02
山西采取措施整顿工业公司,1985-02-06,1985-02
洛阳市制止利用“有奖销售”变相涨价,1985-02-06,1985-02
是有奖销售还是变相赌博？,1985-02-06,1985-02
甘肃流通领域体制改革取得明显效果,1985-02-06,1985-02
中日合作生产微型计算机,1985-02-06,1985-02
厦门将建“厦门台湾大酒店”,1985-02-06,1985-02
国产热气球试飞成功,1985-02-06,1985-02
南海第一个油田第一口试生产井开钻,1985-02-06,1985-02
海北农牧民开采祁连山矿藏,1985-02-06,1985-02
“渭阳”牌轻便摩托车夺冠,1985-02-06,1985-02
这种“凑整”要不得！,1985-02-06,1985-02
拉萨雪城旅社开业,1985-02-06,1985-02
徐水县五户农民集资办医院,1985-02-06,1985-02
农民企业家阎建章被聘任中国农村发展研究所所长,1985-02-06,1985-02
重官衔还是重知识？,1985-02-06,1985-02
西藏农民多杰捐款万元为家乡小学建校舍,1985-02-06,1985-02
《民族画报》为增强各族人民团结作出贡献,1985-02-06,1985-02
中国南大洋考察队开始第二阶段海洋调查,1985-02-06,1985-02
一种新型信息交换汉字字模研制成功,1985-02-06,1985-02
半导体所中高级科研人员党员数接近党员总数的一半,1985-02-06,1985-02
中国足球队二比○胜匈牙利维多顿队,1985-02-06,1985-02
四川新秀熊伟刷新男子二百米蛙泳全国纪录,1985-02-06,1985-02
阳高县承办全国少儿乒乓球赛,1985-02-06,1985-02
全国围棋精英赛在沪揭幕,1985-02-06,1985-02
我国今年六月举办“世界群众体育周”,1985-02-06,1985-02
苏联队夺得冠军,1985-02-06,1985-02
我国摄制的体育故事片《帆板姑娘》即将上映,1985-02-06,1985-02
上级公司平调下级企业  真损人  沈阳绢花厂被吃穷如遭蝗灾     邮局职工盗窃顾客邮包   太缺德  新乡公安局抓罪犯好比捕鼠（今日首都和各省市区报纸要目）,1985-02-06,1985-02
耐磨钻头——骆正常,1985-02-06,1985-02
陕西进行民主推荐省直单位领导干部试点,1985-02-06,1985-02
沂蒙山区富裕农民代表驱车慰问子弟兵,1985-02-06,1985-02
全国政协委员将到各地考察,1985-02-06,1985-02
努力奋斗进一步开创工作新局面,1985-02-06,1985-02
北安市四名党员干部受到严厉处分,1985-02-06,1985-02
组织农民自我教育自我管理自我服务,1985-02-06,1985-02
四千“红娘”搭鹊桥,1985-02-06,1985-02
今年将抽出更多力量支援地方急需工程建设,1985-02-06,1985-02
北京市政府技术顾问团积极发挥参谋作用,1985-02-06,1985-02
对农村“三老”实行定期生活补贴,1985-02-06,1985-02
郑拓彬同高斯达举行会谈,1985-02-06,1985-02
为了空军现代化,1985-02-06,1985-02
中国政府贸易代表团团长陈洁回到北京,1985-02-06,1985-02
美国美隆银行负责人拜访许家屯,1985-02-06,1985-02
高斯达说，澳门已经感受到了同内地合作的好处,1985-02-06,1985-02
农村渴求加工业技术和设备,1985-02-06,1985-02
开拓美的商品,1985-02-06,1985-02
生物工程的发展动向,1985-02-06,1985-02
我们这里缺少沙发用布,1985-02-06,1985-02
襄垣农民盼望呢子衣服下乡,1985-02-06,1985-02
农村妇女“烫发难”,1985-02-06,1985-02
农村需要多用炊事机和小型鼓风机,1985-02-06,1985-02
茶叶加工技术的新探索,1985-02-06,1985-02
东方牌加重自行车受到农村运销户欢迎,1985-02-06,1985-02
北京市生活用具批发部经销管道疏通机,1985-02-06,1985-02
《国际商报》开始征订,1985-02-06,1985-02
小型颗粒饲料压制机通过鉴定,1985-02-06,1985-02
提供豆芽机部件和技术资料,1985-02-06,1985-02
提倡“小包装”,1985-02-06,1985-02
增强团结继续进行抗越斗争 谴责越南分裂联合政府阴谋,1985-02-06,1985-02
民柬在梅莱山抗击越军已持续十天,1985-02-06,1985-02
应该化干戈为玉帛,1985-02-06,1985-02
阿拉法特同沙特国王会谈,1985-02-06,1985-02
黎外交部官员谈黎巴嫩和中东形势,1985-02-06,1985-02
倪志福率中共代表团抵达巴黎,1985-02-06,1985-02
西德总理科尔接见陈慕华,1985-02-06,1985-02
加强日本中小企业同中国经济交流,1985-02-06,1985-02
斯总统为我援建的高级法院大楼奠基,1985-02-06,1985-02
马里总统视察我帮助试验的沼气设施,1985-02-06,1985-02
世界舆论坚决谴责越南侵柬,1985-02-06,1985-02
新西兰再次拒绝美国核军舰访问,1985-02-06,1985-02
国际简讯,1985-02-06,1985-02
国际卫星系统两年搭救三百五十名海空遇险者,1985-02-06,1985-02
美国将增加对以色列军事援助,1985-02-06,1985-02
苏美竞相争夺黑非洲军火市场,1985-02-06,1985-02
呼吁各国采取行动推动苏美会谈,1985-02-06,1985-02
马里政府积极领导人民抗旱救灾,1985-02-06,1985-02
维西要求美国会支持国防预算,1985-02-06,1985-02
比利时群众募捐援助埃塞俄比亚灾民,1985-02-06,1985-02
瑞典小学生呼吁美苏销毁核武器,1985-02-06,1985-02
罗杰斯重任北约欧洲盟军总司令,1985-02-06,1985-02
日本成年人吸烟率相对下降,1985-02-06,1985-02
苏人造卫星未能进入轨道而坠毁,1985-02-06,1985-02
玻利维亚爆发总罢工,1985-02-06,1985-02
哥斯达黎加和尼加拉瓜表示要解决争执,1985-02-06,1985-02
直布罗陀纪行,1985-02-06,1985-02
奥地利为中学生开设信息课,1985-02-06,1985-02
葡萄牙建立十八个信息中心,1985-02-06,1985-02
法国学校将实施信息化计划,1985-02-06,1985-02
边吃边谈,1985-02-06,1985-02
纪念内山嘉吉先生,1985-02-06,1985-02
新村即景（外一首）,1985-02-06,1985-02
雨后的田野（外二章）,1985-02-06,1985-02
贺《雏飞集》列入推荐书目,1985-02-06,1985-02
流言止于智者（大地漫笔）,1985-02-06,1985-02
运用三条自主权    积压产品销售完,1985-02-07,1985-02
继续打击严重刑事犯罪活动  加强经济审判民事审判工作,1985-02-07,1985-02
热烈祝贺法共二十五大召开,1985-02-07,1985-02
法共二十五大开幕,1985-02-07,1985-02
搞活大中企业提高经济效益,1985-02-07,1985-02
“做点国家还来不及做的事”,1985-02-07,1985-02
干部要唱正气歌（本报评论）,1985-02-07,1985-02
去年扶持贫困农户二百四十万一百三十万农户走上富裕之路,1985-02-07,1985-02
加强新时期统战工作,1985-02-07,1985-02
西藏各地农贸市场活跃,1985-02-07,1985-02
山西近五年百万多农户建新房,1985-02-07,1985-02
“官商”一例,1985-02-07,1985-02
自身正  说话响  顶歪风  树正气,1985-02-07,1985-02
领导以身作则  职工遵纪奉公,1985-02-07,1985-02
战士，工人情意深,1985-02-07,1985-02
北京印染厂发挥出大企业优势,1985-02-07,1985-02
成都市农副产品市场繁荣兴旺,1985-02-07,1985-02
干部管理权应下放给企业,1985-02-07,1985-02
弄虚作假  骗取奖金,1985-02-07,1985-02
对以假谋私者不能姑息（国内短评）,1985-02-07,1985-02
鼓励正当致富  反对歪道发财,1985-02-07,1985-02
掷外汇数十万金  购设备多不堪用,1985-02-07,1985-02
毕节退耕还林还牧,1985-02-07,1985-02
中日合营建筑设计公司,1985-02-07,1985-02
黄河源头有了电视差转台,1985-02-07,1985-02
甘肃技术市场在兰州开业,1985-02-07,1985-02
张登楼家庭经营活经济收益多,1985-02-07,1985-02
郊区农民利用泔水养猪好,1985-02-07,1985-02
羊城的“三英时装”,1985-02-07,1985-02
羌营村户均出售五头多肉猪,1985-02-07,1985-02
恳切的呼吁,1985-02-07,1985-02
怕就怕“无方无计”,1985-02-07,1985-02
赶快来解决,1985-02-07,1985-02
河北故城尊师重教蔚成风气,1985-02-07,1985-02
天津去年发展知识分子党员八千多名,1985-02-07,1985-02
文化部表彰国际杂技芭蕾舞比赛获奖演员,1985-02-07,1985-02
青年农民自费办无线电技校,1985-02-07,1985-02
三岁“神童”何以闹中州？,1985-02-07,1985-02
我国首次在南极进行气象观测,1985-02-07,1985-02
小学生徐琛的发明在国际上获奖,1985-02-07,1985-02
湘剧表演艺术家彭俐侬去世,1985-02-07,1985-02
军中战士立功  乡间家属受奖  沈阳市翟家乡拥军优属工作细井下生产领先  地面住房优待  平顶山矿务局鼓励先进办法好（今日首都和各省市区报纸要目）,1985-02-07,1985-02
江铸久灵活多变战胜对手,1985-02-07,1985-02
塞外武星,1985-02-07,1985-02
国际柔道联合会主席松前重义到京,1985-02-07,1985-02
中国大学生体育代表团即将赴意,1985-02-07,1985-02
全国十单位青少年游泳邀请赛结束,1985-02-07,1985-02
统一战线仍然是一大法宝  具有强大生命力,1985-02-07,1985-02
修人，不朽的一生,1985-02-07,1985-02
纪念“二七”大罢工六十二周年,1985-02-07,1985-02
越南当局没有解决柬埔寨问题的任何诚意,1985-02-07,1985-02
发展内地同澳门的合作有广阔的前景,1985-02-07,1985-02
巴布亚新几内亚副总理兼教育部长温蒂将访问我国,1985-02-07,1985-02
庆祝中哥建交五周年,1985-02-07,1985-02
谷牧会见日本佳能公司总经理,1985-02-07,1985-02
中国和联邦德国签订一项经济合作协议,1985-02-07,1985-02
各路援藏建设大军抓紧准备再战,1985-02-08,1985-02
一项光荣而重大的任务（本报评论）,1985-02-08,1985-02
搞活大中型企业十一条政策措施,1985-02-08,1985-02
社会赞助修长城款六百多万元,1985-02-08,1985-02
湖北建起百万平方米的商品住宅,1985-02-08,1985-02
织纳煤田探明储量二十五亿吨,1985-02-08,1985-02
电影新品种全景电影在京试映,1985-02-08,1985-02
国际国内旅游一起抓,1985-02-08,1985-02
经济薄弱地区应大力兴办家庭工业,1985-02-08,1985-02
五笔字型方案进入实用阶段,1985-02-08,1985-02
李先念会见高斯达时希望双方合作维护澳门稳定和繁荣,1985-02-08,1985-02
心愿,1985-02-08,1985-02
英议会下院通过香港法案,1985-02-08,1985-02
强行索取高额费用  进京货物受阻只认金钱不识大局  影响春节供应,1985-02-08,1985-02
解决乱集资、乱摊派问题,1985-02-08,1985-02
昌都建立商品信息网,1985-02-08,1985-02
广州每天开十店,1985-02-08,1985-02
推倒这块“碑”,1985-02-08,1985-02
“亲自抓”,1985-02-08,1985-02
对现阶段农业改革的几点建议,1985-02-08,1985-02
落实富民政策  制止层层“剥皮”,1985-02-08,1985-02
都有一个重新学习的问题（国内短评）,1985-02-08,1985-02
哈尔滨在乡镇企业中发展“卫星工厂”,1985-02-08,1985-02
青藏公路改建工程八月底全部竣工,1985-02-08,1985-02
从红缨枪到彩电,1985-02-08,1985-02
国家海洋局加强海洋战略开发海洋调查工作取得重大进展,1985-02-08,1985-02
长岛建成“候鸟旅馆”,1985-02-08,1985-02
废纸脱墨剂在杭州制成,1985-02-08,1985-02
同仁堂“老年保健服务部”开业,1985-02-08,1985-02
多维营养油投入小批量生产,1985-02-08,1985-02
海安县人均生产肉禽蛋鱼逾百斤,1985-02-08,1985-02
一棵梨树结了二十四种梨,1985-02-08,1985-02
广州市出现“外经一条街”,1985-02-08,1985-02
海洋局工作重点在海洋管理上,1985-02-08,1985-02
将相和  企业兴,1985-02-08,1985-02
湖北鼓励中青年知识分子冒尖,1985-02-08,1985-02
昔日雁南去  今日雁北飞,1985-02-08,1985-02
对“尖子”要破格,1985-02-08,1985-02
衡东县岭茶乡发现“怪物”动物化石,1985-02-08,1985-02
桂林发现奇特溶洞,1985-02-08,1985-02
儿童生活用品生产需大力扶持,1985-02-08,1985-02
医院里的“小字辈”,1985-02-08,1985-02
全国部分大中学校将进行军训试点,1985-02-08,1985-02
“三中全会以来的伟大成就”大型展览获奖,1985-02-08,1985-02
上海慰问赴南极考察队员家属,1985-02-08,1985-02
电视系列片《黄河》将开拍,1985-02-08,1985-02
上海市中学生记者团成立,1985-02-08,1985-02
滥发奖金已知错  天津局级领导做出表率退款  群众起而仿效随意涨价不识羞  广州公共汽车巧立名目捞钱  歪风非刹不可（今日首都和各省市区报纸要目）,1985-02-08,1985-02
中国男女篮在澳双双获胜,1985-02-08,1985-02
黄艳林锐不可挡连中三元云南队与维多顿俱乐部足球队踢平,1985-02-08,1985-02
由小裁判到国际裁判,1985-02-08,1985-02
亚洲少年足球锦标赛小组预赛结束,1985-02-08,1985-02
首届《长城大奖》国际体育摄影竞赛今秋举行,1985-02-08,1985-02
采取扎扎实实措施  保障整党工作顺利进行南京农业大学党委精心组织指导整党,1985-02-08,1985-02
“贴心书记”,1985-02-08,1985-02
各地积极开展统一战线理论研究工作,1985-02-08,1985-02
宁夏组织各级领导干部深入基层调查,1985-02-08,1985-02
利用派性搞诬陷干扰县里正常工作,1985-02-08,1985-02
一桌没有人吃的喜宴,1985-02-08,1985-02
制定安置规划  健全管理机构总参离退休干部“老有所养”,1985-02-08,1985-02
有组织有计划地开展拥军优属活动,1985-02-08,1985-02
利用职权——贪污面票九十万斤法网难逃——罪犯许刚被判死缓,1985-02-08,1985-02
要健全管理制度（国内短评）,1985-02-08,1985-02
纪念“二七”大罢工６２周年,1985-02-08,1985-02
台湾国民党中央秘书长蒋彦士辞职由马树礼接任,1985-02-08,1985-02
人民海军抢救两名生命垂危的台湾渔民,1985-02-08,1985-02
从创作自由到学术自由,1985-02-08,1985-02
略论统计服务与监督,1985-02-08,1985-02
《中国历代名人小传》序,1985-02-08,1985-02
科学学的产生与发展,1985-02-08,1985-02
建设有中国特色的社会主义讨论会,1985-02-08,1985-02
《台湾府志》三种出版,1985-02-08,1985-02
评越南的“新建议”（本报评论）,1985-02-08,1985-02
李先念主席和贝坦库尔总统互致电报热烈祝贺中国和哥伦比亚建交五周年,1985-02-08,1985-02
马歇在法共二十五大作报告,1985-02-08,1985-02
西哈努克亲王视察达维营地号召军民齐心协力把越军赶出柬埔寨,1985-02-08,1985-02
越没有放弃地区扩扩主义野心,1985-02-08,1985-02
我法官倪征ｙù＠①在国际法院宣誓就职,1985-02-08,1985-02
日自民党内田中派开会成立新的政策集团“创政会”,1985-02-08,1985-02
黎巴嫩南部城镇居民总罢工,1985-02-08,1985-02
阿拉法特赞扬巴勒斯坦战士英勇抗击以色列,1985-02-08,1985-02
国际要闻简报,1985-02-08,1985-02
日本各地集会谴责苏联拒不归还北方领土,1985-02-08,1985-02
利比里亚国家元首接见我大使,1985-02-08,1985-02
巴巴多斯总理会见我大使,1985-02-08,1985-02
马达加斯加外长向我大使授勋,1985-02-08,1985-02
简讯,1985-02-08,1985-02
简讯,1985-02-08,1985-02
提出实现负债国债权国政治对话的建议,1985-02-08,1985-02
敦促国会支持国防力量现代化,1985-02-08,1985-02
美元在西欧货币市场又起涨风,1985-02-08,1985-02
苏联暂停向西欧供应石油,1985-02-08,1985-02
争议纷纭的里根预算方案,1985-02-08,1985-02
阿根廷各方通过协商解决国内问题,1985-02-08,1985-02
美国务卿舒尔茨同澳总理霍克会谈美决定在没有澳支援下进行ＭＸ导弹试验,1985-02-08,1985-02
新西兰总理拒绝美国的威胁,1985-02-08,1985-02
莫斯科华盛顿展开一场新的争吵,1985-02-08,1985-02
瑞典建成世界最大水煤浆厂,1985-02-08,1985-02
英军警驱赶反对部署巡航导弹的示威者,1985-02-08,1985-02
波兰宣判神甫事件肇事者,1985-02-08,1985-02
加拿大着手治理酸雨污染,1985-02-08,1985-02
天山畅想曲,1985-02-08,1985-02
我常凝视窗前的世界,1985-02-08,1985-02
流水恋,1985-02-08,1985-02
凡需进口机电设备先在国内招标,1985-02-09,1985-02
“这点牺牲是值得的”,1985-02-09,1985-02
大名县一年建成三万亩“千元田”,1985-02-09,1985-02
赵紫阳会见金塔纳尔,1985-02-09,1985-02
名牌产品岂能名不符实,1985-02-09,1985-02
简讯,1985-02-09,1985-02
天达电信有限公司开业,1985-02-09,1985-02
这种“潮流”不能赶,1985-02-09,1985-02
在纠正新的不正之风方面作出表率,1985-02-09,1985-02
今年工业生产起点高头一个月增产幅度大,1985-02-09,1985-02
全国共有十个城市工业产值超百亿元,1985-02-09,1985-02
震后重建的灾民新村,1985-02-09,1985-02
“千元田”开了种植业新局面（本报评论）,1985-02-09,1985-02
情况在变化  问题还不少    干预仍过多  企业受困扰,1985-02-09,1985-02
湖南省发展优质米取得成绩,1985-02-09,1985-02
英店区优质米打进国际市场,1985-02-09,1985-02
多生产优质米（本报评论）,1985-02-09,1985-02
财政部门要抓好企业财务整顿,1985-02-09,1985-02
内蒙古农牧区乡乡通邮,1985-02-09,1985-02
新疆提前完成“六五”计划规定的工农业总产值指标,1985-02-09,1985-02
哲里木盟积极发展养牛业,1985-02-09,1985-02
西藏贷款扶持藏民发展生产,1985-02-09,1985-02
两千多台电视机进永宁农家,1985-02-09,1985-02
城乡市场将更加繁荣,1985-02-09,1985-02
信用社体制改革全面展开,1985-02-09,1985-02
四平市农行支持粮区发展畜牧业,1985-02-09,1985-02
真瓶装假酒,1985-02-09,1985-02
两张废合同  毁了一爿店,1985-02-09,1985-02
警惕啊，经理们！,1985-02-09,1985-02
领导带头处理群众（来信来访）,1985-02-09,1985-02
我国专利工作体系已初步形成,1985-02-09,1985-02
服务是本分,1985-02-09,1985-02
形成一整套有特色的沼气技术,1985-02-09,1985-02
安徽二十八个县级单位普及初等教育,1985-02-09,1985-02
用贷款发奖金  吃社会主义  兴安玻璃厂领导败坏改革  该严惩不吃请拒受礼  当人民公仆  万县市书记常委定下新规  作表率（今日首都和各省市区报纸要目）,1985-02-09,1985-02
我南极洲考察队发展首批共产党员,1985-02-09,1985-02
我建成六个电信传输地震观测台网,1985-02-09,1985-02
