我选手在瑞典羽毛球公开赛中获四项冠军,1985-03-19,1985-03
航天部向中国男女排赠送排球器材,1985-03-19,1985-03
中国队战胜保加利亚队,1985-03-19,1985-03
山区饮净水  惠及万余人  喜闻勐腊有关部门关心群众生活    市内迁户口  收费两千元  请问大雁塔派出所做的什么生意（今日首都和各省市区报纸要目）,1985-03-19,1985-03
严格划清政策界限  保护干群改革的积极性,1985-03-19,1985-03
青岛警备区党委在整党中加强政策纪律教育,1985-03-19,1985-03
全国侨务工作座谈会在广东召开,1985-03-19,1985-03
盖县城关乡千余名党员帮助群众致富,1985-03-19,1985-03
做好宣传工作  为开放改革服务,1985-03-19,1985-03
社会各界踊跃为残疾人福利事业捐款赠物,1985-03-19,1985-03
兰州军区某团培养开发建设大西北的两用人才,1985-03-19,1985-03
姚依林分别会见美国副国务卿和澳大利亚客人,1985-03-19,1985-03
金石缘,1985-03-19,1985-03
王光宇当选为安徽省人大常委会主任,1985-03-19,1985-03
北京市增选五名人大常委会副主任,1985-03-19,1985-03
康克清会见陈志昆夫妇,1985-03-19,1985-03
全国台联电唁台湾著名老作家杨逵逝世,1985-03-19,1985-03
春风从这里吹起,1985-03-19,1985-03
特殊的“情书”,1985-03-19,1985-03
联系思想提高认识  查处问题务求认真,1985-03-19,1985-03
落实党的知识分子政策中的一个问题,1985-03-19,1985-03
“刺耳言中有真理”,1985-03-19,1985-03
把着眼点放在为党工作上,1985-03-19,1985-03
一个谦让被人夸  一个蛮横受处分,1985-03-19,1985-03
莫再“概不接待”（言论摘编）,1985-03-19,1985-03
“照顾领导”和“领导照顾”（言论摘编）,1985-03-19,1985-03
不可滥用“未发现”（言论摘编）,1985-03-19,1985-03
开只眼，闭只眼,1985-03-19,1985-03
一个急起直落的副县长（部析与思考）,1985-03-19,1985-03
寻求停止两伊战争的手段,1985-03-19,1985-03
中国坚决支持泰国正义立场,1985-03-19,1985-03
越南入侵泰国是“偶然事件”吗？,1985-03-19,1985-03
重申南支持东盟在柬问题上的立场,1985-03-19,1985-03
泰国要求苏联停止援助越南,1985-03-19,1985-03
埃及总统访问约旦磋商中东局势,1985-03-19,1985-03
乔森潘访问南斯拉夫,1985-03-19,1985-03
藤山爱一郎追悼会在东京举行,1985-03-19,1985-03
任何中东问题谈判都应有巴解组织参加,1985-03-19,1985-03
谴责以色列侵犯被占区居民的权利,1985-03-19,1985-03
莫桑比克南非重申应遵守恩科马蒂条约,1985-03-19,1985-03
南非觊觎纳米比亚天然气资源,1985-03-19,1985-03
以色列总理说以将尽快从黎南部撤军,1985-03-19,1985-03
中国新任驻毛里求斯大使递交国书,1985-03-19,1985-03
中国新任驻喀麦隆大使递交国书,1985-03-19,1985-03
印度副总统观看江西杂技团演出,1985-03-19,1985-03
中国政府运输代表团抵达莫斯科,1985-03-19,1985-03
解决住房问题的努力,1985-03-19,1985-03
国际简讯,1985-03-19,1985-03
主张通过对话改善南北方关系,1985-03-19,1985-03
强调不结盟运动在国际事务中的作用,1985-03-19,1985-03
访波兰“钢铁意志”联合企业,1985-03-19,1985-03
苏美相互攻讦  谈判笼罩阴影,1985-03-19,1985-03
里根与马尔罗尼举行会谈,1985-03-19,1985-03
墨西哥等六国代表呼吁美苏停止军备竞赛,1985-03-19,1985-03
大选后的南朝鲜政局,1985-03-19,1985-03
比利时首相宣布首批美国巡航导弹部署完毕,1985-03-19,1985-03
用超声波诱杀老鼠,1985-03-19,1985-03
法国省议会选举  反对党居上风,1985-03-19,1985-03
日本已成为世界最大资本输出国,1985-03-19,1985-03
论封闭,1985-03-19,1985-03
美国来的信,1985-03-19,1985-03
天空的情感,1985-03-19,1985-03
北疆冬曲,1985-03-19,1985-03
早春，题在柳叶……（外二首）,1985-03-19,1985-03
改寿联讽袁世凯,1985-03-19,1985-03
中共中央关于科学技术体制改革的决定,1985-03-20,1985-03
通过新增补四十名政协委员名单,1985-03-20,1985-03
进一步完善继承法草案,1985-03-20,1985-03
加强审计工作  保证改革顺利进行,1985-03-20,1985-03
维护审计工作的严肃性（本报评论）,1985-03-20,1985-03
湖北省审计机关发挥职能作用,1985-03-20,1985-03
新疆加速绿化城市,1985-03-20,1985-03
萧山县做好签订定购合同工作,1985-03-20,1985-03
江苏集市贸易市场发展快,1985-03-20,1985-03
签订好定购合同（国内短评）,1985-03-20,1985-03
上海灯泡厂将多收的二十万元退还用户,1985-03-20,1985-03
服装衬布销路大增,1985-03-20,1985-03
长清农民进城经营小食品,1985-03-20,1985-03
连云港市经济充满活力,1985-03-20,1985-03
沸腾的龙湖,1985-03-20,1985-03
大连市经济开发区基础设施建设成效显著,1985-03-20,1985-03
湛江市经济开发区重视职工业务培训,1985-03-20,1985-03
肇庆赴港洽商成效大,1985-03-20,1985-03
国务院批准三个特区扩大面积,1985-03-20,1985-03
我国一批电子元件达到国际先进水平,1985-03-20,1985-03
北京等地在成都举办小型交易会,1985-03-20,1985-03
上海市三百多项成果将申请专利,1985-03-20,1985-03
南京租赁有限公司帮助企业更新设备,1985-03-20,1985-03
武汉技术市场逐步形成网络,1985-03-20,1985-03
哈尔滨工业大学“门庭若市”,1985-03-20,1985-03
进京聘人才咨询顾问,1985-03-20,1985-03
山东省农业技术中学为农村培养各类人才,1985-03-20,1985-03
北京联合大学成立,1985-03-20,1985-03
孟金陵成为我国培养的第一个农学博士,1985-03-20,1985-03
中国羽毛球队飞抵伦敦参加全英赛,1985-03-20,1985-03
肩负众望  步步登攀,1985-03-20,1985-03
中国男排参加世界杯预选赛名单,1985-03-20,1985-03
中国冰球队胜丹麦队,1985-03-20,1985-03
简讯,1985-03-20,1985-03
简讯,1985-03-20,1985-03
阿联酋报纸评论亚青杯中沙之战,1985-03-20,1985-03
兵精  一人肩起多种事务  长江联合供销公司大胆试验  好！    政简  多种手续一次办理  青岛建筑管理体制根本改革  高！（ 今日首都和各省市区报纸要目）,1985-03-20,1985-03
来函照登,1985-03-20,1985-03
山东省直机关纠正不正之风做到“门前清”,1985-03-20,1985-03
延安地区制止所属单位向中央各部门要钱要物,1985-03-20,1985-03
六届全国政协增补委员名单,1985-03-20,1985-03
要加强对职工的理想教育和纪律教育,1985-03-20,1985-03
广西林业厅马俊等人受到党纪政纪处分,1985-03-20,1985-03
发挥女职工的聪明才智  调动女职工的积极性,1985-03-20,1985-03
符浩率全国人大代表团赴多哥  参加各国议会联盟第七十三届大会,1985-03-20,1985-03
空军司令员张廷发等参加北空某机场植树劳动,1985-03-20,1985-03
范瑾当选为北京市政协主席,1985-03-20,1985-03
上海黄埔军校同学会成立,1985-03-20,1985-03
陈永康同志追悼会在南京举行,1985-03-20,1985-03
海军东海舰队某部一舰艇顶风冒浪抢救渔民,1985-03-20,1985-03
吴学谦会见美国副国务卿,1985-03-20,1985-03
纳米比亚西南非洲人民组织代表团结束对中国的访问,1985-03-20,1985-03
获鹿县妇联认真处理来信,1985-03-20,1985-03
张北县人民政府向苏蒙联军烈士纪念塔献花圈,1985-03-20,1985-03
李鹏在天津会见鸟居幸雄一行,1985-03-20,1985-03
宋平会见瑞典交通运输大臣,1985-03-20,1985-03
重庆市委调整领导班子,1985-03-20,1985-03
军民情满青藏线,1985-03-20,1985-03
让“国宝”更好地为民服务,1985-03-20,1985-03
全国中药材市场预测,1985-03-20,1985-03
“链轨”回升  “小四轮”紧俏,1985-03-20,1985-03
种植药材当前应注意的问题,1985-03-20,1985-03
药用动物养殖业的新趋势,1985-03-20,1985-03
国光牌汽车多次电子点火节油器,1985-03-20,1985-03
欢迎订阅——《机械设计自学入门》,1985-03-20,1985-03
此事莫忽视,1985-03-20,1985-03
要不断开拓蜗牛的销路,1985-03-20,1985-03
我厂可提供沙发坯布,1985-03-20,1985-03
养牛专业村需要饲养技术资料,1985-03-20,1985-03
中国农村智力开发函授学院招生,1985-03-20,1985-03
发展睦邻友好关系新篇章,1985-03-20,1985-03
联邦德国期待着赵总理访问,1985-03-20,1985-03
阿尔及利亚领导人分别会见张劲夫,1985-03-20,1985-03
刚果总统为我一赠建工程奠基,1985-03-20,1985-03
新加坡总统患病住院,1985-03-20,1985-03
阿盟秘书长卡利比印度总理拉·甘地呼吁两伊停火,1985-03-20,1985-03
两伊战争的升级及其原因,1985-03-20,1985-03
埃及总统和约旦国王访问巴格达,1985-03-20,1985-03
非洲的大旱和饥荒,1985-03-20,1985-03
麻醉剂又有何用,1985-03-20,1985-03
联合国亚太经社委员会年会开幕,1985-03-20,1985-03
罗马尼亚普选大国民议会代表,1985-03-20,1985-03
“香蕉帝国”的没落,1985-03-20,1985-03
里根总统结束对加拿大的访问,1985-03-20,1985-03
联合国妇女地位委员会第三次会议结束,1985-03-20,1985-03
玻利维亚总统与工会谈判失败,1985-03-20,1985-03
机器人的步伐,1985-03-20,1985-03
日本警察犯罪引人注目,1985-03-20,1985-03
埃及发现包金木棺,1985-03-20,1985-03
禁用“皇家特准”,1985-03-20,1985-03
非洲人才外流,1985-03-20,1985-03
狗食节育罐头,1985-03-20,1985-03
法国地下公园,1985-03-20,1985-03
塑料温室造林,1985-03-20,1985-03
为市花市树祝福,1985-03-20,1985-03
绿满“北极宫”,1985-03-20,1985-03
从打招呼想到的,1985-03-20,1985-03
萌芽,1985-03-20,1985-03
美国来的信,1985-03-20,1985-03
《诺贝尔文学奖丛书》出版,1985-03-20,1985-03
改革科技体制，推动科技和经济、社会协调发展,1985-03-21,1985-03
基本同意人大常委会工作报告草稿,1985-03-21,1985-03
比利时首相马尔滕斯将访华,1985-03-21,1985-03
胡耀邦将访问西萨摩亚、斐济和巴布亚新几内亚,1985-03-21,1985-03
在调整中不能放松粮食生产,1985-03-21,1985-03
浙江省磷肥生产出现好势头,1985-03-21,1985-03
雁北地区粮食定购合同全落实到户,1985-03-21,1985-03
岂能漫天要价,1985-03-21,1985-03
“高产日”造成重大事故,1985-03-21,1985-03
似曾相识（国内短评）,1985-03-21,1985-03
国务院对温州市进一步对外开放有关问题作出批复,1985-03-21,1985-03
经济短波,1985-03-21,1985-03
青年厂长（经理）企业管理研究班开学,1985-03-21,1985-03
发扬接力赛精神  造福子孙后代,1985-03-21,1985-03
四川森林火灾面积逐年减少,1985-03-21,1985-03
要有改革的思想,1985-03-21,1985-03
文明客船—荣新轮,1985-03-21,1985-03
白藤湖畔“好景门”,1985-03-21,1985-03
科技信息下乡记,1985-03-21,1985-03
“小木屋”的主人徐凤翔调西藏工作,1985-03-21,1985-03
全国林业科普征文评奖揭晓,1985-03-21,1985-03
坚持共同富裕原则  赵县县领导充当“红娘”  富户穷户结对子    践踏尊师重教美德  伊川两干部摧残“园丁”  党纪国法皆难容（今日首都和各省市区报纸要目）,1985-03-21,1985-03
中国青年足球队能进军莫斯科吗？,1985-03-21,1985-03
世界花样滑冰明星巡回表演团在京举行首场表演,1985-03-21,1985-03
奥林匹克邮展揭幕,1985-03-21,1985-03
阿联酋青年队胜泰国队,1985-03-21,1985-03
周继红在法国接受“莫尼克·贝丽乌奖”,1985-03-21,1985-03
参加第三十八届世乒赛的中国代表团第一批成员离京,1985-03-21,1985-03
鱼龙杯足球赛在沪擂响战鼓,1985-03-21,1985-03
简讯,1985-03-21,1985-03
简讯,1985-03-21,1985-03
简讯,1985-03-21,1985-03
潍坊市委把纠正新的不正之风作为整党重点,1985-03-21,1985-03
军事学术研究要着眼未来,1985-03-21,1985-03
刘家奎当上辽宁省劳动模范,1985-03-21,1985-03
中方与阿马科斯特就全球形势和某些地区性问题交换意见,1985-03-21,1985-03
薄一波会见丰田汽车公司访华团,1985-03-21,1985-03
唐克率代表团赴科威特访问,1985-03-21,1985-03
中国文联代表团离京赴朝鲜访问,1985-03-21,1985-03
芮杏文率中国政府代表团回到北京,1985-03-21,1985-03
周延瑾同志逝世,1985-03-21,1985-03
杰出的无产阶级新闻战士,1985-03-21,1985-03
山东省第一劳教所荣获集体一等功,1985-03-21,1985-03
武警北京总队某支队四中队加强纪律教育,1985-03-21,1985-03
首都第一家办理妇女、儿童、婚姻家庭方面法律事宜的律师事务所成立,1985-03-21,1985-03
人工生态系统,1985-03-21,1985-03
“方便食品是个很大的福利”,1985-03-21,1985-03
人工养殖蝇蛆不宜草率推广,1985-03-21,1985-03
要重视餐具消毒,1985-03-21,1985-03
分食——科学的吃饭方式,1985-03-21,1985-03
花粉食品的疗效,1985-03-21,1985-03
用电解水加工食品,1985-03-21,1985-03
松花蛋与铅,1985-03-21,1985-03
海湾国家积极调解两伊战争一些国家航空公司取消飞往两伊航班,1985-03-21,1985-03
越南必须立即停止侵泰,1985-03-21,1985-03
弄巧成拙,1985-03-21,1985-03
国务委员谷牧在巴西参观访问,1985-03-21,1985-03
民柬部队加强在金边地区出击,1985-03-21,1985-03
塞舌尔总统接见我大使,1985-03-21,1985-03
佛得角总理接见我大使,1985-03-21,1985-03
日本成立展望明天日中恳谈会,1985-03-21,1985-03
旅日华侨举行代表会议,1985-03-21,1985-03
美参院通过对非洲灾民非粮食援助案,1985-03-21,1985-03
美苏谈判第三次会议仍无进展,1985-03-21,1985-03
美苏外长将于五月中在维也纳会晤,1985-03-21,1985-03
美参院批准生产二十一枚ＭＸ导弹,1985-03-21,1985-03
比众院同意政府按期部署美导弹,1985-03-21,1985-03
非洲的大旱和饥荒,1985-03-21,1985-03
法刊分析今年世界经济形势,1985-03-21,1985-03
美元突然大跌金价上升,1985-03-21,1985-03
全世界广告费去年达一千五百亿美元,1985-03-21,1985-03
陈强同志已走上了工作岗位,1985-03-21,1985-03
决不辜负党和人民的关怀  努力当一名好的汽车工人,1985-03-21,1985-03
也请给我弟弟一次机会,1985-03-21,1985-03
对捞不义之财的司机要严肃查处,1985-03-21,1985-03
假话不能讲,1985-03-21,1985-03
相悖并行的事,1985-03-21,1985-03
要不要赔偿？应不应处分？,1985-03-21,1985-03
谁为我们新村居民排忧解难？,1985-03-21,1985-03
要消除手扶拖拉机噪音浓烟的污染,1985-03-21,1985-03
简讯,1985-03-21,1985-03
人才未必选票多,1985-03-21,1985-03
怀赵景深先生,1985-03-21,1985-03
观壶口瀑布,1985-03-21,1985-03
瓯江行吟（二首）,1985-03-21,1985-03
从“张工的牙”谈到艺术青春,1985-03-21,1985-03
笑的联想,1985-03-21,1985-03
深巷,1985-03-21,1985-03
决定二十七日召开六届人大三次会议,1985-03-22,1985-03
中华人民共和国主席令,1985-03-22,1985-03
全国人大常委会任命名单,1985-03-22,1985-03
全国人大常委会任免名单,1985-03-22,1985-03
全国人大常委会任免名单,1985-03-22,1985-03
李先念主席从贵阳回到北京,1985-03-22,1985-03
工作监督和法律监督要进一步健全对改革既要坚定又要重视解决问题,1985-03-22,1985-03
搞活开放把石头山变成万宝山,1985-03-22,1985-03
呼吁两伊停止袭击对方非军事目标,1985-03-22,1985-03
我国坚决反对种族隔离政策,1985-03-22,1985-03
让四十岁左右的优秀人才挑重担,1985-03-22,1985-03
依靠科技人员的自觉行动（本报评论）,1985-03-22,1985-03
中华人民共和国涉外经济合同法,1985-03-22,1985-03
发展对外经济关系的重要法律（本报评论）,1985-03-22,1985-03
抚钢改革内部结构  各生产车间相对独立,1985-03-22,1985-03
逼上梁山  天津一机厂大锅改小灶  柳暗花明  扩权到分厂潜力变活力,1985-03-22,1985-03
八大城市将对口开展“青工联谊竞赛”活动,1985-03-22,1985-03
南京发挥义务检查员作用,1985-03-22,1985-03
编者按,1985-03-22,1985-03
办农民进城服务社,1985-03-22,1985-03
赊销饲料解民愁,1985-03-22,1985-03
书柜到农家,1985-03-22,1985-03
新郑县用飞机为枣树治虫,1985-03-22,1985-03
临朐县用“贴息贷款”扶贫成效显著,1985-03-22,1985-03
北京市交通设施器材开发公司成立,1985-03-22,1985-03
农民联合办皮毛公司,1985-03-22,1985-03
事业第一位  高薪请不走,1985-03-22,1985-03
去留抉择有讲究,1985-03-22,1985-03
小麦良种“绵阳十一号”的选育者获奖,1985-03-22,1985-03
维护知识分子正当权益决不能含糊,1985-03-22,1985-03
临床用药监护仪获国家发明奖,1985-03-22,1985-03
六十三种优秀外文书刊获奖,1985-03-22,1985-03
第二届梅花奖评选揭晓,1985-03-22,1985-03
创造杯”少先队活动广播报道比赛开始,1985-03-22,1985-03
第三届“森林风光美展”在京展出,1985-03-22,1985-03
世界邮票展览在广州开幕,1985-03-22,1985-03
文化部等为谢雨辰回归祖国大陆一周年举行招待会,1985-03-22,1985-03
我国南极气象站被世界气象组织授予国际台站代号,1985-03-22,1985-03
加强新药的研究和开发工作,1985-03-22,1985-03
任意设处提干  危害大  邢台检察分院怎能边整边犯    盲目运货进穗  损失重  这批经商人员为何忽视信息（今日首都和各省市区报纸要目）,1985-03-22,1985-03
“买柴”与“卖柴”,1985-03-22,1985-03
杨阳苦战过关险胜成汉国  韩健以逸待劳“磨”垮福特,1985-03-22,1985-03
中国冰球队以六比四胜罗马尼亚队,1985-03-22,1985-03
中国青年足球队获世界青年足球锦标赛决赛阶段比赛资格,1985-03-22,1985-03
群英荟萃京华明星争献绝技,1985-03-22,1985-03
云南十一万干部到农村调查研究,1985-03-22,1985-03
武汉地区“智力拥军”成效显著,1985-03-22,1985-03
藁城县重视对青年思想教育工作,1985-03-22,1985-03
全国人民代表大会常务委员会公告,1985-03-22,1985-03
女职工合法权益应受到保护,1985-03-22,1985-03
太原轻工工业公司党委对领导班子成员和党员进行党性教育,1985-03-22,1985-03
大连市西岗区劳动局认真处理群众来访来信,1985-03-22,1985-03
封丘县利用农闲开展法制教育,1985-03-22,1985-03
姚依林陈慕华分别会见日本丰田汽车公司访华团,1985-03-22,1985-03
廖汉生会见瑞典警察总监,1985-03-22,1985-03
陈慕华会见美国客人,1985-03-22,1985-03
王丙乾会见日本银行访华团,1985-03-22,1985-03
吴学谦宴请几内亚政府代表团,1985-03-22,1985-03
陈慕华宴请意大利外贸部长,1985-03-22,1985-03
华煜卿同志逝世,1985-03-22,1985-03
成都黄埔军校同学会成立,1985-03-22,1985-03
西藏昌都军分区后勤部全心全意为边防部队服务,1985-03-22,1985-03
河北省十五名犯人获高教自学结业证书,1985-03-22,1985-03
哲学研究面临的新问题,1985-03-22,1985-03
东江纵队的抗日斗争,1985-03-22,1985-03
读《西方著名哲学家评传》,1985-03-22,1985-03
学会和善于运用经济调节手段,1985-03-22,1985-03
呼吁以民族利益为重实现全国团结,1985-03-22,1985-03
美国中东政策面临抉择,1985-03-22,1985-03
支持南非和纳米比亚人民斗争（纪念“消除种族歧视国际日”）,1985-03-22,1985-03
南非当局下令禁止群众集会  出动警察开枪镇压示威人群（ 纪念“消除种族歧视国际日”）,1985-03-22,1985-03
消除种族歧视国际日（纪念“消除种族歧视国际日”）,1985-03-22,1985-03
“越南化”,1985-03-22,1985-03
英国西德痛斥越南侵略柬泰,1985-03-22,1985-03
调停日益升级的两伊战争,1985-03-22,1985-03
邓颖超致函慰问田中,1985-03-22,1985-03
阿尔及利亚总理会见张劲夫,1985-03-22,1985-03
谷牧参观中巴合资木材公司,1985-03-22,1985-03
霍梅尼说两伊战争要继续下去,1985-03-22,1985-03
苏联一外交官在新德里被暗杀,1985-03-22,1985-03
美将增加对非洲和拉美的援助  对菲孟等亚洲国家援助将减少,1985-03-22,1985-03
张堤获第一名,1985-03-22,1985-03
埃塞俄比亚久旱逢喜雨,1985-03-22,1985-03
津巴布韦玉米可望丰收,1985-03-22,1985-03
非洲的大旱和饥荒,1985-03-22,1985-03
世界贸易总量去年增长百分之九,1985-03-22,1985-03
呼吁发达国家迅速制止保护主义,1985-03-22,1985-03
美苏将就贸易问题举行高级会谈,1985-03-22,1985-03
一次难产的会议,1985-03-22,1985-03
向美经济界介绍我国经济改革情况,1985-03-22,1985-03
石油现货价格开始坚挺,1985-03-22,1985-03
美众院拨款委员会否决ＭＸ导弹拨款议案,1985-03-22,1985-03
英国公布新财政年度预算方案,1985-03-22,1985-03
美国广播公司被兼并,1985-03-22,1985-03
美国俄亥俄州一家银行关闭,1985-03-22,1985-03
电子计算机使奶牛提高产量,1985-03-22,1985-03
苏在矿井试种蔬菜稳产高产,1985-03-22,1985-03
美科学家用激光分辨癌细胞,1985-03-22,1985-03
英国培养人造皮肤获得成功,1985-03-22,1985-03
日本研制出立体结构半导体,1985-03-22,1985-03
美国两位科学家合成出翡翠,1985-03-22,1985-03
清风亭下哭信芳,1985-03-22,1985-03
二十三岁，走来,1985-03-22,1985-03
坚持改革  不走邪道,1985-03-23,1985-03
当“守法户”光荣（本报评论）,1985-03-23,1985-03
国务院批准统配煤矿总承包五项政策,1985-03-23,1985-03
重庆组建企业性公司,1985-03-23,1985-03
制订生产规划要充分考虑市场需要,1985-03-23,1985-03
我国强烈谴责南非当局镇压黑人群众,1985-03-23,1985-03
尊重企业的法人地位（国内短评）,1985-03-23,1985-03
解决群众买卖树苗困难,1985-03-23,1985-03
不抓科研金变土  抓了科研土变金,1985-03-23,1985-03
大渡河畔女炮工,1985-03-23,1985-03
党政干部后富,1985-03-23,1985-03
头两个月城镇储蓄增加,1985-03-23,1985-03
太原直达广州航班通航,1985-03-23,1985-03
广—深—珠高速公路开工,1985-03-23,1985-03
云浮县又发现一个溶岩洞,1985-03-23,1985-03
绿洲绿洲军垦三十春秋,1985-03-23,1985-03
廉洁奉公的税务员,1985-03-23,1985-03
改进商品包装  减少经济损失,1985-03-23,1985-03
绥宁县对非统配材出境放宽政策,1985-03-23,1985-03
用法律手段保护森林资源,1985-03-23,1985-03
莫让财富变废物（国内短评）,1985-03-23,1985-03
局长星夜送树苗,1985-03-23,1985-03
实现利税上亿元没有滥发奖金,1985-03-23,1985-03
杭州农村三十万青年义务营造风景林,1985-03-23,1985-03
开放蔬菜市场给广州带来新气象（蔬菜经营放开之后）,1985-03-23,1985-03
焦作市蔬菜公司扭亏为盈（蔬菜经营放开之后）,1985-03-23,1985-03
漳州、泉州两市菜多质好（蔬菜经营放开之后）,1985-03-23,1985-03
联营内衣厂经济效益高,1985-03-23,1985-03
禁止向乡镇煤矿乱伸手,1985-03-23,1985-03
经济短波,1985-03-23,1985-03
江苏出现一批新型职业大学,1985-03-23,1985-03
温江农校从衰败中复兴,1985-03-23,1985-03
与校领导共商改革等大事,1985-03-23,1985-03
开的什么价？,1985-03-23,1985-03
各地“抓药难”情况开始好转,1985-03-23,1985-03
吉化设计院采用新技术  两项设计获国家金质奖,1985-03-23,1985-03
新所新办  不拘一格,1985-03-23,1985-03
中美两国新闻界老朋友亲切聚会,1985-03-23,1985-03
北京化纤学院组织学生参加建校工程,1985-03-23,1985-03
《简明不列颠百科全书》即将发行,1985-03-23,1985-03
北京声乐研究所成立,1985-03-23,1985-03
桂林梦幻——日本摄影家久保田博二摄影作品展览开幕,1985-03-23,1985-03
百余名研究生聚会首都为改革献策,1985-03-23,1985-03
春耕生产缺劳力  来了“及时雨”  临沭县派出党员团员帮工队    乡镇企业需知识  欢迎“智多星”  上海城下来退休离休技术员（今日首都和各省市区报纸要目）,1985-03-23,1985-03
全英羽毛球锦标赛产生前八名,1985-03-23,1985-03
足坛新秀——高洪波,1985-03-23,1985-03
第六届全运会会徽正式诞生,1985-03-23,1985-03
周继红在巴黎受奖台上,1985-03-23,1985-03
支持报纸指名道姓批评自己,1985-03-23,1985-03
要深入扎实地开展有理想守纪律全心全意为人民服务的教育活动,1985-03-23,1985-03
光泽县纪委充分发挥部门职能作用,1985-03-23,1985-03
银川市七名领导干部辞去在企业中的兼职,1985-03-23,1985-03
王学文同志遗体告别仪式在京举行,1985-03-23,1985-03
不要吹牛,1985-03-23,1985-03
云南省大力兴办敬老院,1985-03-23,1985-03
阿拉伯银行集团首次向香港银行业投巨资,1985-03-23,1985-03
香港与深圳边境工作小组会第二次会议在香港举行,1985-03-23,1985-03
天津市公安局表彰一批先进集体和个人,1985-03-23,1985-03
武警河北总队四支队抵制新的不正之风,1985-03-23,1985-03
吴学谦同几内亚外长会谈,1985-03-23,1985-03
中意经济合作混合委员会第三次会议举行首次全体会议,1985-03-23,1985-03
朱学范会见芬兰市长代表团,1985-03-23,1985-03
李鹏分别会见联邦德国和日本客人,1985-03-23,1985-03
宋平会见美国客人,1985-03-23,1985-03
深切悼念李代耕同志,1985-03-23,1985-03
这里盗卖铁路器材现象严重,1985-03-23,1985-03
请各有关方面积极设法制止破坏庐山植物园的犯罪行为,1985-03-23,1985-03
所有报纸都应减少文字错误,1985-03-23,1985-03
税利实现上亿元  却不乱花一分钱,1985-03-23,1985-03
植树与浇水,1985-03-23,1985-03
减少文字错误要有得力措施,1985-03-23,1985-03
振兴避暑山庄  我局责无旁贷,1985-03-23,1985-03
请不要随便更改刊名,1985-03-23,1985-03
有些子女阻挠老人寻配偶  往往怀有非常自私的动机,1985-03-23,1985-03
马来西亚全力支持泰国对付越南威胁,1985-03-23,1985-03
