饶有情趣的野驴（自然保护区景物）,1985-02-09,1985-02
武汉医学院向从教五十周年以上的教师颁发荣誉证书,1985-02-09,1985-02
北京老人大学开始招生,1985-02-09,1985-02
深圳影业公司成立,1985-02-09,1985-02
北京高教音像出版社成立,1985-02-09,1985-02
贝利预测下届世界杯足球赛法国队和阿根廷队最有希望,1985-02-09,1985-02
世界高山滑雪锦标赛又决出三枚金牌,1985-02-09,1985-02
黄华副委员长会见国际柔道联合会主席松前重义,1985-02-09,1985-02
普拉蒂尼和基尔弗斯涅米分列欧洲最佳男女运动员榜首,1985-02-09,1985-02
福州市委抓住五件事进行整改,1985-02-09,1985-02
浙江省纪委通报批评宁波三单位,1985-02-09,1985-02
加强党校教育正规化建设,1985-02-09,1985-02
已故检察干部王学礼被追记一等功,1985-02-09,1985-02
做文明市民  创文明单位  建文明城市,1985-02-09,1985-02
江苏省委为开好常委会作出规定,1985-02-09,1985-02
评“怪事一桩”,1985-02-09,1985-02
中国统战理论研究会成立,1985-02-09,1985-02
努力培养知法懂法的武警战士,1985-02-09,1985-02
大凉山驻军为发展民族经济作贡献,1985-02-09,1985-02
帮助“双扶”对象开辟致富门路,1985-02-09,1985-02
北京举办大龄青年集体婚礼,1985-02-09,1985-02
西藏军区某师农场发挥优势为藏族农牧民提供技术支援,1985-02-09,1985-02
宁夏回族自治区政府在京举行招待会,1985-02-09,1985-02
李先念会见利比亚新任驻华人民办事处人民委员会秘书,1985-02-09,1985-02
谷牧会见阿明亲王,1985-02-09,1985-02
宋平会见刚果计划部长,1985-02-09,1985-02
外交学会招待在京外交官和联合国机构代表,1985-02-09,1985-02
杨尚昆方毅分别会见美国俄克拉荷马市大学校长一行,1985-02-09,1985-02
同仁堂店风,1985-02-09,1985-02
谢谢你们，顾客的知心人,1985-02-09,1985-02
农村居民采伐自留地和房前屋后的林木需要审批吗？,1985-02-09,1985-02
我盼望做一名真正的教师,1985-02-09,1985-02
周忠泽急乘客之所急,1985-02-09,1985-02
吴金英待乘客胜似亲人,1985-02-09,1985-02
编者按,1985-02-09,1985-02
捞“油水”谋私利  张鸿烈受处分揭“油霸”顶歪风  谭希贤得奖励,1985-02-09,1985-02
好好的一架风琴竟成了一堆废物,1985-02-09,1985-02
诚恳地接受党报批评发扬光大白求恩精神,1985-02-09,1985-02
民柬部队攻入暹粒市,1985-02-09,1985-02
西提说越南侵柬无法取胜,1985-02-09,1985-02
包藏祸心的决定（国际短评）,1985-02-09,1985-02
柬军民拥护内阁会议公报,1985-02-09,1985-02
瑞典在野党议员要求政府取消对越南的援助,1985-02-09,1985-02
要求台湾当局将所有疑犯交美受审,1985-02-09,1985-02
日报揭露越南旱季攻势的目的,1985-02-09,1985-02
金大中途经日本回到汉城,1985-02-09,1985-02
支持宣布尼泊尔为和平区的建议,1985-02-09,1985-02
日本纵贯列岛的光缆通讯线路正式完工,1985-02-09,1985-02
东非六国召开抗旱会议,1985-02-09,1985-02
中国联合贸易公司在汉堡开业,1985-02-09,1985-02
阿曼副首相接见即将离任的我大使,1985-02-09,1985-02
中国和奥地利签署经济合作备忘录,1985-02-09,1985-02
中匈签订今年换货和付款协定,1985-02-09,1985-02
缅甸努力维护和发展民族文化,1985-02-09,1985-02
南共联盟认为不宜召开世界共产党会议,1985-02-09,1985-02
罗马尼亚基本完成罗共十二大规定任务,1985-02-09,1985-02
日内瓦四十国裁军会议春季会议开幕,1985-02-09,1985-02
霍克说澳美关系没有受到损害,1985-02-09,1985-02
国际经济动态,1985-02-09,1985-02
石油输出国组织削减油价反应良好委内瑞拉、印尼和墨西哥先后降低轻油价格,1985-02-09,1985-02
意法内阁讨论对付恐怖主义的重新抬头,1985-02-09,1985-02
美国一航空公司忽视安全被罚,1985-02-09,1985-02
巴西当选总统坦克雷多访问阿根廷,1985-02-09,1985-02
小报与格调,1985-02-09,1985-02
雅俗共赏《三夫人》,1985-02-09,1985-02
新疆诗稿,1985-02-09,1985-02
抒高尚情操  鞭丑恶心灵,1985-02-09,1985-02
话说电视“补白”,1985-02-09,1985-02
《纪念遵义会议五十周年摄影展览》,1985-02-09,1985-02
新春联,1985-02-09,1985-02
读《舞蹈概论》,1985-02-09,1985-02
简讯,1985-02-09,1985-02
《浙江画报》受到欢迎,1985-02-09,1985-02
一不算计国家二不算计消费者,1985-02-10,1985-02
酒泉成为甘肃首富之乡,1985-02-10,1985-02
江苏大幅度调整种植业结构,1985-02-10,1985-02
宣传工作者的新形象,1985-02-10,1985-02
石家庄地区棉麻公司滥发奖金手段恶劣地委决定改组公司党总支，撤销有关人员职务，现金全部退回,1985-02-10,1985-02
重视报纸批评,1985-02-10,1985-02
中国参加南极长城站落成典礼代表团离京,1985-02-10,1985-02
东盟经济部长会议在吉隆坡闭幕,1985-02-10,1985-02
日本对中国在日筹集资金将予积极合作,1985-02-10,1985-02
宣传干部当“媒婆”,1985-02-10,1985-02
万余小型国营企业取得明显经济效益,1985-02-10,1985-02
珠海经济特区一年实现八个翻番,1985-02-10,1985-02
科技信息交流交易会在河北兴起,1985-02-10,1985-02
吉林发现一座特大型硅灰石矿床,1985-02-10,1985-02
大气环境综合观测在太原市进行,1985-02-10,1985-02
新疆七师战士破冰引水迎春耕,1985-02-10,1985-02
扶持发展商品生产  尽快改变落后面貌,1985-02-10,1985-02
不许假借“公司”之名谋私,1985-02-10,1985-02
党员、干部要当特区建设的“孺子牛”,1985-02-10,1985-02
合肥市中市区房管二所挟私房索财引起公愤,1985-02-10,1985-02
西藏一个小山村的奇迹,1985-02-10,1985-02
“费”的由来,1985-02-10,1985-02
苏州家用电器行业发展快,1985-02-10,1985-02
铜仁地区农机研究所科研、生产、推广一起抓,1985-02-10,1985-02
武汉一轻局调整二级行政机构,1985-02-10,1985-02
我国将建一批建材贸易中心,1985-02-10,1985-02
平江县帮助老区群众致富,1985-02-10,1985-02
深圳文锦渡又一公路桥通车,1985-02-10,1985-02
经济短波,1985-02-10,1985-02
“给人送鱼，不如教人养殖”,1985-02-10,1985-02
唐少传连户搞水运,1985-02-10,1985-02
谁说我不懂待客语言？,1985-02-10,1985-02
大学、中专比例严重失调,1985-02-10,1985-02
为大学生研究生勤工助学广开渠道,1985-02-10,1985-02
中国农学会举行老农学家座谈会,1985-02-10,1985-02
甘肃制定民办科研机构管理办法,1985-02-10,1985-02
哈尔滨铁路局减速顶研究中心改革获硕果,1985-02-10,1985-02
新华社记者２月５日对此报道失实,1985-02-10,1985-02
有感于征收“闲置”费,1985-02-10,1985-02
首都各界庆祝北京同仁堂开业三百一十五周年,1985-02-10,1985-02
电子调光台灯问世,1985-02-10,1985-02
邵宇捐赠文物展览在京举行,1985-02-10,1985-02
我考察队员首次踏上南极半岛,1985-02-10,1985-02
中国水利电力美术摄影书法展览开幕,1985-02-10,1985-02
中国恐龙化石在香港展出,1985-02-10,1985-02
专业大户有觉悟  春节保证不涨价  武汉农贸市场采取措施平抑物价公路沿线乱设卡  车过要收买路钱  广东有关部门早该取缔非法行为（今日首都和各省市区报纸要目）,1985-02-10,1985-02
一件值得提倡的事,1985-02-10,1985-02
辽宁足球队二比一胜维多顿队,1985-02-10,1985-02
中国女排将遇新挑战,1985-02-10,1985-02
著名选手格罗斯再创短池游泳世界最好成绩,1985-02-10,1985-02
中国水球队负于澳大利亚队,1985-02-10,1985-02
卡塔尔队和沙特阿拉伯队获亚洲少年足球锦标赛决赛权,1985-02-10,1985-02
体育,1985-02-10,1985-02
农家父子研制成功玻璃防雾剂,1985-02-10,1985-02
常德卷烟厂发生可喜变化,1985-02-10,1985-02
欢迎失足青年迷途知返重新做人,1985-02-10,1985-02
增强党性  清除派性  加强团结,1985-02-10,1985-02
红星仪表厂关心失足青少年进步成长,1985-02-10,1985-02
每逢佳节倍思亲  人民关怀子弟兵,1985-02-10,1985-02
“智力拥军、智力助民”活动在全国普遍推广,1985-02-10,1985-02
长安乡干部冒雪给五保户送年货,1985-02-10,1985-02
全国有２４万多孤寡老人在敬老院安度晚年,1985-02-10,1985-02
陈慕华回到北京,1985-02-10,1985-02
宋平同刚果计划部长会谈,1985-02-10,1985-02
米库列斯库为纪念罗马尼亚农民起义举行记者招待会,1985-02-10,1985-02
韩权华同志追悼会在京举行,1985-02-10,1985-02
在实践中自学  在自学中成长,1985-02-10,1985-02
表彰忠烈  砥砺后世,1985-02-10,1985-02
杰出的军事家,1985-02-10,1985-02
忆爸爸对我的培养教育,1985-02-10,1985-02
西哈努克主席在梅莱山接受四国大使国书,1985-02-10,1985-02
法共组织国际声援大会,1985-02-10,1985-02
金大中揭露当局向他施暴  美对南朝鲜行为提出抗议,1985-02-10,1985-02
美国希望西欧盟国参加星球大战研究工作,1985-02-10,1985-02
越南当局必须履行联大决议,1985-02-10,1985-02
新西兰总理希望澳新美联盟进行防务合作,1985-02-10,1985-02
以色列的“摩西行动”,1985-02-10,1985-02
贝鲁特机场被劫飞机人质获释,1985-02-10,1985-02
美任命沃尔特斯为驻联合国大使,1985-02-10,1985-02
阿丽阿娜火箭发射两颗通信卫星,1985-02-10,1985-02
国际要闻简报,1985-02-10,1985-02
加拿大将调查隐藏的纳粹战犯,1985-02-10,1985-02
登东京塔有感,1985-02-10,1985-02
非洲民歌一瞥,1985-02-10,1985-02
美国博物馆漫谈,1985-02-10,1985-02
珠撒“蓝色海岸”,1985-02-10,1985-02
墨尔本赛马热,1985-02-10,1985-02
迷人的草原风光,1985-02-10,1985-02
红宝石与缅甸,1985-02-10,1985-02
水电的颂歌,1985-02-10,1985-02
加快干部“四化”步伐  大胆起用一代新人,1985-02-11,1985-02
“十佳”评选揭晓  授奖大会在沪举行,1985-02-11,1985-02
胡耀邦总书记致电热烈祝贺马歇再次当选法共总书记,1985-02-11,1985-02
想国家  顾大局  搞好投入产出包干,1985-02-11,1985-02
主张通过政治对话解决外债问题,1985-02-11,1985-02
湖北投资二亿多元修建中小学校舍,1985-02-11,1985-02
陕西省委书记实行集中办公,1985-02-11,1985-02
五保户喜杀年猪,1985-02-11,1985-02
广东核电合营有限公司开业,1985-02-11,1985-02
我国气温明显偏高趋势将缓和,1985-02-11,1985-02
“吹顺风”,1985-02-11,1985-02
鲜香刺,1985-02-11,1985-02
湖北规定“十个服务”“十个不准”,1985-02-11,1985-02
来自鱼乡的新信息,1985-02-11,1985-02
关键在于改革,1985-02-11,1985-02
招手即来,1985-02-11,1985-02
福建去年农业产值增长速度  首次超过工业产值增长速度,1985-02-11,1985-02
乡镇街道企业要搞好环境保护,1985-02-11,1985-02
制止多头对外  控制重复引进,1985-02-11,1985-02
中国五金矿产进出口总公司取得好成绩,1985-02-11,1985-02
上海第四机床厂积极开发新产品利润一年增长一倍,1985-02-11,1985-02
包钢一月份增产增收,1985-02-11,1985-02
中国人民建设银行贷款支持生产出口商品的企业搞技术改造,1985-02-11,1985-02
农户用上“家庭应用帐簿”,1985-02-11,1985-02
农民集资兴办农机信托服务公司,1985-02-11,1985-02
醋好自有人来买,1985-02-11,1985-02
金家庄村人爱读报,1985-02-11,1985-02
哈尔滨市“二婆婆改嫁”,1985-02-11,1985-02
北京服装三厂经济效益显著,1985-02-11,1985-02
县委书记退款记,1985-02-11,1985-02
不管失职  乱管有害,1985-02-11,1985-02
沪江浙十市外贸积极联合互相支援,1985-02-12,1985-02
分类指导  重点帮助  搞好二期整党,1985-02-12,1985-02
没有成绩不虚报  有了成绩不浮夸,1985-02-12,1985-02
反对浮夸  坚持求实（本报评论）,1985-02-12,1985-02
四十一项出口商品在国际获奖,1985-02-12,1985-02
王老师和“校外生”,1985-02-12,1985-02
全国普通高校达九百多所,1985-02-12,1985-02
群众挖煤国家办交通用户办电,1985-02-12,1985-02
东盟外长会议抨击越南扩张政策,1985-02-12,1985-02
南宁自行车总厂接受批评不要国家机关干部任顾问,1985-02-12,1985-02
全国有四百二十多万人在劳动服务公司显身手,1985-02-12,1985-02
简讯,1985-02-12,1985-02
南宁航运分公司春运安全,1985-02-12,1985-02
勤劳致富喜上眉梢,1985-02-12,1985-02
奇谈怪论,1985-02-12,1985-02
中美合作生产的33——07自卸汽车,1985-02-12,1985-02
长江干线运输百舸争流,1985-02-12,1985-02
广州市郊区第三产业发展快,1985-02-12,1985-02
制止平调合作社财产,1985-02-12,1985-02
武进县六万多农民从事运输业,1985-02-12,1985-02
以城扶乡  以乡补城  兴工富农,1985-02-12,1985-02
天镇化肥厂荣立集体特等功,1985-02-12,1985-02
北京汽车进出口公司成立,1985-02-12,1985-02
内蒙古食品加工业发展快,1985-02-12,1985-02
北京市种火鸡场取得成绩,1985-02-12,1985-02
青岛将引进技术项目,1985-02-12,1985-02
淮阴饲料公司服务热情,1985-02-12,1985-02
浙江省工业增长率夺全国第一,1985-02-12,1985-02
南方各地要抓紧春季植树造林,1985-02-12,1985-02
厂甸恢复生机,1985-02-12,1985-02
芜湖光华玻璃厂一年赚回一个厂,1985-02-12,1985-02
西藏民间运输业蓬勃发展,1985-02-12,1985-02
中美合资生产经营计算机,1985-02-12,1985-02
“画地为牢”的三公里,1985-02-12,1985-02
天津春节粮油供应比去年好,1985-02-12,1985-02
抬不起,1985-02-12,1985-02
山区要富  先开思路,1985-02-12,1985-02
尊师重教要多干实事山西拨款盖教师宿舍,1985-02-12,1985-02
提前半年免试录取优秀中学生,1985-02-12,1985-02
八百里河套到处在亲切慰问教师,1985-02-12,1985-02
后起之秀更当用,1985-02-12,1985-02
我国治疗常见多发眼病有新进展,1985-02-12,1985-02
大型超高温瞬时灭菌机为饮料食品无菌包装创造条件,1985-02-12,1985-02
“香味布书”在北京上市,1985-02-12,1985-02
北京九中开展“听听看看小组”活动,1985-02-12,1985-02
南开大学学生积极参加咨询服务,1985-02-12,1985-02
亡羊补牢  别让南郭先生再出“洋相”  福建严格规定出国人员构成,1985-02-12,1985-02
防患未然  莫在新春佳节硬充“阔气”  抚顺从简安排春节期间活动（今日首都和各省市区报纸要目）,1985-02-12,1985-02
我国将增加一个新的体育项目,1985-02-12,1985-02
苏联队获世界冰上曲棍球锦标赛冠军,1985-02-12,1985-02
我国选手获波恩游泳节一项第三两项第四,1985-02-12,1985-02
简讯,1985-02-12,1985-02
一九八五年欧洲花样滑冰锦标赛结束,1985-02-12,1985-02
让偏瘫病人站起来,1985-02-12,1985-02
大庆市开展群众性的普及法律常识教育,1985-02-12,1985-02
天津市中级人民法院改判一起“贪污案”,1985-02-12,1985-02
要认真对待申诉案件,1985-02-12,1985-02
培养后备力量  充实领导班子,1985-02-12,1985-02
新疆给原国民党起义将校级人员颁发《起义人员证明书》,1985-02-12,1985-02
为残疾人捐款并非“苛捐杂税”,1985-02-12,1985-02
上海八十万青工参加政治轮训,1985-02-12,1985-02
老人们的福气,1985-02-12,1985-02
中国残疾人福利基金会向残疾人社会福利事业单位赠送彩色电视机,1985-02-12,1985-02
田纪云会见刚果计划部长,1985-02-12,1985-02
英国在上海设立总领事馆,1985-02-12,1985-02
简讯,1985-02-12,1985-02
首都军民开展春节慰问演出活动,1985-02-12,1985-02
英文《中国妇女》杂志社与非洲驻华使节夫人联欢,1985-02-12,1985-02
昭昭英灵长相忆,1985-02-12,1985-02
整党健康发展  整党带来活力,1985-02-12,1985-02
先锋谱,1985-02-12,1985-02
门缝不堵风进来,1985-02-12,1985-02
破除陈旧观念  起用年轻干部,1985-02-12,1985-02
发放书报费引起的“风波”,1985-02-12,1985-02
“吹牛”之害不可小看,1985-02-12,1985-02
提倡教育疏导,1985-02-12,1985-02
“曲线谋私”也须休,1985-02-12,1985-02
提几条意见招来横祸,1985-02-12,1985-02
希望多登些这样的好报道,1985-02-12,1985-02
民柬部队包围马德望市,1985-02-12,1985-02
法共二十五大闭幕,1985-02-12,1985-02
亚洲环境部长级会议开幕,1985-02-12,1985-02
必须通过发展农业恢复非洲经济,1985-02-12,1985-02
沙特国王法赫德访问美国,1985-02-12,1985-02
南朝鲜反独裁争民主的斗争高涨,1985-02-12,1985-02
齐亚·哈克总统接见我妇女代表团,1985-02-12,1985-02
简讯,1985-02-12,1985-02
快餐在泰国,1985-02-12,1985-02
卡翁达总统访问埃及,1985-02-12,1985-02
阿萨德连任叙利亚总统,1985-02-12,1985-02
以色列空袭在黎的巴勒斯坦阵地,1985-02-12,1985-02
黎巴嫩发生两起汽车炸弹爆炸事件,1985-02-12,1985-02
捷克斯洛伐克食品工业发展迅速,1985-02-12,1985-02
波兰去年外贸出现顺差,1985-02-12,1985-02
匈牙利第一家私人旅馆生意好,1985-02-12,1985-02
拉美已作为活跃力量出现在国际舞台,1985-02-12,1985-02
美元涨势未已,1985-02-12,1985-02
美元上涨与黄金下跌,1985-02-12,1985-02
“阿丽阿娜”火箭抗衡美航天飞机,1985-02-12,1985-02
比利时两个主要执政党召开会议,1985-02-12,1985-02
美国将发动旅游宣传运动,1985-02-12,1985-02
万年前壁画,1985-02-12,1985-02
陆地鲸,1985-02-12,1985-02
一千五百年前玛雅人墓,1985-02-12,1985-02
一座古村镇遗址,1985-02-12,1985-02
史前古墓,1985-02-12,1985-02
时间在挑战,1985-02-12,1985-02
许钦文先生,1985-02-12,1985-02
百字令,1985-02-12,1985-02
春草,1985-02-12,1985-02
火焰的后裔,1985-02-12,1985-02
欧洲冥想录,1985-02-12,1985-02
发挥集体智慧集中精力抓经济建设工农业总产值连续三年居全国之冠,1985-02-13,1985-02
人甲型基因工程干扰素研制成功,1985-02-13,1985-02
北京市着手清理整顿各种公司,1985-02-13,1985-02
贤内助帮丈夫保全勤,1985-02-13,1985-02
江苏经济迅速发展的启示（本报评论）,1985-02-13,1985-02
介绍我工业技术发展前景和政策,1985-02-13,1985-02
号召世界青年建设美好未来,1985-02-13,1985-02
越军频繁对我国边境开枪开炮  我边防部队忍无可忍奋起还击,1985-02-13,1985-02
不当吃“赞助饭”的食客,1985-02-13,1985-02
冬天里的“夏天”,1985-02-13,1985-02
重申“六优先”（本报评论）,1985-02-13,1985-02
努力增产适销对路消费品,1985-02-13,1985-02
来一个搞好服务质量的竞争,1985-02-13,1985-02
米面复制品大量进入农民家庭,1985-02-13,1985-02
建湖开办经济技术集市,1985-02-13,1985-02
信阳发展商品鱼,1985-02-13,1985-02
扶风县春节前将出售大批生猪,1985-02-13,1985-02
藁城可为春节市场提供大量水果,1985-02-13,1985-02
植树多  成活率高,1985-02-13,1985-02
国营、集体、个体联合养鸡成效显著,1985-02-13,1985-02
商业也要多层次,1985-02-13,1985-02
跨县联营“小型开发区”,1985-02-13,1985-02
三方合营生产食用菌,1985-02-13,1985-02
吸收技术员入股效果好,1985-02-13,1985-02
粮食和养殖专业户结“良缘”,1985-02-13,1985-02
“以水代油”清洗拖拉机,1985-02-13,1985-02
富了的农民爱唱歌,1985-02-13,1985-02
专营孔府名菜的孔膳堂开业,1985-02-13,1985-02
纺织品原料和服装辅料两个进出口公司成立,1985-02-13,1985-02
“点石成金”,1985-02-13,1985-02
离燕归巢  喜中有忧,1985-02-13,1985-02
以诚待人人心归,1985-02-13,1985-02
江苏省按农业区划调整农科所,1985-02-13,1985-02
海军一批科技成果投放国内技术市场,1985-02-13,1985-02
同济大学鼓励学生冒尖奖励教师改革,1985-02-13,1985-02
济南军区召开尊师茶话会,1985-02-13,1985-02
黄翠芬领导的研究室去年获九项成果,1985-02-13,1985-02
北京举办大型文化庙会,1985-02-13,1985-02
中国南极长城站初具规模,1985-02-13,1985-02
致癌物质,1985-02-13,1985-02
著名地质学家张文佑在京逝世,1985-02-13,1985-02
淮阳全面修复太昊陵,1985-02-13,1985-02
维多顿足球队获访华首场胜利,1985-02-13,1985-02
济南举行环城红旗接力长跑活动,1985-02-13,1985-02
全国少年花样滑冰赛结束,1985-02-13,1985-02
世界女子速滑锦标赛民主德国安·舍内刷新女子五千米速滑世界纪录,1985-02-13,1985-02
简讯,1985-02-13,1985-02
世界高山滑雪锦标赛结束我选手名次仍然靠后,1985-02-13,1985-02
电影明星  体育明星  如今又有服务明星  上海出新招重视服务  领导监督  专职监督  新年增设电话监督  武汉靠群众监督物价（今日首都和各省市区报纸要目）,1985-02-13,1985-02
天津市停转机关兴办的一百多个公司商店企业,1985-02-13,1985-02
弥勒县委勇于保护有失误的能人,1985-02-13,1985-02
能人并非完人,1985-02-13,1985-02
国家行政机关要为搞活企业经济服务,1985-02-13,1985-02
肃清“左”的影响  开创统战理论工作新局面,1985-02-13,1985-02
民政部长崔乃夫看望老区人民,1985-02-13,1985-02
为经济建设提供法律服务,1985-02-13,1985-02
一天打退越军十二次进攻,1985-02-13,1985-02
新四军纪念馆在盐城动工兴建,1985-02-13,1985-02
国务院批准辽宁建立三个满族自治县,1985-02-13,1985-02
海军航空兵某歼击机大队荣获“飞行安全大队”称号,1985-02-13,1985-02
国际青年年中国组织委员会将于今年五月举办亚太地区青年友好会见活动,1985-02-13,1985-02
中国朝鲜蒙古苏联在京签订铁路运输议定书,1985-02-13,1985-02
谷牧会见联邦德国客人,1985-02-13,1985-02
黄华会见梅田善美,1985-02-13,1985-02
许德珩会见澳大利亚捷利行有限公司董事长,1985-02-13,1985-02
朱学范会见日本大府市议会议员友好访华团,1985-02-13,1985-02
李鹏会见荷兰菲利普公司副总裁,1985-02-13,1985-02
雨涤青松更葱茏,1985-02-13,1985-02
食品工业新产品开发信息,1985-02-13,1985-02
家长赞成给中、小学生课间加餐,1985-02-13,1985-02
荤素相宜是上策,1985-02-13,1985-02
吉林葡萄酒产销增长,1985-02-13,1985-02
香港快餐的经营特色,1985-02-13,1985-02
有前途的蜗牛养殖业,1985-02-13,1985-02
运城地区食品在京展出,1985-02-13,1985-02
肉质鲜美的福寿螺,1985-02-13,1985-02
银川国营餐馆开设方便快餐,1985-02-13,1985-02
走向世界  为国争光,1985-02-13,1985-02
《企业家丛书》即将出版发行,1985-02-13,1985-02
民柬国民军深入金边附近,1985-02-13,1985-02
东盟六国外长特别会议发表声明要从政治和军事上支持民柬抗越斗争,1985-02-13,1985-02
马歇和法工会领导人分别会见倪志福,1985-02-13,1985-02
不结盟运动应坚持独立和非集团性质真正持久缓和需要所有国家广泛合作,1985-02-13,1985-02
侵柬越军士兵厌战,1985-02-13,1985-02
法赫德国王与里根总统举行会谈,1985-02-13,1985-02
侯赛因会见阿拉法特,1985-02-13,1985-02
扎伊尔的第一位女大使,1985-02-13,1985-02
南非非洲人国民大会前领导人曼德拉拒绝南非当局的有条件释放,1985-02-13,1985-02
中法签署空间科学技术合作议定书,1985-02-13,1985-02
日本网走市庆祝日中友好团体成立十周年,1985-02-13,1985-02
日本首相首次出席庆祝“建国纪念日”集会,1985-02-13,1985-02
国际简讯,1985-02-13,1985-02
中国书好！,1985-02-13,1985-02
欧洲共同体向埃塞俄比亚尼日尔提供援助,1985-02-13,1985-02
尼日利亚向非洲旱灾严重国家提供应急援助,1985-02-13,1985-02
北欧保守党年会讨论安全政策和经济合作,1985-02-13,1985-02
布达佩斯中心菜市场见闻,1985-02-13,1985-02
日、美加、共同体三方举行通商会议,1985-02-13,1985-02
卡林顿呼吁北约团结合作对付恐怖活动,1985-02-13,1985-02
从牛肉“过剩”看农产品销售战,1985-02-13,1985-02
日本注意人口老龄化问题,1985-02-13,1985-02
日研制成超薄型彩色电视机,1985-02-13,1985-02
苏联建成首座大型太阳能发电站,1985-02-13,1985-02
美国加快军用机器人生产,1985-02-13,1985-02
美科学家发明能听写打印的电脑,1985-02-13,1985-02
“求全之毁”（注）,1985-02-13,1985-02
旅顺口，我们这样回答你,1985-02-13,1985-02
作协四次代表大会杂诗,1985-02-13,1985-02
千年古榕,1985-02-13,1985-02
生活的笑容（三首）,1985-02-13,1985-02
欧行冥想录,1985-02-13,1985-02
端正党风推进改革（本报评论）,1985-02-14,1985-02
带头清退礼品  公开作自我批评,1985-02-14,1985-02
端正党风严于律己  搞活经济有章可循,1985-02-14,1985-02
探亲三天回家转,1985-02-14,1985-02
邓颖超致电热烈祝贺齐奥塞斯库  再次当选罗民主和团结阵线主席,1985-02-14,1985-02
斐济和瓦努阿图遭受风灾  我政府分别捐赠救灾款项,1985-02-14,1985-02
中国政府决定派谷牧为特使  出席巴西新总统的就职仪式,1985-02-14,1985-02
农民的议价肉新鲜  市民争买国营店平价肉难卖  店员发愁,1985-02-14,1985-02
帮助老区振兴经济,1985-02-14,1985-02
白果树村农民投资建起儿童公园,1985-02-14,1985-02
春节演十五部影片,1985-02-14,1985-02
我雪雕《希望之光》在国际比赛中获奖,1985-02-14,1985-02
我国科学养虾有新进展,1985-02-14,1985-02
内蒙古牛羊肉总产量和畜牧业总产值创新纪录,1985-02-14,1985-02
为服务者服务,1985-02-14,1985-02
繁荣的年集,1985-02-14,1985-02
抓质量  创名牌  发展出口贸易,1985-02-14,1985-02
到国际市场夺取更多的金牌（本报评论）,1985-02-14,1985-02
中华人民共和国城市维护建设税暂行条例,1985-02-14,1985-02
南方各地春季造林逐步展开,1985-02-14,1985-02
城市科学研究要为改革服务,1985-02-14,1985-02
