赤峰成为内蒙古第一个基本无文盲市,1985-02-19,1985-02
中日合作组装二十万伏高压透射电子显微镜,1985-02-19,1985-02
著名内科专家王叔咸教授逝世,1985-02-19,1985-02
教养,1985-02-19,1985-02
上海优先开发微电子技术,1985-02-19,1985-02
重庆设立文学艺术创作奖励基金,1985-02-19,1985-02
宋庆龄基金会举行在京理事会议,1985-02-19,1985-02
中国医药对外经济技术合作总公司成立,1985-02-19,1985-02
昔争“农转非”  今愿“非转农”  瑞安县粮食部门遇到新事亲拔“钉子户”  人称“铁市长”  延安市长高仲田敢于碰硬（今日首都和各省市区报纸要目）,1985-02-19,1985-02
第三十八届世乒赛五个单项比赛的种子选手抽签分区揭晓,1985-02-19,1985-02
世界大学生冬运会比赛开始,1985-02-19,1985-02
北京足球队雪花基金会成立,1985-02-19,1985-02
黑龙江女子冰球邀请赛鸣金收兵,1985-02-19,1985-02
光荣的教师之家,1985-02-19,1985-02
要在整顿作风加强纪律上花大力气,1985-02-19,1985-02
北京军区各部队积极支援华北革命老区建设,1985-02-19,1985-02
在京藏胞欢度藏历年,1985-02-19,1985-02
辽源市纠正滥发服装风,1985-02-19,1985-02
坚持原则  敢抓敢管,1985-02-19,1985-02
令到即行不搞浪费,1985-02-19,1985-02
大连市委改进会风,1985-02-19,1985-02
浙江审理一起台湾国民党特务案件,1985-02-19,1985-02
不要荒了自家的“田”,1985-02-19,1985-02
河南司法部门进行改革,1985-02-19,1985-02
退伍战士黎意财开办咖啡馆,1985-02-19,1985-02
香港人口达五百三十九万七千多人,1985-02-19,1985-02
我国政府对美方这一做法表示遗憾,1985-02-19,1985-02
庆祝坦中友好条约签订二十周年,1985-02-19,1985-02
巴布亚新几内亚副总理温蒂离广州回国,1985-02-19,1985-02
简讯,1985-02-19,1985-02
为改革而奋飞,1985-02-19,1985-02
做好新形势下党的纪检工作,1985-02-19,1985-02
今日“先进观”（言论摘编）,1985-02-19,1985-02
还需要重打鼓另开张吗？（言论摘编）,1985-02-19,1985-02
义无反顾却闲言（言论摘编）,1985-02-19,1985-02
形式主义贻害无穷（言论摘编）,1985-02-19,1985-02
秀才妙笔莫“生花”（言论摘编）,1985-02-19,1985-02
党风正  敢碰硬  经济活,1985-02-19,1985-02
发现问题不放过  查处问题讲认真,1985-02-19,1985-02
一就是一  上报“万元户”不弄虚作假,1985-02-19,1985-02
替俺谢谢老白同志,1985-02-19,1985-02
“赞助”名义下的骗局,1985-02-19,1985-02
民柬国民军攻占磅同省斯当县城,1985-02-19,1985-02
侵柬越军炮轰泰国村庄受到泰军猛烈还击泰军俘虏七名入侵越军士兵,1985-02-19,1985-02
世界第三例人工心脏移植,1985-02-19,1985-02
卡塔尔支持东盟国家的呼吁要求越南撤出柬埔寨,1985-02-19,1985-02
越南侵略者捞到了什么？,1985-02-19,1985-02
杰马耶勒总统视察赛达市受到热烈欢迎,1985-02-19,1985-02
中坦友好条约的意义远超出两国范围,1985-02-19,1985-02
杰哈德说约巴协议符合巴全委会原则巴民阵和人阵领导人反对约巴协议,1985-02-19,1985-02
苏在阿富汗部署ＳＳ—１２导弹,1985-02-19,1985-02
诿过于民,1985-02-19,1985-02
新喀里多尼亚局势又趋紧张,1985-02-19,1985-02
印博帕尔毒气渗漏事故殃及婴儿,1985-02-19,1985-02
阿拉法特会见中国驻突尼斯大使,1985-02-19,1985-02
马里执政党副总书记接见我大使,1985-02-19,1985-02
巴基斯坦总统观看江西杂技团演出,1985-02-19,1985-02
汉堡东部土壤砷含量高造成危害,1985-02-19,1985-02
国际简讯,1985-02-19,1985-02
中国经济改革是一场革命,1985-02-19,1985-02
美国农业面临的困境,1985-02-19,1985-02
支持孔塔多拉集团为中美洲和平的斡旋,1985-02-19,1985-02
尼加拉瓜副总统拉米雷斯访问西欧四国,1985-02-19,1985-02
庞廷案件的风波,1985-02-19,1985-02
愿意调解哥斯达黎加尼加拉瓜争端,1985-02-19,1985-02
撒切尔夫人要求美采取措施削减预算赤字,1985-02-19,1985-02
苏从美购粮一千五百六十万吨,1985-02-19,1985-02
风雪流浪人,1985-02-19,1985-02
贺年片背后的故事,1985-02-19,1985-02
肖与不肖,1985-02-19,1985-02
海峡抒情短章（二首）,1985-02-19,1985-02
山乡，响起春的足音（外一首）,1985-02-19,1985-02
欧行冥想录,1985-02-19,1985-02
编者附记,1985-02-19,1985-02
同心协力实现祖国富强人民富裕党和国家领导人同各地群众欢度春节,1985-02-20,1985-02
军民情深  同迎新春,1985-02-20,1985-02
做利满天下的“孺子牛”（本报评论）,1985-02-20,1985-02
国务院电贺中国南极长城站建成,1985-02-20,1985-02
唐山孤儿欢度除夕,1985-02-20,1985-02
武衡率代表团抵乔治岛,1985-02-20,1985-02
福建商业部门采购年货供应台湾同胞,1985-02-20,1985-02
港人佳节乐融融,1985-02-20,1985-02
羊城花市喜洋洋,1985-02-20,1985-02
第十五个春节,1985-02-20,1985-02
福星高照,1985-02-20,1985-02
向全国老年同志祝贺新春,1985-02-20,1985-02
为了千万家团圆幸福,1985-02-20,1985-02
北京市建筑工程总公司实现三大突破,1985-02-20,1985-02
中古一九八五年度贸易议定书在京签字,1985-02-20,1985-02
蒙铁尔武官举行招待会庆祝墨西哥建军节,1985-02-20,1985-02
国际青年年《我们这一代年轻人》征文开始评奖,1985-02-20,1985-02
江苏水产品生产出现活跃局面,1985-02-20,1985-02
河南大牲畜创历史最高纪录,1985-02-20,1985-02
微波炉进入家庭厨房,1985-02-20,1985-02
南宁春节举行赛花会,1985-02-20,1985-02
福州建成全景电影院,1985-02-20,1985-02
世界大学生冬运会将在捷举行,1985-02-20,1985-02
中国全力支持柬埔寨人民抗越斗争,1985-02-20,1985-02
民柬国民军袭击梅莱山地区的越军,1985-02-20,1985-02
泰谴责越对民柬部队使用毒气,1985-02-20,1985-02
支持纳米比亚和南非人民正义斗争,1985-02-20,1985-02
高度评价李先念主席即将访泰,1985-02-20,1985-02
纽约华界喜迎春节,1985-02-20,1985-02
东南亚和西太平洋地区卫生和发展会议在曼谷开幕,1985-02-20,1985-02
意大利人因饮酒过多造成巨大损失,1985-02-20,1985-02
美苏在维也纳就中东问题交换意见最后消息,1985-02-20,1985-02
为对付新韩民主党全斗焕改组南朝鲜“内阁”,1985-02-20,1985-02
斯向印建议在保克海峡联合巡逻,1985-02-20,1985-02
中加合营食品加工厂在多伦多市郊开业,1985-02-20,1985-02
我援建的索马里农场水稻喜获丰收,1985-02-20,1985-02
简讯,1985-02-20,1985-02
芳邻处处是友情,1985-02-20,1985-02
首都各界举行春节团拜会,1985-02-21,1985-02
春节祝词,1985-02-21,1985-02
向云南各族人民庆贺新春佳节,1985-02-21,1985-02
祝愿黑龙江人民取得更大成绩,1985-02-21,1985-02
不接新娘  接顾客,1985-02-21,1985-02
江苏农民去年收入大增,1985-02-21,1985-02
二月下旬天气展望,1985-02-21,1985-02
欢度牛年第一个夜晚,1985-02-21,1985-02
十九省市电台为台胞举办迎春晚会,1985-02-21,1985-02
变,1985-02-21,1985-02
王震为上海交通大学九名教授签发荣誉证书,1985-02-21,1985-02
湖南省委省府春节前慰问教师,1985-02-21,1985-02
山东省领导给教师拜年,1985-02-21,1985-02
胡乔木同厦门人民共度春节,1985-02-21,1985-02
长春将建具有中国特色电影城,1985-02-21,1985-02
我国轻工业生产佳音频传,1985-02-21,1985-02
纺织部奖励３８项科技成果,1985-02-21,1985-02
新春佳节在南极,1985-02-21,1985-02
党委书记的责任更重了,1985-02-21,1985-02
踩河新村除夕夜,1985-02-21,1985-02
来自祖国的亲切问候,1985-02-21,1985-02
我冰球队战胜南朝鲜队,1985-02-21,1985-02
中国足球队四比零胜澳门足球队,1985-02-21,1985-02
干涉阿富汗的是谁？（本报评论）,1985-02-21,1985-02
超级大国应率先停止试验改进和生产核武器,1985-02-21,1985-02
越军发动旱季攻势的目的未能达到,1985-02-21,1985-02
炳总理说泰将对越威胁作出军事反应,1985-02-21,1985-02
联合国特设委员会谴责越南侵犯泰柬边境,1985-02-21,1985-02
美苏重开关于中东问题对话,1985-02-21,1985-02
庆祝中坦友好条约签订二十周年,1985-02-21,1985-02
美国人在纽约欢度中国春节,1985-02-21,1985-02
胡晓平在苏举行首场音乐会,1985-02-21,1985-02
真诚友谊和合作的卓越典范,1985-02-21,1985-02
彪炳青史树范例,1985-02-21,1985-02
国家给了企业自主权  企业要为国家多贡献,1985-02-22,1985-02
大同矿年初一产煤八万多吨,1985-02-22,1985-02
浙大一项科研成果节约一亿五千万元,1985-02-22,1985-02
胡耀邦李先念赵紫阳等同志看望叶剑英同志致节日问候,1985-02-22,1985-02
胡启立同志代表中央书记处同志看望陈云同志祝贺新春佳节,1985-02-22,1985-02
习仲勋胡启立乔石同志分别看望聂荣臻同志致节日问候,1985-02-22,1985-02
上海吸收外资突破九亿美元,1985-02-22,1985-02
“一口吃不成个胖子”（本报评论）,1985-02-22,1985-02
南极长城站落成典礼隆重举行,1985-02-22,1985-02
个体户边辉带头稳定物价  开原县狗肉饭店生意兴隆,1985-02-22,1985-02
南昌铁路分局今年春运工作既多又好,1985-02-22,1985-02
西藏边防部队帮助驻地群众发展生产,1985-02-22,1985-02
军队离休干部春节欢聚解放军俱乐部,1985-02-22,1985-02
盐城市郊农民集资治理河道,1985-02-22,1985-02
南极长城站邮局开业,1985-02-22,1985-02
文具“店主”进山庄,1985-02-22,1985-02
安徽粮食系统增盈有方净盈利额名列全国前茅,1985-02-22,1985-02
越军接连炮击我云南边境,1985-02-22,1985-02
“润物细无声”,1985-02-22,1985-02
春节期间的北京地坛文化庙会,1985-02-22,1985-02
职工人均产值一万四千多元,1985-02-22,1985-02
对春联,1985-02-22,1985-02
春节期间合肥市广为教师办好事,1985-02-22,1985-02
军官向教授拜年,1985-02-22,1985-02
回家乡邯郸度假的大学生开展社会服务活动,1985-02-22,1985-02
北疆军区师团领导到哨卡过年,1985-02-22,1985-02
郭琨欢迎各国及台湾省科学家到长城站参加考察活动,1985-02-22,1985-02
中国南极长城站落成典礼,1985-02-22,1985-02
青海农村牧区利用太阳能风能,1985-02-22,1985-02
乌兰夫和农村少年一起欢度春节,1985-02-22,1985-02
花城·花市·花乡,1985-02-22,1985-02
成都灯会,1985-02-22,1985-02
监狱里的团圆饭,1985-02-22,1985-02
上海娱乐场所多起来了,1985-02-22,1985-02
巴解执委会通过约巴联合行动方案,1985-02-22,1985-02
越军悍然进攻泰国边境据点泰边防部队奋起打退入侵者,1985-02-22,1985-02
民柬国民军在菩萨等地袭击越军,1985-02-22,1985-02
东林新貌,1985-02-22,1985-02
昂纳克欢迎苏美控制军备谈判,1985-02-22,1985-02
里根同撒切尔夫人讨论东西方关系等问题,1985-02-22,1985-02
巴政府给阿富汗难民安排谋生职业,1985-02-22,1985-02
葛罗米柯重申苏愿同美发展关系,1985-02-22,1985-02
欧洲共同体外长会议结束,1985-02-22,1985-02
电话在美国,1985-02-22,1985-02
意大利举行狂欢节活动,1985-02-22,1985-02
美在加进行巡航导弹飞行试验,1985-02-22,1985-02
坦桑尼亚总理举行招待会,1985-02-22,1985-02
旅美华侨和美籍华人欢度春节,1985-02-22,1985-02
我驻加拿大使馆举行春节招待会,1985-02-22,1985-02
国际简讯,1985-02-22,1985-02
团圆夜,1985-02-22,1985-02
春天的杂文,1985-02-22,1985-02
跟上变革的生活,1985-02-22,1985-02
为小学教师立传,1985-02-22,1985-02
致南极考察队,1985-02-22,1985-02
广场的风筝,1985-02-22,1985-02
普天同庆（年画）,1985-02-22,1985-02
海丰县党风正民风好经济活,1985-02-23,1985-02
石化总公司经济效益全面提高,1985-02-23,1985-02
开放技术支援农民办矿,1985-02-23,1985-02
开展民间信用  活跃农村经济,1985-02-23,1985-02
从多方面为外商驻沪人员提供服务,1985-02-23,1985-02
山西一百多省级机关干部获大专文凭,1985-02-23,1985-02
今后不再搞文明礼貌月 五讲四美三热爱经常化,1985-02-23,1985-02
德奎利亚尔呼吁支持纳米比亚人民自决,1985-02-23,1985-02
拥军工厂,1985-02-23,1985-02
闯红灯,1985-02-23,1985-02
人不能被钱支配,1985-02-23,1985-02
重庆市设立文学艺术创作奖励基金,1985-02-23,1985-02
上高县农村有上百所业余科技学校,1985-02-23,1985-02
一年结五次果的核桃树,1985-02-23,1985-02
改革住房分配势在必行（国内短评）,1985-02-23,1985-02
精心育苗的好园丁,1985-02-23,1985-02
牡丹江钢纸总厂补贴出售新房,1985-02-23,1985-02
陕西八城市进行住宅补贴出售试点,1985-02-23,1985-02
企业有了自主权  要为国家作贡献,1985-02-23,1985-02
把“触角”伸向沿海,1985-02-23,1985-02
玉屏县转化粮食效益显著,1985-02-23,1985-02
赚钱不忘服务宗旨,1985-02-23,1985-02
青岛一轻系统产值利润持续增长,1985-02-23,1985-02
巫溪县四千多农户种草万余亩,1985-02-23,1985-02
南昌市放开蔬菜市场购销两旺,1985-02-23,1985-02
黑山县棉麻烟公司把“死棋”走活,1985-02-23,1985-02
一千多个个体电影队活跃在云南农村,1985-02-23,1985-02
泰丰楼“红”了,1985-02-23,1985-02
经济短波,1985-02-23,1985-02
上海向全国提供科技咨询服务,1985-02-23,1985-02
薄礼寄深情,1985-02-23,1985-02
“落实办”？“应付办”？,1985-02-23,1985-02
宁夏建立稻麦品种资源数据库系统,1985-02-23,1985-02
北京德胜门箭楼对外开放,1985-02-23,1985-02
今年暑假将举行青少年计算机程序设计赛,1985-02-23,1985-02
友好合作的开端,1985-02-23,1985-02
首都举行春节环城赛,1985-02-23,1985-02
欢腾的松花江,1985-02-23,1985-02
我选手在自由滑比赛中名列第五,1985-02-23,1985-02
简讯,1985-02-23,1985-02
捷克斯洛伐克选手成绩优异,1985-02-23,1985-02
中国冰球队负于苏联队,1985-02-23,1985-02
常在河边走  就是不湿鞋  本钢销售处党风端正人称“清水衙门”    植根土壤中  优劣问群众  石圪节煤矿干部管理实行“民主评议”（今日首都和各省市区报纸要目）,1985-02-23,1985-02
把能量释放出来,1985-02-23,1985-02
四天解决一件拖了四年的问题,1985-02-23,1985-02
内蒙古去年有七千六百多知识分子入党,1985-02-23,1985-02
三名成就突出的知识分子受到重奖,1985-02-23,1985-02
江苏城乡退伍军人两用人才介绍所积极工作,1985-02-23,1985-02
广州军区主动做好侨房清退工作,1985-02-23,1985-02
仓山区为黄宏龙兄弟落实房屋政策,1985-02-23,1985-02
兴宁县认真落实党的侨务政策,1985-02-23,1985-02
昆明“文革”时期被占侨房退还完毕,1985-02-23,1985-02
编者按,1985-02-23,1985-02
上海开展企业法律顾问工作为经济建设提供法律服务,1985-02-23,1985-02
谢一矿为六十二对大龄青年举行集体婚礼,1985-02-23,1985-02
镇西区农民管乐队为四川省府春节团拜会助兴,1985-02-23,1985-02
港币汇价稳定  香港经济得益,1985-02-23,1985-02
加强对经济犯罪行为的检察工作,1985-02-23,1985-02
简讯,1985-02-23,1985-02
安徽十八万孤寡老人安度晚年,1985-02-23,1985-02
热心四化建设的共产党员孙万才,1985-02-23,1985-02
希望尽量减少文字错误,1985-02-23,1985-02
人民警察帮我找到了孩子,1985-02-23,1985-02
他们有颗全心全意为旅客服务的心,1985-02-23,1985-02
川丰—１５马力拖拉机质量愈来愈差（千万不要忘记为人民服务）,1985-02-23,1985-02
两个喇叭不同调（千万不要忘记为人民服务）,1985-02-23,1985-02
金城摩托质量太差（千万不要忘记为人民服务）,1985-02-23,1985-02
客车应真正方便乘客（千万不要忘记为人民服务）,1985-02-23,1985-02
华新浴池重开业  顾客要求得实现,1985-02-23,1985-02
山东省委领导同志重视读者意见   要求各地解决群众洗澡难等问题,1985-02-23,1985-02
莱芜市决定上半年建设好公共厕所,1985-02-23,1985-02
何谓反馈信息？,1985-02-23,1985-02
侵柬越军在旱季攻势中伤亡巨大,1985-02-23,1985-02
许多国家积极认捐援救柬埔寨难民,1985-02-23,1985-02
民柬部队在洞里萨湖周围开展游击战,1985-02-23,1985-02
粮农组织总干事强调非洲应恢复农业生产,1985-02-23,1985-02
莫桑比克总统感谢中国的粮食援助,1985-02-23,1985-02
侵柬越军为米格—２３战斗机改建机场,1985-02-23,1985-02
冈比亚领导人重申支持民柬抗越斗争,1985-02-23,1985-02
澳总督表示将继续维护澳新美安全条约,1985-02-23,1985-02
齐奥塞斯库呼吁以色列撤出所占阿拉伯领土,1985-02-23,1985-02
意共总书记纳塔谈意大利大选前景,1985-02-23,1985-02
以色列占领军野蛮镇压黎南部居民,1985-02-23,1985-02
我驻乌干达大使离任回国,1985-02-23,1985-02
我国海军代表团访问泰国,1985-02-23,1985-02
中捷文化交流计划在布拉格签字,1985-02-23,1985-02
中土文化交流计划在安卡拉签署,1985-02-23,1985-02
希一报纸发行人遭枪击身亡,1985-02-23,1985-02
国际简讯,1985-02-23,1985-02
意大利警方搜捕黑手党犯罪分子,1985-02-23,1985-02
三田町记事（上）,1985-02-23,1985-02
朝鲜一些企业完成上月生产计划,1985-02-23,1985-02
几内亚总统强调要发展农业生产,1985-02-23,1985-02
塞内加尔强调优先发展水利事业,1985-02-23,1985-02
哥伦比亚减少粮食进口,1985-02-23,1985-02
巴黎杂记,1985-02-23,1985-02
撒切尔夫人的华盛顿之行,1985-02-23,1985-02
重申美国对美苏谈判等问题的立场,1985-02-23,1985-02
大量美国机密情报流入苏联之手,1985-02-23,1985-02
一个可喜的数字,1985-02-23,1985-02
艺术纪实的力量,1985-02-23,1985-02
新疆诗稿,1985-02-23,1985-02
切莫见利忘艺,1985-02-23,1985-02
今年的上影,1985-02-23,1985-02
赵鸿该叫“十二红”,1985-02-23,1985-02
冰雕新蕾,1985-02-23,1985-02
首都举行春节慰问教师联欢会,1985-02-24,1985-02
地方大专院校支援部队培养人才,1985-02-24,1985-02
浙江把军队干部教育列入高教规划,1985-02-24,1985-02
因店制宜：包、转、租、赁,1985-02-24,1985-02
开发财路  扶贫致富,1985-02-24,1985-02
首都将兴建豪华宾馆——华侨国际大厦,1985-02-24,1985-02
二十六国建成核电站三百十八座,1985-02-24,1985-02
乡镇企业的热心人,1985-02-24,1985-02
春雨育新苗  新春快造林,1985-02-24,1985-02
郭远庭被开除党籍判刑八年,1985-02-24,1985-02
启迪和箴诫,1985-02-24,1985-02
引导比干预好,1985-02-24,1985-02
绿山深处有人家,1985-02-24,1985-02
调整产业结构要扬长避短,1985-02-24,1985-02
株洲市属各县乡镇企业发展快,1985-02-24,1985-02
济南槐荫化工总厂发展横向联营,1985-02-24,1985-02
塘美乡农民积极兴办家庭工厂,1985-02-24,1985-02
积极为牧区培养人才输送能人,1985-02-24,1985-02
化工科技攻关硕果累累,1985-02-24,1985-02
愿听一声“要不要”,1985-02-24,1985-02
上海石化总厂加氢裂化装置投料试车,1985-02-24,1985-02
营口市清理党政机关干部经商问题,1985-02-24,1985-02
云南发现一宝石矿带,1985-02-24,1985-02
热气腾腾的北京站,1985-02-24,1985-02
社旗镇办起高档服装洗染店,1985-02-24,1985-02
北海市拉开基本建设序幕,1985-02-24,1985-02
连云港加快基础设施建设,1985-02-24,1985-02
温州内联工作进展快,1985-02-24,1985-02
深圳人均居住九点六平方米,1985-02-24,1985-02
湛江市广招四方人才,1985-02-24,1985-02
广州市扩大电话容量,1985-02-24,1985-02
辽宁沿海城市加强协作,1985-02-24,1985-02
春节肥西行,1985-02-24,1985-02
武汉乘车难,1985-02-24,1985-02
节日坚守岗位创高产,1985-02-25,1985-02
各级党组织必须采取有力措施刹住动用公款吃喝送礼的歪风,1985-02-25,1985-02
农民的呼吁,1985-02-25,1985-02
一年大计早安排（本报评论）,1985-02-25,1985-02
儿子教育父亲守法,1985-02-25,1985-02
有偿合同制带来了活力北京科研机构大显其能,1985-02-25,1985-02
搞活交通流通  敞开三镇大门,1985-02-25,1985-02
拉萨各族人民欢度藏历新年,1985-02-25,1985-02
要求各地积极推行火葬改革土葬,1985-02-25,1985-02
功劳让嘴说跑了？,1985-02-25,1985-02
扬州市形成四个造船产业群体,1985-02-25,1985-02
约旦正式宣布约巴协议全文,1985-02-25,1985-02
祖国雄鹰,1985-02-25,1985-02
沈阳标准件厂加速技术改造,1985-02-25,1985-02
上海机床厂不断开拓国际市场,1985-02-25,1985-02
河北开展职工技术练兵比赛活动,1985-02-25,1985-02
提早送化肥到农家,1985-02-25,1985-02
荣子村农民投资兴建现代化鸡舍猪舍,1985-02-25,1985-02
佛山市农村金融工作形势喜人,1985-02-25,1985-02
长治市办起金融服务社,1985-02-25,1985-02
发展横向联系  扩大民品生产,1985-02-25,1985-02
内地经商人员参加西藏勤劳致富经验交流会,1985-02-25,1985-02
再不要向我们摊派了！,1985-02-25,1985-02
温州农村出现三百多个商品交易市场,1985-02-25,1985-02
全国已有小水电站７．８万座,1985-02-25,1985-02
浙闽潮汐发电资源丰富,1985-02-25,1985-02
提倡服务人员讲普通话,1985-02-25,1985-02
北京东华服装公司筹备时兴货源,1985-02-25,1985-02
特快列车装上了闭路电视,1985-02-25,1985-02
物探数据处理系统编制成功,1985-02-25,1985-02
无纺布用粘合剂研制成功,1985-02-25,1985-02
出租是个好办法,1985-02-25,1985-02
一种新的粮食作物——籽粒苋,1985-02-25,1985-02
开辟新的教学科研领域,1985-02-25,1985-02
请注意“低分高能”者,1985-02-25,1985-02
桃江县出现一批科研生产联合体,1985-02-25,1985-02
纠正美国“大众数据库”多处错误,1985-02-25,1985-02
领导下食堂  食堂大变,1985-02-25,1985-02
诊断血尿病因有了新方法,1985-02-25,1985-02
“迎春杯”赛擂响   今年我国足坛的战鼓,1985-02-25,1985-02
张家口市春节群体活动丰富多采,1985-02-25,1985-02
环球汽车旅行摄影赛到达中国,1985-02-25,1985-02
香港足球队大胜文莱队,1985-02-25,1985-02
解放军体育学院举行定向运动赛引人注目,1985-02-25,1985-02
定向运动简介,1985-02-25,1985-02
汉川“万朵金花”离开锅台  搞商品生产  改革促妇女解放福州“一批包公”携卷出院  到基层办案  依法断经济纠纷（今日首都和各省市区报纸要目）,1985-02-25,1985-02
谈大陆经济改革对台湾的影响,1985-02-25,1985-02
吏治风纪江河日下,1985-02-25,1985-02
七名优秀运动员获奖,1985-02-25,1985-02
台湾的大专院校（一）,1985-02-25,1985-02
台湾外贸出口去年超过三百亿美元,1985-02-25,1985-02
莺哥镇和长福岩,1985-02-25,1985-02
大陆去台人员思乡情切菜馆标榜正宗以广招徕,1985-02-25,1985-02
“兵高参”助民致富记,1985-02-25,1985-02
孝感地区非党干部有职有权,1985-02-25,1985-02
带领低智残体人走致富之路,1985-02-25,1985-02
支援地方解决交通拥挤问题,1985-02-25,1985-02
江西积极开展拥军活动,1985-02-25,1985-02
何英会见理查德·阿克维,1985-02-25,1985-02
战士“小厨师”,1985-02-25,1985-02
中山市认真落实侨务政策,1985-02-25,1985-02
副区长带头赌博被撤职,1985-02-25,1985-02
光荣的职责  艰巨的任务,1985-02-25,1985-02
重要的岗位,1985-02-25,1985-02
队长诚心做检讨  犯人感动落下泪,1985-02-25,1985-02
来函照登,1985-02-25,1985-02
罪犯在服刑期间有无选举权,1985-02-25,1985-02
宣传政策解包袱,1985-02-25,1985-02
“浪子”变成致富人,1985-02-25,1985-02
犯人捐款修长城,1985-02-25,1985-02
监狱设立训练班,1985-02-25,1985-02
国际贸易工程学是一门新兴科学,1985-02-25,1985-02
加强消费科学的研究,1985-02-25,1985-02
中国商业经济学会第二届年会,1985-02-25,1985-02
破坏珍贵文物、名胜古迹罪（《中华人民共和国刑法》普及宣传讲话（９５））,1985-02-25,1985-02
《丛书集成初编》将重印补齐出版,1985-02-25,1985-02
书讯,1985-02-25,1985-02
西提会见西哈努克重申全力支持民柬,1985-02-25,1985-02
巴基斯坦举行军管后第一次大选,1985-02-25,1985-02
民柬兵分四路攻打腊塔纳基里省会,1985-02-25,1985-02
契尔年科近两个月首次露面,1985-02-25,1985-02
意法西德领导人为西葡加入欧洲共同体努力,1985-02-25,1985-02
黎巴嫩总统强调全国和解是唯一出路,1985-02-25,1985-02
美参议员要求里根停止援助尼反政府力量,1985-02-25,1985-02
美元比价过高不利于世界经济,1985-02-25,1985-02
黎巴嫩长枪党代表团访问叙利亚,1985-02-25,1985-02
尼日利亚同意巴解设立办事处,1985-02-25,1985-02
战后死于战争者知多少,1985-02-25,1985-02
以总理扬言要继续镇压黎南部人民,1985-02-25,1985-02
阿尔及利亚举办计划生育周,1985-02-25,1985-02
“中国人带走了我们的心”,1985-02-25,1985-02
朝鲜日本首家合营商店开业,1985-02-25,1985-02
国际简讯,1985-02-25,1985-02
无限珍惜我们的自由,1985-02-25,1985-02
敬仰和怀念,1985-02-25,1985-02
《小说月报》首届百花奖评选揭晓,1985-02-25,1985-02
文学的格调与情趣,1985-02-25,1985-02
潮流比传统更有力量,1985-02-25,1985-02
何必“循规蹈矩”？,1985-02-25,1985-02
《拂晓前的葬礼》［中篇小说］,1985-02-25,1985-02
《大林莽》［中篇小说］,1985-02-25,1985-02
《到森林去，到草原去，到黑龙江去》［诗歌专辑］,1985-02-25,1985-02
从吃饺子谈起,1985-02-25,1985-02
侨乡春,1985-02-25,1985-02
潘鹤的新作《开荒牛》,1985-02-25,1985-02
蹄雨,1985-02-25,1985-02
在“象园”里,1985-02-25,1985-02
母亲,1985-02-25,1985-02
