王泽普被免去厂长职务,1985-08-10,1985-08
“路标”,1985-08-10,1985-08
魏县贩卖淘汰药品案正在抓紧查处,1985-08-10,1985-08
挖塘、浚河、修堤、造林、筑路一次成功,1985-08-10,1985-08
江苏夏粮入库六十六亿斤 超过全省合同定购计划数,1985-08-10,1985-08
西藏经济开始突破封闭落后状况,1985-08-10,1985-08
值得一虑的１∶３,1985-08-10,1985-08
广州无羊城晚报社,1985-08-10,1985-08
“白天鹅”飞向世界,1985-08-10,1985-08
大陈岛上新园丁,1985-08-10,1985-08
有无瓜葛？,1985-08-10,1985-08
把触及面开拓得更广些,1985-08-10,1985-08
“后轮驱动”,1985-08-10,1985-08
藁城县积极发展农副产品加工业,1985-08-10,1985-08
为保鲜加工业的兴起欢呼,1985-08-10,1985-08
速热淋浴器漏毒  洗澡者中毒身亡,1985-08-10,1985-08
首都公共汽车为什么当长途车开？,1985-08-10,1985-08
将参加联合国工业发展组织大会第一届会议,1985-08-10,1985-08
兰州铁路局首次实现安全生产三百天,1985-08-10,1985-08
天津一批合资企业实现外汇平衡双方获利,1985-08-10,1985-08
中美合作生产的油田注汽锅炉通过鉴定,1985-08-10,1985-08
我国第一台移动式液压碎石机和高能液压碎石器制成,1985-08-10,1985-08
牡丹江第二发电厂全部投产,1985-08-10,1985-08
中原开发信托总公司成立,1985-08-10,1985-08
一棵树上结出五种果,1985-08-10,1985-08
也谈压缩行政事业经费开支问题,1985-08-10,1985-08
褚家庄靠“劳务输出”致富,1985-08-10,1985-08
“引进迷”黄阿头,1985-08-10,1985-08
科技要加快面向乡镇企业,1985-08-10,1985-08
一项成果实现经济效益五亿元,1985-08-10,1985-08
全国广告理论学术讨论会在安阳市召开,1985-08-10,1985-08
干旱地区自然资源开发和利用国际学术讨论会召开,1985-08-10,1985-08
中国新闻纪录电影展览周在长春开幕,1985-08-10,1985-08
各类教材由新华书店统一征订发行,1985-08-10,1985-08
天津市决定由乡政府直接领导农村教育工作,1985-08-10,1985-08
苏联作曲家肖斯塔科维奇逝世十周年纪念会在京举行,1985-08-10,1985-08
黄洋界上的“宝光”,1985-08-10,1985-08
乱涨物价  耍花招坑顾客骗国家  哈尔滨给屡教不改商店挂牌示众    滥发文凭  拿原则送人情谋私利  吉林省对新老违纪事件追究责任（今日首都和各省市区报纸要目）,1985-08-10,1985-08
柯达杯世界足球锦标赛进入尾声,1985-08-10,1985-08
青岛农民筹资举办足球赛,1985-08-10,1985-08
夫战，勇气也,1985-08-10,1985-08
增强为人民服务观念  改变不负责任作风,1985-08-10,1985-08
军工战线要在大局下加速改革,1985-08-10,1985-08
冰雹袭击之后,1985-08-10,1985-08
讨论经济体制改革等问题,1985-08-10,1985-08
太原市查处一起炒卖外汇案件,1985-08-10,1985-08
吴学谦同利比亚对外联络秘书举行会谈,1985-08-10,1985-08
林丽韫电唁郭雨新逝世,1985-08-10,1985-08
联合国副秘书长结束访华,1985-08-10,1985-08
吴学谦会见马达加斯加工程部长,1985-08-10,1985-08
中荷两国签订兽医检疫协议,1985-08-10,1985-08
戎马生涯六十春,1985-08-10,1985-08
测量大海,1985-08-10,1985-08
信念是生活的太阳,1985-08-10,1985-08
连队“小观天”,1985-08-10,1985-08
人民子弟兵,1985-08-10,1985-08
腾飞蓝天,1985-08-10,1985-08
我的科研成果为何得不到公正评价,1985-08-10,1985-08
加强市场物价管理,1985-08-10,1985-08
莫让科研成果变苦果,1985-08-10,1985-08
旅客乘民航班机前要办哪些手续？,1985-08-10,1985-08
简讯,1985-08-10,1985-08
简讯,1985-08-10,1985-08
简讯,1985-08-10,1985-08
简讯,1985-08-10,1985-08
邮件积压  贻误工作,1985-08-10,1985-08
一封不该退回的函件,1985-08-10,1985-08
伐乱垦触目惊心  生态平衡严重失调,1985-08-10,1985-08
坑人的自动助推器,1985-08-10,1985-08
珍贵花木耐冬树所剩无几,1985-08-10,1985-08
盛名之下,1985-08-10,1985-08
树立用户至上思想  切实抓好售后服务,1985-08-10,1985-08
要求全力防止核战争永远消除核武器,1985-08-10,1985-08
呼吁废除核武器为世界和平作贡献,1985-08-10,1985-08
南非黑人反对种族主义斗争蓬勃发展,1985-08-10,1985-08
阿拉伯首脑特别会议推迟闭幕,1985-08-10,1985-08
美国银行对南非投资减少,1985-08-10,1985-08
杰马耶勒访叙争取阿萨德支持,1985-08-10,1985-08
泰担心美国国会讨论限制纺织品进口法案,1985-08-10,1985-08
中罗签订经济技术合作委员会会议议定书,1985-08-10,1985-08
新西兰对华出口大幅度增加,1985-08-10,1985-08
玻利维亚外长接见我国特使,1985-08-10,1985-08
我国向扎伊尔赠送纸张,1985-08-10,1985-08
埃美联合军事演习结束,1985-08-10,1985-08
以色列轰炸巴勒斯坦人阵司令部,1985-08-10,1985-08
民柬部队击毁越军一列火车,1985-08-10,1985-08
《第二次世界大战中的德国》一书出版,1985-08-10,1985-08
国际要闻简报,1985-08-10,1985-08
西欧掀起反对南非种族主义的浪潮,1985-08-10,1985-08
中国改革明智已引起深刻变化,1985-08-10,1985-08
法国政府指派高级官员调查沉船事件,1985-08-10,1985-08
里根签署美国对外援助法案,1985-08-10,1985-08
引人关注的巴西外债谈判,1985-08-10,1985-08
应促使债权国和债务国对话解决外债问题,1985-08-10,1985-08
美国文盲知多少,1985-08-10,1985-08
英国广播电视记者罢工前后,1985-08-10,1985-08
甘当人梯的戏剧家,1985-08-10,1985-08
老兵的感谢与祝愿,1985-08-10,1985-08
练演捧,1985-08-10,1985-08
芭蕾艺术的新探索,1985-08-10,1985-08
“咽音”重放光彩,1985-08-10,1985-08
简讯,1985-08-10,1985-08
简讯,1985-08-10,1985-08
简讯,1985-08-10,1985-08
简讯,1985-08-10,1985-08
襄阳县砍掉靠农民摊派支撑的新机构,1985-08-11,1985-08
要把中医和西医摆在同等重要的地位,1985-08-11,1985-08
四川多渠道荐贤举能,1985-08-11,1985-08
他同西藏体育馆永存,1985-08-11,1985-08
个人去留交给组织安排一心一意带领部队施工,1985-08-11,1985-08
讲师团结束集训整装待发,1985-08-11,1985-08
让功,1985-08-11,1985-08
西藏选拔千余名小学生到１６个省市读书,1985-08-11,1985-08
“原则干部”小议,1985-08-11,1985-08
双方同意恢复两党关系和友好往来,1985-08-11,1985-08
我对外开放政策是经慎重考虑作出的决策,1985-08-11,1985-08
天津切实压缩地方基建投资,1985-08-11,1985-08
加强对外开放港口地区、旅游点和宾馆管理,1985-08-11,1985-08
森工企业应以营林为主,1985-08-11,1985-08
远近高低各不同,1985-08-11,1985-08
大寺上供销社倒闭的教训,1985-08-11,1985-08
大连发现进货破旧及时索赔,1985-08-11,1985-08
西部地区经济发展讨论会召开,1985-08-11,1985-08
谁之过,1985-08-11,1985-08
苏南新型农业的开端,1985-08-11,1985-08
为九十年代全面振兴中医奠定基础,1985-08-11,1985-08
天津市卫生局抓中西医结合二十九年坚持不懈硕果累累,1985-08-11,1985-08
他为大西北献出了一切（学习翁建才  替祖国分忧  为理想献身）,1985-08-11,1985-08
对大学生进行“四有”教育是当前迫切任务,1985-08-11,1985-08
拉萨地磁台获得国际性荣誉奖章,1985-08-11,1985-08
北京二十六中普及电子计算机知识,1985-08-11,1985-08
三千各族气象工作者为新疆建设建功立业,1985-08-11,1985-08
青年有理想  直追前辈  二百余毕业生去青海高原  大展宏图    巾帼多奇志  不让须眉  十四名女学员赴滇桂前线  报效国家（今日首都和各省市区报纸要目）,1985-08-11,1985-08
阿维兰热就柯达杯赛为本报题词,1985-08-11,1985-08
为中国足球事业进言,1985-08-11,1985-08
文明观众评选活动揭晓,1985-08-11,1985-08
本届柯达杯最佳阵容评出,1985-08-11,1985-08
河北老将刘殿中夺魁,1985-08-11,1985-08
第二届全国工运会定于９月７日开幕,1985-08-11,1985-08
在整党中实实在在地进行党性党纪教育,1985-08-11,1985-08
用行动增强群众的信心,1985-08-11,1985-08
西安破获一起冒充外商代表经营彩电诈骗案,1985-08-11,1985-08
各海事法院积极开展工作,1985-08-11,1985-08
莫取非法之财,1985-08-11,1985-08
毛里求斯议会代表团结束对中国的访问,1985-08-11,1985-08
泰国各党派议员代表团结束访华回国,1985-08-11,1985-08
林维先同志病逝,1985-08-11,1985-08
王任重会见美国众议院筹款委员会贸易小组委员会代表团,1985-08-11,1985-08
吴学谦宴请利比亚对外联络秘书,1985-08-11,1985-08
王震结束访日回到北京,1985-08-11,1985-08
党的工作者休假团回到北京,1985-08-11,1985-08
陈慕华回到北京,1985-08-11,1985-08
田纪云会见美国众议院筹款委员会贸易小组委员会代表团,1985-08-11,1985-08
吴学谦会见联合国副秘书长,1985-08-11,1985-08
张爱萍会见美国前国防部副部长科默,1985-08-11,1985-08
任建新会见比利时最高法院的院长,1985-08-11,1985-08
潜心编书献“余热”,1985-08-11,1985-08
勤奋的学者  忠诚的战士,1985-08-11,1985-08
《新中国电力工业发展史略》序,1985-08-11,1985-08
永远做有益于人民的人,1985-08-11,1985-08
呼吁加强团结解决面临的重大问题,1985-08-11,1985-08
寻求阿拉伯世界的团结,1985-08-11,1985-08
要求国际社会全力支持南部非洲妇女,1985-08-11,1985-08
南部非洲发展协调会议举行首脑会议,1985-08-11,1985-08
巴西断绝同南非一切贸易关系,1985-08-11,1985-08
《朝日新闻》透露日本首相将参拜靖国神社,1985-08-11,1985-08
墨西哥经济形势又趋严峻,1985-08-11,1985-08
日本对美贸易出超继续增加,1985-08-11,1985-08
制造假药坑害病人瑞士罪犯被判徒刑,1985-08-11,1985-08
国际要闻简报,1985-08-11,1985-08
“小白鸽”飞向玛塔,1985-08-11,1985-08
防止汽车相撞的雷达问世,1985-08-11,1985-08
广岛长崎的启迪,1985-08-11,1985-08
黄河女儿的心愿,1985-08-11,1985-08
电脑餐厅,1985-08-11,1985-08
佩鲁贾漫游,1985-08-11,1985-08
可口可乐与百事可乐的角斗,1985-08-11,1985-08
最古老的村落,1985-08-11,1985-08
冒牌货泛滥成灾,1985-08-11,1985-08
鱼跃鸥吟 海碧山青,1985-08-11,1985-08
大连速写,1985-08-11,1985-08
当代年轻知识分子的成长道路,1985-08-12,1985-08
培养“四有”新人是共青团工作出发点和落脚点,1985-08-12,1985-08
欢送讲师团大会在京举行,1985-08-12,1985-08
胸怀大志学创造争当共产主义新人,1985-08-12,1985-08
柯达杯足球赛圆满结束,1985-08-12,1985-08
他和顾客“吵”起来,1985-08-12,1985-08
把积累列入厂长任期目标（我说经济改革）,1985-08-12,1985-08
天津工业产品质量由下降转为上升,1985-08-12,1985-08
收到呼吁灭蚊信之后,1985-08-12,1985-08
小事不小,1985-08-12,1985-08
周到服务吸引储户,1985-08-12,1985-08
质量面前“六亲不认”,1985-08-12,1985-08
陕西农村积极抗旱保秋,1985-08-12,1985-08
吉林：范家屯粮库违章发运  敞车玉米惨遭雨浸北京：永定门粮库紧急抢救  日夜奋战减少损失,1985-08-12,1985-08
认真解决问题  保证安全生产,1985-08-12,1985-08
不当“钢霸”,1985-08-12,1985-08
葫芦岛不作“闷葫芦”,1985-08-12,1985-08
桂林蔬菜市场品种多质量好,1985-08-12,1985-08
玛沁县三分之一牧民定居轮牧,1985-08-12,1985-08
新疆个体工商户超过十四万,1985-08-12,1985-08
浙江发现方形树,1985-08-12,1985-08
也谈筷子问题,1985-08-12,1985-08
总书记为讲师团送行,1985-08-12,1985-08
祝贺柯达杯赛成功 （国内短评）,1985-08-12,1985-08
以大局为重  卸任干部在平凡岗位发光发热  武汉钢铁公司新风尚    对社会负责  承揽业务须着重考虑利国利民  平南县印刷厂有觉悟（今日首都和各省市区报纸要目）,1985-08-12,1985-08
世界性足球大赛桂冠首次被非洲劲旅摘取,1985-08-12,1985-08
举办柯达杯赛是个创举,1985-08-12,1985-08
增强信心再拚搏,1985-08-12,1985-08
国际足联十六岁以下世界锦标赛荣誉奖杯——吉拉迪杯,1985-08-12,1985-08
苏联波瓦尔尼岑跳过２米４０,1985-08-12,1985-08
一些大学教授公开指责“不接触”政策,1985-08-12,1985-08
检查癌症新酵素制成,1985-08-12,1985-08
传统服饰邮票在台发行,1985-08-12,1985-08
台湾服务业增长率将超过工农业,1985-08-12,1985-08
两项疫苗研究有进展,1985-08-12,1985-08
台湾女性婚姻态度有变化,1985-08-12,1985-08
台湾新建猿猴园,1985-08-12,1985-08
攀钢党委围绕生产和改革加强党风建设,1985-08-12,1985-08
新老干部要互相支持齐心协力搞好改革,1985-08-12,1985-08
珍惜荣誉  再立新功,1985-08-12,1985-08
“新四军茅山抗日斗争历史陈列馆”建成,1985-08-12,1985-08
唐县各界群众缅怀白求恩柯棣华,1985-08-12,1985-08
谷牧从日本回到北京,1985-08-12,1985-08
中国和利比亚签署文化合作协定,1985-08-12,1985-08
张猛先生在广州逝世,1985-08-12,1985-08
当干扰袭来之时,1985-08-12,1985-08
破阻力  排干扰,1985-08-12,1985-08
在关键时刻,1985-08-12,1985-08
深圳特区发展面临新的战略阶段,1985-08-12,1985-08
从几个专业合作组织看供销社的改革,1985-08-12,1985-08
注意发挥领导班子的整体功能,1985-08-12,1985-08
《外国美学》第一辑出版,1985-08-12,1985-08
民柬三方加强团结更沉重打击越军,1985-08-12,1985-08
西提说侵柬越军在雨季中被动挨打,1985-08-12,1985-08
卡萨布兰卡会议维护了阿拉伯团结,1985-08-12,1985-08
美国同南非举行秘密会谈,1985-08-12,1985-08
支持南非和纳米比亚妇女正义斗争,1985-08-12,1985-08
南非当局继续野蛮镇压和逮捕黑人,1985-08-12,1985-08
讨论世界经济发展前景及面临挑战,1985-08-12,1985-08
我国贸易代表团访问印尼,1985-08-12,1985-08
斯里兰卡政府军进入戒备状态,1985-08-12,1985-08
乌政变领导人奥凯洛任武装部队司令,1985-08-12,1985-08
乌干达释放一千多政治犯,1985-08-12,1985-08
美苏为最高级会谈进行初步安排,1985-08-12,1985-08
首届中美洲玉米节在洪都拉斯举行,1985-08-12,1985-08
国际要闻简报,1985-08-12,1985-08
里根为什么要发动“秋季攻势”？,1985-08-12,1985-08
论瞿秋白的杂文,1985-08-12,1985-08
关于探索“西部片”的异议,1985-08-12,1985-08
农村剧作的新成果,1985-08-12,1985-08
民族音乐建设的一项大工程,1985-08-12,1985-08
儿童文学理论研究规划会议召开,1985-08-12,1985-08
修一道理想的长城,1985-08-12,1985-08
心中的大佛,1985-08-12,1985-08
七律二首,1985-08-12,1985-08
带露的叫卖声（外一章）,1985-08-12,1985-08
石桥,1985-08-12,1985-08
《忆彭大将军》,1985-08-12,1985-08
“向上面交帐”,1985-08-12,1985-08
有感于名人落榜,1985-08-12,1985-08
生活在花丛中,1985-08-12,1985-08
瞻前顾后  统筹安排（社论）,1985-08-13,1985-08
江苏五十个县建立乡一级财政,1985-08-13,1985-08
我国中医事业得到较快恢复和发展,1985-08-13,1985-08
拉萨呈现一派节日欢乐景象,1985-08-13,1985-08
肖华同志逝世,1985-08-13,1985-08
李先念会见丁肇中,1985-08-13,1985-08
香港中华文化促进中心成立,1985-08-13,1985-08
赵总理电贺联合国工业发展组织大会第一届会议召开,1985-08-13,1985-08
看在孩子们的份上,1985-08-13,1985-08
棋声带来的感受,1985-08-13,1985-08
反法西斯东方战场的光辉篇章,1985-08-13,1985-08
整顿加强兽药管理  取缔假劣兽药,1985-08-13,1985-08
天津服务行业大量改行网点减少,1985-08-13,1985-08
我国建成管道输煤试验中心,1985-08-13,1985-08
雷家营村农协会实行有偿服务,1985-08-13,1985-08
有偿服务好,1985-08-13,1985-08
安徽生物药厂生产销售假劣兽药坑害农民,1985-08-13,1985-08
“洗手处”有感,1985-08-13,1985-08
彩色电视机供需矛盾可望缓和,1985-08-13,1985-08
急起直追的香港印刷业,1985-08-13,1985-08
谈供销社对农民股金的管理,1985-08-13,1985-08
日本ＴＤＫ北京事务所开业,1985-08-13,1985-08
经济信息网络报联合体在京成立,1985-08-13,1985-08
重庆节能见成效,1985-08-13,1985-08
江苏省水产生产出现好势头,1985-08-13,1985-08
广州个体户高德良入党,1985-08-13,1985-08
天山独库公路纪念碑落成,1985-08-13,1985-08
尊师蔚然成风  重教不尚空谈,1985-08-13,1985-08
贪官与假药,1985-08-13,1985-08
何必要等教师节那一天,1985-08-13,1985-08
中共晋江县委决定改组陈埭镇党委,1985-08-13,1985-08
内地和香港联合举行的“黄河音乐节”揭幕,1985-08-13,1985-08
金牛山人类化石科学鉴定会在北京大学举行,1985-08-13,1985-08
联合国教科文组织综合情报计划政府间 理事会会务局会议在北京举行,1985-08-13,1985-08
卢沟桥历史文物修复委员会在京成立,1985-08-13,1985-08
英文《中国日报》采用卫星传送版面新技术,1985-08-13,1985-08
西安交大姚熹教授的论文获美国陶瓷学会奖,1985-08-13,1985-08
《大众健康》杂志创刊,1985-08-13,1985-08
新格局从这里开创,1985-08-13,1985-08
中、美、古、捷、日等八支女篮会战辽河之滨,1985-08-13,1985-08
我航模选手破两项世界纪录,1985-08-13,1985-08
日本队３∶０胜香港队,1985-08-13,1985-08
中国大学生足球队胜中国青年队,1985-08-13,1985-08
“铁税官”拒绝贿赂执法如山  宜丰县税务干部有正气  亮节可贵    “地头蛇”自制镣铐横行乡里  小井乡主要领导已变质  国法难容（今日首都和各省市区报纸要目）,1985-08-13,1985-08
首都归侨抗日老战士祭奠抗日死难烈士,1985-08-13,1985-08
当年参加北平地区抗日斗争的老战士聚会,1985-08-13,1985-08
纪念红军长征“彝海结盟”五十周年,1985-08-13,1985-08
吴学谦会见美国常驻联合国代表,1985-08-13,1985-08
蒙古族革命英雄席尼喇嘛纪念塔在内蒙古重建落成,1985-08-13,1985-08
苏子蘅林盛中电唁郭雨新先生逝世,1985-08-13,1985-08
台湾爱国人士王万得病逝,1985-08-13,1985-08
深入进行党性教育  保证改革健康发展,1985-08-13,1985-08
党性教育要与推进改革结合起来（国内短评）,1985-08-13,1985-08
一年文件千万字  确系“文山” 读完要用百多天  如何得了,1985-08-13,1985-08
自主权和自觉性,1985-08-13,1985-08
突破“封锁线”,1985-08-13,1985-08
端正“检查”风,1985-08-13,1985-08
“老大”一抓就不难,1985-08-13,1985-08
半身不遂,1985-08-13,1985-08
一个纪律与制度管不到的死角,1985-08-13,1985-08
朝鲜四十年来社会主义建设取得巨大成就,1985-08-13,1985-08
南南科研合作之花,1985-08-13,1985-08
举行东盟首脑会议讨论加强经济合作问题,1985-08-13,1985-08
巴解主张召开巴勒斯坦问题国际会议,1985-08-13,1985-08
贝鲁特干戈再起,1985-08-13,1985-08
黎什叶派穆斯林绑架五十名基督教派人士,1985-08-13,1985-08
圭亚那为伯纳姆举行国葬,1985-08-13,1985-08
日航巨型客机失事,1985-08-13,1985-08
尼泊尔首相会见我国政协代表团,1985-08-13,1985-08
新西兰总理欢迎法国调查沉船事件,1985-08-13,1985-08
美碳化物公司又发生毒气外泄事故,1985-08-13,1985-08
国际要闻简报,1985-08-13,1985-08
同债权国谈判但不受国际组织摆布,1985-08-13,1985-08
古巴同西方银行谈判延期偿还贷款,1985-08-13,1985-08
戈尔巴乔夫强调不应背离莫斯科条约西德领导人表示愿扩大同苏联的关系,1985-08-13,1985-08
访丹麦风车园,1985-08-13,1985-08
联大主席谴责南非种族隔离政策,1985-08-13,1985-08
美参众两院通过下财政年度预算法案,1985-08-13,1985-08
尼克松耳后患皮癌,1985-08-13,1985-08
向着二○○○年,1985-08-13,1985-08
南非的种族隔离,1985-08-13,1985-08
敌与友  爱与憎,1985-08-13,1985-08
我爱《春天的笑声》,1985-08-13,1985-08
“假”的断想（大地漫笔）,1985-08-13,1985-08
画中八友歌,1985-08-13,1985-08
消除三十亿元财政赤字实现收支平衡,1985-08-14,1985-08
军事博物馆“抗日战争馆”开馆,1985-08-14,1985-08
北京举行学术报告会,1985-08-14,1985-08
从八月中旬至九月上旬我国将举行一系列活动,1985-08-14,1985-08
“红领巾谈判团”,1985-08-14,1985-08
坚持民主评议干部,1985-08-14,1985-08
喀什地区农民户均一亩多薪炭林,1985-08-14,1985-08
马钢高速线材轧机建设工程开工,1985-08-14,1985-08
摆谱,1985-08-14,1985-08
这样的“忘恩负义”好,1985-08-14,1985-08
北京的书市,1985-08-14,1985-08
多为军队和优抚对象办实事,1985-08-14,1985-08
“巧理千家菜  温暖万人心”,1985-08-14,1985-08
怎样医治“投资饥饿症”？,1985-08-14,1985-08
重视微观放活  加强宏观控制,1985-08-14,1985-08
提高质量  打开销路  力争多用,1985-08-14,1985-08
开发票岂能不讲原则,1985-08-14,1985-08
上半年我国水产品比去年同期增长８．３％,1985-08-14,1985-08
盐亭县经委负责人带头非法经商,1985-08-14,1985-08
平顶山化纤厂被责令停产整顿,1985-08-14,1985-08
编者按,1985-08-14,1985-08
电信通  客商来,1985-08-14,1985-08
经济特区开放城市机场建设进展迅速,1985-08-14,1985-08
烟台市为基础设施建设开绿灯,1985-08-14,1985-08
珠海特区加强能源交通建设,1985-08-14,1985-08
哈尔滨采取措施提高儿童食品质量,1985-08-14,1985-08
听从人民的呼唤,1985-08-14,1985-08
职业中学按职业教育规律办学,1985-08-14,1985-08
骆驼精神,1985-08-14,1985-08
汉语正走向世界,1985-08-14,1985-08
重视环境,1985-08-14,1985-08
试管人参一个月内可开花,1985-08-14,1985-08
察哈尔草原上的蒙古包医院,1985-08-14,1985-08
加纳艺术展览在京开幕,1985-08-14,1985-08
陕西将救活的大熊猫放回秦岭,1985-08-14,1985-08
全国民族语文翻译学术讨论会结束,1985-08-14,1985-08
中国记协将组织新闻记者团前往云南前线采访,1985-08-14,1985-08
产品获金奖  技术传给竞争对手  湖北客车厂该让坑人企业脸红    孕妇拦惊马  挺身救出遇险儿童  唐河女青年能叫自私行为愧死（今日首都和各省市区报纸要目）,1985-08-14,1985-08
中美捷古四队小组出线在望,1985-08-14,1985-08
鹿特丹喜讯频传  我选手连创佳绩,1985-08-14,1985-08
安艳凤在南斯拉夫国际象棋友谊对抗赛中获胜,1985-08-14,1985-08
全国体育发展战略讨论会在西宁开幕,1985-08-14,1985-08
古金水创近年来亚洲十项全能最好成绩,1985-08-14,1985-08
简讯,1985-08-14,1985-08
第二届中国足协杯赛分组确定,1985-08-14,1985-08
天津足球队在印尼独立杯赛中一胜一平,1985-08-14,1985-08
一次遇险与脱险的经过,1985-08-14,1985-08
全椒县委严肃处理以权谋私问题,1985-08-14,1985-08
哈尔滨天鹅饭店正副经理、总支书记等受到处分,1985-08-14,1985-08
姜国云、顾苏受到刑事处分,1985-08-14,1985-08
把血的历史铭刻在南京土地上,1985-08-14,1985-08
理查德·斯·安德里克犯有失火罪,1985-08-14,1985-08
“考考干部，对着哩！”,1985-08-14,1985-08
南斯拉夫“拉多”民间歌舞团在京演出,1985-08-14,1985-08
方毅分别会见丁肇中李远哲,1985-08-14,1985-08
周谷城会见民主也门—中国友好协会代表团,1985-08-14,1985-08
联合国副秘书长在京作裁军报告,1985-08-14,1985-08
畜牧兽医业情况令人担忧,1985-08-14,1985-08
面积大  长势好  品种多  质量高,1985-08-14,1985-08
“牛附红虫病”研究取得成果,1985-08-14,1985-08
太原北郊兽医院研制成兽用长臂连续注射器,1985-08-14,1985-08
报授农村大学受到农民欢迎,1985-08-14,1985-08
谁愿投资建虾场？,1985-08-14,1985-08
优良马新品种——“伊吾马”,1985-08-14,1985-08
由杜仲之死想到的,1985-08-14,1985-08
全国首届食品包装技术交流会十月在镇江市举行,1985-08-14,1985-08
凤凰牌健身车投放市?,1985-08-14,1985-08
“花玉石”健身球受欢迎,1985-08-14,1985-08
“仙鹤”牌健身宝剑,1985-08-14,1985-08
江西研制成功带电脑的电能表,1985-08-14,1985-08
《作物杂志》问世,1985-08-14,1985-08
抗议美国政府对南非的政策,1985-08-14,1985-08
民柬部队解放博胶县城,1985-08-14,1985-08
国务院门前的“葬礼”,1985-08-14,1985-08
沙特和约旦表示要使协调工作取得成果,1985-08-14,1985-08
贝鲁特难民营又发生武装冲突,1985-08-14,1985-08
朝将派特使参加联合国成立四十周年纪念大会,1985-08-14,1985-08
日航罹难客机乘客四人生还,1985-08-14,1985-08
美国贸易代表尤特抵日本访问,1985-08-14,1985-08
斯里兰卡政府与泰米尔人组织开始第二轮谈判,1985-08-14,1985-08
旅美台湾人士悼念郭雨新逝世,1985-08-14,1985-08
保加利亚人积极参加“认识祖国”活动,1985-08-14,1985-08
第二十八届国际民间歌舞节举行,1985-08-14,1985-08
国际要闻简报,1985-08-14,1985-08
巴基斯坦的电信事业,1985-08-14,1985-08
联合国工发组织大会举行首届会议,1985-08-14,1985-08
国际海底筹委会研讨开采海底资源规章制度,1985-08-14,1985-08
百余国代表讨论公正利用卫星轨道和频带,1985-08-14,1985-08
“尤里卡”与欧洲科技合作,1985-08-14,1985-08
民主德国的“青年工程”,1985-08-14,1985-08
苏建造原子供热站原子热电站,1985-08-14,1985-08
印最大核研究反应堆投入使用,1985-08-14,1985-08
美发现调节人生殖能力脑激素,1985-08-14,1985-08
澳大利亚科学家制成合成基因,1985-08-14,1985-08
比利时蔬菜“拍卖市场”见闻,1985-08-14,1985-08
《今日谈》的魅力,1985-08-14,1985-08
怀念台湾旧友林济,1985-08-14,1985-08
是郭诗还是柳诗？,1985-08-14,1985-08
