故土乡音,1985-08-14,1985-08
狼牙山,1985-08-14,1985-08
机械行业已能提供成套高水平石化设备,1985-08-15,1985-08
批准甘肃省委对有关人员的处分决定告诫领导干部把国家人民利益放首位,1985-08-15,1985-08
西吉防护林工程提前一年完成,1985-08-15,1985-08
马耳他总统西班牙首相将访华,1985-08-15,1985-08
讲师团首批成员赴陕西,1985-08-15,1985-08
纪念碑下藏汉情,1985-08-15,1985-08
纪念抗日战争和世界反法西斯战争胜利四十周年展览在京开幕,1985-08-15,1985-08
能上能下,1985-08-15,1985-08
湖州５８家小型企业上交利税大增,1985-08-15,1985-08
象北京大学那样,1985-08-15,1985-08
监督权  要落实,1985-08-15,1985-08
绿荫树下编织忙,1985-08-15,1985-08
灵活经营  方便群众  薄利多销,1985-08-15,1985-08
我国编出一个农业投入产出表,1985-08-15,1985-08
一项重要的基础工作（国内短评）,1985-08-15,1985-08
渠道求多  服务求好,1985-08-15,1985-08
我国对外承包和劳务合作取得进展,1985-08-15,1985-08
王恩茂等边陲优秀儿女获奖章,1985-08-15,1985-08
吴川农民合作企业走向专业协作,1985-08-15,1985-08
不能拎着菜篮管市场,1985-08-15,1985-08
黑龙江省建牛奶联合生产基地,1985-08-15,1985-08
阜阳地区农机畅销,1985-08-15,1985-08
玲珑镇年采万两金,1985-08-15,1985-08
汪上畈农民挑河砂致富,1985-08-15,1985-08
“沙家浜”有了个体客轮,1985-08-15,1985-08
朱里乡粮食购销专业户多,1985-08-15,1985-08
班长友和地龙酒,1985-08-15,1985-08
汕头特区稳步发展,1985-08-15,1985-08
事故在向我们敲警钟,1985-08-15,1985-08
抗日名将吉鸿昌创办的学校为革命和建设培养大批人才,1985-08-15,1985-08
百里矿区  五千名青年送温暖  好事做遍石炭井    一项工程  十一家企业治污染  清水流在白银市（今日首都和各省市区报纸要目）,1985-08-15,1985-08
全国中药资源普查工作初步展开,1985-08-15,1985-08
为抗灾保丰收出谋划策,1985-08-15,1985-08
内地十所大学帮助新疆培养建设人才,1985-08-15,1985-08
比赛异常激烈  比分相差无几,1985-08-15,1985-08
我国伤残人运动员连超世界纪录和全国纪录,1985-08-15,1985-08
天津足球队获印尼独立杯赛小组第一名,1985-08-15,1985-08
中国两名记者骑车登程环游世界,1985-08-15,1985-08
中国青年足球队点将台,1985-08-15,1985-08
饮水思源念亲人,1985-08-15,1985-08
金珠玛米帮我解忧致富,1985-08-15,1985-08
藏族谚语,1985-08-15,1985-08
披“查尔瓦”的阿足足妈妈,1985-08-15,1985-08
要象“老进疆”那样帮助少数民族（国内短评）,1985-08-15,1985-08
谢晋元和八百抗日壮士,1985-08-15,1985-08
谢晋元塑像在上海奠基,1985-08-15,1985-08
上海纪念“八·一三”淞沪抗战四十八周年,1985-08-15,1985-08
漫谈严格训练,1985-08-15,1985-08
中曾根首相等参拜靖国神社会损害世界各国人民的感情,1985-08-15,1985-08
学点“防身术”,1985-08-15,1985-08
胸怀大局  支持部队各项改革,1985-08-15,1985-08
颜德明在广州病逝,1985-08-15,1985-08
扎伊尔和喀麦隆新大使向李先念递交国书,1985-08-15,1985-08
中国共产党友好代表团离京赴拉美四国访问,1985-08-15,1985-08
北京穆斯林朝觐团离京前往麦加,1985-08-15,1985-08
罗干会见尼日尔工人工会联合会代表团,1985-08-15,1985-08
梁家当选为云南省政协主席,1985-08-15,1985-08
郝建秀会见台湾青年,1985-08-15,1985-08
伊犁哈萨克自治州党政领导干部深入基层解决具体问题,1985-08-15,1985-08
葛洲坝使中华鲟因祸得福,1985-08-15,1985-08
学习领导的科学,1985-08-15,1985-08
大视野,1985-08-15,1985-08
西部开发的关键在人才,1985-08-15,1985-08
经济发展战略简介,1985-08-15,1985-08
赤眼蜂在哈萨克斯坦棉田“登陆”,1985-08-15,1985-08
南非黑人群众斗争愈演愈烈,1985-08-15,1985-08
纽约万余人示威反对南非种族隔离制度,1985-08-15,1985-08
朝鲜解放四十年,1985-08-15,1985-08
美官员反对对纺织品进口实行贸易保护主义,1985-08-15,1985-08
美贸易代表结束对日本访问,1985-08-15,1985-08
弹劾马科斯总统的动议被否决,1985-08-15,1985-08
墨菲同侯赛因磋商美约巴会谈问题,1985-08-15,1985-08
日宣布中曾根首相正式参拜靖国神社,1985-08-15,1985-08
乌干达当局未能与游击队领导人如期会谈,1985-08-15,1985-08
日航客机可能因尾翼发生故障坠毁,1985-08-15,1985-08
国际要闻简报,1985-08-15,1985-08
美国今秋农作物将获丰收,1985-08-15,1985-08
巴西总统不顾庄园主反对坚持土改,1985-08-15,1985-08
新加坡第二季度经济出现负增长,1985-08-15,1985-08
尽力避免重复统计,1985-08-15,1985-08
这家工厂的厂长为何要辞职？,1985-08-15,1985-08
加强环保法制教育，刻不容缓！,1985-08-15,1985-08
有害气体和噪音包围了我们,1985-08-15,1985-08
我们在浓烟和轰鸣声中上课,1985-08-15,1985-08
希望制药厂家生产半斤装注射液,1985-08-15,1985-08
他为群众的健康负责,1985-08-15,1985-08
长江第三大桥上的公路亟需养护,1985-08-15,1985-08
让我们集中精力做好乘务工作,1985-08-15,1985-08
“热得快”其实坏得快,1985-08-15,1985-08
竣工两年的住宅楼为啥住不进人？,1985-08-15,1985-08
新官“忘恩”好,1985-08-15,1985-08
金河的鞭炮,1985-08-15,1985-08
他乡遇故知,1985-08-15,1985-08
琴韵,1985-08-15,1985-08
加邦信仰的幻灭,1985-08-15,1985-08
漓江鸡冠山,1985-08-15,1985-08
山西境内“绿色万里长城”初具规模,1985-08-16,1985-08
要努力学习马克思主义的基本理论,1985-08-16,1985-08
上海各界说华怡学华怡,1985-08-16,1985-08
江西省积极清理销毁伪劣药品商品中纪委要求各地抓紧查处这类案件,1985-08-16,1985-08
滑坡报警人,1985-08-16,1985-08
李先念会见格兰特感谢联合国儿童基金会对中国的帮助,1985-08-16,1985-08
党风正厂风好  生产连续增长,1985-08-16,1985-08
深圳兴建深水港,1985-08-16,1985-08
抓党风要落实责任（国内短评）,1985-08-16,1985-08
天津万门市内电话千门长途电话程控机开通,1985-08-16,1985-08
办报要办到群众心坎上,1985-08-16,1985-08
浙江沿海农村商品生产发展快,1985-08-16,1985-08
太平镇农经组织积极为农民提供服务,1985-08-16,1985-08
乱摊派的要害是执法不严,1985-08-16,1985-08
沪川辽黑闽黔决定学习马胜利,1985-08-16,1985-08
学习辛福强全心全意为人民服务,1985-08-16,1985-08
河北省外贸规模不断扩大,1985-08-16,1985-08
北京大力发展淡水鱼生产,1985-08-16,1985-08
张家口地区池塘养鱼九千三百亩,1985-08-16,1985-08
检查何必先通知,1985-08-16,1985-08
小“窗口”观察大天地,1985-08-16,1985-08
目标：货主满意,1985-08-16,1985-08
舟洋渔业合营公司成立,1985-08-16,1985-08
我向联邦德国进口焊管设备,1985-08-16,1985-08
喇嘛湾黄河公路大桥建成,1985-08-16,1985-08
奉献，直到最后一息,1985-08-16,1985-08
拉萨剧院和西藏自治区群艺馆交付使用,1985-08-16,1985-08
不要忘记艰苦创业的光荣传统,1985-08-16,1985-08
著名专家、学者和社会活动家卢于道追悼会在上海举行,1985-08-16,1985-08
木秀于林遭风摧  娄底市领导主持正义  让优秀青年厂长复职    水淹之际有车来  丹东专业户不要报酬  救受灾被困群众脱险（今日首都和各省市区报纸要目）,1985-08-16,1985-08
贵州省发起国画义卖活动赞助修长城,1985-08-16,1985-08
“中国国际儿童文化艺术服务中心”成立,1985-08-16,1985-08
日本北九州市少年交响乐团在京演出,1985-08-16,1985-08
中美两队将争夺“辽宁日报杯”,1985-08-16,1985-08
美国女篮为何进步神速,1985-08-16,1985-08
王大力何润华奋力竞游破一项游泳全国纪录,1985-08-16,1985-08
可口可乐公司为中国青年队饯行,1985-08-16,1985-08
抗战史上威武雄壮的一幕（纪念抗日战争世界反法西斯战争胜利四十周年）,1985-08-16,1985-08
赞扬恢复国民党抗日将领的历史地位,1985-08-16,1985-08
重点在哪里？,1985-08-16,1985-08
中央和国家机关法制宣传员培训班在京开学,1985-08-16,1985-08
中英土地委员会在香港举行第三次会议,1985-08-16,1985-08
王震会见香港合和实业有限公司代表团,1985-08-16,1985-08
邹瑜说：中国将参与联合国有关预防犯罪方面的活动,1985-08-16,1985-08
联合国文官制度改革研讨会在京召开,1985-08-16,1985-08
叶飞会见埃及商界人士,1985-08-16,1985-08
中国穆斯林朝觐团离京赴麦加,1985-08-16,1985-08
荣毅仁会见美国著名专栏作家,1985-08-16,1985-08
苏联工会代表团在华访问,1985-08-16,1985-08
刘俊秀遗体告别仪式在南昌举行,1985-08-16,1985-08
工作方式改革刍议,1985-08-16,1985-08
淞沪会战,1985-08-16,1985-08
行政管理体制应当改革,1985-08-16,1985-08
《辩证法史话》读后,1985-08-16,1985-08
简讯,1985-08-16,1985-08
金日成举行宴会庆祝朝鲜解放四十周年,1985-08-16,1985-08
联合国从同南非有关系的西方公司抽回投资,1985-08-16,1985-08
希望国际社会支持民柬在联合国席位,1985-08-16,1985-08
金边士兵发生多起反水事件,1985-08-16,1985-08
巴总理表示愿同所有邻国发展友好关系,1985-08-16,1985-08
泰、马和印尼代表访问西非,1985-08-16,1985-08
印度设特别法庭打击偷税漏税,1985-08-16,1985-08
日本首相会见即将离任的我大使,1985-08-16,1985-08
我大使向缅甸总统递交国书,1985-08-16,1985-08
中曾根及其阁僚正式参拜靖国神社日在野党和群众团体表示强烈反对,1985-08-16,1985-08
我国同伊拉克签署水利工程合同,1985-08-16,1985-08
东京的八·一五,1985-08-16,1985-08
《中国之夜》受到美国观众欢迎,1985-08-16,1985-08
国际要闻简报,1985-08-16,1985-08
防止核战争必须从消除核武器着手,1985-08-16,1985-08
世界人民渴望和平,1985-08-16,1985-08
戈尔巴乔夫再次呼吁美国响应冻结核试验美认为苏处于核优势才提出暂停试验建议,1985-08-16,1985-08
东西方冲突是美苏争夺的表现,1985-08-16,1985-08
刚果总统荣获国际墨丘利和平金奖,1985-08-16,1985-08
美国连续发生有毒化学品外泄事故,1985-08-16,1985-08
罗马尼亚进入世界十大商船国,1985-08-16,1985-08
日本三光汽船公司因负巨债破产,1985-08-16,1985-08
苏联南极考察船被冰块夹住四个月后获救,1985-08-16,1985-08
居世界第一的美国广告业,1985-08-16,1985-08
中华航天人〔报告文学〕,1985-08-16,1985-08
中和平、事业,1985-08-16,1985-08
援藏四十项重点工程速度快质量高,1985-08-17,1985-08
厂长决策多听职工意见,1985-08-17,1985-08
加工一千万担储备棉以优质优价供应市场,1985-08-17,1985-08
正确估计农民的富裕程度（本报评论）,1985-08-17,1985-08
说实话办实事讲实效为四化建功立业,1985-08-17,1985-08
农业银行调整资金供应办法,1985-08-17,1985-08
已有一百多万老干部离休 大批新干部走上领导岗位,1985-08-17,1985-08
小迟又哭了,1985-08-17,1985-08
山西办起３２９所小型专科医院,1985-08-17,1985-08
莫把“温饱”当“小康”,1985-08-17,1985-08
新的“富有”观,1985-08-17,1985-08
有趣的数学课,1985-08-17,1985-08
国有森林过伐问题严重林业企业应以营林为主,1985-08-17,1985-08
云南省经委限期恢复逾期取消优质称号,1985-08-17,1985-08
从茨榆坨集市看农村富裕之路,1985-08-17,1985-08
武钢实行“一条龙”质量管理成效显著,1985-08-17,1985-08
都用外文标号就好吗？,1985-08-17,1985-08
帮助“失败户”重整旗鼓,1985-08-17,1985-08
要想富  快修路,1985-08-17,1985-08
决定七家企业停止生产电视机,1985-08-17,1985-08
大中型联合企业应建立人才库,1985-08-17,1985-08
青藏公路改建主体工程提前竣工,1985-08-17,1985-08
一百二十六项林业科研成果获林业部奖励,1985-08-17,1985-08
一百二十六项林业科研成果获林业部奖励,1985-08-17,1985-08
秦皇岛煤码头三期工程进行国际招标,1985-08-17,1985-08
做有远见的理财家,1985-08-17,1985-08
陕西查处宝鸡制药厂参与制造假药问题,1985-08-17,1985-08
把算盘打活,1985-08-17,1985-08
为孩子们办点好事，图个啥？,1985-08-17,1985-08
一批反映抗日战争和世界反法西斯战争的影片近期内将在全国陆续上映,1985-08-17,1985-08
第二届中美少年儿童联谊画展在北京开幕,1985-08-17,1985-08
中国专利局将在九月份公布第一批专利申请,1985-08-17,1985-08
中国科学院专利事务所开业典礼在北京举行,1985-08-17,1985-08
画家潘絜兹从艺五十周年回顾展在京开幕,1985-08-17,1985-08
献身山区  育满园桃李遍地栋梁  上峁村齐夸民办教师功劳大    卫国从军  让全家老幼尽走富路  淮安县指导军属致富办法好（今日首都和各省市区报纸要目）,1985-08-17,1985-08
中国女篮力挫美国劲旅,1985-08-17,1985-08
新阵容的长与短,1985-08-17,1985-08
四川严红打破女子二百米自由泳全国纪录,1985-08-17,1985-08
沈坚强陈勤破两项游泳全国纪录,1985-08-17,1985-08
中国大学生足球队阵容,1985-08-17,1985-08
大学生运动会足球赛抽签揭晓,1985-08-17,1985-08
大树的怀念,1985-08-17,1985-08
在党和人民的关怀下成长,1985-08-17,1985-08
饶舌癖和嫉妒病,1985-08-17,1985-08
南京大屠杀遇难同胞纪念馆揭幕,1985-08-17,1985-08
辽宁召开纪念抗日战争胜利四十周年座谈会,1985-08-17,1985-08
八路军驻洛阳办事处旧址辟为纪念馆,1985-08-17,1985-08
《大青山抗日斗争史》一书即将出版,1985-08-17,1985-08
宋任穷接见青年思想政治工作先进集体代表和先进个人,1985-08-17,1985-08
李桂英当选为云南省人大常委会主任和志强任云南省省长,1985-08-17,1985-08
侵华日军七三一细菌部队遗址开放,1985-08-17,1985-08
方毅谷牧等会见海外台湾学者,1985-08-17,1985-08
中英土地委员会第三次会议在香港结束,1985-08-17,1985-08
五百名朝鲜青年即将来华与我国青年举行友好联欢活动,1985-08-17,1985-08
严济慈会见联合国教科文组织官员,1985-08-17,1985-08
痛悼肖华同志,1985-08-17,1985-08
王震会见冈崎嘉平太,1985-08-17,1985-08
方桥镇制订赡养老人规定见实效,1985-08-17,1985-08
漏税的专业户应该自觉补税,1985-08-17,1985-08
汉川熊家信主动补交税款万元,1985-08-17,1985-08
海南大案中工商局的问题应予查究,1985-08-17,1985-08
靠卖土地发财是自毁生路,1985-08-17,1985-08
不应荒芜耕地,1985-08-17,1985-08
坑害儿童  天理不容,1985-08-17,1985-08
杭州塑料厂有令不行有禁不止,1985-08-17,1985-08
毒气噪音扰民,1985-08-17,1985-08
为了姐妹们共同富裕,1985-08-17,1985-08
努力完善措施  保护重点文物,1985-08-17,1985-08
与人？便,1985-08-17,1985-08
公安局两次清理锦西城赌博绝迹,1985-08-17,1985-08
我国五大银行的职能有何不同？,1985-08-17,1985-08
南非“改革”是假  扩大镇压是实,1985-08-17,1985-08
阿富汗游击队打击苏联和卡尔迈勒军队,1985-08-17,1985-08
谴责南非继续非法占领纳米比亚,1985-08-17,1985-08
姆维尼当选为坦桑尼亚下届总统唯一候选人,1985-08-17,1985-08
墨菲同以色列领导人会谈,1985-08-17,1985-08
拉·甘地宣布已就阿萨姆邦问题达成协议,1985-08-17,1985-08
布什出席纪念反法西斯战争胜利仪式,1985-08-17,1985-08
一所不平凡的学府,1985-08-17,1985-08
两伊在中部战线激战,1985-08-17,1985-08
东南亚电脑展览会在新加坡举行,1985-08-17,1985-08
法国下令通缉沉船事件嫌疑犯,1985-08-17,1985-08
我国在墨西哥的蒂华纳设立总领事馆,1985-08-17,1985-08
国际要闻简报,1985-08-17,1985-08
南斯拉夫建立新的银行信贷制度,1985-08-17,1985-08
美国经济形势及其展望,1985-08-17,1985-08
主张加强经援使中美洲摆脱东西方冲突,1985-08-17,1985-08
蒙古上半年经济计划基本完成,1985-08-17,1985-08
波兰国营农场经营效益不断提高,1985-08-17,1985-08
敦促尼哥直接对话解决边境冲突,1985-08-17,1985-08
全世界机器人约有十万台,1985-08-17,1985-08
美一些经济学家说美国经济又有回升,1985-08-17,1985-08
美国第二季度贸易逆差创纪录增高,1985-08-17,1985-08
时代的响亮回声,1985-08-17,1985-08
纪念抗战胜利上映三部新故事片,1985-08-17,1985-08
中朝青年友谊之歌,1985-08-17,1985-08
一股清新的溪流,1985-08-17,1985-08
丹青漫写夕照明,1985-08-17,1985-08
杨成武回忆录《敌后抗战》出版,1985-08-17,1985-08
简讯,1985-08-17,1985-08
简讯,1985-08-17,1985-08
简讯,1985-08-17,1985-08
简讯,1985-08-17,1985-08
胡耀邦同志考察访问天山南北同新疆各族群众共商致富大计,1985-08-18,1985-08
以名牌产品为“龙头”组织协作发展生产,1985-08-18,1985-08
小饭馆的规定,1985-08-18,1985-08
各类劳动服务公司从业人员超过五百万,1985-08-18,1985-08
辽宁省直机关下决心压缩编制年内裁减一千四百多工作人员,1985-08-18,1985-08
加强团结多协商  精简整编得顺利,1985-08-18,1985-08
云南边防英模向首都三家新闻单位作报告,1985-08-18,1985-08
对“另一种对策”的分析,1985-08-18,1985-08
任何时候都要严肃执行政策是第一条,1985-08-18,1985-08
种草种树  发展畜牧  促进农副,1985-08-18,1985-08
天津广开货源多创外汇,1985-08-18,1985-08
地下水并非取之不尽,1985-08-18,1985-08
开化县领导积极抓出口,1985-08-18,1985-08
上海文体进出口分公司创汇多,1985-08-18,1985-08
为何如此胆大妄为？,1985-08-18,1985-08
梧州地区外贸办事处乱发奖金,1985-08-18,1985-08
贱草何以尊为首,1985-08-18,1985-08
黄河故道花果飘香,1985-08-18,1985-08
西藏首次栽培葡萄成功,1985-08-18,1985-08
牧民皮先种草养畜成了富裕户,1985-08-18,1985-08
大港油田原油日产突破万吨,1985-08-18,1985-08
作息要便民,1985-08-18,1985-08
中国环境保护公司成立,1985-08-18,1985-08
在世界屋脊航线上,1985-08-18,1985-08
改革人事制度应利于出人才,1985-08-18,1985-08
靠自己努力创名牌保名牌,1985-08-18,1985-08
食品卫生工作要为保护人民健康服务,1985-08-18,1985-08
经济科学的首要任务是为四化建设服务,1985-08-18,1985-08
我国生物技术的发展重点是产业化,1985-08-18,1985-08
国家科委召开会议推广分选物质新技术——重液变温法,1985-08-18,1985-08
大学里何必搞课间加餐,1985-08-18,1985-08
电视剧《四世同堂》成功之处何在,1985-08-18,1985-08
神农架自然保护区对金丝猴展开系统研究,1985-08-18,1985-08
有差错必改  不因年深日久马虎  福建众侨眷领回土改错收房产    遇好处先让  莫占近水楼台便宜  上海一厂长让出到手工资住宅（今日首都和各省市区报纸要目）,1985-08-18,1985-08
进军莫斯科征程展望,1985-08-18,1985-08
我泳将又创两项全国纪录,1985-08-18,1985-08
简讯,1985-08-18,1985-08
中国登山祝贺团离京赴日,1985-08-18,1985-08
佛山市盛装迎客  世乒赛开幕在即,1985-08-18,1985-08
为做好秘书工作说几句话,1985-08-18,1985-08
乌咀乡党委认真清理农民党员档案,1985-08-18,1985-08
自觉纠正不正之风,1985-08-18,1985-08
葡萄牙和黎巴嫩新大使分别向李主席递交国书,1985-08-18,1985-08
黄华和加拿大议员团会谈,1985-08-18,1985-08
郝建秀会见几内亚比绍全国工联代表团,1985-08-18,1985-08
挽肖华,1985-08-18,1985-08
忠义之志  壮烈之气,1985-08-18,1985-08
教师要为学生树立榜样（在教师这个光荣的岗位上）,1985-08-18,1985-08
我的欣慰（在教师这个光荣的岗位上）,1985-08-18,1985-08
滕老师的题字（在教师这个光荣的岗位上）,1985-08-18,1985-08
小学教师的心愿（在教师这个光荣的岗位上）,1985-08-18,1985-08
青年教师的荣幸（在教师这个光荣的岗位上）,1985-08-18,1985-08
农学博士的导师（在教师这个光荣的岗位上）,1985-08-18,1985-08
博塔的花招 （国际短评）,1985-08-18,1985-08
决心加强武装斗争反对种族主义政权,1985-08-18,1985-08
人心思和,1985-08-18,1985-08
南非黑人为正义与和平进行的斗争必胜,1985-08-18,1985-08
许多国家谴责南非坚持种族隔离制度,1985-08-18,1985-08
尼泊尔国王比兰德拉会见我政协代表团,1985-08-18,1985-08
债权国应与债务国共寻解决债务问题途径,1985-08-18,1985-08
华人对美国社会的发展贡献巨大不容抹煞纽约数百人愤怒抗议辱华影片《龙年》公映,1985-08-18,1985-08
莫桑比克总统接见我大使,1985-08-18,1985-08
美政府发言人对博塔讲话表示失望但仍要同南非实行“建设性接触”,1985-08-18,1985-08
印度博帕尔农药厂被迫关闭,1985-08-18,1985-08
世界上接受心脏移植年龄最小的人,1985-08-18,1985-08
国际要闻简报,1985-08-18,1985-08
访希腊的“老人中心”,1985-08-18,1985-08
友谊美如荷花,1985-08-18,1985-08
平壤公园一瞥,1985-08-18,1985-08
“我们是世界！”,1985-08-18,1985-08
西非艺术之花,1985-08-18,1985-08
“和平”月季,1985-08-18,1985-08
法兰西喜剧院,1985-08-18,1985-08
汽车，惊人的另一面,1985-08-18,1985-08
意大利古董失窃多,1985-08-18,1985-08
昔日天灾人祸  今日欣欣向荣,1985-08-18,1985-08
江苏省调整农村产业结构保证人均占有粮食一千斤,1985-08-19,1985-08
简政放权非抓落实不可,1985-08-19,1985-08
秦皇岛港吞吐量连创纪录  出现不压港不压船好局面,1985-08-19,1985-08
澳大利亚总督斯蒂芬到京,1985-08-19,1985-08
“三不卖”,1985-08-19,1985-08
作个一般号召不如办成一件实事,1985-08-19,1985-08
吉林连降暴雨三十八个县市遭灾  全省人民奋力抗洪抢险抗灾自救,1985-08-19,1985-08
严格限制厂级干部晋级面,1985-08-19,1985-08
教学楼拔地而起  宿舍楼加紧施工,1985-08-19,1985-08
坦桑尼亚总统尼雷尔,1985-08-19,1985-08
张录贪污巨款被开除党籍逮捕法办,1985-08-19,1985-08
江西冷水坑发现大银矿地质远景储量国内第一,1985-08-19,1985-08
我国大牲畜已达上亿头  猪羊头数逾四亿五千万,1985-08-19,1985-08
加强肉类检疫  保障人民健康,1985-08-19,1985-08
整人者，住手！,1985-08-19,1985-08
小吃店为啥被吃垮？,1985-08-19,1985-08
新化“一支笔”,1985-08-19,1985-08
矿产资源要坚持开发与保护并重的原则,1985-08-19,1985-08
依靠农民力量改造新建小场镇,1985-08-19,1985-08
做好收购工作  加强计划管理,1985-08-19,1985-08
二轻企业缺少原料生产吃紧,1985-08-19,1985-08
开辟水上航线  减轻铁路压力,1985-08-19,1985-08
靠农民建集镇,1985-08-19,1985-08
用加强宏观管理办法解决新问题,1985-08-19,1985-08
“水上货郎”,1985-08-19,1985-08
长岛县渔民兴起养貂业,1985-08-19,1985-08
菲利浦电子测试仪器在京展销,1985-08-19,1985-08
宜春第一机械厂充满生机,1985-08-19,1985-08
陈李乡合理调整种植业结构,1985-08-19,1985-08
顾客也要尊重售货员,1985-08-19,1985-08
税、费不是一回事,1985-08-19,1985-08
贝汉廷骨灰安放仪式在沪举行,1985-08-19,1985-08
为农村商品生产提供科技服务,1985-08-19,1985-08
东北地区生态建设战略学术讨论会在大连召开,1985-08-19,1985-08
以汉语会友,1985-08-19,1985-08
大连两中学保送大学生弄虚作假,1985-08-19,1985-08
遗嘱家人须爱国  乐昌一农村党员正气干云    糟蹋公物同儿戏  义县两粮库干部郎当入狱（今日首都和各省市区报纸要目）,1985-08-19,1985-08
强将云集  群星争辉,1985-08-19,1985-08
立足于学习、锻炼和提高,1985-08-19,1985-08
黄晓敏刷新女子２００米蛙泳全国纪录,1985-08-19,1985-08
美国游泳选手劈波斩浪破一项世界纪录,1985-08-19,1985-08
世界大学生运动会会徽,1985-08-19,1985-08
几起引起台湾民众非议的进口丑闻,1985-08-19,1985-08
台湾制成床边监视器,1985-08-19,1985-08
“财政部长”陆润康去职,1985-08-19,1985-08
慢性精神病患者死亡率高,1985-08-19,1985-08
花莲山胞学普通话,1985-08-19,1985-08
无限乡情入画来,1985-08-19,1985-08
全民抗战  胜在团结,1985-08-19,1985-08
纪念越南八月革命胜利四十周年,1985-08-19,1985-08
谷牧会见胡应湘,1985-08-19,1985-08
黄华宴请加拿大议员团,1985-08-19,1985-08
王震会见日本电子工业访华团,1985-08-19,1985-08
郝建秀会见马达加斯加革命工人工会代表团,1985-08-19,1985-08
如此“瑶池圣地”,1985-08-19,1985-08
“药王先师”害人记,1985-08-19,1985-08
我求“神医”的悲剧,1985-08-19,1985-08
迷信儿残害母亲,1985-08-19,1985-08
“和尚庙”里抓罪犯,1985-08-19,1985-08
“二郎神”的伎俩,1985-08-19,1985-08
制止封建迷信活动,1985-08-19,1985-08
技术改造必须依靠科学技术进步,1985-08-19,1985-08
马克思主义经济学是开放型的科学,1985-08-19,1985-08
修地方志必须坚持实事求是,1985-08-19,1985-08
适应改革形势  搞好企业管理,1985-08-19,1985-08
东西联合是东西部共同富裕之路,1985-08-19,1985-08
坦桑重申支持纳米比亚人民斗争,1985-08-19,1985-08
民柬电台赞扬东盟维护民柬联合国合法席位,1985-08-19,1985-08
军备竞赛是破坏各地区稳定的因素,1985-08-19,1985-08
墨菲访问埃及后又同约旦首相会谈,1985-08-19,1985-08
哈梅内伊将连任伊朗总统,1985-08-19,1985-08
尼雷尔总统启程来我国访问,1985-08-19,1985-08
在尼雷尔总统的家乡,1985-08-19,1985-08
越老和柬伪会议再次拒绝东盟建议,1985-08-19,1985-08
