哥伦比亚建立特别经济区,1985-08-19,1985-08
日客机坠毁是因隔板破裂使尾翼解体,1985-08-19,1985-08
白宫不满苏在美报刊登广告作宣传,1985-08-19,1985-08
我政协代表团结束访尼回国,1985-08-19,1985-08
我大使向埃及总统递交赵总理信件,1985-08-19,1985-08
卡塔赫纳被宣布为人类文化财富,1985-08-19,1985-08
国际要闻简报,1985-08-19,1985-08
对当前话剧创作的思考,1985-08-19,1985-08
血泪凝结的慨叹,1985-08-19,1985-08
毕生唯奋斗,1985-08-19,1985-08
中国西部文艺研讨会在新疆伊宁召开,1985-08-19,1985-08
修饰语的贬值,1985-08-19,1985-08
悼肖华同志,1985-08-19,1985-08
挽肖华同志,1985-08-19,1985-08
元宝山下芦笙节,1985-08-19,1985-08
《马克思女儿家书》,1985-08-19,1985-08
《燕都》创刊,1985-08-19,1985-08
渔家乐〔中国画〕,1985-08-19,1985-08
铜鼓县乡镇建立经营管理服务站,1985-08-20,1985-08
开展产品质量创优活动,1985-08-20,1985-08
热烈欢迎尼雷尔总统访问我国李主席主持隆重仪式举行盛大宴会,1985-08-20,1985-08
胡耀邦会见斯蒂芬,1985-08-20,1985-08
彭真会见加拿大议员团,1985-08-20,1985-08
总结抗战时期历史经验激励全国人民,1985-08-20,1985-08
谴责南非当局玩弄所谓“改革”的骗局,1985-08-20,1985-08
开封减轻郊县农民负担二千万元,1985-08-20,1985-08
我国建成世界上最高的北回归线标志塔,1985-08-20,1985-08
辽宁增加教育投资,1985-08-20,1985-08
河北缩减基建投资一亿多元,1985-08-20,1985-08
古稀老农写新闻,1985-08-20,1985-08
乘车感言,1985-08-20,1985-08
扎根陕北十六载  风雪高原育新人,1985-08-20,1985-08
上海积极发展与兄弟地区的经济合作,1985-08-20,1985-08
出卖车皮赚钱  明目张胆索贿,1985-08-20,1985-08
看看他们干了些什么,1985-08-20,1985-08
辽宁驻军大力支援地方抗洪救灾,1985-08-20,1985-08
教授热心出主意  农民办厂得效益,1985-08-20,1985-08
我国第一套大理石板材加工设备在贵州研制成功,1985-08-20,1985-08
心肠热  主意好,1985-08-20,1985-08
管市场与管人,1985-08-20,1985-08
海上石油开发设备展览会开幕,1985-08-20,1985-08
宽城县采矿业发展迅速,1985-08-20,1985-08
藏北牧区采挖虫草一万多斤,1985-08-20,1985-08
胶南鼓励农民发展出口商品,1985-08-20,1985-08
志在全村富盈门,1985-08-20,1985-08
建议扩大信贷管理范围,1985-08-20,1985-08
恋教不恋“官”  热心育人才,1985-08-20,1985-08
闪光的事业,1985-08-20,1985-08
要过一个有意义的教师节,1985-08-20,1985-08
实事要实,1985-08-20,1985-08
首都书画家为筹建抗日战争纪念馆举行义卖展,1985-08-20,1985-08
“肿瘤：前景的展望”国际学术会议在京举行,1985-08-20,1985-08
磁疗保健耳饰研制成功,1985-08-20,1985-08
海外音乐录音制品在京展出,1985-08-20,1985-08
抗早孕药物前列腺素ＰＧ０５栓剂研制成功,1985-08-20,1985-08
克己尊师  东山农场党委书记让住房  高尚品德在今天难能可贵    带头为民  和平区卫生局局长掏厕所  务实作风使当地有口皆碑（今日首都和各省市区报纸要目）,1985-08-20,1985-08
中国泳将创造亚洲最佳成绩,1985-08-20,1985-08
香港南华足球队以三比二战胜北京队,1985-08-20,1985-08
锻炼田径后备军,1985-08-20,1985-08
全国青运会跳水各项冠军决出一批小将向世界高难动作冲击,1985-08-20,1985-08
足球城名不虚传  娃娃兵技冠全国,1985-08-20,1985-08
中国青年女篮闯入世青赛四强,1985-08-20,1985-08
别具一格的圣火传递,1985-08-20,1985-08
中国坦桑之间的友谊和合作富有强大生命力,1985-08-20,1985-08
坦桑和中国的友谊在不断地扩大和加深,1985-08-20,1985-08
坚持团结  坚持进步,1985-08-20,1985-08
万里会见美国学者,1985-08-20,1985-08
杨尚昆会见日本客人,1985-08-20,1985-08
王震会见日本近畿青年洋上大学访华团领导成员,1985-08-20,1985-08
滑县选拔优秀专业户农民担任农村基层干部,1985-08-20,1985-08
左权将军纪念碑整修一新,1985-08-20,1985-08
王震会见日本学者远山正瑛,1985-08-20,1985-08
吴学谦会见加拿大议员团,1985-08-20,1985-08
墨西哥统一社会党政治局委员贝尔杜戈离京回国,1985-08-20,1985-08
罗马尼亚驻华使馆庆祝罗革命胜利四十一周年,1985-08-20,1985-08
周谷城会见联邦德国妇女代表团,1985-08-20,1985-08
加蓬驻华大使举行国庆招待会,1985-08-20,1985-08
新华社补正,1985-08-20,1985-08
整党坚持高标准  巩固成果不放松,1985-08-20,1985-08
关于干部考核问题的几点想法,1985-08-20,1985-08
不正之风要刹住  改革势头要保持,1985-08-20,1985-08
“班门弄斧”不足忌,1985-08-20,1985-08
“哄抬身价”不可为,1985-08-20,1985-08
难点宜攻不宜躲,1985-08-20,1985-08
苦心为穷县传技术  拒绝用医道赚大钱,1985-08-20,1985-08
令人敬佩的党员,1985-08-20,1985-08
村民委员会不能称“政府”,1985-08-20,1985-08
这个“地”字用错了,1985-08-20,1985-08
他念的是什么“经”？,1985-08-20,1985-08
车归原主,1985-08-20,1985-08
越南玩弄五年撤军骗局必遭失败,1985-08-20,1985-08
非统主席呼吁对南非实行经济制裁,1985-08-20,1985-08
北欧四国社民党主席谴责南非种族隔离制度,1985-08-20,1985-08
原日中友协理事长宫崎世民先生逝世,1985-08-20,1985-08
非洲的抗沙漠化斗争,1985-08-20,1985-08
江南命案仍未水落石出,1985-08-20,1985-08
抨击美国屈服以色列压力,1985-08-20,1985-08
墨菲中东之行无结果而回,1985-08-20,1985-08
伊朗连任总统哈梅内伊,1985-08-20,1985-08
我国有色金属展览会在东京开幕,1985-08-20,1985-08
我电影《黄土地》在瑞士获“银豹奖”,1985-08-20,1985-08
国际要闻简报,1985-08-20,1985-08
南朝鲜制定镇压学运法,1985-08-20,1985-08
津巴布韦旱情解除玉米丰收,1985-08-20,1985-08
尼泊尔国内生产总值有增长,1985-08-20,1985-08
埃及去年民航运输量增幅大,1985-08-20,1985-08
特立尼达和多巴哥经济好转,1985-08-20,1985-08
秘鲁一大型水电站投产发电,1985-08-20,1985-08
玻利维亚发现石油天然气田,1985-08-20,1985-08
从“石油热”中冷却下来,1985-08-20,1985-08
联合国工发组织决定年底讨论方针政策,1985-08-20,1985-08
欧洲共同体调整钢铁生产初见成效,1985-08-20,1985-08
法总统要军方制止对核试验场的侵犯,1985-08-20,1985-08
南斯拉夫瓦列沃区制裁违法个体户,1985-08-20,1985-08
日本发射第二颗卫星观测哈雷彗星,1985-08-20,1985-08
巴基斯坦重视和平利用原子能,1985-08-20,1985-08
苏联发现远古人骨,1985-08-20,1985-08
距今约一千三百万年的鲸化石残骸,1985-08-20,1985-08
古罗马女塑像,1985-08-20,1985-08
古希腊罗马图书馆,1985-08-20,1985-08
日本出土绳纹时代陶器,1985-08-20,1985-08
塞浦路斯考古新发现,1985-08-20,1985-08
“会议”之研究,1985-08-20,1985-08
关于郁达夫的两个问题,1985-08-20,1985-08
可以告慰梁启超先生,1985-08-20,1985-08
《回忆卫立煌先生》出版,1985-08-20,1985-08
海上泛舟,1985-08-20,1985-08
水塔剪影（外一首）,1985-08-20,1985-08
弹之歌（外一章）,1985-08-20,1985-08
梨树林,1985-08-20,1985-08
陕西彩色显象管总厂坚持二等品不出厂,1985-08-21,1985-08
理想纪律教育的重点是领导干部和党员,1985-08-21,1985-08
安阳发展横向经济联合中小企业顿时增添活力,1985-08-21,1985-08
李主席宴请斯蒂芬总督,1985-08-21,1985-08
普陀县药检所抵制销售晋江假药,1985-08-21,1985-08
胡耀邦会见贝林格夫人和巴尔卡一行,1985-08-21,1985-08
李先念会见加拿大议员团,1985-08-21,1985-08
赵紫阳同尼雷尔举行会谈,1985-08-21,1985-08
北京钢锉厂产品质量严重下降 党委书记厂长被就地免职,1985-08-21,1985-08
卫士贵在忠诚（国内短评）,1985-08-21,1985-08
打“官司”,1985-08-21,1985-08
故事片《瀚海潮》在京试映获好评,1985-08-21,1985-08
制止建筑工程非法转包行为,1985-08-21,1985-08
点燃理想之火的人,1985-08-21,1985-08
北京新型建筑材料总厂为用户做好服务工作,1985-08-21,1985-08
“三不算计”“两算计”,1985-08-21,1985-08
黑龙江省化工厂面貌大改观,1985-08-21,1985-08
从“代杀鳝鱼”想到的,1985-08-21,1985-08
来函照登,1985-08-21,1985-08
铁路系统大力推广应用计算机,1985-08-21,1985-08
要加强科学测算工作,1985-08-21,1985-08
在九曲黄河第一湾,1985-08-21,1985-08
设走访教师日  听教师心里话,1985-08-21,1985-08
义务为布依族儿童传授知识,1985-08-21,1985-08
奔往第十个高度,1985-08-21,1985-08
我国陆续出版一批有关抗日战争和世界反法西斯战争的书籍,1985-08-21,1985-08
四川中学毕业生争考师范,1985-08-21,1985-08
全国第一个草原自然保护区在内蒙古牧区建成,1985-08-21,1985-08
老干部为青少年作辅导  青少年为老干部送温暖  老少联谊建文明    下面的给上司们进礼品  上司们给下面的发奖金  上下勾结坑国家（今日首都和各省市区报纸要目）,1985-08-21,1985-08
聂耳、冼星海声乐作品演唱比赛结束,1985-08-21,1985-08
本溪市用原计划建宾馆的钱为学校建校舍,1985-08-21,1985-08
下湿庄村为自学青年设立奖学金,1985-08-21,1985-08
长沙一名煤气中毒妇女昏迷一百七十天后康复出院,1985-08-21,1985-08
各国选手陆续抵达日本神户,1985-08-21,1985-08
世界大学生运动会体操比赛展望,1985-08-21,1985-08
男女神射手枪法大比试,1985-08-21,1985-08
中国青年女篮负于南朝鲜队,1985-08-21,1985-08
北京组织自行车旅游锻炼身体丰富生活,1985-08-21,1985-08
安坐电视机前欣赏神户激战,1985-08-21,1985-08
大战中国女排的世界明星队名单选定,1985-08-21,1985-08
辽宁男篮在泰王储杯赛上胜加拿大队,1985-08-21,1985-08
淮北市医药公司非法销售淘汰报废药品受到查处,1985-08-21,1985-08
一面镜子,1985-08-21,1985-08
对青少年进行理想与纪律教育,1985-08-21,1985-08
学习新技术新知识  提高现代领导水平,1985-08-21,1985-08
海军部队开展为地方群众做好事活动,1985-08-21,1985-08
整党要促进工作  要受工作的检验,1985-08-21,1985-08
香港特别行政区基本法咨询委员会发起人第二次会议初步通过咨委会章程草稿,1985-08-21,1985-08
山西省政府颁发《农村五保户供养工作试行办法》,1985-08-21,1985-08
大连营城子乡对五保工作实行合同化管理,1985-08-21,1985-08
西藏第一代律师运用法律手段维护人民群众的合法权益,1985-08-21,1985-08
尼雷尔总统出席专场文艺晚会,1985-08-21,1985-08
方毅会见贝宁客人,1985-08-21,1985-08
抗战初期的江西妇女运动（纪念抗日战争世界反法西斯战争胜利四十周年）,1985-08-21,1985-08
难忘的太行岁月,1985-08-21,1985-08
难忘的太行岁月,1985-08-21,1985-08
抗日怀壮志  杀敌岂顾身,1985-08-21,1985-08
上课,1985-08-21,1985-08
老把戏  新花招（本报评论）,1985-08-21,1985-08
种族隔离主义只能根除不能改革,1985-08-21,1985-08
越南不会放弃吞并柬埔寨的野心,1985-08-21,1985-08
巴基斯坦国民议会支持政府取消军管法,1985-08-21,1985-08
孟加拉国五党组成民族阵线,1985-08-21,1985-08
中东和平关键是解决巴勒斯坦人的命运问题,1985-08-21,1985-08
美官方说仍可能同约巴会谈,1985-08-21,1985-08
贝鲁特又发生两起汽车爆炸事件,1985-08-21,1985-08
在美华人继续抗议放映辱华影片《龙年》,1985-08-21,1985-08
伊朗公布选举结果哈梅内伊当选总统,1985-08-21,1985-08
“拉菲克”——坦桑尼亚,1985-08-21,1985-08
以色列驻埃及一外交官遭枪击身亡,1985-08-21,1985-08
中曾根首相会见我体委主任,1985-08-21,1985-08
马达加斯加总统接见我大使,1985-08-21,1985-08
国际要闻简报,1985-08-21,1985-08
金日成参观朝鲜社会主义建设成就展览,1985-08-21,1985-08
里根下月将同应邀访美的苏外长会晤,1985-08-21,1985-08
古都非斯巡礼,1985-08-21,1985-08
要求建立国际新闻新秩序,1985-08-21,1985-08
人口增长要与经济发展相一致,1985-08-21,1985-08
西方主要工业国生产在回升,1985-08-21,1985-08
莫斯科的绿化,1985-08-21,1985-08
金价涨至五个月来最高水平,1985-08-21,1985-08
南斯拉夫判决一起大盗窃案,1985-08-21,1985-08
一纳粹罪犯向哥斯达黎加当局投案,1985-08-21,1985-08
第一个驾太阳能船横渡太平洋的人,1985-08-21,1985-08
华盛顿的街头小贩,1985-08-21,1985-08
烽火断忆,1985-08-21,1985-08
池塘生春草,1985-08-21,1985-08
郁达夫与鲁迅的《故乡》,1985-08-21,1985-08
张大眼睛看（大地漫笔）,1985-08-21,1985-08
官气和勇气（大地漫笔）,1985-08-21,1985-08
烟雨漓江,1985-08-21,1985-08
湖北经济技术协作范围广收效大,1985-08-22,1985-08
邓小平胡耀邦分别会见尼雷尔,1985-08-22,1985-08
学习别人长处  开足马力前进,1985-08-22,1985-08
勉县精简基层干部减轻农民负担８３万元,1985-08-22,1985-08
彭真会见西班牙参议院代表团人大常委会宴请德卡瓦哈尔一行,1985-08-22,1985-08
津巴布韦总理穆加贝八月下旬访华,1985-08-22,1985-08
借田,1985-08-22,1985-08
我国大部分地区出现不同程度旱情,1985-08-22,1985-08
济南市外贸部门积极协助地方生产和出口芦笋,1985-08-22,1985-08
大庆三十万吨乙烯原料工程十六套引进装置投产,1985-08-22,1985-08
优良牧草松香草试种基地在陕西华县建成,1985-08-22,1985-08
退职也应退钱,1985-08-22,1985-08
记者的荣与辱,1985-08-22,1985-08
加速推进秦皇岛市经济技术开发,1985-08-22,1985-08
西藏外贸回升贸易活跃（放开搞活经济  西藏日新月异）,1985-08-22,1985-08
西藏电视台成立（放开搞活经济  西藏日新月异）,1985-08-22,1985-08
那曲饭店和那曲群艺馆落成（放开搞活经济  西藏日新月异）,1985-08-22,1985-08
藏语电影拷贝已有二千多个（放开搞活经济  西藏日新月异）,1985-08-22,1985-08
各地农行要大力组织资金回笼货币,1985-08-22,1985-08
新疆对外开放见效快,1985-08-22,1985-08
邮电工会第四次全国代表大会开幕,1985-08-22,1985-08
对已验收合格的企业进行复查,1985-08-22,1985-08
济南市技术协作有成绩,1985-08-22,1985-08
农民的“庭院经济学”,1985-08-22,1985-08
西坡镇集资办煤矿,1985-08-22,1985-08
五十四家工厂获自行车生产许可证,1985-08-22,1985-08
方便面的不方便,1985-08-22,1985-08
通辽发电厂一号机组发电,1985-08-22,1985-08
梅县机场动工兴建,1985-08-22,1985-08
上海港紧急疏港告捷,1985-08-22,1985-08
昭通地区认真查补偷漏税款,1985-08-22,1985-08
凤凰是怎样起飞的？,1985-08-22,1985-08
在科研成果面前,1985-08-22,1985-08
“德者，才之帅也”,1985-08-22,1985-08
共青团在教育改革中大有作为,1985-08-22,1985-08
立法是科技工作的当务之急,1985-08-22,1985-08
杨静仁会见旅法中国画家彭万墀,1985-08-22,1985-08
《全国信息汇编》杂志变相出售“记者证”从中牟利六万多元在社会上造成恶劣影响,1985-08-22,1985-08
空军后勤部组织医务人员为首都部分教师义务检查身体,1985-08-22,1985-08
霍英东在京会见获霍英东奖学金学生,1985-08-22,1985-08
《王力文集》前三卷出版，作者捐献全部文集稿酬设立语言学奖,1985-08-22,1985-08
美籍华人胡天育博士向河南一青少年科学宫捐赠科学仪器,1985-08-22,1985-08
昌河机械厂职工子第中学重视教学质量,1985-08-22,1985-08
新城金矿资助当地学校二十五万元,1985-08-22,1985-08
掌“方向盘”忠于人民  开车廿载未捞分文  邗江传颂好驾驶员    盗“邮政戳”利用职权  寄信万件只凭一印  丽水逮捕前副主任（今日首都和各省市区报纸要目）,1985-08-22,1985-08
中国大学生体育代表团到达神户,1985-08-22,1985-08
“中华武术走向世界的日子不远了”,1985-08-22,1985-08
西安武术国际邀请赛隆重开幕,1985-08-22,1985-08
大学生运动会花絮,1985-08-22,1985-08
世界乒坛十六员强将齐集佛山,1985-08-22,1985-08
挪威选手创女子一万米世界最好成绩,1985-08-22,1985-08
印尼“独立杯”赛结束,1985-08-22,1985-08
世界杯乒乓球赛分组最新情况,1985-08-22,1985-08
带头深入实际  改进领导作风,1985-08-22,1985-08
浙江省民兵青年开展“乐为他人作奉献”活动,1985-08-22,1985-08
北京八十六家企业配置和聘请法律顾问促进企业改革和生产健康发展,1985-08-22,1985-08
北京军区指战员在军民共建活动中广泛进行理想纪律道德教育,1985-08-22,1985-08
石家庄做好安置转退军人准备工作,1985-08-22,1985-08
共青团中央决定开展以“祖国在我们心中”为主题的教育活动,1985-08-22,1985-08
李主席任免一批驻外使节,1985-08-22,1985-08
国务院任免一批国家工作人员,1985-08-22,1985-08
越南当局侵柬立场没有任何实质性改变,1985-08-22,1985-08
赵总理分别会见多哥扎伊尔喀麦隆驻华大使,1985-08-22,1985-08
斯蒂芬总督离京赴上海,1985-08-22,1985-08
南非当局提出所谓“改革”是一句空话,1985-08-22,1985-08
全国政协代表团结束对尼泊尔的访问回到北京,1985-08-22,1985-08
王震分别会见日本客人,1985-08-22,1985-08
黄华会见美国众议院司法委员会代表团,1985-08-22,1985-08
菲律宾华侨的抗日斗争,1985-08-22,1985-08
姬鹏飞会见扎伊尔赤道省友好代表团,1985-08-22,1985-08
俞国华重弹所谓“三民主义统一中国”老调,1985-08-22,1985-08
抗战初期的一段回忆,1985-08-22,1985-08
铮铮报国志  巍巍中华魂,1985-08-22,1985-08
非统紧急呼吁国际社会设法营救,1985-08-22,1985-08
宋双表示拒绝同金边伪政权直接谈判,1985-08-22,1985-08
侵略战争的性质不容模糊,1985-08-22,1985-08
韩桑林士兵打死越军炮兵指挥官,1985-08-22,1985-08
拉美国家科技会议开幕,1985-08-22,1985-08
日官员参拜靖国神社伤害亚洲人民感情,1985-08-22,1985-08
贝鲁特炮战再起,1985-08-22,1985-08
美宣布试验反卫星武器  苏予指责,1985-08-22,1985-08
印度锡克教领导人朗格瓦尔被刺身亡,1985-08-22,1985-08
日本右翼团体多次到我使馆门前捣乱,1985-08-22,1985-08
中华猕猴桃在世界市场上深受欢迎,1985-08-22,1985-08
国际要闻简报,1985-08-22,1985-08
我国麋鹿的侨居地纪行,1985-08-22,1985-08
武汉乘车怪事种种,1985-08-22,1985-08
乡党委书记糊涂“判案”殴打教师的歪风难禁,1985-08-22,1985-08
办理结婚登记竟要先买国库券,1985-08-22,1985-08
不该把孩子赶出校门,1985-08-22,1985-08
教师烧煤无处觅,1985-08-22,1985-08
九江市青蛙遭劫,1985-08-22,1985-08
我们不是为钱而来,1985-08-22,1985-08
对药瓶爆裂问题我厂已采取措施,1985-08-22,1985-08
发展乡镇企业不可挤占幼儿园,1985-08-22,1985-08
慢：１日到货１７日才发到货通知书怪：接通知就取货还被罚九十一元,1985-08-22,1985-08
五角钱岂能了结这起吃喝案,1985-08-22,1985-08
买一台收录机竟要搭配三百盘磁带,1985-08-22,1985-08
也谈杂文,1985-08-22,1985-08
义务服务的传统,1985-08-22,1985-08
访泰归来,1985-08-22,1985-08
海歌,1985-08-22,1985-08
摇钱树种种,1985-08-22,1985-08
对策（大地漫笔）,1985-08-22,1985-08
“批判从严”的验证,1985-08-22,1985-08
小巷,1985-08-22,1985-08
我对外承包和劳务合作正向多行业多工种发展,1985-08-23,1985-08
农业银行今年发行十五亿元金融债券,1985-08-23,1985-08
劳务出口是对外开放的组成部分（本报评论）,1985-08-23,1985-08
军队精简整编形势越好工作越要扎实细致,1985-08-23,1985-08
党中央、国务院赠送给西藏人民节日礼品全部运抵拉萨,1985-08-23,1985-08
北京福建等地筹备纪念林则徐诞辰二百周年,1985-08-23,1985-08
加强管理严格控制支出,1985-08-23,1985-08
海军数十名中青年干部任军以上领导职务,1985-08-23,1985-08
江苏稻田养鱼十八万亩亩产千斤稻百斤鱼,1985-08-23,1985-08
江西增拨六百万元经费发展职业教育,1985-08-23,1985-08
十四英寸彩色显象管的生产线在上海动工兴建,1985-08-23,1985-08
马耳他总统巴巴拉,1985-08-23,1985-08
老艺人新贡献,1985-08-23,1985-08
谱写中朝青年友谊绚丽的新篇章（国内短评）,1985-08-23,1985-08
辽阳查处一起重大经济案件,1985-08-23,1985-08
向建筑业国际市场迈步,1985-08-23,1985-08
考核企业干部的一项重要内容,1985-08-23,1985-08
莆田市水产养殖有突破,1985-08-23,1985-08
干部群众当地驻军奋力抗灾,1985-08-23,1985-08
南海石油开发后勤基地建设初具规模,1985-08-23,1985-08
沂蒙山区七县发展林果生产取得成绩,1985-08-23,1985-08
营口蓄电池厂为给国家创汇不怕吃亏,1985-08-23,1985-08
中美合资兴建现代化长绒棉纺织厂合同与章程签字,1985-08-23,1985-08
中日合营长城竹中建设工程有限公司开业,1985-08-23,1985-08
纱布化纤交易会在京举办,1985-08-23,1985-08
岂能以肥顶瘦,1985-08-23,1985-08
郑州电缆厂充满生机,1985-08-23,1985-08
企业改革不能放松智力开发,1985-08-23,1985-08
戈壁瀚海种菜人,1985-08-23,1985-08
要对群众的健康负责,1985-08-23,1985-08
部门界限一打破三千万元省下来,1985-08-23,1985-08
食品卫生管理工作丝毫不能放松,1985-08-23,1985-08
条条块块都要扫障碍,1985-08-23,1985-08
杜润生的论文集《中国农村经济改革》出版,1985-08-23,1985-08
谨防洋货骗人  上海家用电器公司质量把关  金睛识进口劣品    牢记育才重任  万安一批骨干教师弃官返校  心血浇满园桃李（今日首都和各省市区报纸要目）,1985-08-23,1985-08
安徽研制成功一种止血新药“血立停”,1985-08-23,1985-08
北京林学院在西吉防护林工程建设中取得十四项科研成果,1985-08-23,1985-08
深圳市民革小组创办“中山职业培训中心”,1985-08-23,1985-08
为中国代表团举行升旗仪式,1985-08-23,1985-08
神户喜迎宾客来,1985-08-23,1985-08
各国武术代表协商成立国际武联,1985-08-23,1985-08
世界杯乒乓球赛首日爆出冷门,1985-08-23,1985-08
世界青年女篮赛苏联队夺冠,1985-08-23,1985-08
大学生运动会足球开赛,1985-08-23,1985-08
在和平与科学的旗帜下欢聚——圣火抵达神户港纪实,1985-08-23,1985-08
大战午城（日记）,1985-08-23,1985-08
为党奋斗到最后一息,1985-08-23,1985-08
采取有力措施  坚决查禁赌博活动,1985-08-23,1985-08
首都航空界举行座谈会（纪念抗日战争世界反法西斯战争胜利四十周年）,1985-08-23,1985-08
全总召开座谈会（纪念抗日战争世界反法西斯战争胜利四十周年）,1985-08-23,1985-08
大连向苏军烈士纪念塔献花圈（纪念抗日战争世界反法西斯战争胜利四十周年）,1985-08-23,1985-08
李主席分别会见加纳和埃塞俄比亚新大使,1985-08-23,1985-08
尼雷尔总统离京赴朝鲜,1985-08-23,1985-08
庆祝罗马尼亚国庆,1985-08-23,1985-08
廖汉生和德卡瓦哈尔议长举行会谈,1985-08-23,1985-08
澳大利亚总督离沪赴东京,1985-08-23,1985-08
王震会见日本社会党活动家访华团,1985-08-23,1985-08
万里胡启立会见日本劳动大臣山口敏夫,1985-08-23,1985-08
田纪云说：中国行政管理的改革势在必行,1985-08-23,1985-08
王震会见日本经济界人士,1985-08-23,1985-08
王震会见饭田庸太郎,1985-08-23,1985-08
姚依林会见埃塞俄比亚工业部长,1985-08-23,1985-08
李鹏会见捷克斯洛伐克斯柯达公司代表团,1985-08-23,1985-08
钱李仁会见埃塞俄比亚客人,1985-08-23,1985-08
程子华会见日本客人,1985-08-23,1985-08
吴学谦会见西班牙参议院代表团,1985-08-23,1985-08
缅甸新闻代表团抵京,1985-08-23,1985-08
李鹏会见日本三菱重工业公司代表团,1985-08-23,1985-08
李鹏会见美国众议院司法委员会代表团,1985-08-23,1985-08
中国抗日战争是全民族的反侵略战争,1985-08-23,1985-08
从读《龙的传人》想到的,1985-08-23,1985-08
为中朝友谊谱写新赞歌,1985-08-23,1985-08
西哈努克表示不同金边傀儡会晤,1985-08-23,1985-08
就艺术团和访问团的互访达成协议,1985-08-23,1985-08
将进一步加强马中友谊合作,1985-08-23,1985-08
圭亚那总统接见我党代表团,1985-08-23,1985-08
黎巴嫩局势恶化  贝鲁特冲突升级,1985-08-23,1985-08
阿拉法特说巴解将继续加强阿拉伯团结,1985-08-23,1985-08
匈牙利主席接见我大使,1985-08-23,1985-08
我新任大使向泰国王递交国书,1985-08-23,1985-08
特里波利发生爆炸事件死伤百余,1985-08-23,1985-08
民主德国议院主席会见我大使,1985-08-23,1985-08
我向贝宁赠送玉米,1985-08-23,1985-08
隧道尽头的亮光,1985-08-23,1985-08
菲律宾首都群众集会纪念阿基诺逝世两周年,1985-08-23,1985-08
三十名利比亚外交官为不受欢迎的人,1985-08-23,1985-08
国际要闻简报,1985-08-23,1985-08
谴责南非当局无视国际社会的呼吁,1985-08-23,1985-08
声援南非人民斗争  谴责南非当局暴行,1985-08-23,1985-08
一座县城的规划,1985-08-23,1985-08
南非矿工将举行大罢工,1985-08-23,1985-08
坚决反对美国不公平的詹金斯提案,1985-08-23,1985-08
苏联近两千万人从事私人服务,1985-08-23,1985-08
捷向三十多国出口劳务,1985-08-23,1985-08
美国抗议苏使用化学物质监视美外交人员,1985-08-23,1985-08
苏联大量贮存化学武器,1985-08-23,1985-08
阿根廷打击贩毒活动,1985-08-23,1985-08
