庆祝人民解放军建军五十八周年,1985-08-01,1985-08
中央批准中纪委报告处分有关领导干部,1985-08-01,1985-08
吸取教训  继续前进（本报评论）,1985-08-01,1985-08
国务院、中央军委要求各地区各部门积极妥善解决军队干部家属住房困难,1985-08-01,1985-08
全国人大常委会欢宴毛里求斯议会代表团,1985-08-01,1985-08
柯达杯世界锦标赛在京开幕,1985-08-01,1985-08
宣布今后五年每年向我国提供上千万美元援助,1985-08-01,1985-08
“当一辈子临时工”,1985-08-01,1985-08
郑州铁路局运输能力提高,1985-08-01,1985-08
潜力在哪里？（国内短评）,1985-08-01,1985-08
袁宝华兼任人大校长,1985-08-01,1985-08
树立买水观念（本报评论）,1985-08-01,1985-08
天津铁路分局守纪律顾大局,1985-08-01,1985-08
重庆市各部门积极帮助乡镇企业,1985-08-01,1985-08
绥棱县发展大豆加工业,1985-08-01,1985-08
食品店岂能卖农药,1985-08-01,1985-08
新疆良种细毛羊培育技术先进,1985-08-01,1985-08
汇丰银行香港总行新大厦局部开放营业,1985-08-01,1985-08
石家庄市造纸厂产品质量高,1985-08-01,1985-08
兴隆庄矿选煤厂投产,1985-08-01,1985-08
大型电动轮自卸汽车问世,1985-08-01,1985-08
柳州铁路局安全生产抓得好,1985-08-01,1985-08
柳州铁路局安全生产抓得好,1985-08-01,1985-08
海南岛大量进口和倒卖汽车事件真相大白,1985-08-01,1985-08
广西一些县市尊师重教见行动,1985-08-01,1985-08
热情帮助空军发展高等教育,1985-08-01,1985-08
护士长李祖珍获“爱国拥军模范”称号,1985-08-01,1985-08
普氏野马回“娘家”  新疆荒原迎“骄子”,1985-08-01,1985-08
我国高原潜水技术达到世界先进水平,1985-08-01,1985-08
西出阳关多亲人,1985-08-01,1985-08
年轻人也可“让贤”,1985-08-01,1985-08
军民共建我国首座航空馆,1985-08-01,1985-08
中国儿童少年活动中心第三届夏令营在延安开营,1985-08-01,1985-08
各行各业一起动手  联合培养技术人才  山东军民共建活动取得好成绩    逐村逐人分别调查  热情安置回乡战士  广东拥军优属工作增添新内容（今日首都和各省市区报纸要目）,1985-08-01,1985-08
中玻两队握手言和  几内亚队反击破门,1985-08-01,1985-08
上海赛区大雨  巴西小将获胜,1985-08-01,1985-08
中玻教练赛后如是说,1985-08-01,1985-08
大连赛区攻势猛烈两场比赛六次破门,1985-08-01,1985-08
天津赛区爆出冷门阿根廷队出师不利,1985-08-01,1985-08
全国各地军民庆祝“八一”建军节（发扬拥军优属拥政爱民的优良传统）,1985-08-01,1985-08
数以万计的慰问信慰问品飞往老山（发扬拥军优属拥政爱民的优良传统）,1985-08-01,1985-08
以实际行动支持部队精简整编（发扬拥军优属拥政爱民的优良传统）,1985-08-01,1985-08
热忱·积极·尽力,1985-08-01,1985-08
中英土地委员会在香港举行第二次会议,1985-08-01,1985-08
杨静仁会见泰国各党派议员代表团,1985-08-01,1985-08
胡启立会见意共积极分子代表团,1985-08-01,1985-08
姚依林会见伊朗广播电视组织主席,1985-08-01,1985-08
陈慕华会见国际货币基金组织磋商代表团,1985-08-01,1985-08
陈慕华会见美国第一银行系统董事长,1985-08-01,1985-08
关于中国同以色列进行秘密军火交易报道毫无根据,1985-08-01,1985-08
将军离职前后,1985-08-01,1985-08
空军今年飞播造林突破六百万亩,1985-08-01,1985-08
残疾人基金会向残废军人和烈军属赠送家用电器,1985-08-01,1985-08
苏秀英荣获“爱国拥军模范”荣誉称号,1985-08-01,1985-08
张志霞到武警北京总队慰问干部战士,1985-08-01,1985-08
城市生态研究势在必行,1985-08-01,1985-08
扬长避短才能显出优势,1985-08-01,1985-08
招鸟工程：建设鸟语花香新环境,1985-08-01,1985-08
“花园营”战士喜放猫头鹰,1985-08-01,1985-08
沙漠太阳能发电站,1985-08-01,1985-08
重视城市生态规划,1985-08-01,1985-08
招鸟佳话,1985-08-01,1985-08
北京的大天鹅飞到黑龙江,1985-08-01,1985-08
制止捕捉益鸟,1985-08-01,1985-08
基础研究新动向,1985-08-01,1985-08
夏威夷州长有吉设宴欢迎李主席,1985-08-01,1985-08
李主席参观孙中山母校,1985-08-01,1985-08
花环献贵宾,1985-08-01,1985-08
第四次中日政府成员会议圆满结束,1985-08-01,1985-08
一些国家军方领导人电贺我建军节,1985-08-01,1985-08
日本政府公布开放市场的行动计划,1985-08-01,1985-08
阿富汗游击队猛袭喀布尔苏空军基地,1985-08-01,1985-08
印巴将就不使用武力问题重新举行对话,1985-08-01,1985-08
美苏代表在赫尔辛基会议上相互指责,1985-08-01,1985-08
泰国总理下令取缔黄色书刊 埃及政府禁止放映色情录像,1985-08-01,1985-08
英再次降低利率  英镑汇价仍上升,1985-08-01,1985-08
苏拒绝观看美核试验的建议,1985-08-01,1985-08
美苏外长在赫尔辛基举行首次会谈（最后消息）,1985-08-01,1985-08
国际要闻简报,1985-08-01,1985-08
美“挑战者”号发生故障进入低轨道,1985-08-01,1985-08
西昌市综合治理整顿铁路治安,1985-08-01,1985-08
我们这里的村干部任意卖地占地,1985-08-01,1985-08
挂着“信誉第一”牌子，卖冒牌货骗人,1985-08-01,1985-08
绵阳火车站热情接待凯旋的边防战士,1985-08-01,1985-08
贵州铜仁地区十万亩松林发生赤枯病,1985-08-01,1985-08
听众和观众,1985-08-01,1985-08
作者与主人公,1985-08-01,1985-08
用词不当一例,1985-08-01,1985-08
学术交流活动应多发材料少开会,1985-08-01,1985-08
余姚县山区群众买盐难,1985-08-01,1985-08
北京低档饭菜贵,1985-08-01,1985-08
行人难以涉足的人行横道,1985-08-01,1985-08
简讯,1985-08-01,1985-08
简讯,1985-08-01,1985-08
简讯,1985-08-01,1985-08
简讯,1985-08-01,1985-08
简讯,1985-08-01,1985-08
祝捷图〔中国画〕,1985-08-01,1985-08
纪念抗日战争胜利四十周年,1985-08-01,1985-08
安徽调整骨干企业领导班子,1985-08-02,1985-08
仙游度尾镇乡镇企业根基稳后劲足,1985-08-02,1985-08
李先念主席从檀香山回到上海,1985-08-02,1985-08
邓小平纵谈我对外开放政策和国际形势,1985-08-02,1985-08
总结经验教训加强党风党纪建设,1985-08-02,1985-08
女配种员赵金梅,1985-08-02,1985-08
李主席和比兰德拉国王互致贺电,1985-08-02,1985-08
河北省共查补税款一千五百多万元,1985-08-02,1985-08
打个招呼,1985-08-02,1985-08
一位母亲的奉献,1985-08-02,1985-08
拉萨大昭寺街心广场建成,1985-08-02,1985-08
乌鲁木齐石化总厂化肥厂建成投产,1985-08-02,1985-08
贺县县委副书记黄裕辉被依法逮捕,1985-08-02,1985-08
榆树县大批专业户成了文明户,1985-08-02,1985-08
陵县改革畜牧经济管理机构,1985-08-02,1985-08
改革机构要顺理成章（国内短评）,1985-08-02,1985-08
专业户与文明户,1985-08-02,1985-08
长白山百货商场请工厂进店售货,1985-08-02,1985-08
轻工系统复查名牌优质产品质量,1985-08-02,1985-08
无锡电扇厂把好产品质量关,1985-08-02,1985-08
重庆市食品污染情况严重,1985-08-02,1985-08
我国蒸汽机车锅炉首次采用热管技术获得成功,1985-08-02,1985-08
纠正倾斜楼房有新法,1985-08-02,1985-08
新华社改稿,1985-08-02,1985-08
适得其反,1985-08-02,1985-08
希望在田野上,1985-08-02,1985-08
给企业的中层干部“松绑”,1985-08-02,1985-08
理想在燃烧,1985-08-02,1985-08
送医送药到大别山村寨,1985-08-02,1985-08
深圳科技工业园奠基,1985-08-02,1985-08
李公朴先生创建的“北门书屋”重建开业,1985-08-02,1985-08
妻子劝郎明大义  去留听从党安排  邯郸八名部队干部有贤内助    壮士解甲怀豪情  归来犹为国争光  益都三万复员军人立新功劳（今日首都和各省市区报纸要目）,1985-08-02,1985-08
中国姑娘战胜美国男子汉,1985-08-02,1985-08
裁判难分胜负  数子方知结果,1985-08-02,1985-08
世界杯足球赛亚洲区预选赛第二轮比赛南朝鲜队胜印度尼西亚队,1985-08-02,1985-08
“黑猫”男篮能投善抢后来居上  “八一”二队缺乏经验先赢后输,1985-08-02,1985-08
佩雷斯认为古巴女排一年后将与中国队抗衡,1985-08-02,1985-08
前线指战员浴血奋战为国献身堪称“新时代最可爱的人”,1985-08-02,1985-08
多干实事好事不说空话假话就能促进党风根本好转,1985-08-02,1985-08
用实际行动回答党中央国务院的关怀和期望,1985-08-02,1985-08
军队两万离休老干部参加首都“八一”联欢晚会,1985-08-02,1985-08
中英土地委员会第二次会议就有关土地契约等问题进行讨论,1985-08-02,1985-08
周谷城慰问丹东市九连城受灾群众,1985-08-02,1985-08
最高人民法院和最高人民检察院联合发出通知,1985-08-02,1985-08
严济慈同毛里求斯议长会谈,1985-08-02,1985-08
庆祝中国和尼泊尔建交三十周年,1985-08-02,1985-08
陈慕华率政府代表团赴罗马尼亚,1985-08-02,1985-08
黄华会见泰国各党派议员代表团,1985-08-02,1985-08
中国人民争取和平与裁军协会代表团离京赴日本,1985-08-02,1985-08
印尼工商会会长举行答谢宴会,1985-08-02,1985-08
崔月犁宴请马达加斯加卫生部长,1985-08-02,1985-08
母亲的心愿,1985-08-02,1985-08
中国近代史上的爱国主义,1985-08-02,1985-08
长城、秦始皇及其他,1985-08-02,1985-08
发展乡镇企业要注意效益,1985-08-02,1985-08
国营商业要积极参与市场调节,1985-08-02,1985-08
李主席参观波利尼西亚文化中心,1985-08-02,1985-08
双方对中日关系发展表示满意,1985-08-02,1985-08
柬军民拥护民柬对一些重大问题立场,1985-08-02,1985-08
郑浚基就第二十四届奥运会发表谈话,1985-08-02,1985-08
南朝鲜民主人士金大中再次被软禁,1985-08-02,1985-08
尼中关系十分友好和亲密,1985-08-02,1985-08
智利总统皮诺切特接见康世恩,1985-08-02,1985-08
纳拉烈到柬内地视察,1985-08-02,1985-08
乌干达任命新总理,1985-08-02,1985-08
促进中日友好合作关系全面发展,1985-08-02,1985-08
我驻约旦大使向侯赛因国王递交国书,1985-08-02,1985-08
尼日尔元首孔切接见即将离任的我大使,1985-08-02,1985-08
国际简讯,1985-08-02,1985-08
访美国少年太空营,1985-08-02,1985-08
拉美国家重申一体化是历史的必然,1985-08-02,1985-08
采取共同立场同欧洲共同体对话,1985-08-02,1985-08
苏美外长为两国领导人会晤作准备,1985-08-02,1985-08
戈尔巴乔夫兼任苏联国防会议主席,1985-08-02,1985-08
减少环节  各方受益,1985-08-02,1985-08
为何“弃权”,1985-08-02,1985-08
对南非实行经济制裁,1985-08-02,1985-08
欧洲共同体各国决定召回驻南非大使,1985-08-02,1985-08
波兰集会纪念华沙起义四十一周年,1985-08-02,1985-08
美科学家研究爱滋病毒取得进展,1985-08-02,1985-08
阿联酋发现第一例爱滋病,1985-08-02,1985-08
能和人一样行走的机器人,1985-08-02,1985-08
假如烈士复活,1985-08-02,1985-08
在党旗下……,1985-08-02,1985-08
“花之寺”小考,1985-08-02,1985-08
溶洞（二首）,1985-08-02,1985-08
“李存葆住对门”,1985-08-02,1985-08
海防线上〔套色本刻〕,1985-08-02,1985-08
华容县政府只设“一办五委”,1985-08-03,1985-08
“星球大战”干不得,1985-08-03,1985-08
云南农贷资金横向调拨灵活及时,1985-08-03,1985-08
武钢一米七轧机基本达到核定设计水平,1985-08-03,1985-08
北京压缩基建规模,1985-08-03,1985-08
岔道,1985-08-03,1985-08
电视剧《四世同堂》吸引首都观众,1985-08-03,1985-08
贵州剑河大桥通车,1985-08-03,1985-08
学费为何提价？,1985-08-03,1985-08
各级干部以官论奖中饱私囊,1985-08-03,1985-08
向“笔杆子”进一言,1985-08-03,1985-08
“鸡城”符离集,1985-08-03,1985-08
去年农民人均收入最高的是北京郊区,1985-08-03,1985-08
我国为传送电视租用的国际通讯卫星开始启用,1985-08-03,1985-08
我国关于日本海——黄海——东海的鲸类列为保护品种的提案获得通过,1985-08-03,1985-08
交通部提前建成二十二个深水泊位,1985-08-03,1985-08
现代化厂房投资三百万元 作坊式生产减利十分之六,1985-08-03,1985-08
现代化不是“表面化”,1985-08-03,1985-08
郑州花园路粮管所食品厂用广告骗人几百农民上当流落街头,1985-08-03,1985-08
猪耳朵特大的秘密,1985-08-03,1985-08
北京市今年西瓜供应好,1985-08-03,1985-08
新疆一二四团大力发展人用细粮加工转化,1985-08-03,1985-08
职业保健饮料——肺净乐问世,1985-08-03,1985-08
长沙研制成功高压水发生器,1985-08-03,1985-08
每小时挖掘一千五至二千立方米煤炭的斗轮挖掘机试制成功,1985-08-03,1985-08
由西瓜甜想到买菜“苦”,1985-08-03,1985-08
接受批评  改进工作,1985-08-03,1985-08
厂长（经理）要牵“牛鼻子”,1985-08-03,1985-08
“信誉”来不得半点马虎,1985-08-03,1985-08
给中小企业“雪中送炭”,1985-08-03,1985-08
高校录取通知要准确寄到新生手中,1985-08-03,1985-08
什么是爱才？,1985-08-03,1985-08
科学技术在西藏高原开花结果,1985-08-03,1985-08
诊断青光眼有新法,1985-08-03,1985-08
民革中央和中国美协举办“纪念抗日战争胜利四十周年八人书画联展”,1985-08-03,1985-08
《中原烽火》一书出版发行,1985-08-03,1985-08
关键是要追究领导者责任,1985-08-03,1985-08
党纪国法不容,1985-08-03,1985-08
吸取教训  加强教育,1985-08-03,1985-08
奖金拿低档  调资让工人  保定火车站各级领导好个高风格    当官吃空饷  谋私骗国家  沈阳印技所正副所长该当何罪名（今日首都和各省市区报纸要目）,1985-08-03,1985-08
十里杜鹃十里景,1985-08-03,1985-08
柯达杯第二轮比赛高潮迭起,1985-08-03,1985-08
副市长看望啦啦队,1985-08-03,1985-08
先稳下来  再攻上去,1985-08-03,1985-08
我选手马晓春失利,1985-08-03,1985-08
合川县委对党员加强党性党纪教育,1985-08-03,1985-08
全军绿化工作超额完成年度计划,1985-08-03,1985-08
张太雷烈士塑像在天津大学落成,1985-08-03,1985-08
乌苏县充分发挥群众调解组织作用,1985-08-03,1985-08
梨树县人民法院预防经济纠纷有成效,1985-08-03,1985-08
要有主动精神,1985-08-03,1985-08
胡启立夏衍王兆国看望日本公明党委员长竹入义胜,1985-08-03,1985-08
泰国各党派议员代表团举行答谢宴会,1985-08-03,1985-08
胡启立会见朝鲜劳动党中央书记黄长烨,1985-08-03,1985-08
中英土地委员会第二次会议结束,1985-08-03,1985-08
中日政府间文化交流第三次协商会议在京结束,1985-08-03,1985-08
积极为企业提供法律服务,1985-08-03,1985-08
亲切叙谈三件事,1985-08-03,1985-08
不能再让国家工业物资继续大量被盗,1985-08-03,1985-08
要治治官僚主义,1985-08-03,1985-08
您要订阅人民日报海外版吗？ 请到附近邮局办理订阅手续,1985-08-03,1985-08
我国也应多为少年儿童提供读物,1985-08-03,1985-08
这样的事故再也不能重演了,1985-08-03,1985-08
奇怪的收购价,1985-08-03,1985-08
贬值的文明,1985-08-03,1985-08
吸取教训，废止惩罚学生的做法,1985-08-03,1985-08
商店出售冒牌商品顾客退货反要赔钱,1985-08-03,1985-08
仙桃搬运公司装卸队强做生意漫天要价,1985-08-03,1985-08
贬值的文明,1985-08-03,1985-08
希望阿拉伯首脑会议支持约巴协议,1985-08-03,1985-08
法塔赫中央开会研究难民营局势,1985-08-03,1985-08
印巴表示要为签订和平条约继续努力,1985-08-03,1985-08
哈克重申巴基斯坦不打算拥有核武器,1985-08-03,1985-08
瑞士联邦主席强调瑞士应加入联合国,1985-08-03,1985-08
越南当局灭绝柬埔寨民族的罪恶行径,1985-08-03,1985-08
瑞士决定关闭其驻越南大使馆,1985-08-03,1985-08
塞浦路斯总统接见美特使,1985-08-03,1985-08
泰对美将减少对柬难民援助表示失望,1985-08-03,1985-08
欧洲华人学会举行第三届大会,1985-08-03,1985-08
欢迎中国政府成员,1985-08-03,1985-08
国际要闻简报,1985-08-03,1985-08
老年人大脑仍能发育,1985-08-03,1985-08
日本工厂散记,1985-08-03,1985-08
中国出现了奇迹时代,1985-08-03,1985-08
朝鲜大力发展日用消费品生产,1985-08-03,1985-08
苏联加紧建设国内外信息网络,1985-08-03,1985-08
迪马说苏对欧洲安全问题可能持灵活态度,1985-08-03,1985-08
美国众院再次通过制裁南非议案,1985-08-03,1985-08
步行五千公里抗议长期失业,1985-08-03,1985-08
欧安会最后文件签署十周年庆祝大会闭幕,1985-08-03,1985-08
澳大利亚决定召回驻南非大使,1985-08-03,1985-08
欧安会十年回顾与展望,1985-08-03,1985-08
味虽清淡  余韵不绝,1985-08-03,1985-08
北京舞台上的苏联歌剧《这里黎明静悄悄》,1985-08-03,1985-08
在殷红的热土上开花,1985-08-03,1985-08
郑玄让稿,1985-08-03,1985-08
《中国电视剧》创刊,1985-08-03,1985-08
“百花”出版中年作家选集,1985-08-03,1985-08
彩色故事片《黄河之滨》,1985-08-03,1985-08
随州市经济体制综合改革成效突出,1985-08-04,1985-08
赣州地委分期分批培训乡镇长,1985-08-04,1985-08
果农逐客,1985-08-04,1985-08
沈阳向三家企业发出“破产警戒通告”,1985-08-04,1985-08
八万台进口彩电全不合格,1985-08-04,1985-08
彭真会见毛里求斯议会代表团,1985-08-04,1985-08
排挤迫害坚持原则的会计师赵凡,1985-08-04,1985-08
说比,1985-08-04,1985-08
草原今日那达慕,1985-08-04,1985-08
从四合院到大世界,1985-08-04,1985-08
王口乡巧用资金发展乡镇企业,1985-08-04,1985-08
北京钱路局处分野蛮装卸电冰箱有关人员,1985-08-04,1985-08
环城乡热心为家庭工业服务,1985-08-04,1985-08
沙岭子乡劳动服务公司办得好,1985-08-04,1985-08
服务要到“家”,1985-08-04,1985-08
内蒙古许多不毛之地变绿洲,1985-08-04,1985-08
内乡县群众做买卖心中有数,1985-08-04,1985-08
黄冈地区建成鱼苗生产基地,1985-08-04,1985-08
搞好设备维修确保产品质量,1985-08-04,1985-08
尽快扭转伤亡事故上升局面,1985-08-04,1985-08
以搞活经济为名  行诈骗钱财之实,1985-08-04,1985-08
“好再来”难进门,1985-08-04,1985-08
宁夏上半年工业效益好,1985-08-04,1985-08
上海一批青年甘愿到穷厂挑重担,1985-08-04,1985-08
湖羊有了良种繁育体系,1985-08-04,1985-08
郴州制成五芯活性锡焊丝,1985-08-04,1985-08
吹灰器程序控制系统装置问世,1985-08-04,1985-08
原南京博物院院长姚迁错案得纠正,1985-08-04,1985-08
加紧哈雷彗星观测准备工作,1985-08-04,1985-08
拉萨的达赖书库开放,1985-08-04,1985-08
一百二十家出版社联合举办书市,1985-08-04,1985-08
民进中央摄制一部歌颂教师的电视剧,1985-08-04,1985-08
广东省举办七个华侨、华裔学生夏令营,1985-08-04,1985-08
辽宁省第一届台湾同乡夏令营在锦州开营,1985-08-04,1985-08
服务员冷面待客  辽宁商场让其下岗培训    食品厂假货骗人  荔浦县府责令停产待查（今日首都和各省市区报纸要目）,1985-08-04,1985-08
阿根廷队教练评阿队为何兵败,1985-08-04,1985-08
身有残疾的蒲尔威捐款一万二筹办运动会,1985-08-04,1985-08
“柯达杯”足球赛剪影,1985-08-04,1985-08
中国男篮迎战“黑猫”队输十四分,1985-08-04,1985-08
专家学者触及政治敏感问题,1985-08-04,1985-08
台湾简讯,1985-08-04,1985-08
台湾民众赞许,1985-08-04,1985-08
群情愤慨谴责高雄当局,1985-08-04,1985-08
首座足球场动工,1985-08-04,1985-08
高等院校学生纷纷转系,1985-08-04,1985-08
最具影响力的女企业家,1985-08-04,1985-08
发扬拥军优属的优良传统,1985-08-04,1985-08
一身正气  两袖清风,1985-08-04,1985-08
长沙市政府顾问王甸彬调派犯人干私事,1985-08-04,1985-08
鼓励青年为建设边疆作出新贡献,1985-08-04,1985-08
帮助群众解决具体困难,1985-08-04,1985-08
空军今年招收数千名飞行学员质量超过以往任何一年,1985-08-04,1985-08
广西平南县检察院检察员张敏龙秉公办案受到表彰,1985-08-04,1985-08
出席第四次中日政府成员会议的中国代表团回到北京,1985-08-04,1985-08
刘多荃遗体告别仪式在京举行,1985-08-04,1985-08
黄华会见埃及经济外贸部长,1985-08-04,1985-08
黄华会见马达加斯加卫生部长,1985-08-04,1985-08
不丹朝圣团结束对我国的访问,1985-08-04,1985-08
庆祝加中建交二十五周年,1985-08-04,1985-08
“替补”舰长,1985-08-04,1985-08
普及法律常识好处多,1985-08-04,1985-08
法制宣传队,1985-08-04,1985-08
老师，我们感谢您的教诲！,1985-08-04,1985-08
永恒的激励,1985-08-04,1985-08
名师指路,1985-08-04,1985-08
我爱我的彭老师,1985-08-04,1985-08
把红花献给我的老师,1985-08-04,1985-08
增进了解  发展友谊,1985-08-04,1985-08
民柬部队在金边以西作战,1985-08-04,1985-08
呼吁全面禁止核武器,1985-08-04,1985-08
金边伪政权宣布处于紧急状态,1985-08-04,1985-08
日本原子弹受害者在伦敦种植和平樱桃树,1985-08-04,1985-08
国际要闻简报,1985-08-04,1985-08
美苏宇航员将同飞火星,1985-08-04,1985-08
欢迎中国国际友好联络会代表团,1985-08-04,1985-08
谷牧参观筑波科技博览会,1985-08-04,1985-08
马里总统接见我大使,1985-08-04,1985-08
乌干达总理接见我大使,1985-08-04,1985-08
“资源小国”的资源,1985-08-04,1985-08
访伊斯兰文化之乡,1985-08-04,1985-08
艺术的奇葩  友谊的心香,1985-08-04,1985-08
自建住宅的残疾人,1985-08-04,1985-08
大众化自助洗衣店,1985-08-04,1985-08
流动博物馆,1985-08-04,1985-08
历史名城卡耳马,1985-08-04,1985-08
武汉在改革中前进,1985-08-04,1985-08
牟平县农业银行宏观管住微观搞活信贷,1985-08-05,1985-08
“一分利餐馆”,1985-08-05,1985-08
思想政治工作办法多内容新效果好,1985-08-05,1985-08
坚决追究有关党组织和领导者责任,1985-08-05,1985-08
电子部在四川北京企业全部下放,1985-08-05,1985-08
河南省地方小火电厂蓬勃发展,1985-08-05,1985-08
支持非洲统一组织致力加强非洲国家团结,1985-08-05,1985-08
要为民作主（本报评论）,1985-08-05,1985-08
在晋江假药案的背后,1985-08-05,1985-08
中国队闯入柯达杯八强,1985-08-05,1985-08
值得警觉的倾向,1985-08-05,1985-08
不能盲目发展小型炼钢电炉,1985-08-05,1985-08
不能顾此失彼,1985-08-05,1985-08
实行宏观控制微观搞活方针,1985-08-05,1985-08
处理产品要慎重,1985-08-05,1985-08
辽宁农村畜禽饲养业有新发展,1985-08-05,1985-08
接收和销售工作井然有序,1985-08-05,1985-08
国际高级现代管理讲座结业,1985-08-05,1985-08
阜新市五家国营饭店文明服务,1985-08-05,1985-08
柞水大型溶洞群开始接待游人,1985-08-05,1985-08
大连港离港船多于进港船,1985-08-05,1985-08
别开生面的产品交流会,1985-08-05,1985-08
利用外资要有全盘规划,1985-08-05,1985-08
拉萨“新市民”,1985-08-05,1985-08
长子县有了收麦秸专业户,1985-08-05,1985-08
乾安荞麦远销日本,1985-08-05,1985-08
农民李天佑创汇多,1985-08-05,1985-08
阜宁县发展蘑菇生产前景广阔,1985-08-05,1985-08
社会科学研究单位改革新尝试,1985-08-05,1985-08
我国太阳能利用成绩斐然,1985-08-05,1985-08
一项科学方法  净增百万收益,1985-08-05,1985-08
国际太阳能、风能应用学术会议在北京举行,1985-08-05,1985-08
上海大专院校为郊县代培大学生,1985-08-05,1985-08
全国第二届台胞青年夏令营在厦门结束,1985-08-05,1985-08
漳州实验小学兴办生物馆,1985-08-05,1985-08
青岛工人疗养院治疗腰椎间盘突出有方,1985-08-05,1985-08
《中国行政管理》月刊创刊,1985-08-05,1985-08
摊派成灾  变相敲诈勒索  湖南九家煤炭企业被迫用贷款应酬    经营有道  常卖油盐酱醋  重庆一个闹市商店甘愿做微利生意（今日首都和各省市区报纸要目）,1985-08-05,1985-08
小将奋力拚争  战局瞬息多变,1985-08-05,1985-08
许志强童非分获冠亚军,1985-08-05,1985-08
柯达杯赛第二阶段对阵形势,1985-08-05,1985-08
起点低  路还长,1985-08-05,1985-08
《壮士篇》序,1985-08-05,1985-08
要热情支持新班子担起部队建设重担,1985-08-05,1985-08
电贺世界城市市长和平团结会议,1985-08-05,1985-08
胡启立会见圣马力诺共产党代表团,1985-08-05,1985-08
胡启立会见印度国大党（英迪拉派）总书记,1985-08-05,1985-08
胡启立会见塞内加尔社会党代表团,1985-08-05,1985-08
乔石会见摩洛哥进步与社会主义党代表团,1985-08-05,1985-08
中埃签署长期贸易协定,1985-08-05,1985-08
平凡的岗位  不平凡的事迹,1985-08-05,1985-08
岗位与作为,1985-08-05,1985-08
销毁雪枣坯,1985-08-05,1985-08
合格率为何是零,1985-08-05,1985-08
为了人们的健康,1985-08-05,1985-08
坑害群众  法律不容,1985-08-05,1985-08
一张罚款单,1985-08-05,1985-08
滥施农药  致人中毒,1985-08-05,1985-08
有关违反食品卫生法的处罚,1985-08-05,1985-08
积极发展作为社会主义建设的科学的马克思主义,1985-08-05,1985-08
研究社会主义建设时期的新闻学,1985-08-05,1985-08
简讯,1985-08-05,1985-08
《新闻学刊》创刊号出版,1985-08-05,1985-08
淡化“当官心理”,1985-08-05,1985-08
世界政党问题学术讨论会举行,1985-08-05,1985-08
柬人民将继续斗争把越军赶出柬埔寨,1985-08-05,1985-08
谋求打破中美洲和平谈判僵局,1985-08-05,1985-08
拉美国家关于外债问题的“大陆对话”闭幕,1985-08-05,1985-08
