出售有毒食用油罪恶大要求判罪犯坐牢六万年,1988-05-16,1988-05
英爱就引渡恐怖分子达成协议,1988-05-16,1988-05
杜卡基斯又在两州预选中获胜,1988-05-16,1988-05
一句话新闻,1988-05-16,1988-05
未开垦的处女地,1988-05-16,1988-05
戈尔巴乔夫提倡各种农业承包形式,1988-05-16,1988-05
中美洲国家遭受严重旱灾,1988-05-16,1988-05
巴西探讨债务资本化的利弊,1988-05-16,1988-05
苏一核动力卫星将失控烧毁,1988-05-16,1988-05
去年美向亚洲卷烟出口大增,1988-05-16,1988-05
美国超导材料研究取得进展制成超导纤维和新超导薄膜,1988-05-16,1988-05
美发明微型心脏泵首次试验救活一人,1988-05-16,1988-05
泰制定挽救森林计划,1988-05-16,1988-05
瑞典为护理人员紧缺发愁,1988-05-16,1988-05
健忘图,1988-05-16,1988-05
拨响了远方的竖琴,1988-05-16,1988-05
在碰撞中,1988-05-16,1988-05
灞河在哪里？,1988-05-16,1988-05
元朔山“花儿”会,1988-05-16,1988-05
叶楠的踪迹,1988-05-16,1988-05
希萨诺总统到京杨主席设宴欢迎,1988-05-17,1988-05
北京最大商场建成,1988-05-17,1988-05
黑龙江省实施“南联北开”,1988-05-17,1988-05
各级政府要支持文艺体制改革,1988-05-17,1988-05
中国农业继续发展需要后续政策,1988-05-17,1988-05
云南哀牢山发现大金矿,1988-05-17,1988-05
山东半岛实行全方位开放,1988-05-17,1988-05
肖秧当选为重庆市委书记,1988-05-17,1988-05
岂可乱罚“态度款”,1988-05-17,1988-05
青海一农民采得天然大金块,1988-05-17,1988-05
福州简化三资企业审批手续,1988-05-17,1988-05
本报将出版一部彩色画册两本书,1988-05-17,1988-05
北京地区天气预报,1988-05-17,1988-05
克山商品粮猪收购被统死,1988-05-17,1988-05
不能走回头路（国内短评）,1988-05-17,1988-05
内蒙古配合沿海战略定新规,1988-05-17,1988-05
上海筹建外资工作权威机构,1988-05-17,1988-05
苏北第一个亿元镇宿城再上新台阶,1988-05-17,1988-05
武功山林区遭哄抢盗伐,1988-05-17,1988-05
常德私营业主改办执照纷纷亮相,1988-05-17,1988-05
北京下力气发展电信事业,1988-05-17,1988-05
农家女李翠玲发明发酵肥,1988-05-17,1988-05
强化电冰箱生产的宏观调控,1988-05-17,1988-05
红阳机械厂着力培育企业精神,1988-05-17,1988-05
江苏评出五种优质名特茶,1988-05-17,1988-05
简讯,1988-05-17,1988-05
安太堡的困惑,1988-05-17,1988-05
北京市全力解决小学“二部制”,1988-05-17,1988-05
女总经理姓金,1988-05-17,1988-05
长岛古文化为中华文明上源之一,1988-05-17,1988-05
太原发现大型春秋古墓保存完好,1988-05-17,1988-05
提高企业靠技术进步的比较效益,1988-05-17,1988-05
武汉创办科技企业“孵化器”东湖新技术创业者中心受欢迎,1988-05-17,1988-05
专利工作为沿海发展战略服务,1988-05-17,1988-05
我研制成一台智能计算机,1988-05-17,1988-05
肺癌早期诊断有新方法,1988-05-17,1988-05
一种治视神经萎缩新药疗效高,1988-05-17,1988-05
橡胶新割制在海南垦区研究成功,1988-05-17,1988-05
沈阳一家股份制激光综合医院开业,1988-05-17,1988-05
成都电讯工程学院援藏建电子实验室,1988-05-17,1988-05
谭良德在美再胜洛加尼斯中国队包揽跳水四枚金牌,1988-05-17,1988-05
决战前夕,1988-05-17,1988-05
古巴女排以３∶１战胜中国队,1988-05-17,1988-05
中国羽毛球代表团飞抵吉隆坡,1988-05-17,1988-05
全国围棋团体赛落幕,1988-05-17,1988-05
保选手囊括法艺术体操金牌,1988-05-17,1988-05
东道主称雄蒙古国际柔道赛,1988-05-17,1988-05
又有一些省市报纸自办发行,1988-05-17,1988-05
老舍文艺基金会在京成立,1988-05-17,1988-05
第五届戏剧“梅花奖”在京授奖,1988-05-17,1988-05
加强和改进部队思想教育工作,1988-05-17,1988-05
宁乡农村男女知青当家,1988-05-17,1988-05
韩新亮殴打新闻干部被开除党籍,1988-05-17,1988-05
执法的生命在于公正,1988-05-17,1988-05
军区政委在连队的午餐,1988-05-17,1988-05
胡子昂孙晓村浦洁修请求不再担任民建的领导职务,1988-05-17,1988-05
四川妥善安置退伍军人,1988-05-17,1988-05
坚决支持朝鲜自主和平统一祖国伟大事业,1988-05-17,1988-05
阿方辛结束访华回国,1988-05-17,1988-05
简讯,1988-05-17,1988-05
让万千细胞充满活力,1988-05-17,1988-05
奇妙的文学三角,1988-05-17,1988-05
漫议批评的“热”,1988-05-17,1988-05
芳香馥郁的异花,1988-05-17,1988-05
苏联开始从阿富汗撤军,1988-05-17,1988-05
美就诺列加辞职又作让步  巴拿马宣布明年如期大选,1988-05-17,1988-05
在探索中前进的莫桑比克,1988-05-17,1988-05
苏撤军是阿人民和世界人民的胜利,1988-05-17,1988-05
炳总理前往苏联东欧访问,1988-05-17,1988-05
以占区爆发大罢工,1988-05-17,1988-05
以空袭黎南部巴游击队营地,1988-05-17,1988-05
南斯拉夫选出联邦主席团和议会新任主席,1988-05-17,1988-05
中导条约节外生枝与莫斯科首脑会晤,1988-05-17,1988-05
一句话新闻,1988-05-17,1988-05
捷共总书记雅克什接见我大使,1988-05-17,1988-05
我大使向南联邦主席团主席递交国书,1988-05-17,1988-05
华约组织军事委员会举行会议,1988-05-17,1988-05
葛罗米柯结束对罗马尼亚访问,1988-05-17,1988-05
美希基地谈判仍然未达成协议,1988-05-17,1988-05
贝尔法斯特发生一起恐怖行动,1988-05-17,1988-05
改革推动着中国经济发展,1988-05-17,1988-05
“波音—７４７”完成不着陆飞行,1988-05-17,1988-05
南斯拉夫制定新外资法草案,1988-05-17,1988-05
蒙古鼓励和支持公民从事个体劳动,1988-05-17,1988-05
梦想终于变成现实,1988-05-17,1988-05
企业私有化浪潮遍及许多国家,1988-05-17,1988-05
日本科学家研制出人工腱,1988-05-17,1988-05
西德治疗血癌有重大进展,1988-05-17,1988-05
接受五个器官移植的女孩夭折,1988-05-17,1988-05
苏联研制出激光发动机,1988-05-17,1988-05
巴西医生使矮人长高,1988-05-17,1988-05
吃风探源,1988-05-17,1988-05
挂盘,1988-05-17,1988-05
心无旁骛,1988-05-17,1988-05
我看《火神与秋女》,1988-05-17,1988-05
生活的酸甜苦辣,1988-05-17,1988-05
心无旁鹜,1988-05-17,1988-05
冠豸山,1988-05-17,1988-05
依法惩处流通渠道的“扒手”（本报评论）,1988-05-18,1988-05
今日武陟黄河滩,1988-05-18,1988-05
渭北旱原成为小麦生产基地,1988-05-18,1988-05
我外贸出口额激增,1988-05-18,1988-05
北京查处一起非法倒卖农膜案,1988-05-18,1988-05
坚持执行正确政策就会取得成效,1988-05-18,1988-05
李鹏同希萨诺举行会谈,1988-05-18,1988-05
杨尚昆会见赤几客人,1988-05-18,1988-05
胡启立等谈文艺团体改革,1988-05-18,1988-05
捷共总书记雅克什将访华,1988-05-18,1988-05
常香玉承包河南省豫剧一团,1988-05-18,1988-05
四川白沙工农区发生剧烈山崩,1988-05-18,1988-05
我三百体育精英将出征奥运会,1988-05-18,1988-05
北京地区天气预报,1988-05-18,1988-05
唐山农民进城承包国营企业成功,1988-05-18,1988-05
论“用足政策”,1988-05-18,1988-05
农村劳力转移任务仍艰巨,1988-05-18,1988-05
中国工业经济协会首届年会开幕,1988-05-18,1988-05
“冒牌”的微笑,1988-05-18,1988-05
熊猫电子集团在京展示产品,1988-05-18,1988-05
天津会议服务处受欢迎经济效益社会效益均优,1988-05-18,1988-05
中外合作消费品检测中心协议签署,1988-05-18,1988-05
深化经济改革促进企业家成长,1988-05-18,1988-05
吉林市化妆品厂攻克质量关,1988-05-18,1988-05
改革，是他主要的专业,1988-05-18,1988-05
无锡微电子公司探索新体制,1988-05-18,1988-05
汉语“珠联式”输入技术及其汉卡面世,1988-05-18,1988-05
福建师大试行“中期选拔制”,1988-05-18,1988-05
雁北地区致力提高小学教师素质,1988-05-18,1988-05
金色的梦和金色的理想,1988-05-18,1988-05
亚洲女新闻工作者在京召开研讨会,1988-05-18,1988-05
法大使为中国作家代表团举行招待会,1988-05-18,1988-05
中国儿童少年活动中心将设立“希望之星”奖,1988-05-18,1988-05
槐树庙学校开新篇办场三月收入八千,1988-05-18,1988-05
简讯,1988-05-18,1988-05
《何长工回忆录》出版,1988-05-18,1988-05
上海工大和科大联合创办计算机学院,1988-05-18,1988-05
中国女队负于南朝鲜队痛失决赛权,1988-05-18,1988-05
“向奥运会进军——拳击国手赛”开场,1988-05-18,1988-05
波兰公布参加奥运会项目,1988-05-18,1988-05
奥运会非洲区网球预选赛结束,1988-05-18,1988-05
中国羽球队赛前训练引人注目,1988-05-18,1988-05
“蓝色旋风”——德雷,1988-05-18,1988-05
山东多层次发挥离退干部作用,1988-05-18,1988-05
湖南省广泛开展国防教育,1988-05-18,1988-05
来京探亲观光的台胞已逾两万人,1988-05-18,1988-05
锦旗生意异军突起价格看涨，喜？浪费财物粉饰人情荣誉贬值，忧！,1988-05-18,1988-05
愿这类报道不再是新闻,1988-05-18,1988-05
雄县用正反典型教育党员,1988-05-18,1988-05
沈阳铁路局有的放矢开展思想工作,1988-05-18,1988-05
济南军区７１个团以上单位将与驻地城镇同步房改,1988-05-18,1988-05
简讯,1988-05-18,1988-05
威胁我长白山林区的朝鲜林火被扑灭,1988-05-18,1988-05
李鹏会见日本海外经济协力基金总裁,1988-05-18,1988-05
黄立清遗体告别仪式在京举行,1988-05-18,1988-05
生命，在黑与绿之间,1988-05-18,1988-05
“我太伤心啦！”,1988-05-18,1988-05
真作孽！,1988-05-18,1988-05
好大方！,1988-05-18,1988-05
高良佐见义勇为是对我们的鞭策,1988-05-18,1988-05
不要强迫农民种烟,1988-05-18,1988-05
关于高良佐果园纠纷问题的处理情况,1988-05-18,1988-05
现代社会调查预测讲习班招生启事,1988-05-18,1988-05
为孩子治沙眼疥疮,1988-05-18,1988-05
关心交通民警的身体健康,1988-05-18,1988-05
候车室当旅馆乘客露宿街头,1988-05-18,1988-05
长期加班我们受不了,1988-05-18,1988-05
要对孩子负责,1988-05-18,1988-05
编者按,1988-05-18,1988-05
破坏的耕地已平复扶垄起垠准备种植,1988-05-18,1988-05
干部挪用集资办学款赚钱,1988-05-18,1988-05
这岂能叫作“非法着装”？,1988-05-18,1988-05
一份伤残证值十元钱吗？,1988-05-18,1988-05
摩洛哥和阿尔及利亚复交,1988-05-18,1988-05
巴拿马再度宣布紧急状态,1988-05-18,1988-05
苏巴将严格遵守日内瓦协议,1988-05-18,1988-05
拙劣的辩解,1988-05-18,1988-05
联合国监督组观察苏联撤军,1988-05-18,1988-05
一句话新闻,1988-05-18,1988-05
南朝鲜大学生呼吁举行南北学生会谈,1988-05-18,1988-05
美参院将辩论批准美苏中导条约,1988-05-18,1988-05
金庙被围八天冲突仍在继续,1988-05-18,1988-05
黎巴嫩两派民兵继续交火,1988-05-18,1988-05
瓦努阿图发生暴力示威,1988-05-18,1988-05
巴总统齐亚·哈克会见我大使,1988-05-18,1988-05
丹麦与北约的关系更形复杂,1988-05-18,1988-05
法总理向新喀岛派出工作团,1988-05-18,1988-05
南非工会大会特别大会闭幕,1988-05-18,1988-05
希腊抗议土美飞机侵犯领空,1988-05-18,1988-05
印巴举行非法越境问题谈判,1988-05-18,1988-05
苏红旗太平洋舰队访问朝鲜,1988-05-18,1988-05
西德英意三国研制新歼击机,1988-05-18,1988-05
今年平均增长率可达百分之三,1988-05-18,1988-05
“小吉普”探管道,1988-05-18,1988-05
世界食糖价格可能大涨,1988-05-18,1988-05
英镑对西德马克汇价又升,1988-05-18,1988-05
美国利率为何攀升,1988-05-18,1988-05
比培育出抗除草剂甜菜,1988-05-18,1988-05
欧共体财长就资本自由流通意见趋于一致,1988-05-18,1988-05
埃及和以色列出现高温天气,1988-05-18,1988-05
苏联在社会主义理论方面已形成新观点,1988-05-18,1988-05
能听写的机器人,1988-05-18,1988-05
英发明检查部件暗伤新方法,1988-05-18,1988-05
家家有本“难念的经”,1988-05-18,1988-05
海边，一位摄影者,1988-05-18,1988-05
故乡的山,1988-05-18,1988-05
美国文坛的巨人,1988-05-18,1988-05
我国企业集团在改革中发展,1988-05-19,1988-05
一件富有历史意义的大事（本报评论）,1988-05-19,1988-05
内蒙古积极支援国家建设,1988-05-19,1988-05
邓小平会见希萨诺,1988-05-19,1988-05
杨尚昆会见朝军事代表团,1988-05-19,1988-05
中国文联主席团在京举行会议,1988-05-19,1988-05
武昌火车站压缩会议用票,1988-05-19,1988-05
万里会见美洲基民组织代表团,1988-05-19,1988-05
巴基斯坦总统将访华,1988-05-19,1988-05
三大碱厂进入设备安装高潮,1988-05-19,1988-05
淄博织染厂产品远销海外,1988-05-19,1988-05
丰山铜矿发生一起冒顶事故,1988-05-19,1988-05
谁来收拾这个“烂摊子”,1988-05-19,1988-05
北京地区天气预报,1988-05-19,1988-05
大秦铁路一期工程为何受阻,1988-05-19,1988-05
沈阳成立金杯汽车股份公司资产全部采用股票方式筹集,1988-05-19,1988-05
我国扶贫资金使用发生重大变化,1988-05-19,1988-05
河南物资市场形成开放式流通网络,1988-05-19,1988-05
京沪杭电信大通路被阻断５小时２８分,1988-05-19,1988-05
全国烹饪技术比赛闭幕,1988-05-19,1988-05
租赁后职工仍是企业主人,1988-05-19,1988-05
山东电缆厂跃居优秀企业行列,1988-05-19,1988-05
抚顺试办出口创汇工业区,1988-05-19,1988-05
研究尽快扑灭太西矿地火,1988-05-19,1988-05
租赁者要学会做人的工作,1988-05-19,1988-05
简讯,1988-05-19,1988-05
贵在“人和”,1988-05-19,1988-05
骆驼新传,1988-05-19,1988-05
出版者，请记住你的社会责任,1988-05-19,1988-05
北京千余校外教育点成青少年乐园,1988-05-19,1988-05
我建成全国性卫星多普勒网,1988-05-19,1988-05
杰出作家沈从文告别亲友读者,1988-05-19,1988-05
乾县发现秦甘泉宫和梁山宫遗址,1988-05-19,1988-05
襄樊公费医疗浪费减少,1988-05-19,1988-05
今年自然科学基金申请逾万项,1988-05-19,1988-05
教科文零讯,1988-05-19,1988-05
企业家张果喜捐款支援文教,1988-05-19,1988-05
新型防腐蚀复合管研制成功,1988-05-19,1988-05
奥运会报名人数创历史纪录参加比赛运动员已超过万人,1988-05-19,1988-05
东道主的雄心,1988-05-19,1988-05
思想负担过重心理调节不当,1988-05-19,1988-05
苏男篮伤病多夺标艰难,1988-05-19,1988-05
全国力士杯健美赛落幕,1988-05-19,1988-05
全国体委主任座谈会在京召开,1988-05-19,1988-05
北京军区集训师旅以上指挥员,1988-05-19,1988-05
领导要做表率党员要从自身做起,1988-05-19,1988-05
我国加快经济立法,1988-05-19,1988-05
呼吁台湾当局严惩犯罪分子,1988-05-19,1988-05
我对阿尔及利亚与摩洛哥复交表示祝贺,1988-05-19,1988-05
费彝民先生在香港逝世,1988-05-19,1988-05
中国同莫桑比克签署经济技术合作协定,1988-05-19,1988-05
姬鹏飞会见香港基本法咨委会交流访问团,1988-05-19,1988-05
法学界座谈香港基本法草案征求意见稿,1988-05-19,1988-05
邓颖超等会见日本客人,1988-05-19,1988-05
薄一波会见瑞士客人,1988-05-19,1988-05
希萨诺参观成都沼气研究中心,1988-05-19,1988-05
简讯,1988-05-19,1988-05
鲎试剂,1988-05-19,1988-05
磨难虽多心无瑕,1988-05-19,1988-05
富春同志，你与春天同在,1988-05-19,1988-05
人生实难，所贵者丹,1988-05-19,1988-05
喜闻阿摩复交（国际短评）,1988-05-19,1988-05
国际行动理事会在莫斯科开会,1988-05-19,1988-05
田纪云副总理抵加拿大访问,1988-05-19,1988-05
洛杉矶市长设宴欢迎田纪云副总理,1988-05-19,1988-05
阿盟秘书长祝贺阿摩复交,1988-05-19,1988-05
泰国总理访问苏联,1988-05-19,1988-05
政府难以同瓦文萨会谈,1988-05-19,1988-05
首批侵阿苏军撤回苏境,1988-05-19,1988-05
里根否认靠占星术确定日程,1988-05-19,1988-05
哥伦比亚一当选市长被杀害,1988-05-19,1988-05
苏联导弹推进器制造厂爆炸,1988-05-19,1988-05
阿塞拜疆暴乱肇事者被判刑,1988-05-19,1988-05
印度治安部队冲进金庙,1988-05-19,1988-05
巴拿马政府拒绝接受,1988-05-19,1988-05
一句话新闻,1988-05-19,1988-05
南斯拉夫领导人接见我公安部长,1988-05-19,1988-05
玻利维亚总统接见我大使,1988-05-19,1988-05
埃及总理接见我大使,1988-05-19,1988-05
难产的宪法,1988-05-19,1988-05
关于美国发表的两份战略报告,1988-05-19,1988-05
全党要创造性地完成改革任务,1988-05-19,1988-05
援助发展中国家要优先考虑环境保护,1988-05-19,1988-05
改革意味着从幼维和左倾观点中解放出来,1988-05-19,1988-05
凯歌能否在戛纳奏响,1988-05-19,1988-05
进一步深化科技体制改革重点推行承包经营责任制,1988-05-20,1988-05
中央有信心和把握搞好物价改革,1988-05-20,1988-05
李鹏主持国务院第五次常务会议,1988-05-20,1988-05
李先念会见保加利亚祖国阵线代表团,1988-05-20,1988-05
绝不容许横行霸道（本报评论）,1988-05-20,1988-05
广西决定节俭纪念自治区生日,1988-05-20,1988-05
兰州办新技术实业开发区,1988-05-20,1988-05
“南水北调”西线工程开始前期准备,1988-05-20,1988-05
我国又发现一个“金三角”,1988-05-20,1988-05
四川白沙工农区山崩继续发展,1988-05-20,1988-05
我国南北方旱情已缓和,1988-05-20,1988-05
“有益、无害、销得出”,1988-05-20,1988-05
北京地区天气预报,1988-05-20,1988-05
广汉县精兵简政促进经济发展,1988-05-20,1988-05
万树户,1988-05-20,1988-05
化肥企业力争完成８５００万吨任务,1988-05-20,1988-05
株洲矿筛厂靠科技进步起飞,1988-05-20,1988-05
征管个人收入调节税有进展法制观念增强征收款额上升,1988-05-20,1988-05
赞“科技兴企”,1988-05-20,1988-05
落实外商投资企业用人自主权,1988-05-20,1988-05
推选驾引优秀人才促进水上航行安全,1988-05-20,1988-05
阜新请外地先进企业对口帮带,1988-05-20,1988-05
简讯,1988-05-20,1988-05
广东儿童玩具工业发展迅速,1988-05-20,1988-05
葡萄不爬架果实依然肥,1988-05-20,1988-05
让农民少些忧虑（国内短评）,1988-05-20,1988-05
请不要再拖欠俺们的卖粮款,1988-05-20,1988-05
去年的超购棉加价款何时有,1988-05-20,1988-05
南大教改注重培养实干型人才,1988-05-20,1988-05
拚抢,1988-05-20,1988-05
主张学校办产业有固定收入莫把创收担子压在教师身上,1988-05-20,1988-05
我国将首次举办国际发明展览,1988-05-20,1988-05
中学生日常行为规范,1988-05-20,1988-05
何方神怪乱学堂,1988-05-20,1988-05
首都博士后举行学术年会李政道到会祝与会者成功,1988-05-20,1988-05
“中国戏剧大奖”今年开评,1988-05-20,1988-05
新型汉字识别和语音处理系统,1988-05-20,1988-05
四国女排赛拉开战幕中古队均遇强劲挑战,1988-05-20,1988-05
中国羽手球队能再捧双杯吗？,1988-05-20,1988-05
全国足球甲级队联赛  第一阶段分区赛结束,1988-05-20,1988-05
中国水球队进军奥运会步履艰难,1988-05-20,1988-05
战局起伏令观众一饱眼福打情绪球古巴队险些翻船,1988-05-20,1988-05
沿海地区司法行政部门积极开展工作,1988-05-20,1988-05
战士家长要珍惜军属荣誉,1988-05-20,1988-05
天津“两会”期间急事急办,1988-05-20,1988-05
无锡群众富裕不忘国防四年送七千名子弟从军,1988-05-20,1988-05
洛宁重视安置残疾人就业,1988-05-20,1988-05
为什么有法不用？,1988-05-20,1988-05
王会民反映滦县大吃大喝问题后遭解职,1988-05-20,1988-05
台胞赴大陆经商何罪之有？,1988-05-20,1988-05
松花江水位持续上涨五千子弟兵抢修江堤,1988-05-20,1988-05
乌鲁木齐银川西宁等地穆斯林欢庆开斋节,1988-05-20,1988-05
上海破获盗美领事馆大案,1988-05-20,1988-05
希萨诺在成都会见中国厨师,1988-05-20,1988-05
联邦德国向中国提供援助,1988-05-20,1988-05
简讯,1988-05-20,1988-05
普洱之乡的“误会”,1988-05-20,1988-05
陈伯仲遗体告别仪式在京举行,1988-05-20,1988-05
大变动再认识,1988-05-20,1988-05
发展企业产权转让市场的政策研究,1988-05-20,1988-05
裁军重点是战略武器问题,1988-05-20,1988-05
苏报说苏对外政策犯过许多错误,1988-05-20,1988-05
经济机制综合改革稳步前进,1988-05-20,1988-05
游击队将首先夺取贾拉拉巴德市,1988-05-20,1988-05
南朝鲜人民纪念光州起义八周年,1988-05-20,1988-05
南朝鲜“三金”举行会谈,1988-05-20,1988-05
尼政府与反政府武装同意再次谈判,1988-05-20,1988-05
一句话新闻,1988-05-20,1988-05
金庙锡克教武装分子投降,1988-05-20,1988-05
斋月小议,1988-05-20,1988-05
戈尔巴乔夫会见西德的经济部长,1988-05-20,1988-05
里根同以外长讨论中东和平计划,1988-05-20,1988-05
企图暗杀杰克逊的一对夫妇被捕,1988-05-20,1988-05
塞内加尔总统宣布解除紧急状态,1988-05-20,1988-05
苏联一艘客轮在日本大阪港失火,1988-05-20,1988-05
世界人口剧增正加速环境破坏,1988-05-20,1988-05
水中对话机,1988-05-20,1988-05
盲人阅读普通书刊装置,1988-05-20,1988-05
坦诚合作结硕果,1988-05-20,1988-05
太平洋经济合作会议在日开幕,1988-05-20,1988-05
号召各国控制人口增长,1988-05-20,1988-05
太平洋经济合作会议,1988-05-20,1988-05
苏联反酗酒运动三年,1988-05-20,1988-05
一个爱国的作家,1988-05-20,1988-05
灯戏：闹隍会,1988-05-20,1988-05
真戏在民间,1988-05-20,1988-05
深沉·凝重·炽烈,1988-05-20,1988-05
渴盼,1988-05-20,1988-05
歌坛的希望之星,1988-05-20,1988-05
北京在中关村办试验区大规模开发新技术产业,1988-05-21,1988-05
彭水县领导干部竟带头建私房,1988-05-21,1988-05
河南将建特大型铝工业基地,1988-05-21,1988-05
解放思想放胆去干（本报评论）,1988-05-21,1988-05
社会不正之风吹进校园严重侵蚀中小学生思想,1988-05-21,1988-05
中法专家合作改造上海旧城区,1988-05-21,1988-05
人民日报驻海南记者站成立,1988-05-21,1988-05
书记和厂长“内战”升级,1988-05-21,1988-05
艺术表演团体体改方案渐趋完善,1988-05-21,1988-05
录音机的妙用,1988-05-21,1988-05
北京地区天气预报,1988-05-21,1988-05
各地清查对外经济合同工作见效,1988-05-21,1988-05
厂长胡明辉获重奖处境艰难万元奖金无法满足八方求索,1988-05-21,1988-05
又一批“三资”企业落户首都,1988-05-21,1988-05
南阳卷烟厂压非生产开支后劲猛增,1988-05-21,1988-05
开发贫困地区同沿海发展战略相结合,1988-05-21,1988-05
根深才能叶茂,1988-05-21,1988-05
简讯,1988-05-21,1988-05
北京第三棉纺厂节水有方,1988-05-21,1988-05
江阴研制成吹膜彩印复合组合机,1988-05-21,1988-05
中美合资ＡＣＢ国际有限公司成立,1988-05-21,1988-05
唐山市建设银行举办房地产信贷,1988-05-21,1988-05
中国银行首次提供出口买方信贷,1988-05-21,1988-05
开河疏渠看“个体”,1988-05-21,1988-05
广东省九年投资四十亿元全省中小学校舍面貌一新,1988-05-21,1988-05
今年高考复习范围和题型均明确,1988-05-21,1988-05
小学生日常行为规范,1988-05-21,1988-05
北京纪念鲁艺建校５０周年,1988-05-21,1988-05
全国劳动模范王永民新创造王码繁体汉字电脑系统问世,1988-05-21,1988-05
北京少儿社精心为孩子出书,1988-05-21,1988-05
我国第一所蒙文大专学校成立,1988-05-21,1988-05
十七省市在京展销新型玩具,1988-05-21,1988-05
北京举办第二届发明展览会中小学生发明成果引人注目,1988-05-21,1988-05
教科文零讯,1988-05-21,1988-05
古巴女排战胜中国队夺冠四国精英明移师南京再战,1988-05-21,1988-05
印尼羽毛球领队宣称要夺回汤杯,1988-05-21,1988-05
上海将举行国际女垒赛,1988-05-21,1988-05
中外少年国际象棋赛将在京举行,1988-05-21,1988-05
奥林匹克日长跑活动将于６月举行,1988-05-21,1988-05
建立有活力的体育体制,1988-05-21,1988-05
中国羽毛球队能再捧双杯吗？,1988-05-21,1988-05
大陆现有６０岁以上老人九千万,1988-05-21,1988-05
武警江西总队杜绝有偿执勤,1988-05-21,1988-05
调节人际关系缓解社会矛盾,1988-05-21,1988-05
从河北看改革与风气,1988-05-21,1988-05
武警北京总队七百余战士回到执勤岗位,1988-05-21,1988-05
加强同第三世界合作是我国对外政策基石,1988-05-21,1988-05
台湾舆论要求对劫机犯依法制裁,1988-05-21,1988-05
提一个问题,1988-05-21,1988-05
全国政协举行在京委员活动日,1988-05-21,1988-05
谭绍文当选为天津市政协主席,1988-05-21,1988-05
莫桑比克总统离京赴平壤,1988-05-21,1988-05
中苏两国友协１９８８年—１９８９年合作计划签字,1988-05-21,1988-05
简讯,1988-05-21,1988-05
他努力塑造民警的良好形象,1988-05-21,1988-05
我的得意和羞愧,1988-05-21,1988-05
岳西渴望大学毕业生,1988-05-21,1988-05
应追究，也须自省,1988-05-21,1988-05
李富华慷慨解囊兴义学,1988-05-21,1988-05
警惕：有害的假冒茶油,1988-05-21,1988-05
危险：街头作“血型鉴定”,1988-05-21,1988-05
注意：学生中的结核病,1988-05-21,1988-05
小心：村寨发生火灾,1988-05-21,1988-05
汤山温泉濒临枯竭,1988-05-21,1988-05
盼输送实用科技读物,1988-05-21,1988-05
盼新闻片科教片下乡,1988-05-21,1988-05
盼喝上清洁卫生的水,1988-05-21,1988-05
踢皮球乡领导见火不救保青山子弟兵奋勇向前,1988-05-21,1988-05
怎样安全使用石油液化气,1988-05-21,1988-05
加拿大总理马尔罗尼会见田纪云,1988-05-21,1988-05
船漏偏怨帆儿破,1988-05-21,1988-05
