雅克什访华对发展捷中关系意义重大,1988-05-21,1988-05
顾左右而言他,1988-05-21,1988-05
苏美讨论南部非洲和平问题,1988-05-21,1988-05
巴拿马断绝同美国的军事联系,1988-05-21,1988-05
法国确定同伊朗复交谈判代表,1988-05-21,1988-05
里根希望参院批准中导条约,1988-05-21,1988-05
戈尔巴乔夫会见炳·廷素拉暖,1988-05-21,1988-05
一句话新闻,1988-05-21,1988-05
匈党全国代表会议开幕,1988-05-21,1988-05
南朝鲜人民为赵成万举行葬礼,1988-05-21,1988-05
奥野为侵略翻案遭许多日本人反对,1988-05-21,1988-05
拉美八国集团外长将举行会议,1988-05-21,1988-05
斯里兰卡执政党总书记被暗杀,1988-05-21,1988-05
利比亚的正规军同雇佣军交火,1988-05-21,1988-05
苏联军用飞机训练时炸弹掉落,1988-05-21,1988-05
一万名阿拉伯人遭以色列监禁,1988-05-21,1988-05
人口增长过快与过分集中值得关注,1988-05-21,1988-05
进一步协调政策减少国际贸易不平衡,1988-05-21,1988-05
英镑汇率之争暂告平息,1988-05-21,1988-05
将就建立正式关系达成协议,1988-05-21,1988-05
西方股市仍波动不已,1988-05-21,1988-05
亚洲“四小”纺织服装业的转移趋势,1988-05-21,1988-05
美科学家认为火星上曾有生命存在,1988-05-21,1988-05
没有货主的“货物”,1988-05-21,1988-05
话说“算总帐”,1988-05-21,1988-05
“龙羊”印象〔丝网版画〕,1988-05-21,1988-05
“漓江”甘苦,1988-05-21,1988-05
“若是章，便不是句”,1988-05-21,1988-05
写不出题目的小事,1988-05-21,1988-05
眺望,1988-05-21,1988-05
上海文化系统将全部实行聘任制,1988-05-22,1988-05
国际招标公司领导受通报批评,1988-05-22,1988-05
杨尚昆强调全军共同努力搞好改革,1988-05-22,1988-05
我博士后研究工作逐年发展,1988-05-22,1988-05
１５部国产动画片将展播,1988-05-22,1988-05
发挥舆论监督作用（本报评论）,1988-05-22,1988-05
保定地区交通局长周志远被拘传到京,1988-05-22,1988-05
贵州谋划发展民族地区经济,1988-05-22,1988-05
海峡两岸间接贸易激增,1988-05-22,1988-05
江苏１３个穷县变成粮棉基地,1988-05-22,1988-05
长白山林区扑灭一场林火,1988-05-22,1988-05
多一些阳光多一些透明,1988-05-22,1988-05
北京地区天气预报,1988-05-22,1988-05
粤北山地走上企业化经营轨道,1988-05-22,1988-05
要善于“借势”,1988-05-22,1988-05
新民站设立“商品经济档案”,1988-05-22,1988-05
石德段建成“安全放心线路”,1988-05-22,1988-05
鄂西农民放胆生产迅速脱贫,1988-05-22,1988-05
天府之国急起走向国际市场,1988-05-22,1988-05
加快技术进步扩大纺织品出口,1988-05-22,1988-05
峪耳崔金矿遭到严重破坏,1988-05-22,1988-05
淮河治理成就显著,1988-05-22,1988-05
中国掺茶第一人,1988-05-22,1988-05
梁山泊“忠义堂”落成,1988-05-22,1988-05
需要遵循哪些国际惯例,1988-05-22,1988-05
中学督导评估小学减轻课业,1988-05-22,1988-05
从事第二职业的人们,1988-05-22,1988-05
方秀云承包哈尔滨职工建工学院,1988-05-22,1988-05
第二批国家级自然保护区公布,1988-05-22,1988-05
人过中年想什么？,1988-05-22,1988-05
清华大学图书馆新馆奠基,1988-05-22,1988-05
做儿童中心小主人红领巾理事会成立,1988-05-22,1988-05
安子介袁晓园学术思想研讨会在南昌举行,1988-05-22,1988-05
中国剧协组织演员赴井冈山老区慰问,1988-05-22,1988-05
北京颁发“科技园丁奖”,1988-05-22,1988-05
湘鄂西革命根据地历史研究会成立,1988-05-22,1988-05
《经济发展和经济改革》一书出版,1988-05-22,1988-05
著名冶金学家铸造学家王遵明病逝,1988-05-22,1988-05
张文东力克群雄夺冠,1988-05-22,1988-05
汤杯尤杯大赛准备工作就绪,1988-05-22,1988-05
南朝鲜选手夺得亚乒赛混双冠军,1988-05-22,1988-05
举重“神童”被允许参加奥运会,1988-05-22,1988-05
中日美三教头谈世界女排现状,1988-05-22,1988-05
朝鲜乒乓球队退出亚乒赛回国,1988-05-22,1988-05
海峡两岸健美运动发展迅速,1988-05-22,1988-05
江口建立群众投信任票制度,1988-05-22,1988-05
沈阳军区四百多团以上干部带头学法,1988-05-22,1988-05
海航为经济建设作贡献,1988-05-22,1988-05
信阳地区开展“党员评格”活动,1988-05-22,1988-05
固镇县乡乡办党校,1988-05-22,1988-05
上海企业党组织属地管理取得经验,1988-05-22,1988-05
台湾农民和警察发生冲突,1988-05-22,1988-05
国际安全讨论会在京召开,1988-05-22,1988-05
强烈要求台湾当局严惩劫机犯,1988-05-22,1988-05
中国人民抗日战争纪念馆将扩建,1988-05-22,1988-05
简讯,1988-05-22,1988-05
巴苏大夫骨灰安放仪式在石家庄举行,1988-05-22,1988-05
买房人的心态,1988-05-22,1988-05
马思聪,1988-05-22,1988-05
延安瑞雪,1988-05-22,1988-05
谈判应建立在相互尊重基础上,1988-05-22,1988-05
光州十万民众示威,1988-05-22,1988-05
美国公布美苏首脑会谈日程,1988-05-22,1988-05
非统组织部长理事会开会,1988-05-22,1988-05
第六届太平洋经济合作会议闭幕,1988-05-22,1988-05
埃及苏联关系的新发展,1988-05-22,1988-05
戈尔巴乔夫会见埃及外长,1988-05-22,1988-05
雅鲁泽尔斯基会见我工会代表团,1988-05-22,1988-05
芬兰总统接见宋健,1988-05-22,1988-05
葛罗米柯主席会见黄华,1988-05-22,1988-05
近６０个国家面临非洲蝗灾威胁,1988-05-22,1988-05
持续半月的贝鲁特南郊战斗,1988-05-22,1988-05
突尼斯总统同阿拉法特举行会谈,1988-05-22,1988-05
阿拉伯被占领土又发生反以斗争,1988-05-22,1988-05
新加坡要求美国召回一名外交官,1988-05-22,1988-05
尼泊尔教育和文化大臣引咎辞职,1988-05-22,1988-05
印锡克教徒拒绝向政府作出承诺,1988-05-22,1988-05
布隆迪政府表示巴加扎可以回国,1988-05-22,1988-05
一句话新闻,1988-05-22,1988-05
榨橄榄油（雕塑）,1988-05-22,1988-05
博学多才的总统——密特朗,1988-05-22,1988-05
捷克斯洛伐克风情,1988-05-22,1988-05
占星术是否进入白宫的议论,1988-05-22,1988-05
苏联中央电视台在变,1988-05-22,1988-05
噪音与收成,1988-05-22,1988-05
“人头税”之争,1988-05-22,1988-05
反劫机的种种设想,1988-05-22,1988-05
奇异装置减车祸,1988-05-22,1988-05
我国人口出生率回升的原因,1988-05-22,1988-05
冯玉祥珍藏毛泽东的名片,1988-05-22,1988-05
农村劳力素质越高转移门路越多,1988-05-22,1988-05
从音乐哲理的角度看《琵琶行》,1988-05-22,1988-05
不可低估城市的超低空污染,1988-05-22,1988-05
日本天然雨水的利用,1988-05-22,1988-05
历史上实无西施其人,1988-05-22,1988-05
油炸食品与铝毒,1988-05-22,1988-05
如果能成功移植下丘脑人可活到３００岁,1988-05-22,1988-05
既研究国情又了解世界（本报评论）,1988-05-23,1988-05
广东纪检部门当好改革开放卫士,1988-05-23,1988-05
东西部联合开发贫困地区拉开序幕,1988-05-23,1988-05
国营蔬菜公司主导作用不能削弱,1988-05-23,1988-05
四川完善农村双层经营责任制,1988-05-23,1988-05
扶贫工作一大进步（国内短评）,1988-05-23,1988-05
李鹏会见并宴请居内久,1988-05-23,1988-05
李瑞环再次当选为天津市长吴振当选市人大常委会主任,1988-05-23,1988-05
捷共总书记雅克什,1988-05-23,1988-05
闽北遭受特大暴雨袭击,1988-05-23,1988-05
我四个气象基地加紧建设,1988-05-23,1988-05
苏浙川皖携手合作防止再现蚕茧大战,1988-05-23,1988-05
北京地区天气预报,1988-05-23,1988-05
幼芽自需依势长,1988-05-23,1988-05
济南供销系统实行全员抵押承包,1988-05-23,1988-05
沈阳鼓励个人转租临街房办商业增添三千营业网点政府未掏分文,1988-05-23,1988-05
决策者应扭转“城市偏向”,1988-05-23,1988-05
企业兼并在武汉,1988-05-23,1988-05
兼并要依循法律手续（国内短评）,1988-05-23,1988-05
十八里店乡靠人才起飞成为京郊农村一颗明珠,1988-05-23,1988-05
南京用科技丰富了菜篮子,1988-05-23,1988-05
青县制定创汇农业新措施,1988-05-23,1988-05
我国首家重型汽车中外合资企业成立,1988-05-23,1988-05
加紧培养林业人才,1988-05-23,1988-05
简讯,1988-05-23,1988-05
广东机电产品出口势头好,1988-05-23,1988-05
个体户“吃掉”镇办厂,1988-05-23,1988-05
千湖之省水污染渔业资源告急,1988-05-23,1988-05
鉴定会的鉴定,1988-05-23,1988-05
南京工学院与企业联合培养兼通技术外贸人才,1988-05-23,1988-05
中国逻辑与语言函授大学与首都六所高校合办函大,1988-05-23,1988-05
北方城市青少年思想教育研讨会在京召开,1988-05-23,1988-05
华中理工大学按系招生入学二三年后再定专业,1988-05-23,1988-05
太原开设专科门诊治“梅核气”病,1988-05-23,1988-05
大陆录像带流行台湾,1988-05-23,1988-05
电视剧《雪泉》在台儿庄开拍,1988-05-23,1988-05
北京展出新绛民间艺术,1988-05-23,1988-05
京津汉穗群众文化系列大赛开始,1988-05-23,1988-05
亚乒赛中国队共夺得４项冠军,1988-05-23,1988-05
国际羽协准备改变汤杯尤杯赛制,1988-05-23,1988-05
南京城中古女排再争桂冠,1988-05-23,1988-05
奥运会水球预选赛中国队苦战获出线,1988-05-23,1988-05
登山健儿凯旋拉萨,1988-05-23,1988-05
本报开辟为我国奥运健儿出谋划策专栏,1988-05-23,1988-05
我的几点建议,1988-05-23,1988-05
湘豫等地处置不合格党员,1988-05-23,1988-05
浙江破获一起重大盗枪案,1988-05-23,1988-05
罪犯陆南发拒捕被毙群众放鞭炮喜送恶鬼,1988-05-23,1988-05
路拾巨款个体户如数交公见钱眼红乡干部刁难失主,1988-05-23,1988-05
北空坚持十年开展安全行车活动,1988-05-23,1988-05
河北收集到张隐韬烈士日记,1988-05-23,1988-05
荣毅仁设家宴款待美国客人,1988-05-23,1988-05
无锡完善青少年教育工作网络,1988-05-23,1988-05
甘肃利用计算机系统管理干部,1988-05-23,1988-05
旭升乡民兵治安包干效果好,1988-05-23,1988-05
三访亚东,1988-05-23,1988-05
女警官与特殊工厂,1988-05-23,1988-05
安徽改革律师管理体制,1988-05-23,1988-05
叙永县查获巨额粮票被盗案,1988-05-23,1988-05
津市市检察院试行侦查起诉分开,1988-05-23,1988-05
孙家驹犯了投机倒把罪吗？,1988-05-23,1988-05
简讯,1988-05-23,1988-05
中国不再是龙,1988-05-23,1988-05
道光是怎样一个皇帝？,1988-05-23,1988-05
质量与分配,1988-05-23,1988-05
书讯,1988-05-23,1988-05
政治体制改革是为巩固人民政权巩固政权的最重要条件是革新党,1988-05-23,1988-05
田纪云说中加经济技术合作潜力很大,1988-05-23,1988-05
苏公众认为苏美高级会晤有利改善两国关系,1988-05-23,1988-05
中捷人民友谊的结晶——鲁迅图书馆,1988-05-23,1988-05
埃塞俄比亚索马里军队脱离接触,1988-05-23,1988-05
印度总理召开会议讨论金庙问题,1988-05-23,1988-05
苏联两共和国党第一书记被解职,1988-05-23,1988-05
扎伊尔人民革命运动“四大”闭幕,1988-05-23,1988-05
阿富汗游击队封锁贾拉拉巴德周围公路,1988-05-23,1988-05
伊朗接受联合国秘书长停火计划,1988-05-23,1988-05
一句话新闻,1988-05-23,1988-05
布、杜对阵鹿死谁手,1988-05-23,1988-05
南总理米库利奇接见王芳,1988-05-23,1988-05
芬兰总理霍尔克里接见宋健,1988-05-23,1988-05
中南签署长期科技合作纲要,1988-05-23,1988-05
经合部长会议讨论通货膨胀问题,1988-05-23,1988-05
巴西拟定“现代化与调整计划”,1988-05-23,1988-05
中美企业家研讨会孕育合作新项目,1988-05-23,1988-05
保共中央政治局提出科技改革方案,1988-05-23,1988-05
冯至在西德获外国日耳曼学奖,1988-05-23,1988-05
赞比亚打击走私和黑市活动,1988-05-23,1988-05
日本环境白皮书说地球污染严重,1988-05-23,1988-05
现代经济交流乃文化交流,1988-05-23,1988-05
新发现的老舍英文书信,1988-05-23,1988-05
晚晴,1988-05-23,1988-05
又是桐花时节,1988-05-23,1988-05
补缺之作,1988-05-23,1988-05
《圣夜》和它的作者,1988-05-23,1988-05
又是鲁迅佚文吗？,1988-05-23,1988-05
雅克什到达北京赵紫阳设宴欢迎,1988-05-24,1988-05
肇东市农行发放贷款公开化,1988-05-24,1988-05
公开化大有助于消除弄权渎职（本报评论）,1988-05-24,1988-05
青岛警备区船运队党委坚持反腐蚀,1988-05-24,1988-05
格罗斯卡达尔当选匈党总书记和主席,1988-05-24,1988-05
呼盟一年接双季羊羔,1988-05-24,1988-05
北京中关村试验区引起各界关注三百多单位申报建立新技术产业,1988-05-24,1988-05
“中山舰”即将重见天日,1988-05-24,1988-05
赵紫阳会见居内久,1988-05-24,1988-05
贵州发现十丈洞大瀑布,1988-05-24,1988-05
子牙河大桥主体工程竣工,1988-05-24,1988-05
北京地区天气预报,1988-05-24,1988-05
兰州铝厂自我揭短改进管理,1988-05-24,1988-05
结合满负荷工作法探索五天工作制,1988-05-24,1988-05
中行杭州分行开拓服务项目促进浙江省发展外向型经济,1988-05-24,1988-05
黄骅县虾苗难销专业户心急如焚,1988-05-24,1988-05
各地工会要认真贯彻执行企业法,1988-05-24,1988-05
赛格等３企业集团自愿联合,1988-05-24,1988-05
新余钢铁厂高能耗产品找到出路,1988-05-24,1988-05
长征胶鞋总厂被迫改商标,1988-05-24,1988-05
如此“移花接木”,1988-05-24,1988-05
加拿大向我出售小型的公务专机,1988-05-24,1988-05
简讯,1988-05-24,1988-05
他在乡间蹚出金色路,1988-05-24,1988-05
《企业法》条文解说,1988-05-24,1988-05
天津优化青少年健康成长环境河西区大文化网络哺育下一代,1988-05-24,1988-05
双向选择好政策应配套,1988-05-24,1988-05
西藏抢救藏文古籍,1988-05-24,1988-05
江阴实验小学全面评价学生效果好,1988-05-24,1988-05
哈工大与一汽联办汽车工程学院,1988-05-24,1988-05
诗词创作研究团体逾四百,1988-05-24,1988-05
局部战争后勤学术研讨会在蓉举行,1988-05-24,1988-05
南空“小百灵”进京献歌舞,1988-05-24,1988-05
美国向我赠送两只麝牛,1988-05-24,1988-05
我高校首次办性科学培训班,1988-05-24,1988-05
中国男队旗开得胜５∶０击败英格兰队,1988-05-24,1988-05
羽毛球大赛前夜,1988-05-24,1988-05
当今女排古巴最强,1988-05-24,1988-05
安国的“天下第一药市”,1988-05-24,1988-05
国家足球队与天津海鸥队战平,1988-05-24,1988-05
一种汽车限酒自锁装置问世,1988-05-24,1988-05
新型擦剂使氟斑牙由黄变白,1988-05-24,1988-05
鉴别中药用电脑,1988-05-24,1988-05
江西加快律师队伍建设,1988-05-24,1988-05
东莞定点定日接待来访群众,1988-05-24,1988-05
南空党委要求各级干部廉洁奉公,1988-05-24,1988-05
周口地委把竞争机制引入干部管理,1988-05-24,1988-05
军民之间坚持互助互利,1988-05-24,1988-05
民主权利与“自主意识”,1988-05-24,1988-05
上海出现私人律师事务所,1988-05-24,1988-05
天津出现合作制律师事务所,1988-05-24,1988-05
青年战士唐学根舍己救人被授“模范共青团员”称号,1988-05-24,1988-05
杨建新正当防卫刺死流氓检察机关依法律不予起诉,1988-05-24,1988-05
荣毅仁宴请美大通银行国际咨委会会议成员,1988-05-24,1988-05
简讯,1988-05-24,1988-05
非正常死亡,1988-05-24,1988-05
文学的现实品格,1988-05-24,1988-05
巍巍长城的联想,1988-05-24,1988-05
艺术理论的新探索,1988-05-24,1988-05
新时期文学中的现实主义问题,1988-05-24,1988-05
《西路军女战士蒙难记》,1988-05-24,1988-05
作协创研部召开苏晓康、鲁彦周作品讨论会,1988-05-24,1988-05
中国当代军事文学研讨会,1988-05-24,1988-05
南戏学术讨论会在闽举行,1988-05-24,1988-05
希望年内签署削减战略武器条约,1988-05-24,1988-05
阿抵抗力量决定进攻贾拉拉巴德,1988-05-24,1988-05
达成停火确保人质安全协议,1988-05-24,1988-05
田纪云副总理离开加拿大回国,1988-05-24,1988-05
匈社会主义工人党新总书记格罗斯,1988-05-24,1988-05
加总理马尔罗尼启程访西欧,1988-05-24,1988-05
苏共中央举行全会,1988-05-24,1988-05
华盛顿为何向诺列加让步,1988-05-24,1988-05
“阴影”何处来,1988-05-24,1988-05
突尼斯利比亚的领导人会谈,1988-05-24,1988-05
伊朗宣布举行海上军事演习,1988-05-24,1988-05
英欢迎塞拉西家属到英定居,1988-05-24,1988-05
南部非洲出现有利形势,1988-05-24,1988-05
一句话新闻,1988-05-24,1988-05
四方会谈不会损害纳米比亚,1988-05-24,1988-05
埃及总统接见我农业部长,1988-05-24,1988-05
波党领导人会见中共中央党校代表团,1988-05-24,1988-05
美国外贸赤字有所下降世界股票市场隐忧犹存,1988-05-24,1988-05
美财政赤字难以下降,1988-05-24,1988-05
巴西外债谈判遇到新障碍,1988-05-24,1988-05
切尔诺贝利核事故并非偶然,1988-05-24,1988-05
控制人口增长提高人口素质,1988-05-24,1988-05
国际金融市场再次兴起借贷热,1988-05-24,1988-05
非洲难民数量增至近５００万,1988-05-24,1988-05
从冻结到放开,1988-05-24,1988-05
美国妇女买武器防身,1988-05-24,1988-05
旅游者赶实惠纽约人赚大钱,1988-05-24,1988-05
圣贤语录与文化现象,1988-05-24,1988-05
老街,1988-05-24,1988-05
关于书法之道的妙喻,1988-05-24,1988-05
三叶虫,1988-05-24,1988-05
吴休的诗书画,1988-05-24,1988-05
丛林,1988-05-24,1988-05
发展沿海带动全国（本报评论）,1988-05-25,1988-05
三百多万专业人才潜力待发掘,1988-05-25,1988-05
杨尚昆会见雅克什一行,1988-05-25,1988-05
邓小平说改革开放要过几个险关,1988-05-25,1988-05
蒋南翔同志遗体告别仪式在京举行,1988-05-25,1988-05
赵紫阳李鹏分别会见美国客人,1988-05-25,1988-05
浙江省和国家教委联合高校建立杭嘉湖技术开发试验区,1988-05-25,1988-05
研讨绘制治黄新蓝图,1988-05-25,1988-05
北京地区天气预报,1988-05-25,1988-05
营口纺织业引进——改造——出口多,1988-05-25,1988-05
假冒“一○一”充斥市场,1988-05-25,1988-05
“磁性政策”吸引城里人投资农业,1988-05-25,1988-05
要加强和改造思想政治工作,1988-05-25,1988-05
东莞“三来一补”又有新发展,1988-05-25,1988-05
桓台县靠建筑业带动各业,1988-05-25,1988-05
中国有色金属总公司“公文展览”别开生面,1988-05-25,1988-05
临汾地区“死钱”活用,1988-05-25,1988-05
简讯,1988-05-25,1988-05
农具出租专柜好,1988-05-25,1988-05
号码·信息·观念,1988-05-25,1988-05
国产汽车产销两旺,1988-05-25,1988-05
工程质量失控已初步扭转,1988-05-25,1988-05
黄陂“吃”武汉,1988-05-25,1988-05
青岛橡塑公司再加工科技成果,1988-05-25,1988-05
国家科技经费分配优化有法,1988-05-25,1988-05
赵紫阳会见李远哲教授,1988-05-25,1988-05
魔芋制品研究成功在京投产,1988-05-25,1988-05
为残疾人事业义捐书画在京展出,1988-05-25,1988-05
杂文报“鲁迅风”杂文征文等评比揭晓,1988-05-25,1988-05
蒋南翔同志为真理奋斗一生,1988-05-25,1988-05
尤伯杯羽毛球赛中国队首战告捷,1988-05-25,1988-05
刘寿斌获世界青年举重锦标赛金牌,1988-05-25,1988-05
中国女队教练评球,1988-05-25,1988-05
中国队一平一胜,1988-05-25,1988-05
第七届全运会方案基本确定,1988-05-25,1988-05
三名中国选手出线,1988-05-25,1988-05
四国女排交锋透视,1988-05-25,1988-05
宣化基层党组织增强透明度,1988-05-25,1988-05
需要讲真话,1988-05-25,1988-05
柯在铄说双方为实施《联合声明》密切磋商取得进展,1988-05-25,1988-05
会议文件袋的规格越来越高,1988-05-25,1988-05
姚依林同阿达麦茨会谈,1988-05-25,1988-05
琼·尤恩骨灰安放仪式在唐县举行,1988-05-25,1988-05
捷共总书记雅克什参观首钢,1988-05-25,1988-05
祝贺中国和阿曼建交１０周年,1988-05-25,1988-05
某集团军四年多无枪支弹药被盗,1988-05-25,1988-05
越南继续非法侵占我南沙岛礁,1988-05-25,1988-05
外事简讯,1988-05-25,1988-05
茶树青青,1988-05-25,1988-05
编者按,1988-05-25,1988-05
原是巧克力豆,1988-05-25,1988-05
“免费修理工”,1988-05-25,1988-05
化缘“僧人”,1988-05-25,1988-05
“相面先生”,1988-05-25,1988-05
一副可怜相,1988-05-25,1988-05
批评得对,1988-05-25,1988-05
我们欢迎舆论监督,1988-05-25,1988-05
为何迟迟不对王副县长作处理？,1988-05-25,1988-05
引道工程已解决,1988-05-25,1988-05
认真查清严肃处理,1988-05-25,1988-05
殴打税务干部法纪不容！,1988-05-25,1988-05
保险赔偿快兑现,1988-05-25,1988-05
复习资料订单为何禁不了？,1988-05-25,1988-05
有人发林木的不义之财,1988-05-25,1988-05
批评应当实事求是,1988-05-25,1988-05
编者按,1988-05-25,1988-05
对《批评应当实事求是》一文的回答,1988-05-25,1988-05
单方面延长停火一个月,1988-05-25,1988-05
李鹏总理电贺第２４届非统首脑会议,1988-05-25,1988-05
这个国家需要和平,1988-05-25,1988-05
美国特使返回巴拿马,1988-05-25,1988-05
菲律宾军队进入戒备状态,1988-05-25,1988-05
非统与非洲的解放和发展,1988-05-25,1988-05
阿游击队收复坦巴纳要塞,1988-05-25,1988-05
要求安理会讨论南部非洲局势,1988-05-25,1988-05
哥伦比亚被劫客机平安返回,1988-05-25,1988-05
一句话新闻,1988-05-25,1988-05
中国阿曼友谊长青,1988-05-25,1988-05
苏外长谢瓦尔德纳泽会见阮基石,1988-05-25,1988-05
两劫机者在贝鲁特交战中被打死,1988-05-25,1988-05
五艘美舰过苏伊士运河驶向海湾,1988-05-25,1988-05
哥斯达黎加一客机失事无一死亡,1988-05-25,1988-05
叶利钦被解除最高苏维埃主席团委员职务,1988-05-25,1988-05
金庙重新开放,1988-05-25,1988-05
美国北坡石油破禁流入日本远东石油市场竞争将趋激烈,1988-05-25,1988-05
日本海外资产超过一兆美元纯资产连续三年居世界首位,1988-05-25,1988-05
拓展市场之路,1988-05-25,1988-05
英格兰的两家人,1988-05-25,1988-05
美日将恢复农产品贸易谈判,1988-05-25,1988-05
英国大学师生反对学校搞军事科研,1988-05-25,1988-05
全球每分钟出生１５０名婴儿,1988-05-25,1988-05
第四十一届戛纳电影节闭幕,1988-05-25,1988-05
儒术和竞争,1988-05-25,1988-05
树上的鸟和树下的人,1988-05-25,1988-05
学艺杂记,1988-05-25,1988-05
祝君鹏程万里,1988-05-25,1988-05
书法篆刻瑰宝——碧落碑,1988-05-25,1988-05
箫鼓声声入黄龙,1988-05-25,1988-05
改革开放要贯穿中国整个发展过程,1988-05-26,1988-05
李鹏会见雅克什,1988-05-26,1988-05
波兰部长会议主席将访华,1988-05-26,1988-05
外交部发言人答记者问,1988-05-26,1988-05
里根否决保护主义的贸易法案,1988-05-26,1988-05
入党岂能硬拉,1988-05-26,1988-05
上海决心振奋精神打开局面,1988-05-26,1988-05
思想政治工作要建立新格局,1988-05-26,1988-05
合理开发利用长江资源中科院取得一批新成果,1988-05-26,1988-05
灾后百废待兴衙门先买轿车,1988-05-26,1988-05
金代皇陵之谜初步揭开,1988-05-26,1988-05
国家拨巨款维修布达拉宫,1988-05-26,1988-05
何竹康当选吉林省委书记,1988-05-26,1988-05
尹克升再次当选青海省委书记,1988-05-26,1988-05
侯宗宾当选陕西省省长,1988-05-26,1988-05
北京地区天气预报,1988-05-26,1988-05
贵阳开展大检查制止乱涨价,1988-05-26,1988-05
淮北路卡多  农民运输难,1988-05-26,1988-05
消费者协会积极介入市场活动,1988-05-26,1988-05
凝聚力来自协商对话,1988-05-26,1988-05
绥化铁路水泥厂推行“一岗双包两制”,1988-05-26,1988-05
两个文明一起“包”,1988-05-26,1988-05
北京饭店集团成立,1988-05-26,1988-05
荣成创优产品居各县之首,1988-05-26,1988-05
定海偿还一港商贸易损失,1988-05-26,1988-05
河南农技承包为啥走下坡路？,1988-05-26,1988-05
北海咏叹,1988-05-26,1988-05
建设银行总行开办国际金融业务,1988-05-26,1988-05
常熟利用外资改造乡镇企业,1988-05-26,1988-05
新疆近年从抢人才变成分配难,1988-05-26,1988-05
广州一条路九个研究所结盟,1988-05-26,1988-05
从“结合部”开始加温,1988-05-26,1988-05
九单位组织大篷车到河北大厂给农村孩子提供服务带来欢乐,1988-05-26,1988-05
内蒙古草原腹地发现青铜时代岩画,1988-05-26,1988-05
古建筑专家祁英涛逝世,1988-05-26,1988-05
８个少儿艺术团体将在京演出,1988-05-26,1988-05
《希望的火花》一书出版,1988-05-26,1988-05
当前如何加强职业道德教育,1988-05-26,1988-05
奇怪的“择优留级”,1988-05-26,1988-05
首都举办《８０年代北京人》摄影比赛,1988-05-26,1988-05
中国男队五比零轻取印度队,1988-05-26,1988-05
初露锋芒的小老虎,1988-05-26,1988-05
何星辉夺金牌,1988-05-26,1988-05
中国女篮排出新老参半阵容,1988-05-26,1988-05
简讯,1988-05-26,1988-05
江津实行党政干部回避制度,1988-05-26,1988-05
宁夏人大常委会做自我批评,1988-05-26,1988-05
为落选者送诤言,1988-05-26,1988-05
雅克什总书记举行记者招待会,1988-05-26,1988-05
福特基金会中国办事处在京成立,1988-05-26,1988-05
缅甸副总理抵京,1988-05-26,1988-05
简讯,1988-05-26,1988-05
又受到尊重的人,1988-05-26,1988-05
城市部队“家门口兵”越来越多,1988-05-26,1988-05
咸阳市委要求各级党政干部尊重新闻规律接受舆论监督,1988-05-26,1988-05
中捷签署经济科技合作协定,1988-05-26,1988-05
非洲国家驻华使节庆祝“非洲解放日”,1988-05-26,1988-05
纪念董存瑞牺牲４０周年,1988-05-26,1988-05
