发扬工人阶级好传统积极参加和支持改革,1988-05-01,1988-05
全总举行“五一”授奖大会,1988-05-01,1988-05
中日民间人士定期会晤很有好处,1988-05-01,1988-05
杨汝岱当选四川省委书记,1988-05-01,1988-05
我们播下汗水，才能收获现代化（社论）,1988-05-01,1988-05
全国民族团结进步表彰大会倡议书,1988-05-01,1988-05
北京地区天气预报,1988-05-01,1988-05
为现代化辛勤耕耘的人们,1988-05-01,1988-05
军队院校建设有好经验,1988-05-01,1988-05
铁道部查处“韶关车站事件”,1988-05-01,1988-05
加强路风建设制止违法乱纪,1988-05-01,1988-05
上海市人代会首次实行差额选举,1988-05-01,1988-05
新老女劳模在北京座谈,1988-05-01,1988-05
田纪云出访墨西哥美国加拿大,1988-05-01,1988-05
李先念在武汉同各界代表共庆“五一”,1988-05-01,1988-05
中日政治家第一件大事是维护两国友好合作,1988-05-01,1988-05
香港工会联合会庆祝成立４０周年,1988-05-01,1988-05
各少数民族代表在京联欢,1988-05-01,1988-05
我国选手获８个单项冠军,1988-05-01,1988-05
日本外相访问香港,1988-05-01,1988-05
钱其琛同巴西外长会谈,1988-05-01,1988-05
简讯,1988-05-01,1988-05
诺列加已同意辞职,1988-05-01,1988-05
熨,1988-05-01,1988-05
美苏就中导条约核查问题发生争执,1988-05-01,1988-05
巴拿马新外长主张巴美关系正常化,1988-05-01,1988-05
泰国执政党表示支持炳总理解散议会决定,1988-05-01,1988-05
加美关系的改善及面临的问题,1988-05-01,1988-05
空中爆炸大客机天窗洞开平稳着陆驾驶员创造奇迹,1988-05-01,1988-05
日本外相宇野前来我国访问,1988-05-01,1988-05
第四次中日民间人士会议闭幕,1988-05-01,1988-05
飞速发展的世界航天业,1988-05-01,1988-05
一句话新闻,1988-05-01,1988-05
联合国秘书长将出访北非,1988-05-01,1988-05
日内瓦春季裁军谈判结束,1988-05-01,1988-05
南朝鲜快艇侵入朝鲜领海,1988-05-01,1988-05
以军袭击黎巴嫩南部村庄,1988-05-01,1988-05
中共宣传工作者代表团访捷,1988-05-01,1988-05
明年今日此门中,1988-05-01,1988-05
矿山今昔,1988-05-01,1988-05
放筒工之歌（散文诗）,1988-05-01,1988-05
深沉的独白,1988-05-01,1988-05
小站上有个小小的文化室,1988-05-01,1988-05
导航者,1988-05-01,1988-05
我军文职干部暂行条例颁行,1988-05-02,1988-05
旱！旱！争购水龙带,1988-05-02,1988-05
河南省府快捷论证洛阳开发区,1988-05-02,1988-05
山东旱情冻灾和虫害并发省政府动员各地奋起抗灾,1988-05-02,1988-05
广州成立外资管理中心,1988-05-02,1988-05
河北省改善外商投资环境从解决当前急迫问题入手,1988-05-02,1988-05
西安新建铁道口交警队,1988-05-02,1988-05
平面直角彩色显像管生产线在南京市奠基,1988-05-02,1988-05
乌鲁木齐—西安—杭州间航线开通,1988-05-02,1988-05
“两套职务”,1988-05-02,1988-05
首钢民主管理纪实,1988-05-02,1988-05
把民主引入管理（国内短评）,1988-05-02,1988-05
北京地区天气预报,1988-05-02,1988-05
承包指标的扩张及其效应,1988-05-02,1988-05
完善承包要着眼改善企业机制,1988-05-02,1988-05
为现代化辛勤耕耘的人们,1988-05-02,1988-05
一批高效节能新型农机具问世,1988-05-02,1988-05
农民吕宝臻承担蔬菜研究项目,1988-05-02,1988-05
山东化肥供需脱节,1988-05-02,1988-05
我国软件行业亟待发展,1988-05-02,1988-05
我国将开展电工产品安全认证工作,1988-05-02,1988-05
我国能源工业首季稳定增长,1988-05-02,1988-05
简讯,1988-05-02,1988-05
向人民交一份彩色答卷,1988-05-02,1988-05
抢地盖房国法不容,1988-05-02,1988-05
突出初级阶段理论和现实研究,1988-05-02,1988-05
秦始皇１号铜车马重现雄姿,1988-05-02,1988-05
《红旗》杂志即将停刊《求是》杂志七一创刊,1988-05-02,1988-05
去年四种传染病发病率再下降,1988-05-02,1988-05
名传西厢普救寺遗址掘出古文物,1988-05-02,1988-05
中加合办企业管理成都培训中心,1988-05-02,1988-05
今年继续做好选派讲师团工作,1988-05-02,1988-05
中国发明家载誉归来,1988-05-02,1988-05
《国外社会科学》各方注目,1988-05-02,1988-05
中国长城首届美术书法展开幕,1988-05-02,1988-05
“天水风情艺术展”在京举办,1988-05-02,1988-05
双跨珠峰最后一仗打响,1988-05-02,1988-05
当年登山勇士今何在,1988-05-02,1988-05
铺架空中飞桥的无名英雄,1988-05-02,1988-05
上达天庭的梦想,1988-05-02,1988-05
世界登山运动出现新热潮,1988-05-02,1988-05
在改革开放中加强基层党建,1988-05-02,1988-05
党政机关及干部不得谋私和经商,1988-05-02,1988-05
邯郸民兵在深化农村改革中显身手,1988-05-02,1988-05
为了共同的母亲,1988-05-02,1988-05
绥宁县四年未向驻军乱摊派一分钱,1988-05-02,1988-05
魏县破获制售假药品商标案,1988-05-02,1988-05
香港与外地合作破获１１个国际贩毒集团,1988-05-02,1988-05
中苏边界谈判代表团在京举行第二次会议,1988-05-02,1988-05
张树德同志逝世,1988-05-02,1988-05
简讯,1988-05-02,1988-05
李文珊当选为河北省政协主席,1988-05-02,1988-05
藏族战士杨向东爱军习武立功,1988-05-02,1988-05
财迷心窍抢劫犯罪执法犯法落入法网,1988-05-02,1988-05
重视增强公民的权利意识,1988-05-02,1988-05
永州市法院院长被依法逮捕,1988-05-02,1988-05
桐庐殴打执法人员者受惩处,1988-05-02,1988-05
金钱诱惑不动心,1988-05-02,1988-05
警民勇擒歹徒,1988-05-02,1988-05
论改革开放与民族精神的转变,1988-05-02,1988-05
要打破理论工作的高度集权模式,1988-05-02,1988-05
清除传统法律文化的消极影响,1988-05-02,1988-05
辞书学不等于语言学,1988-05-02,1988-05
推进产业结构的研究调整和改造,1988-05-02,1988-05
热烈庆祝“五一”国际劳动节,1988-05-02,1988-05
苏联必须承认阿抵抗力量政府,1988-05-02,1988-05
立足竞争锐意开拓,1988-05-02,1988-05
只承认台湾用“中国台北”名称,1988-05-02,1988-05
朝鲜为林春秋副主席举行国葬,1988-05-02,1988-05
苏联对国家同教会关系采取新态度,1988-05-02,1988-05
泰军方领导人表示仍支持炳总理,1988-05-02,1988-05
阿拉法特主席将再次访问叙利亚,1988-05-02,1988-05
民德领导人会见西德社民党主席,1988-05-02,1988-05
安哥拉总统接见古共政治局委员,1988-05-02,1988-05
布隆迪总统欢迎打算回国的难民,1988-05-02,1988-05
越报承认越南经济面临严重困难,1988-05-02,1988-05
尼加拉瓜停火谈判无进展,1988-05-02,1988-05
朝苏外长会谈朝鲜半岛形势,1988-05-02,1988-05
限制波音７３７客机飞行高度,1988-05-02,1988-05
一句话新闻,1988-05-02,1988-05
不熄的火种,1988-05-02,1988-05
“我在很多美国人爱中国前就爱上中国了”,1988-05-02,1988-05
竞选与争官,1988-05-02,1988-05
嗅觉机器人问世,1988-05-02,1988-05
节食与不育,1988-05-02,1988-05
家谱和祖宗,1988-05-02,1988-05
东山黄叶村,1988-05-02,1988-05
民主兴，杂文兴！,1988-05-02,1988-05
说杨柳,1988-05-02,1988-05
中国美人鱼,1988-05-02,1988-05
川东钓鱼城,1988-05-02,1988-05
《秘密世界》,1988-05-02,1988-05
人人为儿童少年办实事做好事,1988-05-03,1988-05
今年第一季度出口创汇额普遍持续增长,1988-05-03,1988-05
图书发行体制改革卓有成效,1988-05-03,1988-05
广东春季造林种果一千多万亩,1988-05-03,1988-05
陕西切实提高劳模社会地位,1988-05-03,1988-05
祝塘镇外向型经济突飞猛进,1988-05-03,1988-05
李鹏会见索德雷,1988-05-03,1988-05
来者可追,1988-05-03,1988-05
投标不中亦坦然,1988-05-03,1988-05
北京地区天气预报,1988-05-03,1988-05
为现代化辛勤耕耘的人们,1988-05-03,1988-05
阜阳乡镇企业制度建设有进展,1988-05-03,1988-05
初萌的金融意识,1988-05-03,1988-05
南化公司发展外向型经济路子宽,1988-05-03,1988-05
淮北市发生干扰企业承包经营事件,1988-05-03,1988-05
莱州市走出开发山区经济新路子,1988-05-03,1988-05
航空工业开发替代进口产品有成绩,1988-05-03,1988-05
北京市印刷工业水平已有长足进步,1988-05-03,1988-05
衡水农民专业技术研究会蓬勃发展,1988-05-03,1988-05
开发蚂蚁营养宝库,1988-05-03,1988-05
成都“五·一”前夕表彰四百劳模,1988-05-03,1988-05
刘家峡水电站安全发电达六百天,1988-05-03,1988-05
一批煤矿生产事故多被黄牌警告,1988-05-03,1988-05
极少核甜橙新品系在桂培育成功,1988-05-03,1988-05
山西小学毕业考加码学生负担重人民代表提出质询竟被说成造遥,1988-05-03,1988-05
“好！就这样定了”,1988-05-03,1988-05
上海一些研究所开展“创汇科研”,1988-05-03,1988-05
吴从炘列为世界知识界名人,1988-05-03,1988-05
中国影视十大明星评选开始,1988-05-03,1988-05
辽宁农村形成四级文化网络,1988-05-03,1988-05
《吉尼斯世界纪录大全》１９８８年版即将出版,1988-05-03,1988-05
第三代气压水罐诞生,1988-05-03,1988-05
借用“人工椎体”无须剜肉补疮北京老年病院治脊椎病有新术,1988-05-03,1988-05
福建发现光敏核不育水稻,1988-05-03,1988-05
多功能微机核子秤达到国际先进水平,1988-05-03,1988-05
“吃饱了肚子就能办教育”,1988-05-03,1988-05
暴风雨前的沉寂,1988-05-03,1988-05
她并没有满足,1988-05-03,1988-05
中国男子柔道队赴英训练比赛收获甚丰,1988-05-03,1988-05
罗国际体操赛我获两枚银牌,1988-05-03,1988-05
体·育·简·讯,1988-05-03,1988-05
加强监督促进建设廉洁政府,1988-05-03,1988-05
爱国与奋斗,1988-05-03,1988-05
落选也是考验,1988-05-03,1988-05
交城一客车翻车８１人伤亡,1988-05-03,1988-05
六盘水市政府批评“公文旅行”,1988-05-03,1988-05
让团组织更有活力,1988-05-03,1988-05
“高原劲旅”做民族团结模范,1988-05-03,1988-05
某集团军将５２名平庸干部降职或免职,1988-05-03,1988-05
黄海前哨部队支援国家建设,1988-05-03,1988-05
南海舰队评出“南海青年之星”,1988-05-03,1988-05
海军九江油库为地方节资２００多万元,1988-05-03,1988-05
成都军区后勤部原顾问李华安病逝,1988-05-03,1988-05
纪念卢作孚先生诞辰９５周年,1988-05-03,1988-05
临漳煤矿开展义务劳动,1988-05-03,1988-05
简讯,1988-05-03,1988-05
关于探索文学的思考,1988-05-03,1988-05
读的变迁,1988-05-03,1988-05
桃李不言下自成蹊,1988-05-03,1988-05
出版信息,1988-05-03,1988-05
“二十世纪国外文学走向”讨论,1988-05-03,1988-05
庆祝“五一”国际劳动节,1988-05-03,1988-05
田纪云抵墨西哥进行正式访问,1988-05-03,1988-05
美部分撤消对巴拿马经济制裁措施,1988-05-03,1988-05
安古美南非四方将会晤讨论南部非洲和平问题,1988-05-03,1988-05
尼加拉瓜总统奥尔特加宣布如达不成协议将向反政府武装进攻,1988-05-03,1988-05
欧共体和东盟致力加强合作,1988-05-03,1988-05
利比亚呼吁召开中东四方首脑会议,1988-05-03,1988-05
美决定在海湾扩大护航,1988-05-03,1988-05
泰国大选营垒初步形成,1988-05-03,1988-05
一句话新闻,1988-05-03,1988-05
难以调解的新喀岛冲突,1988-05-03,1988-05
巴苏领导人愿意改善两国关系,1988-05-03,1988-05
泰国王家陆军总司令申请辞职,1988-05-03,1988-05
声援巴拿马国际工会会议闭幕,1988-05-03,1988-05
美苏两国签署一项核安全协议,1988-05-03,1988-05
埃及拒绝美解决塔巴问题建议,1988-05-03,1988-05
欧共体呼吁里根否决美贸易法案警告如法案生效将采取报复措施,1988-05-03,1988-05
欧佩克会议未能达成原油减产协议,1988-05-03,1988-05
保证改革的不可逆转性,1988-05-03,1988-05
日本在西欧的贸易攻势,1988-05-03,1988-05
三位华人青年音乐家在美联合演出,1988-05-03,1988-05
中国儿童作品在西班牙获奖,1988-05-03,1988-05
“中国文人书斋”展在华盛顿开幕,1988-05-03,1988-05
加拿大严格限制青少年吸烟,1988-05-03,1988-05
高能之源,1988-05-03,1988-05
读《兼于阁诗话》小得,1988-05-03,1988-05
爸爸认不准门,1988-05-03,1988-05
惊雷（中国画）,1988-05-03,1988-05
神秘瑰丽的地下河,1988-05-03,1988-05
车过黄河大桥,1988-05-03,1988-05
反馈短波,1988-05-03,1988-05
吹唢呐的二叔,1988-05-03,1988-05
乐园,1988-05-03,1988-05
国务院确定行政机构设置,1988-05-04,1988-05
在改革开放中造就一代新人（社论）,1988-05-04,1988-05
上海将利用外资开发浦东,1988-05-04,1988-05
国务院发布２３条规定鼓励投资开发海南岛,1988-05-04,1988-05
共青团十二大举行预备会,1988-05-04,1988-05
坑农的劣迹（国内短评）,1988-05-04,1988-05
万里会见菲众议院议员团,1988-05-04,1988-05
李鹏致电世界卫生组织,1988-05-04,1988-05
赵紫阳祝贺中央团校建校４０周年,1988-05-04,1988-05
六家企业受到经济制裁,1988-05-04,1988-05
蒋南翔同志逝世,1988-05-04,1988-05
全国文学评奖在京揭晓,1988-05-04,1988-05
北京地区天气预报,1988-05-04,1988-05
张家口桥西区办承包市场,1988-05-04,1988-05
建立承包市场好,1988-05-04,1988-05
价值的证明,1988-05-04,1988-05
湖北省加快防洪建设,1988-05-04,1988-05
十一个部门公章一天盖,1988-05-04,1988-05
挂钩化肥票被卡省委书记亲自查,1988-05-04,1988-05
冶金部１１０项技术成果转为生产力,1988-05-04,1988-05
中山市新造良田超过征地,1988-05-04,1988-05
三分之一企业家愿到大陆投资,1988-05-04,1988-05
简讯,1988-05-04,1988-05
一季度国民经济发展动态分析,1988-05-04,1988-05
如何使用经济指数信息,1988-05-04,1988-05
出版书刊要对青少年成长负责,1988-05-04,1988-05
中国实行计划生育基本国策坚定不移,1988-05-04,1988-05
东关村替独生子女户解忧,1988-05-04,1988-05
沟通，产生了奇效,1988-05-04,1988-05
亚太地区科技企业家聚会深圳交流各国兴建科技工业园经验,1988-05-04,1988-05
中法合作培养高级管理人才,1988-05-04,1988-05
西安截瘫康复医疗中心受赞誉,1988-05-04,1988-05
三国登山健儿向珠峰峰顶逼近,1988-05-04,1988-05
奥运会赛前练兵巴西女篮又夺冠,1988-05-04,1988-05
各国水下蛟龙汇聚京华,1988-05-04,1988-05
台湾成立大陆体育研究小组探讨海峡两岸选手如何交流,1988-05-04,1988-05
中国少年足球队在黄石练兵,1988-05-04,1988-05
辽宁姑娘节节胜利势不可当,1988-05-04,1988-05
朝鲜全国篮球冠军队访华,1988-05-04,1988-05
登喜路杯高尔夫球赛落幕,1988-05-04,1988-05
北京成立青年文化咨询交流中心,1988-05-04,1988-05
北京几所大学联合举行校园戏剧汇演,1988-05-04,1988-05
上海大学生第二届电影艺术节开幕,1988-05-04,1988-05
世界新书信息中心开放,1988-05-04,1988-05
蚌埠深化改革完善制度,1988-05-04,1988-05
２５４医院把竞争机制引入团的工作,1988-05-04,1988-05
会议伙食日日高公费补贴吃不消,1988-05-04,1988-05
鼓励犯人老实服刑积极改造,1988-05-04,1988-05
团荔浦县委开展学技术脱贫致富活动,1988-05-04,1988-05
李鹏会见土耳其总理夫人,1988-05-04,1988-05
港舆论界征求对基本法意见,1988-05-04,1988-05
维护亚洲和平稳定是中国外交政策重要内容,1988-05-04,1988-05
麦积山军民扑灭一场林火,1988-05-04,1988-05
济南悼念“五三”惨案遇难者,1988-05-04,1988-05
中日两国外长在京会谈,1988-05-04,1988-05
河北省七届人大一次会议差额选举,1988-05-04,1988-05
晚安，竹楼,1988-05-04,1988-05
简讯,1988-05-04,1988-05
密特朗连任希望再增,1988-05-04,1988-05
加强政经合作符合双方利益,1988-05-04,1988-05
庆祝“五一”国际劳动节,1988-05-04,1988-05
竹下访意双方表示加强合作,1988-05-04,1988-05
以色列大举进犯黎巴嫩南部,1988-05-04,1988-05
巴解官员说巴叙将继续对话,1988-05-04,1988-05
苏联改革能否成功取决于群众支持,1988-05-04,1988-05
世界卫生大会在日内瓦开幕,1988-05-04,1988-05
我大使向捷总统胡萨克递交国书,1988-05-04,1988-05
喀麦隆总统比亚接见我大使,1988-05-04,1988-05
毛里求斯总督林加杜会见我大使,1988-05-04,1988-05
南非四个工会讨论加强团结,1988-05-04,1988-05
泰国宣布炳总理将访问苏联,1988-05-04,1988-05
卡杜米否认巴解同美国接触,1988-05-04,1988-05
两个巴勒斯坦派别发生冲突,1988-05-04,1988-05
美国不派海岸巡逻艇去海湾,1988-05-04,1988-05
英国派遣三艘军舰驶往海湾,1988-05-04,1988-05
一句话新闻,1988-05-04,1988-05
提高消费水准不能脱离发展生产,1988-05-04,1988-05
纽约市场油价下跌,1988-05-04,1988-05
稳定油价的一次有益尝试,1988-05-04,1988-05
贸易法案与白宫意向,1988-05-04,1988-05
里根重申将否决贸易法案,1988-05-04,1988-05
日本对外贸易连续八年出超,1988-05-04,1988-05
赞赏非欧佩克产油国的合作态度,1988-05-04,1988-05
欧共体经济去年增长２．４％,1988-05-04,1988-05
讨论通过一项南极开矿活动公约,1988-05-04,1988-05
毛里塔尼亚蝗情日趋严重我空运农药支援灭蝗斗争,1988-05-04,1988-05
梦萦未名湖,1988-05-04,1988-05
传统与求新,1988-05-04,1988-05
心韵,1988-05-04,1988-05
音乐创作系列讲座,1988-05-04,1988-05
汉阴有叟君知否,1988-05-04,1988-05
共青团第十二次全国代表大会开幕,1988-05-05,1988-05
伟大的转折辉煌的序曲,1988-05-05,1988-05
彭真徐向前聂荣臻薄一波热烈祝贺团的十二大召开,1988-05-05,1988-05
赵紫阳李鹏王震分别会见宇野,1988-05-05,1988-05
阿根廷总统将访华,1988-05-05,1988-05
莫桑比克总统将来访,1988-05-05,1988-05
长白山林区已到火险高峰期干部群众进入防火临战状态,1988-05-05,1988-05
希望在青年,1988-05-05,1988-05
北京地区天气预报,1988-05-05,1988-05
湖南学广东以开放促开发,1988-05-05,1988-05
巧借南风绿湘水,1988-05-05,1988-05
唐山市长主动揭短找原因,1988-05-05,1988-05
利用外资发展电力工业,1988-05-05,1988-05
广东九年吸引外资近五十亿美元,1988-05-05,1988-05
全国乡镇企业普遍建立工会,1988-05-05,1988-05
鞍钢公开奖励投标落选者,1988-05-05,1988-05
这样的盲目发展不能再继续,1988-05-05,1988-05
公路给封闭的沂蒙山区带来活力,1988-05-05,1988-05
简讯,1988-05-05,1988-05
盐城积极为农民供应饲料,1988-05-05,1988-05
国务院关于鼓励投资开发海南岛的规定,1988-05-05,1988-05
北京大学庆祝建校９０周年,1988-05-05,1988-05
北京成立一家民间科研院,1988-05-05,1988-05
技工贸要真正结合,1988-05-05,1988-05
书市谈书,1988-05-05,1988-05
《将帅诗词选》（续集）将出版,1988-05-05,1988-05
延边军分区系统管理优生优育,1988-05-05,1988-05
重庆出现高温天气,1988-05-05,1988-05
我新创心电多相诊断仪五分钟确诊多种心脏病,1988-05-05,1988-05
和未来的教师聊天,1988-05-05,1988-05
叶挺摄影作品在京展出,1988-05-05,1988-05
我人工心脏研究首项成果通过鉴定,1988-05-05,1988-05
中日尼登山队双跨珠峰进入关键时刻,1988-05-05,1988-05
中央电视台今日转播攀登珠峰实况,1988-05-05,1988-05
朝鲜国家足球队来华中国队赶赴杭州迎战,1988-05-05,1988-05
宋俊峰一项计量技术成果  在国际会议上获高度评价,1988-05-05,1988-05
决战前夕,1988-05-05,1988-05
全国大企业篮球赛即将在二汽揭幕,1988-05-05,1988-05
体育简讯,1988-05-05,1988-05
今年军校从地方招生五千,1988-05-05,1988-05
邯郸地区把竞争机制引入干部管理,1988-05-05,1988-05
桂阳县委欢迎群众监督收到批评建议三千余条,1988-05-05,1988-05
小议“没有提不同意见的”,1988-05-05,1988-05
李鹏总理任命一批国家工作人员,1988-05-05,1988-05
简讯,1988-05-05,1988-05
李鹏会见卢旺达外交合作部长,1988-05-05,1988-05
荣毅仁将率全国人大代表团访英,1988-05-05,1988-05
中国不丹等五轮边界会谈将在京举行,1988-05-05,1988-05
赤道几内亚人民代表院代表团洪都拉斯国民议会代表团将访华,1988-05-05,1988-05
城楼寄语,1988-05-05,1988-05
海航某师普法教育收效明显,1988-05-05,1988-05
“五四”游园即景,1988-05-05,1988-05
我国知识分子的优秀代表,1988-05-05,1988-05
震撼西北的春雷,1988-05-05,1988-05
安古美南非举行秘密会谈,1988-05-05,1988-05
希腊土耳其总理将互访,1988-05-05,1988-05
不允许破坏社会安定和经济稳定,1988-05-05,1988-05
墨西哥总统会见田纪云副总理,1988-05-05,1988-05
印度外交秘书访问巴基斯坦,1988-05-05,1988-05
黎巴嫩抗议以色列入侵,1988-05-05,1988-05
日本“宪法纪念日”活动多护宪派改宪派各吹各的号,1988-05-05,1988-05
阿抵抗力量一领导建议成立流动临时政府,1988-05-05,1988-05
菲总统不准马科斯回国奔丧,1988-05-05,1988-05
一句话新闻,1988-05-05,1988-05
杜卡基斯在俄亥俄预选中获胜,1988-05-05,1988-05
迎接下一个密切合作的十年,1988-05-05,1988-05
巴基斯坦卡拉奇宣布紧急状态,1988-05-05,1988-05
非洲阿拉伯国家举行对话会议,1988-05-05,1988-05
路易·戎连任欧委会议会议长,1988-05-05,1988-05
苏联进行今年来第五次核试验,1988-05-05,1988-05
泰国北部一钨矿发生塌陷事故,1988-05-05,1988-05
支持中国重返关贸总协定促进欧洲同中国贸易往来,1988-05-05,1988-05
机会均等,1988-05-05,1988-05
日美间牛肉柑桔谈判宣告破裂美国要求关贸总协定仲裁纠纷,1988-05-05,1988-05
世界银行增加资本的决定生效,1988-05-05,1988-05
世界股票交易发展迅速,1988-05-05,1988-05
美国第一季度劳动生产率上升,1988-05-05,1988-05
增长率不高何以使人欣慰？,1988-05-05,1988-05
令人担忧的非洲蝗灾,1988-05-05,1988-05
《末代皇帝》被列为电视佳作,1988-05-05,1988-05
墨西哥迎接２１世纪的挑战加强太平洋地区发展战略,1988-05-05,1988-05
全世界有汽车５亿多辆,1988-05-05,1988-05
第一条数字通讯线路问世,1988-05-05,1988-05
日本研制成光交换机,1988-05-05,1988-05
在文化交流中找到理解、谅解,1988-05-05,1988-05
亲昵,1988-05-05,1988-05
社会科学顶什么用？,1988-05-05,1988-05
沉默的人,1988-05-05,1988-05
乡村邮局的窗口,1988-05-05,1988-05
青春风度,1988-05-05,1988-05
跨越峰报捷举国欢欣鼓舞,1988-05-06,1988-05
中日尼联合登山队双跨珠峰成功,1988-05-06,1988-05
尼泊尔国王和首相祝贺三国登山队,1988-05-06,1988-05
团中央成员候选人推荐名单开始酝酿,1988-05-06,1988-05
《敦煌》首映式在京举行,1988-05-06,1988-05
禁止向企业摊派,1988-05-06,1988-05
贺跨越地球之巅（本报评论）,1988-05-06,1988-05
我农机化发展出现好形势,1988-05-06,1988-05
第６３届广交会圆满闭幕出口成交额破５０亿美元,1988-05-06,1988-05
柳州市粮食局问题着手处理,1988-05-06,1988-05
张勃兴当选陕西省委书记,1988-05-06,1988-05
大同国营菜市场发挥主渠道作用,1988-05-06,1988-05
北京地区天气预报,1988-05-06,1988-05
小小拖拉机税费知多少,1988-05-06,1988-05
农民办事难（国内短评）,1988-05-06,1988-05
“检查组”是怎样整掉一个厂的,1988-05-06,1988-05
我国首家合资企业兴旺,1988-05-06,1988-05
云南省决定深化改革,1988-05-06,1988-05
农民收入普遍增加沿海地区先富起来,1988-05-06,1988-05
峰峰矿区建立“物价文明街”,1988-05-06,1988-05
几秒胜数年新酒变陈酿,1988-05-06,1988-05
简讯,1988-05-06,1988-05
《企业法》条文解说,1988-05-06,1988-05
禁止向企业摊派暂行条例,1988-05-06,1988-05
伟大的跨越,1988-05-06,1988-05
登顶勇士下山最新消息,1988-05-06,1988-05
史占春谈“世纪大跨越”,1988-05-06,1988-05
电视摄像史上的奇迹,1988-05-06,1988-05
中日美苏四国体操对抗赛我获两项冠军,1988-05-06,1988-05
庄泳创一项亚洲游泳最好成绩,1988-05-06,1988-05
青年要提高自身素质做“四有”新人,1988-05-06,1988-05
乔石希望青年脚踏实地埋头苦干,1988-05-06,1988-05
海峡两岸红十字会为亲人团聚出力,1988-05-06,1988-05
提议重温党的历史经验,1988-05-06,1988-05
台湾近期将出现返乡探亲高潮,1988-05-06,1988-05
姚依林会见日本通产大臣,1988-05-06,1988-05
宁冈纪念井冈山会师六十周年,1988-05-06,1988-05
吴学谦会见缅甸外长,1988-05-06,1988-05
团十二大代表对４日大会评价不一,1988-05-06,1988-05
请不要那么冷漠,1988-05-06,1988-05
简讯,1988-05-06,1988-05
李春利冰窟救人英勇献身,1988-05-06,1988-05
纪念真理标准问题讨论十周年,1988-05-06,1988-05
认真清理我们的理论思想,1988-05-06,1988-05
《当代美国总统与社会——现代美国社会发展简史》,1988-05-06,1988-05
重新构造企业制度建立完善市场机制,1988-05-06,1988-05
巴勒斯坦人举行总罢工,1988-05-06,1988-05
访华目的是寻求友谊与和平,1988-05-06,1988-05
法三名人质在贝鲁特获释,1988-05-06,1988-05
欢迎墨企业家到中国投资设厂,1988-05-06,1988-05
法军警救出新喀岛全部人质,1988-05-06,1988-05
加强中的英日关系,1988-05-06,1988-05
竹下登访问英国,1988-05-06,1988-05
四国秘密会议结束,1988-05-06,1988-05
信息灵捷足先登反应钝良机坐失,1988-05-06,1988-05
一句话新闻,1988-05-06,1988-05
比利时五党同意联合组阁,1988-05-06,1988-05
戈尔巴乔夫接见朝外长金永南,1988-05-06,1988-05
英国爱尔兰讨论安全合作问题,1988-05-06,1988-05
西德将购置二百架新型歼击机,1988-05-06,1988-05
伊朗驻吉达总领事馆遭到冲击,1988-05-06,1988-05
