卡拉奇发生种族冲突城市生活仍陷于瘫痪,1988-05-11,1988-05
卅架阿富汗飞机入侵巴领空,1988-05-11,1988-05
印度旁遮普邦局势紧张,1988-05-11,1988-05
一句话新闻,1988-05-11,1988-05
波兰经济改革的进展与困难,1988-05-11,1988-05
以色列外长佩雷斯访问意大利,1988-05-11,1988-05
舒尔茨将进行第四次中东之行,1988-05-11,1988-05
巴批评印度邀请纳吉布拉访印,1988-05-11,1988-05
南斯拉夫破获一毒品走私集团,1988-05-11,1988-05
统一大市场将为欧洲开辟广阔前景,1988-05-11,1988-05
欧共体隆重庆祝“欧洲日”,1988-05-11,1988-05
美国股票交易商担心通货膨胀道·琼斯指数跌到２０００点以下,1988-05-11,1988-05
南斯拉夫采取新措施抑制通货膨胀,1988-05-11,1988-05
美国不要终止给罗最惠国待遇,1988-05-11,1988-05
巴西企业的技术投资热,1988-05-11,1988-05
从长江送到莱茵河的礼物,1988-05-11,1988-05
对丝绸之路进行综合学术考察,1988-05-11,1988-05
美国民航飞机老化引起人们严重关注,1988-05-11,1988-05
比利时举办中国文化与旅游展览,1988-05-11,1988-05
日本兴起“三性商品”热,1988-05-11,1988-05
秦始皇与大海,1988-05-11,1988-05
“我歌唱，就像赖以生存一样”,1988-05-11,1988-05
“桃花岛”游感录,1988-05-11,1988-05
马克思头像,1988-05-11,1988-05
小花争春别样红,1988-05-11,1988-05
授予老山地区防御作战有功单位个人荣誉称号,1988-05-12,1988-05
嘉奖老山地区防御战参战部队全体指战员,1988-05-12,1988-05
北京前门商业大厦改革引人注目,1988-05-12,1988-05
共青团十二届一中全会在京举行,1988-05-12,1988-05
白衣天使的心愿,1988-05-12,1988-05
上海“明补”第一天,1988-05-12,1988-05
里根总统会见田纪云副总理,1988-05-12,1988-05
我外交部发言人驳斥奥野再次为日本侵略战争辩护,1988-05-12,1988-05
黄知真郭振乾 分别当选连任湖北省人大常委会主任省长,1988-05-12,1988-05
不要吃厂长奖金的大锅饭,1988-05-12,1988-05
日本要充分认识过去侵略事实,1988-05-12,1988-05
北京地区天气预报,1988-05-12,1988-05
武汉重庆沈阳承包人行为发生变化,1988-05-12,1988-05
建设银行摘掉拨款部帽子,1988-05-12,1988-05
青岛市变企业劳动保险为社会保险,1988-05-12,1988-05
店主,1988-05-12,1988-05
张家口地区治理小流域见成效,1988-05-12,1988-05
潍坊市逐步实现运输社会化,1988-05-12,1988-05
我国初步形成农业信息网络,1988-05-12,1988-05
简讯,1988-05-12,1988-05
规则与裁判,1988-05-12,1988-05
北京淡水鱼养殖中心落成,1988-05-12,1988-05
武汉钢铁公司讲信誉守合同,1988-05-12,1988-05
《企业法》条文解说,1988-05-12,1988-05
大连人新的兼并观,1988-05-12,1988-05
对“搞活”的一个新见解,1988-05-12,1988-05
“林群方法”引起国际重视,1988-05-12,1988-05
片面追求升学率倾向造成严重危害,1988-05-12,1988-05
变革时期的心理困惑,1988-05-12,1988-05
研究生到生产一线写论文韩更赞为宝钢工程解难题,1988-05-12,1988-05
深圳生活垃圾袋装化,1988-05-12,1988-05
针灸治疗肩周炎可一针见效,1988-05-12,1988-05
也向自己喊一喊,1988-05-12,1988-05
请老师三思而后言,1988-05-12,1988-05
北京理工大学颁发首届徐特立奖学金,1988-05-12,1988-05
二十七人获科普征文奖,1988-05-12,1988-05
桓仁县农民版画被请进京城展览,1988-05-12,1988-05
中国选手破四项世界纪录获九枚金牌,1988-05-12,1988-05
女子举重大丰收,1988-05-12,1988-05
我女篮二队访苏五胜二负,1988-05-12,1988-05
她的启蒙训练在浴池中,1988-05-12,1988-05
参加第九届亚乒赛中国队主力全部出马,1988-05-12,1988-05
湖南基层法院巡回定点办案,1988-05-12,1988-05
全国公证工作会议在京开幕,1988-05-12,1988-05
老山地区防御作战有功单位和个人事迹简介,1988-05-12,1988-05
授予一批英模单位和个人荣誉称号,1988-05-12,1988-05
爱尔兰总统离京去外地参观,1988-05-12,1988-05
缅甸副总理吴吞丁将访华,1988-05-12,1988-05
越南所谓谈判建议是为掩盖侵略扩张,1988-05-12,1988-05
我向美国人民赠送长城砖,1988-05-12,1988-05
基本法征求意见稿尊重香港现实状况钱伟长希望倾听香港有关人士的意见,1988-05-12,1988-05
吴学谦宴请朝鲜党政代表团,1988-05-12,1988-05
阎明复会见宁恩承夫妇及子女,1988-05-12,1988-05
彭冲会见海外专栏作家李嘉,1988-05-12,1988-05
黄文欢同志在河南参观访问,1988-05-12,1988-05
中国不丹第五轮边界会谈在京举行,1988-05-12,1988-05
“优秀外交战士”李文祥受景仰,1988-05-12,1988-05
我被撞渔船三人幸存,1988-05-12,1988-05
简讯,1988-05-12,1988-05
中国红十字会向埃塞俄比亚灾民赠送食品,1988-05-12,1988-05
张树德追悼会在郑州举行,1988-05-12,1988-05
在建设有中国特色社会主义的伟大事业中继往开来艰苦奋斗,1988-05-12,1988-05
罗卡尔出任法国新总理,1988-05-12,1988-05
会见华人华侨代表,1988-05-12,1988-05
阿根廷愿全面加强同中国关系,1988-05-12,1988-05
罗卡尔,1988-05-12,1988-05
美国否决谴责以色列入侵黎巴嫩提案,1988-05-12,1988-05
撒切尔夫人会见荣毅仁,1988-05-12,1988-05
奥野仍然否认日本过去有侵略意图日本在野党及舆论抨击奥野的谬论,1988-05-12,1988-05
美国几个议员又就西藏问题说三道四,1988-05-12,1988-05
丹麦大选揭晓,1988-05-12,1988-05
一句话新闻,1988-05-12,1988-05
苏科学院恢复布哈林院士称号,1988-05-12,1988-05
波兰罢工罢课行动基本平息,1988-05-12,1988-05
美参院推迟辩论批准中导条约,1988-05-12,1988-05
斯里兰卡政府和人阵达成协议,1988-05-12,1988-05
越部长会议三位副主席被解职,1988-05-12,1988-05
巴勒斯坦七派维持难民营安全,1988-05-12,1988-05
印度新德里发生一起爆炸事件,1988-05-12,1988-05
保守主义是阻碍改革主要因素,1988-05-12,1988-05
新编码系统将使音乐工业发生革命,1988-05-12,1988-05
我学者在半导体研究中有新发现,1988-05-12,1988-05
“艺术城”克奇克梅特巡礼,1988-05-12,1988-05
从“家庭学校”到哈佛大学,1988-05-12,1988-05
世界艾滋病患者达８８０００多人,1988-05-12,1988-05
鼻吸胰岛素治糖尿病,1988-05-12,1988-05
沱茶抗胆固醇有奇效,1988-05-12,1988-05
治疗牙周病的新疗法,1988-05-12,1988-05
对于“死”的思考,1988-05-12,1988-05
愿无愧于炎黄子孙,1988-05-12,1988-05
老冯头,1988-05-12,1988-05
游兴当向“野”山寻,1988-05-12,1988-05
《鲁迅史实求真录》,1988-05-12,1988-05
黑白木刻《春回》,1988-05-12,1988-05
坚持改革增加生产稳定蔬菜价格,1988-05-13,1988-05
北京举行国际护士节表彰暨纪念会,1988-05-13,1988-05
北京四种副食品十五日起调价,1988-05-13,1988-05
重庆在深化改革中落伍,1988-05-13,1988-05
新国家计委组建将如期完成,1988-05-13,1988-05
民航厦门一客机被劫持到台湾,1988-05-13,1988-05
春耕大忙时农民急盼农用物资供应湖南一些生产经营部门竟乘机抬价,1988-05-13,1988-05
严格查禁掺杂掺假伪造食品,1988-05-13,1988-05
今日抵京访问我国,1988-05-13,1988-05
聂卫平也要注意深居,1988-05-13,1988-05
北京地区天气预报,1988-05-13,1988-05
辽宁机械工业进行调整走向突出优势重点发展,1988-05-13,1988-05
浙江一批私营企业追求新目标,1988-05-13,1988-05
福建成为重要的鞋类出口基地,1988-05-13,1988-05
招标落选人韩文兴拳打中标者,1988-05-13,1988-05
寻找失落的优势,1988-05-13,1988-05
工会要敢于为职工说话办事,1988-05-13,1988-05
上海近千劳模受表彰,1988-05-13,1988-05
统计工作将全面改革,1988-05-13,1988-05
三冶实行干部有偿聘任制,1988-05-13,1988-05
唐加林三年开荒千余亩,1988-05-13,1988-05
“后乐园主”梁周伦,1988-05-13,1988-05
莫让“后乐”成“后忧”,1988-05-13,1988-05
贵阳规定中小学校办企业方向,1988-05-13,1988-05
护士节话护士,1988-05-13,1988-05
首都两年六万大中学生受军训,1988-05-13,1988-05
教师摆摊论是非,1988-05-13,1988-05
种子空间试验后植物性能变化,1988-05-13,1988-05
《松赞干布》在京试映获盛赞,1988-05-13,1988-05
帮助农民看好电视节目,1988-05-13,1988-05
《朱光潜全集》陆续出版,1988-05-13,1988-05
沈阳首次仲裁人才流动争议案,1988-05-13,1988-05
中华杯中国画大奖赛揭晓,1988-05-13,1988-05
巴基斯坦传统工艺品在京展出,1988-05-13,1988-05
全国足球甲级队联赛第二轮战势激烈,1988-05-13,1988-05
我选手四人败阵,1988-05-13,1988-05
古巴队胜山东队,1988-05-13,1988-05
蛟龙奋进究奥秘,1988-05-13,1988-05
友好的足球使者,1988-05-13,1988-05
流浪乞讨严重危害社会安定需要各方共同采取措施解决,1988-05-13,1988-05
南昌市政府以法治理城市,1988-05-13,1988-05
全军百余青年官兵在京聚会探讨军队共青团工作的改革,1988-05-13,1988-05
抓紧调整农村基层党组织设置,1988-05-13,1988-05
烟台加强农村基层党组织建设,1988-05-13,1988-05
保密、遮丑和透明度,1988-05-13,1988-05
关于西沙群岛、南沙群岛问题的备忘录,1988-05-13,1988-05
民建举行四届中常会八次全会,1988-05-13,1988-05
南航四中队团支部被评为全军先进,1988-05-13,1988-05
杨献庭受贿案终审判决,1988-05-13,1988-05
阎明复会见顾毓琇先生,1988-05-13,1988-05
杨主席任免一批驻外大使,1988-05-13,1988-05
简讯,1988-05-13,1988-05
承包制是深化改革之路,1988-05-13,1988-05
不能利用通货膨胀来积累资金,1988-05-13,1988-05
《社会主义经济的运行、发展和调节》,1988-05-13,1988-05
《哲学专题二十讲》,1988-05-13,1988-05
《在历史的转折中》作者龚育之三联书店出版,1988-05-13,1988-05
美国政府与诺列加直接谈判,1988-05-13,1988-05
美苏外长在日内瓦会谈,1988-05-13,1988-05
邓小平和撒切尔夫人当选,1988-05-13,1988-05
毙伤越军万余人攻克据点三百多,1988-05-13,1988-05
里根支持布什竞选总统,1988-05-13,1988-05
希望苏联积极协助解决柬问题,1988-05-13,1988-05
中美商贸联委会第六次会议闭幕,1988-05-13,1988-05
奥野表示无意取消全部发言,1988-05-13,1988-05
罗马尼亚的大型养猪企业,1988-05-13,1988-05
尼加拉瓜反政府武装内部分裂,1988-05-13,1988-05
危地马拉挫败一起军事政变,1988-05-13,1988-05
一句话新闻,1988-05-13,1988-05
日夫科夫接见宋健国务委员,1988-05-13,1988-05
昂纳克接见我工会代表团,1988-05-13,1988-05
葡庆祝葡中工商协会成立十周年,1988-05-13,1988-05
约旦国王建议成立泛阿拉伯军,1988-05-13,1988-05
弗拉尼茨基当选奥社会党主席,1988-05-13,1988-05
美国人口达二亿四千五百多万,1988-05-13,1988-05
英一架旋风战斗机训练中坠毁,1988-05-13,1988-05
民主德国判处九名新纳粹分子,1988-05-13,1988-05
亚太经济前景东京会议开幕,1988-05-13,1988-05
苏美首都计算机直接线路开通,1988-05-13,1988-05
中日学者研究增感剂获成功,1988-05-13,1988-05
美国几家银行共同采取措施股市危机以来利率首次上浮,1988-05-13,1988-05
亚马孙地区毁林引起的沉思,1988-05-13,1988-05
伦敦股市价格下跌,1988-05-13,1988-05
欧共体实施新计划加快应用科研成果,1988-05-13,1988-05
一九八七年全世界核能进一步发展,1988-05-13,1988-05
新加坡对浪费食物者罚款,1988-05-13,1988-05
身残志不衰,1988-05-13,1988-05
长江上游水土流失严重国务院决定进行重点防治,1988-05-14,1988-05
阿方辛总统等阿根廷贵宾抵京杨主席主持仪式宴会热烈欢迎,1988-05-14,1988-05
加速深化文艺团体体制改革,1988-05-14,1988-05
烟台农村许多独女户不要二胎,1988-05-14,1988-05
辽宁７０家企业拟聘百名外国专家,1988-05-14,1988-05
中国希望加强同西欧合作,1988-05-14,1988-05
奥野被迫辞去国土厅长官职务,1988-05-14,1988-05
在国际上首获铁磁性准晶体材料,1988-05-14,1988-05
被劫客机原乘客安抵广州,1988-05-14,1988-05
武昌站连续１３天停售硬卧票,1988-05-14,1988-05
人民日报出版社即将出版《沿海地区经济发展战略》,1988-05-14,1988-05
黔北交通干线马合公路通车,1988-05-14,1988-05
亮难题，奖妙计,1988-05-14,1988-05
被劫持到台湾的客机安返厦门,1988-05-14,1988-05
北京地区天气预报,1988-05-14,1988-05
依靠《企业法》深化企业改革,1988-05-14,1988-05
贺兰生资公司抬价销售化肥,1988-05-14,1988-05
退款事未了,1988-05-14,1988-05
宽甸县制定开明政策,1988-05-14,1988-05
我轻工发展锐进势态未减,1988-05-14,1988-05
渔业资源污染触目惊心,1988-05-14,1988-05
不达目的不罢休,1988-05-14,1988-05
雁北“小老树”大片濒临死亡,1988-05-14,1988-05
金洞“丰产林”人工速育速生,1988-05-14,1988-05
喜：全国猪牛羊肉首季产量再增忧：生猪存栏下降猪肉供应偏紧,1988-05-14,1988-05
我邮政储蓄两年见成效,1988-05-14,1988-05
湖南表彰物价监督先进集体,1988-05-14,1988-05
天津办房产交易换房市场,1988-05-14,1988-05
高效微机节电器投入使用,1988-05-14,1988-05
我公布去年计划生育统计数字,1988-05-14,1988-05
全国城市运动会会徽吉祥物,1988-05-14,1988-05
商品经济海洋里的科普之舟,1988-05-14,1988-05
三部四校支援西藏农牧学院,1988-05-14,1988-05
新闻改革需要宏观思考和切实努力,1988-05-14,1988-05
国务院批准生物技术发展政策要点,1988-05-14,1988-05
香山慈幼院校友会成立,1988-05-14,1988-05
解决百年未果的灭弧难题徐国祥发明无弧互补开关,1988-05-14,1988-05
空军成立科技联合开发集团,1988-05-14,1988-05
《一个美国人看旧中国》中译本出版,1988-05-14,1988-05
一个似乎无解的“方程”,1988-05-14,1988-05
首届全国城市运动会筹备工作进展顺利,1988-05-14,1988-05
全国城市运动会简介,1988-05-14,1988-05
朝鲜女子手球队结束访华比赛,1988-05-14,1988-05
朱建华仅跳过２米０５,1988-05-14,1988-05
中国女排战胜古巴队,1988-05-14,1988-05
李心意打入半决赛,1988-05-14,1988-05
中国羽毛球队今日出征,1988-05-14,1988-05
亚乒赛团体赛分组抽签揭晓,1988-05-14,1988-05
福建纪检部门支持改革开放,1988-05-14,1988-05
两起案件的思考,1988-05-14,1988-05
老山对越防御作战英雄竞出,1988-05-14,1988-05
邢台地委请群众监督干部,1988-05-14,1988-05
汽车部队占全军兵员十分之一,1988-05-14,1988-05
论名誉会长之类,1988-05-14,1988-05
吴学谦会见印度国大党（英）代表团,1988-05-14,1988-05
潍坊寒亭区信访工作做得好,1988-05-14,1988-05
爱尔兰总统离鲁赴沪访问,1988-05-14,1988-05
国务院任免一批国家工作人员,1988-05-14,1988-05
深圳破获两起重大涉外盗窃案,1988-05-14,1988-05
简讯,1988-05-14,1988-05
黄教授为他破例,1988-05-14,1988-05
我和伯父母生活几年，是否构成过继关系？,1988-05-14,1988-05
为学生创造安静的读书环境,1988-05-14,1988-05
学生吃饭农民洗碗,1988-05-14,1988-05
校园里的“麻将热”,1988-05-14,1988-05
这难道又是挂靠户所为吗？,1988-05-14,1988-05
利用啤酒的下脚料,1988-05-14,1988-05
回收这批有色金属,1988-05-14,1988-05
我的购货款终于找回来了,1988-05-14,1988-05
好心医生认母解难,1988-05-14,1988-05
狠儿恶媳逼娘上吊,1988-05-14,1988-05
美方应减少贸易限制以扩大双边贸易,1988-05-14,1988-05
开道,1988-05-14,1988-05
法国新政府组成,1988-05-14,1988-05
美同意取消对诺列加贩毒指控,1988-05-14,1988-05
访世界尽头——火地岛,1988-05-14,1988-05
一句话新闻,1988-05-14,1988-05
美法院判处董桂森廿七年徒刑,1988-05-14,1988-05
日本外相就奥野辞职发表讲话说日本对历史认识无任何变化,1988-05-14,1988-05
名古屋南京友好石碑再遭破坏,1988-05-14,1988-05
以色列空袭巴勒斯坦游击队基地,1988-05-14,1988-05
无理的否决,1988-05-14,1988-05
美苏外长签署有关中导条约两项文件,1988-05-14,1988-05
基辛格宴请田纪云,1988-05-14,1988-05
金泳三再任南朝鲜民主党总裁,1988-05-14,1988-05
秘鲁总统接受全体内阁的辞职,1988-05-14,1988-05
阿游击队击落两架苏联直升机,1988-05-14,1988-05
印度治安部队拘捕闯金庙的人,1988-05-14,1988-05
西德一天内发生多起森林火灾,1988-05-14,1988-05
维护和加速改革,1988-05-14,1988-05
西德将向苏联贷款３５亿马克,1988-05-14,1988-05
今夏炎热干燥缘于太阳爆炸,1988-05-14,1988-05
联大批准中美洲经济合作特别计划,1988-05-14,1988-05
英国皇家外科学院接纳黄国俊为荣誉院士,1988-05-14,1988-05
强调加紧进行经济改革,1988-05-14,1988-05
非洲国家积极调整农业政策,1988-05-14,1988-05
印度对人口出生率增长表示担忧,1988-05-14,1988-05
为飞机安装“肋骨”,1988-05-14,1988-05
护林防火的技术与措施,1988-05-14,1988-05
国家物价局发布处罚规定,1988-05-15,1988-05
国务院批准深化物资体制改革方案,1988-05-15,1988-05
赵紫阳会见阿方辛,1988-05-15,1988-05
李鹏和阿方辛举行会谈,1988-05-15,1988-05
依法管理监督价格（本报评论）,1988-05-15,1988-05
赵紫阳会见朝鲜党政代表团,1988-05-15,1988-05
中不两国边界问题可以协商解决,1988-05-15,1988-05
庄希泉逝世,1988-05-15,1988-05
要求台湾方面严惩劫机分子,1988-05-15,1988-05
我将建立统计违法案件通告制度,1988-05-15,1988-05
山东半岛新曙光,1988-05-15,1988-05
北京地区天气预报,1988-05-15,1988-05
陕西调整区域均衡发展战略,1988-05-15,1988-05
国营食品部门大肆炒卖猪票据,1988-05-15,1988-05
奇闻的背后,1988-05-15,1988-05
如何走出“谷底”？,1988-05-15,1988-05
完善租赁制迫在眉睫,1988-05-15,1988-05
福鼎３万亩地实行租赁,1988-05-15,1988-05
北京拍卖市场速写,1988-05-15,1988-05
临汝选派科技人员下乡,1988-05-15,1988-05
肇庆五交公司横向联合辟新途帮助不起眼厂商打开市场销路,1988-05-15,1988-05
舒城白鹅似流云,1988-05-15,1988-05
绿肥面积减少应引起重视,1988-05-15,1988-05
江西查处万安校舍倒塌事件,1988-05-15,1988-05
吉林设农业技术推广奖,1988-05-15,1988-05
“为小苗浇上泉水”,1988-05-15,1988-05
胡启立阎明复等观看藏族歌舞团演出,1988-05-15,1988-05
北京地区大学生科学节闭幕,1988-05-15,1988-05
《中国人口》丛书基本完成,1988-05-15,1988-05
第九届全国好新闻评选揭晓,1988-05-15,1988-05
１９８７年全国最佳邮票评出,1988-05-15,1988-05
多些理解多些引导,1988-05-15,1988-05
给新生儿命名不要用冷僻字,1988-05-15,1988-05
教科文零讯,1988-05-15,1988-05
全国足球甲级队联赛战罢三轮,1988-05-15,1988-05
全国健美锦标赛在徐州开场,1988-05-15,1988-05
金牌大战前景如何,1988-05-15,1988-05
中国队连胜两场,1988-05-15,1988-05
苏联东欧国家显现奥运优势,1988-05-15,1988-05
为拿到最后一张“门票”,1988-05-15,1988-05
我选手前景艰难,1988-05-15,1988-05
山东各级法院注重道德纪律教育,1988-05-15,1988-05
沈阳改变录用机关干部办法,1988-05-15,1988-05
广州军区部队运用法律解决军民纠纷,1988-05-15,1988-05
涿州基本路线教育具体生动,1988-05-15,1988-05
重视法律人才的培养,1988-05-15,1988-05
胡启立会见印度国大党（英）代表团,1988-05-15,1988-05
中国不丹第五轮边界会谈签署联合公报,1988-05-15,1988-05
北京东城区委认真做接收工作,1988-05-15,1988-05
钱其琛与阿根廷外长会谈,1988-05-15,1988-05
阿方辛总统在北大发表演讲,1988-05-15,1988-05
简讯,1988-05-15,1988-05
范培义同志在京病逝,1988-05-15,1988-05
布朗族的婚俗,1988-05-15,1988-05
病榻呓语,1988-05-15,1988-05
在午餐会上,1988-05-15,1988-05
路边石,1988-05-15,1988-05
西樵新声,1988-05-15,1988-05
柳兰,1988-05-15,1988-05
和谐,1988-05-15,1988-05
记一棵树的倒下,1988-05-15,1988-05
联大决议敦促美国参加国际仲裁,1988-05-15,1988-05
愚蠢的“新招”,1988-05-15,1988-05
苏撤军前夕喀布尔气氛紧张,1988-05-15,1988-05
阿拉伯示威者同以警察发生冲突,1988-05-15,1988-05
安哥拉南非双边会谈结束,1988-05-15,1988-05
诺列加否认同美特使有过会晤,1988-05-15,1988-05
苏联希望同阿抵抗力量会谈,1988-05-15,1988-05
希望企业家到中国投资,1988-05-15,1988-05
密特朗总统公布私人财产,1988-05-15,1988-05
一句话新闻,1988-05-15,1988-05
苏联宣布撤军后的阿富汗局势,1988-05-15,1988-05
奥野辞职的启示,1988-05-15,1988-05
莫鲁瓦当选法社会党第一书记,1988-05-15,1988-05
喀麦隆总统保罗·比亚宣誓就职,1988-05-15,1988-05
秘鲁新内阁全体部长宣誓就职,1988-05-15,1988-05
黎巴嫩两派民兵再次发生冲突,1988-05-15,1988-05
八艘美国军舰驶往多事的海湾,1988-05-15,1988-05
美国在内华达进行地下核试验,1988-05-15,1988-05
阳光·自由·国旗,1988-05-15,1988-05
外国幽默画,1988-05-15,1988-05
昆虫学家的忠告,1988-05-15,1988-05
电视的脚步,1988-05-15,1988-05
腾云驾雾，不许吞云吐雾,1988-05-15,1988-05
珍惜每一滴水,1988-05-15,1988-05
优秀生与巧克力,1988-05-15,1988-05
法国人与广告,1988-05-15,1988-05
麦德林卡特尔贩毒集团,1988-05-15,1988-05
蛙体中的“新大陆”,1988-05-15,1988-05
少一个都不行,1988-05-15,1988-05
中国古代的大同思想,1988-05-15,1988-05
干脆收一点学费,1988-05-15,1988-05
录药“磁带”,1988-05-15,1988-05
合理吃好一日三餐,1988-05-15,1988-05
自觉地探索价值规律,1988-05-15,1988-05
高技术与老年人的价值,1988-05-15,1988-05
粗糙飞机,1988-05-15,1988-05
午睡习惯之弊病,1988-05-15,1988-05
北京调价之后,1988-05-16,1988-05
国务院办公厅紧急通知各地各部门 加强税收工作保障国家的财政收入,1988-05-16,1988-05
我国工业产品结构调整见初效,1988-05-16,1988-05
上海教育经费增加１５００万元,1988-05-16,1988-05
深圳经济特区发展公司率先经营海外房地产业,1988-05-16,1988-05
黑龙江省全力排涝抢种,1988-05-16,1988-05
第三世界是最大和平力量,1988-05-16,1988-05
今日抵京访问我国,1988-05-16,1988-05
十八里店乡  菜圃四季香,1988-05-16,1988-05
两种变通,1988-05-16,1988-05
苏军十五日开始撤离阿富汗,1988-05-16,1988-05
阿拉法特大马士革办事处将恢复工作,1988-05-16,1988-05
北京地区天气预报,1988-05-16,1988-05
不能强扣农民粮食预购定金,1988-05-16,1988-05
“先予后取”颠倒不得（国内短评）,1988-05-16,1988-05
“两权分离”是企业法的灵魂,1988-05-16,1988-05
河北开展农资价格大检查,1988-05-16,1988-05
东莞电子业从来料加工起飞,1988-05-16,1988-05
变干部聘任制为公开竞争招标,1988-05-16,1988-05
伪劣羽绒服充斥乌鲁木齐市场,1988-05-16,1988-05
上海经济区银行集团打破条块分割,1988-05-16,1988-05
山东武汉加强企业效益审计,1988-05-16,1988-05
《国外最新实用专利技术资料》向社会推出,1988-05-16,1988-05
我国铁路长距离载运特长桥梁成功,1988-05-16,1988-05
简讯,1988-05-16,1988-05
食草畜禽不可不抓,1988-05-16,1988-05
广开肉路,1988-05-16,1988-05
多发展瘦肉型肉食,1988-05-16,1988-05
编者按,1988-05-16,1988-05
各级领导要对师生安全负责,1988-05-16,1988-05
孩子安危放第几位？,1988-05-16,1988-05
国务院批准信息技术发展政策要点,1988-05-16,1988-05
清华大学科技力量投入主战场四十一项成果效益均逾百万元,1988-05-16,1988-05
延安马列学院建校五十周年纪念会在京举行,1988-05-16,1988-05
我国即将宣布参赛项目,1988-05-16,1988-05
中国男女队团体赛首战双双告捷,1988-05-16,1988-05
中国选手全部败北,1988-05-16,1988-05
行家展望亚乒赛,1988-05-16,1988-05
攀登长城越野赛吸引首都近千人,1988-05-16,1988-05
中国队负于匈牙利队,1988-05-16,1988-05
熊倪陈小丹分获男女跳台冠军,1988-05-16,1988-05
蓟县下营中学学生宿舍坍塌,1988-05-16,1988-05
“下海”者说,1988-05-16,1988-05
清廉从政高效率工作,1988-05-16,1988-05
益阳地区火灾多官僚主义是祸害,1988-05-16,1988-05
如此蛮横交通局长,1988-05-16,1988-05
天津海事法院国际声誉日益提高,1988-05-16,1988-05
广泛探讨新形势下管好党风党纪,1988-05-16,1988-05
公证队伍要发展素质要提高,1988-05-16,1988-05
张家口评选好文件好简报,1988-05-16,1988-05
军功章映衬白头翁,1988-05-16,1988-05
青岛某团成立军人代表委员会,1988-05-16,1988-05
阿方辛总统在京举行记者招待会,1988-05-16,1988-05
爱尔兰总统结束对中国的访问,1988-05-16,1988-05
简讯,1988-05-16,1988-05
公民政治权利岂能侵犯,1988-05-16,1988-05
尊重隐私权,1988-05-16,1988-05
普法“专业户”,1988-05-16,1988-05
深圳经济罪案举报中心受欢迎,1988-05-16,1988-05
黎天荣著书填补消防管理科学空白,1988-05-16,1988-05
二汽发动机厂重视普法,1988-05-16,1988-05
论竞争,1988-05-16,1988-05
密特朗总统宣布解散议会,1988-05-16,1988-05
世界最大油轮在海湾遭袭击,1988-05-16,1988-05
发展美中贸易必须去掉贸易保护主义,1988-05-16,1988-05
里根将否决新贸易法案,1988-05-16,1988-05
寻求解决柬埔寨问题的又一次努力,1988-05-16,1988-05
南联邦议会对米库利奇政府表示信任,1988-05-16,1988-05
华约成员国外长在柏林会晤,1988-05-16,1988-05
两国将加强军事合作,1988-05-16,1988-05
游击队不为撤退苏军提供安全保证,1988-05-16,1988-05
占据金庙的印度锡克教徒投降,1988-05-16,1988-05
