严格控制民工外出,1989-03-06,1989-03
重视农业必须重视农民利益,1989-03-06,1989-03
赵少飞研创助产新法  产妇分娩痛苦可减轻,1989-03-06,1989-03
汕头国贸公司跨国经营,1989-03-06,1989-03
境外投资外汇管理  我国发布施行办法,1989-03-06,1989-03
卖版面——引起社会各界强烈反应  重报格——株洲日报取消有偿报道,1989-03-06,1989-03
拉萨发生严重骚乱事件,1989-03-06,1989-03
公费过年害人不浅  武汉肠胃病人剧增,1989-03-06,1989-03
怎样看现代新儒学思潮,1989-03-06,1989-03
艾滋病“瘟疫”冲击全球,1989-03-06,1989-03
雨雪知春归,1989-03-06,1989-03
１９９０年为国际扫盲年,1989-03-06,1989-03
上钢五厂建立利益共同体,1989-03-06,1989-03
南雄用经济手段控编,1989-03-06,1989-03
给先进人物“减压”,1989-03-06,1989-03
湖南计委领导带头拒贿,1989-03-06,1989-03
坚持共产党领导的多党合作,1989-03-06,1989-03
科协组织咨询服务  避免经济决策失误,1989-03-06,1989-03
凭权力占用资金久不还  佳木斯一批干部吃企业,1989-03-06,1989-03
取得准销证方可进市,1989-03-06,1989-03
今年秋冬服装流行“四主题”,1989-03-06,1989-03
河北有效控制信贷规模,1989-03-06,1989-03
香港前途光明地位不能替代,1989-03-06,1989-03
被判“资匪罪”的两台商获释,1989-03-06,1989-03
康克清会见日本客人,1989-03-06,1989-03
简讯,1989-03-06,1989-03
一女军人举办时装展,1989-03-06,1989-03
荣成海带产量占到全国一半,1989-03-06,1989-03
西宁立法禁酗酒,1989-03-06,1989-03
天津无人看守道口  试装太阳能示警灯,1989-03-06,1989-03
贵州省军工企业民品产值逾十亿,1989-03-06,1989-03
中苏合作改造佳木斯造纸厂,1989-03-06,1989-03
江苏招标实施“丰收计划”,1989-03-06,1989-03
劣质眼镜充斥武汉,1989-03-06,1989-03
泥沙淤积乌江渡电站濒危  专家建议早动手认真治理,1989-03-06,1989-03
和平人士遭以军阻拦,1989-03-06,1989-03
不许任何人拿国家命运当儿戏  驻科索沃部队正处于高度戒备,1989-03-06,1989-03
波圆桌会议出现严重分歧,1989-03-06,1989-03
匈以签署政府级航空协定,1989-03-06,1989-03
骚乱三天死伤两千,1989-03-06,1989-03
巴解反驳美国无端警告,1989-03-06,1989-03
肯尼亚和苏丹互逐外交官,1989-03-06,1989-03
田纪云副总理拜会伊朗总理,1989-03-06,1989-03
乌干达调查乌肯冲突  呼吁通过谈判解决问题,1989-03-06,1989-03
贝克飞往维也纳,1989-03-06,1989-03
毛里求斯总理险遭不测,1989-03-06,1989-03
米格机厂生产民用机械,1989-03-06,1989-03
伊朗否认要求同英会谈,1989-03-06,1989-03
拯救臭氧层伦敦会议开幕,1989-03-06,1989-03
美国民航地勤人员罢工  布什称不屈服经济讹诈,1989-03-06,1989-03
美日合作生产新型战斗机,1989-03-06,1989-03
友好往来,1989-03-06,1989-03
天皇葬礼秘请南非  日外务省支吾其词,1989-03-06,1989-03
新华书店改革发行体制见成效,1989-03-06,1989-03
“小辫子专政”结束之后……,1989-03-06,1989-03
黄梅戏面临危机,1989-03-06,1989-03
东海舰队官兵参加读书活动,1989-03-06,1989-03
《一九八八汉城：不屈的旗帜》,1989-03-06,1989-03
《朱熹与丽娘》为戏曲艺术振兴探路,1989-03-06,1989-03
商业部建立商业文艺基金会,1989-03-06,1989-03
电影《眼镜里的海》摄制完成,1989-03-06,1989-03
意大利歌剧《托斯卡》在京公演,1989-03-06,1989-03
电视连续剧《座山雕世家》开拍,1989-03-06,1989-03
法国里昂芭蕾舞团在沪演出,1989-03-06,1989-03
一天刷新４项世界纪录,1989-03-06,1989-03
首届全国台球个人公开赛进入复赛,1989-03-06,1989-03
麦肯罗再登网球冠军宝座,1989-03-06,1989-03
墨绿台边众生相,1989-03-06,1989-03
简讯,1989-03-06,1989-03
中国女飞毛腿赵友凤后来居上,1989-03-06,1989-03
公开：遏制腐败的屏障,1989-03-06,1989-03
“新权威主义”析,1989-03-06,1989-03
李广臣拒礼引起的议论,1989-03-06,1989-03
农村基层党组织建设报忧,1989-03-06,1989-03
谁来做卫国好儿郎？,1989-03-06,1989-03
一支不再古老的歌,1989-03-06,1989-03
如此照相,1989-03-06,1989-03
怎样理解和试行商业企业股份制,1989-03-06,1989-03
现代新儒学思潮,1989-03-06,1989-03
要把群众情绪作为第一信号,1989-03-06,1989-03
把企业文化摆在更重要的位置上,1989-03-06,1989-03
传播媒介的责任和怎样取得信赖,1989-03-06,1989-03
《经济运行的均衡与非均衡分析》评介,1989-03-06,1989-03
探索艾滋病的奥秘,1989-03-06,1989-03
艾滋病“瘟疫”的冲击,1989-03-06,1989-03
未来的计算机,1989-03-06,1989-03
噪音致癌,1989-03-06,1989-03
集体健忘,1989-03-06,1989-03
鲁迅的自题小像诗,1989-03-06,1989-03
文不如其人,1989-03-06,1989-03
白杨,1989-03-06,1989-03
“响”派号手叶甫图申科,1989-03-06,1989-03
寂静的沪沽湖〔油画〕,1989-03-06,1989-03
北京地区天气预报,1989-03-07,1989-03
我国女干部超过８７０万,1989-03-07,1989-03
全国撤并公司一万七千家  党政机关办企业基本制止,1989-03-07,1989-03
解放军半数营区园林化  三总部提出绿化总目标,1989-03-07,1989-03
我援外成套项目逾千,1989-03-07,1989-03
化工部整顿公司作表率,1989-03-07,1989-03
国家增加投资建铁路,1989-03-07,1989-03
劳动服务公司创办十年成绩可喜,1989-03-07,1989-03
土地使用权有偿出让  今年将扩大试点范围,1989-03-07,1989-03
西汉三万多片文字骨签出土,1989-03-07,1989-03
儿孙上学用公车——气派  车号抄下登报纸——难堪,1989-03-07,1989-03
江西廉政建设抓三件事,1989-03-07,1989-03
拉萨街头骚乱未已,1989-03-07,1989-03
竹下在日本国会承认  上次大战是侵略战争,1989-03-07,1989-03
且慢叫好,1989-03-07,1989-03
春耕正忙农资苦少,1989-03-07,1989-03
农资专营实行两月  初见成效问题不少,1989-03-07,1989-03
省长登台述职  政府工作公开,1989-03-07,1989-03
高法表彰桃源县法院,1989-03-07,1989-03
建议小学低年级不留家庭作业,1989-03-07,1989-03
取消人为障碍方便老兵返家,1989-03-07,1989-03
全国城乡集市达七万,1989-03-07,1989-03
肿瘤进入综合治疗时代,1989-03-07,1989-03
国际针灸医师水平考核委员会成立,1989-03-07,1989-03
丹东人置办新“大件”,1989-03-07,1989-03
台湾国民党部分人事更动,1989-03-07,1989-03
箭竹开花期可测,1989-03-07,1989-03
华北用外资开发低产田,1989-03-07,1989-03
全国试办５种新型商业,1989-03-07,1989-03
简讯,1989-03-07,1989-03
沈阳春节送礼户均３２０元,1989-03-07,1989-03
藏著斌养虎受表彰,1989-03-07,1989-03
女子爱国储蓄受欢迎,1989-03-07,1989-03
沪企业家办理论沙龙,1989-03-07,1989-03
丈夫戍边有功妻子将获奖章,1989-03-07,1989-03
广东让基建回复正常“体温”,1989-03-07,1989-03
空军飞播造林种草,1989-03-07,1989-03
农民成为购买农机主户,1989-03-07,1989-03
专家比较中美儿童就学状况,1989-03-07,1989-03
欧洲常规裁军谈判在即,1989-03-07,1989-03
拘留该省前领导人,1989-03-07,1989-03
值得重视的观点,1989-03-07,1989-03
美东航公司呼吁飞行员复工,1989-03-07,1989-03
田纪云拜会伊朗总统,1989-03-07,1989-03
设立国际保护臭氧层基金  发达国家应为环保出大力,1989-03-07,1989-03
组成基础广泛的政府,1989-03-07,1989-03
巴没有武装人员进入阿富汗,1989-03-07,1989-03
自欺欺人,1989-03-07,1989-03
卡特主张平息《撒旦诗篇》风波,1989-03-07,1989-03
西德绿党选出新领导机构,1989-03-07,1989-03
伦敦郊区两列火车相撞,1989-03-07,1989-03
印共强调与印共（马）的团结,1989-03-07,1989-03
中日举行外交定期协商,1989-03-07,1989-03
简讯,1989-03-07,1989-03
京剧与歌舞伎合排《龙王》在日公演,1989-03-07,1989-03
四川文化市场呈现勃勃生机,1989-03-07,1989-03
中国图书出版洽谈会成交活跃,1989-03-07,1989-03
逛上海文庙旧书市,1989-03-07,1989-03
王平和她的艺术,1989-03-07,1989-03
人在两座舞台上扮演自己,1989-03-07,1989-03
电视剧《白色山岗》受好评,1989-03-07,1989-03
中日合拍电视剧《别了，李香兰》,1989-03-07,1989-03
民族唱法女歌唱家比赛揭晓,1989-03-07,1989-03
北京成立中国茶文化研究会,1989-03-07,1989-03
《解放军文艺史料选编》出版,1989-03-07,1989-03
《康德第一保镖传奇》,1989-03-07,1989-03
北京地质礼堂办娱乐中心,1989-03-07,1989-03
全国青运会决出６枚冰上金牌,1989-03-07,1989-03
横竿上的飞跃,1989-03-07,1989-03
奥选手获大学生冬运会男子高台冠军,1989-03-07,1989-03
关雪清获国际跳水赛金牌,1989-03-07,1989-03
郑丽娟获港一哩跑赛冠军,1989-03-07,1989-03
黄志红获世界室内田径赛女子铅球亚军,1989-03-07,1989-03
左权获保拳击邀请赛第三名,1989-03-07,1989-03
富士通杯世界围棋赛参赛选手名单公布,1989-03-07,1989-03
苏美选手夺得美国杯体操赛全能冠军,1989-03-07,1989-03
捷选手获大学生冬运会３０公里越野滑雪前三名,1989-03-07,1989-03
“逃”与“征”的较量,1989-03-07,1989-03
万事不求人与求人万事难,1989-03-07,1989-03
怎样突破徘徊？,1989-03-07,1989-03
尽快明确农业增长的几项政策,1989-03-07,1989-03
为啥全村选中一副春联,1989-03-07,1989-03
茧丝绸的反思,1989-03-07,1989-03
艺术风格的新尝试,1989-03-07,1989-03
疏离与重聚,1989-03-07,1989-03
小说与“价值”,1989-03-07,1989-03
喜读《曹禺传》,1989-03-07,1989-03
长篇小说《颤抖的灵魂》讨论会,1989-03-07,1989-03
好莱坞童星的自述,1989-03-07,1989-03
谁之过（编后随感）,1989-03-07,1989-03
七十年代名扬泳坛  八十年代志游太空,1989-03-07,1989-03
法国妇女的天地,1989-03-07,1989-03
巾帼采珍,1989-03-07,1989-03
悟《西游记》的“＠①尾”,1989-03-07,1989-03
世纪之桥,1989-03-07,1989-03
《蒙古秘史》人物画展,1989-03-07,1989-03
评胡适答王近庸先生,1989-03-07,1989-03
海上人（外一首）,1989-03-07,1989-03
北京地区天气预报,1989-03-08,1989-03
首都各界妇女集会庆“三八”,1989-03-08,1989-03
工商部门查处六万余大案,1989-03-08,1989-03
面对时代的挑战,1989-03-08,1989-03
国务院下令拉萨实行戒严,1989-03-08,1989-03
合同定购粮油４月起提价,1989-03-08,1989-03
生猪产销再度反复  商业部门猪肉胀库,1989-03-08,1989-03
欧洲常规裁军谈判开幕  华约北约宣布各自建议,1989-03-08,1989-03
西藏上层爱国人士拥护戒严,1989-03-08,1989-03
拉萨戒严后街头平静,1989-03-08,1989-03
李鹏会见美国客人,1989-03-08,1989-03
赵志浩当选山东省省长,1989-03-08,1989-03
伊朗宣布同英国断交,1989-03-08,1989-03
三峡工程论证工作全部完成,1989-03-08,1989-03
暴力抗税案件不断发生  公安税务部门要求严处,1989-03-08,1989-03
江西公审暴力抗税案,1989-03-08,1989-03
骚乱分子施暴记,1989-03-08,1989-03
天津拟办２０件实事,1989-03-08,1989-03
曲阜古树名木多,1989-03-08,1989-03
云南白糖大量积压,1989-03-08,1989-03
洪湖分蓄洪工程将续建,1989-03-08,1989-03
旅顺一妇女海上遇险  漂泊六天后平安生还,1989-03-08,1989-03
将军出马宣讲形势,1989-03-08,1989-03
广东人大旁听席冷落,1989-03-08,1989-03
台湾又兴回大陆扫墓潮,1989-03-08,1989-03
“金钥匙”计划推向全国  盲童进普校不再是梦想,1989-03-08,1989-03
简讯,1989-03-08,1989-03
呼市火车站的双向流动,1989-03-08,1989-03
解决温饱工作成效显著  穷县致富尚须长期努力,1989-03-08,1989-03
华约北约各提新方案,1989-03-08,1989-03
美东航解雇六千职工,1989-03-08,1989-03
批评外汇使用不当,1989-03-08,1989-03
委内瑞拉全国取消宵禁,1989-03-08,1989-03
不同喀布尔政权谈判,1989-03-08,1989-03
中以代表在纽约会晤,1989-03-08,1989-03
苏丹南部局势趋于紧张,1989-03-08,1989-03
今年非洲经济将略有改善,1989-03-08,1989-03
英首相：填满臭氧洞需一百年,1989-03-08,1989-03
托尔问题辩论进入第二周  一民主党人表示支持托尔,1989-03-08,1989-03
英伦交通事故频繁  又有一对列车相撞,1989-03-08,1989-03
舒尔茨出任波音公司董事,1989-03-08,1989-03
苏丹暂时渡过政局危机,1989-03-08,1989-03
世界盲人三千万,1989-03-08,1989-03
英国出土１７００年前铅棺,1989-03-08,1989-03
日本为保护长江白鳍豚募捐,1989-03-08,1989-03
古发现原始树种  为一种软木棕榈,1989-03-08,1989-03
三万女企业家大展风采,1989-03-08,1989-03
“知心姐姐”电话为童解难,1989-03-08,1989-03
死者对生者的挑战,1989-03-08,1989-03
重庆罐头食品总厂怪事一桩：被判无期徒刑罪犯竟获头奖,1989-03-08,1989-03
周里京交通肇事新闻界纷纷评说,1989-03-08,1989-03
雍和宫里的祝福,1989-03-08,1989-03
信息乃开路先锋深圳安装八万自动电话  交椅非钢铁铸就工人开除一位失职厂长,1989-03-08,1989-03
一个吻换来三年劳教,1989-03-08,1989-03
亚运会筹备进入关键阶段,1989-03-08,1989-03
她们闯进男人的世界,1989-03-08,1989-03
前联邦德国足球队长鲁梅尼格将退役,1989-03-08,1989-03
世界大学生冬运会北欧冬季两项决出金牌,1989-03-08,1989-03
一百比一的启示,1989-03-08,1989-03
倾斜的“半边天”,1989-03-08,1989-03
迷惘·冲动·希望,1989-03-08,1989-03
“远功”与“近利”,1989-03-08,1989-03
高技术产品的售后服务,1989-03-08,1989-03
海西高原野生动物在呼救,1989-03-08,1989-03
供销社应恢复销售科技书籍,1989-03-08,1989-03
这里的校舍建设又开工了,1989-03-08,1989-03
宜春市工商银行强迫储蓄  江西省政府发文明令禁止,1989-03-08,1989-03
信访数字下降说明了什么？,1989-03-08,1989-03
晋城郊区信访工作新特点,1989-03-08,1989-03
铁路查堵“三品”  依然防不胜防,1989-03-08,1989-03
偷盗铁路运输货物现象日趋严重,1989-03-08,1989-03
银行不应强行扣款储蓄,1989-03-08,1989-03
打击专吃铁路的“坐地虎”,1989-03-08,1989-03
铁路运输货物丢失  可忙坏了保险公司,1989-03-08,1989-03
尽快整治长乐陈塘港污染,1989-03-08,1989-03
离休后继续作奉献  周子期是个好党员,1989-03-08,1989-03
一条床罩见精神,1989-03-08,1989-03
搞好私营企业劳动合同的管理,1989-03-08,1989-03
扬长避短振兴经济,1989-03-08,1989-03
要有现代质量意识,1989-03-08,1989-03
服务周到顾客多,1989-03-08,1989-03
荷兰裘皮商的烦恼,1989-03-08,1989-03
产品责任制在日本,1989-03-08,1989-03
包装—质量的要素,1989-03-08,1989-03
通俗文学的希望所在,1989-03-08,1989-03
这如诗如梦的年华,1989-03-08,1989-03
关中金字塔,1989-03-08,1989-03
唐代的漳州府衙,1989-03-08,1989-03
唱歌使他们年轻,1989-03-08,1989-03
卷丹花,1989-03-08,1989-03
是谁在西藏践踏人权？,1989-03-09,1989-03
戒严令发出后,1989-03-09,1989-03
北京地区天气预报,1989-03-09,1989-03
国务院通知清理外贸公司,1989-03-09,1989-03
近二百所普通高校将整顿,1989-03-09,1989-03
工业生产保持增长  结构矛盾依然突出,1989-03-09,1989-03
今年预算调节基金  一成用于农业投入,1989-03-09,1989-03
庄稼病虫害将偏重发生  各地谨防假劣农药坑人,1989-03-09,1989-03
三资企业出口额激增,1989-03-09,1989-03
两英国记者被责令离藏,1989-03-09,1989-03
已有五十三名外国人在沪领取就业许可证,1989-03-09,1989-03
薄一波回忆贺龙,1989-03-09,1989-03
如何尽快改变交通滞后局面,1989-03-09,1989-03
美限制联合国中国籍职员旅行  我提出抗议要求取消歧视措施,1989-03-09,1989-03
去年世界外汇储备增加,1989-03-09,1989-03
中国印尼会商复交,1989-03-09,1989-03
情绪、理性和参与意识,1989-03-09,1989-03
一回避二申报三公开,1989-03-09,1989-03
“三八”节中外妇女在京联欢  军队巾帼会聚一堂,1989-03-09,1989-03
部分边海防军官农村家属可以在原籍转为城镇户口,1989-03-09,1989-03
李铁映在鲁考察教育,1989-03-09,1989-03
企业建利益共同体,1989-03-09,1989-03
１９８８年新闻摄影新“十佳”评出,1989-03-09,1989-03
磁悬浮样车制成,1989-03-09,1989-03
《西藏百题问答》《西藏风土志》出版,1989-03-09,1989-03
先培训后就业凭技术定岗位,1989-03-09,1989-03
周南抵澳门访问,1989-03-09,1989-03
李泽厚当选巴黎哲学院院士,1989-03-09,1989-03
简讯,1989-03-09,1989-03
海城向农民发“绿卡”  承包种养业可优先,1989-03-09,1989-03
上海合理利用外资,1989-03-09,1989-03
高级甜味剂——“甜宝”问世,1989-03-09,1989-03
长途汽车设卧铺,1989-03-09,1989-03
五十种鱼落户青海,1989-03-09,1989-03
刘乐三遗体告别仪式举行,1989-03-09,1989-03
宁夏两糖厂受罚,1989-03-09,1989-03
联合国小组讨论国际会计问题,1989-03-09,1989-03
美苏外长在维也纳会谈,1989-03-09,1989-03
寻求建立相互配合的联系,1989-03-09,1989-03
政府相信圆桌会议会达成协议,1989-03-09,1989-03
匈党中央全会讨论行动纲领,1989-03-09,1989-03
厄游击队放弃武装斗争,1989-03-09,1989-03
田纪云副总理抵土耳其访问,1989-03-09,1989-03
中国准备参加维也纳公约,1989-03-09,1989-03
中共祝贺印共１４大,1989-03-09,1989-03
真实是检验新闻唯一标准,1989-03-09,1989-03
南朝鲜三百青年将赴平壤,1989-03-09,1989-03
中国出口商品展览会在伦敦闭幕,1989-03-09,1989-03
瓦努阿图前总统被判刑,1989-03-09,1989-03
乌兹别克最高苏维埃主席易人,1989-03-09,1989-03
日本前劳动省次官被逮捕,1989-03-09,1989-03
提高妇女地位发挥妇女作用,1989-03-09,1989-03
联大通过召开经济特别联大决议,1989-03-09,1989-03
贸发会议秘书长批评保护主义,1989-03-09,1989-03
读书·买书·藏书,1989-03-09,1989-03
谢添谈《那五》,1989-03-09,1989-03
沈阳演出公司效益显著,1989-03-09,1989-03
第二届全国残疾人艺术调演开幕,1989-03-09,1989-03
发行部门提出应对措施,1989-03-09,1989-03
在歌坛的风景线上,1989-03-09,1989-03
《一半是火焰一半是海水》受警告,1989-03-09,1989-03
中影公司扶持艺术探索片,1989-03-09,1989-03
王持纪创作美国历届总统微刻肖像,1989-03-09,1989-03
《记康克清大姐》出版,1989-03-09,1989-03
全国青少年冬运会落幕,1989-03-09,1989-03
七届全运会拟设３３个比赛项目,1989-03-09,1989-03
哈尔滨队获青运会（冬季）冰球冠军,1989-03-09,1989-03
日“五十铃”男篮将来京,1989-03-09,1989-03
中国队将参加全英羽毛球赛,1989-03-09,1989-03
奥运会战略之我见,1989-03-09,1989-03
铁路在拚搏中呼喊,1989-03-09,1989-03
开场白,1989-03-09,1989-03
莫以利小而不为,1989-03-09,1989-03
“黑心秤”,1989-03-09,1989-03
老舍茶馆迎宾客,1989-03-09,1989-03
往事追寻忆贺龙,1989-03-09,1989-03
境外投资外汇管理办法,1989-03-09,1989-03
民用航空运输不定期飞行管理暂行规定,1989-03-09,1989-03
戈尔巴乔夫：常规裁军初试刀,1989-03-09,1989-03
莫斯科敲响了中东锣鼓,1989-03-09,1989-03
阿根廷兵变内情,1989-03-09,1989-03
南非执政党权力斗争愈演愈烈,1989-03-09,1989-03
美苏“热线电话”,1989-03-09,1989-03
老师的“黄牌”,1989-03-09,1989-03
中国,1989-03-09,1989-03
磨难显真情,1989-03-09,1989-03
中州明珠——百泉,1989-03-09,1989-03
情系月牙泉,1989-03-09,1989-03
加强职工物价监督,1989-03-10,1989-03
总理办公会研究煤炭生产,1989-03-10,1989-03
今年发行国库券五十五亿,1989-03-10,1989-03
沿海开放区货物进出境  海关总署颁布管理规定,1989-03-10,1989-03
西藏自治区又发布三个政府令,1989-03-10,1989-03
拉萨骚乱与人权问题不相干,1989-03-10,1989-03
泰国总理即将访华,1989-03-10,1989-03
拉萨正常秩序初步恢复,1989-03-10,1989-03
太阳爆发强“耀斑”  短波电讯一度中断,1989-03-10,1989-03
中国支持欧佩克限产保价协议,1989-03-10,1989-03
我希望华约北约达成协议  大幅度削减欧洲常规军备,1989-03-10,1989-03
关于“新权威主义”看法不一,1989-03-10,1989-03
童大林主张搞活农村市场,1989-03-10,1989-03
北京地区天气预报,1989-03-10,1989-03
人大常委会举行第七次会议,1989-03-10,1989-03
没有稳定的环境什么也搞不成,1989-03-10,1989-03
各部门年内不要开表彰会,1989-03-10,1989-03
川苏湘鄂四省采取措施  劝说滞留外地民工返乡,1989-03-10,1989-03
简讯,1989-03-10,1989-03
两岸关系明显变化,1989-03-10,1989-03
经贸往来双方得利,1989-03-10,1989-03
文化交流逐步增多  台当局设障没道理,1989-03-10,1989-03
搞活农村市,1989-03-10,1989-03
国务院台办负责指导协调,1989-03-10,1989-03
配方施肥有妙用,1989-03-10,1989-03
农机行业这般难,1989-03-10,1989-03
去年进口货二成劣品,1989-03-10,1989-03
酒好价太高欲买把头“茅台”跌入滞销行列,1989-03-10,1989-03
中越副外长磋商日期尚未商定,1989-03-10,1989-03
中国希望巴尔干各国友好相处,1989-03-10,1989-03
２７万农民到白藤湖度假,1989-03-10,1989-03
台湾法律研究所在京成立,1989-03-10,1989-03
杭州人人读书社  半年读者三十万,1989-03-10,1989-03
段昌国获“国际杰出领导人物奖”,1989-03-10,1989-03
河北鼓励种“爱国发家”棉,1989-03-10,1989-03
上海少数人为出国以身试法,1989-03-10,1989-03
农村医疗机构总数减少,1989-03-10,1989-03
台湾涨价风劲,1989-03-10,1989-03
欧洲裁军谈判气氛良好,1989-03-10,1989-03
联合国提出抗议,1989-03-10,1989-03
匈议长被免职,1989-03-10,1989-03
不堪重负的海外“军事义务”,1989-03-10,1989-03
纳米比亚独立进程即将开始  非洲前线国家举行首脑会议,1989-03-10,1989-03
沃尔维斯港应回归纳米比亚  南非应放弃支持纳白人武装,1989-03-10,1989-03
阿拉法特访问巴基斯坦,1989-03-10,1989-03
要求解散喀布尔政权,1989-03-10,1989-03
美允许巴解三成员入境,1989-03-10,1989-03
承认国际法院的条约司法权,1989-03-10,1989-03
苏共机关改组工作结束,1989-03-10,1989-03
委内瑞拉恢复宪法保障,1989-03-10,1989-03
下世纪石油仍为重要能源,1989-03-10,1989-03
中行在美筹资九千万美元,1989-03-10,1989-03
英每五分钟有一烟民死亡,1989-03-10,1989-03
日试制出多种语言同译系统,1989-03-10,1989-03
美政府雇员中“瘾君子”不少,1989-03-10,1989-03
美自行车销量增加,1989-03-10,1989-03
英国将驱逐一批伊朗人  要求伊关闭驻港总领馆,1989-03-10,1989-03
“死亡商人”的勾当,1989-03-10,1989-03
《人民文学》推出专号  展示小说创作现状,1989-03-10,1989-03
探讨当前电影现象追寻发展轨迹,1989-03-10,1989-03
困顿中的徬徨,1989-03-10,1989-03
合肥评出最佳影片和最差影片,1989-03-10,1989-03
警官画家,1989-03-10,1989-03
“我看中国”国际青少年征文大赛开始,1989-03-10,1989-03
《中国历代丝绸纹样》出版,1989-03-10,1989-03
红军老战士张云晓诗集出版,1989-03-10,1989-03
《中国女记者》第一辑问世,1989-03-10,1989-03
世界大学生冬运会王敬歌获一枚铜牌,1989-03-10,1989-03
十一项亚洲锦标赛在大陆举行  中国奥委会欢迎台湾派队参赛,1989-03-10,1989-03
海内外华文奥运报道佳作评选在穗颁奖,1989-03-10,1989-03
世界杯足球赛亚洲区预选赛孟足球队胜泰国队,1989-03-10,1989-03
今夏世界大学生运动会会址仍待定,1989-03-10,1989-03
首届全国台球个人公开赛进入尾声,1989-03-10,1989-03
朝鲜北南双方体育代表团举行会谈,1989-03-10,1989-03
中日太极拳交流会即将举行,1989-03-10,1989-03
形势逼出来的廉政措施,1989-03-10,1989-03
“新权威”不可少,1989-03-10,1989-03
莫做“先放虱子后挠头”的事,1989-03-10,1989-03
别让儿女多带钱,1989-03-10,1989-03
人大监督机制亟需完善,1989-03-10,1989-03
第一张“全家福”,1989-03-10,1989-03
首都旅馆里的常住客,1989-03-10,1989-03
通货膨胀对经济增长的效应,1989-03-10,1989-03
《传统学引论》——告诉我们什么？,1989-03-10,1989-03
建立市场竞争机制,1989-03-10,1989-03
日本文化与现代化,1989-03-10,1989-03
纽约的文化生活（上）,1989-03-10,1989-03
“美国宪法应予废除”,1989-03-10,1989-03
踏上希望之路,1989-03-10,1989-03
别具一格崇尚创新,1989-03-10,1989-03
“此心原自不由人”,1989-03-10,1989-03
大同的佛光笑影,1989-03-10,1989-03
微思集,1989-03-10,1989-03
在南方思念着北方,1989-03-10,1989-03
巧为少米之炊,1989-03-10,1989-03
北京地区天气预报,1989-03-11,1989-03
上月城乡储蓄增加二百多亿,1989-03-11,1989-03
中共中央关于进一步繁荣文艺的若干意见,1989-03-11,1989-03
继续抓紧清理整顿公司,1989-03-11,1989-03
我首次公布科技蓝皮书,1989-03-11,1989-03
我国科技攻关计划  “八五”起分三个层次,1989-03-11,1989-03
江苏全民办教育,1989-03-11,1989-03
工业污染待治理,1989-03-11,1989-03
中国教育面临新的抉择,1989-03-11,1989-03
美参议院否决总统提名  托尔未能入主五角大楼,1989-03-11,1989-03
美东航宣告破产,1989-03-11,1989-03
美驱逐苏一名外交官,1989-03-11,1989-03
她患急病之后,1989-03-11,1989-03
安徽中小学教材差迟滥,1989-03-11,1989-03
常委会工作得到加强  应努力履行监督职责,1989-03-11,1989-03
“典型”方法简析,1989-03-11,1989-03
名烟名酒价适当下浮,1989-03-11,1989-03
海军成立日“四·二三”,1989-03-11,1989-03
保定发展工业重挖潜,1989-03-11,1989-03
“试管绵羊”降生,1989-03-11,1989-03
