全国去年添病床十万张,1989-03-11,1989-03
拉萨街头持续平静,1989-03-11,1989-03
战士陶元拾金不昧反受讥讽  部队领导批评歪风伸张正气,1989-03-11,1989-03
包神铁路开通运煤,1989-03-11,1989-03
青海发现一大型砂金矿,1989-03-11,1989-03
广州筹建“地铁”,1989-03-11,1989-03
“礼品屋”在成都悄然兴起,1989-03-11,1989-03
上海建住宅先装电话线,1989-03-11,1989-03
郑铁局快运春耕物资,1989-03-11,1989-03
国防大学副校长钱抵千病逝,1989-03-11,1989-03
台“光大二号”轮走私香烟被缉获  肇事方已承认事实拱北关将妥善处理,1989-03-11,1989-03
外事简讯,1989-03-11,1989-03
华约北约开始实质性军备谈判,1989-03-11,1989-03
加巴将进行高级接触,1989-03-11,1989-03
李光耀谈新中建交,1989-03-11,1989-03
我认捐五万美元援助柬难民,1989-03-11,1989-03
美将加紧援助西哈努克,1989-03-11,1989-03
芬兰派出先头部队,1989-03-11,1989-03
全面评价贝鲁特,1989-03-11,1989-03
纳米比亚人民继续遭屠杀,1989-03-11,1989-03
土耳其总统接见田纪云,1989-03-11,1989-03
利加乔夫到捷取经,1989-03-11,1989-03
法支持阿进行改革,1989-03-11,1989-03
美国进行地下核试验,1989-03-11,1989-03
非欧佩克产油国纷纷减少出口,1989-03-11,1989-03
友好简讯,1989-03-11,1989-03
贾拉拉巴德激战,1989-03-11,1989-03
黄金市场专家预测今年金价走势,1989-03-11,1989-03
去年进口香蕉值３２亿美元,1989-03-11,1989-03
以色列“思想库”的诤谏,1989-03-11,1989-03
萨游击队不同政府谈判,1989-03-11,1989-03
山东画院作品在京展出,1989-03-11,1989-03
没有“上帝”,1989-03-11,1989-03
戏迷自筹资金京剧精英在武汉展演,1989-03-11,1989-03
“大师自中国来”,1989-03-11,1989-03
京沪穗闽四电视台推新栏目,1989-03-11,1989-03
香港南丫岛发现青铜时代文物,1989-03-11,1989-03
司法部对犯人演出作规定,1989-03-11,1989-03
中国教育面临新的抉择,1989-03-11,1989-03
一个退学生的自述,1989-03-11,1989-03
失衡的理性天平,1989-03-11,1989-03
不必大惊小怪,1989-03-11,1989-03
按需培养研究生迫在眉睫,1989-03-11,1989-03
天才·非理性·道德,1989-03-11,1989-03
湖北省民航局制定措施  严格内部购票管理制度,1989-03-11,1989-03
调查附记,1989-03-11,1989-03
石狮市加强文化市场管理见成效,1989-03-11,1989-03
会同农家子弟失学多,1989-03-11,1989-03
敬老院困难知多少？,1989-03-11,1989-03
一种严重的浪费——重复引进,1989-03-11,1989-03
物质富足精神贫困,1989-03-11,1989-03
夸夸俺们的“渔财神”,1989-03-11,1989-03
我在商丘被敲诈,1989-03-11,1989-03
私造土枪土炮危害大,1989-03-11,1989-03
经销伪劣萤光增白剂谁来管,1989-03-11,1989-03
邮购图书出差错责任在我们,1989-03-11,1989-03
不光彩的交易,1989-03-11,1989-03
南、匈、波面对的通货膨胀困扰,1989-03-11,1989-03
合资企业令人瞩目,1989-03-11,1989-03
“篮子货币”受青睐,1989-03-11,1989-03
经营有方的女经理,1989-03-11,1989-03
重晤鲁艺,1989-03-11,1989-03
谈“严肃处理”,1989-03-11,1989-03
钱币诗话,1989-03-11,1989-03
“成”在哪里,1989-03-11,1989-03
这一夜,1989-03-11,1989-03
《海河漕运图》（风俗画）,1989-03-11,1989-03
北京地区天气预报,1989-03-12,1989-03
今年争取产煤１０亿吨,1989-03-12,1989-03
每年造林成活面积八成虚报 专家呼吁实事求是痛戒浮夸,1989-03-12,1989-03
七届人大常委会七次会议闭会,1989-03-12,1989-03
国务院征求对政府工作报告意见,1989-03-12,1989-03
十年树木,1989-03-12,1989-03
万里寄语人大二次会议,1989-03-12,1989-03
加快发展林业生产力  林业部提出四个转变,1989-03-12,1989-03
假冒商标活动猖獗  国家将予严厉打击,1989-03-12,1989-03
文物被盗走私严重,1989-03-12,1989-03
该下的一定要下  市长承诺不作数,1989-03-12,1989-03
波“圆桌会议”讨论政治改革,1989-03-12,1989-03
美宣布“布雷迪计划”,1989-03-12,1989-03
文森峰第一女性,1989-03-12,1989-03
河南整顿化肥市场,1989-03-12,1989-03
工商局长，怕什么……,1989-03-12,1989-03
人大二次会要开成增强信心的会,1989-03-12,1989-03
全国人大常委会公告,1989-03-12,1989-03
拉萨水电食品供应正常  街头骚乱残物清扫干净,1989-03-12,1989-03
新疆区领导植树实事实做,1989-03-12,1989-03
分裂祖国违背佛教教义,1989-03-12,1989-03
煤矿大事故屡屡发生,1989-03-12,1989-03
民政部全面调查村级政权,1989-03-12,1989-03
西哈努克、宋双、乔森潘,1989-03-12,1989-03
经国务院批准《国境卫生检疫法实施细则》发布施行,1989-03-12,1989-03
全国残疾人艺术调演闭幕,1989-03-12,1989-03
乘除速算一口清,1989-03-12,1989-03
东南沿海走私风甚烈  海关总署已通令严办,1989-03-12,1989-03
著名物理学家王天眷逝世,1989-03-12,1989-03
广东增加农业投资,1989-03-12,1989-03
贵州五千干部下乡,1989-03-12,1989-03
海南制成会“走”的碾米机,1989-03-12,1989-03
饭店设专项旅游,1989-03-12,1989-03
沈阳市电话直通百余国,1989-03-12,1989-03
抚州三年垦荒２５万亩,1989-03-12,1989-03
兰州窖藏白菜面临腐烂危险,1989-03-12,1989-03
台“光大二号”轮走私事实确凿,1989-03-12,1989-03
联合国援助团先遣队抵纳,1989-03-12,1989-03
不合时宜,1989-03-12,1989-03
战略防御计划的命运,1989-03-12,1989-03
苏丹政局仍处于僵持局面,1989-03-12,1989-03
海空军纳入谈判,1989-03-12,1989-03
朝鲜发布战斗准备令,1989-03-12,1989-03
絮勒什当选议会主席,1989-03-12,1989-03
讨论贾拉拉巴德局势  寻求更多国家的支持,1989-03-12,1989-03
美驱逐苏外交官是预谋,1989-03-12,1989-03
布什提名切尼任国防部长,1989-03-12,1989-03
苏助理武官事件不影响两国关系,1989-03-12,1989-03
提出债务谈判两项目标,1989-03-12,1989-03
沙特承认阿七党联盟临时政府,1989-03-12,1989-03
发展中国家粮食供应恶化,1989-03-12,1989-03
利比亚政府改组,1989-03-12,1989-03
加拿大一客机坠毁  ２３人死亡许多人受伤,1989-03-12,1989-03
北极臭氧层正遭破坏,1989-03-12,1989-03
美制成可调节电子太阳镜,1989-03-12,1989-03
英科学家将找到囊性纤维变性基因,1989-03-12,1989-03
西德将向高校增拨资金,1989-03-12,1989-03
英将实施培训工人计划,1989-03-12,1989-03
美巴将举行第二轮会谈,1989-03-12,1989-03
爱情无国界大陆频增涉外婚姻  神州有法制珠海痛击社会黑帮,1989-03-12,1989-03
“失足”现象透视,1989-03-12,1989-03
厕所间粪便横流车厢里饮水难得  众小贩穿梭叫卖列车员大打出手,1989-03-12,1989-03
苏北父亲,1989-03-12,1989-03
网球：将军的伙伴,1989-03-12,1989-03
专座的蜕变,1989-03-12,1989-03
河南油田某公司副经理倒卖黄金饰品,1989-03-12,1989-03
马玲禁闭十九年  智力不如五岁孩,1989-03-12,1989-03
中国选手获两枚大学生冬运会金牌,1989-03-12,1989-03
全国台球个人公开赛收杆,1989-03-12,1989-03
设立纪念容国团敢斗奖和明星奖,1989-03-12,1989-03
钱宇平获棋王赛决赛首局胜利,1989-03-12,1989-03
首钢男篮战胜五十铃队,1989-03-12,1989-03
台运动员拟横渡长江黄河,1989-03-12,1989-03
武术家聚京研究武术等级标准,1989-03-12,1989-03
“我赔公公一棵树”,1989-03-12,1989-03
谈谈林业的喜与忧,1989-03-12,1989-03
喜鹊闹枝新街口,1989-03-12,1989-03
别了西雅图绿了家乡山,1989-03-12,1989-03
少年护林宣传队,1989-03-12,1989-03
钢铁工业劲往哪儿使,1989-03-12,1989-03
有钱为什么不愿存银行？,1989-03-12,1989-03
头发的消费,1989-03-12,1989-03
无题,1989-03-12,1989-03
全民植树  大地添绿,1989-03-12,1989-03
潮起潮落之间〔报告文学〕,1989-03-12,1989-03
三过桦林冈,1989-03-12,1989-03
误会〔外二首〕,1989-03-12,1989-03
柳霞的中国情,1989-03-12,1989-03
布隆迪印象,1989-03-12,1989-03
龟岛,1989-03-12,1989-03
燕岛,1989-03-12,1989-03
红鹤岛,1989-03-12,1989-03
伦敦人的人情味,1989-03-12,1989-03
蜘蛛岛,1989-03-12,1989-03
南斯拉夫漫画,1989-03-12,1989-03
莫斯科河之夜,1989-03-12,1989-03
我国森林资源锐减局面严重,1989-03-12,1989-03
中华文明究竟源于何处？,1989-03-12,1989-03
从粪便流向看浪费和污染,1989-03-12,1989-03
生活中的最佳高度,1989-03-12,1989-03
植树与植树节,1989-03-12,1989-03
我国银行将出现三种变革,1989-03-12,1989-03
竹子是树还是草,1989-03-12,1989-03
世界传真通信将取代电报,1989-03-12,1989-03
假冒、劣质、无证、低压电器面面观,1989-03-12,1989-03
水果为何会由硬变软？,1989-03-12,1989-03
北京地区天气预报,1989-03-13,1989-03
开年以来钢铁产量下降  国家采取措施全力扶持,1989-03-13,1989-03
农村经济出现三个新动向,1989-03-13,1989-03
七大种子基地面向全国市场覆盖面近２０个省市自治区,1989-03-13,1989-03
我开放口岸逾四百个,1989-03-13,1989-03
治理整顿要坚定不移,1989-03-13,1989-03
政协常委会举行第五次会议,1989-03-13,1989-03
政协委员提案受重视  百分之九十九已办复,1989-03-13,1989-03
苏联开始正式选举人民代表,1989-03-13,1989-03
欧美部长级会谈获进展  同意逐步削减农业补贴,1989-03-13,1989-03
八亿农民形象  银幕无处寻觅,1989-03-13,1989-03
人口“军令状”,1989-03-13,1989-03
鹿英杰的胸怀,1989-03-13,1989-03
住房私有化将走双轨,1989-03-13,1989-03
猪肉何以又胀库？,1989-03-13,1989-03
说“条子”,1989-03-13,1989-03
李瑞环承包绿化工程,1989-03-13,1989-03
能源部颁五项规定  确保乡镇煤矿安全,1989-03-13,1989-03
纪念孙中山先生逝世６４周年,1989-03-13,1989-03
河南省农民建房热降温,1989-03-13,1989-03
农村十年改革好新闻评出,1989-03-13,1989-03
台湾中南部大旱  当局已决定限水,1989-03-13,1989-03
大庆石化产品积压,1989-03-13,1989-03
外事简讯,1989-03-13,1989-03
李树槐遗体告别仪式举行,1989-03-13,1989-03
著名化学家张大煜逝世,1989-03-13,1989-03
南丰发展“绿色企业”,1989-03-13,1989-03
“奥比斯”眼科飞机医院抵蓉,1989-03-13,1989-03
郭村镇猪鬃创汇多,1989-03-13,1989-03
天然果蔬饮料研制成功,1989-03-13,1989-03
塔北油田勘查者受表彰,1989-03-13,1989-03
湖北两农民向国家交献文物,1989-03-13,1989-03
毁路者，住手！,1989-03-13,1989-03
贾拉拉巴德战事犹酣,1989-03-13,1989-03
苏联经济改革进程复杂而矛盾,1989-03-13,1989-03
需要架设信任的桥梁,1989-03-13,1989-03
苏丹政府辞职,1989-03-13,1989-03
厄扎尔和田纪云交流改革经验,1989-03-13,1989-03
苏将在汉城设贸易办事处,1989-03-13,1989-03
卡拉奇发生骚乱,1989-03-13,1989-03
要求制订新贷款政策,1989-03-13,1989-03
非洲儿童处境堪忧,1989-03-13,1989-03
波一棉纺厂工潮平息,1989-03-13,1989-03
要求减少拉美国家债务值  墨西哥支持美国“布雷迪计划”,1989-03-13,1989-03
使以损失六亿多美元,1989-03-13,1989-03
法国取消外汇管制,1989-03-13,1989-03
叙指控美外交官从事间谍活动,1989-03-13,1989-03
日专家称可新建一条洋际运河,1989-03-13,1989-03
美将实施廉政改革方案,1989-03-13,1989-03
美一新型导弹巡洋舰下水,1989-03-13,1989-03
南去年旅游收入２０亿美元,1989-03-13,1989-03
简讯,1989-03-13,1989-03
长春查获两个犯罪团伙,1989-03-13,1989-03
全国首家艺术影院在上海创办,1989-03-13,1989-03
报春的燕子,1989-03-13,1989-03
《中国文学大辞典》正在编纂,1989-03-13,1989-03
滇发现百万年前原始工具,1989-03-13,1989-03
中日妇女书法展览在京开幕,1989-03-13,1989-03
秦始皇陵为何随葬兵马俑,1989-03-13,1989-03
国际消费者权益日活动开始,1989-03-13,1989-03
描绘社会百态展示改革困难  天津推出电视剧《潮中行》,1989-03-13,1989-03
六画家为中国残联捐画,1989-03-13,1989-03
增强民族体质最需要什么？,1989-03-13,1989-03
中国国际康复协会在杭州成立,1989-03-13,1989-03
国脚评选揭晓,1989-03-13,1989-03
为大型运动会集资是各国惯例,1989-03-13,1989-03
名人桥牌赛在京举行,1989-03-13,1989-03
一九八九年国际象棋大师赛落幕,1989-03-13,1989-03
中国游协向山东省体育中心送锦旗,1989-03-13,1989-03
英雄父子,1989-03-13,1989-03
政治追求：未冷矛盾太多：困惑,1989-03-13,1989-03
领导者十二忌,1989-03-13,1989-03
参政议政民主监督,1989-03-13,1989-03
“适应国情”析,1989-03-13,1989-03
方国政的“火团理论”,1989-03-13,1989-03
破案水平亟待提高,1989-03-13,1989-03
“入党立功”与“望子成龙”,1989-03-13,1989-03
今日苗家女,1989-03-13,1989-03
谈谈我国的粮食问题,1989-03-13,1989-03
要脚踏实地，不要做表面文章,1989-03-13,1989-03
马克思主义的批判性、多元性和开放性,1989-03-13,1989-03
中国需要自己的社会发展理论,1989-03-13,1989-03
政治体制改革要重视政治文化建设,1989-03-13,1989-03
法律责任研讨会简介,1989-03-13,1989-03
２０００年世界林业展望,1989-03-13,1989-03
依靠科学手段集约造林,1989-03-13,1989-03
绿满法国,1989-03-13,1989-03
“绿色资本”的效益,1989-03-13,1989-03
植树育苗有新法,1989-03-13,1989-03
依法治林科学育林,1989-03-13,1989-03
小说与历史,1989-03-13,1989-03
读《又见〈离骚〉》,1989-03-13,1989-03
设计的追求,1989-03-13,1989-03
商业街,1989-03-13,1989-03
植树节徽章（外一章）,1989-03-13,1989-03
牧羊女,1989-03-13,1989-03
北京地区天气预报,1989-03-14,1989-03
万里海岸兴建绿色长城,1989-03-14,1989-03
中国贫困地区发展基金会成立,1989-03-14,1989-03
中央欢迎公民提批评建议  两信访局邀请进谏者座谈,1989-03-14,1989-03
各地民主评议党员工作  要防止前紧后松走过场,1989-03-14,1989-03
李鹏会见美商会会长,1989-03-14,1989-03
李鹏会见毛里求斯客人,1989-03-14,1989-03
八万七千多名党员  经评议认定不合格,1989-03-14,1989-03
第二届中国艺术节加紧筹备,1989-03-14,1989-03
我驻菲使馆表明我国严正态度,1989-03-14,1989-03
泰王国总理差猜,1989-03-14,1989-03
促进文艺事业长期稳定发展,1989-03-14,1989-03
棉花，棉花……,1989-03-14,1989-03
本报国内三十一个记者站建成,1989-03-14,1989-03
路口即景,1989-03-14,1989-03
博士后与企业家对话,1989-03-14,1989-03
高利集资不可取河北制定限制措施,1989-03-14,1989-03
不满足于接受新闻批评,1989-03-14,1989-03
开发黄河三角洲时机成熟,1989-03-14,1989-03
国家整顿汽车市场  全面清理销售网点,1989-03-14,1989-03
铁路口岸将综合治理,1989-03-14,1989-03
胡乔木谈宽容,1989-03-14,1989-03
中共领导多党合作符合国情,1989-03-14,1989-03
《中国历史地图集》出齐,1989-03-14,1989-03
公众得益各方尽责,1989-03-14,1989-03
快速养猪法推广效益高,1989-03-14,1989-03
残疾人福利基金决算公开,1989-03-14,1989-03
智能小车在长沙问世,1989-03-14,1989-03
无锡市提高劳模待遇,1989-03-14,1989-03
牡铁局安全生产二千天,1989-03-14,1989-03
福建森林覆盖率位居大陆第一名,1989-03-14,1989-03
我口香糖产量世界首位,1989-03-14,1989-03
大批野生动物重返围场县,1989-03-14,1989-03
山西制定国防教育条例,1989-03-14,1989-03
郑州烟厂着大火,1989-03-14,1989-03
“朋德康”大院,1989-03-14,1989-03
简讯,1989-03-14,1989-03
万只鹭鸟居花城,1989-03-14,1989-03
萨尔瓦多局势紧张,1989-03-14,1989-03
南共联盟功勋不容否定  多党制有导致分裂危险,1989-03-14,1989-03
讨论安哥拉和平问题,1989-03-14,1989-03
苏注重防御不是消极行为,1989-03-14,1989-03
民德重视同西德关系,1989-03-14,1989-03
田纪云同伊拉克领导人会谈,1989-03-14,1989-03
苏联南非学者在英接触,1989-03-14,1989-03
中苏边界谈判代表团举行工作会晤,1989-03-14,1989-03
谴责美与南朝鲜军事演习,1989-03-14,1989-03
必须正确评价圆桌会议,1989-03-14,1989-03
美“发现”号又上太空,1989-03-14,1989-03
印共十四大闭幕,1989-03-14,1989-03
希拉克将蝉联巴黎市长,1989-03-14,1989-03
美公众主张大幅削减军费,1989-03-14,1989-03
智利发生反政府示威,1989-03-14,1989-03
巴解美以举行中东问题讨论会,1989-03-14,1989-03
日本发现最古老的文物,1989-03-14,1989-03
泰政府将向研究生提供奖学金,1989-03-14,1989-03
苏提出火山喷发新理论,1989-03-14,1989-03
纽约为猫头鹰安“家”,1989-03-14,1989-03
印又一核发电机组投入使用,1989-03-14,1989-03
二百非法矿工  丧生塞拉利昂,1989-03-14,1989-03
巴西执政党举行八大,1989-03-14,1989-03
意社民党党代会结束,1989-03-14,1989-03
成熟伴随着危机,1989-03-14,1989-03
夜生活截至晚十点,1989-03-14,1989-03
“中国潮”报告文学获奖作品选将出版,1989-03-14,1989-03
我国少数民族文学呈繁荣局面,1989-03-14,1989-03
上影在困境中找出路,1989-03-14,1989-03
建国４０周年优秀歌曲评选在即,1989-03-14,1989-03
为农民举办《金牛奖》电视剧本征集评奖活动,1989-03-14,1989-03
法时装模特将来华表演,1989-03-14,1989-03
“第二届中国电影展”九月举行,1989-03-14,1989-03
崔健音乐会受欢迎,1989-03-14,1989-03
《世界华人摄影作品选》将出版,1989-03-14,1989-03
世界大学生冬运会闭幕,1989-03-14,1989-03
中国队能夺几座奖杯？,1989-03-14,1989-03
变幻莫测的决战时刻,1989-03-14,1989-03
中国队获汉诺威国际  博览会杯体操赛冠军,1989-03-14,1989-03
我们还是主人吗？,1989-03-14,1989-03
大局小局紧相连,1989-03-14,1989-03
三笔“歪账”,1989-03-14,1989-03
跳出耕地的圈子——开发山区,1989-03-14,1989-03
他们为什么涌进城？,1989-03-14,1989-03
“文学危机”与文学体制改革,1989-03-14,1989-03
“娱乐功能”及其他,1989-03-14,1989-03
正视我们的心灵,1989-03-14,1989-03
散文创作的“情感深入”,1989-03-14,1989-03
报告文学《汉城不是洛杉矶》,1989-03-14,1989-03
猫比人贵,1989-03-14,1989-03
他们在想什么做什么？,1989-03-14,1989-03
多给残疾人以温暖,1989-03-14,1989-03
用法律来破“空城计”,1989-03-14,1989-03
排队的科学,1989-03-14,1989-03
北京地区天气预报,1989-03-15,1989-03
四大电网煤炭缺口较大  李鹏召开会议制订对策,1989-03-15,1989-03
国务院确定产业政策要点,1989-03-15,1989-03
调整是为发展准备条件,1989-03-15,1989-03
政协常委会第五次会议闭会,1989-03-15,1989-03
差猜总理抵京,1989-03-15,1989-03
民柬三方领导人联合声明  决定成立国防最高委员会,1989-03-15,1989-03
银行新增贷款五十亿,1989-03-15,1989-03
林业报道要少吹,1989-03-15,1989-03
中外学者举行学术讨论会,1989-03-15,1989-03
轻工产品出口突破百亿美元,1989-03-15,1989-03
王忠禹当选吉林省省长,1989-03-15,1989-03
国务院发言人答中外记者问,1989-03-15,1989-03
说“大”,1989-03-15,1989-03
大学生求职送礼成风,1989-03-15,1989-03
云南震区重现一片生机,1989-03-15,1989-03
保障人民代表履行职责,1989-03-15,1989-03
说与“不白说”,1989-03-15,1989-03
七届全国政协增补委员名单,1989-03-15,1989-03
全国政协新委员具有广泛代表性,1989-03-15,1989-03
不管中商外商  法院一视同仁,1989-03-15,1989-03
纪念消费者权益日活动今起举行,1989-03-15,1989-03
工厂积压停产农民望眼欲穿,1989-03-15,1989-03
劳动和科技制作赛颁奖,1989-03-15,1989-03
贵州查获大批假“茅台”,1989-03-15,1989-03
联合国无偿提供两千万美元  我贫困地区妇幼保健可改善,1989-03-15,1989-03
中英联合联络小组  第十二次会议举行,1989-03-15,1989-03
温州刹住滥建坟墓歪风,1989-03-15,1989-03
“强力增产素”使农作物高产,1989-03-15,1989-03
滇西第一条输油管线建成,1989-03-15,1989-03
无锡严禁搭售滞销商品,1989-03-15,1989-03
著名化学家朱子清逝世,1989-03-15,1989-03
株洲东区政府设“特邀监察员”,1989-03-15,1989-03
陕西经济部门定点扶贫,1989-03-15,1989-03
农村改革理论讨论会７月举行,1989-03-15,1989-03
简讯,1989-03-15,1989-03
甘蔗田里,1989-03-15,1989-03
南总理提出组阁方案,1989-03-15,1989-03
美以讨论中东和平问题,1989-03-15,1989-03
呼吁加强团结对付挑战,1989-03-15,1989-03
穆巴拉克访问西德,1989-03-15,1989-03
双方确立和平原则,1989-03-15,1989-03
苏出兵侵阿仅由勃氏等四人决定,1989-03-15,1989-03
伊总统会见田纪云,1989-03-15,1989-03
美国和南朝鲜正式举行“协作精神８９”军事演习,1989-03-15,1989-03
阿难民涌入巴基斯坦,1989-03-15,1989-03
支持美布雷迪计划,1989-03-15,1989-03
扩大地方经营管理范围,1989-03-15,1989-03
卢泰愚擅改中期评价性质,1989-03-15,1989-03
简讯,1989-03-15,1989-03
冰岛倡议北部海域非军事化,1989-03-15,1989-03
美首次制订禁枪法,1989-03-15,1989-03
美国拖欠联合国会费４．９４亿  中国等２１国已缴纳全部会费,1989-03-15,1989-03
瑞士向菲提供马科斯财产文件,1989-03-15,1989-03
英关闭驻黎使馆领事处,1989-03-15,1989-03
美离婚率下降不属实  初婚家庭破裂将过半,1989-03-15,1989-03
世界原油涨价,1989-03-15,1989-03
四十头鲸自杀智利海滩,1989-03-15,1989-03
印哈里亚纳邦禁止在办公室吸烟,1989-03-15,1989-03
用公车探视罪犯令人忧虑,1989-03-15,1989-03
陕西省府有新招：孩子辍学罚父母  湖南新化出怪事：校舍卖掉换钱花,1989-03-15,1989-03
女研究生李蓓自杀之谜,1989-03-15,1989-03
流动人口骤增给首都巨大压力,1989-03-15,1989-03
“老母鸡变鸭”,1989-03-15,1989-03
一少女在京郊被害  警方呼吁协助破案,1989-03-15,1989-03
某些农村事实婚姻及早婚严重,1989-03-15,1989-03
伍绍祖说奥运战略要突出重点,1989-03-15,1989-03
亚洲手球锦标赛组委会成立,1989-03-15,1989-03
中学体育教师现状令人忧虑,1989-03-15,1989-03
加短跑名将承认１０年前开始服用禁药,1989-03-15,1989-03
我三名裁判担任世界杯预赛裁判工作,1989-03-15,1989-03
美式橄榄球将再次与中国观众见面,1989-03-15,1989-03
走入误区的家教,1989-03-15,1989-03
象牙塔的立足之地,1989-03-15,1989-03
农村学生两种眼光看读书,1989-03-15,1989-03
寻找新的启动点,1989-03-15,1989-03
让他们自己走,1989-03-15,1989-03
谁会讲他的故事,1989-03-15,1989-03
在偷盗的困扰中,1989-03-15,1989-03
临钢被盗严重苦于防不胜防,1989-03-15,1989-03
依法保护工商行政管理人员,1989-03-15,1989-03
认真落实粮食“三挂钩”政策,1989-03-15,1989-03
莱阳市解放“娃娃亲”,1989-03-15,1989-03
石村铁矿继续被毁,1989-03-15,1989-03
制止撕揭信件邮票的行为,1989-03-15,1989-03
延边滥采黄柏风日盛,1989-03-15,1989-03
红星花炮厂管理混乱,1989-03-15,1989-03
烧不醒的庆阳石化厂,1989-03-15,1989-03
买１公斤奖售化肥的遭遇,1989-03-15,1989-03
村民不懂法，真难办！,1989-03-15,1989-03
印度经济在调整和改革中,1989-03-15,1989-03
日本人的吃穿用,1989-03-15,1989-03
“千岛之国”经济缓慢复苏,1989-03-15,1989-03
房价创纪录  店主获暴利,1989-03-15,1989-03
经营灵活的中小企业,1989-03-15,1989-03
合作社——瑞典一宝,1989-03-15,1989-03
愿“风华”吹皱一池清水,1989-03-15,1989-03
“湖畔”忠魂曲（七首）,1989-03-15,1989-03
悼季刊《长篇小说》,1989-03-15,1989-03
“劳伦斯现象”,1989-03-15,1989-03
清泉吟,1989-03-15,1989-03
奉献生命的甘泉,1989-03-15,1989-03
北京地区天气预报,1989-03-16,1989-03
李鹏欢宴差猜中泰总理会谈,1989-03-16,1989-03
中共中央邀请党外人士协商  集思广益做好政协人事安排,1989-03-16,1989-03
李鹏胡启立强调做好信访工作,1989-03-16,1989-03
杨尚昆邓颖超分别会见差猜,1989-03-16,1989-03
费孝通提出教育十条建议  赵紫阳复函表示真诚欢迎,1989-03-16,1989-03
戈尔巴乔夫赵紫阳五月会晤  中苏两党关系自然就正常化,1989-03-16,1989-03
两伊边境重开战,1989-03-16,1989-03
各界向朱良才遗体告别,1989-03-16,1989-03
统配煤矿力争多超产,1989-03-16,1989-03
苏联驱逐一名美国外交官,1989-03-16,1989-03
运城金矿问题揭露多时  为何至今还未作出处理,1989-03-16,1989-03
县以上企业一年损失１８３亿,1989-03-16,1989-03
农业信贷缺口大,1989-03-16,1989-03
上海工业背水一战  产品厉行选优汰劣,1989-03-16,1989-03
看形势要看主流  办特区成绩很大,1989-03-16,1989-03
计划外出生儿年均九百万,1989-03-16,1989-03
朱良才遗体告别仪式在京举行,1989-03-16,1989-03
技术合同法实施条例出台,1989-03-16,1989-03
我们眼中的框子,1989-03-16,1989-03
聂帅致朱良才夫人信,1989-03-16,1989-03
夏粮产区开展创高产活动,1989-03-16,1989-03
成都投资亿元发展通信,1989-03-16,1989-03
永嘉工商户出钱开荒山,1989-03-16,1989-03
石家庄打广告仗,1989-03-16,1989-03
座谈基本法,1989-03-16,1989-03
国际社会关注三峡工程  一批环保专家提出异议,1989-03-16,1989-03
瑞典一旅游者被判驱逐出境,1989-03-16,1989-03
塞北贺兰兴养鱼,1989-03-16,1989-03
台湾成立“中国大陆研究学会”,1989-03-16,1989-03
北京禁止擅招农民工,1989-03-16,1989-03
女博士生用新法  肝移植成功率高,1989-03-16,1989-03
国际消费者权益日,1989-03-16,1989-03
反对《对台互惠关系法》,1989-03-16,1989-03
苏共中央讨论民族问题  指责极端分子向党施压,1989-03-16,1989-03
超越国界的紧迫课题,1989-03-16,1989-03
