北京地区天气预报,1989-03-01,1989-03
我国经济去年喜忧交织,1989-03-01,1989-03
去年经济过热特点：,1989-03-01,1989-03
上海继续提高农业地位,1989-03-01,1989-03
昆明人大常委会设市民旁听席,1989-03-01,1989-03
加强有色金属管理,1989-03-01,1989-03
政协委员提案数量创纪录  办复工作已接近全部完成,1989-03-01,1989-03
欢迎港澳台和外国记者  采访全国人大政协会议,1989-03-01,1989-03
药品管理法实施办法施行,1989-03-01,1989-03
１项建议＝７０００万元,1989-03-01,1989-03
河南平原林业迅速崛起  林木生长量超过消耗量,1989-03-01,1989-03
我家电生产增长过热,1989-03-01,1989-03
丹东一公司巨额货款被骗  总经理受到撤职降薪处分,1989-03-01,1989-03
林贤顺到京参观游览,1989-03-01,1989-03
台湾民众要求放宽两岸通邮,1989-03-01,1989-03
去年世界贸易增长８．５％,1989-03-01,1989-03
科技女杰展才华,1989-03-01,1989-03
１９８８年国民经济和社会发展统计公报,1989-03-01,1989-03
妇女劳动需要社会公认,1989-03-01,1989-03
台当局应为“２·２８”起义平反,1989-03-01,1989-03
我国出版《世界宪法大全》,1989-03-01,1989-03
著名国际问题专家宦乡逝世,1989-03-01,1989-03
采取特别措施控制科索沃局势,1989-03-01,1989-03
英法首脑讨论《撒旦诗篇》事件,1989-03-01,1989-03
苏丹政局新危机  总理威胁要辞职,1989-03-01,1989-03
伊苏关系处于“转折点”,1989-03-01,1989-03
南匈领导人举行工作会晤,1989-03-01,1989-03
越南不应在柬制造内战,1989-03-01,1989-03
眼花缭乱的外交角逐,1989-03-01,1989-03
苏宣布裁减东欧驻军时间表,1989-03-01,1989-03
贝·布托会见我经贸代表团,1989-03-01,1989-03
我出口商品展在英国开幕,1989-03-01,1989-03
南朝鲜群众示威  反对美总统访问,1989-03-01,1989-03
为同中国复交作准备,1989-03-01,1989-03
布什返抵华盛顿,1989-03-01,1989-03
里根同意当《国民评论》董事,1989-03-01,1989-03
客机缘何身撕裂  调查集中到舱门,1989-03-01,1989-03
美加速空天机研制工作,1989-03-01,1989-03
美三百余青少年患艾滋病,1989-03-01,1989-03
文传机在加拿大迅速普及,1989-03-01,1989-03
擅役士兵搬家  退休将军遭罚,1989-03-01,1989-03
我首次评选“中国小英雄”,1989-03-01,1989-03
牛郎织女的喜与忧,1989-03-01,1989-03
残疾人在业率约百分之五十七,1989-03-01,1989-03
八岁儿童打官司胜诉两家企业被裁定赔款,1989-03-01,1989-03
一女骗子多次在首都街头作案  有关人士提醒马路求职者警惕,1989-03-01,1989-03
翻栏杆欲喂凶兽七龄童狮口余生,1989-03-01,1989-03
看电视模仿硬汉七岁娃跳楼摔伤,1989-03-01,1989-03
福州熊猫喜迁新居,1989-03-01,1989-03
中国队连破泰国队三城,1989-03-01,1989-03
中古美日本女排５月重聚会,1989-03-01,1989-03
高丰文谈中泰首战,1989-03-01,1989-03
在容国团首次夺冠的地方,1989-03-01,1989-03
体育“三老”联谊会在京成立,1989-03-01,1989-03
第三届围棋“天元赛”  刘小光卫冕首战告捷,1989-03-01,1989-03
湖南设“新闻风险基金”倡导批评报道  浙江办“个体精神病院”接待四方患者,1989-03-01,1989-03
蒙古国际摔跤赛结束,1989-03-01,1989-03
学子，终将扑向母亲怀抱,1989-03-01,1989-03
经营要知识深悔读书少,1989-03-01,1989-03
教学脱离实际初中学生辍学,1989-03-01,1989-03
知识与金钱,1989-03-01,1989-03
舟山渔场资源衰退生态环境亟待治理,1989-03-01,1989-03
农村教师负担过重  健康状况令人担忧,1989-03-01,1989-03
中外合建“客座实验室”人才辈出,1989-03-01,1989-03
编者按,1989-03-01,1989-03
增加农业投入要落到实处,1989-03-01,1989-03
售粮大户的苦衷,1989-03-01,1989-03
从“压岁钱”说到风气,1989-03-01,1989-03
扶风县再次出现卖猪难,1989-03-01,1989-03
农村信用社存款应更多地用在农业上,1989-03-01,1989-03
提高农民植树造林兴趣,1989-03-01,1989-03
严格控制公款私借,1989-03-01,1989-03
农民为啥不愿进城积肥,1989-03-01,1989-03
沛县电机厂不断被盗  领导人竟然毫不在乎,1989-03-01,1989-03
主动调整化肥运输计划  铁路为我厂解燃眉之急,1989-03-01,1989-03
汽车上烧火取暖怎能够视而不见,1989-03-01,1989-03
广州购机票不易黑市价贵得惊人,1989-03-01,1989-03
李村乡村民吃盐虽困难  未忘支援演习的子弟兵,1989-03-01,1989-03
厂矿查一查生活用电有好处,1989-03-01,1989-03
当前世界经济形势管见,1989-03-01,1989-03
天平倾斜何时了,1989-03-01,1989-03
美国外贸形势初析,1989-03-01,1989-03
国货如何进东瀛,1989-03-01,1989-03
流行的与古典的,1989-03-01,1989-03
西藏——一种境界，一种精神,1989-03-01,1989-03
夜歌,1989-03-01,1989-03
选择,1989-03-01,1989-03
水边的白杨林,1989-03-01,1989-03
何必热衷搞“名录”！,1989-03-01,1989-03
北京地区天气预报,1989-03-02,1989-03
认真执行计划生育政策  控制人口增长能够做到,1989-03-02,1989-03
振奋精神增强信心  一心一意治理整顿,1989-03-02,1989-03
依法整治运输市场,1989-03-02,1989-03
检查灾区生活安排生产救灾,1989-03-02,1989-03
淮南矿确立建设新方案,1989-03-02,1989-03
发掘湮灭千年古都  邺城渐露历史真容,1989-03-02,1989-03
专业人才一生流动不到一次,1989-03-02,1989-03
去年新设城市五十三个,1989-03-02,1989-03
香港发生大山火,1989-03-02,1989-03
外交部发言人答记者问,1989-03-02,1989-03
从统计公报看治理整顿,1989-03-02,1989-03
俞国华坚持一个中国立场,1989-03-02,1989-03
伊朗议会决议与英国断交,1989-03-02,1989-03
杭州市民有“口福”  过了元宵买年货,1989-03-02,1989-03
审判向社会公开法庭邀记者旁听,1989-03-02,1989-03
河南公开办税民主评税,1989-03-02,1989-03
青岛“公费食客”见少,1989-03-02,1989-03
今年社科基金开始申请,1989-03-02,1989-03
县委书记该不该跑基建,1989-03-02,1989-03
中国远洋船队  跃居世界第八,1989-03-02,1989-03
棚架现象,1989-03-02,1989-03
中国商检如何改进,1989-03-02,1989-03
镇江大连两厂产品被禁,1989-03-02,1989-03
胡锦涛会见澳大利亚驻华公使,1989-03-02,1989-03
三亚出现育种专业村,1989-03-02,1989-03
发言先录像开会省时间,1989-03-02,1989-03
福建海域勘察油气田,1989-03-02,1989-03
浙江实行森林火灾保险,1989-03-02,1989-03
抗大一分校校史研究会成立,1989-03-02,1989-03
徒步千里报名参军,1989-03-02,1989-03
四罪犯行窃乾陵被判刑,1989-03-02,1989-03
安徽农资价格稳中有降,1989-03-02,1989-03
周南与港督会谈,1989-03-02,1989-03
葡总统苏亚雷斯首次访问澳门,1989-03-02,1989-03
胡昌林出任驻卡塔尔国大使,1989-03-02,1989-03
北京军区原政委朱良才病逝,1989-03-02,1989-03
外事简讯,1989-03-02,1989-03
北京打工也是不易,1989-03-02,1989-03
暂停宪法保障实行宵禁,1989-03-02,1989-03
苏丹各党派要求解散内阁,1989-03-02,1989-03
黎巴嫩抗议以空袭,1989-03-02,1989-03
萨游击队接受和平建议,1989-03-02,1989-03
南非在纳扶植反对派,1989-03-02,1989-03
哈桑二世获得专利,1989-03-02,1989-03
必须掌握列宁方法  不是引用列宁语录,1989-03-02,1989-03
巴拉圭审判前政权贪污官员,1989-03-02,1989-03
印度否认派遣顾问去阿,1989-03-02,1989-03
加强武器贸易和军工合作,1989-03-02,1989-03
民柬三方重申五点建议为基础  阮基石仍坚持越南撤军有条件,1989-03-02,1989-03
纪念革命二百周年  巴黎整修七月圆柱,1989-03-02,1989-03
南联邦主席呼吁要团结不要分裂  群众集会支持政府采取特别措施,1989-03-02,1989-03
西德开始研究航天运输系统,1989-03-02,1989-03
意公债比例居西方七国之首,1989-03-02,1989-03
美一病人靠人工心脏  已维持生命八十三天,1989-03-02,1989-03
美将全面检修客机,1989-03-02,1989-03
欧洲研制未来汽车,1989-03-02,1989-03
拉什迪事件余波未已,1989-03-02,1989-03
巴警察逮捕喀布尔政权破坏分子,1989-03-02,1989-03
哥游击队宣布单方面停火,1989-03-02,1989-03
斯里兰卡一批村民遭屠杀,1989-03-02,1989-03
社会关注变形金刚热褒贬不一,1989-03-02,1989-03
高志平中标任东方歌舞团团长,1989-03-02,1989-03
九寨沟奇特景观原是冰川形成,1989-03-02,1989-03
灵魂在嬗变中颤动,1989-03-02,1989-03
台《科学寻根丛书》在大陆出版,1989-03-02,1989-03
夕阳无限好,1989-03-02,1989-03
慈溪民间画在台北展出,1989-03-02,1989-03
山西成立皮影研究室填补文化研究空白,1989-03-02,1989-03
美摇滚歌王杰克逊大奖败北,1989-03-02,1989-03
首届全国台球个人公开赛在京开杆,1989-03-02,1989-03
中日体育界将组织联合调查,1989-03-02,1989-03
体育的位置在哪里？,1989-03-02,1989-03
古巴女篮同八一队在陕交手,1989-03-02,1989-03
潍坊四月飘风筝精英大赛比高低,1989-03-02,1989-03
开展农业基础地位再教育,1989-03-02,1989-03
该不该这样立志？,1989-03-02,1989-03
“笼”外现金寻踪,1989-03-02,1989-03
雄鹰播绿,1989-03-02,1989-03
“不买手表，不装表带”,1989-03-02,1989-03
尚难解除的困扰,1989-03-02,1989-03
失衡的结构,1989-03-02,1989-03
都在想,1989-03-02,1989-03
中华人民共和国进出口商品检验法,1989-03-02,1989-03
叶落归根,1989-03-02,1989-03
中华人民共和国传染病防治法,1989-03-02,1989-03
解决柬埔寨问题进入关键阶段,1989-03-02,1989-03
“维持和平先生”,1989-03-02,1989-03
欧洲议会的“会址战”,1989-03-02,1989-03
瑞典的绿党,1989-03-02,1989-03
霍梅尼女儿谈霍梅尼,1989-03-02,1989-03
音响与文明,1989-03-02,1989-03
无猜,1989-03-02,1989-03
只须身后千载名,1989-03-02,1989-03
待漏斋与八百万字,1989-03-02,1989-03
致友人（外一首）,1989-03-02,1989-03
故乡的小屋,1989-03-02,1989-03
北京地区天气预报,1989-03-03,1989-03
去年财税物价大检查收兵  共查出违纪金额七十四亿,1989-03-03,1989-03
缅怀周恩来外交上卓越功勋,1989-03-03,1989-03
嘉奖赴云南抗震救灾有功部队  授予老山三个侦察连荣誉称号,1989-03-03,1989-03
钱其琛阐述周恩来外交思想,1989-03-03,1989-03
刘寿斌破世界纪录,1989-03-03,1989-03
山东将办孔子文化节,1989-03-03,1989-03
我女科学家南极探险  文森峰上发现大铁矿,1989-03-03,1989-03
我支持联合国人权活动,1989-03-03,1989-03
美放宽对华出口限制,1989-03-03,1989-03
新加坡将考虑同中国建交,1989-03-03,1989-03
商品意识渗入小学生,1989-03-03,1989-03
不能让金钱买走童心,1989-03-03,1989-03
电视议政,1989-03-03,1989-03
化肥专营营而不专  多家渔利独亏农民,1989-03-03,1989-03
海南为人才引进清障,1989-03-03,1989-03
“纽扣效应”评说,1989-03-03,1989-03
建设四化要几代人努力,1989-03-03,1989-03
农民到手化肥仍然不足,1989-03-03,1989-03
大墙内外齐帮共管失足人,1989-03-03,1989-03
电子销售大户  前一百名排出,1989-03-03,1989-03
民建设立举报中心,1989-03-03,1989-03
举报人正当权利受保障  乔国祥打击报复被撤职,1989-03-03,1989-03
金坛假农药事件了结,1989-03-03,1989-03
荧屏上会议少些短些,1989-03-03,1989-03
黄振出任驻阿拉伯联合酋长国大使,1989-03-03,1989-03
李鹏会见新离任驻华大使,1989-03-03,1989-03
中苏西段边界互开旅客班车,1989-03-03,1989-03
皖西——“羽绒王国”,1989-03-03,1989-03
尼玛泽仁晋升高级研究员,1989-03-03,1989-03
化工部帮助涉县打水井,1989-03-03,1989-03
黑龙江垦区扩大粮豆面积,1989-03-03,1989-03
厦门对台贸易活跃,1989-03-03,1989-03
时代的剪影,1989-03-03,1989-03
波兰决不背离社会主义道路,1989-03-03,1989-03
动乱局势得到控制,1989-03-03,1989-03
欧洲裁军谈判的新形势,1989-03-03,1989-03
苏将大幅度裁减短导,1989-03-03,1989-03
西柏林万人示威游行,1989-03-03,1989-03
联大为援助团拨款４．１６亿美元,1989-03-03,1989-03
北方四岛归还日本  日苏关系才能发展,1989-03-03,1989-03
南朝鲜要求美军司令部迁离汉城,1989-03-03,1989-03
哪些新闻媒介在美国最有影响？,1989-03-03,1989-03
伊拉克大赦国外流亡者,1989-03-03,1989-03
中国投资环境正在改善,1989-03-03,1989-03
中曾根涉嫌“利”案  访美计划被迫中止,1989-03-03,1989-03
波音客机质量受到怀疑,1989-03-03,1989-03
泰总理不见越外长,1989-03-03,1989-03
对１８岁以下青少年实行宵禁,1989-03-03,1989-03
有关组织呼吁保护拉什迪,1989-03-03,1989-03
两万余名地雷受害者流落街头,1989-03-03,1989-03
美参院批准卫生和公众服务能源部长,1989-03-03,1989-03
查获敌对分子行动纲领,1989-03-03,1989-03
七届全国美展走出困境筹备就绪,1989-03-03,1989-03
李先念主席鼓励校园歌曲,1989-03-03,1989-03
京剧《曹操与杨修》获中国戏曲学会奖,1989-03-03,1989-03
四川三星堆文化遗址有新发现,1989-03-03,1989-03
电影学会奖在穗颁发,1989-03-03,1989-03
一种独特的文化现象,1989-03-03,1989-03
电视系列片《中国影星》拍出十集,1989-03-03,1989-03
沪电视台荧屏新字幕受好评,1989-03-03,1989-03
东海农民年人均看电影５０次,1989-03-03,1989-03
香港民乐姐妹在京奏二胡,1989-03-03,1989-03
“为残疾人事业捐赠书画联展”开幕,1989-03-03,1989-03
一九八八年最佳邮票评选开始,1989-03-03,1989-03
《中华谜语大辞典》将出版,1989-03-03,1989-03
《中国西藏》季刊出版发行,1989-03-03,1989-03
海内外华人共同创办《建筑与城市》刊物,1989-03-03,1989-03
世界大学生冬运会举行升旗仪式,1989-03-03,1989-03
瞩望冰雪健儿有新作为,1989-03-03,1989-03
国际象棋好手  角逐“关中杯”,1989-03-03,1989-03
体育简讯,1989-03-03,1989-03
为了冲出低谷,1989-03-03,1989-03
劳动争议案引出的争议,1989-03-03,1989-03
用辩证方法观察分析形势,1989-03-03,1989-03
“弃”得好“怕”得妙,1989-03-03,1989-03
三都呼唤人才,1989-03-03,1989-03
大学生择业的三个热点,1989-03-03,1989-03
财政赤字能够缩小和消除吗？,1989-03-03,1989-03
怎样看待“新权威主义”？,1989-03-03,1989-03
读《戊戌维新运动新探》,1989-03-03,1989-03
北京学者聚会研讨新权威主义问题,1989-03-03,1989-03
《求是》杂志召开当前经济问题座谈会,1989-03-03,1989-03
纪念共产国际成立７０周年学术报告会在京举行,1989-03-03,1989-03
《中国商业年鉴》出版发行,1989-03-03,1989-03
“教育总统”与美国教育,1989-03-03,1989-03
“文学个体户”,1989-03-03,1989-03
世界公共教育经费知多少？,1989-03-03,1989-03
帕瓦罗蒂：“唱到六十岁以后”,1989-03-03,1989-03
法国新的培训热,1989-03-03,1989-03
盛哉“当代情书世界大奖赛”！,1989-03-03,1989-03
车八岭这片原始森林,1989-03-03,1989-03
谈谈“厕所文化”,1989-03-03,1989-03
小姑·彭郎,1989-03-03,1989-03
花瓣小集,1989-03-03,1989-03
似梦,1989-03-03,1989-03
北京地区天气预报,1989-03-04,1989-03
李鹏主持国务院全体会议  布置修改《政府工作报告》,1989-03-04,1989-03
今年高校招生６４万,1989-03-04,1989-03
赵紫阳等向企业家颂奖,1989-03-04,1989-03
海南强调为政公开  大力肃贪建设廉政,1989-03-04,1989-03
我投资亿元提高钢铁产量,1989-03-04,1989-03
耕地占用税收  地方可留七成,1989-03-04,1989-03
葛洲坝将向华东送电,1989-03-04,1989-03
北京国营企业出现失业者,1989-03-04,1989-03
我国科学家周培源和陆师义  荣任世界生产率科学院院士,1989-03-04,1989-03
合同制职工近千万,1989-03-04,1989-03
个体工商户逾一千四百万,1989-03-04,1989-03
宿州市立法兴教,1989-03-04,1989-03
南追究阿族人罢工组织者,1989-03-04,1989-03
艺术大师桂冠谁属,1989-03-04,1989-03
新时期全国优秀散文（集）杂文（集）评出,1989-03-04,1989-03
中美两家公司合作  开展国际空运业务,1989-03-04,1989-03
违反财经纪律营私肥己  抚顺石油一厂受到查处,1989-03-04,1989-03
当年西藏叛乱起因何在  阿沛披露目击事实真相,1989-03-04,1989-03
全国流动人口  目前达五千万,1989-03-04,1989-03
十万民工涌入海口  希望各地予以劝阻,1989-03-04,1989-03
中国科技界目光向外  技术出口额成倍增长,1989-03-04,1989-03
郑州纺织青工迁新居,1989-03-04,1989-03
京铁春运完成  旅客无一伤亡,1989-03-04,1989-03
湖北招干部女性入选过半,1989-03-04,1989-03
宝鸡间作套种增产增收,1989-03-04,1989-03
上海重点工业攻关开端良好,1989-03-04,1989-03
筹资４５亿增产化肥,1989-03-04,1989-03
田纪云昨离京出访,1989-03-04,1989-03
购买彩电冰箱去年花了十亿,1989-03-04,1989-03
六届政协副主席董其武逝世,1989-03-04,1989-03
钱其琛会见民德副外长,1989-03-04,1989-03
内地公民获准赴台  须经深圳罗湖出境,1989-03-04,1989-03
中央电台听众逾六亿,1989-03-04,1989-03
《党建研究》创刊,1989-03-04,1989-03
倪献策刑满出狱,1989-03-04,1989-03
酸甜苦辣择业时,1989-03-04,1989-03
阿富汗一起政变流产,1989-03-04,1989-03
批评阿尔巴尼亚干涉内政,1989-03-04,1989-03
搞好生产弥补损失,1989-03-04,1989-03
缔结禁止化学武器全球公约,1989-03-04,1989-03
波兰内务部长会见瓦文萨,1989-03-04,1989-03
明年开国际经济特别联大  一九九四年举行人口会议,1989-03-04,1989-03
普遍规律结合本国国情,1989-03-04,1989-03
肯乌发生武装冲突,1989-03-04,1989-03
苏丹同意解散内阁,1989-03-04,1989-03
不允许用公开性反对社会主义,1989-03-04,1989-03
波领导人会见洛克菲勒,1989-03-04,1989-03
美国纪念国会召开二百周年,1989-03-04,1989-03
朝鲜北南第二次副部级会谈无进展,1989-03-04,1989-03
美参院开始激烈辩论,1989-03-04,1989-03
西德三间谍落网,1989-03-04,1989-03
南去年外汇收入创纪录,1989-03-04,1989-03
亚开发银行向印贷款,1989-03-04,1989-03
美国旱情缓解,1989-03-04,1989-03
世界毒品种植面积急剧扩大,1989-03-04,1989-03
豪评《撒旦诗篇》,1989-03-04,1989-03
友好简讯,1989-03-04,1989-03
希腊百万人举行罢工,1989-03-04,1989-03
西影厂铁面无情整顿拍片秩序,1989-03-04,1989-03
历史巨片《开国大典》正加紧拍摄,1989-03-04,1989-03
廉价的感伤,1989-03-04,1989-03
探索民办文艺之路,1989-03-04,1989-03
两岸学者在厦门探讨台湾艺术,1989-03-04,1989-03
中国书法艺术博物馆将开放,1989-03-04,1989-03
《中华人民共和国邮票目录》出版,1989-03-04,1989-03
紫罗兰变色釉瓷雕获“金龙腾飞奖”,1989-03-04,1989-03
香港歌星徐小明在贵州义演,1989-03-04,1989-03
茶文化晚会集锦盒带将制成,1989-03-04,1989-03
徽歙墨厂设计新邮票墨,1989-03-04,1989-03
世界大学生冬运会揭幕,1989-03-04,1989-03
体育举国体制质疑,1989-03-04,1989-03
约翰逊有意服用兴奋剂,1989-03-04,1989-03
全国青运会（冬季）举行开幕式,1989-03-04,1989-03
中国象棋棋圣赛结束,1989-03-04,1989-03
全国青运会（冬季）又决出两枚金牌,1989-03-04,1989-03
天津市办个体发廊大奖赛,1989-03-04,1989-03
出路：技术创新,1989-03-04,1989-03
厌学风之我见,1989-03-04,1989-03
学生面前难题多,1989-03-04,1989-03
书生之情寄于书,1989-03-04,1989-03
闹市里的宁静村落,1989-03-04,1989-03
大作家的小作品,1989-03-04,1989-03
休宁县农业承包户遭受不法侵害,1989-03-04,1989-03
军营变成“中转站”  官兵呼吁挂“黄牌”,1989-03-04,1989-03
劝说军人亲友  莫来部队经商,1989-03-04,1989-03
编者按,1989-03-04,1989-03
对我写批评稿的两种态度,1989-03-04,1989-03
搞批评报道真是太难了,1989-03-04,1989-03
常州市整顿生产资料市场,1989-03-04,1989-03
面对种种压力  我仍秉公执笔,1989-03-04,1989-03
接受舆论监督  神池党风好转,1989-03-04,1989-03
秦岭金矿满目疮痍,1989-03-04,1989-03
加强孔林的维护工作,1989-03-04,1989-03
察尔汗盐湖资源被破坏,1989-03-04,1989-03
严惩哄抢林木的不法分子,1989-03-04,1989-03
营区竟成集市,1989-03-04,1989-03
世界贸易形势看好,1989-03-04,1989-03
贸易战：雷鸣电闪,1989-03-04,1989-03
热那亚港的翻身仗,1989-03-04,1989-03
互通有无发展经济,1989-03-04,1989-03
全燕麦食品风行美国,1989-03-04,1989-03
关于“后现代”,1989-03-04,1989-03
《曹操与杨修》作者陈亚先,1989-03-04,1989-03
面对：飞升的灵魂,1989-03-04,1989-03
话说粉画,1989-03-04,1989-03
远山,1989-03-04,1989-03
北京地区天气预报,1989-03-05,1989-03
我国男女比例开始失调,1989-03-05,1989-03
振奋我们的精神,1989-03-05,1989-03
预算外资金增长过快  预算内资金收不抵支,1989-03-05,1989-03
我国重点建设资金  六年共征集７８３亿,1989-03-05,1989-03
乔石强调重视党的自身建设,1989-03-05,1989-03
民航运输不定期飞行管理  国务院发布施行暂行规定,1989-03-05,1989-03
改革要发挥人民团体作用,1989-03-05,1989-03
工商银行为个体户储蓄行方便,1989-03-05,1989-03
加强对乡镇船舶管理,1989-03-05,1989-03
支持恢复我关贸总协定缔约国地位,1989-03-05,1989-03
两艘万吨轮在长江口相撞,1989-03-05,1989-03
选择——在香蕉与粮食之间,1989-03-05,1989-03
重申解决柬埔寨问题原则立场,1989-03-05,1989-03
李贵鲜欢迎台北派代表,1989-03-05,1989-03
沪破获一特大贩毒案,1989-03-05,1989-03
三条走私船在粤落网,1989-03-05,1989-03
朱汉章创小针刀疗法,1989-03-05,1989-03
新疆惊蜇胜严冬,1989-03-05,1989-03
高安两农民舍己救别人,1989-03-05,1989-03
《辞海》重新修订,1989-03-05,1989-03
航空工业民品逾七成,1989-03-05,1989-03
四川交通稽征收入达八亿,1989-03-05,1989-03
北京日语讲习所开学,1989-03-05,1989-03
著名汽车工程专家江泽民逝世,1989-03-05,1989-03
历史见证,1989-03-05,1989-03
群众告官一一查明,1989-03-05,1989-03
太原一些医院赚昧心钱,1989-03-05,1989-03
打破８级工资制,1989-03-05,1989-03
赴琼必须持证,1989-03-05,1989-03
有感于姑娘挖苦大学生,1989-03-05,1989-03
企业领导正向企业家转变,1989-03-05,1989-03
委内瑞拉局势基本平静,1989-03-05,1989-03
蒙古宣布裁军一万三,1989-03-05,1989-03
拉美八国集团外长会议如期原地举行,1989-03-05,1989-03
欧共体与中东,1989-03-05,1989-03
苏欢迎匈对１９５６年事件的评价,1989-03-05,1989-03
苏丹最高委员会草拟七点政治计划  争取下周成立各党派新的联合政府,1989-03-05,1989-03
伊朗和联合国官员举行会谈,1989-03-05,1989-03
田纪云抵德黑兰访问,1989-03-05,1989-03
撒切尔夫人谈拉什迪事件,1989-03-05,1989-03
贝·布托总理会见迟浩田,1989-03-05,1989-03
阮基石泰国之行没成果,1989-03-05,1989-03
喀布尔外长会晤拉·甘地,1989-03-05,1989-03
朝鲜予以强烈谴责,1989-03-05,1989-03
加强合作适应欧共体一体化进程,1989-03-05,1989-03
美前国家安全事务顾问被判刑,1989-03-05,1989-03
越南计委主任易人,1989-03-05,1989-03
建议１９９２年为国际空间年,1989-03-05,1989-03
苏将安德罗波夫市恢复原名,1989-03-05,1989-03
老鼠迫降飞机,1989-03-05,1989-03
法国定向爆破18层高大楼,1989-03-05,1989-03
我国民间妇女沙龙日益活跃,1989-03-05,1989-03
毛家湾的女雇工,1989-03-05,1989-03
吟到白头歌更多,1989-03-05,1989-03
投毒害夫却丧父向新秀锒铛入狱,1989-03-05,1989-03
小孩玩火万金成灰,1989-03-05,1989-03
“杀鸡给猴看”质疑,1989-03-05,1989-03
深圳离婚案近年猛增,1989-03-05,1989-03
世界杯预选赛亚洲区第五组  中国足球队再胜孟加拉国队,1989-03-05,1989-03
全国青少年冬运会争夺激烈  黑龙江选手实力强显出优势,1989-03-05,1989-03
世界大学生冬运会法苏选手先夺金牌,1989-03-05,1989-03
葡萄牙队获世青足球赛冠军,1989-03-05,1989-03
中国跳水公开赛四月在穗举行,1989-03-05,1989-03
阿维兰热否认增加世界杯决赛名额,1989-03-05,1989-03
申请主办世界大学生运动会  上海面对众多对手前景难卜,1989-03-05,1989-03
北京西城区体委承办亚洲手球锦标赛,1989-03-05,1989-03
世界室内田径赛在匈揭幕,1989-03-05,1989-03
紧缩总量调整结构,1989-03-05,1989-03
煤炭工业后劲在哪里？,1989-03-05,1989-03
消费者是收买不了的,1989-03-05,1989-03
名之过？人之过？,1989-03-05,1989-03
寻找新的聚合力,1989-03-05,1989-03
“偷油鼠”没法治了吗？,1989-03-05,1989-03
悲哀带来的反思,1989-03-05,1989-03
忽发奇想〔报告文学〕,1989-03-05,1989-03
惠灵顿有个绿色世界,1989-03-05,1989-03
世界女兵知多少？,1989-03-05,1989-03
“静音”家电风靡日本,1989-03-05,1989-03
比一比谁的产品好,1989-03-05,1989-03
花粉面包,1989-03-05,1989-03
在英国的家庭里,1989-03-05,1989-03
注重健康改变饮食习惯,1989-03-05,1989-03
外国幽默画,1989-03-05,1989-03
老妇〔油画〕,1989-03-05,1989-03
我国农民十年来的巨大变化,1989-03-05,1989-03
贫困是否是创作成功的必要条件,1989-03-05,1989-03
困境中的我国森林资源,1989-03-05,1989-03
人对休息误解多,1989-03-05,1989-03
郭沫若为古人“诊病”,1989-03-05,1989-03
哪个是“长江第一桥”,1989-03-05,1989-03
六种食品将在我国流行,1989-03-05,1989-03
女性寿命长于男性的奥秘,1989-03-05,1989-03
上海青年教师的读书倾向,1989-03-05,1989-03
蛇年谈蛇徽,1989-03-05,1989-03
北京地区天气预报,1989-03-06,1989-03
《周恩来传》即将出版,1989-03-06,1989-03
