两个热点：土地与价格,1989-03-22,1989-03
书店见缝插针,1989-03-22,1989-03
两人三次打破三项全国纪录,1989-03-22,1989-03
我冰球队平保加利亚队,1989-03-22,1989-03
澳大利亚选手创５项自行车世界纪录,1989-03-22,1989-03
江嘉良接受洛杉矶业余体育基金会奖杯,1989-03-22,1989-03
北京至巴黎之路老式汽车远征即将开始,1989-03-22,1989-03
中日速滑友谊赛结束,1989-03-22,1989-03
裁军五十万人  削减军费开支,1989-03-22,1989-03
“危机感”的联想,1989-03-22,1989-03
西方股市普遍下跌,1989-03-22,1989-03
解决历时八年内战,1989-03-22,1989-03
布什谈美国２１世界战略,1989-03-22,1989-03
危险废料买卖激增  严重威胁健康环境,1989-03-22,1989-03
意两党书记分别会见宋平,1989-03-22,1989-03
西欧两大经济组织将加强合作,1989-03-22,1989-03
日拒绝与苏签经济协定,1989-03-22,1989-03
欧佩克国家厉行限产,1989-03-22,1989-03
阿尔巴尼亚派团出访日本中国,1989-03-22,1989-03
“投改革一票！”,1989-03-22,1989-03
苏联将把中导基地改装成为洲导基地,1989-03-22,1989-03
菲律宾不再帮助越难民去第三国,1989-03-22,1989-03
英今冬严重干旱,1989-03-22,1989-03
从农村看我国普及教育的路子,1989-03-22,1989-03
“读书无用论”是一种片面认识,1989-03-22,1989-03
知识绝不会长久贬值,1989-03-22,1989-03
初中不毕业不能进厂做工,1989-03-22,1989-03
青年问题有深刻的文化背景,1989-03-22,1989-03
“电脑算命”误事又骗钱,1989-03-22,1989-03
周仪发明“周仪”,1989-03-22,1989-03
求贷心切者警惕  外资引荐人有诈,1989-03-22,1989-03
钱还是存入银行好,1989-03-22,1989-03
行车难，乘车难，难在何处？,1989-03-22,1989-03
王文娟是演员的好榜样,1989-03-22,1989-03
何积洲是林场的守护神,1989-03-22,1989-03
个体车辆肇事多,1989-03-22,1989-03
农民卖猪无门  含泪宰猪吃肉,1989-03-22,1989-03
车辆购置附加费漏征严重,1989-03-22,1989-03
卖猪不给现钱  农民叫苦不迭,1989-03-22,1989-03
这里煤矿工人不为吃粮发愁了,1989-03-22,1989-03
我师某部擅自购买轿车被处理,1989-03-22,1989-03
西北饭店退还赠品,1989-03-22,1989-03
封开县查处倒卖木材案,1989-03-22,1989-03
不能忽视小杂粮生产,1989-03-22,1989-03
电网捕鱼断绝鱼子孙,1989-03-22,1989-03
毁田烧砖为何不制止,1989-03-22,1989-03
农村广播网破坏严重,1989-03-22,1989-03
村民卖土怎能不过问,1989-03-22,1989-03
淘金毁良田应由谁管,1989-03-22,1989-03
社会公德何在？,1989-03-22,1989-03
美国：经济政策之争,1989-03-22,1989-03
西德贸易盈余增长  何故未遭责难？,1989-03-22,1989-03
取名的苦恼,1989-03-22,1989-03
世界外汇储备知多少,1989-03-22,1989-03
以务农自豪,1989-03-22,1989-03
艺术：沟通心灵的媒介,1989-03-22,1989-03
颇具风采的鲁迅别传,1989-03-22,1989-03
请来唱支歌,1989-03-22,1989-03
思之歌,1989-03-22,1989-03
出国觅“知音”,1989-03-22,1989-03
《士兵与英雄交响曲》,1989-03-22,1989-03
藏原都市〔木刻〕,1989-03-22,1989-03
北京地区天气预报,1989-03-23,1989-03
财税物价大检查有进展  已查出违纪金额１２３亿,1989-03-23,1989-03
我国超导研究成果  三个方面世界领先,1989-03-23,1989-03
厂长全面负责制完全行得通  思想与经济工作不搞两张皮,1989-03-23,1989-03
能源紧张全国瞩目山西  责无旁贷山西全力挖煤,1989-03-23,1989-03
海南正走出办大特区新路,1989-03-23,1989-03
赵紫阳谈发展中国家建设经验,1989-03-23,1989-03
李先念看望各界政协委员,1989-03-23,1989-03
李鹏同穆塞韦尼会谈,1989-03-23,1989-03
政协委员讨论人代会三个报告,1989-03-23,1989-03
我驻美大使向美国政府提出抗议,1989-03-23,1989-03
北京代表与总理议大事,1989-03-23,1989-03
粮食基础说质疑,1989-03-23,1989-03
热泪,1989-03-23,1989-03
解决骚乱问题尚需治本,1989-03-23,1989-03
拉萨戒严为免更大损失,1989-03-23,1989-03
投资速度下降银行贷款减少  工资增长较快经济效益欠佳,1989-03-23,1989-03
我国旅游业信誉下降  今年中心任务是整顿,1989-03-23,1989-03
领导重视的喜和忧,1989-03-23,1989-03
多选党外人士到政府任职  下半年可望提出初步方案,1989-03-23,1989-03
治理整顿求发展,1989-03-23,1989-03
丁关根款待采访两会的台湾记者,1989-03-23,1989-03
中学生素质关系民族前途,1989-03-23,1989-03
增产菌名不虚传  亿亩田果然增产,1989-03-23,1989-03
王匀玲舍身换来旅客安全,1989-03-23,1989-03
陕西监督化肥专营,1989-03-23,1989-03
婺源设茶叶风险基金,1989-03-23,1989-03
沙市七万多职工参加待业保险,1989-03-23,1989-03
广州新闻出版业兴旺,1989-03-23,1989-03
成都公开选拔市级部门领导,1989-03-23,1989-03
丁翔起遗体告别仪式在京举行,1989-03-23,1989-03
长江鳗苗仍在遭劫,1989-03-23,1989-03
倪南山同志在南昌病逝,1989-03-23,1989-03
胡占山谈控制物价对策,1989-03-23,1989-03
治理整顿与发展农业,1989-03-23,1989-03
“民”告“官”的喜与忧,1989-03-23,1989-03
尽快开始文艺立法工作,1989-03-23,1989-03
索朗伦珠谈西藏人权,1989-03-23,1989-03
“宗教政策越来越落实”,1989-03-23,1989-03
青海发展靠什么,1989-03-23,1989-03
调兵遣将,1989-03-23,1989-03
限时发言,1989-03-23,1989-03
夫妻委员,1989-03-23,1989-03
张百发汇报亚运会筹备情况  人大代表政协委员提出建议,1989-03-23,1989-03
“要争这口气！”,1989-03-23,1989-03
世界女排格局四年不会变,1989-03-23,1989-03
意总统致电杨尚昆  祝贺老式汽车远征,1989-03-23,1989-03
老国手的喜与忧,1989-03-23,1989-03
地球危险废物每年人均百公斤,1989-03-23,1989-03
蒙中新友好关系将不断发展,1989-03-23,1989-03
布什：西方不宜单方裁军  切尼：苏联军事威胁仍在,1989-03-23,1989-03
加强法律秩序减少空间冲突,1989-03-23,1989-03
联合国设阿巴边境监察站  成立基础广泛的联合政府,1989-03-23,1989-03
卡拉奇又发生骚乱,1989-03-23,1989-03
联合国驻黎三名士兵触雷身亡,1989-03-23,1989-03
巴解与美国再次正式接触,1989-03-23,1989-03
为“空中客车”补贴  欧美之间争执加剧,1989-03-23,1989-03
巴西一货机坠毁,1989-03-23,1989-03
古美恢复直接通邮,1989-03-23,1989-03
意共总书记会见宋平一行,1989-03-23,1989-03
在苏联选举人民代表的日子里,1989-03-23,1989-03
粮食基础说质疑,1989-03-23,1989-03
治理整顿取得进展  大中型企业面临新问题,1989-03-23,1989-03
“宜章有个彭道安”,1989-03-23,1989-03
注意治理整顿中的新情况,1989-03-23,1989-03
改变视角看问题,1989-03-23,1989-03
可惜了一个盒子,1989-03-23,1989-03
捍卫真理的勇士,1989-03-23,1989-03
瞬间载着隆重,1989-03-23,1989-03
放射性药品管理办法,1989-03-23,1989-03
股票丑闻困扰下的日本政坛,1989-03-23,1989-03
美国衰落了吗？,1989-03-23,1989-03
民德的工农检查机构,1989-03-23,1989-03
阿朱别依谈赫鲁晓夫下台,1989-03-23,1989-03
有钱能使官推磨,1989-03-23,1989-03
耳赤之一手,1989-03-23,1989-03
也谈月球的背面,1989-03-23,1989-03
樱花初绽,1989-03-23,1989-03
闽南十里桥,1989-03-23,1989-03
朝夕相伴后顾无忧,1989-03-23,1989-03
“名流”别议,1989-03-23,1989-03
北京地区天气预报,1989-03-24,1989-03
人大代表审议政府工作报告  探讨压缩社会总需求的良策,1989-03-24,1989-03
最大失误教育发展不够,1989-03-24,1989-03
政协会议举行大会发言  八位委员登台发表政见,1989-03-24,1989-03
全国社会治安基本稳定,1989-03-24,1989-03
南共联盟主席团发表公报  要求全党同分裂倾向斗争,1989-03-24,1989-03
控制危险废料越境转移  第一个国际公约获通过,1989-03-24,1989-03
从速完善农资专营政策,1989-03-24,1989-03
李鹏等参加人大分组讨论,1989-03-24,1989-03
“五四”精神继承与超越,1989-03-24,1989-03
为什么总急于求成？,1989-03-24,1989-03
治理环境务必把农业搞上去,1989-03-24,1989-03
太原铝材厂房改方案简便易行,1989-03-24,1989-03
房价地价要分开,1989-03-24,1989-03
锦县森林火灾伤亡重大  务必查清责任吸取教训,1989-03-24,1989-03
党外人士参加社会监督应成制度,1989-03-24,1989-03
民主党派负责人谈多党合作,1989-03-24,1989-03
农业区划委员会作调整,1989-03-24,1989-03
姬鹏飞昨欢宴  港澳代表委员,1989-03-24,1989-03
姬鹏飞王汉斌看望港澳人大代表,1989-03-24,1989-03
台湾成为大陆旅游新客源,1989-03-24,1989-03
国旅集团成立,1989-03-24,1989-03
乌干达总统举行记者招待会,1989-03-24,1989-03
《统一论坛》创刊,1989-03-24,1989-03
海南出现农家肥市场,1989-03-24,1989-03
玉树乡乡有电视,1989-03-24,1989-03
云南实施“温饱工程”,1989-03-24,1989-03
河南动手安排秋粮生产,1989-03-24,1989-03
《中国人看联邦德国》  成书出版,1989-03-24,1989-03
简讯,1989-03-24,1989-03
六人被困井下  七天遇救生还,1989-03-24,1989-03
忧思·焦虑·信心,1989-03-24,1989-03
政策不等于法律,1989-03-24,1989-03
科技界面临三个冲击,1989-03-24,1989-03
清醒才能再奋起,1989-03-24,1989-03
信心与求实,1989-03-24,1989-03
农业升温喜忧交织,1989-03-24,1989-03
岂能“宁用武大郎、不要穆桂英”,1989-03-24,1989-03
红绿灯前,1989-03-24,1989-03
塑造民族精神,1989-03-24,1989-03
中国棋手金艳九战九胜夺冠,1989-03-24,1989-03
全国青年摔跤锦标赛鸣金,1989-03-24,1989-03
世界大学生夏季运动会将在西德举行,1989-03-24,1989-03
两千万个体户向亚运会捐赠一座体育馆,1989-03-24,1989-03
出国选手会“反戈一击”吗？,1989-03-24,1989-03
中国冰球队负于荷兰队,1989-03-24,1989-03
美巴讨论中东实质性问题,1989-03-24,1989-03
美国在中东“跳小步舞”,1989-03-24,1989-03
达成交换战俘协议,1989-03-24,1989-03
鞭刑与人权,1989-03-24,1989-03
意共第１８次党代会闭幕,1989-03-24,1989-03
德奎利亚尔致力恢复两伊谈判,1989-03-24,1989-03
确保纳米比亚公正选举,1989-03-24,1989-03
批评该报歪曲西藏人口政策,1989-03-24,1989-03
巴新决定向闹事地点派兵,1989-03-24,1989-03
布托夫人任不管部长,1989-03-24,1989-03
科西嘉岛发生工潮  法国政府派员调解,1989-03-24,1989-03
３０年数百飞机缘何坠毁,1989-03-24,1989-03
美国水下发射导弹失败,1989-03-24,1989-03
摸实情论实理办实事,1989-03-24,1989-03
弃学办实业希望？忧虑？,1989-03-24,1989-03
父母为子女走后门明显增多,1989-03-24,1989-03
加强党内监督是党政廉洁的重要保证,1989-03-24,1989-03
廉政不能留“特区”,1989-03-24,1989-03
主动自觉接受人大政协监督,1989-03-24,1989-03
“汽车兵”训练场上,1989-03-24,1989-03
“五四”精神的继承与超越,1989-03-24,1989-03
喜读《〈资本论〉辞典》,1989-03-24,1989-03
《长江长江——三峡工程论争》,1989-03-24,1989-03
未雨而绸缪,1989-03-24,1989-03
民主德国的职业教育,1989-03-24,1989-03
巴比松画乡情,1989-03-24,1989-03
小型国际问题资料库,1989-03-24,1989-03
“甲壳虫”歌手今何在？,1989-03-24,1989-03
破冰时节说春,1989-03-24,1989-03
暮色中的山茶,1989-03-24,1989-03
争春,1989-03-24,1989-03
愿您的孩子幸福成长,1989-03-24,1989-03
笔名研究的价值,1989-03-24,1989-03
写在古驿站遗址（外一章）,1989-03-24,1989-03
北京地区天气预报,1989-03-25,1989-03
李铁映就教育问题答记者问,1989-03-25,1989-03
政协继续举行大会发言,1989-03-25,1989-03
福建为外商投资提供保证,1989-03-25,1989-03
能源原材料交通运输紧张  国务院采取五项缓解措施,1989-03-25,1989-03
杨尚昆李鹏万里参加人大分组讨论,1989-03-25,1989-03
四十多部委负责人参加分组会  直接向代表汇报工作听取意见,1989-03-25,1989-03
胡应湘将向大陆投资３５亿美元,1989-03-25,1989-03
不该强迫职工储蓄集资,1989-03-25,1989-03
互相注视的四代人,1989-03-25,1989-03
大同市坚决制止倒卖活动  取缔廿一家煤炭经营单位,1989-03-25,1989-03
我矿产资源有新发现,1989-03-25,1989-03
不算多余的实话,1989-03-25,1989-03
改进领导人活动报道  支持按新闻规律办报,1989-03-25,1989-03
地广人稀已是过去  黑龙江耕地也吃紧,1989-03-25,1989-03
为民工鸣个不平,1989-03-25,1989-03
共产党领导是多党合作前提,1989-03-25,1989-03
北京近来频频停电,1989-03-25,1989-03
河北改革农村行政体制,1989-03-25,1989-03
行政公司分文不给  骨干企业贷款优先,1989-03-25,1989-03
李国治走私毒品昨伏法,1989-03-25,1989-03
不能把西方民主运作绝对化,1989-03-25,1989-03
崔健获亚洲音乐节大奖,1989-03-25,1989-03
乌干达总统去广州访问,1989-03-25,1989-03
《柳亚子选集》即将出版,1989-03-25,1989-03
首都大学生座谈新闻改革,1989-03-25,1989-03
简讯,1989-03-25,1989-03
贵州省领导设扶贫联系点,1989-03-25,1989-03
山东实行供用电“四公开”,1989-03-25,1989-03
拉萨建自选商场,1989-03-25,1989-03
黑龙江发布物价新闻,1989-03-25,1989-03
中山市向大海延伸,1989-03-25,1989-03
青海寺院封山育林,1989-03-25,1989-03
西安制成多功能救心盒,1989-03-25,1989-03
改革开放要大力推进  治理环境不因噎废食,1989-03-25,1989-03
自找门路多作贡献,1989-03-25,1989-03
权威怎样形成？,1989-03-25,1989-03
俞正声建议：设立整治试验区,1989-03-25,1989-03
一位土族代表的期待,1989-03-25,1989-03
全国政协七届二次会议小组发言摘编,1989-03-25,1989-03
改革——希望所在,1989-03-25,1989-03
当场拍板,1989-03-25,1989-03
以衣点将,1989-03-25,1989-03
肖爱华获世青赛女花铜牌,1989-03-25,1989-03
至少５至１０名奥运明星服用类固醇,1989-03-25,1989-03
体力不支防守薄弱,1989-03-25,1989-03
哈尔滨青年冰球队和吉林市队在赛场打架,1989-03-25,1989-03
中国竞技体育功利性心态,1989-03-25,1989-03
中国羽毛球队由伦敦移师巴黎,1989-03-25,1989-03
西藏是中国一部分,1989-03-25,1989-03
布什政府原则同意中东和会  巴解准备与以色列直接谈判,1989-03-25,1989-03
扫毒是共同的任务,1989-03-25,1989-03
南继续追究动乱责任者,1989-03-25,1989-03
苏坚决支持纳吉布拉政权,1989-03-25,1989-03
苏丹组成新内阁,1989-03-25,1989-03
德奎利亚尔会晤贝克,1989-03-25,1989-03
美国南朝鲜军事演习结束,1989-03-25,1989-03
简讯,1989-03-25,1989-03
经营不善雷诺损失难计  去岁扭亏净盈法郎８９亿,1989-03-25,1989-03
拉丁美洲国家要求布雷迪计划具体化,1989-03-25,1989-03
世界最大运输机完成商载飞行,1989-03-25,1989-03
债权和主权,1989-03-25,1989-03
去年美经济增长３．９％  今年预计将稍有下降,1989-03-25,1989-03
试管内进行核聚变,1989-03-25,1989-03
“代”的疑惑,1989-03-25,1989-03
制止弃学现象要克服短期行为,1989-03-25,1989-03
空前活跃的农民研究会,1989-03-25,1989-03
夺得粮食丰收期望气象广播,1989-03-25,1989-03
到国外办高技术公司,1989-03-25,1989-03
教育也要有扶贫政策,1989-03-25,1989-03
酿酒工业必须重视节约粮食,1989-03-25,1989-03
废旧物资收购市场亟需整顿,1989-03-25,1989-03
合理提高废旧物资回收价格,1989-03-25,1989-03
教育个体户依法纳税,1989-03-25,1989-03
组织闲置设备调剂市场,1989-03-25,1989-03
学会、协会无须都吃“皇粮”,1989-03-25,1989-03
麻阳三千苗家女不置嫁妆学技术,1989-03-25,1989-03
渭北高原军用通信线路被盗,1989-03-25,1989-03
滥采石殃及马陵山国防设施,1989-03-25,1989-03
月山乡婚姻登记中弄虚作假,1989-03-25,1989-03
内乡县城镇二小校舍隐患多,1989-03-25,1989-03
新生孩子为何不报户口,1989-03-25,1989-03
乱提化肥价为何不处理,1989-03-25,1989-03
沈阳出现“算命”行业,1989-03-25,1989-03
有碍交通的事岂能撒手不管,1989-03-25,1989-03
应关注少儿离家出走的问题,1989-03-25,1989-03
樱花开放前打上完税“句号”,1989-03-25,1989-03
民德管理个体经济有方,1989-03-25,1989-03
消费与借贷,1989-03-25,1989-03
新加坡建设２１世纪机场,1989-03-25,1989-03
国际商战快递公司,1989-03-25,1989-03
一喜一忧,1989-03-25,1989-03
北京地区天气预报,1989-03-26,1989-03
政协大会发言昨达高潮,1989-03-26,1989-03
全国人大依法实施法律监督  辽宁纠正一起逮捕律师错案,1989-03-26,1989-03
治理整顿调整结构最重要,1989-03-26,1989-03
中央关于特区政策是正确的  治理整顿对特区不搞一刀切,1989-03-26,1989-03
律师辩护权不容侵犯,1989-03-26,1989-03
劳动致富非法经营当分清  希望得到社会扶持和理解,1989-03-26,1989-03
我新增八个商品粮棉基地,1989-03-26,1989-03
上海企业向国际标准看齐,1989-03-26,1989-03
中直机构改革基本结束,1989-03-26,1989-03
“令必行，禁必止”,1989-03-26,1989-03
动员各方力量切实加强农业,1989-03-26,1989-03
辞行持续百天  挥霍公款六千,1989-03-26,1989-03
企业内部债券  必须严格管理,1989-03-26,1989-03
欣闻高志平当团长,1989-03-26,1989-03
各方共同努力增加出口创汇,1989-03-26,1989-03
旅游业要以质量求发展,1989-03-26,1989-03
我外交部要求欧洲议会  停止干涉中国内政行动,1989-03-26,1989-03
珍惜安定团结民主和谐政治局面,1989-03-26,1989-03
一巴拿马轮撞沉我“新亚号”,1989-03-26,1989-03
襄樊开办多功能储蓄所,1989-03-26,1989-03
乌干达总统结束访华,1989-03-26,1989-03
彭冲副委员长  会见英国客人,1989-03-26,1989-03
刘述卿会见蒙古《真理报》记者,1989-03-26,1989-03
空军派飞机赴包头破冰抢险,1989-03-26,1989-03
一客车翻进东湖  解放军奋力抢救,1989-03-26,1989-03
天津海关查处  非法进口轿车,1989-03-26,1989-03
江泽民被聘为  上海交大教授,1989-03-26,1989-03
课本追踪录,1989-03-26,1989-03
四川二十六县消除学校危房,1989-03-26,1989-03
新营养液“北京天安２０３”研究有进展,1989-03-26,1989-03
简讯,1989-03-26,1989-03
春绿赤峰,1989-03-26,1989-03
为治理整顿寻良方,1989-03-26,1989-03
全国政协七届二次会议小组发言摘编,1989-03-26,1989-03
岂能限制地方出钱办教育,1989-03-26,1989-03
幼苗更需精心育,1989-03-26,1989-03
增强信心，先要取信于民,1989-03-26,1989-03
在多元格局中把握主流,1989-03-26,1989-03
科技要进入经济建设主战场,1989-03-26,1989-03
中国击剑选手叶冲获世青赛男花冠军,1989-03-26,1989-03
法羽毛球公开赛复赛杨阳失手,1989-03-26,1989-03
第二届中国围棋名人战循环圈赛罢第二轮,1989-03-26,1989-03
北京—巴黎老式汽车远征开始,1989-03-26,1989-03
李梦华获国际奥委会特别证书,1989-03-26,1989-03
首届亚非运动会设十个比赛项目,1989-03-26,1989-03
中国女排赴欧参赛,1989-03-26,1989-03
美国大型油轮触礁  造成严重漏油事故,1989-03-26,1989-03
尼泊尔经济生活出现严重困难,1989-03-26,1989-03
美发射星战实验卫星,1989-03-26,1989-03
苏匈党总书记会谈,1989-03-26,1989-03
多党制也可能无民主可言  一党制亦有可能实现民主,1989-03-26,1989-03
对布雷迪计划期望不能过高,1989-03-26,1989-03
喀布尔政权外交部  请求外交使团返回,1989-03-26,1989-03
布什与国会达成协议,1989-03-26,1989-03
埃约巴解领导人会晤  讨论中东的最新势态,1989-03-26,1989-03
英首相要求释放曼德拉,1989-03-26,1989-03
老兄经商小弟从政  两个布什官商分明,1989-03-26,1989-03
西方七国首脑应优先讨论债务,1989-03-26,1989-03
南朝鲜牧师文益焕抵平壤,1989-03-26,1989-03
圣马力诺执政官和天民党总书记  分别会见宋平为首的中共代表团,1989-03-26,1989-03
动员各方力量切实加强农业,1989-03-26,1989-03
“万向节现象”剖析,1989-03-26,1989-03
集资热要降温,1989-03-26,1989-03
有市无场  不利管理,1989-03-26,1989-03
今天，谁是最美丽的人？〔报告文学〕,1989-03-26,1989-03
周恩来诗碑前的樱花,1989-03-26,1989-03
美的使者,1989-03-26,1989-03
伊塔拉再展雄风,1989-03-26,1989-03
声音证件,1989-03-26,1989-03
可怕！飞行员打瞌睡,1989-03-26,1989-03
南极极点旅行,1989-03-26,1989-03
城市居民粮食浪费现象严重,1989-03-26,1989-03
当前干部不按时离退休的原因,1989-03-26,1989-03
我国嗜酒之风日盛,1989-03-26,1989-03
茶馆的来历,1989-03-26,1989-03
“生命在于运动”新议,1989-03-26,1989-03
世界上规模最大的诗会,1989-03-26,1989-03
日本人为什么愿意储蓄？,1989-03-26,1989-03
电视机将发生五大变化,1989-03-26,1989-03
当今科技发展的新动向,1989-03-26,1989-03
美国试造“微型地球”,1989-03-26,1989-03
撑竿跳,1989-03-26,1989-03
首都清理楼堂馆所压缩投资３４亿多元,1989-03-27,1989-03
北京地区天气预报,1989-03-27,1989-03
政协常委会举行第六次会议,1989-03-27,1989-03
我国今年表彰十万教师,1989-03-27,1989-03
执政务必从严,1989-03-27,1989-03
环境稳定治理整顿才能顺利,1989-03-27,1989-03
政协增补副主席和常委  选举将用逐一表决办法,1989-03-27,1989-03
全国半数以上女童未入学,1989-03-27,1989-03
统战部等联合举行茶话会  招待少数民族代表和委员,1989-03-27,1989-03
国防科技工业成绩斐然,1989-03-27,1989-03
抓党的建设要讲求实效,1989-03-27,1989-03
满意与遗憾,1989-03-27,1989-03
美查明“１２·２１空难原因,1989-03-27,1989-03
“不要扰民”,1989-03-27,1989-03
小学倒塌近两年……,1989-03-27,1989-03
固定资产投资转入新模式,1989-03-27,1989-03
改革缺点失误是前进中问题,1989-03-27,1989-03
人民心声情最真,1989-03-27,1989-03
民族艺术严肃艺术亟需保护,1989-03-27,1989-03
一些地方人为设障  农药供需矛盾加剧,1989-03-27,1989-03
我军建法律顾问制度,1989-03-27,1989-03
军民关系也应立法,1989-03-27,1989-03
涉外房屋产权登记事宜  国务院四部门作出规定,1989-03-27,1989-03
扎扎实实发展两岸关系,1989-03-27,1989-03
愿与台国民党中央对话,1989-03-27,1989-03
修建十世班禅灵塔祀殿  领导小组在拉萨市成立,1989-03-27,1989-03
民盟宴请港澳“两会”代表委员,1989-03-27,1989-03
吴文柱贪赃受惩,1989-03-27,1989-03
外事简讯,1989-03-27,1989-03
中行今年发行１０亿金融债券,1989-03-27,1989-03
农民赵存献为国防建设捐款,1989-03-27,1989-03
蔬菜正当淡季  南昌不愁价高,1989-03-27,1989-03
造纸除渣设备问世,1989-03-27,1989-03
王克昌奖学基金会成立,1989-03-27,1989-03
高效消毒剂制成,1989-03-27,1989-03
高校工科物理试题库建成,1989-03-27,1989-03
承认困难正视困难排除困难,1989-03-27,1989-03
“智囊”要慎选决策讲科学,1989-03-27,1989-03
利用整治机遇调整经济结构,1989-03-27,1989-03
加快发展化纤原料和解决危房,1989-03-27,1989-03
强化人大职能限制行政权力,1989-03-27,1989-03
实事求是对症下药,1989-03-27,1989-03
地矿部长的星期天,1989-03-27,1989-03
全国政协七届二次会议小组发言摘编,1989-03-27,1989-03
签名“收费”,1989-03-27,1989-03
中国女单女双男双混双可稳获冠军,1989-03-27,1989-03
制止运动员服药非一国之事,1989-03-27,1989-03
多特蒙德世乒赛前夕,1989-03-27,1989-03
北京举行春季长跑赛,1989-03-27,1989-03
日本散手学习团来华取经,1989-03-27,1989-03
全国拳击资格赛结束,1989-03-27,1989-03
名人桥牌赛在京举行,1989-03-27,1989-03
最佳小游泳池馆评出,1989-03-27,1989-03
喀布尔要求同美直接会谈  苏联报刊披露喀布尔现状,1989-03-27,1989-03
符合以色列安全需要  明确巴勒斯坦人权利,1989-03-27,1989-03
南塞尔维亚共和国修改宪法  为国家政治稳定创造了前提,1989-03-27,1989-03
匈国会通过《罢工法》,1989-03-27,1989-03
迈赫迪继续任总理,1989-03-27,1989-03
北约未就短导现代化达成一致,1989-03-27,1989-03
第一只“太空鸡”破壳而出,1989-03-27,1989-03
五万人集会示威要求裁军,1989-03-27,1989-03
巴基斯坦举行空战演习,1989-03-27,1989-03
尼泊尔外交大臣抵印,1989-03-27,1989-03
美科州一水坝计划受阻,1989-03-27,1989-03
贝鲁特炮战仍在继续,1989-03-27,1989-03
布什提名塔夫脱任驻北约新大使,1989-03-27,1989-03
美日联合研制新型飞机出现摩擦,1989-03-27,1989-03
阿尔巴尼亚逐步调整政策  积极发展外经和外贸关系,1989-03-27,1989-03
正确认识现状讲求党建实效,1989-03-27,1989-03
《王稼祥一生》序,1989-03-27,1989-03
沉痛悼念宦乡同志,1989-03-27,1989-03
治理宏观金融环境刍议,1989-03-27,1989-03
“黄兴研究”学术讨论会观点述要,1989-03-27,1989-03
对马克思一段话的误解,1989-03-27,1989-03
中国大百科全书《建筑·园林·城市规划》卷,1989-03-27,1989-03
核能——世界能源开发重点,1989-03-27,1989-03
天然气饱含生机,1989-03-27,1989-03
艾滋病疫苗人体试验,1989-03-27,1989-03
海面会持续上升吗？,1989-03-27,1989-03
燕舞散文征文评选结果,1989-03-27,1989-03
致作者和读者,1989-03-27,1989-03
春潮,1989-03-27,1989-03
湖畔,1989-03-27,1989-03
为改革讴歌,1989-03-27,1989-03
“莎士比亚佚诗”的论战,1989-03-27,1989-03
西施答客问,1989-03-27,1989-03
痴情,1989-03-27,1989-03
静寂的雪野（中国画）,1989-03-27,1989-03
北京地区天气预报,1989-03-28,1989-03
全国政协七届二次会议政治决议,1989-03-28,1989-03
全国政协七届二次会议闭幕,1989-03-28,1989-03
