图季曼蝉联克罗地亚总统,1992-08-09,1992-08
联合国武器核查小组抵伊,1992-08-09,1992-08
加利将派观察团赴摩尔多瓦,1992-08-09,1992-08
黎同意参加下一轮阿以会谈,1992-08-09,1992-08
尽全力抓获在逃大毒枭,1992-08-09,1992-08
提出哈萨克斯坦经济发展目标,1992-08-09,1992-08
朝鲜进一步提高人民生活水平,1992-08-09,1992-08
日本的雨水贮留浸透技术,1992-08-09,1992-08
俄罗斯石油生产继续滑坡,1992-08-09,1992-08
设立科技交流基金,1992-08-09,1992-08
艺惊四座誉享八方,1992-08-09,1992-08
新型报警装置,1992-08-09,1992-08
从废旧塑料中提取原油,1992-08-09,1992-08
便携式激光武器,1992-08-09,1992-08
简讯,1992-08-09,1992-08
奥运会与电视转播,1992-08-09,1992-08
重奖奥运功臣的企业家,1992-08-09,1992-08
邮票拯救了奥运会,1992-08-09,1992-08
邓颖超用过的名字、笔名和化名,1992-08-09,1992-08
农业推广学,1992-08-09,1992-08
鱼类的食疗功能,1992-08-09,1992-08
方寸之地巧利用,1992-08-09,1992-08
盛夏冰景,1992-08-09,1992-08
花之最,1992-08-09,1992-08
低氧环境与长寿,1992-08-09,1992-08
乌龙卷风,1992-08-09,1992-08
北京地区天气预报,1992-08-10,1992-08
北京欢迎你，奥林匹克风,1992-08-10,1992-08
第２５届奥运会圆满闭幕,1992-08-10,1992-08
我国第二代科学试验卫星发射成功,1992-08-10,1992-08
恒通公司投资１１亿元  改造北京东四商业区,1992-08-10,1992-08
海南省筹建国家星火示范区,1992-08-10,1992-08
云南民办科技园在昆明奠基,1992-08-10,1992-08
南方最大狩猎场开放,1992-08-10,1992-08
桂林对外开放势头好,1992-08-10,1992-08
乌溪江引水一期工程建成通水,1992-08-10,1992-08
三峡中堡岛添设新景,1992-08-10,1992-08
北京首家村办企业集团诞生,1992-08-10,1992-08
北京——北海正式通航,1992-08-10,1992-08
武汉港对外籍轮船开放,1992-08-10,1992-08
长城计算机自行降价四成,1992-08-10,1992-08
大江大河清障任务进展顺利,1992-08-10,1992-08
我国首家股份经济研究所成立,1992-08-10,1992-08
中日歌星将联袂巡回演出,1992-08-10,1992-08
文硕入选《国际传记辞典》,1992-08-10,1992-08
《中国历代经典宝库》出版,1992-08-10,1992-08
《寻找利益共同点》一书出版,1992-08-10,1992-08
外事简讯,1992-08-10,1992-08
绍兴工程机械厂产品替代进口,1992-08-10,1992-08
“二次出山”作贡献,1992-08-10,1992-08
安庆板簧厂产品无库存,1992-08-10,1992-08
七省市共舞长江经济巨龙,1992-08-10,1992-08
湖南对外开放跃上新台阶,1992-08-10,1992-08
汤阴依托重点项目发展高效农业,1992-08-10,1992-08
淮北市加速吸引外资,1992-08-10,1992-08
湖北旱情严重全省全力保收,1992-08-10,1992-08
王成琪１０年培养近５００名高足,1992-08-10,1992-08
乌兰牧骑欢庆３５岁生日,1992-08-10,1992-08
武汉科技个体户  在美硅谷办公司,1992-08-10,1992-08
力达公司被兼并后获新生,1992-08-10,1992-08
两面针牙膏产销量居全国之冠,1992-08-10,1992-08
北京婚庆公司开业,1992-08-10,1992-08
全国最畅销国产商品展销月将举行,1992-08-10,1992-08
扩大高校办学自主权,1992-08-10,1992-08
大中专毕业生试行合同制,1992-08-10,1992-08
哈尔滨面向企业制订科技政策,1992-08-10,1992-08
铂—２０２,1992-08-10,1992-08
社会力量办学理应大力支持,1992-08-10,1992-08
核素,1992-08-10,1992-08
三支科技队伍“打擂台”,1992-08-10,1992-08
惜字塔顶长大树,1992-08-10,1992-08
超导前沿创一流,1992-08-10,1992-08
全国治沙暨沙业学会成立,1992-08-10,1992-08
福建发现一古文化建筑群遗址,1992-08-10,1992-08
ＳＴ——宽谱治疗仪疗效高,1992-08-10,1992-08
即墨发现亿年古树化石,1992-08-10,1992-08
《写作大辞典》新颖实用,1992-08-10,1992-08
《中国扇面书画集锦》出版,1992-08-10,1992-08
画家刘存惠画集发行,1992-08-10,1992-08
科研机构兴办科技开发企业国有资产管理暂行规定,1992-08-10,1992-08
惜字塔顶长大树,1992-08-10,1992-08
拭目望群星灿然耀眼明,1992-08-10,1992-08
奥运会奖牌榜,1992-08-10,1992-08
我健儿全面超额完成任务,1992-08-10,1992-08
田径争夺在高潮中收兵,1992-08-10,1992-08
地球原来是个村,1992-08-10,1992-08
西班牙国王会见伍绍祖,1992-08-10,1992-08
陆上损失水中补,1992-08-10,1992-08
足球获铜牌非洲有光彩,1992-08-10,1992-08
互贺佳绩皆大欢喜,1992-08-10,1992-08
冠中冠谢尔博,1992-08-10,1992-08
没有奖牌的英雄,1992-08-10,1992-08
细数峥嵘地中海,1992-08-10,1992-08
冠军成绩,1992-08-10,1992-08
引导农村工业在发展中提高,1992-08-10,1992-08
从周边国家和地区看我国加速发展的紧迫性,1992-08-10,1992-08
健全干部选拔的竞争机制,1992-08-10,1992-08
企业改革的关键是适应商品经济规律要求,1992-08-10,1992-08
《中国军事史略》简介,1992-08-10,1992-08
阿拉法特访问摩洛哥,1992-08-10,1992-08
联合国小组在索视察,1992-08-10,1992-08
联合国小组在伊核查,1992-08-10,1992-08
墨发生火车相撞事故,1992-08-10,1992-08
美海军一直升机坠毁,1992-08-10,1992-08
第三世界国家要求各方继续认真谈判,1992-08-10,1992-08
土耳其提出结束波黑冲突计划,1992-08-10,1992-08
布什同高级顾问再次讨论南局势,1992-08-10,1992-08
东盟成立２５年来取得很大成就,1992-08-10,1992-08
阿富汗总统府遭火箭袭击,1992-08-10,1992-08
明石康访问越南,1992-08-10,1992-08
中国与东盟各国友好合作不断发展,1992-08-10,1992-08
德国总理要求对南军事干预  法国官员主张加强对南施压,1992-08-10,1992-08
我人大代表团结束访瓦,1992-08-10,1992-08
反对就北方四岛问题举行公决,1992-08-10,1992-08
危政府和游击队谈判取得进展,1992-08-10,1992-08
长崎举行原子弹罹难者慰灵祭,1992-08-10,1992-08
中国改革开放成就巨大,1992-08-10,1992-08
德国物价仍未得到控制,1992-08-10,1992-08
赢得市场的“秘诀”——信息,1992-08-10,1992-08
日经常性收支盈余创纪录,1992-08-10,1992-08
哈萨克斯坦官员强调吸引外资,1992-08-10,1992-08
美“阿特兰蒂斯”号航天飞机返回地面,1992-08-10,1992-08
墨西哥出动军队扫毒,1992-08-10,1992-08
日研究激光引雷技术,1992-08-10,1992-08
美建造亚毫米波射电望远镜阵列,1992-08-10,1992-08
中空率超过３０％的纤维制成,1992-08-10,1992-08
俄今年粮食收购将大幅度减少,1992-08-10,1992-08
墨成为拉美第一旅游大国,1992-08-10,1992-08
科石油日产一百二十万桶,1992-08-10,1992-08
新型伊尔—１１４客机投产,1992-08-10,1992-08
德国失业人数超三百万,1992-08-10,1992-08
北极风情,1992-08-10,1992-08
漫话读书与“本钱”,1992-08-10,1992-08
再说罗丹,1992-08-10,1992-08
“金爪沟”创业曲,1992-08-10,1992-08
人格的力量,1992-08-10,1992-08
篆刻,1992-08-10,1992-08
北京地区天气预报,1992-08-11,1992-08
延安希望小学奠基,1992-08-11,1992-08
托起明天的太阳,1992-08-11,1992-08
国务院对海南进一步放宽政策,1992-08-11,1992-08
“产学研联合开发工程”实施,1992-08-11,1992-08
姚依林副总理抵马来西亚访问,1992-08-11,1992-08
繁荣文艺必须解放思想,1992-08-11,1992-08
宋平会见安哥拉客人,1992-08-11,1992-08
中国残疾人体育代表团组成,1992-08-11,1992-08
第９９架波音飞机运抵北京,1992-08-11,1992-08
超大穗小麦在咸阳育成,1992-08-11,1992-08
河北兴建火炬产业园区,1992-08-11,1992-08
浦东建继续教育中心,1992-08-11,1992-08
我国最大电弧炉出钢,1992-08-11,1992-08
大连开办房地产交易市场,1992-08-11,1992-08
办一个成一个,1992-08-11,1992-08
中哈两国政府签署七个协议,1992-08-11,1992-08
宫泽对天皇访华作出最终决断,1992-08-11,1992-08
今年棉花购销政策保持稳定  产棉省区试行购销体制改革,1992-08-11,1992-08
纪检部门要围绕经济建设中心做好工作,1992-08-11,1992-08
大力发展工会企事业,1992-08-11,1992-08
客商竖起大拇指,1992-08-11,1992-08
史克慈治病四万多人不取分文,1992-08-11,1992-08
喇叭花和无花果,1992-08-11,1992-08
邹家华叶选平参加珠海明珠山庄奠基典礼,1992-08-11,1992-08
赛福鼎·艾则孜率团出访白俄罗斯和乌克兰,1992-08-11,1992-08
九十年代亚太形势讨论会在京举行,1992-08-11,1992-08
外事简讯,1992-08-11,1992-08
哈萨克斯坦外长结束访华,1992-08-11,1992-08
北京打击卖淫嫖娼违法犯罪活动,1992-08-11,1992-08
进一步做好农民承担费用和劳务监督管理工作,1992-08-11,1992-08
北京煤总建成三产骨干企业  淄博三产服务水平列省前茅,1992-08-11,1992-08
小生产大基地,1992-08-11,1992-08
农业综合开发进展快,1992-08-11,1992-08
石家庄市扩大对外开放,1992-08-11,1992-08
跃向市场,1992-08-11,1992-08
股份制试点企业土地资产管理暂行规定,1992-08-11,1992-08
中国汽车销售总公司成立,1992-08-11,1992-08
海南合资兴建二万吨专用油码头,1992-08-11,1992-08
山海关站安全生产十年无大事故,1992-08-11,1992-08
魏县利用世行资金改造小氮肥,1992-08-11,1992-08
准高速内燃机车牵引电机问世,1992-08-11,1992-08
防水隔热又保温的新型建材问世,1992-08-11,1992-08
新一代无线麦克风系统问世,1992-08-11,1992-08
桂林联合收割机厂产品旺销,1992-08-11,1992-08
退回十年不敢想,1992-08-11,1992-08
十二比四巾帼俏  男儿更当立壮志,1992-08-11,1992-08
集体项目滑坡引人注目  心理负担过重旧话重提,1992-08-11,1992-08
兴奋剂成赛场“艾滋病”,1992-08-11,1992-08
敞着门立章程,1992-08-11,1992-08
编者按,1992-08-11,1992-08
书籍有错何时了！,1992-08-11,1992-08
清除出版物中的“残次品”,1992-08-11,1992-08
整治繁体字首都应带头,1992-08-11,1992-08
工业用盐挤走碘盐  孝感地方病重流行,1992-08-11,1992-08
伪劣稻种充斥市场  武冈数万农户受害,1992-08-11,1992-08
作物岂能“换届”,1992-08-11,1992-08
潘心泰的“灵丹妙药”,1992-08-11,1992-08
新闻出版部门更要用好规范字,1992-08-11,1992-08
让简化字表到基层来,1992-08-11,1992-08
法院判决要不要执行,1992-08-11,1992-08
猪崽子好“福”气！,1992-08-11,1992-08
以准备解除与巴解接触禁令  巴解主席阿拉法特表示高兴,1992-08-11,1992-08
厄瓜多尔总统会见我政府代表团,1992-08-11,1992-08
约巴代表团再次会晤,1992-08-11,1992-08
要求美慎重对待向以提供贷款担保,1992-08-11,1992-08
美国应尊重玻主权,1992-08-11,1992-08
英主张建安全区安置南难民,1992-08-11,1992-08
俄英代表团调查战俘监狱,1992-08-11,1992-08
克里米亚共产党人联盟宣告成立,1992-08-11,1992-08
塞希土两族领导人将直接会谈,1992-08-11,1992-08
对俄乌黑海舰队协议提出异议,1992-08-11,1992-08
南朝鲜将把军妓问题提交联合国,1992-08-11,1992-08
夏收时节梁赞行,1992-08-11,1992-08
南朝鲜国会处于瘫痪状态,1992-08-11,1992-08
南危机成为美国大选的斗争新焦点,1992-08-11,1992-08
促进朝鲜统一大行军开始,1992-08-11,1992-08
日成立国际和平合作本部,1992-08-11,1992-08
爱沙尼亚举行军事演习,1992-08-11,1992-08
哥伦比亚任命新监狱总监,1992-08-11,1992-08
德国东部难民营遭袭击,1992-08-11,1992-08
中国经济正高速增长,1992-08-11,1992-08
日本新干线车速又创新纪录,1992-08-11,1992-08
俄法宇航员返回地面,1992-08-11,1992-08
致力于发展世界农业,1992-08-11,1992-08
“海上丝绸之路”,1992-08-11,1992-08
日本股市再现最低值,1992-08-11,1992-08
简讯,1992-08-11,1992-08
美国企业管理人员失业问题,1992-08-11,1992-08
让争篇,1992-08-11,1992-08
一份重要的文化遗产,1992-08-11,1992-08
灵山荔枝,1992-08-11,1992-08
艺文短波,1992-08-11,1992-08
悼先念同志,1992-08-11,1992-08
高原七月,1992-08-11,1992-08
北京地区天气预报,1992-08-12,1992-08
二连浩特“手语市场”,1992-08-12,1992-08
《中国改造罪犯的状况》白皮书,1992-08-12,1992-08
中国体育代表团第二批人员凯旋,1992-08-12,1992-08
四川重视交通能源建设,1992-08-12,1992-08
近两万师生学马列学党章,1992-08-12,1992-08
马哈蒂尔总理会见姚依林副总理,1992-08-12,1992-08
交通部批准修建二郎山隧道,1992-08-12,1992-08
我自营开发的海上气田投产,1992-08-12,1992-08
乔石会见法共领导人休假团,1992-08-12,1992-08
不怕肥水落外田,1992-08-12,1992-08
西南农资批发市场开业,1992-08-12,1992-08
红花种子生产基地建成,1992-08-12,1992-08
贵州勘探出大型金矿,1992-08-12,1992-08
西藏各界为希望工程捐款,1992-08-12,1992-08
我国电子琴学童逾２００万,1992-08-12,1992-08
北京大力发展节水农业,1992-08-12,1992-08
上海焚毁１８万件伪劣商品,1992-08-12,1992-08
祖国欢迎你们,1992-08-12,1992-08
祖国欢迎你们,1992-08-12,1992-08
中国改造罪犯的状况,1992-08-12,1992-08
社会力量办学利国利民应大力支持,1992-08-12,1992-08
青海抓科技先导型企业见成效,1992-08-12,1992-08
中国地质大学围绕电镀钻头做文章,1992-08-12,1992-08
山沟沟里的农民读书协会,1992-08-12,1992-08
北图举行首都文化界名人纪念笔会,1992-08-12,1992-08
西安民族书画摄影作品在京展出,1992-08-12,1992-08
清华文通信息技术公司成立,1992-08-12,1992-08
多功能烧伤治疗纱布问世,1992-08-12,1992-08
新疆牛胚胎移植研究取得成效,1992-08-12,1992-08
《中国对外服务》杂志创刊,1992-08-12,1992-08
教科文简讯,1992-08-12,1992-08
宋德培用膏贴疗法治骨病,1992-08-12,1992-08
深圳首创空气净化清新机,1992-08-12,1992-08
河南修建《易经》发源地羑里城,1992-08-12,1992-08
当阳研制出长途直拨电话控制器,1992-08-12,1992-08
全国各地抗天灾保秋收,1992-08-12,1992-08
“中国质量万里行”为新闻改革提供新经验,1992-08-12,1992-08
曲阜成为海内外投资热点,1992-08-12,1992-08
北京联航旅游公司一架直升机失事,1992-08-12,1992-08
武警部队授予许德华优秀警官称号,1992-08-12,1992-08
襄樊市转变政府职能高效有序,1992-08-12,1992-08
全国民族文化工作经验交流会闭幕,1992-08-12,1992-08
康务学向国家捐献７３幅书画珍品,1992-08-12,1992-08
中国儿童少年艺术团在京演出,1992-08-12,1992-08
固始县教育电视近期开播,1992-08-12,1992-08
北京香港美食城向残疾儿童捐款,1992-08-12,1992-08
赵望云遗作在京展出,1992-08-12,1992-08
全国适用技术消费精品博览会将在椒江举行,1992-08-12,1992-08
“客”聚五台山,1992-08-12,1992-08
深圳售新股认购抽签表  少数人闹事被及时制止,1992-08-12,1992-08
唐守愚同志逝世,1992-08-12,1992-08
岳嵩同志逝世,1992-08-12,1992-08
天津云罩寺风景区向游人开放,1992-08-12,1992-08
南宁市府大院将让地兴商,1992-08-12,1992-08
营口有座“激光枪战城、太空城”,1992-08-12,1992-08
苏州服装城破土兴建,1992-08-12,1992-08
淄博将举办第三届陶瓷琉璃节,1992-08-12,1992-08
加快老工业基地改造与振兴的意见,1992-08-12,1992-08
按国际惯例办事加快外向型经济发展,1992-08-12,1992-08
东西互助共同发展,1992-08-12,1992-08
姚依林看望我驻马使馆工作人员,1992-08-12,1992-08
喀布尔发生空前激战,1992-08-12,1992-08
布什与拉宾会谈,1992-08-12,1992-08
阿富汗总理访问伊朗,1992-08-12,1992-08
美英法要求安理会授权用武  确保向波黑难民运救济物资,1992-08-12,1992-08
南总理访问希腊和阿尔巴尼亚,1992-08-12,1992-08
巴连就任厄瓜多尔总统,1992-08-12,1992-08
明智之举,1992-08-12,1992-08
以政府决定执行新定居点政策,1992-08-12,1992-08
穆巴拉克会见科外交大臣,1992-08-12,1992-08
非国大与南非政府的对立趋向缓和,1992-08-12,1992-08
保群众抗议逮捕前领导人,1992-08-12,1992-08
孟加拉国总理访问巴基斯坦,1992-08-12,1992-08
俄罗斯呼吁和平解决纳卡冲突,1992-08-12,1992-08
德国城市交通一瞥,1992-08-12,1992-08
东京股市反弹无力下跌不止,1992-08-12,1992-08
欧共体宣布征收反倾销税,1992-08-12,1992-08
外国在葡投资大幅度增长,1992-08-12,1992-08
哥伦比亚反毒取得新进展  查获一点六万公斤可卡因,1992-08-12,1992-08
“阿丽亚娜”火箭第５２次发射,1992-08-12,1992-08
简明新闻,1992-08-12,1992-08
美发现最强伽马射线源,1992-08-12,1992-08
英科学家发现土星有极光,1992-08-12,1992-08
日本制成新型人造骨,1992-08-12,1992-08
瑶山风情汉宫戏,1992-08-12,1992-08
一代文豪的特殊经历,1992-08-12,1992-08
蓉城访文坛两老,1992-08-12,1992-08
银柳依然绿,1992-08-12,1992-08
艺文短波,1992-08-12,1992-08
求索图,1992-08-12,1992-08
北京地区天气预报,1992-08-13,1992-08
江西工业企业大幅扭亏增盈,1992-08-13,1992-08
切实提高产品质量工程质量服务质量水平,1992-08-13,1992-08
１４日７时发射“澳星”,1992-08-13,1992-08
加快改革促进房地产业健康发展,1992-08-13,1992-08
吉林多渠道交流人才,1992-08-13,1992-08
两万多科技人员挺进大别山,1992-08-13,1992-08
联合国裁军和安全亚太地区会议将在上海举行,1992-08-13,1992-08
又有四个县对外国人开放,1992-08-13,1992-08
天津赴港招商成果显著,1992-08-13,1992-08
外商驻沪机构逾千家,1992-08-13,1992-08
友谊关关楼对外开放,1992-08-13,1992-08
管好“跑着生”的人,1992-08-13,1992-08
河北实行规范化股份制试点,1992-08-13,1992-08
天津一公司评选星级售货员,1992-08-13,1992-08
农５Ａ型飞机获得合格证书,1992-08-13,1992-08
鲁西医药商场在阳谷建成,1992-08-13,1992-08
逊克筹建边境经济合作区,1992-08-13,1992-08
拉萨冲出“围城”,1992-08-13,1992-08
基士得耶在华设立六大代理,1992-08-13,1992-08
重视“助跑”,1992-08-13,1992-08
１０万线程控交换机生产线建成,1992-08-13,1992-08
“好侍我夫”洗衣粉获国际专利,1992-08-13,1992-08
南通制成六氟化硫气体充放装置,1992-08-13,1992-08
广州方便面生产设备出口,1992-08-13,1992-08
阻燃型运输带胶粘剂投产,1992-08-13,1992-08
湛江为引进设备办理“预约保险”,1992-08-13,1992-08
“京厨”牌高效吸排油烟机上市,1992-08-13,1992-08
雅丽丝实业公司推出防晒新品,1992-08-13,1992-08
电力成套设备工作跨上新台阶,1992-08-13,1992-08
小浪底水利工程进展顺利,1992-08-13,1992-08
山推厂以内部索赔促质量提高,1992-08-13,1992-08
权威人士认为：既是冲击更是机遇,1992-08-13,1992-08
对外资企业进出口货物  海关将实行新管理办法,1992-08-13,1992-08
蔡诚就《中国改造罪犯的状况》发表电视讲话,1992-08-13,1992-08
全军“二五”普法教育顺利发展,1992-08-13,1992-08
秦皇岛重视做好干部离退休工作,1992-08-13,1992-08
“天涯哨兵”荣立集体一等功,1992-08-13,1992-08
某舟桥旅以求实精神建设基层,1992-08-13,1992-08
公仆本色,1992-08-13,1992-08
中山市颐老院被誉为温暖之家,1992-08-13,1992-08
江苏退伍武警深受地方欢迎,1992-08-13,1992-08
韩清利被授予“爱军习武标兵”称号,1992-08-13,1992-08
新余市组织党纪党课教育观摩,1992-08-13,1992-08
武警赤峰支队帮助地方办矿脱贫,1992-08-13,1992-08
淮安公安局加强人口管理,1992-08-13,1992-08
朝阳公安分局重视信访工作,1992-08-13,1992-08
四川打击破坏国防通信线路罪犯,1992-08-13,1992-08
首都机场武警官兵为旅客服务,1992-08-13,1992-08
空军丰台油库连续二十三年保安全,1992-08-13,1992-08
我国奥运健儿在京联欢,1992-08-13,1992-08
一批企业家在京交流企业改革经验,1992-08-13,1992-08
北京将纪念卢沟桥建桥八百周年,1992-08-13,1992-08
英雄城南昌面貌一新,1992-08-13,1992-08
沈阳一些单位工作松散  群众呼吁整治这种作风,1992-08-13,1992-08
铜陵夜市正红火,1992-08-13,1992-08
钱其琛会见亚太地区一批专家学者,1992-08-13,1992-08
澳门同胞为希望工程捐款,1992-08-13,1992-08
澳门基本法咨委会向草委会送交《咨询意见报告书》,1992-08-13,1992-08
京郊直升机失事伤员得到及时救治,1992-08-13,1992-08
中国旅游购物节将在十三个城市相继举行,1992-08-13,1992-08
批评当局大陆政策不负责任,1992-08-13,1992-08
新华社新闻资料管理迈向现代化,1992-08-13,1992-08
武当拳派研究成果通过鉴定,1992-08-13,1992-08
曹亮同志逝世,1992-08-13,1992-08
服务经济建设加快公安改革步伐,1992-08-13,1992-08
新闻出版署宣布调整部分出版管理规定,1992-08-13,1992-08
张云逸纪念馆落成,1992-08-13,1992-08
选才,1992-08-13,1992-08
蒙山路,1992-08-13,1992-08
山城灯火,1992-08-13,1992-08
坚毅的目光,1992-08-13,1992-08
西方四国要求安理会审议伊人权问题,1992-08-13,1992-08
亚太国家应加强合作共同发展,1992-08-13,1992-08
国际社会呼吁阿冲突各方停火,1992-08-13,1992-08
中马经贸联委会举行会谈,1992-08-13,1992-08
泛非大与南非政府会谈,1992-08-13,1992-08
欧美就南斯拉夫危机发表看法,1992-08-13,1992-08
俄副总理对日关系谈话属“个人想法”,1992-08-13,1992-08
保总统反对在保恢复君主制,1992-08-13,1992-08
匈接连发生袭击外交人员事件,1992-08-13,1992-08
拉宾访美：弥合美以分歧,1992-08-13,1992-08
简讯,1992-08-13,1992-08
埃利关系趋向正常,1992-08-13,1992-08
美墨加达成北美自由贸易协定,1992-08-13,1992-08
津巴布韦继续推行经济改革,1992-08-13,1992-08
波音公司向我交付第一百架客机,1992-08-13,1992-08
美元汇率持续下跌  西方国家再次干预,1992-08-13,1992-08
波兰气候反常歉收已成定局,1992-08-13,1992-08
武陵酒香飘海外,1992-08-13,1992-08
高效·方便·可信,1992-08-13,1992-08
山西和乌一省签署备忘录,1992-08-13,1992-08
哥政府悬赏缉拿头号毒枭,1992-08-13,1992-08
日本恶性犯罪案件剧增,1992-08-13,1992-08
白俄罗斯发生森林火灾,1992-08-13,1992-08
北京地区天气预报,1992-08-14,1992-08
无锡市加快物流体制综合改革,1992-08-14,1992-08
物资配送,1992-08-14,1992-08
６８４７７９４——人才流动热线,1992-08-14,1992-08
我国初步形成全方位开放新格局,1992-08-14,1992-08
千里南岭变封闭屏障为开放走廊,1992-08-14,1992-08
批评四省市擅自发行债券证券,1992-08-14,1992-08
西藏多种经营乡镇企业发展快,1992-08-14,1992-08
简化进口产品和出国人员手续,1992-08-14,1992-08
四川万余失学儿童将重返校园,1992-08-14,1992-08
来一次“质量乡下行”如何？,1992-08-14,1992-08
莱州湾捕蜇忙,1992-08-14,1992-08
新上海商城建设地块签约,1992-08-14,1992-08
广西早造粮食总产创纪录,1992-08-14,1992-08
浙江水产品喜获丰收,1992-08-14,1992-08
京沪线重载列车牵引试验成功,1992-08-14,1992-08
青藏公路铺抗冻实验路,1992-08-14,1992-08
京津开行旅游特快列车,1992-08-14,1992-08
笑声来自台北姑娘,1992-08-14,1992-08
萍乡：开始当主角  德阳：唱红半边天,1992-08-14,1992-08
吉林省积极培育发展劳务市场,1992-08-14,1992-08
不“换脑筋”走不出困境,1992-08-14,1992-08
大同铁路分局多运晋煤为国分忧,1992-08-14,1992-08
我国商检人员获国际评审员证书,1992-08-14,1992-08
轻工部决定加强控制使用化学合成甜味剂,1992-08-14,1992-08
客商齐夸“样品街”,1992-08-14,1992-08
雪花集团公司对市政府承包,1992-08-14,1992-08
物资市场有只“怪兽”,1992-08-14,1992-08
老庄农技站的变迁,1992-08-14,1992-08
海峡两岸城市综合开发研讨会开幕,1992-08-14,1992-08
铁路“两经”与地方协作会将举行,1992-08-14,1992-08
西安联航飞机维修总站开业,1992-08-14,1992-08
《中国优质产品大全》一书出版发行,1992-08-14,1992-08
神冠脑病治疗仪获双奖,1992-08-14,1992-08
长虹牌小型彩扩机投放市场,1992-08-14,1992-08
锦春牌压滤机板框获专利,1992-08-14,1992-08
中国改造罪犯取得历史性成就,1992-08-14,1992-08
提高党员理论科学文化素质  积极投身改革开放经济建设,1992-08-14,1992-08
天津大胆选拔中青年干部,1992-08-14,1992-08
把以经济建设为中心落到实处,1992-08-14,1992-08
正面报道大要案是加强民主与法制的需要,1992-08-14,1992-08
贾俊清和他带领的高炮团双立功,1992-08-14,1992-08
驻藏部队支援边疆建设  各项工作受到当地好评,1992-08-14,1992-08
武警湖北总队积极参与综合治理,1992-08-14,1992-08
过河卒,1992-08-14,1992-08
武警德昌县中队奋勇抗洪抢险,1992-08-14,1992-08
平顶山市评议政府职能部门,1992-08-14,1992-08
农民企业家邱海静担任局长,1992-08-14,1992-08
确山县为驻军办实事,1992-08-14,1992-08
北空某军械库加强安全管理,1992-08-14,1992-08
北京投资兴建国防训练基地,1992-08-14,1992-08
二炮某部纪律建设经常化,1992-08-14,1992-08
回族青年马弘毅提出多项建议,1992-08-14,1992-08
长葛县委加强党管武装工作,1992-08-14,1992-08
新“乐凯”研制及应用者受表彰,1992-08-14,1992-08
做好“发展”大文章,1992-08-14,1992-08
山西选拔千名年轻干部担任领导职务,1992-08-14,1992-08
大陆、港、澳、台中学生将竞赛航天知识,1992-08-14,1992-08
首都集会纪念中国近代留学教育一百二十周年,1992-08-14,1992-08
打出“中华牌”的荣耀,1992-08-14,1992-08
我国矿物表面结构图象研究取得重要突破,1992-08-14,1992-08
郴州邀请中国女排“回娘家”冬训,1992-08-14,1992-08
中华老人文促会对外交流活跃,1992-08-14,1992-08
