北京地区天气预报,1992-08-01,1992-08
杨文意庄泳王晓红获１金２银,1992-08-01,1992-08
加强能源交通建设保证经济高速发展,1992-08-01,1992-08
江泽民杨尚昆李鹏等和军民联欢,1992-08-01,1992-08
娃哈哈果奶全面旺销,1992-08-01,1992-08
中国正式加入世界版权公约,1992-08-01,1992-08
人民军队的神圣职责,1992-08-01,1992-08
夏粮入库快质量好,1992-08-01,1992-08
宝钢二期工程提前达标,1992-08-01,1992-08
海南与大陆铁路通道开始筹建,1992-08-01,1992-08
厦门保税生产资料市场开业,1992-08-01,1992-08
北京日用工业品交易市场开业,1992-08-01,1992-08
电器绝缘用层压板原纸投产,1992-08-01,1992-08
陕西培育出新种大白菜,1992-08-01,1992-08
国防部在京举行盛大招待会,1992-08-01,1992-08
我国加强民族地区经济科技立法,1992-08-01,1992-08
河南高法惩处报复厂长经理行为,1992-08-01,1992-08
《出版物汉字使用管理规定》今日施行,1992-08-01,1992-08
老将军老同志举行座谈会,1992-08-01,1992-08
长安航空公司成立,1992-08-01,1992-08
中国宣布中止与尼日尔外交关系,1992-08-01,1992-08
“祥子来了！”,1992-08-01,1992-08
学习邓小平新时期军队建设思想  为改革开放和经济建设保驾护航,1992-08-01,1992-08
通用航空公司一飞机在宁失事,1992-08-01,1992-08
外交部发言人发表评论,1992-08-01,1992-08
外事简讯,1992-08-01,1992-08
上千只白鹭落户沙市,1992-08-01,1992-08
新疆发现大面积古代岩画,1992-08-01,1992-08
十三陵朝凤山庄动工兴建,1992-08-01,1992-08
磁化水生物效应之谜被揭开,1992-08-01,1992-08
进一步做好农村市场这篇大文章,1992-08-01,1992-08
湛江农业潮,1992-08-01,1992-08
铜陵率先推行综合改革,1992-08-01,1992-08
九江推出四项开放新措施,1992-08-01,1992-08
华东华中煤炭告急,1992-08-01,1992-08
农业银行从日本引进国际商业贷款,1992-08-01,1992-08
税官办起“鹊桥会”,1992-08-01,1992-08
南昌工商局“查假”不分内外,1992-08-01,1992-08
汛情平稳天气正常,1992-08-01,1992-08
中国华源实业有限公司在沪开业,1992-08-01,1992-08
襄樊车站二十年无重大、大事故,1992-08-01,1992-08
“庆红宝”西瓜新品种效益显著,1992-08-01,1992-08
煤城促进会将办科技项目洽谈会,1992-08-01,1992-08
福达胶卷为中国体育代表团专用品,1992-08-01,1992-08
经纬速印油墨填补国内空白,1992-08-01,1992-08
美数据通用公司举办新产品展示会,1992-08-01,1992-08
“濛”时装系列在京展示,1992-08-01,1992-08
我国首创曲线轨道衡通过鉴定,1992-08-01,1992-08
康福天然苗条霜获金奖,1992-08-01,1992-08
父女搞科研,1992-08-01,1992-08
杨文意再度辉煌,1992-08-01,1992-08
未冠仍是人中凤,1992-08-01,1992-08
碧波池诞生６项新纪录  绿茵场决出８支出线队,1992-08-01,1992-08
田径大赛拉开战幕,1992-08-01,1992-08
对服用兴奋剂者严惩不贷,1992-08-01,1992-08
女子体操决出个人全能冠军,1992-08-01,1992-08
健儿扬威巴城争气    北京申办奥运有利,1992-08-01,1992-08
女篮也有梦之队  中国姑娘路难行,1992-08-01,1992-08
中国女排两战两败,1992-08-01,1992-08
“看”的学问,1992-08-01,1992-08
冠军常是新面孔,1992-08-01,1992-08
冠军成绩,1992-08-01,1992-08
奥运金牌榜,1992-08-01,1992-08
日本：热门新闻说林莉,1992-08-01,1992-08
法国：等待冠军未落空,1992-08-01,1992-08
意大利：剑挑金牌举国欢,1992-08-01,1992-08
角斗士听命女裁判,1992-08-01,1992-08
体操教头另谋生路,1992-08-01,1992-08
升旗时的心态,1992-08-01,1992-08
巴市府控制纪念章热,1992-08-01,1992-08
紧紧围绕党的基本路线做好双拥工作,1992-08-01,1992-08
加强国有资产管理完善承包经营责任制,1992-08-01,1992-08
深化改革促进社会经济协调发展,1992-08-01,1992-08
江苏省国营新洋农场深化改革的调查,1992-08-01,1992-08
霍·阿鲁秋尼扬出任亚总理,1992-08-01,1992-08
格土两国签署友好睦邻条约,1992-08-01,1992-08
黎巴嫩国务部长宣布辞职,1992-08-01,1992-08
美爆炸事件五年增加一倍,1992-08-01,1992-08
特多代总统会见我政府代表团,1992-08-01,1992-08
朝总参谋长赞扬我军革命历程,1992-08-01,1992-08
将进一步扩大同中国各领域合作,1992-08-01,1992-08
南总理结束西欧美国之行,1992-08-01,1992-08
捷举行第三次总统选举,1992-08-01,1992-08
安理会决定延长联合国驻黎部队驻扎期,1992-08-01,1992-08
俄罗斯召开核遏制专家会议,1992-08-01,1992-08
以美将讨论解决司法调查争端,1992-08-01,1992-08
监督即将在南非举行的抗议活动,1992-08-01,1992-08
阿拉法特说：“我已准备好了”,1992-08-01,1992-08
阿尔巴尼亚经济继续下滑,1992-08-01,1992-08
俄外交部说苏朝友好条约仍有效,1992-08-01,1992-08
柏林司法当局宣布昂纳克被监禁,1992-08-01,1992-08
美众院拒绝为马蒂电视台拨款,1992-08-01,1992-08
“马克冲击”震动英国,1992-08-01,1992-08
阿尔巴尼亚政坛上的又一次较量,1992-08-01,1992-08
阿特兰蒂斯号航天飞机升空,1992-08-01,1992-08
井上靖与黄河·长江,1992-08-01,1992-08
一篇征文发表的前前后后,1992-08-01,1992-08
钟翰的书面发言,1992-08-01,1992-08
汤弘庆托本报转钟翰的信（节录）,1992-08-01,1992-08
巴塞罗那风情,1992-08-01,1992-08
钢琴家百岁华诞,1992-08-01,1992-08
奇异的路牌,1992-08-01,1992-08
蜥蜴走私猖獗,1992-08-01,1992-08
同在一片蓝天下,1992-08-01,1992-08
猴乡·猴戏·玩猴人,1992-08-01,1992-08
对黄土地的一片深情,1992-08-01,1992-08
百集巨片《京都纪事》,1992-08-01,1992-08
视角独特的《广告人》,1992-08-01,1992-08
走向世界的花汉民,1992-08-01,1992-08
海味军魂,1992-08-01,1992-08
请评出公正来,1992-08-01,1992-08
载歌载舞的温莎管乐团,1992-08-01,1992-08
将军士兵主持电视节目,1992-08-01,1992-08
电视片《旅日见闻》将播出,1992-08-01,1992-08
绚丽多彩的墨西哥音乐表演,1992-08-01,1992-08
亚太通信卫星有限公司  购买两颗美国卫星,1992-08-02,1992-08
苏州物资集团在竞争中发展,1992-08-02,1992-08
李鹏会见法国客人,1992-08-02,1992-08
向战高温职工致敬,1992-08-02,1992-08
油田职工会战忙,1992-08-02,1992-08
建桥工人热情高,1992-08-02,1992-08
江苏加快移动通信网建设,1992-08-02,1992-08
上海开设大型“水上世界”,1992-08-02,1992-08
“亚洲第一”长输煤气管道竣工,1992-08-02,1992-08
新型示警灯将展示京津,1992-08-02,1992-08
向吉铁路线下主体工程完工,1992-08-02,1992-08
北京地区天气预报,1992-08-02,1992-08
小将陆莉获高低杠金牌,1992-08-02,1992-08
海外留学生八百多人  自愿应聘到深圳工作,1992-08-02,1992-08
广东年财政上交大幅增长,1992-08-02,1992-08
上海商业改革开放加快,1992-08-02,1992-08
撤除各类公路检查站,1992-08-02,1992-08
开创经济建设和改革开放新局面  以优异成绩迎接党的十四大召开,1992-08-02,1992-08
赣南大批行政干部转岗,1992-08-02,1992-08
我国开始残疾人就业试点,1992-08-02,1992-08
边境人家,1992-08-02,1992-08
徐向前故居修复开放,1992-08-02,1992-08
海南查处一起“流产”博交会,1992-08-02,1992-08
《中国人民解放军大事典》出版,1992-08-02,1992-08
华北和西北东部近日多雨,1992-08-02,1992-08
警惕一些采购员高价买次品,1992-08-02,1992-08
淄博形成一体化经济网络,1992-08-02,1992-08
上海组建第一家中外合资银行,1992-08-02,1992-08
曹雪芹究竟生在哪里？葬于何方？,1992-08-02,1992-08
卡拉ＯＫ地摊,1992-08-02,1992-08
外事简讯,1992-08-02,1992-08
各地军民热烈庆祝建军节,1992-08-02,1992-08
驻华北部队大力支援地方建设,1992-08-02,1992-08
北空后勤部努力为发展经济做贡献,1992-08-02,1992-08
海军南航部队支援特区建设,1992-08-02,1992-08
西安围绕经济工作开展双拥,1992-08-02,1992-08
总后某油库热情为用户服务,1992-08-02,1992-08
武警部队慰问团赴延安慰问,1992-08-02,1992-08
中组部召开全国老干部工作经验交流会,1992-08-02,1992-08
苏北３市整顿农村后进党支部见成效,1992-08-02,1992-08
通辽加强农村党支部建设,1992-08-02,1992-08
李书记招工,1992-08-02,1992-08
鞍山市公安局从严治警,1992-08-02,1992-08
中央乐团慰问子弟兵,1992-08-02,1992-08
《八一军旗红》出版,1992-08-02,1992-08
中国妇女报写真征文评选揭晓,1992-08-02,1992-08
北京举办少数民族棋类比赛,1992-08-02,1992-08
“雪普乐”进京拥军,1992-08-02,1992-08
某师开展军人与纪律专题教育,1992-08-02,1992-08
武警山西总队为大中型企业服务,1992-08-02,1992-08
湖北省军区计生工作成绩显著,1992-08-02,1992-08
淄博中级法院发挥转业干部作用,1992-08-02,1992-08
不松动的螺丝钉,1992-08-02,1992-08
田径场金牌大户初分帐,1992-08-02,1992-08
风光此日好泳坛说沉浮,1992-08-02,1992-08
百舸争流在毫厘,1992-08-02,1992-08
李铁映电贺中国游泳选手,1992-08-02,1992-08
任是小草也动人,1992-08-02,1992-08
弱项更需强者,1992-08-02,1992-08
奥运金牌榜,1992-08-02,1992-08
乒乓激战渐入高潮,1992-08-02,1992-08
冲刺不失君子风,1992-08-02,1992-08
独占体操一时春,1992-08-02,1992-08
诸强金牌战大势趋明朗,1992-08-02,1992-08
徐亨对大陆选手佳绩表示高兴,1992-08-02,1992-08
冠军成绩,1992-08-02,1992-08
失奖牌慈父慰爱子,1992-08-02,1992-08
知教训教头论得失,1992-08-02,1992-08
东方飞鱼,1992-08-02,1992-08
功德永世风范长存,1992-08-02,1992-08
邓大姐风范永留人间,1992-08-02,1992-08
基总统和议长分别会见彭冲,1992-08-02,1992-08
特多总理会见我政府代表团,1992-08-02,1992-08
友好往来,1992-08-02,1992-08
阿以双边谈判将在华盛顿举行,1992-08-02,1992-08
中非１１国达成互不侵犯条约,1992-08-02,1992-08
万斯特使结束访问南非,1992-08-02,1992-08
美将派部队赴科演习,1992-08-02,1992-08
俄外长谈叶利钦访日问题,1992-08-02,1992-08
决定成立中立军事观察团,1992-08-02,1992-08
摩总统要求联合国派观察团,1992-08-02,1992-08
科伦博出任意大利外长,1992-08-02,1992-08
欧共体就瑞典申请通过意见书,1992-08-02,1992-08
昂纳克夫人抵智利,1992-08-02,1992-08
哥国会辩论美机搜捕毒枭行动,1992-08-02,1992-08
泰总理对军队高层领导作重大调整,1992-08-02,1992-08
德国向境外派兵再次引起争论,1992-08-02,1992-08
南克签署释放战俘协议,1992-08-02,1992-08
俄土签署友好合作条约,1992-08-02,1992-08
泰航客机在尼泊尔坠毁,1992-08-02,1992-08
桑给巴尔内阁改组,1992-08-02,1992-08
加强合作的又一步骤,1992-08-02,1992-08
委哥经济一体化稳步发展,1992-08-02,1992-08
日美再次商讨经济结构问题,1992-08-02,1992-08
美国经济将继续不景气,1992-08-02,1992-08
简讯,1992-08-02,1992-08
欧共体第三产业地位上升,1992-08-02,1992-08
我汽车采购团访问华盛顿,1992-08-02,1992-08
欧共体向中国提供  五百多万美元援助,1992-08-02,1992-08
法国一再反驳悲观预测,1992-08-02,1992-08
历届国际奥委会主席,1992-08-02,1992-08
商品房价是如何确定的,1992-08-02,1992-08
高科技为野生动物保驾,1992-08-02,1992-08
新加坡风行教育保险,1992-08-02,1992-08
中国历史上有几位围棋棋圣,1992-08-02,1992-08
从造字看森林,1992-08-02,1992-08
防止衰老的新见解,1992-08-02,1992-08
送花的含义,1992-08-02,1992-08
计算机家族的新成员,1992-08-02,1992-08
京剧行当趣谈,1992-08-02,1992-08
一次性商品,1992-08-02,1992-08
南昌起义,1992-08-02,1992-08
北京地区天气预报,1992-08-03,1992-08
李小双获男子自由体操金牌,1992-08-03,1992-08
与国际先进水平接轨,1992-08-03,1992-08
外商投资发展势头猛,1992-08-03,1992-08
沂蒙山区崛起一座“批发城”,1992-08-03,1992-08
顺德国营企业虎虎有生气,1992-08-03,1992-08
武汉住宅合作社发展迅速,1992-08-03,1992-08
全国煤炭市场加速发育,1992-08-03,1992-08
要正确宣传党的政策,1992-08-03,1992-08
我核测井技术获重大突破,1992-08-03,1992-08
一种新型汽车节油器推广,1992-08-03,1992-08
牟平县安装住宅电话逾千部,1992-08-03,1992-08
鹰厦线漳平供电段无事故,1992-08-03,1992-08
黄石长江公路桥施工顺利,1992-08-03,1992-08
学说普通话,1992-08-03,1992-08
南京机场运行正常,1992-08-03,1992-08
摘掉“免战牌”,1992-08-03,1992-08
卓资县积极推进机构改革,1992-08-03,1992-08
我国开展卫星定位大会战,1992-08-03,1992-08
初圆“特区梦”,1992-08-03,1992-08
《二十八年间——从师政委到总书记》第三编出版,1992-08-03,1992-08
上海推出四大辞书,1992-08-03,1992-08
江西外贸新机制出效益,1992-08-03,1992-08
澳门基本法（草案）咨询工作结束,1992-08-03,1992-08
台北女一中乐仪队来京访问,1992-08-03,1992-08
台湾民众欢迎大陆中医,1992-08-03,1992-08
广州文化经济向高层次发展,1992-08-03,1992-08
黄山路边“卫生筐”,1992-08-03,1992-08
南京空难抢救纪实,1992-08-03,1992-08
“音乐晚餐”走俏哈尔滨,1992-08-03,1992-08
伟大创举辉煌成就,1992-08-03,1992-08
计算机辅助设计应用前景广阔八部委成立工程协调指导小组,1992-08-03,1992-08
全方位开发电脑排版系列,1992-08-03,1992-08
海军建立舰艇战斗力评估理论体系,1992-08-03,1992-08
《招贤册》的魅力,1992-08-03,1992-08
常州市弱智儿童教育取得成果,1992-08-03,1992-08
天津多渠道融资发行高科技债券,1992-08-03,1992-08
快中子刺激对虾生长技术前景看好,1992-08-03,1992-08
《新编文史笔记》丛书第一辑面世,1992-08-03,1992-08
教科文简讯,1992-08-03,1992-08
王文生用中药攻克癫痫,1992-08-03,1992-08
北京朝阳门医院开办临终关怀病区,1992-08-03,1992-08
《情系长城》出版,1992-08-03,1992-08
《老三届青春祭》盒式磁带推出,1992-08-03,1992-08
杠上衔金纤纤燕,1992-08-03,1992-08
田径场热门人物落马,1992-08-03,1992-08
羽毛球好手均进八强,1992-08-03,1992-08
一寸光阴一寸金,1992-08-03,1992-08
钻石王国黑钻石,1992-08-03,1992-08
克里斯蒂“老”而弥坚,1992-08-03,1992-08
半边阴雨半边睛,1992-08-03,1992-08
美国女篮问鼎势头猛  中捷姑娘争夺出线权,1992-08-03,1992-08
准星终于又准了,1992-08-03,1992-08
关于裁判的话题,1992-08-03,1992-08
举重选手萨马多夫被终身禁赛,1992-08-03,1992-08
奥运金牌榜,1992-08-03,1992-08
知耻后勇英选手决意背水一战,1992-08-03,1992-08
回天乏术服药者难回巴塞罗那,1992-08-03,1992-08
克里斯蒂的金牌举起了英国,1992-08-03,1992-08
冠军成绩,1992-08-03,1992-08
破除“内陆意识”  加快改革开放,1992-08-03,1992-08
解放思想就是换脑筋,1992-08-03,1992-08
要善于化解矛盾,1992-08-03,1992-08
致力于新时期思想政治工作理论探索,1992-08-03,1992-08
冰岛总统第４次宣誓就职,1992-08-03,1992-08
埃及维持和平部队赴波黑,1992-08-03,1992-08
摩总统下令收缴公民的武器,1992-08-03,1992-08
意大利总工会总书记辞职,1992-08-03,1992-08
卢旺达交战双方签署和解协议,1992-08-03,1992-08
美俄向阿以各方发出邀请,1992-08-03,1992-08
我人大代表团抵达斐济,1992-08-03,1992-08
要求拆除中东所有大规模毁灭性武器,1992-08-03,1992-08
美将在发生危机时重返海湾,1992-08-03,1992-08
土空军袭击库尔德游击队基地,1992-08-03,1992-08
斯洛伐克执政党主席团批准捷解体协议,1992-08-03,1992-08
迫使伊拉克接受国际决议  梅杰表示要继续保持压力,1992-08-03,1992-08
希议会正式批准“马约”,1992-08-03,1992-08
美国经济步履蹒跚原因何在,1992-08-03,1992-08
叶利钦批评日本在领土问题上施压,1992-08-03,1992-08
昔日南非入侵塞舌尔  今天赔款美元三百万,1992-08-03,1992-08
我成为向哈萨克斯坦出口商品最多的国家,1992-08-03,1992-08
欧共体委员会通过协调基金章程草案,1992-08-03,1992-08
日本研制新燃料汽车,1992-08-03,1992-08
“我们看到了中国”,1992-08-03,1992-08
阿英马岛石油之争,1992-08-03,1992-08
对日本肉食品进行放射污染检验,1992-08-03,1992-08
叶利钦力求缓解农用燃料紧张状况,1992-08-03,1992-08
世界航运业仍不景气,1992-08-03,1992-08
拉美石油储量达１２３０亿桶,1992-08-03,1992-08
阿盟将帮助土叙伊解决水资源争端,1992-08-03,1992-08
乌总理强调退出卢布区重要性,1992-08-03,1992-08
老人和井,1992-08-03,1992-08
易水源纪胜,1992-08-03,1992-08
燕子石宝砚,1992-08-03,1992-08
水清也有鱼,1992-08-03,1992-08
窗外的橡树,1992-08-03,1992-08
闲庭信步,1992-08-03,1992-08
北京地区天气预报,1992-08-04,1992-08
陈跃玲获女子１０公里竞走冠军,1992-08-04,1992-08
高敏蝉联奥运跳水冠军  邓亚萍乔红获女乒金牌,1992-08-04,1992-08
加快转换企业经营机制,1992-08-04,1992-08
吉林省直部门放权四百多项,1992-08-04,1992-08
郑州市坚决还权于企业,1992-08-04,1992-08
石家庄成为我国医药基地,1992-08-04,1992-08
唐山市对外开放出现新格局,1992-08-04,1992-08
我国歌唱家黑海涛获第一名,1992-08-04,1992-08
秦皇岛港煤码头四期工程将开工,1992-08-04,1992-08
中国西部丝绸批发市场落成,1992-08-04,1992-08
黄山又添一绝——九龙瀑,1992-08-04,1992-08
万县设三峡库区开发区,1992-08-04,1992-08
全国“园丁之家”夏令营开营,1992-08-04,1992-08
南澳被辟为广东海岛开发区,1992-08-04,1992-08
小节不小,1992-08-04,1992-08
身手不凡,1992-08-04,1992-08
暑假期间应多设报刊零售点,1992-08-04,1992-08
海南严厉整治行业不正之风,1992-08-04,1992-08
为了中华富强之路,1992-08-04,1992-08
中国输血事业总方向是无偿献血,1992-08-04,1992-08
严肃查处各类违纪案件,1992-08-04,1992-08
吴学谦会见台北女一中师生,1992-08-04,1992-08
南京空难善后工作抓紧进行,1992-08-04,1992-08
华北中部北部普遍降雨,1992-08-04,1992-08
吴学谦会见日本客人,1992-08-04,1992-08
中国检察代表团出访俄罗斯,1992-08-04,1992-08
南京空难伤员十四人基本脱险,1992-08-04,1992-08
藏族老阿妈的心愿,1992-08-04,1992-08
日本千叶县芭蕾舞团  在京首演《黄河组曲》,1992-08-04,1992-08
巴勒斯坦国新任驻华大使一席谈,1992-08-04,1992-08
香港桂林合资艺术团成立,1992-08-04,1992-08
现代硬笔书法艺术在京展出,1992-08-04,1992-08
辽宁９月举办第二届文化艺术节,1992-08-04,1992-08
《专家谈穿衣打扮的艺术》出版,1992-08-04,1992-08
青少年煤炭科技夏令营在徐州开营,1992-08-04,1992-08
青岛地下商业街开工,1992-08-04,1992-08
“霞飞”两产品受欢迎,1992-08-04,1992-08
中华学习机又添新成员,1992-08-04,1992-08
三笑牌磁性牙刷获专利,1992-08-04,1992-08
便携式康复器设计独到,1992-08-04,1992-08
一种新型石膏板问世,1992-08-04,1992-08
青岛空调器厂重视质量,1992-08-04,1992-08
北京航天石化技术  装备工程公司成立,1992-08-04,1992-08
方向对路子好,1992-08-04,1992-08
涿州改造企业借船出海  新沂加快对外开放步伐,1992-08-04,1992-08
服务跟着农民走唐海稻农不犯愁,1992-08-04,1992-08
联想集团上半年出口  微机板卡五十五万块,1992-08-04,1992-08
从容一跃群星黯,1992-08-04,1992-08
顶风再迎高处寒,1992-08-04,1992-08
中国女排输在哪里？,1992-08-04,1992-08
期待女排重振雄风,1992-08-04,1992-08
羽毛球单打我与冠军无缘,1992-08-04,1992-08
谢尔博胸挂６金,1992-08-04,1992-08
纳米比亚舆论欢呼获首枚奥运奖牌,1992-08-04,1992-08
保持清醒迎接挑战,1992-08-04,1992-08
一飞冲天动情多,1992-08-04,1992-08
中国选手成绩优异有助于申办奥运,1992-08-04,1992-08
奥运金牌榜,1992-08-04,1992-08
成果和水果,1992-08-04,1992-08
测速系统万无一失,1992-08-04,1992-08
队友变对手,1992-08-04,1992-08
冠军成绩,1992-08-04,1992-08
田径比赛不见高潮  冠军成绩令人失望,1992-08-04,1992-08
张燮林的忧患意识,1992-08-04,1992-08
制售假冒伪劣商品可能构成哪些犯罪？,1992-08-04,1992-08
个体医疗点“五假”现象严重,1992-08-04,1992-08
魏文涛救同学英勇献身  钓鱼人扣遗体卑鄙无耻,1992-08-04,1992-08
依法保护税务人员的安全,1992-08-04,1992-08
暴力抗税析,1992-08-04,1992-08
重视新闻出版物的质量,1992-08-04,1992-08
寄信人要写清详细地址,1992-08-04,1992-08
邮递员应避免一字之差,1992-08-04,1992-08
三番两查一堂课,1992-08-04,1992-08
要多生产广普高效农药,1992-08-04,1992-08
卧——祸,1992-08-04,1992-08
美科两国举行联合军事演习,1992-08-04,1992-08
建议成立巴尔干国家经济联盟,1992-08-04,1992-08
苏哈托总统会见陈慕华,1992-08-04,1992-08
要求日本放弃海运钚计划,1992-08-04,1992-08
保两万人在布兹卢贾峰顶举行大会,1992-08-04,1992-08
非国大等组织举行大规模示威活动,1992-08-04,1992-08
叙利亚友谊行,1992-08-04,1992-08
将按苏日宣言解决北方领土问题,1992-08-04,1992-08
抗议强行驱逐昂纳克,1992-08-04,1992-08
黑海舰队将成为两国联合舰队,1992-08-04,1992-08
中泰民柬三方会晤,1992-08-04,1992-08
以决定参加下轮双边会谈,1992-08-04,1992-08
波兰议会通过“小宪法”,1992-08-04,1992-08
多国部队加紧检查驶往约旦商船,1992-08-04,1992-08
摩尔多瓦局势趋于平静,1992-08-04,1992-08
纳─卡冲突再度升级,1992-08-04,1992-08
黎外长呼吁以军撤出黎南部,1992-08-04,1992-08
克举行独立后第一次大选,1992-08-04,1992-08
南斯拉夫马其顿将相互承认,1992-08-04,1992-08
伊朗否认向苏丹派遣军队,1992-08-04,1992-08
美航天飞机释放卫星未入轨道,1992-08-04,1992-08
水资源危机缓解,1992-08-04,1992-08
我产品在国际博览会上受欢迎,1992-08-04,1992-08
投资科研就是投资新产品,1992-08-04,1992-08
赞扬中国经济建设成就,1992-08-04,1992-08
消除贫困缩小南北差距,1992-08-04,1992-08
中国民族舞蹈饮誉美国,1992-08-04,1992-08
“七姐妹”推行“边疆战略”,1992-08-04,1992-08
墨美加再次举行谈判,1992-08-04,1992-08
“二郎”的“神牛”梦,1992-08-04,1992-08
从“难得糊涂”说到质量万里行,1992-08-04,1992-08
竹海一瞥,1992-08-04,1992-08
艺文短波,1992-08-04,1992-08
黄河飘带上的黑宝石,1992-08-04,1992-08
唤起人们树立雄心,1992-08-04,1992-08
竹石,1992-08-04,1992-08
书法,1992-08-04,1992-08
北京地区天气预报,1992-08-05,1992-08
小将孙淑伟技冠十米跳台  吕林王涛勇夺乒乓球金牌,1992-08-05,1992-08
要切实转变政府职能,1992-08-05,1992-08
组织工作要更好为经济建设服务,1992-08-05,1992-08
国际民间艺术节中旬在京举行,1992-08-05,1992-08
共商保护儿童权利,1992-08-05,1992-08
上海近万名大学生  踊跃参加社会实践,1992-08-05,1992-08
达万明研究血液病取得成果,1992-08-05,1992-08
七条中日旅游包机航线开辟,1992-08-05,1992-08
雅砻江将建多个梯级电站,1992-08-05,1992-08
青岛房改方案正式实施,1992-08-05,1992-08
汕头早稻亩产创新纪录,1992-08-05,1992-08
情系巴塞罗那,1992-08-05,1992-08
海峡两岸关系研讨会在京开幕,1992-08-05,1992-08
用生化技术提取免疫刺激剂成功,1992-08-05,1992-08
高狄会见法国客人,1992-08-05,1992-08
香港海裕集团公司资助北京汇文中学,1992-08-05,1992-08
我国植检工作既把关又服务,1992-08-05,1992-08
《国际大市场》日前发行,1992-08-05,1992-08
《执法无情却有情》首映,1992-08-05,1992-08
报告文学集《军魂永驻》出版,1992-08-05,1992-08
草原颂全国书法美术摄影艺术大奖赛精品展开幕,1992-08-05,1992-08
新里程碑,1992-08-05,1992-08
北京出现首家“帮您中心”,1992-08-05,1992-08
王洪文病亡,1992-08-05,1992-08
上海推出深化农村改革新举措,1992-08-05,1992-08
思想政治工作要为改革开放、把我国经济搞上去的伟大战略目标服务,1992-08-05,1992-08
生产经销假冒伪劣商品有罪  最高人民法院要求严厉制裁,1992-08-05,1992-08
农行加快企业化改革进程,1992-08-05,1992-08
认真学习和贯彻全民所有制  工业企业转换经营机制条例,1992-08-05,1992-08
东亚经济与跨国公司学术会开幕,1992-08-05,1992-08
青海省人大常委会积极行使职权,1992-08-05,1992-08
追星的人,1992-08-05,1992-08
我军后备力量建设取得新成就,1992-08-05,1992-08
王锡普见义勇为立功受奖,1992-08-05,1992-08
地方人大的使命,1992-08-05,1992-08
军队测绘部门为经济建设出力,1992-08-05,1992-08
特警部队组建十年成绩卓著,1992-08-05,1992-08
乡宁农行大胆改革机构,1992-08-05,1992-08
铁路检察机关挽回损失６５０余万元,1992-08-05,1992-08
燃烧的晚霞,1992-08-05,1992-08
老台胞机场“认亲”,1992-08-05,1992-08
高台军民开展双奉献活动,1992-08-05,1992-08
新野法院为企业挽回损失３００万,1992-08-05,1992-08
石景山公安分局积极抓捕逃犯,1992-08-05,1992-08
解放军１４６医院为“三老”上门服务,1992-08-05,1992-08
石家庄市公安机关重视综合治理,1992-08-05,1992-08
云南森林警察积极查处林业案件,1992-08-05,1992-08
公安部选送变光控制器参展,1992-08-05,1992-08
走赢“跑步冠军”,1992-08-05,1992-08
吹尽狂沙始到金,1992-08-05,1992-08
跳台夺珠二小龙,1992-08-05,1992-08
田径争夺骤然升温,1992-08-05,1992-08
中国羽球缘何铩羽,1992-08-05,1992-08
虎口掏金叹未成,1992-08-05,1992-08
句号不在圆缺,1992-08-05,1992-08
