钱其琛会见卡扎菲的特使,1992-08-14,1992-08
宜昌县争建“十星”文明村,1992-08-14,1992-08
外事简讯,1992-08-14,1992-08
“妃子笑”真的笑了,1992-08-14,1992-08
刘浪走进《世界名人录》,1992-08-14,1992-08
青年发明家王洪成获五项国家专利,1992-08-14,1992-08
皖医大附院成功切除一女婴巨大肝瘤,1992-08-14,1992-08
汉港合资建设科技大厦,1992-08-14,1992-08
神农架部分景区租赁开发,1992-08-14,1992-08
广西防城将开通三条中越旅游线路,1992-08-14,1992-08
华颐公司研制成功冰箱杀菌保鲜盒,1992-08-14,1992-08
挂吊针有了自动监护器,1992-08-14,1992-08
北京街头出现长话亭,1992-08-14,1992-08
农民办大学,1992-08-14,1992-08
在结合上下功夫在服务上做文章,1992-08-14,1992-08
贫困地区的思想解放尤为迫切,1992-08-14,1992-08
再论中国的大开放,1992-08-14,1992-08
姚依林在马来西亚槟州访问,1992-08-14,1992-08
赛福鼎率人大代表团抵白俄罗斯,1992-08-14,1992-08
喀布尔郊区战斗仍在继续,1992-08-14,1992-08
联合国欧共体将主持南问题国际会议,1992-08-14,1992-08
巴解对美以达成贷款担保协议表示失望,1992-08-14,1992-08
以将在双边谈判中采取积极态度,1992-08-14,1992-08
安理会决定维持对利制裁,1992-08-14,1992-08
希土两族领导人举行直接会谈,1992-08-14,1992-08
贝克调任白宫办公厅主任,1992-08-14,1992-08
秘鲁第二军区司令易人,1992-08-14,1992-08
英国驱逐南难民,1992-08-14,1992-08
厄瓜多尔新总统会见我副外长,1992-08-14,1992-08
友好往来,1992-08-14,1992-08
捷联邦分裂可能产生严重政治经济后果,1992-08-14,1992-08
克罗地亚总统宣誓就职,1992-08-14,1992-08
黎巴嫩将于本月举行大选,1992-08-14,1992-08
卢旺达两派举行第二轮和谈,1992-08-14,1992-08
哈萨克斯坦成立协商委员会,1992-08-14,1992-08
塔吉克选出最高苏维埃主席,1992-08-14,1992-08
土阿两国签署合作协定,1992-08-14,1992-08
意增兵西西里打击黑手党,1992-08-14,1992-08
西方外汇市场继续动荡,1992-08-14,1992-08
厄瓜多尔总统发表就职演说,1992-08-14,1992-08
中国经济增长迅速,1992-08-14,1992-08
搬家记,1992-08-14,1992-08
应多吸引外资少借外债,1992-08-14,1992-08
英将拍摄撒切尔夫人专题片,1992-08-14,1992-08
证实古代中国有一条游牧丝绸之路,1992-08-14,1992-08
简明新闻,1992-08-14,1992-08
富甲岭南,1992-08-14,1992-08
艺文短波,1992-08-14,1992-08
水调歌头,1992-08-14,1992-08
痛悼邓颖超大姐,1992-08-14,1992-08
“戈壁铁骑”欢乐曲,1992-08-14,1992-08
赞井冈山,1992-08-14,1992-08
“长征”显威力“澳星”上太空,1992-08-15,1992-08
北京地区天气预报,1992-08-15,1992-08
中国国际民间艺术节在京开幕,1992-08-15,1992-08
发展民间艺术促进友谊和平,1992-08-15,1992-08
李鹏的祝词,1992-08-15,1992-08
“澳星”升空目击记,1992-08-15,1992-08
姚依林抵新加坡访问,1992-08-15,1992-08
各地要支援三峡移民安置工作,1992-08-15,1992-08
辉煌的跨越,1992-08-15,1992-08
牢固树立以经济建设为中心思想,1992-08-15,1992-08
“长征二号Ｅ”捆绑式火箭,1992-08-15,1992-08
又捧回一块大金牌,1992-08-15,1992-08
根治白发良药乌发丸问世,1992-08-15,1992-08
万载开发野生葛根系列营养食品,1992-08-15,1992-08
高效林木防啃剂在包头投产,1992-08-15,1992-08
酪龙粘合剂为皮革添光彩,1992-08-15,1992-08
固体一滴清净水剂制成,1992-08-15,1992-08
保定自来水公司由“死”变“活”,1992-08-15,1992-08
厦门采取多种形式转换企业经营机制,1992-08-15,1992-08
“商战”冲击波,1992-08-15,1992-08
东北农区畜牧业迅速崛起,1992-08-15,1992-08
明智的选择,1992-08-15,1992-08
大力发展招标事业,1992-08-15,1992-08
背靠大市好繁荣,1992-08-15,1992-08
专利第一村,1992-08-15,1992-08
西藏首次宣布一企业破产,1992-08-15,1992-08
通信设施应纳入城建规划,1992-08-15,1992-08
工商银行支持第三产业加速发展,1992-08-15,1992-08
丹江口人行聘请利率监督员,1992-08-15,1992-08
国旅美食购物中心在京开业,1992-08-15,1992-08
大连开办渔业船舶买卖保险,1992-08-15,1992-08
云南森林防火成效显著,1992-08-15,1992-08
防患于未然,1992-08-15,1992-08
热血铸辉煌,1992-08-15,1992-08
中年作家王蓬近年又推出５部新作,1992-08-15,1992-08
面向经济建设加快改革步伐,1992-08-15,1992-08
乡医治大病,1992-08-15,1992-08
白血病分化生物学研究取得国际一流理论成果,1992-08-15,1992-08
中国体育发展速度快下世纪将成奥运主角,1992-08-15,1992-08
中国女排痛定思痛总结教训,1992-08-15,1992-08
中国跳水队庆功授奖,1992-08-15,1992-08
亚洲青年手球赛月内在京举行,1992-08-15,1992-08
先达集团首创激光全息条码技术,1992-08-15,1992-08
首都出现免费露天卡拉ＯＫ,1992-08-15,1992-08
杭州街头多画廊  中外游人齐赞赏,1992-08-15,1992-08
新一代胃药奥美拉唑研制成,1992-08-15,1992-08
王应太等首报２５种人类染色体核型,1992-08-15,1992-08
仿制紫禁城中“金銮宝座”,1992-08-15,1992-08
福建抓紧落实对外开放的政策措施,1992-08-15,1992-08
牡丹江铁路分局广辟就业门路,1992-08-15,1992-08
记者标兵的心扉,1992-08-15,1992-08
国家加拨专款资助数学研究,1992-08-15,1992-08
宝中铁路堡子梁隧道贯通,1992-08-15,1992-08
“汉语水平考试”逐步走向世界,1992-08-15,1992-08
就联合国有关南的决议  外交部发言人答记者问,1992-08-15,1992-08
宋德敏会见广东省政协  港澳地区委员访问团,1992-08-15,1992-08
颐和园库藏珍品首次公展,1992-08-15,1992-08
外事简讯,1992-08-15,1992-08
京郊直升机事故善后工作正抓紧进行,1992-08-15,1992-08
沙棘油抗癌治癌有良效,1992-08-15,1992-08
宋岩峰采用生物技术成功治疗晚期卵巢癌,1992-08-15,1992-08
提供家电安装服务,1992-08-15,1992-08
违禁虚假广告是怎么出笼的,1992-08-15,1992-08
保险公司对大中型企业有何优惠政策？,1992-08-15,1992-08
确保旅客安全,1992-08-15,1992-08
不准用“消字灵”搞鬼,1992-08-15,1992-08
上海妹子与苏北大哥,1992-08-15,1992-08
禁止在常德机场上放牧,1992-08-15,1992-08
建造新式卫生厕所,1992-08-15,1992-08
设立乡镇劳务市场,1992-08-15,1992-08
确保出租餐具洁净,1992-08-15,1992-08
“活鱼”肆扰,1992-08-15,1992-08
中新各领域合作将继续发展,1992-08-15,1992-08
中国不同意安理会授权用武,1992-08-15,1992-08
授权用武确保向波黑运送救济物资,1992-08-15,1992-08
祝贺你，中国,1992-08-15,1992-08
采用能为各方接受的解决方法,1992-08-15,1992-08
南非政府原则接受联合国秘书长建议,1992-08-15,1992-08
南总理在萨拉热窝遭袭击,1992-08-15,1992-08
白俄罗斯领导人会见赛福鼎·艾则孜,1992-08-15,1992-08
墨西哥希望扩大与中国友好关系,1992-08-15,1992-08
贝克为何调任,1992-08-15,1992-08
南非黑人又遭屠杀,1992-08-15,1992-08
阿地方政权选举揭晓,1992-08-15,1992-08
南土两国总理会谈,1992-08-15,1992-08
泰合艾车站发生爆炸,1992-08-15,1992-08
快餐业在西方日趋兴旺,1992-08-15,1992-08
步行爬山滑雪,1992-08-15,1992-08
新兴学科——分子考古学,1992-08-15,1992-08
为老人设“笑节”,1992-08-15,1992-08
老挝散记,1992-08-15,1992-08
节能在丹麦,1992-08-15,1992-08
辉煌的太阳金字塔,1992-08-15,1992-08
非洲人的发型艺术,1992-08-15,1992-08
争奇斗艳绚丽多采,1992-08-15,1992-08
向主持人进一言,1992-08-15,1992-08
走马上任的胡咏言,1992-08-15,1992-08
“延水情”溯黄河之源,1992-08-15,1992-08
这一片神奇的土地,1992-08-15,1992-08
行进在春天里,1992-08-15,1992-08
痴迷的歌剧之星,1992-08-15,1992-08
魏喜奎访台归来汇报演出,1992-08-15,1992-08
烹饪界的“九头鸟”,1992-08-15,1992-08
锦绣江南的历史画卷,1992-08-15,1992-08
北京地区天气预报,1992-08-16,1992-08
作好准备出色发射第二颗澳星,1992-08-16,1992-08
我商业发射服务能力增强,1992-08-16,1992-08
校园外的世界很精彩,1992-08-16,1992-08
新疆三大盆地油气勘探成果可喜  今明两年原油产量将大幅度增长,1992-08-16,1992-08
港澳同胞盛赞祖国航天事业,1992-08-16,1992-08
钢铁工业效益回升较快,1992-08-16,1992-08
文化部提出十点改革意见,1992-08-16,1992-08
黄金辉吴作栋李光耀会见姚依林,1992-08-16,1992-08
上海市民跨江东迁,1992-08-16,1992-08
内蒙古经贸交易会开幕,1992-08-16,1992-08
中信下属两家公司  发行亿元住宅债券,1992-08-16,1992-08
一种农药换代产品被推广,1992-08-16,1992-08
阿尔山新发现大型矿泉群,1992-08-16,1992-08
台湾北部干旱严重,1992-08-16,1992-08
山东肉牛出栏全国居首,1992-08-16,1992-08
遵义市建成一座大电厂,1992-08-16,1992-08
多登“现场短新闻”,1992-08-16,1992-08
祝贺莫桑比克各方签署联合声明,1992-08-16,1992-08
保险公司支付巨额空难赔款,1992-08-16,1992-08
全国农村百强县博览会将在京举行,1992-08-16,1992-08
山亭的“高标准”与跳跃式,1992-08-16,1992-08
新型分体挂壁遥控房间空调器通过鉴定,1992-08-16,1992-08
宏基电脑举办产品巡回展示,1992-08-16,1992-08
电加热冻油融化效果好,1992-08-16,1992-08
临潼石榴节九月举行,1992-08-16,1992-08
首家商标广告语言研究中心成立,1992-08-16,1992-08
丹阳凯利来推出被服新品,1992-08-16,1992-08
美籍华人陈忠进来华讲股份制,1992-08-16,1992-08
惠安正大鞋畅销国际市场,1992-08-16,1992-08
华西建江苏最大线材厂,1992-08-16,1992-08
锦西努力发展集贸市场,1992-08-16,1992-08
“剩余收益制”研讨会在京举行,1992-08-16,1992-08
三任市长抓市场,1992-08-16,1992-08
武安千余庭院学校促经济发展  黄冈地区调整农业结构见成效,1992-08-16,1992-08
山西保守封闭形象在改观  甘肃联合有色公司同发展,1992-08-16,1992-08
“市场工程”与“市长工程”,1992-08-16,1992-08
天津三资企业效益大增  广西动员城市力量支农,1992-08-16,1992-08
白银针布厂利用情报网络促企业发展,1992-08-16,1992-08
插上腾飞的翅膀,1992-08-16,1992-08
今日退还集资款,1992-08-16,1992-08
总结人民民主专政历史经验的重要文献,1992-08-16,1992-08
锦州公安局为经济建设出力,1992-08-16,1992-08
唐山民兵在大中型企业建功立业,1992-08-16,1992-08
许德华被授予荣誉称号大会在京举行,1992-08-16,1992-08
通铁公安处热情为牧民办好事,1992-08-16,1992-08
张家口法院开展走村访户活动,1992-08-16,1992-08
南京军区两级法院抓好普法教育,1992-08-16,1992-08
辽宁为子弟兵修建电视接收站,1992-08-16,1992-08
宝鸡三百余名转业军人立新功,1992-08-16,1992-08
姜振东为军营义务演出二百场,1992-08-16,1992-08
海军某试验基地支援经济建设,1992-08-16,1992-08
某汽车团积极援建地方工程,1992-08-16,1992-08
中国联航安全飞行六年,1992-08-16,1992-08
黄帝陵整修在即,1992-08-16,1992-08
全国检察机关宣传工作会议在京结束,1992-08-16,1992-08
千余农民送锦旗,1992-08-16,1992-08
钱其琛会见美国客人,1992-08-16,1992-08
吴学谦会见旅美知名华人访问团,1992-08-16,1992-08
外事简讯,1992-08-16,1992-08
北京电视台《北京您早》节目受欢迎,1992-08-16,1992-08
全国友好城市秋季商品交易会将在乐山举行,1992-08-16,1992-08
台湾歌星齐秦将在大陆巡回义演,1992-08-16,1992-08
大型法制教育片《赌祸》发行,1992-08-16,1992-08
国际满学研讨会在京召开,1992-08-16,1992-08
中国乒乓球队接受“集体荣誉奖”,1992-08-16,1992-08
“大力神杯”奥运大奖竞猜抽奖仪式在京举行,1992-08-16,1992-08
奥运金牌得主签名纪念封将发行,1992-08-16,1992-08
漳州支持中国女排重振雄风,1992-08-16,1992-08
进一步改善首都环境质量  为申办奥运会创造好条件,1992-08-16,1992-08
寓爱于严,1992-08-16,1992-08
首都举办大型晚会欢迎奥运健儿,1992-08-16,1992-08
功高日月辉映神州,1992-08-16,1992-08
敬爱的邓大姐，您永远活在全国青少年心中,1992-08-16,1992-08
确保在前南的联合国部队安全,1992-08-16,1992-08
塞希土领导人结束会谈,1992-08-16,1992-08
阿临时总理结束访伊,1992-08-16,1992-08
齐塞克迪当选扎总理,1992-08-16,1992-08
昂纳克确实患有肝癌,1992-08-16,1992-08
安理会决议在前南斯拉夫引起不同反应,1992-08-16,1992-08
欧共体南和会未取得实质进展,1992-08-16,1992-08
讨论针对前南局势的应急计划,1992-08-16,1992-08
波黑危机的国际调解,1992-08-16,1992-08
美航空母舰驶入亚得里亚海,1992-08-16,1992-08
日本要牢记第二次世界大战教训,1992-08-16,1992-08
格军向人质劫持者动武,1992-08-16,1992-08
纳—卡宣布实行战争状态,1992-08-16,1992-08
中国是维护和平促进发展的重要力量,1992-08-16,1992-08
美将在南朝鲜部署“爱国者”导弹,1992-08-16,1992-08
以批准巴勒斯坦报纸出版,1992-08-16,1992-08
黎基督教抵制议会选举,1992-08-16,1992-08
英利两国官员会晤,1992-08-16,1992-08
东亚经济发展迅速,1992-08-16,1992-08
日本普遍担忧拉美喜忧参半,1992-08-16,1992-08
墨西哥与北美自由贸易协定,1992-08-16,1992-08
征稿启事,1992-08-16,1992-08
全国共同努力加快发展步伐,1992-08-16,1992-08
简讯,1992-08-16,1992-08
美经济复苏缓慢,1992-08-16,1992-08
申办奥运会各路有绝招,1992-08-16,1992-08
体育运动的纪录有终极吗？,1992-08-16,1992-08
消费科技新趋势,1992-08-16,1992-08
开发区与特区有何区别,1992-08-16,1992-08
常见古书的合称,1992-08-16,1992-08
蝴蝶为航天事业立功,1992-08-16,1992-08
今日长江几多桥,1992-08-16,1992-08
京剧脸谱摭谈,1992-08-16,1992-08
国外豆腐新花样,1992-08-16,1992-08
喝水的学问,1992-08-16,1992-08
吴承恩为何将孙悟空封为“弼马温”,1992-08-16,1992-08
党中央国务院举行盛大招待会,1992-08-17,1992-08
海南人不出海峡收发全国货,1992-08-17,1992-08
云南放宽出入边境限制,1992-08-17,1992-08
节能霓虹灯系列在京推出,1992-08-17,1992-08
“世界广场”大厦预售办公室,1992-08-17,1992-08
一艘破冰作业船在沪下水,1992-08-17,1992-08
北京地区天气预报,1992-08-17,1992-08
抓住有利时机加快改革开放,1992-08-17,1992-08
江泽民同志的讲话,1992-08-17,1992-08
热烈祝贺“澳星”发射成功,1992-08-17,1992-08
我国民经济高速增长,1992-08-17,1992-08
要深入开展反盗窃斗争  搞好社会治安综合治理,1992-08-17,1992-08
“神秘”的大兴宾馆,1992-08-17,1992-08
湖南干部群众奋力抗旱  提前完成晚稻抢插任务,1992-08-17,1992-08
低噪音调速电机问世,1992-08-17,1992-08
玉柴在宽松环境中拓展,1992-08-17,1992-08
荆门五万农民做买卖搞服务  资溪农民看准“缺门”办三产,1992-08-17,1992-08
东北华北六省区市实现减亏,1992-08-17,1992-08
生猪定点屠宰市民放心吃肉,1992-08-17,1992-08
向商业企业联合贷款,1992-08-17,1992-08
烟草行业限产压库促销见成效,1992-08-17,1992-08
首家房地产中介机构成立,1992-08-17,1992-08
“得民心者得市场”,1992-08-17,1992-08
我国已批准建立上百处森林公园,1992-08-17,1992-08
建水县以旅游促经济发展,1992-08-17,1992-08
大企业对外开放成果展将在深举办,1992-08-17,1992-08
新型燃料合成液化气投放市场,1992-08-17,1992-08
首届齐齐哈尔观鹤节闭幕,1992-08-17,1992-08
北京恒美广告有限公司正式开业,1992-08-17,1992-08
无锡家用电器有限公司“热”中求优,1992-08-17,1992-08
中房总公司注重人才培训,1992-08-17,1992-08
洛阳东都商厦淡季生意不淡,1992-08-17,1992-08
湖南省林工商企业集团公司成立,1992-08-17,1992-08
邢台煤矿连续七年实现高产高效,1992-08-17,1992-08
林区废杂木料加工技术变废为宝,1992-08-17,1992-08
浦东创办高科技产业联合发展公司,1992-08-17,1992-08
我精细陶瓷研究达国际先进水平,1992-08-17,1992-08
六集电视片《第一生产力》摄制完成,1992-08-17,1992-08
西沙群岛建成大型雨水净化集储库,1992-08-17,1992-08
微机管理工程概预算通用软件通过鉴定,1992-08-17,1992-08
鲍子潮种雷竹年收入超万元  临安县推广种植五千五百亩,1992-08-17,1992-08
新型人工合成材料立方氮化硼薄膜问世,1992-08-17,1992-08
电脑诊断仪受欢迎,1992-08-17,1992-08
教科文简讯,1992-08-17,1992-08
青岛海洋大学科研成果转化快,1992-08-17,1992-08
曲阜师大涌现一批科技开发实体,1992-08-17,1992-08
强化大卫生观念提高军队健康水平,1992-08-17,1992-08
山东工大从生产实践中寻找课题,1992-08-17,1992-08
福建成立留学回国人员工作站,1992-08-17,1992-08
小厂敢攻高精尖,1992-08-17,1992-08
世界杯羽毛球赛将在广州举行,1992-08-17,1992-08
孔雀还巢记,1992-08-17,1992-08
严禁检察机关越权办案,1992-08-17,1992-08
北京“的士”主动找客说明什么？,1992-08-17,1992-08
“洋人”求职在北京,1992-08-17,1992-08
湖南纪念李烛尘诞辰一百一十周年,1992-08-17,1992-08
秦皇岛港开展北煤南运大会战,1992-08-17,1992-08
炎黄阪泉古战场在京郊延庆境内,1992-08-17,1992-08
孙柏秋一行离京赴台访问,1992-08-17,1992-08
田径协会为健儿庆功,1992-08-17,1992-08
俞斌张文东将以快棋定归属,1992-08-17,1992-08
中信公司为奥运健儿授奖,1992-08-17,1992-08
“健力宝”重奖奥运健儿,1992-08-17,1992-08
卡斯特罗鼓励古巴运动员,1992-08-17,1992-08
要求体育界总结整顿,1992-08-17,1992-08
三比一战胜北京队,1992-08-17,1992-08
坚持独立自主的和平外交政策,1992-08-17,1992-08
系列文章索引,1992-08-17,1992-08
在中国办各项事业大有可为,1992-08-17,1992-08
喀布尔战事趋缓,1992-08-17,1992-08
朝第三次“泛民族大会”在板门店举行,1992-08-17,1992-08
中新经贸合作进展顺利前景光明,1992-08-17,1992-08
继续发展同中国友好关系,1992-08-17,1992-08
古巴外长会见我副外长,1992-08-17,1992-08
我副外长与新加坡外交秘书会谈,1992-08-17,1992-08
肯执政党总书记批驳此种挑衅行为,1992-08-17,1992-08
波黑塞克两族达成停火协议,1992-08-17,1992-08
此举将会导致阿以会谈推迟,1992-08-17,1992-08
国际组织向索紧急运送食品  埃塞俄比亚８００万人面临饥饿,1992-08-17,1992-08
南克交换千余名战俘,1992-08-17,1992-08
萨军解散一快速反应营,1992-08-17,1992-08
中美洲国家外长举行会议,1992-08-17,1992-08
莫总统呼吁反对派停火,1992-08-17,1992-08
南政府决定承认斯洛文尼亚,1992-08-17,1992-08
中国旅美科技协会（美东）正式成立,1992-08-17,1992-08
为上海地铁制造车辆  德举行首批交货仪式,1992-08-17,1992-08
泰国引进外资措施及成就,1992-08-17,1992-08
全英中国学生学者联谊会举行年会,1992-08-17,1992-08
古巴为巴西受放射影响者治疗,1992-08-17,1992-08
简讯,1992-08-17,1992-08
加拿大“绿色工业”方兴未艾,1992-08-17,1992-08
英国银行电脑系统出故障,1992-08-17,1992-08
验血法检查胎儿唐氏综合证,1992-08-17,1992-08
珠江不是一条江,1992-08-17,1992-08
艺文短波,1992-08-17,1992-08
不灭的火光,1992-08-17,1992-08
洒满山丹花的小路,1992-08-17,1992-08
温泉断想,1992-08-17,1992-08
漓江雨后,1992-08-17,1992-08
武清“两区”建设加速进行,1992-08-18,1992-08
海拉尔垦区大力推进开放,1992-08-18,1992-08
赣南老区引进外资大增,1992-08-18,1992-08
全国清理三角债工作基本完成,1992-08-18,1992-08
中国农村比过去大大开放了,1992-08-18,1992-08
姚依林副总理回到北京,1992-08-18,1992-08
１９９０年版人民币将发行,1992-08-18,1992-08
烟草行业税利大幅上升  比去年同期增长近三成,1992-08-18,1992-08
乔石考察大连经济技术开发区,1992-08-18,1992-08
中国人民银行负责人答记者问,1992-08-18,1992-08
黄河第一号洪峰通过花园口,1992-08-18,1992-08
诱人的新疆特种旅游,1992-08-18,1992-08
舟山建商用石油转运基地,1992-08-18,1992-08
东航增加华东至香港航班,1992-08-18,1992-08
可拆迁立交桥技术问世,1992-08-18,1992-08
家长的眼睛,1992-08-18,1992-08
北京地区天气预报,1992-08-18,1992-08
玻璃钢船艇成为抢手货,1992-08-18,1992-08
石狮开发公司推出新品,1992-08-18,1992-08
铁路用合成橡胶闸瓦投产,1992-08-18,1992-08
益阳将举办武汉经协区商交会,1992-08-18,1992-08
山东工程机械集团总公司成立,1992-08-18,1992-08
房县建成黑木耳商品出口基地,1992-08-18,1992-08
企业股份化改造讲习班在京举行,1992-08-18,1992-08
白河建起五大营林生产基地,1992-08-18,1992-08
从贫困走向富饶,1992-08-18,1992-08
邢台市解决潜亏取得成效,1992-08-18,1992-08
不要逼乡镇企业做蠢事,1992-08-18,1992-08
不能凌虚上台阶,1992-08-18,1992-08
武义县供电局以改革促服务,1992-08-18,1992-08
结合实际贯彻《条例》稳定完善承包,1992-08-18,1992-08
北京中行支持外商投资企业见效,1992-08-18,1992-08
常德市保险公司频推新险种,1992-08-18,1992-08
棉农给供销社打白条,1992-08-18,1992-08
十堰建行拓展房地产金融业务,1992-08-18,1992-08
工行桥西办事处鼎力扶持三产,1992-08-18,1992-08
沸腾的大亚湾,1992-08-18,1992-08
双导盘热轧穿孔机组投产,1992-08-18,1992-08
淮北矿务局重视拥军优属工作,1992-08-18,1992-08
南海县开展创建“文明村、户”活动,1992-08-18,1992-08
企业越发展党建越加强,1992-08-18,1992-08
公安工作要大胆探索新路子,1992-08-18,1992-08
双拥工作要适应改革开放新形势,1992-08-18,1992-08
和平友爱的“小天使”,1992-08-18,1992-08
通信兵举办书画摄影展,1992-08-18,1992-08
港澳台法律事务中心在京成立,1992-08-18,1992-08
驻担杆岛官兵为港澳流动渔民服务,1992-08-18,1992-08
邯郸检察机关严查贿赂犯罪,1992-08-18,1992-08
枣庄山亭区统战工作为经济服务,1992-08-18,1992-08
解放军兽医大为发展畜牧业作贡献,1992-08-18,1992-08
二炮某旅党委坚持自学理论,1992-08-18,1992-08
３０９医院用新科技为兵服务,1992-08-18,1992-08
欧海洋救人拒酬金,1992-08-18,1992-08
卫士忠魂,1992-08-18,1992-08
《十二木卡姆》得到系统挖掘整理,1992-08-18,1992-08
魏金水同志逝世,1992-08-18,1992-08
市场“姻缘”,1992-08-18,1992-08
中国旅游服装服饰大赛将举行,1992-08-18,1992-08
桂林古代傩戏又有新发现,1992-08-18,1992-08
《共和国重点工程建设青年功臣》出版,1992-08-18,1992-08
我奥运健儿接受各界奖励,1992-08-18,1992-08
男子三千米跑世界纪录被刷新,1992-08-18,1992-08
简讯,1992-08-18,1992-08
好莱坞冰上舞蹈艺术团来京表演,1992-08-18,1992-08
马拉多纳风波又起,1992-08-18,1992-08
中央军委三总部欢迎我军奥运健儿,1992-08-18,1992-08
国际民间艺术节北京演出结束,1992-08-18,1992-08
联合国在沪举行裁军和安全问题研讨会,1992-08-18,1992-08
华工激光全息防伪技术达国际先进水平,1992-08-18,1992-08
中科院创合成金刚石微晶新法,1992-08-18,1992-08
西安石油学院研制出新型处理机,1992-08-18,1992-08
高二学生何斯迈被中科大破格录取,1992-08-18,1992-08
胸怀如海意志如钢,1992-08-18,1992-08
缅怀李先念同志在外交上的光辉业绩,1992-08-18,1992-08
人民邮电的创业者,1992-08-18,1992-08
巴西各地发生游行示威,1992-08-18,1992-08
卢旺达和谈陷于停顿,1992-08-18,1992-08
中国宏伟空间计划发展的里程碑,1992-08-18,1992-08
我赴柬军事观察员到位,1992-08-18,1992-08
美国的做法是危险的,1992-08-18,1992-08
把希克马蒂亚尔开除出领导委员会,1992-08-18,1992-08
姚依林会见我驻新使馆人员,1992-08-18,1992-08
学习中国人民自力更生精神,1992-08-18,1992-08
叙对美同意向以提供贷款表示失望,1992-08-18,1992-08
联合国准备参加中东和谈,1992-08-18,1992-08
英国伊朗互逐人员,1992-08-18,1992-08
友好往来,1992-08-18,1992-08
美将迫使伊遵守联合国决议,1992-08-18,1992-08
英未排除向波黑派兵可能,1992-08-18,1992-08
独联体七国签署议定书,1992-08-18,1992-08
布特莱齐呼吁曼德拉共同作出努力,1992-08-18,1992-08
美众多州议员为何放弃竞选,1992-08-18,1992-08
纳—卡组成国家防御委员会,1992-08-18,1992-08
秘政府同反对派签署谅解协议,1992-08-18,1992-08
研修在日本,1992-08-18,1992-08
波兰上半年经济形势严峻,1992-08-18,1992-08
英国大学生就业难,1992-08-18,1992-08
征稿启事,1992-08-18,1992-08
哥陆军司令重申捉拿毒枭归案,1992-08-18,1992-08
削减军费影响美国经济,1992-08-18,1992-08
拉美是霍乱流行最严重地区,1992-08-18,1992-08
东北最大铁路编组站运营,1992-08-19,1992-08
宝钢实施高炉热态喷补新工艺,1992-08-19,1992-08
“双宝”健身酒获国际金奖,1992-08-19,1992-08
泰国上议院议长将访华,1992-08-19,1992-08
基里巴斯总统将访华,1992-08-19,1992-08
坦桑尼亚总统将访华,1992-08-19,1992-08
北京地区天气预报,1992-08-19,1992-08
西藏与内地省份开展经济合作,1992-08-19,1992-08
海南引进外资成片开发洋浦,1992-08-19,1992-08
宝钢三期工程建设全面铺开,1992-08-19,1992-08
交通运输系统推出深化改革措施,1992-08-19,1992-08
“狗不理”走向世界,1992-08-19,1992-08
海南开发潜力很大前景广阔,1992-08-19,1992-08
北京市试点推行国家公务员制,1992-08-19,1992-08
