中国光大（集团）总公司在京成立,1992-08-19,1992-08
乔石会见哈萨克斯坦客人,1992-08-19,1992-08
中国绝不对任何地区谋求势力范围,1992-08-19,1992-08
“取经”还是“取景”？,1992-08-19,1992-08
国家批准建九江大化肥,1992-08-19,1992-08
南京机场新候机室投入使用,1992-08-19,1992-08
广州靠房改解决特困户住房,1992-08-19,1992-08
温州公房提租基本一步到位,1992-08-19,1992-08
联想集团主动改革大胆探索  闯出高新技术产业房改新路,1992-08-19,1992-08
能改就不要等,1992-08-19,1992-08
九万里风鹏正举,1992-08-19,1992-08
将逐步放开出厂价调拨价,1992-08-19,1992-08
用质量标准考核干部见成效,1992-08-19,1992-08
成毛厂让上毛二厂全额风险承包,1992-08-19,1992-08
西安城里的“皖西粮店”,1992-08-19,1992-08
应让湖盐为青海广开财源,1992-08-19,1992-08
北京举行太空轮胎防护剂演示会,1992-08-19,1992-08
“增长乐”冲剂获国家专利,1992-08-19,1992-08
北京东华服装集团成立,1992-08-19,1992-08
歼击机飞行参数记录器研制成功,1992-08-19,1992-08
减肥食品三雅轻乐酥通过鉴定,1992-08-19,1992-08
佛山推出国际水平立体声放大器,1992-08-19,1992-08
捷达无绳电话机俏销国内外市场,1992-08-19,1992-08
国标公文排版打印软件上市,1992-08-19,1992-08
全国百家精品展销订货会将举行,1992-08-19,1992-08
《中国工商管理研究》杂志创刊,1992-08-19,1992-08
中国民航的洋“空姐”,1992-08-19,1992-08
沙漠深处安新家,1992-08-19,1992-08
“义务教育”中政府的义务,1992-08-19,1992-08
福建多渠道增加教育投入,1992-08-19,1992-08
“大学生暑假见闻”征文启事,1992-08-19,1992-08
孩子们的交易会,1992-08-19,1992-08
扎根改革的沃土,1992-08-19,1992-08
教科文简讯,1992-08-19,1992-08
茂油公司获益显著,1992-08-19,1992-08
淄博博山油泵厂靠科技兴业,1992-08-19,1992-08
渭滨星火技术密集区  建设居全国先进水平,1992-08-19,1992-08
一五一医院食管癌手术防漏技术国内领先,1992-08-19,1992-08
宣武医院神经外科治疗  颅深部肿瘤获得新进展,1992-08-19,1992-08
吉林省义务教育发展迅速而扎实,1992-08-19,1992-08
防止松懈情绪提高计划生育率,1992-08-19,1992-08
国家自然科学基金会设立  优秀中青年人才专项基金,1992-08-19,1992-08
藏族学生在湖南,1992-08-19,1992-08
国际沙滩排球赛落幕,1992-08-19,1992-08
两家企业为奥运健儿颁奖,1992-08-19,1992-08
足坛短讯,1992-08-19,1992-08
全国青少年宫棋赛结束,1992-08-19,1992-08
全国青少年射击比赛在昆明举行,1992-08-19,1992-08
宝鸡农口形成“小机构大服务”格局,1992-08-19,1992-08
兴山县努力减轻农民负担,1992-08-19,1992-08
在世界屋脊上修路架桥,1992-08-19,1992-08
国际汉语教学将有较大发展,1992-08-19,1992-08
大陆台港澳中学生同台竞赛航天知识,1992-08-19,1992-08
刘华清秦基伟分别会见巴基斯坦客人,1992-08-19,1992-08
崆山白云洞风景迷人,1992-08-19,1992-08
辽代庆州释迦佛舍利塔重现风采,1992-08-19,1992-08
联视神盾公司技术开发前景广阔,1992-08-19,1992-08
中港将在长沙合资兴建仿古汉城,1992-08-19,1992-08
苦荞麦粉给糖尿病患者带来福音,1992-08-19,1992-08
联合国开发计划署向我国提供援助,1992-08-19,1992-08
吴学谦会见台湾和平小天使访问团,1992-08-19,1992-08
澳门基本法咨委会举行第七次全体会议,1992-08-19,1992-08
维吾尔族姑娘的发式变了,1992-08-19,1992-08
号召体育战线学习奥运健儿奋斗精神,1992-08-19,1992-08
中国女队获定点跳伞亚军,1992-08-19,1992-08
关于我国企业劳动制度改革,1992-08-19,1992-08
中俄合作委员会举行首次会议,1992-08-19,1992-08
赛福鼎·艾则孜率团低乌克兰,1992-08-19,1992-08
美共和党代表大会在休斯敦举行,1992-08-19,1992-08
阿临时政府要求联合国提供帮助,1992-08-19,1992-08
南政府接受前南共和国边界为国际边界,1992-08-19,1992-08
英准备随时参加对伊空袭,1992-08-19,1992-08
莫斯科千余人聚集红场保卫列宁墓,1992-08-19,1992-08
印尼隆重纪念独立４７周年,1992-08-19,1992-08
联合国特使抵达利比亚,1992-08-19,1992-08
约旦国王赴美就医,1992-08-19,1992-08
戈氏主张建立新联盟,1992-08-19,1992-08
又一架美国战机在科坠毁,1992-08-19,1992-08
伯利兹暴力活动增多,1992-08-19,1992-08
联合国核查小组离开巴格达,1992-08-19,1992-08
昂纳克身患肝癌,1992-08-19,1992-08
南部非洲发展共同体成立,1992-08-19,1992-08
中朝签署科技合作交流议定书,1992-08-19,1992-08
日航在逆境中奋进,1992-08-19,1992-08
索马里呼吁国际社会提供紧急粮援,1992-08-19,1992-08
东京股价再次下跌,1992-08-19,1992-08
“９０年代亚太形势”研讨会综述,1992-08-19,1992-08
俄货运飞船与“和平”号轨道站对接成功,1992-08-19,1992-08
简讯,1992-08-19,1992-08
欲速可达,1992-08-19,1992-08
艺文短波,1992-08-19,1992-08
弄潮儿,1992-08-19,1992-08
老舍佚文：《龙须沟人物介绍》,1992-08-19,1992-08
思维与情感的艺术,1992-08-19,1992-08
清晖竞流,1992-08-19,1992-08
北京地区天气预报,1992-08-20,1992-08
上海出让一块土地使用权,1992-08-20,1992-08
中国外运集团正式组建,1992-08-20,1992-08
北京饭店走出国门开拓海外市场,1992-08-20,1992-08
中国投资银行拓展境外业务,1992-08-20,1992-08
合钢由亏损大户转为盈利大户,1992-08-20,1992-08
铁道部与新疆甘肃合资  修建兰新线武—乌段复线,1992-08-20,1992-08
宝钢职工参与企业管理,1992-08-20,1992-08
杉达大学报名热,1992-08-20,1992-08
热中要清醒,1992-08-20,1992-08
乌鲁木齐边贸洽谈会将举行,1992-08-20,1992-08
宋平等参观九二国际化工展,1992-08-20,1992-08
传统铁锅的“一次革命”,1992-08-20,1992-08
拥军新潮起珠江,1992-08-20,1992-08
出口商品商标  产权研究分会成立,1992-08-20,1992-08
“上海台湾城”挂牌,1992-08-20,1992-08
藏北发现大型砂金矿,1992-08-20,1992-08
首家私人综合性产业集团成立,1992-08-20,1992-08
导航与制导惯性系统测试台制成,1992-08-20,1992-08
化德县植树种草治沙化,1992-08-20,1992-08
横向相切,1992-08-20,1992-08
长江防护林工程引入竞争机制,1992-08-20,1992-08
晋城大力发展废水利用工程,1992-08-20,1992-08
淮海水泥厂技改成功超设计能力,1992-08-20,1992-08
国营施工企业创利百家大户排定座次,1992-08-20,1992-08
专业户合法权益应受到保护,1992-08-20,1992-08
’９２国际化工展览会开幕,1992-08-20,1992-08
用市场之手解“死结”,1992-08-20,1992-08
本溪将举办科技咨询招标会,1992-08-20,1992-08
丰南扩大对外经济技术合作,1992-08-20,1992-08
宁波夜市重兴盛,1992-08-20,1992-08
京鲁携手联销纺织品,1992-08-20,1992-08
农行举办分行行长新业务研修班,1992-08-20,1992-08
新型节能水泵在衢州研制成功,1992-08-20,1992-08
烟台啤酒厂喜获二枚国际金奖,1992-08-20,1992-08
鱼台机械厂开拓国际市场势头猛,1992-08-20,1992-08
特区成果博览会暨经贸交流会将开幕,1992-08-20,1992-08
北京华雄医疗电子设备有限公司成立,1992-08-20,1992-08
成都在京开办工贸公司,1992-08-20,1992-08
西单商场对职工进行计量法规教育,1992-08-20,1992-08
辽宁改革人事制度见成效,1992-08-20,1992-08
赵元甲等６人被授予全国法院模范称号,1992-08-20,1992-08
“廉政卫士”,1992-08-20,1992-08
北京拓宽法律服务领域,1992-08-20,1992-08
麻城劳动局为农村青年架致富桥,1992-08-20,1992-08
张家口离退休干部老有所为,1992-08-20,1992-08
张勇被追认为中共党员和革命烈士,1992-08-20,1992-08
总参谋部举办新经济知识系列讲座,1992-08-20,1992-08
北京铁路公安处严打刑事犯罪,1992-08-20,1992-08
武警内蒙古总队重视计划生育,1992-08-20,1992-08
武警黄金部队选送科技干部上大学,1992-08-20,1992-08
解放军９４医院支持地方计划生育,1992-08-20,1992-08
内蒙古军区为边疆作贡献,1992-08-20,1992-08
包铁分局实行干部量化考核,1992-08-20,1992-08
“铁面人”,1992-08-20,1992-08
东亚足球四强赛在即,1992-08-20,1992-08
香港修改新机场设计降低成本一点五亿港元,1992-08-20,1992-08
中国立陶宛达成互免签证协议,1992-08-20,1992-08
黑河与俄罗斯布拉戈维申斯克通邮,1992-08-20,1992-08
北京市查处滥收“高价生”,1992-08-20,1992-08
杭州公厕不凡,1992-08-20,1992-08
首都展示兴安风采,1992-08-20,1992-08
外事简讯,1992-08-20,1992-08
我羽毛球队主力争夺世界杯,1992-08-20,1992-08
简讯,1992-08-20,1992-08
悉尼争办奥运会出新招,1992-08-20,1992-08
在鲜花和掌声中也应是强者,1992-08-20,1992-08
芜湖市公开招聘３０名县级领导干部  延庆７０多名县乡干部自愿回村任职,1992-08-20,1992-08
后赶仙庄的故事,1992-08-20,1992-08
新乡市完善待业保障体系,1992-08-20,1992-08
中央乐团在困境中奋发改革,1992-08-20,1992-08
《人民论坛》征文揭晓,1992-08-20,1992-08
“老外”逛巴扎,1992-08-20,1992-08
“老外”逛巴扎,1992-08-20,1992-08
３２８国道南京至海安段采访启示录,1992-08-20,1992-08
拆除违章建筑不含糊,1992-08-20,1992-08
强制拆除,1992-08-20,1992-08
非法生产鞭炮  八名童工遇难,1992-08-20,1992-08
庄稼汉的“及时雨”,1992-08-20,1992-08
关键在领导的决心,1992-08-20,1992-08
声声叹公路,1992-08-20,1992-08
家长逼迫考高分孩子无奈离家门,1992-08-20,1992-08
强制拆除,1992-08-20,1992-08
佩雷斯说以中东政策发生变化,1992-08-20,1992-08
阿组成和平代表团调停两派冲突,1992-08-20,1992-08
泛非大与南非政府达成协议,1992-08-20,1992-08
摩尔多瓦解除紧急状态,1992-08-20,1992-08
吉尔吉斯等国发生强度较大地震,1992-08-20,1992-08
孟加拉反对派领袖梅农遭枪击,1992-08-20,1992-08
安理会批准向南非派遣观察员,1992-08-20,1992-08
菲再次否认国家警察总监被解职,1992-08-20,1992-08
应恪守尊重国家主权原则,1992-08-20,1992-08
呼吁前南各方尽快停火,1992-08-20,1992-08
中俄签署合作委员会会议纪要,1992-08-20,1992-08
科洛尔会见我代表团,1992-08-20,1992-08
匈奥表示不参与对南军事干预,1992-08-20,1992-08
冲突各派立即停止敌对行动,1992-08-20,1992-08
英机在波黑遭袭击,1992-08-20,1992-08
双方同意设法解决克什米尔问题,1992-08-20,1992-08
联合国核查小组离伊  称伊提供重要新情况,1992-08-20,1992-08
美国南朝鲜举行军事演习  朝鲜对此表示强烈谴责,1992-08-20,1992-08
巴解提出参加阿以双边会谈条件,1992-08-20,1992-08
印度经济呈复苏迹象,1992-08-20,1992-08
美国王安公司申请破产保护,1992-08-20,1992-08
纽约证券交易所掠影,1992-08-20,1992-08
美国研究和开发经费不足,1992-08-20,1992-08
意大型国有财团改为股份制公司,1992-08-20,1992-08
简明新闻,1992-08-20,1992-08
一蜂群有２０个蜂王,1992-08-20,1992-08
育成抗大麦黄矮病毒小麦,1992-08-20,1992-08
北京地区天气预报,1992-08-21,1992-08
寿光菜篮子“挎”入国际市场,1992-08-21,1992-08
民工奋战钦州港,1992-08-21,1992-08
党和政府热情关怀在外留学人员  祖国期望他们学成回国建功立业,1992-08-21,1992-08
和田葡萄“长廊”绿染沙漠,1992-08-21,1992-08
京广线开行首列重载列车,1992-08-21,1992-08
核能低温制冷试验运行成功,1992-08-21,1992-08
人事部要求做好留学人员工作,1992-08-21,1992-08
中国北京同仁堂集团公司成立,1992-08-21,1992-08
全国广告业迅猛发展,1992-08-21,1992-08
福建外汇电子化交易厅开业,1992-08-21,1992-08
昌邑县鹅肥肝年创汇数百万,1992-08-21,1992-08
康可斯航空彩印公司成立,1992-08-21,1992-08
上海拍卖沿街店面房屋,1992-08-21,1992-08
北京要更大胆利用外资,1992-08-21,1992-08
本钢冷轧厂动工兴建,1992-08-21,1992-08
鼓励科技人员下乡,1992-08-21,1992-08
社科专家度假烟台,1992-08-21,1992-08
鸟笼村,1992-08-21,1992-08
再造企业,1992-08-21,1992-08
“喝下”方能“解渴”,1992-08-21,1992-08
珠海外商服务中心当好“三婆”,1992-08-21,1992-08
国际工程咨询公司十年成就卓然,1992-08-21,1992-08
工商银行积极拓展房改金融业务,1992-08-21,1992-08
“九二中旅展”在香港开幕,1992-08-21,1992-08
“中国质量万里行”公告,1992-08-21,1992-08
温橡集团跻身国际市场,1992-08-21,1992-08
锦山机械厂成为配件“小巨人”,1992-08-21,1992-08
北京军区煤矿提供大批优质煤,1992-08-21,1992-08
烟台轮胎厂狠抓质量管理,1992-08-21,1992-08
大连生产大型溴化锂制冷机,1992-08-21,1992-08
为他写下闪光的一行,1992-08-21,1992-08
农业发展学术讨论会在京举行,1992-08-21,1992-08
张家港市经济迅猛发展,1992-08-21,1992-08
北京丹侬出租汽车公司开业,1992-08-21,1992-08
屯溪电务段实现安全生产三千天,1992-08-21,1992-08
献县生产多功能汽车语言报警装置,1992-08-21,1992-08
北京东城区成立副食品批发总公司,1992-08-21,1992-08
国家级新药酮康唑系列投产,1992-08-21,1992-08
上海股票市场一瞥,1992-08-21,1992-08
大力发动群众加强防范工作,1992-08-21,1992-08
农村民主政治建设的好形式,1992-08-21,1992-08
江西公安机关创良好治安环境,1992-08-21,1992-08
四川仪表总厂党员在改革中建功立业,1992-08-21,1992-08
济南选派优秀职工到乡镇任职,1992-08-21,1992-08
胶州市法院重视队伍建设,1992-08-21,1992-08
贵州省军区帮助群众脱贫,1992-08-21,1992-08
北京军区总医院加强医德医风建设,1992-08-21,1992-08
南疆３０万民兵帮助群众致富,1992-08-21,1992-08
宿迁２３０名机关干部充实经济战线,1992-08-21,1992-08
拥军模范石玉英向子弟兵赠送图书,1992-08-21,1992-08
唐山站公安派出所拒礼拒贿价值万元,1992-08-21,1992-08
京武青年俱乐部成为武警官兵乐园,1992-08-21,1992-08
平顶山市审判机关树立一盘棋思想,1992-08-21,1992-08
兴县县委常委实行轮流值班制度,1992-08-21,1992-08
空军一科研成果获一等奖,1992-08-21,1992-08
泗洪县企业精兵简政,1992-08-21,1992-08
黑龙江改造罪犯成绩显著,1992-08-21,1992-08
福建边防总队支援地方建设,1992-08-21,1992-08
把温暖送给群众,1992-08-21,1992-08
健牌国际台球精英赛将举行,1992-08-21,1992-08
用高科技支援地方建设,1992-08-21,1992-08
贵州省表彰扶贫开发先进集体和个人,1992-08-21,1992-08
中日妇女友好交流研讨会在京举行,1992-08-21,1992-08
亚太地区农业生物技术会议在京开幕,1992-08-21,1992-08
流落东瀛的寒山寺古画归原主,1992-08-21,1992-08
肥西优质米行销全国,1992-08-21,1992-08
荣成农民投资一千多万元发展旅游业,1992-08-21,1992-08
“桂香村”开发不含糖的月饼,1992-08-21,1992-08
西安研制成功温泉型贵妃浴带,1992-08-21,1992-08
京津塘高速公路发生重大交通事故,1992-08-21,1992-08
周南与港督彭定康首次会晤,1992-08-21,1992-08
佛山电脑收费站,1992-08-21,1992-08
张文东胜俞斌获挑战权,1992-08-21,1992-08
奥运明星在京汇报动人事迹,1992-08-21,1992-08
话说东亚四强,1992-08-21,1992-08
中国选手赛事进展顺利,1992-08-21,1992-08
美国好莱坞冰上舞蹈艺术团在京表演,1992-08-21,1992-08
台湾报名参加全国农运会,1992-08-21,1992-08
简讯,1992-08-21,1992-08
六千科技人员进军浦东,1992-08-21,1992-08
要大胆地闯,1992-08-21,1992-08
依靠工人阶级深化企业改革,1992-08-21,1992-08
以外带内以内促外加快发展,1992-08-21,1992-08
建立铁路开发基金加快铁路建设速度,1992-08-21,1992-08
扩大开放再上一个新台阶,1992-08-21,1992-08
“新时期共产党员修养有奖问答”活动圆满结束,1992-08-21,1992-08
南总理和高级将领磋商国防问题,1992-08-21,1992-08
联合国决定恢复对萨市空运,1992-08-21,1992-08
欧安会代表团访问塞尔维亚,1992-08-21,1992-08
英将出兵波黑伊拉克  伊谴责“禁飞区”计划,1992-08-21,1992-08
韩国参加联合国对伊武器调查团,1992-08-21,1992-08
法科决定加强军事合作,1992-08-21,1992-08
促进同中亚穆斯林国家关系,1992-08-21,1992-08
就恢复民选总统权力重开谈判,1992-08-21,1992-08
格鲁吉亚的人质风波,1992-08-21,1992-08
德法律专家认为不应审判患病的昂纳克,1992-08-21,1992-08
俄中关系有向纵深发展可能性,1992-08-21,1992-08
古巴关注中国建设进程,1992-08-21,1992-08
决定如期参加第６轮阿以双边会谈,1992-08-21,1992-08
以外长呼吁结束阿以对抗,1992-08-21,1992-08
友好往来,1992-08-21,1992-08
阿政府军向反对派发动进攻,1992-08-21,1992-08
增加对非洲难民的援助,1992-08-21,1992-08
南部非洲经济一体化新步伐,1992-08-21,1992-08
纽约证券交易所掠影,1992-08-21,1992-08
俄将加速私有化进程,1992-08-21,1992-08
征稿启事,1992-08-21,1992-08
新形象新战略,1992-08-21,1992-08
美国斯珀火山再次爆发,1992-08-21,1992-08
西班牙发生特大车祸,1992-08-21,1992-08
维也纳火车相撞多人死伤,1992-08-21,1992-08
行与思,1992-08-21,1992-08
不只是田园诗,1992-08-21,1992-08
艺文短波,1992-08-21,1992-08
立交桥赋,1992-08-21,1992-08
在军营大院里,1992-08-21,1992-08
太行魂,1992-08-21,1992-08
童趣,1992-08-21,1992-08
西北将办国际经济技术洽谈会,1992-08-22,1992-08
万里会见泰国上院议长,1992-08-22,1992-08
李瑞环会见新加坡报界人士,1992-08-22,1992-08
铜陵积极转换政府职能,1992-08-22,1992-08
兰州查处一起虚假广告案,1992-08-22,1992-08
我外债余额逾六百亿美元,1992-08-22,1992-08
天门７０万农民“下海”经营,1992-08-22,1992-08
北京经济技术开发区投保,1992-08-22,1992-08
褐煤干馏新技术投煤产气成功,1992-08-22,1992-08
锦纶高速弹力丝机制成,1992-08-22,1992-08
彭城电厂列入“八五”计划,1992-08-22,1992-08
“大上海国际花园”批租土地,1992-08-22,1992-08
何不“先从隗始”？,1992-08-22,1992-08
北京地区天气预报,1992-08-22,1992-08
龙头永远是高昂的,1992-08-22,1992-08
藏北牧民丰收乐,1992-08-22,1992-08
加快转换内部经营机制见成效,1992-08-22,1992-08
兰州铝厂向科技要效益,1992-08-22,1992-08
包头杭州联手参与浦东开发,1992-08-22,1992-08
让“三产”这根支柱真正立起来（编后）,1992-08-22,1992-08
发育市场深化农村改革的主线,1992-08-22,1992-08
第三产业成为煤炭工业支柱之一,1992-08-22,1992-08
发展多种经营繁荣矿区经济,1992-08-22,1992-08
中意乳品厂大肆制售伪劣产品,1992-08-22,1992-08
机电部不再公布推荐替代进口产品项目,1992-08-22,1992-08
国家发布《医疗器械广告管理办法》,1992-08-22,1992-08
农民自存粮食损失严重,1992-08-22,1992-08
三晋新时兴——“拆墙改店”,1992-08-22,1992-08
纵向放权,1992-08-22,1992-08
边城开放之后,1992-08-22,1992-08
中央电视台将直播德国足球甲级联赛,1992-08-22,1992-08
中国记者首次得到企业奖励,1992-08-22,1992-08
世界杯羽毛球赛赵剑华再战克星,1992-08-22,1992-08
简讯,1992-08-22,1992-08
世界跳伞锦标赛我国已获两项冠军,1992-08-22,1992-08
世界蹼泳锦标赛我队首日摘取三金,1992-08-22,1992-08
再说女排,1992-08-22,1992-08
老舍作品属于世界,1992-08-22,1992-08
澳门向希望工程捐款二十五万美元,1992-08-22,1992-08
《特色论》出版,1992-08-22,1992-08
牡丹电子集团赠送彩电,1992-08-22,1992-08
澳星发射成功志贺,1992-08-22,1992-08
石家庄市用足用活用好现有政策,1992-08-22,1992-08
就在外留学人员有关问题答记者问,1992-08-22,1992-08
农业部评出今年农业科技进步奖,1992-08-22,1992-08
中直机关召开精神文明建设研讨会,1992-08-22,1992-08
北京的十个世界之最,1992-08-22,1992-08
国务院任免国家工作人员,1992-08-22,1992-08
吴学谦会见刘泰英,1992-08-22,1992-08
中国宏观经济决策支持系统通过鉴定,1992-08-22,1992-08
第四届朝鲜学国际学术讨论会在京举行,1992-08-22,1992-08
二百七十四次列车特大抢劫案主犯伏法,1992-08-22,1992-08
《往来台湾实用法律指南》出版,1992-08-22,1992-08
张超音少数民族摄影作品在京展出,1992-08-22,1992-08
杨为国发明回宫格书法获专利,1992-08-22,1992-08
北京东京职工文化技术交流友好活动周开幕,1992-08-22,1992-08
海峡两岸齐文化讨论会在淄博召开,1992-08-22,1992-08
“广东蓝带作家山庄”落成,1992-08-22,1992-08
海南兴建黎、苗族风情村,1992-08-22,1992-08
上海歌星俱乐部成立,1992-08-22,1992-08
新疆繁殖成活２７匹普氏野马,1992-08-22,1992-08
黄鹤楼公园一莲五花心,1992-08-22,1992-08
外事简讯,1992-08-22,1992-08
农村新生人口登记工作须加强,1992-08-22,1992-08
重视企业的职工教育,1992-08-22,1992-08
处理处罚决定应规范化,1992-08-22,1992-08
山楂片上的玻璃渣从何来,1992-08-22,1992-08
洗衣机调查牵动万人心,1992-08-22,1992-08
一些地区人口年报数字水分大,1992-08-22,1992-08
国家统计局简介,1992-08-22,1992-08
不许拿过期食品糊弄农民,1992-08-22,1992-08
见钱“险”开,1992-08-22,1992-08
乌最高苏维埃主席会见我人大代表团,1992-08-22,1992-08
基里巴斯总统塞安纳基启程访华,1992-08-22,1992-08
阿拉伯５国外长紧急会议结束,1992-08-22,1992-08
南以统一代表团参加伦敦国际会议,1992-08-22,1992-08
埃及约旦对“禁飞区”表示关注,1992-08-22,1992-08
西哈努克呼吁国际社会援柬扫雷,1992-08-22,1992-08
秘政府与反对党对话未果,1992-08-22,1992-08
欧委会议会主席主张政治解决南危机,1992-08-22,1992-08
扭转劣势反守为攻,1992-08-22,1992-08
日黑社会头目流窜欧洲  法国当局决定拒之门外,1992-08-22,1992-08
反对把前沙皇与民族英雄并提,1992-08-22,1992-08
捷分解后两国都是继承国,1992-08-22,1992-08
阿十六名部长逃到巴基斯坦,1992-08-22,1992-08
欧“尤里卡—一号”卫星开始工作,1992-08-22,1992-08
波德联合反对贩毒偷盗,1992-08-22,1992-08
奴隶堡感怀,1992-08-22,1992-08
莱蒙湖上鸟趣图,1992-08-22,1992-08
古堡公园散记,1992-08-22,1992-08
海上观岛,1992-08-22,1992-08
米囊加宝,1992-08-22,1992-08
强者的路,1992-08-22,1992-08
太阳城访古,1992-08-22,1992-08
“五彩天地”歌“化工”之情,1992-08-22,1992-08
青艺排演日本话剧《结婚》,1992-08-22,1992-08
仇春霖与校园文化,1992-08-22,1992-08
“空中彩桥”上的明星,1992-08-22,1992-08
《我们的军械兵》,1992-08-22,1992-08
群星荟萃《今夜星光》,1992-08-22,1992-08
东北特色的歌舞晚会,1992-08-22,1992-08
《执法无情却有情》,1992-08-22,1992-08
话说“打官司”,1992-08-22,1992-08
《古船·女人和网》拍得正火,1992-08-22,1992-08
“新谣乐”和冈林信康,1992-08-22,1992-08
舞台很小，也很大,1992-08-22,1992-08
康乐,1992-08-22,1992-08
北京地区天气预报,1992-08-23,1992-08
首都举行奥运健儿报告会,1992-08-23,1992-08
扩大直属高校办学自主权  推进校内管理体制改革,1992-08-23,1992-08
沂蒙山对外开放好戏连台,1992-08-23,1992-08
“星期日市场”,1992-08-23,1992-08
丹东建边境经济合作区,1992-08-23,1992-08
铜陵营造集团公司成立,1992-08-23,1992-08
下月起停止执行批发扣税办法,1992-08-23,1992-08
李鹏会见泰国上院议长,1992-08-23,1992-08
江泽民会见印尼客人,1992-08-23,1992-08
衡水开放眼观三步棋,1992-08-23,1992-08
扬子鳄开展商业圈养,1992-08-23,1992-08
七对新型全列空调列车将调价,1992-08-23,1992-08
乔石会见印尼总检察长,1992-08-23,1992-08
我国十月发射瑞星,1992-08-23,1992-08
岂能一奖永逸,1992-08-23,1992-08
韩国外长今日来华访问,1992-08-23,1992-08
宿迁乡镇农机站兴办实体反哺农业,1992-08-23,1992-08
我玩具产品认证委员会成立,1992-08-23,1992-08
远安：１０万农民走向市场,1992-08-23,1992-08
运城：围绕流通唱大戏,1992-08-23,1992-08
广丰：２０万匹夏布出国门,1992-08-23,1992-08
兴办经济技术开发区不能一哄而起,1992-08-23,1992-08
新世界建设（集团）有限公司投资浦东,1992-08-23,1992-08
大连农民养老保险发展迅速,1992-08-23,1992-08
纯中药制剂复方降脂片投入生产,1992-08-23,1992-08
世界名牌“贝克”啤酒在福建落户,1992-08-23,1992-08
汾武铁厂建成万吨铸铁流水线,1992-08-23,1992-08
金属刷镀烘缸新技术通过鉴定,1992-08-23,1992-08
余姚农行开办代保管业务方便群众,1992-08-23,1992-08
内陆地区对外开放的几个问题,1992-08-23,1992-08
严格执行国家涉外税收法律行政法规,1992-08-23,1992-08
广东改革省级商业体制,1992-08-23,1992-08
北京城建二公司重视党支部建设,1992-08-23,1992-08
浑江市检察院加强廉政建设,1992-08-23,1992-08
湖南省监察机关为企业服务,1992-08-23,1992-08
石家庄社会保险事业不断完善,1992-08-23,1992-08
全国人事部门积极为经济建设服务,1992-08-23,1992-08
为我军现代化建设培养高层次人才  国防大学发挥“集体干部部”作用,1992-08-23,1992-08
跃上新台阶,1992-08-23,1992-08
石家庄选派干部到农村任职,1992-08-23,1992-08
王久刚的作废章,1992-08-23,1992-08
辽宁围绕经济建设办民兵,1992-08-23,1992-08
王政启的“儿女”遍天下,1992-08-23,1992-08
郭殿生被授予“模范指导员”称号,1992-08-23,1992-08
廊坊政法部门加大服务力度,1992-08-23,1992-08
