几种容易混淆的企业,1994-08-14,1994-08
抗癌“良药”就在身边,1994-08-14,1994-08
高枕无忧,1994-08-14,1994-08
北京地区天气预报,1994-08-15,1994-08
三九速度,1994-08-15,1994-08
不妨来些“暗访”,1994-08-15,1994-08
歪曲史实引起内外舆论强烈谴责,1994-08-15,1994-08
樱井辞职宫下继任日环境厅长官,1994-08-15,1994-08
西藏加紧落实６２个援藏项目,1994-08-15,1994-08
促进中西部地区经济发展,1994-08-15,1994-08
宁夏崛起高耗能工业群,1994-08-15,1994-08
延安建成２１０万亩经济林,1994-08-15,1994-08
拜泉县人工造林１００万亩,1994-08-15,1994-08
济南纺织系统扭亏为盈,1994-08-15,1994-08
新疆推广绒山羊科技项目,1994-08-15,1994-08
武汉市住宅电话装得快,1994-08-15,1994-08
广州空调电车线路开通,1994-08-15,1994-08
龙口乡镇企业靠高新技术壮大,1994-08-15,1994-08
无锡县经济发展再创佳绩,1994-08-15,1994-08
文明岗上女民警,1994-08-15,1994-08
十三陵废库变宝库,1994-08-15,1994-08
莫以善小而不为,1994-08-15,1994-08
国家防总紧急通知防汛不可有丝毫懈怠,1994-08-15,1994-08
全国绿委林业部要求加快荒山荒地造林,1994-08-15,1994-08
赵县实施梨果套袋工程,1994-08-15,1994-08
农垦总公司迈向实业化国际化,1994-08-15,1994-08
锦西加强水利专项资金管理,1994-08-15,1994-08
服务城市  发展自己,1994-08-15,1994-08
突破传统农业模式,1994-08-15,1994-08
要“转”到点子上,1994-08-15,1994-08
一位普通农民的市场眼光,1994-08-15,1994-08
“土”产品“洋”价增,1994-08-15,1994-08
倡议设立中华国际交流科学基金会,1994-08-15,1994-08
为农业提供最基本生产资料,1994-08-15,1994-08
“兰州中关村”立足西北面向世界,1994-08-15,1994-08
歌厅搬迁记,1994-08-15,1994-08
我国同步辐射实验室入选,1994-08-15,1994-08
华夏国际学校在珠海成立,1994-08-15,1994-08
部分政协委员人大代表考察承德,1994-08-15,1994-08
江苏改革招生制度,1994-08-15,1994-08
中小学计算机教育研究会成立,1994-08-15,1994-08
北京３５７所中小学结成友好校,1994-08-15,1994-08
希望工程手拉手活动开幕,1994-08-15,1994-08
精神享受,1994-08-15,1994-08
贺卡系深情,1994-08-15,1994-08
教书真好,1994-08-15,1994-08
高尚者的诗行,1994-08-15,1994-08
开发区的人文景观,1994-08-15,1994-08
泰安市实行党风廉政建设责任制,1994-08-15,1994-08
李铁映等视察扎什伦布寺,1994-08-15,1994-08
认真总结维修布达拉宫经验,1994-08-15,1994-08
情系希望工程,1994-08-15,1994-08
张维城同志逝世,1994-08-15,1994-08
世界女排大奖赛悉尼站赛事结束中国队居第三,1994-08-15,1994-08
南北呼应宣传“远南”,1994-08-15,1994-08
中国十佳民营企业家评选开始,1994-08-15,1994-08
数万海内外来宾聚集宝鸡祭炎帝,1994-08-15,1994-08
允许在大陆发布台湾商业和寻亲广告,1994-08-15,1994-08
俞斌和罗洗河将争夺挑战权,1994-08-15,1994-08
大连队继续领先,1994-08-15,1994-08
世界男篮锦标赛  中国队负于澳大利亚队,1994-08-15,1994-08
“十万旅客话民航”活动拉开帷幕,1994-08-15,1994-08
澳门举办大型义演为华南水灾募捐,1994-08-15,1994-08
深圳反贪局开始运作,1994-08-15,1994-08
访李园看巨变,1994-08-15,1994-08
刘兴隆同志逝世,1994-08-15,1994-08
捞草积肥,1994-08-15,1994-08
技术创新  科技与经济结合的思路,1994-08-15,1994-08
新时期弘扬艰苦奋斗精神的几点思考,1994-08-15,1994-08
社科书讯,1994-08-15,1994-08
波黑塞族拒绝五国方案,1994-08-15,1994-08
巴派团同约讨论耶城问题,1994-08-15,1994-08
荒唐的解释,1994-08-15,1994-08
战争罪行昭昭在案  侵华日军竟用剧毒,1994-08-15,1994-08
樱井新丢官记,1994-08-15,1994-08
日至今残存大东亚战争史观,1994-08-15,1994-08
德禁止集会纪念纳粹,1994-08-15,1994-08
消除分歧  促进合作,1994-08-15,1994-08
人口与发展会议将在埃举行,1994-08-15,1994-08
美日竞拟信息蓝图  迪斯尼先登高速路,1994-08-15,1994-08
德又查获核走私案,1994-08-15,1994-08
英首获遗传工程小麦,1994-08-15,1994-08
发展中国家出生率下降,1994-08-15,1994-08
科金融保险对外开放,1994-08-15,1994-08
建议征收汽车污染费,1994-08-15,1994-08
我少年艺术团在罗获一等奖,1994-08-15,1994-08
诗潮涌动,1994-08-15,1994-08
隔河两个村,1994-08-15,1994-08
古泽生香,1994-08-15,1994-08
“富邦杯改革者风采”征文,1994-08-15,1994-08
题洪秀全故居,1994-08-15,1994-08
龙梅,1994-08-15,1994-08
北京地区天气预报,1994-08-16,1994-08
路在脚下,1994-08-16,1994-08
以文会友,1994-08-16,1994-08
抓住机遇  发挥优势  促进发展,1994-08-16,1994-08
第三届中国国际民间艺术节开幕,1994-08-16,1994-08
按照党中央国务院统一部署要求省级国家地方税务机构分设完成,1994-08-16,1994-08
山东建设十个农业高新技术开发示范区,1994-08-16,1994-08
对战争表示深刻反省,1994-08-16,1994-08
全国受旱面积二点四三亿亩,1994-08-16,1994-08
沪节约工业资源成效显著,1994-08-16,1994-08
亚洲最大氧化铝基地建成,1994-08-16,1994-08
内蒙古人工造林逾五千万亩,1994-08-16,1994-08
寒带蔬菜无土栽培实验成功,1994-08-16,1994-08
庄稼保健站,1994-08-16,1994-08
打假重择致富路,1994-08-16,1994-08
质量体系认证工作稳步推进,1994-08-16,1994-08
抚顺石油二厂成为同行创汇排头兵,1994-08-16,1994-08
一汽无锡柴油机厂重振雄风,1994-08-16,1994-08
特殊医疗小分队,1994-08-16,1994-08
从“两厂一长”说起,1994-08-16,1994-08
城市供水事业纳入法制轨道,1994-08-16,1994-08
中国商业联合会在京成立,1994-08-16,1994-08
我国公务员制度稳步推行,1994-08-16,1994-08
甘巴拉连着北京城,1994-08-16,1994-08
宿迁推进精神文明建设,1994-08-16,1994-08
辽宁省委命名张鸣岐为“党的优秀领导干部”,1994-08-16,1994-08
张鸣岐杨晔张秀和被授予革命烈士称号,1994-08-16,1994-08
贵州加强国有企业党建工作,1994-08-16,1994-08
上半年全国火灾损失有增无减,1994-08-16,1994-08
军队企业要坚持“两手抓”的方针,1994-08-16,1994-08
充满爱心,1994-08-16,1994-08
韩素云被授予“爱国拥军模范”称号,1994-08-16,1994-08
北京军代处注重提高官兵素质,1994-08-16,1994-08
李祥雨被树为“精神文明标兵”,1994-08-16,1994-08
甘志周热心青少年教育,1994-08-16,1994-08
临汾医药局为老区人民办实事,1994-08-16,1994-08
驻疆某部二十五年帮助民兵军训,1994-08-16,1994-08
鼓楼区为精神文明建设设立基金,1994-08-16,1994-08
荆州第三技校领导无私奉献,1994-08-16,1994-08
送艺到军营,1994-08-16,1994-08
更好地认清当代中国发展大局,1994-08-16,1994-08
科学理解当代中国马克思主义,1994-08-16,1994-08
为促进西南边疆稳定发展建新功,1994-08-16,1994-08
迎接“远南”运动会  中外影视大荟萃,1994-08-16,1994-08
倡议书,1994-08-16,1994-08
中募委向中国残疾人体育代表团捐款,1994-08-16,1994-08
汉字信息处理系统工程基本完成,1994-08-16,1994-08
世界男篮锦标赛结束中国队获第８名,1994-08-16,1994-08
全国高校排球赛结束,1994-08-16,1994-08
北京国际少年棒球赛举行,1994-08-16,1994-08
３０万名贫困地区儿童将重返校园,1994-08-16,1994-08
第四届青岛国际啤酒节开幕,1994-08-16,1994-08
外事简讯,1994-08-16,1994-08
毛主席关怀盲人工作,1994-08-16,1994-08
“亡羊”之后应“补牢”,1994-08-16,1994-08
警惕有人在粮油中掺杂使假,1994-08-16,1994-08
凯里新情况毁林被制止,1994-08-16,1994-08
《白话容斋随笔》错漏系盗版者所为,1994-08-16,1994-08
地摊卖假药应当有人管,1994-08-16,1994-08
离婚时哪些财产可以作为共同财产分割？,1994-08-16,1994-08
稻种质量差苦了种田人,1994-08-16,1994-08
良田长荒草买粮交公粮,1994-08-16,1994-08
火柴极易爆燃用户提心吊胆,1994-08-16,1994-08
“路边窑”需要经常监督,1994-08-16,1994-08
少儿图书应出精品,1994-08-16,1994-08
农民盼建托畜所,1994-08-16,1994-08
并非乘荫凉,1994-08-16,1994-08
上上下下说中国,1994-08-16,1994-08
日一些政党团体纪念战败日,1994-08-16,1994-08
敦促日本接受历史教训,1994-08-16,1994-08
一场闹剧,1994-08-16,1994-08
日部分阁僚参拜靖国神社,1994-08-16,1994-08
停止在萨市放冷枪,1994-08-16,1994-08
穆巴拉克谈中东和平进程,1994-08-16,1994-08
加沙发生袭击以色列人事件,1994-08-16,1994-08
车臣反对派加紧组建民兵,1994-08-16,1994-08
北约秘书长韦尔纳逝世,1994-08-16,1994-08
阿拉法特批准巴护照样式,1994-08-16,1994-08
阿通过政府行动纲领,1994-08-16,1994-08
秘鲁六省延长紧急状态,1994-08-16,1994-08
刚果一教堂大批人被踩死,1994-08-16,1994-08
东京举行纪念“8·15”反战集会,1994-08-16,1994-08
巴电力领域的革命,1994-08-16,1994-08
全球保险收入１．５万亿美元,1994-08-16,1994-08
加强缅中合作,1994-08-16,1994-08
拉那烈说柬当务之急是发展经济,1994-08-16,1994-08
波罗兹市筹建经济特区,1994-08-16,1994-08
北京·曼谷·北京航线开通,1994-08-16,1994-08
日产业向亚洲扩展,1994-08-16,1994-08
巴基斯坦鱼产品出口增加,1994-08-16,1994-08
巴咖啡出口剧增,1994-08-16,1994-08
“但丁２号”脱险记,1994-08-16,1994-08
美农业部长被控受贿,1994-08-16,1994-08
人民币市场汇价,1994-08-16,1994-08
中美咖啡集团成立,1994-08-16,1994-08
涛飞浪卷商标潮,1994-08-16,1994-08
太白楼的苍蝇值几何,1994-08-16,1994-08
企业竞打“文化牌”,1994-08-16,1994-08
“嘉林花园”为城市添新绿,1994-08-16,1994-08
开个玩具修理店,1994-08-16,1994-08
“马爹利”的奥秘,1994-08-16,1994-08
冯丽丽,1994-08-16,1994-08
彩电比较试验结果,1994-08-16,1994-08
热闹的星期天市场,1994-08-16,1994-08
青春铸警魂,1994-08-16,1994-08
也谈“花钱买平安”,1994-08-16,1994-08
伸手必被捉,1994-08-16,1994-08
无锡公安挂牌上岗,1994-08-16,1994-08
安平法庭登门收案效果好,1994-08-16,1994-08
某高炮旅从参与入手促进社会稳定,1994-08-16,1994-08
阜新市公安局夏季攻势告捷,1994-08-16,1994-08
大力发展“白色工程农业”,1994-08-16,1994-08
彗木相撞促进了天文学的繁荣,1994-08-16,1994-08
从“农民科技日”说起,1994-08-16,1994-08
实施复合绿色工程,1994-08-16,1994-08
黄腐酸：洒向受旱作物的甘露,1994-08-16,1994-08
“长河二号”远程导航定位系统运行,1994-08-16,1994-08
天然色素密蒙黄有益人体健康,1994-08-16,1994-08
绿色食品降糖宝线能治糖尿病,1994-08-16,1994-08
蓬勃发展的中国科技发展基金会,1994-08-16,1994-08
海带的正确吃法,1994-08-16,1994-08
珍稀红皮云杉林亟须抢救,1994-08-16,1994-08
清洁节能的汽油切割机,1994-08-16,1994-08
重放异彩的珠算盘,1994-08-16,1994-08
美食家的“返祖”,1994-08-16,1994-08
一扇看世界的窗口,1994-08-16,1994-08
卧游山水,1994-08-16,1994-08
辰州情结,1994-08-16,1994-08
久违了，阅报栏！,1994-08-16,1994-08
多吉图,1994-08-16,1994-08
北京天气预报,1994-08-17,1994-08
坚决反对虚报瞒报,1994-08-17,1994-08
安徽四大灌区稻禾一片葱绿,1994-08-17,1994-08
中央军委给王林记一等功,1994-08-17,1994-08
围绕全党工作大局进一步做好民族工作,1994-08-17,1994-08
西安海关成企业好帮手,1994-08-17,1994-08
大亚湾核电站机组运转正常,1994-08-17,1994-08
河北取缔无极药市,1994-08-17,1994-08
山东涌现百处亿元市场,1994-08-17,1994-08
京城最大立交桥主体完工,1994-08-17,1994-08
北京工业博览会开幕,1994-08-17,1994-08
不失时机抓好秋粮生产,1994-08-17,1994-08
航空工业机电产品出口增加,1994-08-17,1994-08
莆田新增耕地四万余亩,1994-08-17,1994-08
昆明交易会成果丰硕,1994-08-17,1994-08
古城兰州迎盛会,1994-08-17,1994-08
鹅乡兴化,1994-08-17,1994-08
万里行  大家行,1994-08-17,1994-08
何日还我“名牌”誉,1994-08-17,1994-08
潍坊纯碱厂半年增收节支一亿元,1994-08-17,1994-08
柳铁局为振兴民族经济先行,1994-08-17,1994-08
三九机制,1994-08-17,1994-08
鲁南水泥厂产品受欢迎,1994-08-17,1994-08
湘乡啤酒厂靠科技增效益,1994-08-17,1994-08
商标国际博览会将在京举行,1994-08-17,1994-08
郑州建成肉鸽养殖基地,1994-08-17,1994-08
桂林三金药业集团成立,1994-08-17,1994-08
北京将建京通快速路,1994-08-17,1994-08
住宅与居住环境研究中心成立,1994-08-17,1994-08
赠书交友  动人心弦,1994-08-17,1994-08
辽宁计划生育中心户开创新业绩,1994-08-17,1994-08
彝族草医穴位拔牙堪称一绝,1994-08-17,1994-08
蒙医康玉林善治疑难眼疾,1994-08-17,1994-08
捐资助教共襄义举,1994-08-17,1994-08
第三届全国中学生生物学竞赛揭晓,1994-08-17,1994-08
“保军转民”  开拓市场,1994-08-17,1994-08
国家１比１００万地形数据库建成,1994-08-17,1994-08
简讯,1994-08-17,1994-08
北京电视台推出“周日影院”栏目,1994-08-17,1994-08
《不朽的忠诚》出版,1994-08-17,1994-08
天津有计划培训领导人员,1994-08-17,1994-08
天磁公司投资百万建“人才工厂”,1994-08-17,1994-08
贵州三校一部培养少数民族干部,1994-08-17,1994-08
秦腔自乐班,1994-08-17,1994-08
对领导干部应定期进行知识测验,1994-08-17,1994-08
为了播洒真理的光辉,1994-08-17,1994-08
洞开西北大门  荟萃艺术精品,1994-08-17,1994-08
番禺市等向“远南”捐赠,1994-08-17,1994-08
钱其琛王汉斌分别会见巴拿马客人,1994-08-17,1994-08
钱其琛会见日本自民党访华团,1994-08-17,1994-08
首都交通为残疾人提供方便,1994-08-17,1994-08
罗洗河夺得挑战权,1994-08-17,1994-08
第三届炎黄杯海峡两岸长跑赛近日举行,1994-08-17,1994-08
“孺子牛”刘太生,1994-08-17,1994-08
北京军区某团狠抓干部队伍建设,1994-08-17,1994-08
夕阳红,1994-08-17,1994-08
劲旅走天涯,1994-08-17,1994-08
一位“军嫂”的故事,1994-08-17,1994-08
约以和谈取得新进展,1994-08-17,1994-08
中国政府重视和保护人权,1994-08-17,1994-08
“豺狼”落网,1994-08-17,1994-08
日本“炎热的八月”,1994-08-17,1994-08
巴以谈判移交权力,1994-08-17,1994-08
欢迎朝美协议,1994-08-17,1994-08
正视历史汲取教训,1994-08-17,1994-08
“政府的智慧之家”,1994-08-17,1994-08
我经贸代表团访莱,1994-08-17,1994-08
６万巴人获准入以打工,1994-08-17,1994-08
埃将向巴出口石油,1994-08-17,1994-08
在阿拉木图“打的”,1994-08-17,1994-08
德宣布经济好转,1994-08-17,1994-08
核走私案日趋严重  国际机构深表担忧,1994-08-17,1994-08
蒙通过进出口商品质量条例,1994-08-17,1994-08
日将成立多媒体产业协议会,1994-08-17,1994-08
美将重新成为第一大汽车生产国,1994-08-17,1994-08
日将实施计算科学计划,1994-08-17,1994-08
欧洲联盟外贸逆差锐降,1994-08-17,1994-08
国际市场白银价格下降,1994-08-17,1994-08
世界每天灭绝１６０种动植物,1994-08-17,1994-08
平民生活  史诗品格,1994-08-17,1994-08
《樱桃园》里翻新声,1994-08-17,1994-08
为繁荣高雅艺术做贡献,1994-08-17,1994-08
净、丑、老旦争“梅兰芳金奖”,1994-08-17,1994-08
北京举办纪念关肃霜演出,1994-08-17,1994-08
第五届全国儿童电子琴邀请赛在京举行,1994-08-17,1994-08
北京地区天气预报,1994-08-18,1994-08
荟萃艺术精品  弘扬民族文化,1994-08-18,1994-08
新疆严把棉花质量关,1994-08-18,1994-08
江泽民会见日本自民党访华团,1994-08-18,1994-08
少数民族自治区首府城区经济加快发展,1994-08-18,1994-08
毋忘历史教训  发扬爱国精神,1994-08-18,1994-08
刘明祖任内蒙古自治区党委书记,1994-08-18,1994-08
朱镕基会见亚非保险再保险,1994-08-18,1994-08
联合会执委会议全体代表,1994-08-18,1994-08
金城喜迎盛会,1994-08-18,1994-08
贵阳市乡乡有广播站,1994-08-18,1994-08
海上石油生产形势喜人,1994-08-18,1994-08
兰新复线芨东段提前开通,1994-08-18,1994-08
齐铁分局安全生产十年,1994-08-18,1994-08
黄河飞架第一索,1994-08-18,1994-08
广西成为我国畜牧大省区,1994-08-18,1994-08
扬中长江大桥架通,1994-08-18,1994-08
川陕鄂二十五县市联合保护森林,1994-08-18,1994-08
土地急需“体检”,1994-08-18,1994-08
七嘴八舌“话”交粮,1994-08-18,1994-08
要保证大江大河不出大问题,1994-08-18,1994-08
今年西瓜俏得很,1994-08-18,1994-08
永昌群众吃上鲜鱼,1994-08-18,1994-08
滁州生产自救保秋收,1994-08-18,1994-08
灵溪市场触角伸向二十多个省市,1994-08-18,1994-08
无棣全部兑现拖欠棉农物资,1994-08-18,1994-08
村民喝上鲜牛奶,1994-08-18,1994-08
萍乡着力加强村级党组织建设,1994-08-18,1994-08
发展社会主义市场经济的保证,1994-08-18,1994-08
辽宁大幅度撤销非常设机构,1994-08-18,1994-08
各地公安机关治理公路“三乱”,1994-08-18,1994-08
凤台治穷  民兵有功,1994-08-18,1994-08
祁东县社会治安持续好转,1994-08-18,1994-08
增值税专用发票防伪,1994-08-18,1994-08
税控系统研制成功,1994-08-18,1994-08
港澳台居民首次参加内地律师考试,1994-08-18,1994-08
香河县委指导村支部建设,1994-08-18,1994-08
“他比亲人还要亲”,1994-08-18,1994-08
青川退伍军人显身手,1994-08-18,1994-08
《神圣的使命》出版,1994-08-18,1994-08
吴天志被追授公安战线二级英模称号,1994-08-18,1994-08
临清两千余军烈属重挂“光荣牌”,1994-08-18,1994-08
丰盛派出所开启自动语音咨询服务窗,1994-08-18,1994-08
武警北京总队十支队开展人生观教育,1994-08-18,1994-08
宫元圣艰苦创业无私奉献受表彰,1994-08-18,1994-08
东贸公司政工干部有奔头,1994-08-18,1994-08
切实加强内部刊物管理,1994-08-18,1994-08
内部报刊亟须整顿,1994-08-18,1994-08
老区乐清进百强,1994-08-18,1994-08
首家全国性知识产权评估机构成立,1994-08-18,1994-08
为了千万旅客的平安,1994-08-18,1994-08
“我们同行”事迹报告感人肺腑,1994-08-18,1994-08
“远南”报告演出团报告激人奋进,1994-08-18,1994-08
谢军将参加男子高级国际象棋赛,1994-08-18,1994-08
全国高尔夫球俱乐部杯锦标赛在京举行,1994-08-18,1994-08
简讯,1994-08-18,1994-08
走向２００２年足球夏令营闭营,1994-08-18,1994-08
人保为“远南”提供１２．９亿元保险金,1994-08-18,1994-08
世界妇女大会筹备工作加紧进行,1994-08-18,1994-08
山东出版总社精心组织出好书,1994-08-18,1994-08
梅花鹿落户五指山下,1994-08-18,1994-08
军营文化建设漫议,1994-08-18,1994-08
色彩言语的诗意世界,1994-08-18,1994-08
纪实文学的“实”与“雅”,1994-08-18,1994-08
创造红玛瑙般的散文美,1994-08-18,1994-08
《额尔古纳森林》研讨会,1994-08-18,1994-08
傅太平作品研讨会,1994-08-18,1994-08
《谭震林传奇》出版,1994-08-18,1994-08
约以草签首项经济协议,1994-08-18,1994-08
联合图强有新章,1994-08-18,1994-08
西藏同胞充分享受人权,1994-08-18,1994-08
朝对解决核问题立场不变,1994-08-18,1994-08
向卢旺达周边国家派兵,1994-08-18,1994-08
我向阿富汗难民捐赠救济物资,1994-08-18,1994-08
莱国王宣布解散议会中止政府职能,1994-08-18,1994-08
斯里兰卡大选结果揭晓,1994-08-18,1994-08
危地马拉议会选举结果揭晓,1994-08-18,1994-08
巴拉格尔就任多米尼加共和国总统,1994-08-18,1994-08
俄艇击伤日船  日俄互提抗议,1994-08-18,1994-08
德主审法官被解职,1994-08-18,1994-08
核走私震惊德国,1994-08-18,1994-08
拉美对华贸易看好,1994-08-18,1994-08
美日达成知识产权协议,1994-08-18,1994-08
智将开放长话市场,1994-08-18,1994-08
墨１．８万家鞋厂停业,1994-08-18,1994-08
巴增加对香港出口,1994-08-18,1994-08
欧金融市场出现震动,1994-08-18,1994-08
美联储提高利率  银行界相继效法,1994-08-18,1994-08
竞争中的空中客车,1994-08-18,1994-08
泰将推动湄公河六国合作,1994-08-18,1994-08
神秘的宇宙“黑体”,1994-08-18,1994-08
人蛇共处十五年,1994-08-18,1994-08
时代之子,1994-08-18,1994-08
管桦墨竹,1994-08-18,1994-08
高原牧民,1994-08-18,1994-08
轻舟书法,1994-08-18,1994-08
天地图,1994-08-18,1994-08
北京地区天气预报,1994-08-19,1994-08
变了味的入选,1994-08-19,1994-08
福建猛攻薄弱点增创新优势,1994-08-19,1994-08
山西利用外资兴农取得实效,1994-08-19,1994-08
第四届中国艺术节在兰州隆重开幕,1994-08-19,1994-08
动员各方力量参与支持大西北建设,1994-08-19,1994-08
在第四届中国艺术节开幕式上的讲话,1994-08-19,1994-08
密云水库喝足了,1994-08-19,1994-08
银燕飞落张家界,1994-08-19,1994-08
东阳建筑业成为支柱产业,1994-08-19,1994-08
第四届中国新闻奖揭晓,1994-08-19,1994-08
甘肃化工机械厂效益十年翻四番,1994-08-19,1994-08
国务院关于股份有限公司境外募集股份及上市的特别规定,1994-08-19,1994-08
三九精神,1994-08-19,1994-08
保卫“红塔山”,1994-08-19,1994-08
中国成为国际ＩＳＯ９０００论坛正式成员,1994-08-19,1994-08
全军爱兵带兵模范事迹报告会举行,1994-08-19,1994-08
锋芒所指  “蛀虫”丧胆,1994-08-19,1994-08
三名严重经济罪犯伏法,1994-08-19,1994-08
含泪为英雄请功,1994-08-19,1994-08
千里送黔女,1994-08-19,1994-08
景德镇电化教育走出新路,1994-08-19,1994-08
空军一总队积极支援经济建设,1994-08-19,1994-08
福建涌现三十四个双拥模范单位,1994-08-19,1994-08
《国家公务员暂行条例问答》出版,1994-08-19,1994-08
《陈独秀一家人》出版,1994-08-19,1994-08
空军优秀科技干部李光男进京任职,1994-08-19,1994-08
宿迁市工商局端正行风受好评,1994-08-19,1994-08
扶沟县武装部坚持开展国防法制教育,1994-08-19,1994-08
驻疆某部支持边疆旅游业,1994-08-19,1994-08
’９４中外交通安全研讨会举行,1994-08-19,1994-08
百余残疾人运动员摩托车队成立,1994-08-19,1994-08
世界游泳锦标赛中国代表团组成,1994-08-19,1994-08
安贞医院以三优为“远南”运动会服务,1994-08-19,1994-08
亚运会设施之一——英东游泳馆被租赁,1994-08-19,1994-08
中国体操精英赛揭幕,1994-08-19,1994-08
“跑官”析,1994-08-19,1994-08
外交部发言人宣布,1994-08-19,1994-08
外事简讯,1994-08-19,1994-08
纽约华人为修长城捐款献画,1994-08-19,1994-08
黄河大潮滚滚来,1994-08-19,1994-08
丁关根观看邓小平理论研究系统电脑演示,1994-08-19,1994-08
加强计划管理  严肃招生纪律,1994-08-19,1994-08
江主席任免驻外大使,1994-08-19,1994-08
邹家华会见香港美国实业家,1994-08-19,1994-08
吉林江西“五个一工程”成果丰硕,1994-08-19,1994-08
建立社会主义市场经济体制必须实现观念更新,1994-08-19,1994-08
遏制通货膨胀与防止市场疲软,1994-08-19,1994-08
构建社会利益群体理论框架的可贵探索,1994-08-19,1994-08
蒙中关系将更上一层楼,1994-08-19,1994-08
继续改善和发展两军关系,1994-08-19,1994-08
中越举行政府级第二轮边界谈判,1994-08-19,1994-08
民族文化——立国之本,1994-08-19,1994-08
马来西亚欢迎柬加入东盟,1994-08-19,1994-08
巴以联络委员会会议结束,1994-08-19,1994-08
电话工詹妮芙,1994-08-19,1994-08
日决定向扎伊尔派遣自卫队,1994-08-19,1994-08
波黑穆军总司令号召发动新攻势,1994-08-19,1994-08
希萨诺将参加莫总统选举,1994-08-19,1994-08
加利决定派调查团赴利比里亚,1994-08-19,1994-08
埃塞俄比亚总统结束访美,1994-08-19,1994-08
北约驻大西洋盟军总司令访保,1994-08-19,1994-08
巴警察临察四名哈马斯成员,1994-08-19,1994-08
中国成为世界旅游大国,1994-08-19,1994-08
首届印支科技会议开幕,1994-08-19,1994-08
向贫困宣战的国际合作典范,1994-08-19,1994-08
人口增长  鸟类遭殃,1994-08-19,1994-08
国际贸易格局发生变化,1994-08-19,1994-08
约以签署运输协议,1994-08-19,1994-08
欧洲股市上扬,1994-08-19,1994-08
欧佩克油价下跌,1994-08-19,1994-08
德援助卢旺达难民２．４５亿马克,1994-08-19,1994-08
保４年多吸收外资５亿美元,1994-08-19,1994-08
俄摩达成贷款协议,1994-08-19,1994-08
日通产省计划建设２０座风力发电站,1994-08-19,1994-08
哥伦比亚宣布新农牧业发展计划,1994-08-19,1994-08
人民币市场汇价,1994-08-19,1994-08
扁舟一叶渡大洋,1994-08-19,1994-08
到底怎么活？,1994-08-19,1994-08
我们曾有这样一位市委书记,1994-08-19,1994-08
中国画里的乡村,1994-08-19,1994-08
“上航”展翅,1994-08-19,1994-08
龟蛇之间起新城,1994-08-19,1994-08
商丘人：寻找当今的辉煌,1994-08-19,1994-08
时维英和她的花贴画,1994-08-19,1994-08
开门迎“客”来,1994-08-19,1994-08
百把牛刀惠半省,1994-08-19,1994-08
珍珠女喜笑颜开,1994-08-19,1994-08
一个值得严重警惕的趋向,1994-08-19,1994-08
数字化电讯网络进入香港家庭,1994-08-19,1994-08
共圆一个梦,1994-08-19,1994-08
台湾环保业看好大陆市场,1994-08-19,1994-08
迎接第六届“远南”残疾人运动会,1994-08-19,1994-08
建筑劲旅,1994-08-19,1994-08
北京天气预报,1994-08-20,1994-08
继续加强宏观调控进一步深化金融改革,1994-08-20,1994-08
研讨邓小平理论与广东改革开放,1994-08-20,1994-08
经济效益常抓不懈,1994-08-20,1994-08
江泽民会见日本日中议联代表团,1994-08-20,1994-08
刘华清等观看总政交响乐团演出,1994-08-20,1994-08
