海西蒙古族藏族自治州喜庆四十华诞,1994-08-10,1994-08
江泽民主席会见美国杜邦公司董事长,1994-08-10,1994-08
上海企业解困工作初见成效,1994-08-10,1994-08
一汽开发出新型红旗轿车,1994-08-10,1994-08
安义建成江南最大室内市场,1994-08-10,1994-08
上海空域实行雷达监控,1994-08-10,1994-08
连云港开通直达欧洲班轮航线,1994-08-10,1994-08
让企业唱主角,1994-08-10,1994-08
长风破浪已有时,1994-08-10,1994-08
北京百万职工告别八级工资制,1994-08-10,1994-08
转包生产波音７３７机身,1994-08-10,1994-08
怎么知道您不吃番茄酱？,1994-08-10,1994-08
计算机成为新热点,1994-08-10,1994-08
荆州塑管公司重质量效益增,1994-08-10,1994-08
丰南啤酒厂套用“丽都”标签被查处,1994-08-10,1994-08
南昆铁路那百段开始铺轨,1994-08-10,1994-08
北京将举办大型商贸艺术灯会,1994-08-10,1994-08
新型航空交流电源车研制成功,1994-08-10,1994-08
中国推出九大国际口味香烟,1994-08-10,1994-08
铁道部引进十万线程控交换设备,1994-08-10,1994-08
餐旅服务业商品交易会在广州举行,1994-08-10,1994-08
《世界软件总汇》首卷出版发行,1994-08-10,1994-08
柯达公司举行新产品展示会,1994-08-10,1994-08
黄河之滨“文化村”,1994-08-10,1994-08
阿拉伯数字莫乱用,1994-08-10,1994-08
此情今未了,1994-08-10,1994-08
接过父亲的教鞭,1994-08-10,1994-08
依法保护野生植物资源,1994-08-10,1994-08
北京今秋举办图书报刊博览会,1994-08-10,1994-08
泼墨抒豪情  丹青写壮志,1994-08-10,1994-08
四川下月举办首届书市,1994-08-10,1994-08
北大《国学研究》第二卷出版,1994-08-10,1994-08
亚洲青年管弦乐团在京演出,1994-08-10,1994-08
深圳少儿艺术团来京献艺,1994-08-10,1994-08
四面八方捐资助教,1994-08-10,1994-08
全国小学数学奥林匹克总决赛结束,1994-08-10,1994-08
计划生育“县主任百杰”评选揭晓,1994-08-10,1994-08
阳江市坚持不懈抓干部队伍建设,1994-08-10,1994-08
跨世纪青年人才工程研讨会在京召开,1994-08-10,1994-08
把文章写得短些,1994-08-10,1994-08
验收专家喜说布达拉宫,1994-08-10,1994-08
《当代著名书法家手书邓小平名言》出版,1994-08-10,1994-08
浙江沿海百万军民投入抗台风抢险,1994-08-10,1994-08
’９４潍坊鲁台经贸洽谈会开幕,1994-08-10,1994-08
两会负责人台北会谈是成功的,1994-08-10,1994-08
外事简讯,1994-08-10,1994-08
袁伟民冒雨看望残疾人运动员,1994-08-10,1994-08
挚爱献给国氏四姐弟,1994-08-10,1994-08
罗洗河俞斌积分领先,1994-08-10,1994-08
北京国际武术邀请赛落幕,1994-08-10,1994-08
壁球运动将在我国兴起,1994-08-10,1994-08
中国女排远征澳大利亚,1994-08-10,1994-08
中国男篮负于克罗地亚队,1994-08-10,1994-08
关于社会科学是否生产力的思考,1994-08-10,1994-08
近代中国改革的先驱,1994-08-10,1994-08
文明间的相互创造更有意义,1994-08-10,1994-08
美朝日内瓦会晤取得进展,1994-08-10,1994-08
哥新总统会见我特使,1994-08-10,1994-08
约以美三方领导人会晤,1994-08-10,1994-08
开通和平之路,1994-08-10,1994-08
亚太安全合作小议,1994-08-10,1994-08
柯利达批评英中关系报告,1994-08-10,1994-08
长崎纪念遭原子弹轰炸４９周年,1994-08-10,1994-08
美国务卿提前结束中东之行,1994-08-10,1994-08
巴以开始新一轮谈判,1994-08-10,1994-08
共同开发乌苏里江流域,1994-08-10,1994-08
丑闻的价值,1994-08-10,1994-08
阿拉伯国家农业生产下降,1994-08-10,1994-08
百岁夫妻  子孙逾百,1994-08-10,1994-08
英采煤设备降价,1994-08-10,1994-08
日缺水频率加快,1994-08-10,1994-08
美用遗传技术控制香蕉成熟期,1994-08-10,1994-08
英自行车需求趋旺,1994-08-10,1994-08
２０３０年将达８５亿,1994-08-10,1994-08
俄政府讨论消灭三角债问题,1994-08-10,1994-08
人民币市场汇价,1994-08-10,1994-08
厄尔尼诺现象  十载后仍作祟,1994-08-10,1994-08
白鸥翩翩龙江曲,1994-08-10,1994-08
长白春色唱不尽,1994-08-10,1994-08
真挚地拥抱生活,1994-08-10,1994-08
中华戏曲电视编导协会成立,1994-08-10,1994-08
《湛江有个风流镇》获好评,1994-08-10,1994-08
《歌词创作与音乐》出版,1994-08-10,1994-08
北京地区天气预报,1994-08-11,1994-08
古城，走向现代文明,1994-08-11,1994-08
靠深化改革摆脱困境,1994-08-11,1994-08
国有资产十年增五倍,1994-08-11,1994-08
广州一批跨世纪干部走上领导岗位,1994-08-11,1994-08
取消和限制对华最惠国待遇议案,1994-08-11,1994-08
美国众议院投票予以否决,1994-08-11,1994-08
我国工业生产继续稳定增长,1994-08-11,1994-08
鞍钢不再为滞销产品计产量,1994-08-11,1994-08
我国开发出四百种绿色食品,1994-08-11,1994-08
青海成为重要蜂产品基地,1994-08-11,1994-08
湖南省重点工程施工进度快,1994-08-11,1994-08
浙江清理机关豪华轿车,1994-08-11,1994-08
贵州贫困区电力建设快,1994-08-11,1994-08
内蒙古居民收入明显提高,1994-08-11,1994-08
广东水产加工能力增强,1994-08-11,1994-08
包头投资治理工业污染,1994-08-11,1994-08
冰袋降温,1994-08-11,1994-08
抢修高炉,1994-08-11,1994-08
柳林人，何时走出吕梁山,1994-08-11,1994-08
长海渔民闯外海,1994-08-11,1994-08
宝应反弹琵琶走新路,1994-08-11,1994-08
沂蒙老区  农民旱地发鱼财,1994-08-11,1994-08
凌源农村  涌现三千卖花女,1994-08-11,1994-08
“阳光”铺就名牌路,1994-08-11,1994-08
兰塘乡农民自建水库,1994-08-11,1994-08
供销社个人承包需完善,1994-08-11,1994-08
贫困村更需一个好班子,1994-08-11,1994-08
目前仍处主汛期,1994-08-11,1994-08
“４名职工”办１０个经济实体,1994-08-11,1994-08
走出水门,1994-08-11,1994-08
要闻简报,1994-08-11,1994-08
昔日荒滩地  今日荷藕香,1994-08-11,1994-08
零陵开展群众观点群众路线教育,1994-08-11,1994-08
正义之歌,1994-08-11,1994-08
莱钢炼钢厂弘扬文明新风,1994-08-11,1994-08
宣城强化农村党支部建设,1994-08-11,1994-08
承德深入开展双拥工作,1994-08-11,1994-08
这片热土,1994-08-11,1994-08
淮安领导下基层解难题,1994-08-11,1994-08
空军工程兵某部支援地方建设,1994-08-11,1994-08
首届名牌产品慈善拍卖会将举办,1994-08-11,1994-08
北塘民兵与驻军开展“对口共建”,1994-08-11,1994-08
全国审计厅局长市场经济研讨班开班,1994-08-11,1994-08
北京破获骗租出租汽车特大案,1994-08-11,1994-08
驻浦东某部全面建设上台阶,1994-08-11,1994-08
张英贵夫妇创办“家庭希望小学”,1994-08-11,1994-08
济铁公安局坚持从严治警,1994-08-11,1994-08
“军民共建子弟学校”在豫开办,1994-08-11,1994-08
解放军第六医院领导廉洁自律,1994-08-11,1994-08
一定要把布达拉宫管理工作搞好,1994-08-11,1994-08
共商造就跨世纪人才大计,1994-08-11,1994-08
三喜临门,1994-08-11,1994-08
“远南”运动员自强拚搏精神激人奋进,1994-08-11,1994-08
希望两岸关系发展再创新局面,1994-08-11,1994-08
全国菜篮子工程研讨会在惠州召开,1994-08-11,1994-08
两公司向“远南”捐赠,1994-08-11,1994-08
杜邦公司将增加在华投资,1994-08-11,1994-08
将向“远南”运动会提供服务,1994-08-11,1994-08
中国女垒获世锦赛亚军,1994-08-11,1994-08
全国围棋少年精英赛在京开枰,1994-08-11,1994-08
《北京日报》世界杯竞猜揭晓,1994-08-11,1994-08
北京友好城市少年足球赛闭幕,1994-08-11,1994-08
世界杯金靴奖得主资助一病孩,1994-08-11,1994-08
电视剧《路》投入拍摄,1994-08-11,1994-08
《旮旯胡同》将搬上荧屏,1994-08-11,1994-08
《中国空姐》开拍,1994-08-11,1994-08
烛光灼灼,1994-08-11,1994-08
月照桐林,1994-08-11,1994-08
蝶韵,1994-08-11,1994-08
约以会谈取得新进展,1994-08-11,1994-08
委海地和平斡旋计划失败,1994-08-11,1994-08
法德轴心面临新考验,1994-08-11,1994-08
庆祝中国巴西建交二十周年,1994-08-11,1994-08
献出一份爱,1994-08-11,1994-08
俄重申政治解决车臣问题,1994-08-11,1994-08
萨拉热窝机场重新开放,1994-08-11,1994-08
极端分子活动猖獗,1994-08-11,1994-08
暴力事件连续发生,1994-08-11,1994-08
欢迎朝打算放弃过时核技术,1994-08-11,1994-08
哥总统谴责暗杀塞佩达,1994-08-11,1994-08
墨首届民主协商会议闭幕,1994-08-11,1994-08
安内战双方签署程序性协议,1994-08-11,1994-08
韩国一架客机发生爆炸,1994-08-11,1994-08
日元比价回落,1994-08-11,1994-08
中东北非将举行经济首脑会议,1994-08-11,1994-08
世行将援助巴自治区,1994-08-11,1994-08
俄ＭＭＭ股票案发人深省,1994-08-11,1994-08
诗琳通公主参观中国艺术展,1994-08-11,1994-08
中国向乌干达提供小型工业设备,1994-08-11,1994-08
我援玻第一期打井工程竣工,1994-08-11,1994-08
南非黄金产量下降,1994-08-11,1994-08
捷吸引外资达２５亿美元,1994-08-11,1994-08
交互网络  扩展速度惊人,1994-08-11,1994-08
欧洲股市普遍下跌,1994-08-11,1994-08
白雪获“亚洲之声”一等奖,1994-08-11,1994-08
罗贩毒活动猖獗,1994-08-11,1994-08
波噪音污染严重,1994-08-11,1994-08
阿犯罪率下降,1994-08-11,1994-08
人民币市场汇价,1994-08-11,1994-08
多瑙河“友谊”桥车满为患,1994-08-11,1994-08
慢性杀手  海湾战争怪症,1994-08-11,1994-08
梧桐叶落金茎直,1994-08-11,1994-08
林凡书法,1994-08-11,1994-08
画坛风景线,1994-08-11,1994-08
从戈壁走来,1994-08-11,1994-08
北京地区天气预报,1994-08-12,1994-08
闯过关隘是通衢,1994-08-12,1994-08
辽宁农业综合开发见实效,1994-08-12,1994-08
黑龙江进一步减轻农民负担,1994-08-12,1994-08
江苏农村储蓄超五百亿元,1994-08-12,1994-08
喜闻乡干部学农技,1994-08-12,1994-08
“火炉”中的建设者,1994-08-12,1994-08
宝钢设立教育基金,1994-08-12,1994-08
兰新复线芨许段铺通,1994-08-12,1994-08
深圳至三亚通航,1994-08-12,1994-08
云南四川成为花卉大省,1994-08-12,1994-08
景德镇高档日用瓷批量出口,1994-08-12,1994-08
北京军区号召学习张鼎三,1994-08-12,1994-08
虫口夺棉,1994-08-12,1994-08
铁骨铸钢龙,1994-08-12,1994-08
功臣也须守法,1994-08-12,1994-08
抓紧“菜篮子”工程  确保副食品供应,1994-08-12,1994-08
五年获关税优惠３．３亿美元,1994-08-12,1994-08
今年新批三资企业逾千家,1994-08-12,1994-08
国标为谁而立？,1994-08-12,1994-08
新型大功率电力机车试制成功,1994-08-12,1994-08
煤矿井下支护材料开发获突破,1994-08-12,1994-08
临沂建陶公司产品闯入国际市场,1994-08-12,1994-08
扬州市三泰酱菜荣获国际金奖,1994-08-12,1994-08
创力运动鞋成为中奥委指定产品,1994-08-12,1994-08
中国（洛阳）酒类饮料专业市场将开业,1994-08-12,1994-08
“金丝猴”捐助金丝猴,1994-08-12,1994-08
青岛龙山游乐城时空隧道建成,1994-08-12,1994-08
上半年查处４００多起不正当竞争案,1994-08-12,1994-08
’９４中国旅游购物节成果喜人,1994-08-12,1994-08
睢宁棉纺织厂成为利税大户,1994-08-12,1994-08
《对外贸易法》培训工作将开展,1994-08-12,1994-08
南通整治农村治安促进经济建设,1994-08-12,1994-08
古庙医院的跨越,1994-08-12,1994-08
运城选派青年干部下基层锻炼,1994-08-12,1994-08
新兴集团探索思想政治工作新路,1994-08-12,1994-08
铁路系统整顿车站秩序卓有成效,1994-08-12,1994-08
奔马集团热心社会福利事业,1994-08-12,1994-08
海军后勤依靠科技提高保障能力,1994-08-12,1994-08
图的是事业,1994-08-12,1994-08
某部官兵自觉保护珍稀动物,1994-08-12,1994-08
海淀公安分局加强地区综合整治,1994-08-12,1994-08
某团一批优秀基层干部得到晋升,1994-08-12,1994-08
焦作山阳区坚持工人岗前军训,1994-08-12,1994-08
大特区党团员风采,1994-08-12,1994-08
贵州重视提高企业政工干部地位,1994-08-12,1994-08
“七夕”有感,1994-08-12,1994-08
全军基层官兵深入学习《邓选》第三卷,1994-08-12,1994-08
美财政部指责中国操纵外汇体制不符合事实,1994-08-12,1994-08
普通高校录取新生在各地展开,1994-08-12,1994-08
香港筹预委政务小组会议结束,1994-08-12,1994-08
周恩来纪念馆在新疆石河子落成,1994-08-12,1994-08
新闻出版署向西藏边防部队赠书,1994-08-12,1994-08
又观测到彗木相撞六块黑斑,1994-08-12,1994-08
厦门口岸截获进口罂粟种籽,1994-08-12,1994-08
带领企业创名牌,1994-08-12,1994-08
“远南”运动会服务措施全部到位,1994-08-12,1994-08
“远南”考电脑,1994-08-12,1994-08
世界男篮赛中国男篮负于希腊队,1994-08-12,1994-08
华润集团为残疾人事业捐款,1994-08-12,1994-08
简讯,1994-08-12,1994-08
关于“科学技术是第一生产力”,1994-08-12,1994-08
《毛泽东人民战争后勤理论研究》评介,1994-08-12,1994-08
阿拉法特与拉宾会谈,1994-08-12,1994-08
欧盟转入“小步走”,1994-08-12,1994-08
柬将整编政府军,1994-08-12,1994-08
波黑穆塞族交战不止,1994-08-12,1994-08
罗斯警告要空袭双方,1994-08-12,1994-08
韩航乘客脱险记,1994-08-12,1994-08
反对在自治区设立外交代表机构,1994-08-12,1994-08
车臣总统签署全民总动员令,1994-08-12,1994-08
别有一番滋味在心头,1994-08-12,1994-08
美法加阿继续策划,1994-08-12,1994-08
逼迫海地军方下台,1994-08-12,1994-08
安理会呼吁卢各方为遣返难民作努力,1994-08-12,1994-08
瓦连尼科夫被宣判无罪,1994-08-12,1994-08
日本明年照付美军经费,1994-08-12,1994-08
利各派将举行全国会议,1994-08-12,1994-08
阿要求逮捕伊朗外交官,1994-08-12,1994-08
美参议院通过援外法案,1994-08-12,1994-08
“中国成功就是波音的成功”,1994-08-12,1994-08
彗木相撞  痕迹犹存,1994-08-12,1994-08
科加两国今年可可将减产,1994-08-12,1994-08
发展中国家黄金需求减少,1994-08-12,1994-08
印度钻石出口看好,1994-08-12,1994-08
世界粮食贸易量将下降,1994-08-12,1994-08
人民币市场汇价,1994-08-12,1994-08
土耳其第一颗通讯卫星升空,1994-08-12,1994-08
第十届世界艾滋病大会闭幕,1994-08-12,1994-08
小说家的散文,1994-08-12,1994-08
楚辞的综合研究,1994-08-12,1994-08
“现象”与“经验”,1994-08-12,1994-08
审美内涵和史诗意识,1994-08-12,1994-08
走进历史的真境界,1994-08-12,1994-08
民族审美文化掇英,1994-08-12,1994-08
艺文体裁经营之道,1994-08-12,1994-08
大地书讯,1994-08-12,1994-08
一本外交“史书”,1994-08-12,1994-08
《阿Ｑ——７０年》出版,1994-08-12,1994-08
《邓小平的历程》,1994-08-12,1994-08
中国速递在竞争中崛起,1994-08-12,1994-08
知名度带来市场效益,1994-08-12,1994-08
风情依旧丽江城,1994-08-12,1994-08
一百岁的咸亨酒店,1994-08-12,1994-08
纤毫银针连世界,1994-08-12,1994-08
河海大学重视少数民族人才培养,1994-08-12,1994-08
张有禄：科技攻关带头人,1994-08-12,1994-08
中央民族大学夜大、函授教育硕果累累,1994-08-12,1994-08
某步兵旅积极做好民族团结工作,1994-08-12,1994-08
栉风沐雪三十载  甘为亲人送温暖,1994-08-12,1994-08
四十三次列车是民族团结进步先进集体,1994-08-12,1994-08
佳肴天香，艺术瑰宝,1994-08-12,1994-08
田阳香芒——芒果之王,1994-08-12,1994-08
韵,1994-08-12,1994-08
京城“远南”冲击波,1994-08-12,1994-08
珍惜人生机遇,1994-08-12,1994-08
棒球——乔丹的心灵需要,1994-08-12,1994-08
盲人门球,1994-08-12,1994-08
病燕思飞小陆莉,1994-08-12,1994-08
苏永舜再说世界杯,1994-08-12,1994-08
以高尚的精神塑造人,1994-08-12,1994-08
由张鸣岐想到“爱民如身”,1994-08-12,1994-08
变革中的农村社会,1994-08-12,1994-08
水泥小记,1994-08-12,1994-08
泰山之门,1994-08-12,1994-08
银杏树,1994-08-12,1994-08
大地书讯,1994-08-12,1994-08
书法,1994-08-12,1994-08
晚归图,1994-08-12,1994-08
北京地区天气预报,1994-08-13,1994-08
群雁高飞  功在头雁,1994-08-13,1994-08
农村要进步关键在支部,1994-08-13,1994-08
李鹏主持召开国务院第２３次常务会议,1994-08-13,1994-08
福建省领导干部围绕大局搞调研,1994-08-13,1994-08
湖南定购粮入库早,1994-08-13,1994-08
设“奖教金”好,1994-08-13,1994-08
新疆四季蔬菜鲜,1994-08-13,1994-08
山东住宅小区建设进展迅速,1994-08-13,1994-08
“太平洋机电”在沪成立,1994-08-13,1994-08
广州电车实行无人售票,1994-08-13,1994-08
湖北生猪生产势头强劲,1994-08-13,1994-08
“酶洗”技术提高织物品位,1994-08-13,1994-08
蓉城时兴游水消夏,1994-08-13,1994-08
攻克京九第一难,1994-08-13,1994-08
抓住机遇  尊重规律,1994-08-13,1994-08
魂铸大动脉,1994-08-13,1994-08
沧州工行实行风险管理,1994-08-13,1994-08
大兴安岭艰苦创业硕果累累,1994-08-13,1994-08
常州无线电总厂依靠科技创名牌,1994-08-13,1994-08
“太保”各项业务持续增长,1994-08-13,1994-08
整治后的无极药市,1994-08-13,1994-08
杭州西湖离合器厂开发高层次产品,1994-08-13,1994-08
混凝土复合液获国际大奖,1994-08-13,1994-08
中英合资捷利康医药公司开业,1994-08-13,1994-08
长春皮尔金顿安全玻璃有限公司开业,1994-08-13,1994-08
全国足金首饰设计比赛揭晓,1994-08-13,1994-08
对资产评估加强管理,1994-08-13,1994-08
多层传销疑点多,1994-08-13,1994-08
“经济搭台文艺唱戏”如何？,1994-08-13,1994-08
万丰集团钟情艺术,1994-08-13,1994-08
现代地球科学研究中心成立,1994-08-13,1994-08
中国重视环保工作,1994-08-13,1994-08
亚太空间合作机构筹委会成立,1994-08-13,1994-08
九月北京举办首届国际保健节,1994-08-13,1994-08
生物技术提高中草药药效,1994-08-13,1994-08
“针刀医学”喜获发展,1994-08-13,1994-08
４１个国家和地区报名参加“远南”运动会,1994-08-13,1994-08
’９６亚洲国际邮展展徽、吉祥物选定,1994-08-13,1994-08
《怎样考任国家公务员》出版,1994-08-13,1994-08
《今古通鉴》问世,1994-08-13,1994-08
全国围棋少年精英赛落幕,1994-08-13,1994-08
曹氏基金会向“远南”献爱心,1994-08-13,1994-08
中国队首战败给日本队,1994-08-13,1994-08
俞斌罗洗河保持领先,1994-08-13,1994-08
世界男篮锦标赛复赛结束,1994-08-13,1994-08
老年延寿会,1994-08-13,1994-08
在江泽民同志关怀下,1994-08-13,1994-08
拉萨各界人士盛赞布达拉宫维修工程,1994-08-13,1994-08
着眼大局培育跨世纪青年人才,1994-08-13,1994-08
雷洁琼会见优秀教师代表,1994-08-13,1994-08
反腐败斗争要逐步纳入法制轨道,1994-08-13,1994-08
全国民航思想政治工作会议结束,1994-08-13,1994-08
将强兵不弱,1994-08-13,1994-08
歌咏比赛付出高代价,1994-08-13,1994-08
鲜血写壮歌,1994-08-13,1994-08
摊派风竟刮向学校,1994-08-13,1994-08
这家酒楼应改进服务质量,1994-08-13,1994-08
李官乡道路已畅通,1994-08-13,1994-08
教学楼年底可竣工,1994-08-13,1994-08
给付回扣，单方记帐外帐，仍属不正当竞争行为,1994-08-13,1994-08
污水甚于天灾,1994-08-13,1994-08
美朝谈判暂告结束,1994-08-13,1994-08
巴解呼吁国际社会加快援助,1994-08-13,1994-08
车臣局势又趋紧张,1994-08-13,1994-08
暴雨袭击伦敦,1994-08-13,1994-08
明石康说波黑战争可能升级,1994-08-13,1994-08
美众院否决反犯罪法案,1994-08-13,1994-08
亚洲青联会议在蒙结束,1994-08-13,1994-08
乌哈决定加强互利合作,1994-08-13,1994-08
叶利钦不许暴力干涉车臣,1994-08-13,1994-08
普希金与莫斯科,1994-08-13,1994-08
“洋会”识味,1994-08-13,1994-08
垃圾产品：一举两得,1994-08-13,1994-08
奇特的土著绘画艺术,1994-08-13,1994-08
百老汇的音乐剧,1994-08-13,1994-08
话说阿根廷烤牛肉,1994-08-13,1994-08
环保环保,1994-08-13,1994-08
胶东艺术人才的摇篮,1994-08-13,1994-08
军事题材也要创新,1994-08-13,1994-08
“纤夫”何以得宠？,1994-08-13,1994-08
徐州流行手绘文化衫,1994-08-13,1994-08
《昭君出塞》邮票即将问世,1994-08-13,1994-08
超越前人的杰作,1994-08-13,1994-08
新兵连里度周末,1994-08-13,1994-08
淄博推广交响乐,1994-08-13,1994-08
中华书画博览会庆国庆,1994-08-13,1994-08
“中华美”书画赛揭晓,1994-08-13,1994-08
李双江  风骚一领三十年,1994-08-13,1994-08
烟台举办全国城市童声合唱节,1994-08-13,1994-08
赛车,1994-08-13,1994-08
北京地区天气预报,1994-08-14,1994-08
自强者胜,1994-08-14,1994-08
贵州夏粮连年丰收,1994-08-14,1994-08
安徽扭亏抓大户,1994-08-14,1994-08
云南油气前景好,1994-08-14,1994-08
石西获高产油气流,1994-08-14,1994-08
落实《监管条例》  保护国有资产,1994-08-14,1994-08
村山首相批评樱井发言“不适当”,1994-08-14,1994-08
对樱井发表歪曲历史言论感到遗憾,1994-08-14,1994-08
对美朝会谈取得积极成果表示欢迎,1994-08-14,1994-08
贯彻《监管条例》深化企业改革,1994-08-14,1994-08
昆明成为西南对外开放前沿,1994-08-14,1994-08
菏商段实现运输分流,1994-08-14,1994-08
新一代管理者,1994-08-14,1994-08
扭亏增盈是当前经济工作的大事,1994-08-14,1994-08
天津副食基地稳定市场繁荣,1994-08-14,1994-08
石家庄显像管厂变大亏为大盈,1994-08-14,1994-08
新华寻呼全国漫游总网宣布成立,1994-08-14,1994-08
中企经济信息交流中心创立,1994-08-14,1994-08
太湖水公司跃为国内大型啤酒企业,1994-08-14,1994-08
喜来登使用民航计算机旅馆预订系统,1994-08-14,1994-08
上海与德国合建动物保健品厂,1994-08-14,1994-08
国务院发出治理“三乱”通知,1994-08-14,1994-08
采取坚决措施治理公路“三乱”,1994-08-14,1994-08
希望更加灿烂,1994-08-14,1994-08
蓬莱机关现场办公帮企业“造血”,1994-08-14,1994-08
当“娘”莫怕“孩子”哭,1994-08-14,1994-08
濮阳市加强机关作风建设,1994-08-14,1994-08
湖北财政厅整顿机关纪律,1994-08-14,1994-08
结合民族地区实际做好组织工作,1994-08-14,1994-08
首都武警官兵为“远南”做贡献,1994-08-14,1994-08
齐河综合治理见成效,1994-08-14,1994-08
武警内蒙古总队三支队警民共建结硕果,1994-08-14,1994-08
加强自身建设搞好参政监督,1994-08-14,1994-08
１７６套钥匙的故事,1994-08-14,1994-08
全国优秀法制新闻工作者评选开始,1994-08-14,1994-08
消防部门组织英模报告团赴全国演讲,1994-08-14,1994-08
牟平县严把公派出国关,1994-08-14,1994-08
民兵高贵洪抢险救灾光荣献身,1994-08-14,1994-08
南疆军区某部造福边疆各族人民,1994-08-14,1994-08
桂林市给驻军功臣颁“军功奖”,1994-08-14,1994-08
如东县首创军官之家,1994-08-14,1994-08
某团为民服务活动持之以恒,1994-08-14,1994-08
上海加强同各省市合作交流,1994-08-14,1994-08
全国国防知识竞赛落下帷幕,1994-08-14,1994-08
杨少俊受到总后党委表彰,1994-08-14,1994-08
长白：开山筑富路,1994-08-14,1994-08
周庆鸣同志逝世,1994-08-14,1994-08
吴宗先同志逝世,1994-08-14,1994-08
“澳门基本法有奖问答”颁奖仪式在澳门举行,1994-08-14,1994-08
香港特区筹委会预委会经济小组召开第八次会议,1994-08-14,1994-08
爱我东海,1994-08-14,1994-08
外事简讯,1994-08-14,1994-08
第三届国际徐福学术研讨会在龙口举行,1994-08-14,1994-08
“爱我中华爱我家乡”夏令营在京举办,1994-08-14,1994-08
全国书画创作研讨会作品展评举行,1994-08-14,1994-08
诸葛志润赴日办画展,1994-08-14,1994-08
湘籍三胞诗词选《天涯芳草》出版,1994-08-14,1994-08
河南抓紧查处棉花掺杂使假案件,1994-08-14,1994-08
“我们摊上了个好领导”,1994-08-14,1994-08
老模范新传,1994-08-14,1994-08
农民冷暖挂心头,1994-08-14,1994-08
锐旅奇兵,1994-08-14,1994-08
选准着力点,1994-08-14,1994-08
美朝发表《联合声明》,1994-08-14,1994-08
老挝副总理会见唐家璇,1994-08-14,1994-08
大选前的墨西哥,1994-08-14,1994-08
韩积极评价朝美会谈成果,1994-08-14,1994-08
美国务卿说会谈取得进展,1994-08-14,1994-08
暑期打工仔,1994-08-14,1994-08
爱心超越国界,1994-08-14,1994-08
大藏相认为应对发动战争反省,1994-08-14,1994-08
环境厅长官收回歪曲史实讲话,1994-08-14,1994-08
日提出新防卫政策报告书,1994-08-14,1994-08
联合国酝酿解决海地危机新方案,1994-08-14,1994-08
巴将接管拉法海关巴人通道,1994-08-14,1994-08
米洛舍维奇同斯托尔滕贝格会晤,1994-08-14,1994-08
为了战胜艾滋病,1994-08-14,1994-08
意瑞提高贴现率  德英丹将步后尘,1994-08-14,1994-08
外资购三百家美公司,1994-08-14,1994-08
走私核材料在德落网,1994-08-14,1994-08
记者：你为何泪流满面,1994-08-14,1994-08
王文明提出光学测量新理论,1994-08-14,1994-08
欧共体外贸趋好转  日七月顺差创纪录,1994-08-14,1994-08
瓦尔德斯号赔偿案初审揭晓,1994-08-14,1994-08
中巴合开铁矿,1994-08-14,1994-08
德开拓软件市场,1994-08-14,1994-08
欧消遣电器市场不旺,1994-08-14,1994-08
陈希同等看望“远南”运动员、教练员,1994-08-14,1994-08
世界石油需求增长,1994-08-14,1994-08
“远南”“亚运”携手同行共创辉煌,1994-08-14,1994-08
人民币市场汇价,1994-08-14,1994-08
世纪之交城市防洪任务重,1994-08-14,1994-08
我国文字起源又推前两千年,1994-08-14,1994-08
满语与北京话,1994-08-14,1994-08
落榜后的名人,1994-08-14,1994-08
商标许可使用的动力和策略,1994-08-14,1994-08
延缓衰老三大要诀,1994-08-14,1994-08
