北京地区天气预报,1994-08-01,1994-08
国防部举行盛大招待会,1994-08-01,1994-08
坚持在大局下行动,1994-08-01,1994-08
北京经济增长令人鼓舞,1994-08-01,1994-08
南沙官兵生活条件明显改善,1994-08-01,1994-08
西藏进入历史最好发展时期,1994-08-01,1994-08
把清凉送给一线,1994-08-01,1994-08
云南亿元乡镇四十九个,1994-08-01,1994-08
“白色公害”治理有新技术,1994-08-01,1994-08
天津发展科技咨询业,1994-08-01,1994-08
南泥湾村村户户通电,1994-08-01,1994-08
麻城开通万门程控电话,1994-08-01,1994-08
泰和赣江特大桥创纪录,1994-08-01,1994-08
水库多亏损  此地创佳绩,1994-08-01,1994-08
塔里木的“女粮王”,1994-08-01,1994-08
腾飞的平邑,1994-08-01,1994-08
新野撂荒地低产田大变样,1994-08-01,1994-08
浙江为农服务“示范县”建设有成效,1994-08-01,1994-08
甘肃一批农业精品名扬海内外,1994-08-01,1994-08
蟹苗大战又升级,1994-08-01,1994-08
经济要闻,1994-08-01,1994-08
东沟村为果农发执照,1994-08-01,1994-08
山西省保护耕地卓有成效,1994-08-01,1994-08
原平制种产业成大气候,1994-08-01,1994-08
普陀鲜鱼直销出口,1994-08-01,1994-08
湖南迅达集团科技产业发展迅速,1994-08-01,1994-08
“西海舰队”西北奉献４０年,1994-08-01,1994-08
寄我以信任  报之以琼瑶,1994-08-01,1994-08
“八一”前夕送温暖,1994-08-01,1994-08
“莫高窟将封闭”纯属谣传,1994-08-01,1994-08
《中国传统乐器名家名曲》出版,1994-08-01,1994-08
“教师优先”,1994-08-01,1994-08
合肥高科技广场成为科技成果集散地,1994-08-01,1994-08
蚂蚁入药能治病,1994-08-01,1994-08
中药治疗前列腺病效果佳,1994-08-01,1994-08
肝癌冷冻治疗中心成立,1994-08-01,1994-08
长征医院三捧“白求恩杯”,1994-08-01,1994-08
我染色体工程育出小麦新品种,1994-08-01,1994-08
一竹独秀四明山,1994-08-01,1994-08
领导干部要善于出点子,1994-08-01,1994-08
北京立法制止虚假广告,1994-08-01,1994-08
确保赴台商谈人员安全与尊严,1994-08-01,1994-08
海协与台海基会非正式交换意见,1994-08-01,1994-08
程启文同志逝世,1994-08-01,1994-08
苏子元同志逝世,1994-08-01,1994-08
我国残疾人体育事业取得长足进步,1994-08-01,1994-08
《国际象棋新竞赛手册》出版,1994-08-01,1994-08
参加分龄组国际象棋赛,1994-08-01,1994-08
中国队昨天抵达匈牙利,1994-08-01,1994-08
北京队主场大胜沪军,1994-08-01,1994-08
澳门选手将角逐广岛亚运会九个项目,1994-08-01,1994-08
布勃卡再创世界纪录,1994-08-01,1994-08
世界女足四强赛中国队首战告捷,1994-08-01,1994-08
唐树备愿与台湾有关方面高层负责人会面,1994-08-01,1994-08
香港青年联会代表团参观驻穗部队,1994-08-01,1994-08
向管理要效益求发展,1994-08-01,1994-08
提高农业比较效益之一见,1994-08-01,1994-08
谈谈税制改革后分配格局的变化,1994-08-01,1994-08
朝坚持祖国统一三原则,1994-08-01,1994-08
巴解重申对耶城问题立场,1994-08-01,1994-08
约旦承认巴对耶城拥有主权,1994-08-01,1994-08
从“乐园”厄运说开去,1994-08-01,1994-08
波黑穆族两派冲突又趋激烈,1994-08-01,1994-08
难民落他乡处境惨,1994-08-01,1994-08
总统访四邻求支援,1994-08-01,1994-08
俄又发生一起劫持人质事件,1994-08-01,1994-08
美参议院举行“白水事件”听证会,1994-08-01,1994-08
俄爱签署拆除在爱核反应堆协议,1994-08-01,1994-08
保左派力量庆祝社会主义运动组织诞生１０３周年,1994-08-01,1994-08
意人民党选出新书记,1994-08-01,1994-08
加强管理  精耕细作,1994-08-01,1994-08
保批准偿还外债协议,1994-08-01,1994-08
美与日加贸易谈判破裂,1994-08-01,1994-08
西方援阿农药造成危害,1994-08-01,1994-08
下世纪知识财富占支配地位,1994-08-01,1994-08
最垂直的深井,1994-08-01,1994-08
日本人均寿命最长,1994-08-01,1994-08
研制最大光学反射镜面,1994-08-01,1994-08
第２４届吉福尼儿童国际电影节开幕,1994-08-01,1994-08
墨西哥今年吸收外资７０亿美元,1994-08-01,1994-08
科特迪瓦重振旅游业,1994-08-01,1994-08
世界棉价上升,1994-08-01,1994-08
乌克兰从煤中提炼汽油,1994-08-01,1994-08
巴西外贸大量顺差,1994-08-01,1994-08
共和国的脊梁,1994-08-01,1994-08
大写的子弟兵,1994-08-01,1994-08
月光山寄情,1994-08-01,1994-08
军民共建情意深,1994-08-01,1994-08
书法,1994-08-01,1994-08
北京地区天气预报,1994-08-02,1994-08
农村经济上半年发展态势良好,1994-08-02,1994-08
论宣传先进典型,1994-08-02,1994-08
哨所“动物园”,1994-08-02,1994-08
包钢扬起龙头带动百业,1994-08-02,1994-08
川中油气公司后劲十足,1994-08-02,1994-08
辽宁改革石油流通体制,1994-08-02,1994-08
虞山组建企业集团闯市场,1994-08-02,1994-08
兴隆庄煤矿效益倍增,1994-08-02,1994-08
十大旅游目的地我国跃居第八位,1994-08-02,1994-08
桂林两江机场开工,1994-08-02,1994-08
阳谷减轻农民负担八百万元,1994-08-02,1994-08
汕头早稻单产再创全国纪录,1994-08-02,1994-08
西延铁路公司成立,1994-08-02,1994-08
中原油田建行支持油气上产,1994-08-02,1994-08
昔日打工妹  今朝葡萄王,1994-08-02,1994-08
青岛五千企业实行劳动合同制,1994-08-02,1994-08
振兴支柱产业的目标和对策,1994-08-02,1994-08
把先进技术带给中国,1994-08-02,1994-08
西藏各类市场初具规模,1994-08-02,1994-08
德州一批亏损企业再现生机,1994-08-02,1994-08
云阳摩托车配件厂效益大增,1994-08-02,1994-08
经济要闻,1994-08-02,1994-08
实行公司制关键在转制,1994-08-02,1994-08
各级供销社严把棉花收购质量关,1994-08-02,1994-08
严厉打击掺杂使假违法犯罪活动,1994-08-02,1994-08
首届房地产百强企业评价揭晓,1994-08-02,1994-08
京九吉老段十七座隧道全部贯通,1994-08-02,1994-08
我国矿井专用灯泡出口国外,1994-08-02,1994-08
成都双流机场扩建工程破土动工,1994-08-02,1994-08
南宁“１２０”急救服务通讯系统发挥作用,1994-08-02,1994-08
一百立方米石油液化气铁路罐车试运行,1994-08-02,1994-08
安阳“三枪”自行车销量创纪录,1994-08-02,1994-08
中国投资环境学会成立,1994-08-02,1994-08
奥的斯建立二十四小时电梯服务热线,1994-08-02,1994-08
首届企业闲置设备调剂会将举行,1994-08-02,1994-08
危难时刻看“堡垒”,1994-08-02,1994-08
军民学雷锋  鱼水情更浓,1994-08-02,1994-08
青州双拥工作落到实处,1994-08-02,1994-08
拉萨各界拥军优属庆“八一”,1994-08-02,1994-08
桂滇黔川藏注重培养少数民族干部,1994-08-02,1994-08
驻军训练尖子可享受政府补贴,1994-08-02,1994-08
市场报特约记者聂振强见义勇为受嘉奖,1994-08-02,1994-08
预备役干部训练期间给予补贴,1994-08-02,1994-08
闪光的警徽,1994-08-02,1994-08
海军某预备役师十年成果显著,1994-08-02,1994-08
学雷锋标兵金正洪提干,1994-08-02,1994-08
尹若全获“全国优秀人民警察”称号,1994-08-02,1994-08
郭福才离休十年诊治患儿四万,1994-08-02,1994-08
八里庄街道重视个体户教育,1994-08-02,1994-08
南空某部保障飞行安全四十一年,1994-08-02,1994-08
强生公司慰问国旗护卫中队,1994-08-02,1994-08
北京民调组织为发展经济作贡献,1994-08-02,1994-08
全国人大侨委重视侨务立法和监督,1994-08-02,1994-08
五把钥匙的故事,1994-08-02,1994-08
荣毅仁会见印尼客人,1994-08-02,1994-08
远南饭店堪称残疾人之家,1994-08-02,1994-08
稷山四农民集资修路造福家乡,1994-08-02,1994-08
希望两会会谈能扩大共识克服分歧,1994-08-02,1994-08
陈临新负于山城宏,1994-08-02,1994-08
宦栋槐向“远南”捐画,1994-08-02,1994-08
全国大学生乒乓球锦标赛结束,1994-08-02,1994-08
残疾人世界田径锦标赛闭幕,1994-08-02,1994-08
海协与台海基会再商三项议题,1994-08-02,1994-08
全军“军营之声”歌唱比赛举行,1994-08-02,1994-08
加强执法  杜绝虚假,1994-08-02,1994-08
不该这样垄断,1994-08-02,1994-08
刹一刹“三峡刻石”风,1994-08-02,1994-08
矿渣毁良田  索赔无人理,1994-08-02,1994-08
译电员马虎  喜讯变噩耗,1994-08-02,1994-08
青浦县公安局无汽车修理厂,1994-08-02,1994-08
水困家园  陶老汉危在旦夕,1994-08-02,1994-08
金盾生辉  柳亚利奋勇救人,1994-08-02,1994-08
长途汽车应配乘警,1994-08-02,1994-08
夫妇一方是少数民族，其子女应属于哪个民族？,1994-08-02,1994-08
管一管非标准制作国旗,1994-08-02,1994-08
危险的“铁疙瘩”,1994-08-02,1994-08
安理会授权多国部队出兵海地,1994-08-02,1994-08
埃以首脑强调打破叙以和谈僵局,1994-08-02,1994-08
外交大臣谈生意,1994-08-02,1994-08
一个危险的先例,1994-08-02,1994-08
欧共体多数公民赞成欧洲政治和货币一体化,1994-08-02,1994-08
俄乌总统表示将解决黑海舰队问题,1994-08-02,1994-08
萨帕塔民族解放军允许其控制区内居民参加大选,1994-08-02,1994-08
科威特敦促国际社会迫使伊拉克释放战俘,1994-08-02,1994-08
冈比亚新总统宣布两名军官将受审,1994-08-02,1994-08
日举行仪式悼念相模湖建设的死难者,1994-08-02,1994-08
泰国将于明年中遣返滞留在泰全部老挝难民,1994-08-02,1994-08
法拟延长“绿松石行动”,1994-08-02,1994-08
日本欲拥有制造核武器能力,1994-08-02,1994-08
科济列夫向南通报５国外长会晤内容,1994-08-02,1994-08
将继续加强和发展朝中友谊,1994-08-02,1994-08
美海军陆战队守卫美驻海地使馆,1994-08-02,1994-08
德国老年人的喜与忧,1994-08-02,1994-08
七旬老翁考大学  励志实现平生愿,1994-08-02,1994-08
意大利首次出现人口负增长,1994-08-02,1994-08
日本人口停止向东京圈集中,1994-08-02,1994-08
中东欧国家热浪袭人,1994-08-02,1994-08
捷金融业发展迅速,1994-08-02,1994-08
以约巴将合作消灭蚊蝇,1994-08-02,1994-08
西班牙渔民停止封锁渔港,1994-08-02,1994-08
秘鲁今年缉毒成绩显著,1994-08-02,1994-08
美将实行贸易制裁,1994-08-02,1994-08
日不在压力下谈判,1994-08-02,1994-08
推进区域贸易自由化,1994-08-02,1994-08
保障地区林渔业合理收益,1994-08-02,1994-08
罗决定精简机构,1994-08-02,1994-08
家庭厨卫革命：序幕正在拉开,1994-08-02,1994-08
携包乘车该付多少钱？,1994-08-02,1994-08
生存大跳跃,1994-08-02,1994-08
点水成石：神话还是理想,1994-08-02,1994-08
“唯亭欧立顿”出新表,1994-08-02,1994-08
“巴城”系列印花制品俏销海外,1994-08-02,1994-08
新型车用电子冷藏箱问世,1994-08-02,1994-08
北京天无推出汽车防盗新系统,1994-08-02,1994-08
新型甲烷检测报警仪问世,1994-08-02,1994-08
江苏三毛推出全毛薄花呢,1994-08-02,1994-08
喷施宝公司推出超高效灭草宝,1994-08-02,1994-08
北京天联公司推出真空充氮包装机,1994-08-02,1994-08
旅游不仅有经济,1994-08-02,1994-08
如此“改进”受不了,1994-08-02,1994-08
“好马”还需“好鞍”配,1994-08-02,1994-08
打假难,1994-08-02,1994-08
正气之歌,1994-08-02,1994-08
提高执法水平  发挥审判职能,1994-08-02,1994-08
发票畸变的深思,1994-08-02,1994-08
警中女杰,1994-08-02,1994-08
信阳公安机关坚持严打斗争战果斐然,1994-08-02,1994-08
上海铁路公安局打击拆盗犯罪活动,1994-08-02,1994-08
海军驻京某仓库综合治理保安全,1994-08-02,1994-08
内蒙古锡盟重视治安综合治理,1994-08-02,1994-08
武警嘉兴支队维护驻地治安,1994-08-02,1994-08
千古一书  蔚为大观,1994-08-02,1994-08
跨越与综合,1994-08-02,1994-08
在三种文化间穿行,1994-08-02,1994-08
走进非洲的心灵之旅,1994-08-02,1994-08
迟到的辉煌,1994-08-02,1994-08
为工商业文化启蒙,1994-08-02,1994-08
安阳设立本地图书专柜,1994-08-02,1994-08
《青年参考》拓宽青年视野,1994-08-02,1994-08
爱我中华三部曲,1994-08-02,1994-08
补说清人李,1994-08-02,1994-08
且说名誉,1994-08-02,1994-08
别感“灵龙泉”,1994-08-02,1994-08
大地书讯,1994-08-02,1994-08
鹰之歌,1994-08-02,1994-08
北京地区天气预报,1994-08-03,1994-08
名牌开道  经济振兴,1994-08-03,1994-08
违反规定连续更换小轿车谷城县委书记县长被撤职,1994-08-03,1994-08
贪图享受者戒,1994-08-03,1994-08
天安门广场更换华灯,1994-08-03,1994-08
确保财税改革成功完成国家预算任务,1994-08-03,1994-08
完善税制  分设机构  强化征管,1994-08-03,1994-08
青岛工商局方便外商投资,1994-08-03,1994-08
建筑业成为浙江支柱产业,1994-08-03,1994-08
海南构建新型社会保障制度,1994-08-03,1994-08
我国最大轿车总装线投产,1994-08-03,1994-08
丹东将建我国最大的硼铁矿,1994-08-03,1994-08
广梅汕铁路部分开通货运,1994-08-03,1994-08
企业改革的必由之路,1994-08-03,1994-08
通辽工行帮助肉联厂摘掉亏损帽子,1994-08-03,1994-08
植根沃土,1994-08-03,1994-08
大家都来参加“扶贫行动”,1994-08-03,1994-08
国务院正式批准,1994-08-03,1994-08
外经贸部职能配置新方案,1994-08-03,1994-08
海口运用股份制建设菜篮子,1994-08-03,1994-08
株洲引进外资注重实效,1994-08-03,1994-08
北京成片改造安内“灵光小区”,1994-08-03,1994-08
长白山号旅游特快车投入运行,1994-08-03,1994-08
中国国内旅游协会发行“神州卡”,1994-08-03,1994-08
百通集团开发新型建材效益好,1994-08-03,1994-08
一种新型子午线轮胎通过国家鉴定,1994-08-03,1994-08
《中国期货》杂志向学生赠刊,1994-08-03,1994-08
河北东光二郎岗永清观落成,1994-08-03,1994-08
着力提高质量,1994-08-03,1994-08
蛇生龙：小所与大公司并进,1994-08-03,1994-08
“两全其美”难,1994-08-03,1994-08
台上双十佳  台下父子兵,1994-08-03,1994-08
全部母爱给予学生,1994-08-03,1994-08
专家研讨母乳代用品管理办法,1994-08-03,1994-08
龙港镇投资四千多万元办教育,1994-08-03,1994-08
范埠村的“两把火”,1994-08-03,1994-08
湖南率先完成长防林一期工程,1994-08-03,1994-08
简讯,1994-08-03,1994-08
上海建立民工学校,1994-08-03,1994-08
郧西个体户办英语夜校,1994-08-03,1994-08
香港发现首例艾滋病婴,1994-08-03,1994-08
“文摘专业户”日多,1994-08-03,1994-08
首届中国油画静物展将举行,1994-08-03,1994-08
矿工迷摄影,1994-08-03,1994-08
高明：拥抱“外面的世界”,1994-08-03,1994-08
公务员录用考试将照顾军转干部,1994-08-03,1994-08
拉萨大昭寺维修工程竣工,1994-08-03,1994-08
国以农为本,1994-08-03,1994-08
海协与台海基会第五次事务性商谈结束,1994-08-03,1994-08
第四届海峡两岸关系学术研讨会开幕,1994-08-03,1994-08
《正大综艺——“远南”专场》,1994-08-03,1994-08
“远南”运动会又获资助,1994-08-03,1994-08
中国队三战三胜晋升四强,1994-08-03,1994-08
韩国参加广岛亚运会人数确定,1994-08-03,1994-08
全国青少年航模赛将在青岛举行,1994-08-03,1994-08
马拉多纳亮相“友谊杯”,1994-08-03,1994-08
外事简讯,1994-08-03,1994-08
杨犁同志逝世,1994-08-03,1994-08
台湾中正机场货运承揽大楼失火,1994-08-03,1994-08
福建渔民多次救助遇事台胞,1994-08-03,1994-08
大型画册《布达拉宫》出版,1994-08-03,1994-08
《今日谈选粹》出版发行,1994-08-03,1994-08
电视剧《梅兰芳》开机,1994-08-03,1994-08
安阳书画作品展在京举行,1994-08-03,1994-08
吴仪会见孟加拉客人,1994-08-03,1994-08
加快用高新技术改造传统产业,1994-08-03,1994-08
努力发展劳动就业服务企业,1994-08-03,1994-08
许多拉美国家反对军事干预海地,1994-08-03,1994-08
新内阁积极发展日中友好关系,1994-08-03,1994-08
海地实行全国戒严,1994-08-03,1994-08
朝鲜代表团前往日内瓦,1994-08-03,1994-08
不可滥用“反倾销”,1994-08-03,1994-08
波兰纪念华沙起义五十周年,1994-08-03,1994-08
阿萨德说叙利亚渴望和平,1994-08-03,1994-08
黎总统强调以必须撤出黎南部,1994-08-03,1994-08
芬兰举行北欧妇女论坛活动,1994-08-03,1994-08
五国联络小组拒绝继续谈判,1994-08-03,1994-08
巴以继续第四轮权力移交谈判,1994-08-03,1994-08
美加贸易谈判达成谅解,1994-08-03,1994-08
南太论坛年会强调可持续发展,1994-08-03,1994-08
ＭＭＭ公司股票风波震动全俄,1994-08-03,1994-08
桑总统赞扬中国医疗队,1994-08-03,1994-08
以允许巴农产品入境,1994-08-03,1994-08
巴拿马兴建“中国城”,1994-08-03,1994-08
广东省将购买爱立信公司４亿美元通信设备,1994-08-03,1994-08
比利时企业破产数不断增加,1994-08-03,1994-08
纽约股市上升,1994-08-03,1994-08
美消费开支增长快于个人收入,1994-08-03,1994-08
欧佩克原油价每桶突破１７美元,1994-08-03,1994-08
日本将资助巴自治领导机构,1994-08-03,1994-08
玻利维亚兴建洋际公路路段,1994-08-03,1994-08
日本外汇储备达１１３７亿美元,1994-08-03,1994-08
俄ＭＭＭ公司开始发行新股票,1994-08-03,1994-08
反垄断委加强控制商业广告,1994-08-03,1994-08
人民币市场汇价,1994-08-03,1994-08
兵戏兵演  情真意淳,1994-08-03,1994-08
忆绍康,1994-08-03,1994-08
难忘延安十日行,1994-08-03,1994-08
风华正茂是青春,1994-08-03,1994-08
北京地区天气预报,1994-08-04,1994-08
戈壁红柳,1994-08-04,1994-08
高扬艰苦奋斗的旗帜,1994-08-04,1994-08
乌铁局事迹报告会在京举行,1994-08-04,1994-08
朱镕基会见毛里求斯客人,1994-08-04,1994-08
酷暑下的郑州站,1994-08-04,1994-08
赞广州解决“车子问题”,1994-08-04,1994-08
国务院批准贵阳为农业示范区,1994-08-04,1994-08
走向开放的边陲小镇,1994-08-04,1994-08
今年国库券发行超额完成,1994-08-04,1994-08
广州农村经济持续增长,1994-08-04,1994-08
湖南增大农村卫生投入,1994-08-04,1994-08
浙江商品市场交易旺,1994-08-04,1994-08
宁夏重点工程建设快,1994-08-04,1994-08
建行存款逾二千亿元,1994-08-04,1994-08
新疆成功控制蝗害,1994-08-04,1994-08
燕化聚乙烯装置竣工,1994-08-04,1994-08
赣南经济发展跃居江西前列,1994-08-04,1994-08
通州实施百项工程,1994-08-04,1994-08
多种经营一跃而起,1994-08-04,1994-08
建湖水利管理达到自收自支,1994-08-04,1994-08
邹城挂钩供应农资全部兑现到户,1994-08-04,1994-08
新疆有个“小温州”,1994-08-04,1994-08
天池之水润安图,1994-08-04,1994-08
农村财务管理亟待加强,1994-08-04,1994-08
辛集万亩低产田变成高效经济园,1994-08-04,1994-08
马老汉掏粪,1994-08-04,1994-08
界河镇年外运农副产品２亿公斤,1994-08-04,1994-08
临淄区“菜篮”“米袋”一起抓,1994-08-04,1994-08
沙朗镇发展优稀水产养殖,1994-08-04,1994-08
“伊丽莎白”落户临泉,1994-08-04,1994-08
“黑长江”的追求,1994-08-04,1994-08
福建多渠道培训村级后备干部,1994-08-04,1994-08
保定市推出监督制约新机制,1994-08-04,1994-08
切实安排好灾区群众生活,1994-08-04,1994-08
慰问桂东南抗洪部队,1994-08-04,1994-08
服从大局提高快速综合保障能力,1994-08-04,1994-08
北京法纪检察有成效,1994-08-04,1994-08
天津领导参加“军营一日”活动,1994-08-04,1994-08
南飞公司纪念毛泽东嘉勉信四十周年,1994-08-04,1994-08
海城选拔基层妇女干部,1994-08-04,1994-08
沂州窑矿党委联系实际抓党建,1994-08-04,1994-08
宁晋严厉打击违法犯罪活动,1994-08-04,1994-08
兴城加强旅游旺季治安管理,1994-08-04,1994-08
天津高校为驻津某师培训人才,1994-08-04,1994-08
某军代处主任张广斌廉洁自律,1994-08-04,1994-08
抚顺军转干部各得其所,1994-08-04,1994-08
某炮旅帮助回族群众致富,1994-08-04,1994-08
某油库为地方经济建设作贡献,1994-08-04,1994-08
仙桃重视城市文明工程建设,1994-08-04,1994-08
各地“远南”氛围渐浓,1994-08-04,1994-08
涞源的“炕头工厂”,1994-08-04,1994-08
希望两会负责人会谈取得积极成果,1994-08-04,1994-08
香港区事顾问批评港府,1994-08-04,1994-08
敦煌研究院五十年成果丰硕,1994-08-04,1994-08
’９４国际科学与和平周纪念宣传拉开序幕,1994-08-04,1994-08
中国残疾人体育代表团,1994-08-04,1994-08
国际田联公布各项目今年最好成绩,1994-08-04,1994-08
青岛将举行全国沙滩排球赛,1994-08-04,1994-08
集思广益明确优先资助领域,1994-08-04,1994-08
黑龙江饶河县洪水泛滥成灾,1994-08-04,1994-08
边防大队两战士为抢险献身,1994-08-04,1994-08
中国队首战不敌法国队,1994-08-04,1994-08
郝海东克雷格刘欣被处罚,1994-08-04,1994-08
莫塞利破男子三千米跑世界纪录,1994-08-04,1994-08
全国青少年地学夏令营开营,1994-08-04,1994-08
寻求发展两岸关系新共识,1994-08-04,1994-08
复活的丝绸之路,1994-08-04,1994-08
军中神农氏,1994-08-04,1994-08
我有一颗绿色的心,1994-08-04,1994-08
美拟全面解决与朝关系问题,1994-08-04,1994-08
俄车臣共和国局势紧张,1994-08-04,1994-08
戈兰，寻觅和平的坐标,1994-08-04,1994-08
日本坚持无核三原则,1994-08-04,1994-08
拉宾说两年内不谈耶城问题,1994-08-04,1994-08
伦敦一天两大劫案,1994-08-04,1994-08
巴拉迪尔非洲之行,1994-08-04,1994-08
西方对俄侦察活动异常,1994-08-04,1994-08
美国军火出口居世界之首,1994-08-04,1994-08
塞政府要求波黑塞族接受和平方案,1994-08-04,1994-08
海地军人政权抗议联合国决议,1994-08-04,1994-08
美副总统访问乌克兰,1994-08-04,1994-08
约以举行专家级预备性会谈,1994-08-04,1994-08
中国同南太国家关系稳步发展,1994-08-04,1994-08
阿根廷进行大规模扫毒行动,1994-08-04,1994-08
法国６月有７０４人死于车祸,1994-08-04,1994-08
英一杂志公布英最富者排行榜,1994-08-04,1994-08
日本中学生不爱读课外书,1994-08-04,1994-08
南非等３国将联合打击军火走私,1994-08-04,1994-08
中缅合作建造的３艘内河货船下水,1994-08-04,1994-08
南太七国领导人会见刘华秋,1994-08-04,1994-08
阿根廷有效抑制恶性通胀,1994-08-04,1994-08
警惕“食人菌”杀手,1994-08-04,1994-08
联合国召开援卢难民募捐会,1994-08-04,1994-08
“孔子故乡情画展”在汉城举行,1994-08-04,1994-08
人民币市场汇价,1994-08-04,1994-08
甲戌画展自叙,1994-08-04,1994-08
第八届全国美展今秋举办,1994-08-04,1994-08
上海现代儿童想象画展神奇新颖,1994-08-04,1994-08
木屑花,1994-08-04,1994-08
篆书,1994-08-04,1994-08
北京地区天气预报,1994-08-05,1994-08
长白深处橄榄绿,1994-08-05,1994-08
“不讲派头”,1994-08-05,1994-08
我国黄金生产稳步发展,1994-08-05,1994-08
山东百余企业扭亏为盈,1994-08-05,1994-08
沙市上下一心抓扭亏,1994-08-05,1994-08
西藏油气勘查取得成果,1994-08-05,1994-08
进一步加强职工物价监督工作,1994-08-05,1994-08
吐哈温米油田建成投产,1994-08-05,1994-08
贵州成为煤炭输出大省,1994-08-05,1994-08
京汉广埋地光缆干线动工,1994-08-05,1994-08
四川农民人均收入增百元,1994-08-05,1994-08
广东商业企业经营规模扩大,1994-08-05,1994-08
黑龙江粮食系统半年减亏逾千万,1994-08-05,1994-08
世界屋脊铁路养护机械化,1994-08-05,1994-08
觉醒的质量观,1994-08-05,1994-08
老厂长新风采,1994-08-05,1994-08
变“两头叫”为“两头笑”,1994-08-05,1994-08
枣阳农民积极参与流通,1994-08-05,1994-08
中国化工新技术展览会在曼谷举行,1994-08-05,1994-08
饲料及添加剂市场调查揭晓,1994-08-05,1994-08
雯泉牌陶瓷膜电热水器获金奖,1994-08-05,1994-08
“巡洋舰”牌皮鞋获国际金奖,1994-08-05,1994-08
不锈钢自动晒衣架问世,1994-08-05,1994-08
中泵泵产品成套销售公司成立,1994-08-05,1994-08
西藏仁布县发石财,1994-08-05,1994-08
宝鸡石油钢管厂靠质量占领市场,1994-08-05,1994-08
我国加快住房制度改革步伐,1994-08-05,1994-08
天津海关创造宽松通关环境,1994-08-05,1994-08
首届乡镇企业暨合资企业人才技术交流大会将举行,1994-08-05,1994-08
沈铁局为困难企业“雪中送炭”,1994-08-05,1994-08
开发银行与工行签署委托代理协议,1994-08-05,1994-08
探索农村治安防范的新路,1994-08-05,1994-08
增强领导干部理性思维能力,1994-08-05,1994-08
各地公证机关完善跟踪服务,1994-08-05,1994-08
钦州地委心系基层,1994-08-05,1994-08
三万余名北京青年志愿者将为远南运动会提供优质服务,1994-08-05,1994-08
英雄的妻子,1994-08-05,1994-08
任排长  进军校,1994-08-05,1994-08
推动西藏各项事业迈上新台阶,1994-08-05,1994-08
建议开设“下乡劳动”课,1994-08-05,1994-08
中组部组织中科院工程院院士休假,1994-08-05,1994-08
国务院任免一批国家工作人员,1994-08-05,1994-08
两会负责人会谈在台北举行,1994-08-05,1994-08
陈晟夺得男子一米板跳水金牌,1994-08-05,1994-08
美国友人爱德乐在北京逝世,1994-08-05,1994-08
王兆国会见台湾及海外学者,1994-08-05,1994-08
“远南”宣传向深度广度发展,1994-08-05,1994-08
加强两会合作  培养两岸互信,1994-08-05,1994-08
第１２届亚乒赛九月在天津举行,1994-08-05,1994-08
明年将在中国举办,1994-08-05,1994-08
中直机关捐助教育,1994-08-05,1994-08
全国大学生篮球赛将在成都举行,1994-08-05,1994-08
全国协作区三项棋赛结束,1994-08-05,1994-08
胸襟开阔，放眼世界,1994-08-05,1994-08
纪念甲申山海关之战三百五十周年研讨会,1994-08-05,1994-08
充分发挥讲师团的作用,1994-08-05,1994-08
