既有较高速度又有较好效益,1994-08-20,1994-08
尊干爱兵推动军队基层建设,1994-08-20,1994-08
第五届中国艺术节１９９７年在北京举办,1994-08-20,1994-08
残疾人运动员自强精神催人奋进,1994-08-20,1994-08
第四届中国艺术节异彩纷呈,1994-08-20,1994-08
抑制通货膨胀维护金融秩序,1994-08-20,1994-08
让老百姓吃上“放心肉”,1994-08-20,1994-08
我国森林旅游业突飞猛进,1994-08-20,1994-08
“农机”不应坑农,1994-08-20,1994-08
津门各种人身保险热正在悄然升温,1994-08-20,1994-08
临沭百分之九十七农户参加财产保险,1994-08-20,1994-08
常州市开办科技新产品开发综合保险,1994-08-20,1994-08
鑫达公司非法从事期货交易被查处,1994-08-20,1994-08
西湖更美了,1994-08-20,1994-08
华力继往开来再展宏图,1994-08-20,1994-08
金融业又崛起一支生力军,1994-08-20,1994-08
我的世界桃李飘香,1994-08-20,1994-08
“百宝箱”金不换,1994-08-20,1994-08
为人师者当自重,1994-08-20,1994-08
一站到底,1994-08-20,1994-08
为少男少女歌唱,1994-08-20,1994-08
证书,1994-08-20,1994-08
把根留住,1994-08-20,1994-08
“远南”运动会报名者增加,1994-08-20,1994-08
建设部重视无障碍设施,1994-08-20,1994-08
王艳获自行车世锦赛第七名,1994-08-20,1994-08
八一室内田径馆落成,1994-08-20,1994-08
广岛亚运会中国体育代表团成立,1994-08-20,1994-08
世界女排大奖赛中国队首战告捷,1994-08-20,1994-08
两代园丁的亲情,1994-08-20,1994-08
在“远南残疾人运动会报告演出”座谈会上的讲话,1994-08-20,1994-08
反腐败三项工作要狠抓落实,1994-08-20,1994-08
世纪风，从陇原吹来,1994-08-20,1994-08
以优异成绩迎接全国劳模大会召开,1994-08-20,1994-08
领导干部要学好人口理论,1994-08-20,1994-08
加强中小学生竞赛评奖活动管理,1994-08-20,1994-08
田曾佩会见摩洛哥国王特使,1994-08-20,1994-08
外事简讯,1994-08-20,1994-08
上海各界为刘海粟大师送行,1994-08-20,1994-08
对台中南部地区受灾表示慰问,1994-08-20,1994-08
吴学谦会见日本前首相竹下登,1994-08-20,1994-08
文化部奖励西藏文化工作者,1994-08-20,1994-08
男儿国里一女兵,1994-08-20,1994-08
搬家公司——北京人的宠爱,1994-08-20,1994-08
盗器材铁路受阻,1994-08-20,1994-08
严打击刻不容缓,1994-08-20,1994-08
既制售假酒  又打执法人,1994-08-20,1994-08
“内部吸储”须正确引导,1994-08-20,1994-08
记者采访抗洪受伤,1994-08-20,1994-08
一九六医院关怀备至,1994-08-20,1994-08
为山区农民建立信息渠道,1994-08-20,1994-08
法院未经申请人同意可否决定暂缓执行？,1994-08-20,1994-08
取钱付款  自立规矩,1994-08-20,1994-08
以盐充肥  自欺欺人,1994-08-20,1994-08
荡得小树直发抖,1994-08-20,1994-08
纳中友谊得到巩固和加强,1994-08-20,1994-08
牙买加奉行“一个中国”政策,1994-08-20,1994-08
法律确定各民族权利平等,1994-08-20,1994-08
教育，约旦立国之本,1994-08-20,1994-08
斯里兰卡新总理宣誓就职,1994-08-20,1994-08
荷兰组成以工党为首联合政府,1994-08-20,1994-08
一点九秒，停！,1994-08-20,1994-08
日本Ｈ２—２号火箭发射失败,1994-08-20,1994-08
美俄将举行联合军事演习,1994-08-20,1994-08
波黑塞族议会建议同南联盟组成国家,1994-08-20,1994-08
大批卢旺达人涌向扎伊尔,1994-08-20,1994-08
比军将参加波黑上空的“禁飞行动”,1994-08-20,1994-08
伊朗驻阿根廷大使被召回国内,1994-08-20,1994-08
阿尔及利亚各省救援灾民,1994-08-20,1994-08
曼德拉强调实现重建计划,1994-08-20,1994-08
啊，卡萨布兰卡,1994-08-20,1994-08
杜布纳情思,1994-08-20,1994-08
《芬兰颂》和它的作者,1994-08-20,1994-08
画归故里,1994-08-20,1994-08
大财主与友好运动会,1994-08-20,1994-08
再现明式家具光彩的人,1994-08-20,1994-08
撷生活英华  酿艺术醇香,1994-08-20,1994-08
宋崇转向,1994-08-20,1994-08
他用电脑制作舞蹈,1994-08-20,1994-08
洛杉矶拍卖中国画,1994-08-20,1994-08
“唐诗三百”与电视结缘,1994-08-20,1994-08
京剧和体育联袂,1994-08-20,1994-08
田园风情画,1994-08-20,1994-08
金狮旅游区的新景观,1994-08-20,1994-08
第二届全国管弦乐作品比赛开幕,1994-08-20,1994-08
曹俊清痴情寄蓝天,1994-08-20,1994-08
“雷锋卡”的启示,1994-08-21,1994-08
开发区大有希望,1994-08-21,1994-08
深圳深化国有企业改革,1994-08-21,1994-08
征程回首倍感亲切,1994-08-21,1994-08
湘江大堤上,1994-08-21,1994-08
安徽扶持沿淮地区脱贫,1994-08-21,1994-08
甘肃借“东风” 发展旅游业,1994-08-21,1994-08
内蒙古农业节本增效,1994-08-21,1994-08
黑龙江农民收入增五成,1994-08-21,1994-08
京九线桥墩之最,1994-08-21,1994-08
北京将办“三峡灯会”,1994-08-21,1994-08
福州保护改造“三坊七巷”,1994-08-21,1994-08
苏州工业园区建设铺开,1994-08-21,1994-08
八塘站安全行车一万天,1994-08-21,1994-08
新疆航空公司又辟新线,1994-08-21,1994-08
凉山办彝族国际火把节,1994-08-21,1994-08
北京地区天气预报,1994-08-21,1994-08
质量，人与企业的共振点,1994-08-21,1994-08
管道运输  势在必行,1994-08-21,1994-08
西安汉斯的抠与不抠,1994-08-21,1994-08
邯郸农行建立激励约束机制,1994-08-21,1994-08
北京爱立信通信系统有限公司成立,1994-08-21,1994-08
一九九四国际皮革制品展览会开幕,1994-08-21,1994-08
泾南公司三种产品同获金奖,1994-08-21,1994-08
中国烟草大厦开业,1994-08-21,1994-08
我高速公路护栏防腐达国际水平,1994-08-21,1994-08
我国受旱地区群众全力抗旱,1994-08-21,1994-08
建湖干群奋力抗旱保苗,1994-08-21,1994-08
西北石化设备总公司实行全方位服务,1994-08-21,1994-08
工商行政管理部门加强市场管理,1994-08-21,1994-08
“北航”稳步发展,1994-08-21,1994-08
这个党员像面旗,1994-08-21,1994-08
海军某基地党委深入基层办实事,1994-08-21,1994-08
’９４国际家庭年家庭文化博览会举行,1994-08-21,1994-08
迈向人事管理法制化,1994-08-21,1994-08
张东志勇斗歹徒受重奖,1994-08-21,1994-08
《军事家带兵故事》出版发行,1994-08-21,1994-08
淅川县法院树立良好社会形象,1994-08-21,1994-08
岔尖派出所严打弄事犯罪,1994-08-21,1994-08
民兵辛成响拾巨款归还失主,1994-08-21,1994-08
武警北京某支队为基层办实事,1994-08-21,1994-08
济宁重视青少年国防教育,1994-08-21,1994-08
海城加强对干部审计考核,1994-08-21,1994-08
全军力学计量中心积极培养人才,1994-08-21,1994-08
汤建民发明智能双拼汉字输入法,1994-08-21,1994-08
江苏科技兴省战略见成效,1994-08-21,1994-08
福建农村打击刑事犯罪群众称快,1994-08-21,1994-08
太行出了个经济沟,1994-08-21,1994-08
曹光琳同志逝世,1994-08-21,1994-08
张子华同志逝世,1994-08-21,1994-08
外事简讯,1994-08-21,1994-08
信息“金桥”架瓯越,1994-08-21,1994-08
千年“天书”再现舞台,1994-08-21,1994-08
青岛反腐败斗争不断深入,1994-08-21,1994-08
北京举行万人签名活动,1994-08-21,1994-08
中澳签订南海珠江口盆地石油勘探合同,1994-08-21,1994-08
两名中国人在阿尔及尔遭枪击遇难,1994-08-21,1994-08
两名被害中国人遗体运回北京,1994-08-21,1994-08
要遵循日中邦交正常化的基本原则,1994-08-21,1994-08
一位质朴可敬的将军,1994-08-21,1994-08
杰出的共产主义战士陈少敏,1994-08-21,1994-08
愿言思德  以昭来者,1994-08-21,1994-08
克林顿重申对古巴难民政策,1994-08-21,1994-08
古表示愿同美讨论移民问题,1994-08-21,1994-08
绝不允许对军事设施作“特别核查”,1994-08-21,1994-08
老挝国家主席冯沙万访越,1994-08-21,1994-08
柏林群众集会悼念台尔曼,1994-08-21,1994-08
韦尔纳葬礼在布鲁塞尔举行,1994-08-21,1994-08
乌兹别克斯坦外长易人,1994-08-21,1994-08
罗马尼亚政府部分改组,1994-08-21,1994-08
科伊边界记实,1994-08-21,1994-08
阿拉法特会见挪以外长,1994-08-21,1994-08
白水案又起风波,1994-08-21,1994-08
以外长首次访问加沙,1994-08-21,1994-08
两名中国技术人员在阿遇害,1994-08-21,1994-08
遗体运送回国仪式隆重举行,1994-08-21,1994-08
巴以举行秘密会谈,1994-08-21,1994-08
卡洛斯落网前后,1994-08-21,1994-08
美财政部首席法律顾问辞职,1994-08-21,1994-08
法结束对卢旺达军事干预,1994-08-21,1994-08
波黑塞族选出新政府,1994-08-21,1994-08
巴西科学家发现新病毒,1994-08-21,1994-08
远南运动会各项准备工作就绪,1994-08-21,1994-08
首届金山岭长城越野攀登赛１０月举行,1994-08-21,1994-08
北京武术队培养出一批高手,1994-08-21,1994-08
全国大学生田径锦标赛在泉城举行,1994-08-21,1994-08
争取金牌总数第一,1994-08-21,1994-08
羊城与你同行,1994-08-21,1994-08
全国海滩自行车赛将举行,1994-08-21,1994-08
江宇杯老同志康乐象棋赛决出小组名次,1994-08-21,1994-08
黄力平莫慧兰捧杯,1994-08-21,1994-08
向贫困宣战的国际合作典范,1994-08-21,1994-08
世行初级产品价格指数上升近１７％,1994-08-21,1994-08
呼吁解决住房就业,1994-08-21,1994-08
印支科技会议强调合作发展,1994-08-21,1994-08
首家巴私人银行开业,1994-08-21,1994-08
日元再度大幅升值,1994-08-21,1994-08
“奋进”号将更换发动机,1994-08-21,1994-08
秦兵马俑在韩展出,1994-08-21,1994-08
向巴勒斯坦人提供援助,1994-08-21,1994-08
中国签署一项国际船舶公约,1994-08-21,1994-08
东南亚食品业看好,1994-08-21,1994-08
印航盈利增加,1994-08-21,1994-08
索非亚—汉城航线将开通,1994-08-21,1994-08
中国银行在加开业,1994-08-21,1994-08
环境标志表明什么,1994-08-21,1994-08
卫星云图何处来,1994-08-21,1994-08
光卡——２１世纪电子病历,1994-08-21,1994-08
脑力劳动者的营养食品,1994-08-21,1994-08
防止自我感染和中毒,1994-08-21,1994-08
京城重现保管箱,1994-08-21,1994-08
书画题跋时令称谓,1994-08-21,1994-08
我国古代最早的专科学校,1994-08-21,1994-08
草船借箭,1994-08-21,1994-08
民族振兴的强大精神支柱,1994-08-22,1994-08
加强宏观调控  整顿流通秩序  规范农资市场,1994-08-22,1994-08
《小平同志您好》摄影展在京举行,1994-08-22,1994-08
《邓小平治军方法研究》出版,1994-08-22,1994-08
乔石会见瓦努阿图议会代表团,1994-08-22,1994-08
北京地区天气预报,1994-08-22,1994-08
水利部率先进藏调查研究,1994-08-22,1994-08
不要都责怪乡干部,1994-08-22,1994-08
龙山镇鼓励企业到农村办“助民车间”,1994-08-22,1994-08
巧借蜘蛛百万兵,1994-08-22,1994-08
禹城看养牛,1994-08-22,1994-08
通贤乡水管组管水又管田,1994-08-22,1994-08
云南农副产品收购资金安排就绪,1994-08-22,1994-08
我们乡里的几统一,1994-08-22,1994-08
安徽农行系统全力支持抗旱,1994-08-22,1994-08
商丘生化厂与棉农签订治虫合同,1994-08-22,1994-08
大同农村扎扎实实奔小康,1994-08-22,1994-08
编者按,1994-08-22,1994-08
高扬时代主旋律,1994-08-22,1994-08
让社会更文明更进步,1994-08-22,1994-08
净化心灵的课堂,1994-08-22,1994-08
发展需要和谐的环境,1994-08-22,1994-08
生动有效的思想教育,1994-08-22,1994-08
广大党员干部深入学习《邓选》第三卷,1994-08-22,1994-08
报刊要靠高质量和合法经营壮大自己,1994-08-22,1994-08
李铁映会见竹下登和平山郁夫,1994-08-22,1994-08
地方外事部门要成为党和政府得力助手,1994-08-22,1994-08
敦煌文物保护研究陈列中心落成,1994-08-22,1994-08
郭安娜女士遗体告别仪式在沪举行,1994-08-22,1994-08
展示特殊体育才华,1994-08-22,1994-08
北京中小学百队足球赛结束,1994-08-22,1994-08
挑战者正年轻,1994-08-22,1994-08
百位女同志获全国计划生育优秀女工作者称号,1994-08-22,1994-08
大连队在广州受阻,1994-08-22,1994-08
甘肃唱红文艺经济两台戏,1994-08-22,1994-08
第七届老同志象棋赛收枰,1994-08-22,1994-08
也说写短文章,1994-08-22,1994-08
邓小平经济思想的战略意义,1994-08-22,1994-08
谴责美设立古巴难民营,1994-08-22,1994-08
对古巴进行新制裁,1994-08-22,1994-08
意大利“空城季”,1994-08-22,1994-08
俄德在莫斯科讨论核走私问题,1994-08-22,1994-08
卡拉季奇和马尔蒂奇建议塞族联合,1994-08-22,1994-08
土井议长出访亚洲三国,1994-08-22,1994-08
欧盟推出亚洲战略,1994-08-22,1994-08
中美洲国家反对军事入侵海地,1994-08-22,1994-08
德新纳粹分子“行动”受挫,1994-08-22,1994-08
以军打死打伤７名巴勒斯坦人,1994-08-22,1994-08
斯重视发展与东南亚国家的关系,1994-08-22,1994-08
外贸逆差堆叠  美元疲软依旧,1994-08-22,1994-08
强调致力持续发展,1994-08-22,1994-08
东盟经济区生机勃勃,1994-08-22,1994-08
中尼联合考察加德满都至拉萨公路,1994-08-22,1994-08
美铁路系统用计算机改进货运服务,1994-08-22,1994-08
芬研制飞机安全探测器,1994-08-22,1994-08
日本人口增长率刷新历史最低纪录,1994-08-22,1994-08
孟加拉国一渡船翻沉,1994-08-22,1994-08
科西嘉岛大火毁林１．６万公顷,1994-08-22,1994-08
突尼斯火车相撞伤亡严重,1994-08-22,1994-08
中哈商品贷款协议执行顺利,1994-08-22,1994-08
世界灾害加剧,1994-08-22,1994-08
北美贸易协定奏效,1994-08-22,1994-08
导电塑膜用于太阳能发电,1994-08-22,1994-08
美电脑厂家争夺教育市场,1994-08-22,1994-08
健步风雨兼程,1994-08-22,1994-08
红柳红桑红玫瑰,1994-08-22,1994-08
军营（外一首）,1994-08-22,1994-08
最好的抚慰,1994-08-22,1994-08
艺文短波,1994-08-22,1994-08
大地书讯,1994-08-22,1994-08
云横九派浮黄鹤（书法）,1994-08-22,1994-08
春水（中国画）,1994-08-22,1994-08
理直气壮管好农资市场,1994-08-23,1994-08
一个脚窝一支歌,1994-08-23,1994-08
江泽民主席将访问欧洲三国,1994-08-23,1994-08
八届人大常委会第９次会议２４日召开,1994-08-23,1994-08
奖励十位杰出科学家,1994-08-23,1994-08
乔石会见蒙古大呼拉尔主席,1994-08-23,1994-08
江泽民会见法国客人,1994-08-23,1994-08
江泽民会见竹下登平山郁夫,1994-08-23,1994-08
第四届中国艺术节文艺演出进入高潮,1994-08-23,1994-08
北京地区天气预报,1994-08-23,1994-08
加快商品粮基地建设,1994-08-23,1994-08
力争秋季农业好收成,1994-08-23,1994-08
江西工商行帮６０家企业扭亏增盈,1994-08-23,1994-08
扭亏更要从内部使劲,1994-08-23,1994-08
我国棉花生产形势明显好转,1994-08-23,1994-08
邯郸市石油化工厂走出困境,1994-08-23,1994-08
天津危房改造靠改革攻坚,1994-08-23,1994-08
甘肃为艺术节专项保险,1994-08-23,1994-08
绍兴推出病人保险业务,1994-08-23,1994-08
清原儿童保险一保多得,1994-08-23,1994-08
血肉相连,1994-08-23,1994-08
时代需要这样的公仆,1994-08-23,1994-08
吉林：全面铺开,1994-08-23,1994-08
青岛：稳步推进,1994-08-23,1994-08
徐州农村基层组织增强活力,1994-08-23,1994-08
洋浦开发区法院成立,1994-08-23,1994-08
西南民族法制建设走上健康发展轨道,1994-08-23,1994-08
清正廉洁“一班人”,1994-08-23,1994-08
抚顺市抓军转干部培训有新招,1994-08-23,1994-08
郑广斌爱兵育人受表彰,1994-08-23,1994-08
二○八医院重视人才培养引进,1994-08-23,1994-08
邯郸拥军优属工作注重实效,1994-08-23,1994-08
某部军工段春会绝技献军营,1994-08-23,1994-08
驻藏边防某团大力发展农副业,1994-08-23,1994-08
陈进忠勇救落水少年,1994-08-23,1994-08
最后一天,1994-08-23,1994-08
柳铁公安局服务于民,1994-08-23,1994-08
３０位优秀民办教师代表在京受表彰,1994-08-23,1994-08
昌图粮食系统一批案犯受到严惩,1994-08-23,1994-08
浙江沿海百万军民奋起抗击台风,1994-08-23,1994-08
邓小平著作研究系统电脑软件出版发行,1994-08-23,1994-08
“远南”荧屏色彩纷呈,1994-08-23,1994-08
大型系列活动献“远南”,1994-08-23,1994-08
世界女排大奖赛第一阶段结束,1994-08-23,1994-08
青少年宫棋赛育新苗,1994-08-23,1994-08
李铁映看望敦煌研究院工作人员,1994-08-23,1994-08
发挥地方优势促进经济发展,1994-08-23,1994-08
沙漠之舟成功漂流新疆和田河,1994-08-23,1994-08
“刀美兰酒楼”的故事,1994-08-23,1994-08
全国记协授予杨晔“忠于职守、英勇献身的优秀新闻工作者”称号,1994-08-23,1994-08
第八届中国地市报新闻奖评选结果揭晓,1994-08-23,1994-08
赵梅生画展在京举行,1994-08-23,1994-08
叶尚志诗词书法展在京举办,1994-08-23,1994-08
《中国新闻年鉴》（一九九三年版）出版,1994-08-23,1994-08
中国沈阳国际民间舞蹈（秧歌）节将举行,1994-08-23,1994-08
学校收费乱  不治不得了,1994-08-23,1994-08
学校创收的误区,1994-08-23,1994-08
事实过得硬  不怕当被告,1994-08-23,1994-08
听来的不一定“属实”,1994-08-23,1994-08
数据是“假设”的,1994-08-23,1994-08
《住手》图不符实,1994-08-23,1994-08
市场竞争呼唤《反暴利法》,1994-08-23,1994-08
名牌车咋也糊弄人？,1994-08-23,1994-08
病害肉上市渠道多,1994-08-23,1994-08
不为名利写人生  甘作孩子引路人,1994-08-23,1994-08
俄采取措施吸引外资,1994-08-23,1994-08
墨西哥举行大选,1994-08-23,1994-08
将竞选秘鲁总统,1994-08-23,1994-08
俄德签署备忘录,1994-08-23,1994-08
美众院通过打击犯罪法案,1994-08-23,1994-08
巴以和谈两首脑同被提名候选人,1994-08-23,1994-08
约巴恢复协调磋商,1994-08-23,1994-08
以推迟开放加杰通道,1994-08-23,1994-08
中国驻曼德勒总领馆开馆,1994-08-23,1994-08
泰贸易院主席遇空难逝世,1994-08-23,1994-08
美中止对莱索托经济援助,1994-08-23,1994-08
哈斯布拉托夫呼吁车臣总统辞职,1994-08-23,1994-08
北约将同和平伙伴国联合演习,1994-08-23,1994-08
迎接第六届“远南”运动会,1994-08-23,1994-08
印度残疾人的希望列车,1994-08-23,1994-08
同在蓝天下,1994-08-23,1994-08
平等  参与  贡献,1994-08-23,1994-08
刻苦训练迎“远南”,1994-08-23,1994-08
自信·自强·自立,1994-08-23,1994-08
华晶——“头号”,1994-08-23,1994-08
评奖不收费,1994-08-23,1994-08
名人要惜名,1994-08-23,1994-08
明年夏天喝什么？,1994-08-23,1994-08
阿静粤菜还能“火”,1994-08-23,1994-08
商海小品,1994-08-23,1994-08
何勇的治厂风格,1994-08-23,1994-08
“新科”音响后来居上,1994-08-23,1994-08
振动式离心机在泰兴问世,1994-08-23,1994-08
时代逆变焊机批量生产,1994-08-23,1994-08
“环溪”啤酒畅销不衰,1994-08-23,1994-08
皇家“ＨＢ”啤酒挤进北京,1994-08-23,1994-08
“字声”装置进入市场,1994-08-23,1994-08
灾害面前的启示,1994-08-23,1994-08
风雪高原写伟业,1994-08-23,1994-08
雨中的歌声,1994-08-23,1994-08
“骆驼和羊”的启示,1994-08-23,1994-08
中国青工技能月活动将展开,1994-08-23,1994-08
青年问题研讨会在京举行,1994-08-23,1994-08
迎接市场经济的挑战,1994-08-23,1994-08
力保一方净土,1994-08-23,1994-08
责任,1994-08-23,1994-08
盈盈一水探古今,1994-08-23,1994-08
探索资源配置的“第三只手”,1994-08-23,1994-08
“盛世修庙”,1994-08-23,1994-08
出版界的一块“绿洲”,1994-08-23,1994-08
持之有据  言之成理,1994-08-23,1994-08
晴山霞居,1994-08-23,1994-08
《读书消夏》读后,1994-08-23,1994-08
想到筷子,1994-08-23,1994-08
楼下那条小街,1994-08-23,1994-08
冲出思想的夔门,1994-08-24,1994-08
向环卫工人致敬,1994-08-24,1994-08
确保副食品市场稳定,1994-08-24,1994-08
李鹏会见竹下登,1994-08-24,1994-08
外商必须严格遵守我国法律法规,1994-08-24,1994-08
胡锦涛会见日本先驱新党代表团,1994-08-24,1994-08
北京查处殴打环卫工人事件,1994-08-24,1994-08
《邓小平文选》第三卷英文版出版发行,1994-08-24,1994-08
限期压缩一千万棉纺锭,1994-08-24,1994-08
俄热情期待江泽民主席访问,1994-08-24,1994-08
北京地区天气预报,1994-08-24,1994-08
精心吊装,1994-08-24,1994-08
石家庄纺织业效益名列前茅,1994-08-24,1994-08
平顶山推行目标成本管理扭亏增盈,1994-08-24,1994-08
敕勒川上的阴云,1994-08-24,1994-08
创造中国饮料名牌,1994-08-24,1994-08
海关严厉打击骗退税活动,1994-08-24,1994-08
为国家挽回数千万元损失,1994-08-24,1994-08
中旅集团走旅工贸相结合之路,1994-08-24,1994-08
江西省为灾区调运降价化肥,1994-08-24,1994-08
北铁局打击破坏铁路行为,1994-08-24,1994-08
丹铁分局打“外鬼”挖“内贼”,1994-08-24,1994-08
抚顺十五万独生子女全部“保险”,1994-08-24,1994-08
湛江进口货运险业务增长势头猛,1994-08-24,1994-08
宜兴均陶琉璃瓦首销新加坡,1994-08-24,1994-08
九四中国古钟博览会将在京举行,1994-08-24,1994-08
特制黄山烟获“金烟斗”奖,1994-08-24,1994-08
美半导体公司扩大对华合作,1994-08-24,1994-08
国内旅行社将设旅客损失赔偿保证金,1994-08-24,1994-08
严惩破坏铁路者（编后）,1994-08-24,1994-08
“隐姓埋名一辈子”,1994-08-24,1994-08
为纤维板行业带来广阔前景,1994-08-24,1994-08
这不是“天方夜谭”,1994-08-24,1994-08
肿瘤与微循环状态密切相关,1994-08-24,1994-08
简讯,1994-08-24,1994-08
《中国二十世纪文学研究论著提要》问世,1994-08-24,1994-08
《中华五千年》历史知识竞赛揭晓,1994-08-24,1994-08
“人的价值”征文比赛颁奖,1994-08-24,1994-08
娄底地区开发技术密集型产品,1994-08-24,1994-08
大兴安岭林区有效控制森林病虫害,1994-08-24,1994-08
防病毒农药使蔬菜更新鲜,1994-08-24,1994-08
甘肃唱好经济发展“重头戏”,1994-08-24,1994-08
中央工作组到浙江灾区慰问,1994-08-24,1994-08
办实事与留政绩,1994-08-24,1994-08
浙闽遇难渔工家属赴台处理善后事宜,1994-08-24,1994-08
坚决制止“收费约稿”,1994-08-24,1994-08
第二届中国长春电影节开幕,1994-08-24,1994-08
中国人民大学授予竹下登名誉博士学位,1994-08-24,1994-08
“远南”运动员村昨日封村,1994-08-24,1994-08
中国台北选手正式报名,1994-08-24,1994-08
北京—北戴河公路自行车赛形成传统,1994-08-24,1994-08
中银将于１９９５年准时在澳门发钞,1994-08-24,1994-08
男女团体赛产生四强,1994-08-24,1994-08
瑞士信贷银行与中国进出口银行签订代理行协议,1994-08-24,1994-08
将参加亚运会男子足球赛,1994-08-24,1994-08
外事简讯,1994-08-24,1994-08
《再造中华辉煌——邓小平纪事》出版,1994-08-24,1994-08
纪念《为人民服务》发表５０周年,1994-08-24,1994-08
西藏内地学生“手拉手”交朋友,1994-08-24,1994-08
甲午战争的历史思考,1994-08-24,1994-08
市场经济与政治发展,1994-08-24,1994-08
“跨文化培训”,1994-08-24,1994-08
损人又害己,1994-08-24,1994-08
墨西哥选举总统,1994-08-24,1994-08
迟浩田抵津巴布韦访问,1994-08-24,1994-08
约巴协调磋商会谈结束,1994-08-24,1994-08
村山出访东南亚  首站抵达马尼拉,1994-08-24,1994-08
古外长说不怕美封锁威胁,1994-08-24,1994-08
阿新宪法重申对马岛主权,1994-08-24,1994-08
荷兰新政府宣誓就职,1994-08-24,1994-08
土空军轰炸库尔德工人党基地,1994-08-24,1994-08
比在逃陆军司令在西被捕,1994-08-24,1994-08
秘鲁当局逮捕大批恐怖分子,1994-08-24,1994-08
美元又跌  欧股不振,1994-08-24,1994-08
中韩直接贸易额上升,1994-08-24,1994-08
推进欧洲一体化,1994-08-24,1994-08
美国一家大好人,1994-08-24,1994-08
英拟试验男性避孕药,1994-08-24,1994-08
万国邮盟大会召开,1994-08-24,1994-08
巴拿马运河过船近八十万,1994-08-24,1994-08
马来西亚重振橡胶业,1994-08-24,1994-08
陇上艺苑春又浓,1994-08-24,1994-08
丝路的瑰宝  文明的见证,1994-08-24,1994-08
甘肃文物资源的五大优势,1994-08-24,1994-08
第四届中国艺术节五条旅游专线,1994-08-24,1994-08
《从辉煌走向辉煌》,1994-08-24,1994-08
九色鹿,1994-08-24,1994-08
甘肃艺坛人才辈出,1994-08-24,1994-08
北京地区天气预报,1994-08-25,1994-08
办法就在群众中,1994-08-25,1994-08
“鸣岐不让”,1994-08-25,1994-08
马里总理凯塔,1994-08-25,1994-08
下半年不再出台新的调价措施,1994-08-25,1994-08
八届人大常委会第九次会议开幕,1994-08-25,1994-08
党中央国务院致电慰问,1994-08-25,1994-08
农业部要求抓好棉田后期管理,1994-08-25,1994-08
江泽民会见蒙古大呼拉尔主席,1994-08-25,1994-08
工行２７名分行正副行长辞去公司兼职,1994-08-25,1994-08
太原唐山着力稳定副食品市场,1994-08-25,1994-08
警惕农民负担“反弹”,1994-08-25,1994-08
向沙漠要粮棉油肉,1994-08-25,1994-08
浙江４１０万干群投入抗旱,1994-08-25,1994-08
全绿委等要求造林争创“四佳”,1994-08-25,1994-08
莆田农行上半年放贷２亿多元,1994-08-25,1994-08
安源区乡镇企业步入良性发展轨道,1994-08-25,1994-08
新野“菜园子”造福一方居民,1994-08-25,1994-08
瓜果飘香在沈大,1994-08-25,1994-08
桐柏依靠渔业反哺水利,1994-08-25,1994-08
香河１６万亩薄地变良田,1994-08-25,1994-08
基层干部渴望理解与支持,1994-08-25,1994-08
工作重实效  接待讲方法,1994-08-25,1994-08
黔东南涌现出民族专业村寨,1994-08-25,1994-08
专家与农民,1994-08-25,1994-08
全国人大法律委员会就三部法律,1994-08-25,1994-08
草案的修改情况向常委会作说明,1994-08-25,1994-08
