莫斯塔尔克族宣布宵禁,1996-02-09,1996-02
摩洛哥和西班牙加强合作（短讯）,1996-02-09,1996-02
波罗的海三国外长会晤（短讯）,1996-02-09,1996-02
波黑战争三年余损失四百五十亿,1996-02-09,1996-02
中美举行副外长级政治磋商,1996-02-09,1996-02
匈维和士兵违纪被遣送回国（短讯）,1996-02-09,1996-02
波黑和平进程又遇难题（述评）,1996-02-09,1996-02
驳斥『中国威胁论』,1996-02-09,1996-02
联合国：金永健明石康出任副秘书长,1996-02-09,1996-02
波兰成立新政府,1996-02-09,1996-02
一波音客机失事,1996-02-09,1996-02
韩国三星公司向我云南地震灾区捐款,1996-02-09,1996-02
看好中国市场,1996-02-09,1996-02
泰将在华举办贸易展览会,1996-02-09,1996-02
印度储备银行采取措施阻止卢比下跌,1996-02-09,1996-02
转基因西红柿酱在英上市,1996-02-09,1996-02
夸克可能并非宇宙最基本粒子,1996-02-09,1996-02
蜜蜂靠地面标志辨向,1996-02-09,1996-02
天文学家发现最远的星系,1996-02-09,1996-02
法四军人将赴北极探险,1996-02-09,1996-02
美向３９个国家和地区输出钚,1996-02-09,1996-02
联合国呼吁向贫困开战,1996-02-09,1996-02
菲律宾人口到２０００年将达１亿,1996-02-09,1996-02
美取消向我出售卫星限制,1996-02-09,1996-02
人民币市场汇价,1996-02-09,1996-02
黎巴嫩精简私营广播电台和电视台,1996-02-09,1996-02
国际资金流向何处？,1996-02-09,1996-02
泰国将限制汽车进口,1996-02-09,1996-02
欧盟失业率上扬,1996-02-09,1996-02
巴基斯坦棉花大幅度增产,1996-02-09,1996-02
’９６东京国际图书博览会开幕,1996-02-09,1996-02
重视教练水平的提高,1996-02-09,1996-02
亚冬会奖牌榜,1996-02-09,1996-02
邂逅叶乔波,1996-02-09,1996-02
友人之见,1996-02-09,1996-02
和即小胜,1996-02-09,1996-02
日本难称老大,1996-02-09,1996-02
太阳·冰雪·亚细亚,1996-02-09,1996-02
亚冬会赛事争夺日趋激烈,1996-02-09,1996-02
想起“老鼠嫁女”,1996-02-09,1996-02
新春快乐（剪纸）,1996-02-09,1996-02
今年压岁  谁家招高,1996-02-09,1996-02
过年啦……,1996-02-09,1996-02
小心扒手,1996-02-09,1996-02
别样的情怀,1996-02-09,1996-02
阖家欢乐（美术）,1996-02-09,1996-02
春节话健康,1996-02-09,1996-02
患者过年有禁忌（家庭医疗救护⒃）,1996-02-09,1996-02
传递高尚的信息,1996-02-09,1996-02
“兴猪工程”富梨树,1996-02-09,1996-02
１９９５年各省（市、区）农村经济十大新闻（七）,1996-02-09,1996-02
救  种,1996-02-09,1996-02
千里卖蟹记,1996-02-09,1996-02
人工降雨炮弹质量堪忧（来信）,1996-02-09,1996-02
讨讨『失败经』,1996-02-09,1996-02
一个中国汉子和一个日本老头的治沙缘,1996-02-09,1996-02
北京『百款春联送祝福』活动拉开帷幕,1996-02-09,1996-02
历史文化遗产：“城市更新”中的反思,1996-02-09,1996-02
节奏中的舞蹈,1996-02-09,1996-02
军旅话剧：在表现崇高中定位,1996-02-09,1996-02
塞万提斯纪念碑,1996-02-09,1996-02
北京有线台推出《约会星期天》,1996-02-09,1996-02
水华，再也听不到你的声音了,1996-02-09,1996-02
主角发难（并非讽刺武松）  （美术）,1996-02-09,1996-02
唯有崇高更感人,1996-02-09,1996-02
少来点这种『包装』,1996-02-09,1996-02
中国健儿重登金牌榜首,1996-02-10,1996-02
北京地区天气预报,1996-02-10,1996-02
江泽民会见刚果外长,1996-02-10,1996-02
依靠科学技术推进两个文明建设,1996-02-10,1996-02
送你一条座右铭（今日谈）,1996-02-10,1996-02
江泽民会见法国外长,1996-02-10,1996-02
德国总统会见朱镕基,1996-02-10,1996-02
李鹏召集各民主党派全国工商联负责人无党派人士座谈,1996-02-10,1996-02
努力开创公安工作新局面,1996-02-10,1996-02
中英联合联络小组第三十五次会议取得进展,1996-02-10,1996-02
加强老龄问题对策研究,1996-02-10,1996-02
严格执法  热情服务,1996-02-10,1996-02
中印外交和军事专家小组在京举行会议,1996-02-10,1996-02
法国外长称访华取得积极成果,1996-02-10,1996-02
抓紧解决部分老同志生活困难,1996-02-10,1996-02
因地制宜讲求实效力戒形式主义,1996-02-10,1996-02
维护社会政治稳定  保卫经济建设,1996-02-10,1996-02
人行和香港金融管理局签署双边回购协议,1996-02-10,1996-02
保护环境首先要转变经济增长方式,1996-02-10,1996-02
格罗兹尼发生爆炸事件,1996-02-10,1996-02
朝要求美履行朝美框架协议,1996-02-10,1996-02
美控制边界墨表示担忧,1996-02-10,1996-02
墨西哥总统首访西欧（综述）,1996-02-10,1996-02
波黑塞族宣称报复穆克联邦,1996-02-10,1996-02
以权谋私提存款立陶宛总理丢官,1996-02-10,1996-02
贝·布托总理会见伊朗副外长,1996-02-10,1996-02
驳斥美对中国核试验问题攻击,1996-02-10,1996-02
曼德拉呼吁重建南非,1996-02-10,1996-02
继续推动葡中关系发展,1996-02-10,1996-02
越中友好团体举行酒会,1996-02-10,1996-02
安理会敦促安实现民族和解,1996-02-10,1996-02
批评富国向穷国出售武器,1996-02-10,1996-02
南非议会展览风波,1996-02-10,1996-02
缅拒绝向美引渡昆沙,1996-02-10,1996-02
美国：政府促销军火独霸全球市场（述评）,1996-02-10,1996-02
沙暴袭击埃及,1996-02-10,1996-02
友好往来,1996-02-10,1996-02
先管住自己,1996-02-10,1996-02
亚冬会奖牌榜,1996-02-10,1996-02
选准突破口,1996-02-10,1996-02
一心想着升旗,1996-02-10,1996-02
『我要告诉世界』,1996-02-10,1996-02
马晓春力挡强弩李昌镐中盘认输,1996-02-10,1996-02
柳州国际足球邀请赛明日决战,1996-02-10,1996-02
谢军慎对第七盘棋,1996-02-10,1996-02
世界汽车拉力锦标赛将在瑞典揭幕,1996-02-10,1996-02
冰雪盟主呼之欲出中哈相争已成定局,1996-02-10,1996-02
鳖王范海庭,1996-02-10,1996-02
一日不缺抓信访,1996-02-10,1996-02
新疆：巨报蔚成奇观,1996-02-10,1996-02
告别“穴居”喜乔迁,1996-02-10,1996-02
守志求本朱培立,1996-02-10,1996-02
交警讲文明市民怎么办,1996-02-10,1996-02
警惕宗族势力复活,1996-02-10,1996-02
“发展高科技  实现产业化”,1996-02-10,1996-02
哲学应成为实现现代化的思想武器（学术动态）,1996-02-10,1996-02
提高行政效率初探,1996-02-10,1996-02
不能把管理排斥在第一生产力之外,1996-02-10,1996-02
《名将孙胡子》出版,1996-02-10,1996-02
北京东城区新春文化活动多,1996-02-10,1996-02
愚公后代人,1996-02-10,1996-02
春风拂槛（中国画）,1996-02-10,1996-02
中缅边境片马行,1996-02-10,1996-02
书法,1996-02-10,1996-02
书  法,1996-02-10,1996-02
太平山夜色,1996-02-10,1996-02
春节感怀,1996-02-10,1996-02
佳节小吟,1996-02-10,1996-02
雪花的境界,1996-02-10,1996-02
我国铁路能大面积提速吗,1996-02-10,1996-02
请注意公共道德,1996-02-10,1996-02
无病何苦进“氧吧”,1996-02-10,1996-02
『纯天然』优于『人工合成』吗,1996-02-10,1996-02
中国传统文化的科学精神与人文精神,1996-02-10,1996-02
爱因斯坦说：“人的差异在于业余时间”,1996-02-10,1996-02
新邻居：对不起，我在墙上拍了一只苍蝇（美术）,1996-02-10,1996-02
春节当心火灾（今日谈）,1996-02-11,1996-02
上海市委坚持调查研究先行,1996-02-11,1996-02
北京地区天气预报,1996-02-11,1996-02
卢瑞华当选广东省省长,1996-02-11,1996-02
王乐泉当选新疆维吾尔自治区党委书记,1996-02-11,1996-02
李鹏同科教文卫等界代表座谈,1996-02-11,1996-02
中国冰雪健儿稳操胜券,1996-02-11,1996-02
调查研究是科学决策的基础,1996-02-11,1996-02
２８００亿美元：举足轻重进出口,1996-02-11,1996-02
全国侨联举行迎春茶话会,1996-02-11,1996-02
反腐倡廉关键在抓落实,1996-02-11,1996-02
提高中医药质量和效益,1996-02-11,1996-02
六十万三西移民安居乐业,1996-02-11,1996-02
以工代赈先进集体和个人受表彰,1996-02-11,1996-02
坚决整顿农资流通秩序,1996-02-11,1996-02
煤炭部团中央共同实施『阳光工程』,1996-02-11,1996-02
泰国上议院议长访问重庆,1996-02-11,1996-02
卢荣景当选安徽省政协主席,1996-02-11,1996-02
宗光耀感谢澳门同胞援助云南灾民,1996-02-11,1996-02
台湾是中国不可分割的领土,1996-02-11,1996-02
金钱观：一个重提的话题,1996-02-11,1996-02
黎促以从黎南部撤军,1996-02-11,1996-02
科尔会见朱镕基,1996-02-11,1996-02
总后大批御寒物资运抵云南灾区,1996-02-11,1996-02
中直机关设立颐中青年成材奖励基金,1996-02-11,1996-02
陈玉益当选海南省政协主席,1996-02-11,1996-02
中华环境资源奖和好新闻奖颁发,1996-02-11,1996-02
首都出版界举行座谈会,1996-02-11,1996-02
葡萄牙外长抵达澳门,1996-02-11,1996-02
与法国人共餐,1996-02-11,1996-02
阔佬坐牢付费,1996-02-11,1996-02
世界的未来在亚洲,1996-02-11,1996-02
鼓声相伴  乐趣多,1996-02-11,1996-02
苹果公司三大失策,1996-02-11,1996-02
土耳其不“土”,1996-02-11,1996-02
五十年前的划时代发明,1996-02-11,1996-02
北京中山公园将有迎春大游园,1996-02-11,1996-02
“祖国永远是春天”上演,1996-02-11,1996-02
阎维文出新唱片,1996-02-11,1996-02
俄罗斯国家模范民间舞蹈团来华,1996-02-11,1996-02
花开五度  新年盛情,1996-02-11,1996-02
漫话１９９６年邮票,1996-02-11,1996-02
李琦名作伟人国画仿真  暨《大地之子》画集出版,1996-02-11,1996-02
贺岁锣鼓大赛开幕,1996-02-11,1996-02
世界名歌合唱将上演,1996-02-11,1996-02
情满西站,1996-02-11,1996-02
饱蘸激情画农家,1996-02-11,1996-02
全冷冻液化气储库开工（新闻简报）,1996-02-12,1996-02
１９９６年记帐式（二期）国库券承销签字仪式举行,1996-02-12,1996-02
舒圣佑当选江西省省长,1996-02-12,1996-02
赞美超越,1996-02-12,1996-02
湖口县转变农业增长方式,1996-02-12,1996-02
５３８４亿元：税收三年三大步,1996-02-12,1996-02
第三届亚冬会在哈尔滨闭幕,1996-02-12,1996-02
辛集科技服务形成网络（新闻简报）,1996-02-12,1996-02
“上不愧党，下不愧兵”（今日谈）,1996-02-12,1996-02
驰骋在经济建设战场上,1996-02-12,1996-02
北京地区天气预报,1996-02-12,1996-02
『红旗』家族喜添『新丁』（新闻简报）,1996-02-12,1996-02
第二批甲级工程咨询单位认定,1996-02-12,1996-02
中韩海底光缆系统开通,1996-02-12,1996-02
京津连水陆联运客车滚装线开通,1996-02-12,1996-02
衢州建桥展新容,1996-02-12,1996-02
衡阳百万亩丘岗成“绿色银行”,1996-02-12,1996-02
打出三张外字牌  崛起一个富裕村,1996-02-12,1996-02
我国将举办国际超市及连锁店展,1996-02-12,1996-02
开篇的话,1996-02-12,1996-02
希望在山  效益在林（编后小议）,1996-02-12,1996-02
厦门建行推出住房公积金卡,1996-02-12,1996-02
河南卷烟工业实施名牌战略,1996-02-12,1996-02
万华公司创品牌增效益,1996-02-12,1996-02
徐州首期安居工程竣工,1996-02-12,1996-02
固安开发利用地热资源,1996-02-12,1996-02
集安建设绿色食品基地,1996-02-12,1996-02
负担，仍是沉重的话题,1996-02-12,1996-02
房山推广垦易微生物有机肥,1996-02-12,1996-02
古稀老农  心系国防,1996-02-12,1996-02
天远坚持向职工报告工作制度,1996-02-12,1996-02
民政部北京市慰问基层干部,1996-02-12,1996-02
把廉政作为后勤政治建设大事来抓,1996-02-12,1996-02
沈丘切实为群众办实事,1996-02-12,1996-02
加强经贸交流  促进两岸关系发展,1996-02-12,1996-02
引甘泉者得甘泉,1996-02-12,1996-02
“工作忙，不能忘国防”,1996-02-12,1996-02
海军设计局支援国家经济建设立新功,1996-02-12,1996-02
中国美协举行迎春茶话会,1996-02-12,1996-02
温州“海上长城”崛起东海之滨,1996-02-12,1996-02
《中国教育地图集》受到好评,1996-02-12,1996-02
现场短新闻征文开始,1996-02-12,1996-02
为布依族农民送春联,1996-02-12,1996-02
新疆去年１５万人脱贫,1996-02-12,1996-02
提倡自省（人民论坛）,1996-02-12,1996-02
廖鼎祥同志逝世,1996-02-12,1996-02
北京内蒙古湖南送文化下乡,1996-02-12,1996-02
马宅子居委会向社会捐资四十一万元,1996-02-12,1996-02
江阴党校为１０省培训干部两千人,1996-02-12,1996-02
甘肃解决百余万人饮水困难,1996-02-12,1996-02
香港举行“万众同心庆回归”大会,1996-02-12,1996-02
中国作协春节前夕慰问百名作家,1996-02-12,1996-02
通辽铁路公安处热心服务蒙族旅客,1996-02-12,1996-02
京郊农民出资办庙会,1996-02-12,1996-02
劝世良言五字歌（摘  登）,1996-02-12,1996-02
二六一医院重视计生工作,1996-02-12,1996-02
骨康制剂缩短疗程,1996-02-12,1996-02
一名极重度一氧化碳中毒者获救,1996-02-12,1996-02
不折不扣地依法收费,1996-02-12,1996-02
数百例再障贫血病患者在石市治愈,1996-02-12,1996-02
中药材市场不能再乱下去了,1996-02-12,1996-02
《劝世良言五字歌》风靡中原,1996-02-12,1996-02
康得为地铁“洗澡”,1996-02-12,1996-02
国际儒联举行春节联谊会,1996-02-12,1996-02
中国教育电视台开辟“万婴跟踪”栏目,1996-02-12,1996-02
波黑政府释放四名塞族人,1996-02-12,1996-02
韩日岛屿争端升级,1996-02-12,1996-02
亚欧关系新篇章,1996-02-12,1996-02
哈外长谈哈中关系及对外政策,1996-02-12,1996-02
一周国际要闻回顾（２月４日至１１日）,1996-02-12,1996-02
伊朗重申不与美以发展关系,1996-02-12,1996-02
扎将陆续关闭卢难民营,1996-02-12,1996-02
伦敦发生严重爆炸事件,1996-02-12,1996-02
格罗兹尼反政府集会结束俄政府提出撤军必要条件,1996-02-12,1996-02
韩日岛屿之争（综述）,1996-02-12,1996-02
阿反对党领导人聚会,1996-02-12,1996-02
美国务卿与俄新外长首次会谈,1996-02-12,1996-02
波外长强调发展对华关系,1996-02-12,1996-02
泰副总理接见本报代表团,1996-02-12,1996-02
以色列两反对党将结盟参加大选,1996-02-12,1996-02
阿尔及利亚发生炸弹爆炸事件,1996-02-12,1996-02
国外门面艺术掠影,1996-02-12,1996-02
西林追悼会在莫斯科举行,1996-02-12,1996-02
多米尼加停止寻找失事飞机幸存者的行动,1996-02-12,1996-02
阿根廷巴西巴拉圭签署联合扫毒协议,1996-02-12,1996-02
法鼓励发展绿色石油,1996-02-12,1996-02
乌邪教头目被判刑,1996-02-12,1996-02
巴拿马商船队总吨位名列世界第一,1996-02-12,1996-02
患难见真情,1996-02-12,1996-02
瑞士钟表出口出现下降,1996-02-12,1996-02
叙伊两国协调立场,1996-02-12,1996-02
科威特外籍工人来自一百三十二个国家,1996-02-12,1996-02
巴西限制短期外资流入,1996-02-12,1996-02
国际社会关注我云南震灾,1996-02-12,1996-02
美国电视暴力泛滥成灾,1996-02-12,1996-02
德国失业人数创战后纪录,1996-02-12,1996-02
菲总统正式邀请亚太经合组织成员十一月在苏比克湾会晤,1996-02-12,1996-02
尼日利亚四百多人死于脑膜炎,1996-02-12,1996-02
中国红十字会向马达加斯加赠款,1996-02-12,1996-02
亚冬会奖牌榜,1996-02-12,1996-02
田径连出新纪录,1996-02-12,1996-02
中国杨扬日本渡边充榜上有名,1996-02-12,1996-02
中国女子冰球队一金定乾坤,1996-02-12,1996-02
男篮联赛第十八轮风平浪静,1996-02-12,1996-02
失前蹄 马晓春负于曹氏   四连冠 韩国队稳占擂台,1996-02-12,1996-02
黑白胡子联手施计  大波尔加又搬援兵,1996-02-12,1996-02
中国队出师不利,1996-02-12,1996-02
来信点滴（九版）,1996-02-12,1996-02
谨防『心灵之窗』受损,1996-02-12,1996-02
“‘３·１５’，让消费者说好”调查问卷,1996-02-12,1996-02
燕赵新农民,1996-02-12,1996-02
送瘟神（美术）,1996-02-12,1996-02
冬天里的春天,1996-02-12,1996-02
恭喜发财,1996-02-12,1996-02
好日子攥在自己手里,1996-02-12,1996-02
给土地留份『压岁钱』,1996-02-12,1996-02
夫妻擂台赛,1996-02-12,1996-02
体育“补课”的启示,1996-02-12,1996-02
保护文物小分队,1996-02-12,1996-02
濮阳市农行向班主任颁奖,1996-02-12,1996-02
香港举办“教师周”活动,1996-02-12,1996-02
毛毛丝雨润童心,1996-02-12,1996-02
冯玉祥泰山办学,1996-02-12,1996-02
澳大利亚高等教育新变化,1996-02-12,1996-02
高学历者应有高素质,1996-02-12,1996-02
扶本方能祛邪,1996-02-12,1996-02
马来西亚改组教育部,1996-02-12,1996-02
江泽民会见葡共总书记,1996-02-13,1996-02
控制物价千万不能放松,1996-02-13,1996-02
江泽民胡锦涛观看俄民间舞蹈团演出,1996-02-13,1996-02
首批农业产业化发展项目启动,1996-02-13,1996-02
在京老同志欢聚一堂共迎新春,1996-02-13,1996-02
北京地区天气预报,1996-02-13,1996-02
太保承保亚太１Ａ号卫星发射运行,1996-02-13,1996-02
宋宝瑞当选四川省省长,1996-02-13,1996-02
国家加大三峡工程投入,1996-02-13,1996-02
各地积极采取措施灾民口粮供应落实,1996-02-13,1996-02
新挂历与老黄历（今日谈）,1996-02-13,1996-02
北京旅游业挑大梁,1996-02-13,1996-02
黑龙江补齐“一条腿”,1996-02-13,1996-02
鲍店矿质量体系通过认证,1996-02-13,1996-02
中国工商银行表彰济南工商行,1996-02-13,1996-02
河南建成防伪陶瓷瓶生产线,1996-02-13,1996-02
放小是为了放活（’９６工业大视角⑥）,1996-02-13,1996-02
江苏最大秧盘生产线在海安建成,1996-02-13,1996-02
沿山集团四十万吨炼钢项目进展顺利,1996-02-13,1996-02
查荒灭荒  复耕还田,1996-02-13,1996-02
中意美将联合开发塔里木石油,1996-02-13,1996-02
呼吁社会各界支援老区建设,1996-02-13,1996-02
利民生财（编后）,1996-02-13,1996-02
广告业要为精神文明建设做贡献,1996-02-13,1996-02
建行邢台分行存款突破２０亿元,1996-02-13,1996-02
减负，刻不容缓,1996-02-13,1996-02
新乡研制出家用冷暖锅炉,1996-02-13,1996-02
『送温暖专业户』,1996-02-13,1996-02
顾少光伏法其他罪犯受到严惩,1996-02-13,1996-02
沈铁分局受灾职工安居乐业,1996-02-13,1996-02
各级工会加强宣传思想工作,1996-02-13,1996-02
平凡岗位  大写人生,1996-02-13,1996-02
评李登辉的政治广告———“经营大台湾  建立新中原”,1996-02-13,1996-02
绍兴书法展在京举行,1996-02-13,1996-02
大型问卷调查活动开始举办,1996-02-13,1996-02
驻京部队支持交警维护交通安全,1996-02-13,1996-02
亚冬会隆重热烈精彩圆满,1996-02-13,1996-02
要满腔热忱地支援老区建设,1996-02-13,1996-02
万里海疆涌动双拥春潮,1996-02-13,1996-02
筹委会将进行研究拿出方案,1996-02-13,1996-02
葡萄牙外长抵京,1996-02-13,1996-02
哈萨克斯坦外长抵京,1996-02-13,1996-02
李铁映会见柬埔寨客人,1996-02-13,1996-02
抓好文化下乡活动  改善农村社会风气,1996-02-13,1996-02
韩国向云南地震灾区捐款,1996-02-13,1996-02
“九五”医药科技攻关目标确定,1996-02-13,1996-02
加强妇女儿童事业宣传力度,1996-02-13,1996-02
中小学幼教奖励基金会举行迎春茶话会,1996-02-13,1996-02
北京中医药大学实施三级教学管理体制,1996-02-13,1996-02
贵州人民出版社异军突起,1996-02-13,1996-02
四川实施“千亿工程”,1996-02-13,1996-02
院士『再造』金厂峪企业登门谢『财神』,1996-02-13,1996-02
合理设置学校是关键,1996-02-13,1996-02
本报快讯,1996-02-13,1996-02
美特使抵达波黑访问,1996-02-13,1996-02
秘厄军方领导人首次会谈,1996-02-13,1996-02
以将提前举行大选,1996-02-13,1996-02
阿尔及利亚一天两起爆炸（短讯）,1996-02-13,1996-02
巴林首都发生炸弹爆炸事件（短讯）,1996-02-13,1996-02
欧盟船速之争,1996-02-13,1996-02
韩日岛屿之争又加剧,1996-02-13,1996-02
批评美国目光短浅,1996-02-13,1996-02
北爱多党会谈目前不能举行,1996-02-13,1996-02
哥总统表示不辞职（短讯）,1996-02-13,1996-02
曼德拉说不与古利断绝关系,1996-02-13,1996-02
保宣布前领导人日夫科夫无罪（短讯）,1996-02-13,1996-02
巴大选结果正式揭晓,1996-02-13,1996-02
社会的“宠儿”,1996-02-13,1996-02
殴打同居女子致死美驻韩一军人被捕,1996-02-13,1996-02
俄美高官接踵访波,1996-02-13,1996-02
尼日尔宣布解除宵禁（短讯）,1996-02-13,1996-02
一颗彗星将飞经地球,1996-02-13,1996-02
中缅与联合国合作禁毒,1996-02-13,1996-02
铅污染影响儿童行为,1996-02-13,1996-02
洋人不兴厚礼,1996-02-13,1996-02
人体生物钟极为敏感,1996-02-13,1996-02
美允许其公司购伊石油,1996-02-13,1996-02
比荷医生进行遥控外科手术成功,1996-02-13,1996-02
马来西亚禁放烟花爆竹,1996-02-13,1996-02
分合应变  大小见长,1996-02-13,1996-02
原先标记的南极点位置有误,1996-02-13,1996-02
人民币市场汇价,1996-02-13,1996-02
乐极生悲（美术）,1996-02-13,1996-02
简讯（八版）,1996-02-13,1996-02
中国队再输一场,1996-02-13,1996-02
中国将参加奥运会火炬接力,1996-02-13,1996-02
中国女排结束漳州冬训,1996-02-13,1996-02
谢军卫冕形势严峻,1996-02-13,1996-02
矛利不如盾坚,1996-02-13,1996-02
中国队负于新西兰队,1996-02-13,1996-02
松花江畔的回响,1996-02-13,1996-02
上海申花队教练球员自觉纳税,1996-02-13,1996-02
《中国大陆与港澳台地区经济合作前景》评介,1996-02-13,1996-02
正确认识和处理收入分配中国家、企业和个人的关系（学习贯彻十四届五中全会精神）,1996-02-13,1996-02
要加强企业管理队伍建设,1996-02-13,1996-02
国家将规范设备维修市场,1996-02-13,1996-02
要王海更要『王法』,1996-02-13,1996-02
“王海现象”意味着什么？（上）,1996-02-13,1996-02
多些“一孔之见”,1996-02-13,1996-02
如此“正当理由”（美术）,1996-02-13,1996-02
北京电话为何要升八位？,1996-02-13,1996-02
能不能再多些？,1996-02-13,1996-02
痴痴迷迷钻井 苦比甜少  老老实实做人 得比失多,1996-02-13,1996-02
南京限期扭亏  违者就地免职,1996-02-13,1996-02
经贸委等将公布风机水泵节能产品推荐名录,1996-02-13,1996-02
留点“爱心”给子女,1996-02-13,1996-02
欧盟放宽中国非纺织品配额,1996-02-13,1996-02
用劳动陶冶干部情操,1996-02-13,1996-02
沂南抓好村级班子  实施“能人战略”,1996-02-13,1996-02
“倒拍马”现象探析,1996-02-13,1996-02
辞官回村三年  家乡面貌巨变,1996-02-13,1996-02
求实最可贵,1996-02-13,1996-02
铜山涌现众多『富民支部』『富村支书』,1996-02-13,1996-02
岳阳班子争创『三强』  干部争做『五好』,1996-02-13,1996-02
富拉尔基区委关心群众疾苦,1996-02-13,1996-02
贫困县的步子怎么迈？,1996-02-13,1996-02
心中唯求实,1996-02-13,1996-02
藏书洞与乌宿,1996-02-13,1996-02
春  讯（外一章）,1996-02-13,1996-02
迎春序曲,1996-02-13,1996-02
关于酒的话题,1996-02-13,1996-02
报春（中国画）,1996-02-13,1996-02
李瑞环同宗教团体负责人座谈,1996-02-14,1996-02
李沛瑶同志遗体在京火化    ,1996-02-14,1996-02
江泽民会见哈萨克斯坦外长,1996-02-14,1996-02
首批小康住宅科技产业工程启动,1996-02-14,1996-02
文化事业呼唤社会良知,1996-02-14,1996-02
党中央国务院非常重视李沛瑶遇害案查处和善后工作,1996-02-14,1996-02
朱镕基在德国发表讲演,1996-02-14,1996-02
北京地区天气预报,1996-02-14,1996-02
朱镕基回到北京,1996-02-14,1996-02
中华鳖活性血精批量投产,1996-02-14,1996-02
东胶集团管理科学效益高,1996-02-14,1996-02
中央电视台推出《金融之窗》栏目,1996-02-14,1996-02
走回穷山沟,1996-02-14,1996-02
国债夜市好红火,1996-02-14,1996-02
金长城微机首获Ｗ中文版授权,1996-02-14,1996-02
湖南实行杂交种子专营,1996-02-14,1996-02
鲁奇吉玛工程咨询有限公司成立,1996-02-14,1996-02
专家提醒注意抗旱,1996-02-14,1996-02
禹州市大力发展创汇农业,1996-02-14,1996-02
确保煤炭职工过好春节,1996-02-14,1996-02
广安建区两年经济发展迅速,1996-02-14,1996-02
审计署设立举报中心,1996-02-14,1996-02
电网调度自动化系统正式验收,1996-02-14,1996-02
水保资金不再无偿使用,1996-02-14,1996-02
物价调控去年完成情况及今年计划目标,1996-02-14,1996-02
农行确定贷款重点,1996-02-14,1996-02
全中草药制剂兽药受农户欢迎,1996-02-14,1996-02
天津警备区某团为灾区献爱心(短波),1996-02-14,1996-02
“孔繁森同志事迹展览”轰动大连,1996-02-14,1996-02
各地确保生活困难职工过好年,1996-02-14,1996-02
元氏县交通局重视党校建设(短波),1996-02-14,1996-02
《人民政协学习大纲》一书出版(短波),1996-02-14,1996-02
上海“送温暖”制度化社会化,1996-02-14,1996-02
战士刘长义救人受表彰(短波),1996-02-14,1996-02
长武关心受灾群众生活(短波),1996-02-14,1996-02
金昌市为驻军办实事(短波),1996-02-14,1996-02
民政部慰问解放军三总部和武警总部,1996-02-14,1996-02
对照英模找差距  用好权力为人民,1996-02-14,1996-02
海南边检战士为特区发展献力,1996-02-14,1996-02
钱其琛同葡萄牙外长会谈,1996-02-14,1996-02
外交部发言人发表谈话,1996-02-14,1996-02
李沛瑶同志生平,1996-02-14,1996-02
钱其琛同哈萨克斯坦外长会谈,1996-02-14,1996-02
邹家华会见美国客人,1996-02-14,1996-02
爱国同舟风雨行,1996-02-14,1996-02
中美就知识产权问题在京磋商,1996-02-14,1996-02
海协首届理事会第五次会议召开,1996-02-14,1996-02
天天都有新故事,1996-02-14,1996-02
