中韩难免短兵相接,1996-02-05,1996-02
寻找热点,1996-02-05,1996-02
李铁映强调精心组织保证亚冬会成功,1996-02-05,1996-02
全国男篮联赛第１６轮强弱分明,1996-02-05,1996-02
万年县又现『白条子』,1996-02-05,1996-02
航运安全不可忽视,1996-02-05,1996-02
过节须防火（读者论坛）,1996-02-05,1996-02
县委书记尊老曲,1996-02-05,1996-02
滑县５万吨花生待售,1996-02-05,1996-02
湖北省棉花压库量大,1996-02-05,1996-02
衡水殡葬改革步履维艰,1996-02-05,1996-02
爱眼：众人意识中的“盲点”,1996-02-05,1996-02
乐平农民联合体促产增收,1996-02-05,1996-02
农技培训应走出误区,1996-02-05,1996-02
打好冬季灭虫战,1996-02-05,1996-02
来函照登,1996-02-05,1996-02
种  乱,1996-02-05,1996-02
浦江居民菜篮子丰富,1996-02-05,1996-02
１９９５年各省（市、区）农村经济十大新闻（六）,1996-02-05,1996-02
为发展鸵鸟事业发挥积极作用,1996-02-05,1996-02
建昌『牛』起来了,1996-02-05,1996-02
白集善抓机遇,1996-02-05,1996-02
深切悼念刘海滨同志,1996-02-05,1996-02
中华人民共和国电力法,1996-02-05,1996-02
永远绽开的花,1996-02-05,1996-02
四百大学生背后的文章,1996-02-05,1996-02
秋天树满金,1996-02-05,1996-02
根系生活的沃土,1996-02-05,1996-02
我国运动员获四金,1996-02-06,1996-02
《领导干部一定要讲政治》单行本出版,1996-02-06,1996-02
丽江发生六级强余震,1996-02-06,1996-02
春城人民心系震区,1996-02-06,1996-02
深情的嘱托  殷切的期盼,1996-02-06,1996-02
吴邦国代表党中央国务院慰问地震灾区群众,1996-02-06,1996-02
江泽民在黑龙江看望慰问职工群众,1996-02-06,1996-02
北京地区天气预报,1996-02-06,1996-02
严厉打击走私伪造货币的犯罪活动,1996-02-06,1996-02
杀害李沛瑶同志的案犯被依法逮捕,1996-02-06,1996-02
国务院召开第九次全体会议,1996-02-06,1996-02
广州盘古电子有限公司奠基,1996-02-06,1996-02
健民药业赢得市场主动权,1996-02-06,1996-02
供销社化肥供销有起色,1996-02-06,1996-02
不可小看小作为（编后）,1996-02-06,1996-02
草粉生物饲料制作剂通过鉴定,1996-02-06,1996-02
滨海实施扶贫通电工程,1996-02-06,1996-02
首届中国饲料工业博览会将举办,1996-02-06,1996-02
石家庄彩管玻壳生产线投产,1996-02-06,1996-02
浙江收购棉花三万四千吨,1996-02-06,1996-02
早日实现两岸直接通邮通电,1996-02-06,1996-02
福建南孚电池质量获好评,1996-02-06,1996-02
抚顺蔬菜连锁经营便民利民,1996-02-06,1996-02
《中国设备管理》杂志创刊十周年,1996-02-06,1996-02
燕鑫公司人均利税２．７万元,1996-02-06,1996-02
营造『企业家机制』,1996-02-06,1996-02
形象也是效益——涿州记事,1996-02-06,1996-02
北京发展综合租赁业,1996-02-06,1996-02
辽宁边防总队加大打击走私力度（短波）,1996-02-06,1996-02
周口地区民警力保春运安全（短波）,1996-02-06,1996-02
中国国防报载文论述,1996-02-06,1996-02
推动经济合作  造福两岸人民,1996-02-06,1996-02
濮阳落实领导干部选拔任用《条例》,1996-02-06,1996-02
我国首部动态型法律法规文本出版（短波）,1996-02-06,1996-02
坚持一个中国原则促进祖国和平统一,1996-02-06,1996-02
空军直属工程总队创一流成绩,1996-02-06,1996-02
广东严厉打击知识产权犯罪,1996-02-06,1996-02
如东备好“精神年货”,1996-02-06,1996-02
赌博：害己害家害社会,1996-02-06,1996-02
不能再让赌害横行,1996-02-06,1996-02
海口机场暂停夜航飞行,1996-02-06,1996-02
《２１世纪文学之星丛书》问世,1996-02-06,1996-02
钱其琛与格拉尼奇会谈,1996-02-06,1996-02
严厉打击伪造货币、走私贩卖伪造货币犯罪活动,1996-02-06,1996-02
坚持党性原则不含糊不动摇,1996-02-06,1996-02
坚决取缔非法出版活动促进出版健康繁荣发展,1996-02-06,1996-02
《世界各国商务指南》出版,1996-02-06,1996-02
鲁平会见香港客人,1996-02-06,1996-02
全军深入开展学雷锋学英模活动,1996-02-06,1996-02
“９６春节天山行”慰问团启程,1996-02-06,1996-02
国务院新闻办奖励优秀项目,1996-02-06,1996-02
『国民科技教育丛书』面市,1996-02-06,1996-02
《军队自动化指挥系统概论》出版,1996-02-06,1996-02
中科院：建设好三大基地 农科院：重点进军中西部 林科院：加速科技产业化,1996-02-06,1996-02
盲目择校真害人,1996-02-06,1996-02
靳羽西在北大设立教育基金,1996-02-06,1996-02
全国少年儿童『手拉手』表彰暨推进会议召开,1996-02-06,1996-02
上海加快科普场馆建设  现代化科技新城将在浦东耸立,1996-02-06,1996-02
快讯,1996-02-06,1996-02
阿拉法特：叙黎认识到达成协议紧迫  佩雷斯：愿与所有阿拉伯国家谈判（中东和谈）,1996-02-06,1996-02
要扩大  先改革（国际论坛）,1996-02-06,1996-02
哈最高法院院长涉嫌受贿被起诉,1996-02-06,1996-02
友好往来,1996-02-06,1996-02
日政府公布住专资料新进党恢复国会审议,1996-02-06,1996-02
俄军称即将部分撤离车臣反对派要求取消选举结果,1996-02-06,1996-02
柬越边界纠纷谈判升级,1996-02-06,1996-02
新闻同行话中国,1996-02-06,1996-02
佩里：北约东扩不可避免,1996-02-06,1996-02
塔总统罢免三政要  “兵变”领导人要求得到满足,1996-02-06,1996-02
秘鲁宣布延长紧急状态,1996-02-06,1996-02
越南纪念越共成立６６周年,1996-02-06,1996-02
斯总统说继续推进民族和解,1996-02-06,1996-02
尼日尔组成文官政府,1996-02-06,1996-02
江主席八项主张合理,1996-02-06,1996-02
危总统遇刺幸免于难,1996-02-06,1996-02
科尔强调加强欧洲一体化建设,1996-02-06,1996-02
米洛舍维奇会晤美国务卿,1996-02-06,1996-02
尼喀发生武装冲突,1996-02-06,1996-02
首批救援食品运抵喀布尔,1996-02-06,1996-02
巴拉圭发生飞机坠毁事件,1996-02-06,1996-02
英国去年油气产量创１０年来最高纪录,1996-02-06,1996-02
蒙利用贷款改善农业,1996-02-06,1996-02
介绍中国专著在玻连印三版,1996-02-06,1996-02
以邻为壑,1996-02-06,1996-02
阿根廷大学增设“南方共同市场”专业,1996-02-06,1996-02
尼泊尔认定释迦牟尼诞生处,1996-02-06,1996-02
金价升至六年来最高点,1996-02-06,1996-02
乌克兰煤矿工人举行罢工,1996-02-06,1996-02
多伦多向流浪者发放八千睡袋,1996-02-06,1996-02
蒙利用外资发展基础产业,1996-02-06,1996-02
布里坦强调要按时实现欧洲货币联盟,1996-02-06,1996-02
人民币市场汇价,1996-02-06,1996-02
中华民族文化促进会演出团举行访泰首场演出,1996-02-06,1996-02
柯达推出先进摄影系统,1996-02-06,1996-02
巴西将增加科技投资,1996-02-06,1996-02
美国说客财路广,1996-02-06,1996-02
竞争与合作,1996-02-06,1996-02
成功一瞬间,1996-02-06,1996-02
田径游泳  纪录榜上看英豪,1996-02-06,1996-02
曹大元捧得ＮＥＣ杯,1996-02-06,1996-02
伦特罗向谢军致歉,1996-02-06,1996-02
亚冬会金牌争夺战开始速滑馆频传破纪录佳音,1996-02-06,1996-02
“为祖国  也为亚洲”,1996-02-06,1996-02
中国乒坛评出十佳,1996-02-06,1996-02
速滑馆里的对话,1996-02-06,1996-02
国产双桶洗衣机质量基本合格,1996-02-06,1996-02
今年我国将新建高速公路６００公里,1996-02-06,1996-02
我国汽车保有量达１１００多万辆,1996-02-06,1996-02
不妨开『教训交流会』,1996-02-06,1996-02
宏锋开店,1996-02-06,1996-02
『直销』不等于『廉价』,1996-02-06,1996-02
新产品  新技术,1996-02-06,1996-02
先『斩』后奏（美术）,1996-02-06,1996-02
滥发“王牌”吃红牌（连续报道）,1996-02-06,1996-02
推优之忧,1996-02-06,1996-02
警惕新的『阿里斯顿现象』,1996-02-06,1996-02
南京国企领导不得领取兼职酬金,1996-02-06,1996-02
湖北省工人技师家属可“农转非”,1996-02-06,1996-02
学老外『抠门儿』,1996-02-06,1996-02
大连不容假警察,1996-02-06,1996-02
春节注意防火！,1996-02-06,1996-02
微山湖上静悄悄,1996-02-06,1996-02
一张欠条,1996-02-06,1996-02
非法拘禁法不容！,1996-02-06,1996-02
新郑法院服务到农村（政法短波）,1996-02-06,1996-02
有感于农家请法律顾问,1996-02-06,1996-02
十万火急：信用卡透支犯罪,1996-02-06,1996-02
请爱惜人民币,1996-02-06,1996-02
北京铁路公安处积极查“危”（政法短波）,1996-02-06,1996-02
怀念冬季,1996-02-06,1996-02
读《军营三字经》,1996-02-06,1996-02
全国山水画研讨会在无锡举行,1996-02-06,1996-02
剪纸,1996-02-06,1996-02
岁朝春色（中国画）,1996-02-06,1996-02
艺术岂能『炒』得？,1996-02-06,1996-02
加强高中级干部教育管理,1996-02-07,1996-02
北京地区天气预报,1996-02-07,1996-02
王云坤当选吉林省省长,1996-02-07,1996-02
李鹏会见格拉尼奇,1996-02-07,1996-02
听总理一席话有感（今日谈）,1996-02-07,1996-02
北京站：今年景象大不同,1996-02-07,1996-02
党中央国务院拨出专款物资,1996-02-07,1996-02
财政部发布公告,1996-02-07,1996-02
反腐败是政权建设一项基本任务,1996-02-07,1996-02
确保困难职工过好春节  各地工会积极送温暖,1996-02-07,1996-02
北京西站短歌行,1996-02-07,1996-02
我短道速滑女将破世界纪录,1996-02-07,1996-02
塞外一颗星,1996-02-07,1996-02
首钢日电电子公司迎来亚微米时代,1996-02-07,1996-02
进出口银行确定信贷重点,1996-02-07,1996-02
莱州研制出塑料发泡网挤出机组,1996-02-07,1996-02
ＰＬ型破碎机获国家专利,1996-02-07,1996-02
电热产品等合格率低  秤上作弊现象还很多,1996-02-07,1996-02
广东『兴水安邦』起高潮 （大兴水利建设  完善基础设施）,1996-02-07,1996-02
烟台奥尔呼斯公司开发新产品,1996-02-07,1996-02
中基集团重管理增效益,1996-02-07,1996-02
绿色冷链与铁路网实现对接,1996-02-07,1996-02
拿起解链的钥匙（编后）,1996-02-07,1996-02
雪豹集团在竞争中崛起,1996-02-07,1996-02
我国数据通信快速发展,1996-02-07,1996-02
跳出相互拖欠怪圈,1996-02-07,1996-02
中国鸵鸟养殖开发协会成立,1996-02-07,1996-02
内贸部开展名优酒监测活动,1996-02-07,1996-02
上海摩托罗拉寻呼产品公司成立,1996-02-07,1996-02
维护社会政治大局稳定保持社会治安秩序平稳,1996-02-07,1996-02
沪上涌春潮  学习李国安,1996-02-07,1996-02
民政部总政治部北京市举行座谈会,1996-02-07,1996-02
祖国统一是宗教界的共同愿望,1996-02-07,1996-02
灾民冷暖挂心间,1996-02-07,1996-02
两种“台独”一脉相承,1996-02-07,1996-02
云南军区第一扫雷队献身国防无私奉献中央军委授予“英雄扫雷队”荣誉称号,1996-02-07,1996-02
震区近期发生更大地震可能性不大,1996-02-07,1996-02
要在全社会形成学赶先进风气,1996-02-07,1996-02
过好『三关』（人民论坛）,1996-02-07,1996-02
布赫会见格拉尼奇,1996-02-07,1996-02
李鹏会见香港民建联访京团,1996-02-07,1996-02
雷洁琼考察北京高新技术开发区,1996-02-07,1996-02
香港各界和澳门政府分别向灾区捐款,1996-02-07,1996-02
丁关根李铁映看望演职人员,1996-02-07,1996-02
李瑞环会见泰国上议院议长,1996-02-07,1996-02
择校收费后果堪忧,1996-02-07,1996-02
春蕾计划两年资助女童十万,1996-02-07,1996-02
菜园子需浇『科技水』,1996-02-07,1996-02
永盛制药公司向希望工程捐款百万,1996-02-07,1996-02
喀左重笔描绘当代“农家乐”,1996-02-07,1996-02
『上地杯』新闻摄影赛揭晓,1996-02-07,1996-02
编  后,1996-02-07,1996-02
“科技之光”常映百姓家  武汉电视台十年情钟科普宣传,1996-02-07,1996-02
『九五』计生工作要实现两个转变,1996-02-07,1996-02
朱镕基抵德国访问,1996-02-07,1996-02
近期召开全国委员会会议,1996-02-07,1996-02
本报快讯,1996-02-07,1996-02
阿盟呼吁解决海湾战后问题,1996-02-07,1996-02
伊朗强调外交重点将转向东方,1996-02-07,1996-02
中拉合作意义深远大有可为,1996-02-07,1996-02
地雷：波黑的隐形杀手,1996-02-07,1996-02
克林顿提交下年度预算草案,1996-02-07,1996-02
希腊推迟霍尔布鲁克的访问,1996-02-07,1996-02
海地总统为政变死难者碑揭幕,1996-02-07,1996-02
联合国：拟裁千名工作人员采取措施节省开支,1996-02-07,1996-02
巴美关系新进展（综述）,1996-02-07,1996-02
安盟表示将按计划集结军队,1996-02-07,1996-02
以总理会见美国务卿,1996-02-07,1996-02
贫穷正在威胁着世界（美术）,1996-02-07,1996-02
世界最富国家和最穷国家１９９４年人均国民生产总值（美元）,1996-02-07,1996-02
全球贫富差距知多少,1996-02-07,1996-02
向贫困宣战（短评）,1996-02-07,1996-02
美国贫富悬殊,1996-02-07,1996-02
消除贫困  刻不容缓,1996-02-07,1996-02
非洲贫困状况恶化,1996-02-07,1996-02
亚冬会奖牌榜,1996-02-07,1996-02
喜看冰花吐艳,1996-02-07,1996-02
亚洲冰球一枝独秀,1996-02-07,1996-02
短道中韩平分秋色  速滑八超亚洲纪录,1996-02-07,1996-02
加选手获世界杯滑雪赛金牌,1996-02-07,1996-02
中韩拚争无绝期,1996-02-07,1996-02
贝利获纽约田径赛６０米冠军,1996-02-07,1996-02
坂井送来他山石,1996-02-07,1996-02
全国足球甲Ｂ体能测试结束,1996-02-07,1996-02
三国围棋赛日方下擂,1996-02-07,1996-02
打好持久战,1996-02-07,1996-02
别把『麻风』传染给孩子,1996-02-07,1996-02
莫把节俭当寒碜（读者论坛）,1996-02-07,1996-02
节流与开源并重（编后）,1996-02-07,1996-02
读者来信,1996-02-07,1996-02
不要富了今人亏了后代,1996-02-07,1996-02
抓综合治理  保百姓平安,1996-02-07,1996-02
应在有时思无时,1996-02-07,1996-02
给孩子做个好榜样,1996-02-07,1996-02
满川风雨看潮生,1996-02-07,1996-02
亲子游戏：最珍贵的童年礼物,1996-02-07,1996-02
文化百态,1996-02-07,1996-02
寻求希望与再生,1996-02-07,1996-02
笔下生风  虎气昂然,1996-02-07,1996-02
白驹一越隙  鸿雁万里传,1996-02-07,1996-02
把话筒对准新闻,1996-02-07,1996-02
莫让老工人悄然而“退”,1996-02-07,1996-02
在各地工人报刊上,1996-02-07,1996-02
请别挤占“双休日”,1996-02-07,1996-02
银湖中心新风貌,1996-02-07,1996-02
长春国贸：对待顾客如亲人,1996-02-07,1996-02
充满爱心的朱莲香,1996-02-07,1996-02
北京呼家楼液化气站：为民服务无怨言,1996-02-07,1996-02
关心农民合同工,1996-02-07,1996-02
梅  雨（中国画）,1996-02-07,1996-02
寻味峄山,1996-02-07,1996-02
文明语言是  一项建设工程,1996-02-07,1996-02
恭贺新春（篆刻）,1996-02-07,1996-02
电视剧《京城缉捕队》开拍,1996-02-07,1996-02
『金苹果散文系列』在京出版,1996-02-07,1996-02
万象更新（篆刻）,1996-02-07,1996-02
李鹏会见泰国上议院议长,1996-02-08,1996-02
人大常委会举行委员长会议,1996-02-08,1996-02
北京地区天气预报,1996-02-08,1996-02
吹响科普新号角,1996-02-08,1996-02
李鹏会见优秀留学回国人员,1996-02-08,1996-02
中央军委领导会见李国安事迹报告团,1996-02-08,1996-02
胡富国当选山西省委书记,1996-02-08,1996-02
江泽民会见泰国上议院议长,1996-02-08,1996-02
全面提高群众整体科学素质,1996-02-08,1996-02
冰上雪上比翼齐飞,1996-02-08,1996-02
牢固树立群众观点帮助解决实际困难,1996-02-08,1996-02
桂平唱好三台重头戏,1996-02-08,1996-02
雄威宝西洋参饮料获绿色食品认证,1996-02-08,1996-02
亚龙集团利税十年增百倍,1996-02-08,1996-02
加快实现“两个根本转变”,1996-02-08,1996-02
《国际经济合作》发行１０周年,1996-02-08,1996-02
管市场与办市场彻底分离,1996-02-08,1996-02
浙江努力提高经济运行质量,1996-02-08,1996-02
税务干部王振举获荣誉称号,1996-02-08,1996-02
北京国际交换系统有限公司通过认证,1996-02-08,1996-02
动员全社会力量打好扶贫攻坚战,1996-02-08,1996-02
白酒：警惕假冒  猪肉：留神注水,1996-02-08,1996-02
什么是人民币可兑换？,1996-02-08,1996-02
“抓大”就是抓关键（ ’９６工业大视角⑤）,1996-02-08,1996-02
湛江赤坎区税务管理电子化,1996-02-08,1996-02
路归路  桥归桥（编后）,1996-02-08,1996-02
鞍山路企合作保运输,1996-02-08,1996-02
东安公司技改投入少产出多,1996-02-08,1996-02
宏观经济论坛在京举办,1996-02-08,1996-02
劳模进山来,1996-02-08,1996-02
统一是历史的大趋势,1996-02-08,1996-02
邯郸市直机关整顿作风,1996-02-08,1996-02
见义勇为基金会首次发放补助金,1996-02-08,1996-02
公安厅长私访记,1996-02-08,1996-02
南阳增强干部公仆意识,1996-02-08,1996-02
鞍山公安干警上门为群众办户口,1996-02-08,1996-02
首都驻军交通安全连续十年达标,1996-02-08,1996-02
“济困助学行动”情暖特困生,1996-02-08,1996-02
文艺工作者要同人民群众保持密切联系,1996-02-08,1996-02
博士后的微笑,1996-02-08,1996-02
中国记协举行新春招待会,1996-02-08,1996-02
全国政协举行春节茶话会,1996-02-08,1996-02
学习贯彻江泽民重要讲话精神,1996-02-08,1996-02
震后『四方街』,1996-02-08,1996-02
尉健行会见葡共总书记,1996-02-08,1996-02
重庆市发生特大火灾,1996-02-08,1996-02
钱其琛同刚果外长会谈,1996-02-08,1996-02
统战部向在京部分定居台胞贺新春,1996-02-08,1996-02
境外向云南地震灾区捐赠,1996-02-08,1996-02
迟浩田等与驻华武官欢聚迎新春,1996-02-08,1996-02
北京设立“天天３·１５有奖举报热线”,1996-02-08,1996-02
李贵鲜会见川越敏孝,1996-02-08,1996-02
云南公布地震灾情,1996-02-08,1996-02
江泽民任免驻荷兰大使,1996-02-08,1996-02
何英杰先生捐款５０００万港元,1996-02-08,1996-02
我首次人工合成高活性心钠素,1996-02-08,1996-02
学术期刊光盘检索系统通过鉴定,1996-02-08,1996-02
家长应消除择校想法,1996-02-08,1996-02
国家教委领导慰问贫困山区教师,1996-02-08,1996-02
“少年英雄”牵动少年心,1996-02-08,1996-02
择校助长不良风气,1996-02-08,1996-02
中短篇小说再热京城,1996-02-08,1996-02
当年抢『财神』尝到甜头  如今当『财神』不忘乡邻,1996-02-08,1996-02
种棉从今莫怕虫,1996-02-08,1996-02
沈铁严把“铁大门”,1996-02-08,1996-02
爱立信公司资助民办教师,1996-02-08,1996-02
自作自受,1996-02-08,1996-02
欧盟将帮助巴建立二百五十座城镇,1996-02-08,1996-02
阿富汗爆发大规模战斗,1996-02-08,1996-02
吉总理会见我副外长,1996-02-08,1996-02
传唤克林顿就白水事件作证,1996-02-08,1996-02
叙以同意继续举行谈判,1996-02-08,1996-02
我代表呼吁安实现民族和解,1996-02-08,1996-02
法重视同中国关系,1996-02-08,1996-02
莫斯塔尔发生骚乱,1996-02-08,1996-02
菲总统会见邓朴方,1996-02-08,1996-02
布隆迪：部族矛盾再度激化（综述）,1996-02-08,1996-02
非统组织将调解尼喀争端,1996-02-08,1996-02
车臣万人举行反政府集会,1996-02-08,1996-02
中非决定驱逐乍得反政府武装,1996-02-08,1996-02
塔局势基本恢复平静,1996-02-08,1996-02
中断与穆克联邦接触,1996-02-08,1996-02
古巴谴责美国对古的封锁,1996-02-08,1996-02
促进对华内陆及边远地区交流,1996-02-08,1996-02
柬决定和平解决与越边界纠纷,1996-02-08,1996-02
乌总统谈黑海舰队问题,1996-02-08,1996-02
南非帮助莫桑比克清除地雷,1996-02-08,1996-02
莱索托新国王登基,1996-02-08,1996-02
美国联邦快递将辟中美货运航线,1996-02-08,1996-02
世界金价大幅上扬南非金矿静观市场,1996-02-08,1996-02
挪威艺术展在京开幕,1996-02-08,1996-02
国际社会关注我云南震灾,1996-02-08,1996-02
罗马尼亚华商妇女联合会成立,1996-02-08,1996-02
我向巴捐赠救灾物资,1996-02-08,1996-02
伊与联合国开始谈判出口石油,1996-02-08,1996-02
马哈蒂尔呼吁保护本地区市场,1996-02-08,1996-02
第二届联合国人居会议筹备会议在纽约开幕,1996-02-08,1996-02
金价连升浅析,1996-02-08,1996-02
韩美再次协调援朝立场,1996-02-08,1996-02
人民币市场汇价（据新华社２月７日电）,1996-02-08,1996-02
印度卢比暴跌,1996-02-08,1996-02
著名桥梁专家西林逝世,1996-02-08,1996-02
法一小镇神秘火灾频发,1996-02-08,1996-02
加利建议举行特别联大,1996-02-08,1996-02
法国去年接待游客超过６０００万,1996-02-08,1996-02
巴基斯坦将兴建１万所学校,1996-02-08,1996-02
美国影视四处碰壁,1996-02-08,1996-02
哈成立第一所中文学校,1996-02-08,1996-02
最新消息：谢军第六盘弈和,1996-02-08,1996-02
珍惜学习机会,1996-02-08,1996-02
亚冬会奖牌榜,1996-02-08,1996-02
欧晓涛喜从天降,1996-02-08,1996-02
强者不言胜,1996-02-08,1996-02
王曼丽一鸣惊人,1996-02-08,1996-02
输在局面上,1996-02-08,1996-02
亚冬会颁金过半东道主暂居榜首,1996-02-08,1996-02
田径最佳运动员评出,1996-02-08,1996-02
聂棋圣不敌李昌镐,1996-02-08,1996-02
男篮联赛强队涉险过关,1996-02-08,1996-02
正确处理公有制经济和其他经济成分的关系（学习贯彻十四届五中全会精神）,1996-02-08,1996-02
讲政治要在实际工作中落实,1996-02-08,1996-02
不讲政治就会迷失方向,1996-02-08,1996-02
讲政治一定要身体力行,1996-02-08,1996-02
长联说短,1996-02-08,1996-02
我的脸上还有微笑吗？,1996-02-08,1996-02
花儿为什么这样红,1996-02-08,1996-02
今年春节怎么过？,1996-02-08,1996-02
让春节更加丰富多彩（编者小议）,1996-02-08,1996-02
ＶＣＤ影碟机市场火爆,1996-02-08,1996-02
ＣＥ：将给我们带来什么？,1996-02-08,1996-02
『圣水』泽大地,1996-02-08,1996-02
白园怀古,1996-02-08,1996-02
跨越太行山,1996-02-08,1996-02
一九九五年度报告文学获奖篇目,1996-02-08,1996-02
北京地区天气预报,1996-02-09,1996-02
我国工业生产首月开门红,1996-02-09,1996-02
为建设法制国家而奋斗,1996-02-09,1996-02
春节前夕看市场,1996-02-09,1996-02
李鹏会见刚果外长,1996-02-09,1996-02
实行和坚持依法治国  保障国家的长治久安,1996-02-09,1996-02
李鹏会见法国外长,1996-02-09,1996-02
修水利也要防假,1996-02-09,1996-02
苏州工业园开发力度加大,1996-02-09,1996-02
一种新式蓄电池在无锡问世,1996-02-09,1996-02
双汇，汇集了什么,1996-02-09,1996-02
首届中国质量新闻奖评出,1996-02-09,1996-02
安新县国税局首月税收大幅增长,1996-02-09,1996-02
北京铁路局加强春运安全检查,1996-02-09,1996-02
千分之一废品率的背后,1996-02-09,1996-02
荣成市抓内涵扩大再生产,1996-02-09,1996-02
宏观调控首要任务仍是控制物价,1996-02-09,1996-02
中农信投资驻马店大型农贸市场,1996-02-09,1996-02
水利部对口扶贫重实效,1996-02-09,1996-02
兖州农民人均牧业收入近千元,1996-02-09,1996-02
汇集成优势,1996-02-09,1996-02
三门峡农行两个文明双获丰收,1996-02-09,1996-02
各地加大力度治理春节市场,1996-02-09,1996-02
建行石家庄分行三办存款猛增,1996-02-09,1996-02
供销总社绘出九五蓝图,1996-02-09,1996-02
北京西城区举行军警民联欢,1996-02-09,1996-02
赴京谢亲人,1996-02-09,1996-02
做好老干部保健工作,1996-02-09,1996-02
公安部表彰优秀公安局优秀人民警察,1996-02-09,1996-02
向她行一个军礼,1996-02-09,1996-02
反对民族分裂  早日实现祖国统一,1996-02-09,1996-02
军队领导讲政治要作表率,1996-02-09,1996-02
但愿百姓俱饱暖（人民论坛）,1996-02-09,1996-02
国务院任免一批国家工作人员,1996-02-09,1996-02
反腐败需要新闻舆论积极支持配合,1996-02-09,1996-02
李岚清会见法国客人,1996-02-09,1996-02
吴仪将访问英国,1996-02-09,1996-02
外交部发言人评中美关系,1996-02-09,1996-02
未来一周天气趋势,1996-02-09,1996-02
党中央国务院关心黄河凌汛灾区群众,1996-02-09,1996-02
中央统战部举行迎春联谊会,1996-02-09,1996-02
铁英严重违法违纪被查处,1996-02-09,1996-02
国务院工作组赴灾区指导救灾,1996-02-09,1996-02
充分发挥特邀监察员作用促进反腐败各项任务落实,1996-02-09,1996-02
西哈努克致函钱其琛,1996-02-09,1996-02
全军生产管理系统通过鉴定,1996-02-09,1996-02
钱其琛同法国外长会谈,1996-02-09,1996-02
丰收的“保护神”,1996-02-09,1996-02
中国杰出（优秀）青年科技创业奖评选活动启幕,1996-02-09,1996-02
标本兼治话择校,1996-02-09,1996-02
初中择校弊端多,1996-02-09,1996-02
林宗扬医学教育奖第四次颁奖,1996-02-09,1996-02
第二届“中华人口奖”获奖者简介,1996-02-09,1996-02
继往开来，再建功勋,1996-02-09,1996-02
海内外学子携手再创辉煌,1996-02-09,1996-02
曲格平获荷兰『金方舟』勋章,1996-02-09,1996-02
第二届“中华人口奖”颁发,1996-02-09,1996-02
我知识产权保护状况良好,1996-02-09,1996-02
冰心主编《彩色插图中国文学史》出版,1996-02-09,1996-02
编后,1996-02-09,1996-02
圈外人的冲击（国际论坛）,1996-02-09,1996-02
黎要求以无条件从黎撤军,1996-02-09,1996-02
车臣反对派集会地点被包围,1996-02-09,1996-02
阿拉法特与美国务卿会谈,1996-02-09,1996-02
俄总理表示支持叶利钦竞选总统,1996-02-09,1996-02
安盟已集结部队近七千人（短讯）,1996-02-09,1996-02
塞反政府武装称愿与政府和谈（短讯）,1996-02-09,1996-02
民主党：无人挑战克林顿  共和党：群雄角逐候选人（美国大选）,1996-02-09,1996-02
塔政府总理易人,1996-02-09,1996-02
