弗雷总统会见朱镕基副总理,1996-02-01,1996-02
党的忠诚卫士,1996-02-01,1996-02
小心“一个巴掌”的后果（今日谈）,1996-02-01,1996-02
奠基之年抓法宝,1996-02-01,1996-02
永远忠诚于党的事业（短评）,1996-02-01,1996-02
发扬优良传统  不忘群众疾苦,1996-02-01,1996-02
李鹏总理会见穆塞韦尼总统,1996-02-01,1996-02
北京地区天气预报,1996-02-01,1996-02
把两篇文章作深,1996-02-01,1996-02
莱州市建成大型非织布基地,1996-02-01,1996-02
坚决取缔化肥非法经营活动,1996-02-01,1996-02
沈铁分局实现安全生产两千六百天,1996-02-01,1996-02
东西携手三年不懈  鲁西二十五县后来居上,1996-02-01,1996-02
中美将共同生产稀土永磁材料,1996-02-01,1996-02
企业国有资产产权登记管理办法,1996-02-01,1996-02
滨海县农村电话实现程控化,1996-02-01,1996-02
１０起违法广告案例  １０起假冒商标案例,1996-02-01,1996-02
国产微波炉质量稳定,1996-02-01,1996-02
中国银行与日本输出入银行签署资金协力贷款协议,1996-02-01,1996-02
南京旧摩托车交易中心成立,1996-02-01,1996-02
苏州新区营造良好投资环境,1996-02-01,1996-02
国家光纤通信技术工程研究中心通过验收,1996-02-01,1996-02
颁布《中国人民解放军卫生条例》,1996-02-01,1996-02
实现祖国统一是两岸民心所向,1996-02-01,1996-02
中共中央台办国务院台办负责人发表谈话,1996-02-01,1996-02
陈先瑞同志在京逝世,1996-02-01,1996-02
李岚清会见日本客人,1996-02-01,1996-02
抓好三件事发展旅游业,1996-02-01,1996-02
地质之光再放光华,1996-02-01,1996-02
京城冬装多姿彩,1996-02-01,1996-02
尽心工作迎接香港美好明天,1996-02-01,1996-02
让基本法深入民心——澳门印象之一,1996-02-01,1996-02
欢乐祥和  喜迎新春,1996-02-01,1996-02
姜春云会见美农业部长,1996-02-01,1996-02
依法收缴和停止演出,1996-02-01,1996-02
低温乙醇人血蛋白投产,1996-02-01,1996-02
我们是怎样解决择校问题的,1996-02-01,1996-02
我的一切属于人民,1996-02-01,1996-02
功夫下在薄弱学校建设上,1996-02-01,1996-02
一点浩然气  千里快哉风,1996-02-01,1996-02
丹东开展双休日全民文化娱乐活动,1996-02-01,1996-02
鞍山５０万学生寒假告别“三厅一社”,1996-02-01,1996-02
减轻课业负担  适当组织活动,1996-02-01,1996-02
张庆勤育成小麦新品种,1996-02-01,1996-02
希土争端由来已久（资料）,1996-02-01,1996-02
布隆迪拒绝安理会决议,1996-02-01,1996-02
波黑组建新政府,1996-02-01,1996-02
以军宣布拉马拉为军事禁区,1996-02-01,1996-02
叶利钦改组总统办公厅,1996-02-01,1996-02
"俄外长""第一把火""（国际论坛）",1996-02-01,1996-02
希土对峙爱琴海,1996-02-01,1996-02
美东部华人华侨举行座谈会,1996-02-01,1996-02
联合国特使再赴喀布尔斡旋,1996-02-01,1996-02
２０年内取消美军基地,1996-02-01,1996-02
日本国会起风波,1996-02-01,1996-02
美机频繁对朝空中侦察,1996-02-01,1996-02
阿政府军与塔利班斋月首次交火,1996-02-01,1996-02
俄总统竞选拉开帷幕,1996-02-01,1996-02
美总统会见俄总理,1996-02-01,1996-02
韩国三名国会议员被捕,1996-02-01,1996-02
斯中央银行被炸,1996-02-01,1996-02
欧美打“疯牛肉”官司,1996-02-01,1996-02
泛美航空公司重新开张,1996-02-01,1996-02
瑞典联合大扫毒,1996-02-01,1996-02
人民币市场汇价,1996-02-01,1996-02
巴西货币雷亚尔贬值７％,1996-02-01,1996-02
婴儿艾滋病毒消失非偶然三药并用治艾滋病效果好,1996-02-01,1996-02
波兰政府通过新的铁路运输法草案,1996-02-01,1996-02
美墨贸易争端又起墨指责美强权行径,1996-02-01,1996-02
菲律宾２０００人感染伤寒,1996-02-01,1996-02
泰国内阁批准减税规定,1996-02-01,1996-02
叙利亚一货轮沉没,1996-02-01,1996-02
世界棉花供需形势好转,1996-02-01,1996-02
机器人会清扫房间,1996-02-01,1996-02
德通过电信法草案,1996-02-01,1996-02
中国和越南将恢复铁路联运,1996-02-01,1996-02
基因重组植物新品种抗病毒,1996-02-01,1996-02
火星上可能有生命之光,1996-02-01,1996-02
纽约福利当局渎职  数十儿童无辜惨死,1996-02-01,1996-02
男篮联赛未起波澜  宏远坐四望三,1996-02-01,1996-02
哈尔滨冬趣,1996-02-01,1996-02
简讯,1996-02-01,1996-02
羽坛评出三“十佳”,1996-02-01,1996-02
中国球迷远征团新辟专线,1996-02-01,1996-02
肖爱华挑落银牌,1996-02-01,1996-02
大元落马  中方山重水复  大竹连胜  日方柳暗花明,1996-02-01,1996-02
谢军胜了第一盘,1996-02-01,1996-02
卫冕战第二盘和,1996-02-01,1996-02
亚洲杯预选赛  中国队大胜澳门队,1996-02-01,1996-02
初战古城堡,1996-02-01,1996-02
努力提高政治素质  增强政治责任感（学习贯彻十四届五中全会精神）,1996-02-01,1996-02
世界银行看中国经济,1996-02-01,1996-02
发展经济必须讲政治（学习贯彻十四届五中全会精神）,1996-02-01,1996-02
在政治上一定要头脑清醒（学习贯彻十四届五中全会精神）,1996-02-01,1996-02
要保持政治上的清醒和坚定（学习贯彻十四届五中全会精神）,1996-02-01,1996-02
新产品  新技术,1996-02-01,1996-02
换秤也要换心,1996-02-01,1996-02
“人保”上海分公司总经理何静芝提出：搞好保险资金运用加快走向国际市场,1996-02-01,1996-02
“财神”送不来财！,1996-02-01,1996-02
梅兰芳公园随想,1996-02-01,1996-02
新房邻居：对不起，我在墙上拍了一只苍蝇（美术）,1996-02-01,1996-02
商务公开：商家竞争又一招,1996-02-01,1996-02
三轮代步亦逍遥,1996-02-01,1996-02
国务院研究室丛明、马明兰建议：加强个人所得税征管可从五方面着手,1996-02-01,1996-02
江苏省文德中国山水画研究会作品,1996-02-01,1996-02
“印痴”傅抱石,1996-02-01,1996-02
豆  荚（中国画）,1996-02-01,1996-02
跬步至千里  苦心画乃成,1996-02-01,1996-02
王大观的北京风俗画,1996-02-01,1996-02
林州机关单位对口扶贫（发扬优良传统关心群众疾苦）,1996-02-02,1996-02
鞍山领导干部带头济困（发扬优良传统关心群众疾苦）,1996-02-02,1996-02
今年我国金融改革加快步伐,1996-02-02,1996-02
三万辆庆铃轻型车投放市场,1996-02-02,1996-02
编者按（发扬优良传统关心群众疾苦）,1996-02-02,1996-02
吉铝公司利税三年翻三番多,1996-02-02,1996-02
治理黄河的壮举,1996-02-02,1996-02
北京地区天气预报,1996-02-02,1996-02
海尔集团五大产品荣登金榜,1996-02-02,1996-02
企业高校联手开发农科成果,1996-02-02,1996-02
『企业家』的称号不可滥用（今日谈）,1996-02-02,1996-02
两万亿元：繁荣活跃大市场,1996-02-02,1996-02
化肥生产将可就地取煤加工,1996-02-02,1996-02
电子工业确定发展重点,1996-02-02,1996-02
《中国邮电百科全书》出版,1996-02-02,1996-02
果断地把不合理的负担减下来,1996-02-02,1996-02
强山建材集团总公司靠改革增效益,1996-02-02,1996-02
口岸截获数十种病虫害,1996-02-02,1996-02
北京商家『文化』闹新春,1996-02-02,1996-02
进一步开展现代企业制度试点,1996-02-02,1996-02
新型节能电站在鲁南兴建,1996-02-02,1996-02
南航与美利坚公司签署合约,1996-02-02,1996-02
兵器工业民品产值占八成,1996-02-02,1996-02
我国光纤通信技术有新突破,1996-02-02,1996-02
环宇，艰难又顺利的破产,1996-02-02,1996-02
莲花味精集团设立“质量法庭”,1996-02-02,1996-02
宝坻少铺摊子多搞技改  鄞县组建大型企业集团,1996-02-02,1996-02
烟草行业集约化程度提高,1996-02-02,1996-02
练好内功  再上台阶（编后）,1996-02-02,1996-02
天津去年物价涨幅全国最低,1996-02-02,1996-02
公安边防部队严厉打击走私犯罪,1996-02-02,1996-02
全国青联设立“服务万村行动基金”,1996-02-02,1996-02
中国妇女发展基金会召开二届二次理事会,1996-02-02,1996-02
纪念江泽民关于台湾问题重要讲话发表一周年,1996-02-02,1996-02
群众的高举报率说明什么（人民论坛）,1996-02-02,1996-02
新闻工作要坚持鲜明的党性原则,1996-02-02,1996-02
外国人在华就业实行许可证制度,1996-02-02,1996-02
尉健行会见法国客人,1996-02-02,1996-02
钱其琛赴泰国出席亚欧会议亚洲成员国外长会议,1996-02-02,1996-02
亚星二号启用  有功人员受奖,1996-02-02,1996-02
中国加大力度打击盗版行为,1996-02-02,1996-02
刚果外长将访华,1996-02-02,1996-02
未来一周天气趋势,1996-02-02,1996-02
中央军委授予黄炳华荣誉称号,1996-02-02,1996-02
街坊公益事业兴旺,1996-02-02,1996-02
综合治理  妥善纠正,1996-02-02,1996-02
抓住根本  认真解决,1996-02-02,1996-02
北京日报在人民大学设奖学金,1996-02-02,1996-02
《为了健康》大型活动将举行,1996-02-02,1996-02
葫芦岛日报开展特别采访,1996-02-02,1996-02
专家提醒：勿给庄稼“偏食”,1996-02-02,1996-02
编  后,1996-02-02,1996-02
卫生部向全国推广系列中成药,1996-02-02,1996-02
发挥三个积极性  造就一代新农民,1996-02-02,1996-02
八千农家娃  自费上大学,1996-02-02,1996-02
科教兴国需求更多高层次人才,1996-02-02,1996-02
文化扶贫书搭桥,1996-02-02,1996-02
“总统大拍卖”,1996-02-02,1996-02
永不忘却的纪念（国际论坛）,1996-02-02,1996-02
猜猜这次谁坐庄（美术）,1996-02-02,1996-02
美将从苏丹撤出外交人员,1996-02-02,1996-02
今年为和平与民族大团结之年,1996-02-02,1996-02
赞扬中国改革成就在外国报刊上,1996-02-02,1996-02
巴林驱逐伊朗一名外交官,1996-02-02,1996-02
意大利任命新总理,1996-02-02,1996-02
斯总统强烈谴责恐怖主义行径,1996-02-02,1996-02
塔总统强调依法解决  叶利钦说俄军不参与  独联体五国呼吁和谈（塔吉克斯坦武装冲突）,1996-02-02,1996-02
未获突破性进展仍有实质性分歧,1996-02-02,1996-02
联合国延长驻西撒观察团任期,1996-02-02,1996-02
乌俄外长谈黑海舰队问题,1996-02-02,1996-02
希拉克抵美访问,1996-02-02,1996-02
波黑局势：穆克联邦组成新政府库伦瓦库夫局势趋紧,1996-02-02,1996-02
波兰任命新总理,1996-02-02,1996-02
斯里兰卡：救死扶伤抓紧破案,1996-02-02,1996-02
安理会呼吁苏丹引渡暗杀嫌疑犯,1996-02-02,1996-02
阿尔及利亚发生爆炸事件军方击毙三十名恐怖分子,1996-02-02,1996-02
——老兄，你的能耐比我大！（美术）,1996-02-02,1996-02
中国任何时候都有朋友,1996-02-02,1996-02
印度哥伦比亚审理受贿案,1996-02-02,1996-02
日破获用互联网络传黄案,1996-02-02,1996-02
哈颁布建立“经济特区”令,1996-02-02,1996-02
中国援建的真纳医院在巴开业,1996-02-02,1996-02
联合国因经费紧张裁员,1996-02-02,1996-02
美联储宣布降低利率,1996-02-02,1996-02
德新经济纲领出台,1996-02-02,1996-02
巴西金融市场继续保持稳定,1996-02-02,1996-02
人民币市场汇价（据新华社２月１日电）,1996-02-02,1996-02
“住专”问题的由来和影响（述评）,1996-02-02,1996-02
欧盟采取措施狠刹舞弊风,1996-02-02,1996-02
墨抗议美搞霸权主义,1996-02-02,1996-02
联合国官员赞扬中国住房成就,1996-02-02,1996-02
中国援助玻利维亚打井工程开工,1996-02-02,1996-02
中国篮球学校短训班开学,1996-02-02,1996-02
牵动人心的比赛,1996-02-02,1996-02
亚洲杯足球预选赛  中国队七夺城池,1996-02-02,1996-02
当“和”立断,1996-02-02,1996-02
日本队目标：与上届亚冬会持平,1996-02-02,1996-02
彩云飞过４米２７,1996-02-02,1996-02
谢维宁又破世界纪录,1996-02-02,1996-02
克里斯蒂世锦赛受伤是假？贝利发起心理战,1996-02-02,1996-02
左算右算  前景不妙,1996-02-02,1996-02
拥挤中，您不妨这样做,1996-02-02,1996-02
你我都是同路人  互敬互谅互关心,1996-02-02,1996-02
衡阳站内“五子经”,1996-02-02,1996-02
关于振兴国家财政的思考,1996-02-02,1996-02
跳出金融办金融,1996-02-02,1996-02
市场竞争呼唤降低成本,1996-02-02,1996-02
加速实现两岸直航,1996-02-02,1996-02
开发海洋资源  增加食物供给,1996-02-02,1996-02
立足市域全局  突出县域重点,1996-02-02,1996-02
海滨花园式的香港科技大学,1996-02-02,1996-02
香港与内地去年通话１２亿分钟,1996-02-02,1996-02
神圣的事业,1996-02-02,1996-02
香港经济专家认为,1996-02-02,1996-02
切实维护台商合法权益,1996-02-02,1996-02
开创历史新页,1996-02-02,1996-02
心细志高,1996-02-02,1996-02
三舅在台湾,1996-02-02,1996-02
长春领导干部长年联系贫困户（发扬优良传统  关心群众疾苦）,1996-02-03,1996-02
坚定信心  扎实工作  再夺丰收,1996-02-03,1996-02
武汉十位劳模倡议  向特困职工传技术送温暖（发扬优良传统  关心群众疾苦）,1996-02-03,1996-02
江泽民会见法共代表团,1996-02-03,1996-02
经纬集团向陕甘两省捐赠服装面料（发扬优良传统  关心群众疾苦）,1996-02-03,1996-02
稳定增加农产品有效供给和农民收入,1996-02-03,1996-02
大连理工大学理论学习蔚然成风,1996-02-03,1996-02
北京地区天气预报,1996-02-03,1996-02
喜看大学校园理论热（今日谈）,1996-02-03,1996-02
编后（发扬优良传统  关心群众疾苦）,1996-02-03,1996-02
中央军委举行迎春文艺演出,1996-02-03,1996-02
为现代化建设创造良好国际舆论环境,1996-02-03,1996-02
纪念江泽民关于台湾问题重要讲话发表一周年,1996-02-03,1996-02
中宣部等向百县农民赠送录像带,1996-02-03,1996-02
伊朗驱逐巴林一名外交官,1996-02-03,1996-02
尼前总统总理议长被释放,1996-02-03,1996-02
美联储连降利率（综述）,1996-02-03,1996-02
南部非洲贸易协商会议开幕,1996-02-03,1996-02
旅法华侨举行座谈会,1996-02-03,1996-02
叶利钦将于四月访乌,1996-02-03,1996-02
朱镕基在智利发表演讲,1996-02-03,1996-02
世界经济论坛,1996-02-03,1996-02
葡美俄三国举行磋商,1996-02-03,1996-02
几内亚发生军人哗变,1996-02-03,1996-02
俄能否批准削减战略武器条约,1996-02-03,1996-02
越柬商定和平解决边界纠纷,1996-02-03,1996-02
法总统呼吁改革北约,1996-02-03,1996-02
世界经济论坛年会开幕,1996-02-03,1996-02
中国将积极参加亚欧会议进程,1996-02-03,1996-02
美开始从苏丹撤出外交官,1996-02-03,1996-02
俄一科研所发生核泄漏事故,1996-02-03,1996-02
过犹不及,1996-02-03,1996-02
北国冰城喜迎盛会,1996-02-03,1996-02
男篮联赛杭州赛区受处罚,1996-02-03,1996-02
第一届ＮＥＣ杯围棋赛曹大元郑弘今日争冠,1996-02-03,1996-02
加拿大曲棍球协会提出抗议,1996-02-03,1996-02
老波尔加为何没来？,1996-02-03,1996-02
爱心献给亚冬会,1996-02-03,1996-02
国际排联将再办世界女排大奖赛,1996-02-03,1996-02
又成和棋,1996-02-03,1996-02
哈恩——借黑白格扬名的城市,1996-02-03,1996-02
东西南北评说推广普通话,1996-02-03,1996-02
拉萨冬日鲜果香,1996-02-03,1996-02
哈尔滨拒绝“大和”号,1996-02-03,1996-02
当个好『挑夫』,1996-02-03,1996-02
善领风骚的宋崇山,1996-02-03,1996-02
《公关策划之道》述要,1996-02-03,1996-02
流通领域理论研究的有益尝试,1996-02-03,1996-02
略论领导权威,1996-02-03,1996-02
城市管理现代化初探,1996-02-03,1996-02
提高乡镇企业科学管理水平（学术动态）,1996-02-03,1996-02
电视剧《秋去冬来》开拍,1996-02-03,1996-02
全国中学生尊老敬老书信大奖赛举办,1996-02-03,1996-02
英国『黑色之音』访华演出,1996-02-03,1996-02
《古吴春秋》展现古吴历史风貌,1996-02-03,1996-02
“关东第一鼓”撼人心魄,1996-02-03,1996-02
峨影新片《来不及道歉》受好评,1996-02-03,1996-02
电视文学剧本《青年毛泽东》引起关注,1996-02-03,1996-02
看李梅演戏,1996-02-03,1996-02
双拥城的新奉献,1996-02-03,1996-02
文学未必『嫁』电视,1996-02-03,1996-02
在改革开放中发展着的中国电影,1996-02-03,1996-02
儿童片《和爱一起长大》拍成,1996-02-03,1996-02
新声皆从里巷出,1996-02-03,1996-02
送戏下乡,1996-02-03,1996-02
莫让垃圾毁市容,1996-02-03,1996-02
起起落落话转变,1996-02-03,1996-02
澳门至厦门航线将开通（新闻简报）,1996-02-04,1996-02
招远年产黄金三十万两（新闻简报）,1996-02-04,1996-02
石家庄建超级批发市场（新闻简报）,1996-02-04,1996-02
北京地区天气预报,1996-02-04,1996-02
李沛瑶同志与歹徒搏斗遇害,1996-02-04,1996-02
学习宣传孔繁森文艺创作座谈会举行,1996-02-04,1996-02
青海玉树救灾工作顺利展开,1996-02-04,1996-02
云南丽江发生７级地震,1996-02-04,1996-02
引导农民进市场  推动农业产业化,1996-02-04,1996-02
桑吉内蒂总统会见朱镕基副总理,1996-02-04,1996-02
大化建三十万吨合成氨工程（新闻简报）,1996-02-04,1996-02
首家旅游预订网络开通（新闻简报）,1996-02-04,1996-02
邢台市多方扶助困难职工,1996-02-04,1996-02
李沛瑶同志逝世,1996-02-04,1996-02
亚洲冬季运动会今日开幕,1996-02-04,1996-02
广西近１０万特困移民异地发展,1996-02-04,1996-02
让文化下得起乡（今日谈）,1996-02-04,1996-02
加速两岸空中直航进程,1996-02-04,1996-02
汉中发现明代琉璃照壁,1996-02-04,1996-02
统一是亿万人民的共同心声,1996-02-04,1996-02
中华人民共和国红十字标志使用办法,1996-02-04,1996-02
在京全国人大代表举行迎春联谊会,1996-02-04,1996-02
赵正久创办农民老年宫,1996-02-04,1996-02
长春寒假免费放爱国影片,1996-02-04,1996-02
零丁洋上读报栏,1996-02-04,1996-02
叶利钦与国家杜马主席首次会谈,1996-02-04,1996-02
西安发掘出金朝官印,1996-02-04,1996-02
塔境内冲突不断升级,1996-02-04,1996-02
几内亚总统府遭炮击起火,1996-02-04,1996-02
网球步入低谷,1996-02-04,1996-02
心理诊断美国梦,1996-02-04,1996-02
“空中花园”新说,1996-02-04,1996-02
旅游业的“后遗症”,1996-02-04,1996-02
百年建筑被焚的启示,1996-02-04,1996-02
“人民大使”的中国心,1996-02-04,1996-02
国际副刊,1996-02-04,1996-02
诗坛迎新春,1996-02-04,1996-02
陕西文联研讨赵季平作品,1996-02-04,1996-02
意大利艺术家将来京演合唱,1996-02-04,1996-02
迎接香港回归音乐作品征集活动开始,1996-02-04,1996-02
《湘女多情》,1996-02-04,1996-02
迎新春拜年封将面世,1996-02-04,1996-02
音乐舞蹈演出多,1996-02-04,1996-02
中华炎黄文化研究会编纂大型文库《老子藏》,1996-02-04,1996-02
中央民族乐团将办新春音乐会,1996-02-04,1996-02
保护北京老字号,1996-02-04,1996-02
香飘万里图（中国画）,1996-02-04,1996-02
新水平上的“寓教于乐”,1996-02-04,1996-02
冰天雪地作赛场,1996-02-04,1996-02
党中央国务院致电慰问震区灾民,1996-02-05,1996-02
江泽民会见法赫德,1996-02-05,1996-02
共创冰雪的辉煌,1996-02-05,1996-02
李鹏接受香港三报联合采访,1996-02-05,1996-02
江泽民会见金云龙,1996-02-05,1996-02
中国红十字会紧急救助云南地震灾区,1996-02-05,1996-02
北京地区天气预报,1996-02-05,1996-02
云南军民投入抗震救灾,1996-02-05,1996-02
第三届亚洲冬运会在哈隆重开幕,1996-02-05,1996-02
劳动监察组织形成网络,1996-02-05,1996-02
环宇，比破产本身更重要的,1996-02-05,1996-02
企业改革在哪里寻求突破（ ’９６工业大视角④）,1996-02-05,1996-02
中建一局五公司迭创佳绩,1996-02-05,1996-02
注意结构和布局的关系（经济增长方式转变谈③）,1996-02-05,1996-02
专家研讨武汉与中西部发展战略,1996-02-05,1996-02
辛集市发展交通兴经济,1996-02-05,1996-02
华信公司在认证行业崭露头角,1996-02-05,1996-02
芬格欣给水产养殖业带来福音,1996-02-05,1996-02
贵州加快农村电网建设,1996-02-05,1996-02
中南科技产业集团在京成立,1996-02-05,1996-02
南宫人行实现资金十年安全无事故,1996-02-05,1996-02
沅江甩掉赤字县帽子,1996-02-05,1996-02
南海民营企业上规模增效益,1996-02-05,1996-02
北京又一大型涉外饭店建成,1996-02-05,1996-02
三晶集团向北京市劳模献爱心,1996-02-05,1996-02
喜闻“诤言奖”,1996-02-05,1996-02
武警湖北总队党委坚持学习制度（短波）,1996-02-05,1996-02
民政部河北省联合慰问保定驻军和优抚对象,1996-02-05,1996-02
东电局安置退伍军人“三统一”,1996-02-05,1996-02
书记探访重灾户,1996-02-05,1996-02
两岸青年盼统一,1996-02-05,1996-02
天津消防部门依法治理火灾隐患（短波）,1996-02-05,1996-02
太原：扎实稳妥为民办事,1996-02-05,1996-02
宽甸交警建立『警民联系簿』（短波）,1996-02-05,1996-02
延安为老红军和伤残军人办实事（短波）,1996-02-05,1996-02
携手加强思想政治建设,1996-02-05,1996-02
军事统筹学研究取得新成绩（短波）,1996-02-05,1996-02
爱洒草原  造福人民,1996-02-05,1996-02
江苏省干部向曹克明学习,1996-02-05,1996-02
灵宝严厉打击非法采金活动（短波）,1996-02-05,1996-02
长沙  抓住“热点”评议行风,1996-02-05,1996-02
《战后五十年世界大事纵览》出版,1996-02-05,1996-02
《中国公安装备》画册问世,1996-02-05,1996-02
共产党员要为党立丰碑（人民论坛）,1996-02-05,1996-02
北方今冬为何雨雪少,1996-02-05,1996-02
现场短新闻征文评选揭晓,1996-02-05,1996-02
煤炭部领导慰问特困企业职工（发扬优良传统  关心群众疾苦）,1996-02-05,1996-02
华容县一网起鱼百万公斤,1996-02-05,1996-02
牡丹江五千干部帮扶特困企业（发扬优良传统  关心群众疾苦）,1996-02-05,1996-02
开封为困难职工送温暖（发扬优良传统  关心群众疾苦）,1996-02-05,1996-02
’９６春节联欢晚会筹备就绪,1996-02-05,1996-02
澳门筹建海洋公园,1996-02-05,1996-02
爱护这朵“莲花”,1996-02-05,1996-02
残疾青年助人养蛇致富,1996-02-05,1996-02
鞍山人工孵化孔雀成功,1996-02-05,1996-02
抚州地区实施“民心工程”（发扬优良传统  关心群众疾苦）,1996-02-05,1996-02
功夫要下在联系实际解决问题上,1996-02-05,1996-02
《天山希望之星》舞蹈晚会在京举行,1996-02-05,1996-02
择校收费不可取,1996-02-05,1996-02
我国大众健康意识增强,1996-02-05,1996-02
内蒙古推出电视剧《醒点》,1996-02-05,1996-02
笔顺码获国家专利,1996-02-05,1996-02
汕头邮电系统心系老区教育事业,1996-02-05,1996-02
衡水科教兴区棋活全盘,1996-02-05,1996-02
中华人民共和国计算机信息网络国际联网管理暂行规定,1996-02-05,1996-02
瀛海威开发出大众化电脑网络,1996-02-05,1996-02
滇赣中小学教师工资全部兑现,1996-02-05,1996-02
第１３届龙潭庙会突出民俗特色,1996-02-05,1996-02
真依靠才能大发展（编后）,1996-02-05,1996-02
陕西交通系统加大教育投资,1996-02-05,1996-02
朱镕基会见乌拉圭外长,1996-02-05,1996-02
俄外交部举行晚会庆祝中国春节,1996-02-05,1996-02
海地旧军人滋事,1996-02-05,1996-02
巴林加紧平骚乱,1996-02-05,1996-02
钱其琛会见日本、韩国外长,1996-02-05,1996-02
叶利钦任命两名副外长,1996-02-05,1996-02
塔吉克斯坦局势日趋动荡,1996-02-05,1996-02
美国总统大选在即  各党预选活动频繁,1996-02-05,1996-02
几内亚动乱结束,1996-02-05,1996-02
法将重开驻乌兰巴托大使馆,1996-02-05,1996-02
美对伊朗发出新威胁,1996-02-05,1996-02
俄称将遏制北约东扩,1996-02-05,1996-02
土总统授权祖国党主席组阁,1996-02-05,1996-02
波黑各方按协议撤军顺利,1996-02-05,1996-02
一周国际要闻回顾（１月２９日—２月４日）,1996-02-05,1996-02
保拒绝向波黑派出工兵,1996-02-05,1996-02
克里斯托弗访问前南地区,1996-02-05,1996-02
约旦政府辞职,1996-02-05,1996-02
欧盟将资助波黑排雷,1996-02-05,1996-02
南非将参加联合国维和行动,1996-02-05,1996-02
阿前总统阿利雅再次被捕,1996-02-05,1996-02
捷一些小党为大选结盟,1996-02-05,1996-02
南部非洲发展共同体’９６贸易协商会议开幕,1996-02-05,1996-02
巴拿马执行『不要武器要和平』计划,1996-02-05,1996-02
法国举办第一届国际汉语教学学术研讨会,1996-02-05,1996-02
古巴谴责美海关扣留援古物资,1996-02-05,1996-02
留日百年纪念活动拉开序幕,1996-02-05,1996-02
沙特轮船在塞领海沉没,1996-02-05,1996-02
从步行运动谈起,1996-02-05,1996-02
俄萨马拉至天津航线即将开通,1996-02-05,1996-02
利雅得大爆炸嫌犯被引渡到沙特,1996-02-05,1996-02
经合组织要求塞舌尔撤销保护“洗钱”法令,1996-02-05,1996-02
世界经济论坛组织中国经济专题研讨会,1996-02-05,1996-02
巴西发现特大金矿,1996-02-05,1996-02
巴西降低银行利息,1996-02-05,1996-02
菲海外劳工去年汇款创历史最高纪录,1996-02-05,1996-02
中国上海承建的客轮交付缅甸使用,1996-02-05,1996-02
英业余科学家发射自制火箭成功,1996-02-05,1996-02
欧洲单一货币能否如期实现（综述）,1996-02-05,1996-02
纽约政府遭起诉,1996-02-05,1996-02
朝鲜文艺团体送戏到基层,1996-02-05,1996-02
冰城热心迎宾客,1996-02-05,1996-02
谢军苏珊被罚巨款各方反应强烈,1996-02-05,1996-02
亚洲杯足球预选赛中国队全胜,1996-02-05,1996-02
哈萨克斯坦内定目标：必夺冰球冠军,1996-02-05,1996-02
李铁映会见法赫德金云龙,1996-02-05,1996-02
非洲国家杯足球赛南非队夺冠,1996-02-05,1996-02
大波尔加首尝胜果,1996-02-05,1996-02
