我驻外使馆举行春节招待会,1996-02-20,1996-02
叶利钦与科尔会谈,1996-02-20,1996-02
巴重申将收回运河管理权,1996-02-20,1996-02
卡塔尔报纸批评美国讹诈别国,1996-02-20,1996-02
简讯,1996-02-20,1996-02
普天同庆闹新春,1996-02-20,1996-02
上海现代企业制度试点见效,1996-02-21,1996-02
正月初二工地忙,1996-02-21,1996-02
大年初一赶火车,1996-02-21,1996-02
首钢显示新活力,1996-02-21,1996-02
北京地区天气预报,1996-02-21,1996-02
还是『禁放』好（今日谈）,1996-02-21,1996-02
李鹏同延安老区人民一起过年,1996-02-21,1996-02
德铜『八五』穿金戴银,1996-02-21,1996-02
老区在全国人民心中,1996-02-21,1996-02
好心人  鼎力相助  百万元  失而复得,1996-02-21,1996-02
保定扶贫济困暖人心,1996-02-21,1996-02
烟花璀璨照香江,1996-02-21,1996-02
节日军营一片笑语欢歌,1996-02-21,1996-02
丽江灾区建起第一所抗震小学,1996-02-21,1996-02
歌舞,1996-02-21,1996-02
邹家华向顺德企业拜年时指出切实提高产品整体质量,1996-02-21,1996-02
深信中国大有希望,1996-02-21,1996-02
『拜年车』娄底受阻,1996-02-21,1996-02
同声共祝祖国好,1996-02-21,1996-02
丰滨隧道救难纪实,1996-02-21,1996-02
萨达姆女婿将返回伊拉克,1996-02-21,1996-02
伊出口石油问题首轮谈判结束,1996-02-21,1996-02
蒙特罗再次当选佛得角总统,1996-02-21,1996-02
伦敦第二次爆炸英爱美三国震惊,1996-02-21,1996-02
埃及释放２６９名激进分子,1996-02-21,1996-02
我驻外使节举行招待会欢庆春节,1996-02-21,1996-02
金正日观看春节文艺表演,1996-02-21,1996-02
在美国过春节有感,1996-02-21,1996-02
暴风雪袭击丹麦,1996-02-21,1996-02
加蓬十三人死于埃博拉病,1996-02-21,1996-02
韩国日本将分别设二百海里排他性经济水域,1996-02-21,1996-02
科尔在莫斯科表示德俄对话有利于整个欧洲,1996-02-21,1996-02
土两党就组阁达成原则协议,1996-02-21,1996-02
科约恢复两国邮电通讯服务,1996-02-21,1996-02
伊朗一直升机坠入泥沼,1996-02-21,1996-02
菲外长参加春节庆祝活动,1996-02-21,1996-02
意大利将恢复对俄贷款,1996-02-21,1996-02
以色列成立新政党,1996-02-21,1996-02
印度三名部长引咎辞职,1996-02-21,1996-02
喜上梅梢（中国画）,1996-02-21,1996-02
鼠年迎春（剪纸）,1996-02-21,1996-02
劝酒,1996-02-21,1996-02
京城淘书,1996-02-21,1996-02
故乡的年,1996-02-21,1996-02
仰慕你，中关村北二条三号！,1996-02-22,1996-02
当干部要有压力（今日谈）,1996-02-22,1996-02
北京地区天气预报,1996-02-22,1996-02
衡阳农民开发荒山,1996-02-22,1996-02
海南农民增产增收,1996-02-22,1996-02
广东加大农业投入,1996-02-22,1996-02
河北制药集团实行强迫竞争机制,1996-02-22,1996-02
厦门着力提高经济运行质量,1996-02-22,1996-02
宁波围绕经济建设加强党建,1996-02-22,1996-02
福建初步形成立体交通网络,1996-02-22,1996-02
握手在虎头山上（现场短新闻）,1996-02-22,1996-02
广西提出五个重点,1996-02-22,1996-02
丁关根到中央新闻单位拜年,1996-02-22,1996-02
灾民新村赛春联,1996-02-22,1996-02
金陵雪中即景,1996-02-22,1996-02
宋市长和菜市场,1996-02-22,1996-02
交警姑爷“不称职”,1996-02-22,1996-02
上海举办新春全民健身咨询,1996-02-22,1996-02
局长登车拜年,1996-02-22,1996-02
爱国奉献标兵———晋为民,1996-02-22,1996-02
苏珊·波尔加挑战成功,1996-02-22,1996-02
秦陵兵马俑又发现新坑,1996-02-22,1996-02
上峡煤矿靠凝聚力增强活力,1996-02-22,1996-02
伊拉克同意萨达姆女婿回国,1996-02-22,1996-02
车臣新格罗兹年斯基镇战斗结束,1996-02-22,1996-02
波黑塞族居民大批逃离萨市,1996-02-22,1996-02
以确定议会选举日期,1996-02-22,1996-02
阿政府军和塔利班激战,1996-02-22,1996-02
卡塔尔挫败一起政变,1996-02-22,1996-02
美国新州预选揭晓（国外特写）,1996-02-22,1996-02
南报发起建唐人街运动,1996-02-22,1996-02
新春佳节情系中华,1996-02-22,1996-02
美洲八国首脑聚会寻求建立特殊联盟（评述）,1996-02-22,1996-02
乌克兰儿童的祝福,1996-02-22,1996-02
影片《热线追击》拍成,1996-02-22,1996-02
春节看《黄河的渡过》,1996-02-22,1996-02
电影资料馆建起一流影院,1996-02-22,1996-02
北京市电影改革新举动,1996-02-22,1996-02
独具澳门特色的爱情故事《大辫子的诱惑》曲折动人,1996-02-22,1996-02
观众评改《红天鹅》,1996-02-22,1996-02
《热血丰碑》展军工丰采,1996-02-22,1996-02
２０集电视剧《火热的季节》关镜,1996-02-22,1996-02
黄梅戏音乐电视剧《家》受好评,1996-02-22,1996-02
艺术之树  生命之泉,1996-02-22,1996-02
解不开的黄土情结,1996-02-22,1996-02
蓬勃发展  尚需精品,1996-02-22,1996-02
广电部发布第二批重点影片名单,1996-02-22,1996-02
热土难舍,1996-02-23,1996-02
李鹏将出席亚欧会议,1996-02-23,1996-02
请看美国的少年儿童状况,1996-02-23,1996-02
放眼长远  打好根基,1996-02-23,1996-02
为『造地公司』叫好（今日谈）,1996-02-23,1996-02
北京地区天气预报,1996-02-23,1996-02
把思想政治建设放在首位努力建设全面过硬的连队,1996-02-23,1996-02
积极发挥参政议政民主监督职能,1996-02-23,1996-02
对未来更加充满信心,1996-02-23,1996-02
深化改革首要问题是转变观念,1996-02-23,1996-02
共商国是  喜迎新春,1996-02-23,1996-02
一股新风扑面而来,1996-02-23,1996-02
为实现跨世纪的宏伟纲领贡献力量,1996-02-23,1996-02
成功的经验  广阔的前景,1996-02-23,1996-02
看到了国家的前途和希望,1996-02-23,1996-02
大开眼界  大增见识  大长志气,1996-02-23,1996-02
增强了建设有中国特色社会主义的信心,1996-02-23,1996-02
旅法华人庆新春,1996-02-23,1996-02
美前司法部长访问伊拉克,1996-02-23,1996-02
亚欧面临合作新机遇,1996-02-23,1996-02
沙特国王重掌国家权力,1996-02-23,1996-02
蒙古春节市场繁荣,1996-02-23,1996-02
本周为庆祝农历新年周,1996-02-23,1996-02
罗中友协举办活动庆祝春节,1996-02-23,1996-02
希望深化卢中合作,1996-02-23,1996-02
俄中关系发展无任何障碍,1996-02-23,1996-02
放目阳关,1996-02-23,1996-02
暮归图（中国画）,1996-02-23,1996-02
新春漫话新春诗,1996-02-23,1996-02
喜迎春（剪纸）,1996-02-23,1996-02
压岁蔸拾遗,1996-02-23,1996-02
寻常百姓,1996-02-23,1996-02
姥姥家门口唱大戏,1996-02-23,1996-02
戏  林 （中国画）,1996-02-23,1996-02
广西６６万各族群众告别贫困,1996-02-24,1996-02
万安两万农户办家庭图书室,1996-02-24,1996-02
企业领导“持证上岗”好（今日谈）,1996-02-24,1996-02
北京地区天气预报,1996-02-24,1996-02
鲜花消费带出数千花店,1996-02-24,1996-02
许昌社区学院办出职教特色,1996-02-24,1996-02
美岭之路,1996-02-24,1996-02
特别的奖匾（现场短新闻）,1996-02-24,1996-02
山区农民看到了卫星电视,1996-02-24,1996-02
新疆限期解决农牧民饮水问题,1996-02-24,1996-02
湖南备耕工作动手早,1996-02-24,1996-02
未来一周天气趋势,1996-02-24,1996-02
壮乡各族群众踊跃慰问子弟兵,1996-02-24,1996-02
广州站来了军校大学生,1996-02-24,1996-02
丙子新春于伶喜迎９０华诞上海市党政领导看望巴金,1996-02-24,1996-02
小康村的扶贫联合体,1996-02-24,1996-02
广元廉政教育出新招,1996-02-24,1996-02
黑土地再燃火热拥军情,1996-02-24,1996-02
举成天反重渠报为津腐要道,1996-02-24,1996-02
文明更能生财,1996-02-24,1996-02
安全的核能,1996-02-24,1996-02
美国军事干预新特征（国际论坛）,1996-02-24,1996-02
标题新闻,1996-02-24,1996-02
英不向欧盟出让防务决策权,1996-02-24,1996-02
法宣布国防改革重大措施,1996-02-24,1996-02
美『哥伦比亚』号航天飞机升空,1996-02-24,1996-02
大象相争  驴子得利,1996-02-24,1996-02
朝提出改善与美关系新建议,1996-02-24,1996-02
心系云南震灾区,1996-02-24,1996-02
穆克警察进入萨市塞控区,1996-02-24,1996-02
严格按苏中协定标定俄中东段边界,1996-02-24,1996-02
波黑：塞军宣布同北约部队恢复关系,1996-02-24,1996-02
伊朗称美国将对伊空难赔偿,1996-02-24,1996-02
叶利钦总统发表国情咨文,1996-02-24,1996-02
长白国际狩猎场冬景,1996-02-24,1996-02
剪纸,1996-02-24,1996-02
期  盼,1996-02-24,1996-02
书  法,1996-02-24,1996-02
关于鞭炮及禁鞭的话题,1996-02-24,1996-02
过年小记,1996-02-24,1996-02
相伴在天涯（摄影）,1996-02-24,1996-02
关中情,1996-02-24,1996-02
赶  集（中国画）,1996-02-24,1996-02
塑造民族灵魂的佳作,1996-02-24,1996-02
大山赋,1996-02-24,1996-02
四川抓住机遇富民兴川,1996-02-25,1996-02
西藏实施科技兴藏战略,1996-02-25,1996-02
“大哥大”佳节传情,1996-02-25,1996-02
李鹏看望电力航天系统节日值班人员,1996-02-25,1996-02
文化轻骑到农家,1996-02-25,1996-02
北京地区天气预报,1996-02-25,1996-02
卢森堡首相容克,1996-02-25,1996-02
让机遇落地生金,1996-02-25,1996-02
盼领导干部带头控烟（今日谈）,1996-02-25,1996-02
湖南六天连降四场春雪,1996-02-25,1996-02
昆山解决城市发展与耕地保护矛盾,1996-02-25,1996-02
梅杰认为北约仍是欧洲安全的基石,1996-02-25,1996-02
武柴开拓市场重质量也重销售,1996-02-25,1996-02
煤炭行业社会保险进展快,1996-02-25,1996-02
控制肥价上涨  保护农民利益,1996-02-25,1996-02
呼吁美国改善同中国关系,1996-02-25,1996-02
卡迈勒兄弟被枪杀(伊拉克),1996-02-25,1996-02
日美就战区导弹防御设想缔结备忘录,1996-02-25,1996-02
联合国难民署指责穆克联邦警察,1996-02-25,1996-02
京人争看《好人润五》,1996-02-25,1996-02
香港连日低温引起多人死亡,1996-02-25,1996-02
俄单方面中止对波黑塞族制裁,1996-02-25,1996-02
罗曼．罗兰与《阿Ｑ正传》,1996-02-25,1996-02
澳洲国庆走笔,1996-02-25,1996-02
施教岂只在学校,1996-02-25,1996-02
“绅士风度”琐谈,1996-02-25,1996-02
莎翁研究  又起风波,1996-02-25,1996-02
广州的旅游前景,1996-02-25,1996-02
中国儿童剧场推出“少儿文艺天地”,1996-02-25,1996-02
田华办学校,1996-02-25,1996-02
第一大鼓问世,1996-02-25,1996-02
为农村儿童送戏,1996-02-25,1996-02
《梦醒五棵柳》刮起东北风,1996-02-25,1996-02
请观众评春节好节目,1996-02-25,1996-02
“中国唱法”研讨会召开,1996-02-25,1996-02
东门礁文化节,1996-02-25,1996-02
植根传统  着眼现代,1996-02-25,1996-02
大连市椒金山隧道顺利贯通,1996-02-26,1996-02
中科院上海计算机网络建成,1996-02-26,1996-02
中航油总公司服务优效益好,1996-02-26,1996-02
北京地区天气预报,1996-02-26,1996-02
南棉强化基础管理见成效,1996-02-26,1996-02
上海实施国有工业资本重组,1996-02-26,1996-02
春节期间黄山游客络绎不绝,1996-02-26,1996-02
海上先锋军威扬,1996-02-26,1996-02
“这田还是有种头”,1996-02-26,1996-02
万宝集团冰箱出口超３０万台,1996-02-26,1996-02
广州加快国有企业改革步伐,1996-02-26,1996-02
为有奇葩俏枝头,1996-02-26,1996-02
李鹏总理与容克首相会谈,1996-02-26,1996-02
怎样判断银根松紧？,1996-02-26,1996-02
达川乡镇企业名列四川前茅,1996-02-26,1996-02
唐山在环渤海开放中快马加鞭,1996-02-26,1996-02
成都艾特航空制造公司成立,1996-02-26,1996-02
先锋公司在京举行新产品演示会,1996-02-26,1996-02
湖南农民冬购春肥好热闹,1996-02-26,1996-02
货足则价稳（编后）,1996-02-26,1996-02
上栗成为赣西最大红薯加工基地,1996-02-26,1996-02
北京管市场的与办市场的脱钩,1996-02-26,1996-02
内蒙古正在成为我国产粮区,1996-02-26,1996-02
国家医疗器械专家评审委员会成立,1996-02-26,1996-02
夏津净增棉田十万亩,1996-02-26,1996-02
强化管理  振兴机械、汽车工业（振兴支柱产业）,1996-02-26,1996-02
克旗经济协作取得成效,1996-02-26,1996-02
盐城贫困村全部脱贫,1996-02-26,1996-02
德州市乡镇企业重科技投入,1996-02-26,1996-02
郑州矿务局改制走向市场,1996-02-26,1996-02
新疆进出口比上年增长近三成,1996-02-26,1996-02
天津建设“四过硬”公安队伍,1996-02-26,1996-02
新时期实践党和军队宗旨的模范（专论）,1996-02-26,1996-02
北京出台“护城河工程”,1996-02-26,1996-02
河南公安机关提高干警素质,1996-02-26,1996-02
范志英先进事迹引起反响,1996-02-26,1996-02
广西刑事案件大幅减少,1996-02-26,1996-02
武警海南边防总队维护沿海治安,1996-02-26,1996-02
震撼心灵的旋律,1996-02-26,1996-02
空军第十工程总队重人才,1996-02-26,1996-02
各地纷纷慰问南沙官兵,1996-02-26,1996-02
“为特困企业送个好项目”,1996-02-26,1996-02
天津查获走私汽车大案,1996-02-26,1996-02
专家在京研讨保健品问题,1996-02-26,1996-02
喜看高雅艺术升温（人民论坛）,1996-02-26,1996-02
“我们都有一个家”,1996-02-26,1996-02
刘同志逝世,1996-02-26,1996-02
章孝慈在台北逝世,1996-02-26,1996-02
宜昌农民爱读书,1996-02-26,1996-02
河北出版行业“精品”迭出,1996-02-26,1996-02
杭州强化城市规划管理,1996-02-26,1996-02
枣庄举办鲁南民俗艺术节,1996-02-26,1996-02
严凤英艺术生涯在安庆展出,1996-02-26,1996-02
滇池污染治理取得重要进展,1996-02-26,1996-02
中国红十字会接收一批援滇款物,1996-02-26,1996-02
恪守原则  健全制度,1996-02-26,1996-02
北京新华书店推出一批礼品书,1996-02-26,1996-02
让绿色永驻田野,1996-02-26,1996-02
大型彩印月刊《中国商界》面世,1996-02-26,1996-02
庄河农村添银幕,1996-02-26,1996-02
湖南科技出版社不忘科普之本,1996-02-26,1996-02
安居乐教,1996-02-26,1996-02
红绿灯外交警情,1996-02-26,1996-02
承德深山有戏台,1996-02-26,1996-02
我首台载人磁悬浮列车及实验线通过鉴定,1996-02-26,1996-02
中国艺术教育促进会成立,1996-02-26,1996-02
《爸爸妈妈读过的书》发行,1996-02-26,1996-02
黎真主党再次袭击以军阵地（短讯）,1996-02-26,1996-02
德总理俄罗斯之行（综述）,1996-02-26,1996-02
柬举行『地雷意识日』活动（短讯）,1996-02-26,1996-02
二次大战结束五十年  五千余纳粹罪案未了,1996-02-26,1996-02
库奇马谈乌美关系,1996-02-26,1996-02
以色列接连发生两起爆炸,1996-02-26,1996-02
古击落在美流亡团体两飞机,1996-02-26,1996-02
伊拉克举行隆重葬礼,1996-02-26,1996-02
约旦希望与科威特关系正常化（短讯）,1996-02-26,1996-02
土耳其祖国党和繁荣党组阁失败,1996-02-26,1996-02
斯里兰卡首都加强戒备,1996-02-26,1996-02
德国密切关注法国军队改革（短讯）,1996-02-26,1996-02
索斯科韦茨谈俄总统竞选（短讯）,1996-02-26,1996-02
一周国际要闻回顾（２月１９日至２５日）,1996-02-26,1996-02
中东欧是俄外交重点,1996-02-26,1996-02
韩国总统首访印度,1996-02-26,1996-02
一次象征性访问,1996-02-26,1996-02
饥寒交迫喀布尔（阿富汗通讯）,1996-02-26,1996-02
多种植物共生相互受益,1996-02-26,1996-02
土愿与叙举行谈判,1996-02-26,1996-02
星际间存在水和碳元素,1996-02-26,1996-02
荷兰一游客在美被杀,1996-02-26,1996-02
中国的发展令人瞩目,1996-02-26,1996-02
四名华人青年学者获美“总统教师奖”,1996-02-26,1996-02
利用暑假  助人为乐,1996-02-26,1996-02
我人大向马里议会赠物,1996-02-26,1996-02
摩卢巴以四国签署协议,1996-02-26,1996-02
我加入国际热带木材协定,1996-02-26,1996-02
智利采取措施制止洗钱活动,1996-02-26,1996-02
巴基斯坦发生一起交通事故,1996-02-26,1996-02
朝鲜韩国贸易额逾三亿美元,1996-02-26,1996-02
墨华侨向云南灾区捐款,1996-02-26,1996-02
墨西哥城发生５．６级地震,1996-02-26,1996-02
塔总统下令鼓励科研人员,1996-02-26,1996-02
罗一架安２４飞机失事,1996-02-26,1996-02
谢军失利的反思,1996-02-26,1996-02
家族的力量,1996-02-26,1996-02
澳大利亚禁药官员“请教”加拿大同行,1996-02-26,1996-02
陈露仅获第四名,1996-02-26,1996-02
中国男女队均获出线权,1996-02-26,1996-02
八一队高快结合无坚不摧,1996-02-26,1996-02
路会越走越宽,1996-02-26,1996-02
欧洲足联决定取消对欧盟球员转会限制,1996-02-26,1996-02
把讲政治落到实处（读者论坛）,1996-02-26,1996-02
幼牛何辜,1996-02-26,1996-02
学校借机乱收费,1996-02-26,1996-02
破除千年陋俗,1996-02-26,1996-02
喜帖到手忧愁来,1996-02-26,1996-02
不该这样处理假货,1996-02-26,1996-02
这个靶场须搬迁,1996-02-26,1996-02
玉林地区经济振兴之路,1996-02-26,1996-02
深化流通体制改革  发展物资流通代理制,1996-02-26,1996-02
家庭联产承包制的建立与稳定,1996-02-26,1996-02
难忘的岁月  珍贵的友谊,1996-02-26,1996-02
心血心史照眼明,1996-02-26,1996-02
中华人民共和国外汇管理条例,1996-02-26,1996-02
乐章之间不鼓掌,1996-02-26,1996-02
霍林郭勒山水,1996-02-26,1996-02
金石巨子陈介祺,1996-02-26,1996-02
妙笔丹青铸虎魂,1996-02-26,1996-02
萧山三十年围垦海涂五十万亩,1996-02-27,1996-02
东北经济出现新亮点,1996-02-27,1996-02
热流暖边关,1996-02-27,1996-02
重庆实施“为民办实事工程”,1996-02-27,1996-02
双休日的新鲜事（今日谈）,1996-02-27,1996-02
小车滚滚推出莱芜路,1996-02-27,1996-02
北京市领导假日学习计算机,1996-02-27,1996-02
长沙望城坡经济开发区讲实效,1996-02-27,1996-02
北京地区天气预报,1996-02-27,1996-02
常州高新技术开发区初具规模,1996-02-27,1996-02
岁岁为民办实事  今年再添二十桩,1996-02-27,1996-02
开发一种果子  振兴一项产业,1996-02-27,1996-02
花生销路在何方？,1996-02-27,1996-02
本溪煤矿二次创业开门红,1996-02-27,1996-02
财政部发布１９９６年到期各类国债券还本付息公告,1996-02-27,1996-02
欢迎『被外人吃掉』（经济增长方式转变谈④）,1996-02-27,1996-02
高路华，十年一座电子城,1996-02-27,1996-02
谊成公司开展家电连锁经营,1996-02-27,1996-02
民权三十万农民发『羊』财,1996-02-27,1996-02
当阳农电部门加强为农服务,1996-02-27,1996-02
让科技上山（编后小议）,1996-02-27,1996-02
河北二十六个贫困县面貌改观,1996-02-27,1996-02
丘县领导认真为民解难题,1996-02-27,1996-02
两岸关系的发展不可逆转,1996-02-27,1996-02
南召干部进村入户办实事,1996-02-27,1996-02
潍坊奎文区抓治安重在预防,1996-02-27,1996-02
抚顺公安机关净化社会环境,1996-02-27,1996-02
王学习获全国优秀人民警察称号,1996-02-27,1996-02
公民权益的“守护人”——记海南省社会保障法庭,1996-02-27,1996-02
福建海防部队副食自给有余,1996-02-27,1996-02
让党支部活跃在工地上,1996-02-27,1996-02
企业改制  组织不散,1996-02-27,1996-02
把“温暖”送到“寒冷”处,1996-02-27,1996-02
面对面  心贴心,1996-02-27,1996-02
钱其琛会见卢森堡首相,1996-02-27,1996-02
迟浩田会见罗马尼亚客人,1996-02-27,1996-02
外交部发言人答记者问,1996-02-27,1996-02
他们更需要艺术,1996-02-27,1996-02
张缉光同志逝世,1996-02-27,1996-02
去年全国十大考古新发现评出,1996-02-27,1996-02
桥头有个农民读书会,1996-02-27,1996-02
上海解困帮困工作深细,1996-02-27,1996-02
希望拓宽中卢经贸合作领域,1996-02-27,1996-02
制定法规建立社会保障机制  北京保证低收入者基本生活,1996-02-27,1996-02
水稻立枯病有治,1996-02-27,1996-02
提高校长教师素质是关键,1996-02-27,1996-02
新型喷雾喷粉机问世,1996-02-27,1996-02
大连交通管理科学化,1996-02-27,1996-02
北京为薄弱学校“输血”,1996-02-27,1996-02
“火炬计划”燃遍神州,1996-02-27,1996-02
长铁送“粮”到小站,1996-02-27,1996-02
千余县基本实现『普九』和扫盲,1996-02-27,1996-02
唐都医院再铸辉煌,1996-02-27,1996-02
棉铃虫又遇新克星,1996-02-27,1996-02
以色列爆炸案  国际社会谴责恐怖活动,1996-02-27,1996-02
罗社会主义劳动党举行代表大会,1996-02-27,1996-02
从北约东扩看『冷和』（国际论坛）,1996-02-27,1996-02
俄军在印古什同车臣武装作战,1996-02-27,1996-02
全斗焕出庭受审,1996-02-27,1996-02
独联体热点的形成及现状,1996-02-27,1996-02
巴委员会将于三月初成立,1996-02-27,1996-02
美海军着手提高潜艇隐形能力,1996-02-27,1996-02
英同意与新芬党会谈,1996-02-27,1996-02
艾迪德谴责美对索政策,1996-02-27,1996-02
赤道几内亚举行总统大选,1996-02-27,1996-02
以决定长期封锁巴地区,1996-02-27,1996-02
朝报批评日对朝政策,1996-02-27,1996-02
意大利大选拉开帷幕（综述）,1996-02-27,1996-02
塞冲突双方首次举行和谈,1996-02-27,1996-02
不堪重负（美术）,1996-02-27,1996-02
谍报做到盟友家,1996-02-27,1996-02
英将推出固定移动兼用电话,1996-02-27,1996-02
善抓机遇  选贤任能,1996-02-27,1996-02
美航天机断缆绳系卫星丢失,1996-02-27,1996-02
德国伪钞日益增多,1996-02-27,1996-02
九五年美经济增长放慢,1996-02-27,1996-02
全球股市去年上扬,1996-02-27,1996-02
圣彼得堡汉语学校师生贺新春,1996-02-27,1996-02
莫斯科轮胎厂失火,1996-02-27,1996-02
“单一货币”在法引起争论（综述）,1996-02-27,1996-02
重返绿茵之后（连载１）,1996-02-27,1996-02
穆托拉瞄准两枚奥运会金牌,1996-02-27,1996-02
马晓春首盘告负,1996-02-27,1996-02
北京国安足球队与球迷聚首,1996-02-27,1996-02
爱德华兹格拉芙和阿贾克斯队当选,1996-02-27,1996-02
广州太阳神队获亚军,1996-02-27,1996-02
乐富门威廉姆斯车队添新血,1996-02-27,1996-02
深圳宏昌公司资助体育事业,1996-02-27,1996-02
中国国奥足球队战平乌兹别克斯坦队,1996-02-27,1996-02
趁热打铁,1996-02-27,1996-02
四骁将刷新世界纪录,1996-02-27,1996-02
转变农业增长方式的制约因素及其对策,1996-02-27,1996-02
全面理解和整体把握改革、发展、稳定三者关系,1996-02-27,1996-02
发展市场经济必须坚持群众路线,1996-02-27,1996-02
现代企业制度理论研究的新成果,1996-02-27,1996-02
母亲的五谷袋,1996-02-27,1996-02
『进出口平衡』与城市公厕,1996-02-27,1996-02
信息廊,1996-02-27,1996-02
火车票调价以后,1996-02-27,1996-02
让『数字升官』者降职,1996-02-27,1996-02
小事看美国,1996-02-27,1996-02
『站会』,1996-02-27,1996-02
群众对“送温暖”活动有五盼,1996-02-27,1996-02
电教节目有声有色,1996-02-27,1996-02
辉南县基层班子民主生活会别开生面,1996-02-27,1996-02
怎样当好“班长”,1996-02-27,1996-02
认真调整  精兵简政,1996-02-27,1996-02
建湖县管理外出党员有新招,1996-02-27,1996-02
新『官』上任『三不搞』,1996-02-27,1996-02
敢顶歪风的硬脊梁,1996-02-27,1996-02
心系百姓奔小康,1996-02-27,1996-02
穿水兵服的北大荒人,1996-02-27,1996-02
风景,1996-02-27,1996-02
紫砂壶,1996-02-27,1996-02
注水肉与圈圈儿,1996-02-27,1996-02
《倒淌河》的情韵,1996-02-27,1996-02
农村工作提神之举,1996-02-28,1996-02
全国政协常委会举行第１５次会议,1996-02-28,1996-02
沪宁高速公路全线贯通,1996-02-28,1996-02
乔石委员长会见容克首相,1996-02-28,1996-02
北京地区天气预报,1996-02-28,1996-02
黑龙江省领导同群众共商发展大计,1996-02-28,1996-02
晋又有三十六万人脱贫,1996-02-28,1996-02
山东口岸加工贸易进出口逾７０亿美元,1996-02-28,1996-02
中卢签署六个合作文件,1996-02-28,1996-02
江泽民主席会见容克首相,1996-02-28,1996-02
就发行１９９６年无记名（一期）国债  财政部发布公告,1996-02-28,1996-02
寄希望于台湾人民,1996-02-28,1996-02
田阳农民又认出身边谁是党员,1996-02-28,1996-02
安徽加大投入办水利,1996-02-28,1996-02
竹子应成大产业（编后小议）,1996-02-28,1996-02
今年植树节主题：共建绿色家园,1996-02-28,1996-02
铁路精兵干水电,1996-02-28,1996-02
美菱推行“三维动态目标管理”,1996-02-28,1996-02
我国期货市场的回顾与前瞻,1996-02-28,1996-02
万竿青竹起南平,1996-02-28,1996-02
白山市推进五荒治理,1996-02-28,1996-02
１９９６年到期国债如何兑付,1996-02-28,1996-02
郴州实施“开放兴郴”战略见成效,1996-02-28,1996-02
淄博建成一大型服装批发市场,1996-02-28,1996-02
浙江推广机械化施工,1996-02-28,1996-02
『灾后』蔡家崖,1996-02-28,1996-02
东风１１型内燃机车通过鉴定验收,1996-02-28,1996-02
葫芦岛财政资金倾斜农业,1996-02-28,1996-02
花园集团科技外贸并举效益良好,1996-02-28,1996-02
乡间新曲,1996-02-28,1996-02
一份辞职报告,1996-02-28,1996-02
加大反腐败力度  保障现代化进行,1996-02-28,1996-02
『训  妻』,1996-02-28,1996-02
“双学路”,1996-02-28,1996-02
高薪面前,1996-02-28,1996-02
中央综治委提出今年工作要点,1996-02-28,1996-02
聊城有聊头,1996-02-28,1996-02
胡锦涛会见尼泊尔客人,1996-02-28,1996-02
李鹏会见日本客人,1996-02-28,1996-02
朱镕基会见罗马尼亚客人,1996-02-28,1996-02
农民别墅喜与忧（人民论坛）,1996-02-28,1996-02
把北京建成精神文明“首善之区”,1996-02-28,1996-02
“我们不会忘记他”,1996-02-28,1996-02
香港各级公务员积极留岗迎九七,1996-02-28,1996-02
阎守庆同志逝世,1996-02-28,1996-02
革命老区涉县告别贫困,1996-02-28,1996-02
