清丰５００余复员军人成为农村中坚（短波）,1998-11-09,1998-11
邓州市整顿征兵工作纪律（征兵快讯）,1998-11-09,1998-11
罗山交警力保“绿色通道”畅通（短波）,1998-11-09,1998-11
内蒙古军区加强征兵监督（征兵快讯）,1998-11-09,1998-11
衡铁电气化技校注重发展学生入党（短波）,1998-11-09,1998-11
武警某部严格培训接兵人员（征兵快讯）,1998-11-09,1998-11
即墨公安局实施形象工程（短波）,1998-11-09,1998-11
秦皇岛新兵体检防弊有新招（征兵快讯）,1998-11-09,1998-11
为农民办实事  引导农民奔小康,1998-11-09,1998-11
上海养老保险推开两项改革举措,1998-11-09,1998-11
成都告别『城堵』,1998-11-09,1998-11
『官念』一变天地宽（人民论坛）,1998-11-09,1998-11
昆明环境综合整治面貌一新,1998-11-09,1998-11
大型画册《刘少奇》出版,1998-11-09,1998-11
毕际昌同志逝世,1998-11-09,1998-11
任志恒同志逝世,1998-11-09,1998-11
大别山区建成一级公路,1998-11-09,1998-11
北京  高度重视  精心组织（确保人民日报发行稳中有升）,1998-11-09,1998-11
安徽  确保实现稳中有升（确保人民日报发行稳中有升）,1998-11-09,1998-11
确山  认识到位  措施有力（确保人民日报发行稳中有升）,1998-11-09,1998-11
中国政治稳定经济发展吸引各国投资,1998-11-09,1998-11
第七届上海电视节开幕,1998-11-09,1998-11
人民日报访问团结束台湾之行,1998-11-09,1998-11
《抗洪壮歌》出版发行,1998-11-09,1998-11
“拾花妹”专列出新疆（现场短新闻）,1998-11-09,1998-11
明天气象预报,1998-11-09,1998-11
高技术产业化的创举（纪念改革开放二十年难忘第一）,1998-11-09,1998-11
迅速冲向国际前沿,1998-11-09,1998-11
大连理工大科技产业兴旺,1998-11-09,1998-11
北大清华蓝旗营教师住宅工程开工,1998-11-09,1998-11
北京启动高技术企业担保风险金,1998-11-09,1998-11
创造温暖的孵化器（编余短论）,1998-11-09,1998-11
翡翠玉雕《缔造辉煌》启动（教科文短波）,1998-11-09,1998-11
第四届全国舞蹈比赛在杭举行（教科文短波）,1998-11-09,1998-11
第五届中国杨凌农业科技博览会开幕（教科文短波）,1998-11-09,1998-11
湖南大学多媒体信息教育学院开学（教科文短波）,1998-11-09,1998-11
南海青年学生营开营（教科文短波）,1998-11-09,1998-11
微软中国研究院成立（教科文短波）,1998-11-09,1998-11
美决定部分解除对印巴制裁,1998-11-09,1998-11
俄乌群众纪念十月革命胜利日,1998-11-09,1998-11
美舰黑海唱主角（综述）,1998-11-09,1998-11
巴以搜捕耶城爆炸案涉嫌者,1998-11-09,1998-11
李铁映在华盛顿访问,1998-11-09,1998-11
德新领导人接踵访波（述评）,1998-11-09,1998-11
印尼将严厉打击暴力活动,1998-11-09,1998-11
孟加拉国一法院作出判决,1998-11-09,1998-11
金里奇将辞去美众议员职务,1998-11-09,1998-11
德基民盟选出新领导班子,1998-11-09,1998-11
塔政府军平息叛乱,1998-11-09,1998-11
法国的塞尔维亚情结（新闻背景）,1998-11-09,1998-11
臭氧洞关乎你我他（科技漫话）,1998-11-09,1998-11
东亚国家刺激经济增长,1998-11-09,1998-11
让孩子学得更主动（通讯）,1998-11-09,1998-11
俄金融危机可能导致政治偏差,1998-11-09,1998-11
日本  经济形势“冰封”  毕业学生“冷冻”,1998-11-09,1998-11
联合研制生物芯片  快速测定人类基因,1998-11-09,1998-11
一肝脏植入俩成人  意大利医术新突破,1998-11-09,1998-11
法国弥天大雾  百车超速追尾,1998-11-09,1998-11
珠海国际汽车赛结束,1998-11-09,1998-11
芬兰太阳能量队夺冠,1998-11-09,1998-11
马背上的较量,1998-11-09,1998-11
我队打入四强峰回路转,1998-11-09,1998-11
不同档次的较量,1998-11-09,1998-11
王楠蝉联世界杯女乒赛冠军,1998-11-09,1998-11
生机从天降,1998-11-09,1998-11
全国民运会北京赛区得到赞助,1998-11-09,1998-11
中国选手获两项冠军,1998-11-09,1998-11
海峡两岸保龄球赛排名赛落幕,1998-11-09,1998-11
扩大内需应注意哪些问题？（观点）,1998-11-09,1998-11
『洋批发』悄然涉足中国市场,1998-11-09,1998-11
“丹尼斯量贩”掀动郑州商战浪,1998-11-09,1998-11
潜力不等于市场（经济茶座）,1998-11-09,1998-11
天网不漏“中天诚”,1998-11-09,1998-11
别让垃圾毁了“东方夏威夷”,1998-11-09,1998-11
苹果只有核桃大  多年心血咋赔偿（地方经济新闻集锦）,1998-11-09,1998-11
贪大求洋风光一时  开业三年即告沉沦（地方经济新闻集锦）,1998-11-09,1998-11
渡槽修了二十年至今未过一次水（地方经济新闻集锦）,1998-11-09,1998-11
走私分子的下场,1998-11-09,1998-11
金华县税案透析（热点聚焦）,1998-11-09,1998-11
外汇调剂业务为何取消（金海观潮）,1998-11-09,1998-11
证券法是利好,1998-11-09,1998-11
从商业增值税中挖“潜力”,1998-11-09,1998-11
中国电信受到香港投资界好评,1998-11-09,1998-11
上证综合指数日Ｋ线图,1998-11-09,1998-11
深证成份指数日Ｋ线图,1998-11-09,1998-11
上周股市概览,1998-11-09,1998-11
沪市上周上涨前五名（％）,1998-11-09,1998-11
沪市上周下跌前五名（％）,1998-11-09,1998-11
深市上周上涨前五名（％）,1998-11-09,1998-11
深市上周下跌前五名（％）,1998-11-09,1998-11
邯郸工行支持基础产业（财金短波）,1998-11-09,1998-11
桂林国税高新分局培育税源（财金短波）,1998-11-09,1998-11
龙口地税局健全堵漏机制（财金短波）,1998-11-09,1998-11
怡富中国概念股研讨会举行（财金短波）,1998-11-09,1998-11
新余工行支持企业开发新品（财金短波）,1998-11-09,1998-11
扩大内需应注意哪些问题？（观点）,1998-11-09,1998-11
数字视听新产品登堂入室（市场扫描）,1998-11-09,1998-11
国产水果  呼唤质量标准,1998-11-09,1998-11
双休日上哪儿去？  出海去，下乡去,1998-11-09,1998-11
海信设擂,1998-11-09,1998-11
神奇的国产机器人,1998-11-09,1998-11
职业期盼：稳定压倒高薪,1998-11-09,1998-11
农民洗土豆用洗衣机？（各抒己见）,1998-11-09,1998-11
中越海上旅游航线开通（新产品·新技术）,1998-11-09,1998-11
三诺推出“合成影院”（新产品·新技术）,1998-11-09,1998-11
东鹏陶瓷集团攻克抛光砖吸污难题（新产品·新技术）,1998-11-09,1998-11
恒旺公司引进新型防伪标识（新产品·新技术）,1998-11-09,1998-11
羊绒业亟须加快联合,1998-11-09,1998-11
『软黄金』咋成了『赔钱货』,1998-11-09,1998-11
消费者可放心购买,1998-11-09,1998-11
看谁赔得起,1998-11-09,1998-11
穿羊绒衫要特别在意,1998-11-09,1998-11
注明羊绒含量有疑可测,1998-11-09,1998-11
价低了不是羊绒衫,1998-11-09,1998-11
１０月份工业增长１０．６％,1998-11-10,1998-11
武钢：力保全年三亿元利润,1998-11-10,1998-11
华为：今年销售额可达百亿,1998-11-10,1998-11
中华文明是人类社会宝贵财富,1998-11-10,1998-11
江泽民会见俄罗斯联邦最高法院院长,1998-11-10,1998-11
深入学习邓小平党风廉政建设和反腐败论述,1998-11-10,1998-11
开创企业对口支援工作新局面,1998-11-10,1998-11
欲盖弥彰,1998-11-10,1998-11
北京地区天气预报,1998-11-10,1998-11
开创企业对口支援工作新局面,1998-11-10,1998-11
各地加快冬季农田水利建设（落实中央决定  夯实农业基础）,1998-11-10,1998-11
再造山河写新篇（扶贫攻坚在神州⑸）,1998-11-10,1998-11
野生动物保护十年喜忧参半,1998-11-10,1998-11
金河工程展现现代农业前景,1998-11-10,1998-11
隧道局建设重点工程精打细算,1998-11-10,1998-11
用好基础设施建设资金（编后）,1998-11-10,1998-11
宜宾加大投资拉动经济发展,1998-11-10,1998-11
全国畜产品交易会开幕,1998-11-10,1998-11
“豆腐渣”工程遇“红灯”（新闻快报）,1998-11-10,1998-11
河南商城县四年引资近亿元（新闻快报）,1998-11-10,1998-11
信息化建设抓３个重点（新闻快报）,1998-11-10,1998-11
汕汾高速公路汕头路段开工,1998-11-10,1998-11
石家庄推行电子报税（新闻快报）,1998-11-10,1998-11
中保息县寿险公司抓文明促发展,1998-11-10,1998-11
宁夏穷山深处电话通（新闻快报）,1998-11-10,1998-11
青岛至银川高速公路开工,1998-11-10,1998-11
莱西市电厂发展多种经营促主业,1998-11-10,1998-11
河北创建『十星级』文明农户 （文明村镇创建活动巡礼①）,1998-11-10,1998-11
宁津健全农村民主监督制度,1998-11-10,1998-11
事业单位登记管理暂行条例,1998-11-10,1998-11
民盟全国工作会议在京召开,1998-11-10,1998-11
河南公安机关教育整顿除肌瘤,1998-11-10,1998-11
合肥公安把队伍建设摆在首位,1998-11-10,1998-11
十大检察官首场报告会反响强烈,1998-11-10,1998-11
《村委会组织法学习读本》出版,1998-11-10,1998-11
『勿忘国耻纪实丛书』问世,1998-11-10,1998-11
安阳市郊区法院主动接受人大监督,1998-11-10,1998-11
岂能为走私小汽车开绿灯（社会观察）,1998-11-10,1998-11
纪念十一届三中全会召开二十周年全军理论研讨会在京举行,1998-11-10,1998-11
哈尔滨五龄童致信加利表达愿望  百国驻华使节签字题词同声支持,1998-11-10,1998-11
长江洲湾堵口复堤工程启动,1998-11-10,1998-11
钢梁凌空飞架  桥下行车依旧,1998-11-10,1998-11
广西打击汽车走私初见战果（打击走私沿海行）,1998-11-10,1998-11
柴达木至敦煌输气管道贯通,1998-11-10,1998-11
十典百卷  八载艰辛,1998-11-10,1998-11
李玉奎同志逝世,1998-11-10,1998-11
著名诗人公木病逝,1998-11-10,1998-11
明天气象预报,1998-11-10,1998-11
比利时首相结束访华回国（友好往来）,1998-11-10,1998-11
钱其琛会见印尼总统特使（友好往来）,1998-11-10,1998-11
钱其琛会见英国客人（友好往来）,1998-11-10,1998-11
吴仪会见雀巢集团行政总裁（友好往来）,1998-11-10,1998-11
戴秉国会见非洲客人（友好往来）,1998-11-10,1998-11
中俄最高法院合作协议签署（友好往来）,1998-11-10,1998-11
我国制成高温气冷堆关键设备,1998-11-10,1998-11
新乡农业连续七年攀高,1998-11-10,1998-11
黄工集团培养“三高”人才,1998-11-10,1998-11
湖北水毁学校迅速重建,1998-11-10,1998-11
临汾中心血站职工常年带头献血,1998-11-10,1998-11
大学公共英语教改初见成效,1998-11-10,1998-11
广西大学喜庆七十华诞,1998-11-10,1998-11
中国队半决赛迎战俄罗斯队,1998-11-10,1998-11
郎平评球,1998-11-10,1998-11
再筑“天安门城墙”,1998-11-10,1998-11
中国杯速度赛马公开赛揭幕,1998-11-10,1998-11
围棋小将邱峻淘汰刘小光,1998-11-10,1998-11
二十集大型足球专题片开机,1998-11-10,1998-11
北京－－广州高校自行车赛启程,1998-11-10,1998-11
北京保龄球大赛选手逾十万,1998-11-10,1998-11
中国乒乓球队亚运会目标：四至五金,1998-11-10,1998-11
中国乒乓球队到正定备战亚运会,1998-11-10,1998-11
范志毅有话要说,1998-11-10,1998-11
第五届『吴杨』奖颁奖,1998-11-10,1998-11
石河子建成艾青诗歌馆,1998-11-10,1998-11
ＴＭＴ保护剂消除汽车尾气污染,1998-11-10,1998-11
希望建立韩中伙伴关系,1998-11-10,1998-11
伊拉克重申无意恢复与特委会合作  克林顿召集阁僚讨论解决危机手段,1998-11-10,1998-11
经济全球化和『泰坦尼克』号（国际论坛）,1998-11-10,1998-11
叶利钦中断休假返回莫斯科,1998-11-10,1998-11
印尼总统要求研究骚乱报告,1998-11-10,1998-11
柬国王主持庆祝独立节,1998-11-10,1998-11
独联体国家集会纪念十月革命,1998-11-10,1998-11
美新泰举行空军联合演习,1998-11-10,1998-11
土越境围剿库尔德工人党武装,1998-11-10,1998-11
金融动荡后美国经济走向（专论）,1998-11-10,1998-11
科特迪瓦大力发展旅游业（通讯）,1998-11-10,1998-11
全球降息起高潮,1998-11-10,1998-11
《马尼拉框架》会议在马来西亚举行,1998-11-10,1998-11
美国火车事故  化学物质泄漏,1998-11-10,1998-11
日外汇储备仍居全球之首  泰拍卖倒闭金融机构资产  泰银行降低利率刺激经济,1998-11-10,1998-11
驾驶舱电路起火  失事前便已失控,1998-11-10,1998-11
网上有庸医  看病要当心,1998-11-10,1998-11
公仆英魂系八闽  风范长存照后人,1998-11-10,1998-11
观念转变道路宽,1998-11-10,1998-11
广州“万木草堂”面目全非（记者见闻）,1998-11-10,1998-11
跨小康  再创业（公仆谈心录）,1998-11-10,1998-11
『红管家』张克贤,1998-11-10,1998-11
“有理无钱请进来”,1998-11-10,1998-11
看“亲商”说变化（采访随想）,1998-11-10,1998-11
榆林人进沙退（新风物志）,1998-11-10,1998-11
下岗办起敬老院,1998-11-10,1998-11
扎实做好本职工作（思想纵横）,1998-11-10,1998-11
在初级阶段的实现程度,1998-11-10,1998-11
『改革开放二十周年暨石狮建市十周年研讨会』述要（理论信息）,1998-11-10,1998-11
建设可持续发展的生态城市,1998-11-10,1998-11
为私营企业党员安“家”,1998-11-10,1998-11
立章建制  民主理事 （本期聚焦）,1998-11-10,1998-11
探索基层民主建设的新途径（公仆心声）,1998-11-10,1998-11
山西着力推进农村民主建设,1998-11-10,1998-11
以人为本,1998-11-10,1998-11
情系千家万户,1998-11-10,1998-11
济阳大批机关干部到生产一线建功立业（党建百花园）,1998-11-10,1998-11
大冶市实施富“智”工程见成效（党建百花园）,1998-11-10,1998-11
《社会主义市场经济条件下军队党的建设研究》出版（党建百花园）,1998-11-10,1998-11
斩断伸向计算机的黑手（民主法制述评）,1998-11-10,1998-11
这份售房合同有效吗？（律师答疑）,1998-11-10,1998-11
『白条』的警示（法治论苑）,1998-11-10,1998-11
法律不许“打白条”（监督广角）,1998-11-10,1998-11
开弓也有回头箭（漫画）,1998-11-10,1998-11
心里装着百姓（执法者风采）,1998-11-10,1998-11
玉山１１０，群众的守护神（执法者风采）,1998-11-10,1998-11
陕西法院加大查处司法腐败力度（信息通道）,1998-11-10,1998-11
河北法院着力提高法官队伍素质（信息通道）,1998-11-10,1998-11
江苏市县公安局长开始实行异地交流（信息通道）,1998-11-10,1998-11
柘城县『流动综治办』为群众排忧（信息通道）,1998-11-10,1998-11
东平县公安局刑警确保一方平安（信息通道）,1998-11-10,1998-11
台山人大授予百余海内外人士名誉称号（信息通道）,1998-11-10,1998-11
电视剧《咱家爷们儿》近期播出（信息通道）,1998-11-10,1998-11
内蒙古：共筑千里黄河大堤（省区市的“务实之笔”）,1998-11-11,1998-11
我国金融运行继续平稳发展,1998-11-11,1998-11
胡锦涛会见日本民主党代表团,1998-11-11,1998-11
加拿大总理西班牙参议长将访华,1998-11-11,1998-11
大韩民国总统金大中（人物介绍）,1998-11-11,1998-11
丰收之后看粮仓,1998-11-11,1998-11
谈江主席出访俄日的意义,1998-11-11,1998-11
割不断的医患情,1998-11-11,1998-11
中标“碱场地”（喜看改革开放二十年）,1998-11-11,1998-11
北京地区天气预报,1998-11-11,1998-11
技术出口：这里阳光灿烂（经济视点）,1998-11-11,1998-11
铁面税官,1998-11-11,1998-11
保定地税收入四年迈出四大步（加强税收征管  确保增收千亿）,1998-11-11,1998-11
国企安排职工下岗需按一定程序（两个“确保”政策咨询）,1998-11-11,1998-11
广东突出重点整治汽摩配件市场,1998-11-11,1998-11
秦山核电二期工程１号反应堆安全壳封顶成功,1998-11-11,1998-11
李家峡水电站主体工程竣工,1998-11-11,1998-11
新的进口药品注册证启用,1998-11-11,1998-11
前三季度住宅建设势头好,1998-11-11,1998-11
财政部向保险公司发行债券,1998-11-11,1998-11
不要盲目赶进度,1998-11-11,1998-11
种子掺砂过半  奸商坑农不浅,1998-11-11,1998-11
北京调整出租汽车租价,1998-11-11,1998-11
尽量避免使用木质包装,1998-11-11,1998-11
安阳铁西国税局严格内部考核（加强税收征管  确保增收千亿）,1998-11-11,1998-11
沈阳铁西国税局签清欠责任状（加强税收征管  确保增收千亿）,1998-11-11,1998-11
国家厂丝储备仓库在吴江设立,1998-11-11,1998-11
重庆举办涪陵榨菜文化节,1998-11-11,1998-11
企业信息化研讨交流会将召开,1998-11-11,1998-11
北京大学主办房地产业研讨会,1998-11-11,1998-11
沧州华升精铸公司获质量认证,1998-11-11,1998-11
株洲建下岗青工再就业市场,1998-11-11,1998-11
沈阳全密封变压器厂质量过硬,1998-11-11,1998-11
宁德百余农村宣教中心生机勃勃（文明村镇创建活动巡礼②）,1998-11-11,1998-11
太原警校创立教学派出所,1998-11-11,1998-11
首届『张福运先生纪念讲坛』举办,1998-11-11,1998-11
“港澳台资与改革开放”座谈会举行,1998-11-11,1998-11
全军老兵退伍工作电话会议召开,1998-11-11,1998-11
全国公安英烈基金接受捐款,1998-11-11,1998-11
夯实基础坝自安,1998-11-11,1998-11
锦州公安边防积极开展治安联防（短波）,1998-11-11,1998-11
舞阳县全面推行村务公开制度（短波）,1998-11-11,1998-11
平凉市开通拥军公交专线（短波）,1998-11-11,1998-11
武警某部为驻地经济繁荣献力（短波）,1998-11-11,1998-11
中方县积极分流机关人员（短波）,1998-11-11,1998-11
铜山县严厉制止铺张浪费（短波）,1998-11-11,1998-11
不要绕着问题走（人民论坛）,1998-11-11,1998-11
中央国家机关认真贯彻三中全会精神,1998-11-11,1998-11
外交部发言人发表评论,1998-11-11,1998-11
中直机关首届文化艺术节开幕,1998-11-11,1998-11
著名农学家杨显东逝世,1998-11-11,1998-11
澳门各界欢迎推委会产生办法,1998-11-11,1998-11
一批纪念书籍音像制品问世,1998-11-11,1998-11
河南纪念中原局成立六十周年暨刘少奇百年诞辰,1998-11-11,1998-11
组织党员干部观看《条例》电视片,1998-11-11,1998-11
支持澳门加入国际奥委会,1998-11-11,1998-11
天津邮局收投合一效益上升,1998-11-11,1998-11
国际企业律师协会首届年会在京举行,1998-11-11,1998-11
明天气象预报,1998-11-11,1998-11
钱其琛会见美国客人（友好往来）,1998-11-11,1998-11
傅全有会见美军太平洋总部司令（友好往来）,1998-11-11,1998-11
美军太平洋总部司令在京访问（友好往来）,1998-11-11,1998-11
割不断的医患情,1998-11-11,1998-11
武大中青年教师『唱主角』,1998-11-11,1998-11
这个舞台搭得好（编余短论）,1998-11-11,1998-11
我国第一艘飞翼船试飞成功,1998-11-11,1998-11
网络界专家话网络,1998-11-11,1998-11
艺术发展战略研讨会在京举行,1998-11-11,1998-11
科技界抗洪先进受表彰,1998-11-11,1998-11
六省市外来人口子女就学达９６．２％,1998-11-11,1998-11
生态环境建设是一项长期工作,1998-11-11,1998-11
『人与自然丛书』出版（教科文短波）,1998-11-11,1998-11
计算机用于教育国际会议召开（教科文短波）,1998-11-11,1998-11
山西脑瘫康复医院学术氛围浓（教科文短波）,1998-11-11,1998-11
国产红细胞生成素产业化（教科文短波）,1998-11-11,1998-11
英国称对伊忍耐已近极限  伊希望政治解决核查危机,1998-11-11,1998-11
俄外长高度评价俄中关系,1998-11-11,1998-11
美呼吁以批准临时协议  巴强调建国计划不改变,1998-11-11,1998-11
韩中相闻鸡啼声,1998-11-11,1998-11
伊拉克与阿联酋恢复海上航运线,1998-11-11,1998-11
苏厄召开和解会议,1998-11-11,1998-11
德国犹太人纪念“水晶之夜”,1998-11-11,1998-11
安南结束访问西撒,1998-11-11,1998-11
委举行国会和地方选举,1998-11-11,1998-11
印尼人协举行特别会议,1998-11-11,1998-11
新喀公决赞成努美阿协议  法将逐步向新喀移交权力,1998-11-11,1998-11
访印度软件技术园（连载）,1998-11-11,1998-11
渗透  改造  融合（新闻分析）,1998-11-11,1998-11
丹麦瑞典靠拢欧元（综述）,1998-11-11,1998-11
巴黎环保新招  树木佩戴芯片,1998-11-11,1998-11
我国吸引海外投资  居发展中国家首位,1998-11-11,1998-11
英国皇家歌剧院进行全面修缮,1998-11-11,1998-11
新加坡经济出现负增长  东京日元汇率大幅下跌,1998-11-11,1998-11
世界原油需求减少,1998-11-11,1998-11
墨与欧盟谈判自由贸易  印巴双方开始商贸会谈,1998-11-11,1998-11
可疑账户十余个  转移美元三百亿,1998-11-11,1998-11
实力稍弱  胜机仍存,1998-11-11,1998-11
踏遍他山玉难攻,1998-11-11,1998-11
世界杯短池游泳赛明年初在京举行,1998-11-11,1998-11
马晓春刘小光决战深圳,1998-11-11,1998-11
世界上最大的足球,1998-11-11,1998-11
施拉普纳的“中国心”依旧,1998-11-11,1998-11
保短道速滑选手破世界纪录,1998-11-11,1998-11
王励勤淘汰孔令辉,1998-11-11,1998-11
北京举行韩一杯新闻界网球赛,1998-11-11,1998-11
最高检察机关加大监督力度（特别报道）,1998-11-11,1998-11
农家媳妇敬老情（朴素人生）,1998-11-11,1998-11
“富脑”才能“富民”（说长道短）,1998-11-11,1998-11
呼唤减“助”（一家之言）,1998-11-11,1998-11
不该剥夺他上大学的权利（社会调查）,1998-11-11,1998-11
旧桥崩塌犹在目  新桥命运令人忧（社会聚集）,1998-11-11,1998-11
有感于马永顺“还债”（说长道短）,1998-11-11,1998-11
下司油厂擅自动用国家储备油（调查汇报）,1998-11-11,1998-11
不要乱“打招呼”（读者论坛）,1998-11-11,1998-11
纳税大户何以成了逃税大户（观察台）,1998-11-11,1998-11
土法炼焦禁而不止（耳闻目睹）,1998-11-11,1998-11
促进交警队伍建设（经验交流）,1998-11-11,1998-11
人民日报引他走上了致富路（心里话）,1998-11-11,1998-11
别把千岛湖弄脏了（建议与要求）,1998-11-11,1998-11
镇政府无理收执照  佳大厂停业已两年（监督哨）,1998-11-11,1998-11
兰州一些地方报治疗性病广告太多了（读者来信）,1998-11-11,1998-11
我们应如何顺应自然？（读者点题）,1998-11-11,1998-11
丹心映照夕阳红（普通人的故事）,1998-11-11,1998-11
党报支持我讨回公道（编读往来）,1998-11-11,1998-11
给灵魂一个新居（人生一得）,1998-11-11,1998-11
上岗前不经培训  出事故雇主负责（事中有法）,1998-11-11,1998-11
存款人去世后存款如何支取（事中有法）,1998-11-11,1998-11
社会保险与商业保险（知识窗）,1998-11-11,1998-11
花鸟市场（世相百态）,1998-11-11,1998-11
走俏的“缺点”（实话实说）,1998-11-11,1998-11
与洞庭和谐相伴（读者点题）,1998-11-11,1998-11
港澳台资与改革开放座谈会发言选登,1998-11-11,1998-11
祖国统一的深厚基础,1998-11-11,1998-11
中西部发展不可或缺的重要力量,1998-11-11,1998-11
为改革开放注入新活力,1998-11-11,1998-11
台资企业发展的巨大动力,1998-11-11,1998-11
在改革开放中『通世界』,1998-11-11,1998-11
创造良好的投资环境,1998-11-11,1998-11
相得益彰  共创辉煌,1998-11-11,1998-11
上海力保增税九点七亿元（加强税收征管  确保增收千亿）,1998-11-12,1998-11
北京税收与经济同步增长（加强税收征管  确保增收千亿）,1998-11-12,1998-11
广西国税局全力以赴抓清欠（加强税收征管  确保增收千亿）,1998-11-12,1998-11
普通话等级证书好（今日谈）,1998-11-12,1998-11
今年１—１０月外贸进出口２５９１亿美元,1998-11-12,1998-11
江泽民会见日本《朝日新闻》社社长,1998-11-12,1998-11
我向美国政府提出抗议,1998-11-12,1998-11
懒得戴表（喜看改革开放二十年）,1998-11-12,1998-11
长沙重点防洪工程全面铺开,1998-11-12,1998-11
韩国总统金大中抵京,1998-11-12,1998-11
坚决关闭非法和布局不合理煤矿,1998-11-12,1998-11
北京地区天气预报,1998-11-12,1998-11
西南铁路运力五年将增一倍（新闻简报）,1998-11-12,1998-11
上海网上购物可用信用卡（新闻简报）,1998-11-12,1998-11
西南航空引进大型宽体客机（新闻简报）,1998-11-12,1998-11
我国第一台自动变速箱下线（新闻简报）,1998-11-12,1998-11
内蒙古最大水泥厂日前投产（新闻简报）,1998-11-12,1998-11
坚决关闭非法和布局不合理煤矿,1998-11-12,1998-11
点亮希望之光（扶贫攻坚在神州⑹）,1998-11-12,1998-11
北海市反走私居安思危,1998-11-12,1998-11
栾城县不折不扣降低电价,1998-11-12,1998-11
济宁整顿农村电价见成效,1998-11-12,1998-11
淠史杭灌区拦洪抗旱效益高,1998-11-12,1998-11
射阳一批新型农民“唱主角”,1998-11-12,1998-11
也是基础工程（编后）,1998-11-12,1998-11
农科博览会吸引十万农民,1998-11-12,1998-11
坚持粮食顺价销售,1998-11-12,1998-11
明年收费要出示“身份证”（新闻快报）,1998-11-12,1998-11
知识经济与企业管理大会举行,1998-11-12,1998-11
北京商业银行服务首都经济（新闻快报）,1998-11-12,1998-11
壳牌三吉利换油中心连锁站成立,1998-11-12,1998-11
世博会拍卖会茅台酒厂夺标（新闻快报）,1998-11-12,1998-11
伊敏煤电工程一号机组试产,1998-11-12,1998-11
黑龙江查处通报两起毁林事件（新闻快报）,1998-11-12,1998-11
深圳加拿大国际货运航线开通,1998-11-12,1998-11
包兰铁路兰州东段实现电气化,1998-11-12,1998-11
