面对抗洪英雄……（漫话）,1998-09-17,1998-09
全国杰出青年岗位能手评选揭晓,1998-09-17,1998-09
新疆军区完成“菜篮子工程”,1998-09-17,1998-09
四川查获特大国际偷渡案,1998-09-17,1998-09
论九八抗洪精神,1998-09-17,1998-09
山东潍坊实施『民心工程』,1998-09-17,1998-09
办实事要动真情（子夜走笔）,1998-09-17,1998-09
《继续推进党风廉政建设和反腐败斗争》出版,1998-09-17,1998-09
要继续深化农村改革,1998-09-17,1998-09
第三届范长江新闻奖获奖名单,1998-09-17,1998-09
《’９８中国抗洪图：我们不可战胜》出版,1998-09-17,1998-09
中英联合联络小组第４３次会议结束,1998-09-17,1998-09
国务院任免一批国家工作人员,1998-09-17,1998-09
电视连续剧《西藏风云》开拍,1998-09-17,1998-09
九八国际戏剧邀请展开幕,1998-09-17,1998-09
明天气象预报,1998-09-17,1998-09
彭珮云会见加拿大客人（友好往来）,1998-09-17,1998-09
唐家璇与芬兰外长会谈（友好往来）,1998-09-17,1998-09
爱尔兰总理访问上海（友好往来）,1998-09-17,1998-09
社会党国际主席访问天津（友好往来）,1998-09-17,1998-09
在创新中奋进,1998-09-17,1998-09
『大家都说普通话』,1998-09-17,1998-09
我国纪念国际保护臭氧层日,1998-09-17,1998-09
清华大学计划明年发射小卫星,1998-09-17,1998-09
民族软件备受关注,1998-09-17,1998-09
北京理工大学再创科技辉煌,1998-09-17,1998-09
西藏为『复明行动』建立纪念碑,1998-09-17,1998-09
岳阳县筑好灾后防疫“大坝”,1998-09-17,1998-09
中国优生优育协会嘉奖先进,1998-09-17,1998-09
中国国际茶文化交流会丰富多彩,1998-09-17,1998-09
五羊摩托车禁毒万里行到京,1998-09-17,1998-09
前辈的嘱托（通讯）,1998-09-17,1998-09
西方七国愿继续向俄提供援助,1998-09-17,1998-09
克林顿会见张万年,1998-09-17,1998-09
俄总理谈解决社会问题,1998-09-17,1998-09
安理会谴责塔利班杀害伊外交官,1998-09-17,1998-09
奉辛比克党宣布同意出席新国会首次会议,1998-09-17,1998-09
美称不排除对伊拉克动武,1998-09-17,1998-09
莱索托局势恶化,1998-09-17,1998-09
刚果（金）停火协议缘何难产（新闻分析）,1998-09-17,1998-09
美英丹暂关闭驻乌使馆,1998-09-17,1998-09
解决几比危机会议召开,1998-09-17,1998-09
苏丹出兵支持卡比拉,1998-09-17,1998-09
印尼将调查苏哈托资产问题,1998-09-17,1998-09
西方舆论检讨援俄战略（综述）,1998-09-17,1998-09
协商预防危机  股市强劲反弹,1998-09-17,1998-09
改革全球金融体制（述评）,1998-09-17,1998-09
西藏少年艺倾美国,1998-09-17,1998-09
叶利钦说俄经济形势渐趋正常,1998-09-17,1998-09
菲律宾贸易赤字减少  韩元对美元汇率下跌  韩一家公司投资平壤,1998-09-17,1998-09
亚洲金融危机拖累非洲经济,1998-09-17,1998-09
蒙古国政府发起“绿色革命”运动,1998-09-17,1998-09
中日经贸关系应有新发展,1998-09-17,1998-09
亚运会足球比赛办法确定,1998-09-17,1998-09
客观公正准确报道足球,1998-09-17,1998-09
小篮板工程在北京启动,1998-09-17,1998-09
阿迪达斯公司向中国足球学校赠球,1998-09-17,1998-09
贺龙杯高尔夫球赛组委会向桑植灾区捐物,1998-09-17,1998-09
我军健儿一举夺五枚金牌,1998-09-17,1998-09
中国奥林匹克足球队将再次集训,1998-09-17,1998-09
走出低谷要靠创新（体坛絮语）,1998-09-17,1998-09
乘风破浪正当时（走向大市场）,1998-09-17,1998-09
弥勒县走红（地方经济）,1998-09-17,1998-09
添块“科技明白墙”，如何？（农村杂谈）,1998-09-17,1998-09
龙腾兴凯湖,1998-09-17,1998-09
“老黄牛”带出富裕村（村里人·村中事）,1998-09-17,1998-09
特色种养赢市场,1998-09-17,1998-09
这是咱所里新开发的项目！,1998-09-17,1998-09
樊相  农民拿着合同去种田,1998-09-17,1998-09
周口  小麦育种有突破,1998-09-17,1998-09
洞头  羊栖菜成气候,1998-09-17,1998-09
学会从世界的视角看中国（思想纵横）,1998-09-17,1998-09
把农村信用社办成真正的合作金融组织,1998-09-17,1998-09
发展经济为何要反走私（学习通讯）,1998-09-17,1998-09
原则性是领导工作第一位的,1998-09-17,1998-09
一颗红豆杉（文化风景）,1998-09-17,1998-09
凉山不会忘记,1998-09-17,1998-09
土家文化守护者,1998-09-17,1998-09
精神的播种（大家庭随笔）,1998-09-17,1998-09
大草原与大市场对接,1998-09-17,1998-09
阿尼玛卿雪山的曙光,1998-09-17,1998-09
不敢懈怠（金台随感）,1998-09-17,1998-09
旋翼下的生命,1998-09-17,1998-09
深山沟里金凤凰,1998-09-17,1998-09
军之瑰宝  民之智囊（品书札记）,1998-09-17,1998-09
江南古村遗韵（九州风物）,1998-09-17,1998-09
涉泽求溪  披榛采兰,1998-09-17,1998-09
波斯湾,1998-09-17,1998-09
古街古塔,1998-09-17,1998-09
贵州：加快构筑高等级公路网（省区市的“务实之笔”）,1998-09-18,1998-09
江泽民叶利钦向大会致贺,1998-09-18,1998-09
云水襟怀松柏志,1998-09-18,1998-09
尉健行率中共代表团抵河内访问,1998-09-18,1998-09
秦皇岛兴建热电联网供热工程,1998-09-18,1998-09
做人民的儿子（做人民满意的公务员）,1998-09-18,1998-09
赈灾勿忘扶志（今日谈）,1998-09-18,1998-09
西安投资与贸易洽谈会落幕,1998-09-18,1998-09
鹤壁矿务局井下造气试产成功,1998-09-18,1998-09
新沂至长兴铁路在淮安开工,1998-09-18,1998-09
启  事,1998-09-18,1998-09
北京地区天气预报,1998-09-18,1998-09
小城镇里大舞台（乡镇企业：开辟新的经济增长点⑵）,1998-09-18,1998-09
当前利率不存在很大下调空间  增发国债是短期财政扩张政策  路车收费改革明年初可望出台  加大基础设施建设不产生泡沫,1998-09-18,1998-09
不管企业管什么,1998-09-18,1998-09
宁夏扶贫工程红寺堡灌区正式通水,1998-09-18,1998-09
海关１—８月打击走私成效显著,1998-09-18,1998-09
检验检疫部门积极与美方磋商,1998-09-18,1998-09
夏津电业总公司观念变多卖电,1998-09-18,1998-09
北大荒不能被淹,1998-09-18,1998-09
深圳开通网上经理市场,1998-09-18,1998-09
一字之差（编后）,1998-09-18,1998-09
北京办秋季房地产交易会,1998-09-18,1998-09
服装行业开办工商管理集成训练班,1998-09-18,1998-09
石化工业研讨会在京举行,1998-09-18,1998-09
美国『科文斯』在京设办事处,1998-09-18,1998-09
新型强力杀菌系列产品问世,1998-09-18,1998-09
丹东经贸洽谈会举行,1998-09-18,1998-09
飞利浦节能灯义卖,1998-09-18,1998-09
云水襟怀松柏志,1998-09-18,1998-09
高法公布两个文件,1998-09-18,1998-09
从严治检先治“长”,1998-09-18,1998-09
二炮某部帮助灾区恢复生产,1998-09-18,1998-09
抗洪烈士妻子桂丹入军校学习,1998-09-18,1998-09
太原交警支队干部竞争上岗,1998-09-18,1998-09
香港九届全国人大代表首次组团赴内地视察,1998-09-18,1998-09
澧县交警筑“形象工程”,1998-09-18,1998-09
欠债与还债（人民论坛）,1998-09-18,1998-09
纪念彭德怀百年诞辰,1998-09-18,1998-09
我国任免一批驻外大使,1998-09-18,1998-09
欢迎马达加斯加废除与台『特别协定』,1998-09-18,1998-09
移民建镇统一规划  搬迁企业分类处置（恢复生产  重建家园  发展经济）,1998-09-18,1998-09
灾区互帮互济  加快再建步伐（恢复生产  重建家园  发展经济）,1998-09-18,1998-09
鼓励群众抗灾自救  对口帮扶措施到位（恢复生产  重建家园  发展经济）,1998-09-18,1998-09
迅速组织货源  确保农资供应（恢复生产  重建家园  发展经济）,1998-09-18,1998-09
王兆国会见香港东华三院访京团,1998-09-18,1998-09
德国向我国灾区捐赠物资,1998-09-18,1998-09
未来一周天气趋势,1998-09-18,1998-09
勿忘国耻,1998-09-18,1998-09
香港同胞再向灾区捐赠３３００万港元,1998-09-18,1998-09
明天气象预报,1998-09-18,1998-09
钱其琛会见芬兰外长,1998-09-18,1998-09
黄菊会见社会党国际代表团,1998-09-18,1998-09
爱尔兰总理离沪赴港,1998-09-18,1998-09
波兰客人访问天津,1998-09-18,1998-09
为２１世纪中国提供理论支持,1998-09-18,1998-09
赴藏国家医疗队圆满完成任务,1998-09-18,1998-09
北京化工大学重振雄风,1998-09-18,1998-09
全国科教兴村试点取得成效,1998-09-18,1998-09
聊城市技工学校心系灾区重建,1998-09-18,1998-09
特殊的庆典,1998-09-18,1998-09
创维多媒体电视助教育普及,1998-09-18,1998-09
韩国朝鲜共同组团参加２０００年奥运会,1998-09-18,1998-09
万达成功冲刺  提前四轮卫冕,1998-09-18,1998-09
小将超世界纪录,1998-09-18,1998-09
全国乒乓球锦标赛在宜春开拍,1998-09-18,1998-09
短跑名将贝利腿部受伤,1998-09-18,1998-09
桑兰治疗八个月后有望拄杖移步,1998-09-18,1998-09
大学生篮球联赛即将开始总决赛,1998-09-18,1998-09
美国媒体继续关注桑兰病情,1998-09-18,1998-09
女篮俱乐部赛结束第一阶段,1998-09-18,1998-09
『电脑奥林匹克』中国夺金二十一枚,1998-09-18,1998-09
贝发集团向灾区捐赠百万元文具,1998-09-18,1998-09
电子精品图书联展举办,1998-09-18,1998-09
深切哀悼杨尚昆逝世,1998-09-18,1998-09
哥伦比亚总统会见吴邦国,1998-09-18,1998-09
张万年会见美军方领导人,1998-09-18,1998-09
小渊惠三会见石广生,1998-09-18,1998-09
叶利钦表示与总理观点一致,1998-09-18,1998-09
经济大国应负起责任（国际论坛）,1998-09-18,1998-09
克林顿称将继续领导国家,1998-09-18,1998-09
伊朗愿首先通过外交解决,1998-09-18,1998-09
印度纪念援华医疗队赴华６０周年,1998-09-18,1998-09
桑兰西党宣布参加国会  西哈努克将主持两会议,1998-09-18,1998-09
德黑兰大学外的示威,1998-09-18,1998-09
韩大国家党议员决定辞职,1998-09-18,1998-09
阿盟举行外长会议,1998-09-18,1998-09
金融危机波及拉美（热点对话）,1998-09-18,1998-09
减灾卫星显神通（科技神话）,1998-09-18,1998-09
墨西哥  坏账转公债之争（通讯）,1998-09-18,1998-09
希望我加入世贸组织,1998-09-18,1998-09
贸发会议：今年世界经济增速减缓  格林斯潘：西方国家不会联合降息,1998-09-18,1998-09
个人电脑有局限  新型装置正兴起,1998-09-18,1998-09
中国西藏少儿艺术团在美国,1998-09-18,1998-09
水文资料入网  监视河水泛滥,1998-09-18,1998-09
日经济将出现负增长,1998-09-18,1998-09
“挂职作家”说『挂职』,1998-09-18,1998-09
电影院竟如此揽客（文化信箱）,1998-09-18,1998-09
“金鹰奖”为何有漏报？（文化信箱）,1998-09-18,1998-09
球场不能脏话“荟萃”（文化信箱）,1998-09-18,1998-09
希望与失望（闲话乐风）,1998-09-18,1998-09
卡雷拉斯将一展歌喉,1998-09-18,1998-09
丝路寻梦（旅游答问）,1998-09-18,1998-09
中央戏剧学院举办国际戏剧展,1998-09-18,1998-09
高歌一曲献给共和国的同龄人,1998-09-18,1998-09
诗人绿原获『金环奖』,1998-09-18,1998-09
让东方精神回归东方,1998-09-18,1998-09
银幕上的家长学校,1998-09-18,1998-09
喜人的歌剧音乐创作,1998-09-18,1998-09
大堤上有一方流动的银幕,1998-09-18,1998-09
“红旗渠”人荧屏庆国庆,1998-09-18,1998-09
回首民族百年沧桑  吴天明执导《黄河人》,1998-09-18,1998-09
情真意切  万众一心（佳作赏析１３）,1998-09-18,1998-09
意蕴悠远的电视短剧,1998-09-18,1998-09
电视剧《人子》感人至深,1998-09-18,1998-09
电视展播“’９８流行设计潮”,1998-09-18,1998-09
“挂职作家”说『挂职』,1998-09-18,1998-09
在邓小平理论指引下繁荣文艺,1998-09-18,1998-09
浅议法制与文化（金台文论）,1998-09-18,1998-09
关注中国历史  解剖社会现实,1998-09-18,1998-09
乡情与历史的叠唱,1998-09-18,1998-09
“知青文学”现象再度引发新话题（文摘卡）,1998-09-18,1998-09
文学期刊最新小说月报,1998-09-18,1998-09
『自画青春』征文别开生面,1998-09-18,1998-09
济南出版社出精品图书庆十年华诞,1998-09-18,1998-09
纪念戊戌变法一百周年  华文出版社推出《戊戌百年祭》,1998-09-18,1998-09
新的理论建构《文学解读学导论》,1998-09-18,1998-09
难忘丁玲谈读书（作家书简）,1998-09-18,1998-09
该讲什么话？（金台随感）,1998-09-18,1998-09
一本有趣的书（品书札记）,1998-09-18,1998-09
梅峰大观（笔墨山水）,1998-09-18,1998-09
时间三度（茶楼）,1998-09-18,1998-09
沂蒙顶针,1998-09-18,1998-09
重新做“人”,1998-09-18,1998-09
山村学子,1998-09-18,1998-09
小米汤（多味斋）,1998-09-18,1998-09
四川：打响农村人畜饮水攻坚战（省区市的“务实之笔”）,1998-09-19,1998-09
江泽民会见美国客人,1998-09-19,1998-09
杨尚昆同志遗体二十一日火化,1998-09-19,1998-09
河北弘扬抗洪精神促经济发展,1998-09-19,1998-09
我国首条高架铁路在沪兴建,1998-09-19,1998-09
踊跃参加无偿献血  切实履行公民义务,1998-09-19,1998-09
澳门特区筹委会三次全会开幕,1998-09-19,1998-09
办万家事  解万家忧,1998-09-19,1998-09
越共总书记黎可漂会见尉健行,1998-09-19,1998-09
北京地区天气预报,1998-09-19,1998-09
澳门特区筹委会三次全会开幕,1998-09-19,1998-09
把弘扬抗洪精神作为精神文明建设突出任务,1998-09-19,1998-09
他为移民白了头（做人民满意的公务员）,1998-09-19,1998-09
公安系统表彰抗洪救灾先进,1998-09-19,1998-09
《建设有中国特色社会主义若干理论问题学习纲要》出版,1998-09-19,1998-09
北京第二批爱国主义教育纪念地标志碑落成,1998-09-19,1998-09
沈阳举行升国旗仪式纪念“九一八”,1998-09-19,1998-09
公安系统加紧清理整顿经商活动,1998-09-19,1998-09
全国重点城市环境综合整治考核结果公布,1998-09-19,1998-09
唐家璇离京出席５３届联大  会后分别访问美国加拿大,1998-09-19,1998-09
限期停止生产销售使用车用含铅汽油,1998-09-19,1998-09
明天气象预报,1998-09-19,1998-09
潘文凯会见尉健行,1998-09-19,1998-09
我代表呼吁加强国际经济合作,1998-09-19,1998-09
互利互惠  共创未来（通讯）,1998-09-19,1998-09
印国大党调整政策（综述）,1998-09-19,1998-09
中哥签署禁毒合作等协议,1998-09-19,1998-09
叶利钦任命古斯托夫为第一副总理,1998-09-19,1998-09
美应尽快补交联合国会费,1998-09-19,1998-09
俄总理会见欧盟国家官员,1998-09-19,1998-09
波举行纪念居里夫妇研讨会,1998-09-19,1998-09
莱索托政府未在大选中舞弊,1998-09-19,1998-09
大气层顶层离地越来越近,1998-09-19,1998-09
是否公布克林顿作证录像  美众院两党议员尚有分歧,1998-09-19,1998-09
纽约股市跌风又起  西欧股市全线重挫  俄汇市股市再下跌,1998-09-19,1998-09
辽宁队获全国女篮俱乐部赛冠军,1998-09-19,1998-09
体育科学研究所欢度４０周岁生日,1998-09-19,1998-09
江苏队夺得男女双打冠军,1998-09-19,1998-09
西藏登山探险队开始攀登洛子峰,1998-09-19,1998-09
中国游泳队召开动员大会,1998-09-19,1998-09
受命于危难之际,1998-09-19,1998-09
创造一个好的氛围（体坛絮语）,1998-09-19,1998-09
中国队退出世界象棋棋王赛,1998-09-19,1998-09
临门一脚培训班结束,1998-09-19,1998-09
中国将举办世界台球锦标赛,1998-09-19,1998-09
网络化  对人类社会的影响（热门话题）,1998-09-19,1998-09
中国社会史研究的新探索（学科扫描）,1998-09-19,1998-09
『商会与近代中国』学术研讨会（学术交流）,1998-09-19,1998-09
理论不足是目前历史研究中的主要问题（报刊文摘）,1998-09-19,1998-09
应该既超越西方文化又超越传统文化（报刊文摘）,1998-09-19,1998-09
展望２１世纪的中国经济（书刊评介）,1998-09-19,1998-09
摄影,1998-09-19,1998-09
《戊戌维新与清末新政》,1998-09-19,1998-09
《康有为》,1998-09-19,1998-09
《古钱钞文存》,1998-09-19,1998-09
心安即福地（二十年间）,1998-09-19,1998-09
艺海生涯杂咏,1998-09-19,1998-09
战洪灾,1998-09-19,1998-09
椰树下的侧影（献给改革开放二十年）,1998-09-19,1998-09
《二十年间》征文启事,1998-09-19,1998-09
合唱，集体的魅力（文化现场目击）,1998-09-19,1998-09
做一名故宫人意味什么（名家特稿）,1998-09-19,1998-09
重彩描绘文化长卷（文化百态）,1998-09-19,1998-09
太庙栏杆穿上防护衣,1998-09-19,1998-09
喜看兔儿爷成为卡通明星（一得之见）,1998-09-19,1998-09
众人拾柴火焰高,1998-09-19,1998-09
计算机：潘多拉的盒子,1998-09-19,1998-09
楹联：民族心理的载体,1998-09-19,1998-09
老区于都报廊多,1998-09-19,1998-09
分数：素质教育的切入点,1998-09-19,1998-09
扶贫的误区（金台随感）,1998-09-19,1998-09
遵义行（二首）,1998-09-19,1998-09
北线纪行（文化采风）,1998-09-19,1998-09
双鸟登枝,1998-09-19,1998-09
浪淘沙,1998-09-19,1998-09
过芙蓉镇（笔墨山水）,1998-09-19,1998-09
抗洪奇兵“蛙人”,1998-09-19,1998-09
《毛泽东评阅四大名著》（绣像本）出版,1998-09-19,1998-09
艺文短波,1998-09-19,1998-09
《历史真相的泥淖》中文版出版,1998-09-19,1998-09
建设羊湖电站  造福西藏人民,1998-09-20,1998-09
生命禁区铸丰碑,1998-09-20,1998-09
上海市劳动力价格体系基本形成,1998-09-20,1998-09
我再获两项联合国人居奖,1998-09-20,1998-09
澳门特区筹委会第三次全会新闻公报,1998-09-20,1998-09
澳门特区筹委会第三次全会闭幕,1998-09-20,1998-09
北京地区天气预报,1998-09-20,1998-09
黑龙江为灾区备足粮,1998-09-20,1998-09
两万多小煤矿将关停,1998-09-20,1998-09
海拔最高水电站建成,1998-09-20,1998-09
我国成为钛工业大国,1998-09-20,1998-09
津山线光缆改造竣工,1998-09-20,1998-09
宁夏举行大型洽谈会,1998-09-20,1998-09
生命禁区铸丰碑,1998-09-20,1998-09
俄总理谈新政府任务,1998-09-20,1998-09
公布克林顿作证录像,1998-09-20,1998-09
全国人民代表大会澳门特别行政区筹委会的决定和意见,1998-09-20,1998-09
一身正气  警徽增光,1998-09-20,1998-09
中葡联合联络小组召开会议,1998-09-20,1998-09
巴举行大规模反以示威,1998-09-20,1998-09
菲律宾发生严重沉船事故,1998-09-20,1998-09
支持中央政府在回归后派驻军队,1998-09-20,1998-09
日各党就整顿银行系统达成协议,1998-09-20,1998-09
全国政协委员赈灾义演晚会在京举行,1998-09-20,1998-09
江西抚州检察长被停职检查,1998-09-20,1998-09
明天气象预报,1998-09-20,1998-09
书道一家人,1998-09-20,1998-09
澳洲『下岗族』,1998-09-20,1998-09
遨游天空寻梦,1998-09-20,1998-09
西伯利亚的小木屋,1998-09-20,1998-09
不收参观费的城市,1998-09-20,1998-09
加拉加斯的“街头画家”,1998-09-20,1998-09
光辉战斗的一生  不可磨灭的功勋,1998-09-20,1998-09
西安经济增长势头强劲,1998-09-21,1998-09
杨尚昆光辉战斗的一生,1998-09-21,1998-09
邓小平理论是我们战胜一切困难和风险的强大思想武器,1998-09-21,1998-09
第三届韬奋新闻奖揭晓,1998-09-21,1998-09
中国科大迎来不惑年,1998-09-21,1998-09
敞开向农民收购  坚持购销三统一,1998-09-21,1998-09
北京地区天气预报,1998-09-21,1998-09
瞄准三产闯新路（乡镇企业：开辟新的经济增长点⑶）,1998-09-21,1998-09
我国外经贸抗风险能力显著提高  工商银行全面进军住房金融市场    铁路１０月１日起实行新运行图,1998-09-21,1998-09
加大扶贫开发力度,1998-09-21,1998-09
葫芦岛锌厂堵假打假,1998-09-21,1998-09
全国公路建设进展顺利,1998-09-21,1998-09
６０６次列车怪事多,1998-09-21,1998-09
恒源祥重返南京路,1998-09-21,1998-09
安庆地税局清理漏征漏管,1998-09-21,1998-09
阳光高支创佳绩,1998-09-21,1998-09
内贸局要求做好两节供应（新闻快报）,1998-09-21,1998-09
我国将进一步开放建设市场（新闻快报）,1998-09-21,1998-09
城市集中供热面积达８亿平方米（新闻快报）,1998-09-21,1998-09
青年志愿者植树长江岸（新闻快报）,1998-09-21,1998-09
杨尚昆光辉战斗的一生,1998-09-21,1998-09
用法律撑起一片蓝天（做人民满意的公务员）,1998-09-21,1998-09
公安边防打击走私捷报频传,1998-09-21,1998-09
张景祥受贿被开除党籍,1998-09-21,1998-09
空军奖励优秀科技干部,1998-09-21,1998-09
共有一个家,1998-09-21,1998-09
『大必起于小』漫议（人民论坛）,1998-09-21,1998-09
云南上下一心筹办世博会,1998-09-21,1998-09
第三届韬奋新闻奖获奖者名单,1998-09-21,1998-09
分级负责  抓好落实（认真贯彻落实中办通知精神  确保人民日报发行稳中有升）,1998-09-21,1998-09
采取有效措施  确保逐年上升（认真贯彻落实中办通知精神  确保人民日报发行稳中有升）,1998-09-21,1998-09
提前完成任务  争取新的突破（认真贯彻落实中办通知精神  确保人民日报发行稳中有升）,1998-09-21,1998-09
特区政府坚决维护香港自由市场,1998-09-21,1998-09
全军业余文艺调演开始,1998-09-21,1998-09
北京国际音乐节将举办,1998-09-21,1998-09
元代文化国际研讨会举行,1998-09-21,1998-09
南昌倾城送英雄（现场短新闻）,1998-09-21,1998-09
书记扶贫到农家（现场短新闻）,1998-09-21,1998-09
忻州建设佛教名山旅游线文明长廊,1998-09-21,1998-09
明天气象预报,1998-09-21,1998-09
中信所拓展信息服务市场,1998-09-21,1998-09
旌德县闯出计生新路子,1998-09-21,1998-09
切实执行《森林法》  加强生态环境建设,1998-09-21,1998-09
《邓小平理论普及读本》出版,1998-09-21,1998-09
我国积极参与亚洲泌尿外科学交流,1998-09-21,1998-09
北京开展第十届全国爱牙日活动,1998-09-21,1998-09
牛胚胎玻璃化冷冻保存技术首获成功,1998-09-21,1998-09
安徽大学成为科教兴皖重要基地,1998-09-21,1998-09
大学生义务献血,1998-09-21,1998-09
万宝路甲Ａ联赛积分榜（截至９月２０日第二十二轮）,1998-09-21,1998-09
天津泰达队提前三轮晋升甲,1998-09-21,1998-09
东京国际田径大奖赛于娟铅球夺冠,1998-09-21,1998-09
中国乒协公布明年赛程,1998-09-21,1998-09
亚俱杯万达首战告捷,1998-09-21,1998-09
汕头队获全国乒乓球赛男团冠军,1998-09-21,1998-09
伍绍祖称赞曼谷亚运会准备工作,1998-09-21,1998-09
中国队蝉联亚青女篮赛冠军,1998-09-21,1998-09
孙俊首尝全国冠军滋味,1998-09-21,1998-09
太阳神奋起  主场胜敖东,1998-09-21,1998-09
世界特技飞行大奖赛南京站结束,1998-09-21,1998-09
澳门发展战略研讨会在京举行,1998-09-21,1998-09
首届全国公开水域游泳赛揭幕,1998-09-21,1998-09
《蓟门丛书》出版,1998-09-21,1998-09
北京举办校园足球邀请赛,1998-09-21,1998-09
女教师《杜丽丽》电视剧上映,1998-09-21,1998-09
全国射箭锦标赛在漯河开赛,1998-09-21,1998-09
大篮联决赛西北大学旗开得胜,1998-09-21,1998-09
尉健行拜会杜梅,1998-09-21,1998-09
政府决定进行全面整顿  总统获欧洲三机构支持,1998-09-21,1998-09
风雨同舟难共济（新闻分析）,1998-09-21,1998-09
日本小渊内阁支持率低,1998-09-21,1998-09
德警方逮捕一恐怖活动嫌犯,1998-09-21,1998-09
吹响哨子  遏制犯罪,1998-09-21,1998-09
『黑金钱盒』（大千絮语）,1998-09-21,1998-09
俄新政府面临经济难题,1998-09-21,1998-09
巴西国企改制见成效（综述）,1998-09-21,1998-09
菲国际收支改善  泰外国游客增多  韩海外企业艰难,1998-09-21,1998-09
无形资产有归属  克隆技术起风波,1998-09-21,1998-09
圣女作祟阿根廷  阳春时节寒流急,1998-09-21,1998-09
壳牌总部关闭,1998-09-21,1998-09
我参加『使世界清洁起来』运动受好评,1998-09-21,1998-09
改革国际金融体制,1998-09-21,1998-09
以工代赈宜城乡并举（观点）,1998-09-21,1998-09
给私企更大空间（经济茶座）,1998-09-21,1998-09
游乐安全  人命关天,1998-09-21,1998-09
『站在被告席上的获奖者』（连续报道）,1998-09-21,1998-09
田间烧秸起浓烟  污染环境又浪费,1998-09-21,1998-09
散落芦苇犹牵人心  生产自救细处做起,1998-09-21,1998-09
农电体制改革势在必行,1998-09-21,1998-09
农村保险亟待发展,1998-09-21,1998-09
资金面趋向宽松（金海观潮）,1998-09-21,1998-09
经营『风险』更须防险,1998-09-21,1998-09
什么是股票市场（学金融）,1998-09-21,1998-09
股票市场有哪些种类（学金融）,1998-09-21,1998-09
依法履行审计监督职责,1998-09-21,1998-09
上周股市概览,1998-09-21,1998-09
上证综合指数日Ｋ线图,1998-09-21,1998-09
深证成份指数日Ｋ线图,1998-09-21,1998-09
沪市上周上涨前五名（％）,1998-09-21,1998-09
沪市上周下跌前五名（％）,1998-09-21,1998-09
深市上周上涨前五名（％）,1998-09-21,1998-09
深市上周下跌前五名（％）,1998-09-21,1998-09
住房贷款为何步履蹒跚（市场扫描）,1998-09-21,1998-09
搭售什么？（各抒己见）,1998-09-21,1998-09
“零投诉”的背后（各抒己见）,1998-09-21,1998-09
国航西线新气象,1998-09-21,1998-09
保龄二手货：警惕洋垃圾,1998-09-21,1998-09
丝绸何日再辉煌,1998-09-21,1998-09
如何使用信用卡,1998-09-21,1998-09
ＰＴＣ推出Ｗｉｎｄｃｈｉｌｌ企业信息软件,1998-09-21,1998-09
北京市纸箱厂新厂竣工,1998-09-21,1998-09
摩托罗拉新型信息寻呼机问世,1998-09-21,1998-09
