沙特调解伊阿矛盾,1998-09-09,1998-09
俄罗斯总统杜马继续对峙（综述）,1998-09-09,1998-09
欧盟对南实施新制裁  南指责欧盟禁飞决定,1998-09-09,1998-09
马苏德武装发动新攻势,1998-09-09,1998-09
献艺赈灾手足情（通讯）,1998-09-09,1998-09
马耳他新总理就职,1998-09-09,1998-09
索近四千难民从埃塞回国,1998-09-09,1998-09
真正爱尔兰共和军宣布停火,1998-09-09,1998-09
泰呼吁开美欧亚经济首脑会议,1998-09-09,1998-09
韩国  大企业改革艰难起步（通讯）,1998-09-09,1998-09
社会高龄化加剧  百岁老寿星逾万,1998-09-09,1998-09
俄金融形势进一步恶化,1998-09-09,1998-09
希望加强知识产权国际合作,1998-09-09,1998-09
从罗国产肉鸡降价说起（述评）,1998-09-09,1998-09
高新技术产业如日中天  微软公司股价青云直上,1998-09-09,1998-09
厄瓜多尔发现疯牛病,1998-09-09,1998-09
菲律宾再次调低经济增长目标,1998-09-09,1998-09
福格茨挂冠而去,1998-09-09,1998-09
中国杯特技飞行大奖赛不日竞逐,1998-09-09,1998-09
中国足协评选最佳中场球员,1998-09-09,1998-09
舒城举办亚洲铁人三项赛,1998-09-09,1998-09
足球“科化训练班”再度举行,1998-09-09,1998-09
新人尚未脱颖而出  网上依旧稍逊一筹,1998-09-09,1998-09
奉献真情,1998-09-09,1998-09
亨德利渐显本色,1998-09-09,1998-09
维达杯海峡两岸保龄球赛移师武汉,1998-09-09,1998-09
河南省举办国际滑翔伞公开赛,1998-09-09,1998-09
全国公安队伍建设扫描,1998-09-09,1998-09
『民情日记簿』的启示（一家之言）,1998-09-09,1998-09
“视每份善款善物为圣物”,1998-09-09,1998-09
为保证人民健康多做贡献,1998-09-09,1998-09
没有国哪有家,1998-09-09,1998-09
『新飞』人的情怀,1998-09-09,1998-09
为发现和保护“玉中王”的农民讨回公道（呼吁）,1998-09-09,1998-09
『汇源』的成功之道（质量连着你我他）,1998-09-09,1998-09
菜市场变成垃圾场（耳闻目睹）,1998-09-09,1998-09
『换位』调研出真『经』（读者论坛）,1998-09-09,1998-09
中医中药在辅助治疗癌症方面有独特作用（知识窗）,1998-09-09,1998-09
村务公开不要做表面文章（建议与要求）,1998-09-09,1998-09
管管“通县顺风旅行社”（监督哨）,1998-09-09,1998-09
猛洞河漂流一船四价（监督哨）,1998-09-09,1998-09
制止古窑文物流失  保护古镇旅游资源,1998-09-09,1998-09
友谊关修复工程全面启动（连续报道）,1998-09-09,1998-09
海外华人华侨情系灾区,1998-09-09,1998-09
明清珍档反映澳门沧桑,1998-09-09,1998-09
奏响『建屋安民』曲（“港人治港”印象）,1998-09-09,1998-09
音乐情  中国心,1998-09-09,1998-09
坚决维护联系汇率制度,1998-09-09,1998-09
稳定港元的适时之举,1998-09-09,1998-09
港民认为港人能管理好香港,1998-09-09,1998-09
上半年香港转口贸易稳定,1998-09-09,1998-09
澳门总人口增至４６·６万人,1998-09-09,1998-09
港府拨款２１亿港元照顾老人,1998-09-09,1998-09
为人处世的“真”和“诚”（朋友信箱）,1998-09-09,1998-09
功夫在哪里？（实话实说）,1998-09-09,1998-09
一位中学教师的情怀（普通人的故事）,1998-09-09,1998-09
从『三下乡』到『三入户』（行业写真）,1998-09-09,1998-09
傣族少年和他的辅导老师（世相百态）,1998-09-09,1998-09
年降水量是恒定的吗？（知识窗）,1998-09-09,1998-09
企业破产整顿有权裁减人员（事中有法）,1998-09-09,1998-09
怎样处理人际关系？（朋友信箱）,1998-09-09,1998-09
惊涛拍岸自岿然（东西南北看形势·东部篇）,1998-09-10,1998-09
育才兴国（纪念改革开放二十年难忘第一）,1998-09-10,1998-09
黑龙江用抗洪精神生产自救,1998-09-10,1998-09
海南全力确保经济增长,1998-09-10,1998-09
《发扬抗洪精神  重建家园  发展经济》单行本出版,1998-09-10,1998-09
李岚清会见亚审组织理事会客人,1998-09-10,1998-09
中国并无调低增值税税率的打算,1998-09-10,1998-09
“一把尺子大家量”（今日谈）,1998-09-10,1998-09
成都平原水稻丰收,1998-09-10,1998-09
北京地区天气预报,1998-09-10,1998-09
北京站大修改造全面展开（新闻简报）,1998-09-10,1998-09
大连新港改扩建工程告竣（新闻简报）,1998-09-10,1998-09
西安成立大型软件开发中心（新闻简报）,1998-09-10,1998-09
包头兴建两座大型热源厂（新闻简报）,1998-09-10,1998-09
惊涛拍岸自岿然（东西南北看形势·东部篇）,1998-09-10,1998-09
联华超市“火”在哪？,1998-09-10,1998-09
天同公司效益一跃而起,1998-09-10,1998-09
巍山“借羊还羊”拓宽扶贫路,1998-09-10,1998-09
湖南灾区抢排渍水开展生产自救,1998-09-10,1998-09
江西建行增加贷款支持恢复生产,1998-09-10,1998-09
黄石以抗洪精神抓经济（恢复生产  重建家园）,1998-09-10,1998-09
８月份金融运行保持平稳,1998-09-10,1998-09
我开展质量管理小组活动二十年成效卓著,1998-09-10,1998-09
降低经济适用住房成本,1998-09-10,1998-09
系统工程（编后）,1998-09-10,1998-09
最高审计机关亚洲组织召开理事会,1998-09-10,1998-09
企业与品牌形象研讨会将在京举行,1998-09-10,1998-09
灞河铁路特大桥提前建成,1998-09-10,1998-09
人行金乡支行加强对信用社监管,1998-09-10,1998-09
国际航空发动机可靠性研讨会举行,1998-09-10,1998-09
统一战线广大成员积极参与抗洪救灾,1998-09-10,1998-09
全国各级检察机关勇于向自己“开刀”,1998-09-10,1998-09
海南省公安边防总队加大打私力度,1998-09-10,1998-09
青岛加强文明社区建设,1998-09-10,1998-09
商城县法院实行审判期限公开制,1998-09-10,1998-09
成都警方严打整治向纵深发展,1998-09-10,1998-09
澳门各界谴责爆炸犯罪,1998-09-10,1998-09
婚礼，待到凯旋时,1998-09-10,1998-09
湘鄂十三万抗洪官兵今起班师回营（短波）,1998-09-10,1998-09
海军陆战队帮助群众重建家园（短波）,1998-09-10,1998-09
空军部队学习『抗洪英雄』高建成（短波）,1998-09-10,1998-09
扬子江药业开展学习高建成活动（短波）,1998-09-10,1998-09
武汉天河机场全力保障抗洪调运工作（短波）,1998-09-10,1998-09
『执纪办案一日』征文开栏（短波）,1998-09-10,1998-09
武警某部着力改善基层文化生活（短波）,1998-09-10,1998-09
雄厚实力的显示,1998-09-10,1998-09
重庆提出：确保人民日报发行年年增长  安徽要求：确保完成人民日报发行计划（认真贯彻落实中办通知精神  确保人民日报发行稳中有升）,1998-09-10,1998-09
有助巩固香港金融中心地位,1998-09-10,1998-09
领导干部必须为政清廉,1998-09-10,1998-09
张量同志逝世,1998-09-10,1998-09
森警部队组建５０年成就显著,1998-09-10,1998-09
第七届乌洽会落幕,1998-09-10,1998-09
国台办鼓励继续办好台商投资区,1998-09-10,1998-09
十二届泰山国际登山节开幕,1998-09-10,1998-09
国际和平茶文化交流馆落户杭州,1998-09-10,1998-09
中国是利用外资最好的成功例子,1998-09-10,1998-09
桂林地市合并组建新桂林市,1998-09-10,1998-09
明天气象预报,1998-09-10,1998-09
向辛勤耕耘的人民教师致敬,1998-09-10,1998-09
全国十杰中小学教师受奖,1998-09-10,1998-09
全国政协举办茶话会庆祝教师节,1998-09-10,1998-09
解放军四总部慰问教育工作者,1998-09-10,1998-09
想念你们,1998-09-10,1998-09
中国老教授协会研讨抗洪经验,1998-09-10,1998-09
我国计算机证书考试发展迅速,1998-09-10,1998-09
清华大学实施三个『百人计划』,1998-09-10,1998-09
扶助灾区贫困学生,1998-09-10,1998-09
保护黄河知识问答参加者踊跃,1998-09-10,1998-09
洪灾敲响生态保护警钟,1998-09-10,1998-09
第五十二届联大闭幕,1998-09-10,1998-09
朝鲜举行盛大庆祝活动,1998-09-10,1998-09
金边再次发生流血冲突,1998-09-10,1998-09
美国称美朝会谈取得进展,1998-09-10,1998-09
柬政局进一步动荡（综述）,1998-09-10,1998-09
克林顿律师要求预览报告遭拒绝,1998-09-10,1998-09
多方介入  危机陷僵局（新闻分析）,1998-09-10,1998-09
困难重重  又逢新机遇（新闻分析）,1998-09-10,1998-09
俄国家杜马三党派推举新总理候选人,1998-09-10,1998-09
韩希望南北进入合作时代,1998-09-10,1998-09
伊朗表示将全力解救人质,1998-09-10,1998-09
以色列代表团访问开罗  内塔尼亚胡向埃及道歉,1998-09-10,1998-09
让更多学生上高中（通讯）,1998-09-10,1998-09
学生代课  老师过节,1998-09-10,1998-09
俄政府提出紧急财政措施  将恢复近年中断的经济改革,1998-09-10,1998-09
克林顿呼吁国会增加教育拨款  阿尔及利亚强调优先发展教育,1998-09-10,1998-09
零存整取筹学费  年轻家长减负担,1998-09-10,1998-09
工业污染影响加剧  臭氧空洞面积扩大,1998-09-10,1998-09
电视节目闯市场  上乘佳作赚外汇,1998-09-10,1998-09
今夏气温高  海岸赤潮涌,1998-09-10,1998-09
北京市全民健身宣传周有声有色,1998-09-10,1998-09
中国足协继续加大联赛管理力度,1998-09-10,1998-09
中国队分组不利,1998-09-10,1998-09
四川春泉酒业集团排球俱乐部成立,1998-09-10,1998-09
中国绿色行热气球赛年底举行,1998-09-10,1998-09
男女队携手迈进世青赛,1998-09-10,1998-09
武林英杰,1998-09-10,1998-09
美国网球公开赛阿加西塞莱斯被淘汰,1998-09-10,1998-09
两项全国纪录被改写,1998-09-10,1998-09
曼联俱乐部接受默多克报价,1998-09-10,1998-09
中医专家说桑兰的脊椎神经没有断,1998-09-10,1998-09
农民增收减负形势不容乐观（农村经济观察）,1998-09-10,1998-09
双城农民管村务,1998-09-10,1998-09
还农民自主权（编后小议）,1998-09-10,1998-09
绿色的希望（地方经济）,1998-09-10,1998-09
鸡场送给贫困村（村中人·村中事）,1998-09-10,1998-09
瓜农心里比瓜甜（农村新事）,1998-09-10,1998-09
井陉大力发展旅游业（四面八方）,1998-09-10,1998-09
万荣农民用上『满意电』（四面八方）,1998-09-10,1998-09
优质大米富邹岗（四面八方）,1998-09-10,1998-09
农民育金瓜  国际获金奖（四面八方）,1998-09-10,1998-09
领导者当以『四民』为要（思想纵横）,1998-09-10,1998-09
如何看待村民选举（学习通讯）,1998-09-10,1998-09
《为高速增长创造条件》,1998-09-10,1998-09
处理好县属国有企业改革的几个关系,1998-09-10,1998-09
领导干部要适应形势提高素质,1998-09-10,1998-09
《知识经济浪潮》,1998-09-10,1998-09
水退情不退（青春絮语）,1998-09-10,1998-09
团中央援建帐篷希望小学,1998-09-10,1998-09
广州团市委开通青少年防毒戒毒爱心咨询热线,1998-09-10,1998-09
风口浪尖旗更红,1998-09-10,1998-09
落榜以后,1998-09-10,1998-09
钢铁战士（今日星座）,1998-09-10,1998-09
我们村的年轻人,1998-09-10,1998-09
警察和贫困生,1998-09-10,1998-09
唐山人的情怀,1998-09-10,1998-09
伟堤（抗洪篇）,1998-09-10,1998-09
倾听大自然（笔墨山水）,1998-09-10,1998-09
甘露（摄影）,1998-09-10,1998-09
一篮鸡蛋的传说,1998-09-10,1998-09
帐篷小学,1998-09-10,1998-09
西海秀色（摄影）,1998-09-10,1998-09
桥,1998-09-10,1998-09
碎花石铺就小路,1998-09-10,1998-09
解放思想实事求是自强不息艰苦奋斗  妇女能够创造出无愧于时代光荣业绩,1998-09-11,1998-09
江泽民会见ＩＢＭ董事长,1998-09-11,1998-09
庆祝教师节暨优秀教师表彰会举行,1998-09-11,1998-09
围绕市场促升温（东西南北看形势·西部篇）,1998-09-11,1998-09
贵州加大基础设施建设力度,1998-09-11,1998-09
山西采取措施确保经济增速,1998-09-11,1998-09
北京地区天气预报,1998-09-11,1998-09
围绕市场促升温（东西南北看形势·西部篇）,1998-09-11,1998-09
重建家园：灾区农民缺啥？,1998-09-11,1998-09
加强行业自律  规范市场秩序,1998-09-11,1998-09
为制止企业间竞相降价无序竞争,1998-09-11,1998-09
经济适用住房信贷条件放宽（新闻快报）,1998-09-11,1998-09
宝钢率先实现“清洁炼铁”（新闻快报）,1998-09-11,1998-09
荆门电话化“公”为“私”节支百万（新闻快报）,1998-09-11,1998-09
河南三星公司被查处,1998-09-11,1998-09
交通部要求全力完成１８００亿元投资,1998-09-11,1998-09
国际金融公司支持中国私营企业发展,1998-09-11,1998-09
工行广东分行向茂名石化增贷,1998-09-11,1998-09
水泉湾隧道提前贯通,1998-09-11,1998-09
平谷举办金秋采摘节,1998-09-11,1998-09
昌平县资产重组招商首战告捷,1998-09-11,1998-09
中国环保技术与装备展开幕,1998-09-11,1998-09
解放思想实事求是自强不息艰苦奋斗  妇女能够创造出无愧于时代光荣业绩,1998-09-11,1998-09
献身抗洪的农民侯德云,1998-09-11,1998-09
为灾后重建提供人事人才保证,1998-09-11,1998-09
全军部分调整精简部队,1998-09-11,1998-09
最高人民法院加紧清理经商活动,1998-09-11,1998-09
铁岭市检察长吴志成被免职,1998-09-11,1998-09
北京军区给水团造福张北地震灾区,1998-09-11,1998-09
武警新乡支队注重抓好警民共建,1998-09-11,1998-09
淮阴县实行干部待岗制度,1998-09-11,1998-09
庆祝教师节暨优秀教师表彰会举行,1998-09-11,1998-09
护堤功成  坦克师官兵悄然别公安  生死相依  二十万群众闻讯长相送,1998-09-11,1998-09
赞『用自己的话讲』（人民论坛）,1998-09-11,1998-09
４６届军事五项世锦赛在京开幕,1998-09-11,1998-09
落实组织措施  实行集订分送,1998-09-11,1998-09
教育系统赈灾义演募集款物近５亿,1998-09-11,1998-09
丁关根会见日本客人,1998-09-11,1998-09
中国美协五次全国代表大会召开,1998-09-11,1998-09
外交部发言人答记者问,1998-09-11,1998-09
香港成功申办亚太旅协年会,1998-09-11,1998-09
明天气象预报,1998-09-11,1998-09
扎实做好工作  保证订阅经费（认真贯彻落实中办通知精神  确保人民日报发行稳中有升）,1998-09-11,1998-09
中国红十字会依法管理救灾款物,1998-09-11,1998-09
圩堤上的教师节,1998-09-11,1998-09
碣石山下『葡萄沟』,1998-09-11,1998-09
第三届中华人口奖开始遴选,1998-09-11,1998-09
客房连上因特网,1998-09-11,1998-09
《抗洪赈灾》附捐邮票发行,1998-09-11,1998-09
全国羽毛球锦标赛开拍,1998-09-11,1998-09
国际职业台球赛结束  亨德利名列榜首,1998-09-11,1998-09
中国男女队双获冠军,1998-09-11,1998-09
上海男排获国际男排邀请赛冠军,1998-09-11,1998-09
全国场地自行车赛决出男子凯林赛冠军,1998-09-11,1998-09
私营企业家与希望小学,1998-09-11,1998-09
“十年一个轮回”,1998-09-11,1998-09
唐灵生告别体坛  莫慧兰就读人大,1998-09-11,1998-09
《发展与挑战》出版,1998-09-11,1998-09
２０所希望小学千余名师生受表彰,1998-09-11,1998-09
欧亚平向北京理工大学捐款百万元,1998-09-11,1998-09
北京２１世纪实验学校捐助灾区师生,1998-09-11,1998-09
新世纪质量认证中心捐助希望工程,1998-09-11,1998-09
天津教师情寄灾区学子,1998-09-11,1998-09
射阳县被授予蒜薹之乡称号,1998-09-11,1998-09
老中医座谈授徒师承经验,1998-09-11,1998-09
冠群金辰公司研讨反计算机病毒,1998-09-11,1998-09
北大附中举办教师指挥音乐会,1998-09-11,1998-09
第五十三届联大开幕,1998-09-11,1998-09
叶利钦提名普里马科夫为总理  切尔诺梅尔金放弃候选人资格,1998-09-11,1998-09
卢布贬值与俄美峰会（国际论坛）,1998-09-11,1998-09
委内瑞拉总统会见吴邦国,1998-09-11,1998-09
许嘉璐在各国议联大会上发言,1998-09-11,1998-09
我代表在议联会议上谈人权问题,1998-09-11,1998-09
斯塔尔向国会提交报告,1998-09-11,1998-09
印尼总统呼吁人民谅解当前国内困难,1998-09-11,1998-09
塔利班称伊外交官已死亡,1998-09-11,1998-09
经济安全的分量加大（综述）,1998-09-11,1998-09
霍华德大选抢先机（新闻分析）,1998-09-11,1998-09
金边局势依然紧张,1998-09-11,1998-09
俄国家杜马呼吁严控物价,1998-09-11,1998-09
遏制过度金融投机（经济札记）,1998-09-11,1998-09
毒祸猖狂蔓延  禁毒任重道远（综述）,1998-09-11,1998-09
全球  贫富差距继续拉大  美国  两极分化更趋严重,1998-09-11,1998-09
我西藏艺术团在蒙古国深受欢迎,1998-09-11,1998-09
日本利率下调  美元汇价大升,1998-09-11,1998-09
地下水源所剩无几  生活用水污染严重,1998-09-11,1998-09
连环画走俏收藏品市场,1998-09-11,1998-09
『最高水平』演出不实  『马林斯基剧院』有虚,1998-09-11,1998-09
凤凰山下的盛大节日,1998-09-11,1998-09
我看《杜兰朵》与《图兰多》,1998-09-11,1998-09
“开国金典”面世,1998-09-11,1998-09
《二十年间》征文启事,1998-09-11,1998-09
干干净净迎『检查』,1998-09-11,1998-09
从收藏粮票看世事变迁（收藏话题）,1998-09-11,1998-09
我舍不得北京天文馆（大地漫笔）,1998-09-11,1998-09
武学伟在时装中吟唱（服饰之旅）,1998-09-11,1998-09
好一朵白兰花（艺与人）,1998-09-11,1998-09
山雄水秀看安康,1998-09-11,1998-09
在因特网上买音乐会门票（都市生活）,1998-09-11,1998-09
中央实验话剧院演出《坏话一条街》,1998-09-11,1998-09
演歌剧赈灾区,1998-09-11,1998-09
抗洪歌曲专辑盒带《新的长城》出版,1998-09-11,1998-09
爬山与“心血管体操”（爱康工程）,1998-09-11,1998-09
《许地山文集》出版,1998-09-11,1998-09
中外学者研讨龙文化,1998-09-11,1998-09
回味“老三届”,1998-09-11,1998-09
“东方神韵画展”展出,1998-09-11,1998-09
水患萦怀  翰墨传情·书画界赈灾义卖作品选登,1998-09-11,1998-09
慧而达  专而妙（艺坛人物）,1998-09-11,1998-09
黑夜行路有明灯,1998-09-11,1998-09
王丹金石不随波,1998-09-11,1998-09
田黎明：波光摇曳（艺苑掇英）,1998-09-11,1998-09
面对海外军团（艺坛走笔）,1998-09-11,1998-09
中国美术出版总社在京成立,1998-09-11,1998-09
“黄山风中国画作品展”举行,1998-09-11,1998-09
《走进西藏》画展在京举行,1998-09-11,1998-09
“王兰亭梅花百幅国画展”在京举行,1998-09-11,1998-09
第五届当代中国书画家十人联展举行,1998-09-11,1998-09
永远怀念朱自清老师（心香一瓣）,1998-09-11,1998-09
我看《从头说起》（品书札记）,1998-09-11,1998-09
塞北人家（中国画）,1998-09-11,1998-09
救灾交响曲（三章）,1998-09-11,1998-09
鱼娃（路边拾翠）,1998-09-11,1998-09
姐妹湖（笔墨山水）,1998-09-11,1998-09
漏粉（多味斋）,1998-09-11,1998-09
山乡的希望（摄影）,1998-09-11,1998-09
做好卫生防病防疫工作确保灾后无大疫,1998-09-12,1998-09
８月份工商税收比去年同期增８·８％  头８月外贸进出口总额过两千亿美元,1998-09-12,1998-09
李鹏会见越南客人,1998-09-12,1998-09
李鹏会见加拿大客人,1998-09-12,1998-09
中银向津滨高速公路提供贷款,1998-09-12,1998-09
季允石为江苏省代理省长,1998-09-12,1998-09
回良玉任安徽省委书记,1998-09-12,1998-09
胡锦涛会见韩国客人,1998-09-12,1998-09
“铁人”精神筑长堤,1998-09-12,1998-09
普里马科夫出任俄政府总理,1998-09-12,1998-09
朱镕基总理致电祝贺,1998-09-12,1998-09
南京长江二桥加紧施工,1998-09-12,1998-09
浙江加快基础设施建设,1998-09-12,1998-09
北京地区天气预报,1998-09-12,1998-09
做好卫生防病防疫工作确保灾后无大疫,1998-09-12,1998-09
维护社会治安秩序  保证人民安居乐业,1998-09-12,1998-09
８月份全国市场物价继续下降,1998-09-12,1998-09
加强捐赠管理  帮助灾区重建家园,1998-09-12,1998-09
中央国家机关带头增收节支,1998-09-12,1998-09
做好抗洪及灾后粮食供应工作,1998-09-12,1998-09
各级政府要依法治农维护农民合法权益,1998-09-12,1998-09
外交部发言人就叶利钦提名  普里马科夫为新总理人选发表评论,1998-09-12,1998-09
中国政府强烈谴责这一行径,1998-09-12,1998-09
古巴向我灾区捐赠药品,1998-09-12,1998-09
王兆国会见香港客人,1998-09-12,1998-09
明天气象预报,1998-09-12,1998-09
张万年赴美进行正式访问,1998-09-12,1998-09
钱其琛会见巴基斯坦客人,1998-09-12,1998-09
傅全有会见泰国海军总司令,1998-09-12,1998-09
唐家璇会见巴基斯坦客人,1998-09-12,1998-09
中非外交国务部长将访华,1998-09-12,1998-09
一些国家领导人表示慰问,1998-09-12,1998-09
一方有难  八方支援,1998-09-12,1998-09
塔利班发现伊外交官尸体  伊朗声称将采取报复行动  安理会呼吁进行紧急调查,1998-09-12,1998-09
游子情系家乡（通讯）,1998-09-12,1998-09
为了灾区孩子（通讯）,1998-09-12,1998-09
普里马科夫缘何能过关（新闻分析）,1998-09-12,1998-09
美财长：人民币稳定世界受益,1998-09-12,1998-09
各国议联大会闭幕,1998-09-12,1998-09
俄罗斯新总理（新闻人物）,1998-09-12,1998-09
美初步估断朝发射卫星,1998-09-12,1998-09
公布克林顿绯闻调查报告,1998-09-12,1998-09
以军警打死两名哈马斯成员  再次封锁加沙和约旦河西岸,1998-09-12,1998-09
美元汇价全线跌落  纽约股市再度下滑,1998-09-12,1998-09
中国女枪手个人成绩暂列头名,1998-09-12,1998-09
世界特技飞行大奖赛精彩开幕,1998-09-12,1998-09
以竞赛带动水平,1998-09-12,1998-09
范志毅孙继海作为英甲外籍球员抵达伦敦,1998-09-12,1998-09
里贝克出任德国国家足球队主教练,1998-09-12,1998-09
全国女子手球锦标赛在合肥举行,1998-09-12,1998-09
国际业余田联世界杯赛开幕,1998-09-12,1998-09
西班牙国家足球队教练辞职,1998-09-12,1998-09
亚青女篮赛中国队卫冕形势严峻,1998-09-12,1998-09
夏商周断代工程及其新进展（学科扫描）,1998-09-12,1998-09
莫吝“金针”度与人（治学漫笔）,1998-09-12,1998-09
海外近代史研究的一项成果（书刊评介）,1998-09-12,1998-09
戊戌维新一百周年国际学术讨论会（学术交流）,1998-09-12,1998-09
《不列颠百科全书》国际中文版（新书介绍）,1998-09-12,1998-09
摄影,1998-09-12,1998-09
气象事业：挺进经济主战场,1998-09-12,1998-09
科学技术是抗洪抢险胜利的保证,1998-09-12,1998-09
确保粮改工作顺利进行,1998-09-12,1998-09
加快财政支出改革,1998-09-12,1998-09
培植龙头企业  带动区域经济,1998-09-12,1998-09
中国因特网通向何方（电脑·通信·网络）,1998-09-12,1998-09
南极出现严重暖冬现象（热点追踪）,1998-09-12,1998-09
光栅立体成像技术引人入胜（百科博览）,1998-09-12,1998-09
科技出版『冷』『热』谈（科技杂谈）,1998-09-12,1998-09
中国人怎样拿诺贝尔奖（科海传真）,1998-09-12,1998-09
美国专家谈中国遗传学研究,1998-09-12,1998-09
造一个数字地球,1998-09-12,1998-09
青年计算机科技论坛开幕（新闻频道）,1998-09-12,1998-09
日本成功实现柴油改性（新闻频道）,1998-09-12,1998-09
中文手写输入发生重大变革（新闻频道）,1998-09-12,1998-09
内窥镜技术开始用于手术临床（新闻频道）,1998-09-12,1998-09
清华同方广造智能大厦（新闻频道）,1998-09-12,1998-09
北大方正进军广电行业（新闻频道）,1998-09-12,1998-09
希望从这里升起,1998-09-12,1998-09
共同的奉献,1998-09-12,1998-09
大学生为山民建书屋,1998-09-12,1998-09
河北重点建设『长』势喜人,1998-09-13,1998-09
正是襄阳好风日,1998-09-13,1998-09
西藏一江两河综合开发结硕果,1998-09-13,1998-09
美对中国输美木质包装物  单方采取不合理严厉措施  此举将严重影响中美贸易,1998-09-13,1998-09
“科技大集”农民忙（现场短新闻征文）,1998-09-13,1998-09
台湾“重返”联合国图谋再遭失败,1998-09-13,1998-09
外交部发言人发表谈话,1998-09-13,1998-09
湖南湖北力保援藏项目资金足额到位,1998-09-13,1998-09
北京地区天气预报,1998-09-13,1998-09
天津大力改善教师住房条件,1998-09-13,1998-09
内蒙古又有２５万灾民住暖房,1998-09-13,1998-09
第二届中国投资贸洽会闭幕,1998-09-13,1998-09
西安市“两节一会”注重实效,1998-09-13,1998-09
北京第一家汽车加气站运营,1998-09-13,1998-09
上海粮食基地选址北大荒,1998-09-13,1998-09
浙江财政收入同比大幅增加,1998-09-13,1998-09
正是襄阳好风日,1998-09-13,1998-09
普里马科夫谈俄新政府任务,1998-09-13,1998-09
西哈努克敦促反对党议员参加国会,1998-09-13,1998-09
美国会公布斯塔尔报告  白宫法律顾问据理反驳,1998-09-13,1998-09
伊朗称其两名外交人员幸免于难,1998-09-13,1998-09
纪念周谷城同志诞辰一百周年,1998-09-13,1998-09
贯彻落实国务院通知精神  制止毁林开垦和乱占林地,1998-09-13,1998-09
湖南决定封山植树退耕还林,1998-09-13,1998-09
生产环保两相宜,1998-09-13,1998-09
首都人民支援灾区重建家园捐赠仪式举行,1998-09-13,1998-09
中国美协第五次全国代表大会闭幕,1998-09-13,1998-09
明天气象预报,1998-09-13,1998-09
“年轻生命的最后乐章”,1998-09-13,1998-09
走近黑海,1998-09-13,1998-09
马六甲感怀,1998-09-13,1998-09
不废江河万古流,1998-09-13,1998-09
重返萨尔瓦多,1998-09-13,1998-09
『我能为中国人民做些什么』（五洲茶亭）,1998-09-13,1998-09
鄂州大力推广避灾农业（头条竞赛）,1998-09-13,1998-09
