中国妇女第八次全国代表大会开幕,1998-09-01,1998-09
在实现我国跨世纪发展的历史进程中充分发挥妇女的半边天作用,1998-09-01,1998-09
增收节支  支援灾区,1998-09-01,1998-09
江主席与尼亚佐夫总统会谈,1998-09-01,1998-09
统一思想加强领导迅速而严厉地打击走私犯罪活动,1998-09-01,1998-09
北京地区天气预报,1998-09-01,1998-09
大力加强基础设施建设,1998-09-01,1998-09
灾后恢复生产不能搞简单“复制”,1998-09-01,1998-09
在实现我国跨世纪发展的历史进程中充分发挥妇女的半边天作用,1998-09-01,1998-09
中流砥柱  钢铁长城,1998-09-01,1998-09
“铁锤子团”抗洪记（抗洪先锋谱）,1998-09-01,1998-09
济南军区某团抗洪勇挑重担（抗洪先锋谱）,1998-09-01,1998-09
烈士父亲的情怀（抗洪先锋谱）,1998-09-01,1998-09
退伍兵周春雷抗洪现虎威（抗洪先锋谱）,1998-09-01,1998-09
王兆国会见港澳妇女代表,1998-09-01,1998-09
台胞乘船直航厦门  返回岛内竟遭逮捕,1998-09-01,1998-09
江主席与尼亚佐夫总统会谈,1998-09-01,1998-09
李鹏会见土库曼斯坦总统,1998-09-01,1998-09
李岚清拜会土库曼斯坦总统,1998-09-01,1998-09
中国妇女八大举行预备会,1998-09-01,1998-09
中国妇女第八次全国代表大会主席团常务主席名单,1998-09-01,1998-09
坚持到底夺取抗洪抢险最后胜利,1998-09-01,1998-09
大力支持和关心抗洪抢险部队,1998-09-01,1998-09
支持灾后恢复生产重建家园,1998-09-01,1998-09
平山郁夫向我灾区捐款,1998-09-01,1998-09
国家防总发布第４３号汛情通报,1998-09-01,1998-09
民政部接受一批外国政府和机构援助,1998-09-01,1998-09
智利驻华大使向我捐款,1998-09-01,1998-09
钱其琛会见苏丹总统特使,1998-09-01,1998-09
明天气象预报,1998-09-01,1998-09
李铁映会见日本客人,1998-09-01,1998-09
迟浩田与新西兰国防部长会谈,1998-09-01,1998-09
贾庆林会见日前首相海部俊树,1998-09-01,1998-09
邹家华会见意大利议员代表团,1998-09-01,1998-09
傅全有会见新西兰客人,1998-09-01,1998-09
唐家璇赴南非出席不结盟运动首脑会议,1998-09-01,1998-09
海南省委书记杜青林离京访葡,1998-09-01,1998-09
加强学校卫生防病工作,1998-09-01,1998-09
“山里娃汽车医院”开赴灾区,1998-09-01,1998-09
我国发现第一个大型整装煤层气田,1998-09-01,1998-09
帐篷小学开学了,1998-09-01,1998-09
掩不住的读书声,1998-09-01,1998-09
中学生活第一天,1998-09-01,1998-09
安徽：如期做到『四到位』,1998-09-01,1998-09
我们开学了！,1998-09-01,1998-09
受灾省区千方百计保开学,1998-09-01,1998-09
江西：救灾复校“第一急”,1998-09-01,1998-09
湖南：因地制宜抓开课,1998-09-01,1998-09
湖北：入学方案全落实,1998-09-01,1998-09
内蒙古：多种形式保开学,1998-09-01,1998-09
吉林：让师生安全过冬,1998-09-01,1998-09
黑龙江：大半学校已开学,1998-09-01,1998-09
国家杜马否决总理任命,1998-09-01,1998-09
第七次中日民间人士会议开幕,1998-09-01,1998-09
已签协议应予执行（国际论坛）,1998-09-01,1998-09
不结盟国家外长会议开幕,1998-09-01,1998-09
科尔对俄局势表示忧虑,1998-09-01,1998-09
美俄首脑会晤之前（综述）,1998-09-01,1998-09
西哈努克发表告同胞书,1998-09-01,1998-09
刚果（金）政府军收复两要地,1998-09-01,1998-09
申请专利的苦恼（连载）,1998-09-01,1998-09
巴拿马总统连任法案遭否决,1998-09-01,1998-09
克总统同美国务卿会谈,1998-09-01,1998-09
阿盟谴责以镇压巴人  黎要求以无条件撤军,1998-09-01,1998-09
谴责美轰炸希法制药厂  否认与拉登有任何关系,1998-09-01,1998-09
半导体叩开知识经济大门（院士园地）,1998-09-01,1998-09
西方七国敦促俄深化改革,1998-09-01,1998-09
国际清算银行呼吁严防金融危机,1998-09-01,1998-09
全球股市暴跌的日本因素（新闻分析）,1998-09-01,1998-09
欧洲科技论文排座次  伦敦６·５万篇居榜首,1998-09-01,1998-09
三分之一美国人成为网民  瑞士设立反色情举报网址,1998-09-01,1998-09
日本  台风引发洪水,1998-09-01,1998-09
一代王妃  音容宛在,1998-09-01,1998-09
西方学者聚讼纷纭  蒙娜丽莎真容难见,1998-09-01,1998-09
苏丹  河水泛滥成灾,1998-09-01,1998-09
『物尽其用』不易,1998-09-01,1998-09
失踪十六天生还无可能,1998-09-01,1998-09
浙江男篮找到新婆家,1998-09-01,1998-09
中国网球从娃娃抓起,1998-09-01,1998-09
盛泽田获世界摔跤锦标赛亚军,1998-09-01,1998-09
围棋高手赈灾义赛,1998-09-01,1998-09
法自行车选手破世界纪录,1998-09-01,1998-09
第九届阿拉伯足球杯赛闭幕,1998-09-01,1998-09
大学生篮球赛Ａ级队比赛落幕,1998-09-01,1998-09
南华利生向『宏志班』赠球,1998-09-01,1998-09
汪洋获棋圣战三段组冠军,1998-09-01,1998-09
用生命书写正义,1998-09-01,1998-09
导向文明,1998-09-01,1998-09
民族尊严  岂容侵害,1998-09-01,1998-09
“小道”广告当治（采访随想）,1998-09-01,1998-09
狮泉河印象（边地行）,1998-09-01,1998-09
灾重更显公仆情,1998-09-01,1998-09
洪水冲不走希望,1998-09-01,1998-09
学会拿笔杆（思想纵横）,1998-09-01,1998-09
《马克思恩格斯全集》新版若干卷陆续出版（理论信息）,1998-09-01,1998-09
依法治国与党的领导,1998-09-01,1998-09
怎样认识稽察特派员制度（学习通信）,1998-09-01,1998-09
实践是一所伟大的学校,1998-09-01,1998-09
向抗洪救灾的政法勇士致敬,1998-09-01,1998-09
湖北万名公安交警：洪水中不倒的路标,1998-09-01,1998-09
湖南６０００检察官：舍生忘死抗洪灾,1998-09-01,1998-09
依法治税（法治论苑）,1998-09-01,1998-09
分解『投机倒把罪』（法律知识ＡＢＣ）,1998-09-01,1998-09
黑手，伸向国库（大案要案写真）,1998-09-01,1998-09
金盾闪光,1998-09-01,1998-09
公证：妙解经济“难题”（公证视点）,1998-09-01,1998-09
机制『透明』（执法者风采）,1998-09-01,1998-09
西昌公安,1998-09-01,1998-09
冯玉祥将军在美国的反蒋斗争,1998-09-01,1998-09
回忆龚子荣同志二三事,1998-09-01,1998-09
潘汉年与西安事变的和平解决,1998-09-01,1998-09
增收节支制止浪费支援抗洪救灾工作,1998-09-02,1998-09
依法治水科学治水,1998-09-02,1998-09
老师，您好（今日谈）,1998-09-02,1998-09
乘胜前进  坚持到底,1998-09-02,1998-09
要下决心把砍树人变成种树人,1998-09-02,1998-09
江泽民会见海部俊树,1998-09-02,1998-09
选准选好新增国债投资项目,1998-09-02,1998-09
建区纪念日不搞庆典  西藏厉行节约支援灾区,1998-09-02,1998-09
领导干部要紧密联系当前实际  深入学习自觉运用邓小平理论,1998-09-02,1998-09
中央资助灾区教育专款落实３亿元,1998-09-02,1998-09
北京地区天气预报,1998-09-02,1998-09
增收节支制止浪费支援抗洪救灾工作,1998-09-02,1998-09
新增一千亿国债定向投资六个方面,1998-09-02,1998-09
“森达”的辩证思维,1998-09-02,1998-09
拉动经济增长的重大决策,1998-09-02,1998-09
第六期重点国有企业领导干部培训班开学,1998-09-02,1998-09
昆明国家粮食储备中转库  逆向操作低价销粮被查处,1998-09-02,1998-09
确保灾区食肉安全,1998-09-02,1998-09
有关部门对国企下岗职工作出界定,1998-09-02,1998-09
马永顺：从伐木模范到造林模范（新闻人物）,1998-09-02,1998-09
依法治水科学治水,1998-09-02,1998-09
灾区各级人事部门在抗洪救灾中显身手,1998-09-02,1998-09
火线入党,1998-09-02,1998-09
全国各级妇联工作卓有成效,1998-09-02,1998-09
严厉打击外汇违法犯罪行为,1998-09-02,1998-09
德州开展做群众满意干部活动,1998-09-02,1998-09
“蛙人”入江降洪魔,1998-09-02,1998-09
胡锦涛代表党中央的祝词在妇代会上反响热烈,1998-09-02,1998-09
澳门同胞庆祝建国４９周年筹委会成立,1998-09-02,1998-09
辽宁《共产党员》杂志社千床棉被送灾区,1998-09-02,1998-09
领导干部要紧密联系当前实际  深入学习自觉运用邓小平理论,1998-09-02,1998-09
深明大义的中华儿女（人民论坛）,1998-09-02,1998-09
中土两国签署联合声明,1998-09-02,1998-09
李鹏会见新西兰国防部长,1998-09-02,1998-09
胡锦涛会见圣卢西亚客人,1998-09-02,1998-09
尉健行会见新加坡客人,1998-09-02,1998-09
国家防总发布第４４号汛情通报,1998-09-02,1998-09
民政部要求多渠道解决灾民口粮,1998-09-02,1998-09
钱其琛会见海部俊树（友好往来）,1998-09-02,1998-09
军队高级干部参加轮训班,1998-09-02,1998-09
第七届乌洽会开幕,1998-09-02,1998-09
全国人大常委会执法检查组将赴４省区,1998-09-02,1998-09
大堤上的账篷诊所,1998-09-02,1998-09
明天气象预报,1998-09-02,1998-09
吴仪会见斐济财政部长（友好往来）,1998-09-02,1998-09
筑起生命之坝,1998-09-02,1998-09
首批国家储备药品已调出,1998-09-02,1998-09
傲视洪魔书声朗,1998-09-02,1998-09
情系灾区献爱心,1998-09-02,1998-09
赴藏国家医疗队工作进展顺利,1998-09-02,1998-09
冯玉祥殉难５０周年座谈会在京举行,1998-09-02,1998-09
江苏高校提供勤工助学,1998-09-02,1998-09
上海拨专款救济灾区学生,1998-09-02,1998-09
中国科大为新生提供生活用品,1998-09-02,1998-09
中国人民大学减免灾区学生费用,1998-09-02,1998-09
南开大学为特困生发放冬装补助,1998-09-02,1998-09
长沙救灾教育优先,1998-09-02,1998-09
我国高压变频调速技术有新突破,1998-09-02,1998-09
我军选派精兵强将参赛,1998-09-02,1998-09
南斯拉夫保证比赛如期举办,1998-09-02,1998-09
美国网球公开赛在纽约开战,1998-09-02,1998-09
印尼欲夺取五枚亚运会羽毛球金牌,1998-09-02,1998-09
江淮大地一道风景线,1998-09-02,1998-09
６城市正式申办２００６年冬奥会,1998-09-02,1998-09
全国羽毛球锦标赛将在成都举行,1998-09-02,1998-09
“太极之乡”举办国际太极拳年会,1998-09-02,1998-09
克林顿与叶利钦会晤,1998-09-02,1998-09
为友好合作架桥（记者专访）,1998-09-02,1998-09
再次提名切尔诺梅尔金为总理,1998-09-02,1998-09
朝美会谈恢复,1998-09-02,1998-09
日本天皇会见宋健,1998-09-02,1998-09
俄罗斯政局扑朔迷离（综述）,1998-09-02,1998-09
柬大选正式结果揭晓,1998-09-02,1998-09
澳大利亚  为何提前大选（新闻分析）,1998-09-02,1998-09
学习外语之争（连载）,1998-09-02,1998-09
呼吁和平解决刚果（金）冲突,1998-09-02,1998-09
美国巴尔的摩中华学校成立,1998-09-02,1998-09
蒙总统接受新总理提名,1998-09-02,1998-09
韩第一大党总裁选出,1998-09-02,1998-09
巴拿马外交部长易人,1998-09-02,1998-09
又一个『黑色星期一』（经济札记）,1998-09-02,1998-09
全球金融市场再次剧烈动荡,1998-09-02,1998-09
阿根廷专家赴俄当顾问（通讯）,1998-09-02,1998-09
建筑物防潮新法（科技发明）,1998-09-02,1998-09
机器人真灵巧（科技发明）,1998-09-02,1998-09
新晶体管功率高（科技发明）,1998-09-02,1998-09
特殊药物防疤痕（科技发明）,1998-09-02,1998-09
花车盛会踩高跷,1998-09-02,1998-09
惨祸一天四起  死伤接近百人,1998-09-02,1998-09
二战苦工索赔  德奥公司犯难,1998-09-02,1998-09
因特网经济有前途  五年内投资可收回,1998-09-02,1998-09
电脑黑客发动袭击  总理网址遭到篡改,1998-09-02,1998-09
中华人民共和国土地管理法,1998-09-02,1998-09
反腐败  保企业,1998-09-02,1998-09
话费争议案的教训（连续报道）,1998-09-02,1998-09
苹果树栽在哪里？,1998-09-02,1998-09
多好的战士,1998-09-02,1998-09
一位记者眼中的“老兵”,1998-09-02,1998-09
咸宁地区金融部门支持灾区重建家园,1998-09-02,1998-09
沈阳军区后勤紧急组建兵站  佳市邮局火速免费架通电话,1998-09-02,1998-09
面对第十三次选择（朴素人生）,1998-09-02,1998-09
一桩贩卖私盐案的台前幕后（调查汇报）,1998-09-02,1998-09
强占良田堆垃圾，谁管？,1998-09-02,1998-09
赞云溪乡迁楼之举（读者论坛）,1998-09-02,1998-09
癌症的综合治疗（知识窗）,1998-09-02,1998-09
轻舟架起生命桥（人与人）,1998-09-02,1998-09
廊坊军分区官兵为灾区捐款,1998-09-02,1998-09
襄樊军分区官兵和离退休干部情系灾区,1998-09-02,1998-09
武宁县种子公司销售劣种———坑人！（监督哨）,1998-09-02,1998-09
领录取通知要交赞助费———怪事！（监督哨）,1998-09-02,1998-09
三九集团向灾区捐赠药品,1998-09-02,1998-09
抗洪是英雄  爱民当模范,1998-09-02,1998-09
大众化就是粗俗化吗？,1998-09-02,1998-09
走出『粗俗化』的文化怪圈,1998-09-02,1998-09
军医黄党发（普通人的故事）,1998-09-02,1998-09
含辛茹苦抚残婴（普通人的故事）,1998-09-02,1998-09
类风湿诊疗（家庭医疗保健常识９２）,1998-09-02,1998-09
不得以国家机关工作人员名义做广告（事中有法）,1998-09-02,1998-09
政府早已责令关停  再行转卖当属无效（事中有法）,1998-09-02,1998-09
股份制与股份合作制的区别（知识窗）,1998-09-02,1998-09
爱心无价（实话实说）,1998-09-02,1998-09
稍安勿躁（人生一得）,1998-09-02,1998-09
心系灾区,1998-09-02,1998-09
警惕  企业干部群体违法违纪（本期聚焦）,1998-09-02,1998-09
清正廉洁铸辉煌,1998-09-02,1998-09
严格未必不真情,1998-09-02,1998-09
俭以养德（议论风生）,1998-09-02,1998-09
廊坊加强农村基层干部理论学习,1998-09-02,1998-09
老干部的赈灾情,1998-09-02,1998-09
在洪水中永生,1998-09-02,1998-09
鄂州供电局重视干部队伍建设,1998-09-02,1998-09
锦西炼化总厂注重发展一线党员（党建百花园）,1998-09-02,1998-09
伊楼村的一颗星,1998-09-02,1998-09
武警安徽总队党委公正用人（党建百花园）,1998-09-02,1998-09
双鸭山市开展领导干部监督测评（党建百花园）,1998-09-02,1998-09
加强领导统筹规划自力更生团结奋斗,1998-09-03,1998-09
江泽民会见以色列国防部长,1998-09-03,1998-09
江泽民会见基辛格和万斯,1998-09-03,1998-09
在政协第九届全国委员会第七次主席会议上的讲话,1998-09-03,1998-09
九届政协第七次主席会议举行  李瑞环主持会议并作重要讲话,1998-09-03,1998-09
选新址建新村,1998-09-03,1998-09
李瑞环会见国际狮子会访华团,1998-09-03,1998-09
安民兴邦的大事,1998-09-03,1998-09
北京地区天气预报,1998-09-03,1998-09
建行加大基础设施贷款投放,1998-09-03,1998-09
呼和浩特兴建引黄供水工程,1998-09-03,1998-09
天然林保护工程将全面启动,1998-09-03,1998-09
上海大力推进信息产业建设,1998-09-03,1998-09
成昆线南段电气化工程开工,1998-09-03,1998-09
大庆油田甲醇生产装置投产,1998-09-03,1998-09
加强领导统筹规划自力更生团结奋斗,1998-09-03,1998-09
“治水的龙王”,1998-09-03,1998-09
就业门路来自服务（为下岗职工办实事）,1998-09-03,1998-09
国企职工下岗须按严格程序进行,1998-09-03,1998-09
严惩趁灾售假违法行为,1998-09-03,1998-09
北京旅游业居全国之首,1998-09-03,1998-09
中行加大对外贸出口支持力度,1998-09-03,1998-09
挖出一批啃吃北京西站工程的蛀虫,1998-09-03,1998-09
陕西电话用户超２００万户,1998-09-03,1998-09
开发银行迈出市场化筹资第一步,1998-09-03,1998-09
中技（菲律宾）机电产品有限公司开业,1998-09-03,1998-09
巨龙公司技改再获政府支持,1998-09-03,1998-09
我国电子产品数据库光盘发行,1998-09-03,1998-09
长虹与东芝进行空调技术合作,1998-09-03,1998-09
哈密车务段连续五年报平安,1998-09-03,1998-09
兰州交易会成果丰富,1998-09-03,1998-09
在广泛参与中实现妇女全面进步,1998-09-03,1998-09
综治工作必须常抓不懈,1998-09-03,1998-09
扶贫接力计划将在全国广泛推进,1998-09-03,1998-09
子弟兵完成排险  将返驻地  哈市民夹道相送  泪洒江边,1998-09-03,1998-09
『铁旅长』史学忠,1998-09-03,1998-09
甘肃妥善处理遇难台胞后事,1998-09-03,1998-09
灾区公安消防部门及时部署防火,1998-09-03,1998-09
如此『创收』（社会扫描）,1998-09-03,1998-09
京郊马池口镇加大党建力度,1998-09-03,1998-09
妇女八大举行主席团第二次会议（在中国妇女第八次全国代表大会上）,1998-09-03,1998-09
中央国家机关干部职工踊跃捐献衣被,1998-09-03,1998-09
妇女八大代表举行邓小平理论专题座谈会,1998-09-03,1998-09
清丰人事局加强队伍建设,1998-09-03,1998-09
民政部要求各地解决灾民御寒问题,1998-09-03,1998-09
九届政协第七次主席会议举行  李瑞环主持会议并作重要讲话,1998-09-03,1998-09
中宣部召开中央主要新闻单位负责人会议,1998-09-03,1998-09
创作优秀作品  讴歌抗洪抢险,1998-09-03,1998-09
读者信箱,1998-09-03,1998-09
邢海帆同志逝世,1998-09-03,1998-09
黑龙江千方百计帮助灾民安全越冬,1998-09-03,1998-09
何英杰何柱国捐款５０００万港元,1998-09-03,1998-09
长江干流水位开始全线回落,1998-09-03,1998-09
国家防总发布四十五号汛情通报,1998-09-03,1998-09
本报救灾热线电话又接到一批捐赠,1998-09-03,1998-09
“爱心”医院,1998-09-03,1998-09
明天气象预报,1998-09-03,1998-09
中以国防部长会谈,1998-09-03,1998-09
钱其琛会见韩国客人,1998-09-03,1998-09
温家宝会见美中协会代表团,1998-09-03,1998-09
司马义·艾买提会见国际友人,1998-09-03,1998-09
王忠禹会见巴西客人,1998-09-03,1998-09
傅全有会见罗马尼亚国防部长,1998-09-03,1998-09
土库曼斯坦总统访问深圳,1998-09-03,1998-09
科教兴区  人才为先 （科教兴国神州行）,1998-09-03,1998-09
向世界说明中国,1998-09-03,1998-09
三军医大西南医院抓医德医风,1998-09-03,1998-09
摧不垮的“健康大堤”,1998-09-03,1998-09
南京军区派专家为吴良珠会诊,1998-09-03,1998-09
长江洪灾区校园重建基金启动,1998-09-03,1998-09
吉林高校情系抗洪救灾,1998-09-03,1998-09
第一支国家医疗队灾区返京,1998-09-03,1998-09
做好救灾药品供应和使用管理工作,1998-09-03,1998-09
大堤上的特殊课堂,1998-09-03,1998-09
科技部与建设部联合举办座谈会,1998-09-03,1998-09
洲头救学记,1998-09-03,1998-09
新航天远洋船屡创佳绩,1998-09-03,1998-09
红楼梦文化艺术展展品启运台北,1998-09-03,1998-09
中外文化冲突与融合研讨会举行,1998-09-03,1998-09
《朗文当代高级英语辞典》出版,1998-09-03,1998-09
《素质教育文库》等获冰心奖,1998-09-03,1998-09
联想以科普打市场,1998-09-03,1998-09
第十二次不结盟国家首脑会议开幕,1998-09-03,1998-09
俄美总统签署一系列双边文件,1998-09-03,1998-09
寄海外情  献同胞心（国外特写）,1998-09-03,1998-09
叶利钦责成代总理组建新政府,1998-09-03,1998-09
我全国人大代表团将出席各国议联大会,1998-09-03,1998-09
朝强调发射导弹是自主权问题  日政府决定追加对朝制裁措施,1998-09-03,1998-09
意议员赞扬我西藏政策,1998-09-03,1998-09
澳各界向种族主义说“不”（通讯）,1998-09-03,1998-09
唐家璇会见金永南,1998-09-03,1998-09
新芬党宣称结束使用暴力,1998-09-03,1998-09
蒙古议会否决新总理人选,1998-09-03,1998-09
伊朗在伊阿边境举行军事演习,1998-09-03,1998-09
苏丹代表团前往利比亚,1998-09-03,1998-09
马来西亚副总理安瓦尔被解职,1998-09-03,1998-09
《图兰多》太庙省亲,1998-09-03,1998-09
挪威弃守克朗汇率（通讯）,1998-09-03,1998-09
纽约股市止跌反弹  西欧股市跌势趋缓,1998-09-03,1998-09
马来西亚实施外汇管制  泰国经济明年有望复苏  韩国经济形势继续恶化,1998-09-03,1998-09
全球股市下跌探因（新闻分析）,1998-09-03,1998-09
抗洪能力全国普查  依法治水常备不懈,1998-09-03,1998-09
一些国家采取措施  加强防范金融危机,1998-09-03,1998-09
农业前景依然暗淡  再次呼吁国际援助,1998-09-03,1998-09
俄第一副财长涉嫌受贿被捕,1998-09-03,1998-09
阿盟面临财政危机,1998-09-03,1998-09
泰国会下议院通过金融法规,1998-09-03,1998-09
南太拟建鲸保护区,1998-09-03,1998-09
法公司在华展示先进技术,1998-09-03,1998-09
波音撤换商用飞机集团总裁,1998-09-03,1998-09
百城市自行车赛总决赛将在长沙鸣枪,1998-09-03,1998-09
甲级足球俱乐部再次承诺公平竞争,1998-09-03,1998-09
北京举行“老车迷”杯山地车比赛,1998-09-03,1998-09
万人太极拳表演将在天安门广场举行,1998-09-03,1998-09
中国五位棋手闯过首关,1998-09-03,1998-09
印尼各界对国家足球队打假球反应强烈,1998-09-03,1998-09
中国选手获得好成绩,1998-09-03,1998-09
围棋棋圣战初段至七段组决出优胜者,1998-09-03,1998-09
李宁杯少年足球联赛决赛在即,1998-09-03,1998-09
乡镇企业：“脱农”倾向要不得,1998-09-03,1998-09
海红果树富河曲（走向大市场）,1998-09-03,1998-09
淅川依托  草编致富（走向大市场）,1998-09-03,1998-09
太和桔梗  加工增值（走向大市场）,1998-09-03,1998-09
以『特色』闯市场（编辑点评）,1998-09-03,1998-09
当好“杠杆”,1998-09-03,1998-09
酸枣变甜枣（地方经济）,1998-09-03,1998-09
扶沟城郊乡信用社全力支农（四面八方）,1998-09-03,1998-09
宝塔区加强生态农业建设（四面八方）,1998-09-03,1998-09
唐海发展节水农业（四面八方）,1998-09-03,1998-09
大巴山上有草原,1998-09-03,1998-09
以健康心态对待再就业（思想纵横）,1998-09-03,1998-09
源于实践的思考,1998-09-03,1998-09
坚定不移地推进粮食流通体制改革,1998-09-03,1998-09
关于中国教育经费问题的回顾与思考,1998-09-03,1998-09
激发创造热情,1998-09-03,1998-09
临危方始见英雄（金台随感）,1998-09-03,1998-09
把生命举过头顶（抗洪篇）,1998-09-03,1998-09
历史的回应,1998-09-03,1998-09
快雪堂（九州风物）,1998-09-03,1998-09
晨曦,1998-09-03,1998-09
老汉卖余粮,1998-09-03,1998-09
边塞传新  美育硕果,1998-09-03,1998-09
江泽民到湖南察看灾情  慰问军民指导抗洪救灾,1998-09-04,1998-09
洞庭涛涌正气歌,1998-09-04,1998-09
全总十二届六次执委会召开,1998-09-04,1998-09
切实做好灾区防病防疫工作  力争中小学秋季能及时开学,1998-09-04,1998-09
爱尔兰总理将访华,1998-09-04,1998-09
胡锦涛会见马里客人,1998-09-04,1998-09
李鹏会见罗马尼亚客人,1998-09-04,1998-09
确保增长速度  支援抗洪救灾,1998-09-04,1998-09
辩证看灾害,1998-09-04,1998-09
北京地区天气预报,1998-09-04,1998-09
再接再厉夺取抗洪斗争最后胜利,1998-09-04,1998-09
马永顺的胃口更大了,1998-09-04,1998-09
基本养老保险行业统筹移交地方管理,1998-09-04,1998-09
为了国脉畅通无阻,1998-09-04,1998-09
『九八质量月』活动开始,1998-09-04,1998-09
中华人民共和国财政部公告,1998-09-04,1998-09
建瓯注册农副产品商标３８件,1998-09-04,1998-09
工商银行新增基建项目贷款６５６亿元,1998-09-04,1998-09
昆明机场改扩建工程进展顺利,1998-09-04,1998-09
社旗农产品加工业成气候,1998-09-04,1998-09
长沙私购公房可入市交易,1998-09-04,1998-09
品牌战略（编后）,1998-09-04,1998-09
北京房地产交易展示会举办,1998-09-04,1998-09
北京将出版工商名片录,1998-09-04,1998-09
湖滨区国税局加强征税工作,1998-09-04,1998-09
栾城国地税联查效果好,1998-09-04,1998-09
洞庭涛涌正气歌,1998-09-04,1998-09
全国妇联新一届执委会产生,1998-09-04,1998-09
发挥聪明才智  立志建功成才（在中国妇女第八次全国代表大会上）,1998-09-04,1998-09
审判人员违法审判责任追究办法开始施行,1998-09-04,1998-09
民政部要求尽快重建灾民住房,1998-09-04,1998-09
常德重灾区严格救灾款物管理,1998-09-04,1998-09
各族同胞心连心  捐款捐物寄真情,1998-09-04,1998-09
金融系统在京机关职工捐献衣被,1998-09-04,1998-09
妇联第八届执委名单,1998-09-04,1998-09
命名大会在北京举行,1998-09-04,1998-09
澳门新闻界人士访问陕西,1998-09-04,1998-09
党内应该称“同志”（人民论坛）,1998-09-04,1998-09
师哲同志逝世,1998-09-04,1998-09
管好用好救灾物资,1998-09-04,1998-09
全国政协全力支持灾后重建,1998-09-04,1998-09
外交部发言人发表评论,1998-09-04,1998-09
西安多方节支支援抗洪救灾,1998-09-04,1998-09
澳门特区筹委会政务小组展开咨询活动,1998-09-04,1998-09
八方支援抗洪救灾,1998-09-04,1998-09
国家防总发布第４６号汛情通报,1998-09-04,1998-09
朝鲜驻华使馆举行电影招待会,1998-09-04,1998-09
以色列友人向湖南灾区捐款,1998-09-04,1998-09
明天气象预报,1998-09-04,1998-09
迟浩田会见美国客人,1998-09-04,1998-09
中罗国防部长举行会谈,1998-09-04,1998-09
吴邦国会见美国客人,1998-09-04,1998-09
全国人大代表团赴俄出席各国议联大会,1998-09-04,1998-09
切实做好灾区防病防疫工作  力争中小学秋季能及时开学,1998-09-04,1998-09
泽被当地  惠及京津,1998-09-04,1998-09
湖北死守『防疫大堤』,1998-09-04,1998-09
首批兽药紧急运往灾区,1998-09-04,1998-09
英雄泪,1998-09-04,1998-09
抓住高技术  培植产业群,1998-09-04,1998-09
长江大堤上的医疗救护队,1998-09-04,1998-09
洪灾为湿地保护敲响警钟,1998-09-04,1998-09
