高教面向世界的一大步（纪念改革开放二十年．难忘第一）,1998-11-01,1998-11
国务院办公厅举办科技知识讲座,1998-11-01,1998-11
毛主席纪念堂暂停对外开放,1998-11-01,1998-11
厦门：加快产业升级换代（省区市的“务实之笔”）,1998-11-01,1998-11
祖国进入“新时速”（今日谈）,1998-11-01,1998-11
北京天安门广场改建工程开工,1998-11-01,1998-11
温暖的新家（新飞杯现场短新闻）,1998-11-01,1998-11
比利时首相德阿纳抵京,1998-11-01,1998-11
崛起在黄河三角洲,1998-11-01,1998-11
南台成为大型箱包集散地,1998-11-01,1998-11
北京地区天气预报,1998-11-01,1998-11
西安黑河水利枢纽截流,1998-11-01,1998-11
内蒙古最大水泥厂投产,1998-11-01,1998-11
金正日会见韩国企业家,1998-11-01,1998-11
巴内阁通过巴以协议,1998-11-01,1998-11
旅游业成为秦皇岛三产龙头,1998-11-01,1998-11
北京经济技术开发区生机盎然,1998-11-01,1998-11
明天气象预报,1998-11-01,1998-11
全国《消费者权益保护法》知识竞赛揭晓,1998-11-01,1998-11
绍兴经济再上新台阶,1998-11-01,1998-11
公安部下调今年部分,1998-11-01,1998-11
香港必须竭尽全力建成创新科技中心,1998-11-01,1998-11
澳门特区筹委会政务小组第六次会议结束,1998-11-01,1998-11
学无止境,1998-11-01,1998-11
伊拉克宣布停止与联合国特委会合作,1998-11-01,1998-11
欧盟委员会主席桑特访问湖北,1998-11-01,1998-11
合宁高速公路发生特大恶性交通事故,1998-11-01,1998-11
美三季度增长百分之三点三,1998-11-01,1998-11
斯洛伐克新政府成立,1998-11-01,1998-11
斯海军击毙三十多名游击队员,1998-11-01,1998-11
毕加索作品拍卖结束,1998-11-01,1998-11
关注社会最底层,1998-11-01,1998-11
听无极先生谈艺（世界艺苑）,1998-11-01,1998-11
陈博士与汉字教育,1998-11-01,1998-11
泛舟底江,1998-11-01,1998-11
京城拉巴特,1998-11-01,1998-11
迪拜散记,1998-11-01,1998-11
捍卫生命之本（视点〈十五〉）,1998-11-01,1998-11
上海商品房销售明显增长（头条竞赛）,1998-11-01,1998-11
宿县站迅速行动进行整改,1998-11-01,1998-11
海南实施“百万亩椰林工程”,1998-11-01,1998-11
北国稻农打开致富路,1998-11-01,1998-11
长春一东北虎创产仔纪录,1998-11-01,1998-11
拾花女乘飞机返乡,1998-11-01,1998-11
辽阳市一刑警队长被判刑,1998-11-01,1998-11
电子一条街上的毒瘤（现场目击）,1998-11-01,1998-11
首都图书馆新馆封顶,1998-11-01,1998-11
青岛栈桥修复工程近日动工,1998-11-01,1998-11
“喜看改革开放二十年”征文启事,1998-11-02,1998-11
有了实事求是就不难,1998-11-02,1998-11
大铲海关恢复监管职能,1998-11-02,1998-11
农民当了公务员（纪念改革开放二十年·难忘第一）,1998-11-02,1998-11
大连：充实再就业工作资金,1998-11-02,1998-11
湖南：建立再就业服务中心（积极创造条件  实现两个“确保”）,1998-11-02,1998-11
贵阳：再创业带动了再就业（积极创造条件  实现两个“确保”）,1998-11-02,1998-11
湖北四年查补增值税逾１８亿元,1998-11-02,1998-11
兴化水稻大丰收,1998-11-02,1998-11
北京地区天气预报,1998-11-02,1998-11
有了实事求是就不难,1998-11-02,1998-11
信息网：闽北农民“淘金场”,1998-11-02,1998-11
早抓早主动（编后）,1998-11-02,1998-11
再就业服务中心的作用（两个“确保”政策咨询）,1998-11-02,1998-11
我国纺织业终于走出误区,1998-11-02,1998-11
下岗工人一片情,1998-11-02,1998-11
工商管理系统查处一批违法案件,1998-11-02,1998-11
大连区域性对外『小交会』成果显著,1998-11-02,1998-11
抚油一厂产品合格率连续１４年１００％,1998-11-02,1998-11
世博园园区绿化进展顺利,1998-11-02,1998-11
上海贝尔以高技术产品参与竞争,1998-11-02,1998-11
我国第一条电气化铁路抓紧复线改造,1998-11-02,1998-11
山区资源开发与保护研讨会举办,1998-11-02,1998-11
南疆铁路库阿段开始验交,1998-11-02,1998-11
依达国际货运代理公司开业,1998-11-02,1998-11
“知识经济经典汉译丛书”出版,1998-11-02,1998-11
中日两大民航计算机订座实现直联,1998-11-02,1998-11
哈铁局安全生产１６００天,1998-11-02,1998-11
村民当家作主人（加强农村基层民主法制建设）,1998-11-02,1998-11
公安部决定开展专项斗争,1998-11-02,1998-11
唐山地税局文明服务树新风,1998-11-02,1998-11
青岛推行村支书廉政述职报告制度,1998-11-02,1998-11
平煤集团党委强化干部考核监督,1998-11-02,1998-11
邹城“评差”活动擦亮“窗口”,1998-11-02,1998-11
武警天津总队实施“四个工程”,1998-11-02,1998-11
宜良公安局开门整顿,1998-11-02,1998-11
青年文明号在秦岭隧道工地誓师,1998-11-02,1998-11
牡丹江公车私用锐减,1998-11-02,1998-11
『瀛丹杯』厂（店）歌获奖作品揭晓（短波）,1998-11-02,1998-11
工行伊宁市支行争创文明窗口（短波）,1998-11-02,1998-11
空军军事法院举办法律知识竞赛（短波）,1998-11-02,1998-11
清丰县二医院为下岗职工办实事（短波）,1998-11-02,1998-11
昌平『双警』齐抓共管保平安（短波）,1998-11-02,1998-11
武警某部结合法律为官兵服务（短波）,1998-11-02,1998-11
云南党员干部结对扶贫,1998-11-02,1998-11
全会精神进山村（短新闻征文）,1998-11-02,1998-11
哈尔滨灾民安居解困新村,1998-11-02,1998-11
说心态（人民论坛）,1998-11-02,1998-11
办法总比困难多,1998-11-02,1998-11
中国先进陶瓷国际研讨会在京举行,1998-11-02,1998-11
影片《铁血大动脉》在京首映,1998-11-02,1998-11
辽宁省暨沈阳市纪念解放５０周年,1998-11-02,1998-11
禁止有偿新闻  取得阶段成果,1998-11-02,1998-11
去冬退役士兵基本安置完毕,1998-11-02,1998-11
明天气象预报,1998-11-02,1998-11
比利时首相在京参观（友好往来）,1998-11-02,1998-11
欧盟主席桑特结束访问湖北（友好往来）,1998-11-02,1998-11
澳大利亚海军舰队编队访沪（友好往来）,1998-11-02,1998-11
科学种薯富卢龙（科教兴国神州行）,1998-11-02,1998-11
专家研讨黄土高原综合治理,1998-11-02,1998-11
泗洪建成全国水产百强县,1998-11-02,1998-11
全国农科新成果交易会举行,1998-11-02,1998-11
著名作家关注非键盘文化,1998-11-02,1998-11
上海申花喜捧足协杯,1998-11-02,1998-11
刘国梁打入四强,1998-11-02,1998-11
最后胜利属于哈基宁,1998-11-02,1998-11
我队夺冠形势柳暗花明,1998-11-02,1998-11
韩国队获亚青足球赛冠军,1998-11-02,1998-11
常昊获围棋四强赛冠军,1998-11-02,1998-11
安理会要求伊拉克恢复合作,1998-11-02,1998-11
以美签署战略合作协议,1998-11-02,1998-11
东盟多事之秋（综述）,1998-11-02,1998-11
我新闻代表团结束访美,1998-11-02,1998-11
伊拉克问题又添变数（综述）,1998-11-02,1998-11
我驻摩使馆庆祝中摩建交四十年,1998-11-02,1998-11
日共举办赤旗报节,1998-11-02,1998-11
曼谷亚运场馆剪影,1998-11-02,1998-11
智拒绝西高法皮诺切特案裁决,1998-11-02,1998-11
斯塔尔涉嫌泄密  调查者反被调查,1998-11-02,1998-11
伊朗在伊阿边境举行军事演习,1998-11-02,1998-11
现代集团同朝达成合作协议,1998-11-02,1998-11
德里洋葱与邦议会选举（通讯）,1998-11-02,1998-11
建立全球防灾减灾卫星系统（院士园地）,1998-11-02,1998-11
亚洲经济复苏路途漫漫,1998-11-02,1998-11
小型无人驾驶直升机研制成功（世界科技）,1998-11-02,1998-11
新炉具烤鸡只需四分钟（世界科技）,1998-11-02,1998-11
成人脑细胞能再生（世界科技）,1998-11-02,1998-11
易拆无痛绷带面世（世界科技）,1998-11-02,1998-11
井盖问题（经济茶座）,1998-11-02,1998-11
遏止非法盗采,1998-11-02,1998-11
３０年不变：长效“定心丸”（经济大势）,1998-11-02,1998-11
制止低价倾销要依法（观点）,1998-11-02,1998-11
警惕“菜篮子”里的毒菜（提醒）,1998-11-02,1998-11
低价倾销将受处罚,1998-11-02,1998-11
不法分子疯狂偷捕  银鱼生产岌岌可危（地方经济新闻集锦）,1998-11-02,1998-11
“电脑通”窃取情报  好又多”损失惨重（地方经济新闻集锦）,1998-11-02,1998-11
果实累累收获季  华县农户忙拔树（地方经济新闻集锦）,1998-11-02,1998-11
盯住漏征漏管（热点聚焦）,1998-11-02,1998-11
力保工商税收增收一千亿元,1998-11-02,1998-11
豪夫曼，缴完税你再走,1998-11-02,1998-11
年龄最小的纳税人,1998-11-02,1998-11
邢台国税堵漏增收,1998-11-02,1998-11
个人所得税已收入２４１亿元,1998-11-02,1998-11
江苏省国税系统７个月清理欠税７亿元（财金短波）,1998-11-02,1998-11
哈尔滨国税清欠４９２６万元（财金短波）,1998-11-02,1998-11
浙江省以清欠促收入成效明显（财金短波）,1998-11-02,1998-11
江苏省地税清理入库欠税５．０７亿元（财金短波）,1998-11-02,1998-11
河南省国税清缴两税９亿元（财金短波）,1998-11-02,1998-11
云南省国税清欠入库七亿元（财金短波）,1998-11-02,1998-11
沪市上周上涨前五名（％）,1998-11-02,1998-11
上周股市概览,1998-11-02,1998-11
沪市上周下跌前五名（％）,1998-11-02,1998-11
深市上周上涨前五名（％）,1998-11-02,1998-11
深市上周下跌前五名（％）,1998-11-02,1998-11
深证成份指数日K线图,1998-11-02,1998-11
上证综合指数日K线图,1998-11-02,1998-11
小领带带出大市场,1998-11-02,1998-11
私人电话为何“装多用少”,1998-11-02,1998-11
假作真时真无奈？（各抒己见）,1998-11-02,1998-11
营造都市“桃花源”,1998-11-02,1998-11
光大通信天地，服务得天下,1998-11-02,1998-11
列车上有了“擦鞋匠”,1998-11-02,1998-11
让电脑听懂中国话,1998-11-02,1998-11
如何吃上“放心粮”（红黑榜）,1998-11-02,1998-11
郑州，崛起大型客车生产基地,1998-11-02,1998-11
新一代低盐高品质涪陵榨菜面市,1998-11-02,1998-11
诺基亚推出大容量ＧＳＭ系统,1998-11-02,1998-11
“再生胶囊”纯中药制剂研制成功,1998-11-02,1998-11
甘肃：大力推行节水灌溉（省区市的“务实之笔”）,1998-11-03,1998-11
中汤发表联合公报,1998-11-03,1998-11
中汤建立大使级外交关系,1998-11-03,1998-11
祝贺中汤建交（社论）,1998-11-03,1998-11
江主席会见乌卢卡拉拉王子,1998-11-03,1998-11
李鹏会见德阿纳,1998-11-03,1998-11
朱镕基总理与德阿纳首相会谈,1998-11-03,1998-11
李岚清会见美国客人,1998-11-03,1998-11
铁路建设再创纪录,1998-11-03,1998-11
山东公路建设再掀高潮,1998-11-03,1998-11
天津加快市政公路建设,1998-11-03,1998-11
北京地区天气预报,1998-11-03,1998-11
中国石化集团公司整体实现扭亏为盈,1998-11-03,1998-11
夜巡伶仃洋（打击走私沿海行）,1998-11-03,1998-11
成绩来之不易  增长有望实现,1998-11-03,1998-11
“胜利”的飞跃,1998-11-03,1998-11
建行持香港建新银行股份增至７０％,1998-11-03,1998-11
“金华”等三大涉税要案将公开曝光,1998-11-03,1998-11
下岗职工进再就业服务中心须具备什么条件（两个“确保”政策咨询）,1998-11-03,1998-11
海关系统从严治“官”,1998-11-03,1998-11
绥芬河海关缉毒效果显著,1998-11-03,1998-11
罗甸县送干部到沿海打工,1998-11-03,1998-11
华夏银行加快业务创新步伐,1998-11-03,1998-11
西樵服装面料设计领潮流,1998-11-03,1998-11
农业跨世纪发展战略研讨会举行,1998-11-03,1998-11
天津海关严打造假骗套汇,1998-11-03,1998-11
中澳合资建澳中友好村,1998-11-03,1998-11
湖南永兴举办经贸洽谈会,1998-11-03,1998-11
石家庄站实现安全生产一千天,1998-11-03,1998-11
兵役制度改革势在必行（在九届全国人大党委会第五次会议上）,1998-11-03,1998-11
应严惩涉汇犯罪（在九届全国人大党委会第五次会议上）,1998-11-03,1998-11
分歧渐趋统一  法律呼之欲出（在九届全国人大党委会第五次会议上）,1998-11-03,1998-11
肥城倡节俭刹奢风,1998-11-03,1998-11
菏泽提高村级干部整体素质,1998-11-03,1998-11
信阳市法院自觉接受人大监督,1998-11-03,1998-11
吉林省工商局推行执法公示制,1998-11-03,1998-11
总参努力造就跨世纪人才方阵,1998-11-03,1998-11
辽宁朝阳电业局扎实推进行风建设,1998-11-03,1998-11
警惕高楼建起干部倒下（漫话）,1998-11-03,1998-11
对逃税问题的几点思考（社会观察）,1998-11-03,1998-11
情洒广西脱贫路,1998-11-03,1998-11
今冬征兵工作全面展开,1998-11-03,1998-11
钱其琛会见汤加王子一行,1998-11-03,1998-11
西班牙第二副首相将访华（友好往来）,1998-11-03,1998-11
黑龙江：建立责任制加强监督检查（确保人民日报发行稳中有升）,1998-11-03,1998-11
上海：完善集订分送  确保稳中有升（确保人民日报发行稳中有升）,1998-11-03,1998-11
河南：采取多种措施  加快收订进度（确保人民日报发行稳中有升）,1998-11-03,1998-11
《东史郎诉讼案与南京大屠杀真相》备受关注,1998-11-03,1998-11
中国将继续深化金融体制改革,1998-11-03,1998-11
山西发现汉白玉石林（东西南北中）,1998-11-03,1998-11
踊跃应征,1998-11-03,1998-11
明天气象预报,1998-11-03,1998-11
黄山降价促冬游（东西南北中）,1998-11-03,1998-11
重庆城口贫困人口告别岩洞（东西南北中）,1998-11-03,1998-11
济南第一老年公寓正式启用（东西南北中）,1998-11-03,1998-11
盛华仁拜会比利时首相（友好往来）,1998-11-03,1998-11
欧盟主席桑特离沪赴港（友好往来）,1998-11-03,1998-11
中国派团参加最高审计机关国际组织大会（友好往来）,1998-11-03,1998-11
建生态农业  管面源污染,1998-11-03,1998-11
秦皇岛市第一医院医风正,1998-11-03,1998-11
教育部推出首批辅助教学软件,1998-11-03,1998-11
博士·博士生及其他,1998-11-03,1998-11
两部大型法律工具书出版,1998-11-03,1998-11
我国参与人数逾八千万,1998-11-03,1998-11
专家座谈《走出混沌》,1998-11-03,1998-11
安子介国际贸易研究奖颁发,1998-11-03,1998-11
『金友工程』丛书出版,1998-11-03,1998-11
治污有成效  达标任务重,1998-11-03,1998-11
以总理呼吁各界接受和平协议  巴勒斯坦召开修改宪章筹备会,1998-11-03,1998-11
美宣称将采取措施对付伊拉克  伊强调停止合作不针对联合国,1998-11-03,1998-11
布莱尔建议试析（国际论坛）,1998-11-03,1998-11
南太平洋岛国（资料）,1998-11-03,1998-11
俄通过稳定社会—经济纲领,1998-11-03,1998-11
埃叙总统举行会谈,1998-11-03,1998-11
马前副总理公开受审,1998-11-03,1998-11
英德重建政治关系时机成熟,1998-11-03,1998-11
几比冲突双方签署和约,1998-11-03,1998-11
追忆往昔  憧憬明天（通讯）,1998-11-03,1998-11
探访避难所（连载）,1998-11-03,1998-11
汽车多了以后（大千絮语）,1998-11-03,1998-11
印度经济振兴任务艰巨,1998-11-03,1998-11
华尔街股市走出阴影,1998-11-03,1998-11
环保不应成为借口  贸易须防保护主义,1998-11-03,1998-11
印公布抑制物价措施,1998-11-03,1998-11
体长半毫米  生命最顽强,1998-11-03,1998-11
德国洪水泛滥  损失巨大,1998-11-03,1998-11
中美洲飓风横行  死伤惨重,1998-11-03,1998-11
泰国紧锣密鼓迎亚运,1998-11-03,1998-11
战胜“三虎”  力夺三金,1998-11-03,1998-11
世界女排锦标赛今日开战,1998-11-03,1998-11
马晓春闯入三星杯围棋赛决赛,1998-11-03,1998-11
中国队夺得男团桂冠,1998-11-03,1998-11
王涛失利  王楠告捷,1998-11-03,1998-11
特技飞行大奖赛落幕长沙,1998-11-03,1998-11
北体大庆建校四十五周年,1998-11-03,1998-11
老将王涛不服『老』,1998-11-03,1998-11
国际武联向国际奥委会递交申请,1998-11-03,1998-11
城市公交的奇迹（地方热线）,1998-11-03,1998-11
不等汛期搏洪水  矢志长年固圩堤,1998-11-03,1998-11
赈灾要多做实事（采访随想）,1998-11-03,1998-11
当一名『踏实官』（公仆谈心录）,1998-11-03,1998-11
追求与超越,1998-11-03,1998-11
秦岭秋深丰碑在,1998-11-03,1998-11
西安  汉唐文化游吸引四方客,1998-11-03,1998-11
兴国农家用上太阳能,1998-11-03,1998-11
正确认识农民家庭经营（学习贯彻十五届三中全会精神）,1998-11-03,1998-11
依靠科教发展交通,1998-11-03,1998-11
靡不有初  鲜克有终（思想纵横）,1998-11-03,1998-11
学习出版社  出版学习邓小平理论图书有成果（理论武装工作园地）,1998-11-03,1998-11
借得春风绿黄沙,1998-11-03,1998-11
童心的呼唤,1998-11-03,1998-11
行医先做人,1998-11-03,1998-11
心系众乡亲,1998-11-03,1998-11
血病四大难症（健康城）,1998-11-03,1998-11
海水淡化要加快,1998-11-03,1998-11
“矾都”治污仍须努力,1998-11-03,1998-11
依法解洪忧（民主法制述评）,1998-11-03,1998-11
认捐不兑现怎么办（来信）,1998-11-03,1998-11
莫待『老天』来执法（法治论苑）,1998-11-03,1998-11
摩托车“黑市”目击记（监督广角）,1998-11-03,1998-11
放宽收养条件（立法聚焦）,1998-11-03,1998-11
乱村变富乡（民主建设巡礼）,1998-11-03,1998-11
公路执法『根据地』（法在生活中）,1998-11-03,1998-11
为民办实事  群众唱主角,1998-11-04,1998-11
学文登  创文明,1998-11-04,1998-11
杨拯民遗体送别仪式在京举行,1998-11-04,1998-11
江主席将出席亚太经合组织领导人非正式会议,1998-11-04,1998-11
江主席会见德阿纳首相,1998-11-04,1998-11
人大常委会第五次会议举行全会,1998-11-04,1998-11
李鹏分别会见秘鲁荷兰客人,1998-11-04,1998-11
贾志杰当选为湖北省委书记,1998-11-04,1998-11
姐姐笑了（喜看改革开放二十年）,1998-11-04,1998-11
旅途短了（喜看改革开放二十年）,1998-11-04,1998-11
北京地区天气预报,1998-11-04,1998-11
天津农业：创名牌  占市场  增效益,1998-11-04,1998-11
邯钢又一兼并企业扭转亏损,1998-11-04,1998-11
邯钢经验要真学（编后）,1998-11-04,1998-11
丝绸古道牵“铁龙”（加快铁路建设  拉动经济增长）,1998-11-04,1998-11
中国国际平衡施肥项目增产显著,1998-11-04,1998-11
打私尖兵护国门（打击走私沿海行）,1998-11-04,1998-11
农资建材开展专项“打假”（新闻快报）,1998-11-04,1998-11
确保养老金发放具体目标,1998-11-04,1998-11
移动通信建设优选国产设备,1998-11-04,1998-11
下岗职工基本生活费为何逐年递减（两个“确保”政策咨询）,1998-11-04,1998-11
长虹彩电产销逾三千万台,1998-11-04,1998-11
前三季度来华旅游者增长１１％（新闻快报）,1998-11-04,1998-11
海南政府采购实施公开招标（新闻快报）,1998-11-04,1998-11
为民办实事  群众唱主角,1998-11-04,1998-11
社会治安喜中有忧（在九届全国人大常委会第五次会议上）,1998-11-04,1998-11
专门委员会汇报议案审议结果（在九届全国人大常委会第五次会议上）,1998-11-04,1998-11
依法治农  依法兴农（在九届全国人大常委会第五次会议上）,1998-11-04,1998-11
人大代表团汇报出席各国议会联盟第一百届大会情况（在九届全国人大常委会第五次会议上）,1998-11-04,1998-11
中国青企协召开第七次会员代表大会,1998-11-04,1998-11
社会团体登记管理条例,1998-11-04,1998-11
武警海南总队培育军地两用人才,1998-11-04,1998-11
壶关开展文明活动出现四大变化,1998-11-04,1998-11
西峡法院重视人大代表批评建议,1998-11-04,1998-11
李鹏分别会见秘鲁荷兰客人,1998-11-04,1998-11
本报５０年索引光盘等获数据库评比一等奖,1998-11-04,1998-11
“抗洪钢铁战士”吴良珠去世,1998-11-04,1998-11
澳门特区筹委会法律小组六次会议举行,1998-11-04,1998-11
外交部发言人发表评论,1998-11-04,1998-11
《太空英雄格陵》一书出版,1998-11-04,1998-11
本报华东地区宣传发行座谈会举行,1998-11-04,1998-11
王选  面向新世纪的追求,1998-11-04,1998-11
王兆国会见香港玩具厂商会访问团,1998-11-04,1998-11
三峡库区迁建企业培植知名品牌,1998-11-04,1998-11
举一反三说生态（人民论坛）,1998-11-04,1998-11
欢笑的漠阳江（现场短新闻）,1998-11-04,1998-11
金华佛手飘香（现场短新闻）,1998-11-04,1998-11
刘少奇光辉业绩展览在渝开幕,1998-11-04,1998-11
迟浩田会见秘鲁国防部长,1998-11-04,1998-11
欧盟主席桑特访问澳门香港,1998-11-04,1998-11
比利时画家培梅克作品在京预展,1998-11-04,1998-11
明天气象预报,1998-11-04,1998-11
福州鳌峰垃圾场变公园,1998-11-04,1998-11
心中有群众  治理讲科学（编余短论）,1998-11-04,1998-11
建设绿色环保港口（科教兴国神州行）,1998-11-04,1998-11
中国工程物理院年届“不惑”,1998-11-04,1998-11
婴儿潜能开发跟踪行动启动,1998-11-04,1998-11
我成果转化法律制度日益完善,1998-11-04,1998-11
’９８金秋全国青少年书画赛开幕,1998-11-04,1998-11
《新领导力全书》出版,1998-11-04,1998-11
《不列颠百科全书》中文版问世,1998-11-04,1998-11
治理白色垃圾有新技术,1998-11-04,1998-11
新税务软件亮相,1998-11-04,1998-11
中国队首战胜泰国队,1998-11-04,1998-11
激战即将来临,1998-11-04,1998-11
乒坛女将角逐世界杯,1998-11-04,1998-11
全国业余围棋大奖赛决出各项冠军,1998-11-04,1998-11
国际越野挑战赛将在大理开赛,1998-11-04,1998-11
桑兰将进行针灸治疗,1998-11-04,1998-11
国际标准舞大赛首次进行荷花奖评选,1998-11-04,1998-11
武警北京二总队重视群众体育,1998-11-04,1998-11
汤加隆重庆祝汤中建交,1998-11-04,1998-11
伊希望外交解决危机  美讨论对伊采取措施,1998-11-04,1998-11
巴同意以推迟执行临时协议,1998-11-04,1998-11
李铁映希望中美加强学术交流,1998-11-04,1998-11
中朝俄签订图们江国界水域分界线协定,1998-11-04,1998-11
巴黎竖起华工纪念碑,1998-11-04,1998-11
德英首脑主张两国密切合作,1998-11-04,1998-11
哥游击队重开战火,1998-11-04,1998-11
秘捕获反政府游击队首领,1998-11-04,1998-11
哈美签署合作文件,1998-11-04,1998-11
一女战犯被引渡到克,1998-11-04,1998-11
法一军官涉嫌向塞供情报,1998-11-04,1998-11
切尔诺贝利考察纪实,1998-11-04,1998-11
巴西  大刀阔斧整顿经济（综述）,1998-11-04,1998-11
联合国气候大会开幕,1998-11-04,1998-11
投资大众情绪趋稳  美欧股市持续走高,1998-11-04,1998-11
电信业前景无限（专访）,1998-11-04,1998-11
“老虎”虎威减  外汇投机亏,1998-11-04,1998-11
世界天然气需求将强劲增长,1998-11-04,1998-11
马来西亚资金大幅回流,1998-11-04,1998-11
罗马尼亚工业生产下降,1998-11-04,1998-11
西非经济共同体举行首脑会议,1998-11-04,1998-11
守住精神家园（一家之言）,1998-11-04,1998-11
正确对待和支持舆论监督（特别报道）,1998-11-04,1998-11
“第一恐龙”和它们的保护人（社会聚焦）,1998-11-04,1998-11
明天会更好（神州一隅）,1998-11-04,1998-11
农民不爱听这样的话（说长道短）,1998-11-04,1998-11
『明白墙』与『糊涂账』（说长道短）,1998-11-04,1998-11
冀州掀起扶助贫困生热潮,1998-11-04,1998-11
铁法十名干部被降免诫勉,1998-11-04,1998-11
宜宾异地公开选拔村干部,1998-11-04,1998-11
粮食储运中的问题不容忽视（观察台）,1998-11-04,1998-11
加大执法力度  打击金融犯罪（来信综述）,1998-11-04,1998-11
全面理解『人大监督』（读者论坛）,1998-11-04,1998-11
阿里河林业局森林资源遭破坏（毖后录）,1998-11-04,1998-11
《人民日报》帮了我的忙（心里话）,1998-11-04,1998-11
面目全非  美中不足（耳闻目睹）,1998-11-04,1998-11
这家营业厅欺骗消费者（监督哨）,1998-11-04,1998-11
新沂市推行干部用管链式机制（经验交流）,1998-11-04,1998-11
昌吉糖厂岂能单方修改合同,1998-11-04,1998-11
农村应建商品检测站（来信点滴）,1998-11-04,1998-11
取汇款不该搭售报纸（来信点滴）,1998-11-04,1998-11
一件小事见精神（表扬）,1998-11-04,1998-11
无偿献血  奉献爱心（身边的话题）,1998-11-04,1998-11
爱在心中（普通人的故事）,1998-11-04,1998-11
农村也需拴心留人（实话实说）,1998-11-04,1998-11
献血无损健康（知识窗）,1998-11-04,1998-11
不得擅自邮寄印刷品广告（事中有法）,1998-11-04,1998-11
六十六年再聚首（世相百态）,1998-11-04,1998-11
为家中财产寻求一份保障（请您留意）,1998-11-04,1998-11
装电话不得强令用户购买电话机（事中有法）,1998-11-04,1998-11
多念着别人的好（人生一得）,1998-11-04,1998-11
载入中国农业机械化史册的贡献,1998-11-04,1998-11
献给一个世纪的怀念,1998-11-04,1998-11
注释赵朴老《项南同志哀辞》,1998-11-04,1998-11
项南同志哀辞,1998-11-04,1998-11
人大常委会第五次会议闭幕,1998-11-05,1998-11
金华特大税案被查处,1998-11-05,1998-11
严厉打击涉税违法犯罪活动,1998-11-05,1998-11
安徽推出强农富民新举措,1998-11-05,1998-11
中组部派出第三批检查组,1998-11-05,1998-11
李岚清会见越南体育代表团,1998-11-05,1998-11
全国人大常委会决定任免的名单,1998-11-05,1998-11
中华人民共和国主席令,1998-11-05,1998-11
续写文明新篇章,1998-11-05,1998-11
透过新词看变化（喜看改革开放二十年）,1998-11-05,1998-11
