纽约国际饭店与餐馆展览会举行,1998-11-19,1998-11
三降利率为哪般,1998-11-19,1998-11
美国专家认为亚洲经济出现复苏迹象,1998-11-19,1998-11
赢球最终要靠实力,1998-11-19,1998-11
爱立信乒乓球擂台赛  阎森杨影获决赛权,1998-11-19,1998-11
首届健康麻将邀请赛将举办,1998-11-19,1998-11
步子再大一些,1998-11-19,1998-11
明年世乒赛中国企业冠名,1998-11-19,1998-11
圆了半个世纪的梦,1998-11-19,1998-11
亚运会好新闻评选活动将举行  中国体育信息网开通亚运网站,1998-11-19,1998-11
中国男排负于南斯拉夫队,1998-11-19,1998-11
『进一退二还三』,1998-11-19,1998-11
盐碱滩上的绿色希望（地方经济）,1998-11-19,1998-11
又闻小站稻花香,1998-11-19,1998-11
让农民的钱袋子活起来（农村杂谈）,1998-11-19,1998-11
武安改造“空心村”（四面八方）,1998-11-19,1998-11
渠县投放小蛇１０万（四面八方）,1998-11-19,1998-11
牧民种草销国外（四面八方）,1998-11-19,1998-11
铁囤储粮好处多,1998-11-19,1998-11
“农资合作社”（农村新事）,1998-11-19,1998-11
适应需求变化  加强营销工作,1998-11-19,1998-11
用政治眼光看经济（思想纵横）,1998-11-19,1998-11
积极推进粮食流通体制改革（学习贯彻十五届三中全会精神）,1998-11-19,1998-11
国有企业兼并应注意的几个问题,1998-11-19,1998-11
电视：家庭的“主角”④（电视与我们）,1998-11-19,1998-11
最后的蔷薇,1998-11-19,1998-11
魅力来自个性,1998-11-19,1998-11
燕园剧社：托起青春的梦幻,1998-11-19,1998-11
《中国音像》：步入改版新天地,1998-11-19,1998-11
直面高技术战争的挑战,1998-11-19,1998-11
笔挽风雷现虎威,1998-11-19,1998-11
找回蓝天,1998-11-19,1998-11
古树·老人·龙湖,1998-11-19,1998-11
浦东的那扇西窗,1998-11-19,1998-11
重返集宁（我的家园）,1998-11-19,1998-11
家乡的白鹭,1998-11-19,1998-11
大山中的小镇,1998-11-19,1998-11
蓝天下的沧桑（摄影）,1998-11-19,1998-11
全面理解和贯彻十五大精神  正确把握国有企业改革方向,1998-11-20,1998-11
学习榜样  弘扬正气,1998-11-20,1998-11
江泽民主席回到北京,1998-11-20,1998-11
满怀信心  迎接挑战（社论）,1998-11-20,1998-11
李瑞环观看刘少奇百年诞辰纪念展,1998-11-20,1998-11
刘少奇生平和思想研讨会举行,1998-11-20,1998-11
李鹏在深圳作立法调研,1998-11-20,1998-11
朱镕基与克雷蒂安会谈,1998-11-20,1998-11
北京地区天气预报,1998-11-20,1998-11
全面理解和贯彻十五大精神  正确把握国有企业改革方向,1998-11-20,1998-11
李鹏在深圳作立法调研,1998-11-20,1998-11
金融，打破行政干预,1998-11-20,1998-11
冬季农田水利建设高潮渐起,1998-11-20,1998-11
生猪私屠滥宰清理整顿将全面展开,1998-11-20,1998-11
出口退税不是补贴更非人民币变相贬值,1998-11-20,1998-11
第三届中国杰出青年农民评选揭晓,1998-11-20,1998-11
我国将严惩不法粮商,1998-11-20,1998-11
乡镇企业科技进步成绩显著,1998-11-20,1998-11
刘少奇生平和思想研讨会举行,1998-11-20,1998-11
深圳南岭村致富不忘育人（文明村镇创建活动巡礼⑨）,1998-11-20,1998-11
增强学理论自觉性紧迫感,1998-11-20,1998-11
公开审判制度有利于司法公正,1998-11-20,1998-11
福清公安联系实际边整边改,1998-11-20,1998-11
青岛推进干部选拔制度改革,1998-11-20,1998-11
兰州军区总医院医术与服务同步提高,1998-11-20,1998-11
全军涌现“红旗车驾驶员”近百万人次,1998-11-20,1998-11
乐亭推进厂务公开民主监督,1998-11-20,1998-11
云南成立新闻舆论监督中心（短波）,1998-11-20,1998-11
北京亚运村交警争当『好公仆』（短波）,1998-11-20,1998-11
青龙县对口征兵定向育才（短波）,1998-11-20,1998-11
太原强化建设项目执法监察（短波）,1998-11-20,1998-11
金湖县连续三十六年无政治退兵（短波）,1998-11-20,1998-11
武警某部计生实行『三结合』（短波）,1998-11-20,1998-11
满怀信心  迎接挑战（社论）,1998-11-20,1998-11
朱镕基与克雷蒂安会谈,1998-11-20,1998-11
外交部发言人发表评论,1998-11-20,1998-11
“《财富》全球论坛”明年秋天在沪举行,1998-11-20,1998-11
号召全军掀起科技大练兵热潮,1998-11-20,1998-11
云南宁蒗发生６．２级地震,1998-11-20,1998-11
刘少奇百年诞辰纪念币发行２０００万套,1998-11-20,1998-11
日本政府向我国灾区提供援助,1998-11-20,1998-11
军队武警政法机关与经营企业彻底脱钩,1998-11-20,1998-11
洗衣不用去河边（喜看改革开放二十年）,1998-11-20,1998-11
尉健行会见古巴客人,1998-11-20,1998-11
加中贸易理事会举行第２０届年会,1998-11-20,1998-11
未来一周天气趋势,1998-11-20,1998-11
明天气象预报,1998-11-20,1998-11
何鲁丽分别会见乌干达和南非客人,1998-11-20,1998-11
王兆国会见香港客人,1998-11-20,1998-11
知识就是力量,1998-11-20,1998-11
边疆穷县重教情（科教兴国神州行）,1998-11-20,1998-11
环境恶化危害人类健康,1998-11-20,1998-11
真情的回报,1998-11-20,1998-11
吴川渴盼治『污川』（中华环保世纪行）,1998-11-20,1998-11
流域治污靠合力（编余短论）,1998-11-20,1998-11
我国吸烟危害不容低估,1998-11-20,1998-11
红楼梦文化学术研讨会召开,1998-11-20,1998-11
乐亿阳公司清剿ＣＩＨ病毒（教科文短波）,1998-11-20,1998-11
全国首家学联网站开通（教科文短波）,1998-11-20,1998-11
联想推出全线调制解调器（教科文短波）,1998-11-20,1998-11
电教片《你拍我拍他拍》研讨会举行,1998-11-20,1998-11
北京举办首届民间艺术大展赛,1998-11-20,1998-11
农业部饲料工业中心建成中试车间（教科文短波）,1998-11-20,1998-11
《徐放论》出版,1998-11-20,1998-11
满怀信心  迎接挑战,1998-11-20,1998-11
德法关系的微妙走向（国际论坛）,1998-11-20,1998-11
日本举国欢迎江主席来访,1998-11-20,1998-11
纳米比亚总统会见迟浩田,1998-11-20,1998-11
克林顿亚洲“经济之旅”（新闻分析）,1998-11-20,1998-11
自民自由两党达成协议  明年初前建立联合政权,1998-11-20,1998-11
美众院司法委开始对总统弹劾听证,1998-11-20,1998-11
以色列即日开始从西岸撤军  巴以下周举行最后阶段谈判,1998-11-20,1998-11
韩经济呈现好转迹象（综述）,1998-11-20,1998-11
美国采取措施稳定经济,1998-11-20,1998-11
加再次降息刺激经济,1998-11-20,1998-11
巴格达儿童生存难,1998-11-20,1998-11
吸烟死者半数在穷国  专家呼吁禁烟防杀手,1998-11-20,1998-11
三成居民自愿捐器官  一片爱心死后留人间,1998-11-20,1998-11
米老鼠七十寿辰,1998-11-20,1998-11
从数字看生态危机（科技漫话）,1998-11-20,1998-11
恐龙卵化石首次发现  胚胎有牙齿三十二颗,1998-11-20,1998-11
日贸易盈余持续增加,1998-11-20,1998-11
德明年经济不容乐观,1998-11-20,1998-11
波兰通胀率下降,1998-11-20,1998-11
中远（澳洲）公司获奖,1998-11-20,1998-11
美专家艾克文获殊荣,1998-11-20,1998-11
《英汉保险词典》出版,1998-11-20,1998-11
晓春小光争冠难解难分,1998-11-20,1998-11
中国男排不敌俄罗斯队,1998-11-20,1998-11
经贸委举行老干部象棋赛,1998-11-20,1998-11
吃一堑  长一智,1998-11-20,1998-11
世界冠军和大学生谈为国奉献,1998-11-20,1998-11
１０名基层体育工作者将赴泰观摩亚运会,1998-11-20,1998-11
全国大学生体育合格标准将作新的修订,1998-11-20,1998-11
万国邮联大会将办汽车远征活动,1998-11-20,1998-11
自行车运动员不幸遇难  中保人寿公司依约理赔,1998-11-20,1998-11
『黑哨』误事（编后）,1998-11-20,1998-11
艺术面临数字化,1998-11-20,1998-11
保护徽学,1998-11-20,1998-11
仿声和骂声（文化随笔）,1998-11-20,1998-11
达里奥·福名作惊动剧坛,1998-11-20,1998-11
瘦西湖和莱芒湖（邮苑）,1998-11-20,1998-11
振兴相声艺术,1998-11-20,1998-11
风采———指挥家汤沐海,1998-11-20,1998-11
萨格勒布四重奏小组来华,1998-11-20,1998-11
二十部作品获北京文艺奖,1998-11-20,1998-11
十二月邮品显示纪念性,1998-11-20,1998-11
上海当代诗会盛况喜人,1998-11-20,1998-11
马泰录制唱段ＶＣＤ,1998-11-20,1998-11
含泪看《人子》,1998-11-20,1998-11
电影创作的新风貌,1998-11-20,1998-11
亚洲歌舞话祝福,1998-11-20,1998-11
《圆梦》笑迎世博会,1998-11-20,1998-11
『罗密欧与朱丽叶』,1998-11-20,1998-11
《大潮》：村级剧团演村里事,1998-11-20,1998-11
抗洪精神颂（佳作赏析１５）,1998-11-20,1998-11
中国音乐剧  前景如何,1998-11-20,1998-11
《日本侵华纪实》开始摄制,1998-11-20,1998-11
校园剧《生命的歌》受到学生欢迎,1998-11-20,1998-11
夫妻自演《夫妻没话》,1998-11-20,1998-11
《享受艰难》赴京演出,1998-11-20,1998-11
《畲山风》在京公演,1998-11-20,1998-11
文学期刊最新小说月报有,1998-11-20,1998-11
文学期刊的发展之路,1998-11-20,1998-11
深切的厚望（金台文论）,1998-11-20,1998-11
文摘卡（文艺信息）,1998-11-20,1998-11
北京大学出版社推出《文艺学当代形态论》（文艺信息）,1998-11-20,1998-11
《青年文学》明年扩版（文艺信息）,1998-11-20,1998-11
冉庄诗歌研讨会在京举行（文艺信息）,1998-11-20,1998-11
《书评周刊》：站在读者的立场（文艺信息）,1998-11-20,1998-11
『鲁迅文学奖报告文学获奖者丛书』出版（文艺信息）,1998-11-20,1998-11
长篇历史小说创作研讨会召开（文艺信息）,1998-11-20,1998-11
杨好月散文集《矮檐下的红灯笼》座谈会召开（文艺信息）,1998-11-20,1998-11
『北京之秋』现代诗歌朗诵会举行（文艺信息）,1998-11-20,1998-11
为了修复少奇故居（记忆追寻）,1998-11-20,1998-11
超万劫以自蜕，丽一徽而独涓（水仙花赋句）,1998-11-20,1998-11
百年犹存人间（品书札记）,1998-11-20,1998-11
苦楝赋,1998-11-20,1998-11
故乡是一首民谣（我的家园）,1998-11-20,1998-11
你坚信……,1998-11-20,1998-11
刘少奇同志诞辰一百周年纪念大会在京隆重举行,1998-11-21,1998-11
在刘少奇同志诞辰一百周年纪念大会上的讲话,1998-11-21,1998-11
北京地区天气预报,1998-11-21,1998-11
江泽民会见克雷蒂安,1998-11-21,1998-11
李鹏会见克雷蒂安,1998-11-21,1998-11
希望中葡在澳门过渡期最后阶段保持良好合作,1998-11-21,1998-11
李鹏会见加拿大客人,1998-11-21,1998-11
明天气象预报,1998-11-21,1998-11
朱镕基出席加中贸易理事会年会晚宴,1998-11-21,1998-11
胡锦涛会见“中国杰出青年农民”称号获得者,1998-11-21,1998-11
今年经济增长可基本实现预定目标,1998-11-21,1998-11
确保赈灾专项募集任务完成,1998-11-21,1998-11
纪念十一届三中全会召开二十周年,1998-11-21,1998-11
中直机关首届文化艺术节落幕,1998-11-21,1998-11
上海市档案馆向社会介绍有关刘少奇活动的档案史料,1998-11-21,1998-11
距中国’９９昆明世界园艺博览会开幕还有１６１天,1998-11-21,1998-11
吴邦国出席朝驻华大使宴会,1998-11-21,1998-11
吴仪会见罗马尼亚工商部长,1998-11-21,1998-11
布赫会见朝鲜新闻代表团,1998-11-21,1998-11
唐家璇会见马达加斯加客人,1998-11-21,1998-11
中罗经贸混委会会议在京举行,1998-11-21,1998-11
中加合作向纵深发展,1998-11-21,1998-11
以色列开始从西岸撤军,1998-11-21,1998-11
日美首脑举行会谈,1998-11-21,1998-11
俄总理谈政府工作,1998-11-21,1998-11
意学者认为我改革成就伟大,1998-11-21,1998-11
纳米比亚总理会见迟浩田,1998-11-21,1998-11
日本政要会见中国新闻代表团,1998-11-21,1998-11
刚果（金）大选如期举行,1998-11-21,1998-11
意土关系呈现紧张,1998-11-21,1998-11
世界经济增速放慢,1998-11-21,1998-11
国际空间站第一组件升空,1998-11-21,1998-11
沙漠农业创奇迹（出访归来）,1998-11-21,1998-11
国际战略学会研讨中日关系,1998-11-21,1998-11
日防卫厅长官辞职,1998-11-21,1998-11
伊重申同联合国全面合作,1998-11-21,1998-11
刘少奇同志诞辰一百周年纪念大会在京隆重举行,1998-11-21,1998-11
在刘少奇同志诞辰一百周年纪念大会上的讲话,1998-11-21,1998-11
九运会筹委会在广州成立,1998-11-21,1998-11
马晓春实现“十连冠”,1998-11-21,1998-11
波尔加与谢军之战可能推迟,1998-11-21,1998-11
西方经济增长理论述评（研究动态）,1998-11-21,1998-11
’９８洪灾的法学思考（热点研究）,1998-11-21,1998-11
９０年代“学术史热”的人文意义（报刊文摘）,1998-11-21,1998-11
梁启超的学术贡献（报刊文摘）,1998-11-21,1998-11
《中国预防犯罪通鉴》（报刊文摘）,1998-11-21,1998-11
《２０年经济改革：回顾与展望》,1998-11-21,1998-11
刊头摄影,1998-11-21,1998-11
故乡的诗篇,1998-11-21,1998-11
无锡芭蕉树（二十年间）,1998-11-21,1998-11
烟囱和石头,1998-11-21,1998-11
大海雕像,1998-11-21,1998-11
重绘家乡的蓝天,1998-11-21,1998-11
哨棚：黎明静悄悄,1998-11-21,1998-11
与君同舟  风雨无悔（纪念刘少奇同志诞辰一百周年）,1998-11-21,1998-11
走进厦门,1998-11-21,1998-11
开栏的话,1998-11-22,1998-11
伟大的历史性飞跃（１９７８－１９９８纪念改革开放二十周年特稿⑴）,1998-11-22,1998-11
江泽民会见世界卫生组织总干事,1998-11-22,1998-11
人民不会忘记,1998-11-22,1998-11
上海警备区九家企业交地方管理,1998-11-22,1998-11
动员部署农田水利基本建设,1998-11-22,1998-11
李瑞环会见参加世界福州十邑同乡大会代表,1998-11-22,1998-11
京城喜降瑞雪,1998-11-22,1998-11
北京地区天气预报,1998-11-22,1998-11
伟大的历史性飞跃（１９７８－１９９８纪念改革开放二十周年特稿⑴）,1998-11-22,1998-11
人民不会忘记,1998-11-22,1998-11
动员部署农田水利基本建设,1998-11-22,1998-11
韩总统金大中和美总统克林顿会谈,1998-11-22,1998-11
安南建议延长伊“石油换食品”计划,1998-11-22,1998-11
南执政党强烈谴责美国北约干涉其内政,1998-11-22,1998-11
全军第一批退伍老兵告别军营,1998-11-22,1998-11
做好优抚安置工作,1998-11-22,1998-11
云南宁蒗干群奋勇抗震救灾,1998-11-22,1998-11
加拿大总理结束访华,1998-11-22,1998-11
黄兴国任宁波市委书记,1998-11-22,1998-11
江泽民主席访俄意义重大,1998-11-22,1998-11
明天气象预报,1998-11-22,1998-11
第五届世界福州十邑同乡大会在京举行,1998-11-22,1998-11
第三届少数民族文学创作会议开幕,1998-11-22,1998-11
中国世界遗产研究委员会筹备大会召开,1998-11-22,1998-11
首都国际机场雪后恢复通航,1998-11-22,1998-11
黑白世界  道骨仙风,1998-11-22,1998-11
一张老照片,1998-11-22,1998-11
小事难忘（五洲茶亭）,1998-11-22,1998-11
神往米兰（域外拾零）,1998-11-22,1998-11
书香慰解乡情,1998-11-22,1998-11
巴黎的感悟,1998-11-22,1998-11
广东治理『烂尾楼』见成效（头条竞赛）,1998-11-22,1998-11
洪湖市首次产权交易会重组资产十二点六亿元,1998-11-22,1998-11
一顶贝雷帽取代七顶大盖帽,1998-11-22,1998-11
黑龙江开发乡土人才,1998-11-22,1998-11
油轮被困养殖区（现场目击）,1998-11-22,1998-11
内蒙古采取“零点行动”  数百名逃犯落入法网,1998-11-22,1998-11
济南交警借助自控系统指挥,1998-11-22,1998-11
井冈山开辟主峰景区,1998-11-22,1998-11
对北京交通拥堵的观察与思考（视点１６）,1998-11-22,1998-11
中国的成功  世界的奇迹（１９７８－１９９８纪念改革开放二十周年特稿）,1998-11-23,1998-11
朱镕基会见世界卫生组织总干事,1998-11-23,1998-11
严明法纪  严惩腐败,1998-11-23,1998-11
扎扎实实做好优抚安置工作,1998-11-23,1998-11
杂交水稻生产进入两系法,1998-11-23,1998-11
进城买房（喜看改革开放二十年）,1998-11-23,1998-11
不储冬菜（喜看改革开放二十年）,1998-11-23,1998-11
江泽民主席抵达莫斯科,1998-11-23,1998-11
北京地区天气预报,1998-11-23,1998-11
中国的成功  世界的奇迹（１９７８－１９９８纪念改革开放二十周年特稿）,1998-11-23,1998-11
南宫虚开增值税发票大案被查处,1998-11-23,1998-11
社会各界投资治理『四荒』地,1998-11-23,1998-11
政企配合打击加工贸易走私,1998-11-23,1998-11
公告社会监督电价,1998-11-23,1998-11
厦门企业为龙岩山区“输血”,1998-11-23,1998-11
灾区变净土（打击走私沿海行）,1998-11-23,1998-11
福建反走私取得阶段性成果,1998-11-23,1998-11
工行与工商联携手合作,1998-11-23,1998-11
就业服务的主要内容（两个“确保”政策咨询）,1998-11-23,1998-11
浙江推行反走私领导责任制,1998-11-23,1998-11
北京输油公司通过质量认证,1998-11-23,1998-11
中行向中化提供百亿元融资支持（新闻快报）,1998-11-23,1998-11
四川社会保险事业阔步前进,1998-11-23,1998-11
上海口岸进出口贸易继续增长（新闻快报）,1998-11-23,1998-11
中宏蜂胶软胶囊投放市场,1998-11-23,1998-11
重庆“人防经济”显山露水（新闻快报）,1998-11-23,1998-11
光缆增强用碳素钢丝通过鉴定,1998-11-23,1998-11
“国际菜篮子”拉动黑河经济（新闻快报）,1998-11-23,1998-11
天津农行开办『自助保管箱』业务,1998-11-23,1998-11
朔黄铁路提前铺轨（新闻快报）,1998-11-23,1998-11
风雨过后海天阔（科教兴国神州行）,1998-11-23,1998-11
茂名计生责任制赢得叫好声,1998-11-23,1998-11
痴心办学人,1998-11-23,1998-11
ＧＭ中国科技成就奖颁奖,1998-11-23,1998-11
加快京津地区生态建设,1998-11-23,1998-11
铺设未来之路,1998-11-23,1998-11
祖国就是支点（编余短论）,1998-11-23,1998-11
西安市郊教育群众优生优育,1998-11-23,1998-11
莫比可治疗关节炎副作用小,1998-11-23,1998-11
骨质增生新疗法为患者造福,1998-11-23,1998-11
扎扎实实做好优抚安置工作,1998-11-23,1998-11
从『慎独』想到的……（人民论坛）,1998-11-23,1998-11
无情剥离  有情安置,1998-11-23,1998-11
『金鸡奖』终评揭晓  电影『双奖』颁发,1998-11-23,1998-11
吴怀才同志逝世,1998-11-23,1998-11
绍兴进京招贤（现场短新闻）,1998-11-23,1998-11
库克群岛总理离沪赴香港,1998-11-23,1998-11
南车村新貌,1998-11-23,1998-11
“爱心献功臣行动”在全国实施,1998-11-23,1998-11
平顶山市注重为民办实事,1998-11-23,1998-11
甘肃科教兴省带来新气象,1998-11-23,1998-11
张文康与世界卫生组织总干事会谈,1998-11-23,1998-11
明天气象预报,1998-11-23,1998-11
本报网络版推出『中日关系大事记』专栏,1998-11-23,1998-11
大型纪录片《枫骨中华魂》在京首映,1998-11-23,1998-11
大型历史画册《中国大三线》出版,1998-11-23,1998-11
首家一日三刊新闻报在沪亮相,1998-11-23,1998-11
纪念刘少奇同志诞辰一百周年,1998-11-23,1998-11
重温少奇同志的教诲,1998-11-23,1998-11
刘少奇同志的功业永垂青史,1998-11-23,1998-11
伊指责巴特勒挑起争端,1998-11-23,1998-11
刚果（金）问题会谈未达成协议,1998-11-23,1998-11
中国摄影展在莫斯科（国外特写）,1998-11-23,1998-11
南联盟强调按宪法解决  美指责双方违停火协议,1998-11-23,1998-11
施罗德与拉方丹（综述）,1998-11-23,1998-11
欧盟支持意政府立场,1998-11-23,1998-11
安政府军大规模进攻安盟,1998-11-23,1998-11
美众院扩大对总统弹劾调查,1998-11-23,1998-11
墨西哥举行大型文体表演纪念“革命节”,1998-11-23,1998-11
繁荣的“沙漠市场”（连载）,1998-11-23,1998-11
黎庆祝独立五十五周年,1998-11-23,1998-11
叶利钦调整联邦安全会议成员,1998-11-23,1998-11
巴以临时和平协议开始执行,1998-11-23,1998-11
为了适应市场需求（大千絮语）,1998-11-23,1998-11
欧美香蕉大战愈演愈烈,1998-11-23,1998-11
科技工业园区走向知识经济,1998-11-23,1998-11
经合组织赞扬我改革开放,1998-11-23,1998-11
下大雪  滑雪去,1998-11-23,1998-11
降息推动新一轮股市上涨,1998-11-23,1998-11
阿尔法空间站第一组件升空,1998-11-23,1998-11
尼加拉瓜传染病流行,1998-11-23,1998-11
胎儿脊椎早修复  下肢瘫痪可避免,1998-11-23,1998-11
中欧达成新的纺织品协议,1998-11-23,1998-11
美欧加强气象卫星观测合作,1998-11-23,1998-11
纽约和伦敦能源交易市场酝酿合并,1998-11-23,1998-11
美国资本大举进入亚洲房地产业,1998-11-23,1998-11
暴风雪袭击希腊,1998-11-23,1998-11
追赶世界水平,1998-11-23,1998-11
澳门国际汽车大奖赛结束,1998-11-23,1998-11
云南省第六届民运会开幕,1998-11-23,1998-11
中国队连负意大利荷兰队,1998-11-23,1998-11
总结足球改革五年来的成就和问题,1998-11-23,1998-11
棋手的责任（体坛絮语）,1998-11-23,1998-11
中国男排争冠竞猜将办,1998-11-23,1998-11
中韩足球对抗赛第二回合双方战平,1998-11-23,1998-11
九冬会组委会正式成立,1998-11-23,1998-11
雪趣,1998-11-23,1998-11
象棋棋协大师称号赛收枰,1998-11-23,1998-11
沈祥福稿酬捐希望工程,1998-11-23,1998-11
我国经济高增长期远未结束（观点）,1998-11-23,1998-11
给“献礼工程”提个醒（经济茶座）,1998-11-23,1998-11
建筑业患了什么病,1998-11-23,1998-11
“明星企业”何以濒临破产,1998-11-23,1998-11
冰城飘下头场雪  灾民新村暖融融,1998-11-23,1998-11
“纸”“塑”之争,1998-11-23,1998-11
独辟蹊径搞“连锁”  负担不除仍亏损（地方经济新闻集锦）,1998-11-23,1998-11
低价竞销质量降  海南对虾丢市场（地方经济新闻集锦）,1998-11-23,1998-11
管理乏术加电价  农民重新点油灯（地方经济新闻集锦）,1998-11-23,1998-11
加快培育货币市场（金海观潮）,1998-11-23,1998-11
拥有自己的澄澈蓝天,1998-11-23,1998-11
中国银行发港钞,1998-11-23,1998-11
创名牌服务,1998-11-23,1998-11
深证成份指数日Ｋ线图,1998-11-23,1998-11
上周股市概览,1998-11-23,1998-11
沪市上周上涨前五名（％）,1998-11-23,1998-11
沪市上周下跌前五名（％）,1998-11-23,1998-11
深市上周上涨前五名（％）,1998-11-23,1998-11
深市上周下跌前五名（％）,1998-11-23,1998-11
上证综合指数日Ｋ线图,1998-11-23,1998-11
世界最大规模的股票筹资成功,1998-11-23,1998-11
吉县人行跟踪监测信用社,1998-11-23,1998-11
沅江市健全财政管理体系,1998-11-23,1998-11
租赁消费  叩响京城百姓家,1998-11-23,1998-11
大哥大维修黑洞大,1998-11-23,1998-11
给车一个家,1998-11-23,1998-11
小心翼翼戴眼镜（红黑榜）,1998-11-23,1998-11
雨中峨眉保洁员,1998-11-23,1998-11
垃圾不清理  害人又损己,1998-11-23,1998-11
如此『跟踪』（各抒己见）,1998-11-23,1998-11
三九集团拓展健康产业,1998-11-23,1998-11
摩托罗拉新一代手机面世（新产品·新技术）,1998-11-23,1998-11
东亚铝业推出隔热铝合金门窗（新产品·新技术）,1998-11-23,1998-11
国产磁流体密封件达世界先进水平（新产品·新技术）,1998-11-23,1998-11
『金长城』推出两款商用电脑（新产品·新技术）,1998-11-23,1998-11
取消５６０项电价外收取各种基金和附加费项目,1998-11-23,1998-11
江主席同叶利钦总统举行非正式会晤,1998-11-24,1998-11
世纪之交的中俄关系（中俄高级会晤结果联合声明）,1998-11-24,1998-11
关于中俄边界问题的联合声明,1998-11-24,1998-11
江主席会见俄总理普里马科夫,1998-11-24,1998-11
胡锦涛会见韩国客人,1998-11-24,1998-11
李鹏会见ＡＢＢ集团总裁,1998-11-24,1998-11
全总举行纪念刘少奇百年诞辰座谈会,1998-11-24,1998-11
为我健儿出征亚运会壮行,1998-11-24,1998-11
北京地区天气预报,1998-11-24,1998-11
观念更新天地宽（扶贫攻坚在神州⑻）,1998-11-24,1998-11
依法支持乡企再造新优势实现新发展,1998-11-24,1998-11
宁都农民投资农业热情高（落实中央决定  夯实农业基础）,1998-11-24,1998-11
安远三千亩机动地包到户（落实中央决定  夯实农业基础）,1998-11-24,1998-11
净市场  保两节  保春耕  保建设,1998-11-24,1998-11
河南８家公路施工企业违规经营被清理,1998-11-24,1998-11
中国农业信息网已有３０００多信息集散点,1998-11-24,1998-11
把握基本国情  破解历史难题（１９７８－１９９８纪念改革开放二十周年特稿⑶）,1998-11-24,1998-11
长阳县干部指导土地延包（落实中央决定  夯实农业基础）,1998-11-24,1998-11
建湖审计局为改制企业跟踪服务,1998-11-24,1998-11
尊荣贵宝积极开发猕猴桃资源,1998-11-24,1998-11
顺河地税局加强宗教场所税收征管,1998-11-24,1998-11
计算机用户协会与微软新签合作协议,1998-11-24,1998-11
河北内邱走出水泥散装新路子,1998-11-24,1998-11
格兰仕推出高分子抗磁复合材料,1998-11-24,1998-11
开封国税局专项检查成效大,1998-11-24,1998-11
全总举行纪念刘少奇百年诞辰座谈会,1998-11-24,1998-11
加强流动人口管理和农村治安综合治理工作,1998-11-24,1998-11
两个富有－－－南山人的追求,1998-11-24,1998-11
牙库甫心中的歌,1998-11-24,1998-11
天津对一起组织卖淫案作出判决,1998-11-24,1998-11
保定集会纪念解放五十周年,1998-11-24,1998-11
纪念中国佛教二千年,1998-11-24,1998-11
官兵情系“希望工程”,1998-11-24,1998-11
