联合国气候大会闭幕,1998-11-16,1998-11
我交响乐团访欧首演成功,1998-11-16,1998-11
日提出紧急经济对策,1998-11-16,1998-11
美经济明年增速将放慢,1998-11-16,1998-11
小虾毫米长  灭蚊本领大,1998-11-16,1998-11
汽车产业大象联姻  克莱斯勒寿终正寝,1998-11-16,1998-11
地球明日浴流星雨  美国竭力保卫星群,1998-11-16,1998-11
泰制定明年外债限额,1998-11-16,1998-11
崔文华力夺抓举冠军,1998-11-16,1998-11
万智牌智力竞技引入中国,1998-11-16,1998-11
从惧怕到自信,1998-11-16,1998-11
中国男排进入十六强,1998-11-16,1998-11
全国百城市自行车赛决战长沙,1998-11-16,1998-11
围棋名人战花絮,1998-11-16,1998-11
马晓春扳成一平,1998-11-16,1998-11
《中国武术图典》首发式举行,1998-11-16,1998-11
乒乓球名将李菊有望加盟山西晋园队,1998-11-16,1998-11
当前的经济形势与政策取向（经济大势）,1998-11-16,1998-11
高速公路：呼唤『黑白』并举,1998-11-16,1998-11
『配套』有大戏（经济茶座）,1998-11-16,1998-11
“洋草”成“祸草”,1998-11-16,1998-11
荔汽，『走私天堂』果真打不掉？,1998-11-16,1998-11
开拓灾区市场不能一哄而上（提醒）,1998-11-16,1998-11
牛角“生出”象牙  湛江查获大案,1998-11-16,1998-11
四岁病儿手术急  唯盼血库来佳讯,1998-11-16,1998-11
管理设施跟不上  全港停航逾半年（地方经济新闻集锦）,1998-11-16,1998-11
沪上产品开发滞后  滇军昂然登堂入室（地方经济新闻集锦）,1998-11-16,1998-11
经营混乱质量差  两年亏损一亿七（地方经济新闻集锦）,1998-11-16,1998-11
铁律无情,1998-11-16,1998-11
保险资金入场意义何在（金海观潮）,1998-11-16,1998-11
上证综合指数日Ｋ线图,1998-11-16,1998-11
上周股市概览,1998-11-16,1998-11
沪市上周上涨前五名（％）,1998-11-16,1998-11
沪市上周下跌前五名（％）,1998-11-16,1998-11
深市上周上涨前五名（％）,1998-11-16,1998-11
深市上周下跌前五名（％）,1998-11-16,1998-11
深证成份指数日Ｋ线图,1998-11-16,1998-11
北京市商业银行京卡面世（财金短波）,1998-11-16,1998-11
渣打庆祝在华一百四十周年（财金短波）,1998-11-16,1998-11
台州工行扩大住房贷款业务（财金短波）,1998-11-16,1998-11
华夏银行昆明分行推出新业务（财金短波）,1998-11-16,1998-11
沂南县地税局敞开大门评税风（财金短波）,1998-11-16,1998-11
天然气汽车何时上路,1998-11-16,1998-11
市民买菜  新鲜第一  价格第二（市场扫描）,1998-11-16,1998-11
少点、小点又何妨（各抒己见）,1998-11-16,1998-11
管形荧光灯镇流器总体质量上升（红黑榜）,1998-11-16,1998-11
故障频仍问题多  无照驾驶令人忧,1998-11-16,1998-11
感受差距（他山之石）,1998-11-16,1998-11
郑州：公园免费,1998-11-16,1998-11
盛装行进表演  京城百姓开眼,1998-11-16,1998-11
采摘旅游  乐在其中,1998-11-16,1998-11
Ｓｏｎｙ推出新款迷你型手机ＣＭ—Ｚ２００（新产品新技术）,1998-11-16,1998-11
国际羊毛局继续推广可机洗羊毛衫（新产品新技术）,1998-11-16,1998-11
当前的经济形势与政策取向（经济大势）,1998-11-16,1998-11
北京经济适用房———浮出水面,1998-11-16,1998-11
可承受的住宅价格与可接受的居住地段,1998-11-16,1998-11
经济适用住房：要按市场规律运作,1998-11-16,1998-11
赶快研究,1998-11-16,1998-11
既要转观念  也要给实惠,1998-11-16,1998-11
经济适用住房与安居工程（小资料）,1998-11-16,1998-11
进一步统一思想认识采取有力措施  坚定不移地推进粮食流通体制改革,1998-11-17,1998-11
抓住机遇迎接挑战  实施科教兴国战略,1998-11-17,1998-11
江主席会见美国副总统戈尔,1998-11-17,1998-11
江主席会见秘鲁总统藤森,1998-11-17,1998-11
朱镕基总理同亨利总理会谈,1998-11-17,1998-11
江主席会见泰国总理川·立派,1998-11-17,1998-11
江主席会见智利总统弗雷,1998-11-17,1998-11
江主席会见澳大利亚总理霍华德,1998-11-17,1998-11
北京地区天气预报,1998-11-17,1998-11
内蒙古跻身产粮大省区行列（新闻简报）,1998-11-17,1998-11
拉萨市每四人拥有一部电话（新闻简报）,1998-11-17,1998-11
我国试验成功高速铁路货车（新闻简报）,1998-11-17,1998-11
沪地铁二线上行线隧道贯通（新闻简报）,1998-11-17,1998-11
青岛港集装箱超百万标准箱（新闻简报）,1998-11-17,1998-11
进一步统一思想认识采取有力措施  坚定不移地推进粮食流通体制改革,1998-11-17,1998-11
取消五百六十项电价外加价项目,1998-11-17,1998-11
全国铁路前１０个月完成投资近４００亿元,1998-11-17,1998-11
中石化加大增收节支力度,1998-11-17,1998-11
工行推出汽车消费贷款业务,1998-11-17,1998-11
国有企业下岗职工基本生活有三道保障线（两个“确保”政策咨询）,1998-11-17,1998-11
第三届海峡两岸纺织业合作研讨会举行,1998-11-17,1998-11
陕建行用快用好项目建设资金,1998-11-17,1998-11
虎门虎将（打击走私沿海行）,1998-11-17,1998-11
巴中形成四通八达公路网,1998-11-17,1998-11
广西贵糖集团开发利用“三废”,1998-11-17,1998-11
河南集中查办假冒名优案件３５００余起（新闻快报）,1998-11-17,1998-11
架金桥电视交易会将在京举办,1998-11-17,1998-11
江苏强化外汇管理取得明显成效（新闻快报）,1998-11-17,1998-11
杨森公司捐建三所希望小学,1998-11-17,1998-11
上海海关查获九起知识产权侵权案件（新闻快报）,1998-11-17,1998-11
诺华专题研讨中药现代化问题,1998-11-17,1998-11
太原市公路无“三乱”（新闻快报）,1998-11-17,1998-11
埃尔夫阿托公司捐赠饮用水处理剂,1998-11-17,1998-11
河南纺织压锭重组取得重大进展（新闻快报）,1998-11-17,1998-11
『撒可富』杯平衡施肥知识竞赛举行,1998-11-17,1998-11
西藏水毁公路基本恢复通车（新闻快报）,1998-11-17,1998-11
康柏公司推出客户服务新体系,1998-11-17,1998-11
滑雪将成为黑龙江省今冬旅游热点（新闻快报）,1998-11-17,1998-11
我国最大的皮革化工公司在无锡建成（新闻快报）,1998-11-17,1998-11
美在世界１５家最大公司中占１３席（新闻快报）,1998-11-17,1998-11
太保为国际航展提供１５００亿元保险（新闻快报）,1998-11-17,1998-11
布尔津各族群众共创文明村镇（文明村镇创建活动巡礼⑥）,1998-11-17,1998-11
提高水平  发挥优势,1998-11-17,1998-11
依法履行职责  加强水土保持,1998-11-17,1998-11
前不久，武警浙江省总队海警一支队查获一起特大香烟走私案,1998-11-17,1998-11
我新一代战鹰国际航展显风采,1998-11-17,1998-11
一批党建新书出版,1998-11-17,1998-11
潍城区为群众办实事件件落实,1998-11-17,1998-11
平淡唯实自成金,1998-11-17,1998-11
公安之家（社会扫描）,1998-11-17,1998-11
威海环翠区优化乡镇干部配置（短波）,1998-11-17,1998-11
铁十七局提高领导班子理论水平（短波）,1998-11-17,1998-11
曲阳县探索农村民主管理新路（短波）,1998-11-17,1998-11
《在志愿军司令部的岁月里》出版（短波）,1998-11-17,1998-11
某部积极做好新训后勤保障工作（短波）,1998-11-17,1998-11
武警某部普法小组活跃在辖区（短波）,1998-11-17,1998-11
朱镕基总理同亨利总理会谈,1998-11-17,1998-11
江泽民致信希望发挥党史资政育人作用,1998-11-17,1998-11
村民的民主权利不容侵犯（社会观察）,1998-11-17,1998-11
朱镕基观看纪念刘少奇百年诞辰书画展,1998-11-17,1998-11
坚持环境与经济社会协调发展,1998-11-17,1998-11
北京展开“扫黄打非”专项治理,1998-11-17,1998-11
舍得扔破烂（喜看改革开放二十年）,1998-11-17,1998-11
电话代家书（喜看改革开放二十年）,1998-11-17,1998-11
荒山秃岭果香飘,1998-11-17,1998-11
罗铭先生逝世,1998-11-17,1998-11
香港全国政协委员视察潮汕地区,1998-11-17,1998-11
明天气象预报,1998-11-17,1998-11
张万年会见参加珠海航展外国军队代表团（友好往来）,1998-11-17,1998-11
吴仪与匈牙利经济内阁主席会谈（友好往来）,1998-11-17,1998-11
云南发展高新技术产业  浙江实施技术创新工程,1998-11-17,1998-11
在第二届中国环境与发展国际合作委员会第二次会议开幕式上的讲话,1998-11-17,1998-11
创维  创新创出新境界,1998-11-17,1998-11
新闻出版界表彰先进,1998-11-17,1998-11
兰州商学院  飞走的孔雀又还巢,1998-11-17,1998-11
江阴市着力建设师资队伍,1998-11-17,1998-11
中国《教育大辞典》合编本出版,1998-11-17,1998-11
医界评百佳  弘扬好医风,1998-11-17,1998-11
青岛开发出『康肤灵』,1998-11-17,1998-11
我国从南到北都可观看流星雨（教科文短）,1998-11-17,1998-11
电脑上网替代产品问世,1998-11-17,1998-11
雅鲁藏布大峡谷发现红豆杉林（教科文短）,1998-11-17,1998-11
首届青少年互联网知识大赛初赛结束,1998-11-17,1998-11
小浪底发现汉代大型建筑遗址（教科文短）,1998-11-17,1998-11
赵鹏书画展在香港举办,1998-11-17,1998-11
悦达集团捐助千名湖南学子,1998-11-17,1998-11
ＴＧ系列生物档案系统填补空白,1998-11-17,1998-11
江主席会见美国副总统戈尔,1998-11-17,1998-11
吉隆坡喜迎嘉宾（通讯）,1998-11-17,1998-11
为和平解决危机而努力,1998-11-17,1998-11
唐家璇会见俄外长,1998-11-17,1998-11
美暂停向海湾集结军队  伊不接受任何附加条件  联合国观察员开始返伊,1998-11-17,1998-11
戏还没有结束（国外特写）,1998-11-17,1998-11
俄日彼此向对方迈步（综述）,1998-11-17,1998-11
流星如雨闹夜空（科技漫话）,1998-11-17,1998-11
日提出大规模紧急经济对策,1998-11-17,1998-11
小麦：中加友谊的纽带（记者专访）,1998-11-17,1998-11
日经常项目盈余创纪录  韩国积极开拓中东市场  泰国经济形势有所好转,1998-11-17,1998-11
交通堵塞日益严重  时间浪费成倍增加,1998-11-17,1998-11
安乐死尚未合法  实践者已近三万,1998-11-17,1998-11
歌德学院北京分院院庆,1998-11-17,1998-11
柯达在中国设新厂,1998-11-17,1998-11
俄公布稳定经济首阶段措施,1998-11-17,1998-11
中国选手名列金牌和奖牌总数第一,1998-11-17,1998-11
全国八城市业余保龄球总决赛结束,1998-11-17,1998-11
大型武术晚会《武颂》在京演出,1998-11-17,1998-11
全国速度赛马公开赛收兵,1998-11-17,1998-11
排联苦心经营  发展仍不平衡,1998-11-17,1998-11
国际越野挑战赛在京办展览,1998-11-17,1998-11
第八届全国体育舞蹈锦标赛在京举行,1998-11-17,1998-11
团结杯大学生橄榄球联赛落幕,1998-11-17,1998-11
象棋棋协大师称号赛战罢八轮,1998-11-17,1998-11
全国速滑系列赛结束首站赛事,1998-11-17,1998-11
宽甸：启动“绿色银行”（地方热线）,1998-11-17,1998-11
神韵虽初闻  佳音何时续,1998-11-17,1998-11
有感护林碑石被沙埋（采访随想）,1998-11-17,1998-11
优质高效之路,1998-11-17,1998-11
深圳  市府大院割地  市民喜添新绿（记者见闻）,1998-11-17,1998-11
清廉乃为政之要（公仆谈心录）,1998-11-17,1998-11
土司衙门今依然,1998-11-17,1998-11
为了新世纪的腾飞,1998-11-17,1998-11
市场农业与农业市场（学习贯彻十五届三中全会精神）,1998-11-17,1998-11
认真兴邦  马虎误国（思想纵横）,1998-11-17,1998-11
源于实践的思考,1998-11-17,1998-11
用邓小平理论指导政法工作,1998-11-17,1998-11
教育扶贫：为新世纪奠基（教育聚焦）,1998-11-17,1998-11
王选的启示（教海月谈）,1998-11-17,1998-11
托起民族的希望,1998-11-17,1998-11
放学了  轻松回家去（校园生活）,1998-11-17,1998-11
藏族学生温暖的家,1998-11-17,1998-11
你能当数学家吗？,1998-11-17,1998-11
走向未来的民办高校,1998-11-17,1998-11
让潜在生产力变为现实（执法检查）,1998-11-17,1998-11
走向成熟（执法者风采）,1998-11-17,1998-11
依法治水：重庆刻不容缓的抉择（法在生活中）,1998-11-17,1998-11
地方人大的基本功（法治论苑）,1998-11-17,1998-11
证券市场呼唤立法（委员论坛）,1998-11-17,1998-11
商场该不该赔（律师答疑）,1998-11-17,1998-11
西安严厉打击盗销自行车犯罪（信息通道）,1998-11-17,1998-11
仙居警方定人定案定时清积案（信息通道）,1998-11-17,1998-11
长垣法院解决『执行难』走出新路（信息通道）,1998-11-17,1998-11
闽侯检察院努力维护司法公正（信息通道）,1998-11-17,1998-11
江泽民主席在亚太经合组织领导人与工商咨询理事会代表对话会上的讲话,1998-11-18,1998-11
胡锦涛会见亨利总理,1998-11-18,1998-11
朱镕基会见美国客人,1998-11-18,1998-11
江主席就经济技术合作问题阐述看法,1998-11-18,1998-11
江主席会见俄罗斯总理普里马科夫,1998-11-18,1998-11
江主席会见印尼总统哈比比,1998-11-18,1998-11
江主席会见新西兰总理希普利,1998-11-18,1998-11
江主席会见菲律宾总统埃斯特拉达,1998-11-18,1998-11
江主席会见新加坡总理吴作栋,1998-11-18,1998-11
李岚清分别会见匈牙利美国客人,1998-11-18,1998-11
江主席会见马来西亚总理马哈蒂尔,1998-11-18,1998-11
北京地区天气预报,1998-11-18,1998-11
安徽省五百万民工兴水利,1998-11-18,1998-11
再造秀美山川（扶贫攻坚在神州⑦）,1998-11-18,1998-11
苹果论个卖（经济漫笔）,1998-11-18,1998-11
湄洲湾畔访林工（打击走私沿海行）,1998-11-18,1998-11
盯住市场空白,1998-11-18,1998-11
西南铁路建设再掀高潮,1998-11-18,1998-11
城镇住宅质量成为突出矛盾,1998-11-18,1998-11
公路建设坚决不搞『豆腐渣』工程,1998-11-18,1998-11
沈阳农田基本建设投入大（落实中央决定  夯实农业基础）,1998-11-18,1998-11
金华二轮土地承包进展快（落实中央决定  夯实农业基础）,1998-11-18,1998-11
三名会计人员被吊销会计证（新闻快报）,1998-11-18,1998-11
工程建设企业成果发布会举行（新闻快报）,1998-11-18,1998-11
违规销售邮品行为被查处（新闻快报）,1998-11-18,1998-11
北京育新花园二期住宅封顶,1998-11-18,1998-11
世行资助我解决“２０００年问题”（新闻快报）,1998-11-18,1998-11
维也纳市政管理技术国际研讨会召开,1998-11-18,1998-11
中国医药信息网网员大会举行（新闻快报）,1998-11-18,1998-11
小草沟建成银杏育苗基地,1998-11-18,1998-11
西藏告别商品短缺进入买方市场,1998-11-18,1998-11
东滩矿创全国煤矿月产最高纪录,1998-11-18,1998-11
新疆连年开展农资专项“打假”（新闻快报）,1998-11-18,1998-11
乌铁局实现安全运输１０１０天,1998-11-18,1998-11
河南对欠税千万元以上的３３家企业曝光（新闻快报）,1998-11-18,1998-11
江苏农民收入来源趋于多元化（新闻快报）,1998-11-18,1998-11
宁波市雷厉风行打击走私犯罪（新闻快报）,1998-11-18,1998-11
石花镇两个文明建设再上新台阶（文明村镇创建活动巡礼⑦）,1998-11-18,1998-11
保护农民合法权益不受侵害,1998-11-18,1998-11
书记离任赞誉多,1998-11-18,1998-11
胶州完善干部考核办法,1998-11-18,1998-11
武警抚顺支队党委廉洁自律受表彰,1998-11-18,1998-11
民族地区经济发展与资源开发研讨会开幕,1998-11-18,1998-11
我国法官等级制度正式实行,1998-11-18,1998-11
齐齐哈尔加强农村基层组织建设（短波）,1998-11-18,1998-11
龙口重视经济强村党的建设（短波）,1998-11-18,1998-11
武警福州支队注重培养两用人才（短波）,1998-11-18,1998-11
湖北多佳集团热心灾后重建（短波）,1998-11-18,1998-11
盘锦对进藏新兵实行优惠政策（短波）,1998-11-18,1998-11
某部党委扎根仓库建功业（短波）,1998-11-18,1998-11
上海三大冶金企业组建上海宝钢集团公司,1998-11-18,1998-11
全国党校理论研讨会在京举行,1998-11-18,1998-11
增强环保出效益观念,1998-11-18,1998-11
留学人员在国内大有用武之地,1998-11-18,1998-11
小四轮也『享福』了（喜看改革开放二十年）,1998-11-18,1998-11
外交部发言人发表评论,1998-11-18,1998-11
首都新闻界举行座谈会,1998-11-18,1998-11
我当过『电视机长』（喜年改革开放二十年）,1998-11-18,1998-11
本报网络版推出『辉煌二十年』专栏,1998-11-18,1998-11
唐明照同志逝世,1998-11-18,1998-11
明天气象预报,1998-11-18,1998-11
积极探索具有地区特点的医疗保险制度,1998-11-18,1998-11
海洋管理呼唤法制,1998-11-18,1998-11
北京市政府与中国农大签订合作协议,1998-11-18,1998-11
南开大学与云南省达成合作意向,1998-11-18,1998-11
小提琴协奏曲《梁祝》改编成舞蹈诗剧,1998-11-18,1998-11
刘小光再胜马晓春一盘,1998-11-18,1998-11
中国男排将迎战南斯拉夫队,1998-11-18,1998-11
江泽民出席马总理举行的晚宴,1998-11-18,1998-11
北约东扩与俄白联盟（国际论坛）,1998-11-18,1998-11
经济技术合作大有作为（通讯）,1998-11-18,1998-11
复植乌桕祭英灵（国外特写）,1998-11-18,1998-11
迟浩田结束访南非  博总统会见迟浩田,1998-11-18,1998-11
印尼公布苏哈托存款调查初步结果,1998-11-18,1998-11
以宣布延缓从西岸撤军,1998-11-18,1998-11
特委会人员返伊,1998-11-18,1998-11
克林顿将恢复亚洲之行,1998-11-18,1998-11
朝谴责日间谍卫星计划,1998-11-18,1998-11
欧元区加速利率趋同（经济札记）,1998-11-18,1998-11
英企业恢复投资信心,1998-11-18,1998-11
海湾局势缓和  油价大幅回落,1998-11-18,1998-11
道指重返九千点,1998-11-18,1998-11
中国对世界经济贡献重大（记者专访）,1998-11-18,1998-11
投资对冲基金亏损  联合银行首脑辞职,1998-11-18,1998-11
把禁毒写进教科书（一家之言）,1998-11-18,1998-11
“但存方寸地，留与子孙耕”（朴素人生）,1998-11-18,1998-11
孰是孰非（社会调查）,1998-11-18,1998-11
造福老人的事业,1998-11-18,1998-11
是喜是忧（社会聚焦）,1998-11-18,1998-11
泰安  请管管宰客现象（社会短波）,1998-11-18,1998-11
英籍教师  捐助特困学生（社会短波）,1998-11-18,1998-11
盐城政协  带头节约经费（社会短波）,1998-11-18,1998-11
村干部岂能如此组织村民上访（信访调查）,1998-11-18,1998-11
沭阳２００个单位同一个“账房”（新事瞭望）,1998-11-18,1998-11
慎用『一票否决』（读者论坛）,1998-11-18,1998-11
洱海又现漂草（耳闻目睹）,1998-11-18,1998-11
“村务公开”须规范（观察台）,1998-11-18,1998-11
截留挪用国家税款（信访窗口）,1998-11-18,1998-11
虚假广告坑农事件两例（监督哨）,1998-11-18,1998-11
加强福利性企业税务管理,1998-11-18,1998-11
这个露天垃圾场亟待整治,1998-11-18,1998-11
双线单相三孔接线板应予取缔,1998-11-18,1998-11
安阳有人公开回收失效药品,1998-11-18,1998-11
厂矿企业可否自办电视台？（法律顾问）,1998-11-18,1998-11
渔民缘何拒用渔船证书（来信点滴）,1998-11-18,1998-11
这样的孩子怎么办？（朋友信箱）,1998-11-18,1998-11
行为失衡青少年需要特殊教育（朋友信箱）,1998-11-18,1998-11
执法必须公正（实话实说）,1998-11-18,1998-11
陈重天的接待日,1998-11-18,1998-11
部队是所大学校（普通人的故事）,1998-11-18,1998-11
名誉侵权的认定及处理（请您留意）,1998-11-18,1998-11
年过半百一悟（人生一得）,1998-11-18,1998-11
擅收粮食违法（事中有法）,1998-11-18,1998-11
救助小芳娟（世相百态）,1998-11-18,1998-11
回想公木老师（心香一瓣）,1998-11-18,1998-11
情凝大西北,1998-11-18,1998-11
读东坡诗杂感（金台随感）,1998-11-18,1998-11
诗词和现代生活（品书札记）,1998-11-18,1998-11
大巴山深处（我的家园）,1998-11-18,1998-11
万里江山处处春,1998-11-18,1998-11
古今藏画首次相见  中外佳作同时观览（艺文短波）,1998-11-18,1998-11
在亚太经合组织第六次领导人非正式会议上的讲话,1998-11-19,1998-11
亚太经合组织领导人非正式会议举行,1998-11-19,1998-11
加强学习  提高素质,1998-11-19,1998-11
国务院第十次常务会议召开,1998-11-19,1998-11
加拿大总理让·克雷蒂安（人物介绍）,1998-11-19,1998-11
推广节水灌溉  发展节水农业,1998-11-19,1998-11
北京地区天气预报,1998-11-19,1998-11
中国保险监督管理委员会成立,1998-11-19,1998-11
江苏治乱减负动真碰硬,1998-11-19,1998-11
河南两名县区国税局长被撤职,1998-11-19,1998-11
中国人民银行上海分行成立,1998-11-19,1998-11
明年人民币汇率稳定仍有坚实基础,1998-11-19,1998-11
厦门打击走私规范化法制化（打击走私沿海行）,1998-11-19,1998-11
精选好项目  严把咨询关,1998-11-19,1998-11
一批重点项目举行开标仪式,1998-11-19,1998-11
要为下岗职工缴纳养老、医疗和失业保险费（两个“确保”政策咨询）,1998-11-19,1998-11
四川名酒文化节在宜宾举行,1998-11-19,1998-11
我国蔬菜供应相对充裕,1998-11-19,1998-11
河北栾城地税局长被查处,1998-11-19,1998-11
建设银行推出个人电子汇款业务（新闻快报）,1998-11-19,1998-11
福建老区经济发展群众生活水平提高（新闻快报）,1998-11-19,1998-11
南方铁路机车（集团）公司在常州成立（新闻快报）,1998-11-19,1998-11
三峡债券即将发行（新闻快报）,1998-11-19,1998-11
广州严肃查处统计违法行为（新闻快报）,1998-11-19,1998-11
酒泉总寨镇群众文化建设真红火（文明村镇创建活动巡礼⑧）,1998-11-19,1998-11
我国优抚安置工作成绩显著,1998-11-19,1998-11
切实加强企业思想政治工作,1998-11-19,1998-11
天津放宽落户条件,1998-11-19,1998-11
严格依法管理国家秘密,1998-11-19,1998-11
为让小村换新颜,1998-11-19,1998-11
乌海公安便民利民,1998-11-19,1998-11
鹤城巡警显神威,1998-11-19,1998-11
全军业余文艺调演精彩纷呈,1998-11-19,1998-11
北京输油公司推行“职工代表审议制”,1998-11-19,1998-11
滨海县开展为农服务“六下乡”活动,1998-11-19,1998-11
武警某部帮助驻地建立“普法示范户”,1998-11-19,1998-11
武警某部加强车辆管理出成效,1998-11-19,1998-11
新抚区教育应征青年走雷锋之路,1998-11-19,1998-11
河区法院大兴调查研究之风,1998-11-19,1998-11
朱镕基会见中国环境与发展国际合作委员会委员,1998-11-19,1998-11
尉健行观看话剧《下岗了，别趴下》,1998-11-19,1998-11
保护我国重要地区自然覆盖,1998-11-19,1998-11
第七届金鸡百花电影节在重庆开幕,1998-11-19,1998-11
山西提出生态环境建设十年目标,1998-11-19,1998-11
王建功同志逝世,1998-11-19,1998-11
小客人来自贫困县（现场短新闻）,1998-11-19,1998-11
自来水进农家（喜看改革开放二十年）,1998-11-19,1998-11
湖南隆重纪念刘少奇百年诞辰,1998-11-19,1998-11
京郊出现匿迹多年的野生动物（东西南北中）,1998-11-19,1998-11
甘肃兴隆山保护区开发马麝资源（东西南北中）,1998-11-19,1998-11
厂家请为『农家』谋（人民论坛）,1998-11-19,1998-11
隍城镇成为“农民书法之乡”（东西南北中）,1998-11-19,1998-11
明天气象预报,1998-11-19,1998-11
黄菊会见南非共产党代表团（友好往来）,1998-11-19,1998-11
布赫会见蒙古客人（友好往来）,1998-11-19,1998-11
铁木尔·达瓦买提会见波兰客人（友好往来）,1998-11-19,1998-11
万国权会见美国客人（友好往来）,1998-11-19,1998-11
商潮中的文化奇观,1998-11-19,1998-11
中国百科事业迈向电子化,1998-11-19,1998-11
北京加快高校筒子楼改造,1998-11-19,1998-11
我建立反计算机病毒快速反应机制,1998-11-19,1998-11
夏青播音成就研讨会在京举行,1998-11-19,1998-11
朱自清系列图书出版,1998-11-19,1998-11
经济日报独立制作电视栏目,1998-11-19,1998-11
李可染艺术基金会在京成立,1998-11-19,1998-11
防治老年性痴呆刻不容缓,1998-11-19,1998-11
公安县确保大灾之年无大疫,1998-11-19,1998-11
回春妙手克顽症,1998-11-19,1998-11
敢为先者胜（编余短论）,1998-11-19,1998-11
南阳三师开展园丁科技教育活动,1998-11-19,1998-11
独山子石化总厂帮困助学,1998-11-19,1998-11
国际工业结晶会议在天大召开,1998-11-19,1998-11
江主席在亚佩克会议就电子商务问题发言,1998-11-19,1998-11
建立亚佩克科技产业合作基金,1998-11-19,1998-11
共商大计  迎接挑战（通讯）,1998-11-19,1998-11
江主席看望我驻马使馆人员,1998-11-19,1998-11
亚佩克部分领导人主张不谈政治,1998-11-19,1998-11
纪念周恩来刘少奇彭德怀百年诞辰,1998-11-19,1998-11
特委会已开始恢复武器核查  巴特勒要求伊交出化武文件  俄欢迎美取消对伊动武决定  中东国家乐见核查危机缓解,1998-11-19,1998-11
巴重申通过谈判解决分歧  以议会批准临时和平协议,1998-11-19,1998-11
韩首批游客赴朝观光,1998-11-19,1998-11
唐家璇举行记者招待会,1998-11-19,1998-11
欧盟扩大速度有争议（综述）,1998-11-19,1998-11
高温超导材料转向实用化（院士园地）,1998-11-19,1998-11
道指重上九千点（经济札记）,1998-11-19,1998-11
经合组织再次下调世界经济增长预测,1998-11-19,1998-11
拉美对外投资猛增  去年达九十亿美元,1998-11-19,1998-11
