“姚记”挑落“挑记”,1998-09-21,1998-09
杨尚昆同志遗体昨在京火化  中央领导前往医院沉痛送别,1998-09-22,1998-09
广西力争基础设施建设后来居上,1998-09-22,1998-09
江苏开拓国内外市场有良方,1998-09-22,1998-09
妇女盛会在中国（纪念改革开放２０年难忘第一）,1998-09-22,1998-09
『网上卖菜』好光景（今日谈）,1998-09-22,1998-09
北京地区天气预报,1998-09-22,1998-09
沪十万志愿者参与环境整治（新闻简报）,1998-09-22,1998-09
襄樊电厂首台机组并网发电（新闻简报）,1998-09-22,1998-09
宁夏电视卫星频道正式开通（新闻简报）,1998-09-22,1998-09
厦门乡企产值同比增长两成（新闻简报）,1998-09-22,1998-09
铁路机车业将减员五万（新闻简报）,1998-09-22,1998-09
广州：检查队一批一批“吃”月饼,1998-09-22,1998-09
中国第三届海商法国际研讨会举行,1998-09-22,1998-09
拱北海关查获盗版光盘６９万多张,1998-09-22,1998-09
葫芦岛海滨  低价揽客高价宰人,1998-09-22,1998-09
事业成败在于治,1998-09-22,1998-09
进军国际大市场（乡镇企业：开辟新的经济增长点⑷）,1998-09-22,1998-09
查查『检查』（经济漫笔）,1998-09-22,1998-09
京城月饼新意浓,1998-09-22,1998-09
中外将共同开发秦皇岛３２—６油田,1998-09-22,1998-09
税总要求确保实现增收８００亿元,1998-09-22,1998-09
江苏治理“三乱”减轻企业负担,1998-09-22,1998-09
石化行业效益全面回升,1998-09-22,1998-09
广东市场物价再创新低,1998-09-22,1998-09
天津工业生产回升,1998-09-22,1998-09
亲人就是公务员（做人民满意的公务员）,1998-09-22,1998-09
新郑认真学习邓小平理论,1998-09-22,1998-09
徐铁分局实施“聚心工程”,1998-09-22,1998-09
青岛审判机关加强执行工作,1998-09-22,1998-09
金融系统创建青年文明号座谈会举行,1998-09-22,1998-09
哈尔滨建立新型社区警务体制,1998-09-22,1998-09
浓浓鱼水情,1998-09-22,1998-09
九八中国武警抗洪抢险摄影展开幕（短波）,1998-09-22,1998-09
辉县市法官登门为企业服务（短波）,1998-09-22,1998-09
北京铁路公安开展爱路护路教育活动（短波）,1998-09-22,1998-09
沧州新华区十七万群众评议交警（短波）,1998-09-22,1998-09
大连交警确保旅游安全（短波）,1998-09-22,1998-09
牡丹江铁警被树为公安法制建设标兵（短波）,1998-09-22,1998-09
武警北京某部着力提高干部军事素质（短波）,1998-09-22,1998-09
济南军区青岛第二疗养院勤俭建院（短波）,1998-09-22,1998-09
三二三医院咸阳分院义诊扶贫（短波）,1998-09-22,1998-09
湖南省军区某干休所热心服务老干部（短波）,1998-09-22,1998-09
新疆大路歌,1998-09-22,1998-09
反映辉煌历史  弘扬抗洪精神,1998-09-22,1998-09
灾后援建过冬房（现场短新闻）,1998-09-22,1998-09
藏胞挥泪送“门巴”（现场短新闻）,1998-09-22,1998-09
军委总部安排抗洪部队官兵疗养,1998-09-22,1998-09
严肃发行纪律  确保完成计划（认真贯彻落实中办通知精神  确保人民日报发行稳中有升）,1998-09-22,1998-09
为乡镇党校赠订党报,1998-09-22,1998-09
河北  责任到位  措施到位,1998-09-22,1998-09
精心组织  层层落实（认真贯彻落实中办通知精神  确保人民日报发行稳中有升）,1998-09-22,1998-09
湖北秭归县九畹大桥建成通车,1998-09-22,1998-09
新闻老战士丁一岚逝世,1998-09-22,1998-09
何均同志逝世,1998-09-22,1998-09
明天气象预报,1998-09-22,1998-09
钱其琛会见韩国客人,1998-09-22,1998-09
姜春云会见韩国客人,1998-09-22,1998-09
姜春云会见安哥拉客人,1998-09-22,1998-09
吴仪会见外国客人,1998-09-22,1998-09
湖北  想当公务员  先学普通话,1998-09-22,1998-09
经济要发展  有赖共同语,1998-09-22,1998-09
合力共建“通天塔”（编余短论）,1998-09-22,1998-09
“汉王”新品亮相,1998-09-22,1998-09
职教撑起『富民伞』（科教兴国神州行）,1998-09-22,1998-09
高效电池液研制成功,1998-09-22,1998-09
北京神经肌肉病会诊中心成立,1998-09-22,1998-09
全社会参与控制艾滋病,1998-09-22,1998-09
首批中央调拨药品进灾区,1998-09-22,1998-09
我女将刷新五项世界纪录,1998-09-22,1998-09
亚运会集训名单公布,1998-09-22,1998-09
达科斯塔创男子世界最好成绩,1998-09-22,1998-09
立足稳健  发展难度,1998-09-22,1998-09
天津队两战两胜表现不俗,1998-09-22,1998-09
喜欢挑战  迎接挑战,1998-09-22,1998-09
短波  西藏民院步入不惑之年,1998-09-22,1998-09
延安中学喜庆６０华诞,1998-09-22,1998-09
中小学题典出版,1998-09-22,1998-09
《本草纲目》有了白话本,1998-09-22,1998-09
１０家企业为灾区捐妇女保健用品,1998-09-22,1998-09
默沙东资讯中心受欢迎,1998-09-22,1998-09
以色列在戒备森严中迎来犹太新年,1998-09-22,1998-09
张万年会见美前国防部长佩里,1998-09-22,1998-09
俄国家杜马主席会见齐怀远,1998-09-22,1998-09
喀布尔遭袭  百余人伤亡,1998-09-22,1998-09
友谊·交流·合作（出访归来）,1998-09-22,1998-09
利比里亚警察向美使馆开火,1998-09-22,1998-09
智利欢庆建军节,1998-09-22,1998-09
库利克任俄副总理,1998-09-22,1998-09
伊塔交恶由来及趋势（热点对话）,1998-09-22,1998-09
克林顿作证录像被公布,1998-09-22,1998-09
瑞典议会大选揭晓  社民党将继续执政,1998-09-22,1998-09
马前副总理安瓦尔被捕,1998-09-22,1998-09
确认曾发生强暴案件,1998-09-22,1998-09
韩决定关闭一批驻外机构,1998-09-22,1998-09
两名英国人质在车臣获释,1998-09-22,1998-09
刚果（金）总统访问利比亚,1998-09-22,1998-09
乌称暂不从刚果（金）撤军,1998-09-22,1998-09
社民党的理念（通讯）,1998-09-22,1998-09
不软不硬的着陆（新闻分析）,1998-09-22,1998-09
东京股市昨再创新低  新加坡调低贷款利率,1998-09-22,1998-09
韩加快银行重组（综述）,1998-09-22,1998-09
发展对外开放的民族经济,1998-09-22,1998-09
美商谍异常活跃  欧议员疾呼防范,1998-09-22,1998-09
淡水运输有妙招  塑料巨袋替油轮,1998-09-22,1998-09
卫星观测南极鲸,1998-09-22,1998-09
浩气长留『生死牌』,1998-09-22,1998-09
假教师何以混进惠安县？（热点追踪）,1998-09-22,1998-09
与百姓交朋友（公仆谈心录）,1998-09-22,1998-09
村头竖起“广告牌”,1998-09-22,1998-09
儒警万长松（无悔人生）,1998-09-22,1998-09
登临黄崖关,1998-09-22,1998-09
“大眼睛”你好吗？,1998-09-22,1998-09
千家饺子万家情（采访随想）,1998-09-22,1998-09
适应新形势快一些（思想纵横）,1998-09-22,1998-09
《中国区域经济政策研究》出版（书讯）,1998-09-22,1998-09
先富与共富的辩证思考,1998-09-22,1998-09
为什么要以研究宣传促学习（学习通讯）,1998-09-22,1998-09
发展新型的党际关系,1998-09-22,1998-09
“将军”不看“作战地图”（本期聚焦）,1998-09-22,1998-09
重视学习（议论风生）,1998-09-22,1998-09
干部应该多读书（加强理论学习  提高领导水平）,1998-09-22,1998-09
不断学习（加强理论学习  提高领导水平）,1998-09-22,1998-09
南召县  干部有本“连心簿”,1998-09-22,1998-09
日照市  探索脱贫新路子,1998-09-22,1998-09
钻井三公司  围绕经济抓党建,1998-09-22,1998-09
共筑坚强“堡垒”,1998-09-22,1998-09
大局至上,1998-09-22,1998-09
潜江市７１个新经济体建立了党组织,1998-09-22,1998-09
武警丽水支队党委工作突出受表彰,1998-09-22,1998-09
安化县有条“党建知识走廊”,1998-09-22,1998-09
武警某部党委注重群众工作有成效,1998-09-22,1998-09
让地奥告诉世界［报告文学］,1998-09-22,1998-09
筑起新的大堤,1998-09-22,1998-09
二十年国民经济发展成果巨大,1998-09-23,1998-09
九届人大常委会举办第三次法制讲座,1998-09-23,1998-09
各民主党派中央领导人在京座谈纪念,1998-09-23,1998-09
李瑞环会见罗马尼亚参议长,1998-09-23,1998-09
胡锦涛会见安哥拉代表团,1998-09-23,1998-09
尉健行结束对越南访问,1998-09-23,1998-09
开发银行再次追加３００亿贷款,1998-09-23,1998-09
北京地区天气预报,1998-09-23,1998-09
延寿巨资建设生态县,1998-09-23,1998-09
外企欢迎中国打私（经济视点）,1998-09-23,1998-09
河北查处４起违反粮食购销政策事件,1998-09-23,1998-09
关闭非法开采小煤矿（经济快论）,1998-09-23,1998-09
建材工业走出低谷购销两旺,1998-09-23,1998-09
引碧入连供水北段工程节资２亿元,1998-09-23,1998-09
乌鲁木齐海关打私成效显著,1998-09-23,1998-09
深圳海关查获多起走私大案,1998-09-23,1998-09
造假套汇难逃国门法网,1998-09-23,1998-09
四川非公有制企业快速扩张发展（新闻快报）,1998-09-23,1998-09
上海进入新一轮彩电消费热潮（新闻快报）,1998-09-23,1998-09
甘肃固定资产投资步伐加快（新闻快报）,1998-09-23,1998-09
香港通胀率降至近年来最低点（新闻快报）,1998-09-23,1998-09
百架民用飞机出口创汇逾３亿美元,1998-09-23,1998-09
中美能源融资研讨会在京举行,1998-09-23,1998-09
中国药师周举行,1998-09-23,1998-09
迁安对外经贸洽谈会在京举行,1998-09-23,1998-09
京城丰台打出优质地热井,1998-09-23,1998-09
水处理技术与装备国际展在京举行,1998-09-23,1998-09
天然肠衣行业组织在京成立,1998-09-23,1998-09
中国国际化工展在京举行,1998-09-23,1998-09
美国星巴克咖啡公司进入中国,1998-09-23,1998-09
中国德州经贸洽谈会成果丰硕,1998-09-23,1998-09
走私大案警示录,1998-09-23,1998-09
各民主党派中央领导人在京座谈纪念,1998-09-23,1998-09
喜闻下岗职工获『专利』（人民论坛）,1998-09-23,1998-09
李贵鲜会见秘鲁客人,1998-09-23,1998-09
中国版权保护中心成立,1998-09-23,1998-09
欢迎舆论监督  全力解决问题（连续报道）,1998-09-23,1998-09
第八届宣传人大制度好新闻评选揭晓,1998-09-23,1998-09
世行向长江灾区提供紧急贷款,1998-09-23,1998-09
我国铁路三大干线旅客列车将再次提速,1998-09-23,1998-09
安徽防修结合大干水利,1998-09-23,1998-09
高检纪念重建二十周年,1998-09-23,1998-09
明天气象预报,1998-09-23,1998-09
我国致力于图书馆现代化建设,1998-09-23,1998-09
燕归来,1998-09-23,1998-09
喜看“春燕”翩翩归（编余短论）,1998-09-23,1998-09
留学人员参与重庆环保治理,1998-09-23,1998-09
流动人口计生管理新办法出台,1998-09-23,1998-09
乡镇企业干部学院情系乡镇企业,1998-09-23,1998-09
哈工大精简机关人员２０％,1998-09-23,1998-09
中央财大培训机关分流人员,1998-09-23,1998-09
杰出青年学者奖在京颁发,1998-09-23,1998-09
《中医正骨》改月刊,1998-09-23,1998-09
张清智向灾区捐赠国画,1998-09-23,1998-09
世界女“飞人”格·乔依娜猝死,1998-09-23,1998-09
体操要拿十金,1998-09-23,1998-09
一九九九年度体育竞赛全部『上市』,1998-09-23,1998-09
有目标  有气势  有绝招,1998-09-23,1998-09
全民健身好红火,1998-09-23,1998-09
１５００人报名参加中国象棋网络公开赛,1998-09-23,1998-09
悼念杨尚昆逝世,1998-09-23,1998-09
梅内姆总统会见吴邦国,1998-09-23,1998-09
德国会不会换总理,1998-09-23,1998-09
唐家璇会见联大主席和多国领导人,1998-09-23,1998-09
我呼吁各方对话解决分歧,1998-09-23,1998-09
叶利钦签署政府结构组成命令,1998-09-23,1998-09
阿富汗问题八国会议达成谅解,1998-09-23,1998-09
莱索托否认发生政变  南非博茨瓦纳已出兵,1998-09-23,1998-09
柬三党峰会取得积极成果,1998-09-23,1998-09
世界经济重现危机？ 下此断言为时尚早！（专论）,1998-09-23,1998-09
雪域歌舞迷彼岸（通讯）,1998-09-23,1998-09
货币基金组织回顾亚洲金融危机,1998-09-23,1998-09
今不如昔的感叹（通讯）,1998-09-23,1998-09
安南：国际合作对付金融动荡  布莱尔：大国协调改革金融体系,1998-09-23,1998-09
感受知青,1998-09-23,1998-09
舞“文”弄“典”赚钱，该管！,1998-09-23,1998-09
南京机关小车违章频频,1998-09-23,1998-09
邯郸：市委压缩行政开支,1998-09-23,1998-09
长泰：启动勤政建设工程,1998-09-23,1998-09
谨防“挂、靠、要”（一家之言）,1998-09-23,1998-09
送你一片蓝天（朴素人生）,1998-09-23,1998-09
世上还是好人多,1998-09-23,1998-09
车祸无情法官有情,1998-09-23,1998-09
真情写就奇迹,1998-09-23,1998-09
准确把握市场走向及时反映用户需求,1998-09-23,1998-09
为“干部身边一面旗”叫好（读者论坛）,1998-09-23,1998-09
平凡人生写壮歌（光彩一页）,1998-09-23,1998-09
厂长弄虚作假  企业濒临倒闭（监督哨）,1998-09-23,1998-09
“爱心话亭”遭厄运（耳闻目睹）,1998-09-23,1998-09
生活环境与防癌（知识窗）,1998-09-23,1998-09
农民负担何时减下来？,1998-09-23,1998-09
游客投诉有回音（答复反应）,1998-09-23,1998-09
学科技奔小康,1998-09-23,1998-09
为再就业多做贡献,1998-09-23,1998-09
为科技教育事业献身,1998-09-23,1998-09
在困境中振兴国有企业,1998-09-23,1998-09
以攻克白血病为毕生追求,1998-09-23,1998-09
神圣使命永在心中,1998-09-23,1998-09
抗洪抢险不让须眉,1998-09-23,1998-09
有志者事竟成（短评）,1998-09-23,1998-09
学农真的无用吗？,1998-09-23,1998-09
做农村致富的领头人（朋友信箱）,1998-09-23,1998-09
镇委书记的笔记本（普通人的故事）,1998-09-23,1998-09
出国打工：慎迈第一（请您留意）,1998-09-23,1998-09
赞闻过则改（实话实说）,1998-09-23,1998-09
自费订报为乡亲（世相百态）,1998-09-23,1998-09
浅释“三消”症  治疗糖尿病（家庭医疗保健常识９４）,1998-09-23,1998-09
夕阳感怀（人生一得）,1998-09-23,1998-09
不得出售没有中文说明书的商品（事中有法）,1998-09-23,1998-09
并非有意隐瞒病情  发生事故也难获赔（事中有法）,1998-09-23,1998-09
改革开放给中国人民带来巨大实惠（辉煌的20年（二））,1998-09-24,1998-09
面向世界的一步（纪念改革开放２０年难忘第一）,1998-09-24,1998-09
法国总理若斯潘（人物介绍）,1998-09-24,1998-09
多建坝  少建碑（今日谈）,1998-09-24,1998-09
北京重大工程建设拉动经济增长,1998-09-24,1998-09
李鹏会见罗马尼亚参议长,1998-09-24,1998-09
李鹏会见立陶宛客人,1998-09-24,1998-09
广西农民自筹资金修路架桥（新闻简报）,1998-09-24,1998-09
北京地区天气预报,1998-09-24,1998-09
宁夏投资洽谈会落幕,1998-09-24,1998-09
成都国企养老金直发,1998-09-24,1998-09
天津电话用户逾２００万,1998-09-24,1998-09
普兰店修池田保水土,1998-09-24,1998-09
我国经济呈明显回升态势,1998-09-24,1998-09
加强行业价格自律  规范市场竞争秩序,1998-09-24,1998-09
农垦系统力争明年扭亏增盈,1998-09-24,1998-09
京郊秋粮  喜获丰收,1998-09-24,1998-09
加强电视直销广告管理,1998-09-24,1998-09
北京国际旅游文化节开幕,1998-09-24,1998-09
铜墙铁壁锁龙王,1998-09-24,1998-09
太原车站真奇怪  查询车次要收费,1998-09-24,1998-09
治水和治山（编后）,1998-09-24,1998-09
国家反倾销裁决委员会正式成立,1998-09-24,1998-09
近期国内粮价升幅不大（新闻快报）,1998-09-24,1998-09
国际商业设施展览将举行,1998-09-24,1998-09
我国提高征地补偿标准（新闻快报）,1998-09-24,1998-09
“广船国际”获出口卖方信贷１２亿元（新闻快报）,1998-09-24,1998-09
平齐铁路正式抢修开通（新闻快报）,1998-09-24,1998-09
建设部成立住宅产业化办公室,1998-09-24,1998-09
青岛查获利用台湾制造假发票案（新闻快报）,1998-09-24,1998-09
夏邱镇成为北方石材生产基地,1998-09-24,1998-09
自营进出口审批制将改为备案制（新闻快报）,1998-09-24,1998-09
黄山着手解决“夜不见山”状况（新闻快报）,1998-09-24,1998-09
满城对农村党员实行量化管理,1998-09-24,1998-09
宜昌千余名乡镇干部到一线建功立业,1998-09-24,1998-09
参政议政落实处,1998-09-24,1998-09
要服务于依法治国基本方略,1998-09-24,1998-09
新疆军区表彰先进集体和个人,1998-09-24,1998-09
鲜花送英雄（社会扫描）,1998-09-24,1998-09
认真管理党员（漫话）,1998-09-24,1998-09
南阳审判机关努力维护法律公正,1998-09-24,1998-09
淮阴清河公安分局着力提高民警素质,1998-09-24,1998-09
玉山县严查民警违纪案,1998-09-24,1998-09
北京崇文公安分局强化民警培训,1998-09-24,1998-09
齐鲁石化管理部开展党员示范岗活动,1998-09-24,1998-09
元氏县交通局强化内外监督机制,1998-09-24,1998-09
内蒙古团结互助赶建新居,1998-09-24,1998-09
海协与台湾海基会商定具体细节,1998-09-24,1998-09
天然林停止采伐  坡耕地退耕还林,1998-09-24,1998-09
启动源头环保工程  提高水源涵养功能（全面保护长江黄河上游生态环境）,1998-09-24,1998-09
云南∶７３个县市２２日起封锯育林,1998-09-24,1998-09
都来支持江河源头保护（子夜走笔）,1998-09-24,1998-09
科协要真正成为“科技工作者之家”,1998-09-24,1998-09
吴亦侠同志逝世,1998-09-24,1998-09
杨超时同志逝世,1998-09-24,1998-09
『环太平洋论坛九八年会』在沪召开,1998-09-24,1998-09
联合国驻华机构呼吁国际社会援助中国灾区,1998-09-24,1998-09
明天气象预报,1998-09-24,1998-09
迟浩田会见日本客人（友好往来）,1998-09-24,1998-09
彭珮云会见挪威客人（友好往来）,1998-09-24,1998-09
何鲁丽会见埃塞俄比亚客人（友好往来）,1998-09-24,1998-09
百岁医院『活医典』,1998-09-24,1998-09
聚合人才成大业（编余短论）,1998-09-24,1998-09
湖南灾后传染病减少,1998-09-24,1998-09
福州内河水变清,1998-09-24,1998-09
新青岛大学完成实质性合并,1998-09-24,1998-09
莒县文化建设工程扎实,1998-09-24,1998-09
谷城农民文化餐桌丰盛,1998-09-24,1998-09
中法开展空间技术合作,1998-09-24,1998-09
鹰潭科技救灾显威力,1998-09-24,1998-09
『齐鲁石化人』展览在京举行,1998-09-24,1998-09
鄂豫等省开展健康教育,1998-09-24,1998-09
国际华佗学术研讨会举办,1998-09-24,1998-09
天津举办国际中医男科学提高班,1998-09-24,1998-09
医学专家与灾区防疫人员网上谈,1998-09-24,1998-09
唐家璇会晤布总统和多国外长,1998-09-24,1998-09
阿尔及利亚成立总统选举委员会,1998-09-24,1998-09
莱索托局势恶化（综述）,1998-09-24,1998-09
权力分配可以讨论  首相人选不容谈判,1998-09-24,1998-09
多数美国人希望克林顿完成任期,1998-09-24,1998-09
利比亚对审理地点提出异议  马吉德致函国际组织领导人,1998-09-24,1998-09
韩国整肃公职人员,1998-09-24,1998-09
欧盟代表赴俄摸底（综述）,1998-09-24,1998-09
印度重弹先决条件老调,1998-09-24,1998-09
美将向以出售大批战斗机,1998-09-24,1998-09
意警方大规模搜捕黑手党徒,1998-09-24,1998-09
瑞典大选后的政治组合（新闻分析）,1998-09-24,1998-09
又提『托宾税』（经济札记）,1998-09-24,1998-09
循序渐进的改革（通讯）,1998-09-24,1998-09
美宣布再次向朝援粮,1998-09-24,1998-09
美日首脑举行会谈,1998-09-24,1998-09
谋求新的金融体制（通讯）,1998-09-24,1998-09
俄外长：国际合力克服金融危机  意总理：不应停止对俄罗斯援助,1998-09-24,1998-09
韩国：对国际投机资金亮黄牌,1998-09-24,1998-09
美国：廿九年首次财政无赤字,1998-09-24,1998-09
辽宁天润逼平大连万达,1998-09-24,1998-09
“谢加之战”结果是否有效,1998-09-24,1998-09
派小将为主出战亚运会,1998-09-24,1998-09
奥运会外围赛中越缅朝同在一组,1998-09-24,1998-09
全国乒乓球赛多名国手被新秀淘汰,1998-09-24,1998-09
贾拉汉与『临门一脚』,1998-09-24,1998-09
愿绿茵场多些『脊梁』（体坛絮语）,1998-09-24,1998-09
天津举办中国杯国际体操赛,1998-09-24,1998-09
中国女队保二争一  男队力求佳绩,1998-09-24,1998-09
武义  两万山民下山脱贫（打好扶贫攻坚战）,1998-09-24,1998-09
霍邱  五年脱贫八十万人（打好扶贫攻坚战）,1998-09-24,1998-09
赤城  科技兴县脱贫显效,1998-09-24,1998-09
因地制宜，曙光在前（编后小议）,1998-09-24,1998-09
『清白』还需『明白』（农村杂谈）,1998-09-24,1998-09
以禽补夏保增收,1998-09-24,1998-09
山坪塘租赁承包问题不容忽视（来信）,1998-09-24,1998-09
棉暖运漕人（农村新事）,1998-09-24,1998-09
压力下的竞争（地方经济）,1998-09-24,1998-09
养鸡联合体（调查报告）,1998-09-24,1998-09
苦涩的槟榔,1998-09-24,1998-09
忽鸡沟乡实行村务九公开,1998-09-24,1998-09
潜江加强防排灌体系建设,1998-09-24,1998-09
黑甜玉米市场潜力大,1998-09-24,1998-09
『固始鸡』进军全国大市场,1998-09-24,1998-09
灾害与考验（思想纵横）,1998-09-24,1998-09
抗洪抢险中的伟大精神力量,1998-09-24,1998-09
“活化石”变“摇钱树”,1998-09-24,1998-09
设计图纸光盘存储,1998-09-24,1998-09
魔道之争未有穷期（科技杂谈）,1998-09-24,1998-09
情系故土话桑麻（热点寻踪）,1998-09-24,1998-09
求实创新  源远流长,1998-09-24,1998-09
“让因特网相形见绌”（百科博览）,1998-09-24,1998-09
软件不是消耗品,1998-09-24,1998-09
刻画时代的群雕（科海书舟）,1998-09-24,1998-09
印度  下一个软件超级大国（电脑·通信·网络）,1998-09-24,1998-09
网络电话进入ＣＥＲＮＥＴ,1998-09-24,1998-09
『野战厨房』装备部队,1998-09-24,1998-09
电子期刊文献数据建立规范,1998-09-24,1998-09
宏基光驱推陈出新,1998-09-24,1998-09
家庭生物科学馆,1998-09-24,1998-09
『借光』（金台随感）,1998-09-24,1998-09
星夜，部队悄悄撤离……,1998-09-24,1998-09
云天情怀,1998-09-24,1998-09
千里边防铸雄关,1998-09-24,1998-09
龙潭涧揽胜（笔墨山水）,1998-09-24,1998-09
『我的家园』征文启事,1998-09-24,1998-09
农家仔,1998-09-24,1998-09
灾后重建要遵循规律标本兼治,1998-09-25,1998-09
改革开放的胜利  民族精神的丰碑,1998-09-25,1998-09
网箱养鱼富西滨,1998-09-25,1998-09
为厂务公开叫好（今日谈）,1998-09-25,1998-09
尉健行抵达新西兰访问,1998-09-25,1998-09
英国首相将访华,1998-09-25,1998-09
我国综合国力不断增强（辉煌的20年（三））,1998-09-25,1998-09
１９７９—１９９７年中国与世界及主要国家和地区经济增长率比较,1998-09-25,1998-09
朱镕基同若斯潘会谈,1998-09-25,1998-09
北京地区天气预报,1998-09-25,1998-09
改革开放的胜利  民族精神的丰碑,1998-09-25,1998-09
管住自己的人  把好国家的门,1998-09-25,1998-09
出口退税：到位了吗（经济视点）,1998-09-25,1998-09
６０６次列车有关人员被查处（连续报道）,1998-09-25,1998-09
通许小企业成为顶梁柱,1998-09-25,1998-09
深圳经济增长势头强劲（新闻快报）,1998-09-25,1998-09
柳铁拓宽西南出海通道（新闻快报）,1998-09-25,1998-09
移动电话将升至１１位（新闻快报）,1998-09-25,1998-09
江苏铅封加油机显示器（新闻快报）,1998-09-25,1998-09
广东工行支持经济增长（新闻快报）,1998-09-25,1998-09
广西整顿机关作风初见成效,1998-09-25,1998-09
要依法治农  依法兴农,1998-09-25,1998-09
赞『让群众来评定』（漫话）,1998-09-25,1998-09
西藏整治“耳边腐败”,1998-09-25,1998-09
抓紧复查  有错必纠,1998-09-25,1998-09
贵州省军区扶贫攻坚结硕果,1998-09-25,1998-09
传统美德教育研讨会召开,1998-09-25,1998-09
创星级服务  树文明新风,1998-09-25,1998-09
江苏警方破案,1998-09-25,1998-09
全军换发新两证,1998-09-25,1998-09
纪念济南解放５０周年大会举行,1998-09-25,1998-09
武警某部深入学习抗洪精神,1998-09-25,1998-09
济宁市公安局从严治警,1998-09-25,1998-09
杨献志拥军优属捐款近９万,1998-09-25,1998-09
方城三十二名军嫂办企业,1998-09-25,1998-09
多出精品多出人才繁荣发展社会主义文艺,1998-09-25,1998-09
『坎坎伐檀』与人类成熟（人民论坛）,1998-09-25,1998-09
中法关于加强金融合作的联合声明,1998-09-25,1998-09
全国政协要为灾区重建办实事,1998-09-25,1998-09
未来一周天气趋势,1998-09-25,1998-09
中央政府在澳门特区驻军完全符合联合声明和基本法规定,1998-09-25,1998-09
扬子石化职工踊跃献血,1998-09-25,1998-09
国际金融界应倾听中国的声音,1998-09-25,1998-09
中法关于成立农业及农业食品合作委员会的声明,1998-09-25,1998-09
中法商务协议在京签署,1998-09-25,1998-09
香港全国人大代表视察河南结束,1998-09-25,1998-09
葡萄牙将履行对澳门过渡期的一切承诺,1998-09-25,1998-09
澳门同胞继续向内地灾区捐赠款物,1998-09-25,1998-09
若斯潘总理访问中科院,1998-09-25,1998-09
明天气象预报,1998-09-25,1998-09
北京国际钱币博览会将举办,1998-09-25,1998-09
重庆将举行世界旅游日庆祝活动,1998-09-25,1998-09
第四届全国舞蹈比赛将在杭举行,1998-09-25,1998-09
新疆将建民俗风情园,1998-09-25,1998-09
中央电视台春节晚会投标揭晓,1998-09-25,1998-09
出版媒体齐全  图书实用优质,1998-09-25,1998-09
与改革开放同步,1998-09-25,1998-09
观潮闹海,1998-09-25,1998-09
昔日学堂空荡荡  今日读书声朗朗,1998-09-25,1998-09
