称雄亚洲望悉尼,1999-09-06,1999-09
全国足球甲A联赛战罢第二十一轮,1999-09-06,1999-09
全国足球甲A联赛（爱立信）积分榜,1999-09-06,1999-09
亚洲男篮锦标赛排名,1999-09-06,1999-09
我女力士两破世界纪录,1999-09-06,1999-09
卢沟桥醒狮越野跑在京举行,1999-09-06,1999-09
50年奋斗饮誉国际社会,1999-09-06,1999-09
波兰改革中小学教育,1999-09-06,1999-09
四城会乒乓球团体赛结束,1999-09-06,1999-09
依法查私为何三次败诉,1999-09-06,1999-09
为什么要开征利息所得税,1999-09-06,1999-09
我们踩“石轮”,1999-09-06,1999-09
机场方便面开天价,1999-09-06,1999-09
遭遇“革命”,1999-09-06,1999-09
超生缘何成“痼疾”,1999-09-06,1999-09
扩大投资要与产业结构升级结合,1999-09-06,1999-09
财金短波,1999-09-06,1999-09
基金的投资组合,1999-09-06,1999-09
上周股市概览,1999-09-06,1999-09
沪市上周上涨前五名（％）,1999-09-06,1999-09
沪市上周下跌前五名（％）,1999-09-06,1999-09
深市上周上涨前五名（％）,1999-09-06,1999-09
深市上周下跌前五名（％）,1999-09-06,1999-09
企业债券火起来,1999-09-06,1999-09
利息税对股市影响深远,1999-09-06,1999-09
股份制商业银行大有作为,1999-09-06,1999-09
财金短波,1999-09-06,1999-09
天安门广场最烦口香糖,1999-09-06,1999-09
深圳观光巴士进退两难,1999-09-06,1999-09
电话用处越来越多了,1999-09-06,1999-09
王府井变漂亮了,1999-09-06,1999-09
塑料袋  不能太方便,1999-09-06,1999-09
安特：“消毒”先要自身净,1999-09-06,1999-09
燃气热水器售后服务没到家,1999-09-06,1999-09
’99中国国际美发美容节一瞥,1999-09-06,1999-09
电信普遍服务中国还要往前走多远,1999-09-06,1999-09
世界主要国家和电信市场引入竞争前后电话普遍服务情况一览表,1999-09-06,1999-09
国产杀毒软件市场看好,1999-09-06,1999-09
个人站点新动向：大鱼吃小鱼,1999-09-06,1999-09
业内信息,1999-09-06,1999-09
别忘了中西部,1999-09-06,1999-09
如何处理竞争与普遍服务的关系,1999-09-06,1999-09
江泽民主席抵达墨尔本,1999-09-07,1999-09
江主席致国际防盲协会第六届全体大会的贺信,1999-09-07,1999-09
一个中国原则的挑衅者,1999-09-07,1999-09
朱镕基胡锦涛分别会见科特迪瓦总理,1999-09-07,1999-09
伟大的旗帜  光辉的理论,1999-09-07,1999-09
距2000年还有116天,1999-09-07,1999-09
北京地区天气预报,1999-09-07,1999-09
重庆软硬环境综合整改,1999-09-07,1999-09
山西简朴整洁有声有色,1999-09-07,1999-09
合肥  层层落实抓好治安,1999-09-07,1999-09
沈阳  主题鲜明丰富多彩,1999-09-07,1999-09
我看着日照一天天长大,1999-09-07,1999-09
北京2008年奥运会申办委员会成立,1999-09-07,1999-09
极推进电子商务发展和运用,1999-09-07,1999-09
国产奥迪高级轿车下线长春国际汽车博览会开幕,1999-09-07,1999-09
我国节水灌溉成绩斐然,1999-09-07,1999-09
“东药”大船重新浮出水面,1999-09-07,1999-09
积极推进电子商务发展和运用,1999-09-07,1999-09
国产奥迪高级轿车下线,1999-09-07,1999-09
我国节水灌溉成绩斐然,1999-09-07,1999-09
开秤在即话棉价,1999-09-07,1999-09
50年固定资产投资近18万亿,1999-09-07,1999-09
力争到年底实现纺织整体扭亏为盈,1999-09-07,1999-09
短波,1999-09-07,1999-09
中国政府恢复对澳门行使主权倒计时104天,1999-09-07,1999-09
整改结合效果好,1999-09-07,1999-09
提高部分优抚对象抚恤补助标准,1999-09-07,1999-09
中央综治委组织检查组赴八省市检查社会治安,1999-09-07,1999-09
中国社科院表彰优秀期刊,1999-09-07,1999-09
一个中国原则的挑衅者,1999-09-07,1999-09
朱镕基胡锦涛分别会见科特迪瓦总理,1999-09-07,1999-09
朱镕基会见英国前首相希思,1999-09-07,1999-09
向新中国成立五十周年献礼,1999-09-07,1999-09
澳门回归是一国两制构想又一伟大实践,1999-09-07,1999-09
庆澳门回归巨型如意在泉州展出,1999-09-07,1999-09
香港庆祝国庆五十周年活动拉开序幕,1999-09-07,1999-09
任大连市委书记,1999-09-07,1999-09
中国和世界主要城市明日气象预报,1999-09-07,1999-09
国图馆庆精品图书首发,1999-09-07,1999-09
国际防盲协会第六届全体大会在京召开,1999-09-07,1999-09
李岚清会见外国公司代表,1999-09-07,1999-09
孔繁森：领导干部的楷模,1999-09-07,1999-09
马恩华：“社会主义企业家”,1999-09-07,1999-09
奋进的50年———·四川专版·,1999-09-07,1999-09
锦绣天府奏华章,1999-09-07,1999-09
四川农业稳步发展,1999-09-07,1999-09
国民经济成绩斐然,1999-09-07,1999-09
国企改革攻坚新突破,1999-09-07,1999-09
科学技术进入主战场教育事业迎来大振兴,1999-09-07,1999-09
如今蜀道不再难,1999-09-07,1999-09
天府之国西部投资的热土,1999-09-07,1999-09
社会事业蓬勃发展,1999-09-07,1999-09
“治水兴蜀”见实效,1999-09-07,1999-09
巴以第四轮雅典会谈顺利结束,1999-09-07,1999-09
国际短波,1999-09-07,1999-09
春风百花迎嘉宾,1999-09-07,1999-09
埃及总统穆巴拉克遭袭击受轻伤,1999-09-07,1999-09
巴以和谈的重大进展,1999-09-07,1999-09
与中国合作卓有成效,1999-09-07,1999-09
拉美国家呼吁改革国际金融体系,1999-09-07,1999-09
韩政府对大宇强制整改,1999-09-07,1999-09
钱卓与“聪明鼠”,1999-09-07,1999-09
“中华民族圣火”火种抵达北京,1999-09-07,1999-09
体育短讯,1999-09-07,1999-09
新中国进步惊人,1999-09-07,1999-09
与中国合作卓有成效,1999-09-07,1999-09
商业全球化势头正劲,1999-09-07,1999-09
美一些经济学家对美贸易逆差有新观点,1999-09-07,1999-09
韩政府对大宇强制整改,1999-09-07,1999-09
简讯,1999-09-07,1999-09
第八届亚洲攀岩锦标赛结束,1999-09-07,1999-09
三水健力宝杯国际龙舟争霸赛将举行,1999-09-07,1999-09
中国拳协推出全国拳击擂台挑战赛,1999-09-07,1999-09
女双将作为中国网球突破口,1999-09-07,1999-09
乘风破浪会有时,1999-09-07,1999-09
伟大的旗帜  光辉的理论,1999-09-07,1999-09
从全心全意到人民满意,1999-09-07,1999-09
危险！止步！,1999-09-07,1999-09
医院明码限价百姓喜笑颜开,1999-09-07,1999-09
抓“小”见“大”,1999-09-07,1999-09
大漠红柳魂,1999-09-07,1999-09
重实绩聚民心,1999-09-07,1999-09
放飞童心,1999-09-07,1999-09
走进学习时代,1999-09-07,1999-09
呼唤科普创新,1999-09-07,1999-09
真理的火种唤醒民众,1999-09-07,1999-09
《岳阳楼记》  我心中的灯,1999-09-07,1999-09
“集邮的未来在中国”,1999-09-07,1999-09
建立良好的学术规范,1999-09-07,1999-09
江泽民主席抵达堪培拉,1999-09-08,1999-09
加大中澳两国经贸合作力度,1999-09-08,1999-09
党的十五届四中全会9月19日至22日召开,1999-09-08,1999-09
在墨尔本澳中贸易投资研讨会上的演讲,1999-09-08,1999-09
确保2000年度人民日报发行量超过上年,1999-09-08,1999-09
距2000年还有115天,1999-09-08,1999-09
北京地区天气预报,1999-09-08,1999-09
胡锦涛会见国际狮子会代表团,1999-09-08,1999-09
最好的民族政策,1999-09-08,1999-09
最好的民族政策,1999-09-08,1999-09
伟大的人道主义事业,1999-09-08,1999-09
一位在祖国大陆投资的台商投书本报,1999-09-08,1999-09
定州交警树立良好窗口形象,1999-09-08,1999-09
40万地勘大军顺利转为“地方部队”,1999-09-08,1999-09
中国政府恢复对澳门行使主权倒计时103天,1999-09-08,1999-09
杭州市长公开电话成为“民心线”,1999-09-08,1999-09
“铁骑雄师”,1999-09-08,1999-09
黑龙江通报公款大吃大喝案件,1999-09-08,1999-09
海南公开选拔副厅级干部,1999-09-08,1999-09
要闻简讯,1999-09-08,1999-09
中国政府恢复对澳门行使主权倒计时103天,1999-09-08,1999-09
人大常委会开展《义务教育法》执法检查,1999-09-08,1999-09
预防出生缺陷提高人口质量,1999-09-08,1999-09
献身民族教育事业,1999-09-08,1999-09
教育部门社会各界共同努力确保大学生不因经济困难辍学,1999-09-08,1999-09
“视觉第一中国行动”初见成效,1999-09-08,1999-09
金卫网启动新世纪健康工程,1999-09-08,1999-09
北医大人民医院注重医德医风建设,1999-09-08,1999-09
中方对日右翼分子侵犯中国领土主权极为不满,1999-09-08,1999-09
中国记协维权委对此事深表关注,1999-09-08,1999-09
对外友协举行招待会,1999-09-08,1999-09
法国参议院代表团将访华,1999-09-08,1999-09
友好往来,1999-09-08,1999-09
全国产学研联合洽谈会开幕,1999-09-08,1999-09
李登辉把国民党拖向何处？,1999-09-08,1999-09
江泽民主席任免驻外大使,1999-09-08,1999-09
胡锦涛会见科威特客人,1999-09-08,1999-09
李岚清参观中国国际电子商务应用博览会,1999-09-08,1999-09
唐山精神文明建设迈上新台阶,1999-09-08,1999-09
李国安：转战戈壁的模范给水团长,1999-09-08,1999-09
徐虎：在平凡岗位上温暖千万家,1999-09-08,1999-09
迟浩田与科威特副首相会谈,1999-09-08,1999-09
傅全有与几内亚军队总长会谈,1999-09-08,1999-09
友好往来,1999-09-08,1999-09
奋进的50年,1999-09-08,1999-09
农村现代化的发展,1999-09-08,1999-09
城市化的进程,1999-09-08,1999-09
历史的巨变,1999-09-08,1999-09
多种所有制的活力,1999-09-08,1999-09
国有企业的生机,1999-09-08,1999-09
浙江一年,1999-09-08,1999-09
在墨尔本澳中贸易投资研讨会上的演讲,1999-09-08,1999-09
英首相布莱尔会见丁关根,1999-09-08,1999-09
江主席参观澳仿生耳研究所,1999-09-08,1999-09
东帝汶实行紧急状态,1999-09-08,1999-09
促进经贸合作,1999-09-08,1999-09
短讯,1999-09-08,1999-09
日右翼分子公然登上我钓鱼岛,1999-09-08,1999-09
国奥九强赛主场确定上海,1999-09-08,1999-09
中法电视台合办“城市之间”活动受欢迎,1999-09-08,1999-09
国际短波,1999-09-08,1999-09
告诉世界一个真实的中国,1999-09-08,1999-09
金价暴跌  非洲受害,1999-09-08,1999-09
拉美国家共捉千年虫,1999-09-08,1999-09
中法电视台合办“城市之间”活动受欢迎,1999-09-08,1999-09
四城会乒乓球赛又决出三金,1999-09-08,1999-09
先普及  后发展,1999-09-08,1999-09
克拉玛依模式,1999-09-08,1999-09
科学研究,1999-09-08,1999-09
意优先发展南方经济,1999-09-08,1999-09
株洲乡镇人大为经济发展出力,1999-09-08,1999-09
各地人大报刊集锦,1999-09-08,1999-09
更新观念依法行政,1999-09-08,1999-09
突出重点抓要害,1999-09-08,1999-09
构筑“阳光工程”,1999-09-08,1999-09
一九九九，中国网上大追逃,1999-09-08,1999-09
船头办案,1999-09-08,1999-09
全力追逃维护法纪,1999-09-08,1999-09
塞外雄鹰,1999-09-08,1999-09
河北省涉县警方追逃成效显著,1999-09-08,1999-09
法官老马,1999-09-08,1999-09
第九届宣传人民代表大会制度好新闻获奖作品名单,1999-09-08,1999-09
人大新闻是个“富矿”,1999-09-08,1999-09
傲立潮头谱赞歌,1999-09-08,1999-09
孩子也有隐私权,1999-09-08,1999-09
村民擒匪记,1999-09-08,1999-09
我们都有的权利,1999-09-08,1999-09
隐私权，不容侵犯,1999-09-08,1999-09
请尊重我的“个人空间”,1999-09-08,1999-09
村民擒匪记,1999-09-08,1999-09
借新还旧保证人应否承担保证责任？,1999-09-08,1999-09
简讯,1999-09-08,1999-09
公开栏里明白账,1999-09-08,1999-09
新事集纳,1999-09-08,1999-09
合同不应是一纸空文,1999-09-08,1999-09
推倒违章楼再现武汉关,1999-09-08,1999-09
湖北省江陵县随意克扣乡镇教师工资,1999-09-08,1999-09
学会依法维护权利,1999-09-08,1999-09
治安岗亭咋成了杂货店,1999-09-08,1999-09
“赤膊工程”跌落砖块砸出人命理当赔偿,1999-09-08,1999-09
监督就要“敢”字当头,1999-09-08,1999-09
加强邮购市场监管,1999-09-08,1999-09
为民多办一件事心中才少一份忧,1999-09-08,1999-09
江泽民主席阐述我国在台湾问题和中国加入世贸组织问题上的原则立场,1999-09-09,1999-09
江主席与霍华德总理举行会谈,1999-09-09,1999-09
继续在澳大利亚进行国事访问,1999-09-09,1999-09
永远做党和人民的忠诚卫士,1999-09-09,1999-09
李鹏委员长会见尼泊尔前首相,1999-09-09,1999-09
八月工业生产同比增百分之九点五,1999-09-09,1999-09
距2000年还有114天,1999-09-09,1999-09
北京地区天气预报,1999-09-09,1999-09
汪阿金一家50年,1999-09-09,1999-09
银行贷款松紧掌握基本适度企业合理贷款需求能够满足,1999-09-09,1999-09
促进证券市场健康发展法人配售股票有章可循,1999-09-09,1999-09
农业部发出通知切实抓好今年秋冬种工作,1999-09-09,1999-09
有关部门联合出台利用外资新政策,1999-09-09,1999-09
一项顺应市场经济大潮的改革举措,1999-09-09,1999-09
法人配售股票有章可循,1999-09-09,1999-09
切实抓好今年秋冬种工作,1999-09-09,1999-09
第三届中国投资贸易洽谈会举行,1999-09-09,1999-09
当“永久牌”清洁工,1999-09-09,1999-09
辽宁省卫生防疫站违反规定黄山开会被查处,1999-09-09,1999-09
做好《国务院公报》宣传订阅工作,1999-09-09,1999-09
民航云南公安局严打贩运野生保护动植物,1999-09-09,1999-09
丽江将举办国际东巴文化艺术节,1999-09-09,1999-09
短波,1999-09-09,1999-09
中国政府恢复对澳门行使主权倒计时102天,1999-09-09,1999-09
拉萨  修公路  植草坪,1999-09-09,1999-09
广州  治脏乱  塑形象,1999-09-09,1999-09
兰州  架彩灯  绿城市,1999-09-09,1999-09
杭州  拆违建  增绿地,1999-09-09,1999-09
珠海  创文明  迎回归,1999-09-09,1999-09
白哈巴村的“保护神”,1999-09-09,1999-09
国庆50周年民进会员书法美术摄影展在京开幕,1999-09-09,1999-09
台湾人民利益的背叛者,1999-09-09,1999-09
全国教育工会庆祝教师节暨表彰大会召开,1999-09-09,1999-09
在思想品德课和思想政治课教学中卓有建树,1999-09-09,1999-09
友好往来,1999-09-09,1999-09
“中国武警十大忠诚卫士”颁奖大会举行,1999-09-09,1999-09
李岚清分别会见美国坦桑尼亚客人,1999-09-09,1999-09
吴天祥：基层党员干部的榜样,1999-09-09,1999-09
谭彦：无私奉献的“铁法官”,1999-09-09,1999-09
“我爱你，中国”,1999-09-09,1999-09
在思想品德课和思想政治课教学中卓有建树,1999-09-09,1999-09
李岚清看望老教授考察教师住房建设,1999-09-09,1999-09
友好往来,1999-09-09,1999-09
奋进的50年———·河北专版·,1999-09-09,1999-09
展京畿雄风  创燕赵辉煌,1999-09-09,1999-09
构筑立体“黄金道”,1999-09-09,1999-09
春华秋实50年,1999-09-09,1999-09
让法治秩序尽快确立,1999-09-09,1999-09
“龙”行天下,1999-09-09,1999-09
明珠璀璨耀燕赵,1999-09-09,1999-09
从发展的桎梏到腾飞的翅膀,1999-09-09,1999-09
江主席出席霍华德总理午宴,1999-09-09,1999-09
亚太经合组织高官会议闭幕,1999-09-09,1999-09
国际短波,1999-09-09,1999-09
江主席会见澳华侨华人代表,1999-09-09,1999-09
王冶坪参观澳华幼儿园,1999-09-09,1999-09
共绘合作蓝图,1999-09-09,1999-09
美中首脑会晤将是两国关系新起点,1999-09-09,1999-09
朝鲜重视社会文化生活,1999-09-09,1999-09
简讯,1999-09-09,1999-09
主动出击  抢占阵地,1999-09-09,1999-09
“破冰者”的祝福,1999-09-09,1999-09
拉美国际金融会议闭幕,1999-09-09,1999-09
希腊发生强烈地震,1999-09-09,1999-09
东亚经济步入复苏轨道,1999-09-09,1999-09
办好城运盛会  促进全民健身,1999-09-09,1999-09
北大追认登山遇难同学为优秀团员,1999-09-09,1999-09
四城会乒乓球赛落幕,1999-09-09,1999-09
世界信鸽锦标赛将在北京举行,1999-09-09,1999-09
亚足联与国际足联就世界杯赛席位问题达成协议,1999-09-09,1999-09
关于澳门问题的历史考察,1999-09-09,1999-09
商品房用户的烦恼,1999-09-09,1999-09
农家房别成“豆腐渣”,1999-09-09,1999-09
勇于反思己过,1999-09-09,1999-09
大中专毕业生为何“脱岗”？,1999-09-09,1999-09
企业不应冷落党务干部,1999-09-09,1999-09
南昌火车站广场周边环境脏乱差,1999-09-09,1999-09
儿女要善待老人,1999-09-09,1999-09
瓜果飘香西海固,1999-09-09,1999-09
四面八方,1999-09-09,1999-09
让市场说了算,1999-09-09,1999-09
让“原”字号农产品增值增效,1999-09-09,1999-09
生姜蔬菜富南逄,1999-09-09,1999-09
采得花儿销东瀛映日荷花也生财,1999-09-09,1999-09
变复杂为简单“傻瓜技术”俏内乡,1999-09-09,1999-09
干部拼上一腔心血  果农甩掉一头冷汗,1999-09-09,1999-09
全国职工学习邓小平理论知识竞赛试题,1999-09-09,1999-09
携手同心建边城,1999-09-09,1999-09
村民权益不能损害,1999-09-09,1999-09
跨越,1999-09-10,1999-09
江泽民主席继续在悉尼访问,1999-09-10,1999-09
国家图书馆揭牌,1999-09-10,1999-09
第六届民运会火炬终交仪式在京举行,1999-09-10,1999-09
距2000年还有113天,1999-09-10,1999-09
北京地区天气预报,1999-09-10,1999-09
妈妈眼里的共和国,1999-09-10,1999-09
在共和国光荣榜上,1999-09-10,1999-09
实事求是群众路线是我们的命根子,1999-09-10,1999-09
在共和国光荣榜上,1999-09-10,1999-09
吴仪就改善投资环境与港澳台工商界代表座谈,1999-09-10,1999-09
飞利浦努力开拓中国市场,1999-09-10,1999-09
新版人民币一百元券发行准备工作就绪,1999-09-10,1999-09
财政部发出紧急通知要求各地认真落实调整收入分配政策各项措施,1999-09-10,1999-09
西门子在华投资企业又添新丁,1999-09-10,1999-09
上海银行接受国际金融公司参股投资,1999-09-10,1999-09
对闲置资产和非经营性资产进行盘活重组铁十六局变负担为财富,1999-09-10,1999-09
跨越,1999-09-10,1999-09
解决夫妻两地分居问题有重大突破,1999-09-10,1999-09
860名农村中小学优秀教师榜上有名,1999-09-10,1999-09
患相依存  平等互关爱,1999-09-10,1999-09
一千五百首都高校教师  将喜迁新居,1999-09-10,1999-09
北极科考队返抵上海,1999-09-10,1999-09
信息技术三大展火爆京城,1999-09-10,1999-09
清华等高校确保经济困难新生入学,1999-09-10,1999-09
庆祝教师节音乐会举行,1999-09-10,1999-09
万方数据捐建希望小学,1999-09-10,1999-09
首届“烛光奖”颁奖,1999-09-10,1999-09
要闻短讯,1999-09-10,1999-09
沈阳千名教师喜迁新居,1999-09-10,1999-09
天火·圣火,1999-09-10,1999-09
北京云居寺千年石经回藏地宫,1999-09-10,1999-09
世界围棋公开赛常昊王磊闯入八强,1999-09-10,1999-09
中国男排再获亚锦赛冠军,1999-09-10,1999-09
全国足球甲A联赛第二十二轮辽宁队又尝败绩,1999-09-10,1999-09
纪念孔子诞辰2550年座谈会在京举行,1999-09-10,1999-09
庆祝新中国和人民政协成立五十周年,1999-09-10,1999-09
第六届世界大城市首脑会议明年在京举行,1999-09-10,1999-09
澳门特区政府筹组正在顺利有序进行,1999-09-10,1999-09
李岚清会见经济合作与发展组织秘书长,1999-09-10,1999-09
简讯,1999-09-10,1999-09
武汉古城新貌喜迎国庆,1999-09-10,1999-09
贵阳绿色广场国庆开放,1999-09-10,1999-09
济南十大工程即将竣工,1999-09-10,1999-09
石家庄群众吃上“放心肉”,1999-09-10,1999-09
各地文化活动丰富多彩,1999-09-10,1999-09
不可掉以轻心,1999-09-10,1999-09
李素丽：乘客的“贴心人”,1999-09-10,1999-09
王廷江：致富的“领头人”,1999-09-10,1999-09
中国内政不容干涉,1999-09-10,1999-09
明天气象预报,1999-09-10,1999-09
奋进的50年,1999-09-10,1999-09
科教兴晋,1999-09-10,1999-09
托起太阳,1999-09-10,1999-09
支柱擎天,1999-09-10,1999-09
春色满园,1999-09-10,1999-09
城乡新貌,1999-09-10,1999-09
对外开放,1999-09-10,1999-09
三晋大地换新颜,1999-09-10,1999-09
江泽民主席继续在悉尼访问,1999-09-10,1999-09
国际短波,1999-09-10,1999-09
新西兰外长议长接受我记者采访,1999-09-10,1999-09
万语千言赤子情,1999-09-10,1999-09
西方不等于国际社会,1999-09-10,1999-09
以议会批准以巴新协议,1999-09-10,1999-09
唐家璇会见奥尔布赖特,1999-09-10,1999-09
石广生会见美国贸易代表,1999-09-10,1999-09
国际短波,1999-09-10,1999-09
发展美中关系十分重要,1999-09-10,1999-09
世界技术创新大潮迭起,1999-09-10,1999-09
发达国家与发展中国家科技投资差距大,1999-09-10,1999-09
自主创新  迎接挑战,1999-09-10,1999-09
风云百年,1999-09-10,1999-09
永不熄灭的明灯,1999-09-10,1999-09
七十七台优秀剧目向国庆献礼,1999-09-10,1999-09
京城社区“夕阳红”,1999-09-10,1999-09
老有所乐,1999-09-10,1999-09
爷爷奶奶新爱好,1999-09-10,1999-09
广东舞蹈学校的老师为时代而舞蹈,1999-09-10,1999-09
北京军区战友歌舞团向国庆献礼,1999-09-10,1999-09
中国影协召开座谈会盛赞“精品选”光盘,1999-09-10,1999-09
电视娱乐节目大家谈②,1999-09-10,1999-09
电影频道展播优秀影片,1999-09-10,1999-09
为了明天的回顾,1999-09-10,1999-09
白洋淀的时代风情,1999-09-10,1999-09
川剧《金子》放异彩,1999-09-10,1999-09
南国红豆发新枝,1999-09-10,1999-09
红色历史与传奇人生,1999-09-10,1999-09
亚洲艺术世纪盛会,1999-09-10,1999-09
张艺谋、孟欣策划青春汤灿“祝福祖国”,1999-09-10,1999-09
花鼓戏进京《闹龙舟》,1999-09-10,1999-09
电视系列片《天安门》拍竣,1999-09-10,1999-09
经典合唱唱百年,1999-09-10,1999-09
《开国领袖毛泽东》幕后二三事,1999-09-10,1999-09
让人诗意地栖居在大地上,1999-09-10,1999-09
一帘幽梦几窗景,1999-09-10,1999-09
生命之花,1999-09-10,1999-09
画坛风景线,1999-09-10,1999-09
无悔的选择,1999-09-10,1999-09
艺文短波,1999-09-10,1999-09
不沉的高原,1999-09-10,1999-09
谋猷筹画  恂恂笃行,1999-09-10,1999-09
无悔的选择,1999-09-10,1999-09
清华园的荷花池,1999-09-10,1999-09
以实际行动迎接新中国成立五十周年,1999-09-11,1999-09
江主席抵凯恩斯继续在澳大利亚访问,1999-09-11,1999-09
我军南京广州战区举行诸军兵种联合渡海登陆作战实兵演习,1999-09-11,1999-09
克林顿希望同中国恢复建设性会谈,1999-09-11,1999-09
首都教育界举行庆祝教师节茶话会,1999-09-11,1999-09
李鹏会见西欧联盟议会议长,1999-09-11,1999-09
期待着庄严的历史时刻,1999-09-11,1999-09
距2000年还有112天,1999-09-11,1999-09
北京地区天气预报,1999-09-11,1999-09
我们为什么不承诺放弃使用武力,1999-09-11,1999-09
外交部发言人发表谈话,1999-09-11,1999-09
李鹏会见阿塞拜疆总检察长,1999-09-11,1999-09
舞剧《苏武》再吹高雅之风,1999-09-11,1999-09
布赫会见匈牙利政府文化代表团,1999-09-11,1999-09
鸽哨阵阵报归讯,1999-09-11,1999-09
中国政府恢复对澳门行使主权倒计时100天,1999-09-11,1999-09
吴金印：乡镇党委书记的榜样,1999-09-11,1999-09
邱娥国：一脉真情暖一方人心,1999-09-11,1999-09
我国新修地方志完成大半,1999-09-11,1999-09
国际检察官联合会第四届年会暨会员大会闭幕,1999-09-11,1999-09
迟浩田会见西欧联盟议会客人,1999-09-11,1999-09
何鲁丽会见澳大利亚客人,1999-09-11,1999-09
乐声歌声抒心曲,1999-09-11,1999-09
一些国家重申一个中国政策,1999-09-11,1999-09
联合国将为世界和平发挥重要作用下届联大将接纳三个新会员国,1999-09-11,1999-09
第四届非统组织特别首脑会议在利比亚闭幕,1999-09-11,1999-09
美中断与印尼军事关系,1999-09-11,1999-09
美商会为我灾区建小学,1999-09-11,1999-09
巴拿马领导人赞扬我改革开放,1999-09-11,1999-09
中新关系的里程碑,1999-09-11,1999-09
相隔万里有知音,1999-09-11,1999-09
亚佩克部长级会议闭幕,1999-09-11,1999-09
巴批准以第一阶段撤军图,1999-09-11,1999-09
朝鲜庆祝国庆51周年,1999-09-11,1999-09
孕育希望开创未来,1999-09-11,1999-09
全国场地自行车锦标赛在京开赛,1999-09-11,1999-09
全国城市运动会今日开幕,1999-09-11,1999-09
四城会组委会举行第二次会议,1999-09-11,1999-09
参加天津体操世锦赛中国队阵容确定,1999-09-11,1999-09
国产自行车赛车样品展示会举行,1999-09-11,1999-09
国际羽联最新世界排名,1999-09-11,1999-09
全国足球甲A联赛（爱立信）积分榜,1999-09-11,1999-09
喜迎新中国成立五十周年,1999-09-11,1999-09
满城尽说城运会,1999-09-11,1999-09
国际羽联最新世界排名中国选手列三项榜首,1999-09-11,1999-09
邯钢打出世纪牌,1999-09-11,1999-09
重点项目简介,1999-09-11,1999-09
奋进的50年－－邯郸市成就展示,1999-09-11,1999-09
城建迈向现代都市,1999-09-11,1999-09
邯郸从历史走向未来,1999-09-11,1999-09
邯钢打出世纪牌,1999-09-11,1999-09
农业腾起“十五条龙”,1999-09-11,1999-09
各类教育蓬勃发展,1999-09-11,1999-09
十颗星光耀农家门庭,1999-09-11,1999-09
市场建设  拉动城乡经济,1999-09-11,1999-09
社会保险  筑起社会“安全网”,1999-09-11,1999-09
文化事业  欣欣向荣,1999-09-11,1999-09
刊头摄影,1999-09-11,1999-09
扩大内需与人口再生产,1999-09-11,1999-09
政治经济学一个世纪的传播与发展,1999-09-11,1999-09
有效需求不足：分析与对策,1999-09-11,1999-09
现阶段居民消费行为的特征,1999-09-11,1999-09
“世纪中国走势丛书”,1999-09-11,1999-09
《国际企业经营与管理》,1999-09-11,1999-09
《贸易走向未来》,1999-09-11,1999-09
高校扩招：民所愿国所需,1999-09-11,1999-09
心血熔铸教育丰碑,1999-09-11,1999-09
年轻的事业,1999-09-11,1999-09
大连开发区工会的做法,1999-09-11,1999-09
