万亩荒滩变绿洲（新闻摄影比赛）,2000-09-01,2000-09
李鹏委员长在千年议长大会上的讲话,2000-09-01,2000-09
是真学还是假学（今日谈）,2000-09-01,2000-09
运用价格杠杆促进西部开发,2000-09-01,2000-09
农民增收：仍是重中之重,2000-09-01,2000-09
千年议长大会隆重开幕李鹏委员长在会上发表重要讲话,2000-09-01,2000-09
家庭农场成为石河子新的增长点,2000-09-01,2000-09
北京地区天气预报,2000-09-01,2000-09
高度重视高校“三讲”教育,2000-09-01,2000-09
运用价格杠杆促进西部开发,2000-09-01,2000-09
农民增收：仍是重中之重,2000-09-01,2000-09
沈阳：“押房买车”（经济风景线）,2000-09-01,2000-09
大庆：告别“火炬”（经济风景线）,2000-09-01,2000-09
昆铁：“网运分离”（经济风景线）,2000-09-01,2000-09
京蒙对口帮扶90万农牧民受益,2000-09-01,2000-09
清河羊绒在竞争中领先,2000-09-01,2000-09
成本优势（编后）,2000-09-01,2000-09
让甜蜜的事业甜起来(经济视点),2000-09-01,2000-09
我禁入阿根廷及塔吉克斯坦偶蹄动物,2000-09-01,2000-09
中国移动推出奥运快讯服务,2000-09-01,2000-09
无线寻呼对航空导航干扰减少,2000-09-01,2000-09
前7月来华入境旅游“满堂红”,2000-09-01,2000-09
工行开通BtoC在线支付系统,2000-09-01,2000-09
首批矿产储量评估师获资格证书,2000-09-01,2000-09
西安将举办投资与贸易洽谈会,2000-09-01,2000-09
国内一家智能化酒店开业,2000-09-01,2000-09
湖北永和安门业公司以新取胜,2000-09-01,2000-09
中行为松下提供三十亿元信贷,2000-09-01,2000-09
网易提供新一代搜索引擎服务,2000-09-01,2000-09
高效节能秸秆气化炉研制成功,2000-09-01,2000-09
临沂电业局向多种经营要效益,2000-09-01,2000-09
崇高的使命,2000-09-01,2000-09
吉林市法院系统执结率大幅上升,2000-09-01,2000-09
《粟裕传》出版座谈会在京举行,2000-09-01,2000-09
辽宁提高后备干部素质,2000-09-01,2000-09
福州整治干部变相收受“红包”,2000-09-01,2000-09
《公开选拔领导干部试题选萃》出版,2000-09-01,2000-09
全国社会治安综合治理好新闻颁奖,2000-09-01,2000-09
石家庄靠科技保道路畅通,2000-09-01,2000-09
新闻摄影比赛,2000-09-01,2000-09
明天气象预报,2000-09-01,2000-09
有感于“浙江精神”（人民论坛）,2000-09-01,2000-09
江主席接受四国大使国书,2000-09-01,2000-09
四川宁夏领导干部观看《生死抉择》,2000-09-01,2000-09
保护性开发西部文化遗产和资源,2000-09-01,2000-09
西藏少儿艺术团赴拉美演出,2000-09-01,2000-09
贾庆林会见美国客人（友好往来）,2000-09-01,2000-09
许嘉璐会见德国客人（友好往来）,2000-09-01,2000-09
宋健会见日本外相（友好往来）,2000-09-01,2000-09
傅全有同韩国参联会主席会谈（友好往来）,2000-09-01,2000-09
世界公共卫生联盟国际大会将在京举行,2000-09-01,2000-09
徐匡迪会见台湾亲民党参访团,2000-09-01,2000-09
省长座谈纳诤言,2000-09-01,2000-09
羚锐杯现场短新闻征文揭晓,2000-09-01,2000-09
曾征同志逝世,2000-09-01,2000-09
中国江苏（常熟）首届服装服饰博览会下月举行,2000-09-01,2000-09
对外友协和中越友协庆祝越南国庆,2000-09-01,2000-09
承德举办国际旅游投资洽谈会,2000-09-01,2000-09
中宣部等五部委举行形势报告会,2000-09-01,2000-09
边陲大漠赏“绿珠”(中华环保世纪行·西部开发生态行),2000-09-01,2000-09
老山汉墓有望于9月底开棺,2000-09-01,2000-09
社科学者研讨经济全球化,2000-09-01,2000-09
科学补钙高层研讨会举行,2000-09-01,2000-09
“中国人”网站推出奥运专栏,2000-09-01,2000-09
海峡两岸出版社相互转让版权,2000-09-01,2000-09
王占君新作《清太宗》出版,2000-09-01,2000-09
开阔眼界“西北行”,2000-09-01,2000-09
中外图书版权贸易达2.5万项,2000-09-01,2000-09
新修中小学教材与大纲今秋启用,2000-09-01,2000-09
海南师院斥资百万揽贤才,2000-09-01,2000-09
上海中小学课业簿册四分之一不合格,2000-09-01,2000-09
科技部制定西部开发科技工作意见,2000-09-01,2000-09
李鹏委员长在千年议长大会上的讲话,2000-09-01,2000-09
李鹏会见基辛格博士,2000-09-01,2000-09
李鹏会见加蓬国民议长,2000-09-01,2000-09
李鹏分别会见澳法南三国议长,2000-09-01,2000-09
李鹏会见法国国民议长,2000-09-01,2000-09
克什米尔和平新前景（国际论坛）,2000-09-01,2000-09
波兰总统竞选全面展开（综述）,2000-09-01,2000-09
智利总统会见李铁映,2000-09-01,2000-09
欧盟重申支持巴建国,2000-09-01,2000-09
吉总统强调与中国加强合作,2000-09-01,2000-09
德重判新纳粹杀人犯,2000-09-01,2000-09
古抗议美拒发入境签证,2000-09-01,2000-09
法努力实现与利关系正常化,2000-09-01,2000-09
冰岛重新考虑加入欧盟,2000-09-01,2000-09
土军清除宗教极端分子,2000-09-01,2000-09
千年议长大会（资料）,2000-09-01,2000-09
今年欧洲在欧美相互购并活动中唱主角,2000-09-01,2000-09
三菱汽车两本账（经济札记）,2000-09-01,2000-09
新世纪呼唤理解与沟通（通讯）,2000-09-01,2000-09
欧元跌至历史新低欧洲央行提高利率,2000-09-01,2000-09
日本提出信息技术发展规划五年内赶上美国,2000-09-01,2000-09
俄研制高空灭火系统,2000-09-01,2000-09
纽约市场油价创新高,2000-09-01,2000-09
德国将建立互联网过滤系统,2000-09-01,2000-09
津巴布韦加快土改,2000-09-01,2000-09
机场“历险”记（欧洲之旅）,2000-09-01,2000-09
东非奋力抗旱,2000-09-01,2000-09
办学体制的重要变革,2000-09-01,2000-09
苏州大学加快高科技成果产业化,2000-09-01,2000-09
家庭教育不容忽视(教海月谈),2000-09-01,2000-09
给学生平等的受教育权利,2000-09-01,2000-09
高校教学和科研应统一,2000-09-01,2000-09
专家学者纪念义和团运动100周年（短讯一束）,2000-09-01,2000-09
宋庆龄基金会获捐赠（短讯一束）,2000-09-01,2000-09
河南师大暑期“三下乡”活动有声有色（短讯一束）,2000-09-01,2000-09
青少年暑期看什么（短讯一束）,2000-09-01,2000-09
南昌师范附小开展“五红”教育（短讯一束）,2000-09-01,2000-09
确保减负不反弹,2000-09-01,2000-09
宁夏旅游火,2000-09-01,2000-09
香格里拉“十一”推出超值特惠,2000-09-01,2000-09
装修：我家像你家？（新视窗）,2000-09-01,2000-09
广告云山雾罩补钙须防误区(生活提示),2000-09-01,2000-09
我不想当专家(周未闲话),2000-09-01,2000-09
“打电话”中大奖？,2000-09-01,2000-09
广告咋能如此诱导？（消费信箱）,2000-09-01,2000-09
京城推新线邀你玩个够（旅游指南）,2000-09-01,2000-09
肯德基在华有了首家加盟店（时尚快车）,2000-09-01,2000-09
第二战场赛前扫描,2000-09-01,2000-09
法国力争金牌创纪录,2000-09-01,2000-09
奥运金牌块块要拼,2000-09-01,2000-09
马俊仁多巴争朝夕,2000-09-01,2000-09
平常心赴奥运严阳（读者寄语）,2000-09-01,2000-09
秋水小练兵,2000-09-01,2000-09
德国保住第一集团位置,2000-09-01,2000-09
澳大利亚渴望自留20金,2000-09-01,2000-09
退休后的卡翁达（现场采访）,2000-09-01,2000-09
远东一家人（域外散记）,2000-09-01,2000-09
西班牙的酒馆,2000-09-01,2000-09
月琴,2000-09-01,2000-09
钱包找到了（友谊之花）,2000-09-01,2000-09
幸运之邦,2000-09-01,2000-09
“江南水乡”—达县九龙湖（九州揽胜）,2000-09-01,2000-09
清新优美《火箭兵的梦》,2000-09-01,2000-09
小百花再次进京献艺,2000-09-01,2000-09
“秀”在哪里？（快人快语）,2000-09-01,2000-09
时代的精品《生死抉择》（看台人语）,2000-09-01,2000-09
该让古装戏歇歇了（看台人语）,2000-09-01,2000-09
“挨铡刀的”是谁？（看台人语）,2000-09-01,2000-09
“长大当坏蛋”敲警钟（看台人语）,2000-09-01,2000-09
“史丹莫”杯动漫画大赛揭晓,2000-09-01,2000-09
打开音乐之门再出新意汤沐海率国交首度亮相,2000-09-01,2000-09
北京市电视艺术“春燕奖”揭晓,2000-09-01,2000-09
电视剧《关怀》讲述“急诊室故事”,2000-09-01,2000-09
深见东州中日文化研究出版基金捐赠在京举行,2000-09-01,2000-09
石家庄整顿治理取得成效（电子游戏厅治理见闻）,2000-09-01,2000-09
张俊以：《豪迈英雄》伴国奥健儿出征,2000-09-01,2000-09
《旅奥一家人》奥运期间播出,2000-09-01,2000-09
上学了,2000-09-02,2000-09
“中国资源二号”卫星发射成功,2000-09-02,2000-09
国企：一鼓作气决战决胜,2000-09-02,2000-09
“三紧贴”推动酒钢创一流,2000-09-02,2000-09
全党要认真落实“三个代表”重要思想,2000-09-02,2000-09
让喇叭听着顺耳些(今日谈),2000-09-02,2000-09
新《大气污染防治法》实施,2000-09-02,2000-09
全国普通邮件全面提速,2000-09-02,2000-09
国内速度最快集群式计算机问世(特快专递),2000-09-02,2000-09
二○○○年乌洽会开幕（新闻简报）,2000-09-02,2000-09
二○○○年拉萨雪顿节闭幕（新闻简报）,2000-09-02,2000-09
北京地区天气预报,2000-09-02,2000-09
全党要认真落实“三个代表”重要思想,2000-09-02,2000-09
严厉打击传销和变相传销,2000-09-02,2000-09
新修改的《产品质量法》正式实施,2000-09-02,2000-09
国家林业局将派出督查组督办大要案,2000-09-02,2000-09
全军高级领导干部学习邓小平理论轮训班开学,2000-09-02,2000-09
省部级干部实施西部大开发战略专题研究班开学,2000-09-02,2000-09
“贵州文化活动周”在京举行,2000-09-02,2000-09
迟浩田会见韩国参联会主席（友好往来）,2000-09-02,2000-09
王忠禹会见日本客人（友好往来）,2000-09-02,2000-09
张克辉会见台湾企业家经贸考察团（友好往来）,2000-09-02,2000-09
唐家璇看望西哈努克国王（友好往来）,2000-09-02,2000-09
何厚铧结束访新返回澳门（友好往来）,2000-09-02,2000-09
供销总社要求加强新棉收购工作,2000-09-02,2000-09
爱尔兰副总理将访华,2000-09-02,2000-09
我女警官首次赴联合国总部执行任务,2000-09-02,2000-09
西安警方破获一起跨省诈骗案,2000-09-02,2000-09
浦东新区7万民兵成为两个文明建设生力军,2000-09-02,2000-09
长江上游发生沉船事件,2000-09-02,2000-09
台湾台中东北发生5级地震,2000-09-02,2000-09
明天气象预报,2000-09-02,2000-09
好事多磨,2000-09-02,2000-09
团结交流合作（通讯）,2000-09-02,2000-09
李鹏会见俄国家杜马主席,2000-09-02,2000-09
李鹏会见菲参众两院议长,2000-09-02,2000-09
冰岛热烈欢迎李鹏委员长,2000-09-02,2000-09
宗教领袖和平千年大会闭幕,2000-09-02,2000-09
南美国家首脑会议开幕,2000-09-02,2000-09
克林顿决定暂不部署NMD,2000-09-02,2000-09
秘鲁在探索中前进（出访归来）,2000-09-02,2000-09
朝韩第二次部长级会谈达成协议,2000-09-02,2000-09
法公布协和空难调查报告,2000-09-02,2000-09
李鹏分别会见印英埃加四国议长,2000-09-02,2000-09
中国青年足球队负于日本队,2000-09-02,2000-09
颐和园世界文化遗产标志牌石碑揭幕,2000-09-02,2000-09
首届内地新疆高中班开学,2000-09-02,2000-09
特困生的“爱心通道”,2000-09-02,2000-09
河南全力帮扶困难大学生,2000-09-02,2000-09
西宁为高寒地区军队子女就读设食宿站,2000-09-02,2000-09
山西考察干部媒体征求意见,2000-09-02,2000-09
建行工行再推助学贷款,2000-09-02,2000-09
萨马兰奇认为北京是申办奥运的强大竞争者,2000-09-02,2000-09
北京市召开申奥工作动员大会,2000-09-02,2000-09
周鹤洋三胜李昌镐,2000-09-02,2000-09
中国奥运记者获中国电信支持,2000-09-02,2000-09
全国新闻界乒乓球赛在贵州结束,2000-09-02,2000-09
《百名中国体育记者自述》将出版,2000-09-02,2000-09
新华社创办奥运快报,2000-09-02,2000-09
国际棋联主席纵论国际象棋,2000-09-02,2000-09
中国足球队胜泰国队,2000-09-02,2000-09
保护知识产权推动科技创新,2000-09-02,2000-09
情系第二故乡(人物春秋),2000-09-02,2000-09
西部开发中的文化选择,2000-09-02,2000-09
民歌演唱为什么“千人一声”(直言录),2000-09-02,2000-09
我看歌词创作(文化信箱),2000-09-02,2000-09
回想老艺术家(本月话题·演艺人的文化素养⑤),2000-09-02,2000-09
这样考核比较全面(本月话题·演艺人的文化素养⑤),2000-09-02,2000-09
素养是血脉(本月话题·演艺人的文化素养⑤),2000-09-02,2000-09
六千套绝版发行中华世纪坛水晶金模问世,2000-09-02,2000-09
木雕《彩虹金集》赠送中国艺术节,2000-09-02,2000-09
回首“纪录中国”,2000-09-02,2000-09
京胡与交响乐协奏,2000-09-02,2000-09
海峡两岸京剧名家将共度中秋夜,2000-09-02,2000-09
中国歌舞团演新作,2000-09-02,2000-09
读书天地,2000-09-02,2000-09
传记《张闻天》出版（纪念张闻天诞辰一百周年）,2000-09-02,2000-09
披露日军侵华暴行的新书,2000-09-02,2000-09
世界古代文明的新认识（重点新书）,2000-09-02,2000-09
建构友谊之桥,2000-09-02,2000-09
专家荐书,2000-09-02,2000-09
“游牧新疆”文化考察活动启动,2000-09-02,2000-09
“现代名家艺术随笔”简介,2000-09-02,2000-09
童心爱心汇成诗泉,2000-09-02,2000-09
简讯,2000-09-02,2000-09
周而复《长城万里图》在日本发行日文版,2000-09-02,2000-09
戴于吾艺术歌曲集出版,2000-09-02,2000-09
张晓路的大路歌（大地之子）,2000-09-02,2000-09
高空攻擂,2000-09-02,2000-09
卡拉奇哨所（走进西部）,2000-09-02,2000-09
“伙头军”罗生春！,2000-09-02,2000-09
荷塘一夜雨（中国画）,2000-09-02,2000-09
享受和平（乐凯之光）,2000-09-02,2000-09
大地书影,2000-09-02,2000-09
华居三问（金台随感）,2000-09-02,2000-09
绿色的北京老城,2000-09-02,2000-09
鹁鸪声声,2000-09-02,2000-09
阿里高原（走进西部）,2000-09-02,2000-09
山里茅草菌（多味斋）,2000-09-02,2000-09
为老龄读者出好书,2000-09-02,2000-09
巴林草原散文笔会（艺文短波）,2000-09-02,2000-09
漫画艺术馆开馆暨大学生漫画颁奖（艺文短波）,2000-09-02,2000-09
“东方美神”仿制品通过专家鉴定（艺文短波）,2000-09-02,2000-09
新闻摄影比赛,2000-09-03,2000-09
李鹏委员长抵达雷克雅未克,2000-09-03,2000-09
国民经济：抓住转机 持续增长,2000-09-03,2000-09
尉健行会见日本客人,2000-09-03,2000-09
私企招劳模想到的（今日谈）,2000-09-03,2000-09
天津开发区出现增资热潮,2000-09-03,2000-09
辽宁省政府机关审批事项减少一半,2000-09-03,2000-09
VTS系统通过专家鉴定（新闻简报）,2000-09-03,2000-09
117名志愿者贵州扶贫（新闻简报）,2000-09-03,2000-09
拉萨引资突破四亿元（新闻简报）,2000-09-03,2000-09
海军广场在大连落成（新闻简报）,2000-09-03,2000-09
山西利用雨季加快造林,2000-09-03,2000-09
北京地区天气预报,2000-09-03,2000-09
千年议长大会闭幕,2000-09-03,2000-09
各地采取措施加强和改进党校工作,2000-09-03,2000-09
要充分发挥妇女在西部大开发中的作用,2000-09-03,2000-09
第十二届西交会暨伏羲文化旅游节举办,2000-09-03,2000-09
就美国总统宣布决定暂不部署国家导弹防御系统一事外交部发言人发表谈话,2000-09-03,2000-09
孙孚凌会见日本客人,2000-09-03,2000-09
第九届世界公共卫生联盟大会召开,2000-09-03,2000-09
江苏省暨南京市各界人士纪念抗战胜利55周年,2000-09-03,2000-09
武警部队捐资助“春蕾”,2000-09-03,2000-09
李鹏分别会见三国议长,2000-09-03,2000-09
李鹏会见纽约华侨华人、留学生和我驻美机构代表,2000-09-03,2000-09
赞扬中国政府经济管理有方,2000-09-03,2000-09
普京积极评价美推迟部署NMD,2000-09-03,2000-09
中美友好是大局,2000-09-03,2000-09
挖沙抛石水道何堪（耳闻目睹）,2000-09-03,2000-09
莫给舆论监督设关卡（读者论坛）,2000-09-03,2000-09
行政机构还未消肿事业单位已经膨胀(观察台),2000-09-03,2000-09
临沭排污石梁河水库（呼吁）,2000-09-03,2000-09
一对子女升大学 全家乐无钱设宴谢老师 父母愁（各地报刊读者来信摘编）,2000-09-03,2000-09
电力设施遭破坏网点收购是诱因（监督哨）,2000-09-03,2000-09
不是“派送”是骗局提醒读者莫上当（监督哨）,2000-09-03,2000-09
离休证件不算数部队干部住店难（监督哨）,2000-09-03,2000-09
基层卫生院以药抵账当止,2000-09-03,2000-09
请医生把字写清楚（各地报刊读者来信摘编）,2000-09-03,2000-09
一“进”一“出”富延庆,2000-09-03,2000-09
借助山水做文章（新闻追踪）,2000-09-03,2000-09
蔬菜水果闯市场,2000-09-03,2000-09
北京全面推行乡镇政务公开,2000-09-03,2000-09
德州市大幅度合并乡镇,2000-09-03,2000-09
郑州500棵梧桐大迁移,2000-09-03,2000-09
原长治市委常委王虎林被“双开”,2000-09-03,2000-09
大连水产学校乱收费被查处,2000-09-03,2000-09
兴安盟创办家庭生态林场,2000-09-03,2000-09
辽宁公安人员赴三亚打击传销,2000-09-03,2000-09
西藏贡嘎县九千农民走四方,2000-09-03,2000-09
哈尔滨成立城市综合执法队,2000-09-03,2000-09
李鹏会见冰岛总统格里姆松,2000-09-04,2000-09
积极运用先进信息技术 努力建设廉洁高效政府,2000-09-04,2000-09
献身国防教育事业的典范,2000-09-04,2000-09
唱响民族大团结旋律抓住西部大开发机遇,2000-09-04,2000-09
李鹏会见冰岛总理奥德松,2000-09-04,2000-09
第六届全国大学生运动会开幕来自33个代表团的2841名运动员参赛,2000-09-04,2000-09
着眼于未来(短评),2000-09-04,2000-09
本报多种形式报道奥运,2000-09-04,2000-09
李鹏委员长将顺访白俄罗斯,2000-09-04,2000-09
北京地区天气预报,2000-09-04,2000-09
积极运用先进信息技术 努力建设廉洁高效政府,2000-09-04,2000-09
唱响民族大团结旋律抓住西部大开发机遇,2000-09-04,2000-09
神延铁路开始铺轨架梁,2000-09-04,2000-09
我国首家互联网金融平台开通,2000-09-04,2000-09
延安中行实现银行卡与储蓄网点联网,2000-09-04,2000-09
上海建行开发消费贷款新品种,2000-09-04,2000-09
元氏地税局打击偷漏税有新招,2000-09-04,2000-09
“汽修迷”尚玉东三项成果获国家专利,2000-09-04,2000-09
口岸电子执法系统亮相（经济视点）,2000-09-04,2000-09
福建四个行业扭亏为盈,2000-09-04,2000-09
内蒙古退耕还草锁风沙,2000-09-04,2000-09
云南农村经济快速发展,2000-09-04,2000-09
武汉高新技术产业迅猛增长,2000-09-04,2000-09
延安 赚了“票子”保了“被子”（农业结构调整撷英）,2000-09-04,2000-09
西汉正街成为“中国建材第一市”,2000-09-04,2000-09
河北桃林口水库竣工,2000-09-04,2000-09
全国清真食品展销会暨第二届中华名小吃认定活动在宁夏举办,2000-09-04,2000-09
成都出租车该管管了（记者来信）,2000-09-04,2000-09
献身国防教育事业的典范,2000-09-04,2000-09
闽侯“万千百十”活动促党建（加强和改进思想政治工作）,2000-09-04,2000-09
保定“家庭应急中心”受欢迎（加强和改进思想政治工作）,2000-09-04,2000-09
芷江宣教干部进农家（加强和改进思想政治工作）,2000-09-04,2000-09
特殊艺术：百花园中绽新蕾,2000-09-04,2000-09
莫让“教训”成“叫训”(漫话),2000-09-04,2000-09
兴化两千党员私企建功,2000-09-04,2000-09
淄博私企党组织逾两百,2000-09-04,2000-09
我军首套职工职业技能鉴定培训教材下发,2000-09-04,2000-09
华北军工积极推进武器装备科研生产改革,2000-09-04,2000-09
枞阳思想政治工作生动活泼,2000-09-04,2000-09
武警上海总队实施“百对助学解困工程”,2000-09-04,2000-09
凌海公路段党员带头凝心聚力,2000-09-04,2000-09
东海舰队航空兵热心安置随军家属,2000-09-04,2000-09
江苏省委授予任国庆“优秀援藏干部”称号,2000-09-04,2000-09
奉节移民落户福建,2000-09-04,2000-09
为有源头活水来,2000-09-04,2000-09
《沧海》在沈阳演出获成功,2000-09-04,2000-09
福州民居发生大火,2000-09-04,2000-09
喜看部分知识分子富起来（人民论坛）,2000-09-04,2000-09
煤城打出旅游牌,2000-09-04,2000-09
西藏畜牧业快速健康发展,2000-09-04,2000-09
关怀送给特困生,2000-09-04,2000-09
新疆各族军民携手共建稳定繁荣边疆,2000-09-04,2000-09
西藏自治区领导人会见泰国新闻代表团,2000-09-04,2000-09
明天气象预报,2000-09-04,2000-09
以申办促发展以发展助申办,2000-09-04,2000-09
亚青足球赛我队初战告捷,2000-09-04,2000-09
“长江小小科学家”活动颁奖,2000-09-04,2000-09
联想集团并购赢时通公司,2000-09-04,2000-09
农科院为贵州农业培训干部,2000-09-04,2000-09
文物鉴赏家王世襄以书会友,2000-09-04,2000-09
“麦当劳”资助西部希望小学,2000-09-04,2000-09
小心虚假招生广告蒙人（记者来信）,2000-09-04,2000-09
百余高新技术企业落户清华科技园,2000-09-04,2000-09
唐河制定科技综合示范县建设规划,2000-09-04,2000-09
国产IT品牌占据重要市场地位,2000-09-04,2000-09
全国攀岩精英赛结束,2000-09-04,2000-09
奥运村开村,2000-09-04,2000-09
北京体育大学欢送奥运健儿,2000-09-04,2000-09
神力集团为中国举重队壮行,2000-09-04,2000-09
海峡两岸高校赛木球,2000-09-04,2000-09
国际象棋世界杯第三轮激战叶江川击败肖特,2000-09-04,2000-09
四国足球锦标赛中国队夺得冠军,2000-09-04,2000-09
北京国际自行车赛第二赛段战罢我国选手肖业谌获第二名,2000-09-04,2000-09
安踏奥运主题作品征集活动开始,2000-09-04,2000-09
象棋南北擂台赛又战一轮,2000-09-04,2000-09
给新疆文物一份关爱(文物保护世纪行),2000-09-04,2000-09
务实协作共商大计（通讯）,2000-09-04,2000-09
印尼政府同亚齐独运达成新协议,2000-09-04,2000-09
李鹏做客冰岛朋友家(国外特写),2000-09-04,2000-09
卡塔尔提设想解除对伊制裁,2000-09-04,2000-09
普京抵日访问,2000-09-04,2000-09
韩称与朝合作应“双赢”,2000-09-04,2000-09
南联盟冲破封锁初见成效(综述),2000-09-04,2000-09
南非通过反种族歧视方案,2000-09-04,2000-09
越南庆祝建国55周年,2000-09-04,2000-09
俄成立联邦国务委员会,2000-09-04,2000-09
阿拉法特重申收复东耶,2000-09-04,2000-09
给政策有措施重实效(他山之石),2000-09-04,2000-09
有运气也要靠努力（欧洲之旅）,2000-09-04,2000-09
南共体贸易协定生效,2000-09-04,2000-09
全球变暖威胁动植物生存,2000-09-04,2000-09
蒙古大力发展经济（综述）,2000-09-04,2000-09
美国为中国民乐拍电视片,2000-09-04,2000-09
贪杯实属无奈基因变异作怪,2000-09-04,2000-09
中德举办防洪研讨会,2000-09-04,2000-09
新加坡电脑犯罪上升,2000-09-04,2000-09
啤酒业，开始大重组？,2000-09-04,2000-09
珠啤：靠实力打天下,2000-09-04,2000-09
青啤：不仅要大还要做强,2000-09-04,2000-09
野猪·群居鼠·彩电（下乡手记（53））,2000-09-04,2000-09
燕啤：不惧竞争,2000-09-04,2000-09
坚定不移地发展经济适用住房(观点),2000-09-04,2000-09
庆铃竞技者：不畏艰难险阻(新车风采),2000-09-04,2000-09
远见未来 后来居上,2000-09-04,2000-09
清洁汽车要重视燃油品质（七嘴八舌）,2000-09-04,2000-09
标签制度与税收杠杆（他山之石）,2000-09-04,2000-09
国产安全气囊千呼万唤始出来,2000-09-04,2000-09
天津夏利大幅降价（业内信息）,2000-09-04,2000-09
上海通用首家通过QS—9000评审（业内信息）,2000-09-04,2000-09
宝马展台展车获最高评价（业内信息）,2000-09-04,2000-09
丰田开发柴油车用新催化剂系统（业内信息）,2000-09-04,2000-09
3升路波3．3万公里耗油不足800升（业内信息）,2000-09-04,2000-09
清洁汽油国际研讨会在沪举行（业内信息）,2000-09-04,2000-09
上半年我国计算机和通讯类产品热销,2000-09-04,2000-09
新经济时代：你看得住人才吗？（焦点）,2000-09-04,2000-09
新经济咋那么赚钱？（业内时评）,2000-09-04,2000-09
农民对农话有“四盼”（来信）,2000-09-04,2000-09
未来的电子政府,2000-09-04,2000-09
异地上网可使用漫游上网卡,2000-09-04,2000-09
首届中国移动电话及网络技术研讨会召开,2000-09-04,2000-09
石油天然气电子商贸网站将问世,2000-09-04,2000-09
中国首部数字高清晰度电视剧采用Sony设备,2000-09-04,2000-09
阿尔卡特新款手机即将上市,2000-09-04,2000-09
我国上半年信息产业增长迅猛,2000-09-04,2000-09
中国电子最大基地在昌平奠基,2000-09-04,2000-09
TCL王牌杯《产品质量法》有奖知识竞赛答题卡,2000-09-04,2000-09
竞赛说明,2000-09-04,2000-09
关于新修改的《产品质量法》知识介绍,2000-09-04,2000-09
TCL王牌杯《产品质量法》有奖知识竞赛试题,2000-09-04,2000-09
江泽民主席离开北京,2000-09-05,2000-09
李鹏会晤立陶宛总统阿达姆库斯,2000-09-05,2000-09
江泽民接受美国记者采访,2000-09-05,2000-09
把口号变成行动(今日谈),2000-09-05,2000-09
李瑞环会见葡萄牙最高法院院长,2000-09-05,2000-09
社区是个大家庭,2000-09-05,2000-09
把矛盾化解在基层,2000-09-05,2000-09
北京地区天气预报,2000-09-05,2000-09
三大金融监管部门建立联席会议制度,2000-09-05,2000-09
广发行为中国奥运代表团制专卡,2000-09-05,2000-09
