四川全面推进乡镇干部作风转变,2000-09-18,2000-09
空降兵初步建成诸兵种合成现代化部队,2000-09-18,2000-09
中国科协2000年学术年会开幕,2000-09-18,2000-09
印度海军舰艇编队访问上海,2000-09-18,2000-09
第三批全国创建文明景区示范点确定,2000-09-18,2000-09
“中华和钟”微缩双音编钟研制成功,2000-09-18,2000-09
第六届中国艺术节筹备工作就绪,2000-09-18,2000-09
首都举行抗战胜利五十五周年纪念演出,2000-09-18,2000-09
我国陆地地理中心测定国心塔矗立甘肃董家岭,2000-09-18,2000-09
创文明景区促旅游发展,2000-09-18,2000-09
坚持经济发展和人口控制两手抓,2000-09-18,2000-09
几内亚总理访问大连,2000-09-18,2000-09
四川志愿军老战士赴朝访问,2000-09-18,2000-09
明天气象预报,2000-09-18,2000-09
正确看待“新闻自由”（人民论坛）,2000-09-18,2000-09
我国首创猪白细胞干扰素,2000-09-18,2000-09
亚欧海底光缆全线开通,2000-09-18,2000-09
三联书店进军电子出版业,2000-09-18,2000-09
西部生态环境遥感调查启动,2000-09-18,2000-09
全国推普周朗诵演唱会举行,2000-09-18,2000-09
王府井新华书店将重张开业,2000-09-18,2000-09
“世纪文化论坛”开始举办,2000-09-18,2000-09
“动感之都”影展举行,2000-09-18,2000-09
香港信善奖助学金在京颁发,2000-09-18,2000-09
杉杉西服通过环境标志认证,2000-09-18,2000-09
神州数码致力银行电子化,2000-09-18,2000-09
国际信息奥赛筹备就绪,2000-09-18,2000-09
国图：10年修复敦煌遗书,2000-09-18,2000-09
海尔“世界运动会”,2000-09-18,2000-09
北京崇文区计生工作服务于民,2000-09-18,2000-09
科技催生工厂化农业,2000-09-18,2000-09
历史岂容篡改,2000-09-18,2000-09
菲军怒剿绑匪（国际热线）,2000-09-18,2000-09
委内瑞拉内政外交新举措（综述）,2000-09-18,2000-09
卡斯特罗会见唐家璇,2000-09-18,2000-09
韩朝将举行国防部长会谈,2000-09-18,2000-09
克林顿会见邓朴方,2000-09-18,2000-09
我驻美使馆欢迎残疾人艺术团,2000-09-18,2000-09
菲总统要求安全解救人质,2000-09-18,2000-09
墨隆重纪念独立节,2000-09-18,2000-09
俄就美拒绝查看其潜艇发表声明,2000-09-18,2000-09
欧盟重申谴责奥右翼政党,2000-09-18,2000-09
巴以近日恢复最终地位谈判,2000-09-18,2000-09
科研合作造福两国（通讯）,2000-09-18,2000-09
“走近中国”文化展在纽约闭幕,2000-09-18,2000-09
为“走出去”开放战略提供金融支持（中国企业走向世界）,2000-09-18,2000-09
旅美科学家关注西部大开发,2000-09-18,2000-09
苏州园林在美落成,2000-09-18,2000-09
中罗签署文化合作计划,2000-09-18,2000-09
世界宗教和平文化大会举行,2000-09-18,2000-09
奥运金牌榜,2000-09-18,2000-09
端正心态 超越自我（奥运报道）,2000-09-18,2000-09
18日观赛指南：○举重看杨霞○射击瞧高娥○体操望男团,2000-09-18,2000-09
求静心 陶璐娜怡神养性（奥运报道）,2000-09-18,2000-09
贺首金 何振梁难掩真情（奥运报道）,2000-09-18,2000-09
中国奥委会在悉尼举行盛大招待会,2000-09-18,2000-09
出梦入梦,2000-09-18,2000-09
昂扬之气动地来（悉尼走笔）,2000-09-18,2000-09
中国女足逼平美国队（五环热线）,2000-09-18,2000-09
中国女垒前敌无弱旅,2000-09-18,2000-09
十七日冠军榜,2000-09-18,2000-09
罗举重队药检不过关被逐出奥运会,2000-09-18,2000-09
国家体育总局等电贺中国体育代表团获首枚金牌,2000-09-18,2000-09
不凡的平局,2000-09-18,2000-09
到农村去！,2000-09-18,2000-09
“白色”不禁“绿色”难兴,2000-09-18,2000-09
坐等优惠，不是个事儿（下乡手记（55））,2000-09-18,2000-09
新经济和中国发展路径（观点）,2000-09-18,2000-09
利率改革迈新步(经济茶座),2000-09-18,2000-09
电脑和网络成为欧美发达国家职员的主要办公用品,2000-09-18,2000-09
中国电信业，持续发展面临巨大挑战（焦点）,2000-09-18,2000-09
注意力本身就是财富（新知视界）,2000-09-18,2000-09
赛迪网推出中文垂直搜索引擎,2000-09-18,2000-09
西门子移动网站开通,2000-09-18,2000-09
中国艺术网召开《艺术在二十一世纪的发展》研讨会,2000-09-18,2000-09
“网上农民”王宗康为何下网,2000-09-18,2000-09
首钢发展IC产业成绩喜人,2000-09-18,2000-09
我电子信息产品规模今年将占世界9％,2000-09-18,2000-09
爆炸声过隐患仍存,2000-09-18,2000-09
安全隐患隐在何处（头条竞赛）,2000-09-18,2000-09
舍得在安全生产上花钱（各抒己见）,2000-09-18,2000-09
标本兼治常抓不懈务求实效,2000-09-18,2000-09
7、8两月工矿企业重、特大伤亡事故简况,2000-09-18,2000-09
安全生产：综合管理要与专项监察结合（企业论坛）,2000-09-18,2000-09
河南送变电建设公司：施工机具投入大,2000-09-18,2000-09
上海石化：积极推行安全评价,2000-09-18,2000-09
辽河油田：建立安全责任保证体系,2000-09-18,2000-09
中国健儿奥运连连报捷体操射击举重勇夺三金,2000-09-19,2000-09
无边大漠写新绿,2000-09-19,2000-09
银广夏的启示,2000-09-19,2000-09
李鹏继续在俄罗斯访问,2000-09-19,2000-09
《中国人民抗日军事政治大学史》出版发行,2000-09-19,2000-09
朱镕基会见日本前首相村山富市,2000-09-19,2000-09
加强基层建设 强化法律监督,2000-09-19,2000-09
李岚清会见基里巴斯客人,2000-09-19,2000-09
北京地区天气预报,2000-09-19,2000-09
无边大漠写新绿,2000-09-19,2000-09
要采取有力措施做好抗旱救灾工作,2000-09-19,2000-09
助学贷款：一路走好（经济视点）,2000-09-19,2000-09
社会保险基金收支规模过5000亿元,2000-09-19,2000-09
十家知名企业联合发表绿色宣言,2000-09-19,2000-09
不得限制排斥外埠药品进入本地销售,2000-09-19,2000-09
建行重点发展个人住房贷款,2000-09-19,2000-09
电信资费调整听证会举行,2000-09-19,2000-09
唐山燕泉啤酒厂抓管理见成效,2000-09-19,2000-09
改革中的创新与探索,2000-09-19,2000-09
法官培训工作要系统化规范化,2000-09-19,2000-09
武警内蒙古总队积极维护边疆繁荣稳定,2000-09-19,2000-09
贵阳两名特大贪污罪犯被判死刑,2000-09-19,2000-09
西服时装市场抽查八成多合格（曝光台）,2000-09-19,2000-09
《中国人民抗日军事政治大学史》出版发行,2000-09-19,2000-09
加强基层建设 强化法律监督,2000-09-19,2000-09
福建省级党政机构精简行政编制,2000-09-19,2000-09
江西整体推进干部人事制度改革,2000-09-19,2000-09
“医药代表”可以休矣！（子夜走笔）,2000-09-19,2000-09
何厚铧赴日本访问,2000-09-19,2000-09
处方背后的交易,2000-09-19,2000-09
李铁映会见日本客人（友好住来）,2000-09-19,2000-09
迟浩田与哥伦比亚国防部长会谈（友好住来）,2000-09-19,2000-09
贾庆林会见马来西亚客人（友好住来）,2000-09-19,2000-09
铁木尔·达瓦买提会见爱尔兰客人（友好住来）,2000-09-19,2000-09
中联部代表团离京赴三国访问（友好住来）,2000-09-19,2000-09
王克与俄罗斯国防部副部长会谈（友好住来）,2000-09-19,2000-09
厦门特大走私案在福建陆续开庭审理,2000-09-19,2000-09
铺设西部开发的科技之路,2000-09-19,2000-09
夏商周断代工程通过验收,2000-09-19,2000-09
西藏撑起“绿色保护伞”,2000-09-19,2000-09
北京百万读者游书海,2000-09-19,2000-09
西安建设新材料科技园,2000-09-19,2000-09
哈工大“机器人”走出实验室,2000-09-19,2000-09
从沙进人退到人进沙退（保卫绿色·关注森林）,2000-09-19,2000-09
补钙当心补出病,2000-09-19,2000-09
农村青年期望“双高”,2000-09-19,2000-09
索马里要求联大通过援助决议,2000-09-19,2000-09
毛里求斯组成新政府,2000-09-19,2000-09
印尼总统撤换警察总长,2000-09-19,2000-09
西“埃塔”一号头目在法落网,2000-09-19,2000-09
规模空前的交流（中华文化美国行）,2000-09-19,2000-09
吴仪同冰岛外长会谈,2000-09-19,2000-09
首届亚洲国家政党会议开幕,2000-09-19,2000-09
尼中关系研讨会在尼举行,2000-09-19,2000-09
藤森宣布将重新大选,2000-09-19,2000-09
巴重申难民回归权利,2000-09-19,2000-09
科总统住宅遭袭,2000-09-19,2000-09
南联盟大选进入冲刺阶段（综述）,2000-09-19,2000-09
理解 友谊 共识 合作（述评）,2000-09-19,2000-09
长盛不衰的“穆拉诺”（欧洲之旅）,2000-09-19,2000-09
韩开始修复“京义线”,2000-09-19,2000-09
埃总统呼吁控制人口增长,2000-09-19,2000-09
欧盟东扩需800亿欧元,2000-09-19,2000-09
走向新世纪的联合国中国(专论),2000-09-19,2000-09
众志成城,2000-09-19,2000-09
奥运金牌榜,2000-09-19,2000-09
18日冠军榜,2000-09-19,2000-09
“金牌献给全国人民”(悉尼走笔),2000-09-19,2000-09
金风拂处水霞明（奥运报道）,2000-09-19,2000-09
林幽传绝响,2000-09-19,2000-09
草绿映春阳,2000-09-19,2000-09
情急之下硬闯关（记者采访故事）,2000-09-19,2000-09
19日赛事指南,2000-09-19,2000-09
按下葫芦起了瓢（记者采访故事）,2000-09-19,2000-09
中国女排难进奥运会小组赛前两名,2000-09-19,2000-09
中国羽毛球选手全线告捷,2000-09-19,2000-09
奥运短波,2000-09-19,2000-09
苏州河正在变清（记者观察）,2000-09-19,2000-09
生日领养一棵树,2000-09-19,2000-09
卧龙大熊猫猛添小宝宝,2000-09-19,2000-09
百岁老人的小黑板（人生舞台）,2000-09-19,2000-09
博士也打“钟点工”（地方热线）,2000-09-19,2000-09
“垃圾岛”还须再治本,2000-09-19,2000-09
从“挑灯夜战”说开去（采访随想）,2000-09-19,2000-09
感受美好,2000-09-19,2000-09
“盐田港速度”,2000-09-19,2000-09
高科技支柱,2000-09-19,2000-09
求知的人们,2000-09-19,2000-09
人才与竞争,2000-09-19,2000-09
感受深圳,2000-09-19,2000-09
致富思源,2000-09-19,2000-09
中国女大力士奥运会再“举”两金,2000-09-20,2000-09
李鹏委员长回到北京,2000-09-20,2000-09
北京地区天气预报,2000-09-20,2000-09
我国综合国力显著提高(辉煌“九五”),2000-09-20,2000-09
宏观调控取得积极成果(辉煌“九五”),2000-09-20,2000-09
老英雄住进新房子(“九五”新事),2000-09-20,2000-09
朱镕基会见日本日中议联代表团,2000-09-20,2000-09
意大利众议长将访华,2000-09-20,2000-09
越南总理将访华,2000-09-20,2000-09
转基因杂交棉“南抗3号”试验成功,2000-09-20,2000-09
伟大的里程碑,2000-09-20,2000-09
南京金秋经贸洽谈会拉开帷幕,2000-09-20,2000-09
中英签署NVQ联合颁证合作协议,2000-09-20,2000-09
广深铁路全部实现电气化,2000-09-20,2000-09
大连修建城市轻轨铁路,2000-09-20,2000-09
北京贝尔承建铁道部七号信令网,2000-09-20,2000-09
企业家孵化器国际论坛举办,2000-09-20,2000-09
中经网信息服务研讨会举办,2000-09-20,2000-09
中金公司研讨国企改革,2000-09-20,2000-09
黎明杯超模大赛中国选拔赛举行,2000-09-20,2000-09
亳州中医药交易会结硕果,2000-09-20,2000-09
意大利乔万尼发布秋冬服装,2000-09-20,2000-09
辉煌的五年卓越的成就,2000-09-20,2000-09
旅游者每天可获得出游信息,2000-09-20,2000-09
农业普查结果引起广泛关注,2000-09-20,2000-09
我国成品油价格今年第六次上调,2000-09-20,2000-09
建行与平安保险进行电子商务合作,2000-09-20,2000-09
研究旅游市场有效开发资源,2000-09-20,2000-09
沂水“十要四送”树新风（思想政治工作在基层）,2000-09-20,2000-09
赣县“十进家门”播春风（思想政治工作在基层）,2000-09-20,2000-09
焦作“四职一纠”正行风（思想政治工作在基层）,2000-09-20,2000-09
切实加强和改进法院思想政治工作,2000-09-20,2000-09
当好人防“侦察兵”（我与人防）,2000-09-20,2000-09
把堵源截流摆在禁毒工作首位,2000-09-20,2000-09
华北预备役部队全面推进正规化建设,2000-09-20,2000-09
西峡建立组工干部人才储备库,2000-09-20,2000-09
大同交警四大队自觉接受群众监督,2000-09-20,2000-09
认真总结移民外迁试点经验切实做好库区移民外迁工作,2000-09-20,2000-09
铲除形式主义（人民论坛）,2000-09-20,2000-09
中央党校举行《学习时报》创办周年座谈会,2000-09-20,2000-09
国家体育总局颁布《健身气功管理暂行办法》,2000-09-20,2000-09
“中国与非洲：挑战二十一世纪”国际研讨会举行,2000-09-20,2000-09
第20届国际大坝会议召开,2000-09-20,2000-09
迟浩田会见俄国防部副部长（友好往来）,2000-09-20,2000-09
贾庆林会见新加坡客人（友好往来）,2000-09-20,2000-09
贾庆林会见微软公司首席执行官兼总裁（友好往来）,2000-09-20,2000-09
贾庆林会见厄瓜多尔客人（友好往来）,2000-09-20,2000-09
宋健会见日本客人（友好往来）,2000-09-20,2000-09
李贵鲜会见保加利亚客人（友好往来）,2000-09-20,2000-09
傅全有会见哥伦比亚客人（友好往来）,2000-09-20,2000-09
中国西部城市开发战略研讨会召开,2000-09-20,2000-09
卫生部赴乌鲁木齐医疗专家组返京,2000-09-20,2000-09
首届中老年广场舞蹈大赛在威海开幕,2000-09-20,2000-09
“这段历史必须正视！”,2000-09-20,2000-09
岳麓山下崛起大学科技园,2000-09-20,2000-09
中国杂技家协会第四次全代会举行,2000-09-20,2000-09
绘制第四张“名片”,2000-09-20,2000-09
世界华人雕塑园在青岛揭幕,2000-09-20,2000-09
贫困地区学生获赠健齿用品,2000-09-20,2000-09
首家医药电子商务平台建成,2000-09-20,2000-09
黄祥杰书法展在京举行,2000-09-20,2000-09
沉重的文化命题（文物保护世纪行）,2000-09-20,2000-09
艰难自学十五载古稀圆了大学梦,2000-09-20,2000-09
超级稻“两优培九”获大面积推广,2000-09-20,2000-09
加强交流促进合作,2000-09-20,2000-09
李鹏委员长回到北京,2000-09-20,2000-09
西班牙首相会见李长春,2000-09-20,2000-09
授予李鹏名誉博士学位,2000-09-20,2000-09
美前总统卡特会见曾建徽,2000-09-20,2000-09
首届亚洲国家政党会议闭幕,2000-09-20,2000-09
南缺席审判北约国家领导人,2000-09-20,2000-09
以决定暂停与巴方和谈,2000-09-20,2000-09
俄将打捞沉没潜艇和死难者,2000-09-20,2000-09
伊斯兰堡发生炸弹爆炸事件,2000-09-20,2000-09
“中国文化真神奇！”（国外特写）,2000-09-20,2000-09
世界经济增长加快,2000-09-20,2000-09
欧佩克油价上周回落,2000-09-20,2000-09
油价与油税（经济札记）,2000-09-20,2000-09
气候变暖危及人类（综述）,2000-09-20,2000-09
西藏少儿艺术团在巴西演出成功,2000-09-20,2000-09
德总理号召全民“上网”,2000-09-20,2000-09
土耳其发生恶性车祸,2000-09-20,2000-09
奥运金牌榜,2000-09-20,2000-09
9月19日冠军榜,2000-09-20,2000-09
英风激红袖 剑气贯长虹,2000-09-20,2000-09
中国女子体操队首获团体铜牌,2000-09-20,2000-09
遭逢恶战,2000-09-20,2000-09
中国羽毛球队作好打硬仗的准备,2000-09-20,2000-09
逼上梁山,2000-09-20,2000-09
强中夺铜亦可喜（悉尼走笔）,2000-09-20,2000-09
千言凝一语 万里寄心香,2000-09-20,2000-09
新芳尚待雪霜砺（奥运报道）,2000-09-20,2000-09
上下半场两开反攻战中国男篮击败新西兰（五环热线）,2000-09-20,2000-09
首都警察大比武,2000-09-20,2000-09
彩票不该卖给孩子,2000-09-20,2000-09
中国彩票呼唤立法（立法聚焦）,2000-09-20,2000-09
“刘涌事件”的启示(法治论苑),2000-09-20,2000-09
买股票还是买彩票？,2000-09-20,2000-09
执法违法 严重失职,2000-09-20,2000-09
考好了！再当法官……,2000-09-20,2000-09
川藏筑路兵,2000-09-20,2000-09
开创公诉工作新局面,2000-09-20,2000-09
查处“黄赌毒”严防“灯下黑”（法制纵横）,2000-09-20,2000-09
林坤松：半月三次擒劫匪(执法者风采),2000-09-20,2000-09
罪恶的欲望（大要案写真）,2000-09-20,2000-09
铁肩担道义,2000-09-20,2000-09
河北省唐山市海上110显神威（政法短波）,2000-09-20,2000-09
内蒙古边防总队官兵救助警嫂（政法短波）,2000-09-20,2000-09
“逃犯”克星,2000-09-20,2000-09
“述评”激起千层浪（民主建设巡礼）,2000-09-20,2000-09
代表向选民述职好（民主评说）,2000-09-20,2000-09
渠城市民终于用上“放心气”,2000-09-20,2000-09
“意外”罢免的风波,2000-09-20,2000-09
迟代表“上访”,2000-09-20,2000-09
看，穷山窝的主人们,2000-09-20,2000-09
一条建议带动一方改革,2000-09-20,2000-09
我国粮食生产提前实现“九五”计划目标,2000-09-21,2000-09
国务院举行第31次常务会议,2000-09-21,2000-09
抓而不实等于不抓,2000-09-21,2000-09
尉健行会见日本客人,2000-09-21,2000-09
中国健儿积蓄力量再攀高峰,2000-09-21,2000-09
美参议院通过对华永久正常贸易关系议案,2000-09-21,2000-09
海南构建科学选人用人机制(迈向新世纪),2000-09-21,2000-09
我国农村经济稳定增长(辉煌“九五”),2000-09-21,2000-09
中西部发展战略开始实施,2000-09-21,2000-09
长沙“六路一桥”通车（新闻简报）,2000-09-21,2000-09
南京建成国家级软件园（新闻简报）,2000-09-21,2000-09
李子沟特大桥主体竣工（新闻简报）,2000-09-21,2000-09
福建筑起沿海绿色屏障（“九五”新事）,2000-09-21,2000-09
北京地区天气预报,2000-09-21,2000-09
进出口行支持中水电对外承建工程,2000-09-21,2000-09
第四届国际金属加工工业展将举办,2000-09-21,2000-09
万事达消费信心指数发布,2000-09-21,2000-09
第四届全国焊工技术比赛将于十月举行,2000-09-21,2000-09
秦皇岛边防检查站服务当地经济建设,2000-09-21,2000-09
北京商业银行设立中关村支行,2000-09-21,2000-09
大同改制企业税收增幅大,2000-09-21,2000-09
朱旺村向过度开发说“不”,2000-09-21,2000-09
世界名牌化妆品雅姿彩妆上市,2000-09-21,2000-09
东芝推出新型逐行扫描彩电,2000-09-21,2000-09
常柴投资基因医学领域,2000-09-21,2000-09
把华商大会办成全球华商的世纪盛会,2000-09-21,2000-09
支线航空大有可为（经济视点）,2000-09-21,2000-09
加快国有企业改革和发展增强国有经济控制力,2000-09-21,2000-09
迎接“十一”旅游黄金周,2000-09-21,2000-09
武钢诉俄冷轧硅钢片倾销案获胜,2000-09-21,2000-09
海关全面推广通关改革,2000-09-21,2000-09
首届全国农村适用型工业品博览会开幕,2000-09-21,2000-09
中美共同研究抗类风湿新药,2000-09-21,2000-09
京港经济合作研讨洽谈会将在香港举行,2000-09-21,2000-09
四川公推直选3．3万名村支书,2000-09-21,2000-09
对不称职的检察长要坚决撤换,2000-09-21,2000-09
真心实意为百姓,2000-09-21,2000-09
全国人大财经工作座谈会召开,2000-09-21,2000-09
福建开展争当“廉内助”活动,2000-09-21,2000-09
某炮兵旅锁住沙海“苍龙”千户“生态难民”重返家园,2000-09-21,2000-09
洛阳人武系统扶贫攻坚百余乡村摘掉贫困“帽子”,2000-09-21,2000-09
常德“九·一”特大持枪杀人抢劫运钞车案告破,2000-09-21,2000-09
厦门市国资局有关责任人被查处,2000-09-21,2000-09
我国公安干警从10月1日起着新式警服,2000-09-21,2000-09
中直机关“党建带团建”工作会议召开,2000-09-21,2000-09
邯郸市从治理收费入手遏制腐败,2000-09-21,2000-09
济南铁路公安处以实际行动迎国庆,2000-09-21,2000-09
加强西部大开发中文物保护和管理,2000-09-21,2000-09
外经贸部发言人发表谈话,2000-09-21,2000-09
外交部发言人发表谈话,2000-09-21,2000-09
中国杂技家协会选出新一届领导机构,2000-09-21,2000-09
董建华发表声明表示欢迎,2000-09-21,2000-09
在华美国商会对美参院表决结果表示欢迎,2000-09-21,2000-09
第六届中国艺术节八大展览准备就绪,2000-09-21,2000-09
首都举行纪念吴印咸诞辰100周年座谈会,2000-09-21,2000-09
台湾“9·21”大地震一年来发生3级以上余震500多起,2000-09-21,2000-09
强行收费法不容（社会观察）,2000-09-21,2000-09
李贵鲜会见多米尼加客人（友好往来）,2000-09-21,2000-09
陈锦华会见南非客人（友好往来）,2000-09-21,2000-09
中共代表团离京赴印尼访问（友好往来）,2000-09-21,2000-09
明天气象预报,2000-09-21,2000-09
南京大学：研究生支教到伊犁,2000-09-21,2000-09
安徽构建森林生态网络(保卫绿色关注森林),2000-09-21,2000-09
富阳有奖举报威力大换得一江碧水来,2000-09-21,2000-09
相信群众的眼睛(编余短论),2000-09-21,2000-09
河北农大：“太行山道路”向西延,2000-09-21,2000-09
泉州建设“海峡西岸文化走廊”,2000-09-21,2000-09
西北民族学院喜庆五十华诞,2000-09-21,2000-09
跨省市医疗协作网成立,2000-09-21,2000-09
搜狐公司收购ChinaRen网站,2000-09-21,2000-09
南京举办宽带IP城域网研讨会,2000-09-21,2000-09
全国印刷业清理整顿见成效,2000-09-21,2000-09
浙江大学智力输出造福地方,2000-09-21,2000-09
巴勒斯坦决定暂不恢复和谈,2000-09-21,2000-09
“领导情结”（国际论坛）,2000-09-21,2000-09
日民间团体要求以史实审定教科书,2000-09-21,2000-09
墨总统会见唐家璇,2000-09-21,2000-09
尼肯两国领导人希望加强非中合作,2000-09-21,2000-09
我海军舰艇编队抵加访问,2000-09-21,2000-09
联合国副秘书长会见邓朴方,2000-09-21,2000-09
冰岛领导人会见吴仪,2000-09-21,2000-09
中华文化美国行,2000-09-21,2000-09
向往中华文化,2000-09-21,2000-09
精美的礼物,2000-09-21,2000-09
对话：敞开心扉,2000-09-21,2000-09
企业家热情出场,2000-09-21,2000-09
奥运村运动员食堂镜头一组,2000-09-21,2000-09
二十日冠军榜,2000-09-21,2000-09
奥运金牌榜,2000-09-21,2000-09
羽毛球再待鏖战越从头,2000-09-21,2000-09
巅峰之战 银牌无憾（奥运报道）,2000-09-21,2000-09
“挫折会使我们成熟起来”（五环热线）,2000-09-21,2000-09
最后拼的是意志（悉尼走笔）,2000-09-21,2000-09
药检阳性罚不罚 国际田联费思量,2000-09-21,2000-09
21日观赛指南蛙泳齐晖有一搏,2000-09-21,2000-09
射击队夺牌仍有望,2000-09-21,2000-09
女排赛胡进析败因,2000-09-21,2000-09
曲棍球且收喜泪思更进,2000-09-21,2000-09
正确认识马克思主义,2000-09-21,2000-09
情况明才能求主动(思想纵横),2000-09-21,2000-09
一部系统的军史研究著作（书刊评介）,2000-09-21,2000-09
发展旅游业须走市场化道路,2000-09-21,2000-09
转变：思想工作方法创新的要求,2000-09-21,2000-09
需要政府这只“手”（农村经济观察）,2000-09-21,2000-09
鲁花与农民一起成长(农业产业化龙头企业),2000-09-21,2000-09
好产品还得勤吆喝（农村杂谈）,2000-09-21,2000-09
青川繁养太湖银鱼获成功,2000-09-21,2000-09
玉田加快农业结构调整,2000-09-21,2000-09
1999年中国水资源公报,2000-09-21,2000-09
醉在延边,2000-09-21,2000-09
著名回族指挥家———李德伦（二十世纪中国少数民族备忘录⑨）,2000-09-21,2000-09
携手同行,2000-09-21,2000-09
羽毛球柔道夺得两金,2000-09-22,2000-09
江泽民主席会见美国客人,2000-09-22,2000-09
加强和改善人大对经济工作的立法和监督,2000-09-22,2000-09
李瑞环在京参观画展,2000-09-22,2000-09
朱镕基致电潘文凯表示亲切慰问,2000-09-22,2000-09
培养造就高层次创造性人才,2000-09-22,2000-09
改革迎来艳阳天,2000-09-22,2000-09
固定资产投资稳定增长（辉煌“九五”）,2000-09-22,2000-09
导游员也是一景(今日谈),2000-09-22,2000-09
武汉：百年老街换新颜（“九五”新事）,2000-09-22,2000-09
国民经济告别短缺时代（辉煌“九五”）,2000-09-22,2000-09
北京地区天气预报,2000-09-22,2000-09
国庆南航净增航班1400班次,2000-09-22,2000-09
国家重点鼓励发展的产业、产品和技术目录,2000-09-22,2000-09
重点鼓励发展产业产品目录颁布,2000-09-22,2000-09
首次发布“十一”出游信息,2000-09-22,2000-09
寻找应对大旱之策,2000-09-22,2000-09
两架国产MD90飞机落户北航,2000-09-22,2000-09
丹东市经贸洽谈会开幕,2000-09-22,2000-09
哈轴调整产品结构见成效,2000-09-22,2000-09
建行个人电汇业务在拉萨开通,2000-09-22,2000-09
三亚做好迎接国庆游客准备,2000-09-22,2000-09
二○○○中国友好城市国际大会准备就绪,2000-09-22,2000-09
二○○○年世界华人论坛闭幕,2000-09-22,2000-09
国家投放10万吨储备棉,2000-09-22,2000-09
草原地区如何做好退耕还草还林发展畜牧业工作,2000-09-22,2000-09
加大从源头治理腐败的力度,2000-09-22,2000-09
加强青少年教育积极预防和减少青少年违法犯罪,2000-09-22,2000-09
教育·感化·挽救,2000-09-22,2000-09
力戒形式主义抓好工作落实,2000-09-22,2000-09
德州三万党政干部参与轮岗,2000-09-22,2000-09
“公正执法基层行”采访活动正式启动,2000-09-22,2000-09
总参党委作出开展向刘怡昕学习的决定,2000-09-22,2000-09
大城县拥军优属动真情办实事,2000-09-22,2000-09
高检将审查批捕厅更名为侦查监督厅,2000-09-22,2000-09
高法公开选拔出四十七名审判长,2000-09-22,2000-09
今明两年公安队伍建设主抓“三项教育”,2000-09-22,2000-09
吉林处决一黑社会团伙头目,2000-09-22,2000-09
培养造就高层次创造性人才,2000-09-22,2000-09
改革迎来艳阳天,2000-09-22,2000-09
文化“走出去”形象树起来（人民论坛）,2000-09-22,2000-09
