中共代表离京赴西班牙（友好往来）,2000-09-13,2000-09
明天气象预报,2000-09-13,2000-09
全国百佳新闻工作者获奖名单（101名）,2000-09-13,2000-09
第四届范长江新闻奖获奖名单（10名）,2000-09-13,2000-09
第四届韬奋新闻奖获奖名单（10名）,2000-09-13,2000-09
第四届范长江新闻奖韬奋新闻奖全国百佳新闻工作者评选揭晓,2000-09-13,2000-09
我国开始清点科技家底,2000-09-13,2000-09
德国教授获中国语言文化友谊奖,2000-09-13,2000-09
香港实业家资助人口福利事业,2000-09-13,2000-09
维达杯保龄球冠军赛又赛一站,2000-09-13,2000-09
新药肝络欣获准生产,2000-09-13,2000-09
第六届全国大学生运动会在蓉闭幕,2000-09-13,2000-09
《中国新闻事业编年史》出版,2000-09-13,2000-09
全军心理疾病防治中心成立,2000-09-13,2000-09
关注“流动小文盲”,2000-09-13,2000-09
高教自考毕业证书将实行网上查询,2000-09-13,2000-09
《胡风汉月》为评剧舞台吹来新风,2000-09-13,2000-09
21世纪老年健康论坛在京举行,2000-09-13,2000-09
海峡两岸心血管病学术研讨会召开,2000-09-13,2000-09
李鹏分别与俄议会两院主席会谈,2000-09-13,2000-09
中东和谈巴官员指责以拖延恢复谈判以主张以戴维营会谈为基础叙强调以必须归还所有被占领土,2000-09-13,2000-09
俄议会两院欢宴李鹏,2000-09-13,2000-09
千年盛会的审视及展望(国际论坛),2000-09-13,2000-09
一幅特殊地图,2000-09-13,2000-09
意议长会见李长春,2000-09-13,2000-09
中东和谈三人行（综述）,2000-09-13,2000-09
卡斯特罗会见李铁映,2000-09-13,2000-09
唐家璇会见奥尔布赖特,2000-09-13,2000-09
韩朝表示要为和解与统一努力,2000-09-13,2000-09
日部分教科书出版社淡化战争责任,2000-09-13,2000-09
美俄宇航员为国际空间站铺设电缆,2000-09-13,2000-09
挖山不止变首富(大千絮语),2000-09-13,2000-09
向发展中国家提供援助,2000-09-13,2000-09
原油增产亦难限价（综述）,2000-09-13,2000-09
中国经济将保持高速增长,2000-09-13,2000-09
欧元对美元比价再创新低,2000-09-13,2000-09
悉尼，我们来了(奥运报道),2000-09-13,2000-09
心中有个梦(奥运报道),2000-09-13,2000-09
奥运圣火静候东风(奥运报道),2000-09-13,2000-09
融入奥运(奥运报道),2000-09-13,2000-09
巧遇邓亚萍(奥运报道),2000-09-13,2000-09
国球不敢松懈(奥运报道),2000-09-13,2000-09
智利球星萨莫拉诺将亮相奥运会(奥运报道),2000-09-13,2000-09
悉尼华人华侨为健儿洗尘(奥运报道),2000-09-13,2000-09
琼斯坦承有压力(奥运报道),2000-09-13,2000-09
今日中国成焦点(悉尼走笔),2000-09-13,2000-09
百姓疾苦挂心间(民主法制述评),2000-09-13,2000-09
莫打法律“擦边球”（法治论苑）,2000-09-13,2000-09
实行投票制前后,2000-09-13,2000-09
发挥优势抓好政法队伍建设（探源与思考）,2000-09-13,2000-09
作废政策应及时公示（各地人大工作集锦）,2000-09-13,2000-09
选派“村官”须依法（各地人大工作集锦）,2000-09-13,2000-09
堵住“村规民约”漏洞（各地人大工作集锦）,2000-09-13,2000-09
武警保卫成昆线……,2000-09-13,2000-09
警察“凡进必考”好( 法制纵横),2000-09-13,2000-09
这里阳光灿烂,2000-09-13,2000-09
献身,2000-09-13,2000-09
山城绿灯,2000-09-13,2000-09
江苏围捕经济犯罪逃犯战果累累（政法短波）,2000-09-13,2000-09
谷城县警方“阳光执法”赢民心（政法短波）,2000-09-13,2000-09
江西石化总厂保卫处整治出成效（政法短波）,2000-09-13,2000-09
荣成市检察院严把办案质量关（政法短波）,2000-09-13,2000-09
四川警方侦破一特大爆炸案,2000-09-13,2000-09
由乱而治新东村（执法者风采）,2000-09-13,2000-09
不再赤手空拳（漫画）,2000-09-13,2000-09
没妈的孩子也是宝,2000-09-13,2000-09
法律：道德的下线和上线（探源与思考）,2000-09-13,2000-09
作伪证 法不容,2000-09-13,2000-09
让英雄不再流泪（社会视点）,2000-09-13,2000-09
见义勇为者向受益人索赔（法在生活中）,2000-09-13,2000-09
为了大地的丰收,2000-09-13,2000-09
为“月月奖勇士”叫好（法制人生）,2000-09-13,2000-09
山东昌邑：“法制校长”进校园,2000-09-13,2000-09
河南新野：法院执行注意维护稳定,2000-09-13,2000-09
1680万元投资打了水漂（多棱镜）,2000-09-13,2000-09
追究违法审判确保公正执法,2000-09-13,2000-09
强化管理清理积案,2000-09-13,2000-09
“公示栏”莫成“空示栏”（民主评说）,2000-09-13,2000-09
公开村务促进发展（民主建设巡礼）,2000-09-13,2000-09
净化图书市场 清除精神垃圾（公民建言）,2000-09-13,2000-09
无证煤窑暗度陈仓违法开采死灰复燃（监督广角）,2000-09-13,2000-09
科技副乡镇长缘何难“务科”（追本溯源）,2000-09-13,2000-09
李鹏委员长同普京总统会见,2000-09-14,2000-09
江泽民主席与德拉鲁阿总统会谈,2000-09-14,2000-09
追求实效重在创新,2000-09-14,2000-09
江泽民会见瑞士联邦主席奥吉,2000-09-14,2000-09
江泽民会见世界气象组织秘书长,2000-09-14,2000-09
前8月我进出口总额逾3000亿美元,2000-09-14,2000-09
广东社会保险走在全国前列,2000-09-14,2000-09
9月8日乌鲁木齐爆炸事故原因查明,2000-09-14,2000-09
坚决摒弃形式主义,2000-09-14,2000-09
小浪底枢纽首台机组恢复发电（新闻简报）,2000-09-14,2000-09
青海畜牧业获丰收（新闻简报）,2000-09-14,2000-09
微机联锁信号系统在长沙运行（新闻简报）,2000-09-14,2000-09
浙江研制出数码喷射印花机（新闻简报）,2000-09-14,2000-09
二○○○年中国枣庄经洽会闭幕（新闻简报）,2000-09-14,2000-09
北京地区天气预报,2000-09-14,2000-09
江泽民主席与德拉鲁阿总统会谈,2000-09-14,2000-09
追求实效重在创新,2000-09-14,2000-09
今年秋冬种将稳定粮食种植面积,2000-09-14,2000-09
“走出去”到“引进来”,2000-09-14,2000-09
金融业力助积极财政政策实施,2000-09-14,2000-09
1至8月利用外资呈恢复性增长,2000-09-14,2000-09
牡丹江为企业一年减负上亿元,2000-09-14,2000-09
央行增加农信社再贷款333亿元,2000-09-14,2000-09
8月份居民消费价格总水平同比上涨0．3％,2000-09-14,2000-09
保监会派出机构年内组建完成,2000-09-14,2000-09
建行向北大注资30亿元,2000-09-14,2000-09
政府统计调查项目将定期公布,2000-09-14,2000-09
工行发行“牡丹国际借记卡”,2000-09-14,2000-09
北京首钢新钢有限责任公司成立,2000-09-14,2000-09
进出口行为伊朗炼铜厂提供贷款,2000-09-14,2000-09
广东月饼远销海外,2000-09-14,2000-09
安居乐业是群众的利益所在,2000-09-14,2000-09
建首善创一流,2000-09-14,2000-09
以人为本改善服务,2000-09-14,2000-09
创建文明社区提高市民素质,2000-09-14,2000-09
加强物业管理促进社区文明,2000-09-14,2000-09
从群众关注的热点入手,2000-09-14,2000-09
明天气象预报,2000-09-14,2000-09
“鲁能杯”全国科普知识竞赛圆满结束,2000-09-14,2000-09
中瑞建交50周年招待会在京举行,2000-09-14,2000-09
依法规范人民法院执行,2000-09-14,2000-09
乌鲁木齐“9·8”爆炸事故受伤人员得到妥善救治,2000-09-14,2000-09
北京百余名院士共度中秋,2000-09-14,2000-09
加强执行《条例》情况监督检查坚决防止和纠正用人上的不正之风,2000-09-14,2000-09
上海国际工业博览会将举行,2000-09-14,2000-09
“经济特区与建设有中国特色社会主义”研讨会召开,2000-09-14,2000-09
爱尔兰驻沪总领事馆开馆,2000-09-14,2000-09
迟浩田会见多哥总长,2000-09-14,2000-09
对患者岂能如此不负责任？（社会观察）,2000-09-14,2000-09
全民健身添新景,2000-09-14,2000-09
为旅游培养高素质人才,2000-09-14,2000-09
沙漠公园引出的水话题（中华环保世纪行）,2000-09-14,2000-09
小魔芋衍生大产业,2000-09-14,2000-09
婺源发展生态产业强县富民,2000-09-14,2000-09
首都高校保证经济困难新生入学,2000-09-14,2000-09
北大超声肿瘤治疗机捐赠西部,2000-09-14,2000-09
环保家用微型供热炉通过鉴定,2000-09-14,2000-09
青少年“三观”教育读本面世,2000-09-14,2000-09
国产耐气候试验机技改成功,2000-09-14,2000-09
新型汽车节油器获专利,2000-09-14,2000-09
浙江创建“硅谷天堂”,2000-09-14,2000-09
我国报纸环境报道增多,2000-09-14,2000-09
著作权法颁布十周年座谈会举行,2000-09-14,2000-09
不到三十当教授全国共有十七人,2000-09-14,2000-09
李鹏会见叶利钦,2000-09-14,2000-09
李鹏委员长同普京总统会见,2000-09-14,2000-09
李鹏接见我驻俄人员,2000-09-14,2000-09
李鹏分别会见三位俄、苏前政府领导人,2000-09-14,2000-09
今宵月更圆（国外特写）,2000-09-14,2000-09
唐家璇会见多国外长和国际组织领导人,2000-09-14,2000-09
我驻瑞士使馆庆祝中瑞建交五十周年,2000-09-14,2000-09
千年一聚（本报记者现场目击）,2000-09-14,2000-09
千年首脑大会场外比场内忙,2000-09-14,2000-09
千年语丝,2000-09-14,2000-09
于再清当选国际奥委会委员(奥运报道),2000-09-14,2000-09
吉通奥运套卡首发(奥运报道),2000-09-14,2000-09
喜看奥运添新绿(悉尼走笔),2000-09-14,2000-09
揭幕战痛煞东道主(奥运报道),2000-09-14,2000-09
追访“秘密武器”(奥运报道),2000-09-14,2000-09
战未始硝烟起(奥运报道),2000-09-14,2000-09
赛在赛前(奥运报道),2000-09-14,2000-09
玫瑰不畏春寒(奥运报道),2000-09-14,2000-09
国际象棋世界杯赛许昱华夺冠(奥运报道),2000-09-14,2000-09
“万能”论“无用”论皆不可取(思想纵横),2000-09-14,2000-09
一个系统工程（学习通信）,2000-09-14,2000-09
从严治党须抓好五个环节,2000-09-14,2000-09
探索非公有制经济组织党建工作的途径,2000-09-14,2000-09
灾情发生以后……（社会聚焦）,2000-09-14,2000-09
赞新官任前过道“槛”（实话实说）,2000-09-14,2000-09
郴州市：给三峡移民一个温暖的家（见闻录）,2000-09-14,2000-09
违规“致富”的教育站（专题调查）,2000-09-14,2000-09
禁止摊派销售（来自基层）,2000-09-14,2000-09
积极推进村民自治有利农村党的建设（民主建设在乡村）,2000-09-14,2000-09
丧葬陋习沉渣泛起移风易俗任重道远（焦点透视）,2000-09-14,2000-09
列车十五年无火灾,2000-09-14,2000-09
没有钱也能打官司,2000-09-14,2000-09
《中国：改革决定未来》（书刊评介）,2000-09-14,2000-09
“新经济”带来的机会和挑战（热点研究）,2000-09-14,2000-09
在经济全球化背景下开发西部(学术交流),2000-09-14,2000-09
《中国反贪史》（书刊评介）,2000-09-14,2000-09
进步观念的基本特征（报刊文摘）,2000-09-14,2000-09
原产地规则的再认识（报刊文摘）,2000-09-14,2000-09
无形资产价值实现如何量化（报刊文摘）,2000-09-14,2000-09
全面质量管理：回顾与思考(学者论坛),2000-09-14,2000-09
坚定信念百折不挠,2000-09-14,2000-09
立足岗位刻苦自学,2000-09-14,2000-09
执着追求大胆实践,2000-09-14,2000-09
锲而不舍努力开拓,2000-09-14,2000-09
积极探索勇攀高峰,2000-09-14,2000-09
身残志坚勇于拼搏,2000-09-14,2000-09
潜心研究成就突出,2000-09-14,2000-09
坚韧不拔不断创新,2000-09-14,2000-09
边教边学 大胆创新,2000-09-14,2000-09
勤奋学习积极进取,2000-09-14,2000-09
勤奋学习刻苦钻研开拓创新勇于实践,2000-09-14,2000-09
李鹏会见俄总理卡西亚诺夫,2000-09-15,2000-09
朱镕基与西迪梅举行会谈,2000-09-15,2000-09
江泽民主席致信萨马兰奇,2000-09-15,2000-09
成克杰被执行死刑,2000-09-15,2000-09
严惩腐败警钟长鸣,2000-09-15,2000-09
今年国庆放假七天,2000-09-15,2000-09
江泽民《在联合国千年首脑会议上的讲话》出版,2000-09-15,2000-09
朱镕基会见阿根廷总统,2000-09-15,2000-09
严把安全关（今日谈）,2000-09-15,2000-09
高检设立侦查指挥中心营口公开销毁千台赌博机（特快专递）,2000-09-15,2000-09
北京地区天气预报,2000-09-15,2000-09
一个高级领导干部的毁灭,2000-09-15,2000-09
成克杰被判刑的法律依据,2000-09-15,2000-09
查处成克杰案件备忘录,2000-09-15,2000-09
广东全省范围内基本铲除非法传销,2000-09-15,2000-09
武汉端掉一“地下”证券交易公司,2000-09-15,2000-09
为西部大开发营造良好法制环境,2000-09-15,2000-09
全面提高金融系统职工素质,2000-09-15,2000-09
尽快建立“打拐”日常工作新机制,2000-09-15,2000-09
确保职业道德教育活动取得预期成效,2000-09-15,2000-09
新闻摄影比赛,2000-09-15,2000-09
中阿经贸合作前景广阔,2000-09-15,2000-09
统筹规划 尊重科学 留住人才,2000-09-15,2000-09
人民大学授予阿根廷总统名誉博士学位,2000-09-15,2000-09
贪污就是背叛（人民论坛）,2000-09-15,2000-09
西藏自治区负责人接受两岸记者采访,2000-09-15,2000-09
上海虹桥国际机场被迫关闭,2000-09-15,2000-09
《“法轮功”歪理邪说剖析》出版,2000-09-15,2000-09
钱其琛会见波黑主席团轮值主席特使,2000-09-15,2000-09
曾庆红会见越共中办代表团,2000-09-15,2000-09
吴仪出访冰岛丹麦并出席汉诺威世博会,2000-09-15,2000-09
张闻天生平和思想研讨会在无锡举行,2000-09-15,2000-09
反映了党和政府反腐败的决心,2000-09-15,2000-09
中央苏区工商行政管理史料馆兴建,2000-09-15,2000-09
时传祥纪念馆在山东齐河开馆,2000-09-15,2000-09
阿根廷总统结束访华,2000-09-15,2000-09
明天气象预报,2000-09-15,2000-09
高强度超声聚焦刀饮誉医界,2000-09-15,2000-09
撒开天网擒凶顽,2000-09-15,2000-09
浙江国际时装技术学院成立,2000-09-15,2000-09
两位世界级音乐大师京沪献艺,2000-09-15,2000-09
康柏个人电脑实现轻松升级,2000-09-15,2000-09
《灾难现场的自救互救》发行,2000-09-15,2000-09
喜满你网站建华人网络家园,2000-09-15,2000-09
中华食物网日前问世,2000-09-15,2000-09
成都宇航科教园项目通过论证,2000-09-15,2000-09
要看奥运盛况请上新华网站,2000-09-15,2000-09
李鹏会见俄总理卡西亚诺夫,2000-09-15,2000-09
电力“同行”话未来（通讯）,2000-09-15,2000-09
巴以和谈在美恢复,2000-09-15,2000-09
金正日近期将访汉城,2000-09-15,2000-09
巴解的重要决定(国际论坛),2000-09-15,2000-09
唐家璇拜会安南并会见俄日等国外长,2000-09-15,2000-09
欧盟取消对奥制裁（综述）,2000-09-15,2000-09
唐家璇在联大一般性辩论中发言,2000-09-15,2000-09
首批中国公民旅游团抵东京,2000-09-15,2000-09
三星赞助奥运一举三得（大千絮语）,2000-09-15,2000-09
总统做客中国网站,2000-09-15,2000-09
巴西批评发达国家贸易政策,2000-09-15,2000-09
美参院否决汤普森修正案,2000-09-15,2000-09
中国女足擒服“非洲绿鹰”,2000-09-15,2000-09
中国代表团临阵细做调理,2000-09-15,2000-09
把压力踢进球门(奥运报道),2000-09-15,2000-09
乒乓球抽签揭晓小孔王楠硬仗多,2000-09-15,2000-09
北京奥申委发表公告感谢群众支持,2000-09-15,2000-09
想想金牌拦路虎（悉尼走笔）,2000-09-15,2000-09
尚未开幕先美言萨马兰奇评奥运,2000-09-15,2000-09
柔道敌情难查我队沉着镇静,2000-09-15,2000-09
实德申花继续争冠,2000-09-15,2000-09
女排队员不轻松（五环热线）,2000-09-15,2000-09
“十一”出境游：得管！（新视窗）,2000-09-15,2000-09
当一回澳洲牧民,2000-09-15,2000-09
出境游您享有什么权利（生活提示）,2000-09-15,2000-09
您应尽哪些义务,2000-09-15,2000-09
出国旅游图个啥(周末闲话),2000-09-15,2000-09
国庆：绿色通道推出特惠旅游,2000-09-15,2000-09
哪些旅游目的地已获准正式开放？,2000-09-15,2000-09
“十一”线路精选（旅游指南）,2000-09-15,2000-09
谁是悉尼“王中王”,2000-09-15,2000-09
悉尼奥运会与澳洲土著,2000-09-15,2000-09
列强大比武,2000-09-15,2000-09
悉尼初春寒气逼人,2000-09-15,2000-09
“袖珍大力士”还要夺金,2000-09-15,2000-09
看谁打响第一炮,2000-09-15,2000-09
放飞梦想,2000-09-15,2000-09
绿色一失人何所依（五洲茶亭）,2000-09-15,2000-09
钻石王哈里·奥,2000-09-15,2000-09
世界建筑一瞥,2000-09-15,2000-09
辉煌的废墟（世界见闻）,2000-09-15,2000-09
我见到的悉尼歌剧院,2000-09-15,2000-09
加拿大学生花费知多少,2000-09-15,2000-09
英国禁用工具体罚儿童,2000-09-15,2000-09
九州揽胜,2000-09-15,2000-09
骑牛从军到称帝“中兴”,2000-09-15,2000-09
贺岁片《防守反击》抢先出炉,2000-09-15,2000-09
“健康大使”洪涛,2000-09-15,2000-09
天琢,2000-09-15,2000-09
振兴国产电影的高招（看台人语）,2000-09-15,2000-09
舞弊争奖可耻（看台人语）,2000-09-15,2000-09
少一点“开奖晚会”（看台人语）,2000-09-15,2000-09
酒广告“儿童不宜”（看台人语）,2000-09-15,2000-09
作家的良知（快人快语）,2000-09-15,2000-09
首都大学生竞赛戏剧创作,2000-09-15,2000-09
“巴赫海顿合唱作品音乐会”在京举办,2000-09-15,2000-09
搬离三峡（心意卡）,2000-09-15,2000-09
百台大戏庆十一首都舞台真热闹,2000-09-15,2000-09
第27届奥运会在悉尼隆重开幕,2000-09-16,2000-09
中共中央召开党外人士座谈会,2000-09-16,2000-09
北京地区天气预报,2000-09-16,2000-09
江泽民会见意大利前总统,2000-09-16,2000-09
江泽民朱镕基分别致电西哈努克洪森,2000-09-16,2000-09
全国政协举行第二十四次主席会议,2000-09-16,2000-09
李鹏离开莫斯科抵新西伯利亚,2000-09-16,2000-09
李岚清会见马耳他前总统,2000-09-16,2000-09
李瑞环会见西迪梅,2000-09-16,2000-09
江主席会见几内亚总理,2000-09-16,2000-09
中共中央召开党外人士座谈会,2000-09-16,2000-09
李瑞环会见西迪梅,2000-09-16,2000-09
江主席会见几内亚总理,2000-09-16,2000-09
京沈高速公路全线通车,2000-09-16,2000-09
对党员干部进行警示教育工作全面展开,2000-09-16,2000-09
建设高素质干部队伍的重要保证,2000-09-16,2000-09
不同寻常的谈话会（特快专递）,2000-09-16,2000-09
提高侦查水平加大反贪力度,2000-09-16,2000-09
中宣部向西藏阿里地区捐赠图书,2000-09-16,2000-09
第三届中俄经济学家学术研讨会闭幕,2000-09-16,2000-09
祝贺李鹏访俄成功,2000-09-16,2000-09
朝鲜舆论发表社论批驳韩国要求日本客观审定,2000-09-16,2000-09
深化睦邻友好加强战略协作（述评）,2000-09-16,2000-09
美国会领导人会见我全国人大代表团,2000-09-16,2000-09
巴以举行预备会谈,2000-09-16,2000-09
金正日会见戴秉国,2000-09-16,2000-09
美籍华裔科学家李文和获释,2000-09-16,2000-09
曾建徽批驳美《国际宗教自由报告》,2000-09-16,2000-09
《渥太华公约》缔约国会议闭幕,2000-09-16,2000-09
法芬表示应对奥右翼政党保持警惕,2000-09-16,2000-09
苏哈托再次拒绝出庭受审,2000-09-16,2000-09
中爱将联合进行电子安全培训,2000-09-16,2000-09
德取缔两右翼团体,2000-09-16,2000-09
我代表指出部署NMD后果严重,2000-09-16,2000-09
石广生赴澳参加亚太经济峰会,2000-09-16,2000-09
壮志酬今日万臂振五环,2000-09-16,2000-09
“我听到了你们的心愿”,2000-09-16,2000-09
朝韩健儿携手半岛旗下,2000-09-16,2000-09
第27届奥运会在悉尼隆重开幕,2000-09-16,2000-09
开张首日谁大吉,2000-09-16,2000-09
枪手的准星是心灵,2000-09-16,2000-09
人民网精心制作奥运会一览无遗（五环热线）,2000-09-16,2000-09
七彩梦幻夜（奥运报道）,2000-09-16,2000-09
9月16日将决出金牌预览表,2000-09-16,2000-09
勇往直前向未来（悉尼走笔）,2000-09-16,2000-09
澳门迎来第十四届国际音乐节,2000-09-16,2000-09
世界需要爱,2000-09-16,2000-09
但闻姑苏琵琶声,2000-09-16,2000-09
建议宣传“三江文明”（文化信箱）,2000-09-16,2000-09
学会即兴讲话（本月话题·演艺人的文化素养⑦）,2000-09-16,2000-09
影视人才“资源库”艺创人员中心成立,2000-09-16,2000-09
“哈夏”：四十年风雨乐章,2000-09-16,2000-09
以真诚与良知回报社会和人民,2000-09-16,2000-09
文学的力量,2000-09-16,2000-09
道德内质与文学品格,2000-09-16,2000-09
破晓的曙色,2000-09-16,2000-09
飘泊中的永恒,2000-09-16,2000-09
大理有座德化碑,2000-09-16,2000-09
踏着国歌的旋律（大地之子）,2000-09-16,2000-09
中国功夫（乐凯之光）,2000-09-16,2000-09
大地书影,2000-09-16,2000-09
门子与厨子（金台随感）,2000-09-16,2000-09
半掩的门,2000-09-16,2000-09
瞒书记（大众书话）,2000-09-16,2000-09
豆腐渣片（多味斋）,2000-09-16,2000-09
重识白杨（走进西部）,2000-09-16,2000-09
大乐与天地同和,2000-09-16,2000-09
报告文学《正义之光》受好评,2000-09-16,2000-09
北京地区天气预报,2000-09-17,2000-09
随着百姓的心愿走,2000-09-17,2000-09
八月份消费品市场继续看好,2000-09-17,2000-09
前8月全国固定资产投资增长12．7％,2000-09-17,2000-09
全国发电装机总容量突破3亿千瓦,2000-09-17,2000-09
奥运会开赛第一天中国队夺一银三铜,2000-09-17,2000-09
冷冷热热中英街,2000-09-17,2000-09
李鹏继续在俄罗斯访问,2000-09-17,2000-09
我国登记外债余额有所减少,2000-09-17,2000-09
加强教育培训提高法官素质确保司法公正,2000-09-17,2000-09
切实加强干部监督工作,2000-09-17,2000-09
随着百姓的心愿走,2000-09-17,2000-09
加强教育培训提高法官素质确保司法公正,2000-09-17,2000-09
反腐败要构筑思想道德和党纪国法两道防线,2000-09-17,2000-09
陕西任用干部组织考察与群众评判并举,2000-09-17,2000-09
临汾乡镇干部察民情讲真话办实事,2000-09-17,2000-09
司马义·艾买提会见法国枢机主教艾切卡雷,2000-09-17,2000-09
迟浩田会见意大利国防秘书长,2000-09-17,2000-09
许嘉璐会见意大利客人,2000-09-17,2000-09
百余台商联名敦促台湾当局开放“三通”,2000-09-17,2000-09
西哈努克国王离京返柬,2000-09-17,2000-09
“心灵的节日”,2000-09-17,2000-09
唐家璇会见多国外长,2000-09-17,2000-09
台湾国光剧团在京首演,2000-09-17,2000-09
海峡两岸记者结束对西藏联合采访,2000-09-17,2000-09
第三届中国开渔节降下帷幕,2000-09-17,2000-09
我国企业承诺保护臭氧层,2000-09-17,2000-09
切实加强对领导干部和干部选拔任用工作的监督,2000-09-17,2000-09
网络教育造就职业竞争力（人物风云）,2000-09-17,2000-09
武汉：构筑光谷浇铸希望(本期聚集),2000-09-17,2000-09
《中国浙江》网脱颖而出,2000-09-17,2000-09
弱冠少年办网站,2000-09-17,2000-09
中国中医药网：巧做社区服务文章,2000-09-17,2000-09
创新创新再创新(IT纵横),2000-09-17,2000-09
奥运金牌榜,2000-09-17,2000-09
17日将决出金牌预览表,2000-09-17,2000-09
奥运会门票售出逾八成,2000-09-17,2000-09
自胜者强（奥运报道）,2000-09-17,2000-09
金苹果飘落邻家射击队心如止水,2000-09-17,2000-09
拳拳一片中国心（悉尼走笔）,2000-09-17,2000-09
我们不失望（五环热线）,2000-09-17,2000-09
成败寻常事得失在我心（五环热线）,2000-09-17,2000-09
总体表现尚属正常,2000-09-17,2000-09
奥运会第一天九破世界纪录,2000-09-17,2000-09
新闻摄影比赛,2000-09-18,2000-09
陶璐娜夺得首枚金牌,2000-09-18,2000-09
向着廉洁高效迈进,2000-09-18,2000-09
在深化改革中提高行政水平,2000-09-18,2000-09
李鹏抵达符拉迪沃斯托克,2000-09-18,2000-09
画册《共和国领袖》公开发行,2000-09-18,2000-09
中国科协2000年学术年会开幕,2000-09-18,2000-09
国庆旅游 勿用公款（今日谈）,2000-09-18,2000-09
清华大学专家教授团访问宁夏(特快专递),2000-09-18,2000-09
新疆发现大型铜矿（新闻简报）,2000-09-18,2000-09
青岛城阳区出口大增（新闻简报）,2000-09-18,2000-09
“黔电送粤”工程启动（新闻简报）,2000-09-18,2000-09
北京地区天气预报,2000-09-18,2000-09
凝聚战胜贫困的心气,2000-09-18,2000-09
海关有个“黑匣子”（经济视点）,2000-09-18,2000-09
“科技兴海”是海洋工作的战略目标,2000-09-18,2000-09
渤海又签一石油合同,2000-09-18,2000-09
首期中国旅游发展优先项目推出,2000-09-18,2000-09
郴州举办生态旅游节,2000-09-18,2000-09
汽车文化专列好戏连台,2000-09-18,2000-09
中国移动通信联合会成立,2000-09-18,2000-09
审计署网站开通,2000-09-18,2000-09
王鹏飞被铁道部追授为“优秀共产党员”,2000-09-18,2000-09
三峡移民外迁安置试点进展顺利,2000-09-18,2000-09
治疗痤疮新药泰尔丝问世,2000-09-18,2000-09
北京举办汽车保险国际研讨会,2000-09-18,2000-09
美国总统轮船公司将在沪设单证中心,2000-09-18,2000-09
高智能化全自动汽车底盘测功机问世,2000-09-18,2000-09
石河子招商引资已达十三亿元,2000-09-18,2000-09
辛集有了“皮革大学”,2000-09-18,2000-09
南通建成高标准建材批发市场,2000-09-18,2000-09
要进一步解放思想抓住机遇深化改革加快发展,2000-09-18,2000-09
向着廉洁高效迈进,2000-09-18,2000-09
“平安大队长”王丙武（社会扫描）,2000-09-18,2000-09
全军和武警部队大力加强和改进思想政治教育,2000-09-18,2000-09
进一步巩固和扩大“三讲”教育成果,2000-09-18,2000-09
全国人大常委会执法检查组在内蒙古执法检查,2000-09-18,2000-09
