卡斯特罗与克林顿握手,2000-09-08,2000-09
钱其琛会见伊拉克副总理,2000-09-08,2000-09
中国签署儿童权利公约议定书,2000-09-08,2000-09
关于西部大开发中的文化建设问题,2000-09-08,2000-09
文化城镇的灵魂,2000-09-08,2000-09
江岸花正红,2000-09-08,2000-09
敦煌眼下有四难,2000-09-08,2000-09
魏晋南北朝文学研究惹人注目,2000-09-08,2000-09
祖国颂（假日摄影大观）,2000-09-08,2000-09
街头模特,2000-09-08,2000-09
洋学生当社区助理,2000-09-08,2000-09
农民投资百万兴建假日浴场,2000-09-08,2000-09
触网者年薪知多少？(新视窗),2000-09-08,2000-09
重庆夏日消费亮点闪烁,2000-09-08,2000-09
莫让消费者成“橡皮泥”（周末闲话）,2000-09-08,2000-09
国庆7天长假，商家准备好了吗？,2000-09-08,2000-09
成都：热了茶水冷了咖啡,2000-09-08,2000-09
消除误区，才能保护自己,2000-09-08,2000-09
明星广告与带铃铛的山羊,2000-09-08,2000-09
心贴心的服务,2000-09-08,2000-09
人间自有真情在,2000-09-08,2000-09
非法游医为何泛滥,2000-09-08,2000-09
烟斗与高跟鞋（不吐不快）,2000-09-08,2000-09
什么是类风湿关节炎（小资料）,2000-09-08,2000-09
大脑神经有口粮经常补充保健康,2000-09-08,2000-09
心理卫生不容忽视,2000-09-08,2000-09
治疗性功能障碍产品广告违法,2000-09-08,2000-09
保姆上岗体检为先(编读往来),2000-09-08,2000-09
单病种最高限价百余种药品让利,2000-09-08,2000-09
世界建筑一瞥,2000-09-08,2000-09
志愿天使在行动(奥运将开幕悉尼笑迎宾),2000-09-08,2000-09
如是美景待良辰(奥运将开幕悉尼笑迎宾),2000-09-08,2000-09
出租“太太”(西洋镜),2000-09-08,2000-09
特拉维夫掠影(海外游踪),2000-09-08,2000-09
旧建筑的新生命(他山石),2000-09-08,2000-09
加拿大的公用汽车,2000-09-08,2000-09
《大宅门》几经风雨始成“正果”,2000-09-08,2000-09
《听松》新感,2000-09-08,2000-09
“打开音乐之门2000”火爆气旺,2000-09-08,2000-09
拍戏惊动了国防部长,2000-09-08,2000-09
奥运前奏曲好听好唱（看台人语）,2000-09-08,2000-09
俺农民还有“戏”吗（看台人语）,2000-09-08,2000-09
《啊，朋友》不能这么唱（看台人语）,2000-09-08,2000-09
这样的“风采”是疯态（看台人语）,2000-09-08,2000-09
如何保障音乐权益今秋将有分晓,2000-09-08,2000-09
以群众满意为标准（电子游戏治理见闻）,2000-09-08,2000-09
巩俐给大家提个醒（快人快语）,2000-09-08,2000-09
越南国家交响乐团9月访华（艺文快讯）,2000-09-08,2000-09
国庆上演《罗密欧与朱丽叶》（艺文快讯）,2000-09-08,2000-09
全国城市之歌大赛揭晓（艺文快讯）,2000-09-08,2000-09
第三个张大民“浮出水面”,2000-09-08,2000-09
江泽民与发展中国家领导人共进早餐,2000-09-09,2000-09
李鹏同爱沙尼亚议长萨维会谈,2000-09-09,2000-09
江泽民与克林顿举行正式会晤,2000-09-09,2000-09
联合国安理会五常任理事国举行历史性首脑会晤,2000-09-09,2000-09
李岚清接见奥运会中国体育代表团,2000-09-09,2000-09
共同构筑面向新世纪的中美关系,2000-09-09,2000-09
江泽民出席美友好团体举行的午餐会,2000-09-09,2000-09
北京地区天气预报,2000-09-09,2000-09
北京高校教师喜迁花园小区,2000-09-09,2000-09
充分释放科学技术能量努力提高国民经济素质,2000-09-09,2000-09
60位老教授老专家受表彰,2000-09-09,2000-09
武汉第三座长江大桥通车,2000-09-09,2000-09
吴仪会见何厚铧（友好往来）,2000-09-09,2000-09
吴仪会见香港客人（友好往来）,2000-09-09,2000-09
吴仪会见日本客人（友好往来）,2000-09-09,2000-09
宋健会见日本客人（友好往来）,2000-09-09,2000-09
国家禁毒委部署专项整治行动,2000-09-09,2000-09
第四届中国投资贸易洽谈会在厦门开幕,2000-09-09,2000-09
以更积极姿态参与经济全球化进程,2000-09-09,2000-09
按照“入世”承诺鼓励外商投资,2000-09-09,2000-09
外交部发言人发表谈话,2000-09-09,2000-09
江泽民会见奥巴桑乔,2000-09-09,2000-09
江泽民与发展中国家领导人共进早餐,2000-09-09,2000-09
江泽民与克林顿举行正式会晤,2000-09-09,2000-09
共同构筑面向新世纪的中美关系,2000-09-09,2000-09
江泽民出席美友好团体举行的午餐会,2000-09-09,2000-09
安理会五常任理事国首脑发表会晤声明,2000-09-09,2000-09
历史性的会晤（通讯）,2000-09-09,2000-09
德拉鲁阿强调发展阿中关系,2000-09-09,2000-09
联大拒绝将“台湾参与联合国”提案列入议程,2000-09-09,2000-09
李鹏同爱沙尼亚议长萨维会谈,2000-09-09,2000-09
李鹏会见爱沙尼亚议会各党团负责人,2000-09-09,2000-09
悉尼不平静（悉尼手记）,2000-09-09,2000-09
中国的声音,2000-09-09,2000-09
中国体育代表团举行动员大会,2000-09-09,2000-09
中国体操换将力保团体金牌,2000-09-09,2000-09
中国射击队在大风中训练,2000-09-09,2000-09
奥运会足球赛观众将逾百万,2000-09-09,2000-09
国际象棋世界杯赛许昱华进四强,2000-09-09,2000-09
《生死抉择》摄制组与体育界座谈,2000-09-09,2000-09
新华网和263首都在线双双推出奥运专题网站,2000-09-09,2000-09
追风运动在路上,2000-09-09,2000-09
崔殷泽网上足球学院开通,2000-09-09,2000-09
李鹏会见爱沙尼亚议会爱中友好小组成员,2000-09-09,2000-09
晨光中的弯道（甘肃）(天地一瞬),2000-09-09,2000-09
常熟：开发名城的人文资源,2000-09-09,2000-09
“白雪公主”吴燕琳(人物春秋),2000-09-09,2000-09
少点炒作(本月话题·演艺人的文化素养⑥),2000-09-09,2000-09
《军事辞海》序,2000-09-09,2000-09
歌曲中“洋词”现象(直言录),2000-09-09,2000-09
唐山九月举办中国评剧艺术节,2000-09-09,2000-09
西班牙戏剧家代表团访华,2000-09-09,2000-09
话剧《我听见了爱》公演在即,2000-09-09,2000-09
桑兰热心公益,2000-09-09,2000-09
“赛琳”注重艺术品位,2000-09-09,2000-09
水乡（乐凯之光）,2000-09-09,2000-09
诗友刘征,2000-09-09,2000-09
怀念老友关山月,2000-09-09,2000-09
行者东海（品书札记）,2000-09-09,2000-09
西部放歌,2000-09-09,2000-09
故土乡情（路边拾翠）,2000-09-09,2000-09
从东北望新疆,2000-09-09,2000-09
用典宜讲究（大地漫笔）,2000-09-09,2000-09
执勤点上（走进西部）,2000-09-09,2000-09
写景写意写情（艺坛人物）,2000-09-09,2000-09
郑成功台湾受降图（中国画）,2000-09-09,2000-09
陈小奇：去婉约而趋凝重(艺苑掇英),2000-09-09,2000-09
戴柯和他的油画艺术,2000-09-09,2000-09
关爱人生的油画家,2000-09-09,2000-09
多书卷广闻见,2000-09-09,2000-09
“文”“质”相辅,2000-09-09,2000-09
“中国当代著名艺术家走进云南”画展在京开幕（画坛风景线）,2000-09-09,2000-09
《大美术史论文选》出版（画坛风景线）,2000-09-09,2000-09
竹林深处（乐凯之光）,2000-09-09,2000-09
大地书影,2000-09-09,2000-09
草原上的《母亲》歌（神州情思）,2000-09-09,2000-09
更上一层楼（走进西部）,2000-09-09,2000-09
恒河日出,2000-09-09,2000-09
五十年前的冰雕塑像,2000-09-09,2000-09
什么人“无畏”（金台随感）,2000-09-09,2000-09
火灰食（多味斋）,2000-09-09,2000-09
阿根廷总统德拉鲁阿今起对我国进行国事访问（人物介绍）,2000-09-10,2000-09
江泽民会见穆沙拉夫,2000-09-10,2000-09
江泽民会见巴希尔,2000-09-10,2000-09
江主席在美出席 中国民族音乐会并会见美国企业界人士,2000-09-10,2000-09
李鹏会见爱沙尼亚总统梅里,2000-09-10,2000-09
北京地区天气预报,2000-09-10,2000-09
江泽民主席离开纽约回国,2000-09-10,2000-09
朱镕基分别会见美国日本客人,2000-09-10,2000-09
联合国千年首脑会议闭幕,2000-09-10,2000-09
出席千年盛会取得丰硕成果,2000-09-10,2000-09
李鹏会见爱沙尼亚总统梅里,2000-09-10,2000-09
出席千年盛会取得丰硕成果,2000-09-10,2000-09
欢聚民俗村,2000-09-10,2000-09
花好月圆,2000-09-10,2000-09
钱其琛会见美国务卿等官员,2000-09-10,2000-09
中国将成为世界旅游大国,2000-09-10,2000-09
我残疾人艺术团访美首演成功,2000-09-10,2000-09
我海军舰艇编队结束访问夏威夷,2000-09-10,2000-09
美参院将最后审议PNTR议案,2000-09-10,2000-09
刀锯声声响林木日日稀（耳闻目睹）,2000-09-10,2000-09
断电半年 愁坏众村民电网改造 令人气难平(监督哨),2000-09-10,2000-09
热线冷谈（读者论坛）,2000-09-10,2000-09
新疆硅化木亟待保护（呼吁）,2000-09-10,2000-09
国家计委进一步制止农村电网改造乱收费行为（资料）,2000-09-10,2000-09
立足优势广扩客源,2000-09-10,2000-09
储户取款遭拒付合法权益被侵害（记者来信）,2000-09-10,2000-09
不按电业局的意思办别想用电,2000-09-10,2000-09
嘉鱼农电改造仍有“三乱”现象,2000-09-10,2000-09
编者按,2000-09-10,2000-09
彭珮云离京出访北欧两国,2000-09-10,2000-09
加紧培养选拔优秀年轻干部,2000-09-10,2000-09
切实加强国有企业党风廉政建设,2000-09-10,2000-09
李岚清会见全国优秀教师师德报告团代表代表党中央国务院向全国广大教师祝贺节日,2000-09-10,2000-09
施光南诞辰60周年纪念音乐会举行,2000-09-10,2000-09
进一步加大吸引跨国公司来华投资力度,2000-09-10,2000-09
李岚清同爱尔兰副总理会谈,2000-09-10,2000-09
认真落实《决定》精神努力稳定低生育水平,2000-09-10,2000-09
自觉实践“三个代表”要求维护人民群众根本利益,2000-09-10,2000-09
李岚清会见泰国客人,2000-09-10,2000-09
江泽民主席回到北京,2000-09-11,2000-09
朱镕基看望“9·8”爆炸事故受伤人员,2000-09-11,2000-09
李鹏与拉脱维亚议长斯特劳梅会谈,2000-09-11,2000-09
北京地区天气预报,2000-09-11,2000-09
凤凰山下红烛情,2000-09-11,2000-09
农民更需帮到位（今日谈）,2000-09-11,2000-09
胡锦涛会见土耳其国防部长,2000-09-11,2000-09
阿根廷总统抵达上海,2000-09-11,2000-09
安徽建设数据通信网工程（新闻简报）,2000-09-11,2000-09
重庆发现一植物种质基因库（新闻简报）,2000-09-11,2000-09
信息产品市场规模逐步扩大（新闻简报）,2000-09-11,2000-09
我每二十名学生有一位老师（新闻简报）,2000-09-11,2000-09
与奥林匹克同行,2000-09-11,2000-09
机器人技术产品交流演示会举行,2000-09-11,2000-09
锡林浩特牛羊肉产品展销会闭幕,2000-09-11,2000-09
“福特汽车环保奖”来到中国,2000-09-11,2000-09
烟台研制出环保型液态有机肥,2000-09-11,2000-09
樟树市国税局实现办公自动化,2000-09-11,2000-09
大山里的正气歌,2000-09-11,2000-09
变开放式管理为集中规范管理,2000-09-11,2000-09
继续实行稳健的货币政策,2000-09-11,2000-09
劳动保障专家咨询委员会成立,2000-09-11,2000-09
我超级VCD标准成为国际标准,2000-09-11,2000-09
世界包装组织亚洲中心落户中国,2000-09-11,2000-09
三峡输变电工程获四点六亿美元保险,2000-09-11,2000-09
裕兴公司新产品DVD健舞王面市,2000-09-11,2000-09
沧州新华区多形式做好社区党建,2000-09-11,2000-09
武警黄金一总队科技干部争做贡献,2000-09-11,2000-09
武警甘肃总队二支队积极帮扶地方,2000-09-11,2000-09
触目惊心的现实,2000-09-11,2000-09
为“打得赢”提供保障,2000-09-11,2000-09
刘怡昕先进事迹报告会在京举行,2000-09-11,2000-09
福建农村党支部“两推一选”全面铺开,2000-09-11,2000-09
廊坊信访工作重实效,2000-09-11,2000-09
立足群众安居乐业努力创建文明社区,2000-09-11,2000-09
明天气象预报,2000-09-11,2000-09
两岸青年携手迈向新世纪研讨会举行,2000-09-11,2000-09
张家港：构筑城乡一体文明,2000-09-11,2000-09
统战部和各民主党派中央举办中秋联谊活动,2000-09-11,2000-09
中国船员救起两名菲律宾遇险渔民,2000-09-11,2000-09
在京台胞举行中秋茶话会,2000-09-11,2000-09
海峡两岸记者联合赴藏采访,2000-09-11,2000-09
新疆：不含水分确保按时完成,2000-09-11,2000-09
青海：确保订阅经费提供优质服务,2000-09-11,2000-09
杭州：扩大覆盖面填补空白点,2000-09-11,2000-09
研讨我国开放式基金运作与监管,2000-09-11,2000-09
万国权会见台湾客人,2000-09-11,2000-09
助学：为西部大开发雪中送炭（人民论坛）,2000-09-11,2000-09
中国电信到甘南,2000-09-11,2000-09
凤凰山下红烛情,2000-09-11,2000-09
贺兰岩画世所罕见,2000-09-11,2000-09
全国中小学十杰教师评选揭晓(尊师风气浓重教见行动),2000-09-11,2000-09
我国教师社会地位明显提升(尊师风气浓重教见行动),2000-09-11,2000-09
仙桃市教师工资由财政统一发放(尊师风气浓重教见行动),2000-09-11,2000-09
湘财证券为高校教师过节(尊师风气浓重教见行动),2000-09-11,2000-09
天津工业大学成立,2000-09-11,2000-09
中小学教师学历水平大幅提高(尊师风气浓重教见行动),2000-09-11,2000-09
各方瞩目 广泛交往 注重效果,2000-09-11,2000-09
李鹏与拉脱维亚议长斯特劳梅会谈,2000-09-11,2000-09
古城里加迎嘉宾(通讯),2000-09-11,2000-09
朝鲜隆重庆祝建国52周年,2000-09-11,2000-09
阿拉法特提议推迟建国,2000-09-11,2000-09
朝外务省就美道歉表态,2000-09-11,2000-09
朝劳动党中央书记金容淳将访韩,2000-09-11,2000-09
发展中国家呼吁消除贫困,2000-09-11,2000-09
俄将再次大裁军,2000-09-11,2000-09
南联盟外贸大幅增长,2000-09-11,2000-09
世界反可卡因大会在墨举行,2000-09-11,2000-09
为“走出去”开放战略提供金融支持（中国企业走向世界）,2000-09-11,2000-09
威尼斯电影节闭幕,2000-09-11,2000-09
中国宏观经济出现重要转机,2000-09-11,2000-09
亚太经合组织财长会议闭幕,2000-09-11,2000-09
独联体国家加强税务合作,2000-09-11,2000-09
“愿为中国保险业发展做贡献”（记者专访）,2000-09-11,2000-09
西藏少儿艺术团抵阿演出,2000-09-11,2000-09
机上访李宁(悉尼走笔),2000-09-11,2000-09
国际象棋世界杯赛许昱华获决赛权,2000-09-11,2000-09
中国体育科学代表团获荣誉奖牌,2000-09-11,2000-09
好事多磨(悉尼手记),2000-09-11,2000-09
足球甲A联赛谁夺冠仍是谜,2000-09-11,2000-09
自摩中心举行奥运健儿出征誓师会,2000-09-11,2000-09
中央办公厅首届老干部健身运动会举行,2000-09-11,2000-09
韩国和朝鲜将在悉尼奥运会开幕式上同时入场,2000-09-11,2000-09
奥运会上的华人志愿者,2000-09-11,2000-09
大学生运动会健儿屡破纪录,2000-09-11,2000-09
城市规划百姓先知,2000-09-11,2000-09
电，又短缺了吗？,2000-09-11,2000-09
价格战不是怪圈（经济茶座）,2000-09-11,2000-09
让期货市场服务粮食流通体制改革（观点）,2000-09-11,2000-09
扭亏为盈后的忧虑,2000-09-11,2000-09
来一次文凭打假如何？(下乡手记（54）),2000-09-11,2000-09
居民选购月饼最看重口味,2000-09-11,2000-09
涉水收贷,2000-09-11,2000-09
汽车走私落入法网,2000-09-11,2000-09
建行住房贷款名牌迭出银行乐业百姓安居,2000-09-11,2000-09
国有股减持是机遇（金海观潮）,2000-09-11,2000-09
保险资金入市初露锋芒（热点聚焦）,2000-09-11,2000-09
昌乐农家子弟上学不愁助学贷款解人之忧,2000-09-11,2000-09
小公共该怎么走（市场漫笔）,2000-09-11,2000-09
新经济与风险资本洽谈会将举办（财经短波）,2000-09-11,2000-09
安徽信托投资公司业绩骄人（财经短波）,2000-09-11,2000-09
绥芬河口岸过货额迅猛增长（财经短波）,2000-09-11,2000-09
黄冈人行强化法规纪律观念（财经短波）,2000-09-11,2000-09
加格达奇工商局两整顿见成效（财经短波）,2000-09-11,2000-09
海关纠风动真格,2000-09-11,2000-09
工行与渣打银行加强合作,2000-09-11,2000-09
“农趣馆”的魅力,2000-09-11,2000-09
找准定位以短养长（农村经济观察）,2000-09-11,2000-09
不妨“到别处走走”（农村杂谈）,2000-09-11,2000-09
善待海洋,2000-09-11,2000-09
怀柔富绿绿富怀柔（地方经济）,2000-09-11,2000-09
老区农民卖得“怪”（农村新事）,2000-09-11,2000-09
“暗荒”现象不容忽视（来信）,2000-09-11,2000-09
田头时兴“钟点工”（农村新事）,2000-09-11,2000-09
又一批名企老总进校“充电”,2000-09-11,2000-09
60家大煤矿为何关闭破产（头条竞赛）,2000-09-11,2000-09
建立公平竞争的法治环境（企业论坛）,2000-09-11,2000-09
胆大心细（各抒己见）,2000-09-11,2000-09
新希望涉足化工领域（名企动向）,2000-09-11,2000-09
开滦开始吸纳私营资本（名企动向）,2000-09-11,2000-09
红豆继续实行地区代理制（名企动向）,2000-09-11,2000-09
哪些因素影响了企业效益,2000-09-11,2000-09
李鹏分别会见拉脱维亚总统总理,2000-09-12,2000-09
几内亚总理西迪梅（人物介绍）,2000-09-12,2000-09
江泽民主席会见西哈努克国王,2000-09-12,2000-09
珍惜荣誉 再接再厉 再创辉煌,2000-09-12,2000-09
一切为了伤员的宝贵生命,2000-09-12,2000-09
共产党员要牢固树立党的意识,2000-09-12,2000-09
卫生部派医疗专家赴新疆协助救治伤员,2000-09-12,2000-09
弄清群众在想些什么尽力为群众做点什么,2000-09-12,2000-09
中国体育代表团启程赴悉尼,2000-09-12,2000-09
北京地区天气预报,2000-09-12,2000-09
国有独资商业银行改革又迈新步,2000-09-12,2000-09
在西部大开发中起到骨干作用,2000-09-12,2000-09
汽车工业面对燃油涨价（经济视点）,2000-09-12,2000-09
打私铁军,2000-09-12,2000-09
棉花总量仍供大于求,2000-09-12,2000-09
中国移动互联网骨干网工程启动,2000-09-12,2000-09
警钟长鸣把安全工作落到实处,2000-09-12,2000-09
凭证式（三期）国债15日起发行,2000-09-12,2000-09
8月份工业同比增长12．8％,2000-09-12,2000-09
铸造中华“长剑”,2000-09-12,2000-09
一切为了伤员的宝贵生命,2000-09-12,2000-09
各地将深化“青年文明社区”创建工作,2000-09-12,2000-09
全国人大常委会执法检查组在宁执法检查,2000-09-12,2000-09
“环球二十位最具影响世纪女性”评选,2000-09-12,2000-09
保护母亲河行动将接受最大一笔捐赠,2000-09-12,2000-09
兰州军区某油库注重提高官兵法律素质,2000-09-12,2000-09
济南军区某部育才工作卓有成效,2000-09-12,2000-09
武警交通指挥部四工区为首都筑广厦,2000-09-12,2000-09
重庆对处理“礼金”有新规定为谋取不正当利益赠送礼金和有价证券以行贿论处,2000-09-12,2000-09
加强职称考试管理 确保公平公开公正,2000-09-12,2000-09
针织服装质量明显提高（曝光台）,2000-09-12,2000-09
珍惜荣誉 再接再厉 再创辉煌,2000-09-12,2000-09
弄清群众在想些什么尽力为群众做点什么,2000-09-12,2000-09
统战部国办举行中秋招待会,2000-09-12,2000-09
成思危会见各国议会联盟英国议员团,2000-09-12,2000-09
司马义·艾买提会见日本青年代表团,2000-09-12,2000-09
钱正英会见国际妇女论坛代表团,2000-09-12,2000-09
中共代表出访法国,2000-09-12,2000-09
全国对口援藏工作取得巨大成效,2000-09-12,2000-09
阿根廷总统在上海访问,2000-09-12,2000-09
国务院侨办举行中秋茶话会,2000-09-12,2000-09
香港第二届立法会选举产生,2000-09-12,2000-09
体现香港循序渐进发展民主步伐,2000-09-12,2000-09
明天气象预报,2000-09-12,2000-09
奥运报道,2000-09-12,2000-09
高速路腰斩古长城(文物保护世纪行),2000-09-12,2000-09
全国职工电脑知识普及应用活动开展,2000-09-12,2000-09
长春国际教育展览会闭幕,2000-09-12,2000-09
珠海结束没有大学历史,2000-09-12,2000-09
全国医院院长论坛结束,2000-09-12,2000-09
中国文化达标工程在港启动,2000-09-12,2000-09
宋庆龄基金会向陕甘宁学校捐书,2000-09-12,2000-09
中国日报网站推出频道,2000-09-12,2000-09
中国心理健康教育网开通,2000-09-12,2000-09
中央电视台英语频道即将开播,2000-09-12,2000-09
全国青少年国防教育巡展在即,2000-09-12,2000-09
世界消化学大会在京举行,2000-09-12,2000-09
清华构建数字图像实验室,2000-09-12,2000-09
金联安印章管理系统达标,2000-09-12,2000-09
福建新大陆“新品”迭出,2000-09-12,2000-09
农民“赶集”问科技,2000-09-12,2000-09
北京史家胡同小学探索教学新路,2000-09-12,2000-09
浙江整顿文化娱乐场所,2000-09-12,2000-09
我国首次推出用药安全保险,2000-09-12,2000-09
感受悉尼平常心（奥运报道·悉尼走笔）,2000-09-12,2000-09
加拿大又一运动员药检不过关（奥运报道）,2000-09-12,2000-09
体操：状态好过预料（奥运报道）,2000-09-12,2000-09
举重：夺金目标不变（奥运报道）,2000-09-12,2000-09
澳游泳选手接受兴奋剂检测（奥运报道）,2000-09-12,2000-09
射击：赛场新变化（奥运报道）,2000-09-12,2000-09
公务员要带头讲普通话,2000-09-12,2000-09
李鹏分别会见拉脱维亚总统总理,2000-09-12,2000-09
李鹏出席拉副议长茶会,2000-09-12,2000-09
审时度势再缓建国（新闻分析）,2000-09-12,2000-09
瑞士希望加强与中国全面合作,2000-09-12,2000-09
科技合作：互惠互利 共同发展,2000-09-12,2000-09
医疗合作：真诚援助 成果斐然,2000-09-12,2000-09
教育合作发展经济 育人为先,2000-09-12,2000-09
“南南合作”树典范,2000-09-12,2000-09
农业合作功在千秋 利在长远,2000-09-12,2000-09
编者按（中非合作论坛·专题报道）,2000-09-12,2000-09
“走出去”需要加强服务和管理,2000-09-12,2000-09
科学地总结经验(思想纵横),2000-09-12,2000-09
弘扬科学精神更带根本性和基础性（学习通信）,2000-09-12,2000-09
改革实践促进社会思想不断进步,2000-09-12,2000-09
“骆驼”流动医院,2000-09-12,2000-09
不让一个贫困生失学（热点追踪）,2000-09-12,2000-09
“走读乡官”要住下来（记者观察）,2000-09-12,2000-09
“政务公开”别摆样子（采访随想）,2000-09-12,2000-09
林海火车“招手停”（地方热线）,2000-09-12,2000-09
邵章仁：卖水不为稻粱谋（人生舞台）,2000-09-12,2000-09
食宿农家查减负（公仆访谈）,2000-09-12,2000-09
“重建厂，轻建党”问题不容忽视（本期特稿）,2000-09-12,2000-09
真理与面子（议论风生）,2000-09-12,2000-09
提高干警素质是关键（公仆心声）,2000-09-12,2000-09
落实在“一线”,2000-09-12,2000-09
某军代局用“三个代表”增强党员党性观念,2000-09-12,2000-09
于素朴中自见光辉,2000-09-12,2000-09
闽台合作互动呈上升势头,2000-09-12,2000-09
海峡难隔亲情两岸血浓于水,2000-09-12,2000-09
港澳台侨两周要闻回顾,2000-09-12,2000-09
粤港澳台科技领域合作前景广阔,2000-09-12,2000-09
专家预测今年澳门经济将呈正增长,2000-09-12,2000-09
台湾高雄参访团访豫,2000-09-12,2000-09
澳门逐步开放电讯市场,2000-09-12,2000-09
香港经济走向新时代,2000-09-12,2000-09
李鹏分别与俄议会两院主席会谈,2000-09-13,2000-09
奥运村升起五星红旗,2000-09-13,2000-09
江泽民与汉斯—亚当二世互致贺电,2000-09-13,2000-09
江泽民主席签署通令,2000-09-13,2000-09
江泽民与阿道夫·奥吉互致贺电,2000-09-13,2000-09
新疆可以在五至十年内，取得基础设施和生态环境建设的突破性进展,2000-09-13,2000-09
江泽民会见美国客人,2000-09-13,2000-09
拆墙透绿好（今日谈）,2000-09-13,2000-09
朱镕基会见瑞士联邦主席,2000-09-13,2000-09
北京地区天气预报,2000-09-13,2000-09
北京商业打造新形象（经济视点）,2000-09-13,2000-09
新疆可以在五至十年内，取得基础设施和生态环境建设的突破性进展,2000-09-13,2000-09
减轻农民负担是当前农村工作的一项紧迫任务,2000-09-13,2000-09
以“三个代表”的重要思想为指导进一步巩固和完善缉私新体制,2000-09-13,2000-09
巨资投向旅游基础设施,2000-09-13,2000-09
第四届中国投资贸易洽谈会闭幕,2000-09-13,2000-09
认清形势迎接挑战深化改革以创新求发展,2000-09-13,2000-09
扭亏为赢的秘诀（思想政治工作在基层）,2000-09-13,2000-09
贯彻科技强军战略思想培养高素质军事人才,2000-09-13,2000-09
中央政府驻澳联络办与澳门各界品茗赏月,2000-09-13,2000-09
天涯共此时,2000-09-13,2000-09
四川省交通厅原副厅长郑道访被判处死刑,2000-09-13,2000-09
朱镕基会见瑞士联邦主席,2000-09-13,2000-09
朱镕基会见日本客人,2000-09-13,2000-09
朱镕基会见爱尔兰客人,2000-09-13,2000-09
外交部发言人答记者问,2000-09-13,2000-09
在京台胞联欢庆中秋,2000-09-13,2000-09
牢牢把握正确舆论导向以新的姿态开创新局面,2000-09-13,2000-09
“三个一”为西部文化发展播撒薪火（人民论坛）,2000-09-13,2000-09
几内亚总理在上海访问,2000-09-13,2000-09
尉健行会见乌干达客人,2000-09-13,2000-09
外交部发言人发表评论,2000-09-13,2000-09
迟浩田会见瑞士联邦主席（友好往来）,2000-09-13,2000-09
许嘉璐会见波兰客人（友好往来）,2000-09-13,2000-09
司马义·艾买提会见日本客人（友好往来）,2000-09-13,2000-09
王兆国会见日本客人（友好往来）,2000-09-13,2000-09
新华宋健会见日本友人（友好往来）,2000-09-13,2000-09
傅全有与多哥总参谋长会谈（友好往来）,2000-09-13,2000-09
中联部代表团赴朝鲜访问（友好往来）,2000-09-13,2000-09
