北京地区天气预报,2001-04-01,2001-04
吉林努力探索森林防火新机制  宁夏抓好春季森林防火保安全,2001-04-01,2001-04
福建强化环保基础设施建设,2001-04-01,2001-04
内蒙古推进农牧业产业化,2001-04-01,2001-04
市长办公会上的环保意识,2001-04-01,2001-04
该选谁，先听群众意见,2001-04-01,2001-04
生产性商品打假更要从严,2001-04-01,2001-04
卡塔尔首相阿卜杜拉,2001-04-01,2001-04
“骆驼”的足迹,2001-04-01,2001-04
山西煤炭外销量大幅增长,2001-04-01,2001-04
“骆驼”的足迹,2001-04-01,2001-04
规范企业职工基本养老保险个人账户管理,2001-04-01,2001-04
加强中小企业质量工作,2001-04-01,2001-04
外来工可在珠海退休养老,2001-04-01,2001-04
江苏撤并乡镇五百五十个,2001-04-01,2001-04
东亚—拉美合作论坛外长会议闭幕,2001-04-01,2001-04
谴责美议员阻挠北京申奥,2001-04-01,2001-04
南逮捕前总统行动受阻,2001-04-01,2001-04
澳门各界纪念基本法颁布8周年,2001-04-01,2001-04
宁夏投资贸易洽谈会将举行,2001-04-01,2001-04
河北集中打击涉爆违法犯罪活动,2001-04-01,2001-04
明天气象预报,2001-04-01,2001-04
五莲实施水土保持三大工程,2001-04-01,2001-04
衢州“农技一一○”助农致富,2001-04-01,2001-04
重庆：小商品市场火灾隐患严重,2001-04-01,2001-04
海南：非法传销死灰复燃,2001-04-01,2001-04
慈利学教活动促农业结构调整,2001-04-01,2001-04
大余县直机关对口帮扶为民解困,2001-04-01,2001-04
海口市新华区民主公开解难题,2001-04-01,2001-04
“种交会”火了土默川,2001-04-01,2001-04
龙井吐翠香更浓,2001-04-01,2001-04
宽甸：医疗扶贫到农家,2001-04-01,2001-04
昆医附一院一挂号员被开除公职,2001-04-01,2001-04
乐山大佛“整体美容”,2001-04-01,2001-04
南京主要道路破墙透绿,2001-04-01,2001-04
泰安将恢复东岳庙会,2001-04-01,2001-04
延庆野鸭湖成为鸟类天堂,2001-04-01,2001-04
北京作协召开青年作家作品研讨会,2001-04-01,2001-04
长篇小说《大法官》出版,2001-04-01,2001-04
二十一世纪美学的新视角,2001-04-01,2001-04
长篇小说《大房子》出版,2001-04-01,2001-04
《中国侗族民俗与稻作文化》出版,2001-04-01,2001-04
送小说到乡下去,2001-04-01,2001-04
抒情与哲理的融合,2001-04-01,2001-04
与困难搏战中的力量和美,2001-04-01,2001-04
长篇传记《敦煌守护神──常书鸿》,2001-04-01,2001-04
春雨江南,2001-04-01,2001-04
三年“一剑”谱华章,2001-04-01,2001-04
江泽民等参加首都义务植树活动,2001-04-02,2001-04
开展“三个代表”重要思想学习教育  促进农村经济发展和社会全面进步,2001-04-02,2001-04
湖南着手建设十大生态林工程,2001-04-02,2001-04
云南加快实施天然林保护工程,2001-04-02,2001-04
志愿者的心愿,2001-04-02,2001-04
孟建柱任江西省委书记,2001-04-02,2001-04
保证经济正常运行的迫切需要,2001-04-02,2001-04
北京地区天气预报,2001-04-02,2001-04
首都各界200万人义务植树,2001-04-02,2001-04
开展“三个代表”重要思想学习教育  促进农村经济发展和社会全面进步,2001-04-02,2001-04
实施人才战略做好毕业生资源配置,2001-04-02,2001-04
春满神州忙植树,2001-04-02,2001-04
赣州  植树祭祖漾新风,2001-04-02,2001-04
滨海  每人栽10株意杨,2001-04-02,2001-04
依法规范证券公司股票承销业务,2001-04-02,2001-04
陕西民办高校在校生接近全国十分之一,2001-04-02,2001-04
武汉人喝出一个牛奶产业,2001-04-02,2001-04
谴责日右翼歪曲历史,2001-04-02,2001-04
巴呼吁国际社会制止以暴行,2001-04-02,2001-04
辛格访美  投石问路,2001-04-02,2001-04
古批评美不执行京都议定书,2001-04-02,2001-04
霸气十足,2001-04-02,2001-04
伊拉克又遭美战机轰炸,2001-04-02,2001-04
旅韩侨界揭批“法轮功”,2001-04-02,2001-04
米洛舍维奇被捕,2001-04-02,2001-04
东京地方法院宣布一邪教组织破产,2001-04-02,2001-04
美再次进行导弹拦截试验,2001-04-02,2001-04
战火中的泰托沃,2001-04-02,2001-04
歪理邪说蛊惑人心,2001-04-02,2001-04
考虑历史  立足现实  着眼未来,2001-04-02,2001-04
全国通电行政村基本通广播电视,2001-04-02,2001-04
警惕电子“海洛因”,2001-04-02,2001-04
继续加大社会扶贫工作力度,2001-04-02,2001-04
全国保安“六一”统一换着新式服装标志,2001-04-02,2001-04
卡塔尔首相抵京访华,2001-04-02,2001-04
曾庆红离京赴新加坡访问,2001-04-02,2001-04
苏丹第一副总统访问四川,2001-04-02,2001-04
寻找回来的世界,2001-04-02,2001-04
海峡两岸青年展望新世纪,2001-04-02,2001-04
市场报扩至16版,2001-04-02,2001-04
外交部发言人发表谈话,2001-04-02,2001-04
明天气象预报,2001-04-02,2001-04
张竭诚同志逝世,2001-04-02,2001-04
孙萍同志逝世,2001-04-02,2001-04
保证经济正常运行的迫切需要,2001-04-02,2001-04
虚假招标根子在哪里,2001-04-02,2001-04
让经济列车跑得又快又稳,2001-04-02,2001-04
第十个税收宣传月拉开帷幕,2001-04-02,2001-04
国际资本市场看好“中国石油”,2001-04-02,2001-04
阿拉山口海关查获羚羊角走私大案,2001-04-02,2001-04
厦门农行构筑信贷“防火墙”,2001-04-02,2001-04
伊春实现20年无重大森林火灾,2001-04-02,2001-04
给管理部门提个醒,2001-04-02,2001-04
黑河水调之所思,2001-04-02,2001-04
生态农业  让经济可持续发展,2001-04-02,2001-04
浙江“金钉子”科学意义重大,2001-04-02,2001-04
首都大学生争创“绿色大运”,2001-04-02,2001-04
网上电视直播图像清晰流畅,2001-04-02,2001-04
“希望工程”开办“希望网校”,2001-04-02,2001-04
今年地球日主题确定,2001-04-02,2001-04
中日合作治理黄土高原,2001-04-02,2001-04
寻找市场切入点,2001-04-02,2001-04
广西开通教师教育网站,2001-04-02,2001-04
成都拟办西部高新技术洽谈会,2001-04-02,2001-04
辽宁工业污染源达标排放,2001-04-02,2001-04
从美丽到富饶,2001-04-02,2001-04
为祖国和平统一奔走呼号,2001-04-02,2001-04
“现在来北京正是好时候”,2001-04-02,2001-04
欧盟与俄罗斯关系升温,2001-04-02,2001-04
神经细胞自体移植新方法,2001-04-02,2001-04
防止司机分神监视系统,2001-04-02,2001-04
海水中发现可分解环境激素细菌,2001-04-02,2001-04
水稻基因研究取得成果,2001-04-02,2001-04
里海环境研究进展顺利,2001-04-02,2001-04
留尼旺岛火山爆发,2001-04-02,2001-04
德将加强对青少年保护,2001-04-02,2001-04
“燕麦团队”整装待发,2001-04-02,2001-04
阿根廷  振兴经济新举措,2001-04-02,2001-04
短道速滑单项世锦赛  中国选手夺两枚金牌,2001-04-02,2001-04
世界杯女子花剑赛  罗马尼亚队获冠军,2001-04-02,2001-04
美国游泳赛好戏连台  两项世界纪录被刷新,2001-04-02,2001-04
“辽小虎”中止实德连胜,2001-04-02,2001-04
男篮明星赛  龙虎斗长春,2001-04-02,2001-04
上海中远客场败北,2001-04-02,2001-04
北京女排获资助,2001-04-02,2001-04
第八届中国围棋棋王赛决出四强,2001-04-02,2001-04
一批新秀脱颖而出,2001-04-02,2001-04
散打王争霸赛新人表现出色,2001-04-02,2001-04
雪域“圣水”助北京申奥,2001-04-02,2001-04
中国电信赞助北京奥申委,2001-04-02,2001-04
北京棋文化国际博览会准备就序,2001-04-02,2001-04
三菱事件带来什么,2001-04-02,2001-04
三菱帕杰罗事件始末,2001-04-02,2001-04
迫在眉睫,2001-04-02,2001-04
危机之时见真功,2001-04-02,2001-04
经济数据,2001-04-02,2001-04
话说“馒头办”,2001-04-02,2001-04
涉外产品服务投诉案,2001-04-02,2001-04
完善税制  依法征管  增加税收,2001-04-02,2001-04
基金步入快车道,2001-04-02,2001-04
怎样买卖开放式基金,2001-04-02,2001-04
积极应对外汇管理新形势,2001-04-02,2001-04
农民上网能否淘金,2001-04-02,2001-04
学会科学种田,2001-04-02,2001-04
绿色产品富了乡亲,2001-04-02,2001-04
共兴伟业  共铸辉煌,2001-04-02,2001-04
长治  绿色经济现生机,2001-04-02,2001-04
邵阳  柑橘改良结硕果,2001-04-02,2001-04
“七连冠”的故事,2001-04-02,2001-04
谨防出现“空白地带”,2001-04-02,2001-04
“资本”＋“主意”,2001-04-02,2001-04
CEO：变化仅仅是称谓？,2001-04-02,2001-04
人力资本冲击企业法人治理结构,2001-04-02,2001-04
企业老板，你想改名CEO吗,2001-04-02,2001-04
不只是打假,2001-04-02,2001-04
我国最大的水资源再利用项目建成,2001-04-02,2001-04
昆明：违规黑车为何还在跑,2001-04-02,2001-04
激励不足、行政干预最影响企业家发挥作用,2001-04-02,2001-04
对症下药  标本兼治,2001-04-03,2001-04
大海骄子,2001-04-03,2001-04
第五次人口普查主要数据第二号公报公布,2001-04-03,2001-04
金大中总统接受本报专访,2001-04-03,2001-04
中方向美方提出严正交涉和抗议,2001-04-03,2001-04
我全力搜救落水飞行员,2001-04-03,2001-04
北京地区天气预报,2001-04-03,2001-04
朱镕基与卡塔尔首相会谈,2001-04-03,2001-04
目击北京垃圾处理,2001-04-03,2001-04
期待人人参与,2001-04-03,2001-04
普通高校招生实施新规定,2001-04-03,2001-04
三峡工程设立建设质量特别奖,2001-04-03,2001-04
依法加强对上市公司的检查工作,2001-04-03,2001-04
我国外债余额减少61亿美元,2001-04-03,2001-04
北京五一起发布空气质量预报,2001-04-03,2001-04
中外专家将联手考察广西乐业天坑群,2001-04-03,2001-04
黄河之水“天上”来  科学调度缓旱情,2001-04-03,2001-04
外出打工去挣钱  学龄青年辍学多,2001-04-03,2001-04
“120”急救未救急  性命攸关谁负责,2001-04-03,2001-04
盲目引种未致富  无奈砍倒刺梨树,2001-04-03,2001-04
金大中总统接受本报专访,2001-04-03,2001-04
各国议联大会开幕,2001-04-03,2001-04
以军劫持巴安全部队五成员  巴警告将导致紧张局势升级,2001-04-03,2001-04
首晤便交锋,2001-04-03,2001-04
澳总理会见张万年,2001-04-03,2001-04
唐家璇与韦德里纳会谈,2001-04-03,2001-04
金永南会见我共青团代表团,2001-04-03,2001-04
太阳出现十余年最大黑子  强日冕喷射影响无线通信,2001-04-03,2001-04
米洛舍维奇被捕前后,2001-04-03,2001-04
英国推迟选举,2001-04-03,2001-04
欺世盗名  逼人就范,2001-04-03,2001-04
拉美六国人民期待江泽民主席的访问,2001-04-03,2001-04
国务院安全生产委员会成立,2001-04-03,2001-04
冉绍之先进事迹报告会在济南举行,2001-04-03,2001-04
彭珮云在湖北考察工作,2001-04-03,2001-04
“党在我心中”青少年知识竞赛举办,2001-04-03,2001-04
《红色歌典》在京发布,2001-04-03,2001-04
嵊州领带“胃口”大,2001-04-03,2001-04
许嘉璐会见不丹客人,2001-04-03,2001-04
肖扬会见玻利维亚客人,2001-04-03,2001-04
王在希会见亲民党“三通”参访团,2001-04-03,2001-04
黑龙江“巾帼科技致富工程”正红火,2001-04-03,2001-04
明天气象预报,2001-04-03,2001-04
沈求我同志逝世,2001-04-03,2001-04
小品小戏奖大赛举行,2001-04-03,2001-04
“法轮功”违背宗教和社会基本准则,2001-04-03,2001-04
海协与亲民党“三通”参访团交换意见,2001-04-03,2001-04
对症下药  标本兼治,2001-04-03,2001-04
大海骄子,2001-04-03,2001-04
打假：维护外企合法权益,2001-04-03,2001-04
国内需求：经济增长的主动力,2001-04-03,2001-04
“十五”机电产品出口计划年增12％,2001-04-03,2001-04
银行卡将换新装,2001-04-03,2001-04
单端荧光灯合格仅一成多,2001-04-03,2001-04
中国交通保险公司成立,2001-04-03,2001-04
涤除邪恶保民安,2001-04-03,2001-04
辽宁  深入开展党群共富活动,2001-04-03,2001-04
重庆  让群众得实惠,2001-04-03,2001-04
廊坊  严把“四关”不走过场,2001-04-03,2001-04
赤峰  送温暖办实事,2001-04-03,2001-04
平湖行政区划调整力度大效果好,2001-04-03,2001-04
北京重视社会福利社会化,2001-04-03,2001-04
全国兴边富民行动现场会召开,2001-04-03,2001-04
北京团市委等筹排革命历史题材话剧,2001-04-03,2001-04
中华见义勇为基金会获捐赠,2001-04-03,2001-04
西宁指挥学校成为“花园式”警校,2001-04-03,2001-04
武警云南迪庆支队努力保护生态,2001-04-03,2001-04
炊事员立了一等功,2001-04-03,2001-04
蓝牙──信息时代的黑马,2001-04-03,2001-04
历史不容篡改,2001-04-03,2001-04
东亚地区经济将连续稳步增长,2001-04-03,2001-04
中国美国商会发表白皮书,2001-04-03,2001-04
美联航开通北京至芝加哥航线,2001-04-03,2001-04
加警方突袭黑帮“地狱天使”,2001-04-03,2001-04
日本金融业大重组,2001-04-03,2001-04
赴加受训英军因口蹄疫遭抗议,2001-04-03,2001-04
工业生态系统前景美好,2001-04-03,2001-04
利润与生命孰轻孰重,2001-04-03,2001-04
植物茎顶组织基因被发现,2001-04-03,2001-04
基因变异导致胆结石,2001-04-03,2001-04
通用推迟燃料电池车计划,2001-04-03,2001-04
日本重视碳纳米技术研究,2001-04-03,2001-04
一场外汇风波,2001-04-03,2001-04
手机短信息传递申奥情,2001-04-03,2001-04
中国男队首先遭遇南斯拉夫俄罗斯,2001-04-03,2001-04
中国选手获两项冠军,2001-04-03,2001-04
国家男篮集训队组成,2001-04-03,2001-04
支持北京申奥活动异彩纷呈,2001-04-03,2001-04
世界杯预选赛亚洲区第九小组开战,2001-04-03,2001-04
世界网球最新排名  阿加西仍排在首位,2001-04-03,2001-04
里斯本半程马拉松  肯尼亚女将创佳绩,2001-04-03,2001-04
全国围棋乙级联赛  中外好手云集济南,2001-04-03,2001-04
全国山地车赛结束  六枚金牌各有归属,2001-04-03,2001-04
首都高校篮球邀请赛开球,2001-04-03,2001-04
世界女排大奖赛将在哈尔滨举办,2001-04-03,2001-04
多伦多申奥报告书全文上网,2001-04-03,2001-04
马克思主义唯物论与中国共产党,2001-04-03,2001-04
还是“官本位”在作祟,2001-04-03,2001-04
情系西部大开发,2001-04-03,2001-04
教师的感染力,2001-04-03,2001-04
“保送”利弊谈,2001-04-03,2001-04
专家型教育决策的新范式,2001-04-03,2001-04
新经济离我们并不遥远,2001-04-03,2001-04
喜忧参半,2001-04-03,2001-04
选好教师更重要,2001-04-03,2001-04
春风化雨正当时,2001-04-03,2001-04
老实人与“老黄牛”,2001-04-03,2001-04
亡羊不补牢酿大祸,2001-04-03,2001-04
打赢了官司  讨不回损失,2001-04-03,2001-04
流失生是如何产生的？,2001-04-03,2001-04
人才市场该打假了,2001-04-03,2001-04
还要等多久？,2001-04-03,2001-04
“培训”通知满天飞  哪管基层怎招架,2001-04-03,2001-04
农村孩子贷款求学难,2001-04-03,2001-04
山西运城王家营村：造纸废水淹没耕地,2001-04-03,2001-04
宝成路复线走石段：路外伤亡事故增多,2001-04-03,2001-04
经理当“小工”,2001-04-03,2001-04
“新世纪话传统”西柏坡杯征文启事,2001-04-03,2001-04
农村文化现状有喜有忧,2001-04-03,2001-04
八十年的问候,2001-04-03,2001-04
电视需要批评,2001-04-03,2001-04
别把自己“典”给“名人词典”,2001-04-03,2001-04
岂可随意“钦点”名人,2001-04-03,2001-04
“名人录”实为“人名录”,2001-04-03,2001-04
“名人词典”是“害人词典”,2001-04-03,2001-04
黄山迎客松,2001-04-03,2001-04
北京国际艺术博览会即将举行,2001-04-03,2001-04
广州作家关注国企脱困,2001-04-03,2001-04
俄罗斯当代油画展在京举办,2001-04-03,2001-04
七十七位世界名人将聚首中国美术馆,2001-04-03,2001-04
舞台又见《楚宫恨》,2001-04-03,2001-04
名人故居的幽思,2001-04-03,2001-04
全国造林绿化表彰动员大会隆重举行,2001-04-04,2001-04
中方再次召见美国驻华大使,2001-04-04,2001-04
全国社会治安工作会议在京举行,2001-04-04,2001-04
江主席会见卡塔尔国首相,2001-04-04,2001-04
外交部发言人谈美国军用侦察机撞毁我军用飞机事件真相和中方有关立场,2001-04-04,2001-04
我增派舰船飞机全力搜寻跳伞飞行员,2001-04-04,2001-04
北京地区天气预报,2001-04-04,2001-04
江泽民主席发表谈话,2001-04-04,2001-04
全国造林绿化表彰动员大会隆重举行,2001-04-04,2001-04
全国社会治安工作会议在京举行,2001-04-04,2001-04
开展“严打”整治斗争  加强社会治安工作,2001-04-04,2001-04
外交部发言人发表谈话,2001-04-04,2001-04
教育部发言人发表谈话,2001-04-04,2001-04
中央军委批准军队审计建设发展规划,2001-04-04,2001-04
把农村税费改革主要内容公示于众,2001-04-04,2001-04
新疆第三次向塔里木河下游输水,2001-04-04,2001-04
规范上市公司行业分类标准,2001-04-04,2001-04
强烈谴责日本审定通过歪曲史实教科书,2001-04-04,2001-04
韩对日审定教科书表示强烈遗憾,2001-04-04,2001-04
谴责政府对美化侵略教科书“开绿灯”,2001-04-04,2001-04
日文科省宣称歪曲史实教科书“合格”,2001-04-04,2001-04
日本教科书审定制度,2001-04-04,2001-04
安南向我下落不明飞行员的家属表示慰问,2001-04-04,2001-04
委举办中国文化周,2001-04-04,2001-04
张万年会见澳外长,2001-04-04,2001-04
法总统会见唐家璇,2001-04-04,2001-04
美元与投票,2001-04-04,2001-04
教科文组织重申反对克隆人,2001-04-04,2001-04
普京发表国情咨文,2001-04-04,2001-04
中医在南非获得合法地位,2001-04-04,2001-04
大批安盟武装分子投诚,2001-04-04,2001-04
黑海国家建立海军合作组织,2001-04-04,2001-04
美将重启火星探测计划,2001-04-04,2001-04
迟浩田会见卡塔尔首相,2001-04-04,2001-04
何鲁丽会见玻利维亚客人,2001-04-04,2001-04
王忠禹会见摩洛哥客人,2001-04-04,2001-04
唐家璇回到北京,2001-04-04,2001-04
美军用侦察机撞击我军用飞机过程,2001-04-04,2001-04
李鹏会见卡塔尔首相,2001-04-04,2001-04
李鹏会见日本法务大臣,2001-04-04,2001-04
李岚清会见不丹客人,2001-04-04,2001-04
李岚清将出访欧亚三国,2001-04-04,2001-04
迟浩田与加蓬国防部长会谈,2001-04-04,2001-04
强烈谴责美侦察机撞毁我军用飞机侵犯我主权,2001-04-04,2001-04
美撞机事件严重违反国际法,2001-04-04,2001-04
钱其琛会见亲民党“三通”参访团,2001-04-04,2001-04
外交部发言人谈美国军用侦察机撞毁我军用飞机事件真相和中方有关立场,2001-04-04,2001-04
推动全民义务植树运动向纵深发展,2001-04-04,2001-04
农民增收：最紧迫的任务,2001-04-04,2001-04
海关总署转变职能初见成效,2001-04-04,2001-04
1400亿元贷款将投向基础设施建设,2001-04-04,2001-04
武汉种子交易会越做越大,2001-04-04,2001-04
茅台酒获国家原产地域保护,2001-04-04,2001-04
第十届海南国际椰子节将举办,2001-04-04,2001-04
先正达在华设立农业科教奖学金,2001-04-04,2001-04
中国企业高峰会即将召开,2001-04-04,2001-04
多用市场手段管理经济,2001-04-04,2001-04
香河在农民增收上做文章,2001-04-04,2001-04
“十五”计划纲要名词解释（9）,2001-04-04,2001-04
车辆购置税已入库三十三点六亿元,2001-04-04,2001-04
北京首电推出全自动电力节能装置,2001-04-04,2001-04
栾城县地税局打击非法票据,2001-04-04,2001-04
照南天公司推出“迅捷通”产品,2001-04-04,2001-04
菜籽饼脱毒制作剂面市,2001-04-04,2001-04
昆明客站全面改造工程启动,2001-04-04,2001-04
羽绒服市场名牌效应突出,2001-04-04,2001-04
韩国SK集团开通中文网站,2001-04-04,2001-04
香格里拉签署郑州一饭店管理协议,2001-04-04,2001-04
“请帮我们学习”,2001-04-04,2001-04
整合“学习资源”,2001-04-04,2001-04
拒疯牛于国门之外,2001-04-04,2001-04
首都高校师生聆听形势报告,2001-04-04,2001-04
发挥监督作用推进可持续发展,2001-04-04,2001-04
“清华”从工科院校迈向综合大学,2001-04-04,2001-04
第三代互联网什么模样  国内外众专家细说端详,2001-04-04,2001-04
西工大构建网上思想政治教育新体系,2001-04-04,2001-04
《拒绝邪教、净化校园》获好评,2001-04-04,2001-04
“黄河热气球环保世纪行”启动,2001-04-04,2001-04
“箭牌杯”环保宣传大赛举办,2001-04-04,2001-04
全国中小学生电子琴比赛筹备,2001-04-04,2001-04
秦西垂陵区铜器在京展出,2001-04-04,2001-04
紧缺矿产资源勘查研究获突破,2001-04-04,2001-04
邯郸  倡导文明殡葬方式,2001-04-04,2001-04
南京  专家破解古尸不腐之谜,2001-04-04,2001-04
长期稳定  平等互利,2001-04-04,2001-04
经贸往来  成果喜人,2001-04-04,2001-04
政党交往  发展友好,2001-04-04,2001-04
科技合作  形式多样,2001-04-04,2001-04
教育交流  广泛深入,2001-04-04,2001-04
文化交流  促进友谊,2001-04-04,2001-04
农业协作  生机勃勃,2001-04-04,2001-04
卫生合作  造福人民,2001-04-04,2001-04
中国需要非洲  非洲需要中国,2001-04-04,2001-04
哈斯木不敌丁俊晖,2001-04-04,2001-04
中国队首战惜败于芬兰,2001-04-04,2001-04
赤子申奥之情  北京上空的鹰,2001-04-04,2001-04
国际奥委会主席竞选指令确定,2001-04-04,2001-04
金光振将徒步颠球2008公里,2001-04-04,2001-04
许银川提前夺冠,2001-04-04,2001-04
新疆提出体育发展十年规划,2001-04-04,2001-04
足球龙之队评选揭晓,2001-04-04,2001-04
八一女排与康博再度合作,2001-04-04,2001-04
怎样遏制刑讯逼供,2001-04-04,2001-04
代表履职被打终有结果,2001-04-04,2001-04
在流动哨位上,2001-04-04,2001-04
解读“乡官”,2001-04-04,2001-04
勿做“听会代表”,2001-04-04,2001-04
立法听证意义重大,2001-04-04,2001-04
普及宪法应成为首要任务,2001-04-04,2001-04
怎样开好乡镇专题人代会,2001-04-04,2001-04
向“毒果”开刀,2001-04-04,2001-04
切莫顾此失彼,2001-04-04,2001-04
百姓的贴心人,2001-04-04,2001-04
解民忧  稳民心,2001-04-04,2001-04
有这样一个“家”,2001-04-04,2001-04
从“倒数第一”到“人民满意”,2001-04-04,2001-04
管窥严格执法,2001-04-04,2001-04
兴利除弊  锐意改革,2001-04-04,2001-04
大道平安通三峡,2001-04-04,2001-04
法律无价,2001-04-04,2001-04
他是个好法官,2001-04-04,2001-04
忠诚,2001-04-04,2001-04
海岛办案“女状元”,2001-04-04,2001-04
神圣的天平,2001-04-04,2001-04
刚正不阿  清廉如水,2001-04-04,2001-04
“俺们百姓好福气！”,2001-04-04,2001-04
严明法度  推进法治,2001-04-04,2001-04
强化“刚性”监督,2001-04-04,2001-04
说说人大监督,2001-04-04,2001-04
改进代表工作方式方法,2001-04-04,2001-04
请人大检查承诺,2001-04-04,2001-04
为舆论监督鼓与呼,2001-04-04,2001-04
苟恋河治污提了七年未果人代会质询采取果断措施,2001-04-04,2001-04
北京地区天气预报,2001-04-05,2001-04
美方应该向中国人民道歉,2001-04-05,2001-04
全国整顿和规范市场经济秩序工作会议在京召开,2001-04-05,2001-04
国务院安全生产督查组分赴各地,2001-04-05,2001-04
再次向美方严正交涉,2001-04-05,2001-04
国防部发言人发表谈话,2001-04-05,2001-04
动员起来坚决整顿规范市场经济秩序,2001-04-05,2001-04
江泽民主席离开北京,2001-04-05,2001-04
胡锦涛会见加蓬国防部长,2001-04-05,2001-04
动员起来坚决整顿规范市场经济秩序,2001-04-05,2001-04
全国整顿和规范市场经济秩序工作会议在京召开,2001-04-05,2001-04
向日方提出严正交涉,2001-04-05,2001-04
中日友协负责人发表书面谈话,2001-04-05,2001-04
全国人大外委会负责人发表谈话,2001-04-05,2001-04
加强考试管理  严肃考风考纪,2001-04-05,2001-04
全国政协外委会负责人发表谈话,2001-04-05,2001-04
愤怒批驳日本右翼教科书篡改历史,2001-04-05,2001-04
李鹏会见西哈努克国王,2001-04-05,2001-04
走火入魔  难以自拔,2001-04-05,2001-04
国际舆论批评美国霸权主义,2001-04-05,2001-04
绝大多数美国人认为美应负主要责任,2001-04-05,2001-04
曾庆红拜会新加坡总统纳丹,2001-04-05,2001-04
韩外长表示强烈遗憾,2001-04-05,2001-04
“上海五国”联合检查小组举行会议,2001-04-05,2001-04
科什图尼察说无暇考虑引渡米洛舍维奇,2001-04-05,2001-04
《欧洲侨报》揭露“台独”和“法轮功”狼狈为奸,2001-04-05,2001-04
日本  且看右翼教科书如何美化侵略,2001-04-05,2001-04
对伊制裁导致死亡率上升,2001-04-05,2001-04
依法严惩严重刑事犯罪分子,2001-04-05,2001-04
积极投入“严打”整治斗争,2001-04-05,2001-04
迅速掀起“严打”整治斗争高潮,2001-04-05,2001-04
发挥军队在维护社会政治稳定中的作用,2001-04-05,2001-04
西藏积极筹备庆祝和平解放50周年活动,2001-04-05,2001-04
冉绍之先进事迹报告会在福州举行,2001-04-05,2001-04
莲花山下植新绿,2001-04-05,2001-04
强烈谴责美侦察机撞毁我军用飞机侵犯我主权,2001-04-05,2001-04
霸道行径与霸权逻辑,2001-04-05,2001-04
愤怒谴责美国的霸权行径,2001-04-05,2001-04
湖州党政军领导慰问王伟父母,2001-04-05,2001-04
中俄举行战略稳定磋商,2001-04-05,2001-04
铁木尔·达瓦买提会见爱沙尼亚客人,2001-04-05,2001-04
周光召会见韩国高科技代表团,2001-04-05,2001-04
韩杼滨会见日本法务大臣,2001-04-05,2001-04
钱正英会见伊拉克客人,2001-04-05,2001-04
傅全有会见印度客人,2001-04-05,2001-04
卢森堡副首相将访华,2001-04-05,2001-04
美驻华使领馆官员与肇事侦察机机组人员见面,2001-04-05,2001-04
为什么要加快城镇化步伐,2001-04-05,2001-04
深入开展国有企业效绩评价,2001-04-05,2001-04
