电影评论要着眼大众,2001-04-14,2001-04
批评的发展与不足,2001-04-14,2001-04
努力于真切的批评,2001-04-14,2001-04
形成批评的合力,2001-04-14,2001-04
戏剧批评期盼大手笔,2001-04-14,2001-04
提倡引导、鉴赏式批评,2001-04-14,2001-04
建构文化交流的桥梁,2001-04-14,2001-04
见证人文化城市,2001-04-14,2001-04
龚自珍的“文学股票”,2001-04-14,2001-04
三联新书,2001-04-14,2001-04
“译林少儿文库”奉献给读者,2001-04-14,2001-04
阮章竞《晚号集》出版,2001-04-14,2001-04
《“十五”计划公众建议选编》,2001-04-14,2001-04
《季羡林传》,2001-04-14,2001-04
新书拾零,2001-04-14,2001-04
“图说中国艺术史丛书”,2001-04-14,2001-04
筑成我们的文学家园,2001-04-14,2001-04
李岚清开始对法国进行正式访问,2001-04-15,2001-04
北京地区天气预报,2001-04-15,2001-04
李岚清与格鲁吉亚总统会谈,2001-04-15,2001-04
江主席与卡斯特罗主席会谈,2001-04-15,2001-04
海军领导看望王伟父母,2001-04-15,2001-04
批准王伟为革命烈士,2001-04-15,2001-04
江泽民主席赠诗卡斯特罗主席,2001-04-15,2001-04
海上渔排党旗飘,2001-04-15,2001-04
海上渔排党旗飘,2001-04-15,2001-04
李岚清与格鲁吉亚总统会谈,2001-04-15,2001-04
外交部发言人发表谈话,2001-04-15,2001-04
大规模搜救我跳伞飞行员王伟的行动结束,2001-04-15,2001-04
全国勘界任务基本完成,2001-04-15,2001-04
第三次全国特殊教育工作会议召开,2001-04-15,2001-04
张君李泽军特大系列抢劫杀人案开庭,2001-04-15,2001-04
印度成立印中组织,2001-04-15,2001-04
博罗金回到莫斯科,2001-04-15,2001-04
日着手解析古代生物基因,2001-04-15,2001-04
许嘉璐会见日本客人,2001-04-15,2001-04
包头推行主动防范警务制,2001-04-15,2001-04
中古领导人在哈瓦那参观展览,2001-04-15,2001-04
中古友谊谱新篇,2001-04-15,2001-04
徘徊镇里“领头雁”,2001-04-15,2001-04
衡水  六千干部住村入户搞调研,2001-04-15,2001-04
鄂州  听取群众意见解决“三通”难题,2001-04-15,2001-04
遂宁  抓好整改取信于民,2001-04-15,2001-04
东营  抓住重点注重实效,2001-04-15,2001-04
新洲区涉农部门转变职能携手为农服务,2001-04-15,2001-04
介休民营企业投资农业一亿五,2001-04-15,2001-04
克拉玛依发展现代农业,2001-04-15,2001-04
致富状元“送经”来,2001-04-15,2001-04
盐池有人又在挖甘草,2001-04-15,2001-04
大学门前的“黑广告”,2001-04-15,2001-04
百色农民谢党恩  大会堂里话巨变,2001-04-15,2001-04
重庆公路交通提前实现“5年变样”目标,2001-04-15,2001-04
丹青画高原  雪域寄深情,2001-04-15,2001-04
试说“以德治文”,2001-04-15,2001-04
《大法官》震撼人心,2001-04-15,2001-04
《紫荆勋章》与岭南电视剧创作,2001-04-15,2001-04
回归题材的压轴之作,2001-04-15,2001-04
《紫荆勋章》和谐之美,2001-04-15,2001-04
好看的电视剧,2001-04-15,2001-04
纪念丁玲逝世十五周年,2001-04-15,2001-04
江泽民主席抵达加拉加斯,2001-04-16,2001-04
紧紧抓住“三个代表”重要思想的贯彻落实,2001-04-16,2001-04
三大网络兴邙山,2001-04-16,2001-04
“五一”期间：铁路增开客车保旅游,2001-04-16,2001-04
第89届广交会开幕,2001-04-16,2001-04
新西兰总理克拉克,2001-04-16,2001-04
喜见众“的”打“老鼠”,2001-04-16,2001-04
北京地区天气预报,2001-04-16,2001-04
神延铁路全线提前铺通,2001-04-16,2001-04
落实责任抓好森林防火 确保人民生命财产安全,2001-04-16,2001-04
北京：整合资源  营造大绿,2001-04-16,2001-04
武汉：大树上路  绿荫进城,2001-04-16,2001-04
兴利防弊  适度有序,2001-04-16,2001-04
五环图案林长伴八达岭,2001-04-16,2001-04
中科院纳米科技中心挂牌,2001-04-16,2001-04
“放心菜”的吸引力,2001-04-16,2001-04
学界泰斗季羡林将拍摄公益广告,2001-04-16,2001-04
野生动物遭宰售  无据可依重罚难,2001-04-16,2001-04
处分学生须听证  民主集中作决定,2001-04-16,2001-04
学校放任采购关  劣病猪肉进食堂,2001-04-16,2001-04
“团团”“圆圆”喜相逢,2001-04-16,2001-04
美国有了“海尔路”,2001-04-16,2001-04
西藏第十条航线首航成功,2001-04-16,2001-04
加拉加斯欢迎江主席,2001-04-16,2001-04
法普—夏大区区长欢宴李岚清,2001-04-16,2001-04
普京视察车臣地区,2001-04-16,2001-04
革新开放在越南,2001-04-16,2001-04
韩执政党谴责日右倾言论,2001-04-16,2001-04
美报批评政府傲慢外交,2001-04-16,2001-04
英团体抗议美NMD计划,2001-04-16,2001-04
诡辩难掩真相,2001-04-16,2001-04
巴抨击沙龙提出的巴建国条件,2001-04-16,2001-04
美再次发生枪杀案,2001-04-16,2001-04
非洲联盟将筹建,2001-04-16,2001-04
伊拒绝恢复武器核查,2001-04-16,2001-04
强硬无助和谈,2001-04-16,2001-04
广东  突出重点  强力出击,2001-04-16,2001-04
山东  “稳准狠”打击三类犯罪,2001-04-16,2001-04
辽宁  依法办案从重从快,2001-04-16,2001-04
吉林  完善治安防范体系,2001-04-16,2001-04
给人民群众以安全感,2001-04-16,2001-04
协作排查旅游安全隐患,2001-04-16,2001-04
为了西部的教育,2001-04-16,2001-04
曹刚川离京赴乌克兰访问,2001-04-16,2001-04
以实际行动向王伟同志学习,2001-04-16,2001-04
从国际法的角度透视中美撞机事件,2001-04-16,2001-04
淡化行政色彩  政府更具权威,2001-04-16,2001-04
商品房销售“猫腻”有治了,2001-04-16,2001-04
继往开来  加快航空工业发展,2001-04-16,2001-04
第三代移动通信产业化取得突破,2001-04-16,2001-04
推广煤炭洁净利用,2001-04-16,2001-04
黎南铁路复线施工进展顺利,2001-04-16,2001-04
禹州市地税局强化征管,2001-04-16,2001-04
和县农田林网建设成效显著,2001-04-16,2001-04
《保护农民权益实用手册》出版发行,2001-04-16,2001-04
《阀门树手册》出版,2001-04-16,2001-04
中华可乐投放市场,2001-04-16,2001-04
武汉出台“三严禁”整治网吧,2001-04-16,2001-04
大学的门始终向你敞开,2001-04-16,2001-04
我国创建风景名胜示范区,2001-04-16,2001-04
180个城市中学生志愿服务环保,2001-04-16,2001-04
献礼片《新甜蜜的事业》首映,2001-04-16,2001-04
建党八十周年歌曲征集活动开始,2001-04-16,2001-04
白山市合理开发矿泉水资源,2001-04-16,2001-04
专家研讨食品安全,2001-04-16,2001-04
首家大学生网络文明协会成立,2001-04-16,2001-04
社科学者评析“法轮功”现象,2001-04-16,2001-04
部队官兵素质教育丛书出版,2001-04-16,2001-04
老红军栽下申奥树,2001-04-16,2001-04
中国围棋名人战  邱峻率先晋决赛,2001-04-16,2001-04
中韩女子围棋对抗赛中方险胜,2001-04-16,2001-04
全国男排联赛又战一轮,2001-04-16,2001-04
奥运邮品为申奥推波助澜,2001-04-16,2001-04
足球甲B联赛第四轮平淡收场,2001-04-16,2001-04
罗雪娟刷新百米蛙泳全国纪录,2001-04-16,2001-04
国际风筝会在贵阳白云开幕,2001-04-16,2001-04
大运会准备工作基本就绪,2001-04-16,2001-04
中国女排在郴州集训,2001-04-16,2001-04
李昌镐马晓春被淘汰,2001-04-16,2001-04
中国队首场失利,2001-04-16,2001-04
睦邻友好  源远流长,2001-04-16,2001-04
美国  股市震荡与经济走向,2001-04-16,2001-04
朝鲜重视旅游业,2001-04-16,2001-04
全球经济增长今年将放缓,2001-04-16,2001-04
友协纪念巴黎公社130周年,2001-04-16,2001-04
大众公司参加绿化长城,2001-04-16,2001-04
联合利华启用新标识,2001-04-16,2001-04
不安全的“安全区”,2001-04-16,2001-04
阔步迈向现代文明,2001-04-16,2001-04
构筑新世纪再腾飞的平台,2001-04-16,2001-04
创新意识催生出“四大名牌”,2001-04-16,2001-04
增创龙岗发展新优势,2001-04-16,2001-04
从22.5亿元到186.5亿元,2001-04-16,2001-04
龙岗区四大基地建设巡礼,2001-04-16,2001-04
一对下岗夫妇和四家超市,2001-04-16,2001-04
超市老总上海学艺,2001-04-16,2001-04
零售业：准备好了吗？,2001-04-16,2001-04
缩短差距  迎接入世,2001-04-16,2001-04
经济数据,2001-04-16,2001-04
“红高粱”咋“黄了”,2001-04-16,2001-04
返贫和脱贫,2001-04-16,2001-04
海关表彰科技先进,2001-04-16,2001-04
勇攀高峰,2001-04-16,2001-04
海关的“火眼金睛”,2001-04-16,2001-04
打科技牌  解通关难,2001-04-16,2001-04
电子口岸在崛起,2001-04-16,2001-04
“九五”海关科技应用主要成果,2001-04-16,2001-04
科技强关  把好国门,2001-04-16,2001-04
救助“长江女神”,2001-04-16,2001-04
爱惜我们共有的家园,2001-04-16,2001-04
发展数字化农业,2001-04-16,2001-04
常山包田好方便,2001-04-16,2001-04
呼唤新型科技人才,2001-04-16,2001-04
寿阳种菜收益高,2001-04-16,2001-04
帮农民走向市场,2001-04-16,2001-04
石嘴山生态建设抓得实,2001-04-16,2001-04
祁东发展“订单农业”,2001-04-16,2001-04
保定百万农民学科技,2001-04-16,2001-04
志在黄沙染绿,2001-04-16,2001-04
短信息：为何火爆,2001-04-16,2001-04
移动互联：网络经济新曙光,2001-04-16,2001-04
国内长途细算账,2001-04-16,2001-04
牢骚、理解与透明度,2001-04-16,2001-04
办公何时真正能无纸,2001-04-16,2001-04
中国电信与华为签订服务合作协议,2001-04-16,2001-04
华中最大的数据中心落户武汉,2001-04-16,2001-04
江泽民主席与查韦斯总统会谈,2001-04-17,2001-04
历史、现实与未来,2001-04-17,2001-04
李鹏会见黎巴嫩议长,2001-04-17,2001-04
李瑞环抵达路易港,2001-04-17,2001-04
湖州人民学习缅怀“海空卫士”王伟,2001-04-17,2001-04
上海：围绕重点认真开展整治斗争,2001-04-17,2001-04
新疆：全面部署限期改变治安面貌,2001-04-17,2001-04
北京地区天气预报,2001-04-17,2001-04
授予王伟“海空卫士”荣誉称号,2001-04-17,2001-04
做好新时期经济发展大文章,2001-04-17,2001-04
运用现代科技建设现代化海关,2001-04-17,2001-04
建筑市场重点整顿四方面问题,2001-04-17,2001-04
严厉打击制售假劣药品和违法刊播广告,2001-04-17,2001-04
教育部推出中等职业教育新措施,2001-04-17,2001-04
上海今年重大工程投资近500亿元,2001-04-17,2001-04
宝鸡致力建设生态园林城市,2001-04-17,2001-04
国产直升机进入民用市场,2001-04-17,2001-04
科学家发出“太阳风暴”警报,2001-04-17,2001-04
国家储备橡胶下旬竞卖,2001-04-17,2001-04
三峡库区垃圾多  资金不足治理难,2001-04-17,2001-04
跟父母上一天班  同孩子上一天学,2001-04-17,2001-04
慎吃野生动植物  树立文明消费观,2001-04-17,2001-04
经营管理老一套  种田大户退农田,2001-04-17,2001-04
整治“特权车”,2001-04-17,2001-04
李瑞环抵达路易港,2001-04-17,2001-04
以轰炸贝卡谷地,2001-04-17,2001-04
江主席向玻利瓦尔墓献花圈,2001-04-17,2001-04
李岚清抵巴黎访问,2001-04-17,2001-04
国际舆论批评美对我搞间谍活动,2001-04-17,2001-04
安南对黎南部局势表示不安,2001-04-17,2001-04
澳大利亚  环保从教育做起,2001-04-17,2001-04
口蹄疫并非源自中餐馆,2001-04-17,2001-04
俄美关系走向引人注目,2001-04-17,2001-04
俄将改进导弹对付美NMD,2001-04-17,2001-04
雅加达首家中文书店开业,2001-04-17,2001-04
日一美术馆将还被盗中国佛像,2001-04-17,2001-04
美从轻处理撞沉日船责任人,2001-04-17,2001-04
努力做好新形势下的法制工作,2001-04-17,2001-04
江西加强督查保证学习教育质量,2001-04-17,2001-04
宜昌为移民排忧解难,2001-04-17,2001-04
江苏着力解决农民四“最”,2001-04-17,2001-04
确保民族区域自治法的宣传落实,2001-04-17,2001-04
用“三个代表”思想指导人权建设,2001-04-17,2001-04
统一战线要坚持为经济建设服务,2001-04-17,2001-04
外交部发言人发表谈话,2001-04-17,2001-04
温家宝会见日本客人,2001-04-17,2001-04
吴仪同南斯拉夫副总理会谈,2001-04-17,2001-04
唐家璇与巴基斯坦外长会谈,2001-04-17,2001-04
老挝副总理兼外长宋萨瓦抵京,2001-04-17,2001-04
中国惠州首届国际数码节开幕,2001-04-17,2001-04
明天气象预报,2001-04-17,2001-04
为陕北富泽筑坦途,2001-04-17,2001-04
行政效率应该提速,2001-04-17,2001-04
中海油年创利百亿,2001-04-17,2001-04
第五届“台交会”闭幕,2001-04-17,2001-04
灯泡合格率较去年明显提高 八家企业片面降成本质量不保,2001-04-17,2001-04
二十一个群众团体机关机构改革启动,2001-04-17,2001-04
四川“打黑除恶”有声威,2001-04-17,2001-04
山东召开公捕公判大会,2001-04-17,2001-04
湖南深挖“保护伞”,2001-04-17,2001-04
“党在我心中”读书征文启事,2001-04-17,2001-04
西北驻军积极支援西部大开发,2001-04-17,2001-04
年轻专家担当科研领导重任,2001-04-17,2001-04
方城公安局整纪树形象,2001-04-17,2001-04
政绩“缩水”为哪般,2001-04-17,2001-04
为使迷途者知返,2001-04-17,2001-04
“亿万妇女健身活动”展示大赛将举行,2001-04-17,2001-04
定兴交警建立内外监督机制,2001-04-17,2001-04
汝城加强党校建设,2001-04-17,2001-04
开封公安局争先创优效果好,2001-04-17,2001-04
小洪浩的兵哥哥,2001-04-17,2001-04
右翼势力要把日本引向何方？,2001-04-17,2001-04
从中餐馆成了“替罪羊”说起,2001-04-17,2001-04
服务  安全  经济  效益,2001-04-17,2001-04
美国经济下降及其影响,2001-04-17,2001-04
对拓展中非经贸合作的思考,2001-04-17,2001-04
《中国博物馆》巴黎亮相,2001-04-17,2001-04
委石油公司去年纯利润增加两倍,2001-04-17,2001-04
乌宇航部门将利用最新科技成果,2001-04-17,2001-04
中意签订科技合作协议,2001-04-17,2001-04
生物伦理、技术及安全研讨会闭幕,2001-04-17,2001-04
海南将办马拉松游泳大奖赛,2001-04-17,2001-04
全国女子举重赛屡创佳绩,2001-04-17,2001-04
何处飞鸢不争春,2001-04-17,2001-04
中国队获一银四铜,2001-04-17,2001-04
全国越野摩托车锦标赛将开赛,2001-04-17,2001-04
攀枝花国际长江漂流节将举行,2001-04-17,2001-04
快讯,2001-04-17,2001-04
锋线伤病太多  国足急招“二李”,2001-04-17,2001-04
“我们的联赛”区域决赛新意迭出,2001-04-17,2001-04
郭莉萍胜胡明,2001-04-17,2001-04
运用柔性战略  提升核心能力,2001-04-17,2001-04
光辉的建党学说,2001-04-17,2001-04
以改革精神全面加强党的建设,2001-04-17,2001-04
《中华民国史》,2001-04-17,2001-04
《中国社会史论》,2001-04-17,2001-04
《金融工程丛书》,2001-04-17,2001-04
精神支柱与凝聚力,2001-04-17,2001-04
椰风海韵话文昌,2001-04-17,2001-04
唐三彩之乡出了彩,2001-04-17,2001-04
古运河畔“水”文章,2001-04-17,2001-04
折叠起来的博物馆,2001-04-17,2001-04
戏梦人生,2001-04-17,2001-04
迎候科幻小说的春天,2001-04-17,2001-04
规范旅游市场  树立良好形象,2001-04-17,2001-04
无辜蒙冤有悖法理  荥阳法院有错不纠,2001-04-17,2001-04
福建厦门拯救白鹭行动,2001-04-17,2001-04
我爱我的小扁担,2001-04-17,2001-04
“没理的找领导”与“有理的找代表”析,2001-04-17,2001-04
最是萦怀英雄魂,2001-04-17,2001-04
非法手机市场应取缔,2001-04-17,2001-04
地下投递活动太猖獗,2001-04-17,2001-04
无人看守道口事故多,2001-04-17,2001-04
由《曹禺访谈录》所想到的,2001-04-17,2001-04
我见到的辞典编委会,2001-04-17,2001-04
勿做早叫的喜鹊,2001-04-17,2001-04
《走向喜马拉雅》雅安开机,2001-04-17,2001-04
“华夏杯”新诗大赛征稿,2001-04-17,2001-04
京剧之春  群星献艺,2001-04-17,2001-04
《徽州女人》与中国版画结缘,2001-04-17,2001-04
为中国舞蹈喝彩,2001-04-17,2001-04
老照片与美丽中国,2001-04-17,2001-04
“法轮功”邪教是夺人性命的犯罪者,2001-04-18,2001-04
加强领导突出重点认真落实全国社会治安工作会议部署的任务,2001-04-18,2001-04
北京地区天气预报,2001-04-18,2001-04
全国人大常委会委员长会议举行,2001-04-18,2001-04
李瑞环与毛里求斯总统会见,2001-04-18,2001-04
我国一季度国民经济开局良好,2001-04-18,2001-04
查韦斯总统盛宴欢迎江主席,2001-04-18,2001-04
加强领导突出重点认真落实全国社会治安工作会议部署的任务,2001-04-18,2001-04
切实增强紧迫感责任感  搞好新世纪初林业建设,2001-04-18,2001-04
取消住房建设四十七项不合理收费,2001-04-18,2001-04
中国北京高新技术产业国际周下月举办,2001-04-18,2001-04
为整顿规范经济秩序提供司法保障,2001-04-18,2001-04
抓紧落实机关事业单位住房补贴,2001-04-18,2001-04
上门广告骗农坑农,2001-04-18,2001-04
大力整顿和规范市场经济秩序  促进国民经济和社会健康发展,2001-04-18,2001-04
李瑞环与毛里求斯总统会见,2001-04-18,2001-04
授予江主席“解放者勋章”,2001-04-18,2001-04
江主席和查韦斯总统出席签字仪式,2001-04-18,2001-04
江主席会见委全国代表大会主席,2001-04-18,2001-04
友谊万岁,2001-04-18,2001-04
授予江主席“城市贵宾”称号,2001-04-18,2001-04
王冶坪会晤查韦斯总统夫人,2001-04-18,2001-04
李瑞环会见毛国民议会议长,2001-04-18,2001-04
李岚清会见法国文化部长,2001-04-18,2001-04
坚决反对李登辉以任何借口访日,2001-04-18,2001-04
老挝认为应尊重各国人民的选择,2001-04-18,2001-04
印尼报纸批评美搞双重人权标准,2001-04-18,2001-04
委肯媒体抨击美国霸权主义  苏丹称赞我对撞机事件立场,2001-04-18,2001-04
马尔代夫总统会见傅全有,2001-04-18,2001-04
以对加沙全面军事打击,2001-04-18,2001-04
大力选拔女干部  抓紧发展女党员,2001-04-18,2001-04
人民英雄人民赞,2001-04-18,2001-04
丁关根会见老挝客人,2001-04-18,2001-04
温家宝会见黎巴嫩议长,2001-04-18,2001-04
吴仪会见联合国开发计划署署长,2001-04-18,2001-04
外交部发言人发表谈话,2001-04-18,2001-04
唐家璇与老挝副总理兼外长会谈,2001-04-18,2001-04
把爱国热情化为强国强军实际行动,2001-04-18,2001-04
人间惨剧  邪教罪恶,2001-04-18,2001-04
中国最大的钛白粉企业成立,2001-04-18,2001-04
京燕化工靠技改打品牌战,2001-04-18,2001-04
平谷将举办国际桃花烟花节,2001-04-18,2001-04
冀东集团拓展新型建材领域,2001-04-18,2001-04
洪山区首季国税收入增长快,2001-04-18,2001-04
稷山国税严处行政违法行为,2001-04-18,2001-04
首季金融运行平稳健康,2001-04-18,2001-04
经济运行保持稳定增长态势,2001-04-18,2001-04
供销社要办成真正农民的合作经济组织,2001-04-18,2001-04
建设部提出加强装修市场管理,2001-04-18,2001-04
证监会制定发审委工作程序,2001-04-18,2001-04
减税为金融业增后劲,2001-04-18,2001-04
“十五”计划纲要名词解释（十四）,2001-04-18,2001-04
校园里锻造人生坐标,2001-04-18,2001-04
同心协力，实施科教兴国战略,2001-04-18,2001-04
我国全面整顿规范出版物市场,2001-04-18,2001-04
行家分析世乒赛团体赛形势和特点,2001-04-18,2001-04
第三届全国特奥会将在西安举办,2001-04-18,2001-04
国际奥委会正式公布主席候选人名单,2001-04-18,2001-04
全国女子举重锦标赛又超两项世界纪录,2001-04-18,2001-04
BGN世界象棋挑战赛在京揭幕,2001-04-18,2001-04
卫生部规范健康相关产品命名,2001-04-18,2001-04
武警部队向春蕾计划献爱心,2001-04-18,2001-04
北京开展大肠癌普查义诊活动,2001-04-18,2001-04
新型环保涂料研制成功,2001-04-18,2001-04
产品协同商务走近我国制造业,2001-04-18,2001-04
北师大亚太实验学校揭牌,2001-04-18,2001-04
美国  经济增速趋回升,2001-04-18,2001-04
历史岂容篡改,2001-04-18,2001-04
天灾人祸闹英伦,2001-04-18,2001-04
韩将迫使日本解决历史教科书问题,2001-04-18,2001-04
美国自1980年以来发生的大规模骚乱,2001-04-18,2001-04
加大打击力度  依法从严惩处,2001-04-18,2001-04
发挥职能作用  落实严打部署,2001-04-18,2001-04
加强专政力量  开展严打整治斗争,2001-04-18,2001-04
打好社会治安攻坚战,2001-04-18,2001-04
以昂扬的战斗姿态投入严打,2001-04-18,2001-04
全面落实社会治安综治措施,2001-04-18,2001-04
严打整治斗争全面展开,2001-04-18,2001-04
我说“严打”,2001-04-18,2001-04
构筑海关监督网络,2001-04-18,2001-04
建立有效监督制约机制,2001-04-18,2001-04
您用错过这些法律概念吗？,2001-04-18,2001-04
艰难的较量,2001-04-18,2001-04
无悔的追求,2001-04-18,2001-04
悔悟,2001-04-18,2001-04
成案率低,2001-04-18,2001-04
农民懂法是好事,2001-04-18,2001-04
仅有说法是不够的,2001-04-18,2001-04
漫画,2001-04-18,2001-04
执法者遭遇执法者,2001-04-18,2001-04
执法者作假谁来打,2001-04-18,2001-04
升级考学  求仙拜佛  糊涂学子  可悲可叹,2001-04-18,2001-04
人大会议代表为何缺席多,2001-04-18,2001-04
南通市人大常委会答复,2001-04-18,2001-04
村干部无权批地卖地,2001-04-18,2001-04
画里有话,2001-04-18,2001-04
江主席圆满结束拉美六国访问回国,2001-04-19,2001-04
胡锦涛与黎可漂亲切会见,2001-04-19,2001-04
李鹏会见荷兰议会一院议长,2001-04-19,2001-04
李瑞环与毛里求斯总理会见,2001-04-19,2001-04
抓住有利时机充分发挥优势  加快把上海建成现代化国际大都市,2001-04-19,2001-04
李岚清与法国总统会见,2001-04-19,2001-04
美国反华提案遭到第十次失败,2001-04-19,2001-04
王恩茂同志遗体在京火化,2001-04-19,2001-04
北京地区天气预报,2001-04-19,2001-04
中拉合作  共创未来,2001-04-19,2001-04
抓住有利时机充分发挥优势  加快把上海建成现代化国际大都市,2001-04-19,2001-04
中国谴责以色列侵犯阿拉伯国家,2001-04-19,2001-04
李鹏会见泰国客人,2001-04-19,2001-04
尉健行会见老挝客人,2001-04-19,2001-04
中国政府将为中外企业创造更好市场环境,2001-04-19,2001-04
抓住难得的历史性机遇  实现航空工业更快发展,2001-04-19,2001-04
中美就美侦察机撞毁中方飞机事件及相关问题在京举行谈判,2001-04-19,2001-04
港澳各界谴责美方出尔反尔丑恶行径,2001-04-19,2001-04
追授王伟“中国青年五四奖章”,2001-04-19,2001-04
何鲁丽会见欧洲议会客人,2001-04-19,2001-04
丁石孙会见伯利兹客人,2001-04-19,2001-04
宋健会见日本贸促会访华团,2001-04-19,2001-04
王忠禹会见尼泊尔客人,2001-04-19,2001-04
经叔平会见多米尼加客人,2001-04-19,2001-04
王文元会见尼日利亚客人,2001-04-19,2001-04
唐家璇会见南斯拉夫副总理,2001-04-19,2001-04
巴外长访问中国国际战略学会,2001-04-19,2001-04
李鹏会见南斯拉夫副总理,2001-04-19,2001-04
胡锦涛与黎可漂亲切会见,2001-04-19,2001-04
李瑞环与毛里求斯总理会见,2001-04-19,2001-04
李岚清与法国总统会见,2001-04-19,2001-04
中拉合作  共创未来,2001-04-19,2001-04
李瑞环会见毛里求斯副总理,2001-04-19,2001-04
胡锦涛与坎代会见,2001-04-19,2001-04
谴责美借“人权”干涉我内政,2001-04-19,2001-04
十撞南墙该休矣,2001-04-19,2001-04
胡锦涛瞻仰胡志明陵墓,2001-04-19,2001-04
借人权行霸权难逃败局,2001-04-19,2001-04
王恩茂同志遗体在京火化,2001-04-19,2001-04
王恩茂同志生平,2001-04-19,2001-04
外交部发言人发表谈话,2001-04-19,2001-04
从“奶头”管到“嘴头”,2001-04-19,2001-04
一季度我国利用外资增幅较大,2001-04-19,2001-04
煤炭工业协会积极服务企业,2001-04-19,2001-04
交行筹备代销开放式基金,2001-04-19,2001-04
景区推出十五家示范单位,2001-04-19,2001-04
农业部今年要办五件大事,2001-04-19,2001-04
东滩矿首季创利六千万元,2001-04-19,2001-04
手机防辐射天线帽研制成功,2001-04-19,2001-04
诸城国税局开展“不满意调查”,2001-04-19,2001-04
国内第一款手机型网络相机问世,2001-04-19,2001-04
北京邀请欧美大旅行商考察旅游业,2001-04-19,2001-04
“十五”计划纲要名词解释（十五）,2001-04-19,2001-04
开门红打下了好基础,2001-04-19,2001-04
社旗县检察院反腐有突破,2001-04-19,2001-04
海军官兵建功西沙保生态,2001-04-19,2001-04
乳山国税局注重队伍建设,2001-04-19,2001-04
武警某部促进青年成才,2001-04-19,2001-04
黑河国税局强素质树形象,2001-04-19,2001-04
“严打”要突出重点确保实效,2001-04-19,2001-04
公安部部署治爆缉枪专项行动,2001-04-19,2001-04
高检院派出工作组,2001-04-19,2001-04
公安部关于严厉打击违反爆炸物品  枪支弹药管理违法犯罪活动的通告,2001-04-19,2001-04
围绕权钱人的管理  推进三项制度改革,2001-04-19,2001-04
石家庄特大爆炸案一审宣判,2001-04-19,2001-04
走“三高”之路,2001-04-19,2001-04
森喜朗正式宣布辞职,2001-04-19,2001-04
美国政要“变脸”记,2001-04-19,2001-04
紧急大撤离,2001-04-19,2001-04
孟印边境发生流血冲突,2001-04-19,2001-04
普京同伊副总统会谈,2001-04-19,2001-04
印发射同步卫星运载火箭,2001-04-19,2001-04
第八次中日友好交流会议闭幕,2001-04-19,2001-04
巴谴责以对加沙军事打击  国际社会抨击以对巴施暴,2001-04-19,2001-04
法国开庭审判一邪教,2001-04-19,2001-04
陶璐娜创女子运动手枪世界纪录,2001-04-19,2001-04
世界象棋挑战赛鸣锣开战,2001-04-19,2001-04
中国体操界推敲新规则,2001-04-19,2001-04
贵阳白云国际风筝会落幕,2001-04-19,2001-04
CBA最佳阵容评选揭晓,2001-04-19,2001-04
国际社会赞赏中国处理撞机事件立场,2001-04-19,2001-04
