西部产业开发须立足于“四个转变”,2001-04-10,2001-04
科学认识社会主义发展的历史进程,2001-04-10,2001-04
具有民族地方特色的实证研究,2001-04-10,2001-04
管住小节  挡住诱惑,2001-04-10,2001-04
“太阳风暴”天外来,2001-04-10,2001-04
谁来决定基础研究方向,2001-04-10,2001-04
不只源自玻璃幕墙,2001-04-10,2001-04
我国短期气候预测准确率明显提高,2001-04-10,2001-04
软科学研究大有可为,2001-04-10,2001-04
遨游太空  道中有“道”,2001-04-10,2001-04
为什么叫“金钉子”？,2001-04-10,2001-04
记忆让视觉成形,2001-04-10,2001-04
“生命之源”的奥妙,2001-04-10,2001-04
火焰在太空燃烧,2001-04-10,2001-04
向普通灯泡告别,2001-04-10,2001-04
监督：在八小时以外,2001-04-10,2001-04
“八小时以外”的监督和隐私权保护,2001-04-10,2001-04
“八小时以外”的监督要加强,2001-04-10,2001-04
要从家庭开始防微杜渐,2001-04-10,2001-04
杜绝腐败滋生的“温床”,2001-04-10,2001-04
舆论监督：切实发挥优势,2001-04-10,2001-04
涿州农民逛大集,2001-04-10,2001-04
地方小戏春花烂漫  舞台演绎乡村故事,2001-04-10,2001-04
小戏春晖满九州,2001-04-10,2001-04
农村小戏的启示,2001-04-10,2001-04
戏小意义大,2001-04-10,2001-04
耀眼的风景,2001-04-10,2001-04
五个没想到,2001-04-10,2001-04
全总表彰先进个人和先进集体,2001-04-11,2001-04
李岚清会见巴西国防部长,2001-04-11,2001-04
年轻直辖市的答卷,2001-04-11,2001-04
各地群众坚决拥护我政府立场,2001-04-11,2001-04
世界舆论纷纷谴责美霸权行径,2001-04-11,2001-04
荷兰议长将访华,2001-04-11,2001-04
马来西亚最高元首将访华,2001-04-11,2001-04
黎巴嫩议会代表团将访华,2001-04-11,2001-04
斩草必除根,2001-04-11,2001-04
北京地区天气预报,2001-04-11,2001-04
江主席开始对乌拉圭进行国事访问,2001-04-11,2001-04
一季度全国工业生产开局良好,2001-04-11,2001-04
第二届中国昆明国际旅游节开幕,2001-04-11,2001-04
中国—东盟信息通信技术研讨会举行,2001-04-11,2001-04
中国人民银行纠正和打击逃废银行债务行为,2001-04-11,2001-04
国家旅游局重拳规范旅游市场秩序,2001-04-11,2001-04
全国供销社根治农资棉花制假售假,2001-04-11,2001-04
加强“网吧”等上网服务营业场所管理,2001-04-11,2001-04
中国移动电话模拟网年底关闭,2001-04-11,2001-04
长城在村民手中“延伸”,2001-04-11,2001-04
戏说历史成时尚  少年何处觅正史,2001-04-11,2001-04
撇开用户签协议  居民拒绝宽带网,2001-04-11,2001-04
治理“城市牛皮癣”   厦门拿出“杀手锏”,2001-04-11,2001-04
年轻直辖市的答卷,2001-04-11,2001-04
阿盟谴责以镇压巴人,2001-04-11,2001-04
热烈欢迎江泽民主席,2001-04-11,2001-04
江泽民会见阿高法院长,2001-04-11,2001-04
江泽民会见阿议会领导人,2001-04-11,2001-04
江泽民会见阿国关委领导成员,2001-04-11,2001-04
授予江泽民“城市贵宾”称号,2001-04-11,2001-04
乌中议员友好协会成立,2001-04-11,2001-04
柬华人华侨谴责美霸权行径,2001-04-11,2001-04
承认美机侵犯我领空,2001-04-11,2001-04
合作之路越走越宽,2001-04-11,2001-04
石广生与贾瓦里尼会谈,2001-04-11,2001-04
越共八届十二中全会闭幕,2001-04-11,2001-04
金大中和洪森会谈,2001-04-11,2001-04
以军再袭加沙,2001-04-11,2001-04
呼吁铲除邪教,2001-04-11,2001-04
迅速掀起严打整治斗争高潮,2001-04-11,2001-04
从龙泉村“晒被子”说起,2001-04-11,2001-04
集中整治治安混乱地区  切实落实各级领导责任,2001-04-11,2001-04
组织好“全国助残日”活动,2001-04-11,2001-04
田纪云会见泰国客人,2001-04-11,2001-04
赵南起会见朝鲜客人,2001-04-11,2001-04
傅全有会见巴西国防部长,2001-04-11,2001-04
唐家璇会见保加利亚副外长,2001-04-11,2001-04
外交部发言人发表谈话,2001-04-11,2001-04
吴邦国与澳大利亚副总理会谈,2001-04-11,2001-04
加速推进我军现代化建设,2001-04-11,2001-04
顾秀莲看望王伟妻子阮国琴,2001-04-11,2001-04
海军领导看望王伟妻子阮国琴,2001-04-11,2001-04
天涯海角寻王伟,2001-04-11,2001-04
目击海空搜救,2001-04-11,2001-04
美驻华使馆官员与美机组人员第五次会面,2001-04-11,2001-04
大力植树造林  加快国土绿化,2001-04-11,2001-04
推进经贸法制建设  促进依法行政,2001-04-11,2001-04
技术改造工作力度加大,2001-04-11,2001-04
美容院化妆品质量如何,2001-04-11,2001-04
“十五”计划纲要名词解释（12）,2001-04-11,2001-04
“明星村”陨落的背后,2001-04-11,2001-04
郑州金水公安分局构建动态治安防范体系,2001-04-11,2001-04
民之安重于山,2001-04-11,2001-04
定州开展“民情记事”活动,2001-04-11,2001-04
鸡东典型示范抓“学教”,2001-04-11,2001-04
首届律师辩论赛半决赛鸣金,2001-04-11,2001-04
《中国共产党民族工作史》出版,2001-04-11,2001-04
安徽警方专家组出手不凡,2001-04-11,2001-04
云南公安边防科技强警,2001-04-11,2001-04
南浔农行开办“文明学校”,2001-04-11,2001-04
龙岗巡警多种手段遏制犯罪,2001-04-11,2001-04
今日“铁军”雄风,2001-04-11,2001-04
武警河北总队植树护京城,2001-04-11,2001-04
新密法院请政协委员搞回访,2001-04-11,2001-04
济南军区某仓库争学先进,2001-04-11,2001-04
株洲响石岭派出所为民服务,2001-04-11,2001-04
农民吴庆友扶贫捐款百万,2001-04-11,2001-04
事实胜于雄辩,2001-04-11,2001-04
韩国政府  要求日本修改歪曲历史教科书,2001-04-11,2001-04
加拿大一机构  强烈谴责日本美化战争的行径,2001-04-11,2001-04
数字时代新角逐,2001-04-11,2001-04
美放弃提前建美洲自由贸易区,2001-04-11,2001-04
《围绕五环》看好北京申奥,2001-04-11,2001-04
自杀成为日公务员二号杀手,2001-04-11,2001-04
加大力开发西部能源,2001-04-11,2001-04
海信建成南非最大彩电基地,2001-04-11,2001-04
增进了解  推动合作,2001-04-11,2001-04
巴西大力反腐败,2001-04-11,2001-04
欧盟外交势头强劲,2001-04-11,2001-04
全国围棋锦标赛结束  深圳和浙江升入甲级,2001-04-11,2001-04
跆拳道锦标赛鸣金  八项冠军各有其主,2001-04-11,2001-04
超级台球联赛预赛  多名老将落马出局,2001-04-11,2001-04
发展学校体育  推进素质教育,2001-04-11,2001-04
沈阳军区推广“三对三”篮球赛,2001-04-11,2001-04
全国汽车拉力锦标赛昆明站开战,2001-04-11,2001-04
中国体操队获支持,2001-04-11,2001-04
大运会评比礼仪引导员,2001-04-11,2001-04
北京宽利足球队获赞助,2001-04-11,2001-04
第二阶段激战在即,2001-04-11,2001-04
全国铁人三项赛推出新举措,2001-04-11,2001-04
海峡两岸选手大漠竞逐自行车,2001-04-11,2001-04
中国足球队聚昆明  备战世界杯预选赛,2001-04-11,2001-04
这堂课非补不可,2001-04-11,2001-04
接受人民的监督,2001-04-11,2001-04
浙江办理人大议案政协提案规范化,2001-04-11,2001-04
彭山终止一县人大代表资格,2001-04-11,2001-04
设立“见死不救罪”,2001-04-11,2001-04
铸造警魂,2001-04-11,2001-04
环保卫士,2001-04-11,2001-04
由衡阳“摘牌”看全国铁路护路联防,2001-04-11,2001-04
治安治本  惟在于民,2001-04-11,2001-04
“蛇头”遇克星,2001-04-11,2001-04
安徽芜湖市交警解决积案,2001-04-11,2001-04
沈铁公安强化烟花爆竹管理,2001-04-11,2001-04
青少年上网亟须指导,2001-04-11,2001-04
我国刑法关于铁路治安的条款,2001-04-11,2001-04
为了公正裁判,2001-04-11,2001-04
铁面庭长李怀玉,2001-04-11,2001-04
虚假医药广告害死人,2001-04-11,2001-04
中华人民共和国广告法（摘要）,2001-04-11,2001-04
中华人民共和国药品管理法（摘要）,2001-04-11,2001-04
法严则人思善,2001-04-11,2001-04
广告“三乱”何时休,2001-04-11,2001-04
渔民安危记心间,2001-04-11,2001-04
法制宣传“热”三河,2001-04-11,2001-04
“阳光”下断案,2001-04-11,2001-04
集体所有制企业领导由谁任免？,2001-04-11,2001-04
应当尊重集体经济组织民主管理权,2001-04-11,2001-04
针砭时弊  厉行新风,2001-04-11,2001-04
旁听一座通向百姓的桥,2001-04-11,2001-04
督办要认真,2001-04-11,2001-04
人大监督清理“空额工资”,2001-04-11,2001-04
盱眙人大建立《联系代表手册》制,2001-04-11,2001-04
麻阳人大实行“双接待日”制度,2001-04-11,2001-04
规范行政执法,2001-04-11,2001-04
救救千年岩画,2001-04-11,2001-04
把爱国热情化为强国力量,2001-04-12,2001-04
江主席与巴特列总统会谈,2001-04-12,2001-04
李瑞环会见朝鲜客人,2001-04-12,2001-04
李岚清抵达塔什干,2001-04-12,2001-04
美方对此事件必须承担全部责任  向中国人民作出交待  停止在中国沿海进行侦察活动  防止类似事件再次发生,2001-04-12,2001-04
美政府全权代表美驻华大使普理赫向我外交部部长唐家璇递交关于美国军用侦察机撞毁中国军用飞机事件的致歉信,2001-04-12,2001-04
北京地区天气预报,2001-04-12,2001-04
江泽民主席发表谈话,2001-04-12,2001-04
加强综合治理  共建网络文明,2001-04-12,2001-04
技改项目“备案制”将取代“审批制”,2001-04-12,2001-04
重点推进预算管理制度改革,2001-04-12,2001-04
过一个欢乐祥和的“五一”长假,2001-04-12,2001-04
严肃认真处理历史教科书问题,2001-04-12,2001-04
日本政府应有更加明确的态度,2001-04-12,2001-04
室内装饰业资质审查  协会说了算,2001-04-12,2001-04
对棉花质量问题负责到底  不让假冒伪劣农资进市场,2001-04-12,2001-04
中国商业联合会完成重组,2001-04-12,2001-04
义卖献爱心,2001-04-12,2001-04
北京商务中心区规划设计方案评选揭晓,2001-04-12,2001-04
全国软件工作会议举行,2001-04-12,2001-04
黑龙江网上软件园启动,2001-04-12,2001-04
上海环保出新规  追究查处责任人,2001-04-12,2001-04
大连社保新气象  企业职工两相宜,2001-04-12,2001-04
企业单方毁契约  奶农怒泼鲜牛奶,2001-04-12,2001-04
巴特列总统欢宴江泽民主席,2001-04-12,2001-04
向江主席赠送“城市钥匙”,2001-04-12,2001-04
玫瑰之城迎嘉宾,2001-04-12,2001-04
中巴关系稳步发展,2001-04-12,2001-04
海外侨界继续谴责美国霸权行径,2001-04-12,2001-04
美NMD将严重动摇核裁军基础,2001-04-12,2001-04
张万年结束访新回国,2001-04-12,2001-04
金大中会见戴秉国,2001-04-12,2001-04
西哈努克国王回到金边,2001-04-12,2001-04
太空非军事化国际会议开幕,2001-04-12,2001-04
以大规模轰炸加沙,2001-04-12,2001-04
把爱国热情化为强国力量,2001-04-12,2001-04
王伟生还的可能性很小,2001-04-12,2001-04
李瑞环会见墨西哥客人,2001-04-12,2001-04
以实际行动捍卫国家主权和领土完整,2001-04-12,2001-04
干部群众坚决拥护我国政府正确决定,2001-04-12,2001-04
国际社会称赞中国处理撞机事件立场,2001-04-12,2001-04
新时代呼唤更多冉绍之,2001-04-12,2001-04
台湾同胞来电慰问王伟家人,2001-04-12,2001-04
美军机上人员一直得到中方妥善安置,2001-04-12,2001-04
军民继续全力搜救王伟,2001-04-12,2001-04
西哈努克国王和王后离京回国,2001-04-12,2001-04
吴仪会见阿联酋客人,2001-04-12,2001-04
王忠禹会见日本客人,2001-04-12,2001-04
陈锦华会见泰国副总理,2001-04-12,2001-04
唐家璇与卢森堡副首相会谈,2001-04-12,2001-04
傅全有会见土耳其海军司令,2001-04-12,2001-04
庄严的承诺,2001-04-12,2001-04
突破体制性障碍的重要一步,2001-04-12,2001-04
农13师221团扭亏转盈,2001-04-12,2001-04
商业零售业百强评出,2001-04-12,2001-04
打掉“保护伞”,2001-04-12,2001-04
艾滋病防控刻不容缓,2001-04-12,2001-04
科学家风尘仆仆探沙源,2001-04-12,2001-04
清华大学重视校园治安,2001-04-12,2001-04
让师生安心做学问,2001-04-12,2001-04
中国儿童论坛闭幕,2001-04-12,2001-04
石家庄医界争赴山区义诊,2001-04-12,2001-04
首条菌根制剂生产线落成,2001-04-12,2001-04
新型农用抗生素通过鉴定,2001-04-12,2001-04
互联网上网服务营业场所管理办法,2001-04-12,2001-04
谴责日本教科书歪曲历史,2001-04-12,2001-04
名教练被指控  名将感到震惊,2001-04-12,2001-04
韩领导人深表不满  国会议员静坐抗议,2001-04-12,2001-04
走进非洲天地宽,2001-04-12,2001-04
德里公交瘫痪的启示,2001-04-12,2001-04
我援老项目交接仪式举行,2001-04-12,2001-04
日拒发李登辉入境签证,2001-04-12,2001-04
中国乒乓球队信心十足,2001-04-12,2001-04
全国汽车拉力赛第二站落幕,2001-04-12,2001-04
今年甲A分外“红”,2001-04-12,2001-04
九运会古典式摔跤预赛结束,2001-04-12,2001-04
亚洲青年举重锦标赛破一项纪录,2001-04-12,2001-04
全国场地自行车冠军赛首站决7金,2001-04-12,2001-04
联合会杯网球赛  中国队两战两胜,2001-04-12,2001-04
跨入新世纪  创造新辉煌,2001-04-12,2001-04
优政：党政干部的新追求,2001-04-12,2001-04
以创新促发展,2001-04-12,2001-04
扶贫工作的新要求,2001-04-12,2001-04
英雄群体精神世界的理性追寻,2001-04-12,2001-04
加强对村民自治的理论研究,2001-04-12,2001-04
“三个代表”是坚持“三个有利于”的根本保证,2001-04-12,2001-04
“馋嘴干部”吞吃统筹提留款,2001-04-12,2001-04
半途而废的养殖园区,2001-04-12,2001-04
患者不是“摇钱树”,2001-04-12,2001-04
善待求医农民,2001-04-12,2001-04
南京盗版图书猖獗,2001-04-12,2001-04
“以恶除邪”有害无利,2001-04-12,2001-04
处理千起事故无差错,2001-04-12,2001-04
躬身理民事  倾情解民忧,2001-04-12,2001-04
荣成市靖海镇干部彩票竟然搞摊派,2001-04-12,2001-04
肃北蒙古族自治县鼠害危及大草原,2001-04-12,2001-04
山西蒲县克城镇小学建厕掏学生腰包,2001-04-12,2001-04
事业心  责任心  进取心,2001-04-12,2001-04
为了特区上空的文明,2001-04-12,2001-04
鸡窝里飞出“金凤凰”,2001-04-12,2001-04
告别无声世界,2001-04-12,2001-04
警民联手正一方风气,2001-04-12,2001-04
馨正医德暖万千人心,2001-04-12,2001-04
“义工”在行动,2001-04-12,2001-04
极品人,2001-04-12,2001-04
重建钱王祠有感,2001-04-12,2001-04
书房小吟,2001-04-12,2001-04
二桥的灯,2001-04-12,2001-04
静谧（水彩画）,2001-04-12,2001-04
真实的纪录,2001-04-12,2001-04
《中国新闻奖精品集》在广州出版发行,2001-04-12,2001-04
《中关村进行曲》研讨会在京举行,2001-04-12,2001-04
融入大山,2001-04-12,2001-04
周恩来学术研讨会在淮安召开,2001-04-12,2001-04
茅盾学术研讨会在桐乡举行,2001-04-12,2001-04
江主席和卡多佐总统会谈,2001-04-13,2001-04
李鹏在浙江进行立法调研,2001-04-13,2001-04
朱镕基在湖南考察工作,2001-04-13,2001-04
胡锦涛将率中共代表团出席越共“九大”,2001-04-13,2001-04
李岚清分别与乌兹别克斯坦总统总理会见,2001-04-13,2001-04
各地干部群众拥护我国政府正确决定,2001-04-13,2001-04
王恩茂同志逝世,2001-04-13,2001-04
北京地区天气预报,2001-04-13,2001-04
江主席开始对巴西进行工作访问,2001-04-13,2001-04
李鹏在浙江进行立法调研,2001-04-13,2001-04
朱镕基在湖南考察工作,2001-04-13,2001-04
外经贸部发言人发表谈话,2001-04-13,2001-04
机关事业单位4月开始执行涨工资政策,2001-04-13,2001-04
炸封非法采矿点,2001-04-13,2001-04
青藏铁路今年将挺进一百公里,2001-04-13,2001-04
中国邮政EMS表示：欢迎,2001-04-13,2001-04
巴金等人作品出版权著作权被侵案结案,2001-04-13,2001-04
世界优秀种羊落户内蒙古草原,2001-04-13,2001-04
拦住行人就算命  惊慌失措撞大树,2001-04-13,2001-04
仿冒商品成祸害  法律制裁须具体,2001-04-13,2001-04
中式快餐寻市场  找准对象能发展,2001-04-13,2001-04
江主席和卡多佐总统会谈,2001-04-13,2001-04
李岚清分别与乌兹别克斯坦总统总理会见,2001-04-13,2001-04
卡多佐总统欢宴江主席,2001-04-13,2001-04
江主席会见乌拉圭最高法院院长,2001-04-13,2001-04
江主席会见乌拉圭议会领导人,2001-04-13,2001-04
树立南南合作的典范,2001-04-13,2001-04
高度赞赏中国领导人的政治家风范,2001-04-13,2001-04
我大使再次向日严正交涉,2001-04-13,2001-04
迫使日修改歪曲史实教科书,2001-04-13,2001-04
外国政要欢迎中美处理撞机事件取得积极进展,2001-04-13,2001-04
国际社会支持我对撞机事件立场,2001-04-13,2001-04
中国政府保留向美方追究责任的权利,2001-04-13,2001-04
朱镕基会见澳大利亚副总理,2001-04-13,2001-04
朱镕基会见卢森堡副首相,2001-04-13,2001-04
李瑞环会见中信国际咨询会议外方人士,2001-04-13,2001-04
坚决拥护我国政府处理撞机事件的决策,2001-04-13,2001-04
外交部发言人发表谈话,2001-04-13,2001-04
第五届台交会在厦门举行,2001-04-13,2001-04
李铁映会见塞拉利昂客人,2001-04-13,2001-04
张万年结束访问澳、新回京,2001-04-13,2001-04
吴仪会见卢森堡副首相,2001-04-13,2001-04
吴仪会见多哥客人,2001-04-13,2001-04
韩杼滨会见意大利客人,2001-04-13,2001-04
唐家璇将出访三国并出席“上海五国”外长会晤,2001-04-13,2001-04
唐家璇会见科威特埃米尔特使,2001-04-13,2001-04
会见刚果（金）客人,2001-04-13,2001-04
司法部批准十一家外国律师事务所设立驻华办事处,2001-04-13,2001-04
中澳签署交通运输领域合作备忘录,2001-04-13,2001-04
军民继续尽最大努力搜救王伟,2001-04-13,2001-04
人权图书赠书仪式在京举行,2001-04-13,2001-04
纪念《民事诉讼法》颁行十周年研讨会举行,2001-04-13,2001-04
王伟父母表示坚决拥护我国政府正确决定,2001-04-13,2001-04
许杏虎亲属看望王伟家人,2001-04-13,2001-04
美机人员离开海口,2001-04-13,2001-04
完善市场促规范,2001-04-13,2001-04
“走出去”天地广阔,2001-04-13,2001-04
黑河中游全力推行节水农业,2001-04-13,2001-04
节水是福,2001-04-13,2001-04
“十五”计划纲要名词解释（13）,2001-04-13,2001-04
商业投资洽谈会今秋启幕,2001-04-13,2001-04
平保推出长期住院保险,2001-04-13,2001-04
上海将禁销烟道式燃气热水器,2001-04-13,2001-04
福建,2001-04-13,2001-04
黑龙江,2001-04-13,2001-04
广州,2001-04-13,2001-04
河南,2001-04-13,2001-04
武汉,2001-04-13,2001-04
中央国家机关认真部署“严打”整治斗争,2001-04-13,2001-04
最高人民法院公布实施有关司法解释,2001-04-13,2001-04
《身体力行“三个代表”》征文启事,2001-04-13,2001-04
加快教科文卫立法,2001-04-13,2001-04
民建中央到丰宁义务植树,2001-04-13,2001-04
推进“夕阳”工作,2001-04-13,2001-04
《落日的辉煌》出版座谈会举行,2001-04-13,2001-04
淮南任用干部实行无记名投票,2001-04-13,2001-04
成安县探索农村稳定工作新路,2001-04-13,2001-04
江苏将首家在京大规模招收博士后研究人员,2001-04-13,2001-04
总参干休所为老干部办实事,2001-04-13,2001-04
微山国税局抓实学教活动,2001-04-13,2001-04
河南登封农村党建落到实处,2001-04-13,2001-04
晋城国税二分局税宣抓得紧,2001-04-13,2001-04
武警部队九百多转业干部选择自主择业,2001-04-13,2001-04
谁是罪魁祸首,2001-04-13,2001-04
疯牛病引发农业政策之争,2001-04-13,2001-04
口蹄疫  疯牛病  二恶英,2001-04-13,2001-04
“零危险”不科学,2001-04-13,2001-04
呼唤生态农业,2001-04-13,2001-04
中韩女棋手再对抗,2001-04-13,2001-04
北京让基里安频频点头,2001-04-13,2001-04
中国冰球队出征世锦赛,2001-04-13,2001-04
霍克支持北京申奥,2001-04-13,2001-04
中国区比赛将开战,2001-04-13,2001-04
奥林匹克走遍中国巡回展开幕,2001-04-13,2001-04
南非  球迷蜂拥球场  至少43人丧生,2001-04-13,2001-04
浙江队升级已成定局,2001-04-13,2001-04
人民网直播围棋名人战,2001-04-13,2001-04
书画名家迎大运,2001-04-13,2001-04
十佳评选群众抽奖揭晓,2001-04-13,2001-04
天津为啥不能明白消费？,2001-04-13,2001-04
北京半夜爬起打长途？,2001-04-13,2001-04
广东平静之下尽是无奈,2001-04-13,2001-04
福州呼唤知情权,2001-04-13,2001-04
让百姓真正得实惠,2001-04-13,2001-04
“长大了”，还玩玩具吗？,2001-04-13,2001-04
欢乐的海,2001-04-13,2001-04
为药价虚高把脉,2001-04-13,2001-04
多胞胎并非多多益善,2001-04-13,2001-04
夜间值班医生在哪？,2001-04-13,2001-04
患者入厕难医院有苦衷,2001-04-13,2001-04
中华医学会开展心衰患者调查,2001-04-13,2001-04
北医三院畸形肾移植术成功,2001-04-13,2001-04
解放军304医院无张力疝修补疗效好,2001-04-13,2001-04
广东高明脑细胞课题获通过,2001-04-13,2001-04
手机还是少打为好,2001-04-13,2001-04
致读者,2001-04-13,2001-04
肝脏移植：晚期肝病有救,2001-04-13,2001-04
在外国看小事,2001-04-13,2001-04
维莱特花园随想,2001-04-13,2001-04
她在母腹中遭枪击,2001-04-13,2001-04
法国女性地位表里不一,2001-04-13,2001-04
阿舒拉日,2001-04-13,2001-04
仪柬,2001-04-13,2001-04
观日本麻将博物馆,2001-04-13,2001-04
世界最大购物车,2001-04-13,2001-04
多厅影院──电影市场的一缕曙光,2001-04-13,2001-04
节目安排应该合理,2001-04-13,2001-04
《笑傲江湖》的“好”与不“好看”,2001-04-13,2001-04
《笑傲江湖》：首尾不凡,2001-04-13,2001-04
《笑傲江湖》不笑也罢,2001-04-13,2001-04
张谊油画今日起展出,2001-04-13,2001-04
儿童新片  扬起笑脸,2001-04-13,2001-04
《花季雨季》伴着青春成长,2001-04-13,2001-04
“电视电影剧本”评奖,2001-04-13,2001-04
世界百城诗歌对话北京,2001-04-13,2001-04
高发梦想演一回军人,2001-04-13,2001-04
《大宝真情互动》传递真情,2001-04-13,2001-04
洪金宝笑谈“老人与海”,2001-04-13,2001-04
我喜欢生活的原态,2001-04-13,2001-04
江泽民主席抵达哈瓦那,2001-04-14,2001-04
牢记党的宗旨  增强公仆意识,2001-04-14,2001-04
首都举行座谈会纪念赵世炎诞辰一百周年,2001-04-14,2001-04
第二次全国残疾人事业工作会议在京举行,2001-04-14,2001-04
李岚清抵达第比利斯,2001-04-14,2001-04
各地干部群众表示要把爱国热情化为强国力量,2001-04-14,2001-04
北京地区天气预报,2001-04-14,2001-04
农村“三个代表”重要思想学教活动见成效,2001-04-14,2001-04
第二次全国残疾人事业工作会议在京举行,2001-04-14,2001-04
我外贸进出口额一季度首超千亿美元,2001-04-14,2001-04
全国一季度利息税收入成倍增长,2001-04-14,2001-04
对“网吧”开展专项清理整顿,2001-04-14,2001-04
新世纪的希望,2001-04-14,2001-04
迅速全力投入“严打”整治斗争,2001-04-14,2001-04
迅速整顿规范文化市场秩序,2001-04-14,2001-04
禁止有伤社会风化的演示,2001-04-14,2001-04
不要把孩子引向绝路！,2001-04-14,2001-04
“法轮功”把他逼疯了,2001-04-14,2001-04
江主席访委意义重大,2001-04-14,2001-04
国际社会高度评价我处理撞机事件立场,2001-04-14,2001-04
欧洲侨界举行反独促统座谈会,2001-04-14,2001-04
谴责右翼教科书将日引向孤立,2001-04-14,2001-04
马里总统说非洲冲突要靠自己解决,2001-04-14,2001-04
米洛舍维奇被送回监狱,2001-04-14,2001-04
加宣布归还我唐代一文物,2001-04-14,2001-04
美国又发生种族冲突,2001-04-14,2001-04
垂泪斥邪教,2001-04-14,2001-04
齐晖打破女子二百米蛙泳世界纪录,2001-04-14,2001-04
中国棋院将处罚围乙作弊当事人,2001-04-14,2001-04
亚青举重赛落幕,2001-04-14,2001-04
国家游泳集训队成立,2001-04-14,2001-04
“感谢北京”,2001-04-14,2001-04
日本将向中国援助价值20多亿日元的器材和药品,2001-04-14,2001-04
在纪念赵世炎同志诞辰一百周年座谈会上的讲话,2001-04-14,2001-04
人是最可宝贵的,2001-04-14,2001-04
“中国需要和平，世界需要和平”,2001-04-14,2001-04
搜救王伟的工作仍在继续,2001-04-14,2001-04
中国对撞机事件的处理维护了国家主权和民族尊严,2001-04-14,2001-04
傅全有赴三国访问,2001-04-14,2001-04
唐家璇会见联合国亚太经社会执行秘书,2001-04-14,2001-04
会见利比亚客人,2001-04-14,2001-04
李绪鄂同志逝世,2001-04-14,2001-04
《我与石油有缘》出版座谈会举行,2001-04-14,2001-04
变频数字彩电亮相APEC会议,2001-04-14,2001-04
冠群管理软件支持IBM新技术,2001-04-14,2001-04
IT认证培训研讨会在京举行,2001-04-14,2001-04
杰合伟业发布新型物流管理软件,2001-04-14,2001-04
三星推出双屏显示WAP手机,2001-04-14,2001-04
人民网：与重大事件同在,2001-04-14,2001-04
世界需要电子商务,2001-04-14,2001-04
互联网，旅行社要对你说,2001-04-14,2001-04
调查显示：移动互联网前景广阔,2001-04-14,2001-04
研究表明：教育信息化市场巨大,2001-04-14,2001-04
扬大家风范  做细处文章,2001-04-14,2001-04
信息安全“守护神”,2001-04-14,2001-04
一代盛事  旷世巨典,2001-04-14,2001-04
思考：通向史识的桥梁,2001-04-14,2001-04
在历史长河中探索边疆治理的演进,2001-04-14,2001-04
为人类的美好未来而奋斗,2001-04-14,2001-04
文化精神的科学总结,2001-04-14,2001-04
严复研究析疑二题,2001-04-14,2001-04
编者按,2001-04-14,2001-04
建构文艺评论新格局,2001-04-14,2001-04
抵制和杜绝泡沫评论,2001-04-14,2001-04
搞好面向群众的文艺评论,2001-04-14,2001-04
呼唤电视艺术评论,2001-04-14,2001-04
