创新不是主观臆想,2001-04-19,2001-04
促进农业参与国际分工与协作,2001-04-19,2001-04
建设高素质干部队伍的重要环节,2001-04-19,2001-04
研究邓小平理论的新视角,2001-04-19,2001-04
对新世纪安全战略的积极探索,2001-04-19,2001-04
西部大开发与精神文明建设,2001-04-19,2001-04
赌博者的乐园？,2001-04-19,2001-04
艰辛举报路,2001-04-19,2001-04
加强法律服务  积极化解矛盾,2001-04-19,2001-04
不严的“严禁”,2001-04-19,2001-04
化肥农药水货多,2001-04-19,2001-04
农民竟交工商税,2001-04-19,2001-04
擅自多收孕检费,2001-04-19,2001-04
推行择医而治  改革就医模式,2001-04-19,2001-04
完善配套  补偏去弊,2001-04-19,2001-04
“自选”质疑,2001-04-19,2001-04
年龄不应是道“坎”,2001-04-19,2001-04
紧密联系实际  实践“三个代表”,2001-04-19,2001-04
从“偷采金砂”说起,2001-04-19,2001-04
安徽省全面实行廉政谈话制度,2001-04-19,2001-04
金鸡台村的巨变,2001-04-19,2001-04
“威力”从哪里来？,2001-04-19,2001-04
武警南通支队强化政治工作,2001-04-19,2001-04
“我的一家”,2001-04-19,2001-04
感谢黄州,2001-04-19,2001-04
我们刚开始,2001-04-19,2001-04
汪洋恣肆都是情,2001-04-19,2001-04
随感录,2001-04-19,2001-04
建武一夜,2001-04-19,2001-04
永远的铺路石,2001-04-19,2001-04
长诗《东方神话》出版,2001-04-19,2001-04
陈景文两部诗集出版,2001-04-19,2001-04
《二○○○中国最佳杂文》出版,2001-04-19,2001-04
白俄罗斯共和国总统将访华,2001-04-20,2001-04
江主席结束拉美六国访问回到北京,2001-04-20,2001-04
中共中央致越共九大的贺辞,2001-04-20,2001-04
李鹏会见日本客人,2001-04-20,2001-04
李瑞环抵达开普敦,2001-04-20,2001-04
李岚清与法国总理会见,2001-04-20,2001-04
中美就美侦察机撞毁我军用飞机事件举行谈判,2001-04-20,2001-04
胡锦涛发表重要讲话,2001-04-20,2001-04
北京地区天气预报,2001-04-20,2001-04
朱镕基与新西兰总理会谈,2001-04-20,2001-04
中美就美侦察机撞毁我军用飞机事件举行谈判,2001-04-20,2001-04
进一步完善安全生产监管体系 促进安全生产形势的根本好转,2001-04-20,2001-04
中央国家机关大规模移交档案,2001-04-20,2001-04
一季度社会消费品零售总额增长10.3％,2001-04-20,2001-04
国家旅游局公布“五一”热线电话,2001-04-20,2001-04
南京6家违规财险公司受查处,2001-04-20,2001-04
京城里特殊的“希望小学”,2001-04-20,2001-04
浙江开展向王伟学习活动,2001-04-20,2001-04
西藏干群缅怀“海空卫士”,2001-04-20,2001-04
网络经济与经济治理国际研讨会举行,2001-04-20,2001-04
这是大国所为吗？,2001-04-20,2001-04
加强交流  增进信任  促进合作  共同发展,2001-04-20,2001-04
我再挫美反华人权提案 国际社会表示欢迎支持,2001-04-20,2001-04
西藏文化交流团举行报告会,2001-04-20,2001-04
古巴誓死保卫社会主义,2001-04-20,2001-04
朱镕基会见老挝客人,2001-04-20,2001-04
朱镕基会见巴基斯坦客人,2001-04-20,2001-04
朱镕基会见德国客人,2001-04-20,2001-04
中央纪委作出处分规定,2001-04-20,2001-04
对抗的死胡同还要走多久？,2001-04-20,2001-04
把培养选拔年轻干部工作提高到新水平,2001-04-20,2001-04
反华不得人心  正义必定胜利,2001-04-20,2001-04
加强民族团结促进共同繁荣,2001-04-20,2001-04
老挝驻华使馆举行晚宴庆祝老中建交40周年,2001-04-20,2001-04
军队要积极投身西部大开发,2001-04-20,2001-04
周铁农会见日本客人,2001-04-20,2001-04
蔡武离京赴摩尔多瓦,2001-04-20,2001-04
迅速取缔报废汽车拆解拼装市场,2001-04-20,2001-04
利用外资处置不良资产首获成功,2001-04-20,2001-04
由“种棉热”说开去,2001-04-20,2001-04
工商银行与美国际集团全面合作,2001-04-20,2001-04
玉米变酒精试点项目投产,2001-04-20,2001-04
公路建设资金违规问题突出,2001-04-20,2001-04
互联网“最后一公里”豁然通畅,2001-04-20,2001-04
中青年教师成为高校主力军,2001-04-20,2001-04
《集成电路布图设计保护条例》公布,2001-04-20,2001-04
全国扫黄打非行动开局良好,2001-04-20,2001-04
天津开发区涉外职专受欢迎,2001-04-20,2001-04
为申奥添绿,2001-04-20,2001-04
百名治沙专家送科技到沙区,2001-04-20,2001-04
首届外观设计专利赛举行,2001-04-20,2001-04
徐福文化搭起开放桥,2001-04-20,2001-04
清华网站全新改版献礼校庆,2001-04-20,2001-04
中非外长强调美应尊重中国主权,2001-04-20,2001-04
胡锦涛发表重要讲话,2001-04-20,2001-04
李岚清与法国总理会见,2001-04-20,2001-04
胡锦涛率中共代表团出席,2001-04-20,2001-04
友情加亲情,2001-04-20,2001-04
胡锦涛与陈德良会见,2001-04-20,2001-04
黎可漂向越共九大作报告,2001-04-20,2001-04
且看美国如何表现,2001-04-20,2001-04
出征四十六届世乒赛  中国代表团名单公布,2001-04-20,2001-04
全国场地自行车赛  姜翠华获两枚金牌,2001-04-20,2001-04
世界冰球B组锦标赛  中国队保组出现转机,2001-04-20,2001-04
上海云南夺冠势头受阻,2001-04-20,2001-04
种子棋手大半过关,2001-04-20,2001-04
中国羽毛球天王挑战赛本月开战,2001-04-20,2001-04
首钢大型综合体育中心年底建成,2001-04-20,2001-04
中澳市长联名支持北京申奥 小童星赠送吉祥物表示祝愿,2001-04-20,2001-04
欧洲体育记协主席来华交流,2001-04-20,2001-04
九运会武术散打预赛揭幕,2001-04-20,2001-04
中国百万少年盼奥运绘画活动启动,2001-04-20,2001-04
中天事件：游客被骗百万元,2001-04-20,2001-04
对旅行社下点猛药,2001-04-20,2001-04
网络广告春光已现,2001-04-20,2001-04
京城“春之梦”   尽兴在“五一”,2001-04-20,2001-04
眼镜扮靓,2001-04-20,2001-04
能夺回斯韦思林杯吗,2001-04-20,2001-04
春雷爆响,2001-04-20,2001-04
精打细算,2001-04-20,2001-04
“倒骑王”欲倒飞长城,2001-04-20,2001-04
少林将军的体育武术情怀,2001-04-20,2001-04
世乒赛团体赛电视转播表,2001-04-20,2001-04
古拉尔赤克的中国情缘,2001-04-20,2001-04
当家应知柴米贵,2001-04-20,2001-04
委内瑞拉人的“百家姓”,2001-04-20,2001-04
禁忌点滴,2001-04-20,2001-04
曼哈顿的“城中之城”,2001-04-20,2001-04
感受“地上天堂”,2001-04-20,2001-04
企业长盛之道在于“德”,2001-04-20,2001-04
江泽民会见新西兰总理,2001-04-21,2001-04
朱镕基电贺摩尔多瓦共和国新总理,2001-04-21,2001-04
国务院召开第三十七次常务会议,2001-04-21,2001-04
关心劳模  爱护劳模  学习劳模,2001-04-21,2001-04
建筑市场：勘察设计施工监理企业自纠自查,2001-04-21,2001-04
交通市场：整顿规范年底要取得阶段性成果,2001-04-21,2001-04
北京地区天气预报,2001-04-21,2001-04
江泽民会见王伟亲属及生前所在部队代表,2001-04-21,2001-04
“治病”是假   “台独”是真,2001-04-21,2001-04
以“三个代表”统领农村各项工作  推动农村经济发展社会全面进步,2001-04-21,2001-04
“稳准狠”确保“严打”斗争质量,2001-04-21,2001-04
全力以赴抓好“严打”整治斗争,2001-04-21,2001-04
严惩严重危害社会治安犯罪,2001-04-21,2001-04
我政府向日方提出严正交涉,2001-04-21,2001-04
中商会和中物联成立,2001-04-21,2001-04
复旦大学组建神经生物学研究所,2001-04-21,2001-04
我国16年培养博士后近1.4万人,2001-04-21,2001-04
我国数字地质图数据库赠送有关部门,2001-04-21,2001-04
明天气象预报,2001-04-21,2001-04
功过谁评说  后生定先祖,2001-04-21,2001-04
胡锦涛会见古朝等国代表团团长,2001-04-21,2001-04
李岚清会见法国外长,2001-04-21,2001-04
日议员参拜靖国神社,2001-04-21,2001-04
越南外长强调发展越中关系,2001-04-21,2001-04
美应对撞机事件承担全部责任,2001-04-21,2001-04
庆祝“吉隆滩战役”胜利40周年,2001-04-21,2001-04
巴领导人会见傅全有,2001-04-21,2001-04
乌克兰总统会见曹刚川,2001-04-21,2001-04
巴重申继续中东和平进程  一些国家谴责以侵略行径,2001-04-21,2001-04
中老关系研讨会举行,2001-04-21,2001-04
美古两国恢复定期航运,2001-04-21,2001-04
泰破获假美国库券案,2001-04-21,2001-04
“上海五国”军队总参谋部将加强合作,2001-04-21,2001-04
陈健大使向日方提出严正交涉,2001-04-21,2001-04
美联储再度“突袭”,2001-04-21,2001-04
世界华商大会9月在南京召开,2001-04-21,2001-04
东南之滨的体育乐土,2001-04-21,2001-04
朱镕基会见韩国总统特使,2001-04-21,2001-04
尉健行会见新西兰工会客人,2001-04-21,2001-04
尉健行会见新西兰总理,2001-04-21,2001-04
外交部发言人发表谈话,2001-04-21,2001-04
吴仪会见新西兰总理,2001-04-21,2001-04
彭珮云会见多哥客人,2001-04-21,2001-04
梁思成诞辰100周年纪念会举行,2001-04-21,2001-04
盐城纪念新四军重建军部六十周年,2001-04-21,2001-04
秦皇岛：打造新世纪“旅游航母”,2001-04-21,2001-04
刘亚洲捐30万元稿费建希望小学,2001-04-21,2001-04
赵颖慧夺得世界杯赛女子步枪银牌,2001-04-21,2001-04
瓦尔德内尔充满信心,2001-04-21,2001-04
全国青少年三对三篮球联赛下月开幕,2001-04-21,2001-04
世界冰球B组锦标赛中国队负于英国队,2001-04-21,2001-04
刘殿中巧取一分,2001-04-21,2001-04
全国场地自行车赛第二站比赛结束,2001-04-21,2001-04
国产服务器杀出重围,2001-04-21,2001-04
技术的方向是市场,2001-04-21,2001-04
名词解释,2001-04-21,2001-04
业界视点,2001-04-21,2001-04
一个品牌的崛起,2001-04-21,2001-04
范索云和她的34位“爹娘”,2001-04-21,2001-04
时炳良助失学儿童重返校园,2001-04-21,2001-04
信贷助农奔小康,2001-04-21,2001-04
写好文字说明,2001-04-21,2001-04
春到内昆,2001-04-21,2001-04
牧牛和牧牛图,2001-04-21,2001-04
家乡的希望,2001-04-21,2001-04
给自己多一点爱心,2001-04-21,2001-04
战斗堡垒今更坚,2001-04-22,2001-04
云南掀起严打整治第一战役高潮,2001-04-22,2001-04
安徽重拳出击穷追猛打黑恶势力,2001-04-22,2001-04
贵州集中力量整治治安混乱地区,2001-04-22,2001-04
李瑞环会见南非国民议会议长,2001-04-22,2001-04
白俄罗斯共和国总统卢卡申科,2001-04-22,2001-04
张君李泽军等14名罪犯被判死刑,2001-04-22,2001-04
北京地区天气预报,2001-04-22,2001-04
百步一亭  温馨家园,2001-04-22,2001-04
盼社区绿荫满中华,2001-04-22,2001-04
百步一亭  温馨家园,2001-04-22,2001-04
李瑞环会见南非省务院主席,2001-04-22,2001-04
胡锦涛看望我驻越使馆人员,2001-04-22,2001-04
革新开放富农家,2001-04-22,2001-04
强烈抗议政府纵容李登辉访日,2001-04-22,2001-04
国际社会支持我对人权问题立场,2001-04-22,2001-04
外交部发言人答记者问,2001-04-22,2001-04
台湾社会人士强烈反对李登辉赴日,2001-04-22,2001-04
香港舆论谴责李登辉分裂祖国活动,2001-04-22,2001-04
重庆纪念赵世炎百年诞辰,2001-04-22,2001-04
第二十届电视剧“飞天奖”揭晓,2001-04-22,2001-04
中韩签署大蒜贸易协议备忘录,2001-04-22,2001-04
唐家璇出访三国并出席“上海五国”外长会晤,2001-04-22,2001-04
外交部新任驻港特派员吉佩定抵港履新,2001-04-22,2001-04
陕西韩城一小煤矿发生瓦斯爆炸事故,2001-04-22,2001-04
战斗堡垒今更坚,2001-04-22,2001-04
稷山县：信息扶贫带来电话热,2001-04-22,2001-04
“杀人恶魔”的末日,2001-04-22,2001-04
学习王伟精神  搞好本职工作,2001-04-22,2001-04
县长上门道歉,2001-04-22,2001-04
枝江市：企业成为农业订单大户,2001-04-22,2001-04
临沂：城建投资主体多元化,2001-04-22,2001-04
湘潭  万件实事解民忧,2001-04-22,2001-04
成都  十万干部送甘霖,2001-04-22,2001-04
龙华镇  解决村级经济发展不平衡,2001-04-22,2001-04
美术作品欣赏,2001-04-22,2001-04
李鬼气煞李逵,2001-04-22,2001-04
严谨而儒雅,2001-04-22,2001-04
堂而皇之下,2001-04-22,2001-04
出入传统  自标高格,2001-04-22,2001-04
一定要认真抓好整改,2001-04-23,2001-04
海空卫士——王伟,2001-04-23,2001-04
四川工业生产稳步增长,2001-04-23,2001-04
河南国民经济开局良好,2001-04-23,2001-04
宁夏工业实现整体赢利,2001-04-23,2001-04
朱镕基批示要求严肃处理责任者,2001-04-23,2001-04
江泽民总书记致电祝贺农德孟当选越共中央总书记,2001-04-23,2001-04
李岚清回到北京,2001-04-23,2001-04
农德孟当选越共中央总书记,2001-04-23,2001-04
白俄罗斯共和国总统抵京,2001-04-23,2001-04
北京地区天气预报,2001-04-23,2001-04
重庆重点抓好百个工业结构调整项目,2001-04-23,2001-04
中科院将全面推行岗位聘任制,2001-04-23,2001-04
贵州房屋置换模式成为商品出售,2001-04-23,2001-04
3月份“国房景气指数”攀升,2001-04-23,2001-04
京沪高速公路客运全线开通,2001-04-23,2001-04
“绿色”列车亮相青岛,2001-04-23,2001-04
北京公安“零点行动”,2001-04-23,2001-04
加拿大归还我一尊龙门石雕,2001-04-23,2001-04
云南省府作承诺  地方保护要消除,2001-04-23,2001-04
环保执法敢碰硬  山西查处失职者,2001-04-23,2001-04
优质稻米难发展  三大难题相困扰,2001-04-23,2001-04
企业农民喜联姻  反租倒包大增收,2001-04-23,2001-04
太平镇取消村级招待费之后,2001-04-23,2001-04
贵在坚持,2001-04-23,2001-04
李瑞环会见南非副总统,2001-04-23,2001-04
胡锦涛接受越南媒体采访,2001-04-23,2001-04
越共“九大”闭幕,2001-04-23,2001-04
李铁映结束访法,2001-04-23,2001-04
摩总理会见中共代表团,2001-04-23,2001-04
中国最大海外石油承包工程竣工,2001-04-23,2001-04
西藏文化交流团访问智利,2001-04-23,2001-04
美友好人士支持我处理撞机事件立场,2001-04-23,2001-04
日本小泉有望当选自民党新总裁,2001-04-23,2001-04
布隆迪政变未遂,2001-04-23,2001-04
贝·布托案起波澜,2001-04-23,2001-04
婚姻法（修正草案）向社会公布征求意见的情况,2001-04-23,2001-04
年龄“不限”与学习“无限”,2001-04-23,2001-04
深入持久地开展资源教育活动,2001-04-23,2001-04
新闻摄影比赛,2001-04-23,2001-04
潍坊国际风筝会举行,2001-04-23,2001-04
昆明国际艺术节开幕,2001-04-23,2001-04
“中国通用技术杯”新闻摄影比赛启事,2001-04-23,2001-04
省长雨中听民声,2001-04-23,2001-04
鼓声阵阵谢党恩,2001-04-23,2001-04
明天气象预报,2001-04-23,2001-04
崔萍同志逝世,2001-04-23,2001-04
金熙英同志逝世,2001-04-23,2001-04
北京：突出重点全面整顿,2001-04-23,2001-04
湖南：重点抓好六方面整治,2001-04-23,2001-04
云南：确保整顿目标实现,2001-04-23,2001-04
新疆：整顿工作全面展开,2001-04-23,2001-04
股市摘牌动真格,2001-04-23,2001-04
保持货币供应量平稳增长,2001-04-23,2001-04
保护珍贵的地质遗产,2001-04-23,2001-04
广东海关缉私艇队首访香港海关,2001-04-23,2001-04
国土资源部举办大型宣传活动  纪念第三十二个“世界地球日”,2001-04-23,2001-04
棉检师执业资格考试举行,2001-04-23,2001-04
北京铁路加开“五一”临客,2001-04-23,2001-04
安阳郊区地税局加强发票管理,2001-04-23,2001-04
朝阳国税举办区域经济座谈会,2001-04-23,2001-04
长治市请专家指点民企发展,2001-04-23,2001-04
大观园茶会将在京举行,2001-04-23,2001-04
美两家公司赞助我关节炎防治,2001-04-23,2001-04
美国瑞姆空调进入中国市场,2001-04-23,2001-04
海空卫士——王伟,2001-04-23,2001-04
黑龙江   “打黑除恶”攻势凌厉,2001-04-23,2001-04
云南  公安边防守好“三道防线”,2001-04-23,2001-04
吉安  精心组织首战告捷,2001-04-23,2001-04
交通违章处理能否简便一点,2001-04-23,2001-04
“党在我心中”百城青年文化广场活动展开,2001-04-23,2001-04
民进召开担任政府实职人员座谈会,2001-04-23,2001-04
吉林地税廉政建设制度化,2001-04-23,2001-04
东阳乡镇干部为广大农户建档案,2001-04-23,2001-04
农业系统先进党组织优秀党员征文开始,2001-04-23,2001-04
玉林制药厂“职工之家”暖人心,2001-04-23,2001-04
绥宁县看守所二十二年无事故,2001-04-23,2001-04
裕安区“三个代表”学教落在实处,2001-04-23,2001-04
巴西头号大毒枭落网,2001-04-23,2001-04
意航法航决定联姻,2001-04-23,2001-04
艾滋病在柬埔寨蔓延,2001-04-23,2001-04
美研制快速飞机,2001-04-23,2001-04
美国应批准《京都议定书》,2001-04-23,2001-04
南北美洲存在巨大分歧,2001-04-23,2001-04
安捷的教训,2001-04-23,2001-04
韩国抗议日本歪曲历史,2001-04-23,2001-04
女子象棋大师赛又赛一场,2001-04-23,2001-04
中国队首战告捷,2001-04-23,2001-04
全国足球甲B联赛战报,2001-04-23,2001-04
中国队严阵以待,2001-04-23,2001-04
常昊战胜古力,2001-04-23,2001-04
体育界共商战略大计,2001-04-23,2001-04
世界象棋挑战赛精彩纷呈,2001-04-23,2001-04
全国男子排球联赛接近尾声,2001-04-23,2001-04
北京：自行车宣传队助申奥,2001-04-23,2001-04
诸暨斗岩全国攀岩精英赛结束,2001-04-23,2001-04
世界杯射击赛中国奖牌列第一,2001-04-23,2001-04
世界冰球锦标赛中国队成功保组,2001-04-23,2001-04
为啥连螺栓都拧不紧,2001-04-23,2001-04
为中小企业创造公平环境,2001-04-23,2001-04
低价位车缘何少人喝彩,2001-04-23,2001-04
对马虎不能马虎,2001-04-23,2001-04
部分地区安全隐患严重,2001-04-23,2001-04
好技术难过“水土关”,2001-04-23,2001-04
浮桥又浮起来了,2001-04-23,2001-04
经济数据,2001-04-23,2001-04
处置不良资产：结构调整新动力,2001-04-23,2001-04
投资普制金币正当时,2001-04-23,2001-04
湖北国税构筑廉政新防线,2001-04-23,2001-04
券商的责任更重了,2001-04-23,2001-04
迎接保险市场新挑战,2001-04-23,2001-04
工行今年发放项目贷款将超千亿,2001-04-23,2001-04
阳光卡向“私人金融全能卡”发展,2001-04-23,2001-04
营口地税加强涉外税收征管,2001-04-23,2001-04
恩施国税“九五”税收逾二十亿,2001-04-23,2001-04
新华人寿上海分公司开业,2001-04-23,2001-04
玉田地税农村税收公开见成效,2001-04-23,2001-04
从“妈妈”到“婆婆”,2001-04-23,2001-04
此“婆婆”非彼“婆婆”,2001-04-23,2001-04
乡企发展不能“中间冷”,2001-04-23,2001-04
只当了一年“莲藕状元”,2001-04-23,2001-04
唐河畜牧寻找健康卖点,2001-04-23,2001-04
海宁农民与教授“攀亲”,2001-04-23,2001-04
上栗实行贷款信用“绿卡”,2001-04-23,2001-04
两幅“中堂”乐不同,2001-04-23,2001-04
拓展服务触角,2001-04-23,2001-04
环境，也是生产力,2001-04-23,2001-04
建筑市场“四把刀”,2001-04-23,2001-04
企业将投资的主要高新技术领域（%）,2001-04-23,2001-04
关注安全  关爱生命,2001-04-23,2001-04
工程招标投标“十八怪”,2001-04-23,2001-04
用生命播洒阳光,2001-04-24,2001-04
李瑞环与姆贝基会见,2001-04-24,2001-04
胡锦涛与农德孟亲切会见,2001-04-24,2001-04
胡锦涛出席越共九大后回到北京,2001-04-24,2001-04
马来西亚最高元首苏丹·萨拉赫丁,2001-04-24,2001-04
北京地区天气预报,2001-04-24,2001-04
江主席与卢卡申科总统会谈,2001-04-24,2001-04
自觉实践“三个代表”的楷模,2001-04-24,2001-04
用生命播洒阳光,2001-04-24,2001-04
江主席对军事科研工作重要论述是新形势下军事科研的科学指南,2001-04-24,2001-04
听取供销合作社改革发展情况汇报,2001-04-24,2001-04
检查未成年人保护法实施情况,2001-04-24,2001-04
听取关于人口与计划生育立法情况汇报,2001-04-24,2001-04
提高检察队伍素质  保证严打顺利进行,2001-04-24,2001-04
外经贸部发言人发表谈话,2001-04-24,2001-04
PT水仙成为首家退市公司,2001-04-24,2001-04
李瑞环与姆贝基会见,2001-04-24,2001-04
胡锦涛与农德孟亲切会见,2001-04-24,2001-04
李瑞环抵达比勒陀利亚,2001-04-24,2001-04
胡锦涛离开河内回国,2001-04-24,2001-04
不要错上加错,2001-04-24,2001-04
中越两党两国关系新篇章,2001-04-24,2001-04
韩国总理会见邵华泽,2001-04-24,2001-04
美洲国家首脑会议闭幕,2001-04-24,2001-04
沃罗宁再次当选摩共领袖,2001-04-24,2001-04
亚太经社会年会开幕,2001-04-24,2001-04
李鹏会见卢卡申科总统,2001-04-24,2001-04
李鹏会见坦桑尼亚客人,2001-04-24,2001-04
朱镕基会见古巴客人,2001-04-24,2001-04
尉健行会见保加利亚客人,2001-04-24,2001-04
中华人民共和国和白俄罗斯共和国联合声明,2001-04-24,2001-04
白俄罗斯坚定支持北京申奥,2001-04-24,2001-04
中国伊斯兰教教务指导委员会成立,2001-04-24,2001-04
“中国记者林”二期工程启动,2001-04-24,2001-04
王兆国会见香港玩具厂商会访京团,2001-04-24,2001-04
迟浩田会见白俄罗斯客人,2001-04-24,2001-04
迟浩田同捷克国防部长会谈,2001-04-24,2001-04
温家宝会见印度尼西亚客人,2001-04-24,2001-04
吴仪会见多哥妇女代表团,2001-04-24,2001-04
新闻摄影比赛,2001-04-24,2001-04
国务院关于修改《中华人民共和国外资企业法实施细则》的决定,2001-04-24,2001-04
中华人民共和国外资企业法实施细则,2001-04-24,2001-04
辩证看待信息安全,2001-04-24,2001-04
警惕  滥用抗生素,2001-04-24,2001-04
新世纪呼唤新农民,2001-04-24,2001-04
高校教学质量提高有保障,2001-04-24,2001-04
我国第一次现代化实现程度73％,2001-04-24,2001-04
造血干细胞捐献者资料库加紧建设,2001-04-24,2001-04
秦岭北麓将再现“上林苑”风采,2001-04-24,2001-04
中美教育论坛在京举行,2001-04-24,2001-04
超甜玉米大规模示范,2001-04-24,2001-04
上海国际茶文化节将举行,2001-04-24,2001-04
信阳师院重奖科研人员,2001-04-24,2001-04
反盗版技术大有作为,2001-04-24,2001-04
中小学教师阅读状况有了回答,2001-04-24,2001-04
关注9％,2001-04-24,2001-04
中国男女队旗开得胜,2001-04-24,2001-04
全国体育发展战略研讨会闭幕,2001-04-24,2001-04
世界象棋挑战赛决出四强,2001-04-24,2001-04
为海外兵团正名,2001-04-24,2001-04
毫厘之差的启示,2001-04-24,2001-04
绿色食品──农业的亮点,2001-04-24,2001-04
把邪教送上审判台,2001-04-24,2001-04
印度  推行伊斯兰外交,2001-04-24,2001-04
欧洲小汽车价格连续5年下降,2001-04-24,2001-04
俄乌平息钢管战,2001-04-24,2001-04
非洲经济可望持续增长,2001-04-24,2001-04
领导者的根本职责,2001-04-24,2001-04
举事当先审民心,2001-04-24,2001-04
“一把手”须坚持“两点论”,2001-04-24,2001-04
树立现代文明社会的残疾人观,2001-04-24,2001-04
党性党风教育的理想读物,2001-04-24,2001-04
向世界一流大学迈进,2001-04-24,2001-04
清华大学“九五”期间教学科研成果扫描（）,2001-04-24,2001-04
大学精神与清华精神,2001-04-24,2001-04
清华知名校友选,2001-04-24,2001-04
参事工作是统战工作重要方面,2001-04-24,2001-04
根源黄帝,2001-04-24,2001-04
和平统一的康庄大道,2001-04-24,2001-04
开发区“守护神”,2001-04-24,2001-04
跨越海峡的亲情,2001-04-24,2001-04
喧嚣中的怀念,2001-04-24,2001-04
百集电视片《影响中国历史进程的事件》即将问世,2001-04-24,2001-04
娱乐荧屏当去铜臭,2001-04-24,2001-04
名与不名自己知,2001-04-24,2001-04
都是“名利”惹的祸,2001-04-24,2001-04
卡尔·皮尼指挥爱乐乐团,2001-04-24,2001-04
愿为工人歌与呼,2001-04-24,2001-04
首届全国广告模特大赛拉开帷幕,2001-04-24,2001-04
嘉德春拍多佳品,2001-04-24,2001-04
《中华文学选刊》改版,2001-04-24,2001-04
《傅尚媛水彩画展》在京举行,2001-04-24,2001-04
《中国流行歌曲榜》2000年度评选揭晓,2001-04-24,2001-04
“五一”首都舞台精彩纷呈,2001-04-24,2001-04
伟大时代的英雄战士,2001-04-25,2001-04
艰苦奋斗是他们的旗帜,2001-04-25,2001-04
中老两国领导人互致贺电 热烈祝贺两国建交40周年,2001-04-25,2001-04
全国人大常委会第二十一次会议开幕,2001-04-25,2001-04
胡锦涛会见王伟亲属及生前所在部队代表,2001-04-25,2001-04
中央军委授予王伟“海空卫士”荣誉称号命名大会在京举行,2001-04-25,2001-04
北京地区天气预报,2001-04-25,2001-04
江主席会见马来西亚最高元首,2001-04-25,2001-04
我国“九五”科技攻关成果辉煌,2001-04-25,2001-04
福建整顿市场经济秩序见效,2001-04-25,2001-04
首家外企博士后科研工作站挂牌,2001-04-25,2001-04
地方检察院今年进行五方面改革,2001-04-25,2001-04
国家税务总局公布7起涉税案件,2001-04-25,2001-04
农发行正式办理外汇结算业务,2001-04-25,2001-04
用生命播洒阳光,2001-04-25,2001-04
一季度工业经济效益水平明显提高,2001-04-25,2001-04
李瑞环看望我驻南非人员,2001-04-25,2001-04
老中合作关系不断发展,2001-04-25,2001-04
不要把日本引入歧途,2001-04-25,2001-04
捷总理会见唐家璇,2001-04-25,2001-04
摩领导人会见中共代表,2001-04-25,2001-04
小泉当选日自民党总裁,2001-04-25,2001-04
日妇联会抗议右翼教科书,2001-04-25,2001-04
抗议李登辉访日,2001-04-25,2001-04
中国政府坚决反对李登辉到美活动,2001-04-25,2001-04
美将向台出售部分武器,2001-04-25,2001-04
介绍和平解放后伟大成就,2001-04-25,2001-04
阿尔及利亚支持我对人权问题立场,2001-04-25,2001-04
美从轻发落撞船责任人,2001-04-25,2001-04
