哥反政府武装绑架12名省议员,2002-04-13,2002-04
肯重申坚持一个中国立场,2002-04-13,2002-04
委内瑞拉政局突变,2002-04-13,2002-04
乌克兰  议会选举两大赢家,2002-04-13,2002-04
北京首钢队保级有望,2002-04-13,2002-04
女子围棋名人战种子选手仅一人进四强,2002-04-13,2002-04
健康老人登山活动东北赛区开幕,2002-04-13,2002-04
全民健身好新闻评选结果揭晓,2002-04-13,2002-04
全国射箭冠军赛破一项全国纪录,2002-04-13,2002-04
大学生足球联赛东区决赛结束,2002-04-13,2002-04
明天气象预报,2002-04-13,2002-04
朱镕基会见泰国总理他信,2002-04-13,2002-04
朱镕基会见日本首相小泉,2002-04-13,2002-04
朱镕基会见中外企业家,2002-04-13,2002-04
朱镕基会见韩国总理李汉东,2002-04-13,2002-04
李岚清会见剑桥大学校长,2002-04-13,2002-04
上海合作组织成员国六国文化部长会晤,2002-04-13,2002-04
博鳌亚洲论坛首届年会好戏连场,2002-04-13,2002-04
中国的发展将促进亚洲繁荣,2002-04-13,2002-04
中美举行海上军事安全磋商机制二〇〇二年年度会晤,2002-04-13,2002-04
电视片《中华文物备忘录》座谈会举行,2002-04-13,2002-04
世界聚焦博鳌,2002-04-13,2002-04
外交部驻澳门副特派员韩肇康离任,2002-04-13,2002-04
沈阳总工会成立困难职工救助中心,2002-04-13,2002-04
博鳌亚洲论坛首届年会开幕,2002-04-13,2002-04
为了大地的丰收,2002-04-13,2002-04
巴彦淖尔盟加快小康村建设,2002-04-13,2002-04
巴盟河套灌区推行节水型农业,2002-04-13,2002-04
龙舞河套,2002-04-13,2002-04
强化政府责任  推进依法行政,2002-04-13,2002-04
治学浅说,2002-04-13,2002-04
反思全球化,2002-04-13,2002-04
《文化的视点》,2002-04-13,2002-04
《国共关系史上的秘案》,2002-04-13,2002-04
《社会变革中的行政法治》,2002-04-13,2002-04
《网络与当代社会文化》,2002-04-13,2002-04
世贸组织与我国行政法治,2002-04-13,2002-04
构建信息时代政务模式,2002-04-13,2002-04
大势所趋  历史机遇,2002-04-13,2002-04
梳理主线  规范业务,2002-04-13,2002-04
分步发展  循序渐进,2002-04-13,2002-04
确保安全  把握分寸,2002-04-13,2002-04
包头市审批大厅门庭冷落,2002-04-13,2002-04
突出政务  知难而上,2002-04-13,2002-04
信息化带动工业化的思考,2002-04-13,2002-04
网络媒体成功的标准是什么,2002-04-13,2002-04
一曲爱国者之歌,2002-04-13,2002-04
学习世贸组织基本知识,2002-04-13,2002-04
巴蜀文化研究与文化建设,2002-04-13,2002-04
副刊百年史（序跋选）,2002-04-13,2002-04
为健康的书评鼓呼,2002-04-13,2002-04
世纪的回顾,2002-04-13,2002-04
专家推荐优秀作文图书,2002-04-13,2002-04
《鲁迅小说全编绘图本》出版,2002-04-13,2002-04
对线条艺术的创新求索,2002-04-13,2002-04
《新闻电影———我们曾经的年代》出版发行,2002-04-13,2002-04
《赵彬画集》出版,2002-04-13,2002-04
江主席抵利比亚进行国事访问,2002-04-14,2002-04
中德关系前景广阔  中德友好深入人心,2002-04-14,2002-04
朱镕基会见董建华何厚铧以及香港澳门工商界人士,2002-04-14,2002-04
朱镕基会见阮孟琴,2002-04-14,2002-04
胡锦涛会见基辛格,2002-04-14,2002-04
李岚清出席尼克松总统访华暨中美《上海公报》发表30周年纪念活动,2002-04-14,2002-04
为了绿色的承诺,2002-04-14,2002-04
李岚清会见欧盟客人,2002-04-14,2002-04
张立昌当选天津市委书记,2002-04-14,2002-04
北京地区天气预报,2002-04-14,2002-04
江泽民与卡扎菲会谈,2002-04-14,2002-04
明天气象预报,2002-04-14,2002-04
首部旅游饭店行业规范出台,2002-04-14,2002-04
千方百计增加农民收入,2002-04-14,2002-04
严禁任何单位和个人毁林烧炭,2002-04-14,2002-04
全国人大内司委结束在沪执法检查,2002-04-14,2002-04
欧盟关于打火机的CR法案对我相关产业构成歧视,2002-04-14,2002-04
年底所有市县建立基本医疗保险制度,2002-04-14,2002-04
聊城将举办中国江北水城旅游文化节,2002-04-14,2002-04
玉溪公安机关靠改革强警,2002-04-14,2002-04
富阳改善环境塑造个性城市,2002-04-14,2002-04
广开门路完善政策努力开创再就业工作新局面,2002-04-14,2002-04
上海申花队主场失利,2002-04-14,2002-04
阿拉法特谴责耶城爆炸事件,2002-04-14,2002-04
坦桑支持我和平统一大业,2002-04-14,2002-04
韩朝红十字会联络官接触,2002-04-14,2002-04
里约集团峰会闭幕,2002-04-14,2002-04
国际刑事法院获准成立,2002-04-14,2002-04
耶城爆炸祸及我公民,2002-04-14,2002-04
欧盟改革应体现大小国平等,2002-04-14,2002-04
驻阿国际安全部队遭袭,2002-04-14,2002-04
美驻也使馆附近发生爆炸,2002-04-14,2002-04
南联盟引渡法引发震荡,2002-04-14,2002-04
查韦斯辞职前后,2002-04-14,2002-04
北京积极推动奥运会筹办工作,2002-04-14,2002-04
富士通杯世界职业围棋赛揭幕,2002-04-14,2002-04
全国田径大奖赛在顺德揭幕,2002-04-14,2002-04
象棋超级排位赛胡荣华进入八强,2002-04-14,2002-04
乒乓球超级联赛战况激烈,2002-04-14,2002-04
江主席抵利比亚进行国事访问,2002-04-14,2002-04
博鳌亚洲论坛圆满结束,2002-04-14,2002-04
为了亚洲的共同繁荣,2002-04-14,2002-04
亚洲国家应建立自己强大的新闻媒体,2002-04-14,2002-04
中国政府表示哀悼,2002-04-14,2002-04
中国政府向朝鲜提供一批物资援助,2002-04-14,2002-04
流通业成为辽宁产业老二,2002-04-14,2002-04
运城打造“阳光财政”,2002-04-14,2002-04
“一站式”审批为何站不住,2002-04-14,2002-04
去年制笔业出口创汇3.54亿美元,2002-04-14,2002-04
西门子在华再投巨资,2002-04-14,2002-04
企业失信之最：拖欠、违约、制假售假,2002-04-14,2002-04
中国国际易货交易网开通,2002-04-14,2002-04
北戴河加快建设旅游城市,2002-04-14,2002-04
小天鹅进军中央空调,2002-04-14,2002-04
春兰空调技术又登国际讲台,2002-04-14,2002-04
林州市地税局实行纳税期限提示制,2002-04-14,2002-04
东滩矿安全产煤一千四百万吨,2002-04-14,2002-04
老字号东来顺获驰名商标称号,2002-04-14,2002-04
为了绿色的承诺,2002-04-14,2002-04
义利兼顾的光彩事业,2002-04-14,2002-04
有感于省委书记的反思,2002-04-14,2002-04
高原新貌,2002-04-14,2002-04
杰出青年卫士  刘晓辉,2002-04-14,2002-04
文明路上“领头羊”,2002-04-14,2002-04
家和万事兴,2002-04-14,2002-04
无言遗物写忠诚,2002-04-14,2002-04
特色农业“花”正红,2002-04-14,2002-04
“订单农业”呼唤信用,2002-04-14,2002-04
咋念“富经”,2002-04-14,2002-04
兰考：昔日沙荒变绿洲,2002-04-14,2002-04
西部开发“指南”莫太滥,2002-04-14,2002-04
“生态桃”富了平谷,2002-04-14,2002-04
三河农业产业化致富万家,2002-04-14,2002-04
怀远农民靠“手艺”打工,2002-04-14,2002-04
六合村用上“水存折”,2002-04-14,2002-04
绿色农业亮了沛县,2002-04-14,2002-04
万里归心对月明,2002-04-14,2002-04
书法文化与学者眼界,2002-04-14,2002-04
画人和战士亚明,2002-04-14,2002-04
写生的出入动静,2002-04-14,2002-04
作品欣赏,2002-04-14,2002-04
中国画研究院组织画家写生,2002-04-14,2002-04
邵华泽海外摄影集出版,2002-04-14,2002-04
华辰拍卖异军突起,2002-04-14,2002-04
中国和利比亚发表新闻公报,2002-04-15,2002-04
立足资源优势  大力发展特色经济 保护生态环境  走可持续发展道路,2002-04-15,2002-04
李鹏分别会见孟加拉国议长和阿塞拜疆国民议会主席,2002-04-15,2002-04
朱镕基会见基辛格,2002-04-15,2002-04
胡锦涛会见参加“中日青年环保合作论坛”的日本客人,2002-04-15,2002-04
山水古韵长,2002-04-15,2002-04
一季度各地经济形势好,2002-04-15,2002-04
江主席对尼日利亚进行国事访问,2002-04-15,2002-04
北京地区天气预报,2002-04-15,2002-04
高位嫁接  重心下移,2002-04-15,2002-04
一举数得,2002-04-15,2002-04
今年投资155亿元改造传统产业,2002-04-15,2002-04
我国森林火灾损失十余年来大幅下降,2002-04-15,2002-04
“二〇〇二国际人类基因组大会”在沪举行,2002-04-15,2002-04
广交会会期实行重大改革,2002-04-15,2002-04
海洋生物雕塑：艺术关注生态,2002-04-15,2002-04
院士专家田头问菜,2002-04-15,2002-04
山水古韵长,2002-04-15,2002-04
八国集团环境部长会议举行,2002-04-15,2002-04
殷切期待朱镕基访土,2002-04-15,2002-04
穆巴拉克会见我教育部长,2002-04-15,2002-04
阿拉法特同鲍威尔会谈,2002-04-15,2002-04
查韦斯重新就任总统,2002-04-15,2002-04
埃塞接受海牙边界委员会裁决,2002-04-15,2002-04
纪念金日成同志90诞辰,2002-04-15,2002-04
永远和人民在一起,2002-04-15,2002-04
阿即将推选大国民会议代表,2002-04-15,2002-04
澳放开干细胞研究,2002-04-15,2002-04
马达加斯加发生流血冲突,2002-04-15,2002-04
悠久的历史  灿烂的文化,2002-04-15,2002-04
国家外专局科技拥军成效显著,2002-04-15,2002-04
考察北京市大气环境质量,2002-04-15,2002-04
北京将限期关停现有砂石场,2002-04-15,2002-04
山西确保灾区群众基本生活,2002-04-15,2002-04
成都万名干部结对帮扶贫困户,2002-04-15,2002-04
青海加强林业建设,2002-04-15,2002-04
吉林治理荒漠化土地,2002-04-15,2002-04
武汉为市民打造生态家园,2002-04-15,2002-04
曾庆红会见日本客人,2002-04-15,2002-04
亚洲议会和平协会第三届年会首批代表抵京,2002-04-15,2002-04
深圳国际航空货运首季“开门红”,2002-04-15,2002-04
立足资源优势  大力发展特色经济 保护生态环境  走可持续发展道路,2002-04-15,2002-04
李鹏分别会见孟加拉国议长和阿塞拜疆国民议会主席,2002-04-15,2002-04
热烈祝贺北京市怀柔撤县设区,2002-04-15,2002-04
医疗事故处理条例,2002-04-15,2002-04
睦邻合作  共求发展,2002-04-15,2002-04
熙来攘往通有无,2002-04-15,2002-04
美签订人类干细胞研究国际协议,2002-04-15,2002-04
刘东生获泰勒环境奖,2002-04-15,2002-04
栗原小卷电影作品展开幕,2002-04-15,2002-04
宇宙中发现两奇异星体,2002-04-15,2002-04
黑洞共唱“同一首歌”,2002-04-15,2002-04
CBA总决赛第二场面面观,2002-04-15,2002-04
于梅玲获女子围棋名人战冠军,2002-04-15,2002-04
全国田径大奖赛首站落幕,2002-04-15,2002-04
足球甲A联赛  北京国安队领跑第一阶段,2002-04-15,2002-04
男排联赛  江苏浙江山东辽宁进四强,2002-04-15,2002-04
南华队第八次获香港足总杯赛冠军,2002-04-15,2002-04
卡努奇创男子马拉松世界最好成绩,2002-04-15,2002-04
国际田联变更积分排名体制,2002-04-15,2002-04
大学生足球联赛南区决赛阶段开球,2002-04-15,2002-04
中国银川国际摩托旅游节将举行,2002-04-15,2002-04
黄河边只准卖黄河啤酒,2002-04-15,2002-04
警惕“篱笆墙”花样翻新,2002-04-15,2002-04
摘自朱镕基总理在九届全国人大五次会议上的政府工作报告,2002-04-15,2002-04
地方保护为何难消除？,2002-04-15,2002-04
邂逅“中国造”,2002-04-15,2002-04
咱也喝上了自来水！,2002-04-15,2002-04
有水就能办“漂流”吗,2002-04-15,2002-04
保险开放  人才告急,2002-04-15,2002-04
别踩上市公司担保“地雷”,2002-04-15,2002-04
为啥要给导游换证计分,2002-04-15,2002-04
玩具出口检验驶上“快车道”,2002-04-15,2002-04
助学贷款须防混水摸鱼,2002-04-15,2002-04
首届旅游纪念品设计大赛北京折桂,2002-04-15,2002-04
利宝互助保险集团热心西部投资,2002-04-15,2002-04
一季度日照海关实现税收增长九成,2002-04-15,2002-04
看建设银行怎样创优争佳,2002-04-15,2002-04
四通失误误在哪儿,2002-04-15,2002-04
降低决策风险之管见,2002-04-15,2002-04
多换观念少换人,2002-04-15,2002-04
赤壁  2528项行政收费  中小企业不堪重负,2002-04-15,2002-04
内退期间还要缴养老保险费吗,2002-04-15,2002-04
企业家今年最关注十件事,2002-04-15,2002-04
国航：登机全程引导,2002-04-15,2002-04
康佳超级电视受欢迎,2002-04-15,2002-04
空中金桥连中印,2002-04-15,2002-04
建设新长寿  实现新跨越,2002-04-15,2002-04
话说“长寿”,2002-04-15,2002-04
长寿撤县建区  工业再展宏图,2002-04-15,2002-04
水陆空立体交通快捷方便,2002-04-15,2002-04
投资兴业的热土,2002-04-15,2002-04
江主席与奥巴桑乔总统会谈,2002-04-16,2002-04
江主席和奥夫曼总统互致贺电,2002-04-16,2002-04
江泽民主席朱镕基总理向民航客机罹难者表示哀悼,2002-04-16,2002-04
人大常委会委员长会议举行,2002-04-16,2002-04
李鹏会见阮文安,2002-04-16,2002-04
朱镕基总理抵达安卡拉,2002-04-16,2002-04
马其顿共和国总统将访华,2002-04-16,2002-04
纪念谭震林同志诞辰100周年座谈会举行,2002-04-16,2002-04
国航一客机在韩国坠毁,2002-04-16,2002-04
北京地区天气预报,2002-04-16,2002-04
亚洲议会和平协会第三届年会准备工作就绪,2002-04-16,2002-04
总结经验完善政策  推进农村税费改革,2002-04-16,2002-04
为了和平  为了发展,2002-04-16,2002-04
我载人航天测控系统达国际先进水平,2002-04-16,2002-04
“我自豪，我是劳动者”征文举办,2002-04-16,2002-04
中法合作开发鹅肥肝产业研讨会举行,2002-04-16,2002-04
巴向鲍威尔提出四点要求,2002-04-16,2002-04
钱其琛对尼方悼念我空难者表示感谢,2002-04-16,2002-04
朝隆重纪念金日成90诞辰,2002-04-16,2002-04
金永南会见中国政府文化代表团,2002-04-16,2002-04
维护拉美民主宪制,2002-04-16,2002-04
软件基地  人才摇篮,2002-04-16,2002-04
查韦斯为什么能重新执政,2002-04-16,2002-04
哥总统候选人险遭不测,2002-04-16,2002-04
以色列立即撤军是急务,2002-04-16,2002-04
韩中双方全力处置客机坠毁事件,2002-04-16,2002-04
朱镕基总理抵达安卡拉,2002-04-16,2002-04
李鹏分别会见马来西亚下院议长和基里巴斯众议长,2002-04-16,2002-04
朱镕基和毛里求斯总理互致贺电,2002-04-16,2002-04
在纪念谭震林同志诞辰一百周年座谈会上的讲话,2002-04-16,2002-04
李岚清会见越南国会主席,2002-04-16,2002-04
迟浩田同丹麦国防大臣会谈,2002-04-16,2002-04
新闻摄影比赛,2002-04-16,2002-04
中阿建交10周年招待会举行,2002-04-16,2002-04
中国政府对国航空难事件罹难者表示沉痛哀悼,2002-04-16,2002-04
向国航空难罹难人员表示哀悼,2002-04-16,2002-04
北京保险行业协会抓紧确定失事航班购买航意险旅客名单,2002-04-16,2002-04
第六届“台交会”闭幕,2002-04-16,2002-04
平安保险紧急启动海外急难援助,2002-04-16,2002-04
中国森林风景资源博览会将举行,2002-04-16,2002-04
明天气象预报,2002-04-16,2002-04
李鹏会见阮文安,2002-04-16,2002-04
国航一客机在韩国坠毁,2002-04-16,2002-04
整治集贸市场刻不容缓,2002-04-16,2002-04
长出自己的“脑袋”,2002-04-16,2002-04
一季度金融运行健康平稳,2002-04-16,2002-04
今年国内棉花价格仍将处于较低水平,2002-04-16,2002-04
节能灯产品七成半不合格,2002-04-16,2002-04
西峡建起五百个党群联合体,2002-04-16,2002-04
湟中干部顺应民意认真整改,2002-04-16,2002-04
读薄老党史新著,2002-04-16,2002-04
全军第二个“解放军青年林”工程启动,2002-04-16,2002-04
总参研制开发车辆自动化管理系统,2002-04-16,2002-04
上海5月将迎来排坛大赛,2002-04-16,2002-04
国际空间站施工顺利,2002-04-16,2002-04
美与北约盟国开始新一轮磋商,2002-04-16,2002-04
你追我赶同发展,2002-04-16,2002-04
田允喆出任韩国副总理,2002-04-16,2002-04
驻日美军一战机坠毁,2002-04-16,2002-04
加美研制军用天花疫苗,2002-04-16,2002-04
印敦促旅游业大力反恐,2002-04-16,2002-04
中国足球队集训名单产生,2002-04-16,2002-04
孔杰半目优势击败曹薰铉单骑闯关,2002-04-16,2002-04
全国健康老人登山活动移师五台山,2002-04-16,2002-04
北京奥运会设施方案征集报名结束,2002-04-16,2002-04
北京群众万人保龄球大赛揭幕,2002-04-16,2002-04
中国队力克德国队夺冠,2002-04-16,2002-04
四川队以一环优势夺金,2002-04-16,2002-04
积极应对  趋利避害,2002-04-16,2002-04
首届中国舞蹈节在云南昆明举行,2002-04-16,2002-04
三个代表”要求与人的全面发展,2002-04-16,2002-04
享乐与忧患,2002-04-16,2002-04
抓规划  抓建设  抓经营,2002-04-16,2002-04
当代劳动有哪些新特点,2002-04-16,2002-04
农业产业化经营须有新思路,2002-04-16,2002-04
文化资本何处寻？,2002-04-16,2002-04
丰富孩子的精神食粮,2002-04-16,2002-04
郑和航海新说,2002-04-16,2002-04
山东最后的皮影传人,2002-04-16,2002-04
专家抢救藏学汉文文献,2002-04-16,2002-04
四川立法保护世界遗产,2002-04-16,2002-04
国史编纂工作全面启动,2002-04-16,2002-04
中医药的“清明上河图”,2002-04-16,2002-04
“洛阳牡丹”何以越开越艳,2002-04-16,2002-04
洛阳实施环境“民心工程”,2002-04-16,2002-04
房高不要超过树高,2002-04-16,2002-04
王屋山：关于水的报告,2002-04-16,2002-04
温塘桃花女,2002-04-16,2002-04
雄风颂,2002-04-16,2002-04
远山深处,2002-04-16,2002-04
西部春歌,2002-04-16,2002-04
父亲用过的农具,2002-04-16,2002-04
畲乡笋包,2002-04-16,2002-04
江主席抵突尼斯进行国事访问,2002-04-17,2002-04
江泽民在阿布贾发表重要讲话深入阐述新世纪中非关系,2002-04-17,2002-04
江泽民主席致亚洲议会和平协会第三届年会的贺信,2002-04-17,2002-04
科特迪瓦总统将访华,2002-04-17,2002-04
朱镕基总理与埃杰维特总理会谈,2002-04-17,2002-04
在亚洲议会和平协会第三届年会开幕式上的讲话,2002-04-17,2002-04
亚洲议会和平协会第三届年会在京隆重开幕,2002-04-17,2002-04
北京地区天气预报,2002-04-17,2002-04
在奥巴桑乔总统举行的欢迎宴会上的讲话,2002-04-17,2002-04
李鹏胡锦涛会见各国议会代表团团长,2002-04-17,2002-04
李鹏举行招待会欢迎出席亚洲议会和平协会第三届年会各国来宾,2002-04-17,2002-04
李鹏会见各国议会联盟理事会主席,2002-04-17,2002-04
李鹏会见拉那烈,2002-04-17,2002-04
携手共创灿烂明天,2002-04-17,2002-04
李鹏分别会见泰国和蒙古客人,2002-04-17,2002-04
在亚洲议会和平协会第三届年会开幕式上的讲话,2002-04-17,2002-04
亚洲议会和平协会第三届年会在京隆重开幕,2002-04-17,2002-04
中国和尼日利亚发表联合公报,2002-04-17,2002-04
高度评价江泽民即将访伊,2002-04-17,2002-04
朱镕基会见土耳其代总统、大国民议会议长伊兹吉,2002-04-17,2002-04
新西兰副总理会见吴官正,2002-04-17,2002-04
金大中要求做好中国客机空难善后工作,2002-04-17,2002-04
联合国人权会议强烈谴责以色列,2002-04-17,2002-04
友谊与期盼,2002-04-17,2002-04
江主席抵突尼斯进行国事访问,2002-04-17,2002-04
江泽民在阿布贾发表重要讲话深入阐述新世纪中非关系,2002-04-17,2002-04
朱镕基总理与埃杰维特总理会谈,2002-04-17,2002-04
明天气象预报,2002-04-17,2002-04
对中国公民在耶路撒冷遇难表示慰问,2002-04-17,2002-04
湖南发动各界扶助困难群众,2002-04-17,2002-04
武汉为困难群众办实事,2002-04-17,2002-04
宁夏“千村扶贫开发工程”进展顺利,2002-04-17,2002-04
清除“不良儿歌”,2002-04-17,2002-04
外经贸部有关负责人发表谈话,2002-04-17,2002-04
外交部发言人发表谈话,2002-04-17,2002-04
迟浩田与厄瓜多尔国防部长会谈,2002-04-17,2002-04
温家宝会见日本客人,2002-04-17,2002-04
彭珮云会见日本客人,2002-04-17,2002-04
陈锦华会见柬埔寨客人,2002-04-17,2002-04
全国法院司法警察素质提高,2002-04-17,2002-04
中国西班牙政府合作项目在津奠基,2002-04-17,2002-04
专项审计希望工程捐款收支情况,2002-04-17,2002-04
空军一批自主择业转业干部在深圳民企挂职,2002-04-17,2002-04
本报“华侨华人世纪行”采访启动,2002-04-17,2002-04
国航空难事故处理工作组第二批人员抵达汉城,2002-04-17,2002-04
“4·15”空难目前生还39人,2002-04-17,2002-04
人保对坠毁国航班机快速理赔,2002-04-17,2002-04
一季度财政收支基本正常,2002-04-17,2002-04
工业经济运行开局良好,2002-04-17,2002-04
关闭不具备安全生产基本条件矿山,2002-04-17,2002-04
反倾销工作进展明显,2002-04-17,2002-04
煤炭供应平稳存煤充足,2002-04-17,2002-04
宁波海关公开销毁一批侵权货物,2002-04-17,2002-04
万枚高产奶牛胚胎移植项目正式启动,2002-04-17,2002-04
东方公司向境外汇出首笔回收款,2002-04-17,2002-04
中国棒球联赛将首次亮相,2002-04-17,2002-04
冷门项目的新生,2002-04-17,2002-04
中国队公布汤尤杯阵容,2002-04-17,2002-04
第三届玉珠峰登山大会举办在即,2002-04-17,2002-04
做好今年扩大农村税费改革试点工作,2002-04-17,2002-04
励志创新  崇尚实践,2002-04-17,2002-04
中欧信息社会合作论坛开幕,2002-04-17,2002-04
“电子政务”进课堂,2002-04-17,2002-04
微型小学大作为,2002-04-17,2002-04
国防科研试验部队博士后工作站成立,2002-04-17,2002-04
希望工程助学行动启动,2002-04-17,2002-04
协和医院医生被打案判决,2002-04-17,2002-04
欧佩克油价大幅回落,2002-04-17,2002-04
突尼斯经济持续健康发展,2002-04-17,2002-04
俄部分恢复进口美禽肉,2002-04-17,2002-04
美企业库存持续下降,2002-04-17,2002-04
通用电气再裁七千人,2002-04-17,2002-04
中日研讨新世纪经济合作,2002-04-17,2002-04
澳在华已发九万留学签证,2002-04-17,2002-04
打开糖体生物芯片之门,2002-04-17,2002-04
关内关外沐友谊,2002-04-17,2002-04
城乡联动创建文明城市,2002-04-17,2002-04
夺得千峰翠色来,2002-04-17,2002-04
创新  集聚  规范,2002-04-17,2002-04
乡镇选举：中国农民的民主操练,2002-04-17,2002-04
莫把选代表视同选劳模,2002-04-17,2002-04
乡镇换届选举的十个法定时间,2002-04-17,2002-04
洪祖裕和他的十四张选民证,2002-04-17,2002-04
芷江板山乡人大为农减负严把关,2002-04-17,2002-04
贵阳市人大督办滥伐林木案件,2002-04-17,2002-04
济南商河县制定代表辞职规定,2002-04-17,2002-04
不断增强宪法意识人大意识 陕西检察机关主动接受监督,2002-04-17,2002-04
表演警察技能  展示反恐实力,2002-04-17,2002-04
乔迁：喜事莫成愁,2002-04-17,2002-04
淮北：从优待警解“心结”,2002-04-17,2002-04
黄爱平：深入基层是“法宝”,2002-04-17,2002-04
科技城管向您走来,2002-04-17,2002-04
长乐加强廉政制度建设,2002-04-17,2002-04
“环保巡逻兵”,2002-04-17,2002-04
连云港交巡警优质服务受好评,2002-04-17,2002-04
鄄城地税整顿规范税收秩序,2002-04-17,2002-04
偷渡  一条不归之路,2002-04-17,2002-04
向偷渡宣战,2002-04-17,2002-04
知名商品不容侵权,2002-04-17,2002-04
假冒必然自毁前程,2002-04-17,2002-04
审判：追求法律效果和社会效果的统一,2002-04-17,2002-04
法官评析,2002-04-17,2002-04
喜看执行收费改革,2002-04-17,2002-04
成铁警方端掉一倒卖车票窝点,2002-04-17,2002-04
栾城县检察院大力预防职务犯罪,2002-04-17,2002-04
烟台严厉打击经济犯罪,2002-04-17,2002-04
张老汉的“隐私权”,2002-04-17,2002-04
警方忠告,2002-04-17,2002-04
一次卓有成效的监督,2002-04-17,2002-04
监督·民主·法制,2002-04-17,2002-04
代表视察要“实察”,2002-04-17,2002-04
罗山人大突出重点抓调研,2002-04-17,2002-04
于都人大组织代表向选民述职,2002-04-17,2002-04
易门人大实行干部任前演示制度,2002-04-17,2002-04
从“羞答答”到“我不满意”,2002-04-17,2002-04
如实汇报,2002-04-17,2002-04
别开生面的对话会,2002-04-17,2002-04
再论在解放思想中统一思想,2002-04-18,2002-04
江泽民主席与本·阿里总统会谈,2002-04-18,2002-04
江主席与普京总统通电话,2002-04-18,2002-04
推动中突友好合作关系进一步发展,2002-04-18,2002-04
江泽民祝贺查韦斯重新履行总统职责,2002-04-18,2002-04
金大中致电江泽民朱镕基,2002-04-18,2002-04
亚洲议会和平协会第三届年会举行第一次全会,2002-04-18,2002-04
朱镕基继续在土耳其访问,2002-04-18,2002-04
北京地区天气预报,2002-04-18,2002-04
李鹏会见朝鲜最高人民会议代表团团长金秀学,2002-04-18,2002-04
李鹏会见不丹和密克罗尼西亚客人,2002-04-18,2002-04
两江欢畅迎嘉宾,2002-04-18,2002-04
正确的主题  成功的开端,2002-04-18,2002-04
一季度国民经济发展势头良好,2002-04-18,2002-04
中华人民共和国财政部公告,2002-04-18,2002-04
对中国的统计数据持怀疑态度没有道理,2002-04-18,2002-04
北京大唐发电公司获100亿元授信,2002-04-18,2002-04
六十万名学生将免交义务教育杂费,2002-04-18,2002-04
亚洲议会和平协会第三届年会在重庆继续进行,2002-04-18,2002-04
中国全国人大代表团提出四项主张,2002-04-18,2002-04
亚洲议会和平协会第三届年会举行第一次全会,2002-04-18,2002-04
江主席会见突尼斯议长和总理,2002-04-18,2002-04
鲍威尔与阿拉法特会谈未果,2002-04-18,2002-04
强权政治的造势之论,2002-04-18,2002-04
司马义·艾买提访问奥地利,2002-04-18,2002-04
摩领导人会见我军事代表团,2002-04-18,2002-04
阮科恬会见我佛教代表团,2002-04-18,2002-04
尼首相会见列确,2002-04-18,2002-04
我驻毛使馆庆祝中毛建交30周年,2002-04-18,2002-04
