高处着眼实处着手,2002-04-01,2002-04
青海依托资源优势培育支柱产业,2002-04-01,2002-04
“爱兵政委”的情怀,2002-04-01,2002-04
营造依法治税诚信纳税良好环境,2002-04-01,2002-04
四省市联手控制渤海污染,2002-04-01,2002-04
湖南工业经济效益提高,2002-04-01,2002-04
首家轨道客车公司成立,2002-04-01,2002-04
北京建设首都新博物馆,2002-04-01,2002-04
内蒙古乌海机场开工,2002-04-01,2002-04
北京地区天气预报,2002-04-01,2002-04
难忘唐山魂,2002-04-01,2002-04
北京对症下药治“塞车”,2002-04-01,2002-04
方便与不便,2002-04-01,2002-04
宁夏退耕还林还草工作全面展开,2002-04-01,2002-04
内蒙古治理黑河流域,2002-04-01,2002-04
“三化工程”装扮格尔木,2002-04-01,2002-04
北京奥林匹克公园和五棵松文化体育中心规划设计方案向国内外公开征集,2002-04-01,2002-04
武汉文明扫墓树新风,2002-04-01,2002-04
好个“农业气象预测书”,2002-04-01,2002-04
山东全力抗旱,2002-04-01,2002-04
“天津日报号”首航,2002-04-01,2002-04
参展商良莠不齐博览会亟须严管,2002-04-01,2002-04
写作软件竟畅销作文咋能成“造文”,2002-04-01,2002-04
商家下乡签订单农民进城访商场,2002-04-01,2002-04
“三无”歪风煞风景西湖“不雅”几时休,2002-04-01,2002-04
制止以对巴军事侵犯,2002-04-01,2002-04
布莱尔，该当心了,2002-04-01,2002-04
旅法侨界公祭华工,2002-04-01,2002-04
阿举行阿中建交三十周年报告会,2002-04-01,2002-04
美加强对朝空中侦察和军事训练,2002-04-01,2002-04
尼首都发生大爆炸,2002-04-01,2002-04
明天气象预报,2002-04-01,2002-04
武警部队建立领导干部选拔任用新机制,2002-04-01,2002-04
西安结合实际开展公民道德建设,2002-04-01,2002-04
安徽保卫黄山松,2002-04-01,2002-04
我国大部地区提前迎来夏日高温,2002-04-01,2002-04
有感于某些干部“不会说话”,2002-04-01,2002-04
唐家璇与以外长佩雷斯通电话,2002-04-01,2002-04
佛指舍利在台供奉瞻礼结束返回法门寺,2002-04-01,2002-04
海峡两岸关系协会致函台湾海峡交流基金会,2002-04-01,2002-04
在台北遭遇地震,2002-04-01,2002-04
台湾发生强烈有感地震,2002-04-01,2002-04
“爱兵政委”的情怀,2002-04-01,2002-04
依法治税促进发展,2002-04-01,2002-04
深入贯彻新《税收征管法》,2002-04-01,2002-04
法律和道德的共同要求,2002-04-01,2002-04
正确认识税收功能,2002-04-01,2002-04
充分发挥新征管法的作用,2002-04-01,2002-04
加大对税收征管宣传力度,2002-04-01,2002-04
让征税人用税人各就其位,2002-04-01,2002-04
培育良好的国民纳税意识,2002-04-01,2002-04
制度建设与道德建设应当紧密结合,2002-04-01,2002-04
处理好政策与法律的关系,2002-04-01,2002-04
在创新中贯彻依法治税,2002-04-01,2002-04
倡导诚信纳税的文明风尚,2002-04-01,2002-04
抓好税收服务  促进西部开发,2002-04-01,2002-04
税收调节促进青啤腾飞,2002-04-01,2002-04
营造依法治税诚信纳税良好环境,2002-04-01,2002-04
治沙效果与政绩挂钩,2002-04-01,2002-04
迎接中国音像业的春天,2002-04-01,2002-04
享受数字化生活,2002-04-01,2002-04
人象冲突应予关注,2002-04-01,2002-04
社会力量设立科技奖项达47项,2002-04-01,2002-04
英语免费培训工程将在京实施,2002-04-01,2002-04
北京军医学院科技兴院,2002-04-01,2002-04
天大招收公共管理硕士研究生,2002-04-01,2002-04
首创集团向宏志班捐赠电脑,2002-04-01,2002-04
难忘唐山魂,2002-04-01,2002-04
我援阿物资运抵喀布尔,2002-04-01,2002-04
加强经济和财政管理,2002-04-01,2002-04
纽约国际汽车展开幕,2002-04-01,2002-04
我们是好邻居,2002-04-01,2002-04
印度宗教冲突又起,2002-04-01,2002-04
相互倚重睦邻安邦,2002-04-01,2002-04
新加坡引进人才有高招,2002-04-01,2002-04
英王太后睡眠中辞世,2002-04-01,2002-04
澳旅行社欺诈中国游客,2002-04-01,2002-04
中国文化周在开罗开幕,2002-04-01,2002-04
李奥贝纳屡获业界殊荣,2002-04-01,2002-04
传统医学及中医药会议举行,2002-04-01,2002-04
刚（布）安两国共开海底石油,2002-04-01,2002-04
西班牙火车相撞两人死亡,2002-04-01,2002-04
梅里雪山17勇士纪念馆（网络）开馆,2002-04-01,2002-04
中国队夺得短道速滑世锦赛男团冠军,2002-04-01,2002-04
上海申花队首尝胜果,2002-04-01,2002-04
美国“灯塔”明星联队将来宁夏献技,2002-04-01,2002-04
亚洲大学生足球邀请赛在港结束,2002-04-01,2002-04
韩国羽毛球公开赛中国队获3金,2002-04-01,2002-04
上海八一先下一城,2002-04-01,2002-04
浙江队击败江苏队,2002-04-01,2002-04
宜春市加紧做好农运会各项筹备工作,2002-04-01,2002-04
美方确定阵容,2002-04-01,2002-04
“八仙”找钱各有神招,2002-04-01,2002-04
摘自朱镕基总理九届全国人大五次会议上的政府工作报告,2002-04-01,2002-04
适应加入世贸推进改革发展,2002-04-01,2002-04
盼雨,2002-04-01,2002-04
你是老板还是领导？,2002-04-01,2002-04
煤价该由谁来定,2002-04-01,2002-04
单种苹果吃“苦头”,2002-04-01,2002-04
出口信用保险叫好还得叫座,2002-04-01,2002-04
转变海关职能促进贸易便利,2002-04-01,2002-04
堵截“洋垃圾”,2002-04-01,2002-04
物流：第三利润源,2002-04-01,2002-04
新股配售回来了,2002-04-01,2002-04
摩根斯坦利看好中国经济,2002-04-01,2002-04
《财务总监》中文版出版,2002-04-01,2002-04
卢森堡中行参与银团贷款,2002-04-01,2002-04
阿城财政收入强劲增长,2002-04-01,2002-04
民生银行注重管理人员培训,2002-04-01,2002-04
王沟：先绿起来的地方,2002-04-01,2002-04
让世人看到希望,2002-04-01,2002-04
退耕还林知多少,2002-04-01,2002-04
“村误”也应公开,2002-04-01,2002-04
呼唤电视科教片,2002-04-01,2002-04
瑞金农业信息网作用不凡,2002-04-01,2002-04
镇平玉雕致力产业形象,2002-04-01,2002-04
怀宁涌现五千农民经纪人,2002-04-01,2002-04
滨州农民用上放心电,2002-04-01,2002-04
北小营招商连打环保牌,2002-04-01,2002-04
创名牌建名企出名品,2002-04-01,2002-04
编者按,2002-04-01,2002-04
穷可贷  富可贷  不守信用不能贷,2002-04-01,2002-04
你诚信我支持,2002-04-01,2002-04
你拨通电话我送贷上门,2002-04-01,2002-04
出个好点子  奖台奥拓车,2002-04-01,2002-04
“三不”与“一管”,2002-04-01,2002-04
海尔：设计中心设国外,2002-04-01,2002-04
养老金计算时分“中人”和“新人”吗？,2002-04-01,2002-04
摩托车新一轮合资升温,2002-04-01,2002-04
《经济转轨中的价格机制》一书出版,2002-04-01,2002-04
方正科技推出高像素数码相机,2002-04-01,2002-04
联想一步登顶,2002-04-01,2002-04
江泽民祝贺“神舟”三号飞船圆满返回,2002-04-02,2002-04
“神舟”三号飞船准确返回地面,2002-04-02,2002-04
文明新境界,2002-04-02,2002-04
广东助弱扶贫制度化,2002-04-02,2002-04
小城镇与大视野,2002-04-02,2002-04
昆明提高城镇居民“低保”标准,2002-04-02,2002-04
兰新铁路西段进行扩能改造,2002-04-02,2002-04
大型高档越野车生产线投产,2002-04-02,2002-04
青海斥资50亿打造交通网络,2002-04-02,2002-04
汕头社会信用信息网启动,2002-04-02,2002-04
北京地区天气预报,2002-04-02,2002-04
抓住机遇坚定信心打好基础提高水平 进一步开创西部大开发工作的新局面,2002-04-02,2002-04
思想政治工作要长期坚持和发扬,2002-04-02,2002-04
旱区群众全力投入春耕抗旱,2002-04-02,2002-04
有关考点考试结果无效  相关人员受到严肃处理,2002-04-02,2002-04
华北东北西北地区旱情依然严峻,2002-04-02,2002-04
中央管理的国有骨干企业总会计师首期培训班开学,2002-04-02,2002-04
黑龙江打造“旅游牌”,2002-04-02,2002-04
今年为市民办好10件实事,2002-04-02,2002-04
中国宏观经济研讨会在京召开,2002-04-02,2002-04
长江流域昨起全面春季禁渔,2002-04-02,2002-04
上海实施市容环卫管理条例,2002-04-02,2002-04
桂林市容市貌大为改观,2002-04-02,2002-04
音乐界研讨中国电子音乐发展,2002-04-02,2002-04
危房五年无人管  学生上课打游击,2002-04-02,2002-04
大学生成绩下降老教授忧心如焚,2002-04-02,2002-04
新伎俩躲避监督“化工厂”藏身水上,2002-04-02,2002-04
论国际局势的几个特点,2002-04-02,2002-04
要求以军从巴撤出  确保阿拉法特安全,2002-04-02,2002-04
以暴易暴无赢家,2002-04-02,2002-04
沙特国王会见吴仪,2002-04-02,2002-04
韩总统会见我文化部长,2002-04-02,2002-04
中南美洲中国和平统一促进会工作会议闭幕,2002-04-02,2002-04
高度评价阿中关系,2002-04-02,2002-04
安政府军和安盟签订执行和约备忘录,2002-04-02,2002-04
结束内战方可治本(连载),2002-04-02,2002-04
明天气象预报,2002-04-02,2002-04
“神舟”返神州,2002-04-02,2002-04
薄一波同志著《领袖元帅与战友》出版,2002-04-02,2002-04
解放军四总部表彰一批运输单位和个人,2002-04-02,2002-04
深情的回忆与怀念,2002-04-02,2002-04
云南重点扶持4000个贫困村 甘肃年内解决40万人口温饱,2002-04-02,2002-04
彭珮云会见港澳红十字会负责人,2002-04-02,2002-04
唐家璇与保加利亚外长举行会谈,2002-04-02,2002-04
广西罢免莫军的全国人大代表职务,2002-04-02,2002-04
抓住机遇坚定信心打好基础提高水平 进一步开创西部大开发工作的新局面,2002-04-02,2002-04
无纸通关：助企业快跑,2002-04-02,2002-04
全国水资源综合规划着手编制,2002-04-02,2002-04
海关4年监管货物23亿吨,2002-04-02,2002-04
药品和医疗服务广告问题多,2002-04-02,2002-04
国家“十五”重点项目芳纶Ⅱ开工,2002-04-02,2002-04
互联网行业签署自律公约,2002-04-02,2002-04
东风悦达起亚签署重组协议,2002-04-02,2002-04
缴税送你小车筐,2002-04-02,2002-04
保护奥运标志  严打侵权行为,2002-04-02,2002-04
居民因私购汇有新渠道,2002-04-02,2002-04
申请人24小时内可获赴德签证,2002-04-02,2002-04
新版导游证开始试行,2002-04-02,2002-04
北京将办中小企业服务日,2002-04-02,2002-04
国际玻璃工业技术展将在京举行,2002-04-02,2002-04
秦沈客运专线铺架已达葫芦岛北站,2002-04-02,2002-04
平原县实施“彩虹工程”成效显著,2002-04-02,2002-04
长治城区大力发展民营经济,2002-04-02,2002-04
深圳出租车将全面上档次,2002-04-02,2002-04
森达皮鞋销量再度夺冠,2002-04-02,2002-04
东岳国税局个体私营税收大增,2002-04-02,2002-04
我国将建立公共就业服务制度,2002-04-02,2002-04
安陆群众帮村干部整改,2002-04-02,2002-04
南漳“说事”制度说拢人心,2002-04-02,2002-04
人才战略当与时俱进,2002-04-02,2002-04
也要反对小“官”的官僚主义,2002-04-02,2002-04
《伟大的理论创新》出版座谈会在京召开,2002-04-02,2002-04
公道正派的公证人,2002-04-02,2002-04
全国青少年防沙治沙活动启动,2002-04-02,2002-04
长治市国税局推行“一线工作法”,2002-04-02,2002-04
文明新境界,2002-04-02,2002-04
永远的纪念,2002-04-02,2002-04
《财富》评出美国企业500强,2002-04-02,2002-04
沃尔玛独占鳌头,2002-04-02,2002-04
我驻越使馆祭扫中国烈士墓,2002-04-02,2002-04
我向罗马尼亚提供物资援助,2002-04-02,2002-04
中国与湄公河委员会签订合作协议,2002-04-02,2002-04
风雨戍边人,2002-04-02,2002-04
印取消所有出口限额,2002-04-02,2002-04
俄解除进口美鸡肉禁令,2002-04-02,2002-04
西班牙暴雨五人死亡,2002-04-02,2002-04
科对烟草征收百分之百关税,2002-04-02,2002-04
“安乐死”在荷兰开始合法,2002-04-02,2002-04
美研制出新型X射线显微镜,2002-04-02,2002-04
爱沙尼亚  春天来得早  候鸟提前到,2002-04-02,2002-04
大舒马赫获F—1巴西大奖赛冠军,2002-04-02,2002-04
第二届全国体育大会将在绵阳举行,2002-04-02,2002-04
刘昌赫夺得冠军,2002-04-02,2002-04
矢志不移  全心投入,2002-04-02,2002-04
全国场地自行车冠军赛在京开赛,2002-04-02,2002-04
孙继海进入英超几成定局,2002-04-02,2002-04
世界（I组）冰球锦标赛中国队力争保组,2002-04-02,2002-04
阿加西夺得迈阿密网球大师赛冠军,2002-04-02,2002-04
围绕扩大内需  改善宏观调控,2002-04-02,2002-04
认清权力性质  恪尽公仆责任,2002-04-02,2002-04
世界眼光与党的思想理论建设,2002-04-02,2002-04
抓住重点推进思想作风建设,2002-04-02,2002-04
从根本上克服形式主义,2002-04-02,2002-04
一流大学闲想,2002-04-02,2002-04
教育主权与学生德育,2002-04-02,2002-04
创造  创新  创业,2002-04-02,2002-04
构建机制  营造氛围  提供保障,2002-04-02,2002-04
加快普及小学外语教学进程,2002-04-02,2002-04
高校教改怎样应对挑战,2002-04-02,2002-04
乡村女教师——王宝杰,2002-04-02,2002-04
情深意重  割舍不断,2002-04-02,2002-04
东北抗日战争中的周保中,2002-04-02,2002-04
团结各族干部  维护边疆稳定,2002-04-02,2002-04
宁都起义精神长存,2002-04-02,2002-04
保护城市文脉,2002-04-02,2002-04
留恋老北京,2002-04-02,2002-04
丹顶鹤——祥瑞天使,2002-04-02,2002-04
理性的“门槛”,2002-04-02,2002-04
中国文联召开七届二次全委会,2002-04-02,2002-04
王健寻找新境界,2002-04-02,2002-04
风景区里有四多,2002-04-02,2002-04
中国广播民族乐团在德国演奏,2002-04-02,2002-04
《怎样写文章》再版,2002-04-02,2002-04
粤剧交响令观众赞不绝口,2002-04-02,2002-04
首都春季好戏连台,2002-04-02,2002-04
布鲁斯南来华做形象广告,2002-04-02,2002-04
电视舞蹈作品将展播,2002-04-02,2002-04
江主席和阿利耶夫总统互致贺电,2002-04-03,2002-04
李鹏对日本进行正式友好访问,2002-04-03,2002-04
朱镕基将出访三国,2002-04-03,2002-04
“人”写天地间,2002-04-03,2002-04
青海科技攻关项目招标,2002-04-03,2002-04
河北长城旅游公路开工,2002-04-03,2002-04
云南加大水利工程投入,2002-04-03,2002-04
治治“口袋书”,2002-04-03,2002-04
北京地区天气预报,2002-04-03,2002-04
结合新实际大力弘扬延安精神 开创新世纪改革发展生动局面,2002-04-03,2002-04
河北省卫生行业作出七项承诺,2002-04-03,2002-04
福建电力公司公开十项服务承诺,2002-04-03,2002-04
健全和规范有形建筑市场,2002-04-03,2002-04
“网点行动”取得重大战果,2002-04-03,2002-04
财政部要求加强收费基金管理,2002-04-03,2002-04
俄罗斯解除自我国进口肉类产品禁令,2002-04-03,2002-04
农技干部当“顾问”,2002-04-03,2002-04
兰州将投入65亿元调整工业结构,2002-04-03,2002-04
安徽大力发展无公害农产品,2002-04-03,2002-04
不让乱“花”迷人眼 试用药剂抑飞絮,2002-04-03,2002-04
李鹏出席中日两国文化年开幕招待会,2002-04-03,2002-04
巴要求召开阿盟外长紧急会议,2002-04-03,2002-04
让中日友好世代相传,2002-04-03,2002-04
不智之举,2002-04-03,2002-04
菲总统会见宋健,2002-04-03,2002-04
我呼吁促进人权事业健康发展,2002-04-03,2002-04
穆沙拉夫访问阿富汗,2002-04-03,2002-04
巴向美移交“基地”组织要员,2002-04-03,2002-04
俄前总理在京演讲,2002-04-03,2002-04
俄蒙关系全面加强,2002-04-03,2002-04
明天气象预报,2002-04-03,2002-04
博鳌亚洲论坛首届年会十二日开幕,2002-04-03,2002-04
农民心里乐开花,2002-04-03,2002-04
管在“理”上,2002-04-03,2002-04
烟台选拔干部与引进人才结合,2002-04-03,2002-04
钱其琛会见保加利亚外长,2002-04-03,2002-04
唐家璇与彭定康会谈,2002-04-03,2002-04
国际裁军研讨会在北京举行,2002-04-03,2002-04
张万年会见俄前总理,2002-04-03,2002-04
王忠禹会见日本客人,2002-04-03,2002-04
李贵鲜会见吉布提客人,2002-04-03,2002-04
外交部发言人发表谈话,2002-04-03,2002-04
结合新实际大力弘扬延安精神 开创新世纪改革发展生动局面,2002-04-03,2002-04
你不脱贫我不走,2002-04-03,2002-04
蒋冬英：博大母爱呵女成才,2002-04-03,2002-04
夏邑县采取措施制止污染,2002-04-03,2002-04
“得罪人”的效益,2002-04-03,2002-04
西宁：公共设施屡遭盗毁,2002-04-03,2002-04
“大地画派”六画家赴甘孜阿坝采风,2002-04-03,2002-04
昆明大幅上调自来水价格,2002-04-03,2002-04
东南大学5博士生受聘宿迁县（区）长,2002-04-03,2002-04
淮北矿业安全生产创新纪录,2002-04-03,2002-04
掀起你的盖头来,2002-04-03,2002-04
武汉：长江一桥减负之后,2002-04-03,2002-04
淮河、太湖流域重点断面水质自动监测周报,2002-04-03,2002-04
过半数孩子对父母提出异议,2002-04-03,2002-04
“长征二号F”火箭试验队返京,2002-04-03,2002-04
宋庆龄基金会组织两国青少年交流,2002-04-03,2002-04
“大学生素质拓展计划”启动,2002-04-03,2002-04
平谷农民种桃有了标准,2002-04-03,2002-04
加入世贸组织法律文件出版,2002-04-03,2002-04
驻京部队和武警药品集中招标,2002-04-03,2002-04
荷兰华侨捐助石家庄再障医院,2002-04-03,2002-04
首都书画家参加“绿色保护林”活动,2002-04-03,2002-04
中国青少年网络协会获捐赠,2002-04-03,2002-04
中国中医研究院成立抗肿瘤中心,2002-04-03,2002-04
中国长江三峡知识竞赛结束,2002-04-03,2002-04
我国信息技术市场研究报告发布,2002-04-03,2002-04
别让农家肥成了污染源,2002-04-03,2002-04
“人”写天地间,2002-04-03,2002-04
于根伟不会放弃世界杯,2002-04-03,2002-04
多元一体合而不同,2002-04-03,2002-04
纽约市场油价继续上涨,2002-04-03,2002-04
日经济出现停止下滑迹象,2002-04-03,2002-04
美客机紧急迫降12人受伤,2002-04-03,2002-04
上海广东分列两个赛区榜首,2002-04-03,2002-04
全国体育大会今后每四年举办一届,2002-04-03,2002-04
侵权使用奥林匹克标志的六类表现,2002-04-03,2002-04
安徽率先推出运动队职业道德规范,2002-04-03,2002-04
波波夫积极备战世界短池游泳锦标赛,2002-04-03,2002-04
散打王争霸赛再战一轮,2002-04-03,2002-04
阿根廷  经济尚未走出险境,2002-04-03,2002-04
携手展鸿图  共建新南阳,2002-04-03,2002-04
张仲景医药创新工程推介暨 经贸洽谈会即将在医圣故里南阳举行,2002-04-03,2002-04
密切联系群众  依法履行职责,2002-04-03,2002-04
徽县“人大宣传月”十年坚持不懈,2002-04-03,2002-04
台州实施代表职务津贴制,2002-04-03,2002-04
平顶山打破代表“终届制”,2002-04-03,2002-04
精彩回放,2002-04-03,2002-04
责任与使命,2002-04-03,2002-04
我与代表法,2002-04-03,2002-04
编者按,2002-04-03,2002-04
十年来代表仪案提交情况,2002-04-03,2002-04
民主的选举  民意的体现,2002-04-03,2002-04
人民选我当代表,2002-04-03,2002-04
素质乃履行职责之本,2002-04-03,2002-04
筑牢民主政治的根基,2002-04-03,2002-04
人大代表如何产生,2002-04-03,2002-04
不辜负人民重托,2002-04-03,2002-04
权益绝不容侵犯,2002-04-03,2002-04
创造良好的履职环境,2002-04-03,2002-04
代表执行职务的保障,2002-04-03,2002-04
闭会期间代表的主要活动有哪些,2002-04-03,2002-04
贵阳市人大代表履行职责忙,2002-04-03,2002-04
代表如何处理群众委托的信件？,2002-04-03,2002-04
走进人大代表,2002-04-03,2002-04
维护人民当家做主的权利,2002-04-03,2002-04
既到位  又创新,2002-04-03,2002-04
察民情  听民声  解民难,2002-04-03,2002-04
抓好代表工作五个环节,2002-04-03,2002-04
诗词里的代表情愫,2002-04-03,2002-04
脉搏，与群众一起跳动,2002-04-03,2002-04
“接待日”温暖百姓心,2002-04-03,2002-04
法律和道义的授权,2002-04-03,2002-04
江泽民会见普里马科夫,2002-04-04,2002-04
江泽民会见美国客人,2002-04-04,2002-04
江泽民会见彭定康,2002-04-04,2002-04
李鹏委员长与日本众参两院议长会谈,2002-04-04,2002-04
加快退耕还林步伐  加大结构调整力度 努力增加农民收入  切实减轻农民负担,2002-04-04,2002-04
李瑞环会见保加利亚外长,2002-04-04,2002-04
解放思想开拓创新 抓住机遇加快发展,2002-04-04,2002-04
抓住西部大开发的历史机遇 实现经济和科技教育跨越式发展,2002-04-04,2002-04
天津：加快中小学布局调整,2002-04-04,2002-04
神舟”三号飞船科学实验取得重要成果,2002-04-04,2002-04
陕西国有土地使用权出让全部实行有偿,2002-04-04,2002-04
重庆今年着重抓十件大事,2002-04-04,2002-04
燕山石化乙烯改造工程通过验收,2002-04-04,2002-04
“神舟”三号飞船返回舱运抵北京,2002-04-04,2002-04
“神舟”三号飞船拟人载荷试验效果良好,2002-04-04,2002-04
成品油价格今起适当提高,2002-04-04,2002-04
宁国效益农业促增收,2002-04-04,2002-04
感受“新天堂”,2002-04-04,2002-04
北京城市快速轨道工程  东直门地下折返线贯通,2002-04-04,2002-04
殡葬消费问题多  倡导文明须“用功”,2002-04-04,2002-04
人才市场“虚火”盛  招聘求职成功少,2002-04-04,2002-04
服务先行笋市旺  农民自愿入市场,2002-04-04,2002-04
雇车进城上网吧  农民网上忙“备耕”,2002-04-04,2002-04
解放思想开拓创新 抓住机遇加快发展,2002-04-04,2002-04
李鹏会见川口顺子外相,2002-04-04,2002-04
李鹏出席日众参两院议长欢迎招待会,2002-04-04,2002-04
李鹏会见日自民党干事长,2002-04-04,2002-04
李鹏出席日经济团体联合举行的午餐会,2002-04-04,2002-04
老电力工作者的情怀,2002-04-04,2002-04
委领导人会见田纪云,2002-04-04,2002-04
克罗地亚总统会见迟浩田,2002-04-04,2002-04
黎红英会见曹庆泽,2002-04-04,2002-04
国际社会继续对中东局势恶化表示忧虑,2002-04-04,2002-04
李鹏委员长与日本众参两院议长会谈,2002-04-04,2002-04
明天气象预报,2002-04-04,2002-04
江泽民会见德国客人,2002-04-04,2002-04
朱镕基会见美国客人,2002-04-04,2002-04
李瑞环会见菲律宾中国和平统一促进会访问团,2002-04-04,2002-04
李瑞环会见香港青少年中华历史文化教育交流团,2002-04-04,2002-04
架在心上的桥,2002-04-04,2002-04
是打假还是护假？,2002-04-04,2002-04
内蒙古草原生态恢复加快,2002-04-04,2002-04
中欧签署合作项目协议,2002-04-04,2002-04
中国正通过各种渠道敦促以色列尽快撤军,2002-04-04,2002-04
吴官正出访澳大利亚新西兰,2002-04-04,2002-04
贾庆林会见越南客人,2002-04-04,2002-04
贾庆林会见乌干达客人,2002-04-04,2002-04
钱其琛会见彭定康,2002-04-04,2002-04
布赫会见爱沙尼亚客人,2002-04-04,2002-04
司马义·艾买提会见土耳其客人,2002-04-04,2002-04
赵南起会见韩国客人,2002-04-04,2002-04
唐家璇会见乌干达客人,2002-04-04,2002-04
加快退耕还林步伐  加大结构调整力度 努力增加农民收入  切实减轻农民负担,2002-04-04,2002-04
时尚在春天打造,2002-04-04,2002-04
今年继续实施数字电视研发专项,2002-04-04,2002-04
《国际海运条例》实施进入实质阶段,2002-04-04,2002-04
欧盟的决定不科学不公正,2002-04-04,2002-04
长城公司成功拍卖债权,2002-04-04,2002-04
东北亚经济论坛5月举行,2002-04-04,2002-04
山东推出“五一”旅游大餐,2002-04-04,2002-04
进出口行发行80亿元金融债券,2002-04-04,2002-04
北仑海关退运一批“洋垃圾”,2002-04-04,2002-04
中欧应多领域加强经贸合作,2002-04-04,2002-04
项目管理要向专业化发展,2002-04-04,2002-04
中国企业高峰会将在北京举行,2002-04-04,2002-04
潮州市诚信为本创名牌,2002-04-04,2002-04
“六六顺”皮鞋获免检,2002-04-04,2002-04
华为以太网交换机巡展启动,2002-04-04,2002-04
虹桥机场集中监管仓储区正式运行,2002-04-04,2002-04
广东口岸肥料进口大幅增长,2002-04-04,2002-04
湖北旅游发展总体规划通过评审,2002-04-04,2002-04
江西针棉开发集装箱优化管理系统,2002-04-04,2002-04
服务农民  富裕农民,2002-04-04,2002-04
宝安区以学教促党建,2002-04-04,2002-04
保定开展“七进村七入户”活动,2002-04-04,2002-04
以“三个代表”指导人大代表工作,2002-04-04,2002-04
辽宁将为全省公安民警上人身保险,2002-04-04,2002-04
全国检察机关控告申诉工作取得明显成效,2002-04-04,2002-04
北京破获特大伪造贩卖国家公文印章案,2002-04-04,2002-04
“老鼠”“老虎”都要打,2002-04-04,2002-04
清明网上献花  共祭民族英烈,2002-04-04,2002-04
崇文区加大危旧房改造监察力度,2002-04-04,2002-04
绍兴健全党的宣传员网络,2002-04-04,2002-04
邹城城区国税分局力行“三个代表”,2002-04-04,2002-04
《公民行为：十万个怎么办》出版,2002-04-04,2002-04
《“三个代表”重要思想概论》出版,2002-04-04,2002-04
安全行车与事故处理知识读本出版,2002-04-04,2002-04
首都法律界研讨伤熊案教训,2002-04-04,2002-04
T491/492次列车积极转变服务理念,2002-04-04,2002-04
汉川人武部党委扶贫帮困,2002-04-04,2002-04
纽约市场金价上扬,2002-04-04,2002-04
美国2月份工厂订货下降,2002-04-04,2002-04
我教育部向澳国立大学捐书,2002-04-04,2002-04
国际油价再创新高,2002-04-04,2002-04
美欧股市普遍下跌,2002-04-04,2002-04
美优秀华裔青年代表团将访华,2002-04-04,2002-04
斯里兰卡和平进程迈新步,2002-04-04,2002-04
创新·质量·服务,2002-04-04,2002-04
减肥要治心  用脑勿用胃,2002-04-04,2002-04
克隆兔落地法国,2002-04-04,2002-04
同饮一江水  共荣一条街,2002-04-04,2002-04
