取缔“法轮功”就是维护人权,2002-04-18,2002-04
我驻韩大使同韩方交换意见,2002-04-18,2002-04
荷兰内阁宣布集体辞职,2002-04-18,2002-04
日本“有事法制”意欲何为,2002-04-18,2002-04
在万国宫沉痛控诉,2002-04-18,2002-04
推动中突友好合作关系进一步发展,2002-04-18,2002-04
再论在解放思想中统一思想,2002-04-18,2002-04
大力加强精神文明建设  积极开展综合治理工作,2002-04-18,2002-04
《永乐大典》编纂六百周年国际研讨会举行,2002-04-18,2002-04
迟浩田与菲律宾国防部长会谈,2002-04-18,2002-04
温家宝会见丹麦国防大臣,2002-04-18,2002-04
温家宝会见厄瓜多尔客人,2002-04-18,2002-04
成思危会见肯尼亚客人,2002-04-18,2002-04
国库棉花岂能擅自削价出售,2002-04-18,2002-04
空军某部整体作战能力显著提高,2002-04-18,2002-04
《东方文化集成》首批成果引人关注,2002-04-18,2002-04
董建华介绍香港特区政府主要官员问责制,2002-04-18,2002-04
热烈祝贺北京平谷撤县设区,2002-04-18,2002-04
塑造强者,2002-04-18,2002-04
博鳌有个边防所,2002-04-18,2002-04
工会法知识竞赛揭晓,2002-04-18,2002-04
昆明铁路公安注重以案普法,2002-04-18,2002-04
涪陵国税局廉政教育经常化,2002-04-18,2002-04
洪湖科局干部竞争上岗,2002-04-18,2002-04
东昌府交警开展交通专项整治,2002-04-18,2002-04
盖州交通局着力加强制度建设,2002-04-18,2002-04
无为加强专武干部队伍建设,2002-04-18,2002-04
全国民办老人院院长论坛在京举行,2002-04-18,2002-04
中国体育摄影学会成立新一届理事会,2002-04-18,2002-04
南部非洲严重缺粮,2002-04-18,2002-04
东帝汶选出首任总统,2002-04-18,2002-04
韩国景气回升防过热,2002-04-18,2002-04
边界最后裁决  埃厄和睦有期,2002-04-18,2002-04
阿根廷与IMF分歧依旧,2002-04-18,2002-04
CBA总决赛上海队逼近冠军宝座,2002-04-18,2002-04
八一求变  上海求稳,2002-04-18,2002-04
国际足联最新排名中国队上升三位,2002-04-18,2002-04
日本队战平哥斯达黎加队,2002-04-18,2002-04
英格兰足总为世界杯赛开出巨额奖金,2002-04-18,2002-04
贝肯鲍尔称德国队能闯入世界杯八强,2002-04-18,2002-04
巴西奥委会主席看好中国足球队,2002-04-18,2002-04
环青海湖国际公路自行车赛7月举办,2002-04-18,2002-04
国际山地极限运动赛揭幕安吉,2002-04-18,2002-04
北京科技大学辉煌五十年,2002-04-18,2002-04
就业形势与对策,2002-04-18,2002-04
创造更多的就业岗位是当务之急,2002-04-18,2002-04
关注就业岗位的国际化竞争,2002-04-18,2002-04
修身与立身,2002-04-18,2002-04
为什么劳动要转化为价值,2002-04-18,2002-04
理论创新：回答时代提出的课题,2002-04-18,2002-04
攻坚之战,2002-04-18,2002-04
开创党建新格局,2002-04-18,2002-04
想进步，多种“数”；出效果，迈大步。,2002-04-18,2002-04
苏区干部的“三宝”,2002-04-18,2002-04
珍惜前程  珍惜家庭,2002-04-18,2002-04
为农民“点”干部叫好,2002-04-18,2002-04
下访岂能成“约访”,2002-04-18,2002-04
领导一票顶几票？,2002-04-18,2002-04
纪律处分怎能“打白条”,2002-04-18,2002-04
刹住公务接待中的铺张浪费之风,2002-04-18,2002-04
“官员文凭腐败”必须遏制,2002-04-18,2002-04
谁之过？,2002-04-18,2002-04
加大国债下乡销售力度,2002-04-18,2002-04
国债岂能只在内部销售,2002-04-18,2002-04
销售国债莫搞暗箱操作,2002-04-18,2002-04
《一次不寻常的就医经历》有回音,2002-04-18,2002-04
作废凭证充发票  洗车场主偷逃税,2002-04-18,2002-04
建校款被乡截留  新校舍竣工无期,2002-04-18,2002-04
强行摊派集资款  苦煞七千教职工,2002-04-18,2002-04
倾真情济民困,2002-04-18,2002-04
“相约北京”向我们走来,2002-04-18,2002-04
文化互动  精神相通,2002-04-18,2002-04
中直院团整体出击,2002-04-18,2002-04
走，我们去看展览,2002-04-18,2002-04
广场艺术  播撒芬芳,2002-04-18,2002-04
凌空生辉,2002-04-18,2002-04
《蝴蝶夫人》保利亮相,2002-04-18,2002-04
《兵圣孙武》长安出场,2002-04-18,2002-04
中外名角北京打擂,2002-04-18,2002-04
江泽民主席开始对伊朗进行国事访问,2002-04-19,2002-04
江主席与本·阿里总统亲切话别,2002-04-19,2002-04
李鹏与亚洲议会和平协会年会各国代表一起观看文艺晚会,2002-04-19,2002-04
适应改革发展新形势需要 进一步发挥行政监察职能,2002-04-19,2002-04
亚洲议会和平协会第三届年会举行第二次全会,2002-04-19,2002-04
全总将表彰先进个人和先进集体,2002-04-19,2002-04
秦山二期工程一号机组商业运行,2002-04-19,2002-04
政法机关深入开展严打整治斗争,2002-04-19,2002-04
引导而不要包办,2002-04-19,2002-04
甘肃实现乡乡通电,2002-04-19,2002-04
北京地区天气预报,2002-04-19,2002-04
李鹏会见老挝国会主席维雅吉,2002-04-19,2002-04
李鹏会见塔吉克斯坦和斯里兰卡客人,2002-04-19,2002-04
李鹏会见俄罗斯杜马副主席齐林加罗夫,2002-04-19,2002-04
李鹏会见斐济和萨摩亚客人,2002-04-19,2002-04
李鹏分别会见伊拉克沙特科威特伊朗议会领导人,2002-04-19,2002-04
亚洲议会和平协会第三届年会举行分组讨论,2002-04-19,2002-04
“亚洲的热血已经沸腾”,2002-04-19,2002-04
李鹏会见韩国议长李万燮,2002-04-19,2002-04
适应改革发展新形势需要 进一步发挥行政监察职能,2002-04-19,2002-04
亚洲议会和平协会第三届年会举行第二次全会,2002-04-19,2002-04
新加坡领导人会见吴官正,2002-04-19,2002-04
钱其琛会见突尼斯外长,2002-04-19,2002-04
巴西众议长会见李贵鲜,2002-04-19,2002-04
唐家璇会见土耳其外长,2002-04-19,2002-04
普京发表国情咨文,2002-04-19,2002-04
美改革军事指挥结构,2002-04-19,2002-04
中韩展开旅游促销交流活动,2002-04-19,2002-04
合作与交流,2002-04-19,2002-04
阿富汗老国王归来,2002-04-19,2002-04
鲍威尔自称中东之行取得成功,2002-04-19,2002-04
空手而归还是有所斩获,2002-04-19,2002-04
格林斯潘说美经济形势继续好转,2002-04-19,2002-04
一小型飞机撞入米兰高层建筑,2002-04-19,2002-04
杜绝假新闻,2002-04-19,2002-04
“龙须沟”人喜回迁,2002-04-19,2002-04
全国人大外委会负责人发表谈话,2002-04-19,2002-04
外交部发言人发表谈话,2002-04-19,2002-04
许嘉璐会见俄罗斯客人,2002-04-19,2002-04
中共友好代表团出访老挝柬埔寨,2002-04-19,2002-04
“4·15”空难工作组在韩全面展开工作,2002-04-19,2002-04
鬼话与祸心,2002-04-19,2002-04
做好企业减员和破产企业职工安置工作,2002-04-19,2002-04
怎样看待市场销售增幅回落,2002-04-19,2002-04
反倾销反补贴保障措施工作体系初步建立,2002-04-19,2002-04
地质调查领域将重新调整战略框架,2002-04-19,2002-04
加强法规建设推进资源节约综合利用,2002-04-19,2002-04
电子行业龙头企业实力继续提升,2002-04-19,2002-04
中国国际运输与物流博览会将举办,2002-04-19,2002-04
中国企业高峰会开幕,2002-04-19,2002-04
一季度进口钢材增长快,2002-04-19,2002-04
郑州市整治加油站 开展纳税专项检查,2002-04-19,2002-04
一季度药品不合格率6.7％,2002-04-19,2002-04
信达启动30亿元资产春季拍卖活动,2002-04-19,2002-04
第四届国家级教学成果奖评出,2002-04-19,2002-04
北京工大开展诚信与责任主题教育,2002-04-19,2002-04
《当代中国监狱纪实》丛书问世,2002-04-19,2002-04
莫让CBA成为无本之木,2002-04-19,2002-04
中国逻辑与语言函大20年育人50万,2002-04-19,2002-04
“欧元之父”到外经贸大讲学,2002-04-19,2002-04
国际动画教育研讨会召开,2002-04-19,2002-04
蓝帆科技推出全新发展战略,2002-04-19,2002-04
新型纳米服装研制成功,2002-04-19,2002-04
北京港莱进军环保产业,2002-04-19,2002-04
无锡将举行中国合唱节,2002-04-19,2002-04
淮河、太湖流域重点断面水质自动监测周报,2002-04-19,2002-04
开篇的话,2002-04-19,2002-04
中日友好源泉在民间,2002-04-19,2002-04
播撒生命的绿色,2002-04-19,2002-04
莫道夕阳红来迟,2002-04-19,2002-04
富士山麓家族情,2002-04-19,2002-04
潮涌三江古城新,2002-04-19,2002-04
天鹅起舞,2002-04-19,2002-04
分时度假  咱能享受吗,2002-04-19,2002-04
永久有多久,2002-04-19,2002-04
欢乐谷给您更多欢乐,2002-04-19,2002-04
小卖店为啥成了“小赊店”,2002-04-19,2002-04
泰康：一张保单保全家,2002-04-19,2002-04
药品说明应说明白,2002-04-19,2002-04
读《三国》悟医患关系,2002-04-19,2002-04
药品广告不能打“擦边球”,2002-04-19,2002-04
为什么看病要托人,2002-04-19,2002-04
每天30分钟：预防疾病的最小运动量,2002-04-19,2002-04
别让“职业病”损害健康,2002-04-19,2002-04
回归“夜生理”状态,2002-04-19,2002-04
提防“药托儿”,2002-04-19,2002-04
介入手术成功治疗10万心脏病患者,2002-04-19,2002-04
西门子医疗集团战略重心转向中国,2002-04-19,2002-04
春燥防上火,2002-04-19,2002-04
科学使用安眠药,2002-04-19,2002-04
漫画,2002-04-19,2002-04
珍贵的记忆,2002-04-19,2002-04
美国西部开发交响曲,2002-04-19,2002-04
走近名著,2002-04-19,2002-04
开愚人玩笑莫过火,2002-04-19,2002-04
人类心脏移植手术的先驱（连载）,2002-04-19,2002-04
节日与节日文化,2002-04-19,2002-04
梅登：传播中国文化的智者,2002-04-19,2002-04
多演演我们工人,2002-04-19,2002-04
变味的“挑战主持人”,2002-04-19,2002-04
“盖世太保”有些假,2002-04-19,2002-04
荧屏也该戒烟了,2002-04-19,2002-04
为“主流声音”叫好,2002-04-19,2002-04
“青春偶像剧”该降温了,2002-04-19,2002-04
观众给电视剧演员亮分,2002-04-19,2002-04
《荔枝红了》讴歌农村新形象,2002-04-19,2002-04
中国版《葛蓓莉娅》业已成型,2002-04-19,2002-04
咂摸生活的滋味,2002-04-19,2002-04
首届中国舞蹈节将在昆明举行,2002-04-19,2002-04
朱晖将来京献艺,2002-04-19,2002-04
“风雅之爱”与卡丹情怀,2002-04-19,2002-04
来自大山深处的警察,2002-04-19,2002-04
和平发展的宣言友谊合作的盛会,2002-04-20,2002-04
江泽民主席抵达德黑兰,2002-04-20,2002-04
朱镕基总理发表讲话,2002-04-20,2002-04
朱镕基总理抵达开罗,2002-04-20,2002-04
黎巴嫩总理将访华,2002-04-20,2002-04
创建法制诚信公平经济环境 完善社会主义市场经济体制,2002-04-20,2002-04
北京地区天气预报,2002-04-20,2002-04
亚洲议会和平协会第三届年会隆重闭幕,2002-04-20,2002-04
亚洲议会和平协会执行理事会举行二次会议,2002-04-20,2002-04
李鹏举行招待会,2002-04-20,2002-04
李鹏分别会见尼泊尔和土库曼斯坦客人,2002-04-20,2002-04
AAPP会议的成功反映了亚洲各国合作的诚意,2002-04-20,2002-04
亚洲议会和平协会重庆宣言,2002-04-20,2002-04
没想到中国西部如此可爱,2002-04-20,2002-04
亚洲议会加强合作的新篇章,2002-04-20,2002-04
亚洲议会和平协会第三届年会隆重闭幕,2002-04-20,2002-04
江泽民会见伊朗法尔斯省省长,2002-04-20,2002-04
中国经济将保持快速增长,2002-04-20,2002-04
瑞典力促对华经贸关系,2002-04-20,2002-04
丝绸古道沐春风,2002-04-20,2002-04
安南呼吁向中东部署多国部队,2002-04-20,2002-04
国航客机事故调查善后有序展开,2002-04-20,2002-04
加墨不参加美组建北方司令部计划,2002-04-20,2002-04
机械故障还是自杀行为,2002-04-20,2002-04
CBA没有失败者,2002-04-20,2002-04
中国已获近两万张世界杯赛门票,2002-04-20,2002-04
国足亮相红塔基地,2002-04-20,2002-04
中国足球队召开备战世界杯动员会,2002-04-20,2002-04
第七届少数民族运动会明年九月在宁夏举行,2002-04-20,2002-04
首届全国大学生健身健美操赛启动,2002-04-20,2002-04
安吉国际山地极限运动赛结束,2002-04-20,2002-04
异乡有个温馨的家,2002-04-20,2002-04
学习江泽民论延安精神的重要讲话,2002-04-20,2002-04
我国加快推进制造业信息化,2002-04-20,2002-04
中央国家机关建立第二批思想教育基地,2002-04-20,2002-04
桂林开通免费公交车,2002-04-20,2002-04
国航“四·一五”空难家属赴韩,2002-04-20,2002-04
河南：“两个确保”落实到位,2002-04-20,2002-04
湖南：着力消除社保“盲点”,2002-04-20,2002-04
天津大学资助贫困生规范化长期化制度化,2002-04-20,2002-04
中俄航联委第四十四次例会举行,2002-04-20,2002-04
吴仪与赫里斯坚科举行会谈,2002-04-20,2002-04
外交部发言人评欧洲议会通过的报告,2002-04-20,2002-04
国际足联副主席郑梦准到本报参观访问,2002-04-20,2002-04
北师大成立心理学院,2002-04-20,2002-04
行业报自律与改革发展研讨会在京召开,2002-04-20,2002-04
宁夏发生严重毁林案件,2002-04-20,2002-04
创建法制诚信公平经济环境 完善社会主义市场经济体制,2002-04-20,2002-04
继续扩大国内需求  保持经济较快增长,2002-04-20,2002-04
借船出海  走出国门,2002-04-20,2002-04
100个城市退休人员纳入社会化管理,2002-04-20,2002-04
标准体系注入新活力,2002-04-20,2002-04
警惕“武汉新田”变相传销,2002-04-20,2002-04
3月份居民消费价格同比下降0.8％,2002-04-20,2002-04
“黄金周”民航全力保安全,2002-04-20,2002-04
“长江春禁”，渔民吃亏吗？,2002-04-20,2002-04
我停止从荷兰进口动物源性食品,2002-04-20,2002-04
承德中行新华支行培训青年员工,2002-04-20,2002-04
七台河加快煤化工建设,2002-04-20,2002-04
中化商标通过中国驰名商标认定,2002-04-20,2002-04
中国（古镇）国际灯饰博览会将举行,2002-04-20,2002-04
镇平国税开展“税民联系进万家”活动,2002-04-20,2002-04
文峰地税表彰诚信单位,2002-04-20,2002-04
元宝山电厂积极应对入世挑战,2002-04-20,2002-04
十大连锁企业联合招商洽谈会举行,2002-04-20,2002-04
绿色包装联合行动拉开帷幕,2002-04-20,2002-04
唐山蓝带公司支持体育事业,2002-04-20,2002-04
古韵新风共生辉,2002-04-20,2002-04
严格执法  热情服务,2002-04-20,2002-04
一户农家祖孙三代拥军二十二年,2002-04-20,2002-04
团徽在这里闪亮,2002-04-20,2002-04
中医药国外受褒奖,2002-04-20,2002-04
“兄弟杯”十年创辉煌,2002-04-20,2002-04
中国软件业弱在哪儿,2002-04-20,2002-04
先解决心理问题,2002-04-20,2002-04
数据与事实,2002-04-20,2002-04
他们看到了什么？,2002-04-20,2002-04
演艺市场迈入“鼠标＋水泥”时代,2002-04-20,2002-04
电脑病毒一周播报,2002-04-20,2002-04
网语  一道新门向谁开,2002-04-20,2002-04
莫道身轻如燕阅遍天下华章,2002-04-20,2002-04
掌上电脑中文软件发布最新版,2002-04-20,2002-04
在牛奶和豆浆之间,2002-04-20,2002-04
信息技术为金盾增辉,2002-04-20,2002-04
我们的名字是长城,2002-04-20,2002-04
湖畔鸥影,2002-04-20,2002-04
聊城记,2002-04-20,2002-04
诗人的眼睛,2002-04-20,2002-04
江泽民主席与哈塔米总统举行会谈,2002-04-21,2002-04
江泽民会见拉夫桑贾尼主席和卡鲁比议长,2002-04-21,2002-04
努力把重庆的改革建设发展推向新阶段,2002-04-21,2002-04
朱镕基同穆巴拉克总统会见,2002-04-21,2002-04
奋战一百天夺取京剧音配像的全面胜利,2002-04-21,2002-04
奋战一百天  夺取京剧音配像的全面胜利,2002-04-21,2002-04
北京地区天气预报,2002-04-21,2002-04
保障流动人口子女接受义务教育,2002-04-21,2002-04
奇妙的机器人,2002-04-21,2002-04
五年投资三百亿唤回碧水蓝天,2002-04-21,2002-04
推介绿色健康生活方式,2002-04-21,2002-04
我国太阳能综合利用产业化程度提高,2002-04-21,2002-04
辽宁植树变“植数”将受追究,2002-04-21,2002-04
青海挤掉退耕还林还草“泡沫”,2002-04-21,2002-04
用硬措施刹造假风,2002-04-21,2002-04
加大政策的支持力度 全面推动再就业工作,2002-04-21,2002-04
奋战一百天夺取京剧音配像的全面胜利,2002-04-21,2002-04
奋战一百天  夺取京剧音配像的全面胜利,2002-04-21,2002-04
象棋排位赛陶汉明晋级八强,2002-04-21,2002-04
同意调查杰宁难民营状况,2002-04-21,2002-04
世界经济形势仍困难不少,2002-04-21,2002-04
司马义·艾买提访问比利时,2002-04-21,2002-04
安议长会见王文元,2002-04-21,2002-04
中国人民不会忘记雨果,2002-04-21,2002-04
国足训练轻松快乐,2002-04-21,2002-04
于根伟两周后将康复,2002-04-21,2002-04
浙江队险胜山东队率先闯入决赛,2002-04-21,2002-04
CUBA男子八强赛在泰山脚下打响,2002-04-21,2002-04
汤尤杯羽毛球赛获中国人保支持,2002-04-21,2002-04
江泽民主席与哈塔米总统举行会谈,2002-04-21,2002-04
江泽民会见拉夫桑贾尼主席和卡鲁比议长,2002-04-21,2002-04
朱镕基同穆巴拉克总统会见,2002-04-21,2002-04
杨汝岱会见叙利亚客人,2002-04-21,2002-04
李岚清观看“相约北京”联欢活动开幕演出,2002-04-21,2002-04
把“四进社区”活动深入持久地开展下去,2002-04-21,2002-04
黑龙江：社区送岗位  方便千万家,2002-04-21,2002-04
公交车上听民声,2002-04-21,2002-04
武警湖北总队增强凝聚力,2002-04-21,2002-04
努力把重庆的改革建设发展推向新阶段,2002-04-21,2002-04
昆明有支女子乘警队,2002-04-21,2002-04
淮安农村经济赢得“满堂彩”,2002-04-21,2002-04
五原农业经济走好“四步棋”,2002-04-21,2002-04
厦门规范外语译文社会用字,2002-04-21,2002-04
三峡海外游客同比增加2倍多,2002-04-21,2002-04
平谷启动反传销监控网络,2002-04-21,2002-04
乐亭海岛生态旅游醉游人,2002-04-21,2002-04
新乡市郊区拓宽富民路,2002-04-21,2002-04
陶瓷上的微书艺术,2002-04-21,2002-04
农民乐园春意浓,2002-04-21,2002-04
杨裕中：情洒荒山绘春色,2002-04-21,2002-04
达州农村建立“三个代表”流动学习站,2002-04-21,2002-04
是谁为死人贷款开了绿灯？,2002-04-21,2002-04
打假别忘农村市场,2002-04-21,2002-04
农村消费维权为何举步维艰,2002-04-21,2002-04
霸州市：建设城市森林,2002-04-21,2002-04
“四话”干部要不得,2002-04-21,2002-04
持卡理财要有防范意识,2002-04-21,2002-04
欲退一张卡  烦恼两个月,2002-04-21,2002-04
民工队长———捐资百万建学堂,2002-04-21,2002-04
阜阳交警———全员“充电”促管理,2002-04-21,2002-04
保健学会———健康教育进社区,2002-04-21,2002-04
人民大学———百台电脑赠西部,2002-04-21,2002-04
健身方式不当  公园小树遭殃,2002-04-21,2002-04
积极参与区域经济合作 开创我国对外经贸新格局,2002-04-21,2002-04
改革融资体制 加快城市化步伐,2002-04-21,2002-04
方便群众办事,2002-04-21,2002-04
共同建设社会信誉大厦,2002-04-21,2002-04
“税鼠”难逃法网,2002-04-21,2002-04
小说里的自然,2002-04-21,2002-04
弘扬民族文化的有益实践,2002-04-21,2002-04
流行与品位,2002-04-21,2002-04
溯游而上的传统文化之旅,2002-04-21,2002-04
拿什么拯救人文精神,2002-04-21,2002-04
游走在古典和现实之间,2002-04-21,2002-04
领导干部要做勤于学习善于学习的典范,2002-04-22,2002-04
一心为民  一身正气,2002-04-22,2002-04
全国干部培训教材《序言》,2002-04-22,2002-04
江泽民为全国干部培训教材作《序言》,2002-04-22,2002-04
朱镕基总理发表讲话,2002-04-22,2002-04
默默的实践者,2002-04-22,2002-04
太平洋作证,2002-04-22,2002-04
北京地区天气预报,2002-04-22,2002-04
江泽民主席会见哈梅内伊,2002-04-22,2002-04
本期关注公厕建设和管理,2002-04-22,2002-04
“厕所革命”在桂林,2002-04-22,2002-04
不同年代的厕所话题,2002-04-22,2002-04
“九五”期间水利行业利用外资43亿美元,2002-04-22,2002-04
最高人民法院公布相关司法解释,2002-04-22,2002-04
山西电力公司公布九项承诺,2002-04-22,2002-04
荷兰猪肠衣含氯霉素  我国首次作焚毁处理,2002-04-22,2002-04
农民抗旱用上了“股份井”,2002-04-22,2002-04
泰山实施综合整治,2002-04-22,2002-04
优良习惯要养成  情境说服效果佳,2002-04-22,2002-04
地铁沿线卖鲜肉  主意新鲜效益差,2002-04-22,2002-04
医院尝试会员制  病人看病可刷卡,2002-04-22,2002-04
文物保护热温州  政府社会都关注,2002-04-22,2002-04
历史见证中伊友好,2002-04-22,2002-04
朱镕基会见埃议长和协商会议主席,2002-04-22,2002-04
江主席会见我驻伊使馆人员,2002-04-22,2002-04
调查以军战争罪行,2002-04-22,2002-04
朱镕基会见阿盟秘书长,2002-04-22,2002-04
尼泊尔国王会见列确,2002-04-22,2002-04
乌副总统会见中共代表团,2002-04-22,2002-04
刚果（金）结束国内政治对话,2002-04-22,2002-04
小泉再次参拜靖国神社  韩国对此表示非常遗憾,2002-04-22,2002-04
美国五万人举行反战示威集会,2002-04-22,2002-04
“法轮功”遭取缔是咎由自取,2002-04-22,2002-04
飞撞米兰大厦事件有悬疑,2002-04-22,2002-04
布什批准美向亚非四国军援,2002-04-22,2002-04
菲南部发生爆炸事件,2002-04-22,2002-04
朱镕基总理发表讲话,2002-04-22,2002-04
江泽民主席会见哈梅内伊,2002-04-22,2002-04
“四进社区”活动在全国启动,2002-04-22,2002-04
重庆直辖与西部大开发研讨会闭幕,2002-04-22,2002-04
湖南：一季度实现“两个确保”,2002-04-22,2002-04
成都：建立社区再就业工程网络,2002-04-22,2002-04
警钟还是要常给自己敲,2002-04-22,2002-04
清华大学新闻与传播学院成立,2002-04-22,2002-04
李肇星奉命向日方提出严正交涉,2002-04-22,2002-04
外交部发言人发表谈话,2002-04-22,2002-04
以史为鉴  面向未来,2002-04-22,2002-04
陈锦华同罗马尼亚参议院议长座谈,2002-04-22,2002-04
明天气象预报,2002-04-22,2002-04
江泽民为全国干部培训教材作《序言》,2002-04-22,2002-04
邮运千万里  满意在雪域,2002-04-22,2002-04
株洲改进集贸市场税收征管,2002-04-22,2002-04
开行资产质量继续提高,2002-04-22,2002-04
加快我国税制改革进程,2002-04-22,2002-04
外商看好中国建筑市场,2002-04-22,2002-04
第五届中国国际机械装备展将举行,2002-04-22,2002-04
石家庄地税征收社保费进度快,2002-04-22,2002-04
阿尔山矿泉水受市场欢迎,2002-04-22,2002-04
烟台啤酒推行纯生化管理,2002-04-22,2002-04
“吉斯”家具又添新专利,2002-04-22,2002-04
长治城区经济建设添新力,2002-04-22,2002-04
北京建行电子银行交易活跃,2002-04-22,2002-04
北京经济开发区污水处理厂投入运营,2002-04-22,2002-04
“武训”故乡写忠诚,2002-04-22,2002-04
企业文化  精神文明建设有效载体,2002-04-22,2002-04
中国公证事业需要与世界接轨,2002-04-22,2002-04
默默的实践者,2002-04-22,2002-04
太平洋作证,2002-04-22,2002-04
国际货币与金融委员会部长级会议召开,2002-04-22,2002-04
西方七国财长发表声明,2002-04-22,2002-04
为了满足“中国特需”,2002-04-22,2002-04
中日韩加强环保合作,2002-04-22,2002-04
美第一头克隆牛终于当妈妈,2002-04-22,2002-04
阿特兰蒂斯号返回地面,2002-04-22,2002-04
无鼠标键盘电脑问世,2002-04-22,2002-04
英发现野生鸟类寿星,2002-04-22,2002-04
国足备战进入第三天,2002-04-22,2002-04
米卢不评韩哥赛果  只谈中韩对抗,2002-04-22,2002-04
李霄鹏渴望进球,2002-04-22,2002-04
四川女排获企业冠名,2002-04-22,2002-04
北京台球队获支持,2002-04-22,2002-04
山东鲁能队夺得冠军,2002-04-22,2002-04
全国男排联赛江苏队晋级决赛,2002-04-22,2002-04
足协杯甲B球队难敌甲A劲旅,2002-04-22,2002-04
世界体育论坛将于5月在京举行,2002-04-22,2002-04
山东科大队闯入CUBA总决赛,2002-04-22,2002-04
创现代化强区  建生态型鄞州,2002-04-22,2002-04
鄞乡无地不春光,2002-04-22,2002-04
进一步打破行业垄断,2002-04-22,2002-04
摘自朱镕基总理在九届全国人大五次会议上的政府工作报告,2002-04-22,2002-04
你吃好了吗？,2002-04-22,2002-04
小煤窑吞噬大草原,2002-04-22,2002-04
岂能如此歧视民工,2002-04-22,2002-04
黄河边依然只卖黄河啤酒（连续报道）,2002-04-22,2002-04
南京外地车可以上牌照了,2002-04-22,2002-04
给些“免疫力”,2002-04-22,2002-04
废品回收：好个朝阳产业,2002-04-22,2002-04
再生资源如何“再生”,2002-04-22,2002-04
加快发展税务代理,2002-04-22,2002-04
贷款购车可享一站式服务,2002-04-22,2002-04
持有暂停上市或退市股票怎么办,2002-04-22,2002-04
密室之中有猫腻,2002-04-22,2002-04
河南经济增长促进国税增收,2002-04-22,2002-04
中信银行推出全球最快的国际汇款业务,2002-04-22,2002-04
苏州工业园出口区发展快,2002-04-22,2002-04
北京税法宣传千里行启动,2002-04-22,2002-04
如何用好水资源,2002-04-22,2002-04
保护我们的生命线,2002-04-22,2002-04
哈尔滨全力抗旱保春种,2002-04-22,2002-04
平原改革农村财务管理,2002-04-22,2002-04
唐海兴县富民靠人才,2002-04-22,2002-04
水资源综合规划,2002-04-22,2002-04
“人才回流”怎样留得住？,2002-04-22,2002-04
注重培养企业核心价值观,2002-04-22,2002-04
兄妹标兵,2002-04-22,2002-04
蓝星为啥抢“包袱”,2002-04-22,2002-04
“红博现象”：营销新概念,2002-04-22,2002-04
领导干部学电脑丛书出版,2002-04-22,2002-04
中欧高级工商管理人才受欢迎,2002-04-22,2002-04
超过法定加班时间可拒绝,2002-04-22,2002-04
打假须破地方保护,2002-04-22,2002-04
江泽民主席回到北京,2002-04-23,2002-04
