宁夏加大扶贫开发力度,2002-04-09,2002-04
青岛实行“低保”承诺服务,2002-04-09,2002-04
安徽通过市场引导推进再就业,2002-04-09,2002-04
昆明为下岗职工购买就业岗位,2002-04-09,2002-04
海南喜气洋洋迎嘉宾,2002-04-09,2002-04
农行山东分行对重点客户公开授信二百八十亿元,2002-04-09,2002-04
长海医院构筑人才高地,2002-04-09,2002-04
白城着力抓“劳务经济”,2002-04-09,2002-04
北京百余名退伍女兵自谋职业,2002-04-09,2002-04
深圳公交车用上全球卫星定位系统,2002-04-09,2002-04
要重视林木种苗质量,2002-04-09,2002-04
三湘农民心欢畅,2002-04-09,2002-04
布莱尔支持美打击伊拉克,2002-04-09,2002-04
朝韩重启和平进程,2002-04-09,2002-04
问农鹿儿岛,2002-04-09,2002-04
挪威国王会见迟浩田,2002-04-09,2002-04
以军继续猛攻巴控区 鲍威尔赶赴中东斡旋,2002-04-09,2002-04
谁孤立？,2002-04-09,2002-04
中阿对话会议开幕,2002-04-09,2002-04
我驻约使馆庆祝中约建交25周年,2002-04-09,2002-04
哈总统会见王文元,2002-04-09,2002-04
韩拟向朝援粮30万吨,2002-04-09,2002-04
阿国防部长车队遭炸弹袭击,2002-04-09,2002-04
李鹏出席鹿儿岛县知事欢迎晚宴,2002-04-09,2002-04
广东省委首次票决地级市党政一把手,2002-04-09,2002-04
明天气象预报,2002-04-09,2002-04
难忘昨天,2002-04-09,2002-04
温家宝会见美国客人,2002-04-09,2002-04
傅全有会见意大利客人,2002-04-09,2002-04
唐家璇与希腊外长会谈,2002-04-09,2002-04
甘肃省“三下乡”重在办实事,2002-04-09,2002-04
重新奏响人生的乐章,2002-04-09,2002-04
外交部发言人发表谈话,2002-04-09,2002-04
依法加强人口与计划生育工作,2002-04-09,2002-04
淮河、太湖流域重点断面水质自动监测周报,2002-04-09,2002-04
加强食品打假  整治医疗服务,2002-04-09,2002-04
追随心灵的呼唤,2002-04-09,2002-04
让地球充满生机,2002-04-09,2002-04
《画坛巨擘》出版,2002-04-09,2002-04
我国高温超导线材进入国际市场,2002-04-09,2002-04
北京宏志中学正靠借债度日,2002-04-09,2002-04
西部中学获赠电脑,2002-04-09,2002-04
中华民族园演绎西部风情,2002-04-09,2002-04
近万农民  无偿献血,2002-04-09,2002-04
“海洋”的另一种追求,2002-04-09,2002-04
让管理给科研插上翅膀,2002-04-09,2002-04
夕阳无限好  黄昏欢乐多,2002-04-09,2002-04
世界老龄大会开幕,2002-04-09,2002-04
司马义·艾买提会见安南,2002-04-09,2002-04
人口老龄化状况堪忧,2002-04-09,2002-04
伊拉克暂停出口原油,2002-04-09,2002-04
看好中国电子商务,2002-04-09,2002-04
阿根廷向澳出口核反应堆,2002-04-09,2002-04
阿定柏柏尔语为官方语,2002-04-09,2002-04
哥发生恶性汽车炸弹爆炸,2002-04-09,2002-04
印度车祸十七人丧生,2002-04-09,2002-04
多数美国人缺乏运动,2002-04-09,2002-04
莫斯科行路难,2002-04-09,2002-04
各国共商保护生物多样性,2002-04-09,2002-04
十头大象竟一夜被杀,2002-04-09,2002-04
多元调查拯救华南虎,2002-04-09,2002-04
转基因玉米污染野生玉米？,2002-04-09,2002-04
沙尘暴再袭蒙古国,2002-04-09,2002-04
人民利益高于一切,2002-04-09,2002-04
中国再添一金一银一铜,2002-04-09,2002-04
国际足联女足世界杯考察团抵沪,2002-04-09,2002-04
五指何时攥成拳,2002-04-09,2002-04
格局依旧  喜忧参半,2002-04-09,2002-04
健康老人登山健身活动在京揭幕,2002-04-09,2002-04
全国男篮甲A联赛深圳奥神双双降级,2002-04-09,2002-04
小将胡耀宇力克李昌镐,2002-04-09,2002-04
立志与立行,2002-04-09,2002-04
商业是先导产业,2002-04-09,2002-04
加强对困难群众的文化关怀,2002-04-09,2002-04
关注休闲产业,2002-04-09,2002-04
重视物流园区布局,2002-04-09,2002-04
以最广大人民的根本利益为最高标准,2002-04-09,2002-04
新技术考验中国通信,2002-04-09,2002-04
好钢用在刀刃上,2002-04-09,2002-04
太空高处实验台,2002-04-09,2002-04
科学有奇趣  童叟共痴迷,2002-04-09,2002-04
地球温度创千年新高,2002-04-09,2002-04
牙膏离退休不远了,2002-04-09,2002-04
新工艺新机制带来新变化,2002-04-09,2002-04
科技兴农选品种 济南红提到新疆,2002-04-09,2002-04
电磁干扰与防护技术,2002-04-09,2002-04
贵州为中小企业设国际市场开拓资金,2002-04-09,2002-04
新增1500亿国债投资方案确定,2002-04-09,2002-04
一季度企业生产经营平稳发展,2002-04-09,2002-04
浮动佣金走过来,2002-04-09,2002-04
煤矿安全生产形势依然严峻,2002-04-09,2002-04
全国旅游投诉结案率高,2002-04-09,2002-04
“长江春禁”执法行动开始,2002-04-09,2002-04
栖霞工商局方便企业登记,2002-04-09,2002-04
黄骅冬枣获原产地保护,2002-04-09,2002-04
今年我国进口轿车不会大幅增加,2002-04-09,2002-04
中法保险业开展合作交流,2002-04-09,2002-04
南宁海关查获毒品走私案,2002-04-09,2002-04
花木工厂展示现代农业,2002-04-09,2002-04
中行与百胜开展全面合作,2002-04-09,2002-04
桥东地税局加强税法宣传,2002-04-09,2002-04
铁路大粒径道碴摊铺机亮相,2002-04-09,2002-04
大豆深加工技术受欢迎,2002-04-09,2002-04
平谷将办国际桃花烟花节,2002-04-09,2002-04
达芙妮连续四年销量第一,2002-04-09,2002-04
难忘的败兴之旅,2002-04-09,2002-04
治一治“盲从”,2002-04-09,2002-04
谁来问质量,2002-04-09,2002-04
我看图书“泡沫”,2002-04-09,2002-04
寻访鸡鸣驿,2002-04-09,2002-04
我也来一段,2002-04-09,2002-04
一部有学术价值的服饰美学史,2002-04-09,2002-04
杨华与新民歌,2002-04-09,2002-04
听听农民说地名,2002-04-09,2002-04
英国喜剧走上北京舞台,2002-04-09,2002-04
舞剧《红梅赞》和歌剧《党的女儿》将再次上演,2002-04-09,2002-04
江主席与施罗德总理会谈,2002-04-10,2002-04
李鹏委员长回到北京,2002-04-10,2002-04
安徽全力帮扶困难群众 福建实行挂钩帮扶制度,2002-04-10,2002-04
招商引资不宜“摊派”,2002-04-10,2002-04
嘉陵何以重拔头筹,2002-04-10,2002-04
山东对取消的收费项目大检查,2002-04-10,2002-04
第四届中国航展将在珠海举行,2002-04-10,2002-04
深圳骨髓库配型成功十八例,2002-04-10,2002-04
国际连锁集团交易会在津举行,2002-04-10,2002-04
兰州市国内生产总值首季开门红,2002-04-10,2002-04
国家级南京经济技术开发区挂牌,2002-04-10,2002-04
北京地区天气预报,2002-04-10,2002-04
江主席与劳总统举行会谈,2002-04-10,2002-04
突出重点增强“严打”斗争针对性实效性 强化防范全面落实社会治安综治措施,2002-04-10,2002-04
为农业和农村经济发展建功立业,2002-04-10,2002-04
大力整顿规范认证市场秩序,2002-04-10,2002-04
董建华将率团出席博鳌亚洲论坛年会,2002-04-10,2002-04
何厚铧将出席博鳌亚洲论坛年会并发表讲话,2002-04-10,2002-04
博鳌生态美如画,2002-04-10,2002-04
今后不再批准开办小煤矿,2002-04-10,2002-04
十五”期间大力推进绿色食品事业,2002-04-10,2002-04
瑞士有条件解除中国鸡肉进口禁令,2002-04-10,2002-04
中国联通CDMA试运营结束,2002-04-10,2002-04
走出“人才高消费”  高职学生也受宠,2002-04-10,2002-04
“托儿”混进旅游团  购物宰客没商量,2002-04-10,2002-04
环保执法遭抗法  随行记者挨毒打,2002-04-10,2002-04
“彩虹桥”下乱糟糟,2002-04-10,2002-04
江主席出席柏林市政府欢迎招待会,2002-04-10,2002-04
江主席分别会见德两党主席,2002-04-10,2002-04
江主席会见德前总理科尔,2002-04-10,2002-04
钱其琛会见德副总理兼外长,2002-04-10,2002-04
以色列小步撤军 鲍威尔遭遇尴尬,2002-04-10,2002-04
美承认阿拉法特为巴领导人,2002-04-10,2002-04
施罗德主张军事干预中东,2002-04-10,2002-04
反对任何形式核扩散,2002-04-10,2002-04
喀麦隆打击邪教组织,2002-04-10,2002-04
英王太后葬礼在伦敦举行,2002-04-10,2002-04
沙龙解散以核心安全内阁,2002-04-10,2002-04
以军杰宁遭袭十三人丧生,2002-04-10,2002-04
沙龙缘何一意孤行,2002-04-10,2002-04
江主席与施罗德总理会谈,2002-04-10,2002-04
明天气象预报,2002-04-10,2002-04
中国出版集团在京成立,2002-04-10,2002-04
中央企业领导廉洁自律若干规定实施办法出台,2002-04-10,2002-04
浙江省直机关作风建设重实效,2002-04-10,2002-04
黄石推进干部作风建设,2002-04-10,2002-04
新闻摄影比赛,2002-04-10,2002-04
另一种英雄,2002-04-10,2002-04
西瓜未熟先吆喝,2002-04-10,2002-04
北方春播和春季造林将推迟一周左右,2002-04-10,2002-04
依法解决好妇女事业发展中的突出问题,2002-04-10,2002-04
大连工会“五助”活动促进再就业,2002-04-10,2002-04
外事简讯,2002-04-10,2002-04
清明时节迁坟忙,2002-04-10,2002-04
台湾《中国时报》创建人余纪忠先生逝世,2002-04-10,2002-04
嘉陵何以重拔头筹,2002-04-10,2002-04
机制上突破  载体上创新,2002-04-10,2002-04
余姚——东南名邑,2002-04-10,2002-04
创新，时代的历史先声,2002-04-10,2002-04
徐水围绕农民增收开展学教,2002-04-10,2002-04
汝阳抓基层党建促村民致富,2002-04-10,2002-04
团中央召开学习实践“三个代表”座谈会,2002-04-10,2002-04
大连着力建设国家无障碍环境示范市,2002-04-10,2002-04
计算机犯罪新动向,2002-04-10,2002-04
也说政绩靠“炒”,2002-04-10,2002-04
厦门开元区农民有了最低生活保障,2002-04-10,2002-04
北京确定整治五十三处治安重点,2002-04-10,2002-04
二炮某旅道德建设见成效,2002-04-10,2002-04
汕头改革行政审批制度,2002-04-10,2002-04
焦作中院变“相马”为“赛马”,2002-04-10,2002-04
北京二龙路城管分队争创一流,2002-04-10,2002-04
山海关站依靠职工抓安全,2002-04-10,2002-04
人行新县支行强化金融法规教育,2002-04-10,2002-04
青春着意化为桥,2002-04-10,2002-04
继往开来  促进友好  扩大合作,2002-04-10,2002-04
李鹏接受日本记者采访,2002-04-10,2002-04
承先启后谱新篇,2002-04-10,2002-04
今年亚洲经济增长4.8％,2002-04-10,2002-04
阐述我在老龄问题上立场,2002-04-10,2002-04
中国乒乓球“双十佳”评选揭晓,2002-04-10,2002-04
英雄今犹在  风景已不同,2002-04-10,2002-04
中国足球“龙之队”评选揭晓,2002-04-10,2002-04
西藏登山探险队将挑战最难攀登的山峰,2002-04-10,2002-04
长池短池  各有短长,2002-04-10,2002-04
全国极限精英赛将于羊城揭幕,2002-04-10,2002-04
王洪礼和李金羽今天做客人民网,2002-04-10,2002-04
社区自治新探索,2002-04-10,2002-04
莫让村务公开流于形式,2002-04-10,2002-04
为京郊绿色屏障绘新图,2002-04-10,2002-04
“四五”普法写新篇,2002-04-10,2002-04
认真实践代表法,2002-04-10,2002-04
临朐  三项评比激活人大工作,2002-04-10,2002-04
镇海  督办“重复”议案有新招,2002-04-10,2002-04
邓州  出台典型案件监督办法,2002-04-10,2002-04
失信破产第一案,2002-04-10,2002-04
自律与他律,2002-04-10,2002-04
造假者进班房,2002-04-10,2002-04
女骑警风采,2002-04-10,2002-04
严惩违法审判者,2002-04-10,2002-04
“黑脸”局长,2002-04-10,2002-04
滁州国税稽查局长年坚持听证,2002-04-10,2002-04
白山市看守所实施感化式教育,2002-04-10,2002-04
好警察雷通,2002-04-10,2002-04
编者按,2002-04-10,2002-04
来自虚拟世界的挑战,2002-04-10,2002-04
网络无界  法律有边,2002-04-10,2002-04
网吧犯罪率缘何高,2002-04-10,2002-04
网络也要讲“网德”,2002-04-10,2002-04
网站是否侵权？,2002-04-10,2002-04
网络文章  权利几多？,2002-04-10,2002-04
为绿化建言,2002-04-10,2002-04
“失职”与“越权”,2002-04-10,2002-04
依法做好村委会换届选举,2002-04-10,2002-04
五小企业“躲”深山 吕梁山区遭污染,2002-04-10,2002-04
广元  人大通过古城开发与保护议案,2002-04-10,2002-04
衡南  代表建议办理向人代会报告,2002-04-10,2002-04
安丘  人大大力创新工作机制,2002-04-10,2002-04
烟台  牟平区人大为群众解难,2002-04-10,2002-04
代表法是代表的权利法典,2002-04-10,2002-04
以实际行动做好代表工作,2002-04-10,2002-04
共同创造一个和平繁荣的新世纪,2002-04-11,2002-04
江主席出席劳总统欢迎晚宴,2002-04-11,2002-04
江主席发表演讲,2002-04-11,2002-04
一个普通公民的道德情怀,2002-04-11,2002-04
深圳纳米材料应用获突破,2002-04-11,2002-04
台湾高科技园区落户海门,2002-04-11,2002-04
第三届昆明国际旅游节开幕,2002-04-11,2002-04
第六届东西部贸洽会落幕,2002-04-11,2002-04
不要让党员游离于组织之外,2002-04-11,2002-04
北京地区天气预报,2002-04-11,2002-04
科研合作顾虑多  管理体制待改革,2002-04-11,2002-04
情感教育进课堂  幼小心灵获“疏导”,2002-04-11,2002-04
废旧电脑乱拼装  “电子垃圾”成危害,2002-04-11,2002-04
“星火”发明难“燎原”  成果亟待变产品,2002-04-11,2002-04
货物贸易等五领域均有较大动作,2002-04-11,2002-04
进一步推广企业总法律顾问制度试点,2002-04-11,2002-04
企业法律顾问资格考试政策有调整,2002-04-11,2002-04
我国绿色食品开发初具规模,2002-04-11,2002-04
工行成为我国最大住房按揭银行,2002-04-11,2002-04
青海成都苏州深圳电话号码将升位,2002-04-11,2002-04
精神铸品牌,2002-04-11,2002-04
宁夏开展集贸市场专项整治,2002-04-11,2002-04
福建新建三所本科院校,2002-04-11,2002-04
“四色”经济富肇东,2002-04-11,2002-04
长江大堤实施清障 芜湖万民主动拆迁,2002-04-11,2002-04
江主席出席勃兰登堡州长举行的午宴,2002-04-11,2002-04
站在历史交汇点上,2002-04-11,2002-04
敦促以从巴撤军,2002-04-11,2002-04
澳代总理会见吴官正,2002-04-11,2002-04
毛总理会见中共代表团,2002-04-11,2002-04
揭露邪教“法轮功”,2002-04-11,2002-04
美批准前总统卡特访古,2002-04-11,2002-04
圣普组成新内阁,2002-04-11,2002-04
智采取措施援助灾民,2002-04-11,2002-04
鲍威尔故意兜圈子,2002-04-11,2002-04
俄美分歧依旧,2002-04-11,2002-04
共同创造一个和平繁荣的新世纪,2002-04-11,2002-04
江主席发表演讲,2002-04-11,2002-04
排污害苦了村民,2002-04-11,2002-04
中国全国人大代表团组成,2002-04-11,2002-04
珠海对领导干部进行权力观教育,2002-04-11,2002-04
办好和平盛会  展示重庆风采,2002-04-11,2002-04
全国农村青年工作会议在京举行,2002-04-11,2002-04
外交部发言人答记者问,2002-04-11,2002-04
雷锋精神永驻,2002-04-11,2002-04
李元如同志逝世,2002-04-11,2002-04
刘昂同志逝世,2002-04-11,2002-04
明天气象预报,2002-04-11,2002-04
按照“三个代表”要求  做好干部培训教材工作,2002-04-11,2002-04
从“加勺汤”到“给块肉”,2002-04-11,2002-04
银行间债券市场准入有新规,2002-04-11,2002-04
一季度企业家信心指数止跌回升,2002-04-11,2002-04
中信向长城宽带注资6亿元,2002-04-11,2002-04
锅炉事故比上年增加一成多,2002-04-11,2002-04
菏泽打造“国际牡丹花会”品牌,2002-04-11,2002-04
龙门石窟纪念币昨起发行,2002-04-11,2002-04
皇岗口岸日均过境人数逾四万,2002-04-11,2002-04
为中国培养一流法律专才,2002-04-11,2002-04
中国出版集团合力图强,2002-04-11,2002-04
科教兴村计划惠及“三农”,2002-04-11,2002-04
我国可再生能源利用方兴未艾,2002-04-11,2002-04
译林出版社悬赏十万堵源头,2002-04-11,2002-04
无奈的壮举,2002-04-11,2002-04
省长调研“生态省”,2002-04-11,2002-04
科学不容炒作,2002-04-11,2002-04
中国广电学会第四届理事会闭幕,2002-04-11,2002-04
专家研讨餐桌污染与食品安全,2002-04-11,2002-04
北京少年以行动迎接奥运,2002-04-11,2002-04
中华汽车向希望工程捐资,2002-04-11,2002-04
中国民法百年研讨会举行,2002-04-11,2002-04
同仁眼科“挂号难”有望缓解,2002-04-11,2002-04
“微量子护眼工程”启动,2002-04-11,2002-04
德俄举行政府间磋商,2002-04-11,2002-04
布什主张美能源供应多样化,2002-04-11,2002-04
石油市场波澜起,2002-04-11,2002-04
安达信裁员自救,2002-04-11,2002-04
中东紧张  日元升值,2002-04-11,2002-04
为新国家建立开绿灯,2002-04-11,2002-04
俄挫败一起美间谍活动,2002-04-11,2002-04
墨谴责美侵犯劳工人权,2002-04-11,2002-04
纽约世贸中心原址建设构想出台,2002-04-11,2002-04
非洲经济增势喜人,2002-04-11,2002-04
巴黎立法治狗屎,2002-04-11,2002-04
八一险胜上海东方,2002-04-11,2002-04
国家体监委确定近期重点工作,2002-04-11,2002-04
广东队蝉联全国象棋团体锦标赛冠军,2002-04-11,2002-04
●中国体育代表团专用饮料严把关 ●国足出征世界杯获保险公司支持,2002-04-11,2002-04
重庆队首尝胜果,2002-04-11,2002-04
散打王争霸赛第三周激战连场,2002-04-11,2002-04
国奥队集训直指雅典奥运,2002-04-11,2002-04
一个普通公民的道德情怀,2002-04-11,2002-04
法制化：廉政建设的必由之路,2002-04-11,2002-04
成人与责任,2002-04-11,2002-04
更新行政观念探析,2002-04-11,2002-04
以城镇化推动社会经济发展,2002-04-11,2002-04
人民的需要就是我们的责任,2002-04-11,2002-04
“站在第一线”,2002-04-11,2002-04
困境之中更显本色,2002-04-11,2002-04
破产企业党组织和党员应如何去留？,2002-04-11,2002-04
形式主义的根子在哪里,2002-04-11,2002-04
重读《狱中同志的意见》,2002-04-11,2002-04
一届“政绩债”竟需百年还,2002-04-11,2002-04
“有啥困难尽管说，特别是我们领导想不到的。”,2002-04-11,2002-04
“逼民致富”要不得,2002-04-11,2002-04
不宜成群结队搞“三同”,2002-04-11,2002-04
讲话何必言“特点”,2002-04-11,2002-04
书记念错人名之后,2002-04-11,2002-04
做群众想做的事,2002-04-11,2002-04
“仙丹妙药”能求来吗？,2002-04-11,2002-04
把当老百姓列入领导日程,2002-04-11,2002-04
我的县府行,2002-04-11,2002-04
产品鉴定费周折 消费维权困扰多,2002-04-11,2002-04
“东升杯摄影比赛”揭晓,2002-04-11,2002-04
“京九绿色长廊”尚未全绿,2002-04-11,2002-04
让“世纪大道”名副其实,2002-04-11,2002-04
莫让仿真“冥钞”污染市场,2002-04-11,2002-04
殡葬陋习已成农民重负,2002-04-11,2002-04
死后不占子孙耕地,2002-04-11,2002-04
你笑时露几颗牙？,2002-04-11,2002-04
美之折腾,2002-04-11,2002-04
春光漫溢玉湖,2002-04-11,2002-04
草原雄风（装饰画）,2002-04-11,2002-04
广场的老人,2002-04-11,2002-04
静静的黑龙江,2002-04-11,2002-04
七叔公晒腊肉,2002-04-11,2002-04
江泽民主席继续在德国访问,2002-04-12,2002-04
朱镕基会见参加博鳌亚洲论坛各国前政要,2002-04-12,2002-04
胡锦涛将出访三国,2002-04-12,2002-04
以道德的力量教育人鼓舞人,2002-04-12,2002-04
越南国会主席、阿塞拜疆国民议会主席将访华,2002-04-12,2002-04
浙江经济保持强劲势头,2002-04-12,2002-04
北京王府井将举办国际车展,2002-04-12,2002-04
第三届西博会将在成都举行,2002-04-12,2002-04
深圳首季经济发展势头良好,2002-04-12,2002-04
珠海国税首季同比增长四成,2002-04-12,2002-04
道德高尚最可敬,2002-04-12,2002-04
北京地区天气预报,2002-04-12,2002-04
中国将加强国际经济技术合作,2002-04-12,2002-04
两年内完成中小学危房改造,2002-04-12,2002-04
加强和改善粮食宏观调控 深化国有粮食购销企业改革,2002-04-12,2002-04
电力体制改革方案确定,2002-04-12,2002-04
一季度我国外贸出口增长近一成,2002-04-12,2002-04
中欧信息社会合作论坛将于本月举行,2002-04-12,2002-04
国家经贸委公布今年化肥关税配额和原油非国营贸易配额,2002-04-12,2002-04
《中国民族人口》出版发行,2002-04-12,2002-04
加强传染病疫情监测防治,2002-04-12,2002-04
管管如此洗车,2002-04-12,2002-04
统一思想提高认识突出抓好再就业工作,2002-04-12,2002-04
以道德的力量教育人鼓舞人,2002-04-12,2002-04
日美钢铁贸易谈判未果,2002-04-12,2002-04
突尼斯热情期待江主席访问,2002-04-12,2002-04
以军攻占杰宁 欧盟主张制裁,2002-04-12,2002-04
建立国际促和有效机制,2002-04-12,2002-04
朝出版金正日文献集,2002-04-12,2002-04
石广生与德经济部长会谈,2002-04-12,2002-04
韩将向朝提供化肥,2002-04-12,2002-04
美告诫以必须同巴谈判,2002-04-12,2002-04
韩要求日修改历史教科书,2002-04-12,2002-04
谢列兹尼奥夫决定留任俄杜马主席,2002-04-12,2002-04
中东危机冲击法国,2002-04-12,2002-04
南上院通过与海牙法庭合作法,2002-04-12,2002-04
安哥拉正式启动停火协议,2002-04-12,2002-04
粮农组织一驻阿人员遇害,2002-04-12,2002-04
联合国国际公约生效,2002-04-12,2002-04
博鳌亚洲论坛首届年会内容丰富多彩,2002-04-12,2002-04
王兆国会见港澳特区青年企业家代表,2002-04-12,2002-04
“你的工作任务完成了吗？”,2002-04-12,2002-04
梦圆洛阳城,2002-04-12,2002-04
云南龙头企业与农民建立利益联结机制,2002-04-12,2002-04
兰州贫困居民全部纳入“低保”,2002-04-12,2002-04
凝聚在事业的旗帜下,2002-04-12,2002-04
外交部发言人发表谈话,2002-04-12,2002-04
怎样维护最广大人民的根本利益,2002-04-12,2002-04
明天气象预报,2002-04-12,2002-04
社会科学要为改革开放和现代化建设服务,2002-04-12,2002-04
学艺十余年  徒弟成师傅,2002-04-12,2002-04
田头到餐桌全程标准化,2002-04-12,2002-04
青年企协举行代表大会,2002-04-12,2002-04
跨国零售集团采购会准备就绪,2002-04-12,2002-04
摩根斯坦利中国业务发展快,2002-04-12,2002-04
安达抓会风改作风办实事,2002-04-12,2002-04
邯郸市丛台区转变作风“始于足下”,2002-04-12,2002-04
巴南区抓作风建设领导干部率先垂范,2002-04-12,2002-04
北京首批因私出入境中介机构获得经营许可证,2002-04-12,2002-04
“下高楼出深院”才有收获,2002-04-12,2002-04
蓟县县直机关党建工作上水平,2002-04-12,2002-04
洪湖事业单位打破职务终身制,2002-04-12,2002-04
山东泉林纸业党建工作“四到位”,2002-04-12,2002-04
断桥惊魂记,2002-04-12,2002-04
国际回声,2002-04-12,2002-04
欧美不断较劲,2002-04-12,2002-04
盟友的“美国观”,2002-04-12,2002-04
“泛欧”情结与“唯美”主义,2002-04-12,2002-04
美国人怎么看欧洲人,2002-04-12,2002-04
海边拾贝,2002-04-12,2002-04
尝尝等待的滋味,2002-04-12,2002-04
春的韵律·春的时尚,2002-04-12,2002-04
什么是无公害食品、绿色食品、有机食品,2002-04-12,2002-04
泰国是中国游客出境游首选目的地,2002-04-12,2002-04
中青旅换了一张“脸”,2002-04-12,2002-04
上海将在境外开设商品贸易中心,2002-04-12,2002-04
汇款到乡下咋这么难？,2002-04-12,2002-04
冰城：成年人也爱玩玩具,2002-04-12,2002-04
笔记本电脑缘何降价,2002-04-12,2002-04
蔡振华，祖国为你自豪,2002-04-12,2002-04
世界杯飞鸿,2002-04-12,2002-04
韩国大嫂热情助阵,2002-04-12,2002-04
东京街头彩旗飘飘,2002-04-12,2002-04
各国警察共保安全,2002-04-12,2002-04
波波夫未到圆梦时,2002-04-12,2002-04
周末体育赛事精彩纷呈,2002-04-12,2002-04
不像明星的李琳,2002-04-12,2002-04
五月，北京再掀“红色浪潮”,2002-04-12,2002-04
中国的太阳,2002-04-12,2002-04
多创作几首环保歌曲,2002-04-12,2002-04
秦桧也成了正面人物,2002-04-12,2002-04
如此“争抢”令人烦,2002-04-12,2002-04
“一语之劳”有何难,2002-04-12,2002-04
走，看相声去！,2002-04-12,2002-04
“形形色色”的广告,2002-04-12,2002-04
话剧国家队正式亮相,2002-04-12,2002-04
赵本山、王小丫票选获奖,2002-04-12,2002-04
演艺界为长城披上绿装,2002-04-12,2002-04
众明星为绿色喝彩,2002-04-12,2002-04
江主席继续在德国访问,2002-04-13,2002-04
江主席访问德国萨克森州,2002-04-13,2002-04
朱镕基总理致辞,2002-04-13,2002-04
为了群众生活更美好,2002-04-13,2002-04
携手共创新世纪亚洲美好未来,2002-04-13,2002-04
李岚清会见来华参加上海合作组织成员国文化部长会晤的外方代表,2002-04-13,2002-04
北京地区天气预报,2002-04-13,2002-04
博鳌亚洲论坛首届年会开幕,2002-04-13,2002-04
中国交通建设博览会在京举办,2002-04-13,2002-04
科博会（国际周）建筑论坛将举行,2002-04-13,2002-04
中德城市气候国际学术研讨会举行,2002-04-13,2002-04
法兰克福展览公司在华设立子公司,2002-04-13,2002-04
济南在京举办名优产品展览,2002-04-13,2002-04
当代和海尔共建“筑屋工作室”,2002-04-13,2002-04
城市水价改革政策出台,2002-04-13,2002-04
更好地落实妇女权益保障法,2002-04-13,2002-04
大力发展网络银行服务,2002-04-13,2002-04
人大内司委在川检查执法,2002-04-13,2002-04
供销社要推动农业产业化进程,2002-04-13,2002-04
第六届“台交会”在厦门开幕,2002-04-13,2002-04
国寿北京分公司首季保费猛增,2002-04-13,2002-04
中方声明保留采取进一步措施的权利,2002-04-13,2002-04
戏剧梅花十九度绽放,2002-04-13,2002-04
气象局公开招聘研究所长,2002-04-13,2002-04
一季度实际利用外资增长近三成,2002-04-13,2002-04
进一步提高动植物检疫执法水平,2002-04-13,2002-04
为了群众生活更美好,2002-04-13,2002-04
江主席再访汽车城,2002-04-13,2002-04
巴要求调查以军屠杀行径 沙龙称有恐怖就没有和平,2002-04-13,2002-04
里约集团峰会开幕,2002-04-13,2002-04
古欢迎卡特做客哈瓦那,2002-04-13,2002-04
