推进资源性产品价格和环保收费改革,2008-12-14,2008-12
把这片红色的土地建设得更加美丽,2008-12-14,2008-12
中日韩领导人会议发表三国合作行动计划,2008-12-14,2008-12
中日韩《三国伙伴关系联合声明》,2008-12-14,2008-12
二〇〇八年联合国气候大会闭幕,2008-12-14,2008-12
温家宝出席中日韩领导人会议,2008-12-14,2008-12
中日韩《国际金融和经济问题的联合声明》,2008-12-14,2008-12
戴秉国会见赖斯和美总统国家安全事务助理,2008-12-14,2008-12
中巴关系现状与未来学术研讨会举行,2008-12-14,2008-12
深化合作 共克时艰,2008-12-14,2008-12
改革创新 科学发展,2008-12-14,2008-12
抗灾救灾优秀电视节目表彰会举行,2008-12-14,2008-12
纪念南京大屠杀同胞遇难71周年,2008-12-14,2008-12
改革开放给了我们好机遇（我的亲历）,2008-12-14,2008-12
春蕾女童感受北京（新闻摄影）,2008-12-14,2008-12
中国全面小康十大示范县市评选揭晓,2008-12-14,2008-12
朱月华同志逝世,2008-12-14,2008-12
我变成了地道的城里人（我的亲历）,2008-12-14,2008-12
张文碧同志逝世,2008-12-14,2008-12
农业大发展  农民得实惠,2008-12-14,2008-12
开启新的30年,2008-12-14,2008-12
农村改革发展30年大事记,2008-12-14,2008-12
讲述农村30年,2008-12-14,2008-12
讲述农村30年,2008-12-14,2008-12
阳光下的大茶叶胡同（中国画）,2008-12-14,2008-12
色和水染笔带情,2008-12-14,2008-12
兴衰 蜕变 坚守（中国文化三十年）,2008-12-14,2008-12
有容之大（艺坛走笔）,2008-12-14,2008-12
艺坛风景线,2008-12-14,2008-12
通过战胜金融危机提升我国经济水平,2008-12-15,2008-12
同心促发展奋力渡难关,2008-12-15,2008-12
立足扩大内需依靠改革开放保持经济增长,2008-12-15,2008-12
把保持经济平稳较快发展作为首要任务,2008-12-15,2008-12
坚持科学发展 注重改善民生,2008-12-15,2008-12
同心促发展奋力渡难关,2008-12-15,2008-12
把保持经济平稳较快发展作为首要任务,2008-12-15,2008-12
“改革开放三十年中国环保事业”高峰论坛举行,2008-12-15,2008-12
继续团结奋斗 开创各项事业发展新局面,2008-12-15,2008-12
我国将在今年底或明年初发放3G牌照,2008-12-15,2008-12
坚持把发展作为第一要务坚定不移地走新型工业化道路,2008-12-15,2008-12
我家的三大观念转变（我的亲历）,2008-12-15,2008-12
珍惜机遇 务实创新 万众  一心把各项事业推向前进,2008-12-15,2008-12
率中央代表团第一分团在崇左慰问各族干部群众,2008-12-15,2008-12
美国汽车三巨头徘徊在破产边缘,2008-12-15,2008-12
布什突访伊拉克,2008-12-15,2008-12
日韩媒体积极评价中日韩领导人会议,2008-12-15,2008-12
务实推进国际金融体系改革（国际论坛）,2008-12-15,2008-12
尼泊尔要求联合国特派团延长任期,2008-12-15,2008-12
巴基斯坦将推进巴中务实合作,2008-12-15,2008-12
美报说美朝磋商朝交响乐团访美事宜,2008-12-15,2008-12
中华美国学会理事会议在京举行,2008-12-15,2008-12
中国让我有家的感觉（感受中国改革开放（二十五））,2008-12-15,2008-12
土库曼斯坦议会选举折射国家变革,2008-12-15,2008-12
戴秉国会见美国前国务卿奥尔布赖特等友人,2008-12-15,2008-12
汪德方同志逝世,2008-12-15,2008-12
宁波：从开放立市到开放强市（经典中国辉煌３０年）,2008-12-15,2008-12
《吉祥哈达——西藏大型文化艺术展》举行,2008-12-15,2008-12
农工党十四届二中全会举行,2008-12-15,2008-12
首届津台投资合作洽谈会举行,2008-12-15,2008-12
志愿者的世界很阳光（人民论坛）,2008-12-15,2008-12
以和平为念  以发展为重（纪念《告台湾同胞书》发表30周年）,2008-12-15,2008-12
立足扩大内需依靠改革开放保持经济增长,2008-12-15,2008-12
网上报名引发支付烦恼,2008-12-15,2008-12
南极科考开始大规模卸货（我随“雪龙”闯南极）,2008-12-15,2008-12
“三通”助推台湾经济,2008-12-15,2008-12
“三通”启动 两岸双赢（热点解读）,2008-12-15,2008-12
抓住“三通”造就的新契机（人民时评）,2008-12-15,2008-12
世界格局中的中日战略互惠关系,2008-12-15,2008-12
广东百种出版物纪念改革开放30年,2008-12-15,2008-12
龙门石窟别墅群将被拆除（连续报道）,2008-12-15,2008-12
硕士研究生招生同比增长5%,2008-12-15,2008-12
专家呼吁广告代言需担社会责任,2008-12-15,2008-12
中国企业首次打入高端地铁车辆市场,2008-12-15,2008-12
明年广义货币供应量争取增长17%,2008-12-15,2008-12
首个木本油料产业示范区落户云南,2008-12-15,2008-12
浙江衢州开通“金融服务110”,2008-12-15,2008-12
环评为科学发展护航,2008-12-15,2008-12
新提法释放新信号（经济聚焦）,2008-12-15,2008-12
触摸30年,2008-12-15,2008-12
风浪中的营救,2008-12-15,2008-12
助四川灾区女性自立,2008-12-15,2008-12
为老百姓办事尽心一点，真的很难吗？（声音）,2008-12-15,2008-12
300余名劳模参观考察改革开放成果,2008-12-15,2008-12
扎实推进农村基层党风廉政建设（干部说干事）,2008-12-15,2008-12
把握劳动力转移新变化 开创农村发展新局面（互动天地）,2008-12-15,2008-12
为经济社会科学发展提供保障,2008-12-15,2008-12
喜看农村劳动力转移新气象（时论精粹）,2008-12-15,2008-12
马龙郭焱男女单打折桂（动感２００８）,2008-12-15,2008-12
中国选手夺得十六枚金牌,2008-12-15,2008-12
庞清/佟健获双人滑冠军,2008-12-15,2008-12
联赛，盘活市场这局棋（联赛面面观④）,2008-12-15,2008-12
欧内勋三扩院门,2008-12-15,2008-12
30年，3大变化,2008-12-15,2008-12
改  革  正未有穷期,2008-12-15,2008-12
改革开放照亮中国（纪念改革开放３０年）,2008-12-15,2008-12
正视“成长的烦恼”（金海观潮）,2008-12-15,2008-12
变迁,2008-12-15,2008-12
迈向市场  沧桑巨变（纪念改革开放30年）,2008-12-15,2008-12
市场化改革四阶段,2008-12-15,2008-12
中国企业改革大事记,2008-12-15,2008-12
三大转变（纪念改革开放３０年）,2008-12-15,2008-12
贾庆林会见香港中华总商会访问团,2008-12-16,2008-12
吴邦国主持召开第十五次委员长会议,2008-12-16,2008-12
30年不变的时代呼声,2008-12-16,2008-12
两岸“三通”迈出历史性步伐,2008-12-16,2008-12
同心同德 振奋精神 锐意进取 扎实工作  为建设创新型国家作出新的更大贡献,2008-12-16,2008-12
在纪念中国科协成立50周年大会上的讲话,2008-12-16,2008-12
更好更快地把我国科技事业推向前进,2008-12-16,2008-12
英国首相表示与印巴进行反恐合作,2008-12-16,2008-12
布什突访阿富汗,2008-12-16,2008-12
《东盟宪章》正式生效,2008-12-16,2008-12
阿披实当选泰国总理,2008-12-16,2008-12
中美关系发展有利世界繁荣（国际论坛）,2008-12-16,2008-12
中韩友协媒体委员会成立并启动联谊活动,2008-12-16,2008-12
中印举行防务安全磋商,2008-12-16,2008-12
柬埔寨国王西哈莫尼会见陈至立,2008-12-16,2008-12
美选举墨守祖宗之法,2008-12-16,2008-12
纪念中美建交30周年国际研讨会举行,2008-12-16,2008-12
吴邦国主持召开第十五次委员长会议,2008-12-16,2008-12
安哥拉总统多斯桑托斯（人物介绍）,2008-12-16,2008-12
吴邦国会见亚美尼亚国民会议主席,2008-12-16,2008-12
我代表将出席安理会索马里海盗问题部长级会议,2008-12-16,2008-12
朝鲜劳动党中央书记崔泰福会见中共友好代表团,2008-12-16,2008-12
加快高新技术产业化  为建设创新型国家作出新贡献,2008-12-16,2008-12
开好高水平的民主生活会,2008-12-16,2008-12
30年不变的时代呼声,2008-12-16,2008-12
学习实践活动要为保发展保民生保稳定  保中央决策部署落实提供坚强保证,2008-12-16,2008-12
贯彻落实中央经济工作会议精神  保持经济平稳较快发展,2008-12-16,2008-12
60年来第一艘,2008-12-16,2008-12
从此鸿雁不辗转,2008-12-16,2008-12
两岸空管首次直接对话,2008-12-16,2008-12
两岸海运直航首航仪式举行,2008-12-16,2008-12
两岸同时发行邮品,2008-12-16,2008-12
两岸“三通”梦圆,2008-12-16,2008-12
等待直航逾十载,2008-12-16,2008-12
海峡两岸空运包机直航启动,2008-12-16,2008-12
越南计划筹措６０亿美元刺激经济,2008-12-16,2008-12
假如弗里德曼还活着（大千絮语）,2008-12-16,2008-12
朝鲜平壤市正式开通３Ｇ手机通信,2008-12-16,2008-12
百年老店的最后悲情,2008-12-16,2008-12
法国中部持续降雪,2008-12-16,2008-12
经济学家预测美联储将继续降息,2008-12-16,2008-12
美国纽约州进入紧急状态,2008-12-16,2008-12
铁骨柔情展风范（时代先锋）,2008-12-16,2008-12
温州：敢为人先的发展之路（经典中国辉煌３０年）,2008-12-16,2008-12
公告,2008-12-16,2008-12
改革开放30年军营新闻人物评选揭晓,2008-12-16,2008-12
服务西部地区  服务广大农村（深入开展学习实践科学发展观活动）,2008-12-16,2008-12
加强金融服务  支持灾区重建（深入开展学习实践科学发展观活动）,2008-12-16,2008-12
中国民主建国会九届二中全会在京召开,2008-12-16,2008-12
30年乡镇企业对经济社会贡献巨大,2008-12-16,2008-12
福建26人入选“中国好人榜”,2008-12-16,2008-12
实施三项制度  推进改革发展（深入开展学习实践科学发展观活动）,2008-12-16,2008-12
专题,2008-12-16,2008-12
300本图书记录改革开放,2008-12-16,2008-12
中医坐堂试点扩至48个地区,2008-12-16,2008-12
上海高中生近视率高达76%,2008-12-16,2008-12
敬畏观众才能收获掌声（快评）,2008-12-16,2008-12
《梅兰芳》重塑“大片”之美（文化观察）,2008-12-16,2008-12
《浴血坚持》的历史自觉,2008-12-16,2008-12
坚持以科学发展观为指导  深入推进预防腐败工作,2008-12-16,2008-12
一切为了群众的利益（党的纪律检查工作辉煌30年）,2008-12-16,2008-12
公告,2008-12-16,2008-12
宁东煤电化基地项目开工,2008-12-16,2008-12
见证中国奇迹（感言）,2008-12-16,2008-12
三换电表（我的亲历）,2008-12-16,2008-12
“生态旅游”引投资促消费,2008-12-16,2008-12
七部门整治私屠滥宰病死猪肉非法交易,2008-12-16,2008-12
前十一个月央企营业收入超十万亿元,2008-12-16,2008-12
龙江乳业乘势而上,2008-12-16,2008-12
11月份货币供应量增长14.8%,2008-12-16,2008-12
如何看待工业增速回落（经济聚焦·岁末看形势④）,2008-12-16,2008-12
从零到世界第二,2008-12-16,2008-12
长江航道多措并举提升通航效率,2008-12-16,2008-12
沿海港口货物吞吐量与GDP的增长关系,2008-12-16,2008-12
我国交通运输改革发展的经验与展望,2008-12-16,2008-12
争当企业发展“助推器”,2008-12-16,2008-12
优化政治生态  促进科学发展（加强新形势下的领导班子思想政治建设系列报道之八）,2008-12-16,2008-12
党员成了“追星族”（创新与实践）,2008-12-16,2008-12
民情夜访 相约周三（创新与实践）,2008-12-16,2008-12
广东阳江核电站正式开工,2008-12-17,2008-12
温家宝会见世界银行行长佐利克,2008-12-17,2008-12
唐山积聚能量保增长促发展,2008-12-17,2008-12
上海世博会倒计时500天,2008-12-17,2008-12
安哥拉总统抵京访华,2008-12-17,2008-12
深入学习实践科学发展观  不断增强我国出版业的竞争力和影响力,2008-12-17,2008-12
胡锦涛《在纪念中国科协成立50周年大会上的讲话》单行本出版,2008-12-17,2008-12
习近平会见巴基斯坦参联会主席,2008-12-17,2008-12
历史的契机等待我们把握,2008-12-17,2008-12
福州：宜居城市领舞海峡西岸（经典中国辉煌３０年）,2008-12-17,2008-12
李克强将出访印尼、埃及和科威特,2008-12-17,2008-12
突出实践特色 支持扩大内需（深入开展学习实践科学发展观活动）,2008-12-17,2008-12
加大信贷投入 做好融资服务（深入开展学习实践科学发展观活动）,2008-12-17,2008-12
广东阳江核电站正式开工,2008-12-17,2008-12
李克强会见世界银行行长佐利克,2008-12-17,2008-12
加强交流为区域经济社会发展做贡献,2008-12-17,2008-12
历史的契机等待我们把握,2008-12-17,2008-12
深入学习实践科学发展观  不断增强我国出版业的竞争力和影响力,2008-12-17,2008-12
调整税收政策 确保经济增长（深入开展学习实践科学发展观活动）,2008-12-17,2008-12
勇挑重担中央企业要发挥顶梁柱作用,2008-12-17,2008-12
李建国会见亚美尼亚国民会议主席,2008-12-17,2008-12
中美举行第六次战略对话,2008-12-17,2008-12
中东问题有关四方强调支持巴以继续进行和谈,2008-12-17,2008-12
国务院新闻办举行新年招待会,2008-12-17,2008-12
黑山共和国正式递交加入欧盟申请,2008-12-17,2008-12
人民网走出跨越“国门”第一步,2008-12-17,2008-12
梁光烈会见巴基斯坦参联会主席,2008-12-17,2008-12
美国呼吁朝鲜接受核设施验证议定书,2008-12-17,2008-12
杨洁篪同马尔代夫外长会谈,2008-12-17,2008-12
俄美未就反导及削减战略武器问题达成共识,2008-12-17,2008-12
第三届犹太伊斯兰教和平大会呼吁巴以和解,2008-12-17,2008-12
外交部举行例行记者会,2008-12-17,2008-12
“飞鞋袭击”的背后（国际论坛）,2008-12-17,2008-12
高举中国特色社会主义伟大旗帜  不断开创国防和军队现代化建设新局面,2008-12-17,2008-12
改革路上结硕果 根深叶茂万年青,2008-12-17,2008-12
矛盾不上交（人民论坛）,2008-12-17,2008-12
全国政法机关经受考验服务大局,2008-12-17,2008-12
坚持不懈地抓好党的创新理论武装工作  进一步把全军官兵凝聚在中国特色社会主义伟大旗帜下,2008-12-17,2008-12
学习贯彻胡锦涛总书记致中国人权研究会信,2008-12-17,2008-12
贺国强会见俄罗斯联邦总统监察署代表团,2008-12-17,2008-12
扎实推进农村党风廉政建设 为农村改革发展作出贡献,2008-12-17,2008-12
木耳人家（我的亲历）,2008-12-17,2008-12
改革未有穷期  中国还在路上（网友留言板）,2008-12-17,2008-12
福州：宜居城市领舞海峡西岸（经典中国辉煌３０年）,2008-12-17,2008-12
我们要“保”怎样的“增长”（人民时评）,2008-12-17,2008-12
“团团圆圆”23日赴台,2008-12-17,2008-12
谁“黑”了食品添加剂？（热点解读）,2008-12-17,2008-12
欧佩克轮值主席称成员国同意削减原油产量,2008-12-17,2008-12
走进波兰清洁煤田,2008-12-17,2008-12
直面冬日裁员潮（独家视角）,2008-12-17,2008-12
金融欺诈案拖累美股走低,2008-12-17,2008-12
科技新知,2008-12-17,2008-12
梳理人力资源市场化配置进程（新书评介）,2008-12-17,2008-12
彪炳史册的伟大实践（纪念改革开放３０周年）,2008-12-17,2008-12
扩大内需应重点启动农村消费（学者论学问）,2008-12-17,2008-12
在新的历史起点谋划和推进法治建设（纪念改革开放３０周年）,2008-12-17,2008-12
加强村级组织建设  推动农村改革发展（干部说干事）,2008-12-17,2008-12
独具特色的通俗理论读物（新书评介）,2008-12-17,2008-12
公告,2008-12-17,2008-12
公告,2008-12-17,2008-12
公告,2008-12-17,2008-12
武汉城市圈建现代林业示范区,2008-12-17,2008-12
对外开放30周年回顾展将举行,2008-12-17,2008-12
党报到门口,2008-12-17,2008-12
第九届国际汉语教学研讨会举行,2008-12-17,2008-12
中国致公党十三届二中全会开幕,2008-12-17,2008-12
中国西藏文化保护与发展协会一届五次常务理事会召开,2008-12-17,2008-12
科技发展要让老百姓得到好处,2008-12-17,2008-12
公告,2008-12-17,2008-12
国开行股份有限公司成立,2008-12-17,2008-12
张家港保税港区获准设立,2008-12-17,2008-12
500天后，相约上海（经济聚焦）,2008-12-17,2008-12
1—11月城镇固定资产投资增长26.8%,2008-12-17,2008-12
商务部新闻发言人就汽车零部件WTO争端案上诉机构报告发表谈话,2008-12-17,2008-12
保护农民工权益 我们在行动（独家）,2008-12-17,2008-12
返乡农民工最需要什么？（周三观察）,2008-12-17,2008-12
用法律为劳动者撑腰,2008-12-17,2008-12
在多党合作事业中阔步前进,2008-12-17,2008-12
党政部门应带头弃用纸质贺年卡,2008-12-17,2008-12
追寻“南丝路”,2008-12-17,2008-12
防止土地流转中的“非粮化”倾向（政声集萃）,2008-12-17,2008-12
推进温州民营经济创新发展的战略重点,2008-12-17,2008-12
专家评说——,2008-12-17,2008-12
温州民营企业必将率先走出困境,2008-12-17,2008-12
吴邦国会见塞拉利昂议长,2008-12-18,2008-12
温家宝主持召开国务院常务会议,2008-12-18,2008-12
湖北化危机为机遇力保又好又快发展,2008-12-18,2008-12
胡锦涛与安哥拉总统举行会谈,2008-12-18,2008-12
李克强会见亚美尼亚国民会议主席,2008-12-18,2008-12
伟大的转折 历史的丰碑,2008-12-18,2008-12
习近平和索尼娅·甘地致信祝贺,2008-12-18,2008-12
贾庆林吴伯雄连战将出席两岸经贸文化论坛,2008-12-18,2008-12
坚定必胜信心勇于迎接挑战 促进经济平稳较快发展  保障社会公平正义 维护社会和谐稳定,2008-12-18,2008-12
万个支部结对 万名党员帮扶（深入开展学习实践科学发展观活动）,2008-12-18,2008-12
今天现场直播纪念党的十一届三中全会召开30周年大会,2008-12-18,2008-12
广州：谋划未来放眼量（经典中国辉煌３０年）,2008-12-18,2008-12
第三届北京文博会开幕,2008-12-18,2008-12
想打赢练打赢 思发展谋发展（深入开展学习实践科学发展观活动）,2008-12-18,2008-12
温家宝主持召开国务院常务会议,2008-12-18,2008-12
明年起关税更优惠（政策解读）,2008-12-18,2008-12
坚定必胜信心勇于迎接挑战 促进经济平稳较快发展  保障社会公平正义 维护社会和谐稳定,2008-12-18,2008-12
优化开行方案 提升服务质量（深入开展学习实践科学发展观活动）,2008-12-18,2008-12
南共市首脑会议举行,2008-12-18,2008-12
安理会就打击索马里海盗通过决议,2008-12-18,2008-12
跟随总理“急行军”,2008-12-18,2008-12
我驻美使领馆庆祝中美建交三十周年,2008-12-18,2008-12
“中国的繁荣使世界受益”,2008-12-18,2008-12
寻求共识  增进合作,2008-12-18,2008-12
古巴正式加入里约集团,2008-12-18,2008-12
贸易保护主义损人不利己（国际论坛）,2008-12-18,2008-12
安理会支持巴以通过谈判达成全面和平协议,2008-12-18,2008-12
泰国国王批准阿披实为总理,2008-12-18,2008-12
南美国家联盟首脑会议举行,2008-12-18,2008-12
认真开展清理规范评比达标表彰  工作 努力取得人民满意的效果,2008-12-18,2008-12
农民喜领养老保险,2008-12-18,2008-12
改革开放三十年感言（人民论坛）,2008-12-18,2008-12
李源潮会见摩尔多瓦客人,2008-12-18,2008-12
王家瑞会见越南客人,2008-12-18,2008-12
王岐山会见金融稳定论坛主席,2008-12-18,2008-12
三代人的“篮球梦”（我的亲历）,2008-12-18,2008-12
国台办举行例行记者会,2008-12-18,2008-12
阿不来提·阿不都热西提会见亚洲宗教和平会议名誉主席,2008-12-18,2008-12
夯实基础保平安,2008-12-18,2008-12
侯祥麟同志逝世,2008-12-18,2008-12
机遇稍纵即逝 未来任重道远（网友留言板）,2008-12-18,2008-12
“振华4”轮逼退海盗,2008-12-18,2008-12
消费券如何“劝”消费？（热点解读）,2008-12-18,2008-12
公开征求意见面临两大考验（人民时评）,2008-12-18,2008-12
首批台湾水果抵达大陆,2008-12-18,2008-12
大变化孕育新格局（年终报道·全球扫描）,2008-12-18,2008-12
“寻找未来天文之星”活动在京启动,2008-12-18,2008-12
改革开放30年优秀出版成果展在京开展,2008-12-18,2008-12
我国行政管理体制改革进程的回顾,2008-12-18,2008-12
王保成：爱讲故事的“导弹王”（国防和军队建设）,2008-12-18,2008-12
“医药卫生扶贫”行动惠及7000多万农牧民,2008-12-18,2008-12
我国广播覆盖人口居世界首位,2008-12-18,2008-12
中央补助投资100亿元下达,2008-12-18,2008-12
厦门建发与台湾人寿成立合资公司,2008-12-18,2008-12
全国首家空港型综合保税区在京奠基,2008-12-18,2008-12
中联重科创混凝土泵送世界纪录,2008-12-18,2008-12
以港兴工 以工促农,2008-12-18,2008-12
旅客乘机物品限带措施调整,2008-12-18,2008-12
廉租房建设贷款可享优惠利率,2008-12-18,2008-12
“我参与起草的三个中央《决定》”（经济聚焦）,2008-12-18,2008-12
中国民俗学界的一部争气之作,2008-12-18,2008-12
社会消费品零售总额突破10万亿元,2008-12-18,2008-12
取消自行车登记制度,2008-12-18,2008-12
举报“吃拿卡要”最高奖万元,2008-12-18,2008-12
在尊重差异中求得和谐（声音）,2008-12-18,2008-12
妹妹嫁了个台湾郎（纪念《告台湾同胞书》发表30周年）,2008-12-18,2008-12
工会“两节”送温暖  重点关注四类群体,2008-12-18,2008-12
节假日预约办公已成为工作常态（２００８政府创新回头看）,2008-12-18,2008-12
民警要提拔，先抓一个贼？,2008-12-18,2008-12
藏族和其他少数民族超九成,2008-12-18,2008-12
城乡衔接构建治安防控网络,2008-12-18,2008-12
集资建房与非法集资有本质区别,2008-12-18,2008-12
加快建设国际一流电视强势媒体,2008-12-18,2008-12
国门初开的岁月,2008-12-18,2008-12
３０年十件大事,2008-12-18,2008-12
当今世界，谁都不能关起门来（名家有约）,2008-12-18,2008-12
环保公众力量影响决策,2008-12-18,2008-12
三十年十件大事,2008-12-18,2008-12
面朝大海 春暖花开（观澜）,2008-12-18,2008-12
教育   万里春风第一枝,2008-12-18,2008-12
科技中国跻身第二方阵,2008-12-18,2008-12
教育   万里春风第一枝,2008-12-18,2008-12
环保公众力量影响决策,2008-12-18,2008-12
当今世界，谁都不能关起门来（名家有约）,2008-12-18,2008-12
面朝大海 春暖花开（观澜）,2008-12-18,2008-12
科技中国跻身第二方阵,2008-12-18,2008-12
三十年十件大事,2008-12-18,2008-12
以人道写商道,2008-12-18,2008-12
潘学聪书法展举办,2008-12-18,2008-12
我们走在大路上（纪念改革开放３０周年特选作品）,2008-12-18,2008-12
书画虚热遇寒流（文艺点评）,2008-12-18,2008-12
款款绣出五彩烟霞（新作鉴赏）,2008-12-18,2008-12
在纪念党的十一届三中全会召开30周年大会上的讲话,2008-12-19,2008-12
纪念党的十一届三中全会召开30周年大会在京隆重举行,2008-12-19,2008-12
在纪念党的十一届三中全会召开30周年大会上的讲话,2008-12-19,2008-12
纪念党的十一届三中全会召开30周年大会在京隆重举行,2008-12-19,2008-12
将改革开放伟大事业继续推向前进（社论）,2008-12-19,2008-12
在纪念党的十一届三中全会召开30周年大会上的讲话,2008-12-19,2008-12
今年新增一千亿元中央投资计划已全部下达,2008-12-19,2008-12
温家宝主持召开国务院常务会议,2008-12-19,2008-12
国家决定实施成品油价格和税费改革,2008-12-19,2008-12
坚持科学发展 推动政法工作改革创新,2008-12-19,2008-12
《改革开放三十年重要文献选编》出版发行,2008-12-19,2008-12
“始终坚持改革开放的正确方向”,2008-12-19,2008-12
“放歌新时代——歌唱改革开放三十周年文艺晚会”在京举行,2008-12-19,2008-12
中国对外开放三十周年回顾展开幕,2008-12-19,2008-12
但羡梨园春色秀,2008-12-19,2008-12
开放式发展成就经贸大国,2008-12-19,2008-12
孟加拉国解除紧急状态  恢复民主进程,2008-12-19,2008-12
梁光烈会见韩国国防大学校长,2008-12-19,2008-12
美联储降息至历史最低点的用意,2008-12-19,2008-12
孟建柱与吉内务部长举行会谈,2008-12-19,2008-12
外交部举行例行记者会,2008-12-19,2008-12
千名日本青少年抵京访华,2008-12-19,2008-12
中卡庆祝建交20周年,2008-12-19,2008-12
无奈“买路钱”（国际随笔）,2008-12-19,2008-12
刘延东会见俄文化部长,2008-12-19,2008-12
潘基文强调国际社会共同应对危机,2008-12-19,2008-12
索马里政局乱象不断,2008-12-19,2008-12
拉美人的拉美（国际论坛）,2008-12-19,2008-12
强化基层基础工作  排查调处矛盾纠纷,2008-12-19,2008-12
人民日报社外事局和人民网举办新年联谊会,2008-12-19,2008-12
南极内陆队出发建“昆仑”,2008-12-19,2008-12
高考阅卷30载（我的亲历）,2008-12-19,2008-12
改革开放对国家对香港对世界影响深远,2008-12-19,2008-12
国民党主席吴伯雄启程参加两岸经贸文化论坛,2008-12-19,2008-12
湛江：铆足劲头迈大步（经典中国辉煌３０年）,2008-12-19,2008-12
“连横纪念馆—台湾文化展”揭幕,2008-12-19,2008-12
百度成立上海研发中心,2008-12-19,2008-12
三十年与祖国同在（港澳在线）,2008-12-19,2008-12
中国国民党高雄县委员会访问团首次参访福州,2008-12-19,2008-12
去年我国小康实现程度为72.9％,2008-12-19,2008-12
新政策意在提振楼市（经济聚焦）,2008-12-19,2008-12
我国节能建筑实现由“小”到“大”的突破,2008-12-19,2008-12
六大环保督查中心全部组建到位,2008-12-19,2008-12
我国最大四层铁路立交桥群现雏形,2008-12-19,2008-12
金融之“危”中的实体之“机”（感言·特别策划）,2008-12-19,2008-12
