首个内陆保税港区落户重庆,2008-12-19,2008-12
世界首个±660千伏直流输电工程开工,2008-12-19,2008-12
30年制服变换  看时代演进,2008-12-19,2008-12
“金色旋律”演唱会  记录如歌30年,2008-12-19,2008-12
河北返乡农民工可入读中职学校,2008-12-19,2008-12
龙门石窟别墅群被强制拆除（连续报道）,2008-12-19,2008-12
二〇〇九年将晚到一秒,2008-12-19,2008-12
民族精神是最核心的软实力（新语）,2008-12-19,2008-12
239件美术作品展示改革开放30年,2008-12-19,2008-12
海外学习汉语人数超过四千万,2008-12-19,2008-12
文理分科越来越早（文化观察·关注高中文理分科②）,2008-12-19,2008-12
周末赛事,2008-12-19,2008-12
全国经常参加体育锻炼人数不足30％,2008-12-19,2008-12
第十一届全运会奖牌样式发布,2008-12-19,2008-12
体坛速递,2008-12-19,2008-12
民族体育进课堂,2008-12-19,2008-12
寒冬滑雪热 着装要精心（健身之道）,2008-12-19,2008-12
广州 开放学校体育设施遇烦恼,2008-12-19,2008-12
加强诚信道德建设 促进企业健康成长,2008-12-19,2008-12
企业文化建设风向标,2008-12-19,2008-12
把脉企业文化  重振中国信心,2008-12-19,2008-12
创新文化引领中国创造,2008-12-19,2008-12
创新进行时,2008-12-19,2008-12
共建和谐油田,2008-12-19,2008-12
阅读提示,2008-12-19,2008-12
在改革创新中不断超越,2008-12-19,2008-12
中华文化成就和谐菲尼克斯,2008-12-19,2008-12
燕山石化  演绎“绿色”企业文化,2008-12-19,2008-12
开创服务文化新境界,2008-12-19,2008-12
理想凝聚力量 责任铸就卓越,2008-12-19,2008-12
我们为什么需要企业文化,2008-12-19,2008-12
胡锦涛《在纪念党的十一届三中全会召开30周年大会上的讲话》单行本出版,2008-12-20,2008-12
贾庆林会见中国国民党主席吴伯雄,2008-12-20,2008-12
在新的历史起点上努力开创高校党建工作新局面,2008-12-20,2008-12
吴邦国温家宝分别会见安哥拉总统,2008-12-20,2008-12
胡锦涛分别会见曾荫权何厚铧,2008-12-20,2008-12
技改助推山东经济平稳增长,2008-12-20,2008-12
温家宝分别会见曾荫权何厚铧,2008-12-20,2008-12
贾庆林会见中国国民党荣誉主席连战,2008-12-20,2008-12
成品油消费税政策明年起调整,2008-12-20,2008-12
保发展保大局促进工业经济平稳较快发展,2008-12-20,2008-12
农村档案资源共享工程将启动,2008-12-20,2008-12
福州湾边大桥建成通车,2008-12-20,2008-12
中国国际建设环境友好型社会成果展开幕,2008-12-20,2008-12
循环经济促进法实施座谈会举行,2008-12-20,2008-12
全国政协纪念改革开放三十周年书画作品展开幕,2008-12-20,2008-12
深入开展学习实践科学发展观活动,2008-12-20,2008-12
坚持不懈抓基层打基础苦练基本功,2008-12-20,2008-12
中美签署大熊猫续租协议,2008-12-20,2008-12
美《科学》杂志预测２００９年科研热点,2008-12-20,2008-12
精诚合作五十年,2008-12-20,2008-12
蒙古国总统总理分别会见中共代表团,2008-12-20,2008-12
高度评价胡锦涛发表的重要讲话,2008-12-20,2008-12
日本首相在《日本与中国》发表新年贺词,2008-12-20,2008-12
我驻纽约总领馆庆祝中美建交30周年,2008-12-20,2008-12
为应对金融危机提供司法保障,2008-12-20,2008-12
王家瑞出访蒙古国、越南,2008-12-20,2008-12
纪念中国天主教自选自圣五十周年座谈会召开,2008-12-20,2008-12
切实加强反腐倡廉理论政策研究  促进党风廉政建设和反腐败斗争,2008-12-20,2008-12
认真学习贯彻胡总书记在纪念党的十一届三中全会召开三十周年大会上重要讲话,2008-12-20,2008-12
在新的历史起点上努力开创高校党建工作新局面,2008-12-20,2008-12
为维护改革发展稳定大局作贡献,2008-12-20,2008-12
新闻摄影,2008-12-20,2008-12
人民政协新闻宣传工作要突出重点体现特色增强实效,2008-12-20,2008-12
统一战线各界人士纪念中共十一届三中全会召开三十周年座谈会召开,2008-12-20,2008-12
新加坡恢复进口我国乳及含乳食品,2008-12-20,2008-12
《北京记忆》回溯“人民生活史”,2008-12-20,2008-12
司法行政体制改革有序推进,2008-12-20,2008-12
陕西延长石油销售突破600亿元,2008-12-20,2008-12
人民网推出专题网站“中国西藏网”,2008-12-20,2008-12
“中国好人榜”（南昌）颁奖仪式举行,2008-12-20,2008-12
北海：白鹭翩飞 产业腾跃（经典中国辉煌30年）,2008-12-20,2008-12
国产电子（纸）阅读器质量上乘,2008-12-20,2008-12
中国建院附中“建设生态文明从我做起”倡议活动启动,2008-12-20,2008-12
人民网开通“知识产权”频道,2008-12-20,2008-12
30年城乡面貌发生巨变,2008-12-20,2008-12
文化界纪念郑振铎诞辰110周年,2008-12-20,2008-12
温暖工程百万农民工培训圆满完成,2008-12-20,2008-12
法治是改革开放的有力保障,2008-12-20,2008-12
生动展现改革开放光辉历程的鸿篇巨制,2008-12-20,2008-12
科技强军，理论先行,2008-12-20,2008-12
北京鱿鱼（纪念改革开放30周年特选作品）,2008-12-20,2008-12
百花（中国画）,2008-12-20,2008-12
信用文化开掘和谐主题,2008-12-20,2008-12
清新（中国画）,2008-12-20,2008-12
《中国美术家精品集》出版,2008-12-20,2008-12
秋游神农架,2008-12-20,2008-12
时光的风（世说心语）,2008-12-20,2008-12
田园偶记,2008-12-20,2008-12
岁月苔痕（纪念改革开放30周年特选作品）,2008-12-20,2008-12
《改革开放三十周年》纪念邮票发行（邮票新赏）,2008-12-20,2008-12
美玉不琢佳创意,2008-12-20,2008-12
中阿两国领导人互致贺电热烈庆祝两国建交50周年,2008-12-21,2008-12
“中日青少年友好交流年”闭幕,2008-12-21,2008-12
纪念中国电视事业诞生暨中央电视台建台50周年大会在京举行,2008-12-21,2008-12
第四届两岸经贸文化论坛在上海隆重开幕,2008-12-21,2008-12
纪念党的十一届三中全会召开三十周年理论研讨会举行,2008-12-21,2008-12
学习实践科学发展观活动要与学习贯彻胡锦涛重要讲话和中央经济工作会议精神结合起来,2008-12-21,2008-12
李克强开始对印尼进行正式访问,2008-12-21,2008-12
明天会更好,2008-12-21,2008-12
中日青少年友好交流年活动闭幕招待会举行,2008-12-21,2008-12
大冬会火炬传递启动仪式举行,2008-12-21,2008-12
“中日青少年友好交流年”闭幕,2008-12-21,2008-12
冬至了，灾区群众如何过冬,2008-12-21,2008-12
学习实践科学发展观活动要与学习贯彻胡锦涛  重要讲话和中央经济工作会议精神结合起来,2008-12-21,2008-12
国务院办公厅关于切实做好当前农民工工作的通知,2008-12-21,2008-12
美国政府出手救助汽车业,2008-12-21,2008-12
泰国组成新内阁,2008-12-21,2008-12
拉美一体化新看点,2008-12-21,2008-12
赖斯认为朝鲜最终将接受核验证协议,2008-12-21,2008-12
基辅遭遇空前“寒流”,2008-12-21,2008-12
李克强开始对印尼进行正式访问,2008-12-21,2008-12
党旗，飘扬在知识高地(经典中国辉煌30年),2008-12-21,2008-12
我国海军舰艇赴亚丁湾、索马里海域护航,2008-12-21,2008-12
俞正声会见中国国民党主席吴伯雄,2008-12-21,2008-12
皖浙赣三省交界高速公路贯通（新闻摄影）,2008-12-21,2008-12
第四届两岸经贸文化论坛在上海隆重开幕,2008-12-21,2008-12
坚定信心战胜挑战全力维护国家安全和社会稳定,2008-12-21,2008-12
纪念党的十一届三中全会召开三十周年理论研讨会举行,2008-12-21,2008-12
俞正声会见中国国民党荣誉主席连战,2008-12-21,2008-12
一周农事,2008-12-21,2008-12
狼，羊，怎么取舍？,2008-12-21,2008-12
专家建议,2008-12-21,2008-12
水果坐上“过山车”,2008-12-21,2008-12
“麻雀”要变“金凤凰”（话说新农村）,2008-12-21,2008-12
寻访北京“最美的乡村”,2008-12-21,2008-12
同是小额信贷 这个项目不一般,2008-12-21,2008-12
农民新年发“药”财,2008-12-21,2008-12
农村新事,2008-12-21,2008-12
皂市镇开展阳光便民服务,2008-12-21,2008-12
干部换脑筋 百姓得实惠,2008-12-21,2008-12
过磷酸钙用作水冲肥不合理（农化服务广场）,2008-12-21,2008-12
环境整洁带热乡村旅游,2008-12-21,2008-12
服务发展 保障民生,2008-12-21,2008-12
让贫困学子成就梦想,2008-12-21,2008-12
第四届中国家庭文化艺术节在京结束,2008-12-21,2008-12
王胜俊当选中国法官协会会长曹建明当选中国检察官协会会长,2008-12-21,2008-12
深入开展学习实践科学发展观活动,2008-12-21,2008-12
蒙牛伊利承诺乳品安全,2008-12-21,2008-12
歌声见证祖国成长,2008-12-21,2008-12
与时代同步 与人民同心,2008-12-21,2008-12
重温阅读的快乐,2008-12-21,2008-12
开拓国际关系研究新领域,2008-12-21,2008-12
共产党执政规律的有益探索,2008-12-21,2008-12
“论剑”丛书论改革发展（读书）,2008-12-21,2008-12
眼睛里的国度（读书）,2008-12-21,2008-12
用影像刻录瑶山文化,2008-12-21,2008-12
“干部大讲堂”谈领导素养（读书）,2008-12-21,2008-12
《冒险小虎队》“女生版”面世,2008-12-21,2008-12
讴歌光明的事业,2008-12-21,2008-12
英语网络教材上线公测,2008-12-21,2008-12
《熟视无睹》益人益己,2008-12-21,2008-12
《江泽民文选》民族文版出版发行,2008-12-22,2008-12
认真学习胡锦涛同志“12·18”重要讲话精神  努力开创党风廉政建设和反腐败斗争新局面,2008-12-22,2008-12
继续推进改革开放伟大事业的纲领性文献,2008-12-22,2008-12
中国与世界关系的历史性变化,2008-12-22,2008-12
第四届两岸经贸文化论坛在上海圆满闭幕,2008-12-22,2008-12
强军之路,2008-12-22,2008-12
温家宝主持召开国务院常务会议,2008-12-22,2008-12
李克强考察中国在印尼投资合作项目,2008-12-22,2008-12
在纪念党的十一届三中全会召开30周年理论研讨会上的讲话,2008-12-22,2008-12
中国改革开放有利世界繁荣,2008-12-22,2008-12
李克强考察中国在印尼投资合作项目,2008-12-22,2008-12
在纪念党的十一届三中全会召开30周年理论研讨会上的讲话,2008-12-22,2008-12
经济衰退压低国际油价（国际论坛）,2008-12-22,2008-12
“你们会有用武之地”,2008-12-22,2008-12
中国与世界关系的历史性变化,2008-12-22,2008-12
认真学习胡锦涛同志“12·18”重要讲话精神  努力开创党风廉政建设和反腐败斗争新局面,2008-12-22,2008-12
团结一心迎挑战抢抓机遇促发展,2008-12-22,2008-12
第六届“宋庆龄少年儿童发明奖”颁奖典礼举行,2008-12-22,2008-12
以举办世界大冬会为契机大力发展群众体育事业,2008-12-22,2008-12
加倍珍惜两岸和平发展新契机,2008-12-22,2008-12
京剧喜见后来人（人民论坛）,2008-12-22,2008-12
“中国文化发展战略与国家文化软实力”研讨会举办,2008-12-22,2008-12
第四届两岸经贸文化论坛在上海圆满闭幕,2008-12-22,2008-12
鼓励支持海外留学人员回国创新创业报效祖国,2008-12-22,2008-12
数九寒冬开始 北方大风降温,2008-12-22,2008-12
《正道直行——党风廉政建设的实践与思考》出版,2008-12-22,2008-12
82个具体问题理清发展思路（深入开展学习实践科学发展观活动）,2008-12-22,2008-12
五项监管措施确保运行安全（深入开展学习实践科学发展观活动）,2008-12-22,2008-12
两亿元补贴让居民过暖冬（深入开展学习实践科学发展观活动）,2008-12-22,2008-12
帮企业 稳就业,2008-12-22,2008-12
服务大局 奋发有为（经典中国辉煌３０年）,2008-12-22,2008-12
第三届北京国际文博会圆满落幕,2008-12-22,2008-12
二〇〇八，中国拥抱世界（年终报道中国·世界）,2008-12-22,2008-12
China加油！,2008-12-22,2008-12
在保持平稳较快发展中体现科学发展,2008-12-22,2008-12
集体主义精神的弘扬（第五届中国公民道德论坛论文选登）,2008-12-22,2008-12
深化司法体制改革应遵循哪些规律（学习通信）,2008-12-22,2008-12
把保持经济平稳较快发展作为首要任务（学习贯彻中央经济工作会议精神）,2008-12-22,2008-12
为党的思想理论建设修志存史（新书评介）,2008-12-22,2008-12
筑暖房送寒衣,2008-12-22,2008-12
冬至日，修新房杀年猪,2008-12-22,2008-12
强军之路,2008-12-22,2008-12
春天并不遥远（经济聚焦）,2008-12-22,2008-12
火车儿童票标准调高至1.5米,2008-12-22,2008-12
广州治水探索“公有民营”,2008-12-22,2008-12
中国经济百人榜颁奖典礼举行,2008-12-22,2008-12
ARJ21—700飞机转入试飞取证,2008-12-22,2008-12
我国电话用户逼近10亿,2008-12-22,2008-12
社区商业待破题  三多三少伤脑筋,2008-12-22,2008-12
１０项政策措施宣布,2008-12-22,2008-12
越是困难，越要强化“好”的意识（声音）,2008-12-22,2008-12
第四届两岸经贸文化论坛共同建议,2008-12-22,2008-12
示范高职毕业生就业率达96％,2008-12-22,2008-12
文理兼修可行吗？（文化观察·关注高中文理分科③）,2008-12-22,2008-12
新华网推出全球新闻搜索系统,2008-12-22,2008-12
我对京剧振兴很有信心（新语）,2008-12-22,2008-12
广东净化手机上网环境,2008-12-22,2008-12
逾两亿人网上看新闻,2008-12-22,2008-12
奋勇争先,2008-12-22,2008-12
国乒教练班子公布,2008-12-22,2008-12
上海山东分获男女冠军,2008-12-22,2008-12
北京龙潭湖体育产业园区被授予“国家体育产业基地”,2008-12-22,2008-12
中国足球队出访两战皆负,2008-12-22,2008-12
完善联赛  铁规护航（联赛面面观⑤）,2008-12-22,2008-12
港口搬到河南来（瞭望台）,2008-12-22,2008-12
楼市回暖要牵“牛鼻子”（经济茶座）,2008-12-22,2008-12
明年，仍值得期待（经济大势）,2008-12-22,2008-12
收获,2008-12-22,2008-12
让消费领跑经济（经济热点）,2008-12-22,2008-12
建行的“DNA改造”,2008-12-22,2008-12
银行业改革大事记（延伸阅读）,2008-12-22,2008-12
银企已成伙伴啦,2008-12-22,2008-12
《戴相龙金融文集》面世,2008-12-22,2008-12
增信贷与防风险并举（金海观潮）,2008-12-22,2008-12
新世纪全球公司讲坛在京举行,2008-12-22,2008-12
向真正的银行转变（经济聚焦·纪念改革开放30年）,2008-12-22,2008-12
“没有银行，啥事都办不成”,2008-12-22,2008-12
北京有了村镇银行,2008-12-22,2008-12
苏州高新区推出自助缴税系统,2008-12-22,2008-12
临沂海关“量、质”并举抓税收,2008-12-22,2008-12
体制三变立潮头,2008-12-22,2008-12
扭转工业经济下滑着力点在哪,2008-12-22,2008-12
把紧日子过成好日子（各抒己见）,2008-12-22,2008-12
从小代理到全球500强,2008-12-22,2008-12
三代人（纪念改革开放３０周年特选作品）,2008-12-22,2008-12
繁花似锦(中国画),2008-12-22,2008-12
换个角度看苏南（金台随感）,2008-12-22,2008-12
时间深处的美丽,2008-12-22,2008-12
春雷初记,2008-12-22,2008-12
大铜山,2008-12-22,2008-12
书法,2008-12-22,2008-12
小井庄,2008-12-22,2008-12
胡锦涛会见日本前首相福田康夫,2008-12-23,2008-12
深入把握党的十一届三中全会的重大历史贡献,2008-12-23,2008-12
李克强与印尼副总统卡拉举行会谈,2008-12-23,2008-12
群策群力  共渡难关,2008-12-23,2008-12
人大常委会第六次会议在京举行,2008-12-23,2008-12
殷切的勉励激情的奉献,2008-12-23,2008-12
努力使大学生“村官”下得去待得住干得好流得动,2008-12-23,2008-12
吴邦国贾庆林分别会见印尼客人,2008-12-23,2008-12
全国妇联纪念改革开放三十周年座谈会举行,2008-12-23,2008-12
群策群力  共渡难关,2008-12-23,2008-12
人大常委会第六次会议在京举行,2008-12-23,2008-12
太阳总要出来的,2008-12-23,2008-12
把扩大内需作为保增长的根本途径,2008-12-23,2008-12
“鸟巢”等13项奥运工程获鲁班奖,2008-12-23,2008-12
农业部解决农产品积压滞销难题,2008-12-23,2008-12
各级行政学院要围绕中心、服务大局  为保持经济平稳较快发展做出新的贡献,2008-12-23,2008-12
深入把握党的十一届三中全会的重大历史贡献,2008-12-23,2008-12
央行下调基准利率存款准备金率,2008-12-23,2008-12
李克强与印尼副总统卡拉举行会谈,2008-12-23,2008-12
危机考验国家动员能力（大千絮语）,2008-12-23,2008-12
白立忱会见印尼地方代表理事会主席,2008-12-23,2008-12
中阿建交50周年招待会举行,2008-12-23,2008-12
变局中更应自强（国际论坛）,2008-12-23,2008-12
日本１１月份贸易逆差为２２３４亿日元,2008-12-23,2008-12
中阿语言与文化交流研讨会在京举行,2008-12-23,2008-12
陈际瓦率中共友好代表团访问伊朗,2008-12-23,2008-12
俄议会上院通过《反腐败法》草案,2008-12-23,2008-12
伊朗将接收俄Ｓ—３００防空导弹系统,2008-12-23,2008-12
蒙古国国家大呼拉尔主席会见王家瑞,2008-12-23,2008-12
欧元区１０月份工业订单大幅下降,2008-12-23,2008-12
麦道夫骗局令人深思,2008-12-23,2008-12
欧佩克周平均油价上升,2008-12-23,2008-12
上海世博必成“尖兵”,2008-12-23,2008-12
有感于吴仁宝六换翻译（人民论坛）,2008-12-23,2008-12
国家大剧院“公众开放日”迎来万余观众,2008-12-23,2008-12
坚持改革创新 推动科学发展  不断开创我国教育事业发展新局面,2008-12-23,2008-12
宋堃同志逝世,2008-12-23,2008-12
加大工作力度深入开展文化科技卫生“三下乡”活动,2008-12-23,2008-12
殷切的勉励激情的奉献,2008-12-23,2008-12
《方毅传》和《方毅文集》出版,2008-12-23,2008-12
努力使大学生“村官”下得去待得住干得好流得动,2008-12-23,2008-12
一笔拉动内需的大单,2008-12-23,2008-12
为真理而歌唱（时代先锋）,2008-12-23,2008-12
“团团”“圆圆”今日赴台,2008-12-23,2008-12
紧紧团结在党的旗帜下（经典中国辉煌３０年）,2008-12-23,2008-12
解放思想气象新,2008-12-23,2008-12
马克思主义中国化成果的充分展示,2008-12-23,2008-12
北京老字号的文化内涵,2008-12-23,2008-12
改革开放以来马克思著作文本研究述评（哲学社会科学３０年）,2008-12-23,2008-12
深化反“围剿”历史研究  弘扬苏区革命精神,2008-12-23,2008-12
经济学期刊应成为改革开放的思想库（学术交流）,2008-12-23,2008-12
“新的发展阶段中效率和公平问题研究”课题结项,2008-12-23,2008-12
哲学是提高人生境界之学（学术随笔）,2008-12-23,2008-12
推进基本公共服务均等化的路径选择（观点）,2008-12-23,2008-12
公告,2008-12-23,2008-12
买早餐只能站着吃？（碰撞）,2008-12-23,2008-12
全国首个反垄断案件专项合议庭成立,2008-12-23,2008-12
四部法律草案  突出民生主题,2008-12-23,2008-12
惠台措施 寒冬送暖,2008-12-23,2008-12
以不变的诚信应对多变的市场（声音）,2008-12-23,2008-12
台湾居民可在大陆从事律师职业,2008-12-23,2008-12
第三届“人民社会责任奖”企业名单揭晓,2008-12-23,2008-12
法院司法改革明确十项任务,2008-12-23,2008-12
两岸合作步新局,2008-12-23,2008-12
“人民共和国党报论坛”第五届年会举行,2008-12-23,2008-12
改革开放是西藏实现跨越式发展的强大动力,2008-12-23,2008-12
继往开来勇于创新按照科学发展观要求深入开展纠风工作,2008-12-23,2008-12
成都军区千辆军车向四川地震灾区运送建材,2008-12-23,2008-12
上海十六岁学生体质改善明显,2008-12-23,2008-12
全国1000多家博物馆实现免费开放,2008-12-23,2008-12
掌上握手机免费逛国图,2008-12-23,2008-12
剑指“注水统计”挤压“泡沫政绩”,2008-12-23,2008-12
教育部称英语六级未泄题,2008-12-23,2008-12
中国再也不能折腾了（新语）,2008-12-23,2008-12
专利修正案草案拟作出四处修改,2008-12-23,2008-12
盘点（大昭评论）,2008-12-23,2008-12
佟文勇夺女子组冠军,2008-12-23,2008-12
把握盛会机遇  利用冰雪平台,2008-12-23,2008-12
中国队一比零小胜约旦队,2008-12-23,2008-12
活动站点达八千多个,2008-12-23,2008-12
“优秀不优秀看标准”（创新与实践）,2008-12-23,2008-12
解放思想，提高领导科学发展的能力（加强新形势下的领导班子思想政治建设系列报道之九）,2008-12-23,2008-12
家乡的冬天很温暖,2008-12-23,2008-12
动态管理服务流动党员（创新与实践）,2008-12-23,2008-12
赤子心铸灾区情,2008-12-23,2008-12
工商系统促经济平稳较快增长,2008-12-23,2008-12
工商系统市场监管取得新成效,2008-12-23,2008-12
停收“两费”推进工商转型,2008-12-23,2008-12
廉政勤政劲风吹,2008-12-23,2008-12
推进工商行政管理实现“四个转变”,2008-12-23,2008-12
老专家话改革开放（感受３０年巨变）,2008-12-23,2008-12
乘高铁赞中国速度（感受３０年巨变）,2008-12-23,2008-12
寒冬迎圣诞,2008-12-23,2008-12
“洋票友”看文化繁荣（感受３０年巨变）,2008-12-23,2008-12
同样节日  别样心情,2008-12-23,2008-12
沧桑巨变  精神永恒,2008-12-23,2008-12
从马拉飞机到体系保障,2008-12-23,2008-12
一个献血小屋的光荣史,2008-12-23,2008-12
武安：“富百姓”才是“硬道理”,2008-12-24,2008-12
“一把米”跨越到“一袋米”,2008-12-24,2008-12
“团团”“圆圆”到宝岛,2008-12-24,2008-12
疾风知劲草 务实破难关,2008-12-24,2008-12
李克强会见印尼总统苏西洛,2008-12-24,2008-12
风云二号E星成功发射,2008-12-24,2008-12
深入把握改革开放三十年的伟大历程和辉煌成就,2008-12-24,2008-12
满腔豪情走天涯 一片丹心献祖国,2008-12-24,2008-12
政协举行首届人口资源环境发展态势分析会,2008-12-24,2008-12
减负两千亿稳岗数千万（政策解读·关注促进就业政策④）,2008-12-24,2008-12
把加快发展方式转变和结构调整作为保增长的主攻方向,2008-12-24,2008-12
大力支持农业农村经济发展（深入开展学习实践科学发展观活动）,2008-12-24,2008-12
“高”处可避寒,2008-12-24,2008-12
力保市场主体良好发展势头（深入开展学习实践科学发展观活动）,2008-12-24,2008-12
推进文化建设提高国家文化软实力,2008-12-24,2008-12
黄河济南段今冬首次流凌,2008-12-24,2008-12
加大信贷投入优化信贷结构（深入开展学习实践科学发展观活动）,2008-12-24,2008-12
今年我国吸收外资预计逾900亿美元,2008-12-24,2008-12
护航展现负责任大国形象（国际论坛）,2008-12-24,2008-12
斐济和新西兰相互驱逐外交官,2008-12-24,2008-12
土耳其说土以总理会晤富有成果,2008-12-24,2008-12
李克强会见印尼总统苏西洛,2008-12-24,2008-12
俄拟再下猛药救经济,2008-12-24,2008-12
圣彼得堡的期盼（出访归来）,2008-12-24,2008-12
几内亚总统病逝  军官发动政变,2008-12-24,2008-12
纪念中日友协成立45周年理事会举行,2008-12-24,2008-12
确认驻伊多国部队任期年底结束,2008-12-24,2008-12
罗马尼亚新政府宣誓就职,2008-12-24,2008-12
“庞氏骗局”的警示（大千絮语）,2008-12-24,2008-12
中国驻阿拉木图总领馆开馆,2008-12-24,2008-12
给外来工子女送温暖,2008-12-24,2008-12
上海以机构改革促政府职能转变,2008-12-24,2008-12
言因人而重（人民论坛）,2008-12-24,2008-12
外交部举行例行记者会,2008-12-24,2008-12
陈至立会见越南客人,2008-12-24,2008-12
寸土寸金惜毫纤（经典中国辉煌３０年）,2008-12-24,2008-12
西方媒体捏造中国向津巴布韦转运武器是无中生有、别有用心,2008-12-24,2008-12
以中央精神统一全团思想、凝聚青年力量  为推动科学发展、促进社会和谐多作贡献,2008-12-24,2008-12
王家瑞会见韩国客人,2008-12-24,2008-12
江学彬同志逝世,2008-12-24,2008-12
徐明清同志逝世,2008-12-24,2008-12
中国海军编队做好出航准备,2008-12-24,2008-12
团团圆圆安抵新家（热点解读）,2008-12-24,2008-12
团团圆圆抵台第一餐,2008-12-24,2008-12
春天就在不远处（人民时评）,2008-12-24,2008-12
在剧烈动荡中辞旧迎新,2008-12-24,2008-12
漫画,2008-12-24,2008-12
粮食安全威胁民生,2008-12-24,2008-12
油价表现惊心动魄,2008-12-24,2008-12
世界应对经济寒冬,2008-12-24,2008-12
“金砖四国”有望拉动全球70%增长,2008-12-24,2008-12
丢弃恐惧  增强信心,2008-12-24,2008-12
贸易发展坎坷不顺,2008-12-24,2008-12
金融危机继续探底,2008-12-24,2008-12
把提高思想认识与解决突出问题统一起来（思想纵横）,2008-12-24,2008-12
科学发展观催生新的工程咨询理念,2008-12-24,2008-12
塑造城市特色 推动科学发展,2008-12-24,2008-12
突出实践特色解决突出问题（学习实践科学发展观论坛）,2008-12-24,2008-12
努力提高党员干部的思想政治素质,2008-12-24,2008-12
文化建设须坚持统筹兼顾,2008-12-24,2008-12
应当制定专门的孤儿供养条例（政声集萃）,2008-12-24,2008-12
让农民工子女就近接受优质教育（政声集萃）,2008-12-24,2008-12
推广使用中水为北京“解渴”,2008-12-24,2008-12
书骨如山托厚重（情怀）,2008-12-24,2008-12
北大仓“整”出新天地（党派之声）,2008-12-24,2008-12
“新兵”的统战观（统一战线）,2008-12-24,2008-12
“一户一策”助企业渡难关,2008-12-24,2008-12
稳外贸 扩消费 保增长（经济聚焦·岁末看形势⑤）,2008-12-24,2008-12
外资银行首发人民币信用卡,2008-12-24,2008-12
