“我心里一直惦记着你们”,2008-12-01,2008-12
改革开放是决定当代中国命运的关键抉择,2008-12-01,2008-12
塔吉克斯坦议会上院议长将访华,2008-12-01,2008-12
柴达木全力修复盆地生态,2008-12-01,2008-12
锦屏二级水电站成功截流,2008-12-01,2008-12
深切关怀暖壮乡（广西辉煌50年）,2008-12-01,2008-12
淄博张店升级产业拓展发展空间,2008-12-01,2008-12
苏州力促城乡一体化发展,2008-12-01,2008-12
连云港港十五万吨级航道开通,2008-12-01,2008-12
国开行20天完成600亿元增贷计划,2008-12-01,2008-12
学习实践活动要为保证经济  平稳较快发展提供强大动力,2008-12-01,2008-12
深切关怀暖壮乡（广西辉煌50年）,2008-12-01,2008-12
深入开展学习实践科学发展观活动,2008-12-01,2008-12
沪杭两地实施“医保互通”,2008-12-01,2008-12
撬动农村近万亿内需（政策解读）,2008-12-01,2008-12
罗马尼亚举行议会选举,2008-12-01,2008-12
以将释放二百五十名巴在押人员,2008-12-01,2008-12
中东和平期待新开端（国际论坛）,2008-12-01,2008-12
联合国举行发展筹资问题后续国际会议,2008-12-01,2008-12
印再次确认孟买恐怖袭击中无中国人死亡,2008-12-01,2008-12
泰国总理府发生爆炸,2008-12-01,2008-12
尼日利亚中部骚乱已获控制,2008-12-01,2008-12
中国产品惠及蒙古国百姓（感受中国改革开放（十九））,2008-12-01,2008-12
俄总统拉美行意味深长,2008-12-01,2008-12
柬埔寨首相洪森会见孟建柱,2008-12-01,2008-12
非盟敦促联合国向索马里派驻维和部队,2008-12-01,2008-12
中国政府继续增派飞机接回我滞泰公民,2008-12-01,2008-12
“香格里拉”的变与不变（人民论坛）,2008-12-01,2008-12
北京提前完成全年“蓝天”目标,2008-12-01,2008-12
梁光烈会见越南客人,2008-12-01,2008-12
根深方能叶茂 拼搏才有明天,2008-12-01,2008-12
杨洁篪与巴基斯坦外长通电话,2008-12-01,2008-12
海南：特区20年 旧貌换新颜（经典中国辉煌３０年）,2008-12-01,2008-12
“我心里一直惦记着你们”,2008-12-01,2008-12
“改革开放颂”系列演出拉开帷幕,2008-12-01,2008-12
干预需要配套政策支持,2008-12-01,2008-12
携手对抗“世纪瘟疫”（热点解读）,2008-12-01,2008-12
辩证看待农民工返乡潮(人民时评),2008-12-01,2008-12
加强艾滋病检测与筛查,2008-12-01,2008-12
联合国赞赏中国政府防艾行动,2008-12-01,2008-12
越南三举措 振经济,2008-12-01,2008-12
网络暴力第一案的思考（大千絮语）,2008-12-01,2008-12
全球抗击艾滋病斗争进展显著,2008-12-01,2008-12
西班牙充分挖掘母语产业价值,2008-12-01,2008-12
林毅夫强调发展中国家急需投资,2008-12-01,2008-12
发挥后发优势推动科学发展（干部说干事）,2008-12-01,2008-12
扩大内需是战略性举措（学者论学问）,2008-12-01,2008-12
理论创新：伟大的历史性创造（纪念改革开放３０周年）,2008-12-01,2008-12
高原明珠再放异彩（高举旗帜 科学发展·——改革开放30年系列调研报告（15））,2008-12-01,2008-12
交通建设领域事故同比下降43.6%,2008-12-01,2008-12
入境游人数连续三个月下降,2008-12-01,2008-12
口岸联检从这里起步（影像·30年）,2008-12-01,2008-12
我国超过1/3城市家庭拥有商业寿险,2008-12-01,2008-12
394亿元投资项目，暂缓！,2008-12-01,2008-12
既要“急事快办” 又忌“急功近利”（声音特别报道·信心从哪里来）,2008-12-01,2008-12
四问培训中的县委书记,2008-12-01,2008-12
外资还是看好中国（经济大势）,2008-12-01,2008-12
别总忽悠老太太（经济茶座）,2008-12-01,2008-12
返乡学艺忙,2008-12-01,2008-12
让百姓端稳“饭碗”（经济热点）,2008-12-01,2008-12
沙河建北方最大机械零部件市场,2008-12-01,2008-12
救车市重在改善消费环境（各抒己见）,2008-12-01,2008-12
汽车业主动调整战“寒冬”,2008-12-01,2008-12
全国规模以上批发市场超9万家,2008-12-01,2008-12
香港工薪族，缘何退休不犯愁,2008-12-01,2008-12
有色金属业发布社会责任指南,2008-12-01,2008-12
国电集团进军相关产业化“危”为“机”,2008-12-01,2008-12
回乡创业，大学毕业生新选择（文化观察）,2008-12-01,2008-12
网络文学是个好现象(新语),2008-12-01,2008-12
石上松,2008-12-01,2008-12
中堡岛消失记（纪念改革开放３０周年特选作品）,2008-12-01,2008-12
别样的告别（大地漫笔）,2008-12-01,2008-12
炭子冲少奇铜像,2008-12-01,2008-12
石狮雕像,2008-12-01,2008-12
白杨与哨兵,2008-12-01,2008-12
玉韵大理（玉文化与和谐社会）,2008-12-01,2008-12
文明，流自内心（话题·今天，我们如何  延续文明?（一））,2008-12-01,2008-12
曾侯乙编钟记（九州风物）,2008-12-01,2008-12
舞蹈精品晚会速写,2008-12-01,2008-12
诗界名家采风神农山,2008-12-01,2008-12
推动中国特色社会主义法学事业繁荣发展,2008-12-02,2008-12
把党和政府的关怀落实到体制机制和政策措施上,2008-12-02,2008-12
习近平会见越南人民军总参谋长,2008-12-02,2008-12
让每一位公民都掌握防控知识  让每一位患者都得到及时救助,2008-12-02,2008-12
贾庆林与老挝建国阵线中央委员会主席会谈,2008-12-02,2008-12
全国各地积极开展法律进乡村活动,2008-12-02,2008-12
海关总署十项措施支持进出口企业,2008-12-02,2008-12
坚持以科学发展观为指导  加强深化行政管理体制改革研究,2008-12-02,2008-12
重点流域水污染防治规划实施中存在三大问题,2008-12-02,2008-12
数字点击,2008-12-02,2008-12
把党和政府的关怀落实到体制机制和政策措施上,2008-12-02,2008-12
湖南首次进行环境资源交易拍卖,2008-12-02,2008-12
到基层就业 去西部工作（政策解读·关注促进就业政策①）,2008-12-02,2008-12
我国兽药行业年销售额超200亿元,2008-12-02,2008-12
七台河对昌隆煤矿爆炸事故责任人作出处理,2008-12-02,2008-12
粮食肉类等商品临时价格干预解除,2008-12-02,2008-12
青海湖流域生态示范项目启动,2008-12-02,2008-12
甘肃设200万元省长金融奖励基金,2008-12-02,2008-12
新增10亿元建四千多计生服务站,2008-12-02,2008-12
柬埔寨国王会见中国公安部部长孟建柱,2008-12-02,2008-12
中共代表出席俄罗斯联邦共产党代表大会,2008-12-02,2008-12
孟买遭袭后的印巴关系（热点对话）,2008-12-02,2008-12
朱威烈教授荣获“海湾合作委员会奖”,2008-12-02,2008-12
贾庆林会见老挝总理波松,2008-12-02,2008-12
奥巴马安全团队面临挑战(述评),2008-12-02,2008-12
孟买恐怖袭击敲响警钟（国际论坛）,2008-12-02,2008-12
贾庆林与老挝建国阵线中央委员会主席会谈,2008-12-02,2008-12
俄表示空军将成为保障俄安全的决定因素,2008-12-02,2008-12
泰国反政府民盟结束在总理府的示威,2008-12-02,2008-12
民盟十届二中全会开幕,2008-12-02,2008-12
我国成功发射“遥感卫星四号”,2008-12-02,2008-12
梁光烈会见新加坡客人,2008-12-02,2008-12
梁光烈会见缅甸客人,2008-12-02,2008-12
下力气抓好村党支部书记队伍建设  确保十七届三中全会精神落到实处,2008-12-02,2008-12
时艰出英雄（人民论坛）,2008-12-02,2008-12
民进十二届二中全会开幕,2008-12-02,2008-12
推动中国特色社会主义法学事业繁荣发展,2008-12-02,2008-12
何勇会见亚非国家预防腐败研讨班代表,2008-12-02,2008-12
民革十一届二中全会开幕,2008-12-02,2008-12
台盟八届二中全会开幕,2008-12-02,2008-12
两海相拥兴大连（经典中国辉煌３０年）,2008-12-02,2008-12
外交部发言人答记者问,2008-12-02,2008-12
出租车怎样“走好”？（热点解读）,2008-12-02,2008-12
县委书记的自省和他律（人民时评）,2008-12-02,2008-12
南极中山站大规模改建（我随“雪龙”闯南极）,2008-12-02,2008-12
里约集团呼吁建立全球经济预警机制,2008-12-02,2008-12
流汗挨过金融危机（经济透视）,2008-12-02,2008-12
美国“奋进”号航天飞机安全着陆,2008-12-02,2008-12
水城真成“水城”了,2008-12-02,2008-12
加拿大救市案引风暴,2008-12-02,2008-12
新会计准则：力助企业“走出去”,2008-12-02,2008-12
重庆出资30亿为民买房暖市场,2008-12-02,2008-12
让企业通关更便利（财经故事）,2008-12-02,2008-12
确保民生投入用于民（金海观潮）,2008-12-02,2008-12
股市寒冬过去是春天（热点聚焦）,2008-12-02,2008-12
工行信用卡消费额突破两千亿元（财经短波）,2008-12-02,2008-12
济南海关提高税收征管效能（财经短波）,2008-12-02,2008-12
丹麦最大单笔对外投资落户天津（财经短波）,2008-12-02,2008-12
银行业协会鼓励发展私人银行（财经短波）,2008-12-02,2008-12
“鸟巢”三十亿保额大单花落平安（财经短波）,2008-12-02,2008-12
始终保持惩治腐败的强劲势头（党的纪律检查工作辉煌30年）,2008-12-02,2008-12
节俭 高效 温馨,2008-12-02,2008-12
要看到农民工返乡的积极面（对话）,2008-12-02,2008-12
国开行股份有限公司创立大会召开,2008-12-02,2008-12
太行山82万老区人民提前喝上安全水,2008-12-02,2008-12
莫把财富当包袱（快评）,2008-12-02,2008-12
返乡农民工  创业有天地,2008-12-02,2008-12
破解“申请再审难”  杜绝“申请再审乱”,2008-12-02,2008-12
网友寄望县委书记：少摆官架少讲官话  多问民生多谋发展,2008-12-02,2008-12
民间组织实行契约式管理,2008-12-02,2008-12
山西长治  96万张“名片”发出之后（２００８政府创新回头看）,2008-12-02,2008-12
残疾人事业发展研究会成立,2008-12-02,2008-12
增强信心也要找准关键穴位（声音特别报道·信心从哪里来）,2008-12-02,2008-12
《于无声处》重登话剧舞台,2008-12-02,2008-12
昆明二百余家饭店停播背景音乐,2008-12-02,2008-12
珍惜自己的大学时代（新语）,2008-12-02,2008-12
东北28所高师院校“联合推销”毕业生,2008-12-02,2008-12
拿什么保护个人隐私（文化观察）,2008-12-02,2008-12
雷抒雁诗歌朗诵会记录“激情三十年”,2008-12-02,2008-12
相声小品精粹展示“欢笑三十年”,2008-12-02,2008-12
短道金花未来更灿烂,2008-12-02,2008-12
广州倡导无烟亚运,2008-12-02,2008-12
武术散打功夫王争霸赛  决出四位“功夫之王”（体坛速递）,2008-12-02,2008-12
中国奥委会  奥运后首签合作伙伴（体坛速递）,2008-12-02,2008-12
第二届“729杯”  乒乓南北挑战赛落幕（体坛速递）,2008-12-02,2008-12
内蒙古  新住宅区需规划建设体育设施（体坛速递）,2008-12-02,2008-12
姚明两双火箭负于掘金  阿联14分网队逆转太阳（体坛速递）,2008-12-02,2008-12
女足世青赛  法美两队挺进半决赛（体坛速递）,2008-12-02,2008-12
高原集训备战世界杯,2008-12-02,2008-12
南宁获得举办权,2008-12-02,2008-12
当为郎平高兴（大昭评论）,2008-12-02,2008-12
超市小功能全,2008-12-02,2008-12
小短信  大关爱（创新与实践）,2008-12-02,2008-12
学习进一步  发展迈大步（加强新形势下的领导班子思想政治建设系列报道之六）,2008-12-02,2008-12
让读书倡廉成为时尚（党建论坛）,2008-12-02,2008-12
移动通信惠及“三州”乡亲,2008-12-02,2008-12
手机让生活五彩缤纷,2008-12-02,2008-12
从“摇着打”到“走着打”,2008-12-02,2008-12
从总统千金择校说起(五周茶亭),2008-12-02,2008-12
爱尔兰人爱美酒,2008-12-02,2008-12
自由交往真好（感受巨变３０年）,2008-12-02,2008-12
萨格勒布一瞥,2008-12-02,2008-12
普瓦兰面包回味无穷,2008-12-02,2008-12
在泥土里发酵（玉文化与和谐社会）,2008-12-02,2008-12
周海婴的老照片,2008-12-02,2008-12
说玉（玉文化与和谐社会）,2008-12-02,2008-12
巴渝路上（纪念改革开放３０周年特选作品）,2008-12-02,2008-12
从状告自己说起（金台随感）,2008-12-02,2008-12
往事（文苑转话）,2008-12-02,2008-12
《深圳大道》研讨会在京举行,2008-12-02,2008-12
洛夫诗书画展举办,2008-12-02,2008-12
享受散步（大地漫笔）,2008-12-02,2008-12
飞跃蓝天,2008-12-03,2008-12
贾庆林会见老挝国会主席通辛,2008-12-03,2008-12
贾庆林开始对柬埔寨进行正式友好访问,2008-12-03,2008-12
心手相牵共繁荣(广西辉煌５０年),2008-12-03,2008-12
江苏确保实现全年发展目标,2008-12-03,2008-12
抓住难得机遇 发挥自身优势 推动广西经济社会又好又快发展,2008-12-03,2008-12
李长春会见印度客人,2008-12-03,2008-12
改革开放的方向和道路是完全正确的,2008-12-03,2008-12
国土部七项举措保障新增中央投资用地（坚定信心 应对挑战）,2008-12-03,2008-12
第五届中国青年女科学家奖揭晓,2008-12-03,2008-12
以信息化带动工业化以工业化促进信息化,2008-12-03,2008-12
“十一五”前两年万元工业增加值用水量降幅达一成六,2008-12-03,2008-12
深入开展学习实践科学发展观活动,2008-12-03,2008-12
培育“小老板” 多造“新饭碗”（政策解读·关注促进就业政策②）,2008-12-03,2008-12
交通部100亿新增资金全面落实,2008-12-03,2008-12
坚定信心 扎实工作 努力扩大内需 保持外贸稳定增长,2008-12-03,2008-12
美国核谈判代表启程访问亚洲三国,2008-12-03,2008-12
以色列总统佩雷斯会见刘云山,2008-12-03,2008-12
“最有礼貌”从何谈起(国际随笔),2008-12-03,2008-12
贾庆林会见老挝国家副主席本南,2008-12-03,2008-12
葡共总书记德索萨与中共代表翁杰明会谈,2008-12-03,2008-12
朝韩关系走向何方,2008-12-03,2008-12
泰国政局依然迷雾重重,2008-12-03,2008-12
外交部举行例行记者会,2008-12-03,2008-12
警惕“金本位”复辟思潮（国际论坛）,2008-12-03,2008-12
中韩将举行首次外交部门高级别战略对话,2008-12-03,2008-12
差瓦拉担任泰国看守政府总理,2008-12-03,2008-12
“克林顿全球倡议”亚洲会议在港举行,2008-12-03,2008-12
“中国改革开放与人权发展30年”学术研讨会召开,2008-12-03,2008-12
推动厂务公开民主管理工作向更深层次发展,2008-12-03,2008-12
杨洁篪会见菲律宾总统阿罗约和新加坡内阁资政李光耀,2008-12-03,2008-12
问政于民 问需于民 问计于民(人民论坛),2008-12-03,2008-12
抓住难得机遇 发挥自身优势  推动广西经济社会又好又快发展,2008-12-03,2008-12
天津百米千吨塔一次吊装成功,2008-12-03,2008-12
广西经济社会实现跨越发展(在国新办新闻发布会上),2008-12-03,2008-12
三代艺术家放歌“春天的旋律”,2008-12-03,2008-12
夏伯勋同志逝世,2008-12-03,2008-12
入冬后最强冷空气将影响我国大部地区,2008-12-03,2008-12
王家瑞会见印度客人,2008-12-03,2008-12
王岐山同保尔森通话,2008-12-03,2008-12
《国内外经济社会发展实例选编》出版,2008-12-03,2008-12
金仁燮同志逝世,2008-12-03,2008-12
让歧视远离艾滋病致孤儿童（人民时评）,2008-12-03,2008-12
一次为“完成出国指标”的“考察”（热点解读）,2008-12-03,2008-12
“徐州保尔”身上发生奇迹（连续报道）,2008-12-03,2008-12
付华 苦难中挺立的阳光女孩（人生境界）,2008-12-03,2008-12
接连发生手机短信和电话诈骗案件,2008-12-03,2008-12
为了同胞早回祖国怀抱,2008-12-03,2008-12
中国内地滞泰游客近日有望全返,2008-12-03,2008-12
“感受到不一般的温暖”,2008-12-03,2008-12
尽快接回滞留同胞,2008-12-03,2008-12
为农业农村发展提供支持和保障（学习三中全会《决定》推进农村改革发展）,2008-12-03,2008-12
努力开创农村改革发展新局面,2008-12-03,2008-12
执政为民的价值取向（思想纵横）,2008-12-03,2008-12
珍爱生命·众志成城·多难兴邦（第五届中国公民道德论坛）,2008-12-03,2008-12
大力推动马克思主义中国化（理论信息）,2008-12-03,2008-12
心手相牵共繁荣(广西辉煌５０年),2008-12-03,2008-12
飞跃蓝天,2008-12-03,2008-12
演习，没有硝烟（体验）,2008-12-03,2008-12
中国奶业发展高峰论坛举行,2008-12-03,2008-12
大学生发明指纹式酒后禁驾器,2008-12-03,2008-12
水生生物种群资源逐步恢复,2008-12-03,2008-12
保险业务监管收费标准调低,2008-12-03,2008-12
“菜篮子”产品价格回稳,2008-12-03,2008-12
面对苹果汁市场之变,2008-12-03,2008-12
证券公司可申报融资融券,2008-12-03,2008-12
长春市 领导“读报”读出了什么（２００８征服创新回头看）,2008-12-03,2008-12
今夕何夕 不应有憾（观沧海）,2008-12-03,2008-12
“中秋烤肉”在传统与环保间艰难前行（行走台湾·看环保）,2008-12-03,2008-12
棒球术语“逆转胜”成岛内热词（海峡连线）,2008-12-03,2008-12
挑战面前，尤需提升干部执行力（声音特别报道·信心从哪里来）,2008-12-03,2008-12
西湖边长出“文化大树”？(文化观察),2008-12-03,2008-12
壮医医生资格获法律认可,2008-12-03,2008-12
甘肃４学生殴打同学致死被判刑,2008-12-03,2008-12
30年文学论坛在深圳举行,2008-12-03,2008-12
吉林取消重点校及重点班,2008-12-03,2008-12
福建明年取消农村中小学寄宿费,2008-12-03,2008-12
官员读博当以求知为重（新语）,2008-12-03,2008-12
大冬会筹备基本就绪,2008-12-03,2008-12
伺机,2008-12-03,2008-12
中国代表团力争前三,2008-12-03,2008-12
5岁中超有点烦（联赛面面观①）,2008-12-03,2008-12
中国民主增量发展,2008-12-03,2008-12
民主大事记,2008-12-03,2008-12
人权30年30事,2008-12-03,2008-12
未来30年中国人权保障将更广泛,2008-12-03,2008-12
市场与法治30年大事记,2008-12-03,2008-12
市场经济呼唤法治,2008-12-03,2008-12
点击“法律六进”,2008-12-03,2008-12
“五五”普法第三年,2008-12-03,2008-12
变独角戏为大合唱,2008-12-03,2008-12
确定金融促进经济发展九项政策措施,2008-12-04,2008-12
长春优化产业布局推动科学发展,2008-12-04,2008-12
重庆造林建绿都,2008-12-04,2008-12
甘肃调水润下游,2008-12-04,2008-12
柬埔寨国王西哈莫尼会见贾庆林,2008-12-04,2008-12
坚持改革开放不动摇，不能走回头路,2008-12-04,2008-12
工业新跨越（广西辉煌５０年）,2008-12-04,2008-12
吴邦国会见塔吉克斯坦议会上院议长,2008-12-04,2008-12
我国有望率先实现IPv6商用,2008-12-04,2008-12
网友留言板,2008-12-04,2008-12
注意选配熟悉农村工作的领导干部,2008-12-04,2008-12
确定金融促进经济发展九项政策措施,2008-12-04,2008-12
拟延迟处级以上女干部退休年龄,2008-12-04,2008-12
新增三百多亿投资已全部下达,2008-12-04,2008-12
免、减、补 三招促创业（政策解读·关注促进就业政策③）,2008-12-04,2008-12
农行：八项举措扶持小企业（各方扶持创业新举措）,2008-12-04,2008-12
上海：5000万元助学生创业企业成长（各方扶持创业新举措）,2008-12-04,2008-12
成都：无抵押小额贷款掀起创业热（各方扶持创业新举措）,2008-12-04,2008-12
贵阳：全力帮助返乡农民工创业（各方扶持创业新举措）,2008-12-04,2008-12
河南省——“两手抓”强农业  “组合拳”扩内需,2008-12-04,2008-12
教育部——优先农村教育 促进资源共享,2008-12-04,2008-12
农业部——应对经济形势 做好各项工作,2008-12-04,2008-12
中国首家海外软件园在东京开业,2008-12-04,2008-12
巴勒斯坦民族权力机构主席和总理会见刘云山,2008-12-04,2008-12
尼泊尔总理会见杨洁篪,2008-12-04,2008-12
将各国在索马里海域打击海盗授权延长一年,2008-12-04,2008-12
贾庆林会见柬埔寨国会主席韩桑林,2008-12-04,2008-12
麻生太郎会见李肇星,2008-12-04,2008-12
和谐交流  更上层楼(国际论坛),2008-12-04,2008-12
柬埔寨国王西哈莫尼会见贾庆林,2008-12-04,2008-12
高科技发展与当代国际关系学术研讨会举行,2008-12-04,2008-12
猪头肉·油漆刷·泥饭碗（国际随笔）,2008-12-04,2008-12
对外友协纪念“声援巴勒斯坦人民国际日”,2008-12-04,2008-12
委俄军演引关注,2008-12-04,2008-12
中国呼吁化学武器拥有国如期完成销毁工作,2008-12-04,2008-12
左爱同志逝世,2008-12-04,2008-12
国产动画产量今年有望突破12万分钟,2008-12-04,2008-12
骆耕漠同志逝世,2008-12-04,2008-12
我国已向19个国家派驻30名警务联络官,2008-12-04,2008-12
王岐山会见白俄罗斯客人,2008-12-04,2008-12
中国的民族区域自治制度不容动摇,2008-12-04,2008-12
从数学大国走向数学强国（我的亲历）,2008-12-04,2008-12
扎实开展中央政策落实检查工作  为经济平稳较快发展提供有力保证,2008-12-04,2008-12
路甬祥会见塔吉克斯坦客人,2008-12-04,2008-12
红歌为什么能唱红（人民论坛）,2008-12-04,2008-12
陈至立率全国人大代表团出访亚洲四国,2008-12-04,2008-12
入冬，最强冷空气袭来（热点解读）,2008-12-04,2008-12
公务员考核重在打破“官”念（人民时评）,2008-12-04,2008-12
美国各界评说中美战略经济对话,2008-12-04,2008-12
充满生机的对话机制,2008-12-04,2008-12
奠定长久经济伙伴关系的基石,2008-12-04,2008-12
工业新跨越（广西辉煌５０年）,2008-12-04,2008-12
改革开放三十年中国文化的发展,2008-12-04,2008-12
“第一”的追求（经典中国辉煌３０年）,2008-12-04,2008-12
六部委举办改革开放三十年形势报告会,2008-12-04,2008-12
人一能之我百之(高举旗帜  科学发展·——改革开放30年系列调研报告（16）),2008-12-04,2008-12
全国首例环境污染责任险获赔,2008-12-04,2008-12
短信资费不再“内外有别”,2008-12-04,2008-12
产权交易从这里发端（影像·30年）,2008-12-04,2008-12
旅游业成首都经济新增长点,2008-12-04,2008-12
新疆和田着力修复生态,2008-12-04,2008-12
首家民营航空公司将停飞,2008-12-04,2008-12
楼市成交出现回暖迹象（经济聚焦）,2008-12-04,2008-12
在危机中崛起（感言）,2008-12-04,2008-12
传统文化须敬畏（文艺点评）,2008-12-04,2008-12
《浴血坚持》再现红色风云,2008-12-04,2008-12
艺术诠释台湾历史,2008-12-04,2008-12
《惊天动地》讴歌抗震英雄,2008-12-04,2008-12
改革开放与戏剧复兴（纪念改革开放３０周年特选作品）,2008-12-04,2008-12
亲情剧的可喜突破,2008-12-04,2008-12
“钱学”厦大再整合（文艺信息）,2008-12-04,2008-12
话剧要与时代互动（文艺信息）,2008-12-04,2008-12
专家畅谈中国歌剧（文艺信息）,2008-12-04,2008-12
硕果累累三十年,2008-12-04,2008-12
技术驱动联想成长之路,2008-12-04,2008-12
迈向创新中国（观澜）,2008-12-04,2008-12
创新是发展的不竭动力（名家有约）,2008-12-04,2008-12
试管猴 中国智慧世界瞩目,2008-12-04,2008-12
创新中国（岁月如诗３０年）,2008-12-04,2008-12
消除歧视是防艾良方（不吐不快）,2008-12-04,2008-12
本报转基因报道引起广泛关注（报网互动）,2008-12-04,2008-12
妈妈，别为我哭泣,2008-12-04,2008-12
用民生财政支持社保事业发展,2008-12-04,2008-12
社会保障科学发展需适应“五大要求”,2008-12-04,2008-12
维护广大职工社保权益,2008-12-04,2008-12
努力实现中国社会保障科学发展,2008-12-04,2008-12
加快建立和完善多层次医疗保障体系,2008-12-04,2008-12
有效保障人民群众基本生活,2008-12-04,2008-12
完善社保体制 促进居民消费,2008-12-04,2008-12
做好“五个加强”全面开展社保审计,2008-12-04,2008-12
实现多支柱社会保障,2008-12-04,2008-12
将新增财力全部用于社保,2008-12-04,2008-12
盘活卫生资源化解看病难,2008-12-04,2008-12
医药卫生体制改革关键在制度设计,2008-12-04,2008-12
医疗保障要“点”“面”兼顾,2008-12-04,2008-12
坚持创新和实现养老保障全覆盖,2008-12-04,2008-12
对社保基金全方位监管,2008-12-04,2008-12
建议进行应对老龄化高峰试点,2008-12-04,2008-12
建立科学社保基金监管体系,2008-12-04,2008-12
完善养老保险制度需更多探索,2008-12-04,2008-12
健全监管体制确保基金安全,2008-12-04,2008-12
增进传统友谊共创美好未来,2008-12-05,2008-12
贾庆林与柬参议院主席谢辛会谈,2008-12-05,2008-12
河南培养农村发展领头人,2008-12-05,2008-12
坚持社会主义市场经济的改革方向,2008-12-05,2008-12
学习实践活动要与应对国际金融危机紧密结合  推动中央促进经济增长政策措施的贯彻落实,2008-12-05,2008-12
温家宝将出席中日韩领导人会议,2008-12-05,2008-12
第五次中美战略经济对话开幕,2008-12-05,2008-12
郭崇毅——政府参事的楷模,2008-12-05,2008-12
97.3亿“特殊党费”全部划拨,2008-12-05,2008-12
学习实践活动要与应对国际金融危机紧密结合  推动中央促进经济增长政策措施的贯彻落实,2008-12-05,2008-12
沈阳军区党委——开门搞活动 问计于群众,2008-12-05,2008-12
国家煤矿安全监察局——学习实践两不误 安全发展双促进,2008-12-05,2008-12
国务院南水北调办——建设优质工程 抓好移民工作,2008-12-05,2008-12
农业部新增51.5亿元投资已全面下达,2008-12-05,2008-12
建行年内新增贷款将达四千多亿元,2008-12-05,2008-12
产业强起来 农民富起来（广西辉煌50年）,2008-12-05,2008-12
我国高校出版社体制改革全面推进,2008-12-05,2008-12
科学发展凝军心,2008-12-05,2008-12
