走进公务员笔试阅卷现场,2008-12-09,2008-12
眉山“海推”产生候选人干部选任“第一关”群众说了算,2008-12-09,2008-12
石家庄改革户籍政策本科以上毕业生先落户后择业,2008-12-09,2008-12
第一批学习实践活动单位紧密结合工作实际开展学习实践活动,2008-12-09,2008-12
扩大内需要避免“工程上马干部下马”（声音特别报道·信心从哪里来）,2008-12-09,2008-12
品品当年烦和难（翻阅３０年人民日报）,2008-12-09,2008-12
屡审屡犯审而不改“一把手”将被问责,2008-12-09,2008-12
年薪50万，试用3个月郴州公开招聘政府高级雇员,2008-12-09,2008-12
辽宁中小学生明年起将享免费体检,2008-12-09,2008-12
改革开放献礼片《十万人家》将播出,2008-12-09,2008-12
八桂迈向新一极（广西辉煌５０年）,2008-12-09,2008-12
甘肃“寒区”寒假变长暑假变短,2008-12-09,2008-12
《广西大百科全书》出版发行,2008-12-09,2008-12
“泥腿子”剧团为何这样火(文化观察),2008-12-09,2008-12
中国队夺得四银(动感２００８),2008-12-09,2008-12
国家足球队开始集训,2008-12-09,2008-12
9年曲终 微笑道别,2008-12-09,2008-12
体坛速递,2008-12-09,2008-12
新一届国乒主教练确定,2008-12-09,2008-12
家门口掀起健身热(全民健身),2008-12-09,2008-12
金昶伯与中国女曲分手,2008-12-09,2008-12
绿皮车上的“星级”支部（创新与实践）,2008-12-09,2008-12
南桥的“楼道党小组”（创新与实践）,2008-12-09,2008-12
打造科学发展的新引擎（加强新形势下的领导班子思想政治建设系列报道之七）,2008-12-09,2008-12
解读“红领”成长计划,2008-12-09,2008-12
孟林与慕容枫：两个“草根”的抗艾之路,2008-12-09,2008-12
拥抱只是一个开始（记者手记）,2008-12-09,2008-12
警车送我打工去,2008-12-09,2008-12
无悔的选择（感受３０年巨变）,2008-12-09,2008-12
赏舞在巴厘（旅人心语）,2008-12-09,2008-12
在色楞格河畔,2008-12-09,2008-12
一生一次的传奇,2008-12-09,2008-12
海关力促外贸企业保出口,2008-12-10,2008-12
沧州市场与产业良性互动,2008-12-10,2008-12
浦东自我加压经济增速,2008-12-10,2008-12
青岛：活力勃发胶州湾（经典中国辉煌３０年）,2008-12-10,2008-12
贾庆林会见欧美同学会·中国留学人员联谊会第六届理事会全体理事,2008-12-10,2008-12
愿这样的讨论更多些（今日谈）,2008-12-10,2008-12
震区群众迁新居,2008-12-10,2008-12
新疆段完成过半,2008-12-10,2008-12
南沙港区通过验收,2008-12-10,2008-12
共同参与平等合作把孔子学院越办越好,2008-12-10,2008-12
寿光蔬菜“实名销售”,2008-12-10,2008-12
青岛：活力勃发胶州湾（经典中国辉煌３０年）,2008-12-10,2008-12
纪念中国乡镇企业发展三十年高峰论坛举行,2008-12-10,2008-12
艺苑奇葩誉八桂（广西辉煌50年）,2008-12-10,2008-12
路基品格(时代先锋),2008-12-10,2008-12
银行“开小灶” “补奶”小企业（政策解读）,2008-12-10,2008-12
欧盟表示支持建立国际核燃料库,2008-12-10,2008-12
和白求恩一样爱中国（感受中国改革开放（二十二））,2008-12-10,2008-12
我驻巴大使向巴基斯坦人民致以节日祝贺,2008-12-10,2008-12
新西兰克马德克群岛发生７级地震,2008-12-10,2008-12
俄罗斯直面经济危机,2008-12-10,2008-12
离谱的老总年薪（国际随笔）,2008-12-10,2008-12
泰国解除曼谷两机场紧急状态,2008-12-10,2008-12
欧盟启动在索马里海域打击海盗行动,2008-12-10,2008-12
冰人“请愿”,2008-12-10,2008-12
俄印推进战略伙伴关系（国际论坛）,2008-12-10,2008-12
联合国气候变化大会分歧依旧,2008-12-10,2008-12
世卫组织帮助津巴布韦控制霍乱,2008-12-10,2008-12
六方会谈团长会继续进行,2008-12-10,2008-12
美国政府重新评估阿富汗战略,2008-12-10,2008-12
“女排情结”更丰厚（我的亲历）,2008-12-10,2008-12
寒流测出的温度（人民论坛）,2008-12-10,2008-12
外交部举行例行记者会,2008-12-10,2008-12
谈家桢同志逝世,2008-12-10,2008-12
欧美同学会·中国留学人员联谊会  第六届理事会第一次会议举行,2008-12-10,2008-12
新疆宁夏各族群众欢度古尔邦节,2008-12-10,2008-12
全国青年京剧演员电视大赛举行,2008-12-10,2008-12
把吸引和用好海外留学人才作为推动科学发展的战略举措来抓,2008-12-10,2008-12
贾庆林会见欧美同学会·中国留学人员联谊会第六届理事会全体理事,2008-12-10,2008-12
“神七”代表团访问澳门,2008-12-10,2008-12
“再办厂，我还来打工”（企业故事）,2008-12-10,2008-12
74家虚假中医药机构网站被曝光,2008-12-10,2008-12
自律+他律，获取“责任收益”（对话高管）,2008-12-10,2008-12
主要责任人被撤职（连续报道）,2008-12-10,2008-12
案件系最高检指定太原管辖,2008-12-10,2008-12
文化遗产，如何走进“数字时代”（人民时评）,2008-12-10,2008-12
“改革开放颂”展示名团名家名曲,2008-12-10,2008-12
首部农民工题材故事片首映,2008-12-10,2008-12
红色文化“映红”将军县,2008-12-10,2008-12
我工程论文发表数跃居世界第一,2008-12-10,2008-12
龙门石窟旁冒出别墅群（文化观察）,2008-12-10,2008-12
深刻把握中国特色社会主义理论体系的实践基础,2008-12-10,2008-12
开拓进取的创新精神（思想纵横）,2008-12-10,2008-12
“理论观察家”栏目正式上线,2008-12-10,2008-12
高举伟大旗帜的必然要求,2008-12-10,2008-12
《中国特色社会主义理论体系新论》简评（新书评介）,2008-12-10,2008-12
用中国特色社会主义理论体系武装全党,2008-12-10,2008-12
尊重和保障党员民主权利,2008-12-10,2008-12
全力供热确保室温18℃,2008-12-10,2008-12
获准设立纽约分行,2008-12-10,2008-12
特殊群体利益如何保障,2008-12-10,2008-12
首个仿真煤矿教学基地落户兰州,2008-12-10,2008-12
来之不易的“双下降”（经济聚焦·岁末看形势②）,2008-12-10,2008-12
暂停受理设立新航空公司申请,2008-12-10,2008-12
近500亿元可投向股权基金,2008-12-10,2008-12
第四届两岸经贸文化论坛将在上海举行,2008-12-10,2008-12
金马影帝给了“解放军军官”(海峡连线),2008-12-10,2008-12
民生投入只能加大不能减少（声音特别报道·信心从哪里来）,2008-12-10,2008-12
用音乐诠释简单生活（行走台湾·看环保）,2008-12-10,2008-12
山东 公车“排号轮休”百日后(2008政府创新·回头看),2008-12-10,2008-12
解放思想 创新发展,2008-12-10,2008-12
考核官员话语权交群众（周三观察）,2008-12-10,2008-12
仙女镇选民给人大代表打分,2008-12-10,2008-12
民评官“邳州实验”(独家),2008-12-10,2008-12
残疾人选“娘家人”（周三印象）,2008-12-10,2008-12
我国知识产权案大幅增长,2008-12-10,2008-12
法院加大制裁侵占耕地行为,2008-12-10,2008-12
人大监督“四步曲”,2008-12-10,2008-12
电话费滞纳金谁来管（新法快评）,2008-12-10,2008-12
检察院推行领导示范办案,2008-12-10,2008-12
建知识产权执法信息网上共享平台,2008-12-10,2008-12
警方重拳打击经济犯罪,2008-12-10,2008-12
新法专递,2008-12-10,2008-12
扬州检察机关严查单位受贿,2008-12-10,2008-12
丽江“玉湖水利群体事件”四问（法眼）,2008-12-10,2008-12
香港百余投诉渠道件件投诉有果,2008-12-10,2008-12
随州公安局以制度“管人管事”,2008-12-10,2008-12
选民评议人大代表,2008-12-10,2008-12
我国正推动建立多元纠纷解决机制,2008-12-10,2008-12
人民政协，改革开放三十年,2008-12-10,2008-12
吴邦国会见蒙古国家大呼拉尔主席,2008-12-11,2008-12
贾庆林会见柬埔寨客人,2008-12-11,2008-12
“春天的故事——大型交响合唱朗诵晚会”在京举行,2008-12-11,2008-12
中央经济工作会议在北京召开,2008-12-11,2008-12
中央代表团离京抵南宁,2008-12-11,2008-12
中央统战部向党外人士通报中央经济工作会议精神,2008-12-11,2008-12
前11个月外贸总值逾2.37万亿美元,2008-12-11,2008-12
湖北省向在京湖北籍农民工送文化,2008-12-11,2008-12
明年部分节假日的安排确定,2008-12-11,2008-12
保增长扩内需调结构推动又好又快发展（社论）,2008-12-11,2008-12
中央经济工作会议在北京召开,2008-12-11,2008-12
由票证到卡的变迁（我的亲历）,2008-12-11,2008-12
安理会讨论国际反恐与全球安全,2008-12-11,2008-12
董建华在纽约就中美关系发表演讲,2008-12-11,2008-12
潘基文呼吁加大打击腐败力度,2008-12-11,2008-12
哈将继续深化与中国战略伙伴关系,2008-12-11,2008-12
美国外交走向“中间道路”（国际论坛）,2008-12-11,2008-12
谁让林肯在墓中不安（国际随笔）,2008-12-11,2008-12
乌克兰议会组成新执政联盟,2008-12-11,2008-12
澳大利亚悉尼市将安装反恐报警系统,2008-12-11,2008-12
俄外长说欧盟是俄的战略伙伴,2008-12-11,2008-12
我渔船在厄海域遭海盗抢劫,2008-12-11,2008-12
第十二次中日经济讨论会在东京举行,2008-12-11,2008-12
六方会谈团长会继续磋商,2008-12-11,2008-12
给非洲人民带来实惠（感受中国改革开放（二十三））,2008-12-11,2008-12
立陶宛新一届政府就职,2008-12-11,2008-12
格表示仍将按北约标准装备军队,2008-12-11,2008-12
爱心让聋儿走进有声世界,2008-12-11,2008-12
庆祝广西壮族自治区成立五十周年文艺晚会举行,2008-12-11,2008-12
梁光烈与俄罗斯国防部长会谈,2008-12-11,2008-12
李金华会见朝鲜客人,2008-12-11,2008-12
中央代表团离京抵南宁,2008-12-11,2008-12
改善民生惠及大众(人民论坛),2008-12-11,2008-12
国务院任免国家工作人员,2008-12-11,2008-12
戴秉国离京对美国进行工作访问并举行第六次中美战略对话,2008-12-11,2008-12
把祖国南疆建设得更加美好(社论),2008-12-11,2008-12
期盼春运中“春的温暖”（人民时评）,2008-12-11,2008-12
9部门联手打击滥用食品添加剂,2008-12-11,2008-12
灾区建材价格为何涨起来？（热点解读）,2008-12-11,2008-12
昆仑站建站先遣队出发,2008-12-11,2008-12
中国向巴基斯坦捐赠一批气象仪器,2008-12-11,2008-12
美国加州最大商业太阳能屋顶发电,2008-12-11,2008-12
长恨秋归无觅处 不知转入此中来,2008-12-11,2008-12
中越工程承包领域合作潜力巨大,2008-12-11,2008-12
感受石溪大学中国情怀,2008-12-11,2008-12
日本发现控制种子发芽的蛋白质,2008-12-11,2008-12
美国白宫和国会就援救汽车业达成一致,2008-12-11,2008-12
中国会尽全力节能减排,2008-12-11,2008-12
面对霍乱不慌乱（科技大观）,2008-12-11,2008-12
中非经贸合作潜力大（关注非洲）,2008-12-11,2008-12
印度又出台2000亿卢比经济刺激方案,2008-12-11,2008-12
在沿边开放中崛起的国境商城(高举旗帜 科学发展·——改革开放30年系列调研报告（18）),2008-12-11,2008-12
唐山港吞吐量破亿吨,2008-12-11,2008-12
商业银行可办并购贷款,2008-12-11,2008-12
倾力培育旅游消费热点,2008-12-11,2008-12
连云港：东方海岸崛起海港城（经典中国辉煌３０年）,2008-12-11,2008-12
南南产权交易所在沪运行,2008-12-11,2008-12
公平税负一大步,2008-12-11,2008-12
前11月全国实际使用外资额增长26%,2008-12-11,2008-12
13%撬动9200亿元农村消费（经济聚焦）,2008-12-11,2008-12
“农超对接”试点启动,2008-12-11,2008-12
“惠农政策让我显身手”（全国农村优秀人才代表）,2008-12-11,2008-12
重庆公安禁令 公款吃喝免职,2008-12-11,2008-12
品品当年烦和难（翻阅３０年人民日报）,2008-12-11,2008-12
上海 用手机“给市长写信”有着落（２００８政府创新·回头看）,2008-12-11,2008-12
“心热”但不“头晕”“手快”更要“眼明”（声音特别报道·信心从哪里来）,2008-12-11,2008-12
河北集中火力 清剿法律白条,2008-12-11,2008-12
２００８大案要案扫描,2008-12-11,2008-12
春天的故事 历史的回声,2008-12-11,2008-12
“神七”代表团结束港澳之行回到北京,2008-12-11,2008-12
北京高校辅导员将持证上岗,2008-12-11,2008-12
“最令人兴奋的增长区”（广西辉煌50年）,2008-12-11,2008-12
沧桑巨变五十年 继往开来谱新篇,2008-12-11,2008-12
欧美同学会·中国留学人员联谊会选举产生第六届理事会会长会,2008-12-11,2008-12
佛学文化工程《密宗甘露精要·传世大藏经秘密部》面世,2008-12-11,2008-12
大型文献片《伟大的历程》将在央视黄金时间播出,2008-12-11,2008-12
中国选手首日喜获两金,2008-12-11,2008-12
组建一支善打硬仗的队伍,2008-12-11,2008-12
大冬会火种采集别出心裁,2008-12-11,2008-12
北京金隅胜山东黄金,2008-12-11,2008-12
冬季室内健身讲究多（健身之道）,2008-12-11,2008-12
广州亚运城建设全面铺开,2008-12-11,2008-12
中国驶上信息高速公路,2008-12-11,2008-12
告别寻呼机,2008-12-11,2008-12
气象服务“飞”入千家万户,2008-12-11,2008-12
农村学校有了“电老师”,2008-12-11,2008-12
奥运“盛宴”传遍全球,2008-12-11,2008-12
印记,2008-12-11,2008-12
瞬间搜遍每个角落,2008-12-11,2008-12
拥抱信息中国（观澜）,2008-12-11,2008-12
信息促进人的现代化（岁月如诗３０年名家有约）,2008-12-11,2008-12
平时教书，假期打工,2008-12-11,2008-12
给教师发展空间,2008-12-11,2008-12
农村教师何时令人羡慕（教育论坛）,2008-12-11,2008-12
一所中学两任校长的不同感慨,2008-12-11,2008-12
靠什么坚守农村校园,2008-12-11,2008-12
焦点,2008-12-11,2008-12
垃圾日清村貌焕然,2008-12-11,2008-12
农家污水分散处理,2008-12-11,2008-12
翩翩起舞,2008-12-11,2008-12
学学蚂蚁搬家（环境漫笔）,2008-12-11,2008-12
双流多清流  白鹭归乡来,2008-12-11,2008-12
农村环境保护（关注）,2008-12-11,2008-12
苏州工业园区：废品摇身变资源,2008-12-11,2008-12
瓦斯发电造福新疆,2008-12-11,2008-12
环保展览亲近公众,2008-12-11,2008-12
十部新片纪念改革开放30周年,2008-12-11,2008-12
异军突起结硕果（纪念改革开放３０周年特选作品）,2008-12-11,2008-12
前后两个三十年,2008-12-11,2008-12
《超强台风》带来的启示（文艺时评）,2008-12-11,2008-12
类型电影唱响时代主旋律,2008-12-11,2008-12
电贺广西壮族自治区成立50周年,2008-12-12,2008-12
统一思想 坚定信心,2008-12-12,2008-12
一如既往坚持以人为本切实推动人权事业发展,2008-12-12,2008-12
贾庆林分别会见蒙古和阿富汗客人,2008-12-12,2008-12
胡锦涛会见俄罗斯国防部长,2008-12-12,2008-12
温家宝主持召开国务院常务会议,2008-12-12,2008-12
广西各族各界群众隆重集会庆祝自治区成立五十周年,2008-12-12,2008-12
广西各族各界群众隆重集会庆祝自治区成立五十周年,2008-12-12,2008-12
出席湘桂铁路扩能改造工程暨广西沿海铁路南宁至钦州扩能改造工程开工动员大会,2008-12-12,2008-12
广西壮族自治区第六次民族团结进步表彰大会隆重举行,2008-12-12,2008-12
在广西壮族自治区成立五十周年庆祝大会上的讲话,2008-12-12,2008-12
率中央代表团参观广西壮族自治区成立50周年成就展并为广西民族博物馆揭幕,2008-12-12,2008-12
璀璨绿城夜无眠,2008-12-12,2008-12
六方会谈团长会结束,2008-12-12,2008-12
提振信心  共克时艰,2008-12-12,2008-12
２００８年诺贝尔奖颁奖仪式举行,2008-12-12,2008-12
联合国纪念世界人权日及《世界人权宣言》,2008-12-12,2008-12
推动中美关系进一步发展,2008-12-12,2008-12
麻生首相会见人民日报代表团,2008-12-12,2008-12
联合国气候变化高级别会议开幕,2008-12-12,2008-12
中日韩协调应对危机（国际论坛）,2008-12-12,2008-12
六方会谈主席声明,2008-12-12,2008-12
始终坚持社会主义先进文化前进方向  谱写出无愧于时代无愧于人民的美术事业新篇章,2008-12-12,2008-12
严隽琪会见蒙古客人,2008-12-12,2008-12
梁光烈会见匈牙利军队总参谋长,2008-12-12,2008-12
中央军委举行深入学习实践  科学发展观活动解放思想讨论,2008-12-12,2008-12
赤峰风电发展进入快车道,2008-12-12,2008-12
王家瑞会见蒙古客人,2008-12-12,2008-12
王家瑞会见俄罗斯客人,2008-12-12,2008-12
塞拉利昂议长将访华,2008-12-12,2008-12
统一思想 坚定信心,2008-12-12,2008-12
曾荫权将赴京述职,2008-12-12,2008-12
阿不来提·阿不都热西提会见阿富汗客人,2008-12-12,2008-12
温家宝主持召开国务院常务会议,2008-12-12,2008-12
会见俄罗斯国防部长,2008-12-12,2008-12
夏征农同志逝世,2008-12-12,2008-12
王刚会见俄罗斯客人,2008-12-12,2008-12
增强反恐意识 构筑反恐防线有效防范和打击恐怖活动,2008-12-12,2008-12
贾庆林分别会见蒙古和阿富汗客人,2008-12-12,2008-12
万事俱备 只待启程,2008-12-12,2008-12
南通：“近代第一城”的现代化跨越（经典中国辉煌３０年）,2008-12-12,2008-12
300余吨爱尔兰进口猪肉被查封,2008-12-12,2008-12
歌飞壮乡,2008-12-12,2008-12
工资涨了27次（我的亲历）,2008-12-12,2008-12
浙江文化创意产业迸发活力,2008-12-12,2008-12
从“小胡同”到“大市场”(我的亲历),2008-12-12,2008-12
中国人权取得历史性进步,2008-12-12,2008-12
推动文化创新 建设文化强市（干部说干事）,2008-12-12,2008-12
把党的组织优势转化为推动科学发展的强大动力,2008-12-12,2008-12
加强主流网站建设形成舆论引导新格局（观察与思考）,2008-12-12,2008-12
加强农村信访工作的成功探索,2008-12-12,2008-12
群众抒群言,2008-12-12,2008-12
“天价年薪”该叫停（经济时评）,2008-12-12,2008-12
部分供电企业损害用户权益,2008-12-12,2008-12
保持粮食市场和价格基本稳定,2008-12-12,2008-12
起起落落看物价（经济聚焦·岁末看形势③）,2008-12-12,2008-12
税收征管成本大大降低,2008-12-12,2008-12
我国实验快堆2010年并网发电,2008-12-12,2008-12
唤醒“沉睡”的罗布泊,2008-12-12,2008-12
严禁保险业高管滥发高薪,2008-12-12,2008-12
深入开展学习实践科学发展观活动,2008-12-12,2008-12
关于在治理商业贿赂专项工作中推进市场诚信体系建设的意见,2008-12-12,2008-12
危机面前，更要注重“选”商引资（声音特别报道·信心从哪里来）,2008-12-12,2008-12
品品当年烦和难（翻阅３０年人民日报）,2008-12-12,2008-12
永远的侯祥麟（人物）,2008-12-12,2008-12
亲情陪护孩子成长,2008-12-12,2008-12
中学该不该分文理(文化观察·关注高中文理分科①),2008-12-12,2008-12
连续报道,2008-12-12,2008-12
体坛速递,2008-12-12,2008-12
冬季室外健身四项注意（健身之道）,2008-12-12,2008-12
不畏严寒 开心畅游,2008-12-12,2008-12
周末赛事,2008-12-12,2008-12
气势如虹（动感２００８）,2008-12-12,2008-12
常昊李昌镐将争冠,2008-12-12,2008-12
国象特级大师邀请赛开枰,2008-12-12,2008-12
悬念增加 新人辈出,2008-12-12,2008-12
完善机制促发展,2008-12-12,2008-12
冬日里的暖流,2008-12-12,2008-12
希望，就在前方,2008-12-12,2008-12
福冈会议值得期待,2008-12-12,2008-12
寻求合作新路标,2008-12-12,2008-12
历次中日韩领导人会晤和会议,2008-12-12,2008-12
中日韩力推东亚合作进程,2008-12-12,2008-12
返乡创业 感觉挺好,2008-12-12,2008-12
再接再厉 为建设创新型国家做出更大贡献,2008-12-12,2008-12
中国特色高新技术产业化的光辉旗帜,2008-12-12,2008-12
图说火炬,2008-12-12,2008-12
穿过丛林 立于莽原,2008-12-12,2008-12
杜丘远去的身影,2008-12-12,2008-12
音乐流淌  岁月留痕,2008-12-12,2008-12
亲历与见证中国文艺３０年（纵横）,2008-12-12,2008-12
无边光景时时新,2008-12-12,2008-12
未来的生活仍有戏,2008-12-12,2008-12
风雪“天路”,2008-12-13,2008-12
多彩延安,2008-12-13,2008-12
安哥拉总统将访华,2008-12-13,2008-12
宁夏节水抗旱粮食丰收,2008-12-13,2008-12
赤峰林改提高造林质量,2008-12-13,2008-12
学习实践科学发展观活动要突出实践特色与推动经济平稳较快发展紧密结合起来,2008-12-13,2008-12
深入学习实践科学发展观 谱写广西改革发展新篇章,2008-12-13,2008-12
单位GDP能耗下降3.46%,2008-12-13,2008-12
亚美尼亚国民会议主席将访华,2008-12-13,2008-12
看望广西老同志、老红军和各条战线代表,2008-12-13,2008-12
我国全力扭转工业增速下滑状况（在国新办新闻发布会上）,2008-12-13,2008-12
送儿赴军营,2008-12-13,2008-12
率中央代表团第一分团赴百色慰问各族干部群众,2008-12-13,2008-12
深入开展学习实践科学发展观活动,2008-12-13,2008-12
司马义·铁力瓦尔地率中央代表团三分团赴南宁市慰问各族干部群众,2008-12-13,2008-12
张德江率中央代表团二分团赴防城港慰问,2008-12-13,2008-12
铁道部广西共同加快铁路建设,2008-12-13,2008-12
李兆焯率中央代表团五分团到梧州市慰问,2008-12-13,2008-12
杜青林率中央代表团四分团慰问都安高中师生代表,2008-12-13,2008-12
气候变化大会  有差距  有成果,2008-12-13,2008-12
戴秉国在美就纪念中美建交３０周年发表演讲,2008-12-13,2008-12
莫让加沙成“监狱”（国际随笔）,2008-12-13,2008-12
美国称将重新考虑对朝鲜的政策,2008-12-13,2008-12
欧盟峰会就三大焦点问题达成一致,2008-12-13,2008-12
中国驻黎维和官兵获联合国维和勋章,2008-12-13,2008-12
“中国充满活力和创造力”（感受中国改革开放（二十四））,2008-12-13,2008-12
老挝国家主席会见陈至立,2008-12-13,2008-12
希腊为何发生大骚乱,2008-12-13,2008-12
瑞士平静加入申根区,2008-12-13,2008-12
美国会参议院否决汽车业救援方案,2008-12-13,2008-12
梁光烈会见波黑、朝鲜客人,2008-12-13,2008-12
中国美协选举产生新一届理事会和主席团,2008-12-13,2008-12
陈水扁涉贪污等罪被起诉,2008-12-13,2008-12
历经磨难逢高考 抱着孩子上大学（我的亲历）,2008-12-13,2008-12
杨洁篪与英国外交大臣通话,2008-12-13,2008-12
上海：融入世界服务全国(经典中国辉煌30年),2008-12-13,2008-12
郑万通会见巴西客人,2008-12-13,2008-12
“卖葡萄”的“三级跳”（我的亲历）,2008-12-13,2008-12
中美在京举行中亚、南亚事务磋商,2008-12-13,2008-12
新闻摄影,2008-12-13,2008-12
张学良台湾新竹故居对外开放,2008-12-13,2008-12
多彩延安,2008-12-13,2008-12
周铁农会见阿富汗客人,2008-12-13,2008-12
两岸海上直航12月15日首航  航运企业20日内可获准运输业务,2008-12-13,2008-12
中韩举行首次外交部门高级别战略对话,2008-12-13,2008-12
中国记协邀请专家向中外记者介绍经济形势,2008-12-13,2008-12
改革开放30年全国马克思主义文艺理论研究学术研讨会召开,2008-12-13,2008-12
成品油价格难以简单与国外类比,2008-12-13,2008-12
在优化结构的前提下扩大投资规模,2008-12-13,2008-12
苹果土豆大白菜销售难,2008-12-13,2008-12
看达赖集团的政教合一专制本质,2008-12-13,2008-12
五粮液等入选“消费者喜爱老字号”,2008-12-13,2008-12
爱心献给“爱心岛”,2008-12-13,2008-12
全心全意依靠工人阶级,2008-12-13,2008-12
和谐劳动关系是社会和谐稳定的基石,2008-12-13,2008-12
进一步巩固工人阶级的领导地位,2008-12-13,2008-12
做与时俱进、奋发有为的产业工人,2008-12-13,2008-12
不断推动工会工作创新发展,2008-12-13,2008-12
任何时候都要全心全意依靠工人阶级,2008-12-13,2008-12
大力宣传工人阶级和工会工作,2008-12-13,2008-12
高速路上爆胎遇险好心人施救不留名（表扬）,2008-12-13,2008-12
霸州民心工程惠万家（来自基层）,2008-12-13,2008-12
黑煤矿乱采滥挖  村民权益遭侵害（监督）,2008-12-13,2008-12
愿“报发户”再多一些（读者论坛）,2008-12-13,2008-12
黑中介骗人没商量  返乡农民工须小心（呼吁）,2008-12-13,2008-12
手机短信,2008-12-13,2008-12
上海火车站应在地铁设告示牌（建议）,2008-12-13,2008-12
期待明天会更好,2008-12-13,2008-12
发型屋人去室空  刷卡族遭遇欺诈（耳闻目睹）,2008-12-13,2008-12
美的抒写,2008-12-13,2008-12
履痕,2008-12-13,2008-12
一江两岸 (摄影),2008-12-13,2008-12
情倾这片土地（金台随感）,2008-12-13,2008-12
满目春意,2008-12-13,2008-12
清明广远唱大风（纪念改革开放30周年特选作品）,2008-12-13,2008-12
明年中央投资确定5个重点投向,2008-12-14,2008-12
温家宝出席中日韩领导人会议,2008-12-14,2008-12
温家宝会见韩国总统李明博,2008-12-14,2008-12
温家宝会见日本首相麻生太郎,2008-12-14,2008-12
辽宁繁荣市场促消费,2008-12-14,2008-12
成品油价税费改革方案收到建议近5万条,2008-12-14,2008-12
天津拉动内需保增长,2008-12-14,2008-12
把这片红色的土地建设得更加美丽,2008-12-14,2008-12
认真总结经验开创改革发展新局面,2008-12-14,2008-12
走具有地方特色科学发展之路  促进各民族共同繁荣发展,2008-12-14,2008-12
深入开展学习实践科学发展观活动,2008-12-14,2008-12
内蒙古2200亿建农村牧区公路,2008-12-14,2008-12
坚持发展是硬道理  加快钦州市经济发展,2008-12-14,2008-12
深入学习实践科学发展观  不断推动经济社会又好又快发展,2008-12-14,2008-12
