栗战书参加党的二十大四川代表团讨论,2022-10-18,2022-10
锚定目标任务 广泛凝心聚力 为全面建设社会主义现代化国家团结奋斗,2022-10-18,2022-10
深刻领悟“两个确立”的决定性意义 自觉用党的二十大精神统一思想和行动,2022-10-18,2022-10
更加自觉拥护和坚持“两个确立” 凝心聚力贯彻落实党的二十大战略部署,2022-10-18,2022-10
深刻领悟“两个确立”的决定性意义 坚定不移推进中华民族伟大复兴历史进程,2022-10-18,2022-10
心往一处想 劲往一处使,2022-10-18,2022-10
参加二十大代表团讨论,2022-10-18,2022-10
参加党的二十大解放军和武警部队代表团小组讨论,2022-10-18,2022-10
参加二十大代表团讨论,2022-10-18,2022-10
以中国式现代化全面推进中华民族伟大复兴,2022-10-18,2022-10
党在革命性锻造中更加坚强有力,2022-10-18,2022-10
在新的历史起点上推进“一国两制”伟大实践,2022-10-18,2022-10
热烈祝贺中共二十大胜利召开,2022-10-18,2022-10
团结才能胜利 奋斗才会成功（人民论坛）,2022-10-18,2022-10
居住更舒适 生活更美好（二十大时光）,2022-10-18,2022-10
台湾统派政党热烈祝贺中共二十大召开,2022-10-18,2022-10
多国政党政府领导人热烈祝贺中共二十大召开,2022-10-18,2022-10
为全面推进中华民族伟大复兴而团结奋斗,2022-10-18,2022-10
中国新发展 世界新机遇,2022-10-18,2022-10
感悟非凡成就 汲取前行力量,2022-10-18,2022-10
在新的赶考之路上向历史和人民交出新的优异答卷,2022-10-18,2022-10
“不负时代、不负人民”（一见）,2022-10-18,2022-10
站在人与自然和谐共生的高度谋划发展（党代表话报告）,2022-10-18,2022-10
坚持和发展新时代“枫桥经验”（党代表话报告）,2022-10-18,2022-10
用高质量发展开创新局面（新征程·高质量发展谱新篇）,2022-10-18,2022-10
推进乡村振兴要靠实干（议报告 话发展）,2022-10-18,2022-10
实现高水平科技自立自强（议报告 话发展）,2022-10-18,2022-10
以高水平安全服务高质量发展（议报告 话发展）,2022-10-18,2022-10
加快建设交通强国（议报告 话发展）,2022-10-18,2022-10
为高质量发展提供人才保障（议报告 话发展）,2022-10-18,2022-10
增强创新这个第一动力（感言）,2022-10-18,2022-10
把金融服务着力点放在实体经济上（议报告·金融助力高质量发展）,2022-10-18,2022-10
深化金融供给侧结构性改革（议报告·金融助力高质量发展）,2022-10-18,2022-10
不断实现人民对美好生活的向往（新征程·全心全意为人民服务）,2022-10-18,2022-10
促进高质量充分就业（议报告 话民生）,2022-10-18,2022-10
织密织牢社会保障网（议报告 话民生）,2022-10-18,2022-10
提升医疗卫生服务适老化水平（议报告 话民生）,2022-10-18,2022-10
持续提高饮用水质量（议报告 话民生）,2022-10-18,2022-10
让特教学生接受更优质教育（议报告 话民生）,2022-10-18,2022-10
为人民托起“稳稳的幸福”（快评）,2022-10-18,2022-10
深入打好污染防治攻坚战（议报告·推动绿色发展）,2022-10-18,2022-10
不断改善生态环境质量（议报告·推动绿色发展）,2022-10-18,2022-10
在伟大复兴的新征程上奋勇前进（二十大时光）,2022-10-18,2022-10
党内民主的生动实践（盛会走笔）,2022-10-18,2022-10
水清河美更宜居（观盛会 话感悟）,2022-10-18,2022-10
技能人才成长快（观盛会 话感悟）,2022-10-18,2022-10
养老服务更周到（观盛会 话感悟）,2022-10-18,2022-10
村民增收致富忙（观盛会 话感悟）,2022-10-18,2022-10
三地同心共发展（观盛会 话感悟）,2022-10-18,2022-10
经济实力实现历史性跃升（新时代画卷·奋进十年）,2022-10-18,2022-10
中国农业银行 耕耘美丽中国 共创幸福生活,2022-10-18,2022-10
守护青山 绿色发展（走进县城看发展）,2022-10-18,2022-10
海南自贸港发展不断提速（经济聚焦）,2022-10-18,2022-10
科技强国产业报国格兰仕专注制造业44年,2022-10-18,2022-10
我国观测到迄今最亮伽马射线暴（科技自立自强）,2022-10-18,2022-10
“既要专业、细心，更要有热情”（奋斗者正青春）,2022-10-18,2022-10
中国建设银行湖北省分行 以新金融行动助力经济社会高质量发展,2022-10-18,2022-10
贵州茅台：高质量发展，大踏步前进，打造世界一流企业,2022-10-18,2022-10
武汉坚持以人民为中心的发展思想，答好探索超大城市现代化治理新路子“必答题”,2022-10-18,2022-10
全面建设社会主义现代化国家关键在党（深入学习贯彻习近平新时代中国特色社会主义思想）,2022-10-18,2022-10
始终把握历史主动（思想纵横）,2022-10-18,2022-10
邮储银行北京分行 以高质量发展为主线 谱写服务首都发展新篇章,2022-10-18,2022-10
“交流让智慧产生火花”（国际视点）,2022-10-18,2022-10
中非农业科技合作坚持“授人以渔”,2022-10-18,2022-10
昆仑芯AI芯片 筑底算力经济“新基建”,2022-10-18,2022-10
好客山东 好品山东,2022-10-18,2022-10
中国人民保险 做有温度的人民保险,2022-10-18,2022-10
党的二十大主席团举行第二次会议,2022-10-19,2022-10
习近平同乌干达总统穆塞韦尼就中乌建交60周年互致贺电,2022-10-19,2022-10
“虽千万人，吾往矣”（微镜头·习近平总书记参加党的二十大广西代表团讨论）,2022-10-19,2022-10
“就是要理直气壮、很自豪地去做这件事”（微镜头·习近平总书记参加党的二十大广西代表团讨论）,2022-10-19,2022-10
真理之光照亮复兴之路,2022-10-19,2022-10
加快构建新发展格局 着力推动高质量发展（新征程 代表谈）,2022-10-19,2022-10
解放军和武警部队代表团继续讨论党的二十大报告,2022-10-19,2022-10
境内外记者探访北京市轨道交通指挥中心,2022-10-19,2022-10
前三季度人民币贷款增加18.08万亿元,2022-10-19,2022-10
100个国家乡村振兴示范县创建单位公布,2022-10-19,2022-10
外国政党政要和各界人士热烈祝贺中共二十大胜利召开,2022-10-19,2022-10
携手开创人类更加美好的未来,2022-10-19,2022-10
“为非洲国家发展带来更多有益借鉴”,2022-10-19,2022-10
中国式民主行之有效（国际论坛·读懂中国·读懂中国共产党）,2022-10-19,2022-10
“更好的日子还在后头呢！”（二十大时光）,2022-10-19,2022-10
伟大成就是拼出来、干出来、奋斗出来的（人民论坛）,2022-10-19,2022-10
共担复兴重任 共享伟大荣光,2022-10-19,2022-10
真理之光照亮复兴之路,2022-10-19,2022-10
不断谱写马克思主义中国化时代化新篇章,2022-10-19,2022-10
三件大事的“历史性胜利”（一见）,2022-10-19,2022-10
以时代精神激活文化生命力（党代表话报告）,2022-10-19,2022-10
用新的伟大奋斗创造新的伟业（党代表话报告）,2022-10-19,2022-10
脚踏实地发展实体经济（党代表话报告）,2022-10-19,2022-10
高质量推进地方高校改革发展（党代表话报告）,2022-10-19,2022-10
把青春的活力转换成创新的动力（党代表话报告）,2022-10-19,2022-10
推动创新链产业链资金链人才链深度融合（党代表话报告）,2022-10-19,2022-10
坚定不移将改革开放进行到底（新征程·高质量发展谱新篇）,2022-10-19,2022-10
发挥保险民生保障安全网作用（议报告 话发展）,2022-10-19,2022-10
推动能源行业高质量发展（议报告 话发展）,2022-10-19,2022-10
把发展经济的着力点放在实体经济上（议报告 话发展）,2022-10-19,2022-10
全方位夯实粮食安全根基（议报告 话发展）,2022-10-19,2022-10
坚持农业农村优先发展（议报告 话发展）,2022-10-19,2022-10
汇聚全面推进乡村振兴的磅礴力量（感言）,2022-10-19,2022-10
助力国家创新体系建设（议报告·创新驱动发展）,2022-10-19,2022-10
集聚力量进行科技攻关（议报告·创新驱动发展）,2022-10-19,2022-10
建设人与自然和谐共生的现代化（新征程·全心全意为人民服务）,2022-10-19,2022-10
促进高质量充分就业（议报告 话民生）,2022-10-19,2022-10
解决好人民群众急难愁盼问题（议报告 话民生）,2022-10-19,2022-10
协同发展养老事业和养老产业（议报告 话民生）,2022-10-19,2022-10
让群众享有更高品质医疗保障（议报告 话民生）,2022-10-19,2022-10
扎实推动乡村全面振兴（议报告 话民生）,2022-10-19,2022-10
让现代化建设成果惠及全体人民（快评）,2022-10-19,2022-10
加强煤炭清洁高效利用（议报告·积极稳妥推进碳达峰碳中和）,2022-10-19,2022-10
构建清洁低碳现代能源体系（议报告·积极稳妥推进碳达峰碳中和）,2022-10-19,2022-10
旗帜鲜明讲政治 步调一致向前进（把党建设得更加坚强有力）,2022-10-19,2022-10
坚持在学懂弄通做实上下功夫（党建论坛）,2022-10-19,2022-10
让乡亲们日子越过越好（我为群众办实事）,2022-10-19,2022-10
“人民”二字比天高（我为群众办实事）,2022-10-19,2022-10
坚定不移推进绿色发展（党代表议报告）,2022-10-19,2022-10
科技赋能高质量发展（党代表议报告）,2022-10-19,2022-10
全力推动知识产权保护（党代表议报告）,2022-10-19,2022-10
全面推进乡村振兴（党代表议报告）,2022-10-19,2022-10
自信自强 守正创新 踔厉奋发 勇毅前行,2022-10-19,2022-10
始终不渝坚持党的领导（新时代画卷·奋进十年）,2022-10-19,2022-10
走中国特色社会主义政治发展道路（新时代画卷·奋进十年）,2022-10-19,2022-10
工商银行 深入贯彻新发展理念 以金融力量服务高质量发展,2022-10-19,2022-10
改造老旧小区 满足居民所需（有温度的举措 暖民心的行动）,2022-10-19,2022-10
让小水果长成“致富果”（奋斗者正青春）,2022-10-19,2022-10
四川泸州 创新实施“民心守护”工程,2022-10-19,2022-10
水清岸绿 城市更美丽（美丽中国）,2022-10-19,2022-10
绿色发展动力足（走进县城看发展）,2022-10-19,2022-10
邮储银行江苏省分行：践行普惠金融 服务高质量发展,2022-10-19,2022-10
多国努力发掘农业文化遗产多方面价值（国际视点）,2022-10-19,2022-10
汉堡国际风能展首次设立氢能论坛,2022-10-19,2022-10
第二届世界粮食论坛在罗马开幕,2022-10-19,2022-10
人保资本保险资产管理有限公司 与产业共生 为企业赋能,2022-10-19,2022-10
东莞 坚持“科技创新+先进制造” 踔厉奋发向未来,2022-10-19,2022-10
把新时代中国特色社会主义不断推向前进（深入学习贯彻习近平新时代中国特色社会主义思想）,2022-10-19,2022-10
坚持中国特色社会主义道路（思想纵横）,2022-10-19,2022-10
贵阳市乌当区 踔厉奋发向未来 蓄势腾飞正当时,2022-10-19,2022-10
绘就天蓝地绿水清的美丽中国新画卷（绿色家园）,2022-10-19,2022-10
绿化广袤国土 添彩神州大地（生态论苑）,2022-10-19,2022-10
听花酒 运用酿酒新工艺 赋予白酒新价值,2022-10-19,2022-10
微众银行 发展普惠金融 助力共同富裕,2022-10-19,2022-10
新时代十年伟大变革具有里程碑意义,2022-10-20,2022-10
党的二十大各代表团继续举行分组会议,2022-10-20,2022-10
不断实现人民对美好生活的向往,2022-10-20,2022-10
共同奋斗创造美好生活（今日谈）,2022-10-20,2022-10
学习报告明方向 担当奋进立新功（二十大时光）,2022-10-20,2022-10
法治中国建设开创新局面,2022-10-20,2022-10
现代化基础设施体系加快构建,2022-10-20,2022-10
优化运力保畅通,2022-10-20,2022-10
世界政党政要和各界人士继续祝贺中共二十大胜利召开,2022-10-20,2022-10
推动实现全球共同繁荣（外媒看中国）,2022-10-20,2022-10
为人类和平与发展作贡献的政党（国际论坛·读懂中国·读懂中国共产党）,2022-10-20,2022-10
“村民们收入涨了好几倍，日子越过越好”（共创繁荣发展新时代）,2022-10-20,2022-10
“全球发展倡议回应了发展中国家诉求”,2022-10-20,2022-10
让青春在全面建设社会主义现代化国家的火热实践中绽放绚丽之花,2022-10-20,2022-10
坚定信仰信念、把握历史主动的根本所在（人民论坛）,2022-10-20,2022-10
国务院任免国家工作人员,2022-10-20,2022-10
新时代十年伟大变革具有里程碑意义,2022-10-20,2022-10
发表任内首份施政报告,2022-10-20,2022-10
时刻保持解决大党独有难题的清醒和坚定,2022-10-20,2022-10
增强志气、骨气、底气（一见）,2022-10-20,2022-10
加快实现高水平科技自立自强（党代表话报告）,2022-10-20,2022-10
扎实推动高质量发展（党代表话报告）,2022-10-20,2022-10
加快规划建设新型能源体系（党代表话报告）,2022-10-20,2022-10
办好人民满意的教育（党代表话报告）,2022-10-20,2022-10
促进高质量充分就业（新征程·全心全意为人民服务）,2022-10-20,2022-10
把保障人民健康放在优先发展战略位置（快评）,2022-10-20,2022-10
加快发展方式绿色转型（议报告 话发展）,2022-10-20,2022-10
让老区人民过上更好生活（议报告 话发展）,2022-10-20,2022-10
强化为民服务功能（议报告 话民生）,2022-10-20,2022-10
完善社会保障体系（议报告 话民生）,2022-10-20,2022-10
优化教育资源配置（议报告 话民生）,2022-10-20,2022-10
勇担筑梦育人使命（议报告 话民生）,2022-10-20,2022-10
建设堪当民族复兴重任的高素质干部队伍（把党建设得更加坚强有力）,2022-10-20,2022-10
聚天下英才而用之（党建论坛）,2022-10-20,2022-10
坚守岗位守护万家灯火（我为群众办实事）,2022-10-20,2022-10
让更多群众享受高水平医疗服务（我为群众办实事）,2022-10-20,2022-10
坚持为党育人为国育才（党代表议报告）,2022-10-20,2022-10
用心用情为群众排忧解难（党代表议报告）,2022-10-20,2022-10
努力提供更便捷的纳税服务（党代表议报告）,2022-10-20,2022-10
续写新时代“半条被子”故事（党代表议报告）,2022-10-20,2022-10
把发展进步的命运牢牢掌握在自己手中（二十大时光）,2022-10-20,2022-10
自我革命永远在路上（盛会走笔）,2022-10-20,2022-10
扎根大陆发展信心更足（观盛会 话感悟）,2022-10-20,2022-10
充满干劲建设农业强国（观盛会 话感悟）,2022-10-20,2022-10
让社区居民生活更美好（观盛会 话感悟）,2022-10-20,2022-10
助推文化产业蓬勃发展（观盛会 话感悟）,2022-10-20,2022-10
革命老区谱写发展新篇（观盛会 话感悟）,2022-10-20,2022-10
集体经济带动村民致富（观盛会 话感悟）,2022-10-20,2022-10
坚定信心 同心同德 埋头苦干 奋勇前进,2022-10-20,2022-10
增强实现中华民族伟大复兴的精神力量（新时代画卷·奋进十年）,2022-10-20,2022-10
满足人民日益增长的精神文化需求（新时代画卷·奋进十年）,2022-10-20,2022-10
仁和药业 助力中医药事业发展，服务健康美好生活,2022-10-20,2022-10
瓜果飘香日子旺（新时代画卷·奋进十年）,2022-10-20,2022-10
人工智能，为科研注入智慧动能（科技自立自强）,2022-10-20,2022-10
带头讲好红色故事（奋斗者正青春）,2022-10-20,2022-10
听花酒 运用酿酒新工艺 赋予白酒新价值,2022-10-20,2022-10
银联强健引擎 助商惠民计划,2022-10-20,2022-10
各地抢抓时节兴修水利（经济聚焦）,2022-10-20,2022-10
走清洁能源发展之路,2022-10-20,2022-10
广西 大力推进农业高质量发展,2022-10-20,2022-10
一些国家推动运河城市可持续发展的探索（国际视点）,2022-10-20,2022-10
“穿”在身上的健康管家（科技大观）,2022-10-20,2022-10
南京国家农创中心：在推动农业农村现代化进程中奋发有为,2022-10-20,2022-10
坚持把国家和民族发展放在自己力量的基点上（深入学习贯彻习近平新时代中国特色社会主义思想）,2022-10-20,2022-10
归根到底是老百姓的“幸福梦”（思想纵横）,2022-10-20,2022-10
站在人与自然和谐共生的高度谋划发展,2022-10-20,2022-10
伊利牛奶 助力健康中国,2022-10-20,2022-10
以中国式现代化全面推进中华民族伟大复兴,2022-10-21,2022-10
坚持农业农村优先发展,2022-10-21,2022-10
撸起袖子加油干，争创一流业绩（二十大时光）,2022-10-21,2022-10
李克强向科威特首相艾哈迈德致贺电,2022-10-21,2022-10
前三季度我国汽车出口211.7万辆（新数据 新看点）,2022-10-21,2022-10
一起来想 一起来干（今日谈）,2022-10-21,2022-10
中国特色大国外交开拓前行,2022-10-21,2022-10
不断塑造发展新动能新优势,2022-10-21,2022-10
数字人民币累计交易金额超千亿元,2022-10-21,2022-10
以中国式现代化全面推进中华民族伟大复兴,2022-10-21,2022-10
多国政党政要继续祝贺中共二十大胜利召开,2022-10-21,2022-10
“中国正以自信、有力的步伐向前迈进”（外国政党政要和友好人士看新时代中国共产党）,2022-10-21,2022-10
“给发展中国家带来希望”,2022-10-21,2022-10
中国共产党心系人民、胸怀天下（国际论坛·读懂中国·读懂中国共产党）,2022-10-21,2022-10
中方将同金砖伙伴一道，稳步推进扩员进程,2022-10-21,2022-10
外媒关注中国全面推进乡村振兴,2022-10-21,2022-10
在发展中保障和改善民生,2022-10-21,2022-10
依靠顽强斗争打开事业发展新天地（人民论坛）,2022-10-21,2022-10
祖国完全统一一定要实现，也一定能够实现！,2022-10-21,2022-10
一版责编：王 军 杨 旭 刘 念 二版责编：吴 燕 吕 莉 郭雪岩 三版责编：李 琰 张远南 时元皓 四版责编：胡安琪 张佳莹 杨烁壁,2022-10-21,2022-10
增强实现中华民族伟大复兴的精神力量,2022-10-21,2022-10
新领域新赛道 新动能新优势（一见）,2022-10-21,2022-10
以护水保水实现生态惠民（党代表话报告）,2022-10-21,2022-10
加快推进农业科技创新（党代表话报告）,2022-10-21,2022-10
用心绘就暖心民生画卷（党代表话报告）,2022-10-21,2022-10
提升专业队伍攻坚能力建设（党代表话报告）,2022-10-21,2022-10
抓好高素质干部队伍建设（党代表话报告）,2022-10-21,2022-10
深入开展法治宣传教育（党代表话报告）,2022-10-21,2022-10
全面推进乡村振兴（新征程·高质量发展谱新篇）,2022-10-21,2022-10
不断提升清洁能源消纳能力（议报告 话发展）,2022-10-21,2022-10
提升金融服务民生能力（议报告 话发展）,2022-10-21,2022-10
构建高水平科研平台（议报告 话发展）,2022-10-21,2022-10
为乡村振兴提供更多金融支持（议报告 话发展）,2022-10-21,2022-10
服务实体经济转型升级（议报告 话发展）,2022-10-21,2022-10
坚定不移推进高水平对外开放（感言）,2022-10-21,2022-10
加强关键核心技术攻关（议报告·加快建设制造强国）,2022-10-21,2022-10
用航天科技创造美好生活（议报告·加快建设制造强国）,2022-10-21,2022-10
把保障人民健康放在优先发展的战略位置（新征程·全心全意为人民服务）,2022-10-21,2022-10
站在人与自然和谐共生的高度谋划发展（快评）,2022-10-21,2022-10
不断提高气象现代化水平（议报告·提高公共服务水平）,2022-10-21,2022-10
保障人民生命财产安全（议报告·提高公共服务水平）,2022-10-21,2022-10
提高医疗服务水平（议报告 话民生）,2022-10-21,2022-10
加快补齐民生短板（议报告 话民生）,2022-10-21,2022-10
大力推进文化惠民（议报告 话民生）,2022-10-21,2022-10
持续增进民生福祉（议报告 话民生）,2022-10-21,2022-10
坚持大抓基层的鲜明导向（把党建设得更加坚强有力）,2022-10-21,2022-10
着力造就拔尖创新人才（党代表议报告）,2022-10-21,2022-10
建设现代化产业体系（党代表议报告）,2022-10-21,2022-10
培养德才兼备的优秀人才（党代表议报告）,2022-10-21,2022-10
以产业振兴推动乡村振兴（党代表议报告）,2022-10-21,2022-10
激发群众参与社区治理热情（党代表议报告）,2022-10-21,2022-10
为基层减负 为实干鼓劲（党建论坛）,2022-10-21,2022-10
用忠诚担当守护百姓平安（我为群众办实事）,2022-10-21,2022-10
以法治阳光温暖人心（我为群众办实事）,2022-10-21,2022-10
矢志不渝 笃行不怠 不负时代 不负人民,2022-10-21,2022-10
以创新实干接续奋斗（现场评论）,2022-10-21,2022-10
安徽天长 坚持创新引领 推进高质量发展,2022-10-21,2022-10
增进民生福祉，提高人民生活品质（新时代画卷·奋进十年）,2022-10-21,2022-10
为人民谋幸福 为世界谋大同（外国政党政要和友好人士看新时代中国共产党）,2022-10-21,2022-10
华侨城：深化改革创新 推动高质量发展,2022-10-21,2022-10
优化养老照护 专业服务入户（推动实现全体老年人享有基本养老服务①）,2022-10-21,2022-10
深化对口援助 激发内生力量（民生观）,2022-10-21,2022-10
渔家“秋耕”美如画,2022-10-21,2022-10
江西出台促进残疾人就业方案,2022-10-21,2022-10
广西推出44项便民利企举措,2022-10-21,2022-10
以实际行动助力乡村振兴,2022-10-21,2022-10
我们党坚定信仰信念、把握历史主动的根本所在（深入学习贯彻习近平新时代中国特色社会主义思想）,2022-10-21,2022-10
立足地方实际 提高履职能力,2022-10-21,2022-10
上汽MG MULAN 擦亮中国汽车国际名片,2022-10-21,2022-10
五粮液 砥砺实干酿造浓香 锐意进取迈向一流,2022-10-21,2022-10
保国利民 追求卓越,2022-10-21,2022-10
描绘万里河山 彰显时代气象（坚持“两创” 书写史诗）,2022-10-21,2022-10
心系人民  真情流淌（用优秀作品增强人民精神力量）,2022-10-21,2022-10
绿水青山  奋斗诗篇（用优秀作品增强人民精神力量）,2022-10-21,2022-10
以歌寄情  以剧载道（用优秀作品增强人民精神力量）,2022-10-21,2022-10
经典之作  创新演绎（用优秀作品增强人民精神力量）,2022-10-21,2022-10
入画成舞  意蕴丛生（用优秀作品增强人民精神力量）,2022-10-21,2022-10
走进国外“专精特新”企业（国际视点）,2022-10-21,2022-10
打造落实倡议新平台 汇聚发展共赢新动能,2022-10-21,2022-10
“欧洲交通周”引导绿色出行,2022-10-21,2022-10
“美美与共——中法文化交流活动”在巴黎举行,2022-10-21,2022-10
凝心聚力促发展幸福同酿担使命,2022-10-21,2022-10
平安中国 中国平安,2022-10-21,2022-10
党的二十大主席团举行第三次会议,2022-10-22,2022-10
做到“五个牢牢把握” 把二十大精神落到实处,2022-10-22,2022-10
更加自觉地担负起光荣使命（二十大时光）,2022-10-22,2022-10
用新的伟大奋斗创造新的伟业,2022-10-22,2022-10
加快实施创新驱动发展战略,2022-10-22,2022-10
怀抱梦想又脚踏实地 敢想敢为又善作善成（今日谈）,2022-10-22,2022-10
顺应时代要求 体现全党意志,2022-10-22,2022-10
让祖国天更蓝、山更绿、水更清,2022-10-22,2022-10
促进人与自然和谐共生,2022-10-22,2022-10
做到“五个牢牢把握” 把二十大精神落到实处,2022-10-22,2022-10
多国政党政要继续祝贺中共二十大胜利召开,2022-10-22,2022-10
让科技成果为更多人所及所享（国际社会看中国这十年）,2022-10-22,2022-10
推动树立平等、互鉴、对话、包容的文明观（和音·大国外交砥砺前行⑧）,2022-10-22,2022-10
发展全过程人民民主,2022-10-22,2022-10
“必须永远吹冲锋号”（人民论坛）,2022-10-22,2022-10
加快实施创新驱动发展战略,2022-10-22,2022-10
用新的伟大奋斗创造新的伟业,2022-10-22,2022-10
携手开创人类更加美好的未来,2022-10-22,2022-10
“最广泛、最真实、最管用的民主”（一见）,2022-10-22,2022-10
党代表话报告,2022-10-22,2022-10
坚持把发展经济的着力点放在实体经济上（新征程·高质量发展谱新篇）,2022-10-22,2022-10
让绿色成为高质量发展的鲜明底色（感言）,2022-10-22,2022-10
议报告·推进高水平对外开放,2022-10-22,2022-10
议报告 话发展,2022-10-22,2022-10
健全社会保障体系（新征程·全心全意为人民服务）,2022-10-22,2022-10
议报告·全面推进乡村振兴,2022-10-22,2022-10
议报告 话民生,2022-10-22,2022-10
保持党员队伍先进性和纯洁性（二十大时光）,2022-10-22,2022-10
体现大国担当 深化国际合作（点赞）,2022-10-22,2022-10
观盛会 话感悟,2022-10-22,2022-10
确保党永远不变质、不变色、不变味（把党建设得更加坚强有力）,2022-10-22,2022-10
时刻绷紧纪律规矩这根弦（党建论坛）,2022-10-22,2022-10
我为群众办实事,2022-10-22,2022-10
党代表议报告,2022-10-22,2022-10
坚持山水林田湖草沙一体化保护和系统治理（新时代画卷·奋进十年）,2022-10-22,2022-10
展现可信、可爱、可敬的中国形象,2022-10-22,2022-10
非凡十年 世界瞩目,2022-10-22,2022-10
国际回声,2022-10-22,2022-10
广西钦州：踔厉奋发 向海图强,2022-10-22,2022-10
协同治理 守护大美湿地（美丽中国）,2022-10-22,2022-10
全国城市细颗粒物平均浓度同比下降,2022-10-22,2022-10
三北工程启动20个科学绿化试点县建设,2022-10-22,2022-10
