烈士纪念日向人民英雄敬献花篮仪式在京隆重举行,2022-10-01,2022-10
充分发挥新型举国体制优势 一以贯之善始善终久久为功 努力实现我国高端装备制造更多重大突破,2022-10-01,2022-10
国务院举行国庆招待会,2022-10-01,2022-10
新时代中国共产党的历史使命,2022-10-01,2022-10
《习近平讲故事》（第二辑）出版发行,2022-10-01,2022-10
中共中央国务院对C919大型客机取得型号合格证的贺电,2022-10-01,2022-10
坚定不移推进中华民族伟大复兴历史进程（社论）,2022-10-01,2022-10
宁夏加快推进新能源建设（喜迎二十大）,2022-10-01,2022-10
烈士纪念日向人民英雄敬献花篮仪式在京隆重举行,2022-10-01,2022-10
大江奔流谱华章（江河奔腾看中国）,2022-10-01,2022-10
充分发挥新型举国体制优势 一以贯之善始善终久久为功 努力实现我国高端装备制造更多重大突破,2022-10-01,2022-10
新时代中国共产党的历史使命,2022-10-01,2022-10
在庆祝中华人民共和国成立七十三周年招待会上的致辞,2022-10-01,2022-10
中国继续坚持走和平发展道路 坚持改革开放基本国策,2022-10-01,2022-10
凝心聚伟力 奋进谱华章,2022-10-01,2022-10
李克强会见2022年度中国政府友谊奖获奖外国专家,2022-10-01,2022-10
中国政府友谊奖颁奖仪式在北京举行,2022-10-01,2022-10
C919飞机型号合格证颁证仪式在北京举行,2022-10-01,2022-10
国务院举行国庆招待会,2022-10-01,2022-10
探索科学高地 服务人类健康（二十大代表风采）,2022-10-01,2022-10
培养农业人才 带动农民增收（二十大代表风采）,2022-10-01,2022-10
深入开展安全生产大检查“回头看”督导检查,2022-10-01,2022-10
《总体国家安全观学习纲要》繁体版在香港地区出版发行,2022-10-01,2022-10
我国首艘2000吨级风电安装平台交付,2022-10-01,2022-10
中国队挺进决赛，追平历史最好成绩,2022-10-01,2022-10
凝心聚伟力 奋进谱华章,2022-10-01,2022-10
推动长江经济带高质量发展（新时代画卷·江河奔腾看中国）,2022-10-01,2022-10
鲜艳的五星红旗 最深情的祝福,2022-10-01,2022-10
中国农业发展银行 强化农业政策性银行责任担当 高质量服务全面推进乡村振兴,2022-10-01,2022-10
绘写大江大河的万千气象,2022-10-01,2022-10
欢度国庆节 喜迎二十大,2022-10-02,2022-10
数字经济发展跃上新台阶（奋进新征程 建功新时代·非凡十年）,2022-10-02,2022-10
山西积极探索基层治理新路径新举措（喜迎二十大）,2022-10-02,2022-10
深化农业供给侧结构性改革，走质量兴农之路（乡村振兴一线探访）,2022-10-02,2022-10
各界观众走进中国共产党历史展览馆汲取奋进力量,2022-10-02,2022-10
爱国是心之所系、情之所归（今日谈）,2022-10-02,2022-10
浩荡黄河奏响新时代乐章（江河奔腾看中国）,2022-10-02,2022-10
青藏高原建起一座“智慧城”,2022-10-02,2022-10
深化农业供给侧结构性改革，走质量兴农之路（乡村振兴一线探访）,2022-10-02,2022-10
外国领导人祝贺中华人民共和国成立73周年,2022-10-02,2022-10
新时代中国外交的根本遵循和行动指南（和音·大国外交砥砺前行①）,2022-10-02,2022-10
山西积极探索基层治理新路径新举措（喜迎二十大）,2022-10-02,2022-10
中企投建的柬埔寨首条高速公路试运营,2022-10-02,2022-10
“共创更加美好生活”,2022-10-02,2022-10
中国第八批赴南苏丹（朱巴）维和步兵营获联合国“和平荣誉勋章”,2022-10-02,2022-10
带头创新实干 助推乡村振兴（二十大代表风采）,2022-10-02,2022-10
C919大飞机迎来发展里程碑,2022-10-02,2022-10
大飞机，飞出创新发展新高度（人民论坛）,2022-10-02,2022-10
践行使命担当 潜心教书育人（二十大代表风采）,2022-10-02,2022-10
香港、澳门特区政府举行升旗仪式和酒会庆祝新中国成立73周年,2022-10-02,2022-10
“筑梦——我们的新时代美术摄影作品展”开幕,2022-10-02,2022-10
数字经济发展跃上新台阶（奋进新征程 建功新时代·非凡十年）,2022-10-02,2022-10
让黄河成为造福人民的幸福河（新时代画卷·江河奔腾看中国）,2022-10-02,2022-10
褒扬功勋 礼赞英雄,2022-10-02,2022-10
建立国家功勋荣誉表彰制度 弘扬社会主义核心价值观,2022-10-02,2022-10
展现首批“共和国勋章”获得者的人生华章,2022-10-02,2022-10
高质量建设国家植物园 共爱共享自然之美,2022-10-02,2022-10
保护植物就是保护人类的未来（生态论苑）,2022-10-02,2022-10
“让更多文物和文化遗产活起来”（坚持“两创” 书写史诗·非凡十年）,2022-10-02,2022-10
破译古人类的“多彩生活”,2022-10-02,2022-10
欢度国庆节 喜迎二十大,2022-10-03,2022-10
消费“主引擎”动力强劲（奋进新征程 建功新时代·非凡十年）,2022-10-03,2022-10
广东加快推动海洋经济高质量发展（喜迎二十大）,2022-10-03,2022-10
坚持人与自然和谐共生，走乡村绿色发展之路（乡村振兴一线探访）,2022-10-03,2022-10
高唱新时代奋斗者之歌（今日谈）,2022-10-03,2022-10
倡导绿色低碳 弘扬新风正气,2022-10-03,2022-10
协同发展 产业兴城（走进县城看发展）,2022-10-03,2022-10
港口作业忙,2022-10-03,2022-10
坚持人与自然和谐共生，走乡村绿色发展之路（乡村振兴一线探访）,2022-10-03,2022-10
一版责编：张彦春 刘 念 康 岩 二版责编：王 军 臧春蕾 张伟昊 三版责编：高 石 曲 颂 刘 融 四版责编：林 琳 白之羽 韩春瑶,2022-10-03,2022-10
多国人士盛赞中国十年发展成就 期待深化合作,2022-10-03,2022-10
架设合作之桥 促进共同发展（国际论坛）,2022-10-03,2022-10
推动构建更加公正合理的国际秩序,2022-10-03,2022-10
“为家乡农业发展带来机遇”,2022-10-03,2022-10
谱写中多友谊精彩篇章（大使随笔）,2022-10-03,2022-10
联合国人权理事会第五十一届会议“人类命运共同体视野下的人权发展”边会举行,2022-10-03,2022-10
立足平凡岗位 服务社区居民（二十大代表风采）,2022-10-03,2022-10
历经水火淬炼 保护群众安全（二十大代表风采）,2022-10-03,2022-10
努力绘就乡村振兴的壮美画卷（人民论坛）,2022-10-03,2022-10
我国第四批预备航天员选拔工作启动,2022-10-03,2022-10
七彩田园 多彩生活,2022-10-03,2022-10
香港特区行政长官欢迎和感谢国家在港选拔载荷专家,2022-10-03,2022-10
中国男队和女队均取得小组赛两连胜,2022-10-03,2022-10
京雄商高铁雄安新区至商丘段开工建设,2022-10-03,2022-10
消费“主引擎”动力强劲（奋进新征程 建功新时代·非凡十年）,2022-10-03,2022-10
广东加快推动海洋经济高质量发展（喜迎二十大）,2022-10-03,2022-10
松辽碧水间 振兴谱新篇（新时代画卷·江河奔腾看中国）,2022-10-03,2022-10
展现大国制造的历史记忆（华夏博物之旅）,2022-10-03,2022-10
劳模印记,2022-10-03,2022-10
演绎人与自然和谐共生的生动故事（绿色家园）,2022-10-03,2022-10
共建生机勃发的地球生命共同体（生态论苑）,2022-10-03,2022-10
在城市，转角遇见绿色,2022-10-03,2022-10
欢度国庆节 喜迎二十大,2022-10-04,2022-10
我国产业工人队伍不断壮大（奋进新征程 建功新时代·非凡十年）,2022-10-04,2022-10
上海完成中心城区成片旧改,2022-10-04,2022-10
天津推动职业教育高质量发展（喜迎二十大）,2022-10-04,2022-10
脚踏实地把每件平凡的事做好（今日谈）,2022-10-04,2022-10
凝聚共识 全民行动,2022-10-04,2022-10
加快推进“一件事一次办”打造政务服务升级版,2022-10-04,2022-10
农村公路服务和安全保障能力提升,2022-10-04,2022-10
高铁疾驰 出行有序,2022-10-04,2022-10
“海基一号”投用,2022-10-04,2022-10
千里淮河展新颜（江河奔腾看中国）,2022-10-04,2022-10
一版责编：张彦春 刘 念 康 岩 二版责编：王 军 臧春蕾 邓剑洋 三版责编：孟祥麟 张矜若 尚凯元 四版责编：沈 寅 白之羽 韩春瑶,2022-10-04,2022-10
柬埔寨进入“高速公路时代”（共建“一带一路”）,2022-10-04,2022-10
中国国际影响力、感召力、塑造力显著提升（和音·大国外交砥砺前行②）,2022-10-04,2022-10
中国成功连任国际电信联盟理事国,2022-10-04,2022-10
美国输出通胀拖累世界经济复苏（钟声）,2022-10-04,2022-10
坚持自主创新 掌握关键技术（二十大代表风采）,2022-10-04,2022-10
推动产业发展 带动村民增收（二十大代表风采）,2022-10-04,2022-10
景区活动精彩纷呈,2022-10-04,2022-10
澳门宣布选拔载荷专家基本条件,2022-10-04,2022-10
清洁河道,2022-10-04,2022-10
中国男队和女队继续保持小组赛全胜,2022-10-04,2022-10
天津推动职业教育高质量发展（喜迎二十大）,2022-10-04,2022-10
我国产业工人队伍不断壮大（奋进新征程 建功新时代·非凡十年）,2022-10-04,2022-10
治水惠民 淮河安澜（新时代画卷·江河奔腾看中国）,2022-10-04,2022-10
传承红色基因 凝聚奋进力量,2022-10-04,2022-10
增强革命文化的吸引力,2022-10-04,2022-10
贵州茅台 重阳·下沙 顺时生产 酒香天成,2022-10-04,2022-10
拓宽文学价值 激发创造活力（创造性转化创新性发展纵横谈）,2022-10-04,2022-10
拥抱生活 讴歌时代（艺海观澜）,2022-10-04,2022-10
奋斗点亮少年梦想,2022-10-04,2022-10
在找矿突破战略行动中发挥更大作用 奋力书写“英雄地质队”新篇章,2022-10-05,2022-10
希望的田野 耕耘的画卷,2022-10-05,2022-10
感悟伟大成就 汲取奋进力量,2022-10-05,2022-10
欢度国庆节 喜迎二十大,2022-10-05,2022-10
力量生于团结，幸福源自奋斗（今日谈）,2022-10-05,2022-10
田里来了年轻的农技人（一线调研）,2022-10-05,2022-10
用知识和技术改变乡村（子夜走笔）,2022-10-05,2022-10
科学精准落实各项防疫措施,2022-10-05,2022-10
轻工业规上企业实现营收15.2万亿元,2022-10-05,2022-10
培育年馍产业 带动百姓增收（走进县城看发展）,2022-10-05,2022-10
共同推进构建人类命运共同体的伟大进程（和音·大国外交砥砺前行③）,2022-10-05,2022-10
“在交流互鉴中汲取养分，在时代进步中根深叶茂”（大道之行）,2022-10-05,2022-10
“喝上了干净水，住进了新房子”（共创繁荣发展新时代）,2022-10-05,2022-10
中方呼吁会员国及时足额向联合国缴费,2022-10-05,2022-10
“可靠的合作平台”,2022-10-05,2022-10
感悟伟大成就 汲取奋进力量,2022-10-05,2022-10
探寻中华文明 传播传统文化（二十大代表风采）,2022-10-05,2022-10
坚守本职工作 守护生命健康（二十大代表风采）,2022-10-05,2022-10
都市消费持续火热,2022-10-05,2022-10
希望的田野 耕耘的画卷,2022-10-05,2022-10
壬寅（2022）年中国仙都祭祀轩辕黄帝大典在浙江缙云举行,2022-10-05,2022-10
珠江闽江生态向好景象新（新时代画卷·江河奔腾看中国）,2022-10-05,2022-10
金秋时节 橙黄橘绿（二十四节气）,2022-10-05,2022-10
“寒露”“白露”区别何在？,2022-10-05,2022-10
“霜降”的“霜”从何而来？,2022-10-05,2022-10
金风飘菊蕊（跟着唐诗宋词去旅游）,2022-10-05,2022-10
文化空间提质增效,2022-10-05,2022-10
让新型文化空间常有常新,2022-10-05,2022-10
清清江河水滋润美好生活,2022-10-05,2022-10
凝聚党心民心 永葆生机活力,2022-10-06,2022-10
有力举措有效激发市场活力（奋进新征程 建功新时代·非凡十年）,2022-10-06,2022-10
海南推进热带雨林国家公园建设（喜迎二十大）,2022-10-06,2022-10
更好知史爱党、知史爱国（今日谈）,2022-10-06,2022-10
坚守在岗位 喜迎二十大,2022-10-06,2022-10
扩大政务服务“跨省通办”范围进一步提升服务效能,2022-10-06,2022-10
让青蒿素更好地造福人类,2022-10-06,2022-10
凝聚党心民心 永葆生机活力,2022-10-06,2022-10
新一代信息技术产业迈上新台阶（经济新方位）,2022-10-06,2022-10
一版责编：张彦春 刘涓溪 张帅祯 二版责编：王 军 巩育华 邓剑洋 三版责编：王 芳 莽九晨 刘 慧 四版责编：沈 寅 白之羽 林子夜,2022-10-06,2022-10
加强减灾国际合作 助力经济社会发展（共建“一带一路”）,2022-10-06,2022-10
土库曼斯坦与中国：携手沿着进步与繁荣之路前进（国际论坛·读懂中国·读懂中国共产党）,2022-10-06,2022-10
留学生体验农事,2022-10-06,2022-10
有力举措有效激发市场活力（奋进新征程 建功新时代·非凡十年）,2022-10-06,2022-10
壮大集体经济 助力乡村振兴（二十大代表风采）,2022-10-06,2022-10
推动产业发展 带动群众增收（二十大代表风采）,2022-10-06,2022-10
焕发乡村文明新气象,2022-10-06,2022-10
第八届全国道德模范故事汇基层巡演启动,2022-10-06,2022-10
海南推进热带雨林国家公园建设（喜迎二十大）,2022-10-06,2022-10
成都努力建设世界赛事名城,2022-10-06,2022-10
清清塔河万泉河 永续发展惠人民（新时代画卷·江河奔腾看中国）,2022-10-06,2022-10
传承弘扬长城文化 提升保护利用水平,2022-10-06,2022-10
让长城焕发新的生机活力,2022-10-06,2022-10
《领航》唱出激荡昂扬的时代旋律,2022-10-06,2022-10
拓展艺术实践平台 培养青年音乐人才（来自现场的声音）,2022-10-06,2022-10
展现奋斗人生的光彩,2022-10-06,2022-10
经济体制改革阔步向前（奋进新征程 建功新时代·非凡十年）,2022-10-07,2022-10
水木湛清华 奋进新征程,2022-10-07,2022-10
广西擦亮“山清水秀生态美”金字招牌（喜迎二十大）,2022-10-07,2022-10
我国新添4处世界灌溉工程遗产,2022-10-07,2022-10
坚守在岗位 喜迎二十大,2022-10-07,2022-10
让新能源发得出供得上用得好（经济新方位·巩固经济回升向好趋势）,2022-10-07,2022-10
保护好黄河口湿地（人民满意的公务员）,2022-10-07,2022-10
牢牢守住不发生规模性疫情的底线,2022-10-07,2022-10
用上绿电，更要用好绿电（快评）,2022-10-07,2022-10
绿电高速有了“中转仓”,2022-10-07,2022-10
一版责编：张彦春 刘涓溪 张帅祯 二版责编：王 军 巩育华 邓剑洋 三版责编：王 芳 刘 歌 王海林 四版责编：沈 寅 白之羽 林子夜,2022-10-07,2022-10
外国领导人祝贺中华人民共和国成立73周年,2022-10-07,2022-10
坚定不移走和平发展道路（和音·大国外交砥砺前行④）,2022-10-07,2022-10
“两国人民情谊的生动体现”,2022-10-07,2022-10
经济体制改革阔步向前（奋进新征程 建功新时代·非凡十年）,2022-10-07,2022-10
刘建超出席“生态政策和可持续发展”国际政党论坛,2022-10-07,2022-10
外交部发言人就中方在联合国人权理事会挫败涉疆决定草案答记者问,2022-10-07,2022-10
中摩发行建交30周年纪念封和纪念邮票,2022-10-07,2022-10
守护美丽南海 带动群众致富（二十大代表风采）,2022-10-07,2022-10
播撒法治种子 呵护孩子成长（二十大代表风采）,2022-10-07,2022-10
文化消费丰富多彩,2022-10-07,2022-10
澳门首部沉浸式爱国主义戏剧首演,2022-10-07,2022-10
假期涌动健身潮 新兴项目受青睐,2022-10-07,2022-10
水木湛清华 奋进新征程,2022-10-07,2022-10
千年运河 水韵华章（新时代画卷·江河奔腾看中国）,2022-10-07,2022-10
古寨风光韵味长（走进传统村落）,2022-10-07,2022-10
英谈村传统民居建筑的特色,2022-10-07,2022-10
汲古润今 传承创新,2022-10-07,2022-10
汇集非遗保护理论实践新成果,2022-10-07,2022-10
《我的家乡十八洞》（新书架）,2022-10-07,2022-10
《风雅中国：杨泓说文物》（新书架）,2022-10-07,2022-10
认识万物互联的新型“界面”（序与跋）,2022-10-07,2022-10
《习近平关于依规治党论述摘编》出版发行,2022-10-08,2022-10
中国共产党第十九届中央纪律检查委员会第七次全体会议公报,2022-10-08,2022-10
加强新时代高技能人才队伍建设,2022-10-08,2022-10
绘就人水和谐的美丽图景（奋进新征程 建功新时代·非凡十年）,2022-10-08,2022-10
乌兰牧骑传递党的声音和关怀（喜迎二十大）,2022-10-08,2022-10
永远保持奋斗韧劲（今日谈）,2022-10-08,2022-10
国家财政性教育经费10年累计支出33.5万亿元（新数据 新看点）,2022-10-08,2022-10
全力以赴稳就业（经济新方位·巩固经济回升向好趋势）,2022-10-08,2022-10
科学精准做好疫情防控工作,2022-10-08,2022-10
走进农家农田问农情（人民满意的公务员）,2022-10-08,2022-10
“只用一个星期，我就适应了新工作”,2022-10-08,2022-10
帮得准 扶得稳（快评）,2022-10-08,2022-10
中央网信办持续深入打击网络谣言和虚假信息,2022-10-08,2022-10
一版责编：杨 旭 张帅祯 赵 政 二版责编：王 军 蒋雪婕 祁嘉润 三版责编：李 琰 杨 迅 时元皓 四版责编：袁振喜 陈亚楠 栾心怡,2022-10-08,2022-10
为世界减贫事业提供中国样本（外国政党政要和友好人士看新时代中国共产党）,2022-10-08,2022-10
中国共产党始终保持蓬勃生命力（国际论坛·读懂中国·读懂中国共产党）,2022-10-08,2022-10
“推动全球发展的探索者和引领者”,2022-10-08,2022-10
立体交通促发展,2022-10-08,2022-10
“在我们的全球业务中发挥着重要作用”,2022-10-08,2022-10
陈竺出席二十国集团议长会议,2022-10-08,2022-10
“丝路驿站”旧貌换新颜,2022-10-08,2022-10
孔子学院中文课堂走进土耳其总统府,2022-10-08,2022-10
让穷山坳开出致富花（二十大代表风采）,2022-10-08,2022-10
为了更多山区孩子（二十大代表风采）,2022-10-08,2022-10
为党和国家事业发展提供根本政治保证（人民论坛）,2022-10-08,2022-10
十六集大型电视专题片《领航》即将播出,2022-10-08,2022-10
国庆期间全国社会大局稳定治安秩序良好,2022-10-08,2022-10
绘就人水和谐的美丽图景（奋进新征程 建功新时代·非凡十年）,2022-10-08,2022-10
海河两岸涌新潮（新时代画卷·江河奔腾看中国）,2022-10-08,2022-10
展现团队力量 实现赛前目标,2022-10-08,2022-10
加强新时代高技能人才队伍建设,2022-10-08,2022-10
辽宁省政协原党组副书记、副主席孙远良严重违纪违法被开除党籍,2022-10-08,2022-10
内蒙古自治区高级人民法院原党组书记、院长胡毅峰严重违纪违法被开除党籍,2022-10-08,2022-10
中国联合网络通信集团有限公司原党组副书记、总经理李国华严重违纪违法被开除党籍,2022-10-08,2022-10
武汉东湖 努力打造“世界名湖 人民乐园”,2022-10-08,2022-10
家乡路，宽阔又通畅,2022-10-08,2022-10
咬定青山不放松,2022-10-09,2022-10
营养改善计划惠及农村学生3.5亿人次（奋进新征程 建功新时代·非凡十年）,2022-10-09,2022-10
中国共产党第二十次全国代表大会新闻中心10月12日启用并对外接待服务,2022-10-09,2022-10
陕西加快发展新能源汽车产业（喜迎二十大）,2022-10-09,2022-10
传承发展提升农耕文明，走乡村文化兴盛之路（乡村振兴一线探访）,2022-10-09,2022-10
10年来单位国内生产总值能耗年均下降3.3%,2022-10-09,2022-10
推进能上能下 激励担当作为（政策解读）,2022-10-09,2022-10
发挥陆港作用 带动产业发展（走进县城看发展）,2022-10-09,2022-10
咬定青山不放松,2022-10-09,2022-10
永定河再次实现全线通水,2022-10-09,2022-10
为建设安全稳定的世界提供中国方案（国际论坛·读懂中国·读懂中国共产党）,2022-10-09,2022-10
为世界和平与发展和人类文明进步贡献智慧和力量（国际社会看中国这十年）,2022-10-09,2022-10
营养改善计划惠及农村学生3.5亿人次（奋进新征程 建功新时代·非凡十年）,2022-10-09,2022-10
“示范中心就是我的家”,2022-10-09,2022-10
点亮山里女孩的梦想（二十大代表风采）,2022-10-09,2022-10
刻苦钻研 冲锋在前（二十大代表风采）,2022-10-09,2022-10
成为世界经济增长的主要稳定器和动力源（人民论坛）,2022-10-09,2022-10
传承发展提升农耕文明，走乡村文化兴盛之路（乡村振兴一线探访）,2022-10-09,2022-10
国务院任免国家工作人员,2022-10-09,2022-10
举办“对党忠诚 不负人民”家风故事分享会,2022-10-09,2022-10
中国队勇夺女团五连冠,2022-10-09,2022-10
国庆假期全国安全形势总体平稳,2022-10-09,2022-10
花团锦簇迎盛会（新时代画卷）,2022-10-09,2022-10
丰收的景象 增收的喜悦（走进传统村落）,2022-10-09,2022-10
厚植爱国情怀 砥砺强国之志（深聚焦）,2022-10-09,2022-10
热爱祖国是立身之本成才之基（教育时评）,2022-10-09,2022-10
上好“大思政课” 打好人生底色（师说）,2022-10-09,2022-10
匠心铸“箭” 逐梦太空（科技群英绘·最美科技工作者）,2022-10-09,2022-10
“坚持美人之美、美美与共”（坚持“两创” 书写史诗·非凡十年）,2022-10-09,2022-10
让有福之州更好造福于民,2022-10-10,2022-10
《习近平总书记教育重要论述讲义》英文版出版发行,2022-10-10,2022-10
建强战斗堡垒 夯实执政之基,2022-10-10,2022-10
创新第一动力更强劲（奋进新征程 建功新时代·非凡十年）,2022-10-10,2022-10
伟大事业都始于梦想、基于创新、成于实干（今日谈）,2022-10-10,2022-10
贵州推动生态文明建设出新绩（喜迎二十大）,2022-10-10,2022-10
全国县乡两级人大换届选举工作全面完成,2022-10-10,2022-10
增强对当前疫情防控政策的信心和耐心,2022-10-10,2022-10
《强军十年大事记》出版发行,2022-10-10,2022-10
让有福之州更好造福于民,2022-10-10,2022-10
中国真心实意帮助太平洋岛国（国际论坛）,2022-10-10,2022-10
在高质量发展的道路上不断书写新篇章（国际社会看中国这十年）,2022-10-10,2022-10
创新第一动力更强劲（奋进新征程 建功新时代·非凡十年）,2022-10-10,2022-10
“为绿色经济作出积极贡献”,2022-10-10,2022-10
巩固务实合作 维护地区安全,2022-10-10,2022-10
五十余载 见证医者仁心（二十大代表风采）,2022-10-10,2022-10
千次实验 终成高效炼金（二十大代表风采）,2022-10-10,2022-10
传播真善美 传递正能量（人民论坛）,2022-10-10,2022-10
建强战斗堡垒 夯实执政之基,2022-10-10,2022-10
坚持走中国特色自主创新道路,2022-10-10,2022-10
科技自立自强筑牢国家强盛之基（奋进新征程 建功新时代·非凡十年）,2022-10-10,2022-10
北斗应用，助力美好生活（新时代新作为）,2022-10-10,2022-10
医药创新，服务人民健康（新时代新作为）,2022-10-10,2022-10
以科技的主动赢得国家发展的主动（潮头观澜）,2022-10-10,2022-10
把创新作为引领发展的第一动力（奋进新征程 建功新时代·非凡十年）,2022-10-10,2022-10
奋进新征程 建功新时代（新时代画卷·奋进十年）,2022-10-10,2022-10
沈阳：奋力推进城市治理高质量发展,2022-10-10,2022-10
新时代十年的伟大变革具有里程碑意义（学习习近平总书记重要讲话精神，迎接党的二十大）,2022-10-10,2022-10
关于第二批全国法治政府建设示范地区和项目名单的公示,2022-10-10,2022-10
幸福邻里坊 服务在身边,2022-10-10,2022-10
中国队勇夺男团十连冠,2022-10-10,2022-10
招商银行股份有限公司原党委书记、行长田惠宇严重违纪违法被开除党籍和公职,2022-10-10,2022-10
我科学家实现百公里级自由空间高精度时间频率传递,2022-10-10,2022-10
冲锋在缉毒战场最前沿（人民满意的公务员）,2022-10-10,2022-10
古城“融”出新风采,2022-10-10,2022-10
中国信保深圳分公司 赋能深圳外贸高质量发展,2022-10-10,2022-10
共谋全球生态文明建设之路（人民观点）,2022-10-10,2022-10
建设贸易强国，拓展外贸发展空间（评论员观察）,2022-10-10,2022-10
让干部有更多时间和精力抓落实（人民时评）,2022-10-10,2022-10
致读者,2022-10-10,2022-10
海辰储能 专业让能源更安全,2022-10-10,2022-10
蒙牛 携手世界杯 夯实品牌发展之基,2022-10-10,2022-10
编者按（学术圆桌）,2022-10-10,2022-10
中国式现代化道路新在哪里（学术圆桌）,2022-10-10,2022-10
新型城镇化是中国式现代化的必然选择（学术圆桌）,2022-10-10,2022-10
中国式现代化具有重要启示意义（学术圆桌）,2022-10-10,2022-10
美国军事霸权主义危害全球和平稳定（深度观察）,2022-10-10,2022-10
沙特大力发展旅游业,2022-10-10,2022-10
蒙古国积极推进新铁路计划,2022-10-10,2022-10
江苏省常州市钟楼区 数字经济乘“云”而上,2022-10-10,2022-10
恒洁卫浴 厚植品质实力，奋力书写高质量发展新篇章,2022-10-10,2022-10
减负增效重实干 担当尽责开新篇,2022-10-11,2022-10
习近平致电祝贺范德贝伦当选连任奥地利总统,2022-10-11,2022-10
现代产业体系迈出坚实步伐（奋进新征程 建功新时代·非凡十年）,2022-10-11,2022-10
四川全力以赴抓项目促投资稳经济（喜迎二十大）,2022-10-11,2022-10
智慧港口运转高效,2022-10-11,2022-10
创新乡村治理体系，走乡村善治之路（乡村振兴一线探访）,2022-10-11,2022-10
