我国快递网点基本实现乡镇全覆盖（新数据 新看点）,2022-10-11,2022-10
企业实力活力持续增强（经济新方位）,2022-10-11,2022-10
“动态清零”可持续而且必须坚持,2022-10-11,2022-10
全国铁路11日起调整运行图,2022-10-11,2022-10
减负增效重实干 担当尽责开新篇,2022-10-11,2022-10
现代产业体系迈出坚实步伐（奋进新征程 建功新时代·非凡十年）,2022-10-11,2022-10
推动全球人权治理健康发展,2022-10-11,2022-10
共建“一带一路”促进共同发展繁荣（和音·大国外交砥砺前行⑤）,2022-10-11,2022-10
以实际行动应对全球性挑战,2022-10-11,2022-10
“共商共建共享的生动体现”,2022-10-11,2022-10
春华秋实五十年 携手合作谱新篇（大使随笔）,2022-10-11,2022-10
育好一株苗 让丁香绽放高原之上（二十大代表风采）,2022-10-11,2022-10
做好一个阀 为工业强基贡献力量（二十大代表风采）,2022-10-11,2022-10
开创了我国改革开放新局面（人民论坛）,2022-10-11,2022-10
从“卖石头”，到“卖梨子”，再到“卖生态”（深阅读·关注生态产品价值实现）,2022-10-11,2022-10
空间站梦天实验舱已完成推进剂加注,2022-10-11,2022-10
一版责编：杨 旭 刘 念 赵 政 二版责编：吴 燕 蒋雪婕 郭雪岩 三版责编：李 琰 张远南 时元皓 四版责编：袁振喜 陈亚楠 张佳莹,2022-10-11,2022-10
加快构建现代产业体系,2022-10-11,2022-10
我国产业发展综合实力稳步提升（奋进新征程 建功新时代·非凡十年）,2022-10-11,2022-10
光伏业凸显新优势（新时代新作为）,2022-10-11,2022-10
快递业跑出加速度（新时代新作为）,2022-10-11,2022-10
坚定不移推动产业高质量发展（潮头观澜）,2022-10-11,2022-10
建设创新引领、协同发展的产业体系（奋进新征程 建功新时代·非凡十年）,2022-10-11,2022-10
奋进新征程 建功新时代（新时代画卷·奋进十年）,2022-10-11,2022-10
湖南服务国家战略 展现地方担当,2022-10-11,2022-10
毫不动摇坚持和加强党的全面领导（学习习近平总书记重要讲话精神，迎接党的二十大）,2022-10-11,2022-10
“我与跨境电商共成长”（奋斗者正青春）,2022-10-11,2022-10
创新乡村治理体系，走乡村善治之路（乡村振兴一线探访）,2022-10-11,2022-10
丰富发展了中国特色大国外交理论和实践创新成果（人民观点）,2022-10-11,2022-10
建设航空强国，奋力推动创新发展（评论员观察）,2022-10-11,2022-10
激发涌现更多专精特新中小企业（人民时评）,2022-10-11,2022-10
江西 生态鄱阳湖 绿色农产品,2022-10-11,2022-10
明光市 美丽乡村路 遍开振兴花,2022-10-11,2022-10
坚持以中国式现代化推进中华民族伟大复兴（深入学习贯彻习近平新时代中国特色社会主义思想）,2022-10-11,2022-10
坚持底线思维（思想纵横）,2022-10-11,2022-10
重庆两江新区：更好发挥引领示范作用 奋力打造现代化建设“升级版”,2022-10-11,2022-10
近郊游选择越来越多,2022-10-11,2022-10
牢牢守住安全底线,2022-10-11,2022-10
珠海国资国企激发产业动能,2022-10-11,2022-10
成都市青白江区 加快建设陆港枢纽 推动高质量发展,2022-10-11,2022-10
湖南高速集团：锚定高质量发展目标 勇当开路先锋,2022-10-11,2022-10
海南澄迈 奋力谱写乡村振兴新篇章,2022-10-11,2022-10
高质量发展迈出坚实步伐（奋进新征程 建功新时代·非凡十年）,2022-10-12,2022-10
习近平同德国总统施泰因迈尔就中德建交50周年互致贺电,2022-10-12,2022-10
《习近平谈治国理政》第一卷冰岛文版首发式在雷克雅未克举行,2022-10-12,2022-10
各地开展喜迎二十大主题文明实践活动（喜迎二十大）,2022-10-12,2022-10
浙江淳安下姜村携手邻村迈向共同富裕（喜迎二十大）,2022-10-12,2022-10
王岐山将出席亚洲相互协作与信任措施会议第六次峰会,2022-10-12,2022-10
打好精准脱贫攻坚战，走中国特色减贫之路（乡村振兴一线探访）,2022-10-12,2022-10
登记在册市场主体达1.63亿户,2022-10-12,2022-10
敢于拼搏 善于拼搏（今日谈）,2022-10-12,2022-10
高质量发展迈出坚实步伐（奋进新征程 建功新时代·非凡十年）,2022-10-12,2022-10
“躺平”不可取，“躺赢”不可能,2022-10-12,2022-10
为世界人权事业进步贡献力量,2022-10-12,2022-10
彭丽媛向联合国教科文组织2022年女童和妇女教育奖颁奖仪式致贺词,2022-10-12,2022-10
始终不渝做全球发展的贡献者（和音·大国外交砥砺前行⑥）,2022-10-12,2022-10
各地开展喜迎二十大主题文明实践活动（喜迎二十大）,2022-10-12,2022-10
中国医疗队在几内亚开展急救培训活动,2022-10-12,2022-10
浙江淳安下姜村携手邻村迈向共同富裕（喜迎二十大）,2022-10-12,2022-10
构建新发展格局 重塑新竞争优势（奋进新征程 建功新时代·非凡十年）,2022-10-12,2022-10
在疾控一线守护人民健康（二十大代表风采）,2022-10-12,2022-10
把绿色能源送到千家万户（二十大代表风采）,2022-10-12,2022-10
打好精准脱贫攻坚战，走中国特色减贫之路（乡村振兴一线探访）,2022-10-12,2022-10
《2021—2035年国家古籍工作规划》公布实施,2022-10-12,2022-10
指引我们走出一条中国特色大国外交新路（人民观点）,2022-10-12,2022-10
建设文化强国，铸就中华文化新辉煌（评论员观察）,2022-10-12,2022-10
致读者,2022-10-12,2022-10
杭州青山湖科技城 聚力打造千亿级科技产业平台,2022-10-12,2022-10
永远站在党和人民事业的最前线,2022-10-12,2022-10
大型电视专题片《领航》引发广泛反响,2022-10-12,2022-10
我国人民陪审员超33万人,2022-10-12,2022-10
全国已成立1.4万余个乡镇街道消防站所,2022-10-12,2022-10
第132届广交会将于10月15日线上开幕,2022-10-12,2022-10
“天宫课堂”第三课定于十月十二日实施,2022-10-12,2022-10
神舟十四号：太空生活丰富多彩,2022-10-12,2022-10
“我们的研究要面向国家重大需求”（奋斗者正青春）,2022-10-12,2022-10
调动各方力量 持续助力发展,2022-10-12,2022-10
强化司法保障 优化营商环境,2022-10-12,2022-10
广西师范大学 “四抓四建”贯穿全程，开辟高等院校创新创业教育新路径,2022-10-12,2022-10
湖南岳阳 奋力打造长江经济带绿色发展示范区,2022-10-12,2022-10
构建新发展格局 推动高质量发展,2022-10-12,2022-10
关系我国发展全局的重大战略任务（奋进新征程 建功新时代·非凡十年）,2022-10-12,2022-10
坚持扩大内需 激发消费活力（新时代新作为）,2022-10-12,2022-10
实行双轮驱动 助力产业升级（新时代新作为）,2022-10-12,2022-10
在构建新发展格局中展现新作为（潮头观澜）,2022-10-12,2022-10
推动构建新发展格局取得扎扎实实成效（奋进新征程 建功新时代·非凡十年）,2022-10-12,2022-10
广州 打造建设社会主义文化强国城市范例,2022-10-12,2022-10
儋州市奋力推进儋洋一体化发展,2022-10-12,2022-10
奋进新征程 建功新时代（新时代画卷·奋进十年）,2022-10-12,2022-10
以高质量党建引领国有科技型企业创新发展（人民要论）,2022-10-12,2022-10
始终贯彻党的群众路线（思想纵横）,2022-10-12,2022-10
南方电网：科技赋能 打造坚强电网,2022-10-12,2022-10
福建 激活八闽文化 赋能高质量发展,2022-10-12,2022-10
深圳龙岗 奋力谱写高质量发展新篇章,2022-10-12,2022-10
中共十九届七中全会在京举行,2022-10-13,2022-10
党的二十大新闻中心正式开始对外接待服务,2022-10-13,2022-10
全面推进乡村振兴迈出坚实步伐（奋进新征程 建功新时代·非凡十年）,2022-10-13,2022-10
青海西宁公共服务提升质效（喜迎二十大）,2022-10-13,2022-10
加快培育中小企业特色产业集群（经济新方位·助力中小企业发展）,2022-10-13,2022-10
新增减税降费及退税缓税缓费超3.4万亿元,2022-10-13,2022-10
营造公道正义、共建共享的安全格局（和音·大国外交砥砺前行⑦）,2022-10-13,2022-10
让共同发展的阳光照亮全球减贫之路（国际社会看中国这十年）,2022-10-13,2022-10
蔡达峰出席各国议会联盟第145届大会,2022-10-13,2022-10
“切实有效推动构建人类命运共同体”,2022-10-13,2022-10
80多个国家和地区媒体记者参观“奋进新时代”主题成就展,2022-10-13,2022-10
推动古中关系实现新的发展（国际论坛）,2022-10-13,2022-10
二十大新闻中心组织中外记者参访活动,2022-10-13,2022-10
为国争光 逐梦四届冬奥（二十大代表风采）,2022-10-13,2022-10
为民服务 温暖一方邻里（二十大代表风采）,2022-10-13,2022-10
为“中国之治”夯实法治根基（人民论坛）,2022-10-13,2022-10
中国空间站第三次太空授课活动取得圆满成功,2022-10-13,2022-10
太空授课播撒科学的种子,2022-10-13,2022-10
各地少先队组织集中开展“喜迎二十大”活动,2022-10-13,2022-10
全力保障口岸跨境货运高效顺畅,2022-10-13,2022-10
中国东方航空 全力服务新发展格局 助力民航高质量发展,2022-10-13,2022-10
中国建设银行 拓维升级新金融行动 走中国特色金融发展之路,2022-10-13,2022-10
展现产业兴乡村美农民富的壮美画卷,2022-10-13,2022-10
农业农村现代化迈上新台阶（奋进新征程 建功新时代·非凡十年）,2022-10-13,2022-10
人才兴 产业旺（新时代新作为）,2022-10-13,2022-10
树新风 展新貌（新时代新作为）,2022-10-13,2022-10
让亿万乡亲生活芝麻开花节节高（潮头观澜）,2022-10-13,2022-10
书写乡村振兴新篇章（奋进新征程 建功新时代·非凡十年）,2022-10-13,2022-10
开辟国际关系理论创新的新境界（人民观点）,2022-10-13,2022-10
建设体育强国，为社会提供强大正能量（评论员观察）,2022-10-13,2022-10
欢迎赐稿,2022-10-13,2022-10
浙江碳银：绿色产业助力乡村振兴,2022-10-13,2022-10
润泽智算科技集团股份有限公司,2022-10-13,2022-10
党的自我革命永远在路上（学习习近平总书记重要讲话精神，迎接党的二十大）,2022-10-13,2022-10
踏实肯干 精益求精（奋斗者正青春）,2022-10-13,2022-10
恒丰银行杭州分行 聚合金融之力 奋进共富之路,2022-10-13,2022-10
保障粮食供给 端牢中国饭碗,2022-10-13,2022-10
大力发展绿色产业 促进产业生态双赢,2022-10-13,2022-10
17岁以下女足世界杯中国队首战告捷,2022-10-13,2022-10
举重亚锦赛中国选手向术林摘得三银,2022-10-13,2022-10
成都高新区 奋力创建世界领先科技园区,2022-10-13,2022-10
上海松江推动科技创新与产业发展深度融合,2022-10-13,2022-10
湖南农业发展投资集团：加快建设国内一流综合性农业企业,2022-10-13,2022-10
中共中央召开党外人士座谈会征求对中共二十大报告的意见,2022-10-14,2022-10
我们这样回答,2022-10-14,2022-10
栗战书主持召开十三届全国人大常委会第一百二十六次委员长会议,2022-10-14,2022-10
王岐山会见哈萨克斯坦总统托卡耶夫并出席亚信第六次峰会,2022-10-14,2022-10
党的十九大以来大事记,2022-10-14,2022-10
以奋发有为的精神把新时代中国特色社会主义推向前进,2022-10-14,2022-10
党的十九大以来大事记,2022-10-14,2022-10
栗战书主持召开十三届全国人大常委会第一百二十六次委员长会议,2022-10-14,2022-10
王岐山会见哈萨克斯坦总统托卡耶夫并出席亚信第六次峰会,2022-10-14,2022-10
党的十九大以来大事记,2022-10-14,2022-10
党的十九大以来大事记,2022-10-14,2022-10
党的十九大以来大事记,2022-10-14,2022-10
党的十九大以来大事记,2022-10-14,2022-10
我们这样回答,2022-10-14,2022-10
就《党的十九大以来大事记》编写情况答记者问,2022-10-14,2022-10
我们这样回答,2022-10-14,2022-10
党的十九大以来大事记,2022-10-14,2022-10
精进工艺 保障高铁安全（二十大代表风采）,2022-10-14,2022-10
忠诚拼搏 锻造过硬实力（二十大代表风采）,2022-10-14,2022-10
人民对美好生活的向往不断变为现实（奋进新征程 建功新时代·非凡十年）,2022-10-14,2022-10
守住不发生规模性疫情的底线（国务院联防联控机制发布会）,2022-10-14,2022-10
广西来宾打造西部陆海新通道重要节点城市,2022-10-14,2022-10
民生福祉增 生活更幸福,2022-10-14,2022-10
让全体中国人都过上更好的日子（奋进新征程 建功新时代·非凡十年）,2022-10-14,2022-10
托起稳稳的幸福（新时代新作为）,2022-10-14,2022-10
让便捷服务触手可及（新时代新作为）,2022-10-14,2022-10
为了人民的美好生活努力奋斗（潮头观澜）,2022-10-14,2022-10
人民幸福 生活美好（奋进新征程 建功新时代·非凡十年）,2022-10-14,2022-10
杭州高新区（滨江）向世界领先科技园区奋力迈进,2022-10-14,2022-10
金秋北京喜意浓,2022-10-14,2022-10
同心向党迎盛会,2022-10-14,2022-10
山西大同 谱写全方位高质量发展新篇章,2022-10-14,2022-10
泰达勇立潮头谱新篇 打造开发区转型升级样本,2022-10-14,2022-10
奋进新征程 建功新时代（新时代画卷·奋进十年）,2022-10-14,2022-10
喜迎党的二十大融媒体产品选登,2022-10-14,2022-10
广发银行 加大金融支持力度 助力实体经济发展,2022-10-14,2022-10
武汉推进科技自立自强，加快建设具有全国影响力的科技创新中心,2022-10-14,2022-10
习近平向中国国际可持续交通创新和知识中心成立致贺信,2022-10-15,2022-10
习近平同马尔代夫总统萨利赫就中马建交50周年互致贺电,2022-10-15,2022-10
为中国人民谋幸福 为中华民族谋复兴,2022-10-15,2022-10
党的二十大将于16日在京举行,2022-10-15,2022-10
出席党的二十大代表团全部报到,2022-10-15,2022-10
稻香庆丰年,2022-10-15,2022-10
前8月我国服务进出口总额同比增20.4%（新数据 新看点）,2022-10-15,2022-10
十年砥砺奋进 绘写壮美画卷,2022-10-15,2022-10
为中国人民谋幸福 为中华民族谋复兴,2022-10-15,2022-10
为中国人民谋幸福 为中华民族谋复兴,2022-10-15,2022-10
十年砥砺奋进 绘写壮美画卷,2022-10-15,2022-10
冲锋在前 续写连队荣光（二十大代表风采）,2022-10-15,2022-10
“纪录小康工程”数据库近日上线系列丛书在全国出版发行,2022-10-15,2022-10
十年砥砺奋进 绘写壮美画卷,2022-10-15,2022-10
特战尖兵 誓为军旗增辉（二十大代表风采）,2022-10-15,2022-10
第一——四版责编,2022-10-15,2022-10
奋进新征程 建功新时代（新时代画卷·奋进十年）,2022-10-15,2022-10
第五版责编,2022-10-15,2022-10
奋进新征程 建功新时代（新时代画卷·奋进十年）,2022-10-15,2022-10
第六版责编,2022-10-15,2022-10
大型电视专题片《领航》引发热烈反响,2022-10-15,2022-10
全社会凝聚力和向心力极大提升（人民论坛）,2022-10-15,2022-10
全国政协“奋进新时代，百名委员说”第四场宣讲活动举行,2022-10-15,2022-10
《中国共产党第二十次全国代表大会》纪念邮票16日发行,2022-10-15,2022-10
西藏各族青年积极投身生态建设（喜迎二十大）,2022-10-15,2022-10
党建引领 强村富民,2022-10-15,2022-10
出席党的二十大代表团全部报到,2022-10-15,2022-10
第七版责编,2022-10-15,2022-10
中国建设银行广东省分行,2022-10-15,2022-10
湖南阔步迈向开放高地,2022-10-15,2022-10
努力共建幸福之城,2022-10-15,2022-10
中国银行江苏省分行打出“准、新、优”服务组合拳,2022-10-15,2022-10
指导中国特色大国外交实践阔步前行（人民观点）,2022-10-15,2022-10
建设教育强国，办好人民满意的教育（评论员观察）,2022-10-15,2022-10
中兴通讯服务器及存储产品,2022-10-15,2022-10
第十版责编,2022-10-15,2022-10
交通银行 全面践行绿色发展，诠释国有大行责任担当,2022-10-15,2022-10
桂林市 奋力打造世界级旅游城市,2022-10-15,2022-10
新时代10年的伟大变革,2022-10-15,2022-10
在中华民族发展史上具有里程碑意义（深入学习贯彻习近平新时代中国特色社会主义思想）,2022-10-15,2022-10
民族复兴进入不可逆转的历史进程（观察者说）,2022-10-15,2022-10
以中国式现代化推进中华民族伟大复兴,2022-10-15,2022-10
党建聚人心 敲开幸福门（深度关注·党旗在基层一线高高飘扬）,2022-10-15,2022-10
做忠诚干净担当的人民公仆（红船观澜）,2022-10-15,2022-10
“监督一点通”服务平台促进干部转作风,2022-10-15,2022-10
江西赣州 奋力打造高质量发展示范区 书写新时代革命老区新篇章,2022-10-15,2022-10
绘山河锦绣 写时代华章,2022-10-15,2022-10
党的二十大举行预备会议和主席团第一次会议,2022-10-16,2022-10
中国共产党第二十次全国代表大会主席团成员名单,2022-10-16,2022-10
坚持人民至上,2022-10-16,2022-10
中国共产党第二十次全国代表大会主席团常务委员会成员名单,2022-10-16,2022-10
中国共产党第二十次全国代表大会秘书长名单,2022-10-16,2022-10
中国共产党第二十次全国代表大会副秘书长名单,2022-10-16,2022-10
《习近平的扶贫足迹》《习近平的小康情怀》出版发行,2022-10-16,2022-10
中国共产党第二十次全国代表大会代表资格审查委员会成员名单,2022-10-16,2022-10
习近平向伊拉克新任总统拉希德致贺电,2022-10-16,2022-10
奋力开创中国特色社会主义新局面（社论）,2022-10-16,2022-10
习近平就尼日利亚发生沉船事故向尼日利亚总统布哈里致慰问电,2022-10-16,2022-10
向着全面推进中华民族伟大复兴奋勇前进,2022-10-16,2022-10
团结奋进向未来,2022-10-16,2022-10
擘画中国发展蓝图 促进世界繁荣进步,2022-10-16,2022-10
“中国向世界提供的重要国际公共产品”（大道之行）,2022-10-16,2022-10
中国的发展带来合作共赢机遇（国际论坛·读懂中国·读懂中国共产党）,2022-10-16,2022-10
共同开启中马关系新篇章（大使随笔）,2022-10-16,2022-10
向中外记者介绍大会议程及有关情况,2022-10-16,2022-10
坚持人民至上的价值追求（人民论坛）,2022-10-16,2022-10
历史巨变令人赞叹,2022-10-16,2022-10
坚持人民至上,2022-10-16,2022-10
市场主体结构持续优化,2022-10-16,2022-10
第132届广交会线上开幕,2022-10-16,2022-10
一版责编：王 军 杨 旭 赵 政 二版责编：吴 燕 蒋雪婕 郭雪岩 三版责编：焦 翔 张远南 戴楷然 四版责编：胡安琪 陈亚楠 张佳莹,2022-10-16,2022-10
以中国式现代化推进中华民族伟大复兴,2022-10-16,2022-10
“现代化的本质是人的现代化”（一见）,2022-10-16,2022-10
继续统筹推进“五位一体”总体布局 协调推进“四个全面”战略布局,2022-10-16,2022-10
深刻领悟“两个确立”的决定性意义（寄语）,2022-10-16,2022-10
为高质量发展提供金融支撑（寄语）,2022-10-16,2022-10
把乡村建设得更加美好（寄语）,2022-10-16,2022-10
奋力实现高水平科技自立自强（寄语）,2022-10-16,2022-10
为美丽中国建设添砖加瓦（寄语）,2022-10-16,2022-10
牢牢把住粮食安全主动权（寄语）,2022-10-16,2022-10
继续扎实推进全体人民共同富裕,2022-10-16,2022-10
让脱贫群众生活更上一层楼（寄语）,2022-10-16,2022-10
践行绿水青山就是金山银山理念（寄语）,2022-10-16,2022-10
完善住房供应和保障体系（寄语）,2022-10-16,2022-10
全面推进健康中国建设（寄语）,2022-10-16,2022-10
大力发展公共文化事业（寄语）,2022-10-16,2022-10
持续提升高等教育质量（寄语）,2022-10-16,2022-10
继续有力推进党的建设新的伟大工程,2022-10-16,2022-10
让初心始终闪耀（寄语）,2022-10-16,2022-10
不断激发干事创业精气神（寄语）,2022-10-16,2022-10
让红色基因代代传承（寄语）,2022-10-16,2022-10
筑牢基层战斗堡垒（寄语）,2022-10-16,2022-10
把好作风弘扬在新时代（寄语）,2022-10-16,2022-10
多为群众办实事（寄语）,2022-10-16,2022-10
继续积极推动构建人类命运共同体,2022-10-16,2022-10
为共建美好未来指明前进方向（寄语）,2022-10-16,2022-10
加强农业科技创新合作（寄语）,2022-10-16,2022-10
为全球抗疫贡献中国力量（寄语）,2022-10-16,2022-10
菌草援外促进当地增加就业（寄语）,2022-10-16,2022-10
把中老铁路维护好、运营好（寄语）,2022-10-16,2022-10
推进基础设施互联互通（寄语）,2022-10-16,2022-10
人民对美好生活的向往，就是我们的奋斗目标,2022-10-16,2022-10
人民对美好生活的向往，就是我们的奋斗目标,2022-10-16,2022-10
国家电投 绿色、创新、融合，真信、真干、真成 开启建设世界一流企业新征程,2022-10-16,2022-10
努力让群众过上更幸福的生活(人民幸福生活是最大的人权),2022-10-16,2022-10
向着全面推进中华民族伟大复兴奋勇前进,2022-10-16,2022-10
粤桂协作 打造全产业链帮扶模式,2022-10-16,2022-10
我的科研梦，尽在那片深蓝（科技自立自强·青年科学家）,2022-10-16,2022-10
沙地增绿 产业增收（走进县城看发展）,2022-10-16,2022-10
浙江余杭 实施“十大工程” 打造未来城市新样板,2022-10-16,2022-10
十年实现“八大转变” 兰州新区改革发展开新局,2022-10-16,2022-10
多彩贵州：非凡十年赶超跨越,2022-10-16,2022-10
中国共产党第二十次全国代表大会在京开幕,2022-10-17,2022-10
高举中国特色社会主义伟大旗帜 为全面建设社会主义现代化国家而团结奋斗,2022-10-17,2022-10
高举中国特色社会主义伟大旗帜 为全面建设社会主义现代化国家而团结奋斗,2022-10-17,2022-10
高举中国特色社会主义伟大旗帜 为全面建设社会主义现代化国家而团结奋斗,2022-10-17,2022-10
中国共产党第二十次全国代表大会在京开幕,2022-10-17,2022-10
铭记党的奋斗历程 弘扬伟大建党精神（二十大时光）,2022-10-17,2022-10
团结奋斗，创造新的历史伟业,2022-10-17,2022-10
台湾地区有关政党和人士祝贺中国共产党第二十次全国代表大会召开,2022-10-17,2022-10
朝鲜越南老挝古巴党中央热烈祝贺中共二十大召开,2022-10-17,2022-10
世界政党政要和友好人士热烈祝贺中共二十大召开,2022-10-17,2022-10
“中国的发展成就为发展中国家树立了榜样”,2022-10-17,2022-10
展现社会主义制度的显著优越性（国际论坛·读懂中国·读懂中国共产党）,2022-10-17,2022-10
人民网推出党的二十大报道专区专题,2022-10-17,2022-10
用新的伟大奋斗创造新的伟业,2022-10-17,2022-10
用新的伟大奋斗创造新的伟业,2022-10-17,2022-10
用新的伟大奋斗创造新的伟业,2022-10-17,2022-10
用新的伟大奋斗创造新的伟业,2022-10-17,2022-10
永远把伟大建党精神继承下去、发扬光大,2022-10-17,2022-10
永远把伟大建党精神继承下去、发扬光大,2022-10-17,2022-10
撸起袖子加油干 风雨无阻向前行,2022-10-17,2022-10
自信务实展现大党风范（现场评论）,2022-10-17,2022-10
发展成果惠及更多群众,2022-10-17,2022-10
持续打造优势产业链,2022-10-17,2022-10
更鲜活地讲好党的故事,2022-10-17,2022-10
让草原生态更加美好,2022-10-17,2022-10
在对话中增进相互理解,2022-10-17,2022-10
优质儿科医疗资源不断扩容,2022-10-17,2022-10
奋进伟大征程 谱写时代华章,2022-10-17,2022-10
改造水电气 方便吃住行（有温度的举措 暖民心的行动）,2022-10-17,2022-10
河南织密居家社区养老服务网,2022-10-17,2022-10
广东实现乡镇公共充电桩全覆盖,2022-10-17,2022-10
南通：擦亮“南通好通”“万事好通”品牌,2022-10-17,2022-10
凝心聚力建设新时代 中国特色社会主义壮美广西,2022-10-17,2022-10
多彩贵州：奋力谱写现代化建设新篇章,2022-10-17,2022-10
聚传统智慧 显生态价值（美丽中国）,2022-10-17,2022-10
《湿地公约》第十四届缔约方大会筹备主体工作基本就绪,2022-10-17,2022-10
环境减灾二号E星成功发射,2022-10-17,2022-10
百度智能云 助力龙源电力打造“新能源生产数字化”标杆,2022-10-17,2022-10
彰显办赛水平 助力全民健身,2022-10-17,2022-10
让骑行之路更通畅（体坛观澜）,2022-10-17,2022-10
骆知鹭获攀岩亚锦赛女子攀石银牌,2022-10-17,2022-10
中兴通讯 服务器及存储产品,2022-10-17,2022-10
中国新能源汽车积极拓展欧洲市场（国际视点）,2022-10-17,2022-10
“中国方案”助力阿富汗和平重建,2022-10-17,2022-10
“萧滨一体化” 打造跨区域产业共富样板,2022-10-17,2022-10
邮储银行履行国有大行责任担当 服务经济社会高质量发展,2022-10-17,2022-10
心往一处想劲往一处使推动中华民族伟大复兴号巨轮乘风破浪扬帆远航,2022-10-18,2022-10
“既是最难的，也是最伟大的”（微镜头·习近平总书记参加党的二十大广西代表团讨论）,2022-10-18,2022-10
“因为信任，就好好把我们的事情做好”（微镜头·习近平总书记参加党的二十大广西代表团讨论）,2022-10-18,2022-10
心往一处想 劲往一处使,2022-10-18,2022-10
砥砺实干 锐意进取 为全面建设社会主义现代化国家而团结奋斗,2022-10-18,2022-10
