绿色南通 宜居之城,2022-10-22,2022-10
“青春就是用来奋斗的”（奋斗者正青春）,2022-10-22,2022-10
让校园运动氛围更浓（体坛观澜）,2022-10-22,2022-10
国际奥委会发布报告 北京冬奥会全球观众超20亿,2022-10-22,2022-10
射击（步手枪）世锦赛 中国队领跑奖牌榜,2022-10-22,2022-10
汉口银行：打造科技金融创新模式 服务湖北“科技强省”战略,2022-10-22,2022-10
中国人寿 助力人民群众 健康生活和高质量养老,2022-10-22,2022-10
中国建设银行 以新金融行动推进高质量发展,2022-10-22,2022-10
中国共产党第二十次全国代表大会在京闭幕,2022-10-23,2022-10
中国共产党第二十届中央政治局常委今日同中外记者见面,2022-10-23,2022-10
中国共产党第二十次全国代表大会关于十九届中央委员会报告的决议,2022-10-23,2022-10
中国共产党第二十次全国代表大会关于十九届中央纪律检查委员会工作报告的决议,2022-10-23,2022-10
中国共产党第二十次全国代表大会关于《中国共产党章程（修正案）》的决议,2022-10-23,2022-10
中国共产党第二十次全国代表大会在京闭幕,2022-10-23,2022-10
中国共产党第二十届中央委员会委员名单,2022-10-23,2022-10
中国共产党第二十届中央委员会候补委员名单,2022-10-23,2022-10
中国共产党第二十届中央纪律检查委员会委员名单,2022-10-23,2022-10
用新的伟大奋斗创造新的伟业,2022-10-23,2022-10
在新时代新征程创造令世人刮目相看的新的更大奇迹,2022-10-23,2022-10
团结奋斗，谱写新时代中国特色社会主义更加绚丽的华章（社论）,2022-10-23,2022-10
为全面建设社会主义现代化国家而团结奋斗,2022-10-23,2022-10
高举伟大旗帜 谱写崭新篇章,2022-10-23,2022-10
高举伟大旗帜 谱写崭新篇章,2022-10-23,2022-10
世界政党政要和社会各界继续祝贺中共二十大成功举行,2022-10-23,2022-10
为全面建设社会主义现代化国家而团结奋斗,2022-10-23,2022-10
“牢牢把握过去5年工作和新时代10年伟大变革的重大意义”,2022-10-23,2022-10
“牢牢把握新时代中国特色社会主义思想的世界观和方法论”,2022-10-23,2022-10
“牢牢把握以中国式现代化推进中华民族伟大复兴的使命任务”,2022-10-23,2022-10
“牢牢把握以伟大自我革命引领伟大社会革命的重要要求”,2022-10-23,2022-10
“牢牢把握团结奋斗的时代要求”,2022-10-23,2022-10
安徽芜湖 用高质量提升发展成色，用加速度应对发展挑战,2022-10-23,2022-10
为党和人民事业贡献智慧和力量,2022-10-23,2022-10
团结才能胜利 奋斗才会成功,2022-10-23,2022-10
梦天实验舱本月底具备发射条件,2022-10-23,2022-10
用帮扶影响带动更多学校,2022-10-23,2022-10
在平凡岗位上实现人生价值,2022-10-23,2022-10
把司法服务送到群众家门口,2022-10-23,2022-10
真抓实干，做好“侨”的文章（二十大时光）,2022-10-23,2022-10
感受时代脉动 凝聚奋进力量（二十大时光）,2022-10-23,2022-10
好想你健康食品股份有限公司 创新赋能高质量发展,2022-10-23,2022-10
你好山河 遇见西安港,2022-10-23,2022-10
广州 发挥粤港澳大湾区核心引擎优势 推动区域一体化高质量发展,2022-10-23,2022-10
党的二十届一中全会产生中央领导机构 习近平任中共中央总书记中央军委主席,2022-10-24,2022-10
习近平等领导同志亲切会见出席党的二十大代表、特邀代表和列席人员,2022-10-24,2022-10
始终坚持一切为了人民一切依靠人民 以中国式现代化全面推进中华民族伟大复兴,2022-10-24,2022-10
中国共产党第二十届中央纪律检查委员会第一次全体会议公报,2022-10-24,2022-10
中共二十届中央领导机构成员简历,2022-10-24,2022-10
光荣和梦想的远征,2022-10-24,2022-10
奋力实现中华民族伟大复兴的中国梦,2022-10-24,2022-10
中共二十届中央领导机构成员简历,2022-10-24,2022-10
广大干部群众认真学习贯彻党的二十大精神,2022-10-24,2022-10
光荣和梦想的远征,2022-10-24,2022-10
中共中央将于24日上午举行新闻发布会,2022-10-24,2022-10
肩负使命任务 创造新的伟业（社论）,2022-10-24,2022-10
广大干部群众认真学习贯彻党的二十大精神,2022-10-24,2022-10
坚持绿色发展,2022-10-24,2022-10
“蓝图已经绘就，号角已经吹响”（人民论坛）,2022-10-24,2022-10
我国勘探发现首个深水深层大气田,2022-10-24,2022-10
朝鲜越南老挝古巴领导人热烈祝贺习近平当选中共中央总书记,2022-10-24,2022-10
世界政党政要热烈祝贺习近平当选中共中央总书记,2022-10-24,2022-10
为人类进步事业作出新的更大贡献（和音）,2022-10-24,2022-10
描绘人与自然和谐共生的美丽画卷（国际社会看中国这十年）,2022-10-24,2022-10
完整准确全面贯彻新发展理念（新时代画卷）,2022-10-24,2022-10
以智能制造为主攻方向 推动产业技术变革和优化升级（新时代画卷）,2022-10-24,2022-10
科技的集聚地 创新的孵化器（新时代画卷）,2022-10-24,2022-10
大力推进生态文明建设（新时代画卷）,2022-10-24,2022-10
绿色能源 “风光”无限（新时代画卷）,2022-10-24,2022-10
各地重点工业项目积蓄发展动力（经济聚焦）,2022-10-24,2022-10
扩面增产并举 提升大豆产能（感言）,2022-10-24,2022-10
企业集团财务公司管理进一步规范,2022-10-24,2022-10
成渝地区双城经济圈产业数字化赋能基地投用,2022-10-24,2022-10
山西加大农村电商和乡村e镇财政政策资金保障力度,2022-10-24,2022-10
以优质服务促企业发展,2022-10-24,2022-10
对马克思主义哲学的创新性发展（学苑论衡）,2022-10-24,2022-10
读原著 学原文 悟原理（学术随笔）,2022-10-24,2022-10
在实践中学哲学用哲学（专题深思）,2022-10-24,2022-10
了解马克思恩格斯生平与思想的有益参考（新书评介）,2022-10-24,2022-10
创作是拨动心中的琴弦（新语·让好声音成为最强音）,2022-10-24,2022-10
“中国天眼”，看见更远星河（科技自立自强）,2022-10-24,2022-10
杭州萧山 以党建引领推进全域现代社区建设,2022-10-24,2022-10
服务多种多样 生活多姿多彩（推动实现全体老年人享有基本养老服务②）,2022-10-24,2022-10
云南出台措施支持高校毕业生就业,2022-10-24,2022-10
江西多部门力推既有住宅加装电梯,2022-10-24,2022-10
桂林银行 激活金融活水，助力乡村振兴,2022-10-24,2022-10
将创建示范美丽宜居村庄1500个左右,2022-10-24,2022-10
协同治理 让水更清河更畅（美丽中国）,2022-10-24,2022-10
部署全国水土流失动态监测工作,2022-10-24,2022-10
甘肃持续加强水资源管理,2022-10-24,2022-10
黄河岸边美如画,2022-10-24,2022-10
云南加快推进林草产业建设,2022-10-24,2022-10
世界女子围棋团体赛中国队夺冠,2022-10-24,2022-10
感动不止于赛场（体坛观澜）,2022-10-24,2022-10
骆宗诗夺得女子57公斤级冠军,2022-10-24,2022-10
刘清漪获得女子组银牌,2022-10-24,2022-10
百度智能云携手理想汽车打造全国智能计算网络 升级新能源汽车驾乘体验,2022-10-24,2022-10
浓墨重彩书写中国故事（坚持“两创” 书写史诗·非凡十年）,2022-10-24,2022-10
中国电影的进步让我自豪（用优秀作品增强人民精神力量）,2022-10-24,2022-10
不负时代  不负人民（用优秀作品增强人民精神力量）,2022-10-24,2022-10
观众的期待就是努力的方向（用优秀作品增强人民精神力量）,2022-10-24,2022-10
主旋律电影涌现精品力作（用优秀作品增强人民精神力量）,2022-10-24,2022-10
三江潮头万象新 四川乐山：奋力书写高质量发展新篇章,2022-10-24,2022-10
广东南海 坚持文化创新 激发城市活力,2022-10-24,2022-10
认真学习宣传贯彻党的二十大精神 奋力实现建军一百年奋斗目标,2022-10-25,2022-10
领航新时代新征程新辉煌的坚强领导集体,2022-10-25,2022-10
从这份报告，看我们党的谋事之基、成事之道（微观察·党的二十大）,2022-10-25,2022-10
中国共产党中央委员会致各民主党派中央、全国工商联的感谢信,2022-10-25,2022-10
钱正英同志逝世,2022-10-25,2022-10
中共国务院党组召开会议 深入学习贯彻党的二十大精神,2022-10-25,2022-10
深刻领悟“两个确立”的决定性意义 用党的二十大精神指引人大工作发展,2022-10-25,2022-10
全国政协党组召开会议 学习贯彻党的二十大精神,2022-10-25,2022-10
中国共产党中央委员会致各民主党派中央、全国工商联的感谢信,2022-10-25,2022-10
新征程是充满光荣和梦想的远征（人民论坛）,2022-10-25,2022-10
从这份报告，看我们党的谋事之基、成事之道（微观察·党的二十大）,2022-10-25,2022-10
海南自由贸易港 建设高标准推进,2022-10-25,2022-10
外国政党政要热烈祝贺习近平当选中共中央总书记,2022-10-25,2022-10
让世界进一步读懂中国,2022-10-25,2022-10
推动形成人与自然和谐共生新格局（和音·大国外交砥砺前行⑨）,2022-10-25,2022-10
“世界对中国充满期待”（外媒看中国）,2022-10-25,2022-10
远销海外,2022-10-25,2022-10
“夺取新时代中国特色社会主义新胜利的政治宣言和行动纲领”,2022-10-25,2022-10
领航新时代新征程新辉煌的坚强领导集体,2022-10-25,2022-10
国务院任免国家工作人员,2022-10-25,2022-10
锚定中心任务，开好局起好步（人民观点）,2022-10-25,2022-10
建设能源强国，保障国家能源安全（评论员观察）,2022-10-25,2022-10
用更好营商环境提升企业竞争力（人民时评）,2022-10-25,2022-10
像格桑花一样扎根在雪域边陲（中国道路中国梦·不负嘱托更奋发⑨）,2022-10-25,2022-10
为建设科技强国汇聚磅礴力量（大家谈·强国复兴有我①）,2022-10-25,2022-10
坚定信心、同心同德，埋头苦干、奋勇前进,2022-10-25,2022-10
中央机关及其直属机构2023年度公务员招考今起报名,2022-10-25,2022-10
第五届进博会线上国家展启动,2022-10-25,2022-10
秋日田园美,2022-10-25,2022-10
“夺取新时代中国特色社会主义新胜利的政治宣言和行动纲领”,2022-10-25,2022-10
依法为外商投资筑起保护屏障,2022-10-25,2022-10
生态环保法律体系基本形成,2022-10-25,2022-10
穿绳系扣 手手相传（工匠绝活）,2022-10-25,2022-10
“做学问，要从国家需要出发”（讲述·一辈子一件事）,2022-10-25,2022-10
好客山东 好品山东,2022-10-25,2022-10
成功推进和拓展了中国式现代化（全面深入学习宣传贯彻党的二十大精神）,2022-10-25,2022-10
源源不断培养造就哲学社会科学人才,2022-10-25,2022-10
用新的伟大奋斗创造新的伟业（思想纵横）,2022-10-25,2022-10
讲好大运河沿线城市发展故事（新书评介）,2022-10-25,2022-10
我国经济总体恢复向好（经济聚焦）,2022-10-25,2022-10
我国进出口增长百分之九点九,2022-10-25,2022-10
国家综合立体交通网主骨架将加快建设,2022-10-25,2022-10
高水平开放，增强城市吸引力,2022-10-25,2022-10
最大单体碱性水电解制氢装备下线,2022-10-25,2022-10
中国移动 提升效率，就是提升企业竞争力,2022-10-25,2022-10
向海出发，探索那片深蓝（科技自立自强·青年科学家）,2022-10-25,2022-10
创新叙事方式 讲好领航故事,2022-10-25,2022-10
厚植文化底蕴 传播文明新风,2022-10-25,2022-10
中国移动 控制成本，就是提升企业竞争力,2022-10-25,2022-10
凝聚党群合力 提升治理效能（基层治理新实践）,2022-10-25,2022-10
用好考核指挥棒，为基层减负（一线行走）,2022-10-25,2022-10
河北建立三级联动城市道桥行业综合监管平台,2022-10-25,2022-10
杭州临平 共富建设扎实推进 释放高质量发展新活力,2022-10-25,2022-10
聚点成网 多层照护（推动实现全体老年人享有基本养老服务③）,2022-10-25,2022-10
开办“便民门诊”的启示（民生观）,2022-10-25,2022-10
广西：加快推进乡村治理现代化 保障经济社会稳定发展,2022-10-25,2022-10
共同努力，让生活更低碳（美丽中国）,2022-10-25,2022-10
地表水水质优良比例达86.3%,2022-10-25,2022-10
风电新增装机1924万千瓦,2022-10-25,2022-10
西藏青海四川云南将有较强雨雪天气,2022-10-25,2022-10
中国人寿寿险公司 助力高质量发展 服务美好生活,2022-10-25,2022-10
叮当健康 加快健康产业数字化建设 持续推进“健康服务”高质量发展,2022-10-25,2022-10
非洲加速发展人工智能产业（国际视点）,2022-10-25,2022-10
中国电动车在巴黎车展备受关注,2022-10-25,2022-10
中国银行湖北省分行：坚定不移走好金融特色发展之路,2022-10-25,2022-10
担当实干抓落实（金台潮声）,2022-10-25,2022-10
驰而不息推进全面从严治党,2022-10-25,2022-10
四川 升级“天府乡村”公益品牌 助力乡村振兴,2022-10-25,2022-10
江西南昌东湖区 加快建设“五个东湖”描绘城市新画卷,2022-10-25,2022-10
研究部署学习宣传贯彻党的二十大精神,2022-10-26,2022-10
推动中华民族伟大复兴号巨轮乘风破浪、扬帆远航,2022-10-26,2022-10
高举中国特色社会主义伟大旗帜 为全面建设社会主义现代化国家而团结奋斗,2022-10-26,2022-10
高举中国特色社会主义伟大旗帜 为全面建设社会主义现代化国家而团结奋斗,2022-10-26,2022-10
高举中国特色社会主义伟大旗帜 为全面建设社会主义现代化国家而团结奋斗,2022-10-26,2022-10
高举中国特色社会主义伟大旗帜 为全面建设社会主义现代化国家而团结奋斗,2022-10-26,2022-10
高举中国特色社会主义伟大旗帜 为全面建设社会主义现代化国家而团结奋斗,2022-10-26,2022-10
党的二十大报告单行本出版,2022-10-26,2022-10
党的二十大报告学习辅导读本出版发行,2022-10-26,2022-10
奋力实现建军一百年奋斗目标 打开强军事业发展新局面,2022-10-26,2022-10
公布《促进个体工商户发展条例》,2022-10-26,2022-10
中央军委召开学习宣传贯彻党的二十大精神工作部署会,2022-10-26,2022-10
撸起袖子加油干 同心共圆中国梦,2022-10-26,2022-10
向党外人士通报中共二十大精神,2022-10-26,2022-10
“惟其艰巨，所以伟大；惟其艰巨，更显荣光”（人民论坛）,2022-10-26,2022-10
多国政党政要热烈祝贺习近平当选中共中央总书记,2022-10-26,2022-10
携手创造世界的美好未来,2022-10-26,2022-10
中共百年奋斗历史经验具有重要启发意义（国际论坛·读懂中国·读懂中国共产党）,2022-10-26,2022-10
“中国特色社会主义展现出巨大活力”,2022-10-26,2022-10
“扩大发展融资，实现可持续未来”研讨会在沪举行,2022-10-26,2022-10
越共中央总书记阮富仲将访华,2022-10-26,2022-10
推动中华民族伟大复兴号巨轮乘风破浪、扬帆远航,2022-10-26,2022-10
坚持和加强党的全面领导（人民观点）,2022-10-26,2022-10
建设人才强国，厚植人才资源竞争优势（评论员观察）,2022-10-26,2022-10
以高考改革促进学生健康成长（人民时评）,2022-10-26,2022-10
激发更多爱国情、强国志、报国行（中国道路中国梦）,2022-10-26,2022-10
培养新时代的“大先生”（新论）,2022-10-26,2022-10
依法全面推进乡村振兴,2022-10-26,2022-10
撸起袖子加油干 同心共圆中国梦,2022-10-26,2022-10
培训万名“乡村建设带头工匠”,2022-10-26,2022-10
宝马集团以实际行动助力实现“双碳”目标,2022-10-26,2022-10
促进个体工商户发展条例,2022-10-26,2022-10
汇聚新时代奋进力量的精品力作,2022-10-26,2022-10
直播间里唢呐响（为梦想奔跑）,2022-10-26,2022-10
中国移动 增加人均产值，就是提升企业竞争力,2022-10-26,2022-10
三亚崖州湾科技城 奋力打造科创高地,2022-10-26,2022-10
不断谱写马克思主义中国化时代化新篇章（全面深入学习宣传贯彻党的二十大精神）,2022-10-26,2022-10
依靠顽强斗争打开事业发展新天地,2022-10-26,2022-10
团结就是力量 团结才能胜利（思想纵横）,2022-10-26,2022-10
深刻认识新时代十年的里程碑意义（新书评介）,2022-10-26,2022-10
事事有着落 件件有回音（一线调研）,2022-10-26,2022-10
中国移动 降低能耗，就是提升企业竞争力,2022-10-26,2022-10
梯田土楼 古韵悠悠（走进传统村落）,2022-10-26,2022-10
品味土楼的精妙,2022-10-26,2022-10
铜陵 从千年铜都到“智造”之城,2022-10-26,2022-10
户外运动装备产业加快成长（深度观察·细看产业新亮点④）,2022-10-26,2022-10
进一步推动生产性服务业发展（观象台）,2022-10-26,2022-10
西气东输四线工程全面开工（资讯速递）,2022-10-26,2022-10
北京全球友好机场总裁论坛举办（资讯速递）,2022-10-26,2022-10
农村公路：十年净增90多万公里（新视点）,2022-10-26,2022-10
托育园开到家门口（消费视窗）,2022-10-26,2022-10
便利店 不断提高便民服务能力（市场漫步）,2022-10-26,2022-10
农旅融合促增收,2022-10-26,2022-10
《商务领域标准化管理办法》正式实施（市场资讯）,2022-10-26,2022-10
企业落实食品安全主体责任新规出台（市场资讯）,2022-10-26,2022-10
供与销两头发力 促农村消费提质（消费万花筒）,2022-10-26,2022-10
加大勘探开发力度 确保能源安全（新时代画卷）,2022-10-26,2022-10
上海松江 推动长三角G60科创走廊更高质量一体化发展,2022-10-26,2022-10
全面学习把握落实党的二十大精神 奋力夺取全面建设社会主义现代化国家新胜利,2022-10-27,2022-10
让党旗在新征程上高高飘扬,2022-10-27,2022-10
牢记“三个务必” 坚定历史自信 增强历史主动,2022-10-27,2022-10
李克强向英国新任首相苏纳克致贺电,2022-10-27,2022-10
十三届全国人大常委会第三十七次会议在京举行,2022-10-27,2022-10
深入学习贯彻党的二十大精神 坚定不移推进全面从严治党,2022-10-27,2022-10
中国共产党章程,2022-10-27,2022-10
中国共产党章程,2022-10-27,2022-10
中国共产党章程,2022-10-27,2022-10
中国共产党章程,2022-10-27,2022-10
《中国共产党章程》单行本出版,2022-10-27,2022-10
法学法律工作者要深入学习贯彻落实党的二十大精神 为在法治轨道上全面建设社会主义现代化国家贡献力量,2022-10-27,2022-10
全面学习把握落实党的二十大精神 奋力夺取全面建设社会主义现代化国家新胜利,2022-10-27,2022-10
十三届全国人大常委会第三十七次会议在京举行,2022-10-27,2022-10
深入学习贯彻党的二十大精神 坚定不移推进全面从严治党,2022-10-27,2022-10
一版责编：王 军 许 诺 史 哲 二版责编：殷新宇 吕 莉 祁嘉润 三版责编：焦 翔 张远南 戴楷然 四版责编：胡安琪 杨烁壁 郭 玥,2022-10-27,2022-10
各国政党政要持续祝贺习近平当选中共中央总书记,2022-10-27,2022-10
“中国一定会胜利实现第二个百年奋斗目标”（外国政党政要和友好人士看新时代中国共产党）,2022-10-27,2022-10
为维护世界共同利益发挥重要作用（国际论坛·读懂中国·读懂中国共产党）,2022-10-27,2022-10
王毅会见东盟国家驻华使节,2022-10-27,2022-10
巴基斯坦总理夏巴兹·谢里夫将访华,2022-10-27,2022-10
“推进南南合作和南北合作的纽带”,2022-10-27,2022-10
中朝双方共同纪念中国人民志愿军抗美援朝出国作战72周年,2022-10-27,2022-10
就党的二十大通过的《中国共产党章程（修正案）》答记者问,2022-10-27,2022-10
牢记“三个务必” 坚定历史自信 增强历史主动,2022-10-27,2022-10
让党旗在新征程上高高飘扬,2022-10-27,2022-10
立志做有理想、敢担当、能吃苦、肯奋斗的新时代好青年,2022-10-27,2022-10
调设备 保供暖,2022-10-27,2022-10
探访关爱特殊困难老年人,2022-10-27,2022-10
全国环卫工人数量达200多万名,2022-10-27,2022-10
中国人民保险 安身乐业 奋斗前行,2022-10-27,2022-10
坚持中国特色社会主义道路（人民观点）,2022-10-27,2022-10
筑牢网络与信息安全防护墙（评论员观察）,2022-10-27,2022-10
让城市更智慧更便捷（人民时评）,2022-10-27,2022-10
技能报国 青春绽彩（暖闻热评）,2022-10-27,2022-10
在时光里写下奋斗者足迹（大家谈·强国复兴有我②）,2022-10-27,2022-10
把握好习近平新时代中国特色社会主义思想的世界观和方法论（全面深入学习宣传贯彻党的二十大精神）,2022-10-27,2022-10
加强我国国际传播能力建设,2022-10-27,2022-10
团结才能胜利 奋斗才会成功（思想纵横）,2022-10-27,2022-10
技术水平居国际前列（科技自立自强）,2022-10-27,2022-10
记录非凡成就 书写伟大变革,2022-10-27,2022-10
电视剧《大考》创作座谈会举行,2022-10-27,2022-10
中国科学技术大学科技商学院成立,2022-10-27,2022-10
中国移动 提升效率，就是提升企业竞争力,2022-10-27,2022-10
天津援疆 高质量助力文化润疆,2022-10-27,2022-10
守护多样物种 共建美好家园（美丽中国）,2022-10-27,2022-10
菌草是什么草？（把自然讲给你听）,2022-10-27,2022-10
中国移动 控制成本，就是提升企业竞争力,2022-10-27,2022-10
体育产业发展驶入快车道,2022-10-27,2022-10
乡村体育 别样清新（体坛观澜）,2022-10-27,2022-10
国家体操队公布参赛名单,2022-10-27,2022-10
中国队包揽女子组越野赛冠亚军,2022-10-27,2022-10
改革前行 绿电奔涌 南方电网广西电网公司全力做好清洁能源消纳工作,2022-10-27,2022-10
最后一个“断点”是如何打通的（法治头条·调查研究）,2022-10-27,2022-10
更好发挥检察公益诉讼制度效能（金台锐评）,2022-10-27,2022-10
自费为小区买滑梯 他人滑倒是否担责（以案说法）,2022-10-27,2022-10
沈阳市大东区 努力开创振兴发展新局面,2022-10-27,2022-10
中国精品出版物亮相法兰克福书展（国际视点）,2022-10-27,2022-10
太平洋岛国积极应对气候灾害,2022-10-27,2022-10
亚通组织呼吁加强媒体合作以应对新局面,2022-10-27,2022-10
陕西省西咸新区沣西新城 大力推进秦创原总窗口建设,2022-10-27,2022-10
协力共建社会治理共同体,2022-10-27,2022-10
京东11.11 给生活多点实在,2022-10-27,2022-10
烟台 奋力打造更具竞争力的新时代现代化国际滨海城市,2022-10-27,2022-10
弘扬伟大建党精神和延安精神 为实现党的二十大提出的目标任务而团结奋斗,2022-10-28,2022-10
习近平向美中关系全国委员会年度晚宴致贺信,2022-10-28,2022-10
十九届中央纪律检查委员会向中国共产党第二十次全国代表大会的工作报告,2022-10-28,2022-10
李克强主持召开国务院常务会议,2022-10-28,2022-10
向着新的奋斗目标，出发!,2022-10-28,2022-10
十三届全国人大常委会第三十七次会议举行第二次全体会议,2022-10-28,2022-10
深刻把握新时代十年伟大变革的里程碑意义,2022-10-28,2022-10
弘扬伟大建党精神和延安精神 为实现党的二十大提出的目标任务而团结奋斗,2022-10-28,2022-10
深入学习贯彻党的二十大精神,2022-10-28,2022-10
十九届中央纪律检查委员会向中国共产党第二十次全国代表大会的工作报告,2022-10-28,2022-10
多国政党政要持续祝贺习近平当选中共中央总书记,2022-10-28,2022-10
三季度中国市场对外资依然保持较强吸引力,2022-10-28,2022-10
王毅同沙特外交大臣费萨尔主持召开中沙高委会政治外交分委会第四次会议,2022-10-28,2022-10
王毅同俄罗斯外长拉夫罗夫通电话,2022-10-28,2022-10
坦桑尼亚总统哈桑将访华,2022-10-28,2022-10
十九届中央纪律检查委员会向中国共产党第二十次全国代表大会的工作报告,2022-10-28,2022-10
坚持以人民为中心的发展思想（人民观点）,2022-10-28,2022-10
为科技创新厚植学风作风基础（人民时评）,2022-10-28,2022-10
让民族团结进步之花长盛不衰（现场评论·新时代的伟大实践(11)）,2022-10-28,2022-10
挺进深地挖掘油气潜能（新知）,2022-10-28,2022-10
深刻把握大食物观的内涵和要求（新论）,2022-10-28,2022-10
十三届全国人大常委会第三十七次会议审议多部法律草案,2022-10-28,2022-10
工业企业利润行业结构不断改善,2022-10-28,2022-10
上海经济加快恢复展现韧性,2022-10-28,2022-10
前9月实际使用外资超万亿元,2022-10-28,2022-10
4项两化融合国家标准发布,2022-10-28,2022-10
全国碳市场累计成交额达85.8亿元,2022-10-28,2022-10
香港旅游发展局招标告示,2022-10-28,2022-10
凝聚创新动能 谱写崭新篇章,2022-10-28,2022-10
推进刑事案件律师辩护全覆盖向纵深发展,2022-10-28,2022-10
二〇二二年国家海上搜救综合演练在珠江口水域举办,2022-10-28,2022-10
全国破获文物犯罪案件4200余起,2022-10-28,2022-10
党建引领“齐步走”,2022-10-28,2022-10
创新警务实践 展现担当作为,2022-10-28,2022-10
为发展具有中国特色、世界水平的现代教育作贡献（深入学习贯彻习近平新时代中国特色社会主义思想）,2022-10-28,2022-10
形成同心共圆中国梦的强大合力,2022-10-28,2022-10
加快推进涉外法治建设（专题深思）,2022-10-28,2022-10
