毛主席语录,1969-09-01,1969-09
用毛泽东思想统帅革命大批判,1969-09-01,1969-09
马鞍山钢铁公司医院有的放矢地开展革命大批判批得越深改得越好医务人员清除大叛徒刘少奇反革命修正主义医疗卫生路线的余毒，提高了两条路线斗争觉悟，明确了斗批改的政治方向,1969-09-01,1969-09
希尔同志离京回国康生等同志到机场欢送,1969-09-01,1969-09
革命要继续批判要深入上海横沙岛军民深入开展革命大批判,1969-09-01,1969-09
谁是历史的创造者？——评大毒草《兵临城下》,1969-09-01,1969-09
当继续革命的带头人,1969-09-01,1969-09
大庆油田采油第二指挥部革委会在解放军支左人员的帮助下加强革命纪律性巩固革委会一元化领导,1969-09-01,1969-09
牢记毛主席关于“革命委员会好”的伟大教导热情支持革委会自觉维护革委会的革命权威湖南湘潭混凝土制品厂广大革命工人积极帮助革委会用毛泽东思想掌好权，全厂上下团结一条心，进一步巩固了无产阶级专政,1969-09-01,1969-09
对美蒋反动派的黑暗统治深感不满弃暗投明原蒋匪帮陆军中尉周振德返回祖国大陆,1969-09-01,1969-09
用一不怕苦，二不怕死的革命精神建设连队,1969-09-01,1969-09
简讯,1969-09-01,1969-09
扬州市琼花居委会发动革命家长和广大群众积极配合贫下中农做好下乡知识青年工作,1969-09-01,1969-09
在大风大浪中锻炼成长——记立志在远洋渔船上为革命打鱼的女知识青年贾迎光,1969-09-01,1969-09
重新学习  继续革命,1969-09-01,1969-09
抗议苏修社会帝国主义对我国的武装挑衅印度学生在苏修领事馆前示威加尔各答群众集会通过决议号召印度革命人民站在中国一边,1969-09-01,1969-09
要求加强斗争以实际行动回击挑衅阿拉伯人民反对美以侵略者怒潮汹涌巴基斯坦各地人民举行示威声讨犹太复国主义的暴行,1969-09-01,1969-09
血淋淋的‘友谊’,1969-09-01,1969-09
美帝疯狂掠夺亚非拉天然财富通过大规模资本输出攫取这些地区的矿产和原料资源,1969-09-01,1969-09
苏修社会帝国主义加紧向东南亚扩张出钱出枪支持印尼、缅甸、“马来西亚”等反动派镇压人民革命斗争利用“援助”、“贸易”和“文化交流”等手段大搞经济和文化侵略,1969-09-01,1969-09
美日军火垄断资本加紧勾结适应美日反动派扩军备战需要合伙生产飞机和火箭,1969-09-01,1969-09
北京城区天气预报,1969-09-01,1969-09
毛主席语录,1969-09-02,1969-09
毛主席林副主席周总理致电越南党政领导人热烈祝贺越南民主共和国独立二十四周年,1969-09-02,1969-09
抚顺市革委会遵照毛主席“团结起来，争取更大的胜利”的伟大教导领导成员带头斗私批修克服资产阶级派性进一步巩固发展了革命的大联合和三结合,1969-09-02,1969-09
干部插队劳动好关于如何办好“五·七”干校的讨论三——干部下放参加集体生产劳动问题,1969-09-02,1969-09
插队劳动的大方向完全正确关于如何办好“五·七”干校的讨论三——干部下放参加集体生产劳动问题,1969-09-02,1969-09
下放大队劳动有利于锻炼关于如何办好“五·七”干校的讨论三——干部下放参加集体生产劳动问题,1969-09-02,1969-09
培养新型干部的好学校关于如何办好“五·七”干校的讨论三——干部下放参加集体生产劳动问题,1969-09-02,1969-09
要批判‘阶级斗争熄灭论’,1969-09-02,1969-09
干革命的学校,1969-09-02,1969-09
高一等和低一等,1969-09-02,1969-09
我们尝到了甜头,1969-09-02,1969-09
应当办“五·七”干校,1969-09-02,1969-09
任务方针问题解决了,1969-09-02,1969-09
福州市革委会用毛主席关于继续革命的理论武装群众组成一支浩浩荡荡的革命大批判大军全市各单位紧密结合当前任务，狠批刘少奇反革命修正主义路线，推动斗批改深入发展,1969-09-02,1969-09
赞比亚政府友好代表团举行告别宴会李先念副总理和有关部门负责人应邀出席维纳团长和李先念副总理在洋溢着中赞两国人民友好气氛的宴会上先后讲了话,1969-09-02,1969-09
昆明机床厂革委会带领群众深入持久地开展革命大批判狠批刘少奇修正主义办企业路线,1969-09-02,1969-09
周恩来总理接见赞比亚政府友好代表团周总理同西科塔·维纳团长等赞比亚朋友进行了亲切友好的谈话,1969-09-02,1969-09
面向农业工农结合——山西省翼城县建立农机三级修理制造网的调查报告,1969-09-02,1969-09
自力更生发展县社工业肇东县为农业生产服务的工业体系基本形成,1969-09-02,1969-09
一个深受贫下中农欢迎的农具厂,1969-09-02,1969-09
让捷克斯洛伐克人民反对苏修的斗争风暴来得更猛烈吧！,1969-09-02,1969-09
阿《团结报》强烈谴责苏修加紧同帝国主义和反动派勾结苏修联帝反华必将加速自己的灭亡,1969-09-02,1969-09
索马里海岸朋友谴责苏修对中国的武装挑衅中国人民将击败任何敌人,1969-09-02,1969-09
扩张侵略势力建立海上霸权镇压阿拉伯民族解放运动苏修在地中海疯狂推行‘炮舰政策’派出六十多艘军舰耀武扬威，不断进行‘演习’，到处寻找基地,1969-09-02,1969-09
积极开展社会主义竞赛迎接祖国解放二十五周年阿工人胜利完成前八个月生产计划重视政治思想工作发挥人的积极因素劳动生产率大大提高,1969-09-02,1969-09
挪中友好协会举行电影晚会放映我党‘九大’纪录片受到热烈欢迎,1969-09-02,1969-09
庆祝越南民主共和国宣布独立二十四周年我对外友协和中越友协举行酒会,1969-09-02,1969-09
抗议美英和本国垄断资本的残酷剥削拉丁美洲各国工人纷纷展开斗争秘鲁哥斯达黎加工人罢工乌拉圭工人反击警察镇压,1969-09-02,1969-09
