报眼华主席语录,1977-09-01,1977-09
华国锋主席同铁托总统会谈,1977-09-01,1977-09
铁托总统瞻仰毛主席遗容,1977-09-01,1977-09
铁托总统应邀出席文艺晚会,1977-09-01,1977-09
《毛泽东选集》第五卷英文版出版发行,1977-09-01,1977-09
高举毛主席旗帜加快社会主义建设步伐,1977-09-01,1977-09
力争晚稻超早稻夺取全年大丰收,1977-09-01,1977-09
二十万矿工投入夺煤大战,1977-09-01,1977-09
为创建大庆式城市作新贡献,1977-09-01,1977-09
夺取揭批“四人帮”斗争的新胜利,1977-09-01,1977-09
列宁对“无产阶级文化派”的批判,1977-09-01,1977-09
学习《毛泽东选集》第五卷参考资料１８,1977-09-01,1977-09
谭震林副委员长会见日中友好长崎县青年之船访华团部分朋友,1977-09-01,1977-09
国防部举行宴会欢迎苏丹军事代表团,1977-09-01,1977-09
庆祝马来西亚国庆,1977-09-01,1977-09
我驻丹麦王国大使离京赴任,1977-09-01,1977-09
朱穆之社长宴请美联社董事会代表团,1977-09-01,1977-09
中蒙国境铁路联合委员会例会在呼和浩特市举行,1977-09-01,1977-09
庆祝土耳其建军节,1977-09-01,1977-09
交流科研成果制定发展规划,1977-09-01,1977-09
决心把小黑麦的生产科研推向更高水平,1977-09-01,1977-09
外事往来,1977-09-01,1977-09
毛泽东思想继续照耀中国人民胜利前进,1977-09-01,1977-09
毛主席三个世界理论必将显示出越来越强大威力,1977-09-01,1977-09
中国共产党必将为世界革命作出巨大贡献,1977-09-01,1977-09
欢庆十一大拥护华主席,1977-09-01,1977-09
粉碎“四人帮”是马列主义的胜利,1977-09-01,1977-09
我中央乐团在咸兴、江原道和开城访问演出,1977-09-01,1977-09
我大学生体育代表团瞻仰季米特洛夫陵墓,1977-09-01,1977-09
我生物学考察组结束对越南访问,1977-09-01,1977-09
决心使红海成为和平区摆脱帝国主义争夺,1977-09-01,1977-09
揭露苏美加紧在中东的争夺,1977-09-01,1977-09
必须恢复巴勒斯坦人民的民族权利,1977-09-01,1977-09
摔下“马”来,1977-09-01,1977-09
心劳日拙,1977-09-01,1977-09
吉布提总统访问伊拉克,1977-09-01,1977-09
中南友谊的一曲赞歌,1977-09-01,1977-09
埃及呼吁阿拉伯国家制订共同战略对付以色列,1977-09-01,1977-09
美国军事代表团访问苏丹,1977-09-01,1977-09
北京地区天气预报,1977-09-01,1977-09
报眼华主席语录,1977-09-02,1977-09
