邓小平副总理在华盛顿重申中国希望和平解决台湾问题,1979-02-01,1979-02
坚持党委的集体领导原则,1979-02-01,1979-02
阐述中国对世界形势、中美关系和台湾问题的立场和政策,1979-02-01,1979-02
研究成功钛铁分离新技术,1979-02-01,1979-02
我国农村新建六千多座小水电站,1979-02-01,1979-02
北京市一批新建工业项目投产,1979-02-01,1979-02
要用极大的努力把农业尽快搞上去,1979-02-01,1979-02
决定按专业化分工原则改革管理体制,1979-02-01,1979-02
三机部、六机部改进作风停止召开全系统学大庆会议,1979-02-01,1979-02
隔海遥望思亲人,1979-02-01,1979-02
帮助居民调回在国外和港澳资产,1979-02-01,1979-02
一个围歼知识分子的大阴谋,1979-02-01,1979-02
驳“言者有罪”论,1979-02-01,1979-02
邓副总理与美国参议员共进午餐并出席众议院国际关系委员会茶话会,1979-02-01,1979-02
邓副总理出席美国友好团体和华侨的招待会,1979-02-01,1979-02
在友好的气氛中邓副总理同美国内阁官员共进早餐,1979-02-01,1979-02
邓副总理会见美国前总统尼克松,1979-02-01,1979-02
邓副总理向林肯纪念堂献花圈并参观全国宇航博物馆,1979-02-01,1979-02
美国国旗的由来,1979-02-01,1979-02
卡特总统夫人为邓副总理夫人举行招待会,1979-02-01,1979-02
玫瑰园里春意浓,1979-02-01,1979-02
北京地区天气预报,1979-02-01,1979-02
建议改变陕北的土地经营方针,1979-02-01,1979-02
建议扩大北方绿肥种植面积,1979-02-01,1979-02
读者对黄土高原建设方针问题的反应,1979-02-01,1979-02
沙生植物园,1979-02-01,1979-02
开辟蛋白质饲料来源,1979-02-01,1979-02
在今天的舞台上,1979-02-01,1979-02
联合新闻公报,1979-02-02,1979-02
邓副总理举行盛大答谢招待会结束对华盛顿访问赴亚特兰大,1979-02-02,1979-02
邓副总理和卡特总统签署中美科技合作协定和文化协定并发表讲话,1979-02-02,1979-02
各国联合起来对付苏联霸权主义,1979-02-02,1979-02
两天会谈结果令人满意,1979-02-02,1979-02
邓副总理会见西哈努克亲王,1979-02-02,1979-02
把城市郊区建成副食品生产基地,1979-02-02,1979-02
力争水利设施当年发挥效益湖北各地狠抓续建配套工程,1979-02-02,1979-02
广东一些地区允许社员私人养牛,1979-02-02,1979-02
南京集体所有制商业有新发展,1979-02-02,1979-02
化工部轮训小氮肥厂厂长,1979-02-02,1979-02
夜战的灯火不见了,1979-02-02,1979-02
实行联合办公加快审批建设项目,1979-02-02,1979-02
战士终竟是战士,1979-02-02,1979-02
走出会议室，跳出文件堆,1979-02-02,1979-02
广东省民主生活逐步活跃,1979-02-02,1979-02
愿逐东风快着鞭,1979-02-02,1979-02
充分行使自治权选举当家人,1979-02-02,1979-02
为加快四个现代化建设很多专家、学者积极献计献策,1979-02-02,1979-02
《大众电影》等三刊物将复刊,1979-02-02,1979-02
《剧本》月刊复刊《人民戏剧》改版,1979-02-02,1979-02
“南宋官窑”名瓷仿制成功,1979-02-02,1979-02
台湾的农林和海产,1979-02-02,1979-02
乾县生产“唐三彩”复制品,1979-02-02,1979-02
历史性会谈的巨大成果,1979-02-02,1979-02
邓小平副总理到达亚特兰大访问,1979-02-02,1979-02
