目前经济形势很好为建国来少见,1981-03-01,1981-03
中央的方针政策重大措施都要坚决执行,1981-03-01,1981-03
北京开展“为人民服务，对人民负责”讨论,1981-03-01,1981-03
经常骑车下基层调查和处理问题,1981-03-01,1981-03
赵紫阳电贺西班牙新首相,1981-03-01,1981-03
山西省领导干部对照检查财政纪律,1981-03-01,1981-03
罢免曹轶欧五届人大代表资格,1981-03-01,1981-03
迅速发展的北京市机械化养鸡事业,1981-03-01,1981-03
今日谈,1981-03-01,1981-03
今年争取基本实现财政收支平衡,1981-03-01,1981-03
实现政治上进一步安定确保经济调整顺利进行,1981-03-01,1981-03
要继续进行有利于调整的经济体制改革,1981-03-01,1981-03
国家体委举行授奖大会表彰先进,1981-03-01,1981-03
河南省领导干部教育子女实行计划生育,1981-03-01,1981-03
以雷锋为榜样,1981-03-01,1981-03
围绕建设新农村开展新长征突击手活动,1981-03-01,1981-03
李景膺同志在京病逝,1981-03-01,1981-03
简明新闻,1981-03-01,1981-03
由“私访”想到的,1981-03-01,1981-03
为何有些地方硬分币紧缺,1981-03-01,1981-03
希望做几件扎实的事情,1981-03-01,1981-03
这样的办事效率值得提倡,1981-03-01,1981-03
一个节约的代表团,1981-03-01,1981-03
郑化民管车百辆  儿子结婚不动一台,1981-03-01,1981-03
