哈尔滨文化事业一派新气象,1988-06-01,1988-06
难忘的第一次,1988-06-01,1988-06
经济体制改革应以承包制为中心,1988-06-01,1988-06
党员马占林投资百余万致力兴办扶贫福利企业,1988-06-01,1988-06
连城县建立教育目标责任制,1988-06-01,1988-06
国务院颁布防止拆船污染管理条例,1988-06-01,1988-06
北京一批公寓以外汇销售,1988-06-01,1988-06
费彝民先生骨灰安放仪式在京举行,1988-06-01,1988-06
要爱护和支持职工物价监督队伍,1988-06-01,1988-06
我地下施工技术获重大进展钻孔压浆成桩法被广泛运用,1988-06-01,1988-06
“三北”防护林体系二期工程今春造林完成年度计划８０％,1988-06-01,1988-06
圣佛煤矿发生瓦斯爆炸事故,1988-06-01,1988-06
马思忠任宁夏人大常委会主任,1988-06-01,1988-06
不要让儿童只过“六一”,1988-06-01,1988-06
便河路滴血记,1988-06-01,1988-06
北京地区天气预报,1988-06-01,1988-06
遵义跨出行政界约按经济流向搞联合,1988-06-01,1988-06
黑龙江全面推行家庭农场双层经营体制框架已建立,1988-06-01,1988-06
提倡搞点“向内学习”,1988-06-01,1988-06
王震考察京郊两家合资企业,1988-06-01,1988-06
市长宣布开城门吸收四海资金,1988-06-01,1988-06
三大轿车基地引入新型投资体制走以企业为投资主体的建设新路,1988-06-01,1988-06
新疆航空公司异军突起,1988-06-01,1988-06
我国又有５４城市设国库券转让市场,1988-06-01,1988-06
茶香那儿去了,1988-06-01,1988-06
简讯,1988-06-01,1988-06
湖南一架运输机坠毁,1988-06-01,1988-06
《企业法》条文解说,1988-06-01,1988-06
闹得黄海新潮起,1988-06-01,1988-06
树立正确的人才观,1988-06-01,1988-06
儿童节三愿,1988-06-01,1988-06
李先念邓颖超题词贺儿童节,1988-06-01,1988-06
近五年我国少儿人口比例下降,1988-06-01,1988-06
８位先进工作者３２个先进集体获全国“热爱儿童”荣誉奖章,1988-06-01,1988-06
别让孩子们失望,1988-06-01,1988-06
广东选派科技骨干到山区任领导职务,1988-06-01,1988-06
内蒙古一处古动物化石宝库遭劫,1988-06-01,1988-06
全国儿童医药产品在京展销,1988-06-01,1988-06
首都讨论残疾作家刘琦作品,1988-06-01,1988-06
即墨县试行卫生经济责任制,1988-06-01,1988-06
首都群众喜迎登山勇士凯旋,1988-06-01,1988-06
中国羽毛球队胜在经验和战术,1988-06-01,1988-06
中国女篮飞抵狮城,1988-06-01,1988-06
马来西亚队３∶２淘汰印尼队,1988-06-01,1988-06
韩爱平谈苦战过关,1988-06-01,1988-06
向娄琢玉教授颁奖,1988-06-01,1988-06
体坛拾零,1988-06-01,1988-06
长治市委坚持从严治党查处二百五十余违纪案,1988-06-01,1988-06
解放军某部苑本民为驻地小学生传授书法知识,1988-06-01,1988-06
贵州已有十四万人脱贫,1988-06-01,1988-06
回到普通连队位置上,1988-06-01,1988-06
