在京老同志品茶迎新春,1997-02-01,1997-02
香港特别行政区筹委会八次全会举行,1997-02-01,1997-02
国务院召开第５４次常务会议,1997-02-01,1997-02
北京采取多种形式扶贫济困,1997-02-01,1997-02
『大众』的答卷（“窗口行业”示范单位优质服务追踪报道）,1997-02-01,1997-02
第1108个“无投诉日”（“窗口行业”示范单位优质服务追踪报道）,1997-02-01,1997-02
追踪一三○一航班（“窗口行业”示范单位优质服务追踪报道）,1997-02-01,1997-02
首都举行军民迎春文艺晚会,1997-02-01,1997-02
国务院举行第五次反腐败会议,1997-02-01,1997-02
北京地区天气预报,1997-02-01,1997-02
在京老同志品茶迎新春,1997-02-01,1997-02
国务院举行第五次反腐败会议,1997-02-01,1997-02
部署今年社会治安综合治理工作,1997-02-01,1997-02
钱其琛在香港特别行政区  筹委会第八次全体会议上讲话,1997-02-01,1997-02
无锡重视丰富市民的生活,1997-02-01,1997-02
扶贫要力戒形式主义,1997-02-01,1997-02
李瑞环参观陈逸飞画展,1997-02-01,1997-02
搞好职业道德建设禁止有偿新闻  需要社会各界积极参与加强监督,1997-02-01,1997-02
宗教界人士迎春茶话会举行,1997-02-01,1997-02
统战部、国办举行迎春招待会,1997-02-01,1997-02
中央人民广播电台春节节目异彩纷呈,1997-02-01,1997-02
首都高校学生座谈  电视文献片《邓小平》,1997-02-01,1997-02
世界经济论坛年会开幕,1997-02-01,1997-02
李洁明的悲哀,1997-02-01,1997-02
纳米技术  异军突起（科技探索）,1997-02-01,1997-02
美国花钱买“民主”  古巴拒绝美“援助”,1997-02-01,1997-02
欧盟发起反种族主义活动,1997-02-01,1997-02
