在庆祝中国人民解放军建军七十周年大会上的讲话,1997-08-01,1997-08
热烈庆祝中国人民解放军建军七十周年,1997-08-01,1997-08
北京地区天气预报,1997-08-01,1997-08
隆重庆祝中国人民解放军建军七十周年,1997-08-01,1997-08
在庆祝中国人民解放军建军七十周年大会上的讲话,1997-08-01,1997-08
热烈庆祝中国人民解放军建军七十周年,1997-08-01,1997-08
为什么要保持适度增长？,1997-08-01,1997-08
夏粮定购任务已完成  议购粮收购进度加快,1997-08-01,1997-08
遵义饮水工程全面启动,1997-08-01,1997-08
物资系统增亏势头得到遏制,1997-08-01,1997-08
走有中国特色的精兵之路（社论）,1997-08-01,1997-08
河南双拥再上新台阶,1997-08-01,1997-08
三军医大为部队现代化服务,1997-08-01,1997-08
无棣重视拥军优属工作,1997-08-01,1997-08
承德民兵预备役为稳定作贡献,1997-08-01,1997-08
烈火铸就的青春（庆祝中国人民解放军建军70周年）,1997-08-01,1997-08
某集团军积极支援地方建设,1997-08-01,1997-08
扬子江药业拥军坚持不辍,1997-08-01,1997-08
官兵与牧民,1997-08-01,1997-08
武警某部与驻地回族群众亲如鱼水,1997-08-01,1997-08
河北省武安市成立正规化村级党校（短波）,1997-08-01,1997-08
吉安地区公安局强化从严治警（短波）,1997-08-01,1997-08
洛阳老城区法院推行立体化管理（短波）,1997-08-01,1997-08
淄博市消防支队争创一流业绩（短波）,1997-08-01,1997-08
