李瑞环回到北京,1998-06-01,1998-06
本月起开展税收漏征漏管户清查工作,1998-06-01,1998-06
中国人民银行公告,1998-06-01,1998-06
中国人民银行关于发行中国珍稀野生动物,1998-06-01,1998-06
两院院士大会今天举行,1998-06-01,1998-06
北京近五十万人实现再就业,1998-06-01,1998-06
吉林省力促国企下岗职工再就业,1998-06-01,1998-06
自办公司的下岗女工－－－庄丽,1998-06-01,1998-06
迎接新世纪  学做新主人,1998-06-01,1998-06
我国克隆ＡＢＯ血型试剂研究成果显著,1998-06-01,1998-06
北京地区天气预报,1998-06-01,1998-06
第一位的工作,1998-06-01,1998-06
全国房地产业进入景气空间,1998-06-01,1998-06
用小行动保护大地球,1998-06-01,1998-06
中行择优扶持中小企业,1998-06-01,1998-06
麦客持卡走天下,1998-06-01,1998-06
海峡两岸大公司合作,1998-06-01,1998-06
民间资金托起乡韩黄河大桥,1998-06-01,1998-06
多一份力量（编后）,1998-06-01,1998-06
地铁复八线建,1998-06-01,1998-06
网上缉私女杰,1998-06-01,1998-06
贵州企业与农科院进行技术合作,1998-06-01,1998-06
首都机场扩建工程进展顺利,1998-06-01,1998-06
飞利浦消费通讯捐款希望工程,1998-06-01,1998-06
中英建筑工程学士学位专业评估互认,1998-06-01,1998-06
大倾角波形挡边输送带研制成功,1998-06-01,1998-06
农村经济绿皮书出版,1998-06-01,1998-06
金亚亚麻面料服装在燕莎展销,1998-06-01,1998-06
朔黄铁路恢河双线特大桥兴建,1998-06-01,1998-06
锦绣华侨城,1998-06-01,1998-06
无限忠诚  精神永存,1998-06-01,1998-06
北京市第二聋哑学校举办首期“声之望聋儿家长联谊会”,1998-06-01,1998-06
武警广西总队医院外二科情满壮乡,1998-06-01,1998-06
西安七千民警进考场,1998-06-01,1998-06
首批少数民族挂职团干全部到岗,1998-06-01,1998-06
伊犁多渠道培养年轻干部,1998-06-01,1998-06
中日光彩环保项目合作签字仪式在京举行,1998-06-01,1998-06
海滩上的婚礼（社会扫描）,1998-06-01,1998-06
赵峰获『为民献身优秀青年』称号,1998-06-01,1998-06
空军第二工程总队鏖战赣江大堤,1998-06-01,1998-06
济宁开通市长公开电话,1998-06-01,1998-06
广东公安边防七支队发扬『南泥湾精神』,1998-06-01,1998-06
武警交通厦门指挥所创优良业绩,1998-06-01,1998-06
九国儿童欢聚北京芳草地小学,1998-06-01,1998-06
镇平检察院重视队伍建设,1998-06-01,1998-06
辽宁一批边检站受表彰,1998-06-01,1998-06
“我们的好兄弟”,1998-06-01,1998-06
高体乾同志逝世,1998-06-01,1998-06
一次会议发布新闻公报,1998-06-01,1998-06
北京市丰台发生３．４级地震,1998-06-01,1998-06
联合国亚太经社会老龄问题地区会议闭幕,1998-06-01,1998-06
积极安置国企下岗职工为国分忧,1998-06-01,1998-06
全国报纸理论宣传研究会举行年会,1998-06-01,1998-06
福建省举办少儿欢乐节,1998-06-01,1998-06
