江泽民主席回到北京,1999-04-01,1999-04
李鹏会见希腊总理,1999-04-01,1999-04
李鹏拜会希腊总统,1999-04-01,1999-04
西方拒绝俄罗斯和平倡议北约将扩大对南空袭规模,1999-04-01,1999-04
增进了解促进合作推动建立国际新秩序（社论）,1999-04-01,1999-04
朱镕基会见美国国会议员,1999-04-01,1999-04
首钢向污染宣战舍得投入,1999-04-01,1999-04
责无旁贷（编后）,1999-04-01,1999-04
本社公告,1999-04-01,1999-04
北京地区天气预报,1999-04-01,1999-04
九九房改，稳步推进货币化分配（经济视点）,1999-04-01,1999-04
香港发现禽流感病毒但对人无害,1999-04-01,1999-04
取消外资银行营业性分支机构地域限制,1999-04-01,1999-04
把住“病从口入”这一关（百城万店无假货）,1999-04-01,1999-04
农行增加贷款支持春耕生产,1999-04-01,1999-04
交通部开展质量年宣传月活动,1999-04-01,1999-04
“中国专利代理”成立十五周年,1999-04-01,1999-04
壳牌集团继续扩大在华投资,1999-04-01,1999-04
凯博装饰面料注重品种开发,1999-04-01,1999-04
NS推出“信息电器”产品,1999-04-01,1999-04
“飞狐”可视网络引擎开通,1999-04-01,1999-04
华源天地立体车库制造公司成立,1999-04-01,1999-04
多用型植物生长剂研制成功,1999-04-01,1999-04
旅游业成为贵州新支柱产业,1999-04-01,1999-04
