教育提速惠民生,2008-09-01,2008-09
华国锋同志遗体在京火化,2008-09-01,2008-09
江苏标本兼治实现太湖安全度夏,2008-09-01,2008-09
湖北全力应对暴雨洪灾,2008-09-01,2008-09
努力实现城市管理数字化,2008-09-01,2008-09
“5·12”地震灾区中小学全面复课,2008-09-01,2008-09
辽宁首条城际轻轨开工建设,2008-09-01,2008-09
活力四射东北亚,2008-09-01,2008-09
救援人员急赴攀枝花—会理震区,2008-09-01,2008-09
平等是前提尊重是基础（你我微笑·共享和谐）,2008-09-01,2008-09
最高法院出台诉讼时效制度司法解释,2008-09-01,2008-09
茂名建设全国第三个2000万吨炼油项目,2008-09-01,2008-09
《中国新闻年鉴》2008年卷出版,2008-09-01,2008-09
全国人大代表团离京出访瑞士丹麦俄罗斯,2008-09-01,2008-09
内地奥运金牌运动员结束访港赴澳门访问,2008-09-01,2008-09
中国绿色能源汽车发展高峰论坛举行,2008-09-01,2008-09
百名全国青联委员开展四川灾区行活动,2008-09-01,2008-09
深入学习实践科学发展观进一步推动军队党的建设和部队全面建设,2008-09-01,2008-09
泰国国会紧急开会机场重新开放,2008-09-01,2008-09
高度赞扬北京奥运会组织工作,2008-09-01,2008-09
美国新奥尔良市因飓风逼近紧急撤离市民,2008-09-01,2008-09
美国佩林助选的双重效应,2008-09-01,2008-09
两名中国工程师在巴基斯坦失踪,2008-09-01,2008-09
美印核协议闯关难（国际论坛）,2008-09-01,2008-09
中国承建改造的安哥拉马罗铁路试运营通车,2008-09-01,2008-09
意大利与利比亚签订友好条约,2008-09-01,2008-09
墨西哥声讨犯罪祈求平安,2008-09-01,2008-09
教育提速惠民生,2008-09-01,2008-09
华国锋同志生平,2008-09-01,2008-09
青岛残奥分村欢迎首批入村代表队,2008-09-01,2008-09
俄残奥代表团为参赛选手壮行,2008-09-01,2008-09
山水洲城传递真情,2008-09-01,2008-09
亲身体验携手同行,2008-09-01,2008-09
巴基斯坦残奥委欢送运动员出征,2008-09-01,2008-09
身残志坚的致富带头人,2008-09-01,2008-09
青岛残奥帆赛报名完毕,2008-09-01,2008-09
百湖之城洋溢关爱（残奥圣火传递）,2008-09-01,2008-09
隐形材料应用广,2008-09-01,2008-09
英财政大臣称英经济面临６０年来最糟状况,2008-09-01,2008-09
欧元区８月份通胀率有所下降,2008-09-01,2008-09
中国巾帼故事感动维也纳观众,2008-09-01,2008-09
科技新知,2008-09-01,2008-09
印度双管齐下遏制通胀,2008-09-01,2008-09
“加勒比石油计划”筹备建设天然气输送管道,2008-09-01,2008-09
越南经济宏观调控初显成效,2008-09-01,2008-09
世卫组织说社会不公平影响健康,2008-09-01,2008-09
