携手促进世界和平与共同发展,2013-01-01,2013-01
研究部署党风廉政建设和反腐败工作,2013-01-01,2013-01
中俄两国元首互致新年贺电,2013-01-01,2013-01
全面贯彻落实党的十八大精神  要突出抓好六个方面工作,2013-01-01,2013-01
让我们一起成就梦想（社论）,2013-01-01,2013-01
新年致读者,2013-01-01,2013-01
大庆油田稳产十年,2013-01-01,2013-01
本报假日生活版亮相,2013-01-01,2013-01
“文化低保”乐农家（三下乡惠民生）,2013-01-01,2013-01
一早来赶“文化集”（三下乡惠民生）,2013-01-01,2013-01
文化国企首亮“家底”,2013-01-01,2013-01
规范文化央企资产评估,2013-01-01,2013-01
行贿超万元应究刑责（政策速递）,2013-01-01,2013-01
电话订票全国通取,2013-01-01,2013-01
冬小麦苗情好于往年,2013-01-01,2013-01
网络立法 是约束更是保护,2013-01-01,2013-01
利于信息安全流动,2013-01-01,2013-01
首起恢复上市获准,2013-01-01,2013-01
北京上调六项社保标准,2013-01-01,2013-01
平安稳定是新年最大心愿,2013-01-01,2013-01
中国经济向好有利股市回升,2013-01-01,2013-01
回良玉会见津巴布韦总统,2013-01-01,2013-01
中国就《越南海洋法》表示关切,2013-01-01,2013-01
被日方抓扣中国渔船船员获释,2013-01-01,2013-01
胡主席特使将出席加纳总统就职典礼,2013-01-01,2013-01
日本进入增税时代,2013-01-01,2013-01
中国公共外交协会在京成立,2013-01-01,2013-01
美国延长外国情报监听法案,2013-01-01,2013-01
美“财政悬崖”谈判仍搁浅,2013-01-01,2013-01
法国网络安全战略正兴起（各国依法监管互联网面面观）,2013-01-01,2013-01
伊拉克系列袭击至少13人死亡,2013-01-01,2013-01
“只要有信心，黄土变成金”,2013-01-01,2013-01
百姓萦怀 万事不难（人民论坛）,2013-01-01,2013-01
北京倒计时迎新年,2013-01-01,2013-01
南吕梁隧道爆炸事故严重瞒报,2013-01-01,2013-01
山东简化地方接待工作(下大决心改进作风),2013-01-01,2013-01
江西多场会议简朴开(下大决心改进作风),2013-01-01,2013-01
兰州政府两节不办灯展(下大决心改进作风),2013-01-01,2013-01
广西   钦崇高速通车仪式10分钟(下大决心改进作风),2013-01-01,2013-01
中国海监编队继续在我钓鱼岛领海内巡航,2013-01-01,2013-01
西藏“三大节日”补助到位,2013-01-01,2013-01
中非局势 反政府武装拒绝总统和谈提议,2013-01-01,2013-01
叙利亚人民期盼政治和解（国际视点）,2013-01-01,2013-01
