战斗在雀儿山上的道班工人,1955-01-28,1955-01,社会
浙江前线我军击落击伤蒋贼飞机各一架,1955-02-21,1955-02,社会
上海、沈阳等市场上新币迅速代替了旧币,1955-03-07,1955-03,社会
北京奖励优良卫生工作人员,1955-03-09,1955-03,社会
上海私营工厂制拖拉机零件,1955-03-10,1955-03,社会
藏族妇女积极建设康藏高原,1955-03-10,1955-03,社会
内蒙古草原建成一座面粉厂,1955-03-22,1955-03,社会
松板乡农民利用核桃枯喂猪,1955-04-05,1955-04,社会
法方在海防用武力劫运居民,1955-05-11,1955-05,社会
我国第一个滑翔学校开学,1955-06-18,1955-06,社会
四川近三千名革命残废军人将往农村担任农业社会计,1955-08-02,1955-08,社会
农村工作队必须依靠党的支部进行工作,1955-08-24,1955-08,社会
不容许欠了公款拖延不还的行为,1955-09-11,1955-09,社会
山东制丝厂领导人员不关心工人疾苦,1955-10-10,1955-10,社会
广西兴建一所新型眼科研究室,1955-10-11,1955-10,社会
青年积极分子回到各地后广泛作传达报告鼓舞了广大青年建设社会主义的热情,1955-10-16,1955-10,社会
吐鲁番葡萄干大量上市,1955-10-26,1955-10,社会
长江大桥五号桥墩围囹首次下沉完毕,1955-11-03,1955-11,社会
衡南等县少数农民秋收后不注意节约粮食,1955-11-06,1955-11,社会
拖拉机厂职工准备冬季施工,1955-11-18,1955-11,社会
