不罚肇事本地车 独罚无辜外地车,2007-01-10,2007-01,社会
走近农民工：城里生活又一年,2007-01-21,2007-01,社会
沪昆高速江西段发生２２起追尾交通事故,2007-02-12,2007-02,社会
秦皇岛奥运礼品成贺岁新时尚,2007-02-13,2007-02,社会
上餐馆吃年夜饭  饮食安全莫怠慢,2007-02-13,2007-02,社会
游人乱攀景观破坏西湖美景（耳闻目睹）,2007-02-27,2007-02,社会
主要责任人一审被判１６年（连续报道）,2007-02-27,2007-02,社会
广州死刑犯临刑前  可与亲属见面,2007-03-21,2007-03,社会
陌路遇险临危施救（瞬间）,2007-04-05,2007-04,社会
海内外华人公祭轩辕黄帝（祭奠先祖缅怀英烈）,2007-04-06,2007-04,社会
济南铁路局列车提速餐价不涨,2007-04-20,2007-04,社会
云南彝乡抗旱保苗夺丰收,2007-04-25,2007-04,社会
湖南武冈党员干部为农民“三最”破题,2007-05-15,2007-05,社会
广州残疾人有望免费坐公交车,2007-05-20,2007-05,社会
獭鼠成灾危害草场（耳闻目睹）,2007-05-29,2007-05,社会
长沙出台城市桥梁安全管理条例,2007-06-25,2007-06,社会
