北京野鸭湖冰雪马拉松落幕,2017-01-08,2017-01,社会
西藏专项行动保护藏羚羊,2017-01-16,2017-01,社会
抽查元宵汤圆确保食品安全,2017-02-10,2017-02,社会
安徽聘万余贫困人口当护林员,2017-02-13,2017-02,社会
张献忠江口沉银传说被证实,2017-03-21,2017-03,社会
司机一口痰  老人满头脏（百姓关注·汽车社会中的问题②）,2017-03-28,2017-03,社会
吉林警方打掉20个地下钱庄,2017-04-13,2017-04,社会
组建交警铁骑 加强街面查控,2017-04-18,2017-04,社会
新疆兵团首个国家5A级景区揭牌,2017-04-26,2017-04,社会
宁夏涌现新就业形态（链接）,2017-04-27,2017-04,社会
交通管理应迈向精细化（金台锐评）,2017-05-03,2017-05,社会
13岁小将获女子十米台冠军,2017-05-15,2017-05,社会
四年审结拐卖妇女儿童犯罪案件三千余件,2017-06-02,2017-06,社会
农村贫困人口患病“家底”摸清,2017-06-07,2017-06,社会
查获8.5万吨走私固体废物,2017-06-20,2017-06,社会
给涉毒学生留条归路（来论）,2017-06-29,2017-06,社会
无人机巡线6000公里输油管线,2017-06-30,2017-06,社会
违法鸣笛，当罚（民声）,2017-07-19,2017-07,社会
精准扶贫，用心用情用力（扶贫手记）,2017-11-07,2017-11,社会
坚定走出贫困锅底（采访手记）,2017-12-17,2017-12,社会
知识竞赛莫成抄写竞赛（党员论坛）,2017-12-19,2017-12,社会
过去打工热 今现“城归”潮（人民眼·乡村振兴）,2017-12-22,2017-12,社会
长江第一桥 三代养桥人（新时代·面孔）,2017-12-27,2017-12,社会
