全国收购粮食８００亿公斤,1996-01-20,1996-01,财经
打好冬季灭虫战,1996-02-05,1996-02,财经
农村形势好  农民过“肥年”,1996-02-15,1996-02,财经
深化流通体制改革  发展物资流通代理制,1996-02-26,1996-02,财经
河北取缔１５个假冒伪劣商品集散地,1996-03-01,1996-03,财经
杭州历时８年修成《西湖志》,1996-03-04,1996-03,财经
中华人民共和国国家统计局关于１９９５年国民经济和社会发展的统计公报（１９９６年３月１日）,1996-03-07,1996-03,财经
切实减轻农民负担,1996-03-13,1996-03,财经
有共识  有分歧,1996-03-15,1996-03,财经
买杂交稻种要当心,1996-03-18,1996-03,财经
新疆阿图什东北发生６．９级地震,1996-03-21,1996-03,财经
旱情不除  抗旱不止,1996-03-27,1996-03,财经
塔克拉玛干沙漠喜降春雨,1996-04-04,1996-04,财经
杭州牡丹芍药花展开幕,1996-04-08,1996-04,财经
郁金香国际花卉展将举行,1996-04-14,1996-04,财经
中央财政加大支农力度,1996-04-17,1996-04,财经
万吨玉米压库急找买主,1996-04-24,1996-04,财经
“南京１９３７画展”在神户开幕,1996-04-25,1996-04,财经
全民健身登泰山比赛９月举行,1996-05-21,1996-05,财经
从五比Ｏ到一比四,1996-05-27,1996-05,财经
肉菜蛋糖价格平抑靠什么？,1996-05-30,1996-05,财经
再现劫难与辉煌敦煌艺术进京城,1996-06-14,1996-06,财经
天山初醒（版画）雪,1996-06-20,1996-06,财经
世行本年度对华提供２９．７亿美元贷款,1996-06-27,1996-06,财经
切实加强领导  加快国有企业改革和发展（共８篇）,1996-07-08,1996-07,财经
为进一步稳定物价而努力,1996-07-12,1996-07,财经
全国供销总社布置棉检措施,1996-07-20,1996-07,财经
５月份美外贸逆差创近８年最高纪录,1996-07-22,1996-07,财经
７月２７日：地震专家与首都公众见面,1996-07-24,1996-07,财经
农业银行推出金穗万事顺卡,1996-07-26,1996-07,财经
和农民拉家常,1996-08-05,1996-08,财经
增收也须减负,1996-08-12,1996-08,财经
不找银行找同行,1996-08-16,1996-08,财经
青海唐古拉山发生５．１级地震,1996-08-24,1996-08,财经
农民负担：沉重的话题（减轻农民负担大家谈）,1996-08-26,1996-08,财经
重视组织建设,1996-08-27,1996-08,财经
世界黄金产量呈增长趋势,1996-08-28,1996-08,财经
巾帼抢险逞英雄,1996-09-10,1996-09,财经
开发银行向大中型企业贷款７５８亿元,1996-09-19,1996-09,财经
前８个月工商税收逾４０００亿元,1996-09-20,1996-09,财经
决不放松粮食生产（二）,1996-09-23,1996-09,财经
粮食要同步发达,1996-10-14,1996-10,财经
国际标准组织推出ＩＳＯ１４０００,1996-10-15,1996-10,财经
刘小光二比一领先,1996-10-23,1996-10,财经
作物秸秆：勿焚烧  快还田,1996-10-23,1996-10,财经
寿阳农民人均产粮超吨,1996-11-04,1996-11,财经
农村信用社成为农村金融基础力量,1996-11-12,1996-11,财经
北京『大豆行动计划』启动,1996-11-22,1996-11,财经
我国颁布珠宝玉石国家标准,1996-11-26,1996-11,财经
严控甲醇产销  杜绝假酒害人,1996-12-09,1996-12,财经
俞斌负于徐奉洙,1996-12-13,1996-12,财经
江阴建成最大钢绳出口基地,1996-12-30,1996-12,财经
